434878,儿子以诗酒送文伯起既而复继三诗予喜其用韵颇工为和五首 其五
434875,儿子以诗酒送文伯起既而复继三诗予喜其用韵颇工为和五首 其二
434877,儿子以诗酒送文伯起既而复继三诗予喜其用韵颇工为和五首 其四
501217,赠安南善书阮生生名太冲为予书春秋春王正月考及安南行稿予喜其楷法遒美更其字曰用和而诗以赠之
889640,臻公释氏之秀者浮游徜徉迹接天下乃者归卧云山闭门不出遂命斋名曰戏鲸真得古惠师之遗趣也予喜其志因留二十韵以赠之
434876,儿子以诗酒送文伯起既而复继三诗予喜其用韵颇工为和五首 其三
581633,陈梦祥宪副寄其所作读陈公甫行状辨示予大约为作状者之过褒设也予喜其论之正赋古选报之
501218,赠安南善书阮生生名廷玠为予书春秋春王正月考及安南行稿予喜其楷法遒美更其字曰宝善而诗以赠之
434874,儿子以诗酒送文伯起既而复继三诗予喜其用韵颇工为和五首 其一
436590,儿子以诗酒送文伯起既而复继三诗予喜其用韵颇工为和五首
585817,郁林守邝和仲乃元博宪副之犹子而吾友松溪程学士之徒也谬称予为师祖持松溪赠良守诗访天关予喜其贤而赓之云
527891,西谷有浙聘予喜其得胜游因话浙中之胜
254628,儿子以诗酒送文伯起既而复继三诗予喜其用韵颇工为和
