822303,柳梢青 偕潘慎明、陶叔南、范烟桥诸老赴南京，中途雨霁
709248,丁亥初春重游甘竹中途留宿岑六
451864,清平乐 夏夜偕诸子玉潭公园漫步中途暴雨骤至小令记之
244915,潜夫约中途遣诗相送至江山无耗寄诗督之
23309,中途寄友人
296848,中途遇雨·海外无名胜
34969,翰林游舍人清明日入院中途见过余明日
803406,王青县懿颂同年去秋惠余沧酒一瓮中途车覆书至而瓮空今来青县复以一瓮见饷口占一绝谢之
1153806,至德中途中书事却寄李僩
544535,喻邦相束装入计中途忽有迁杭之命寄怀二首 其二
697116,喻邦相束装入计中途忽有迁杭之命寄怀二首
1079664,邵伯路中途遇前纲载茉莉花甚众舟行甚急不得细观也又有小盆榴等皆精妙奇靡之观因成二绝 其二
585018,承檄往夷中途次二首 其一
580757,己卯扈驾南征中途遇菊节
296846,中途遇雨·雨露衣衫湿
328885,邵伯路中途遇前纲载茉莉花甚众舟行甚急不得细观也又有小盆榴等皆精妙奇靡之观因成二绝
842873,同石遗郁庭藜观宰平游沟沟岩中途阻雨宿白鸰墩归来庵陶斋所营也
788507,中途遇雨
180341,德广至中途再示诗次其韵
1177361,春中途中寄南巴崔使君
528998,赴储芋西少参中途过陈氏庄避雨
782587,中途阻雨
585160,过夷中途次四首 其四
908264,德广至中途再示诗次其韵
214353,与张覃秀才邺中途次言别
838738,与谢石秋、星楼、林湘畹、黄茂笙游冈山超峰寺中途遇雨 其一
693284,过夷中途次四首
585157,过夷中途次四首 其一
275591,柳梢青·偕潘慎明、陶叔南、范烟桥诸老赴南京，中途雨霁
35100,奉使九华山中途遇青阳薛郎中
1007478,由京买航还武康夜泊中途因醉晓还邑中摭实有赋
521470,张廷肃宪副致仕归中途得二郎子德捷报
1032043,与张覃秀才邺中途次言别
766277,夜半乐 夜趋剑阁，中途大雷雨侵，晨始抵宿处
568450,廿四日晓发平乐白岩追送山行数十里中途微雨有赠
703902,与李伯襄宫允同发汝南余晚至真阳迟伯襄不至邮吏云中途止宿民舍诗以讯之
920847,除夜大雪，留潍州，元日早晴，遂行，中途雪复作
296845,与谢石秋、星楼、林湘畹、黄茂笙游冈山超峰寺中途遇雨
1196075,翰林游舍人清明日入院中途见过余明日亦入西省上直因寄游君
544534,喻邦相束装入计中途忽有迁杭之命寄怀二首 其一
838741,与谢石秋、星楼、林湘畹、黄茂笙游冈山超峰寺中途遇雨 其四
585159,过夷中途次四首 其三
1024133,题黄龙中途眠松
1174294,中途寄友人
328152,中途遇雨·零雨濛濛远近同
447625,重游太湖仙岛中途独返
427923,西江月 春江许承晃伉俪絜爱子辰自济南归厦门，中途过沪，留宿蜗居者三夕。倾谈甚契，戏效东坡俳体赋此赠之
1246856,笪本可为祖母病行祷婺源中途五鹤导舞默有悬应歌以送之
408266,次日与柱尊异舟中途遇雨相失夜后始追及之
843669,与谢石秋、星楼、林湘畹、黄茂笙游冈山超峰寺中途遇雨
920391,发洪泽，中途遇大风，复还
693265,承檄往夷中途次二首
755159,家书忽至眷属以中途梗塞暂居越城次夫子韵
11576,至德中途中书事却寄李僴
585158,过夷中途次四首 其二
1092243,计偕中途寄家大人
30750,春中途中寄南巴崔使君
987616,潜夫约中途遣诗相送至江山无耗寄诗督之
585019,承檄往夷中途次二首 其二
102195,发洪泽中途遇大风复还
614815,与李伯襄宫允同发汝南余晚至真阳迟伯襄不至邮吏云中途止宿民舍诗以讯之 其二
452300,辛卯五月既寄望，何言兄招饮，盖大董烤鸭店主人欲与诗人相识，特置酒请何言兄代邀，菜肴极尽精致，且配以诗词佳句，颇有风雅之意。适逢新疆星汉、广州东遨、西安田茂来京，与伯元、力夫、新河在附近酒店雅聚，不断来电相招，只得中途移席，赋此自嘲
614814,与李伯襄宫允同发汝南余晚至真阳迟伯襄不至邮吏云中途止宿民舍诗以讯之 其一
296847,中途遇雨·到寺已三更
747559,同人冒雨寻白兆山桃花岩中途雨甚小憩山寺被酒有怀太白 其一
268717,赴港海道中·途长日暮子偕行
379170,题黄龙中途眠松
838739,与谢石秋、星楼、林湘畹、黄茂笙游冈山超峰寺中途遇雨 其二
99466,除夜大雪留潍州元日早晴遂行中途雪复作
1195966,奉使九华山中途遇青阳薛郎中
1067834,将游云居中途得佛鉴师到日涉简径归
747560,同人冒雨寻白兆山桃花岩中途雨甚小憩山寺被酒有怀太白 其二
1079663,邵伯路中途遇前纲载茉莉花甚众舟行甚急不得细观也又有小盆榴等皆精妙奇靡之观因成二绝 其一
176737,由京买航还武康夜泊中途因醉晓还邑中摭实有
882474,乙巳冬十月随幼男赴海陵丞中途遇交代有开正视事之请既抵官舍有作
731442,归至中途复有北行之役因赋
838740,与谢石秋、星楼、林湘畹、黄茂笙游冈山超峰寺中途遇雨 其三
1109958,邵伯路中途遇前纲载茉莉花甚众舟行甚急不得细观也又有小盆榴等皆精妙奇靡之观因成二绝
811631,同人冒雨寻白兆山桃花岩中途雨甚小憩山寺被酒有怀太白
