426043,韵和叶、陈两先生唱酬遣怀二绝 其二
424294,长相思·罗蕉麓杨志青两先生祖饯于温泉山馆，赋此留别
426042,韵和叶、陈两先生唱酬遣怀二绝 其一
738982,清明日同人城南看花各赋七言古诗追和苏东坡杨孟载两先生作
272309,韵和叶、陈两先生唱酬遣怀二绝
835148,满江红 外族周季况先生以旧藏新莽始建国二年镜见付，既乞俞荫甫、孙仲容两先生为释文，因系以词
765914,沁园春 喜石渚陈十村、葛野航两先生过访，作此赠别。
829744,有怀章太炎邹威丹两先生狱中
605019,黄君常从罗浮以陈抑之邓玄度两君书见贻君常且损佳什缪相昵就赋此谢之幸语两先生促膝不远也
769117,毕展叔先生招陪秦岵斋王奉斋两先生登大别山拂云楼，分韵得云字
371247,沁园春·喜石渚陈十村、葛野航两先生过访，作此赠别
629571,雁字效袁中郎小脩两先生体
804992,东胶山晤黄守中先生曾孙某出其先人守制砚并顾景范安孟公两先生画卷
429224,癸丑二月八夕与易石甫罗瘿庵两先生集奉瑁盦观奉卿所藏名迹因联句赠主人
790423,陶社落成，恭和丹翁吏部原唱，并祝颂慈、玉池两先生华诞 其二
750950,戊午六月从沈南一陈子松两先生及张倬云沈谱笙诸君观荷芦雨盦欢饮至月上始罢用少陵丈八沟诗分韵得放字客字 其二
408439,黄克强先生与李西屏先生书札 十八年七月廿八日 西屏先生属吾友陈冕雅示侃于大石桥寓中追怀民国前三年与克强遁初两先生同居新宿者旬日辛亥季秋两君自沪渎赴武昌与侃会于蕃舶遂同入鄂元年克强先生为留守时侃犹得一晤后此遂不相闻岁月飘忽两君皆亡追思昔游犹在心目抚弦青简不禁泫然敬题一诗以志感
769654,贺新郎·余至何阜，故人胡二简开尊酌我，酒间因话庚辰冬与余同寓吴陵，有仇坦园、王宾文两先生风雪中相聚甚欢，今宾翁已殁，怆然感怀，为赋是词
728661,念奴娇 方景两先生庙
263090,访曾君静于明瑟山庄，读杨赵两先生诗
804525,除夕忆先大人暨两先慈
839381,访曾君静于明瑟山庄，读杨赵两先生诗。明日，君静同令史圣与招饮虚郭园，极宾主之乐，为赋小诗简谢
544870,舟过吴门奉怀王太仆元美祠部敬美两先生 其一
770284,和两先生讽早睡之作
818543,有怀章太炎邹威丹两先生狱中 其二
697147,舟过吴门奉怀王太仆元美祠部敬美两先生
544871,舟过吴门奉怀王太仆元美祠部敬美两先生 其二
742530,一笑山房同田夫西郊两先生夜坐
973764,仆自北门放舟过溥子而告行坐间出示上蔡景迂两先生墨帖具道先世契之详益重其别为成是诗
432220,韵和叶、陈两先生唱酬遣怀二绝
751785,敬题朱竹垞毛西河两先生合像
750949,戊午六月从沈南一陈子松两先生及张倬云沈谱笙诸君观荷芦雨盦欢饮至月上始罢用少陵丈八沟诗分韵得放字客字 其一
164738,过涪州怀伊川涪翁两先生
814070,陶社落成，恭和丹翁吏部原唱，并祝颂慈、玉池两先生华诞
132766,章运诗·宝屏峰上两先生
815829,戊午六月从沈南一陈子松两先生及张倬云沈谱笙诸君观荷芦雨盦欢饮至月上始罢用少陵丈八沟诗分韵得放字客字
818544,有怀章太炎邹威丹两先生狱中 其一
43130,念奴娇·方景两先生庙
485927,病中对梅花一株欣然有作录似西塾孟载季迪两先生一笑
419753,减兰 读海藻所收赵韵丞、朱锡百两先生诗，感题其后
283801,减兰·读海藻所收赵韵丞、朱锡百两先生诗，感题其后
298966,敬题朱竹垞毛西河两先生合像
264764,长相思·罗蕉麓杨志青两先生祖饯于温泉山馆，赋此留别
909428,过涪州怀伊川涪翁两先生
802203,西斋小葺初成西涧露湑两先生见过赠诗次韵
790422,陶社落成，恭和丹翁吏部原唱，并祝颂慈、玉池两先生华诞 其一
