846839,鹊桥仙 寿王驸马又将亲迎九月二十
479049,送原辉南还（九月二日）
314476,鹧鸪天·一九四六年九月，将之汉皋，和元谊、吉权、深之秋感韵
736562,九月十三日饶州寓斋夜坐
469868,闰九月燕子矶登高用寒字
700421,九月八日饮振衣亭归有怀三首
28657,九月八日
755657,戊辰九月将从楚游留呈两大人兼别弟妹 其二
305790,九月十四夕湖上
495500,甲辰九月感怀 其二
532709,壬寅九月十有七日吾生四十有四年矣
1128556,凤凰山泉石胜绝去城无几里而前此未有知者偶因休吏与文中良器二士访寻得瑰奇卓绝之观于荆棘草莽间相顾大笑因崇基趾筑亭榭疏泉甃池为登临啸咏之地九月二十五日游陟归夜作小诗十首
670820,九月同殿卿登南山 其一
785887,九月朔日启程由上海归舟中作
930398,九月三日同吕周辅教授游大邑诸山
514715,九月八日枕上闻秋风大作有感
515383,九月廿八日黄司训汝彝雨中留宿联句二首 其二
294140,鹧鸪天·一九九五年九月自堪萨斯移居路易安纳州，临行口占小令，辞别堪庐绿圃花木禽虫
422706,满江红 其二 九月七日阎海文死事
1108936,九月初十日值宿玉堂七绝
1066512,九月二十四日陪少蕴左辖饮朱氏林亭以朱行中寄其弟诗为韵席上同赋
444797,临江仙·和江南雨十二花仙词  九月菊花
314101,沁园春·忆丙寅九月八日为先子六十诞辰，客汪舟次先生家，先生张宴为寿
509839,九月木犀花盛开偶成寄贺黄门克恭
923127,和陈彦升学士九月校书怀旧之作
656923,九月梦
301783,癸酉九月九日，予自京飞乌鲁木齐
383723,九月七日南昌太守王君华冈过访东郭小园有诗见遗酬赠
242194,九日·去年九月愁何恨
111409,邵武作·爱重八九月
1118861,九月八日戏作两绝句示妻子
685958,九月既望陈勋卿招同穆王二令公登龙津逍遥楼望西樵诸山既暮移酌于东轩就月漫赋二首
1005739,子瞻在惠州以十月初吉作重九和渊明己酉九月九日韵余去年以此日奔避万山今日则有间矣有野人馈菊两丛对之叹息因继韵陶苏之后
698429,九月十一日天禧寺访卢月桐观画壁回口占二绝句以寄
181621,甲寅九月末雨至十月二十三日得晴闻是日六飞
80289,暮秋·九月山村已骤寒
1056793,九月一日口号奉呈显翁文叔
888535,九月二十六日同朝宗泽民游洞宫用刘使君韵二首 其一
963113,九月一日侍老人游洞霄宿超然馆闻钟
903123,九月梅花
117548,寄子瞻·忆赴钱塘九月秋
529269,九月朔饯别过水南
644448,九月晦日高僧同朝赐馔
969966,贺皇太子九月四日生辰 其一
573753,九月朔过王庄偶读高适闭门无不可何事更登高句漫成三绝 其三
492007,九月九日将赴豫章夜发瑞州城下二首 其二
1073354,九月瑞香盛开
219591,九月望徙坐冬窝
692892,嘉靖乙巳年八月十二日出狱归九月十一日复逮系途次有作
594585,九月七日同管臬使曾谢俞三山人集王元美弇山园
547551,九月廿一日同赵少虚文学李前峰司马饮宫秀才山房对菊三首 其三
918816,九月一日
826590,满庭芳·丁丑九月客燕京，书感
750128,九月忆舍弟
169367,九月八日夜雨留智叔
487061,如梦令 九月晦日尚未得归
626641,癸巳九月与乔生先生夜话见其壁间画像乃十年前梁生所写抚今追昔有少壮之殊爰赋二诗以赠因书其上 其一
251890,丁亥九月十九和晦窗先生观音菩萨出家日偈子
773929,壬寅1902九月十五夜同栎社诸子莱园置酒
836017,菩萨蛮 九月廿八日四更枕上念巧先作
298666,九月初五日同沈虚谷昆仲游浣笔泉用壁上木兰山人元韵
972067,九月二日发舟快阁下
542642,九月七日游佛山同薛子乔阎达夫许克之赋得黄字
472000,纪赐四十首 其四十 辛夘九月乞休得请钦遣内使赍赐路费宝钞次日又遣内使赍赐白金文绮盖六卿日讲各有特恩也
318753,忆旧游·九月十八日独游惠麓
821802,十月桃 沈石田画九月桃花折枝小幅，自题云：荣华难暂顷，天地亦多情。感之成咏
17758,长相思·九月西风兴
730385,九月十九日八旗馆露台登高赋呈节庵孝通伯严斗垣叔峤诸君子
275172,雪·九月边城雪
1135765,九月三日晚登秀亭分韵得七字
438533,九月七日饮
572312,九月初五日得三弟京闱第三报志喜仍用散木韵践前约也 其六
1164424,奉和圣制闰九月九日登庄严总持二寺阁
505713,九月辞
663541,九月望日同大阳有台二使君泛湖出郭二首 其二
69046,阻雪·九月中原柳未枯
588913,九月十日谒佥宪彭楚山饮洱海道中补重九之会
583154,九月九日寓九江时户部李时雍同年预约游庐山以是日雨作中辍时雍复遣人送酒侑以一绝因走笔戏答四绝 其三
346642,九月九·不是妻孥须入山
816293,庚寅九月自苏州量移武昌留示诸生
913145,贺皇太子九月四日生辰 其十
826024,九月初一日晨起 其二
313340,念奴娇·癸巳九月余游宝安，主张子寿上舍园中
930396,九月十日夜独坐
413100,一九六六年九月廿二日红卫兵勒令归乡内子淡俜结装相随旋又奉令返回原职计居乡一百天 其六
611920,乙卯九月十四之夕徐海石囧卿尹冲玄令尹温瑞明少府陈美用民部招集天坐轩泛月作三首 其三
1070715,世以啄木为珍禽其声至入乐府而海南一种形小而声淫每四五月间飞鸣如蛙蝈至八九月乃已亦名啄木繁声可恶然琼人讹其声为骂秃禽殆得其实因为赋诗
193801,菊花·八月九月天气凉
667928,府治内礼贤堂落成桐冈君张宴于此以招郡之耆旧予固非其人幸奉杖屦兹九月八日吾辈亦就此供具少展谢私诗曰跻彼公堂称彼兕觥此之谓也乃即席赋诗四章 其一
545364,闰九月望后抵淮上包稚升水部邀集署中二首 其二
161996,九月十二日侍祠明堂口占
157649,丙子九月陈村避地三绝
705622,九月望日得石斋馆丈午日见怀诗次韵 其一
966405,乾道三年九月宴罢 其一
486263,追和柯丹丘所藏坡翁诗帖五首（洪武辛酉九月） 其四
909909,又九月十四日登秋风阁以馀霞散成绮澄江静如练为韵分得馀静二字 其一
1136782,谢叠山先生己丑九月被执北行闽士以诗送之倚歌以饯 其二
5323,九月十日即事
1135722,九月二十六日雪予未之见北人云大都是时亦无此寒
82640,咸齑十韵·九月十月屋瓦霜
328813,德操充之皆约九月间见过今皆未至扶杖出门悠然有感
350609,水龙吟·九月八日宿清风店
1090900,九月犹煖梅桂有华
407256,九月三十日江上送秋，寻去年醉处不可得，惘然有作
1215962,九月一日还自上京途中纪事十首 其六
189069,渔家傲·九月芦香霜旦旦
194176,九月宴罢·万古云霄一凤鸾
191578,九月八日游报本寺
254455,九月五日作
901196,九月望夜与诗僧可久泛西湖
169729,与友人中元作别九月十日复会中间节物不得共
1246861,九月十日命次儿文凤携琴谒张仲贤知县是晚宿澄塘兰若同吴德渊文凤联句以叙阳关别意云
157727,九月十四日夜枕不寐起视明月清寒著人冷然有
774975,甲戌1814九月廿一夜予方有秋兴适奎垣以诗见贶清话更阑叠次其韵感赋二律 其二
285165,八声甘州·九月避兵海上感赋，用梦窗韵
1026568,九月十日西湖席上得乐字
790047,九月十二日，赵次侯见招，及钱仲谦吴冠英李申兰汪友梅吴肖陶同游虞山。晚归饮仲谦墨园，赋次以记
972063,九月一日晨起风物凄然不胜怀远之思作五首寄和父憨申并烦转致湖池二州也 其五
839394,九月初六日寄怀刘石香二首 其二
813190,九月二十日醉后作四章
945891,糖多令/唐多令 其一 九月留城书怀
495502,甲辰九月感怀 其四
595243,九月望日陪吴困宇大尹陈曲江邑博登楼作
922918,元丰己未三院东阁作 己未九月予赴鞫御史闻子瞻先已被系予昼居三院东阁而子瞻在知杂南庑才隔一垣不得通音息因作诗四篇以为异日相遇一噱之资耳 其一
845763,风入松 寿刘倅九月初九
521028,甲辰九月五日迎司马兰亭过蔡廷章宿 其二
1152060,奉和九月九日登慈恩寺浮图应制
583947,九月水际拒霜
365883,九月朔日启程由上海归舟中作
795369,江城子 江梅九月小院盛开，词以纪之
77415,白龙·九月癸酉暮
715410,九月药亭宅见梅
250763,乙丑九月拟清湘老法并题
832009,九月二十六日小妾举一男，坠地即绝。余年三十有六，尚无子嗣，怆然有感 其三
869445,次韵和江邻几九月五日省直
913153,贺皇太子九月四日生辰 其二
611918,乙卯九月十四之夕徐海石囧卿尹冲玄令尹温瑞明少府陈美用民部招集天坐轩泛月作三首 其一
493565,七月一日得大兄去年九月寄书来其午魏直夫来自京师闻大兄哀讣而未领家问是夕灯下且信且疑辄赋绝句以写悲怆
1029168,和宁国守沈察院九月严霜十五韵
1195884,九月三十夜雨寄故人
1042176,九月八日晚会永叔西斋
522291,晚步中庭侍人褚氏问今三月半耶曰然笑曰京中日日思归今归来九月矣喜溢颜面予闻而欣然记以小诗
473594,九月十七夜与周国雍话旧
934932,九月一日夜读诗稿有感走笔作歌
846892,醉蓬莱 寿张宰九月廿八
719982,戊寅九月初三日奉谒少师高阳公于里第感旧述怀三首 其一
365875,九月十一夜渡苏彝士河
832010,九月二十六日小妾举一男，坠地即绝。余年三十有六，尚无子嗣，怆然有感 其四
1071040,九月二十八日枕上
572311,九月初五日得三弟京闱第三报志喜仍用散木韵践前约也 其五
432117,甲午九月出都
956818,九月十九日衙散回留大将及幕属饮清心堂观晚菊分韵得噪暮字
676448,九月八日登天平
601772,庚戌九月将有浙行舟泊穗城怅然有作
432073,一九六六年九月廿二日红卫兵勒令归乡内子淡俜结装相随旋又奉令返回原职计居乡一百天
477250,九月二十四日早朝
1187682,九月九日
221279,癸丑九月苦雨和宋饮冰韵
960558,九月十三日饮湖上
80990,九月三日同吕周辅教授游大邑诸山
381163,九月初四日萱妹四十生日栗兄置酒作诗胥及柽弟皆作一律寄之
843574,辛丑九月十三夜伏枕不寐，忆前年咏菊诗款惬意，续赋二律
874556,九月初十日值宿玉堂七绝 其四
414601,甲申九月钞顺德蕲春两黄先生咏怀诗注成偶效其体九首 其二
201463,九月一日与王季夷酌别为赋十六韵
834904,琐窗寒 九月廿二夜雨，强眠未着，赋寄内子海上，并约吴越之游
769213,丁未九月赘成都盐茶道署呈外舅林西厓先生
433629,甲申九月钞顺德蕲春两黄先生咏怀诗注成偶效其体九首
814770,乙亥九月九日纪事诗四首
159983,次韵和相公九月八日所赐诗
930392,九月十一日疾小间夜赋二首 其二
721413,九月晦日同王惠州王础尘连双河诸公集石公精舍送秋同限蕉字松字二首
195367,於杭州九月送袁太初赴宁海教官
383258,九月八日罗康洲宗伯黄仪庭司成田钟台宫谕习豫南司成会集朝天宫道院
810157,扬州慢甲午九月游广陵平山堂曲宴即席和白石韵
386676,九月望日见题名录，雪村举首，赋此寄贺
80989,九月三日泛舟湖中作
1236485,九月一日还自上京途中纪事十首
972069,九月十三日雪
687005,至正乙未秋九月宪司潘郎以巡历来吉省掾马郎以徵籴过赣于其归各赋赠一首
639179,九月七日别墅池亭小酌
896183,九月十日菊花烂开
64428,九月十七夜与周国雍话旧
665243,壬辰九月二十二日再入讲筵进讲得诗三首 其二
1041035,和阎都官九月十三日夜对月是夕某与子华圣俞如晦会饮君谟所
430157,九月十四夕湖上 其二
930405,九月初作四首 其四
1115426,凝露堂前紫薇花两株每自五月盛开九月乃衰二首
792280,癸丑九月，六十自慨四首 其三
812398,九月偕兄子乐斋之毗陵
850060,九月十四日小会
468440,九月三日山堂桂花经雨而落慨然有作
829401,乙亥秋九月至旧京视散原先生日与心畬叔明立之伯夔君任羹梅过从寥志强志贻先询先诸弟自津沪来旧藏五十馀年陈酒由杭至京连日聚饮赋诗属和
961076,沁园春 寿婺州陈可斋九月九日
508364,和陶诗 己酉岁九月九日
1217084,九月二日揭晓仆以朔旦始得閒复成二诗录奉泰甫侍郎思齐御史本中都事道明敏文伯崇有志诸寮友 其二
990476,赋九月梅花
1075886,九月十六日示内二首 其一
382845,九月廿五日东园菊下小集
888534,九月二十六日同朝宗泽民游洞宫用刘使君韵二首 其二
301730,癸亥九月·墟里依依欲上烟
445513,九月偕诸诗友游王爷庙以践去春之约次韵山谷登快阁
739973,九月十九日出都别友
1006844,鹧鸪天 其一 九月十三日携家游夏氏林亭燕集作，并送汤词
643920,闰九月
1001896,九月 其二
1151680,九月九日忆山东兄弟
1093554,九月四日黄子功林德久自柳州共汎访铦师
789337,九月十六日广雅尚书宅集即席赠别樊按察分得佳韵 其二
823191,风入松 九月十八日怀江叔老
1168,九月奉教作
1207977,九月二十八日，济上作
189415,九月初吉永嘉苏太古同游金华洞夜宿鹿田寺用
456686,九月某日杂诗六首 其一
1116712,七年九月，自广陵召还，复馆于浴室东堂。八年六月，乞会稽，将去，汶公乞诗，乃复用前韵三首
36839,九月八日送萧少府归洪州
1134391,九月初五日
1207946,九月十四日，过紫极宫熊道人房
1094434,九月二十日
460439,蝶恋花　九月四日记梦中事三首 其二
532139,九月与内姻兄弟登龙冈答梁应民二首 其二
468367,九月五日与陈渊如刘主敬同登湖阳诸山
948700,绍兴庚辰九月二十三日与浙东权帅同年程龙图并试玉堂庚寅岁由少蓬寓直摛文发策试馆职亦九月也有怀泰之辄寄四韵
948700,绍兴庚辰九月二十三日与浙东权帅同年程龙图并试玉堂庚寅岁由少蓬寓直摛文发策试馆职亦九月也有怀泰之辄寄四韵
825015,九月十五夜月下作三首 其二
263065,丁亥九月·彩虹飞入碧波中
1182908,九月九日李苏州东楼宴
130017,晚秋犹热·九月年时已肃霜
925529,丙寅九月二十八日作来年将告老
167645,九月八日持螯
196701,雪中见菊·九月黄花正是时
1134382,九月一日稍佳演作五十六字终不及少陵牧之
575015,九月望日登顾氏山园
572303,九月二日盛集诸公郊游至二圣寺仍用散木韵 其五
304223,九月四日李庄口占
719829,后秋兴八首九月初二日，泛舟吴门而作 其一
1199360,诗一十七首 其五 九月六日夕紫微夫人喻作示许长史并与同学
996987,庭坚以去岁九月至鄂登南楼叹其制作之美成长句久欲寄远因循至今书呈公悦
459489,九月十一班中无钥开匮，不得取书，作诗遣闷十首 其八
260893,九月的夜晚
1126,奉和九月九日登慈恩寺浮图应制
524153,九月七日夜集
342601,九月十五夜北楼望太湖
460436,蝶恋花　九月一日梦起作二首 其一
1199270,月节折杨柳歌十三首 其九 九月歌
99795,九月十五日观月听琴西湖一首示坐客
123335,九月十日南出见梅
694814,九月骤寒二首
407950,宣统二年庚戌九月偕同人登宽甸西北峥嵘山，入寺信宿，七律八首（录四） 其一
991737,九月五日得姑苏谢学士寄木兰堂官酝
429641,九月三十日登石景山最高处
363472,和故人二首丁卯年九月二十二日梦中得之
326492,写怀·淡月疏云九月天
195978,满江红·九月二十一日出京怀古
53377,丙子九月工部奏进万历制钱式样赐讲官六人各
948989,点绛唇 其三 赴池阳郡会，坐中见梅花赋丁亥九月己丑
770548,壬子八九月读书题词十五首 其七 靖节桃花源记
96650,九月十一日雪·九月天雨雪
96650,九月十一日雪·九月天雨雪
941754,水调歌头 癸卯九月十五日寿朱元晦
56795,九月七日雨
749582,九月初五日同沈虚谷昆仲游浣笔泉用壁上木兰山人元韵
1103954,九月四日偕弟可玉外甥张敏修吾孙栋游西山访古追怀甲戌旧游感叹不已纪事五十韵
288904,九月朔日倩画工绘万山寒柏图，题四诗以见志
910554,甲午九月十七日留题太平寺
14440,九月九日勤政楼下观百僚献寿
400217,高阳台 九月初三悼杨生作
228618,壬申九月初十归自邑中两绝
475673,余羁秣陵乞休累疏而格于新令郁郁之怀伏枕增剧遂效杜子美同谷体为秣陵七歌时丙戌九月既望也 其四
675888,九月望日登宝峰次韵
930395,九月十日
321735,前辈有满城风雨近重阳句而不成篇九月六日遇雨因为足之招同官分韵
1135776,八月晦甲子雨至九月二日怀同来二僧及两子
295611,丁卯九月释戡招集江亭分得杯字
897408,九月下旬有作二首 其一
466245,九月十一班中无钥开匮，不得取书，作诗遣闷十首
350985,渔家傲·九月轻霜拂商素
79668,九月十日夜独坐
673360,九月十三夜泛分韵
1025909,九月梨花
909559,水调歌头 其十六 乙巳九月寿城获捷，和傅山父凯歌韵
36565,九月十日
317523,西湖·九月西湖天渐凉
930407,九月初郊行
1219078,九月十二日出北郊
408863,九月十八日抵家
338604,百字令·九月十四生日漫兴
459492,九月十一卫生所见花似南瓜。黄色，圆平如掌，南瓜如此不？为赋
803578,九月望日燕集蓉湖舟中因登惠山得洞字
664143,九月八日奉谒先垄述感
486262,追和柯丹丘所藏坡翁诗帖五首（洪武辛酉九月） 其三
1232582,九月风雨清斋
765066,春从天上来 旅食钱唐，喜家果亭叔典试南来，于其出闱也，赋一词赠之，时乙卯九月十日
505680,甲辰岁九月一夜梦外舅天趣郑先生问幽冥之事但云海天月色秋茫茫觉而衍其语以寄哀情
906750,九月十三日夜偶书
65432,九月晦日感怀
535019,奉次许宗鲁中允九月二日居庸佛阁同仇将军登宴二首 其二
104418,九月五日得姑苏谢学士寄木兰堂官酝
578868,九月十六夜宿漳浦云霄驿纪怀
319845,九月八日喜禹峰至
922180,和陶己酉岁九月九日，并引
105786,次韵九月十七日饮陆君用见山堂
443612,虞美人　九月五日夜自咸阳飞北京
1066996,凤凰山泉石胜绝去城无几里而前此未有知者偶因休吏与文中良器二士访寻得瑰奇卓绝之观于荆棘草莽间相顾大笑因崇基趾筑亭榭疏泉甃池为登临啸咏之地九月二十五日游陟归夜作小诗十首 其十
188929,九月十七日夜度蔡道岭宿弥勒院
429679,九月八日集无边华庵饯浣华韵伯作画余名之曰秋槎图并赋三绝句 其二
1134394,九月初四日大风雨近重阳无酒夜成二首 其一
735884,九月十九日同贲黄理田公燮登慈仁寺内毗卢阁分赋登高二韵录一
716202,九月初十夕
1004299,宝祐五年史院修高孝光宁四朝国史成上进九月明堂升侑高宗礼成进诗三章称贺 其三
552427,洪武癸丑九月十八日为外兄集贤大学士张东谷贺八十 其三
787558,九月四日重至东阳寄杭诸友 其一
1211550,九月七日舟次宝应县雨中与天与弟别
367632,九月十日府委撞点巡铺马上得四绝
1115061,壬申九月初十归自邑中两绝
743564,家秋塍大令复以嘉庆元年九月与黄小松易武虚谷亿为嵩少伊阙之游寻碑选胜作图纪事其年十二月往求孙渊如星衍篆题其首明年五月以书抵余华亭官所求诗
842887,瀛台侍直七月至九月得十六首 其十四
368013,九月十日菊
1102641,课仆诣田所偶用渊明庚戌岁九月中于西田穫早稻韵
895846,九月望日同君谟侍郎泛西湖夜饮
404652,鹧鸪天·一九四六年九月，将之汉皋，和元谊、吉权、深之秋感韵
418368,哨遍 夏日游外九水，遇雨旋晴，景尤奇丽。赋柬同游诸子，时戊辰九月
966406,乾道三年九月宴罢 其二
1101479,九月十日府委撞点巡铺马上得四绝 其四
428389,游喀纳斯湖，宿哈巴河一连，此处为中国之最北端，虽九月已寒冷彻骨，夜不能寐，枕上看窗外繁星若灿，口占
51054,己酉岁九月九日
3121,九月九日忆山东兄弟
992310,依韵和江邻几癸巳六月十日同刁吴韩杨饮范景仁家晚赴馆宿睹吴兴太守章伯镇题壁记辛卯仲秋初吉九月十一日十月二十二日十二月十一日壬辰二月一日馆直慨然有感
46847,九月八日对菊
414604,甲申九月钞顺德蕲春两黄先生咏怀诗注成偶效其体九首 其五
1149770,赋得九月尽
404876,浣溪沙·九月二十二日与室人偕游乌来
615441,闰九月朔同集欧子建半竹亭
677956,九月十五夜月蚀
407953,宣统二年庚戌九月偕同人登宽甸西北峥嵘山，入寺信宿，七律八首（录四） 其四
889553,和陶庚戌岁九月中于西田穫早稻
459483,九月十一班中无钥开匮，不得取书，作诗遣闷十首 其二
413102,一九六六年九月廿二日红卫兵勒令归乡内子淡俜结装相随旋又奉令返回原职计居乡一百天 其八
572300,九月二日盛集诸公郊游至二圣寺仍用散木韵 其二
429740,九月廿二日出都过天津见太夷先生九日诗和者甚众辄用其均以抒吾意
580520,弘治五年九月八日司空戴先生召诸公为白去寺之游归途间张靖州有九日遣怀之作遂次其韵十四首 其十
459618,九月二十二梦见椒子幼株，欲掘种故家后窗下，作诗曰：异日小窗读周易，可从窗内一抬头。而觅锄不得，惶然遂醒。思梦里故家，乃十馀年前景，久已荡然，无复种树之隙矣；屋亦为姑母加建久居，并无可归之地矣。因足成篇，更补一首。梦中句云云，盖现居窗外有孤树，读书倦处，辄举目相对耳 其一
825014,九月十五夜月下作三首 其一
605140,清漳郑肇中文学昔者社友郑辂思观察之哲嗣也壬申秋九月以诗见访投辖小园次来韵答之
634263,甲寅九月杪予从江宁入句曲晤林明府仅人因得接黍谷钱中丞之欢同寓崇明寺畅谈捧腹已成三日夕之乐十月朔二鼓别归邻院而宿夜梦与中丞凭高俯视见有搅绵花者梦中幻境其花蒙茸如海风撼浪予谓中丞曰可共作搅绵花诗何如中丞诺之予遂先成二句曰却似白云生谷口还如泻水置平川及旦林紫君相过因与中丞同早饭王大席陈南浦俱在焉饭后相与步城头揽郭外秋色而凭高之意遂忆梦中因语中丞中丞索予续成欲和同游者各属一章即以此为相逢剪拂投赠之雅什也
658737,壬戌九月
459486,九月十一班中无钥开匮，不得取书，作诗遣闷十首 其五
1109533,九月十日赵韩王园同舍饯送王微之晰出守汝州即席次其韵二首
1125932,九月望徙坐冬窝
895462,九月一日与王季夷酌别为赋十六韵
826624,菩萨蛮·庚寅九月薄游衡湘，阻风洞庭之南津港。吴楚舟樯，云屯鳞集。翼晨登白马将军庙，北风骤转，千帆竞挂，衔尾翩联，一白直穷天际，洵江湖壮观也
104424,九月晦日谒韩子华遂留邀江邻几同饮是夕值其
486751,蝶恋花 九月海棠
1101411,九月以檄至九江杂赋
434507,江城子 九月有感
842654,九月十五夜涌泉寺口号
23137,夜雨·九月三十日
843589,九月初六日寄怀刘石香二首
458870,九月二日暮饮馀欲访肖，过陇中田埂，而迷所向
50432,旅寓·九月犹絺衣
1141273,九月西城无涧同陈道士衡上人 其二
429682,九月二十一日作 其一
626640,丙子秋九月重谒本师和尚于南海宝象林即事呈偈
229746,登高·天晴九月九
772356,梅伯言、马湘帆、汤海秋、王少鹤四农部，何子贞编修，陈颂南、苏赓堂、朱伯韩三侍御，叠次召余同亨甫为觞宴之乐。九月二十六日，复集蒹葭阁；盖丙申年入都，伯言、湘帆置酒处也。诸君各以诗文见赠，余行有日，辄成七律数章酬别 其五
318165,九月朔日，飓风大雨，楼望看水
1154279,奉和九月九日登慈恩寺浮图应制
792279,癸丑九月，六十自慨四首 其二
1045629,九月九 其五
585776,九月廿日白云遣兴二首 其一
753071,曾主政丙戌九月还湘丁亥三月复抵京诗约上巳同游
867471,惜黄花 九月七日定兴道中
782369,九月四日同年卢雅雨都转喜余来赴登高之约即放艇真州邀同年戴通乾来会是日同饮雅雨官舍期以九日游平山堂通乾得诗二首即次其韵 其二
1148836,九月九日幸临渭亭登高得秋字
1093771,闰九月旦
3281,九月九日刘十八东堂集
494130,九月二十二日同巡按高侍御登六榕寺塔
916546,水调歌头 其四 韩倅九月八日生辰
58658,迎銮曲·九月南征九月回
58658,迎銮曲·九月南征九月回
825053,九月初四日萱妹四十生日栗兄置酒作诗胥及柽弟皆作一律寄之
353496,九月十一日龙华寺斋宿礼部陈同年见余嵬字韵诗宠和惠示复用韵奉酬
813708,满江红·八月十五日遍寻陶然亭龙树寺诸胜。入夜星月皎洁，饮赵氏斋，閒步归旅舍。忆贺少楼明经有九月十五望月两阕，属和，久无以应，次韵寄怀
1134389,九月初一日
372895,壬子九月七日会大安寺
579655,后九月九日
772359,梅伯言、马湘帆、汤海秋、王少鹤四农部，何子贞编修，陈颂南、苏赓堂、朱伯韩三侍御，叠次召余同亨甫为觞宴之乐。九月二十六日，复集蒹葭阁；盖丙申年入都，伯言、湘帆置酒处也。诸君各以诗文见赠，余行有日，辄成七律数章酬别 其八
687064,九月二十五日有传秋闱两榜至书舍见思永杨植以诗中乙科喜乡闾之有人学业之丕振因赋三绝以自释
