311079,菩萨蛮·九月廿八日四更枕上念巧先作
96647,九月十一日雪·寒风动地至
1082520,九月八日登高作重九奇父赋三十韵与义拾馀意亦赋十二韵 其二
770551,壬子八九月读书题词十五首 其十 岑嘉州集
259621,九月十一日夜对月
606258,九月既望陈勋卿招同穆王二令公登龙津逍遥楼望西樵诸山既暮移酌于东轩就月漫赋二首 其一
1238052,济川阻雪九月二十七日客况四首 其一
148912,癸卯九月赣吉大水
742175,九月崇效寺登高因至法源寺
1240532,九月七日复游寒泉登南峰有怀龙门云台二首 其二
713306,九月晦日同王惠州王础尘连双河诸公集石公精舍送秋同限蕉字松字二首 其一
550291,己夘九月杪再游摄山遇雨
307451,瀛台侍直七月至九月得
107196,九月初五日·暮雨萧萧鼓角风
700181,甲辰九月五日迎司马兰亭过蔡廷章宿
804620,和响泉叔父九月七日游惠山韵二首 其一
764965,贺新郎 庚戌九月为既庭师五帙，浪迹燕齐，未获捧觞称庆，隔岁归来，绘云松图补祝，时辛亥正月望后，梅花盛开日也
551197,寿雪浪禅师九月九日五十初度
698093,九月饯衍圣公于礼部次夏宗伯桂洲韵
155371,九月八日次韵沈虞聊
383228,辛夘九月乞休得请钦遣内使赍赐路费宝钞次日又遣内使赍赐白金文绮盖六卿日讲各有特恩也
1100001,九月山丹
482115,九月晦日感怀
665244,壬辰九月二十二日再入讲筵进讲得诗三首 其三
131485,九月十日醵饮丹山
286405,乙卯九月九日来游西涧西涧主委客去
783847,乙亥九月九日纪事诗四首 其三
897405,九月一日有作
895063,九月七夜喜新凉
337424,九月十六日生日示内
999532,九月二十六日河上雪
369291,九月十四日游台阳十六日抵安平家楚荣镇军招驻署中夜谈有感
367698,九月以檄至九江杂赋
374323,明智院·时过九月秋
413095,一九六六年九月廿二日红卫兵勒令归乡内子淡俜结装相随旋又奉令返回原职计居乡一百天 其一
104057,过鸣雁城·九月过鸣雁
1216082,岁戊子五月将赴闽宪徵擢翰林待制兼国史院编修官九月驿至京师送季长弟之任山南宣慰照磨二首 其二
104425,九月二十四日大风
577,九月九日登玄武山
580513,弘治五年九月八日司空戴先生召诸公为白去寺之游归途间张靖州有九日遣怀之作遂次其韵十四首 其三
24236,九月于东逢雪
459228,九月一日共肖饮馀雨中出坐。其地旧为山石，尝屡坐谈者，大半已夷平作楼矣
1218722,九月十日自寿
190018,九月八日夜大风雨寄王定国
459112,九月十三夜作歌
668193,九月二十八夜梦中作
944878,九月十日醵饮丹山
383157,戊子九月寿宫随驾步视宝城还于东廊称贺玉音宣劳赐茶并赉綵花文绮等物
1239842,九月十七日闻雁寄董庄
181478,九月九日堂红叶
1149358,咏廿四气诗 霜降九月中
96652,九月廿一日雪书呈进之
779328,尾犯 九月五日雨中作
839476,辛丑九月十三夜伏枕不寐，忆前年咏菊诗款惬意，续赋二律 其二
387726,鹧鸪天·九月初三绣岭东
77967,九月晦日作·炊烟漠漠衡门寂
431305,九月上越王台二首
1005116,九月二十七日晓起书梦
697215,闰九月望后抵淮上包稚升水部邀集署中二首
1147966,奉和九月九日登慈恩寺浮图应制
429683,九月二十一日作 其二
493093,九月二十五日有传秋闱两榜至书舍见思永杨植以诗中乙科喜乡闾之有人学业之丕振因赋三绝以自释 其三
107189,九月三十日汉臣置酒次日有诗次韵
1084547,九月十二夜独步梅溪玩月人迹悄然秋色满眼微风不动岩桂自香初不劳思偶得四句盖心境中静时语也归小成室对短灯檠索纸书之
116509,九月下旬有作·惨惨岁云暮
817326,九月四日钱少司寇舟抵维扬同年卢都转雅雨放艇真州邀余往会至即同饮官斋更期九日平山堂登高二首
254179,九月三十感恩
466288,九月十七钓茶港三首
111805,见山楼下植梅百本九月见花
366386,答黄寺丞九月二十一日出郊
972066,九月二十七日题桂溪铺
501016,龙凤己亥秋九月上於建龙关仪凤楼杂写金陵山川六处命僚属各赋绝句走笔立成
911519,九月二十六日观水
1103001,拟长吉十二月乐辞 九月
346511,九月九·有人才思耸如山
1081013,九月二十二日秋举失利出门用中相饯夜步河上留别
1085780,前辈有满城风雨近重阳句而不成篇九月六日遇雨因为足之招同官分韵
317935,九月十三日同友人高于仲自省回涂中遇雨
845264,鹧鸪天 九月初三夜宿华清，用香山旧句成解
416992,倦寻芳 芳华易逝欢事去，心慨乎言之，不自知其意之谁属矣，辛巳九月
842876,瀛台侍直七月至九月得十六首 其三
655015,九月朔卞庙谒祭因有豫作登高之约归次偶成 其三
917454,九月二十一夜梦至乱山丛石间出憩道傍拂石坐古榕下仰视木杪萝蔓凌空兴欲蜚举既觉哦成古篇
444630,丁亥九月十九和晦窗先生观音菩萨出家日偈子
930391,九月二十五日鸡鸣前起待旦
498859,九月十二日宫允孙季泉太史尹洞山林肖泉王槐野郭东野过对菊有作资韵
842883,瀛台侍直七月至九月得十六首 其十
1116903,元丰己未三院东阁作 己未九月予赴鞫御史闻子瞻先已被系予昼居三院东阁而子瞻在知杂南庑才隔一垣不得通音息因作诗四篇以为异日相遇一噱之资耳
284356,九月十三日董君天狂招饮于天香楼，席散偕兆惇、兆恩二老同志浣纱村畅叙，归后得一律报之
466448,减兰　九月十三
730679,九月十二日
972062,九月一日晨起风物凄然不胜怀远之思作五首寄和父憨申并烦转致湖池二州也 其二
834905,减字木兰花 九月廿三夜营睡不成，枕上口占寄岚屏
408493,甲午九月出都 其一
501666,闰九月重阳前一日奉陪梅所知司游员山谒康仙祠即席次韵二首 其一
772856,九月十四日游台阳十六日抵安平家楚荣镇军招驻署中夜谈有感
1076088,九月二十四日试吏省舍雨中独坐终日是日诵阮嗣宗秋怀十七首因效其体
456691,九月某日杂诗六首 其六
277041,九月七日与劳玉初刘仲鲁访灵光寺旧址寄陶斋
833481,鹧鸪天 其一 九月初三夜宿华清，用香山旧句成解
792281,癸丑九月，六十自慨四首 其四
705624,九月望日得石斋馆丈午日见怀诗次韵 其三
138880,和陶庚戌岁九月中于西田获早稻
1116085,九月十六日出郡登舟如钱塘十七日舟中杂兴
825190,九月八日
429814,九月七日拔可园中望月有怀散原老人
437495,九月十一日夜对月
693907,九月朔过王庄偶读高适闭门无不可何事更登高句漫成三绝
492477,九月八日述怀
1070195,九月七日夜梦王元规诘旦其弟元矩适相访感而作诗一首
963114,九月十八日夜泊刘郎浦 其二
319345,九月十九日八旗馆露台登高赋呈节庵孝通伯严斗垣叔峤诸君子
218205,九月二十九日迩英开讲忝预末班讲退小集玉堂
991733,九月二十四日大风
1103766,庚子九月十四日陪芳洲观山中泉石次韵
1066992,凤凰山泉石胜绝去城无几里而前此未有知者偶因休吏与文中良器二士访寻得瑰奇卓绝之观于荆棘草莽间相顾大笑因崇基趾筑亭榭疏泉甃池为登临啸咏之地九月二十五日游陟归夜作小诗十首 其六
294260,九月十七日晚眺
920252,九月二十日微雪，怀子由弟二首 其一
770554,壬子八九月读书题词十五首 其十四 昌黎诗钞
104383,挽词·九月秋风急
1206502,题耕织图二十四首奉懿旨撰 耕 其九 九月
323411,九月一日自道场山如临安周德载夏廷茂自菁村乘舟来访既别寄以小诗
874557,九月初十日值宿玉堂七绝 其一
1157270,闰九月九日独饮
495492,墙角红梅，九月发花一朵，偶成四绝；时羁狱舍，用「盐」字 其二
512730,丁未九月闻哀诏
587193,九月饯衍圣公于礼部次夏宗伯桂洲韵 其三
107188,九月三日晚登秀亭分韵得七字
809834,去岁八九月雨最多民间俗说封地雨故一冬少雪犹可支持自交立春复不见云所以望雨甚殷昨晚密云四起夜深甘霖即霈田间老幼无不举手加额欢声载道朕以民食为天喜均一体故赋七言近体以示群臣
1136583,和九月十日紫极登高韵
168424,九月八日桐川道中二绝
542896,九月晦夜少林寺对雪
349522,芦林潭对月忆家偶成回文戊子九月
553521,闰九月王修撰直宅对菊分韵得喜字送其兄行敏
1134387,九月三十日汉臣置酒次日有诗次韵
348921,九月瑞香盛开
329354,闻仙都·九月霪霖谷欲登
682303,追和柯丹丘所藏坡翁诗帖五首（洪武辛酉九月）
428455,癸亥九月偕程君颂嘉、王子云轩、顾子经笙、吴子斡卿游青山寺纪之以诗三首 其二
530545,杂兴　癸夘九月也 其六
73176,青杏儿·九月季秋凉
155301,游龙井·九月十日天气凉
574369,九月一日同诸友行山中 其二
585777,九月廿日白云遣兴二首 其二
381067,扬州慢·甲午九月游广陵平山堂曲宴即席和白石韵
223011,九月九日登山
506134,己未九月余新归灉江度构茅居甫成姻兄王氏效先有诗见美倚歌和之以酬其深意云 其二
804528,九月十五月下作
1218500,九月三日晚与郑元秉对坐至日暮小雨后归宿偶成
346510,九月九·九日诸公欲上山
218324,九月梅·洒扫东篱具菊杯
650476,九月十八日扈从车驾出居庸关外较猎
930390,九月二十三夜小儿方读书而油尽口占此诗示之
34943,九月三十夜雨寄故人
701283,林云山盆梅九月盛开魏竹溪有诗次韵二首
492199,九月廿二日承钟元卿六月二十日书且有卜邻之约未知能遂否也赋答意
722656,后秋兴八首九月初二日，泛舟吴门而作
99,九月九日
843521,八归 丁亥九月十二日舟发新州同仲叔返省应院试徐大同行联句一阕
1148990,与太白同之东洛至栎阳太白染疾驻行予九月二十五日至华岳寺雪后望山
1169490,九月奉教作
1002002,癸卯九月赣吉大水
1005325,九月朔晨起忆故园晚易
321789,九月十三日离仙林
682308,余羁秣陵乞休累疏而格于新令郁郁之怀伏枕增剧遂效杜子美同谷体为秣陵七歌时丙戌九月既望也
586438,九月一日北上舟次漳门遇乡人周仲素自京师回且言香山郑时济当继至诗以候之
897411,九月末风雨初寒 其二
783069,九月四日钱少司寇舟抵维扬同年卢都转雅雨放艇真州邀余往会至即同饮官斋更期九日平山堂登高二首 其二
271830,千秋岁·无恙将归虞山，以己卯九月所画菊帧见赠，依调奉答
990776,九月晦日谒韩子华遂留邀江邻几同饮是夕值其内宿不终席明日有诗予次其韵
754129,九月十四日舟由丹徒夜半与薇隐乘月登岸行三里作
580171,丙午岁九月廿日余偕同寅李由道罗象州过于冯佩之先生馆因留小酌联句三首 其二
742657,九月五日初雪
433441,九月八日集无边华庵饯浣华韵伯作画余名之曰秋槎图并赋三绝句
1127,闰九月九日幸总持寺登浮图应制
1076093,绍兴十九年秋九月丙戌皇帝以太师益国公像御制赞文称载勋德命秘书省珍藏小臣备员史馆获预荣观再拜稽首赋诗二十韵上进
745185,九月八日同年陈范川太史招同梁一峰广文游光孝净慧二禅寺呈范川 其二
699334,九月二日盛集诸公郊游至二圣寺仍用散木韵
608826,九月雪时在苑西楼，与四家兄、傅逊之、高正甫诸公同赋 其一
1176998,九月十日即事
580170,丙午岁九月廿日余偕同寅李由道罗象州过于冯佩之先生馆因留小酌联句三首 其一
329352,九月七日偶书
981169,闰九月九日
586033,九月七日驻节苕溪承王方伯载酒召游岘山山有三贤祠奇峦秀峰仙阁禅宫掩映松竹之外凭高引目灏气渺然诚一郡佳胜也因赋短律用识高游
999437,九月十日龙兴寺饮饯蹇磻翁赴梁门酒半题名南轩因偶书屋壁
160899,九月二十九日到思溪庄避人事十月初四日过生
467519,九月三十感恩
974459,潘元寿以九月十一日行莫令君领客携具泛舟饯之蕃用九日韵作诗要莫及徐丞同赋以送潘
870,奉和九月九日登慈恩寺浮屠应制
818044,九月廿三夜酒后作明日越园南返矣
45076,九月
430441,九月上越王台二首 其二
310288,感事述怀·九月犹絺绤
765355,九月二十日醉后作四章 其一
459488,九月十一班中无钥开匮，不得取书，作诗遣闷十首 其七
372262,阅古堂前植菊二本九月十八日花犹未开因以小诗嘲之
100938,去岁九月二十七日在黄州生子名遁小名干儿颀
404898,霜叶飞·丁酉九月北投登高，同蔼麓絜生渔叔，用清真韵，兼呈醇士寥音二公
268103,减字木兰花·九月廿三夜营睡不成，枕上口占寄岚屏
930402,九月初作
1074598,宣和元年九月十二日赐宴联句
1199382,诗二十五首 其十 九月十八日夜云林右英夫人作
991736,九月十六日自许昌回至京师胥平叔宋中道迓于郊外
874554,九月初十日值宿玉堂七绝 其六
414602,甲申九月钞顺德蕲春两黄先生咏怀诗注成偶效其体九首 其三
1045628,九月九 其四
1172712,九月一日过孟十二仓曹十四主簿兄弟
147458,九月七日江上阻风
288236,倒犯·癸亥九月一日赋京师鸭炙
998549,九月八日次韵沈虞卿一首
248081,临江仙·九月菊花
1162213,九月十日郡楼独酌
600532,九月望日郭司马毕冢宰魏司徒枉小斋赏菊因用杜韵赋谢
1134390,九月初八日
1216757,九月六日宿宝集寺
702197,九月廿日白云遣兴二首
772355,梅伯言、马湘帆、汤海秋、王少鹤四农部，何子贞编修，陈颂南、苏赓堂、朱伯韩三侍御，叠次召余同亨甫为觞宴之乐。九月二十六日，复集蒹葭阁；盖丙申年入都，伯言、湘帆置酒处也。诸君各以诗文见赠，余行有日，辄成七律数章酬别 其四
754975,戊寅九月记异
1206879,九月一日清溪道中二首 其一
961633,九月赴郡燕旄节适至
261447,黄菊集句·九月欲将尽
118765,闰九月重九与父老小饮四绝
696338,九月客至齐云山登高用东泉韵二首
187034,九月十日晴
985557,九月望徙坐冬窝 其二
572364,九月二十九日同罗服卿及社中诸兄弟登高二圣寺 其一
514903,九月六日今上登极礼成听诏次韵
384192,九月十日闻城中雨雹，是日为寒露节
232239,九月七夜喜新凉
413717,九月再自武昌下金陵回无锡重还武昌江上作
641703,九月十四日上亲策试赐膳华盖殿西庑下以大行皇后丧设酒不荤
1195820,九月十一日寄陈郎中
1241881,九月廿七日
1169545,闰九月九日幸总持寺登浮图应制
1208126,九月十九日京东门与董右军诸公别至通州还寄在京朋游
1167729,奉和九月九日登慈恩寺浮图应制
493091,九月二十五日有传秋闱两榜至书舍见思永杨植以诗中乙科喜乡闾之有人学业之丕振因赋三绝以自释 其一
580517,弘治五年九月八日司空戴先生召诸公为白去寺之游归途间张靖州有九日遣怀之作遂次其韵十四首 其七
1122676,九月十八日夜泊刘郎浦
329504,九月二十三日过黄家岭望行春门有感
263728,菩萨蛮·丁巳九月病中有感
286278,卢龙塞·策马九月卢龙道
559422,李思准九月诞辰寄一律为寿
1220847,记忆先亲复斋先生诗二首 其一 九日初度先父生宋淳祐己酉九月九日
705618,戊寅九月初三日奉谒少师高阳公于里第感旧述怀三首 其三
590687,甲寅九月十日登神光山纪事
893727,九月二十二日晚秋曲宴
673887,九月六日早发新化
1066988,凤凰山泉石胜绝去城无几里而前此未有知者偶因休吏与文中良器二士访寻得瑰奇卓绝之观于荆棘草莽间相顾大笑因崇基趾筑亭榭疏泉甃池为登临啸咏之地九月二十五日游陟归夜作小诗十首 其二
303936,九月二十九日同散原觚庵复园絜先游七里泷
129766,偶阅夷坚志见梁郑公有九月梅化诗因复次韵
589637,贺潢涧公九月十六初度
381183,九月十五夜月下作
603044,闰九月八日承茂才元生偕乃兄弟侄诸文士携酒见过因订九日之会
1066993,凤凰山泉石胜绝去城无几里而前此未有知者偶因休吏与文中良器二士访寻得瑰奇卓绝之观于荆棘草莽间相顾大笑因崇基趾筑亭榭疏泉甃池为登临啸咏之地九月二十五日游陟归夜作小诗十首 其七
661876,壬戌九月十八日白湖镇遇风舟危甚赋此纪事
151930,九月望夜与诗僧可久泛西湖
1161063,奉和九月九日登慈恩寺浮图应制
428368,癸酉九月九日，予自京飞乌鲁木齐，先至高昌、交河故城，再到伊宁，越天山至库车，即拟去喀什，登昆仑山感赋一绝。九月十九日于库车改定
428368,癸酉九月九日，予自京飞乌鲁木齐，先至高昌、交河故城，再到伊宁，越天山至库车，即拟去喀什，登昆仑山感赋一绝。九月十九日于库车改定
705263,菩萨蛮 丁巳九月病中有感八首 其二十
320159,九月十八日作
867105,虞美人 九月游虎丘
825370,九月二十一日出山海关赴秦王岛
1248985,国宝照磨有平野轩在扬州城郭中今寓吴十许年矣至正丙午九月十一日在开元寺为写此图并诗以赠
1105948,嘉泰改元桂林大比与计偕者十有一人九月十六日用故事行宴享之礼作是诗劝为之驾
1128364,丙子九月陈村避地三绝
849820,甲戌九月日有食之纪异三十韵
748542,庚戌九月自吴返越嘉禾道中 其二
897406,九月十二日入南山憩一民舍冒雨炙衣久之
362696,九月初二日晓雪
283437,浪淘沙·九月十九日石工约集词社同人为展重阳之会
80993,九月十八日至山园是日颇有春意
642747,拟唐人十二月乐章并闰月 其九 九月
606259,九月既望陈勋卿招同穆王二令公登龙津逍遥楼望西樵诸山既暮移酌于东轩就月漫赋二首 其二
981124,九月八日游涡
781010,九月十三日同友人高于仲自省回涂中遇雨 其二
390124,九月九日过德州不及登东壁楼于城西旅店拾纸作诗属鲁瞻留题楼上
1204559,清平乐 九月回至隆兴
1147924,九月菊花咏应制
740383,九月十二日集范湖草堂补作重九有赋
674439,九月三日芙蓉与菊同开
791001,九月既望蔡氏景贤书屋张筵赏菊率成七绝六章并五排一首 其五
287192,烛影摇红·九月望后独游北海，步谭篆青九日登高韵
555790,嘉靖乙巳年八月十二日出狱归九月十一日复逮系途次有作 其二
968280,醉落魄/一斛珠 用韵赋九月见梅
136071,雪·丙午九月才入冬
160959,九月到白石先妣茔所
836807,九月十七日闻斗六失陷、总戎殉节，感赋二十韵
944557,九月一日戴时可酒边 其一
572306,九月二日盛集诸公郊游至二圣寺仍用散木韵 其八
940493,与友人中元作别九月十日复会中间节物不得共观追酬所愿有今夕在聊成小诗谢之
331670,九月十四夜月蚀
107194,九月初四日大风雨近重阳无酒夜成
765356,九月二十日醉后作四章 其二
80992,九月十八日夜梦避雨叩一僧院有老宿年八十许
1155789,九月八日酬皇甫十见赠
855230,浣溪沙 其十二 九月十二夜务亭作
1167289,闰九月九日幸总持寺登浮图应制
573752,九月朔过王庄偶读高适闭门无不可何事更登高句漫成三绝 其二
365879,九月初三夜招袁重黎柯巽庵梁节庵王晋卿诸君小饮和节庵韵
928226,九月十二日折菊
193602,喜雨韵·江南九月菊花香
839393,九月初六日寄怀刘石香二首 其一
330251,八月十一日九月六日二十四日三梦过赵仲强家坐中人物笑语
948026,辛未九月晦日
226193,甲午九月留浮梁与郑瑞卿吴可翁方玉父方可大
1103957,九月廿一自虎林回同程晓崖游梅岩
838376,丙申九月初三日有感
896809,九月十八日梦中作闻雁诗
178315,九月十四日登崇山晚归
816791,九月十四夕梦中作
1250839,钱唐赠别陈秉彝归天台约九月来吾邑故末及之
13382,奉酬宣上人九月十五日东亭望月见赠因怀紫阁旧游
1088263,九月六日早发潭溪夜登云谷翌旦赋此
828790,九月四日李庄口占
1216752,九月八日陪危太朴偕梁九思游城南三学寺万寿寺 其二
928220,乙丑九月三日晚久雨骤晴西南新月如玉钩重阳以八月置闰菊花粲然满园喜甚作一绝记之
972073,九月廿一日雪书呈进之
80979,九月十四日夜鸡初鸣梦一故人相语曰我为莲华
843143,辛未九月十七日文文忠师祠生日作
107192,九月初一日·满城风雨夜初长
459914,九月十七钓茶港三首 其三
1170967,九月于东逢雪
156097,子瞻在惠州以十月初吉作重九和渊明已酉九月
272980,九月登凤岭同何毅孙吕芳子赋
55198,边词·九月未授衣
1005712,九月十四日夜枕不寐起视明月清寒著人泠然有欲仙之意
770544,壬子八九月读书题词十五首 其三 谢宣城集
914552,贺皇太子九月四日生辰二首 其一
70558,九月晦日王村道中
146352,戏马台·九月初九日
909910,又九月十四日登秋风阁以馀霞散成绮澄江静如练为韵分得馀静二字 其二
1041465,黄寺丞九月十三日见寄
302403,九月二十五日京师蝗
106482,重阳后绝句·九月重阳菊未开
770546,壬子八九月读书题词十五首 其五 初唐四子
1163794,九月十日即事
918368,九月十六日出郡登舟如钱塘十七日舟中杂兴 其一
918371,九月十六日出郡登舟如钱塘十七日舟中杂兴 其三
1070951,老钦阇黎以政和七年九月十七日夜圆寂趺坐如生道俗叹仰邑丞向仁叔作偈赞悼因次其韵 其一
1134386,九月十二日得蟹小酌
822659,浪淘沙慢 其二 九月下旬，西山之战，两军伤亡，过当客有述其惨状者。复次清真韵
1147923,九月十五日夜宿郑尚书絪东亭望月寄杜给事
191104,和宁国守沈察院九月严霜十五韵
982418,九月八日夜大风雨寄王定国
1211096,十二月乐辞十三首 其九 九月
667031,九月廿五夜枕上闻雨寄示兴仁兼简允庄弟
1169692,奉和九月九日登慈恩寺浮图应制
756212,辛酉九月十九展重阳日从郑斋夫子登陶然亭感赋二律即次夫子重九登遥集楼韵
616881,九月过绿乡亭见黄菊盛开有感
810237,辛丑九月看菊有感
905320,嘉祐三年九月受命来岭外七年十一月得请知济州感恩顾己喜不自胜留诗四章以志岁月 其三
1231580,九月八日以满城风雨近重阳分韵得雨字
456690,九月某日杂诗六首 其五
556063,九月晦日钧州公馆见菊
906461,临江仙 次韵富季申九月菊未开
746881,九月同琉球郑生赴通州作
438852,辛未九月二十一日雪
920288,九月中曾题二小诗于南溪竹上，既而忘之，昨日再游，见而录之 其一
1070560,庭菊烂开招子我共赏而空无酒饮闻瓜洲酒美遣酤数升殆如灰汁戏作三绝句因以酬九月四日戏赠之作 其二
183484,己未九月予赴鞫御史闻
1238053,济川阻雪九月二十七日客况四首 其二
833821,唐多令 道中二十二岁初度志感，时九月五日
173931,九月二十日率赵彥和王平叔刘谊夫游栖岩寺彥
891932,闰九月晦日登舟二首 其一
930393,九月十一日疾小间夜赋二首 其一
639594,失调名 九月豫章道中
1112853,九月末风雨初寒
818043,越园离旧京八年矣甲戌九月重来存问故人经旬而归留别社园诗以送之
990774,九月二日梦后寄裴如晦
1123725,九月一日晨起风物凄然不胜怀远之思作五首寄和父憨申并烦转致湖池二州也
772354,梅伯言、马湘帆、汤海秋、王少鹤四农部，何子贞编修，陈颂南、苏赓堂、朱伯韩三侍御，叠次召余同亨甫为觞宴之乐。九月二十六日，复集蒹葭阁；盖丙申年入都，伯言、湘帆置酒处也。诸君各以诗文见赠，余行有日，辄成七律数章酬别 其三
493092,九月二十五日有传秋闱两榜至书舍见思永杨植以诗中乙科喜乡闾之有人学业之丕振因赋三绝以自释 其二
184183,和陈彦升学士九月校书怀旧之作
60672,九月八日郭南山亭宴集
630921,须识以端阳入岭订予九月还山霜露已降消息渺然病中多感纪之以诗
873947,醉蓬莱 寿七十一九月十八
1026236,九月十日游象之葆光亭寄曼叔
386998,九月八日灞桥戏题
1133017,九月八日持螯
547714,九月十三夜扈从功德寺陪李渐庵大司寇王忠铭徐检庵二学士登金山对月二首 其一
755658,戊辰九月将从楚游留呈两大人兼别弟妹 其三
901889,九月十四日登崇山晚归
820088,九月初三夜遣怀
1161942,奉和圣制九月十八日赐百寮追赏因书所怀
477991,九月十四日集东麓亭
1144156,谢叠山先生己丑九月被执北行闽士以诗送之倚歌以饯
245513,和通判九月望日始见菊花
719832,后秋兴八首九月初二日，泛舟吴门而作 其四
655818,九月壬午承王九鼎同省石井先陇罢宿惠民药局丙丁夜虚堂隐几偶思及之因成此句
156988,点绛唇·九月传杯
1134385,九月八日宾旸携酒西斋晚登秀亭次前韵 其二
619853,九月梅花同子明诸子赋 其一
1070701,九月二日自公馆迁居双泉风物幽胜作双泉诗二十韵
426097,丙辰九月上旬重访吴门陪同杨民老叶咏老畅游园林拙政园二律 其二
353938,寄卢中甫·九月都门风薄衣
1038110,九月十日西园会范内翰李紫微已下诸公惠雅章谨成拙诗仰答厚意
524192,闰九月繁台酬寄常邓州前御史兄
330969,九月二十八日枕上
665242,壬辰九月二十二日再入讲筵进讲得诗三首 其一
458136,贺新郎　九月二十一
80998,九月二十八日五鼓起坐抽架上书得九域志泣然
