103300,九月都下对雪寄永叔师鲁
343027,九月二十二日黄县道中遇雪
566918,九月朔与诸友醉某子长安邸舍得花字
459490,九月十一班中无钥开匮，不得取书，作诗遣闷十首 其九
1066989,凤凰山泉石胜绝去城无几里而前此未有知者偶因休吏与文中良器二士访寻得瑰奇卓绝之观于荆棘草莽间相顾大笑因崇基趾筑亭榭疏泉甃池为登临啸咏之地九月二十五日游陟归夜作小诗十首 其三
1077368,九月十四夜月蚀
343023,九月八日离虔
1167758,九月十日即事
988040,九月二十九日迩英开讲忝预末班讲退小集玉堂之庐即留宿直因赋唐律呈诸讲官
424570,九月朔日，飓风大雨，楼望看水
230468,蝶恋花·九月重湖寒意早
1085584,九月十五夜
81258,记九月二十六夜梦
688349,成化丙午九月十一日偕大参李德馨年兄陪宁殿下谒献王陵联句二首
338616,惜秋华·九月十四日周屺公先生招饮寓园，余以生日未赴，次韵奉柬
558558,九月廿二日家人插榴花梨花口号
420765,忆旧游 九月十八日独游惠麓，寄畅园
921604,九月十五日，迩英讲《论语》，终篇，赐执政讲读史官燕于东宫。又遣中使就赐御书诗各一首，臣轼得《紫薇花绝句》，其词云：丝纶阁下文书静，钟鼓楼中刻漏长。独坐黄昏谁是伴，紫薇花对紫薇郎。翌日各以表谢又进诗一篇，臣轼诗云
956819,九月三日宿胥口始闻雁
819963,乙亥秋九月至旧京视散原先生日与心畬叔明立之伯夔君任羹梅过从寥志强志贻先询先诸弟自津沪来旧藏五十馀年陈酒由杭至京连日聚饮赋诗属和 其三
1250696,九月廿三日同德基宿城西王庄敏公故宅有作
292400,浪淘沙·壬子九月暂归武昌，赋寄内子上海
528416,九月二十六日同贾广文刘举人任贡士高夔府先生宅内赏菊四首 其三
950670,九月十四日夜月明如昼敬想合宫竣事志喜而作
428051,木兰花慢 傅抱石以一九六五年九月廿九日午后一时零七分逝世南京，赋此志悼
618,九月九日登龙山
517067,丙申九月十六夜寓琴川客馆梦亡徐氏女兄
86592,丁酉九月十四日黄源岭客舍题黄瀛父近诗
53302,九月十七日闻雁寄董庄
79910,若耶溪上·九月霜风吹客衣
747895,九月二十日潘德舆招饮海山仙馆即事有作 其四
40516,中兴歌·九月秋水清
828041,九月以事至天津季湘苕雪治芗子安楚生八兄寥志二弟皆自京来会适逢九日就市楼小饮即别去途中感赋二首 其一
1248140,九月十六日陈逸人旭访余蜀山中明日将还武塘因赋此送别
719833,后秋兴八首九月初二日，泛舟吴门而作 其五
1112614,九月末大风一夕遂安置火炉有感二首
379541,九月六日驾幸蔡王府
104421,九月十一日下昭亭舟中
390103,九月初二日奉神宗显皇帝遗诏于京口成服哭临恭赋挽词
934937,九月六夜梦中作笑诗觉而忘之明日戏追补一首
387136,鹧鸪天·九月初三夜宿华清，用香山旧句成解
429329,九月十六夜雷雨枕上成此
1250888,九月八日灞桥戏题
580174,成化丙午九月十一日偕大参李德馨年兄陪宁殿下谒献王陵联句二首 其二
1228926,九月晦日二首 其二
323895,朝中措·九月末水仙开
1215959,九月一日还自上京途中纪事十首 其三
777518,九月十五夜苦雨
100357,九月中曾题二小诗於南溪竹上
116511,九月十二日入南山憩一民舍冒雨炙衣久之
783845,乙亥九月九日纪事诗四首 其一
1061109,九月六日驾幸蔡王府
80997,九月初作
35186,和徐舍人九月十一日见寄
522243,九月三日见梅
790999,九月既望蔡氏景贤书屋张筵赏菊率成七绝六章并五排一首 其三
293173,甲午九月出都
845623,千秋岁 庆生日女受聘九月十七
459226,九月四日醉作与肖看
1137890,次宋省斋九月十日
1061583,九月八日雨作
369855,九月二十日
646775,九月望夜
1175256,奉和九月九日登慈恩寺浮图应制
842882,瀛台侍直七月至九月得十六首 其九
1103950,辛丑九月十二与芳洲留宿雅山堂岁且周矣芳洲再往赋古诗十二韵奉寄壬寅九月十一日也
1103950,辛丑九月十二与芳洲留宿雅山堂岁且周矣芳洲再往赋古诗十二韵奉寄壬寅九月十一日也
1116590,九月中曾题二小诗于南溪竹上，既而忘之，昨日再游，见而录之 其二
573751,九月朔过王庄偶读高适闭门无不可何事更登高句漫成三绝 其一
593343,燕京九月末菊已尽矣范景伯署中方盛开同韦纯显过看得花字
383392,九月廿一日同赵少虚文学李前峰司马饮宫秀才山房对菊
879539,九月十八日夜梦赏春某氏园池赋春词二首题柱 其一
1066990,凤凰山泉石胜绝去城无几里而前此未有知者偶因休吏与文中良器二士访寻得瑰奇卓绝之观于荆棘草莽间相顾大笑因崇基趾筑亭榭疏泉甃池为登临啸咏之地九月二十五日游陟归夜作小诗十首 其四
472344,九月三日方别驾携酒殽见过因怀徐荆州
816145,甲戌1814九月廿一夜予方有秋兴适奎垣以诗见贶清话更阑叠次其韵感赋二律
1109296,九月十日赵令园饯送王汝州汝州留诗二篇次韵
306294,九月七日游玉泉山登妙高塔
811032,庚戌九月自吴返越嘉禾道中
1034594,九月丁亥秋祀毕劳农北郊苏提干以疾不往以诗见寄因次其韵
96657,九月二日发舟快阁下
1170411,九月十日雨中过张伯佳期柳镇未至以诗招之
1218888,九月一日寄谢太守
58897,云中九月八日同张年兄字川登高
272294,丙辰九月上旬重访吴门陪同杨民老叶咏老畅游园林拙政园
938914,九月十一日挈浩同省先陇早起四山昏翳冲雾露涉水登山至山颠则日已东上澄空朗然下视村中雾犹蒙罩人烟桑柘皆不可辨戏成一绝
739921,九月十洲过津门出颂嘉草堂图属题依韵即送其南归次章末句兼怀欧舫湘灵诸君
1143905,九月初四日大风雨近重阳无酒夜成二首
468561,九月十八日天寿圣节
486264,追和柯丹丘所藏坡翁诗帖五首（洪武辛酉九月） 其五
731522,九月十日夜望云月偶书此数语
118136,九月十一日书事
107197,九月初八日·今年未见菊花枝
52495,闰九月燕子矶登高用寒字
787608,九月二日病赴睦州 其一
375534,九月十四日自寿
145925,发淮安·九月初二日
456688,九月某日杂诗六首 其三
914551,贺皇太子九月四日生辰二首 其二
153444,九月十日寄潘邠老
1005758,丙子九月陈村避地三绝 其三
232203,九月二十一夜梦至乱山丛石间出憩道傍拂石坐
832007,九月二十六日小妾举一男，坠地即绝。余年三十有六，尚无子嗣，怆然有感 其一
772357,梅伯言、马湘帆、汤海秋、王少鹤四农部，何子贞编修，陈颂南、苏赓堂、朱伯韩三侍御，叠次召余同亨甫为觞宴之乐。九月二十六日，复集蒹葭阁；盖丙申年入都，伯言、湘帆置酒处也。诸君各以诗文见赠，余行有日，辄成七律数章酬别 其六
748813,庚寅九月自苏州量移武昌留示诸生 其二
77971,九月十日如汉州小猎於新都弥牟之间投宿民家
939701,九月九日魏衍见过
991738,九月五日梦欧阳永叔
247891,高阳台·九月初三悼杨生作
21535,同卫尉崔少卿九月六日饮
1075423,九月十六日生日示内
322574,丁未九月赘成都盐茶道署呈外舅林西厓先生
574892,九月一日点易台新成登而观之又得一石如台漫赋
558988,九月十五日任公祖登凤凰台次李韵一首时公次日初度
407996,榕城九月用少陵登高韵
143991,乙酉六月十九日应诏言事九月一日去国
813635,九月八日同年陈范川太史招同梁一峰广文游光孝净慧二禅寺呈范川
1037564,九月十五夜北楼望太湖
857349,嘉泰改元桂林大比与计偕者十有一人九月十六日用故事行宴享之礼作是诗劝为之驾 其二
882675,九月二十七日夜大风雨顿凉偶作
1002126,九月 其四
470979,九月既望次瑞卿惜别诗
73942,九月·又向江头载夕晖
705267,菩萨蛮 丁巳九月病中有感八首 其二十四
684450,府治内礼贤堂落成桐冈君张宴于此以招郡之耆旧予固非其人幸奉杖屦兹九月八日吾辈亦就此供具少展谢私诗曰跻彼公堂称彼兕觥此之谓也乃即席赋诗四章
556966,九月骤寒二首 其一
1192210,九月十八赐百僚追赏因书所怀
604260,九月十二日儿孙扶侍登狮峰醉归放笔
905319,嘉祐三年九月受命来岭外七年十一月得请知济州感恩顾己喜不自胜留诗四章以志岁月 其一
686865,九月梅花同子明诸子赋
859912,又九月朔同诸将观石马桥
31267,乙丑岁九月在萧滩镇驻泊两月忽得商马杨迢
583455,宿九江城时九月五日也
304600,戊辰九月同公渚君适焦山登高宿松寥阁
1246838,东南山水瑰奇甲天下莫若天台匡庐三茅武彝予尝游焉其以温泉名者如三山之天汤句曲之汤水又尝游焉私怪句曲人颇以牲杀污辱之三山置士卒锔鐍虽不同句曲污辱为王公贵人禁不得一澡浴者黄山予乡闬之名山也距郡城百有馀里未尝一即焉以游癸夘九月某日狂风怒号滕六大作予游焉浴于池甑蒸汤沸其气如饙馏然内池限以石甃外池濒于溪流当水涨龙必潜泳易致湮塞盖地产丹砂故也与句曲三山特异虽知群仙饷以琼琳玉树珍禽缟鹤但恨诸峰巘崿千态万状不能悉睹
1217797,己丑九月抵金华旅馆和旧题诗韵
423314,九月登凤岭同何毅孙吕芳子赋
1041655,九月十四日于雍熙院为舅氏斋设作
388617,九月同集蔡翼皇太守来青亭
215390,乙巳九月登冶城作
970115,虞美人 其一 九月饮乘风亭故基
459485,九月十一班中无钥开匮，不得取书，作诗遣闷十首 其四
555933,九月节
874558,九月初十日值宿玉堂七绝 其三
92122,九月菊未花
914554,贺皇太子九月四日生辰四首 其三
125232,闰九月九日登高有感
75070,九月一日还自上京途中纪事
426096,丙辰九月上旬重访吴门陪同杨民老叶咏老畅游园林拙政园二律 其一
1118038,九月初作四首
928229,九月晦日作四首 其一
1144334,九月九日赏红叶
680815,九月望后雨雪与同寅分韵赋诗效禁体
99903,七年九月自广陵召还复馆於浴室东堂
452324,辛卯九月二十三日游云居寺步嘉庆帝元韵
383101,九月十三日大雪唐君平文学入对过访有诗见投赋赠
310949,烛影摇红·壬子九月辟地至渝
784709,九月七日作
1181845,同卫尉崔少卿九月六日饮
1005117,九月初十日山房午睡恍见梅枝已吐白矣惊喜而作
791000,九月既望蔡氏景贤书屋张筵赏菊率成七绝六章并五排一首 其四
835414,齐天乐 其四 戊午九月同王咏斋、张子高仿行宋文潞公，丙午同甲会
1028700,九月八日游报本寺
1128207,庭菊烂开招子我共赏而空无酒饮闻瓜洲酒美遣酤数升殆如灰汁戏作三绝句因以酬九月四日戏赠之作
428456,癸亥九月偕程君颂嘉、王子云轩、顾子经笙、吴子斡卿游青山寺纪之以诗三首 其三
1123818,九月五日具草酌同彦博审知成父集于普宁山半之亭作诗二首
728616,己酉年九月自滇归闽，同人赠言惜别，途中赋此答之
1141363,于杭州九月送袁太初赴宁海教官
815713,九月四日同年卢雅雨都转喜余来赴登高之约即放艇真州邀同年戴通乾来会是日同饮雅雨官舍期以九日游平山堂通乾得诗二首即次其韵
50542,九月八日旅中夜怀
830608,烛影摇红·九月望后独游北海，步谭篆青九日登高韵
62557,乌栖曲·九月过姑苏
770552,壬子八九月读书题词十五首 其十一 韦苏州集
756634,九月八日送友之越
414605,甲申九月钞顺德蕲春两黄先生咏怀诗注成偶效其体九首 其六
429678,九月八日集无边华庵饯浣华韵伯作画余名之曰秋槎图并赋三绝句 其一
555405,林云山盆梅九月盛开魏竹溪有诗次韵二首 其二
812428,九月四日重至东阳寄杭诸友
1164423,奉和九月九日登慈恩寺浮屠应制
264289,甲寅九月南堂先生归里计日抵家见忆代书
492274,至正乙未秋九月宪司潘郎以巡历来吉省掾马郎以徵籴过赣于其归各赋赠一首 其二
1071676,九月十五日济川诸公同游因成长韵
1106426,九月二十九日到思溪庄避人事十月初四日过生朝方归初三日早恕子遣人来送酒食并词二阕因成唐律二首
313257,声声慢·九月六日承伯纯吏部招同姚子梁太守、陶矩林司马、桂竹君秋曹集沙萝浦绿雪楼
478919,九月一日游悬鼓崖
719830,后秋兴八首九月初二日，泛舟吴门而作 其二
1149828,酬郑从事四年九月宴望海亭次用旧韵
460450,减兰　九月十三 其一
581546,城市山林亭会酌二首时九月六日也亭前禾甚丰 其二
1236564,记忆先亲复斋先生诗二首 其一 九日初度先父生宋淳祐己酉九月九日
1026642,次韵和相公九月八日所赐诗
580173,成化丙午九月十一日偕大参李德馨年兄陪宁殿下谒献王陵联句二首 其一
928227,九月十四日夜鸡初鸣梦一故人相语曰我为莲华博士盖镜湖新置官也我且去矣君能暂为之乎月得酒千壶亦不恶也既觉惘然作绝句记之
540832,九月庭下杏花
81003,九月二十三夜小儿方读书而油尽口占此诗示之
580518,弘治五年九月八日司空戴先生召诸公为白去寺之游归途间张靖州有九日遣怀之作遂次其韵十四首 其八
705266,菩萨蛮 丁巳九月病中有感八首 其二十三
1237538,九月八日赋二种芙蓉二首 红芙蓉
76201,九月一日夜读诗
720400,水龙吟 九月八日宿清风店
413101,一九六六年九月廿二日红卫兵勒令归乡内子淡俜结装相随旋又奉令返回原职计居乡一百天 其七
740633,九月十三日约王怀祖史文量陈梅岑何数峰及侄玉川为西山之游
1223609,九月十八日黄菊始开时且禁酿谩成示德衡弟
10783,宿湘江·九月湘江水漫流
825016,九月十五夜月下作三首 其三
552426,洪武癸丑九月十八日为外兄集贤大学士张东谷贺八十 其二
1120644,九月十六日示内二首
417294,唐多令  乙丑九月登黄鹤楼
516396,九月一日过长沙
329708,秋晚·九月西风未肯凉
736698,九月
595478,九月客至齐云山登高用东泉韵二首 其一
122215,九月八日泊池口
768340,拜星月慢 九月十五，月夜怀去年湖上之游
963470,九月四日过增口道中
337916,九月山丹·数本山丹似晓霞
1063337,壬辰九月不雨至巳年三月穑事去矣今夕辄复霈然喜甚卧作此诗
390134,九月望日得石斋馆丈午日见怀诗次韵却寄
12978,渔父·八月九月芦花飞
735154,九月二日同马允彭篯侯董采载臣陈鏦大始严鸿逵赓臣查枢左旋大儿葆中从子至忠放舟东游
222324,秋兴·穷秋九月西风高
965270,九月八日寄懒窠
245223,九月望日同君谟侍郎泛西湖夜饮
825683,孝胥以戊戌九月出京至庚戌七月入京凡十三年有诗纪之辛亥九月出京至癸亥七月入京亦十三年且出京皆以九月入京皆以七月悟而嗟叹自念生逢世乱穷老无所就复为此诗
825683,孝胥以戊戌九月出京至庚戌七月入京凡十三年有诗纪之辛亥九月出京至癸亥七月入京亦十三年且出京皆以九月入京皆以七月悟而嗟叹自念生逢世乱穷老无所就复为此诗
825683,孝胥以戊戌九月出京至庚戌七月入京凡十三年有诗纪之辛亥九月出京至癸亥七月入京亦十三年且出京皆以九月入京皆以七月悟而嗟叹自念生逢世乱穷老无所就复为此诗
301984,九月初六日雨中读陶集
383659,九月十三夜扈从功德寺陪李渐庵大司寇王忠铭徐检庵二学士登金山对月
1101477,九月十日府委撞点巡铺马上得四绝 其二
972068,九月十一夜雨中读吴梦与诗书以示之
303279,虞美人·辛亥九月作
719835,后秋兴八首九月初二日，泛舟吴门而作 其七
80988,九月七日子坦子聿俱出歛租谷鸡初鸣而行甲夜
381532,九月初一日晨起
646126,九月八日旅中夜怀
96640,九月一日晨起风物凄然不胜怀远之思作
1112828,九月下旬有作二首
972070,九月十六日文兴折赠绿萼梅数枝花多而甚香非寻常梅花比也
158981,九月十日龙兴寺饮饯蹇磻翁赴梁门酒半题名南
1141274,九月西城无涧同陈道士衡上人 其一
304445,乙亥秋九月至旧京视散原先生日
414600,甲申九月钞顺德蕲春两黄先生咏怀诗注成偶效其体九首 其一
492062,九月三日由长坑入南山寺将过里良暂憩合龙寺闻饶兵已逼新安二日矣
680520,闰九月九日榆林写怀
263187,辛丑九月十三夜伏枕不寐忆前年咏菊诗款惬意
104416,九月一日·授衣念祖节
358312,九月朔夜闻雨
581819,九月朔日
171227,甲戌九月日有食之纪异三十韵
719640,九月望后梅已数花先黄菊而发喜赋
451674,临江仙 九月菊花
747893,九月二十日潘德舆招饮海山仙馆即事有作 其二
1038903,九月五日夜出盘门泊于湖间偶成密会坐上书吴黄尉
521804,九月十四日赵尔锡西庄泛舟和涯翁韵 其一
413813,无题丙辰九月
1119979,九月一日戴时可酒边
911518,丁卯九月十夜观月
138250,水调歌头·九月二十六
985808,九月一日睡起
1252094,九月节后希石林公邀游西岩分得须字
109770,九月梨花
433129,九月朔日倩画工绘万山寒柏图，题四诗以见志
295560,九月八日偶成
580127,后九月九日
466445,蝶恋花　九月一日梦起作二首
265976,持灯省菊·九月尖风十月霜
905022,水调歌头 寿丘漕九月初三
821680,虞美人 九月蟹肥而无菊可赏，书此寄远人
528147,九月四日刘子见过二首 其二
1169271,奉和九月九日登慈恩寺浮图应制
601378,九月署中宴集兼寄鸣吾弟
508715,景泰壬申九月初六日，经筵讲退，蒙召至文华殿。皇上负扆而立，面垂顾问，赐楮币一千贯。复遣中官赐雪花梨及鲜果一笼，荷恩感激赋此以识
1222326,僧传古坐龙图严东平所藏至元二年秋九月张签省耀卿处观七年闰十一月甲戌公退马上偶得时秋苦旱冬天无雪
1086055,九月一日自道场山如临安周德载夏廷茂自菁村乘舟来访既别寄以小诗
1120178,和通判九月望日始见菊花二首
815967,九月十三日同友人高于仲自省回涂中遇雨
1135766,九月雪十月雷记异
1005166,丙子九月陈村避地三绝 其一
300865,甲申九月钞顺德蕲春两黄先生咏怀诗注成偶效其体
685543,乙卯九月十四之夕徐海石囧卿尹冲玄令尹温瑞明少府陈美用民部招集天坐轩泛月作三首
1227156,九月十日接驾回因游香山寺饮于西厓之上酒酣呈主人
1005167,丙子九月陈村避地三绝 其二
492273,至正乙未秋九月宪司潘郎以巡历来吉省掾马郎以徵籴过赣于其归各赋赠一首 其一
139674,九月丁亥秋祀毕劳农北郊苏提干以疾不往心诗
402037,初发上海己卯 九月
960559,九月十日晴
772352,梅伯言、马湘帆、汤海秋、王少鹤四农部，何子贞编修，陈颂南、苏赓堂、朱伯韩三侍御，叠次召余同亨甫为觞宴之乐。九月二十六日，复集蒹葭阁；盖丙申年入都，伯言、湘帆置酒处也。诸君各以诗文见赠，余行有日，辄成七律数章酬别 其一
685227,九月九日寓九江时户部李时雍同年预约游庐山以是日雨作中辍时雍复遣人送酒侑以一绝因走笔戏答四绝
603034,九月三日承黄茂才君甫元玉伯安携李英登海西台
51038,庚戌岁九月中于西田获早稻
345339,壬辰九月不雨至巳年三月穑事去矣今夕辄复霈然喜甚卧作此诗
120729,九月二日·灯火一樽酒
457462,九月三十感恩 其一
586406,九月六日赵太守丹山游圭峰分韵得重字
823235,酹月 庚申九月十三，方鹤叟、邓约园、林山公、邓休庵、胡玉叔、龚慧修、唐仲威、龚向农、李季讷招同宋问琴、向伋公，泛舟百花潭，憩二仙庵，归饮唐氏桐花馆。越日，问琴、约园、鹤叟以诗词见寿，遂依西麓此调纪胜，因录质政
839441,丁亥九月静圃主人留饮玩月，即席成二律用题瑞莲图韵 其一
583153,九月九日寓九江时户部李时雍同年预约游庐山以是日雨作中辍时雍复遣人送酒侑以一绝因走笔戏答四绝 其二
627231,九月十五夜芦潭限韵
702429,九月廿八日黄司训汝彝雨中留宿联句二首
834530,浪淘沙 九月十九日石工约集词社同人为展重阳之会。病不克与，走笔赋呈，不耐苦吟，聊慰猎心耳
958377,甲寅九月末雨至十月二十三日得晴闻是日六飞进狩诸将告捷
670823,九月同殿卿登南山 其四
69987,得道阳·九月苍天爽气高
524170,九月晦日西南陂再泛二首 其一
846677,朝中措 其四 咏九月桃呈□晋侯
347267,九月廿五夜小雨成雪
214,九月十日偶书
1048996,和邓温伯内翰九月七日约游北高峰
667930,府治内礼贤堂落成桐冈君张宴于此以招郡之耆旧予固非其人幸奉杖屦兹九月八日吾辈亦就此供具少展谢私诗曰跻彼公堂称彼兕觥此之谓也乃即席赋诗四章 其三
1124252,九月十一日雪二首
309071,九月初七日同人集塔江金山寺
414606,甲申九月钞顺德蕲春两黄先生咏怀诗注成偶效其体九首 其七
963005,九月十七日夜度蔡道岭宿弥勒院
580516,弘治五年九月八日司空戴先生召诸公为白去寺之游归途间张靖州有九日遣怀之作遂次其韵十四首 其六
149675,拥翠楼·淳熙元年九月尾
604500,九月七日雨中李伯开欲过小园用前韵以诗促之
825285,九月二十四日葬弥明于苏州木渎米斗山
699335,九月初五日得三弟京闱第三报志喜仍用散木韵践前约也
1247509,九月晦日见菊
466257,九月二十二梦见椒子幼株，欲掘种故家后窗下，作诗曰：异日小窗读周易，可从窗内一抬头。而觅锄不得，惶然遂醒。思梦里故家，乃十馀年前景，久已荡然，无复种树之隙矣；屋亦为姑母加建久居，并无可归之地矣。因足成篇，更补一首。梦中句云云，盖现居窗外有孤树，读书倦处，辄举目相对耳
503755,九月二日见菊蕊尚青偶赋
123334,九月五日晴暖步后园
80991,九月三十日登城门东望凄然有感
914555,贺皇太子九月四日生辰四首 其二
496955,部饷至京引见皇极门时戊辰九月五日二首 其一
1183601,奉和九月九日应制
203941,又九月朔同诸将观石马桥
699348,九月二十九日同罗服卿及社中诸兄弟登高二圣寺
748812,庚寅九月自苏州量移武昌留示诸生 其一
458416,零六年九月三十夜石人生日，共饮湖南酒家，醉中苦吟作。一诗之成，乃时逾二刻，非苦吟而何。盖予中心有不吉语，往复欲以避之耳
667929,府治内礼贤堂落成桐冈君张宴于此以招郡之耆旧予固非其人幸奉杖屦兹九月八日吾辈亦就此供具少展谢私诗曰跻彼公堂称彼兕觥此之谓也乃即席赋诗四章 其二
783783,戊辰九月九日举顺天乡试
1022016,九月望夜招处士林君泛湖玩月
842889,瀛台侍直七月至九月得十六首 其十六
1042187,九月二十五日召赴后苑观稻
812602,九月二十日潘德舆招饮海山仙馆即事有作
107191,九月二十五书事
769044,长亭怨慢·九月晦日
457098,九月五日作
372883,九月四日会安正堂
918369,九月十六日出郡登舟如钱塘十七日舟中杂兴 其五
96649,九月十三日雪
467967,九月某日杂诗六首
1180286,忆长安 九月
427017,虞美人·辛亥九月作
572302,九月二日盛集诸公郊游至二圣寺仍用散木韵 其四
736474,九月菊下计友人去程
495501,甲辰九月感怀 其三
1197216,庚戌岁九月中于西田穫旱稻
1154366,九月八日
1048685,九月十八夜宿莱州海庙夜分登亭望月观海呈伯温舍人
17226,酬郑从事四年九月宴望海亭次用旧韵
100617,和陶己酉岁九月九日
616528,九月初九父子同日下狱十一夜传有令勒余自裁守牢者将余严禁待命篝灯草嘱并封所著古书付儿续一律
336997,九月十六日示内
815884,和响泉叔父九月七日游惠山韵二首
913151,贺皇太子九月四日生辰 其四
547285,九月八日罗康洲宗伯黄仪庭司成田钟台宫谕习豫南司成会集朝天宫道院
251643,水龙吟·癸未九月十九观世音菩萨出家日赠外
572307,九月初五日得三弟京闱第三报志喜仍用散木韵践前约也 其一
134618,九月十一日夜雨宿营南园韩秉国寄酒兼见招以
107199,九月八日宾旸携酒西斋晚登秀亭次前韵
1215960,九月一日还自上京途中纪事十首 其四
388380,青玉案·乙丑九月十九日登粤秀山
635783,故友梁腾虎困死朱崖，就地藁葬。九月登高望远，凄然有存亡之感
1070561,庭菊烂开招子我共赏而空无酒饮闻瓜洲酒美遣酤数升殆如灰汁戏作三绝句因以酬九月四日戏赠之作 其三
1004575,蝶恋花 其九 月下有感
559031,九月八日同何靖卿侍御饮寿安寺
349148,九月二十二日秋举失利出门用中相饯夜步河上留别
1197536,己酉岁九月九日
608827,九月雪时在苑西楼，与四家兄、傅逊之、高正甫诸公同赋 其二
456517,江城子 壬午九月廿五晨不能起，卧近亭午，乃强起赴校课徒。涂中慨然有作
629361,崇祯庚午九月十九日为陈母八十佳辰其长君子含命某执笔而颂之
183027,九月十四日小会
158982,九月二十六日河上雪
1039585,九月四日会安正堂
340425,次韵朱子厚九月十一日见寄
769668,沁园春·忆丙寅九月八日为先子六十诞辰，客汪舟次先生家，先生张宴为寿。今己亥是日，从郡返里，追念往昔，不禁盛衰存殁之感焉。赋此兼示公有
