252154,生查子·九月随感
475676,余羁秣陵乞休累疏而格于新令郁郁之怀伏枕增剧遂效杜子美同谷体为秣陵七歌时丙戌九月既望也 其七
719983,戊寅九月初三日奉谒少师高阳公于里第感旧述怀三首 其二
122689,骤寒吟·九月奇寒前未闻
131481,九月一日戴时可酒边
843201,叔毅陪枚老雯青游青原山寺予未获偕雯青为图于帐额枚老有诗时光绪癸未九月也豫侄装标乞题感赋
923534,闰九月重九与父老小饮四绝 其一
948502,九月十八日夜忽梦作送王龟龄诗两句枕上足成之
530546,杂兴　癸夘九月也 其七
711672,月节折杨柳歌十三首 其九 九月歌
408494,甲午九月出都 其二
529212,九月朔晨起盆中再著数花适钱国辅自松城至为余作俨山玉舜图邑中数客继集而世安具扁舟西去矣即席再叠
275197,九月十六日广雅尚书宅集即席赠别樊按察分得佳韵
690797,墙角红梅，九月发花一朵，偶成四绝；时羁狱舍，用「盐」字
174172,类试院考校九月十日塔之八级中现宝光杨齐伯
547550,九月廿一日同赵少虚文学李前峰司马饮宫秀才山房对菊三首 其二
608308,高正甫出守袁州九月九日予偕家兄暨诸亲友能文者十九人饯之毗卢阁赋诗为别 其一
1113930,嘉祐三年九月受命来岭外七年十一月得请知济州感恩顾己喜不自胜留诗四章以志岁月
789666,九月中旬虞山顶茶庵杂诗
1208890,浴罢（九月七日平江作南使江浙之行）
1181542,奉和九月九日登慈恩寺浮图应制
667390,九月十一日北野携酌徐元大池亭宴集
842888,瀛台侍直七月至九月得十六首 其十五
940058,九月八日夜雨留智叔
170049,诗一首·蓝水秋来八九月
552018,九月七日署中小酌
432218,丙辰九月上旬重访吴门陪同杨民老叶咏老畅游园林拙政园二律
176153,九月八日寄懒窠
1215965,九月一日还自上京途中纪事十首 其九
92473,九月一日夜宿盈川市
157725,九月朔晨起忆故园晚易
272304,九月十一日与杨老同舟归乡
364003,九月吉日涧上望芙蓉因寻菊今岁特晚青蕊未作怃然有怀
338102,九月偕兄·萍踪聚散却无凭
221295,避寇·戊午九月十
430440,九月上越王台二首 其一
1062963,九月二十六日韩弼夫与十九娘赴官郢州之京山携家出饯于城南郝氏之园席上作小诗送韩儿侄咸和
433469,九月十四夕湖上
475670,余羁秣陵乞休累疏而格于新令郁郁之怀伏枕增剧遂效杜子美同谷体为秣陵七歌时丙戌九月既望也 其一
931347,记九月三十日夜半梦
1216972,九月朔迎驾大口
1206484,题耕织图二十四首奉懿旨撰 织 其二十一 九月
520002,九月见牡丹
922022,七年九月，自广陵召还，复馆于浴室东堂。八年六月，乞会稽，将去，汶公乞诗，乃复用前韵三首 其二
954094,奉答原甫九月八日见过会饮之作
308751,九月十二夜
530543,杂兴　癸夘九月也 其四
941745,卜算子 九月十八日寿徐子才
460438,蝶恋花　九月四日记梦中事三首 其一
56811,寄丰叔良·阿咸九月到
381601,孝胥以戊戌九月出京至庚戌七月入京凡十三年有诗纪之
228964,九月十六日出郡登舟如钱塘十七日舟中杂兴
1225506,九月十七日登清凉寺翠微亭故址
683551,九月闭关谢笔砚而千里故人讯问不绝又多以诗及者遂成此二律志苦且代荅
81002,九月初作·富贵功名未足云
701521,九月与内姻兄弟登龙冈答梁应民二首
435801,九月七日梦中作诗续以末后二句
155742,九月五日周少府卫秀才会饮吴波亭周有诗因次
1055623,八月十一日九月六日二十四日三梦过赵仲强家坐中人物笑语一一如平时因寄长句庶蒙藻思见酬因投一会面之慰也
486400,怀仙歌赐周玄初（永乐四年九月十九日。见周玄真《鹤林类集》）
930404,九月初作四首 其一
930400,九月下旬即事
580512,弘治五年九月八日司空戴先生召诸公为白去寺之游归途间张靖州有九日遣怀之作遂次其韵十四首 其二
1236104,九月二日揭晓仆以朔旦始得閒复成二诗录奉泰甫侍郎思齐御史本中都事道明敏文伯崇有志诸寮友
530540,杂兴　癸夘九月也 其一
972072,九月五日具草酌同彦博审知成父集于普宁山半之亭作诗二首 其一
305683,九月二十一日作
125987,秋游·九月风光虽已暮
459868,九月十五日快雨诗
1043493,九月十日赵令园饯送王汝州汝州留诗二篇次韵 其二
160396,九月十日游象之葆光亭寄曼叔
91934,贺皇太子九月四日生辰·日日龙楼问寝时
817984,九月初六日雨中读陶集
224464,水龙吟·年年九月西湖
454804,九月初三夜即景一个月无诗，今夜破戒
760850,九月二十九日十八叠韵寄伯瑶
800098,九月十五夜中庭闲步作
1003738,九月晦斋宿太一宫都监姚高士示刘长翁及汤仲能诸公唱酬诗轴因和韵二首 其一
1036024,雨中花慢 初至密州。以累年旱蝗。斋素累月。方春牡丹盛开。遂不获一赏。至九月。忽开千叶一颛。雨中特为置酒。遂作
705262,菩萨蛮 丁巳九月病中有感八首 其十九
849542,九月十九夜纪梦
510768,得林别驾书云去秋九月尝梦予于广信舟中兼示道路所闻
104419,九月五日梦欧阳永叔
819982,九月入觐敬述
180899,九月八日登高作重九奇父赋三十韵与义拾余意
157728,九月初十日山房午睡恍见梅枝已吐白矣惊喜而
505603,九月六日催菊赋得何字
484137,九月七日雨
1075887,九月十六日示内二首 其二
385299,是岁闰九月再汎
552833,九月二十七日早祀山川坛风云雷雨师坛随班行礼因过水濂洞而回
937677,九月八日戏作两绝句示妻子 其一
627261,九月六日归龙山同黄秉昭夜泊江上
506133,己未九月余新归灉江度构茅居甫成姻兄王氏效先有诗见美倚歌和之以酬其深意云 其一
1046651,九月十日赵韩王园同舍饯送王微之晰出守汝州即席次其韵二首 其一
460437,蝶恋花　九月一日梦起作二首 其二
264498,九月初三夜遣怀
923683,九月十一日书事
1138117,九月九日赏红叶 其一
975661,九月十日独游钟山
842884,瀛台侍直七月至九月得十六首 其十一
897412,九月末风雨初寒 其一
555244,丙辰九月廿四日致政归寓蒜岭驿次韵二律 其二
96651,九月晦日舣舟浴于昭真既罢同方元直成父弟儿
559137,九月十九辰德仕招饮时适邀黄将军为攺次日德进惠以二绝次韵奉答 其二
840787,九月上浣抵家即事
791003,九月既望蔡氏景贤书屋张筵赏菊率成七绝六章并五排一首
950901,九月十三日始就郊墅拜宝谟阁直学士提举江州太平兴国宫之命
135123,九月十一日杓孙得男
698225,九月朔卞庙谒祭因有豫作登高之约归次偶成
740804,己丑九月与金香沺山中话别有赠
556092,九月八日作
101200,七年九月自广陵召还复馆于浴室东堂八年六月
685562,和黄士明太史辽左闻报六首己未九月
116507,九月十日菊花烂开
802216,留别南中亲友戊子九月 其一
572378,五弟清梵阁落成闰九月九日同邹伯学王闇然王连玉刘绳之方平弟觞其上得清字
839475,辛丑九月十三夜伏枕不寐，忆前年咏菊诗款惬意，续赋二律 其一
934933,九月七日子坦子聿俱出敛租谷鸡初鸣而行甲夜始归劳以此诗
841352,九月十七日晚眺
686574,九月望日同大阳有台二使君泛湖出郭二首
107198,九月初六日客报吾州初一日大火城中俱尽吾家
9719,九月九日李苏州东楼宴
492102,九月一日泛舟赴上麓拟简刘子琚
528414,九月二十六日同贾广文刘举人任贡士高夔府先生宅内赏菊四首 其一
960005,九月初吉永嘉苏太古同游金华洞夜宿鹿田寺用杜陵山馆诗韵以赠
695547,闰九月重阳前一日奉陪梅所知司游员山谒康仙祠即席次韵二首
101184,微雪怀子由弟·岐阳九月天微雪
748195,丙午九月自东里抵任城与茝坪弟夜话
1548,九月九日望蜀台
770555,壬子八九月读书题词十五首 其十五 谭友夏集
459239,萤凋殆尽，九月二十九夜肖家浴忽见一丸
827178,水调歌头 九月十一日邀蜕盦登麓山
17003,拟醉·九月闲宵初向火
1039240,阅古堂前植菊二本九月十八日花犹未开因以小诗嘲之
76724,九月晦日作
1127960,宝祐五年史院修高孝光宁四朝国史成上进九月明堂升侑高宗礼成进诗三章称贺
381458,九月十五日游劳山题柳树台酒店
652793,九月十日雨中访徐校理留宿
930403,九月初作四首 其三
842885,瀛台侍直七月至九月得十六首 其十二
626377,美人诗二十二首 其九 月溶
319278,癸丑九月，六十自慨
419836,烛影摇红 壬子九月辟地至渝
19627,闰九月九日独饮
780267,虞美人 九月十六日夜泊双桥
655014,九月朔卞庙谒祭因有豫作登高之约归次偶成 其二
116510,九月十八日梦中作闻雁诗
133804,次韵和邻几九月五夜直
416420,秋宵吟    九月望夕不寐闻笛作
1199377,诗二十五首 其五 九月三日夕云林王夫人喻作令示许长史
872,奉和圣制闰九月九日登庄严总持二寺阁
104422,九月六日登舟再和潘歙州纸砚
86591,明府·九月南州菊未黄
1212374,九月道中遇雪
471998,纪赐四十首 其三十七 戊子九月寿宫随驾步视宝城还于东廊称贺玉音宣劳赐茶并赉綵花文绮等物
913774,凝露堂前紫薇花两株每自五月盛开九月乃衰二首 其一
812402,九月二日病赴睦州
913150,贺皇太子九月四日生辰 其五
596361,兴国灵山二十景和前令唐子侯氏 其十九 月池
826309,声声慢·九月六日承伯纯吏部招同姚子梁太守、陶矩林司马、桂竹君秋曹集沙萝浦绿雪楼
1118902,九月八日登高作重九奇父赋三十韵与义拾馀意亦赋十二韵
300162,秋宵吟·九月望夕不寐闻笛作
1169553,奉和九月九日登慈恩寺浮图应制
876089,丁酉九月十四日黄源岭客舍题黄瀛父近诗
780268,虞美人 九月十七日泊嘉兴，时将由枫泾入沪，不经吴门矣，感赋此解
547832,寄吴少溪宫录七十 其二十八 九月十三日大雪唐君平文学入对过访有诗见投赋赠
936110,绍熙辛亥九月四日雨后白龙挂西北方复雨三日作长句记之
828091,九月十九日同复园谒禹陵登会稽山顶
529230,九月望初寒独坐
96648,九月十一夜雨中读吴梦与诗书以示之
357288,长亭怨慢·九月晦日
700172,九月十四日赵尔锡西庄泛舟和涯翁韵
535018,奉次许宗鲁中允九月二日居庸佛阁同仇将军登宴二首 其一
495494,墙角红梅，九月发花一朵，偶成四绝；时羁狱舍，用「盐」字 其四
1028428,九月九日登山
770189,九月十六日雪和冯庵
252483,九月七日饮
1215957,九月一日还自上京途中纪事十首 其一
575487,万历乙亥秋九月，同诸将再登太平南山有作
530332,庚午九月廿五日梦中偶得
522476,九月七日东园先生寿七十三诗以祝之
719836,后秋兴八首九月初二日，泛舟吴门而作 其八
972065,九月一日晨起风物凄然不胜怀远之思作五首寄和父憨申并烦转致湖池二州也 其四
502510,九月一日过崇信兰若
144319,九月十八日夜泊刘郎浦二绝
102991,九月十八日山中见杜鹃花复开
890926,满江红 其一 戊午九月七日，碧沚和制几韵
1240433,壬午九月九日与郭希仲纪叔维马希远饮周景文晚香堂上纪画墨菊马鼓琴既而各赋一首
16929,赋得九月尽
552428,洪武癸丑九月十八日为外兄集贤大学士张东谷贺八十 其四
612047,和黄士明太史辽左闻报六首己未九月 其六
298147,九月八日飓风
825140,循龙州城垣遂入同风书院访仙岩登可思亭九月十六日也
204410,织妇·九月风高未授衣
460244,凤皇台上忆吹箫　九月二十六病卧肖，起留三阕。时肖有分飞之悲，亦触余旧事，故泛写之二首 其二
911443,壬申九月初十归自邑中两绝 其一
1241853,九月四日遣愁
11759,九月十日雨中过张伯佳期柳镇未至以诗招之
13770,九月十日郡楼独酌
850206,九月廿二日西馆雨中作
1236506,岁戊子五月将赴闽宪徵擢翰林待制兼国史院编修官九月驿至京师送季长弟之任山南宣慰照磨二首
1127813,九月 其三
149179,南门·今上元年九月初
103301,九月二日梦後寄裴如晦
572299,九月二日盛集诸公郊游至二圣寺仍用散木韵 其一
80983,九月一日未明起坐
521805,九月十四日赵尔锡西庄泛舟和涯翁韵 其二
414194,丙寅年九月朔晋七十五岁有作
1063329,壬辰九月二十三日始寒以诗记之
552425,洪武癸丑九月十八日为外兄集贤大学士张东谷贺八十 其一
740142,甲寅九月南堂先生归里计日抵家见忆代书
293143,九月出都·莫言朝事费平章
689635,洪武癸丑九月十八日为外兄集贤大学士张东谷贺八十
116508,九月下旬有作
916747,八声甘州 寿萧帅参九月廿三
306406,散原少予五岁今年八十矣记其生日亦九月赋寄庐山
918362,九月十六日出郡登舟如钱塘十七日舟中杂兴 其六
680549,九月九日夜兀坐诵潘邠老满城风雨近重阳之句因为韵赋
348565,九月蓬莱亭周彦达节推酌发
496919,行行且游猎丁丑九月作
459620,九月二十四重过陆城养殖场荷池，末首记姑妈语也 其一
267091,榕城九月用少陵登高韵
271196,无题丙辰九月
1205606,鹧鸪天 九月八日寄松京故旧
528417,九月二十六日同贾广文刘举人任贡士高夔府先生宅内赏菊四首 其四
897407,九月下旬有作二首 其二
1085586,亡姊之葬在九月而不得其日十五日读坡诗至英公燎须事不觉悲涕是日辛酉得非葬日邪诗以寓哀
1096149,九月十四日自寿 其一
934935,九月十六日夜梦驻军河外遣使招降诸城觉而有作
547506,九月廿五日东园菊下小集四首 其一
842878,瀛台侍直七月至九月得十六首 其五
911795,九月十五夜月细看桂枝北茂南缺未经古人拈出纪以二绝句 其一
475672,余羁秣陵乞休累疏而格于新令郁郁之怀伏枕增剧遂效杜子美同谷体为秣陵七歌时丙戌九月既望也 其三
580511,弘治五年九月八日司空戴先生召诸公为白去寺之游归途间张靖州有九日遣怀之作遂次其韵十四首 其一
1234297,和邓善之九月雪
1231376,至正壬辰九月十二日过玉山草堂留别山中诸公
1054039,九月十八日作
227792,九日·霜冷风清九月九
76722,九月六夜梦中作笑诗
772353,梅伯言、马湘帆、汤海秋、王少鹤四农部，何子贞编修，陈颂南、苏赓堂、朱伯韩三侍御，叠次召余同亨甫为觞宴之乐。九月二十六日，复集蒹葭阁；盖丙申年入都，伯言、湘帆置酒处也。诸君各以诗文见赠，余行有日，辄成七律数章酬别 其二
555792,嘉靖乙巳年八月十二日出狱归九月十一日复逮系途次有作 其四
869916,宿南园 九月十一日夜雨宿南园韩秉国寄酒兼见招以诗谢之
96654,九月二十七日题桂溪铺
670821,九月同殿卿登南山 其二
1143846,九月八日宾旸携酒西斋晚登秀亭次前韵
308150,酹月·庚申九月十三
705261,菩萨蛮 丁巳九月病中有感八首 其十八
819961,乙亥秋九月至旧京视散原先生日与心畬叔明立之伯夔君任羹梅过从寥志强志贻先询先诸弟自津沪来旧藏五十馀年陈酒由杭至京连日聚饮赋诗属和 其一
1225306,九月初旬临清下陵州舟中
747771,九月十日发通州
1003737,九月晦斋宿太一宫都监姚高士示刘长翁及汤仲能诸公唱酬诗轴因和韵二首 其二
682438,九月雪时在苑西楼，与四家兄、傅逊之、高正甫诸公同赋
1129481,九月十四日自寿
1228925,九月晦日二首 其一
1211119,九月十五月食
330801,老钦阇黎以政和七年九月十七日夜圆寂趺坐如生道俗叹仰邑丞向仁叔作偈赞悼因次其韵
621438,永历二年九月十五日
799539,九月八日喜禹峰至
842875,瀛台侍直七月至九月得十六首 其二
572308,九月初五日得三弟京闱第三报志喜仍用散木韵践前约也 其二
1215948,九月十七日承诏篆追号明庙玺文锡宴中书有衣币之赐
333094,梦江南·甲申九月朔日别京师往游西湖赋此为约
1215963,九月一日还自上京途中纪事十首 其七
787559,九月四日重至东阳寄杭诸友 其二
224649,九月申屠伯骥同饮寿张蚩尤冢上
842877,瀛台侍直七月至九月得十六首 其四
540819,乙卯九月七日西城闻慎修秋捷
557515,九月七日龙山感赋简苏郡丞
305682,九月八日集无边华庵饯浣华韵伯作画余名之曰秋槎图并赋三绝句
1045626,九月九 其二
843161,散原少予五岁今年八十矣记其生日亦九月赋寄庐山
741215,九月十四夕梦中作 其二
695199,壬辰九月二十二日再入讲筵进讲得诗三首
802217,留别南中亲友戊子九月 其二
580521,弘治五年九月八日司空戴先生召诸公为白去寺之游归途间张靖州有九日遣怀之作遂次其韵十四首 其十一
496482,忆王孙 九月八日邀客赏菊
49595,九月既望次瑞卿惜别诗
318547,九月三十日江上送秋，寻去年醉处不可得，惘然有作
765357,九月二十日醉后作四章 其三
157726,九月二十七日晓起书梦
963817,九月十八日夜泊刘郎浦 其一
344165,和衲山上人九月晦日登云岫庵观日月合朔
589636,九月一日登泰山
778211,满江红·八月十五日遍寻陶然亭龙树寺诸胜。入夜星月皎洁，饮赵氏斋，閒步归旅舍。忆贺少楼明经有九月十五望月两阕，属和，久无以应，次韵寄怀 其二
1135764,九月二十二日晓倚楼
131486,九月十日乡人醵饮丹山分韵得东字
531013,九月望日与诸弟夜泛
913950,九月一日夜宿盈川市
1113830,老钦阇黎以政和七年九月十七日夜圆寂趺坐如生道俗叹仰邑丞向仁叔作偈赞悼因次其韵
1072370,和故人二首丁卯年九月二十二日梦中得之 其二
475671,余羁秣陵乞休累疏而格于新令郁郁之怀伏枕增剧遂效杜子美同谷体为秣陵七歌时丙戌九月既望也 其二
252705,桂枝香· 民国二十九年九月
923336,元祐癸酉秋九月蒙恩补郡维扬十一月到治莅事之始首阅题名前后帅守莫非一时豪杰固所钦慕矣然于其间九公颇有夤缘感旧思贤嗟叹不足因作长韵题于斋壁以寄所怀耳
73941,九月七日复游寒泉登南峰有怀龙门云台
459487,九月十一班中无钥开匮，不得取书，作诗遣闷十首 其六
333848,九月八日雨作
918365,九月十六日出郡登舟如钱塘十七日舟中杂兴 其二
612217,九月望夕同自得朝爽台小酌玩月步韵
923533,闰九月重九与父老小饮四绝 其四
1111823,九月二十六日同朝宗泽民游洞宫用刘使君韵二首
77970,九月初郊行
662535,九月不见菊
404065,鹧鸪天·九月三日，同盟军胜利之夕，西北师院同事赵君海峰嘱题
291190,贺新凉·廿二年九月十八日
433442,九月二十一日作
370345,九月四日黄子功林德久自柳州共汎访铦师
708492,贺新郎  其十二 九月龙爪槐登高有感圣秋邮沂诸故人同集者为檗子方虎介玉雪客时金粟将南归矣
481474,九月十三日夜梦绣衣康用和握手话旧觉而闻雨有感诗以寄之
930389,九月二十八日五鼓起坐抽架上书得九域志泫然有感
562173,九月望日钱塘玛瑙寺僧照觉原过幽湖读书所出示诗数篇因其别也走笔赋诗一首为赠且有紫微山之约云
280574,九月二十六日小妾举一男，坠地即绝。余年三十有六，尚无子嗣，怆然有感
1115232,贺皇太子九月四日生辰二首
592533,丁卯九月十七日同汪山人黄中舍集杨汝德园赏菊是日牡丹忽开一花江北深秋未见寒色然亦异矣为纪一诗
107187,九月十二日得蟹小酌
405322,浣溪沙 壬寅九月十六夜作
846793,瑞鹤仙 寿王侍郎九月廿七
169366,九月九日魏衍见过
1032299,九月六日发舟齐山下呈祝静得蔡君瑞
263053,咏菊·野圃霜高九月天
583155,九月九日寓九江时户部李时雍同年预约游庐山以是日雨作中辍时雍复遣人送酒侑以一绝因走笔戏答四绝 其四
817625,九月二十五日京师蝗
524171,九月晦日西南陂再泛二首 其二
125503,湖上·湖上烟光九月天
265315,大同八年秋九月诗
825369,九月十五日游劳山题柳树台酒店
160150,满江红·丁未九月南渡泊舟仪真江口作
842874,瀛台侍直七月至九月得十六首 其一
826023,九月初一日晨起 其一
941784,祝英台近 九月一日寿俞德载
580523,弘治五年九月八日司空戴先生召诸公为白去寺之游归途间张靖州有九日遣怀之作遂次其韵十四首 其十三
341169,忆内·九月江乡橘柚秋
991111,依韵和武平九月十五日夜北楼望太湖
471973,纪赐四十首 其四 丙子九月工部奏进万历制钱式样赐讲官六人各一锭
332304,浪淘沙·丙辰九月十四夜
430538,九月十三日夜宿榕江与家兄雨三同观书画
152068,绍兴庚辰九月二十三日与浙东权帅同年程龙图
947180,和通判九月望日始见菊花二首 其一
918370,九月十六日出郡登舟如钱塘十七日舟中杂兴 其九
227496,记九月二十五夜梦中作
802215,芦林潭对月忆家偶成回文戊子九月
413569,九月十三日董君天狂招饮于天香楼，席散偕兆惇、兆恩二老同志浣纱村畅叙，归后得一律报之
220488,九日观阅·猎猎西风九月寒
1252854,济川阻雪九月二十七日客况四首
913149,贺皇太子九月四日生辰 其六
96655,九月晦日·经旬不饮仍废诗
585696,丙午九月十二日新定仰辰台同周自正郑孔新谢振卿扳跻登望浩歌而归
466258,九月二十四重过陆城养殖场荷池，末首记姑妈语也
658494,九月晦日玉延亭看菊
922021,七年九月，自广陵召还，复馆于浴室东堂。八年六月，乞会稽，将去，汶公乞诗，乃复用前韵三首 其一
1046938,九月十八日离魏都寄内二首 其一
552429,洪武癸丑九月十八日为外兄集贤大学士张东谷贺八十 其五
410129,九月朔日倩画工绘万山寒柏图，题四诗以见志 其一
437780,丁巳九月梦与范季沾同登北潭之临芳亭觉而作诗记其事以示范
944877,九月十日乡人醵饮丹山分韵得东字
253338,辛未九月二十一日雪
813107,九月十一日偕王慰三、章彦芳、王倬臣赴荡口舟中联句二首
505606,九月十一日天禧寺访卢月桐观画壁回口占二绝句以寄 其二
285531,京津车中暮作 九月初六日
459949,风入松　九月七日待彭不至
1223615,九月八日赋二种芙蓉二首 其二 转观芙蓉
944558,九月一日戴时可酒边 其二
460440,蝶恋花　九月四日记梦中事三首 其三
504039,九月廿五日值余初度诸友以诗酒见寿于舟中赋五言长律一首以谢云
459621,九月二十四重过陆城养殖场荷池，末首记姑妈语也 其二
303644,九月十六夜雷雨枕上成此
301954,九月十八日抵家
1086057,九月十三日离仙林
555791,嘉靖乙巳年八月十二日出狱归九月十一日复逮系途次有作 其三
152151,九月十八日夜忽梦作送王龟龄诗两句枕上足成
861210,九月二十九日到思溪庄避人事十月初四日过生朝方归初三日早恕子遣人来送酒食并词二阕因成唐律二首 其一
1155035,予以长庆二年冬十月到杭州明年秋九月始与范阳卢贾汝南周元范兰陵萧悦清河崔求东莱刘方舆同游恩德寺之泉洞竹石籍甚久矣及兹目击果惬心期因自嗟云到郡周岁方来入寺半日复去俯视朱绶仰睇白云有愧于心遂留绝句
1112182,闰九月晦日登舟二首
459912,九月十七钓茶港三首 其一
991732,九月一日
568263,九月朔晨兴
747894,九月二十日潘德舆招饮海山仙馆即事有作 其三
745754,九月十日偕诸同人集谦斋别驾斋中赏菊
689777,部饷至京引见皇极门时戊辰九月五日二首
413099,一九六六年九月廿二日红卫兵勒令归乡内子淡俜结装相随旋又奉令返回原职计居乡一百天 其五
564224,九月
455333,生查子 九月随感
882285,水调歌头 其三 壬寅九月，谒季修，题其书室壁曰秋斋梦谒，复以进道韵续之
1062766,九月八日晓起绝粮舟中读书
555243,丙辰九月廿四日致政归寓蒜岭驿次韵二律 其一
791002,九月既望蔡氏景贤书屋张筵赏菊率成七绝六章并五排一首 其六
918363,九月十六日出郡登舟如钱塘十七日舟中杂兴 其十
495493,墙角红梅，九月发花一朵，偶成四绝；时羁狱舍，用「盐」字 其三
819962,乙亥秋九月至旧京视散原先生日与心畬叔明立之伯夔君任羹梅过从寥志强志贻先询先诸弟自津沪来旧藏五十馀年陈酒由杭至京连日聚饮赋诗属和 其二
1099205,九月朔
1220635,九月十日出城
572309,九月初五日得三弟京闱第三报志喜仍用散木韵践前约也 其三
703955,杂兴　癸夘九月也
426085,九月十一日与杨老同舟归乡
1027316,九月十一日杓孙得男
530541,杂兴　癸夘九月也 其二
195430,九月西城无涧同陈道士衡上人
1231475,甲子年九月二十五日西寇犯高凉战于坡山
947782,九月二十二日侍祠明堂口占
722640,九月望日得石斋馆丈午日见怀诗次韵
1089552,九月十一日龙华寺斋宿礼部陈同年见余嵬字韵诗宠和惠示复用韵奉酬
682918,奉次许宗鲁中允九月二日居庸佛阁同仇将军登宴二首
930399,九月三日泛舟湖中作
442506,己卯九月与诗社同仁游黄岗
1216751,九月八日陪危太朴偕梁九思游城南三学寺万寿寺 其一
508365,和陶诗 庚戌岁九月中于西园穫早稻
1122212,次韵朱子厚九月十一日见寄三首
930406,九月初作四首 其二
180873,己酉九月自巴丘过湖南别粹翁
