1105854,彦嘉通守当今之俊伟人也余心向慕之常以未获识君为恨兹因孔纯老遂有邂逅之适其何幸如此将归纯老置酒饯别仆实预坐酒数行纯老丐诗于彦嘉以记坐上笑谈之乐顷刻扫数百言挥毫落纸云烟飞动永叔所谓盈前尽珠玑一一难简汰者殆谓是邪索鄙句不敢以固陋辞辄和北庄二诗奉呈
1082555,彦嘉通守当今之俊伟人也余心向慕之常以未获识君为恨兹因孔纯老遂有邂逅之适其何幸如此将归纯老置酒饯别仆实预坐酒数行纯老丐诗于彦嘉以记坐上笑谈之乐顷刻扫数百言挥毫落纸云烟飞动永叔所谓盈前尽珠玑一一难简汰者殆谓是邪索鄙句不敢以固陋辞辄和北庄二诗奉呈 其二
331028,德起侍讲侍郎以亲老丐外章
1070764,德起侍讲侍郎以亲老丐外章累数十上上虽察其诚至眷待方隆卒不许其去五月九日有旨令归觐且使迎奉以来一时士友莫不歆艳称叹为人臣子能使圣主敬爱贪恋如此诚千载之遇足以显其父母扬名后世矣上虞李某作诗送行
290359,老丐·历劫犹存老病身
791892,前在海上见会稽徐僧佣所作《九老》诗，意警词练，因仿为之，并限其韵 其九 老丐
856360,彦嘉通守当今之俊伟人也余心向慕之常以未获识君为恨兹因孔纯老遂有邂逅之适其何幸如此将归纯老置酒饯别仆实预坐酒数行纯老丐诗于彦嘉以记坐上笑谈之乐顷刻扫数百言挥毫落纸云烟飞动永叔所谓盈前尽珠玑一一难简汰者殆谓是邪索鄙句不敢以固陋辞辄和北庄二诗奉呈 其一
