666280,顾东江先生遗善堂诗 其七
666275,顾东江先生遗善堂诗 其二
765816,满庭芳 蓉江先生过访，别后寄赠
664995,挽西园江先生
504112,季翔弟惟学自嘉禾来武昌省母及其还也赋诗为别乃翁清江先生有文集行于世惟学婿于沈氏云
655530,龙窟渡拜先曾祖楚江先生墓
666281,顾东江先生遗善堂诗 其八
532412,二府少峰江先生同令弟章山哭其季方文厓上舍得诗二首示及索和赋此 其二
835187,高阳台 小江先生有骑省之戚，屡欲为词唁之，会以病树盦卧病图属题，漫赋是解
371151,百字令·题邵蓉江先生诗集
71013,和曲江先生元夕寿伯翔翁作
444902,满庭芳  题袁江先生《深秋之记忆》图
851469,古心江先生以旧弼出镇长沙癸酉十月乙亥是为七十六岁门人文某以一节趋走部内谨拟古体一首为寿
666274,顾东江先生遗善堂诗 其一
677577,传报广寇劫予邑之西南燔杀惨甚罗文庄公旧宅刘两江先生舍皆为烟烬为之掩涕
736689,写秋云一抹赠陈澹江先生
1233727,别后寄澄江先生
547857,寄吴少溪宫录七十 其五十三 山中怀寄沈龙江先生
532025,送三江先生
501319,祭酒江先生见和再次前韵
770636,寄题朱九江先生祠堂
1239535,和曲江先生元夕寿伯翔翁作
654865,挽棠溪处士肃庵江先生
765869,百字令 其二 题邵蓉江先生诗集
796238,风入松 题谢文节公遗琴，奉简素江先生按谱
666276,顾东江先生遗善堂诗 其三
145894,古心江先生以旧弼出镇长沙癸酉十月乙亥是为
617828,晨坐斋中和张曲江先生韵
95673,呈王平江·先生自词伯
283054,高阳台·小江先生有骑省之戚，屡欲为词唁之，会以病树盦卧病图属题，漫赋是解
448813,题朱九江先生手批艺文册
383741,山中怀寄沈龙江先生
1213025,挽休宁黄秋江先生母
817006,百字令 题邵蓉江先生诗集
666277,顾东江先生遗善堂诗 其四
688236,二府少峰江先生同令弟章山哭其季方文厓上舍得诗二首示及索和赋此
590547,谢别王娄江先生再致期待之意
582092,寄从兄月江先生致政司训
655619,怀曾祖楚江先生
659298,寿澄江先生八十诗
371147,满庭芳·蓉江先生过访
532411,二府少峰江先生同令弟章山哭其季方文厓上舍得诗二首示及索和赋此 其一
800107,书京江先生南苑诗后
704888,顾东江先生遗善堂诗 其一
508442,风木操题文学江先生风木图
666279,顾东江先生遗善堂诗 其六
298697,写秋云一抹赠陈澹江先生
795945,风入松 读集中吴门小怀女史咏谢琴风入松一阕，次韵奉寄素江先生正拍
760883,桃源女史朱伯姬，九江先生女公子也，能诗画，为兰史作小幅而自题绝句其上，兰史出观，因为书此
666278,顾东江先生遗善堂诗 其五
765868,百字令 其一 题邵蓉江先生诗集
444903,八声甘州  题袁江先生长卷山水图《秋江吟》
