293345,丹阳访石曼卿墓
1182386,弋阳访古
431620,水调歌头二首·辛丑重阳访周谷城于淮海公寓，放怀高论，莫逆于心，率赋此词，藉倾积愫
17672,再到襄阳访问旧居
838714,壬子春日过霞阳访马君亦篯，得观所藏图书，复赏所植花木。信宿三日，踰苏岭，归海沧
273082,来阳访庞士元故宅时日闻湘西大捷
684996,过休阳访查八十不遇二首
1157090,再到襄阳访问旧居
459135,岳阳访李石雄不遇
21124,弋阳访古
305916,沈阳访马占山将军后赋呈
1049873,中秋泛月至历阳访太守孙公素
711461,送梁并之之丹阳访胡令君
714205,泾阳访王大春
63307,过休阳访查八十不遇
427913,水调歌头二首·辛丑重阳访周谷城于淮海公寓，放怀高论，莫逆于心，率赋此词，藉倾积愫 其一
633553,长安逢韩掌邦时韩子拟出辽阳访剩师叔
472252,过休阳访查八十不遇二首 其一
426920,来阳访庞士元故宅时日闻湘西大捷
472253,过休阳访查八十不遇二首 其二
955673,去年过弋阳访赵恂道通判话西湖旧游因题小诗近忽刻石寄来谩录
1214685,余游暨阳访道士吴清逸见大龟如车轮五尾色苍黑类古铜蹒跚而行特特有声因为之赋
1049890,送刘继邺秀才之岳阳访木尉
427914,水调歌头二首·辛丑重阳访周谷城于淮海公寓，放怀高论，莫逆于心，率赋此词，藉倾积愫 其二
414974,沈阳访马占山将军后赋呈
122175,去年过弋阳访赵恂道通判话西湖旧游
748992,丹阳访石曼卿墓
275192,怀古·试向高阳访酒徒
