627965,作客惠阳寄居穷巷中有小室方不盈丈仅足读书临帖无隙地可以栽花种竹独辟西牖稍能坐观西湖之胜旅中少暇赋诗自娱二日以来遂成四章 其四
689100,作客惠阳寄居穷巷中有小室方不盈丈仅足读书临帖无隙地可以栽花种竹独辟西牖稍能坐观西湖之胜旅中少暇赋诗自娱二日以来遂成四章
627962,作客惠阳寄居穷巷中有小室方不盈丈仅足读书临帖无隙地可以栽花种竹独辟西牖稍能坐观西湖之胜旅中少暇赋诗自娱二日以来遂成四章 其一
408606,丙戌十二月十七日喜仙臣至后二日以东坡生日诗见示作此和之
883543,端平乙未王正十月有二日以官事宿祥云得五十六言
97676,四月十二日以夏潦暴甚舣舟辰之铁枪崖下偶得
627964,作客惠阳寄居穷巷中有小室方不盈丈仅足读书临帖无隙地可以栽花种竹独辟西牖稍能坐观西湖之胜旅中少暇赋诗自娱二日以来遂成四章 其三
784014,十二月初二日以签掣四川引见乾清宫
627963,作客惠阳寄居穷巷中有小室方不盈丈仅足读书临帖无隙地可以栽花种竹独辟西牖稍能坐观西湖之胜旅中少暇赋诗自娱二日以来遂成四章 其二
748575,开岁二日以言事罢官将南归叠三字韵
973834,四月十二日以夏潦暴甚舣舟辰之铁枪崖下偶得浮木于水中宛然如山因其形似名曰卧岭立峰喜而赋诗当寄交友之能诗者求著语焉
