673236,正统已已年丽寇至缙云大肆摽掠延杀无辜乡氓赵氏女自经死钟氏妇堕南岩宛予特赋其事二首 其一 赵氏女
965504,酬和二章拜呈慈云大师伏惟采览 其一 和桂子
952813,和天竺慈云大师
1080287,鼓山颂法眼语在里即求出云大家合眼跳黄河戏成四韵奉答
194682,谢人分寄密云大小团
914032,元日癸卯占云大熟
704250,正统已已年丽寇至缙云大肆摽掠延杀无辜乡氓赵氏女自经死钟氏妇堕南岩宛予特赋其事二首 赵氏女
107190,九月二十六日雪予未之见北人云大都是时亦无
1082880,东山到温州仙岩览安楞严姚郎中故事安初读楞严经破句悟道后接姚郎中以梅潭水声悟道东山拈云大小郎中可惜埋向仙岩山中遂说偈仍赠仙岩监寺 其二
673237,正统已已年丽寇至缙云大肆摽掠延杀无辜乡氓赵氏女自经死钟氏妇堕南岩宛予特赋其事二首 其二 钟氏妇
1082569,疏山作糊饼草堂老师出语云色香味触具四尘且道糊饼具几尘是时众皆无语老师末后云大刀三十口以颂系其后
855141,谢人分寄密云大小团
720210,囊云大师山居
204525,寄慧云大师
1135722,九月二十六日雪予未之见北人云大都是时亦无此寒
1082879,东山到温州仙岩览安楞严姚郎中故事安初读楞严经破句悟道后接姚郎中以梅潭水声悟道东山拈云大小郎中可惜埋向仙岩山中遂说偈仍赠仙岩监寺 其一
622000,自吴城至马当湖江八景 其五 大姑山　俗云大姑鞋在湖口上三十里
752450,都中赠别范岱云大令
327563,宝应道中·蒸云大泽斗蛟龙
89125,郄谢·蒙叟云大儒倡
95037,元日癸卯占云大熟
965501,酬和二章拜呈慈云大师伏惟采览 其二 和种桂
280924,赠任公·脚底烟云大九州
1082881,东山到温州仙岩览安楞严姚郎中故事安初读楞严经破句悟道后接姚郎中以梅潭水声悟道东山拈云大小郎中可惜埋向仙岩山中遂说偈仍赠仙岩监寺 其三
908321,刘蜕唐大中时人文冢在兜率寺予尝读孙樵自序其作云大中皇帝尝有诏褒时之艺能凡三人而樵居其一曰孙樵有扬马之文蜕既同时不应不在褒诏之列士之显晦固有定分刘君独未能忘此乎冢其文予盖疑其有激也作此吊之
934158,谒凌云大像
217441,和天竺慈云大师
761266,渡江云 大观亭同阳湖赵敬甫江夏郑赞侯
1130446,东山到温州仙岩览安楞严姚郎中故事安初读楞严经破句悟道后接姚郎中以梅潭水声悟道东山拈云大小郎中可惜埋向仙岩山中遂说偈仍赠仙岩监寺
562000,题子昂松树障子歌盖王成之所藏者纸尾云大德八年正月廿夜灯下书
1022162,寄慧云大师
77461,谒凌云大像
