518496,舟中读谢鸣治先生所作伊洛渊源续录序文其间有曰自是以来犹有窃吾道之名以用于昏浊之世借儒者之言以盖其佛老之真呜呼先生之言盖有所指我知之矣然先生既引而不发愚亦安敢明言聊布短章以诵其志
979858,平昔于王褒赠同处士八绝中喜诵其龙尾禅室一首今连日行荒山中颇增幽居之兴以其句为一诗寄杨中立谢显道刘壮舆陈叔易同趣归期也有好事者亦不予鄙 蓬蒿自杜门
974167,顷见迂斋谈游子明不容口且诵其诗恨未遂倾盖之愿前年一见既慰我心所恨俱匆遽不得款语近过迂斋闻寄书又复访问死生顾屏窜林壑逃死无日何以辱盛意如此辄成一诗奉寄
559502,戊辰十一月廿一日夜梦有令禁私宰余谓合家久不啖牛肉遂拈一诗诵其事睡觉只忆起语二句枕上足之辄成一律
979857,平昔于王褒赠同处士八绝中喜诵其龙尾禅室一首今连日行荒山中颇增幽居之兴以其句为一诗寄杨中立谢显道刘壮舆陈叔易同趣归期也有好事者亦不予鄙 鸟宿暮林喧
97801,顷见迂斋谈游子明不容口且诵其诗恨未遂倾盖
980474,平昔于王褒赠同处士八绝中喜诵其龙尾禅室一首今连日行荒山中颇增幽居之兴以其句为一诗寄杨中立谢显道刘壮舆陈叔易同趣归期也有好事者亦不予鄙 人还虚室静
54153,与次明宿昆山舟中次明诵其近作因次韵
1074897,东坡老人居儋耳尝独游城北过溪观闵客草舍偶得一蒻笠戴归妇女小儿皆笑邑犬皆吠吠所怪也六月六日恶热如堕甑中散发南轩偶诵其语忽大风自北来骤雨弥刻
980475,平昔于王褒赠同处士八绝中喜诵其龙尾禅室一首今连日行荒山中颇增幽居之兴以其句为一诗寄杨中立谢显道刘壮舆陈叔易同趣归期也有好事者亦不予鄙 井汲才通径
502476,送黄彦美还会稽彦美常从故侯买里古思以兵守越后雪仇报恩一时称诵 其二
672821,箱房后丛竹抽简甚多内直房候朝与司徒孙公谈种竹事公诵其在吏部郎署咏竹因次其韵
502475,送黄彦美还会稽彦美常从故侯买里古思以兵守越后雪仇报恩一时称诵 其一
149374,平昔于王褒赠周处士八绝中喜诵其龙尾禅室
477895,与次明宿昆山舟中次明诵其近作因次韵
