247685,杂诗·虚杯相待酒仍斟
1217286,次韵相待山行
175434,自寿·光景不相待
681356,舟次奉新驿得戴侍御同年书知于前驿相待漫得一绝
1033328,见淮东制帅赵南仲侍郎相待厚甚特送买山钱又欲刊石屏诗置于扬州郡斋话别叙谢
740700,得李南涧书知于广州相待却寄
147305,见淮东制帅赵南仲侍郎相待厚甚特送买山钱
493558,既四月末予西轩牡丹一枝最后开与戎葵掩映特盛时叔铭适自保定归隐若有相待之意因命酌快赏叔铭再用前绝句韵为寄兴不能已仍用韵奉荅并忆吕本拙佥宪按事中山未还归日当共一笑云
592039,淦口望胡佥宪舟不至先赴金川驿相待
25967,答王参·寸晷不相待
599090,平夷驿侯林郡丞不至予出都日郡丞赋诗一章且解所衣貂领赠之约予千滇关相待久不见至怅然留题于壁
609009,乙巳中秋余将南行因忆四家兄先到湾中舣舟相待
17638,秋霁·金火不相待
250234,渭城朝雨杨青青五陵少年陪同到西安新河兄也自京飞来相会田茂兄设宴相待并即席赋诗见赠步韵为谢
5265,酬岑勋见寻就元丹丘对酒相待以诗见招
637645,世殿下设宴相待作绝句一章敬和
821224,高山流水 周仲眉室陈戊双夫人知音善画，尝取临川曲意作琅玕题名图。竹数十竿，每竿使曲舍诸人题姓氏其上而留其一相待，并索词
915187,刘寺展绣亭上与尤延之久待京仲远不至再相待于灵芝寺
229793,送到逢吉·独去谁相待
1168671,詶岑勋见寻就元丹丘对酒相待以诗见招
250710,庚寅孟冬过浔阳当地诗友盛情相待席上分韵得国字
493557,既四月末予西轩牡丹一枝最后开与戎葵掩映特盛时叔铭适自保定归隐若有相待之意因命酌快赏叔铭再用前绝句韵为寄兴不能已仍用韵奉荅并忆吕本拙佥宪按事中山未还归日当共一笑云
452269,庚寅孟冬过浔阳当地诗友盛情相待席上分韵得国字
545593,王通侯世叔与余订约同舟余以诸故人挽留未发世叔解缆先行特驻济上为岱宗之游以相待寄谢此章
452259,渭城朝雨杨青青五陵少年陪同到西安新河兄也自京飞来相会田茂兄设宴相待并即席赋诗见赠步韵为谢
