13366,饯裴行军赴朝命
1183144,刘侍御朝命许停官归侍
53557,和受之宫詹悼鹤诗二首时将赴朝命
625686,王大将军奉朝命驻防吾潮辞旧居诗
835503,翠楼吟 其二 继莲畦为江藩，与端督龃龉。朝命移甘肃，于道令权皖抚，故为此词
471144,和受之宫詹悼鹤诗二首时将赴朝命 其二
1077913,华容西二十许里有墨山即离骚所谓玄石也山有大云寺寺有云母泉甘芳洁清大旱不竭唐李华有诗序之甚详其末云华贬杭州司公恩复左补阙次于岳阳江山延望思与高贤共饮云母之泉躬耕墨山之下敢违朝命以询私欲秋风露寒洞庭微波一闻猿声不觉涕下况支离多病年甫始衰愿饵药扶寿以究无生之学事乖志负火爇余心三复其言而悲之因次其韵
471143,和受之宫詹悼鹤诗二首时将赴朝命 其一
1179278,夏夜饯裴行军赴朝命
13320,夏夜饯裴行军赴朝命
1179253,饯裴行军赴朝命
434720,予以朝命催租河朔道出隆虑邂逅杨东卿盖栖霞隐人也尝许予小山以地远卒不能致约以后期故作是诗以为定券
199742,赠罗仲思仲思今夏来试群士八月予被朝命为别
839528,殷芝阶先生今春奉朝命重游泮宫，征诗奉贺，率成十六韵呈正
979017,赠罗仲思仲思今夏来试群士八月予被朝命为别试所考试仲思亦来
253448,予以朝命催租河朔道出隆虑邂逅
319298,送研樵·朝命兼边寄
9952,刘侍御朝命许停官归侍
698507,和受之宫詹悼鹤诗二首时将赴朝命
263083,殷芝阶先生今春奉朝命重游泮宫征诗奉贺率成十六韵呈正
