1072606,再和一篇兼寄朱希真
183473,用诸公本韵各和一篇
1068857,用伯初韵再和一篇请子温户曹同赋
139324,余有重阳诗岁和一篇今日偶和成
1068550,长句送以道既辱和答而夏传圣诗亦用此韵以道复和一篇篇末颇及少逸与不肖因再赋此传圣姻家书问必数或可达以道
889039,余有重阳诗岁和一篇今日偶和成二首 其二
1070142,再和一篇以答固穷之句
1081767,行简以曾守韵见贻复和一篇
1078863,应文监视刈穫有诗辄和一篇恐以一饱废学因而勉之
922985,用诸公本韵各和一篇共三首 其一
594953,太保临淮李公寄扈从诸诗辄和一篇
889040,余有重阳诗岁和一篇今日偶和成二首 其一
352149,应文监视刈穫有诗辄和一篇恐以一饱废学因而勉之
889258,拙者有重阳诗以阳字韵岁和一篇复继前作
1084531,九日会饮予为唱首自和凡数篇皆因事叙情尔未作重九诗也今再和一篇每句用事而不见姓名末联外馀皆略存对偶必有能和之者
324496,再和一篇兼寄朱希真
139353,拙者有重阳诗以阳字韵岁和一篇复继前作
922984,用诸公本韵各和一篇共三首 其二
1116888,用诸公本韵各和一篇共三首
1087771,丁丑冬在温陵陪敦宗李丈与一二道人同和东坡惠州梅花诗皆一再往反昨日见梅追省前事忽忽五年旧诗不复可记忆再和一篇呈诸友兄一笑同赋
335280,行简以曾守韵见贻复和一篇
922983,用诸公本韵各和一篇共三首 其三
1111744,余有重阳诗岁和一篇今日偶和成二首
