453136,元月三日大雪，会张生于蒋宅口仙踪林，归赋有寄
1043900,灯夕陈大夫来会张承议以病不出有诗赠陈次韵和之
19636,病中数会张道士见讥以此答之
106942,会张仲实宅得天字
248456,元月三日大雪会张生于蒋宅口仙踪林归赋有寄
599179,丙申春同诸社丈北郊会张吴二将军杨武生邀酌松下晚归书事二首 其二
364664,灯夕陈大夫来会张承议以病不出有诗赠陈次韵和之
691075,丙申春同诸社丈北郊会张吴二将军杨武生邀酌松下晚归书事二首
201139,忆陪诸公会张侯之第
1057088,和李善初会张范二公
524111,新秋宣威后堂会张鲍二帅晚过东圃作
220209,游罗汉院因会张良辅大夫遂留於壁
1147333,奉和袁使君高郡中新亭会张鍊师昼会二上人
1134676,会张仲实宅得天字
599178,丙申春同诸社丈北郊会张吴二将军杨武生邀酌松下晚归书事二首 其一
1041096,新作凉轩会张拱辰至
36658,奉和袁使君高郡中新亭会张炼师昼会二上人
347579,和李善初会张范二公
1168800,会张生述怀
904116,游罗汉院因会张良辅大夫遂留于壁
36689,与王录事会张征君姊妹炼师院玩雪兼怀清会上人
36104,会张生述怀
827954,陶斋尚书作东坡生日宴集同人节庵师会张文襄公之葬亦来京师
1156434,病中数会张道士见讥以此荅之
959619,忆陪诸公会张侯之第
1147062,与王录事会张徵君姊妹鍊师院玩雪兼怀清会上人
1055887,维扬会张曼老陈瑩中分韵得柳字
