222785,子别母呈所翁陈先生
1099986,所翁为泳作小卷玩珠龙极其精妙赋玩珠吟一首追忆此友
645001,题陈所翁画龙
507188,题所翁龙
872538,题陈所翁为叶半隐作全龙邀同赋
187326,题李锐父所藏陈所翁龙轴
493425,奉和吟所翁二首 其二
108121,题罗观光藏陈所翁墨竹
216923,题陈所翁为叶半隐作全龙邀同赋
648791,题杨学士藏陈所翁四龙图
577226,所翁龙为员外郎尹祥赋
1136429,题罗观光藏陈所翁墨竹
337726,偶得虾酱怀所翁作
663089,题卢润卿所藏陈所翁画龙
1216615,题陈所翁九龙戏珠图
1028523,子别母呈所翁陈先生
1099968,偶得虾酱怀所翁作
1211437,题陈所翁龙
493424,奉和吟所翁二首 其一
339642,所翁为泳作小卷玩珠龙极其精妙赋玩珠吟
687083,奉和吟所翁二首
492957,题所翁墨龙
1224393,题陈所翁双龙图
961017,题李锐父所藏陈所翁龙轴
1231221,题所翁画龙
1216961,赠易学李所翁
51089,恭题宣庙画所翁画龙图
506606,题陈所翁画十四龙图
519462,陈所翁双龙卷
479104,恭题宣庙画所翁画龙图
678274,题所翁墨龙
1228661,陈所翁子雷岩画龙
