504039,九月廿五日值余初度诸友以诗酒见寿于舟中赋五言长律一首以谢云
545833,王仲升以五言长律见贻赋此答赠
1100246,五言长城
803500,陈同年梦溪，甲戌春偕计北上，路过兴济，壁间有五言长律一章，墨沈犹新而不着姓氏。诗曰 其二
803499,陈同年梦溪，甲戌春偕计北上，路过兴济，壁间有五言长律一章，墨沈犹新而不着姓氏。诗曰 其一
536820,天子诏职方张君子畏发齐兵平吴世贞吴人也恨不得从一卒之列慨然歌五言长篇为赠
878145,竹溪直院盛称起予草堂诗之善暇日览之多有可恨者因效颦作十首亦前人广骚反骚之意内二十九首用旧题惟岁寒知松柏被褐怀珠玉三首效山谷馀十八首别命题或追录少作并存于卷以训童蒙之意 五言长城
137379,奉使道中五言长韵
1003958,入都一年馀舍馆五迁最后得杨园空屋僻远市嚣宽洁爽垲火后庄文府以中旨攘夺仓皇徙寓奉常之寅清堂成五言长篇
803498,陈同年梦溪，甲戌春偕计北上，路过兴济，壁间有五言长律一章，墨沈犹新而不着姓氏。诗曰
569995,感事得五言长律三十句时家弟敬美致关中书为归计因赋此寄之
954089,奉使道中五言长韵
810558,陈同年梦溪，甲戌春偕计北上，路过兴济，壁间有五言长律一章，墨沈犹新而不着姓氏。诗曰
973074,闻子耕司户兄非一日昨见墨帖于中州又诵五言长篇于刘子澄许今兹乃遂识面辄题鄙句以叙区区
650424,钦惟圣天子嗣大历服简用旧人懋图治理覃布恩德绥怀万方天地清宁海宇乂安乃以宣德戊申二月廿八日命少师吏部尚书臣蹇义臣幼孜等凡十有八人乘马将仆?从游万岁山已又命乘御舟泛太液池遍历小山诸处维时风日暄朗景物明丽氛埃屏息佳气郁葱心目舒畅得以周览奇胜复蒙天语从容慰劳赐以醇醪珍馔俾尽饮至醉恩意深厚宠赐便蕃诚终身之荣幸千载而一遇者也臣幼孜无任感激之至谨赋五言长律一首上进伏乞圣览不胜幸甚诗曰
568933,遇故将军袁泽知其为太常柳庄先生裔也因出洪武永乐中诸贤所贻先生诗文示之且赠以五言长体一章
491443,十月十三日燕相府知印张观复从江西来承大兄六月八日家问捧诵之馀悲喜交集因赋五言长歌一首奉报匪敢言诗姑述怀耳
595206,夏日晚发夏津至清平公署阻雨赋五言长排十八韵
