921547,见子由与孔常父唱和诗，辄次其韵。余昔在馆中，同舍出入，辄相聚饮酒赋诗。近岁不复讲，故终篇及之，庶几诸公稍复其旧，亦太平盛事也
931285,甲子岁十月二十四日夜半梦遇故人于山水间饮酒赋诗既觉仅能记一二乃追补之二首 其一
1063350,大观四年春吾与友人任景初舍弟端孺自蜀来京师至长安时方寒食吾三人相与戎服游九龙池饮酒赋诗乐甚是岁吾迁岭表明年景初亦谪江左忽忽数岁皆未得去寒食无几念念悽然作诗寄任因命舍弟同赋
1117774,甲子岁十月二十四日夜半梦遇故人于山水间饮酒赋诗既觉仅能记一二乃追补之二首
134714,去岁与东郡幕府君同游河亭望太行雪饮酒赋诗
247533,壬辰八月夜梦饮酒赋诗
440248,壬辰八月夜梦饮酒赋诗“只有秋心敌酒肠”。次夕秋分，过马蹄湖，荷花都尽，忆梦中句，足以完之
998886,予卧病数日意思殊昏昏中秋强起陪老人把酒对月不敢濡唇吻思去岁在当涂试院与诸公饮酒赋诗又一载矣因成长句
346035,读张彦明饮酒赋诗唱酬次韵归之
1073507,余大观中偕何袭明登仕同为太学诸生别后二十六年余□南迁道清江袭明逆余于新淦之洲上苍颜白发大略相似感叹之馀饮酒赋诗以为笑乐袭明笔力雄赡操纸立就凡六七反必用前韵余继和者十二篇云 其一
869958,去岁与东郡幕府诸君同游河亭望太行雪饮酒赋诗今冬罢归京邑怅然有怀
1073508,余大观中偕何袭明登仕同为太学诸生别后二十六年余□南迁道清江袭明逆余于新淦之洲上苍颜白发大略相似感叹之馀饮酒赋诗以为笑乐袭明笔力雄赡操纸立就凡六七反必用前韵余继和者十二篇云 其二
1110465,余大观中偕何袭明登仕同为太学诸生别后二十六年余□南迁道清江袭明逆余于新淦之洲上苍颜白发大略相似感叹之馀饮酒赋诗以为笑乐袭明笔力雄赡操纸立就凡六七反必用前韵余继和者十二篇云
1073653,读张彦明饮酒赋诗唱酬次韵归之
901953,余于今年二月初一日夜梦中与刘彦礼兄弟水边饮酒赋诗曾记所作元八句忘其馀今足成之
1243525,梅友公游芙蓉峰探神仙遗迹登高长啸俯视尘世然后朗吟步月而归自魏晋之下曹氏父子桓温庾亮之徒登高对月饮酒赋诗其后寂寥千年世无斯乐今公乃能以雅道继之盖庶几焉予足不至此山几年矣因公之游遂唤醒旧梦从道复出诗见示遂次韵焉
918220,程存虚梦与六人饮酒赋诗余亦与焉而眉长夹鼻下与髯齐觉而记其诗以见示或以此为余寿徵因忆罗汉中有长眉尊者戏次韵
931284,甲子岁十月二十四日夜半梦遇故人于山水间饮酒赋诗既觉仅能记一二乃追补之二首 其二
245370,程存虚梦与六人饮酒赋诗余亦焉而眉长夹鼻下
1137510,长儿授馆于杭每休暇过仲实家相与谭经析理间则饮酒赋诗为乐今闰秋十四日会于复轩相视而笑曰好天凉月即中秋况今岁两中秋乎乃留饮剧论夜参半蝉联不休情愈郁穆予闻之甚喜因为诗寄之
