686110,量移司农分署答李成白姚巽卿二首
1251151,崆峒云居为曾巽卿赋
606391,姚巽卿见过遇雨而返辄有赠言答和二首 其一
541269,同山人林熙甫父老陈焜诸生陈巽卿陈练游菱溪五云山 其二
606392,姚巽卿见过遇雨而返辄有赠言答和二首 其二
686001,和巽卿至后登台二首
488438,严濑舟中诵姚巽卿赠别诗有世路危于七里滩作此寄意
607056,姚巽卿过留小酌别后有作答和
606405,和巽卿至后登台二首 其二
685997,姚巽卿见过遇雨而返辄有赠言答和二首
541270,同山人林熙甫父老陈焜诸生陈巽卿陈练游菱溪五云山 其三
827170,宴西园 怀黄巽卿
541224,饮陈巽卿宅即席赋得帝字
297800,宴西园·怀黄巽卿
750965,端午日同严秋樵劳巽卿袁孝宰南观饮酒
606404,和巽卿至后登台二首 其一
488335,送姚巽卿
541445,漫题柬徐弼卿张仲矩二国子陈巽卿洪子崇江惟城三茂才
607156,量移司农分署答李成白姚巽卿二首 其二
611195,登舟留别姚巽卿
607155,量移司农分署答李成白姚巽卿二首 其一
487773,寒食病起寄郑文蔚陈尧勋姚巽卿
607076,小至和杜答巽卿
541268,同山人林熙甫父老陈焜诸生陈巽卿陈练游菱溪五云山 其一
686375,同山人林熙甫父老陈焜诸生陈巽卿陈练游菱溪五云山
542025,八月十三夜谭鸿胪子羽第同李太史子寔张给事巽卿莫膳部子良赋得秋字
