958389,石季平题李南画石之傍曰叠石为山已是一重公案况画者耶郑子见而笑之明日戏成伽佗问随缘云随缘居士即季平道号也
313987,贺新郎·别文梁、洛闻之明日，宿江堰镇却寄
928679,戍兵有新婚之明日遂行者予闻而悲之为作绝句二首 其二
654696,传胪之明日赐宴礼部凡供事者皆与焉都宪屠公又赋一律仆再和之
855025,县境不雨祷响潭得之明日一龟出潭水上取以归县斋诸进士有诗因作一首
424809,题清人王仲瞿住谷城之明日谨以牛膏斗酒合琵琶三十二弦侑祭于西楚霸王之墓诗后 其三
851288,拜罗氏百岁母之明日主人举酒客张千载心赋诗某喜赞不自已见之趁韵
146203,拜罗氏百岁母之明日主人举酒客张千载心赋诗
163731,归班之明日以六参人趁起居
973956,毕叔文携坡帖及与季真给事倡酬诗卷见访于邢大声家相与观之明日次韵淳熙癸卯正月二十有一日也
433319,题清人王仲瞿住谷城之明日谨以牛膏斗酒合琵琶三十二弦侑祭于西楚霸王之墓诗后
948921,顷创棋色之论邦衡深然之明日府中花会戏成二绝 其一
314336,题清人王仲瞿住谷城之明日谨以牛膏斗酒合琵琶三十二弦侑祭于西楚霸王之墓诗后
982232,壬午春社之明日请尊老会于西山之精舍庞眉皓首奕奕相照真吾邦希阔之盛事辄成口号一首并呈诸耆寿且坚异日早退之约云
1144353,癸酉三月园亭小饮之明日又适澹斋所薄暮醉归广文寄佳句二首走笔次韵
424808,题清人王仲瞿住谷城之明日谨以牛膏斗酒合琵琶三十二弦侑祭于西楚霸王之墓诗后 其二
82863,新津小宴之明日欲游修觉寺以雨不果呈范舍人
1233560,郡厅宴集之明日乡先生复为置酒重述口号
152320,顷创棋色之论邦衡深然之明日府中花会戏成
1139018,癸酉三月园亭小饮之明日又适澹斋所薄暮醉归广文寄佳句二首走笔次韵 其一
930173,新津小宴之明日欲游修觉寺以雨不果呈范舍人二首 其一
410618,后七夕八一二之明日，上海以虹桥事件开战
101263,述古闻之明日即来坐上复用前韵同赋
424807,题清人王仲瞿住谷城之明日谨以牛膏斗酒合琵琶三十二弦侑祭于西楚霸王之墓诗后 其一
492063,至里良之明日闻抄兵已入长兴因赋以自慰
769649,贺新郎·别文梁、洛闻之明日，宿江堰镇却寄
934937,九月六夜梦中作笑诗觉而忘之明日戏追补一首
1035324,鹊桥仙 七夕之明日载酒李彭州家即席赋
570036,诗成之明日而王翁疾甚又明日就木矣感叹之余复得一章
1118226,新津小宴之明日欲游修觉寺以雨不果呈范舍人二首
1004051,初度诣葛仙化奉香火归邑之明日有驯鹿自中径入县庭士友异其事赋诗相庆用张权父韵
194957,县境不雨祷响潭得之明日一龟出潭水上取以归
1246843,黄君季伦下顾槐塘山中濒行具述院判相公天资高明识见超绝海内人士以之权衡轻重子不可不往谒之明日入城府巧不相值归而沉痾又复踰月辄陈鄙句谨候阍人以献
659123,癸未春予送女至京口至之明日为上元节是夜宴邃庵杨少傅第少傅悬灯于山灿烂奇甚
123850,寄上鄙句之明日舟次梅口南枝已有春意
920542,述古闻之，明日即至，坐上复用前韵同赋
513695,至河间之明日拜扫先世赐茔
282413,后七夕八一二之明日，上海以虹桥事件开战
182827,祠二庙之明日未得顺风呈同行
185737,癸酉三月园小饮之明日又适澹斋所薄暮醉归广
930172,新津小宴之明日欲游修觉寺以雨不果呈范舍人二首 其二
850576,祠二庙之明日未得顺风呈同行
1003767,归班之明日以六参入趁起居
163523,初度诣葛仙化奉香火归邑之明日有驯鹿自中径
574744,树儿埋之明日视冢还有感
935536,戍兵有新婚之明日遂行者予闻而悲之为作绝句二首 其一
1072254,比过石壁访王元渤舍人欲观棋战闻同鱼轩出游独与戎琳二师对语久之明日元渤有诗见贻次韵奉酬
233959,壬午春社之明日请尊老会于西山之精舍庞眉皓
1118559,戍兵有新婚之明日遂行者予闻而悲之为作绝句二首
352730,元夕之明日久阴乍晴月色皎然
923732,王子立与迟等游陈家园桥败几不成行晚自酒务往见之明日雨作偶尔成咏
1142314,杨求仁路教游何道山之明日余始自洞庭归恨不与隽游漫趁韵一笑
1000243,寒食安厚卿具酒馔邀数君子游压沙寺观梨花独苏子由不至诗来命座客同赋予既次韵和之明日上巳安复置酒招予与苏又明日清明予屈二君为射饮之会而苏君仍用前韵作诗见及予亦复和
1139017,癸酉三月园亭小饮之明日又适澹斋所薄暮醉归广文寄佳句二首走笔次韵 其二
948322,顷创棋色之论邦衡深然之明日府中花会戏成二绝 其二
574493,上巳之明日登锡山顶一首
957199,寄上鄙句之明日舟次梅口南枝已有春意复次知府秘书赠行高韵
1089525,元夕之明日久阴乍晴月色皎然
1120345,顷创棋色之论邦衡深然之明日府中花会戏成二绝
