936958,绵州录参厅观姜楚公画鹰少陵为作诗者
939919,送澶州录曹宋参军
917013,赠别蔡武子被诬得释赴泉州录参
1032657,送赵几道赴台州录事
1152973,信州录事参军常曾古鼎歌
1172040,送从弟永任饶州录事参军
437173,送雷希颜之泾州录事李君美治中公廨南楼坐中作
1225375,送赵季文任湖州录判
1173862,送韦讽上阆州录事参军
6870,送从弟永任饶州录事参军
1083806,题处州录参厅平远楼
169050,送澶州录曹宋参军
260569,送雷希颜之泾州录事李君美治中公廨南楼坐中作
1224353,送聂太祝赴潮州录事聂天历潜邸旧人
324855,题处州录参厅平远楼
1220111,送吴叔巽赴湖州录事
6112,信州录事参军常曾古鼎歌
194008,送赵几道赴台州录事
1208593,欧阳南阳还临江便道之官庐陵幕府（前翰林检阅抚州录判）
952302,送思深赴泉州录参
1246077,送郑希道行省掾满之泉州录事
8905,东津送韦讽摄阆州录事
235838,赠别蔡武子被诬得释赴泉州录参
1172808,东津送韦讽摄阆州录事
76648,绵州录参厅观姜楚公画鹰少陵为作诗
184646,寄黄州录事刘进之同年
13539,春送十四叔赴任渝州录事绝句
1161698,春送十四叔赴任渝州录事绝句
238375,送思深赴泉州录参
7380,送韦讽上阆州录事参军
883163,寄黄州录事刘进之同年
