1125004,去八月同张文饶考试始遂言集执经问道至今不敢忘因成二诗
852538,寄员文饶屯田
87871,李文饶·画取维州如槁叶
215033,文饶自昌国以诗见寄次韵
342049,八绝句·心禀犀文饶地力
436480,并门无竹旧矣李文饶尝一植之至今寺僧日为平安报其难可知已官舍东堂之北种碧芦以寄意因作长句
978685,去八月同张文饶考试始遂言集执经问道至今不敢忘因成二诗 其二
165813,松菊堂读史·不作文饶将相官
199733,赠张文饶·乾坤五十策
991422,送韩文饶寺丞宰萧山
984806,次韵刘文饶题绝尘亭
1053370,次韵文饶同自龙井出资国度泛舟以归北山
363885,送韩七文饶郎中再知解州
947661,苏文饶往昌国意颇惮之送以诗因勉之
947628,文饶自昌国以诗见寄次韵二首 其二
199833,去八月同张文饶考试始遂言集执经问道至今
378043,次韵文饶同自龙井出资国度泛舟以归北山
165748,池上·文饶论百揆
875332,李文饶一首
883649,次韵苏文饶见贻之什
991423,送韩文饶赞善宰河南
378038,同苏文饶主簿西湖夜泛
984589,次韵刘文饶题绝尘亭诗
1053334,同苏文饶主簿西湖夜泛
1028759,主簿昨示喜雨之作末章用李文饶故事非所敢闻用韵回纳
364583,送韩文饶知均州
369770,次韵苏文饶待舟书事
1071846,次韵苏文饶待舟书事
215037,苏文饶往昌国意颇惮之送以诗因勉之
1120214,文饶自昌国以诗见寄次韵二首
154392,寄员文饶屯田
947627,文饶自京师还欲往昌国而风作不可渡乃为绝句戏之
947629,文饶自昌国以诗见寄次韵二首 其一
191187,主簿昨示喜雨之作末章用李文饶故事非所敢闻
325968,次韵苏文饶见贻之什
174263,次韵刘文饶题绝尘亭诗
1071696,至国门闻苏文饶将出都戏赠长句兼简其兄世美
1043494,送韩七文饶郎中再知解州
979016,赠张文饶
104896,送韩文饶赞善宰河南
1043487,送韩文饶知均州
259085,并门无竹旧矣李文饶尝
104899,送韩文饶寺丞宰萧山
950907,上高赵宰同叔遗以诚斋集开卷偶见答徐宋臣监丞书云来帖告诉门生排根尝闻前辈谓受人之恩而不忘者为子必孝为臣必忠盖推是心而信其人也又闻惟以怨报德者为不可测盖以有人之形者必有人之情也故卢杞之于颜公敏中之于文饶之奇之于永叔邢恕之于君实孰测其报恩一至此极哉昔孟尝君有一客孟尝遇之甚厚而客每毁孟尝或问其故客曰人皆誉君而我独毁人必以我为小人而以君为长者此吾所以报君也前五子者其意将无出于此欤至如逄蒙杀羿之事孟子不责蒙而
978686,去八月同张文饶考试始遂言集执经问道至今不敢忘因成二诗 其一
