622068,晓发新城喜见西山山色尚在明灭间也
313282,思佳客·绮云字自伦敦寄示天士河图，云将迟余于红桥白舫间也
826328,思佳客·绮云字自伦敦寄示天士河图，云将迟余于红桥白舫间也
1079596,晁叔用得古镜二一以遗法一上人澄澈可爱底水隐然蜃楼突起又作杯渡禅师像翩然衣动正在中流间也一求记于予因为作歌
420289,陌上花 题董选观春雨斋填词图卷。君自禾中避乱来江汉间也
307080,自均州以西滩岭丛杂一千九百馀里每夜泊舟听雨闻猿盖经两月日行万壑间也
1079600,往年与关止叔相别甬上止叔见勉学道甚勤且曰无为专事文字间也及今五年矣尚未有所就因作诗见志且以自警也
419158,好事近 乙酉仲春，自灵峰访鹭山于大荆，不见三月矣。二灵间花事甚盛，惜匆匆在兵尘间也
535554,郑都官尝作代秋扇词予窃见其多怨尤不平之意非知道者之言遂赋此以广之非欲竞工拙于声律间也
1141372,太学冬至日同斋朋友先以兄弟叙拜讫遍诣诸斋行礼出遂置酒湖上衣冠谈笑之乐至今栩栩在念间也因至日去近二十九和为正仲道之
872638,有客来从阳羡闻元绩离家已月馀由昆山过临安桐庐计今合归矣元绩当不惜迂路一访仆于苕霅间也戏为一绝招之元绩纯孝人每在道念亲殊切
819526,自均州以西滩岭丛杂一千九百馀里每夜泊舟听雨闻猿盖经两月日行万壑间也
