108025,赠程君以忠杨君泰之
471969,新都程君房寄墨数螺道中为税使所榷戏作志感
1135709,赠程君以忠杨君泰之 其一
337768,程君履以薛宰书见访
1232050,送程君俊学正归浔阳
488476,春日得程君衡书却寄
428454,癸亥九月偕程君颂嘉、王子云轩、顾子经笙、吴子干卿游青山寺纪之以诗三首 其一
1134791,次韵休宁程君圉来访
106579,次韵休宁程君圉来访君先公伯祥秋崖先生之
713570,送程君还歙
301729,癸亥九月偕程君颂嘉、王子云轩、顾子经笙、吴子干卿游青山寺纪之以诗
431498,癸亥九月偕程君颂嘉、王子云轩、顾子经笙、吴子干卿游青山寺纪之以诗三首
53374,新都程君房寄墨数螺道中为税使所榷戏作志感
1135710,赠程君以忠杨君泰之 其二
428456,癸亥九月偕程君颂嘉、王子云轩、顾子经笙、吴子斡卿游青山寺纪之以诗三首 其三
1143908,赠程君以忠杨君泰之
482387,次韵奉和仙居知县程奉民述（时程君为人所诬，方就逮，而有是作）
778033,念奴娇·题程君姬人俪青墓志后1925
488238,题程君衡扇面
1099997,程君履以薛宰书见访
536620,程君将北游谒余诗为赠君精易数独谓余尚当出余不许也
501649,三衢程君璋氏访友临漳将归赋此以赠
428455,癸亥九月偕程君颂嘉、王子云轩、顾子经笙、吴子斡卿游青山寺纪之以诗三首 其二
488468,槜李舟中题扇头梅花寄程君衡
1067769,里儒程君穷居教弟子员喜雨作诗见贻次韵谢之
