790689,忆同学徐拙庵侍御二首 其一
583551,煎茶和赵侍御二首 其一
581113,别周侍御二首 其一
597979,山中寄别杨少参之七闽兼怀颜侍御二首 其一
669155,送别南衡童侍御二首 其一
1168075,宣州九日闻崔四侍御与宇文太守游敬亭余时登响山不同此赏醉后寄崔侍御二首 其一
651934,发沅州舟中寄陈侍御二首 其一
1182338,随州献李侍御二首 其一
638544,和罗一峰赠王乐用侍御二首 其一
1228464,古意怀仲章贡侍御二首 其一
540735,十二月立春日简栾侍御二首 其一
526137,挽程良用侍御二首 其一
1050980,别贾侍御二首 其一
975721,再过溧阳县见李侍御二首 其一
589459,宴别程古川侍御二首 其一
894276,涉淮溯清迫于冰涸舟次下邳先寄彭门赵侍御二首 其一
1135345,送程侍御二首 其一
529726,逢方仲敏侍御二首 其一
666484,赠苏允吉侍御二首 其一
523589,秋日吕公西园同玉溪侍御二首 其一
973225,寄处州季侍御二首 其一
877236,送洪侍御二首 其一
534870,秦宫保封丘祠次王侍御二首 其一
549307,赠别李本晦侍御二首 其一
1160230,山中寄元二侍御二首 其一
583412,再用前韵走笔答方时鸣侍御二首 其一
