39759,答赵景猷·导以水柔
977767,以水石菖蒲赠谷堂孙漕
106707,读素问·凡火以水沃
1112919,以水仙花供都运判院
581618,予生日属火以水用事每值戊年戊土伤水辄罗否剥除九龄少小不能记忆自十九至于今四历兹口地支虽异祸患则均腊穷幸其去于岁月之迈有不暇惜云时在戊午饯岁赋以送之
1062640,以水沈香寄吕居仁戏作六言二首 其一
908480,晚步江浒有得鼋大如箕赎放之邻叟言此家前数日已尝得一煮之通夕旦发盎视之鼋忽引首以水喷其面兹亦可惊异者作是诗以为好杀者之戒
958046,饭后以水噀蚁时予有华严日课
945214,次韵戴帅初以水涨不及赴茂林醵饮重午
1062641,以水沈香寄吕居仁戏作六言二首 其二
82496,新移竹栽喜於得雨而池中鸂鶒乃以水溢而去戏
93261,喜雨口号·苏湖元以水为乡
1063665,何忠孺家有石如砚以水灌之有枝叶出石间如岩桂状为作此
1128770,以水沈香寄吕居仁戏作六言二首
131426,次韵戴帅初以水涨不及赴茂林醵饮重午
916564,传言玉女 其一 许永之以水仙、瑞香、黄香梅、幽兰同坐，名生四和，即席赋此
1115619,进贤初食白菜因名之以水精菜云二首
937171,新移竹栽喜于得雨而池中鸂鶒乃以水溢而去戏以长句记之
279409,南浦·蔡冰吾大愚别廿五年矣，闻其在汉皋，以水龙韵寄之，冰吾依此调见答，用韵酬之
912727,进贤初食白菜因名之以水精菜云二首 其二
502756,题林逸人水竹居巷中州逸人隐于横塘所居环树脩竹凿池以通潮汐暇日常宴坐其中与道徜徉澹如也因以水竹居自名其堂且索予长句诗就主人击节而歌歌竟请书为赠文
906667,诸刹以水激硙磨殊可观为赋此诗
92121,进贤初食白菜因名之以水精菜云
182027,饭后以水噀蚁时予有华严日课
351956,以水仙花供都运判院
1089143,以水仙花供都运判院 其一
63669,知非吟·鱼以水为命
912728,进贤初食白菜因名之以水精菜云二首 其一
1089144,以水仙花供都运判院 其二
822661,南浦 蔡冰吾大愚别廿五年矣，闻其在汉皋，以水龙韵寄之，冰吾依此调见答，用韵酬之
