992129,达观禅师昙颖住隐静兰若或言自此猕猴散走不来颖尝哂曰吾知是山枇杷为多始至也未实故其去将实也必群集后果然颖恶乎俗之好异恐传以为人惑欲予咏而播之
1075210,米元章为须江太守闻有怪石在河壖莫知其所自来人以为异而不敢取公命移置州沼为燕游之玩石至而惊遽命设席拜于庭下曰吾欲见石兄二十年矣闻者以为言坐是罢去余游濡须而石犹在询之邦人信然乃作此诗
562348,赤城吕徽之博闻强识宋亡遂晦不仕一日大雪中至巨家易谷立堂下久之堂东偏众客方咏雪有分韵得蝶字者艾思不就徽之不觉失笑咸诘之曰汝何笑曰吾欲用滕王蛱蝶事耳众客皆惊阴知其为徽之也延之坐不可欲赒以谷辞既去使人尾之至其居地极幽阻及雪霁候焉荆扉竹屋不蔽风雨见桶中坐一妇人盖其妻也问徽之所在曰出捕鱼矣得于溪上具言所以来之意曰诸子可少留乃换酒共饮返宿道傍大楼下主人怪舆马之盛因言其状主人亦不知有徽之也明日求之则已迁居矣徽之
1036154,水龙吟 昔谢自然欲过海求师蓬莱，至海中，或谓自然，蓬莱隔弱水三十万里，不可到。天台有司马子微，身居赤城，名在绛阙，可往从之，自然乃还，受道于子微。白日仙去，子微著坐忘论七篇，枢一篇，年百馀，将终，谓弟子曰：吾居玉霄峰，东望蓬莱，尝有真灵降焉，今为东海青童君所召，乃蝉脱而去。其后李太白作大鹏赋云：尝见子微于江陵，谓余有仙风道骨，可与神游八极之表。元丰七年冬余过临淮，而湛然先生梁公在焉，童颜清彻，如二
1244677,汸始见黄先生问生何岁对曰己未先生曰吾六经补注以己未年刊或曰书已刻矣恨无读者吾应之曰恐读者未生尔岂知子之生年乃吾刊书之岁又获相交岂非偶然乎乃命春秋之学今年二十有七年矣值愚生朝次思敬韵以寓其感云
888786,括苍胡经仲以经术授吾乡子弟仆顷过钱塘得吾兄永言多益及友人孟世功书未尝不以得交经仲为言且以其往还诗什相示已决知经仲非尘埃中人矣春初归自钱塘遂获识经仲于斋馆信数公之知人交道之不朽一年之间凡三相会从容谈笑者盖十许日而诗筒之循环来往曾未尝辍而仆之心犹以不得朝夕见经仲为恨也一日经仲来访席未定乃谓仆曰吾将归乡明年不复来此矣仆念经仲之贤交游中所未有顾世方扰攘会合无期临风语离殆不胜依黯因诵老杜人生足别离之句作五绝
588374,己酉岁壬辰之夜梦与三洲李丈登高台遥望中原但见齐州九点在苍霭中隐隐可辨三洲曰宇宙内事吾儒分内事也曰子知分内之事则知尽分内之道乎三洲又曰吾今乃知居高则明处下则塞曰子知明塞之义则知尽居处之道矣三洲又曰天地山河存乎两界秦晋为首闽越为尾馀皆毛发肢节也曰子通督任之义则知通致理之源矣须臾云霞四歛皎日照衣环顾太和万物融合浑为一丸三洲曰此所谓弄丸者耶曰子知转九之义则宇宙之柄在手矣语罢而觉遂赋四章以纪其事因以赠三洲之
888784,括苍胡经仲以经术授吾乡子弟仆顷过钱塘得吾兄永言多益及友人孟世功书未尝不以得交经仲为言且以其往还诗什相示已决知经仲非尘埃中人矣春初归自钱塘遂获识经仲于斋馆信数公之知人交道之不朽一年之间凡三相会从容谈笑者盖十许日而诗筒之循环来往曾未尝辍而仆之心犹以不得朝夕见经仲为恨也一日经仲来访席未定乃谓仆曰吾将归乡明年不复来此矣仆念经仲之贤交游中所未有顾世方扰攘会合无期临风语离殆不胜依黯因诵老杜人生足别离之句作五绝
889592,括苍胡经仲以经术授吾乡子弟仆顷过钱塘得吾兄永言多益及友人孟世功书未尝不以得交经仲为言且以其往还诗什相示已决知经仲非尘埃中人矣春初归自钱塘遂获识经仲于斋馆信数公之知人交道之不朽一年之间凡三相会从容谈笑者盖十许日而诗筒之循环来往曾未尝辍而仆之心犹以不得朝夕见经仲为恨也一日经仲来访席未定乃谓仆曰吾将归乡明年不复来此矣仆念经仲之贤交游中所未有顾世方扰攘会合无期临风语离殆不胜依黯因诵老杜人生足别离之句作五绝
1036102,满江红 董毅夫名钺，自梓漕得罪。罢官东川。归鄱阳，遇东坡于齐安。怪其丰暇自得。余问之。曰：吾再娶柳氏，三日而去官。吾固不戚戚，而忧柳氏不能忘怀于进退也。已而欣然。同忧患若处富贵，吾是以益安焉。命其侍儿歌其所作满江红。嗟叹之不足，乃次其韵
1009094,岫家居昌国南海上安期先生炼丹之地乡曰安期忆十岁时父携至于家山嘱之曰吾死当葬此地南水上时正朝此处可以荫汝父死日奉遗言而葬焉家废后岫出家从释为僧来多病多难幸不致死今已六十二岁虽学佛无所知粗明善恶因果不堕凡愚数中实父遗言所及今作一偈以代墓志云
980488,有客从伯父大夫问说之者伯父报之曰吾侄家中焚香读楚辞耳因得诗一首拜呈
830279,林文忠赴戍伊犁道遇所亲绘像赠之曰吾老矣恐不能生入玉门聊当齿发还乡也拜观感赋
1005170,丙子兵祸台温为烈宁海虽经焚掠然耕者不废丁丑粗为有秋但种秫者少以醉人为瑞物吾亦似陶靖节时或无酒雅咏不辍也八月初九日连日雷雨溪路阻绝山房岑寂此夕初霁浊酒新漉数酌竟步秋树阴潭鱼可数望前峰老枫数十株已无色白鸟飞翻去来是中有惠崇大年笔家人遣两力来迎因倒坐篮舆而归人或问之戏答曰吾日莫途远故倒行也记以三绝 其一
1005168,丙子兵祸台温为烈宁海虽经焚掠然耕者不废丁丑粗为有秋但种秫者少以醉人为瑞物吾亦似陶靖节时或无酒雅咏不辍也八月初九日连日雷雨溪路阻绝山房岑寂此夕初霁浊酒新漉数酌竟步秋树阴潭鱼可数望前峰老枫数十株已无色白鸟飞翻去来是中有惠崇大年笔家人遣两力来迎因倒坐篮舆而归人或问之戏答曰吾日莫途远故倒行也记以三绝 其三
1111818,括苍胡经仲以经术授吾乡子弟仆顷过钱塘得吾兄永言多益及友人孟世功书未尝不以得交经仲为言且以其往还诗什相示已决知经仲非尘埃中人矣春初归自钱塘遂获识经仲于斋馆信数公之知人交道之不朽一年之间凡三相会从容谈笑者盖十许日而诗筒之循环来往曾未尝辍而仆之心犹以不得朝夕见经仲为恨也一日经仲来访席未定乃谓仆曰吾将归乡明年不复来此矣仆念经仲之贤交游中所未有顾世方扰攘会合无期临风语离殆不胜依黯因诵老杜人生足别离之句作五绝
888785,括苍胡经仲以经术授吾乡子弟仆顷过钱塘得吾兄永言多益及友人孟世功书未尝不以得交经仲为言且以其往还诗什相示已决知经仲非尘埃中人矣春初归自钱塘遂获识经仲于斋馆信数公之知人交道之不朽一年之间凡三相会从容谈笑者盖十许日而诗筒之循环来往曾未尝辍而仆之心犹以不得朝夕见经仲为恨也一日经仲来访席未定乃谓仆曰吾将归乡明年不复来此矣仆念经仲之贤交游中所未有顾世方扰攘会合无期临风语离殆不胜依黯因诵老杜人生足别离之句作五绝
918237,友人俞伯初梦余立悬崖飞瀑之下谓曰吾缘涧曲折而来泉声忽左忽右子其为我赋所未能伯初即句曰石根行步转耳畔水声移遂足成短篇见示次韵答之
1005169,丙子兵祸台温为烈宁海虽经焚掠然耕者不废丁丑粗为有秋但种秫者少以醉人为瑞物吾亦似陶靖节时或无酒雅咏不辍也八月初九日连日雷雨溪路阻绝山房岑寂此夕初霁浊酒新漉数酌竟步秋树阴潭鱼可数望前峰老枫数十株已无色白鸟飞翻去来是中有惠崇大年笔家人遣两力来迎因倒坐篮舆而归人或问之戏答曰吾日莫途远故倒行也记以三绝 其二
889591,括苍胡经仲以经术授吾乡子弟仆顷过钱塘得吾兄永言多益及友人孟世功书未尝不以得交经仲为言且以其往还诗什相示已决知经仲非尘埃中人矣春初归自钱塘遂获识经仲于斋馆信数公之知人交道之不朽一年之间凡三相会从容谈笑者盖十许日而诗筒之循环来往曾未尝辍而仆之心犹以不得朝夕见经仲为恨也一日经仲来访席未定乃谓仆曰吾将归乡明年不复来此矣仆念经仲之贤交游中所未有顾世方扰攘会合无期临风语离殆不胜依黯因诵老杜人生足别离之句作五绝
1214576,石门张氏园几二百年事见语溪志南石先生既宣慰河东退而家居每与宾友觞咏其中闻之里父老公之曾祖君为郡太守而归有指而詈之者阍人执以请命公曰彼安敢詈我与之酒且有以赠之责门者曰吾岂以贵势凌人哉汝不待教令而拘系之是扬吾恶名以为子孙累也逐而易之噫斯其所以嗣世益昌而此园之所以弗废与
498284,栎园姨翁幽楼久矣忽走京都人咸以宦情疑之余独知其不然也既而为荆川先生请谥朝奏疏夕报可客复有进议者曰『此时陈乞一荫得旨如寄耳』嘐然曰『吾驰走黄尘为先公易名两字耳今幸邀主恩归报家庙安能更贪羁绁为故山猿鹤笑耶』飘然策骑归逍遥林下余窃怪向之疑者真以腐鼠意鹓雏也记之以诗得转韵四十八句
149211,有客从伯父大夫问说之者伯父报之曰吾侄家中
611537,秋日访彭贞元留题时适有饷以酒者喜曰吾留客有胆矣可想其风致云
1128341,丙子兵祸台温为烈宁海虽经焚掠然耕者不废丁丑粗为有秋但种秫者少以醉人为瑞物吾亦似陶靖节时或无酒雅咏不辍也八月初九日连日雷雨溪路阻绝山房岑寂此夕初霁浊酒新漉数酌竟步秋树阴潭鱼可数望前峰老枫数十株已无色白鸟飞翻去来是中有惠崇大年笔家人遣两力来迎因倒坐篮舆而归人或问之戏答曰吾日莫途远故倒行也记以三绝
997684,王子才军中有道人鬻笔既售而去笑曰吾姓名在管中破视有细字曰李洞长求之不复见矣
