1133257,寓舍在青安门外由是出郊不数里群山献状如游龙如奔马如踞虎豹深秀坡陀不一而足似有招引赋诗之意遂约子野再用韵 其一
1143594,寓舍在青安门外由是出郊不数里群山献状如游龙如奔马如踞虎豹深秀坡陀不一而足似有招引赋诗之意遂约子野再用韵
1153354,郡斋左偏栽竹百馀竿炎凉已周青翠不改而为墙垣所蔽有乖爱赏假日命去斋居之东墙由是俯临轩阶低映帷户日夕相对颇有翛然之趣
1133256,寓舍在青安门外由是出郊不数里群山献状如游龙如奔马如踞虎豹深秀坡陀不一而足似有招引赋诗之意遂约子野再用韵 其二
1080058,会稽石道叟教授南剑兵火抢攘之馀兴治郡学尺椽片瓦皆其所自经营也未期月而学成远近赖之又祠前辈贤者以风励多士使游其间者望之而心化由是而入尧舜之道不难也古之教者盖多术矣五帝宪三王有乞言宪贤于乞言也道叟知之矣吕本中为作诗叙本末云
167391,寓舍在青安门外由是出郊不数里群山献状如游
772956,台俗富而悍僿而不文余葺横舍召生徒月必以试巾卷盈廷储金钱若干为母入其子为书院费复选刻海东课艺藉开文教风气由是荒陬僻陋多文学之士矣
1249180,海虞山人缪叔正扁舟相过以慰别后之思余谓兵后朋旧星散得一顷相见旷如隔世遂邀汝阳袁子英天平范君本彭城钱好学荣城赵善长扶风马孟昭聚首可诗斋内诸公亦乐就饮或携肴或挈果共成真率之会由是皆尽欢饮酒酣各赋诗以纪走笔而就兴有未尽者复能酬倡以乐永夜余以诗先成叔正俾余叙数语于篇首缅思烽火隔江近在百里今夕之会诚不易得况后会无期乎吴宫花草娄江风月今皆走麋鹿于瓦砾场矣独吾草堂宛在溪上余虽祝发尚能与诸公觞咏其下共忘此身于干戈
1208549,卫御史（故西台御史平阳卫弼字良佐延祐初以列郡守忤贵近意由是有旨罢西台良佐遂归亡何薨后数年识其子靖卿靖卿席世赏得官亦气节凛凛有父风云）
958461,封州学东池岁率孳鱼冬晚粥之用佐养士教授高公补之至以绍兴己已之春夏偶微旱至秋掌计者告匮试出池鱼则比旧加三倍得众谓公躬自临池鱼不化为苞苴故所获如是观如居士曰汉武帝时海旁民入租渔海鱼不胜计县官利而取之鱼不出捐以予民鱼乃再来由是知物之繁夥皆天道益寡之意教授念念以廪饩不继为忧则盛池鱼以丰其入亦天意哉戏赋之
