455319,清平乐 岁杪得倚云女史绘赠《小梅窗填词图》更蒙蛰堪兄首倡《清平乐》诸吟侣迭相和赠铭感于怀赋此一并拜谢
605235,曹能始观察以诗见怀赋此寄谢
676604,蔡九逵文徵仲王履约汤子重王履吉诸知己自吴来访欢数日别去怅然增怀赋此奉寄
569707,大中丞陈公自楚南服贻诗见怀赋此为谢
606783,李明府迁居延平忆旧里春宵之景有作见怀赋此和答
416489,齐天乐   丁巳季秋，于故纸中觅得先外王父郑晓涵先生手书，自辑《晚翠轩词》残稿一卷，先外王父曾自刊《晚学斋集》，流传亦稀，仅存硕果，览物怆怀，赋此一解
400096,洞仙歌 廖忏庵丈以词见怀，赋此却寄，并柬冯秋雪
598640,驿亭所至见总制王鉴川留题及捡所上封事数读之勃然兴怀赋此寄赠
247761,洞仙歌·廖忏庵丈以词见怀赋此却寄并柬冯秋雪
575470,练武太平，登南庙望北山古刹，感怀赋此
784527,易公仙公申兄弟，暨王兰谷宿盘山天城寺三日，历盘西剑台诸胜而归，未及追陪怅然于怀赋此却寄 其二
311563,望海潮·民国卅四年客南岳中学感怀赋此
813600,易公仙公申兄弟，暨王兰谷宿盘山天城寺三日，历盘西剑台诸胜而归，未及追陪怅然于怀赋此却寄
784526,易公仙公申兄弟，暨王兰谷宿盘山天城寺三日，历盘西剑台诸胜而归，未及追陪怅然于怀赋此却寄 其一
430579,霜天晓角 瓶中双射子，右株憔悴，左枝凄暗无色，似悼亡然。呜呼！鸳鸯同命，蝴蝶双生蝶双生，物犹如是，何况吾人？偶感近事，触目怆怀，赋此以当一哭
416580,望海潮  民国卅四年客南岳中学感怀赋此
673594,往山东独宿城东驿适中秋见月不寐有怀赋此
442861,已丑立春偕拱成淙祥二君饮茗于北阁观澜亭有怀赋此
400223,浪淘沙 与静庵不通音问二十年矣，庚戌秋日，得来书相讯起居，并以词见怀，赋此却寄
453636,徐绚老友读予仰斋存稿见怀赋此答之
604885,郑松门太史以诗送其里人纪贞石司训归善并以见怀赋此附谢
498778,甲寅九日建阳尹冯斗山见招以病不赴有诗见怀赋此答之
619693,寄答欧嘉可欧嘉可自五羊来过村居时余方入城亦访嘉可不值嘉可有诗见怀赋此奉答
784528,易公仙公申兄弟，暨王兰谷宿盘山天城寺三日，历盘西剑台诸胜而归，未及追陪怅然于怀赋此却寄 其三
