1245546,张静居寓菁山以清宴名堂要余题先以诗见美因赋此酬之并似周伯阳
920592,与周长官、李秀才游径山，二君先以诗见寄，次其韵二首 其二
650474,腊月四日同杨谕德晚出访友人李伯葵余回至长安街坠马遂在告数日胡学士先以诗见寄明日杨复以诗来相嘲因次韵奉答且以自解也然后诗结语盖答杨意也 其二
920591,与周长官、李秀才游径山，二君先以诗见寄，次其韵二首 其一
735306,废处山中友人沈哲先以诗见询依韵奉酬
99958,与周长官李秀才游径山二君先以诗见寄
99190,与周长官李秀才游径山二君先以诗见寄次其韵
677199,伯先偕徐女扬诸君见过留饮檀园别后伯先以诗见寄次韵
1116756,与周长官、李秀才游径山，二君先以诗见寄，次其韵二首
15175,酬乐天晚夏闲居欲相访先以诗见贻
696764,腊月四日同杨谕德晚出访友人李伯葵余回至长安街坠马遂在告数日胡学士先以诗见寄明日杨复以诗来相嘲因次韵奉答且以自解也然后诗结语盖答杨意也
650473,腊月四日同杨谕德晚出访友人李伯葵余回至长安街坠马遂在告数日胡学士先以诗见寄明日杨复以诗来相嘲因次韵奉答且以自解也然后诗结语盖答杨意也 其一
