792489,锡山闲咏四首 其一
240147,追赋暮游·锡山舟泊似荒村
343747,早发晋陵望锡山
945253,杖锡山别前人
140952,自锡山归舟中
716857,送王处士灵柩归祔锡山先茔 其三
792491,锡山闲咏四首 其三
661627,锡山道中闻子规
309350,珍珠帘·锡山春泛示浣孙
548579,同沈明府顾文学冯茂才诸君汎莲蓉湖看香船灯时与锡山塔灯相望因赋
87561,感旧七绝句·锡山落在暮云边
144964,仗锡山·高寒雪窦顶
690375,读乌符观碑刻无上宫访蒋晖诗四首 其二 闻钱与谦报寄锡山同年华文光
809474,雨过锡山
674996,舟宿锡山途中
809433,锡山
764981,满江红 至锡山赠吴伯成明府，再用荔裳、顾庵诸先生原韵
526448,自荆溪问道往锡山
1009868,仗锡山中
945021,同黄东发提举游杖锡山
270996,虞美人·过锡山秦园访留仙太史不遇作
558717,读乌符观碑刻无上宫访蒋晖诗四首 其二 闻钱与谦报寄锡山同年华文光
344262,闻骏孙将之锡山却寄
295101,过锡山谒李紫璈师
570805,王山人承父赴顾益卿中丞之约道经锡山诣陈稚登言别陈为叙出塞之艰涕泗不已承父愀然返棹作四绝句记之余属和焉 其二
716858,送王处士灵柩归祔锡山先茔 其四
350950,步月·月下携小婢登锡山
768485,折红梅 锡山舟中遣兴
574520,观锡山塔基寄顾少参与成
331548,季言送余至湖外欲往无为挈其姊旅榇归锡山悯其勤赠此一绝
470589,锡山夜别闲孟子薪彦逸及从子宜之儿子杭之 其二
1070854,送禹功还锡山
1077673,次通城送季言弟还锡山二首 其二
63070,锡山饮友人楼中临别赠以诗
1078193,送季言弟还锡山省先垄四首 其三
414743,锡山道中光景幽绝
716855,送王处士灵柩归祔锡山先茔 其一
768375,斗婵娟 赠锡山画师华希逸
756615,问水庵次锡山华凝修韵
583781,锡山张元之初为闽运长缘簿书诖误近一到闽予方有剑川之役元之晨命僮奴手缄云以四果饷发之乃荔枝杨梅枇杷樱桃歌也戏和答之荔枝
1077674,季言送余至湖外欲往无为挈其姊旅榇归锡山悯其勤赠此一绝
811004,锡山闲咏四首
658372,锡山揽袂集三首 其三
275731,折红梅·锡山舟中遣兴
317303,秋尽日同海若看菊锡山
1078192,送季言弟还锡山省先垄四首 其二
1217004,次倪元镇张伯雨锡山倡和之什
130816,杖锡山别前人
626561,寄锡山朱赋游兼怀蜀中王使君
1216739,七月一日之集庆望日次锡山宿玄文馆
647890,留别锡山诸友二首 其二
722067,送王处士灵柩归祔锡山先茔
521749,锡山王应藩工真行书尤善题署予辑郡志为予留数月将归赋此赠之
57268,奉陪遂昌郑明德锡山倪元镇宴潘仲昭左丞园亭
839364,锡山秦缦卿方伯家遇雪二首 其二
883060,杖锡山
379932,锡山道中·忆昨理征棹
804869,锡山塔下双刹寺有杜鹃一本高逾寻丈开时鲜红满目盖百年物也余于癸卯三月往观即赋
843586,寄锡山石香刘君二首
795360,踏莎美人 又七月看锡山燃灯，和表姊
523533,酬钱子锡山之招
792490,锡山闲咏四首 其二
729953,辞明州太守宗公湘文请住仗锡山寺
277334,题杨味云重修锡山贯华阁图
792492,锡山闲咏四首 其四
591355,闻顾玄纬锡山待沐园产绿芝遥寄此咏
1157942,杂体诗 怀锡山药名离合二首 其二
184606,杖锡山·万杉夹道磴千盘
548441,九日张澄斋大参邀登锡山同诸公分得山字
402755,珍珠帘 锡山春泛示浣孙
841464,过锡山谒李紫璈师
842728,白蜡处处产锡山石皆作玉色西人锯磨以制器布地
263216,寄锡山石·道子丹青工部诗
28510,和袭美怀锡山药名离合二首
1194009,杂体诗 怀锡山药名离合二首
1114014,次通城送季言弟还锡山二首
1077672,次通城送季言弟还锡山二首 其一
1176223,和袭美怀锡山药名离合二首 其一
515495,寄锡山秦处士七十
509494,怡菊为锡山赵汝明题
346872,虞美人·锡山舟中独酌
683908,王山人承父赴顾益卿中丞之约道经锡山诣陈稚登言别陈为叙出塞之艰涕泗不已承父愀然返棹作四绝句记之余属和焉
680066,锡山施医官彦清以诗见贶奉答
772632,伏日邀同鸠兹韦载玉锡山周梅亭龙骧玉峰孙翼青进吴趋李槎寄掞新安吴澹如基尧武林施祓堂爟暨子婿高时夏从于和埮集来鸥馆小饮分赋得南字
778456,虞美人  过锡山秦园访留仙太史不遇作
672207,锡山舟中呈同年吕宜中期游龙山惠泉不果
1227057,无锡山中留题
470588,锡山夜别闲孟子薪彦逸及从子宜之儿子杭之 其一
843587,锡山秦缦卿方伯家遇雪二首
772608,赠锡山周梅亭龙骧
1010027,仗锡山
902514,自锡山归舟中三首 其一
674213,次韵寄锡山邹光大
512385,送锡山邵二尹还任
594458,送沈孺休还云间曹仲行还锡山
130707,同黄东发提举游杖锡山
663444,送钱伯川归锡山
765543,步月 月下携小婢登锡山
570804,王山人承父赴顾益卿中丞之约道经锡山诣陈稚登言别陈为叙出塞之艰涕泗不已承父愀然返棹作四绝句记之余属和焉 其一
733574,锡山晚泊
839359,寄锡山石香刘君二首 其一
307400,白蜡处处产锡山石皆作玉色西人锯磨以制器布地
684534,留别锡山诸友二首
67584,题云林画·故家池馆锡山阿
769832,虞美人•锡山舟中独酌
804775,登锡山
577299,双节堂为锡山朱靖赋
549951,过锡山同张奠夫访第二泉用濂溪先生萍乡诗韵
571061,送赵挥使还锡山
902513,自锡山归舟中三首 其二
902512,自锡山归舟中三首 其三
809497,雨中幸锡山园林
291152,登锡山浮图
491023,蚤抵锡山
647889,留别锡山诸友二首 其一
654869,古木寒鸦为锡山王敏行
1157941,杂体诗 怀锡山药名离合二首 其一
509434,湖山旧隐为锡山钱津赋
429021,秋尽日同海若看菊锡山
741046,送王春明十二归锡山
548578,春仲六日同黄伯传王元穆诸君山游晚观锡山塔灯纪兴
590757,游锡山二泉偕素峰叶长官
653528,瀛洲为锡山杨秀才作
807732,风流子  锡山庆云庵感旧 时永如上人新逝
481488,锡山饮友人楼中临别赠以诗
658370,锡山揽袂集三首 其一
843562,得锡山徐君子敬书简怀却寄二首
558390,寄锡山邹逸人
498166,半塘遇邑人庄敛之同游虎丘山后方舟抵锡山获汲而归
333580,次通城送季言弟还锡山
658371,锡山揽袂集三首 其二
512248,送锡山高贡士
570806,王山人承父赴顾益卿中丞之约道经锡山诣陈稚登言别陈为叙出塞之艰涕泗不已承父愀然返棹作四绝句记之余属和焉 其三
666875,和彭别驾石屋登锡山观五湖之作
594580,泊锡山过王彦贻宅
1113449,自锡山归舟中三首
691564,锡山夜别闲孟子薪彦逸及从子宜之儿子杭之
331382,送季言弟还锡山省先垄
1078194,送季言弟还锡山省先垄四首 其四
344497,锡山舟晓·五两沿洄去复停
766307,碧牡丹 自锡山却返武林，朋辈招邀，勉留十日，劳歌未已，重赋短章
1139182,赠曹德玉子达卿父子同赴锡山馆
1194842,和袭美怀锡山药名离合二首
330757,送禹功还锡山
300572,锡山道中光景幽绝
1176224,和袭美怀锡山药名离合二首 其二
570807,王山人承父赴顾益卿中丞之约道经锡山诣陈稚登言别陈为叙出塞之艰涕泗不已承父愀然返棹作四绝句记之余属和焉 其四
263055,得锡山徐君子敬书简怀却寄
1114149,送季言弟还锡山省先垄四首
610517,锡山驿秋晓
804486,晚登锡山次陈逊其韵
443859,克难坡访阎锡山故居
716856,送王处士灵柩归祔锡山先茔 其二
693655,锡山揽袂集三首
1197812,锡山古谣
575146,登锡山退饮惠山方丈示同游诸君子
839363,锡山秦缦卿方伯家遇雪二首 其一
670514,锡山尊贤祠
839360,寄锡山石香刘君二首 其二
1141890,锡山道中
263217,锡山秦缦卿方伯家遇雪
839362,得锡山徐君子敬书简怀却寄二首 其二
574493,上巳之明日登锡山顶一首
195168,杖锡虎·杖锡山中深
144965,仗锡山中·雨地春山薇蕨长
839361,得锡山徐君子敬书简怀却寄二首 其一
185855,赠曹德玉子达卿父子同赴锡山馆
807488,念奴娇  送钱础日归锡山同云臣和曹顾庵韵
494281,送邹山人归锡山
428308,登锡山浮图
485956,奉陪遂昌郑明德锡山倪元镇宴潘仲昭左丞园亭分得雾字韵
58144,锡山夜别闲孟子薪彦逸及从子宜之儿子
748193,任城送姜锡山归蓬莱
333294,还锡山·陆离长佩切云冠
1078191,送季言弟还锡山省先垄四首 其一
263215,寄锡山石香刘君
523256,酬水部锡山之招
