605308,写梅花赠萧山令沈孟威时孟威以内召至
509378,天顺庚辰十一月十八日承巡抚大同宣府之命闰月七日陛辞蒙恩赐敕赐酒饭既退朝蒙召至文华殿天颜咫尺褒谕再四复蒙赐谕中官赐酒饭赐宝钞三千贯皆前此所无归而戒行赋此书感且以言志
1159417,元和十一年自朗州召至京戏赠看花诸君子
123855,己丑五月被召至行在遇周畏知司直和五年
932863,青城大面山中有二隐士一曰谯先生定字天授建炎初以经行召至扬州欲留之讲筵不可拜通直郎直秘阁致仕今百三十馀岁巢居崄绝人不能到而先生数年辄一出至山前人有见之者其一曰姚太尉平仲字希晏靖康初在围城中夜将死士攻贼营不利骑骏骡逸去建炎初所在揭榜以观察使召之竟不出淳熙甲午乙未间乃或见之于丈人观道院亦年近九十紫髯长委地喜作草书盖皆得道于山中云偶成五字二首托上官道人寄之 其一 寄谯先生
145906,病甚梦召至帝所获宥觉而顿愈遂赋
1117659,青城大面山中有二隐士一曰谯先生定字天授建炎初以经行召至扬州欲留之讲筵不可拜通直郎直秘阁致仕今百三十馀岁巢居崄绝人不能到而先生数年辄一出至山前人有见之者其一曰姚太尉平仲字希晏靖康初在围城中夜将死士攻贼营不利骑骏骡逸去建炎初所在揭榜以观察使召之竟不出淳熙甲午乙未间乃或见之于丈人观道院亦年近九十紫髯长委地喜作草书盖皆得道于山中云偶成五字二首托上官道人寄之 寄谯先生
201835,再召至龙图阁观书
851335,病甚梦召至帝所获宥觉而顿愈遂赋
857754,再召至龙图阁观书
508715,景泰壬申九月初六日，经筵讲退，蒙召至文华殿。皇上负扆而立，面垂顾问，赐楮币一千贯。复遣中官赐雪花梨及鲜果一笼，荷恩感激赋此以识
189692,元佑三年余被召至京师从翰林苏先生过兴国浴
1037266,青城大面山中有二隐士一曰谯先生定字天授建炎初以经行召至扬州欲留之讲筵不可拜通直郎直秘阁致仕今百三十馀岁巢居崄绝人不能到而先生数年辄一出至山前人有见之者其一曰姚太尉平仲字希晏靖康初在围城中夜将死士攻贼营不利骑骏骡逸去建炎初所在揭榜以观察使召之竟不出淳熙甲午乙未间乃或见之于丈人观道院亦年近九十紫髯长委地喜作草书盖皆得道于山中云偶成五字二首托上官道人寄之 其二 寄姚太尉
956356,己丑五月被召至行在遇周畏知司直和五年前送周归弋阳韵见赠复次韵答之
982313,元祐三年余被召至京师从翰林苏先生过兴国浴室院始识汶师后二年复来阅诸公诗因次韵
650455,喜友人郭子成赴召至京夜宿旅舍赋此奉柬
1218700,送解伯中赴史馆召至正癸未朝廷以史事遣使起河东张先生于广陵明年史局开又于广陵徵解先生广陵连有二盛事睹兹荣美赋诗为别
1172407,郊坛回舆中书二相公蒙圣慈召至御马前仰感恩遇辄书是诗兼呈二相公
648379,奉天门早见后午被召至右顺门晚退口号
