119867,次韵张丞·长日官曹迄未闲
546579,忆以修挐舟饯别至魏湾执手恋恋闻某直指垂至乃发迄今令人怅然偶值清源鸿便辄题二绝寄苏并讯易惟效蔡景明 其一
832340,瑞龙吟 庄头村花田自五代迄今，盖亦地之韵者。余既来游，感叹今昔，托之于音
787250,北城览旧，示叔白、紫迄
635452,自春迄夏抱疴东林承豫章熊剑文惠药得差赋此致谢兼送其行
787016,上元夜同人集子谦潇洒轩徵歌回忆丙子上元同秋园徐先生妹倩以宁饮潇洒轩迄今已五阅岁矣因感志事兼怀秋园以宁
545929,忆在临安舜举观察数过从旅中自庚午迄丙申岁致手书益以嘉贶屈指嘉隆词客几尽灵光一柱仅观察存而余以晚进忝窃深知殊感且作园居多暇赋此寄怀
545121,王长公闭关修玄谢绝一切独期余过访禅堂余以母病迄今未赴春日索居读公所致诸札掩袂太息怀不能已积成七言律八章用摅鄙臆词之荒陋不暇计也 其八
419980,台城路 花市甚盛，迄未出游
545115,王长公闭关修玄谢绝一切独期余过访禅堂余以母病迄今未赴春日索居读公所致诸札掩袂太息怀不能已积成七言律八章用摅鄙臆词之荒陋不暇计也 其二
545117,王长公闭关修玄谢绝一切独期余过访禅堂余以母病迄今未赴春日索居读公所致诸札掩袂太息怀不能已积成七言律八章用摅鄙臆词之荒陋不暇计也 其四
545114,王长公闭关修玄谢绝一切独期余过访禅堂余以母病迄今未赴春日索居读公所致诸札掩袂太息怀不能已积成七言律八章用摅鄙臆词之荒陋不暇计也 其一
310867,台城路·花市甚盛，迄未出游
545119,王长公闭关修玄谢绝一切独期余过访禅堂余以母病迄今未赴春日索居读公所致诸札掩袂太息怀不能已积成七言律八章用摅鄙臆词之荒陋不暇计也 其六
276299,北城览旧，示叔白、紫迄
697390,忆以修挐舟饯别至魏湾执手恋恋闻某直指垂至乃发迄今令人怅然偶值清源鸿便辄题二绝寄苏并讯易惟效蔡景明
545116,王长公闭关修玄谢绝一切独期余过访禅堂余以母病迄今未赴春日索居读公所致诸札掩袂太息怀不能已积成七言律八章用摅鄙臆词之荒陋不暇计也 其三
697183,王长公闭关修玄谢绝一切独期余过访禅堂余以母病迄今未赴春日索居读公所致诸札掩袂太息怀不能已积成七言律八章用摅鄙臆词之荒陋不暇计也
545120,王长公闭关修玄谢绝一切独期余过访禅堂余以母病迄今未赴春日索居读公所致诸札掩袂太息怀不能已积成七言律八章用摅鄙臆词之荒陋不暇计也 其七
826184,五彩结同心·昆山真义镇之东亭子为顾阿瑛玉山佳处故址之一。今岁池荷盛开，重台骈萼，并蒂至五六花。余偕姚虞琴、江小鹣、郎静山临赏。以其叶小藕窳而不结莲房，又花瓣襞积，卷如蕉心，正与吴中华山刘宋造像中所刊千叶莲同。因断为即天竺传来之千叶莲，盖花中如海棠、海石榴、山茶，凡舶来种恒现多层，此殆同例也。元末明初迄今已六百年，沦落荒村中，今始幸邀吾徒之一顾。感赋此阕，以属阿瑛，兼示同人
923235,润守修撰见招与左丞王公大夫俞公东园集会宾主四人更无他客某顷为南都从事值故相杜公与王宾客焕毕大卿世长朱兵部贯冯郎中平同时退居府中作五老会一日大尹庐陵欧阳公作庆老公宴而王毕二公以病不赴中座亦只四人某时与诸僚同与席末言念往昔正类今辰然自皇祐庚寅迄今元符己卯整五十年矣抚事感怀辄成七言四韵
959161,绍定闽寇平上功省府黄伯厚与焉余时在政事堂赵用甫掾西曹力言此文墨士请官以左选既而赏戾法迄授武阶去岁戊戌用甫帅鄞乃来为阃属余浪迹湖山岁馀始一见稍稔接觞咏亹亹迫人间及前事有见晚恨余与之酒曰一文资直慁子然以人废法虽相知如今日亦弗敢则笑而不怨赴调行在所赠以君莫愁之歌
308420,瑞龙吟·庄头村花田自五代迄今
535055,砺峰公之陟南礼侍也余在金陵日引跂然迄左一觏兹余改北雍公入觐得觏无几复别去不能无慨然于中者作诗叙往用抒积思云耳
544997,司空潘公浚渠迄工纪事
768575,轮台子 读长水唱和词忆从癸丑别鲍子子韶，迄今戊午，余移家湖东，子韶仍归虔州，感赋
546546,记十八九时章二宅中食江鲚狂饮剧醉豪兴欲飞迄今二十馀年再过瓜洲食此此物风味不减畴昔乃余发则种种不复能作少年态矣
545118,王长公闭关修玄谢绝一切独期余过访禅堂余以母病迄今未赴春日索居读公所致诸札掩袂太息怀不能已积成七言律八章用摅鄙臆词之荒陋不暇计也 其五
519757,予祖康王尝游翠微山留题永庆寺璧迄今四十载寺僧录诗来谒求和予三复展诵感慕不觉泣下因再拜追和时成化庚子九月一日也
950824,予癸巳在京口因郡中元夕张灯偶阅国史靖康丙午正月十五日辛巳祐陵南巡驻跸是郡二月二十三日己未始还京师凡居郡三十有八兹闻箫鼓感旧兴叹不胜潸然因涉笔以记大略而僧有冲希者乃携以示正伦彼谓予讽己遂架大怨迄兴妄狱圣明察知其冤予复将指前漫尽白因悼正伦之殁闵其左计亮其初心附昔所作诗于后
546580,忆以修挐舟饯别至魏湾执手恋恋闻某直指垂至乃发迄今令人怅然偶值清源鸿便辄题二绝寄苏并讯易惟效蔡景明 其二
546620,忆与王生酣眠小玉馆中迄今垂三十载武林邂逅纵谈畴昔则同事酒垆者什九岱宗矣把臂潸然辄复赋此
904345,石过青渠壁间有何人者诗欲梓潼神君戒杀以从佛神君初以孝廉举岂自污于一饮一食之间为哉后稷肇祀庶无罪悔以迄于今试以此语为解嘲并赋小诗呈时发县大夫一笑
1208645,予以延祐元年从先兄正献公入汴始识彦辉吴徵君是岁故中丞马公伯庸今翰林学士谢公敬德国子博士王君师鲁乡贡河南行省迄今二十五年予再以按行至汴居监察行院去徵君所居仅半里犹以公事未毕尚迟于请见时马公亦薨谢王在馆阁感念存殁赋唐律一首先遣持遗徵君正之（至元四年戊寅）
788397,壬子岁九月七日吾弟怡贤亲王定窆于水东村朕念手足至谊兼以辅弼功勤献替忠款抚今忆昔情不能已因亲临奠送稍伸积痛夫神游于天魄藏于地亘古迄今理之常也但以吾弟之亲贤为国家柱石幽明异路于兹永别当深秋草木黄落之际朕心曷胜凄怆爰赋此诗以写怀
