404522,水调歌头·长江三峡水利工程畅想
431985,考察嘉区水利至嘉善
312726,水调歌头·长江三峡水利工程畅想
581982,六月十八日孔章陈寅长为避暑饮于水利司既而赋此谢之
774036,曹侯既兴水利乃巡田劝农赋此以颂
386203,海音诗·谁兴水利济瀛东
413760,考察嘉区水利至嘉善 其一
672898,送项德懋丞长洲专管水利
803983,伊拉里克河水利林文忠公遣戍时所开，所谓四十八坎儿也，贤者所至，有益于民如此
123300,园田叹四绝·台家水利有科条
685218,戊辰元宵前一日同大中丞吴交石黔国公沐总戎洎三司往松花灞巡视水利因以省耕次吴交石韵二首
270596,考察嘉区水利至嘉善
526175,邹水部监真州水利出饯不及因寄
413761,考察嘉区水利至嘉善 其二
571422,送邹子常熟水利县丞
583391,戊辰元宵前一日同大中丞吴交石黔国公沐总戎洎三司往松花灞巡视水利因以省耕次吴交石韵二首 其二
254792,三门峡水利工程有感
681411,送张克谦郎中治水利山东
525680,至日往荆州一带视水利
583390,戊辰元宵前一日同大中丞吴交石黔国公沐总戎洎三司往松花灞巡视水利因以省耕次吴交石韵二首 其一
194635,出郊韵·寄语头衔水利官
671989,送刘世熙赴四川佥事管水利
