178012,送迤郎中使高丽
583292,送王敬之行人使高丽
562598,送陈缉熙修撰使高丽
562621,送祁至和郎中使高丽
637664,金寺丞德清张中书士琏同使高丽往还经山海因赠二十韵
57278,送周仲瞻架阁使高丽
1128177,送傅舍人国华使高丽二首
364549,钱穆甫杨康功使高丽还为中书舍人书此为寄
1204752,水调歌头 即席赠河南廉使高辛甫
382303,送人使高丽
256575,使高丽·去国五千里
1035819,贡院锁宿闻吕员外使高丽赠徐骑省
1245134,送人使高丽
1043416,钱穆甫杨康功使高丽还为中书舍人书此为寄
1070391,送傅舍人国华使高丽二首 其二
117507,送林子中安厚卿二学士奉使高丽
199181,厚卿子中使高丽
924155,送林子中安厚卿二学士奉使高丽二首 其二
1002612,康定军使高秘丞自襄阳司农寺勾业寺丞自光化相继迁拜签判程殿丞受代还朝预有惜别之意辄书长句奉呈
924154,送林子中安厚卿二学士奉使高丽二首 其一
1040143,次前人赠奉使高丽安焘密学
119207,使高丽·东夷从古慕中华
505060,送契尚宾使高丽
652243,送陈脩撰使高丽
562436,题竹送高博士使高丽
351483,送秦楚材使高丽
439090,奉使高丽过平州馆
1044953,客有传朝议欲以子瞻使高丽大臣有惜其去者白罢之作诗以纪其事
361611,次前人赠奉使高丽安焘密学
768589,解连环 用李十九韵，送琢恺似南还，因话使高丽事
1070390,送傅舍人国华使高丽二首 其一
490007,送契公文出使高丽还京师
873144,望明河 赠路侍郎使高丽
187767,梦使高丽到东海口占
355770,送傅舍人国华使高丽
576638,从西庵孙先生出使高丽
258614,奉使高丽过平州馆
198893,康定军使高秘丞自襄阳农寺勾业寺丞自光化相
356067,使高丽·翩翩渌水泛红莲
863588,送柴郎中使高丽
438548,使高丽
880123,梦使高丽到东海口占
1117038,送林子中安厚卿二学士奉使高丽二首
672816,送徐舜和使高丽十六韵
228140,再用韵贺计使高耻堂建台得雨
968913,再用韵贺计使高耻堂建台得雨
921982,顷年杨康功使高丽，还，奏乞立海神庙于板桥。仆嫌其地湫隘，移书使迁之文登，因古庙而新之，杨竟不从。不知定国何从见此书，作诗称道不已。仆不
1002563,厚卿子中使高丽
1079273,送秦楚材使高丽
119204,使高丽·官是蓬莱海上仙
485966,送周仲瞻架阁使高丽
99557,顷年杨康功使高丽
190019,客有传朝议欲以子瞻使高丽大臣有惜其去者白
982646,客有传朝议欲以子瞻使高丽大臣有惜其去者白罢之作诗以纪其事
