1172773,天宝初南曹小司寇舅于我太夫人堂下累土为山一匮盈尺以代彼朽木承诸焚香瓷瓯瓯甚安矣旁植慈竹盖兹数峰嵚岑婵娟宛有尘外数致乃不知兴之所至而作是诗
917807,奉檄往哭象山复会葬及归自金溪留宿本县仙乐观归而作是诗 其二
302511,雪朝方读书，姬人来告，邻树鸟尽集吾庭，因物类之感而作是诗
1196969,从事中郎张彦明为中护军奚世都为汲郡太守客将之官大将军崇贤之德既远而厚下之恩又隆非此离析有感圣皇既蒙引见又宴于后园感鹿鸣之宴乐咏鱼藻之凯歌而作是诗
1051689,元祐元年十二月庚子雪夏首莼湖结冰鹡鸰群集于上者至不可数感而作是诗也
958218,己酉正月大风寒米价腾踊菜色之民皇皇于道感而作是诗
817834,雪朝方读书，姬人来告，邻树鸟尽集吾庭，因物类之感而作是诗
1062763,八月二十日晚凉可喜秋思浩然乘兴独游至崇宁寺谒须上人表以次元闻而造焉既归而作是诗
917759,奉檄往哭象山复会葬及归自金溪留宿本县仙乐观归而作是诗 其一
1052753,予十一月甲申以使来武冈坐茅茨之室逼闾阎之陋无故人往来之乐怀羁旅不足之情于是有游古山之寺在县西十五里而山水俊拔深秀亦有可爱者因留置酒抵暮还驿而作是诗
728695,初入黔境土人皆居悬岩峭壁间缘梯上下与猿猱无异睹之心恻而作是诗
1075844,睡馀飞絮满庭有感而作是诗
