693858,冯桢卿给谏为尊人青方新开园亭邀同卢本潜都谏过酌
1147220,新秋同卢侍御薛员外白蘋洲月夜
723503,同卢记室从军诗
735865,雨后同卢龙孙金廓明羊月生朱嗣殷过饮刘睿生家纪事
607564,同卢唐宪入罗浮
559420,元相叶台翁诞辰同卢饶二年丈携尊为寿辱惠诗箑次韵奉答
602984,同卢达章访苏惟卿留饮得居字
1147066,乌程李明府水堂同卢使君幼平送奘上人游五台
623645,夏日同卢元明黎缜之饮唐寅仲先生青门
1161437,同卢校书游新兴寺
627834,壬午九日同卢乃来诸子登粤秀山
617888,冯桢卿给谏为尊人青方新开园亭邀同卢本潜都谏过酌 其一
36669,奉同卢使君幼平游精舍寺
610240,扶胥冬泛同卢元明朱季美万伯文刘季德黎缜之区子建刘道子黄元卿区启图作
1147242,同卢使君幼平郊外送阎侍御归台
629045,鸡洲阻雨同卢一清韩孟郁赋
613697,同卢一清黄逢永伍国开集陈集生太史斐园咏白鸭得轻字
1147112,奉同卢使君幼平游精舍寺
1151924,同卢拾遗过韦给事东山别业二十韵给事首春休沐维已陪游及乎是行亦预闻命会无车马不果斯诺
36687,新秋同卢侍御薛员外白苹洲月夜
533273,人日屠田叔邀同卢西台张明府屠光禄张孝廉董山人小集
36828,乌程李明府水堂同卢使君幼平送奘上人游五台
1178425,同卢明府饯张郎中除义王府司马海园作
615337,同卢韩李诸子泛舟作
620799,小除前一日同卢给谏游石室
22574,同卢校书游新兴寺
628963,上龙门滩同卢原父
40046,同卢记室从军诗
1213758,同卢疏斋学士泊舟桃源县
1178424,同卢明府早秋宴张郎中海亭
617889,冯桢卿给谏为尊人青方新开园亭邀同卢本潜都谏过酌 其二
1147059,九日同卢使君幼平吴兴郊外送李司仓赴选
36832,九日同卢使君幼平吴兴郊外送李司仓赴选
4568,同卢明府早秋宴张郎中海亭
4540,同卢明府饯张郎中除义王府司马海园作
602986,同卢达章访霍衍荣酒馆步黄山人韵题一首
2845,同卢拾遗过韦给事东山别业二十韵给事首春
36723,同卢使君幼平郊外送阎侍御归台
614912,同卢虹仲出都至彭城登云龙山
