817246,树斋先生廉峰太史招集江亭销夏
746845,重经山海关寄黄树斋同年
747023,树斋先生廉峰太史招集江亭销夏 其二
764591,桂枝香 姜桐音芳树斋留别
742679,且种树斋对客
746700,黄树斋侍御招同人宴集陶然亭时余将有玉田之行作此志别
747022,树斋先生廉峰太史招集江亭销夏 其一
266474,桂枝香·姜桐音芳树斋留别
747818,四月四日叶筠潭黄树斋两鸿胪徐廉峰黄矩卿两太史汪孟慈陈颂南两部曹招同郭羽可中翰潘四农解元共四十二人作江亭展禊之会
743923,六月二十四日钟仰山侍郎黄树斋太史招同吴兰雪刺史张亨甫明经净业湖观荷
388328,树斋先生廉峰太史招集江亭销夏
618778,同诸子集雪树斋赋
746457,鹰雏行和黄树斋同年爵滋
748471,题树斋给谏所藏云龙册子
738570,钱修亭前辈招同汪谨堂吴鸣佩李玉洲徐晋叔诸同年集香树斋看山桃花同用昌黎山石诗韵
748475,寄黄树斋
747527,哭黄树斋少司寇师
746479,相见篇和黄树斋鸿胪
386032,送黄少司寇树斋先生入京
746844,渡扬子江和黄树斋少司寇原韵
384868,少司寇黄树斋先生
