246015,减字木兰花·庚寅冬予羁京师
655883,素庵题正统辛酉冬予归自钟陵息肩湖莽李氏南溟饬其宗以迓礼于从子世熙之堂崔氏文瓛翁古服来临酒数行欢然赋诗而别后七年南溟脩世谱话旧小陂索素庵大书以归又二年持以求赋诗曰
1247343,甲寅仲冬予摄官星渚本邑判簿李公以催租入山忽游武夷予命小舟追之不及是夕宿常庵溪风山月一时清兴王事靡盬明日即附舟逆流而上因忆曩时与石堂卢使君同游放怀山水一觞一咏其乐不可复也援笔书怀遂成唐律二首 其一
1070727,海南有五色雀土人呼为小凤罕有见者苏子瞻谪居此郡绍圣庚辰冬再见之常作诗记其事公实以是年北归癸酉冬予亦两见之今二年矣乙亥八月二十二日会客陈氏园飞鸣庭下回翔久之众客惊叹创见因赋是诗
250222,己丑仲冬予作粤闽之游归来见诸友悼诗方知西溪病夫已然下世感而赋此
1253313,甲寅仲冬予摄官星渚本邑判簿李公以催租入山忽游武夷予命小舟追之不及是夕宿常庵溪风山月一时清兴王事靡盬明日即附舟逆流而上因忆曩时与石堂卢使君同游放怀山水一觞一咏其乐不可复也援笔书怀遂成唐律二首
834713,高阳台 甲戌中冬，予有夔州之役。漱泉送予江上，赋此别之
1247344,甲寅仲冬予摄官星渚本邑判簿李公以催租入山忽游武夷予命小舟追之不及是夕宿常庵溪风山月一时清兴王事靡盬明日即附舟逆流而上因忆曩时与石堂卢使君同游放怀山水一觞一咏其乐不可复也援笔书怀遂成唐律二首 其二
247613,木兰花·甲午冬予居处夹道多南天竹
452204,己丑仲冬予作粤闽之游归来见诸友悼诗方知西溪病夫已然下世感而赋此
356828,高阳台·甲戌中冬，予有夔州之役。漱泉送予江上，赋此别之
440128,木兰花 甲午冬，予居处夹道多南天竹，朱实如豆，团圞可爱，而通体皆毒，食之心死
553375,题梦彩堂大理推官冯思齐氏自为监察御史时扁其堂曰梦彩洪武廿一年岁次戊辰冬予过大理思齐以卷征诗
