599045,寄赠林井丹兵宪入楚 其二
620226,寄候兵宪邵公祖
575479,兵宪刘公以游喜峰、柞子洞诸作见示，赋答 其一
594074,答朱兵宪秉器九日潼关见寄二首 其二
700735,兵宪刘公以游喜峰、柞子洞诸作见示，赋答
472631,寄范伯修兵宪
599111,重送陈兵宪
587014,平南和杨文瑞兵宪
629002,送兵宪罗公入觐 其一
594437,送宋兵宪惟一赴闽中
698075,和汪少参嘉会抚徭通峡韵先是嘉靖乙酉予在浔与杨兵宪文瑞议雕剿峡贼闻者悚慄惟杨与鄙意合力主之仅戮九人馀悉抚定群蛮震慑愿附籍输税告乞通峡军门乃敕予檄商舟通焉盖自韩公通峡至今六十馀年矣
595083,九日偕兵宪周狮峰同年谯湫宾山游 其一
603426,寄送李仰隅兵宪之江南
652307,席上送樵村兵宪西亭
675236,简孙兵宪用之约游贤隐寺
474542,闻汉中兵宪王斯进讨贼有功赋此寄赠
609235,寄万兵宪
539313,寄邓兵宪
541996,初春侯兵宪举舜宅同潘别驾时乘赋得明字
498819,赠敖兵宪入吴
594073,答朱兵宪秉器九日潼关见寄二首 其一
608137,悯潦三章端民歌王兵宪宗鲁也余为广其辞焉 其三
597791,寄易水张兵宪二首 其二
594002,答朱兵宪秉器潼关见奇
61442,寄范伯修兵宪
594465,送刘兵宪长钦赴滇中 其一
663945,九月朔兵宪董公召饮以腹病不获参侍几席相邀改期已而石汀豸史冒雨先至遂尔命觞且辱肴果之赐感念良晤谈对无缘口呈奉博一笑
675285,赠别张汝祯兵宪兼致留意
57026,送皇甫百泉兵宪滇南
699900,暮秋与徐兵宪郭参戎同登望江楼二首
679710,和王兵宪寄秋日诗韵 其一
569687,寄陜西右方伯徐公公近以吾郡兵宪迁
61101,席上送樵村兵宪西亭
586453,李兵宪月山约游圭峰次韵
596485,三水夜别兵宪莫葵山公是公宴留草书因赋
679580,送葛双石兵宪转江西大参
587021,和汪少参嘉会抚徭通峡韵先是嘉靖乙酉予在浔与杨兵宪文瑞议雕剿峡贼闻者悚慄惟杨与鄙意合力主之仅戮九人馀悉抚定群蛮震慑愿附籍输税告乞通峡军门乃敕予檄商舟通焉盖自韩公通峡至今六十馀年矣 其二
549144,送孙瞻园兵宪还秦
571240,送河东兵宪王子晋叔
538476,答兵宪汪丈伯阳
597790,寄易水张兵宪二首 其一
490922,秋夜与徐兵宪东轩小坐
542539,季冬法祥寺吴大理张总督温中丞谢黄门刘兵宪荀员外昌都督吕池州方东昌诸词丈饯别有赋
594036,酬朱兵宪秉器以华岳诸诗三秦石刻见寄
498718,赠刘带川兵宪延绥 其二
490933,暮秋与徐兵宪郭参戎同登望江楼二首 其一
587020,和汪少参嘉会抚徭通峡韵先是嘉靖乙酉予在浔与杨兵宪文瑞议雕剿峡贼闻者悚慄惟杨与鄙意合力主之仅戮九人馀悉抚定群蛮震慑愿附籍输税告乞通峡军门乃敕予檄商舟通焉盖自韩公通峡至今六十馀年矣 其一
598270,过徐州与刘又洲兵宪
606717,甘棠税驾卷为杨兵宪作
593138,饶州酬黄兵宪士弘妙果寺饮别
682408,寄梁兵宪天津
550312,送方尔止传经蔡兵宪幕中并司记室
606539,道出徐州值冰始泮莫兵宪助以舟役
531607,薛畏齐兵宪望鹤楼吟
594426,送郑兵宪克渐赴岭西
614861,送冯元成兵宪赍捧
538324,送饶兵宪迁湖广参政
548664,戏柬刘效忠兵宪
586391,春日同兵宪何小洛游圭峰
529723,王兵宪于泽以二力士送予遣还二首 其一
541877,同李兵宪廷实刘计部伯柬宴集因谈五台山之胜遂赋长歌
615109,罗中实兵宪过枉山斋次韵
53923,海鹘行赠陈少岳兵宪
584490,送侯三峰宪长赴贵州左辖次梦山兵宪韵
695776,送刘兵宪长钦赴滇中
682549,悯潦三章端民歌王兵宪宗鲁也余为广其辞焉
585820,寄五川杨梦羽兵宪
498717,赠刘带川兵宪延绥 其一
569809,送蹇子上兵宪进中丞抚顺天 其一
713010,维岳篇祝嵩山兵宪
702208,感湖南道兵宪胡石屏衡州南岳礼际周至小诗二绝以致谢忱
595084,九日偕兵宪周狮峰同年谯湫宾山游 其二
599047,寄赠林井丹兵宪入楚 其四
542127,暮秋夜集刘兵宪子礼宅赋得秋多二字 其一
599044,寄赠林井丹兵宪入楚 其一
569810,送蹇子上兵宪进中丞抚顺天 其二
585967,感湖南道兵宪胡石屏衡州南岳礼际周至小诗二绝以致谢忱 其二
608622,寄梁兵宪天津 其二
584812,薜兵宪宴寄谢
498858,秋日赠林退斋兵宪颖川
541211,题松柏芝兰图寿兵宪王公
498719,赠刘带川兵宪延绥 其三
692969,和王兵宪寄秋日诗韵
683443,送汪丈伯阳兵宪谢病归
683569,送蹇子上兵宪进中丞抚顺天
542128,暮秋夜集刘兵宪子礼宅赋得秋多二字 其二
691017,送兵宪罗公入觐
606727,送金兵宪起复
575480,兵宪刘公以游喜峰、柞子洞诸作见示，赋答 其二
593296,答霍兵宪入都见访
599046,寄赠林井丹兵宪入楚 其三
689011,九日偕兵宪周狮峰同年谯湫宾山游
608136,悯潦三章端民歌王兵宪宗鲁也余为广其辞焉 其二
679557,海日篇寿路莲浦兵宪
669218,题赵清献焚香图送张兵宪
588916,普定行台兵宪熊龙泉顾话兼示水程
608621,寄梁兵宪天津 其一
623799,送兵宪任公入贺
471821,送侍御张龙坪领东沂兵宪
585966,感湖南道兵宪胡石屏衡州南岳礼际周至小诗二绝以致谢忱 其一
498764,赠张严亭兵宪建宁
679712,和王兵宪寄秋日诗韵 其三
594618,衢州张兵宪安甫夜宴得旗字
561497,题桓山马水部张户曹宋兵宪邀集 其二
586757,和顾兵宪
695767,答朱兵宪秉器九日潼关见寄二首
542466,送圣甫之巴东兼讯唐兵宪
594841,罗定陈兵宪惟平邀同黄大参士弘饮团练营之南堂
616011,赠岭西兵宪张截止程先生
679711,和王兵宪寄秋日诗韵 其二
51313,汉中兵宪王斯进讨贼有功寄赠
600435,过任城兵宪丘厚山年丈邀同廉宪王竹阳年丈宴集南池
498998,送黄三峰兵宪山东
474518,九日寄怀田梦鹤兵宪
490901,雨后与徐兵宪郭参戎同往水西寺宴客
561496,题桓山马水部张户曹宋兵宪邀集 其一
473813,送皇甫百泉兵宪滇南
597382,杨兵宪平寇志喜
538174,闻岛寇警有感因呈兵宪王使君
596833,哭少铉谭兵宪
490987,再别徐鲁源兵宪周大川佥宪郭两峰参戎一首
529724,王兵宪于泽以二力士送予遣还二首 其二
608135,悯潦三章端民歌王兵宪宗鲁也余为广其辞焉 其一
629003,送兵宪罗公入觐 其二
607795,寄贵宁兵宪油铭二兄
666862,初冬得报敝邑筑成防寇承澜沧周兵宪公枉书相问聊此代简
594661,连滩砦讯罗定风土寄王兵宪索平蛮碑
594709,王兵宪宗鲁救水活万人功在肇庆纪之以诗
652401,病间寄徐无染兵宪
575502,寿北平兵宪海山陈公
593837,闻王敬美转江西兵宪
677609,送喻兵宪归南昌
583713,送萧兵宪还万安
538482,送汪丈伯阳兵宪谢病归 其二
593314,闻陈兵宪道襄已至永平将过三团诸路并寄忠甫
701372,赠刘带川兵宪延绥
541346,同王兵宪登崇熹塔
594466,送刘兵宪长钦赴滇中 其二
533667,送胡兵宪伯贤赴滇中
703156,暮秋夜集刘兵宪子礼宅赋得秋多二字
571258,送龚发轩先由沅州兵宪改云南提学以外艰未赴服缺复领旧职尝有谮君近视不堪提学者故微谑之
542428,寄蔡春台兵宪兼忆王凤洲廉宪
586598,演武亭呈徐兵宪
688635,题桓山马水部张户曹宋兵宪邀集
542133,初秋同刘兵宪叔清游五龙山值雨得天字
594663,王兵宪邀泛沥湖登石洞再至七星岩
695061,寄易水张兵宪二首
490934,暮秋与徐兵宪郭参戎同登望江楼二首 其二
539183,兵宪王君阳德数过弇山园颇述泉石之美走笔奉寄
497622,松陵舟次呈治兵宪使冯公
593607,登海岱楼寄永平陈兵宪道襄时辽左有警
542599,送赵兵宪絅夫之宣府
624086,送岭西兵宪李公参藩豫章十二韵
704480,寄赠林井丹兵宪入楚
542516,寄怀刘念庵兵宪时执所纪梧岗二太守
475373,海鹘行赠陈少岳兵宪
51295,九日寄怀田梦鹤兵宪
693803,王兵宪于泽以二力士送予遣还二首
583964,傅本学兵宪四西卷
541913,闽中兵宪徐子与黔南学宪吴明卿自都下相别历二十年矣孟春癸夘夜予梦二君话旧既寤仍梦同渡漳河吊古因思社友存殁相半悲哉
538481,送汪丈伯阳兵宪谢病归 其一
586754,次顾兵宪韵
669219,题张华受剑图寄朱兵宪
542521,秋雨连绵南望洛阳因寄吴大理温中丞谢给事刘兵宪吕太守词丈
609127,至自崆峒同年朱兵宪觞于颍川上
64193,病间寄徐无染兵宪
542479,寄白羊口裴万户兼讯陈兵宪
59382,送侍御张龙坪领东沂兵宪
