416561,锁阳台  校园赏菊
535577,九日同序翁邵园赏菊赴李蒲汀之约用旧韵
592533,丁卯九月十七日同汪山人黄中舍集杨汝德园赏菊是日牡丹忽开一花江北深秋未见寒色然亦异矣为纪一诗
272287,谢刘老邀约往留园赏菊，并招饮新丰饭店
702556,黄司训欲到荒园赏菊用韵奉期
842295,憩园赏菊次武进余大均韵二首 其一
766523,台城路 立冬日霁青叔招集同人于小竹林园赏菊，即席赋赠
311776,锁阳台·校园赏菊
667150,绮塍西园赏菊
515200,黄司训欲到荒园赏菊用韵奉期 其一
385873,觉园赏菊，赋呈子良太守
406951,太闲招游邻园赏菊，次荷尹韵
826531,庆春宫·西园赏菊，镫畔一丛，冷艳动人，醉折花枝，感吟成调
408368,梅园赏菊
503733,西园赏菊
294799,憩园赏菊·西风木末动微凉
842296,憩园赏菊次武进余大均韵二首 其二
302434,万生园赏菊赋呈节庵先生
426067,谢刘老邀约往留园赏菊，并招饮新丰饭店
365930,台城路·立冬日霁青叔招集同人于小竹林园赏菊，即席赋赠
844899,憩园赏菊次武进余大均韵二首
292289,庆春宫·西园赏菊，镫畔一丛，冷艳动人，醉折花枝，感吟成调
650955,沈氏园赏菊次韵施克和呈在座
386697,辛未九月廿一日，小集壶园赏菊，同人各以诗见贻
790427,和冶庵表阮怡园赏菊韵赠丹卿先生
817674,万生园赏菊赋呈节庵先生
294798,憩园赏菊次武进余大均韵
569877,过吴太学新园赏菊卜夜作
301915,梅园赏菊·车马纷纷笑语倾
265867,太闲招游邻园赏菊，次荷尹韵
515201,黄司训欲到荒园赏菊用韵奉期 其二
