768868,分咏五代史 其一 梁敬翔
1214452,赋陆子敬旧时月色亭
365998,水调歌头·偕李俭伯光溥、吴薇客敬义、李芷香鼎铭、郑颉苏如海诸同年及家菊人孝廉，曾月夜泛舟至惠山
128513,敬题箕颍集后·昔侍先君日
787019,春雨过松轩同敬亭话旧
426418,吕老兆棠先生古稀荣庆成七律二章敬祝千秋 其二
351954,敬谢经略秘阁馀甘汤
15216,敬酬微公见寄二首
684024,敬美弟杜门信州移文乞休赋此寄之
481109,为香山顾敬中题画
190525,庄敬日强斋·人情乐安肆
448728,江西胡拜山老以诗宠赠敬步原韵
862431,和敬岩韵迓其归
1144238,都梁北乡士多好学有向君敏衡者一日访予语甚质气甚夷礼甚虔予心异之间为予言曰家故沅徙也今所居有溪实自沅来乃筑室聚书其上以教子弟因以沅溪书舍名之而其亭则曰无加盖其地旧号无加庄以其东止于石西止于岸南止于路北止于泉也愿有以发之予既为籀右书二颜而向君复以所谓廉崖者谂予予闻此石杰立千尺实峭厉峻削可敬可仰有类乎廉者颇思一至其处摩挲此石以激衰懦而未能也乃各为一解以谢焉
448701,李天马师自上海以张氏法帖辨伪一书见寄敬题其后
115940,喜雨止·敬亭与吾期
1136433,题郑提学孔明敬斋
813745,屡辱侍读王先生以卢藏用种明逸常彝甫见嘲未敢用鄙句唐突又蒙赐口号四章语意郑重督和甚切勉遵无言不酬之义敬答四首以当解嘲
1168411,宣州九日闻崔四侍御与宇文太守游敬亭余时登响山不同此赏醉后寄崔侍御二首 其二
1229911,小阁呈兄敬仲
947477,试后自题因送从弟敬之赴省
802465,代敬诒弟哀杨文敬公士骧 其二
802465,代敬诒弟哀杨文敬公士骧 其二
559687,大司徒毕堂翁老年伯蒙恩予告敬赋
405337,与敬老、臞翁、季思共赋风雨龙吟楼诗，以“未知明年又在何处”分韵，得“未”字“又”字
979128,和答曾敬之秘书见招能赋堂烹茶二首 其二
269341,齐天乐·宋拓梁萧敷敬太妃双志，次周清真韵
862352,广曾敬仲
1209414,和杨居敬韵二首 其一
697488,存没篇四首 黎秘书惟敬
294075,玉楼春·敬题麻姑祝嘏图，恭祝明两老师九秩豫
915138,古风敬饯都运焕章雷吏部祗召入觐
877101,送子敬赴潮倅七言二首 其二
502361,敬轩诗为王达善赋
560261,题小竹为邢克敬作
722639,新复燕居庙成敬和忠宪先师废院诗
464685,鹧鸪天·赠吴敬之
684429,人有自郢来者辄有所述敬赋三诗
705653,左宁南画像歌为柳敬亭作
592136,春日同惟敬约卿过弘法寺访翠岩和尚
735826,屡辱侍读王先生以卢藏用种明逸常彝甫见嘲未敢用鄙句唐突又蒙赐口号四章语意郑重督和甚切勉遵无言不酬之义敬答四首以当解嘲 其四
264,舒和·玉帛牺牲申敬享
468373,辛亥冬十月九日从余兄原礼及陆好问刘主敬同登萝岩倚圣屏憩禅庵饮清凉池临筀竹湾谒龙湫玩仙李遂宿绝顶看月明日南俯大小车岩望东西二岭还北崖瞰石龟石笋复游眺久之乃下山所得奇胜赋长句五首 其一
963765,敬和老人览镜
13116,奉和圣制中元日题奉敬寺
542007,七夕敬诚二君饯别得秋字
473646,送方二敬之北游
811818,展拜恩师遗像敬题
480612,寄内敬
1229374,次韵叔方先生兼简伯行敬初二首 其二
593720,广渠门再别黎惟敬
1002028,递呈馀干郭主簿子敬
890708,久雨喜晴检阅计院纪以舂容之篇敬用韵为谢
766474,水调歌头 偕李俭伯光溥、吴薇客敬义、李芷香鼎铭、郑颉苏如海诸同年及家菊人孝廉，曾月夜泛舟至惠山。
595284,九日与欧彦桢黎惟敬诸公游蒲涧
815728,咏尘咏影和敬业堂集中韵
881457,寄敬甫叶兄
697028,膝汝载先生卜筑武夷邀余过访余以家慈卧床褥尚孤此约感念今昔不胜怅惘敬赋小诗奉寄凡八章
428512,恭和夫子大人榆林留别士民之作敬步原韵 其二
612505,六月苦旱祈祷得蔡敬夫社兄新诗读之冷然俄而风雨骤至赋排律以酬之
626265,哭敬叔 其十二
428511,恭和夫子大人榆林留别士民之作敬步原韵 其一
772857,十月二日家敬堂总戎邀同安平观水战
603493,鸡鸣寺寄怀祁敬江
1222697,和姚子敬秋怀五首 其二
90600,古风敬饯都运焕章雷吏部祗召入觐
640426,偶题主敬陶参政所论诗经小序后 其一
1247138,题柯敬仲画竹
1174276,题敬爱寺楼
787053,二月十五日过松轩忽忆去岁亦此日同敬亭贻谋大川小集松轩用阮亭集中韵各赋七律一首转瞬一年矣因用杜句花枝欲动春风寒分韵余得花字
539209,舍弟敬美自秦来郧谈登华山之胜有作
708837,虞美人 同徐敬可看林家紫牡丹
1218510,寄杜洲乡学读书诸弟侄时王敬助为师
658127,答主敬少参
851706,暑布送王廷举用萧敬夫韵 其一
376211,秋塘陈敬父席上饯薛子舒之官建康
579572,赠邵太守文敬
501496,广东省郎观子毅翩翩佳公子也读书能诗甚闲于礼以省命辅予安南之行雅相敬礼予暂留龙江君与士良典簿先造其国正辞严色大张吾军今子毅北辙而予南辕家贫旅久复送将归深有不释然者口占绝句四首以赠诗不暇工情见乎辞云尔 其三
434469,满江红 张丈信夫林亭小酌感事怀人敬用遁庵先生韵
976719,题李氏敬聚堂 其四
101995,汉炳丹山晚进知学以来尝於文字中敬识先生矣
786996,立秋前三日雨中作兼怀敬亭弟
227534,挽词·谁解题封忠敬堂
7502,敬寄族弟唐十八使君
1231853,用陈敬初雨中见寄有过湖别墅意
1234645,和柯敬仲博士幽兰
569701,与敬美弟初出郭宿故墅 其一
1238989,同李主敬赋周炼师渔樵耕牧诗四章章十二句 其三
429591,落花诗八首敬和春榆舅父原均 其七
1026089,朝中措 约和卿、敬之持醪为文叔生朝
751612,购得杨升庵先生雪韵楼画像敬赋此诗
411288,读近代江右人诗，得绝句十六首（录十五） 其四 夏吷庵敬观
485772,挽樊参政（讳执敬）
230351,许介之以丞相周益公所书古乐府四篇见寄敬题
479689,涯翁与二汪饮襄陵酒闻清来留一尊见待已而尽之赋一醉二首清至首以见示敬和 其一
1237933,次韵答王敬助
1217475,和危太朴捡讨叶敬常太史东湖纪游
658149,与李敬熙 其五
1244948,次陈敬初见寄二首兼怀张仲敏 其二
610060,初夏同汤中允嘉宾黄仪部贞父张民部孟奇刘民部元定米明府仲诏沈虞部季彪徐兵部鸣卿毕秘书孟侯邓兵部玄度蔡兵部敬夫李孝廉伯远刘孝廉百世集草桥赋诗效骆体
578965,和林宗敬韵
1131898,汉炳丹山晚进知学以来尝于文字中敬识先生矣试吏赤水偶逢先生经由为龙多少驻行旆出三诗以贲之汉炳不揆荒拙勉继严韵
1100604,送月窗王敬叔游武夷
1239777,东城道中与王守敬张思廉同赋
502888,书建宁守宣城苪公敬亭山房
502204,过瑶溪访俞敬道不遇因留宿是时敬道有金陵经商之行
502204,过瑶溪访俞敬道不遇因留宿是时敬道有金陵经商之行
1029303,别胡仲立次敬子伯量二丈韵二首 其一
787002,送敬亭之羊房 其一
286826,敬呈绝句·妙墨题辞各擅长
505014,送汪以敬归睦州省觐四首 其四
513775,腊月半后祠堂前并后园梅花盛开敬次家君卷中旧韵二首柬克俭 其二
1060373,颂古七首 其四 麻谷持锡到章敬又到南泉。
548796,婉儿怨戏为敬承作八绝 其七
485227,与内弟周思敬晚过雁荡僧舍
426321,淮阴陈以光先生以七律四章相赠，敬步原韵 其四
432312,淮阴陈以光先生以七律四章相赠，敬步原韵
789272,笛家 同敬立、甸威踏春北山，小憩兴福寺
228186,次徐径坂衡阳使君韵示林敬则
1236168,敬次叔父适庵先生六观图韵六首
1223828,题柯敬仲杂画十首 其六
161913,送张敬甫常出守荆门
1206002,沁园春 玄旦日先君冀郡公作此示勉敬跋于后
1244878,寄马敬常
978439,予客昆山得荐严长老时道人散朗閒远不交人事心甚敬之今来海上复得悟公老成疏练能言吴中山水人物甚详东轩种竹如云不问其人可知也一日忽起故山之想予语悟野田荒草在处愁人心目安能复作沩山之牛乎因作一诗言君子出处之大致以告不知者
1244947,次陈敬初见寄二首兼怀张仲敏 其一
332179,贺新凉·再赠柳敬亭
1241150,敬题谕淮安朱安抚诏后
1159884,敬宗睿武昭悯孝皇帝挽歌三首 其一
512999,送都元敬赴试
805086,寒夜同年薛璞庵庶常顾晴沙农部蒋敬韬上舍小饮秦岵斋寓斋题敬效山水二首 其一
805086,寒夜同年薛璞庵庶常顾晴沙农部蒋敬韬上舍小饮秦岵斋寓斋题敬效山水二首 其一
626255,哭敬叔 其二
720472,新复燕居庙成敬和忠宪先师废院诗 其二
919167,十六日伏睹明堂礼成圣驾恭谢太一宫小臣敬成口号 其二
695675,同黎惟敬询韩子成病
745277,汾江送家叙敬之迁江
810479,题敬亭琵琶行填词后二首
429587,落花诗八首敬和春榆舅父原均 其三
1220219,极高明亭诗为曾以敬作 其三
1100713,敬酬芳庭植讲师
543815,哭黎惟敬秘书四首 其二
1125333,敬题濂溪先生书堂
751332,叶盘新摹丁敬身隐君像属题
652379,司寇临海敬所王公阅视三镇远以图说见遗赋诗二章为报 其一
791483,家大人重建漫泉亭，并补刻冰泉铭敬志二首 其一
756412,次陶先生以自题王廉生祭酒遗墨见示敬赋长句
658959,四月九日与弟秉之进之过通安桥顾氏因偕玄敬登阳山绝顶次日过虎山桥七宝泉至灵岩山而还得诗三首 其一
788295,雍正三年乙巳二月十有二日皇考服制告除违情从礼溯时增怆敬述纪哀
513019,和林郡侯送王敬止赴任琼州韵
580163,成化庚子岁长至后八日余偕冯秋官佩之过同寅邵文敬第夜坐联句八首俱借韵走笔 其五
367391,齐天乐·七月既望，偕陈湘渔作敬、吴研仙廷燮兄莲舫西湖泛月
505917,敬赋双头莲房
435773,寄荅溪南诗老辛愿敬之
85304,叠韵答陆敬南
34260,留题爱敬寺
626258,哭敬叔 其五
769535,满江红  敬书岳忠武王赠吴将军宝刀行墨迹后
548791,婉儿怨戏为敬承作八绝 其二
1227960,送僧朴庵用柯敬仲韵
819982,九月入觐敬述
263383,冯汗老用雪字韵赋诗寄予，兼怀黟县胡君敬庵
683554,与敬美弟初出郭宿故墅
505041,送杨敬修之京
1115054,伏蒙赐和复用韵二章拜呈可谓出丑衒媸惟自叙鄙怀并以见区区敬慕之意姑惟教之是所愿也
307229,敬步原韵·落拓由来少结交
1111059,忆秦娥 雪梅二阕奉怀敬夫
1251587,吊刘敬可
52447,送毛敬父之庐州
515369,和气致祥卷为黄州刘太守敬之赋次其韵二首 其二 折梅结实
518455,敬蒙书赐梧冈二大字伏睹八法精妙超入神品宠荣所及不胜喜庆十袭珍藏永为家宝谨赋诗谢恩
592172,冬日同文博士寿承黎秘书惟敬集顾舍人汝和宅
96164,寄周文显·我敬周夫子
918348,宝庆改元孟春中浣敬拜十贤于学宫谨哦唐律
676223,送邓以敬
489922,次韵陈敬初陪贡泰甫待制降香娄上 其二
727904,哭戴敬夫
809692,览皇清文颖内大学士陈廷敬作各体诗清雅醇厚非集字累句之初学所能窥也故作五言近体一律以表风度
1232927,封龙十咏 其十 敬斋祠
860935,沁园春 敬次白真人韵
583292,送王敬之行人使高丽
424083,满江红·西湖白文公祠附祀樊谏议，敬赋
187665,奉酬敬亭石隐君
886331,峡州程彦彪签判赋桃花菊读之良有佳致嗣韵敬呈觉其东涂西抹也
1098191,石屏后集锓梓敬呈屏翁
506843,持敬斋为南昌经历周文远作
816560,敬书叔祖威毅伯所撰刘勇介公传后
251479,登敬亭山至太白独坐楼戏作
595316,黎惟敬北馆分韵 其一
1007029,逢曹子敬知录三首 其一
349518,丁丑人日敬寄京师呈家大人作此诗时年十二岁
3494,敬酬陈掾亲家翁秋夜有赠
742724,道光壬午五月自曹镇任奉命致仕返黔俶装将行赋长句四章敬以纪恩兼用志别 其二
1089140,敬谢经略秘阁馀甘汤 其二
1206909,满江红 次白君举州倅所寄韵君举三十年前友屡示佳制读之令人起敬比以簿书倥偬不遑酬答闻改除天台恐因得簪盍于惠泉之侧用以叙怀
74083,满庭芳·和赵仲敬咏雪
693008,风雪大作子敬寘酒喜朱伯徽寻鲁志敏回
1126197,敬题箕颍集后二首
787148,九日同敬亭子谦登道院斗母阁
1003993,工侍国史李丈奉御香祷雪上竺前一夕雪瑞已应道间志喜成诗以示敬借韵同赋 其一
821031,琴调相思引 闻继湘弟有鄂渚之行，病不得送，用贺方回韵成此，并寄敬之武昌
1230630,敬题范文正公所书伯夷颂卷尾
624025,入循州哭叶六敬亭
658148,与李敬熙 其四
374154,敬溪翁·揭翻古剡岸云开
1148542,郊庙歌辞 享太庙乐章 诚敬
41011,下直出溪边望答虞丹徒敬诗
140023,绝句·将军元自敬延年
650848,徐仲敬作雪梅见贻因题其上
570707,十二绝句送敬美弟闽中学政 其十一
297188,成德桥成，公善领事拟于冬日涓吉落之，感而成诗见示；敬和原韵
570859,哭敬美弟二十四首 其十
825913,黄溯初求题敬乡楼图
1223826,题柯敬仲杂画十首 其四
750225,题管敬伯读雪山房图
1182125,敬宗皇帝挽词三首 其一
598330,九日黎惟敬朱石潭邓云川湛然上人集朝汉台
508706,水竹幽居为唐克敬赋
672990,樗庭为同年丁敬夫先翁赋
489835,送吴敬德之济宁
662166,恭睹临雍释奠敬述以诗
707604,沁园春　　赠柳敬亭
1001774,敬简堂观莲
1236842,题柯敬仲梅竹图二首
473449,送黎惟敬还岭南时有夷警
428520,敬和荫乔老世兄留别榆林士民之作即步原韵 其三
5443,独坐敬亭山
492587,和陈敬则寄赠二首 其二
791472,出西郭行田间至南涧听泉敬步家大人原韵
236491,次姚子敬简高司丞
545308,春日送赵均甫敬甫二文学一之北庠一之南雍秋试并寄怀大学士汝迈先生
448601,题杨守敬书迹影本后
819788,为吴敬臣题刘凋所画手卷
491558,宴集洞山寺分韵得见字奉柬丁克诚颜中行王敬仲詹德裕枯林上人
430323,先大夫乙丙遗书李范之丈命题斋心竟日敬成一首戊午十月九日夜中
496928,京口桃李园作时戊寅春赵敬甫邬汝翼陈永年同游
1200321,饯吕子敬赴漕台
420365,青门饮 印敬铭师赐哈密瓜，赋谢
810482,全敬亭示以南郊小雨诗偶忆旧游和韵三首
851124,山中载酒用萧敬夫韵赋江涨
1221561,郑敬常求题画像因用同姓八事赞之
533955,豫章逢王敬美入贺
570697,十二绝句送敬美弟闽中学政 其一
593213,丘谦之黎维敬过饮
699356,曾退如太史返棹江干雨甚宿杨上舍家令门僧持卷来观夜坐有怀敬题其末
520335,予尝读正蒙诸书而仰止横渠久矣兹过郿阳适道先生故居因询左右乃知先生祠墓在镇遂以瓣香致敬祠下且留一律以寓诚云
635047,寿敬人上座六十初度
811840,道光壬午五月自曹镇任奉命致仕返黔俶装将行赋长句四章敬以纪恩兼用志别
326976,熹次延之年兄韵敬题绍德庵真如轩写呈伯时季路二兄
788292,甲辰十一月十三日恭值皇考二周忌辰感时永慕哀痛填膺洒泪述哀敬成一律
585969,赠谢生惟近知远周生敬甫仪还徽州
592227,闻黎职方惟敬已趋金陵予自黄梅渡江过浔阳不得相见
569545,敬美弟有荅予寄怀之作适以奉贺归倚原韵为赠
1001982,参政瞿公之孙东广机宜德远惠书若诗以能问于不能久之愧虚盛意敬赋古风谢塞
188074,崖边积雪取食清甚次敬夫韵
638517,与杨居敬大尹叙别
327618,送王敬岩江东都宪
518259,洪武庚辰八月一日为抚安人民至衣锦乡访安湖书院拜先圣殿谒先贤祠栋宇倾挠廊庑荒茀顾瞻感叹念欲兴修兹焉经始以俟毕工历初十日夜坐挈矩堂新月满庭谩尔兴怀成五言近体十首时儒生钟民敬亦次余韵以纪一时之清兴也 其九
570852,哭敬美弟二十四首 其三
815472,宋建中靖国辛巳七月二十八日为东波先生骑箕之辰先生乞居常州，卒于孙氏寓馆，其地去余家不数十武，旧迹犹存，岁值辛巳，去先生六百年矣，感今追昔，邀同学诸子于是日肇祀先生，用眉山二字成诗二章，致敬恭思慕之意云
505013,送汪以敬归睦州省觐四首 其三
686006,送何敬渐改北成均二首
368200,石屏后集锓梓敬呈屏翁
552505,题敬义斋卷 其三
752115,传镫寺观章皇御绘宏觉禅师像敬赋
1053382,次韵法真禅师送曾敬之宣德昆仲
695756,送黎惟敬请告南还
578119,爱萱堂为仁和陈敬赋
538643,仲春望后二日与彭孔嘉章道华刘子威魏季朗张伯起张幼于舍弟敬美过袁鲁望遇雪探韵得先字
787611,饮建昌山亭寻先题亦潇洒楼遗址，敬次原韵
588601,忆昔行送黎惟敬北上
963481,又敬和寓舍
807771,沁园春  为高汝敬尊公季远题像并赠汝敬
807771,沁园春  为高汝敬尊公季远题像并赠汝敬
839410,敬之大兄归道山一年矣，久欲作挽而未果，今往吴门篷窗暇为补三首 其一
479429,答王存敬见赠
518256,洪武庚辰八月一日为抚安人民至衣锦乡访安湖书院拜先圣殿谒先贤祠栋宇倾挠廊庑荒茀顾瞻感叹念欲兴修兹焉经始以俟毕工历初十日夜坐挈矩堂新月满庭谩尔兴怀成五言近体十首时儒生钟民敬亦次余韵以纪一时之清兴也 其六
191739,知建宁·过家乡里敬
515238,十一月廿七日送士敬至浦口别后赋此
521157,初预庆成燕敬赋
972600,初八日人事少閒命车出游因以寻诗首访滕王阁纷然屠沽思为之败已过东湖得孺子亭亭阁幽邃乃陈阜卿复作者一时诗板甚多择数知名句录之又东数步得孺子祠有像设及曾公衮书南丰所作祠堂记及沈持要重立岁月壁崩粪积殊异敬事迤逦避雨入总持寺谒澹台子羽墓阅雷公祠墓有大篆立于其前祠有乐章无尽所作雨止绝南昌县径还舣舟之地作五诗
588674,正月二日得黎婿惟和书报除大行人喜甚口占俚语录似惟敬惟仁
919845,简铦朴翁兼简敬叟二首 其二
245758,减字木兰花·丙午六月吴敬轩师由台来港
280919,敬题吕曜初先生画像
417356,一斛珠 题胡敬修先生葡萄画幅
548797,婉儿怨戏为敬承作八绝 其八
768964,冬夜敬录重桂堂集
661125,送张敬亭都宪还宣城
389551,咏诗敬贺·煌煌封典表功臣
948557,仲嘉致政敷学尚书汪兄宠和鄙句且寄适轩记诗铭等皆慕白乐天语也敬以来意尽用乐天事次韵
592174,同惟敬夜过明卿得台字
480173,次韵答邵户部文敬
592231,秋夜登曾缮部省中楼同黎惟敬赋
470695,同伯敬渡漳河
485609,赋许思敬真率朝
541590,上元同刘敬甫送弟从戎 其一
389550,咏诗敬贺·少孤为客效疆场
1213202,壬寅日长至兀坐不出寄卢敬斋知州
544659,王次公敬美寄惠计偕集叙走笔二律奉谢 其一
569791,癸未十月成伯从孙詹录偕弟进士寅季侄孟嘉过敬美澹圃看菊花作
941977,敬赞月林观禅师 其三
701215,区敬庭舅荔圃话旧
216972,简敬轩何行叟觅墨
671136,乙卯春大人有文安之行送至京口大人用杨柳青青渡水人为韵赋七绝以别敬步原韵 其七
1230649,和敬仲韵
479665,春雪敬亭用前韵再答
547486,夏日饮表弟刘敬宇水亭四首 其二
1116397,十六日伏睹明堂礼成圣驾恭谢太一宫小臣敬成口号
218795,试后自题因送从弟敬之赴省
570858,哭敬美弟二十四首 其九
1244986,宴吕敬夫水阁
706211,哭欧阳三弟叔敬沈湘六首 其二
832759,迷神引 戊戌五日半塘老人以清泉瓣香敬祀三闾大夫，依屯田体为迎神之章。率和一阕，醉醒清浊之感，未能发抒万一也
676773,闻张鹅山侍御巡按甘肃比岁当还敬以此寄上
669469,秋夜简敬承公亮
272267,敬简陈以光老师
293610,敬和栖霞先生鸟松阁作
432321,吕老兆棠先生古稀荣庆成七律二章敬祝千秋
1220220,极高明亭诗为曾以敬作 其四
432310,虚度八十深荷叶老惠赐五言三律敬步原韵并乞郢政
505889,敬和留别诗韵 其二
786973,怀易堂次敬亭韵 其五
468729,遇史克敬询故园
546576,湖上酒楼听歌王检讨敬夫汪司马伯玉二乐府及张伯起传奇戏作 其三
1247003,次韵陈敬所高吟之辱二首 其二
751937,翁文恭公生日师郑吏部邀同人陶然亭为瓶社第一集并出遗墨传观敬赋长句
786967,春暮同敬亭贻谋泛月 其四
1218812,题罗成之藏柯敬仲悬崖竹
597550,中秋前一夕雨过黎惟敬山房
1212050,和韵寄吴城陈敬初
851363,敬和道山堂庆瞻御书韵
649576,太平圣德诗十章 其二 皇上奉圣母皇太后极天下之养爱敬之至深得欢心此圣人治道之本也为圣孝之诗第二
1194154,赠文敬太子挽歌词二首
711945,送家明敬
549877,寄怀李懋明兼呈王止敬
207750,子敬作诗已久不以见示忽出一卷共有四十字乃
947286,上东山坟寄敬之弟
683568,少保戚公元敬解岭南将印还莱海访余娄上言别得二七言近体
834827,双双燕 为陈敬如题《燕燕楼图》
307483,高宗为皇四子时致蔡文勤闾疾诗翰敬题
740148,咏尘咏影和敬业堂集中韵 其一
697179,秋日同邦相明府敬承太史集郑氏园亭薄暮携酒登大云山二首
520374,予读唐史而每叹汾阳功满天地忠贯日星实后之尚父也予过华州敬谒祠下噫伟人不作而其堂堂大节殆与华岳争高矣因作长歌以寓景仰之私云
263291,范之以先德尚书公三万卷楼藏书图属题，敬赋一律
299484,敬题·乞骸疏草背人挥
322893,泊舟瓜洲口寄怀河南藩幕娄寿之敬之两君
640428,偶题主敬陶参政所论诗经小序后 其三
828983,与文白、敬斋、冀野、新令、觉民、文彦、麦思武德、包尔汉、阿合买提江诸公庙儿沟野餐二首 其二
1029300,次敬叔韵二首 其二
128744,题张敬仲寒岩瀑泉
787073,戏赠敬亭山居 其二
591850,同许太仆元复文文学寿承吴山人子充黎秘书惟敬姚鸿胪元白杜舍人从殷集吴侍御约卿宅得禅字
196704,题李氏敬聚堂·枝叶皆从一本生
552503,题敬义斋卷 其一
1088029,崖边积雪取食甚清次敬夫韵
710191,四会访朱子敬表兄学署
787037,和敬亭与西宾上人倚水阁看雨
11167,敬报孙常州二首
697389,湖上酒楼听歌王检讨敬夫汪司马伯玉二乐府及张伯起传奇戏作
1235766,极高明亭诗为曾以敬作
801177,甲寅闽变，永嘉令马公琾与温处道陈公丹赤同时殉难，今春马公子观察君陈情行在，特锡恩谥忠勤，敬赋一章以纪其盛
670594,荅王敬美广川道中见怀
849966,敬礼瓦屋和尚塔偈
1110340,送张敬夫栻以追送不作远为韵赋诗五章藉手言别不胜惓惓爱助之诚情见乎辞惟高明幸教
272270,敬挽刘公晓光
717472,佟声远友兄爱予第四儿明渲特甚求养为己子病中赋诗六章敬以托之 其一
1001805,新淦陆伯仁过我钱塘逆旅中漫出诗篇辄蒙赏音敬赋短章相谢
614063,天宁寺同林彦杓陈心虞曾敬济许映三
1250973,送莫礼敬应聘之京
186568,隔墙闻正父乡饮甚乐偶畏风不预用前韵敬简
1193059,敬报孙常州二首 其一
410140,六月六日得太夫人书敬题一律
802208,丁丑人日敬寄京师呈家大人作此诗时年十二岁 其二
701135,庆都道中遇邵玉泉大守倾盖论诗握手甚欢欲止余宿而行李先发矣因书别连白石佳作示余且索和敬次荅之
592490,答冯郡博京口见讯因忆黎职方惟敬 其二
741849,观大兴师所藏宋椠施注苏诗本敬题其后
523254,翟生苦节尚志人也迩从余河之上余嘉敬焉作诗以赠
919114,泛宛溪至敬亭
271524,一斛珠·题胡敬修先生葡萄画幅
753939,济南学署秋日归宁夫子字问归期敬答十二韵
480607,过柯亭怀内敬
1251451,临池清兴为张敬惟作二首 其二
382320,寄胡敬文县尹
479690,涯翁与二汪饮襄陵酒闻清来留一尊见待已而尽之赋一醉二首清至首以见示敬和 其二
794186,戊子举敬节会诗谢祝君赓飏
426609,敬和先父题沧浪亭步韵
675219,别都玄敬主事改南京礼部
570860,哭敬美弟二十四首 其十一
1239868,山中答高彦敬
738350,谒敬亭张尚书祠 其二
616731,区敬庭舅诗扇寄寿依韵答之
568879,敬美弟杜门信州移文乞休赋此寄之 其二
591381,夏日游黎惟敬山池
640186,风雪大作子敬寘酒喜朱伯徽寻鲁志敏回 其一
172684,敬微·受用庐山水石奇
787117,闻敬亭自潞河过通州至邓家庄访鸿上人偶忆旧游书此即赠 其二
608775,送罗敬叔归江上田舍 其一
548794,婉儿怨戏为敬承作八绝 其五
1032625,挽林敬之
939765,次韵敬酬元弼三兄
800750,宋建中靖国辛巳七月二十八日为东波先生骑箕之辰先生乞居常州，卒于孙氏寓馆，其地去余家不数十武，旧迹犹存，岁值辛巳，去先生六百年矣，感今追昔，邀同学诸子于是日肇祀先生，用眉山二字成诗二章，致敬恭思慕之意云 其一
644588,蜀府敬慎斋
692062,得徐使君所贻王敬美见赠答寄
603475,溪上赠黎惟敬
569085,咏诸功臣像二十六首 其二十五 故光禄大夫柱国少师太子太师吏部尚书华盖殿大学士赠太师张文忠公孚敬
672738,寺中再次敬修咏竹
1224922,与陈敬初同舟北游题饯行卷后
1221614,云谷为王彦常赋兼简敬仲
539076,至江州尚不得舍弟敬美除官信闷成却寄
357167,暑夜同子敬
188098,方广寺睡觉次敬夫韵
540366,太和绝顶赠敬美少参弟时游自太华新领部南康为匡庐主人 其三
515226,十一月十四日饮流塘詹存中家晚归时李锦衣士敬公便过县同行
597163,寄符敬所
