800751,宋建中靖国辛巳七月二十八日为东波先生骑箕之辰先生乞居常州，卒于孙氏寓馆，其地去余家不数十武，旧迹犹存，岁值辛巳，去先生六百年矣，感今追昔，邀同学诸子于是日肇祀先生，用眉山二字成诗二章，致敬恭思慕之意云 其二
412778,敬渊以悼亡诗五十篇见示，爰题其后三首 其二
1209418,过天山周敬之席上和人韵二首 其一
40761,往敬亭路中
1226460,送何彦敬赴山东宪幕
518254,洪武庚辰八月一日为抚安人民至衣锦乡访安湖书院拜先圣殿谒先贤祠栋宇倾挠廊庑荒茀顾瞻感叹念欲兴修兹焉经始以俟毕工历初十日夜坐挈矩堂新月满庭谩尔兴怀成五言近体十首时儒生钟民敬亦次余韵以纪一时之清兴也 其四
1087814,奉同张敬夫城南二十咏 其十二 柳堤
1219134,仲春六日，辱陈敬初诸君枉顾，小饮敝楼，分得静字
972101,二诗敬寄致政大夫先生 其二
757073,到杨花津敬次伯氏
1113166,叶夷中屡以书求予记敬斋予往年尝为亲旧为记及铭矣今独成两绝句寄之
604258,寄和石渠陈侯五月七日偕宝安诸缙绅笼潭观竞渡诗数欲扫门无因往役入洛之怀弥切归滕之愿空悬窃幸扬风欲申就日敬步来韵情见乎词
201630,和敬步叔弟七月十二夜胡伯恭园池对月即事之
316434,游园赠敬文
968834,敬和九锁步虚词 朝元锁
388512,张司礼尧督备显陵八年而始还朝节惠之政口碑载道余甚愧之敬之於其行赋五言近体以赠
68816,次韵答王敬助·丰年真可乐
538270,奉谒长陵敬志鄙感
606718,送袁敬德游勾漏
301192,四会访朱子敬表兄学署
1087810,奉同张敬夫城南二十咏 其八 山斋
1213217,和敬斋卢公仲通王宰新秋咏怀
536504,谒孟庙敬述
883123,送张敬夫栻以追送不作远为韵赋诗五章藉手言别不胜惓惓爱助之诚情见乎辞惟高明幸教 其四
1087819,奉同张敬夫城南二十咏 其十七 听雨舫
569662,答舍弟敬美觐还复履江右臬任时偕余访道有遇 其二
963764,敬和老人盆池
1240420,与宁子廉马敬常饮酒得移字
563318,送谭敬卿比部削籍西归
592287,黎惟敬席上文休承有赠歌者戏和二首 其一
1194051,敬宗睿武昭悯孝皇帝挽歌三首
593022,次偃师寄王敬美二首 其二
48291,柯敬仲墨竹
1226938,陪高彦敬游南山
508789,和高仲显送弟敬宰吉水
407791,题吴敬梓故居
403610,金缕曲 其二 心叔之墓已有宿草，敬老又不知以何时示疾，何时捐馆，桑户反其真，而我犹为人猗，悲夫
1193061,敬酬陆山人二首 其一
1241224,隐忧六章时有司奉吏部符敬依令旨起取 其六
1238425,送罗与敬归西昌
447495,临江仙 新年同求能些雩敬和熊鉴老原韵
749571,阮敬斋慎斋云庄招饮桑榆别业 其二
696565,跋丽水俞元吉所藏高彦敬临米元章越山图并序
144298,敬和老人盆池
250551,仰老九十华诞有诗见示敬步元韵为贺
539199,寄敬甫考功时拱辰太仆初归里
659655,敬亭有怀
664449,淮浦歌三章为太仆杨敬之作 其三
1222698,和姚子敬秋怀五首 其四
787031,归途有怀敬亭
591171,答黎惟敬
509477,予整兵西巡辱中贵韦公携酒邀太监陈公王公同饯别行台酒酣韦公探唐人早朝诗和韵见赠走笔立就词致高远观者竦然起敬公复属予和辞不获已且重公之为人避权辞名有古人风因草草步韵并及之
1233149,平猺颂上湖广平章衮布巴勒驸马时公奉诏出征道贺二州事毕班师特授中书平章余参随麾下以功授永明簿感公之恩敬献诗以颂公之功云
570621,襄国王飞教千里岁一慰存野人无以仰酬惟祝麟趾之庆而已敬成四绝情见乎辞 其二
1222728,送岳德敬提举甘肃儒学
145476,送敬从可上人
786970,怀易堂次敬亭韵 其二
684809,王敬宏夫人
803359,恭和荫乔老先生留别榆林士民之作敬步原韵 其一
65457,次陈敬德卜居河阳韵
697869,敬进宁王殿下仙人好楼居三章
306092,胡退庐思敬
570704,十二绝句送敬美弟闽中学政 其八
1131566,别胡仲立次敬子伯量二丈韵二首
186451,湖南使者邵公召赴行在所寓客张某敬赋以饯行
514921,十三日文华后殿早进读尚书孟子午进讲大学衍义日以为常读毕赐宴讲毕赐茶上皆呼先生而不名惭感之馀敬赋以志
1162564,送僧归敬亭山寺
513826,嘉兴拜先师吕文懿公冢以陈无已丘园无起日江汉有东流诗韵敬赋十首 其七
11396,敬酬大府二十四舅览诗卷因以见示
571555,赠彭敬之四绝 其三
591889,雪中同惟敬约卿集休承寓舍得君字
605861,都门送袁敬德之任英州二首 其二
569030,柏溪翁写竹妙得彭城墨派而不轻为人作以故传世颇鲜此纸仅以数枝寓意耳而姿态溢出乃子尚书公刻之石摹本示余不胜仰止敬题于后
700282,涯翁与二汪饮襄陵酒闻清来留一尊见待已而尽之赋一醉二首清至首以见示敬和
597200,与欧敬斋夜酌高道士炼室
488772,答穆敬甫
577046,□□□□□□□敬赋
252990,寿星明·用敬渊韵寿通尹七十
242665,送槃斋叶敬叔丈
676754,系狱敬呈王大伾侍御李复斋工部丈六十韵
1217002,寄达兼善经历柯敬仲博士
968885,次徐径坂衡阳使君韵示林敬则
741622,敬敷书院值雪
1225469,题柯敬仲梅
592173,同项思尧黎惟敬诸君饮顾光禄汝所齐中乃兄汝由直阁汝和舍人皆在会
282127,暗香·敬懿皇太妃画梅，和白石道人自度咏梅二曲
561353,留都诸司拜进元旦贺表仆忝官礼曹当职题署摄事讫敬识一诗
543681,赵侯汝申以学术兴起一方怜才下善阖邑推其长者兹以七贤图属余赋之倘亦有王阮忘年之意乎敬题短歌
359007,念奴娇·家敬旃将军招同彭羡门
13502,酬陆四十楚源春夜宿虎丘山对月寄梁四敬之兼见贻之作
333247,冬夜敬录重桂堂集
438940,同敬之裕之游水谷分韵赋诗得荷风送香气五字 其三
1249529,江滨小警胡居敬助教来访雨中有述
432972,敬渊以悼亡诗五十篇见示，爰题其后三首
515237,送李锦衣士敬 其四
66987,酬罗敬叔
455452,读大清宰辅陈廷敬杏花诗感怀二首 其二
661611,都玄敬见访夜话
787091,秋郊晚眺次敬亭韵
537890,月夜与惟敬浮玉岛饮
58638,送都玄敬·驱马别君处
59799,过柯亭怀内敬
592288,黎惟敬席上文休承有赠歌者戏和二首 其二
911533,伏蒙赐和复用韵二章拜呈可谓出丑衒媸惟自叙鄙怀并以见区区敬慕之意姑惟教之是所愿也 其二
559688,大司徒毕堂翁老年伯蒙恩予告敬赋
671134,乙卯春大人有文安之行送至京口大人用杨柳青青渡水人为韵赋七绝以别敬步原韵 其五
569354,辱襄王殿下有精镠轻箑之赐敬成五律为谢
253915,除夕感怀敬呈东风老人
317899,题费敬侯墓
871217,倪敬父柯山
988068,殿庐纪怀敬用右史舍人韵
782674,题沈敬轩秋江归棹图
251362,高阳台·访吴敬梓元武阁读书处遗址
816023,贺新郎 赠柳敬亭
659717,寿御史大夫张敬亭翁
85782,生查子·元夕戏陈敬叟
1015590,送别黄敬山
705891,与王兆京同年宿敬亭
426319,淮阴陈以光先生以七律四章相赠，敬步原韵 其二
240257,书堂自警·开卷必起敬
663704,送匡敬夫按贵州
498379,御君兄内子妆阁被火敬唁以诗八首 其三
544873,寄燕中友人六首 其一 岭南黎惟敬
1230532,敬次叔父适庵先生六观图韵六首 其三
658426,寄严守邵文敬
594203,酬王敬美解官后以秦中碑麟关洛纪游见寄
1010242,送敬从可上人
737434,答吉敬先
968829,敬和九锁步虚词 天关锁
513931,邢侍郎居敬挽章
299852,送陈明敬游西湖
292257,东坡引·湖帆取静淑夫人绿遍池塘草词意绘图，以志悼亡之痛。敬题一解
1220225,极高明亭诗为曾以敬作 其九
351749,龟龄侍御以番阳士子之意作五峰亭且赋诗某敬和
707913,满庭芳 其七 寿王敬哉宗伯
591701,和黎惟敬寄意二首 其一
1098834,寄径山敬溪翁
288867,六月六日得太夫人书敬题一律
543465,出山投华严寺夜宿晨起游吕公洞曩同惟敬题名老衲炊黄梁作供忆邯郸枕上事怃然久之
1088062,和敬夫韵
515234,送李锦衣士敬 其一
426931,五羊购得山阴王季重为先文介画云林数抹便面敬一题
1218929,送尹敬思令尹归青州并序 其二
787994,皇父勘河省不获奉侍瞻恋惭悚交迫于怀敬成一律
1237932,次韵答王敬助六首 其一
570814,中贵人致牡丹一株颇丽雨中对之怅然停饮因寄仲氏敬美 其二
548790,婉儿怨戏为敬承作八绝 其一
666855,正月二十五日修敬吟社宴集次韵
510204,寄袁晖林敬 其一
327304,敬夫用熹定王台韵赋诗因复次韵
1161850,赠文敬太子挽歌词二首 其一
210372,己酉生日敬次靖节先生掇挽歌辞
488770,喜杨道行徵会濮上呈李伯承穆敬甫陈翼甫
560260,题小景为邢编脩克敬赋
1003512,工侍国史李丈奉御香祷雪上竺前一夕雪瑞已应道间志喜成诗以示敬借韵同赋 其六
773420,敬步李门太守仁山小墅自题瑶韵 其二
950714,六月二十一日内引赐对缉熙殿玉音宣问漏下数刻将退赐金币香茗有差既而御笔除长地官将旨八路复赐一札兼镇姑孰敬纪感遇以昭恩荣四首 其四
776397,赠陈握卿己未1799年邀众呈禁字纸牌捐建敬圣楼崇祀仓圣人
1222871,题高彦敬桑落洲望庐山图
810471,题敬亭弟松崖披卷图
884104,送李敬则之升扬
603499,午门早朝简欧祯伯黎惟敬
416798,如此江山  敬亭山登高题壁
689767,广东省郎观子毅翩翩佳公子也读书能诗甚闲于礼以省命辅予安南之行雅相敬礼予暂留龙江君与士良典簿先造其国正辞严色大张吾军今子毅北辙而予南辕家贫旅久复送将归深有不释然者口占绝句四首以赠诗不暇工情见乎辞云尔
1234192,送姚子敬教授绍兴
208342,酬敬上人·浙界残零处
787056,送贻谋之西山访敬亭
538184,奉送子敬宗兄之建宁司理因简明卿邵武
680237,彦敬小景
783201,咏落叶敬步御制原韵 其六
382371,谒比干墓·墓禽知敬久无音
950525,满江红 甫敬赋满江红，敬祝百千遐算，甫再拜
950525,满江红 甫敬赋满江红，敬祝百千遐算，甫再拜
652979,送马孝廉敬函骨归?
472167,寄冯敬叔
1204773,如梦令 次郭子敬韵四首
699255,次韵陈敬初陪贡泰甫待制降香娄上
1203968,清平乐 送张都事子敬秩满北归
956812,七夕至叙州登锁江亭山谷谪居时屡登此亭有诗四篇敬用其韵
645052,寄胡敬方
1206471,和姚子敬秋怀五首 其三
1221193,王叔明为俞子贤作山居图于尚友堂后为郑敬常所得俾题其上
522301,赵叔敬佥宪示和东湖诗次韵写怀因以为赠 其一
570868,哭敬美弟二十四首 其十九
689758,遇故人胡居敬临江府送至新淦
501495,广东省郎观子毅翩翩佳公子也读书能诗甚闲于礼以省命辅予安南之行雅相敬礼予暂留龙江君与士良典簿先造其国正辞严色大张吾军今子毅北辙而予南辕家贫旅久复送将归深有不释然者口占绝句四首以赠诗不暇工情见乎辞云尔 其二
787146,全敬亭示以南郊小雨诗偶忆旧游和韵三首 其三
417043,上西楼  许谈斋先生晚晴楼吟草读后敬题
951617,方广寺睡觉次敬夫韵
720471,新复燕居庙成敬和忠宪先师废院诗 其一
854436,题柯峰谳掾钱君叔行敬简轩
261056,中秋日同辛敬之魏邦彦马伯善麻信
500757,送黄文敬长岱山
429590,落花诗八首敬和春榆舅父原均 其六
11837,王敬伯歌
1223768,欧阳元功待制入院后仆以兼领成均辰酉甚严绝不得相见今夜当同宿斋宫赋此先寄并简谢敬德修撰
429589,落花诗八首敬和春榆舅父原均 其五
154280,简铦朴翁兼简敬叟
1230533,敬次叔父适庵先生六观图韵六首 其四
919164,十六日伏睹明堂礼成圣驾恭谢太一宫小臣敬成口号 其五
1217150,春日怀柯敬仲博士
1144304,友梅吴编校寿宫之侧筑庵曰全归有诗十咏敬次之
1167844,独坐敬亭山
1244881,同敬常泛娄江
968830,敬和九锁步虚词 龙吟锁
503822,春日游敬亭山
1123204,幸侍轺车敬赘严韵
336202,庆成口号·别殿斋居极敬严
558085,复邵文敬
570484,晓上人自江右来谒敬美赠之诗云南海杨枝白社莲老僧无住总随缘不知逢着文章伯可有衣裳与大颠又行脚山僧不住山正逢居士掩玄关却嫌留偈多重障大海长空自往还盖谓余方杜门不易见倚韵立赠二绝 其二
73883,和姚子敬秋怀
735873,赠吴人陈敬仲 其一
1111132,题子敬范新妇唐摹帖三首
1137676,友梅吴编校寿宫之侧筑庵曰全归有诗十咏敬次之 其一
1220740,寄朱玉林兼柬萧孟敬仲仪
536563,初春同俞仲蔚及舍弟敬美登马鞍山得四首以山高月小为韵 其三
548792,婉儿怨戏为敬承作八绝 其三
288860,奉太夫人游二忠祠敬题祠壁
304540,九月入觐敬述
144757,秋日怀新敬二上人
706214,哭欧阳三弟叔敬沈湘六首 其五
810463,怀易堂次敬亭韵
802466,代敬诒弟哀杨文敬公士骧 其三
802466,代敬诒弟哀杨文敬公士骧 其三
593334,中秋夜起玩月怀吴明卿王敬美二首 其二
1249968,题柯敬仲竹石
54859,敬亭见和山行有李杜齐能之句虽主押韵而亦非
568696,以双玉杯假敬美暂留赵吴兴所书莲花经成此
724084,往敬亭路中
877210,送林子敬倅武昌
948731,胡邦衡惠淳字韵佳什回首十年间不知几往返矣虽岁月逾迈而格律益高降叹不足敬用赓和
1088041,莲花峰次敬夫韵
513829,嘉兴拜先师吕文懿公冢以陈无已丘园无起日江汉有东流诗韵敬赋十首 其十
557884,送林宗敬
1238943,同李主敬赋周炼师渔樵耕牧诗四章章十二句 其二
759902,南汉敬州修慧寺千佛铁塔歌
1003510,工侍国史李丈奉御香祷雪上竺前一夕雪瑞已应道间志喜成诗以示敬借韵同赋 其四
883063,邑人李子宽公绰以所著十说及论孟解相示极有可敬而老且贫只一子又丧之遂为无告之民复以诗见投览之悽然赠以八句
948855,王才臣求园中六诗杨秘监谢尚书皆赋 其一 庄敬日强斋
697148,寄燕中友人六首 岭南黎惟敬
1218495,次王敬助见寄韵六首 其六
433693,敬步苏翁绳武九十述怀原玉四首选二
547128,岱西山人歌寿何吏部敬庵
307242,吕老兆棠先生古稀荣庆成七律二章敬祝千秋
1193206,九日与敬处士左学士同赋采菊上东山便为首句
1165521,赠敬亭清越上人
595711,廖韩泉拟俞敬堂内寄次韵以和
543814,哭黎惟敬秘书四首 其一
600505,题韩医士苏台画像韩乃太史敬堂之兄
1037183,敬和东宫春日泛湖韵
1237935,次韵答王敬助六首 其四
513587,上元日承邵文敬主事请游神乐观次韵二首 其一
506027,寄黄侍御克敬谪归
439448,诗送辛敬之东归二首
559684,大司徒毕堂翁老年伯蒙恩予告敬赋
1219600,题柯敬仲梅竹图二首 其二
951592,莲花峰次敬夫韵
807305,满庭芳  寿王敬哉先生用棠村词韵
683890,十二绝句送敬美弟闽中学政
1153369,郊庙歌辞 享文敬太子庙乐章 其二 送文舞迎武舞
592266,王仪甫索题黎惟敬画
275651,琴调相思引·闻继湘弟有鄂渚之行，病不得送，用贺方回韵成此，并寄敬之武昌
739585,和家兄敬怀秋日閒居 其三
947781,与郭敬叔
890489,舟舣娥祠敬留二绝 其一
751932,先中丞公癸酉鄂闱拟墨原稿沄儿装潢成册敬题其后 其三
704549,哭敬叔
553016,送贾惟敬
678436,寄内敬
152269,陆务观之友杜敬叔写予真戏题四句他日持似务
1134456,三月八日百五节林敬舆携酒约盛元仁戴帅初方万里访赵仲实宣慰于西湖第五桥之曲港南山书院五首 其三
258356,向诗人致敬
541282,李敬可刘和甫访予石洞敬可赠诗有卜邻之意赋此奉答
541282,李敬可刘和甫访予石洞敬可赠诗有卜邻之意赋此奉答
591311,同张中卿吴而待黎惟敬梁思伯何少羽游崇胜寺得霞字
513823,嘉兴拜先师吕文懿公冢以陈无已丘园无起日江汉有东流诗韵敬赋十首 其四
1215214,网鱼苗图为戈伯敬题
570623,襄国王飞教千里岁一慰存野人无以仰酬惟祝麟趾之庆而已敬成四绝情见乎辞 其四
309976,疏影·春影，先大父有此解，依调敬填
480585,得文敬双塔寺和章招之不至四叠韵奉答
403607,水调歌头 其三 敬老书来，言龙泉初缔交事
1219497,月夜怀十五友，并引 其九 陈敬初兄弟
521343,题王敬止所藏陈明之菊二首 其二
1004008,诸友载酒饮沧江海棠下公许以上寿亲庭不克与胜赏翌日招饮出示新作敬和元韵
911534,伏蒙赐和复用韵二章拜呈可谓出丑衒媸惟自叙鄙怀并以见区区敬慕之意姑惟教之是所愿也 其一
1088040,夜宿方广闻长老守荣化去敬夫感而赋诗因次其韵
1220550,赠聂克敬兼简宗武
517864,承表弟敬德相顾诗以志感
925561,新年团拜后和主敬韵并呈雪平
1226022,题前馀姚州判官叶敬常海堤遗卷
683526,与敬美少参登太和绝顶二首
945714,敬赋虚斋孙君容膝
827385,赖公蓝田开七秩觞咏诗敬贺四首 其四
1142389,都梁北乡士多好学有向君敏衡者一日访予语甚质气甚夷礼甚虔予心异之间为予言曰家故沅徙也今所居有溪实自沅来乃筑室聚书其上以教子弟因以沅溪书舍名之而其亭则曰无加盖其地旧号无加庄以其东止于石西止于岸南止于路北止于泉也愿有以发之予既为籀右书二颜而向君复以所谓廉崖者谂予予闻此石杰立千尺实峭厉峻削可敬可仰有类乎廉者颇思一至其处摩挲此石以激衰懦而未能也乃各为一解以谢焉 其二
412760,霜降前一日王丈敬五与驾吾、声越、心叔过余山斋，因约秀之、季思、幼征聚饮，旋登五云峰，循岭而下，遂至云栖
658150,与李敬熙 其六
812360,分咏五代史 梁敬翔
833860,南乡子 其一 将抵白门，敬借家大人韵
73685,风入松·寄柯敬仲
1223830,题柯敬仲杂画十首 其八
272286,敬祈民老前辈教正
571256,庆都道中遇邵玉泉大守倾盖论诗握手甚欢欲止余宿而行李先发矣因书别连白石佳作示余且索和敬次荅之 其二
1238942,同李主敬赋周炼师渔樵耕牧诗四章章十二句 其一
1148400,郊庙歌辞 享先蚕乐章 展敬
426318,淮阴陈以光先生以七律四章相赠，敬步原韵 其一
649896,题竹送任敬让参议 其一
703069,辛亥冬十月九日从余兄原礼及陆好问刘主敬同登萝岩倚圣屏憩禅庵饮清凉池临筀竹湾谒龙湫玩仙李遂宿绝顶看月明日南俯大小车岩望东西二岭还北崖瞰石龟石笋复游眺久之乃下山所得奇胜赋长句五首
1253204,次韵陈敬所高吟之辱二首
1088057,自上封登祝融峰绝顶次敬夫韵
1168075,宣州九日闻崔四侍御与宇文太守游敬亭余时登响山不同此赏醉后寄崔侍御二首 其一
541767,书王氏墓碣寄子敬淀山湖上
606425,送何敬渐改北成均二首 其一
284643,敬步原韵·锁院抡才久不行
1067173,题河南王氏所藏子敬帖
571255,庆都道中遇邵玉泉大守倾盖论诗握手甚欢欲止余宿而行李先发矣因书别连白石佳作示余且索和敬次荅之 其一
626254,哭敬叔 其一
558516,翰林编修丁原敬屡约不至作此问之
810475,送敬亭之羊房
233598,偶作·当敬不敬谓之悖
233598,偶作·当敬不敬谓之悖
583172,赠李元敬郡守
1250755,九日同刘敬思黄彦美登萧然山
92382,寄题张县尉敬之南昌官寺重新子真祠堂
1088042,方广睡觉次敬夫韵
581783,挽同年黄子敬编修二首 其一
682578,送罗敬叔归江上田舍
591702,和黎惟敬寄意二首 其二
1213648,野庄公与孚论汉唐以来宰相有王佐气象得四人焉命孚为诗并呈商左山参政谢敬斋尚书 其一 诸葛孔明
527242,送杨太仆敬之赴滁
432846,读玉虬夫子诗，感奋不已，敬赋四首选二
570856,哭敬美弟二十四首 其七
1137674,友梅吴编校寿宫之侧筑庵曰全归有诗十咏敬次之 其十
1249006,过丘以敬管句吴山别业
491582,题边长文所画山水图歌为常伯敬赋
501177,思归引题王居敬总管宁轩
1223777,触石坠马卧病蒙恩予告先至上京寄溉之学士敬仲参书二首 其一
438934,中秋日同辛敬之魏邦彦马伯善麻信之元裕之燕集三乡光武庙诸君有诗昂霄亦继作
1234298,次韵子敬怀王子庆往吴中
313027,风入松·敬题梅叟师墨画观世音佛像
889480,白石道者栖于洪岩以石为粮先朝敬爱之赐予之物甚盛一日主僧持来郡斋因获恭览叹仰之馀偶成拙句二首 其二
166490,夏日宿广教寺风月清甚思李白敬亭诗有怀有似
695832,和黎惟敬寄意二首
148386,敬简堂观莲
802318,今陕甘总制杨石泉尚书卸署福州将军由闽航海莅沪令于军中曰浮江沂汉车骑出潼关度岁西安弭节兰州于时江淮瓯越文武千人云集海上鹤盖成阴候公前旌久矣至顾念边陲汲汲西迈飙轮不灭火虎士不解剑江苏候补道聂仲芳丈时铸后膛钢炮方为中华创制请公视始允为一日之留广钧晋谒于江南制造局以威毅命亦申攀辕之请公出诏书及枢王手书以示乃知风雨驰驱不避艰险敬天子命重边务也孔子之不俟驾诗人之赋出车胥此意也广钧以诗受知于公因广其意为诗以献
1209241,题危太朴检讨借船图次叶敬常编修韵
68934,次答王敬助
650653,挽敬先廖检讨
592027,秋夕约卿元白惟敬同集小斋闻新雁得年字
1209415,和杨居敬韵二首 其二
981470,敬题濂溪先生书堂 其一
222479,徐敬甫出示所居之别南岩图并圹公题咏欲予同
544644,首送王敬美先生入贺万寿二首并寄徐子与右参黎惟敬秘书 其一
544644,首送王敬美先生入贺万寿二首并寄徐子与右参黎惟敬秘书 其一
502831,挽林医敬仲殁爪蛙图
618984,同黎惟敬梁思立梁少伸林开先过流霞岛
1235943,次王敬助见寄韵六首
915012,赠周敬伯
306094,夏吷庵敬观
541707,送马叔遇马千里卢敬之周汝信张学曾李国柱王荩伯胡颐玄张聚五张孺充陈维则安曰儒诸孝廉偕计
492977,往时杨清溪为乡先达菊存陈公作种菊图工妙逼真去之六十馀年其五世孙继先乃得之于其仲父有实家盖其家故物也出以示余因题其后以致景仰之意 其五 题东园耕隐图为友罗敬所赋
1119302,敬赞月林观禅师
428504,恭和荫乔老先生留别榆林士民之作敬步原韵 其一
40706,游敬亭山诗
570051,昔白文公有诗赠裴淄州其起句云九十不衰真地仙余以此例赠九十翁者凡五人矣莆田林方渠公以名进士官至郡守累进阶正三品今年寿九十二而其子敬夫复以雷阳守便道彩侍毋论五人者仅一宗马湖雁行即所谓裴淄州者当亦不及也喜羡之余敬步前韵授之俾歌以称觞
570051,昔白文公有诗赠裴淄州其起句云九十不衰真地仙余以此例赠九十翁者凡五人矣莆田林方渠公以名进士官至郡守累进阶正三品今年寿九十二而其子敬夫复以雷阳守便道彩侍毋论五人者仅一宗马湖雁行即所谓裴淄州者当亦不及也喜羡之余敬步前韵授之俾歌以称觞
787119,闻敬亭自潞河过通州至邓家庄访鸿上人偶忆旧游书此即赠 其四
533212,秋夜杨懋功宅同王敬美诸子集得春字
327107,寿母生朝·敬为生朝举一觞
1230530,敬次叔父适庵先生六观图韵六首 其一
877102,送子敬赴潮倅七言二首 其一
692627,夏午睡胡敬所年兄因见教作此和谢
307278,王益初老先生诗中耆宿。屡锡瑶章，铭感殊深。敬叠原韵，藉表谢忱
678675,题冯克敬清风轩
370950,同丁敬身金质甫陈江皋登宝石山天然图画阁
1138668,山村赠礼敬龙泽上人诗有几年不踏澄江路耆旧唯存陆子方之句和之二首 其二
328245,满江红·酬赠既庭兼示吴敬生兄弟
570854,哭敬美弟二十四首 其五
722709,满江红 拜岳鄂王墓敬和原韵
1095786,酬季敬父清明见寄
589067,寄年家敬所筠源黄博士
692522,送敬侄
427566,木兰花慢 敬题彊村丈手书词稿
1245501,妙莲禅院与王守敬燕
444453,菩萨蛮 拟经洪都赴厦门约以事不果，颖庐以此调二首见寄，敬次其韵，以志愧仄 其一
670572,荅寄敬美
787046,复斋宗叔邀同敬亭寅圃饮酒赏雪余因事未往即用敬亭同复斋寅圃城南酒楼原韵却寄
787046,复斋宗叔邀同敬亭寅圃饮酒赏雪余因事未往即用敬亭同复斋寅圃城南酒楼原韵却寄
802463,笙陔于光绪乙亥冬夜梦至一园杜鹃花零落满地一小轩榜曰安分知止之馆悬巨镜写人了了则貂冠华袿君语张夫人设遇增秩君当无幸及君晋四品之岁果悼亡又尝梦登所居珠泉草堂舍后山长松千章风声谡谡有茅屋汎埽雅洁及卜夫人佳城恰当其处君固不乐进取夫人亦每举榜语风谏夫明识若此而蹈中寿妖梦是践名论空留廖君能无□于怀耶敬述彤徽以题琴羡将使漆园傲吏塞旦宅之悲猗兰仙才罢潜英之石 其二
438941,同敬之裕之游水谷分韵赋诗得荷风送香气五字 其四
402106,重返风雨龙吟楼，晤敬老、臞翁，时眉仲适至，因留小饮
1172350,琴曲歌辞 王敬伯歌
41482,敬酬杨仆射山斋独坐诗
289155,石敬瑭·石晋最不肯
747506,宗伯奎玉庭师以承晖园纪恩诗见示敬赋二律奉呈 其一
592028,春夜同惟敬约卿集寿承学舍时休承将之吉水在坐同赋得寒字
593401,七夕同黎惟敬范子宣张元易郑伯良王彦贻朱汝修集华存叔馆时存叔初至得长字
1160240,合溪水涨寄敬山人
