826412,临江仙·丹徒尹彦孙太守子龙章卒，妇陈氏遗诗一首殉焉。太守出示遗诗，敬题其后
640841,次庄孟敬韵二首 其二
184524,送张敬夫栻以追送不作远为韵赋诗五章藉手言
23472,送僧归敬亭山寺
161948,敬次无咎来韵抒写
591399,送方明府君敬擢户曹入留都
86411,怀李敬子·此士今徐孺
52159,送重峰阮子敬南还
447642,原韵敬贺斗全兄六十大寿
761329,甘州  甲寅元日，赵敬甫见过
695780,哭王敬美二首
1196024,爱敬寺有老僧尝游长安言秦雍间事历历可听因赠此诗兼示同行客
402963,琵琶仙 泛碧浪湖，赴道场山，敬谒蕙风师墓，小舟容与中，和白石自度腔
424037,满江红·西湖白文公祠附祀樊谏议敬题
296793,喜赖敬熙至潮州
26563,敬答李先生
468703,送重峰阮子敬南还
1134457,三月八日百五节林敬舆携酒约盛元仁戴帅初方万里访赵仲实宣慰于西湖第五桥之曲港南山书院五首 其二
1088013,复用前韵敬别机仲
1002050,敬赋黄万安肃父五云阁
545226,夜泊金阊寄奠王敬美先生八首 其四
468367,九月五日与陈渊如刘主敬同登湖阳诸山
18170,梦亡友刘太白同游彰敬寺
951576,方广圣灯次敬夫韵
1239734,渔父篇赠瞿敬夫
661016,寄李敬夫用其送行韵 其二
1123689,二诗敬寄致政大夫先生
591875,雨中同元白过惟敬借树轩
833861,南乡子 其二 野泊值小寒日，敬借家大人韵
544077,吴郡金公应照令吾邑凡后先六载清风卓操绝代无伦黉士慕其遗爱将举祀名宦不佞恭窃门下敬赋二章 其二
1168437,独坐敬亭山
505858,敬和元日韵
167305,方万里史敬舆陈孝先龚圣予胡穆仲相继沦没令
1218928,送尹敬思令尹归青州并序 其一
1193062,敬酬陆山人二首 其二
545097,秋日同邦相明府敬承太史集郑氏园亭薄暮携酒登大云山二首 其二
533882,习仪后李临淮史计部兄弟邀陪王使君敬美集显灵道院
663284,送王内使敬夫归省
538034,张司礼尧督备显陵八年而始还朝节惠之政口碑载道余甚愧之敬之於其行赋五言近体以赠
1088020,十三日晨起霜晴前言果验再用敬夫定王台韵赋诗
1087821,奉同张敬夫城南二十咏 其十九 采菱舟
832021,敬题吕曜初先生画像 其二
75292,送罗与敬归西昌
647898,题高彦敬画和高季迪张来仪韵
547661,寄韩敬堂殿讲
447752,新疆邓世广先生旅蜀途中得佳弟子四，有诗记之，敬步其韵以贺
900532,安国置酒敬简堂分韵得柳暗六春字 其四
274650,王伯敬见访
999087,展敬文孝庙
1238990,同李主敬赋周炼师渔樵耕牧诗四章章十二句 其四
900036,敬饯刘兴伯提干之官
1249527,新岁有感寄简席焕章胡居敬
570867,哭敬美弟二十四首 其十八
844948,为简敬画梅率题二绝
542143,雨中过昭觉禅院同云洲丈敬诚二君赋得多字
286823,敬呈绝句·菊瘦堪供陶令爱
569323,谷日同敬美携榼访家元驭因饮元驭园亭 其二
612097,小筑镜园池馆将成夏日何敬宇尹冲玄洪约吾曾资铭移舟载酒集邻仙楼得前字
240233,曾子·敬谨曾参氏
963480,又敬和还家自喜
841318,为简敬画梅率题二绝 其一
844567,追和翁师志吾庚申旧作敬步原韵二首
1003511,工侍国史李丈奉御香祷雪上竺前一夕雪瑞已应道间志喜成诗以示敬借韵同赋 其七
48417,文敬坠马用予韵见遗再和一首
706360,家兄观夫之抄槁云墨迹似先徵君垂示以诗哀定后敬和四韵
461575,一得兄五十嘉辰敬贺
96762,二诗敬寄致政大夫先生
787079,和敬亭苦雨之作
426048,答谢前惠大作满江红词稿敬简陈以光教师并求指正
163525,成都逾旬阴冷深冬时节借馆趣悟得子敬德夫
1001634,陆倅连和三篇见示敬酬其一
492586,和陈敬则寄赠二首 其一
21735,敬宗皇帝挽词三首
948912,陆务观之友杜敬叔写予真戏题四句他日持似务观一笑
68815,次韵答王敬助·野云依竹静
1248875,题柯敬仲竹木
689191,登楼观阁时王令明叔邀张用昭段德光王敬夫康德涵四子同游二首
1241185,览周左丞伯温壬辰岁拜御史扈从集感旧伤今敬题五十韵
1097322,送王敬岩江东都宪 其三
660866,梅鹤旧图敬赋长歌为大人封君万寿之献
426424,虚度八十深荷叶老惠赐五言三律敬步原韵并乞郢政 其三
1210692,送敬伯仁
570702,十二绝句送敬美弟闽中学政 其六
1133066,方万里史敬舆陈孝先龚圣予胡穆仲相继沦没令人感怆
883126,送张敬夫栻以追送不作远为韵赋诗五章藉手言别不胜惓惓爱助之诚情见乎辞惟高明幸教 其二
465259,定风波 章行严丈说诗中央大学，相遇话旧，承赠此调，敬和
579958,思敬轩
285736,传镫寺观章皇御绘宏觉禅师像敬赋
493563,题晦庵先生书耕云钓月四大字墨本为王敬之知事赋
1143938,三月八日百五节林敬舆携酒约盛元仁戴帅初方万里访赵仲实宣慰于西湖第五桥之曲港南山书院五首
1204698,满庭芳 其一 和赵仲敬咏雪
1187354,奉和圣制中元日题奉敬寺
566082,赠王敬止侍御一首
697194,夜泊金阊寄奠王敬美先生八首
144152,挽李丞·笃敬古君子
65415,寄玄敬·函丈论文十载余
568878,敬美弟杜门信州移文乞休赋此寄之 其一
49414,山中答高彦敬
1088028,道中景物甚胜吟赏不暇敬夫有诗因次其韵
252035,鹧鸪天·敬题《半梦填词图》
866264,许介之以丞相周益公所书古乐府四篇见寄敬题其后
363078,别张简唐思敬并示陈縡尚元焯
189536,游敬亭山用谪仙韵
1168316,自梁园至敬亭山见会公谈陵阳山水兼期同游因有此赠
286822,辛酉三月，靖江杨翰如先生以过慧中女士画幅属题，敬呈绝句
639344,己酉孟秋二十六日，余方昼寝，忽苍头传邻人徐敬滨速售西基，余以素手辞。而又遣子促赴勉就成事，从兄少参喜祖业得还，奖以诗，次韵志感
547487,夏日饮表弟刘敬宇水亭四首 其三
1117508,敬超先
251614,读陈寅恪先生《阜昌》诗敬步原韵
686587,送都玄敬二首
742723,道光壬午五月自曹镇任奉命致仕返黔俶装将行赋长句四章敬以纪恩兼用志别 其一
24518,赠敬晊助教·到来常听说清虚
1088162,雪中与林择之祝弟登刘园之宴坐岩有怀南岳旧游赋此呈择之属和并寄敬夫兄
705113,画梅为陆简敬
1208485,次韵谢敬德司业冬至夜见念诗二首 其一
144299,敬和老人青梅
676468,简黎惟敬直阁兼怀梁柱臣中翰
544704,将之武昌留别社中诸丈黎秘书惟敬
1230817,敬题范文正公所书伯夷颂卷尾
1154161,晚渡滹沱敬赠魏大
683967,送舍弟敬美北上
557174,寄袁三子敬
737825,先公有浮山诗因忆旧游敬步原韵·指月石
1170275,送杨敬之倅湖南
700230,题王敬止所藏陈明之菊二首
539079,七月望夕大参郑邦用佥事蔡景明戢敬之邀游赤壁二首 其二
725392,离合诗赠尚书令何敬容诗
338153,悼亡·吾母怜儿汝敬夫
692226,挽翰林检讨廖敬先
853795,敬亭道中
207540,偶成·莫钭爱敬复雕镌
592142,惟敬席上喜思伯使还
787072,戏赠敬亭山居 其一
860058,挽漳守郑都承子敬四首 其二
666486,小园旧名退乐中丞马敬臣先生改曰常乐因为题榜兼赋古诗二章见赠蕙敬次韵奉酬且记吾园得名之始 其一
666486,小园旧名退乐中丞马敬臣先生改曰常乐因为题榜兼赋古诗二章见赠蕙敬次韵奉酬且记吾园得名之始 其一
816764,恭和荫乔老先生留别榆林士民之作敬步原韵
477307,送族孙时敬游大梁
548795,婉儿怨戏为敬承作八绝 其六
428014,临江仙 赵朴初居士以中国代表团团长出席世界宗教徒争取和平会议及日本第十届禁止原子弹氢弹大会胜利归来，拈此致敬。即以居士寄赠长谷瑩润长老诗句竖起脊梁真佛子发端
5121,游敬亭寄崔侍御
535062,八月二十七夜同年宴集内射所酒阑步东台观月慨谈往昔愀然兴感赵文属倡句不揣敬呈郢削
827383,赖公蓝田开七秩觞咏诗敬贺四首 其二
787149,书怀联句同敬亭用昌黎纳凉联句原韵
234286,邀赵行之陈敬叟未至四韵速之
786975,水南庄题壁同敬亭贻谋用苏韵
1097566,时敬庵
464812,一点春·敬题潘夫人绿草词集
735890,镜月归余以先朝典故数事送难于令兄映碧先生先生以为闻所未闻有侨札之誉感赋一律敬寄
649897,题竹送任敬让参议 其二
662061,奉赠蒋师相敬所致仕归湘源兼简令兄大司徒二首 其二
534735,伯兄对集陪廨示我以长句乃行敬用韵述叙平生为别并诏儿曹匪言乎诗
667328,送倪汝敬谪官宜山
1238366,寓意十首次敬助韵 其八
580918,次郑敬道明府八景总咏韵
541591,上元同刘敬甫送弟从戎 其二
1222696,和姚子敬秋怀五首 其一
426065,敬祈民老前辈教正二首 其一
259494,诗送辛敬之东归
535064,自彭城入沛书感录似张元敬水部并寄周允文提学
976721,题李氏敬聚堂 其一
457487,除夕感怀敬呈东风老人 其三
144294,敬用老人功臣净士院韵
839411,敬之大兄归道山一年矣，久欲作挽而未果，今往吴门篷窗暇为补三首 其二
59798,送王内敬重戍辽海
499754,寄鳌溪程则敬
571358,佥宪贾公谢事西川怡神楚北锡忝通家敬呈鄙作公病初起适慰其怀云
721004,哭欧阳三弟叔敬沈湘六首
603481,将还罗浮留别李敬可袁可观于钟昌父宅
1088099,次韵择之怀张敬夫
622234,懋敬殿落成恭纪阁试
147101,次韵谢敬之题南康县刘清老园
737143,渔洋先生以右丞竹里馆作图敬题应命
940008,敬酬智叔三赐之辱兼戏杨理曹二首 其二
491588,题常伯敬撷兰轩歌
591960,同黎惟敬询韩子成病 其一
538991,洪武中发三千僧戍边尹山隆法师请焚身以宽其罪仍留瓣香施法雨济旱人主嘉之为诗以纪其事且悉赐三千僧牒后百八十年初地婆罗门王世贞得其遗像塔铭读之敬题于后
326892,居敬·但得心存斯是敬
326892,居敬·但得心存斯是敬
569995,感事得五言长律三十句时家弟敬美致关中书为归计因赋此寄之
1234271,题赵敬父侍御祖德诗
919168,十六日伏睹明堂礼成圣驾恭谢太一宫小臣敬成口号 其四
251956,鹧鸪天·敬题半梦填词图即步蛰师元玉
919165,十六日伏睹明堂礼成圣驾恭谢太一宫小臣敬成口号 其六
235289,持敬堂·大哉紫阳箴
592819,集方允治宅怀陈敬甫
593682,初秋雨中同黎惟敬秘书刘仲修观察李袭美明府蒋少翼吴仲周滕晋生李惟仕朱汝修陈从训六徵士集李临淮惟寅宅得卮字
751933,先中丞公癸酉鄂闱拟墨原稿沄儿装潢成册敬题其后 其四
327611,送王敬岩·狱情微暧自难明
383500,哭戴敬夫·青山来此赴
826256,鹧鸪天·寿劳敬修八十
194504,久雨喜晴检阅计院纪以舂容之篇敬用韵为谢
591861,伏日同许殿卿姚元白黎惟敬游郑氏园四首 其三
591863,闻岭外苦旱岛夷再转潮州和惟敬
253437,题高敬之所藏云溪独钓图
504137,敬和书堂新成
790373,舟中望敬亭山
570853,哭敬美弟二十四首 其四
594072,寄送王宪副敬美督学秦中
1211511,经姑苏与张天雨杨廉夫郑明德陈敬初同游虎丘山次东坡旧题韵
1239778,送唐处敬赴嘉兴
700221,赵叔敬佥宪示和东湖诗次韵写怀因以为赠
323070,陆宣公·敬舆避谗谤
978241,王辛甫示朱敬堂钓台诗卷次韵
568957,黄宪子先辈弱冠受知吾家敬美今年秋闰过吴门扁舟访我弇上出所撰临华新草及北征稿读之盖洋洋矣赋虽吐一斑足窥全豹灵光洞箫将来当不过此至于近体出入初中时挟梁栋之气不耐点检恐指南之车切玉之剑未便可已也仆既钦其才美其志因成一章以效微箴宪子当不逆耳哉
739583,和家兄敬怀秋日閒居 其一
908391,林夫体中不佳而能不废翰墨且蒙以文轴见教其天性所嗜如此敬叹不已既勿药作诗贺之
224654,淮安路教谢西溪己丑二月饮叠山于敬义堂有诗
592117,雪夜同惟敬饯别彦国还卢龙得高字
747507,宗伯奎玉庭师以承晖园纪恩诗见示敬赋二律奉呈 其二
59816,寄内敬·草没龙城不见家
683909,中贵人致牡丹一株颇丽雨中对之怅然停饮因寄仲氏敬美
1106291,挽漳守郑都承子敬四首
327619,送王敬岩·功夫真处在持操
61627,十五夜饮王敬止园亭
1195554,敬报孙常州二首
1222947,送乐德敬甘肃儒学提举
1238361,寓意十首次敬助韵 其三
522145,沈石田画为敬所阁老题 其一
676314,敬谒考亭书院下作
559686,大司徒毕堂翁老年伯蒙恩予告敬赋
1244702,刘敬思邀访南屏隐者莫景行同游南山
315073,清平乐·相亲相敬
1216414,依韵奉呈敬在博士先生并简诸公一笑
503943,来德堂为中都国学分教林敬伯赋
803358,敬和荫乔老砚弟留别榆林士民之作即步原韵
730195,吴又乐名父以先世橙斋公种菜图册见示敬和册中原韵 六首选四 其四
1192196,敬酬张九龄当涂界留赠之作
717475,佟声远友兄爱予第四儿明渲特甚求养为己子病中赋诗六章敬以托之 其四
55799,司寇临海敬所王公阅视三镇远以图说见遗赋诗
525084,赠秋官叶敬之奏最北上
404608,忆江南·敬挽龙榆生先生
925571,周氏敬荣堂诗
747272,上元后十日竹坪叔招集豫顺堂出观姜西溟书上元宴集诗卷即次其韵敬和
356953,和随园集中咏物子敬索赋
569683,送仲氏敬美视关中学政时皈心道门兹行染指而已 其二
570708,十二绝句送敬美弟闽中学政 其十二
553161,赠俞敬之
489921,次韵陈敬初陪贡泰甫待制降香娄上 其一
1122125,和敬禅师茶偈
1134458,三月八日百五节林敬舆携酒约盛元仁戴帅初方万里访赵仲实宣慰于西湖第五桥之曲港南山书院五首 其一
640090,题卜子敬所画脩竹轩图为夏仲南赋
504061,礼部颁王府文官诰敕次审理王敬德韵
811210,潮阳东山张、许二公祠为文丞相题沁园春词处，旁即丞相祠也，秋日过谒，敬赋二律
465890,读陈寅恪先生《阜昌》诗敬步原韵
828977,与文白、敬斋、觉民、文彦诸公再至庙儿沟
228145,再用韵答·敬简如翁吾所慕
292305,踏莎行·匑厂先生碧虑商歌。依弁阳翁题中仙词卷调敬赋，张尔田初稿
1120311,王才臣求园中六诗杨秘监谢尚书皆赋 庄敬日强斋
538580,敬美弟举南宫喜而赋此
705088,乙卯春大人有文安之行送至京口大人用杨柳青青渡水人为韵赋七绝以别敬步原韵
438600,诗送辛敬之东归二首 其二
1230827,祥符寺追和文敬所壁间韵
1235570,送尹敬思令尹归青州并序
322337,刘敬亭·订交重认石三生
772256,江宁克复，曾涤生先生功绩伟甚。敬赋二律，以志欣仰 其二
260358,夏午睡胡敬所年兄因见教作此和谢
593290,华山睡图歌为黎惟敬赋
569711,壬午元日与敬美祝圣少饮即事
577541,送陈叔敬北上省亲
816555,恭阅邸钞敬赋戊子秋冬
972102,二诗敬寄致政大夫先生 其一
497292,同赵敬甫京口游桃李园作
807721,一寸金  距亳村不数里有古刹曰敬先庵，庵侧有一高邱，或穴其下乃得古冢，隧涧幽凉，明器怪诡，似是古侯王墓。词以纪事
196746,竹·吾敬五子猷
410706,平伯示生日感怀敬依春在堂集中八秩原诗韵之作次韵和之仍用原诗首句
1029302,别胡仲立次敬子伯量二丈韵二首 其二
1086046,过宛陵陪汪枢密登双溪阁叠嶂楼游高斋望敬亭山诵谢元晖李太白诗用枢公游齐山韵
106906,寄题云屋赵资敬启蒙亭风雩亭
776791,敬和栖霞先生鸟松阁作
750515,敬题通甫师诗集后时师新自都归
553559,长诗一章美韩侯也侯宰无锡多善政复以捍禦有功遂升州守之秩行且有日乡人王昶会予京师能具谈侯德予辱知遇尤深弗得归预攀辕之列敬用次第昶言赋成长诗五十韵使邑人歌之窃比甘棠之咏云耳
843566,敬之大兄归道山一年矣，久欲作挽而未果，今往吴门篷窗暇为补三首
345318,寿虞丞相·敬捧仙家九酝觞
657597,题周敬叔菊花孤鹤出韵 其一
545978,参知张公睿父观察吴公文仲过访吴公旧宰金华订盟莫逆张公神交十载近始识荆乃并辱提携收之方外高轩枉问宴洽连宵国士之知敬酬此什
290083,西子妆慢·和石工敬跻堂秋望
549298,咏耿敬亭年伯
720197,赠柳敬亭
596163,除夕过黎惟敬宅守岁
327303,次敬夫登定王台韵
950670,九月十四日夜月明如昼敬想合宫竣事志喜而作
592859,夏日同陈使君敬甫游郑园泛舟因怀王侍御纯甫
547144,岁暮送汪山人敬仲南还
628026,送林芳之敬臣叔侄归冠石山
1165408,再题敬亭清越上人山房
323604,过宛陵陪汪枢密登双溪阁叠嶂楼游高斋望敬亭山诵谢元晖李太白诗用枢公游齐山韵
1222699,和姚子敬秋怀五首 其五
880197,奉酬敬亭石隐君
514001,予过婺源宿万寿僧舍住僧敬公有望云思亲图求予诗因为下一转语
658957,喜玄敬少卿致仕
1144990,张敬儿自为歌谣
498378,御君兄内子妆阁被火敬唁以诗八首 其二
1232103,赠子敬
603709,豫章朱山李敬父早得悟于明德夫子之门今六十馀矣出游金陵却还旧隐阳羡芙蓉山山为庞公参禅处云
409031,昭化（费敬侯屯兵处）
971619,段元衡出示与晦翁九日登紫霄峰诗及手帖并及贾八十兄诗既敬读之得三绝句 其二
457488,除夕感怀敬呈东风老人 其四
408439,黄克强先生与李西屏先生书札 十八年七月廿八日 西屏先生属吾友陈冕雅示侃于大石桥寓中追怀民国前三年与克强遁初两先生同居新宿者旬日辛亥季秋两君自沪渎赴武昌与侃会于蕃舶遂同入鄂元年克强先生为留守时侃犹得一晤后此遂不相闻岁月飘忽两君皆亡追思昔游犹在心目抚弦青简不禁泫然敬题一诗以志感
1237936,次韵答王敬助六首 其五
296435,咏史·敬仲战三却
1101986,饯林子敬还闽葬母
1229238,题杨文昭为刘敬思画
591849,李符卿伯承左迁亳州夜同黎秘书惟敬吴侍御约卿往饯得长字
563068,寿朱敬韬母太夫人
275605,丑奴儿·图禺生尝得柳敬亭平话稿本，以诧黄季刚，遂秘不复出
682057,七月七日八日敬承用韫招饮时敬承将有留院之行同诸丈赋
682057,七月七日八日敬承用韫招饮时敬承将有留院之行同诸丈赋
1211637,贺丘郡博持敬新修镇江儒学
682074,陆敬承有台曰来爽暇日登之漫赋
327120,崖边积雪取食甚清次敬夫韵
494186,赠四川王公子敬之
671133,乙卯春大人有文安之行送至京口大人用杨柳青青渡水人为韵赋七绝以别敬步原韵 其四
464019,苏渊雷先生过杭留诗，谬以学人见许，愧不取当，敬次元韵，即请教正
470149,豫章朱芾斯宗侯逸园雨中宴别屠太初之南海罗敬叔之武昌李林宗之白下孙泰符之剑江欧阳于奇之毗陵予还广陵
486099,题叶楚庭醉渔卷简彭敬宗刘子原子载子明 其一
138255,白石道者栖于洪岩以石为粮先朝敬爱之赐予之
464325,金缕曲 寿家耐诚师七十，敬次周匏叟前辈韵
737823,先公有浮山诗因忆旧游敬步原韵·金谷岩西种茶处
704351,王敬美以游京口诸山篇咏见示
698437,洪武庚辰八月一日为抚安人民至衣锦乡访安湖书院拜先圣殿谒先贤祠栋宇倾挠廊庑荒茀顾瞻感叹念欲兴修兹焉经始以俟毕工历初十日夜坐挈矩堂新月满庭谩尔兴怀成五言近体十首时儒生钟民敬亦次余韵以纪一时之清兴也
1197220,癸卯岁十二月中作与从弟敬远
859821,题敬荣堂
1236333,野庄公与孚论汉唐以来宰相有王佐气象得四人焉命孚为诗并呈商左山参政谢敬斋尚书 诸葛孔明
624130,秋日同谷卿缜之伯乔及兄伯鳞弟子敬泛舟佛滘归至清溪数里各赋十绝 其二
786968,春日偕敬亭贻谋载酒游道院用少陵题张氏隐居韵即题其壁上
803327,展拜恩师遗像敬题 其一
593333,中秋夜起玩月怀吴明卿王敬美二首 其一
429586,落花诗八首敬和春榆舅父原均 其二
1223827,题柯敬仲杂画十首 其五
432624,恭和夫子大人榆林留别士民之作敬步原韵
712314,答林敬臣
577554,寄庄克敬广文
1218227,和韵赵敬德杂兴四首 其二
132069,送敬甫弟赴省试
1119057,敬酬智叔三赐之辱兼戏杨理曹二首
1221185,柯敬仲竹为陈常仲赋
671131,乙卯春大人有文安之行送至京口大人用杨柳青青渡水人为韵赋七绝以别敬步原韵 其二
678096,颍上感怀呈王安中陈叔谅陈敬脩暨在泮诸友
979127,和答曾敬之秘书见招能赋堂烹茶二首 其一
544012,膝汝载先生卜筑武夷邀余过访余以家慈卧床褥尚孤此约感念今昔不胜怅惘敬赋小诗奉寄凡八章 其一
1225323,题高彦敬越山图
501755,送聂克敬归省
964048,敬和老人秋日山行
1023705,和童敬重
763665,贺新郎 其一 赠柳敬亭
1132312,寄题王才臣南山隐居六首 庄敬日强斋
650595,敬思亭为司业贝公赋
634434,戊申初冬望前一日本师天然老和尚六十又一示生人天胥庆华梵交响恭赋律言敬致末祝
787003,送敬亭之羊房 其二
457486,除夕感怀敬呈东风老人 其二
1089036,龟龄侍御以番阳士子之意作五峰亭且赋诗某敬和
508360,和陶诗 癸夘十二月中作与从弟敬远
12,帝京篇·奉天竭诚敬
419425,减字木兰花 纪念吴敬梓逝世二百三十周年
976776,题李氏敬聚堂 其二
1247335,赠吴彦敬
751930,先中丞公癸酉鄂闱拟墨原稿沄儿装潢成册敬题其后 其一
552570,题陈仲良所藏高彦敬青山白云图
1108511,挽郑子敬都承二首
569322,谷日同敬美携榼访家元驭因饮元驭园亭 其一
959150,和敬禅师茶偈 其二
574025,闻秦修敬讣
786966,春暮同敬亭贻谋泛月 其三
428505,恭和荫乔老先生留别榆林士民之作敬步原韵 其二
325510,五王 桓彦范、敬晖、崔元炜、张柬之、袁恕己
787121,目病初愈示敬亭贻谋
676837,诏狱结后书情敬呈王龙池二府兼致谢意
331999,沁园春·赠柳敬亭
286825,敬呈绝句·长笺挥洒墨花狂
1238364,寓意十首次敬助韵 其六
851437,予邓峒□巽斋欧阳先生为淦邓峒赋诗以孝子慈孙望于人先生之盛心也敢不拜手敬赞邓君勉之
990106,子敬见和食雪诗仍次前韵
1141666,送程敬叔教谕赴建平
676385,黎惟敬小集得霜字
1231883,寄陈敬德
964047,敬和大人新年韵
44848,步元韵敬答云上人·公子才华迥绝尘
609708,读王奉常敬羙公所撰先君光禄公墓志铭感赋
686726,淮浦歌三章为太仆杨敬之作
491315,赠别严吾敬
1210397,次韵杨廉夫送僧仲猷归澄江礼敬寺
1244864,闻吕敬夫移居五首 其四
695772,哭黎惟敬二首
809665,翰林魏学诚该直命大学士陈廷敬出题考得四方无事太平年朕喜其句而偶成四韵
1252650,次陈敬初见寄二首兼怀张仲敏
1031545,汉炳丹山晚进知学以来尝于文字中敬识先生矣试吏赤水偶逢先生经由为龙多少驻行旆出三诗以贲之汉炳不揆荒拙勉继严韵 其三
983355,游敬亭山用谪仙韵二首 其二
302639,木兰花慢·敬题彊村丈手书词稿
528023,送都玄敬主事二首 其二
1231823,夜梦家兄又梦陈敬初
594370,闻王敬美关中督学乞休还吴下
959149,和敬禅师茶偈 其一
673873,十月七日同黄敬之宿源口舟中有怀谢行忠上舍
228985,孟秋朔日天台刘允叔和叔乡人陈思敬饯饮钱塘
548812,代敬承悲婉儿
706213,哭欧阳三弟叔敬沈湘六首 其四
734791,阁上坐雨望敬亭
1219356,赠柯敬仲，次王止善韵
596164,集梁思伯宅送黎惟敬得空字
829944,章母吴太夫人仙去赋诗四章敬挽
879713,摸鱼儿 其三 用前韵调敬德
253884,弓格剑·敬白诸君行路者
438939,同敬之裕之游水谷分韵赋诗得荷风送香气五字 其二
1111022,训蒙绝句 居敬二首
276613,寒夜琴兴有怀敬庵徵君
1063648,赠李敬修
942145,天台桐柏观李高士惠诗兼寄其游山纪咏一编且复见招予不能赴约敬次来韵以谢
843183,序宾先生百龄纪念敬赋
266772,鹧鸪天·寿劳敬修八十
543532,存没篇四首 其一 黎秘书惟敬
1206891,水调歌头 和卢仲敬太守
536570,冬日集舍侄一敬所作
72469,敬书宸翰后
142800,敬和老人荷花
527641,东海太守行赠徐以敬
237540,峡州程彦彪签判赋桃花读之良有佳致嗣韵敬呈
675129,松鹤寿彭敬之
426417,吕老兆棠先生古稀荣庆成七律二章敬祝千秋 其一
693337,挽同年黄子敬编修二首
1146615,唐大飨拜洛乐章 敬和
818022,戊辰三月过武仲二兄媚秋堂获观邑贤薛剑公为陈独漉作石竹芝兰画册敬题一律
436124,吾兄同仲坚采鹭鸶藤于午芹之东溪因咏诗见示前代诗人未尝闻赋此者此花长于田野篱落閒人视之与草芥无异是诗一出好事者将知所贵矣感叹之馀敬次其韵有与我同志继而述之不亦懿乎
591918,伏日同惟敬鹫峰寺避暑
566214,挽杜隐君敬心一首
1251248,驿舟回寄杨子敬长司陈国玘知事
166371,和徐敬伯知县别喻伯经韵
677150,除夕白门喜比玉携榼至寓舍同子将无际升父无我守岁伯敬复遣人饷酒
564942,送杨敬斋之官湖南二首 其一
805087,寒夜同年薛璞庵庶常顾晴沙农部蒋敬韬上舍小饮秦岵斋寓斋题敬效山水二首 其二
805087,寒夜同年薛璞庵庶常顾晴沙农部蒋敬韬上舍小饮秦岵斋寓斋题敬效山水二首 其二
1217066,许编修克敬归平水奉寄王秘监先辈
1234401,题高彦敬画二轴 其一
697118,王次公敬美寄惠计偕集叙走笔二律奉谢
1164972,敬酬杜华淇上见赠兼呈熊曜
101902,敬赞月林观禅师
592715,同赵敬辰黄定父茅平仲吕子佩游金山登江天阁
1095753,寄秋塘陈敬甫
968835,敬和九锁步虚词 藏云锁
570863,哭敬美弟二十四首 其十四
