1218494,次王敬助见寄韵六首 其五
545229,夜泊金阊寄奠王敬美先生八首 其七
257952,向杜甫致敬
594586,八日同冯元敏谢少廉俞公临曹子念饮王敬美澹圃
438942,同敬之裕之游水谷分韵赋诗得荷风送香气五字 其五
559693,大司徒白翁毕老先生蒙恩予告敬赋
670910,得徐使君所贻王敬美见赠答寄 其二
593625,王少参敬美入贺暂憩弘法寺雨中同赵太史汝师周民部元孚出访
482825,先子所作高陵篇藏诸家塾二十馀年一旦触目不能无感焉敬赋古诗一篇以缀其后洪武二十四年岁在癸未彭祖拜首书
737824,先公有浮山诗因忆旧游敬步原韵·陆子岩前竹下
695888,次偃师寄王敬美二首
428514,恭和荫乔夫子留别榆林士民之作敬步原韵
44495,答王敬身西安见怀仍用人字韵
1242683,王自牧、冷起敬诸文士游西湖、南山，记题其后
561413,寄寿张允敬同年
210538,伯氏墓下·敬长于今我独亡
434480,鹧鸪天 其三 重九日敬用遁庵兄韵
514102,拜庆千秋节敬赋
642184,敬进宁王殿下仙人好楼居三章 其二
505011,送汪以敬归睦州省觐四首 其一
1037016,题子敬范新妇唐摹帖三首 其二
1244173,同李主敬赠李将军修陇西公墓
543816,哭黎惟敬秘书四首 其三
1093187,净慈西堂简敬叟
206961,林敬之挽词·杂遝新河市
731500,中秋后二日同臞仙敬亭游带水山庄马氏园分韵得忙字
348470,恭阅邸钞敬赋戊子秋冬
801368,挽龚敬五 其二
602051,五代史六首 其一 石敬塘
918241,休宁朱肖岩葺其先大父岐山书堂为藏修之所而徵诗于余余闻其先伯父由释褐职教姑苏今其父子能世家学不坠遗基是可敬已为赋二章 其一
781616,谒谢山阴师，值五十初度，窃睹御赐斐叠，敬呈二首 其一
1148449,袁仁敬歌
672698,送蒋中允敬之归省
790922,与朱敬斋都中话旧，即以志别
709918,送陈明敬游西湖
593330,闻王敬美参藩江西
528593,登楼观阁时王令明叔邀张用昭段德光王敬夫康德涵四子同游二首 其一
1249059,十二月廿二日为重阳王真人诞辰是日立春在淞江长春道院瞻拜真人及七真像敬题薛一山丹房
591876,元白惟敬约卿见过同咏秋雨得尘字
751785,敬题朱竹垞毛西河两先生合像
779221,多丽 冬日敬亭宴集止宿
432216,敬祈民老前辈教正二首
1059691,敬超先 其一
877518,挽郑子敬都承二首 其二
580088,次韵答邵文敬
15470,道州敬酬何处士书情见赠
543817,哭黎惟敬秘书四首 其四
578188,和乐堂为梁敬叔赋
569717,以近况报敬甫亦小有所规也
592077,省中芍药和惟敬
423482,鹧鸪天·沪上见管仲姬书心经册，高仅二寸，广寸许，细楷如黍米精绝。后题云：长生禅院比丘尼觉因募装观音圣像圆满，属书心经，纳诸藏中，因为焚香沐手书此，至正二年八月朔日。管道升敬识。与闺人各临一本，赋此代跋
1010210,秋日怀新敬二上人
570864,哭敬美弟二十四首 其十五
737897,先祖山姜诗集有句云客来须倩小山姜扶我抠迎似杖长自注云呼长孙为小山姜时同之方六龄也今老矣百不如人每一展读不胜惭痛因敬追原韵
1087811,奉同张敬夫城南二十咏 其九 蒙轩
609156,黎惟敬秘书新辟东林社与诸客同过
568961,腕疮剧病不寐戏成示敬美
454865,将进酒 敬贺蔡厚示刘庆云二前辈喜结千禧姻缘
1113192,安国置酒敬简堂分韵得柳暗六春字
534939,伯兄以首春次文学彭君庠三诗垂示敬和志感 其一
570701,十二绝句送敬美弟闽中学政 其五
649566,题竹送胡轸敬同
121086,敬题濂溪先生书堂
128512,敬题箕颍集后
468433,题严氏青山宴集图次唐应奉处敬韵
1221626,梅花清梦为沈士敬赋
536637,送舍弟敬美北上 其二
513827,嘉兴拜先师吕文懿公冢以陈无已丘园无起日江汉有东流诗韵敬赋十首 其八
1221612,松月斋为张克敬赋
609313,罗敬叔送至赵家圩晚泊赠别
68738,次韵答王敬助·小隐水南村
48482,文敬携叠韵诗见过且督再和去后急就一首
1148843,会真诗 其一 杨敬真
593837,闻王敬美转江西兵宪
591961,同黎惟敬询韩子成病 其二
63260,寄冯敬叔
108158,送张子敬湖南宣慰司都事
887754,蹋莎行/踏莎行 敬赋草窗绝妙词
544013,膝汝载先生卜筑武夷邀余过访余以家慈卧床褥尚孤此约感念今昔不胜怅惘敬赋小诗奉寄凡八章 其二
294074,玉楼春·敬祝唐圭璋先生八十五寿辰
426049,敬简陈以光老师
468588,题陈敬德主簿棘鹊图
186894,某敬采民言成六韵为安抚阁老尚书寿伏幸过目
737300,平蛮歌为灵川令楼敬思作
428000,望江南 题晋府旧藏王子敬书洛神赋十三行精拓本以贻钱生
1088022,马上口占次敬夫韵
538907,黎惟敬内翰自南海访余吴兴登岘山分韵 其二 得湘字
855134,累蒙周开祖使君贬示佳章才拙思荒愧不能报谨勉次韵一萹少叙敬避老匠之意
457489,除夕感怀敬呈东风老人 其五
1137671,友梅吴编校寿宫之侧筑庵曰全归有诗十咏敬次之 其五
707606,沁园春　　赠柳敬亭  云间张青雕从中州南还，索调寿母
1223778,触石坠马卧病蒙恩予告先至上京寄溉之学士敬仲参书二首 其二
68781,次韵答王敬助
769608,满江红·修翁将返金陵，前二日招同扶九、懋敬、东阳暨令弟二简泛舟西溪 其二
707894,满江红 其六 寿王敬哉宗伯
986579,浚耕云敬得方丈
571553,赠彭敬之四绝 其一
1228298,招仙词题高彦敬云山卷
803329,展拜恩师遗像敬题 其三
539091,敬美需次不调于秋夜倡和有庾公南楼之思走笔为答时予有岭右命
683837,晓上人自江右来谒敬美赠之诗云南海杨枝白社莲老僧无住总随缘不知逢着文章伯可有衣裳与大颠又行脚山僧不住山正逢居士掩玄关却嫌留偈多重障大海长空自往还盖谓余方杜门不易见倚韵立赠二绝
1219309,至元丁丑夏五，宣城汪叔敬、吴人干寿道、丹丘柯敬仲、国人泰兼善同仆游天平，次往灵岩，有作奉和二首 其一 天平魏公祠
1219309,至元丁丑夏五，宣城汪叔敬、吴人干寿道、丹丘柯敬仲、国人泰兼善同仆游天平，次往灵岩，有作奉和二首 其一 天平魏公祠
761266,渡江云 大观亭同阳湖赵敬甫江夏郑赞侯
536636,送舍弟敬美北上 其一
915137,古风敬饯吉州梁史君
422641,满江红 其四 敬次岳忠武黄鹤楼词韵
1088065,二诗奉酬敬夫赠言并以为别 其二
838182,暗香·壬戌奉读逸兄春雪见忆新词，敬和
708911,琐窗寒  敬可贻酢戏咏之
789245,惜馀春慢 金陵旅次，偕龚敬立、莫文中、范东旭、叔皋谟过僧舍，看秋海棠，用鲁逸仲韵
515049,怀邵文敬太守
706215,哭欧阳三弟叔敬沈湘六首 其六
864616,敬亭山检受御书
474625,狱夜书愁敬呈吴少槐吏部
491989,宁都曾三省自京师得危应奉为作其先人埋铭一通归以示予敬题其后
1213188,申仲礼自别秦淮台宪诸公如失轩鉴继过太原仆留吴中尝以诗奉寄丁酉冬敬甫薇郎回自并门连奉报章且谂仲礼薰陶涵养非向年比英风迈节形见乎辞又非行辈所可拟伦也因便奉和略表仰思
200692,重阳后一日偕翁宾暘张敬之江楼中分韵得台字
35320,癸卯闽乱从弟监察御史敬凝迎仕别作
209230,和敬禅师茶偈
226666,次敬叔韵·别我新诗有许清
885072,忆秦娥 雪梅二阕奉怀敬夫 其二
580359,遣怀寄吕敬修
668158,题王侍御敬止所藏仲穆马图
676340,堂成敬酬丰五溪学士之作
426316,王益初老先生诗中耆宿。屡锡瑶章，铭感殊深。敬叠原韵，藉表谢忱
504625,次胡叔敬见过诗韵
544016,膝汝载先生卜筑武夷邀余过访余以家慈卧床褥尚孤此约感念今昔不胜怅惘敬赋小诗奉寄凡八章 其五
1111050,二诗奉酬敬夫赠言并以为别
862350,小酌敬岩梅下和立斋韵 其二
911240,庄敬日强斋二首 其一
940009,敬酬智叔三赐之辱兼戏杨理曹二首 其一
464918,水调歌头 大哥嫂生日，前已作诗寄祝，旋两兄先后填此调，辄为同讴。敬渊曾用李后主虞美人词韵题数十年前平湖老宅双桂堂前全家合照，结语有那得阳乌东返水西流之句
735405,赠柳敬亭并题左宁南军中说剑图
1191454,癸卯闽乱从弟监察御史敬凝迎仕别作
196708,梅·吾敬林隐君
473090,初夏同王应凤佘日章汪以仁以敬过佘子玉园居
1216274,借曹汝敬晚对亭酌因叙相思相勉之意
1101792,幸侍轺车敬赘严韵 其一
1223414,秋日陪集贤学士赵公敬夫憩龙山玄真宫
383632,寄韩敬堂殿讲
569661,答舍弟敬美觐还复履江右臬任时偕余访道有遇 其一
1242997,王敬仲知府自临江回
666487,小园旧名退乐中丞马敬臣先生改曰常乐因为题榜兼赋古诗二章见赠蕙敬次韵奉酬且记吾园得名之始 其二
666487,小园旧名退乐中丞马敬臣先生改曰常乐因为题榜兼赋古诗二章见赠蕙敬次韵奉酬且记吾园得名之始 其二
824102,蝶恋花 冷禅、敬庵、蜕园合作枫菊竹石，属余题句
785333,己卯冬雪夜怀人诗十二首 其九 刘敬亭
538906,黎惟敬内翰自南海访余吴兴登岘山分韵 其一 得蘋字
681982,伯氏招燕京王敬哉饮
591871,七夕约卿携酒惟敬同过得凉字
202082,王辛甫示朱敬堂钓台诗卷次韵
528022,送都玄敬主事二首 其一
1215910,奉酬见寄清制元韵敬贺致政荣归惟面同一捧腹
98193,六绝句·去岁诸公祖敬之
1217536,题舜江楼为叶敬常州判赋
658147,与李敬熙 其三
1022330,天龙恭敬赞
452963,重修黄宾虹纪念馆敬题
163676,送句甥持敬赴省试
347305,读画史·子敬因成駮
714589,送陈明敬游吴因访秀州诸子 其二
817648,读简岸先生诗敬题
723862,游钟山大爱敬寺诗
686929,离怀寄汪宗彝杨孟瑄魏居敬
1238362,寓意十首次敬助韵 其四
763586,满江红 其十二 酬赠既庭兼示吴敬生兄弟
814339,宗伯奎玉庭师以承晖园纪恩诗见示敬赋二律奉呈
384443,题王侍御敬止所藏仲穆马图
593577,春日同刘仲修康裕卿刘子大沈纯甫史元秉朱汝修邀黎惟敬徐子与集李惟寅宅得台字
412779,敬渊以悼亡诗五十篇见示，爰题其后三首 其三
593530,王符卿敬美携酒同石廷尉拱辰见过
499676,寄何叔敬兄弟
611059,送蔡敬夫司马转饷关西
53233,送唐处敬赴嘉兴
279899,呈敬寺·转语曾无慧舌根
62837,同伯敬渡漳河
843013,高宗为皇四子时致蔡文勤闾疾诗翰敬题 其一
309278,满江红·敬题约园忠义专祠录
591939,姚元白黎惟敬张羽王见过小酌得孤字
468074,晋南行     谒陈廷敬墓
101221,书刘景文所藏王子敬帖绝句
851109,与朱古平饮山中和萧敬夫韵
664070,送都玄敬二首次韵 其二
1230019,广贤曾堂宾出示先世手墨敬题廿八字
648731,送罗汝敬侍郎致仕南归
505925,敬和元宵韵
885055,奉同张敬夫城南二十咏 其六 兰涧
403475,风入松 敬题梅叟师墨画观世音佛像
1128671,逢曹子敬知录三首
196645,敬聚堂·闻君出宰山水县
978271,求余敬可字与小儿习不至
570871,哭敬美弟二十四首 其二十二
945252,张敬之县尉
554215,送王处敬赴交址佥事
943683,再次敬字韵
422790,西江月 敬悼美利坚罗斯福总统
114725,观世音赞·敬礼补陀
1093139,俞伯辉主簿同徐必大判院见过涧上纳凉约鲍南仲教授小酌次韵南仲所赋兼怀林德久国录陈敬甫学士
591964,十三夜同苏子川黎惟敬方德新吴明卿苏子冲成仁卿黄定甫集吴约卿观灯得开字
649575,太平圣德诗十章 其一 正月十三日大祀天地先日车驾夙兴径诣南郊躬历神厨遍阅祭品申饬太常务精诚意是夕有司请如故事放烟火上曰朕方严对越岂暇嬉事敕免之已而阴云微布瑞雪纷集行事之际天气融和月星皎洁云飙净敛肃如神临此上天昭答圣敬也为敬天之诗第一
649575,太平圣德诗十章 其一 正月十三日大祀天地先日车驾夙兴径诣南郊躬历神厨遍阅祭品申饬太常务精诚意是夕有司请如故事放烟火上曰朕方严对越岂暇嬉事敕免之已而阴云微布瑞雪纷集行事之际天气融和月星皎洁云飙净敛肃如神临此上天昭答圣敬也为敬天之诗第一
1103962,余敬可示汪子明诸君大雪诗卷次韵
708467,贺新郎 和曹宝庵舍人赠柳叟敬亭
590838,职方蒋东川辟东山为东营偕陈敬亭偶登东川留酌赋此纪怀
291503,蝶恋花·冷禅、敬庵、蜕园合作枫菊竹石，属余题句
559685,大司徒毕堂翁老年伯蒙恩予告敬赋
696076,秋日同谷卿缜之伯乔及兄伯鳞弟子敬泛舟佛滘归至清溪数里各赋十绝
497883,王敬宏夫人 其二
186748,叶夷中屡以书求予记敬斋予往年尝为亲旧为记
825588,喻兆蕃出世所藏高宗纯皇帝书画小册敬题
843562,得锡山徐君子敬书简怀却寄二首
1212286,送张敬叔
735847,左宁南与柳敬亭军中说剑图歌
751194,赵次山同年前辈属题鲁斋年伯阳谷殉难事实敬步公松球歌韵
709877,逢邓子敬讯郭天门先生家居有寄
64610,送方二敬之北游
834155,水调歌头 口号赠袁敬抚
969927,冬夜偕徐敬室自白石归
376157,秋塘陈敬父挽章
515384,小斋初成喜承之彦夫天爵敬之师鲁踵至值冬霖累日不止举酒相属以来雨名吾斋分得蓬字
592489,答冯郡博京口见讯因忆黎职方惟敬 其一
167152,有怀龚子敬子中
1224313,送蔡思敬还豫章有怀辽阳李提举
813006,先公有浮山诗因忆旧游敬步原韵·沧浪亭
1195557,敬酬陆山人二首
507756,留别王教谕士敬 其二
593534,送王敬美使秦
664447,淮浦歌三章为太仆杨敬之作 其一
951600,道中景物甚胜吟赏不暇敬夫有诗因次其韵
491556,同张士敬姚超白炳文南宗上人饥别张怀德千户于大愚寺之松林赋柬诸君子
543608,岭南祁羡仲以诗见贻赋答并问惟敬秘书
1033416,次韵谢敬之题南康县刘清老园
959911,唐敬宗
670361,送范敬甫之闽中
548681,陆敬承有台曰来爽暇日登之漫赋 其四
276560,如此江山·敬亭山登高题壁
843014,高宗为皇四子时致蔡文勤闾疾诗翰敬题 其二
1218416,吴南伯王子英李元善会于林湖资敬庵各有诗予遂叙和 其二
951593,崖边积雪取食清甚次敬夫韵
1241221,隐忧六章时有司奉吏部符敬依令旨起取 其三
740569,四库全书第一部缮录告成正月廿一日奉贮于文渊阁臣以校理与观陈设敬歌以纪
1224308,小孤山晓发和蔡思敬韵
1213649,野庄公与孚论汉唐以来宰相有王佐气象得四人焉命孚为诗并呈商左山参政谢敬斋尚书 其二 谢安石
802462,笙陔于光绪乙亥冬夜梦至一园杜鹃花零落满地一小轩榜曰安分知止之馆悬巨镜写人了了则貂冠华袿君语张夫人设遇增秩君当无幸及君晋四品之岁果悼亡又尝梦登所居珠泉草堂舍后山长松千章风声谡谡有茅屋汎埽雅洁及卜夫人佳城恰当其处君固不乐进取夫人亦每举榜语风谏夫明识若此而蹈中寿妖梦是践名论空留廖君能无□于怀耶敬述彤徽以题琴羡将使漆园傲吏塞旦宅之悲猗兰仙才罢潜英之石 其一
1059692,敬超先 其二
544926,敬美使君再起督闽中学闻将于岁杪暂出寄讯
186498,安国置酒敬简堂分韵得柳暗六春字
1089383,杨丈既惠丹砂数种再用韵敬酬
1234321,题高彦敬树石图
1235860,次韵谢敬德司业冬至夜见念诗二首
548680,陆敬承有台曰来爽暇日登之漫赋 其三
415787,挽王敬身先生
802264,敬书叔祖威毅伯所撰刘勇介公传后 其二
513759,敬亭山
336051,亡友高伯庸滑稽玩世屡与人忤而见余则加敬人共怪之
667825,人有自郢来者辄有所述敬赋三诗 其一
652340,酬罗敬叔
1159130,登龙门敬善寺阁
204077,承子敬·端平众彦起弹冠
1230199,送吴子敬赴钓台书院山长
374683,时敬庵·主人时孝敬
374683,时敬庵·主人时孝敬
684797,云闲物外人也其幽怀元尚不可一世而时混迹于声酒流赏于翰墨直寄其牢骚焉耳衣白先生赠句云『无事到心头岂徒然哉』敬演其意为寿
586788,赠少参王本一本一以公谴谪戍吾璚上谒军门予适守苍梧道过与语甚悦且闻其善书因求写梧山书院四字及敬义字皆有矩矱临别谓予宜有赠什予归急草古风一章未及脱稿而舟已发矣人便因附寄申意
1223441,饯王敬叔
196647,敬聚堂·辛勤勿坠百年业
541941,再寄沈参政敬叔
51571,葛隐居汝敬
1092859,送敬之
602230,送陈士鹄赴进士举兼柬黎惟敬欧桢伯梁彦国诸公
1217505,徐伯敬哀诗
428648,老友姚君岫章盆梅盛开，孤芳独赏，为诗八首相示，颇触兴怀，勉凑七律一章敬以奉和
1006933,主簿年家丈游敬亭
163506,大雪同杨景韩程子敬登寺楼
1160458,赠敬晊助教二首 其二
443976,敬题饶岱章先辈《旷夏楼存稿》
282764,敬赋·夫子何为者
643046,题敬赐内侍兰谷道人蒋怡之诗卷
492535,题前崇文直长赵居敬令子所藏翰林诸老诗卷后
383411,题韩敬堂殿讲牡丹石榴画卷时值双寿称觞并呈此瑞
58684,婉儿怨戏柬敬承·今夕是何夕
1107541,己酉生日敬次靖节先生拟挽歌辞三首
947545,吾乡有李明府其伯子襟怀夐然世表某早知敬慕长诵诸人今老矣辄韵之以贻其子孙云
568915,王鸿胪同瑴乞归以养母也黎惟敬内翰合燕中诸名士以诗送之而题曰青山招隐属不佞次焉
897281,谒敬亭祠
14897,敬宗睿武昭湣孝皇帝挽歌
340395,敬题丞相赵忠靖公墨梅为张宣参作
963763,敬和老人青梅
13664,赠文敬太子挽歌词二首
951597,登山有作次敬夫韵
692697,荅马敬臣
132902,敬甫生日·苹尾生薰梅作霖
1137268,霜天晓角 其六 寿陈敬之
787135,蜡梅次敬亭韵兼寄易堂
648805,送周敬常诗
13454,赠文敬太子庙时享退文舞迎武舞乐章
1920,太和·孝敬中发
761332,齐天乐  送周韬甫、赵敬甫之杭州
879081,生查子 元夕戏陈敬叟
900387,安国置酒敬简堂分韵得柳暗六春字 其一
417339,南浦月 敬悼欧阳南老人
1111837,白石道者栖于洪岩以石为粮先朝敬爱之赐予之物甚盛一日主僧持来郡斋因获恭览叹仰之馀偶成拙句二首
597491,秋夜山楼对月与黎惟敬梁思伯诸君同赋
593840,送黎秘书惟敬得请致仕二首 其二
265700,花心动·寄大敬
68008,捣练子·赠京兆蓝党谢敬人休执著
951542,水调歌头 送敬则赴袁州教官
592580,黎职方惟敬北上见过
592582,送惟敬兼怀思
807458,念奴娇  十三夜大宗伯王敬哉先生招饮是夜无月七叠前韵
717476,佟声远友兄爱予第四儿明渲特甚求养为己子病中赋诗六章敬以托之 其五
550971,娄江哭王太常敬美先生
576591,赠王子敬凯旋
707609,沁园春　　赠柳敬亭  吴兴爱山台禊饮，分韵得关字
1090512,六月二十一日戊寅率同寮诣登源祖庙中迎英济祷雨是日也雨随车至越翼日己卯继之至中宵方霁自辛巳至于乙酉遂沛然沾足丙戌敬送神因书二小诗以纪灵异 其一
810480,闻敬亭自潞河过通州至邓家庄访鸿上人偶忆旧游书此即赠
730192,吴又乐名父以先世橙斋公种菜图册见示敬和册中原韵 六首选四 其一
544961,寄黎惟敬
1003856,送句甥持敬赴省试
570699,十二绝句送敬美弟闽中学政 其三
591557,西樵山中忆惟敬内翰思伯中舍
614046,七夕独酌衙斋有怀梁自献潘孟与张敬余
497882,王敬宏夫人 其一
429588,落花诗八首敬和春榆舅父原均 其四
683913,哭敬美弟二十四首
1248251,送王守敬还淮南
670911,得徐使君所贻王敬美见赠答寄 其三
786957,登庆礼闸有怀敬亭
204078,承子敬·壶山阀阅例多贤
795580,洞仙歌 敬题张荫嘉母舅《乐圃词钞》后
505969,敬和文房四宝
900531,安国置酒敬简堂分韵得柳暗六春字 其三
522146,沈石田画为敬所阁老题 其二
787001,大钟寺同敬亭弟作
1125483,游敬亭山用谪仙韵二首
504407,赠胡叔敬
204079,承子敬·饕相当朝舞大权
592881,陈使君敬甫张进士于皋过斋中对菊
784055,敬谒房师晓亭夫子并叩见太师母太夫人及二世兄三世兄退而志喜 其三
702558,送李锦衣士敬
528594,登楼观阁时王令明叔邀张用昭段德光王敬夫康德涵四子同游二首 其二
478246,怀知诗 其五 葛隐居汝敬
426066,敬祈民老前辈教正二首 其二
816103,岁壬子，余在赵家马头村佣书时值清明佳节，率徒散步闲游，误入仙境。但见桃李斗艳，梅柳争春，灿烂芳菲，四无涯际，真乐景也。即命徒杏村沽酒，开筵坐花，畅饮狂歌，不觉颓然大醉。稍醒，思饮茶而不得。适有一小徒，偶摘隔年干霜杏数枚敬余，或亦望梅止渴之意也。余恍然曰：昔闻识者云，霜杏烹茶，清香无比，何不试之？急归家觅竹炉，生活火，净石铫，盛甘泉，烹霜杏以饮。未入口，即清香扑鼻，不禁拍案惊奇曰：孰意以天之弃物，竟
613672,舟次同杨应先谭敬质玩月
46797,丛竹图赠内弟周思敬就题
702688,次庄孟敬韵二首
1238365,寓意十首次敬助韵 其七
661953,吴门卧病承同年王敬止枉顾
1202316,昭君怨 赠女姑萧敬善等
766418,齐天乐 七月既望，偕陈湘渔作敬、吴研仙廷燮兄莲舫西湖泛月
507544,题赵敬重游钱塘卷
826905,暗香·敬懿皇太妃画梅，和白石道人自度咏梅二曲
717477,佟声远友兄爱予第四儿明渲特甚求养为己子病中赋诗六章敬以托之 其六
809151,法海寺瞻皇考御书敬佛二字
144075,又敬和还家自喜
1128027,工侍国史李丈奉御香祷雪上竺前一夕雪瑞已应道间志喜成诗以示敬借韵同赋
226688,别胡仲立次敬子伯量二丈韵
1246032,题柯敬仲墨竹花石
278434,梁敬帝墓·高封大土号仓墩
544555,不佞自燕中归后却扫闭关一时秇苑诸名公以吏事来越者虽闻问间通而逢迎都绝乃君禹苏丈独下询刍荛穷搜草莽停驺倾盖把臂忘形至贻赠诸篇金石铿訇风霜错落揄扬蔑副愧汗弥深敬题排律五十韵奉酬大雅
591926,李实夫太守将还泉南集别黎惟敬宅沈管二山人同赋得豪字
204075,挽漳守郑都承子敬
1096168,秋塘陈敬父挽章
787018,晓起即景寄敬亭
1217153,送柯敬仲之京
626260,哭敬叔 其七
1013721,敬溪翁
810473,春暮同敬亭贻谋泛月
841319,为简敬画梅率题二绝 其二
976777,题李氏敬聚堂 其三
46843,与内弟周思敬晚过雁荡僧舍
681412,为镇江唐惟敬题一泓亭
671959,雨后答邵文敬
539170,送李孟敬侍御还台
286674,减字木兰花·敬悼毛主席逝世
781027,题费敬侯墓
485156,丛竹图赠内弟周思敬就题
505888,敬和留别诗韵 其一
876785,怀李敬子
1251955,舟次兰阴忆寄君善敬德浚仲诸友
702336,和气致祥卷为黄州刘太守敬之赋次其韵二首 其二 折梅结实
704038,喜信州作叠山先生书院访其后以奉祀事敬赋二绝
1200096,敬之
862351,小酌敬岩梅下和立斋韵 其一
193369,敬留二绝·孝娥何意要垂名
82450,无咎兄郡斋燕集有诗末章见及敬次元韵
1219445,高彦敬画
655007,泊河西务与杨郎中克敬同年夜话
409778,范之以先德尚书公三万卷楼藏书图属题，敬赋一律
299476,先中丞公癸酉鄂闱拟墨原稿沄儿装潢成册敬题其后
48418,得文敬双塔寺和章招之不至四叠韵奉答
1160170,敬酬微公见寄二首 其二
1162887,寄敬亭山清越上人
787015,人日寄敬亭即次其村中韵
731206,癸酉九月十五日于养心殿殿门外用鸟枪连毙逆匪二名十月十二日上命承恩公和世泰宣旨赐名威烈枪敬佩殊恩恭成长律
1234236,赵克敬耘庵
1182038,送清敬阇黎归浙西
413820,敬步家大人示景璠韵
790336,王子实前辈戏咏炭，敬用其韵以和之
814732,家大人重建漫泉亭，并补刻冰泉铭敬志二首
188093,敬夫用定王台韵赋诗因复次韵
592121,同文休承顾汝和黎惟敬于虎圈观西域所进狮子
352857,劝农口号·三劝农家敬主人
211671,送陈敬甫·十年所闻溢吾耳
472041,婉儿怨戏柬敬承五首 其四
816751,满江红 过金沙寺，为岳鄂王题壁处敬和原韵
825157,戚元敬
844156,南乡子 将抵白门，敬借家大人韵
234089,用柏梁体题式敬斋
1137675,友梅吴编校寿宫之侧筑庵曰全归有诗十咏敬次之 其四
787084,题敬亭琵琶行填词后二首 其二
411286,读近代江右人诗，得绝句十六首（录十五） 其二 胡退庐思敬
795871,水龙吟 敬题张夫子乐圃词钞后
28852,再题敬亭清越上人山房
1252880,临池清兴为张敬惟作二首
546574,湖上酒楼听歌王检讨敬夫汪司马伯玉二乐府及张伯起传奇戏作 其一
809634,每时届炎暑即赴口外掖辇视膳朝夕温凊自初夏皇太后偶尔违和故不至此清凉之境因咏怀一首敬书于箑头恭进以接清风而舒远慕之微悃而已
453602,孙中山诞辰一百四十周年敬步挽刘道一韵
1087804,奉同张敬夫城南二十咏 其一 纳湖
1220226,极高明亭诗为曾以敬作 其十
478524,竹堂寺与李敬敷杨启同观梅
581784,挽同年黄子敬编修二首 其二
1239286,次韵陈敬初答虞清二子雨中见寄绝句六首 其五
428513,恭和吟樵观察夫子大人留别榆林士民之作敬步元韵
153555,十六日伏睹明堂礼成圣驾恭谢太一宫小臣敬成
403599,龙山会 竹楼岁暮，与敬老、瞿禅、季思、心叔取词调中有风雨龙吟楼字者各拈一调，余得《龙山会》
1088021,敬夫用熹定王台韵赋诗因复次韵
307254,虚度八十深荷叶老惠赐五言三律敬步原韵并乞郢政
543767,寄陆太史敬承二首 其一
436744,鹧鸪天 立春后数日盛寒不出因赋鄙语敬呈遁庵尊兄一笑
318178,挽王敬身先生
