652764,赋得太湖春水送华以及岁贡
560529,翠云□假山名为华以□作
263330,铁华以晚眺诗见示，自谓不减放翁，因和韵代简奉答
650243,帝王膺受天命至圣之德格于天心故三光全而寒暑时群生和而万物育是以上天昭锡景贶以彰盛美钦惟皇上统绍鸿基主宰神人宵旰图治至仁孚于海内至信昭于天下华夷效顺海宇清宁雨旸晦明各顺其叙时和岁登家给人足乃永乐十一年春二月皇上再狩北京行庆赏黜陟之典田野之民莫不鼓舞欢跃瞻仰日月之光华以为盛世太平之贺乃夏五月丁未山东兖州府曹县以驺虞来献白质黑章五采绚烂目光如电尾长倍躯起伏蹲卧不扰不惊在廷臣僚洎蛮夷酋长与夫工商舆?之徒莫
677599,甲子冬赴松潘过窦圌山历明月关俱有罗两华题迹时闻两华以贵阳宪长归矣怀望赋此
1217547,春草轩为毗陵华以愚赋
1248942,和华以愚韵兼题所画春山高士图
602540,君华以诗见怀用韵答之
298171,好事近·年前定华以西藏檀香见贻，今始燃之，感而成咏
905757,公华以北山荔子见寄因念昔游慨然怀归戏成
137762,清明前一日韩子华以靖节斜川诗见招游李园既
409707,铁华以晚眺诗见示，自谓不减放翁，因和韵代简奉答
954215,清明前一日韩子华以靖节斜川诗见招游李园既归遂苦风雨三日不能出穷坐一室家人辈倒残壶得酒数杯泥深道路无人行去市又远索于筐筥得枯鱼乾虾数种彊饮疾醉昏然便寐既觉索然因书所见奉呈圣俞
741160,古华以桃核石索题石为阮湘圃封公所贻
