827905,在榆林游览天涯海角
941246,偕彭雅林游翠即席求和
34969,翰林游舍人清明日入院中途见过余明日
1005390,去春帅初尝约为榆林游欲烹羊酿酒为小孟尝既而仆归凤栖后帅初亦往西浙遂不果今帅初已归当践前言但同游之客达善已下世矣因黄甘便作诗以叙其怀
20235,相思林·游客远游新过岭
808703,蒋别驾芝冈招同费使怀谷载孝廉闇成上舍光林游陆氏水木明瑟园二首 其二
157478,去春帅初尝约为榆林游欲烹羊酿酒为小孟尝既
1073567,桂林山水奇丽妙绝天下柳子厚记訾家洲亭粗见其略余以六月六日度桂林岭欲更仆诣象属暑甚遂少留日从诸公于岩穴之下穹林巨壑近接阛阍之中远不过城闉之趾居高望远夸雄斗丽殆不可状择其尤者以十诗记之名之曰桂林十咏 曾公岩曾子宣丞相元丰中守桂林游七星山始见此洞芟薙草莽平坦方广可容数百人悉布砖甓之入洞十馀步有涧水横其前不可涉公梁石为桥以便游者号曾公岩
81097,寄二子·大儿新作鹤林游
182864,陈翰林游天池约相会于栖贤久之不至
588866,与区白斋梁毅所江虚谷何古林游东山寺次联句韵
1164262,闻李翰林游池上有寄
269221,在榆林游览天涯海角
140796,留赠三诗·绕林游遍便沿陂
1070118,同叶翰林游虎丘分韵得丘字
812559,蒋别驾芝冈招同费使怀谷载孝廉闇成上舍光林游陆氏水木明瑟园二首
1196075,翰林游舍人清明日入院中途见过余明日亦入西省上直因寄游君
225278,山涛·身心已逐竹林游
110832,偕彭雅林游翠即席求和
31544,闻李翰林游池上有寄
665836,赠王双林游宦海门
850132,陈翰林游天池约相会于栖贤久之不至
808702,蒋别驾芝冈招同费使怀谷载孝廉闇成上舍光林游陆氏水木明瑟园二首 其一
451479,好事近 倚秋千 桂林游
509425,同钱翰林游宝叔寺和同年张太仆韵
