1144238,都梁北乡士多好学有向君敏衡者一日访予语甚质气甚夷礼甚虔予心异之间为予言曰家故沅徙也今所居有溪实自沅来乃筑室聚书其上以教子弟因以沅溪书舍名之而其亭则曰无加盖其地旧号无加庄以其东止于石西止于岸南止于路北止于泉也愿有以发之予既为籀右书二颜而向君复以所谓廉崖者谂予予闻此石杰立千尺实峭厉峻削可敬可仰有类乎廉者颇思一至其处摩挲此石以激衰懦而未能也乃各为一解以谢焉
602113,夏日游湖李文学有诗索答
941093,延平郡学有小阁予名之曰穹林云壑和叶教韵 其一
95678,呈宋伯潜·学有南轩派
133469,四贤堂·经济学有用
465659,寄赠听风楼主李生瑚琏质书学有深功文壁精神见山阴法乳融楼藏人海裹心在玉壶中且待秋风至与君同听风一九七六年次韵奉和刘伟山兄隆冬瑞雪呵冻命笔之作
939253,问学有感
512072,初授滇南提学有成
84479,冬晴稍理旧学有感于怀
669283,济北甄文学有䧺才自题名号数十为书问余余定以一鹤归之因作一鹤吟二首 其一
169750,延平郡学有小阁予名之曰穹林云壑和叶教韵
284499,观巢城中学有感
1142389,都梁北乡士多好学有向君敏衡者一日访予语甚质气甚夷礼甚虔予心异之间为予言曰家故沅徙也今所居有溪实自沅来乃筑室聚书其上以教子弟因以沅溪书舍名之而其亭则曰无加盖其地旧号无加庄以其东止于石西止于岸南止于路北止于泉也愿有以发之予既为籀右书二颜而向君复以所谓廉崖者谂予予闻此石杰立千尺实峭厉峻削可敬可仰有类乎廉者颇思一至其处摩挲此石以激衰懦而未能也乃各为一解以谢焉 其二
270223,重到周庄中学有感
411142,观巢城中学有感
225317,刘伶·宗尚无为学有原
1137476,都梁北乡士多好学有向君敏衡者一日访予语甚质气甚夷礼甚虔予心异之间为予言曰家故沅徙也今所居有溪实自沅来乃筑室聚书其上以教子弟因以沅溪书舍名之而其亭则曰无加盖其地旧号无加庄以其东止于石西止于岸南止于路北止于泉也愿有以发之予既为籀右书二颜而向君复以所谓廉崖者谂予予闻此石杰立千尺实峭厉峻削可敬可仰有类乎廉者颇思一至其处摩挲此石以激衰懦而未能也乃各为一解以谢焉 其一
1119234,延平郡学有小阁予名之曰穹林云壑和叶教韵
605893,赠李嗣业太学有引
236517,都梁北乡士多好学有向君敏衡者一日访予语甚
183251,朋来亭·学有青衿聚
940557,延平郡学有小阁予名之曰穹林云壑和叶教韵 其二
178420,问学有感·閒花乱蕊竞红青
693223,济北甄文学有䧺才自题名号数十为书问余余定以一鹤归之因作一鹤吟二首
426688,重到周庄中学有感
781181,京兆瑶峰先生持同乡常观察行述示余知公儒臣殉节风义凛然读公爱吟草又如裴晋公故里凤凰山诸什益恍然于公之学有经术平生不朽之事非慷慨捐生一端可竟也余欲出一二语为颂第念忠魂享庙食矣德政纪浣溪矣文章寿梨枣矣捃摭遗迹近于剽窃吁公逝十馀年矣西充民肖像尸祝至今不衰何以感人之深而去思之长也因作迎神曲一章代西充民歌咏之云尔
86236,赠施道州·施先生学有源流
940558,延平郡学有小阁予名之曰穹林云壑和叶教韵 其三
1137477,都梁北乡士多好学有向君敏衡者一日访予语甚质气甚夷礼甚虔予心异之间为予言曰家故沅徙也今所居有溪实自沅来乃筑室聚书其上以教子弟因以沅溪书舍名之而其亭则曰无加盖其地旧号无加庄以其东止于石西止于岸南止于路北止于泉也愿有以发之予既为籀右书二颜而向君复以所谓廉崖者谂予予闻此石杰立千尺实峭厉峻削可敬可仰有类乎廉者颇思一至其处摩挲此石以激衰懦而未能也乃各为一解以谢焉 其三
548528,秋日同王典客顾孙二太学暨诸亲故游眺蓉湖庄二太学有作余亦嗣响
386934,赠地理师·素业承家学有师
931119,冬晴稍理旧学有感于怀
569775,方仲美博学有文而时时使酒依吴明卿居武昌从访弇中有赠
506255,起晦钟文学有诗呈国子萧先生倚歌和赠
409064,赵尧生同学有东川之行作四诗饯之（录一）
669284,济北甄文学有䧺才自题名号数十为书问余余定以一鹤归之因作一鹤吟二首 其二
173472,赠恭侍者·学有千门路
