885594,朗湖道中因见二事信笔二首 其一
902246,感事二事 其二
985679,花头巡检先君纪之详矣孝女乡女子骑虎以救亲今汝滩下有孝女石即其处也乡之得名以此然则汝滩旧名女滩米坑旧名女坑皆当仍旧不可改也吾乡有此二事宜庙而祭之以表励风俗因成一绝道余所志云
978481,张连鲁仲本蜀人从其先宦岭表仅五六十年矣为言广州城内有桧奇古甚土人相传自唐末至今往时东坡先生道惠宿留此州尝供佛其下得甘露缀枝之异予徵二事皆无所据而耆旧相传云尔要必有从来者张乞诗为赋长谣一篇
1113377,感事二事
979834,予告客不能饮酒尝使宾主俱劳客言有二事便可痛饮谓对花对佳人予病眼难看花从照律师授四分律远妇人作绝句谢客
1111277,朗湖道中因见二事信笔二首
902247,感事二事 其一
171943,朗湖道中因见二事信笔
523081,送席副使监贵州屯学二事歌
149442,予告客不能饮酒尝仗宾主俱劳客言有二事便可
1167964,张相公出镇荆州寻除太子詹事余时流夜郎行至江夏与张公去千里公因太府丞王昔使车寄罗衣二事及五月五日赠余诗余答以此诗
625735,后生德壬辰八月二十二事也
885619,朗湖道中因见二事信笔二首 其二
161120,答秀叔·人生昏宦只二事
