569367,程孟孺以善诗及书与余交十五年矣今春过余则书法益妙云将入燕应中秘之募索一言为赠余久厌笔研且畏绮语虚名落长安人耳不得已勉成二律塞白孟孺慎毋以示人也 其二
888217,予谪居荆南赋诗百馀篇书为两轴丙戌夏泛舟归润道由汉阳廖明略邀予饮于郎官湖因携示之明略坚欲抄录会予舟行甚速期以他日见归不幸明略死矣此本不复可得今将可记者录之忘者将复乞于渚宫诸友然平生作语老不自已又安用如许污后人耳目乎因感而有作
589548,求李子长画画形不似画虚难，此妙知君亦等閒。景物都归模写下，乾坤直在转移间。泉声不聒幽人耳，树色能开老道颜。我欲还家洗尘虑，闭窗趺坐看江山甘泉先生邀游波罗夜泛席赋回海北项公祖
405768,黑龙江 峨眉幽邃处以江名溪，诧人耳。峡下施小铁桥，行者皆眴慄，远不及天台石梁之险也。
49947,漂母非能知人特一时能施于人耳观其对信数语
322200,虞美人·耳根聒破笙歌竞
459505,八年前同学辈游连云山，归途至半山，大饥，问一老妪乞浆，而得粽。两年前共肖再游，遂访其人，耳已聋，亦忘前事。今日醉起，忽忆之。作此。十一月十四
107679,杂书·近代一人耳
172973,审配陈珪·元龙父子二人耳
470587,余买一小丘于铁山下登陟不数十武而尽揽湖山之胜尤于看梅为宜盖踞花之上千村万落一望而收之久欲作一小阁名为六浮六浮之名遂满人耳而阁竟不就友人邹孟阳见余叹息每欲代为经营今日始引孟阳至其地亦复叫绝不能已余因为作六浮阁图兼题一诗冀孟阳无忘此盟时丁巳八月十八日也
781131,寄和常理斋四弟二十一首 其十二 和来诗冒暑出都福赵二同年远送至芦沟桥贳酒作别恨未得预也依韵和之聊当与福赵作三人耳
708522,点绛唇 美人耳
683400,程孟孺以善诗及书与余交十五年矣今春过余则书法益妙云将入燕应中秘之募索一言为赠余久厌笔研且畏绮语虚名落长安人耳不得已勉成二律塞白孟孺慎毋以示人也
43212,纪事·众人耳目外
471284,漂母非能知人特一时能施于人耳观其对信数语可见而古今论者胥失之予过其祠感而赋此
569366,程孟孺以善诗及书与余交十五年矣今春过余则书法益妙云将入燕应中秘之募索一言为赠余久厌笔研且畏绮语虚名落长安人耳不得已勉成二律塞白孟孺慎毋以示人也 其一
