934157,谒巫山庙两庑碑版甚众皆言神佐禹开峡之功而诋宋玉高唐赋之妄予亦赋诗一首
773652,凤邑大昆麓庄内福德祠前一带基地被庄众侵占百馀年耕作菜园开池筑厕嘉庆乙亥1815陈君廷瑜首唱捐赀劝解庄人为之清出众皆悦之
436391,丁未新正与诗社诸公园亭宴集彦衡有诗众皆属和一时樽酒宾席之胜殆可乐也余虽老顾不可虚盛意勉为赋此
1082569,疏山作糊饼草堂老师出语云色香味触具四尘且道糊饼具几尘是时众皆无语老师末后云大刀三十口以颂系其后
572407,夜起同廖道人扣王生门索酒酒行而电电大作众皆辟易余兴益豪至子夜乃休 其一
572408,夜起同廖道人扣王生门索酒酒行而电电大作众皆辟易余兴益豪至子夜乃休 其二
958388,白莲草亭前盆池所出也惯见红华忽遇此本孤高淡素有足爱者众皆以比妇人而予独以拟颜子云
699355,夜起同廖道人扣王生门索酒酒行而电电大作众皆辟易余兴益豪至子夜乃休
773622,郡北之南庄旧有古更路庄人侵占数十年适乾隆己酉1789陈君握卿诣七庄为之清出时有争讼横逆百馀事悉听其劝解众皆悦服陈君回郡七庄老幼送程十里
459176,大云山绝顶大雨，数时不止，冲雨而归，众皆苦之，予独怡然。时遇横铺丹丹、胖子诸人
83699,谒巫山庙两庑碑版甚众皆言神佐禹开峡之功而
940761,嘉定戊寅秋同蔡念成诸人游三叠泉泉旧名三级改今名岩间莓苔隐然有字如玉色众皆曰古人留题也即而视之其末有密官二字馀皆似字而不可晓他日复往则不复有睹因作诗以纪之
522343,别驾高君解绶归众皆叹惜竞为诗以送之予亦继作
