185269,怡颜亭曹若晦子无易为奉亲作
1066681,致政朝奉亲家丁公挽歌词二首 其二
1122624,送杜阳安奉亲还蜀
1004636,庆元丁巳十月奉亲如临安宿西菩寺表弟吴克仁俱焉 其二
1251107,送子卿还家奉亲
173397,送章明章善解官奉亲还吴中
679844,送王生奉亲之松江
939124,用门牌日有好花迎客笑岁刍新酒奉亲欢为韵为老人寿
916737,淳熙丁未初伏奉亲避暑中岩 其二
916736,淳熙丁未初伏奉亲避暑中岩 其一
1038907,黄雍于西安修水之侧起佚老亭以奉亲
1033549,侄孙仲晦亦龙和前诗甚佳其家有林塘之胜兄弟和睦日以奉亲为乐用此韵以美之
963684,送杜阳安奉亲还蜀 其二
1071256,宣和四年东阳梅某出守蕲州以五月十九日斋宿山谷黎明奉亲朝谒真源万寿宫少休五云寺赋此
1220376,童氏作楼奉亲名曰乐心
997124,高至言筑亭于家圃以奉亲总其观览之富命曰溪亭乞余赋诗余先君之敝庐望高子所筑不过十牛鸣地耳故余未尝登临而得其胜处
1068932,别后一日予独游惠山寺酌泉烹茶而去时景蕃补葺旧隐将自德兴奉亲而归以诗追寄之
222454,用门牌日有好花迎客笑岁篘新酒奉亲叹为韵为
1128488,致政朝奉亲家丁公挽歌词二首
151509,怀天台·有妹有弟奉亲慈
1115896,淳熙丁未初伏奉亲避暑中岩
849658,我辈小年端午给假蒲酒奉亲之外日游村田间致足乐也今老矣竹坞老友近馆授徒逢此小熟奉一酌道旧且有感于并汾旧事云
926731,治平丁未仲秋，游伊洛二川。六日晚，出洛城西门，宿奉亲僧舍，听张道人弹琴
10734,苦哉行·可汗奉亲诏
658295,赠方文粹奉亲之官京师
653021,奉亲堂
345099,幽谷谢惠新酿家馔奉亲
1138958,宁晋李照磨筑室奉亲名曰芝室索客赋之
109359,淳熙丁未初伏奉亲避暑中岩
1033481,呈姚显叔奉亲送死极孝
519015,夜罾鱼奉亲
1106807,送章明章善解官奉亲还吴中二首
640892,驱车篇送张志道奉亲柩归清潭
234184,庆元丁巳十月奉亲如临安宿西菩寺表弟吴克仁
1004637,庆元丁巳十月奉亲如临安宿西菩寺表弟吴克仁俱焉 其一
862891,送章明章善解官奉亲还吴中二首 其二
941078,同师道弟奉亲游延平凤山
1048838,幽谷谢惠新酿家馔奉亲
795605,苏幕遮 夫子新安归云：郡女王叶奉亲甘旨，夫客死粤西，讣至，屏食而绝
170091,同师道弟奉亲游延平凤山
1066680,致政朝奉亲家丁公挽歌词二首 其一
928051,鹧鸪天 其四 任静江经略安抚日元夕奉亲出郊
1251466,题瞿德皋奉亲读书处
648942,题刘氏奉亲堂
1244050,环山亭（袁氏为奉亲而筑）
903266,茂洪奉亲携妾迁新馆戏赠
862892,送章明章善解官奉亲还吴中二首 其一
147746,呈姚显叔奉亲送死极孝
1128151,庆元丁巳十月奉亲如临安宿西菩寺表弟吴克仁俱焉
1139007,怡颜亭曹若晦子无易为奉亲作
351688,别后一日予独游惠山寺酌泉烹茶而去时景蕃补葺旧隐将自德兴奉亲而归以诗追寄之
114728,高至言筑亭于家圃以奉亲总其观览之富命曰溪
657405,奉亲堂为古溪赋
1026960,奉亲两载为民祈蚕作竞渡于此以五十六言即事
1221553,孙仲文奉亲图
357634,致政朝奉亲家丁公挽歌词
237171,我辈小年端午给假蒲酒奉亲这外日游村田间致
963685,送杜阳安奉亲还蜀 其一
144158,送杜阳安奉亲还蜀
916738,淳熙丁未初伏奉亲避暑中岩 其三
