1114130,所寓天宁方丈后有阇提花数株连月盛开玉雪可爱怅然有怀成三绝句寄吴元中
428142,予于甲戌秋，执教鞭于杭州冯氏女子中学，及丁丑夏历十月杪，始只身从军马中步行回家，今日登普济桥南望，怅然有感
627122,丁亥仲春余归自岭右暂憩乡园读杜工部秦州杂咏怅然感怀因次其韵 其四
872636,再过宜兴舟中见芍药数枝忆淮乡此花之盛为之怅然辄成三绝 其三
858696,全椒张公有诗在北山西庵僧者墁之怅然有感
1191230,听乐怅然自述
1081427,余去秋七月登舟逮此一年矣六月晦日午睡觉闻儿女辈相谓曰明朝又是秋风起推枕怅然走笔记之
581086,湛内翰将行怅然有感兼怀阳明子
830275,上巳花下怅然有感因和俶玉用昌黎寒食日出游韵
826176,芳草渡·病院冬深，忽闻燕语，怅然有赋。依清真体韵及四声
819734,岚山雨后樱花狼藉怅然有作
475022,周以言黄圣长过我先人城南故居赋诗见示怅然答此
649258,到桃源黄学士舟已先在南岸不得相即相望怅然
781435,人来说岭南事，怅然述怀
739453,次真州未及访玉几徵君怅然有作
283598,台城路·病酒初起，残春苦寒，隔院筝声，月华似水，怅然赋之
973716,与叔骥父子别后怅然怀之三首 其一
973714,与叔骥父子别后怅然怀之三首 其三
1156796,自罢河南已换七尹每一入府怅然旧游因宿内厅偶题西壁兼呈韦尹常侍
734480,久不得曾庭闻消息怅然有怀
662072,经武夷阻雨不及游怅然有怀追和旧作
544284,徐象先订约同发而榜人留滞余待之不至殊怅然
46056,浣溪沙·独立苍茫每怅然
675785,怀化驿观前年和韵旧作又辱张东沙诸公见和墨迹在壁宛然如新光阴不冉怅然有感
1050587,和安止怀予北归怅然有作三首 其三
570815,中贵人致牡丹一株颇丽雨中对之怅然停饮因寄仲氏敬美 其三
627132,丁亥仲春余归自岭右暂憩乡园读杜工部秦州杂咏怅然感怀因次其韵 其十四
1058100,翻书见舍弟去年自寿归郓道中诗怅然怀想久不作诗因集句为答用渭城体可歌也 其五
549742,昔年赴戍道出禾川承龙袍溪带湖贺巽东修吾昆仲及龙生作霖高雅感念今昔怅然有怀
869958,去岁与东郡幕府诸君同游河亭望太行雪饮酒赋诗今冬罢归京邑怅然有怀
402947,月下笛 王城归客，追缅夙游，怅然有作
934147,累日文符沓至怅然有感三首 其一
627127,丁亥仲春余归自岭右暂憩乡园读杜工部秦州杂咏怅然感怀因次其韵 其九
347999,怅然有作·雨馀风物一番新
1062119,公实示閒字韵诗怅然有感次韵奉和三首 其三
694791,元美有江上之约未得遽赴怅然有思
538364,同诸君饯子成怅然有感盖予以前岁是月使归
483523,至新丰丘丈寓所期与理旧情而吐今意不料已先我东还矣不胜怅然因为是诗俟便寄与
464519,卜算子 七月十七日晨赴九龙坡机场，以桂林大火，机不能到，怅然而返
291403,苏幕遮·亚子来海上才五日，明晨将返棹红梨，怅然赋此
934146,累日文符沓至怅然有感三首 其三
798902,鹧鸪天·病中清明，不能省墓，为之怅然
423487,忆旧游·秋夕津门客馆忆去岁别南中时情事，怅然有作，用清真韵
889471,予与王瞻叔韩通一林梅卿余知默徐彦才六人皆同庚也一登政路五上禁涂其四久已物故所存者独知默与予耳今日得报知默又已云亡念年齿至此予亦岂久于世者乎怅然有感于怀因成数语以自解
6852,承恩量移宰江邑临鄱江怅然之作
1062118,公实示閒字韵诗怅然有感次韵奉和三首 其二
701166,芜湖风阻寻访旧识无有存者是夏张工部奉命槯木亦巳还朝抚时感事不觉怅然偶书二绝与罗少府
1138,晚景怅然简二三子
612117,过郴阳巡道旧署留宿抚衙前双古松怅然有感
13793,永宁里园亭休沐怅然成咏
523667,兄以西堂落成盖怅然有念于二亲余心交痛颂义追德爰成兹咏焉
741527,入大风洞不能穷游怅然有作
289898,三姝媚·园中紫丁香三株，今春特盛，风晨重对，已半残矣。怅然赋此
409781,闻范之仓卒去皖，怅然寄诗二章，即次范之九日宴集诗韵 其一
1163772,唐昌观玉蕊花折有仙人游怅然成二绝 其一
667940,石泉施生从余游湖上数月忽中夜不寐枕上闻过雁求曹之声怅然有怀郊郢故人诘旦束装向余求去余不能留诗以纪别
277046,怅然有作·玉漏惊催玄武湖
608582,病起客至言西郊花事已过怅然有作 其二
708472,菩萨蛮  西郊海棠已放，风复大作，对花怅然
388162,明卿由给事外谪贻书见报怅然有答
888984,见市上有卖海棠者怅然有感
647203,庚申秋夜予卧病孤山闲读虎关女郎秋梦诗怅然神往不能假寐漫赋一绝并纪幽怀予巳作木石人尚不能无情后之览者当如何也
47410,久雨坏墙园蔬尽压怅然成诗
353645,德久和韵以予请外之力预为怅然再用前韵
268202,天均酒次以诗见示事有同感怅然兴怀
443802,乙酉八月既望，露台赏月，怅然有作
547622,嘉靖壬戌从三兄无择下第同归有过桃花口诗至万历已夘请告南还复过此地咏兄旧句怅然有感用韵追和
1162154,山郭风雨朝斋怅然秋思
138303,得家书报敝居紫丁香盛开怅然有感
362895,怅然赋·谁知踪迹亦飘讽
810209,舟过岳阳楼，风利而不得泊，望之而不能登，怅然赋此
470637,别莆田陈君彦质追送不及怅然有作五首 其二
597447,舟次胥江怅然有恍别之作
904507,德辉郎君名嘉橘其小字也书来云修嘉辰故事并蒙惠二尊怅然有感二首 其二
824491,苏幕遮 亚子来海上才五日，明晨将返棹红梨，怅然赋此
813411,订《中晚唐诗人主客图》既成，怅然有感，题卷末二首
645812,槎峰禅暇因读梦观右讲经居武林日所寄佳什怅然有怀援笔遂成长句时梦观寓中都龙兴寺故录以寄之
597778,起复赴京途闻赵良弼自辽东领郡之顺德寻以母忧奔汝上因取道过其庐访之怅然为别四首 其一
807857,贺新郎  舟泊枫桥，同吴广璧小饮金苇昭斋中，归过寒山寺，因忆昔年阮亭王先生入吴，夜已曛黑，风雨杂遝，阮亭摄衣著屐，列炬登岸，径上寺门，题诗二绝而去，一时以为狂。今别去六七年矣，怅然赋此并怀阮亭
644633,乙丑中秋在石镜精舍同士友玩月后二日家兄寄示会饮分韵诸诗览之怅然叹不得与因奉次来韵兼东郑君好义 其一
1077987,所寓天宁方丈后有阇提花数株连月盛开玉雪可爱怅然有怀成三绝句寄吴元中 其三
556120,宜兴舟中读徐养斋诗稿因思奉别之久怅然有怀二首 其二
509000,壬申岁暮预约同寅余公新正郊游值霖雨闷甚正月三日因携壶独酌贡院池亭怅然有怀
537539,明卿由给事外谪贻书见报怅然有答
447570,新昌县寻天姥山不得归途怅然
1249343,中秋对月无酒怅然孤吟
464604,西子妆 彊村语业有酬先外舅吴北山先生本调一阕，回环讽诵，怅然有作，敢于追和，聊寄所怀。
564388,留都玉署无梅怅然有怀小园
933706,病中久废游览怅然有感
271855,岚山雨后樱花狼藉怅然有作
1030301,虞美人 其二 与客赏海棠，忆去岁临川所赋，怅然有远宦之叹。晚过楚塞作
475337,吕道士楼怅然有作
796840,菩萨蛮 春雨连绵，园花零落，风前独立，怅然久之，谱饯花词四章，并寄丽轩 其三
390356,亡儿后拆所筑月台怅然有作
331358,所寓天宁方丈后有阇提花数株连月盛开玉雪可爱怅然有怀成三绝句寄吴元中
807508,念奴娇  丁巳中秋广陵寓中病疟不获为红桥平山之游怅然有作奉柬金观察长真先生并示豹人穆倩孝威定九蛟门叔定女受无言诸君
384378,杨仪部君谦纂述之余颇修静业瞻对无由怅然成咏
524794,和英玉闻秋佳亭新移怅然作兼简王礼部钦佩
745304,积雪初尽晚晴忽开怅然成咏
230001,访旧所游服膺斋怅然有怀
354413,舟经武塘蒋亭彦杜于皇枉过予以行促怅然而别
1071117,列之告别为之怅然小诗送别
6851,自苏台至望亭驿人家尽空春物增思怅然有作因寄从弟纾
199751,今年正月二十五日行园见群花尽开怅然追思去
1158790,谪官后却归故村将过虎丘怅然有作
277534,蝶恋花·冬日得国内友人书，道时事甚悉，怅然赋此
740491,奄旦处也时朔雪被野人马衣裘满目寒色怅然兴感作怀古四篇 其三
471512,临章楼闻越舸且别怅然二首 其一
932933,客自凤州来言岐雍间事怅然有感
522080,荐溪宫谕省觐归赋诗末就而别八月七日礼部南斋独坐怅然有怀足成奉寄
1079526,十一月五日与才仲弟相别于白沙东门之外怅然久之不能自释乃知谢安石作恶之语不为过也因成八诗奉寄可见别后气味亦可并示京洛间亲旧也 其七
539766,再赠子与十绝 子与行余既以长歌饯别矣临岐怅然飞龙之乖隔羽翼之无从也因复为十绝以吴音度之栈马踯躅行徒掩涕矣 其一
539338,癸丑余以避地吴中登阊阖行战地怅然有感
13814,山郭风雨朝霁怅然秋思
1085467,次韵安国读荐福壁间何卿二诗怅然有感
627138,丁亥仲春余归自岭右暂憩乡园读杜工部秦州杂咏怅然感怀因次其韵 其二十
81302,过茱萸舖青松朱户前临大道绝似西陲亭驿怅然
465245,水龙吟 岁暮楼窗倚眺，怅然有赋
838158,诉衷情·居京养疴，考功旧役，远来丐见。义分依依，为之怅然，时吏部易为警署
1172018,自苏台至望亭驿人家尽空春物增思怅然有作因寄从弟纾
279309,瑞鹤仙·江城厌旅，再度清明，坐对瓶花，怅然有赋。调夹钟羽一解
1156780,早春西湖闲游怅然兴怀忆与微之同赏因思在越官重事殷镜湖之游或恐未暇偶成十八韵寄微之
1005321,七月望日避地省坑存思庵留题时章林出白石可为水晶有旨差路县官同金玉提举差夫取凿又宿兵守之吏卒旁午指予为上户求鸡羊酒米油铁无以应其求且不堪其屡也来避于此予念自丁丑之乱至此凡三避矣僧旧屋更新怅然有感因赋之
474747,春日病起得家书怅然有感
789710,秋目远望怅然有感
78037,累日文符沓至怅然有感
570813,中贵人致牡丹一株颇丽雨中对之怅然停饮因寄仲氏敬美 其一
498289,余旧诗悉已遗忘而韬仲皆为存录展阅一过觉无端往事交集胸怀怅然久之因呈四韵
571579,芜湖风阻寻访旧识无有存者是夏张工部奉命槯木亦巳还朝抚时感事不觉怅然偶书二绝与罗少府 其二
1079525,十一月五日与才仲弟相别于白沙东门之外怅然久之不能自释乃知谢安石作恶之语不为过也因成八诗奉寄可见别后气味亦可并示京洛间亲旧也 其六
609463,燕京风霾连日春昼阴冥不得跨蹇驴出郭怅然有作 其三
872637,再过宜兴舟中见芍药数枝忆淮乡此花之盛为之怅然辄成三绝 其二
499748,夜雨倏霁月色清朗起视天宇怅然有故人之想遂赋此奉呈娄君仲实为翌日游岩之约云
665798,大田读伯固起溟见和之作怅然怀答二首 其二
78390,张季长学士自兴元遣人来因询梁益间事怅然有
168461,闻韩正伦检正挂冠感叹故交怅然久之偶成
78119,偶怀小益南郑之间怅然有赋
962469,访旧所游服膺斋怅然有怀
1194236,唐昌观玉蕊花折有仙人游怅然成二绝
322251,送尔执北归后怅然有感
677411,过匡庐阻雪不得登怅然增怀因赋短篇报九江牧射陂朱君
369098,贺新凉·初夏过陶然亭寻壁间竹素青士箌云旧题半已磨灭矣怅然赋此
1157215,初与元九别后忽梦见之及寤而书适至兼寄桐花诗怅然感怀因以此寄
597780,起复赴京途闻赵良弼自辽东领郡之顺德寻以母忧奔汝上因取道过其庐访之怅然为别四首 其三
973744,中秋以山居不得与周文对饮况子畅在数百里外也怅然有怀
513436,苦热与汪汝温露坐树下怅然有怀
1079523,十一月五日与才仲弟相别于白沙东门之外怅然久之不能自释乃知谢安石作恶之语不为过也因成八诗奉寄可见别后气味亦可并示京洛间亲旧也 其四
615568,客与余话出山事怅然有作
1191402,晚自台中归永宁里南望山色怅然有怀呈上右司十一兄
765584,满江红 其四 忆故园种竹栽篱，怅然寄内
1004270,与子先兄及伯畅甥别投宿明月山客邸怅然有赋 其一
1156499,得微之到官后书备知通州之事怅然有感因成四章 其二
97109,得晴欲过江访梅已忽病作天亦复阴怅然有赋
627133,丁亥仲春余归自岭右暂憩乡园读杜工部秦州杂咏怅然感怀因次其韵 其十五
308445,新雁过妆楼·得晦闻书，怅然赋答
47671,黄慎之自闽见访夜坐对酌怅然有感
748775,十一月初六发平夷初出滇境怅然成咏
756282,重到山中怅然感旧次壁间韵
794915,声声慢 还苏州后至修梅旧居，未免室迩人遥之感，怅然倚声。
10909,晚自台中归永宁里南望山色怅然有怀呈上右司十一兄
15163,晚岁登武陵城顾望水陆怅然有作
277045,十二月十二日送客不及怅然有作
309107,寄怀·海上思君倍怅然
423256,游交芦庵僧人老且病出观华秋岳奚铁生西溪诸卷欲访厉太鸿先生墓为时已晚怅然归去赋此赠之 其二
627126,丁亥仲春余归自岭右暂憩乡园读杜工部秦州杂咏怅然感怀因次其韵 其八
54189,杨仪部君谦纂述之余颇修静业瞻对无由怅然成
703989,宿戈阳山家将明怅然兼忆李少卿二首
546572,入晋陵复不及访朱在明怅然复寄此诗
836000,金缕曲 读公度今别离四章，枨触千端，怅然赋此。
930648,山行见三十年前题名怅然有赋
889490,权郡许丈饯别于蛾眉亭怅然有作
698556,宜兴舟中读徐养斋诗稿因思奉别之久怅然有怀二首
266633,金缕曲·读公度今别离四章，枨触千端，怅然赋此
656129,阅去年日录簿此日寓娄谅氏怅然成诗
871681,盘溪之游前一日知几太博行矣同令君梅下清饮不无怅然吾人会合之难再赋绝句 其一
1079527,十一月五日与才仲弟相别于白沙东门之外怅然久之不能自释乃知谢安石作恶之语不为过也因成八诗奉寄可见别后气味亦可并示京洛间亲旧也 其八
1089750,德久和韵以予请外之力预为怅然再用前韵
598073,顷岁卜居郡南至是始辞郭使君还山怅然有作
637332,周驸马德章作诗送别因追思其先兄德明方伯余读之怅然遂和以见意
1050585,和安止怀予北归怅然有作三首 其一
98465,怅然怀之·君家苕霅间
1114050,九日诸季散处长乐外邑怅然有怀二首
323920,敕局同年相饯是日谢遣婢子春饶者还其家同年大不然之共怅然也
613965,寒食斋居何文起将之五羊以书话别怅然赋此
1125799,和安止怀予北归怅然有作三首
892198,长安道中怅然作三首 其二
340875,公实示閒字韵诗怅然有感次韵奉和
442165,久未归省怅然成赋
930850,予行蜀汉间道出潭毒关下每憩罗汉院山光轩今复过之怅然有感
815297,金缕曲 春雨连绵桃花落尽忽忆去年今日姚小春集同人作皋亭之游今小春去都中一载矣黄昏不寐怅然久之挑灯为谱三痊并寄小春
696627,大田读伯固起溟见和之作怅然怀答二首
1103788,故夏与南翁往来里社共听松风盘旋久之欲作数语不果近日偶至其下怅然兴怀追赋六言一首
292282,木兰花慢·虎丘山顶瘦塔盘空，人迹罕到，赛日携榼登眺，怅然成咏
837565,兰陵王·翡仙殁后，倏忽经年，芳菲依旧，欢悰去心，怅然此怀，乌能已已
471513,临章楼闻越舸且别怅然二首 其二
796838,菩萨蛮 春雨连绵，园花零落，风前独立，怅然久之，谱饯花词四章，并寄丽轩 其一
950822,闻韩正伦检正挂冠感叹故交怅然久之偶成三首 其一
465260,解语花 壬午元夜月色为风雨所败，山城寂冷，追忆曩年广州灯市之盛，怅然赋此
600796,外孙张穆叔从父命远行至今半载杳无消息怅然感怀二首 其二
537264,濮阳李明府自新喻再寄予诗兹以觐事驻城外属时禁方严不得出视怅然有怀
928898,过茱萸铺青松朱户前临大道绝似西陲亭驿怅然有作
272335,久不得曾庭闻消息怅然有怀
308517,秋思·秋夜小集，听六禾谈曲中近事，怅然怀旧，爰和梦窗孤调，简子端
556875,元美有江上之约未得遽赴怅然有思 其一
665797,大田读伯固起溟见和之作怅然怀答二首 其一
609461,燕京风霾连日春昼阴冥不得跨蹇驴出郭怅然有作 其一
98463,与叔骥父子别后怅然怀之
523868,见云雷垂垂不雨怅然有作
768790,金缕曲 其三 春雨连绵桃花落尽忽忆去年今日姚小春集同人作皋亭之游今小春去都中一载矣黄昏不寐怅然久之挑灯为谱三痊并寄小春
556786,元美将之青州书来约会已乃径去怅然动怀爰命同心展笔志恨得寒字
824597,蝶恋花 莼农以所和《浮海词》五解见寄，辞意凄婉。昏暮素居，怅然念旧，再为依声答之
1114158,余两过湖湘皆以事阻不到南岳今自衡趋潭意谓决可一到又以新讨降步谅之众不果往为之怅然成两绝句
591329,陈潜甫于风雪中见访闻将寻张苏二逸人怅然怀之
421738,秋日游陶然亭，怅然有感
586433,嘉靖丙戌予出守宣城值仲春廿日连雨不止正有闾阎之忧忽津吏走报麦垄淹没遂偕同寅汪西麓登北楼四望怅然
934117,梦游山寺焚香煮茗甚适既觉怅然以诗记之
1172028,承恩量移宰江邑临鄱江怅然之作
835383,月下笛 闻叶汝谐谈西湖访友事，怅然赋此。用张玉田赠仇山村韵
498300,贺生文战不利愤懑悲骚托之好内以自发摅竟得疾不起比余再过其居凄凉触目即所最欢昵者亦不复在燕子楼矣因怅然书其壁上 其一
672465,汝脩北行约过溧上既闻自京口渡江而去为之怅然及予将至京师喜佳会不远往往形诸梦寐赋此寄之
930481,三年前与儿辈步过东泾小岭得胜处可营别墅贫不能成偶复至其地怅然有感
351791,荐福观何卿壁间诗对之怅然次前韵
1058101,翻书见舍弟去年自寿归郓道中诗怅然怀想久不作诗因集句为答用渭城体可歌也 其六
796841,菩萨蛮 春雨连绵，园花零落，风前独立，怅然久之，谱饯花词四章，并寄丽轩 其四
448669,四渡黄河而不得见黄河之水怅然有赋
125104,怅然作·兴亡作今古
1155942,华城西北雉堞最高崔相公首创楼台钱左丞继种花果合为胜境题在雅篇岁暮独游怅然成咏
768788,金缕曲 其一 春雨连绵桃花落尽忽忆去年今日姚小春集同人作皋亭之游今小春去都中一载矣黄昏不寐怅然久之挑灯为谱三痊并寄小春
348820,和安止怀予北归怅然有作
431316,闻范之仓卒去皖，怅然寄诗二章，即次范之九日宴集诗韵
388056,濮阳李明府自新喻再寄予诗兹以觐事驻城外属时禁方严不得出视怅然有怀
924122,柳湖久无水怅然成咏
512016,癸已岁予齿四十九矣宦绩无成道德日负怅然有感因作
10256,听乐怅然自述
597779,起复赴京途闻赵良弼自辽东领郡之顺德寻以母忧奔汝上因取道过其庐访之怅然为别四首 其二
1004271,与子先兄及伯畅甥别投宿明月山客邸怅然有赋 其二
1253027,黄慎之自闽见访夜坐对酌怅然有感四首
473525,舟中梦后月明江清怅然有怀
444010,丁亥中秋前一日，漫步青山湖畔，时正挖湖底隧道，水全抽干，怅然赋此
529946,闻庭实上计不与怅然有怀
889023,江朝宗许重阳见过候终日竟不闻车音使人怅然因成拙句以诮之
470636,别莆田陈君彦质追送不及怅然有作五首 其一
1062117,公实示閒字韵诗怅然有感次韵奉和三首 其一
445868,日暮访仙游寺寺已颓圮怅然久之
509150,宿戈阳山家将明怅然兼忆李少卿二首 其一
546059,杪秋再游兰阴过精舍见前壁间题怅然复书一绝
276414,订《中晚唐诗人主客图》既成，怅然有感，题卷末
1078268,九日诸季散处长乐外邑怅然有怀二首 其二
933846,偶怀小益南郑之间怅然有赋
515339,八月六日至南山怅然兴怀因就葺整书册赋此
539145,助甫以病不出会遗诗见赠怅然有答
653785,甲寅三月登吴山怅然有作
709900,辛亥秋遇沈从弱于石埭遂往白门相期归路访其安庆家居兼取药地和尚近耗明年归舟经过乘风不及登岸为之怅然
546580,忆以修挐舟饯别至魏湾执手恋恋闻某直指垂至乃发迄今令人怅然偶值清源鸿便辄题二绝寄苏并讯易惟效蔡景明 其二
276415,怅然有感·前生应有罪
13833,永宁里小园与沈校书接近怅然题寄
117676,柳湖久无水怅然成咏
316301,诉衷情·居京养疴，考功旧役，远来丐见。义分依依，为之怅然，时吏部易为警署
515332,有客馈予奇石置庭前盆池意甚爱之一夕被人窃去怅然赋诗且以自慰
615010,余桐封之役将出都门余士翘以谒选来余候命留滞士翘补官司教北流乃先余行怅然赋此
80844,客自凤州来言岐雍间事怅然有感
430250,浣溪纱慢    霜腴以此解见示，丹阳车次，春雨乍霁，新月掩映云外，客心怅然，辄和其韵，却寄霜腴海上
1181326,闻进士许彬罢举归睦州怅然怀寄
815301,菩萨蛮 春雨连绵，园花零落，风前独立，怅然久之，谱饯花词四章，并寄丽轩
3937,谪官后却归故村将过虎丘怅然有作
291365,蝶恋花·莼农以所和《浮海词》五解见寄，辞意凄婉。昏暮素居，怅然念旧，再为依声答之
889319,闻故旧二三公或不幸于官或以疾病而去或以口语而罢怅然有感
528973,黄纯玉之再游龙华也予不及再陪怅然次韵
695056,起复赴京途闻赵良弼自辽东领郡之顺德寻以母忧奔汝上因取道过其庐访之怅然为别四首
513473,成化癸巳腊月十日予生盖三十年矣适有史事不克归省怅然有怀谨步韵家君守寿诗一章录似克俭克宽二弟
330270,仲春季泽远来相访感往念今怅然有怀
826512,木兰花慢·虎丘山顶瘦塔盘空，人迹罕到，赛日携榼登眺，怅然成咏
362624,味辛客游浙西余顷从楚南归不得即见怅然赋
1079521,十一月五日与才仲弟相别于白沙东门之外怅然久之不能自释乃知谢安石作恶之语不为过也因成八诗奉寄可见别后气味亦可并示京洛间亲旧也 其二
1079524,十一月五日与才仲弟相别于白沙东门之外怅然久之不能自释乃知谢安石作恶之语不为过也因成八诗奉寄可见别后气味亦可并示京洛间亲旧也 其五
1246329,野行偶见红树怅然有感呈石末公
53866,吕道士楼怅然有作
627129,丁亥仲春余归自岭右暂憩乡园读杜工部秦州杂咏怅然感怀因次其韵 其十一
556876,元美有江上之约未得遽赴怅然有思 其二
488478,过吴江不及晤周继美叔宗兄弟怅然有怀
733438,送尔执北归后怅然有感
50782,周以言黄圣长过我先人城南故居赋诗见示怅然
1050586,和安止怀予北归怅然有作三首 其二
740492,奄旦处也时朔雪被野人马衣裘满目寒色怅然兴感作怀古四篇 其四
447511,闻重庆青年报停刊，忆曾谋职于兹数年，不禁怅然
602321,寂居蓟门岁聿云暮爰睹栖鸟怅然兴怀和归鸟四章
416225,蝶恋花 冬日得国内友人书，道时事甚悉，怅然赋此
683676,再赠子与十绝 子与行余既以长歌饯别矣临岐怅然飞龙之乖隔羽翼之无从也因复为十绝以吴音度之栈马踯躅行徒掩涕矣
545052,王长公两寄余书不值乍次公之江右始得之时公雅慕长生将以八月闭关与尘世绝书来云云怅然奉寄二首 其二
1122601,公实示閒字韵诗怅然有感次韵奉和三首
780014,百字令 朱锡鬯过访不值怅然有寄
124192,冬夜饮散怅然有感
748124,吾与故人蕲水陈子秋舫别几三十年而陈子没又十余年矣予至武昌江路匪遥未得一访其故居怅然有作
768789,金缕曲 其二 春雨连绵桃花落尽忽忆去年今日姚小春集同人作皋亭之游今小春去都中一载矣黄昏不寐怅然久之挑灯为谱三痊并寄小春
139091,权郡许丈饯别于蛾眉亭怅然有作
784528,易公仙公申兄弟，暨王兰谷宿盘山天城寺三日，历盘西剑台诸胜而归，未及追陪怅然于怀赋此却寄 其三
1055980,仲春季泽远来相访感往念今怅然有怀
520696,莆田郑自修宰河源故厚予四月三日舟过县城君以诖误不在予亦以文法行一时风雨大作小泊沙口而去怅然怀君口占一诗期后寄之
572675,崤陵壁间见黄平倩诗怅然有怀和韵
682505,燕京风霾连日春昼阴冥不得跨蹇驴出郭怅然有作
950823,闻韩正伦检正挂冠感叹故交怅然久之偶成三首 其三
630923,山中病起人境初涉而茅屋待结远人未归怅然兴怀书寄阿字
950930,比闻赵季茂奉板舆行春甚乐予跃然效之是日乃值大风雨昏后倦归则素月流天仍复晴矣自此连日春色尤浓杏已过雨红英满地怅然有作因寄
1235655,董仲达送予至湘阴别后顺风比晚行三百里怅然有怀作二绝付其仆之远送者持归
1018399,临川道中怅然有感因作遣情
58974,春日病起得家书怅然有感
1246150,黄慎之自闽见访夜坐对酌怅然有感四首 其三
323563,次韵安国读荐福壁间何卿二诗怅然有感
1028427,七夕前二日与窥堂庄使君江横观水望霓怅然
292176,月下笛·闻叶汝谐谈西湖访友事，怅然赋此。用张玉田赠仇山村韵
832290,秋思 秋夜小集，听六禾谈曲中近事，怅然怀旧，爰和梦窗孤调，简子端
1149847,和浙西李大夫晚下北固山喜松径成阴怅然怀古偶题临江亭
