432245,游交芦庵僧人老且病出观华秋岳奚铁生西溪诸卷欲访厉太鸿先生墓为时已晚怅然归去赋此赠之
509402,发云中将之宣城至阳和奉敕送敌使出境因复回辕怅然有作
414360,抱老与余别十年矣顷自故国飞经新加坡返耶嘉达馀候之于新嘉坡飞机场但见其乌帽出没众客中匆匆相呼复登机去竟不得把臂一谈怅然写此怀之
368804,鹧鸪天·病中清明，不能省墓，为之怅然
931122,冬暖颇有春意追忆成都昔游怅然有作
515788,腊月望日至南山治装北上梅花盛开独酌花前怅然有作
903403,临江仙 余年三十二岁在甲辰尝画七圈于纸揭之坐右每圈横界作十眼岁涂其一今已过五十有二怅然增感戏题此词
821863,阳春曲 三月初一日夜归，遇旧曲，怅然成咏
545051,王长公两寄余书不值乍次公之江右始得之时公雅慕长生将以八月闭关与尘世绝书来云云怅然奉寄二首 其一
289771,宿张家口，出大境门，至阴山之麓，怅然而返
654970,八月十四风雨之夕病中望舍弟消息不至怅然有怀
744169,不得游西山怅然有作
1156500,得微之到官后书备知通州之事怅然有感因成四章 其三
741545,由十八盘登青柯坪坐莲花峰阯不及登陟怅然有作
538418,妻叔李六丈下第秋时始归赋此为别因怅然也
1099882,偶怀丙午丁未同朝诸公怅然有感壬戌再预经幄先帝犹记小臣为安晚门人
1004269,与子先兄及伯畅甥别投宿明月山客邸怅然有赋 其三
1062132,庚戌岁六月四日至洪城旧庐无复尺椽怅然伤怀用丙午岁迁居诗韵
222874,七夕前二日与窥堂庄使君江横观水望霓怅然
380241,金缕曲·重游城东可羡园，西风戒寒，花事渐减，怅然谱此
80165,梦游山寺焚香煮茗甚适既觉怅然以诗记之
600795,外孙张穆叔从父命远行至今半载杳无消息怅然感怀二首 其一
931261,旧识姜邦杰于亡友韩无咎许近屡寄诗来且以无咎平日倡和见示读之怅然作此诗附卷末
546579,忆以修挐舟饯别至魏湾执手恋恋闻某直指垂至乃发迄今令人怅然偶值清源鸿便辄题二绝寄苏并讯易惟效蔡景明 其一
657269,和司马提学倡和诗韵 来教谓从者云此地故少梅追念旧乐怅然兴怀复和一章昶亦奉和一章以答从者 其四
1248399,暮归闻许文学枉顾怅然有怀
527871,得五清先生消息尚客澧州怅然有怀作诗六首 其一
934110,梦至成都怅然有作二首 其一
408676,十月二十八日枕上闻飞雪有声移时遂止怅然感赋仿欧阳公禁体用东坡聚星堂韵
1058098,翻书见舍弟去年自寿归郓道中诗怅然怀想久不作诗因集句为答用渭城体可歌也 其三
525968,客舍闻李侍御师文至未获晤对怅然有怀
537398,濮阳李明府自新喻再寄予诗兹以觐事驻城外属时禁方严不得出视怅然有怀
1109579,翻书见舍弟去年自寿归郓道中诗怅然怀想久不作诗因集句为答用渭城体可歌也
627124,丁亥仲春余归自岭右暂憩乡园读杜工部秦州杂咏怅然感怀因次其韵 其六
1068818,腊前五日立春天气极暄妍今复雨雹凛凛不休所居梅花方盛开一雨零落殆尽怅然为赋此诗
470638,别莆田陈君彦质追送不及怅然有作五首 其三
623823,完初曾丈以嗜酒患足闭户经年不得一晤怅然奉寄
693944,丁亥仲春余归自岭右暂憩乡园读杜工部秦州杂咏怅然感怀因次其韵
931905,两蜀故人寄余阆中左绵题名石刻来皆二十馀年矣怅然有感
266692,芳草渡·病院冬深，忽闻燕语，怅然有赋。依清真体韵及四声
18168,东墙夜合树去秋为风雨所摧今年花时怅然有感
1128096,与子先兄及伯畅甥别投宿明月山客邸怅然有赋
796839,菩萨蛮 春雨连绵，园花零落，风前独立，怅然久之，谱饯花词四章，并寄丽轩 其二
527872,得五清先生消息尚客澧州怅然有怀作诗六首 其二
627128,丁亥仲春余归自岭右暂憩乡园读杜工部秦州杂咏怅然感怀因次其韵 其十
1124247,与叔骥父子别后怅然怀之三首
330879,列之告别为之怅然小诗送别
1058099,翻书见舍弟去年自寿归郓道中诗怅然怀想久不作诗因集句为答用渭城体可歌也 其四
527873,得五清先生消息尚客澧州怅然有怀作诗六首 其三
79807,山行见三十年前题名怅然有赋
518686,王世赏大参闻荐有作见示颇感近事怅然依韵答之
414498,天均酒次以诗见示事有同感怅然兴怀
820758,三姝媚 园中紫丁香三株，今春特盛，风晨重对，已半残矣。怅然赋此
1241548,黄慎之自闽见访夜坐对酌怅然有感四首 其一
830832,今岁得元初刘京叔归潜志写本自叙著书之时年三十二经涉忧患记忆见闻所居堂曰归潜因以名书仆行年正与相同遭时多故亦有归潜之志遗编触手怅然动怀漫书长句以当跋尾
1211239,董仲达送予至湘阴别后顺风比晚行三百里怅然有怀作二绝付其仆之远送者持归 其二
1049691,被诏还阙过碧落洞观元伯兄留题怅然久之兼成拙诗以纪胜概
919633,十二月二十八夜至此怅然继和
896858,予元丰戊午岁自楚至宋由柘城至福昌年二十有五后十年当元祐二年再过宋都追感存殁怅然有怀
1108049,再过宜兴舟中见芍药数枝忆淮乡此花之盛为之怅然辄成三绝
612076,老友米君梦昔旅食京华结社三载今不远数千里访我隐居话旧论心怅然赋赠
676675,王子元肃有精庐在虞山下去白雀不数里缄书报之不遇返棹怅然寄以长句
1156501,得微之到官后书备知通州之事怅然有感因成四章 其四
750687,夜泊螺山大雨不克谒王子寿丈怅然赋诗
892197,长安道中怅然作三首 其三
547835,寄吴少溪宫录七十 其三十一 南天观追忆许鍊师怅然有作
125103,怅然作·三辅古风烟
627134,丁亥仲春余归自岭右暂憩乡园读杜工部秦州杂咏怅然感怀因次其韵 其十六
697172,王长公两寄余书不值乍次公之江右始得之时公雅慕长生将以八月闭关与尘世绝书来云云怅然奉寄二首
699126,既别田叔归过渊关公署怅然有怀
81169,检旧诗偶见在蜀日江渎池醉归之篇怅然有感
627123,丁亥仲春余归自岭右暂憩乡园读杜工部秦州杂咏怅然感怀因次其韵 其五
683130,乙丑中秋在石镜精舍同士友玩月后二日家兄寄示会饮分韵诸诗览之怅然叹不得与因奉次来韵兼东郑君好义
608581,病起客至言西郊花事已过怅然有作 其一
263344,闻范之仓卒去皖，怅然寄诗二章，即次范之九日宴集诗韵
676604,蔡九逵文徵仲王履约汤子重王履吉诸知己自吴来访欢数日别去怅然增怀赋此奉寄
409782,闻范之仓卒去皖，怅然寄诗二章，即次范之九日宴集诗韵 其二
620221,予为孝廉游南岩数十年往矣通籍后久客长安每思旧胜如隔蓬壶丁卯冬奉命还家辱友人招饮于此见多改观且及结绿先兄欣赏之事怅然不胜今昔之感漫纪一律
98466,怅然怀之·远斋老于文
78160,梦至成都怅然
872635,再过宜兴舟中见芍药数枝忆淮乡此花之盛为之怅然辄成三绝 其一
933257,禹迹寺南有沈氏小园四十年前尝题小阕壁间偶复一到而园已易主刻小阕于石读之怅然
936801,乾道初予自临川归钟陵李德远范周士送别于西津是日宿战平风雨终夕今自临川之高安复以雨中宿战平怅然感怀二首 其二
627120,丁亥仲春余归自岭右暂憩乡园读杜工部秦州杂咏怅然感怀因次其韵 其二
76643,梦至成都怅然有作
423255,游交芦庵僧人老且病出观华秋岳奚铁生西溪诸卷欲访厉太鸿先生墓为时已晚怅然归去赋此赠之 其一
546573,枫桥夜泊梦与房仲诸君欢饮达旦觉而怅然寄此
455841,晚成兄招饮路远卧病不克相从怅然有作
807497,念奴娇  甲寅九日追感京洛旧游怅然成咏
494312,已及首夏遂尔寻春与诸同志游胜泉寺时春花已罢遂观源泉怅然啸歌偶而成韵
527874,得五清先生消息尚客澧州怅然有怀作诗六首 其四
932904,南堂脊记乃已三十年偶读之怅然有感
1112245,长安道中怅然作三首
55662,舟中梦后月明江清怅然有怀
66631,得顾茂俭书及所著离思赋怅然有作
934111,梦至成都怅然有作二首 其二
814234,奄旦处也时朔雪被野人马衣裘满目寒色怅然兴感作怀古四篇 其二
95795,中秋风雨骤作怅然有怀简全真沅陵并寄成父弟
556995,楼中闲望家君报已赴蜀矣即怅然有赋焉
1110030,十一月五日与才仲弟相别于白沙东门之外怅然久之不能自释乃知谢安石作恶之语不为过也因成八诗奉寄可见别后气味亦可并示京洛间亲旧也
271564,浣溪纱·乍归复出，过诗舲，话曩者徐园共游之乐，不胜怅然
644635,乙丑中秋在石镜精舍同士友玩月后二日家兄寄示会饮分韵诸诗览之怅然叹不得与因奉次来韵兼东郑君好义 其三
1070719,庚午春予得罪再贬昌化琼士饯送者皆怅然有不忍别之意严君锡魏介然追路至儋耳兹事当求之古人感叹成古风二百言送行
532533,秋夕庭中怅然有怀吴文济御史时渠将有闽中之行
332144,百字令·朱锡鬯过访不值怅然有寄
80377,南堂脊记乃已三十年偶读之怅然有感
533243,闻海寇入高凉陷属邑怅然有作
627131,丁亥仲春余归自岭右暂憩乡园读杜工部秦州杂咏怅然感怀因次其韵 其十三
627125,丁亥仲春余归自岭右暂憩乡园读杜工部秦州杂咏怅然感怀因次其韵 其七
527875,得五清先生消息尚客澧州怅然有怀作诗六首 其五
509128,壬辰岁午日与林锦衣饮于行台喜雨堂林乘兴为予挥扇面怅然有感书此赠之
830669,乙卯二月予还湘省墓散原亦返峥庐适同轮舟乃彼此不相遇怅然久之抵沪晤散原言发南昌时方意归途邂逅有诗见忆爰和此篇
216263,全椒张公有诗在北山西庵僧者墁之怅然有感
289780,秋日游陶然亭，怅然有感
1156498,得微之到官后书备知通州之事怅然有感因成四章 其一
978878,平都山硖中胜处余思欲一到而不能近得予弟书云今岁仲春尝与外兄孙长文顺流往游焉闻之不胜怅然
689143,得五清先生消息尚客澧州怅然有怀作诗六首
509151,宿戈阳山家将明怅然兼忆李少卿二首 其二
305817,浣溪纱慢·霜腴以此解见示，丹阳车次，春雨乍霁，新月掩映云外，客心怅然
527876,得五清先生消息尚客澧州怅然有怀作诗六首 其六
309240,祝英台近·秋旅搜箧，得故衣，怅然
544104,余从陆至安平镇闻傅伯俊明府先一夕过此怅然有寄
615916,戴公纶彭伯时李烟客三子先归与伍国开有开扶醉夜起送出云路村头怅然赋别
627137,丁亥仲春余归自岭右暂憩乡园读杜工部秦州杂咏怅然感怀因次其韵 其十九
747055,青柯坪下山怅然有作
139211,江朝宗许重阳见过候终日竟不闻车音使人怅然
252422,下乡·怅然出门去
520736,季冬朔旦汝德周学二秀才过访病禁饮不能留别去怅然竟日烛下得句明日寄之
804896,侯氏亦园余祖芸石公曾馆焉，秋日过此怅然志感
499328,蒋其祥订游西山同人促归不及待怅然留别
913576,雪晴窗开展唐诗得一片桃花怅然赋之
973715,与叔骥父子别后怅然怀之三首 其二
491873,承曾子硕自洪归赣道次太和以故人旷伯逵书问见及临别怅然诗以送之
696437,别莆田陈君彦质追送不及怅然有作五首
551889,既别田叔归过渊关公署怅然有怀 其二
782909,将赴辽东约门人沈周颋摄馆事两月余归迟沈已如期去一月矣怅然有作
1211238,董仲达送予至湘阴别后顺风比晚行三百里怅然有怀作二绝付其仆之远送者持归 其一
822587,瑞鹤仙 江城厌旅，再度清明，坐对瓶花，怅然有赋。调夹钟羽一解
580967,宿野趣堂伤余舅之不见怅然有感
627136,丁亥仲春余归自岭右暂憩乡园读杜工部秦州杂咏怅然感怀因次其韵 其十八
474018,得顾茂俭书及所著离思赋怅然有作
339607,偶怀丙午丁未同朝诸公怅然有感壬戌再预经幄先帝犹记小臣为安晚门人
613728,舟次螺江始闻萧伯玉大行奉使还里不及造访怅然有寄
978909,汤子才凌云山用予十四日韵见示且云卫尉顷登清音载酒二亭口占一联清音见江来载酒送江去怅然感之
1208541,闻驾幸开平不获瞻仰怅然有作
889622,得家书报敝居紫丁香盛开怅然有感
1160084,和浙西李大夫晚下北固山喜径松成阴怅然怀古偶题临江亭并浙东元相公所和依本韵
570814,中贵人致牡丹一株颇丽雨中对之怅然停饮因寄仲氏敬美 其二
1088993,荐福观何卿壁间诗对之怅然次前韵
571578,芜湖风阻寻访旧识无有存者是夏张工部奉命槯木亦巳还朝抚时感事不觉怅然偶书二绝与罗少府 其一
765583,满江红 其三 忆故园种竹栽篱，怅然寄内
423574,浣溪纱 乍归复出，过诗舲，话曩者徐园共游之乐，不胜怅然。诗舲以小词相送，率然和之
403282,祝英台近 秋旅搜箧，得故衣，怅然
1042167,得隐直书重阳日登高于三门禹庙怅然恨不参之作一诗以寄
1213411,江东陈伯宣置庄名忠养盖取事亲为大之义览卷怅然
892210,冬夜饮散怅然有感
805539,贺新凉 初夏过陶然亭寻壁间竹素青士箌云旧题半已磨灭矣怅然赋此
946354,送宋国博参议江东分韵得夜字前年上幸学一时同舍今去略尽为之怅然
1078267,九日诸季散处长乐外邑怅然有怀二首 其一
766288,还京乐 丙戍小住都门，匆匆脂辖，怅然有作
832229,绕佛阁 荔湾追凉，经黄诏平别业，感念往年觞咏之盛，怅然回棹。次美成韵
797084,绿意 戊申六月过罗浮，荷雨多池溢，花不透水，怅然拈此解
153553,十月二十八夜至此怅然继和
627130,丁亥仲春余归自岭右暂憩乡园读杜工部秦州杂咏怅然感怀因次其韵 其十二
268473,忆旧游·秋夕津门客馆忆去岁别南中时情事，怅然有作，用清真韵
1246151,黄慎之自闽见访夜坐对酌怅然有感四首 其四
19793,唐昌观玉蕊花折有仙人游怅然成二绝
1078303,余两过湖湘皆以事阻不到南岳今自衡趋潭意谓决可一到又以新讨降步谅之众不果往为之怅然成两绝句 其一
609462,燕京风霾连日春昼阴冥不得跨蹇驴出郭怅然有作 其二
787311,订《中晚唐诗人主客图》既成，怅然有感，题卷末二首 其二
480740,读程原道昆阳诗怅然有怀
1162208,永宁里园亭休沐怅然成咏
1117893,梦至成都怅然有作二首
929207,昔从戎南郑日范西叔为予书小卧屏今三十有八年矣怅然有怀
1160159,晚岁登武陵城顾望水陆怅然有作
487938,久不得子韩粤中消息怅然有怀
537853,海浮子自滇归迂驾过访值余他出怅然因赋此寄怀
834051,玉蝴蝶 蛮江听雨，拥被无眠，追溯欢尘，怅然赋此
790535,畏风足不出户者数日矣，次儿自适园回，携到红梅两枝，怅然有感，插瓶赋之庚午
660612,舣舟蜀山候沈石田晨起闻已过怅然赋此
1079520,十一月五日与才仲弟相别于白沙东门之外怅然久之不能自释乃知谢安石作恶之语不为过也因成八诗奉寄可见别后气味亦可并示京洛间亲旧也 其一
1077986,所寓天宁方丈后有阇提花数株连月盛开玉雪可爱怅然有怀成三绝句寄吴元中 其二
779354,杏花天 同游南谷，云林妹先返，怅然赋此
806980,虞美人 泊舟垂虹桥不及过晤舍妹同纬云弟怅然赋此
139213,见市上有卖海棠者怅然有感
688434,临章楼闻越舸且别怅然二首
644636,乙丑中秋在石镜精舍同士友玩月后二日家兄寄示会饮分韵诸诗览之怅然叹不得与因奉次来韵兼东郑君好义 其四
684185,外孙张穆叔从父命远行至今半载杳无消息怅然感怀二首
666054,莆诸君子邀游木兰宿云庄溪阁因饯余涌江把袂而别怅然兴怀
309281,月下笛·王城归客，追缅夙游，怅然有作
13836,客有自渠州来说常谏议使君故事怅然成咏
677917,苏台至望亭驿人家尽空怅然有作寄从弟纡
20408,山信至说平泉别墅草木滋长地转幽深怅然思归复此作
950821,闻韩正伦检正挂冠感叹故交怅然久之偶成三首 其二
1107920,盘溪之游前一日知几太博行矣同令君梅下清饮不无怅然吾人会合之难再赋绝句
1079522,十一月五日与才仲弟相别于白沙东门之外怅然久之不能自释乃知谢安石作恶之语不为过也因成八诗奉寄可见别后气味亦可并示京洛间亲旧也 其三
348821,怅然有作·一读诗翁寄我篇
748238,雪霁东郊寻梅不得怅然作此
477914,杨仪部君谦纂述之余颇修静业瞻对无由怅然成咏
268481,南浦·倦游思返，还复淹留，忽忽又重九矣。沚老见示近词，怅然属和
56355,庚申秋夜予卧病孤山闲读虎关女郎秋梦诗怅然
279263,大酺·园游不与，怅然有赋
350970,满江红·忆故园种竹栽篱，怅然寄内
733042,访赵锦帆于报国寺解官南归怅然有怀
739100,秋晚由沛至丰车中书所见时经和庵家不得过访怅然忆之
573870,东山公书来问久无书舟中作书怅然有感
1113795,德辉郎君名嘉橘其小字也书来云修嘉辰故事并蒙惠二尊怅然有感二首
51684,临章楼闻越舸且别怅然·乱帆秋影半江楼
274389,阳春曲·三月初一日夜归，遇旧曲，怅然成咏
1155078,东墙夜合树去秋为风雨所摧今年花时怅然有感
1225561,癸酉闰三月十六日仙邑馆所儿子琦入梦怅然不怿后八日自解
892199,长安道中怅然作三首 其一
1172382,山信至说平泉别墅草木滋长地转幽深怅然思归复此作
30839,闻进士许彬罢举归睦州怅然怀寄
796873,金缕曲 重游城东可羡园，西风戒寒，花事渐减，怅然谱此
1058096,翻书见舍弟去年自寿归郓道中诗怅然怀想久不作诗因集句为答用渭城体可歌也 其一
596719,会试回传容灵先物故为之怅然赋此
1163773,唐昌观玉蕊花折有仙人游怅然成二绝 其二
905190,庚戌仲春携小子访别晦翁过亲友江清卿之门其嗣子尚幼不果见次早道经江清卿墓下怅然有怀
1055531,再领玉局昔东坡翰林作诗送戴蒙有玉局他年第几人之句后自岭外归遂领玉局予复官亦得之坡今亡矣怅然有怀
252091,水龙吟·岁暮楼窗倚眺怅然有赋
1005348,三月二十九日立夏喜晴稍有自适意有自旧京来者问钱湖景物又复怅然
708888,六么令  张老四曾事云间周勒卣度曲甚美遇之怅然
1070717,仲兄去岁落一齿书来怅然作诗以宽其意
1077985,所寓天宁方丈后有阇提花数株连月盛开玉雪可爱怅然有怀成三绝句寄吴元中 其一
423517,南浦·倦游思返，还复淹留，忽忽又重九矣。沚老见示近词，怅然属和
498301,贺生文战不利愤懑悲骚托之好内以自发摅竟得疾不起比余再过其居凄凉触目即所最欢昵者亦不复在燕子楼矣因怅然书其壁上 其二
551888,既别田叔归过渊关公署怅然有怀 其一
822541,大酺 园游不与，怅然有赋
163957,与子先足及伯畅甥别投宿明月山客邸怅然有赋
932142,张季长学士自兴元遣人来因询梁益间事怅然有感
1169606,晚景怅然简二三子
550097,燕子矶期于还时登揽归棹北发梦中度过醒已不及泊矣怅然有作
662270,忆在京师与从善郎中雨中倡和颇多今君南徙怅然有怀
601772,庚戌九月将有浙行舟泊穗城怅然有作
627119,丁亥仲春余归自岭右暂憩乡园读杜工部秦州杂咏怅然感怀因次其韵 其一
333356,九日诸季散处长乐外邑怅然有怀
443671,鹧鸪天 春夜不寐怅然有作
83948,病中久癈游览怅然有感
556119,宜兴舟中读徐养斋诗稿因思奉别之久怅然有怀二首 其一
644634,乙丑中秋在石镜精舍同士友玩月后二日家兄寄示会饮分韵诸诗览之怅然叹不得与因奉次来韵兼东郑君好义 其二
1059058,仲孺督烹小团既而非真物也怅然次韵以谢不敏
593491,闻子与入贺不果怅然有怀同敬美作
973403,欲再过子进昆仲舟人绐以迷路既远不能复也怅然怀之
1246149,黄慎之自闽见访夜坐对酌怅然有感四首 其二
1193948,得微之到官后书备知通州之事怅然有感因成四章
929853,乾道初予自临川归钟陵李德远范周士送别于西津是日宿战平风雨终夕今自临川之高安复以雨中宿战平怅然感怀二首 其一
51683,临章楼闻越舸且别怅然
309102,武夷之游以事阻独坐怅然
400582,满庭芳   登西麓，望小湖，看去鸟苍烟，怅然久之。
333643,怅然有怀·终朝兀坐但焚香
262840,高阳台·秋雨连绵，怅然赋此
421654,宿张家口，出大境门，至阴山之麓，怅然而返
470639,别莆田陈君彦质追送不及怅然有作五首 其四
318420,满庭芳·登西麓，望小湖，看去鸟苍烟，怅然久之
800911,大侄书金陵回即走西安怅然念之
599090,平夷驿侯林郡丞不至予出都日郡丞赋诗一章且解所衣貂领赠之约予千滇关相待久不见至怅然留题于壁
308447,绕佛阁·荔湾追凉，经黄诏平别业，感念往年觞咏之盛，怅然回棹
740490,奄旦处也时朔雪被野人马衣裘满目寒色怅然兴感作怀古四篇 其二
510239,何生告还新喻因忆希仁先生平生故人不相见十有六年怅然有作附生它日见之为我道之
934148,累日文符沓至怅然有感三首 其二
597781,起复赴京途闻赵良弼自辽东领郡之顺德寻以母忧奔汝上因取道过其庐访之怅然为别四首 其四
1162135,客有自渠州来说常谏议使君故事怅然成咏
784527,易公仙公申兄弟，暨王兰谷宿盘山天城寺三日，历盘西剑台诸胜而归，未及追陪怅然于怀赋此却寄 其二
762638,遣去里门人还，言被水灾，怅然有作
740489,奄旦处也时朔雪被野人马衣裘满目寒色怅然兴感作怀古四篇 其一
888628,去春劝耕云际移植海棠曾留小诗今岁困于多事欲往不果怅然有怀复和前韵以示主僧
1118260,乾道初予自临川归钟陵李德远范周士送别于西津是日宿战平风雨终夕今自临川之高安复以雨中宿战平怅然感怀二首
1078427,赵正之宠贶和篇褒与过厚适传新命念暌违之有日预深怅然辄次其韵
556054,览任少海吏部庆都留题怅然怀人因次其韵
978854,今年正月二十五日行园见群花尽开怅然追思去年是日去江津县亲戚相送今一岁矣嗟叹不足情见乎辞
934125,检旧诗偶见在蜀日江渎池醉归之篇怅然有感
813600,易公仙公申兄弟，暨王兰谷宿盘山天城寺三日，历盘西剑台诸胜而归，未及追陪怅然于怀赋此却寄
708659,昼夜乐•亡妇遗钗，有火珠一颗。今失所在，怅然赋此
627135,丁亥仲春余归自岭右暂憩乡园读杜工部秦州杂咏怅然感怀因次其韵 其十七
697390,忆以修挐舟饯别至魏湾执手恋恋闻某直指垂至乃发迄今令人怅然偶值清源鸿便辄题二绝寄苏并讯易惟效蔡景明
271580,卜算子·足疾缠绵，欲归不得，怅然于怀，口占小词一阕呈两兄斧正
63626,读程原道昆阳诗怅然有怀
1078304,余两过湖湘皆以事阻不到南岳今自衡趋潭意谓决可一到又以新讨降步谅之众不果往为之怅然成两绝句 其二
495417,春暮，怅然有作
542540,杨郡丞伯寅张别驾威仲寺中饯别周节推尚占之大梁未旋怅然赋此
365241,翻书见舍弟去年自寿归郓道中诗怅然怀想久不作诗因集句为答用渭城体可歌也
784526,易公仙公申兄弟，暨王兰谷宿盘山天城寺三日，历盘西剑台诸胜而归，未及追陪怅然于怀赋此却寄 其一
499803,御史丁公子坚与余为金石交而经岁不面殊抱怏怏甲子冬公重游玉笥留旧馆信宿既去余始自外归为之怅然赋诗写情因录奉寄
1121038,闻韩正伦检正挂冠感叹故交怅然久之偶成三首
208217,临川道中怅然有感因作遣情
832225,新雁过妆楼 得晦闻书，怅然赋答
655857,程庸以种湖所书拙字及鄙句见示怅然有作
1091752,敕局同年相饯是日谢遣婢子春饶者还其家同年大不然之共怅然也
80697,怅然·三十年为一世人
124250,长安道中怅然作
684747,贺生文战不利愤懑悲骚托之好内以自发摅竟得疾不起比余再过其居凄凉触目即所最欢昵者亦不复在燕子楼矣因怅然书其壁上
683909,中贵人致牡丹一株颇丽雨中对之怅然停饮因寄仲氏敬美
598305,再游白云洞何君载酒于云峰崖念白云主人先友何子明已逝旧□读书处□云室石梯□梁屏榻仍在而云堂观音像则新创也怅然有感赋此
1058097,翻书见舍弟去年自寿归郓道中诗怅然怀想久不作诗因集句为答用渭城体可歌也 其二
76936,冬暖颇有春意追忆成都昔游怅然有作
933156,春晚坐睡忽梦泛舟饮酒乐甚既觉怅然有赋
602515,雨后汉江大涨放舟东下怅然赋此
787310,订《中晚唐诗人主客图》既成，怅然有感，题卷末二首 其一
682401,病起客至言西郊花事已过怅然有作
972210,中夜风雨骤作怅然有怀简全真沅陵并寄成父弟
383726,南天观追忆许鍊师怅然有作
470640,别莆田陈君彦质追送不及怅然有作五首 其五
974354,得晴欲过江访梅已忽病作天亦复阴怅然有赋
570957,刘半舫光禄与余倾盖莫逆长安入计竟不得一面怅然有作
730995,金缕曲 三月十七日乃孙补年外祖父仙游之辰，抚今追昔，怅然于怀，爰赋此阕，聊当一哭
1068851,建炎辛亥八月二十六日夜梦舣舟江岸与梅和胜论诗梅出古诗示予极壮丽复为予作汤饼方就席视梅手中器已十裂汤饼淋漓觉而怅然作此篇
