1070969,自象登舟入武仙县境有山耸拔四十丈奇秀异常有道人于此升仙因以得名
212972,送戴汉老·三洞耸奇秀
165734,过铜陵南望一山高出云上奇秀可骇余未尝至江
330810,自象登舟入武仙县境有山耸拔四十丈奇秀异常有道人于此升仙因以得名
498002,无可姨翁韵寄烟霞，嗜耽松石，丁卯春雪中，手植六松于庭，斸自幽崖，选其奇秀，遂使轩窗宛若岩阿院落，居然物外卧游而快之，时座客各陈诗，余亦题赠二首 其二
498001,无可姨翁韵寄烟霞，嗜耽松石，丁卯春雪中，手植六松于庭，斸自幽崖，选其奇秀，遂使轩窗宛若岩阿院落，居然物外卧游而快之，时座客各陈诗，余亦题赠二首 其一
979103,过铜陵南望一山高出云上奇秀可骇余未尝至江南遽曰此九华也问之言是
339856,挽词·天地钟奇秀
197959,江行至内牛庙山特奇秀晚舟檥庙下留诗于壁
907008,江行至黄牛庙山特奇秀晚舣舟庙下留诗于壁
684735,无可姨翁韵寄烟霞，嗜耽松石，丁卯春雪中，手植六松于庭，斸自幽崖，选其奇秀，遂使轩窗宛若岩阿院落，居然物外卧游而快之，时座客各陈诗，余亦题赠二首
949956,浣溪沙 其一 今岁冬温，近腊无雪，而梅殊未放。戏作浣溪沙三叠，以望发奇秀
741628,沅陵道中观夹岸诸山奇秀可喜
737540,泊陈家湾睹山石奇秀迟客舟同登不至日暝独游未穷其胜
