898060,偶摘梅数枝致案上盎中芬然遂开因为作一诗
472206,杨二檀闻人北江二臬副过山中值余他出乃自移二石坐竹下待之少顷余还邹草陵亦至遂开樽相话日尽而别
116848,偶摘梅数枝致案上盎中芬然遂开因为作一诗
957070,知郡安抚以立春日揭所书新安郡榜南楼之上晓雪纷集邦人以为善祥遂开宴以落之辄赋长句一篇以附风谣之末
90352,杂兴六言·一老遂开九秩
803326,岁壬子，偶得一新闻，不必言其姓氏，存厚道也。有三家村某某，共请一先生，恭而且敬，尚何言哉。开读后，适有一顽徒，白字信口流，讹音任意吐。先生正之，不听，遂惩之夏楚，稍示感也。孰意顽徒归家，不惟有肤受之愬，而且有浸润之谮。其悍父奋然曰：敢打吾儿，吾必报之，何不效黄鹤楼故事？遂开琼筵，设伏兵，治刚刀，磨霍霍，必欲杀之而后已。时伊兄苦劝之，触怒伊弟，哭阻之，受伤。后其妻警觉而叱咤之，遂不果，然已声闻籍籍，
682949,五日命舟过游金山寺郡守林君追至遂开宴江天之阁移席观竞渡戏二首
582248,将过梁山柏林漕岭望之云翳因怀昌黎韩子以精诚之至遂开衡山之云韩固不易希然忠诚在我士各有志作一绝以贻山神至于云散山明则事出于偶然者予不敢以自诬也
535192,五日命舟过游金山寺郡守林君追至遂开宴江天之阁移席观竞渡戏二首 其二
535191,五日命舟过游金山寺郡守林君追至遂开宴江天之阁移席观竞渡戏二首 其一
