648250,己酉元夕偕行俭学夔公绪百鍊并携稻秫市中观灯遂过退庵小酌即席赋诗得谁字
950740,设醮太平宫竣事呈偕行诸君二首 其一
950739,设醮太平宫竣事呈偕行诸君二首 其二
274980,和京江相国西郊偕行原韵
1103936,丁酉正月九日省谒家叔洁山居士于郭仙峰下是日仲退亦省其叔四山翁于是偕行洁山既留饭送别乌龙潭上裴回久之绝壁梅花炯然独立如高人招之不来冻泉泠泠下岩窦如瑟筑声相顾绝赏因以春山多胜事分韵约四山父子同赋时四山留外未归也韵以齿次瑞得多字
564866,沃泉邓太守久淹远郡报政喜与予偕行有诗见贶用韵奉答
900181,自乌石渡湘思去岁与朱元晦林择之偕行讲论之乐赋此
515252,八日游双门寺入山观石门及龙潭爱其奇胜赋短歌以畀寺僧时山斗汝耆文真梦吉德吉守道诸宗彦偕行
1083544,郊行探春得梅林攀玩为乐因成诗示偕行
1040191,何推官见招游岳麓以郡中事冗弗克偕行口占二绝以谢 其二
635019,王暖村慧则兄同赴梁王顾观梅之约予拟偕行不果别后有怀
361214,何推官见招游岳麓以郡中事冗弗克偕行口占二绝以谢
672539,上陵至沙河与孔时偕行
1030826,淳熙戊戌将命广东侍亲携孥十一月至安仁留云锦驿一宿而去时晋卿侄偕行后二十三年分阃桂林晋卿主馀干簿复以是月来会于此把盏道旧为之怆然因成一诗示晋卿
686020,郑生偕行自闽远来索赠二首
888999,任漕鲁漕同谒史发运为庐阜之游恨不得偕行因成小诗二首 其二
734723,和京江相国西郊偕行原韵
186690,自乌石渡湘思去岁与朱元晦林择之偕行讲论之
1083511,次韵侄端方过予偕行南村玩月
1098098,壬子立夏日同郡博士黄次夔游江祖太白钓台因成古诗并呈偕行诸丈
1040190,何推官见招游岳麓以郡中事冗弗克偕行口占二绝以谢 其一
994561,庆元己未冬至前二日访林公度至栗山翌日同访吴必大林季亨容之偕行爱其溪山池亭之胜为之赋诗
889000,任漕鲁漕同谒史发运为庐阜之游恨不得偕行因成小诗二首 其一
168379,设醮太平宫竣事呈偕行诸君
545492,沈侍御杨茂才同邀太虚楼燕集余适留滞湖上以薄暮过则宾主偕行矣戏柬一律
553244,侍从亲王之国大梁代祀岳渎陵寝与宋季子奉祠偕行至郑州分道
1244126,同宗弟文炳宴集余以病不能往中和仲简偕行且有登览之乐因事触兴形于咏歌俯仰之间余不能无憾焉聊复次韵
400345,暹罗猜耶山访佛使比丘，游室利佛逝遗址，于黄榛中踟蹰终日，归来有诗。偕行者谢大晋嘉，即用谢客登永嘉绿嶂山诗韵，邀其同作
583366,偶遇省参白辅之辅之与之偕行因出中秋诗倚韵奉答
515193,九日将游古岩寺道中作方君时勉汪君严夫偕行
930551,子遹调官得永平钱监待次甚远寄诗宽其意盖将与之偕行也
606462,郑生偕行自闽远来索赠二首 其二
558742,宿苏桥驿始会鲁内翰偕行
1084986,十月十六日欲与梦龄弟及闻诗闻礼同游兰亭仍约喻叔奇偕行会天气不佳喻亦以疾辞出门而止兀坐终日怀抱殊恶
606461,郑生偕行自闽远来索赠二首 其一
1044817,自扬州与中甫才翁偕行
268717,赴港海道中·途长日暮子偕行
1121050,设醮太平宫竣事呈偕行诸君二首
1123360,何推官见招游岳麓以郡中事冗弗克偕行口占二绝以谢
849816,东归同年三山王簿宾之赵户立父连簿仁父黄上舍偕行分道买樽酌别
139088,任漕鲁漕同谒史发运为庐阜之游恨不得偕行因
1111665,任漕鲁漕同谒史发运为庐阜之游恨不得偕行因成小诗二首
387407,上陵至沙河与孔时偕行
