1085995,游东坡十一绝 其二
955879,李次山自画两图其一泛舟湖山之下小女奴坐船头吹笛其一跨驴渡小桥入深谷各题一绝 其二
966363,刘景仁画墨梅扇上又画梅影于扇阴求诗各题一绝 其二
679784,延生来谒因善篆画各赠一绝 其二
413169,龙泉观唐梅宋柏各一绝 其二
930263,醉中信笔作四绝句既成惧观者不知野人本心也复作一绝 其二
1071154,客惠予早鸣晚鸣二鸡各赋一绝 其二 晚鸣
633068,大翁携来诸物俱典尽各赋一绝 其二 画
872675,薄暮游潘登仕园园有堂三间榜曰一枝盖湖公枢密两取庄周郤诜之语既以嘉潘亦以勉潘之二子因用其意各赋一绝 其二
1036795,园丁折花七品各赋一绝 其二 水精毬
872318,题四皓对奕瀹茶图各一绝 其二
429723,陈几士以美人画四帧乞题各系一绝 其二
827330,教师节，本校开五周纪念会有京剧六出各成一绝 其二 卖黄马
875439,画笥有二粉头各题一绝 其二
923023,次韵阳孝本游翟家湾书院二首又一绝 其二
998628,次韵王待制游东坡留题十一绝 其二
952523,天台邵明府履善遗牡丹各赋一绝 其二
907420,仁实分柑仲躬饷碧泉各赋一绝 其二
872243,术有号莘野钓滨者求诗各与一绝 其二
518862,桂林杂题十一绝 其二 上滩
