1242631,桃花园招兀颜廉访使饮
594905,送徐廉访赴蜀右辖
196494,上严廉访·大哉伊洛传
1212070,题进士索士岩诗卷士岩与余同榜又同为燕南官由翰林编修为御史台掾兼经筵检讨除为燕南廉访经历
105910,呈阎子静廉访翰学
771899,呈台澎道徐树人廉访四首 其三
365941,齐天乐·偕蔼如廉访游螺墩，和壁上全椒金氏题
196497,上严廉访·七闽天南陬
544526,寄赠廉访梅公 其一
1141132,上张廉访 其三
545794,李本宁廉访入武林以手书新历饷余溪堂却寄七言八律 其三
505037,送王公中丞之山南廉访三首 其二
1141173,上严廉访十首 其七
544083,送徐廉访之虔州
697114,寄赠廉访梅公
1213737,京兆廉访使赵彦泽赠椰瓢稯扇
760229,是日之客王方伯外，有蒋亦贌廉访、潘左阶观察、夏用卿殿撰，而主人则丁伯厚侍讲、吴玉臣编修、汪莘伯广文及予也，十叠前韵
1222789,送陈都事云南铨选兼简李廉访
185289,送周宣差除陕西廉访佥事
760513,次韵答俞君实廉访 其三
1003259,燕山亭  杨廉访生日
196483,上张廉访·道傍竹马彩旌旗
549755,桐江晤徐献和廉访使
1227798,题鲜于伯机与仇廉访帖
771900,呈台澎道徐树人廉访四首 其四
545793,李本宁廉访入武林以手书新历饷余溪堂却寄七言八律 其二
545895,送张大参知睿父擢江右廉访四律 其三
1032270,癸巳七月送姚廉访移司金陵二首
682315,送王公中丞之山南廉访三首
760181,将之岭东劝学，沈涛园廉访以长句见送，次韵奉答，兼柬岑云阶、张坚白
226180,癸巳七月送姚廉访移司金陵
551142,陈廉访先生七十初度
1135053,呈阎子静廉访翰学二首 其一
545797,李本宁廉访入武林以手书新历饷余溪堂却寄七言八律 其六
697258,贺李廉访本宁初度二首
1139061,送周宣差除陕西廉访佥事
55818,送高汝谦廉访之蜀
600199,送陈廉访年丈入觐
196491,上严廉访·古人重民教
202949,上廉访分司官
545792,李本宁廉访入武林以手书新历饷余溪堂却寄七言八律 其一
1234286,送阎子静廉访浙西
1232807,嘲廉访司官
811425,次韵答俞君实廉访
1233692,上廉访司
196489,上严廉访·煌煌五星聚
1184502,言志献浙东廉访辞召
760514,次韵答俞君实廉访 其四
544620,李本宁廉访以武侯庙八律见贻倚赋排律四首 其三
1141172,上严廉访十首 其八
545795,李本宁廉访入武林以手书新历饷余溪堂却寄七言八律 其四
1211972,题淮东王廉访清凉亭
196492,上严廉访·因思传记学
707172,仿昭代诸家体三十八首 十九 李廉访攀龙 登眺
764873,百字令 舟出吴门沈书森太守玮宝招同潘玉泉廉访曾玮钱芝门太守恩棨宴集桃花坞即言别
750349,读冯鲁川廉访微尚斋诗集书后
1207823,寄福建杜廉访使君
544527,寄赠廉访梅公 其二
196485,上严廉访·斯文迓续交
1208072,奉同廉访使君洎寮友游爱同寺
1208528,仇云轩训其子彦中廉访三绝句其孙今御史公度持以求诗
1141179,上严廉访十首 其一
545894,送张大参知睿父擢江右廉访四律 其二
1141211,寄张廉访
771897,呈台澎道徐树人廉访四首 其一
196488,上严廉访·汉兴历数世
1229939,戏赠李廉访参道
1234294,春日送廉访监司赴都
752246,题张少伊廉访剑女图
543545,六公篇 其六 李廉访于鳞
1217633,寄浙西廉访托克托使君
1135052,呈阎子静廉访翰学二首 其二
744667,闻雁呈刘眉生廉访
750068,祈昆嵛山得雨樵野廉访以诗见赠步韵和之
1141133,上张廉访 其二
1006834,蝶恋花 和王廉访
1207819,送答里麻廉访使
1063742,御手委廉访守贰监勘钊庆裕二十三日复收入禁将入狱忧无人供饭有银一两钱六百以付来胜甫胜甫曰此止可办半月过此如何余默计曰有官饭耳
1229916,送傅扩斋廉访秩满归长安
1216359,儒有萨氏子者家无田囊无储始以进士入官为京口录事长行南台辟为掾继而御史台奏为燕廉访架阁官岁馀迁知闽海廉访事又岁馀诏进河北廉访经历皆奉其母以行其禄养也后至元三年八月望舟泊延平津上是夕星河粲然天无翳云月色如白日溪潺潺如乐奏四山环抱如拱如立如侍左右如奔走执事者萨子奉母船上与其妇具酒殽盘馔奉觞继而若妹妹之婿若仆若婢次而进和而不亵谨而怡怡月光荡酒而溪韵杂语笑母叹息舟人醉歌亦相与鼓枻作南歌为乐今夕何夕不知其异乡
1216359,儒有萨氏子者家无田囊无储始以进士入官为京口录事长行南台辟为掾继而御史台奏为燕廉访架阁官岁馀迁知闽海廉访事又岁馀诏进河北廉访经历皆奉其母以行其禄养也后至元三年八月望舟泊延平津上是夕星河粲然天无翳云月色如白日溪潺潺如乐奏四山环抱如拱如立如侍左右如奔走执事者萨子奉母船上与其妇具酒殽盘馔奉觞继而若妹妹之婿若仆若婢次而进和而不亵谨而怡怡月光荡酒而溪韵杂语笑母叹息舟人醉歌亦相与鼓枻作南歌为乐今夕何夕不知其异乡
1216359,儒有萨氏子者家无田囊无储始以进士入官为京口录事长行南台辟为掾继而御史台奏为燕廉访架阁官岁馀迁知闽海廉访事又岁馀诏进河北廉访经历皆奉其母以行其禄养也后至元三年八月望舟泊延平津上是夕星河粲然天无翳云月色如白日溪潺潺如乐奏四山环抱如拱如立如侍左右如奔走执事者萨子奉母船上与其妇具酒殽盘馔奉觞继而若妹妹之婿若仆若婢次而进和而不亵谨而怡怡月光荡酒而溪韵杂语笑母叹息舟人醉歌亦相与鼓枻作南歌为乐今夕何夕不知其异乡
538548,赠别俞丈汝成迁楚廉访
545637,贺李廉访本宁初度二首 其一
1229479,简畅廉访
1229472,送陈都事使云南兼寄李仲渊廉访
195481,读福建谦廉访辅大使遗事
1141174,上严廉访十首 其六
107596,前参政浙西廉访徐子方得代送别三十韵
196486,上严廉访·南方尚秉礼
545796,李本宁廉访入武林以手书新历饷余溪堂却寄七言八律 其五
1061058,送赵廉访
1141851,送黄易岩访商廉访
778227,水龙吟·立冬后六日秋雨如织，秦澹如廉访招同郭意城京卿应敏斋方伯金梅生都转薛季怀钱子奇两司马小集园居，因成此解
764902,水调歌头 皖江阻雨日与朱久香学使兰何小宋方伯璟吴竹庄廉访坤修诗筒往来自题酬唱诗后
772190,南征八咏 其五 初三日，全军入彰化城，呈丁述庵廉访、周子玉主政
1135733,前参政浙西廉访徐子方得代送别三十韵
749282,孙琴西廉访次唐端夫东坡生日诗韵追念湘乡师相属和奉呈并怀钱子密
1207878,望瀛海一首送危太朴之四明兼简廉访邓使君翰林袁侍讲
38684,言志献浙东廉访辞召
1141171,上严廉访十首 其九
505036,送王公中丞之山南廉访三首 其一
544621,李本宁廉访以武侯庙八律见贻倚赋排律四首 其四
545799,李本宁廉访入武林以手书新历饷余溪堂却寄七言八律 其八
545896,送张大参知睿父擢江右廉访四律 其四
544710,易侍御苏别驾蔡廉访携酒清源大雄阁饯别得才字
1141134,上张廉访 其一
196487,上张廉访·荒山十室九无人
771898,呈台澎道徐树人廉访四首 其二
1236242,寄浙西张廉访二首
545798,李本宁廉访入武林以手书新历饷余溪堂却寄七言八律 其七
814404,呈台澎道徐树人廉访四首
1143903,呈阎子静廉访翰学二首
549757,寄谢李廉访题仁文书院
826682,水龙吟·题平湖朱竹石廉访师遗照，用郑叔问韵
544619,李本宁廉访以武侯庙八律见贻倚赋排律四首 其二
544618,李本宁廉访以武侯庙八律见贻倚赋排律四首 其一
1234315,送史总管廉访江东
760511,次韵答俞君实廉访 其一
545893,送张大参知睿父擢江右廉访四律 其一
752907,酬方子箴廉访赠文序
196490,上严廉访·春秋得忠臣
697298,送张大参知睿父擢江右廉访四律
1144722,上严廉访十首
1230201,赠臧鲁山廉访
379851,送黄易岩访商廉访
752400,题冯鲁川廉访所藏米芾芜湖县学记为武养斋大令作
103647,辞荐呈余廉访
652386,送高汝谦廉访之蜀
196484,上张廉访·书生久叹三纲绝
1007717,辞荐呈余廉访
1141175,上严廉访十首 其五
1141178,上严廉访十首 其二
1234367,送山东廉访照磨于思容
545638,贺李廉访本宁初度二首 其二
697453,李本宁廉访以武侯庙八律见贻倚赋排律四首
1144720,上张廉访
747207,和金眉生廉访江上寄怀
697280,李本宁廉访入武林以手书新历饷余溪堂却寄七言八律
196493,上严廉访·四海文公书
516769,寄奉按察司廉访使
296328,水龙吟·题平湖朱竹石廉访师遗照，用郑叔问韵
1204604,满江红 送郑鹏南经历赴河东廉访幕
1140877,上廉访分司官
505038,送王公中丞之山南廉访三首 其三
384981,题廉访李海帆先生《登万年寺望峨眉积雪图》
1230824,寄浙西张廉访二首 其二
1141170,上严廉访十首 其十
760246,次韵赠亦璞廉访
1141672,读福建廉访辅大使遗事
1141176,上严廉访十首 其四
749462,登章江门城楼呈江岷樵廉访
85453,次韵赠亦璞廉访
760512,次韵答俞君实廉访 其二
766548,齐天乐 偕蔼如廉访游螺墩，和壁上全椒金氏题
1230823,寄浙西张廉访二首 其一
1207883,七月一日，飓风后，奉和廉访使
707174,仿昭代诸家体三十八首 二十一 高廉访叔嗣 宦况
1141177,上严廉访十首 其三
