1219193,徐孟达别墅冬日海棠
644977,挽徐孟义
1205787,买陂塘 赠徐孟祥用梦庵先生韵
570388,徐孟章索诗为赠走笔得三绝句 其三
568953,赠无住道人徐孟孺
207681,惊蛰后雪访徐孟坚不遇坐待甚久
504527,题徐孟玑爱日堂
504413,徐孟玑斗室
553799,题凝碧书房为江阴徐孟熙赋
690988,徐孟孺招游新筑还集景文堂
628770,徐孟孺招游新筑还集景文堂 其一
541332,题徐孟晦绿阴草堂
995129,沁园春 其七 送徐孟坚秩满还朝
577368,过临清闻教谕徐孟恕已故诗以悼之
748708,寄徐孟卿观察时返扬州
504637,期徐孟玑不至
1225670,白头母次徐孟岳韵
385550,徐孟孺陈村图
683818,徐孟章索诗为赠走笔得三绝句
543609,余在娄江日孙齐之徐孟孺同日先后过访余以行迫不及报谢追忆二君辄成短歌
733576,与郝雪海徐孟枢同事武闱赋赠
1239776,宿王判簿宅送徐孟岳
628771,徐孟孺招游新筑还集景文堂 其二
569798,送徐孟孺游北雍且应秋试
504608,徐孟玑送东阳酒
621085,都门三月三日李灌溪老师招同顾端木陆起顽徐孟博简伯葵集双河庵即席赠起顽予将南还
569787,汪伯玉司马同淹佳二仲徐孟孺胡元瑞过我弇园而张司马肖甫亦至
990286,惊蛰后雪访徐孟坚不遇坐待甚久
53259,宿王判簿宅送徐孟岳
489799,白头母歌次韵徐孟岳
265525,寄徐孟卿观察时返扬州
985284,卜算子 其二 二月晦，偕徐孟坚、滕审言、李季功游裴公亭作
570386,徐孟章索诗为赠走笔得三绝句 其一
570387,徐孟章索诗为赠走笔得三绝句 其二
