108852,银城旧县
1158847,送荀八过山阴旧县兼寄剡中诸官
503865,过彭泽旧县
799360,旧县送吴伯扬茂才还白下
950866,排湾遇风对岸即彭泽旧县二首 其二
1123766,旧县道中二首
740185,中元旧县驿夜歌 其二
677019,宿东阿旧县同张宗晓张伯美小饮村西梨树下作
1220601,大驾南归至龙虎台迎候者皆于昌平胄监岁馆旧县何氏至正九年八月监丞吴当独来馆人持祭酒司业旧题索赋 其一
492570,至东阿已迁谷城旧县水潦之馀民物萧条可感
740184,中元旧县驿夜歌 其一
862990,题杨道人庵庵基旧县邑有废井存
1235744,大驾南归至龙虎台迎候者皆于昌平胄监岁馆旧县何氏至正九年八月监丞吴当独来馆人持祭酒司业旧题索赋
505211,过盱眙旧县怀南涧公
224694,题彭泽旧县锹梁公祠
621911,十四夜泊繁昌旧县镇
1211562,题旧县驿
810456,中元旧县驿夜歌
903756,长乐旧县
950867,排湾遇风对岸即彭泽旧县二首 其一
972323,旧县道中二首 其一
565986,溧阳旧县桥转至深溪一首
746281,自上杭旧县乡至永安湖口司无在非山山密而促登顿甚劳途中书此遣怀
1220602,大驾南归至龙虎台迎候者皆于昌平胄监岁馆旧县何氏至正九年八月监丞吴当独来馆人持祭酒司业旧题索赋 其二
168332,排湾遇风对岸即彭泽旧县
972322,旧县道中二首 其二
1121020,排湾遇风对岸即彭泽旧县二首
278026,旧县送吴伯扬茂才还白下
793730,舟发旧县雨泊复行
168768,行次旧县寄立之
1248699,旧县
438192,宿旧县四更而归道中摭所见作行路难
108854,长乐旧县
903757,银城旧县
279817,舟发旧县雨泊复行
928195,盈川旧县
672751,旧县驿前人家
4114,送荀八过山阴旧县兼寄剡中诸官
1136793,题彭泽旧县狄梁公祠
939770,行次旧县寄立之
173592,题杨道人庵庵基旧县邑有废井存
261201,宿旧县四更而归道中摭所见作行路难
