1128073,重阳后一日亲友会饮于沧洲以初九未成旬重阳即此辰探韵得初未二字
1004199,重阳后一日亲友会饮于沧洲以初九未成旬重阳即此辰探韵得初未二字 其二
962479,步自玉局会饮于判院涂丈廨舍正得日字
142411,上元后漕幕同僚二十八人会饮於西湖登千佛阁
553175,三月四日会饮于方德贞氏以上巳寒食清明比合于两日间要予赋诗成二十韵
214245,既别羊王二君与同官会饮于城南因成一篇追寄
552937,三月廿四日会饮于姚先生宗文家时在座者以斋黄先生文竹夏先生野亭沈先生仲良陈先生列坐以齿行酒侑食仰独山之高俯长淮之深燕笑一日之间有足乐者黄先生起论山川形胜因及曾杨之学赋诗一挥而就老成特达其何可及耶因次韵于后纪胜集云
859473,既别羊王二君与同官会饮于城南因成一篇追寄
1004198,重阳后一日亲友会饮于沧洲以初九未成旬重阳即此辰探韵得初未二字 其一
1038246,清明后同秦帅端明会饮于李氏园池偶作
1082915,良臣会饮于仙庄话次颇闻俗子讥诃次前韵自解兼呈国镇
320829,清明后同秦帅端明会饮于李氏园池偶作
163389,重阳后一日亲友会饮於沧洲以初九未成旬重阳
856224,上元后漕幕同僚二十八人会饮于西湖登千佛阁运干赵渔樵希圣以坡诗七言绝句分韵得陌字
508560,十六日与学士钱公亚卿章公会饮于崔都阃宅赋此以谢
229976,步自玉局会饮于判院涂丈廨舍正得日字
