870074,和昌言官舍十题 其二 薏苡
1026277,再和昌言喜雪 其一
133772,昌言见督诗债戏绝句
869204,昌言谪官符离有病鹤折翼舟载以行及还修注始平公以诗问之命光同赋二首 其二
134265,寓泊郑圃寄献昌言舍人
103659,赋石昌言家五题其一括苍石屏
531300,别周昌言黄孟至
104197,和石昌言以蜀牋南牋答松管之什
870073,和昌言官舍十题 其五 蜀葵
992302,依韵和石昌言学士求鼠须笔之什鼠须鼠尾者前遗君谟今以松管代赠
921564,和张昌言喜雨
869571,和潞公与昌言正叔游独乐园徘徊久之主人不至
133991,送昌言宿州
991333,送石昌言学士
102327,次韵张昌言给事省宿
1107637,送昌言舍人得告还蜀三首
990679,和石昌言学士官舍十题 其三 薏苡
1026369,和昌言谒见景仁所居话及洛事
993306,赋石昌言家五题 其二 白石寒树屏
870029,和梅圣俞咏昌言五物 括苍石屏
870030,和梅圣俞咏昌言五物 淡树石屏
1026370,和昌言喜雪
904962,念奴娇 符昌言写寄朱胡梅词，酬唱语皆不凡，因次其韵
993309,赋石昌言家五题 其四 怀素草书
1038275,家园花开与陈大师饮茶同赏呈伯寿正叔昌言
1026936,赠昌言太中
134499,和潞公与昌言正步游独乐园徘徊久之主人不至
921550,次韵张昌言给事省宿
857809,和石昌言舍人酬王景彝学士雪霁有怀
1031383,送石昌言知宿州
923912,次韵张昌言给事省中直宿
870069,和昌言官舍十题 其三 石兰
1126495,和石昌言学士官舍十题 病竹
1026443,送石昌言归蜀
870071,和昌言官舍十题 其十 病竹
320724,家园花开与陈大师饮茶同赏呈伯寿正叔昌言
990676,和石昌言学士官舍十题 其九 甘菊
133776,昌言谪官符离有病鹤折翼舟载以行及还修注始
499759,送孙昌言之官广东
869696,送昌言舍人得告还蜀三首 其三
921575,次韵张昌言喜雨
133835,子高有徐浩诗碑昌言借摹其文甫及数本石有微
993307,赋石昌言家五题 其三 白鹘屏事于景仁
870072,和昌言官舍十题 其六 畦蔬
992421,和石昌言学士官舍十题 其二 石榴花
869202,昌言有咏石发诗三章模写精楷殆难复加仆虽未睹兹物而已若识之久者辄复强为三诗以继其后非敢庶几肩差适足为前诗之舆台耳 其三
1126526,赋石昌言家五题 括苍石屏
991691,和石昌言求牡丹栽
103766,赋石昌言家五题其五蜀虎图
103956,韩子华访石昌言不遇石有诗韩邀和答
103098,依韵和石昌言学士求鼠须笔之什鼠须鼠尾者前
626183,秋夜达生适生克蒙克慎昌言斐廷诸昆弟赏月得月字
870070,和昌言官舍十题 其一 石榴花
202981,送石昌言知宿州
867776,武陵春 戴昌言家姬供春盘
489602,题陈昌言水月斋梅影图
869697,送昌言舍人得告还蜀三首 其二
869582,奉和始平公喜闻昌言修注
653819,和徐学士琼送危昌言诗大朴之孙也
928154,访余昌言不遇留题
869699,送昌言知宿州
992688,哀石昌言舍人 其一
992423,和石昌言学士官舍十题 其六 葵花
992799,送石昌言舍人使匈奴
1042501,丙申闰月领扬州与京师诸公别戊戌十一月受诏还阁首尾仅三年尔然原叔伯庸隐甫子奇公南清卿之翰昌言八人者皆已徂谢感之怆然作七言寄滑州正臣密学给事
867796,青玉案 其三 为戴昌言歌姬作
160285,和昌言太中
151417,访余昌言不遇留题
992424,和石昌言学士官舍十题 其七 蔬畦
134059,奉和始平公喜闻昌言修注
1246259,嘉兴寄王昌言学正
1041452,送石昌言知宿州
993305,赋石昌言家五题 其一 括苍石屏
134658,送昌言舍人得告蜀
103768,赋石昌言家五题其四怀素草书
1037897,哀石昌言舍人 其三
869205,昌言谪官符离有病鹤折翼舟载以行及还修注始平公以诗问之命光同赋二首 其一
869811,寓泊郑圃寄献昌言舍人
869364,子高有徐浩诗碑昌言借摹其文甫及数本石有微衅惧而归之子高答简有碎珊瑚之戏昌言以诗赠子高同舍皆和
869364,子高有徐浩诗碑昌言借摹其文甫及数本石有微衅惧而归之子高答简有碎珊瑚之戏昌言以诗赠子高同舍皆和
103454,哀石昌言舍人
991607,韩子华吴长文石昌言三舍人见访
869550,和昌言官舍十题 其四 萱草
575282,为许昌言员外题画
1107707,昌言有咏石发诗三章模写精楷殆难复加仆虽未睹兹物而已若识之久者辄复强为三诗以继其后非敢庶几肩差适足为前诗之舆台耳
996043,次韵张昌言给事喜雨
992798,送石昌言舍人还蜀拜扫
103024,赋石昌言家五题其三白鹘屏
1107740,和昌言官舍十题 石榴花
104519,送石昌言舍人还蜀拜扫
160286,和昌言喜雪
1102446,见礼部尚书谢公昌言
1107713,昌言谪官符离有病鹤折翼舟载以行及还修注始平公以诗问之命光同赋二首
113481,次韵张昌言给事喜雨
869203,昌言有咏石发诗三章模写精楷殆难复加仆虽未睹兹物而已若识之久者辄复强为三诗以继其后非敢庶几肩差适足为前诗之舆台耳 其二
1026368,和昌言太中
118119,次韵张昌言给事省中直宿
990674,和石昌言学士官舍十题 其八 水红
160283,和昌言谒见景仁民居话及洛事
990673,和石昌言以蜀笺南笺答松管之什
870067,和昌言官舍十题 其九 兰
201627,和石昌言舍入酬王景彝学士雪霁有怀
993308,赋石昌言家五题 其五 蜀虎图
1042121,元日发古北口寄禹玉直孺昌言三阁老
366771,元日发古北口寄禹玉直孺昌言三阁老
987342,近者昌言多出诸贤之后有感一首
104520,送石昌言舍人使匈奴
991161,和宋次道奠石昌言舍人
514482,送翰林检讨方昌言考绩还南京
869201,昌言有咏石发诗三章模写精楷殆难复加仆虽未睹兹物而已若识之久者辄复强为三诗以继其后非敢庶几肩差适足为前诗之舆台耳 其一
160030,再和昌言喜雪
103764,赋石昌言家五题其二白石寒树屏
104518,送石昌言学士
142169,追和东坡老昌言喜雨呈同官
856123,追和东坡张昌言喜雨呈同官
990675,和石昌言学士官舍十题 其十 兰
997781,送梅昌言出镇太原
993319,韩子华访石昌言不遇石有诗韩邀和答
870068,和昌言官舍十题 其八 甘菊
238558,近者昌言多出诸贤之后有感
870066,和昌言官舍十题 其七 水红
1131029,再和昌言喜雪
1049369,谢夔守贾昌言礼宾
103277,和石昌言求牡丹栽
1037896,哀石昌言舍人 其二
869968,石昌言学士宰中牟日为诗见寄久未之答今冬罢武成幕来京师此诗谢之
870031,和梅圣俞咏昌言五物 缚虎图
870028,和梅圣俞咏昌言五物 怀素书
102306,和张昌言喜雨
869200,昌言见督诗债戏呈绝句
990677,和石昌言学士官舍十题 其四 石兰
992422,和石昌言学士官舍十题 其一 病竹
133713,答昌言求薯蓣苗
134686,石昌言学士宰中牟日为诗见寄久未之答今冬罢
870027,和梅圣俞咏昌言五物 白鹘图
104254,和宋次道奠石昌言舍人
870226,答昌言求薯蓣苗
574871,送钱昌言赴顺宁经府
1026276,再和昌言喜雪 其二
102297,次韵张昌言喜雨
990678,和石昌言学士官舍十题 其五 萱草
160543,送石昌言归蜀
1126471,哀石昌言舍人
160644,赠昌言太中
869698,送昌言舍人得告还蜀三首 其一
