733677,董岐卿侍读参莫经略军事经略卒于军独获免归朝诗以慰之
647859,寄略道权上人
214259,寄吴冲卿·平生身事略相同
997172,晚泊长沙示秦处度范元实用寄明略和父韵五首 其二
636630,元旦有怀姚明府时略地海上 其一
216482,胡笳·身执略兮入西关
765670,金缕曲 其九 题《南汇朱烈妇行略》后
158492,依韵奉和经略司徒侍中上巳会兴庆池
869608,宣徽使河东经略使郑文肃公挽歌 其一
544583,大中丞万公伯修以出塞百咏湟中经略诸牍见贻卒业寄怀十六韵时万公复有塞上之行
979534,复用前韵答唐公唐公有一日纸贵传都城之句且讼其不知我也并呈鲁直成季明略
709006,摸鱼儿  勉宏略叠前韵
819535,早朝诗和略园相国
964714,和经略焕章朱公千叶白梅诗
155743,题建德驿用经略张舍人壁间韵
918099,送陈经略二首 其一
416518,天香   海仙花略似水仙花，具五色幽香，清艳绝伦。洵名芳也，倚此赋之
527378,城略阳
1038274,次韵秦帅经略吕通议过洛少留
1127022,以酒渴爱江清作五小诗寄廖明略学士兼简初和父主簿
1038252,驾经略太尉相公移镇太原 其二
893222,和延州经略庞龙图八咏 其四 柳湖
980403,谨次知府经略待制韵
268926,新春·领略春光好
760224,前诗于彭及楼事殊略，为五、六叠韵申其意焉 其一
219882,公退·缺然资略每区区
156652,撼庭竹·绰略青梅弄春色
80667,山亭·门开度略彴
229167,和潘经略广州峡山
320611,经略大观文相公寄示东田别后一篇谨次元韵
411897,论诗 杂阅古今人诗偶有所见辄成一绝计约十首今只存其四略见昔年读诗眼力也 其二
1112917,敬谢经略秘阁馀甘汤
78994,有怀独孤景略
418328,癸巳初秋偕同丛碧慧素孝同元白宏略雨中游劳山自北九水至鱼鳞瀑途中书所见八首 其三
113725,晚泊长沙示秦处度范元实用寄明略和父韵
996403,以酒渴爱江清作五小诗寄廖明略学士兼简初和父主簿 其三
290849,祁县鲁村清光绪庚子余避拳匪之乱曾宿此村人家其屋在高崖上马上仰视约略可辨云
931520,有怀独孤景略
431114,希腊先哲柏拉图有心灵不朽之论，略依其旨，率成二章奉题雨僧兄诗集 其一
509038,图韩范二公经略西夏事迹于正心堂之壁各系以诗著志也 其一
366796,西湖再开呈张经略
148740,谢广东经略潘直阁间分贶李济墨
961222,双桃寄巩经略三首 其二
904997,庆桂帅经略二首 其一
999794,依韵奉和经略司徒侍中过湫马上始见终南
34519,贺容府韦中丞大府贤兄新除黔南经略
191593,上巳恐可回舟略访子长园亭然未敢为宿诺
97673,山行七绝·雨势崩腾略未休
320911,次韵秦帅经略吕通议过洛少留
68979,石湖寺·略彴江烟外
230923,重阳雪·一介蹉跎略叙陈
376179,状元袁府判作诗赠王司理其略云简川号工诗只今在市廛试呼一问之参寥师孰贤王索答酬以四十字
88634,孙伯符·霸略谁堪敌伯符
944967,四月三日与家人小酌转官毬花因成八句略为花吐气也
1038249,经略大观文相公寄示东田别后一篇谨次元韵
144135,劝农呈丘帅·南楼健目略江拜
355857,新作纸屏隆师为作山水笔墨略到而远意有馀戏题此句末句盖取所谓柴门鸟雀噪游子千里至也
175413,庆桂帅经略·江汉浮浮炳地灵
488952,游尊胜寺简略师
834212,梦游仙 其一 白太傅尝以此调追忆吴宫钱塘之胜。余则榕城倦旅，即景成咏，以兹区替吴越，岂但儗不于伦，然幸为吾辈所经，岂可使地灵终閟，平生游寓，虽僻陋而未敢忘，约略存之，亦小人怀土之过也
79922,入秋游山赋诗略无阙日戏作五字七首识之以野
900831,运使徐中奉寻李隐者于本部因临访上清遂得煮茶款话至夜分乃散明目悦耳信有瑰伟崇高变通之论山川之秀亦有增明日分袂时宣和五年其略于是篇也
1064777,了翁谪廉欲置华严托余将来以六偈见寄其略曰杖头多少闲田地挑取华严入岭来次韵寄之 其五
298184,台城路·题文略溪山红叶图
1004678,用朱经略韵
65859,山中书怀·谷幽略似百花潭
390108,题滕县赵宰祠堂辛酉春赵有书遗余谭灭奴方略征播州以勤死
1016422,和潘经略广州峡山五首 其一
150847,略放二·归早开迟两寂寥
870106,奉和经略庞龙图延州南城八咏 其四 飞盖园
922637,数日前，梦人示余一卷文字，大略若谕马者，用「吃蹶」两字，梦中甚赏之，觉而忘其馀，戏作数语足之
792545,甲寅四月，偶赴琴城，晤西京吾兄，欢谈竟日，阔别五六年，精神如昨，出先德柳村图属题。柳村都兄之尊人，弟之世长也，弟即不文，就少年所闻见者而略叙之，虽不足概平生，而落落大端已在，于是赋五古一章，所以纪实也，质之吾兄当乎否乎
151091,使北·略无险阻蔽皇居
83067,夜归偶怀故人独孤景略
465831,寄怀贺文略学长
819829,阅两浙輶轩录载绍兴张岱事岱字宗子累世通显服食豪侈家蓄梨园数部日与诸胜流度曲徵歌及间以古学挑之则自四部七略以至唐宋说家荟萃琐屑之书靡不赅悉尝自谓少壮秾华恍如梦境耳因有感于李猛庵丈之为人率赋一律寄赠
333324,元结尝经略容管王守作次山堂以思其人为赋此诗
934951,入秋游山赋诗略无阙日戏作五字七首识之以野店山桥送马蹄为韵 其三
327238,次知府·志士怀韬略
796624,多丽 栖香旧阁久成废苑，残岁略加修葺中，扆侄有词题壁，予亦制此
161199,归途叹·孙吴摅将略
760225,前诗于彭及楼事殊略，为五、六叠韵申其意焉 其二
400258,凤栖梧 为贺文略题画
290287,读史·远略不可勤
325671,凯旋诗·扫穴传方略
264676,空城计·武侯韬略夙驰名
811252,前诗于彭及楼事殊略，为五、六叠韵申其意焉
303381,蝶恋花·借问秋情谁领略
285308,天香·海仙花略似水仙花，具五色幽香，清艳绝伦。洵名芳也，倚此赋之
808618,熊经略廷弼
433335,癸巳初秋偕同丛碧慧素孝同元白宏略雨中游劳山自北九水至鱼鳞瀑途中书所见八首
1248083,同唐文学肃王校书行访衍略二上人留宿真庆精舍得闻字
847593,绍兴祀祚德庙八首 其五 英略公位酌献用《成安》。
577258,和少司成张公玄略喜新竹韵
97076,求蜀纸·紫岩黟歙略相同
608584,梁武库经略河陇回
1084169,六月初雨中渡西湖因至道人庵烧佛香略憩灵隐与乡僧同啜茶乘晚以归 其二
370388,王景略对桓温扪虱而谈当世之务
416524,齐天乐   馥丽蕤花产南非洲好望角，移植园亭已久，姿态楚楚。花白略似晚香玉，芬馥袭人。瓶供一枝，香盈满室，名芳也。倚此赋之
365693,怀人诗·荐贤略似孔文举
1073562,桂林山水奇丽妙绝天下柳子厚记訾家洲亭粗见其略余以六月六日度桂林岭欲更仆诣象属暑甚遂少留日从诸公于岩穴之下穹林巨壑近接阛阍之中远不过城闉之趾居高望远夸雄斗丽殆不可状择其尤者以十诗记之名之曰桂林十咏 八桂堂
1213134,寄高文甫治书略寓自劾之意
286996,见惺樵诗多言丁香色香之盛而余太略戏叠前韵
378703,了翁谪廉欲置华严托余将来以六偈见寄其略曰杖头多少闲田地挑取华严入岭来次韵寄之
1120278,胡元之提刑寺丞迂涂相过宠示二诗次韵为谢兼简赵再可经略张君量运使
1037393,次韵同经略舍人登七星山
727406,读外舅一年所为诗因发箧出大人及两弟及罕儿诸作遍与外舅观之外舅爱钟铠诗至仿效其体爰询当事以外间所见诗派之异而喟然有感于斯文也叠韵见示当世仅次其韵略志当世所云云
1145697,相州百姓为樊叔略语
1088495,腊月九日晚发怀安公父教授寿翁知丞载酒为别而元礼景嵩子木择之廷老考叔舜民诸贤相与同舟乘便风顷刻数十里江空月明饮酒乐甚因以星垂平野阔月涌大江流分韵熹得星字醉中别去乃得数语略纪一时之胜云
894561,寄延州经略庞龙图
86027,九叠·商略红儿何足比
1208448,乞巧辞二章（京师里俗以七月七日昏时设祠乞巧于天星织女盖闺人处子惑于荒谬怪诞之说不事箴组觊倖渺茫虚无之效卒无所得予闵其愚遂设为妇祷神答之意缀成此章假辞托兴以譬夫世之学者昧下学上达之理忽略遗弃于日用寻常之事而谓圣人之迶高远玄妙非力行之所可企及当求之于恍惚有无之域是以终于无闻漫不知省因以为戒且自警云尔） 其一
708483,贺新郎  其三 影梅庵忆语，久置案头，不省谁何持去辟疆，再为寄示，开卷泫然，怀人感旧，同病之情略见乎词矣
1108908,旴士张季携所注三略访西山先生既跋其书余复题二绝于卷尾
350295,浣溪纱·约略琵琶紫塞沙
281006,所居洪衙埕即清初洪经略承畴故第，今尚有祠堂在焉
496038,沁园春 其五 送毛东塘经略安南
1016420,和潘经略广州峡山五首 其三
999790,依韵奉和判府经略司徒侍中上巳晚游九曲池诗
418329,癸巳初秋偕同丛碧慧素孝同元白宏略雨中游劳山自北九水至鱼鳞瀑途中书所见八首 其四
213771,贾生·一时谋议略施行
545572,暮秋舟次南皮故人太末赵宗鲁以别驾经略河渠邀集行馆话旧并命小奚拨阮放歌酣畅达曙即席赋赠二章 其二
1075007,光武二十八年五溪蛮反马文渊年六十三矣踊跃请行卒致困败班定远久在绝域上疏请归词甚切至其略曰臣不敢望至酒泉郡但愿生入玉门关遂老中朝辛亥季春三日灯下读此二传感而赋诗
1049681,奉送中济经略侍郎赴镇庆州得元字
790742,题沙定峰读史大略后
410858,祁县鲁村清光绪庚子余避拳匪之乱曾宿此村人家其屋在高崖上马上仰视约略可辨云
1002059,谢广东经略潘直阁席间分贶李济墨
335526,鄜延凯歌·天威略地过黄河
976313,和经略直阁寺丞赠刘升之蛰龙岩二首 其二
197583,夜坐呈外舅·略无家具可经营
1073507,余大观中偕何袭明登仕同为太学诸生别后二十六年余□南迁道清江袭明逆余于新淦之洲上苍颜白发大略相似感叹之馀饮酒赋诗以为笑乐袭明笔力雄赡操纸立就凡六七反必用前韵余继和者十二篇云 其一
1038251,驾经略太尉相公移镇太原 其一
892967,僖宗在蜀谏官孟昭图上疏言田令孜屏书不奏沈之虾蟆津诗人郑谷伤之略曰徒将心许国不识道消时予钦其人作诗投吊
158140,秦州幕府·十万强弓略未弯
1007155,过富池水军寨统辖姚子雄公廨略栖迟且有约同上杭京
791377,题松筠阁贞孝事略
1073563,桂林山水奇丽妙绝天下柳子厚记訾家洲亭粗见其略余以六月六日度桂林岭欲更仆诣象属暑甚遂少留日从诸公于岩穴之下穹林巨壑近接阛阍之中远不过城闉之趾居高望远夸雄斗丽殆不可状择其尤者以十诗记之名之曰桂林十咏 七星岩
697247,暮秋舟次南皮故人太末赵宗鲁以别驾经略河渠邀集行馆话旧并命小奚拨阮放歌酣畅达曙即席赋赠二章
986015,灯夕寄献内翰虢略公
1126371,故经略华文赵郎中崇宪挽章三首
820254,青玉案  偶用元裕之略谱
218604,送陈经略·英姿卓荦众长兼
807293,满庭芳 今春梅候，余适买棹吴门，乃因循羁绊，不及为邓尉之游，正深怅惋，及过里门，而枝头香雪已零落略尽矣，会放公以梅下见怀词并云臣和章相示，漫次原韵
1043990,新开湖诗 昝司万参军甄盘虢略主簿何殊南湖种柳植莲
936332,春晴暄甚花开略无馀矣赋以寓感
979536,复用前韵遣怀呈鲁直唐公成季明略
292420,旧史·天心庙略定如何
404723,齐天乐·庚午八月游东西天目，略穷其胜，潇然有出尘之思
1071395,次韵桂林经略李尚书投赠之句三首 其一
1039910,次韵程给事同孙觉学士杨宪景略天衣谒禹庙夜归
828207,题王景略货畚图
1084531,九日会饮予为唱首自和凡数篇皆因事叙情尔未作重九诗也今再和一篇每句用事而不见姓名末联外馀皆略存对偶必有能和之者
880520,灯夕寄献内翰虢略公
159356,和经略宣徽吴太尉以将经洛阳旧隐之作
165448,复用前韵答鲁直并呈明略
473444,寄万伯修经略朝鲜
137583,送张洞推官赴永兴经略司
252752,忆江南·济南好，伟略想效公
644591,近述基命录粗载三代帝王宽厚之政以寓忠爱之私幸彻睿览过蒙赐诗宠褒词高旨远复增惭荷谨依韵略陈情以谢万一云
922012,送范中济经略侍郎，分韵赋诗，以「元戎十乘以先启行」为韵，轼得先字，且赠以鱼枕杯四，马箠一
1034041,嘉定甲戌孟秋二十有七日起居舍人兼直学士院真德秀上殿直前奏边事不顾忌讳一疏万言援引古今铺陈方略忠谊感激辞章浩瀚诚有补于国家天台戴复古获见此疏伏读再三窃有所感敬效白乐天体以纪其事录于野史
813890,辑广西志略漫述二首
577264,国子司业张公玄略哀挽
999792,依韵奉和经略司徒侍中寒食后池诗二首 其二
151081,双桃寄鞏经略
997169,晚泊长沙示秦处度范元实用寄明略和父韵五首 其五
712616,赠大木上人经略芝冈熊公之孙
377168,郁山主赞·略彴蹈翻天地黑
150846,乙卯春自郡归赏牡丹适有故意回唯魏紫略放二
831412,所居洪衙埕即清初洪经略承畴故第，今尚有祠堂在焉
1107673,奉和经略庞龙图延州南城八咏 迎薰亭
979531,复用前韵呈明略
17815,期李二十文略王十八质夫不至独宿仙游寺
997173,晚泊长沙示秦处度范元实用寄明略和父韵五首 其一
316647,题朱正作鲁迅传略
77930,嘉阳官舍奇石甚富散弃无领略者予始取作假山
78899,重九怀独孤景略
918098,送陈经略二首 其二
911298,次韵经略吴及石门洞
276956,杂感·日出穷遐略
300377,水龙吟·梦刘桥，略用东坡《小舟横截》韵
699766,胡无人四首 念汉武雄才及卫霍远略
905693,灯夕寄献内翰虢略公
214850,山居诗·高才宠略敢凌云
891946,和延州经略庞龙图八咏 其三 延利渠
471222,自徐州至吕梁述水势大略
256590,瑞鹤仙·弟李经略生朝
90957,银杏·深灰浅火略相遭
47148,略上人房竹
146581,题秦隐君祠次邓经略韵
78563,自开岁略无三日晴戏作长句
56194,古北口城此城雄据山川盖徐武宁之经略也
436684,瑞鹤仙 弟李经略生朝
799692,辑广西志略漫述二首 其一
1122420,乙卯春自郡归赏牡丹适有故竟回唯魏紫略放二头
93756,太白墓·玄晖旧宅略无存
331037,送知府提举出守虢略
38334,送略禅者归南岳
991035,邵伯堰下王君玉饯王仲仪赴渭州经略席上命赋
1073565,桂林山水奇丽妙绝天下柳子厚记訾家洲亭粗见其略余以六月六日度桂林岭欲更仆诣象属暑甚遂少留日从诸公于岩穴之下穹林巨壑近接阛阍之中远不过城闉之趾居高望远夸雄斗丽殆不可状择其尤者以十诗记之名之曰桂林十咏 来风亭风洞在七星岩之下曾公岩之右大暑时有风出穴中泠然如冰雪被体不可久留旧有亭摧坏始撤而新之赵漕少隐置酒落其成名曰来风云
999793,依韵奉和经略司徒侍中上巳会兴庆池
870109,奉和经略庞龙图延州南城八咏 其三 柳湖
918094,陈经略生朝四首 其三
875330,旴士张季携所注三略访西山先生既跋其书余复题二绝于卷尾 其二
197024,虢略公·峣阙翚飞河汉傍
10360,在滁苦雨归桃花崦伤亲友略尽
414091,乙卯仲冬让公来劄略云小恙医嘱半休又游菜市口得廉价宜书纸将以两卷为赠并拟以菜市口寻曹芹圃不遇为题书长句一时兴发先书长句却寄
160425,水阁·约略横云岛
1073508,余大观中偕何袭明登仕同为太学诸生别后二十六年余□南迁道清江袭明逆余于新淦之洲上苍颜白发大略相似感叹之馀饮酒赋诗以为笑乐袭明笔力雄赡操纸立就凡六七反必用前韵余继和者十二篇云 其二
114175,再次韵呈廖明略
545571,暮秋舟次南皮故人太末赵宗鲁以别驾经略河渠邀集行馆话旧并命小奚拨阮放歌酣畅达曙即席赋赠二章 其一
431115,希腊先哲柏拉图有心灵不朽之论，略依其旨，率成二章奉题雨僧兄诗集 其二
41285,送始安王方略入关
917525,秦侯不调累年识者叹息兹以规恢秘略亲简上知有诏复其官亨衢自此发轫闻之喜甚为作古篇
870110,奉和经略庞龙图延州南城八咏 其七 缘云轩
996400,以酒渴爱江清作五小诗寄廖明略学士兼简初和父主簿 其五
112478,灯夕寄献内翰虢略公
345240,六月初雨中渡西湖因至道人庵烧佛香略憩灵隐与乡僧同啜茶乘晚以归
165447,复用前韵答明略并呈鲁直
225234,吴汉·智谋勇略已过人
636632,元旦有怀姚明府时略地海上 其三
1098526,题经略台
628226,经略祖
1040149,次韵程给事同孙觉学士杨宪景略游天衣寺
41937,己亥杂诗·风云材略已消磨
73749,意行·略彴三家市
316063,中秋·佳节因贫略
1234229,题李公略所藏高彦敬夜山图
917460,久雨新霁蚤过松竹道院复以雨归因用汪彦章一春略无十日晴之句
418327,癸巳初秋偕同丛碧慧素孝同元白宏略雨中游劳山自北九水至鱼鳞瀑途中书所见八首 其二
438675,元光间予在上龙潭每春秋二仲月往往与元雷游历嵩少诸蓝禅师汴公方事参访每相遇辄挥毫赋诗以道閒适之乐今犹梦寐见之儿子渭近以公故抵任城禅师附寄诗以叙畴昔未几驻锡东庵因造谒间出示裕之数诗醉笔纵横亦略道嵩游旧事感叹之馀漫赋长句二首 其二
869196,奉和经略庞龙图延州南城八咏 其八 禊堂
990208,故经略华文赵郎中崇宪挽章三首 其三
135666,题如庵·脱略机关一散人
140224,春日·一春略无十日晴
593336,送刘翁高赴略阳主簿
961223,双桃寄巩经略三首 其一
1016421,和潘经略广州峡山五首 其二
298789,红梅·略染尘缘也不妨
1110465,余大观中偕何袭明登仕同为太学诸生别后二十六年余□南迁道清江袭明逆余于新淦之洲上苍颜白发大略相似感叹之馀饮酒赋诗以为笑乐袭明笔力雄赡操纸立就凡六七反必用前韵余继和者十二篇云
741475,留别经略
251477,凤凰源·略彴横陈履虎危
108292,西郊纪事·朴略童蒙学
347327,奉寄·约略古堰西
825385,桐城陈镜潭求题其弟琴甫事略
1071396,次韵桂林经略李尚书投赠之句三首 其二
359858,金缕曲·题《南汇朱烈妇行略》后
948598,次张钦夫经略韵送胡长彦司户还庐陵
485130,略上人房竹
941973,海南气候与中州异群花皆早发至春时已尽独荷花自三四月开至穷腊与梅菊相接虽花头小而香色可爱顷岁苏端明谪居此郡尝和渊明诗其略云城南有荒池琐细谁复采幽姿小芙蕖香色独未改即此池也今五十馀年池益增广临川陈使君复结屋其上名宾燕堂今夏得雨迟七月末花方盛开因成此诗约胜日为采莲之集云
1064773,了翁谪廉欲置华严托余将来以六偈见寄其略曰杖头多少闲田地挑取华严入岭来次韵寄之 其一
928051,鹧鸪天 其四 任静江经略安抚日元夕奉亲出郊
1250135,张武略
75235,春草碧·折冲尊俎谈兵略
636631,元旦有怀姚明府时略地海上 其二
401249,题朱正作鲁迅传略
893220,和延州经略庞龙图八咏 其一 迎薰亭
1112060,六月初雨中渡西湖因至道人庵烧佛香略憩灵隐与乡僧同啜茶乘晚以归
373109,周观察·领略芝颜笑语亲
663655,送孙志同经略居庸二首 其二
781269,题四川崇庆牧常君殉节纪略后 其一
686593,送孙志同经略居庸二首
996524,再答明略二首 其二
696193,与东丈并桨南归索余鹪鹩园诗舟次鹅湖萧然无事辄以艰韵成之政得五首言之不次冀略之耳
800374,熊经略
796513,满江红 题溧水任秀才垲殉难略后
1038260,令弟坚官满归京偶成四十言代书寄判武学顾学士略资一噱
151083,经略·世间固有无情物
418331,癸巳初秋偕同丛碧慧素孝同元白宏略雨中游劳山自北九水至鱼鳞瀑途中书所见八首 其六
207764,夜坐·道人心事略幽闲
870107,奉和经略庞龙图延州南城八咏 其六 延利渠
125944,洛阳春吟·光阴不肯略从容
663654,送孙志同经略居庸二首 其一
434406,瑞鹤仙 其一 弟李经略生朝
373238,木瓜坞·山中果树略扶疏
158493,依韵奉和经略司徒中寒食后池诗
149484,谨次知府经略待制韵
113759,再答明略·挟策读书计糊口
840490,偕郑叔进游曲江略具陂陀麦苗憔悴不胜荒凉之感叔进诗成次其韵
577455,寄司业张公玄略时车驾幸太学
1053562,与廖明略学士赋馀干县白云亭一首呈吴明府
219288,閒吟·春风略不欺贫贱
865199,仲子叔明二邦君兼济子安德和文明四使者同过逐客于文殊偶食无肉客既满意而主人略无愧色作诗一首
183485,赴鞫御史闻·近年出处略相同
111265,梅·略彴低横露浅滩
293642,菩萨蛮·年来领略愁滋味
1094302,王景略对桓温扪虱而谈当世之务
544881,不佞隶博士籍五载馀迥游京师不为当道所知今归业且谢去乃辱督学滕公物色风尘擢之异等而且脱略师生罔间形迹青衿之遇近代所无感德酬知辄复赋谢二首 其二
231446,柳梢青·约略春痕
433310,希腊先哲柏拉图有心灵不朽之论，略依其旨，率成二章奉题雨僧兄诗集
400225,齐天乐 寄题贺文略所作溪山红叶图卷
108761,再答明略·廖侯言如不出口
918095,陈经略生朝四首 其二
494630,题三郡政略
880654,经略焕章先生宠赐千叶梅佳制似笑疏花太孤瘦故教密叶拥千层昔人所未经道真绝唱也褒不揆辄拾馀意申呈仰丐规削
1116043,送陈经略二首
1122399,双桃寄巩经略三首
1213188,申仲礼自别秦淮台宪诸公如失轩鉴继过太原仆留吴中尝以诗奉寄丁酉冬敬甫薇郎回自并门连奉报章且谂仲礼薰陶涵养非向年比英风迈节形见乎辞又非行辈所可拟伦也因便奉和略表仰思
1227092,送李公略
365478,杂事诗·依样葫芦巧略同
934956,入秋游山赋诗略无阙日戏作五字七首识之以野店山桥送马蹄为韵 其七
615158,与东丈并桨南归索余鹪鹩园诗舟次鹅湖萧然无事辄以艰韵成之政得五首言之不次冀略之耳 其三
360601,昝司万参军甄盘虢略主簿何殊南湖种柳植莲
719111,阅汪文冶始信峰草堂纪略率题六绝 其三
83098,闲中乐事·得丧略相当
61480,次经略舍人韵
113435,次韵廖明略同吴明府白云亭宴集
171546,闰月九日登越王台次韵经略敷文所寄诗
979538,复答唐公并呈鲁直成季明略
929144,夜归偶怀故人独孤景略
966425,戏题陈晦叔经略秀斋
931658,自开岁略无三日晴戏作长句
1056725,道先贤良寄示长篇辄此酬和略希一笑
922430,昔在九江，与苏伯固唱和。其略曰：「我梦扁舟浮震泽，雪浪横空千顷白。觉来满眼是庐山，倚天无数开青壁。」盖实梦也。昨日又梦伯固手持乳香婴儿
1105169,驾经略太尉相公移镇太原
607768,端阳幕中喜彭祁连自大鹏携酒过酌因示兵略酒阑诸部献俘至
243743,赋张以道寒绿·领略一轩寒绿
1064776,了翁谪廉欲置华严托余将来以六偈见寄其略曰杖头多少闲田地挑取华严入岭来次韵寄之 其四
846840,鹊桥仙 寿朱经略硕人
43926,走别张文峙杜于皇苍略因登鸡鸣山
996804,走答明略适尧民来相约奉谒故篇末及之
748488,过高经略横滦别墅故址
168086,饭罢·雪意犹商略
495300,吴佩远游雁宕山归，备述名胜；因为诗纪略，亦志余企望之怀也
164160,登尘表·领略东风一倚阑
177552,过富池水军寨统辖姚子雄公廨略栖迟且有约同
904996,庆桂帅经略二首 其二
999791,依韵奉和判府经略司徒侍中春阴马上之什
850793,过兴平哭耿傅谏议丧呈经略韩密学
1078047,元结尝经略容管王守作次山堂以思其人为赋此诗
909539,水调歌头 其一 送印德远经略入广
330695,寄元叔·十年出处略相同
1096292,状元袁府判作诗赠王司理其略云简川号工诗只今在市廛试呼一问之参寥师孰贤王索答酬以四十字
72031,醉桃源·略将微语破昏衢
561743,嘉靖壬寅三月四日同勋辅五臣直宿西苑时雨适澍上召赐酒仁寿宫中谕曰寒春宵分召卿等饮一钟朕手注之酒殿中少看待雨略住出银钟带归圣恩隆渥前代所未有也恭赋近体二首志感 其一
878383,旴士张季携所注三略访西山先生既跋其书余复题二绝于卷尾 其一
1016418,和潘经略广州峡山五首 其五
1038253,驾经略太尉相公移镇太原 其三
784556,乙卯九月九日来游西涧西涧主委客去竟赴千像寺斋遂得孤游竟日戊午夏又至西涧涧主又赴千像寺斋时节顿易而踪迹略同追和前作再赋此诗
76876,春晴暄甚花开略无余矣赋以寓感
1177180,贺容府韦中丞大府贤兄新除黔南经略
166155,复答唐公并呈鲁直成季明略
1213247,中丞公示诗隐然有确乎不拔之气讽咏之馀再赓高韵略摅愚衷但求免以衰暮赋归后时为耻尔
121626,赠陈签判·熠熠萤光略露荷
951825,闰月九日登越王台次韵经略敷文所寄诗
544880,不佞隶博士籍五载馀迥游京师不为当道所知今归业且谢去乃辱督学滕公物色风尘擢之异等而且脱略师生罔间形迹青衿之遇近代所无感德酬知辄复赋谢二首 其一
1133298,题李公略示高郎中吴山观月图
121739,小憩见花·略得花边一欠伸
1070787,送知府提举出守虢略
