273822,生查子·余年十六七游江户，邂逅一姝，以所自制彩花相赠
237698,舟中独酌·一年十二月华圆
433565,山中秋兴用杜老韵     （八首） 一九三八年作，时年十五岁
905318,嘉祐三年九月受命来岭外七年十一月得请知济州感恩顾己喜不自胜留诗四章以志岁月 其四
1200834,导引 大定三年十月祫享顺銮应钟宫
999213,三月十四日陪同年十有六人游净慈遂饮于水月居坐中即事 其三
1125168,元符二年十一月十六日赵德麟检校诸邑李方叔自酂来会中庐游灵溪寺观飞泉穷水所出涉龙潭遂至上洞寻火而入路穷乃回归息岩下岩洞泉潭前此未名尝见襄沔记郭璞游仙诗谓青溪道士鬼谷子所隐在义清县义清今其地也岩势天巧如观音大士所居潭抱石而曲泉悬级挂空若冲牙珩璜垂而有声遂名洞曰清溪岩曰补陀潭曰玉玦泉曰珠佩说之寄题四绝句 青溪洞
628998,佳人年十五为潘乾父赋 其二
21162,效古词·莫愁新得年十六
1208368,节妇刘氏（刘氏阳曲民家女早嫁西杜王舜卿生子甫一岁王远游越十年不归刘氏奉舅姑惟谨无怨言子年十四闻父留滦京往拜焉至则他娶矣刘若不闻日勉其子以学又十年王始归浃日而复去竟死滦水上刘自奋艰厄中以保其家以成其子有司上其事旌其门子名思义刘年七十馀）
407534,南岳祝融峰 其二 一九四零年作，时年十七岁
646246,洪武五年正月十五日朝廷就钟山寺大建法会普济幽冥四年十二月十五日上御奉天殿集公侯百官宣谕建会之因禁天下屠宰上先斋戒一月以严法赋斋戒
65900,胡姬年十五·胡女倚芳年
324403,刘天锡之子八岁能作大字今年十三矣笔画愈进有雄健之气作二绝句赠之
127327,七年十二日夜登清心阁
433566,南岳祝融峰 一九四零年作，时年十七岁
1064429,宣和四年十二月二十四日大雪珠禅客忽至渠以谷山退院来审是否作此示之
1163769,建中四年十月感事
127868,幽闺怨·妾年十五从良人
173032,陈道士年十三骨气有异弈棋得妙处鲜能对者推
464030,菩萨蛮·一九六四年十月十六日原子弹爆炸 其五
1056960,元祐六年十月庚午驾自景陵宫移仗谒先圣孔子祠入门降辇步就小次由东阶以升奠爵再拜礼官告成礼然后退幸太学诏博士皆升堂坐诸生两庑下命国子祭酒丰稷讲书无逸终篇因又幸武成王庙而还左丞相吕大防右丞相刘挚率百官皆从于是丞相赋诗以形容上德诸在位者皆属和肇以礼官忝从诸大夫之后谨和诗一章
443805,乙酉年十月廿五日，浔阳地震，波及洪都
1127351,三月十四日陪同年十有六人游净慈遂饮于水月居坐中即事
494902,毛献清殿元乃婿王世芳年十八领乡荐会试下第因留毕姻于毛氏以孟秋还太仓
154034,哭尧章·儿年十七未更事
1069732,宣和七年十二月二十一日就睿谟殿张灯预赏元宵曲燕应制
