1113930,嘉祐三年九月受命来岭外七年十一月得请知济州感恩顾己喜不自胜留诗四章以志岁月
802326,溯涓水抵花石投逆旅观主人女所制搓爆竹机女年十八九慧甚上年为堰水车献之土豪灌田良便豪欲娶为子妇女不可受所值酬直为此机其法先用二板中横铁丝十馀枚取滑藤及糯粥煮纸为糜以油傅铁丝上取如糜者乘热倾二板閒急搓之凡十数次搓纸捲铁丝上如软竹置石灰中养之一炊许坚如铁石矣复有二板上板密排多刃下板密排多槽槽与刃相受相距皆以寸取所搓者数百枚拔去铁丝置此切之皆寸断为短筒又有二板下板有多孔深八九分圆径与短筒等孔底铺黄泥如粉细
265390,大同十年十月戊寅诗
305879,一九六一年十一月九日寒夜作
125113,夫人阁·新年十日逢春日
407524,山中秋兴用杜老韵     （八首） 其二 一九三八年作，时年十五岁
39971,胡姬年十五
84081,长信宫词·忆年十七兮初入未央
1061251,均父约去年十月还襄阳今已二月矣尚未闻汉上消息因诵旧寄渠诗二首用其韵寄之 其二
935167,予年十六始识叶晦叔于西湖上后二十七年晦叔之弟声叔来为临邛守相遇于成都晦叔没久矣访其遗文略无在者乃赋此诗
94654,玉照堂·常年十月未花开
349518,丁丑人日敬寄京师呈家大人作此诗时年十二岁
480393,西山诗次李宾之韵（壬辰年十二月）
407530,山中秋兴用杜老韵     （八首） 其八 一九三八年作，时年十五岁
150226,赵君年十六作雨诗极奇验可畏说之辄次韵和之
1238460,胡姬年十五拟刘越石
118097,送欧阳辩·我年十九识君翁
301616,高阳台·哭孝先次儿，此子勤学而贤，乙巳冬仲卒，年十七
731144,乾隆九年十月重葺翰林院落成车驾临幸赐宴送大学士掌院事鄂尔泰张廷玉进署以张说东壁图书府五律字为韵赋东字音字二首敕诸臣各分一字赋诗 其一
72834,怯薛行·怯薛儿郎年十八
400389,浣溪沙 一九二二年十月八日纽约城作
420911,念奴娇 一九八〇年十一月十三日游览东坡赤壁
355639,元祐六年十月庚午驾自景陵宫移仗谒先圣孔子祠
948698,绍兴三年十月丙辰长沙郡贡士三十人于公堂太守周某赋诗一篇代鹿鸣之歌
1036153,满庭芳 余年十七。始与刘仲达往来于眉山。今年四十九。相逢于泗上。淮水浅冻。久留郡中。晦日同游南山。话旧感叹。因作满庭芳云
263757,喜迁莺令·贺李丹壑秋捷时年十六岁
54403,西屯女·西屯女儿年十八
802208,丁丑人日敬寄京师呈家大人作此诗时年十二岁 其二
417349,忆江南三首 其一 一九九0年十月十九夜，重读鲁迅先生《野草》数页，吟此纪念先生逝世五十四周年
541499,同李宗阳泛西湖招侄男兆不至口占促之时年十五
457959,二零零一年十二月三十一夜 其三
705443,喜迁莺令 贺李丹壑秋捷时年十六岁
1194310,贞元八年十二月谒先主庙绝句三首
1118877,十三日再赋二首其一以赞使君是日对花赋此韵诗笔落纵横而郡中修水战之具方大阅于燕公楼下也其一自叙所感忆年十五在杭州始识此花皆三丈高木尝赋诗焉
62293,尹母行·云间尹母年十七
1061250,均父约去年十月还襄阳今已二月矣尚未闻汉上消息因诵旧寄渠诗二首用其韵寄之 其一
457858,此梦得于予少年十八九时。予共一老农犁田，俄而有女子挎篮至，其衣甚粗，其貌甚常，盖为老农之女抑或孙女，携饭馔耕者也。食既毕，与女并坐一长条椅上，予倦极，乃倚其肩小憩，竟尔入睡。中心温暖怅惘，殆不能词达。苟世果有幸福一事，予将并此世界、古今，一切弃之，而举梦中此一刻也。倚枕思之，条椅予自车站所见，父女二人，则平生未尝见，即梦中亦不相识。予盖行客，偶尔路过，略一助老农耳。苟能梦至睡起，必拽行囊而长去者。
858071,元丰二年十月政公改路故作此诗
824422,沁园春 一九六三年十二月，赋呈毛主席
929249,绍兴癸亥余以进士来临安年十九明年上元从舅光州通守唐公仲俊招观灯后六十年嘉泰壬戌被命起造朝明年癸亥复见灯夕游人之盛感叹有作
980458,元符二年十一月十六日赵德麟检校诸邑李方叔自酂来会中庐游灵溪寺观飞泉穷水所出涉龙潭遂至上洞寻火而入路穷乃回归息岩下岩洞泉潭前此未名尝见襄沔记郭璞游仙诗谓青溪道士鬼谷子所隐在义清县义清今其地也岩势天巧如观音大士所居潭抱石而曲泉悬级挂空若冲牙珩璜垂而有声遂名洞曰清溪岩曰补陀潭曰玉玦泉曰珠佩说之寄题四绝句 其四 珠佩泉
555802,乙巳年十月二十五日夜复入狱咏柏一绝
460169,忆少年　十二月二十一日作
156971,嘉佑三年九月受命来岭外七年十一月得请知济
203360,送商府判·比年十月君初来
1036225,浣溪沙 绍圣元年十月二十三日与程乡令侯晋叔、归善簿谭汲同游大云寺。野饮松下，乃设松黄汤，作此阙。余近酿酒。名之曰万家春。盖岭南万户酒也。
39574,咏怀·昔年十四五
431796,忆江南三首 一九九0年十月十九夜，重读鲁迅先生《野草》数页，吟此纪念先生逝世五十四周年
937681,十三日再赋二首其一以赞使君是日对花赋此韵诗笔落纵横而郡中修水战之具方大阅于燕公楼下也其一自叙所感忆年十五在杭州始识此花皆三丈高木尝赋诗焉 其一
714862,方湘九年十五时割臂肉疗其伯父疾诗以赠之
1141643,范文正公黄素小楷昌黎伯夷颂盖宋皇祐三年十一月在青社所书以遗京西转运使苏公舜元者也后二百四十年大兴李侯戡得此本于燕及南来守吴乃文正公乡里即访公子孙以畀之范氏喜而索诗为赠
979843,元符二年十一月十六日赵德麟检校诸邑李方叔自酂来会中庐游灵溪寺观飞泉穷水所出涉龙潭遂至上洞寻火而入路穷乃回归息岩下岩洞泉潭前此未名尝见襄沔记郭璞游仙诗谓青溪道士鬼谷子所隐在义清县义清今其地也岩势天巧如观音大士所居潭抱石而曲泉悬级挂空若冲牙珩璜垂而有声遂名洞曰清溪岩曰补陀潭曰玉玦泉曰珠佩说之寄题四绝句 其一 青溪洞
225433,玉山避寇·前年十月间
269415,十年·十年难学到诗翁
414824,七五年十月二十九日访戊申翁于燕园，招以肴酒，示以珍藏，又同游圆明园遗址，尽一日之欢，归赋五古纪实
315893,十年·十年涉世惜知难
78365,予年十六始识叶晦叔於西湖上後二十七年晦叔
77120,灯笼·我年十六游名场
383473,台湾杂咏·生年十五鬓鬖鬖
178261,去年十一月十二日致宏如秦州仆饯之余口复到
404676,踏莎行·一九九七年十月，忽得日英电告，克正以肺癌弃世，不胜震悼，哀吟当哭
837800,高阳台·哭孝先次儿，此子勤学而贤，乙巳冬仲卒，年十七
60076,二年十一月和暖如春上游观上苑召侍臣危素宋
608716,拟佳人年十五
1249491,至正十年十二月十九日义兴吴国良持倪云林诗来玉山中相与徜徉数日将旋索为别余与玉山同简云林
905321,嘉祐三年九月受命来岭外七年十一月得请知济州感恩顾己喜不自胜留诗四章以志岁月 其二
420251,东风齐著力 二十六年十二月十三日南京失手。时在庐山讲舍，闻讯悲苦，且闻委员长痛哭别陵事，益涌澜翻之泪也
422783,鹊踏枝 三十三年十一月十五夜书
457957,二零零一年十二月三十一夜 其一
51469,竹枝词·生年十五棹能开
854478,至元廿四年十一月二十日得宣命诣朝可庵有诗不敢当次韵以谢 其二
254511,菩萨蛮·一九六四年十月十六日原子弹爆炸
1105458,至元廿四年十一月二十日得宣命诣朝可庵有诗不敢当次韵以谢
866682,绍兴六年十月六日同信可舜弼进道谒隐甫值渠晒画于中庭遂得纵观中间不无可人意独范宽雪山八幅超然绝群令人意象肃如真得脱身归岩壑间者请赋诗以知君重毫素为韵得君字
661785,成化十四年十二月十六日吴兴张渊子静松陵史鉴明古长洲李甡应祯吴宽原博颖川陈瑄廷璧入云泉庵观大石联句
887297,予与子寔避盗同走崆峒予以其年十一月归侍金川踰月而子实走豫章阅三载子实携婉妹归梅川道经旴予自金川侍亲归会之酒酣作是诗以饯别壬辰十一月二十七日
79798,绍兴癸亥余以进士来临安年十九明年上元从舅
96568,教授·去年十月君行此
1064097,龙山亦名隐山余宣和五年十一月中浣日过焉有浙道人鸿公乞偈为作
264946,东风齐著力·二十六年十二月十三日南京失手
1209045,菩萨蛮 卫州道中至元四年十月与巴尔斯布哈御史同行按行河南四道
816545,丁丑人日敬寄京师呈家大人作此诗时年十二岁
1165750,贞元八年十二月谒先主庙绝句三首 其三
998558,三月十四日陪同年十有六人游净慈遂饮于水月居坐中即事 其二
152382,绍兴三年十月丙辰长沙郡贡士三十人于公堂太
818907,一九四七年十月十八日自上海至香港机中口占四首选一
657247,庚尧嗣君鼎晨兄年十九以戴记初登北榜
514076,邵村张氏子茂植年十二俊颖可爱其父才遣从予游以其尚幼俾先之于塾师俟少长则收而教之且勖以诗
405064,一九七九年十月，余以事至京，志岳兄南游沪杭，将返哈尔滨，道出京华，相逢话故，并出新诗见示，归后赋此奉寄，即乞郢正
649034,静安亭诗沙溪刘伯川先生席上作时年十二
1165748,贞元八年十二月谒先主庙绝句三首 其一
146115,去年十月九日余至燕城今周星不报为赋长句
854479,至元廿四年十一月二十日得宣命诣朝可庵有诗不敢当次韵以谢 其一
1073050,刘天锡之子八岁能作大字今年十三矣笔画愈进有雄健之气作二绝句赠之 其一
266804,水龙吟·时序相催，悲愉无定。我闻如是，言愁欲愁，卅四年十月作
514924,弘治元年十月十八日得休致之命与李符台士钦小酌口占
628997,佳人年十五为潘乾父赋 其一
379643,均父约去年十月还襄阳今已二月矣尚未闻汉上消息因诵旧寄渠诗二首用其韵寄之
458481,零八年十月末，予过巩县，思一谒杜陵生窑及其旧墓，而病酒伤风，终不克就。聊赋此解，以谢杜公
407528,山中秋兴用杜老韵     （八首） 其六 一九三八年作，时年十五岁
690995,佳人年十五为潘乾父赋
407527,山中秋兴用杜老韵     （八首） 其五 一九三八年作，时年十五岁
929246,绍兴辛酉予年十七矣距今已六十年追感旧事作绝句
379154,云庵生辰·今年十月十六日
99635,元祐五年十二月十二日同景文义伯圣途次元伯
725795,大同十年十月戊寅诗
249525,一九九二年十二月四日中山市博物馆举办欧初业馀书画习作展览赋此贺赠
826629,高阳台·辛巳岁先室绚华侍祖外舅彭刚直公归衡阳，时余年十四，妇年十六。舟发胥江，依依惜别，为第一度分襟处。卅年来伤离感逝之怀，焉得逢人而语。黄陵瑶瑟，飙乘仙女之踪；元武明珠，泪结相思之字。野水孤帆，城阴一角，夕阳无语，离思当年，低回独喻云
826629,高阳台·辛巳岁先室绚华侍祖外舅彭刚直公归衡阳，时余年十四，妇年十六。舟发胥江，依依惜别，为第一度分襟处。卅年来伤离感逝之怀，焉得逢人而语。黄陵瑶瑟，飙乘仙女之踪；元武明珠，泪结相思之字。野水孤帆，城阴一角，夕阳无语，离思当年，低回独喻云
863093,陈道士年十三骨气有异弈棋得妙处鲜能对者推此艺以他学何所不可因成短篇赠之
106160,醉吟·渊明年十九
20153,贞元八年十二月谒先主庙绝句三首
980457,元符二年十一月十六日赵德麟检校诸邑李方叔自酂来会中庐游灵溪寺观飞泉穷水所出涉龙潭遂至上洞寻火而入路穷乃回归息岩下岩洞泉潭前此未名尝见襄沔记郭璞游仙诗谓青溪道士鬼谷子所隐在义清县义清今其地也岩势天巧如观音大士所居潭抱石而曲泉悬级挂空若冲牙珩璜垂而有声遂名洞曰清溪岩曰补陀潭曰玉玦泉曰珠佩说之寄题四绝句 其三 玉玦潭
116357,再和马图·我年十五游关西
1051689,元祐元年十二月庚子雪夏首莼湖结冰鹡鸰群集于上者至不可数感而作是诗也
743564,家秋塍大令复以嘉庆元年九月与黄小松易武虚谷亿为嵩少伊阙之游寻碑选胜作图纪事其年十二月往求孙渊如星衍篆题其首明年五月以书抵余华亭官所求诗
407522,古柏 1936年作，时年十三岁
214589,偈颂·去年十月十七
473801,胡姬年十五
155670,三月十四日陪同年十有六人游净慈遂饮於水月
1003197,念奴娇  余年十八寓符离，临行，作此词
307796,燕山亭·书感分寄榆生羊石瞿禅杭州，时廿四年十一月
72809,胡姬年十五拟刘越石
44548,蝶恋花·窈窕燕姬年十五
724408,至德二年十一月十二日升德施山斋三宿决定罪福忏悔诗
466295,二零零一年十二月三十一夜
464026,菩萨蛮·一九六四年十月十六日原子弹爆炸 其一
458447,二零零七年秋归乡，得会老薛并诸友。薛云，中年向暮，馀事皆无，但思重拾诗思，以遣苍髯。故记以赠之。又忆少年十七八时，共约归隐，予有词云：觅佳地、须邻古柏，有小舟、细雨泊烟霏。功名倦，匡山忆处，结屋相依。今廿馀年矣，竟不得践其归志，悲乎
866709,策师南游过三峡见予求施以诗会余忧悲苦恼无意赋咏姑借梅为喻送行则无一字不著题此本分事不妨大亲切也策将安取绍兴十四年十二月一日
605162,读旌柏堂录为陆贞姑七十寿赋贞姑今宪副廉石陆公之姑也姑年十六归同邑参知冯公皋谟之子曰春旸甫期春旸逝姑举遗腹子五岁亦夭姑投缳触棺誓殉地下左右力护视始免参知公伤其志欲为择嗣无可择者乃以幼女为姑之女是贞姑以小姑为女亦为子也盖义起矣参知公曰小姑长唯妇择婿婿之于是宪副公为贞姑之婿宪副公郎水部日辄疏贞姑之节以闻得报表闾称贞姑云岁甲戌姑年七十矣八月既望为设帨之辰宪副公适以入贺过里乃索拙句为寿不得辞敢以三章侑勺者
464029,菩萨蛮·一九六四年十月十六日原子弹爆炸 其四
180874,己酉中秋之夕与任才仲醉於岳阳楼上明年十一
458480,零八年十月石人山伴仙居晨起
902108,去年十一月十二日致宏如秦州仆饯之馀口复到生口作别明年六月十二日仆自竹山避地溯流上馀口道由生口复经分手之地感时书事奉寄致宏时建炎四年也
467541,菩萨蛮·一九六四年十月十六日原子弹爆炸
417350,忆江南三首 其二 一九九0年十月十九夜，重读鲁迅先生《野草》数页，吟此纪念先生逝世五十四周年
315892,一九七九年十月，余以事至京
896016,醉垂鞭 其二 赠琵琶娘，年十二
299369,吴江舟次·三年十渡吴江水
905319,嘉祐三年九月受命来岭外七年十一月得请知济州感恩顾己喜不自胜留诗四章以志岁月 其一
811656,乾隆九年十月重葺翰林院落成车驾临幸赐宴送大学士掌院事鄂尔泰张廷玉进署以张说东壁图书府五律字为韵赋东字音字二首敕诸臣各分一字赋诗
899130,朝中措 其二 前年十二月十八日入对，遂除吏侍。今在婺州，腊月十八日也
883795,涪州江心有巨石隐于深渊石傍刻二鱼古记云鱼出岁必大丰端拱元年十二月十有四日昂自瞿塘回遵途于此知郡琅琊王公□云石鱼再出来岁复稔昂往而观之果如所说因歌圣德辄成一章
1124534,均父约去年十月还襄阳今已二月矣尚未闻汉上消息因诵旧寄渠诗二首用其韵寄之
879603,萧长公来访示以诸公诗卷谓与予游从之久不能一辞为赠颇相噍责予赋之不可辞之亦不可皆有说焉名章俊语前后相望无数次乎其间是睹西子之容面自增丑耳所不容却者予年十五时海山官丁受琴于长夫今予年四十与长夫有二十五年之旧辞之弗作其可乎因书数言
443282,叶海燕索诗，叶年十九，善舞，家吴山下
948148,予年十四五侍子中兄读书赣州寿量寺久之寺为寇燔其后子中出守一新之今小儿纶又将佐郡他日当访旧游因主僧慈济写真题赞
465869,一九九二年十二月四日中山市博物馆举办欧初业馀书画习作展览赋此贺赠
333055,光绪三十三年十二月乞病纪恩
221875,绍兴六年十月六日同信可舜弼进道谒隐甫值渠
1036150,如梦令 元丰七年十二月十八日浴泗州雍熙塔下，戏作如梦令两阙。此曲本唐庄宗制，名忆仙姿，嫌其名不雅，故改为如梦令。庄宗作此词，卒章云：「如梦。如梦。和泪出门相送。」因取以为名云
826288,水龙吟·时序相催，悲愉无定。我闻如是，言愁欲愁，卅四年十月作
543494,夜灯同永叔话旧仲子弼年十四于座中戏咏白石榴有霜寒秋色净明月挂枝头之句余嘉其风格朗朗赋此勖之
428057,清平乐 一九六五年十二月八日曹荻秋副市长当选为上海市市长，赋此致贺
727768,丁丑人日敬寄京师呈家大人作此诗时年十二岁 其一
1053685,元丰四年十二月大雪郡侯送酒
830780,光绪三十三年十二月乞病纪恩
1196884,胡姬年十五
1165749,贞元八年十二月谒先主庙绝句三首 其二
313832,鹊踏枝·三十三年十一月十五夜书
378853,宣和四年十二月二十四日大雪珠禅客忽至渠以谷山退院来审是否作此示之
218435,予与子寔避盗同走崆峒予以其年十一月归侍金
240677,同年十人会於湖上巫子先拘台制不来有诗次韵
407532,南岳望日亭 一九四零年作，时年十七岁
1208633,济南张侯至大二年奉御香祷旱历山舜祠雨应是年十二月也
69732,卢孤女·卢孤女年十五
1106661,刘天锡之子八岁能作大字今年十三矣笔画愈进有雄健之气作二绝句赠之
292459,十年·十年生计历黄粱
407529,山中秋兴用杜老韵     （八首） 其七 一九三八年作，时年十五岁
893020,去年十月赴淮阳今实周一岁岁中三迁遂直内禁作诗记其出处
296486,记年·十年移易住山期
1208544,延祐七年十一月朔小雪既上英宗皇帝入太庙祀享致斋万姓瞻仰喜而赋诗
1155790,九年十一月二十一日感事而作
980597,赵君年十六作雨诗极奇验可畏说之辄次韵和之
916324,己亥年十月十七日大雪
404659,酹月江·一九八○年十月悼念余志宏同志
125244,去年十月赴淮阳今实周一岁岁中三迁遂直内禁
583453,弘治十六年十二月二十五日午大雪二十九日寅止正月三日晚又雪至十六日或雪或止惟十五日尤异其雪花大者约广二三寸长亦如之见者莫不惊骇余时奉命在镇是日雨水节寒如冬至沿河冻合舟不能行屋檐积雪弥月不消不知天道竟何如也感而有作
1085761,赵果州之子年十四能作大字果州自荆南以诗寄予命书之字画老成异日必名家因赠以诗
1160024,令狐仆射与余投分素深纵山川阻修然音问相继今年十一月仆射疾不起闻予已承讣书寝门长恸后日有使者两辈持书并诗计其日时已是卧疾手笔盈幅翰墨尚新律词一篇音韵弥切收泪握管以成报章虽广陵之弦于今绝矣而盖泉之感犹庶闻焉焚之穗帐之前附于旧编之末
483776,二年十一月和暖如春上游观上苑召侍臣危素宋濂詹同吴琳及观等赐宴于奉天门东紫阁蒙御制一序赐之曰卿等各赋一诗以述今日之乐观诗曰
938066,己酉中秋之夕与任才仲醉于岳阳楼上明年十一月二十日南游过道谒姜光彦出才仲画轴则写是夕事也剪烛观之恍然一笑书八句以当画记
653566,哭内十二韵时年十七
464027,菩萨蛮·一九六四年十月十六日原子弹爆炸 其二
1053880,元丰三年十一月施君发之县丞舣舟浔阳出所收书相示好之笃蓄之多装裱之妙可尚也诗以记其事
464028,菩萨蛮·一九六四年十月十六日原子弹爆炸 其三
955320,桐庐方正父家藏书翰林画白芍药予来领郡事因获一见感叹久之题二十八字景祐元年十月七日
731145,乾隆九年十月重葺翰林院落成车驾临幸赐宴送大学士掌院事鄂尔泰张廷玉进署以张说东壁图书府五律字为韵赋东字音字二首敕诸臣各分一字赋诗 其二
143844,至元廿四年十一月二十日得宣命诣朝可庵有诗
809879,康熙五十四年十月初三日避暑山庄恭祝皇太后万寿诗
58231,寄阿山·最忆凤雏年十四
407526,山中秋兴用杜老韵     （八首） 其四 一九三八年作，时年十五岁
1073051,刘天锡之子八岁能作大字今年十三矣笔画愈进有雄健之气作二绝句赠之 其二
905320,嘉祐三年九月受命来岭外七年十一月得请知济州感恩顾己喜不自胜留诗四章以志岁月 其三
79800,绍兴辛酉予年十七矣距今已六十年追感旧事作
195219,范文正黄素小楷昌黎伯夷颂盖宋皇佑三年十一
407533,南岳祝融峰 其一 一九四零年作，时年十七岁
855451,同年十人会于湖上巫子先拘台制不来有诗次韵
17358,赠友·一年十二月
265085,念奴娇·一九八〇年十一月十三日游览东坡赤壁
819818,乙巳二月赴湘长沙湘阴武冈为先高祖金门公旧治遗爱在民至今父老犹能言之时先曾祖秋舫公官京朝常忽忽不乐明发之怀形诸篇什舟夜不寐感怀先德梦中得「长歌明发篇浩叹京国年」十字醒成之
407523,山中秋兴用杜老韵     （八首） 其一 一九三八年作，时年十五岁
128194,当垆·胡姬年十五
605163,读旌柏堂录为陆贞姑七十寿赋贞姑今宪副廉石陆公之姑也姑年十六归同邑参知冯公皋谟之子曰春旸甫期春旸逝姑举遗腹子五岁亦夭姑投缳触棺誓殉地下左右力护视始免参知公伤其志欲为择嗣无可择者乃以幼女为姑之女是贞姑以小姑为女亦为子也盖义起矣参知公曰小姑长唯妇择婿婿之于是宪副公为贞姑之婿宪副公郎水部日辄疏贞姑之节以闻得报表闾称贞姑云岁甲戌姑年七十矣八月既望为设帨之辰宪副公适以入贺过里乃索拙句为寿不得辞敢以三章侑勺者
999214,三月十四日陪同年十有六人游净慈遂饮于水月居坐中即事 其一
416957,燕山亭 书感分寄榆生羊石瞿禅杭州，时廿四年十一月
407525,山中秋兴用杜老韵     （八首） 其三 一九三八年作，时年十五岁
457958,二零零一年十二月三十一夜 其二
192609,已亥年十月十七大雪
937682,十三日再赋二首其一以赞使君是日对花赋此韵诗笔落纵横而郡中修水战之具方大阅于燕公楼下也其一自叙所感忆年十五在杭州始识此花皆三丈高木尝赋诗焉 其二
512837,无锡沈宗贵存耕翁之仲子自弱冠侍翁至余家余年十三见先父以诗画赠存耕经四十九年尚存宗贵所观感而赋此
639562,蝶恋花 小婢寻香，婀娜有致，楚楚如秋棠，可怜年十二而死，怆然哀之赋此
417351,忆江南三首 其三 一九九0年十月十九夜，重读鲁迅先生《野草》数页，吟此纪念先生逝世五十四周年
879602,萧长公来访示以诸公诗卷谓与予游从之久不能一辞为赠颇相噍责予赋之不可辞之亦不可皆有说焉名章俊语前后相望无数次乎其间是睹西子之容而自增丑耳所不容却者予年十五时海山官丁受琴于长夫今予年四十与长夫有二十五年之旧辞之弗作其可乎因书长句
215180,元丰二年十月政公改路故作此诗
378947,龙山亦名隐山余宣和五年十一月中浣日过焉有浙道人鸿公乞偈为作
989339,胡姬年十五
921788,元祐五年十二月十二日，同景文、义伯、圣途、次元、伯固、蒙仲游七宝寺，题竹上
1036152,浣溪沙 元丰七年十二月二十四日从泗州刘倩叔游南山
690576,读旌柏堂录为陆贞姑七十寿赋贞姑今宪副廉石陆公之姑也姑年十六归同邑参知冯公皋谟之子曰春旸甫期春旸逝姑举遗腹子五岁亦夭姑投缳触棺誓殉地下左右力护视始免参知公伤其志欲为择嗣无可择者乃以幼女为姑之女是贞姑以小姑为女亦为子也盖义起矣参知公曰小姑长唯妇择婿婿之于是宪副公为贞姑之婿宪副公郎水部日辄疏贞姑之节以闻得报表闾称贞姑云岁甲戌姑年七十矣八月既望为设帨之辰宪副公适以入贺过里乃索拙句为寿不得辞敢以三章侑勺者
278187,沁园春·一九六三年十二月，赋呈毛主席
150192,元符二年十一月十六日赵德麟检校诸邑
287396,哭李心栽·去年十二月
979842,元符二年十一月十六日赵德麟检校诸邑李方叔自酂来会中庐游灵溪寺观飞泉穷水所出涉龙潭遂至上洞寻火而入路穷乃回归息岩下岩洞泉潭前此未名尝见襄沔记郭璞游仙诗谓青溪道士鬼谷子所隐在义清县义清今其地也岩势天巧如观音大士所居潭抱石而曲泉悬级挂空若冲牙珩璜垂而有声遂名洞曰清溪岩曰补陀潭曰玉玦泉曰珠佩说之寄题四绝句 其二 补陀岩
19341,九年十一月二十一日感事而作
323588,赵果州之子年十四能作大字果州自荆南以诗寄予命书之字画老成异日必名家因赠以诗
41597,至德二年十一月十二日升德施山斋三宿决定罪
851456,去年十月九日余至燕城今周星不报为赋长句
921374,元丰七年十一月十三日，与几先自竹西来访庆老，不见，得与徐君卿供奉、蟾知客东阁道话久之
