333683,冬至前·人间此会信非常
164670,赠郑通庵韵·此别何年此会重
191624,同游张园酒中各叹明年未知谁与此会余最衰病
263479,竹枝词·此会由来是劝工
828781,东坡生日墨巢约看梅坐中蔬畦十馀年不见矣别后书来谓此会不可无诗漫为长句
1076298,苏内相在黄冈尝从桃花寺僧觅茶栽移种雪堂下余始至此会岁且暮明年春得新芽试之色香味俱绝不减湖越二品宜其见赏于此老人也人言雪堂今已鞠为馆驿茶盖可知矣
920665,和苏州太守王规父侍太夫人观灯之什，余时以刘道原见访，滞留京口，不及赴此会，二首 其二
1156873,胡吉郑刘卢张等六贤皆多年寿予亦次焉偶于弊居合成尚齿之会七老相顾既醉且欢静而思之此会稀有因成七言六韵以纪之传好事者
385065,九日·此会登楼岁几更
1116527,和苏州太守王规父侍太夫人观灯之什，余时以刘道原见访，滞留京口，不及赴此会，二首
745965,壬寅腊月十九日嶰筠前辈招诸同人集双砚斋作坡公生日此会在伊江得未曾有诗以纪之
139325,偶和成·此会从来有故常
787390,七月七日，与子乔会岑诗人于钟氏园，分韵得十蒸，去年叔白有此会
277813,七月七日，与子乔会岑诗人于钟氏园，分韵得十蒸，去年叔白有此会
946047,同游张园酒中各叹明年未知谁与此会余最衰病宜去因作诗识之
920664,和苏州太守王规父侍太夫人观灯之什，余时以刘道原见访，滞留京口，不及赴此会，二首 其一
1251578,予去岁九日与史文英张仲礼会饮瑶台山皆有诗题于观壁予末句曰但愿加餐强健在来年此会莫相违今年在平陆追和其韵以寄云
322042,南楼·江汉西来于此会
