1145259,武成殂后谣
206853,直院中书莫公殂往哀痛不成文辄留小诗灵几并
431354,沁园春 元配于淑贤病殂申江，父死患难友朋之手，三年不敢以闻。祖母创心长别，为此哀辞，淑贤淳化县人，故甘泉宫地也
305464,入秋以来茫父季常亮侪曼仙相继殂谢吾乡老辈如巴园碧栖亦归道山晨起感念书柬宰平
751779,七月二十九日得秦中赵岳生司马书知女弟于去岁四月朔日殂谢诗以哭之
991459,闻高平公殂谢述哀感旧以助挽歌三首 其三
1126527,闻高平公殂谢述哀感旧以助挽歌三首
105635,闻高平公殂谢述哀感旧以助挽歌
991460,闻高平公殂谢述哀感旧以助挽歌三首 其二
350309,霜叶飞·刘达泉病过汉上，还湘竟殂阁雪。岁阑谱此寄诔
266718,浣溪纱·友人许惠鸳鸯忽陨厥雌，余挈雄以归。越夕复殂，睹物兴怀，有赋
542429,寄门人王少海陆石虹二子因悼商洛山同贾于邺未几病殂久淹旅榇作诗讽之
868601,直院中书莫公殂往哀痛不能成文辄留小诗灵几并致鲈鱼金柑为奠
991461,闻高平公殂谢述哀感旧以助挽歌三首 其一
420191,沁园春 其一 元配于淑贤病殂申江，父死患难友朋之手，三年不敢以闻。祖母创心长别，为此哀辞，淑贤淳化县人，故甘泉宫地也
834336,霜叶飞 刘达泉病过汉上，还湘竟殂阁雪。岁阑谱此寄诔
429959,入秋以来茫父季常亮侪曼仙相继殂谢吾乡老辈如巴园碧栖亦归道山晨起感念书柬宰平
826202,浣溪纱·友人许惠鸳鸯忽陨厥雌，余挈雄以归。越夕复殂，睹物兴怀，有赋
