360302,来京师·贫是吾家物
513502,季弟克宽来京师适当端午西湖南海之莲尚未有花而予家盆池特出二萼化工之巧有若为予两人者设耳克宽南行有期辄用开宴以酬花因思予在西城时此花亦于五月盛开司寇陆公辈各赋一诗以为予中举之徵其后果然今十四年矣故诗及之
453210,抗战英雄高志远之孙高小平来京晤叙诗以述怀
817322,李廉衣来京己两月矣遍寻不晤感赋
637573,余奉使朝鲜与其国相徐刚中唱酬颇熟别后不能不往来于怀也适张司译自朝鲜来京徐君赠以绝句三章蔼然寓见念之意披阅有感依韵赋焉 其三
451957,甲申夏应三江有月之邀赴三峡得与众诗友相识，其后东遨兄三江兄几度来京小聚，日前三江才走，东遨兄又至，赋此以呈
360300,来京师·全家如一叶
386345,临江仙·得子宽粤中来札，知岁底决计来京，慰甚
452026,乙酉十二月五日诸友驱车来京小聚，欢饮竟夜，转战多家酒店，及至酒醒已在河北省境，自觉荒唐，戏赋一律为记
250365,乙酉十二月五日诸友驱车来京小聚
306313,病起赋谢克礼医师君有声沪上前岁归与欧战近来京师始与余相识岂佛家所谓缘耶
452296,辛卯孟夏海楼兄携女儿心莲来京盘桓数日时心莲才考中国美附中赋诗以赠
783020,李廉衣来京己两月矣遍寻不晤感赋 其一
452328,辛卯冬秒虞廷兄来京秋扇为置酒半梦抱琴高凉疏影师生同至言及次日蛰门赴天津雅集数日后得疏影来诗云欲留终去别良俦过处云山满目愁衣上京华留酒债孤怀和梦返渝州颇多怏怏之意忆及曾与疏影有渝州之约戏步原韵慰之
451968,四月九日中午，红叶自苏州来京邀饮并以名茶见赠，自言以后长住京城，晚间伯元置酒再饮，十日晨红叶来电称昨夜大醉，现在尚不能起，真率性友也，因口占一律以寄之
1063350,大观四年春吾与友人任景初舍弟端孺自蜀来京师至长安时方寒食吾三人相与戎服游九龙池饮酒赋诗乐甚是岁吾迁岭表明年景初亦谪江左忽忽数岁皆未得去寒食无几念念悽然作诗寄任因命舍弟同赋
828680,自来官京朝者皆居宣武门外屋宇湫隘依然寒士家风所谓南城士大夫也国变后王侯第宅皆易新主速化者率居东西内城然盛衰不常倏焉灭迹予因病请急来京僦居景山下盖有不胜今昔之感者爰成长句一首
452059,丙戌夏日与京城诗友设宴迎接蛰堪东遨燕婷来京步是务斋主韵
754681,二女自库伦来京喜成
452344,壬辰春暮冷白来京小酌
406512,大杰来京夜过有诗即饯其南还
809810,吏部尚书引年致仕宋荦因朕六旬寿庆祝来京事毕五月内回本乡朕念旧臣特书七言律一首以纪其事云
462145,花朝前日海楼来京分韵春和景明拈和字
452277,蓝天孤鹤兄来京烟沽野鹤设宴接风席间野鹤提议以有诗无酒不诗人为首句赋诗
124611,笔见授·何年掷钵来京毂
345342,大观四年春吾与友人任景初舍弟端孺自蜀来京师至长安
251187,三江兄来京小聚席间论及诗事时事皆无不惬遂约分韵得疏字
452195,新河兄自西安乘机来京聚会途中不断发诗凑趣步韵以答
452505,鹧鸪天 友人岳父家遭遇强行占地，生计难以为继，夫妇俩仓皇来京为家人申诉，予陪其小酌，归后忽然高烧，竟夜辗转难眠，榻上赋此
452042,清明前一日晦窗来京小酌相约赋此
362693,移家来京师
911660,叔虎辱与予游最久其所为诗文仅窥一二未获搴珠璧之椟而纵观也行李来京都携方崖类藁携续集示予暇日隐几读之斲巧抽新绚綵烂烂为之洞心豁目不知君家所藏其富若是辄成古风以自诧奇观因以为谢
250617,新河兄自西安乘机来京聚会途中不断发诗凑趣步韵以答
14252,示儿·始我来京师
362695,来京师·当代朱公叔
688491,余奉使朝鲜与其国相徐刚中唱酬颇熟别后不能不往来于怀也适张司译自朝鲜来京徐君赠以绝句三章蔼然寓见念之意披阅有感依韵赋焉
386303,绝句·忆从戊戌来京师
521453,沈廷用以尺籍事来京却归赋别
577253,得家书闻舍弟琦来京喜而有赋
248778,清角来京和问余斋主人
250431,仰斋丈以耄耋之龄只身来京会友席上相约游西山步其元韵
49072,归来·京国归来老更穷
296768,丙戌1886偕徐仞千陈梧冈两同年来京会试
250327,四月九日中午红叶自苏州来京邀饮并以名茶见赠
250409,日前与是务斋主叩石山人小酌言谈甚欢今日河北天放兄来京小聚席间得叩石来诗言及昨日事戏和
453291,海楼兄来京同登居庸关
460802,清角来京，和问余斋主人
381854,乙亥除夕·父兄持我来京日
513550,新安洪生通今郑州守有约之少子乡进士远之弟而予兄汀州贰守克和之婿也来京师从人受春秋学日以成岁暮欲将往省于郑且南还入郡学以俟秋试其志可谓健矣道别之际赋诗赠之
840539,周世臣同年来京师酒楼话旧即返汴梁见赠一诗次韵奉答
452052,高凉来京车上以诗见寄次韵迎之
250505,蓝天孤鹤兄来京烟沽野鹤设宴接风席间野鹤提议以有诗无酒不诗人为首句赋诗
452283,景秀兄侍父来京看病赋此以赠
637571,余奉使朝鲜与其国相徐刚中唱酬颇熟别后不能不往来于怀也适张司译自朝鲜来京徐君赠以绝句三章蔼然寓见念之意披阅有感依韵赋焉 其一
250245,辛卯孟夏海楼兄携女儿心莲来京盘桓数日时心莲才考中国美附中赋诗以赠
809840,浙闽总督范时崇陛见来京朕每念祖为开创宰辅父乃忠义名臣所以待之优重今因回任特书御诗饯送
362694,来京师·长安居不易
826641,祝英台近·鹊华秋梦图者，安巢居士閒情所托也。绣檀回枕，已歇余馨；落叶惊蝉，但曳残响。羽陵缘尽，挽不住飞絮光阴；淡粉楼空，问不出青禽消息。断云幽梦，写放翁坏壁之词；弱柳平桥，送苏小香车之路。钗凤眷回眸之月，笼鹦学留客之声。翠水秋寒，红衫人远。安巢乃贻书历下，索句宣南。秋色仿伯雨之图，影事托云轩之梦。仆本羁迟，同嗟沦谪。云愁霞想，抚枯树以兴怀；心倒肠回，借飞花而溅泪。子野之来京口，零落兜娘；澹心之记板
251236,海楼来京与居庸诸友同聚
1051833,刘生适中初业儒稍能文词气勇而不暴甚得乡士人心连蹇不得志以医游四方元祐七年来京师予与乔给事公权丰侍郎相之荐于朝入翰林为医官孙待制传师帅渭辟以从予哀生之志未得而喜其得贤主人以归也作是诗以送之
843007,黄忠端画所见古松为长卷作记七章载集中杨抟九孝廉尝携报国寺四松应天郊坛二松来京予题有诗后九年又出天台东西九松属题盖先德所藏已分为二中更豪夺近始索回案诸原记尚缺包山以下三章不知落谁手矣
834465,水龙吟 印昆以师曾拟香光仿北苑渴笔山水纨扇遗墨徵题，是癸丑冬间作，十年师曾始来京师，为赋二阕 其一
250534,壬辰春暮冷白来京小酌
153905,多景楼·自来京口足清游
250385,丙戌夏日与京城诗友设宴迎接蛰堪东遨燕婷来京步是务斋主韵
250509,景秀兄侍父来京看病赋此以赠
250379,高凉来京车上以诗见寄次韵迎之
461553,海楼来京与居庸诸友同聚
452376,壬辰七夕后一日雨如自唐山来京与社友小聚分天阶夜色凉如水为韵予得凉字
360301,来京师·江乡愁米贵
453212,三江兄来京席间忆及凉山限体分韵得头字
452300,辛卯五月既寄望，何言兄招饮，盖大董烤鸭店主人欲与诗人相识，特置酒请何言兄代邀，菜肴极尽精致，且配以诗词佳句，颇有风雅之意。适逢新疆星汉、广州东遨、西安田茂来京，与伯元、力夫、新河在附近酒店雅聚，不断来电相招，只得中途移席，赋此自嘲
794525,临江仙 得子宽粤中来札，知岁底决计来京，慰甚。作此
843008,病起赋谢克礼医师君有声沪上前岁归与欧战近来京师始与余相识岂佛家所谓缘耶
869968,石昌言学士宰中牟日为诗见寄久未之答今冬罢武成幕来京师此诗谢之
844502,水龙吟 印昆以师曾拟香光仿北苑渴笔山水纨扇遗墨徵题，是癸丑冬间作，十年师曾始来京师，为赋二阕
452093,日前与是务斋主叩石山人小酌言谈甚欢今日河北天放兄来京小聚席间得叩石来诗言及昨日事戏和
362702,杨西禾来京话旧且出前年见赠之作和之
827954,陶斋尚书作东坡生日宴集同人节庵师会张文襄公之葬亦来京师
837990,丙戌1886偕徐仞千陈梧冈两同年来京会试徐捷得工部陈考得中书余已入彀因对策伤时被放二君强欲留余在京过夏书此谢之
462121,三江兄来京小聚席间论及诗事时事皆无不惬遂约分韵得疏字
251221,花朝前日海楼来京分韵春和景明拈和字
286990,周世臣同年来京师酒楼话旧即返汴梁见赠一诗次韵奉答
250371,清明前一日晦窗来京小酌相约赋此
429357,姚君悫归揭阳营秋园既成北来京师作图索诗
452128,仰斋丈以耄耋之龄只身来京会友席上相约游西山步其元韵
809894,两广总督赵宏灿陛见来京
783021,李廉衣来京己两月矣遍寻不晤感赋 其二
250257,壬辰七夕后一日雨如自唐山来京与社友小聚分天阶夜色凉如水为韵予得凉字
637572,余奉使朝鲜与其国相徐刚中唱酬颇熟别后不能不往来于怀也适张司译自朝鲜来京徐君赠以绝句三章蔼然寓见念之意披阅有感依韵赋焉 其二
274891,薄游·迢递来京国
44069,大杰来京夜过有诗即饯其南还
