668460,十一月六日初度与客饮散独坐诵太白紫极宫诗有感次韵
97137,过潼川之飞乌县见余干丞相题驿舍诗有感次韵
247935,高阳台·秋感次韵彭郎
675566,宿兴隆有感次韵
402458,鹭江长啸洞读施李二公石刻唱和诗有感次韵
72959,吴中春感次韵
207661,宝泰寺读曾鸿父侍郎留题有感次韵作侍郎挽歌
754062,读厉樊榭集有和闺秀陈坤维丁巳闰九手检顾秀野元诗选卖供饘粥诗有感次韵
304858,新春杂感次韵和中山
990373,宝泰寺读曾鸿父侍郎留题有感次韵作侍郎挽歌
583515,直沽道中读张翠屏舟中纵笔适有所感次韵柬内翰石溪梁先生
583299,重阳房村驿有感次韵
1105729,和李士举陪提刑徽猷游中梁山临秀远轩以望江中平陆之胜承示佳句且叙故旧离合之感次韵二首
722159,奉和惠州王太守除夕杂感次韵
833384,二郎神 湘绮先生谒行宫归，赋此志感，次韵奉和
1062119,公实示閒字韵诗怅然有感次韵奉和三首 其三
1062118,公实示閒字韵诗怅然有感次韵奉和三首 其二
620498,寇乱后邝湛若访予滁署有诗志感次韵答之
972583,过潼川之飞乌县见馀干丞相题驿舍诗有感次韵
736418,新春杂感次韵和中山
387672,二郎神·湘绮先生谒行宫归，赋此志感，次韵奉和
679641,读骝山诸公所遗倡和诗有感次韵
336333,有感次韵·底用人前诵子虚
741672,瓯北谭祁阳往事有感次韵
596564,过邳北望有感次韵答同年吉水王畏斋
340875,公实示閒字韵诗怅然有感次韵奉和
384154,和羽可舍人《紫薇山房话感》次韵
197710,迷道有感次韵
1101369,观赵月林春雨诗卷有感次韵
855479,和李士举陪提刑徽猷游中梁山临秀远轩以望江中平陆之胜承示佳句且叙故旧离合之感次韵二首 其一
1062117,公实示閒字韵诗怅然有感次韵奉和三首 其一
1223678,泰定甲子上京有感次韵马伯庸待制
455807,书感次韵启宇先生
236217,象之晚坐有感次韵
717336,奉和惠州王太守除夕杂感次韵 其一
367774,观赵月林春雨诗卷有感次韵
1103221,有感次韵
465024,高阳台 秋感次韵彭郎
1122601,公实示閒字韵诗怅然有感次韵奉和三首
483401,吴中春感次韵
855478,和李士举陪提刑徽猷游中梁山临秀远轩以望江中平陆之胜承示佳句且叙故旧离合之感次韵二首 其二
862279,迷道有感次韵
717337,奉和惠州王太守除夕杂感次韵 其二
905082,象之晚坐有感次韵
306740,鹭江长啸洞读施李二公石刻唱和诗有感次韵
