548089,相工刘鹏北上过谒书示二首 其一
383761,王仁之明经北游过谒
533222,何山人以诗过谒答之
609943,游星岩过谒还素李公
569624,寄太平龙同知身之时儿子以试事过谒 其一
1042440,辛卯十二月同持国游会灵观各曾赋诗后一年会灵烧高下俱尽天子为先朝所为不忍废复治集禧略放渭阳帝祠制度五岳同宇毋乏事而已不能如向之钜丽也戊戌十二月以事过谒祠下作七言寄持国
545946,秀上人自永嘉过谒乞余言绍介汪司马公将以是秋驻锡黄山白岳间赋赠
522491,谪蜀过谒双忠之祠
670483,春夜许使君集送江生过谒李伯华太常江善鼓琴因句及之
811210,潮阳东山张、许二公祠为文丞相题沁园春词处，旁即丞相祠也，秋日过谒，敬赋二律
1062983,被檄诣益津过谒城自和元日所题诗
382917,相工刘鹏北上过谒书示
683544,寄太平龙同知身之时儿子以试事过谒
759443,潮阳东山张、许二公祠为文丞相题沁园春词处，旁即丞相祠也，秋日过谒，敬赋二律 其一
569625,寄太平龙同知身之时儿子以试事过谒 其二
547901,王仁之明经北游过谒
682248,相工刘鹏北上过谒书示二首
817864,杨少勤胡荫荪两生过谒寓楼别后寄
302525,杨少勤胡荫荪两生过谒寓楼别后寄
759444,潮阳东山张、许二公祠为文丞相题沁园春词处，旁即丞相祠也，秋日过谒，敬赋二律 其二
548090,相工刘鹏北上过谒书示二首 其二
