1088222,圭父约为金斗之游次韵献疑聊发一笑
327406,圭父约为金斗之游次韵献疑聊发一笑
1088226,奉酬圭父末利之作
962372,畅伯圭父子下第归乡携嗣由广文书并手佳章宠贶正旧读程门遗书知有潜道者列由求之间今见伯圭父子姓名不胜惊喜因问家世出处果潜道近族遂用其韵反其意出鄙语以谢庶几朋友相与切磋之义也
962372,畅伯圭父子下第归乡携嗣由广文书并手佳章宠贶正旧读程门遗书知有潜道者列由求之间今见伯圭父子姓名不胜惊喜因问家世出处果潜道近族遂用其韵反其意出鄙语以谢庶几朋友相与切磋之义也
885083,菩萨蛮 其二 次圭父回文韵
1088227,奉酬圭父白莲之作
327405,次圭父游将军岩韵
326635,奉酬圭父末利之作
230003,畅伯圭父子下第归乡携嗣由广文书并手佳章宠
326956,圭父为彦集置酒白莲沼上彦集有诗因次其韵呈坐上诸友
1088224,彦集圭父择之同饮白云精舍以醉酒饱德为韵熹分得饱字醉中走笔奉呈
1088312,圭父为彦集置酒白莲沼上彦集有诗因次其韵呈坐上诸友
1088221,次圭父游将军岩韵二首 其二
327407,次圭父观鱼韵
1088220,次圭父游将军岩韵二首 其一
1110911,次圭父游将军岩韵二首
1088228,次圭父观鱼韵
327323,奉酬圭父白莲之作
