740401,春仲八日皇十一子召集撷秀山房同人吉通政渭厓茅庶子耕亭钱殿撰湘舲咸在座
533786,同潘少承黄幼章过天宁寺访蔡山人子耕
882383,满江红 其四 次杨子耕韵
972504,次韵黄子耕因任伯起见寄之作
98371,因书寄黄子耕六言
768270,摸鱼子 耕客属题半完圃读书图，寿其外舅钱子湘先生
425360,季子耕处
973528,简黄子耕
96924,次韵子耕去秋临安归途见过于玉山智门寺之作
96605,简黄子耕·不见吾叔度
972874,奉寄子耕簿公尊兄兼呈德化令君丞公二首 其一
974534,因书寄黄子耕六言三首 其三
416944,高阳台 潮安除夜和韩子耕
371687,黄子耕监丞挽诗
974536,因书寄黄子耕六言三首 其一
974333,寄黄子耕
1123885,奉寄子耕簿公尊兄兼呈德化令君丞公二首
97403,奉寄子耕簿公尊兄兼呈德化令君丞公
96332,寄黄子耕·谁能一枉林间寺
278677,季子耕处·季子高风孰许攀
533709,同邝别驾中伯蔡山人子耕幼子邦理登九成台
307806,高阳台·潮安除夜和韩子耕
98654,闻子耕司户兄非一日昨见墨帖于中州又诵五言
1093236,谢黄子耕惠纸被时在钱塘乍冷无衾窘甚
974535,因书寄黄子耕六言三首 其二
533195,过真如寺乾上人访蔡文学子耕
972448,次韵子耕去秋临安归途见过于玉山智门寺之作
972873,奉寄子耕簿公尊兄兼呈德化令君丞公二首 其二
973333,寄黄子耕
973074,闻子耕司户兄非一日昨见墨帖于中州又诵五言长篇于刘子澄许今兹乃遂识面辄题鄙句以叙区区
96328,寄黄子耕·野寺已黄昏
96952,次韵黄子耕因任伯起见寄之作
532853,食荔枝贻李季常兼柬欧经季欧子耕
95462,子耕录寄老圃赋及千秋观诸诗寄谢
1124263,因书寄黄子耕六言三首
972199,子耕录寄老圃赋及千秋观诸诗寄谢
1094296,黄子耕监丞挽诗
