833481,鹧鸪天 其一 九月初三夜宿华清，用香山旧句成解
845736,水调歌头 寿赵阆州五月初五
790593,五月初四日旅邸书怀四首录二 其一
449508,癸酉十二月初九日清游罗浮天寒而弗见梅花第一次来游与荆妻时未结缡前后忽忽四十年逝水流光能不慨然
319307,正月初二日同杨叔娇登楼望馀雪
895015,十二月初七日述怀
107119,六月初一日次韵酬元煇
469201,八月初四日纪事二首 其一
160169,花心动·江月初升
985067,正月初八日同莫少虚蒲大受王园泛舟各赋二首 其二
53406,丙子七月初侍日讲纪述
730386,正月初二日同杨叔娇登楼望馀雪
1138601,太常引 四月初八日庆六十
517986,乙未夏五月初三日夜梦侍朝因追想平日所见成绝句三十八首 其十五
306268,三月初九日召见养心殿
874557,九月初十日值宿玉堂七绝 其一
384998,十月初十日召对乾清宫，面奏陈情，蒙恩准回籍养亲，恭纪
793684,六月初二日，圆明园引见，口占纪恩四首 其三
417623,永遇乐 己巳三月初四寿绿腴君次坡公韵
106242,八月初二日·蝉声渐渐怯西风
930491,上章纳禄恩畀外祠遂以五月初东归五首 其五
853414,五月初四大水
750118,再去温州蔡枳篱同年以诗赠行依韵答之已巳十一月初一日也
874576,二月初七日寿溪十绝 其四
719809,后秋兴八首八月初十日，小舟夜渡，惜别而作 其五
769200,腊月初一日燕子矶遇陈棣园、典胄父子
1004318,木兰花慢 八月初四
330133,偶题六绝·不觉六月初八日
332861,三月初九夜有感
191592,十二月初六日抵仪真廨舍次日即出护使客天气
825195,十二月初一日梅厅展墓 其二
576534,正月初四日南郊礼成
722656,后秋兴八首九月初二日，泛舟吴门而作
1134622,正月初三日水西寺
972128,十二月初六夜梦客溧阳半月而未见晦庵梦中以见迟为并作诗谢之首句云平生知己晦庵老岁晚方怀见晚羞寐而诊曰羁于一官久去师门精神之感形见如此耶用其句赋诗一章寄上
452970,甲戌八月初三日海宁观潮
1079601,六月初三日雨后步至城东
348517,过江宁·江月初低碧溪沈
1025928,八月初七日终夜大雷震雨如倾注风败吾藩篱拔吾庭树
846914,鹧鸪天 寿尊长十一月初十
1134422,八月初一日
1119652,三月初晚晴寄高缙之三首
903149,正月初四日听新乐成绝句 其三
540550,满庭芳 傍有何山亦佳闰六月初七夜戏为天孙赋此
71590,酹江月·初机学道
825824,二月初六日进呈二诗 其二
1066697,十二月初四日游吴山院
1125731,正月初八日同莫少虚蒲大受王园泛舟各赋二首
453179,甲午正月初八京师大雪
160899,九月二十九日到思溪庄避人事十月初四日过生
385823,戊辰二月初九日为内子陈淑人冥诞感赋
382391,二月初八日携舅家弟妹重上大观楼
182056,六月初八义荣司谏自福庆山见过奉陪游四岩以
657028,二月初二日梦 其二
717371,八月初八夕咏月 其二
428039,浣溪沙 叶笑雪君江山故里，食贫治史绝勤，书来云正月初五日为其五十诞辰，拈此寄祝
522254,三江石潭寄和天津晓发诗且得十月初报次韵
428017,水调歌头 夏历八月初一日为顺宜长女诞辰，不觉正满四十岁，诸弟妹相约称觞，老人赋此助兴，写寄厦材长男一笑
930402,九月初作
1095307,正月初六观灯
835461,女冠子 其二 二月初一
874554,九月初十日值宿玉堂七绝 其六
1112060,六月初雨中渡西湖因至道人庵烧佛香略憩灵隐与乡僧同啜茶乘晚以归
846424,洞仙歌 寿宫教八月初九
1134390,九月初八日
943608,三月初晚晴寄高缙之三首 其二
679957,四月初一到和州府家城驿
825225,三月初五日携家人往龙华观桃花至则已谢 其三
825131,七月初一日作
458436,减兰　四月初归云溪
1005169,丙子兵祸台温为烈宁海虽经焚掠然耕者不废丁丑粗为有秋但种秫者少以醉人为瑞物吾亦似陶靖节时或无酒雅咏不辍也八月初九日连日雷雨溪路阻绝山房岑寂此夕初霁浊酒新漉数酌竟步秋树阴潭鱼可数望前峰老枫数十株已无色白鸟飞翻去来是中有惠崇大年笔家人遣两力来迎因倒坐篮舆而归人或问之戏答曰吾日莫途远故倒行也记以三绝 其二
424868,七月初八自东街天灯弄移寓城外南洲百感交集因有是作
846768,满庭芳 庆生日又生子五月初一
845706,木兰花慢 寿制干三月初七
303783,雨中花慢·四月初二日阴雨，访彦通屯云馆，联句用东坡韵
42785,于中好·七月初四夜风雨
1005122,十一月初三日插梅花古罍洗中因成四绝 其四
591885,十月初度都下值防虏甚急感怀寄诸弟五首 其四
793053,四月初二日生日有感
705618,戊寅九月初三日奉谒少师高阳公于里第感旧述怀三首 其三
719804,后秋兴八首八月初二日闻警而作 其八
705610,十一月初六日召对文华殿旋奉严旨革职待罪感恩述事 其一
458065,正月初五车行临湘道中 其二
277557,浣溪沙·正月初三新月
347854,元祐三年八月初六日得报已有代者归期可数喜动于中载形歌咏
517995,乙未夏五月初三日夜梦侍朝因追想平日所见成绝句三十八首 其二十四
352444,十月初五日自白门之丹阳宿于驿亭中是夕风雪大作
825716,四月初五日夜直 其七
846848,鹊桥仙 寿女人七月初八
322448,解连环·丁巳闰六月初七夜为牛女解嘲，和悔堂、远春两弟作
631269,二月初九日山楼竖栋示诸子
362696,九月初二日晓雪
825708,三月初十日夜直 其四
292650,水晶帘·碧天如幕月初三
938743,七月初十夜对月呈留粹中
453108,正月初四大雾
772973,六月初七日夜获甘霖连日大雨滂沱赋此志喜
1005120,十一月初三日插梅花古罍洗中因成四绝 其二
793685,六月初二日，圆明园引见，口占纪恩四首 其四
1138483,七月初七夜渡黄河
381625,庚午二月初九夜
106449,正月初二日晴过常州
846709,满江红 七月初四
737642,丙午十二月初七日下狱次日得旨发军前效力赎罪感恩述事次东坡狱中寄子由韵寄从弟佩苍实夫 其二
518007,乙未夏五月初三日夜梦侍朝因追想平日所见成绝句三十八首 其三十六
149583,十月初七日入郡涂中作
448787,己卯正月初三和刘逸老
949002,沁园春 寿楚阳赵宰四月初二
19367,三月三日·画堂三月初三日
517991,乙未夏五月初三日夜梦侍朝因追想平日所见成绝句三十八首 其二十
107194,九月初四日大风雨近重阳无酒夜成
809879,康熙五十四年十月初三日避暑山庄恭祝皇太后万寿诗
365879,九月初三夜招袁重黎柯巽庵梁节庵王晋卿诸君小饮和节庵韵
657044,七月初九日梦
813082,二月初三日为先母忌辰舟中感赋二首
825705,三月初十日夜直 其一
839393,九月初六日寄怀刘石香二首 其一
1135759,七月初一日晚大恶风而雨
838376,丙申九月初三日有感
829412,七月初四日夜直时复园寥志正游焦山杂忆山中诸胜小诗寄之
262280,杂感·八月初三可怜夜
631279,曩在海云偶得一天风雨沉山阁之句时尘异诸子侍坐命作对语尘异以万古云烟锁石门应予心异之己未八月初七入双镜楼忽忆前事正当斯时因用旧句足成一律以识梦中之境始信人之心愿原非虚设也
1144069,正月初四后十馀日病嗽不能出杂书十首
842955,六月初一日漱芳斋听戏 其四
253142,壬辰二月初六雪晴超山赏梅
460539,鹧鸪天　元月初作
766610,齐天乐 题龙岩临清杀贼图，咸丰甲寅三月初七夜事
753258,见十二月初七日邸钞作
107192,九月初一日·满城风雨夜初长
145884,发吉州·己卯六月初一日
705611,十一月初六日召对文华殿旋奉严旨革职待罪感恩述事 其二
12498,行见月·月初生
156097,子瞻在惠州以十月初吉作重九和渊明已酉九月
375598,正月初六观灯
146352,戏马台·九月初九日
196720,七月初十夜对月呈留粹中
339602,十月初六夜偶成
748775,十一月初六发平夷初出滇境怅然成咏
828301,八月初九夜梦至一处案上书装册甚古翻视为魏晋六朝人诗梁诗标曰梁言齐曰齐言妙趣纷纶盎有馀味醒后追忆不得遂拟二首彷佛所见云 其一
825706,三月初十日夜直 其二
58750,八月初三夜月
577363,三月初二发京师
96736,二月初二日·所见与所闻
825226,三月初五日携家人往龙华观桃花至则已谢 其四
325185,五月初七日梦中得起二句醒起续成之
246013,西江月·初夏崇明见广玉兰花发
972099,二月初十日自荻浦绝湖三首 其二
300327,朝朝三月初九
237363,三月初四夜宿僧庐
705614,十一月初六日召对文华殿旋奉严旨革职待罪感恩述事 其五
820088,九月初三夜遣怀
901953,余于今年二月初一日夜梦中与刘彦礼兄弟水边饮酒赋诗曾记所作元八句忘其馀今足成之
719832,后秋兴八首九月初二日，泛舟吴门而作 其四
355667,沁园春·寿许宰二月初一
885951,辛亥三月系舟潇湘得邵武柳州二丞相正月初书抚事感怀寄此长句
1129479,正月初一酬盘隐陆别驾再雪得封字初三夜醮遇风得泾字
719867,后秋兴八首辛丑二月初四日，夜宴述古堂，酒罢而作 其七
719808,后秋兴八首八月初十日，小舟夜渡，惜别而作 其四
834528,三姝媚 其一 丙寅八月初五夜预中秋和金梁梦月词韵
785851,九月初三夜招袁重黎柯巽庵梁节庵王晋卿诸君小饮和节庵韵
1005119,二月初三日曝睡
902403,正月初四日听新乐成绝句 其二
517992,乙未夏五月初三日夜梦侍朝因追想平日所见成绝句三十八首 其二十一
541028,十月初寒围炉小饮
838200,闻樨学舍将于腊月初五日解馆。初四夜，灯花忽开，喜而志之 其二
983454,昨暮侍玉霄亭坐新月初上凉风叠至配以丹荔白醑景物且美赋诗呈知府丈
745436,正月初八日与少史访烟霞洞复历理安寺五云山云栖诸胜 其三
471971,纪赐四十首 其一 丙子二月初与经筵进讲纪述
1134520,五月初十日病体少苏
314818,玉阑干·二月初八日大雪作
252593,庚寅四月初三哭别辛磊兄夜独步康园见荆花纷纷泣赋
758923,多丽 秋光萧瑟，抚景增愁，填此遣兴兼悼归程氏先姊。时九月初七，姊亡日也
572937,丁酉十二月初六初度 其四
85337,三月初八夜
846362,临江仙 贺人寿有父有兄弟十一月初三
824965,七月初十日入永定门
1028707,十二月初六日抵仪真廨舍次日即出护使客天气严寒里河冰合有厚一二尺者打冻峻急不免取山路径走都梁
814048,六月初二日，圆明园引见，口占纪恩四首
447345,临江仙 辛已正月初十夜立平良图伉俪招饮并赐丹青，归已淩晨也，倚枕赋此
517990,乙未夏五月初三日夜梦侍朝因追想平日所见成绝句三十八首 其十九
905031,鹧鸪天 寿吴倅九月初七
770290,六月初一日
874580,二月初七日寿溪十绝 其八
766536,齐天乐 其一 三月初十日舟过临平
845972,归朝欢 寿监丞四月初十
828997,庚午二月初二日为怡园主人六旬双庆暨母夫人八秩华诞社友具餪筵为寿二首
825472,二月初一日雪中作
808938,二月初八日携舅家弟妹重上大观楼
308567,烛影摇红·丁卯正月初三夜，与闺人烧烛候春
719864,后秋兴八首辛丑二月初四日，夜宴述古堂，酒罢而作 其四
874583,二月初七日寿溪十绝 其九
972100,二月初十日自荻浦绝湖三首 其一
1206399,水龙吟 寿夏改斋闰八月初二
719845,后秋兴八首庚子阳月初一，拂水拜墓作 其一
825136,八月初十夜即事
656886,丙午十月初三日梦
682213,纪赐四十首 丙子二月初与经筵进讲纪述
825197,十二月初九日渡海 其二
178347,六月初七日雨小止游蒲溪临独木桥而还
1155056,木莲树生巴峡山谷间巴民亦呼为黄心树大者高五丈涉冬不凋身如青杨有白文叶如桂厚大无脊花如莲香色艳腻皆同独房蕊有异四月初始开自开迨谢仅二十日忠州西北十里有鸣玉溪生者秾茂尤异元和十四年夏命道士母丘元志写惜其遐僻因题三绝句云 其三
87114,二月初七日寿溪十绝
333455,新月·初月明生小
302289,七月初六日赴沪海上大风
829878,南楼令 正月初六日茸城归舟，风雨不已，写此寄慨
661127,三月初七日驾幸太学喜而有作
176833,甲戌八月初九夜武康山中洪水骤发越十日漕司
719849,后秋兴八首庚子阳月初一，拂水拜墓作 其五
325235,十月初五日抵里
664826,三月初九日过浒西看牡丹 其一
171001,玉楼春·三月初三春渐老
1134432,十一月初八日观雨
772637,七月初九夜月
768821,金缕曲 七月初五朱草衣五十初度
222611,甲辰九月初访晦庵先生大安道中余正叔韵
833238,满庭芳 九月初三夜写香山诗意
407859,海滨  1990年8月初旬
517972,乙未夏五月初三日夜梦侍朝因追想平日所见成绝句三十八首 其一
406297,四月初二日游兰州小西湖
825823,二月初六日进呈二诗 其一
714466,奉题方尔止戊申年正月初四日恭谒孝陵感怀诗后
719834,后秋兴八首九月初二日，泛舟吴门而作 其六
759957,三月初八夜
966503,水调歌头 寿黄邦彦四月初八
708825,醉花阴  云暑五月初见芍药
515478,四月初六日杨村道中遇暴风野泊入夜尤甚舟人大恐皆不寐待旦灯下有感
993445,千秋岁引 寿女人八月初二
1005395,四月初四日正仲子堂可大及梅所周鍊师会耕养堂
1093756,正月初六日
825698,二月初五日内务府夜直
185713,庚午三月初九日寒食有感
585659,十一月初七早还与县尹章碧湖
813864,咸丰癸丑二月初九日贼攻金陵愈急见势难支即手书绝命词二首 其二
958868,八月初五梦桃杏枝上皆小蕊顷刻间一花先开既而次第皆拆色殊红鲜可爱梦中为赋一诗觉但记其第二句戏足成之
809786,嘉平月初雪后晚坐偶有所见书怀
459536,二月初见作二首 其一
517977,乙未夏五月初三日夜梦侍朝因追想平日所见成绝句三十八首 其六
1005823,阴雨几月馀三月初一日闻鸠鸣有作
237361,三月初五日先秘阁忌
817711,十一月初一夜重读邓秋门遗诗
1093762,三月初二日
1030336,水调歌头 其一 贺赵可父七月初六
825907,庚午二月初九夜
829711,二月初六日进呈二诗
337030,秋晚二绝·凉月初欣薄露天
833938,疏影 昵鶄廔主家在虞山，尝与泛舟尚湖，招凉度夕，时水空天远，星晚月初，湖风吹衣，山翠倒影，夜色中光景奇绝，既泊舟中流，乃弛衣敷簟，并枕鹢首而卧，飞星掠鬓，斜河映胸，共道欢爱则言笑晏晏，相怜同病则悽然俯仰，自以为逢伯陵季荝以来无此乐也。聊赋此调，以追旧欢
456214,鹧鸪天 正月初十至十六日率学生十二名至香港圣保罗男女中学交流学习，宿半山区宝恒苑三首 其二
462769,丙申马月初一，居庸诗社绮梦楼年会。分放翁咏屈平祠之“祇有滩声似旧时”句，依齿得有字
1005719,十二月初六日龟藏夜坐有感
865846,六月初二日作
366014,齐天乐·三月初十日舟过临平
710715,甲辰二月初六甘露降
381498,十一月初三日奉乘舆幸日本使馆
459537,二月初见作二首 其二
696154,二月初二日梦
809848,五十三年冬旱十二月初二日大雪二十一日又雪途中偶成
430802,四月初一纪事二首 其一
1005718,十二月初八日晓梦归故园
882980,腊月初七日夜梦游山林间清甚赋诗半就觉而忘之追成八句
31397,离家·八月初长夜
134279,再使河北·桑麦青青四月初
1084170,六月初雨中渡西湖因至道人庵烧佛香略憩灵隐与乡僧同啜茶乘晚以归 其三
1216193,过雁荡山东行程一舍许名历澳岛无风而雨气蒸如暑眠不帖席留此三日不得行时盖十一月初也
419504,鹧鸪天 癸巳夏四月初二日，闻夏吷庵丈敬观下世作。
263222,九月初六日寄怀刘石香
174392,正月初八日同莫少虚蒲大受王园泛舟各赋
129996,五月初四大水
518000,乙未夏五月初三日夜梦侍朝因追想平日所见成绝句三十八首 其二十九
157903,十二月初八日晓梦归故园
591884,十月初度都下值防虏甚急感怀寄诸弟五首 其三
719831,后秋兴八首九月初二日，泛舟吴门而作 其三
416947,长亭怨慢 乙亥三月初八日，大水冲城，往还阻绝，夜复风雨交作，因篝灯倚此
427703,玉阑干 二月初八日大雪作，用杜安世声韵
866921,水调歌头 三月初三
238287,倾杯乐·璧月初圆
839676,二月初十日，缮葺宗祠，因往督工，有感而作
180357,飞乌与正老相值盖十月初见之梦兆云
456215,鹧鸪天 正月初十至十六日率学生十二名至香港圣保罗男女中学交流学习，宿半山区宝恒苑三首 其三
807924,贺新郎  腊月初六日是余生日即亡妇忌辰也词以志痛仍用前韵
157883,十一月初三日插梅花古罍洗中因成四绝
695627,三月初诣祖父母父母各墓所
977236,九月初四日分韵得然字
450056,五月初亦觉轻寒而感
1103904,九月初七夜寓双溪精舍
157797,七月初四日赋紫薇花
452880,壬辰二月初十雨中超山赏梅
322401,多丽·秋光萧瑟，抚景增愁，填此遣兴兼悼归程氏先姊。时九月初七，姊亡日也
838201,闻樨学舍将于腊月初五日解馆。初四夜，灯花忽开，喜而志之 其三
833606,一枝花 其三 三月初九日过西园，薄阴酿雨，花木皆有寒色，再叠前韵
381663,八月初十夜即事
790707,十月初五日抵里
722660,后秋兴八首辛丑二月初四日，夜宴述古堂，酒罢而作
1244345,六月初十日客馆披凉寄伯刚文学盖伤于处者也
1005717,十二月初一日醉歌
105895,十月初六日同仇仁近至王子由庵遂饮白云李居
355145,正月初三日送叔宜弟初离襄阳
705612,十一月初六日召对文华殿旋奉严旨革职待罪感恩述事 其三
1110697,宣和五年二月初九日偶书呈如公妙空禅师
270077,行香子·九月初三，和螺川韵
979812,十月初七日入郡涂中作
1134621,正月初二日晴过常州
846414,柳梢青 寿人母五月初六
1224215,六月初十夜雨止玩月有感
719848,后秋兴八首庚子阳月初一，拂水拜墓作 其四
829605,三月初五日携家人往龙华观桃花至则已谢
307465,六月初一日漱芳斋听戏
1138802,八月初游君山谊斋有诗同赋二首 其一
822195,雨中花慢 四月初二日阴雨，访彦通屯云馆，联句，用东坡韵
17685,早蝉·六月初七日
1065307,云盖生日三月初七报慈僧持真求赞
958206,十月初梦寄良嗣诗三句云相思一载馀身随云共远梦与汝同居觉而足之
784014,十二月初二日以签掣四川引见乾清宫
1025978,西江月 十一月初六日夜偶成
745434,正月初八日与少史访烟霞洞复历理安寺五云山云栖诸胜 其一
825862,十一月初一夜四鼓寄稚辛
314839,上林春·癸酉二月初二日探梅邓尉，花枝寒勒，含蕊未放感时抚事，短咏抒哀
1203982,鹧鸪天 元贞元年九月初五日
387730,桂枝香·己亥五月初七夜
553127,五月初一日太守试阖府县诸生命予为主试初六日揭晓太守有诗次韵
1236807,七月初二夜，洪州对月，怀伯丈亲舍
477004,戊申正月初宿休园
455334,翠圆枝 癸巳腊月初五观梅偶得
829704,三月初十日夜直
212618,六月初二日作
355666,木兰花慢·八月初四
508881,辛未八月初四日奉天门朝见口号
560019,和编脩许道中腊月初三日诞诗三首 其二
861209,九月二十九日到思溪庄避人事十月初四日过生朝方归初三日早恕子遣人来送酒食并词二阕因成唐律二首 其二
1237883,甲午年正月初四日得春
559464,三月初诣祖父母父母各墓所 其四
417598,夜游宫  壬戌十月初六日勺庵怀先母作
1005343,十月初七日山中感兴
1228193,六月初十日雨止月出坐大桂树旁西风先秋
319505,迁杭有感·冷雨埋春四月初
314958,鹧鸪天·癸巳夏四月初二日，闻夏吷庵丈敬观下世作
846895,醉蓬莱 寿龙图有父母十一月初四
825196,十二月初九日渡海 其一
811821,正月初八日与少史访烟霞洞复历理安寺五云山云栖诸胜
883898,宣和五年二月初九日偶书呈如公妙空禅师 其二
830348,十月初十夜鼓浪屿月中
1005335,十一月初三日夜有兴寻梅
771745,六月初七日午雨暴注，少刻即晴，偶得绝句四首 其四
427671,上林春 癸酉二月初二日探梅邓尉，花枝寒勒，含蕊未放感时抚事，短咏抒哀
607904,二月初一怀亲讳日
846724,满江红 寿尚倅三月初六
1005320,七月初四日赋紫薇花
845751,水调歌头 庆史守正月初四
993447,满江红 四月初六
969339,水龙吟 寿太守九月初一
719798,后秋兴八首八月初二日闻警而作 其二
970862,沁园春 其二 寿朱漕正月初八
366792,正月初五日杜城集
846930,鹧鸪天 五月初十
604479,八月初八夜宿赵氏浮翠堂观儿辈入试
157881,十月初七日山中感兴
874578,二月初七日寿溪十绝 其十
92783,六月初四日往云际院田间雨足喜而赋之
517973,乙未夏五月初三日夜梦侍朝因追想平日所见成绝句三十八首 其二
1135895,正月初四后十馀日病嗽不能出杂书十首 其九
459837,正月初一归自临湘记青坡景
941261,八月初五日有怀旧事
36029,赋新月·初月如弓未上弦
705619,戊寅九月初三日奉谒少师高阳公于里第感旧述怀 其二
1252081,六月初七夜与岭南族中长少二十二人乘月泛西湖示诸同游
70719,酹江月·初心奉道
381290,四月初五日夜直
1005333,八月初十日疟起行园
722658,后秋兴八首庚子阳月初一，拂水拜墓作
1095015,正月初三日丁使君送三绝句梅诗 其二
178238,六月初八日过龙洞纳凉树阴下酌泉待月而行
217169,偶题·窗涵山影月初斜
552714,十二月初四日夜三更梦睡觉蛀齿脱落口占一绝今年五十七岁数其齿蛀时则二十有八年矣
106131,七月初一日淮浙大潮巨风亘古所无
705613,十一月初六日召对文华殿旋奉严旨革职待罪感恩述事三首 其二
314437,七月初八自东街天灯弄移寓城外南洲百感交集因有是作
771743,六月初七日午雨暴注，少刻即晴，偶得绝句四首 其二
107698,正月初七日如江西以畏饮辞吴式贤宅宿向果市
1099059,十月初五日自白门之丹阳宿于驿亭中是夕风雪大作
995207,满庭芳 寿黄状元三月初八
250725,壬辰八月初八石窝镇雅聚分韵得破字
825707,三月初十日夜直 其三
404851,望江南·戊子五月初三夜自台北趋基隆，即夕登舟北归
1006780,西江月 其二 三月初六日席上代监酒和
157709,八月初三日五更梦觉追记
107941,四月初四日闻绩溪凡十五都贼焚欲尽傍出焚歙
517988,乙未夏五月初三日夜梦侍朝因追想平日所见成绝句三十八首 其十七
874574,二月初七日寿溪十绝 其三
816913,丙午十二月初七日下狱次日得旨发军前效力赎罪感恩述事次东坡狱中寄子由韵寄从弟佩苍实夫
20,辽城望月·玄兔月初明
283439,三姝媚·丙寅八月初五夜预中秋和金梁梦月词韵
251730,浣溪沙·丁亥子月初雪
381773,七月初一日作
381682,二月初五日内务府夜直
157880,十月初三日追记丙子岁以此日风寻中度平坑岭
722669,戊寅九月初三日奉谒少师高阳公于里第感旧述怀三首
517979,乙未夏五月初三日夜梦侍朝因追想平日所见成绝句三十八首 其八
381668,十二月初九日渡海
1128341,丙子兵祸台温为烈宁海虽经焚掠然耕者不废丁丑粗为有秋但种秫者少以醉人为瑞物吾亦似陶靖节时或无酒雅咏不辍也八月初九日连日雷雨溪路阻绝山房岑寂此夕初霁浊酒新漉数酌竟步秋树阴潭鱼可数望前峰老枫数十株已无色白鸟飞翻去来是中有惠崇大年笔家人遣两力来迎因倒坐篮舆而归人或问之戏答曰吾日莫途远故倒行也记以三绝
1242095,八月初二日喜雨次林秉彝韵
668696,八月初九日见月
96787,六月初九日晚大雨简文显子畅
902404,正月初四日听新乐成绝句 其一
830562,四月初六夜同病山泛舟鉴湖
825224,三月初五日携家人往龙华观桃花至则已谢 其二
804526,自题小照原注：戊戌四月初六日吴学署中作
1242037,洪武三十一年闰五月初十日亥时大行皇帝崩十六日皇太孙即位十八日大赦天下改明年为建文感而恭赋
780292,蝶恋花 九月初二夜雨过垂虹桥，书感同梦西
107718,夜望·夕阳已下月初生
325191,五月初四日旅邸书怀
632351,自八月初病耳至十一月不愈
266624,忆旧游·甲午七月初三日五十一初度
802878,满江红 十一月初一纪游
731214,戊子六月初七日扬威将军大学士威勇公长龄至京亲缴印信御勤政殿行抱见礼诗志欣庆
845698,木兰花慢 寿主簿十一月初五
495018,甲午正月初七日于严介溪公所寓山池作瀛洲会是日会者八公分得七言长句体为八仙歌
106456,正月初四后十余日病嗽不能出杂书
157948,五月初四日浴阁成
708593,小重山 八月初九日风雨寒甚昼眠有作
106413,七月初一日晚大恶风而雨
279219,龙山会·九月初二日同克群散步南洼，寻龙树、龙泉、凫潭诸胜
297278,闻樨学舍将于腊月初五日解馆。初四夜，灯花忽开，喜而志之
518001,乙未夏五月初三日夜梦侍朝因追想平日所见成绝句三十八首 其三十
845976,永遇乐 寿族兄正月初六，与定光佛同日生
1244548,三月初五日偶题
552213,闰八月初十夜酌樊淑鲁为余诵田御宿邀赏望夜之作口占次韵
