719983,戊寅九月初三日奉谒少师高阳公于里第感旧述怀三首 其二
1005749,五月初四日浴阁成
250226,江右诗社相邀于庚寅三月初三丰城雅聚先赋此篇以寄
591882,十月初度都下值防虏甚急感怀寄诸弟五首 其一
1005334,八月初三日五更梦觉追记
743857,七月初四日喜晴
1155055,木莲树生巴峡山谷间巴民亦呼为黄心树大者高五丈涉冬不凋身如青杨有白文叶如桂厚大无脊花如莲香色艳腻皆同独房蕊有异四月初始开自开迨谢仅二十日忠州西北十里有鸣玉溪生者秾茂尤异元和十四年夏命道士母丘元志写惜其遐僻因题三绝句云 其二
370422,三月初三日
650086,八月初九日初闻雁
821863,阳春曲 三月初一日夜归，遇旧曲，怅然成咏
874575,二月初七日寿溪十绝 其一
203022,甲辰闰月初伏快雨凉风昼眠初觉庭前小栏花木
660111,五月初七日恭遇先帝忌辰不胜悲恸强成一律用写哀悰
719868,后秋兴八首辛丑二月初四日，夜宴述古堂，酒罢而作 其八
790106,七月初五，夜梦一老人，携登亭台，饮予以酒，命咏二绝。时酒气在喉，残镫映窗，披衣记此 其一
953379,大江词/念奴娇 寿仙尉十一月初一
1084168,六月初雨中渡西湖因至道人庵烧佛香略憩灵隐与乡僧同啜茶乘晚以归 其一
758918,解连环 丁巳闰六月初七夜为牛女解嘲，和悔堂、远春两弟作
517997,乙未夏五月初三日夜梦侍朝因追想平日所见成绝句三十八首 其二十六
452777,西江月 初夏崇明见广玉兰花发
874582,二月初七日寿溪十绝 其五
657039,十月初三日梦
87268,池上对月·初插玉梳小
302503,十一月初二雪夜归作寄伯扬
157534,二月初二日山中感兴
559462,三月初诣祖父母父母各墓所 其二
704777,天顺元年六月初十日上章告老未允十一日又请十三日又请至二十一日蒙允出京师舟中赋七首
403638,醉吟商小品 四月初一夜闻杜鹃，是夜履平来宿，遂邀同赋。履平有《踏莎行》一首甚美，惜今佚其稿
413779,丙午 夏历二月初九日
746800,壬戌五月初三夜忽中风痹之疾香山所谓体瘝目眩左足不支与有同病焉昔苻坚得习凿齿于汉南因其蹇疾裁堪半丁香山诗云汉上羸残号半人是也余年已七十可以称翁因自号半翁纪之以诗 其二
81002,九月初作·富贵功名未足云
42486,三月初八日幸圆明园
1005338,十二月初七日补缀旧诗寄正仲
771742,六月初七日午雨暴注，少刻即晴，偶得绝句四首 其一
157902,十二月初六日龟藏夜有感
930404,九月初作四首 其一
846862,酹江月/念奴娇 庆母在作生日五月初七
807452,念奴娇  八月初七夜对月呈李湘北太史
883897,宣和五年二月初九日偶书呈如公妙空禅师 其一
1005344,十月初三日追记丙子岁以此日风雪中度平坑岭入马耳峰
300367,永遇乐·己巳三月初四寿绿腴君次坡公韵
817984,九月初六日雨中读陶集
454804,九月初三夜即景一个月无诗，今夜破戒
768820,千秋岁 四月初一日金其旋表兄五十初度寄祝
1005713,八月初十日夜露坐场圃新月半破前溪夜舂俯仰寥泬小儿子周在侧忽引翁袖曰月照山重也聊记其语
157728,九月初十日山房午睡恍见梅枝已吐白矣惊喜而
1241874,腊月初二夜雪
780776,好事近 欠月初十日即事
422620,长亭怨慢     四月初十作
294769,十二月初·顿抛残霰噤神鸦
616120,正月初六同饮天恍宗侯 其一
848479,烛影摇红 五月初三
264498,九月初三夜遣怀
96735,二月初二日
450081,二月初春晨行于野径
307803,长亭怨慢·乙亥三月初八日，大水冲城，往还阻绝，夜复风雨交作，因篝灯倚此
839039,六月初二恭逢先慈忌日，趋拜墓田
615348,三月初十日见盘莲花贻伍子
1138648,二月初八日左丞相吴坚右□□□□□枢密使谢堂参政密
157858,四月初四日正仲子堂可大及梅所周鍊师会耕养
972096,二月初二日二首 其二
825740,十月初十日贵州丸舟中夜起
478309,三月初峡山道中
842805,三月初九日召见养心殿
232485,玩月·初生如金钩
657030,五月初二日梦
96734,二月初八日·只道贫无置锥地
107198,九月初六日客报吾州初一日大火城中俱尽吾家
135173,十月旦尚暖用夹公服二月初吉雪寒甚服单
829633,十一月初三日奉乘舆幸日本使馆
302265,十二月初六日书寄刘三贞壮曼殊寒隐
960005,九月初吉永嘉苏太古同游金华洞夜宿鹿田寺用杜陵山馆诗韵以赠
211819,永遇乐·璧月初晴
400779,蝶恋花·乙未四月初四日倚装赠内
459721,肖六月初一即二十九岁生日，倘循古习，当贺三十矣。予作此游戏之诗而命以堂皇之名，曰《而立篇》，持赠肖子，将以讨酒吃耳。借打油之诗而行揩油之实，打油而得以打秋风，此吾之乐，固不下于寿翁也
1143883,丁亥十一月初八日南至二首
930403,九月初作四首 其三
846774,满庭芳 十月初五
846121,庆清朝 寿吴宪六月初三
652250,天顺元年六月初十日上章告老未允十一日又请十三日又请至二十一日蒙允出京师舟中赋七首 其二
915100,六月初四日往云际院田间雨足喜而赋之二首 其一
191595,三月初一日晴色甚快人意晚宿撮石岭陈氏书院
833492,桂枝香 己亥五月初七夜，寿平招同古微、逊庵观名伶桂凤演《宛城》一剧，赋此赏之
250332,正月初五京城醉归口占
825713,四月初五日夜直 其四
518002,乙未夏五月初三日夜梦侍朝因追想平日所见成绝句三十八首 其三十一
612220,李自得古稀加一十月初十届初度期余已陈诗称觞适有馈黄白二菊者灼灿照筵悠然欣赏再赋为寿
642601,月初生行
157882,十一月初三日夜有兴寻梅
235536,卜算子·昨夜月初圆
845612,上阳春/蓦山溪 寿人夫妻二子同日十月初二
373793,闻杜鹃·山月初明草树凉
1135894,正月初四后十馀日病嗽不能出杂书十首 其十
140943,正月初四日听新乐成绝句
972165,三月初二日雨人以为风止之祥
719836,后秋兴八首九月初二日，泛舟吴门而作 其八
891957,和晏太尉三月初五日
701874,乙未夏五月初三日夜梦侍朝因追想平日所见成绝句三十八首
286834,巧月初三日，乐平新妇自北漍归，久别重逢喜可知也。会有作小诗调之者，依韵赋此
911443,壬申九月初十归自邑中两绝 其一
790855,十月初十与家人话梁园旧事感赋二首 其二
149179,南门·今上元年九月初
1250924,癸丑岁十二月初四夜宿狮子林听雨有作
772189,南征八咏 其四 十一月初一二鼓，所部全军过大渡，冒险疾趋。彰城内应外攻，奋勇争先，随即克复城池，闻鸡初唱。止寅时二刻也
98266,十二月初六夜梦客溧阳半月而未见晦庵梦中以
719800,后秋兴八首八月初二日闻警而作 其四
827934,七月初四日夜直时复园寥志正游焦山杂忆山中诸胜小诗寄之 其三
1207782,七月初二夜，洪州对月，怀伯丈亲舍
252353,翠圆枝·癸巳腊月初五观梅偶得
722643,十一月初六日召对文华殿旋奉严旨革职待罪感恩述事
1027971,十月旦尚煖用夹公服二月初吉雪寒甚服单
769669,沁园春·八月初，与王秋上同寓郡城，秋上遇寒疾死，孟冬十日词以哭之
816405,齐天乐 三月初十日舟过临平
845618,千秋岁 十二月初九
434398,感皇恩 杨成之生朝四月初三日
1095277,正月初九日客舍
840159,巧月初三日，乐平新妇自北漍归，久别重逢喜可知也。会有作小诗调之者，依韵赋此
456379,元月初六游北京孔庙前游逾八年矣
652252,天顺元年六月初十日上章告老未允十一日又请十三日又请至二十一日蒙允出京师舟中赋七首 其四
1192848,八月初一驾幸延喜楼看冠带降戎
846958,鹧鸪天 三月初二
181714,十月初梦寄良嗣诗三句云相思一载馀身共远梦
1225306,九月初旬临清下陵州舟中
345281,六月初雨·溪头断续雨
972258,六月初九日晚大雨简文显子畅
298036,正月初十日园行
906502,蝶恋花 西山小湖，四月初，莲有一花
253198,甲戌八月初三日海宁观潮
473007,八月初三夜月
387197,一枝花·三月初九日过西园，薄阴酿雨，花木皆有寒色，再叠前韵
120670,三月初晚晴寄高缙之
572308,九月初五日得三弟京闱第三报志喜仍用散木韵践前约也 其二
825710,四月初五日夜直 其一
695669,十月初度都下值防虏甚急感怀寄诸弟五首
283850,壬戍腊月初七日大风雪
943607,三月初晚晴寄高缙之三首 其三
195277,七月初五夜养正堂示诸友
381444,三月初五日携家人往龙华观桃花至则已谢
833175,浪淘沙 板桥题壁，八月初三日夜
617005,正月初二日早行苦寒
226554,倾杯乐·皓月初圆
719803,后秋兴八首八月初二日闻警而作 其七
250679,癸巳正月初五值蝶儿生辰赋此为贺
930493,上章纳禄恩畀外祠遂以五月初东归五首 其二
1064099,七月初九夜坐西轩雨止月出不胜清绝
1218477,十一月初五日初度
456419,贺新郎  重读陶诗正月初三作
248429,正月初四大雾
846178,西江月 十月初三
1244311,己亥六月初五日
990461,水调歌头 寿隐者十一月初七
77970,九月初郊行
79689,病不禁·四月欲尽五月初
145896,高沙道中·三月初五日
1135785,十月初六日同仇仁近至王子由庵遂饮白云李居士宅书事
1207783,七月初二夜，洪州对月，怀伯丈亲舍 其一
700710,三月初九日过浒西看牡丹
140199,初月·初月当楼动
833244,踏莎行 三月初五日宿彭善村，夜雨寒甚，晓起雪积寸许，因赋
923328,与诸同僚偶会赋八题 其三 坐久月初上
305306,六月初八夕大雷雨枕上偶占
826023,九月初一日晨起 其一
296121,十一月初三夜自浦口渡江
304100,七月初四日夜直时复园寥志正游焦山杂忆山中诸胜小诗寄之
443952,莺声绕红楼 丁卯正月初六九天玄女圣诞感赋
517982,乙未夏五月初三日夜梦侍朝因追想平日所见成绝句三十八首 其十一
450020,是夜雨停，新月初升偶题
182118,八月初四日谢雨采石中元祠
935006,上章纳禄恩畀外祠遂以五月初东归五首 其四
1082481,八月初一夜闻雨
815460,壬戌五月初三夜忽中风痹之疾香山所谓体瘝目眩左足不支与有同病焉昔苻坚得习凿齿于汉南因其蹇疾裁堪半丁香山诗云汉上羸残号半人是也余年已七十可以称翁因自号半翁纪之以诗
751136,芸敏同居法源寺累月初夏余先出都作此为别
829463,八月初九夜梦至一处案上书装册甚古翻视为魏晋六朝人诗梁诗标曰梁言齐曰齐言妙趣纷纶盎有馀味醒后追忆不得遂拟二首彷佛所见云
112757,江城子·秋堂风露月初弦
972097,二月初二日二首 其一
325063,二月初三日为先母忌辰舟中感赋
285531,京津车中暮作 九月初六日
846239,沁园春 寿闽帅正月初二
825194,十二月初一日梅厅展墓 其一
861210,九月二十九日到思溪庄避人事十月初四日过生朝方归初三日早恕子遣人来送酒食并词二阕因成唐律二首 其一
664827,三月初九日过浒西看牡丹 其二
442479,丙子二月初八夜游城北观看介子推庙
873943,满江红 寿留守正月初三
719801,后秋兴八首八月初二日闻警而作 其五
846789,瑞鹤仙 庆生日又娶妻八月初七
456056,乙未正月初二大连客舍临孔子庙堂碑至解黻去佩书烬儒坑八字慨然有作
62071,海棠花·小楼风定月初斜
719806,后秋兴八首八月初十日，小舟夜渡，惜别而作 其二
1134337,丁亥十一月初八日南至二首 其二
160882,会稽六月初五日新米入市价减旧以升计之几十
825711,四月初五日夜直 其二
591886,十月初度都下值防虏甚急感怀寄诸弟五首 其五
1052425,正月初三日送叔宜弟初离襄阳
790864,五月初七日梦中得起二句醒起续成之
572309,九月初五日得三弟京闱第三报志喜仍用散木韵践前约也 其三
162567,八月初五日有怀旧事
378827,佛鉴兴修天宁而大檀越辐凑六月初吉有双莲开殿庭之西池作此
311221,朝中措·明霞成绮月初来
705615,十一月初六日召对文华殿旋奉严旨革职待罪感恩述事三首 其三
412268,七零年八月初三夜
322617,七月初四日喜晴
518003,乙未夏五月初三日夜梦侍朝因追想平日所见成绝句三十八首 其三十二
930406,九月初作四首 其二
56864,戊申正月初宿休园
719978,十一月初六日召对文华殿旋奉严旨革职待罪感恩述事三首 其一
86090,九月初十日值宿玉堂七绝
825892,十月初九日侗伯立之向元同游罗氏菊圃
285383,海滨 1990年8月初旬
841470,二月初六日将赴试河南隔夕赋此以壮行色
300409,元月初五日夜坐
386665,七月初一日闻金陵于六月十六日克复
555693,夜将晓梦过原次寮隐居赋诗为次寮赠得起二语觉而足之乙巳年六月初十日
181184,七月初七夜渡黄河
315615,二月初三日出使
296927,丙申九月初三日有感
240911,八月初七日终夜大雷震雨如倾注风败吾藩篱拔
769444,唐多令  四月初九日作
450087,壬辰二月初，小雨加雪。
652620,丙子七月初一日，赴乩申谢
791178,乙酉七月初五抵苍梧
572936,丁酉十二月初六初度 其三
360338,新月·初出如弓未上弦
378948,七月初九夜坐西轩雨止月出不胜清绝
466118,二月初见作二首
863246,糖多令/唐多令 庆曹松庐待郎，与秋壑只争二日，曹新除两浙漕八月初十
911444,壬申九月初十归自邑中两绝 其二
972098,二月初十日自荻浦绝湖三首 其三
407245,乱后归成都作  六月初二日
800888,闰六月初七夜月
1058491,元祐三年八月初六日得报已有代者归期可数喜动于中载形歌咏
493928,八月初四日纪事二首 其二
1005768,四月初一日积雨新霁偶成
846153,西江月 寿刘公子十月初西
498188,九月初八出门日别妇柩作
518087,洪武辛巳闰三月初九之吉陪同守郭公游灵山徘徊历览山水之胜可娱心目承命赋诗谩成古体一首录藁奉呈惟冀采览
302420,四月初五夜风晓起过崇效寺看牡丹
107121,六月初七日雨始止初八日始晴
1135721,七月初一日淮浙大潮巨风亘古所无二首 其一
828454,乙亥七月初八日恭谒福陵昭陵敬赋
696155,十一月初三夕于杏林
743418,乾隆十六年三月初三日迎銮献诗召试行宫谢恩恭纪
773525,丙申1896三月初九夜有感
746397,九月初旬有西江之行晚泊富春
824960,七月初三日雨时将入都 其二
719865,后秋兴八首辛丑二月初四日，夜宴述古堂，酒罢而作 其五
1135893,正月初七日如江西以畏饮辞吴式贤宅宿向果市店
809190,康熙十七年九月初十日奉太皇太后临御温泉恭纪五言排律八韵
960418,瑞鹤仙 其二 寿萧通判十月初一日
834892,浪淘沙 七月初六日感旧作
387586,满庭芳·九月初三夜写香山诗意
415248,元月初五日夜坐
652253,天顺元年六月初十日上章告老未允十一日又请十三日又请至二十一日蒙允出京师舟中赋七首 其五
534394,溪月初出水
24635,八月初一驾幸延喜楼看冠带降戎
106211,五月初三日雨寒痰嗽
719862,后秋兴八首辛丑二月初四日，夜宴述古堂，酒罢而作 其二
828011,二月初六日出东门展外舅子封公暨外姑周夫人墓过洪山卓刀泉途间感赋
790582,二月初三日为先母忌辰舟中感赋二首 其一
902100,六月初七日雨小止游蒲溪临独木桥而还
97337,十一月初五日晨起书呈叶德章司法
775679,三月初七日祭海候风
284438,正月初四游迎水庵
846193,齐天乐 寿碧涧三月初一
874560,九月初十日值宿玉堂七绝 其五
829705,十月初四日残夜
572313,九月初五日得三弟京闱第三报志喜仍用散木韵践前约也 其七
121016,西湖月·初弦月挂林梢
930490,上章纳禄恩畀外祠遂以五月初东归五首 其一
967426,正月初三至初五再攻焚其攻具虏骑大却
228617,十二月初六日栖嬾和方山
834667,西子妆 秋宇澄霁，残月初上，暝烟不生，楼外丛树动摇，凉翠欲滴，同蘋湘赋此，一绳新雁，若与歌声相和也
518006,乙未夏五月初三日夜梦侍朝因追想平日所见成绝句三十八首 其三十五
304437,乙亥七月初八日恭谒福陵昭陵敬赋
517974,乙未夏五月初三日夜梦侍朝因追想平日所见成绝句三十八首 其三
106243,八月初一日·吾生遽如此
496866,水调歌头 其二 崇祯丁丑正月初卜日迎春
452539,望海潮 古雷半岛风光秀丽，海产丰饶，惜新建化工企业即将运行，佳景或恐不再，辛卯九月初特与力夫、新河、高凉、疏影来此作告别游，时值台风来袭，巨浪骇人，遂与诸君相约赋此
881685,蓦山溪 其三 老妻生日作，十一月初七日
467974,鹧鸪天 正月初十至十六日率学生十二名至香港圣保罗男女中学交流学习，宿半山区宝恒苑三首
826118,雨中花慢 四月初二日阴雨，访彦通屯云馆，联句用东坡韵
699441,丁酉十二月初六初度
823739,行香子 九月初三，和螺川韵
313978,沁园春·八月初，与王秋上同寓郡城，秋上遇寒疾死，孟冬十日词以哭之
1118042,上章纳禄恩畀外祠遂以五月初东归五首
874581,二月初七日寿溪十绝 其七
1004814,水龙吟 寿吴尉七月初一
494126,回宿丕礼晓枕夜梦先师石翁先生正月初三日
108367,五月初十日病体少甦
842954,六月初一日漱芳斋听戏 其三
1005724,十月初五日重赋菊
81001,九月初作·碧海仙蓬感旧游
846495,壶中天/念奴娇 庆刘孺人七月初三
846897,醉蓬莱 寿邑宰九月初五
1092680,十月初十日
842953,六月初一日漱芳斋听戏 其二
268095,浪淘沙·七月初六日感旧作
849627,三月初四夜宿僧庐
559463,三月初诣祖父母父母各墓所 其三
1005326,二月初二日山中感兴
330089,郭熙画扇·袅袅凉风八月初
517999,乙未夏五月初三日夜梦侍朝因追想平日所见成绝句三十八首 其二十八
1003388,多丽 寿待郎十二月初七
1135795,三月初五日孟君复王元俞治中十人同会分韵得诗字
939045,甲辰九月初访晦庵先生大安道中和余正叔韵
1096225,十月初三四雪
829629,四月初五日夜直
814890,七月初五，夜梦一老人，携登亭台，饮予以酒，命咏二绝。时酒气在喉，残镫映窗，披衣记此
959005,七月初五日城中大风雨
657027,二月初二日梦 其一
107944,四月初九日清和绝佳闻贼焚歙南路蔓延五十余
367470,齐天乐·题龙岩临清杀贼图，咸丰甲寅三月初七夜事
846497,壶中天 寿伯母十二月初六
809798,三月初十日恭请皇太后雅玩斋进膳看梅花
517976,乙未夏五月初三日夜梦侍朝因追想平日所见成绝句三十八首 其五
95028,月下杲饮·月初生处薄云生
1004815,满庭芳 寿徐佑卿七月初五
81734,十二月初一日得梅一枝绝奇戏作长句今年於是
846224,步蟾宫 庆友人四月初四
178668,七月初四日小雨后游步水边
1123774,二月初二日二首
846673,最高楼 寿翁簿二月初十
902075,七月初四日小雨后游步水边
719850,后秋兴八首庚子阳月初一，拂水拜墓作 其六
843986,六月初一日漱芳斋听戏
107451,三月初五日孟君复王元俞治中十人同会分韵得
829643,九月初一日晨起
430803,四月初一纪事二首 其二
68818,甲午年正月初四日得春
790854,十月初十与家人话梁园旧事感赋二首 其一
597066,与沈迎川石圃王肖阳会竹峰府时新月初霁即事
408401,送吴生至江干而反 庚申十月初二寄到
645120,正月初三祭始祖濮州公族议欲更旧门符山林城市寻常屋唐宋诗书第一家者予意不可因赋一律呈诸父
740406,八月初六日拜分校之命入闱用王衷白先生韵 其一
1042500,正月初五日杜城集
750660,四月初八日
471972,纪赐四十首 其二 丙子七月初侍日讲纪述
967433,腊月初三日虏人攻城以强弩射退获捷
132420,十月初还潭州题王氏瑞竹图
429520,六月初八夕大雷雨枕上偶占
1193886,木莲树生巴峡山谷间巴民亦呼为黄心树大者高五丈涉冬不凋身如青杨有白文叶如桂厚大无脊花如莲香色艳腻皆同独房蕊有异四月初始开自开迨谢仅二十日忠州西北十里有鸣玉溪生者秾茂尤异元和十四年夏命道士母丘元志写惜其遐僻因题三绝句云
775934,丁酉1717正月初五夜罗山署中大风次早风歇饮酒纪之以诗
1134393,九月初四日大风雨近重阳无酒夜成二首 其二
381403,十月初六夜新康舟中
1244043,十二月初三日大雪与同宗弟文昌饮谌时忽落一齿遂赋
428024,洞仙歌 立冬后一日寿金平庐，平庐以光绪癸巳十月初五日生，长予九岁
722167,八月初八夕咏月
560020,和编脩许道中腊月初三日诞诗三首 其三
444229,庚寅六月初六谒金溪象山先生墓
803621,咸丰癸丑二月初九日贼攻金陵愈急见势难支即手书绝命词二首 其一
297951,辛丑六月初一日世鸿兄病逝广州其甥来告诗以哭之
886143,梦宗氏子来兄舍寄生九月初七果生侄子
691228,正月初六同饮天恍宗侯
846773,满庭芳 寿胡簿方三十十一月初四
297912,十月初一日晓雨
1096110,正月初一酬盘隐陆别驾再雪得封字初三夜醮遇风得泾字 其一
652251,天顺元年六月初十日上章告老未允十一日又请十三日又请至二十一日蒙允出京师舟中赋七首 其三
817993,十二月初六日书寄刘三贞壮曼殊寒隐
832368,烛影摇红 丁卯正月初三夜，与闺人烧烛候春
846868,蝶恋花 八月初六
930871,五月初病体益轻偶书
874559,九月初十日值宿玉堂七绝 其七
1094403,正月初三日
1134549,六月初七日雨始止初八日始晴
873931,念奴娇 寿尚倅三月初一
761540,摸鱼儿 癸亥八月初二日赋
980431,二月初山上作
719812,后秋兴八首八月初十日，小舟夜渡，惜别而作 其八
263556,庚午二月初二日为怡园主人六旬双庆暨母夫人
81000,九月初作·九月都门凛欲霜
1138325,文山道人事毕壬午腊月初九日
1134603,四月初十日得蜂虿茧丝之句
803622,咸丰癸丑二月初九日贼攻金陵愈急见势难支即手书绝命词二首 其二
467019,四月初三夜闻欧淑芹女士清琴偕周正光君
134654,柳枝词·宣阳门前三月初
1135897,正月初四后十馀日病嗽不能出杂书十首 其七
256614,感皇恩·杨成之生朝四月初三日
458459,正月初八共石人山访三苏坟，郏县酒家索笔书
943609,三月初晚晴寄高缙之三首 其一
750576,八月初十夜坐月
1135896,正月初四后十馀日病嗽不能出杂书十首 其八
637970,辛丑得年四十三七月初见髭一茎白者走笔赋此
440299,二月初五日他人之春林
386699,三月初九日，舟次金川，访王孚吉太守于郎君官署
790583,二月初三日为先母忌辰舟中感赋二首 其二
1242196,十二月初一初六两日闻雷
1007479,甲戌八月初九夜武康山中洪水骤发越十日漕司檄往检涝
271797,满江红·冬月初六日
874555,九月初十日值宿玉堂七绝 其二
157708,八月初十日夜露坐场圃新月半破前溪夜舂俯仰
410958,京津车中暮作 九月初六日
813086,五月初四日旅邸书怀四首录二
930492,上章纳禄恩畀外祠遂以五月初东归五首 其三
845704,减字木兰花 庆女人三月初五
825728,十月初四日残夜 其二
824959,七月初三日雨时将入都 其一
915217,早入东省残月初上
808900,三月初十沙洋
1005345,十月初五日夜闻鸡
555893,夜梦四老人俱彷佛百余岁衣冠古朴气象庄重皆天然不事矫饰同坐一木凳予趋前长揖四老人俱起答之渊默无一言觉犹宛在目中以诗记之丁未正月初三日早间书
1211161,中秋玩月初阳台有约不往夜分有作明日寄同约诸公
184462,腊月初七日夜梦游山林间清甚赋诗半就觉而忘
1099870,十月初六夜偶成
860261,贺新郎 寿右史正月初七
80999,九月初作·菊佩糕盘节物催
1135898,正月初四后十馀日病嗽不能出杂书十首 其六
1134521,五月初三日雨寒痰嗽
572314,九月初五日得三弟京闱第三报志喜仍用散木韵践前约也 其八
838199,闻樨学舍将于腊月初五日解馆。初四夜，灯花忽开，喜而志之 其一
167162,夜半见月·中夜月初上
825198,十二月初九日渡海 其三
356724,西子妆·秋宇澄霁，残月初上
1134369,七月初一日早起
375126,四月初八·只么随流去
846722,满江红 其一 寿传府尹九月初十
829555,十二月初九日渡海
1005723,十月初三日自邑夜归
572935,丁酉十二月初六初度 其二
181807,八月初一夜闻雨
631430,八月初五日示诸子
461364,律五月初一雷雨日赴京
107912,十一月初八日观雨
94723,早入东省残月初上
1108936,九月初十日值宿玉堂七绝
695595,繇茶陵过吉州张使君招饮白鹭书院时三月初十日也就此因闻倭警
1103901,五月初一日煮茶偶作
191544,七月初得雨后大有秋意
1005220,免役未几四月二十九日总府复有仓官之命五月初二日入城告愬作一绝贻如山王监簿如山前与予别谓此别不复有相见之日矣予言得十年住山不出吾事毕矣今未两月已复会面更成惨怆也
930449,十二月初一日得梅一枝绝奇戏作长句今年于是四赋此花矣
308655,忆旧游·闰八月初六夜，怀人次韵
456418,贺新郎甲申正月初三养蜡嘴雀数日
827292,庚午二月初二日为怡园主人六旬双庆暨母夫人八秩华诞社友具餪筵为寿二首 其二
294768,十二月初四夜大雪用东坡尖叉韵
719802,后秋兴八首八月初二日闻警而作 其六
