1005739,子瞻在惠州以十月初吉作重九和渊明己酉九月九日韵余去年以此日奔避万山今日则有间矣有野人馈菊两丛对之叹息因继韵陶苏之后
1005123,十一月初三日插梅花古罍洗中因成四绝 其三
728887,三月初八日幸圆明园
846893,醉蓬莱 寿特奏官十二月初二
209262,七月初五日城中大风雨
679321,八月初八日饮刘参戎对月亭
577411,八月初三秋丁斋宿偶赋
274389,阳春曲·三月初一日夜归，遇旧曲，怅然成咏
911630,十二月初六日出郊途中值雪偶成小律诗
322301,特百溪·良宵十月初三夜
281812,七零年八月初三夜
440702,庚寅正月初五日卢翼过予兄弟同游景山向晚驱车君子峰
381781,十二月初一日梅厅展墓
415304,朝朝三月初九
375734,船窗蕙萱·小试凉薰四月初
298666,九月初五日同沈虚谷昆仲游浣笔泉用壁上木兰山人元韵
57251,秋闺·华月初生夜
1094259,十二月初九日雪尹子潜来
517994,乙未夏五月初三日夜梦侍朝因追想平日所见成绝句三十八首 其二十三
183356,坐久月初上
1113436,正月初四日听新乐成绝句
297161,六月初二恭逢先慈忌日，趋拜墓田
572312,九月初五日得三弟京闱第三报志喜仍用散木韵践前约也 其六
369840,正月初三日
500466,十月初六日夜作
1036841,六月初四日往云际院田间雨足喜而赋之二首 其二
826024,九月初一日晨起 其二
1134423,八月初二日
322735,腊月初一日燕子矶遇陈棣园、典胄父子
384489,八月初九日见月
1135903,正月初四后十馀日病嗽不能出杂书十首 其一
411777,三月初九过岳王墓下改旧作
90901,五月初二日苦熟
459361,六月二十阴历之五月初一生日未往
304664,踏莎行·十月初十日，梦湖斋坐雨，夜景幽绝，醒记之
657033,十一月初三夕于杏林 其一
813117,十月初十与家人话梁园旧事感赋二首
302556,七月十五夜月初上
839394,九月初六日寄怀刘石香二首 其二
402180,西江月 初见燕到
842952,六月初一日漱芳斋听戏 其一
156109,阴雨向月余三月初一闻鸠鸣有作
845763,风入松 寿刘倅九月初九
375120,正月初九日客舍
164796,梅·非云非雪月初浮
452879,壬辰二月初六雪晴超山赏梅
616121,正月初六同饮天恍宗侯 其二
110208,腊月初三日虏人攻城以强弩射退获捷
371422,正月初六日
82424,五月初病体益轻偶书
884298,忆秦娥 正月初六日夜月
719982,戊寅九月初三日奉谒少师高阳公于里第感旧述怀三首 其一
572311,九月初五日得三弟京闱第三报志喜仍用散木韵践前约也 其五
560018,和编脩许道中腊月初三日诞诗三首 其一
860265,瑞鹤仙 寿叶路钤二月初一
1103906,癸未三月初七日泛舟东溪寻访赵石斋于方壶山中临分留呈
157877,十月初五日重赋菊
794916,菩萨蛮  三月初七寄瑟庵于京师
518008,乙未夏五月初三日夜梦侍朝因追想平日所见成绝句三十八首 其三十七
125161,和晏太尉三月初五日
958354,六月初八义荣司谏自福庆山见过奉陪游西岩以新茶享石佛抵暮出山明日成古诗一章为谢云
381163,九月初四日萱妹四十生日栗兄置酒作诗胥及柽弟皆作一律寄之
448019,四月初三夜闻欧淑芹女士清琴偕周正光君 其二
874556,九月初十日值宿玉堂七绝 其四
902101,六月初八日过龙洞纳凉树阴下酌泉待月而行
997790,酹江月/念奴娇 寿太守母八十正月初一
737641,丙午十二月初七日下狱次日得旨发军前效力赎罪感恩述事次东坡狱中寄子由韵寄从弟佩苍实夫 其一
1005121,十一月初三日插梅花古罍洗中因成四绝 其一
879016,卜算子 其五 曹守生朝十二月初六日
1212700,辛巳年二月初四日夜半后梦中作
793682,六月初二日，圆明园引见，口占纪恩四首 其一
874579,二月初七日寿溪十绝 其二
930405,九月初作四首 其四
1135794,三月初五日同诸友自城南游水西书事
558977,繇茶陵过吉州张使君招饮白鹭书院时三月初十日也就此因闻倭警 其一
827936,七月初四日夜直时复园寥志正游焦山杂忆山中诸胜小诗寄之 其五
157878,十月初五日夜闻鸡
288065,二月初十日，缮葺宗祠，因往督工，有感而作
125903,南园赏花·三月初三花正开
251028,庚寅正月初五日卢翼过予兄弟同游景山向晚驱车君子峰
790155,甲戌四月初二日，偕钱子宣大令自长沙起程旋里
16843,感梦·十月初二日
957952,八月初四日谢雨采石中元祠
150174,二月初山上作
159791,步月·初阳夺残凛
451971,正月初五京城醉归口占
185506,八月初游君山谊斋有诗同赋
189415,九月初吉永嘉苏太古同游金华洞夜宿鹿田寺用
270599,丙午夏历二月初九日
161937,绝句·正月初弦二月赊
1134391,九月初五日
836388,满江红 冬月初六日，偕向君南皋过新繁，吊双忠墓
90539,渡太和江·二月初头春向中
1135900,正月初四后十馀日病嗽不能出杂书十首 其四
46282,四月初二日游兰州小西湖
411163,正月初四游迎水庵
517980,乙未夏五月初三日夜梦侍朝因追想平日所见成绝句三十八首 其九
452418,癸巳正月初五值蝶儿生辰赋此为贺
901084,八月初四夜池上
518004,乙未夏五月初三日夜梦侍朝因追想平日所见成绝句三十八首 其三十三
719829,后秋兴八首九月初二日，泛舟吴门而作 其一
444228,庚寅六月初七游麻姑山次谢客韵
903647,祝英台近 寿张路钤四月初一
1243999,辛丑二月初八日予携妻子避乱于北山清修寺赋一律奉谢山中故旧云
652249,天顺元年六月初十日上章告老未允十一日又请十三日又请至二十一日蒙允出京师舟中赋七首 其一
306979,满江红·壬子二月初觉和暖韶华已过半矣绿肥红瘦春光奈何
749582,九月初五日同沈虚谷昆仲游浣笔泉用壁上木兰山人元韵
400217,高阳台 九月初三悼杨生作
371425,三月初二日
228618,壬申九月初十归自邑中两绝
835989,忆旧游 甲午七月初三日五十一初度，自赋一阕
157707,八月初十日瘧起行园
970893,二月初八日
1244463,八月初三夜对月
106241,八月初一日
110205,正月初三至初五再攻焚其攻具虏骑大却
930407,九月初郊行
451428,双红豆 壬申十月初八日燮良生日
385876,正月初四日咏雪
1207784,七月初二夜，洪州对月，怀伯丈亲舍 其二
96730,二月初十日自荻浦绝湖
1134394,九月初四日大风雨近重阳无酒夜成二首 其一
1142244,五月初二日闻祁门县四月二十七日大水没鼓楼蛟龙斗争溺死者多休宁县江潭等处亦多漂溺
719810,后秋兴八首八月初十日，小舟夜渡，惜别而作 其六
716202,九月初十夕
747881,十一月初八日舟中夜坐饥甚
44680,祝英台近·月初残
1134421,八月初一日
908275,飞乌与正老相值盖十月初见之梦兆云
719807,后秋兴八首八月初十日，小舟夜渡，惜别而作 其三
1115061,壬申九月初十归自邑中两绝
157857,四月初一日积雨新霁偶成
825714,四月初五日夜直 其五
720056,癸未十月初七日以言事下狱
225516,泛江·风回浪急月初圆
345241,六月初雨·久困尘埃梦
98265,十二月初四夜同吴资深陈明叔宿观山
427758,月华清 癸巳中秋后一日湖帆有和洪叔玙之作，其年七月初二日为湖帆六十初度，因用原韵补成一阕寿之
1028712,三月初一日晴色甚快人意晚宿撮石岭陈氏书院
51592,三月初峡山道中
844034,忆旧游 闰八月初六夜，怀人次韵
761539,甘草子 七月初五夜雨
452386,壬辰八月初八石窝镇雅聚分韵得破字
370773,万寿诗·二月初弦月色涵
1005170,丙子兵祸台温为烈宁海虽经焚掠然耕者不废丁丑粗为有秋但种秫者少以醉人为瑞物吾亦似陶靖节时或无酒雅咏不辍也八月初九日连日雷雨溪路阻绝山房岑寂此夕初霁浊酒新漉数酌竟步秋树阴潭鱼可数望前峰老枫数十株已无色白鸟飞翻去来是中有惠崇大年笔家人遣两力来迎因倒坐篮舆而归人或问之戏答曰吾日莫途远故倒行也记以三绝 其一
79785,上章纳禄恩畀外祠遂以五月初东归
708660,玲珑四犯•闰六月初七日作
517993,乙未夏五月初三日夜梦侍朝因追想平日所见成绝句三十八首 其二十二
652255,天顺元年六月初十日上章告老未允十一日又请十三日又请至二十一日蒙允出京师舟中赋七首 其七
657031,三月初七日梦
824077,南楼令 其一 正月初六日茸城归舟，风雨不已，写此寄慨
1084169,六月初雨中渡西湖因至道人庵烧佛香略憩灵隐与乡僧同啜茶乘晚以归 其二
298031,五月初四雷雨
1005168,丙子兵祸台温为烈宁海虽经焚掠然耕者不废丁丑粗为有秋但种秫者少以醉人为瑞物吾亦似陶靖节时或无酒雅咏不辍也八月初九日连日雷雨溪路阻绝山房岑寂此夕初霁浊酒新漉数酌竟步秋树阴潭鱼可数望前峰老枫数十株已无色白鸟飞翻去来是中有惠崇大年笔家人遣两力来迎因倒坐篮舆而归人或问之戏答曰吾日莫途远故倒行也记以三绝 其三
843589,九月初六日寄怀刘石香二首
719846,后秋兴八首庚子阳月初一，拂水拜墓作 其二
107604,七月初一日早起
998301,行香子 寿邓宰母二月初五
517984,乙未夏五月初三日夜梦侍朝因追想平日所见成绝句三十八首 其十三
1216192,十一月初二日发楚门
1095014,正月初三日丁使君送三绝句梅诗 其一
463059,送辛磊兄四首 其三 庚寅四月初三哭别辛磊兄夜独步康园见荆花纷纷泣赋
1134338,丁亥十一月初八日南至二首 其一
846809,蓦山溪 寿友人七月初七
765022,临江仙 腊月初度自赠
517978,乙未夏五月初三日夜梦侍朝因追想平日所见成绝句三十八首 其七
98120,三月初二日雨人以为风止之祥
1081421,乙巳二月初八日集独乐园夜饮梅花下会者宋退翁胡明仲马世甫张与之王子与林秀才及余凡七人以炯如流水涵青蘋为韵赋诗分得流字
825053,九月初四日萱妹四十生日栗兄置酒作诗胥及柽弟皆作一律寄之
1134389,九月初一日
603022,甲辰三月初度自述
296327,齐天乐·丙寅八月初五日津南秋禊
700761,和编脩许道中腊月初三日诞诗三首
217501,桃花·柳坠梅飘半月初
298206,点绛唇·甲寅三月初一日锦山隐庐楔集
517996,乙未夏五月初三日夜梦侍朝因追想平日所见成绝句三十八首 其二十五
1135870,六月初一日次韵酬元煇
518009,乙未夏五月初三日夜梦侍朝因追想平日所见成绝句三十八首 其三十八
664763,八月初十日仲修见过
387587,踏莎行·三月初五日宿彭善村，夜雨寒甚，晓起雪积寸许，因赋
772971,光绪十八年1892三月初六日筱村中丞按试台南正在明伦堂讲书忽地大震因以诗纪之
517989,乙未夏五月初三日夜梦侍朝因追想平日所见成绝句三十八首 其十八
972129,十二月初四夜同吴资深陈明叔宿观山
827291,庚午二月初二日为怡园主人六旬双庆暨母夫人八秩华诞社友具餪筵为寿二首 其一
1135901,正月初四后十馀日病嗽不能出杂书十首 其三
1134602,四月初九日清和绝佳闻贼焚歙南路蔓延五十馀里
827932,七月初四日夜直时复园寥志正游焦山杂忆山中诸胜小诗寄之 其一
517998,乙未夏五月初三日夜梦侍朝因追想平日所见成绝句三十八首 其二十七
719833,后秋兴八首九月初二日，泛舟吴门而作 其五
845619,千秋岁 四月初九
873863,沁园春 庆叶镇五月初八
390103,九月初二日奉神宗显皇帝遗诏于京口成服哭临恭赋挽词
387136,鹧鸪天·九月初三夜宿华清，用香山旧句成解
442752,甲申正月初九偕诗社同仁春游拈得真韵
106731,丁亥十一月初八日南至
953402,瑞鹤仙 寿虞守三月初十
440733,壬辰元月初二日与莼客天吴乐堂雪中游剡县大佛寺
994438,酹江月/念奴娇 寿二月初二
562221,洪武六年五月初一日早朝奉天殿西域国师来朝盖前代所未有也目击盛事因赋
1028895,和七月初五日夜得雨
80997,九月初作
985068,正月初八日同莫少虚蒲大受王园泛舟各赋二首 其一
900125,百字谣/念奴娇三月初九
1227435,十二月初六日晓发松江
179033,余於今年二月初一日夜梦中与刘彦礼兄弟水边
107940,四月初十日得蜂虿茧丝之句
795688,减字木兰花 闰六月初七
387555,浪淘沙·板桥题壁，八月初三日夜
1143449,庚午三月初九日寒食有感
251019,壬辰元月初二日与莼客天吴乐堂雪中游剡县大佛寺
949003,壶中天/念奴娇 寿妇人又良人登科七月初二
232272,十二月初七日述怀
827935,七月初四日夜直时复园寥志正游焦山杂忆山中诸胜小诗寄之 其四
285604,四月初三夜雨思亲
1143905,九月初四日大风雨近重阳无酒夜成二首
107197,九月初八日·今年未见菊花枝
1130916,正月初三日丁使君送三绝句梅诗
1155054,木莲树生巴峡山谷间巴民亦呼为黄心树大者高五丈涉冬不凋身如青杨有白文叶如桂厚大无脊花如莲香色艳腻皆同独房蕊有异四月初始开自开迨谢仅二十日忠州西北十里有鸣玉溪生者秾茂尤异元和十四年夏命道士母丘元志写惜其遐僻因题三绝句云 其一
1108802,二月初七日寿溪十绝
145925,发淮安·九月初二日
517983,乙未夏五月初三日夜梦侍朝因追想平日所见成绝句三十八首 其十二
381423,七月初三日雨时将入都
772303,十月初三日纳侧室杜氏
746801,壬戌五月初三夜忽中风痹之疾香山所谓体瘝目眩左足不支与有同病焉昔苻坚得习凿齿于汉南因其蹇疾裁堪半丁香山诗云汉上羸残号半人是也余年已七十可以称翁因自号半翁纪之以诗 其三
829566,十二月初一日梅厅展墓
247891,高阳台·九月初三悼杨生作
309927,长亭怨慢·四月初十作
1065088,佛鉴兴修天宁而大檀越辐凑六月初吉有双莲开殿庭之西池作此
1004324,沁园春 其二 寿许宰二月初一
179032,余於六月初三日泛舟至奇石洞留题洞中
719851,后秋兴八首庚子阳月初一，拂水拜墓作 其七
1238604,八月初四日雪坡太守周门拓入云居山中复度岭饮于水月尼寺赋诗书似太守及苏州刺史周义卿
1103943,辛丑二月初晴与仲退从芳洲纵游溪山间私念吾党会聚殆不偶然赋古诗一首后五百岁有知音者于吾诗物色可乎
181335,文山道人事毕壬午腊月初九日
372168,十二月初九日雪尹子潜来
652254,天顺元年六月初十日上章告老未允十一日又请十三日又请至二十一日蒙允出京师舟中赋七首 其六
302506,五月初三日，王静安自沉颐和园昆明湖中
590612,己酉科七月初送三男赴试
1135899,正月初四后十馀日病嗽不能出杂书十首 其五
107448,三月初五日同诸友自城南游水西书事
1135720,七月初一日淮浙大潮巨风亘古所无二首 其二
194734,李白於宣州谢朓楼饯别校书叔云一首十二月初
790594,五月初四日旅邸书怀四首录二 其二
517981,乙未夏五月初三日夜梦侍朝因追想平日所见成绝句三十八首 其十
228740,十二月初六日出郊途只值雪偶成小律诗
157901,十二月初一日醉歌
874558,九月初十日值宿玉堂七绝 其三
389730,甲辰二月初六甘露降
107943,四月初二日出兵恰满一月百姓未得下城
637629,十一月初五日出巡至太原县
1118038,九月初作四首
572934,丁酉十二月初六初度 其一
728318,于中好  七月初四夜风雨，其明日是亡妇生辰
820362,满江红 壬子二月初觉和暖韶华已过半矣绿肥红瘦春光奈何
430670,壬戍腊月初七日大风雪
64997,皇夫叹·岁当己亥三月初
295767,正月初九晨渡江发浦口
1005117,九月初十日山房午睡恍见梅枝已吐白矣惊喜而作
294179,二月初六日将赴试河南隔夕赋此以壮行色
809518,康熙二十八年岁旱冬又无雪朕焦心劳思寝食俱废二月初间谒陵路遇大雨田野欢声方少抒朕怀故赋五言律以记之
1115744,六月初四日往云际院田间雨足喜而赋之二首
843781,闻樨学舍将于腊月初五日解馆。初四夜，灯花忽开，喜而志之
845748,水调歌头 寿周相子正月初一
849626,三月初五日先秘阁忌
375525,正月初一酬盘隐陆别驾再雪得封字初三夜醮遇风得泾字
825223,三月初五日携家人往龙华观桃花至则已谢 其一
719805,后秋兴八首八月初十日，小舟夜渡，惜别而作 其一
1164790,宿关西客舍寄东山严许二山人时天宝初七月初三日在内学见有高道举徵
1106426,九月二十九日到思溪庄避人事十月初四日过生朝方归初三日早恕子遣人来送酒食并词二阕因成唐律二首
821847,探春令 正月初八日日出而雪，阴晴百变，亦气候之异也
719830,后秋兴八首九月初二日，泛舟吴门而作 其二
827933,七月初四日夜直时复园寥志正游焦山杂忆山中诸胜小诗寄之 其二
1216224,至正辛丑诏加福建国王为□□□□本省官属以正月初九为王诞日谒庙称贺走叨先行展敬礼道中欣逢仪仗之过马上有作戏呈幕府诸公
872569,十一月初四日五鼓纪梦寄外
842183,十二月初四夜大雪用东坡尖叉韵二首 其二
559461,三月初诣祖父母父母各墓所 其一
855110,李白于宣州谢朓楼饯别校书叔云一首十二月初六日夜独坐松斋怀抱良不佳饮少辄醉庭下梅两株月色皎然倚树微吟偶诵李白此诗有会予意者次其韵追和一首
719811,后秋兴八首八月初十日，小舟夜渡，惜别而作 其七
861256,会稽六月初五日新米入市价减旧以升计之几十二三闻海商米船方集亦损其直
845744,水调歌头 寿王制置十一月初六
291516,南楼令·正月初六日茸城归舟，风雨不已，写此寄慨
793683,六月初二日，圆明园引见，口占纪恩四首 其二
719852,后秋兴八首庚子阳月初一，拂水拜墓作 其八
722652,后秋兴八首八月初二日闻警而作
846766,满庭芳 庆尚书恬退八月初八
719799,后秋兴八首八月初二日闻警而作 其三
874577,二月初七日寿溪十绝 其六
53376,丙子二月初与经筵进讲纪述
319628,三月初九过岳王墓下改旧作
250949,癸酉十二月初九日清游罗浮天寒而弗见梅花
297956,正月初十日作
1096111,正月初一酬盘隐陆别驾再雪得封字初三夜醮遇风得泾字 其二
375551,十月初三四雪
255149,西江月·初见燕到
106455,正月初三日水西寺
930870,五月初作
740407,八月初六日拜分校之命入闱用王衷白先生韵 其二
301984,九月初六日雨中读陶集
300468,夜游宫·壬戌十月初六日勺庵怀先母作
209235,八月初五梦桃杏枝上皆小蕊顷刻间一花先开既
1244341,二月初晴题淦西居人楼壁
1202950,鹊桥仙 大德辛丑岁八月初四日寿平章相公夫人
719835,后秋兴八首九月初二日，泛舟吴门而作 其七
381532,九月初一日晨起
846130,百字谣/念奴娇 二月初四
86622,二月初七日寿溪·士不论穷达
1123684,二月初十日自荻浦绝湖三首
163349,寿李子先·正阳用事月初吉
817649,四月初五夜风晓起过崇效寺看牡丹
558978,繇茶陵过吉州张使君招饮白鹭书院时三月初十日也就此因闻倭警 其二
780244,秋千索 壬寅七月初十，夜雨有忆
448018,四月初三夜闻欧淑芹女士清琴偕周正光君 其一
719847,后秋兴八首庚子阳月初一，拂水拜墓作 其三
295768,沈阳雨后·塞垣二月初闻雨
719797,后秋兴八首八月初二日闻警而作 其一
1138801,八月初游君山谊斋有诗同赋二首 其二
817813,十一月初二雪夜归作寄伯扬
585654,十月初一日衡岳居成作
1144035,七月初一日淮浙大潮巨风亘古所无二首
282897,蝶恋花·乙未四月初四日倚装赠内
905022,水调歌头 寿丘漕九月初三
156082,日食·十月初吉日
508715,景泰壬申九月初六日，经筵讲退，蒙召至文华殿。皇上负扆而立，面垂顾问，赐楮币一千贯。复遣中官赐雪花梨及鲜果一笼，荷恩感激赋此以识
771744,六月初七日午雨暴注，少刻即晴，偶得绝句四首 其三
189241,菩萨蛮·开禧三月初逢九
1135902,正月初四后十馀日病嗽不能出杂书十首 其二
975667,十月初还潭州题王氏瑞竹图
91651,登姑苏台·二月尽头三月初
279706,醉后戏赠·一双眸子月初裁
325094,十月初十与家人话梁园旧事感赋
384122,五月初九日喜雨，赠托爱山中丞
292574,大酺·丙辰十月初三梦书楹联
1095016,正月初三日丁使君送三绝句梅诗 其三
133730,垂柳·天意清和二月初
228894,辛酉正月初八日入郡赴高校书之约二十二日出
309071,九月初七日同人集塔江金山寺
305704,十月初十夜鼓浪屿月中
629931,五月初五家宴无荔嘲夫
699335,九月初五日得三弟京闱第三报志喜仍用散木韵践前约也
838202,闻樨学舍将于腊月初五日解馆。初四夜，灯花忽开，喜而志之 其四
432602,四月初一纪事二首
386084,西江月·初夏郊行
275484,雨中花慢·四月初二日阴雨，访彦通屯云馆，联句，用东坡韵
717370,八月初八夕咏月 其一
518005,乙未夏五月初三日夜梦侍朝因追想平日所见成绝句三十八首 其三十四
902242,登真观在利州嘉川县西五里南临宋江相传云张天师栖真之地至今有遗履池县下二十馀里江心有积石土人谓天师殡鬼堆石上有纹隐起类篆籀土人谓天师符观中多大柏连抱皆数百年物也又有铁铸老君二其一已损六月初五日少息观中闻其事于小童与石刻颇验云
873945,满江红 寿胡漕六月初一
1135891,四月初四日闻绩溪凡十五都贼焚欲尽傍出焚歙县之南乡遂焚至昌化
487518,虞美人 闰 六月初七
825712,四月初五日夜直 其三
616528,九月初九父子同日下狱十一夜传有令勒余自裁守牢者将余严禁待命篝灯草嘱并封所著古书付儿续一律
157879,十月初三日自邑夜归
440526,披云原玉：壬辰正月初二凌晨听雪调寄菩萨蛮用伯狐韵
572307,九月初五日得三弟京闱第三报志喜仍用散木韵践前约也 其一
1094425,三月初三日
699809,八月初四日纪事二首
844892,十二月初四夜大雪用东坡尖叉韵二首
901954,余于六月初三日泛舟至奇石洞留题洞中一首
720146,十月初六发榆中夜抵鱼河驿
572938,丁酉十二月初六初度 其五
790107,七月初五，夜梦一老人，携登亭台，饮予以酒，命咏二绝。时酒气在喉，残镫映窗，披衣记此 其二
456213,鹧鸪天 正月初十至十六日率学生十二名至香港圣保罗男女中学交流学习，宿半山区宝恒苑三首 其一
107196,九月初五日·暮雨萧萧鼓角风
825732,十一月初三日奉乘舆幸日本使馆 其一
825715,四月初五日夜直 其六
825372,十月初六夜新康舟中
135372,奉口遇雨·七月欲尽八月初
345240,六月初雨中渡西湖因至道人庵烧佛香略憩灵隐与乡僧同啜茶乘晚以归
817525,七月初六日赴沪海上大风
835888,忆旧游 其一 闰八月初六夜，怀人次韵
1247426,十月初五日夜柳城梦草堂
1239546,壬辰闰三月初三日銈弟归因录其语奉呈楚金诸君子
660115,五月初四日游永乐寺次联句韵呈同游冯雪湖魏邦直牧时庸诸君
719866,后秋兴八首辛丑二月初四日，夜宴述古堂，酒罢而作 其六
248499,甲午正月初八京师大雪
1128358,十一月初三日插梅花古罍洗中因成四绝
297873,正月初一日元儿生
745435,正月初八日与少史访烟霞洞复历理安寺五云山云栖诸胜 其二
739012,六月初三日闻蝉
517975,乙未夏五月初三日夜梦侍朝因追想平日所见成绝句三十八首 其四
1028697,七月初得雨后大有秋意
809297,三月初六日告祭福陵恭述十韵
828302,八月初九夜梦至一处案上书装册甚古翻视为魏晋六朝人诗梁诗标曰梁言齐曰齐言妙趣纷纶盎有馀味醒后追忆不得遂拟二首彷佛所见云 其二
844506,三姝媚 丙寅八月初五夜预中秋和金梁梦月词韵
846119,庆清朝 寿章丞二月初六
387726,鹧鸪天·九月初三绣岭东
500213,二月初三日出使
973686,十一月初五日晨起书呈叶德章司法
740600,十一月初一日渡黄河
817931,七月十五夜月初上
290907,四月初一纪事
106855,次韵志归·还家五月初
1095312,四月初八
825727,十月初四日残夜 其一
722653,后秋兴八首八月初十日，小舟夜渡，惜别而作
446193,八月初一夜不寐
552546,十一月初九日早出南门
911305,喜迁莺 寿杨韩州正月初五
444809,浣溪沙·丁亥子月初雪
845264,鹧鸪天 九月初三夜宿华清，用香山旧句成解
843050,苏盦作风异图以纪甲子十一月初三日之事
82425,五月初作·邻舍舂新麦
1144354,八月初游君山谊斋有诗同赋二首
189777,金山晚眺·西津江口月初弦
351362,挽辞·八月初凉后
744279,二月初五夜雪
446361,庚寅二月初五内子二十七岁生日戏赠
719861,后秋兴八首辛丑二月初四日，夜宴述古堂，酒罢而作 其一
1229149,六月初三日迁居寄卧云翁
746799,壬戌五月初三夜忽中风痹之疾香山所谓体瘝目眩左足不支与有同病焉昔苻坚得习凿齿于汉南因其蹇疾裁堪半丁香山诗云汉上羸残号半人是也余年已七十可以称翁因自号半翁纪之以诗 其一
657034,十一月初三夕于杏林 其二
517987,乙未夏五月初三日夜梦侍朝因追想平日所见成绝句三十八首 其十六
1031340,甲辰闰月初伏快雨凉风昼眠初觉庭前小栏花木各有意气效柏梁体
370119,正月初三日丁使君送三绝句梅诗
356431,池上·慧晓池塘二月初
