1134392,九月初六日客报吾州初一日大火城中俱尽吾家亦尽七八九报皆然初十日始报吾家幸免拆毁屋十馀间二十五日得王山长亲家书始知仅存州治州仓州学书院吾家免焚馀所免不过数十家
814432,六月初七日午雨暴注，少刻即晴，偶得绝句四首
820495,踏莎行    十月初十日，梦湖斋坐雨，夜景幽绝，醒记之。
1133824,四月初二日出兵恰满一月百姓未得下城
846350,鱼水同欢 庆两子同日十月初六
382042,著新脱故·蚕茧方成四月初
846356,临江仙 十二月初八
508942,二月初四日夜梦中作
860255,念奴娇 寿洪运管五月初五
918411,辛酉正月初八日入郡赴高校书之约二十二日出西郊即事
517985,乙未夏五月初三日夜梦侍朝因追想平日所见成绝句三十八首 其十四
458064,正月初五车行临湘道中 其一
846471,贺圣朝 寿主簿六月初九
846360,临江仙 庆梁孺人十二月初三
825733,十一月初三日奉乘舆幸日本使馆 其二
826684,齐天乐·丙寅八月初五日津南秋禊
960419,瑞鹤仙 其一 寿南康钱守正月初六
591883,十月初度都下值防虏甚急感怀寄诸弟五首 其二
846351,临江仙 寿友人六月初七
719863,后秋兴八首辛丑二月初四日，夜宴述古堂，酒罢而作 其三
791218,祝黄素庵大令七十寿时己巳七月初五
572310,九月初五日得三弟京闱第三报志喜仍用散木韵践前约也 其四
274377,探春令·正月初八日日出而雪，阴晴百变，亦气候之异也
295850,七月初三夜山中雨坐
452225,江右诗社相邀于庚寅三月初三丰城雅聚先赋此篇以寄
722668,十一月初六日召对文华殿旋奉严旨革职待罪感恩述事三首
842182,十二月初四夜大雪用东坡尖叉韵二首 其一
911631,十二月初六日栖懒和方山
825836,三月初一晓
307490,苏盦作风异图以纪甲子十一月初三日之事
817819,五月初三日，王静安自沉颐和园昆明湖中。毕命越五日，余偕桥川、子雍、小平、绥方出西郊，访其故居。为诗吊之
191169,和七月初五日夜得雨
178534,十一月初四日五鼓纪梦寄外
298009,正月初三与诸生登太平山
247451,二月初五日他人之春林
157535,二月初三日曝睡
749522,辛卯四月初五日夜坐时苦雨骑月
577518,八月初一日奉天殿早朝
1141355,七月初五夜养正堂示诸友
