279557,相见欢·哀弦忽动离声
1139499,阃下忽动归兴
1007539,杜陵至节后诗有远在剑南思洛阳句予客九江远过兴国至后忽动西湖之感口占实情得四韵何当神交杜陵于梦寐中必亦一笑也
586180,季秋寓羊城批验所行坐水亭中偶得黄紫溪书知近卧病少出忽动小轩丛菊之思诗以寄意
85773,满江红·夜雨凉甚忽动从戎之兴
604464,泰和萧君还拙以青乌氏客端州十六寒暑矣馆于余者甫三年乡思忽动孤舟遄发既惜其别复望其来乃留其家还拙以古人行谈古人术往往能取今人信第今人得还拙曰地师余得之曰人师也故于其言别也既为之治装复为之赋诗 其一
866275,拟游长沙至零陵忽动归兴
230319,拟游长沙至零陵忽动归兴
284043,绣球青鸟·天姝忽动抛球意
879244,满江红 其一 夜雨凉甚，忽动从戎之兴
604465,泰和萧君还拙以青乌氏客端州十六寒暑矣馆于余者甫三年乡思忽动孤舟遄发既惜其别复望其来乃留其家还拙以古人行谈古人术往往能取今人信第今人得还拙曰地师余得之曰人师也故于其言别也既为之治装复为之赋诗 其二
690455,泰和萧君还拙以青乌氏客端州十六寒暑矣馆于余者甫三年乡思忽动孤舟遄发既惜其别复望其来乃留其家还拙以古人行谈古人术往往能取今人信第今人得还拙曰地师余得之曰人师也故于其言别也既为之治装复为之赋诗
1084497,前中秋一日舟过山阴晚稻方熟忽动乡思呈先之
209326,阃下忽动归兴
