912272,同岳大用甫抚干雪后游西湖早饭显明寺步至四圣观访林和靖故居观鹤听琴得四绝句时去除夕二日 其三
474108,溪閤坐雨招胡国珍陈用甫二丈
204101,南剑赵用甫权郡有小集以祈晴不用妓移晚筵於
599921,送及泉舍弟用甫舍侄西游
860159,南剑倅赵用甫权郡有小集以祈晴不用妓移晚筵于潘司户
146995,赵用甫提举梦中得片云不隔梅花月之句时被命
204006,简南剑倅赵用甫以夫同年
912274,同岳大用甫抚干雪后游西湖早饭显明寺步至四圣观访林和靖故居观鹤听琴得四绝句时去除夕二日 其一
1033633,赵用甫提举梦中得片云不隔梅花月之句时被命入朝雪中送别用其一句补以成章
959161,绍定闽寇平上功省府黄伯厚与焉余时在政事堂赵用甫掾西曹力言此文墨士请官以左选既而赏戾法迄授武阶去岁戊戌用甫帅鄞乃来为阃属余浪迹湖山岁馀始一见稍稔接觞咏亹亹迫人间及前事有见晚恨余与之酒曰一文资直慁子然以人废法虽相知如今日亦弗敢则笑而不怨赴调行在所赠以君莫愁之歌
959161,绍定闽寇平上功省府黄伯厚与焉余时在政事堂赵用甫掾西曹力言此文墨士请官以左选既而赏戾法迄授武阶去岁戊戌用甫帅鄞乃来为阃属余浪迹湖山岁馀始一见稍稔接觞咏亹亹迫人间及前事有见晚恨余与之酒曰一文资直慁子然以人废法虽相知如今日亦弗敢则笑而不怨赴调行在所赠以君莫愁之歌
912273,同岳大用甫抚干雪后游西湖早饭显明寺步至四圣观访林和靖故居观鹤听琴得四绝句时去除夕二日 其二
860095,简南剑倅赵用甫以夫同年二首 其一
912275,同岳大用甫抚干雪后游西湖早饭显明寺步至四圣观访林和靖故居观鹤听琴得四绝句时去除夕二日 其四
61608,溪閤坐雨招胡国珍陈用甫二丈
947520,贺刘叔猷为用甫纳妇
218775,加刘叔猷为用甫纳妇
1214921,乡人杨用甫成家于彼，载酒相劝，因书
1106257,简南剑倅赵用甫以夫同年二首
1115333,同岳大用甫抚干雪后游西湖早饭显明寺步至四圣观访林和靖故居观鹤听琴得四绝句时去除夕二日
860225,简南剑倅赵用甫以夫同年二首 其二
