600356,梁公子元忠顷遇予龙门里第以尊翁开府墓志见属予嘉其仁孝至情而庆开府公之禧后未有艾也伤往怀今赋三十一韵
1174928,郡斋有紫薇双本自朱明接于徂暑其花芳馥数旬犹茂庭宇之内迥无其伦予嘉其美而能久因诗纪述
331075,予得罪南迁朝廷枢密院准备差遣张君送伴凡八十日予嘉其勤于其行也作诗送之
360285,徐沟蔡明府予嘉斋头间燕歌有感
1113821,予得罪南迁朝廷枢密院准备差遣张君送伴凡八十日予嘉其勤于其行也作诗送之
1070863,予得罪南迁朝廷枢密院准备差遣张君送伴凡八十日予嘉其勤于其行也作诗送之 其一
458054,共胡僧出雍和宫入孔庙，庙前有老柏，枝形苍怪，兽走禽飞，争持作势。胡僧指之曰：“凤翥鸾翔不能去。”予嘉其语，欲攘而夺之。越日，语及拙句“哀莫大于心不死”，胡僧笑曰：“即以此偿之，若何。”一毛不拔，寸土必争，斯何人哉。归而补足，庶免吃亏也
820691,迈陂塘 步曾素抱远志，一日与谭，步曾因言，来日将探奇海外。予嘉其志之壮也，为赋此阕，即示步曾
1046955,予嘉祐中尝迎先妣来主临潼元祐丁卯□月赴守遂宁复过是邑凡山林宫寺之胜皆当日奉板舆盍朋簪岁时游息之处到今二十八年矣因成短诗以叙感慨
1070864,予得罪南迁朝廷枢密院准备差遣张君送伴凡八十日予嘉其勤于其行也作诗送之 其二
