176502,题清泉院·孤僧如槁木
131780,次韵上乘寺主僧如岳咏菊
945415,寄慈溪赭山寺主僧如岳
207473,为僧如赋深居
226605,送诗僧如师西游
131451,主僧如日·桂渐吹香菊渐斑
585736,韶州清溪潮水山有泉甚灵黄生经府绣送予为行窝豹谷陈太守为之立石坊增置亭宇选南华僧如昌拨田住守如昌来见予天关诗以赠之用濂溪罗浮韵
145084,幽怀·野僧如野鹿
974300,假宿总持寺从僧如应借读高僧诗法钦所编无为子所叙者
941631,为僧如赋深居
657944,送白马僧如景往沂洲
1101984,赠安禅僧如师
1127830,山谷诗集有题净因寺壁二绝句未知寺在何处甲子秋余游富阳妙山之净因寺用次山谷韵书以遗寺僧如智
331120,贺新郎·僧如梵摘阮
1149831,僧如展及韦载同游碧涧寺各赋诗予落句云他生莫忘灵山座满壁人名后会稀展共吟他生之句因话释氏缘会所以莫不悽然久之不十日而展公长逝惊悼返覆则他生岂有兆耶其间展公仍赋黄字五十韵飞札相示予方属和未毕自此不复撰成徒以四韵为识
96127,假宿总持寺从僧如应借读高僧诗法钦所编无为
944646,次韵上乘寺主僧如岳咏菊
1001265,山谷诗集有题净因寺壁二绝句未知寺在何处甲子秋余游富阳妙山之净因寺用次山谷韵书以遗寺僧如智 其二
1149255,八月六日与僧如展前松滋主簿韦戴同游碧涧寺赋得扉字韵寺临蜀江内有碧涧穿注两廊又有龙女洞能兴云雨诗中喷字以平声韵
905290,贺新郎 僧如梵摘阮
131450,次前韵二首似前育王寺主僧如日
1029469,送诗僧如师西游
1001266,山谷诗集有题净因寺壁二绝句未知寺在何处甲子秋余游富阳妙山之净因寺用次山谷韵书以遗寺僧如智 其一
944636,次前韵二首似前育王寺主僧如日 其二
487952,访徐唯起绿玉斋喜陈伯孺僧如翰并至席上怀惟和
1119982,次前韵二首似前育王寺主僧如日
658492,送僧如海还金泽
945566,次前韵二首似前育王寺主僧如日 其一
50629,闲居·颠毛脱尽野僧如
131558,寄慈溪赭山寺主僧如岳
488737,秋日同林尧勋王玉生徐惟起曹能始僧如瀚集平远台
