1076444,季夏极暑正昼草木俱萎独吾坡上数君子玉立苍然傲睨自得岂杜少陵所谓脩竹不受暑者乎
466306,予别肖健，相期不作诗。盖相知廿年，自识其在心者；况有诗不能留，徒触其在中肠者，无诗亦足别，未害其在中肠者乎。迨临行之夜，乃终食言而书此短章二首
826211,卜算子·宵诵东坡此调，意当时怀贤去国，情绪万端，必有不胜其辗转反侧者。赋此见意，亦宋玉微词之旨。世人以侧艳目之，谬矣。港居荐涉冬春，望远登楼，伊郁谁语，偶继坡作，以写我忧。世其有为我作郑笺者乎
897013,过孝感县十里所望一土山下有渔舟呼之不来委舟负鱼径去不顾俄有一舟不待呼自拿舟直前取舟中美鱼致之求价甚贱予倍与之值卒辞倍值而去予语之曰尔不待招而赴人之求仁也售不求厚价廉也子岂有道者乎兹楚境也昔有劝屈大夫以餔糟啜醨者岂非子耶为作一篇
889471,予与王瞻叔韩通一林梅卿余知默徐彦才六人皆同庚也一登政路五上禁涂其四久已物故所存者独知默与予耳今日得报知默又已云亡念年齿至此予亦岂久于世者乎怅然有感于怀因成数语以自解
458160,予别肖健，相期不作诗。盖相知廿年，自识其在心者；况有诗不能留，徒触其在中肠者，无诗亦足别，未害其在中肠者乎。迨临行之夜，乃终食言而书此短章二首 其一
731148,御史有以沙汰僧道为请者朕谓沙汰何难即尽去之不过一旨之颁天下有不奉行者乎但今之僧道实不比昔日之横恣有赖于儒氏辞而辟之盖彼教已式微矣且藉以养流民分田授井之制既不可行将此数十百万无衣无食游手好闲之人置之何处耶故特为诗以见意
459651,二月十日拟归乡，忽忆年前今日初见。诵“四月十七，正是去年今日”之句，或恐其来，徘徊不定。然旧事湮消，必无更来之日矣。感怆无端，与其坐愁孤室，毋如决而起行。十三日返，未及归室，径赴中班。见卫生所白梅盛作，更忆去年摘此与之，尝有诗“黑须人对白须花。”同事告予：昨彼来班中还书，不遇转托。因思彼或先至予室，乃更来班。及归室，果得一萎花桌间，果彼来所遗者乎？然乎不然？述其事
458161,予别肖健，相期不作诗。盖相知廿年，自识其在心者；况有诗不能留，徒触其在中肠者，无诗亦足别，未害其在中肠者乎。迨临行之夜，乃终食言而书此短章二首 其二
520368,新丰盖象丰也汉高斯举其亦孝矣予经是地而闻鸡鸣犬吠之声俨有太平气象第未知太公当日果不思丰否亦不知新丰市上犹有斗酒濯足者乎因成一诗以写兴云
