152177,八月十八日与客小集赏岩桂而红梅海棠金林檎
72268,己卯正月十八日与申屠彦德游虎丘得客字
965911,七月十八日与诸人集真于燕誉堂
886352,腊月二十八日与知宗提举分岁郡中啜茶于北楼赏梅于忠献堂知宗即席有诗次韵并简提舶
237708,腊月二十八日与知宗提举分岁郡中啜茶于北楼
737452,九月十八日与杭客游千佛山余不至是山者十四年矣
182695,七月十八日与诸人集真于燕誉堂
480408,三月十八日与亨甫归自城西并玉河而北见宫树参差山日隐映时已薄暮无人声独二骑云
921745,真觉院有洛花，花时不暇往，四月十八日，与刘景文同往赏枇杷
1238959,己卯正月十八日与申屠彦德游虎丘得客字
660089,腊月十八日与冯雪湖潘南山会宿山亭次韵联句 其二
451955,甲申十一月二十八日与江南至卧佛寺探蜡梅，芳蕾满树，皆未放也，十二月与藉舟停云重访，只有几树初开数朵，赋此自嘲
660088,腊月十八日与冯雪湖潘南山会宿山亭次韵联句 其一
948127,八月十八日与客小集赏岩桂而红梅海棠金林檎盛开明日江西美赋四绝句走笔次首篇韵
702974,腊月十八日与冯雪湖潘南山会宿山亭次韵联句
250289,甲申十一月二十八日与江南至卧佛寺探蜡梅
157481,八月二十八日与潘少白刘君曲草酌耕养堂时刘
323641,腊月二十八日与知宗提举分岁郡中啜茶于北楼赏梅于忠献堂知宗即席有诗次韵并简提舶
58997,三月十八日与亨甫归自城西并玉河而北见宫树
1006810,浪淘沙令 九月十八日与千里赏菊三首 其一
101226,真觉院有洛花花时不暇往四月十八日与刘景文
531200,三月二十八日与诸弟出野观社笋舆穿窄径日中乃得平路小憩大梵寺
1005329,八月二十八日与潘少白刘君英草酌耕养堂时刘正仲以求免役入城予亦为群小见厄者也
