372620,闻前都水王荀龙郎中将率二三知旧游天平山寺
1132039,闻前月时事君举象先皆与南宫之选是日读易诗春秋作四首
716783,闻前州守王君谈德庆山川之胜诗以赠之
1091018,闻前月时事君举象先皆与南宫之选是日读易诗春秋作四首 其四
367906,闻前月时事君举象先皆与南宫之选是日读易诗春秋作
1091015,闻前月时事君举象先皆与南宫之选是日读易诗春秋作四首 其一
1190600,余寓汀州沙县病中闻前郑左丞璘随外镇举荐赴洛兼云继有急徵旋见脂辖因作七言四韵戏以赠之或冀其感悟也
1039612,闻前都水王荀龙郎中将率二三知旧游天平山寺
1180951,闻前王使君在泽潞居
1091017,闻前月时事君举象先皆与南宫之选是日读易诗春秋作四首 其三
585059,病中闻前堂花盛开
37222,闻前王使君在泽潞居
737427,奉赠林非闻前辈
490300,丰厓社饮席上闻前星之喜分韵得国字
731205,三月十二日晓发半壁店数里许闻前途有虎即追蹑之至南上落村虎跳入村院遣谙达明喜富英阿登墙发火器殪之诗以纪事
803060,闻前中丞汤公潜庵讣诗以志感
1091016,闻前月时事君举象先皆与南宫之选是日读易诗春秋作四首 其二
950907,上高赵宰同叔遗以诚斋集开卷偶见答徐宋臣监丞书云来帖告诉门生排根尝闻前辈谓受人之恩而不忘者为子必孝为臣必忠盖推是心而信其人也又闻惟以怨报德者为不可测盖以有人之形者必有人之情也故卢杞之于颜公敏中之于文饶之奇之于永叔邢恕之于君实孰测其报恩一至此极哉昔孟尝君有一客孟尝遇之甚厚而客每毁孟尝或问其故客曰人皆誉君而我独毁人必以我为小人而以君为长者此吾所以报君也前五子者其意将无出于此欤至如逄蒙杀羿之事孟子不责蒙而
