104375,李舍人见过·春泥无处所
1190618,奉和峡州孙舍人肇荆南重围中寄诸朝士二篇时李常侍洵严谏议龟李起居殷衡李郎中冉皆有继和余久有是债今至湖南方暇牵课 其二
661733,和汝舍人行敏韵 其一
954184,柴舍人金霞阁
241801,送五时亨舍人帅蜀诗
1052770,呈张邃明舍人
219733,次韵李次仲赴巨山张舍人招赠之什
704342,招姜主客宗孝王杜二舍人王项二文学吴沈刘居四山人集借树轩
976530,春日寄陈舍人
384909,羽可舍人寓居小斋旬余，赋此送别
35185,上舍人徐铉
557183,早春寄明卿舍人时以使事还
10894,李舍人少尹惠家酝一小榼立书绝句
1181059,送彭偃房由赴朝因寄钱大郎中李十七舍人
13895,寄中书同年舍人
992688,哀石昌言舍人 其一
670793,留别吴舍人 其一
1129420,呈胡舍人二首
709311,集海幢酬张青雕舍人
164770,和刘舍人咏雪
1157114,早祭风伯因怀李十一舍人
1196498,偶闻官吏举请辄有一篇寄呈成都府从弟舍人
1155590,得钱舍人书问眼疾
957647,和蜀公紫薇花再发寄中书舍人
423174,凤楼春    和欧阳舍人
238277,赠刘舍人次德裕弟韵
857810,和刘原父舍人雪霁早朝
10891,元日喜闻大礼寄上翰林四学士中书六舍人二十韵
889288,送王舍人彦正奉祠东归
1068923,次韵子公舍人侄纸阁用荆公韵二首 其二
927805,寄谢三城太守韩子华舍人
596066,赠别王舍人化
1038781,酬欧阳舍人寄题醉翁亭诗
1119175,上潘舍人德久
1001684,送中书舍人郑惠叔入国 其二
992799,送石昌言舍人使匈奴
670391,郡斋与舍人赋
103954,韩子华吴长文石昌三舍人见访
90616,寒食雨中同舍人约游天竺
24040,郑州献从叔舍人褎
686341,分题得震泽竹枝词送中书李舍人
650675,挽中书舍人王孟端 其二
923201,送石舍人得告还蜀
140201,送中书王舍人使北虏
812936,题朱麋君舍人鉴成焦山酣睡图四首
137380,奉和刘舍人初雪
302197,七夕寄容舍人
216253,上西垣舍人
81429,和范舍人永康青城道中作
3454,秦中岁晏马舍人宅宴集
914091,出北关门送李舍人使虏
661780,分题得震泽竹枝词送中书李舍人 其四
913382,寄题万元享舍人园亭七景 其七 绵隐堂
591547,寄梁舍人思伯
1196445,送廖舍人江南安抚
138003,夜闻风声有感奉呈原父舍人圣俞直讲
4159,奉寄婺州李使君舍人
1175445,奉和苑舍人宿直晓玩新池寄南省友
1152948,和吴舍人早春归沐西亭言志
15808,奉报翰林张舍人见遗之诗
963501,太一宫斋祭呈司封吴舍人
1000048,紫微舍人宋公爱子侄三人同日得第作诗以纪盛美二首 其一
894449,舍人院观御篆紫微阁榜赐宴奏御
232479,悼吕居仁舍人
152219,次韵陈叔晋舍人殿试笔记
984765,邛州西岩轩阁陋甚抡仲知府舍人侍殿撰公来游惜其颓敝乃更新之既成以书招印同游因成一章
1109301,次韵和秘书省林舍人校书寓兴五首
1003027,陪张舍人出郊
1196075,翰林游舍人清明日入院中途见过余明日亦入西省上直因寄游君
494547,张伯怀舍人素扇面
385968,题潘星斋舍人《中秘校书图》
34631,献徐舍人
192938,次韵和阁长李舍人喜薛梁二舍人及予同时拜命
192938,次韵和阁长李舍人喜薛梁二舍人及予同时拜命
533082,暮春张考功助甫邀游韦氏园时梁舍人思伯偕至 其四
916110,次韵和昭收寄银台李舍人之什
1179303,山中月夜寄朱张二舍人
918126,借舍人吕丈送大雅东还诗韵奉呈
1037393,次韵同经略舍人登七星山
2835,送张舍人佐江州同薛璩十韵
1131431,送邓舍人将漕西淮用舍人坐上诗韵
1131431,送邓舍人将漕西淮用舍人坐上诗韵
496722,赤枣子 其二 欧阳舍人体
353662,张舍人惠古梅酬以拙言
707973,永遇乐 其三 七夕观项王诸剧，同汪蛟门舍人、陆恂若茂才、王子凉内弟、王奕臣内侄、吴介侯甥、长源弟
1046240,和酬子中舍人
998770,寄洪舍人二绝 其二
1113346,呈湖州赵再可舍人二首
1167892,陪族叔刑部侍郎晔及中书贾舍人至游洞庭五首 其三
544358,题杨母册为其子舍人
741251,访叶恒斋舍人南屏诗屋
1072766,安成逢吉守李西美舍人二首 其二
6915,和谢舍人雪夜寓直
41623,在陈旦解酲共哭顾舍人诗
119014,次韵曾子开舍人四月一二日扈从
1094624,次韵潘德久舍人七月廿一夜喜雨五绝 其一
513543,题刘廷问舍人所藏夏仲昭太常晴雨二竹 其一
1195832,立秋后一日与朱舍人同直
13980,元日呈李逢吉舍人
15178,奉和中书崔舍人八月十五日夜玩月二十韵
1247023,送欧阳舍人
12159,和李员外与舍人咏玫瑰花寄徐侍郎
1180931,送卢舍人三首 其三
35186,和徐舍人九月十一日见寄
494427,送胡舍人立之
516430,谢郭舍人赠斑竹杖
165979,闻文潜舍人出试院约毅父考功寻春
1190323,送李舍人携家归江东觐省
527880,闻陆舍人子引罢官兼怀徐舍人德章
527880,闻陆舍人子引罢官兼怀徐舍人德章
1072765,安成逢吉守李西美舍人二首 其一
802996,渔家傲 其八 十二月山家词，和钱舍人葆酚、董孝廉苍水
137736,内直对月寄子华舍人持国廷评
1171176,韩翃舍人即事
162132,谢当涂陈舍人馈姑孰春
310398,寄林文翰舍人
585720,北京吕舍人万乐子世宽明坤病目四十不肯娶遨游四方来访西樵将之藩府勉留住喷玉岩 其一
863550,贺三舍人新入西掖
1089815,亲家张舍人挽词 其一
325564,高阳台·与徐星伯曹玉水两舍人集叶雨辀太守斋赠歌者似兰次雨老原韵
974606,浣溪沙 其二 和洪舍人
802992,渔家傲 其四 十二月山家词，和钱舍人葆酚、董孝廉苍水
324133,寄贺刘美中舍人直学士院
320315,王舍人庄·西出齐州似不远
11265,寄中书李舍人纾
11577,奉和太常王卿酬中书李舍人中书寓直春夜对月见寄
1171441,上令狐舍人
8921,巴陵早秋寄荆州崔司马吏部阎功曹舍人
1079434,奉怀张公潜舍人二首 其一
1072583,谒王宣子舍人
402063,闲步至苦槠湾村舍人家小坐
181314,昝舍人锦江泛舟
953732,奉和刘舍人初雪
12386,早春书事奉寄中书李舍人
164037,西省斋宿陪侍左史曹舍人话旧以除当字赋诗下
34936,贺殷游二舍人入翰林江给事拜中丞
1089502,再次韵并呈舍人叔丈
1108866,送真舍人帅江西八首
1173611,太子张舍人遗织成褥段
1094627,次韵潘德久舍人七月廿一夜喜雨五绝 其四
191092,中书郡舍人挽诗
1053232,曾子固舍人挽辞 其一
934982,送李舍人赴阙
520808,题沈山人藏王舍人竹枝
482630,赋得无诸城送浦舍人源归晋陵
730351,题朱麋君舍人鉴成焦山酣睡图四首 其三
852811,挽崔舍人 其一
331065,干誉舍人将赴召前一日录示左丞公昔年见寄佳什辄用韵奉送
104256,欧阳永叔王原叔二翰林韩子华吴长文二舍人同
1126259,和曾舍人梅影雪意二首 梅影
599020,月夜吴舍人过集
1166984,寄白二十二舍人
1156325,赴苏州至常州荅贾舍人
103261,和吴冲卿江邻几二学士王景彝舍人秋兴
533087,暮春张考功助甫邀游韦氏园时梁舍人思伯偕至 其九
1052824,依韵和呈刘贡父舍人三首 其三
1191320,元日喜闻大礼寄上翰林四学士中书六舍人二十韵
1236231,次韵康子山舍人二首
52886,秋夜浦舍人见宿园亭分得天字
152149,闻西省赏酴醿芍药戏成小诗奉简泰之侍讲舍人
189796,送刘贡父舍人
11536,奉和李舍人昆季咏玫瑰花寄赠徐侍郎
1196673,奉和武功学士舍人纪赠文懿大师净公
529902,吴舍人园亭
159493,送石舍人赐告还乡
134658,送昌言舍人得告蜀
975473,送曹提干归永嘉兼寄陈君举舍人 其二
716756,七夕家舍人兄奉命归娶赋赠
1032060,闻高舍人锡下世
169983,上潘舍人·淛水人如大雅诗
23046,寄瑉笛与宇文舍人
307439,顾鹤逸画山水卷子为曹君直舍人题
183901,次韵刘叔贡舍人从驾
32876,寄同年封舍人渭
538782,倪舍人八十有三矣犹能跨马见访招提赠以佳句第用赐环为慰差非鄙怀聊抒奉答
31748,和张舍人·玉女盆边雪未销
92147,见潭师刘恭父舍人·云雾开衡岳
948365,闻西省赏酴醾芍药戏成小诗奉简泰之侍讲舍人年兄并以丁香橄榄百枚助筵却求残花数枝 其一
748915,客怀柬龚定庵舍人 其四
1180930,送卢舍人三首 其二
353472,再次外舅韵戏呈舍人叔丈
1167013,新除水曹郎答白舍人见贺
124782,和天休舍人奉祠太一宫见寄
15054,河南王少尹宅燕张常侍白舍人兼呈卢郎中李员外二副使
384246,连日奔走尘冗怀抱欠佳偶过顾舍人汝由研山
694623,送邢大舍人二首
1089816,亲家张舍人挽词 其二
104774,送谢舍人奉使北朝
360661,燕待宫使郭舍人致语
1126505,依韵和刘原甫舍人扬州五题 时会堂二首
156837,挽崔舍人·雅望高簪履
906126,宫使待制舍人赵公挽诗 其二
891943,和天休龙图经句署怀旧忆道卿舍人并见寄 其一
648032,送中书徐舍人归省兼问讯乃父茂良
969947,挽崔舍人 其一
139990,次韵李参政上刘舍人阁学
1118226,新津小宴之明日欲游修觉寺以雨不果呈范舍人二首
868505,诗悼路钤舍人德久潘公三首 其三
4301,过裴舍人故居
594316,诚意伯刘国祯招饮同郑光禄赵舍人集
538908,赠别惟敬北上兼简梁舍人
735192,韩圣秋舍人见过响山草堂即事 其一
1037897,哀石昌言舍人 其三
955451,和运使舍人观潮 其二
691962,吴舍人丧内
347444,贺吕子进舍人告谢
718485,寿钱舍人母 其一
1174233,寄珉笛与宇文舍人
1139062,送经之偕义斋两舍人入燕并呈善之待制
115670,次韵孔舍人曝书
321946,悼汪舍人养源
1034041,嘉定甲戌孟秋二十有七日起居舍人兼直学士院真德秀上殿直前奏边事不顾忌讳一疏万言援引古今铺陈方略忠谊感激辞章浩瀚诚有补于国家天台戴复古获见此疏伏读再三窃有所感敬效白乐天体以纪其事录于野史
278622,杨舍人墓·相传杨舍本荒丘
1090507,和万舍人分惠鲎鱼 其一
1053233,曾子固舍人挽辞 其二
334928,起居方舍人挽诗
533084,暮春张考功助甫邀游韦氏园时梁舍人思伯偕至 其六
27051,酬王舍人雪中见寄
104238,和刘原父舍人乐郊诗
1195743,鼎臣学士侍郎楚金舍人学士以再伤庭梅诗同垂宠和清绝感叹情致俱深因成四十字陈谢
36628,和李舍人使君纾题云明府道室
1160474,题从伯舍人道正里南园
192588,閤门钱舍人知全州
170184,和潘舍人·不能百里马牛风
560047,挽金中书舍人父文鼎先生其人能诗善画
1153197,广陵送别宋员外佐越郑舍人还京
840686,梁溪有杰士一首为孙伯瑜舍人作
1152784,寓居沣上精舍寄于张二舍人
18421,初罢中书舍人
37445,送陈秀才赴举兼寄韩舍人
517629,过昆陵怀浦舍人源
351161,次韵和曾子固舍人
1072671,陪元勃舍人秀实监丞游彻见阁
1049605,和后唐王仁裕舍人留题自然观
363509,比过石壁访王元渤舍人欲观棋战闻同鱼轩出游
892617,贺紫微舍人改镇
916367,省中当直即事书怀兼简阁长李舍人
764973,五福丽中天 贺大司农苍嵓梁先生育麟，次汪蛟门舍人原倡
575886,武昌别鲁侍仪舍人文浚
593178,游程舍人樗园 其二
1164729,送宇文舍人出宰元城
177956,寄海州副使田舍人
464243,满庭芳 涂钝庵舍人出新姬相见，调之
384168,次郭羽可舍人《同憩龙蟠洲小风月亭遣兴》原韵
43527,路舍人客居太湖东山三十年寄此代柬
26185,寄柳舍人宗元
5001,书情题蔡舍人雄
504120,题史仲愚舍人终南山色图
332003,疏影·咏落照遥和钱舍人
364613,次韵和秘书省林舍人校书寓兴
1167016,酬白二十二舍人早春曲江见招
192911,次韵和太僕钱少卿寄赠编修主人宋承旨李舍人
158003,送紫微沈舍人守越州
340237,朝中措·元夕上潭帅刘共甫舍人
897974,赴亳州教官次韵和中书钱舍人及亳州守晁美叔见赠
98653,舍人·要识公兄弟
5055,赠别舍人弟台卿之江南
1217642,刘舍人桃花马歌
527884,怀王舍人文熙
137523,和原甫舍人阁下午寝归有作
869811,寓泊郑圃寄献昌言舍人
948915,和范至能舍人农圃堂韵
924258,曾子固舍人挽词
1046030,和彦常舍人元夕扈从二首 其一
1115103,送王吉州宣子舍人知明州二首
1121600,和运使舍人观潮
1081211,次韵李伯纪舍人食了斋所寄石芝有感
894108,和柴天休郑舍人奉祠太一见怀之作
670794,留别吴舍人 其二
923024,次韵宋次道庆黄安中李邦直二舍人皆自史院拜命
117321,送翟公巽赴中书舍人
1179989,郑州献卢舍人
191106,和万元亨舍人送芡实
1139034,送节之衡之两舍人入燕
993859,陪韩子云吊张安国舍人墓
200215,次姚舍人·斜岸乌纱落魄裘
142565,和韵寄董令升舍人
1191355,奉和王侍郎春日喜李侍郎崔给谏张舍人韦谏议见访因命觞观乐之什
533016,秀林亭为王舍人桓赋
364310,次韵和王舍人灯夕见寄
17715,早祭风伯因怀李十一舍人
21655,和李十二舍人冬至日
1107566,诗悼路钤舍人德久潘公三首
895048,悼吕居仁舍人
118171,曾子固舍人挽词
22748,再下第将归荆楚上白舍人
909616,临江仙 甲寅中秋和刘舍人赏月
368184,和阁老舍人曝书会
1028721,中书黄舍人父总干挽诗 其一
1061274,宝志禅师梁天监中将入寂然一烛付后阁舍人吴庆庆以事闻帝叹曰大师不复留矣烛者将以后事嘱我乎颂
206455,酬和知制诰孙舍人见寄
103454,哀石昌言舍人
331048,送韦子骏赴中书舍人召
992233,汴水斗减舟不能进因寄彦国舍人
1130056,曾子固舍人挽辞
513544,题刘廷问舍人所藏夏仲昭太常晴雨二竹 其二
1072893,离行在别胡舍人
1046695,送郑毅夫舍人被召五首 其三
1174988,和令狐舍人酬峰上人题山栏孤竹
1196070,谪居舒州累得韩高二舍人书作此寄之
39090,上徐舍人铉
118116,次韵孔武仲三舍人省上
343393,寄邓舍人·顷随旌旆按东州
22877,早春阁下寓直萧九舍人亦直内署因寄书怀四韵
225735,春日寄陈舍人
1215913,送南宫舍人赵子期出使安南
894238,送紫微夏舍人徙治洪州
178218,和陈州田舍人留别
652970,赠中书舍人朱孔昜
842690,冬日同易实甫兵备顺鼎沈小沂舍人兆祉游邻霄台
780066,疏影 咏落照遥和钱舍人
630103,送黎舍人美周
1125421,送刘贡父舍人二首
548428,赠管舍人御赐烛笔等物六首时丙戌新正二日王孝廉邸舍即席赋 其五 五色丝绦
528572,送徐舍人使南都
1151774,和贾舍人早朝大明宫之作
1051477,雪中会孙洙舍人饮王氏西堂戏成三绝 其三
158272,紫微舍人宋公爱子侄三人同日得第作诗以纪盛
999095,挽吴春卿舍人
935985,和范舍人病后二诗末章兼呈张正字 其二
18387,与沈杨二舍人阁老同食敕赐樱桃玩物感恩因成十四韵
514239,沛县端午与同行徐敬夫舍人王去私司务赵梦麟主事
25277,酬隐珪舍人寄红烛
845124,摸鱼儿 人日谢何诗孙舍人送酒
1174966,元日呈李逢吉舍人
1107753,紫微石舍人挽歌二首
1059117,奉和邢舍人寄望之愚溪朝阳岩 其二
533775,梁舍人李环卫招同王杨丘三曹长康曹管张四山人游邓园得云字
103554,次韵和吴仲庶舍人送德化郭尉
860400,挽张舍人安国四首 其四
830916,摸鱼儿 其一 人日谢何诗孙舍人送酒
1195918,江舍人宅筵上有妓唱和州韩舍人歌辞因以寄
1195918,江舍人宅筵上有妓唱和州韩舍人歌辞因以寄
353473,再次韵并呈舍人叔丈
372183,潘舍人重打带
542323,冬夜同徐比部子与吴舍人明可听张肖甫鼓琴得声字
1149983,上张舍人
183891,次韵宋次道庆黄安中李邦直二舍人皆自史院拜
225392,谢李舍人题额
670795,留别吴舍人 其三
1048685,九月十八夜宿莱州海庙夜分登亭望月观海呈伯温舍人
32903,和王舍人崔补阙题天王寺
1201513,捣练子 赠李舍人
704382,万寿节和吴舍人约卿
593425,同伍舍人谢侍御饯朱民部使代州便道省觐二首 其一
650507,赠吴舍人胜复任还南京
1165766,早春书事奉寄中书李舍人
1064481,雪夜至明教寄王路分舍人
332166,解连环·咏芦花遥和钱舍人
20586,太子刘舍人邀看花
986873,王清叔舍人玉寒堂
5150,留别贾舍人至二首
1027669,范叔刚舍人示文正公象笏
13312,送崔舍人起居
991607,韩子华吴长文石昌言三舍人见访
585577,送吕奉朝舍人来省北归干前程
892439,和天休舍人奉祠太一宫见寄
267474,木兰花慢·题半塘老人秋窗忆远图，图为况夔笙舍人拓寄江总栖霞残碑而作
183949,次韵王都尉团练押赐高丽归使宴射赠馆伴舍人
1195958,和殷舍人萧员外春雪
1093284,陈君举舍人集新刊三山因读其诗有感
735891,寄赠高澹人舍人
1035588,送王专王衢之许下自维扬谒孙学士王舍人
164411,知刘舍人咏秋千
241723,和蜀公紫薇花再发寄中书舍人
377701,赠子固舍人
1153709,中书舍人李座上送颍阳徐少府
185121,挽王元渤舍人
124352,挽崔舍人·久托奎躔照
13911,酬裴舍人见寄
992798,送石昌言舍人还蜀拜扫
860403,挽张舍人安国四首 其一
533136,招姜主客宗孝王杜二舍人王项二文学吴沈刘居四山人集借树轩 其一
858623,上西垣舍人
82033,送范舍人还朝
915647,寄题万元享舍人园亭七景 其二 蒲鱼港
1186310,中书王舍人辋川旧居
746689,六月十二山谷生日邵蕙西舍人招吴子叙编修张石舟大令朱伯韩侍御赵伯厚赞善曾涤生学士冯鲁川主政龙翰臣修撰刘蕉云学正及曾亮凡十人集于寓斋舍人有诗属和
746689,六月十二山谷生日邵蕙西舍人招吴子叙编修张石舟大令朱伯韩侍御赵伯厚赞善曾涤生学士冯鲁川主政龙翰臣修撰刘蕉云学正及曾亮凡十人集于寓斋舍人有诗属和
1196038,寄和州韩舍人
863555,贺范舍人再入西掖
1195358,喜侯舍人蜀中新命三首
1072479,和程子山舍人赠高虞卿
548426,赠管舍人御赐烛笔等物六首时丙戌新正二日王孝廉邸舍即席赋 其三 墨
245426,题蒲传正舍人清风阁
10117,奉和苑舍人宿直晓玩新池寄南省友
649420,送中书舍人陈彝训赴北京 其二
482683,秋夜浦舍人见宿园亭分得天字
303120,哭容舍人·潜颖趋陵苕
593172,人日过吴舍人
607996,元宵与二客同饮用杜工部赠田舍人韵
596012,秋夜滕王阁登眺答林舍人见寄
806838,采桑子 其八 为汪蛟门舍人题画册十二帧
1185259,许下书情寄张韩二舍人
1153923,陪中书李纾舍人夜泛东池
1172022,和张舍人中书宿直
909166,和刘舍人夏雨喜霁
345053,胶水道中逢九日呈温伯舍人
1117268,送中书潘舍人省上二首
473351,李舍人孤山草堂坐雨
15047,白舍人曹长寄新诗有游宴之盛因以戏酬
388152,送顾舍人使金陵还松江
104519,送石昌言舍人还蜀拜扫
863499,和陈州田舍人留别 其五
768590,瑶华慢 高澹人内翰入直南书房，上手摘白石榴一枚赐之，舍人尝不敢竟携归，命友人作半榴图，因题卷末
1175017,送章孝标校书归杭州因寄白舍人
540421,赠别梁舍人鈙 其一
609222,朱舍人有吴门之役先过河间官舍省亲寻归湖州因忆君采舍人亦以去秋奉使过家
609222,朱舍人有吴门之役先过河间官舍省亲寻归湖州因忆君采舍人亦以去秋奉使过家
863841,送田舍人出牧淮阳
1130827,次韵潘德久舍人七月廿一夜喜雨五绝
860439,上九江唐舍人一首五十韵
1072475,送王舍人超武
1156483,寄李相公崔侍郎钱舍人
798000,法曲献仙音  寄严览民钱宝汾顾华峰三舍人
1052809,依韵和曾子开舍人从驾孟飨景灵宫四首 其四
1043549,次韵和秘书省林舍人校书寓兴五首 其四
10692,许下书情寄张韩二舍人
189812,舍人·观也本诸生
906884,谒冷朝奉路逢王才元舍人同往
94396,赣守张子智舍人寄诗送酒和韵谢之
34904,早春旬假独直寄江舍人
522694,又赠王舍人四首 其一
720195,寄李舍人雯
360434,和酬子中舍人
709255,忆邝舍人湛若
992230,汴之水三章送淮南提刑李舍人 其三
593165,游吴舍人贲园
1088984,寄张真父舍人 其二
349376,依韵和曾子开舍人从驾孟飨景灵宫
147909,贺叶司业兼中书舍人
150567,赋张舍人抱啸堂
92448,见澹庵胡先生舍人
572898,宣城饮王舍人家留别
1072848,送王舍人赴明州过阙二首 其二
961374,闰七夕呈谯内知舍人
548416,寒夜管舍人顾文学过集分得删字
1176409,奉和袭美寄琼州杨舍人
1072234,酬王元渤舍人方智善学士求余作墨竹一首
1053213,赠子固舍人 其二
780059,解连环 咏芦花遥和钱舍人
931275,玉牒所迎驾望见周洪道舍人
538028,吕舍人移疾归吴
537823,顾舍人夏日过访弘法寺 其一
1043527,和贾舍人春祠太一坛二首 其二
806840,采桑子 其十 为汪蛟门舍人题画册十二帧
1094288,送爆竹潘舍人
496721,赤枣子 其一 欧阳舍人体
592081,酬王舍人仪甫潞河见寄
592073,首夏沈鸿胪宅同吴侍书黎秘书顾舍人赏牡丹
1105806,送董令升舍人归朋溪二首
1117602,依韵和曾子开舍人从驾孟飨景灵宫四首
806836,采桑子 其六 为汪蛟门舍人题画册十二帧
1180929,送卢舍人三首 其一
906127,宫使待制舍人赵公挽诗 其一
922896,又送石舍人
1156746,与沈杨二舍人閤老同食敕赐樱桃玩物感恩因成十四韵
865290,次韵李舍人
1000949,挽王元渤舍人二首 其二
917015,赠程舍人近侍入闽
13931,和令狐舍人酬峰上人题山栏孤竹
869541,和运使舍人北园饯别行憩三交僧舍冒雪宿百井关见寄
722356,寿钱舍人母
207000,待制中书舍人陈公之亡以山宅须利既迁殡而未
1194416,陪族叔刑部侍郎晔及中书贾舍人至游洞庭五首
1129406,诗挽曾舍人张氏二首
751084,与谢舍人论文
1043548,次韵和秘书省林舍人校书寓兴五首 其三
1070390,送傅舍人国华使高丽二首 其一
748076,将游浙江魏默深舍人赋诗赠行次韵奉答
807189,洞仙歌  题乔石林舍人桃源图小照
378024,子固舍人·吏部遗编久寂寥
232105,题张安国舍人平沙落雁图
1216026,季长弟由国子生除侍仪舍人喜赋二首 其二
16237,寄白二十二舍人
1043690,原父舍人爰自春坊迁职史氏未更晦望旋有新命增秩谏省跻荣纶阁斐然成篇以伸欢贺
899287,寄田锡舍人
1167775,巴陵赠贾舍人
710219,送谭天水游燕赴周舍人之约
1160079,和令狐相公晚泛汉江书怀寄洋州崔侍郎阆州高舍人二曹长
1027788,唐舍人挽词 其二
44672,鹧鸪天·庚申除夕和吴伯宛舍人
648779,蔡舍人挽诗
566016,送中书舍人王子永入京一首
914577,送王吉州宣子舍人知明州二首 其一
601112,和贾舍人早朝大明宫
25368,投杜舍人
917575,菩萨蛮 其一 春日呈安国舍人
104140,还吴长文舍人诗卷
42950,梁溪顾梁汾舍人过访赋此以赠兼题其小像
1107407,和衢守张舍人龙眠捉马图诗
914076,见周子充舍人叙怀
31364,和王舍人抚州饮席赠韦司空
1157166,自到郡斋仅经旬日方专公务未及宴游偷闲走笔题二十四韵兼寄常州贾舍人湖州崔郎中仍呈吴中诸客
34757,献中书汤舍人
151020,和潘德久舍人见惠
1154902,和李员外与舍人咏玫瑰花寄徐侍郎
1045955,次韵李才元舍人二首 其二
192923,次韵和慎大詹中秋待月寄西掖三舍人之什
377705,曾子固舍人挽辞
240479,挽中书舍人叶公
1175081,寄中书同年舍人
383324,乙未十月傅金沙侍御殷洗心舍人过访山中赋赠
863496,和陈州田舍人留别 其四
536939,为吴舍人题匈奴出猎图
1117128,雪中会孙洙舍人饮王氏西堂戏成三绝
806834,采桑子 其四 为汪蛟门舍人题画册十二帧
1186322,过王舍人宅
1184546,赠刘舍人古意
1186312,太子李舍人城东别业与二三文友逃暑
5741,和张舍人夜直中书寄吏部刘员外
1071420,起居方舍人挽诗二首 其二
1043455,立春谢赐幡胜口号呈子瞻冲元内翰子开器资舍人
702297,题浦舍人画梧桐竹石
35550,从弟舍人惠茶
244146,挽张舍人安国
863551,贺冯起张秉二舍人
364565,次韵和张舍人北使归
384922,应诏将入京，羽可舍人寄诗赠行，次韵留别
24836,重阳日寄韦舍人
955958,虎丘新复古石井泉太守沈虞卿舍人劝农过之为赋三绝谨次韵 其二
148506,观故中书舍人张公所书时氏家系
1180804,赠抱麻刘舍人
504162,题中书舍人朱孟辩墨竹
1029008,秋释奠于学万舍人示诗次韵以酬
597938,薛舍人尊甫寿卷
662405,答蔡舍人从善次韵 其一
103611,汴之水三章送淮南提刑李舍人
1179464,张舍人南溪别业
235768,赠程舍人近侍入闽
516287,挽黄门林克翀其子任中书舍人
940259,蝶恋花 送彭舍人罢徐
1037659,送石舍人得告展省
533920,送秦舍人汝立归无锡时补玉官不赴
1116132,起居方舍人挽诗二首
661777,分题得震泽竹枝词送中书李舍人 其一
8852,冬晚送长孙渐舍人归州
14394,同水部张员外籍曲江春游寄白二十二舍人
1001307,观故中书舍人张公所书时氏家系
538323,寄吴舍人明卿
702477,题刘廷问舍人所藏夏仲昭太常晴雨二竹
1164163,薛舍人见徵恩赐香并二十八字同寄
150815,方叔元振元老同令侄舍人见访
851806,上亭北轩对月吹笛得才元舍人昭华引醉霜月草堂吟皆诗谱也 其二
923952,次韵曾子开舍人四月一二日扈从二首 其二
257426,四舍人生日
56848,送张舍人还永嘉
1104890,送提举太平观熊舍人
125543,监中会两禁诸公饮饯吴舍人梁正言富修撰叶龙
936740,读吕舍人诗追次其韵五首 其二
105622,太庙致斋答韩舍人简
1048683,胶水道中逢九日呈温伯舍人
2338,同李舍人冬日集安乐公主山池
