991541,晨起裴吴二直讲过门云凤阁韩舍人物故作五章以哭之 其一
796437,满江红 题张璚隐舍人《长毋相忘室填词图》
219922,次韵洪六丈舍人苏黄马券
1179382,和杨三舍人晚秋与崔二舍人张秘监苗考功同游昊天观时中书寓直不得陪随因追往年曾与旧僚联游此观纪题在壁已有沦亡书事感怀辄以呈寄兼呈东省三给事之作杨君见徵鄙词因以继和
1179382,和杨三舍人晚秋与崔二舍人张秘监苗考功同游昊天观时中书寓直不得陪随因追往年曾与旧僚联游此观纪题在壁已有沦亡书事感怀辄以呈寄兼呈东省三给事之作杨君见徵鄙词因以继和
946856,寄扬州知府钱舍人
901708,呈湖州赵再可舍人二首 其一
1047209,谨次君倚舍人寄题惠山翠麓亭韵
1196385,奉和武功学士舍人纪赠文懿大师净公 其三
37241,送卢舍人三首
810913,清明后十日陈古华农部招同秦小岘舍人邵荻香徐郎斋两孝廉小饮肄书次小岘韵
948364,闻西省赏酴醾芍药戏成小诗奉简泰之侍讲舍人年兄并以丁香橄榄百枚助筵却求残花数枝 其四
1127736,久与广西帅年丈左史张舍人别自琼罢归过静江相见
1118735,读吕舍人诗追次其韵五首
533080,暮春张考功助甫邀游韦氏园时梁舍人思伯偕至 其二
978941,前起居舍人何资深竹光酒法奇甚近得其法酿成以饷李仁甫
434713,跋张舍人所收杨仲明天厩铁骢图
1186333,奉和中书常舍人晚秋集贤院即事寄徐薛二侍御
683340,顾舍人夏日过访弘法寺
1126812,舍人崔公挽词
860401,挽张舍人安国四首 其三
135953,唐舍人挽词
860402,挽张舍人安国四首 其二
132570,舍人·西船满载下东州
916160,李舍人独直
178194,酬赠田舍人
915645,寄题万元享舍人园亭七景 其四 闲世界
137427,答子华舍人退朝小饮官舍
9330,赠阙下裴舍人
1085750,题无隐斋寄交代张真父舍人
215582,和唐公舍人访净因
164771,和刘舍人夏雨喜霁
592173,同项思尧黎惟敬诸君饮顾光禄汝所齐中乃兄汝由直阁汝和舍人皆在会
1086294,悼汪舍人养源
29609,上张舍人
5864,和吴舍人早春归沐西亭言志
1029139,中书黄舍人父总干挽诗 其二
16111,酬白二十二舍人早春曲江见招
748566,访端木子彝舍人
806842,采桑子 其十二 为汪蛟门舍人题画册十二帧
1154874,晚秋西省寄上李韩二舍人
661779,分题得震泽竹枝词送中书李舍人 其三
988068,殿庐纪怀敬用右史舍人韵
191200,正卿不见累日闻十二日与郑丈舍人游何山书此
1115312,寄题万元享舍人园亭七景 意山
749,酬通事舍人寓直见示篇中兼起居陆舍人景献
749,酬通事舍人寓直见示篇中兼起居陆舍人景献
875606,送真舍人帅江西八首 其二
602572,七夕同欧崙山廷评袁平洲光禄金我玄舍人朱仲修集梁舅氏祠部宅得陵字
1176716,太子刘舍人邀看花
137992,夷陵书事寄谢三舍人
82863,新津小宴之明日欲游修觉寺以雨不果呈范舍人
916112,次韵和阁长李舍人喜薛梁二舍人及予同时拜命之什
916112,次韵和阁长李舍人喜薛梁二舍人及予同时拜命之什
138186,官舍假日书怀奉呈子华内翰长文原甫景仁舍人
52848,赋得无诸城送浦舍人源归晋阳
1002791,送欧阳员外归觐滁州舍人
1194427,留别贾舍人至二首
528519,雨过徐舍人
1043669,致斋中太一宫见屏风有唐贤和常舍人诗因次韵寄子瞻内翰子由侍郎子开舍人穆父待制数公皆尝祠太一也
1043669,致斋中太一宫见屏风有唐贤和常舍人诗因次韵寄子瞻内翰子由侍郎子开舍人穆父待制数公皆尝祠太一也
1046039,子进舍人北归过衡阳累曰会话粗释暌间之念复辱佳章存慰衰朽辄次韵以谢
593934,冬夜同李比部黎司勋黄李二进士集金舍人宅和得比部二韵 其一
923777,同陈述古舍人观芍药
593312,顾舍人元浚携酒晚过
894272,流杯小宴偶成拙诗奉呈运使王密学紫微韩舍人
999154,谢中书施舍人宴集
961579,赋张舍人抱啸堂五首 其三
354495,和刘舍人·剪綵微茫比丝发
13965,酬令狐舍人
539130,送梁舍人奉使还岭南
1186729,和翰林吴舍人兄弟西斋
695719,冬夜同李比部黎司勋黄李二进士集金舍人宅和得比部二韵
1192489,酬杜舍人
1170579,苏州元日郡斋感怀寄越州元相公杭州白舍人
1105993,依韵和贾直孺舍人初春祠左太乙二首
1000950,挽王元渤舍人二首 其一
1153824,和裴延龄尚书寄题果州谢舍人仙居
35004,亚元舍人不替深知猥贻佳作三篇清绝
332495,永遇乐·七夕观项王诸剧，同汪蛟门舍人、陆恂若茂才、王子凉内弟、王奕臣内侄、吴介侯甥、长源弟
1196383,奉和武功学士舍人纪赠文懿大师净公 其一
856017,和张安国舍人
548424,赠管舍人御赐烛笔等物六首时丙戌新正二日王孝廉邸舍即席赋 其一 烛
1116049,挽吕舍人二首
1016343,诗挽曾舍人张氏二首 其一
1107166,寄邓舍人二首
1043519,次韵和王舍人酬王工部早朝
1195629,再见从弟舍人
533923,送王舍人赍林端简恤典至闽中兼扶侍还琼海
12373,寄中书李舍人
233718,寄潘德久·舍人宾日姿
1085790,送何希深舍人赴召
1029160,和万元亨舍人送芡实
547420,乙未十月傅金沙侍御殷洗心舍人过访山中赋赠
287163,梁溪有杰士一首为孙伯瑜舍人作
1188916,喜侯舍人蜀中新命三首 其三
137392,奉酬长文舍人出城见示之句
955956,虎丘新复古石井泉太守沈虞卿舍人劝农过之为赋三绝谨次韵 其三
600486,送梁浮山舍人往濮阳祭葬尚书苏公
137738,暮春书事呈四舍人
1003794,西省斋宿陪侍左史曹舍人话旧以除当字赋诗下教和答 其二
1126452,晨起裴吴二直讲过门云凤阁韩舍人物故作五章以哭之
1175583,和韦舍人早朝
683809,赠别梁舍人鈙
191344,次张安国舍人读王侍郎诗有怀其人韵
117735,同陈述古舍人观芍药
155208,谢中书施舍人宴集
867512,挽崔舍人 其一
1161111,晦日与卢舍人同诣补阙城南林园
1052806,依韵和曾子开舍人从驾孟飨景灵宫四首 其一
385999,又次郭舍人见寄韵
992218,李舍人淮南提刑
88793,送真舍人帅江西
1054913,南楼有作呈仲矩舍人
1016317,呈胡舍人二首 其一
856068,和韵寄董令升舍人
631171,陆义山舍人入山
12434,和钱舍人水植诗
22255,夏日梅溪馆寄庞舍人
1115139,薛舍人母方氏太恭人挽章二首
902638,送马舍人赴建康军幕
556709,简吴明卿舍人
998963,次韵宇文舍人见贻之作
5351,与贾至舍人于龙兴寺剪落梧桐枝望灉湖
30001,经张舍人旧居
992626,欧阳永叔王原叔二翰林韩子华吴长文二舍人同过弊庐值出不及见
1165328,和杨舍人咏中书省花树
1121794,虎丘新复古石井泉太守沈虞卿舍人劝农过之为赋三绝谨次韵
844111,寄林文翰舍人
1182190,和李舍人秋日卧疾言怀
1177329,奉和白舍人游镜湖夜归
1152033,酬严少尹徐舍人见过不遇
488421,送詹淑正还新安寿母兼同颜舍人质卿同登太山 其一
970501,赠赵舍人
533361,赠顾舍人
330500,次韵叶舍人
295944,章一山属题潘黻庭舍人日记残本
709600,哭容舍人
856063,和董令升舍人梦中得句
996609,次韵文潜同游王舍人园
991019,李舍人见过
1173465,冬晚送长孙渐舍人归州
676416,雪晴同吕舍人顾汝所南郊閒步
743560,清明后十日陈古华农部招同秦小岘舍人邵荻香徐郎斋两孝廉小饮肄书次小岘韵 其二
137726,寄阁老刘舍人
913381,寄题万元享舍人园亭七景 其六 倚苕
90531,中书胡舍人玉堂夜直用万里所和汤君雪韵和寄
1035729,赠三门漕运钱舍人
1177090,和徐舍人九月十一日见寄
103486,次韵和范景仁舍人对雪
17499,答崔侍郎钱舍人书问因继以诗
713620,送家舍人
345054,九月十八夜宿莱州海庙夜分登亭望月观海呈伯温舍人
998769,寄洪舍人二绝 其一
1068922,次韵子公舍人侄纸阁用荆公韵二首 其一
1046696,送郑毅夫舍人被召五首 其四
479182,挽张世琏舍人
1168704,题瓜州新河饯族叔舍人贲
93384,送王成之中书舍人使虏
857781,依韵和贾直孺舍人初春祠左太乙二首 其一
137390,奉酬扬州刘舍人见寄之作
1069525,谢王七舍人施手写华严经并大藏等经及弥陀像 其三
1195744,上舍人徐铉
21673,和李十二舍人直日放朝对雪
530257,夜访吾舍人廷介留酌
992320,依韵和李舍人旅中寒食感事
857780,依韵和贾直孺舍人初春祠左太乙二首 其二
34892,献中书潘舍人
737929,庄愈庐舍人斋中双盆梅歌次陆根堂编修韵
1078337,送李似之舍人归连江旧隐二首 其一
61493,留守舍人张公安国闻维筑亭题其榜曰朝阳既去
1054033,送提举太平观熊舍人 其二
896308,次韵子由舍人先生追读迩英绝句四首 其二
953873,答子华舍人退朝小饮官舍
100763,次韵穆父舍人再赠之什
749299,答潘辛芝舍人见赠次韵
548500,题紫宸宣对册赠管建初舍人
1072188,雪夜一首呈傅舍人
24878,访沉舍人不遇
126768,寄陕守祖择之舍人
991467,食橙寄谢舍人
35493,送从弟舍人入蜀
1161881,酬崔舍人阁老冬至日宿直省中奉简两掖阁老并见示
772873,送陈省三舍人望曾归台湾 其二
863318,舍人院竹
514836,题柳文范舍人画右军观鹅便面
820311,鹧鸪天  己亥三月别曾舍人
173960,邛州西岩轩阁陋甚抡仲知府舍人侍殿撰公来游
869696,送昌言舍人得告还蜀三首 其三
475899,过汪中山舍人园亭二首 其一
1167924,与贾至舍人于龙兴寺剪落梧桐枝望㴩湖
806837,采桑子 其七 为汪蛟门舍人题画册十二帧
105213,舍人杨州·今年太守采茶来
1130774,次韵潘舍人画轴
889995,上西平/金人捧露盘 送陈舍人
969948,挽崔舍人 其二
12254,晚秋西省寄上李韩二舍人
995263,舍人崔公挽词 其二
13612,酬崔舍人阁老冬至日宿直省中奉简两掖阁老并见示
320483,送提举太平观熊舍人
1164219,和张舍人
256680,五舍人生朝
1043416,钱穆甫杨康功使高丽还为中书舍人书此为寄
1182898,吐蕃党舍人临刑
909493,八声甘州 其七 寿刘舍人
597575,寄吴舍人明卿
135127,李起宗舍人悠然亭
992467,和吴冲卿江邻几二学士王景彝舍人秋兴
1158836,奉寄婺州李使君舍人
52913,呈浦舍人
1095220,拜吕舍人墓
14572,薛舍人使君观察韩判官侍御许雨晴到所居既霁先呈即事
1106611,安成逢吉守李西美舍人二首
370406,次韵潘舍人画轴
1153071,寄中书刘舍人
61491,次韵同经略舍人登七星山
851807,上亭北轩对月吹笛得才元舍人昭华引醉霜月草堂吟皆诗谱也 其一
1094289,潘舍人重打带
1072258,次韵周秀实监丞嘉仲府判叔侄贻王元渤舍人二首诗中见反且恨不与奕棋之会 其二
1058219,入境寄集贤林舍人
999101,挽唐立夫舍人
11333,中书舍人李座上送颍阳徐少府
10233,会稽山居寄薛播侍郎袁高给事高参舍人
865397,谢李舍人题额
9279,太子李舍人城东别业与二三文友逃暑
645145,送中书舍人唐存恕归省
309135,庆宫春·寄怀文叔问舍人苏州
1131447,和万舍人折赠蜡梅韵
360659,燕待知滁州郭舍人致语口号
891874,戏招君况舍人
1195985,秋日雨中与萧赞善访殷舍人于翰林座中作
280598,江城子·毗陵道中简丁舍人
814106,采桑子 为汪蛟门舍人题画册十二帧
1157475,荅崔侍郎钱舍人书问因继以诗
330628,挽董舍人·华发年方永
1072562,王舍人生辰作
220635,和运使舍人观潮
1188437,送孙舍人归湘州
377968,酬刘巨载舍人见赠所画山水扇
664255,寄王升舍人二首 其二
230751,寄田锡舍人
32820,喜侯舍人蜀中新命
1153973,和常舍人晚秋集贤院即事十二韵寄赠江南徐薛二侍郎
1181790,和李十二舍人冬至日
474353,盛仲交自金陵至集于乔舍人小园
915016,赣守张子智舍人寄诗送酒和韵谢之
1038480,答和阁老刘舍人雨中见寄
1185090,会稽山居寄薛播侍郎袁高给事高参舍人
16910,见人咏韩舍人新律诗因有戏赠
364567,立春谢赐幡胜口号呈子瞻冲元内翰子开器资舍人
649419,送中书舍人陈彝训赴北京 其一
473380,赠徐舍人
1598,同韦舍人元旦早朝·夕转清壶漏
925273,送中书潘舍人省上二首 其一
692031,留别吴舍人
1189786,投翰林萧舍人
889305,送黄仲秉舍人赴湖南漕
918101,挽吕舍人二首 其二
940238,南柯子/南歌子 贺彭舍人黄堂成
1076819,送明仲舍人知邵州
521266,王舍人孟端为华处士作耕渔图久而失去其孙珵访求得之
930173,新津小宴之明日欲游修觉寺以雨不果呈范舍人二首 其一
935984,和范舍人永康青城道中作
898073,寄子瞻舍人二首 其二
488677,寄赠袁舍人
35933,送孙舍人归湘州
9283,中书王舍人辋川旧居
513947,送刘尚质舍人乃兄还巴陵
27960,寄琼州杨舍人
914336,陈安行舍人阁学挽词三首 其一
548498,夏月同诸子集管舍人新居得欢字
802991,渔家傲 其三 十二月山家词，和钱舍人葆酚、董孝廉苍水
979410,次韵张著作文潜饮王舍人才元家时坐客户部李尚书公择光禄文少卿周翰大理杜少卿君章黄著作鲁直
1186517,赠阙下裴舍人
896307,次韵子由舍人先生追读迩英绝句四首 其三
7635,奉和贾至舍人早朝大明宫
891942,和天休龙图经句署怀旧忆道卿舍人并见寄 其二
1070391,送傅舍人国华使高丽二首 其二
1106621,送王舍人赴明州过阙二首
513934,送汝行敏舍人赴南京武选员外
954250,答刘原父舍人见过后中夜酒定复追昨日所览杂记并简梅圣俞之作
691814,赠王舍人升二首
1185765,寄柳舍人宗元
342528,送石舍人入西阁见紫薇花盛开
925799,西江月 其二 正月四日和建宁陈安行舍人，时被召
1076642,挽董舍人
533597,万寿节和吴舍人约卿 其二
806841,采桑子 其十一 为汪蛟门舍人题画册十二帧
342658,送石舍人得告展省
662407,答蔡舍人从善次韵 其三
342736,又陪公素舍人晨入西阁见紫薇初开
728821,路舍人客居太湖东山三十年，寄此代柬
2342,和元舍人万顷临池玩月戏为新体
916127,次韵和慎大詹中秋待月寄西掖三舍人之什
108773,次韵文潜同游王舍人园
513397,分得戏马台送李应祯舍人还江东
1185057,李舍人席上感遇
350363,沁园春·诗孙舍人初度日集三雅亭，赋赠
533081,暮春张考功助甫邀游韦氏园时梁舍人思伯偕至 其三
142560,和张安国舍人
1132414,和孙舍人重过陕下二首
437064,满江红 伯平舍人亲友得意西归
229115,舍人张氏·一代称贤母
49756,李舍人孤山草堂坐雨
990919,次韵和永叔雨中寄原甫舍人
1157020,长庆二年七月自中书舍人出守杭州路次蓝溪作
1035543,和孙舍人重过陕下二首 其二
947572,送陈智叔舍人赴召
386579,吉水道中寄羽可舍人
1153828,奉和太常王卿酬中书李舍人中书寓直春夜对月见寄
923951,次韵曾子开舍人四月一二日扈从二首 其一
1127440,紫微舍人宋公爱子侄三人同日得第作诗以纪盛美二首
1113731,次韵叶舍人
1154254,喜杨舍人入翰林
940252,菩萨蛮 和彭舍人留别
802998,渔家傲 其十 十二月山家词，和钱舍人葆酚、董孝廉苍水
896309,次韵子由舍人先生追读迩英绝句四首 其一
856478,六州歌头 和张安国舍人韵呈进彦
114007,王才元舍人许牡丹求诗
389105,喜明卿舍人至口号
1171877,贺同年翰林从叔舍人知制诰
141869,和董令升舍人
686326,和汝舍人行敏韵
708463,满庭芳  和伯紫韵送钱葆馚舍人
765008,百字令 索汪蛟门舍人新词
537824,顾舍人夏日过访弘法寺 其二
802999,渔家傲 其十一 十二月山家词，和钱舍人葆酚、董孝廉苍水
177958,寄冯舍人·转输争合滞才华
1229455,季境舍人归维扬朝中名公各赠以诗看云八十翁閒閒吴全节作唐律一首以授之
1043546,次韵和秘书省林舍人校书寓兴五首 其一
81428,和范舍人书怀
384937,酬羽可舍人归后见寄次韵
863495,和陈州田舍人留别 其一
321985,得张大猷尚书书云比每进对屡以待御为言而邦衡舍人言尤数切云云某为群
35566,偶闻官吏举请辄有一篇寄从弟舍人
476716,赠宋文百户石冈舍人
116543,寄子瞻舍人·皎皎连城璧
30146,寄制诰李舍人
889449,潘公舍人义荣当世第一流人也仆顷得金华私窃自喜将获从公之游洎至而公已云亡至今以为恨金元鼎出公往还诗帖因即公韵和数句于后姑以少见平生慕用之意云
915646,寄题万元享舍人园亭七景 其三 溪云
1092888,赠潘德久舍人
957690,四月三十日慈孝寺山亭席上次韵经父舍人送子敦都运待制赴河北
730349,题朱麋君舍人鉴成焦山酣睡图四首 其一
1179178,薛舍人使君观察韩判官侍御许雨晴到所居既霁先呈即事
253441,跋张舍人所收杨仲明天厩铁骢图
201736,和刘原甫舍人雪霁早朝
24524,题从伯舍人道正里南园
1156050,舟行阻风寄李十一舍人
261775,摸鱼儿·历亭寄程周量舍人
915644,寄题万元享舍人园亭七景 其五 也贤
987169,汉宫春 寿张安国舍人
921551,次韵三舍人省上
710415,七夕寄容舍人
359478,南楼有作呈仲矩舍人
1046693,送郑毅夫舍人被召五首 其一
364297,与宋次道舍人同在殿中覆考进士次道子侄同就御试赠次道
385991,过层山访郭羽可舍人活秀园
177805,贺三舍人新入西掖
155743,题建德驿用经略张舍人壁间韵
961578,赋张舍人抱啸堂五首 其四
1094345,次韵潘舍人画轴 其四
330645,寄李成德舍人
31001,献制诰杨舍人
23860,韩翃舍人即事
285067,金缕曲·得王楘丞舍人书，用李良年徵君答朱十韵
185620,送节之术之两舍人入燕
666918,寄赠姚江陈舍人生日
81427,和范舍人病後二诗末章
524556,赠何舍人
914334,陈安行舍人阁学挽词三首 其三
1191699,过薛舍人旧隐
875602,送真舍人帅江西八首 其六
532914,画菊为孙舍人以道赋
1172182,和李舍人直中书对月见寄
363430,次韵傅舍人咏褚邦直葫芦
473330,雨中寄顾汝和舍人
914832,清晓出城别王宣子舍人
472212,送张舍人还永嘉
10874,缑氏拜陵回道中呈李舍人少尹
977766,赠閤门潘舍人
93381,送王吉州宣子舍人和明州
468285,次韵送周府引礼舍人崇德程原道奉使入越买茶北还
363370,次韵周秀实监丞嘉仲府判叔侄贻王元渤舍人
863641,寄田舍人
135370,范叔刚舍人示文正公象笏
13897,将归东都寄令狐舍人
1137901,次姚舍人 其一
146977,嘉定甲戌孟秋二十有七日起居舍人兼直学士院
1192668,投杜舍人
132569,送曹提干归永嘉兼寄陈君举舍人
990217,故殿撰修史李舍人挽章二首 其二
9781,春宴张舍人宅
1188893,寄同年封舍人渭
874151,九日寄陈君举舍人
763293,水调歌头 其四 题汪蛟门舍人少壮三好图
52881,岊江兰若送浦舍人归晋阳分得衣字
197412,上杭帅吕舍人
514519,杨应宁舍人相邀避暑韩太仆园与倪舜咨学士联句
5688,寄中书刘舍人
836772,寄林文翰舍人 其三
425282,杨舍人墓
1071896,次韵何文缜舍人后省致斋
353446,亲家张舍人挽词
13232,山中月夜寄朱张二舍人
661783,分题得震泽竹枝词送中书李舍人 其七
488423,送詹淑正还新安寿母兼同颜舍人质卿同登太山 其三
12593,上裴度舍人
1030851,送张安国舍人
1158831,奉和赵给事使君留赠李婺州舍人兼谢舍人别驾之什
1158831,奉和赵给事使君留赠李婺州舍人兼谢舍人别驾之什
22540,上翰林蒋防舍人
1181554,同韦舍人早朝
177811,贺冯起张乘二舍人
1052807,依韵和曾子开舍人从驾孟飨景灵宫四首 其二
1173434,赠献纳使起居田舍人
873139,点绛唇 其一 和王元渤舍人见贻
831266,徵招 再题王幼霞侍御秋窗忆远图。图为况夔笙舍人客江南作，并装金陵栖霞寺残碑二段
1167717,献中书潘舍人
268469,张诗舲先生与潘功甫舍人诗简以酒和墨作书式之装册属题谨次其韵多用原诗本事
1195987,贺殷游二舍人入翰林江给事拜中丞
118409,次韵孔文仲舍人酴醾
1245099,送蔡士廉舍人奔讣还四明
836770,寄林文翰舍人 其一
1045954,次韵李才元舍人二首 其一
1135632,跋高舍人钱舜举君选著色山水
1107417,挽崔舍人
915084,中书胡舍人玉堂夜直用万里所和汤君雪韵和寄逆旅再和谢焉
1174955,酬令狐舍人
863408,内翰毕学士外制柴舍人故兵部阁老王公之门生又与第五厅舍人同在两制追思馀庆因赋短章寄于三君子
863408,内翰毕学士外制柴舍人故兵部阁老王公之门生又与第五厅舍人同在两制追思馀庆因赋短章寄于三君子
369811,赵运干秩满经由寄怀任舍人直院九日
596150,和黎职方冬至日别梁舍人还朝
936741,读吕舍人诗追次其韵五首 其四
328341,寄戴舍人·名在登科记
185156,题张彥实舍人墓下涌泉亭
13482,奉和张舍人阁老阁中直夜思闻雅琴因以书事通简僚友
984233,上中书陈舍人三首 其三
1196018,送魏舍人仲甫为蕲州判官
24039,寄成都高苗二从事郑州献从叔舍人褎
1185496,巴陵早秋寄荆州崔司马吏部阎功曹舍人
369287,送陈省三舍人望曾归台湾
745698,赵象庵舍人招至悦性僧楼观太液池荷花前四日间法梧门学士已邀兰雪国博来游有诗次其韵
369561,次韵何文缜舍人后省致斋
2450,同韦舍人早朝
1179268,送崔舍人起居
1120100,挽中书舍人叶公三首
517440,送郑舍人之岭南
686517,答蔡舍人从善次韵
815426,渔家傲 十二月山家词，和钱舍人葆酚、董孝廉苍水
1035697,谢长安孙舍人寄惠蜀笺并茶二首 其二
380254,忆旧游·题张仲甫舍人“香溪泛宅图”
1157709,登龙昌上寺望江南山怀钱舍人
6355,送宇文舍人出宰元城
924965,雪中会孙洙舍人饮王氏西堂戏成三绝 其一
35080,和印先辈及第后献座主朱舍人郊居之作
134567,和运使舍人北园饯别行憩三闪僧舍冒雪宿百井
20888,过薛舍人旧隐
30056,郑州献卢舍人
36489,奉和裴舍人春日杜城旧事
1029012,送邓舍人将漕西淮用舍人坐上诗韵 其二
1029012,送邓舍人将漕西淮用舍人坐上诗韵 其二
1127647,挽王元渤舍人二首
925338,潘舍人求父朝议挽诗
219858,送中书潘舍人省上
1152726,和张舍人夜直中书寄吏部刘员外
999208,二月二十一日何司业集客于张园玉牒给事命予赋诗紫微舍人左史舍人亦以见委因成七言十韵一首
999208,二月二十一日何司业集客于张园玉牒给事命予赋诗紫微舍人左史舍人亦以见委因成七言十韵一首
229162,呈胡舍人·官闲无事只深禅
743254,冰山雪海歌为董蕴田舍人作
807917,贺新郎  诸城李渭清赠我以龙须数茎，同曹舍人实庵、陆编修义山、沈大令融谷赋。余箧中旧有虎须，故篇中及之
1106610,送刘美中舍人赴漳州二首
349011,次韵李伯纪舍人招饮
364599,次韵和王舍人酬王工部早朝
214316,闻高舍人锡下世
1189035,秦中岁晏马舍人宅宴集
17957,得钱舍人书问眼疾
1051476,雪中会孙洙舍人饮王氏西堂戏成三绝 其二
1054155,王舍人庄
898074,寄子瞻舍人二首 其一
1167052,奉和舍人叔直省时思琴
34898,寄和州韩舍人
869697,送昌言舍人得告还蜀三首 其二
104330,明经试大义多不通有感依韵和范景仁舍人
936529,送范舍人还朝
527739,寄阴舍人
1052808,依韵和曾子开舍人从驾孟飨景灵宫四首 其三
1069524,谢王七舍人施手写华严经并大藏等经及弥陀像 其二
608204,董玄宰太史席上送朱君采舍人
177892,送阁门秦舍人
1114240,宫使待制舍人赵公挽诗
189904,次韵孔彦常舍人曝书
1027581,李起宗舍人悠然亭
1196388,奉和武功学士舍人纪赠文懿大师净公 其六
750937,丁丑人日张幼樵侍讲健盦太史朱砚生侍御汪柳门司业顾皞民水部许鹤巢曹紫荃两舍人集于归砚山房即席次柳门韵
23789,令狐舍人说昨夜西掖玩月因戏赠
35219,鼎臣学士侍郎楚金舍人学士以再伤
241605,四月三十日慈孝寺山亭席上次韵经父舍人送子
909165,和刘舍人咏雪
743559,清明后十日陈古华农部招同秦小岘舍人邵荻香徐郎斋两孝廉小饮肄书次小岘韵 其一
124647,戏招君况舍人
506455,赠袁舍人忠微
14805,始至云安寄兵部韩侍郎中书白舍人二公近曾远守故有属焉
556137,送陆舍人调辽府长史
159365,和柴天休郑舍人奉祠太一见怀之作
528993,酌别何舍人兼问讯空同子
592145,十六夜同黎秘书吴侍御梁舍人集梦芝馆听管山人作吴歌
184162,次韵曾子固舍人上元从驾游幸
26841,贺同年翰林从叔舍人知制诰
948366,闻西省赏酴醾芍药戏成小诗奉简泰之侍讲舍人年兄并以丁香橄榄百枚助筵却求残花数枝 其三
1161950,奉和张舍人阁老阁中直夜思闻雅琴因以书事通简僚友
832750,木兰花慢 题半塘老人秋窗忆远图，图为况夔笙舍人拓寄江总栖霞残碑而作
539760,喜明卿舍人至口号
1174998,将归东都寄令狐舍人
204839,梅水村·紫薇号舍人
914077,见潭帅刘恭父舍人二首 其二
224822,和衢守张舍人龙眠捉马图诗
953916,夷陵书事寄谢三舍人
233792,拟欧阳舍人古篆
522692,赠王舍人升二首 其一
796894,忆旧游 题张仲甫舍人“香溪泛宅图”
109060,挽崔舍人·忆昨登瀛日
740646,金文学招同钱编修载韦含人谦?谢编修墉吴舍人钱赞善家舍人游万泉庄
740646,金文学招同钱编修载韦含人谦?谢编修墉吴舍人钱赞善家舍人游万泉庄
1052823,依韵和呈刘贡父舍人三首 其二
903930,挽崔舍人 其二
124920,答道卿舍人桐竹之嘲
856147,送董令升舍人归朋溪二首 其一
704332,吴舍人内子挽词
