1109538,送郑毅夫舍人被召五首
1183254,和谢舍人雪夜寓直
528553,十六夜尹舍人宅次刘汝忠韵
7579,赠献纳使起居田舍人
513547,送中书舍人桐城何志廉赴南京刑部员外予较艺礼闱志廉实预事于帘内
1182909,与韩侍御同寻李七舍人不遇题壁留赠
914576,送王吉州宣子舍人知明州二首 其二
807287,满庭芳  题顾梁汾舍人扈驾诗后
1094344,次韵潘舍人画轴 其三
16022,奉和舍人叔直省时思琴
11374,和常舍人晚秋集贤院即事十二韵寄赠江南徐薛二侍郎
139026,送王舍人彦正奉祠东归
593716,正月二日伍舍人朱计部谢侍御司考功见过张武库袁民部同集得东字
81426,和范舍人病後二诗末章兼呈张正字
184137,二月晦日过范景仁舍人留饮联句分夜而归
169981,上潘舍人德久
772871,陈镜河舍人澄清
1190612,和王舍人抚州饮席赠韦司空
1083519,上李舍人
9580,同中书刘舍人题青龙上房
1112714,次韵子由舍人先生追读迩英绝句四首
1081203,次韵李伯纪舍人招饮
537515,送顾舍人使金陵还松江
807797,沁园春  题汪舍人蛟门少壮三好图
916343,次韵和李舍人立秋祠太一宫宿斋书事之什
177978,贺迤舍人新入西掖
533015,吴舍人内子挽词 其二
922900,三月十七日三舍人宴集西省刘叔贡作诗贻坐客席上走笔和呈
36244,酬杜舍人
369302,陈镜河舍人澄清
1106902,寄献润州赵舍人
349012,和李舍人留题泛碧斋
1211670,寄进士野仙不花仲实除侍仪通事舍人
300166,凤楼春·和欧阳舍人
385899,羽可舍人、楚瞻运副同集荫余别墅，即席有赋，次韵酬之
1164570,游陆浑南山自歇马岭到枫香林以诗代书荅李舍人适
1102729,送王舍人之燕山
11513,陪中书李纾舍人夜泛东池
533079,暮春张考功助甫邀游韦氏园时梁舍人思伯偕至 其一
863596,送閤门秦舍人
1151151,和钱舍人水植诗
1189006,寻徐山人遇马舍人
909557,水调歌头 甲寅寿刘舍人
349449,呈张邃明舍人
5509,题瓜州新河饯族叔舍人贲
932445,和范舍人书怀
98652,挽汪义源舍人
192898,次韵和中书李舍人勉元氏道宗奉宗兄弟之什
1029067,偶和万舍人中秋有月无客有酒无殽韵
124351,挽崔舍人·士有千龄遇
709316,为隼儿娶妇承程舍人周量惠以雅什赋此奉答并呈芝五震生
948900,次韵陈叔晋舍人殿试笔记
134592,寄题李舍人蒲中新斋
94748,薛舍人母方氏太恭人挽章
1052802,次韵和曾子固舍人二首 其二
115703,次韵子由舍人先生追读迩英绝句
14995,送唐舍人出镇闽中
880526,李舍人独直
526192,答何舍人仲默
641172,怀浦舍人长源
218621,挽吕舍人·边蹇成遗老
881930,贺叶司业兼中书舍人
957900,陈舍人送蒲萄
177752,内翰毕学士外制迤舍人故仈部阁老王公之门生
593704,伍舍人子谦朱计部子得见过得来字
961228,方叔元振元老同令侄舍人见访
340270,送王舍人之燕山
813369,春日集里中耆旧于南湖之观堂喜邱舍人含三初归因招入社次韵
329602,次韵李才元舍人
1185963,同徐员外除太子舍人寓直之作
780827,张仲甫舍人闻余改役东河以诗志喜因叠寄谢武林诸君韵答之二首 其一
1159836,送唐舍人出镇闽中
192900,次韵和昭收寄银台李舍人之什
1090508,和万舍人分惠鲎鱼 其二
802993,渔家傲 其五 十二月山家词，和钱舍人葆酚、董孝廉苍水
800811,与顾梁汾舍人次阁学韩公韵
1188914,喜侯舍人蜀中新命三首 其一
179447,陈舍人送蒲萄
946610,挽中书舍人叶公三首 其三
365146,送郑毅夫舍人被召
1094343,次韵潘舍人画轴 其二
9674,贾员外处见中书贾舍人巴陵诗集览之怀旧代书寄赠
213878,用乐道舍人韵书十日事呈
892466,和道卿舍人奉祠太一斋宫 其一
650674,挽中书舍人王孟端 其一
973098,挽汪养源舍人二首 其一
275773,东风第一枝·正月十九夜汪蛟门乔石林两舍人
103557,次韵和永叔雨中寄原甫舍人
1196389,奉和武功学士舍人纪赠文懿大师净公 其七
177970,寄献翰林宋舍人
707928,万年欢 其二 汪蛟门舍人举子，赋此志喜
592172,冬日同文博士寿承黎秘书惟敬集顾舍人汝和宅
178884,呈湖州赵再可舍人
1184531,同韦舍人元旦早朝
106069,跋高舍人钱舜举君选著色山水
79071,又送李舍人赴阙
710721,燕台送王李二舍人出贬衡巫
5054,巴陵赠贾舍人
217290,送王舍人罢两浙宪赴阙
1085463,张安国舍人以南陵鄱阳雨旸不同示诗次韵
384270,雪晴同吕舍人顾汝所南郊閒步
186883,陪安国舍人劳农北郊分韵得阑字
1130054,赠子固舍人
900615,陪舍人兄过陈仲思溪亭深有买山卜邻之意舍人兄预以颛壑见名因成古诗赠仲思
900615,陪舍人兄过陈仲思溪亭深有买山卜邻之意舍人兄预以颛壑见名因成古诗赠仲思
900614,陪安国舍人劳农北郊分韵得阑字
1190898,酬王二十舍人雪中见寄
906288,次韵行父舍人有感
909206,和刘舍人咏鞦韆
18034,舟行阻风寄李十一舍人
533750,潞河雪后寄梁许二舍人
802997,渔家傲 其九 十二月山家词，和钱舍人葆酚、董孝廉苍水
134265,寓泊郑圃寄献昌言舍人
873122,江城子 王元渤舍人将赴吉州，因以戏之
17971,渭村退居寄礼部崔侍郎翰林钱舍人诗一百韵
1181375,献制诰杨舍人
475900,过汪中山舍人园亭二首 其二
845128,沁园春 诗孙舍人初度日集三雅亭，赋赠
364249,和贾舍人春祠太一坛
385990,次羽可舍人怡云楼见怀韵
869833,紫微石舍人挽歌二首 其一
991539,晨起裴吴二直讲过门云凤阁韩舍人物故作五章以哭之 其三
369947,次韵潘德久舍人七月廿一夜喜雨五绝
933893,寄张真父舍人二首 其一
995372,王才元舍人许牡丹求诗
992272,饮刘原甫舍人家同江邻几陈和叔学士观白鹇孔雀凫鼎周亚夫印钿玉宝赫连勃勃龙雀刀
1166871,早朝寄白舍人严郎中
52921,题朱舍人为史太守写竹
1117887,和范舍人病后二诗末章兼呈张正字
982669,送刘贡父舍人二首 其一
147463,静斋张敏则舍人赠诗因用其韵为酬
350188,摸鱼儿·人日谢何诗孙舍人送酒
351683,次韵子公舍人侄纸阁用荆公韵
742141,雨中饮何玉峰广文斋中迟范叔度比部柴珠江舍人不至
858713,次杨乐道韵六首 其六 用乐道舍人韵书十日事呈乐道舍人圣从待制
858713,次杨乐道韵六首 其六 用乐道舍人韵书十日事呈乐道舍人圣从待制
16113,春日李舍人宅见两省诸公唱和因书情即事
1112088,和道卿舍人奉祠太一斋宫
569741,寄题邹孚如舍人读书草堂
1094008,送潘舍人护客
533758,立春日同王太仆梁舍人彭鸿胪集杨仪部宅
92166,清晓出城别王宜子舍人
102328,和三舍人省上
178165,舍人院竹·封了词头遶砌行
1072564,六月上浣陪王元勃舍人携客游青原山周秀实通判作韵语纪一时胜集奉次元韵
869832,紫微石舍人挽歌二首 其二
183419,重次前韵奉酬子由子开叔贡三舍人
990926,次韵和吴仲庶舍人送德化郭尉
196838,和李公素舍人真州通济亭诗
950293,送王时亨舍人帅蜀诗二首 其一
533533,饮饯徐比部宅时吴舍人李比部同集 其二
77042,读吕舍人诗追次其韵
533612,送许舍人稚干使赵兼荣侍还灵宝
188948,送王舍人制置四川
1043622,与宋次道舍人同在殿中覆考进士次道子侄同就御试赠次道二首 其二
863658,寄献翰林宋舍人
507339,己卯春同中书舍人吴均入闽观风出京口占
199713,前起居舍人何资深竹光酒法奇甚近得法酿成以
869776,寄题李舍人蒲中新斋
975868,送曹提干归永嘉兼寄陈君举舍人 其一
233705,寄德久舍人时将过吴门
858874,和唐公舍人访净因
1150712,观于舍人壁画山水
533332,送黄清甫偕顾舍人游滇中
1052822,依韵和呈刘贡父舍人三首 其一
831038,金缕曲 空江拥被，万感如潮。忆张南湖舍人云骧芙蓉碣传奇最为婉艳，爰倚是调，题寄言愁，欲愁不觉，江州泪湿矣
940808,上潘舍人 其一
388120,询吴舍人病
1160930,奉和张舍人阁中直夜思闻雅琴因书事通简僚友
1167999,送张舍人之江东
528160,自滇蜀归李户部马舍人见访
1174992,和裴舍人观田尚书出猎
921492,次韵穆父舍人再赠之什
914578,送王成之中书舍人使虏
225385,次韵李舍人
159057,舍人院观御篆微阁榜赐宴奏御
1159651,白舍人见酬拙诗因以寄谢
1175528,李舍人山园送庞邵
1072543,再和酬王元勃舍人见寄
324459,离行在别胡舍人
28667,忆中条·燕辞旅舍人空在
173587,同刘仲忱舍人先生郑武子饯伯氏赋两篇得圣欢
752362,用山谷游王舍人园韵题天柱阁
35497,再见从弟舍人
142102,和董令升舍人梦中得句
166554,和士特韵程进道舍人
806835,采桑子 其五 为汪蛟门舍人题画册十二帧
177715,赠采访使合门穆舍人
1048728,寄邓舍人二首 其二
914335,陈安行舍人阁学挽词三首 其二
1119159,挽崔舍人
813691,送陈省三舍人望曾归台湾
662408,答蔡舍人从善次韵 其四
867268,和衢守张舍人龙眠捉马图诗 其二
1160004,詶冯十七舍人宿卫赠别五韵
41403,和王舍人送客未还闺中有望诗
186882,陪舍人兄过陈仲思溪亭深有买山卜邻之意舍人
186882,陪舍人兄过陈仲思溪亭深有买山卜邻之意舍人
936743,读吕舍人诗追次其韵五首 其五
868751,待制中书舍人陈公之亡以山宅须利既迁殡而未葬也后五月乃克葬焉二首 其二
1057175,贺吕子进舍人告谢
1164683,奉和中书舍人贾至早朝大明宫
916312,阁门廖舍人知袁州
21661,和李十二舍人裴四二舍人两阁老酬白少傅见寄
21661,和李十二舍人裴四二舍人两阁老酬白少傅见寄
206439,和长安孙舍人见寄
11393,和裴延龄尚书寄题果州谢舍人仙居
150584,闰七夕呈谯内知舍人
1225634,和松石舍人秋夜不寐
1171087,郑州献从叔舍人袖
16172,早朝寄白舍人严郎中
591850,同许太仆元复文文学寿承吴山人子充黎秘书惟敬姚鸿胪元白杜舍人从殷集吴侍御约卿宅得禅字
21041,李舍人席上感遇
1191799,窃览都官李郎中和李舍人益酬张舍人弘静夏夜寓直思闻雅琴见寄
1191799,窃览都官李郎中和李舍人益酬张舍人弘静夏夜寓直思闻雅琴见寄
18704,赴苏州至常州答贾舍人
124783,和天休龙图经句署怀旧忆道卿舍人并见寄
1113819,干誉舍人将赴召前一日录示左丞公昔年见寄佳什辄用韵奉送
322006,五月二十五日饯安国舍人于荐福洪右史王宗丞来会坐间用前韵
1042619,去年冬辙以起居郎入侍迩英讲不逾时迁中书舍人虽忝冒愈深而瞻望清光与日俱远追记当时所见作四绝句呈同省诸公 其三
1028826,次张安国舍人读王侍郎诗有怀其人韵
23033,寄澧州张舍人笛
34969,翰林游舍人清明日入院中途见过余明日
102352,次韵钱舍人病起
1037589,又陪公素舍人晨入西阁见紫薇初开
958617,送中书王舍人使北虏
768669,百字令 其三 高舍人斋即事，送武曾南还
915792,谢木韫之舍人分送讲筵赐茶
842830,顾鹤逸画山水卷子为曹君直舍人题
914078,见潭帅刘恭父舍人二首 其一
915920,题李季章中书舍人石林堂
1076758,次韵叶舍人 其三
1156109,李十一舍人松园饮小酎酒得元八侍御诗叙云在台中推院有鞫狱之苦即事书怀因酬四韵
814461,张仲甫舍人闻余改役东河以诗志喜因叠寄谢武林诸君韵答之二首
982453,次韵孔彦常舍人曝书
1155460,送冯舍人閤老往襄阳
125649,寄谢三城太守韩子华舍人
155869,次韵宇文舍人见贻之作
1408,同徐员外除太子舍人寓直之作
206564,谢长安孙舍人寄惠蜀牋并茶
1125609,上中书陈舍人三首
1156085,初罢中书舍人
698530,挽张舍人二首
916106,次韵和李舍人拜命书怀寄馆殿旧僚之什
1126366,故殿撰修史李舍人挽章二首
1043550,次韵和秘书省林舍人校书寓兴五首 其五
159218,送紫微夏舍人从治洪州
1093307,赵运干秩满经由寄怀任舍人直院九日
402089,四月一日游南山中，至竹坑，就村舍人家借爨，醉饱而归，诗以纪之
324579,安成逢吉守李西美舍人
1033865,静斋张敏则舍人赠诗因用其韵为酬
901174,留守舍人张公安国闻维筑亭为题其榜曰朝阳既去而亭成复为赋诗次韵
741534,同程鱼门舍人曹习庵宋小岩两编修吴白华姚姬传两吉士集王梦楼侍讲斋中分端得观字
1149520,见人咏韩舍人新律诗因有戏赠
916396,阁门钱舍人知全州
1171004,令狐舍人说昨夜西掖玩月因戏赠
524122,哭王舍人升
978426,寄德久舍人时将过吴门
1186401,太子李舍人城东别业
1171656,奉和张舍人送秦鍊师归岑公山
14776,和令狐相公晚泛汉江书怀寄洋州崔侍郎阆州高舍人二曹长
488424,送詹淑正还新安寿母兼同颜舍人质卿同登太山 其四
923227,重次前韵奉酬子由子开叔贡三舍人二首 其一
1003795,西省斋宿陪侍左史曹舍人话旧以除当字赋诗下教和答 其一
1076677,寄李成德舍人
1072761,送刘美中舍人赴漳州二首 其二
990541,书事和韩子华舍人
103817,晨起裴吴二直讲过门云凤阁韩舍人物故作五章
959844,和李公素舍人真州通济亭诗
724483,赠贺左丞萧舍人诗
973097,挽汪养源舍人二首 其二
1202335,桃源忆故人 因赵元帅舍人出示用其韵
961581,赋张舍人抱啸堂五首 其一
255107,闲步至苦槠湾村舍人家小坐
863773,赠采访使閤门穆舍人
875600,送真舍人帅江西八首 其八
1166914,春日李舍人宅见两省诸公唱和因书情即事
909904,小苏先生九三丈自司谏拜起居郎权中书舍人廌作诗以贺
333668,次韵李西美舍人见寄
695711,同伍舍人谢侍御饯朱民部使代州便道省觐二首
15048,苏州白舍人寄新诗有叹早白无儿之句因以赠之
991150,和永叔中秋夜会不见月酬王舍人
576799,赠阎舍人赴阁
955452,和运使舍人观潮 其一
220698,舍人观潮·何处潮偏盛
522693,赠王舍人升二首 其二
315640,送中书舍人内弟董仲鲁奉使亲藩
863556,贺柴舍人新入西掖
132417,送蒋舍人知利州
923226,重次前韵奉酬子由子开叔贡三舍人二首 其二
28705,寄王十四舍人
6881,寄王舍人竹楼
1156082,初除主客郎中知制诰与王十一李七元九三舍人中书同宿话旧感怀
5159,送张舍人之江东
1159430,伤独孤舍人
594058,同方武选梁祠部黎司勋携酒过金舍人宅得新字
374397,谢王七舍人施手写华严经并大藏等经及弥陀像
2308,李舍人山园送庞邵
592067,吴侍御约卿宅同黎秘书惟敬杜舍人从殷得臣字
1086295,悼张舍人安国
1065617,燕待宫使郭舍人致语
1123477,挽崔舍人
915123,长句寄周舍人子充
1132413,谢长安孙舍人寄惠蜀笺并茶二首
872721,岁晚泊姑苏用吕居仁舍人韵二首寄孟信安 其一
156838,挽崔舍人·桂籍联升望舜裳
602564,秋夜同欧廷评丈方武选年兄梁祠部舅氏过得金舍人宅得云字
507027,孔殿秋香为蹇舍人题
378636,次韵王舍人兰室
14239,早赴街西行香赠卢李二中舍人
1035540,和长安孙舍人见寄
836722,北投埔义士林锡爵招同林文翰舍人、邱石庄、简荣卿孝廉、洪玉昆明经及各巨姓头人宴集倚南轩，计议防乱事宜，即席赋赠
13976,送李舍人归兰陵里
386000,杨春墅明府复调署永丰，羽可舍人诗以寄慰，依韵和之即赠明府
308615,三字令·和欧阳舍人韵
524073,春望柬何舍人
548433,送金舍人考绩暂归南海省觐
3051,苑舍人能书梵字兼达梵音
9031,太子李舍人城东别业
1117601,次韵和曾子固舍人二首
1107637,送昌言舍人得告还蜀三首
183349,三舍人题名於后省皆赋诗因寄呈刘贡父
1146017,酬薛舍人万年宫晚景寓直怀友
93905,谢木韫之舍人分送讲筵赐茶
155587,寄洪舍人二绝
963057,送王舍人制置四川
34934,江舍人宅筵上有妓唱和州韩舍人歌辞因以寄
34934,江舍人宅筵上有妓唱和州韩舍人歌辞因以寄
152390,和范至能舍人农圃堂韵
528571,送陆舍人使吴下
865389,寒梅上李舍人
1236498,季长弟由国子生除侍仪舍人喜赋二首
1127385,寄洪舍人二绝
946611,挽中书舍人叶公三首 其二
103029,依韵和永叔内翰酬寄杨州刘原甫舍人
1167669,献中书汤舍人
224123,赠赵舍人·季父英名上玉津
670400,荅元美病中见寄并示吴舍人
704376,饮饯徐比部宅时吴舍人李比部同集
152137,送洪景卢舍人北使
18097,寄李相公崔侍郎钱舍人
207617,故殿撰修史李舍人挽章
1001485,久与广西帅年丈左史张舍人别自琼罢归过静江相见 其二
1138166,昝舍人锦江泛舟
991214,明经试大义多不通有感依韵和范景仁舍人
105478,饮刘原甫舍人家同江邻几陈和叔学士观白鹇孔
661734,和汝舍人行敏韵 其二
13899,送章孝标校书归杭州因寄白舍人
28300,奉和袭美寄琼州杨舍人
322964,题无隐斋寄交代张真父舍人
896306,次韵子由舍人先生追读迩英绝句四首 其四
831202,水调歌头 补寿何诗孙舍人五十。时君将乞郡，余亦将游岭南矣
1159706,苏州白舍人寄新诗有叹早白无儿之句因以赠之
533449,集许舍人稚干宅观舞
1137900,次姚舍人 其二
1196499,从弟舍人惠茶
363385,次韵寄怀王元渤舍人
124236,和道卿舍人承祀出郊过西苑马上有作
1078406,次韵李西美舍人见寄二首 其一
842,游陆浑南山自歇马岭到枫香林以诗代书答李舍人適
24926,喜杨舍人入翰林
940810,上潘舍人德久 其二
868507,诗悼路钤舍人德久潘公三首 其二
178089,送田舍人出牧淮阳
763332,鹤冲天 题钱葆馚舍人小像
13940,和吕舍人喜张员外自北番回至境上先寄二十韵
836771,寄林文翰舍人 其二
1190470,和吴子华侍郎令狐昭化舍人叹白菊衰谢之绝次山本韵
1182940,奉和中书常舍人晚秋集贤院即事寄赠徐薛二侍御
1174439,寄澧州张舍人笛
372048,送潘舍人护客
13975,和裴舍人观田尚书出猎
1122437,赋张舍人抱啸堂五首
385998,登层山钟秀峰和羽可舍人韵
868602,待制中书舍人陈公之亡以山宅须利既迁殡而未葬也后五月乃克葬焉二首 其一
1128177,送傅舍人国华使高丽二首
1190617,奉和峡州孙舍人肇荆南重围中寄诸朝士二篇时李常侍洵严谏议龟李起居殷衡李郎中冉皆有继和余久有是债今至湖南方暇牵课 其一
13268,春暮郊居寄朱舍人
832439,三字令 和欧阳舍人韵
1196387,奉和武功学士舍人纪赠文懿大师净公 其五
990623,依韵和刘原甫舍人扬州五题 昆丘
23158,三川驿伏览座主舍人留题
952336,赠刘舍人次德裕弟韵
230939,寄扬州知府钱舍人
25795,奉和张舍人送秦炼师归岑公山
648049,为钟舍人题孟端竹
1191476,再下第将归荆楚上白舍人
896977,次韵孔舍人曝书
340216,满江红·中秋上刘恭甫舍人
1159652,白舍人自杭州寄新诗有柳色春藏苏小家之句因而戏酬兼寄浙东元相公
9262,过王舍人宅
847008,秋声有怀寄副翰宋白舍人
533085,暮春张考功助甫邀游韦氏园时梁舍人思伯偕至 其七
594059,七夕同袁光禄黎司勋金舍人朱山人集梁祠部宅得秋字
661657,送汝舍人行敏秩满还乡复往京师
953904,暮春书事呈四舍人
806832,采桑子 其二 为汪蛟门舍人题画册十二帧
329848,子进舍人北归过衡阳累曰会话粗释暌间之念复辱佳章存慰衰朽辄次韵以谢
1186144,同王錥起居程浩郎中韩翃舍人题安国寺用上人院
104101,和永叔中秋夜会不见月酬王舍人
1110059,奉怀张公潜舍人二首
58423,盛仲交自金陵至集于乔舍人小园
696829,赤枣子 欧阳舍人体
88837,送真舍人帅江西·谏书元不为求名
169984,上潘舍人·经行造次有新诗
926075,满江红慢 其三 席间和洪舍人兼简司马汉章
1196386,奉和武功学士舍人纪赠文懿大师净公 其四
388424,顾舍人夏日过访弘法寺
960151,满江红 其一 中秋上刘恭甫舍人
927802,寄陕守祖择之舍人
1081204,再和李伯纪舍人韵
149054,送中书舍人郑惠叔入国
933892,寄张真父舍人二首 其二
105217,依韵和刘原甫舍人赴杨州途次赠予翩翩河中船
903927,挽崔舍人 其一
1076757,次韵叶舍人 其二
1146738,江行寄张舍人
946612,挽中书舍人叶公三首 其一
1115179,陈安行舍人阁学挽词三首
992252,还吴长文舍人诗卷
233735,旅舍·人言我身长
1188915,喜侯舍人蜀中新命三首 其二
1172219,送别驾赴晋陵即舍人叔之兄
999945,送紫微沈舍人守越州
670257,吴舍人丧内 其二
585721,北京吕舍人万乐子世宽明坤病目四十不肯娶遨游四方来访西樵将之藩府勉留住喷玉岩 其二
91785,陈安行舍人阁学挽词
203676,寄张舍人·万冤无计彻天衢
1129344,谢王七舍人施手写华严经并大藏等经及弥陀像
225454,寒梅上李舍人
1167890,陪族叔刑部侍郎晔及中书贾舍人至游洞庭五首 其一
661189,赠引礼舍人曾民悦
1165994,夏日梅溪馆寄庞舍人
1076756,次韵叶舍人 其一
961580,赋张舍人抱啸堂五首 其二
1070197,九日块坐无聊越州使君季野舍人见过敝庐会方回承议亦至因游章公山林登览甚适越州置酒暮夜乃归作诗一首
906125,宫使待制舍人赵公挽诗 其三
953721,和原甫舍人阁下午寝归有作
183421,三舍人·都堂直北正衙西
155825,挽唐立夫舍人
1112229,和天休龙图经句署怀旧忆道卿舍人并见寄
323589,送何希深舍人赴召
875604,送真舍人帅江西八首 其四
593666,送金舍人持伯奉使河洛因归为封君寿
515480,与刘舍人 其一
768312,玉京秋 竹垞书来，知沈覃九近寓高舍人宅，简寄此词
515481,与刘舍人 其二
22490,上翰林李舍人
184065,三月十七日三舍人宴集西省刘叔贡作诗贻坐客
31245,奉和峡州孙舍人肇荆南重围中寄诸朝士二篇时·征途安敢更迁延
1117076,次韵曾子开舍人四月一二日扈从二首
1016342,诗挽曾舍人张氏二首 其二
916392,集贤宿直寄中书李梁二舍人
104923,书事和韩子华舍人
1072669,寄程子山舍人
845141,江南好 篷窗晨起，展诗孙舍人潇湘清晓册子，爰拟其意，广为十阕。兼述土风，亦竹枝遗讽也
802989,渔家傲 其一 十二月山家词，和钱舍人葆酚、董孝廉苍水
75911,寄张真父舍人·天上紫微省
593892,送张舍人使青州因还蒲州
1183258,奉寄中书王舍人
553365,题浦舍人画梧桐竹石 其一
1088983,寄张真父舍人 其一
379130,雪夜至明教寄王路分舍人
1175577,同李舍人冬日集安乐公主山池
533916,九日同欧博士顾舍人南都礼上人过普恩寺访吕山人
772874,送陈省三舍人望曾归台湾 其三
528951,何舍人馆中对雪
109061,挽崔舍人·在昔夸三喜
940809,上潘舍人德久 其一
191172,和万舍人折赠蜡梅韵
488422,送詹淑正还新安寿母兼同颜舍人质卿同登太山 其二
1043458,吕舍人北使
48420,读柳拱之员外严宗哲主事杨应宁舍人倡和长句
936739,读吕舍人诗追次其韵五首 其一
1167891,陪族叔刑部侍郎晔及中书贾舍人至游洞庭五首 其二
358810,和后唐王仁裕舍人留题自然观
286549,陪高九舍人楷饮姜孝子祠
1127730,送中书舍人郑惠叔入国
696788,挽中书舍人王孟端
1182977,贾员外处见中书贾舍人巴陵诗集览之怀旧代书寄赠
808661,王舍人纮
988706,和曾舍人梅影雪意二首 其一 梅影
1042885,慈孝寺送顾待制次韵和孔舍人
50412,赠宋文百户石冈舍人
41578,赠贺左丞萧舍人诗
553366,题浦舍人画梧桐竹石 其二
364549,钱穆甫杨康功使高丽还为中书舍人书此为寄
922886,二月晦日过范景仁舍人留饮联句分夜而归
34741,献中书张舍人
14286,和崔舍人咏月二十韵
32821,喜侯舍人蜀中新命·却搜文学起吾唐
1029011,送万舍人将漕江东
1182188,和李十二舍人裴四二舍人两阁老酬白少傅见寄
1182188,和李十二舍人裴四二舍人两阁老酬白少傅见寄
556138,送王舍人往昆山为顾相公营墓
1078407,次韵李西美舍人见寄二首 其二
15214,伤独孤舍人
9731,奉和中书常舍人晚秋集贤院即事寄赠徐薛二侍御
1168554,留别贾舍人至二首 其一
1183773,重阳日寄韦舍人
1114072,次韵李西美舍人见寄二首
649421,送中书舍人陈彝训赴北京 其三
1196390,奉和武功学士舍人纪赠文懿大师净公 其八
435068,五舍人生朝
125491,贺紫微舍人改镇
5670,寓居沣上精舍寄于张二舍人
1181470,酬隐圭舍人寄红烛
1048687,再和孙正甫音字韵呈舍人
1039298,次韵答运使杨畋舍人
924334,次韵孔文仲舍人酴醾
925202,次韵洪六丈舍人苏黄马券一首
1150300,奉和裴舍人春日杜城旧事
979797,蓦山溪 其三 亳社寄文潜舍人
979566,闻文潜舍人出试院约毅父考功寻春
670384,寄吴舍人兼呈徐子与
1115118,见潭帅刘恭父舍人二首
857809,和石昌言舍人酬王景彝学士雪霁有怀
999183,题建德驿用经略张舍人壁间韵
1165229,酬通事舍人寓直见示篇中兼起居陆舍人景献
1165229,酬通事舍人寓直见示篇中兼起居陆舍人景献
1174080,三川驿伏览座主舍人留题
863497,和陈州田舍人留别 其三
1035698,谢长安孙舍人寄惠蜀笺并茶二首 其一
868506,诗悼路钤舍人德久潘公三首 其一
992297,依韵和永叔内翰酬寄扬州刘原甫舍人
169982,舍人德久·惭愧西湖处士身
1178112,奉报翰林张舍人见遗之诗
1195033,送卢舍人三首
813616,七益诗 那舍人慎脩
103457,次韵和吴长文舍人即事见寄
192579,閤门廖舍人知袁州
1071419,起居方舍人挽诗二首 其一
784389,七益诗 其一 那舍人慎脩
3547,寻徐山人遇马舍人
661778,分题得震泽竹枝词送中书李舍人 其二
