835665,金缕曲 得王楘丞舍人书，用李良年徵君答朱十韵
1078338,送李似之舍人归连江旧隐二首 其二
11993,和李舍人直中书对月见寄
319662,题朱麋君舍人鉴成焦山酣睡图
385784,闻羽可舍人自章门回，适久旱大雨，喜而有作
1088893,考试呈周茂振舍人陈季陵国正
875607,送真舍人帅江西八首 其一
34895,送魏舍人仲甫为蕲州判官
536683,贻吴舍人
923478,去年冬辙以起居郎入侍迩英讲不逾时迁中书舍人虽忝冒愈深而瞻望清光与日俱远追记当时所见作四绝句呈同省诸公 其二
219087,陪韩子云吊张安国舍人墓
748914,客怀柬龚定庵舍人 其三
183372,送石舍人得告还蜀
702563,与刘舍人
1177011,观朱舍人归葬吴中
206578,赠三门漕运钱舍人
1161410,鄂渚送白舍人赴杭州
201860,依韵和贾直孺舍人初春祠左太乙
141194,送马舍人赴建康军幕
198028,谒冷朝奉路逢王才元舍人同在
991540,晨起裴吴二直讲过门云凤阁韩舍人物故作五章以哭之 其四
863657,寄献润州赵舍人 其二
1049962,中书舍人陈公元舆以诗送吾儿鼎赴尉慎邑卒章见及遂次原韵和答
1072290,次韵寄怀王元渤舍人一首
556934,吴舍人得子
108777,次韵曾子开舍人游藉田载荷花归
1094342,次韵潘舍人画轴 其一
582921,送邢大舍人二首 其二
542327,吴舍人明可徙居同徐子与刘子成二比部夜集得书字
686682,寄王升舍人二首
909546,水调歌头 其八 和吴鹤林舍人送杨帅韵
851805,上亭北轩对月吹笛得才元舍人昭华引醉霜月草堂吟皆诗谱也 其三
5313,陪族叔刑部侍郎晔及中书贾舍人至游洞庭五首
930172,新津小宴之明日欲游修觉寺以雨不果呈范舍人二首 其二
957759,送成都护戎韩舍人
810098,高阳台　与徐星伯曹玉水两舍人集叶雨辀太守斋赠歌者似兰次雨老原韵
918900,游西湖用中字韵呈直院高舍人
206504,和孙舍人重过陕下
191094,秋释奠于学万舍人示诗次韵以酬
1001180,董令升舍人朋溪图赵祖文笔也
730350,题朱麋君舍人鉴成焦山酣睡图四首 其二
92658,见周子叶充舍人叙怀
15457,奉和张舍人阁中直夜思闻雅琴因书事通简僚友
1117638,寄张真父舍人二首
94955,朱新仲舍人灊山诗集其子軧叔止见惠
1072549,郡斋次张参政韵呈王舍人
1092383,挽崔舍人 其一
1196098,亚元舍人不替深知猥贻佳作三篇清绝不敢轻酬因为长歌聊以为报未竟复得子乔校书示问故兼寄陈君庶资一笑耳
1081205,和李舍人留题泛碧斋
990218,故殿撰修史李舍人挽章二首 其一
990620,依韵和刘原甫舍人扬州五题 时会堂二首 其一
1106325,挽张舍人安国四首
702184,北京吕舍人万乐子世宽明坤病目四十不肯娶遨游四方来访西樵将之藩府勉留住喷玉岩
206521,送王专王衢之许下自维扬谒孙学士王舍人
661781,分题得震泽竹枝词送中书李舍人 其五
780828,张仲甫舍人闻余改役东河以诗志喜因叠寄谢武林诸君韵答之二首 其二
15046,白舍人见酬拙诗因以寄谢
192601,次韵和李舍人立秋祠太乙宫宿斋书事之什
6794,和张舍人中书宿直
1025845,满江红 重九与张舍人
731697,赠路舍人
104520,送石昌言舍人使匈奴
803000,渔家傲 其十二 十二月山家词，和钱舍人葆酚、董孝廉苍水
761016,惜红衣 中秋夜，彊村翁蹋月见过，秋花宛娈，襟韵清浃，因和白石自制无射宫一曲兼寄伯宛舍人沪上。
482665,呈浦舍人源
802990,渔家傲 其二 十二月山家词，和钱舍人葆酚、董孝廉苍水
1180120,寄制诰李舍人
117798,雪中会孙洙舍人饮王氏西堂戏成三绝
185618,送经之偕义斋两舍人入燕并呈善之待制
1109305,与宋次道舍人同在殿中覆考进士次道子侄同就御试赠次道二首
991161,和宋次道奠石昌言舍人
1174387,秋晚与沈十七舍人期游樊川不至
593177,游程舍人樗园 其一
1151779,苑舍人能书梵字兼达梵音皆曲尽其妙戏为之赠
10352,和翰林吴舍人兄弟西斋
13329,中春亭雪夜寄西邻韩李二舍人
159120,流杯小宴偶成拙诗奉呈运使王密学紫微韩舍人
990619,依韵和刘原甫舍人扬州五题 时会堂二首 其二
963058,送王诚之舍人使北方得挥字
953740,官舍假日书怀奉呈子华内翰长文原甫景仁舍人圣俞博士
948762,送洪景卢舍人北使
56468,过汪中山舍人园亭
522696,又赠王舍人四首 其三
345070,寄邓舍人·白发书生意气完
539764,嘲吴舍人新娶
593609,午日李明府招集显灵道院同姚太守方计部黎秘书王太仆梁舍人沈比部分得恩字
1072455,次韵傅舍人咏褚邦直葫芦
1177925,上达奚舍人
718486,寿钱舍人母 其二
629722,送同人周藻思从龚舍人含五太史入都门
347619,和钱穆父舍人
1094009,重送潘舍人
947256,送章舍人知汝州
14288,酬王二十舍人雪中见寄
708495,贺新郎  其十五 为汪蛟门舍人病中纳姬和方虎
1000827,次苏守朱新仲舍人留会稽之行韵
683265,询吴舍人病
746268,闰重阳日集家红生舍人寓宅酒后登阁望西山追和陈紫澜先生原韵盖先生官楚时以赠舍人尊祖者七十七年矣
746268,闰重阳日集家红生舍人寓宅酒后登阁望西山追和陈紫澜先生原韵盖先生官楚时以赠舍人尊祖者七十七年矣
122941,虎丘新复古石井泉太守沈虞卿舍人劝农过之
1124388,送曹提干归永嘉兼寄陈君举舍人
533784,元夕前偕梁舍人思伯携酒过余伯祥旅寓邀周潘刘黄诸子同集
991712,送谢舍人奉使北朝
103058,依韵和李舍人旅中寒食感事
662406,答蔡舍人从善次韵 其二
1054034,送提举太平观熊舍人 其三
954096,奉酬扬州刘舍人见寄之作
1131261,唐舍人挽词
593426,同伍舍人谢侍御饯朱民部使代州便道省觐二首 其二
992231,汴之水三章送淮南提刑李舍人 其二
1168132,书情题蔡舍人雄
1072254,比过石壁访王元渤舍人欲观棋战闻同鱼轩出游独与戎琳二师对语久之明日元渤有诗见贻次韵奉酬
915962,薛舍人母方氏太恭人挽章二首 其二
732505,春日集里中耆旧于南湖之观堂喜邱舍人含三初归因招入社次韵 其一
753178,陪高九舍人楷饮姜孝子祠
537442,询吴舍人病 其二
1179986,经张舍人旧居
709395,黄舍人符升秩迁客部奉使册鄢陵王兼捧前任荣封诰命就道还里赋此送之
1053212,赠子固舍人 其一
647509,送浦舍人还晋府
1070844,干誉舍人将赴召前一日录示左丞公昔年见寄佳什辄用韵奉送 其二
916098,次韵和太仆钱少卿寄赠编修主人宋承旨李舍人之什
206934,诗悼路钤舍人德久潘公
192615,省中当直即事书怀兼简阁长李舍人
1000047,紫微舍人宋公爱子侄三人同日得第作诗以纪盛美二首 其二
522697,又赠王舍人四首 其四
16192,新除水曹郎答白舍人见贺
772868,施云舫舍人士洁
806839,采桑子 其九 为汪蛟门舍人题画册十二帧
1165764,寄中书李舍人
88798,送真舍人帅江西·应对诙谐路亦开
1191319,缑氏拜陵回道中呈李舍人少尹
940641,和潘舍人
1064021,王舍人路分生辰
13343,岁暮送舍人
104112,和谢舍人新秋
984234,上中书陈舍人三首 其二
1035637,送紫微孙舍人赴镇长安
61480,次经略舍人韵
894206,送石舍人赐告还乡
1154617,寄王十四舍人
1046694,送郑毅夫舍人被召五首 其二
768556,鹤冲天 题钱舍人垂纶图，即和韵
523826,简何舍人二十韵
724401,在陈旦解酲共哭顾舍人诗
355770,送傅舍人国华使高丽
1150960,上裴度舍人
728570,满江红  梁溪顾梁汾舍人过访赋此以赠兼题其小像
1072760,送刘美中舍人赴漳州二首 其一
6501,奉和中书舍人贾至早朝大明宫
199937,次韵程愿以十诗见示篇中多及故起居舍人程子
1175582,和元舍人万顷临池玩月戏为新体
1167893,陪族叔刑部侍郎晔及中书贾舍人至游洞庭五首 其四
181336,送张舍人从军
730451,胡祠北楼送杨舍人还都
1070809,送韦子骏赴中书舍人召
1157916,闻裴李二舍人拜纶阁
105212,依韵和刘原甫舍人杨州五题其一时会堂
1042620,去年冬辙以起居郎入侍迩英讲不逾时迁中书舍人虽忝冒愈深而瞻望清光与日俱远追记当时所见作四绝句呈同省诸公 其四
533532,饮饯徐比部宅时吴舍人李比部同集 其一
1172996,奉和贾至舍人早朝大明宫
75910,寄张真父舍人
991670,次韵和范景仁舍人对雪
320940,绝句·舍人早定江西派
556891,人日寄吴明卿舍人
480587,读柳拱之员外严宗哲主事杨应宁舍人倡和长句戏次韵一首
948367,闻西省赏酴醾芍药戏成小诗奉简泰之侍讲舍人年兄并以丁香橄榄百枚助筵却求残花数枝 其二
1028182,唐舍人挽词 其一
1192818,华清宫和杜舍人
15771,上达奚舍人
1179242,岁暮送舍人
576102,怀朱太史芾宋舍人璲
342305,送江宁监军李舍人归阙
186613,登楚野亭见张舍人题字
708467,贺新郎 和曹宝庵舍人赠柳叟敬亭
219704,潘舍人求父朝议挽诗
749274,枢垣早直用岑嘉州和贾舍人早朝诗韵
1037646,送江宁监军李舍人归阙
990621,依韵和刘原甫舍人扬州五题 竹西亭
816109,韩圣秋舍人见过响山草堂即事
548425,赠管舍人御赐烛笔等物六首时丙戌新正二日王孝廉邸舍即席赋 其二 香
916282,梁舍人奉使巴中
184715,董令升舍人朋溪图赵祖文笔也
1181038,春宴张舍人宅
1048193,和邓舍人读之罘碑二十韵
591868,夏夜同吴侍御黎秘书集许舍人稚干馆得芳字
468174,送白舍人渡江
817481,客怀柬龚定庵舍人
1582,赠刘舍人古意·女床閟灵鸟
35021,谪居舒州累得韩高二舍人书作此寄之
1037895,依韵和吴长文舍人对雪怀永叔内翰
198800,送欧阳员外归觐滁州舍人
342688,寄题王舍人书斋
940226,西江月 席上劝彭舍人饮
850484,三舍人题名于后省皆赋诗因寄呈刘贡父
806831,采桑子 其一 为汪蛟门舍人题画册十二帧
872722,岁晚泊姑苏用吕居仁舍人韵二首寄孟信安 其二
974602,生查子 其四 再和舍人
218781,送陈智叔舍人赴召
682972,过汪中山舍人园亭二首
1070843,干誉舍人将赴召前一日录示左丞公昔年见寄佳什辄用韵奉送 其一
881373,寄张舍人
914176,朱新仲舍人灊山诗集其子軧叔止见惠且有诗和以谢之
991537,晨起裴吴二直讲过门云凤阁韩舍人物故作五章以哭之 其五
1043451,次韵和张舍人北使归
916105,次韵和李舍人忆北园寻春之作
1111187,亲家张舍人挽词
592118,送许舍人稚干请告还灵宝
533596,万寿节和吴舍人约卿 其一
1083487,寄谢潘舍人赠乌纱帽
1112505,次韵子公舍人侄纸阁用荆公韵二首
1035478,谢孙舍人题名水亭因有纪赠
156384,游西湖用中字韵呈直院高舍人
772872,送陈省三舍人望曾归台湾 其一
1085281,得张大猷尚书书云比每进对屡以待御为言而邦衡舍人言尤数切云云某为群邪所疾独见知二公因读邦衡和和乐楼诗复用前韵
1159771,河南王少尹宅燕张常侍白舍人兼呈卢郎中李员外二副使
918102,挽吕舍人二首 其一
533086,暮春张考功助甫邀游韦氏园时梁舍人思伯偕至 其八
474699,按察李公诞子公蜀人先以中书舍人为御史
524711,次孟侍御酬何舍人仲默见寄之作
9794,送彭偃房由赴朝因寄钱大郎中李十七舍人
6937,奉寄中书王舍人
1195431,奉和峡州孙舍人肇荆南重围中寄诸朝士二篇时李常侍洵严谏议龟李起居殷衡李郎中冉皆有继和余久有是债今至湖南方暇牵课
1001486,久与广西帅年丈左史张舍人别自琼罢归过静江相见 其一
1185326,朝下寄韩舍人
37391,赠抱麻刘舍人
524005,九日寄何舍人仲默
343692,漫兴十首和郭半村舍人韵
767991,摸鱼儿 历亭寄程周量舍人
349240,再和李伯纪舍人韵
301220,送谭天水游燕赴周舍人之约
748800,九月晦日陪寿阳祁相国张诗舲少宰何青士侍御于慈仁寺饯秋主人为叶润臣阁读孔绣山舍人分韵得细字
178885,呈湖州赵再可舍人·一舸乘风汎渺茫
1065613,燕待知滁州郭舍人致语口号
135191,送陈君举舍人东归
991538,晨起裴吴二直讲过门云凤阁韩舍人物故作五章以哭之 其二
104376,李舍人淮南提刑
725183,同柳吴兴乌亭集送柳舍人诗
955957,虎丘新复古石井泉太守沈虞卿舍人劝农过之为赋三绝谨次韵 其一
1191305,李舍人少尹惠家酝一小榼立书绝句
218586,借舍人吕丈送大雅东还诗韵奉呈
202109,小苏先生九三丈自司谏拜起居郎权中书舍人廌
1167894,陪族叔刑部侍郎晔及中书贾舍人至游洞庭五首 其五
332765,万年欢·汪蛟门舍人举子，赋此志喜
863652,寄海州副使田舍人
34915,和殷舍人萧员外春雪
1223900,刘忠肃公之四世孙中书舍人讳震孙之曾孙益之题其居曰云松巢予家与刘氏累世之契故为书忠肃公文集之首诗三篇并赋此与之
903381,木兰花慢 甲寅三月中浣，邀楼大防、陈君举中书两舍人，黄文叔侍制、彭子寿右史、黄子由匠监、沈应先大著过桂隐即席作
1168736,赠别舍人弟台卿之江南
137443,答王内翰范舍人
177348,秋声有怀寄副翰宋白舍人
593430,春日同方奉常刘舍人饮李明府吏隐轩得江字限八韵
1048727,寄邓舍人二首 其一
1180594,送陈秀才赴举兼寄韩舍人
333382,舍人见寄·几年离索渴微言
1052801,次韵和曾子固舍人二首 其一
1079435,奉怀张公潜舍人二首 其二
875601,送真舍人帅江西八首 其七
1046031,和彦常舍人元夕扈从二首 其二
139121,潘公舍人义荣当世第一流人也仆顷得金华私窃
1108024,岁晚泊姑苏用吕居仁舍人韵二首寄孟信安
1179326,春暮郊居寄朱舍人
1093209,题潘舍人小月岩
1042706,次韵和王平甫赠张舍人
1028772,正卿不见累日闻十二日与郑丈舍人游何山书此为寄
548427,赠管舍人御赐烛笔等物六首时丙戌新正二日王孝廉邸舍即席赋 其四 画扇
1156909,渭村退居寄礼部崔侍郎翰林钱舍人诗一百韵
533083,暮春张考功助甫邀游韦氏园时梁舍人思伯偕至 其五
1049647,和阁老舍人曝书会
103847,汴水斗减舟不能进因寄彦国舍人
950292,送王时亨舍人帅蜀诗二首 其二
116448,赴亳州教官次韵和中书钱舍人及亳州守晁美叔
831083,江南好 篷窗晨起，展诗孙舍人潇湘清晓册子，爰拟其意，广为十阕。兼述土风，亦竹枝遗讽也 其一
730352,题朱麋君舍人鉴成焦山酣睡图四首 其四
978720,次韵程愿以十诗见示篇中多及故起居舍人程子山老懒姑取其一用韵答之
631027,示程周量舍人
892105,答道卿舍人桐竹之嘲
995810,谢王舍人剪送状元红
1190289,同中书刘舍人题青龙上房
26402,投翰林萧舍人
434999,四舍人生日
330716,送明仲舍人知邵州
79509,玉牒所迎驾望见周洪道舍人
522695,又赠王舍人四首 其二
723444,和王舍人送客未还闺中有望诗
533014,吴舍人内子挽词 其一
162618,陪张舍人出郊
992305,依韵和刘原甫舍人赴扬州途次赠予翩翩河中船
384154,和羽可舍人《紫薇山房话感》次韵
1037660,送石舍人入西阁见紫薇花盛开
1224198,次韵康子山舍人二首 其一
533137,招姜主客宗孝王杜二舍人王项二文学吴沈刘居四山人集借树轩 其二
1159991,奉和中书崔舍人八月十五日夜玩月二十韵
1072461,游青原呈王元勃舍人周秀实监丞
14787,酬冯十七舍人宿卫赠别五韵
1120354,闻西省赏酴醾芍药戏成小诗奉简泰之侍讲舍人年兄并以丁香橄榄百枚助筵却求残花数枝
1037899,次韵王舍人忆省中小桃寄江学士
21251,秋吟献李舍人
901707,呈湖州赵再可舍人二首 其二
1028720,中书邵舍人挽诗
1112900,寄张真父舍人
319313,胡祠北楼送杨舍人还都
863400,书怀送田二舍人自吏部郎中出典泰州
856062,和董令升舍人
363867,吕舍人北使
1043899,次韵和王舍人灯夕见寄
1098697,寄戴舍人
689428,送詹淑正还新安寿母兼同颜舍人质卿同登太山
593411,黎秘书携酒同顾舍人吕蒋二山人礼永二上人集普恩寺得过字
1053530,酬刘巨载舍人见赠所画山水扇
1092384,挽崔舍人 其二
10689,朝下寄韩舍人
1158614,过裴舍人故居
113948,谢王舍人剪送状元红
768604,尉迟杯 题蕃锦集，和钱葆芬舍人韵
1059116,奉和邢舍人寄望之愚溪朝阳岩 其一
345055,再和孙正甫音字韵呈舍人
1037896,哀石昌言舍人 其二
137507,答刘原父舍人见过後中夜酒定复追昨日所览杂
594010,吴舍人挽词
913383,寄题万元享舍人园亭七景 其一 意山
1171999,寄王舍人竹楼
990836,太庙致斋答韩舍人简
369708,赋诗·舍人簪笔上蓬山
994416,贺新郎 其二 寿中书舍人
104683,食橙寄谢舍人
1046697,送郑毅夫舍人被召五首 其五
192932,次韵和李舍人忆北园寻春之作
36320,江行寄张舍人
515513,送中书舍人欧阳子履佥宪广东提调学政
1077549,似表复以诗来再次前韵并简似矩待制似之舍人
1119172,上潘舍人
116542,寄子瞻舍人·纷纷名利场
893243,郑天休舍人言中丞晏尚书西园见忆
990624,依韵和刘原甫舍人扬州五题 蒙谷
738381,寄张舍人
537441,询吴舍人病 其一
992540,和谢舍人新秋
1155345,和韩侍郎题杨舍人林池见寄
514418,送丁玉夫舍人谪晋安州判
1181791,和李十二舍人直日放朝对雪
1188955,和王舍人崔补阙题天王寺
802995,渔家傲 其七 十二月山家词，和钱舍人葆酚、董孝廉苍水
1089500,再次外舅韵戏呈舍人叔丈
21672,和李舍人秋日卧疾言怀
714188,留别钱舍人
1112759,寄子瞻舍人二首
218195,殿庐纪怀敬用右史舍人韵
193138,梁舍人奉使巴中
35090,送高舍人使岭南
692358,送中书舍人陈彝训赴北京
925272,送中书潘舍人省上二首 其二
1144276,次姚舍人
893051,和道卿舍人承祀出郊过西苑马上有作
229113,诗挽曾舍人张氏
1106905,和陈州田舍人留别
735193,韩圣秋舍人见过响山草堂即事 其二
22295,华清宫和杜舍人
1167711,献中书张舍人
94014,题李季章中书舍人石林堂
112947,挽崔舍人
200216,次姚舍人·披起绵衣换葛裘
663889,王舍人招予不至坐客联句见促马上
1229481,张舍人遥碧楼
102948,和谢舍人洊震
166148,次韵张着作文潜饮王舍人才元家时坐客户部李
1085468,五月二十五日饯安国舍人于荐福洪右史王宗丞来会坐间用前韵
979440,至日同文潜舍人饮钱京兆穆父家
1016316,呈胡舍人二首 其二
229163,呈胡舍人·东观何如双树家
1196493,送从弟舍人入蜀
916097,次韵和中书李舍人勉元氏道宗奉宗兄弟之什
372701,次韵答运使杨畋舍人
1190927,早赴街西行香赠卢李二中舍人
9591,送李舍人携家归江东觐省
324130,寄程子山舍人
952852,送王舍人罢两浙宪赴阙
245412,送章舍人知汝州
191196,中书黄舍人父总干挽诗
218599,挽吕舍人·接物初无间
9721,与韩侍御同寻李七舍人不遇题壁留赠
1182450,秋吟献李舍人
1116910,重次前韵奉酬子由子开叔贡三舍人二首
995264,舍人崔公挽词 其一
1151986,送张舍人佐江州同薛璩十韵
12380,奉酬李舍人秋日寓直见寄
548475,郊寺送华舍人芝台奉使西塞还乡
1195917,早春旬假独直寄江舍人
92663,见潭师刘恭父舍人·道合宁嫌脕
1043526,和贾舍人春祠太一坛二首 其一
768072,江城子 毗陵道中简丁舍人
1085259,四月从驾诣德寿宫与诸公会食于和乐楼是日借洪景严承旨马戏云从驾滥骑承旨马朝天叨缀舍人班异日再集胡舍人邦衡云不可不成篇也遂于楼中足之
1085259,四月从驾诣德寿宫与诸公会食于和乐楼是日借洪景严承旨马戏云从驾滥骑承旨马朝天叨缀舍人班异日再集胡舍人邦衡云不可不成篇也遂于楼中足之
1190977,和崔舍人咏月二十韵
799906,曹舍人寓斋闻捣衣作
953875,答王内翰范舍人
1175012,送李舍人归兰陵里
349384,依韵和呈刘贡父舍人
961577,赋张舍人抱啸堂五首 其五
1117162,去年冬辙以起居郎入侍迩英讲不逾时迁中书舍人虽忝冒愈深而瞻望清光与日俱远追记当时所见作四绝句呈同省诸公
991120,依韵和胡舍人见唁
177974,寄田舍人·山处升沉不足悲
11892,寄上舍人叔
975483,送蒋舍人知利州
1196384,奉和武功学士舍人纪赠文懿大师净公 其二
10189,观于舍人壁画山水
384908,次羽可舍人夏日见怀韵
670256,吴舍人丧内 其一
1175072,和吕舍人喜张员外自北番回至境上先寄二十韵
324176,送刘美中舍人赴漳州
193091,集贤宿直寄中书李梁二舍人
830842,张诗舲先生与潘功甫舍人诗简以酒和墨作书式之装册属题谨次其韵多用原诗本事
1035544,和孙舍人重过陕下二首 其一
206552,谢孙舍人题名水亭因有纪赠
3049,和贾舍人早朝大明宫之作
1028899,和万舍人折赠蜡梅韵 其一
1159653,白舍人曹长寄新诗有游宴之盛因以戏酬
691815,又赠王舍人四首
892468,和道卿舍人奉祠太一斋宫 其三
676425,连日奔走尘冗怀抱欠佳偶过顾舍人汝由研山斋其窗明几净折松枝梅花作供凿玉河冰烹茗啜之又得凫鼎奇古目所未见炙内府龙涎香恍在世外不复知有京华尘土赋此纪兴
529897,与江夏尹饯于舍人于黄鹤楼
36402,张舍人南溪别业
961730,和潘德久舍人见惠
486432,忆友丁大舍（国初勋爵之子未袭爵者皆称大舍，如古云舍人也）
800606,断砚歌为姜西溟先辈赋，砚为家梁汾舍人击碎
350452,水调歌头·补寿何诗孙舍人五十。时君将乞郡，余亦将游岭南矣
582920,送邢大舍人二首 其一
188950,送王诚之舍人使北方得挥字
789987,大风招严藕村孝廉同年生马谷生袁厚安两舍人
389733,燕台送王李二舍人出贬衡巫
102868,晨起裴吴二直讲过门云凤阁韩舍人物故作五
17730,登龙昌上寺望江南山怀钱舍人
31244,奉和峡州孙舍人肇荆南重围中寄诸朝士二篇时
593614,送梁舍人持伯使豫章暂还南海
900285,登楚野亭见张舍人题字
856604,渔家傲 和董舍人令升三首 其五
768420,东风第一枝 正月十九夜汪蛟门乔石林两舍人置酒都下寓斋二鲍锡鬯谷梁湘草同集看灯上美人
892760,监中会两禁诸公饮饯吴舍人梁正言富修撰叶龙图以计省不赴作诗见寄
1153976,奉和李舍人昆季咏玫瑰花寄赠徐侍郎
538343,维扬遇吴明卿舍人汎舟夜酌
988705,和曾舍人梅影雪意二首 其二 雪意
191546,送万舍人将漕江东
830999,沁园春 其一 诗孙舍人初度日集三雅亭，赋赠
764338,念奴娇 其十二 送方邺还宣城，兼怀唐耕岛舍人，用孝威韵
854905,顷刘子先学士守姑苏尝寄洞庭春酒得为西湖十日之醉今流落于此但觉村醪可憎戏作一首奉寄吴天用使君舍人
183357,又送石舍人
482699,题朱舍人为史太守写梧竹
802994,渔家傲 其六 十二月山家词，和钱舍人葆酚、董孝廉苍水
105079,依韵和胡舍人见唁
923015,次韵刘叔贡舍人从驾
49753,雨中寄顾汝和舍人
49767,赠徐舍人
1196346,送汤舍人之陈州
112744,舍人崔公挽词
714641,赠陆舍人
593935,冬夜同李比部黎司勋黄李二进士集金舍人宅和得比部二韵 其二
892467,和道卿舍人奉祠太一斋宫 其二
333371,送李似之舍人归连江旧隐
523067,送何舍人赍诏南纪诸镇
1028897,和万舍人折赠蜡梅韵 其三
345457,杂诗·屏迹舍人巷
206586,送紫微孙舍人赴镇长安
867511,挽崔舍人 其二
661784,分题得震泽竹枝词送中书李舍人 其八
1037733,寄题王舍人书斋
960147,朝中措 其六 元夕上潭帅刘共甫舍人
953850,寄阁老刘舍人
863046,同刘仲忱舍人先生郑武子钱伯氏赋两篇得圣欢二韵
1131383,中书黄舍人父总干挽诗
1110172,和彦常舍人元夕扈从二首
1167713,献徐舍人
199492,九日寄陈君举舍人
124535,郑天休舍人言中丞晏尚书西园见忆
1165755,奉酬李舍人秋日寓直见寄
169473,寄张文潜舍人
1113682,挽崔舍人
1186293,题杜舍人林亭
788885,念奴娇 张蕙甫比部李叔和舍人江亭招饮
1127989,西省斋宿陪侍左史曹舍人话旧以除当字赋诗下教和答
1026023,浣溪沙 夜饮潘舍人家，有客携家妓来歌
324219,送王舍人赴明州过阙
856146,送董令升舍人归朋溪二首 其二
687591,赠管舍人御赐烛笔等物六首时丙戌新正二日王孝廉邸舍即席赋 烛
1094625,次韵潘德久舍人七月廿一夜喜雨五绝 其二
188342,李舍人独直
1043547,次韵和秘书省林舍人校书寓兴五首 其二
1134311,题曹舍人文龙墨竹扇仲宾息斋写
1124216,挽汪养源舍人二首
358299,奉和邢舍人寄望之愚溪朝阳岩
1072847,送王舍人赴明州过阙二首 其一
923055,次韵曾子固舍人上元从驾游幸
104254,和宋次道奠石昌言舍人
992539,和谢舍人荐震
17523,长庆二年七月自中书舍人出守杭州路次蓝溪作
992428,和刘原父舍人乐郊诗
732506,春日集里中耆旧于南湖之观堂喜邱舍人含三初归因招入社次韵 其二
371683,送爆竹潘舍人
709161,秋夜宿张过庵宅兼怀陆舍人
1180789,和毛学士舍人早春
1092138,送张子有彦实舍人之侄
818168,鹧鸪天 庚申除夕和吴伯宛舍人
1072257,次韵周秀实监丞嘉仲府判叔侄贻王元渤舍人二首诗中见反且恨不与奕棋之会 其一
232944,送人之武夷·精舍人归入内台
1089786,张舍人惠古梅酬以拙言
124235,和道卿舍人奉祠太一斋宫
548429,赠管舍人御赐烛笔等物六首时丙戌新正二日王孝廉邸舍即席赋 其六 笔
1049247,和答刘子先舍人送行诗
1083688,送王时亨舍人帅蜀二十韵
921510,次韵钱舍人病起
863498,和陈州田舍人留别 其二
