150724,极目亭有怀韩常伯
592600,同张玄超陆华甫姚元白沈子高集邢太常伯羽宅邢六十初度且诞子诸君已有贺章因继此作
1183112,宿淮阴南楼酬常伯能
948724,秋官少常伯失杯复得乃好客之报来诗误认天意遂欲因噎废食走笔次韵发笑
54555,题边长文所画山水图歌为常伯敬赋
857244,寄李常伯满粹翁
857287,谢李常伯
491582,题边长文所画山水图歌为常伯敬赋
961779,寄韩判院南涧常伯之子
150713,寄韩卷院南涧常伯之子
1211751,寄良常伯雨
961691,极目亭有怀韩常伯
857185,客杭思李常伯满粹翁及衡父子权因寄此
491588,题常伯敬撷兰轩歌
197445,客杭思李常伯满粹翁及衡父子权因寄此
150341,闻常伯韩公下世感赋
961766,闻常伯韩公下世感赋 其二
532900,答戴常伯
539299,冬日同客游李太常伯华诸园
287311,戊戌中秋与村白水陈锦涛洪复斋蒋信斋张养农方楚青蒋澍堂常伯旂同饮天津酒楼时余蒋南归率呈一律
152070,秋官少常伯失杯复得乃好客之报来诗误认天意
961765,闻常伯韩公下世感赋 其一
493627,晚凉同常伯敬黄子邕过杨伯谦湖上书舍值伯谦出未归子邕买酒小酌联句
819000,戊戌中秋与村白水陈锦涛洪复斋蒋信斋张养农方楚青蒋澍堂常伯旂同饮天津酒楼时余蒋南归率呈一律
197430,寄李常伯满粹翁
486754,送常伯昂
195638,谢李常伯·人从东南来
9923,宿淮阴南楼酬常伯能
1122362,闻常伯韩公下世感赋
472930,李太常伯华江上草堂雪夜出妓弹琵琶
