55486,邦彦饮湖上暮归过保叔大呼求见因赍酒出寺饮
515032,饮定惠寺次旧韵调邦彦
435945,赠玉峰魏文邦彦
354097,和侄邦彦登道山亭诗
508704,游宝石峰次邦彦韵
479322,岁暮客钱塘邦彦徵君以诗招饮席间因次其韵
690057,戴文进捕鱼图为刘邦彦题
902632,相士陈邦彦觅诗
1214574,梁邦彦王官谷见访 其一
55471,巾子峰会集次刘邦彦韵
693134,哭刘邦彦二首
663316,赠何邦彦二首 其二
1244761,寄友人宋邦彦
283761,踏莎行·题云间邦彦图刻本，寄张琢丈
1212404,春日寄怀魏隐君邦彦
514023,题宗老文彬南薰轩追和刘邦彦韵
649113,送王邦彦大理归蜀
478765,断桥分手次刘邦彦韵 其一
1237374,梁邦彦王官谷见访
512875,赠徐遵诲和刘邦彦韵四首 其三
383986,岁暮客钱塘邦彦徵君以诗招饮席间因次其韵
1214641,风泾之东有鹳鸟作巢白莲寺其雄为人所执众鹳挟他雄偶其雌弗从破巢啄鷇而去市人怜之为求故雄使复合梁邦彦作义鹳行余和之
686768,赠何邦彦二首
478602,立夏日山中遍游后夜宿刘邦彦竹东别墅
686331,断桥分手次刘邦彦韵
50650,立夏日山中遍游后夜宿刘邦彦竹东别墅
646051,舜江杨邦彦家扁二首次刘允若韵
648381,莫州同王邦彦张伯原饮道傍民家
261056,中秋日同辛敬之魏邦彦马伯善麻信
512874,赠徐遵诲和刘邦彦韵四首 其二
135765,答周邦彦觅茶
438934,中秋日同辛敬之魏邦彦马伯善麻信之元裕之燕集三乡光武庙诸君有诗昂霄亦继作
660603,送邦彦学士先生二首 其二
383972,后三日雪晴同邦彦游西湖再叠前韵
896175,答周邦彦觅茶 其二
661814,百字令 刘邦彦招饮竹东馆赏桂花
661695,冷泉亭口号与刘邦彦别
658445,送石邦彦知汜水
533125,同杨邦彦徐子与过汝和雪舫集
512876,赠徐遵诲和刘邦彦韵四首 其四
689550,送邦彦学士先生二首
583344,春日次石邦彦修撰韵
66746,玉泉亭次石邦彦韵
512873,赠徐遵诲和刘邦彦韵四首 其一
661567,问刘邦彦疾
55144,舜江杨邦彦家扁二首次刘允若韵
661797,醉桃源 寄刘邦彦
487920,海陵除夜仝德夫宗振道昭邦彦作
501219,送侯邦彦自南谯游建业
60008,送何邦彦佥江西宪初识面数日告行
63944,后三日雪晴同邦彦游西湖
141236,相士陈邦彦觅诗
478764,邦彦饮湖上暮归过保叔大呼求见因赍酒出寺饮之以诗送别
1127198,次邦彦节推见寄
1054979,次邦彦节推见寄 其一
646052,舜江杨邦彦家扁二首次刘允若韵 其二 午桥柳庄
347657,送邦彦赴阙
1054980,次邦彦节推见寄 其二
654143,戴文进捕鱼图为刘邦彦题 其一
648382,阻风雪德州有怀王邦彦司直
1058492,送邦彦赴阙
948131,万安韦邦彦字俊臣携王民瞻杨廷秀谢昌国绝句相过次韵勉之 其二
672716,吕邦彦请饮新城道观追次逊斋先辈谢客见访之作
480074,玉泉亭次石邦彦韵
661655,宿灵隐禅房次刘邦彦韵
661564,于府尹景瞻张太守靖之刘邦彦沈明德宝峰宴集
1214467,与梁邦彦对雪饮酒禁体
488724,答林德夫余邦彦海陵见招之作
63939,岁暮客钱唐邦彦征君
798716,明月生南浦 明顺德陈岩野先生邦彦遗像
478766,断桥分手次刘邦彦韵 其二
359502,次邦彦节推见寄
479323,后三日雪晴同邦彦游西湖再叠前韵
478742,巾子峰会集次刘邦彦韵
660602,送邦彦学士先生二首 其一
966503,水调歌头 寿黄邦彦四月初八
1214575,梁邦彦王官谷见访 其二
660714,邦彦第四和章不至复用韵促之
654144,戴文进捕鱼图为刘邦彦题 其二
663315,赠何邦彦二首 其一
948132,万安韦邦彦字俊臣携王民瞻杨廷秀谢昌国绝句相过次韵勉之 其一
513036,哭刘邦彦二首 其二
515029,湖上待刘邦彦不至
653371,送刘指挥邦彦袭职南还
693129,赠徐遵诲和刘邦彦韵四首
513035,哭刘邦彦二首 其一
1066273,和侄邦彦登道山亭诗
779230,霜叶飞 和周邦彦《片玉词》
479500,送何邦彦佥江西宪初识面数日告行
581345,送何邦彦之官浮梁
419693,踏莎行 题云间邦彦图刻本，寄张琢丈
508703,宴仁和聂广文东轩次刘邦彦韵
1120351,万安韦邦彦字俊臣携王民瞻杨廷秀谢昌国绝句相过次韵勉之
