1212070,题进士索士岩诗卷士岩与余同榜又同为燕南官由翰林编修为御史台掾兼经筵检讨除为燕南廉访经历
1172440,重过列子庙追感顷年自淮服与居守王仆射同题名于庙壁仆射已为御史余尚布衣自后俱列紫垣继游内署两为夏官之代复联左揆之荣荷宠多同感涕何极因书四韵奉寄
1044310,送贯之兄被召为御史三首 其二
1121887,送贯之兄被召为御史三首
1211661,凤凰台为御史大夫易释董公同赋
1243919,送李本存归江西新喻州本存儒学教授历省掾为御史所论改温州海隅巡尉赋三律赠之 其三
506935,重庆堂为御史崔仲玉赋
105609,孙屯田召为御史
1044309,送贯之兄被召为御史三首 其一
514005,节庵倪先生以经学教于乡既成其子进贤举进士为御史又出其馀以淑乡之人其在德兴孙司马之塾最久予过婺源望先生之庐尚远不能往拜漫成一律奉寄
1252250,送李本存归江西新喻州本存儒学教授历省掾为御史所论改温州海隅巡尉赋三律赠之
659510,蓉溪为御史大夫金公题次邃翁韵
1028974,林正甫与子中春并命为御史正甫按刑浙东道别去兼旬而予衔命按视宫陵经越上获一再款语临行有诗因次其韵 其二
537068,南岷山歌为御史大夫南充王公作
506856,环秀堂为御史李安题
1028973,林正甫与子中春并命为御史正甫按刑浙东道别去兼旬而予衔命按视宫陵经越上获一再款语临行有诗因次其韵 其一
339960,送贯之兄被召为御史
509347,重庆堂为御史郑时题时伯父为秋官亚卿父与大父皆受封
991665,孙屯田召为御史
509384,双节堂为御史朱铉题
36033,为御史衔命出关谳狱道中看华山有诗
1190770,为御史衔命出关谳狱道中看华山有诗
1243918,送李本存归江西新喻州本存儒学教授历省掾为御史所论改温州海隅巡尉赋三律赠之 其二
191298,林正甫与子中春并命为御史正甫按刑浙东道别
650253,上林春雨图为御史罗亨信赋
474699,按察李公诞子公蜀人先以中书舍人为御史
1044311,送贯之兄被召为御史三首 其三
1131410,林正甫与子中春并命为御史正甫按刑浙东道别去兼旬而予衔命按视宫陵经越上获一再款语临行有诗因次其韵
17007,狂醉·一自柏台为御史
1243917,送李本存归江西新喻州本存儒学教授历省掾为御史所论改温州海隅巡尉赋三律赠之 其一
593853,芝林曲为御史大夫吴兴潘公作
1243550,谢东阳太守赵子威牧守有理诗以美之（时为御史）
539030,赠故秦比部少说尝为御史
59400,按察李公诞子公蜀人先以中书舍人为御史
