1152452,闻官军继至未睹凯旋
32335,闻官军继至未睹凯旋
418334,癸巳秋日偕同元白孝同宏略及丛碧慧素伉俪游劳山从北九水入山越鱼鳞峡直抵靛缸湾遇雨溪流湍急四山飞瀑弥望晴游所未睹也即为纪游诗八章意有未尽更赋长歌以张之
155659,石洞·此秘昔未睹
869202,昌言有咏石发诗三章模写精楷殆难复加仆虽未睹兹物而已若识之久者辄复强为三诗以继其后非敢庶几肩差适足为前诗之舆台耳 其三
989975,浣溪沙 其四 西园赏牡丹，寿圣亲见双花，卧下皆未睹，折以劝酒，词亦继成
837293,惜余春慢·慈仁寺双松。相传有清中叶重植，非渔洋诸老所题旧物。寺燬于庚子兵燹，松独无恙。社集分咏京师花木，召南拈得，以平生未睹为憾。偶偕访之，一已枯萎，盖昨岁栖止流民，爨湢所侵也，慨然同赋
458714,三月八夜醉起见月，平生未睹清纯如此者，心亦澄如古井，为赋
1107707,昌言有咏石发诗三章模写精楷殆难复加仆虽未睹兹物而已若识之久者辄复强为三诗以继其后非敢庶几肩差适足为前诗之舆台耳
869203,昌言有咏石发诗三章模写精楷殆难复加仆虽未睹兹物而已若识之久者辄复强为三诗以继其后非敢庶几肩差适足为前诗之舆台耳 其二
522347,数日不过西亭忽木兰着三花平生所未睹也涉笔书此招味苓同赏
544272,是日世叔座中出八带鱼供馔余夙闻未睹即席复成此章
869201,昌言有咏石发诗三章模写精楷殆难复加仆虽未睹兹物而已若识之久者辄复强为三诗以继其后非敢庶几肩差适足为前诗之舆台耳 其一
230913,春日即事·禁烟未睹燕了飞
579390,世称乌反哺盖闻而未睹焉一日晨起见其类聚飞鸣乃其然也感叹有作
