1144238,都梁北乡士多好学有向君敏衡者一日访予语甚质气甚夷礼甚虔予心异之间为予言曰家故沅徙也今所居有溪实自沅来乃筑室聚书其上以教子弟因以沅溪书舍名之而其亭则曰无加盖其地旧号无加庄以其东止于石西止于岸南止于路北止于泉也愿有以发之予既为籀右书二颜而向君复以所谓廉崖者谂予予闻此石杰立千尺实峭厉峻削可敬可仰有类乎廉者颇思一至其处摩挲此石以激衰懦而未能也乃各为一解以谢焉
1214190,欧阳公虽不到杭而惠勤师思之因所居有涌泉出因名之曰六一泉
346242,送路倅·所居有本能行义
1142389,都梁北乡士多好学有向君敏衡者一日访予语甚质气甚夷礼甚虔予心异之间为予言曰家故沅徙也今所居有溪实自沅来乃筑室聚书其上以教子弟因以沅溪书舍名之而其亭则曰无加盖其地旧号无加庄以其东止于石西止于岸南止于路北止于泉也愿有以发之予既为籀右书二颜而向君复以所谓廉崖者谂予予闻此石杰立千尺实峭厉峻削可敬可仰有类乎廉者颇思一至其处摩挲此石以激衰懦而未能也乃各为一解以谢焉 其二
117341,所居有梅一株在堂东荒秽中正月二十六日已谢
1112816,所居有梅一株在堂东荒秽中正月二十六日已谢矣二首
1137476,都梁北乡士多好学有向君敏衡者一日访予语甚质气甚夷礼甚虔予心异之间为予言曰家故沅徙也今所居有溪实自沅来乃筑室聚书其上以教子弟因以沅溪书舍名之而其亭则曰无加盖其地旧号无加庄以其东止于石西止于岸南止于路北止于泉也愿有以发之予既为籀右书二颜而向君复以所谓廉崖者谂予予闻此石杰立千尺实峭厉峻削可敬可仰有类乎廉者颇思一至其处摩挲此石以激衰懦而未能也乃各为一解以谢焉 其一
1070933,某到郴几两月适当重阳而菊犹未开然江山清远又仙佛所居有足乐者因成鄙句以写离忧
896410,所居有梅一株在堂东荒秽中正月二十六日已谢矣二首 其一
1064451,宣和五年四月十二日余馆湘阴之兴化徐质夫自土山来一昔夜语甚颠倒且日前尝梦见东坡今复见子何清事相联耶吾所居有亭名闲美尝有白燕巢梁间屡见鹤翔舞于层霄嘱予为诗纪其事质夫大梁人贤而有文佳公子也
1137477,都梁北乡士多好学有向君敏衡者一日访予语甚质气甚夷礼甚虔予心异之间为予言曰家故沅徙也今所居有溪实自沅来乃筑室聚书其上以教子弟因以沅溪书舍名之而其亭则曰无加盖其地旧号无加庄以其东止于石西止于岸南止于路北止于泉也愿有以发之予既为籀右书二颜而向君复以所谓廉崖者谂予予闻此石杰立千尺实峭厉峻削可敬可仰有类乎廉者颇思一至其处摩挲此石以激衰懦而未能也乃各为一解以谢焉 其三
330913,某到郴几两月适当重阳而菊犹未开然江山清远又仙佛所居有足乐者因成鄙句以写离忧
896409,所居有梅一株在堂东荒秽中正月二十六日已谢矣二首 其二
1091437,题日新梅室向在杭日所居有此今迁居虞山矣禅房花木深常建题虞山寺诗也虞山旧名破山
1214145,白水晁居士名家驹也脱俗嗜饮所居有断崖夕翠轩留偈而化赋此寄悼
117342,所居有梅·冷落疏枝寒草冈
