610798,同黎明府南楼玩月
593681,伏日同黎秘书余太史李明府集莲花庵得孤字
695675,同黎惟敬询韩子成病
610784,避暑铜陵留滞二旬暇同黎明府登天王寺乘凉三首 其三
618186,秋日同黎君选徐木之侄明公儿准集愚公楼时方延僧诵法华经分赋四首 其三
593576,方奉常李明府招同黎秘书徐方伯集于广惠寺
592152,同黎秘书曾缮部吴侍御万金吾出善果寺访冯侍御
688860,庚辰春日同黎君选欧嘉可诸从儿侄渡石门二首
592231,秋夜登曾缮部省中楼同黎惟敬赋
688888,庚辰初秋日同黎君选徐六出罗子开家从儿侄赋别门人吴孟浚比部于宝莲寺二首
602726,十六夜同黎国辉过集李时芳馆得开字
592067,吴侍御约卿宅同黎秘书惟敬杜舍人从殷得臣字
609170,黄公绍博士斋中同黎司封集得文字
591276,秋夜同黎惟敬宿清泉精舍
593438,初夏同黎惟敬李于美张元易及舍弟经季集顾叔潜宅得桐字十二韵
593237,雨中汪仲淹邀游湖山亭同黎维敬袁文谷方于鲁赋得花字
593357,同黎惟敬陆华甫邵长孺程无过潘子朋程虞仲游广济寺永上人精舍
618647,七夕同黎君选徐六出吴孟浚罗子开陈迪先家从兄弟儿侄饮于濯魄台 其六
630051,游七星岩同黎美周梁渐子何景玮诸子赋 其二
815670,同黎弼轩游慈云寺
618173,庚辰春日同黎君选欧嘉可诸从儿侄渡石门二首 其一
618181,同黎君选欧嘉可碧瓯亭纳凉分赋二首 其一
623811,同黎缜之吴子宪诸君饮蘧园得涯字
497259,吴杭州招同黎阃帅集城西公署
604959,辛酉秋日高正甫先生招同黎君玺君选集大忠祠之超然亭
618325,庚辰初秋日同黎君选徐六出罗子开家从儿侄赋别门人吴孟浚比部于宝莲寺二首 其一
591902,同黎秘书刘山人游西山经玉泉山池亭望西湖
497058,同黎徐二帅游南屏山二首 其一
618644,七夕同黎君选徐六出吴孟浚罗子开陈迪先家从兄弟儿侄饮于濯魄台 其三
610800,又同黎明府游铜官山二首 其二
618984,同黎惟敬梁思立梁少伸林开先过流霞岛
593401,七夕同黎惟敬范子宣张元易郑伯良王彦贻朱汝修集华存叔馆时存叔初至得长字
685493,避暑铜陵留滞二旬暇同黎明府登天王寺乘凉三首
541286,三月三日同黎惟仁林开先宴梁少仲东庄
618185,秋日同黎君选徐木之侄明公儿准集愚公楼时方延僧诵法华经分赋四首 其二
688940,七夕同黎君选徐六出吴孟浚罗子开陈迪先家从兄弟儿侄饮于濯魄台
618156,立秋后一日同黎君选徐木之高沛卿傅元子暨准儿游古榕洲分赋
600659,同黎岱屿年丈海珠寺眺望
630112,春日同黎美周苏裕宗曾自昭姚谷符诸子赋得月下梨花双白燕
604856,李烟客欧嘉可黄逢永移舟招同黎馆甥是因小孙台宴集浮丘旧社得梁字
618184,秋日同黎君选徐木之侄明公儿准集愚公楼时方延僧诵法华经分赋四首 其一
615439,十五夜同黎邓欧诸子饮李仲伟席上得星字
618174,庚辰春日同黎君选欧嘉可诸从儿侄渡石门二首 其二
624128,黄昆父携具邀同黎缜之邓伯乔黄元生梁羲年李伯襄李仲伟李良父黄元礼李珏仲龙池社集分赋体得五言古韵得一先
544730,夜同黎惟敬康裕卿胡文父何仁仲朱汝修集李惟寅宅得寒字
544684,谷日同黎惟敬秘书梁思伯中翰丘汝谦计部童子鸣康裕卿二山人安茂卿文学集朱在明宅得宫字
593397,郑光禄邀游智化寺登万佛阁同黎秘书李明府二张光禄分得繁字
593679,李明府召同黎秘书刘观察王纳言集得歌字
618314,初秋雨夜同黎君选徐木之傅元子诸从右文伯承集松风阁分赋
615725,仲秋日同黎缜之邓伯乔访欧子建饮贻安堂其诸从同集
497059,同黎徐二帅游南屏山二首 其二
592145,十六夜同黎秘书吴侍御梁舍人集梦芝馆听管山人作吴歌
593412,同黎秘书王纳言李临淮李宛平过刘观察园玩菊
690093,游七星岩同黎美周梁渐子何景玮诸子赋
591960,同黎惟敬询韩子成病 其一
593682,初秋雨中同黎惟敬秘书刘仲修观察李袭美明府蒋少翼吴仲周滕晋生李惟仕朱汝修陈从训六徵士集李临淮惟寅宅得卮字
593596,同黎秘书李明府携酒过方太常宅
688863,同黎君选欧嘉可碧瓯亭纳凉分赋二首
591849,李符卿伯承左迁亳州夜同黎秘书惟敬吴侍御约卿往饯得长字
618643,七夕同黎君选徐六出吴孟浚罗子开陈迪先家从兄弟儿侄饮于濯魄台 其二
614339,春日鲁子湛书堂赏花同黎建和郑明宰黄茂明分赋 其三
604851,巧夕移舟合江楼邀同黎定宇亲家昆季汎集时定宇方谢去举子业故戏及之
610783,避暑铜陵留滞二旬暇同黎明府登天王寺乘凉三首 其二
609188,同黎惟仁访朱氏兄弟山池
609164,重阳后一日同黎惟仁陈少珍梁少仲陈孔信麦兆张黎君玺再登西城角楼
609186,饮对江楼望越井冈木棉花同黎惟仁赋
299313,同黎弼轩游慈云寺
593640,九日广济寺同黎惟敬顾汝修郑伯良顾汝和李于美邵长孺张元易登藏经阁得头字
522175,席仁同黎一卿许伯诚三御史出巡与之酌别
618182,同黎君选欧嘉可碧瓯亭纳凉分赋二首 其二
784943,同黎悦安阎古樵弈棋夜饮
618646,七夕同黎君选徐六出吴孟浚罗子开陈迪先家从兄弟儿侄饮于濯魄台 其五
618645,七夕同黎君选徐六出吴孟浚罗子开陈迪先家从兄弟儿侄饮于濯魄台 其四
746428,同黎弼轩游慈云寺 其一
591290,月夜同黎惟敬梁思伯泛芙蓉溪得秋字
690916,春日鲁子湛书堂赏花同黎建和郑明宰黄茂明分赋
548264,二月十五日雨中同黎参议欧博士顾典客顾舍为钟丈人人沈进士黄文学永上人集王鸿胪宅得风字
717079,花朝后一日同黎子及诸从兄弟小集澹翁家叔园林分赋
593654,元夜同黎惟敬李于美邵长孺顾叔潜集沈太史君典宅得春字时君典在告
615879,中秋先一夕浮邱社集同黎君选传贞父陶摇光何龙友彭伯时戴安仲从弟代骧赋
591961,同黎惟敬询韩子成病 其二
614338,春日鲁子湛书堂赏花同黎建和郑明宰黄茂明分赋 其二
618326,庚辰初秋日同黎君选徐六出罗子开家从儿侄赋别门人吴孟浚比部于宝莲寺二首 其二
614337,春日鲁子湛书堂赏花同黎建和郑明宰黄茂明分赋 其一
630050,游七星岩同黎美周梁渐子何景玮诸子赋 其一
592104,病中曾缮部携酒同黎秘书夜过得长字
618648,七夕同黎君选徐六出吴孟浚罗子开陈迪先家从兄弟儿侄饮于濯魄台 其七
618988,丰湖晚步同黎惟和赋
688864,秋日同黎君选徐木之侄明公儿准集愚公楼时方延僧诵法华经分赋四首
593218,同黎郎中过乔评事饮丁香花下
603821,秋日赵太史招同黎秘书祁林二子集听笙亭得楼字
593683,同黎惟敬酌陈玉叔得渠字
592229,瑞州官舍同黎比部晚酌净芳亭
591867,姚元白将还金陵同黎惟敬顾汝和汝所过访得秋字
610799,又同黎明府游铜官山二首 其一
618642,七夕同黎君选徐六出吴孟浚罗子开陈迪先家从兄弟儿侄饮于濯魄台 其一
593395,同黎秘书孙太史顾评事诸君过王鸿胪宅静修上人亦至得轻字
592092,九日同黎秘书李黄门吴冯二侍御登宣武门楼
625225,夏杪同黎君选徐木之谒寿何相国延居宝纶阁
689807,同黎徐二帅游南屏山二首
685434,又同黎明府游铜官山二首
593356,夜同黎秘书过徐方伯
591309,同黎惟敬梁思伯游西樵宿云谷洞得存字
593629,中秋同黎惟敬王敬美梅客生沈箕仲屠长卿周元孚唐惟良沈叔成集陶懋中宅对月
618187,秋日同黎君选徐木之侄明公儿准集愚公楼时方延僧诵法华经分赋四首 其四
746429,同黎弼轩游慈云寺 其二
591925,陆山人元德见过同黎秘书惟敬梁舍人思伯小酌得山字
601115,午日同黎惟敬泛舟
610782,避暑铜陵留滞二旬暇同黎明府登天王寺乘凉三首 其一
