509657,刘廷美佥宪为乡人魏古作湖山图徐武功题诗其上魏复求予作为赋一绝
690643,题倪云林筠石乔柯图倪有诗其上即用其韵
1211871,余与观志能俱以公事赴北舟至梁山泊时荷花盛开风雨大至舟不相接遂泊芦苇中余折芦一叶题诗其上寄志能
588682,燕山田少参将奉表北上以忠孝节义四书见惠题诗其上赋此答赠
439068,还紫云寺素扇且题诗其上
936055,夜梦与数客观画有八幅龙湫图特奇客请予作诗其上书数十字而觉不复能记明旦乃追补之亦彷佛梦中意也
817992,陈讱生为余写蒹葭楼图并题诗其上自东瀛见寄七月晦日雨中展视赋此酬之
965271,子经昔有黄筌玉笋图故人陈众仲题诗其上后为人易去常追忆不已余往借观临之以归郑氏并识以诗
1070867,签判黄元功顷摄守蔚平枕江有小亭予假居久之稍加葺治且作诗其上名之曰横江今既还职辄用写呈
641425,以地图赠吴明府题诗其上
760698,晓沧不工画而为谢叠峰少将作小幅山水，自题诗其上，戏为书此
176053,子经昔有黄筌玉笋图故人陈众仲题诗其上后为
301988,陈讱生为余写蒹葭楼图并题诗其上自东瀛见寄七月晦日雨中展视赋此酬之
493505,宗启刘君由泰和知县入为工部侍郎先时县丞陈举善为作山水图以识别及会京师刘属题诗其上余邑子也故云
510458,沈石田作玉台图题诗其上见寄次韵以复
644295,日彰法师得旨还山王生作泉石閒斋图予题诗其上以为赠行
331077,签判黄元功顷摄守蔚平枕江有小亭予假居久之稍加葺治且作诗其上名之曰横江今既还职辄用写呈
1242052,景辰张先生校文福建归林公崇高画闽溪放棹图赋诗其上以饯因次韵就题
1063016,余有鉴其制如书册戏号勋业簿取子美诗所谓勋业频看鉴者马子约题诗其上云勋业簿中频点捡只添白发与苍颜和之
605492,题倪云林筠石乔柯图倪有诗其上即用其韵 其二
1219217,赵善长枉顾玉山，遂以绢为予索画，并诗其上
605491,题倪云林筠石乔柯图倪有诗其上即用其韵 其一
492434,题杨懋临所画平远图有左炼师题诗其上因赋此继之
