40698,三日侍华光殿曲水宴代人应诏诗·文教已肃
732976,丁巳元日侍班候贺雪中口占
813280,丙戌春日侍太夫人邓尉探梅遍历铜坑香雪海诸胜太夫人命赋梅花用高青邱韵呈九首
40700,三日侍华光殿曲水宴代人应诏诗·高悬甲帐
914113,四月十七日侍立集英殿观进士唱名
648198,十月十六日侍从赴北京出江东门
811373,立春前一日侍家大人游薯村题宗人山楼二首
164987,正月二十七日侍二老人出万里桥游宝历寺谒五
731380,曲阿后湖用颜延年三月三日侍游韵赠吉渭厓先生
723143,为临川王九日侍太子宴诗
40658,三日侍宴曲水代人应诏诗
299114,八声甘州·秋日侍莲甫舅氏游摄山
41042,九日侍宴乐游苑诗为西封侯作
40657,三日侍华光殿曲水宴代人应诏诗
40704,三日侍宴曲水代人应诏诗·初莺命晓
1003680,清明日侍亲舆游海云寺四首 其二
886658,正月二十七日侍二老人出万里桥游宝历寺谒五丈天王至合江亭登小舟往来江中日晚出舟憩卧柳亭以归记所见
249029,七月七日侍皇太子宴玄圃园诗
68859,送日侍者游两府兼柬丁仲容先生
725450,三日侍安成王曲水宴诗
40697,三日侍华光殿曲水宴代人应诏诗·悬象着明
947782,九月二十二日侍祠明堂口占
956333,十月朝开炉偶书余病归二年未能拜埽松楸曩常以此日侍先兄游洞庭并写悲感之怀
723961,三日侍华光殿曲水宴代人应诏诗
499140,元日侍班
580726,己丑秋九日侍御张凤村北上联舟至长兴久滞风雨时凤村有上恤灾之议诗呈同寅诸君 其一
144318,九月一日侍老人游洞霄宿超然馆闻钟
617597,春三日侍诸父泛舟桃花坞 其一
389752,元日侍香山何夫子燕宝纶阁
1061729,试灯日侍亲游戒珠寺
159019,季冬立春日侍宴垂拱殿契丹使预会
596138,人日侍家慈过南园
1164425,奉和立春日侍宴内出剪綵花应制
62773,春日侍宴高唐齐东二王即韵应教
254460,九日侍宴口占
404752,浣溪沙·甲戌三月三日侍世父木公、病树二丈游北新泾赵氏园。病丈有诗，予亦和作，更次韵得此解
40327,三日侍凤光殿曲水宴应制诗
40696,三日侍华光殿曲水宴代人应诏诗·羣分未辨
698242,弘治纪元戊申二月十三日侍从亲耕藉田用程学士韵一首怀不能已复缀短韵一章
724664,车驾幸京口三月三日侍游曲阿后湖作诗
974093,闰七月二十日侍知府寺簿先生为石鼓山向园之游
534821,五日侍宴龙舟应制
1084322,辛亥九日侍家君同孙子渊子昭子尚登高于家之东山时菊花未开坐客皆以为恨至十月望独步东篱下见前日青枝已烂熳矣东坡云凉天佳月即中秋菊花开日乃重阳不以日月断也于是命酒肴呼邻里饮于丛畔云
1167294,奉和九日侍宴应制得浓字
1484,奉和圣制立春日侍宴内殿出剪彩花应制
159701,正月四日侍宴紫宸殿契丹使预会
1216015,三月廿二日侍从圣上汎舟玉泉西寺护国寺行香作二首 其一
1142257,六月十二日侍郎桥感事
1169492,人日侍宴大明宫恩赐綵缕人胜应制
650257,重午日侍从内苑观击毬射柳应制
514033,仁里宗侄素时日侍予于聚爱楼又从游石镜诸处胜地情意勤款与他宗人不同时予将重脩统宗世谱且欲编石镜古今题咏以素时之博学好古也两以属之素时其尚有以副予之志哉
199,奉和圣制立春日侍宴内殿出翦彩花应制
963113,九月一日侍老人游洞霄宿超然馆闻钟
1198488,七月七日侍皇太子宴玄圃园诗
725735,三日侍皇太子曲水宴诗
771523,三月四日侍母登舟谢淮阴诸友送至宝应
161996,九月十二日侍祠明堂口占
580727,己丑秋九日侍御张凤村北上联舟至长兴久滞风雨时凤村有上恤灾之议诗呈同寅诸君 其二
867,奉和立春日侍宴内出剪彩花应制
40701,三日侍华光殿曲水宴代人应诏诗·天地既成
40702,三日侍宴曲水代人应诏诗·丽景则春
40328,为临川王九日侍太子宴诗
475962,春日侍宴高唐齐东二王即韵应教
97745,闰七月二十日侍知府寺簿先生为石鼓山向园之
797668,八声甘州 秋日侍莲甫舅氏游摄山
1187443,九日侍宴应制
723136,三日侍凤光殿曲水宴应制诗
676648,秋日侍蔡师宴汤二子重
1169575,春日侍宴幸芙蓉园应制
41575,三日侍宴宣猷堂曲水诗
538954,乞休杜门日侍老母汤药朝来眉颦稍舒知有牡丹已零落矣为之一慨 其一
1003679,清明日侍亲舆游海云寺四首 其三
1167305,春日侍宴芙蓉园应制
723962,三日侍宴曲水代人应诏诗
1473,奉和圣制九日侍宴应制得高字
693854,春三日侍诸父泛舟桃花坞
40331,三日侍林光殿曲水宴应制诗
725449,三日侍华光殿曲水宴诗
1128022,清明日侍亲舆游海云寺四首
1123,春日侍宴幸芙蓉园应制
755063,春日侍家慈天竺礼佛
894445,季冬立春日侍宴垂拱殿契丹使预会
723124,九日侍宴乐游苑诗
41161,三月三日侍宴西池诗
180717,昨日侍巾钵饭于天宁蒙示佳什谨次韵
1236497,三月廿二日侍从圣上汎舟玉泉西寺护国寺行香作二首
788352,朕御极七载宵旰万几未遑他出己酉夏因命将远讨誓师于南海子缅怀曩日侍奉皇考巡幸此地色笑俨在目前而龙驭杳然邈不可攀俯仰徘徊曷胜今昔之感爰成一律以述追思
40659,三日侍宴曲水代人应诏诗·周道如砥
1216016,三月廿二日侍从圣上汎舟玉泉西寺护国寺行香作二首 其二
307797,淡黄柳·廿四年七月廿二日侍斠玄夫子游后湖
724832,九日侍宴诗
724387,三日侍宴宣猷堂曲水诗
2441,人日侍宴大明宫应制
725052,九日侍宴乐游苑诗
1170130,奉和圣制九日侍宴应制得高字
545943,春日侍家君过祝太学留宿别馆夜出群少侑觞豪饮申旦醉梦中拈韵得此诗题壁示太学并示山人无殊
1065681,正月二十四日侍亲游罗浮道院栖禅山寺
892998,九日侍宴太清楼
265466,九日侍皇太子乐游苑诗
725085,九日侍宴乐游苑正阳堂诗
480021,弘治纪元戊申二月十三日侍从亲耕藉田用程学士韵一首怀不能已复缀短韵一章 其一
40699,三日侍华光殿曲水宴代人应诏诗·作乐顺动
759949,立春前一日侍家大人薯村题宗人山楼二首 其二
1003678,清明日侍亲舆游海云寺四首 其四
1238077,送日侍者游两府兼柬丁仲容先生
725572,三日侍皇太子曲水宴诗
457094,九日侍宴口占
724443,秋日侍宴娄苑湖应诏诗
678653,天寿日侍宴
480022,弘治纪元戊申二月十三日侍从亲耕藉田用程学士韵一首怀不能已复缀短韵一章 其二
710759,元日侍香山何夫子燕宝纶阁
738029,夏日侍家在陆编所自著诗古文目录讫赋呈
2211,奉和九日侍宴应制得浓字
1169532,立春日侍宴内殿出剪綵花应制
1038528,九日侍宴太清楼
507238,午日侍宴
2208,春日侍宴芙蓉园应制
1175923,立春日侍宴内出剪綵花应制
1183664,人日侍宴大明宫应制
938187,昨日侍巾钵饭于天宁蒙示佳什谨次韵
1518,立春日侍宴内出剪彩花应制
754874,丙戌春日侍太夫人邓尉探梅遍历铜坑香雪海诸胜太夫人命赋梅花用高青邱韵呈九首 其一
124006,九日侍宴太清楼
754875,丙戌春日侍太夫人邓尉探梅遍历铜坑香雪海诸胜太夫人命赋梅花用高青邱韵呈九首 其二
683496,乞休杜门日侍老母汤药朝来眉颦稍舒知有牡丹已零落矣为之一慨
1120,立春日侍宴内殿出剪彩花应制
1003681,清明日侍亲舆游海云寺四首 其一
40329,九日侍宴乐游苑诗
1183670,奉和圣制立春日侍宴内殿出剪綵花应制
1147687,奉和圣制立春日侍宴内殿出剪綵花应制
163403,清明日侍亲舆游海云寺
531354,四月廿日侍班纪事次金鹤卿韵
40703,三日侍宴曲水代人应诏诗·上巳惟昔
725940,九日侍宴乐游苑应令诗
338192,三月四日侍母登舟谢淮阴诸友送至宝应
759948,立春前一日侍家大人游薯村题宗人山楼二首 其一
1292,人日侍宴大明宫恩赐彩缕人胜应制
2701,九日侍宴应制
538955,乞休杜门日侍老母汤药朝来眉颦稍舒知有牡丹已零落矣为之一慨 其二
423073,淡黄柳 廿四年七月廿二日侍斠玄夫子游后湖，时四山淡漠，一雨霏微，景光凄绝
723137,三日侍林光殿曲水宴应制诗
725736,九日侍皇太子乐游苑诗
617598,春三日侍诸父泛舟桃花坞 其二
726007,三日侍宴咏曲水中烛影诗
1088358,暇日侍法曹叔父陪诸名胜为落星之游分韵得往字率尔赋呈聊发一笑
1231060,上元日侍宴叠嶂楼
144013,元宵前三日侍老人游双林
1146313,春日侍宴望海应诏
795560,蝶恋花 春日侍祖母母氏，偕诸姊妹游虞山
722996,九日侍宴乐游苑诗为西封侯作
1009362,示慧日侍者德禅人偈
93320,四月十七日侍立集英殿观进士唱名
360769,试灯日侍亲游戒珠寺
535662,九月二日侍经筵有述
725939,三日侍兰亭曲水宴诗
1178664,正月晦日侍宴浐水应制赋得长字
504645,冬至前日侍父宴胡伯奇济生堂
894414,正月四日侍宴紫宸殿契丹使预会
723885,三月三日侍宴西池诗
1211789,春日侍驾游香山
682783,己丑秋九日侍御张凤村北上联舟至长兴久滞风雨时凤村有上恤灾之议诗呈同寅诸君
963842,元宵前三日侍老人游双林
1208607,端午日雨霁暂出齐化门回入城遥面京西诸山及市肆风景追忆延祐六年六月廿有二日侍诚夫尚书兄初自江南还都亦经此路仍值雨晴今十有五年矣感念畴昔因赋此诗
41588,秋日侍宴娄苑湖应诏诗
650475,九日侍从车驾出南郊登高
40733,三日侍华光殿曲水宴代人应诏诗·求贤每劳
342460,元夕前一日侍大人邀胡孝辕德州姚孟承山人小集得文字
725032,九日侍宴乐游苑诗
1159376,奉和圣制立春日侍宴内殿出剪綵花应制
642824,三月二日侍燕
