587975,苏见江携酒过访诗以谢之
838405,秋河贻梅花画册，诗以谢之 其三
535108,拟道齐河招渭滨宪副为岳游不果渭滨爰追会于高唐既别诗以谢之
196626,孔同知孔圣衣裔垂念逆旅用意勤甚诗以谢之
755139,庞书君女史惠赠纨扇诗以谢之
976745,孔同知孔圣之裔垂念逆旅用意勤甚诗以谢之
587797,张宪长过访诗以谢之
385290,顾华玉以书邀予为西湖之游病不能赴诗以谢之
627236,访同里龙宗尼有周生者呼其爱姬行酒有留髡之志姬通词赋工翰墨坐中书箑见诒不知仆之为伧父也诗以谢之
588350,藩司诸公见访失迓诗以谢之 其一
628521,尹右民作先文烈行状诗以谢之
1159998,南海马大夫见惠著述三通勒成四帙上自邃古达于国朝采其菁华至简如富钦受嘉贶诗以谢之
517772,七月中旬霖雨大作夜分卧处墙颓连榻者先觉不以闻恍惚中伤鼻出血感何杨诸友慰安情甚厚诗以谢之
1218870,钱塘谢太守有书见邀作此诗以谢之
515593,衍圣公自曲阜载奇石一块至京相馈诗以谢之
604454,韩伯声后圃梅花盛开招赏冗夺不获赴诗以谢之 其二
843801,秋河贻梅花画册，诗以谢之
657741,承孙侍御枉顾失迓诗以谢之 其二
574559,董感恩道卿自兰溪来访致枫山章公手书诗以谢之
517769,丙申初度日承诸知己设酒肴相慰诗以谢之
295726,欧西战事方急余偶事纂述有以时危讽者诗以谢之
838403,秋河贻梅花画册，诗以谢之 其一
854993,王治中招余饮丹阳刘公雪苑英公在座主人俾余坐中席僧居左道居右众宾列坐两傍曰道之所在也余敢当此哉为诗以谢之
352710,慎思屡以佳篇见贻且俾属和而衰老困于强敌辄为诗以谢之兼简无咎文潜天启
685105,王岱麓李三洲携酒过访诗以谢之三首
1085403,子应赠蜀中石刻十卷诗以谢之
700272,周文焕致槐栽十二本列植道南美而且巨不日成阴矣诗以谢之庚午正月望日
657740,承孙侍御枉顾失迓诗以谢之 其一
1249285,胡仲厚为余写陋容诗以谢之
685022,项瓯东过访诗以谢之
384113,西斋王梧冈先生以鱼鲊、山茗见贶，诗以谢之
510050,平乡伯陈公以紫茄花绢为家慈寿诗以谢之
1048101,慎思屡以佳篇见贻且俾属和而衰老困于强敌辄为诗以谢之兼简无咎文潜天启
587857,王岱麓李三洲携酒过访诗以谢之三首 其一
734764,戊午春入都请罪施介平又韩追送江干诗以谢之
685007,藩司诸公见访失迓诗以谢之
630999,诸子邀游厓门诗以谢之
384921,得姚秋浦明府书为家母寿，诗以谢之
346672,史君赠所临蜀本三苏入京图诗以谢之
521691,周文焕致槐栽十二本列植道南美而且巨不日成阴矣诗以谢之庚午正月望日 其一
690451,韩伯声后圃梅花盛开招赏冗夺不获赴诗以谢之
658157,吴宗道医已入神品张旭草书宜僚弄丸非诳也百尺竿头更进一步又在宗道诗以谢之
687719,承孙侍御枉顾失迓诗以谢之
679602,冬月苗汝材自晋中以毡衣巾见赠诗以谢之
838404,秋河贻梅花画册，诗以谢之 其二
792942,浼冷君司马画扇蒙写红梅满幅诗以谢之
568113,闻孙送至枫桥诗以谢之
585231,陈公晦张信夫来顾失迓诗以谢之
321997,子应赠蜀中石刻十卷诗以谢之
587974,赵东台携酒过访诗以谢之
588017,项瓯东过访诗以谢之 其一
604453,韩伯声后圃梅花盛开招赏冗夺不获赴诗以谢之 其一
782697,友人简邀踏青诗以谢之
1098045,史君赠所临蜀本三苏入京图诗以谢之
386610,庐陵义仓平粜，以余谷一石见惠，诗以谢之
668682,顾华玉以书邀予为西湖之游病不能赴诗以谢之
588351,藩司诸公见访失迓诗以谢之 其二
445126,小小有寿吾句云『先生百岁再求句小小无牙却有诗』其情可感诗以谢之并贺生辰
838406,秋河贻梅花画册，诗以谢之 其四
605041,王宪度明府招饮时以目疾不能赴移席小寓诗以谢之
297338,秋河贻梅花画册，诗以谢之
787647,高香亭由东阳寄何氏兰亭本，诗以谢之
587858,王岱麓李三洲携酒过访诗以谢之三首 其二
587859,王岱麓李三洲携酒过访诗以谢之三首 其三
588018,项瓯东过访诗以谢之 其二
661447,许子厚约游石湖余以事沮诗以谢之
888773,昔杯渡禅师自西域开山隐静止携五叶松来岁月既远余求此山中之松已化为乌有矣护国远老知余此意遍搜之天台山中得于玉霄峰下移以见饷遂为林下之光因诗以谢之
604909,陈石渠明府枉书先讯诗以谢之
588420,何宪副小洛访予青萝山中失迓诗以谢之
674921,小传见托冗未果作诗以谢之
799740,甲寅四月宋蓼天少宰以边才特疏荐余诗以谢之
521692,周文焕致槐栽十二本列植道南美而且巨不日成阴矣诗以谢之庚午正月望日 其二
