1168732,赠华州王司士
1213061,休日陪汉阳诸名公登秋兴亭觞咏移时尘虑顿息但以不得会仲通为歉因缀长句呈钦夫佥司士元太守君平察推仲通宰公暨座中诸友
4992,赠华州王司士
4296,郧上送韦司士归上都旧业
1182298,送常州司士崔千里
1213181,王仲通宰公自东吴别去十载甲寅秋会于鄂渚乃知尚在七品常调中使人有郁郁遗才之叹谈论平生相对如梦历数海内诸友离合升沉之状悲欢良久有不能自已者既而仲通有欲为道隐求奉一祠之语诘难未能服俄为借骑下淮复归行馆翌日缀诗二章奉呈兼简钦甫佥司士元使君君平察推 其一
7111,夜别韦司士得城字
1153972,和李使君三郎早秋城北亭楼宴崔司士因寄关中弟张评事时遇
1178533,裴司士员司户见寻
4610,裴司士员司户见寻
1158747,郧上送韦司士归上都旧业
1237213,王仲通宰公自东吴别去十载甲寅秋会于鄂渚乃知尚在七品常调中使人有郁郁遗才之叹谈论平生相对如梦历数海内诸友离合升沉之状悲欢良久有不能自已者既而仲通有欲为道隐求奉一祠之语诘难未能服俄为借骑下淮复归行馆翌日缀诗二章奉呈兼简钦甫佥司士元使君君平察推
1213182,王仲通宰公自东吴别去十载甲寅秋会于鄂渚乃知尚在七品常调中使人有郁郁遗才之叹谈论平生相对如梦历数海内诸友离合升沉之状悲欢良久有不能自已者既而仲通有欲为道隐求奉一祠之语诘难未能服俄为借骑下淮复归行馆翌日缀诗二章奉呈兼简钦甫佥司士元使君君平察推 其二
15541,和李使君三郎早秋城北亭宴崔司士因寄关中张评事
1187009,夜别韦司士得城字
11345,送从叔士准赴任润州司士
1153859,送从叔士准赴任润州司士
