1225448,天冠山同诸学士为祝丹阳赋 其二 逍遥岩
502722,书高漫士为道人游月窗作水墨图
633727,孙鹤林居士为狂人所累赴理五羊今得脱然诗送之归 其二
182051,类试院放榜众论以得士为庆作古诗一章呈详定
821082,绮罗香 居竹楼时日以丹青自遣，醇士为余作扇头小景，题遗山句云：可怜旧隐抛何处，一片伤心画不成。盖唯易十年二字为可怜耳，检示惘然，漫拈此解
921459,杨康功有石，状如醉道士，为赋此诗
559823,赠医士为续经历以仁作
502660,高漫士为许宗显作山水图
958468,类试院放榜众论以得士为庆作古诗一章呈详定钱宪元素及同院诸公绍兴甲子十月二十八日也
1065180,陈处士为予画像求颂戏与之
1014818,文殊大士为龙女说法赞
1225450,天冠山同诸学士为祝丹阳赋 其四 石人峰
828674,闻近日求人书者以进士为贵戏作一绝
538506,送吴博士为齐藩相地还朝
502703,题高漫士为周仲器作黄山书室图
502625,题高漫士为王明府绘吴航胜览
1225451,天冠山同诸学士为祝丹阳赋 其五 小隐岩
378908,陈处士为予画像求颂戏与之
420722,望海潮 其二 姚名达教授与其女弟子封禾子沈乃蓉二女士为女子月刊社宴客于沪上青年会，时予方自槟城假归，被邀列席，在座有陈碧云梁雪清诸女士及王统照赵景深汪馥泉许杰张若英马子华上官公仆等三十余人，皆当世文坛名作家，洵省事也。因为之赋
760347,以摄影法成澹定村心太平草庐图，张六士为题长句，次其韵
220100,送张巨山·士为知己用
680969,题三一居士为嘉兴屠元明贰守作盖其历武昌建昌太平不挈家故云
928542,过建阳县以双鹅赠东观道士为长生鹅观俯大溪鹅得其所矣武夷险绝处有仙船架崖壁间数日前大风吹堕船木数寸坚硬如石予偶得之皆此行奇事也各赋一诗 其二 堕木
1138941,马道士为詹仲明作柳城春色图城门外柳树连堤桃花夹竹小桥渔艇茅屋下有读书人不知何处景也为题二绝 其一
1070934,郴士为作暖阁既成是夕雪作喜而成诗
1118250,过建阳县以双鹅赠东观道士为长生鹅观俯大溪鹅得其所矣武夷险绝处有仙船架崖壁间数日前大风吹堕船木数寸坚硬如石予偶得之皆此行奇事也各赋一诗 双鹅
579583,东山居士为何良贵曲
1138940,马道士为詹仲明作柳城春色图城门外柳树连堤桃花夹竹小桥渔艇茅屋下有读书人不知何处景也为题二绝 其二
167714,鬼书·壮士为儒耻
1250279,小留豫章袁尚志归自浙右得刘伯温书并寄吴兴温国宝笔十枚感其远贶一诗奉寄伯温名基处州青田人举进士为高安丞再迁江浙儒学副提举
304209,闻近日求人书者以进士为贵戏作一绝
657508,乐道斋诗定山居士为彭世英书世英十过定山所得止此昔东坡鬻马方叔不免更鬻然于此纸世英岂待一过宿哉世英之戚必有此纸者尚亦知世英之不易得也
633726,孙鹤林居士为狂人所累赴理五羊今得脱然诗送之归 其一
928894,过建阳县以双鹅赠东观道士为长生鹅观俯大溪鹅得其所矣武夷险绝处有仙船架崖壁间数日前大风吹堕船木数寸坚硬如石予偶得之皆此行奇事也各赋一诗 其一 双鹅
514005,节庵倪先生以经学教于乡既成其子进贤举进士为御史又出其馀以淑乡之人其在德兴孙司马之塾最久予过婺源望先生之庐尚远不能往拜漫成一律奉寄
1144409,马道士为詹仲明作柳城春色图城门外柳树连堤桃花夹竹小桥渔艇茅屋下有读书人不知何处景也为题二绝
703268,孙鹤林居士为狂人所累赴理五羊今得脱然诗送之归
331111,郴士为作暖阁既成是夕雪作喜而成诗
277506,感怀·士为天下生
1225447,天冠山同诸学士为祝丹阳赋 其一 鍊丹井
643260,谢杜医士为叶百户赠
1236199,天冠山同诸学士为祝丹阳赋 鍊丹井
743768,翁覃溪学士为摹砖塔铭赋谢
502717,题高漫士为果之绘阜阳别墅
313386,清平乐·骆佩香女士为王梦栖画水墨花卉卷
901455,京兆安汾叟赴辟临洮幕府南舒李君自画阳关图并诗以送行浮休居士为继其后
657756,谢医士为谢汝申作
881639,浣溪沙 其二 渔父词，张志和之兄松龄所作也，有招玄真子归隐之意。居士为姑苏郡守，浩然有归志，因广其声为浣溪沙，示姑苏诸友
502557,书高谩士为陈容斋作山水图
1056045,茅山道中抵莫投一客邸甚素雅主人喜客乃一善士为待至厚既别留此致谢
826488,清平乐·骆佩香女士为王梦栖画水墨花卉卷
102593,杨康功有石状如醉道士为赋此诗
502620,书漫士为陈拙脩绘沧洲别墅
205023,吾友张四居士为僧敢献善颂
185525,马道士为詹仲明作柳城春色图城门外柳树连堤
1208600,江西袁庆远由郡博士为幕职再调潮州路经历徵诗送行
330319,茅山道中抵莫投一客邸甚素雅主人喜客乃一善士为待至厚既别留此致谢
1239694,五月余还至渭南适克正博士为丞于兹款遇有加意义兼至因用赋诗以道旧并以留别
659064,木石居士为叶文节赋
275659,绮罗香·居竹楼时日以丹青遣，醇士为余作小景
1008062,吾友张四居士为僧敢献善颂
1214212,子昂学士为余作此山二字并作诗见畀其诗云青青云外山炯炯松下石顾此山中人风神照松色又云爽气在襟袖清风拂丝桐悠悠适天趣宴坐心融融书此以谢
55272,五月余还至渭南适克正博士为丞于兹赋诗道旧
830204,游埃及录士京 埃及古庙陵阙皆在录士录士为七千年古京地球古文明第一游埃及者不到录士与未游同
1225449,天冠山同诸学士为祝丹阳赋 其三 玉帘泉
663118,姚义士为亡友经纪曲尽
403973,浣溪沙·题周练霞女士为冒效鲁教授绘《赤栏桥图》
1144820,南豫州军士为王玄谟宗越语
387824,题木居士·为神讵比沟中断
