54083,青县赠潘茂硕
1089475,潘茂和才叔远访雨后饯别 其二
1089474,潘茂和才叔远访雨后饯别 其一
602659,寒食访潘茂才子科昆季书馆夜坐同赋家字韵
903223,池上次潘茂洪韵
471585,青县赠潘茂硕
141099,潘茂洪借屋地主催起仆以山园暂假寓泊书两诗
1111148,潘茂和才叔远访雨后饯别
140660,即席次潘茂洪韵
1089728,次潘茂和韵
549121,丁未清明后一日偕潘茂昆郡伯登峄山
141287,杨伯时李子永潘茂洪同游安福寺
141328,同魏茂先潘茂洪泛湖终日
353459,潘茂和才叔远访雨后饯别
140366,次韵答潘茂洪桂花见怀
140895,池上次潘茂洪韵
902787,潘茂洪借屋地主催起仆以山园暂假寓泊书两诗送之 其二
1225583,寄潘茂
620465,九日答潘茂才
1113450,潘茂洪借屋地主催起仆以山园暂假寓泊书两诗送之
902913,次韵酬潘茂洪见寄
902958,杨伯时李子永潘茂洪同游安福寺诗
902899,次韵答潘茂洪桂花见怀
353404,次潘茂和韵
141100,潘茂洪出疆回以汴都画山水扉见遗报之五言
902788,潘茂洪借屋地主催起仆以山园暂假寓泊书两诗送之 其一
140761,次韵酬潘茂洪见寄
903105,潘茂洪出疆回以汴都画山水扇见遗报之五言
903156,同魏茂先潘茂洪泛湖终日
640593,正月十三日饮潘茂清家
902915,次韵潘茂洪春日书怀
140782,次韵潘茂洪春日书怀
1221570,赠潘茂华
902943,即席次潘茂洪韵
