747849,邓湘皋丈枉顾别十三年矣喜赋
572815,龙君御载酒过德山见访一别十三年矣感念存没不觉悽然已复自笑举觥相乐遂大醉
268441,友人自豫章来，喜食蟹，云不尝此味十三年矣，作此赠之
761933,友人自豫章来，喜食蟹，云不尝此味十三年矣，作此赠之
923720,予昔在京师画工韩若拙为予写真今十三年矣容貌日衰展卷茫然叶县杨生画不减韩复令作之以记其变偶作
431846,余兄妹五人，于烽烟岁月中各奔东南西北。壬申之夏，得团聚于五羊城，屈指已四十三年矣。感而为诗
211887,金缕曲/贺新郎·七十三年矣
415565,余兄妹五人，于烽烟岁月中各奔东南西北。壬申之夏，得团聚于五羊城，屈指已四十三年矣。感而为诗 其二
459741,往建新农场探哨子，待渡洞庭湖滨，因忆八四年同学辈游君山，初过此渡，今十三年矣
119325,予昔在京师画工韩若拙为予写真今十三年矣容
415564,余兄妹五人，于烽烟岁月中各奔东南西北。壬申之夏，得团聚于五羊城，屈指已四十三年矣。感而为诗 其一
983243,柳梢青 其四 钓台。绍兴甲子赴试南宫登此，今三十三年矣
1049529,往时与今钱唐蒲资政传正修史邓内翰温伯同和唐韦考功张水部盛山十二咏畀开江吴令使榜于宿云亭二十三年矣因缘登览感慨畴昔复为短篇以纪故事元祐二年正月二十八日安岳冯允南
826836,百字令·予弟南生游艺多能，素不能画，一日得尺绢临钱萚石先生墨兰，信笔挥洒，便有意致。予弟亡来十三年矣，此帧尚藏箧中，附装先世文字册后，系之以词
