414360,抱老与余别十年矣顷自故国飞经新加坡返耶嘉达馀候之于新嘉坡飞机场但见其乌帽出没众客中匆匆相呼复登机去竟不得把臂一谈怅然写此怀之
920458,八月十七日，复登望海楼，自和前篇，是日榜出，余与试官两人复留五首 其一
99427,八月十七复登望海楼自和前篇是日榜出余与试
1116621,八月十七日，复登望海楼，自和前篇，是日榜出，余与试官两人复留五首
741521,自泽口循江堤陆行二十余里至田关复登舟即事
974141,明日同数公复登山忽闻履声乃审知也携和诗三篇来复用韵作一首
263335,中秋月夜偕艺叔，伯秀出游访季野，复登西城远眺有怀
1247019,伏读高昌佥宪公唐律十二首爱其清新雄杰殆本天成非吟哦造次可得韩退之慕樊宗师文苏子瞻拟黄鲁直体惟其有之是以似之区区虽欲效颦第恐唐突西施耳 其十一 和复登灵山
783109,雨后复登通州城楼
920462,八月十七日，复登望海楼，自和前篇，是日榜出，余与试官两人复留五首 其五
134574,和王秀才以光始自陕右游山归复登少室为诗见
69070,怀友·登楼复登楼
1213257,金华客舍夜鼠为祟囊有馀粟悬置榻隅群鼠思窃食之历户枢缘屋壁坠者相继苏而复登感慨偶成
566808,两宿齐云下憩逆旅夜大雪因复登眺
920461,八月十七日，复登望海楼，自和前篇，是日榜出，余与试官两人复留五首 其四
428844,晚步偕秦仲子至陶然亭复登南城远眺
638461,雨霁复登陈山
409741,中秋月夜偕艺叔，伯秀出游访季野，复登西城远眺有怀
485884,次复登华盖山
1062877,二十二日泛舟曹娥江至蔡家山以晚潮将至趋陆至白宋堰遂复登舟
585163,次日复登岳阳楼
868911,临江仙 其十六 明日与客复登台，再用前韵
109511,次复登华盖山
920460,八月十七日，复登望海楼，自和前篇，是日榜出，余与试官两人复留五首 其三
920459,八月十七日，复登望海楼，自和前篇，是日榜出，余与试官两人复留五首 其二
733766,晓雨复登燕子矶绝顶
307511,晚步偕秦仲子至陶然亭复登南城远眺
602983,重阳后一日访苏惟奕书馆黄崇赋携酒榼复登海西台因步惟奕九日韵
98062,明日同数公复登山忽闻履声乃审知也携和诗
739503,游乳泉洞入石云复登莲华岩至白云洞
