376211,秋塘陈敬父席上饯薛子舒之官建康
1231853,用陈敬初雨中见寄有过湖别墅意
1244948,次陈敬初见寄二首兼怀张仲敏 其二
1244947,次陈敬初见寄二首兼怀张仲敏 其一
489922,次韵陈敬初陪贡泰甫待制降香娄上 其二
492587,和陈敬则寄赠二首 其二
578119,爱萱堂为仁和陈敬赋
1247003,次韵陈敬所高吟之辱二首 其二
1212050,和韵寄吴城陈敬初
834827,双双燕 为陈敬如题《燕燕楼图》
1224922,与陈敬初同舟北游题饯行卷后
1252684,次韵陈敬初答虞清二子雨中见寄绝句六首
879531,邀赵行之陈敬叟未至四韵速之
470793,读金元诸公遗集各赋一章凡五首 其三 陈敬初
842328,章茀云有伤逝四首和以绝句而推广之十二首 其六 陈敬伯裔仲
687016,和陈敬则寄赠二首
1137136,浣溪沙 其四 寿陈敬之推官
1219134,仲春六日，辱陈敬初诸君枉顾，小饮敝楼，分得静字
65457,次陈敬德卜居河阳韵
85782,生查子·元夕戏陈敬叟
699255,次韵陈敬初陪贡泰甫待制降香娄上
735873,赠吴人陈敬仲 其一
1219497,月夜怀十五友，并引 其九 陈敬初兄弟
1253204,次韵陈敬所高吟之辱二首
268010,双双燕·为陈敬如题《燕燕楼图》
1239283,次韵陈敬初答虞清二子雨中见寄绝句六首 其二
492586,和陈敬则寄赠二首 其一
234286,邀赵行之陈敬叟未至四韵速之
592819,集方允治宅怀陈敬甫
1211511,经姑苏与张天雨杨廉夫郑明德陈敬初同游虎丘山次东坡旧题韵
489921,次韵陈敬初陪贡泰甫待制降香娄上 其一
678096,颍上感怀呈王安中陈叔谅陈敬脩暨在泮诸友
1231883,寄陈敬德
1252650,次陈敬初见寄二首兼怀张仲敏
1231823,夜梦家兄又梦陈敬初
1095753,寄秋塘陈敬甫
939023,赠陈敬甫
1240528,舟中与陈敬初联句
1239287,次韵陈敬初答虞清二子雨中见寄绝句六首 其六
1250823,至漷州梦陈敬初有作
1246909,用陈敬所韵奉简董仲潜 其二
1095289,秋塘陈敬父席上饯薛子舒之官建康
735874,赠吴人陈敬仲 其二
641804,次韵陈敬德主簿题明心寺壁
64939,次韵陈敬初答虞清二子
1246908,用陈敬所韵奉简董仲潜 其一
1217117,寄陈敬初郯九成
1229372,春晖楼者吴下顾君仲瑛就养读书之所也仲瑛日与昆弟子侄奉卮酒为亲寿临海陈敬初氏实记之余不自揆辄赋古诗二首或者歌以介寿仲瑛之志也其词曰
266491,南柯子·淮西客舍，接得陈敬止书有寄
962132,送陈敬甫
387011,至漷州梦陈敬初有作
1247002,次韵陈敬所高吟之辱二首 其一
653613,别陈敬佐
468588,题陈敬德主簿棘鹊图
1093139,俞伯辉主簿同徐必大判院见过涧上纳凉约鲍南仲教授小酌次韵南仲所赋兼怀林德久国录陈敬甫学士
590838,职方蒋东川辟东山为东营偕陈敬亭偶登东川留酌赋此纪怀
376157,秋塘陈敬父挽章
1137268,霜天晓角 其六 寿陈敬之
879081,生查子 元夕戏陈敬叟
1096168,秋塘陈敬父挽章
211671,送陈敬甫·十年所闻溢吾耳
1239286,次韵陈敬初答虞清二子雨中见寄绝句六首 其五
482940,次陈敬德卜居河阳韵二首 其一
491779,题陈敬则书室
222540,赠陈敬甫·翻水相逢亦偶然
764609,南柯子 其三 淮西客舍，接得陈敬止书有寄。
502720,题陈敬山晋安丹室
562218,留别陈敬夫
1253185,用陈敬所韵奉简董仲潜
690342,次陈敬德卜居河阳韵二首
1251936,题陈敬初小丹丘
1239284,次韵陈敬初答虞清二子雨中见寄绝句六首 其三
1239285,次韵陈敬初答虞清二子雨中见寄绝句六首 其四
482941,次陈敬德卜居河阳韵二首 其二
295215,陈敬伯裔仲
1239701,十一月十日宿陈敬初馆中临别有作
55275,十一月十日宿陈敬初馆中临别有作
814082,赠吴人陈敬仲
1137241,鹊桥仙 其一 题陈敬之扇
735875,赠吴人陈敬仲 其三
1239282,次韵陈敬初答虞清二子雨中见寄绝句六首 其一
594587,九日同陈敬甫梁伯龙登马鞍山得高字
