1119200,乙丑春旱至四月十六夜雨
955680,四月十六日拄笏亭偶题
846017,好事近 寿章宰四月十六
122574,四月十六日拄笏亭偶题
940485,乙丑春旱至四月十六夜雨 其一
1234723,四月十六寓玉环喜家童来住至
729977,四月十六陪茗香翁湘绮先生泛舟碧湖
1083566,四月十六日同弟侄效李长吉体分韵得首字
167200,四月十六夜月蚀
266734,浣溪纱·旧历四月十六日为明末张儿乔女士生日
808825,才儿生去年四月十六，少四十日一岁而殇，埋之栀冈麓
501114,四月十六日夜月
382382,才儿生去年四月十六，少四十日一岁而殇，埋之栀冈麓
940484,乙丑春旱至四月十六夜雨 其二
1208087,四月十六日诣东华门奉迎香舆
1133073,四月十六夜月蚀
169741,乙丑春旱至四月十六夜雨
85342,四月十六夜东山与台客话月
759990,四月十六夜东山与台客话月
826218,浣溪纱·旧历四月十六日为明末张儿乔女士生日，同人以名香花果祀之。方壶并歌余所制百花冢曲为寿。先期由邓昙殊绘象供养，因为题此。呜呼，何世何年，此物此志，古愁今恨，能不依依。乔倩有灵，当兴同感
