297681,台北赠蔡君伯毅
991608,韩玉汝遗澄心纸二轴初得此物欧阳永叔又得于宋次道又得于君伯氏子华今则四矣
1124043,晏斋余自名也故常以榜自随乃以名厅事之东偏厅之后旧有一室面对竹余山居富此物亦以竹隐名对此竹而有思于山中故以思隐名之思隐之东又辟屋丈许连以为斋乞名于张君伯永为名曰容斋并作三绝志其事焉
976760,南至前一日蒋君伯禄携山谷草字来示上有南轩题跋亦南至前一日异哉
710966,寿陈君伯章
499583,邹君伯谦南昌士族也挟笔墨来游金川谒诸文士余观其气宇不凡而有志于学告别归省诗以赠之
837904,台北赠蔡君伯毅
658863,赠石湖卢隐君伯常
827996,五月十三日同散原恪士寿丞瘦唐同武游焦山一宿与瘦唐寿丞同武先去散原恪士留山待王君伯沆
793339,闻卢君伯垠冤系京狱作诗吊之
196663,南至前一日蒋君伯禄携山谷草字来示上有南轩
1151342,上同州使君伯
971679,晏斋余自名也故常以榜自随乃以名厅事之东偏厅之后旧有一室面对竹余山居富此物亦以竹隐名对此竹而有思于山中故以思隐名之思隐之东又辟屋丈许连以为斋乞名于张君伯永为名曰容斋并作三绝志其事焉 其一
971680,晏斋余自名也故常以榜自随乃以名厅事之东偏厅之后旧有一室面对竹余山居富此物亦以竹隐名对此竹而有思于山中故以思隐名之思隐之东又辟屋丈许连以为斋乞名于张君伯永为名曰容斋并作三绝志其事焉 其三
555468,题葡萄为林君伯正赋
971681,晏斋余自名也故常以榜自随乃以名厅事之东偏厅之后旧有一室面对竹余山居富此物亦以竹隐名对此竹而有思于山中故以思隐名之思隐之东又辟屋丈许连以为斋乞名于张君伯永为名曰容斋并作三绝志其事焉 其二
502759,赠别曾君伯刚游广东访陈潮州
