1050803,阮师旦希圣彻垣开轩而东湖仙亭射的诸山如在掌上予为之名曰新轩盖取景物变态新新无穷之义赋十绝句 其十
492986,往时杨清溪为乡先达菊存陈公作种菊图工妙逼真去之六十馀年其五世孙继先乃得之于其仲父有实家盖其家故物也出以示余因题其后以致景仰之意 其十四 舟中望南塘酒楼再赋有怀故人旷伯逵孙伯虞
1083148,求道人示诗粲然有江湖间道人风味盖尝得句法于东溪可今以其韵作诗送之时将如瑞峰期朝夕还吉祥云
1144238,都梁北乡士多好学有向君敏衡者一日访予语甚质气甚夷礼甚虔予心异之间为予言曰家故沅徙也今所居有溪实自沅来乃筑室聚书其上以教子弟因以沅溪书舍名之而其亭则曰无加盖其地旧号无加庄以其东止于石西止于岸南止于路北止于泉也愿有以发之予既为籀右书二颜而向君复以所谓廉崖者谂予予闻此石杰立千尺实峭厉峻削可敬可仰有类乎廉者颇思一至其处摩挲此石以激衰懦而未能也乃各为一解以谢焉
534880,华盖入侍
520352,说经台之北仅一舍有祖庭焉予访重阳旧迹虽有黄冠数辈惜无可问之者然而叠阁重楼气象甚都所谓五祖七真者其亦乘云驭鹤而来憩于此耶盖不可知也予面峰峦徘徊松下恍若飞渡弱流而容与蓬山之上矣因作一诗以写幽兴云
344289,绿牡丹·翠云承盖上流苏
308711,金菊对芙蓉·经桴旁华盖山购新屋，颇葺园榭
704236,星岩二十景 洞开华盖
910040,故谏议大夫鲜于公欲作新堂以传世谱名曰卓绝内相先生题其名曰蜀鲜于氏卓绝之堂某以此八字为韵作八诗盖鲜于公顷尝俾某赋之而三子以求其诗故原其古而美其今以颂美之 其二
914718,留题筠庵以茅盖层出如蓑衣然
963146,小雪前三日钟冠之约余侍老人行山舟发后洪入杜坞自郑盖庵过阆山趋翔凤山菁山遍览杨坟秀园遂至何山道场山乘兴薄吴兴访玉湖书院水晶境界而归自戊子至庚子阴晴相半胜处辄徘徊赋诗饮酒伟哉观也数诗见后 其二 宿资福小阁次梁间韵
154647,莲池·紫盖嫩贴水
1107052,盖仙山六题 仙洞
840469,泛舟虎阜因吊五人之墓自春徂夏盖三至矣 其三
971674,徐君季纯常德教授廨中名一室曰如舟取东坡为宛丘诗而云也过之欲为赋诗意到辄书故不免杂出君居龙游故有盈川之句诗臞云者盖初未识而为簿公曾元之所言也凡五首 其五
466159,十月二十八日太平间作，盖为同事家葬事主书记五首
1113177,韩廷玉筑亭于官舍之旁园中故多梅会有飞雪予因题其扁曰梅雪盖取少陵诗语而刘公贡父送刘长官掌广西机宜尝用此事有雪片梅花五岭春之句今廷玉适为此官于以名亭抑其宜也亭边花木多吾弟定叟旧植故予首章及之
213915,徐熙花·徐熙丹青盖江左
935704,舟中咏落景馀清晖轻桡弄溪渚之句盖孟浩然耶溪泛舟诗也因以其句为韵赋诗十首 其三
1079832,顷与知止相别于曹州西门外盖今十四年矣闻尝自澶渊过此感叹
88162,九日·戏马呼鹰盖世豪
100568,和陶饮酒·盖公偶谈道
466309,熊家饮归，周燕婷先生遗以酸菜，瓶大如斗。盖久前饮中偶语，既已忘失者。更饮于街头，桌间书此，以为谢焉
129930,十二月二十四日雪盖予三年于淮才见此耳时东
1196238,侍郎吟思愈清逸才无敌唱弥高而和弥寡我已竭而彼转盈欲罢不能盖彰其馀刃知难而退甘竖于降旗五章强振于芜音三鼓那成于勇气暂希解甲少遂息肩庶重整其懦兵愿别当其坚阵此时胜负期一决焉却以地僻尘埃少为首希垂采览 其一
493019,往时杨清溪为乡先达菊存陈公作种菊图工妙逼真去之六十馀年其五世孙继先乃得之于其仲父有实家盖其家故物也出以示余因题其后以致景仰之意 其二
949773,检校金盖别业
544318,野寺古槐奇绝亭亭如车盖四望皆同树身屹立丈许其颠折为五枝折处宽平可四人箕踞坐余挈胡茅两生散发豪饮其中日暮乃下 其二
561630,扈跸南巡自出京至在途蒙恩赉诸物各恭纪一绝以志荣感其酒馔牲品等物尤多盖不能悉纪也 其十一 赐磁器瓯碗十二件
356233,湖上新秋·十里荷风盖尽倾
1196253,齿疾未平灸疮正作新诗又至奇韵难当暗忍呻吟强思酬和别披小简盖念短才更竭病怀甘输降款 其二
786315,凄凉调 词纪近事，失于平质。盖时方头会箕敛，沿门挨户，无能免者；故不觉其言之直也
148301,会昌小岘亭有碑侍郎陆公作也今通守盖公之孙
1240395,夏盖山石鼓谣
915503,胡英彦得欧阳公二帖盖训其子仲纯叔弼之语其一公自书之其一东坡书之英彦刻石以遗朋友吾叔父春卿得一本有诗谢英彦和焉万里用其韵以简英彦
365509,舟泊波塞是夕大雨盖六月不雨矣
1050798,阮师旦希圣彻垣开轩而东湖仙亭射的诸山如在掌上予为之名曰新轩盖取景物变态新新无穷之义赋十绝句 其五
91142,石宝盖·圆顶环珠幡
918495,开禧元年四月自中都挈家还乡寓居城南十二月迁居柳溪上其夜大雪初一日盖宰来访约过县斋为一日款深夜而归赋此 其四
114133,云盖智和尚真赞
984580,正纪诞辰辄成三绝句为寿所谓寿者非世俗之寿也盖期君道学坚固将与造物者游无终始者为友而已 其三
732206,同弱翁登华盖山资福寺
405620,虞美人 其二 庚辰重阳前三日方君壁妹在南京书肆中得满城风雨近重阳图盖前岁旅居汉皋时悬之斋壁者为题二词其右
544317,野寺古槐奇绝亭亭如车盖四望皆同树身屹立丈许其颠折为五枝折处宽平可四人箕踞坐余挈胡茅两生散发豪饮其中日暮乃下 其一
72360,归朝欢·羽盖霓旌满空簇
418191,读倾盖集枨触劫中所感二首 其二
675582,戏答禽语二首 其二 楚蜀春间有鸟鸣曰甜也吃苦也吃盖反舌类也
161446,山行二绝·路回浓绿屡低盖
905426,至启伏蒙仆射相公以小子近司靶阁罕扣芜音忽徵庸陋之词盖示记怜之旨特贻篇什俯耀行藏捧玩无厌感戴交切谨依高韵奉和聊抒下情
919992,送邢刍父赴漕试盖予以牒逊之
458063,同前记除夜事。盖食于方妻许，实尚未足称店，但偏房断屋三数间而已。予与诸贫困小店，皆结为友，室苟稍稍生白，辄恹然不喜
905431,至启休沐之中静专一室病不复饮无以慰怀性且寡合若何为乐但窗閒弄笔信意乱书无所从意无所得自如而已岂曰诗乎不觉又成五章章之首句皆云朱门多好景盖纪田第园林之胜美明公游豫之适昔张处士献牛奇章诗尤鲙炙人口其警句有带盘红鼹鼠袍砑紫犀牛之盛然而清议者不以为累公之德何哉赋闲宴而歌富贵也小子是作焉敢望回然亦驽骀之希骥尔 其三
1111479,龙华大像盖冀国夫人所作因成二绝
1142603,予家世居富山久矣世有隐德老坡所谓我家韦布三百年惟有阴功不知数盖类是也因作此以记其实且以勉族氏子弟云 其三
958522,清明前风雨兼旬城外桃李无在者书室中有酴醾一瓶置之甚久盖风雨所不及也为赋五韵
268575,点绛唇·题缪筱珊垂虹感旧图，盖为蒋鹿潭作也
1172551,题平盖沼
594947,方伯费公卜葬先太夫人有日适自闽迁粤过里襄事盖孝感也赋诗志之
1137441,希年初度老友王希宣扁舟远访夙谊甚厚贶以十诗实用渊明采菊东篱下语五章云每岁思亲不持斝蓼莪几欲废诗雅盖深知予心者读之凄然辄尔和韵 其九
1084701,明庆忏院上方地爽而幽盖精蓝之胜也予因会友托迹于其间一日探囊中得石刻诗一本乃王瞻叔国博先生题台人秀野堂也摹写景物颇类于此因置之壁间意有感触遂借其韵
703891,寄题导舆洞为李若回别业盖取潘黄门板舆奉母之义乃兄中丞所命
116299,鸿轩下有蔷薇予初至时生意盖仅存耳予为灌溉
493017,往时杨清溪为乡先达菊存陈公作种菊图工妙逼真去之六十馀年其五世孙继先乃得之于其仲父有实家盖其家故物也出以示余因题其后以致景仰之意 其四十五 题墨梅
973782,六月十三日四更登舟县岸迟明抵秽步宿雨犹湿昨夕近郭风而不雨不知此间盖滂沱也
171257,得诗五·长沙一倾盖
668744,壬子元旦饮毛石屋家观郡邑迎春盖明日立春也次东坡韵
1087795,昨以诗徵亡碑于四十一丈既蒙酬和而诸兄亦继作焉联为巨编藏之巾笥虽所亡古刻不可复得而此之所获则已多矣顾其中犹有不能释然者因念吾子厚隶法妙古人当为我大书伟辞于壁庶以焜耀区区之望彼死鬼之陈迹其存亡盖不足为重轻也次韵见意云
378376,次韵王节推安道见过云盖
996255,盖郎中惠诗有二强攻一老不战而胜之嘲次韵解之
893219,和延州经略庞龙图八咏 其五 飞盖园
1003852,仲秋池塘荷盖方密有四五朵花
130850,沁园春·旗盖运迁
1057037,盖公堂歌
191956,刘进之饮蕃叟弟筠亭且赋诗余与蕃叟族居盖屏
1088127,次韵伯崇登滕王阁感旧盖闻往时延阁公拜疏于此云
561627,扈跸南巡自出京至在途蒙恩赉诸物各恭纪一绝以志荣感其酒馔牲品等物尤多盖不能悉纪也 其八 赐綵装松竹梅鸾带
142209,赠蔡道人·宝盖山前蔡道人
414340,风雨中二兄三兄偕大侄女自厦门飞来上海相视盖别十有二年矣二首选一
698075,和汪少参嘉会抚徭通峡韵先是嘉靖乙酉予在浔与杨兵宪文瑞议雕剿峡贼闻者悚慄惟杨与鄙意合力主之仅戮九人馀悉抚定群蛮震慑愿附籍输税告乞通峡军门乃敕予檄商舟通焉盖自韩公通峡至今六十馀年矣
1052527,云盖寺谈空亭
414687,题倾盖集二首 其一
291486,金缕曲·题秋棠图，为周无尽作。无尽又有棠隐女士小传，叙恨凄楚，盖伤心人也，为填此阕
1063464,郡人献笋守以分饷郡寮而吏独见遗守知之命追赐焉盖不出既久而人忘之也因成一篇
1108012,丫头岩诗载墙壁间无虑数十百首形容盖有尽之者矣辄复寄兴以俟采诗者择焉
832340,瑞龙吟 庄头村花田自五代迄今，盖亦地之韵者。余既来游，感叹今昔，托之于音
668242,鸡鸣山金陵胜处往岁盖屡游之未有作也偶阅九逵凭虚阁记追赋
864174,仆在会稽泛舟至剡中是时雪迟梅子烟外万枝夹岸幽香不断盖非人间世也友人廉宣仲在四明闻之作子猷访戴图见寄作长短句谢之仍书四绝句于图后 其四
735174,盖公堂
1074590,太师以被赐暹字韵诗前后凡三次进和盖欲示其韵愈严而愈工耳复以前韵又赐太师
515656,十二月七日监放官吏俸粮其册云学士程某等共支米二百石初盖不知当此首选也戏成一律奉寅长西涯先生同一捧腹云
1210357,开元真人见贻刘商观弈图石刻毫发布缕皆尽精妙盖李龙眠临唐画本茅君彦模勒为玉局仙翁所藏云
126423,欢笑·划平荆棘盖楼台
162526,好事近·飞盖满南园
826742,庆春宫·赋豹房铜牌。牌椭圆式，长三寸有奇，一面横刻豹字七百七十五号，下镌豹形。一面刻随驾养豹官军勇士悬带此牌。盖明正德时物
540144,岘山有朋寿堂盖为大司空蒋公刘公大司寇顾公筑也已已岁余与吴比部范太史嗣游焉吴与余俱丙戌范丁亥因题一绝以为四十年左證云
140525,游西湖·饭余飞盖北山来
245530,荷华·翠盖田田绿
897286,鸿轩下有蔷薇予初至时生意盖仅存耳予为灌溉壅护今年春遂大盛仲春著花数百萼大几如芍药丰盛妍丽顷所未见也余有黄州之行酌酒赏别
685790,南京给事中童志昂和李商隐无题诗韵南京诸公多和之意盖有寓间出命予属和予村学究也不能外题以为诗姑咏史以复之
457953,班中翻《三国演义》，伏见刘备兄盖世英雄，战无不败，宁屈不死，百逃不殆，及入赘东吴，始过上幸福生活；再逃东吴，又多得贤内之助；予仰之无已，因恭作二绝，以为颂歌焉 其一
1094797,器远寄近诗季章兄弟唱和蟆颐江梅术皆其所也因题二绝寄答盖曹李同榜 其二
900306,韩廷玉筑亭于官舍之旁园中故多梅会有飞雪予因题其扁曰梅雪盖取少陵诗语而刘公贡父送刘长官掌广西机宜尝用此事有雪片梅花五岭春之句今廷玉适为此官于以名亭抑其宜也亭边花木多吾弟定叟旧植故予首章及之 其一
164979,龙华大像盖冀国夫人所作因成二绝
150434,汪尚书挽章·文章事业盖群工
279094,绿盖舞风轻·观荷山贝子园，用弁阳老人韵
890490,君异郑兄出示旧诗盖绍定初所信笔也俛仰三十年矣戏成口占复归之
1247301,予壮年时幽居山谷尘俗罕接惟与泉石草木为侣日徜徉其间醒悦心目而已年老力衰世移事改向之醒心悦目者反足以损灵乱思矣盖所养于中者既异故应于外者自殊是以石失其贞而存其乱木失其美而存其恶泉失其清而存其污草失其劲而存其弱理固然也因成律诗四首以泄胸中之郁抑呈录同志庶知比兴之有在焉 其一
302733,劳山纪游·蟠松偃盖近天都
1070576,新作纸屏隆师为作山水笔墨略到而远意有馀戏题此句末句盖取所谓柴门鸟雀噪游子千里至也
350000,有感·玉伞轻擎盖有阴
187067,陈明卿觅瓦盖屋
765,祠紫盖山经玉泉山寺
867251,乙丑中秋与山僧数辈自虎邱灵岩泛太湖登洞庭东山曰翠峰望湖中群山高下出没如大圆镜见百千万亿青螺髻然瑰玮绝特盖入眼未之见恨风作不能过西山睹林屋洞天之胜然已得其彷佛矣 其四
518496,舟中读谢鸣治先生所作伊洛渊源续录序文其间有曰自是以来犹有窃吾道之名以用于昏浊之世借儒者之言以盖其佛老之真呜呼先生之言盖有所指我知之矣然先生既引而不发愚亦安敢明言聊布短章以诵其志
518496,舟中读谢鸣治先生所作伊洛渊源续录序文其间有曰自是以来犹有窃吾道之名以用于昏浊之世借儒者之言以盖其佛老之真呜呼先生之言盖有所指我知之矣然先生既引而不发愚亦安敢明言聊布短章以诵其志
51080,是日往观果刻本盖世贤招饮恐客不至故绐尔乃
200984,淮上·车盖飞云不放船
493014,往时杨清溪为乡先达菊存陈公作种菊图工妙逼真去之六十馀年其五世孙继先乃得之于其仲父有实家盖其家故物也出以示余因题其后以致景仰之意 其二
1165240,华盖山
963490,小雪前三日钟冠之约余侍老人行山舟发后洪入杜坞自郑盖庵过阆山趋翔凤山菁山遍览杨坟秀园遂至何山道场山乘兴薄吴兴访玉湖书院水晶境界而归自戊子至庚子阴晴相半胜处辄徘徊赋诗饮酒伟哉观也数诗见后 谨和老人凤口遇雨
492978,往时杨清溪为乡先达菊存陈公作种菊图工妙逼真去之六十馀年其五世孙继先乃得之于其仲父有实家盖其家故物也出以示余因题其后以致景仰之意 其六 奉青李一盛寄子渊杨判府
678178,祷雨盖苍山龙湫时以邑宰命往
187649,觅藉栽·红妆翠盖出污涂
21554,松坛·盘盘松上盖
973775,以坡公君如大江日千里我如此水千山底为韵作小诗十四首重送在伯盖深有感于斯句云 其十三
297155,感事·盖世枭雄一讣来
866229,赵司法诗集自题近道盖取工部所贻元隐居诗中语也因书二绝 其二
739073,夏盖湖
181843,余素·陋屋三间草盖成
821082,绮罗香 居竹楼时日以丹青自遣，醇士为余作扇头小景，题遗山句云：可怜旧隐抛何处，一片伤心画不成。盖唯易十年二字为可怜耳，检示惘然，漫拈此解
953411,三桥诗 飞盖
483991,予少年磊隗负气诵稼轩辛先生郁孤台旧赋菩萨蛮尝慨然流涕岁庚辰过铅山先生神道前有诗云云见南归纪行藁后会赣州黄教授请赋郁孤台诗复作近体八句亡其旧藁因念功名制于数定材杰例与时乖自昔不遇若先生者盖亦多矣然犹惜其未能知时审已恬于静退几以斜阳烟柳之词陷于种豆南山之祸今二十九年矣舟过是台细雨闭蓬静坐忽忆旧诗因录于此见百念灰冷衰老甚矣云
185228,二洞·缦缨乳盖张公洞
1003933,道传山丹一本两花举以见遗夜窗翻书偶见刘潜夫尝赋云偶然避雨过民舍一本山丹恰盛开种久树身樛似盖浇频花面大如杯怪疑朱草非时出惊问红云甚处来可惜书生无事力千金移入画栏栽因借韵同赋一首
963143,小雪前三日钟冠之约余侍老人行山舟发后洪入杜坞自郑盖庵过阆山趋翔凤山菁山遍览杨坟秀园遂至何山道场山乘兴薄吴兴访玉湖书院水晶境界而归自戊子至庚子阴晴相半胜处辄徘徊赋诗饮酒伟哉观也数诗见后 其一 宿妙胜阁
895175,题宝盖岩寺
956951,次韵子文探梅水西春已深犹未开水西谓歙溪而黄君谟州学记云濒江地卑盖此水为浙之源正可谓之江也
867249,乙丑中秋与山僧数辈自虎邱灵岩泛太湖登洞庭东山曰翠峰望湖中群山高下出没如大圆镜见百千万亿青螺髻然瑰玮绝特盖入眼未之见恨风作不能过西山睹林屋洞天之胜然已得其彷佛矣 其二
907786,游华盖山容成洞天
439866,汉青盖镜铭
953971,飞盖桥玩月
1091502,登多景楼分楼高天一握为韵得一字楼非旧址惟东面可眺三隅暗甚时方改作榜称米元章书盖伪也语寺僧当易之
1005888,庵中有红山茶一株自腊月开至二月半为蕊尚无数也盖十霜十雪矣
1036094,水龙吟 闾秋大夫孝终公显尝守黄州，作栖霞楼，为郡中绝胜。元丰五年，余谪居黄。正月十七日梦扁舟渡江，中流回望，楼中歌乐杂作。舟中人言：公显方会客也。觉而异之，乃作此曲。盖越调鼓笛慢。公显时已致仕。在苏州
562348,赤城吕徽之博闻强识宋亡遂晦不仕一日大雪中至巨家易谷立堂下久之堂东偏众客方咏雪有分韵得蝶字者艾思不就徽之不觉失笑咸诘之曰汝何笑曰吾欲用滕王蛱蝶事耳众客皆惊阴知其为徽之也延之坐不可欲赒以谷辞既去使人尾之至其居地极幽阻及雪霁候焉荆扉竹屋不蔽风雨见桶中坐一妇人盖其妻也问徽之所在曰出捕鱼矣得于溪上具言所以来之意曰诸子可少留乃换酒共饮返宿道傍大楼下主人怪舆马之盛因言其状主人亦不知有徽之也明日求之则已迁居矣徽之
422977,庐山杂诗十四首 其十二 屋脊岭为庐山最高处，余行其上，但见群峰杂遝，来伏足下。倚松寂坐，俛视峰色明灭无定，盖云过其上所致也
123932,七夕·乌鹊桥头羽盖移
770457,桂东原腊尽日自营口晓发盖州诗简栖瘿公均有和作因次韵寄东原兼呈简栖瘿公
918193,余年二十馀即有二毛盖乱离间关所致感而有作
1108050,薄暮游潘登仕园园有堂三间榜曰一枝盖湖公枢密两取庄周郤诜之语既以嘉潘亦以勉潘之二子因用其意各赋一绝
466351,王江华罹于水，予急书问之，来书告贷。予负债累千，无能为也，适发薪，尽与之。更乞诸卢子，亦慨然尽出薪金。肖子有室家之累，窘迫亦甚，笑曰：子二人可叫化矣，乞诸吾厨可乎。予乞食于肖，盖已十年。亦不谢二子，为和渊明《乞食》之诗以记其行言，更和《阻风规林》二章述其交游焉
1172773,天宝初南曹小司寇舅于我太夫人堂下累土为山一匮盈尺以代彼朽木承诸焚香瓷瓯瓯甚安矣旁植慈竹盖兹数峰嵚岑婵娟宛有尘外数致乃不知兴之所至而作是诗
169964,南园荔子熟名曰魏紫盖是陈家紫种以先公赐封
854182,僮有弹鹭寘池上者予解其缚纵之而不去盖不饮不食拳立而不徙者七八日作诗返之故巢
356145,长啸洞北回望大顶如列屏幛比到山前却不见盖为仙掌所蔽
828092,节师见予九日诗寄语曰岂忘庚戌重九耶何诗中未及之盖是秋节师入都吊张文襄公之丧予以九日邀同陈韬老集于十刹海广化寺凄然相对二老皆有诗刘松庵为图记之今忽忽八载矣感赋长句奉寄以志哀
1030688,夏日登车盖亭十绝 其四
493018,往时杨清溪为乡先达菊存陈公作种菊图工妙逼真去之六十馀年其五世孙继先乃得之于其仲父有实家盖其家故物也出以示余因题其后以致景仰之意 寄邹君浩二绝 其四十六
185216,溆浦柟木洞盖神龙所居今年夏大旱县官乞取其
837666,疏影·为吴湖帆、潘静淑夫妇题宋刻梅花喜神谱。是书盖百宋一廛故物，其后展转归吴县潘氏。湖帆为文勤公从女婿，辛酉正月潘夫人三十生日，其家以是书贻之，湖帆谋付影印，乞余题词
42282,满庭芳·雨盖飘荷
165773,泊思禅寺呈廖明略其地盖干越寺在琵琶洲上
305733,福州杂诗·偃盖孤松表故青
928295,小舟白竹篷盖保长所乘也偶借至近村戏作二首 其一
119820,次韵程帅·从昔文章盖代翁
935705,舟中咏落景馀清晖轻桡弄溪渚之句盖孟浩然耶溪泛舟诗也因以其句为韵赋诗十首 其九
148019,贺新郎·翠盖笼娇面
701135,庆都道中遇邵玉泉大守倾盖论诗握手甚欢欲止余宿而行李先发矣因书别连白石佳作示余且索和敬次荅之
1251899,庚戍正月仆有金陵之行而商翁将归高安同舟至湄湘留数日不能相违夜宿王氏甥西斋吹箫酌酒为别夫倾盖相逢犹有分携之感况平生故人耶书此以见眷恋之情耳
658026,闻县中祈雨连日未有得而密云北来定山已如注矣明日县侯谢雨昶无籍之人天地久不收管县官不当顾盻蒙此佳贶盖出望外遂用前韵聊以志喜
141649,满庭芳·翠盖千重
136230,嘲杜鹃·杜宇声声盖自嗟
918492,开禧元年四月自中都挈家还乡寓居城南十二月迁居柳溪上其夜大雪初一日盖宰来访约过县斋为一日款深夜而归赋此 其一
438807,兴定庚辰夏六月望予与元好问赵郡李献能同游玉华谷又将历崧前诸刹因憩于少姨庙元周行廊庑得古仙人词于壁间然其首章直屋漏雨为所漫剥殆不可辨乃磴木石而上拂拭汛涤迫视者久之始可完读观其体则柏梁事则终始二汉字画在钟王之间东井又元鼎所都幽州必贤宗子虞也夫眷眷不忘幽州者非吾田畴尚谁欤田复所事之雠却曹瞒之赏衰俗波荡中挺挺有烈丈夫风气其死而不忘盖无疑其能道此语亦无疑观者不应以文体古今之变而疑仙语也噫仙山灵岳宜有闳衍博大
772353,梅伯言、马湘帆、汤海秋、王少鹤四农部，何子贞编修，陈颂南、苏赓堂、朱伯韩三侍御，叠次召余同亨甫为觞宴之乐。九月二十六日，复集蒹葭阁；盖丙申年入都，伯言、湘帆置酒处也。诸君各以诗文见赠，余行有日，辄成七律数章酬别 其二
164502,挽蹇都官·倾盖荆州日
973772,以坡公君如大江日千里我如此水千山底为韵作小诗十四首重送在伯盖深有感于斯句云 其十
935735,访青神尉廨借景亭盖山谷先生旧游也
386256,海音诗·筠篮隐约盖微遮
1115361,题萧岳英常州草虫轴盖画师之女朱氏之笔二首
239212,芝草图·高义从来盖里闾
949594,绿盖舞风轻 白莲赋
306235,袁太常·盖狂汲戆故难平
386751,渡江云·古槐青似盖
510005,华盖仙踪为谢布政作时谢已物故
548702,送张洪阳宗伯请告还公有閒云馆盖旧业也 其五
853336,十二月二十四日雪盖予三年于淮才见此耳时东师援淝水捷书西来走笔呈赵公借官奴与幕友一醉
983995,过马肝峡石形与色皆如马肝迸出峭壁之上予观之盖石芝耳大窠一本小者四五不知风雨几百载而质不败赋石芝行
242352,大涤洞·玄盖天中万象垂
1247303,予壮年时幽居山谷尘俗罕接惟与泉石草木为侣日徜徉其间醒悦心目而已年老力衰世移事改向之醒心悦目者反足以损灵乱思矣盖所养于中者既异故应于外者自殊是以石失其贞而存其乱木失其美而存其恶泉失其清而存其污草失其劲而存其弱理固然也因成律诗四首以泄胸中之郁抑呈录同志庶知比兴之有在焉 其三
1091925,和袁丞盖岭长松三首 其三
224715,游洛阳宝盖寺赠长老道琼
423563,点绛唇·题缪筱珊垂虹感旧图，盖为蒋鹿潭作也
910043,故谏议大夫鲜于公欲作新堂以传世谱名曰卓绝内相先生题其名曰蜀鲜于氏卓绝之堂某以此八字为韵作八诗盖鲜于公顷尝俾某赋之而三子以求其诗故原其古而美其今以颂美之 其一
569085,咏诸功臣像二十六首 其二十五 故光禄大夫柱国少师太子太师吏部尚书华盖殿大学士赠太师张文忠公孚敬
1216583,有客有客在门崔嵬高盖华轩起欲与之语言已叱仆夫回辕 其二
1035068,送郑侍郎四川制置分韵得盖字
434722,漕副刘师韩自辽西按田讼回仆率僚友迎劳于郊是夕仆酒战败绩明日师韩传檄再三竟不复出盖渠豪千饮而仆素不能也戏以此诗解嘲
1168327,访道安陵遇盖还为余造真箓临别留赠
963832,小雪前三日钟冠之约余侍老人行山舟发后洪入杜坞自郑盖庵过阆山趋翔凤山菁山遍览杨坟秀园遂至何山道场山乘兴薄吴兴访玉湖书院水晶境界而归自戊子至庚子阴晴相半胜处辄徘徊赋诗饮酒伟哉观也数诗见后 杨坟
476494,春日周都阃招饮其宅盖亡友梁国吏第怆然兴感
274411,绿盖舞风轻·苏州公园看荷花，红白相间，弥望无隙
177917,八绝诗垂藤盖
14331,楸树·青幢紫盖立童童
492983,往时杨清溪为乡先达菊存陈公作种菊图工妙逼真去之六十馀年其五世孙继先乃得之于其仲父有实家盖其家故物也出以示余因题其后以致景仰之意 其十一 雷港夜泊
1058778,盖仙山六题 其一 仙洞
