459618,九月二十二梦见椒子幼株，欲掘种故家后窗下，作诗曰：异日小窗读周易，可从窗内一抬头。而觅锄不得，惶然遂醒。思梦里故家，乃十馀年前景，久已荡然，无复种树之隙矣；屋亦为姑母加建久居，并无可归之地矣。因足成篇，更补一首。梦中句云云，盖现居窗外有孤树，读书倦处，辄举目相对耳 其一
747902,十二月二五日立春太湖留别咏芝君久抱病盖误服温剂余小住三日不令服药眠食谈饮乃俱健胜
885019,盖竹与陈和仲昆季
1225183,射的山龙瑞宫问阳明洞天洞盖是禹穴
620714,赠紫盖寺衲子东旭
1111249,送盖总领上计三首
1080521,晋大宁四年王敦自武昌下屯于湖明年六月敦将举兵内向明帝微行至于湖阴察其营垒而去唐温庭筠作湖阴曲盖为此也后汉王霸之孙改封芜湖吴时此地称于湖或称芜湖察其营垒则姑熟之西初无湖阴又且于湖乃芜湖也张文潜有于湖曲广其意追和焉
961343,余垂老于居之西偏营小堂面对南山一峰卓然榜曰如山盖取诗人意也
918500,开禧元年四月自中都挈家还乡寓居城南十二月迁居柳溪上其夜大雪初一日盖宰来访约过县斋为一日款深夜而归赋此 其九
459175,往大云山车中见桃花与杜鹃并作，盖月馀冷雨，桃季遂迟
1137579,希年初度老友王希宣扁舟远访夙谊甚厚贶以十诗实用渊明采菊东篱下语五章云每岁思亲不持斝蓼莪几欲废诗雅盖深知予心者读之凄然辄尔和韵 其二
344354,金莲宝相·绿天欹盖护花房
313846,临江仙·桃花鱼，一名降落伞鱼，盖水母也。共旭初、充和咏之
687058,往时杨清溪为乡先达菊存陈公作种菊图工妙逼真去之六十馀年其五世孙继先乃得之于其仲父有实家盖其家故物也出以示余因题其后以致景仰之意
153824,飞盖堂即事·秋清未脱暑衣裳
313537,鼓浪屿宿陈秋园桐荫楼盖君昆仲奉母起居之所也
1122508,高盖名山院二首
196317,何叔京挽章·倾盖黄亭夜
62790,感事·鸾旌孔盖幸汾阴
569075,咏诸功臣像二十六首 其十五 故荣禄大夫少保吏部尚书华盖殿大学士赠特进太傅商文毅公辂
1125710,正纪诞辰辄成三绝句为寿所谓寿者非世俗之寿也盖期君道学坚固将与造物者游无终始者为友而已
458273,行乌镇旧街。盖其败废未修缮，游人不至者
898801,西江月 其六 蕲倅李君达才，当靖康、建炎之间，以诸生起兵河东，屡摧强敌，盖未知其事，重为感叹，赋此
1075915,七闽山中竹皆有实多至万斛民赖以食岁且不饥作乐府短歌以纪异事将以俟采诗者择焉盖诗人之职也
378572,次韵王安道节推过云盖
257375,冠盖里·道口亭前多贵游
167762,集贤里·冠盖游从日
458449,断桥侧见枯荷，记去年离此，与金师有观荷之约，今兹来践，盖已后期矣，因书呈金师
135878,大涤洞·巍巍元盖天
70648,太常引·二松如盖偃中庭
772356,梅伯言、马湘帆、汤海秋、王少鹤四农部，何子贞编修，陈颂南、苏赓堂、朱伯韩三侍御，叠次召余同亨甫为觞宴之乐。九月二十六日，复集蒹葭阁；盖丙申年入都，伯言、湘帆置酒处也。诸君各以诗文见赠，余行有日，辄成七律数章酬别 其五
172319,次韵盖簿初春郊行
1052224,云盖老僧八十二
48549,寄庄孔旸·背郭诛茅草盖堂
246210,盖斯墓·先贤遗迹是耶非
568957,黄宪子先辈弱冠受知吾家敬美今年秋闰过吴门扁舟访我弇上出所撰临华新草及北征稿读之盖洋洋矣赋虽吐一斑足窥全豹灵光洞箫将来当不过此至于近体出入初中时挟梁栋之气不耐点检恐指南之车切玉之剑未便可已也仆既钦其才美其志因成一章以效微箴宪子当不逆耳哉
1070266,春日与汪彦章藻赵叔问相约游樟林阁樟林阁盖郡豪冢舍背城郊墟无与比者因咏靖节感彼柏下人安得不为欢之句偶书五言呈同游二公
110438,华盖山·廛隐筑东山
1090372,和吴守修盖禁兵营屋之韵
459412,中秋夜与肖饮月下。无席而坐地，以酒瓶盖代盏，以月代日，捉二萤囊纸以替灯。乐甚，醉作此。诗成忽忆先时出院者，想车已到家，此生之途亦已到站矣。人苦如是，予乐如是，天心之不公平也。及予乐时，竟未一念及其人，人心之不相通也。苦乐相形，予惘惘若有愧疚。然空言何用，“一如饱汉讥饿枵”而已，如斯而已
312628,长亭怨慢·洞庭先生以所存先师钝安先生诗札手迹数纸见示，盖劫余之遗也。属为题词，怆然赋此
233691,次韵盖宰·大化我虫臂
1001439,豫章上游江中有道观盖尸坚吾游仙之地 濯风
142542,和赵积中白莲·翠盖亭亭水满塘
852122,弭盖亭
570061,偃盖松
495167,忆余在翁岛与张鲵渊、吴峦徲、朱闻玄诸先辈从游，一时情文宛然在目。今三君皆以国难殉，而余在行间，犹偷视息。然蹙蹙靡骋，盖不胜兴废存亡之感矣
458497,同前立刘家小学作。校盖予十年前发蒙所也
772359,梅伯言、马湘帆、汤海秋、王少鹤四农部，何子贞编修，陈颂南、苏赓堂、朱伯韩三侍御，叠次召余同亨甫为觞宴之乐。九月二十六日，复集蒹葭阁；盖丙申年入都，伯言、湘帆置酒处也。诸君各以诗文见赠，余行有日，辄成七律数章酬别 其八
1232629,赋盖
325776,蝶恋花·飞盖西园春已半
799075,阮郎归 十月十日海风大作，沈船拔木，农产摧折盖殆尽。急归山察视，吾庐尚存，填此志幸
888858,梅亭盖旧太守徐公禋所作传者谓公得庾岭梅移种于此故创斯亭余来相距未六十年曩日之梅已无复有感时追往因取野梅环植之仍赋二绝 其一
565539,高士颂九十一首 其四十五 盖公
812879,乾隆癸丑中秋，陈榕溪夫子自三河遣人走京师，招湘读书官舍，且命即日束装，趁节赏月，盖下车之第七日也。距今夕乃五年矣。夫子俸满不迁，湘复留滞都门，偃蹇如故。极思来会此节，一话万端，以病新起不果。对月孤吟，惆怅无极，时嘉庆三年戊午八月十五夜
605162,读旌柏堂录为陆贞姑七十寿赋贞姑今宪副廉石陆公之姑也姑年十六归同邑参知冯公皋谟之子曰春旸甫期春旸逝姑举遗腹子五岁亦夭姑投缳触棺誓殉地下左右力护视始免参知公伤其志欲为择嗣无可择者乃以幼女为姑之女是贞姑以小姑为女亦为子也盖义起矣参知公曰小姑长唯妇择婿婿之于是宪副公为贞姑之婿宪副公郎水部日辄疏贞姑之节以闻得报表闾称贞姑云岁甲戌姑年七十矣八月既望为设帨之辰宪副公适以入贺过里乃索拙句为寿不得辞敢以三章侑勺者
148880,豫章上游江中有道观盖尸坚吾游仙之地
493023,往时杨清溪为乡先达菊存陈公作种菊图工妙逼真去之六十馀年其五世孙继先乃得之于其仲父有实家盖其家故物也出以示余因题其后以致景仰之意 其三
177655,白莲花·素质盈盈绿盖张
387096,买陂塘·障秋晖亭亭青盖
1143686,予家世居富山久矣世有隐德老坡所谓我家韦布三百年惟有阴功不知数盖类是也因作此以记其实且以勉族氏子弟云
986264,送坚大师往云盖兼简隆老
905433,至启休沐之中静专一室病不复饮无以慰怀性且寡合若何为乐但窗閒弄笔信意乱书无所从意无所得自如而已岂曰诗乎不觉又成五章章之首句皆云朱门多好景盖纪田第园林之胜美明公游豫之适昔张处士献牛奇章诗尤鲙炙人口其警句有带盘红鼹鼠袍砑紫犀牛之盛然而清议者不以为累公之德何哉赋闲宴而歌富贵也小子是作焉敢望回然亦驽骀之希骥尔 其一
971039,以坡公君如大江日千里我如此水千山底为韵作小诗十四首重送在伯盖深有感于斯句云 其六
584993,予游象山台既有班班花鸟之句朗司厅适见之以为诮己也因再咏以释其意盖岂绝望于象之无人耶
120662,使君东游·红旗围皂盖
521961,王参政叔武自太原入朝首索西江赠行之作盖丁夘岁赵叔鸣郎中倡首逋欠几十年矣小轩夜半相对惘然为书此卷末亦因以复叔鸣也
42937,郯城倾盖亭下作
51176,偶见元李希籧提举遗墨乞归宾之盖希籧其先世
172308,次韵盖簿宾春
191494,有怀南坡盖雪阻旬日不到
1005776,正仲思归作篆畦今夜月十诗非篆畦月乃雁苍月盖杜子美鄜州月之意也予作十章乃篆畦月也 其十
506144,华盖山
349224,临要阁·繁枝盖地欲成幄
1111818,括苍胡经仲以经术授吾乡子弟仆顷过钱塘得吾兄永言多益及友人孟世功书未尝不以得交经仲为言且以其往还诗什相示已决知经仲非尘埃中人矣春初归自钱塘遂获识经仲于斋馆信数公之知人交道之不朽一年之间凡三相会从容谈笑者盖十许日而诗筒之循环来往曾未尝辍而仆之心犹以不得朝夕见经仲为恨也一日经仲来访席未定乃谓仆曰吾将归乡明年不复来此矣仆念经仲之贤交游中所未有顾世方扰攘会合无期临风语离殆不胜依黯因诵老杜人生足别离之句作五绝
520407,近郭有玄都观盖禹锡看花处也种桃道士既不可见而兔葵燕麦今尚复然予山行之趣悉见于诗兹将入城而犹有玄都之兴散人好奇亦自可笑诗亦不可不留也
287138,泛舟虎阜因吊五人之墓自春徂夏盖三至矣
230388,赵司法诗集自题近道盖取工部所贻元隐大诗中
204449,庭松·乔枝偃盖势凌云
103908,偃盖亭·既将茅覆檐
1091924,和袁丞盖岭长松三首 其二
918271,里人俞退翁自号南山南菊逸尝赋诗以道其志继有和者一日示两钜编则有故文丞相长句冠于其首盖君谒丞相于燕京时所赠也谨次韵以归之
538934,大宗伯董丈用均用前押韵三章见贻惜别陈怀徵之梦寐至云遥想六桥冠盖集知无一日酒杯閒又云水国共怜门似水山神应望屐登山其托羡湖山寄好风雅真无匹矣复以三章追挽先君子奏之松柏之间霜飙骤零真足肠断不揣辄复和谢依来数其乱篇专志哀感知鉴泣乌之私不以续貂为诮也 其二
189117,忆江南·倾盖侣
216909,丫头岩诗载墙壁间无虑数十百首形容盖有尽
931397,后陵永庆院在大西门外不及一里盖王建墓也有二石幢犹当时物又有太后墓琢石为人马甚伟
935703,舟中咏落景馀清晖轻桡弄溪渚之句盖孟浩然耶溪泛舟诗也因以其句为韵赋诗十首 其五
1216582,有客有客在门崔嵬高盖华轩起欲与之语言已叱仆夫回辕 其一
570957,刘半舫光禄与余倾盖莫逆长安入计竟不得一面怅然有作
1208448,乞巧辞二章（京师里俗以七月七日昏时设祠乞巧于天星织女盖闺人处子惑于荒谬怪诞之说不事箴组觊倖渺茫虚无之效卒无所得予闵其愚遂设为妇祷神答之意缀成此章假辞托兴以譬夫世之学者昧下学上达之理忽略遗弃于日用寻常之事而谓圣人之迶高远玄妙非力行之所可企及当求之于恍惚有无之域是以终于无闻漫不知省因以为戒且自警云尔） 其一
562221,洪武六年五月初一日早朝奉天殿西域国师来朝盖前代所未有也目击盛事因赋
137843,右飞盖·鸣驺入远树
1143727,郡人有朱买臣严子陵按史传买臣吴人尝出为会稽太守名曰乡郡会稽盖今两浙之地吾郡特以去州二十里曰朱池为买臣昔居之地难以考见其实子陵晚耕于富春山中则今钓台是也二公出处不同心事亦异姑以其同为郡人各赋一首使九原有作不怅来者之不我知也
1137583,希年初度老友王希宣扁舟远访夙谊甚厚贶以十诗实用渊明采菊东篱下语五章云每岁思亲不持斝蓼莪几欲废诗雅盖深知予心者读之凄然辄尔和韵 其八
20623,华盖山·一岫坡陀凝绿草
1070929,海外气候每岁三四月间已如剧暑客有自吉阳至者寓馆问汉亭累日且言吉阳气候昼夜如炊因叹此邦之胜乃知人生无有足时不经热恼岂知平日之清凉乎故古之达者每以此对治释氏云推落大火坑火坑变成池皮鞋和尚以为即时清凉也苏公亦云岭南瘴毒地有此江月寒乃知天壤间何人不清安予谪居岭海踰十五年见闻习熟不以为异因作此诗以自慰且以警世之贱丈夫一不快即愁叹怨愤或讥谤怒骂如柳刘之徒盖未足以语此也
84569,感旧四首末章盖思有以自广
273695,转应曲·戏题屋后废沼，其旁叠石有佳者，盖拙政园故物也
301805,明铁盖山口玄奘东归入境处立碑
137576,飞盖桥翫月·天形积轻清
674941,汉世有道士将贝多子种于嵩山一岁三花色白而香盖仙种也
493012,往时杨清溪为乡先达菊存陈公作种菊图工妙逼真去之六十馀年其五世孙继先乃得之于其仲父有实家盖其家故物也出以示余因题其后以致景仰之意 其三
276220,自麻盖中过雪山至西俄洛
1065752,予寓洛阳宝坛有僧悟超类有道者与语论事能援古證今盖未祝发时读孔氏之史书涉猎大义为浮屠犹不废今老矣不复读也形骸枯槁真能遗世故而玩死生者送予至龙门陪予游东西两山作此诗别之
963142,小雪前三日钟冠之约余侍老人行山舟发后洪入杜坞自郑盖庵过阆山趋翔凤山菁山遍览杨坟秀园遂至何山道场山乘兴薄吴兴访玉湖书院水晶境界而归自戊子至庚子阴晴相半胜处辄徘徊赋诗饮酒伟哉观也数诗见后 阆山妙严院松月堂读张汪二公诗有感用无垢韵
101142,横湖·贪看翠盖拥红妆
872675,薄暮游潘登仕园园有堂三间榜曰一枝盖湖公枢密两取庄周郤诜之语既以嘉潘亦以勉潘之二子因用其意各赋一绝 其二
305640,秋日·独爱禅关偃盖松
190366,高祖试剑石·拔山盖世何为者
216112,送熊伯通·岁暮欣逢盖共倾
309304,瑞龙吟·放舟秦淮，自桃叶渡至复成桥，月明风细，雨桁珠帘，盖不胜古情至枨触也
536835,案头苏诗一编偶展读之有云龙钟三十九劳生已强半岁暮日斜时还为昔人叹公倅馀杭日作盖取白乐天语兴感也此公尚为摇落语吾辈宁无穷途之恸因成一章兼示舍弟虽然公兄弟名位穹显晚节各天而吾以早废弃故相守田亩间差为优耳他固不敢较也
402836,瑞龙吟 放舟秦淮，自桃叶渡至复成桥，月明风细，雨桁珠帘，盖不胜古情至枨触也
458580,人笑皮鞋破歌。盖底脱如张饿口
119659,次韵刘宰·倾盖回舟一再逢
656278,坐沼上有怀京师冠盖
183044,县圃有小城环之北面有邱阜耸出乔木蔽其上盖
971038,以坡公君如大江日千里我如此水千山底为韵作小诗十四首重送在伯盖深有感于斯句云 其四
1242685,高房山画庐山图，贡云林待制有诗在上，为其子户部尚书贡师泰赋，盖其家物也
371507,寄赵农丞·祝融紫盖潇湘水
585789,辛亥腊月十八日初得上唐精舍之地于张氏以上塘作上唐盖有三唐焉帝尧为上唐李唐为中唐若五代之唐斯为下矣偶得三绝以纪其胜云 其二
225755,读隋书·子盖怀英断
318645,社日北郊展亡姊绣青墓，丧乱以来，人事牵率，盖两岁不至矣
1132936,范文正公黄素小楷昌黎伯夷颂盖在青社时所书以遗京西转运使舜元苏公者也后二百年大兴李侯戡得此本于燕及南来守吴乃文正乡里即访公子孙以畀之范氏喜而求诗为赋此二首 其二
131460,次韵八侄·素妆青盖送春归
432434,虞美人 庚辰重阳前三日方君壁妹在南京书肆中得满城风雨近重阳图盖前岁旅居汉皋时悬之斋壁者为题二词其右
772357,梅伯言、马湘帆、汤海秋、王少鹤四农部，何子贞编修，陈颂南、苏赓堂、朱伯韩三侍御，叠次召余同亨甫为觞宴之乐。九月二十六日，复集蒹葭阁；盖丙申年入都，伯言、湘帆置酒处也。诸君各以诗文见赠，余行有日，辄成七律数章酬别 其六
108382,武林感旧又·吴侬青盖已云何
837293,惜余春慢·慈仁寺双松。相传有清中叶重植，非渔洋诸老所题旧物。寺燬于庚子兵燹，松独无恙。社集分咏京师花木，召南拈得，以平生未睹为憾。偶偕访之，一已枯萎，盖昨岁栖止流民，爨湢所侵也，慨然同赋
86289,又三首·冠盖憧憧有许忙
1130880,送昌甫盖前晚独立涧上看桃花初开意思正适时见昌甫来也
614770,寄题导舆洞为李若回别业盖取潘黄门板舆奉母之义乃兄中丞所命 其二
6323,玉门关盖将军歌
468366,庚戌秋七月中山刘坦之先生补注选诗辞简而事明论切而指达正五臣之荒谬黜苍山之浅鄙撷花采实成一家言盖可以行今而传后者也诗以美之
246118,金缕曲·理旧稿忆孟兆祥盖不见有十二年矣
1246838,东南山水瑰奇甲天下莫若天台匡庐三茅武彝予尝游焉其以温泉名者如三山之天汤句曲之汤水又尝游焉私怪句曲人颇以牲杀污辱之三山置士卒锔鐍虽不同句曲污辱为王公贵人禁不得一澡浴者黄山予乡闬之名山也距郡城百有馀里未尝一即焉以游癸夘九月某日狂风怒号滕六大作予游焉浴于池甑蒸汤沸其气如饙馏然内池限以石甃外池濒于溪流当水涨龙必潜泳易致湮塞盖地产丹砂故也与句曲三山特异虽知群仙饷以琼琳玉树珍禽缟鹤但恨诸峰巘崿千态万状不能悉睹
888857,梅亭盖旧太守徐公禋所作传者谓公得庾岭梅移种于此故创斯亭余来相距未六十年曩日之梅已无复有感时追往因取野梅环植之仍赋二绝 其二
1142406,郡人有朱买臣严子陵按史传买臣吴人尝出为会稽太守名曰乡郡会稽盖今两浙之地吾郡特以去州二十里曰朱池为买臣昔居之地难以考见其实子陵晚耕于富春山中则今钓台是也二公出处不同心事亦异姑以其同为郡人各赋一首使九原有作不怅来者之不我知也 其一
415977,观盖叫天
960923,陈明卿觅瓦盖屋
966196,古今豪逸自放之士鲜不嗜酒以其类也虽以此致失者不少而清坐不饮醒眼看醉人亦未必尽得盖可考矣予好饮而尝患不给二顷种秫之念往来于怀世网婴之未有其会因作五言酒诗一百韵以寄吾意虽寄古人陈迹并及酒德之大概以为开辟醉乡之羽檄参差反复不能论次也同年兄唐仲章闻而悦之因录以寄庶几兹乡他日不乏宝邻尔
327183,过盖竹作·浩荡鸥盟久未寒
1216217,走也衔命而来舣舟永嘉之楚门盖居人戴氏里也一日邀致于所居之村曰竹冈杯酒留连伯仲联侍居周匝佳山水环绕于其间间尝游目登眺一时清远之思崭然眉睫昔谢太傅好游东山未为无谓也顾余何人拟迹宰相不能不愧耳幸以诗人常谈见恕是所望也
191311,王簿不惮暑途亲扣石金祈雨盖有志乎民者也以
77824,後陵永庆院在大西门外不及一里盖王建墓也有
826184,五彩结同心·昆山真义镇之东亭子为顾阿瑛玉山佳处故址之一。今岁池荷盛开，重台骈萼，并蒂至五六花。余偕姚虞琴、江小鹣、郎静山临赏。以其叶小藕窳而不结莲房，又花瓣襞积，卷如蕉心，正与吴中华山刘宋造像中所刊千叶莲同。因断为即天竺传来之千叶莲，盖花中如海棠、海石榴、山茶，凡舶来种恒现多层，此殆同例也。元末明初迄今已六百年，沦落荒村中，今始幸邀吾徒之一顾。感赋此阕，以属阿瑛，兼示同人
577875,华盖观瀑
459535,肖大醉卧予处，李亦在。醉间问卢安往。李曰已眠，子亦可眠矣。肖云骗人，我知道正在写诗。盖予每醉不卧，必作诗遣兴，时实未作，而笑曰然。彼问何句。为诵“酒人果如何，酒人陶渊明”十字。肖醉语皆大妙解颐，最能双关迁想，惜醒不能记耳。越二日往问病，即以十字发端
169858,荷花·亭亭张翠盖
361838,太师以被赐暹字韵诗前后凡三次进和盖欲示其韵愈严而愈工耳复以前韵又赐太师
569009,赠别邢氏邢子愿按吴吴人德之而迁楚藩少参以去不佞尤有慨焉因成二章盖比兴之义胜云尔 其一
346360,又雪仙·华盖车前龙步滑
1223906,同开先南楚悦禅师观息斋画竹卷于崇仁普安寺煜公之禅室盖煜之师一初本公所藏也因记延祐甲寅息斋奉诏写嘉熙殿壁南楚与之同寓庆寿寺时予同为太常博士俯仰之间已为陈迹乃题其后云
493010,往时杨清溪为乡先达菊存陈公作种菊图工妙逼真去之六十馀年其五世孙继先乃得之于其仲父有实家盖其家故物也出以示余因题其后以致景仰之意 春日绝句三首寄李子翀 其三十八
1058782,盖仙山六题 其五 双笋石
1094796,器远寄近诗季章兄弟唱和蟆颐江梅术皆其所也因题二绝寄答盖曹李同榜 其一
108552,次韵盖郎中率郭郎中休官
492981,往时杨清溪为乡先达菊存陈公作种菊图工妙逼真去之六十馀年其五世孙继先乃得之于其仲父有实家盖其家故物也出以示余因题其后以致景仰之意 其三
1070723,东坡载酒堂二诗盖用渊明始春怀古田舍韵遂不见于后集予至儋始得真本因追和其韵 其二
492993,往时杨清溪为乡先达菊存陈公作种菊图工妙逼真去之六十馀年其五世孙继先乃得之于其仲父有实家盖其家故物也出以示余因题其后以致景仰之意 其二十一 题杜草堂戴笠小像
958217,山斋疏陋每焚香旁舍闻之而斋中不甚觉盖香随风以流也为四十言
939451,三城侍郎寄示留题延庆寺二韵诗二章顷岁予肄业于此遗景尽在幸会之迹首唱之序详矣谨依命攀和但于首章增为四韵盖浅陋之才不觉辞费因遣稚子赞善大夫通判邠州事学古写于此牌以永嘉赐 其二
44647,读史·东海人奴盖世雄
492995,往时杨清溪为乡先达菊存陈公作种菊图工妙逼真去之六十馀年其五世孙继先乃得之于其仲父有实家盖其家故物也出以示余因题其后以致景仰之意 其二十三 题王叔明竹石图叔明赵文敏公之甥
785778,舟泊波塞是夕大雨盖六月不雨矣
1028825,朱天永示仆二诗盖有激而云者因用其韵以广之 其一
273872,巫山一段云·华盖连休鬓
1091159,孙元可赋张公石室诗句语险怪辞峰秀拔读之如神游洞府而陵果为之奔属也非身行此洞不知此诗之工盖其质似卢仝而文丽多之如又加鞭当千里一瞬其视刘叉马异得名浪矣诗文与我过当诚无足以当之牵韵勉酬真添薪煮箦之举
493022,往时杨清溪为乡先达菊存陈公作种菊图工妙逼真去之六十馀年其五世孙继先乃得之于其仲父有实家盖其家故物也出以示余因题其后以致景仰之意 其二
52488,皇帝行幸南京歌·翩翩翠盖覆鸣銮
548701,送张洪阳宗伯请告还公有閒云馆盖旧业也 其四
404873,玉楼春·壬辰七月二十三日携俊儿自台北飞花莲，道经台南台东，盖越卑南山脉而行也
928227,九月十四日夜鸡初鸣梦一故人相语曰我为莲华博士盖镜湖新置官也我且去矣君能暂为之乎月得酒千壶亦不恶也既觉惘然作绝句记之
935699,舟中咏落景馀清晖轻桡弄溪渚之句盖孟浩然耶溪泛舟诗也因以其句为韵赋诗十首 其十
327255,华盖石·醉扶藜杖少盘桓
181720,山斋疏陋每焚香旁舍闻之而斋中不甚觉盖香随
1066529,余谪沙阳地僻家远遇寒食如不知盖闽人亦不甚重其节也感而赋诗五首以杜子美无家对寒食五字为韵 其三
375147,松溪·翠盖童童胜碧油
996038,次韵伯氏寄赠盖郎中喜学老杜诗
111978,画梅·铢衣翠盖映朱颜
167304,范文正公黄素小楷昌黎伯夷颂盖在青社时所书
154568,弭盖亭·弭盖长亭下
154568,弭盖亭·弭盖长亭下
1077480,阻风泊慈湖夹焚香默祷有长鱼跃波而江豚出没舟人大惊抵暮风便因命解舟乘月泛禁江一夕至金陵盖数百里作二绝以纪其事 其二
950650,病中午后登山閒步遥见园亭有翠帟张栏处久而识之为张孝显成趣轩盖与缇屏油幕高会予病不得冲宴怅惘移时因以中孚泽所网鲜鳊侑以棠漪家酝并成四绝呈在席诸人 其三
307080,自均州以西滩岭丛杂一千九百馀里每夜泊舟听雨闻猿盖经两月日行万壑间也
869041,昆山吕正之三男子连中神童科盖奇事也次严别驾韵
434720,予以朝命催租河朔道出隆虑邂逅杨东卿盖栖霞隐人也尝许予小山以地远卒不能致约以后期故作是诗以为定券
464396,西江月 赠大内侄何正阳，自昆明归省，酒边话旧，喟喜交集。盖一别三十四年矣
684033,赠别邢氏邢子愿按吴吴人德之而迁楚藩少参以去不佞尤有慨焉因成二章盖比兴之义胜云尔
1076433,仆所居盖濂溪先生之故基也有井清甘而寒先生尝以比谷帘今为路人所汲余尝为作亭号濂溪泉而为之铭今未暇也
188546,五盖山·五峰如盖色苍苍
188546,五盖山·五峰如盖色苍苍
1228186,箫台八景 其二 盖竹洞天
562585,南京给事中童志昂和李商隐无题诗韵南京诸公多和之意盖有寓间出命予属和予村学究也不能外题以为诗姑咏史以复之 其二
301991,少屏以其夫人周湘云女士行述见示盖去其悼亡之时亹亹又期月矣为题一律以止其戚
582827,和千家诗六十首 其五十三 登车盖亭
150443,同官游赤松·山舆翠盖出华颠
562586,南京给事中童志昂和李商隐无题诗韵南京诸公多和之意盖有寓间出命予属和予村学究也不能外题以为诗姑咏史以复之 其三
843053,严几道临帖卷子没盖七年矣感题
1160997,吴 青盖
548700,送张洪阳宗伯请告还公有閒云馆盖旧业也 其三
538364,同诸君饯子成怅然有感盖予以前岁是月使归
