1053452,过彭城观陈传道知录所藏东坡公画
325458,少城观沁河涨
438311,西城观水
983686,出东城观水
259545,西城观水·西山秋水来天地
592828,繁城观魏受禅尊号二碑
849416,层城观
1159632,太和戊申岁大有年诏赐百僚出城观秋稼谨书盛事以俟采诗者
711023,过丰城观秋色
1897,洛城观酺应制
11693,登夏州城观送行人赋得六州胡儿歌
323320,昨日饭金城观今日饭石田驿
12289,御制雨后出城观览敕朝臣已下属和
377959,过彭城观陈传道知录所藏东坡公画
921093,与王郎昆仲及儿子迈，绕城观荷花，登岘山亭，晚入飞英寺，分韵得「月明星稀」四字 其三
186426,登江陵郡城观雪
186709,中秋与僚佐登江陵郡城观月
1155805,与诸公同出城观稼
164862,层城观·秋星如弹月如梳
1089129,丰城观音院有胡明仲范伯达汪彦章诸公题字
99990,与王郎昆仲及儿子迈遶城观荷花登岘山亭
1170569,登夏州城观送行人赋得六州胡儿歌
1116768,与王郎昆仲及儿子迈，绕城观荷花，登岘山亭，晚入飞英寺，分韵得「月明星稀」四字
1234625,由清江赤城观至宝塔寺暮归樟镇
952524,同钱则父登郡城观予所和梅仲潜金山吊东鲁林表民逢吉诗淮民同赋一绝
1184323,登兴元城观烽火
1208308,章义门送人还南城观台
921091,与王郎昆仲及儿子迈，绕城观荷花，登岘山亭，晚入飞英寺，分韵得「月明星稀」四字 其一
941062,中秋桐城观举子
217842,层城观·人世佳期惟七夕
30679,登兴元城观烽火
51515,清明日游新城观音祠
1176844,洛城观酺应制
99290,与王郎昆仲及儿子迈绕城观荷花登岘山亭晚入
777275,赤嵌城观海
183817,同钱则父登郡城观予所和梅仲潜金山吊东鲁林
568277,武城观涨因忆陈后山五月一雨凉中宵大江南之句情景悠然援毫有述
917065,层城观
936050,夜读唐诸人诗多赋烽火者因记在山南时登城观塞上传烽追赋一首
169697,中秋桐城观举子
571830,出城观柰子花遇大风至韦公寺而还同游为顾升伯李酉卿家伯修
126437,和张子望洛城观花
1004247,遂宁喻生画鹿甚精介同官梁知丞谒余因令作八幅图帐适赤城观主惠一鹿甚驯未数日忽又一鹿奔至县圃非邑士所豢养者竟不详其所自来物理感召画龙而致真龙似未足为诞也借邑士张权父诗韵以赠之
453126,京剧《下鲁城》观后
921094,与王郎昆仲及儿子迈，绕城观荷花，登岘山亭，晚入飞英寺，分韵得「月明星稀」四字 其四
326977,题赤城观·落日空山秋气清
1154908,御制雨后出城观览敕朝臣已下属和
19086,与诸公同出城观稼
1088665,题赤城观
921092,与王郎昆仲及儿子迈，绕城观荷花，登岘山亭，晚入飞英寺，分韵得「月明星稀」四字 其二
1156759,太和戊申岁大有年诏赐百寮出城观稼谨书盛事以俟采诗
900633,登江陵郡城观雪
18877,太和戊申岁大有年诏赐百寮出城观稼谨书盛事以俟采诗
900371,中秋与僚佐登江陵郡城观月
503531,梅花城观兵
99954,与王郎昆仲及儿子迈遶城观荷花
351839,丰城观音院有胡明仲范伯达汪彦章诸公题字
248446,京剧《下鲁城》观后
1085537,昨日饭金城观今日饭石田驿
927581,和张子望洛城观花
179799,出东城观水
83021,夜读唐诸人诗多赋烽火者因记在山南时登城观
765147,少城观沁河涨
472771,清明日游新城观音祠
