480393,西山诗次李宾之韵（壬辰年十二月）
457959,二零零一年十二月三十一夜 其三
1194310,贞元八年十二月谒先主庙绝句三首
824422,沁园春 一九六三年十二月，赋呈毛主席
460169,忆少年　十二月二十一日作
1249491,至正十年十二月十九日义兴吴国良持倪云林诗来玉山中相与徜徉数日将旋索为别余与玉山同简云林
420251,东风齐著力 二十六年十二月十三日南京失手。时在庐山讲舍，闻讯悲苦，且闻委员长痛哭别陵事，益涌澜翻之泪也
457957,二零零一年十二月三十一夜 其一
661785,成化十四年十二月十六日吴兴张渊子静松陵史鉴明古长洲李甡应祯吴宽原博颖川陈瑄廷璧入云泉庵观大石联句
264946,东风齐著力·二十六年十二月十三日南京失手
1165750,贞元八年十二月谒先主庙绝句三首 其三
1165748,贞元八年十二月谒先主庙绝句三首 其一
99635,元祐五年十二月十二日同景文义伯圣途次元伯
249525,一九九二年十二月四日中山市博物馆举办欧初业馀书画习作展览赋此贺赠
20153,贞元八年十二月谒先主庙绝句三首
1051689,元祐元年十二月庚子雪夏首莼湖结冰鹡鸰群集于上者至不可数感而作是诗也
743564,家秋塍大令复以嘉庆元年九月与黄小松易武虚谷亿为嵩少伊阙之游寻碑选胜作图纪事其年十二月往求孙渊如星衍篆题其首明年五月以书抵余华亭官所求诗
466295,二零零一年十二月三十一夜
866709,策师南游过三峡见予求施以诗会余忧悲苦恼无意赋咏姑借梅为喻送行则无一字不著题此本分事不妨大亲切也策将安取绍兴十四年十二月一日
899130,朝中措 其二 前年十二月十八日入对，遂除吏侍。今在婺州，腊月十八日也
883795,涪州江心有巨石隐于深渊石傍刻二鱼古记云鱼出岁必大丰端拱元年十二月十有四日昂自瞿塘回遵途于此知郡琅琊王公□云石鱼再出来岁复稔昂往而观之果如所说因歌圣德辄成一章
465869,一九九二年十二月四日中山市博物馆举办欧初业馀书画习作展览赋此贺赠
333055,光绪三十三年十二月乞病纪恩
1036150,如梦令 元丰七年十二月十八日浴泗州雍熙塔下，戏作如梦令两阙。此曲本唐庄宗制，名忆仙姿，嫌其名不雅，故改为如梦令。庄宗作此词，卒章云：「如梦。如梦。和泪出门相送。」因取以为名云
428057,清平乐 一九六五年十二月八日曹荻秋副市长当选为上海市市长，赋此致贺
1053685,元丰四年十二月大雪郡侯送酒
830780,光绪三十三年十二月乞病纪恩
1165749,贞元八年十二月谒先主庙绝句三首 其二
378853,宣和四年十二月二十四日大雪珠禅客忽至渠以谷山退院来审是否作此示之
1208633,济南张侯至大二年奉御香祷旱历山舜祠雨应是年十二月也
583453,弘治十六年十二月二十五日午大雪二十九日寅止正月三日晚又雪至十六日或雪或止惟十五日尤异其雪花大者约广二三寸长亦如之见者莫不惊骇余时奉命在镇是日雨水节寒如冬至沿河冻合舟不能行屋檐积雪弥月不消不知天道竟何如也感而有作
17358,赠友·一年十二月
457958,二零零一年十二月三十一夜 其二
921788,元祐五年十二月十二日，同景文、义伯、圣途、次元、伯固、蒙仲游七宝寺，题竹上
1036152,浣溪沙 元丰七年十二月二十四日从泗州刘倩叔游南山
278187,沁园春·一九六三年十二月，赋呈毛主席
287396,哭李心栽·去年十二月
237698,舟中独酌·一年十二月华圆
646246,洪武五年正月十五日朝廷就钟山寺大建法会普济幽冥四年十二月十五日上御奉天殿集公侯百官宣谕建会之因禁天下屠宰上先斋戒一月以严法赋斋戒
1064429,宣和四年十二月二十四日大雪珠禅客忽至渠以谷山退院来审是否作此示之
1069732,宣和七年十二月二十一日就睿谟殿张灯预赏元宵曲燕应制
