790074,一如仁兄长余数岁，与余契洽。文宗理法，教恤单寒，至于晓露移花，春风啜茗，其馀事也。去岁古稀称庆，同人寿君者多寿以诗，君亦作诗自寿。谨次原韵呈政。时在戊寅菊月 其二
245151,河传·海宇，称庆
1003814,张伯修令君赋诗同韵称庆
1220320,天历初元京师之变大兴军旅中外皇皇遄闻顺附诛放奸臣朝廷清明海宇宁一皇帝神圣郊天告庙躬行典礼酬功报力恩泽周溥大宥涤濯仁施滂沛百官称庆宾筵秩秩进贤去邪皆繇睿断太平之运适符於今草野愚臣谨摭所闻著为歌咏以称述盛德愧辞语芜谫不足备太史之采传示久远云尔共八十韵
410568,朱小汀丈八秩称庆其子梁任来索诗丈登辛未武科官至守备
282340,朱小汀丈八秩称庆其子梁任来索诗丈登辛未武科官至守备
764965,贺新郎 庚戌九月为既庭师五帙，浪迹燕齐，未获捧觞称庆，隔岁归来，绘云松图补祝，时辛亥正月望后，梅花盛开日也
790073,一如仁兄长余数岁，与余契洽。文宗理法，教恤单寒，至于晓露移花，春风啜茗，其馀事也。去岁古稀称庆，同人寿君者多寿以诗，君亦作诗自寿。谨次原韵呈政。时在戊寅菊月 其一
569969,新乐大王明德懿亲肩美齐献被礼服义趾称河间耳顺已逾国储未立迩者熊梦奕奕麟趾振振凡在同声俱廑称庆敬成七言律以弁卷端
163914,张伯修令君赋诗同韵称庆
815225,一如仁兄长余数岁，与余契洽。文宗理法，教恤单寒，至于晓露移花，春风啜茗，其馀事也。去岁古稀称庆，同人寿君者多寿以诗，君亦作诗自寿。谨次原韵呈政。时在戊寅菊月
