1046254,御试求遗书于天下
1042181,拟御试求遗书于天下
1063356,长沙竹笋闻于天下大者可十斤重食之甚甘而不冰脾昔渡湘欲作诗未暇也今复过之酬以此篇
650243,帝王膺受天命至圣之德格于天心故三光全而寒暑时群生和而万物育是以上天昭锡景贶以彰盛美钦惟皇上统绍鸿基主宰神人宵旰图治至仁孚于海内至信昭于天下华夷效顺海宇清宁雨旸晦明各顺其叙时和岁登家给人足乃永乐十一年春二月皇上再狩北京行庆赏黜陟之典田野之民莫不鼓舞欢跃瞻仰日月之光华以为盛世太平之贺乃夏五月丁未山东兖州府曹县以驺虞来献白质黑章五采绚烂目光如电尾长倍躯起伏蹲卧不扰不惊在廷臣僚洎蛮夷酋长与夫工商舆?之徒莫
807280,满江红  闻往岁帝城烟火之盛，甲于天下，今年元夜，作客都门，适逢新禁，凄然独坐，词以遣怀
579445,广于天下为远藩仕籍华秩已少况琼于广又为远郡成化二年秋进薛公远户部尚书邢公宥都御史丘公浚翰林学士皆在一月恐虽天下望郡亦希海外衣冠胜事真奇逢也
659118,送大行人柯君使毕还闽中省觐余窃伏草野无复当世之望忽承九重遣使衔命下贲丘园此三代养老引年之盛礼也斯礼也不见于天下久矣顾余何人而际其盛君使既竣便道归拜太夫人于堂感激之馀无以为报因赋诗赠之
345492,长沙竹笋闻于天下大者可十斤重食之甚甘而不冰脾昔渡湘欲作诗未暇也今复过之酬以此篇
104463,挽词·试问於天下
