710903,余友韩耳叔文恪公之仲子死于难托生刘两成为子刘亦余友也托生之前梦耳叔入室遂产及能言刘有姑戏之曰汝为谁顿有悟曰我父为官我兄为和尚余为人刃今五年不复记忆余喜续三生之缘诗寄两成令示之
1138732,绝句留别善之仲实并呈松涧云仲无逸四首 其三
1138733,绝句留别善之仲实并呈松涧云仲无逸四首 其二
185388,同善之仲贯无逸游饮夜归分韵得星字
216500,和仲庶夜过新开湖忆冲之仲涂共泛
435902,送辅之仲庸还大梁
1138813,同善之仲实无逸游饮夜归分韵得星字
185387,同善之仲它无逸共赋雪中香亭
1138734,绝句留别善之仲实并呈松涧云仲无逸四首 其一
185766,绝句留别善之仲实并呈松涧云仲无逸
1239486,至正丁酉冬昆山顾仲瑛会客芝云堂适时贵自海上来以黄柑遗之仲瑛分饷坐客喜而有作属余及陆良贵袁子英等六客同赋
1138964,同善之仲实无逸共赋雪中香亭
1144426,绝句留别善之仲实并呈松涧云仲无逸四首
911219,余十岁时从亡兄仲氏侍先父摄帅江陵郡圃蜡梅数百株一昔盛开予为记之仲兄颇赏爱以为工今十六七年矣属感前事重赋七言以纾余悲
512837,无锡沈宗贵存耕翁之仲子自弱冠侍翁至余家余年十三见先父以诗画赠存耕经四十九年尚存宗贵所观感而赋此
595862,中秋夜对月怀吴之仲
1138731,绝句留别善之仲实并呈松涧云仲无逸四首 其四
858866,和仲庶夜过新开湖忆冲之仲涂共泛
