473557,中甫过斋中烹茗清谈试笔写图因题其上三首 其二
353420,谢鲍潮州惠归正李媪所作外国图因题卷后
417633,念奴娇 作《野水秋心图》因题
473558,中甫过斋中烹茗清谈试笔写图因题其上三首 其三
694903,中甫过斋中烹茗清谈试笔写图因题其上三首
1111183,谢鲍潮州惠归正李媪所作外国图因题卷后二首
502172,汊口程伯龄扁所居曰容膝山房求余写乔松古木图因题以为赠
621211,为徐巨源作榆溪草堂图因题湖溪在豫章城内颇恨无山予谓为图补山不如为堂补楼也
55673,中甫过斋中烹茗清谈试笔写图因题其上
1251843,为文举画泖山图因题
590342,题李子长为写爱梅图因题
502136,率溪汪茂卿求写溪山小隐图因题图左
300372,念奴娇·作《野水秋心图》因题
768590,瑶华慢 高澹人内翰入直南书房，上手摘白石榴一枚赐之，舍人尝不敢竟携归，命友人作半榴图，因题卷末
1089758,谢鲍潮州惠归正李媪所作外国图因题卷后二首 其一
473556,中甫过斋中烹茗清谈试笔写图因题其上三首 其一
400487,点绛唇 谷雏为作瑶山行役图，因题其上
1089759,谢鲍潮州惠归正李媪所作外国图因题卷后二首 其二
318359,点绛唇·谷雏为作瑶山行役图，因题其上
1248926,为曹佥事画溪山春晓图因题
