1245183,寄东湖浚天渊长老伯仲
965598,中秋对月忆伯仲
192014,呈沈守·别乘潘郎伯仲间
895291,病起枕上口占三绝句奉呈公实峤之贤伯仲一笑 其一
220279,送杨充老·蚤接君家伯仲贤
603944,携李王文学伯仲饮予西湖谈烟雨楼之胜因偕会稽王道坚登之
493201,承王子与伯仲枉顾敝庐不果迎候奉次留题二首 其一
1063612,香城怀吴氏伯仲
998471,伯仲时德升用均父韵送德父守菑川邀余同赋
491623,题竹石图歌奉赠周思廉思忠伯仲
687074,承王子与伯仲枉顾敝庐不果迎候奉次留题二首
475253,朐冈行赠迟户部兼简冯汝强伯仲
491447,夜宴富滩郭氏西庭和荅九洲萧徵士并柬履理履祥于渊贤伯仲
1044910,宋匪躬太祝先辈示及刘贡父伯仲三人同年登第之诗因奉一篇
367459,摸鱼儿·滋伯仲甫綗士韵梅，用稼轩韵作送春词
49678,将游甬东王青州伯仲见过作
270844,双双燕·题佟汇白中丞伯仲渔樵图
904529,公实公衍伯仲相访云木犀再花香橘新摘也并以为惠且将以佳篇因次韵
1096428,万竹陈兄伯仲相过
54802,夜泊虎丘同刘元声伯仲
538717,初春饮张氏伯仲园皇甫子循以疾不与贻诗见艳未及造访先此有答
492926,八月十一日自水南渡江道金华过北岩访萧鹏举氏是日云阴掩冉殊不见日色道中赋绝句三首明日因录柬举善暨鹏举伯仲 其三
655864,访表兄锁秉端伯仲
544211,送汪象先伯仲还新安二首 其二
1251111,社日偕郭思诚伯仲郊行过其先人墓
353676,挽词·忆曾伯仲共论文
188667,任伯仲时德升用均你韵送德父守菑川邀奈同赋
62118,朐冈行赠迟户部兼简冯汝强伯仲
697016,寄居曲水园柬张氏伯仲二首
543923,寄居曲水园柬张氏伯仲二首 其二
188675,次韵任伯仲均父诗和唐英之什
697061,送汪象先伯仲还新安二首
492158,冬日同诸友访萧国录登西楼复会宿山房分韵得连字因怀往昔夜过监学访萧国录会宋学士周员外诸公赋诗旧事明日赋柬鹏南伯仲并分韵诸作者
299277,秋同石琬伯仲琳诸子游坤月精舍
886997,九日偕朱彦器伯仲游雁门山
191957,莲花·伯仲之间竹与梅
163633,叔存侄伯仲拉登平盖观
536544,雨饮李氏伯仲草堂遣谢
229051,送伯才伯仲之官
49781,渡江寄吴氏伯仲
1033167,到南昌呈宋愿父伯仲黄子鲁诸丈 其二
1244210,柬王奎伯仲
147106,到南昌呈宋愿父伯仲黄子鲁诸丈
1003828,叔存侄伯仲拉登平盖观
472748,同谢水部陈山人游虎丘王进士赠华荡酒与高家惠泉伯仲也
201395,病起枕上口占三绝句奉呈公实峤之贤伯仲一笑
864525,与刘天游伯仲夜话霅中戏赠
151311,九日偕朱彦器伯仲游雁门山
376247,酬姜贫乐·我欲渊明伯仲间
1065817,地炉歌寄伯仲
492447,寄汤子敏伯仲
655865,访表兄章二伯仲
687053,八月十一日自水南渡江道金华过北岩访萧鹏举氏是日云阴掩冉殊不见日色道中赋绝句三首明日因录柬举善暨鹏举伯仲
493377,余留宣溪旷氏几半月于别也承惟宁惟南伯仲率诸客送余江浒停舟赋诗眷眷有留恋之意明日到流江书此寄谢
492275,喜水退过南园问劳子与伯仲兼怀水东别业
557807,哀杨伯仲词
804708,重修横山桥成呈萧虞音伯仲
1066772,周文之运使巡按海宁追忆曩岁与伯仲同奉板舆之乐感慨赋诗不惟辞藻格力清蔚高迈且足以敦孝悌而厚风俗昔夏侯湛作诗示潘岳曰此文非徒温雅乃别见孝悌之性因次韵和二首 其二
323811,宋匪躬太祝先辈示及刘贡父伯仲三人同年登第之诗因奉一篇
895290,病起枕上口占三绝句奉呈公实峤之贤伯仲一笑 其三
493376,余留宣溪旷氏几半月于别也承惟宁惟南伯仲率诸客送余江浒停舟赋诗眷眷有留恋之意明日到流江书此寄谢
1161771,奉和史馆张阁老以许陈二阁长爱弟俱为尚书郎伯仲同时列在南北省会于左掖因而有咏
778502,双双燕  题佟汇白中丞伯仲渔樵图
1216217,走也衔命而来舣舟永嘉之楚门盖居人戴氏里也一日邀致于所居之村曰竹冈杯酒留连伯仲联侍居周匝佳山水环绕于其间间尝游目登眺一时清远之思崭然眉睫昔谢太傅好游东山未为无谓也顾余何人拟迹宰相不能不愧耳幸以诗人常谈见恕是所望也
109294,送容斋·一门伯仲知谁似
334976,挽诗·天与精忠伯仲间
1016434,送伯才伯仲之官
192306,公实公衍伯仲相访云木犀再花香橘新摘也并以
238420,哭薛吏部·伯仲皆登第
357893,周文之运使巡按海宁追忆曩岁与伯仲同奉板舆之乐感慨赋诗
502120,题姚智伯仲凝霏轩
566821,十六日霁与张长治伯仲集城隅次长治韵
603975,怀王伯仲
1241989,壬申十二月廿九日林泉抱拙伯仲万山别驾同宿三味轩得何字
998476,次韵任伯仲均父诗和唐英之什
639114,己巳仲春王承吉招游习池因谒乃祖忠节祠墓遂同侍御曹西泉伯仲彭副郎文卿徜徉尽日而还
201396,伯仲一笑·海外绿洋来万里
906239,仆与公采户曹奉议有先世之契又旧从其伯仲游今复相遇于此前日偶过西邻不知尝辱车马承贶佳什次韵为谢
382327,寄东湖浚天渊长老伯仲
603952,寄怀沈生伯仲
970967,与硕父沈弟伯仲晚行河堤硕父欲作小亭于其上且云西南得山最多即其语作绝句
382986,秋日有怀伯仲两兄
492925,八月十一日自水南渡江道金华过北岩访萧鹏举氏是日云阴掩冉殊不见日色道中赋绝句三首明日因录柬举善暨鹏举伯仲 其二
497236,昆山逢长兴徐宪副同王太仆伯仲饮仲蔚宅
240965,二神峰·伯仲怡然意甚真
493202,承王子与伯仲枉顾敝庐不果迎候奉次留题二首 其二
766590,摸鱼儿 滋伯仲甫綗士韵梅，用稼轩韵作送春词，先后邮寄，次韵继声
1213070,赠陈方回伯仲诗洛下
895289,病起枕上口占三绝句奉呈公实峤之贤伯仲一笑 其二
1033166,到南昌呈宋愿父伯仲黄子鲁诸丈 其一
190656,中秋对月忆伯仲
624327,过林启抡伯仲醉归有赋
616125,马园步姜宗伯仲讱韵
543922,寄居曲水园柬张氏伯仲二首 其一
166899,仆与公采户曹奉议有先世之契又旧从其伯仲游
376205,万竹陈兄伯仲相过
881644,浣溪沙 其一 简王景源、元渤伯仲
1240783,乙酉四月二日与蒋桂轩伯仲诸友同泛震泽大小雷望洞庭之峰吹笛饮酒乘月而归盖不异老杜坡仙游渼陂赤壁也舟中各赋诗余赋二十韵为首唱
1066533,再和涉汝诗呈去非伯仲
323945,送徐圣可·文康伯仲见昌黎
1063748,谢李商老伯仲见过
169439,送林朝奉·两父论诗伯仲间
1132195,到南昌呈宋愿父伯仲黄子鲁诸丈
184721,次忧字韵·公家伯仲世名流
69690,乙酉四月二日与蒋桂轩伯仲诸友同泛震泽大小
1064173,同世承世英世隆三伯仲蔡定国刘达道登滕王阁
105976,府判·公家贤伯仲
201397,伯仲一笑·天上宝囊无尽藏
543723,寄汪仲淹伯仲
545420,汪象先伯仲招游城东阮姬馆即席索诗题壁间
1066771,周文之运使巡按海宁追忆曩岁与伯仲同奉板舆之乐感慨赋诗不惟辞藻格力清蔚高迈且足以敦孝悌而厚风俗昔夏侯湛作诗示潘岳曰此文非徒温雅乃别见孝悌之性因次韵和二首 其一
1128507,周文之运使巡按海宁追忆曩岁与伯仲同奉板舆之乐感慨赋诗不惟辞藻格力清蔚高迈且足以敦孝悌而厚风俗昔夏侯湛作诗示潘岳曰此文非徒温雅乃别见孝悌之性因次韵和二首
470171,夜泊虎丘同刘元声伯仲
594271,上巳陈右父金道存聂道亨何惟圣吴载伯黄伯仲过集得歌字
538035,留吉甫达甫伯仲小饮
473333,将游甬东王青州伯仲见过作（以下《客越志》，嘉靖丙寅）
1251202,寄项如山伯仲
377878,挽辞·伯仲持哀日
871765,永伯仲渊在狱作九十二言伤之
179663,桂椿堂·欈李于门伯仲佳
151634,与刘天游伯仲夜话霅中戏赠
544210,送汪象先伯仲还新安二首 其一
1112416,病起枕上口占三绝句奉呈公实峤之贤伯仲一笑
547609,秋日有怀伯仲两兄
98464,与硕父沈弟伯仲晚行河堤硕父欲作小亭于其上
239089,永伯仲渊在狱作九十二言伤之
569875,顾尚玺伯仲东西二园今并为一然主人老病芜不治矣信步一游志感
541620,王阳德大参伯仲邀饮墨池园池即右军洗砚处谢氏梦草堂在侧
492924,八月十一日自水南渡江道金华过北岩访萧鹏举氏是日云阴掩冉殊不见日色道中赋绝句三首明日因录柬举善暨鹏举伯仲 其一
473407,渡江寄吴氏伯仲
74501,水调歌头·伯仲见伊吕
