1155055,木莲树生巴峡山谷间巴民亦呼为黄心树大者高五丈涉冬不凋身如青杨有白文叶如桂厚大无脊花如莲香色艳腻皆同独房蕊有异四月初始开自开迨谢仅二十日忠州西北十里有鸣玉溪生者秾茂尤异元和十四年夏命道士母丘元志写惜其遐僻因题三绝句云 其二
500712,益都城北三十里有邮亭名白羊铺壁间石刻张梦臣学士诗一首乃至大辛亥未第时所作其诗曰迢迢长日路途间两字功名抵死难岂为身荣爱奔竞正缘亲老逼饥寒云霄附凤心徒壮客馆无鱼铗自弹百亩薄田容易办也应无梦到长安仆因次韵书事
869073,上郡南三十里有相思亭在太山之麓二水所交平皋之上往来者徒习其名莫详其义庆历甲申岁余适延安过于其下于时夏虏梗边征戍未息窃感东山采薇之义叙其情而悯其劳因作五诗庶几不违周公之指且以释亭之名尔 其一
406262,送蓬仙兄返里有感 其二
505593,千里有诗见贻次韵以答
644136,谒侯城里有感
1236667,燕城之北垂三十里有瓮山原先妣国夫人坟室在焉予过之哀感不已而贮之诗仍寄呈尊夫大领省以慰其感云
869931,上郡南三十里有相思亭在太山之麓二水所交平皋之上往来者徒习其名莫详其义庆历甲申岁余适延安过于其下于时夏虏梗边征戍未息窃感东山采薇之义叙其情而悯其劳因作五诗庶几不违周公之指且以释亭之名尔 其五
1078088,自晋康顺流六十里有山巉然临江下有岩洞可容千人轩豁平坦景幽邃石罅间滴泉厥味甘冽因目之曰玉乳岩赋诗以纪其事
100712,次韵和王巩·邻里有异趣
803349,榆林归里有感复用留别原韵
232112,未至池阳五里有齐山寺后岩石巉然缘崖而上绝
953139,过陶岭有钱王井又三里有钱王石庵
359833,重过长千里有感
26572,和太常杜少卿东都修行里有嘉莲
869072,上郡南三十里有相思亭在太山之麓二水所交平皋之上往来者徒习其名莫详其义庆历甲申岁余适延安过于其下于时夏虏梗边征戍未息窃感东山采薇之义叙其情而悯其劳因作五诗庶几不违周公之指且以释亭之名尔 其二
212358,右清心堂·千里有馀刃
644135,谒侯城里有感
8432,归来·客里有所过
373412,秀州城外九里有竹树小桥
406264,送蓬仙兄返里有感 其三
917480,未至池阳五里有齐山寺寺后岩石巉然缘崖而上绝顶有翠微亭即杜樊川九日携壶地也自亭而西憩集仙洞
1193886,木莲树生巴峡山谷间巴民亦呼为黄心树大者高五丈涉冬不凋身如青杨有白文叶如桂厚大无脊花如莲香色艳腻皆同独房蕊有异四月初始开自开迨谢仅二十日忠州西北十里有鸣玉溪生者秾茂尤异元和十四年夏命道士母丘元志写惜其遐僻因题三绝句云
1077913,华容西二十许里有墨山即离骚所谓玄石也山有大云寺寺有云母泉甘芳洁清大旱不竭唐李华有诗序之甚详其末云华贬杭州司公恩复左补阙次于岳阳江山延望思与高贤共饮云母之泉躬耕墨山之下敢违朝命以询私欲秋风露寒洞庭微波一闻猿声不觉涕下况支离多病年甫始衰愿饵药扶寿以究无生之学事乖志负火爇余心三复其言而悲之因次其韵
1038951,秀州城外九里有竹树小桥予十八年前与友人解晦叔饮别于此今过之景物依然而解生已亡悲叹不足复成小诗
406263,送蓬仙兄返里有感 其一
1212977,燕城之北垂三十里有瓮山原先妣国夫人坟室在焉予过之哀感不已而贮之诗仍寄呈尊夫大领省以慰其感云 其二
520345,凤泉之南不二里有一巨石而复承一石大亦称焉以一夫撼之则其势微动加以众力则屹然莫移盖亦异也相传谓之神功石岂其然乎予停舆一视因成二诗 其二
46272,送蓬仙兄返里有感·东风催异客
520333,盩厔之南三十里有台焉相传为马融读书之所予闻六籍穿凿于汉儒而女乐生徒之缪亦可资千古一笑途次口占一律聊以吊南郡太守云
1189802,和太常杜少卿东都脩行里有嘉莲
1078232,宿开平寺去剑浦二十里有泉石之胜曩与郡守谢德夫同游今一纪矣溪山草木依然住持犹旧人也感叹有作二首 其二
329782,进士·里有宾兴方启燕
1139140,雅宜山在城西五十里有德庆庵在其下穹窿山福顺寺长老绍尧翁作诗取以雅宜为号求诗
120096,房陵·农闲闾里有逢迎
452390,陪幻庐寻访故里有作
578411,挂冠归里有赋
99630,巫山庙上下数十里有乌鸢无数取食于行舟之上
1212976,燕城之北垂三十里有瓮山原先妣国夫人坟室在焉予过之哀感不已而贮之诗仍寄呈尊夫大领省以慰其感云 其一
807721,一寸金  距亳村不数里有古刹曰敬先庵，庵侧有一高邱，或穴其下乃得古冢，隧涧幽凉，明器怪诡，似是古侯王墓。词以纪事
349833,如梦里·有见
46273,送蓬仙兄返里有感·同侪争疾走
134436,题厅壁·百里有民社
92888,又和·帝城底里有山林
139102,里有蒋生者颇志于学迫于贫困吾叔德先见而怜
1155054,木莲树生巴峡山谷间巴民亦呼为黄心树大者高五丈涉冬不凋身如青杨有白文叶如桂厚大无脊花如莲香色艳腻皆同独房蕊有异四月初始开自开迨谢仅二十日忠州西北十里有鸣玉溪生者秾茂尤异元和十四年夏命道士母丘元志写惜其遐僻因题三绝句云 其一
807818,八归  杜家庙距济南四十五里，有旅馆颇幽靓，砌下玉簪一丛，尤楚楚可念，徙倚久之，词以写怀
74535,太常引·藕花香里有丛筠
185270,雅宜山在城西五十里有德庵在其下穹寄山福寺
258489,书里有你哗哗作响的时间
869930,上郡南三十里有相思亭在太山之麓二水所交平皋之上往来者徒习其名莫详其义庆历甲申岁余适延安过于其下于时夏虏梗边征戍未息窃感东山采薇之义叙其情而悯其劳因作五诗庶几不违周公之指且以释亭之名尔 其三
920145,巫山庙上下数十里，有乌鸢无数，取食于行舟之上，舟人以神之故，亦不敢害
798565,如梦里·有见
520328,兴平之西二十里有镇曰马嵬致政阎方伯文振之旧第在焉方伯盖予诗友也且喜其居近周道因为之一留仍贻之以诗曰
688165,凤泉之南不二里有一巨石而复承一石大亦称焉以一夫撼之则其势微动加以众力则屹然莫移盖亦异也相传谓之神功石岂其然乎予停舆一视因成二诗
999674,西距渭南二十里有佛祠曰梁田其主僧守遂者引予登阁久之欲题名屋壁守遂遽阻曰有榜谕恐得罪于邑大夫愿勿题又阁有韩玉汝赴洋州日留题诗板而书字犹新询于守遂曰前日韩将漕本道亦邑宰令写之诗也因感世态而作
807520,念奴娇  由亳州至归德途经木兰故里有祠在焉感赋
1113982,宿开平寺去剑浦二十里有泉石之胜曩与郡守谢德夫同游今一纪矣溪山草木依然住持犹旧人也感叹有作二首
864530,客里有怀徐太古
604940,徐海石中丞入佐内台还里有终焉之志诗以讯之
221127,过陶岭有钱王井又三里有钱王石庵
333465,宿开平寺去剑浦二十里有泉石之胜曩与郡守谢德夫同游
67730,过侯城里有感
740986,重过长千里有感
432656,送蓬仙兄返里有感 其二
1078231,宿开平寺去剑浦二十里有泉石之胜曩与郡守谢德夫同游今一纪矣溪山草木依然住持犹旧人也感叹有作二首 其一
46269,送蓬仙兄返里有感
1155056,木莲树生巴峡山谷间巴民亦呼为黄心树大者高五丈涉冬不凋身如青杨有白文叶如桂厚大无脊花如莲香色艳腻皆同独房蕊有异四月初始开自开迨谢仅二十日忠州西北十里有鸣玉溪生者秾茂尤异元和十四年夏命道士母丘元志写惜其遐僻因题三绝句云 其三
1107682,上郡南三十里有相思亭在太山之麓二水所交平皋之上往来者徒习其名莫详其义庆历甲申岁余适延安过于其下于时夏虏梗边征戍未息窃感东山采薇之义叙其情而悯其劳因作五诗庶几不违周公之指且以释亭之名尔
1212978,燕城之北垂三十里有瓮山原先妣国夫人坟室在焉予过之哀感不已而贮之诗仍寄呈尊夫大领省以慰其感云 其三
886519,满江红 按郡志，涪溪侧十里有瀑布，泻出两峰间，垂数十丈，号水帘洞。其侧有亭，山谷榜曰奇观
889500,里有蒋生者颇志于学迫于贫困吾叔德先见而怜之赡其有无使从胡经仲学作诗勉之
520344,凤泉之南不二里有一巨石而复承一石大亦称焉以一夫撼之则其势微动加以众力则屹然莫移盖亦异也相传谓之神功石岂其然乎予停舆一视因成二诗 其一
158424,西距渭南二十里有佛祠曰梁田其主僧守遂者引
869074,上郡南三十里有相思亭在太山之麓二水所交平皋之上往来者徒习其名莫详其义庆历甲申岁余适延安过于其下于时夏虏梗边征戍未息窃感东山采薇之义叙其情而悯其劳因作五诗庶几不违周公之指且以释亭之名尔 其四
828153,张梦兰先生以南翔罗汉菜见饷其太夫人手腌也相传菜种为达摩祖师所遗止附南翔寺十里有是菜袓师来时有鹤南飞故以名寺云
655722,宿悬榻里有怀往事
250726,陪幻庐寻访故里有作
133986,上郡南三十里有相思亭在太山之麓二水所交平
338369,忌日·千里有孤子
482350,过侯城里有感
