1193463,余以咸亨元年在西京寻听于时与并部处一法师莱州弘祎论师更有三二诸德同契鹫岭标心觉树然而一公属母亲之年老遂怀恋于并州祎师遇玄瞻于江宁乃叙情于安养玄逵既到广府复阻先期唯与晋州小僧善行同去神州故友索尔分飞印度新知冥焉未会此时踯躅难以为怀戏拟四愁聊题两绝
322949,寓栖真四宿时二儿寓上庠未知去留又祠命未下颇以为怀
1103764,己亥重九夜归篝灯独酌因思乙未岁是日陪余敬可携赵定庵马宁卿王叔文云隐二三道伴登芝山驻接仙亭蔬盘果食清谈竟日今诸道萍散而敬可九原不可作对酒凄然殆无以为怀也
1147697,余以咸亨元年在西京寻听于时与并部处一法师莱州弘祎论师更有三二诸德同契鹫岭标心觉树然而一公属母亲之年老遂怀恋于并州祎师遇玄瞻于江宁乃叙情于安养玄逵既到广府复阻先期唯与晋州小僧善行同去神州故友索尔分飞印度新知冥焉未会此时踯躅难以为怀戏拟四愁聊题两绝 其一
798985,宴清都 客枕羁愁，枯灯煮梦，郁伊善感，何以为怀。和草窗登霅川韵，不自知所言之何似也
1085487,寓栖真四宿时二儿寓上庠未知去留又祠命未下颇以为怀
368666,宴清都·客枕羁愁，枯灯煮梦，郁伊善感，何以为怀
1147698,余以咸亨元年在西京寻听于时与并部处一法师莱州弘祎论师更有三二诸德同契鹫岭标心觉树然而一公属母亲之年老遂怀恋于并州祎师遇玄瞻于江宁乃叙情于安养玄逵既到广府复阻先期唯与晋州小僧善行同去神州故友索尔分飞印度新知冥焉未会此时踯躅难以为怀戏拟四愁聊题两绝 其二
