1001601,余以檄出陈机宜往西津候别余阻风不得前
545784,十三日再同王仲升陈实卿章茂德王仲济盛明元六昆季宴集祝华父唐污父适至分韵得前字即席赋
19598,赠梦得·前日君家饮
1122913,夜饮颐斋以灯前细雨檐花落为韵分得前字又得花字赋二首
374,侍宴应诏赋韵得前字
233257,社日喜晴分韵得前字
71412,一剪梅·新得前高一簇山
1106028,予行为魏仓监门忽得前监仓官诗人江南彭少逸诗因次韵时彭以遗火失官
1068604,予行为魏仓监门忽得前监仓官诗人江南彭少逸诗因次韵时彭以遗火失官 其一
879574,社日喜晴分韵得前字
972310,去冬过新喻得前四句因见全真行足以成篇
148514,余以檄出陈机宜往西津候别余阻风不得前
612097,小筑镜园池馆将成夏日何敬宇尹冲玄洪约吾曾资铭移舟载酒集邻仙楼得前字
97769,去冬过新喻得前四句因见全真行足以成篇
1156524,梦得前所酬篇有鍊尽美少年之句因思往事兼咏今怀重以长句荅之
1068605,予行为魏仓监门忽得前监仓官诗人江南彭少逸诗因次韵时彭以遗火失官 其二
965114,夜饮颐斋以灯前细雨檐花落为韵分得前字又得花字赋二首 其一
323729,予行为魏仓监门忽得前监仓官诗人江南彭少逸诗因次韵时彭以遗火失官
592082,约卿宅同元白惟敬咏盆荷得前字
159771,初春置酒河上得前忠武记室饶廷评书因成感咏
832659,千秋岁 效连咏体，夔笙得前拍，予继声
965113,夜饮颐斋以灯前细雨檐花落为韵分得前字又得花字赋二首 其二
1146244,侍宴应诏赋韵得前字
1155904,令狐相公与梦得交情素深眷予分亦不浅一闻薨逝相顾泫然旋有使来得前月未殁之前数日书及诗寄赠梦得哀吟悲叹寄情于诗诗成示予感而继和
557016,冬夜沈李陆禹卢潘诸文学同徐山人集芙蕖馆分得前字
176285,夜饮颐斋以灯前细雨檐花落为韵分得前字又得
894509,初春置酒河上得前忠武记室饶廷评书因成感咏以寄
31963,寄顾云·省得前年别
71349,一剪梅·新得前高自发扬
71350,一剪梅·新得前高孰可知
206680,疏小渠·分得前溪水
267220,千秋岁·效连咏体，夔笙得前拍，予继声
