857277,答问诗十二篇寄呈满子权 其十二 龙谢水车
857273,答问诗十二篇寄呈满子权 其四 耒答镈
1156003,江楼晚眺景物鲜奇吟玩成篇寄水部张员外
709632,怀芳篇寄徐子能
835957,庆春泽漫 其一 丙寅季冬十四日对雪曾赋长篇寄君达兄，壬辰寓珠江，仲冬二十八夜大雪。追思往事，如梦如尘，复填小阕以寄
1105931,答问诗十二篇寄呈满子权 镈问耒
633144,起西以长篇寄讯答此短章
448508,手录近作百篇寄刘峻
1157918,辱牛仆射相公一札兼寄三篇寄怀雅意多兴味亦以三长句各各继来意次而和之
330907,灵真道人久无诗来用协甫韵并前篇寄之且拉尔耳翁同赋
530868,琼音篇寄康对山
857279,答问诗十二篇寄呈满子权 其七 耒问斧
857280,答问诗十二篇寄呈满子权 其八 斧问耒
139924,大理曾少卿欲见余近作录数篇寄之以诗为谢且
200558,汪正夫云已厌游湖上顾予犹未数往遂成长篇寄
1120485,次韵赣州知府陈侍郎二首前篇寄幼安后篇寄季陵
1120485,次韵赣州知府陈侍郎二首前篇寄幼安后篇寄季陵
1241264,三贞篇寄纳麟哈刺参政幕下僚友
1127717,罗子琳来就广漕试予以檄出至西江峡口怀古感兴两篇寄子琳后篇救子琳穷病也
920198,辛丑十一月十九日，既与子由别于郑州西门之外，马上赋诗一篇寄之
597894,塞上读霞海篇寄管涔子
1088639,伏读尤美轩诗卷谨赋一篇寄呈伯时季路二兄
959647,汪正夫云已厌游湖上顾予犹未数往遂成长篇寄之
601661,武夷篇寄冯稚谟
1217627,古镜篇寄韩与玉
1091553,次韵赣州知府陈侍郎二首前篇寄幼安后篇寄季陵 其二
1091553,次韵赣州知府陈侍郎二首前篇寄幼安后篇寄季陵 其二
857271,答问诗十二篇寄呈满子权 其九 水车问龙
35566,偶闻官吏举请辄有一篇寄从弟舍人
364620,晁美叔前寄知字韵诗别求予诗既已和前篇因复用前韵作一篇寄晁
857281,答问诗十二篇寄呈满子权 其六 镈问耒
266595,庆春泽漫·丙寅季冬十四日对雪曾赋长篇寄君达兄
1091552,次韵赣州知府陈侍郎二首前篇寄幼安后篇寄季陵 其一
1091552,次韵赣州知府陈侍郎二首前篇寄幼安后篇寄季陵 其一
1196498,偶闻官吏举请辄有一篇寄呈成都府从弟舍人
857272,答问诗十二篇寄呈满子权 其十一 水车谢龙
1058750,岁暮篇寄无碍居士
264203,银河篇寄颐道主人汉皋
362938,织锦巷·纂组诗篇寄意深
1246037,戏为雪鸡篇寄詹同文
18484,江楼晚眺景物鲜奇吟玩成篇寄水部张员外
1155178,有双鹤留在洛中忽见刘郎中依然鸣顾刘因为鹤叹二篇寄予予以二绝句答之 其二
1001656,罗子琳来就广漕试予以檄出至西江峡口怀古感兴两篇寄子琳后篇救子琳穷病也 其二
857274,答问诗十二篇寄呈满子权 其三 耒答镈
541880,梦瑶池篇寄上大冢宰吴汝乔大司徒刘体乾少冢宰林贞恒大理卿刘致卿中丞朱自充鸿胪卿史应之诸公
263300,芗泉姻世讲前有见怀诗，近复以佳篇寄示，次催字韵一律奉和
569863,张左虞都尉故与余善每过弇中风流谑浪飞白无算余犹以酒客卤莽遇之后稍出其诗余稍稍称善然不觉其异也及集成而丐余为叙因赋诸友篇左虞仅居四十人之一耳去年左虞死余不能往吊以香帛寓之而无主丧者孟秋之朔偶摊书出晒于散帙中探得他诗读之不甚快最后一卷极清新丽雅之致句字有力格韵不凡而忘其谁作以集考之则左虞制也不觉失声而泣吾愧钟子期多矣遂成一七言律而会其子授官奔丧归并书诸友篇寄之俾焚于棺所逝者有知将从夜台沽酒三叫称快余亦
195600,答问诗十二篇寄呈满子权其十谢龙水车
857276,答问诗十二篇寄呈满子权 其十 龙答水车
1001657,罗子琳来就广漕试予以檄出至西江峡口怀古感兴两篇寄子琳后篇救子琳穷病也 其一
754783,银河篇寄颐道主人汉皋
782630,进学篇寄坦居五弟
1085618,十月四日宿于沙市舟中捲帘忽见新月天色如水乡思凄然得诗一联云诗成天作纸帘捲月为钩连夕烛有花至六日家书来自临安足成一篇寄二弟
762304,除台湾郡丞，客以海图见遗，漫赋一篇寄诸同学
1034906,大理曾少卿欲见余近作录数篇寄之以诗为谢且云连日疮疡作读余文而愈因次其韵
556983,既赋金山篇寄子与复系之此诗
745303,秋江篇寄吴中诸故人
1103493,远游篇寄府教景熙
857270,答问诗十二篇寄呈满子权 其一 镈问耒
1155177,有双鹤留在洛中忽见刘郎中依然鸣顾刘因为鹤叹二篇寄予予以二绝句答之 其一
1070921,灵真道人久无诗来用协甫韵并前篇寄之且拉尔耳翁同赋
857278,答问诗十二篇寄呈满子权 其五 耒问镈
1212560,大江篇寄上贤王以代谢章兼贺平云南之捷
71179,三贞篇寄纳麟哈剌参政幕下僚友
857275,答问诗十二篇寄呈满子权 其二 耒答镈
530814,怀音篇寄张惟信学士
1043560,晁美叔前寄知字韵诗别求予诗既已和前篇因复用前韵作一篇寄晁
566097,予慕游五岳久矣程子乃先我登嵩华高篇寄及感而赋之一首
335815,次韵赣州知府陈侍郎二首前篇寄幼安后篇寄季陵
335815,次韵赣州知府陈侍郎二首前篇寄幼安后篇寄季陵
628959,孤鸿篇寄黎马龙罗集虚
409817,芗泉姻世讲前有见怀诗，近复以佳篇寄示，次催字韵一律奉和
487472,春游篇寄晋陵吴生
843631,庆春泽漫 丙寅季冬十四日对雪曾赋长篇寄君达兄，壬辰寓珠江，仲冬二十八夜大雪。追思往事，如梦如尘，复填小阕以寄
1193894,有双鹤留在洛中忽见刘郎中依然鸣顾刘因为鹤叹二篇寄予予以二绝句答之
594579,西林篇寄安茂卿
751359,焦桐篇寄李㤅伯慈铭
531633,河桥篇寄用贞懋昭
677441,澄江秋水篇寄寿沔翁先生七帙见远怀
