1144238,都梁北乡士多好学有向君敏衡者一日访予语甚质气甚夷礼甚虔予心异之间为予言曰家故沅徙也今所居有溪实自沅来乃筑室聚书其上以教子弟因以沅溪书舍名之而其亭则曰无加盖其地旧号无加庄以其东止于石西止于岸南止于路北止于泉也愿有以发之予既为籀右书二颜而向君复以所谓廉崖者谂予予闻此石杰立千尺实峭厉峻削可敬可仰有类乎廉者颇思一至其处摩挲此石以激衰懦而未能也乃各为一解以谢焉
801917,恭寿先生于黄山深谷得杖一枝双茎盘曲节目轮囷首尾仍合并为一极离奇瑰异之观为作短歌
1162161,州民自言巴土冬湿且多阴晦今兹晴朗苦寒霜颇甚故老或异之因示寮吏
671702,长安肆中有拥书甚富而秘不示人诗以异之
320246,余得文竹寸馀上有仙翁神女像相偶而坐异之作诗
585849,续得蒋道林书付鹑野来者颇异之欲条答病未能小诗书扇代启三首 其二
615876,建霞楼前盘中白莲花带绿色采贻国开伍子异之曰佛家有青莲仙家有碧莲何来此绿莲花也次日伍子过又抽一花则又白如雪或红如朱叠瓣相间有一瓣而中分红白者花神之变幻极矣各赋一诗
1035205,水调歌头 送赵阆州希异之官
1036094,水龙吟 闾秋大夫孝终公显尝守黄州，作栖霞楼，为郡中绝胜。元丰五年，余谪居黄。正月十七日梦扁舟渡江，中流回望，楼中歌乐杂作。舟中人言：公显方会客也。觉而异之，乃作此曲。盖越调鼓笛慢。公显时已致仕。在苏州
275638,鹧鸪天·梦中得一楼句，醒而异之
168166,夹河中有矮道人自小舟持呪为生人莫不异之者
677075,友人吴瑞生尝患腹痛自言遇小不平辄发以酒浇之则止酒醒复然余闻而异之为作此歌不敢望枚生七发聊用广瑞生意耳
1082156,夜梦一道人见访相与语甚久颇及宗乘中事因戏之曰仙家亦学佛耶其人笑曰仙佛岂有二哉觉而异之作诗纪其事
1142389,都梁北乡士多好学有向君敏衡者一日访予语甚质气甚夷礼甚虔予心异之间为予言曰家故沅徙也今所居有溪实自沅来乃筑室聚书其上以教子弟因以沅溪书舍名之而其亭则曰无加盖其地旧号无加庄以其东止于石西止于岸南止于路北止于泉也愿有以发之予既为籀右书二颜而向君复以所谓廉崖者谂予予闻此石杰立千尺实峭厉峻削可敬可仰有类乎廉者颇思一至其处摩挲此石以激衰懦而未能也乃各为一解以谢焉 其二
679050,里人获苍鹿异之献于官遂作南山鹿
1054270,余得文竹寸馀上有仙翁神女像相偶而坐异之作诗
1137476,都梁北乡士多好学有向君敏衡者一日访予语甚质气甚夷礼甚虔予心异之间为予言曰家故沅徙也今所居有溪实自沅来乃筑室聚书其上以教子弟因以沅溪书舍名之而其亭则曰无加盖其地旧号无加庄以其东止于石西止于岸南止于路北止于泉也愿有以发之予既为籀右书二颜而向君复以所谓廉崖者谂予予闻此石杰立千尺实峭厉峻削可敬可仰有类乎廉者颇思一至其处摩挲此石以激衰懦而未能也乃各为一解以谢焉 其一
965451,夹河中有矮道人自住小舟持咒为生人莫不异之者
1158395,腊月中与韦户曹游发生洞裴回之际见双白蝙蝠三飞洞门时多异之同为口号
744594,得姬传先生书因寄管异之
585850,续得蒋道林书付鹑野来者颇异之欲条答病未能小诗书扇代启三首 其三
534662,詶刘白云五月登大王峰绝顶得仙橘数十颗见遗歌其事异之
1137477,都梁北乡士多好学有向君敏衡者一日访予语甚质气甚夷礼甚虔予心异之间为予言曰家故沅徙也今所居有溪实自沅来乃筑室聚书其上以教子弟因以沅溪书舍名之而其亭则曰无加盖其地旧号无加庄以其东止于石西止于岸南止于路北止于泉也愿有以发之予既为籀右书二颜而向君复以所谓廉崖者谂予予闻此石杰立千尺实峭厉峻削可敬可仰有类乎廉者颇思一至其处摩挲此石以激衰懦而未能也乃各为一解以谢焉 其三
585848,续得蒋道林书付鹑野来者颇异之欲条答病未能小诗书扇代启三首 其一
1078030,寓琼山远华馆一夕梦游山间小堂松竹环合有道士坐堂上诵李太白送人游桃源序中有良田名池竹果森然三十六洞别为一天之语觉而异之今假道容惠当游勾漏都峤白石罗浮皆洞天也岂神者先告将有所遇耶赋诗以纪之
631279,曩在海云偶得一天风雨沉山阁之句时尘异诸子侍坐命作对语尘异以万古云烟锁石门应予心异之己未八月初七入双镜楼忽忆前事正当斯时因用旧句足成一律以识梦中之境始信人之心愿原非虚设也
840446,岁暮怀人十四首客广州作寄以代柬 其十 张异之
744851,九日集抱瓮园赋诗甚欢翼日乃大风雨用惜抱轩集中猎日次重九诗韵柬异之
1249178,余与杨君铁崖别两年矣庚寅嘉平之朔君自淞泖过余溪上适永嘉曹新民自武林至相与饮酒芝云堂明日铁崖将赴任曹君亦有茂异之举同往武林信欢会之甚难而分携之独易安可不痛饮尽兴以洗此愦愦之怀因以对酒当歌为韵赋诗如左于匡庐属瑛序数语为识
287069,张异之·乘槎博望有家风
1153203,腊月中游发生洞裴回之际见双白蝙蝠三飞洞门时多异之同为口号
834745,琵琶仙 己卯清明，同游古林庵，祭管异之先生同，修竹便娟，池塘一碧，丙子夔州东屯之游正复似之。赋此柬同游，并怀漱泉
702205,续得蒋道林书付鹑野来者颇异之欲条答病未能小诗书扇代启三首
378713,与韩子苍·虽赴来机少异之
356844,琵琶仙·己卯清明，同游古林庵，祭管异之先生同，修竹便娟
101814,腊月中与韦户曹游发生洞裴回之际见双白蝙蝠三飞洞门时多异之同为口号
520316,弘治癸丑予以足疾未瘳倦于医居恒忽忽或有进者曰去城之西三百里太白山之下有泉曰凤泉去城之东百馀里曰石门亦有汤泉去城之东北六十里曰骊山亦有温泉浴其水者痼疾皆愈予闻而异之曰有是哉第以守藩不敢专出入乃遣使上告于天子天子许之予拜命踊跃不敢烦有司自饰具以往感恩志喜因有一律纪之其诗云
971124,永丰尉治神祠前梅已成阴忽著花七出而无鄂色又正白众咸异之尉上蔡谢君子畅有诗蕃次韵
