817583,宿潭柘寺与同游诸子拈韵分得佳字
906397,黄檗归途以碧潭清皎洁为韵分得碧字真歇泛舟先归
1122913,夜饮颐斋以灯前细雨檐花落为韵分得前字又得花字赋二首
957706,席上分韵送天觉使河东以登山临水送将归为韵分得临字
690747,立秋同诸子限韵，分得「盐咸」二字
508479,送曹冕中书南还省亲三十四韵分得青字
543882,春日司马公同携王姬入紫霞洞观桃花时少连太宁仲嘉仲淹并集司马以桃花源美人家为韵分得桃字
302377,宿潭柘寺与同游诸子拈韵分得佳字
736414,壬辰仲冬费滋衡江服懿林中山苏梅仙枉集寓斋用海日生残夜江春入旧年为韵分得生入二字
668307,三月既望同吴次明蔡九逵陈道复汤子重王履约履仁汎舟石湖遂登治平以天朗气清惠风和畅为韵分得朗字
909909,又九月十四日登秋风阁以馀霞散成绮澄江静如练为韵分得馀静二字 其一
909977,同诸公饯望元因宿谷隐以何当风雨夜复此对床眠为韵分得对此二字 其一
520516,雪后杨礼部邀宴用谢宣城韵分得浊字
1114868,同仲宝风雨中过德麟留宿以夜未央为韵分得未字并和二公夜央字韵
1059087,与仲孺文仲述之作诗送仲弓赴籍田以之子于征为韵分得子字
1062760,乙未寒食前一日陪姚季一吴和甫登崇德寺阁赋诗以驾言出游以写我忧为韵分得我出二字 其一
202192,同仲宝风雨中过德麟留宿以夜未央为韵分得未
737079,甲申中秋澄观堂宴集以昌黎一年明月今宵多为韵分得月字
1058964,同仲宝风雨中过德麟留宿以夜未央为韵分得未字并和二公夜央字韵 其三
909975,同仲宝风雨中过德麟留宿以夜未央为韵分得未字并和二公夜央字韵 其一
965114,夜饮颐斋以灯前细雨檐花落为韵分得前字又得花字赋二首 其一
985054,中秋待月以星辰避彩乾坤静为韵分得避字
738366,谷雨后二日程芗溪招同洪棕亭汪春泉方石堂游上方寺寺有三绝碑及坡公送李使君诗十韵墨刻在壁即用坡公白板烧松烟为韵分得烧字
972166,三月审知以余行有日置酒于智门寺后竹间小亭时与者王彦博审知之侄彦章余之弟成父审知命以尊前失诗流为韵分得流字书以呈之
1058963,同仲宝风雨中过德麟留宿以夜未央为韵分得未字并和二公夜央字韵 其二
1123617,乙未寒食前一日陪姚季一吴和甫登崇德寺阁赋诗以驾言出游以写我忧为韵分得我出二字
495148,立秋同诸子限韵，分得「盐咸」二字 其一
965113,夜饮颐斋以灯前细雨檐花落为韵分得前字又得花字赋二首 其二
495149,立秋同诸子限韵，分得「盐咸」二字 其二
999212,十月五日从兄四弟三侄侍太孺人赏菊亦好园以赏心乐事为韵分得赏字
909910,又九月十四日登秋风阁以馀霞散成绮澄江静如练为韵分得馀静二字 其二
176285,夜饮颐斋以灯前细雨檐花落为韵分得前字又得
174385,中秋待月以星辰避彩乾坤静为韵分得避字
166708,黄蘖归途以碧潭清皎洁为韵分得碧字真歇泛舟
1058962,同诸公饯望元因宿谷隐以何当风雨夜复此对床眠为韵分得对此二字 其二
1062761,乙未寒食前一日陪姚季一吴和甫登崇德寺阁赋诗以驾言出游以写我忧为韵分得我出二字 其二
1114863,又九月十四日登秋风阁以馀霞散成绮澄江静如练为韵分得馀静二字
1114867,同诸公饯望元因宿谷隐以何当风雨夜复此对床眠为韵分得对此二字
