283071,忆旧游·捡废札，得舅氏一刺，背书寓李铁拐斜街广元栈九字。栗娘夫人手笔也
169381,沈道院有水墨壁画奇笔也惜其穷年无赏之者贾
953040,毗陵太平院壁间画山水熟视之有飞动势殆仙笔也因题
890490,君异郑兄出示旧诗盖绍定初所信笔也俛仰三十年矣戏成口占复归之
604203,枯木竹石图唐解元最得意笔也图以自况诗以自悲余每展其图辄咏其诗不胜身世之感故复悲其意用其韵而赓和之 其一
1142538,寄题沃祥卿梅泉二大字盖何潜斋笔也
921903,赵景贶以诗求东斋榜铭，昨日闻都下寄酒来，戏和其韵，求分一壶作润笔也
835206,忆旧游 捡废札，得舅氏一刺，背书寓李铁拐斜街广元栈九字。栗娘夫人手笔也
297732,水龙吟·题画，雨中春树万人家。十二年前吴石明笔也
509547,题陈御史苍厓舞凤竹乃仲昭笔也
978876,宁江侨人刘生徽宗时以画供奉翰林中近过元汝功见其画甚多皆刘生笔也
1091055,六月三夜梦观某人诗什其书一章四绝盖绝笔也走读竟太一真人来告语青猿手里得长书静闻丹灶风中雨之句梦而默记之寤矣作诗导意
1001180,董令升舍人朋溪图赵祖文笔也
522376,南京摺扇名天下成化间尤重李昭骨王孟仁画兼之者誇以为奇而今不可得矣明善内弟以听泉主人扇索题其画则孟仁笔也展玩数四旧京风致宛在目前为书此以志感
604204,枯木竹石图唐解元最得意笔也图以自况诗以自悲余每展其图辄咏其诗不胜身世之感故复悲其意用其韵而赓和之 其二
184715,董令升舍人朋溪图赵祖文笔也
690688,枯木竹石图唐解元最得意笔也图以自况诗以自悲余每展其图辄咏其诗不胜身世之感故复悲其意用其韵而赓和之
827221,水龙吟 题画，雨中春树万人家。十二年前吴石明笔也
939794,沈道院有水墨壁画奇笔也惜其穷年无赏之者贾明叔请余同赋
827140,阮郎归  辛卯六十四岁 病树索题东湖修褉图，余习翁笔也。是日予病未赴
