501023,参议李公次前韵二首见示赓歌奉荅 其二
501126,重登凤凰台献歌奉进时岁丙午剪除群凶殆尽喜而有作
1241261,合淝束遂庵学正为画君山酹月图长歌奉谢
474866,雪山歌奉寄彭太保
501022,参议李公次前韵二首见示赓歌奉荅 其一
491623,题竹石图歌奉赠周思廉思忠伯仲
575281,王宣溪先世铁拄杖歌奉次西涯先生韵
737384,玉带生歌奉和漫堂先生
1233044,天台歌奉简郡庠谢广文玉成
540616,承赵江都阳溪子寄示登金山见怀之作聊成短歌奉答
444467,子夜歌 奉题石窗夜坐图二首 其二
936073,往在都下时与邹德章兵部同居百官宅无日不相从仆来佐豫章而德章亦谪高安感事述怀作歌奉寄
668001,舟中听张子鱼歌奉赠
444466,子夜歌 奉题石窗夜坐图二首 其一
1164921,轮台歌奉送封大夫出师西征
474865,翠华歌奉寄白岩乔司马
744905,莱臧赋赠泰始砖砚歌奉酬长句
56694,翠华歌奉寄白岩乔司马
573804,惠山泉歌奉次涯翁先生
801551,张鸿勋惠读看云吟稿作长歌奉柬即送其南还
4932,鸣皋歌奉饯从翁清归五崖山居
71177,合肥束遂庵学正画君山酹月图长歌奉谢
700033,参议李公次前韵二首见示赓歌奉荅
537062,梁长子自泰山归以百三十韵诗见誇因成俚歌奉嘲
675032,刘元瑞赠剑作短歌奉酬
1160313,泛舒城南溪赋得沙鹤歌奉饯张侍御赴河南元博士赴扬州拜觐仆射
871394,怀仙楼歌奉呈鹤林尊友
1077567,唐植甫左司许出示所藏红丝砚辄成短歌奉呈并简顾子美
56658,雪山歌奉寄彭太保
1168400,鸣皋歌奉饯从翁清归五厓山居
6293,轮台歌奉送封大夫出师西征
246407,子夜歌·奉题石窗夜坐图
574277,松棚歌奉次涯翁先生
479664,敬亭见和山行有李杜齐能之句虽主押韵而亦非所当也因歌奉答拜写近怀
505164,好静轩歌奉教赋
466048,子夜歌 奉题石窗夜坐图二首
