100918,书王定国所藏烟江叠嶂图
199743,鲜于大任自东南归唐安遗予张安国所作水调歌
830206,耶路萨冷观犹太人哭所罗门城壁男妇百数日午凭城泪下如糜诚万国所无也惟有教有识故感人深远吾念故国辄为怆然
735764,诏观西洋国所进狮子因获遍阅虎圈诸兽敬制长句纪事和高阳相公
921690,书王定国所藏王晋卿画《著色山》二首 其一
597763,题黄州刘使君旧隐其堂上有徐相国所赠诗章在焉
99844,书王定国所藏王晋卿画著色山
1065693,题刘均国所藏燕公山水图
1095785,凤鸣寺十八应真乃日本国所制密印僧典于沈氏沈施于凤鸣
972582,过曾季永见壁间张安国所书天下第一真仙之岩知有融州便托附贾季承书作二诗呈季永且怀季承 其一
636490,题英鸡黎国所画园林图
1123807,过曾季永见壁间张安国所书天下第一真仙之岩知有融州便托附贾季承书作二诗呈季永且怀季承
375414,凤鸣寺十八应真乃日本国所制密印僧典于沈氏沈施于凤鸣
979006,鲜于大任自东南归唐安遗予张安国所作水调歌墨本一轴且云明年复往吴下喜简作此
266272,诏观西洋国所进狮子因获遍阅虎圈诸兽敬制长句纪事和高阳相公
921670,书王定国所藏《烟江叠嶂图》
97121,过曾季永见壁间张安国所书天下第一真仙之岩
921691,书王定国所藏王晋卿画《著色山》二首 其二
972581,过曾季永见壁间张安国所书天下第一真仙之岩知有融州便托附贾季承书作二诗呈季永且怀季承 其二
1047804,奉酬伯昌志国所示古调
