181586,庚午腊中苦寒不雪不雪岭南之常而苦寒为希有
1105854,彦嘉通守当今之俊伟人也余心向慕之常以未获识君为恨兹因孔纯老遂有邂逅之适其何幸如此将归纯老置酒饯别仆实预坐酒数行纯老丐诗于彦嘉以记坐上笑谈之乐顷刻扫数百言挥毫落纸云烟飞动永叔所谓盈前尽珠玑一一难简汰者殆谓是邪索鄙句不敢以固陋辞辄和北庄二诗奉呈
922832,和兖弟与梁况之学士同作四绝句 呈况之常叔立之
457847,秦无赖子刘邦行季，少即游手好閒。然史之常则，小流氓皆成大事业，而成大事业者皆小肚肠。雄如项羽，乃曰富贵不还乡，如衣锦夜行，何论乎刘季。故刘季窃国，即骄其父兄曰：某业所就，孰与仲多？唐人唐彦谦过刘仲隐居之山，作诗云：千载遗踪寄薜萝，沛中乡里旧山河。长陵亦是闲丘陇，异日谁知与仲多。予读此，喜其语之冷峭深远，亦书一律
126763,恩怨吟·人之常情
253706,禁春·贫者士之常
1082555,彦嘉通守当今之俊伟人也余心向慕之常以未获识君为恨兹因孔纯老遂有邂逅之适其何幸如此将归纯老置酒饯别仆实预坐酒数行纯老丐诗于彦嘉以记坐上笑谈之乐顷刻扫数百言挥毫落纸云烟飞动永叔所谓盈前尽珠玑一一难简汰者殆谓是邪索鄙句不敢以固陋辞辄和北庄二诗奉呈 其二
916355,京师故人有以陇西鹦鹉遗予者因畜养之去年出守缙云提挈而至性灵甚慧触类能言公退玩之常若不足忽遇疾而逝因命瘗于小园作诗一章聊以追悼识者无罪予以贵畜也
142162,彦嘉能守当今之后伟人也余心向慕之常以未获
15617,伤时·常闻贫贱士之常
360342,吊屈原·放逐臣之常
549832,蓝生扩之常虑予召毁故作此解之 其一
1070727,海南有五色雀土人呼为小凤罕有见者苏子瞻谪居此郡绍圣庚辰冬再见之常作诗记其事公实以是年北归癸酉冬予亦两见之今二年矣乙亥八月二十二日会客陈氏园飞鸣庭下回翔久之众客惊叹创见因赋是诗
994098,送人之常德
549833,蓝生扩之常虑予召毁故作此解之 其二
3892,送方外上人之常州依萧使君
647459,答王之常
693632,蓝生扩之常虑予召毁故作此解之
647742,挽王之常先生
925435,韩簿之常山送行一首
504308,送顾仲明之常熟州教授
219730,韩簿之常山送行
1240596,怀寄强行之常州学官
481085,送徐守民归浙之常山
566529,送彭司训之常州
1025049,改祭修斋决疑颂 圆丘方泽，上下神明，国之常典。云何劝令断祭，奈太伤国风乎？颂曰：
647697,送王之常
1207681,送李用和之常熟知州
958442,庚午腊中苦寒不雪不雪岭南之常而苦寒为希有矣
566512,送谢同知之常州
73357,送李用和之常熟知州
549834,蓝生扩之常虑予召毁故作此解之 其三
1251009,青山相送迎 访王光福之常烟水居
672795,送杨太守恭莆之常州府
72262,怀寄强行之常州学官
121056,送人之常德
1077862,余来湖外临行与叔易奕而胜得铜炉制作精古爱之常置几案间感物怀人为赋此诗
183985,右呈况之常·偶陪嘉约出重闉
748804,一粟庵水榭与贝闰生话旧即送之常德
647472,题徐希孟云林卷兼柬王之常
1158669,送方外上人之常州依萧使君
63966,送徐守民归浙之常山
553836,送金元祺之常州教授
856360,彦嘉通守当今之俊伟人也余心向慕之常以未获识君为恨兹因孔纯老遂有邂逅之适其何幸如此将归纯老置酒饯别仆实预坐酒数行纯老丐诗于彦嘉以记坐上笑谈之乐顷刻扫数百言挥毫落纸云烟飞动永叔所谓盈前尽珠玑一一难简汰者殆谓是邪索鄙句不敢以固陋辞辄和北庄二诗奉呈 其一
549835,蓝生扩之常虑予召毁故作此解之 其四
788397,壬子岁九月七日吾弟怡贤亲王定窆于水东村朕念手足至谊兼以辅弼功勤献替忠款抚今忆昔情不能已因亲临奠送稍伸积痛夫神游于天魄藏于地亘古迄今理之常也但以吾弟之亲贤为国家柱石幽明异路于兹永别当深秋草木黄落之际朕心曷胜凄怆爰赋此诗以写怀
