544437,送吴文仲使君并怀参知睿父二首 其二
1086818,闽商货千叶牡丹疑其非而却之并怀蓝宪所许
757293,临江仙 其三 同纫兰四妹作，即呈雪兰大姊、蘅芳、蓉岑两妹，并怀顾羽素表妹，无锡王畹兰五妹
972463,次韵伯瑞见示并怀叔骥和叔
757300,临江仙 其十 同纫兰四妹作，即呈雪兰大姊、蘅芳、蓉岑两妹，并怀顾羽素表妹，无锡王畹兰五妹
559197,送浚川全山人归镛并怀萧广文宾竹五绝 其四
972940,复次韵呈沅陵诸丈并怀在伯二首 其一
974284,留元衡须月上因抄贾元放旧词并怀季承
967553,玉烛新 和方时父，并怀孙季蕃
752480,瘿厂过访奉赠一首并怀东原
602201,和陈明佐花朝韵并怀其弟明瞻
492251,送慧上人之九顿岭 其九 戍楼燕集呈熊子庄常子中岳维高并怀公衡万户
967570,念奴娇 其一 寒食次卢野涉，并怀孙季蕃
309866,绮罗香·春感并怀侯镇庭
757299,临江仙 其九 同纫兰四妹作，即呈雪兰大姊、蘅芳、蓉岑两妹，并怀顾羽素表妹，无锡王畹兰五妹
807841,贺新郎  弓冶弟万里省亲三年旋里，于其归也，悲喜交集，词以赠之，并怀卫玉叔暨汉槎吴子，即用赠苏昆生韵
413881,暑中怀客岁渡红海时情景追纪以诗并怀同舟诸子
807444,渡江云  扬州感旧追悼西樵荔裳伯吁介夫诸先生并怀阮亭豹人穆倩定九舟次无言诸公
695641,送浚川全山人归镛并怀萧广文宾竹五绝 其二
973077,闻刘凝远丈病已欣然成诗并怀伯瑞仲文叔骥二首 其一
543587,寄三衢易使君惟效约秋深为烂柯之游并怀蔡景明苏以脩
828801,赠念衣并怀左周二丈
559196,送浚川全山人归镛并怀萧广文宾竹五绝 其三
1089655,送德友之长沙章贡并怀薛叶二兄
380052,石湖仙·又题花滩渔唱词稿并怀其楼居之胜
757301,临江仙 其十一 同纫兰四妹作，即呈雪兰大姊、蘅芳、蓉岑两妹，并怀顾羽素表妹，无锡王畹兰五妹
833582,少年游 得王子常同年凤阳书，并示《春感》四阕，即次来韵，并怀逸珊夫人 其一
972939,复次韵呈沅陵诸丈并怀在伯二首 其二
1250675,至正庚寅二月十六日同韩秀才发都门南归并怀陈检讨
369182,临江仙·同纫兰四妹作，即呈雪兰大姊、蘅芳、蓉岑两妹，并怀顾羽素表妹，无锡王畹兰五妹
254180,郁庵藏兵之骆越王弓格剑并怀蚩尤大帝
341796,闽商货千叶牡丹疑其非而却之并怀蓝宪所许
1247877,九日黄州作并怀建上二友
295412,意难忘·寄萍庵并怀仲宣
543675,蚤春苦雨邦相明府见过留饮斋中竟夕走笔放歌为今雨行并怀燕社诸子
544436,送吴文仲使君并怀参知睿父二首 其一
697100,送吴文仲使君并怀参知睿父二首
973076,闻刘凝远丈病已欣然成诗并怀伯瑞仲文叔骥二首 其二
501258,丙寅乡贡同宁德黄君泽韩君瑕林鹤山登幔亭峰今十五年矣赋此并怀黄子肃同年
1146703,首秋闻雁并怀敦煌知己
559194,送浚川全山人归镛并怀萧广文五绝 录一
757291,临江仙 其一 同纫兰四妹作，即呈雪兰大姊、蘅芳、蓉岑两妹，并怀顾羽素表妹，无锡王畹兰五妹
473867,灯夕同陆姬过胡姬并怀侯双
764296,满江红 其十 顾庵有再柬西樵兼怀京洛故人之作，再用前韵奉酬并怀公㦷周量诸子
757297,临江仙 其七 同纫兰四妹作，即呈雪兰大姊、蘅芳、蓉岑两妹，并怀顾羽素表妹，无锡王畹兰五妹
845275,少年游 得王子常同年凤阳书，并示《春感》四阕，即次来韵，并怀逸珊夫人
98589,闻刘凝远丈病已欣然成诗并怀伯瑞仲文叔骥
757302,临江仙 其十二 同纫兰四妹作，即呈雪兰大姊、蘅芳、蓉岑两妹，并怀顾羽素表妹，无锡王畹兰五妹
757295,临江仙 其五 同纫兰四妹作，即呈雪兰大姊、蘅芳、蓉岑两妹，并怀顾羽素表妹，无锡王畹兰五妹
304595,赠念衣并怀左周二丈
974509,邂逅孙子仪于临安喜而赋诗并怀子进子肃
95202,邂逅孙子仪于临安喜而赋诗并怀子进子肃
95557,次韵伯瑞见示并怀叔骥和叔
457413,郁庵藏兵之骆越王弓格剑并怀蚩尤大帝
757298,临江仙 其八 同纫兰四妹作，即呈雪兰大姊、蘅芳、蓉岑两妹，并怀顾羽素表妹，无锡王畹兰五妹
1217601,雨夜同天台道士郑蒙泉话旧并怀刘子彝
972206,马上读子肃诗集并怀子进子仪
96849,马上读子肃诗集并怀子进子仪
621069,至武林严印持子岸乔梓见招闻子将从山中特至罗文止乍病不赴予复以曹木上钱殷求缪湘芷三子邀向湖上不得往因寄以诗并怀同集沈昆铜张天生冯千秋诸子
807857,贺新郎  舟泊枫桥，同吴广璧小饮金苇昭斋中，归过寒山寺，因忆昔年阮亭王先生入吴，夜已曛黑，风雨杂遝，阮亭摄衣著屐，列炬登岸，径上寺门，题诗二绝而去，一时以为狂。今别去六七年矣，怅然赋此并怀阮亭
768741,石湖仙 又题花滩渔唱词稿并怀其楼居之胜
1123731,复次韵呈沅陵诸丈并怀在伯二首
283108,暑中怀客岁渡红海时情景追纪以诗并怀同舟诸子
749282,孙琴西廉访次唐端夫东坡生日诗韵追念湘乡师相属和奉呈并怀钱子密
96790,留元衡须月上因抄贾元放旧词并怀季承
569912,王丈太仆得余前寄诗辄步五章见报敬迭奉谢并怀贤从故侍御 其一
360293,留别正阳书院诸生并怀邵二云编修
820433,意难忘 寄萍庵并怀仲宣
710176,过白石村访唐明藜聓其从兄明犀久游未归因并怀之
301177,过白石村访唐明藜聓其从兄明犀久游未归因并怀之
830376,九日节庵招集广化寺同陈仁先曾寿潘吾刚清荫伍叔葆铨萃江霞君孔殷感和节庵并怀伯严江南
545068,人日邦相过访小斋留集至暮分得寻字并怀燕社曩岁之集
362897,次韵赠蒋师退时偕洪稚存客维扬并怀高东井
353369,送德友之长沙章贡并怀薛叶二兄
97384,复次韵呈沅陵诸丈并怀在伯
807320,水调歌头  夜饮季端木斋中归忽尔飞雪填词奉柬并怀尊甫孚公
544612,载别静父瀫元二宗人并怀徐陈茅王四子
834745,琵琶仙 己卯清明，同游古林庵，祭管异之先生同，修竹便娟，池塘一碧，丙子夔州东屯之游正复似之。赋此柬同游，并怀漱泉
757294,临江仙 其四 同纫兰四妹作，即呈雪兰大姊、蘅芳、蓉岑两妹，并怀顾羽素表妹，无锡王畹兰五妹
1123669,闻刘凝远丈病已欣然成诗并怀伯瑞仲文叔骥二首
786405,答林幼春并怀林十及梁钝庵
545624,寄周懋修文学并怀殷无美职方
813670,临江仙 同纫兰四妹作，即呈雪兰大姊、蘅芳、蓉岑两妹，并怀顾羽素表妹，无锡王畹兰五妹
830836,得沤尹吴中书偶成转韵二百八十字寄答并怀大鹤
545891,答世叔通侯见讯并怀说仲词盟
807468,念奴娇  送朱近修还海昌并怀丁飞涛之白下送既庭返吴门仍用顾庵韵
559198,送浚川全山人归镛并怀萧广文宾竹五绝 其五
268468,得沤尹吴中书偶成转韵二百八十字寄答并怀大鹤
757296,临江仙 其六 同纫兰四妹作，即呈雪兰大姊、蘅芳、蓉岑两妹，并怀顾羽素表妹，无锡王畹兰五妹
757292,临江仙 其二 同纫兰四妹作，即呈雪兰大姊、蘅芳、蓉岑两妹，并怀顾羽素表妹，无锡王畹兰五妹
422585,绮罗香    春感并怀侯镇庭
559195,送浚川全山人归镛并怀萧广文宾竹五绝 其二
62935,灯夕同陆姬过胡姬并怀侯双
769658,沁园春·忆同李凉肆过刘蔚园水亭，饮烧春于蔷薇花下，醉后题记壁间，乃丁丑浴佛前一日也。丙戌同刘子客何阜，适是日过其寓。话及兹事，忽复十年，怆然赋此，并怀凉肆
545614,再入武林柬王水部并怀蔡南宫
