730246,次韵题章侯博古牌刻本三首选二 其二
51080,是日往观果刻本盖世贤招饮恐客不至故绐尔乃
283761,踏莎行·题云间邦彦图刻本，寄张琢丈
483522,尝见石刻本华山图以为形似不过如此及既登而还重见于姜月心家不觉失笑因书此于其上
759558,西园重见诗畸刻本，为之黯然
729772,踏莎行  题明叶绸鸳鸯梦传奇崇祯丙子刻本
274211,沈棠溪至赠所撰古文刻本别逾十年君
264025,踏莎行·题明叶绸鸳鸯梦传奇崇祯丙子刻本
293522,次韵题章侯博古牌刻本
85230,西园重见诗畸刻本为之黯然
749787,杨忠悯公谏马市劾严嵩两疏稿石刻本
479026,是日往观果刻本盖世贤招饮恐客不至故绐尔乃复次韵
1237894,刘商观弈图石刻本
815602,次韵题章侯博古牌刻本三首选二
69092,刘商观奕图石刻本
749939,沈棠溪至赠所撰古文刻本别逾十年君今年七十有七犹以著述自课情话移时皆切磋语也
730208,叠前韵题陈章侯博古牌刻本 其二
293512,叠前韵题陈章侯博古牌刻本
730207,叠前韵题陈章侯博古牌刻本 其一
53024,尝见石刻本华山图以为形似不过如此及既登而
293547,三题章侯画博古牌刻本次前韵
730245,次韵题章侯博古牌刻本三首选二 其一
815597,叠前韵题陈章侯博古牌刻本
730201,三题章侯画博古牌刻本次前韵 其二
730200,三题章侯画博古牌刻本次前韵 其一
815595,三题章侯画博古牌刻本次前韵
419693,踏莎行 题云间邦彦图刻本，寄张琢丈
