1129134,宣和甲辰岁开十日予欲束衣随淮水东下锦官常禅人且合掌请语因留三绝
1012215,宣和甲辰岁开十日予欲束衣随淮水东下锦官常禅人且合掌请语因留三绝 其二
438508,田器之燕子图　器之自叙云明昌丙辰予从军塞外合虏里山野舍荒凉难以状言春末有双燕亦巢此屋土人不之识屡欲捕之予曲为全护此燕昼出夜归予必开户待之忽一日飞止坐隅都无惊畏巧语移时不去予始悟明日秋社此鸟当归殆留别语也因作一诗赠之云几年塞外历崎危谁谓乌衣亦此飞朝向芦陂知有为莫投茅舍重相依君怜我处频迎语我忆君时不掩扉明日西风悲鼓角君应先去我何归此诗以细字写之为蜡丸系之燕足上明年四月予受代归又八年泰和甲子任潞州观察判
1159418,元和甲午岁诏书尽徵江湘逐客余自武陵赴京宿于都亭有怀续来诸君子
883069,和甲辰秋夜读书有感韵
1012213,宣和甲辰岁开十日予欲束衣随淮水东下锦官常禅人且合掌请语因留三绝 其三
1012572,宣和甲辰三月三日山谷寺偶成是时欲下长芦也
1012214,宣和甲辰岁开十日予欲束衣随淮水东下锦官常禅人且合掌请语因留三绝 其一
373326,政和甲午孟冬休后一日苏过叔党彦明自开化甘泉至明仙时念老禅师复出世矣因题诗壁间
1065966,政和甲午孟冬休后一日苏过叔党彦明自开化甘泉至明仙时念老禅师复出世矣因题诗壁间
167569,追和陈去非宣和甲辰重九韵
1133196,追和陈去非宣和甲辰重九韵
184254,和甲辱秋夜读书有感韵
