138765,仙馆·仙境清闲识者稀
1228948,癸巳冬至李君时可同客柔川追感永嘉旧游以诗为赠当己丑岁会永嘉时十月桃花盛开气如春半识者忧其不祥既而果然就用前韵因并及之
197393,赠王平甫·当世所交识者稀
242302,别高家店·独抱朱弦识者稀
1085052,叔父宝印师往永嘉妙果院未期年而退弟子德纯住龙翔一日归省其师亦退居林下缁素挽留之乃遁于异郡不踰月间师弟子相继退休识者高之目为僧中二疏某窃禄将一考矣有愧二高僧因书一绝庶几他日或蹈其高躅云
916355,京师故人有以陇西鹦鹉遗予者因畜养之去年出守缙云提挈而至性灵甚慧触类能言公退玩之常若不足忽遇疾而逝因命瘗于小园作诗一章聊以追悼识者无罪予以贵畜也
459264,献冲访许间夕老师不遇，余语频老师初识者，邀宿其家。次日即登连云，暮归而其祖母卒，甚难为怀。此诗书于溪石之背，石在连云小学侧，八六年予始游，亦坐此石作诗也
934934,九月十八夜梦避雨叩一僧院有老宿年八十许邀留甚勤若旧相识者梦中为赋此诗
231998,秦侯不调累年识者叹息兹以规恢秘略亲简上知
505558,读和古体凡二十有六韵丰腴醇重有顺无彊第其间与予过实君子宁失于厚公则有之受而不惭正恐不免见讥于识者别用奉答以谢愚拙时戊辰六月癸亥朔日也
1094232,上饶登科八人所识者四
519885,有旧识者自广南以椰子孔雀见寄
963022,用绰中韵送正臣正臣欲归隐而无资故广其意以告识者云尔
948826,新光州守赵师奭字国佐才高一世仕京口以谗废宰太和以忧归得郡待对没于逆旅家会稽又遭焚识者闵之今既葬矣其子寄行状求追挽嗟悼不足情见乎辞
501481,二十七日晚到万安县县令冯仲文来问劳翌日登岸观故宋贾相秋壑所居故址左城隍祠右社稷坛中为龙溪书院其后二乔木郁然云贾相生于此书院旧甚盛田多于邑学今归之官独旧屋前后二间中存先圣燕居像左四公木主徘徊久之当宋季年君臣将相皆非气运方兴者敌襄樊无策可救江左人材眇然无可为者譬之奕者不胜其偶无局不败是时有识者为崔菊坡叶西麓无已则为文山李肯斋可也而痴顽已甚贪冒富贵国亡家丧为千载骂笑而刻舟求剑者乃区区议其琐琐之陈迹悲夫因
1076216,全一道人分以石芝味极平淡咀留牙颊间良久乃甘而世罕有识者或云九华山中亦有之二首 其一
821364,蝶恋花 绣谷在灵岩山下，邑人辟其地为公墓。摩挲碑识，多旧相识者
803321,岁壬子，余在赵家马头村佣书时值清明佳节，率徒散步闲游，误入仙境。但见桃李斗艳，梅柳争春，灿烂芳菲，四无涯际，真乐景也。即命徒杏村沽酒，开筵坐花，畅饮狂歌，不觉颓然大醉。稍醒，思饮茶而不得。适有一小徒，偶摘隔年干霜杏数枚敬余，或亦望梅止渴之意也。余恍然曰：昔闻识者云，霜杏烹茶，清香无比，何不试之？急归家觅竹炉，生活火，净石铫，盛甘泉，烹霜杏以饮。未入口，即清香扑鼻，不禁拍案惊奇曰：孰意以天之弃物，竟
917525,秦侯不调累年识者叹息兹以规恢秘略亲简上知有诏复其官亨衢自此发轫闻之喜甚为作古篇
803323,岁壬子，余在赵家马头村佣书时值清明佳节，率徒散步闲游，误入仙境。但见桃李斗艳，梅柳争春，灿烂芳菲，四无涯际，真乐景也。即命徒杏村沽酒，开筵坐花，畅饮狂歌，不觉颓然大醉。稍醒，思饮茶而不得。适有一小徒，偶摘隔年干霜杏数枚敬余，或亦望梅止渴之意也。余恍然曰：昔闻识者云，霜杏烹茶，清香无比，何不试之？急归家觅竹炉，生活火，净石铫，盛甘泉，烹霜杏以饮。未入口，即清香扑鼻，不禁拍案惊奇曰：孰意以天之弃物，竟
277225,华清·城郭休过识者稀
343861,伯牙琴台·流水音孤识者稀
1120861,全一道人分以石芝味极平淡咀留牙颊间良久乃甘而世罕有识者或云九华山中亦有之二首
1076217,全一道人分以石芝味极平淡咀留牙颊间良久乃甘而世罕有识者或云九华山中亦有之二首 其二
689764,二十七日晚到万安县县令冯仲文来问劳翌日登岸观故宋贾相秋壑所居故址左城隍祠右社稷坛中为龙溪书院其后二乔木郁然云贾相生于此书院旧甚盛田多于邑学今归之官独旧屋前后二间中存先圣燕居像左四公木主徘徊久之当宋季年君臣将相皆非气运方兴者敌襄樊无策可救江左人材眇然无可为者譬之奕者不胜其偶无局不败是时有识者为崔菊坡叶西麓无已则为文山李肯斋可也而痴顽已甚贪冒富贵国亡家丧为千载骂笑而刻舟求剑者乃区区议其琐琐之陈迹悲夫因
816103,岁壬子，余在赵家马头村佣书时值清明佳节，率徒散步闲游，误入仙境。但见桃李斗艳，梅柳争春，灿烂芳菲，四无涯际，真乐景也。即命徒杏村沽酒，开筵坐花，畅饮狂歌，不觉颓然大醉。稍醒，思饮茶而不得。适有一小徒，偶摘隔年干霜杏数枚敬余，或亦望梅止渴之意也。余恍然曰：昔闻识者云，霜杏烹茶，清香无比，何不试之？急归家觅竹炉，生活火，净石铫，盛甘泉，烹霜杏以饮。未入口，即清香扑鼻，不禁拍案惊奇曰：孰意以天之弃物，竟
803322,岁壬子，余在赵家马头村佣书时值清明佳节，率徒散步闲游，误入仙境。但见桃李斗艳，梅柳争春，灿烂芳菲，四无涯际，真乐景也。即命徒杏村沽酒，开筵坐花，畅饮狂歌，不觉颓然大醉。稍醒，思饮茶而不得。适有一小徒，偶摘隔年干霜杏数枚敬余，或亦望梅止渴之意也。余恍然曰：昔闻识者云，霜杏烹茶，清香无比，何不试之？急归家觅竹炉，生活火，净石铫，盛甘泉，烹霜杏以饮。未入口，即清香扑鼻，不禁拍案惊奇曰：孰意以天之弃物，竟
501480,二十七日晚到万安县县令冯仲文来问劳翌日登岸观故宋贾相秋壑所居故址左城隍祠右社稷坛中为龙溪书院其后二乔木郁然云贾相生于此书院旧甚盛田多于邑学今归之官独旧屋前后二间中存先圣燕居像左四公木主徘徊久之当宋季年君臣将相皆非气运方兴者敌襄樊无策可救江左人材眇然无可为者譬之奕者不胜其偶无局不败是时有识者为崔菊坡叶西麓无已则为文山李肯斋可也而痴顽已甚贪冒富贵国亡家丧为千载骂笑而刻舟求剑者乃区区议其琐琐之陈迹悲夫因
372154,上饶登科八人所识者四
235273,过泾邑水西县尹先伯祖尝为邑簿领耆儒有识者
1033550,侄孙炳以东野农歌一编来细读足以起予七言有汲水灌花私雨露临池叠石幻溪山草欺兰瘦能香否杏笑梅残柰俗何似此两联皆自出新意自可传世然言语之工又未足多其体格纯正气象和平为可喜余非谀言自有识者因题其卷末以归之
887957,过泾邑水西县尹先伯祖尝为邑簿领耆儒有识者
281259,学书·信笔涂鸦识者嗤
