547142,游蜀山湖歌示任城王甥季辅
737376,题任城太白酒楼
439386,元光间予在上龙潭每春秋二仲月往往与元雷游历嵩少诸蓝禅师汴公方事参访每相遇辄挥毫赋诗以道閒适之乐今犹梦寐见之儿子渭近以公故抵任城禅师附寄诗以叙畴昔未几驻锡东庵因造谒间出示裕之数诗醉笔纵横亦略道嵩游旧事感叹之馀漫赋长句二首
748195,丙午九月自东里抵任城与茝坪弟夜话
544564,龚使君合祀供奉拾遗于任城纪事三十韵
568579,任城题杨訚直夫泉香书屋二首 其一
779640,清平乐 书任城店壁，壁上多明季公车名士留题之作，缕经垩抹，不复可认，因撮其字句，连缀为词
529057,放任城南闸
1168730,赠任城卢主簿
7560,与任城许主簿游南池
1172737,与任城许主簿游南池
365032,过任城谒田直孺
438674,元光间予在上龙潭每春秋二仲月往往与元雷游历嵩少诸蓝禅师汴公方事参访每相遇辄挥毫赋诗以道閒适之乐今犹梦寐见之儿子渭近以公故抵任城禅师附寄诗以叙畴昔未几驻锡东庵因造谒间出示裕之数诗醉笔纵横亦略道嵩游旧事感叹之馀漫赋长句二首 其一
476786,任城太白楼
979532,复用前韵答十五叔父任城相会见和诗任城有李白旧游处录于诗中
979532,复用前韵答十五叔父任城相会见和诗任城有李白旧游处录于诗中
380344,任城太白酒楼
1227365,任城南
370341,次韵子任·城郭秋风晚
333171,任城使院晤翁霁堂有赠
568580,任城题杨訚直夫泉香书屋二首 其二
1041231,任城道中
4966,赠任城卢主簿
677110,任城舟中得家报述怀 其一
677112,游任城南池
383313,任城魏松轩山人携琴见过从游溪山数日书赠
534464,任城登太白楼
547396,任城魏松轩山人携琴见过从游溪山数日书赠
1232642,续兰亭会补任城吕系诗
668529,再次宿任城韵
1046670,过任城谒田直孺
677278,任城舟中题画 其一
595990,任城别郑十四归江东
545588,任城待闸再柬龚观察子勤二首 其二
677279,任城舟中题画 其二
604337,自大野至任城口号
802061,任城使院晤翁霁堂有赠
750732,任城太白酒楼
677111,任城舟中得家报述怀 其二
600435,过任城兵宪丘厚山年丈邀同廉宪王竹阳年丈宴集南池
327885,寄夫人·任城避暑平安否
165495,复用前韵答十五叔父任城相会见和诗任城有李
165495,复用前韵答十五叔父任城相会见和诗任城有李
691561,任城舟中得家报述怀
559849,送陈主事谟归省分题得任城酒楼
438675,元光间予在上龙潭每春秋二仲月往往与元雷游历嵩少诸蓝禅师汴公方事参访每相遇辄挥毫赋诗以道閒适之乐今犹梦寐见之儿子渭近以公故抵任城禅师附寄诗以叙畴昔未几驻锡东庵因造谒间出示裕之数诗醉笔纵横亦略道嵩游旧事感叹之馀漫赋长句二首 其二
1168231,对雪奉饯任城六父秩满归京
697251,任城待闸再柬龚观察子勤二首
691583,任城舟中题画
5171,对雪奉饯任城六父秩满归京
693761,任城题杨訚直夫泉香书屋二首
1232643,续兰亭会补任城令吕本诗
740659,任城李太白酒楼歌
751780,十一月二十八日移入任城梦园是日为王宜人忌日感而有作
545587,任城待闸再柬龚观察子勤二首 其一
748193,任城送姜锡山归蓬莱
