991901,正月二十四日同江邻几韩持国过师商庙
105697,正月二十四日同江邻几韩持国过师商庙
842789,六月十四日同林行陀方策六李子新钟惺西郭芸屏李石芝王彦和陈易园逭暑小雄山斋 其一
949856,治平乙巳暮春十四日同宋复古游山巅至大林寺书四十字
188934,庚戍正月十四日同友人丁晋年王蔚之谒普照塔
1124197,八月二十四日同审知登塔山用审知前载九日留题之韵作二首时彦博归及常山
842790,六月十四日同林行陀方策六李子新钟惺西郭芸屏李石芝王彦和陈易园逭暑小雄山斋 其二
1003960,十四日同张伯修罗坚甫大智赏月探韵即事感兴殊激懦衷翌日会保福辱诗示教借张大韵同赋
163610,十四日同张伯修罗坚甫大智赏探韵即事感兴殊
868918,临江仙 其九 十一月二十四日同王幼安、洪思诚过曾存之园亭
842948,四月十四日同嘿园宰平游上方山至兜率寺
95409,八月二十四日同审知登塔山用审知前载九日留
844023,六月十四日同林行陀方策六李子新钟惺西郭芸屏李石芝王彦和陈易园逭暑小雄山斋
973677,八月二十四日同审知登塔山用审知前载九日留题之韵作二首时彦博归及常山 其一
491790,七月十四日同王徵君萧国录游云峰寺观壁间旧画墨龙有感
973676,八月二十四日同审知登塔山用审知前载九日留题之韵作二首时彦博归及常山 其二
