518793,乌符观读吕仙诗刻忽报蓝祁阳改知嘉善喜赋二绝为别 其一
608308,高正甫出守袁州九月九日予偕家兄暨诸亲友能文者十九人饯之毗卢阁赋诗为别 其一
659612,萧侍御两湖纡道云庄短章为别 其一
989012,小三侄远持兄嫂之命见访于荒寒寂寞中将归二诗为别 其一
594178,周计部元孚被播南行答其临清所寄因以为别 其一
534204,雨后饿姚元白还金陵召歌者蒒成侑酌醉后赋此为别 其一
1001660,表兄峡山萧伯钧至会昌久之以归欤字韵丐诗为别 其一
849121,次青溪后二章为别 其一
850303,君表自西林还城中以诗二首为别 其一
614959,刘觐国观察斋捧便道归省佘买舟相访追欢数日值束装还治匆匆分袂赋此为别 其一
922131,追饯正辅表兄至博罗，赋诗为别 其一
532510,草堂前芙蓉正吐口占数绝为别 其一
630674,康熙庚戌孟秋制府周彝初持服北归道出韶石订入山不果赋诗三首奉柬兼以为别 其一
760252,实甫将行赋此为别 其一
860678,次韵何子应留诗为别 其一
1095275,次宫讲于素斋韵为别 其一
1088064,二诗奉酬敬夫赠言并以为别 其一
598539,筠台戴郡公枉驾敝庐赋此为别 其一
627150,奉新署中赠冯调冶且以为别 其一
644754,承宜隐友兄同还精舍赋短律五首为别 其一
563864,林汝桓以二诗寄次韵为别 其一
1222516,忽剌木御史还台索诗二绝为别 其一
715296,王观察招食嘉鱼率赋兼以为别 其一
1099771,雨山徐总管袖诗见访以道间见梅而作少留一夕次韵为别 其一
570874,上人将谒补陀过金陵谒诗为别 其一
