419588,双调忆江南 前词二王并答，又见许贞卿先生和作，有调无腔，遂为琬琰之藉，复有所能，随叠元韵江南忆
688857,小金山既分赋后诸子谓望气楼环翠亭二公遂为兹山香火宜有专赋用志所怀遂篝灯各赋一首二首
857351,嘉泰二年岁在壬戌正月八日携家还里幕中诸友远来饯别同游乳洞遂为终日之款因成古风一章
545275,抵太函适汪司马赴许将军泛舟余遂为不速之客座中分赋
981239,转运度支得青州资政黄素书韩吏部伯夷颂许昌相以以诗跋尾遂为七言因而寄及谨用拙篇纪咏
917664,经略龙图开拓曾公岩景物一新遂为诸岩之冠因成拙诗投之
956562,李翚知县作亭西湖上余用东坡语名之曰饮绿遂为胜概
618163,小金山既分赋后诸子谓望气楼环翠亭二公遂为兹山香火宜有专赋用志所怀遂篝灯各赋一首二首 其一
1214521,吴中汤孟实余闻之衍师道原同居七世矣能率正其家人庭无间言室无私藏诸舍少有不律辄晨起盛服至其寝门引咎自责必改而后止天子赐复以表孝义之门馆阁名臣皆为诗歌美之余虽未见君子中心藏之矣遂为之诗所谓不必寄元也
572057,王回先一夕尚痛饮叫笑如常时侵晓三弟来云回病且革以为戏也急往观之回奄然逝矣遂为长律哭之
883063,邑人李子宽公绰以所著十说及论孟解相示极有可敬而老且贫只一子又丧之遂为无告之民复以诗见投览之悽然赠以八句
459260,十一月十五共肖往平江，访旧所历，游连云山，随行随书。及归，更补怪木、果蜕二章。岳阳汽车站遇老人弹凤凰琴，久听彷徨，有不能为怀者。略资其困，与接言甚欢，遂为吾缕述其事。车上记之
457987,二零零一年末夜梦与段学俭兄谈诗，梦中复梦，得断句曰：“潮头断艇波还下，月底惊云骏以奔”。既醒，不识其意。然时复忆及梦中断艇，遂为足成一律
700725,读刘使君诗，遂为却寄
618164,小金山既分赋后诸子谓望气楼环翠亭二公遂为兹山香火宜有专赋用志所怀遂篝灯各赋一首二首 其二
1208625,鉴湖水送乌希说（希说以至元丙子夏由史属代祀北岳济渎南至会稽腊残求赠言适笺尾腊文有鉴湖水之语遂为题赋诗饯之予以至顺癸酉使过绍兴不得一至湖上至今歉然）
1159976,乐天是月长斋鄙夫此时愁卧里闾非远云雾难披因以寄怀遂为联句所期解闷焉敢惊禅
575514,读刘使君诗，遂为却寄 其一
456022,颈椎久病医者嘱馀多昂首以矫之遂为矫首一绝
524125,病甚与亲友诀别遂为绝笔
505803,郡庠胡子温以杨侯所题弓求赋遂为书此
637595,有自西川来镇远者使獭捕鱼甚巧周翠渠同何贰守观之欲赋未就间以语予遂为四句
608133,臬长李公之堂有雉忽来驯扰若家鸡数日后锦羽焕烂此治世文明之象异类驯服之符也一时缀文之士咸作诗侈其事予遂为歌歌曰
569016,封户部大夫次泉李德润先生其先自关中徙豪卫京师遂为京师人补博士弟子通经术有声而不获第有子今仪部君早达以其官封先生不色喜惟杜门读书缮性而已仪部用直言获谴先生不色忧旋被召迁今官迎先生养先生亦不色喜其夷然泊然者如故也弇州生闻之曰先生其有道者欤选部魏子曰子以先生有道者则子之言遍天下而乃啬于有道者何也辞弗获已为古风一章歌以寿之
757136,自日本东京拟回国至赤马关闻国中有变诣山寺恸哭遂为缟服有遐举之志
1099875,昔与诸友同登香城最胜阁有长歌一首今壁题已失仅记炊烟不尽愁不尽七字追怀往事遂为律体以足之
497346,北游诗二十一首 其十九 江上逢客遂为金焦之游
496474,锦鹧鸪 三更一笛一联，胡仲父落梅之句也。词人所称，予惜不见其全篇，遂为足之
1045933,岷峨王高士赍牟中秘墨帖来求跋自言能护真气鍊大丹罹兵祸而辍同辈有志于斯事者皆然又言老人村凡二三百岁者亦皆死于兵嗟夫兵之祸生灵甚矣祸蜀则尤惨祸及高士更不轻矣遂为之赋诗
580759,新都杨君铅山费君全州蒋君同邑张君钟君有世讲之会而吾弟叔永与焉特作此小诗用识老怀喜乐之意诸君他日更倡叠和联成一轴并请吾石淙石斋二老先生各为训戒法语于前后又安知此轴不遂为通家之张本也哉
575515,读刘使君诗，遂为却寄 其二
888773,昔杯渡禅师自西域开山隐静止携五叶松来岁月既远余求此山中之松已化为乌有矣护国远老知余此意遍搜之天台山中得于玉霄峰下移以见饷遂为林下之光因诗以谢之
459742,予往临湘，倚车窗假寐，遂梦与薛辈驱车欲观海，车中议论激烈，为赋诗云：踪迹未随槎入汉，心胸先替海生潮。然左回右折，终未至海而醒。梦中句盖昔年往天津观海车中断句，久已忘失者，遂为补足。或舟车，或步行，将有所往，而卒不能达，此予所屡梦者。不特梦也，醒中亦岂异是
1223346,萧姓渊善鼓琴予尝为之作我思操今自和林归再任巡徼之职于江南比行又求予诗遂为赋汉铜马式歌以送之
1248989,萨仲明为丞相府掾时僦居京师名其轩曰半野后买宅延陵亦揭是名于轩因雨宿其下遂为赋诗云
