540126,谢万曰忠并询之 其二
1075210,米元章为须江太守闻有怪石在河壖莫知其所自来人以为异而不敢取公命移置州沼为燕游之玩石至而惊遽命设席拜于庭下曰吾欲见石兄二十年矣闻者以为言坐是罢去余游濡须而石犹在询之邦人信然乃作此诗
960933,沿江买鱼不得询之则前此多为官船所强取故有亦言无因成三绝 其三
546396,邦相游烂柯不遂戏为四绝询之 其三
540128,谢万曰忠并询之 其四
1037013,刘泾新收唐绢本兰亭作诗询之
336616,梅圣俞尝为建德尉仆过是邑询之果然且言今有梅公堂在焉
960615,沿江买鱼不得询之则前此多为官船所强取故有亦言无因成三绝 其一
790180,约蓉姊不至以诗询之
546394,邦相游烂柯不遂戏为四绝询之 其一
583198,徐州春日野望徐俗不作土询之故老云徐州是卧牛城打春则人不安
1076259,梅圣俞尝为建德尉仆过是邑询之果然且言今有梅公堂在焉
546455,客有至自吴门者传周公瑕媵人将就馆喜而为诗询之
187100,沿江买鱼不得询之则前比我为官船所强取故有
697360,邦相游烂柯不遂戏为四绝询之
483495,华山西北夹路皆荷花望不知其顷之为几大石小石错杂乎中边询之途人有老者云此地本山址昔因崩而下陷故水聚荷生
540127,谢万曰忠并询之 其三
447683,余屡至姥山，例随游人自北船塘登岸，庚寅秋取道南船塘，途中见萧瑟老院，闭门无人迹，询之竟淮军昭忠祠也
615134,舆地图载河池有智州山意为名胜询之州人无有知者口占一绝
759669,凤皇山下投宿文氏家，询之，盖信国公裔也，出其庐陵所刊族谱及公诗文集、自订年谱、遗像三、手书一幅见示，感而有作
865735,景定壬戌冬得数椽于城南慈感渡侧询之故老云距贾耘老旧址不远因作五言八句
546395,邦相游烂柯不遂戏为四绝询之 其二
960616,沿江买鱼不得询之则前此多为官船所强取故有亦言无因成三绝 其二
423824,绮罗香·缙云山下红树林立。询之土人，是黄楝树，繁艳不减于枫
683747,谢万曰忠并询之
546397,邦相游烂柯不遂戏为四绝询之 其四
264721,绮罗香·缙云山下红树林立。询之土人，是黄楝树，繁艳不减于枫
1122328,沿江买鱼不得询之则前此多为官船所强取故有亦言无因成三绝
540125,谢万曰忠并询之 其一
380334,约蓉姊不至以诗询之
