1222045,再次寿道韵二首 其二
1212052,去吴留别于寿道陈子平诸友 其一
1212053,去吴留别干寿道陈子平诸友
625818,寿道民祁太翁
1230955,至顺四年四月九日陪尚书王公叔能常博柳公道传州尹干君寿道钱翼之文学同游天平赋近体诗二首时范氏诸孙在焉
1237330,去吴留别于寿道陈子平诸友
899526,台城路/齐天乐 饯干寿道应举
1222043,次寿道韵二首 其二
1219397,送干寿道知州婺源
1233562,寄曹子讷于寿道二同年
1141841,次郑佥事送于寿道之慈湖长
1237117,次寿道韵二首
1236818,喜雪寄达监司，次寿道韵二首
1139022,送干寿道同知北上
679499,永寿道中
1224329,寄题傅尊师兄弟所作宁寿道院
1219310,至元丁丑夏五，宣城汪叔敬、吴人干寿道、丹丘柯敬仲、国人泰兼善同仆游天平，次往灵岩，有作奉和二首 其二 灵岩涵空阁
1236813,至元丁丑夏五，宣城汪叔敬、吴人干寿道、丹丘柯敬仲、国人泰兼善同仆游天平，次往灵岩，有作奉和二首 天平魏公祠
185312,送干寿道同知北上
1219383,寄吴江知州干寿道
617482,寿道民祁太翁
1141970,次干寿道陪曹许二丞山行
171359,舍去智寿·道义须知耐岁寒
1219357,喜雪寄达监司，次寿道韵二首 其一
1219309,至元丁丑夏五，宣城汪叔敬、吴人干寿道、丹丘柯敬仲、国人泰兼善同仆游天平，次往灵岩，有作奉和二首 其一 天平魏公祠
1222042,次寿道韵二首 其一
1030358,浦湘曲 为金坛教谕干寿道考满怅词
1219358,喜雪寄达监司，次寿道韵二首 其二
1237118,再次寿道韵二首
381923,次郑佥事送于寿道之慈湖长
1222044,再次寿道韵二首 其一
926006,清平乐 其一 寿道夫
