1248233,黄德让病后苦吟因赋诗以释之
873619,云岩竹源二禅俱与招客三月二十一日遂饭于竹源庵谋诸野则获也刘奇仲有约不至吴周宝游德华刘致中暨公望刘才仲陈圣叔某会焉从容辩论怀抱甚适因赋诗以纪之
1247978,吕山人将来游蜀山因赋诗以要之
1243765,七月望夕予曳杖步月直造峰顶高吟朗咏划然长啸兴尽而返明日山下居人咸言闻清啸惊醒尘梦者数十家予因赋诗以纪其事云
747190,博克达山之麓有溪出焉迤逦北流越乌垣东鄙入峡俗名水磨沟是也峡左有泉涌穿石隙会小泉数十道下注大溪溪岸嘉树茏葱野花错杂桥堤楼榭位置天然不意荒陬得此佳境因赋诗以记之
1226004,至元六年庚辰十又二月庚辰朔己亥大雨雪戊申复雨雪至七年辛巳正月朔旦己酉雨雪大作癸丑甲寅复大雪因赋诗以记
1249887,玉山雅集图者淮海张叔厚为玉山主人作也主人当花柳春明之时宴客于玉山中极其衣冠人物之盛至今林泉有光叔厚即一时景绘而成图杨铁史既序其事又各分韵赋诗于左俾当时预是会者既足以示不忘而后之览是图与是诗者又能使人心畅神驰如在当时会中展玩之馀因赋诗以记其后云
891012,州以隆名诚盛事也父老欢喜一词仆亦感且慰因赋诗以志其盛
850293,过紫极宫感道士卓玘遗迹因赋诗以续诸公哀辞之后
183227,过此极宫感道士卓玘遗迹因赋诗以续诸公哀辞
436296,卫生行之少负侠气与余兄弟相遇于艰难之际自抑惴惴常若不及迨今十五年矣家贫而益安岂果有所学乎不然何其舍彼而取此也生正月十六日诞弥日也因赋诗以赠为一笑乐且以坚其志云
