157862,水阁新成与潘胡二子小饮
900502,六月二十六日秀青亭初成与客同集
619579,有开新舟成与诸子同泛
531069,池上会心亭初成与客小饮
606215,新造舟成与客同泛二首 其一
496112,木兰花令 其一 嘉靖戊戌，京郎东堂新成，与费邸民悦、吴郎以容、唐田、时臣二弟夜酌
186465,六月二十六日秀青亭初成与客同集
174203,横翠堂成与诸公落之蒙贶佳篇不敢当也谩作数
206922,送蔡学正·鍊尽刚成与物和
588058,小楼成与诸戚友宴饮用杜韵二首 其一
1005377,水阁新成与潘胡二子小饮
606216,新造舟成与客同泛二首 其二
868922,临江仙 其十五 乙卯八月九日，南山绝项作台新成，与客赏月作
574254,与成与与新复至
742706,射圃草亭初成与同人较艺
304642,念奴娇·西溪词人祠堂落成，与祭，次吷庵韵
588059,小楼成与诸戚友宴饮用杜韵二首 其二
588692,仲夏酿荔枝酒成与欧麦二友同酌次韵一首因麦有及于天宝故事因及之
985243,横翠堂成与诸公落之蒙贶佳篇不敢当也谩作数语以纪其实
423527,惜红衣·丙午八月叔问营樵风别墅成，与沤尹造访，徘徊庭间，新月晚烟，光景可念。今年丛桂再华，昌绶方感秋卧病，沤尹独游吴中，因话鄙生，海滨索居无憀状，各赋佳什见寄。会有都门之行，不获面别，辄依韵奉和，为异日相思之资。凭楮依黯，不可为怀
748829,思范堂落成与永郡诸君宴集周迁安学博即席赋诗依韵答之
698687,木兰花令 嘉靖戊戌，京郎东堂新成，与费邸民悦、吴郎以容、唐田、时臣二弟夜酌
681410,鼎仪来并居新楼成与文量登贺次韵
497182,谢都尉新楼落成与山甫丈各赋诗赠之
820474,念奴娇    西溪词人祠堂落成，与祭，次吷庵韵
685026,小楼成与诸戚友宴饮用杜韵二首
685947,新造舟成与客同泛二首
