509639,赵总兵诗贺东广平次韵酬答二首 其二
603000,步韵酬答郑秀才肖筠
1010804,筼房暑中寄诗依韵酬答
445634,元韵酬答春蕊兄元夕诗见示
677607,自峨眉还眉州陈蒙山丈从锦城以诗讯问登山辞甚清妙依韵酬答
1123840,次韵酬答陈席庆伯见贻二首
49657,将之吴门李茂初诗邀看梅止余楼中次韵酬答
838789,谢石秋酒后赠句，即用原韵酬答 其一
96965,次韵酬答陈席庆伯见贻
297445,谢石秋酒后赠句，即用原韵酬答
470964,将之吴门李茂初诗邀看梅止余楼中次韵酬答
413338,程千帆寄诗见怀次韵酬答
838790,谢石秋酒后赠句，即用原韵酬答 其二
284001,程千帆寄诗见怀次韵酬答
595184,吴方伯苏原先生见寄佳作次韵酬答
1089381,再次韵酬答
972517,次韵酬答陈席庆伯见贻二首 其一
612403,秋夜与修公谈禅步投赠元韵酬答
509638,赵总兵诗贺东广平次韵酬答二首 其一
704054,赵总兵诗贺东广平次韵酬答二首
144936,筼房暑中寄诗依韵酬答
158170,次韵酬答胡一之
625758,应物上人至自雷峰以诗见贻次韵酬答
1048497,永康徐尉次寄颜令诗韵见寄因以前韵酬答
1088507,比与邻曲诸贤修举岁事携壶石马追补斜川之游而公济适至饮罢首出和陶之句以纪其胜辄亦用韵酬答兼呈诸同游者请共赋之
752383,乙盦以登高诗写寄又题后五言一首依韵酬答
999667,次韵酬答胡一之
345007,永康徐尉次寄颜令诗韵见寄因以前韵酬答
602999,步韵酬答吴秀才彦家
972516,次韵酬答陈席庆伯见贻二首 其二
973457,曾耆英自太和携所录谢民师观妙诗文副以长句见惠次韵酬答
1010540,余与筼房秋崖冬日会于沙溪春复会于龟溪适逢祠山诞辰二翁有诗见贻依韵酬答
281735,念奴娇·原韵酬答白野先生抄诗三十六卷
1238961,戊寅十二月丹丘柯博士过林下赋诗次韵酬答
416771,念奴娇 原韵酬答白野先生抄诗三十六卷，
72267,戊寅十二月丹丘柯博士过林下赋诗次韵酬答
406899,遁庵寄示《梦忆》诗，依韵酬答
843822,谢石秋酒后赠句，即用原韵酬答
