383924,山楼夕照·远望当归日
208608,有惠益母粉及当归者
365345,次韵和永叔岁旦对雪见寄时某于上源驿典护契丹朝正使人日当归前一日始得此诗
808437,蜀当归
438508,田器之燕子图　器之自叙云明昌丙辰予从军塞外合虏里山野舍荒凉难以状言春末有双燕亦巢此屋土人不之识屡欲捕之予曲为全护此燕昼出夜归予必开户待之忽一日飞止坐隅都无惊畏巧语移时不去予始悟明日秋社此鸟当归殆留别语也因作一诗赠之云几年塞外历崎危谁谓乌衣亦此飞朝向芦陂知有为莫投茅舍重相依君怜我处频迎语我忆君时不掩扉明日西风悲鼓角君应先去我何归此诗以细字写之为蜡丸系之燕足上明年四月予受代归又八年泰和甲子任潞州观察判
1042031,次韵和永叔岁旦对雪见寄时某于上源驿典护契丹朝正使人日当归前一日始得此诗
743597,梦五星坐山广下指一草示余云是当归感赋此章
142050,慈湖即事·嗟予留滞行当归
998500,廉夫有会当归去来之句复次前韵
115251,书声·屋山啼乌儿当归
884426,有惠益母粉及当归者
459555,是日酒馆饯行，大醉，遂拉薛与共至云溪，更饮肖家。夜半稍醒，二人尚酣然。次日薛当归，予以班不能送，作《贺新郎》留之。及薛归后，再赋《飘风行》以寄
459867,偶翻旧稿，见九五年绝句：“定当归去故家楼，梦里先来种木奴。异日小窗读周易，可从窗内一抬头。”“十年前景恣重游，更为归来预作图。梦里一身归枕在，故家新计两虚无。”异日句梦中所作，盖尝梦掘香椒幼株，欲种故家后窗外，而终不就。因忆故家后窗外实尝有一树，似为桃，已近枯，亦未见著果。时先君行弃世，毁悴无形，常负手徜徉其下，摩娑不止，如不堪者。树侧为邻家进舟爹茅厕，先君病肺病痔，每如厕，必时许乃出，护裤于腰，
855114,径山无畏老人从旁郡来解包武康观音院昨日访别云当走钱塘吴兴二郡谒林丰二主人仆怪其枯槁淡薄士当无求于世反从事于王公门墙下老人知仆意因云二公有道士我佛所谓大长者辈今佛长城在彼我当归之仆是其说作诗以饷其行老人常挂瘗鹤铭于座右自言得其行笔法又苦吟名于士大夫间屡过仆东堂饭每称吾家饭美以故并载诗中
826922,疏影·光绪辛卯陈蓝洲丈客武昌，尝梦舟行，两岸节荷叶，閒以疏柳，岸有渔家相款。丈言吾西湖荷花正盛，当归访之。既寤，写图寄其弟谔士丈。丁丑杭州被兵，图失复得，叔通出示徵题，时仲恕将自旧都南还，稚谔亦在上海
139992,秋怀·母心日日儿当归
185402,画卷五绝·当归随列与黄金
466284,偶翻旧稿，见九五年绝句：“定当归去故家楼，梦里先来种木奴。异日小窗读周易，可从窗内一抬头。”“十年前景恣重游，更为归来预作图。梦里一身归枕在，故家新计两虚无。”异日句梦中所作，盖尝梦掘香椒幼株，欲种故家后窗外，而终不就。因忆故家后窗外实尝有一树，似为桃，已近枯，亦未见著果。时先君行弃世，毁悴无形，常负手徜徉其下，摩娑不止，如不堪者。树侧为邻家进舟爹茅厕，先君病肺病痔，每如厕，必时许乃出，护裤于腰，
188669,廉夫有会当归去来之句复次韵
459865,偶翻旧稿，见九五年绝句：“定当归去故家楼，梦里先来种木奴。异日小窗读周易，可从窗内一抬头。”“十年前景恣重游，更为归来预作图。梦里一身归枕在，故家新计两虚无。”异日句梦中所作，盖尝梦掘香椒幼株，欲种故家后窗外，而终不就。因忆故家后窗外实尝有一树，似为桃，已近枯，亦未见著果。时先君行弃世，毁悴无形，常负手徜徉其下，摩娑不止，如不堪者。树侧为邻家进舟爹茅厕，先君病肺病痔，每如厕，必时许乃出，护裤于腰，
459866,偶翻旧稿，见九五年绝句：“定当归去故家楼，梦里先来种木奴。异日小窗读周易，可从窗内一抬头。”“十年前景恣重游，更为归来预作图。梦里一身归枕在，故家新计两虚无。”异日句梦中所作，盖尝梦掘香椒幼株，欲种故家后窗外，而终不就。因忆故家后窗外实尝有一树，似为桃，已近枯，亦未见著果。时先君行弃世，毁悴无形，常负手徜徉其下，摩娑不止，如不堪者。树侧为邻家进舟爹茅厕，先君病肺病痔，每如厕，必时许乃出，护裤于腰，
