452420,始迁新居幻庐命赋诗
250655,游和顺古镇后于农家老宅食饵块饵丝幻庐得诗一联众人相约以此为结同赋
250661,蝴蝶会五期幻庐讲题画诗并命题题孤飞云馆秋空一碧图
452388,蝴蝶会五期幻庐讲题画诗并命题题孤飞云馆秋空一碧图
462147,癸巳年幻庐为余治此君轩及姓名图章珍视三年未曾有句前日小聚又惠红叶及霜于斋二印百感莫名长歌以记
250547,壬辰四月二十一日与幻庐赴信阳途中红叶传诗相迓试步元韵
252031,幻庐先生治印以惠赋此为谢
250565,始迁新居幻庐命赋诗
452552,水调歌头 癸巳中秋后一日渝州闻喜会馆雅集，主人以民乐助兴，适逢幻庐生日，步东坡韵为寿
452433,元韵奉和幻庐
452392,酒后至杨光家听幻庐与其放歌
251855,谢幻庐主人治印
444611,谢幻庐主人治印
452390,陪幻庐寻访故里有作
452361,游和顺古镇后于农家老宅食饵块饵丝幻庐得诗一联众人相约以此为结同赋
251219,癸巳年幻庐为余治此君轩
250569,元韵奉和幻庐
250727,酒后至杨光家听幻庐与其放歌
452356,信阳三首 其一 壬辰四月二十一日与幻庐赴信阳途中红叶传诗相迓试步元韵
461564,初夏日幻庐金水二兄来信阳草成一首先呈
466718,信阳三首 壬辰四月二十一日与幻庐赴信阳途中红叶传诗相迓试步元韵
251203,初夏日幻庐金水二兄来信阳草成
462599,幻庐先生治印以惠赋此为谢
250726,陪幻庐寻访故里有作
445829,谢京华幻庐兄治印伯元兄惠茶时在返穗途中
