1252676,西湖酌别便欲过草堂因冗未果小诗二章奉寄稍凉当买舟相晤也
971579,亭午欲过意复凄然偶引杯酒而沅陵丈送诗适至因走笔成两绝并呈教授兄 其二
107707,至后有感·秋来意欲过江东
1036154,水龙吟 昔谢自然欲过海求师蓬莱，至海中，或谓自然，蓬莱隔弱水三十万里，不可到。天台有司马子微，身居赤城，名在绛阙，可往从之，自然乃还，受道于子微。白日仙去，子微著坐忘论七篇，枢一篇，年百馀，将终，谓弟子曰：吾居玉霄峰，东望蓬莱，尝有真灵降焉，今为东海青童君所召，乃蝉脱而去。其后李太白作大鹏赋云：尝见子微于江陵，谓余有仙风道骨，可与神游八极之表。元丰七年冬余过临淮，而湛然先生梁公在焉，童颜清彻，如二
329972,欲过大乘先寄祖灯禅师大乘甚贫新开堂
694341,衡山和李子长见怀欲过江门
511327,闻陈宗汤湛民泽欲过江门遇?风不果用张廷实韵寄之
973380,晚坐欲过在伯而不能
97136,园庐·拟欲过君非一日
65885,欲过草堂未果奉寄
371662,欲过履道庵不果因以诗送饼饵
1055736,欲过大乘先寄祖灯禅师大乘甚贫新开堂
971580,亭午欲过意复凄然偶引杯酒而沅陵丈送诗适至因走笔成两绝并呈教授兄 其一
247635,鹧鸪天·蔌蔌飞红欲过墙
1000790,大热欲过广寿寺谒韩子苍追凉先之以诗
98708,晚坐欲过在伯而不能
128135,处和有诗欲过小圃
974354,得晴欲过江访梅已忽病作天亦复阴怅然有赋
989046,处和有诗欲过小圃
137004,蝶恋花·欲过清明烟雨细
1124021,亭午欲过意复凄然偶引杯酒而沅陵丈送诗适至因走笔成两绝并呈教授兄
225647,五绝·扶筇欲过北山来
604500,九月七日雨中李伯开欲过小园用前韵以诗促之
96271,再呈明叔·欲过江天阁
974406,屡遗公择书且寄以诗皆未得报成父弟书云公择欲过予再寄
128034,天台书事·香火寻盟欲过门
1090631,七月三日到镇江欲过金山始登舟暴风雷雨忽大作泊抵寺岸则少霁矣回舟晚晴却遇便风
511239,衡山和李子长见怀欲过江门 其一
1012596,资圣庵欲过圆通
1093219,海南思南豅正花欲过赵阁亦倦
133675,资圣庵欲过圆通
97109,得晴欲过江访梅已忽病作天亦复阴怅然有赋
97565,亭午欲过意复凄然偶引杯酒而沅陵丈送诗适至
176851,客寓邻家有园尝欲过之不可得
293087,浣溪纱·翠竹檀栾欲过墙
1094243,欲过履道庵不果因以诗送饼饵
1007259,客寓邻家有园尝欲过之不可得
375203,庵居即事·欲过东家怕渡桥
521703,雨后文仪欲过小楼閒话诗以速之
383117,忧旱·五月欲过犹未雨
511240,衡山和李子长见怀欲过江门 其二
306563,阿那曲·强欲过河呼不起
1240512,西湖酌别便欲过草堂因冗未果小诗二章奉寄稍凉当买舟相晤也 其一
185070,大热欲过广寿寺谒韩子苍追凉先之以诗
1249495,西湖酌别便欲过草堂因冗未果小诗二章奉寄稍凉当买舟相晤也 其二
157787,三月三日欲过小园闻海棠未开翦韭独酌有怀
329026,赠人·坚卧因循欲过冬
1005350,三月三日欲过小园闻海棠未开剪韭独酌有怀
