983461,书魏元益便面
513392,与亨大懋衡二太史天瑞元益贯之三给事同游神乐观是日廉伯有约不至 其二
179706,书魏元益便面
513393,与亨大懋衡二太史天瑞元益贯之三给事同游神乐观是日廉伯有约不至 其三
356043,寄朱元益·小园桃杏已欣荣
1070657,寄朱元益
514545,菊庄图为致仕章元益给事赋
513391,与亨大懋衡二太史天瑞元益贯之三给事同游神乐观是日廉伯有约不至 其一
945994,景元益之诸友考试旁郡余梦与步月联诗得水花初净月如银之句追成一绝
1103647,韶卿往乌伤寄刘元益
191864,景元益之诸友考试旁郡余梦与步月联诗得水花
1030284,桃源忆故人 郑德舆饯别元益，余亦预席。醉中诸姬索词，为赋一阕 其一
702338,与亨大懋衡二太史天瑞元益贯之三给事同游神乐观是日廉伯有约不至
369466,韶卿往乌伤寄刘元益
558037,忆同年会寄章黄门元益
1030295,朝中措 其一 为文倅元益寿。元益，陈鲁公之婿
1030295,朝中措 其一 为文倅元益寿。元益，陈鲁公之婿
1030306,蝶恋花 辛卯重九，余在试闱，闻张子仪、文元益诸公登舟青阁分韵作词。既出院，方见所赋，以“玉山高并两峰寒”为韵，尚馀并字，因为足之
1070330,同赵子雍过朱元益耜乐圃
