355763,拙诗送别·向来南北叹流年
894780,拙诗奉赠富乐山海公禅师
1078878,某上章辞免召命蒙恩矜许仍赐羊酒存问自念衰残辱此异数不胜感天荷圣之情谨课成拙诗一首
953617,久在病告近方赴直偶成拙诗二首 其二
385852,和刘凤台副举惠题拙诗次韵
1156586,编集拙诗成一十五卷因题卷末戏赠元九李二十
159457,府斋岁晏节物感人辄成拙诗二篇上寄昭文相公
892727,闻中山公淝上家园新成秘奉阁辄抒拙诗寄献
320668,运使兵部以某驰想林泉拙诗言志荐承属和曲有褒嘉今复致谢
206649,将游蜀中恨有所滞至情难蓄发为拙诗寄锦川峡
894131,府斋岁晏节物感人辄成拙诗二篇上寄昭文相公枢密太尉虽俚调无取亦盍各斐然之义也 其一
320786,运使兵部见采拙诗四沐继和唱者已竭而答者无穷内省小巫敢当大敌既难收合馀烬愿为城下之盟
1159651,白舍人见酬拙诗因以寄谢
1087794,昨承诸兄临辱不揆以薄酒蔬食延驻都骑明日视壁间所张墨刻有亡去者人以为德庆丈之廋也驰问遣索蒙需拙诗辄赋所怀往奉一笑而尊犍刻可以归于我矣
894536,故相国沂公建设学官实宠兹土近闻生徒寖盛姑复慰怀因成拙诗一章奉呈州学官因以勉导来者
1070882,重阳后二日会严氏野趣亭坐客吴德永裴尧文杜志林林元宪李彦实严君锡魏介然及予八人因成拙诗以纪一时之集云
1128175,傅国华从使辽东已事还朝拙诗送别
1049691,被诏还阙过碧落洞观元伯兄留题怅然久之兼成拙诗以纪胜概
1105200,某天圣四年叨充乡赋明道二年夏假副车于本郡今年夏忝外计于本道寔嗣世职八月行部率遵故常乡老欢迎邀留累日徘徊旧地追惟畴曩因成拙诗二章题于行署
747899,雨舲中丞赐和拙诗兼和坡公海市篇见柬奉答两篇 其二
1159781,南海马大夫远示著述兼酬拙诗辄著微诚再有长句时蔡戎未弭故见于篇末
385861,酬漆古香学博惠题拙诗
905481,至启伏蒙宠惠宝相花数朵烂然可观发钿合之中才惊绝艳睹彩笺之上又辱佳篇感叹既盈咏歌斯作辄依高韵拜献拙诗一首
1037909,彭门贤守器之度支赵鼎记余生日过形善祝并惠黄石茶瓯怀素千字文一轴辄成拙诗仰答来意
863048,孙叔诚宰南峰过信道诸暨旧事往往能记拙诗因以送之
1070912,四月望夜郡寮悉赴盛集羊荆华林伯寿伯安相继见过同登涌月阁待月成拙诗并呈常往来诸友
1070363,傅国华从使辽东已事还朝拙诗送别 其二
953618,久在病告近方赴直偶成拙诗二首 其一
366666,闻舅氏以秘书监致政谨献拙诗为贺
894130,府斋岁晏节物感人辄成拙诗二篇上寄昭文相公枢密太尉虽俚调无取亦盍各斐然之义也 其二
138168,偶成拙诗·清晨下直大明宫
333818,子常生日无以为寿偶得团茶一饼因书拙诗一首藉之以献
1070924,拙诗奉送厚之权郡还阙
320785,某以端居多暇怀洛成诗伏蒙运使兵部俯垂属和拙诗伸谢
331100,四月望夜郡寮悉赴盛集羊荆华林伯寿伯安相继见过同登涌月阁待月成拙诗并呈常往来诸友
917664,经略龙图开拓曾公岩景物一新遂为诸岩之冠因成拙诗投之
331091,己巳重九小集拙诗记海外风景之异呈亨叔
894272,流杯小宴偶成拙诗奉呈运使王密学紫微韩舍人
1171254,谢先辈防记念拙诗甚多异日偶有此寄
1038078,某伏蒙昭文相公以某方忝瀍洛之寄因有嵩少之行惠赐游山器一副质轻而制雅外华而中坚匪惟便于赍持实为林下之珍玩也辄成拙诗一章报谢
863329,独酌自吟拙诗次吏报转运使到郡戏而有作
572671,定州见拙诗拓戏题
1038256,某以端居多暇怀洛成诗伏蒙运使兵部俯垂属和拙诗伸谢
95312,呈明叔·伯威虽拙诗故巧
331106,拙诗奉送厚之权郡还阙
894324,淳之九兄以仆承乏制曹幸联局事向当成绩猥辱裁篇谨抒拙诗以谢来贶
23963,谢先辈防纪念拙诗甚多异日偶有此寄
948507,十一月二十七日刘公度徐用之许相过公度居忧止酒用之偶食素适有饷小春团茶者因成拙诗奉简
209152,林治中近有捕虎之役调以拙诗
1041951,闻舅氏以秘书监致政谨献拙诗为贺
429573,寄呈乙盦老人并谢题拙诗
352279,某上章辞免召命蒙恩矜许仍赐羊酒存问自念衰残辱此异数不胜感天荷圣之情谨课成拙诗
1038258,运使兵部见采拙诗四沐继和唱者已竭而答者无穷内省小巫敢当大敌既难收合馀烬愿为城下之盟
177938,独酌自吟拙诗次吏报转运使到郡戏而有作
209232,比以拙诗戏调张籍不知作者已盈轴矣辄矣辄和
1121386,久在病告近方赴直偶成拙诗二首
1156284,昨以拙诗十首寄西川杜相公相公亦以新作十首惠然报示首数虽等工拙不伦重以一章用伸答谢
831684,颂臣谢丈留须，余戏赠两绝，有『长须国里如求婿，跨凤乘龙属此髯』之句，后余弟烈堂果赠一姬，喜拙诗竟成佳谶，因次前韵，再赋二章，以博妆台双笑 其一
1038023,某天圣四年叨充乡赋明道二年夏假副车于本郡今年夏忝外计于本道寔嗣世职八月行部率遵故常乡老欢迎邀留累日徘徊旧地追惟畴曩因成拙诗二章题于行署 其二
1035420,长安龙图陈学士宠示重阳日翠微楼上见览拙诗之作兼蒙寄翠微楼长乐亭二记各述一绝寄而谢之
1046183,望与诸公会于大慈闻海云山茶合江梅花开遂相邀同赏虽无歌舞实有清欢因成拙诗奉呈
894464,留台吴侍郎时泛小舟临玩清洛辄成拙诗奉寄
844295,颂臣谢丈留须，余戏赠两绝，有『长须国里如求婿，跨凤乘龙属此髯』之句，后余弟烈堂果赠一姬，喜拙诗竟成佳谶，因次前韵，再赋二章，以博妆台双笑
137536,久在病告近方赴直偶成拙诗
341835,开岁五日使君见约同宫使尚书诸丈观山宫梅花因成拙诗
173948,有野人来献石蝉以二千钱偿以之因成拙诗
1068859,顾景蕃访大年侄昆仲留宿细柳轩夜论诗律辄及老朽大年作长篇调景蕃末章见称过实且欲尽借拙诗因次其韵为谢
948823,腊旦大雪运使何同叔送羊羔酒拙诗为谢
831685,颂臣谢丈留须，余戏赠两绝，有『长须国里如求婿，跨凤乘龙属此髯』之句，后余弟烈堂果赠一姬，喜拙诗竟成佳谶，因次前韵，再赋二章，以博妆台双笑 其二
109129,拙诗奉赠富乐山海公禅师
1038247,贤大师以诸巨公画像见示传神写照曲尽其妙兼丐拙诗辄成一首奉呈
747898,雨舲中丞赐和拙诗兼和坡公海市篇见柬奉答两篇 其一
206466,见览拙诗·斗城谁建翠微楼
1112300,府斋岁晏节物感人辄成拙诗二篇上寄昭文相公枢密太尉虽俚调无取亦盍各斐然之义也
1087253,开岁五日使君见约同宫使尚书诸丈观山宫梅花因成拙诗
1037914,某伏蒙宫师相公杜寄示新居诗斋沐捧读不胜铭叹某谨成拙诗一章上纪盛德粗伸谢意
1035576,将游蜀中恨有所滞至情难蓄发为拙诗寄锦川峡路薛田臧奎二运使提刑杨及
1061596,子常生日无以为寿偶得团茶一饼因书拙诗一首藉之以献
206468,见览拙诗·京兆重阳大尹家
154760,拙诗六韵奉寄兴州分判诚之蒲兄
206465,长安龙图陈学士宠示重阳日翠微楼上见览拙诗
1038257,运使兵部以某驰想林泉拙诗言志荐承属和曲有褒嘉今复致谢
885169,谨次韵和呈垂览拙诗之作
15046,白舍人见酬拙诗因以寄谢
320909,贤大师以诸巨公画像见示传神写照曲尽其妙兼丐拙诗辄成
152041,腊旦大雪运使何同叔送羊羔酒拙诗为谢
959018,比以拙诗戏调张籍不知作者已盈轴矣辄和两韵 其一
1035761,长安龙图陈学士宠示重阳日翠微楼上见览拙诗之作兼蒙寄翠微楼长乐亭二记各述一绝寄而谢之 长乐亭
159120,流杯小宴偶成拙诗奉呈运使王密学紫微韩舍人
1038121,窃知今日于家园种山芋辄成拙诗奉呈副枢谏议
1053026,知府伯常度支宿熙春台辄成拙诗上寄
1035421,长安龙图陈学士宠示重阳日翠微楼上见览拙诗之作兼蒙寄翠微楼长乐亭二记各述一绝寄而谢之 翠微楼
1038110,九月十日西园会范内翰李紫微已下诸公惠雅章谨成拙诗仰答厚意
18144,编集拙诗成一十五卷因题卷末戏赠元九李二十
852422,拙诗六韵奉寄兴州分判诚之蒲兄
985092,有野人来献石蝉以二千钱偿之因成拙诗
1070895,己巳重九小集拙诗记海外风景之异呈亨叔
320774,窃知今日于家园种山芋辄成拙诗奉呈副枢谏议
959017,比以拙诗戏调张籍不知作者已盈轴矣辄和两韵 其二
866412,拙诗五十六言赠富乐山海公长老
173393,孙叔诚宰南峰过信道诸暨旧事往往能记拙诗因
658001,田户侯病愈求诗以谢何医余诺之既去田致何语无作讥语康节谓自从删后更无诗诗何道哉乃为我辈所坏如此真可疑也然余之不能取信于人于此亦可考矣遂作拙诗一章以致愧一以谢何
1122091,比以拙诗戏调张籍不知作者已盈轴矣辄和两韵
124700,闻中山公淝上家园新成秘奉阁辄抒拙诗寄献
159118,留台吴侍郎时泛小舟临玩清洛辄成拙诗奉寄
509778,不习书绢殊失故态已付染师作碧玉老人卧帷矣呵呵拙诗纪兴录上顾别驾先生以博一笑
1070362,傅国华从使辽东已事还朝拙诗送别 其一
959051,林治中近有捕虎之役调以拙诗
883720,雪夕林亭小酌因成拙诗四十韵以贻坐客昔欧阳公与人咏雪先戒勿用梨梅练絮白舞鹅鹤等字今篇中辄守此戒但愧不工伏惟采览
111278,謹次韵和呈垂览拙诗之作
812604,雨舲中丞赐和拙诗兼和坡公海市篇见柬奉答两篇
330771,重阳后二日会严氏野趣亭坐客吴德永裴尧文杜志林林元宪李彦实严君锡魏介然及予八人因成拙诗以纪一时之集云
1157600,偶以拙诗数首寄呈裴少尹侍郎蒙以盛制四篇一时酬和重投长句美而谢之
923286,解秩西还夕次葛驿二通判与签判学士留府诸君远出饯别情至礼勤辄成拙诗奉谢厚意
320655,九月十日西园会范内翰李紫微已下诸公惠雅章谨成拙诗仰答厚意
356059,傅国华从使辽东已事还朝拙诗送别
1041135,府公射堂饮酒辄陪尊丈侍郎兼揖诸孙拜献拙诗
1038022,某天圣四年叨充乡赋明道二年夏假副车于本郡今年夏忝外计于本道寔嗣世职八月行部率遵故常乡老欢迎邀留累日徘徊旧地追惟畴曩因成拙诗二章题于行署 其一
1037003,某顿首今日去国之官谨成拙诗上献相公汲公钧席下执某顿首上
