602816,送余沈二春元赴进士举
1023669,和致轩送余魁
1225027,送余廷季赴海东佥宪
957273,谭德称杨商卿父子送余自成都合江亭相从至泸南合江县始分袂水行踰千里作诗以别
1165760,送余赞善使还赴薛尚书幕
371558,送余解元再往吴中
361366,送余林二生赴举
1103951,送余晋仲游庐山
991356,送余郎中知郑州
620380,送余麦积上舍北上
478134,白雀返棹李王二子送余过虞山下作四绝句 其四
550846,送余印卿秀才还濉阳
66324,董体仁送余至固节旗亭饮别赋此贻之
728618,子茂薄君自兰泉送余至凉州且赋七律四章赠行次韵奉答 其二
104809,送余郎中知郑州
592521,送余太史还朝
524557,送余客
712745,送余信宜初芙
58473,送余侍御贬荆门州
1208421,竹枝歌三首 其二 送余德辉还池州
775298,送余刺史宝冈秩满入觐即次留别元韵 其二
694015,夜宴邓卿云将军府第同诸生李明卿廉安卿陈子晋潘子敬李大亨时史先生与严思孔刘近之驾扁舟送余湖中风涛大作暮薄相失末首却寄
600843,夜宴邓卿云将军府第同诸生李明卿廉安卿陈子晋潘子敬李大亨时史先生与严思孔刘近之驾扁舟送余湖中风涛大作暮薄相失末首却寄 其一
1089636,送余伯益知县
674709,送余侍御珊谪判安陆
844528,金缕曲 送余挺生大令筠之乐清任
114137,元师自荣州来追送余于泸之江安绵水驿因复用
331548,季言送余至湖外欲往无为挈其姊旅榇归锡山悯其勤赠此一绝
371560,送余运管入浙
715284,送余君
1204977,水龙吟 送余干教邓觉非归吴
1089058,过湘中得诗僧万致一于书无所不读非苟得诗名于僧中者余欲与俱还吴中而万家浯溪将结草庵其上送余至湘阴复归作四十字以别
966273,送余泽还义兴
474762,董体仁送余至固节旗亭饮别赋此贻之
653546,送余大尹
1044745,五言送余良孺大监致仕归乡
608371,汪公干从燕台送余至济上叙别兼寄别和叔 其二
1217570,送余廷心待制之浙东佥宪
1077674,季言送余至湖外欲往无为挈其姊旅榇归锡山悯其勤赠此一绝
621049,李仲木喜余下第南还赋诗载酒相贺即席述答因柬刘公旦用公旦送余北上韵
506830,送余侍讲还乡
999029,周少府由姑熟送余同宿于玩鞭亭
566832,送余兴国
212384,送余子美归淮上
577012,送余德禔归羊城
638898,送余昌期之漳平
606683,江应雷偕诸太学追送余苏家桥暮酌有赠答和二首 其一
1040431,送余宗道主簿赴官
877166,送余子寿
546693,黄生石父棋于吾越为第一手而诗思亦翩翩是夕赋一律送余南还酬此
836194,金缕曲 其一 送余挺生大令筠之乐清任
241213,送余仲谦赴江州教
684645,白雀返棹李王二子送余过虞山下作四绝句
682575,汪公干从燕台送余至济上叙别兼寄别和叔
572590,王章甫送余石头口因共游赤壁章甫将归读书九峰山 其一
611839,立秋前五日社集天界寺诸词客分赋金陵名胜送余行余分得白鹭洲探五微留别
547978,送余太史云衢册封周藩四首 其四
366650,送余江州·潮汐通城下
775301,送余刺史宝冈秩满入觐即次留别元韵 其五
1242862,命酒徵歌送余婿，时伯庸酒间赋赠董景明、董彦祯诸亲还遂昌
735031,卢舜徒太守送余至天津留别
50285,送余学官归罗江
292224,浣溪沙·送余诠卿归雅都
593845,送余太史伯祥册封衡府
117506,送余京同年兄通判岚州
155256,周少府由姑熟送余同宿于玩鞭亭
12381,送余赞善使还赴薛尚书幕
1094033,送余解元再往吴中
996407,元师自荣州来追送余于泸之江安绵水驿因复用旧所赋此君轩诗韵赠之并简元师法弟周彦公
284272,金缕曲·送余挺生大令筠之乐清任
478131,白雀返棹李王二子送余过虞山下作四绝句 其一
504976,北风辞送余舜容之京 其二
991354,送余中舍知汉州德阳
493377,余留宣溪旷氏几半月于别也承惟宁惟南伯仲率诸客送余江浒停舟赋诗眷眷有留恋之意明日到流江书此寄谢
616714,送余舅归应试
682219,送余太史云衢册封周藩四首
337764,送余兄西上
382682,送余太史云衢册封周藩
1092845,送余子寿暂回上饶
1099930,送余兄西上
88815,送余子归·去岁与君同聘召
600488,送余太史册封衡藩
1006736,送余直卿廷对
843902,浣溪沙 送余诠卿归雅都
360632,大学送余适正往洛中就馆
534952,陈子虚少卿刘虞让大尹送余庐陵志别
493376,余留宣溪旷氏几半月于别也承惟宁惟南伯仲率诸客送余江浒停舟赋诗眷眷有留恋之意明日到流江书此寄谢
678728,送余侍讲致仕南归
686350,鸂鶒吟送余大尹三首
569732,送余教授归天台兼简应在明
547975,送余太史云衢册封周藩四首 其一
593942,送余进士明复司法常州
1224911,送余嘉宾赴常宁州判官
68805,金陵行送余局官
780833,子茂薄君自兰泉送余至凉州且赋七律四章赠行次韵奉答 其一
559029,九日送余毓初孝廉远访回镛
938994,徐子融以诗送余方叔吴介甫二书见示和韵以谢 其一
617210,亲友送余度岭诗以别之
57797,白雀返棹李王二子送余过虞山下作四绝句
559615,送余子兼武举北上次扇头韵
924878,送余京同年兄通判岚州
606684,江应雷偕诸太学追送余苏家桥暮酌有赠答和二首 其二
100301,杏·开花送余寒
476583,送余学官归罗江
991357,送余驾部江州
104811,送余干李少府
775297,送余刺史宝冈秩满入觐即次留别元韵 其一
632615,诸公送余出郊心公诗先成赋和
242580,送余直卿廷对
780834,子茂薄君自兰泉送余至凉州且赋七律四章赠行次韵奉答 其三
1094037,送余运管入浙
572592,王章甫送余石头口因共游赤壁章甫将归读书九峰山 其三
472082,送余侍御贬荆门州
547977,送余太史云衢册封周藩四首 其三
699389,王章甫送余石头口因共游赤壁章甫将归读书九峰山
654651,送余佥宪致仕归南城
608370,汪公干从燕台送余至济上叙别兼寄别和叔 其一
1222529,送余率翁职满谒选并寄容斋承旨肯堂学士
659211,送余国信归铅山
1041954,送余江州
1065464,大学送余适正往洛中就馆
1218737,送余廷心翰林应奉
991355,送余少卿知睦州
104807,送余中舍知汉州德阳
567382,送余君
1238293,金陵行送余局官
100304,再送·余刃西屠横海鲲
361503,送余宗道主簿赴官
600844,夜宴邓卿云将军府第同诸生李明卿廉安卿陈子晋潘子敬李大亨时史先生与严思孔刘近之驾扁舟送余湖中风涛大作暮薄相失末首却寄 其二
661376,鸂鶒吟送余大尹三首 其一
123210,谭德称杨商卿父子送余自成都合江亭相从
682347,北风辞送余舜容之京
222684,徐子融以诗送余方叔吴介甫二书见示和韵以谢
807472,念奴娇  曹顾庵王西樵邓孝威沈方邺汪舟次季希韩李云田兄散木皆有送余归阳羡词作此留别
378131,和致轩送余魁
661378,鸂鶒吟送余大尹三首 其三
594617,龙游鲁明府遣童秀才叔龙送余衢州因念亡友童子鸣
600845,夜宴邓卿云将军府第同诸生李明卿廉安卿陈子晋潘子敬李大亨时史先生与严思孔刘近之驾扁舟送余湖中风涛大作暮薄相失末首却寄 其三
938995,徐子融以诗送余方叔吴介甫二书见示和韵以谢 其二
1136600,送余仲谦赴江州教
835384,浣溪沙 其一 送余诠卿归雅都
1208422,竹枝歌三首 其三 送余德辉还池州
740761,县诸生十数辈送余至蔚州之暖泉村越旦暖泉人复为余设饯堡门外迟回久之而别
1081059,令德送余都门外眷眷惜别余恨不款作诗寄之
921174,正月二十日，往岐亭，郡人潘、古、郭、三人送余于女王城东禅庄院
548177,送余太史使东藩
555051,送余先生教授淮府
1208420,竹枝歌三首 其一 送余德辉还池州
633641,送余立人归江宁寿其尊人余澹心
531262,次韵谢高泉送余往永昌
614671,送余士翘之教东官
478133,白雀返棹李王二子送余过虞山下作四绝句 其三
992945,送余中舍监韶州钱监
531107,赋得灵岩阁送余懋贤
532072,送余崇一使蜀
775303,送余刺史宝冈秩满入觐即次留别元韵 其七
1092872,送余制干赴四明
597870,送余医生归上杭
99516,正月二十日往岐亭郡人潘古郭三人送余于女王
603623,送余云衢册封周藩
519759,送余士英司马之京
1049878,送余秘校
1039815,送余林二生赴举
775300,送余刺史宝冈秩满入觐即次留别元韵 其四
564254,送余子华归省
686049,江应雷偕诸太学追送余苏家桥暮酌有赠答和二首
547976,送余太史云衢册封周藩四首 其二
572591,王章甫送余石头口因共游赤壁章甫将归读书九峰山 其二
994791,送余子美归淮上
641189,送余司马归晋中
815273,送余刺史宝冈秩满入觐即次留别元韵
138098,送余姚陈寺丞
1118976,徐子融以诗送余方叔吴介甫二书见示和韵以谢
182671,送余泽还义兴
775299,送余刺史宝冈秩满入觐即次留别元韵 其三
353538,送余伯益知县
484101,癸夘闰三月十九日奉旨代祠宝公遇环中子于山中送余出寺余止之环中子曰不出圆悟关因续为句
521946,送余德辉御史赴安陆判官得月字
533679,刘仲恭姚元白吴约卿毗卢阁送余德甫
178383,芍药·凄凄寒雨送余春
1235933,竹枝歌三首 送余德辉还池州
592344,皇州春色歌送余君房沈肩吾
104812,送余驾部江州
814466,子茂薄君自兰泉送余至凉州且赋七律四章赠行次韵奉答
666049,昔余北征太初至自湖州送余至姑胥吾惟可至自三衢送余至槜李不二载间相继下世重逢此地怆然伤怀作哭二子诗
666049,昔余北征太初至自湖州送余至姑胥吾惟可至自三衢送余至槜李不二载间相继下世重逢此地怆然伤怀作哭二子诗
530984,送余懋忠
104810,送余少卿知睦州
1220017,送余善之归浏阳
661377,鸂鶒吟送余大尹三首 其二
552099,送余德先之任闽中取道云中省觐
478132,白雀返棹李王二子送余过虞山下作四绝句 其二
570979,送余郡慱擢教国子学录
504975,北风辞送余舜容之京 其一
775302,送余刺史宝冈秩满入觐即次留别元韵 其六
472986,仲春廿日发瓜渚同顾使君益卿赴闽粤郭次甫吴孝甫吴叔原送余京口是日值余初度记此留别
124296,送余姚尉顾洵美老辈
780835,子茂薄君自兰泉送余至凉州且赋七律四章赠行次韵奉答 其四
