1159732,和令狐相公以司空裴相见招南亭看雪四韵
183829,太傅相公以梅圣俞寄和建茶诗垂示俾次前韵
905426,至启伏蒙仆射相公以小子近司靶阁罕扣芜音忽徵庸陋之词盖示记怜之旨特贻篇什俯耀行藏捧玩无厌感戴交切谨依高韵奉和聊抒下情
320882,某伏蒙昭文相公以某方忝瀍洛之寄因有嵩少
1159709,和仆射牛相公以离阙庭七年班行亲故亡殁十无一人再睹龙颜喜庆虽极感叹风烛能不怆然因成四韵并示集贤中书二相公所和
1156260,宣武令狐相公以诗寄赠传播吴中聊奉短草用申酬谢
1038250,次韵留守相公以某赴东庄特赐佳篇
892327,次韵天平观文庞相公以久留塞下见寄
1038204,次韵留守相公以罗门新渠并成喜而成咏
569518,太师存翁相公以元旦家燕诗见示次韵
124929,次韵天平观文庞相公以久留塞下见寄
1038078,某伏蒙昭文相公以某方忝瀍洛之寄因有嵩少之行惠赐游山器一副质轻而制雅外华而中坚匪惟便于赍持实为林下之珍玩也辄成拙诗一章报谢
1156837,奉和思黯相公以李苏州所寄太湖石奇状绝伦因题二十韵见示兼呈梦得
320603,次韵留守相公以罗门新渠并成喜而成咏
35189,太傅相公以东观庭梅西垣旧植昔陪盛赏
922941,太傅相公以梅圣俞寄和建茶诗垂示俾次前韵
320910,次韵留守相公以某赴东庄特赐佳篇
923954,次韵程相公以柳湖久涸辄引蔡水溉注感而成咏二首 其二
227312,靖启伏蒙观文相公以靖忝承善政特寄嘉篇谨依
1117110,次韵程相公以柳湖久涸辄引蔡水溉注感而成咏二首
224008,仆射相公以望重位高识分知足因书台抱遽成雅
224035,至启伏蒙仆射相公以小子近司芸阁罕扣芜音忽
923421,青州资政寄示小楷伯夷颂许昌相公以诗跋尾因作诗谢二公兼呈永兴观文相公
905408,仆射相公以鹤算渐高鸿恩未答形于章句冠彼诗流蒙见寄之荣感爱忘之甚诚知寡和岂敢无言亦以鄙怀伸于拙笔庶垂一览聊用发咍
1196093,太傅相公以庭梅二篇许舍弟同赋再迂藻思曲有虚称谨依韵奉和庶申感谢
18706,宣武令狐相公以诗寄赠传播吴中聊奉短草用申酬谢
1159757,奉和郑相公以考功十弟山姜花俯赐篇咏
1184838,太傅相公以东观庭梅西垣旧植昔陪盛赏今独家兄唱和之馀俾令攀和辄依本韵伏愧斐然
887205,靖启伏蒙观文相公以靖忝承善政特寄嘉篇谨依严韵和酬
1038037,谢太傅相公以近诗三十首寄示
14984,奉和郑相公以考功十弟山姜花俯赐篇咏
320642,谢太傅相公以近诗三十首寄示
923955,次韵程相公以柳湖久涸辄引蔡水溉注感而成咏二首 其一
1168838,癸巳岁吉甫圜丘摄事合于中书后阁宿斋常负忝愧移止于集贤院会门下相公以七言垂寄亦有所酬短章绝韵不足抒意因叙所怀奉寄相公兼呈集贤院诸学士
118503,次韵程相公以柳湖久涸辄引蔡水溉注感而成咏
14932,和令狐相公以司空裴相见招南亭看雪四韵
905407,仆射相公以望重位高识分知足因书台抱遽成雅章清苦振琼烂如裁锦猥蒙宠示实动荣观辄述鄙怀仰依高韵
1039496,次韵答宫保张相公以长篇见寄
1159742,和李相公以平泉新墅获方外之名因为诗以报洛中士君子兼见寄之什
