678352,河间府瀛海驿写竹遂成长句
77499,胸次郁郁偶取枯笔作狂草遂成长句
1060201,与曹圣延游风洞及七星观遂成长句
200558,汪正夫云已厌游湖上顾予犹未数往遂成长篇寄
933776,胸次郁郁偶取枯笔作狂草遂成长句
959647,汪正夫云已厌游湖上顾予犹未数往遂成长篇寄之
1079729,将去曹南连得江晁书因叹存没诸友遂成长韵
1180164,隐尝在江陵忝故中令白公叨蒙知遇今复重过渚宫感事悲身遂成长句
1142395,予读书之室先从兄时南尝扁以绿猗今二十馀年矣感叹存殁遂成长篇
1004015,去岁重阳日得彦威信附六月间二小侄及从弟侄所寄书自蜀阃递中附至历言去冬今春所遭兵祸及有司督迫科调之苦喜其存全哀其窘蹙洒涕如霰寄讯邀其下峡而边事又告急未知其达与否也会杪冬见邸报宣谕使者余公侍郎改命授钺尽护蜀师意欲以此事归控骨肉会聚兹事其谐矣喜极涕零遂成长篇
674014,陈准卿招饮遂成长句申谢
645812,槎峰禅暇因读梦观右讲经居武林日所寄佳什怅然有怀援笔遂成长句时梦观寓中都龙兴寺故录以寄之
782358,乙亥春得读遂堂先生庆芝堂集既卒业遂成长句以志向往之诚
604699,重过七星岩祝明府招同南海王明府岩集时余以制帅戴公出访后至遂成长夜之饮赋谢
1079812,与季宏子植同过信中饮薜荔亭下夜分乃散别后奉怀遂成长韵
504631,胡君济源家藏钱舜举所画俾予题之按山水形胜人物草木凡图中所具者莫不曲尽微妙大率吴中佳处沉吟细玩若湖山之在目遂成长律十八韵以写怀乡之意云
617719,秋日自遣遂成长篇
