511141,世卿赴顺德吴明府之召五日不返诗以促之 其一
1104928,承君棋输包子诗以促之
514211,龚廷臣许刻图书不至诗以促之
614142,七夕得正古上人书许渡海见访诗以促之
511142,世卿赴顺德吴明府之召五日不返诗以促之 其二
1251971,宗道师曾许寻郑元秉春草图见寄诗以促之
866158,闻复卿欲访诗以促之
890168,奚大卿许赋生香亭诗以促之
504753,吴主一惠墨并图书不至诗以促之
110590,奚大卿许赋生香亭诗以促之
638853,移居且弥月旧主迟迟未去诗以促之
638344,连珠池诸生欲搆亭其上诗以促之
1054484,承君棋输包子诗以促之 其一
694323,世卿赴顺德吴明府之召五日不返诗以促之
212577,闻复卿欲访诗以促之
528733,贾西谷邀饮山寺朝信不至诗以促之
1054485,承君棋输包子诗以促之 其二
558436,俞舜卿佥宪许柑未送诗以促之
690558,王幼度明府黄元卿国学陈集生太史订游罗浮拟过小园诗以促之
624147,刘季德许序拙草诗以促之
605073,王幼度明府黄元卿国学陈集生太史订游罗浮拟过小园诗以促之 其一
605074,王幼度明府黄元卿国学陈集生太史订游罗浮拟过小园诗以促之 其二
