590520,丙戌授讲河源次一江韵宰沙泉俞太守
1133616,次陈浦泉教授渡江韵
1132277,再次沧江韵
226582,次范光伯泛江韵
69428,用顾松江韵复理贰守并柬雪坡刺史
1107226,与所盘诸君会石幡还和杜老曲江韵
572055,赋得野竹上青霄拈三江韵
749677,风云亭同周芙汀夜坐次芙江韵
522167,送瓯滨谒陵用三江韵时方南征
834452,好事近 前题 和蒲江韵
522152,送玉峰少宰之南都兼简东川太宰用三江韵
687483,题便面次顾东江韵二首
585432,燕乐亭次黄小江韵
457212,戏咏五四，亦用义山曲江韵回寄乖崖
865892,与所盘诸君会石幡还和杜老曲江韵 其二
212789,与所盘诸君会石幡还和杜老曲江韵
565077,题便面次顾东江韵二首 其二
659860,时苗留犊次三江韵 其一
443803,记梦步高青丘《登金陵雨花台望大江》韵
277205,蛰园牡丹限江韵
1238584,用顾松江韵复理贰守并柬雪坡刺史
757080,次柏静涛正使清川江韵
588623,夏夜对月用张曲江韵四首 其二 十六夜
831169,宴清都 舟夜，用庐蒲江韵
350138,宴清都·舟夜，用庐蒲江韵
701493,夏夜对月用张曲江韵四首 十五夜
755011,秋夕望月和张曲江韵
664918,除夕和石江韵 其二
522105,东亭用三江韵
1029449,次范光伯泛江韵
210402,次七夕游松江韵
664919,除夕和石江韵 其三
277206,限江韵·姚黄欧碧总无双
443323,丁亥六月既望芙蓉园雅集用杜曲江韵
299417,风云亭同周芙汀夜坐次芙江韵
822442,锦园春三犯 公园赏牡丹，和蒲江韵
279106,锦园春三犯·公园赏牡丹，和蒲江韵
213289,次陈浦泉教授渡江韵
698637,除夕和石江韵
632699,大雪用栖贤寄阿字九江韵
1200728,给四江韵赋海棠
522107,丝瓜棚成次三江韵
664920,除夕和石江韵 其四
588625,夏夜对月用张曲江韵四首 其四 十八夜
267749,大酺·同江韵秋过顾氏园看牡丹
868401,次七夕游松江韵
832963,大酺 同江韵秋过顾氏园看牡丹
865891,与所盘诸君会石幡还和杜老曲江韵 其一
444122,己丑三月晦日湖上送春用贾长江韵
385744,燕乐亭次黄小江韵
695497,时苗留犊次三江韵
277207,释戡有故宫看花三用江韵之作亦用此韵和之
768886,咏脚划船五排限江韵
1034635,再次沧江韵 其一
590587,次后江韵答双湖掌教停舟不行
659861,时苗留犊次三江韵 其二
588622,夏夜对月用张曲江韵四首 其一 十五夜
741268,辛峰阁听雨和鹤江韵
614798,湖口望瀑布次张曲江韵
553421,饮酒沔县市中走笔次刘忠江韵
664917,除夕和石江韵 其一
254327,戏咏五四亦用义山曲江韵回寄乖崖
283364,好事近·和蒲江韵
1034634,再次沧江韵 其二
445907,自白鹤泉下朱张渡步少陵曲江韵集句
588624,夏夜对月用张曲江韵四首 其三 十七夜
739017,和岑春江韵
565076,题便面次顾东江韵二首 其一
