148357,吉之南门外见木芙蓉烂开
116507,九月十日菊花烂开
126105,赏梅·春早梅花正烂开
116415,苦寒·见说樱桃已烂开
1055830,晚过王晋卿第移坐池上松杪凌霄烂开
938938,壬午三月廿三日偕诸生携酒过公美家公美宅前山花烂开极可爱为赋一绝
356002,庭菊烂开招子我共赏而空无酒饮闻瓜洲酒美遣酤数升
1070559,庭菊烂开招子我共赏而空无酒饮闻瓜洲酒美遣酤数升殆如灰汁戏作三绝句因以酬九月四日戏赠之作 其一
219661,池上梅烂开一枝横竹间方蕊
896183,九月十日菊花烂开
1001937,吉之南门外见木芙蓉烂开
939149,纵步过资福寺僧留饮出示净度文三教一理论戏书时寺门桂花烂开
1128207,庭菊烂开招子我共赏而空无酒饮闻瓜洲酒美遣酤数升殆如灰汁戏作三绝句因以酬九月四日戏赠之作
134293,早春寄景仁·辛夷花烂开
1070561,庭菊烂开招子我共赏而空无酒饮闻瓜洲酒美遣酤数升殆如灰汁戏作三绝句因以酬九月四日戏赠之作 其三
125991,秋游·七月芙蕖正烂开
1070560,庭菊烂开招子我共赏而空无酒饮闻瓜洲酒美遣酤数升殆如灰汁戏作三绝句因以酬九月四日戏赠之作 其二
272116,得子大诗·撩梦天花灿烂开
985643,池上梅烂开一枝横竹间方蕊
