985065,冯当可以日暮碧云合佳人殊未来效建除体作诗招胜之且索同赋因用其韵
1084322,辛亥九日侍家君同孙子渊子昭子尚登高于家之东山时菊花未开坐客皆以为恨至十月望独步东篱下见前日青枝已烂熳矣东坡云凉天佳月即中秋菊花开日乃重阳不以日月断也于是命酒肴呼邻里饮于丛畔云
284383,郁云丈先后以日人注释欧阳文忠诗钞及王鹤潭学耨堂诗文集见赠，呈句志谢
160576,同胡江范郡裴二宋司马饮会灵水轩即席赋以日
174254,冯当可以日暮碧云合佳人殊未来效建除体作诗
832976,临江仙 沈子封将之官滇中，与兄乙盦暂客沪上，偶有感于东坡谓子由宦游相别之日浅，退休相从之日长二语，以日长榜其寓楼，乙盦有词，依调和之
1084969,中秋见月方以为喜既而阴蔽意殊不满东坡云良天佳月即中秋不以日月断也诸君有醵会之约复用前韵
492562,故元侍讲学士邵庵虞公尝作送赵子章还新安叙论述考亭夫子所以为学之方甚悉于篇终复系以诗意甚惓惓焉吾友寿阳继道吕君独好而录之以日诵而自省其必有得于斯言者矣因追和一首以属其后亦将以交勉而更励也
471273,正宾以日本刀见赠歌以答之
1085506,次韵唐立夫以日者命状见寄
413543,郁云丈先后以日人注释欧阳文忠诗钞及王鹤潭学耨堂诗文集见赠，呈句志谢
747897,林颖叔招同宗涤楼朱伯韩叶润臣孔绣山王少鹤刘炯甫拜黄文节公生日以日问月学旅人念乡分韵得旅字
49942,正宾以日本刀见赠歌以答之
321689,次韵唐立夫以日者命状见寄
121316,以日者命状寄王龟龄
1026624,同胡江范邵裴二宋司马饮会灵水轩即席赋以日暮天无云春风扇微和为韵得日字
976189,以日者命状寄王龟龄
