587975,苏见江携酒过访诗以谢之
571763,陶石篑兄弟远来见访诗以别之
587797,张宪长过访诗以谢之
614142,七夕得正古上人书许渡海见访诗以促之
638325,有乡僧自钱塘来访诗以赠之
866158,闻复卿欲访诗以促之
616049,陈明卿自吴门见访诗以别之
426270,画家廖宏老友远道来访，诗以致谢
685105,王岱麓李三洲携酒过访诗以谢之三首
746198,门人蒋纯甫自吴淞来访诗以慰之
685022,项瓯东过访诗以谢之
603038,梁季参见访诗以赠之兼忆黄惟让
604456,骆勉叔余四十年前同席友也一旦扁舟见访诗以赠之 其二
690452,骆勉叔余四十年前同席友也一旦扁舟见访诗以赠之
587857,王岱麓李三洲携酒过访诗以谢之三首 其一
551170,王相如文学千里来访诗以赠别
581397,周侍御上疏言幸臣事谪怀远驿过访诗以奉赠
588064,谢医士过访诗以赠之
212577,闻复卿欲访诗以促之
581419,闽令刘公升肇庆府判来访诗以奉答
587974,赵东台携酒过访诗以谢之
588017,项瓯东过访诗以谢之 其一
604455,骆勉叔余四十年前同席友也一旦扁舟见访诗以赠之 其一
266833,画家廖宏老友远道来访，诗以致谢
191994,东阳杜季高远访诗以送之
668012,病中武昌二客过访诗以赠之
587858,王岱麓李三洲携酒过访诗以谢之三首 其二
587859,王岱麓李三洲携酒过访诗以谢之三首 其三
588018,项瓯东过访诗以谢之 其二
946034,东阳杜季高远访诗以送之
