1075744,将登南高示同舍 其二
585876,至梯上山麓将登矣忽为大雨所阻及乏仆夫而还作诗讼梯上神
542185,将登五台夜宿圭峰禅房
336806,将登南·三年身在翠鬟堆
870026,和王秀才以光始自陜右游山归复将登少室为诗见寄
48554,木斋先生将登舟以诗见寄次韵
676525,彭思庵绝粒百馀日矣兹将登岳阳楼过吴言别题此为赠
691098,木斋先生将登舟以诗见寄次韵二首
480278,木斋先生将登舟以诗见寄次韵二首 其一
379028,将登南岳绝顶而志上人以小团斗夸见遗作诗谢之
575433,庚午夏六月檄召诸将登坛会盟
1064268,将登南岳绝顶而志上人以小团斗夸见遗作诗谢之
739316,将登华岳
721554,送田丈自代返秦将登华岳
306937,乡居杂咏·早稻将登插晚秧
104394,雷秘校入阙拟官时将登舟过辇下
903665,玉蝴蝶 九月十日，将登黄山，遽为雨阻，遂饮弊止。陈君俞独不至，已而以三阕见寄，辄次其韵
638306,将登黄鹤楼
364997,杂事诗·中将登坛妙指挥
569201,自松江返孟孺印上人同载将登泖塔而为陆伯达所误迂道迫暝始抵泖口垂渡大风骤作维梢久之兴尽而去赋此解嘲书付寺僧
543459,将登西山绝顶昏黑法华寺废址小憩
734186,将登铜雀台过漳河
480279,木斋先生将登舟以诗见寄次韵二首 其二
387058,闻贞夫将登华岳次韵一首寄上
558491,道中索书者甚夥有涉水攀舷拜索恳至者余皆执笔应之至河西务将登陆而舟师又以十纸请予既为书作四句自笑云
716620,与诸将登大甑山作
711707,发舟中湘将登南岳
491289,晚出溪上将登武山不果
1075743,将登南高示同舍 其一
675097,闻贞夫将登华岳次韵一首寄上
610125,将登白云峰听泉声
712823,九月晦日同连双河湛天沐慧容上人二儿士皆自增城将登罗浮中路宿资福寺
337177,将登南高示同舍
714105,送田丈自代返秦将登华岳 其一
991622,雷秘校入阙拟官时将登舟过辇下
269023,败将·登坛犹是汉嫖姚
384345,彭思庵绝粒百馀日矣兹将登岳阳楼过吴言别题此为赠
1120797,将登南高示同舍
714106,送田丈自代返秦将登华岳 其二
