719983,戊寅九月初三日奉谒少师高阳公于里第感旧述怀三首 其二
224051,昨日奉谒还家马上偶成长句亦次前韵用述鄙怀
996115,自巴陵略平江临湘入通城无日不雨至黄龙奉谒清禅师继而晚晴邂逅禅客戴道纯款语作长句呈道纯
1106839,予寓家龟溪赋廪郡故事郡将始至及其将行皆一奉谒予非异人也不敢异众故自壬戌三月至癸亥暮春计裁一年往来三宿何山寺退而自笑复自怜也质明将发纵观殿藏奥曲睹慧枢二士经营成立之迹私有感焉因赋二绝
115526,无咎兄赠子方寺丞见约出院奉谒复用原韵上呈
538270,奉谒长陵敬志鄙感
229960,奉谒夔州何异侍郎
962483,奉谒夔州何异侍郎
619718,辛酉冬奉谒始祖上柱国公祠感赋
862522,予寓家龟溪赋廪郡故事郡将始至及其将行皆一奉谒予非异人也不敢异众故自壬戌三月至癸亥暮春计裁一年往来三宿何山寺退而自笑复自怜也质明将发纵观殿藏奥曲睹慧枢二士经营成立之迹私有感焉因赋二绝 其二
719982,戊寅九月初三日奉谒少师高阳公于里第感旧述怀三首 其一
664143,九月八日奉谒先垄述感
407540,奉谒周恕斋师长沙清香留寓庐 其二
433567,奉谒周恕斋师长沙清香留寓庐
862523,予寓家龟溪赋廪郡故事郡将始至及其将行皆一奉谒予非异人也不敢异众故自壬戌三月至癸亥暮春计裁一年往来三宿何山寺退而自笑复自怜也质明将发纵观殿藏奥曲睹慧枢二士经营成立之迹私有感焉因赋二绝 其一
705618,戊寅九月初三日奉谒少师高阳公于里第感旧述怀三首 其三
732850,鄗城奉谒魏相国留饮葆石堂赋谢
996804,走答明略适尧民来相约奉谒故篇末及之
468204,奉谒伯夷庙
407539,奉谒周恕斋师长沙清香留寓庐 其一
300487,奉谒周恕斋师长沙清香留寓庐
113797,走答明略适尧民来相约奉谒故篇未及之
705619,戊寅九月初三日奉谒少师高阳公于里第感旧述怀 其二
897508,无咎兄赠子方寺丞见约出院奉谒复用原韵上呈子方兼答无咎见及语
722669,戊寅九月初三日奉谒少师高阳公于里第感旧述怀三首
905463,昨日奉谒还家马上偶成长句亦次前韵用述鄙怀
113796,自巴陵略平江临湘入通城无日不雨至黄龙奉谒
