978270,李俊民寄诗一首次韵答之
1239638,赠刘俊民先辈
578340,和羊城梁俊民三首 其二
978269,李俊民三十年前凡两寄诗时困于世故俱不克和常抱此欠近理败箧忽见两诗岁月可惊凄然有感辄赋长句附便以谢不敏
286957,去永年甫一月以夷氛恶避地复至武俊民戎部割宅居之十日遂遣眷南归自赴行在濒行赠谢武丈
892287,州举俊民以艺中第为诗驰贺
578339,和羊城梁俊民三首 其一
1247512,赋刘俊民镇抚兰室
578016,羊城友人梁俊民以诗寄赠余余因次韵以答之
202099,李俊民三十年前凡两寄诗时困于世故俱不克和
1247820,雨中喜刘俊民孔克逊相过
55336,赠刘俊民先辈
438748,留别孙俊民姚公茂
255935,留别孙俊民姚公茂
124565,州举俊民以艺中第为诗驰贺
840485,去永年甫一月以夷氛恶避地复至武俊民戎部割宅居之十日遂遣眷南归自赴行在濒行赠谢武丈
747690,盱山试玻璃泉赠韩俊民
209374,赠蔡俊民挟雷法妆眼科北行
347411,李俊民寄诗一首次韵答之
417707,满庭芳 送俊民之化州
131840,次韵吴竹溪名俊民谢单景山名枢载酒
685755,和羊城梁俊民三首
1139522,赠蔡俊民挟雷法兼眼科北行
208578,元宵怀都城简胡令俊民时胡连夕在告
884557,元宵怀都城简胡令俊民时胡连夕在告
1247428,刘俊民镇抚自京回趋会不及诗以寄意
347410,李俊民三十年前凡两寄诗时困于世故俱不克和常抱
578341,和羊城梁俊民三首 其三
