533079,暮春张考功助甫邀游韦氏园时梁舍人思伯偕至 其一
533758,立春日同王太仆梁舍人彭鸿胪集杨仪部宅
533085,暮春张考功助甫邀游韦氏园时梁舍人思伯偕至 其七
533080,暮春张考功助甫邀游韦氏园时梁舍人思伯偕至 其二
539130,送梁舍人奉使还岭南
683809,赠别梁舍人鈙
533081,暮春张考功助甫邀游韦氏园时梁舍人思伯偕至 其三
596150,和黎职方冬至日别梁舍人还朝
592145,十六夜同黎秘书吴侍御梁舍人集梦芝馆听管山人作吴歌
591547,寄梁舍人思伯
533082,暮春张考功助甫邀游韦氏园时梁舍人思伯偕至 其四
533087,暮春张考功助甫邀游韦氏园时梁舍人思伯偕至 其九
538908,赠别惟敬北上兼简梁舍人
533084,暮春张考功助甫邀游韦氏园时梁舍人思伯偕至 其六
533775,梁舍人李环卫招同王杨丘三曹长康曹管张四山人游邓园得云字
540421,赠别梁舍人鈙 其一
593609,午日李明府招集显灵道院同姚太守方计部黎秘书王太仆梁舍人沈比部分得恩字
533784,元夕前偕梁舍人思伯携酒过余伯祥旅寓邀周潘刘黄诸子同集
916282,梁舍人奉使巴中
533086,暮春张考功助甫邀游韦氏园时梁舍人思伯偕至 其八
533083,暮春张考功助甫邀游韦氏园时梁舍人思伯偕至 其五
193138,梁舍人奉使巴中
593614,送梁舍人持伯使豫章暂还南海
533745,抵京王太仆仪甫许舍人稚干梁舍人思伯偕康洪管三山人见访
704337,暮春张考功助甫邀游韦氏园时梁舍人思伯偕至
540422,赠别梁舍人鈙 其二
591925,陆山人元德见过同黎秘书惟敬梁舍人思伯小酌得山字
