1066580,戊午次吴山解空院乃端师子道场是日上巳呈法中禅老
638034,重九后一日赋是日即馀余日
920460,八月十七日，复登望海楼，自和前篇，是日榜出，余与试官两人复留五首 其三
920474,是日宿水陆寺，寄北山清顺僧二首 其一
509632,去岁余与窗友赵伯颙同外补五月十有二日予至钱塘宿斋吴山而伯颙已先至因来叙话夜分始别匆匆一载矣兹予统师南征经伯颙之邻封伯颙亦来犒师亦以是日会于浔阳两情相对喜而复感而伯颙又亟欲别去予因口占三绝以赠 其二
140056,奉谢资阳谢纯天诸友是日三池周季章冯季修许
514718,渡江至仪真是日微风不兴江水如镜与伯谐伯常缓酌微吟不觉至暮
1249059,十二月廿二日为重阳王真人诞辰是日立春在淞江长春道院瞻拜真人及七真像敬题薛一山丹房
1121021,便风经雁汊宿荻港是日舟行四百里三首
459555,是日酒馆饯行，大醉，遂拉薛与共至云溪，更饮肖家。夜半稍醒，二人尚酣然。次日薛当归，予以班不能送，作《贺新郎》留之。及薛归后，再赋《飘风行》以寄
1240841,书扇寄玉岩在瑶芳所书是日食金桃（洪武庚戌夏五月）
446354,是日逃班遥往华兴寺参禅夜归记此
1120870,陪李使君登庾楼是日云雾不见淮山二首
1212789,司春园五月五日梨花是日因事不果 其一
709026,寒夕文燕再叠前韵是日我闻室落成延河东君居之
509379,是日启行六卿台长诸公祖饯德胜门外既晚宿弥陀寺明旦别去酬寺主衍公一律
771405,月华清•连夕阴雨，中秋后一日放晴，月分外皎洁，是日值秋分节
1120588,是日因游春谷园池复以所分题五平韵赋六言五首
561139,薛楼宴集次汪户部希会是日出师捕安义之寇
835332,摸鱼子 彊村写示龙华桃花词，依韵答之。是日寺僧约看花未往
748685,大孤山是日至湖口风利未泊
1224243,二月二十四日自琼州出白沙驿阻风二日不得渡海是日有幕客送寒衣却出赋诗
782004,元夕前三日林子花烛是日雪
901112,是日归馆中作
807527,念奴娇  游楞伽山上方寺是日微雨
459542,是日至五田中学寻老薛，数年不见，苍然老矣。赋赠三首 其一
1130832,昌甫诗来言九日是悼亡之日因答和及紫芝是日过城下
567221,作荷芦于是日亦次朝题
323920,敕局同年相饯是日谢遣婢子春饶者还其家同年大不然之共怅然也
1005425,会计家酿得十石日饮三升可周一岁是日一饮成醉
345412,独游·是日游于独
469353,馀不溪回舟寄讯章元礼吏部是日雪
950778,便风经雁汊宿荻港是日舟行四百里三首 其二
681757,读石翁诗是日东光河上遇户部侍郎王公民望惠以此集
617520,佛日与诸君泛舟江上俗是日已陈龙舟之戏谓之出水龙
920459,八月十七日，复登望海楼，自和前篇，是日榜出，余与试官两人复留五首 其二
1216066,明日慈仁宫进讲毕钦承特命改授崇文监丞参检校书籍事是日同僚邀复游西山举酒为寿赋二首简谢雅意 其一
509633,去岁余与窗友赵伯颙同外补五月十有二日予至钱塘宿斋吴山而伯颙已先至因来叙话夜分始别匆匆一载矣兹予统师南征经伯颙之邻封伯颙亦来犒师亦以是日会于浔阳两情相对喜而复感而伯颙又亟欲别去予因口占三绝以赠 其三
1225287,次韵许可用参政从幸承天护圣寺是日升左丞
168370,是日迎送之车属道戏成
1103119,是日因游春谷园池复以所分题五平韵赋六言五首 其一
180035,饮文氏园是日鹊噪于庭坐上烛花无数就试者凡
496257,临江仙 其三 壬寅六月望曰，次醉翁韵，是日立秋
690860,春日尹世立携同高仲良陈伯良集放生社是日微雨
862734,中春二十四日集仰止书室德茂仰止何彦亨彦发邓叔度与仆凡六人至夜格夫自外归就邀同饮仰之是日对棋屡败德茂任直时出骂坐语叔厚谓子可以诗纪事否翌日戏成长句
782368,九月四日同年卢雅雨都转喜余来赴登高之约即放艇真州邀同年戴通乾来会是日同饮雅雨官舍期以九日游平山堂通乾得诗二首即次其韵 其一
826486,摸鱼子·泛西溪至交芦庵，观所藏西溪图画。是日谒樊榭先生与月上夫人栗主，因用樊榭题西溪卜居图韵
561543,奉和师相序翁阁中盆荷初开是日翁六载考绩 其二
179859,自离芜湖多阻风是日早次雁汊风顺亟驾帆以行
820394,青玉案 二月二十闰枝丈瑑青兄招饮词集是日游北海
928273,上巳小饮追忆乾道中尝以是日病酒留三泉江月亭悽然有感
964206,浣溪沙 其二 以鸳鸯梅送曾守，是日，曾守携家游南园
882702,壬子元日遂安县学讲书齿饮前此四十三年钱建为令尝有此集题名在壁是日詹本仁有诗余和其韵
191586,十一月三十日乃耘老弟生朝余是日也宿留富阳
787595,是日适逢寒日归途有作次方干寒食过东阳韵 其一
812401,是日适逢寒日归途有作次方干寒食过东阳韵
490417,仲春望日予为社主诸公有不赴者是日无诗且散去雨中闷怀因取杜句继以唐宋人句集诗九律各志所感奉寄诗皆人所习闻者姓名故不列载萝石隐翁时在禹穴 其八 紫峡隐士居峡川
648189,诸公从狩龙山因登牛首山访佛窟寺胡学士有诗是日仆以病不及行想像佳游辄用次韵三首 其二
1090512,六月二十一日戊寅率同寮诣登源祖庙中迎英济祷雨是日也雨随车至越翼日己卯继之至中宵方霁自辛巳至于乙酉遂沛然沾足丙戌敬送神因书二小诗以纪灵异 其一
389850,访邵子弁是日以友人王太史聘入京不遇
277689,重九卧病忆兄弟，前年是日雨，在长安与姊联句寄怀，因成一律
933243,癸丑重九登山亭追怀顷在兴元常以是日猎中梁山下乐甚慨然赋诗予于是生六十有九年矣
366144,十二月十二日斋祠西太一宫是日大风
244481,是日至马祖岩和前韵
105918,题郭熙雪晴松石平远图为张季野作是日同读杜
637173,发广宁都宪诸公饯于城东是日宿高平
1212790,司春园五月五日梨花是日因事不果 其二
389988,程孟孺谒余武昌以是日至而余以是日发因偕登庐岳各返故里遂成二绝为赠并呈豫章诸王孙
389988,程孟孺谒余武昌以是日至而余以是日发因偕登庐岳各返故里遂成二绝为赠并呈豫章诸王孙
937682,十三日再赋二首其一以赞使君是日对花赋此韵诗笔落纵横而郡中修水战之具方大阅于燕公楼下也其一自叙所感忆年十五在杭州始识此花皆三丈高木尝赋诗焉 其二
465996,宴清都 是日，程垓体
712050,雨后冯再来中丞招同王长文姜坤侯何涟若陈继袁诸子泛舟谒南海神祠登浴日亭望海是日晴霁诘朝复雨即事赋谢二首 其一
622223,九日同诸公登涵元塔四首塔之七层　初峻工于是日 其三
490415,仲春望日予为社主诸公有不赴者是日无诗且散去雨中闷怀因取杜句继以唐宋人句集诗九律各志所感奉寄诗皆人所习闻者姓名故不列载萝石隐翁时在禹穴 其六 西皋太守
688657,晨观风洞登叠綵楼历拱辰亭亭为镇守傅中贵所创岩峦奇耸千里在目诸巡院有诗予辄次韵是日介行登赋不尽兴也
963279,闰月廿六日奉御香祈天竺观音于昭庆寺是日得霁
561613,岁除日省中晚归是日上手札曰谕秩宗有光禄酒馔之赐 其二
458593,立春日作，盖记八五年是日大雷雨与彭李在墓山事也
517826,壬寅冬至二十四韵是日早雪晚晴
1210664,港口舟行是日室人生日寄此为寿 其二
200169,上已同省斋直轩郊游直轩有诗次韵是日又值寒
466249,是日至五田中学寻老薛，数年不见，苍然老矣。赋赠三首
841521,将次龙家集天大雷雨以风是日晚晴遣兴十四韵
1091517,丙戌重五后一日予与同舟三人游虎丘庚寅岁予亦以是日至枫桥望虎丘塔迫日莫叹息而去
1041339,直舍留道粹广渊君实圣民伯初饮是日邻几济川宴王金吾园亭不预会戏作五言寄之
638817,紫阳庵吊丁野鹤用萨天锡韵是日同任侍御张王二冬官娄春曹饮亭中遇雨
69782,书扇寄玉嵒在瑶芳所书是日食金桃
355766,江仲嘉仕吴兴雅重道场山长老惠颜仲嘉之柩以八月十五日至山下颜以是日告寂
367084,是日天气乍晴颇快人意因和韵拉世弼谒傅岩
457975,晃荡诗为肖作。是日同晃者肖卢 其一
930394,九月十八日至山园是日颇有春意
903919,长庚绍兴十九年七月十九日尝游阳华后十有二年复以是月是日从乡曲诸公再到岩下感今追昔因成十韵
568041,答献叔折杏花见赠是日予初度
572766,是日新晴
515112,庚戌元日县中随例望阙行礼因思旧岁是日方在清化寺守冻感时抚躬率然赋此
366497,五月十一日早行是日风寒如八九月
54864,南村约庵雨中过访喜新街成饮平胃散酒是日谈
751148,正月二十日由枫桥至五{氵众}泾用东坡是日女王城诗韵
1224690,泰定丁卯八月十二日崇天门传胪赐进士右榜第一人阿察赤左榜第一人李黼皆肄业国学日新斋余西厅授业生也是日京尹备鼓乐旗帜麾盖甚都导二状元入学谢师拜余明伦堂榜眼刘思诚探花郎徐容尝因同年黄晋卿彭幼元从予游亦拜其侧其馀进士以门生礼来拜谢杂遝不记姓名圜桥门而观者万计都人以为斯文盛事昔未有也同寅举酒相属偶成四绝以纪其事 其二
1103121,是日因游春谷园池复以所分题五平韵赋六言五首 其三
721351,雨后冯再来中丞招同王长文姜坤侯何涟若陈继袁诸子泛舟谒南海神祠登浴日亭望海是日晴霁诘朝复雨即事赋谢二首
950779,便风经雁汊宿荻港是日舟行四百里三首 其一
883192,端午侍母氏饮有怀二兄偶阅二苏是日高安唱和慨然用韵
688637,通州城北新浚通惠河以达漕粟入京免陆运之劳是日登舟有作
1078419,正之复次前韵作四篇见示是日适登城楼以望江山且阅捷报因赋六章以报之 其五
771170,甘州•丙辰春禊，是日余初度
972110,八日雨是日期成父来已而不至
817341,出山海关是日宿叶家坟
956425,甲午岁朝寓桂林记去年是日泊桐江谒严子陵祠迤逦度岭感怀赋诗
1085259,四月从驾诣德寿宫与诸公会食于和乐楼是日借洪景严承旨马戏云从驾滥骑承旨马朝天叨缀舍人班异日再集胡舍人邦衡云不可不成篇也遂于楼中足之
1078417,正之复次前韵作四篇见示是日适登城楼以望江山且阅捷报因赋六章以报之 其三
356868,百字令·乙未七月十八感赋，是日亡妇五十生日也
925296,陪侍知府待制丈巾山高设窃闻是日赓和去春林倅红楼风什奉继一首
827947,四月十五日田伏侯同年约崇效寺看牡丹予晨往主客皆未集次日晤李猛庵丈言是日到最后席散客已尽矣独坐成咏因忆昔与半塘老人来游恰亦四月十五日感怀三首予因和之 其一
149767,和岘窗韵是日也适赴座主西湖社日之宴
96635,九日次韵斯远去年是日同成父登半山亭见怀之
957953,十一月十三日宿东林是日小雨不见庐山戏留绝诗于方丈
688622,晚次普门寺作是日发郢诸公饯于池河
1165141,洪州西山祈雨是日辄应因赋诗言事
296744,出京之前一日，王吉臣、干臣昆季祖饯于陶然亭。是日阴雨，赋此志感
490416,仲春望日予为社主诸公有不赴者是日无诗且散去雨中闷怀因取杜句继以唐宋人句集诗九律各志所感奉寄诗皆人所习闻者姓名故不列载萝石隐翁时在禹穴 其七 海村麾使
561502,通州城北新浚通惠河以达漕粟入京免陆运之劳是日登舟有作 其一
872743,奉陪舅丈秘书彦平主簿兄游慧聚终日小饮上方待月再历妙峰诸胜处用前人韵得二诗是日尝微雨作 其一
142907,闰月廿六日奉御香祈天竺观音於昭庆寺是日得
790351,岁暮琴川返棹，折得红绿梅。是日已立春矣，舟发赋此 其二
1078420,正之复次前韵作四篇见示是日适登城楼以望江山且阅捷报因赋六章以报之 其六
647067,郎君游闽拟以是日登陆风雨大作心甚忧之
539906,访邵子弁是日以友人王太史聘入京不遇
889277,是日大雪际晚复晴月色辉映尤为可喜偶成数句
889018,再辱九日和章连日公冗失于奉赓今日大阅偶于马上得之兼简是日座客
1091016,闻前月时事君举象先皆与南宫之选是日读易诗春秋作四首 其二
48343,闻刘东山司马致仕之命是日得谢方石祭酒到家
548226,夏日同诸子集顾光禄分得屏字是日为光禄诞日
477722,奉次毕司空与客对弈谢荅张侍御惠酒之作是日司空招予出城不及赴
697710,己亥人日是日壬子上表贺海平二首
461922,宴清都 其一 是日，程垓体
468571,五月六日先为马蹶而伤左足自清漳千里舆归闽宪是日之夜坐占长句
1103120,是日因游春谷园池复以所分题五平韵赋六言五首 其二
897802,到陈午憩小舍有任王二君子惠牡丹二盘皆绝品也是日风雨大寒明日作此诗呈希古
1070920,海外自去冬不雨至今农圃俱病郡侯率僚友为民祈祷二月十八日祭社致斋是日雨作喜而成诗呈逢时使君
554567,己亥人日是日壬子上表贺海平二首 其一
583152,九月九日寓九江时户部李时雍同年预约游庐山以是日雨作中辍时雍复遣人送酒侑以一绝因走笔戏答四绝 其一
790350,岁暮琴川返棹，折得红绿梅。是日已立春矣，舟发赋此 其一
561503,通州城北新浚通惠河以达漕粟入京免陆运之劳是日登舟有作 其二
770190,是日寒甚 其一
1236504,明日慈仁宫进讲毕钦承特命改授崇文监丞参检校书籍事是日同僚邀复游西山举酒为寿赋二首简谢雅意
770218,冯庵移居穿虹滨以诗贺之是日四月八也 其五
457976,晃荡诗为肖作。是日同晃者肖卢 其二
765089,贺新凉 岳州大捷，上以二月二日宣凯，是日大雪
384194,十一月朔，偶忆庚戌是日出京，感而有作
331104,海外自去冬不雨至今农圃俱病郡侯率僚友为民祈祷二月十八日祭社致斋是日雨作喜而成诗呈逢时使君
1121465,是日天气乍晴颇快人意因和韵拉世弼谒傅岩
1121083,宿太平宫葆清庵自和少年壁间戊辰岁所作韵是日闻虏大入滁濠二首
1093338,丁寺丞灵山阁同国正小集是日得雨次韵仁甫五字
896271,正月二十五日以小疾在告作三绝是日苦寒 其一
676473,清明大雪因忆十年前亦是日下雪盖北方常事南人则未之见也
833480,浣溪纱 三月十五夜东园看月，是日清明
1083217,书室述怀奉寄民表兄是日得民表书
770214,冯庵移居穿虹滨以诗贺之是日四月八也 其一
829680,三月十二日四十八岁初度是日自上海赴南京
1005870,闻鸠有作喜为晴兆也是日开霁又喜其占之有验再赋之以贻达善季辨天色难保惟快作诗为应耳
277899,是日绮石老人养疴不至倚枕绘王瓜芦菔以志昔日春明游宴之乐为题其后
561163,东昌驿下逢少保鹅湖相公赴召，是日大行人赍敕迎劳适至，敬抒赠贺
1042930,赤甲祈雨是日获之
897439,三伏暑甚七月八日立秋是日风作凉爽炎酷顿消老病欣然命酒成二诗 其二
1062880,是日晚次晋祠日已暮矣有客呼门甚急问之则阳曲尉高履伯祥也不鄙谓余置酒叙别感其志意以诗赠之高尝客河间河间帅南阳公以一饭礼焉高每语余未始不感激也故见于卒章
611516,戊午清明旗峰踏青因忆客岁是日携常湘云赋春游篇往事东流共增感叹二首 其一
1016345,尝拉寿居仁访青山性老是日小舟抗断港进退不能几至兴尽薄莫叩关少慰寂寥之叹居仁有诗次韵以谢
52171,夜饮醉归赠王伯纯是日王得容程子初同饮
403858,水调歌头 其二 元宵日邓尉看梅花是日为慧素生日
761749,青山湿遍 五月二十四日，宣武门西广西义园视亡儿小羊墓。是日为亡姬桐娟生日。
950712,五年不治笔研奉诏起家是日始草辞免奏旋假书吏于郡题写皆生疏又堂帖趣行三日戒涂偶成二首 其一
939127,白鹿洞谒先生祠堂呈李梦开教授是日李入洞讲书
180675,以赞使君是日对花赋此韵
772969,光绪甲午自春徂夏阖郡不雨农人难于布种心窃忧之仍旧恭迎冈山观音大士入城中是日神甫降而雨大作自午至戌四野均沾非神之赐不及此喜而以诗纪之并酬神惠。
574505,正月三日小饯施克和于惠山酒间克和诵刘后村元日诗为令因用其韵再致别意是日予奉老母观新精舍故别设于知微山房云
827140,阮郎归  辛卯六十四岁 病树索题东湖修褉图，余习翁笔也。是日予病未赴
751780,十一月二十八日移入任城梦园是日为王宜人忌日感而有作
950930,比闻赵季茂奉板舆行春甚乐予跃然效之是日乃值大风雨昏后倦归则素月流天仍复晴矣自此连日春色尤浓杏已过雨红英满地怅然有作因寄
544657,明晨邀三君集舟中是日雪大作竟暮
495018,甲午正月初七日于严介溪公所寓山池作瀛洲会是日会者八公分得七言长句体为八仙歌
683009,雨中捡箧得石田先生丁卯岁赠诗云多时契阔费相思就见江城喜可知时事但凭心口语老人难作岁年期林花及地风吹糁檐溜收声雨散丝明日孤踪又南北教云封记壁间诗后题五月十一日适是日亦五月十一及今丁丒恰十年而先生下世八年矣因追和其韵以致感叹
896269,正月二十五日以小疾在告作三绝是日苦寒 其二
807555,东风第一枝  丁巳元日大雪是日迎春
472986,仲春廿日发瓜渚同顾使君益卿赴闽粤郭次甫吴孝甫吴叔原送余京口是日值余初度记此留别
53784,清明日陪杨铁崖饮城东门是日风雨
102225,是日自磻溪将往阳平憩于麻田青峰寺之下院翠
583196,长至寓徐州是日晴明喜而有作
971615,是日雨阴殊甚咫尺如隔然
492924,八月十一日自水南渡江道金华过北岩访萧鹏举氏是日云阴掩冉殊不见日色道中赋绝句三首明日因录柬举善暨鹏举伯仲 其一
779273,台城路 六月廿六，云姜招游尺五庄看荷花。是日许金桥郎席题词，遂用其韵
162587,送洪宰西归少歌渔春渡是日风雨
404793,喜迁莺·戊寅十一月朔冬至，病树丈和梦窗甲辰冬至韵，要同作。忆丙子岁是日适归里展墓，独行风雪中。今几何时，而吴楚竟同异域，因时感旧，言愁欲愁
806808,菩萨蛮  云臣招看牡丹以雨未赴小词奉柬并柬是日赏花诸子
622222,九日同诸公登涵元塔四首塔之七层　初峻工于是日 其二
769658,沁园春·忆同李凉肆过刘蔚园水亭，饮烧春于蔷薇花下，醉后题记壁间，乃丁丑浴佛前一日也。丙戌同刘子客何阜，适是日过其寓。话及兹事，忽复十年，怆然赋此，并怀凉肆
1239199,己丑元旦过承天门作是日大风
180314,焦山汉末焦光隐於此是日乃其生日士人会者甚
1078720,谒蒋仲远坐中出所知和徐学士诗归而次韵二首是日饮仲远宅见二侍儿 其一
699687,九日同诸公登涵元塔四首塔之七层　初峻工于是日
571592,竹亭新种佛桑每日但开一朵是日六朵并开戏呈二府诸公
