537879,除夕张山人分韵是日有浙藩之报 其一
1217812,丁酉八月十二夜武陵对月是日省除青田主簿
1092943,二十八日过器远是日生朝且有淮总之辟
1234599,早发东阿午经东平晚宿汶上是日雪
556451,自乍浦下海至舟山入舟风恶四鼓发舟风恬日霁波面如镜舟人以为海上罕遇是日行六百五十余里
907352,是日至马祖岩和前韵
116485,离富池望庐岳是日入夹口直达浔阳遂舍大江之
534438,是日再游金山寺
920458,八月十七日，复登望海楼，自和前篇，是日榜出，余与试官两人复留五首 其一
445808,是日有闻集唐宋名家句用梅振才先生韵
560201,过高邮湖是日烟雾望东岸彷佛如寺
630046,陈使君招饮粤秀山是日听词人歌陈乔生新制曲有怀乔生
522210,是日晚独酌小吴山下 其一
316170,木兰花慢·二月廿三日至上海，方知是日为清明也
661333,长儿琰行年四十族长老而下皆辱来贺儿颇任事宗祠之建豫有劳焉是日榜刻适完余亦良喜因忆前十年赴召北上途中值吾儿生朝曾寄一诗勉之今用原韵赋诗二首见意 其二
974183,既过曾居因访刘茂实秀才是日明叔同出恨仲威不至
683350,除夕张山人分韵是日有浙藩之报
545447,李本建招集薛馆薛于弧矢最精挟弹尤称绝技是日纵观许为李作长歌赠薛先赋此篇
513392,与亨大懋衡二太史天瑞元益贯之三给事同游神乐观是日廉伯有约不至 其二
1222661,七月六日承贞居先生远寄周钟铣间有女象凫之形则考工记所谓凫氏为钟者也击之与夷则合而是日又适立秋古物之来岂偶然哉辄成小诗拜贶之辱
352007,任守作醮为民祈福先期而雪是日开霁
410516,访胡孟云于清江旅司令部地为前河督署内有清宴园是日淮阴官绅公宴馨航等余辞不赴席散乃入之
1132039,闻前月时事君举象先皆与南宫之选是日读易诗春秋作四首
1076268,陪李使君登庾楼是日云雾不见淮山二首 其二
941291,送洪宰西归少歌渔春渡是日风雨
333386,正之复次前韵作四篇见示是日适登城楼以望江山且阅捷报因赋六章以报之
561542,奉和师相序翁阁中盆荷初开是日翁六载考绩 其一
996342,三月乙巳来赋盐万岁乡且蒐狝匿赋之家晏饭此舍遂留宿是日大风自采菊苗荐汤饼二首 其二
522336,初九日见红梅约味苓同赏是日新作水楼亦欲诗人过之为后来嘉话也
548582,小园社集主宾凡八人是日雨分得衫字
1224818,次韵许左丞从车驾游承天护圣寺是日由参政升左丞
365335,上巳日玉津园赐宴是日杂端为主人
904825,临江仙 其四 老母太恭人三月二十一日生，是日仍遇己卯本命，作千岁会祝寿，子孙三十八人
530866,登大慧寺逌然台是日杜鹃鸣于北都
116414,正月二十五日以小疾在告作三绝是日苦寒
622224,九日同诸公登涵元塔四首塔之七层　初峻工于是日 其四
772647,九日同人集东堂观剧是日演周忠介公遗事
897438,三伏暑甚七月八日立秋是日风作凉爽炎酷顿消老病欣然命酒成二诗 其一
630619,闻云南报因酬汪居士是日海幢老人六十初度澹归侍坐
949939,品令 其一 重九前一日，飞卿携酒相过，坐中歌空青送客词，因用其韵。是日淮上贼军退舍
1116516,是日宿水陆寺，寄北山清顺僧二首
1082959,是日天气乍晴颇快人意因和韵拉世弼谒傅岩 其二
210373,己酉九日次靖节是几是日韵
701137,奉和大师序翁二考复职是日内阁盆莲初开漫兴二首
466298,晃荡诗为肖作。是日同晃者肖卢
946163,重阳日寄瑞安留宰留宰以是日宴新第人并见招不及赴
191815,重阳日寄瑞安留宰留宰以是日宴新第人并见招
1075742,冬至前九日湖水尽冰后二日晚晴小舟循湖心而归冰已稍开书是日所见
900506,长沙历冬无雪正月十日与客登卷云亭望西山始见一白莫夜复大作竹声萧然是日坐上分韵得云字
180551,十三日再赋二首其一以赞使君是日对花赋此韵
1112705,正月二十五日以小疾在告作三绝是日苦寒
404629,玉楼春·戊辰端阳上海诗词学会与美国四海诗社结盟为姊妹社。是日两社同时在上海、纽约召开朗吟会，即席口占小令
1103936,丁酉正月九日省谒家叔洁山居士于郭仙峰下是日仲退亦省其叔四山翁于是偕行洁山既留饭送别乌龙潭上裴回久之绝壁梅花炯然独立如高人招之不来冻泉泠泠下岩窦如瑟筑声相顾绝赏因以春山多胜事分韵约四山父子同赋时四山留外未归也韵以齿次瑞得多字
641737,予与翁应吕同至赣州府是日各从本道予往雩都翁赴惠州作诗送之时十一月十有七日也
815472,宋建中靖国辛巳七月二十八日为东波先生骑箕之辰先生乞居常州，卒于孙氏寓馆，其地去余家不数十武，旧迹犹存，岁值辛巳，去先生六百年矣，感今追昔，邀同学诸子于是日肇祀先生，用眉山二字成诗二章，致敬恭思慕之意云
882674,九日偕同寮至破山还饮誓清亭是日早雨寻霁自余至官三见菊花节常会于誓清因成二诗志之 其二
921217,正月二十日，与潘、郭二生出郊寻春，忽记去年是日同至女王城作诗，乃和前韵
1091018,闻前月时事君举象先皆与南宫之选是日读易诗春秋作四首 其四
1077390,是日闻报御笔许牵复有感
51080,是日往观果刻本盖世贤招饮恐客不至故绐尔乃
947715,水龙吟 寿王漕，是日冬至
179826,祷雨于保福寺是日大雨至
579315,弘治二年冬子长命书是日应之 其一
323330,过八叠有小舟卖虾是日风便但江岸萦迂疾徐相半
1240538,是日秦淮海泛舟过绰湖向夕未归余与桂天香坐芝云堂以伫之堂阴枇杷始华烂炯如雪乃移桃笙树底据磐石相与奕棋遂胜其紫丝囊而罢于是小蟠桃执文犀?起贺金缕衣轧凤头琴余亦擘古阮嗺酒甚欢而天香郁郁有潸然之态俄而淮海归且示以舟中所咏余用韵并纪其事云
480277,闻刘东山司马致仕之命是日得谢方石祭酒到家日所寄诗感而有作
99427,八月十七复登望海楼自和前篇是日榜出余与试
1204662,千秋岁 寿王推官母九十一是日小寒节
551286,送了空禅师归长干寺是日为观音大士初度
184431,九日偕同寮至破山还饮誓清亭是日上雨寻霁自
1085586,亡姊之葬在九月而不得其日十五日读坡诗至英公燎须事不觉悲涕是日辛酉得非葬日邪诗以寓哀
821920,浪淘沙慢 八仙桥青年会听歌，是日有生死恨搜孤救孤三娘教子梁红玉诸剧
1224027,兴庆宫朝退次韵袁伯长见贻是日上加尊号礼成告谢集即东出奉祠斋宫
461923,宴清都 其二 是日，程垓体
99227,正月二十日与潘郭二生出郊寻春忽记去年是日
1116621,八月十七日，复登望海楼，自和前篇，是日榜出，余与试官两人复留五首
329276,饭花光店是日立春
713253,寄祝冯再来中丞是日值立春三首 其一
1112764,三伏暑甚七月八日立秋是日风作凉爽炎酷顿消老病欣然命酒成二诗
788293,是日瞻拜御容追忆慈颜不胜悲怆再成一律
367906,闻前月时事君举象先皆与南宫之选是日读易诗春秋作
760229,是日之客王方伯外，有蒋亦贌廉访、潘左阶观察、夏用卿殿撰，而主人则丁伯厚侍讲、吴玉臣编修、汪莘伯广文及予也，十叠前韵
800750,宋建中靖国辛巳七月二十八日为东波先生骑箕之辰先生乞居常州，卒于孙氏寓馆，其地去余家不数十武，旧迹犹存，岁值辛巳，去先生六百年矣，感今追昔，邀同学诸子于是日肇祀先生，用眉山二字成诗二章，致敬恭思慕之意云 其一
1070188,仲嘉分题得诗分韵得经字是日仲嘉以事先归代作一首
142500,和子远官牌夹口韵是日闻官军破虔贼
492254,春同旷伯逵周叔用徐仲孺登秋屏阁是日闻淮郡有警风沙黯然赋呈万德躬孙伯虞诸君子
479673,南村约庵雨中过访喜新街成饮平胃散酒是日谈论间多可慨者别后赋此寄之
897226,离富池望庐岳是日入夹口直达浔阳遂舍大江之险示同行
825227,三月十二日四十八岁初度是日自上海赴南京 其一
809026,赋得爆竹声中一岁除是日微雪
561965,壬子秋七月一日与郭文伯饮入于朱弘道竹所是日大雨拟苏州
1118877,十三日再赋二首其一以赞使君是日对花赋此韵诗笔落纵横而郡中修水战之具方大阅于燕公楼下也其一自叙所感忆年十五在杭州始识此花皆三丈高木尝赋诗焉
1091015,闻前月时事君举象先皆与南宫之选是日读易诗春秋作四首 其一
447166,五月二十一日离汉返川，船上得句。是日适为余三十四岁生日
100908,在彭城日与定国为九日黄楼之会今复以是日相
90973,发赵屯得风宿杨林池是日行二百里
1216039,兴圣殿进讲即事是日赐酒饮杏花下
938263,游慧林寺以三峡炎蒸定有无为韵得定字是日欲逃暑阁下而守阁童子持不可
332483,念奴娇·座中赠陈子文、是日陈心简、陈子厚诸子，同集蕉林
669663,九日晚对菊次容处士韵，是日县主曹侯二尹邵侯持酒过白沙，李九渊容贯各馆乡中未归
622221,九日同诸公登涵元塔四首塔之七层　初峻工于是日 其一
611517,戊午清明旗峰踏青因忆客岁是日携常湘云赋春游篇往事东流共增感叹二首 其二
363088,十月十九日至沪初随何大臣如璋使日本即于是日由上海东渡今十二年矣
1088975,任守作醮为民祈福先期而雪是日开霁
99675,出颍口初见淮山是日至寿州
983894,祷雨于保福寺是日大雨至
513393,与亨大懋衡二太史天瑞元益贯之三给事同游神乐观是日廉伯有约不至 其三
868382,己酉九日次靖节是岁是日韵
493972,游滁山二十咏 其二十 春寒是日和暖特甚丰山似喜人再至也
950777,便风经雁汊宿荻港是日舟行四百里三首 其三
592533,丁卯九月十七日同汪山人黄中舍集杨汝德园赏菊是日牡丹忽开一花江北深秋未见寒色然亦异矣为纪一诗
751301,咸丰三年冬贷粟钱江农人张国震馈钱以济是日暴风不止先王母倚闾忧甚距今十九岁矣感怀成诗
522350,四月七日陪约庵适斋二太守东园鸿胪龙山都谏登超果一览楼望西隐堂有感还饮翠林精舍作时西隐火已一年而寺主杰峰亦化去矣是日翠林亦病出蔬馔延客故末句云云
99223,是日偶至野人汪氏之居有神降于其室自称天人
583155,九月九日寓九江时户部李时雍同年预约游庐山以是日雨作中辍时雍复遣人送酒侑以一绝因走笔戏答四绝 其四
872742,奉陪舅丈秘书彦平主簿兄游慧聚终日小饮上方待月再历妙峰诸胜处用前人韵得二诗是日尝微雨作 其二
882673,九日偕同寮至破山还饮誓清亭是日早雨寻霁自余至官三见菊花节常会于誓清因成二诗志之 其一
796057,喝火令 小春廿三为先夫子小兆祖茔，是日值余母难，抚然倚此
459544,是日至五田中学寻老薛，数年不见，苍然老矣。赋赠三首 其三
332185,贺新凉·二月二日，宣岳州捷是日大雪和其年
1042417,十二月十二日斋祠西太一宫是日大风
936801,乾道初予自临川归钟陵李德远范周士送别于西津是日宿战平风雨终夕今自临川之高安复以雨中宿战平怅然感怀二首 其二
700171,涯翁示独酌二诗序云是日饮松江酒次韵奉谢
490418,仲春望日予为社主诸公有不赴者是日无诗且散去雨中闷怀因取杜句继以唐宋人句集诗九律各志所感奉寄诗皆人所习闻者姓名故不列载萝石隐翁时在禹穴 其九 石林上人
712051,雨后冯再来中丞招同王长文姜坤侯何涟若陈继袁诸子泛舟谒南海神祠登浴日亭望海是日晴霁诘朝复雨即事赋谢二首 其二
456433,生查子 端午节亚平宁烟斗客聚会李津生宅。是日为李夫人王湛芳辰
491834,下苍山西麓将问道过金精是日赵伯友与客先赴山中闻已出谷口相候喜赋
683782,程孟孺谒余武昌以是日至而余以是日发因偕登庐岳各返故里遂成二绝为赠并呈豫章诸王孙
683782,程孟孺谒余武昌以是日至而余以是日发因偕登庐岳各返故里遂成二绝为赠并呈豫章诸王孙
1066699,十二月二十三日立春中散兄棣华第六会特盛是日天大雪小孙女出綵幡胜及花柳精巧夜漏且五鼓方罢既归不得寐偶成律诗纪事拜呈中散兄兼简公任阜民详定侍郎道祖签幕判院朝提辖奉议卿任宝录待制
480164,分献次青溪太宰韵（时青溪分得星辰二，是日立春）
492926,八月十一日自水南渡江道金华过北岩访萧鹏举氏是日云阴掩冉殊不见日色道中赋绝句三首明日因录柬举善暨鹏举伯仲 其三
826482,惜余春慢·戊午三月二十五日偕月子泛舟湖上三潭，登孤山，饮楼外楼，用樊榭戊戌三月二十二日泛湖，次清真韵。是日所乘舟即曲园叟小游梅舰也
563101,廉宪王母诰封张太恭人七十寿诗张太恭人刲股血诚神明降鉴天子既表怀清之宅复疏观察之恩荣名所归吉祥来集兹大夫盟府纪功祝釐竣事正当太夫人七帙设帨之辰是日也白华朱萼赓束晢之诗青鸟丹砂受西池之箓九牧之中三乐咸备诗以为贺
674160,中秋将台玩月是日卢都阃为会
920279,是日自磻溪，将往阳平，憩于麻田青峰寺之下院翠麓亭
950711,五年不治笔研奉诏起家是日始草辞免奏旋假书吏于郡题写皆生疏又堂帖趣行三日戒涂偶成二首 其二
545458,惟寅治第于甃石中得大禹岣嵝碑因函置壁间赋此纪事是日同观者王行父汪明生
641859,李守道芍药有一茎而双葩者是日方纳婿咸以为瑞钱国录有诗王梧溪为之序一日持卷来求予题因赋此
337265,陪李使君登庾楼是日云雾不见淮山
123379,甲午岁朝寓桂林记去年是日泊桐江谒严子
743869,早发过鸡鸣驿是日至宣府
423473,满庭芳·戊戌闰三月望立夏，忆前月是日正清明也。苏庵出视李㤅伯先生霞川花影词手稿，有庚申闰清明作，谓自辛丑闰后再逢今日，枨触旧怀，含悽成咏。今距庚申垂四十载，中间再闰仅己卯一遇耳。鄙人频年濩落，久惯伤春，客里光阴，逾增惆怅。依韵示苏庵，并寄彦云和之
1223585,嘉莲亭宴罢奉陪泛舟夜分始归赋诗三十韵是日之宴渤海县尹吴安之以使来具也
1094647,昌甫诗来言九日是悼亡之日因答和及紫芝是日过城下 其二
1070369,江仲嘉仕吴兴雅重道场山长老惠颜仲嘉之柩以八月十五日至山下颜以是日告寂
1136203,是日天明复书
1078415,正之复次前韵作四篇见示是日适登城楼以望江山且阅捷报因赋六章以报之 其一
1082958,是日天气乍晴颇快人意因和韵拉世弼谒傅岩 其一
479619,是日检箧得公壬戌和宝哭徵伯诗
384216,是日约往南郊不果
787596,是日适逢寒日归途有作次方干寒食过东阳韵 其二
673396,赠林克英表弟是日舣舟会饮
284698,正月二十日由枫桥至五泾用东坡是日女王城诗韵
432164,十二月十九日大雪抵平遥同卫耀东痛饮是日为余生日（四首选三）
352243,谒蒋仲远坐中出所知和徐学士诗归而次韵二首是日饮仲远宅见二侍儿
1215949,十月四日今上亲祀太庙前期备法驾宿斋是日漏下二鼓行礼天清星朗熙事告成伯琦忝下执事谨赋七言八句以颂
937681,十三日再赋二首其一以赞使君是日对花赋此韵诗笔落纵横而郡中修水战之具方大阅于燕公楼下也其一自叙所感忆年十五在杭州始识此花皆三丈高木尝赋诗焉 其一
338106,是日适逢寒日归途有作次方干寒食过东阳韵
707949,念奴娇 其二十 座中赠陈子文、是日陈心简、陈子厚诸子，同集蕉林。
1095448,老母元宵初度是日立春
1041844,五月十一日早行是日风寒如八九月
561305,晚次普门寺作是日发郢诸公饯于池河 其二
254259,是日磨刀戏作
540283,程孟孺谒余武昌以是日至而余以是日发因偕登庐岳各返故里遂成二绝为赠并呈豫章诸王孙 其一
540283,程孟孺谒余武昌以是日至而余以是日发因偕登庐岳各返故里遂成二绝为赠并呈豫章诸王孙 其一
483633,庚戌九日是日闻蝉
818721,重九卧病忆兄弟，前年是日雨，在长安与姊联句寄怀，因成一律
637323,和徐议政三月三日途中之作是日寒食
560956,正德戊寅正月七日驾自宣府回前期颁赐廷臣服色是日大雪百官迎德胜门外首臣奉觞致辞称贺即事纪述
1028704,十一月三十日乃耘老弟生朝余是日也宿留富阳驿中念之殊不胜情因赋一诗俟到吴门有便寄去
920462,八月十七日，复登望海楼，自和前篇，是日榜出，余与试官两人复留五首 其五
1227981,九月一日李晋仲张子长张仲举蔡行之载酒西湖是日会者凡九人分韵得采字
825228,三月十二日四十八岁初度是日自上海赴南京 其二
800751,宋建中靖国辛巳七月二十八日为东波先生骑箕之辰先生乞居常州，卒于孙氏寓馆，其地去余家不数十武，旧迹犹存，岁值辛巳，去先生六百年矣，感今追昔，邀同学诸子于是日肇祀先生，用眉山二字成诗二章，致敬恭思慕之意云 其二
561083,晨观风洞登叠綵楼历拱辰亭亭为镇守傅中贵所创岩峦奇耸千里在目诸巡院有诗予辄次韵是日介行登赋不尽兴也 其二
821684,疏影 为卢奉璋赋桐影小筑。是日与辟疆、彦通、器伯诸人同集
180510,游慧林寺以三峡炎蒸定有无为韵得定字是日欲
692229,诸公从狩龙山因登牛首山访佛窟寺胡学士有诗是日仆以病不及行想像佳游辄用次韵三首
272940,仲瑛约余赴韶是日招同咏雩立民毅孙硕生过集即送之海洲
868887,水调歌头 其二 九月望日，与客习射西园，余偶病不能射。客较胜相先。将领岳德，弓强二石五斗，连发三中的，观者尽惊。因作此词示坐客。前一夕大风，是日始寒。
1143549,是日汎舟归湖滨至夜雪大作旦起赋五言古体一首
460988,是日磨刀戏作
490412,仲春望日予为社主诸公有不赴者是日无诗且散去雨中闷怀因取杜句继以唐宋人句集诗九律各志所感奉寄诗皆人所习闻者姓名故不列载萝石隐翁时在禹穴 其三 朴居柱史
485930,藜科（藜科丛生庭中，白露日，割而为帚。是日取藜无蚁。谚云）
720620,桂枝香 岁端午，予年六十有一，腊月之十日恭遇慈大人生辰，适见第五儿啊需以是日举，喜而有作
7530,清明·着处繁花务是日
1094649,昌甫诗来言九日是悼亡之日因答和及紫芝是日过城下 其四
820348,八声甘州 己酉正月二十九梦得句「闲杀流莺外，雨榭风楼」是日为亡妇道清忌日日月如流忽忽十年矣倚甘州一阕
442115,秋夜岑寂无聊忽忆是日乃余之生朝因赋
653815,正月二日朱孟瑜宅赏灯是日有雪
855429,与同舍游净明是日大寒予独乘马诸公以孟浩然相戏以其乡人故也关丈有诗次韵
1162207,巴南郡斋雨中偶看长历是日小雪有怀昔年朝谒因成八韵
561045,常甫宪副钦之翰检与予先后登岳钦之独值雨是日予与常甫坐候云开堂因赋二章 其二
783187,出山海关是日宿叶家坟 其一
920380,出颍口初见淮山，是日至寿州
1041754,府公说牡丹盛开是日逼晚意不及观
780097,贺新凉 二月二日，宣岳州捷是日大雪和其年
99836,是日宿水陆寺寄北山清顺僧
571268,奉和大师序翁二考复职是日内阁盆莲初开漫兴二首 其二
1070045,神鱼泓是日与诸公流杯水中如西丘故事
362605,移家南旋是日报罢
1078721,谒蒋仲远坐中出所知和徐学士诗归而次韵二首是日饮仲远宅见二侍儿 其二
483915,夜饮醉归赠王伯纯是日王得容程子初同饮
1137826,上巳同省斋直轩郊游直轩有诗次韵是日又值寒食节
490410,仲春望日予为社主诸公有不赴者是日无诗且散去雨中闷怀因取杜句继以唐宋人句集诗九律各志所感奉寄诗皆人所习闻者姓名故不列载萝石隐翁时在禹穴 其一
947729,汉宫春 其二 元宵十四夜作，是日立春
1070919,郡学落成之初八月二十二日陪郡守同来仍榜郡学二字遒劲结密观者兴叹是日燕郡僚并学职郡守谓予本起诸生俾预燕集因成鄙句呈逢时坐客
549688,文昌书院东诸秀才是日校文
1076267,陪李使君登庾楼是日云雾不见淮山二首 其一
476715,八月十三日夜梦亡室安人惊泣而窹因思去年丁丑是日在京师安人未明兴告予曰今日趋朝不可如常日之宴盖其日警跸值新狩还也今遇是日感其贤淑又小子周二岁之晬重感赋绝句二首 其二
476715,八月十三日夜梦亡室安人惊泣而窹因思去年丁丑是日在京师安人未明兴告予曰今日趋朝不可如常日之宴盖其日警跸值新狩还也今遇是日感其贤淑又小子周二岁之晬重感赋绝句二首 其二
521682,黄家闸南数里地旷多盗丁卯北行阁浅三宿是日风帆迅疾家童指示其处为之怃然
549736,玄潭观次曾司空韵是日祀二刘文学
950841,宿太平宫葆清庵自和少年壁间戊辰岁所作韵是日闻虏大入滁濠二首 其二
583508,至日有作是日斋戒禁酒柬夏景升
815838,岁暮琴川返棹，折得红绿梅。是日已立春矣，舟发赋此
1216008,二月十九日承诏复兼经筵官是日进讲咸宁殿面赐卮酒作
949908,好事近 其一 青阳道中见梅花。是日微风，花已有落者
521930,奉和涯翁西郊观稼是日得乡书有感
527928,别寺僧是日立春
1209070,南乡子 至元六年九月十四日李重山宪副寿日是日适台使赍玺书奖谕风宪至山南遂大宴合乐重山号梅庭主人所居官舍即旧木犀亭久扁香宇
453068,是日京师骤阴寒，读问馀斋主人咏九一八诗，感而奉和
692749,八月十三日夜梦亡室安人惊泣而窹因思去年丁丑是日在京师安人未明兴告予曰今日趋朝不可如常日之宴盖其日警跸值新狩还也今遇是日感其贤淑又小子周二岁之晬重感赋绝句二首
692749,八月十三日夜梦亡室安人惊泣而窹因思去年丁丑是日在京师安人未明兴告予曰今日趋朝不可如常日之宴盖其日警跸值新狩还也今遇是日感其贤淑又小子周二岁之晬重感赋绝句二首
622118,解柱明中翰见招草桥山庄是日孙大器管泰阶曹允大黄改庵刘胤平同其弟拙存俱集
1112987,谒蒋仲远坐中出所知和徐学士诗归而次韵二首是日饮仲远宅见二侍儿
1236643,司春园五月五日梨花是日因事不果
855976,和子薳官牌夹口韵是日闻官军破虔贼
522028,送三儿应举予己酉乡试初场前夕梦乘雾登鸡鸣山及半见日出惊寤众以为祥既乃下第而三儿天秩以是日生今二十有八年矣始遣其应举因感前事书此励之庶几不以离忧而妨远业也四月十五日识
604270,日升霞举诗为邑侯裒谷孙公览揆而赋也侯以壬戌秋八月分城南海以乙丑秋八月课绩罗浮时都御史台御史台未获交承故侯之最未上而玺书未报八之日则侯之览揆也罗浮之父老子弟一则以喜矣吉祥善事巧于相值如此惟侯以文事饰吏治以美意行良法求之两汉文苑循吏传中业已前无古人不肖萱尝以三曹抱关于侯之德里缟带之欢盖世讲焉故侯式庐则停镳辍轭问俗则解带开襟东阁吟花有简必授南楼对月无酒不同形骸尽捐肝胆相照盖谊为君民恩为父子矣去岁是日侯方
827949,四月十五日田伏侯同年约崇效寺看牡丹予晨往主客皆未集次日晤李猛庵丈言是日到最后席散客已尽矣独坐成咏因忆昔与半塘老人来游恰亦四月十五日感怀三首予因和之 其三
410324,十二月十九日大雪抵平遥同卫耀东痛饮是日为余生日（四首选三） 其二
387724,浣溪纱·三月十五夜东园看月，是日清明
459543,是日至五田中学寻老薛，数年不见，苍然老矣。赋赠三首 其二
464520,临江仙 拟始电约蒋诉心见迓桂林机场，是日无机，未去
157589,会计家酿得十石日饮三升可周一岁是日一饮成
459305,是日相送后往肖涂中见月作
1103764,己亥重九夜归篝灯独酌因思乙未岁是日陪余敬可携赵定庵马宁卿王叔文云隐二三道伴登芝山驻接仙亭蔬盘果食清谈竟日今诸道萍散而敬可九原不可作对酒凄然殆无以为怀也
950842,宿太平宫葆清庵自和少年壁间戊辰岁所作韵是日闻虏大入滁濠二首 其一
770191,是日寒甚 其二
274075,海棠春令·立下荐樱桃，感寄。是日寒甚
293774,十二月十九日大雪抵平遥同卫耀东痛饮是日为余生日
509631,去岁余与窗友赵伯颙同外补五月十有二日予至钱塘宿斋吴山而伯颙已先至因来叙话夜分始别匆匆一载矣兹予统师南征经伯颙之邻封伯颙亦来犒师亦以是日会于浔阳两情相对喜而复感而伯颙又亟欲别去予因口占三绝以赠 其一
515225,长至前二日闻李锦衣士敬自南阳扫墓取道访予新安奉迓杨山寺是日相传皇子诞生有赦将到
181621,甲寅九月末雨至十月二十三日得晴闻是日六飞
996341,三月乙巳来赋盐万岁乡且蒐狝匿赋之家晏饭此舍遂留宿是日大风自采菊苗荐汤饼二首 其一
53786,庚戌九日是日闻蝉
785711,十月十九日至沪初随何大臣如璋使日本即于是日由上海东渡今十二年矣
492204,过万安憩达观寺坐对水西芙蓉诸峰与客谈旧游久之是日得风船先上滩因步至神潭登舟
369958,昌甫诗来言九日是悼亡之日因答和及紫芝是日过城下
