102220,是日至下马碛憩于北山僧舍有阁曰怀贤南直斜
366226,兴庆池送江淮陈度支是日微凉
592194,早秋同达水部集施虞部省中园亭得来字是日期曾缮部不至
1250125,八月十八日萧閒道馆听袁南宫弹琴是日风雨萧然有感而作
571267,奉和大师序翁二考复职是日内阁盆莲初开漫兴二首 其一
583154,九月九日寓九江时户部李时雍同年预约游庐山以是日雨作中辍时雍复遣人送酒侑以一绝因走笔戏答四绝 其三
302271,五月二十八日为顾亭林先生生日是日适读先生诗
896270,正月二十五日以小疾在告作三绝是日苦寒 其三
901248,元丰癸亥秋季赴官郴岭舣舟樊口与潘彦明范亨父以小艇过吉阳寺是日大风雨雪
459611,是日黄昏行小塘作。夜肖至，更饮于其地
229142,尝拉寿居仁访青山性老是日小舟抗断港进退不
96369,既过曾居因访刘茂实秀才是日明叔同出恨仲威
561500,晚次漷县值雨是日闻车驾还京
821615,海棠春令 立下荐樱桃，感寄。是日寒甚
688765,常甫宪副钦之翰检与予先后登岳钦之独值雨是日予与常甫坐候云开堂因赋二章
591986,病中顾汝所招饮不赴闻是日子与先归鲁望吐酒有污茵之句因以戏之
671762,历城贵君招游华不注是日轻阴微雨
13821,巴南郡斋雨中偶看长历是日小雪有怀昔年朝谒因成八韵
613856,春日尹世立携同高仲良陈伯良集放生社是日微雨 其二
496751,长相思 其四 崇祯八年正月十八日，贼陷池河。是日枢部发援兵
779522,金风玉露相逢曲 丙寅中秋，是日秋分
1241862,开垆日有感是日始见霜
860553,和岘窗韵是日也适赴座主西湖社日之宴
829446,四月十五日田伏侯同年约崇效寺看牡丹予晨往主客皆未集次日晤李猛庵丈言是日到最后席散客已尽矣独坐成咏因忆昔与半塘老人来游恰亦四月十五日感怀三首予因和之
1131497,六月二十一日戊寅率同寮诣登源祖庙中迎英济祷雨是日也雨随车至越翼日己卯继之至中宵方霁自辛巳至于乙酉遂沛然沾足丙戌敬送神因书二小诗以纪灵异
168303,便风经雁汊宿荻港是日舟行四百里
312385,喝火令·小春廿三为先夫子小兆祖茔，是日值余母难，抚然倚此
822628,多丽 积雨兼旬，忽放晴霁，是日由固口回城，舆中口占
818038,五月二十八日为顾亭林先生生日是日适读先生诗
490414,仲春望日予为社主诸公有不赴者是日无诗且散去雨中闷怀因取杜句继以唐宋人句集诗九律各志所感奉寄诗皆人所习闻者姓名故不列载萝石隐翁时在禹穴 其五 勾溪外史
687053,八月十一日自水南渡江道金华过北岩访萧鹏举氏是日云阴掩冉殊不见日色道中赋绝句三首明日因录柬举善暨鹏举伯仲
513391,与亨大懋衡二太史天瑞元益贯之三给事同游神乐观是日廉伯有约不至 其一
101112,约公择饮是日大风
1042011,上巳日玉津园赐宴是日杂端为主人
445799,敦和兄招饮天河分韵得山字是日湘天华青少杯诗词大赛启事发布
1091017,闻前月时事君举象先皆与南宫之选是日读易诗春秋作四首 其三
770216,冯庵移居穿虹滨以诗贺之是日四月八也 其三
553247,洛阳七里桥命儿还大梁是日风霾大作晚色忽开一诗自遣
929853,乾道初予自临川归钟陵李德远范周士送别于西津是日宿战平风雨终夕今自临川之高安复以雨中宿战平怅然感怀二首 其一
561612,岁除日省中晚归是日上手札曰谕秩宗有光禄酒馔之赐 其一
920475,是日宿水陆寺，寄北山清顺僧二首 其二
375139,老母元宵初度是日立春
914104,发赵屯得风宿杨林池是日行二百里
457977,晃荡诗为肖作。是日同晃者肖卢 其三
1247835,七月二十八夜同巢翁石父燕集玄都道院中是日雷雨昼晦既夕星月烂然席上有作
1043373,八月十五日秋分是日又社
661332,长儿琰行年四十族长老而下皆辱来贺儿颇任事宗祠之建豫有劳焉是日榜刻适完余亦良喜因忆前十年赴召北上途中值吾儿生朝曾寄一诗勉之今用原韵赋诗二首见意 其一
561304,晚次普门寺作是日发郢诸公饯于池河 其一
688100,仲春望日予为社主诸公有不赴者是日无诗且散去雨中闷怀因取杜句继以唐宋人句集诗九律各志所感奉寄诗皆人所习闻者姓名故不列载萝石隐翁时在禹穴
479026,是日往观果刻本盖世贤招饮恐客不至故绐尔乃复次韵
219785,陪侍知府待制丈巾山高设窃闻是日赓和去春林
139070,是日大雪际晚复晴月色辉映尤为可喜偶成数句
282722,水调歌头·时近春分梅始盛发，次前韵排解，是日结诗伴赏花
685471,戊午清明旗峰踏青因忆客岁是日携常湘云赋春游篇往事东流共增感叹二首
594969,上元夕同刘季德岑克名刘道子集苏叔大小雅斋是日叔大举长子弥月
513981,山斗宗人汝翼率族众燕予于世忠行祠是日雨山斗以其所居之前有山如覆斗形故名
490411,仲春望日予为社主诸公有不赴者是日无诗且散去雨中闷怀因取杜句继以唐宋人句集诗九律各志所感奉寄诗皆人所习闻者姓名故不列载萝石隐翁时在禹穴 其二 石门秀师
721410,寄祝冯再来中丞是日值立春三首
1118260,乾道初予自临川归钟陵李德远范周士送别于西津是日宿战平风雨终夕今自临川之高安复以雨中宿战平怅然感怀二首
681326,是日庄孔阳司副自江浦来会夜宿江上次明仲韵
920461,八月十七日，复登望海楼，自和前篇，是日榜出，余与试官两人复留五首 其四
613855,春日尹世立携同高仲良陈伯良集放生社是日微雨 其一
222459,白鹿洞谒先生祠堂呈李梦开教授是日李入洞讲
978854,今年正月二十五日行园见群花尽开怅然追思去年是日去江津县亲戚相送今一岁矣嗟叹不足情见乎辞
814501,冯庵移居穿虹滨以诗贺之是日四月八也
761376,霜叶飞  庚申重九，杜小舫以西岐登高之作见寄。是日余游虎墩大圣寺，亦用清真韵和之
551022,林方伯先生七十初度是日为吕纯阳诞辰
386640,腊月廿一日晓起大雪，是日巳刻立春
366552,府公说牡丹盛开是日逼晚意不及观
1080591,饭花光店是日立春
1042308,兴庆池送江淮陈度支是日微凉
920930,约公择饮是日大风
572033,夏日刘元定邀同顾升伯沈仲润李长卿丘长孺集城西荷亭是日热甚得暴雨乃解
648190,诸公从狩龙山因登牛首山访佛窟寺胡学士有诗是日仆以病不及行想像佳游辄用次韵三首 其三
770215,冯庵移居穿虹滨以诗贺之是日四月八也 其二
666461,省中赏牡丹是日喜雨得知字
609968,同郭朝谔刘觐国诸兄饮潘明叔席是日洗鹏翼还南海
333536,是日闻报御笔许牵复有感
1098017,去年脩禊后三日得南宫捷报于家今年是日与同年赵簿同事泮宫感而赋诗
575350,寄钱子推是日子推宿山中
1091752,敕局同年相饯是日谢遣婢子春饶者还其家同年大不然之共怅然也
921218,是日，偶至野人汪氏之居，有神降于其室，自称天人李全，字德通。善篆字，用笔奇妙，而字不可识，云，天篆也。与予言，有所会者。复作一篇，仍用
181713,十一月十三日宿东林是日小雨不见庐山戏留绝
782369,九月四日同年卢雅雨都转喜余来赴登高之约即放艇真州邀同年戴通乾来会是日同饮雅雨官舍期以九日游平山堂通乾得诗二首即次其韵 其二
561082,晨观风洞登叠綵楼历拱辰亭亭为镇守傅中贵所创岩峦奇耸千里在目诸巡院有诗予辄次韵是日介行登赋不尽兴也 其一
648188,诸公从狩龙山因登牛首山访佛窟寺胡学士有诗是日仆以病不及行想像佳游辄用次韵三首 其一
79774,上巳小饮追忆乾道中尝以是日病酒留三泉江月
920277,七月二十四日，以久不雨，出祷磻溪。是日宿虢县。二十五日晚，自虢县渡渭，宿于僧舍曾阁。阁故曾氏所建也。夜久不寐，见壁间有前县令赵荐留名，有怀其人
522240,宋西庄寿诗为懋思太学赋是日迎予西郊
668438,雨中捡箧得石田先生丁卯岁赠诗云多时契阔费相思就见江城喜可知时事但凭心口语老人难作岁年期林花及地风吹糁檐溜收声雨散丝明日孤踪又南北教云封记壁间诗后题五月十一日适是日亦五月十一及今丁丒恰十年而先生下世八年矣因追和其韵以致感叹 其二
1121030,五年不治笔研奉诏起家是日始草辞免奏旋假书吏于郡题写皆生疏又堂帖趣行三日戒涂偶成二首
962295,阮郎归 其一 为张平甫寿，是日同宿湖西定香寺
729833,点绛唇  戊戌重九，是日霜降
1210466,次桑善止韵是日廉夫杨尹见访
78900,正月二日晨出大东门是日府公宴移忠院
483626,清明日陪杨铁崖饮城东门是日风雨
771657,青房并蒂莲·花朝是日为亡室顾恭人逝日，二十一年前事，黯然销魂者，固有甚于别也
561044,常甫宪副钦之翰检与予先后登岳钦之独值雨是日予与常甫坐候云开堂因赋二章 其一
1136445,题郭熙雪晴松石平远图为张季野作是日同读杜诗
663865,二月一日候朝是日予祖母寿辰
1103123,是日因游春谷园池复以所分题五平韵赋六言五首 其五
364232,八月十五日秋分是日又社
676455,是日约往南郊不果
593523,皇极门贺蓟辽奏捷是日安南入贡
1070036,吴下去冬不寒春不雨人以为病城中火灾相仍自十二月至今凡八九发雍熙佛寺灾势尤甚闾里讹言相惊往往徙货泉载家具日为避火计二月乙巳郡守以承天佛寺慧感神像供府第为佛事禳祷是日雨明日雪丁未又大雪农事有初火怪庶或熄人心稍安作诗记其事
1251012,踏莎行 诜上人留宿 是日俞明府鹤瓢道人同访
1085588,过八叠有小舟卖虾是日风便但江岸萦迂疾徐相半
946032,长沙腊月雷是日约宴赵帅俊臣闻雷乃罢越三日雨雪帅喜以诗相贺用韵酬之
827948,四月十五日田伏侯同年约崇效寺看牡丹予晨往主客皆未集次日晤李猛庵丈言是日到最后席散客已尽矣独坐成咏因忆昔与半塘老人来游恰亦四月十五日感怀三首予因和之 其二
54868,涯翁示独酌二诗序云是日饮松江酒次韵奉谢
95541,八日雨是日期成交来已而不至
282265,海人设素酌宝积寺赏牡丹是日大风雨
1103122,是日因游春谷园池复以所分题五平韵赋六言五首 其四
1210663,港口舟行是日室人生日寄此为寿 其一
814496,是日寒甚
490413,仲春望日予为社主诸公有不赴者是日无诗且散去雨中闷怀因取杜句继以唐宋人句集诗九律各志所感奉寄诗皆人所习闻者姓名故不列载萝石隐翁时在禹穴 其四 南野上舍
1078418,正之复次前韵作四篇见示是日适登城楼以望江山且阅捷报因赋六章以报之 其四
938047,二十二日自北沙移舟作是日闻贼革面
1247867,八月十三日早上御奉天门选注儒士是日膺广西之命
688742,岁除日省中晚归是日上手札曰谕秩宗有光禄酒馔之赐
501339,再次韵答之是日微雨大风
972334,用老谢丈立春韵赠周文显蕃与文显以癸巳岁是日相识始有倡酬故及之
522211,是日晚独酌小吴山下 其二
514074,予访王氏子仁泰于泽富仁泰适以是日生男时予方以疾断酒为之喜而破戒赋诗赠之
440562,复性书院旧设乌尤寺内，为抗战时期马一浮先生撰杖都讲地也，其居所曰“濠上草堂”者亦构筑于乌尤山麓。是日下午以游凌云山茗饮延时未及往游，遥礼之而已
815713,九月四日同年卢雅雨都转喜余来赴登高之约即放艇真州邀同年戴通乾来会是日同饮雅雨官舍期以九日游平山堂通乾得诗二首即次其韵
9494,人日代客子是日立春
908117,饮文氏园是日鹊噪于庭坐上烛花无数就试者凡五人
168469,五年不治笔研奉诏起家是日始草辞免奏旋假书
757831,满庭芳 丙戍立春，是日除夕
583423,早春次胡紫山韵是日斋居
783188,出山海关是日宿叶家坟 其二
713255,寄祝冯再来中丞是日值立春三首 其三
192056,长沙腊月雷是日约宴赵帅俊臣闻雷乃罢越三日
371716,丁寺丞灵山阁同国正小集是日得雨次韵仁甫五字
1090360,七月一日知丞往众浔潭命道士投铁简是日有雨二日知丞过访共道灵验相与感叹因以数语记之
335906,丙戌重五后一日予与同舟三人游虎丘庚寅岁予亦以是日至枫桥望虎丘塔迫日莫叹息而去
460671,是日京城晨雨
186947,是日二使者出游晚凉有作
295814,去岁腊月二十三日哲维访余天津旅次余以是日归大连不相直哲维有诗见寄次答
180915,二十二日自北沙移舟作是日闻贼革面
900261,是日二使者出游晚凉有作
1218788,春日同王仲远偕游松林湖之上西望洞庭东西两山是日寒食有感
1216067,明日慈仁宫进讲毕钦承特命改授崇文监丞参检校书籍事是日同僚邀复游西山举酒为寿赋二首简谢雅意 其二
168227,比闻赵季茂春板舆行春甚乐予跃然效之是日乃
622095,孙蜚莪偕宋尔孚杨承之携酒过从得榴字是日夏尽
712168,向恬庵携酒西山是日适热发不得痛饮赋此答谢
568509,老母自八月末失调至于十二月逾一时六日始离床褥扶枝引步负暄弄孙于檐下若春木向荣朝暾屏翳前十月廿八日为诞辰汤药之中惟焚香告天不得备礼是日乃取卮酒拜献团圞相保得遂母子姑妇之欢因志以诗
445693,不寐有寄是日白露
685227,九月九日寓九江时户部李时雍同年预约游庐山以是日雨作中辍时雍复遣人送酒侑以一绝因走笔戏答四绝
908348,自离芜湖多阻风是日早次雁汊风顺亟驾帆以行既而稍驶落帆之半晚次雷口舟人以贪风曛暮不得泊几危
1090513,六月二十一日戊寅率同寮诣登源祖庙中迎英济祷雨是日也雨随车至越翼日己卯继之至中宵方霁自辛巳至于乙酉遂沛然沾足丙戌敬送神因书二小诗以纪灵异 其二
583153,九月九日寓九江时户部李时雍同年预约游庐山以是日雨作中辍时雍复遣人送酒侑以一绝因走笔戏答四绝 其二
420859,木兰花慢 二月廿三日至上海，方知是日为清明也
1078067,三月二十三日德音至容南恭闻驻跸浙东王师屡捷虏骑远遁是日得诸季书挈家寓饶之德兴幸免惊扰忻忭之馀辄成口号
958377,甲寅九月末雨至十月二十三日得晴闻是日六飞进狩诸将告捷
824001,浪淘沙令 别苏州，在汽车中作，是日为三月十九日
479691,涯翁示独酌二诗序云是日饮松江酒次韵奉谢 其一
410623,海人设素酌宝积寺赏牡丹是日大风雨
940821,丙寅五月三日陪真秘字留校理游鼓山一别二年适同游东观缅思旧游正以是日作诗以记之
713323,有进川南使君新荔枝者是日初尝苦瓜使君纪之以诗与吴山带和之次吴韵二首 其一
388449,除夕张山人分韵是日有浙藩之报
85436,是日之客王方伯外
622119,是日诸子肩舆余独乘马醉归辄供笑谑诗以解嘲
713324,有进川南使君新荔枝者是日初尝苦瓜使君纪之以诗与吴山带和之次吴韵二首 其二
611922,丙辰元日同林垂之集周贵谔二有亭是日主人斋不设荤
1000049,腊月二十三日群牧使元内翰曾龙图同日拜枢参之命是日立春
974187,是日招明叔饮明叔有诗次韵
721496,有进川南使君新荔枝者是日初尝苦瓜使君纪之以诗与吴山带和之次吴韵二首
476714,八月十三日夜梦亡室安人惊泣而窹因思去年丁丑是日在京师安人未明兴告予曰今日趋朝不可如常日之宴盖其日警跸值新狩还也今遇是日感其贤淑又小子周二岁之晬重感赋绝句二首 其一
476714,八月十三日夜梦亡室安人惊泣而窹因思去年丁丑是日在京师安人未明兴告予曰今日趋朝不可如常日之宴盖其日警跸值新狩还也今遇是日感其贤淑又小子周二岁之晬重感赋绝句二首 其一
770217,冯庵移居穿虹滨以诗贺之是日四月八也 其四
1237644,港口舟行是日室人生日寄此为寿
769668,沁园春·忆丙寅九月八日为先子六十诞辰，客汪舟次先生家，先生张宴为寿。今己亥是日，从郡返里，追念往昔，不禁盛衰存殁之感焉。赋此兼示公有
66577,郎君游闽拟以是日登陆风雨大作心甚忧之
117142,三伏暑甚七月八日立秋是日风作凉爽炎酷顿消
1204975,水龙吟 寿族父瑞堂是日惊蛰
157971,闻鸠有作喜为晴兆也是日开霁又喜其占之有验
920281,是日至下马碛，憩于北山僧舍。有阁曰怀贤，南直斜谷，西临五丈原，诸葛孔明所从出师也
440433,腊月廿四日故乡对雪吾乡风俗以是日为小年于日夕之时展墓祭祖也
622644,孙蜚莪宋尔孚携酒琴过从得榴字是日夏尽
456623,雨夜书怀是日作性情辨
921966,在彭城日，与定国为九日黄楼之会。今复以是日，相遇于宋。凡十五年，忧乐出处，有不可胜言者。而定国学道有得，百念灰冷，而颜益壮，顾予衰病，
673876,夜宿蔡村忆邦应弟弟时公干通州八月十一夜作是日雨晴月皎
458006,浣溪沙　共长沙诸网友饮，席中随书。予不至长沙，盖已十年矣，是日正立夏
700300,是日晚独酌小吴山下
479692,涯翁示独酌二诗序云是日饮松江酒次韵奉谢 其二
1031296,四月十七日奉安仁宗皇帝御容于景灵孝严殿是日舟次陈留感怀述事十六韵
1094646,昌甫诗来言九日是悼亡之日因答和及紫芝是日过城下 其一
540284,程孟孺谒余武昌以是日至而余以是日发因偕登庐岳各返故里遂成二绝为赠并呈豫章诸王孙 其二
540284,程孟孺谒余武昌以是日至而余以是日发因偕登庐岳各返故里遂成二绝为赠并呈豫章诸王孙 其二
931266,正月二日晨出大东门是日府公宴移忠院
1042305,同河中府签判刘状元廷平访华阴云台观陈搏先生故居是日云雾不尽见诸峰
921664,卧病逾月，请郡不许，复直玉堂。十一月一日锁院，是日苦寒，诏赐宫烛法酒，书呈同院
1224689,泰定丁卯八月十二日崇天门传胪赐进士右榜第一人阿察赤左榜第一人李黼皆肄业国学日新斋余西厅授业生也是日京尹备鼓乐旗帜麾盖甚都导二状元入学谢师拜余明伦堂榜眼刘思诚探花郎徐容尝因同年黄晋卿彭幼元从予游亦拜其侧其馀进士以门生礼来拜谢杂遝不记姓名圜桥门而观者万计都人以为斯文盛事昔未有也同寅举酒相属偶成四绝以纪其事 其一
1076088,九月二十四日试吏省舍雨中独坐终日是日诵阮嗣宗秋怀十七首因效其体
702338,与亨大懋衡二太史天瑞元益贯之三给事同游神乐观是日廉伯有约不至
417687,水调歌头 时近春分梅始盛发，次前韵排解，是日结诗伴赏花
737738,阌乡书怀是日拟宿盘豆不果
224192,是日归馆中作
1035036,奉谢资阳谢纯天诸友是日三池周季章冯季修许德开资中支仲壬至谢介卿冯清叔广汉常光父继至遂宁杨仪斯期而未至
753092,是日绮石老人养疴不至倚枕绘王瓜芦菔以志昔日春明游宴之乐为题其后
384225,清明大雪因忆十年前亦是日下雪盖北方常事南人则未之见也
58641,奉次毕司空与客对弈谢答张侍御惠酒之作是日
1236595,泰定丁卯八月十二日崇天门传胪赐进士右榜第一人阿察赤左榜第一人李黼皆肄业国学日新斋余西厅授业生也是日京尹备鼓乐旗帜麾盖甚都导二状元入学谢师拜余明伦堂榜眼刘思诚探花郎徐容尝因同年黄晋卿彭幼元从予游亦拜其侧其馀进士以门生礼来拜谢杂遝不记姓名圜桥门而观者万计都人以为斯文盛事昔未有也同寅举酒相属偶成四绝以纪其事
107921,是日大雨水涨
248389,是日京师骤阴寒读问馀斋主人咏九一八诗
77888,癸丑重九登山亭追怀顷在兴元常以是日猎中梁
710603,玄元栖霞洞是日华月华君所居
574102,雨坐漫述是日郭仁宏寄小像至
410325,十二月十九日大雪抵平遥同卫耀东痛饮是日为余生日（四首选三） 其三
834794,百字令 乙未七月十八感赋，是日亡妇五十生日也
469343,廿五日晓泛山行历龙井诸处还孤山湖是日物色加浓游情衍不曼觉尽日
908242,焦山汉末焦光隐于此是日乃其生日土人会者甚众
833751,莺啼序 壬子上巳后一日谷雨，同石甫、午诒、筠卿过徐园看牡丹。是日，园中有文明结婚者，比至，则礼成归去矣
410323,十二月十九日大雪抵平遥同卫耀东痛饮是日为余生日（四首选三） 其一
1110294,九日偕同寮至破山还饮誓清亭是日早雨寻霁自余至官三见菊花节常会于誓清因成二诗志之
291535,浪淘沙令·别苏州，在汽车中作，是日为三月十九日
838578,出京之前一日，王吉臣、干臣昆季祖饯于陶然亭。是日阴雨，赋此志感
972054,九日次韵斯远去年是日同成父登半山亭见怀之什寄斯远兼示成父
97999,是日招明叔饮明叔有诗次韵
713254,寄祝冯再来中丞是日值立春三首 其二
998580,去岁十月六日由番江向安仁今岁十月回自广信复以是日同王蓝田诸公登安仁张古峰
583453,弘治十六年十二月二十五日午大雪二十九日寅止正月三日晚又雪至十六日或雪或止惟十五日尤异其雪花大者约广二三寸长亦如之见者莫不惊骇余时奉命在镇是日雨水节寒如冬至沿河冻合舟不能行屋檐积雪弥月不消不知天道竟何如也感而有作
264126,点绛唇·戊戌重九，是日霜降
1094648,昌甫诗来言九日是悼亡之日因答和及紫芝是日过城下 其三
293978,水调歌头·元宵日邓尉看梅花是日为慧素生日
573341,是日登寺楼甚幽，诸公拟借为社，遂各施买酒馀钱付僧葺窗槛，并志
566865,二月望后连日夜风甚不减前年而是日二儿书至
621800,甲戌奉使荆藩樊山王设舟邀同同使宋今础泛雨湖是日连阴霢霂及登舟而明湖已开霁相迎矣
1078416,正之复次前韵作四篇见示是日适登城楼以望江山且阅捷报因赋六章以报之 其二
950786,是日迎送之车属道戏成
744098,花将军营中驼罗骢马飘瞥善战云自西藏中所得索余貌之是日席上姚太守施总戎及诸幕僚各为一诗豪宕感激之意可以传矣
1126935,三月乙巳来赋盐万岁乡且蒐狝匿赋之家晏饭此舍遂留宿是日大风自采菊苗荐汤饼二首
1216837,闰中秋是日白露节
696261,长儿琰行年四十族长老而下皆辱来贺儿颇任事宗祠之建豫有劳焉是日榜刻适完余亦良喜因忆前十年赴召北上途中值吾儿生朝曾寄一诗勉之今用原韵赋诗二首见意
1114075,正之复次前韵作四篇见示是日适登城楼以望江山且阅捷报因赋六章以报之
366091,同河中府签判刘状元廷平访华阴云台观陈搏先生故居是日云雾不尽见诸峰
809887,五十五年正月十二癸卯立春是日风从东北而至景云密布瑞雪铺地至十三日未止书云立春与元日同占乃收成之兆故喜民有足食之庆朕慰宵旰之忧赋五言排律以记其事
533737,五溪舫为宗室子深赋是日同余德甫集
904942,百字令 寿冯宪。是日，宴于古羊桃花下
1076306,十六日对雨是日闻得濂溪地
899112,念奴娇 其一 次韵张仲远，是日醉甚，逃席
688687,奉和师相序翁阁中盆荷初开是日翁六载考绩
384192,九月十日闻城中雨雹，是日为寒露节
426860,仲瑛约余赴韶是日招同咏雩立民毅孙硕生过集即送之海洲
1108031,奉陪舅丈秘书彦平主簿兄游慧聚终日小饮上方待月再历妙峰诸胜处用前人韵得二诗是日尝微雨作
554568,己亥人日是日壬子上表贺海平二首 其二
97998,是日雨阴殊甚咫尺如隔然
306978,青玉案·二月二十闰枝丈瑑青兄招饮词集是日游北海
620211,端午赐宴纪事是日上御五凤楼凭栏天颜密迩仍有排律
633601,顿修自髫水丁家难后掩关匡庐复归雷峰即以是日入侍寮诗以志喜
868929,南歌子 是日微雨，过午而霁，晚遂月出，次刘无言韵
80993,九月十八日至山园是日颇有春意
419475,水调歌头 辛巳十二月十九日，太疏招同向之、爰居、篆青、霜杰、佩秋、彦通、伯冶、次溪集桥西草堂，为东坡作生日，是日立春微雪
1135204,是日大雨水涨
248657,是日京城晨雨
704052,去岁余与窗友赵伯颙同外补五月十有二日予至钱塘宿斋吴山而伯颙已先至因来叙话夜分始别匆匆一载矣兹予统师南征经伯颙之邻封伯颙亦来犒师亦以是日会于浔阳两情相对喜而复感而伯颙又亟欲别去予因口占三绝以赠
53189,是日检箧得公壬戌和宝哭徵伯诗
537880,除夕张山人分韵是日有浙藩之报 其二
492925,八月十一日自水南渡江道金华过北岩访萧鹏举氏是日云阴掩冉殊不见日色道中赋绝句三首明日因录柬举善暨鹏举伯仲 其二
668437,雨中捡箧得石田先生丁卯岁赠诗云多时契阔费相思就见江城喜可知时事但凭心口语老人难作岁年期林花及地风吹糁檐溜收声雨散丝明日孤踪又南北教云封记壁间诗后题五月十一日适是日亦五月十一及今丁丒恰十年而先生下世八年矣因追和其韵以致感叹 其一
544272,是日世叔座中出八带鱼供馔余夙闻未睹即席复成此章
346658,去年脩禊后三日得南宫捷报于家今年是日与同年赵簿同事泮宫感而赋诗
326122,书室述怀奉寄民表兄是日得民表书
279349,多丽·积雨兼旬，忽放晴霁，是日由固口回城，舆中口占
