627217,舟发珠江承诸子携酒饯送用前韵赋别
712058,赣儿受室承诸公赠诗赋答
596740,澯子入京龙荫承诸公盛赠以言因续四首于卷后 其三
1087794,昨承诸兄临辱不揆以薄酒蔬食延驻都骑明日视壁间所张墨刻有亡去者人以为德庆丈之廋也驰问遣索蒙需拙诗辄赋所怀往奉一笑而尊犍刻可以归于我矣
1172773,天宝初南曹小司寇舅于我太夫人堂下累土为山一匮盈尺以代彼朽木承诸焚香瓷瓯瓯甚安矣旁植慈竹盖兹数峰嵚岑婵娟宛有尘外数致乃不知兴之所至而作是诗
494549,甲午元宵予奉会于池亭承诸公乘雪见过分得五言绝句体四首因以奉谢 其一
532836,秋日集文寿承诸子得寒字
606975,京中承诸年丈招饮
517769,丙申初度日承诸知己设酒肴相慰诗以谢之
186544,二月二十日野步城南晚与吴伯承诸友饮裴台分
538863,履魏三日受筴易州行府承诸公为会高台有作
596611,承诸公约赴丞厅之筵赋此辞谢
591530,同少承诸子粤秀山观音阁秋望
700100,澯子入京龙荫承诸公盛赠以言因续四首于卷后
639035,乙丑正月二十七日出京承诸公饯送至城南马上口号
717106,季秋之五日承诸族父过赏菊梅分赋
701059,春日承诸郡公招同李仰山唐曙台泛舟西湖用前韵
732978,十月二日出都承诸公郊饯
601439,春日承诸郡公招同李仰山唐曙台泛舟西湖用前韵 其一
900360,二月十日野步城南晚与吴伯承诸友饮裴台分韵得江字
494552,甲午元宵予奉会于池亭承诸公乘雪见过分得五言绝句体四首因以奉谢 其四
601440,春日承诸郡公招同李仰山唐曙台泛舟西湖用前韵 其二
1051177,承诸公酌别西郊分韵赋诗得戎字
517865,屡承诸友惠物又闻酒米之贶诗以志之
702127,甲午元宵予奉会于池亭承诸公乘雪见过分得五言绝句体四首因以奉谢
591358,承诸公过西堂赏菊得儒字
494551,甲午元宵予奉会于池亭承诸公乘雪见过分得五言绝句体四首因以奉谢 其三
596739,澯子入京龙荫承诸公盛赠以言因续四首于卷后 其二
494550,甲午元宵予奉会于池亭承诸公乘雪见过分得五言绝句体四首因以奉谢 其二
596738,澯子入京龙荫承诸公盛赠以言因续四首于卷后 其一
596741,澯子入京龙荫承诸公盛赠以言因续四首于卷后 其四
