1160158,崔元受少府自贬所还遗山姜花以诗答之
1214960,仲宜以所植菊花见贻，以诗答之
333514,邓成彦供茉莉以诗答之
183516,同事合使见问奚国山水何如江乡以诗答之
358868,运使李献甫有书云千山万水之间泥泞劳苦不可胜言者因以诗答之
184563,新毗陵守王立之书来以诗答之蜀中同寮也
1077184,吴亲寄瓷枕香垆颇佳以诗答之 瓷垆
1049519,运使李献甫有书云千山万水之间泥泞劳苦不可胜言者因以诗答之
158201,保安杨公济书来问疾以诗答之
14757,崔元受少府自贬所还遗山姜花以诗答之
324425,癸未春被召东山益老来贺曰赵州八十犹行脚以诗答之云
282845,史兆伸书寄王荆公独山梅花诗，慰我北行，以诗答之
320596,自济源回及中道得通守郎中诗跂羡山水之游以不得陪从为恨因以诗答之
1032403,梁必大归自燕山有诗问讯以诗答之
472166,得应职方书以诗答之
552393,高平儒牛好古以独茧引丝为扇因见赠戏以诗答之
896425,贫病投劾乞补外官亲友问者以诗答之
306064,辟疆为书扇，既别以诗答之
15011,唐秀才赠端州紫石砚以诗答之
862799,杨仲承秘书蹉跎三年今得荣州文学冬日贻书以诗答之
825037,丁叔衡画便面见贻以诗答之
519471,沈启南写山水花禽四幅见寄以诗答之
441885,故人询回城之事以诗答之
411258,辟疆为书扇，既别以诗答之
574033,僧圆显请记行窝以诗答之
12325,刘展下判官相招以诗答之
116842,贫病投劾乞补外官亲友问者以诗答之
442141,闻调用风言以诗答之
1187483,刘展下判官相招以诗答之
80527,亲旧书来多问近况以诗答之
331151,昌老询予来历以诗答之
923001,同事閤使见问奚国山水何如江乡以诗答之
1077183,吴亲寄瓷枕香垆颇佳以诗答之 瓷枕
1076991,昌老询予来历以诗答之
1077185,邓成彦供茉莉以诗答之
17887,庾顺之以紫霞绮远赠以诗答之
1073116,癸未春被召东山益老来贺曰赵州八十犹行脚以诗答之云
63267,得应职方书以诗答之
999856,保安杨公济书来问疾以诗答之
1159852,唐秀才赠端州紫石砚以诗答之
1038152,自济源回及中道得通守郎中诗跂羡山水之游以不得陪从为恨因以诗答之
882984,新毗陵守王立之书来以诗答之蜀中同寮也
415446,史兆伸书寄王荆公独山梅花诗，慰我北行，以诗答之
226298,梁必大归自燕山有诗问讯以诗答之
622128,封荆将就道子仪宜以诗祖余也而索余己巳赠行之作因复以诗答之
578295,云村梁纹涧惠茶酝以诗答之
