881801,杨郎中新居和尧夫先生韵 其一
340135,寄绵竹致政杨郎中
1084776,己巳元日读韩送杨郎中贺正诗因和其韵
927226,留题水北杨郎中园亭二首 其二
18806,和杨郎中贺杨仆射致仕后杨侍郎门生合宴席上作
863483,和屯田杨郎中同年留别之什
18803,新昌闲居招杨郎中兄弟
18908,自题新昌居止因招杨郎中小饮
146765,杨郎中新居和尧夫先生韵
927227,留题水北杨郎中园亭二首 其一
160770,和杨郎中北廊梅花
1156164,和杨郎中贺杨仆射致仕后杨侍郎门生合宴席上作
1046736,次韵杨郎中洙早春
35008,送杨郎中唐员外奉使湖南
66666,舟中次杨郎中君谦韵
1156612,新昌闲居招杨郎中兄弟
870250,题太原通判杨郎中新买水北园
491665,题杨郎所制五采匹笺歌赠自明杨徵士
561709,刑部杨郎中精于医术尝巳予疾于艰亟兹出守夔郡作诗赠之
6207,上嘉州青衣山中峰题惠净上人幽居寄兵部杨郎中
366841,次韵杨郎中洙早春
1040544,寄绵竹致政杨郎中
885735,送杨郎中守嘉兴
514834,送杨郎中志仁赴湖广宪副
134835,题太原能判杨郎中新买水北园
172522,送杨郎中守嘉兴
1156047,自题新昌居止因招杨郎中小饮
1196000,送杨郎中唐员外奉使湖南
577047,江南图为考功杨郎中赋
125862,留题水北杨郎中园亭
496101,减字木兰花 其五 送杨郎中克实谪官
25399,寄唐州杨郎中
542632,送库部杨郎中守严州
555321,送杨郎中恺之参议广西
922988,龙舒太守杨郎中示及诸公题咏洛阳新居见邀同作辄依安乐先生首唱元韵继和
1117409,留题水北杨郎中园亭二首
765069,倦寻芳 客武昌赠歌者杨郎
480071,舟中次杨郎中君谦韵
1155374,玩迎春花赠杨郎中
655007,泊河西务与杨郎中克敬同年夜话
1109884,杨郎中新居和尧夫先生韵
1164846,上嘉州青衣山中峰题惠净上人幽居寄兵部杨郎中
507452,送杨郎中催马草还京
177874,和屯田杨郎中同年留别之什
861336,和杨郎中北廊梅花
881800,杨郎中新居和尧夫先生韵 其二
513876,次荆门管河杨郎中求题水墨葡萄
1192740,寄唐州杨郎中
751159,杨郎山夜泊即事
184048,龙舒太守杨郎中示及诸公题咏洛阳新居见邀同
626797,除前二日雨中陈五席上贻杨郎时杨值东里之厄将有远行并此赠别
