922010,次韵吴传正枯木歌
921415,寄蕲簟与蒲传正
926920,代书寄吴传正寺丞
117762,寄题蒲传正学士阆中藏书阁
926825,答和吴传正赞善二首并寄高阳王十三机宜 其二
923010,次韵王正仲蒲传正二月十五日奉祠高禖二首 其二
922015,丹元子示诗，飘飘然有谪仙风气，吴传正继作，复次其韵
20862,人日陪宣州范中丞传正与范侍御宴
926783,寄吴传正寺丞
1116906,次韵王正仲蒲传正二月十五日奉祠高禖二首
101206,丹元子示诗飘飘然有谪仙风气吴传正继作复次
850417,谒吴传正因赠
126765,寄吴传正寺丞
126234,依韵和吴传正寺丞见寄
850378,送传正之官礼部
926874,二十五日依韵和左藏吴传正寺丞见赠
924226,寄题蒲传正学士阆中藏书阁
183944,次韵王正仲蒲传正二月十五日奉祠高禖
99083,寄蕲簟与蒲传正
126759,二十五日依韵和左藏吴传正寺丞见赠
183263,慧林遇薄传正吕子进闲谈
923011,次韵王正仲蒲传正二月十五日奉祠高禖二首 其一
927059,依韵和吴传正寺丞见寄
245426,题蒲传正舍人清风阁
126719,代书寄吴传正寺丞
126880,答和吴传正赞善
923259,寄题蒲传正学士清风阁
926826,答和吴传正赞善二首并寄高阳王十三机宜 其一
183879,寄题蒲传正学士清风阁
1049529,往时与今钱唐蒲资政传正修史邓内翰温伯同和唐韦考功张水部盛山十二咏畀开江吴令使榜于宿云亭二十三年矣因缘登览感慨畴昔复为短篇以纪故事元祐二年正月二十八日安岳冯允南
1049370,与蒲宗孟传正察推
947419,题吴景恬写三传正后
1191635,人日陪宣州范中丞传正与范侍御传真宴东峰亭
183072,谒吴传正因赠
102487,次韵吴传正枯木歌
1117425,答和吴传正赞善二首并寄高阳王十三机宜 其二
947228,题蒲传正舍人清风阁
850674,慧林遇蒲传正吕子进閒谈
