140736,湖山作诗·烟重山弥远
457847,秦无赖子刘邦行季，少即游手好閒。然史之常则，小流氓皆成大事业，而成大事业者皆小肚肠。雄如项羽，乃曰富贵不还乡，如衣锦夜行，何论乎刘季。故刘季窃国，即骄其父兄曰：某业所就，孰与仲多？唐人唐彦谦过刘仲隐居之山，作诗云：千载遗踪寄薜萝，沛中乡里旧山河。长陵亦是闲丘陇，异日谁知与仲多。予读此，喜其语之冷峭深远，亦书一律
902845,冬至后五日约客晨往极乐精舍因寻梅湖山作诗纪事 其一
1113397,冬至后五日约客晨往极乐精舍因寻梅湖山作诗纪事
1061060,张执权主簿同二知县大夫入山作诗并以见赠亦次其韵
1129506,西余庭犀合抱强半不下西湖刘寺双桂已厄于嘉定十二年打十方之初信夫主僧元粹之忍也余在北山作诗援之云翠华几度树边来手压芳枝内苑栽且看传灯金粟面小留残馥点苍苔两唐律赋西余吊刘寺云
726465,初入山作诗
1095667,西余庭犀合抱强半不下西湖刘寺双桂已厄于嘉定十二年打十方之初信夫主僧元粹之忍也余在北山作诗援之云翠华几度树边来手压芳枝内苑栽且看传灯金粟面小留残馥点苍苔两唐律赋西余吊刘寺云 其二
1095666,西余庭犀合抱强半不下西湖刘寺双桂已厄于嘉定十二年打十方之初信夫主僧元粹之忍也余在北山作诗援之云翠华几度树边来手压芳枝内苑栽且看传灯金粟面小留残馥点苍苔两唐律赋西余吊刘寺云 其一
902844,冬至后五日约客晨往极乐精舍因寻梅湖山作诗纪事 其二
140398,冬至后五日约客晨往极乐精舍因寻梅湖山作诗
668220,处州刘学谕敔乃刘龙洲远孙便道拜龙洲墓于昆山作诗送之
839463,幼南比部将赴润州讲席，花朝招饮于味閒斋，邵后山作诗赠别，比部和之，余亦次韵
724663,车驾幸京口侍游蒜山作诗
