269620,胡山眉瘗天木于家山同午祁过访感赠
524036,仰头遇友夜泊感赠
772070,与张鉴三封君重话旧事感赠
720116,姚若侯至感赠
683829,张牧迁淮相国与诸君会饯山园感赠四绝
390072,张牧迁淮相国与诸君会饯山园感赠四绝
475842,上清祝圣逢孙默斋使君感赠因期同陈午江枉顾山中
442706,有感赠碧霞君二律 其二
306357,濑川浅之进厦门别后顷来主东方文化会事喜晤感赠
252075,梅花引·海棠溪遇旧感赠
306255,仲容别十五年矣适宰潮阳闻余过汕倍道来会感赠
625876,喜万季用职方偕弱士金吾亚叔博士至粤旅中感赠
819913,愔仲年来酒量稍减感赠一首
446371,入京前夕步沁儿感赠原韵却寄
465272,梅花引 海棠溪遇旧感赠
276160,彭仲谋出其太仆公遗像并虔州殉难诸札感赠
467275,有感赠碧霞君二律
304410,密之来自荆州除夕共饮感赠
570446,张牧迁淮相国与诸君会饯山园感赠四绝 其四
830353,仲容别十五年矣适宰潮阳闻余过汕倍道来会感赠
571301,祷雨有感赠石冈吴太守
820175,浔阳共彭晓山话因吟潭感赠晓山
29944,为人感赠
452981,读海岳风华集感赠王翼奇毛谷风
735152,胡山眉瘗天木于家山同午祁过访感赠
253209,读海岳风华集感赠王翼奇毛谷风
442705,有感赠碧霞君二律 其一
17930,和元九与吕二同宿话旧感赠
85063,壬老将去吴感赠长句
303947,愔仲年来酒量稍减感赠
570443,张牧迁淮相国与诸君会饯山园感赠四绝 其一
509108,师次永州久雨祈晴有感赠赵征夷
772110,厅幕张君秋汀观潜园山水册索昼未果，爱慕心殷，常形齿颊。赋诗感赠
751695,壬老将去吴感赠长句
828415,密之来自荆州除夕共饮感赠
332297,读洪昉思稗畦行卷感赠一首兼寄赵秋谷官赞
570444,张牧迁淮相国与诸君会饯山园感赠四绝 其二
736493,读洪昉思稗畦行卷感赠一首兼寄赵秋谷官赞
604548,汪士元参军归四明有感赠之以诗
1179629,为人感赠
570445,张牧迁淮相国与诸君会饯山园感赠四绝 其三
1156146,和元九与吕二同宿话旧感赠
264535,浔阳共彭晓山话因吟潭感赠晓山
524026,滕阁访屠子感赠
843086,濑川浅之进厦门别后顷来主东方文化会事喜晤感赠
