920524,富阳妙庭观董双成故宅，发地得丹鼎，覆以铜盘，承以琉璃盆，盆既破碎，丹亦为人争夺持去，今独盘鼎在耳，二首 其一
892204,兰轩初成公退独坐因念若得一怪石立于梅竹间以临兰上隔轩望之当差胜也然未尝以语人沈吟之际适髯生历阶而上抱一石至规制虽不大而巉岩可喜欲得一书籍易之时予几上适有二书乃插架之重者即遣持去寻命小童置石轩南花木之精彩顿增数倍因作长句书以遗髯生聊志一时之偶然也
1116627,富阳妙庭观董双成故宅，发地得丹鼎，覆以铜盘，承以琉璃盆，盆既破碎，丹亦为人争夺持去，今独盘鼎在耳，二首
641354,夜泊大林铺橐中食物数种不知何人持去
1249456,梁溪倪元镇为余写湖山清晓图河东张仲举题诗于上友人郑君杰竟持去不还虽往欲观亦不出示郑真忍人也今观斯图触景会意宁不为之慨叹谩赋长句云
974974,二日至襄阳诗卷为偷儿持去
881670,清平乐 其六 郑长卿资政惠以龙焙绝品。余方酿芗林春色，恨不得持去，戏有此赠
1138799,丁酉春识庆上人于钱塘邓君善之索余同赋孝僧诗余请以二十字尽记其实既成善之喜而书之不知何人持去后二年上人访余江上复书以遗之
1231255,石民瞻作县彭泽集贤赵子昂画马赠别后为他人持去二十年后复得之题诗以识之
132336,二日至襄阳诗卷为偷儿持去
708483,贺新郎  其三 影梅庵忆语，久置案头，不省谁何持去辟疆，再为寄示，开卷泫然，怀人感旧，同病之情略见乎词矣
303684,病中众异枉存手录近诗持去明日谢以一律
429332,病中众异枉存手录近诗持去明日谢以一律
920525,富阳妙庭观董双成故宅，发地得丹鼎，覆以铜盘，承以琉璃盆，盆既破碎，丹亦为人争夺持去，今独盘鼎在耳，二首 其二
89113,夏旱·奴挈军持去
