421522,浣溪沙 其二 蔬畦病起，芒种后一日，招同蜕园、太闲午饮市楼，归用前韵
1232398,至正二十年八月十五日招同诸彦小集南湖以杜甫不可久留豺虎地南方犹有未招魂为均得不字
690454,伏日招同李黄陈三广文汎集改席恰受航对月
534931,白坡太守秋日招同诸君子游青原山寺用壁间韵二首 其一
534932,白坡太守秋日招同诸君子游青原山寺用壁间韵二首 其二
272940,仲瑛约余赴韶是日招同咏雩立民毅孙硕生过集即送之海洲
383882,白坡太守秋日招同诸君子游青原山寺用壁间韵
408589,乙丑十二月十九日招同人作东坡先生日即供先生诗集代像醉后作歌
682900,白坡太守秋日招同诸君子游青原山寺用壁间韵二首
313354,摸鱼儿·人日后一日招同李竹农庶常、杨超白别驾、萧伯瑶山人泛舟花埭，沽酒珠江，迟何一山贰尹不至
314072,满江红·修翁将返金陵，前二日招同扶九、懋敬、东阳暨令弟二简泛舟西溪
799598,夏日招同毛子霞徐臞庵周金山赵双白张研铭汉度董苍水沈雪峰诸子集用双白韵
426860,仲瑛约余赴韶是日招同咏雩立民毅孙硕生过集即送之海洲
604460,伏日招同李黄陈三广文汎集改席恰受航对月 其一
427538,浣溪沙慢·甲戌春日招同众异吷厂榆生冀野真茹张氏园看花。劫后重来，非复当年裙屐之感矣。吷厂约填此解，并邀诸子同作
265840,浣溪沙·蔬畦病起，芒种后一日，招同蜕园、太闲午饮市楼，归用前韵
769608,满江红·修翁将返金陵，前二日招同扶九、懋敬、东阳暨令弟二简泛舟西溪 其二
604461,伏日招同李黄陈三广文汎集改席恰受航对月 其二
604806,伏日招同李康侯黄见河陈惺白三广文榕溪泛集
813932,满江红·修翁将返金陵，前二日招同扶九、懋敬、东阳暨令弟二简泛舟西溪
826435,摸鱼儿·人日后一日招同李竹农庶常、杨超白别驾、萧伯瑶山人泛舟花埭，沽酒珠江，迟何一山贰尹不至
612279,季冬十二日招同社诸子集朝爽台送别王鸣吉
302675,浣溪沙慢·甲戌春日招同众异吷厂榆生冀野真茹张氏园看花
769607,满江红·修翁将返金陵，前二日招同扶九、懋敬、东阳暨令弟二简泛舟西溪 其一
