423542,寿楼春·山荷寓斋夜集，座有南来粲者，言迫重午，行将归去，客自长沙还，得奂彬近讯，又听朱生琵琶数曲，辄依前韵，杂缀成篇，皆本事也
1063761,余所居寺前有南涧涧下浅池每至其上未尝不诵柳子厚南涧诗又恨东坡不和乃和示超然
779855,渡江云 周子莱衣洞庭东山人也，风流蕴藉，工诗擅隶，间作小词，有南宋人旨趣，以其别号懒渔，乞为赋之
976760,南至前一日蒋君伯禄携山谷草字来示上有南轩题跋亦南至前一日异哉
570314,余佐留枢诸曹掾中有南充刘璋者偶诸生试其文烂然已而竟从本格得官将归省叩余秋署乞一言之赠若有不释然者余闵其意走笔得二绝句付之时方乞休在告也 其一
95678,呈宋伯潜·学有南轩派
570315,余佐留枢诸曹掾中有南充刘璋者偶诸生试其文烂然已而竟从本格得官将归省叩余秋署乞一言之赠若有不释然者余闵其意走笔得二绝句付之时方乞休在告也 其二
964256,满庭芳 其九 景卢有南昌之行，用韵惜别，兼简司马汉章
278130,杂诗·宋固有南北
222318,秋气凛然庭木将坠道谦上人有南征之役赋诗祖
521829,刘君克柔以亲老思归适有南京尚宝卿之命喜而索诗
253057,临江仙·曹宝麟谓余词有南渡后气象因戏答之
544795,周元孚过访见赠奉答时元孚方有南都司马之擢
987840,秋气凛然庭木将坠道谦上人有南征之役赋诗祖行
521870,宣城徐士元浮沈州县二十年始有南台之选其阅历多矣将能为国家建久远之策而不诡于玉石朱紫之辨乎故诗以叙别而不及其他
521554,往在京师赵君希德有南游之约四月廿五风雨中忽相见于东楼留两月别去将由金陵视其侄锦衣君而归赋此为赠
712586,励儿行后连有南风漫成
683646,余佐留枢诸曹掾中有南充刘璋者偶诸生试其文烂然已而竟从本格得官将归省叩余秋署乞一言之赠若有不释然者余闵其意走笔得二绝句付之时方乞休在告也
462395,临江仙　曹宝麟谓余词有南渡后气象因戏答之
735419,维扬客舍送云客兄北上予时亦有南越之行
120295,学录韵·俗习有南北
569626,殷无美与沈君典状元有南宫之好今将访君典于宣城赋此送之并简沈
534305,施龙会讲学蓝原约登武夷不果余复有南行道中寄此
196663,南至前一日蒋君伯禄携山谷草字来示上有南轩
275366,遗山论诗又有南北之见复作此正之
773609,初郡中魁堂会社无匾丙寅1806陈君握卿建朱子祠脩敬字堂颜曰中社书院以郡外有南北社此中立也
154208,喜雨·薰兮有南风
650954,歙县许良佐西园其先有南园欧阳公王荆公尝为序记
268489,寿楼春·山荷寓斋夜集，座有南来粲者
515869,成化庚子冬有南京礼部之命回视绾州符十载矣政教无成重自感愧赋此以别州之人士
118724,二绝·春来便有南园约
140150,南阁行·北城之阳有南阁
1197993,有南篇
789496,遗山论诗又有南北之见复作此正之
338025,挽诗·客有南来者
