570572,正月六日送舍弟河口即事偶成 其五
644944,正月六日观灵谷寺塔影奉和御制诗二首 其一
1085662,正月六日游碛呈行可元章
531667,正月六日温泉晚归
122710,正月六日风雪大作
959020,正月六日早行松山道
150284,正月六日七日书所见
833179,菩萨蛮 其一 正月六日至延安作
955712,正月六日风雪大作 其一
570573,正月六日送舍弟河口即事偶成 其六
1141365,己丑正月六日袁季源家遭燬次韵书闷
650902,甲辰正月六日继芳邀社予以眩疾不赴诗以申谢
896927,正月六日
116413,正月六日·杨柳梢头腊雪消
972326,正月六日雪
735065,戊寅正月六日再至朐城
103299,和正月六日沈文通学士遗温柑
1121748,正月六日风雪大作
988196,正月六日集玉壶次才元韵
1065140,正月六日南安岩主生辰
742087,正月六日安国镇道中
955711,正月六日风雪大作 其二
538121,正月六日雨阻江上因记昨岁同于鳞诸君访茂秦于华严庵分韵赋诗一时之盛怅焉有怀爰赋十韵
95716,正月六日雪
321908,正月六日游碛呈行可元章
644945,正月六日观灵谷寺塔影奉和御制诗二首 其二
78965,正月六日作
845216,菩萨蛮 正月六日至延安作
935420,正月六日作
747610,丙申正月六日舟发郡城
675829,庚戌年正月六日夜赋
92080,戊子正月六日雷雨感叹示寿仁子
570570,正月六日送舍弟河口即事偶成 其三
209286,正月六日早行松山道
1070231,和柳子厚诗十七首 其十七 辛亥正月六日夜雷已发声大雨达旦山中流泉高下喷薄殆不啻九十九不减仇池也
387558,菩萨蛮·正月六日至延安作
570571,正月六日送舍弟河口即事偶成 其四
199020,正月六日雪霁
570569,正月六日送舍弟河口即事偶成 其二
648020,正月六日偕邹汝舟庶子金用诚司直张伯原司谏过姚友直洗马饮
550029,宿长清署中晓起将发感而有作时丙辰正月六日
683859,正月六日送舍弟河口即事偶成
460195,贺新郎　正月六未亮作
570568,正月六日送舍弟河口即事偶成 其一
701044,正月六日观灵谷寺塔影奉和御制诗二首
1002438,正月六日雪霁
980478,正月六日七日书所见
915150,戊子正月六日雷雨感叹示寿仁子
712590,正月六日将归锦岩泊舟潘子登寓楼下新月甚佳因留宿三日两登斯楼亦一快也
195406,己丑正月六日袁季源家遭毁次韵书闷
496003,减字木兰花 壬寅正月六日，奉圣谕，今日皇四女试岁周，一取钟、二取银、三取黄水晶石，示卿等知。恭述此词，用纪嘉事
992407,和正月六日沈文通学士遗温柑
