81830,述怀·尺寸虽无补县官
486653,谕临蒸县官
185216,溆浦柟木洞盖神龙所居今年夏大旱县官乞取其
1075205,解人敦武郎富君为余言解池广二百里其利不赀又有六小池官虽置戍以为厉禁而民寔擅其利或悉以属县官则盐不复成其事颇怪作小诗以纪之
658026,闻县中祈雨连日未有得而密云北来定山已如注矣明日县侯谢雨昶无籍之人天地久不收管县官不当顾盻蒙此佳贶盖出望外遂用前韵聊以志喜
324821,馀姚待县官致语口号
92678,将赴高安出吉水报谒县官归涂宿五峰寺
327195,杉木长涧·县官发廪存鳏孤
363948,蛮请降·县官斩敌予金帛
640111,农家乐示宁国县官
1192702,送人自苏州之长沙县官
59587,谕临蒸县官
657196,青县官舍
913028,将赴高安出吉水报谒县官归涂宿五峰寺二首 其二
198206,催发诸邑民兵至朝邑县官未至遂宿其驿
409985,悲莱阳 是年因加赋暴动邑绅曲诗文出为请命致遭拿办县官亦操之过急大府遂派兵三百前往查办又有吕绅出为调停反被枪毙于是大动公愤立集万人孙抚宝琦当令登莱道痛剿乱民六月六日约计死千馀人生掳百馀人此次剿虔之苦闻系由莱绅王侍郎?密电所致缘王与曲有隙故也六月廿六日恭读痛斥孙抚谕旨为感而悲之
1200675,送县官之京
958490,家有小园比他处果蓏倍登或问郑子何术致此告之曰汉武帝使海上县官亲渔鱼皆不出其后捐以予民则鱼复来因知天之生物本以惠济穷民彼富足者不可兼而得也吾贫甚矣安知造物者不以是少私之耶戏为一诗
1247519,代灵宝废观道士叶宗善贽县官
1005321,七月望日避地省坑存思庵留题时章林出白石可为水晶有旨差路县官同金玉提举差夫取凿又宿兵守之吏卒旁午指予为上户求鸡羊酒米油铁无以应其求且不堪其屡也来避于此予念自丁丑之乱至此凡三避矣僧旧屋更新怅然有感因赋之
800380,沛县官舍留别杨简庵表兄
1001178,溆浦楠木洞盖神龙所居今年夏大旱县官乞取其水以祷立应民犹以为未足因作是诗以遗诸公致再请之意焉
913029,将赴高安出吉水报谒县官归涂宿五峰寺二首 其一
513807,登富春山时乡族商人多以索逋钱寓子陵祠问其所从索者皆县官也笑赋一绝
1165121,和裴侍中承恩拜扫旋辔途中有怀寄州县官僚乡国亲故
916799,过石首谒县官回有作
25311,送人自苏州之长沙县官
235938,过石首谒县官回有作
1084050,馀姚待县官致语口号
96685,寄怀·县官宽灭去年租
958461,封州学东池岁率孳鱼冬晚粥之用佐养士教授高公补之至以绍兴己已之春夏偶微旱至秋掌计者告匮试出池鱼则比旧加三倍得众谓公躬自临池鱼不化为苞苴故所获如是观如居士曰汉武帝时海旁民入租渔海鱼不胜计县官利而取之鱼不出捐以予民鱼乃再来由是知物之繁夥皆天道益寡之意教授念念以廪饩不继为忧则盛池鱼以丰其入亦天意哉戏赋之
906907,催发诸邑民兵至朝邑县官未至遂宿其驿
1115608,将赴高安出吉水报谒县官归涂宿五峰寺二首
