135376,分韵送孙从之司业使湖南得千字
9709,送何员外使湖南
658187,送景武主事奉使湖南
705901,怀方邵村使湖南
916980,送胡康侯使湖南
354560,奉使湖南遇雨寄叔宜
948964,戴子微运使出使湖北约以恶语送行而未遣也佳篇见督次韵奉寄
1052548,奉使湖南遇雨寄叔宜
35008,送杨郎中唐员外奉使湖南
213983,送沈兴宗察院出使湖南
527653,醉歌赠子容使湖南便道归省兼讯献吉
178099,送罗著作奉使湖湘
6922,送元侍御充使湖南
3922,夏口送屈突司直使湖南
361185,闻杜植移使湖南
674596,送郑希大使湖南
638987,赠别钟给事使湖贵
228174,寄高耻堂·江西格了使湖南
1039992,闻杜植移使湖南
1196000,送杨郎中唐员外奉使湖南
1158752,夏口送屈突司直使湖南
1182924,送何员外使湖南
369786,送李献可奉使湖南
235785,送胡康侯使湖南
152528,戴子微运使出使湖北约以恶语送行而未遣也佳
863586,送罗著作奉使湖湘
1071968,送李献可奉使湖南
858982,送沈兴宗察院出使湖南
1027990,分韵送孙从之司业使湖南得千字
674266,送黄才伯内翰出使湖藩便道归省
1183262,送元侍御充使湖南
1051787,路人有弃其子者因作是诗予时奉使湖外
