734410,梦有持画卷者属余题诗醒忘其一二语因补成之 其一
1007820,念奴娇 梦有奏方响而舞者
180173,偶连日食鸡夜梦有截一支者颇怜之有谓予言鸡
332782,春从天上来·初度，时生儿弥月，曾梦有饷五苗图者，因以命名
97013,梦有作六言·几欲罢官归去
252691,过秦楼·观程砚秋演春闺梦有感
570562,仲冬望乍晴风横甚而窗月破梦有成
974540,次韵斯远见梦有作六言二首 其二
301773,启祥自美来书问疾，适予重校《红楼梦》有感，诗以代柬
459699,六月廿八午小眠梦之，然所见实别为一人，醒不待思，知即彼所隐化。弗洛伊德论梦，有所谓移置，此似差相仿佛。因述梦境，移心中而置诸纸上，或可稍解郁结乎。然予于弗氏梦说，时有不许
379023,宿石霜山前庄梦拜普贤像明日到院见壁间画如所梦有作
81269,记梦·夜梦有客短褐袍
78163,梦有饷地黄者味甘如蜜戏作数语记之
821977,朝中措 喜公武过访。公武居歌乐山时，数梦有妇人介胄来见，自言是秦良玉，因请人写其貌，又尝属余为解甲归耕图，未之应也
822497,采桑子慢 鱼浪不来，缁尘久滞，凉宵远梦，有天末之怀。和君特
559502,戊辰十一月廿一日夜梦有令禁私宰余谓合家久不啖牛肉遂拈一诗诵其事睡觉只忆起语二句枕上足之辄成一律
1064258,宿石霜山前庄梦拜普贤像明日到院见壁间画如所梦有作
974541,次韵斯远见梦有作六言二首 其一
1010428,山房假寐梦有一客抱琴奏曲而去既觉诗以记之
707895,满江红 其七 过黄梁梦有感
1090642,夜梦有人惠丝鞋一双次日报除左史
601374,次韵古风答小岑叔见梦有怀之作
734411,梦有持画卷者属余题诗醒忘其一二语因补成之 其二
816456,梦有持画卷者属余题诗醒忘其一二语因补成之
588013,近日见此德之所以不进者只是此心原不洁静故欲来染之是以未得清明潇洒之乐因思程子云凡有意向皆是欲欲心甚惕然每念平时作诗文著述欲自见之于世周理人事欲得而不失者皆是欲也方欲打点搜出一洗而空之而伦樾溪适柬至云昨梦有司为子起牌坊先拟行道二字为扁仆不可乃以无欲扁之噫岂天意有造于予乎哉夫无欲之义周子为以学圣之要而程子又发明之可谓尽矣吾人循此自立乃圣贤之正脉路也因作诗以答于樾溪复以自警云
592805,纪梦有引
129718,梦有饷予宝器一奁者曰僧某甲入寂奉以别也一
854147,梦有饟予宝器一奁者曰僧某甲入寂奉以别也一念不敢受当与善知识作供耳顾视僧在傍恢然伟岸与之揖甚野划然笑曰我不管也因墨格上笔书云老藤一枝孤云万里如是我闻我闻如是放笔趺坐而逝既觉因作偈言焉知僧非异人与予宿有缘契庶几闻之
380479,落花·一场春梦有无间
332748,满江红·过黄梁梦有感
1124260,次韵斯远见梦有作六言二首
1157099,因梦有悟
447141,西江月 宿汝溪旅馆夜梦有感
707964,春从天上来 其三 初度，时生儿弥月，曾梦有饷五苗图者，因以命名。
908475,偶连日食鸡夜梦有截一支者颇怜之有谓予言鸡之被烹酷过于是惊觉作此诗以自警
936939,梦有饷地黄者味甘如蜜戏作数语记之
97012,次韵斯远见梦有作六言
307347,香·博山无梦有云行
428400,启祥自美来书问疾，适予重校《红楼梦》有感，诗以代柬
19186,因梦有悟
144606,山房假寐梦有一客抱琴奏曲而去既觉诗以记之
