418640,感怀二首 其一 丁酉季秋，子美为余校印还轩词成，赋此志感
412783,吕贞白与徐声越来游，赋此志感
271031,念奴娇·馆金陵驯象门今廿二年孙道宣以词见示赋此
836399,木兰花慢 费芝云兵部感怀词六首，悼其亡姬作也。出以见示，为赋此阕
333031,江南好·与香雪花下谈少年春秋佳日为赋此解
826774,一枝春·彭刚直公红梅画幅，为遣嫁孙女于俞氏所作，孙婿陛云移付其女夫郭则沄藏之，为赋此解
900363,十三日晨起霜晴用定王台韵赋此
1205821,朱仲文编修还江西诸公分题赋诗为饯予适同载南归约至扬子桥分别因为赋此
606609,宋文学自以忧郁不乐远游适志赋此别之
532399,丙申岁腊访甥杨继宗子熙春读书山中宿留赋此 其二
428051,木兰花慢 傅抱石以一九六五年九月廿九日午后一时零七分逝世南京，赋此志悼
1232166,予少年过蓟门酒楼赋此题曰连十八书郡人疑其为吕洞宾作也谩记于此
636595,长至日晤宪公胡子树于崧台署中赋此
428037,玉楼春 马茂元以胡云翼下世见告，亟赴万国殡仪馆吊之，至则已移入火葬场，赋此致悼
409713,光炯将赴云南制府幕，泛海取道越南，赋此赠别
444452,翠楼吟 柏森先生招饮双枣书屋，与梦芙、新河、引之同赋此调
570027,朱定国失意后访我金陵赋此赠之
819892,庶侯自宝应来并出近诗赋此赠之
264024,三姝媚·王幼霞侍御见示春柳词，未及奉和，又有送行之作，赋此阕答之
1242341,西河 一春索居，况味殊恶，赋此纪怀
1248140,九月十六日陈逸人旭访余蜀山中明日将还武塘因赋此送别
1034008,高九万见示落星长句赋此答之
411469,夫人归宁母家，逾期不返，赋此寄之
833594,鹧鸪天 雨夜，易五以车迓某郎，赋此调之
544427,思齐夜出杨瓜佐酒稍异常者讯之知杨姥得诸异人即席赋此
755048,过访少如座中忽值雷电交作雨雹横飞闻朝阳城楼竟为雷火所毁便道往观归来赋此记之时壬寅夏四月二十二日也
477578,弟洛为猗氏学谕以襄陵酒方见示如法酿造良佳赋此答意
591525,陈推府九十过余山馆始获瞻承赋此上寿
277351,绮罗香·冰如有美洲之行，赋此送之
307276,江城吴老招饮，赋此致谢
545086,贞吉以秦镜并短歌见贻赋此奉答
657124,淮上逢董浔阳太史归湖州赋此言别
426915,盛九万丧其掌珠匡华赋此慰之 其三
843235,荫坪叠落花前颌四首索和己未及今十年矣感而赋此 其一
402985,清平乐 湖帆写松竹两帧见赠，客索松去，赋此题记
699033,闵孝昭送其尊人隐武夷自归广陵赋此以送
298898,凌玉去燕游晋归以诗见赠赋此奉酬
157513,孤坑头上篮舆烟雨中赋此醒困
412040,参政会中遇陶玄女士询及亡妻赵娴清女士身后情况归来怅惘感赋此篇戊寅
773067,癸丑1913仲冬内田民政长官阁下南巡抵嘉召集厅下各支厅长厅参事区长等训示并赐宴席上赋此奉呈
595315,乙卯李三洲都宪讯予北上之期赋此答之
44158,置水仙种於瓦盆中覆以泥花放赋此赏之
730995,金缕曲 三月十七日乃孙补年外祖父仙游之辰，抚今追昔，怅然于怀，爰赋此阕，聊当一哭
797949,忆秦娥  梦至石城盘马觉后赋此
460391,贺新郎　四月二夜步往橘子洲头，已立为公园矣，而铁将军把门，不得入。予立栏外赋此
540133,吕侍郎自制桑落酒绝佳以一瓿见饷赋此为谢并乞酿方 其二
722338,文与也为予写西洞庭图赋此以赠
1027347,元珍弟酌别赋此赠之
179867,元质偶招客饮为赋此篇
282657,清平乐·燕台秋冷，曹部一空，薄宦穷途，飘流满目。感赋此解
882743,陈传朋和余梅花旧作余再赋此
299207,满江红·闻张总统国梁阵亡丹阳，寻即常州被困，感愤赋此
834772,满江红 其一 心谷将归海上，赋此留别，依韵答之
1099998,嘉禾瑞于丁卯此粟瑞于戊辰两年之间嘉瑞迭见所产之地其名亦美琴化所感盛矣哉再赋此为梯飙明府贺
452254,庚寅秋与高凉过南昌与江右诸师友雅集席间飞花行令一时甚乐赋此以记依晦窗韵
460541,水龙吟　与冯金荣钓鱼不获，既作一五律，更赋此
522056,崇府长史王先生珙清壬子荐名时寔预试事往以公事入都索诗为别赋此奉寄
585229,予有天津之行同僚耿副郎辈郊饶赋此以谢之
493442,雨坐读史记忆子中兄茆堂已开北渠赋此奉呈三绝 其三
428038,木兰花慢 闻谢啬庵丈逝世北京，赋此致悼
481764,余自流江将归南溪刘先生亦还珠林赋此别伯昂诸友
1088443,读子厚步月诗时方闻吕伯恭讣后数日赋此
677599,甲子冬赴松潘过窦圌山历明月关俱有罗两华题迹时闻两华以贵阳宪长归矣怀望赋此
803844,盆菊盛开有一本而异色者绚彩呈妍各极其致可以人而不如花乎赋此以示九弟
411535,幼子梦芙英年失学，将随堂侄和炎习工艺，明日拟作潜岳之游，赋此志感 其二
428073,霜降节风雨数日夜感而赋此
447366,梁上泉万龙生蒲健夫三君子为拙著《云气轩吟稿》赐序跋，赋此致谢
693215,游金河寺赋此二首
833384,二郎神 湘绮先生谒行宫归，赋此志感，次韵奉和
315537,王大参以春景诸作见遗赋此以答
599095,往予经贵筑严镇宁苏普安各留欢信宿别忽十载二君皆泉下人矣流涕赋此
795910,远朝归 逸园赏梅，四姑以诗见寄，赋此答之
551284,郑邦衡以书见贻兼惠玉章诗扇赋此荅赠
404610,鹧鸪天·沈迈士老画师年九十三，以秋宵作画诗见示，赋此为赠
575526,雨夜饮客震湖舟中有感赋此
268333,贺新凉·钱奎卿见贻佳句，又为余莲因室稿作序，赋此以谢
638705,闻梁侍讲叔厚先生暨王文哲黄门使交南将过富春赋此二律以侯兼致赠别之意 其一
598166,山阴姚生过潮谒予请书走笔赋此
371017,换巢鸾凤·张东园送洋鸡一只赋此报之
314100,沁园春·戊子春闰，予应试吴陵，胡修来过敝里访予不遇，兹于东亭握手，喜而赋此
418641,感怀二首 其二 丁酉季秋，子美为余校印还轩词成，赋此志感
266607,金缕曲·秀崧世妹随幕端溪，赋此送之
304569,询先折珸山园中海棠二枝为余瓶供干长有致小萼将放正花事极妍之时也夜对赋此
1088920,黄子馀自海昏见予于九江欲行为赋此诗
246425,浣溪沙·江婴老置酒渔村酒家相谈甚欢赋此为谢
271039,沁园春·程穆倩六十初度作木兰花慢自寿中借禽虫为喻索题赋此
978981,尉廨无隙地不能莳花竹之属惟厅事前旧有柳一株予怜其独也增植其七焉暮春之月大有生意可喜为赋此
829785,留赠方药雨 丙申之冬入天津洎己亥秋始得归将行赋此二律
834378,暗香 画梅，枣华遗墨也。雨甥属题，凄然赋此，依韵拟石帚
356801,秋尽同蘋湘夜饮赋此示之并柬漱泉
807667,绮罗香  龚节孙录余所选今词赋此奉柬
459755,八月二十九病起秋来，聊为赋此五首 其一
250483,己丑腊月十六日夜与景秀野鹤高凉小聚席间孤鹤兄自兰州传诗助兴戏赋此篇为谢
605169,甲戌旧郡公韶阶徐公督学以诗币见寄赋此驰谢 其二
605200,三广文以灯夕见过留酌目废不能侍饮赋此谢之
246306,贺新郎·庚寅初冬持社成立诸侣盟于峨眉之巅感而赋此
537978,向生上脩名臣录采及先事赋此赠之
461572,去信阳郑州诸兄相邀沉醉数日赋此为别
383113,平阴徐南龙令君夜邀别后有诗见寄赋此酬谢
425924,游历吴门，姻兄设宴赋此志谢
222499,予始生日岩叟酒见过且有寿语赋此以谢之
774638,东征逾载整棹言归巡使黄玉圃先生索台湾近咏知其留心海国志在经纶非徒广览土风娱词翰已也赋此奉教 其四
605175,以拙刻诸书耑力致杨维斗解元赋此并寄
542538,刘太守以德之大梁予将赴潞安赋此言别
322817,沁园春·仲春独步小园，见风景萧条，感而赋此
698573,家居喜袁芳洲相过赋此为赠三首
1132936,范文正公黄素小楷昌黎伯夷颂盖在青社时所书以遗京西转运使舜元苏公者也后二百年大兴李侯戡得此本于燕及南来守吴乃文正乡里即访公子孙以畀之范氏喜而求诗为赋此二首 其二
718416,文与也为予写西洞庭图赋此以赠 其六
432550,庚子秋夕访李莲卿于城西，赋此四首
305593,悢然赋此·巨刃摩天志未灰
249242,报载日本首相参拜靖国神社忆南京大屠杀事感而赋此
777889,庆春泽·移居小龙坎柏树村，澄宇颇得友朋之乐，叔傥、鹰若、刚伯三君招饮席上，感赋此阕
1218860,二月十四日风雨孤坐秀州城西僧舍赋此
573432,月下萧允升、顾开雍集小斋赋此 其二
832396,木兰花慢 岁暮闻彊村翁即世，赋此寄哀
813934,满江红·六皆重过敝邑，水阻兼旬，游醮极欢，于其行也，赋此送之
1219070,同郑德明访宝昙上人不遇赋此二绝 其二
311647,幼子梦芙英年失学，将随堂侄和炎习工艺，明日拟作潜岳之游，赋此志感
433785,孔雀今日意特依依暮遂不见度有远行矣赋此送之
491966,蜀人师季则自临川来靖安省其姑于李氏岁暮将归辱贻铜刻赋此答赠
604501,羊城某文学宣泰昌新诏于潮取道榕溪以诗见投因同舟入循赋此却赠
635822,还东林社中诸子见过赋此
538905,袁鲁望考功奏最不上与舍弟留饮白下赋此促之
700265,同年宋良佐巡按得代以书留别赋此寄赠
247982,双调忆江南·闻海楼诸兄并鉴公诸贤常州雅聚同拈此调忆及昔年游江南事不胜感慨赋此却寄
601311,甲子冬寅阳卜居仓边邻左赋此贻之
446109,满庭芳 大丫手制芙蕖见贻为赋此解
582013,弘治甲子陈宪长吉夫入觐时予按保宁送之郊即别去赋此寄之
615046,余自秣陵奉慈讣奔归孙燕诒闵士行林茂芝诸子送我秦淮之上余既除服诸子寄秦淮折柳册至赋此志谢
436124,吾兄同仲坚采鹭鸶藤于午芹之东溪因咏诗见示前代诗人未尝闻赋此者此花长于田野篱落閒人视之与草芥无异是诗一出好事者将知所贵矣感叹之馀敬次其韵有与我同志继而述之不亦懿乎
544415,吴生谈鲁连台在辽城东北未有题咏余素高其节侠即席赋此
683627,访吴登不值承见寄三绝句赋此为答
806988,小重山  泊舟松陵城外未及一晤舍妹赋此写怀
694244,得林子逢书感平湖事赋此次前韵
824421,水调歌头 其二 端阳节近，仍用前韵，赋此遣怀
1244363,闻郭怡有诗未及见因赋此以寄恨
828746,询先折珸山园中海棠二枝为余瓶供干长有致小萼将放正花事极妍之时也夜对赋此
545607,王中叔擢北部归省天台以尺素相闻赋此代饯时永叔乞假里中二首 其二
457998,予辞故乡网唐风宋韵版主，诸友惜别相送，作诗甚众，予览而感之，感而愧之，赋此聊以为答
1220530,宋枢密权公葬婺源之麓八世孙居都昌者作楼以望其丘陇于千里之外名曰寓思虞学士尝为赋诗今楼已废矣九世孙缉来求余诗赋此
743597,梦五星坐山广下指一草示余云是当归感赋此章
821171,西平乐 匪石来静石湾，夜谈甚乐，归而赋此见寄，依韵奉酬
935042,大醉梅花下走笔赋此
613434,羽甫家兄招游石涧同区茂对区君玉犹子仲昭流连迨暮归途狼藉赋此纪兴
266671,高阳台·木君赋此词，瑰曼可诵，爰依其韵，更赋秋草
266762,眼儿媚·丁柏岩又行，赋此送之，益难为怀矣
266711,点绛唇·重阳闷不出门，遂失灵岩登高之约，赋此见意
826184,五彩结同心·昆山真义镇之东亭子为顾阿瑛玉山佳处故址之一。今岁池荷盛开，重台骈萼，并蒂至五六花。余偕姚虞琴、江小鹣、郎静山临赏。以其叶小藕窳而不结莲房，又花瓣襞积，卷如蕉心，正与吴中华山刘宋造像中所刊千叶莲同。因断为即天竺传来之千叶莲，盖花中如海棠、海石榴、山茶，凡舶来种恒现多层，此殆同例也。元末明初迄今已六百年，沦落荒村中，今始幸邀吾徒之一顾。感赋此阕，以属阿瑛，兼示同人
538921,朱山人见过碧澜欢饮却去赋此赠之
400271,高阳台 戊午岁末，闻应豪夫妇车祸见殒。悽然南望，赋此吊之
409750,郑清侯自泰州和予看雪诗，赋此奉答
809999,风入松 江南秋早，丛桂未华，连雨困人，大似熟梅天气，吴侬呼为木樨蒸，赋此以志清异。
423981,八声甘州·辛稼轩水调歌头和杨济翁、破阵子为陈同甫赋及本调读李广传，皆自写肮脏，不独鹧鸪天追念少年时也。余少志颇似稼轩，辛亥以后，始一意文史。去冬谢太学归卧海上，至菽水不给，遂斥藏书，辄效稼轩体赋此
517775,九日偶沽得一壶坐间诸友索余赋此
617523,庄景说奉使靖江王邸往来五羊见访赋此赠别 其二
423499,摸鱼儿·丁酉冬与双佩阁主别于沪上。今春予独北来，郁郁久居，音问旷隔，烟墨脂黛，坠欢窅然。新秋逆旅，君忽过存，剪镫清话，良慰羁袌。诘朝又入都矣。用花宜馆韵赋此，书扇寄赠，为异日相思之资
416229,绮罗香　冰如有美洲之行，赋此送之
833495,三姝媚 盛夏小雨骤晴，北池荷花遽开三朵，翠婉红娇，倚风如笑，为赋此词
556295,家居喜袁芳洲相过赋此为赠三首 其一
690519,戊午初度车宜仲内兄偕羊鹅二城诸君子为笠屐图以诗见寿赋此奉答
842465,冯逆犯阙，缶老来书云：聋有所闻，歌以代哭，赋此答之二首 其二
538941,用晦宗侯余德甫宪副寄诗贶问兼致先公挽些赋此奉酬 其一
302900,江城子·蒲门谷仓失火，金某被累，余为营救。感赋此阕
287856,重九后二日游南汤山浴于陶庐之温泉赋此记游
418912,鹧鸪天 燕女弥月为赋此词
534205,雨后饿姚元白还金陵召歌者蒒成侑酌醉后赋此为别 其二
459758,八月二十九病起秋来，聊为赋此五首 其四
1220714,丑月六日见迫趋升抗论力争复絷于小舟龙开河口累夕惊风怒涛中六日夜至十有二日大雪冱冻病卧赋此 其一
311737,感而赋此·漫道金闺射策伦
613706,羽甫兄得还旧磬赋此志喜
294179,二月初六日将赴试河南隔夕赋此以壮行色
424368,临江仙·瘿公书来，为程郎艳秋索词，赋此应之
569495,瀫阳公入佐天官兼领翰学赋此送之
294069,摸鱼儿·龙华寺百年牡丹盛放，斋堂小饮，花前赋此
515401,十二月廿一日得旨昭雪复官感激赋此
728616,己酉年九月自滇归闽，同人赠言惜别，途中赋此答之
872224,二十四夜梦到何许植物多瑞香觉而赋此
760252,实甫将行赋此为别 其一
785699,乡人以余远归争来询问赋此志感
512904,闻杨君谦致政赋此以致健羡十五首 其一
832379,喜迁莺 立春日，得杨铁夫书，喜闻彊村先生起居，赋此寄怀
521501,泰和萧生将赴临汀驿留三日为予写真赋此为赠 其二
638319,奉提学广川吴先生试赋此求教
465869,一九九二年十二月四日中山市博物馆举办欧初业馀书画习作展览赋此贺赠
834713,高阳台 甲戌中冬，予有夔州之役。漱泉送予江上，赋此别之
790531,昨承彦卿先生过访，赋此志幸，即次彦翁贻竹宾韵
443962,浣溪纱花朝将至，赋此以贺颖庐芳诞
307296,再赴吴门赋此赠胡老
711582,罗专城罢官东粤与余舍相依穷愁著书颇称同病余家在香山将浮海而归赋此留别
810177,章台月  吴姬宛宛，家在半塘桥，尝述其小时七夕遇仙事，感而赋此
515793,弘治戊午春正月十三日舟次淳安春霖不止进士维扬张君凤举方知县事以灯节燕予酒后赋此纪事兼致谢意
778516,贺新郎  杨商贤病起话旧赋此志感
334979,吕丞相自天台寄示退老堂诗卷赋此
416539,高阳台 旧历年本拟归家，忽被风雪所阻，江城淹滞，赋此写怀，窗外梅花，休偏笑我
272903,陈协只丈有遗悲怀之作赋此慰之
302884,疏帘淡月·闻式僧事，感慨赋此
1213804,得姚牧庵左丞书赋此以答
487735,读姚新宁苦竹记有感赋此为赠
821061,点绛唇 余客渝州，而门人旧故先后来者甚众，尊酒相劳，感慨系之。女弟子章璠索词，为赋此解
808260,换巢鸾凤  张东园送洋鸡一只赋此报之
444487,贺新郎 柏森先生七旬新婚，赋此为贺兼调之
604532,恩诏赐复冠带县大夫雨中携酒赐贺赋此呈谢 其六
426771,与演庐同客香港无夕不谈赋此纪实
283307,暗香·画梅，枣华遗墨也。雨甥属题，凄然赋此，依韵拟石帚
900391,汤总管邢监庙约游城东酒间求诗为赋此
780562,汉宫春 汝筠率孙辈频年都勇剿贼，今以韶关解围，均获迁秩。感恩述事，赋此寄筠
592572,张仲实过杨州为余写容赋此以别
422544,一剪梅 避乱濠江欲归未能慨然赋此
769079,青玉案·予有醉乡梦境图记或笑之赋此解嘲
588302,李三洲宅上兰盛开感而赋此 其一
1220352,湖西罗受可作梅月图赠予北行赋此报之
464935,鹊桥仙 其二 盆中海棠四季著花，用先君子韵赋此殿集
827297,庚午正月二十九日，予值消寒第七集赋此
247089,满江红·朱仙镇岳庙碑林征稿为赋此词并书以付之
604595,邑佐潘侯偕乡友移樽小园目废已久不能趋侍赋此奉谢二首 其一
417678,贺新郎 乙亥春宋词来饮 畅叙甚欢 次日赋此寄赠
816786,沁园春 潮阳太守宋让水远惠词稿兼饷方物赋此寄赠
302981,锁窗寒·读水云楼词，有感鹿潭晚岁事，赋此吊之
430579,霜天晓角 瓶中双射子，右株憔悴，左枝凄暗无色，似悼亡然。呜呼！鸳鸯同命，蝴蝶双生蝶双生，物犹如是，何况吾人？偶感近事，触目怆怀，赋此以当一哭
443623,浣溪纱　沉香亭看牡丹，小酌花萼楼，微醉赋此 其一
410425,正月廿七偕李伯虞仲侣昆弟严梓林赴江湾观飞机，美女士史天孙演驾飞机，日落雇人力车回报社，因赋此纪其事
460130,蝶恋花　人物依旧，故情已改，赋此自戒
1091637,梦与辛幼安遇于一精舍予赋诗一篇觉而记其卒章云它年寄书处当记卢仝穷因赋此诗寄之
400082,瑞鹤仙 客有以城南梅讯见告，赋此答之
533644,佛日拟游西山不果次甫竟申独往赋此寄之 其一
779285,鹧鸪天 冬夜听夫子论道，不觉漏三商矣。盆中残梅香发，有悟赋此
260347,元旦狱中自制弃纸灯笼狱卒以无文彩索诗赋此
570528,七年前为在明赋此十绝句今春在明遇余吴阊复出卷索书之时余二人各挂冠久矣因题二绝于后 其二
499437,高允宪先生客习氏馆中清风修竹翛然有尘外意喜而赋此
489383,昔先太史与白云閒上人憩此今三十年矣而壁间遗墨尚新瞻仰徘徊不胜流涕因赋此以识岁月云
247910,齐天乐·客有以咏藕词见示因用其原调赋此寄怀
464526,满庭芳 朱琴可荫龙，桂林少年，辑刻王半塘、况夔生、邓雨人鸿荃三家词，并在半塘故宅为老词人逝世三十六周年集会，赋此贻之
835362,贺新凉 壬申季夏客居邛廨，蕉窗送雨，烦襟洒然，张紫帆枉存，同赋此解
452176,清泉兄生性好酒日前随编辑部迁至营口海滨予道海鲜正适合白酒兄言白酒太费戏赋此篇以寄
748396,客有谈洞庭之胜者赋此奉简
444519,贺新郎 李锐老米寿，赋此为贺
537152,陈丈子兼自蜀右辖谢事归数辞徵召养性自适唯词翰流传人间耳今年七十而神明愈茂时余方填郧襄未能趋贺赋此寄怀
408352,杨文炤寄诗约杭州观梅春深始获成行赋此酬之
918630,谒金门 使君再招饮，牡丹如山，坐上赋此
784097,慧麟侄出痘新愈于元旦日索诗因而赋此
427904,虞美人 辛丑立秋日闻梅畹华兰芳逝世北京，赋此志哀
772972,癸巳1893夏台南郡久不雨时余随同镇道虔诚祈祷不胜殷盼赋此
1243815,与客话湖山佳胜予足不至者四十年因赋此以叙旧事
745977,将出玉关得嶰筠前辈自伊犁来书赋此却寄二首 其二
598540,筠台戴郡公枉驾敝庐赋此为别 其二
309989,一萼红·瓶梅一枝，春意蓬勃，将办出山，感而赋此
422561,水龙吟    岁暮，得宫悬来诗，知武华秋杪病逝，赋此寄哀。
744747,留章杰家五日辱杨三高二沈二丁倪二奚大周大王二张三高大先后枉顾归舟赋此以志清集
543494,夜灯同永叔话旧仲子弼年十四于座中戏咏白石榴有霜寒秋色净明月挂枝头之句余嘉其风格朗朗赋此勖之
708216,满江红 顾庵复和八首见示赋此答之并贻既庭 其十六
291403,苏幕遮·亚子来海上才五日，明晨将返棹红梨，怅然赋此
605188,有以苕上沈中丞客五羊诃林社集诗见贻者用来韵赋此寄之 其一
428057,清平乐 一九六五年十二月八日曹荻秋副市长当选为上海市市长，赋此致贺
536831,王生近诗爽然有天际真人想乃父沂州君濡首吏牍俱所不晓赋此赠之
538742,中庵上人结庵当虎丘之半赋此赠之
315195,减字木兰花·案上盆兰养之三岁矣，忽抽一蕊，喜赋此阕
757945,摸鱼儿 夫子久客袁浦，赋此寄之。
537682,弟侄俱荐赋此寄之
305592,闻君励将西行悢然赋此
792632,甲申游蜀乙酉夏闻亲病遄归感而赋此二首 其一
250476,东至泽兵兄邀请参加京城雅集因故未能与会赋此致歉
636868,前参戎李元济手植双槐于庭下其子东园兄弟不忘手泽颜之为堂绘图徵诗赋此并识旧游 其二
672266,平乐候王器之来巡适阻风迟行亲友情钟竟夕不寐赋此以迓
672461,四月十四日德州官廨见蔷薇盛开有感明日道间又闻莺声宛转在树阴中不胜凄惋赋此自遣
918498,开禧元年四月自中都挈家还乡寓居城南十二月迁居柳溪上其夜大雪初一日盖宰来访约过县斋为一日款深夜而归赋此 其十
432873,虞美人 院庭湘桃海棠已花，休沐日独赏，赋此
787588,孟春共甫之吴叔寅北上伯约之甬予将之东阳赋此志别
791435,甲申秋偕朗轩、鸿斋、远模游沪，回舟至锡，三弟入都，赋此志别
1208763,舟中闻笛（岳阳楼下邻舟一军将醉而吹笛爱其音韵清壮命酒赏之旦求予诗遂赋此以赠）
464934,鹊桥仙 其一 盆中海棠四季著花，用先君子韵赋此殿集
601110,集郭梦菊膳部席上赋此 其二
472350,秋日待家书不至感赋此诗
286102,藏上人寄诗招游西涧以事不果赋此却寄
250426,与文清昆阳子诸兄游北固楼甘露寺赋此留别
614632,成靖之予告余亦将南赋此为别
458033,厂外卫生所侧，薄有小林，有树久为斧伐，但一根蔸，上残数枯株而已。予出此抽烟，忽见枯株生菌，轮绕而上，枯株尽为所覆，其美盖不可名状，因为赋此
492540,闻伯兄中翁有水竹居之乐赋此奉寄
427952,卜算子 老妻培育紫玫瑰一枝，秋后尽发花，冷艳清香，得未曾有，赋此纪之
832000,闻槐庭东游，赋此寄赠 其四
604986,杨鹏遥方伯赴粤西重过小园投诗见别未及留酌赋此呈谢
491802,过新淦樟口欲访检校谢叔宾不果赋此遥谢
453410,云生海楼过洪州，感而赋此，兼柬纷纷
411466,丁酉夏余应安徽省文史研究馆之聘，寄居岳西县垣，夜不成寐，起读杜工部诗，感而赋此 其三
537327,吴人杜惠由小侯弃官归卧好谈玄理余时避地过从甚得赋此赠之 其一
836136,鹊桥仙 阳历七月七日，东邦士女相将乞巧，忘与汉朝腊错啎也，戏赋此解
325252,赋此自遣·当年贱子叹途穷
508715,景泰壬申九月初六日，经筵讲退，蒙召至文华殿。皇上负扆而立，面垂顾问，赐楮币一千贯。复遣中官赐雪花梨及鲜果一笼，荷恩感激赋此以识
507242,两蒙恩赐倭扇欣戴之馀赋此
1089678,谢观复长髯垂膝俨然山泽之癯弃去儒业从皇甫道士于庐阜余见之三茅以所编老君实录见赠赋此奉酬
1116155,吕丞相自天台寄示退老堂诗卷赋此二首
488900,彭二令归香山县仆往瑞州候小孙得同舟至胥江又分去赋此
901097,西州访旧诸公皆沿檄去偕江一父过郎官湖赋此
665251,陈子道脩来南京求铭父墓赋此送之
569626,殷无美与沈君典状元有南宫之好今将访君典于宣城赋此送之并简沈
416580,望海潮  民国卅四年客南岳中学感怀赋此
568385,丹阳孙思和东游每当山水胜处辄绘为图冬夕过俨山示我光福一段赋此
727772,西子妆·雨中坐放鹤亭眺湖光山色感而赋此
843237,荫坪叠落花前颌四首索和己未及今十年矣感而赋此 其三
428040,南乡子 刘定一自江宁乡间来，留宿萧斋者六日，倾谈特契，赋此赠别
614676,孟郁兄偕陈参戎帅兵平山东妖贼赋此以壮其行
408318,钱默存新婚即偕往英京留学赋此志贺
797107,沁园春 仲春独步小园，见风景萧条，感而赋此
712168,向恬庵携酒西山是日适热发不得痛饮赋此答谢
434517,浣溪沙 元夜后一日史生仲恭久客初还酒閒喜为赋此
202096,刘元辅寄咏史六十首赋此为谢
826178,风入松·年来好漫游，赋此答问者，时在青岛
61230,欧桢伯得请归岭南赋此以寄
289898,三姝媚·园中紫丁香三株，今春特盛，风晨重对，已半残矣。怅然赋此
697254,王中叔擢北部归省天台以尺素相闻赋此代饯时永叔乞假里中二首
494650,周厚山中丞家鹤产双雏是称瑞鹤为赋此诗
558108,诗欲学陆放翁赋此见志
641454,伏承陜省卜架阁以臈粥稻米相馈麟游危赞府亦寄鹿脯到斋赋此叙谢
312465,浣溪沙·畹君书告肝病复发赋此慰之
493720,署荣阳教谕永昌举人周绍稷连遭二丧归道遇于滇为赋此
