826211,卜算子·宵诵东坡此调，意当时怀贤去国，情绪万端，必有不胜其辗转反侧者。赋此见意，亦宋玉微词之旨。世人以侧艳目之，谬矣。港居荐涉冬春，望远登楼，伊郁谁语，偶继坡作，以写我忧。世其有为我作郑笺者乎
624491,天然本师归自匡山先札赋此寄讯
769623,满江红·同天申、扶九、跃千、秋箴、蔚园诸君饮雉升斋中，即事赋此 其一
444608,惊闻江南雨兄尊人辞世赋此以悼
452152,大雨中喜识永新兄，小酌间相约赋此
792923,包筱笠以侍萱图属题并示其自题长句赋此以广其意
85457,实甫将行赋此为别
826155,高阳台·木君赋此词，瑰曼可诵，爰依其韵，更赋秋草
508995,夏仲出郭归迟暮投山寺而宿与无垢净上人坐话漫兴赋此
460255,蝶恋花　元月三日别王江华，待车华容注滋口车站，孤坐赋此，时醉初醒。龙贺江，实沱江，当时误听耳
368953,百字令·喜药林至高平招同周倬云陆秀三柳湖即席赋此
186851,齐山石壁间见林择之题字缅怀其人赋此
547856,寄吴少溪宫录七十 其五十二 平阴徐南龙令君夜邀别后有诗见寄赋此酬谢
937681,十三日再赋二首其一以赞使君是日对花赋此韵诗笔落纵横而郡中修水战之具方大阅于燕公楼下也其一自叙所感忆年十五在杭州始识此花皆三丈高木尝赋诗焉 其一
790754,旋里既久亲故犹诿陲不已，赋此自遣二首 其一
695143,孙比部以建言谪潮阳宾于小墅清夜相过感而赋此四首
758185,多丽 冬夜病卧不寐，倚枕赋此
570527,七年前为在明赋此十绝句今春在明遇余吴阊复出卷索书之时余二人各挂冠久矣因题二绝于后 其一
683373,程广文先生德甫博学能文章用睚眦去其官郁郁不乐将北游淮楚以纾其志赋此壮之
278186,沁园春·偶读刘复村《我梦见君》词，改用其韵赋此
606852,郑生善仪索赠赋此留别
531997,感秋三首时洪都兵变予方种菊东篱有终焉之志因赋此诗 其一
667936,一雨数日不绝田畯抱病穫之忧予闻而嘲之曰甫幸其润随忌其淫然则天之欲媚于人也难矣感而赋此
384906,朱石翘比部改官出宰楚南，纡道过访，赋此赠行
831538,读梁子嘉大令日本纪游诗卷，赋此寄之
292026,癸未冬初应邀去山水大酒店观览奇石展赋此以答谢主人
424333,好事近·己未孟冬薄游汉上。十发丈招同梅郎饮于寓楼，出示灵岩垂柳图，话石巢旧事，赋此为赠
934934,九月十八夜梦避雨叩一僧院有老宿年八十许邀留甚勤若旧相识者梦中为赋此诗
1135046,吾乡朋友比多诗人宜进一步大则文公小亦龙溪可也于汪德载杨复之归赋此意并寄刘元煇黄仲宣
545462,张中丞助父两以书寄余余亦两书寄助父而皆不达郎君后之都下再得手札赋此奉酬
958294,砌下黄菊暮秋始开为赋此篇
411416,闻日寇攻陷皖城，愤而赋此 其二
697582,集郭梦菊膳部席上赋此
454212,《陶景明诗书画册》出版忆与陶公交往事感而赋此
597644,闻侄儿应昆昨始发蒙走笔赋此兼贻示后生
542309,朱郎中伯邻养疴道院雨中见召赋此答之
632545,余与大来苏筑俱生残冬感而赋此
431700,幼子梦芙英年失学，将随堂侄和炎习工艺，明日拟作潜岳之游，赋此志感
887583,金盏子 独寓窗晚花方作小蕾，未及见开，有新邑之役。朅来西馆，篱落间嫣然一枝可爱，见似人而喜，为赋此解
605038,同人区季方以少司徒还里赋此讯之
832221,瑞鹤仙才人河满赋此慰之
532412,二府少峰江先生同令弟章山哭其季方文厓上舍得诗二首示及索和赋此 其二
266699,水调歌头·程十发以天台采药图属题，旋即谢世，为追赋此阕
611495,闻尹禺阳下第愁病赋此代柬招过剧谈
424470,浣溪沙·少梅为余作醉月颦霞图，赋此纪之
301875,钱默存新婚即偕往英京留学赋此志贺
311710,闻日寇攻陷皖城，愤而赋此
419455,八声甘州 溥心畲以所作山水见寄，赋此报之
826195,点绛唇·重阳闷不出门，遂失灵岩登高之约，赋此见意
765110,春日延荔浦寿邀余读书西坪赋此二首 其二
1241131,承君衡叔干远送赋此以别
700262,泰和萧生将赴临汀驿留三日为予写真赋此为赠
424308,高阳台·月夜泛湖至彭祠，光景奇丽，杏丈高吟来人买得渔舟度岁华之句，余亦有浮家意。感赋此解
526631,黔国别号玉冈用喜雨诗韵为赋此诗
492565,过河间府遇高阳刘思道乃吾乡先生元友严公之高弟自云旧藏公遗文若山水记等作类多遭乱散佚不存而山水记存者又以远而不得见慨念今夕为之惘然明日赋此为别
820460,满江红    逖徐州感赋此阕
588682,燕山田少参将奉表北上以忠孝节义四书见惠题诗其上赋此答赠
791558,左泉先生赐读伴云仙馆，即事诗八首，赋此奉酬 其一
453991,无欲斋主览拙著两宋四大家词札记旋贶瑶章赋此为报
834667,西子妆 秋宇澄霁，残月初上，暝烟不生，楼外丛树动摇，凉翠欲滴，同蘋湘赋此，一绳新雁，若与歌声相和也
602879,秋日卧病显恩僧舍承邬文学汝翼贻诗枉问赋此答之
542650,程总制信夫东归赋此寄怀
636870,前参戎李元济手植双槐于庭下其子东园兄弟不忘手泽颜之为堂绘图徵诗赋此并识旧游 其四
246310,风入松·蜀州雅集听天放楼主人抚琴赋此归之
732333,开岁往役海上暮春还时家更空乏赋此
678470,喜陈少尹致仕还赋此奉寄
757254,声声慢 三月望前一日，纫兰妹招同雪兰大姊、蘅芳三妹暨畹兰五妹看海棠，赋此索和。
939118,叶茂卿寄诗卷赋此以谢之
559708,喜从玉壶记忆得周忠介旧寄二诗赋此 其一
466781,客中晤寤堂兄于圳上有怀酒风石雨兄兼寄柳堂兄与长沙诸子 于鹏城邀寤堂兄聚龙华赁舍赋此
760752,虞笙以题蛱蝶图诗见示，为赋此 其二
440424,端阳前二日赴韩山讲席试深感赵公长者下士之心赋此留别兼简渺之兄
426911,至马坝喜晤郑孝则盛九万舒宗度袁凤文苏武龄麦显朝何彼秾及之衍侄孙分日留饮赋此纪实 其五
780272,浣溪沙 落灯后二日，维舟蟠溪新桥，水风冻烟，山雨酿雪。孤榜剪烛，怆怀旧游，慢赋此解
683535,明卿约以秋月枉驾寻有诗来改订春期赋此促之
1225082,至正十一年秋七月巡按松州虎贲分司时山谷寒甚公事绝少明日即还为赋此 其二
538694,王参政明辅为余刻姓名太华绝顶以墨刻见示赋此为谢
839935,百花生日次房得孙赋此志喜二首 其一
606783,李明府迁居延平忆旧里春宵之景有作见怀赋此和答
452539,望海潮 古雷半岛风光秀丽，海产丰饶，惜新建化工企业即将运行，佳景或恐不再，辛卯九月初特与力夫、新河、高凉、疏影来此作告别游，时值台风来袭，巨浪骇人，遂与诸君相约赋此
833930,一萼红 忆吴门旧游，赋此解，寄社中诸子，用白石韵
752860,会兴镇河干悬崖数百尺平挹中条俯临茅津乔生建飞阁三楹于其上置酒高会以落其成即席赋此
606908,王倩泠自四明来访将由罗浮历武夷至雁荡而归武林赋此为别
419580,念奴娇 卧病逾年，盛暑中两度梦醒后赋此
603039,秋日欧卢二社长见过同读钟茂才秀贞诗集赋此寄怀
311662,赋此志感·季子担簦怅远违
835976,虞美人 雨后怀秀崧，赋此寄之
519995,三月十日牡丹盛开将约诸宾客共赏九日夜忽风雨大作黎明园丁走报花已半离披矣感而赋此
690580,宝安旧令姑苏李子木侍御读礼里居远贶书币见索拙刻复为张天如太史杨维斗解元绍介亦索拙刻即以拙刻耑力各致之赋此驰谢
419534,木兰花慢 获闻毅成溘逝，用乐章体赋此悼之
820665,小若皋 三弟作咏史一阕，多壮语。爰反其体为赋此解，即用原韵
778014,惜秋华·瘿公薄游海上，以程郎艳秋小影见贻，赋此以志俊想1919
728531,八声甘州  客有言西江近事者感而赋此
45650,王述庵论诗绝句诋諆放翁感而赋此
356730,菩萨蛮·九日薄饮，既阑，同蘋湘徘徊长桥，云波明瑟，怆然赋此
453684,南徐树寄示题江西一老图赋此答之
409732,季野之江上，赋此赠别，兼致雪楼、慎登 其二
842518,怡园主人消寒会予自上海归赋此
285112,水调歌头·朱子英贫困思家不已，赋此慰之，非调之也
250709,庚寅中秋登狼山望长江子佩言此为长江之尾岸阔潮平恰如人到老境旷达平和感而赋此
1225157,方景贤宋景濂夜坐观吴中杂诗遂及宣和博古图为赋此
776404,辛亥1911季冬因东市场边元帅庙街一带民居尽行拆毁赋此志感
432295,水调歌头 衡阳王剑龙南游三载，与予同事于槟城钟灵中学，此次假归省母，向余索词为别，赋此送之
808062,齐天乐 三弟寄椒珠并蜀笺数种赋此二阕示之 其二
416489,齐天乐   丁巳季秋，于故纸中觅得先外王父郑晓涵先生手书，自辑《晚翠轩词》残稿一卷，先外王父曾自刊《晚学斋集》，流传亦稀，仅存硕果，览物怆怀，赋此一解
521742,黄岩有水出天台下流入海湍悍能败舟土人呼为恶溪艾斋陈君募乡人筑长堤截而回之民用无患是岁与施彦器宪副访予云间赋此为赠
422185,庚子秋夕访李莲卿于城西，赋此四首 其三
512909,闻杨君谦致政赋此以致健羡十五首 其十
430627,满江红 先子遗容为蠹虫所蚀，重装后，幸无恙，喜而赋此
778464,临江仙  艾石五兄纳姬白门善解琴书携之入蜀催妆赋此
267466,瑞鹤仙·庚子岁晏赋此调，寄悔生长安，今三十年矣
309889,一剪梅·避乱濠江欲归未能慨然赋此
647195,汪夫人以不系园诗见示赋此寄之
715931,大司马吴公惠田赋此奉答 其一
417531,鹧鸪天　癸亥秋识叶嘉莹教授，叶治吴词，颇有新解，见似人而喜，赋此 和敏庵得金陵织造府遗石
418653,蝶恋花 前意不畅，再赋此即寄荫君
416306,扁舟寻旧约 寓斋对雪，有怀九珠叔。适陈匪石至，邀城南探梅，赋此索和
287212,金缕曲·奭召南八十初度，刊集告成，见赠，赋此为寿
833453,高阳台 爽翁卜妾秦淮，赋此调之
638636,戊午七月访清江浦冬官席文同地曹刘用熙饮于园亭赋此
500099,王大参以春景诸作见遗赋此以答
760253,实甫将行赋此为别 其二
431699,七月十三日为先妣九十七岁冥诞，赋此志痛
521788,过东昌访前贰守郝公适公生辰赋此为寿郝在松职专治水守廉奉公今不易得也四月二十一日
718414,文与也为予写西洞庭图赋此以赠 其四
501203,湛渊王提点招饮出示座主马中丞诗归赋此谢之
818906,十二月九日为陪都各界追悼昆明被难师生大会赋此书痛兼誓努力
230793,小王亲迎赋此赠行卒间聊遗鄙怀
834942,鹊桥仙 浣秋书云“秋初当理归舟”，赋此寄之以坚其约
704386,佛日拟游西山不果次甫竟申独往赋此寄之
750622,新居落成赋此自贺兼柬镜仁
459263,黄金洞中学醉卧，半夜起，步至塔下，岚雾游移，山月濛濛，万山空寂，渺予一身。忆旧游不再，聊为赋此
452108,因蜀滇之游得与沚斋丈相识蒙其以墨宝见惠并填词见赠赋此为谢
443208,玉楼春 小农弄璋名子曰士铭婺俗将临双满月赋此为贺
285218,吕贞白与徐声越来游，赋此志感
427969,卜算子·得冼玉清教授书云：陈寅恪教授自去岁折足，政府特派护士三人更番照顾，近又为制小车，由护士推挽于走廊，藉吸新鲜空气。感赋此阕
573457,顾升伯太史奉命如梁赋此为别
288989,杨笑侬叠寄新诗，并惠铁观音佳茗，赋此以谢
798865,风入松 在梓舍决计入山，赋此
288654,烛影摇红·壬戌七夕前三日畹华姬人得子，赋此为贺
601400,晓起闻宠儿捷报赋此志喜
445849,己丑腊八与友人京华论诗相约赋此
248041,人日同新河兄夜饮大醉值京华初雪赋此却寄
534204,雨后饿姚元白还金陵召歌者蒒成侑酌醉后赋此为别 其一
602682,闻方长公入粤因承存念赋此寄怀
468027,香港李国明兄以墨梅一幅见赠赋此以谢
634868,省英卓今病因留宿旅舍经旬临别赋此 其二
414406,孔雀今日意特依依暮遂不见度有远行矣赋此送之 其二
325088,箧中检得败纸一束，启视则游梁时留存之要牍也。感而赋此
817661,武林乱后，未得贞壮书，赋此讯之，丙辰小除夕
545100,金伯韶以春怀小草见诒讶其结交甚盛戏为赋此
400096,洞仙歌 廖忏庵丈以词见怀，赋此却寄，并柬冯秋雪
786496,有同姓黉士，率先断发洋装者；以其画兰册来徵题，姑为赋此
539159,子与自闽远使相讯道失所贻书而诗篇幸存赋此报寄 其一
633427,壬寅春三月石鉴覞弟奉师命入阊门为先师翁乞塔铭于钱牧斋先生赋此为赠
624633,公眉兄自闽漳来访予旧有游漳之约因事不果感其远至赋此为赠
459759,八月二十九病起秋来，聊为赋此五首 其五
553309,晚至昆阳州饮通守家土官留此州俟予至同宿马氏有邻妇李氏抱子携酒而至赋此
544802,大司空潘公寄示河渠诸刻卒业赋此奉赠
820728,台城路 忏庵寄示秦淮闻歌词赋此报之
688073,遭诬得罪赋此以见志
558607,二月八日予生辰也喜浙江左大参桂坡先生至绝不饮酒茶话甚适赋此以识 其一
385838,岱孙春闱幸捷供职西曹，赋此寄勖
684038,耿大夫入为司徒领太仓事时余方上书乞骸赋此赠别
411457,武汉铁桥落成，赋此致贺 其二
419910,月下笛 久不闻杨致存信，昨来书讯近况，兼问同人，赋此代柬
459882,金农诗云：“故人笑比中庭树，一日秋风一日疏。”似指故人物故。予虽无此，而故人日散，殆亦相类。赋此首
297987,自澳返穗止于友家感怆万端援笔赋此
418886,风入松 次箫赋《水龙吟》题余词集，语多溢美，赋此所以报也
729787,鹧鸪天  王幼霞御史得其友人由江南拓寄江总残碑，因作秋窗忆远图，属题，为赋此阕
709471,夏日承本师天然和上属阿字持书沈阳诗扇寄示赋此奉答兼怀阿公
498830,衡守蔡白石月夜见过赋此别之
774637,东征逾载整棹言归巡使黄玉圃先生索台湾近咏知其留心海国志在经纶非徒广览土风娱词翰已也赋此奉教 其三
784315,冷子示关中友人赠诗且索予作赋此以赠
590569,樟树取道浏阳遇聂凤冈惠酒赋此谢之
831997,闻槐庭东游，赋此寄赠 其一
598605,弼唐兄食不重肉乃东西远游无宁岁感而赋此寓忠告之意
680625,舟中遇同年吴圯宪副往洮泯兵备问余彼中风俗赋此答之
452082,仰翁以耄耋之龄相陪自宜春至丰城再到南昌始还途中更以诗见赠感愧之馀赋此作答
797378,满江红 韵玉六妹赴陕，赋此送别
50181,有怀淬用刚赋此以寄
468057,梦江南 小薇师养病于市八医院，赋此以慰
294507,冯逆犯阙，缶老来书云：聋有所闻，歌以代哭，赋此答之
542492,吴子乔有弟从方士数年不归因访于梁宋间赋此以赠
324573,从叔君冕见访山间自云平生躬耕钓无求于人中有至乐令某作诗写其萧散之状为赋此篇
402950,醉翁操 坐飞车，御长风，泠然善也。词人前未有赋此者
269038,陈迂谷中翰维英移居狮子岩斋额曰栖野巢赋此赠之
545449,王行父入都以鹅飵糟鲥葛簟等物见饷赋此
605176,戊辰七十有一境内外诸名硕皆以佳章见寿赋此奉谢四首 其一
447627,蝶恋花 芳草邀游璧山青杠，夜半酒酣，狂歌醉舞，真所谓不知老之将至也，即兴赋此
402915,南浦 将去燕台，赋此留别
273252,琼宜女侄和余夜楼居四律赋此励之
581743,夜饮李黄门第以技马较胜负约五负者罚诗一首予数负赋此呈同饮诸公
431675,闻日寇攻陷皖城，愤而赋此
404590,鹧鸪天·友人赴哈尔滨出席红楼梦学会，临行以临江仙词见示，赋此赠之
810104,三姝媚  秋晚新晴，买舟黄步，时闻易五中实卧病惠山，便一寻问，用梦窗韵赋此。
368938,齐天乐·三弟寄椒珠并蜀笺数种赋此二阕示之
844333,闻槐庭东游，赋此寄赠
431013,长亭怨慢 洞庭先生以所存先师钝安先生诗札手迹数纸见示，盖劫余之遗也。属为题词，怆然赋此
1071256,宣和四年东阳梅某出守蕲州以五月十九日斋宿山谷黎明奉亲朝谒真源万寿宫少休五云寺赋此
605189,有以苕上沈中丞客五羊诃林社集诗见贻者用来韵赋此寄之 其二
539215,请太室兄为代而不能俟赋此寄怀
615832,乙卯冬何龙友北上卒卒未及一言为别嗣得其度岭书赋此寄之
273591,金错刀·行严居南岸汪山，赋此寄怀
518953,题宝泽卷守拙翁手书小学真解遗其子其子宝之今颇有成立故赋此
819090,作书久不能进愤然赋此
597130,贺文铭德铭遥想忠铭亲家赋此
452417,三江兄远寄脐橙赋此以谢
444232,乐乐伉俪见访赋此以赠 次凫公失喜韵
790843,金溎生同转寄示诗章并以冰泉唱和闰集及陶庐杂忆两卷见赠赋此报之三首 其三
569712,张肖甫司马特膺简命督抚全浙赋此赠之得二首 其一
657225,潘麓原去青县十年矣青人思之有感赋此
419560,八声甘州 闻行严丈年来爱倚屯田此曲，且传近又奉命南飞，赋此寄之
712626,与柳州江使君磊庵再晤于五羊适有西川督学之擢赋此送之
541457,郑生学医从海上军索赠赋此
605013,韩绪仲宗伯卧子舍以神祖实录告成束急还朝计日爰立索诗为赠赋此志喜 其二
427868,采桑子 戊戌重阳后十日，得吉川教授寄赠中国文学报第九册，赋此报谢，兼怀小川环树先生
807701,泛清波摘遍  万大士表兄招赏白莲赋此
98605,文叔见饯于郊外且有所论复赋此
1231927,与白云山人夜坐山人将归天台即席赋此送之
604955,杨鹏遥观察雨中过访小园粗粝未陈淹留竟日赋此奉谢 其一
521500,泰和萧生将赴临汀驿留三日为予写真赋此为赠 其一
918497,开禧元年四月自中都挈家还乡寓居城南十二月迁居柳溪上其夜大雪初一日盖宰来访约过县斋为一日款深夜而归赋此 其七
427788,沁园春 喜获郭鼎堂先生复书，辄用后村梦孚若韵赋此代简
830523,读范肯堂遗集怆然赋此
559127,丁未七夕雨适郑德进馈芳园胡桃时乡人报夷舶因风出洋矣转忆沈约有云胡桃挺自禁地为胡羯奔逃之兆感而赋此 其二
542664,吴太守明乡入觐见访时客晋赋此奉答
789941,过汪北鱼香南斋时，携琴僧墨隐、画史吴冠英，游大小石湾，久待不归，赋此却寄四首 其四
281204,赋此寄赠·凫舄乘风上碧虚
1223768,欧阳元功待制入院后仆以兼领成均辰酉甚严绝不得相见今夜当同宿斋宫赋此先寄并简谢敬德修撰
805539,贺新凉 初夏过陶然亭寻壁间竹素青士箌云旧题半已磨灭矣怅然赋此
709060,次韵鹿干岳《喜从玉壶记忆得周忠介旧寄二诗赋此》
493204,题散兰图花叶狼藉若采而弃之者有松枝竹叶杂之盖戏墨也进士刘仲炯以示余因为赋此
596908,先人琴砖从修宅得之感而赋此
416331,蕙兰芳 湖帆得马守真、薛素素画兰，合装成卷，嘱赋此解
833958,国香 买兰数本，香韵绝佳，为赋此解
604801,诸亲朋小园宴集赋此奉谢
807413,无闷  益都冯相国夫人饮我以太和春赋此奉谢
760690,菽园以镜映选诗图见寄，赋此奉答
783332,癸亥五月二十后酷热异常死者万计六月五日恭遇皇上省躬求言是夜北风大作继以膏雨沴戾顿除仰见圣主至诚格天捷于影响赋此纪异且私幸其安全也
429870,与蛰云论诗归后得赠章赋此报之 其二
958293,相识有遗予以紫石砚者谓是下岩石名曰玉斗予自湖南再转之岭畏行李重滞旧所用委弃不存正以无砚为窘得之喜甚且爱其名捧而戏之曰亚父后尔尚无恙耶为赋此
585791,上唐庄旧名盘龙山村老云崔丞相有碑一通喜而赋此
839936,百花生日次房得孙赋此志喜二首 其二
1249986,友人仕掾曹为上官所迫从赋此送归
513647,成化戊戌四月十一日储皇御左春坊敏政进讲大学首章退宴文华门十二日上御经筵敏政进讲中庸第二十章退宴左顺门感愧之馀赋此呈同事诸君子
738143,高处厚先生信宿山中赋此却寄
766153,解佩环 梅为风雨所败感而赋此
833739,兰陵王 午诒赋此调寄宝生，奉同一首，后阕为薛四发也
598640,驿亭所至见总制王鉴川留题及捡所上封事数读之勃然兴怀赋此寄赠
325091,金溎生同转寄示诗章并以冰泉唱和闰集及陶庐杂忆两卷见赠赋此报之
417787,鹧鸪天 夜饮洞庭银针茶，思乡之情油然而生赋此以解宿酲
787804,宾于将返武康以所携笋蔬麦餈见赠赋此送之 其三
425953,八一初度，陈以光老师惠诗称寿赋此奉谢
411390,重阳后一日游太湖之南乡，夜宿山中，久不成寐，凭窗远眺，赋此咏怀
918611,沁园春 其二 挂黄山图十二轴，恰满一室，觉此身真在黄山中也，赋此词寄天都峰下王道者
608641,汝纶将归南暂往吴门酒后赋此
792313,旷庐落成移居赋此 其三
844773,丁巳元日赋长篇后意未尽而韵已将尽乃再赋此二章吾平生所得在此也
248879,邵燕祥《当代打油诗丛书弁言》读后赋此自嘲
346813,刘元辅寄咏史诗六十首赋此为谢
61112,早春大中丞同川李公见访询及陂上旧游处赋此
249699,八一生朝政协惠赐寿糕赋此感谢
679528,读高冲寰月下为雪山寿母诗赋此兼有厚望以有山林语也
314974,木兰花慢·癸巳晚秋冼玉清教授南归过沪，赋此赠行
813667,齐天乐 三弟寄椒珠并蜀笺数种赋此二阕示之
606089,贺郡丞过谈有思归之作赋此慰留
538209,陈子道易向客徐相公所以忤陆都督出游谒余营丘有舍馆之契今年夏初复访海上留少时虽才气不衰而发种种矣赋此惜之且以赠别
429279,瘿公若海约游西山期而未往瘿有诗见及赋此谢之并书所闻 其二
253133,平湖陆维钊书画院张某索书虎字赋此报之
410403,约同人游吴淞望东海登废垒而赋此（二首） 其二
419256,风入松 与达安别四年，盛暑重逢沪渎。因偕往吴淞观海，追念南普陀旧游，漫赋此阕
541282,李敬可刘和甫访予石洞敬可赠诗有卜邻之意赋此奉答
672635,吾鄞龙舌朱氏予先祖侍郎府君之姻族也守阯弱冠时尝馆于其家表侄名轩者年才十三从受业焉今来南都须鬓苍然问其年已六十二赋此志别
252031,幻庐先生治印以惠赋此为谢
569980,瀫阳公入佐天官兼领翰学赋此送之
513472,长至后二日山陵陪祀回适有诏修宋元二史纲目不肖滥预率尔赋此
457912,石人兄读予《荷塘集》，得一奇梦，梦曰：大夜弥天，唯荷塘恍有黑光。荷盖大可覆人，予趺坐盖底，胸以下皆没乎水。石人谓碰壁已亡，此必其魂也。有顷，亦下入水，与予并坐荷下，隔梗而顾之。时巨雨如泻，荷盖震颤不已。久之，拉予返，而予冷然不理。石人归，及岸回首，见予趺坐如故，乃为之泣下。予故为赋此 其一
1241129,有怀淬用刚赋此以寄
521749,锡山王应藩工真行书尤善题署予辑郡志为予留数月将归赋此赠之
964384,小王亲迎赋此赠行卒章聊遣鄙怀
307605,满庭芳·复生归蜀，赋此赠别
1077863,客有馈玉面狸者戏赋此诗
709276,暮春羊城社集诸公诗成寄示并索赋赋此答和
830221,丁巳元日赋长篇后意未尽而韵已将尽乃再赋此二章吾平生所得在此也 其二
834718,垂杨 汉南道上，烟水凄绝，寒柳萧萧，似闵人摇落者。因赋此解，他日漱泉见之，当亦以为有桓郎之感也
728362,金缕曲  姜西溟言别，赋此赠之
415921,乙卯仲夏偕吟友三人①游黄山登飞来石以观西海群峰有感赋此
774608,陈茂才瀚归自闽军以中和诗草见示适闻和议已成感而赋此并题其集
610327,潘子迁社兄以诗见赠赋此寄怀兼申华祝
807507,念奴娇  徐孚若招同诸子过饮余以怯酒先归赋此言谢
569691,甫尔逍遥偶得陆司空与绳数行坐客因举吴门诗语一笑赋此
294289,轮舶夜行喧填奋发，有惊雷怒涛之声。枕上赋此以寄旅怀
668022,客有以琴书谒予者赋此赠之
512907,闻杨君谦致政赋此以致健羡十五首 其七
568968,辰玉应试留都赋此赠之兼赠孟孺 其四
761026,水龙吟 皋桥水楼曲宴醉别瞻园，会馀岁暮有九江之役，载雪过白门，愿言不从，赋此感叹。
431082,闻太一越山被捕慨然赋此二首 其二
370868,疏影·湖上见柳影因赋此阕
636110,归路再经罗浮不能游焉赋此留别
1223940,甲戌四月十七日至临川冲云寺祝圣寿斋罢为赋此诗
465288,凤栖梧 手种雪山大豆作花，初开则轻红未消，已放则一白早露，孙花翁梅边语妙，可以同证矣。欣然赋此
790444,读前明贡月楼先生倦飞吟及当时同僚和作赋此纪之
538957,王司成元驭转北露章请告时予乞归之疏已上矣赋此奉问
695287,闻梁侍讲叔厚先生暨王文哲黄门使交南将过富春赋此二律以侯兼致赠别之意
639135,大司马刘东山老先生谪戍肃州遇赦放还经襄阳铁佛寺叙旧赋此奉赠
427706,祝英台近 丹阳吕凤子避兵入蜀，取稼轩词意为写落花美人见寄，爰依原韵，赋此报之
605019,黄君常从罗浮以陈抑之邓玄度两君书见贻君常且损佳什缪相昵就赋此谢之幸语两先生促膝不远也
646146,夜归赋此以寄东田隐士
