431683,阔别宜城，瞬经八载，江山依旧，人物全非，赋此抒感
434513,临江仙 三月十日与诸君约会西园久而不至花又狼藉因赋此以排闷
380976,临江仙引·九日有怀瞻园，时方辟兵海上，用耆卿仙吕宫赋此
432245,游交芦庵僧人老且病出观华秋岳奚铁生西溪诸卷欲访厉太鸿先生墓为时已晚怅然归去赋此赠之
1064461,二月二十一日奉陪季长游岳麓饭罢登法华台赋此
458154,十一月八夜梦见先父，予问曰：“这几天你到哪里去了？”语未及终，即蹲身咽泣，不复能声。恍然中似觉先父渐近予前，然予闭目，未尝见其面目举止，但觉如是耳。既醒，犹闻唇吻间喃喃自语曰：“你不在家，怎么吃饭的？”倚枕更忆，梦中语时，尝略犹疑，不知当谓“几天”抑“几年”；实则先父弃世，行将廿年矣。越三二日，中夜复醒，乃为赋此
549992,牡丹落几尽矣惟馀一枝垂垂不坠因而赋此
605109,制府姚江王公疏荐地方人才谬以见及注曰原任贵州平越府知府张萱学穷二酉胸富五车岭南开著述之宗天北起斗山之望即未报闻第草莽之臣获以姓名从诸名流入公夹袋亦感恩知己矣赋此寄谢 其三
684024,敬美弟杜门信州移文乞休赋此寄之
810972,旷庐落成移居赋此
250226,江右诗社相邀于庚寅三月初三丰城雅聚先赋此篇以寄
417616,青玉案 偕娟访蒋锡鸾，赋此为赠
816956,东征逾载整棹言归巡使黄玉圃先生索台湾近咏知其留心海国志在经纶非徒广览土风娱词翰已也赋此奉教
292030,俞律诗兄督予先作《登庐山龙首崖放歌》，因走笔赋此，不知能入法眼否
478628,闻杨君谦致政赋此以致健羡十五首 其六
570025,故人卓澄甫光禄补官北上过金陵饮官舍赋此送之且订留署之约
559126,丁未七夕雨适郑德进馈芳园胡桃时乡人报夷舶因风出洋矣转忆沈约有云胡桃挺自禁地为胡羯奔逃之兆感而赋此 其一
501201,赤盏为肃慎贵族于今为清门希曾其字者读书为诗善鼓琴且工墨菊有新意为予作四幅留其二徵诗为赋此云
388210,春晴与峻伯游云门既别雪乃大作赋此志之且订后约
741183,夏日喜静山诸君过我留饮赋此
416925,声声慢 江亭重到景物都非感赋此阕
423512,莺啼序·津门羁迹，七度蟾圆。今将南去，临岐惘惘。用梦窗韵赋此，留示同人
454661,邵燕祥《当代打油诗丛书弁言》读后赋此自嘲 其一
1075219,客舍有井极深而寒今岁大暑日汲以供盥濯喜甚赋此
834090,沁园春 小斋开同心兰一枝，为赋此解
764824,一萼红 朱修伯太史同年学勤见余上年赠月娥词属倚原调转赠雪卿为赋此阙
826246,眼儿媚·丁柏岩又行，赋此送之，益难为怀矣
42907,客有言西江近事者感而赋此
775674,壬辰1832春来澎办赈务临行赋此为蒋怿庵刺史志别 其二
370992,菩萨蛮·马佩兮梅花卷子寓骑省之戚徵予赋此
50197,永乐寺观先师柳公三大篆及诸石刻泫然赋此
380911,章台月·吴姬宛宛，家在半塘桥，尝述其小时七夕遇仙事，感而赋此
635480,白沙先生梦长髯道士手挈一囊贮罗浮山遗之纪之以诗黄子汉人奇其事继以长歌予见而复奇之赋此以广其志
416494,高阳台  周氏园本曾宾谷先生故宅。丘壑有致，花木便娟，今沦为学校，抚今感昔，为赋此解
455319,清平乐 岁杪得倚云女史绘赠《小梅窗填词图》更蒙蛰堪兄首倡《清平乐》诸吟侣迭相和赠铭感于怀赋此一并拜谢
718411,文与也为予写西洞庭图赋此以赠 其一
356857,百字令·得少符吴中书，赋此答之，丁亥试灯日也
267643,三姝媚·瞻园约为西山之游，寒阴殢人，屡阻携屐，雪后引眺，赋此代简
423090,锁阳台 蒙安自沪上寄声存问，赋此报?，兼抒近怀。征尘未浣，仆御在门，命笔黯然不自知其言之掩抑也
458538,予分配在岳化，暑假至其地，正肖健所居也。与姑母饭于其家。归车中赋此，记所与共语意也
603017,访张子觉留饮赋此赠之
313488,孔雀今日意特依依暮遂不见度有远行矣赋此送之
683495,用晦宗侯余德甫宪副寄诗贶问兼致先公挽些赋此奉酬
760751,虞笙以题蛱蝶图诗见示，为赋此 其一
444206,麻城龟山赏杜鹃，虽值花期，而仅见寒苞数点，怆然赋此
434504,汉宫春 纯甫生朝，且有弄璋之喜，赋此以贺
795927,凤凰台上忆吹箫 冒四姑将迁别墅，赋此留别
1207624,宝粹二上人值雨留宿西涧草堂明日赋此以赠
298178,扬州慢·盛献三兄以擅古琴知名，因赋此调为赠
704345,得仲弟西越书云有挂冠之兴予亦请告期暮春可聚故园赋此订约
690536,河源陈明府以便面诗见贻赋此奉答
429221,闻君励将西行悢然赋此 其二
545682,与黄山人舜夫别三十年绝不相闻问忽道遇于长安青灯话旧不胜今昔之感即席赋此
271003,临江仙·曹顾庵归自楚中闻余在白门不及晤而去留书为别赋此词奉答
274966,丁丑年住怀远真儒书院构如是住成赋此记之
827122,玉楼春 山梅初绽，适值大雪，赋此索湘弟和二首 其一
289622,庚子秋夕访李莲卿于城西，赋此
619631,朱仪伯来自武林误寻余于铁城不值时予亦以病不得访仪伯赋此为别兼致声乃弟子悬陆与偕徐楚白三子 其二
468028,观新排赣剧《牡丹亭》，曲调多借鉴西乐，舞姿则颇似芭蕾，感而赋此
790841,金溎生同转寄示诗章并以冰泉唱和闰集及陶庐杂忆两卷见赠赋此报之三首 其一
446165,韩国学界为金退庵亡国后隐居不仕之节义征诗限韵，赋此二首以应 其二
400236,齐天乐 客有以咏藕词见示，因用其原调赋此寄怀
454385,报载日本首相参拜靖国神社忆南京大屠杀事感而赋此 其一
383687,谢绎梅中丞过邑赐访不遇题诗驿壁而去赋此寄谢
402860,秋霁 李萼楼别业在吴阊城南醋库巷，招客登临，为赋此解
817349,刘编修殿虎赠余诗己三年矣赋此答之
545447,李本建招集薛馆薛于弧矢最精挟弹尤称绝技是日纵观许为李作长歌赠薛先赋此篇
442956,苏州吕洪宝师傅为吾捏泥像赋此诗赠之
1071588,吕丞相自天台寄示退老堂诗卷赋此二首 其二
538340,师道太史兼直外制赋此寄之
538418,妻叔李六丈下第秋时始归赋此为别因怅然也
478627,闻杨君谦致政赋此以致健羡十五首 其五
454386,报载日本首相参拜靖国神社忆南京大屠杀事感而赋此 其二
751612,购得杨升庵先生雪韵楼画像敬赋此诗
652305,早春大中丞同川李公见访询及陂上旧游处赋此奉简三首 其二
440165,霜叶飞 辛卯秋暮偕京中诸侣访西山黄叶村，传为曹雪芹晚岁著书之所，宁信其实，同赋此调
844565,百花生日次房得孙赋此志喜二首
427787,临江仙 陈市长属徐平羽同志转知博物馆，许我专精撰述，不必随例上班，因用东坡词韵赋此报谢
758004,蝶恋花 小素大嫂有湖上之约，赋此却寄。
709316,为隼儿娶妇承程舍人周量惠以雅什赋此奉答并呈芝五震生
569588,故将李弃官学道垂九十矣而参方不休赋此赠之
828998,奉读冶盦仁兄五十述怀诗赋此谨赠二首
298016,旧舍用木撑持状如牢狱不可居也赋此遣闷
988485,凤栖梧/蝶恋花 其三 会于秋香阁，适令丞有违言，赋此词劝之
715842,张桐尹饷我杭州宫扇赋此答之 其二
251987,王安国先生雅贶墨宝赋此申谢
789577,金缕曲  岁暮怀熊东美袁世浦东美彯缨世胄，为沈氏宅相，年少才俊，与余缔交庾园，分曹赌酒，剪烛传歌，备极文宴之乐，乙卯春省亲，袁浦旋试京兆，鸾翮偶锻，意将入赀，为郎赋此寄之
317877,冒暑出都福赵二同年远送至卢沟桥贳酒作别赋此怀之用前韵
518200,郑居贞自闽归歙往迎母因赋此饯别
578336,黄方伯饶泰政遣人送至常山因赋此以谢之
464571,鹊桥仙·桂林遇鲁若衡，谈湘事有感，赋此
57759,宝粹二上人值两留宿西涧草堂明日赋此以赠
417558,清平乐　已巳初春梦碧后社成立喜而赋此
569100,耿大夫入为司徒领太仓事时余方上书乞骸赋此赠别 其一
430736,吴中旅夜不寐赋此
539155,少泉太仆公谢人间久矣独有喜余迁太仆中丞二律见寄郧中赋此奉酬兼简犹子时厚太仆 其三
404339,满江红·朱仙镇岳庙碑林征稿，为赋此词并书以付之
436329,总管陇西公归自赵城以雪途行役见命赋此以献
605058,吴用潜侍御特起观察苍梧以超和尚为书邮见存赋此寄怀
610657,九日孙建侯贻诗讯余病兼约登高赋此之二首 其二
1218172,癸未春留钱唐巨可大家六月可大殁明年移家临平余将东归因赋此写怀
832393,应天长 庚午秋，谒彊村翁沪上，日坐思悲阁谈词，吴湖帆为图以张之。赋此报湖帆，并索翁和
297942,癸巳除夕为余四十生辰赋此自遣
605114,非水居告成六月七日迎诸君子及诸歌姬同汎赋此代柬 其二
772968,衮于辛卯1891奉檄权台臬道下车伊始即以清理庶狱为务时值生番滋事势将用兵判牍之暇慨然赋此
568967,辰玉应试留都赋此赠之兼赠孟孺 其三
301225,陶苦子村居筑楼同元孝侄闭关秋日过之赋此
1071472,东安许明府同里之亲任满回家求诗为别即席赋此兼简熊使君
601174,元夜命酌终南山水天炼师于海珠信宿赋此 其二
736479,宋中丞牧仲以宋本施注苏诗见惠赋此奉谢
918495,开禧元年四月自中都挈家还乡寓居城南十二月迁居柳溪上其夜大雪初一日盖宰来访约过县斋为一日款深夜而归赋此 其四
605168,甲戌旧郡公韶阶徐公督学以诗币见寄赋此驰谢 其一
650379,甥光烈自蔚州归喜而赋此
522142,吾乡先辈勇退急流者二人宪副定庵先生今八十八宪佥一斋先生今八十四予既数为定翁赋诗而宪佥不及非阙典欤何生行赋此以谢不敏且为他日乡邦故事云
522132,定庵兄孙从哲之官便道还家赋此豫寿
765391,梦中颜余屋曰空意庵醒而赋此
311736,夫人归宁母家，逾期不返，赋此寄之
598046,赵明府以季夏晦日自普宁过访山居因为江舟小酌鼓枻中流是时梧叶未落山意欲秋至夜别去感而赋此
267252,木兰花慢·岁除苦雨，兀坐篝镫，赋此遣怀
787803,宾于将返武康以所携笋蔬麦餈见赠赋此送之 其二
181559,清明前三日将晚风雹大作枕上赋此
250732,畏庵兄四十初度赋此以贺
813171,春日延荔浦寿邀余读书西坪赋此二首
797447,高阳台 年年小池左侧秋海棠盛开，今花时过亦，红苞寂然，赋此寓感
827294,奉读冶盦仁兄五十述怀诗赋此谨赠二首 其二
304628,满江红·逖徐州感赋此阕
426132,承王益初、沈松寿枉顾赋此答谢
454309,迎春花市上见“花之隐逸者”与红桃并放触动情怀归来赋此
411452,幼子梦芙出生，赋此志感
935167,予年十六始识叶晦叔于西湖上后二十七年晦叔之弟声叔来为临邛守相遇于成都晦叔没久矣访其遗文略无在者乃赋此诗
708631,师师令 除庭酴醾栀子盛开凄然赋此
444445,淡黄柳 颖庐远惠江西银毫并赋此调，因念前游，转生怅叹，捡去岁九溪道中所折红叶一片报之，即次其韵
641962,庚午除夕风雨大作因思壬戌岁除在按察司官舍无异今夕瞬息之间已及九载慨今念昔不能无怀遂赋此
707928,万年欢 其二 汪蛟门舍人举子，赋此志喜
589210,陈守备饯古云寺即席赋此
443143,忆少年 莼客北行途中以手机短信问讯赋此寄之
403517,八声甘州 维深砚弟学画于溥王孙心畲，精能之至，称高足弟子。余虽好绘事，愧不若也，阅君画卷并忆北京旧游，赋此奉寄
760733,晓沧惠香米，兼以诗贶，赋此为谢，并送之汀州
832857,三姝媚 瞻园约为西山之游，寒阴殢人，屡阻携屐，雪后引眺，赋此代简
604195,吴孝甫以雨后秋山图并诗见赠赋此奉答
918154,先世藏减笔画马甚精妙因乱失之追悼赋此
815233,甲申游蜀乙酉夏闻亲病遄归感而赋此二首
898861,浣溪沙 其一 过临川席上赋此词
301907,杨文炤寄诗约杭州观梅春深始获成行赋此酬之
423565,阮郎归·大姊惠兰花，赋此谢之
700945,元夜命酌终南山水天炼师于海珠信宿赋此
451957,甲申夏应三江有月之邀赴三峡得与众诗友相识，其后东遨兄三江兄几度来京小聚，日前三江才走，东遨兄又至，赋此以呈
948529,元宵煮浮圆子前辈似未尝赋此坐间成四韵
545446,薛生以七夕初度故小字巧巧又清斋学佛复有素素之称行父拉余过曲中薛持笺索题走笔赋此
827033,鹧鸪天 久闻黄冈十力熊君，今世奇士，任道精勇，无缘会合。昨承贻我近著语要，兼称道拙词，赋此奉谢
250488,行次夷陵梅间竹兄设宴接风予不胜其情竟至大醉醒后赋此为谢兼呈诸友
266064,八一初度陈以光老师惠诗称寿赋此奉谢
1240819,四月四日偕蜀郡袁景文大梁程冲霄益都张翔远云间吕德厚会稽胡时敏汝南殷大章同游钱氏别墅饮于菊亭僧舍赋此书于壁
592387,王仲房以书遣慧光上人订栖霞之约赋此奉答
681093,闻胡司空附郭成新居赋此以寄
1212476,庚申岁夏因六盘之变尝与巴特玛其名者质诸天日约分二道邀击而师颇闻其人为敌谋将遂赋此为食言者之戒
423748,固园主人招饮归途车中赋此却寄并赠南社诸公
825466,爱苍示听松诗因及涛园种松事赋此答之
569723,送傅吴县入觐以善治民闻而山甫子予辈谓其负仙骨精禅理因赋此为饯
222737,叶茂卿寄诗卷赋此以谢之
605946,陈以哲孝廉自武夷山中有作寄怀侑以仙洞茶建溪酒赋此答谢
570880,李宗伯以四绝句慰余请告赋此奉酬且伸后约 其四
1088498,伏读致政少傅相公送赵成都佳句两篇不胜慰幸已次高韵并饯其行而再赋此章以见区区瞻仰之意缮录拜呈伏乞采览 其一
700952,大司农李葵孺先生得请赐乘传归粤赋此以祖其行
823671,清平乐 江翊云先生得兔儿花咏诗，徵题，为赋。此花近年从欧洲传来
774636,东征逾载整棹言归巡使黄玉圃先生索台湾近咏知其留心海国志在经纶非徒广览土风娱词翰已也赋此奉教 其二
812615,过汪北鱼香南斋时，携琴僧墨隐、画史吴冠英，游大小石湾，久待不归，赋此却寄四首
559750,题赏春图为张琳作时盛暑过其家出画索诗赋此以归之
1213776,徐浩然任西京经历考满回京访子于城西寓舍赋此以寄
311308,临江仙·前词良苦，赋此自解
272958,李培生来客榄溪访予病榻赋此赠之
590830,包一山旧同僚擢守葭州遽致仕归赋此致赠
50545,夜归赋此以寄东田隐士
604530,恩诏赐复冠带县大夫雨中携酒赐贺赋此呈谢 其四
444421,霜叶飞 壬申秋杪京华吟聚，与盛元小步龙潭湖，同赋此阕，用梦窗韵
678588,以杜少陵文章憎命达之句析而为韵赋此 其四
427809,临江仙 久不得冼玉清来问，风雨中赋此代简
1212472,饮凤凰山醉仙洞有歌稼轩郑国正应来死鼠叶公原不好真龙瑞鹧鸪者因为赋此
545606,王中叔擢北部归省天台以尺素相闻赋此代饯时永叔乞假里中二首 其一
404968,画堂春·一飞兄以小影属题，为赋此调
849266,开化寺前古木数株叶密阴繁极可爱系舟其下赋此
569729,子厚第三书孤愤之怀极矣男子要自有出世事毋论浮荣即不朽亦第二义也赋此广之 其二
825302,季直之子怡祖十二岁赋登塔诗曰凭栏词客招新月隔岸渔翁唱晚烟季直自作诗曰阿翁十二始为诗今汝追翁欲及之愿汝立身求学问要如登塔最高时又为怡祖请余书扇乃赋此遗之
1172454,近于伊川卜山居将命者画图而至欣然有感聊赋此诗兼寄上浙东元相公大夫使求青田胎化鹤
466634,报载日本首相参拜靖国神社忆南京大屠杀事感而赋此 其二
1236258,至正十一年秋七月巡按松州虎贲分司时山谷寒甚公事绝少明日即还为赋此
783965,闻立亭言梅澥寄书问都中诸友音耗感而赋此
421147,满庭芳 复生归蜀，赋此赠别
1068818,腊前五日立春天气极暄妍今复雨雹凛凛不休所居梅花方盛开一雨零落殆尽怅然为赋此诗
271380,蕙兰芳·湖帆得马守真、薛素素画兰，合装成卷，嘱赋此解
761920,陈迂谷中翰移居狮子岩，斋额曰栖野巢，赋此赠之
542097,刘侍御叔清擢守扶风赋此寄赠
246515,八声甘州·梦旻庵兄觉后追忆梦中情景怆然赋此
465289,渡江云 钟钟山顷来成都，即将有峨眉乌尤之行，茗叙江楼，缅怀西湖旧游，不胜叹怅，赋此以为迎饯
515429,北上过武林再会竹东刘君虽右手痿痹神采胜常酌别之顷因赋此竹东当倚歌而和之舟中把玩如故人之在眉睫也
443594,沁园春  将止酒，赋此谢诸友
51223,夏夜独坐披襟当风颇有秋意赋此寄怀
945844,柳梢青 其一 晚凉到季父处观荷，花心已敛，遂赋此
250484,立春日无稽斋主步予轮值社长韵见贺赋此为谢仍步原韵
180551,十三日再赋二首其一以赞使君是日对花赋此韵
834235,风入松 小园桃李作花，澹红妍白，天然相亚，为赋此解
833492,桂枝香 己亥五月初七夜，寿平招同古微、逊庵观名伶桂凤演《宛城》一剧，赋此赏之
309446,南浦·将去燕台，赋此留别
491213,八月枉希颜王孝廉自大唐别业相见靖安县中辱赠长句甚慰旅怀临别赋此
431895,约同人游吴淞望东海登废垒而赋此（二首）
454664,邵燕祥《当代打油诗丛书弁言》读后赋此自嘲 其四
272952,张君华出示新词高阳台一阕赋此和之
306789,数得纫诗书迟迟未答，顷读近作多章，殷殷垂问，不能自已，赋此报之
288632,水龙吟·十发丈工画石，赋此为赠
22805,路逢有似亡友者恻然赋此
474542,闻汉中兵宪王斯进讨贼有功赋此寄赠
604463,唐明府以驯鹿见贻赋此呈谢
544887,郭方伯以三诗见赠赋此奉答 其一
252355,西江月·新春与东遨茗话遥寄明汉忆当日浏河夜叙忽忽一年又过赋此追怀聊充课业
426359,吴门李西庚先生神交两载，今始识荆，欣喜之馀，赋此见意
540132,吕侍郎自制桑落酒绝佳以一瓿见饷赋此为谢并乞酿方 其一
604759,郑台擢涖郡昭州便道枉驾赋此谢别
780268,虞美人 九月十七日泊嘉兴，时将由枫泾入沪，不经吴门矣，感赋此解
717222,远公贻我莲种赋此答之
314874,八声甘州·溥心畲以所作山水见寄，赋此报之
772135,得徐树人师抚闽信，赋此志喜
638457,癸丑三月十三日刘生玘邀为陈山之游以事不果赋此呈胡伯雍明府二首 其一
292095,参政会中遇陶玄女士询及亡妻赵娴清女士身后情况归来怅惘感赋此篇戊寅
464541,水龙吟 阳叔葆求题尊人悔庵词钞，先经遐庵点定，赋此归之
427878,浣溪沙 入春不得谢啬翁书，赋此寄怀
747218,与徐星伯年丈论江河二源赋此纪之
331101,昌化虽穷寂今岁偶诸处寄酒东船至得北果又老庖自海康来人日与客饮邂逅成醉座中赋此
515238,十一月廿七日送士敬至浦口别后赋此
314024,沁园春·客东亭，夜梦亡姊，枕上赋此
833587,金缕曲 其二 莲溪以鹾台领长沙、宝庆二郡，余误以为常德，遂有“武陵桃花”之句，可笑人也。赋此解嘲
284364,外孙一洪在桐庐忙于双夏工作，赋此勉之
601109,集郭梦菊膳部席上赋此 其一
458044,贺新郎　沙子石子兄极少上网，每一显身，爱其诗者辄为雀跃。近于碰壁书斋贴新作，予草翻一过，即去午食，酒中赋此以赠
607276,钱茂才自浙中来访备述其途次之阻赋此送之
839343,客游十载，竟无可述，年来寄迹虞山，时往来尚湖之滨，途中有感，赋此
536827,参议范君视事三日即出泰安过莱海还赍表而北赋此赠之
678860,吴市居民目予年少笑而赋此
424294,长相思·罗蕉麓杨志青两先生祖饯于温泉山馆，赋此留别
200101,承亲戚见过生朝赋此为谢
790866,予历年避暑祠中，每邀荪湄小住，披襟岸帻相对怡情。今夏移榻来祠而荪湄去秋作古矣，怅赋此诗八首 其二
325704,摸鱼儿·过天香楼，忆同崔格卿旧游，感而赋此
835861,满庭芳 疏花在门，明月满地，秋声飒然，愁绪迸集，因赋此解
295905,十二月五日袁伯夔谭瓶斋集同人为何猿叟作生日赋此兼士瓶斋
286834,巧月初三日，乐平新妇自北漍归，久别重逢喜可知也。会有作小诗调之者，依韵赋此
1212680,尝游北禅院鼓子花特盛邻观且有琵琶音后游其所赋此
66324,董体仁送余至固节旗亭饮别赋此贻之
843497,淡黄柳 筠甫重至韶州赋此为别忆昔五六岁时屡随侍过此今生已矣并以写意
386767,倦寻芳·积雨初晴，春暄极美，独步至绿萝溪上，归赋此词
604883,戊午初度顾邻初太史以文见寿赋此奉谢 其一
951587,林间残雪时落锵然有声赋此
303657,众异既归殊惓惓于江南之游赋此讯之
570118,访吴登不值承见寄三绝句赋此为答 其三
834888,长亭怨慢 江上检旧缄付炬，赋此
424163,满江红·戊寅八月，重庆孔诞大祀，迂叟闻之，为七言律诗一首见示，赋此为和
572867,万二酉老师有垂老之疾惑而赋此万里中老儒余家父子兄弟祖孙皆从之游其人可知 其二
110179,灯夕多为城中之约因赋此篇
1068352,梦秦处度持生绢画山水图来语予此画刘随州诗也君为我作诗书其上梦中赋此诗
542102,吴人郑速季入邺省兄中伯每谈倭寇之乱久而思归赋此以赠三首 其二
311765,赋此志感·缥湘万卷付洪炉
1036026,水龙吟 咏笛材，时太守闾丘公显已致仕，居姑苏。后房懿卿者，甚有才色，因赋此诗
83332,荀秀才送蜡梅十枝奇甚为赋此诗
921459,杨康功有石，状如醉道士，为赋此诗
427837,声声慢 得龚翰青翁书，报家珠以七月二十六日下世，赋此纪哀
426913,盛九万丧其掌珠匡华赋此慰之 其一
605890,客有讥余不出者赋此代答
357379,双双燕·予携度儿来粤节届立秋矣燕子方营巢于寓室之楣怜而赋此
826183,水调歌头·程十发以天台采药图属题，旋即谢世，为追赋此阕
605235,曹能始观察以诗见怀赋此寄谢
459756,八月二十九病起秋来，聊为赋此五首 其二
426805,蜀人王秀峰来客荆园时梅花盛开流连吟赏赋此寄王公子季友兼简黄咏雩五羊
262185,江城梅花引·日内瓦湖畔樱花如海，赋此以状其盛
532303,禾稼在野人有更生之望喜而赋此 其一
566205,顾中舍壬辰之冬直文华殿书显灵宫碑而邸馆有雁集之未几承御笔题衔之宠若先徵焉索赋此咏一首
813698,外子辞昌延榷务归里喜面赋此四首
263356,闻光炯归湖上，赋此寄之
820758,三姝媚 园中紫丁香三株，今春特盛，风晨重对，已半残矣。怅然赋此
338536,醉落魄·外子久客不归，赋此速驾
357383,青玉案·予有醉乡梦境图记或笑之赋此解嘲
98122,三兄既见过喜而赋此
292206,贺新凉·壬申季夏客居邛廨，蕉窗送雨，烦襟洒然，张紫帆枉存，同赋此解
514089,歙北有山曰飞布甚奇山下江氏世居之山旧有主簿庙以结兵禦寇之功而江氏实主其祀今江氏之老曰嗣器其家以殷实徙京师从子韶入为京学生尝及见予予过歙欲访江氏适以疾不果赋此寄之
271324,忆瑶姬·吴湖帆出示隋董美人墓志，为赋此解
958521,清明前三日将晚风雹大作枕上赋此
386025,赋此送别·幸喜年丰话故林
459696,自来云溪，倏已十载，有屋如蜗壳，长戴未离，亦大可感，聊为赋此
697151,郭方伯以三诗见赠赋此奉答
151604,道士号庭梅为赋此
384924,林赐阶邑宰以诗赠行，赋此答谢
521741,陈都阃汝玉以思亲册求题久未有以复也二月君提兵过江赋此为别伫闻捷音把笔以俟 其二
407956,前阅报见满洲里俄人画界交涉，今过安奉铁道，又见人竭力经营，感而赋此
619585,秋夜不寐因念幼度从弟方在远行赋此寄忆并答见寄 其二
380689,乳燕飞·己巳初春，微疴偶作。百感纷来，欹枕无眠，信口赋此
443655,香港李国明兄以墨梅一幅见赠赋此以谢 其二
411536,幼子梦芙英年失学，将随堂侄和炎习工艺，明日拟作潜岳之游，赋此志感 其三
313123,游工部草堂遇王际云刘俊臣二君小饮赋此
833094,浣溪沙 梦坡德配张夫人六十寿，作放生会于西溪，为赋此阕
923754,石盆种菖蒲甚茂忽开八九华或言此华寿祥也远因生日作颂亦为赋此
521563,同年宋良佐巡按得代以书留别赋此寄赠 其六
834255,高阳台 其一 上巳日紫帆同次香、敦甫江岸踏青，赋此调寄余古欢阁，即用原韵答之
624641,李华嶙以尊公乡贤册见示赋此奉赠
1215509,客有语予以卫生之术者其说流于固赋此以赠之
590312,承郭易庵陈守愚邹柏窗邹静轩四老携酒过访话旧乐甚赋此答之
301832,将有陕西之行浩然赋此
587744,丹徒尹聂君同年家侄也再邀游焦山赋此
411467,丁酉夏余应安徽省文史研究馆之聘，寄居岳西县垣，夜不成寐，起读杜工部诗，感而赋此 其四
414405,孔雀今日意特依依暮遂不见度有远行矣赋此送之 其一
428410,贺新郎 己丑牡丹盛时作。予园中牡丹皆从洛阳移来，至今十年，已满园春色矣，因为赋此解
837973,林君献堂率其二子留学东京赋此赠行
443875,蓉城盛会未克前往，谨赋此以贺〈岷峨诗稿〉创刊二十周年
