790812,箧中检得败纸一束，启视则游梁时留存之要牍也。感而赋此二首 其一
958238,有客问予每日何事客退赋此
416694,龙吟曲 箧中得恽七宏庐病榻见怀词若干首，泫然赋此，时距其死已六阅月矣
538547,得河中王丈宪副地震后书云未有出山之耗赋此促之
443705,梦江南 其二 小薇师养病于市八医院，赋此以慰
512912,闻杨君谦致政赋此以致健羡十五首 其十五
443704,梦江南 其一 小薇师养病于市八医院，赋此以慰
297603,庚戌秋冬之际上海检查鼠疫风潮陡起，感而赋此
388234,弟侄俱荐赋此寄之
542584,夏日郑园陪饯皇甫子循别驾同沈禹文参军元仰之给事王元美比部沈子文刘朝宗进士赋此
302028,武林乱后，未得贞壮书，赋此讯之，丙辰小除夕
278173,思佳客·共凤举谈赋此
481101,读医士王立方瘦老子传求歌赋此
585060,久病公事分累同寅赋此谢之
537328,吴人杜惠由小侯弃官归卧好谈玄理余时避地过从甚得赋此赠之 其二
409731,季野之江上，赋此赠别，兼致雪楼、慎登 其一
532398,丙申岁腊访甥杨继宗子熙春读书山中宿留赋此 其一
754476,三弟归自云南其去也过舍辞行赋此送之
774635,东征逾载整棹言归巡使黄玉圃先生索台湾近咏知其留心海国志在经纶非徒广览土风娱词翰已也赋此奉教 其一
444489,浣溪沙 江婴老置酒渔村酒家，相谈甚欢，赋此为谢
451934,杨之有弄瓦之喜赋此为贺
544805,将出都丁元父过访数四且贻诗饯别意甚惓切赋此奉酬
443699,观新排赣剧《牡丹亭》，曲调多借鉴西乐，舞姿则颇似芭蕾，感而赋此 其一
314453,燕归赋此志喜壬戌
784556,乙卯九月九日来游西涧西涧主委客去竟赴千像寺斋遂得孤游竟日戊午夏又至西涧涧主又赴千像寺斋时节顿易而踪迹略同追和前作再赋此诗
444146,凝秋、皎月联袂来访赋此以赠
429381,庭前丁香始开赋此宠之
58020,见源来自越一雨巢松来自吴同过松寥阁赋此示
600592,发雷阳有司供张日侈赋此志愧
424299,虞美人·石父丈为张灵后身，灵鹣师以梦晋长江万里图便面为寿，出以见示，为赋此解
721889,大司马吴公惠田赋此奉答
674013,十一月八日驱车南行客况寥落赋此见志
731032,台城路 寒窗人悄，雨夜灯昏，黯黯离愁，盈盈客思，信笔赋此，以写闷怀
492034,承郭奉奎夜过溪上言北岩杜鹃花盛开手数枝相赠明日赋此为别
768767,疏影 秋分日偕吴梦蕉汪子雨石芷卿筱珊叔祖买舟由古荡至留下秋水空明树阴合匝意甚闲适因赋此解
387142,三姝媚·盛夏小雨骤晴，北池荷花遽开三朵，翠婉红娇，倚风如笑，为赋此词
463904,王安国先生雅贶墨宝赋此申谢
683517,少泉太仆公谢人间久矣独有喜余迁太仆中丞二律见寄郧中赋此奉酬兼简犹子时厚太仆
808920,经行一路，皆地广大而民稀且穷，官斯土者自中原来，对此荒荒，靡不愁郁，期满秩迁去，将终不能富庶也，慨然赋此
308044,江城子·端阳人，牧稀、荩生、约真、钝子携酒肴聚饮于此，赋此志影
294068,鹧鸪天·沈迈士老画师年九十三，以秋宵作画诗见示，赋此为赠
273069,得颙园越南来书赋此奉答
652306,早春大中丞同川李公见访询及陂上旧游处赋此奉简三首 其三
466170,昨宵醉卧卢智晖许，似梦泛舟西湖。揽衣而起，行犹摇曳，更复持杯，席间赋此。即以寄莼鲈兄二首
423278,陈协只丈有遗悲怀之作赋此慰之
511330,景易读书潮连赋此勖之
690547,韩绪仲宗伯卧子舍以神祖实录告成束急还朝计日爰立索诗为赠赋此志喜
250227,蒙仰翁招与诸诗友茗坐并以新茶见赐赋此奉谢
585064,萧汝柔掌教讶无回书赋此见意
511555,张侍御叔亨将赴京遣人告行求赠言不已赋此以答
750766,自庵丈以董香光画卷见赠赋此志谢
465260,解语花 壬午元夜月色为风雨所败，山城寂冷，追忆曩年广州灯市之盛，怅然赋此
325411,余客闽之南靖海水爆发几致淹没感而赋此
791559,左泉先生赐读伴云仙馆，即事诗八首，赋此奉酬 其二
623340,望白云在天忽然有感而赋此
312900,踏莎行·盼浣桐兰州信。既至，惟寥寥数语，嗣觉其跨驼双影，赋此调之
936798,陶渊明云三径就荒松菊犹存盖以菊配松也余读而感之因赋此诗
777928,木兰花慢·赴杭转沪，往视姊，赋此示澄宇，兼辞黄山
311602,愤而赋此·元戎开府说天波
604488,春日鸡足山人和陶元亮归去来辞见访摄病愁霖不得言晤赋此奉谢
790867,予历年避暑祠中，每邀荪湄小住，披襟岸帻相对怡情。今夏移榻来祠而荪湄去秋作古矣，怅赋此诗八首 其三
388098,庚戌秋有约吴峻伯不就赋此
332765,万年欢·汪蛟门舍人举子，赋此志喜
601507,庚辰与郭霞谷黄鸣谷黄寤堂道南康入燕鸣谷上第余就选二丈南归赋此以别
522148,保宁何重器尝通守松江以福建盐课提举致仕其子鉴鏊入太学频辱惠音且存问吾乡故旧甚悉感其雅情赋此奉寄
1223900,刘忠肃公之四世孙中书舍人讳震孙之曾孙益之题其居曰云松巢予家与刘氏累世之契故为书忠肃公文集之首诗三篇并赋此与之
1244631,存中过余山中言及乱时所遭赋此为赠
1248014,喜许孝廉见过赋此以谢
192210,石蒙恩召还以病留滞度岁赋此诗道别呈诸同官
458046,贺新郎　将赴京，思一往长城，为赋此。及至，不果往 其二
807533,念奴娇  客有善丝竹者以笺索词漫为赋此
843236,荫坪叠落花前颌四首索和己未及今十年矣感而赋此 其二
785619,石川鸿齐英偕僧来谒张副使误谓为僧鸿齐作诗自辩余赋此以解嘲
727435,探春·月夜饮荒祠水木明瑟池馆苍凉主人告予曰此邹副使愚谷十二楼址也声伎豪侈今衰歇矣感而赋此
536656,萧懋建户部弃官后游杭以西湖诸长歌见寄赋此为赠
1077862,余来湖外临行与叔易奕而胜得铜炉制作精古爱之常置几案间感物怀人为赋此诗
462400,临江仙　甲申孟冬吴君战垒制临江仙词见贻越三月未遑次答君遽归道山因次韵赋此抑亦痛定之歌哭云
690590,丙子季春邑侯金公偕归善陆侯游罗浮余以瞽目地主不能从侍赋此呈之以见响往
247747,瑞鹤仙·客有以城南梅讯见告赋此答之
581707,弘治乙丑二月宪长入觐予暂署堂事比得代就间戏而赋此
715932,大司马吴公惠田赋此奉答 其二
270839,水龙吟·乙巳除日得家报新置木峪山庄慨然有终老之意而赋此
826659,清平乐·燕台秋冷，曹部一空，薄宦穷途，飘流满目。感赋此解
305260,庭前丁香始开赋此宠之
695270,癸丑三月十三日刘生玘邀为陈山之游以事不果赋此呈胡伯雍明府二首
542390,同乡程子宾丁卯春以广东大参擢山右廉宪及夏仍转广东右方伯戊辰春罢官北归两年之间往复万里殊为可叹赋此寄怀
273478,日本投降世界和平公园开庆祝会感而赋此
544647,江右王孙贞吉以书并画见贻赋此寄谢
453433,长沙席上分韵得恩字，赋此以呈三湘诸友
500106,并州五月中旬雨未沾足而风气萧然与清秋无异感而赋此
520126,杏花盛开喜而赋此
545558,与张仲立顾靖父别且十年馀忽晤于顾山人斋中喜而赋此
441365,水调歌头 将之海上子锋赋此调赠别步韵奉和
251758,醉花阴·乙酉九日晦窗先生嘱赋此调
798097,贺新郎  云郎合卺为赋此词
431674,戊寅正月，予有皋城之行，越五日言归，先妣太夫人已先一日逝世矣，悲痛之余，赋此志念
585003,梁应和许访继芳亭中不果赋此迓之
78135,魔境作颇思远适赋此自遣
559710,次韵鹿干岳《喜从玉壶记忆得周忠介旧寄二诗赋此》
545450,唐从事邀集酒楼观女乐即席赋此送唐之歙中
728471,八归  二月十一夜风月甚佳，过水水绘园听诸郎弦管，灯下因遣家信，凄然不成一字，赋此以寄闺人
793512,外子辞昌延榷务归里喜面赋此四首 其四
494474,答安福乡进士周君得之所问八条后赋此
826221,洞仙歌·余髫年在书斋，汪憬吾丈来，命对，特赏琴韵书声一联。今四十余年，丈怛化澳门，余羁栖香港，遂成永隔。赋此志悼
252313,鹧鸪天·东遨离湘返粤赋此略慰旅途寥寂
606241,康山人以新刻锦囊寄示兼有诗劝驾赋此答之
403301,国香慢 南中百卉杂陈，有移根他植者，念之弥切。辛丑四月廿五日，将去吉隆坡看乌结先夕，赋此
709059,次韵鹿干岳《喜从玉壶记忆得周忠介旧寄二诗赋此》
615843,王总戎镇粤与予未晤比解官归以书见存赋此送之
417271,浣溪沙   熊生清泉除夕来谒送我健身球赋此以酬
604772,八月十四夜得直指虞石王公书贶以还朝束急不果罗浮之游因偕里中诸缙绅攀宴小园赋此候别 其一
937682,十三日再赋二首其一以赞使君是日对花赋此韵诗笔落纵横而郡中修水战之具方大阅于燕公楼下也其一自叙所感忆年十五在杭州始识此花皆三丈高木尝赋诗焉 其二
427914,水调歌头二首·辛丑重阳访周谷城于淮海公寓，放怀高论，莫逆于心，率赋此词，藉倾积愫 其二
512906,闻杨君谦致政赋此以致健羡十五首 其四
834745,琵琶仙 己卯清明，同游古林庵，祭管异之先生同，修竹便娟，池塘一碧，丙子夔州东屯之游正复似之。赋此柬同游，并怀漱泉
834100,无闷 听蛙声，悄然赋此解
288698,好事近·己未孟冬薄游汉上。十发丈招同梅郎饮于寓楼，出示灵岩垂柳图，话石巢旧事，赋此为赠
824374,浣溪沙 寒夜羁旅中，听邻人吹尺八、弹琴，尽成幽怨之音矣，赋此寄意
759275,春第相从有年，去岁复间关渡海随予来粤，今乃请携家归台，并以绢乞诗为永念，怆然赋此
512837,无锡沈宗贵存耕翁之仲子自弱冠侍翁至余家余年十三见先父以诗画赠存耕经四十九年尚存宗贵所观感而赋此
315542,并州五月中旬雨未沾足而风气萧然与清秋无异感而赋此
834209,满江红 残臈二十五日江路冲寒，赋此为蛮天雪印
338126,宾于将返武康以所携笋蔬麦餈见赠赋此送之
465820,八一生朝政协惠赐寿糕赋此感谢
308405,喜迁莺·立春日，得杨铁夫书，喜闻彊村先生起居，赋此寄怀
443700,观新排赣剧《牡丹亭》，曲调多借鉴西乐，舞姿则颇似芭蕾，感而赋此 其二
835383,月下笛 闻叶汝谐谈西湖访友事，怅然赋此。用张玉田赠仇山村韵
544825,长公偶以小恙为余强起卧榻间隐几对谈阅二晨夕迫归告别意殊恋恋再赋此
388161,子与有使事赋此问之
422184,庚子秋夕访李莲卿于城西，赋此四首 其二
569857,临淮彻侯李君知六军事赋此寄贺
837452,金缕曲·奭召南八十初度，刊集告成，见赠，赋此为寿
784277,藏上人寄诗招游西涧以事不果赋此却寄 其三
904967,减字木兰花 客赠梅花一枝，香色奇绝，为赋此词
538154,贼深矣俞生颇有桑梓之恋胡能北哉恐一旦之不戒赋此寄怀凡十二韵
598062,陈守戎得代别予赋此为赠兼致意于乃兄少参君
639562,蝶恋花 小婢寻香，婀娜有致，楚楚如秋棠，可怜年十二而死，怆然哀之赋此
1005842,阪坑头上篮舆烟雨中赋此醒困
672465,汝脩北行约过溧上既闻自京口渡江而去为之怅然及予将至京师喜佳会不远往往形诸梦寐赋此寄之
315001,沁园春·喜获郭鼎堂先生复书，辄用后村梦孚若韵赋此代简
515246,成化壬寅冒雪至大畈今兹之来雪有加而兴不孤夜谈及山阴故事因赋此赠诸眷长
263338,光炯避难蜀中，闻有峨嵋之行，赋此奉怀
400070,东风第一枝 小黄山馆寒梅著花，约黄咏雩各赋此调并呈主人马武仲
427743,破阵子 一九五○年一月，真儿将随二野军政大学入川，赋此送行
687945,杨孝廉明度出宰宣平，其昆玉江度旻度送至官舍，归途遍历西湖、天台诸胜，辄有题咏，出以示予，赋此以致欣赏之意，因寄宣平明府
833938,疏影 昵鶄廔主家在虞山，尝与泛舟尚湖，招凉度夕，时水空天远，星晚月初，湖风吹衣，山翠倒影，夜色中光景奇绝，既泊舟中流，乃弛衣敷簟，并枕鹢首而卧，飞星掠鬓，斜河映胸，共道欢爱则言笑晏晏，相怜同病则悽然俯仰，自以为逢伯陵季荝以来无此乐也。聊赋此调，以追旧欢
266612,虞美人·雨后怀秀崧，赋此寄之
501189,予别黄岩十又六年谫焉德薄父老当不复记然区区常往来于怀也如晦上人来见语亹亹不能休别又依依不忍释予不知何也赋此以赠
459757,八月二十九病起秋来，聊为赋此五首 其三
1036235,鹧鸪天 陈公密出侍儿素娘歌紫玉箫曲，劝老人酒。老人饮尽，为赋此词
457913,石人兄读予《荷塘集》，得一奇梦，梦曰：大夜弥天，唯荷塘恍有黑光。荷盖大可覆人，予趺坐盖底，胸以下皆没乎水。石人谓碰壁已亡，此必其魂也。有顷，亦下入水，与予并坐荷下，隔梗而顾之。时巨雨如泻，荷盖震颤不已。久之，拉予返，而予冷然不理。石人归，及岸回首，见予趺坐如故，乃为之泣下。予故为赋此 其二
544146,醉卧赵文学榻上蘧然甚适觉赋此章
840968,辛未三月于旧基筑室数楹落成赋此四首 其一
901123,曾希曾见示近作赋此赠之
508560,十六日与学士钱公亚卿章公会饮于崔都阃宅赋此以谢
282705,贺新郎·乙亥春宋词来饮 畅叙甚欢 次日赋此寄赠
775673,壬辰1832春来澎办赈务临行赋此为蒋怿庵刺史志别 其一
556296,家居喜袁芳洲相过赋此为赠三首 其二
378535,会师胡卢而笑曰独无语以饯我乎因赋此
833144,大酺 夏夜雨中读竹山《虞美人》词，悢然有身世之感，赋此寄一二故人
978918,张若虚乃予妻党汤德翁外孙喜其来赋此
532411,二府少峰江先生同令弟章山哭其季方文厓上舍得诗二首示及索和赋此 其一
452300,辛卯五月既寄望，何言兄招饮，盖大董烤鸭店主人欲与诗人相识，特置酒请何言兄代邀，菜肴极尽精致，且配以诗词佳句，颇有风雅之意。适逢新疆星汉、广州东遨、西安田茂来京，与伯元、力夫、新河在附近酒店雅聚，不断来电相招，只得中途移席，赋此自嘲
452204,己丑仲冬予作粤闽之游归来见诸友悼诗方知西溪病夫已然下世感而赋此
306033,胡侍禦殁三年重访退庐，感怆赋此
1242696,岁除日，同廖如川至太尉丞相府，留坐说周易，因赐酒并官历，赋此上谢
703919,刘觐国观察斋捧便道归省佘买舟相访追欢数日值束装还治匆匆分袂赋此为别
829049,玉楼春 山梅初绽，适值大雪，赋此索湘弟和二首
432167,将之皖，与都门诸友话别江亭，赋此以赠
805494,翠楼吟 胡城东六安舟次得绝句四章，风格清绝，友人为写其意，余赋此词
313399,鹊踏枝·避寇归国小住黔中花溪听雨赋此
651895,过沅州见故乡父老从戎者与道家乡事多有识先人者因赋此
600914,春日李维任舟中召饮不至赋此赠之
444464,如此江山 丁丑秋暮萍影词史自蜀中见过，重话鸿雪前事，不胜喟叹，赋此兼为饯别
447471,牛魔王火锅主人邀饮，赋此志谢
453636,徐绚老友读予仰斋存稿见怀赋此答之
556432,秋日书客童君见过赋此为赠
443694,颖庐远惠瑶华，赋此以报
186461,清明后七日与客同为水东之游翌朝赋此
694941,筠台戴郡公枉驾敝庐赋此为别
844823,冯逆犯阙，缶老来书云：聋有所闻，歌以代哭，赋此答之二首
263333,季野之江上，赋此赠别，兼致雪楼、慎登
55796,周国雍参藩寄红罽衣赋此为谢
466370,贺新郎　将赴京，思一往长城，为赋此。及至，不果往
1064249,钱济明作轩于古井旁名冰华赋此
709358,道经江门登舟访万明府时省秋郊外赋此寄之
427118,锁窗寒 读水云楼词，有感鹿潭晚岁事，赋此吊之
447496,夜读先父遗笔痛不能已挥泪赋此
542682,李鸿胪仲白归自成都赋此慰怀
356734,换巢鸾凤·恭甫移家秦淮，赋此柬之
585017,责子赋此自解
402765,高阳台 周氏今觉庵新得石刻美人，招客宴赏，为赋此解
820021,小犬杏儿，燕产也，金发被体，状颇可爱，余去沪时赠诸尺五楼主，昨得来书，谓因病物化，已瘗之荒郊，为怅惘累日，赋此答之
676236,许摄泉见过山中失迓赋此解嘲
186829,汤总管邢监庙约游城东酒间求诗为赋此
1092094,汪节夫解官东归赋此赠行
250412,山行至涵星池畔天气突变怪像叠出赋此以记
900396,帐干周君桂林相从之旧己亥莫春出岭迂道相过临别求予言姑赋此
898155,寒食后数日方持斋诵经而东园游人甚盛因而赋此
665624,雁宕读壁间诗侯希召云此陈准卿之作也昔与准卿为月夜游仰观天柱诸峰岌岌如坠发狂大叫自以为奇观今兹已矣相顾欷歔赋此酹之
570467,鳦先以书自通于屠青浦有国士之遇赋此赠之
424290,双调望江南·西螺廖菊友君午夜招饮徵歌，醉归赋此谢之
833878,八六子 秦淮雪后，一碧成冰，万影都销，凄然赋此
453762,一剪梅 唤云辑多幅月影月饼图片遥贺中秋赋此为谢
782601,读任东涧史论呓林等作赋此赠之并示同学
430130,季鸾以其尊人百年忌日归里表墓为赋此诗
693147,闻杨君谦致政赋此以致健羡十五首
559712,次韵鹿干岳《喜从玉壶记忆得周忠介旧寄二诗赋此》
312483,浣溪沙·熊生清泉除夕来谒送我健身球赋此以酬
411446,阔别宜城，瞬经八载，江山依旧，人物全非，赋此抒感 其二
1029434,入京道中风雨因赋此遂退休
813603,藏上人寄诗招游西涧以事不果赋此却寄
452083,谒宗羽嵓先生并蒙先生手书诗稿见赠赋此以寄
843431,月上海棠 游极乐寺看海棠花开且落矣为赋此解
561647,符子太仆出守韶郡赋此以赠符子昔尝作倅于韶也 其二
444010,丁亥中秋前一日，漫步青山湖畔，时正挖湖底隧道，水全抽干，怅然赋此
806830,采桑子 吴门遇徐松之问我新词赋此以答
604885,郑松门太史以诗送其里人纪贞石司训归善并以见怀赋此附谢
705797,维扬宗梅岑寄余诗扇赋此寄谢
772963,台南洋药充斥奸商漏私动与海关相龃龉判牍后慨然赋此
515112,庚戌元日县中随例望阙行礼因思旧岁是日方在清化寺守冻感时抚躬率然赋此
958350,广南食槟榔先嚼蚬灰蒌藤叶津遇灰藤则浊吐出一口然后槟榔继进所吐津到地如血唇齿颊舌皆红初见甚骇而土人自若无贵贱老幼男女行坐咀嚼谓非此亦无以通殷勤焉于风俗珍贵凡姻亲之结好宾客之款集包苴之请托非此亦无以通殷勤焉余始至或劝食之槟榔未入口而灰汁藤浆隘其咽嗽濯踰时未能清赋此长韵
547759,谢绎梅中丞过邑赐访不遇题诗驿壁而去赋此寄谢
759739,沈艾孙为刻石章三，赋此为谢二首 其二
452868,平湖陆维钊书画院张某索书虎字赋此报之
781409,予既别永安山中，间道走汀州，路阻不前。诸友有招予还者，兼和鄙韵见寄。赋此志谢
646505,见源来自越一雨巢松来自吴同过松寥阁赋此示之
464557,齐天乐 重至甲山村，毅吾索赠言，爰为赋此
539034,沈嘉则之楚不遂复有中原之游赋此壮之
512905,闻杨君谦致政赋此以致健羡十五首 其三
536915,夕梦数恶赋此自解
538702,肖甫自江北移滇臬走使以诗见问赋此奉答
283670,渡江云·读青梅馆诗词稿有怀曩日里中文酒之欢，依声赋此，感不绝心
655573,枕上默诵中庸稍悟一书大旨喜而赋此
813147,予历年避暑祠中，每邀荪湄小住，披襟岸帻相对怡情。今夏移榻来祠而荪湄去秋作古矣，怅赋此诗八首
188091,林间残雪时落锵然有声赋此
333091,四和香·黄三出所藏元刊文信国集杜诗属题盖囗中作也感而赋此
411367,近遭兵燹，失镶玉宝鼎一座，正深惋惜，忽于旧书麓中得古墨双团，阳面篆书：“双凤玦”三字，阴面刻双凤齐飞，其缘镌：“天启元年程大约藏”，审知为四百年前物，至为可宝，爰赋此七律二章以志之 其一
427960,水调歌头 一九六三年三月十五日，仲弘元帅作国际形势报告。十九日，召集座谈国际形势问题，与会者约四十人，赋此志感
759738,沈艾孙为刻石章三，赋此为谢二首 其一
416283,寿楼春 观演《湘真阁》南剧，仲清、九珠叔各赋此解，余亦继声
1223789,罗朋友道擢高科拜官还崇仁赋此为别
832997,水调歌头 壬戌七月十六日甘翰臣招同王息存、王病山、况夔笙、潘饼庵、劳敬修及令弟璧生、子季、闰生非园秋禊，赋此纪事
690467,荆璞岩大父暂还云阳便道入罗浮时余暴病不获赴别幸云阳文学江孟辰过访小园赋此寄怀
291459,琴调相思引·闾门外听歌赋此
277352,高阳台·冰如导游西湖赋此
833021,金缕曲 其二 芸巢病起，赋此柬之
404131,瑶花慢·番禺坑头村，有晋松一株，乃陈将军元德避刘宋乱，南来所植，近已枯槁。慈溪访之，赋此索和。因继声以答其岁寒之契云
411464,丁酉夏余应安徽省文史研究馆之聘，寄居岳西县垣，夜不成寐，起读杜工部诗，感而赋此 其一
553855,五月一日钦蒙赐扇上有古人嘉言皆当今名翰伏读之馀喜而赋此
569743,肖甫兄治浙师功成召拜御史大夫行左司马事道过吴门轻舟入访弇中赋此赠别得二章 其一
429278,瘿公若海约游西山期而未往瘿有诗见及赋此谢之并书所闻 其一
556190,宪副饶湖田见过陈渡草堂赋此为赠
488140,社中诸子访我海上赋此
454332,除夕夜深、知命年来、梅酒争春，醺然赋此 其二
533169,得仲弟西越书云有挂冠之兴予亦请告期暮春可聚故园赋此订约 其一
542039,李子田有事代州闻敌犯羊防口憣然归县赋此寄怀
978355,表兄王俊夫客当涂以古诗见寄赋此奉谢
356828,高阳台·甲戌中冬，予有夔州之役。漱泉送予江上，赋此别之
675019,见李介庵卷因念其为人赋此诗
1222348,湘中后怨至元十八年岁辛巳冬十月按事顺德晨起灯下读沈下贤文集偶赋此或云郑即子春也
431385,念奴娇 正值中日和平友好条约签订之际，喜得波多野太郎教授来书，赋此答之
338875,西子妆·雨中坐放鹤亭眺湖光山色感而赋此
900561,张子真杨政光吴德夫追路湘源赋此以别
287283,金缕曲·戊寅上巳，寂坐空斋，枨触旧游，叠去年社园修禊韵，赋此志慨
281205,赋此寄赠·洞天月出饮流霞
568966,辰玉应试留都赋此赠之兼赠孟孺 其二
539045,陆叔原楚生兄弟自江右归携德甫用晦书见存且剧谈二君相遇之厚赋此寄之
426782,江上阻雾遇潘顾西写示忆湘江旧作纵横今古涕泪泗交集赋此以广其意
456540,踏莎行 阳历七月二十二日邱宜钢自广西河池来电，言及目下不慊，而谓余多乐。因赋此调
538729,王太史与余奕负余锦文笺余负一诗扇赋此促之
418697,鹧鸪天 屏兄寄红叶来，赋此为酬
427987,满江红 一九**年三月一日，陈仲弘元帅陪同周恩来总理由锡兰飞返昆明，赋此致敬
444391,解连环 雪日得新河书，谓近小驻临潼，所居去华清池百馀步，赋此阕寄之，用玉田韵
569590,子厚宗侯贻书及诗见赠赋此奉答
738300,归愚述都门李穆堂侍郎话吴中故交殷勤见讯赋此志感
57834,吊刘竹东后赋此
569298,黄玄甫国士也数困公车以其业来质赋此期之
976311,潮阳尉郑太玉梦至泉侧饮之甚甘明日得之东山上作梦泉记令余作诗为赋此篇
429220,闻君励将西行悢然赋此 其一
679927,永乐甲辰之秋岳阳方豸史佺按辔赤水偶得一联云云生石洞重阴合雨过峰峦积翠深索余足之因而赋此
57216,董山人来白田为寄高季迪诗赋此赠别
418752,踏莎行 与安波夜谈，赋此
570498,赵仁甫孝廉来乞其父墓文留山园少时赋此志别 其一
790872,予历年避暑祠中，每邀荪湄小住，披襟岸帻相对怡情。今夏移榻来祠而荪湄去秋作古矣，怅赋此诗八首 其八
515339,八月六日至南山怅然兴怀因就葺整书册赋此
251885,惊闻江南雨兄尊人辞世赋此以悼
1071345,吴傅朋以王逸少遗意作游丝之书古今所无恨未之见也为赋此诗
868508,柯君振相别三十馀年为言亲丧不能举请赋此诗庶几有哀之者
452510,鹧鸪天 新河次日一早作别赋此作别
707608,沁园春　　赠柳敬亭  丁酉小春，海棠与水仙并开，王廉州为予写秋林图，初成，因取瓶花作供，辄赋此词
605012,韩绪仲宗伯卧子舍以神祖实录告成束急还朝计日爰立索诗为赠赋此志喜 其一
411526,七月十三日为先妣九十七岁冥诞，赋此志痛 其一
492991,往时杨清溪为乡先达菊存陈公作种菊图工妙逼真去之六十馀年其五世孙继先乃得之于其仲父有实家盖其家故物也出以示余因题其后以致景仰之意 其十九 同子瑗梁徵士上圯入小庄投宿下郛周氏草房赋此奉柬
766338,喜迁莺 其四 陶凫芗同年为觅教场胡同宅丁香二株可爱，急欲移居而不得，赋此解嘲
754077,怀藻姊书来询近况赋此代柬 其二
315070,木兰花慢·获闻毅成溘逝，用乐章体赋此悼之
633590,扫先师翁塔大雨赋此
820689,西河 重入都门，景物异昔，沧桑之变，乃复如斯，怆然赋此，用清真韵
