547129,大伾山亭图歌为朱令君赋
561822,海天春晓图歌为桂翁作
712614,罗浮山水图歌为陈岱清司李
491696,题青阳行乐图歌为黄允中赋别
491616,题云山图歌为武山胡炼师赋
54555,题边长文所画山水图歌为常伯敬赋
491582,题边长文所画山水图歌为常伯敬赋
286578,湘雨楼图歌为张语山观察祖同世丈赋
564788,汉宫春晓图歌为克斋司徒题
47511,潜溪图歌为宋景濂赋
595444,中流自在图歌为谭次川年兄题
505160,题湖山春翠图歌为倪晋明作
740129,盘山图歌为吴颖庵少京兆作
532910,西王母图歌为陈侍御道帙母太夫人寿
651130,山水图歌为蒲守徐孚题
553572,万木图歌为杨庶子荣勉仁
593290,华山睡图歌为黎惟敬赋
505161,题琵琶云气图歌为张彦弘作
505172,题董北苑秋江待渡图歌为汪大椿赋
556097,双寿图歌为叚翁作
679559,寿图歌为任柏溪举人铠赋
537042,汾阳王单骑见番图歌为郭都督作
557925,松石图歌为绣衣孟仁
505170,题松阴授道图歌为王景山赋
1240197,潜溪图歌为宋景濂赋
730883,湘雨楼图歌为张语山观察祖同世丈赋
562691,乐寿图歌为潘百朋寿
