609289,清明日公干过谈郊游
306342,五月十三日公雨招饮张忠武别业有诗次和
1050723,日公绿萝庵
580209,弘治庚戌岁十月十日公事稍暇奉邀大参德馨内翰世赏过行台小酌遂相与联句仍用内翰韵得二首别赓韵一首 其一
83336,旬日公事颇简喜而有赋
306329,次韵愔仲五月十三日公雨酒座感赋
580211,弘治庚戌岁十月十日公事稍暇奉邀大参德馨内翰世赏过行台小酌遂相与联句仍用内翰韵得二首别赓韵一首 其三
843057,五月十三日公雨招饮张忠武别业有诗次和
785834,乙未二月二十七日公祭沈文肃公祠
315328,夏日公馀·三边无警静烽烟
453906,立冬日公园闲步
139417,再辱九日和章连日公冗失于奉赓今日大阅偶于
274720,九日公㦷招游祖家园同芝麓先辈石臞阮亭玉随玉虬赋
540740,都城冬日公出同杨东川寅丈宿僧舍二首 其一
167709,公退曝日·公退无营懒读书
492618,公文契尚书由参政山西入拜礼部而予以侍郎起于家同日拜命赴南宫今承恩致仕又适同日公文有别业在溧阳予将南还泰和于别也不能以无词焉因赋二律诗为赠 其一
310896,满庭芳·九日公宴唐宅
161319,五日公宴
1246074,正月一日公宴分韵得恩字
515685,五月十二日公署后园偶步
688356,弘治庚戌岁十月十日公事稍暇奉邀大参德馨内翰世赏过行台小酌遂相与联句仍用内翰韵得二首别赓韵一首
1207831,八月十五日公堂宴别作
580210,弘治庚戌岁十月十日公事稍暇奉邀大参德馨内翰世赏过行台小酌遂相与联句仍用内翰韵得二首别赓韵一首 其二
843035,次韵愔仲五月十三日公雨酒座感赋
132957,和陈正已九日公安道中韵
492619,公文契尚书由参政山西入拜礼部而予以侍郎起于家同日拜命赴南宫今承恩致仕又适同日公文有别业在溧阳予将南还泰和于别也不能以无词焉因赋二律诗为赠 其二
606050,夏日公出便过江氏园亭
419921,满庭芳 九日公宴唐宅
348100,日公绿萝庵
540741,都城冬日公出同杨东川寅丈宿僧舍二首 其二
931514,旬日公事颇简喜而有赋
975355,和陈正己九日公安道中韵
500104,夏日公馀
687019,公文契尚书由参政山西入拜礼部而予以侍郎起于家同日拜命赴南宫今承恩致仕又适同日公文有别业在溧阳予将南还泰和于别也不能以无词焉因赋二律诗为赠
889018,再辱九日和章连日公冗失于奉赓今日大阅偶于马上得之兼简是日座客
993481,五日公宴
733679,九日公㦷招游祖家园同芝麓先辈石臞阮亭玉随玉虬赋
697990,都城冬日公出同杨东川寅丈宿僧舍二首
