1236793,送陈从事归江东二首
432655,题陈从周教授园林谈二首
547294,京口赠陈从训文学
593400,寺居病起酬京口陈从训过访
596969,晚泊江口别业兼答陈从事
544457,送王文学还武昌时以陈从训书至
65223,立秋日忆陈从训将至燕都
1208130,送陈从事归江东二首 其二
546261,憩陈从训湘竹榻戏题
594398,中秋郭次父陆华甫周文美陆无从胡伯昂何长卿李季常安茂卿陈从训黄白仲陈季迪梅季豹过集得长字
548854,逐妇行送陈从龙侍御
1208129,送陈从事归江东二首 其一
593682,初秋雨中同黎惟敬秘书刘仲修观察李袭美明府蒋少翼吴仲周滕晋生李惟仕朱汝修陈从训六徵士集李临淮惟寅宅得卮字
533338,送陈从训还丹徒
273892,小重山·为陈从周画山水
547068,春日寄陈从训
414540,题陈从周教授园林谈二首 其一
403976,金缕曲·梓翁陈从周郁文先生，八岁失怙，今春返祖籍绍兴道墟社甫故里，获其尊人《清荣公哀启》残册。珍同家乘，加以装帧后，由令亲蒋雨田先生为作长跋，属不才题咏，感赋此阕
569252,至京口承陈从训相送丹阳道中留赠
383029,游甘露寺绝顶望金焦二山作示邬汝翼陈从训
414541,题陈从周教授园林谈二首 其二
547688,游甘露寺绝顶望金焦二山作示邬汝翼陈从训
569020,赠别陈从训时余且入山矣
594723,答京口陈从训见寄
280243,题陈从周教授园林谈
821421,小重山 为陈从周画山水
551868,同谢于楚袁小脩汪肇邵詹淑正李季宣陈从训集谢在杭席上赠伎
473969,立秋日忆陈从训将至燕都
382638,京口赠陈从训文学
