504210,江夏奚瑛以进士出宰武城其兄瑄作鹄山秋思图寄之索题为赋绝句一首
783008,廷璋儿以武举效力京营千总秉瑛侄以进士试用户部主事数年资其薄俸以供饘粥今二子前后归班候选生路遂绝赋此见志且励二子固贫之志不可不坚也
978864,王才谅自行朝归以进士题名示予怆然有感
929249,绍兴癸亥余以进士来临安年十九明年上元从舅光州通守唐公仲俊招观灯后六十年嘉泰壬戌被命起造朝明年癸亥复见灯夕游人之盛感叹有作
828674,闻近日求人书者以进士为贵戏作一绝
79798,绍兴癸亥余以进士来临安年十九明年上元从舅
257172,贾佐之以进士充军被挞
536667,嘉靖丁未夏四月余以进士隶大理得左寺凡九人朝夕甚乐也又明年六月则八人者以次授去独予在晨候大吏升揖散步空馆顾影凄然为赋一章
304209,闻近日求人书者以进士为贵戏作一绝
1216359,儒有萨氏子者家无田囊无储始以进士入官为京口录事长行南台辟为掾继而御史台奏为燕廉访架阁官岁馀迁知闽海廉访事又岁馀诏进河北廉访经历皆奉其母以行其禄养也后至元三年八月望舟泊延平津上是夕星河粲然天无翳云月色如白日溪潺潺如乐奏四山环抱如拱如立如侍左右如奔走执事者萨子奉母船上与其妇具酒殽盘馔奉觞继而若妹妹之婿若仆若婢次而进和而不亵谨而怡怡月光荡酒而溪韵杂语笑母叹息舟人醉歌亦相与鼓枻作南歌为乐今夕何夕不知其异乡
1069757,送光上人还湖南光丞相吴元忠之母弟旧名惇字元常以进士入官已而弃家祝发云
199745,王才谅自行朝归以进士题名示予怆然有感
435514,贾佐之以进士充军被挞
928280,丫头岩见周洪道以进士入都日题字
1041377,李觏以太学助教召曾巩以进士及第归俱会郡下素闻两人之贤留饮涵虚阁
83333,丫头岩见周洪道以进士入都日题字
534499,重阳后九日过赵特峰庭菊盛开主人索酒于周迹山主政迟酌不至时赵以进士乞教授因戏呈兼简迹山
