1115811,梦亡友黄世永梦中犹喜谈佛既觉感念不已因和梦李白韵以记焉二首
946538,甲子岁除一夕梦与先子论诗有云未能免俗犹听谶无计为生只送穷此吾顷年诗也汝亦得之否某曰已在家集中既觉泣书二章 其一
1052051,自北归夜梦侍亲闱久之既觉感而成诗
80165,梦游山寺焚香煮茗甚适既觉怅然以诗记之
145234,春夜梦中得观与心为度身将世作仇一联既觉而
555945,夜梦一人戴无翅纱帽谓诸葛孔明也予揖而就之谓予曰尘世富贵何足道哉唯唯既觉漏四鼓矣以诗纪其事丁未夏六月十四日也 其三
936686,病足昼卧梦中谵谆乃诵尚书也既觉口占绝句二首 其二
934974,十月二十六日夜梦行南郑道中既觉恍然揽笔作此诗时且五鼓矣
1010199,春夜梦中得观与心为度身将世作仇一联既觉而足成四韵寄修观者
931285,甲子岁十月二十四日夜半梦遇故人于山水间饮酒赋诗既觉仅能记一二乃追补之二首 其一
931287,甲午十一月十三夜梦右臂踊出一小剑长八九寸有光既觉犹微痛也
590369,庚戌秋夜梦与甘泉先生讲有道者心无老少之异一句反覆不辍既觉是梦复梦诗云
1066235,乙巳八月二十九日宿内府梦过村落循溪而行问路旁人家此云何曰士村也涉溪入山崦谓同行曰此可赋诗因得鸠燕二句既觉足之以为异日之观
922189,十一月九日，夜梦与人论神仙道术，因作一诗八句。既觉，颇记其语，录呈子由弟。后四句不甚明了，今足成之耳
1117774,甲子岁十月二十四日夜半梦遇故人于山水间饮酒赋诗既觉仅能记一二乃追补之二首
980615,洛川驿中梦与一故人作诗十馀韵既觉惟记其两句南山络条华四顾吃所哀因识之
930367,丁巳正月二日鸡初鸣梦至一山寺名凤山其尤胜处曰咮轩予为赋诗既觉不遗一字
936685,病足昼卧梦中谵谆乃诵尚书也既觉口占绝句二首 其一
146747,梦呈乐轩先生既觉不失一字录
1005118,二十五日晚西窗坐睡梦美人出纨扇索题为题一绝既觉则童子已明烛矣忘其上三句足成此篇
308402,三姝媚·午窗假寐，姬人为供给红梅枝，既觉始见之
1050576,梦游金山作四韵既觉止记一联因足成之
1005542,春日与正仲坐山斋余隐几就睡既觉而正仲端坐诵书未已此意似更胜渊明卿且去之语也
934094,梦中江行过乡豪家赋诗二首既觉犹历历能记也 其一
1241850,十月十一日夜梦中赋诗一首既觉忘前四句枕上足成之
80192,梦宴客大楼上命笔作诗既觉续成之
649232,夜梦与故冕庵胡公泛舟自鸥江至鹭洲对酒联诗公起首句余续第二第三句公续第四第五句余复续第六第七句公结末句既觉而忘第五至第七三句怆然怀旧因补之如左
92814,梦亡友黄世永梦中犹喜谈佛既觉感念不巳因和
928909,余往与宇文叔介同客山南今年叔介客死临安十月十一日夜忽梦相从取架上书共读如平生读未竟忽辞去留之不可曰欲归校药方既觉泫然不能已因赋此诗
928252,十月二十八日夜鸡初鸣时梦与数女仙遇其一作诗示予颇哀怨如人间语惟末句稍异予戏之曰若无此句不可为神仙矣其一从傍戒曰汝当勿忘此规作诗者甚有愧色予颇悔之既觉赋两绝句以解嘲 其一
81730,十月二十六日夜梦行南郑道中既觉恍然揽笔作
516055,讳日梦见先考音容如昨既觉不胜悲感而作
928253,十月二十八日夜鸡初鸣时梦与数女仙遇其一作诗示予颇哀怨如人间语惟末句稍异予戏之曰若无此句不可为神仙矣其一从傍戒曰汝当勿忘此规作诗者甚有愧色予颇悔之既觉赋两绝句以解嘲 其二
347994,梦游金山作四韵既觉止记一联因足成之
354885,自北归夜梦侍亲闱久之既觉感而成诗
555943,夜梦一人戴无翅纱帽谓诸葛孔明也予揖而就之谓予曰尘世富贵何足道哉唯唯既觉漏四鼓矣以诗纪其事丁未夏六月十四日也 其一
933156,春晚坐睡忽梦泛舟饮酒乐甚既觉怅然有赋
910177,甲辰正月二十三日夕壬申梦坐一江楼上见雪月辉映汀洲高下澄流金碧林野疏迥景物清华绝非人间世所有因赋数诗既觉止记一首
1228216,夜梦老人身长而峨冠自称住钓台仆意其为严子陵居旁者曰此朱元晦也梦中作诗遗之既觉犹能成诵
1118385,十月二十八日夜鸡初鸣时梦与数女仙遇其一作诗示予颇哀怨如人间语惟末句稍异予戏之曰若无此句不可为神仙矣其一从傍戒曰汝当勿忘此规作诗者甚有愧色予颇悔之既觉赋两绝句以解嘲
834805,浣溪沙 戊戌人日，梦与礼卿及二客斗诗牌，予得句云：芳草碧沾游子屐，夕阳红到小姑祠。既觉，乃续成此解纪之
1010428,山房假寐梦有一客抱琴奏曲而去既觉诗以记之
928227,九月十四日夜鸡初鸣梦一故人相语曰我为莲华博士盖镜湖新置官也我且去矣君能暂为之乎月得酒千壶亦不恶也既觉惘然作绝句记之
149350,骆川驿中梦与一故人作诗十余韵既觉唯记其两
1117827,梦中江行过乡豪家赋诗二首既觉犹历历能记也
964450,希文枕边谈诗谓律诗易工梦中与之辩诗以折其非既觉忘数字因足成之
1073994,奉祠朝日饮卯酒就寝既觉庭中萧然已无行迹马上赋诗
880754,梦呈乐轩先生既觉不失一字录呈竹溪玉堂
692923,夜梦一人戴无翅纱帽谓诸葛孔明也予揖而就之谓予曰尘世富贵何足道哉唯唯既觉漏四鼓矣以诗纪其事丁未夏六月十四日也
917454,九月二十一夜梦至乱山丛石间出憩道傍拂石坐古榕下仰视木杪萝蔓凌空兴欲蜚举既觉哦成古篇
946537,甲子岁除一夕梦与先子论诗有云未能免俗犹听谶无计为生只送穷此吾顷年诗也汝亦得之否某曰已在家集中既觉泣书二章 其二
555946,夜梦一人戴无翅纱帽谓诸葛孔明也予揖而就之谓予曰尘世富贵何足道哉唯唯既觉漏四鼓矣以诗纪其事丁未夏六月十四日也 其四
78613,昼寝梦一客相过若有旧者夷粹可爱既觉作绝句
854147,梦有饟予宝器一奁者曰僧某甲入寂奉以别也一念不敢受当与善知识作供耳顾视僧在傍恢然伟岸与之揖甚野划然笑曰我不管也因墨格上笔书云老藤一枝孤云万里如是我闻我闻如是放笔趺坐而逝既觉因作偈言焉知僧非异人与予宿有缘契庶几闻之
887573,夜游宫 其一 竹窗听雨，坐久隐几就睡，既觉，见水仙娟娟于灯影中
915731,梦亡友黄世永梦中犹喜谈佛既觉感念不已因和梦李白韵以记焉二首 其二
954215,清明前一日韩子华以靖节斜川诗见招游李园既归遂苦风雨三日不能出穷坐一室家人辈倒残壶得酒数杯泥深道路无人行去市又远索于筐筥得枯鱼乾虾数种彊饮疾醉昏然便寐既觉索然因书所见奉呈圣俞
915732,梦亡友黄世永梦中犹喜谈佛既觉感念不已因和梦李白韵以记焉二首 其一
1120136,甲子岁除一夕梦与先子论诗有云未能免俗犹听谶无计为生只送穷此吾顷年诗也汝亦得之否某曰已在家集中既觉泣书二章
1057939,梦与舍弟登灵泉步趋如无疾既觉感而赋诗用王介甫韵
1118451,病足昼卧梦中谵谆乃诵尚书也既觉口占绝句二首
931284,甲子岁十月二十四日夜半梦遇故人于山水间饮酒赋诗既觉仅能记一二乃追补之二首 其二
934117,梦游山寺焚香煮茗甚适既觉怅然以诗记之
555944,夜梦一人戴无翅纱帽谓诸葛孔明也予揖而就之谓予曰尘世富贵何足道哉唯唯既觉漏四鼓矣以诗纪其事丁未夏六月十四日也 其二
78164,梦韩无咎如在京口时既觉枕上作
157703,春日与正仲坐山斋余隐几就睡既觉而正仲端坐
77361,病足昼卧梦中谵谆乃诵尚书也既觉口占绝句
934115,梦宴客大楼上命笔作诗既觉续成之
936946,梦韩无咎如在京口时既觉枕上作短歌
832392,三姝媚 午窗假寐，姬人为供给红梅枝，既觉始见之，时得彊村翁寄词，有“风怀销尽”语，遂下一转语作我发端
929437,昼寝梦一客相过若有旧者夷粹可爱既觉作绝句记之
1063613,大雪晚睡梦李德修插琼花一枝与语甚久既觉作此诗时在洞山
144606,山房假寐梦有一客抱琴奏曲而去既觉诗以记之
1060451,绍圣二年秋七月乙未夜梦游一胜处非平生所经行见一道士延余坐饮以醇酒酒酣道旧故恍然不知所以因而赋诗既觉漫不复记忆戏作五言以补之
934093,梦中江行过乡豪家赋诗二首既觉犹历历能记也 其二
1239700,二月望在巩昌客馆夜梦归里中与金十二丈傅九文学同游高五处士别业既觉有感而赋
928571,正月十一日夜梦与亡友谭德称相遇于成都小东门外既觉慨然有作
