19652,题新涧亭兼酬寄朝中亲故见赠
92358,野桥·亦好亭兼弄月亭
373217,寄题池亭兼赠吕道正
597930,寄题萧廷玘池亭兼讯其从子曰贞
1045722,寄题池亭兼赠吕道正二首 其二
667966,重晏魏子池亭兼约再游
628031,留别黎雨亭兼订西楼之约
21465,寄题蔡州蒋亭兼简田使君
19542,和杨尚书罢相后夏日游永安水亭兼招本曹杨侍郎同行
712190,寄怀王阮亭兼索其南海集
1156163,和杨尚书罢相后夏日游永安水亭兼招本曹杨侍郎同行
159598,再葺流杯亭兼得今翰林胡学士旧记石刻移置坐
124155,题罗江翠望亭兼简西游君子
674923,送盛秋亭兼柬吴克温
159283,次韵和吴侍郎再葺东亭兼怀晁公旧隐
893789,再葺流杯亭兼得今翰林胡学士旧记石刻移置坐隅郡人以为宠
1182114,寄题蔡州蒋亭兼简田使君
1045721,寄题池亭兼赠吕道正二首 其一
499264,赠南符卿汪柏亭兼省觐
894024,次韵和吴侍郎再葺东亭兼怀晁公旧隐
892975,题罗江翠望亭兼简西游君子
1156706,题新涧亭兼酬寄朝中亲故见赠
1121554,寄题池亭兼赠吕道正二首
