966394,和林和靖先生梅韵 其五
757028,和天台雅集韵 其五
983322,再用前韵 其五
1086598,大龙山五咏用家君所和胡别驾韵 其五 汤炉
1219097,再次韵 其五
1076601,早春次韵 其五
1003973,上后乐刘先生左史十首用襄阳诗两句行藏坚晚节进退法先民为韵 其五
522390,淑人启土有感随事写怀用辛巳韵 其五
625031,闺怨一百首次孙西庵原韵 其五
760168,五叠前韵 其五
579755,闺情复次前韵 其五
625084,闺怨一百首次孙西庵原韵 其五十八
589108,村庄漫述和赵中丞韵 其五
557082,张助甫席上同吴峻伯白伯伦再饯朱主客南还赋得江飞兢渡日草见踏青心十韵 其五
635920,中宿归舟赋得落日放船好和张子白韵 其五
600537,山癯老人九景诗和毕松坡大宰韵 其五 丹灶回阳
653105,题陈主事元宗渔洲雅集诗用秋来凫雁下方塘元韵 其五
443298,戊寅迎春曲步凡翁韵 其五
572287,和散木韵 其五
447541,冬夜独坐十叠韵 其五
1089098,次江州王知府叔坚韵 其五
548907,赠明上人八章次叔兄韵 其五
605243,秋夜江行客有歌唐人野旷天低树江空月近人之句因用为韵 其五
1085116,泰之用欧苏颍中故事再作五绝勉强继韵 其五
1052713,再和子育韵 其五
750700,信陵书院作追述耆献留别院中诸生叠仙屏河帅韵 其五
573554,释用思母八首再依前韵 其五
1081915,刘希颜持节按县招维心舟中小酌次维心韵 其五
518666,再次顾贰守前韵 其五
760152,三叠前韵 其五
401296,丙戍秋兴八首次少陵韵 其五
786973,怀易堂次敬亭韵 其五
457181,春感十首次丘仓海韵 其五
1081617,役所书事用山谷观化韵 其五
759977,东山感春诗，次己亥感秋韵 其五
1073372,返魂梅次苏藉韵 其五
1087848,次刘秀野蔬食十三诗韵 其五 茭笋
787066,春忆杂诗次渔洋先生上巳辟疆招同邵潜夫陈其年修禊水绘园八首原韵 其五 水南庄
876426,用厚后弟强甫韵 其五
760369,秋怀八首，次覃孝方韵 其五
636030,马山杂咏三十韵 其五
959126,再和前韵 其五
760136,叠前韵 其五
934953,入秋游山赋诗略无阙日戏作五字七首识之以野店山桥送马蹄为韵 其五
655695,追和刘秀野诗韵 其五
963186,刘后溪和雁湖即事诗十绝见示次韵 其五
783200,咏落叶敬步御制原韵 其五
627123,丁亥仲春余归自岭右暂憩乡园读杜工部秦州杂咏怅然感怀因次其韵 其五
1098104,上立斋先生十首以有官居鼎鼐无宅起楼台为韵 其五
830495,甲午天津杂感和姚慕庭先生原韵 其五
426853,和黄咏雩榄溪杂诗即用原韵 其五
614444,古冈八景和叶六桐明府韵 其五 江门晚渡
808958,追和程春海先生橡茧十咏原韵 其五 驱蠹
997661,归途次韵 其五
1215183,送张志可侍父之奉化幕官二十首用杜少陵万壑树声满千崖秋气高浮舟出郡郭别酒寄江涛为韵 其五
1003805,寿李悦斋五首和送三荣使君韵 其五
774970,次广文吴友山台阳怀古杂咏元韵 其五
1066420,次江文韵 其五
905778,再用前韵 其五
629064,韩孟郁招同黄宫谕刘宪副高太守梁韩二明府暨苏梁诸公集浮丘步寅仲韵 其五
611956,村居春兴秋兴各十章俱步张孟奇园居韵 其五
1137922,次程南仲韵 其五
1220590,王继学赋柳枝词十首书于省壁至正十有三年扈跸滦阳左司诸公同追次其韵 其五
1221659,雪湖八景次瞿宗吉韵 其五 西陵雪樵
1027040,八月十四日携家泛月次韵 其五
1070517,江仲嘉行邑将归见寄绝句次韵 其五
1062740,杨时可作十诗以寄河间诗之所及非吾僚则吾友也因悉次其韵以和之又以其所以赠我者复赠时可作还字韵 其五
404015,临江仙·再和石窗词长《米寿放歌》原韵 其五
777706,隩草戊戌1654仲冬和韵 其五
1034340,王常博寄示沌路七诗李肩吾用韵为予寿因次韵 其五
579745,闺情十绝次金诚之先生韵 其五
554822,病剧再韵 其五
905156,上黄端明寿诗以伫期三入后一品见玄孙为韵 其五
935607,杂感十首以野旷沙岸净天高秋月明为韵 其五
572243,和王以明山居韵 其五
856390,送彦立兄游太学以恩袍草色动为韵 其五
902064,自顺阳至均房道五首用陈符宝去非韵 其五
625079,闺怨一百首次孙西庵原韵 其五十三
609452,正月十五日霍君仪邀游朱季美山池同用畅超然之高情为韵 其五
629209,镜园和邓玄度步韵 其五
564339,东郊别业用前韵 其五
1089247,次东坡先生韵 其五
671134,乙卯春大人有文安之行送至京口大人用杨柳青青渡水人为韵赋七绝以别敬步原韵 其五
760857,和絜斋世丈西园秋兴，次翁覃溪阁学韵 其五
644234,喜清远兄至以齐已诗长忆旧山日与君同聚沙十字为韵 其五
1200626,春词和韵 其五
860663,再次韵 其五
945557,次儿瀹以诗四首道各意因两用其韵 其五
936409,秋怀十首以竹药闭深院琴樽开小轩为韵 其五
935979,和陈鲁山十诗以孟夏草木长绕屋树扶疏为韵 其五
1031616,三月十二日晚雨因取渊明诗微雨洗高林清飙矫云翮之句定韵赋十诗翌日雨未已侄坦师来相招时方赋六首暮雨暗还舍遂足十韵 其五
627893,山居三十韵 其五
1079578,送山伯良佐东归以务道期息涂为韵 其五
1089304,直舍考校次弱翁再用前韵 其五
1068829,奉和朱新仲祠部六月晦日省宿用白乐天诗无波古井水有节秋竹竿十字为韵 其五
774841,杂诗平韵 其五
609744,次临封八景韵 其五 西山晴雪
555654,春兴八首次韵 其五
868444,晚年辟地为圃僭用老坡和靖节归田园居六韵 其五
518339,用钟伴读清明节灯下书怀韵 其五
572784,和萃芳馆主人鲁印山韵 其五
1059076,送杜堪才以江汉故人少为韵 其五
888092,王持中读余近诗跋以五绝因次其韵 其五
541098,道遇寒食忆宋之问马上逢寒食句五咏其韵 其五
1221694,送赵永贞改丞德化县以万水千山路孤舟几日程为韵 其五
599451,早春即事和韵 其五
616189,唐操江落花诗三十首李临淮先有属和余兴不自已遂悉次其韵 其五 五微
1000655,同官皆和复次韵 其五
745412,奉同太宰节使朱先生和郭景纯游仙九首次其韵 其五
1047629,答林夫五颂次元韵 其五
759721,寄兰史、晓沧、菽园用晓沧韵 其五
838942,和陈丈剑门新秋偶兴呈菽庄主人原韵 其五
502334,咏怀次倪安道十首韵 其五
429665,雨中游西山诗五首以催诗走群龙为韵 其五
935581,杂兴十首以贫坚志士节病长高人情为韵 其五
775301,送余刺史宝冈秩满入觐即次留别元韵 其五
625080,闺怨一百首次孙西庵原韵 其五十四
553033,用五河县孙驿丞行简秋凉感怀诗韵 其五
1137768,春夜雪再用韵 其五
1239696,五禽言次王季野韵 其五
587882,神游飞云诗和方西樵韵 其五
500492,书事五首次郡侯韵 其五
936451,秋夜感遇十首以孤村一犬吠残月几人行为韵 其五
757005,香奁和姊氏韵 其五
760293,拟杜诸将五首用原韵 其五
1220690,与同馆戏续前韵 其五
412191,感奋书怀八首，用蒋贞金先生五十述怀原韵 其五
1067033,游径山蕴常上人字无可以山中秋日十诗求和因次韵 其五
657589,和答许巡按枉顾定山韵 其五
412706,诸将五首用工部韵 其五
917504,秋怀十首微云淡河汉疏雨滴梧桐为韵 其五
782363,游新城汪园步遂堂先生韵 其五
991187,和范景仁王景彝殿中杂题三十八首并次韵 其五 奉呈诸君
838934,和施耐公感兴原韵 其五
549956,哭殉难十公用前韵 其五 宫谕湛陆刘公
534077,列岫亭以窗中列远岫为韵 其五
775693,留别八首和徐幼眉大令必观见赠韵 其五
443642,辛未除夕遣怀步孔凡老韵 其五
872282,追和晦庵先生十梅韵 其五 野梅
617495,次临封八景韵 其五 西山晴雪
1220168,市汊驿十绝次韵 其五
996892,奉和文潜赠无咎篇末多见及以既见君子云胡不喜为韵 其五
819098,冬日杂诗以仰视皇天白日速为韵 其五
1238363,寓意十首次敬助韵 其五
401304,乙卯春感八首次草堂秋兴韵 其五
1087936,次秀野杂诗韵 其五 又五绝卒章戏简及之主簿
1070506,山中次叶翰林韵 其五
402277,秦国《国风吟苑》诗刊主编王诚以论诗七绝征和，因步韵 其五
571663,丙戍正月部兵赴南宁道中杂韵 其五
403935,临江仙·依蕙风簃步程子大八首韵 其五
553011,秋兴用宋推府韵 其五
627159,九日限韵 其五
572303,九月二日盛集诸公郊游至二圣寺仍用散木韵 其五
868422,枕簟入林僻茶瓜留客迟十韵 其五
936243,幽居记今昔事十首以诗书从宿好林园无俗情为韵 其五
1052504,和国信子育元韵 其五
848917,霅山和丹岩晚春韵 其五
760144,再叠前韵 其五
637710,游白云寺分韵 其五
884496,重阳不见菊次诸公韵 其五
488036,秋日閒居和张隆甫韵 其五
636768,续西园咏木芙蓉后十五韵 其五
587573,赠方棠陵用陶饮酒韵 其五
402291,仍有馀意，三步前韵 其五
1137820,三用韵 其五
973806,东坡在惠州窘于衣食以重九近有樽俎萧然之叹和渊明贫士七诗今去重九三日尔仆以新谷未升方绝粮是忧至于樽俎又未暇计也因诵靖节贫士诗及坡翁所和者辄复用韵 其五
944739,弟观为众奉里神于丹山僧舍有五绝因趁韵 其五
612941,秋夜偕诸生月下诵桂子月中落之句因以为韵 其五
599467,春日陪侯侍御游洪岩用卢大参韵 其五
759648,春感次许蕴伯大令韵 其五
590443,赋雪次滁州孙环山进士韵 其五
993614,雨后十小绝以一雨洗残暑万家生早凉为韵 其五
550035,赋得春寒花较迟即用为韵 其五
1051853,和范学士韵 其五
654616,无题和李商隐韵 其五
719793,金陵秋兴八首次草堂韵 其五
781092,学易岛庵蝉联体以苔径雀声晚蕉窗蝶梦凉囊琴步野渡枕笛醉渔航二十字为题各限五言四韵每一题即以次字为韵 其五 晚
769761,菩萨蛮•题青溪遗事画册和阮亭韵 其五 迷藏
1076297,刘德秀县丞凡五和前篇仆亦五次其韵 其五
428943,秋兴八首用杜子美韵 其五
1139124,雪夜不寐偶成短句十首用渭北春天树江东日暮云为韵 其五
660523,寄刘东山五首次国贤韵 其五
625771,临封八景次韵 其五 西山晴雪
450557,浣溪沙十四部平韵 其五
1140187,愿月得雨兼旬秋晹人望已切再和前韵 其五
943739,同陈宰黄簿游灵山八首宰云吾辈可谓忙里偷闲苦中作乐以八字为韵 其五
412649,游仙吟三十首用栩园韵 其五
518542,苍梧十景次汪宪副韵 其五 西岭严关
549806,和周吏部海门公韵 其五
434989,和秦彦容韵 其五
774164,再叠台江杂咏原韵 其五
877695,诸公载酒贺余休致水村农卿有诗次韵 其五
1218398,和济夭岸法师约李五峰同游韵 其五
935617,杂感五首以不爱入州府为韵 其五
534041,秋雨集清泉精舍以唐人雨中山果落灯下草虫鸣为韵 其五
935525,岁暮感怀十首以馀年谅无几休日怆已迫为韵 其五
636540,答张子白来韵 其五
625085,闺怨一百首次孙西庵原韵 其五十九
500325,赋得孤云独往还楞伽山中同石斋先生分韵 其五
996754,自咸平至太康鞍马间得十小诗寄怀晏叔原并问王稚川行李鹅儿黄似酒对酒爱新鹅此他日醉时与叔原所咏因以为韵 其五
1078210,叶梦授送家园梅花且以绝句十五章见示次其韵 其五
927856,谢商守宋郎中寄到天柱山户帖仍依元韵 其五
510286,麦秀夫于城南小渚中累土结茅居之容一之马伯干取酒共醉桃花下各赋诗为乐秀夫谒余同作附其韵 其五
554196,舟中杂咏用杜子美秦州诗韵 其五
625081,闺怨一百首次孙西庵原韵 其五十五
1244716,和吴正传五台怀古韵 其五 戏马台
585342,待隐园池亭观物感怀和韵 其五
401346,仿杜甫同谷七歌并用原韵 其五
1066500,送友赴试钜野送之西门时方有外舅之戚极目无聊归不得卧作诗五首却寄以风云入壮怀为韵 其五
1219087,和饶介之秋怀诗韵 其五
630950,滕王阁五首和足两韵 其五
1099887,和吴检详飞跃亭韵 其五
1137699,次刘晓窗九日韵 其五
628197,朝云墓十首次孙西庵先生韵 其五
945302,俞荪墅示以杂兴四首乃用危骊塘所次唐子西韵因次韵 其五
555450,鲤湖纪游十首和先辈龚司训韵 其五
514565,追思旧游寄浙江左时翊参政十绝次草庭都尉韵 其五
1068790,子温侄用再闻诵新作突过黄初诗作十诗见遗辄勉强次韵 其五
1137580,希年初度老友王希宣扁舟远访夙谊甚厚贶以十诗实用渊明采菊东篱下语五章云每岁思亲不持斝蓼莪几欲废诗雅盖深知予心者读之凄然辄尔和韵 其五
730150,读工部诸将五首感次其韵 其五
904219,将至兰陵道中以远岫重叠出寒花散漫开为韵 其五
855845,梅花十绝追和张文潜韵 其五
639085,书堂十咏奉和少司寇新昌何世光先生韵 其五 碧绛桃
875971,熊主簿示梅花十绝诗至梅花已过因观海棠辄次其韵 其五
760013,岁暮感怀次感春韵 其五
1027055,大雪赵振文寄诗言乘月泛舟清甚次韵 其五
754235,雁字三十首次韵 其五
945756,戴帅初九日无憀以满城风雨近重阳为韵七首袖而示余因次其韵 其五
599477,舟行用卢方伯莘老韵 其五
971084,见梁检法书怀八绝句于广文尉曹处次韵 其五
838042,咏梅八首和贡觉原韵 其五
1003713,虞使君示春日喜雨六绝和韵 其五
1066531,余谪沙阳地僻家远遇寒食如不知盖闽人亦不甚重其节也感而赋诗五首以杜子美无家对寒食五字为韵 其五
535678,南巡歌八首次韵 其五
1071800,曾大父有诗云三春拂榻花黏袖午夜淘丹月在池舍弟子飞归蜀与语及此因取为韵 其五
963131,万景楼次韵 其五
1218428,次雷子枢知事延平八咏韵 其五 梅山朝旭
411374,和李啸楼先生三醉木芙蓉原韵 其五
625082,闺怨一百首次孙西庵原韵 其五十六
1076724,和舒伯源梅花韵 其五
447146,三十咏怀七首，以横眉冷对千夫指为韵 其五
1076027,次韵季共月夜见怀竹坡用子绍韵 其五
905066,和吴微明疏影横斜水清浅七咏韵 其五
1094741,次韵 其五
731409,易州道中咏怀古迹五首用杜工部韵 其五
557096,白伯伦仪部移居夜阶助甫司封访之席上赋得卜居赤甲迁居新两见巫山楚水春十四韵 其五
508259,再和人韵 其五
512723,和陈惟夤先生姑苏钱塘怀古韵 其五
787140,全閒居八首用紫琼道人春日园居杂咏原韵 其五
890362,次邦宪宣德红梅诗韵 其五
625077,闺怨一百首次孙西庵原韵 其五十一
975030,大人生朝代诸儿五首以春风花草香为韵 其五
579789,拟唐人四时宫词二十首次官汝清韵 其五
790990,寿张少泉先生七十即用其自寿原韵 其五
430109,杭州探梅历游超山西泠烟霞洞灵峰以中有万斛江南愁为韵 其五
632313,和栖贤山居韵 其五
866898,和陈七峰七诗韵 其五
564980,秋兴八首用马西玄韵 其五
983311,再用前韵 其五
649935,奉和澹庵少保题梅花韵 其五
838694,杨花五首，和沈琛笙大使原韵 其五
482328,次郑好义见贻韵 其五
783307,和叶某留别原韵 其五
401312,乙卯后春感八首三叠秋兴韵 其五
760160,四叠前韵 其五
1226753,聪仲晦古意廿一首爱而和之仍次其韵 其五
950305,与苏州守十诗以兵卫森画戟燕寝凝清香为韵 其五
625083,闺怨一百首次孙西庵原韵 其五十七
457191,杂感十首步丘逢甲韵 其五
1220158,送俞君实十首以长因送人处忆得别家时为韵 其五
1094771,次韵 其五
1058044,王升之绝句以诗成有共赋酒熟无孤斟为韵因次其韵 其五
573562,奉母八首仍依前韵 其五
429600,消夏偶成十五首用上平韵 其五
660802,待隐园次杨太宰韵 其五
760377,秋怀次前韵 其五
1029463,饯吴长文司理用脩持贤业教无欠为韵 其五
1018272,浩西堂见和因再用韵 其五
625078,闺怨一百首次孙西庵原韵 其五十二
401320,丙辰春感八首四叠少陵秋兴韵 其五
889502,陈子厚送韶鸭将以七绝因次其韵 其五
1137914,次程斗山村居韵 其五
936632,斋中杂兴十首以丈夫贵壮健惨戚非朱颜为韵 其五
980589,说之方忧韩公表大夫疾遽致仕乃蒙传视送陈州王枢密诗十首意典辞丽忻喜辄次韵和呈以公若登台辅临危莫爱身为韵 其五
985151,和蒲大受王园泛舟用文老韵 其五
508251,再和谩书韵 其五
1094596,鲁解元以坡语空山无人水流花开为诗和韵 其五
573546,在狱思母八首依前韵 其五
579829,十二月词十二首复次官汝清韵 其五
1068503,刘无损欲书十扇以韦苏州乔木生夏凉流云吐华月句作韵 其五
408455,金陵秋兴八首用杜韵 其五
671188,拟古仍古韵 其五
791888,前在海上见会稽徐僧佣所作《九老》诗，意警词练，因仿为之，并限其韵 其五 老农
737394,春游杂吟次赵秋谷前辈韵 其五
1217524,宫词八首次契公远正字韵 其五
1032856,渔村杂诗十首再和前韵 其五
580021,闲思十首次代内赠韵 其五
599906,十洲草亭十首和玉田韵 其五
664476,送钱水部致仕次杭秋官韵 其五
443303,己卯迎春曲步凡翁韵 其五
976217,蜡梅十五绝和陈天予韵 其五
882601,江北梅开殊晚和林实之别驾韵 其五
1090105,喻工部追和王詹事游东坡十一绝亦次韵 其五
1004081,寿宪使江寺簿八首以座右公廉勤谨忠信和缓八字为韵 其五
471041,䨑云诗八首次韵 其五
905871,复用前韵 其五
838636,秋怀八首和邱仙根工部原韵 其五
978661,鲜于东之晋伯之子赠诗次韵 其五
760827,寄怀菽园，兼讯兰史，叠次晓沧韵 其五
935220,开岁半月湖村梅开无馀偶得五诗以烟湿落梅村为韵 其五
1004283,郡事多冗命绳翁拉彦翔则明德素游赵园彦翔归以五章示教用韵 其五
1091008,十四日从诸同官登西山郊坛冈次孟监务韵 其五
838700,春草八首，和沈琛笙大使原韵 其五
410652,代友人和张野秋侍郎戊戌秋感原韵 其五
1027480,次周益公韵 其五
940575,次刘学录梅韵 其五
668519,道出淮泗舟中阅高常侍集有自淇涉黄河十二首因次其韵 其五
1034515,和虞退夫见贻生日诗韵 其五
909740,吕颜野饮醉中寄五绝句次其韵 其五
799424,九日同人邀游龙门寺用少陵蓝田崔氏庄韵 其五
1056766,亨父录示山斋即事五篇索和遂次其韵 其五
768996,南乡子·暑夜用欧阳炯韵 其五
1026738,和彦猷在华亭赋十题依韵 其五 秦始皇驰道
705239,浣溪沙 有客为王校书索赠漫题二阕其字浣若为调浣溪纱其名西也以西字为韵 其五
656826,湖西八景次陈石斋韵 其五 大旒垂玉
1141981,和静春赠唐心月韵 其五
572295,再和散木韵 其五
774369,次徐树人七十述原韵 其五
1243664,和李本存孤字韵 其五
783131,范兰亭索赠限梅岑送潘问奇原韵 其五
760030,论诗次铁庐韵 其五
943770,次姜尧章赠诗卷中韵 其五
415323,寿石吟十三首录七，用一九八一年《咏雨花石》韵 其五
457204,白日梦十章再用仓海韵 其五
604326,奉和濲师赵相公怀山八咏用韵 其五 紫霞洞叟
1215765,樵阳八咏用陈教和周东圃韵 其五 北桥春舫
872664,晚坐和韵 其五
963193,同孙子直和李参政东园韵 其五
614556,随笔书所见杂用坡公韵 其五
1220628,青宫受宝朝贺日次韵 其五
1212076,神山避暑晚行田间用陶渊明平畴交远风良苗亦怀新为韵 其五
1095189,百法庵次载叔韵 其五
837879,奉和实甫观察原韵 其五
636008,客珠崖怀罗浮寄山中诸子三十韵 其五
508184,游大胜寺赓壁间诗韵 其五
1077269,罗畴老录示和丹霞绝句五首次韵 其五
625076,闺怨一百首次孙西庵原韵 其五十
884569,十月旦读子美北风吹瘴疠羸老思散策之句初寮尝作十诗因次其韵 其五
1141571,六月十三日寿陈子徽太博十首以无官一身轻有子万事足为韵 其五
1067841,读西京杂记十三首次渊明读山海经韵 其五
841087,梅花九首次高青邱韵 其五
968150,怀梅水村十绝用张小山韵 其五
615219,次临封八景韵 其五 西山晴雪
1078590,泛歙溪用老杜诗青惜峰峦过为韵 其五
634370,九日和王仲锡宪长咏蝴蝶花限韵 其五
435056,用赵之美留别韵 其五
918283,奉和江冲陶隐居二十韵 其五
760007,重送王晓沧次前韵 其五
1137843,四用韵 其五
889576,和董伯玉不向东山久韵 其五
488046,春日幽居十首和薛景登韵 其五
838515,再和徐展云先生重九登石门岭原韵 其五
1137867,再用韵 其五
604537,甲子秋七月入宝安过访邓玄度观察镜园同尹用平温尔惇两年丈饮邻仙楼用杜少陵游何将军山林十诗四十韵 其五
624259,平声四韵 其五
500497,幽居九首次监郡韵 其五
883006,子宝东归以嘤其鸣矣求友声为韵作古诗七章宽予旅怀次其韵 其五
652719,閒居初夏七首次王校理韵 其五
876669,竹溪评余近诗发药甚多次韵 其五
612005,暮春紫烟楼八咏步陈仪翔年兄百尺楼韵 其五
481034,晚春五首用杨孟载韵 其五
1221651,雪中八咏次睢宗吉韵 其五 雪雁
879865,送李季允侍郎归蜀五绝用禅房花竹幽为韵 其五
963343,益昌次费伯矩赠行韵 其五
1090423,和林子长送芡实诗韵 其五
950335,辛酉大雪戏成十诗以千山鸟飞绝万径人踪灭为韵 其五
888716,和任宰元绍见寄十首以归来问信湖山抚摩松菊为韵 其五
587607,听铁泉和韵 其五
635877,和张子白来韵 其五
1081910,维心过邵子非溪亭夜话有伤时感旧之作索余次韵 其五
752634,新年次东坡韵 其五
775115,留别松山观察以皇恩只许住三年为韵 其五
521919,前题次十峰司宪韵 其五
940581,次喻景山韵 其五
979617,感寓十首次韵和黄著作鲁直以将穷山海迹胜绝赏心晤为韵 其五
