177649,初欲登小孤惠济庙水盛风驶回首已远矣
607991,过滕王阁欲登不果和友竹
1046845,欲登祝融峰阻雨呈少卿
160750,月台·我欲登仙换凡骨
1133821,北高峰屡欲登而辍
366968,欲登祝融峰阻雨呈少卿
745615,舟泊东昌望光岳楼欲登未果
1007163,初欲登小孤惠济庙水盛风驶回首已远矣
734067,闻鼓山绝顶可望海外诸国欲登不果
634058,予欲登飞来寺顶至半山亭怯风不能行不挂超汉自显三子掖之而下
1244887,箫史赵信卿谒玉山昆季且欲登碧梧翠竹之堂诗以道其行
106280,北高峰屡欲登而辍
315636,欲登楼未果先赋一律以见意
169724,欲登蓬莱山谢雨恐泥泞不可行是早忽晴并纪其
152105,乙卯中秋初夜见月欲登楼而阴五鼓如永和镇省
809651,回銮至华阴欲登华山因风雾所阻
153127,满江红·正欲登临
1086631,山中阻雨欲登华顶峰而不果
1182637,浩初上人见贻绝句欲登仙人山因以酬之
329354,闻仙都·九月霪霖谷欲登
500226,欲登楼未果先赋一律以见意
273200,病起杂诗·强欲登楼筋力乏
129714,苦雨·稼欲登场只等晴
534866,晓望石廪峰欲登不果作
383861,晓望石廪峰欲登不果作
941003,欲登蓬莱山谢雨恐泥泞不可行是早忽晴并纪其异
118878,停云诗·晚稻欲登
948117,乙卯中秋初夜见月欲登楼而阴五鼓如永和镇省七兄月色如昼
478564,归途欲登惠山时烟雨空濛众有难色余独奋往
169527,和黄充出游·剩欲登临强作欢
14615,浩初上人见贻绝句欲登仙人山因以酬之
