626528,江上有怀高望公
710913,花朝同高望公璩子弟赋
710895,西郊同岑梵则王说作陈乔生梁药亭陈元孝集高望公客斋赋
629516,送高望公入山
203822,和宗侄朝望公辅贺生朝韵
859962,和宗侄朝望公辅贺生朝韵
711085,西郊社集同岑梵则王说作柬屈翁山高望公诸子
711786,秋日西郊宴集同岑梵则张穆之陈乔生王说作高望公庞祖如梁药亭梁颙若屈泰士屈翁山时翁山归自塞上
370347,喜予见过·望望公超市
538649,虎山桥同鲁望公瑕子求道振子念舍弟作得然字
627972,访高望公村舍 其二
713231,同宁都魏和公昆山徐原一同里王震生高望公湛用喈程周量何不偕梁器圃陶苦子集药亭六瑩堂得真字
628535,同高望公芥庵坐月时须识上人自雷峰至
689102,访高望公村舍
710919,送高望公还山
380471,溪欸乃歌·望公坞上碧云堆
628506,中秋怀高望公
301214,暮春三宿邝无傲斋中迟高望公不至同许式微许二陔赋
710213,暮春三宿邝无傲斋中迟高望公不至同许式微许二陔赋
629721,秋夜罗澹峰司李石湖与黄君简高望公分赋
627971,访高望公村舍 其一
626450,高望公于穗石洞侧土中得玉状类砚而微阙欲以见赠予辞焉为作抵玉之歌
1038712,相国杜公旧里钱唐有别野在华下既得谢留寓睢阳因家焉某近赴益部过三峰闻华人之望公舍而不还又顾吾乡之独幸国老处焉因道西人之意成长句四韵奉寄杜公
710906,重阳后二日同张离隐何不偕陈元孝陶苦子高望公林叔吾集梁芝五斋中
