1161931,张工部至薄寒山下有书无由驰报輤车之至倍切悲怀
488533,戏答见嘲醉后堕车之作
535892,田车之什二章
447688,自合肥归巢误入合宁高速，即驱车之滁州琅琊山，得诗三首 其三 醉翁亭
116447,复答迎郭侯犊车之句
863663,淳化二年八月晦日夜梦于上前赋诗既寤唯省一句云九日山州见菊花间一日有商于贰车之命实以十月三日到郡重阳已过残菊尚多意梦已徵矣今忽然一岁又逼登高追续前诗句因成四韵
956441,再次喜雨诗韵以表随车之应
593487,答王中丞元美喜余待诏公车之作
123303,再次喜雨诗韵以表随车之应
619170,冬日访龙泉时江梅已放因得刘长孺公车之讯
799214,乾隆癸丑中秋，陈榕溪夫子自三河遣人走京师，招湘读书官舍，且命即日束装，趁节赏月，盖下车之第七日也。距今夕乃五年矣。夫子俸满不迁，湘复留滞都门，偃蹇如故。极思来会此节，一话万端，以病新起不果。对月孤吟，惆怅无极，时嘉庆三年戊午八月十五夜 其一
790404,东坡年五十九南迁过泰和县，作秧马歌赠曾移忠。观其体物浏亮，托思深远，心声心画，绘影绘声，洵乎合水车之咏，并入农书，而嗣泥橇之风，垂为器谱。粤以首夏农事方兴，黄云乍收，碧毯如织。谨次其体，以俟采风者览云
585814,承广西大巡东逵陈侍御下车之初即致书来问盖公学出于蒋道林有渊源矣以此正己格物而风俗化矣小诗奉寄
812879,乾隆癸丑中秋，陈榕溪夫子自三河遣人走京师，招湘读书官舍，且命即日束装，趁节赏月，盖下车之第七日也。距今夕乃五年矣。夫子俸满不迁，湘复留滞都门，偃蹇如故。极思来会此节，一话万端，以病新起不果。对月孤吟，惆怅无极，时嘉庆三年戊午八月十五夜
441088,向晚买车之武林从明庐师莼客安和钝丼诸兄作长夜之饮弱侯闻知寄赠长句因步韵却寄
896437,复答迎郭侯犊车之句
447687,自合肥归巢误入合宁高速，即驱车之滁州琅琊山，得诗三首 其二 独登琅琊山顶会峰阁
826641,祝英台近·鹊华秋梦图者，安巢居士閒情所托也。绣檀回枕，已歇余馨；落叶惊蝉，但曳残响。羽陵缘尽，挽不住飞絮光阴；淡粉楼空，问不出青禽消息。断云幽梦，写放翁坏壁之词；弱柳平桥，送苏小香车之路。钗凤眷回眸之月，笼鹦学留客之声。翠水秋寒，红衫人远。安巢乃贻书历下，索句宣南。秋色仿伯雨之图，影事托云轩之梦。仆本羁迟，同嗟沦谪。云愁霞想，抚枯树以兴怀；心倒肠回，借飞花而溅泪。子野之来京口，零落兜娘；澹心之记板
799215,乾隆癸丑中秋，陈榕溪夫子自三河遣人走京师，招湘读书官舍，且命即日束装，趁节赏月，盖下车之第七日也。距今夕乃五年矣。夫子俸满不迁，湘复留滞都门，偃蹇如故。极思来会此节，一话万端，以病新起不果。对月孤吟，惆怅无极，时嘉庆三年戊午八月十五夜 其二
255736,月·火车（之二）
447686,自合肥归巢误入合宁高速，即驱车之滁州琅琊山，得诗三首 其一
645921,雷峰一初送竹屿春谷和尚诗有莫念平生下泽车之句就为起句以寄之
468116,自合肥归巢误入合宁高速，即驱车之滁州琅琊山，得诗三首
