1243213,孟院判宅辞饮
1216767,四月十四日习仪白塔寺有旨翥升院判
516461,挽蒋静学院判
650584,龙潭十景为太医院判蒋用文赋 其二 七星礼斗
650583,龙潭十景为太医院判蒋用文赋 其一 三江观潮
647993,雨中寄蒋用文院判
506869,赠韩院判
1236831,寄颜元卿院判二首
650586,龙潭十景为太医院判蒋用文赋 其四 柳湾待渡
692352,题蒋院判小画
659243,王院判父挽诗
516608,送蒋院判随驾赴京
647464,王孟端写竹木图为院判刘士宾题
1219507,寄颜元卿院判二首 其一
1216812,闻董孟起副枢乃弟鄂霄院判凶讣哭之二首 其一
650589,龙潭十景为太医院判蒋用文赋 其七 花洞垂纶
1216813,闻董孟起副枢乃弟鄂霄院判凶讣哭之二首 其二
649339,题蒋院判墨竹
648047,为行俭题五杏图赠院判蒋主善
650337,赠太医院判韩公达
650587,龙潭十景为太医院判蒋用文赋 其五 官桥送别
506857,题蒋院判秋林书屋
658464,送周院判原已还任南京得杲字
577210,题蒋院判家山水图
649397,题蒋院判小画 其一
648364,寄蒋用文院判 其二
650588,龙潭十景为太医院判蒋用文赋 其六 水驿维舟
645053,卢氏秋夜赋寄王院判
1242654,题清心堂诗卷后，为相院判赋
516469,谢克一蒋院判送菊
659288,送王院判弟医官归宜兴
919112,和赵院判
696783,龙潭十景为太医院判蒋用文赋 三江观潮
535295,许院判挽歌二首 其一
53625,送院判俞子茂进兵番阳
648363,寄蒋用文院判 其一
648637,蒋用文院判静学斋诗
1217874,题院判石末公见惠赵仲穆双马图
686284,寄静学蒋院判次韵
692292,寄蒋用文院判
516421,寄静学蒋院判次韵 其一
650592,龙潭十景为太医院判蒋用文赋 其十 谯楼晚眺
1246843,黄君季伦下顾槐塘山中濒行具述院判相公天资高明识见超绝海内人士以之权衡轻重子不可不往谒之明日入城府巧不相值归而沉痾又复踰月辄陈鄙句谨候阍人以献
452049,电视新闻报导京城某中年男子车祸遇难法院判决赔偿四十一万元而同车遇难农村女孩仅获赔十七万元
1216238,题米元晖山水为贾仙院判作
535296,许院判挽歌二首 其二
483269,上院判（十四韵）
59561,上院判·浩荡风云气
1236085,闻董孟起副枢乃弟鄂霄院判凶讣哭之二首
520755,哭周院判
484170,送院判俞子茂进兵番阳
650591,龙潭十景为太医院判蒋用文赋 其九 石屋春游
1226018,寄迈里古思院判
1219508,寄颜元卿院判二首 其二
649398,题蒋院判小画 其二
514480,分题履寿周原已院判乃尊
650590,龙潭十景为太医院判蒋用文赋 其八 旗山散牧
650585,龙潭十景为太医院判蒋用文赋 其三 华麓寻真
660467,和太医萧院判诗一首
506914,一片秋意为史院判题
506912,小画为韩院判题
650553,挽史公望院判
516422,寄静学蒋院判次韵 其二
506870,鉴湖一曲为史院判题
514861,送周原已院判还南京
1249074,谢中政院判买住昂霄枉过予龙江寓隐
650581,王学士直求赋五杏图赠蒋院判
1219327,次韵寄颜元卿院判
650501,赠刘院判
684214,许院判挽歌二首
508800,黄楚祥院判母挽诗
