602610,中秋后一日偕顶笪僧游蒲涧
805064,上巳前一日偕同人游惠山舟次口占
333203,上巳前一日偕同人游惠山舟次口占
813107,九月十一日偕王慰三、章彦芳、王倬臣赴荡口舟中联句二首
829107,中秋后一日偕晓因挈女步月二首
549121,丁未清明后一日偕潘茂昆郡伯登峄山
185577,三月一日偕善之无逸游南山桃园分韵复源字
404878,清平乐·癸巳正月十一日偕室人同登阳明山看樱花杜鹃
650905,立夏前一日偕梅庵立夫过新安别墅
761212,一萼红  清明前一日，偕周莲伯散步城北，红日已西，乃至虹桥，复买小舟过桃花庵、莲性寺，烟水凄然，游人绝少，共溯洄者渔船三两而已
607886,中秋后一日偕上方过访谢宗吉
827681,中秋后一日偕晓因挈女步月二首 其一
688349,成化丙午九月十一日偕大参李德馨年兄陪宁殿下谒献王陵联句二首
580174,成化丙午九月十一日偕大参李德馨年兄陪宁殿下谒献王陵联句二首 其二
580173,成化丙午九月十一日偕大参李德馨年兄陪宁殿下谒献王陵联句二首 其一
827682,中秋后一日偕晓因挈女步月二首 其二
445614,重九后一日偕诸子再探陶家冲依齿分韵得五微
268709,中秋后一日偕晓因挈女步月
200692,重阳后一日偕翁宾暘张敬之江楼中分韵得台字
1138936,三月一日偕善之无逸游南山桃园分韵得源字
804443,立秋后一日偕群从过西林
607832,立秋前一日偕思耀弟过访宗吉宅赋莲房
790756,九月十一日偕王慰三、章彦芳、王倬臣赴荡口舟中联句二首 其一
950114,重阳后一日偕翁宾旸张敬之江楼分韵得台字
790757,九月十一日偕王慰三、章彦芳、王倬臣赴荡口舟中联句二首 其二
