696123,新嘉驿署旧有会稽女子留题三绝悽婉动人予以戊寅暮春过宿其处则壁间之句已磨灭不可复识矣感慨之馀仍和韵吊之
790106,七月初五，夜梦一老人，携登亭台，饮予以酒，命咏二绝。时酒气在喉，残镫映窗，披衣记此 其一
721415,王川南使君紫诠招同李宫詹山公袁通政密山梁太史药亭蓝山人采饮游灵洲予以事不果往诸公分韵及之仍同游韵八首
624714,新嘉驿署旧有会稽女子留题三绝悽婉动人予以戊寅暮春过宿其处则壁间之句已磨灭不可复识矣感慨之馀仍和韵吊之 其一
817602,上巳日，瘿公集同人十刹海修禊，予以病未至亦补一诗
158534,予以病久不赴朝谒因灸三里穴罢信笔偶书
567425,丁卯七夕谢兴化公孙海门偕浩上人胡子文饷予以系得牛字
785321,廿一史沈阳夏凤栖先生旧物也予以三十金得之尽典衣裘方足其数有相笑者作此解嘲
919992,送邢刍父赴漕试盖予以牒逊之
139734,李参政约客访西郊海棠予以斋禁不与
1070908,庚午重九予以忧患经此节物亦强举杯复同坐客步至陈氏水阁率尔成韵
677589,予以癸亥夏至雅之官舍雅素称多雨四山阴霭鲜见皎日初秋稍霁夜月倍明不觉跃然如晤交时亭中墙竹砌花颇茂有会于心为之赋诗一首
1084655,西园新辟昌龄索诗予以其未开尊也戏作数语既饮复用前韵
785308,广福门赴旅顺之行期本拟在四月二十四日后迁延至二十八日予以饯行诗书之于扇因以赠之复题一截
713327,王川南使君紫诠招同李宫詹山公袁通政密山梁太史药亭蓝山人采饮游灵洲予以事不果往诸公分韵及之仍同游韵八首 其二
565034,庚戌仲夏予赴召北上石川张子饯于江浒同舟至金山别去顷复寄予以诗草草依韵附谢二首 其二
872273,轻柔杨柳挟春妍孤梗梅花结雪缘此是乾坤大消息相逢切莫说流年此予三十年前赠先见赵太史二绝之一予亦不复记忆矣后三十五年太史访予山中恨诗不存惟为予诵此而亦忘其一竟莫省为何等语也既徵补之且告予以五星之将聚因作二首奉笑 其二
320268,诸君送黄仲勉户曹予以事不预遣人送绿杨一枝赠别
527075,阁老石淙杨公司空鹤山李公都宪东皋王公为同年之会予以年家子与席奉次石淙公韵二首 其一
828092,节师见予九日诗寄语曰岂忘庚戌重九耶何诗中未及之盖是秋节师入都吊张文襄公之丧予以九日邀同陈韬老集于十刹海广化寺凄然相对二老皆有诗刘松庵为图记之今忽忽八载矣感赋长句奉寄以志哀
1215509,客有语予以卫生之术者其说流于固赋此以赠之
713332,王川南使君紫诠招同李宫詹山公袁通政密山梁太史药亭蓝山人采饮游灵洲予以事不果往诸公分韵及之仍同游韵八首 其七
1034725,李参政约客访西郊海棠予以斋禁不与
884180,会魏夫人席上命小鬟妙舞曲终求诗于予以飞雪满群山为韵作五绝 其三
322331,廿一史沈阳夏凤栖先生旧物也予以三十金得之尽典衣裘方足其数有相笑者作此解嘲
79082,予以淳熙戊戌岁自蜀归时年五十四今三十有二
594115,惟敬出次郊园示予以功德寺牡丹之盛辄赋二诗讯之 其一
209408,予以甲寅冬过弋阳石桥戊辰正月重过
703282,甲寅秋予以乞经从燕台南归留滞白门顿弟在吴门专侍至之住数日去陵阳订其复至白首天涯易散难聚不已之情未欲遽远且天老人住山无力世乱难安相与共依座下此什送之并似六康居士念予亦一编户民也
996813,陈吉老县丞同知命弟游青原谒思禅师予以簿领不得往二公雨久不归戏作百家衣一首二十韵招之
1155035,予以长庆二年冬十月到杭州明年秋九月始与范阳卢贾汝南周元范兰陵萧悦清河崔求东莱刘方舆同游恩德寺之泉洞竹石籍甚久矣及兹目击果惬心期因自嗟云到郡周岁方来入寺半日复去俯视朱绶仰睇白云有愧于心遂留绝句
152541,邦衡置酒出小鬓予以官柳名之闻邦衡近买婢名
522415,十一月十四日梦人示所注周易前列卦爻后系众说朱阑素纸缮写极精致予以钱求卦得小畜之坤后四日冬至纪之以诗
1127717,罗子琳来就广漕试予以檄出至西江峡口怀古感兴两篇寄子琳后篇救子琳穷病也
921106,予以事系御史台狱，狱吏稍见侵，自度不能堪，死狱中，不得一别子由，故作二诗授狱卒梁成，以遗子由，二首 其一
79083,予以壬戌六月十四日入都门癸亥五月十四日去
333912,予以王褒僮约授嗣行叟叟有书抵予并求跛奚移文且云要与僮约作伉俪以此诗戏之
884179,会魏夫人席上命小鬟妙舞曲终求诗于予以飞雪满群山为韵作五绝 其二
109587,予以年事渐髙气海不能熟生煖冷旅中
916355,京师故人有以陇西鹦鹉遗予者因畜养之去年出守缙云提挈而至性灵甚慧触类能言公退玩之常若不足忽遇疾而逝因命瘗于小园作诗一章聊以追悼识者无罪予以贵畜也
510624,梦游衡山遇南极数老人来过却须先生作主与诸老对酌洪崖寿崖在旁歌诗以侑觞合坐皆喜予以诗一首识兴云
530584,平阳四首　时予以吏部谪判平阳 其四
624716,新嘉驿署旧有会稽女子留题三绝悽婉动人予以戊寅暮春过宿其处则壁间之句已磨灭不可复识矣感慨之馀仍和韵吊之 其三
1170999,王十二兄与畏之员外相访见招小饮时予以悼亡日近不去因寄
901361,组以时果供馈予以酒为报
1121031,予以谬作数种并总所奏藁遗参赞高紫微闻以阅读未及赐报平日正病无人为过目者兹不特饷所有别白半生漫浪笔研间为不虚矣因赠二首
995753,贾天锡惠宝薰乞诗予以兵卫森画戟燕寝凝清香十字作诗报之 其三
713330,王川南使君紫诠招同李宫詹山公袁通政密山梁太史药亭蓝山人采饮游灵洲予以事不果往诸公分韵及之仍同游韵八首 其五
463841,予以颈患复发困卧半日始解起看暝色茫茫是有此记
814890,七月初五，夜梦一老人，携登亭台，饮予以酒，命咏二绝。时酒气在喉，残镫映窗，披衣记此
650902,甲辰正月六日继芳邀社予以眩疾不赴诗以申谢
997111,贾天锡惠宝薰乞诗予以兵卫森画戟燕寝凝清香十字作诗报之 其一
168272,予以谬作数种并总所奏藁遗参赞高紫微闻以阅
558484,俞仲学号橘隐来济宁访婿予以橘语戏之
553001,王汉章以博学授英山知县予以其能绳祖武作诗贺之盖汉章曾伯祖内翰公曾祖常博公兄弟相继登博学宏词科有名咸淳间者也
997114,贾天锡惠宝薰乞诗予以兵卫森画戟燕寝凝清香十字作诗报之 其六
958293,相识有遗予以紫石砚者谓是下岩石名曰玉斗予自湖南再转之岭畏行李重滞旧所用委弃不存正以无砚为窘得之喜甚且爱其名捧而戏之曰亚父后尔尚无恙耶为赋此
799220,人皆议少陵绝句为短，予以少陵自不肯为人之所长。若夫古今派别，焉可诬也。杜自云，法自儒家有，心从弱岁疲。或辄以别调目之，是可异已。作二绝句 其二
100267,予以事系御史台狱狱吏稍见侵自度不能堪
948649,邦衡置酒出小鬟予以官柳名之闻邦衡近买婢名野梅故以为对
527076,阁老石淙杨公司空鹤山李公都宪东皋王公为同年之会予以年家子与席奉次石淙公韵二首 其二
930847,予以壬戌六月十四日入都门癸亥五月十四日去国而中有闰月盖相距正一年矣慨然有赋二首 其二
887297,予与子寔避盗同走崆峒予以其年十一月归侍金川踰月而子实走豫章阅三载子实携婉妹归梅川道经旴予自金川侍亲归会之酒酣作是诗以饯别壬辰十一月二十七日
1116550,予以事系御史台狱，狱吏稍见侵，自度不能堪，死狱中，不得一别子由，故作二诗授狱卒梁成，以遗子由，二首
561436,院堂之集予以病不赴次韵答诸公
233131,组以时果供馈予以酒为报
105388,新安潘侯将行约游山门寺予以泞淖遂止因为诗
530583,平阳四首　时予以吏部谪判平阳 其三
713326,王川南使君紫诠招同李宫詹山公袁通政密山梁太史药亭蓝山人采饮游灵洲予以事不果往诸公分韵及之仍同游韵八首 其一
150075,予以四韵记陆大夫三高图自谓能省句矣後作绝
633805,甲寅秋予以乞经从燕台南归留滞白门顿弟在吴门专侍至之住数日去陵阳订其复至白首天涯易散难聚不已之情未欲遽远且天老人住山无力世乱难安相与共依座下此什送之并似六康居士念予亦一编户民也 其二
167812,九日与数客登善福院之绝顶晚饮茗饮阁予以病
960975,番阳张君叔振观予以其家双瑞图俾诗之叔振大参忠定公诸孙也惟忠定公政和八年魁天下某先世实隶其榜今某于叔振令子若凤为同年生世科之契也又何辞虽不能诗谨课二首 其一
689768,予以使事留滞安南安南人费安朗以隐宫给事其国亲贵近臣家老而弥谨预于馆人之役朝夕奉事甚勤拜求作诗恳至再四口占二绝予之一以志予念乡之感一以对景自释焉
567635,予奇梅领之松客有誇予以滇者
634253,甲寅中秋予以乞经留滞长干与诸公偕宿餐云鍊师道院却赠
326419,会魏夫人席上命小鬟妙舞曲终求诗于予以飞雪满群山为韵作五绝
1117754,予以壬戌六月十四日入都门癸亥五月十四日去国而中有闰月盖相距正一年矣慨然有赋二首
571135,戊寅八月送弟铣受室于笋峰宪长伍宋诸婿会于前溪里第菊节寿辰予以事先别敬赋此章
99808,南溪之南竹林中新构一茅堂予以其所处最为深
538758,张山人会于子相芙蓉馆十五年矣子相物故且八年而予以伏阙会山人山人赠予以诗不胜怀旧之感因赋此为赠
538758,张山人会于子相芙蓉馆十五年矣子相物故且八年而予以伏阙会山人山人赠予以诗不胜怀旧之感因赋此为赠
1000148,予以病久不赴朝谒因灸三里穴罢信笔偶书
574567,予以大魁望文玉久矣久屈而伸其在兹乎诗以志别
1053729,诸君送黄仲勉户曹予以事不预遣人送绿杨一枝赠别
838183,长亭怨慢·逸兄避暑匡山，予以事不克偕往，挥汗谱寄
995755,贾天锡惠宝薰乞诗予以兵卫森画戟燕寝凝清香十字作诗报之 其八
1215486,周溪南诸公游龙湖时予以病不偕和溪南韵
302388,上巳日，瘿公集同人十刹海修禊，予以病未至亦补
1110751,会魏夫人席上命小鬟妙舞曲终求诗于予以飞雪满群山为韵作五绝
501499,予以使事留滞安南安南人费安朗以隐宫给事其国亲贵近臣家老而弥谨预于馆人之役朝夕奉事甚勤拜求作诗恳至再四口占二绝予之一以志予念乡之感一以对景自释焉 其二
550115,冬月辰叟有湖上之游归来贻予以诗依韵和之
530582,平阳四首　时予以吏部谪判平阳 其二
494706,参赞紫岩刘公有旨取回京用行在八月末予以祭告先之渡江作此奉赠
884527,渊明以正月五日游斜川时年五十予以正月二日游曹源庵年五十有二矣慨然书示同行
564527,蔡林屋考绩北上别予以诗用韵答二首 其一
584066,与竹塘院长拟登太岳诸峰予以病不果
494822,祁门汪茂才可立久住九华来寿予以太极章答之
950705,予以谬作数种并总所奏藁遗参赞高紫微闻以阅读未及赐报平日正病无人为过目者兹不特饷所有别白半生漫浪笔研间为不虚矣因赠二首 其二
113342,陈吉老县丞同知命弟游青原谒思禅师予以簿领
713328,王川南使君紫诠招同李宫詹山公袁通政密山梁太史药亭蓝山人采饮游灵洲予以事不果往诸公分韵及之仍同游韵八首 其三
916406,予以缙云进士周启明长书呈秘阁黄少卿黄颇叹重作诗六韵美之因次韵和酬
915093,予因集杜句跋杜诗呈监试谢昌国察院谢丈复集杜句见赠予以百家衣报之
533259,李惟寅集诸子贝叶斋予以病不赴
1208625,鉴湖水送乌希说（希说以至元丙子夏由史属代祀北岳济渎南至会稽腊残求赠言适笺尾腊文有鉴湖水之语遂为题赋诗饯之予以至顺癸酉使过绍兴不得一至湖上至今歉然）
884182,会魏夫人席上命小鬟妙舞曲终求诗于予以飞雪满群山为韵作五绝 其四
148593,罗子琳来就广漕试予以檄出至西江峡口怀古感
208605,渊明以正月五日游斜川时年五十予以正月二日
1126868,贾天锡惠宝薰乞诗予以兵卫森画戟燕寝凝清香十字作诗报之
1142460,夜梦入一市井中见有总角道人能相人者往来熟视予久之其语不能记也因授予以一握算筹谩记其事
958251,拟送傅推官吉先予以绍兴己已六月自复徙封吉先后一月到任
538560,于鳞归绝不见客而独见余饮之酒又走使损饷绒褐予以吴丝答之而侑以诗
1122336,番阳张君叔振观予以其家双瑞图俾诗之叔振大参忠定公诸孙也惟忠定公政和八年魁天下某先世实隶其榜今某于叔振令子若凤为同年生世科之契也又何辞虽不能诗谨课二首
997112,贾天锡惠宝薰乞诗予以兵卫森画戟燕寝凝清香十字作诗报之 其四
492618,公文契尚书由参政山西入拜礼部而予以侍郎起于家同日拜命赴南宫今承恩致仕又适同日公文有别业在溧阳予将南还泰和于别也不能以无词焉因赋二律诗为赠 其一
552999,同郡乌先生继善蒙恩还里过濠上待舟留二旬余予以契家周旋无虚日将行着序为赠先生复留诗以别遂用韵以致惓惓并附先生留别诗于后
181728,拟送傅推官吉先予以绍兴己已六月自复徙对吉
673195,予以痼疾申呈当道郁堂谢公不允令就医药视事未能即归和朱文公病中呈诸友韵
799219,人皆议少陵绝句为短，予以少陵自不肯为人之所长。若夫古今派别，焉可诬也。杜自云，法自儒家有，心从弱岁疲。或辄以别调目之，是可异已。作二绝句 其一
229896,寺有四绝一曰灵岩予以赴官获此税鞅赋拙句用
792273,予以直州判加捐州同指分皖省，乡诸君皆惜予不善择官，又不善择地，赋以自解
828667,询先七弟虑予以忧致病数来书问诗以答之
885026,九日与数客登善福院之绝顶晚饮茗饮阁予以病先归赋十二韵
713331,王川南使君紫诠招同李宫詹山公袁通政密山梁太史药亭蓝山人采饮游灵洲予以事不果往诸公分韵及之仍同游韵八首 其六
1155178,有双鹤留在洛中忽见刘郎中依然鸣顾刘因为鹤叹二篇寄予予以二绝句答之 其二
738559,予以康熙辛丑壬寅来热河寓徐文定公半山堂今三十年矣感而有作
434720,予以朝命催租河朔道出隆虑邂逅杨东卿盖栖霞隐人也尝许予小山以地远卒不能致约以后期故作是诗以为定券
633804,甲寅秋予以乞经从燕台南归留滞白门顿弟在吴门专侍至之住数日去陵阳订其复至白首天涯易散难聚不已之情未欲遽远且天老人住山无力世乱难安相与共依座下此什送之并似六康居士念予亦一编户民也 其一
695926,惟敬出次郊园示予以功德寺牡丹之盛辄赋二诗讯之
440408,青玉案  己丑秋九黄山登高后启宇诸君同游合肥，予以故不克往，新河作赤阑桥怀古图，青凤以此调属和
538364,同诸君饯子成怅然有感盖予以前岁是月使归
1001656,罗子琳来就广漕试予以檄出至西江峡口怀古感兴两篇寄子琳后篇救子琳穷病也 其二
661441,澄上人房紫牡丹开觞予以酒因诗以记
307407,湖亭驯象缅王所俸也予以食则跪
995754,贾天锡惠宝薰乞诗予以兵卫森画戟燕寝凝清香十字作诗报之 其九
451887,予以刘子全书事有春申之行，陆子奇捷招饮百乐门酒店，与者秦子子云奚子子夏蔡子希平王子星客及发初覆眉女史，席间分韵得蒲字，戏为长句
218435,予与子寔避盗同走崆峒予以其年十一月归侍金
960974,番阳张君叔振观予以其家双瑞图俾诗之叔振大参忠定公诸孙也惟忠定公政和八年魁天下某先世实隶其榜今某于叔振令子若凤为同年生世科之契也又何辞虽不能诗谨课二首 其二
153494,送邢刍父赴漕试盖予以牒逊之
790107,七月初五，夜梦一老人，携登亭台，饮予以酒，命咏二绝。时酒气在喉，残镫映窗，披衣记此 其二
181836,相识有遗予以紫石砚者谓是下岩石名日玉斗予
1001657,罗子琳来就广漕试予以檄出至西江峡口怀古感兴两篇寄子琳后篇救子琳穷病也 其一
1055842,兼江祥瑛上人能书自以为未工又能诗而求予诗甚勤予以为非所当病也为赋一首勉之使进于道云
152289,六曹长贰观潮予以入直不预晡时大雷雨走笔戏
948153,六曹长贰观潮予以入直不预晡时大雷雨走笔戏蔡子平
884178,会魏夫人席上命小鬟妙舞曲终求诗于予以飞雪满群山为韵作五绝 其一
993336,新安潘侯将行约游山门寺予以泞淖遂止因为诗以见怀
354413,舟经武塘蒋亭彦杜于皇枉过予以行促怅然而别
1191449,劝王氏入贡宠予以官作辞命篇
565033,庚戌仲夏予赴召北上石川张子饯于江浒同舟至金山别去顷复寄予以诗草草依韵附谢二首 其一
494987,甲午三月十八日欧南野司成设会于鸡鸣山凭虚阁予以风阻而返依限韵追和
564528,蔡林屋考绩北上别予以诗用韵答二首 其二
594116,惟敬出次郊园示予以功德寺牡丹之盛辄赋二诗讯之 其二
492619,公文契尚书由参政山西入拜礼部而予以侍郎起于家同日拜命赴南宫今承恩致仕又适同日公文有别业在溧阳予将南还泰和于别也不能以无词焉因赋二律诗为赠 其二
1005927,潘少白前岁惠予零陵石一片方不及尺而文理巧秀有山水烟云之状予以作砚屏始成因赋长吟以遗之
452657,胡僧兄来沪会军持风二中天吴诸兄招饮予以公干故遽不得往因各饮其所及见复饮于云南路山东小馆
950706,予以谬作数种并总所奏藁遗参赞高紫微闻以阅读未及赐报平日正病无人为过目者兹不特饷所有别白半生漫浪笔研间为不虚矣因赠二首 其一
979833,予以四韵记陆大夫三高图自谓能省句矣后作绝句增画笔之妙
1068174,予以王褒僮约授嗣行叟叟有书抵予并求跛奚移文且云要与僮约作伉俪以此诗戏之
1155177,有双鹤留在洛中忽见刘郎中依然鸣顾刘因为鹤叹二篇寄予予以二绝句答之 其一
422787,朝中措 齐学启少将既殉国，其同学友顾一樵为言君少年志气及死事甚详，一樵有诗，予以词悼之
964548,寺有四绝一曰灵岩予以赴官获此税鞅因赋拙句用志其行
624715,新嘉驿署旧有会稽女子留题三绝悽婉动人予以戊寅暮春过宿其处则壁间之句已磨灭不可复识矣感慨之馀仍和韵吊之 其二
459555,是日酒馆饯行，大醉，遂拉薛与共至云溪，更饮肖家。夜半稍醒，二人尚酣然。次日薛当归，予以班不能送，作《贺新郎》留之。及薛归后，再赋《飘风行》以寄
1107993,轻柔杨柳挟春妍孤梗梅花结雪缘此是乾坤大消息相逢切莫说流年此予三十年前赠先见赵太史二绝之一予亦不复记忆矣后三十五年太史访予山中恨诗不存惟为予诵此而亦忘其一竟莫省为何等语也既徵补之且告予以五星之将聚因作二首奉笑
316274,长亭怨慢·逸兄避暑匡山，予以事不克偕往，挥汗谱寄
633984,诸子作病僧诗予以为非有道之病僧光半因请予赋一律
246028,胡僧兄来沪会军持风二中天吴诸兄招饮予以公干故遽不得往因各饮其所及见复饮于云南路山东小馆
928382,予以淳熙戊戌岁自蜀归时年五十四今三十有二年矣犹复强健得小诗自贺
982372,客有遗予以假山石盆池者闻陈元发有石菖蒲作此诗乞之
884181,会魏夫人席上命小鬟妙舞曲终求诗于予以飞雪满群山为韵作五绝 其五
514029,贡士佐时生子弥月予适至焉初予以诗寿新安千户于翁八十翁以锦帕为谢因以遗儿用为远寿之徵
920290,南溪之南竹林中，新构一茅堂，予以其所处最为深邃，故名之曰避世堂
514071,宿坑口孙启先生家次韵时予以疾戒饮故诗及之
35316,劝王氏入贡宠予以官作辞命篇
192634,予以缙云进士周启明长书呈秘阁黄少卿黄颇歎
997110,贾天锡惠宝薰乞诗予以兵卫森画戟燕寝凝清香十字作诗报之 其七
620509,二月六日友人返白沙时予以试事归
451914,南宋太庙龙瓦烧痕犹在，予以六百金得之百川印象兄
490335,许云村给事崔石洲总戎同游觉林寺投予以诗次韵用答
331098,庚午重九予以忧患经此节物亦强举杯复同坐客步至陈氏水阁率尔成韵
842737,湖亭驯象缅王所俸也予以食则跪
939091,重九后一日同公美游灵泉公美举示莲塘纳凉之句后公美和予浮桥观月之韵纪灵泉之游予以老人不快不暇即赋老人既安用渠纳凉韵为谢
1001101,汪?惇仁教授即官舍作斋予以独冷名之
713333,王川南使君紫诠招同李宫詹山公袁通政密山梁太史药亭蓝山人采饮游灵洲予以事不果往诸公分韵及之仍同游韵八首 其八
204296,君复处士栖大师夙有玩月泛湖之约予以卧病致
1139297,予以甲寅冬过弋阳石桥戊辰正月重过
253448,予以朝命催租河朔道出隆虑邂逅
383938,二月六日友人返白沙时予以试事归
704275,阁老石淙杨公司空鹤山李公都宪东皋王公为同年之会予以年家子与席奉次石淙公韵二首
687454,庚戌仲夏予赴召北上石川张子饯于江浒同舟至金山别去顷复寄予以诗草草依韵附谢二首
527424,六子诗六子者皆当世名士也予以不类得承契纳辅志励益者多矣病归值秋寤叹中夜有怀良友作六子诗
872274,轻柔杨柳挟春妍孤梗梅花结雪缘此是乾坤大消息相逢切莫说流年此予三十年前赠先见赵太史二绝之一予亦不复记忆矣后三十五年太史访予山中恨诗不存惟为予诵此而亦忘其一竟莫省为何等语也既徵补之且告予以五星之将聚因作二首奉笑 其一
828423,戴文节公遗砚刻梅花一树萦绕四周左侧镌鹿床居士制五字微有损文予以廉价得之铭其背曰质损而神完犹取义而仁全世皆弃而苍虬所专昔文节以书有破体不为宣宗所喜又为穆相彰阿画山水便面未设色穆以为轻己遭谗斥退后居杭州殉粤匪之难予有感于公之遗事为作此诗
1080956,予以年事渐高气海不能熟生煖冷旅中又无药物遂用火攻之策灼艾凡二百壮吟呻之际得诗二十韵
995752,贾天锡惠宝薰乞诗予以兵卫森画戟燕寝凝清香十字作诗报之 其十
921107,予以事系御史台狱，狱吏稍见侵，自度不能堪，死狱中，不得一别子由，故作二诗授狱卒梁成，以遗子由，二首 其二
520316,弘治癸丑予以足疾未瘳倦于医居恒忽忽或有进者曰去城之西三百里太白山之下有泉曰凤泉去城之东百馀里曰石门亦有汤泉去城之东北六十里曰骊山亦有温泉浴其水者痼疾皆愈予闻而异之曰有是哉第以守藩不敢专出入乃遣使上告于天子天子许之予拜命踊跃不敢烦有司自饰具以往感恩志喜因有一律纪之其诗云
687019,公文契尚书由参政山西入拜礼部而予以侍郎起于家同日拜命赴南宫今承恩致仕又适同日公文有别业在溧阳予将南还泰和于别也不能以无词焉因赋二律诗为赠
585683,承陈瑞山侍御閒顾江门钓台次石翁韵留诗将还朝也予以奉赠 其二
687526,蔡林屋考绩北上别予以诗用韵答二首
703961,平阳四首　时予以吏部谪判平阳
702176,承陈瑞山侍御閒顾江门钓台次石翁韵留诗将还朝也予以奉赠
330903,羊荆华敞小轩面丛竹予以细香名之盖用杜子美风吹细细香之句因赋此诗
1070913,羊荆华敞小轩面丛竹予以细香名之盖用杜子美风吹细细香之句因赋此诗
962130,余居苕溪上，与白石洞天为邻。潘德久字予曰：白石道人且以诗见畀。其词曰：“人间官爵似摴蒱，采到枯松亦大夫。白石道人新拜号，断无缴驳任称呼。”予以长句报贶
530581,平阳四首　时予以吏部谪判平阳 其一
1193894,有双鹤留在洛中忽见刘郎中依然鸣顾刘因为鹤叹二篇寄予予以二绝句答之
528386,沈逸士来自吴下能诗善鼓琴间投篇什见讯顾馆于城中予以病不得造乃作此诗招致敝庄
812888,人皆议少陵绝句为短，予以少陵自不肯为人之所长。若夫古今派别，焉可诬也。杜自云，法自儒家有，心从弱岁疲。或辄以别调目之，是可异已。作二绝句
997109,贾天锡惠宝薰乞诗予以兵卫森画戟燕寝凝清香十字作诗报之 其五
1022055,君复处士栖大师夙有玩月泛湖之约予以卧病致爽前期因为此章聊以道意
1208645,予以延祐元年从先兄正献公入汴始识彦辉吴徵君是岁故中丞马公伯庸今翰林学士谢公敬德国子博士王君师鲁乡贡河南行省迄今二十五年予再以按行至汴居监察行院去徵君所居仅半里犹以公事未毕尚迟于请见时马公亦薨谢王在馆阁感念存殁赋唐律一首先遣持遗徵君正之（至元四年戊寅）
713329,王川南使君紫诠招同李宫詹山公袁通政密山梁太史药亭蓝山人采饮游灵洲予以事不果往诸公分韵及之仍同游韵八首 其四
187454,番阳张君叔振观予以其家双瑞图俾诗之叔振大
538142,明卿过子相邀予以召客不赴闻二子有作赋此
448961,临江仙 中秋日荻老约余作追月之会予以迩时早睡不赴因以小词戏答并示诸公
585682,承陈瑞山侍御閒顾江门钓台次石翁韵留诗将还朝也予以奉赠 其一
