81426,和范舍人病後二诗末章兼呈张正字
596868,梦观灯赋诗末联由俗物败意而罢醒后足之忆录以纪异
652037,怀李廷圭用前诗末句起韵并书于壁
1117887,和范舍人病后二诗末章兼呈张正字
1007913,伋再和史君前诗末章闻已再乞宫祠伋居在远郊不获同州人致挽留之词复用前韵
1083051,和元诗末篇之意二绝寄友人 其一
151498,伋再和史君前诗末章
993690,张王臣自湖南官满趋朝舟过白沙和惠资福二诗末章见及次韵 其一
935230,无咎兄郡斋燕集有诗末章见及敬次元韵
1126594,张王臣自湖南官满趋朝舟过白沙和惠资福二诗末章见及次韵
849846,郑昂叔和余问盗诗末及山东事弟侄辈又问山东本末再用前韵答之
364804,莆田杂诗·末丽娟娟妒
367165,和元诗末篇之意二绝寄友人
81427,和范舍人病後二诗末章
1083052,和元诗末篇之意二绝寄友人 其二
241888,挽诗·末绪惭非偶
632735,阅未央遗集有初夏同予入循州访刘乃运兄弟诗末云令威他日归华表定在循州古树边似为予今日谶也因和其韵
935985,和范舍人病后二诗末章兼呈张正字 其二
993689,张王臣自湖南官满趋朝舟过白沙和惠资福二诗末章见及次韵 其二
171245,郑昂叔和余问盗诗末及山东事弟侄辈又问山东
522080,荐溪宫谕省觐归赋诗末就而别八月七日礼部南斋独坐怅然有怀足成奉寄
1121481,和元诗末篇之意二绝寄友人
82450,无咎兄郡斋燕集有诗末章见及敬次元韵
932446,和范舍人病后二诗末章兼呈张正字 其一
