64797,郑翰卿自新安移家金陵诗
303605,舜卿自比国寄诗来依韵答之
1144399,送留君玉高云卿自江阴迁松江四绝
539116,予与自闽明卿自贵同日书至有感 其一
138802,和陈义卿·自顾迂疏不入时
572024,彭长卿自武陵至公安游甚困便欲由梁之鲁入都歌以送之
616049,陈明卿自吴门见访诗以别之
574559,董感恩道卿自兰溪来访致枫山章公手书诗以谢之
591954,吴明卿自闽至寒夜同集吴约卿谒舍得明字
429141,舜卿自比国寄诗来依韵答之
1035139,题尹商卿自信斋
683513,予与自闽明卿自贵同日书至有感
545042,喻明府邦相新至邑适康山人裕卿自虔州还雁宕过访同集署中分韵得杯字
472649,郑翰卿自新安移家金陵诗以讯之
1002012,送马少卿自广东漕易江西宪
866287,送丁少卿自桂帅移镇西蜀
1001283,代墨客卿自赋赠安城彭云翼 其二
533173,明卿自闽至晤于吴约卿官舍
591866,吴约卿自邯郸回同惟敬过讯留酌因览张助甫诸诗
971890,游叫岩用范元卿自普康归日留题韵
1001284,代墨客卿自赋赠安城彭云翼 其一
533155,约卿自北岳回以庙碑见贻
230408,送丁少卿自桂帅移镇西蜀
1127795,代墨客卿自赋赠安城彭云翼
139842,题尹商卿自信斋
1179133,与洪孺卿自梁州回途中经骆谷见野果有闽中悬壶子即同采摘因呈之洪亦闽人
1139070,送留君玉高云卿自江阴迁松江四绝 其三
148466,代墨客卿自赋赠安城彭云翼
236691,此君室·问卿自用卿
539117,予与自闽明卿自贵同日书至有感 其二
1002082,题朱虞卿自懒
1138747,送留君玉高云卿自江阴迁松江四绝 其二
1138748,送留君玉高云卿自江阴迁松江四绝 其一
1042104,喜春卿自陜归
148964,题朱虞卿自懒
1036799,吴歈一首送丘宗卿自平江移会稽
562735,袁仪卿自征播归
1138746,送留君玉高云卿自江阴迁松江四绝 其四
569660,伯承少卿自报国寺分手二十五年矣虽讯问不废而笑谈永隔今岁初夏复有一诗见遗聊尔奉答
388148,答明卿·自汝移金马
123046,吴歈一首送丘宗卿自平江移会稽赠寿老
575122,杭太仆东卿自滁阳以诗来慰次韵答之
796467,菩萨蛮 喜蔼卿自毗陵归
240249,挽孙少卿·自抛襴苧列簪绅
224167,挽朱倅周卿·自洒膏粱习
533154,约卿自邯郸回同桢伯过讯留酌出示张助甫所寄书
149066,送马少卿自广东漕易江西宪
569958,明卿自楚驰信相问云秋后当访我金陵以一诗贺儿骐豋第以六诗苦旱答之
541913,闽中兵宪徐子与黔南学宪吴明卿自都下相别历二十年矣孟春癸夘夜予梦二君话旧既寤仍梦同渡漳河吊古因思社友存殁相半悲哉
366346,喜春卿自陜归
98212,游叫岩用范元卿自普康归日留题韵
185519,送留君玉高云卿自江阴迁松江四绝
