147598,镇江别总领吴道夫侍郎时愚子琦来迎侍朝夕催
608688,还至胥江顺庆儒懿嘉贞恭慈国诸侄来迎 其二
513762,早发湖乐镇过黄木岭遇佐时及乡人来迎
608687,还至胥江顺庆儒懿嘉贞恭慈国诸侄来迎 其一
762008,女孙于归有日，途梗未通，曾蓝田总戎适携少君来迎，喜赋
563811,归途有僧自望华亭来迎且请诗
650087,驾发沙岭度阳河沿边父老来迎和黄中书韵
103389,闰三月八日淮上遇风杜挺之先至洪泽遣人来迎
809545,北藩诸部君长来迎
948914,陈宰有诗来迎次韵
659944,舟至直沽长子正来迎喜而有作时正自家来省先还至德州闻予得请复来迎也
659944,舟至直沽长子正来迎喜而有作时正自家来省先还至德州闻予得请复来迎也
515242,过会里遐富渡宗孙希周来迎
141621,满江红·竹马来迎
1005170,丙子兵祸台温为烈宁海虽经焚掠然耕者不废丁丑粗为有秋但种秫者少以醉人为瑞物吾亦似陶靖节时或无酒雅咏不辍也八月初九日连日雷雨溪路阻绝山房岑寂此夕初霁浊酒新漉数酌竟步秋树阴潭鱼可数望前峰老枫数十株已无色白鸟飞翻去来是中有惠崇大年笔家人遣两力来迎因倒坐篮舆而归人或问之戏答曰吾日莫途远故倒行也记以三绝 其一
1005168,丙子兵祸台温为烈宁海虽经焚掠然耕者不废丁丑粗为有秋但种秫者少以醉人为瑞物吾亦似陶靖节时或无酒雅咏不辍也八月初九日连日雷雨溪路阻绝山房岑寂此夕初霁浊酒新漉数酌竟步秋树阴潭鱼可数望前峰老枫数十株已无色白鸟飞翻去来是中有惠崇大年笔家人遣两力来迎因倒坐篮舆而归人或问之戏答曰吾日莫途远故倒行也记以三绝 其三
605086,移家羊城道路戒心帅府以帐下戈船来迎自榕水至珠海遂获利涉赋而谢之
1033880,镇江别总领吴道夫侍郎时愚子琦来迎侍朝夕催归甚切
798240,薄媚摘遍 前词甫脱稿，闻竹樵方伯行至安肃，笙鹤来迎，为之投笔泪下，因又成一首嗣后，词兴阑珊矣
682416,还至胥江顺庆儒懿嘉贞恭慈国诸侄来迎
1093430,送履常中州买渔艇归半溪二三友放溜来迎
277130,六月十日晓泊神户志成诸公来迎郑君祝三有诗见赠次韵奉答
992257,闰三月八日淮上遇风杜挺之先至洪泽遣人来迎
1005169,丙子兵祸台温为烈宁海虽经焚掠然耕者不废丁丑粗为有秋但种秫者少以醉人为瑞物吾亦似陶靖节时或无酒雅咏不辍也八月初九日连日雷雨溪路阻绝山房岑寂此夕初霁浊酒新漉数酌竟步秋树阴潭鱼可数望前峰老枫数十株已无色白鸟飞翻去来是中有惠崇大年笔家人遣两力来迎因倒坐篮舆而归人或问之戏答曰吾日莫途远故倒行也记以三绝 其二
233536,寿赵泉使·来迎父老喜相扶
608689,还至胥江顺庆儒懿嘉贞恭慈国诸侄来迎 其三
787399,送子乔移官苍梧，至陆云界，去年叔白来迎处
370285,送履常中州买渔艇归半溪二三友放溜来迎
152244,陈宰有诗来迎次韵
269002,女孙于归有日，途梗未通，曾蓝田总戎适携少君来迎，喜赋
373872,喝石岩·皓首来迎宴坐师
468459,舍弟原仁以驴车自太原来迎我于真定
493233,下北岩适举正鹏举自溪上来迎道中赋此
276458,送子乔移官苍梧，至陆云界，去年叔白来迎处
1128341,丙子兵祸台温为烈宁海虽经焚掠然耕者不废丁丑粗为有秋但种秫者少以醉人为瑞物吾亦似陶靖节时或无酒雅咏不辍也八月初九日连日雷雨溪路阻绝山房岑寂此夕初霁浊酒新漉数酌竟步秋树阴潭鱼可数望前峰老枫数十株已无色白鸟飞翻去来是中有惠崇大年笔家人遣两力来迎因倒坐篮舆而归人或问之戏答曰吾日莫途远故倒行也记以三绝
1038709,兴州长举县西二十里阁道立表曰飞石阁告往来者急度勿停予赴益部兴州将吏来迎皆至长举因访老吏飞石之状云昔尝有之亦飘风暴雨之时也予望山顶皆已垦耕而行人熟虚名至是皆驰过因成一绝
