539158,欧祯伯自岭南寄书经岁始达时已谒公车矣
355855,戏题郭慎求所寄书尾
364568,王正仲林子中联舟西上过睢阳寄书率尔成诗为报
61209,张玄超自海上寄书问连城生消息
882971,答成都虞子韶钤干寄书信兼示近作
830524,驻南安郡城得京师寄书奉答
60887,邻有戍将未归观其家人寄书为述所怀
783965,闻立亭言梅澥寄书问都中诸友音耗感而赋此
703504,弼臣病阻白门两次寄书并诗因成二章兼次其韵
1041545,寄书
521876,十二月一日寄书天彝有感用煮茶韵
1085182,刘长方自豫章寄书称砮焦蛎房之美恨未知味书一绝以寄之
632574,弼臣病阻白门两次寄书并诗因成二章兼次其韵 其一
49246,山中答武康徐高士寄书
1042243,寄书
366059,寄书·区脱逢归驿
763882,减字木兰花 其一 寄书
470317,寄书曲
323348,寄书与二叔二弟
703513,雪公寄书入山偶成二律
632675,雪公寄书入山偶成二律 其二
286047,寄外·寄书万里祝加餐
980557,忽蒙秀实内黄贤尉寄书期许稠至有经世之语辄代书为谢
321624,刘长方自豫章寄书称砮焦蛎房之美恨未知味书一绝以寄之
1103628,春日寄书代乡人答
939483,寄书上人
632223,孟贞寄书不至
881146,春闺杂咏 寄书
1163232,荅知己自阙下寄书
922323,过于海舶，得迈寄书、酒。作诗，远和之，皆粲然可观。子由有书相庆也，因用其韵赋一篇，并寄诸子侄
379872,送束申甫任江陵教因寄书台时录荆之广西宪幕
728569,送入我门来  寄书
813868,减字木兰花 寄书
974167,顷见迂斋谈游子明不容口且诵其诗恨未遂倾盖之愿前年一见既慰我心所恨俱匆遽不得款语近过迂斋闻寄书又复访问死生顾屏窜林壑逃死无日何以辱盛意如此辄成一诗奉寄
1000077,箧中得调官时杨氏所寄书慨然追感
356261,减字木兰花·寄书
189337,寄书·岁月逡巡笑故吾
230947,湖州李使君闻予游庐山寄书云为我一谢清绝
329007,余避地踰岭寄书宜章孙氏贼去则尽失之感叹有作
305398,蛰云表兄避地侍养近寄书云为加沙一集皆栩园唱酬之作病
485491,过黄耳墓有感（陆士衡在洛被祸时，寄书犬也。墓在华亭南）
954064,谷正至始得先所寄书及诗不胜喜慰因书数韵奉酬圣俞
227685,铁冠道士寄书
1055886,秦太虚寄书云想君在毗陵广坐中白眼望青天也因录此语为寄兼简诸君
757814,蝶恋花 每寄书素庵不到有感
1149101,凭李忠州寄书乐天
1172017,早秋京口旅泊章侍御寄书相问因以赠之时七夕
96478,寄李舒州·剩欲寄书兼寄诗
276533,刘明府正孚都门寄书，并新订诗卷，报以短韵
1225146,严陵应仲章自杭寄书至赋此答之
1213770,张叔纪自燕寄书赋此以答
368301,王立之寄书言其子阿宜渐学作诗及问余稚子梦玉安否作诗奉戏
450337,临江仙二十首 其十 寄书
996232,辱粹道兄弟寄书久不作报以长句谢不敏
542371,答宋鸿胪仁甫寄书
806853,好事近 丙辰早春得云间张洮侯寅冬所寄书
675258,答顾全州华玉寄书
1085684,寄书与二叔二弟 其一
632674,雪公寄书入山偶成二律 其一
323543,酬林明仲寄书并长篇
493565,七月一日得大兄去年九月寄书来其午魏直夫来自京师闻大兄哀讣而未领家问是夕灯下且信且疑辄赋绝句以写悲怆
103224,正阳驿舍梦郑并州寄书开之即三山图也
1079955,余避地踰岭寄书宜章孙氏贼去则尽失之感叹有作
1085685,寄书与二叔二弟 其二
673586,谢祭酒林亨大寄书
833130,浪淘沙 良乡道中读子珍寄书，悢然有怀，为成是解
203528,寄书·一书欲写寄云鬟
17110,凭李忠州寄书乐天
54236,竹枝词·南濠有客寄书还
1196107,孟君别后相续寄书作此酬之
913666,谢江东耿漕曼老寄书并与沈侍郎唱和诗二首 其一 谢诒书劳苦
1073708,修上人以楞严圆觉二经见寄书六言一偈
582060,从弟亚夫进士自南安寄书至喜而赋此寄京答之
1062638,王立之寄书言其子阿宜渐学作诗及问余稚子梦玉安否作诗奉戏
67127,美人寄书
575381,寄书
497177,春日端居谢都尉寄书至却报
481624,九日喜家人寄书至秉常相过问慰与之共饮至醉述怀有作斐然成章
623159,连近城自端水寄书言别诗以答之
413319,虚传寇至以方粲秋所寄书简五十五通装为一帙寄还之媵以长句
727737,踏莎行 寄书
1212413,责友人久不寄书
54397,九日喜家人寄书至秉常相过问慰与之共饮至醉
49205,江上寄书
492944,余归自南京承永新欧阳子韶寄书辄赋奉答
369456,春日寄书代乡人答
474007,张玄超自海上寄书问连城生消息
216725,哭十侄·到官六月寄书回
61548,寄书曲·行人促家信
327403,寄林择之·故人千里寄书来
25400,塞上蒙汝州任中丞寄书
429801,蛰云表兄避地侍养近寄书云为加沙一集皆栩园唱酬之作病山苍虬诒重及韬庵太夷二老率有和章要余次韵
172621,寄书上人·阶前春色长苔斑
999543,上高明府孙世则寄书及诗依韵和酬
97476,五诗寄·自往一寄书
572087,河间逢北去人寄书口号
217760,咏歌·久闻山僧寄书觅
1091637,梦与辛幼安遇于一精舍予赋诗一篇觉而记其卒章云它年寄书处当记卢仝穷因赋此诗寄之
1070570,戏题郭慎求所寄书尾
364464,悼杨公缊·寄书曾未报
1004015,去岁重阳日得彦威信附六月间二小侄及从弟侄所寄书自蜀阃递中附至历言去冬今春所遭兵祸及有司督迫科调之苦喜其存全哀其窘蹙洒涕如霰寄讯邀其下峡而边事又告急未知其达与否也会杪冬见邸报宣谕使者余公侍郎改命授钺尽护蜀师意欲以此事归控骨肉会聚兹事其谐矣喜极涕零遂成长篇
755280,酬外子凤阳道中寄书
22877,早春阁下寓直萧九舍人亦直内署因寄书怀四韵
337778,寄书后作·几度题书客未还
482025,邻有戍将未归观其家人寄书为述所怀
991906,正阳驿舍梦郑并州寄书开之即三山图也
1084403,读孙子尚旧所寄书
350666,踏莎行·寄书
93908,谢江东耿漕曼老寄书并与沈侍郎唱和诗谢诒书
158385,箧中得调官时杨氏所寄书慨然追感
6862,早秋京口旅泊章侍御寄书相问因以赠之时七夕
573381,陶石篑寄书
1105676,寄书与二叔二弟
387342,浪淘沙·良乡道中读子珍寄书，悢然有怀，为成是解
158397,上高明府孙世则寄书及诗依韵和酬
1240000,山中答武康徐高士寄书
787534,刘明府正孚都门寄书，并新订诗卷，报以短韵
354288,陈宗之叠寄书籍小诗为谢
1085299,酬林明仲寄书并长篇
532670,酬李伯华寄书
906574,铁冠道士寄书
277626,定风波·云君病中属儿辈寄书促归，因赋此以慰之
757866,踏莎行 寄书
457873,一日，安徒生之美人鱼遇漆园吏之曳尾龟，乃相与谈。其言鱼嚏鳖咳，盖不能悉。鱼陋龟之无文也，诺为之寄书，而请其友鲛人代购之。鲛人者，中文版之美人鱼也。龟得书，欲以诗相谢，而自顾龟爪短拙，不能捉笔，转请诸碰壁斋。碰壁斋才尽，然感二鱼之义，且与龟同出庄子之门，于是强头咬牙，硬拼蛮做，终焉成章。龟受而读之，摇头摆尾，团团自转，不胜其雀跃云。诗曰
380746,兰陵王·江上逢北使寄书和清真
102693,过于海舶得迈寄书酒作诗远和之皆粲然可观子
298014,先生自费城寄书有吾其左衽矣之叹占此奉告
283951,虚传寇至以方粲秋所寄书简五十五通装为一帙寄还之媵以长句
485562,江上寄书
1141912,送束申甫任江陵教因寄书台时录荆之广西宪幕
824391,定风波 云君病中属儿辈寄书促归，因赋此以慰之
960295,寄书
473626,美人寄书
1037022,答薛绍彭寄书
913667,谢江东耿漕曼老寄书并与沈侍郎唱和诗二首 其二 谢唱和佳句
523764,寄书
35129,孟君别后相续寄书作此酬之
108945,送胡季昭·频寄书回洗我愁
637357,谢江西旧同寅寄书
946862,湖州李使君闻予游庐山寄书云为我一谢清绝
96108,寄彭元思·忆昨寄书今几日
1115779,谢江东耿漕曼老寄书并与沈侍郎唱和诗二首 谢诒书劳苦
760967,兰陵王 江上逢北使寄书和清真
150154,忽蒙秀实内黄贤尉寄书期许稠至有经世之语辄
184231,答成都虞子韶钤干寄书信兼示近作
820248,明月满扬州 寄书
42972,寄书·香茗才情
681666,同寅寄书以诗代答
1097505,陈宗之叠寄书籍小诗为谢
1043457,王正仲林子中联舟西上过睢阳寄书率尔成诗为报
37990,答知己自阙下寄书
533154,约卿自邯郸回同桢伯过讯留酌出示张助甫所寄书
1045014,谢吕帅寄书
151523,子忱崇道吏部寄书问讯并寄药物适当风雨夕长
1192751,塞上蒙汝州任中丞寄书
512088,予来滇南一载始得寄书人便书成特附四韵楮尾
827951,贻先弟见予戒坛松诗遂梦至戒坛见松高数丈涛声如雷惊寤寄书相告并感怀四首走笔和之
187790,见寄·书贤从事我非刘
1099563,寄书后作
556858,寄书
138188,谷正至始得先所寄书及诗不胜喜慰因书数韵奉
1174330,早春阁下寓直萧九舍人亦直内署因寄书怀四韵
114674,辱粹道兄弟寄书久不作报以长句谢不敏
457925,谢友人寄书
146578,韩木·康成迹寄书带草
558310,广东孙寿九龄寄书至
632575,弼臣病阻白门两次寄书并诗因成二章兼次其韵 其二
1007911,子忱崇道吏部寄书问讯并寄药物适当风雨夕长句代谢
316597,酬严霜·羊城有客寄书来
565133,寄书京中故人
