938941,火田郑次山贫士也家有燕坐之处五为赋之 槁木寮
514628,和镜川学士东阁静坐之什
44290,方巡视残菊宗武示晓起独坐之作因次和
818380,方巡视残菊宗武示晓起独坐之作因次和
801440,次和荃谷寒夜独坐之作
939115,火田郑次山贫士也家有燕坐之处五为赋之 寓意轩
977424,登舟客有诵杜诗春水船如天上坐之句因成一绝
137855,圣俞在南省监印进士试卷有兀然独坐之叹因思
939112,火田郑次山贫士也家有燕坐之处五为赋之 岁寒谷
937804,宴坐之地籧篨覆之名曰蓬斋
939114,火田郑次山贫士也家有燕坐之处五为赋之 隐窝
110180,登舟客有诵杜诗春水船如天上坐之句因成一绝
180799,宴坐之地籧篨覆之名曰蓬斋
743264,答莲裳芙初夜坐之作
918774,江城子 其一 葛使君示书，有元夕寒厅孤坐之叹。昨日石林寄示所和长短句，辄亦次韵和呈，因以自见穷寂之态
939113,火田郑次山贫士也家有燕坐之处五为赋之 观省斋
1001548,会昌小岘亭有碑侍郎陆公作也今通守盖公之孙乃发家传为南斋宴坐之计敬酬见教
953643,圣俞在南省监印进士试卷有兀然独坐之叹因思去岁同在礼闱慨然有感兼简子华景仁
