1083145,吴骏卿寄示和黄元广诗多及古人为己之学辄复次韵资一大笑兼简元广 其三
569802,汝师语次多及时事民瘼慨然有感复成一首
570047,世贞迩来寿九十翁如骆司理杜金二处士皆由白香山起语今年为宗履湖先生九十复引前例寿之先生之伯子故吏部子相余硕交也故中联多及之
826206,兰陵王·用清真韵。湖帆出示金吉金红梅画轴，内有朱古微、王右遐诸公题词，皆感时之作，复多及景阳宫井事，辄题此阕，用遣新愁
866705,游石龙偶成寺僧通首坐饱历丛林归老此山故诗多及之
996717,次韵答常甫世弼二君不利秋官郁郁初不平故予诗多及君子处得失事
978458,再用韵酬陈秘校来诗有击楫清中原之志故中间多及之
1083143,吴骏卿寄示和黄元广诗多及古人为己之学辄复次韵资一大笑兼简元广 其一
1110686,吴骏卿寄示和黄元广诗多及古人为己之学辄复次韵资一大笑兼简元广
1139120,清明日偕赵云壁张仲实顾伯玉张见山游分韵得好字以百家衣补之赵故嘉禾宰今为学官坐中多及学校事
1083144,吴骏卿寄示和黄元广诗多及古人为己之学辄复次韵资一大笑兼简元广 其二
199937,次韵程愿以十诗见示篇中多及故起居舍人程子
978720,次韵程愿以十诗见示篇中多及故起居舍人程子山老懒姑取其一用韵答之
