471410,答丁右武稍迁南仆丞怀仙作
691133,新迁南庄，喜友人送菊，用李中麓次唐荆川咏菊韵二首
385270,送何少宰左迁南京工侍
539111,送少宰刘公宪谦迁南大司空
1078259,季夏之初自安国迁南台天宁寺依南山而面北暑气尤盛暇日望山顶松林郁然意必有异因穴垣凿磴以造其上形势坦平风日清美四顾山峦环合江潮往来景物不可模状月出林表清光更多夜久阒寂殆非尘世作古诗二十韵以纪其事奉呈巽达元仲
1216999,王继学廉使迁南台侍史诗以贺之
668605,送何少宰左迁南京工侍二首 其二
575546,送欧廷评仑山迁南工部 其四
567629,送某公迁南户部
575544,送欧廷评仑山迁南工部 其二
615003,喜陈茹连国子迁南宪幕
683022,送何少宰左迁南京工侍二首
700748,送欧廷评仑山迁南工部
526800,同年郁希正与予同谪开州希正迁南京户部偶诵水东日记所载先生送别诗谓其词意悲感闻者流涕因索予和漫为赋此词语高妙何敢望前人至于情之可悲则固有甚焉者矣观者略其词而取其情可也
638856,赠林仰之迁南京国子监丞
118282,画山水横卷·我昔得罪迁南夷
575543,送欧廷评仑山迁南工部 其一
614925,施羽王以书附乃弟卫幕枉讯兼闻其迁南司业赋此却寄
569763,荅魏大侍御时自谪迁南考功
639317,新迁南庄，喜友人送菊，用李中麓次唐荆川咏菊韵二首 其一
538026,送汪光禄迁南京尹
1041533,迁南行
668604,送何少宰左迁南京工侍二首 其一
639318,新迁南庄，喜友人送菊，用李中麓次唐荆川咏菊韵二首 其二
600577,送欧桢伯大理迁南工曹
388508,送汪光禄迁南京尹
581780,送蔡从善中舍迁南畿刑曹郎便道归天台省亲
51664,答丁右武稍迁南仆丞怀仙作
575545,送欧廷评仑山迁南工部 其三
