368243,赵倅赋喜雪诗为黄堂颂黄堂和韵传示僚属众因续貂
1216149,初秋同杨国贤太监耀珠巴戬少监子贞监丞暨僚属重汎湖游西山
1205946,七月七日同宋显夫学士暨经筵僚属游上京西山纪事二首 其二
972749,李通判休日约僚属追凉于净因已复酌于芙蕖馆既题名于寺之壁为赋唐律
515834,归朝欢 漳守陈公洪谟有捕寇功膺奖劳之典僚属乞词以贺
155644,侍御宴僚属于番江楼以卧病不克与分韵得四字
1205945,七月七日同宋显夫学士暨经筵僚属游上京西山纪事二首 其一
184140,冬日北庭怀馀杭旧僚属
199775,寄李悦夫时监成都军资库茶马司檄兼僚属闻近
999305,侍御宴僚属于番江楼以卧病不克与分韵得四字
545647,王贞伯总戎曹能始计部偕僚属并游胡氏园亭昏黑言旋二君更衣拉余痛饮申旦时张中贵为主人
978805,寄李悦夫时监成都军资库茶马司檄兼僚属闻近治胥吏数辈
909214,春日领僚属游龙隐岩
588981,秋日同僚属登声远楼
515833,水调歌头 郡守张白斋入觐僚属乞词为赠
1236503,七月七日同宋显夫学士暨经筵僚属游上京西山纪事二首
95129,李通判休日约僚属追凉于净因已复酌于芙蕖馆
164368,春日领僚属游龙隐岩
490944,东轩对菊与僚属晚坐
891770,会僚属赏海棠偶有题咏
1058366,道守董公重成寇公楼集宴僚属因赋长句
577013,圣驾幸北京率僚属父老郊迎
501016,龙凤己亥秋九月上於建龙关仪凤楼杂写金陵山川六处命僚属各赋绝句走笔立成
494957,即座次韵和桂洲公夏日试就职贡士有感示僚属兼慰诸生之作
1098198,赵倅赋喜雪诗为黄堂颂黄堂和韵传示僚属众因续貂
30199,览晋史·齐王僚属好男儿
922959,冬日北庭怀馀杭旧僚属
138700,会僚属赏海棠偶有题咏
1084962,三月晦日邵宪宴僚属于西园某与焉赵提干即席赋诗次韵
894488,去年三月禊饮池上岁月易得忽复暮春因再宴僚属作
