601779,清远道中朱荆玉携酒同弟学张懋纬承宰承藻承衮送至东林寺
473822,张太学载酒同刘侍御彭秀才石佛院看芍药因怀龙湾徐太守
1074044,斗酒同小诗送杨君圣四绝 其三
162896,浣溪沙·寿酒同斟喜有馀
975780,次韵衡山徐监酒同考府学试八首 其二
677452,欧阳文朝载酒同访康东沔先生龙洲园居和作
592004,雷比部携酒同古比部夜过得何字
763632,念奴娇 其九 “念奴娇·舟中携酒同西樵送荔裳入都”
132313,次韵衡山徐监酒同考府学试
1074045,斗酒同小诗送杨君圣四绝 其四
974788,次韵衡山徐监酒同考府学试八首 其七
55687,姚山人携酒同过陆园看梅花
707591,满庭芳　　道场山麓，太白山人亭成吴园次置酒同诸子分韵得人字
250884,吴镇·雁鹜为盟酒同倾
57029,张太学载酒同刘侍御彭秀才石佛院看芍药因怀
1124420,次韵衡山徐监酒同考府学试八首
974790,次韵衡山徐监酒同考府学试八首 其五
593150,贞吉携酒同宗良孔阳再饯滕王阁得筵字
974792,次韵衡山徐监酒同考府学试八首 其三
593155,子深用晦携酒同宗良孔阳饯送分得书字
1110530,斗酒同小诗送杨君圣四绝
740112,文园三兄载酒同游龙井作
618525,春日载酒同诸子过友人赏牡丹四首 其一
618528,春日载酒同诸子过友人赏牡丹四首 其四
593209,陈忠甫携酒同梁孔适夜过
1074043,斗酒同小诗送杨君圣四绝 其二
1204858,摸鱼儿 次郭子敬祭酒同赏牡丹韵
1084360,有客赠酒同舍终夕尽欢复用前韵
1157557,晓上天津桥闲望偶逢卢郎中张员外携酒同倾
593149,宗良孔阳携酒同贞吉饯石亭馆得曹字
624001,雨中曾炼师携酒同景文伯文元珍伯乔烟客饮黄龙洞
594884,秋日黎继荐携酒同关伯玉诸子过蘧园得停字
545804,朱吴于三生携酒同游城南观音禅院
970023,垂丝钓 其一 干越亭路彦捷置酒同别富南叔
975779,次韵衡山徐监酒同考府学试八首 其八
974793,次韵衡山徐监酒同考府学试八首 其一
525145,清旷亭酌酒同许隐君赠别臧子明进士春试
1074042,斗酒同小诗送杨君圣四绝 其一
593151,立春日风雨仍泊石亭馆魏甫佳甫携酒同宗良贞吉孔阳饮舟中得桡字赋成韵
345635,斗酒同小诗送杨君圣四绝
533310,潘子携酒同欧氏诸子过清泉山中出吴笺索余拙书因留夜坐
130638,谢单景山载酒同赏牡丹过燕余
618527,春日载酒同诸子过友人赏牡丹四首 其三
944841,谢单景山载酒同赏牡丹过燕馀
491071,家弟归自秣陵携酒同登虎邱
593169,吴仲实携酒同陆华父吴仲足方献成吴虎臣方元素汪仲嘉泛新安江得飞字
628070,将归北田家蒲涧携酒同诸子云峰饯别
613696,将之五羊羽甫家兄携酒同诸子话别
592078,雨夜郑驾部携酒同过黎司封宅时司封已擢广西参藩
299611,对酒同黄子
710081,对酒同黄子
593530,王符卿敬美携酒同石廷尉拱辰见过
618526,春日载酒同诸子过友人赏牡丹四首 其二
545742,王总戎携酒同登新城南楼即席赋
65855,哭亡妹琼章·别酒同倾九日前
592104,病中曾缮部携酒同黎秘书夜过得长字
798713,貂裘换酒 同抱香又农拍照，题送抱香之行
593411,黎秘书携酒同顾舍人吕蒋二山人礼永二上人集普恩寺得过字
974789,次韵衡山徐监酒同考府学试八首 其六
1213122,辛亥三月陪马克脩治书谒天游孙真人方丈阶前牡丹盛开卮酒同玩座中范提点索诗
688919,春日载酒同诸子过友人赏牡丹四首
473535,姚山人携酒同过陆园看梅花
550927,秋日载酒同陈汝翔黄伯宠惟起惟扬二弟访王玉生郊居
1201428,金莲出玉花 继酒同监韵联珠
974791,次韵衡山徐监酒同考府学试八首 其四
585714,重阳携酒同洪侍御觉山诸生方持素何宗远钟叔辉郑孔新周明几谢振卿周昌逵方毅中登高大科峰见日台翻王摩诘韵以广方洪归念
