939121,永邑杨君鉴子明辟斋读书将从事于古人为己之学求斋名于予并欲得一语以示为学之方予谓学虽多端而其要莫先于明善所以子思孟子俱以此开道后学大学格物之训实同出一源故因杨君之请扁以明善且诗以演其义幸毋忽其言之陋云
974183,既过曾居因访刘茂实秀才是日明叔同出恨仲威不至
1032122,春晚三客同出郊归途甚醉
150790,悼邦节弟·皇考怜同出
999321,显谟左司周公元吉将漕湖北一时名流赋诗饯行予与左司同出于詹事周公之门为同门同居班列二年为同朝同考类试于贡闱为同寮三者既同契好弥笃于其行也作长句以送之
1243902,重九后菊（壬辰年小篱黄菊节后始华异香芳容不类馀者惜其开不应时如绝笔之麟又似吾性倔强好与世欲背驰岂其以予无酒酬酢故迟之抑将耻伍凡下不欲与之同出俟其衰谢然后独步西风否则赋性谦退不欲争先群品特殿于九日之后耳赋唐律一章见意云）
108873,九日同出真珠园再用前韵
386028,喜阮侯亭明府至，走邀寿泉学博，席间同出近作，即题明府古文卷
134310,正月三日与广渊同出南薰门分斋宫涂中有作
470995,正月十八日同仲和侯园看梅因期同出西郭即事
817071,梦洪大亮吉忆旧时同出此途感吟二首
825879,侗伯立之立庵同出观荷
211298,晦同出城·城中未必闷
1155805,与诸公同出城观稼
939126,甲寅寒食日访徐子融子融同出游晚归志所历二十六韵
96369,既过曾居因访刘茂实秀才是日明叔同出恨仲威
222468,甲寅寒食日访徐子融子融同出游晚归志所历
118425,试院唱酬·老去在家同出家
1224026,从兄德观父与集同出荣州府君宋亡隐居不仕而殁集来吴门省墓从外亲临邛韩氏得兄遗迹有云我因国破家何在君为唇亡齿亦寒不知为谁作也抚诵不觉流涕因足成一章并发其幽潜之意云
1122068,和孟坚二月晦同出城
423113,声声慢 辛巳清明后一日，罗元一、李白华两兄约同出游。自清洞经井水门、单竹径、罗家祠归莲溪寓所
1099727,郡圃小山大资可斋先生所作也石久散而池亦荒恕斋来公补处叠之浚之访求旧记重刊之仍续留题之句以寄可翁翁又和之以某同出可斋之门不鄙赐示借韵为谢 其一
1099728,郡圃小山大资可斋先生所作也石久散而池亦荒恕斋来公补处叠之浚之访求旧记重刊之仍续留题之句以寄可翁翁又和之以某同出可斋之门不鄙赐示借韵为谢 其二
307894,声声慢·辛巳清明后一日，罗元一、李白华两兄约同出游
112470,春晚三客同出郊归途甚醉
1046550,送文与可同出守湖州
230911,次韵同出祓殡
784985,梦洪大亮吉忆旧时同出此途感吟二首 其二
457873,一日，安徒生之美人鱼遇漆园吏之曳尾龟，乃相与谈。其言鱼嚏鳖咳，盖不能悉。鱼陋龟之无文也，诺为之寄书，而请其友鲛人代购之。鲛人者，中文版之美人鱼也。龟得书，欲以诗相谢，而自顾龟爪短拙，不能捉笔，转请诸碰壁斋。碰壁斋才尽，然感二鱼之义，且与龟同出庄子之门，于是强头咬牙，硬拼蛮做，终焉成章。龟受而读之，摇头摆尾，团团自转，不胜其雀跃云。诗曰
19086,与诸公同出城观稼
371615,昌甫有诗琴士云得之黄子厚盖考亭坐中客也因入章泉同出城解后和韵
641433,奎在乡里时辱先达诸公折辈行与之交者多矣而或远在百里之外近亦不下一二舍以故不获亟从之游独吾叔御道原公武次泉潜夫数君子居相近志相同出入往来无间蚤暮有得必告有疑必质当是时亦诚以为乐矣而未知其为难得也一二年来或出或处或南入于广或东往于齐而奎亦远迹关辅閒居独处每一兴怀平昔从游之乐如在天外茫乎不可复得然后知会合之不易而离索之为苦也昔之人中年为别必数日作恶岂为过哉作诗一首以寄此怀
240950,派派泉·水源同出万山头
61944,即日·午门同出独归迟
1219198,向年与岳汉阳、赵宛丘同登荆溪王氏仁寿堂，今几四十稔。时允同尚未生，兹允同出拜，感念今昔，赋以与之
869964,正月三日与广渊同出南薰门分趋斋宫涂中有作
118188,次前韵·老去在家同出家
958673,和孟坚二月晦同出城 其一
225060,绝句·异名同出少人知
1094148,昌甫有诗琴士云得之黄子厚盖考亭坐中客也因入章泉同出城解后和韵
1099729,郡圃小山大资可斋先生所作也石久散而池亦荒恕斋来公补处叠之浚之访求旧记重刊之仍续留题之句以寄可翁翁又和之以某同出可斋之门不鄙赐示借韵为谢 其三
951815,九日同出真珠园再用前韵
1121241,郡圃小山大资可斋先生所作也石久散而池亦荒恕斋来公补处叠之浚之访求旧记重刊之仍续留题之句以寄可翁翁又和之以某同出可斋之门不鄙赐示借韵为谢
49603,正月十八日同仲和侯园看梅因期同出西郭即事
964335,次韵同出祓殡
211277,和孟坚二月晦同出城
784984,梦洪大亮吉忆旧时同出此途感吟二首 其一
17192,出门行·兄弟同出门
1170922,彭城公薨后赠杜二十七胜李十七潘二君并与愚同出故尚书安平公门下
958672,和孟坚二月晦同出城 其二
