487895,同施仲宣黄惟聚尧衢游九鲤湖分得齐字 其三
909979,同德麟仲宝过谢公定酌酒赏菊以悲哉秋之为气萧瑟八字探韵各赋二诗仍复相次八韵某分得哉萧二字 其三
572609,暮春同王以明丘长孺苏潜夫魏二方游韦氏庄得宽字 其三
559401,壬戌诞日四首并得三字 其三
592443,九日姚伯子陈伯春陆无从张叔龙集斋中得风字 其三
495493,墙角红梅，九月发花一朵，偶成四绝；时羁狱舍，用「盐」字 其三
860729,呈陈崇青求娱亲堂三大字 其三
855540,次韵王司户梅花五绝不得用古人意及比妇人玉雪并洁白等字 其三
1072174,和峦嶅二子寒食少天色五字 其三
438940,同敬之裕之游水谷分韵赋诗得荷风送香气五字 其三
921093,与王郎昆仲及儿子迈，绕城观荷花，登岘山亭，晚入飞英寺，分韵得「月明星稀」四字 其三
902374,分韵赋散水花得盐字 其三
559071,谢荩衷再访予山中诗以送之三首并得春字 其三
1074765,次卿与余终日坐竹间以何人有酒身无事谁家多竹门可款为韵余得上七字 其三
619449,雁字 其三
531950,粤台怀古四首分韵得幽字 其三
550166,过泉林得灵字 其三
451170,十六字 其三 梦游山
557076,席上送朱主客得萧春青西四字 其三
402094,与敬老、臞翁、季思共赋风雨龙吟楼诗，以“未知明年又在何处”分韵，得“未”字“又”字 其三
572556,夏日城西园亭闻蝉得阴字 其三
900531,安国置酒敬简堂分韵得柳暗六春字 其三
1068511,春怀赋得冰雪莺来晚春寒花较迟十字 其三
719403,仲秋五日客端州承太守王公招同诸公游七星岩分赋得秋字 其三
597351,同曹明府游厓分韵得水字 其三
1212755,十六夜月得人字 其三
572851,雁字 其三
799302,病起听雨拈得声字 其三
