868751,待制中书舍人陈公之亡以山宅须利既迁殡而未葬也后五月乃克葬焉二首 其二
868602,待制中书舍人陈公之亡以山宅须利既迁殡而未葬也后五月乃克葬焉二首 其一
1141643,范文正公黄素小楷昌黎伯夷颂盖宋皇祐三年十一月在青社所书以遗京西转运使苏公舜元者也后二百四十年大兴李侯戡得此本于燕及南来守吴乃文正公乡里即访公子孙以畀之范氏喜而索诗为赠
1036118,醉翁操 琅琊幽谷，山川奇丽，泉鸣空涧，若中音会。醉翁喜之，把酒临听，辄欣然忘归。既去十馀年，而好奇之士沈遵闻之。往游，以琴写其声，曰醉翁操，节奏疏宕，而音指华畅，知琴者以为绝伦。然有其声而无其辞。翁虽为作歌，而与琴声不合。又依楚词作醉翁引，好事者亦倚其辞以制曲。虽粗合韵度，而琴声为词所绳约，非天成也。后三十馀年，翁既捐馆舍，遵亦没久矣。有庐山玉涧道人崔闲，特妙于琴。恨此曲之无词，乃谱其声，而请东坡
1143649,范文正公黄素小楷昌黎伯夷颂盖在青社时所书以遗京西转运使舜元苏公者也后二百年大兴李侯戡得此本于燕及南来守吴乃文正乡里即访公子孙以畀之范氏喜而求诗为赋此二首
178666,风潮信也·后世新奇方竞出
1073865,绍兴壬子某南迁过疏山上一览亭见拟东坡煨芋诗刻龛之壁间诗律句法良是殆不能辨乃宣卿侍郎守临川时所拟作也后数日道次安仁县一士人吴君出宣卿诗数十解示余奇丽清婉咀嚼有味如啖蔗然读之惟恐尽于是拊卷三叹而后知公置力于斯文久矣又二十年宣卿筑室荆溪山中别营一堂以平生所蓄东坡诗文杂言长短句残章断槁尺牍游戏之作尽椟藏其中号景坡自书榜仍为记刻之某欲具小舟造观而宣卿召用今以集撰守吴门乃赋诗为之先
1080521,晋大宁四年王敦自武昌下屯于湖明年六月敦将举兵内向明帝微行至于湖阴察其营垒而去唐温庭筠作湖阴曲盖为此也后汉王霸之孙改封芜湖吴时此地称于湖或称芜湖察其营垒则姑熟之西初无湖阴又且于湖乃芜湖也张文潜有于湖曲广其意追和焉
1132936,范文正公黄素小楷昌黎伯夷颂盖在青社时所书以遗京西转运使舜元苏公者也后二百年大兴李侯戡得此本于燕及南来守吴乃文正乡里即访公子孙以畀之范氏喜而求诗为赋此二首 其二
1216359,儒有萨氏子者家无田囊无储始以进士入官为京口录事长行南台辟为掾继而御史台奏为燕廉访架阁官岁馀迁知闽海廉访事又岁馀诏进河北廉访经历皆奉其母以行其禄养也后至元三年八月望舟泊延平津上是夕星河粲然天无翳云月色如白日溪潺潺如乐奏四山环抱如拱如立如侍左右如奔走执事者萨子奉母船上与其妇具酒殽盘馔奉觞继而若妹妹之婿若仆若婢次而进和而不亵谨而怡怡月光荡酒而溪韵杂语笑母叹息舟人醉歌亦相与鼓枻作南歌为乐今夕何夕不知其异乡
250243,福鼎别号桐城盖昔日城中遍植桐树故也后为新任长官所伐今日二三子于此结社并以桐为名
1132937,范文正公黄素小楷昌黎伯夷颂盖在青社时所书以遗京西转运使舜元苏公者也后二百年大兴李侯戡得此本于燕及南来守吴乃文正乡里即访公子孙以畀之范氏喜而求诗为赋此二首 其一
1062929,元祐中先人将漕淮南与长乐林旦次中为僚其子硕儒肤与余游相好也后三十五年复相见于京师道旧涕泪已而复遣其爱子薿见过仍辱赠诗叙畴昔之好次其韵答之
452294,福鼎别号桐城盖昔日城中遍植桐树故也后为新任长官所伐今日二三子于此结社并以桐为名
583328,南山潘孔修先生学甚纯正事母至孝尝著孝经正误诸书以济时行道为志在刑部时上筹边十策及时政得失忠义剀切海内想望风采盖第一流人物也后以迎养陈情疏凡二上乃改南都缜适奉命至得以亲炙受益为多顾复奔走江南念兹远违情不能已用韵奉答以著平生之谊云
618318,花朝寄怀欧嘉可谢伯子黎美周诸子言念去岁同游宝莲正今日也后晤何地可期
826347,国香慢·日耳曼女士李士馨花明玉艳，略识华文。与陈骏生典簿邂逅白陵。联骑看花，擘巾题句，拟之洛水江皋，不是过也。后士馨以流离远徙，竟绝声闻。骏生重访旧居，大有朱箔天涯之感。因取士馨往日赠诗，属张小轩茂才译为长篇，自书于册，而委余题首
1107550,待制中书舍人陈公之亡以山宅须利既迁殡而未葬也后五月乃克葬焉二首
983664,上官桀诈令人为燕王旦上书言光疑有非常臣愿归符玺宿卫察变上曰朕知是书诈也后桀燕王等谋废立事觉尽诛
