1194174,郡中玩月寄江南李少尹虞部孟员外三首
1177201,赠江南李偕副使
1060095,寄题江南李氏四照亭
335683,寄题江南李氏四照亭
13796,郡中玩月寄江南李少尹虞部孟员外三首
114909,江南李後主梦观世音像赞
542433,寄江南李巽川许习盘二正郎兼忆张怀洲黄门
873767,兼道携古墨来墨面龙纹墨背识云保大九年奉敕造长春殿供御龙印香煤旁又识云墨务官臣庭邽监官臣夷中臣子和臣卞等进盖江南李氏物也感之为作此诗
291655,望江南·李次公将往福州，余以望江南拙词一册为贻，次公并索赠言，因即填此调一阕媵之
240611,张元举惠江南李王帐中香
860788,张元举惠江南李王帐中香
1162181,郡中玩月寄江南李少尹虞部孟员外三首 其二
34518,赠江南李偕副使
1162182,郡中玩月寄江南李少尹虞部孟员外三首 其三
541916,江南李秀才过敝庐因言及诗法赋此长歌用答来意
1162180,郡中玩月寄江南李少尹虞部孟员外三首 其一
540031,陈生作大字用布帛随手为之此法出江南李后主号撮襟书生不知也
824178,望江南 李次公将往福州，余以望江南拙词一册为贻，次公并索赠言，因即填此调一阕媵之
996739,江南李后主梦观世音像赞
