1041485,和过骐骥院观马因饮李氏夜归复与江谢会于敝居
923112,和过打造部落
310769,念奴娇·中和过了
735329,次和过浮溪馆见绿阴之作 其一
999809,和过尉氏林香陂韵
735330,次和过浮溪馆见绿阴之作 其二
28338,和过张祜处士丹阳故居
538618,辱存叔幼圜和过黄淳父诗再叠奉答
1059151,闻彦和过桂州 其一
356053,许主簿见和过有推借再作奉呈
1117588,闻彦和过桂州
1146010,奉和过旧宅应制
1247012,伏读高昌佥宪公唐律十二首爱其清新雄杰殆本天成非吟哦造次可得韩退之慕樊宗师文苏子瞻拟黄鲁直体惟其有之是以似之区区虽欲效颦第恐唐突西施耳 其四 和过九华山
1146127,奉和过旧宅应制
1059152,闻彦和过桂州 其二
1070349,许主簿见和过有推借再作奉呈
347,奉和过旧宅应制
1086432,司理叔文和过万桥诗复用前韵
343,奉和过慈恩寺应制
813742,次和过浮溪馆见绿阴之作
158831,和过尉氏林香陂韵
1146117,奉和过慈恩寺应制
613676,同陈叔和过知微斋中听雨
1176355,和过张祜处士丹阳故居
533637,立春后五日同元白次甫思伯汝和过子与得车字
184170,和过打造部落
302595,开岁五日文约、守和过访，别后俱有诗来，赋此以答
1732,奉和过梁王宅即目应制·岩居多水石
184169,和过神水沙碛
533609,岁除前一日同舍弟惟和过助甫
533636,残腊同姚元白郭次甫梁思伯顾汝和过子与
412894,开岁五日文约、守和过访，别后俱有诗来，赋此以答
677201,秋日喜子鱼孟阳君美仲和过檀园宿留即事
169516,和过田承君
209767,同王子和过张氏小园
923366,和过神水沙碛
1179218,奉和过梁王宅即目应制
939810,和过田承君
888142,同王子和过张氏小园
