352049,次韵孙仲益食豚鱼
1094700,次韵施仲益 其二
1075715,孙仲益尚书以诗赠吴益先吴出巨轴索诗
872803,用孙仲益尚书韵二首呈孟信安 其一
1059495,仲益遽塞便门作此戏之
1130845,次韵施仲益
207476,秋潭为吴仲益赋
1030469,采桑子 孙仲益集于西斋，题侍儿作第一流，因以词谢之
358389,次韵答仲益见简
1079237,谢孙仲益察院借示诗卷
1059471,简仲益求纸帐
647756,闻钱仲益自杭州获归
1059118,仲益约游延庆不至作此戏之
368055,闻黄仲益云梦辟书报命
1059472,仲益以帐来且有就榻眠之句复次韵与之
1094238,昌甫约过施仲益
371760,送施仲益何文蔚余子任及蒋吴二友赴省
1059479,次韵答仲益见简
1093096,次韵施仲益
1094701,次韵施仲益 其三
1094699,次韵施仲益 其一
1055834,送李仲益赴濠梁司户
1059128,和欧阳彦立再用仲益前韵
1093103,次韵昌甫所寄因答施仲益且寄斯远 其一
337456,孙仲益尚书以诗赠吴益先吴出巨轴索诗
372157,昌甫约过施仲益
1093429,送施仲益何文蔚余子任及蒋吴二友赴省
1078767,次韵孙仲益食豚鱼
1093104,次韵昌甫所寄因答施仲益且寄斯远 其二
941695,秋潭为吴仲益赋
1130980,次韵昌甫所寄因答施仲益且寄斯远
1094091,次韵昌甫闻予过仲益见寄
1059978,同官李仲益赠张思仲家歌人团茶因题其封
872789,用孙仲益尚书韵二首呈孟信安 其二
1090833,闻黄仲益云梦辟书报命
1217166,成居竹有书报甥傅君亮至扬州言其家与外表舅吴仲益及妇家二叔学生韩与玉全家无恙喜甚有怀
1059127,次韵仲益解嘲
1055848,送李仲益及第调濠州司户还钱塘
358385,简仲益求纸帐
371587,次韵昌甫闻予过仲益见寄
950961,孙仲益和议帖赞
369985,施仲益·尽以清才一笔收
1059120,谢仲益惠兰
1059477,仲益欲归作此留之
334957,戏孙仲益暮春自尚书郎予告迎妇浙东留毗陵久之
1212899,奉寄郭仲益鍊师
358395,仲益遽塞便门作此戏之
143260,嘲仲益·低帘廕茅竹
928078,嘲仲益
1071466,戏孙仲益暮春自尚书郎予告迎妇浙东留毗陵久之
1053366,送李仲益赴襄阳幕
1083666,代上孙仲益尚书生日
1249455,送樊仲益省郎之解州
370584,有怀斯远及施仲益次章丘韵
358388,仲益欲归作此留之
1093131,有怀斯远及施仲益次章丘韵
1108056,用孙仲益尚书韵二首呈孟信安
370555,次韵施仲益
553968,写家山图寄翰林钱仲益先生
1047785,奉赠仲益南上
970138,鹧鸪天 其四 上元孙长父郎中坐上次仲益尚书赠玉奴韵
370556,施仲益·空斋秋净尚何须
1093105,次韵昌甫所寄因答施仲益且寄斯远 其三
1094761,有怀斯远及施仲益次章丘韵
358117,仲益以帐来且有就榻眠之句复次韵与之
