653385,刑科钱士义升山西参议临行以流泉小幅求题书此见意
307256,陈以光先生屡赐诗词惭于应答写此见意
426359,吴门李西庚先生神交两载，今始识荆，欣喜之馀，赋此见意
558337,予居春坊之右厢者月馀寂寂无偶适李瑞卿至与居左厢故旧之情切劘之益兼得而备至喜幸之深赋此见意
426308,陈以光先生屡赐诗词惭于应答写此见意
826211,卜算子·宵诵东坡此调，意当时怀贤去国，情绪万端，必有不胜其辗转反侧者。赋此见意，亦宋玉微词之旨。世人以侧艳目之，谬矣。港居荐涉冬春，望远登楼，伊郁谁语，偶继坡作，以写我忧。世其有为我作郑笺者乎
826195,点绛唇·重阳闷不出门，遂失灵岩登高之约，赋此见意
307279,吴门李西庚先生神交两载，今始识荆，欣喜之馀，赋此见意
149348,明仲约七月晦集属抱病先以此见意犹并以申谢
266711,点绛唇·重阳闷不出门，遂失灵岩登高之约，赋此见意
950685,与高紫微雪溪饯客虽已预盟然坐次予每居上为之踧踖寄此见意
585162,登岳阳楼陪宴诸公赋此见意
585064,萧汝柔掌教讶无回书赋此见意
895323,子立昆仲垂和游天宫诗既工且敏义不虚辱再此见意
980279,明仲约七月晦集属抱病先以此见意犹并以申谢
