1042073,往得南岳玄猿特善啸立秋后风雨颇凉声尤清绝怜其山林之思为作七言
319630,岁暮穷极有某府怜其贫嘱为撰文因步《钓台题壁》韵作答
1033358,归舟已具李宪楼仓有约盗贼梗道见避乱者可怜 其一
641340,十月二日宝应舟中夜梦先君手赐一狐裘仰视慈颜似怜其远行者梦回伤感悲不自胜
366747,往得南岳玄猿特善啸立秋后风雨颇凉声尤清绝怜其山林之思为作七言
1033951,归舟已具李宪楼仓有约盗贼梗道见避乱者可怜 其二
717266,赋得六旬犹健亦天怜 其一
709028,河东春日诗有梦里愁端之句怜其作憔悴主语聊广其意
717267,赋得六旬犹健亦天怜 其二
268050,山花子·山花忽开一枝，怜其晚秋无侣，摘供案头，为赋小词
978981,尉廨无隙地不能莳花竹之属惟厅事前旧有柳一株予怜其独也增植其七焉暮春之月大有生意可喜为赋此
834815,山花子 山花忽开一枝，怜其晚秋无侣，摘供案头，为赋小词
1246147,紫虚周道士还俗多年而贫老如故元帅石末公怜其无依复令归观就养
868489,刘氏女自誓为尼怜其操者幸助成之
206957,刘氏女自誓为尼怜其操者幸助成之
411790,岁暮穷极有某府怜其贫嘱为撰文因步《钓台题壁》韵作答
1246846,河朔侯公君祥知黟县之四年公怜其讼简民淳民亦乐公之德也岁次辛丑春予入其境则耕凿无废壤蚕桑无落职歙休宁两县流离转徙且僦居以就食予未尝不慨叹人人如公用心其有不治得乎窗前置石珑刻画象天都三十有六峰为赋之以昭善治云
