107663,大明赋·草制无知傅伯寿
160288,和伯寿秘监
132699,送周伯寿赴省
1078829,王伯寿见复用前韵奉答
1105213,承伯寿大蓬惠书寄大小钵囊花并语及敝居松下石上之饮因成二小诗
611340,赋得春日迟迟篇为梁封君年伯寿
530050,松厓歌寄方方伯寿卿
155176,次韵伯寿兄海棠
156025,次韵伯寿兄中秋玩月
1038289,承伯寿大蓬惠书寄大小钵囊花并语及敝居松下石上之饮因成二小诗 其一
158138,送刘伯寿团练致政归洛阳旧隐
865381,寄司录朝奉兼简伯寿
975454,送周伯寿赴省二首 其一
147935,答何中丞伯寿
1070912,四月望夜郡寮悉赴盛集羊荆华林伯寿伯安相继见过同登涌月阁待月成拙诗并呈常往来诸友
974064,李大椿伯寿见示宝剑歌答之
880208,畏雨不出简张端袤昆仲符伯寿诸兄
1101672,寄题崇仁吴甫伯寿康堂
187516,奉送符伯寿尉太平
1063799,余游侯伯寿思儒之间久矣而未识季长昨日见之夜归作此寄之
139454,挽翟伯寿·少日为僚古乐成
139455,挽翟伯寿·高情爽气薄云天
134503,和刘伯寿陪潞褉饮
898877,浣溪沙 其二十三 以贡茶、沈水为扬齐伯寿
331100,四月望夜郡寮悉赴盛集羊荆华林伯寿伯安相继见过同登涌月阁待月成拙诗并呈常往来诸友
1038275,家园花开与陈大师饮茶同赏呈伯寿正叔昌言
998771,得伯寿兄知丞书因成绝句奉寄
1037915,招刘伯寿秘监
1049970,嵩山归送刘伯寿秘监
148347,寄临汀推官卢伯寿
132931,饯周伯寿得枝字
1078830,次韵伯寿述怀
351987,送猿翟伯寿
899125,绿头鸭/多丽 其一 次韵王伯寿
320724,家园花开与陈大师饮茶同赏呈伯寿正叔昌言
352273,王伯寿示佳作备述穷苦次韵奉呈
1001739,寄临汀推官卢伯寿 其二
999115,留别伯寿兄
660695,次杭方伯寿日韵
155848,得伯寿兄知丞书因成绝句奉寄
611046,蒲涧歌为潘年伯寿
44213,半淞园坐雨伯夔重伯寿臣及儿子方恪同游
869505,和刘伯寿陪潞公禊饮
925796,西江月 为范南伯寿
1016658,徐伯寿求赞
998966,次韵伯寿兄见寄
975453,送周伯寿赴省二首 其二
968483,官田之集翁聘君失期陈伯寿赋诗率尔次韵
96857,李大椿伯寿见示宝剑歌答之
1215349,寄题张伯寿煮石窝
1234027,酬罗伯寿 其一
134780,暮春同刘伯寿史诚之饮宋叔在园
1122948,题高伯寿墨梅
1089473,送陈伯寿之子仲至迎侍赴嘉兴秋官
352264,王伯寿见复用前韵奉答
155177,次韵伯寿兄残春即事
352059,次韵伯寿述怀
998965,次韵伯寿兄中秋玩月
530380,谢方方伯寿卿惠米
975657,饯周伯寿得枝字
1089376,次韵陈伯寿食黄雀有感
1038290,承伯寿大蓬惠书寄大小钵囊花并语及敝居松下石上之饮因成二小诗 其二
937466,定风波 进贤道上见梅赠王伯寿
1049844,洛中王秀才谈刘伯寿动静慕其潇洒作诗识之
132700,送周伯寿赴省·子合居官久
367826,寄题崇仁吴甫伯寿康堂
1078857,王伯寿示佳作备述穷苦次韵奉呈
999070,送伯寿兄之官上虞
974465,蕃舣舟湘西之明夕郑仲理吴德夫周伯寿黎季成共置酒于书院阁下追饯者邢广声王衡甫时戊申仲秋七日
1063176,题自画横披与翟伯寿
889379,挽翟伯寿二首 其一
98032,孟秋八日夜伯寿仲理过予同访俊步月入城南书
1236962,酬罗伯寿
95277,次韵和答周伯寿送行
999910,送刘伯寿团练致政归洛阳旧隐
234733,官田之集翁聘君失期陈伯寿赋诗率尔次韵
116935,刘伯寿秘校
818383,半淞园坐雨伯夔重伯寿臣及儿子方恪同游
156027,次韵伯寿兄宿华藏有感
1214479,张伯寿煮石窝清坐
1089212,送猿翟伯寿
624419,贺海康梁年伯寿
973926,次韵和答周伯寿送行
998968,次韵伯寿兄宿华藏有感
964965,题高伯寿墨梅 其一
889378,挽翟伯寿二首 其二
155575,留别伯寿兄
1247367,九日席上呈兼善伯寿
870248,暮春同刘伯寿史诚之饮宋叔达园
1234356,酬罗伯寿 其二
176508,题高伯寿墨梅
1247261,题刘伯寿菊逸卷
968575,柳梢青 其一 和张伯寿紫笑词
1089275,昨日与周伯寿别终夕雨小诗追路
1026354,和伯寿秘监
225428,寄司录朝奉兼简伯寿
1111752,挽翟伯寿二首
148348,卢伯寿·解官赴调出临川
156030,次韵伯寿兄见寄
1036141,无愁可解 国工花日新作越调解愁。洛阳刘几伯寿闻而悦之。戏作俚语之词。天下传咏。以为几于达者。龙丘子犹笑之。此虽免乎愁。犹有所解也。若夫游于自然而托于不得已。人乐亦乐。人愁亦愁。彼且恶乎解哉。乃反其词。作无愁可解云
1089353,次陈伯寿分韵得者字
951314,答何中丞伯寿
156028,次韵伯寿兄秋日偶题
974128,孟秋八日夜伯寿仲理过予同访俊乂步月入城南书院繇东渚上读书堂过蒙轩憩卷云欲访月榭而月未到坐濯清者久之乃归赋诗十四韵以记
998967,次韵伯寿兄秋日偶题
999259,次韵伯寿兄海棠
964964,题高伯寿墨梅 其二
899678,清平乐 为伯寿题四花牡丹
999258,次韵伯寿兄残春即事
353586,送陈伯寿之子仲至迎侍赴嘉兴秋官
897632,刘伯寿秘校
155794,送伯寿兄之官上虞
880196,奉送符伯寿尉太平
1127753,寄临汀推官卢伯寿
1001740,寄临汀推官卢伯寿 其一
1124490,送周伯寿赴省二首
