514422,夏日独卧西斋陶懋学贡士与克俭弟隔坐写画笑语而窗外槐阴与盆石掩映宛如往岁回舟北上时事因成一诗
520379,予入华山而爱其名胜恨不登落雁峰携谢眺惊人句搔首以问苍天耳玩之不足而因成一诗山灵有知其尚羡予之奇观也哉
1030826,淳熙戊戌将命广东侍亲携孥十一月至安仁留云锦驿一宿而去时晋卿侄偕行后二十三年分阃桂林晋卿主馀干簿复以是月来会于此把盏道旧为之怆然因成一诗示晋卿
641339,梦尚之彦强来问病源所在随以数语答之及觉忘记其辞因成一诗遍寄昆山学诸生且因自警云尔
958392,后圃石榴初为夏日所暴得秋雨所烂易落雀又从而窃之树间日以彫疏顾其馀尚可侑吾小饮因成一诗而摘取之
967608,积雨初霁乘兴邀王和叟赵久成二监郡游南山饮于云间阁因成一诗醉书于石壁
1079464,连日与一上人会话密庵清坐附火乃有山居气息因成一诗奉呈
851235,张元帅谓予国已亡矣杀身以忠谁复书之予谓商非不亡夷齐自不食周粟人臣自尽其心岂论书与不书张为改容因成一诗
520368,新丰盖象丰也汉高斯举其亦孝矣予经是地而闻鸡鸣犬吠之声俨有太平气象第未知太公当日果不思丰否亦不知新丰市上犹有斗酒濯足者乎因成一诗以写兴云
