283048,蝶恋花·庚子五月再游吴门，同人泛舟山塘，追悼亡友建霞
491255,题高人汎舟图为铁柱左炼师赋
145430,苕溪夜泛·萍踪人泛清苕去
1006764,木兰花/玉楼春 与诸人泛溪作
32030,冬末同友人泛潇湘
1034995,约客十有二人汎舟东山分韵得大字
432201,携家人泛舟西泠谒岳庙遂至玉泉观鱼三首
682004,约时去华诸同人泛舟
677299,同西生上人泛舟两堤题画 其二
339185,秋日同雪涛上人泛舟入禾水
769098,满江红·癸丑岁六月十二日同人泛秦淮
818477,三月三日鹤亭自丹徒至携同宗武公约伯臧及苍崖上人泛舟秦淮夜还饮水榭与鹤亭别
602785,端午同友人泛舟游大通寺
419919,摸鱼儿 重阳后四日与同人泛舟花潭，香宋生日也
240701,同诸乡人泛临安西湖
779774,虞美人 泛舟鸳鸯湖，泊香海庵，戏咏叶子，题金校书文璧扇
178827,约人泛舟·前旬小雨飞廉纤
139757,约客十有二人汎舟东山分韵得大字
357389,满江红·癸丑岁六月十二日同人泛秦淮
826158,百字令·送友人泛海
310897,摸鱼儿·重阳后四日与同人泛舟花潭，香宋生日也
313354,摸鱼儿·人日后一日招同李竹农庶常、杨超白别驾、萧伯瑶山人泛舟花埭，沽酒珠江，迟何一山贰尹不至
618166,季春望后同诸社人泛舟分赋二首 其一
855453,同诸乡人泛临安西湖
272155,携家人泛舟西泠谒岳庙遂至玉泉观鱼
266674,百字令·送友人泛海
530244,孟秋十六日孙道甫范文一昆仲邀予同汪进之京兆方质夫逸人泛舟西湖二首 其一
304644,采桑子·流人泛宅西溪好
548336,春暮同朱光禄华鸿胪顾谢二徵君陈逸人泛五里湖
887567,还京乐 黄钟商友人泛湖，命乐工以筝、笙、琵琶、方响迭奏
835181,蝶恋花 庚子五月再游吴门，同人泛舟山塘，追悼亡友建霞、畏■
1174642,冬末同友人泛潇湘
263670,歌七章·九灵山人泛东海
627413,季夏同姚讱庵晓白张敬庵严筑公黎传人汎舟南宗庵访昙大师刘羽士振枰试茗纵谈玄理归次逢禅上人以荔枝驰回饷客和讱庵作
543632,武林大雪程太学仲凯邀同张总戎黄刺史徐司理钱文学吕山人汎棹湖中泊南岸放歌徒步入龙井汲泉瀹茗延赏至暮乃归
942201,同友人汎舟过断桥登寿星江湖伟观归舟听客讴清真词意甚适分得江字奉寄季大著乡执兼呈真静先生
687209,孟秋十六日孙道甫范文一昆仲邀予同汪进之京兆方质夫逸人泛舟西湖二首
880377,同友人泛舟至仁王
341467,和维申秋夕同友人泛月西湖
279735,留别同人·泛海曾从赤崁来
782715,与诸同人泛舟天桥湾得骸字磨字二首 其二
677298,同西生上人泛舟两堤题画 其一
691586,同西生上人泛舟两堤题画
530245,孟秋十六日孙道甫范文一昆仲邀予同汪进之京兆方质夫逸人泛舟西湖二首 其二
618167,季春望后同诸社人泛舟分赋二首 其二
817282,与诸同人泛舟天桥湾得骸字磨字二首
412385,携家人泛舟西泠谒岳庙遂至玉泉观鱼三首 其二
902122,约人泛舟
65510,同友人泛湖
145627,同友人泛舟至仁王
477035,同友人泛湖
412384,携家人泛舟西泠谒岳庙遂至玉泉观鱼三首 其一
826435,摸鱼儿·人日后一日招同李竹农庶常、杨超白别驾、萧伯瑶山人泛舟花埭，沽酒珠江，迟何一山贰尹不至
538343,维扬遇吴明卿舍人汎舟夜酌
782714,与诸同人泛舟天桥湾得骸字磨字二首 其一
1065811,送人泛海北归兼寄诸兄弟
1249550,秋日同友人泛舟
412386,携家人泛舟西泠谒岳庙遂至玉泉观鱼三首 其三
688858,季春望后同诸社人泛舟分赋二首
231106,同友人泛舟过断桥登寿星江湖伟观归舟听客讴
