746841,长夏无事偶检十余年来师友翰墨得十卷装池之因成七律一首
1190599,余卧疾深村闻一二郎官今称继使闽越笑余迂古潜于异乡闻之因成此篇
323341,初入巫山界登罗护关云雾晦冥默祷之因成一绝
863194,腊八日书斋早起南邻方智善送粥方雪寒欣然尽之因成小诗
894482,天禧初侨寓安陆有宅一区尝于斋前手植橘树才尺馀许未几擢第随牒游方天圣庚午冬屏居畿邑守舍儿自安陆馈余丹橘一箧因曰此即斋前所植抚物怀旧悽然不平者久之因成感咏
1085470,易芝山五老亭名曰五峰安国书之因成短篇
173948,有野人来献石蝉以二千钱偿以之因成拙诗
321896,易芝山五老亭名曰五峰安国书之因成短篇
203189,马驭周晬思之因成
1085379,不欺室三字参政张公书也笔力劲健如端人正士俨然人望而敬之因成古诗八韵
889268,前日小集梅花犹在乘兴移其下杯行乐甚是夕风微月朗花飞入坐者纷纷如雪待制曾丈有四并之叹谓不可无作屡属唱之因成拙句
655818,九月壬午承王九鼎同省石井先陇罢宿惠民药局丙丁夜虚堂隐几偶思及之因成此句
985092,有野人来献石蝉以二千钱偿之因成拙诗
869588,忝职谏垣日负忧畏缅思云夫处士老兄萧然物外何乐如之因成浮槎诗寄献以抒鄙怀
569001,洪山人自永嘉偕肖甫司马过吴门轻舟入访云将入燕赴平津之约余时病起为蔬食以供从容久之因成一章为别
1031312,马奴周晬思之因成
939138,行崧岭将半下瞰山中一人家似不与世接者凝伫久之因成一绝
1085639,初入巫山界登罗护关云雾晦冥默祷之因成一绝
537172,友人毛仲章文学弃诸生隐居自适铜梁张使君有真逸之目须予诗阐之因成短歌一首
598278,武定女官凤索林领兵先至军容壮甚余喜之因成长句
