78680,子聿欲暂归山阴见乃翁作恶遂不行赠以此诗
567910,山阴景孟刘侯乘舆过访闭门不见乃题诗素纨致谢
930548,子聿欲暂归山阴见乃翁作恶遂不行赠以此诗
973627,张次律见招欲同一诗人饮既见乃新定远令刘旦元赞也诘朝与之别别后寄之并寄次律
802445,余傍资水溯流采金遂穷序水之源贪其山水或冒雨陵雪坐卧松泉至数日不返受障气饮毒泉前后历年至戊申夏五又泛洞庭浮沅遍涉辰鼎渐诸水水中大洲率新淤水皆有毒居之者辄病疟余亦染焉客益阳就医六月廿七日日加申见一人杂诸人中但有身首无腰足问左右皆不见乃鬼也至七月朔酉时若虢太子之尸蹶者炊许觉魂游空虚中余素有离魂病然尚知魂与我为对待者此日则不知有我嗒然若丧其一乃真死也左右疾呼之以千数始苏心先明目乍黑乍明又良久口始能言他医皆
802444,余傍资水溯流采金遂穷序水之源贪其山水或冒雨陵雪坐卧松泉至数日不返受障气饮毒泉前后历年至戊申夏五又泛洞庭浮沅遍涉辰鼎渐诸水水中大洲率新淤水皆有毒居之者辄病疟余亦染焉客益阳就医六月廿七日日加申见一人杂诸人中但有身首无腰足问左右皆不见乃鬼也至七月朔酉时若虢太子之尸蹶者炊许觉魂游空虚中余素有离魂病然尚知魂与我为对待者此日则不知有我嗒然若丧其一乃真死也左右疾呼之以千数始苏心先明目乍黑乍明又良久口始能言他医皆
572583,邹子尹偕僧秋水见访门者不知却之相见乃一笑
816594,余傍资水溯流采金遂穷序水之源贪其山水或冒雨陵雪坐卧松泉至数日不返受障气饮毒泉前后历年至戊申夏五又泛洞庭浮沅遍涉辰鼎渐诸水水中大洲率新淤水皆有毒居之者辄病疟余亦染焉客益阳就医六月廿七日日加申见一人杂诸人中但有身首无腰足问左右皆不见乃鬼也至七月朔酉时若虢太子之尸蹶者炊许觉魂游空虚中余素有离魂病然尚知魂与我为对待者此日则不知有我嗒然若丧其一乃真死也左右疾呼之以千数始苏心先明目乍黑乍明又良久口始能言他医皆
95758,张次律见招欲同一诗人饮既见乃新定远令刘旦
