602490,送黎伯华参政江右
602337,出都怀黎伯华选部
1141643,范文正公黄素小楷昌黎伯夷颂盖宋皇祐三年十一月在青社所书以遗京西转运使苏公舜元者也后二百四十年大兴李侯戡得此本于燕及南来守吴乃文正公乡里即访公子孙以畀之范氏喜而索诗为赠
749708,和黎伯庸夜雨书怀之作 其二
94778,谒昌黎伯庙
1143649,范文正公黄素小楷昌黎伯夷颂盖在青社时所书以遗京西转运使舜元苏公者也后二百年大兴李侯戡得此本于燕及南来守吴乃文正乡里即访公子孙以畀之范氏喜而求诗为赋此二首
594034,答黎伯华登岱后见寄
813498,和黎伯庸夜雨书怀之作
601122,简水南黎伯亨
1132936,范文正公黄素小楷昌黎伯夷颂盖在青社时所书以遗京西转运使舜元苏公者也后二百年大兴李侯戡得此本于燕及南来守吴乃文正乡里即访公子孙以畀之范氏喜而求诗为赋此二首 其二
167304,范文正公黄素小楷昌黎伯夷颂盖在青社时所书
489179,黎伯雍报最
746436,苏文忠昌黎伯韩文公庙碑
1132937,范文正公黄素小楷昌黎伯夷颂盖在青社时所书以遗京西转运使舜元苏公者也后二百年大兴李侯戡得此本于燕及南来守吴乃文正乡里即访公子孙以畀之范氏喜而求诗为赋此二首 其一
204687,临川投赠·今休昌黎伯
914840,谒昌黎伯庙
195219,范文正黄素小楷昌黎伯夷颂盖宋皇佑三年十一
958551,黎伯英解元赠予一大缶封泥如法初谓酒也至乃西山泉云暑中时可一酌珍重其意为赋此章
182047,黎伯英解元赠予一大缶封泥如法初谓酒也至乃
106812,范文正公楷书昌黎伯夷颂平江李使君信之久藏
749707,和黎伯庸夜雨书怀之作 其一
1136189,范文正公楷书昌黎伯夷颂平江李使君信之久藏真本以归文正远孙族长士贵祠以少牢复其家
