958335,衡岳左右道旁茅舍竹门中有老人八十一岁宣和间尝为芜湖尉因官火弃官寓湖湘无生涯学者时过之问经义遂相资助皆自言如是予饭其旁饭已即行马上拟成
872373,医僧洪淡寮见示金刚经解集验方村寺清规皆自著也诗以归之
380275,天仙子·满腹闲愁皆自取
125224,三泉县龙洞洞门深数十步呀然复明皆自然而成
1005031,题法喜院是院一瓦一木皆自能师手而师丈室惟布衾木枕无复长物即之坐庞眉皓顶泊然似不能言者无乃真有道者耶 其二
828042,九月以事至天津季湘苕雪治芗子安楚生八兄寥志二弟皆自京来会适逢九日就市楼小饮即别去途中感赋二首 其二
809618,赋得万物静观皆自得
1128388,题法喜院是院一瓦一木皆自能师手而师丈室惟布衾木枕无复长物即之坐庞眉皓顶泊然似不能言者无乃真有道者耶
1005032,题法喜院是院一瓦一木皆自能师手而师丈室惟布衾木枕无复长物即之坐庞眉皓顶泊然似不能言者无乃真有道者耶 其一
828041,九月以事至天津季湘苕雪治芗子安楚生八兄寥志二弟皆自京来会适逢九日就市楼小饮即别去途中感赋二首 其一
423981,八声甘州·辛稼轩水调歌头和杨济翁、破阵子为陈同甫赋及本调读李广传，皆自写肮脏，不独鹧鸪天追念少年时也。余少志颇似稼轩，辛亥以后，始一意文史。去冬谢太学归卧海上，至菽水不给，遂斥藏书，辄效稼轩体赋此
468283,既至潍州寄同考礼者胶西张绅士行上元杨翮文举吴郡钱逵伯行郑元长卿嘉陵杨基孟载吴兴牟鲁仲望燕山翟汾文中东嘉余尧唐诸暨姜渐羽仪余上虞谢肃凡十人皆自浙西而至南京者也
923024,次韵宋次道庆黄安中李邦直二舍人皆自史院拜命
183891,次韵宋次道庆黄安中李邦直二舍人皆自史院拜
186293,缘识·五恶贪嗔皆自起
1142323,张彦清学士以使事来杭访问忠烈王子孙盖其先皆自保定原系实同乃合二谱聚族谒庙叙拜厥谊甚古仲实赋诗以纪录寄山中辄和之
893001,三泉县龙洞洞门深数十步呀然复明皆自然而成
227931,题法喜院是院一瓦一木皆自能师手而师丈室惟
216709,石屏风·形模皆自然
712823,九月晦日同连双河湛天沐慧容上人二儿士皆自增城将登罗浮中路宿资福寺
1033550,侄孙炳以东野农歌一编来细读足以起予七言有汲水灌花私雨露临池叠石幻溪山草欺兰瘦能香否杏笑梅残柰俗何似此两联皆自出新意自可传世然言语之工又未足多其体格纯正气象和平为可喜余非谀言自有识者因题其卷末以归之
829389,九月以事至天津季湘苕雪治芗子安楚生八兄寥志二弟皆自京来会适逢九日就市楼小饮即别去途中感赋二首
