1073446,清明日与范季实诸人过胥泽民别墅小集二首 其一
909911,三冈亭在邑西南三十里秦昭王使谒者王稽使魏夜与范雎言先生待我于三冈亭之南是也
902651,送樱桃与范尚书二首 其一
134074,送酒与范尧夫
690769,张书绅与范予瞻论余十余年来戎马，颇为劳苦孤危，有诗见赠。读之怆然，因成二首
437780,丁巳九月梦与范季沾同登北潭之临芳亭觉而作诗记其事以示范
1155035,予以长庆二年冬十月到杭州明年秋九月始与范阳卢贾汝南周元范兰陵萧悦清河崔求东莱刘方舆同游恩德寺之泉洞竹石籍甚久矣及兹目击果惬心期因自嗟云到郡周岁方来入寺半日复去俯视朱绶仰睇白云有愧于心遂留绝句
1227998,与范子择三首 其三
495319,张书绅与范予瞻论余十余年来戎马，颇为劳苦孤危，有诗见赠。读之怆然，因成二首 其一
182165,与范信仲及严陵同官纳凉万松亭
20862,人日陪宣州范中丞传正与范侍御宴
141188,与范尚书·满架酴醾雪未乾
1227996,与范子择三首 其一
513861,祁州上巳与范嘉龙御史舟中小酌
577660,和吏部黄尚书与范徵韶韵
238443,与范总干·贤士未达时
360897,与范谦叔饮西园
1080583,与范益谦饮有怀才仲
900425,胡丈广仲与范伯崇自岳市来同登绝顶举酒极谈得闻比日讲论之乐
495320,张书绅与范予瞻论余十余年来戎马，颇为劳苦孤危，有诗见赠。读之怆然，因成二首 其二
883196,十一月二十六夜梦与范石湖各赋梅花六言觉仅记其大意足成二绝 其一
558277,与范进士同宴金鳌阁赋此奉送兼柬黄佥宪
1110569,清明日与范季实诸人过胥泽民别墅小集二首
1025738,水调歌头 其二 七月六日与范至能会饮垂虹。是时至能赴括苍，余以九江命造朝，至能索赋
1110359,十一月二十六夜梦与范石湖各赋梅花六言觉仅记其大意足成二绝
902650,送樱桃与范尚书二首 其二
1227997,与范子择三首 其二
984236,与范总干
951612,胡文广仲与范伯崇自岳市来同登绝顶举酒极谈得闻比日讲论之乐
345215,又和会月波楼与范德镇赓唱之什
51454,雨中与范伯桢登常照寺饮其弟仲昭书舍
184686,十一月二十六夜梦与范石湖各赋梅花六言觉仅
1236164,与范子择三首
469862,寒夜与范汭过黄习远萧萧斋宿得人字
1113477,送樱桃与范尚书二首
1080029,与范益谦炳文叔仪步月
1073447,清明日与范季实诸人过胥泽民别墅小集二首 其二
329123,与范益谦炳文叔仪步月
326619,胡丈广仲与范伯崇自岳市来同登绝顶举酒极谈得闻比日讲论之乐
141187,送樱桃与范尚书
409777,予在桐，与范之有重阳就菊之约，因事迟来江上，昨垂示九日诗索和，并置酒招饮，即席次韵 其二
1088059,胡丈广仲与范伯崇自岳市来同登绝顶举酒极谈得闻比日讲论之乐
409776,予在桐，与范之有重阳就菊之约，因事迟来江上，昨垂示九日诗索和，并置酒招饮，即席次韵 其一
966192,与范信仲及严陵同官纳凉万松亭
263361,予在桐，与范之有重阳就菊之约，因事迟来江上，昨垂示九日诗索和
431321,予在桐，与范之有重阳就菊之约，因事迟来江上，昨垂示九日诗索和，并置酒招饮，即席次韵
472726,雨中与范伯桢登常照寺饮其弟仲昭书舍
1049332,又和会月波楼与范德镇赓唱之什
52507,寒夜与范汭过黄习远萧萧斋宿得人字
1191635,人日陪宣州范中丞传正与范侍御传真宴东峰亭
188094,胡文广仲与范伯崇自岳市来同登绝顶举酒极谈
1065695,与范箕叟避暑西湖
1057266,与范谦叔饮西园
883195,十一月二十六夜梦与范石湖各赋梅花六言觉仅记其大意足成二绝 其二
