67015,拜方正学先生祠堂
657980,寄沈提学先生 其二
655843,奉寄族叔父仲学先生
662214,送静学先生南还
555122,题吴继学先生家藏边景昭花鸟图五首 其五 梅竹五爵
658038,用韵寄黄提学先生
655648,怀族叔父仲学先生
800948,方正学先生祠
580540,郑家驿次沈提学先生题壁韵二首 其一
510587,感事呈宋督学先生
415961,甲骨文歌——兼呈江苏省甲骨文学会会长徐自学先生
292053,甲骨文歌——兼呈江苏省甲骨文学会会长徐自学先生
735943,拜方正学先生祠四十韵
575334,奉寄沈提学先生 其一
814300,方正学先生祠
575335,奉寄沈提学先生 其二
555119,题吴继学先生家藏边景昭花鸟图五首 其二 海棠三白头
555120,题吴继学先生家藏边景昭花鸟图五首 其三 榴花十二红
274919,方正学先生祠
67016,拜方正学先生祠堂·白马魂空结
661052,瀛洲会次丰原学先生韵
555179,挽韶州贰守方源学先生
655552,冬夜步月怀刘悦学先生
655608,除日奉和族叔父仰学先生见寄诗韵
482351,拜方正学先生祠堂二首 其一
701345,题吴继学先生家藏边景昭花鸟图五首 梅竹双鹊
693513,奉寄沈提学先生
662733,和马静学先生入直
584856,谒桐乡王汝学先生
655747,奉和族叔父仲学先生
658005,和王提学先生游茅山
638654,戊午冬至前一日承赵提学先生免试退而赋此
789177,满江红 方正学先生祠，用岳鄂王韵
216853,送傅野·国学先生石与孙
482352,拜方正学先生祠堂二首 其二
657981,寄沈提学先生 其三
644138,谒正学先生祠堂
66825,题方正学先生祠堂
739613,方正学先生祠 其二
732227,和祖心上人游城南谒方正学先生祠
658002,答王提学先生
275820,拜方正学先生祠四十韵
657979,寄沈提学先生 其一
580541,郑家驿次沈提学先生题壁韵二首 其二
581023,督学先生粹夫枉顾话旧偶成
714009,木末亭拜方正学先生像
802118,樊大舅客金陵有诗吊方正学先生墓予次其韵
555121,题吴继学先生家藏边景昭花鸟图五首 其四 败荷四鹡鸰
776972,和施士洁寄和○○楼上学○先生移居原韵
472093,题方正学先生祠堂
582916,送王汝学先生
560527,庆周宗学先生七十
555118,题吴继学先生家藏边景昭花鸟图五首 其一 梅竹双鹊
739612,方正学先生祠 其一
687746,寄沈提学先生
700163,拜方正学先生祠堂二首
658004,和王提学先生雪后游玉山
655293,族叔父仲学先生春月承访弼时赁房方定兹别数月矣有怀寄诗
344178,木末亭吊方正学先生墓和董陆诸君作
688305,郑家驿次沈提学先生题壁韵二首
65430,方正学先生墓
655333,寄湖西族叔父仲学先生
