484845,送前进士夏尚之归宜春
387009,饯吴伯尚之江西
1028215,谢文思许尚之石函广陵散谱
1225552,送宗元始和尚之天竺维那 其三
713151,送蔡尚之之琼州读书其兄肇之官舍
1235996,酬蒋尚之见寄韵二首
297090,感兴原韵·笑人儒腐尚之乎
46870,送前进士夏尚之归宜春
1216474,寄文济王府教授郭尚之
499738,贺邓尚之除丰城虞衡
748502,陶尚之独立图
1211672,寄文济王府教授郭尚之
740856,送崔尚之归蜀
819014,送继禅和尚之杭州开僧学堂
1250820,饯吴伯尚之江西
525174,咏幻住庵辛夷花寄袁尚之
1237000,送宗元始和尚之天竺维那
573288,送吴尚之太史谒告归桐城
287388,送继禅和尚之杭州开僧学堂
641339,梦尚之彦强来问病源所在随以数语答之及觉忘记其辞因成一诗遍寄昆山学诸生且因自警云尔
743304,芦墅放舟同映川兄弟蕙畴稚存尚之渊如应尾
1225550,送宗元始和尚之天竺维那 其一
136082,谢文思许尚之石函广陵散谱
1209261,酬蒋尚之见寄韵二首 其二
1225551,送宗元始和尚之天竺维那 其二
567964,和张尔唯九日招饮同弥生尚之大白洛生绸生用韵兼有所感
567960,中元鲁弥生张尔唯罗尚之招饮同郝刘二校书
1209260,酬蒋尚之见寄韵二首 其一
