196793,归闲退为·莫管声名草木知
862948,庸斋薛微之里居时与仆为莫逆交乱后寓洛西时来关中每相见必诧郝婿之为人岁辛未秋绍先沿檄至长安始得因杯酒接殷勤观其气概知庸斋之不予欺也今因其归诗以饯之
577218,子昂兰竹图为莫知观赋
512419,寿亲堂为莫宗范题
415927,为莫干山碑林撰书勒石①
326623,观西山怀岳麓以为莫能相上下也聊赋此云
438508,田器之燕子图　器之自叙云明昌丙辰予从军塞外合虏里山野舍荒凉难以状言春末有双燕亦巢此屋土人不之识屡欲捕之予曲为全护此燕昼出夜归予必开户待之忽一日飞止坐隅都无惊畏巧语移时不去予始悟明日秋社此鸟当归殆留别语也因作一诗赠之云几年塞外历崎危谁谓乌衣亦此飞朝向芦陂知有为莫投茅舍重相依君怜我处频迎语我忆君时不掩扉明日西风悲鼓角君应先去我何归此诗以细字写之为蜡丸系之燕足上明年四月予受代归又八年泰和甲子任潞州观察判
1088128,观西山怀岳麓以为莫能相上下也聊赋此云
574680,为莫临安曰纯题画
292021,为莫干山碑林撰书勒石
173527,庸斋薛微之里居时与仆为莫逆交乱后寓洛西时
30983,石城·石城昔为莫愁乡
98816,取东坡为·莫嫌学舍小如舟
424297,摸鱼儿·题修篁问讯图，图为莫釐严竹亭先生遗像，嘉庆庚申作，越六十年，经粤匪乱散失。今为先生曾孙价人所得
1206596,蝶恋花  杏庄为莫景行题
