859048,宿土坊驿寄孔世长
1164456,途中寒食题黄梅临江驿寄崔融
766521,踏莎行 题潘补之希甫春驿寄诗图
16117,使至蓝溪驿寄太常王丞
1190929,次石头驿寄江西王十中丞阁老
673608,水口驿寄三山诸友
878271,发湘潭驿寄府公
1049477,广滩驿寄知县卢大年职方
610877,王庄驿寄长洲父老 其二
610876,王庄驿寄长洲父老 其一
685495,王庄驿寄长洲父老
814217,定风波 潜山驿寄答佟艾生方伯
14382,次石头驿寄江西王十中丞阁老
914,途中寒食题黄梅临江驿寄崔融
654705,东河驿寄京师诸友
743405,宿兰山驿寄挽宋小坡给谏
25435,行次灵龛驿寄西蜀尚书
5109,流夜郎至西塞驿寄裴隐
183179,至白湖驿寄四弟
203115,大湖驿寄建州同年窦职方
1207993,寄宿维扬驿，寄怀王仪伯
766322,定风波 其一 潜山驿寄答佟艾生方伯
755470,章丘驿寄弟妇及八妹
503602,舟次水驿寄关外同志
620631,宿新村驿寄怀梁非馨
358849,广滩驿寄知县卢大年职方
1192662,行次灵龛驿寄西蜀尚书
927483,自凤州还至秦川驿寄守倅薛姚二君
850287,至白湖驿寄四弟
1031159,大湖驿寄建州同年窦职方
1247892,梧州归至龙门驿寄诸同志
1166883,使至蓝溪驿寄太常王丞
1180018,秋日泊平望驿寄太常裴郎中
126384,自凤州还至秦川驿寄守倅薛姚二君
24087,行至金牛驿寄兴元渤海尚书
215401,宿土坊驿寄孔世长
366046,踏莎行·题潘补之希甫春驿寄诗图
30127,秋日泊平望驿寄太常裴郎中
1171036,行至金牛驿寄兴元渤海尚书
274826,章丘驿寄弟妇及八妹
1168548,流夜郎至西塞驿寄裴隐
86091,发湘潭驿寄府公
