830829,莫君楚生以吾家绣谷老人药园诗稿见示用族祖瓯亭翁于京师重获瓶花斋旧藏丁卯集得长律三首韵酬之 其一
1074791,过张参军故居曲肱亭旧基在焉山谷老人名亭且有诗所谓邻鸡呼不起拥被听松风者是也
1042155,富谷老人臧用自云本京师兵士咸平中没番五十馀年矣
268514,莫君楚生以吾家绣谷老人药园诗稿
830830,莫君楚生以吾家绣谷老人药园诗稿见示用族祖瓯亭翁于京师重获瓶花斋旧藏丁卯集得长律三首韵酬之 其二
337339,过张参军故居曲肱亭旧基在焉山谷老人名亭且有诗所谓邻鸡呼不起拥被听松风者是也
112825,赠幽谷老人
366371,富谷老人臧用自云本京师兵士咸平中没番五十馀年矣
830831,莫君楚生以吾家绣谷老人药园诗稿见示用族祖瓯亭翁于京师重获瓶花斋旧藏丁卯集得长律三首韵酬之 其三
569751,唐人有画葛稚川移居图者与妇各骑一觠角牛前后五白羊从之一赤脚担装又一少女从之手携束书且行且读妇所乘牛背大幞一婴儿在焉其用笔颇雅劲山谷老人书七言律于尾似不能悉稚川事故为补题一首
843869,莫君楚生以吾家绣谷老人药园诗稿见示用族祖瓯亭翁于京师重获瓶花斋旧藏丁卯集得长律三首韵酬之
1001190,肇庆守郑子礼以李北海石室碑见寄辄次山谷老人韵为谢
1065333,山谷老人赞
1030396,赠幽谷老人
