347857,出院有日用前韵与诸公叙别
434513,临江仙 三月十日与诸君约会西园久而不至花又狼藉因赋此以排闷
246867,与诸兄弟方山别诗
537304,四月一日同于鳞子与诸君水头放舟六首 其二
1088506,三月晦日与诸兄为真率之约徘徊石马晚集保福偶成短句奉呈聊发一笑
526278,徐君叙宅与诸君悬灯赏梨花
1161735,七夕见与诸孙题乞巧文
372561,重九与诸亲会别桥驿
451851,水调歌头 癸巳二月望与诸子泛舟玉湖蛰堪兄约填此调
635055,癸亥初春与诸同学游三昧涧分得吟字
980202,朱郎元章以予不得宫观与诸侄有唱和见寄揽之欣喜五更枕上赋四首 其二
606514,月下与诸叔季小集
445958,剑门道中与诸子
1170657,与诸公游济渎泛舟
1072004,曹山老送笋蕨与诸禅客同食戏成
762562,与诸昆季言怀 其八
810372,与诸子登堠山
762565,与诸昆季言怀 其十一
762564,与诸昆季言怀 其十
436122,癸丑仲秋之夕与诸君会饮山中感时怀旧情见乎辞
617681,家圃与诸客竟日夜剧游伯促咸在赋二十二韵
458063,同前记除夜事。盖食于方妻许，实尚未足称店，但偏房断屋三数间而已。予与诸贫困小店，皆结为友，室苟稍稍生白，辄恹然不喜
451603,马日与诸友饮于小河直街谈时事，窗外新柳初发
1239515,洪武癸丑八月二日与诸暨赵用宾黄汉章赵自立江阴孙大雅大年丘宗岱程传可同游钟山分韵得落字
703557,与诸子约三日春游第三日阻雨二首
717114,人日双桧堂社集与诸从分得高字
1062507,与诸人分韵咏古碑探得罗池庙记以池字为韵
51110,与诸友出城东散步水际
55763,上巳日与诸公游大同雷公山
636247,元夕后一夜与诸子话别
681291,城南姚氏园饯刘太宰与诸吏部晚会归得二首 其二
666893,谈思永以唐张祜题惠山诗勒石重街小洞之闲与诸弟同赋
379910,送菊·忆与诸贤入醉乡
184466,冷副端与诸人九日登高有诗次韵
1163802,秋日与诸公文会天寺
691169,九日与诸年友游栖霞
666992,与诸公同游钟鸣洞赋诗分韵得南字 其二
13227,春分与诸公同宴呈陆三十四郎中
572083,丹中与诸上人谈亡友潘雪松事诗以记之
999570,元卿舟次丹阳读予与诸君前年送别联句因作以道南还愆期之意远垂寄示辄依元韵和答
466049,浣溪沙 戊寅初冬，萍影重过津门，与诸侣小集华夏酒楼，同赋二首
488298,武陵别诸君子余戊子春客武陵时与诸君子作湖山游甚适天涯春尽忽尔怀归各别一首聊感离索 其一 袁履善
446308,与诸子醉别久无诗逾年复羁天末见仲春榕叶纷飞感怀绿烟并寄-天涯-
437159,七夕与诸生游鹊山
923329,与诸同僚偶会赋八题 其四 邑署独鹤
483705,夏日与诸友文燕
589502,九日与诸僚长登茱萸亭
634056,舟中分栗与诸子
683829,张牧迁淮相国与诸君会饯山园感赠四绝
1175093,与诸公池上待月
762556,与诸昆季言怀 其二
537416,与子与诸君即席分赋得瓜
480860,上巳日与诸公游大同雷公山
1042015,初雪朝退与诸公至西阁
347599,挽司空·位与诸公绝
436768,望月婆罗门引 癸卯元宵与诸君各赋词以为乐寂寞山村无可道者因述其昔年京华所见以望月婆罗门引歌之酒酣击节将有堕开元之泪者
543418,己夘仲秋复当计偕北上以家母病不赴与诸友言别四首 其二
1062951,闰月中浣与诸客会于葆真宫郑顾道有诗次韵
447080,宜宾行七首 其一 与诸友水东门品茗
705565,自白下至槜李与诸子约游山阴
390072,张牧迁淮相国与诸君会饯山园感赠四绝
414344,怡和轩与诸友夜坐追话郁达夫之死
619579,有开新舟成与诸子同泛
90864,中秋与诸子果饮
631381,中秋病起与诸子玩月二首 其二
1179324,春日与诸公汎舟
832187,与诸侄夜话作
233524,蒙检讨封送所与诸同朝倡酬盛作某老拙愧后砾
251210,浣溪纱·周口店遗址与诸友同玩
531805,草堂与诸生二首 其一
1079835,与诸舍弟游董村
1006764,木兰花/玉楼春 与诸人泛溪作
531806,草堂与诸生二首 其二
883052,冷副端与诸人九日登高有诗次韵 其一
603362,九日与诸曹友同登显灵宫阁
608833,元夕与诸客宴集同用灯字
596533,重阳与诸友游圭峰二首时闻边报 其一
1042727,雪中退朝与诸同舍登秘阁
318300,西子妆慢·盛暑与诸生浮槎水国，有渺然江海之思
641129,夏日与诸公至絓月兰若
634873,花朝与诸子游榄溪寺
101656,冬日到泉郡次九龙江与诸公唱和十三韵
691251,圆榄山有双树连枝者下有古墓存焉与诸子异而赋之
631055,中秋前五日与诸衲宿片鳞岩
537305,四月一日同于鳞子与诸君水头放舟六首 其三
606294,与诸同年话别于飞云洞二首有引 其一
556327,夜归陈渡草堂时新与诸子别去有怀二首 其二
1079745,京师新郑与诸晁兄弟往还前后数诗 其五
531013,九月望日与诸弟夜泛
894127,季秋侍宴中阙与诸公憩学士院作
87563,梦赏心亭·梦与诸贤会赏心
1168122,与诸公送陈郎将归衡阳
979787,满江红 赴玉山之谪，与诸父泛舟大泽，分题为别
1159538,荅裴令公雪中讶白二十二与诸公不相访之什
388136,复与诸君游张氏园
585421,午日与诸炼师登聚仙台怀霍渭先甘于盘
636233,归韦涌与诸子分赋
832076,台北东荟芳与诸同人祝献堂第三十初度
636066,山中除夕与诸子同赋
1109892,京师新郑与诸晁兄弟往还前后数诗
923328,与诸同僚偶会赋八题 其三 坐久月初上
1183065,泊丹阳与诸人同舟至马林溪遇雨
405324,春分后一日与诸公登万松岭，经周漈村至佛山石壁寺共饭
1079633,与诸弟诸李同登塔山愚壁以事不能来因成二绝 其一
953762,秋日与诸君马头山登高
254319,七月二十六日应嘘堂邀自汉过宁与诸友集于石头城
359019,贺新郎·十月几望，顺德署中，与诸公醉后看月，时余自七夕后往句曲，至此凡四阅月矣
632997,与诸子约三日春游第三日阻雨二首 其二
253223,雨夜京师与诸生论书
631234,中秋后三夕与诸子玩月感赋
634262,与诸子宿万鍊师道院赏月
782838,仲夏与诸同人游王园先至明复庵别业即与同往乘兴复至丰台分韵得诗五首 其五
133807,次韵和韩子华寒食休沐与诸公同赵令园幕归马
400478,西子妆慢  盛暑与诸生浮槎水国，有渺然江海之思。率填此阙，聊以解愠
980203,朱郎元章以予不得宫观与诸侄有唱和见寄揽之欣喜五更枕上赋四首 其一
990660,和十一月十二日与诸君登西园亭榭怀旧书事 其二
18456,与诸客空腹饮
1000135,九日与诸君饮
494312,已及首夏遂尔寻春与诸同志游胜泉寺时春花已罢遂观源泉怅然啸歌偶而成韵
969982,与诸公会饮昆山放生池亭
526078,秋日与诸文士息园宴集各赋一首
276034,与诸子游隐山六洞
255032,春分后一日与诸公登万松岭
567467,与诸生三到徐氏园得兵曹郎简而始入
250410,与诸友过杨歧山独自先下
1062548,八月十五夜与诸友游南湖玩月
631143,初春与诸衲游黄沙坑
1164954,凉州馆中与诸判官夜集
3283,与诸公游济渎泛舟
713498,与诸公别于西陵
510624,梦游衡山遇南极数老人来过却须先生作主与诸老对酌洪崖寿崖在旁歌诗以侑觞合坐皆喜予以诗一首识兴云
1078190,中秋与诸季及德久昆仲望月同饮
965911,七月十八日与诸人集真于燕誉堂
632996,与诸子约三日春游第三日阻雨二首 其一
787348,九日，与诸生暨桂龄、欢龄、喜龄南冈登高
337874,昔与诸友同登香城最胜阁有长歌
141046,与诸弟游天竺
538900,与诸公携酒昭庆戒坛陈少参从僧讲律仪口嘲
36463,冬晚与诸文士会太仆田卿宅
452565,与诸友登永宁寺塔基
923331,与诸同僚偶会赋八题 其二 待灯
246813,与诸公会饮昆山放生池亭
403602,百字令 丁亥1947中秋前一夕，与诸公会宛春山斋，围尊待月
444470,浣溪沙 戊寅初冬，萍影重过津门，与诸侣小集华夏酒楼，同赋二首 其一
1071041,赵丞相过藤州相从累日因言在朝与诸史官会话论修史事恐它时不免南行坐有一士云若有此某当从行今日到此音问也不通退作小诗
280972,与诸侄夜话作
615742,顾别驾以谤解官与诸子饯之归吴
948124,二月十七夜与诸弟小酌尝榧实误食乌喙乌喙堇也古书云以堇寘酒杀人戏成小诗
1099646,戊午与诸友同谒犀斜南谷二师坟作 其一
159198,九日南阳与诸公会
440582,十一日晨，脂车待发，犹与诸同人觅间游祭鳄台。好古成癖，韩公有知，当亦为之胡卢
633549,人日与诸子登观星台 其二
613812,社集同王尧韭潘孟与诸子咏六角井
13643,韦宾客宅与诸博士宴集
463950,与诸子游天目湖
683235,四月一日同于鳞子与诸君水头放舟六首
402087,春分后一日与诸公登万松岭，经周漈村至佛山石壁寺共饭 其一
452539,望海潮 古雷半岛风光秀丽，海产丰饶，惜新建化工企业即将运行，佳景或恐不再，辛卯九月初特与力夫、新河、高凉、疏影来此作告别游，时值台风来袭，巨浪骇人，遂与诸君相约赋此
488302,武陵别诸君子余戊子春客武陵时与诸君子作湖山游甚适天涯春尽忽尔怀归各别一首聊感离索 其五 余鞠夫
85888,病起·昔与诸贤共造廷
479609,九日与诸生适南野
435418,大阳与诸友话旧
630437,秋夜与诸衲坐月
923327,与诸同僚偶会赋八题 其六 华藏竹
762559,与诸昆季言怀 其五
53186,九日与诸生适南野
881606,点绛唇 重阳后数日，菊墩始有花。与诸友再 登，赋第四首 其十四
769646,贺新郎·记与诸子往岁金陵之游，感怀宗二又曾
902824,与诸弟游天竺
1146815,赐梨李泌与诸王联句
16902,酬段丞与诸棋流会宿弊居见赠二十四韵
1163066,再经蒋山与诸长老夜话
412206,仝君具酒相招，座间与诸友谈太白峨眉之胜，归来风雨大作，苦不成寐，晨起作诗柬之
762563,与诸昆季言怀 其九
775553,劝农归路经海会寺与诸同人分赋 其二
711172,与诸子游罗浮
575295,都昌阻风用陈后山韵与诸生
1079743,京师新郑与诸晁兄弟往还前后数诗 其三
1062637,与诸人集陈公美书堂观雪以朔雪洗尽烟岚昏为韵探得烟字
905577,江城子 其二 九日与诸季登高
607258,初任粤西过里与诸亲旧宴集
663158,清明夜与诸友围棋观音寺
344524,上巳与诸于联屐行郊闻留都有楚寇忧而成诗
182695,七月十八日与诸人集真于燕誉堂
174203,横翠堂成与诸公落之蒙贶佳篇不敢当也谩作数
227468,陪范明府与诸同官饮新亭是夕以莞尔榜之因赋
631537,九日与诸子晚眺
447787,黄牛峡夜宿与诸兄灯下论诗豪饮
869989,次韵和韩子华寒食休沐与诸公同会赵令园暮归马上偶成
1110311,冷副端与诸人九日登高有诗次韵
53847,与诸从游登燕子矶
452094,与诸友过杨歧山独自先下
1091926,和李无变与诸公出郊访王彦博
1149555,酬段丞与诸棋流会宿弊居见赠二十四韵
451933,与诸友会于九溪理安寺分韵得无字戏为柏梁台体
509832,与诸友夜过贞节桥
671996,与诸友东郭草亭看牡丹二首 其二
1070045,神鱼泓是日与诸公流杯水中如西丘故事
537480,复与诸君游张氏园 其四
327334,闰月十一日月中坐彭蠡门唤船与诸人共载汎湖至堤首回棹入西湾还分韵赋诗约来晚复集诗不至者浮以大白
630501,与诸衲游知园
1079744,京师新郑与诸晁兄弟往还前后数诗 其四
227582,与诸公游葆真宫
377068,寒食礼·清明寒食与诸人
462119,乙未居庸年会与诸兄沐南宫温泉
34313,醉中惜花更书与诸从事
673107,与诸乡友手谈
588058,小楼成与诸戚友宴饮用杜韵二首 其一
15311,答裴令公雪中讶白二十二与诸公不相访之什
468063,宜宾行七首 与诸友水东门品茗
452464,癸巳七月与诸友南行至车站方知铁路因台风暴雨停运遂返素涛阁閒话尽啖为路途所备酒肴相约赋诗为记
633548,人日与诸子登观星台 其一
290435,与诸子登堠山
372780,走笔戏呈机宜著作与诸同席
1156747,与诸客空腹饮
569771,明卿与诸君过澹圃分韵得穷字
5617,郡斋雨中与诸文士燕集
922964,发句米奉议见示与诸公唱和北山壮观佳篇因索鄙制老病久弃笔砚勉强口占小子次韵奉酬
615656,九日与诸年友游栖霞 其二
50338,与诸弟别乐庵弟约有江阳之会
556326,夜归陈渡草堂时新与诸子别去有怀二首 其一
676679,雪后石湖与诸友同泛 其二
636473,游飞水潭与诸子同赋限韵 其二
596534,重阳与诸友游圭峰二首时闻边报 其二
956361,予寓邑中与诸子讲学巨山侄孙转示初冬书事因用韵
1147644,冬日到泉郡次九龙江与诸公唱和十三韵
2970,晚春严少尹与诸公见过
983401,辛亥寒食清明之交杜陵先生暂归省谒与诸生食罢游后园独坐萧然戏作长句示诸儿
1164825,早秋与诸子登虢州西亭观眺
6524,早秋与诸子登虢州西亭观眺
666991,与诸公同游钟鸣洞赋诗分韵得南字 其一
951742,陪范明府与诸同官饮新亭是夕以莞尔榜之因赋此诗
1092979,月夜散步浮桥因取酒与诸友小饮
452470,与诸公重过鹅鼻嘴步前韵
636472,游飞水潭与诸子同赋限韵 其一
27060,春晚与诸同舍出城迎座主侍郎
616067,与诸同年探郊梅晚酌灵谷寺
922963,发句米奉议见示与诸公唱和北山壮观佳篇因索鄙制老病久弃笔砚勉强口占小子次韵奉酬 和王崇禧寄扬州尚书
62121,夏日与诸友文燕
596531,戊戌秋谭少铉与诸贤父兄为予祈嗣大雁山赋此奉谢时予受室几四载矣
748246,与诸友游石岭
923401,暮春与诸同僚登钟山望牛首
452132,周日与诸友小聚戏作
697469,己夘仲秋复当计偕北上以家母病不赴与诸友言别四首
590235,孟夏与诸公臬司较艺浏庠士次壁间韵
670183,同元美与诸比部早夏城南放舟 其五
1223773,鳌峰者国史院庭中石名也伯宁御史为仆言自其先公时与诸老名胜赋诗者盖数百篇今玉堂无本而御史家具有之且曰峰所托差低盍稍崇其址乃八月五日既克如命因赋此以报且请录示旧诗补故事以传云
634253,甲寅中秋予以乞经留滞长干与诸公偕宿餐云鍊师道院却赠
490588,重阳日与诸省丈都门晚集
570446,张牧迁淮相国与诸君会饯山园感赠四绝 其四
209776,太和道中雪作因与诸友下马索酒快饮率尔成诗
998886,予卧病数日意思殊昏昏中秋强起陪老人把酒对月不敢濡唇吻思去岁在当涂试院与诸公饮酒赋诗又一载矣因成长句
1155805,与诸公同出城观稼
1113869,中春之初与诸友游黎氏园荆华赠予桃花一枝归置瓶中连日不凋因成两绝示同行且令同赋
1151842,晚春严少尹与诸公见过
959974,二月丁亥与诸友奠何先生毕退游北山智者寺书二十八言
634052,峡水与诸子饮
980200,朱郎元章以予不得宫观与诸侄有唱和见寄揽之欣喜五更枕上赋四首 其四
447506,宿钓鱼城与诸君茗饮月下
622061,春分后入东土无日不与诸花共朝夕也
152153,二月十七夜与诸弟小酌尝榧实误食乌喙乌喙堇
65466,与诸公酌酒
839353,与诸晋昭诸公游九龙山二首 其一
631274,与诸子赏牡丹用尘异韵
277808,九日，与诸生暨桂龄、欢龄、喜龄南冈登高
364598,与诸公会赵氏园主人加送酒馔既而求诗书五十六字
1062495,与诸友游南湖分韵得红字
543419,己夘仲秋复当计偕北上以家母病不赴与诸友言别四首 其三
344001,与诸子俱问而喻疾以诗见示因詶其韵
1121236,戊午与诸友同谒犀斜南谷二师坟作
631210,与诸衲赴大石李村荔枝之约
809005,元夜与诸王宴饮乾清宫
1116937,与诸同僚偶会赋八题 不期而会
461571,聚武昌与诸同学登黄鹤楼，座中更有十七年不见者，归来赋此以记
810567,劝农归路经海会寺与诸同人分赋
634049,江中山影与诸子分赋
726486,于莱城东十里与诸门徒登青阳岭太基山上四面及中嵿扫石置仙坛诗
329091,京师新郑与诸晁兄弟往还前后数诗
664768,彭麓诗和白坡提学与诸公见过之作
839354,与诸晋昭诸公游九龙山二首 其二
1218649,题刘孝子传后泰州海陵县刘子彬性孝友与诸弟隐居读书耕以为养曲尽其道亲丧茔葬有异色蛇见又产连理木人以为孝感状元陈祖仁记其事司业江存礼因作刘孝子传为题其后
513627,春坊斋夜追忆旧时在翰林东署与诸君子喜雪焚香联句之作奉简亨甫鼎仪世贤三太史
447500,暮春登剑门关用温飞卿韵与诸君同赋
1106374,与诸友游杨氏池上呼王隐居小饮晚登书台
735530,病中与诸友
655589,病中倦卧偶思年二十四时寓居东坪与诸生夜读赋玩月诗微吟一过神思洒然遂次旧韵
245986,初二日晚外家聚会既散与诸弟复饮至旦
703698,中秋病起与诸子玩月二首
665503,傅木虚报与诸君问余疾苦不至口述嘲之
189432,二月丁亥与诸友奠何先生毕退游北山智者寺书
78362,予十许岁即往来云门诸山今复与诸子来追念凄
384749,中秋日晚雨忽霁与诸友看月
819829,阅两浙輶轩录载绍兴张岱事岱字宗子累世通显服食豪侈家蓄梨园数部日与诸胜流度曲徵歌及间以古学挑之则自四部七略以至唐宋说家荟萃琐屑之书靡不赅悉尝自谓少壮秾华恍如梦境耳因有感于李猛庵丈之为人率赋一律寄赠
13731,七夕见与诸孙题乞巧文
475300,五月望夜与诸君山中再酌和仅初韵
538627,同子与诸君游大司寇顾公箬溪书院分韵时公不出且折简见召 其一 得松字
333631,中秋与诸季及德久昆仲望月同饮
488300,武陵别诸君子余戊子春客武陵时与诸君子作湖山游甚适天涯春尽忽尔怀归各别一首聊感离索 其三 吴公箨
1057938,与诸人步郊外作寄舍弟斯川
313985,贺新郎·与诸子夜话，悼佑曾以宁
615758,伍国开斋中与诸子分赋怀五岳诗予得恒山
634048,与诸子登飞来寺至半山怯风而返
687956,岛门秋雨与诸子同赋
1079634,与诸弟诸李同登塔山愚壁以事不能来因成二绝 其二
670184,同元美与诸比部早夏城南放舟 其六
583323,大理徐成章与诸寺僚邀饮于鸡鸣寺成章有诗次韵奉答兼柬翁朝良诸友
636134,长至日与诸公集翠林寺晚过香雪庵分赋
465444,木兰花慢 4月春假，与诸生游马江头
615639,清明与诸从及何龙友晚泊
603868,与诸子集智度寺
1062576,与诸友访黄宗鲁宗鲁置酒于思猷亭席上分韵赋思猷亭诗各以姓为韵予得谢字
517817,除夕与诸友坐谈罢感怀
5233,与诸公送陈郎将归衡阳
1126497,和十一月十二日与诸君登西园亭榭怀旧书事
619659,舟夜阻风与诸客空酌
984714,中秋日与诸公同游宝莲院分韵得尘字
537481,复与诸君游张氏园 其五
566918,九月朔与诸友醉某子长安邸舍得花字
1046183,望与诸公会于大慈闻海云山茶合江梅花开遂相邀同赏虽无歌舞实有清欢因成拙诗奉呈
923330,与诸同僚偶会赋八题 其五 府庠小沼
357983,近蒙明堂使局赐酒元巳日与诸僚会饮城东王君仪先生辟谷独不敢召以二尊为寿
257080,大阳与诸友话旧
1091383,清明日余与诸友游招隐山寺酌酒宋氏园亭谒苏才翁墓而归
453008,雨夜京师与诸生论书
832143,旭东遗骸至，与诸同人迎于葫芦墩驿
855288,清平乐 与诸君小酌，烛下见花，戏作一首 其二
619634,白云寺与诸子对菊怀何襄武伯友
453423,雨中与诸子游浮梁瑶里
1089366,雪再作山甫约游雨花台不遂闻与诸公登凤凰台次韵送似
468004,彩云轩品茗与诸子同看西湖各有戏作四首
775912,劝农归路经海会寺与诸同人分赋 其一
13226,八月十五夜与诸公锦楼望月得中字
681290,城南姚氏园饯刘太宰与诸吏部晚会归得二首 其一
490639,春日与诸亲友同过灵殿寺观梅
564181,与诸友避暑河亭小酌
146117,七月十三夜用灯牌字韵凑成一诗与诸宾一笑
298905,病中与诸友
1039285,走笔戏呈机宜著作与诸同席
1169067,醉中惜花更书与诸从事
1155806,与诸同年贺座主侍郎新拜太常同宴萧尚书亭子
631380,中秋病起与诸子玩月二首 其一
762555,与诸昆季言怀 其一
388068,四月一日同于鳞子与诸君水头放舟
517601,冬日与诸生登天香台书寄王处士
917771,蒙检讨封送所与诸同朝倡酬盛作某老拙愧后砾某祗拜以呈
1198854,与诸兄弟方山别诗
277159,暮春雨后与诸文士宴集新馆
636359,丹霞除夕与诸子守岁
538628,同子与诸君游大司寇顾公箬溪书院分韵时公不出且折简见召 其二 得穷字
700066,重阳与诸友游圭峰二首时闻边报
462128,浣溪纱 周口店遗址与诸友同玩
15207,唐郎中宅与诸公同饮酒看牡丹
335796,清明日余与诸友游招隐山寺酌酒宋氏园亭谒苏才翁墓而归
900810,琴斋乃予旧居以琴名斋吾为之也项先生与诸生居之谈庄讲老有佳趣向尝造焉而忆往事乃亦有分胜多救之处成诗呈项先生者书其实耳
26433,山中与诸道友夜坐闻边防不宁因示同志
683275,复与诸君游张氏园
630865,西樵碧玉洞与诸子卜筑
923326,与诸同僚偶会赋八题 其一 不期而会
517421,与诸公同游神乐观
280933,台北东荟芳与诸同人祝献堂第三十初度
457221,七月二十六日应嘘堂邀自汉过宁与诸友集于石头城，明晨独往苏州西山，闻诸子复集于求雨山
1192455,宣上人见示与诸公唱和
636308,中秋夜与诸子归舟泊港口，玩月分赋
444553,倦寻芳 千山词聚，拈此调与诸侣同赋
616330,圆榄山有双树连枝者下有古墓存焉与诸子异而赋之 其三
817810,中秋夜，与李子沧萍、张子友鹤，观月社园。忆去年中秋与诸贞壮、黄元白同饮于此，李、张二子亦与焉。贞壮、元白后先南归，惟二子尚相从不去。又朝来始得唐天如兵间书，知其仍在人世，伤乱怀远，一时交集。张子为余援琴奏“捣衣之操”，诗以写之
914007,中秋与诸子果饮
893939,九日南阳与诸公会
866625,与诸友同坐梅下月雾凄清风琴泠然不类人世各联三二语醉归卧南窗下明日徵所出语皆忘失不记因追赋古诗以补遗缺
889599,送酒与诸葛宰
9892,泊丹阳与诸人同舟至马林溪遇雨
655006,二月二日与诸亲友别后道中偶成
328732,与诸舍弟游董村
689407,武陵别诸君子余戊子春客武陵时与诸君子作湖山游甚适天涯春尽忽尔怀归各别一首聊感离索 袁履善
543420,己夘仲秋复当计偕北上以家母病不赴与诸友言别四首 其四
488299,武陵别诸君子余戊子春客武陵时与诸君子作湖山游甚适天涯春尽忽尔怀归各别一首聊感离索 其二 邬汝翼
1125158,朱郎元章以予不得宫观与诸侄有唱和见寄揽之欣喜五更枕上赋四首
1153036,郡斋雨中与诸文士燕集
676678,雪后石湖与诸友同泛 其一
445933,彩云轩品茗与诸子同看西湖各有戏作四首 其四
36720,春夜与诸公同宴呈陆郎中
636282,同住东林，有厌清苦者相继辞去。时值小除，与诸子守岁，示此以坚其志
922348,用过韵，冬至与诸生饮酒
243857,琴斋乃予旧居以琴名斋吾为之也项先生与诸生
631037,丹霞诗十二首 与诸衲绕海螺山脚二首 其十
923235,润守修撰见招与左丞王公大夫俞公东园集会宾主四人更无他客某顷为南都从事值故相杜公与王宾客焕毕大卿世长朱兵部贯冯郎中平同时退居府中作五老会一日大尹庐陵欧阳公作庆老公宴而王毕二公以病不赴中座亦只四人某时与诸僚同与席末言念往昔正类今辰然自皇祐庚寅迄今元符己卯整五十年矣抚事感怀辄成七言四韵
476659,与诸弟别乐庵弟约有江阳之会
34208,与诸门生春日会饮繁台赋
537477,复与诸君游张氏园 其一
1079742,京师新郑与诸晁兄弟往还前后数诗 其二
379362,与诸友·龙亡大泽蚖蛇出
615955,初秋与诸子游海淀 其一
990801,与诸友普明院亭纳凉分题
879874,送晦庵语孟集注与诸侄
603774,丙戌赴谪下雉过小金山谒苏祠与诸季言别
716620,与诸将登大甑山作
193250,冬夕与诸公宴集贤梅学士西斋分得今夕何夕探
183384,暮春与诸同僚登钟山望牛首
434537,满江红 清明与诸生登西硙柏冈
4575,与诸子登岘山
57767,郊游与诸公作
683466,同子与诸君游大司寇顾公箬溪书院分韵时公不出且折简见召 得松字
1156758,分司洛中多暇数与诸客宴游醉后狂吟偶成十韵因招梦得宾客兼呈思黯奇章公
556303,次叶师与诸生讲书钟楼寺闻钟作
705552,与诸兄弟饮射作
588059,小楼成与诸戚友宴饮用杜韵二首 其二
481346,与诸公酌酒
159186,季秋侍宴中阙与诸公憩学士院作
691940,同元美与诸比部早夏城南放舟
323957,和李无变与诸公出郊访王彦博
504497,金陵与诸生玩月时得告
447565,西湖与诸诗友同赋送春诗二首 其一
445930,彩云轩品茗与诸子同看西湖各有戏作四首 其一
900503,六月晦发霅川广德兄与诸友饮饯于渔山已而皆有诗赠别寄此言谢
631281,中秋双镜楼与诸子玩月
251211,满庭芳·乙未谷雨与诸朋有明月山之行是夜小饮约寄此调
948157,太和芍药最盛有红都胜黄楼子为之冠昔山谷常宰邑篇咏极多独遗此花四月八日与诸友共赏戏成小诗
1161861,韦宾客宅与诸博士宴集
281790,仝君具酒相招，座间与诸友谈太白峨眉之胜，归来风雨大作，苦不成寐，晨起作诗柬之
385629,午日与诸炼师登聚仙台怀霍渭先甘于盘
