985243,横翠堂成与诸公落之蒙贶佳篇不敢当也谩作数语以纪其实
490881,夏日舟次平望与诸故旧叙别
1222380,雨中与诸公会饮市楼
636246,华林除夕与诸子守岁赋得山中无历日寒尽不知年得无字
479037,与诸友出城东散步水际
452136,丁亥十月十五与诸诗友夜游西湖
1088422,闰月十一日月中坐彭蠡门唤船与诸人共载汎湖至堤首回棹入西湾还分韵赋诗约来晚复集诗不至者浮以大白
630967,与诸子探早梅
570443,张牧迁淮相国与诸君会饯山园感赠四绝 其一
62542,五月望夜与诸君山中再酌和仅初韵
980201,朱郎元章以予不得宫观与诸侄有唱和见寄揽之欣喜五更枕上赋四首 其三
17778,与诸同年贺座主侍郎新拜太常同宴萧尚书亭子
590215,与诸父兄会於寺醉中命题一门和气
574903,二十日与诸生私祀忠定祠退馂松风阁
685969,与诸同年话别于飞云洞二首有引
1047208,和王公觌望日与诸公会于大慈同赏山茶梅花
251189,乙未居庸年会与诸兄沐南宫温泉
250585,与诸公重过鹅鼻嘴步前韵
1155808,与诸道者同游二室至九龙潭作
250125,浣溪沙·己丑八月十七日与诸友步月青山岭
711171,与诸子游罗浮
434521,望月婆罗门引 其一 癸卯元宵与诸君各赋词以为乐寂寞山村无可道者因述其昔年京华所见以望月婆罗门引歌之酒酣击节将有堕开元之泪者
569452,与诸公过瓦官寺作食
375560,佛国白赴召刘侍郎无言与诸贤作供于报恩题壁以纪傍有隆茂宗所作古木怪石
1071136,中春之初与诸友游黎氏园荆华赠予桃花一枝归置瓶中连日不凋因成两绝示同行且令同赋 其一
680326,与诸子登岘山
691207,初秋与诸子游海淀
606063,十四夜与诸文学对月酌别
1078189,自海外归间关万里经涉五载初抵家与诸季会饮成长句兼简邹德久昆仲
343803,与诸弟醵饮牡丹花下刘将军不速而至徵其杖头钱逸去以诗见嘲依韵戏詶
321983,四月从驾诣德寿宫与诸公会食于和乐楼
691216,与诸同年游燕子矶二首
537308,四月一日同于鳞子与诸君水头放舟六首 其六
506479,上巳日与诸公饮酒
906585,与诸公游葆真宫
504986,与诸友山中晚行
762557,与诸昆季言怀 其三
780156,金缕曲 与诸同人话吴兴风景有感 十七叠前韵
668683,中秋日晚雨忽霁与诸友看月
1109954,与诸弟诸李同登塔山愚壁以事不能来因成二绝
616328,圆榄山有双树连枝者下有古墓存焉与诸子异而赋之 其一
777224,劝农归路经海会寺与诸同人分赋 其三
615956,初秋与诸子游海淀 其二
1150288,冬中与诸公会宿姚端公宅怀永乐殷侍御
1071137,中春之初与诸友游黎氏园荆华赠予桃花一枝归置瓶中连日不凋因成两绝示同行且令同赋 其二
522441,新舟成约庵期与诸公同泛诗以速之
189491,辛亥寒食清明之交社陵先生暂归省谒与诸生食
615655,九日与诸年友游栖霞 其一
452240,晚宴后与诸友重饮大排档
280956,旭东遗骸至，与诸同人迎于葫芦墩驿
349911,江城子·与诸年少论缠足
888087,太和道中雪作因与诸友下马索酒快饮率尔成诗
488301,武陵别诸君子余戊子春客武陵时与诸君子作湖山游甚适天涯春尽忽尔怀归各别一首聊感离索 其四 钱季善
851089,七月十三夜用灯牌字韵凑成一诗与诸宾一笑
250438,丁亥十月十五与诸诗友夜游西湖
691103,城南姚氏园饯刘太宰与诸吏部晚会归得二首
458403,三月十九夜醉中电肖，问所寄酒达未，肖云正与诸友试此酒，皆已醺然矣
434520,望月婆罗门引 其二 癸卯元宵与诸君各赋词以为乐寂寞山村无可道者因述其昔年京华所见以望月婆罗门引歌之酒酣击节将有堕开元之泪者
567455,与诸君集明月庵在妓坊之南隔一垣得春字
341424,与诸弟夜就田家宿听雨枕上偶成
714889,三月晦日与诸子分赋
1038211,余前此二纪保釐西郊与判台李少师及洛社诸君游龙门饮伊上有渔者献鳜鱼十数尾因作羹鲙坐客有思鲈之兴余后守魏累请休致久而未遂曾为忆鳜诗寄洛下诸贤今年秋累与诸君饮于东田池上苇间鲙鱼炊香稻以佐酒浩然有江湖之趣因作是诗并录忆鳜诗如左
855186,西江月 其三 长安秋夜与诸君饮，分题作
782715,与诸同人泛舟天桥湾得骸字磨字二首 其二
631042,丁未元日与诸衲泛舟江上
703240,人日与诸子登观星台
212775,月中与诸友还在沙溪
634866,初秋与诸子登宝莲寺风雨大至
537479,复与诸君游张氏园 其三
609156,黎惟敬秘书新辟东林社与诸客同过
19086,与诸公同出城观稼
670180,同元美与诸比部早夏城南放舟 其二
466985,西湖与诸诗友同赋送春诗二首
452508,浣溪沙 己丑八月十七日与诸友步月青山岭
1179307,四川使宅有韦令公时孔雀存焉暇日与诸公同玩座中兼故府宾妓兴嗟久之因赋此诗用广其意
260555,七夕与诸生游鹊山
1217731,聚星堂与诸文士宴集分韵得凉字
36179,宣上人见示与诸公唱和
922965,发句米奉议见示与诸公唱和北山壮观佳篇因索鄙制老病久弃笔砚勉强口占小子次韵奉酬 和壮观亭
369754,曹山老送笋蕨与诸禅客同食戏成
607711,长至日与诸生别后独步星岩
615901,初冬载酒陶摇光宅与诸子夜集分赋
715565,初秋与诸子泛舟长水
122559,予寓邑中與諸子講學巨山姪孫轉示初冬书事因
447566,西湖与诸诗友同赋送春诗二首 其二
817282,与诸同人泛舟天桥湾得骸字磨字二首
670181,同元美与诸比部早夏城南放舟 其三
263143,与诸晋昭诸公游九龙山
1179300,八月十五夜与诸公锦楼望月得中字
452290,辛卯春与诸友游太姥山
990802,与诸弟及李少府访广教文鉴师
1147127,春夜与诸公同宴呈陆郎中
817728,上巳与敷庵登江亭忆与诸学子前年之游
537303,四月一日同于鳞子与诸君水头放舟六首 其一
617520,佛日与诸君泛舟江上俗是日已陈龙舟之戏谓之出水龙
1132540,郑下赵光道与余有十五年家世之旧守官代郡之崞县闻余以使事羁留平城与诸公相从皆一时英彦遂以应举自免去驾短辕下泽车驱一僮二驴扶病以来相聚凡旬日而归昔白乐天与元微之偶相遇于夷陵峡口既而作诗叙别虽憔悴哀伤感念存没至叹泣不能自已而终篇之意盖亦自开慰况吾辈今日可无片言以识一时之事邪因各题数句而余为之叙夜将半各有酒所语不复锻鍊要之皆肺腑中流出也
528467,新色寺与诸生留别
251199,聚武昌与诸同学登黄鹤楼座中更有十七年不见者归来赋此以记
916332,冬夕与诸公宴集贤梅学士西斋分得今夕何夕探得云字
1150372,冬晚与诸文士会太仆田卿宅
762561,与诸昆季言怀 其七
636433,岛门秋雨与诸子同赋 其二
1087602,与诸同寮谒奠北山过白岩小憩
1099875,昔与诸友同登香城最胜阁有长歌一首今壁题已失仅记炊烟不尽愁不尽七字追怀往事遂为律体以足之
446011,辛卯五月既望与诸子醉泛后海分韵得共字
1178414,与诸子登岘山
537306,四月一日同于鳞子与诸君水头放舟六首 其四
250583,癸巳七月与诸友南行至车站方知铁路因台风暴雨停运
762560,与诸昆季言怀 其六
569893,夜与诸公饮大雄殿前庭银杏下得月有作
447789,留社成立大会与诸子宴集西湖金庸别业分韵得“枝”字
570444,张牧迁淮相国与诸君会饯山园感赠四绝 其二
250227,蒙仰翁招与诸诗友茗坐并以新茶见赐赋此奉谢
698581,夜归陈渡草堂时新与诸子别去有怀二首
250714,辛卯春与诸友游太姥山
1150311,秋暮与诸文士集宿姚端公所居
1079741,京师新郑与诸晁兄弟往还前后数诗 其一
865904,月中与诸友还在沙溪
102696,用过韵冬至与诸生饮酒
1067301,与诸友汲同乐泉烹黄檗新芽
36497,冬中与诸公会宿姚端公宅怀永乐殷侍御
38023,再经蒋山与诸长老夜话
1249180,海虞山人缪叔正扁舟相过以慰别后之思余谓兵后朋旧星散得一顷相见旷如隔世遂邀汝阳袁子英天平范君本彭城钱好学荣城赵善长扶风马孟昭聚首可诗斋内诸公亦乐就饮或携肴或挈果共成真率之会由是皆尽欢饮酒酣各赋诗以纪走笔而就兴有未尽者复能酬倡以乐永夜余以诗先成叔正俾余叙数语于篇首缅思烽火隔江近在百里今夕之会诚不易得况后会无期乎吴宫花草娄江风月今皆走麋鹿于瓦砾场矣独吾草堂宛在溪上余虽祝发尚能与诸公觞咏其下共忘此身于干戈
174378,中秋日与诸公同游宝莲院分韵得尘字
743947,与诸子游隐山六洞
444119,己丑暮春与诸子夜饮梅湖分韵得“上”字
1043517,与诸公会赵氏园主人加送酒馔既而求诗书五十六字
750127,除夕与诸弟饮即席
447472,淑萍姐来渝与诸友聚饮于佛图关
35588,周泰·名与诸公又不同
689587,与诸友东郭草亭看牡丹二首
762566,与诸昆季言怀 其十二
923333,与诸同僚偶会赋八题 其八 登赏心亭
1223586,十二月廿又二日观雪泠然台城郭山川四顾清爽小儿诵东坡先生聚星堂诗甚习殊可乐也因忆马明初云往岁德常杜左司尝与诸公和之成巨轴然皆不及一见仆则不敢言和但对景乘兴谨用其韵尔僭越之罪观者恕之
314091,贺新郎·记与诸子往岁金陵之游，感怀宗二又曾
1183039,与诸公同登无锡北楼
183394,发句米奉议见示与诸公唱和北山壮观佳篇因索
860752,与诸友游杨氏池上呼王隐居小饮晚登书台 其二
331010,中春之初与诸友游黎氏园荆华赠予桃花一枝归置瓶中连日不凋因成两绝示同行且令同赋
855285,清平乐 其四 春晚与诸君饮
1251240,同子与入院时就文庙开试院与诸公同止云章阁上
552892,学中与诸公饮酒分韵得晴字
105507,与诸友普明院亭纳凉分题
6307,凉州馆中与诸判官夜集
1158835,奉陪郑中丞自宣州解印与诸侄宴馀干后溪
452715,初二日晚外家聚会既散与诸弟复饮至旦
635820,端午与诸子再泛虎溪分赋
1150530,与诸门生春日会饮繁台赋
445104,象湖雨中与诸同仁聚饮共庆江右立社
250632,晚宴后与诸友重饮大排档
615582,夜与诸子步月
445932,彩云轩品茗与诸子同看西湖各有戏作四首 其三
1189748,山中与诸道友夜坐闻边防不宁因示同志
544203,香山寺流憩亭小酌逢张郑应季四文学邀宿华严洞余与诸子素昧平生酒酣兴发策蹇十里从之诘朝复抵碧云泉上
817299,仲夏与诸同人游王园先至明复庵别业即与同往乘兴复至丰台分韵得诗五首
616062,与诸同年游燕子矶二首 其二
251483,十一日晨脂车待发犹与诸同人觅间游祭鳄台
475313,与诸从游登燕子矶
337707,戊午与诸友同谒犀斜南谷二师坟作
457139,和子南与诸友登永宁寺塔基
782836,仲夏与诸同人游王园先至明复庵别业即与同往乘兴复至丰台分韵得诗五首 其三
368390,与诸人集陈公美书堂观雪以朔雪洗尽烟岚昏为韵探得烟字
158985,九日与诸君饮
186431,六月晦发霅川广德兄与诸友饮饯于渔山已而皆
254422,和子南与诸友登永宁寺塔基
9834,与诸公同登无锡北楼
1085259,四月从驾诣德寿宫与诸公会食于和乐楼是日借洪景严承旨马戏云从驾滥骑承旨马朝天叨缀舍人班异日再集胡舍人邦衡云不可不成篇也遂于楼中足之
782837,仲夏与诸同人游王园先至明复庵别业即与同往乘兴复至丰台分韵得诗五首 其四
1067103,近蒙明堂使局赐酒元巳日与诸僚会饮城东王君仪先生辟谷独不敢召以二尊为寿
656121,与诸生授康节诗道傍石
606295,与诸同年话别于飞云洞二首有引 其二
313414,怡和轩与诸友夜坐追话郁达夫之死
150263,朱郎元章以予不得宫观与诸侄有唱和见寄揽之
277801,子乔招游石溪，与诸生会诗，听远道人弹琴，即事遣闷，示子乔
993046,徐元舆见邀与诸君同游至峰山溪上作
684639,雪后石湖与诸友同泛
1058497,出院有日用前韵与诸公叙别
709009,多丽  星期与诸子宴集涉园遥同次韵
602197,叶午溪节推取道柳州适逢九日与诸同寅敬约小集
445931,彩云轩品茗与诸子同看西湖各有戏作四首 其二
1082581,与诸友
1078343,初见牡丹与诸季申伯小酌
491033,冬夜与诸友同集冯郡伯园亭分得栖字
22673,与诸公池上待月
537478,复与诸君游张氏园 其二
779057,贺新郎 十月几望，顺德署中，与诸公醉后看月，时余自七夕后往句曲，至此凡四阅月矣
782834,仲夏与诸同人游王园先至明复庵别业即与同往乘兴复至丰台分韵得诗五首 其一
616329,圆榄山有双树连枝者下有古墓存焉与诸子异而赋之 其二
139047,送酒与诸葛宰
990661,和十一月十二日与诸君登西园亭榭怀旧书事 其一
762558,与诸昆季言怀 其四
717066,闻观察公以暮春日与诸公为菖蒲涧之游赋此纪事并以为观察公寿
782714,与诸同人泛舟天桥湾得骸字磨字二首 其一
221884,与诸友同坐梅下月雾凄清风琴泠然不类人世各
276165,与诸子集沈宪吉北山草堂分赋九松并纪席中胜事
570445,张牧迁淮相国与诸君会饯山园感赠四绝 其三
515882,暮春与诸文学掾觞于万桂山阴
1096291,佛国白赴召刘侍郎无言与诸贤作供于报恩题壁以纪傍有隆茂宗所作古木怪石
685026,小楼成与诸戚友宴饮用杜韵二首
18493,与诸客携酒寻去年梅花有感
670179,同元美与诸比部早夏城南放舟 其一
690261,与诸公同游钟鸣洞赋诗分韵得南字
537307,四月一日同于鳞子与诸君水头放舟六首 其五
36506,秋暮与诸文士集宿姚端公所居
533400,黄龙洞听赵太史与诸生讲学
488303,武陵别诸君子余戊子春客武陵时与诸君子作湖山游甚适天涯春尽忽尔怀归各别一首聊感离索 其六 邬章文
603191,与诸寅丈游南溟
478097,郊游与诸公作
769653,贺新郎·与诸子夜话，悼佑曾以宁
491102,后苑牡丹盛开与诸公同赏分韵得杯字
328878,与诸弟诸李同登塔山愚壁以事不能来因成二绝
536534,秋日与诸大夫登后湖阁宴眺有述
615657,九日与诸年友游栖霞 其三
843560,与诸晋昭诸公游九龙山二首
616061,与诸同年游燕子矶二首 其一
1155807,与诸客携酒寻去年梅花有感
105342,徐元舆见邀与诸君同游至峰山溪上作
782835,仲夏与诸同人游王园先至明复庵别业即与同往乘兴复至丰台分韵得诗五首 其二
636432,岛门秋雨与诸子同赋 其一
531200,三月二十八日与诸弟出野观社笋舆穿窄径日中乃得平路小憩大梵寺
137758,秋日与诸君马头山登高
687960,游飞水潭与诸子同赋限韵
102893,与诸弟及李少府访广教文鉴师
1039473,重九与诸亲会别桥驿
701581,草堂与诸生二首
444471,浣溪沙 戊寅初冬，萍影重过津门，与诸侣小集华夏酒楼，同赋二首 其二
630670,春晴月下与诸子散步
424052,沁园春·一九六一年市政协座谈会后，与诸同志游雁荡。余来游第三度矣
923332,与诸同僚偶会赋八题 其七 秦淮柳
614206,和冬至与诸生饮酒
543417,己夘仲秋复当计偕北上以家母病不赴与诸友言别四首 其一
673767,十月八日雪与诸寮倡和
1159552,唐郎中宅与诸公同饮酒看牡丹
365337,初雪朝退与诸公至西阁
882731,冷副端与诸人九日登高有诗次韵 其二
616538,寒食与诸子游东郊
811993,与诸昆季言怀
935160,予十许岁即往来云门诸山今复与诸子来追念凄然
452226,蒙仰翁招与诸诗友茗坐并以新茶见赐赋此奉谢
787288,子乔招游石溪，与诸生会诗，听远道人弹琴，即事遣闷，示子乔
625267,过隆兴与诸子偶集
451607,端午与诸君坐塘栖会馆谈旧事
250435,周日与诸友小聚戏作
462127,满庭芳 乙未谷雨，与诸朋有明月山之行，是夜小饮约寄此调
615583,聚仙台与诸子坐月
1087681,与诸人用东坡韵共赋梅花适得元履书有怀其人因复赋此以寄意焉
19082,与诸道者同游二室至九龙潭作
798408,江城子·与诸年少论缠足
1099647,戊午与诸友同谒犀斜南谷二师坟作 其二
627026,冬夜月色明皎与诸子宿雷峰祝天和尚
670182,同元美与诸比部早夏城南放舟 其四
671995,与诸友东郭草亭看牡丹二首 其一
453428,凄凉犯 甲午闰重阳与诸子访杭州西溪
860751,与诸友游杨氏池上呼王隐居小饮晚登书台 其一
13218,春日与诸公泛舟
298009,正月初三与诸生登太平山
407344,少城六先生祠梅树，殆百年物，花时尝与诸人相羊其下，山公有诗，丧乱以来，颇有逝者，而梅亦被斫，顷承出示思旧之作，依韵率和    乙酉人日
402088,春分后一日与诸公登万松岭，经周漈村至佛山石壁寺共饭 其二
246485,倦寻芳·千山词聚拈此调与诸侣同赋
