23627,余谢病东归王秀才见寄今潘秀才南棹奉酬
1071331,藻蒙叔雅祠部重九日惠花惠酒惠诗继为袁家碣钴鉧潭之游因循不能答再承佳句见寄今用来韵率课一篇参陪杖履之胜幸一笑而去之以覆酱瓿而作纸绞也
900232,定叟弟频寄黄檗仰山新芽尝口占小诗适灾患亡聊久不得遣寄今日方能写此 其二
1032328,朱可绍去秋许棕靸明年夏当见寄今及期矣辄以诗请
1113187,定叟弟频寄黄檗仰山新芽尝口占小诗适灾患亡聊久不得遣寄今日方能写此
1162395,余谢病东归王秀才见寄今潘秀才南棹奉酬
226109,朱可绍去秋许棕靸明年夏当见寄今及期矣辄以
900231,定叟弟频寄黄檗仰山新芽尝口占小诗适灾患亡聊久不得遣寄今日方能写此 其一
632416,寄今度
361527,续梦中作·边寄今儒弁
866260,戊戌冬仆客桂林雪中赵叔愚书张司业逢贾岛绝句为寄今冬对雪感而有作
1230747,余自至元元贞间客杭得交子行父虽齿在余先甚款密也余往来于杭有年间归吴门每承以诗或书尺见寄今犹有存者其过山村翁诀别之诗按胡汲仲先生冢铭乃至大四年也越三十一年为至正改元始见其手迹于卢山甫家感悼之馀为作七言一首以附于后亦挽之之意云时余六十又四
