1076214,文若自华亭携家来游西湖袖出新诗其归乃和前篇聊以当别
114053,又戏题下岩·往往携家来托宿
26946,山中夜坐·归家来几夜
935687,自唐安徙家来和义出城迎之马上作
426848,仲瑛自香港携家来访迁者踵接余数语解之置酒知白斋咏雩亦以同日不约而至出名瓷相慨赏盖忧乐集于俄顷感愤形于楮墨故末语及之也
78518,自唐安徙家来和义出城迎之马上作
337486,文若自华亭携家来游西湖袖出新诗其归乃和前篇聊以当别
362693,移家来京师
659944,舟至直沽长子正来迎喜而有作时正自家来省先还至德州闻予得请复来迎也
131011,赞龄叟留东隐·才出家来恩膦轻
246801,登泰山·一家来仰泰山尊
71920,菩萨蛮·挈家来吃山城水
969949,挈家来游饫山林之美款泉石之胜引睇莆阳扁画因慨思关河鼎沸版图之归无期当有任其咎者
972437,早到超果寺示成父且约归日携家来游
978865,王元才携家来过有诗见示因简此作
95904,早到超果寺示成父且约归日携家来游
273075,仲瑛自香港携家来访迁者踵接余数语解之置酒知白斋咏
199980,王元才携家来过有诗风示因简此作
281431,哭内子·我自分家来
1218921,题崔原亭竹深处予家有竹数竿人号曰居竹轩原亭城西别墅有竹亦数竿则又号之曰竹深处予与崔君通家来往所好相同故及之
