984580,正纪诞辰辄成三绝句为寿所谓寿者非世俗之寿也盖期君道学坚固将与造物者游无终始者为友而已 其三
923396,累年告老恩旨未俞诏领祠宫遂还乡闬燕閒无事追省平生因成感事述怀诗五言一百韵示儿孙辈使知遭遇终始之意以代家训故言多不文
438807,兴定庚辰夏六月望予与元好问赵郡李献能同游玉华谷又将历崧前诸刹因憩于少姨庙元周行廊庑得古仙人词于壁间然其首章直屋漏雨为所漫剥殆不可辨乃磴木石而上拂拭汛涤迫视者久之始可完读观其体则柏梁事则终始二汉字画在钟王之间东井又元鼎所都幽州必贤宗子虞也夫眷眷不忘幽州者非吾田畴尚谁欤田复所事之雠却曹瞒之赏衰俗波荡中挺挺有烈丈夫风气其死而不忘盖无疑其能道此语亦无疑观者不应以文体古今之变而疑仙语也噫仙山灵岳宜有闳衍博大
150687,初营·万物有终始
103087,叶大卿挽词·终始为全德
984578,正纪诞辰辄成三绝句为寿所谓寿者非世俗之寿也盖期君道学坚固将与造物者游无终始者为友而已 其二
1125710,正纪诞辰辄成三绝句为寿所谓寿者非世俗之寿也盖期君道学坚固将与造物者游无终始者为友而已
237489,挽词·典学怀终始
39603,咏怀·俦物终始殊
1137389,柏生两石间千岁终不大韩子则欲移之平地以遂其生柏生两石间天命本如此苏子则欲安之石间以全其生二说若异然韩子爱惜人物以有用者也故又曰伤根柏不死千丈不难至苏子爱惜名节以自保者也故曰虽云生之艰与石相终始爱柏一也虽然处险难而出险尤难金华倪君老儒也以柏山自号因取二公意赋诗寄之
984579,正纪诞辰辄成三绝句为寿所谓寿者非世俗之寿也盖期君道学坚固将与造物者游无终始者为友而已 其一
