833094,浣溪沙 梦坡德配张夫人六十寿，作放生会于西溪，为赋此阕
577102,送受益黄先生会试
945154,次韵前人醵更生会三首 其一
131804,次韵前人醵更生会
945153,次韵前人醵更生会三首 其二
662423,中秋前一夜西涯先生召诸生会饮命题试月
945152,次韵前人醵更生会三首 其三
373480,宿华严寺与友生会话
1119996,次韵前人醵更生会三首
612113,赠别湛阳生会试请缨
638161,喜诸生会馔
285740,癸丑除夕·人生会有极
267870,浣溪沙·梦坡德配张夫人六十寿，作放生会于西溪，为赋此阕
1038937,宿华严寺与友生会话
131806,更生会·满天地里暗尘飞
778022,百字令·贺周梦坡德配张夫人六十寿，作放生会于西溪，较早时梦坡扩充西溪秋雪庵以祀浙中词人
277801,子乔招游石溪，与诸生会诗，听远道人弹琴，即事遣闷，示子乔
131805,更生会·劫火吹炎海水飞
603693,凤阳别驾高君文学梁君辈暨诸生会龙兴寺者再别后寄怀
129205,春暮·人生会有百年极
787288,子乔招游石溪，与诸生会诗，听远道人弹琴，即事遣闷，示子乔
