602260,祖洲歌为沈令公题兼送上觐
789577,金缕曲  岁暮怀熊东美袁世浦东美彯缨世胄，为沈氏宅相，年少才俊，与余缔交庾园，分曹赌酒，剪烛传歌，备极文宴之乐，乙卯春省亲，袁浦旋试京兆，鸾翮偶锻，意将入赀，为郎赋此寄之
1221406,双松轩为沈廉赋
513402,乐丘八咏分得卧虹桥为沈时旸主事乃翁赋
508543,上国观光歌为沈侯官司仓用宾赋
49377,楚江清远图为沈伦画并寓九曲山房作·寒烟引轻素
1242552,玉箫引，为沈仲德赋
98812,徐提干为沈运使种竹于上饶新居昭礼有诗蕃同
556775,胡上幽栖四章为沈二丈赋 其一
546466,为沈生题扇
974267,徐提干为沈运使种竹于上饶新居昭礼有诗蕃同作
1250663,存存斋为沈仲说赋
669649,过相城为沈陶庵和天全翁赏菊之作
604241,漳流竹隐歌为沈司马伯含赋赠忆堂老人
1221147,为沈景玉题高士谦所作烟雨万竿图
567740,为沈嘉则题枯木画四首 其二
658067,蜀山草堂为沈月作东坡旧堂址也元为独山东坡去犬为蜀今从之
481468,东林小隐卷为沈处士题 其一
501972,山中乐为沈东林题画
482860,为沈趣庵题画
489484,如舟亭为沈子和氏赋松雪翁所书扁
653519,为沈履德题水仙
684289,云峰卷为沈夷斋题
64937,为沈趣庵题画
653264,一山为沈兑秀才题
63287,东林小隐为沈处士题
62216,玺庵为沈介轩赋
506796,乐琴书处为沈学士题
479203,黄鹤山樵为沈兰坡作小景兰坡孙启南求题
739299,济宁南池杜工部新祠诗为沈椒园同年作
1237072,为沈竹窗题竹梅二图
567739,为沈嘉则题枯木画四首 其一
1249710,六柳庄为沈太守作
57829,黄鹤山樵为沈兰坡作小景兰坡孙启南求题
641624,养正斋为沈一中
675907,晚景便面为沈仲明作
702621,东林小隐卷为沈处士题
535226,云峰卷为沈夷斋题 其一
318572,摸鱼子·渌波春远图，为沈渻庵悫题，壬午
1214603,雪隐山人诗为沈伯玉作
1220994,钩勒竹为沈景王赋 其二
535227,云峰卷为沈夷斋题 其二
746921,访音图为沈丹谷作
1221210,为沈竹窗题竹梅二图 其一
506657,题梅花纨扇图为沈公辅赋
1221519,万竹轩诗为沈亮赋
650204,乐琴书处为沈民则学士赋
674700,五老峰行为沈太守廷材赋
362568,为沈莩亭题揽镜图
567742,为沈嘉则题枯木画四首 其四
554422,乐琴书处歌为沈修撰赋
49376,楚江清远图为沈伦画并寓九曲山房作·猿啼楚山晚
578162,静学斋为沈布政之子赋
560406,秋林书屋为沈武功作
946427,题僧法传为沈仲一画听松图
49374,楚江清远图为沈伦画并寓九曲山房作
1145003,时人为沈麟士语
300143,惜秋华·为沈太侔题晚闻室填词图
535228,云峰卷为沈夷斋题 其三
423140,惜秋华  为沈太侔题晚闻室填词图
481116,玺庵为沈介轩赋
1221211,为沈竹窗题竹梅二图 其二
49375,楚江清远图为沈伦画并寓九曲山房作·潮落寒沙广
698908,为沈嘉则题枯木画四首
567741,为沈嘉则题枯木画四首 其三
587234,白鹰为沈都阃题
515433,小饮承天寺为沈启南题林和靖二帖上有谢安抚印记
560474,吴淞秋色图为沈汝祯题
556778,胡上幽栖四章为沈二丈赋 其四
514209,郭忠恕雪霁江行图为沈启南题
694886,胡上幽栖四章为沈二丈赋
653948,白头公手卷为沈材美题
556777,胡上幽栖四章为沈二丈赋 其三
653413,齐寿为沈秋官作
537405,绿尊草堂为沈君赋
1221626,梅花清梦为沈士敬赋
558680,洙泾为沈士登题盛子昭画时在五湖一苇舟
808732,题耕岩草堂图为沈樗崖山人
489839,玉山草堂为沈南叔赋
1214668,王维辋川剑石叶石林作精舍置之弁山下今为沈玉泉所得醉后求见因赋此
102784,沧洲亭怀古此诗为沈辽作
1220993,钩勒竹为沈景王赋 其一
407368,摸鱼子 渌波春远图，为沈渻庵悫题，壬午
1237043,钩勒竹为沈景王赋
511956,东林小隐卷为沈处士题 其二
100225,观大水望朝阳岩作此诗为沈辽作
1221707,兰雪斋为沈德源赋
191620,题僧法传为沈仲一画听松图
504920,槃隐为沈子俊赋
661431,一愚为沈廷望赋
556776,胡上幽栖四章为沈二丈赋 其二
669116,槐阴堂为沈开府赋
569018,兰谷辞为沈子赋也
1207131,百字令 为沈画师题写山楼
