972420,成父弟作书室于前山举予旧名堂曰青毡以榜之其旁一窗政直瑞峰取曾大父留题之句榜曰霞牖赋诗二首 其一
227468,陪范明府与诸同官饮新亭是夕以莞尔榜之因赋
951742,陪范明府与诸同官饮新亭是夕以莞尔榜之因赋此诗
95639,以榜之·土断既已久
1114146,北归次盰江疏山宗瑞长老来迓且言山巅有亭俯视群山犹培塿也求佳名大书以榜之取少陵句为目之曰一览亭成两绝句
888016,甲子举中补滥忝前名考官刘簿云已在解选涝漉袁簿批有文字清快老健惜乎正榜之额有限之语
355697,杨日新辟书室以月壶榜之求诗
739308,放榜之前夕示诸分校
1128137,杨日新辟书室以月壶榜之求诗
1092142,杨日新辟书室以月壶榜之求诗 其二
152369,上巳访杨廷秀赏牡丹于御书匾榜之斋其东园仅
1078182,北归次盰江疏山宗瑞长老来迓且言山巅有亭俯视群山犹培塿也求佳名大书以榜之取少陵句为目之曰一览亭成两绝句 其一
1078183,北归次盰江疏山宗瑞长老来迓且言山巅有亭俯视群山犹培塿也求佳名大书以榜之取少陵句为目之曰一览亭成两绝句 其二
95638,成父弟作书室于前山举予旧名堂日青毡以榜之
948812,登仕郎曾忠佐迎母王于乐氏母许新居成即归于是筑第高沙极轮奂母欲迁而逝乃虚中堂榜之曰思永为赋四韵
972419,成父弟作书室于前山举予旧名堂曰青毡以榜之其旁一窗政直瑞峰取曾大父留题之句榜曰霞牖赋诗二首 其二
1123708,成父弟作书室于前山举予旧名堂曰青毡以榜之其旁一窗政直瑞峰取曾大父留题之句榜曰霞牖赋诗二首
948516,上巳访杨廷秀赏牡丹于御书匾榜之斋其东园仅一亩为术者九名曰三三径意象绝新
1092141,杨日新辟书室以月壶榜之求诗 其一
