1075210,米元章为须江太守闻有怪石在河壖莫知其所自来人以为异而不敢取公命移置州沼为燕游之玩石至而惊遽命设席拜于庭下曰吾欲见石兄二十年矣闻者以为言坐是罢去余游濡须而石犹在询之邦人信然乃作此诗
520346,予经山寺爱其幽雅因留宿焉昔人所谓天下名山僧占多者信然哉所惜者世无金山长老而吾带盖不足留聊成一诗以自适云
864315,会稽杨梅雄天下其佳者皆出项里相传项羽乡里也验图志信然戏作杨梅诗供作者一笑耳
572958,嵩阳宫古柏封于汉非汉物也都玄敬以为三代时物信然
957161,晓发飞鸟晨霞满天少顷大雨吴谚云朝霞不出门暮霞行千里验之信然戏纪其事
425993,重阳无雨一冬晴，徵之今冬节候信然
808758,挽岳将军公讳钟琪前宁远副将军后拟提督四川己巳春入觐京师还止望都传舍余谒见长身赭面被服儒素为言金川形势及纳降事盖虏夙重公故卧护十年卒无事唐以李世绩为长城信然以雅能诗即席千言立就唯食前方丈行厨之费不赀此外固无一毫负公也将星已没当为天下惜此人
908356,过大信口忆西归录载大江渺渺忽二石山如伏猊引出水面东西对峙江形若瓢然而山乃其口然相距犹三四里则江之广狭可见视之信然妙哉写物之功感而赋此篇
266116,重阳无雨一冬晴，徵之今冬节候信然
