1062532,游西塔寺分韵赋诗怀汪信民以渊明停云诗岂无他人念子实多为韵探得念字
910020,谷隐饮中以采菱渡头风起策杖村西日斜为韵探得采头二字 其一
910021,谷隐饮中以采菱渡头风起策杖村西日斜为韵探得采头二字 其二
1062486,游逍遥寺以野寺江天豁山扉花木幽为韵探得山字
1114862,谷隐饮中以采菱渡头风起策杖村西日斜为韵探得采头二字
1062637,与诸人集陈公美书堂观雪以朔雪洗尽烟岚昏为韵探得烟字
1128754,同吴迪吉汪信民游西塔寺分韵赋诗以荷花日落酣为韵探得荷花字
368383,游泉庵寺怀璧上人以徐飞锡杖出风尘为韵探得徐字
1062552,集西塔寺怀亡友汪信民以言念君子温其如玉为韵探得念字
1087793,巢居之集以中有学仙侣吹箫弄明月为韵探策赋之而熹得中字遂误为诸君所推高俾专主约既而赋诗者颇失期于是令最后者具主礼以当罚乃稍集独敦夫圭甫违令后至众白罚如约饮罢以苍茫云海路岁晚将无获分韵熹得将字而子衡兄得苍字实代熹出令
1062491,同吴迪吉汪信民游西塔寺分韵赋诗以荷花日落酣为韵探得荷花字 其一
202172,谷隐饮中以采菱渡头风起策杖村西日斜为韵探
1062533,游西塔寺分韵咏双莲以太华峰头玉井莲为韵探得华字
202473,为韵探·东西南北人
368390,与诸人集陈公美书堂观雪以朔雪洗尽烟岚昏为韵探得烟字
1062623,游泉庵寺怀璧上人以徐飞锡杖出风尘为韵探得徐字
1062492,同吴迪吉汪信民游西塔寺分韵赋诗以荷花日落酣为韵探得荷花字 其二
1062505,汪文彬载酒率诸人过予溪堂观芝草以煌煌灵芝一年三秀为韵探得煌字
1062551,怀季智伯以洪龟父赠智伯诗气盖关中季子心为韵探得盖字
