175811,同范智闻五月十四日夜赏月
1076321,正月十四日夜病在告雨中不寐示刘德秀
38293,中秋十四日夜对月上南平主人
934962,八月十四日夜湖山观月
892145,八月十四日夜东轩饯赵同州志元吴陕州冲卿徐润州君章
322422,踏莎行·十四日夜，对月有怀
855203,武陵春 其二 正月十四日夜孙使君席上观雪，继而月复明
434527,渔家傲 正月十四日夜有感而作
931285,甲子岁十月二十四日夜半梦遇故人于山水间饮酒赋诗既觉仅能记一二乃追补之二首 其一
551308,八月十四日夜招张孺愿钱叔达谢脩之陈汝大王玉生袁无竞集平远台观万岁神光二塔灯分得八庚
750620,十月十四日夜泊荷叶洲对月有怀
1005129,十四日夜月色颇佳山寒不出门窗间拥絮坐玩殊胜昨夜之微茫也
77687,五月十四日夜梦一僧持诗编过予有暴雨诗语颇
191099,七月十四日夜大雨彻晓方止田家云早晚禾自此
739938,十一月十四日夜
666441,八月十四日夜饯伯昭五首 其二
17270,八月十四日夜玩月
666443,八月十四日夜饯伯昭五首 其四
99817,十二月十四日夜微雪明日早往南溪小酌至晚
663895,九月十四日夜访马尚宝文明不值
930456,十月二十四日夜梦中送庐山道人归山
1028694,七月十四日夜大雨彻晓方止田家云早晚禾自此不忧矣喜而为诗
157891,十四日夜月色颇佳山寒不出门窗间拥絮坐翫殊
83864,八月十四日夜湖山观月
793870,八月十四日夜虎丘步行
525918,己巳十二月十四日夜雷
1117774,甲子岁十月二十四日夜半梦遇故人于山水间饮酒赋诗既觉仅能记一二乃追补之二首
336621,正月十四日夜病在告雨中不寐示刘德秀
115096,八月十四日夜刀坑口对月奉寄王子难子闻适用
1034598,八月十四日夜约客月下有赋
76731,甲子岁十月二十四日夜半梦遇故人於山水间饮
537271,正月十四日夜同茂秦于鳞子与子相集灵济宫公实馆分韵得灯微二字 其二
794587,踏莎行 十四日夜，对月有怀，三叠前韵
1048333,八月十四日夜月
134296,正月二十四日夜雪
125095,八月十四日夜东轩饯赵同州志元吴陕州冲卿徐
1048730,乙卯十二月十四日夜宿东禅僧舍
505651,十二月二十四日夜忆母亲作三首 其三
683229,正月十四日夜同茂秦于鳞子与子相集灵济宫公实馆分韵得灯微二字
869412,正月二十四日夜雪
1030783,和李子真八月十四日夜赏月之什
157727,九月十四日夜枕不寐起视明月清寒著人冷然有
343553,八月十四日夜月
505650,十二月二十四日夜忆母亲作三首 其二
920287,十二月十四日，夜，微雪，明日早，往南溪小酌，至晚
930891,六月二十四日夜分梦范至能李知几以尤延之同集江亭诸公请予赋诗记江湖之乐诗成而觉忘数字而已
1163035,中秋十四日夜对月上南平主人
307364,十月十四日夜坐望月示从侄承勋
368737,洞仙歌·忆梅，辛未十二月十四日夜坐作，用屯田体
382237,丙午十一月二十四日夜梦回书事
934940,二月二十四日夜大风异常
297658,月下笛·二月十四日夜，泊舟烟台外，独坐舵楼远眺
950670,九月十四日夜月明如昼敬想合宫竣事志喜而作
698431,十二月二十四日夜忆母亲作三首
1110689,奉同胡德辉八月十四日夜玩月次韵
1083173,奉同胡德辉八月十四日夜玩月次韵 其二
666442,八月十四日夜饯伯昭五首 其三
928227,九月十四日夜鸡初鸣梦一故人相语曰我为莲华博士盖镜湖新置官也我且去矣君能暂为之乎月得酒千壶亦不恶也既觉惘然作绝句记之
666440,八月十四日夜饯伯昭五首 其一
491534,七月十四日夜纪梦
77072,二月二十四日夜大风异常
1247724,七月十四日夜宴集巢云左辖山庄席上分得辖字韵
1083172,奉同胡德辉八月十四日夜玩月次韵 其一
305327,八月十四日夜水榭
1222996,六月二十四日夜梦剡源师同游山寺主僧延入丈室出梅花画卷赋诗旁有胡用章先生坐主僧下时剡源对席仆居其次案上绿竹一枝青翠可爱剡源赋诗桷即援笔
798766,洞仙歌·忆梅，辛未十二月十四日夜坐作，用屯田体
80979,九月十四日夜鸡初鸣梦一故人相语曰我为莲华
1005712,九月十四日夜枕不寐起视明月清寒著人泠然有欲仙之意
666444,八月十四日夜饯伯昭五首 其五
78017,六月二十四日夜分梦范至能李知几以尤延之同
931284,甲子岁十月二十四日夜半梦遇故人于山水间饮酒赋诗既觉仅能记一二乃追补之二首 其二
537270,正月十四日夜同茂秦于鳞子与子相集灵济宫公实馆分韵得灯微二字 其一
996327,八月十四日夜刀坑口对月奉寄王子难子闻适用
423782,月下笛 二月十四日夜，泊舟烟台外，独坐舵楼远眺，寒江如练，皓月中天，水天一色，光景奇绝，倚此歌之，海涛若互答也
342896,乙卯十二月十四日夜宿东禅僧舍
505649,十二月二十四日夜忆母亲作三首 其一
1245168,丙午十一月二十四日夜梦回书事
1148989,八月十四日夜玩月
428934,十月十四日夜坐望月示从侄承勋一首
1072024,八月十四日夜作
704880,八月十四日夜饯伯昭五首
241463,和李子真八月十四日夜赏月之什
873647,同范智闻五月十四日夜赏月
139972,八月十四日夜约客月下有武
279896,八月十四日夜虎丘步行
935178,五月十四日夜梦一僧持诗编过予有暴雨诗语颇壮予欣然和之联巨轴欲书未落笔而觉追作此篇
429575,八月十四日夜水榭
