618315,夏杪黎君选邓伯乔戴公纶赵裕子徐木之黎美周李美发欧天驹陈中行自五羊过访余偕欧嘉可暨两儿宴接江上分得东字
629550,午日同邓伯乔赵裕子僧孟容集谢伯子池上二首 其一
632741,闻谢伯子赵裕子二老友在喜赋
628803,李伯襄太史招同马伯起赵裕子载酒访余丹丘各赋二律 其一
621303,奉和家大人同饮欧子建苏季文谢伯子庞尔珍赏赵裕子水仙花有赋
629579,咏赵裕子水仙花
616080,淮上午日逢韩绪仲宗伯挈赵裕子之官南院 其一
615021,行次安肃冒寒卧病又值騄儿痘友人赵裕子为治药饵俱获瘥赋此志谢
621326,花朝梁木公招待家大人同欧子建赵裕子戴安仲邝湛若诸公社集诃林千佛塔赋 其一
628804,李伯襄太史招同马伯起赵裕子载酒访余丹丘各赋二律 其二
615033,壬戌除夕与赵裕子客署守岁
704541,午日同邓伯乔赵裕子僧孟容集谢伯子池上二首
704615,花朝梁木公招待家大人同欧子建赵裕子戴安仲邝湛若诸公社集诃林千佛塔赋
629551,午日同邓伯乔赵裕子僧孟容集谢伯子池上二首 其二
633429,题赵裕子绘卫天山寿山图
615613,上谷遇韩绪仲先生暨赵裕子驿馆夜谈
614787,夏五黄元卿招同韩孟郁邓伯乔赵裕子饮渌水草堂
690470,冬夜韩寅仲赵裕子见过留酌
615567,初冬黄元卿园林与黎缜之冯稚谟韩孟郁赵裕子欧子建邓伯乔诸子分赋
1098667,促赵裕卿酒
621009,二月十七日社集赵裕子云槎同诸公赋
709313,秋社日喜赵裕子至
691221,淮上午日逢韩绪仲宗伯挈赵裕子之官南院
616081,淮上午日逢韩绪仲宗伯挈赵裕子之官南院 其二
621327,花朝梁木公招待家大人同欧子建赵裕子戴安仲邝湛若诸公社集诃林千佛塔赋 其二
621404,过赵裕子戏赠
604544,冬夜韩寅仲赵裕子见过留酌 其二
328423,促赵裕卿酒
604543,冬夜韩寅仲赵裕子见过留酌 其一
629107,午日泗上过韩宗伯出掌南院招饮舟中同李宫詹赵裕子
616019,初夏梁支世傅贞甫马元伯赵裕子过访山居
691013,李伯襄太史招同马伯起赵裕子载酒访余丹丘各赋二律
