96676,郡檄子肃检视旱田以诗寄之
1000109,孙曼叔待制安抚至陕西先以诗寄
98590,闻刘彦说率友生过别业以诗寄之与彦说之约者
372765,与馀杭希文资政经时两绝音问忽得讯正与近致书同日因以诗寄
991964,合流曹光道惠钜李知其炎酷中有此味亦可乐也辄以诗寄
1016362,黄待制病中以诗寄之
330763,余将卜居水东先以诗寄吴令
969085,次庄过荆渚以诗寄之
869416,仲庶同年兄自成都移长安以诗寄贺
98274,以诗寄饯·六飞驻吴中
1219562,成广陵先生以诗寄张先生，韵度深稳，谨依韵奉和
388728,辛丑仲秋初度，王孟邻茂才以诗寄赠
1048715,和孙叔康以诗寄芋
1213243,道过东昌申仲礼佥司暨状元呼都克岱尔诸父台辅贤昆仲厚意相邀别后以诗寄谢
1081845,无言颁政以诗寄行简辄次韵 其一
1039224,与馀杭希文资政经时两绝音问忽得讯正与近致书同日因以诗寄
854970,蔡天逸以诗寄梅诗至梅不至
454421,汝伦兄胃病发作以诗寄问疾相慰之意
1107408,公肃在东南三有书来未报闻其除司直以诗寄贺且谢
149216,无己初除正字以诗寄之
1156260,宣武令狐相公以诗寄赠传播吴中聊奉短草用申酬谢
1182665,得卢衡州书因以诗寄
862595,陈粹中再约重阳之集既不果赴以诗寄之二首 其一
15277,美温尚书镇定兴元以诗寄贺
173169,陈粹中再约重阳之集即不果赴以诗寄这
974208,贵溪隔岸有二岩仆旧游也闻子畅受秋租于彼以诗寄之
324430,次韵李宜仲以诗寄龙涎
862594,陈粹中再约重阳之集既不果赴以诗寄之二首 其二
867254,公肃在东南三有书来未报闻其除司直以诗寄贺且谢 其一
974181,施衢州除浙西提刑以诗寄饯三首 其二
644674,脩德以诗寄次韵
1247878,倪仲岂编修陈景忠教授有约不至以诗寄之
676748,孟龙川许送芸香不至走索兼以诗寄
224827,以诗寄贺·纵横才力自时须
1066835,近辟禄隐轩建瓢饮亭季父以诗寄题和韵
1106688,次韵李宜仲以诗寄龙涎三首
1111440,下沱张西叔牡丹号奇品以诗寄花因用韵谢
909045,书院诸客登仲宣楼以诗寄之
261117,族兄才卿下第后赴宜禄酒官以诗寄之
921090,林子中以诗寄文与可及余，与可既殁，追和其韵
1085250,某去五月罢馆职还乡涂中以诗寄同舍云去国怀明主离群念旧游翻令到家梦中夜绕瀛洲今以史职复至道山访旧或迁或去惟后园脩竹乃故人也感叹良久因成短篇
1249936,杨季常约至山中既而不果因以诗寄三首 其二
1028093,林德久秘书寄楚辞故训传及叶音草木疏求序于余病中未暇因以诗寄谢
983849,祝子正从范使君锻以诗寄之
354924,徐中文赴新建以诗寄之
676841,赠陆梦洲古琴兼以诗寄
1093256,王干以诗寄和答
335291,无言颁政以诗寄行简辄次韵
974246,郡檄子肃检视旱田以诗寄之
787753,宾于以诗寄赠用韵复之
254684,路逢安阳花酒问之云迓贰车于河上戏以诗寄萧彭老
509313,张式之佥都致政既归四明以诗寄予依韵奉酬
1073137,次韵李宜仲以诗寄龙涎三首 其三
864063,秋浦见陆次川会其有广德之役同游齐山而别既归以诗寄之
229187,黄待制病中以诗寄之
869815,景仁书云去冬因酒病耳病牙遂不入洛以诗寄呈
1165303,拾得韦氏花钿以诗寄赠
98273,以诗寄饯·昔公立螭坳
224826,公肃在东南三有书来未报闻其除司直以诗寄贺
980460,无己初除正字以诗寄之
436962,水调歌头 昔拟栩仙人王云鹤赠予诗云寄与閒閒傲浪仙枉随诗酒堕凡缘黄尘遮断来时路不到蓬山五百年其后玉龟山人云子前身赤城子也予因以诗寄之云玉龟山下古仙真许我天台一化身拟折玉莲骑白鹤他年沧海看扬尘吾友赵礼部庭说丹阳子谓予再世苏子美也赤城子则吾岂敢若子美则庶几焉尚愧辞翰微不及耳因作此以寄意焉
179096,祝子正从范使君锻以诗寄之
99777,林子中以诗寄文与可及余与可既殁追和其韵
227291,次庄过荆渚以诗寄之
865345,和谢吏部铁字韵三十四首 邑官有和者亦以诗寄之其人自云禦方寇有功
1073135,次韵李宜仲以诗寄龙涎三首 其一
322793,始得伯潜书时筑室石鼓山中以诗寄怀
1062938,朱贡父自尚书郎领宪河朔会高阳阙守因摄帅事以诗寄之且觅蟹螯
349022,茂实被檄权永新以诗寄之
578016,羊城友人梁俊民以诗寄赠余余因次韵以答之
314300,梦偕黄胜白同游庐山醒后以诗寄意兼订后约
739647,袁简斋得余归信以诗寄投次韵奉答 其一
134263,雨中过王安之所居谒以诗寄之
241661,张三十病愈久不相见以诗寄问
886144,下沱张西叔牡丹号奇品以诗寄花因用韵谢 其二
1070866,余将卜居水东先以诗寄吴令
133840,仲庶同年兄自成都移长安以诗寄贺
974182,施衢州除浙西提刑以诗寄饯三首 其一
1159531,美温尚书镇定兴元以诗寄贺
886145,下沱张西叔牡丹号奇品以诗寄花因用韵谢 其一
1124181,施衢州除浙西提刑以诗寄饯三首
158002,孙曼叔待制安抚至陕西先以诗寄
663929,同年侍御罗瑞卿将到京先以诗寄荅之
739648,袁简斋得余归信以诗寄投次韵奉答 其二
353762,李彦益过景城以诗寄之
195074,蔡天逸以诗寄梅诗至梅不至
447306,日本汉学家鬼头有一教授来信告将于明年率团重访忠州，欣喜之馀，以诗寄之
155805,文举仙尉以诗寄似兼惠新安纸乳洞荼次韵奉酬
945238,吴竹修以诗寄次韵以复
331695,近以诗寄许振叔承林德祖见和复次前韵寄之
1062830,四月二十七日雨后诣府学道过辟雍不暇谒权朝美归以诗寄之
707714,辛丑仲秋初度，王孟邻茂才以诗寄赠；次韵答之
152385,贺升卿年垂八十以诗寄平园新咏二十二篇又录
521929,以诗寄师邵御史戏书其后
972813,侍郎周公不赴富沙士论推高以诗寄呈
9873,曾东游以诗寄之
53326,御赐圆通禅寺后以诗寄善世全室
867253,公肃在东南三有书来未报闻其除司直以诗寄贺且谢 其二
1057300,季颜师颜谪齐州以诗寄之
973075,闻刘彦说率友生过别业以诗寄之与彦说之约者皆当和此诗也
12282,逢江客问南中故人因以诗寄
972565,过吉水问萧伯和兄弟云在县四十里之罗陂远不及见以诗寄之并呈仲和
134608,景仁书云去冬因酒病耳病牙遂不入洛以诗寄呈
143960,王火井见过先以诗寄用韵
130579,吴竹修以诗寄次韵以复
18706,宣武令狐相公以诗寄赠传播吴中聊奉短草用申酬谢
166928,似表弟之钱塘约岁前归愆期不至以诗寄之
286433,若水上人禁足东涧以诗寄我赋答
1073136,次韵李宜仲以诗寄龙涎三首 其二
870120,雨中过王安之所居不谒以诗寄之
957622,张三十病愈久不相见以诗寄问
1081846,无言颁政以诗寄行简辄次韵 其二
343247,和孙叔康以诗寄芋
1052133,徐中文赴新建以诗寄之
1213652,闻胡紫山被召以诗寄呈
434798,路逢安阳花酒问之云迓贰车于河上戏以诗寄萧彭老
1066256,李彦益过景城以诗寄之
98002,侍郎周公不赴富沙士论推高以诗寄呈
1085761,赵果州之子年十四能作大字果州自荆南以诗寄予命书之字画老成异日必名家因赠以诗
1046222,治平三年秋七月当涂郭功父招无为杨次公会于环峰时五云叟陈德孚以诗寄吾二人因联句酬之
1106847,陈粹中再约重阳之集既不果赴以诗寄之二首
224829,以诗寄贺·江北江南罢战尘
335108,以诗寄行·平生狗曲视骊驹
1023693,吴太清有远役以诗寄别次韵
974180,施衢州除浙西提刑以诗寄饯三首 其三
1116198,无言颁政以诗寄行简辄次韵
1156496,得行简书闻欲下峡先以诗寄
987978,寄黄州赵别驾庚辰入蜀舟次黄冈适赵倅奇夫沿檄行边不遇以诗寄之
424852,梦偕黄胜白同游庐山醒后以诗寄意兼订后约
1249935,杨季常约至山中既而不果因以诗寄三首 其一
193242,度支梁谏议请病告以诗寄之
237597,下沱张西叔牡丹号奇品以诗寄花因用韵谢
505001,高凉邹通守以诗寄予石龙次韵奉答
906256,似表弟之钱塘约岁前归愆期不至以诗寄之
916216,度支梁谏议请病告以诗寄之
751067,始得伯潜书时筑室石鼓山中以诗寄怀
784305,若水上人禁足东涧以诗寄我赋答
963512,王火井见过先以诗寄用韵 其一
848220,小魏买马久不至以诗寄之
1218421,次韵桂怀英以诗寄谢元善及宗昭侄辈暮夜见访
1253286,杨季常约至山中既而不果因以诗寄三首
158427,行叟权秋掾比回正老以诗寄之因次韵奉和
387947,得卢衡州书因以诗寄
1081293,茂实被檄权永新以诗寄之
828373,啸麓园中桐花正开久坐其下以诗寄怀因和
1153360,南宫夜直宿见李给事封题其所下制敕知奏直在东省因以诗寄
438496,族兄才卿下第后赴宜禄酒官以诗寄之
237906,小魏买马久不至以诗寄之
249250,汝伦兄胃病发作以诗寄问疾相慰之意
1249937,杨季常约至山中既而不果因以诗寄三首 其三
1154907,逢江客问南中故人因以诗寄
479862,闻东山先生领都宪之命修理黄河以诗寄之
164540,书院诸客登仲宣楼以诗寄之
323588,赵果州之子年十四能作大字果州自荆南以诗寄予命书之字画老成异日必名家因赠以诗
645811,御赐圆通禅寺后以诗寄善世全室
1122646,王火井见过先以诗寄用韵
1183200,曾东游以诗寄之
1077988,得家书报长子仪之房下得孙男殊慰老怀时在雷州著易传适至震卦因名之曰震孙以诗寄仪之
998893,文举仙尉以诗寄似兼惠新安纸乳洞茶次韵奉酬
1178456,夜泊庐江闻故人在东寺以诗寄之
4526,夜泊庐江闻故人在东寺以诗寄之
973364,得周畏知书病久不报以诗寄之
999673,行叟权秋掾比回正老以诗寄之因次韵奉和
963511,王火井见过先以诗寄用韵 其二
578122,闻馀姚黄大尹美政以诗寄之
97054,得周畏知书病久不报以诗寄之
1077564,近以诗寄许振叔承林德祖见和复次前韵寄之
357925,近辟禄隐轩建瓢饮亭季父以诗寄题和韵
948738,贺升卿年垂八十以诗寄平园新咏二十二篇又录十年前简予四诗尚有访戴之兴谨次最后一章韵为谢
98270,施衢州除浙西提刑以诗寄饯
569917,赵高邮来亨以诗寄怀并示新集有答
867252,公肃在东南三有书来未报闻其除司直以诗寄贺且谢 其三
740537,偕胡西垞稚威读书石林禅房张尔康赵韫山各以诗寄次韵奉寄
18163,得行简书闻欲下峡先以诗寄
