546687,潞河留别王行父袁微之李本建徐象先四绝句 其一
545451,同王行父集惟寅斋头得来字
545658,王行父授官上林赋柬
544345,同王行父管建初汪公干谢彦云集区太史馆即景分赋余得盆中紫茄 其二
697409,潞河留别王行父袁微之李本建徐象先四绝句
545458,惟寅治第于甃石中得大禹岣嵝碑因函置壁间赋此纪事是日同观者王行父汪明生
545907,集惟寅第同顾朗生王行父作
569217,赠王行父行父稚钦先生犹子也而师事吴明卿为文
545449,王行父入都以鹅飵糟鲥葛簟等物见饷赋此
545448,同谢友可集王行父馆中
545916,同王行父顾朗生胡孟韬俞羡长集惟寅白雪斋分得人字
697086,同王行父管建初汪公干谢彦云集区太史馆即景分赋余得盆中紫茄
544208,同王行父李叔操徐象先诸子十日饮作
546689,潞河留别王行父袁微之李本建徐象先四绝句 其三
546690,潞河留别王行父袁微之李本建徐象先四绝句 其四
545497,梦王行父并寄薛素卿二首 其二
546688,潞河留别王行父袁微之李本建徐象先四绝句 其二
697230,梦王行父并寄薛素卿二首
608275,送王行父
545433,同王行父吴允兆沈孺休李本建魏颖超汪明生李叔操集惟寅宫保第得飞字
697441,王行父惠簟赋谢二绝
546878,王行父惠簟赋谢二绝 其二
545496,梦王行父并寄薛素卿二首 其一
544344,同王行父管建初汪公干谢彦云集区太史馆即景分赋余得盆中紫茄 其一
546877,王行父惠簟赋谢二绝 其一
