524177,霖雨汹涌城市簿筏而行我庐高垲尚苦崩塌何况黄子住居湫隘诗以问之
210366,旅邸·湫隘嚣尘不可居
828680,自来官京朝者皆居宣武门外屋宇湫隘依然寒士家风所谓南城士大夫也国变后王侯第宅皆易新主速化者率居东西内城然盛衰不常倏焉灭迹予因病请急来京僦居景山下盖有不胜今昔之感者爰成长句一首
1253219,近辟一室扁曰琴书所或者病其湫隘不称隐者之居也率二儿各和陶诗
1246790,近辟一室扁曰琴书所或者病其湫隘不称隐者之居也率二儿各和陶诗 其二
958253,时官多以封州俸薄井邑萧条居处湫隘为叹观如闻而赋之
373306,叔父所居·湫隘黄门宅
181707,时官多以封州俸薄井邑萧条居处湫隘为欢观如
304219,牵牛花·湫隘一椽陈病树
921982,顷年杨康功使高丽，还，奏乞立海神庙于板桥。仆嫌其地湫隘，移书使迁之文登，因古庙而新之，杨竟不从。不知定国何从见此书，作诗称道不已。仆不
98033,觅应氏庵·只知嫌湫隘
1246789,近辟一室扁曰琴书所或者病其湫隘不称隐者之居也率二儿各和陶诗 其一
1074855,甘菊数本旧植之地沮洳湫隘颇有悴色十一月二十三日移植墙下明日小雨数刻欣然便有生意
