604713,寿于谷峰大宗伯六十 其二
547908,哭冯大宗伯四首 其一
538918,大宗伯董丈用均初度
561499,恭闻驾谒长陵寄呈扈从夏公大宗伯 其二
688636,恭闻驾谒长陵寄呈扈从夏公大宗伯
383765,哭冯大宗伯
476044,送大宗伯介溪公南都十二韵
569412,袁抑之大宗伯考最暂还里寄问之
556508,送大宗伯两洲王公考绩二首 其二
478686,送大宗伯王公入朝
695706,送大宗伯古林何公致仕南归二首
547860,寄吴少溪宫录七十 其五十六 得李大宗伯丈报书酬寄
687442,和大宗伯张阳峰赏莲之什二首
474238,徐大宗伯同唐张娄三子见饯至新洋江始别
495094,挽大宗伯吴峦徲先生 其一
570821,戊子初中夏金陵祈晴祈雨者各一而大宗伯姜公主之应因呈公一绝
594471,送大宗伯杨公谢病还姑苏
569947,送大宗伯姜翁考绩北上
620432,清音楼次大宗伯李老师韵
52621,送大宗伯介溪公南都十二韵
547422,秋日閒居有怀黄大宗伯
562910,送钱麟武大宗伯还会稽
692621,送大宗伯两洲王公考绩二首
695201,寿大宗伯甘泉先生二律
593391,送大宗伯古林何公致仕南归二首 其二
590615,次前韵怀大宗伯盛程斋因柬塔溪相及云
569050,承大宗伯姜公少司寇李公邀同大司寇陆公少司徒方公陟牛首山有述
383122,沈大宗伯使问寄谢
616100,寄董大宗伯
705810,哭外舅鹿城顾大宗伯
683910,大宗伯姜公倡诸公祈雨澍应偶成一绝奉览蒙赐迭四章不揣鄙陋辄依韵补上忘其续貂恐蹈蛇足不知群公能遂翕如成此胜事否
569986,为王大宗伯题五指参天峰
542086,暮秋闻倭寇稍平寄上南都大宗伯孙公兼怀太史文和二首 其一
570037,大宗伯吴兴董公枉棹海滨道返命进士长君代访且赠长律饰奖过情愧感之情托之申和
451897,清明谒钱牧斋大宗伯并柳夫人墓
564522,寄寿大宗伯汪石潭先生
683494,大宗伯董丈用均用前押韵三章见贻惜别陈怀徵之梦寐至云遥想六桥冠盖集知无一日酒杯閒又云水国共怜门似水山神应望屐登山其托羡湖山寄好风雅真无匹矣复以三章追挽先君子奏之松柏之间霜飙骤零真足肠断不揣辄复和谢依来数其乱篇专志哀感知鉴泣乌之私不以续貂为诮也
569873,徐大宗伯归有园留宴作
564986,和大宗伯张阳峰赏莲之什二首 其二
571225,奉送大宗伯严老先生赴南都
383766,冯大宗伯·海色云门欲断肠
542087,暮秋闻倭寇稍平寄上南都大宗伯孙公兼怀太史文和二首 其二
534809,和答大宗伯董用均
569984,陈玉叔廷尉邀大宗伯王公过饮有作
545001,题张大宗伯閒云馆
570926,大宗伯徐公携阿倩见饯娄江命赋之得二绝
562911,送郑方水大宗伯归江右
604712,寿于谷峰大宗伯六十 其一
474237,过大宗伯徐公留饮山池出所欢明童佐酒
683927,大宗伯徐公携阿倩见饯娄江命赋之得二绝
569630,寿大宗伯吴兴董公七十
569249,为王大宗伯题文笔峰
538934,大宗伯董丈用均用前押韵三章见贻惜别陈怀徵之梦寐至云遥想六桥冠盖集知无一日酒杯閒又云水国共怜门似水山神应望屐登山其托羡湖山寄好风雅真无匹矣复以三章追挽先君子奏之松柏之间霜飙骤零真足肠断不揣辄复和谢依来数其乱篇专志哀感知鉴泣乌之私不以续貂为诮也 其二
383326,秋日閒居有怀黄大宗伯
569593,奉和大宗伯董公返棹之作
548483,和大宗伯罗公瑞雪应祈之作次韵
703150,暮秋闻倭寇稍平寄上南都大宗伯孙公兼怀太史文和二首
564761,送大宗伯张阳峰赴南都
569934,陈先辈子卿大宗伯公子也美秀而文亡弟太常有拂拭之契访我白下论诗契合寻上公车饮而赠之
564938,寄张阳峰大宗伯
800021,玉叔观察招陪龚大宗伯西樵阮亭诸先生集寓园泛舟观剧达曙作歌
627046,奉呈南大宗伯李公
383115,得李大宗伯丈报书酬寄
547911,哭冯大宗伯四首 其四
593390,送大宗伯古林何公致仕南归二首 其一
569966,丹阳道中承宫保大宗伯姜翁出会因赠一律
620050,寿李伯襄大宗伯
538933,大宗伯董丈用均用前押韵三章见贻惜别陈怀徵之梦寐至云遥想六桥冠盖集知无一日酒杯閒又云水国共怜门似水山神应望屐登山其托羡湖山寄好风雅真无匹矣复以三章追挽先君子奏之松柏之间霜飙骤零真足肠断不揣辄复和谢依来数其乱篇专志哀感知鉴泣乌之私不以续貂为诮也 其一
570924,大宗伯徐公携阿倩见饯娄江命赋之得二绝 其一
561498,恭闻驾谒长陵寄呈扈从夏公大宗伯 其一
686074,答大宗伯陈公二首
383142,冯大宗伯·前年执手碧山阿
54758,过大宗伯徐公留饮山池出所欢明童佐酒
569872,过大宗伯徐公作
606836,答大宗伯陈公二首 其二
548706,题柏溪沈翁画竹大宗伯龙江公尊人也
682210,哭冯大宗伯四首
598770,大宗伯林公谈乡园时政作诗以羊开府为言用韵酬和
665266,寿大宗伯甘泉先生二律 其一
570822,大宗伯姜公倡诸公祈雨澍应偶成一绝奉览蒙赐迭四章不揣鄙陋辄依韵补上忘其续貂恐蹈蛇足不知群公能遂翕如成此胜事否 其一
564985,和大宗伯张阳峰赏莲之什二首 其一
682930,徐公子宅赏牡丹次孙大宗伯二首
383141,冯大宗伯·十年讲幄奉宸聪
517695,南宫呈大宗伯
605234,王幼度明府为今大宗伯云杜李本宁先生犹婿余以本宁先生获交幼度盖三十馀年笔研友也先数岁宝安同社诸君子欲为余作特室于旗峰之阳且受廛矣甲子冬幼度以龙门令摄篆宝安喜而赋之得十六韵以先歌来暮者言非未同幸毋曰此饥鸟此阳鱎也
588735,除夕次大宗伯阳峰韵
569676,徐大宗伯以佛语见讯倚韵和之
535095,徐公子宅赏牡丹次孙大宗伯二首 其一
807458,念奴娇  十三夜大宗伯王敬哉先生招饮是夜无月七叠前韵
588733,祖陵祇役次阳峰大宗伯韵
547909,哭冯大宗伯四首 其二
570824,大宗伯姜公倡诸公祈雨澍应偶成一绝奉览蒙赐迭四章不揣鄙陋辄依韵补上忘其续貂恐蹈蛇足不知群公能遂翕如成此胜事否 其三
535096,徐公子宅赏牡丹次孙大宗伯二首 其二
617841,祈雨部宿呈李金峨大宗伯林鹤胎左宗伯
665267,寿大宗伯甘泉先生二律 其二
690498,寿于谷峰大宗伯六十
260325,送大宗伯两洲王公考绩
556507,送大宗伯两洲王公考绩二首 其一
383834,和答大宗伯董用均
509225,挽大宗伯王文安公
495095,挽大宗伯吴峦徲先生 其二
54759,徐大宗伯同唐张娄三子见饯至新洋江始别
604714,寿于谷峰大宗伯六十 其三
570823,大宗伯姜公倡诸公祈雨澍应偶成一绝奉览蒙赐迭四章不揣鄙陋辄依韵补上忘其续貂恐蹈蛇足不知群公能遂翕如成此胜事否 其二
569462,黄山人说仲故文毅公大宗伯石龙公后也投诗示余别去依此为赠
617831,送董思白大宗伯加太子太保予告驰驿
384199,宗师李芝龄大宗伯
621113,至南都呈大宗伯李小湾先生
569220,歌赠大宗伯袁公抑之七十
690741,挽大宗伯吴峦徲先生
494947,承大宗伯李公薇园燕集原唱并诚斋汪中丞同韵见示次韵酬二公
488757,和大宗伯陈公闻倭寇遁归我师追击尽复朝鲜之地志喜韵
538935,大宗伯董丈用均用前押韵三章见贻惜别陈怀徵之梦寐至云遥想六桥冠盖集知无一日酒杯閒又云水国共怜门似水山神应望屐登山其托羡湖山寄好风雅真无匹矣复以三章追挽先君子奏之松柏之间霜飙骤零真足肠断不揣辄复和谢依来数其乱篇专志哀感知鉴泣乌之私不以续貂为诮也 其三
496040,沁园春 其七 贺大宗伯介溪公六十
606835,答大宗伯陈公二首 其一
570925,大宗伯徐公携阿倩见饯娄江命赋之得二绝 其二
488719,送陈大宗伯还山
547910,哭冯大宗伯四首 其三
569631,贺大宗伯董公孙捷秋试
569777,与元驭宗伯家驭及吾弟敬美二学宪陪杨大宗伯月夜沿流泊西墅作
781976,赠顾大宗伯
547873,寄吴少溪宫录七十 其七十 沈大宗伯使问寄谢
