20911,闻国家将行封禅聊抒臣情
905426,至启伏蒙仆射相公以小子近司靶阁罕扣芜音忽徵庸陋之词盖示记怜之旨特贻篇什俯耀行藏捧玩无厌感戴交切谨依高韵奉和聊抒下情
834912,琐窗寒 北地秋深，月光如雪，凭栏寄咏，聊抒夜思
538775,伏承御史院王大夫再损肴醴之贶聊抒短句情见乎辞
1180000,故洛阳公镇大梁时隐得游门下今之经历事往人非聊抒所怀以伤以谢
538879,承于鳞为先公作传将勒石墓道聊抒鄙感
539304,殷子以七言长韵见投聊抒鄙怀奉答凡二十韵
894418,仲微殿丞以余多难退居荐贻诲问复缄新什以勉病躯扶力牵课聊抒谢恳
538782,倪舍人八十有三矣犹能跨马见访招提赠以佳句第用赐环为慰差非鄙怀聊抒奉答
268108,琐窗寒·北地秋深，月光如雪，凭栏寄咏，聊抒夜思
151088,适斋先生续乐天达哉行因继其后诗虽不工聊抒
1191710,闻国家将行封禅聊抒臣情
961971,适斋先生续乐天达哉行因继其后诗虽不工聊抒鄙意而已
905434,至启至比婴风热殆过浃旬近方稍康未果上谒辄呈短什聊抒下情
538772,戴伯常锦衣携酒萧祠贻诗见赠未能报访聊抒此答
905477,伏蒙承旨学士特赠宠招惭非嘉客陪列仙于丹地观盛事于玉堂御题禁署之名势娱飞动圣制大风之作铿若宫商一时并耀于蓬瀛三体互成于真草昔太宗之优待学士日预论思明皇之宠尚集贤时闻临幸以今况昔异代同荣至谬亚冢卿获司中秘啖牛心而不称陪麈尾以何□□衔乐圣之杯且乏如宾之赋嗟叹不足歌咏辄兴虽劳燥吻之冥搜终类击辕之陋唱仰尘高鉴聊抒下情
