978915,过陈行之饮
1105213,承伯寿大蓬惠书寄大小钵囊花并语及敝居松下石上之饮因成二小诗
844445,寄怀姚秋坪刺史刘雪子通守严星樵明府许午楼孝廉卞晋卿明经均于秦淮作平原十日之饮者也
191956,刘进之饮蕃叟弟筠亭且赋诗余与蕃叟族居盖屏
855312,摊破浣溪沙/浣溪沙 其三 吴兴僧舍竹下与王明之饮
727414,三月二十六日言謇博优行援士相见礼以诗造余寓庐明日遂招之饮而诗未报也阅再旬复以其所为训周晓芙诗波及于我而督和会姚丈人来异其为人乃招之饮而同和之 其一
727414,三月二十六日言謇博优行援士相见礼以诗造余寓庐明日遂招之饮而诗未报也阅再旬复以其所为训周晓芙诗波及于我而督和会姚丈人来异其为人乃招之饮而同和之 其一
1038289,承伯寿大蓬惠书寄大小钵囊花并语及敝居松下石上之饮因成二小诗 其一
389416,东风第一枝·乙卯新正三日孝侯同年招作长夜之饮赋此
438450,次韵安之饮酒
897486,予官竟陵时李文举尝以事至郡同游西禅刹陆子泉烹茶酌酒甚欢也今岁予移官齐安文举自武昌渡江过我与之饮酒念西禅旧事相与慨然
459411,中秋暮将往肖作赏月之饮，适医院一病友为家戚接归。数日未能救之，时尚未断呼吸，既拔氧气，只在分秒矣。既至肖家，众备酒食，予偷隙作此
814565,三月二十六日言謇博优行援士相见礼以诗造余寓庐明日遂招之饮而诗未报也阅再旬复以其所为训周晓芙诗波及于我而督和会姚丈人来异其为人乃招之饮而同和之
814565,三月二十六日言謇博优行援士相见礼以诗造余寓庐明日遂招之饮而诗未报也阅再旬复以其所为训周晓芙诗波及于我而督和会姚丈人来异其为人乃招之饮而同和之
840999,寄怀姚秋坪刺史刘雪子通守严星樵明府许午楼孝廉卞晋卿明经均于秦淮作平原十日之饮者也 其一
1051629,和深之饮字
165020,尹馆作此觅酒召李顺之饮
588419,壬寅闰五月十四夜静坐后但见神气清朗彻夜玩月不寐至五鼓略就枕即梦见白沙先生瘦而长骨格昂峭两目烱然一如画图中所见者持酒一盏饮予曰此醇酒也极甜美曾饮之乎予答曰未饮也曰可饮之饮后即觉寤天将曙矣因纪以诗云
890459,减字木兰花 其一 中秋独与静之饮
160091,招彝叟厚之饮台上花间
199674,过陈行之饮
623645,夏日同卢元明黎缜之饮唐寅仲先生青门
946046,刘进之饮蕃叟弟筠亭且赋诗余与蕃叟族居盖屏迹不出各数年于是有感次其韵
52649,与王庸之饮
1143065,吴隐之饮贪泉图
511090,容一之饮邻家酩酊仆地戏作
653142,六礼有将式克语之三加有辞式克御之死丧之威翕共与之饮食言笑肃慎祇之增增来仍式谷以之毋俾此邦不竞谓之 其二
134780,暮春同刘伯寿史诚之饮宋叔在园
690088,六礼有将式克语之三加有辞式克御之死丧之威翕共与之饮食言笑肃慎祇之增增来仍式谷以之毋俾此邦不竞谓之
793360,友人下第客中，邀为长夜之饮，即席口号慰之
255785,次韵安之饮酒
732816,赴邓柬之饮
870147,秋雨霁倏闻宗圣案伎应之饮酒诗呈宜甫
1092466,同杜叔高祝彦集观天保庵瀑布主人留饮两日且约牡丹之饮 其二
441088,向晚买车之武林从明庐师莼客安和钝丼诸兄作长夜之饮弱侯闻知寄赠长句因步韵却寄
939309,尹馆作此觅酒召李顺之饮
897916,某寒热伏枕已数日忽闻车骑明当接顿睡中得韵语数句上呈四丈龙图兼记至日之饮
1038290,承伯寿大蓬惠书寄大小钵囊花并语及敝居松下石上之饮因成二小诗 其二
200089,鲜于大任自吴下来比与之饮大任自取毗陵惠山
1007635,程申叔来备言近况因与之饮
1026143,和微之饮杨路分家听琵琶 其二
841000,寄怀姚秋坪刺史刘雪子通守严星樵明府许午楼孝廉卞晋卿明经均于秦淮作平原十日之饮者也 其二
523728,早春赴鲍相之饮
1026190,招彝叟厚之饮台上花间
1117308,同杜叔高祝彦集观天保庵瀑布主人留饮两日且约牡丹之饮
176753,程申叔来备言近况因与之饮
764823,东风第一枝 乙卯新正三日孝侯同年招作长夜之饮赋此
62098,九日偕沈濬之饮天长寺昌上人所
604699,重过七星岩祝明府招同南海王明府岩集时余以制帅戴公出访后至遂成长夜之饮赋谢
476030,与王庸之饮
531223,喜任苍岩至招之饮
727415,三月二十六日言謇博优行援士相见礼以诗造余寓庐明日遂招之饮而诗未报也阅再旬复以其所为训周晓芙诗波及于我而督和会姚丈人来异其为人乃招之饮而同和之 其二
727415,三月二十六日言謇博优行援士相见礼以诗造余寓庐明日遂招之饮而诗未报也阅再旬复以其所为训周晓芙诗波及于我而督和会姚丈人来异其为人乃招之饮而同和之 其二
653141,六礼有将式克语之三加有辞式克御之死丧之威翕共与之饮食言笑肃慎祇之增增来仍式谷以之毋俾此邦不竞谓之 其一
870248,暮春同刘伯寿史诚之饮宋叔达园
1068052,正月二十六日寇顺之饮仆以醽渌酒径醉闻横笛音李仲先顺之有苍头能作龙吟三弄偶不果戏成此诗
114616,送陈萧县·欲留君以陈遵投辖之饮
160440,请微之饮·句解章通字字安
363163,吴隐之饮贪泉图
1215264,与韩成之饮
979007,鲜于大任自吴下来比与之饮大任自取毗陵惠山泉酌之色清而味胜蜀无有也喜赋诗
525301,九日风雨同昆山张水部诚之饮岳阳行台
1026477,请微之饮
925469,同杜叔高祝彦集观天保庵瀑布主人留饮两日且约牡丹之饮 其一
1026142,和微之饮杨路分家听琵琶 其一
481540,九日偕沈浚之饮天长寺昌上人所
1131076,和微之饮杨路分家听琵琶
