906735,项城主簿赵岍求书惹云亭为系二绝 其一
1114366,项城主簿赵岍求书惹云亭为系二绝
12330,江南回逢赵曜因送任十一赴交城主簿
152263,庐陵主簿李子贤东顷示长笺用刘元城主簿可教
906736,项城主簿赵岍求书惹云亭为系二绝 其二
866293,送李焕云赴恭城主簿
159396,穀城主簿王崇者少得养生禅寂之道中年弃官入
948656,庐陵主簿李子贤东顷示长笺用刘元城主簿可教事去秋复惠楚词皆未果答今代还索言老谬勿哂
894514,谷城主簿王崇者少得养生禅寂之道中年弃官入汉阴武当之间邈与世绝又有吴人山者自远携母与王同隐时余方贫病慨然慕之因为诗代书以寄二子且托王寻耕钓之地相与迩者并以叙怀云
1168524,送族弟单父主簿凝摄宋城主簿至郭南月桥却回栖霞山留饮赠之
193132,留别桐城主簿
230330,送李焕云赴恭城主簿
1187486,江南回逢赵曜因送任十一赴交城主簿
992763,送毛秘校罢宣城主簿被荐入补令
104849,送毛秘校罢宣城主簿被荐入补令
922603,美哉一首送韦城主簿欧阳君
916266,留别桐城主簿
1251309,题竹赠石城主簿倪仲威
5180,送族弟单父主簿凝摄宋城主簿至郭南月桥却回
198015,项城主簿赵赋求书惹云亭为系二绝
99667,美哉一首送韦城主簿欧阳君
