614860,送毛明府之永嘉
1184019,送友人之永嘉
1069879,予同彦老自四明之永嘉中道留宿岳林会法照海印二禅伯夜话投晓登车乃行留题于寺三首 其三
505110,送陈省之之永嘉二首 其一
1069877,予同彦老自四明之永嘉中道留宿岳林会法照海印二禅伯夜话投晓登车乃行留题于寺三首 其一
1246110,壬辰岁八月自台州之永嘉度苍岭
367257,予同彦老自四明之永嘉中道留宿岳林
1248846,送钱思复之永嘉山长
735717,将之永嘉曹侍郎饯予江上，吴客韦二丈为弹长亭之曲并吹笛送行，歌以赠韦即送其出塞
1019371,送僧之永嘉
184856,送绍兴张耆年教授之永嘉学官
1107363,予同彦老自四明之永嘉中道留宿岳林会法照海印二禅伯夜话投晓登车乃行留题于寺三首
1000926,送绍兴张耆年教授之永嘉学官
544698,送伍明府景周之永嘉
682326,送陈省之之永嘉二首
1069878,予同彦老自四明之永嘉中道留宿岳林会法照海印二禅伯夜话投晓登车乃行留题于寺三首 其二
502708,送王借之永嘉训迪
735518,送张振九之永嘉司马任
204594,送僧之永嘉
550845,送陈彦宗之永嘉
505111,送陈省之之永嘉二首 其二
25049,送友人之永嘉
1216429,送府掾之永嘉
