1152842,元日寄诸弟兼呈崔都水
542256,晚秋呈崔后渠侍郎
5671,开元观怀旧寄李二韩二裴四兼呈崔郎中严家令
1213766,塞上闻鸡呈崔中丞
8834,江阁卧病走笔寄呈崔卢两侍御
527240,朝天宫看梅呈崔萧二光禄刘尚宝
1068547,次韵答任德夫夹滩见贶长句并呈崔彦圣
1166010,晚次荆溪馆呈崔明府
359603,道中有作呈崔风子
1172893,江阁卧病走笔寄呈崔卢两侍御
5059,赠宣城宇文太守兼呈崔侍御
1055015,道中有作呈崔风子
1166570,早过梨岭喜雪书情呈崔判官
23135,醉后呈崔大夫
1156116,花前有感兼呈崔相公刘郎中
22138,晚次荆溪馆呈崔明府
1174260,醉后呈崔大夫
1179282,寓兴呈崔员外诸公
18847,花前有感兼呈崔相公刘郎中
1083620,花前有感兼呈崔相公刘郎中
1227136,湖中醉呈崔郎中
5692,元日寄诸弟兼呈崔都水
13344,寓兴呈崔员外诸公
494753,次韵吕仲木修撰赴予边炉之作兼呈崔穆黄诸君
35721,早过梨岭喜雪书情呈崔判官
1153964,早春游樊川野居却寄李端校书兼呈崔峒补阙司空曙主簿耿湋拾遗
1152705,开元观怀旧寄李二韩二裴四兼呈崔郎中严家令
1168746,赠宣城宇文太守兼呈崔侍御
