871760,三子以食贫困于藜藿为诗以勉之
1055625,德循诗律甚佳方幸拭目因作拙句以勉之
1047144,宗弟晦之通直有诗陈武信归簉三老之后损之喜继元韵以勉之
865890,与所盘行溪边有一小屋可爱问之乃为南山主人盘翁欲买居越日诗来有孟光到老不晓事刚道还山活计非之句用韵以勉之
1057321,子瞻辞免起居之命令铄复用前韵一首以勉之
517822,棐子弱冠成人伊始寄一律以勉之
621990,有怀岐岩新寺因寄悦则讯其近日功程兼以勉之四首 其一
630598,诸衲侍长庆老人扫博山塔诗以勉之二首 其一
1119754,和陈叔馀韵二首一以谢来意一以勉之
240205,和陈叔余韵二首一以谢来意一以勉之
962427,临川吴子达以揲蓍游成都访余寺中见堂上晦翁像作而曰向亦尝得见之且见问蜀之易学子云以来代有其人近世何如某叹其用意精切拳拳如此因为出数语以勉之
703629,诸衲侍长庆老人扫博山塔诗以勉之二首
1127811,值侯修学趣儒人稍急因遗莲花莲实西瓜于吾宗翔叔作诗以勉之
1222957,仲章诗律大进数日道中论诗亦颇相合复次前韵以勉之
1069752,雨夜与模论中原旦起模与徐惇济游清凉观形势嘉其有志因以勉之
596955,晓发饯关少宰暮雨谩述以勉之
1214688,余自辛亥岁馆于魏塘吴氏时义士静心先生方无恙长子彦良应门于家次子景良输力于时皆一时伟人季子季良为赘婿于外与余尤相友善岁壬申景良卒于官所归葬胥山诸孙各求分异学遂废而余乃去矣顷者不逞之徒坏其守冢之庐季良之子璋闻于官罪人斯得众称之曰能故为是诗以勉之
872348,旧庐毁于乱十年矣吾老他寓每不能再葺戊子冬良异聚芸人之资自构小堂因以勉之
1122481,临邛计次魏自言六世祖破荒先生晚居景陵因葬焉后世子孙岁时不能拜扫日负樵牧不禁之忧慨然欲往携其所藏遗书一卷求书纸尾且云是行并之武昌省运使表兄迤逦观光上国用正岩字韵赋诗一章以言志正亦用岩字韵为赋三章以勉之云
925555,第四子学春秋发愤不辍书以勉之
948976,登仕郎张武来求一言因记衰颜就以勉之
434749,故人翟仲谋潦倒场屋今复见之所异于昔者苍颜白发耳适以诗陈情辄次其韵因以勉之
1070772,连日以目疾不能躬课子侄辈枕上成四十言粗明汲古之意以勉之
701022,夜酌方圣羽于石巢诗以勉之
559214,侄圻之南雍诗以勉之
152166,登仕郎张武来求一言因记衰颜就以勉之
889069,贡院落成郡庠诸生毕集因作诗以勉之
625198,夜酌方圣羽于石巢诗以勉之 其二
497911,赠君锡即用其韵兼有以勉之
330252,德循诗律甚佳方幸拭目因作拙句以勉之
625197,夜酌方圣羽于石巢诗以勉之 其一
301226,龄儿学字诗以勉之
305864,易升权自北归诗以勉之
621992,有怀岐岩新寺因寄悦则讯其近日功程兼以勉之四首 其三
324657,外孙刘子野游学南安才归数日又告行匆匆赠以一诗为别且以勉之
944405,和陈叔馀韵二首一以谢来意一以勉之 其二
1001400,值侯修学趣儒人稍急因遗莲花莲实西瓜于吾宗翔叔作诗以勉之 其一
1072923,外孙刘子野游学南安才归数日又告行匆匆赠以一诗为别且以勉之
621993,有怀岐岩新寺因寄悦则讯其近日功程兼以勉之四首 其四
1001398,值侯修学趣儒人稍急因遗莲花莲实西瓜于吾宗翔叔作诗以勉之 其三
630599,诸衲侍长庆老人扫博山塔诗以勉之二首 其二
962430,临邛计次魏自言六世祖破荒先生晚居景陵因葬焉后世子孙岁时不能拜扫日负樵牧不禁之忧慨然欲往携其所藏遗书一卷求书纸尾且云是行并之武昌省运使表兄迤逦观光上国用正岩字韵赋诗一章以言志正亦用岩字韵为赋三章以勉之云 其一
871734,郑师易秀才诗奔腾遒壮殆有石曼卿学士风骨作四韵以勉之
962428,临邛计次魏自言六世祖破荒先生晚居景陵因葬焉后世子孙岁时不能拜扫日负樵牧不禁之忧慨然欲往携其所藏遗书一卷求书纸尾且云是行并之武昌省运使表兄迤逦观光上国用正岩字韵赋诗一章以言志正亦用岩字韵为赋三章以勉之云 其三
1001399,值侯修学趣儒人稍急因遗莲花莲实西瓜于吾宗翔叔作诗以勉之 其二
710225,龄儿学字诗以勉之
699656,有怀岐岩新寺因寄悦则讯其近日功程兼以勉之四首
1214219,余昔年邂逅登山东卢长卿之门遂联辔游京师真所谓倾盖如故者也别六年重过其庐则已为他人屠沽肆矣因诘邻翁乃知以穷徙他所遂往访之缱绻话旧成短歌以勉之
160498,燕诸生于内集堂作诗以勉之
163267,第四子学春秋发愤不辍书以勉之
239051,三子以食贫困藜藿为诗以勉之
1210656,张提刑向尹大兴天子以二海青宠锡之未几拜兹命则知睿眷之有在也于其行作诗以勉之
923358,秀才石君予同年子也携书见投重之以歌诗意甚勤厚其归也邀予言为赠因作五言以勉之
1210058,景贤作诗颇有思归意因和元韵以勉之
944404,和陈叔馀韵二首一以谢来意一以勉之 其一
415012,易升权自北归诗以勉之
445622,闻皎月将调蕲春文化局诗以勉之
962429,临邛计次魏自言六世祖破荒先生晚居景陵因葬焉后世子孙岁时不能拜扫日负樵牧不禁之忧慨然欲往携其所藏遗书一卷求书纸尾且云是行并之武昌省运使表兄迤逦观光上国用正岩字韵赋诗一章以言志正亦用岩字韵为赋三章以勉之云 其二
621991,有怀岐岩新寺因寄悦则讯其近日功程兼以勉之四首 其二
1026934,燕诸生于内集堂作诗以勉之
240206,一以勉之·此道何曾远
1222819,再从侄瑛幼孤学道龙虎山自伤不能鞠携述祖德以勉之
138493,贡院落成郡庠诸生毕集因作诗以勉之
604877,勋侄瑩儿堪台两孙偕试棘闱诗以勉之
