1147054,题湖上草堂
36570,题湖上草堂
414373,嘉州乌尤山访马一浮先辈次其濠上草堂即物成咏五首原韵奉赠选二 其二
384001,访徐尚容·虎溪溪上草堂閒
313434,嘉州乌尤山访马一浮先辈次其濠上草堂即物成咏五首原韵奉赠选
530192,同吾进士谨游陈遂初湖上草堂
538943,湖上草堂为德甫赋
592059,寻空同先生河上草堂
1038668,金陵府署池上草堂
802021,过涧上草堂徐昭法先生故居
744164,涧上草堂
745710,涧上草堂
628625,过罗幼良溪上草堂留题
530281,过陈进士遂初湖上草堂
770721,题钟秋岩《涧上草堂图》
709226,周还梅濠上草堂
749349,江上草堂歌
351293,金陵府署池上草堂
615324,十六夜同诸子饮欧华玉湖上草堂因与子建伯乔二子荡舟观海尽兴而返得清字
412080,癸未蜀游杂诗四首 其四 乐山访濠上草堂
347224,题钟秋岩《涧上草堂图》
440562,复性书院旧设乌尤寺内，为抗战时期马一浮先生撰杖都讲地也，其居所曰“濠上草堂”者亦构筑于乌尤山麓。是日下午以游凌云山茗饮延时未及往游，遥礼之而已
317164,乐山访濠上草堂
433759,嘉州乌尤山访马一浮先辈次其濠上草堂即物成咏五首原韵奉赠选二
800771,题徐昭法先生涧上草堂画兼贻西照头陀
380895,后庭花·湖上草堂和孙光宪
810158,后庭花  湖上草堂和孙光宪
414372,嘉州乌尤山访马一浮先辈次其濠上草堂即物成咏五首原韵奉赠选二 其一
742294,涧上草堂
620099,甲午七夕小酌溪上草堂
737902,晚过池上草堂示允武
594761,春日郭舜举学宪枉过洲上草堂
502933,欧阳明府江上草堂
472930,李太常伯华江上草堂雪夜出妓弹琵琶
801841,雪中忆家园池上草堂
