1078259,季夏之初自安国迁南台天宁寺依南山而面北暑气尤盛暇日望山顶松林郁然意必有异因穴垣凿磴以造其上形势坦平风日清美四顾山峦环合江潮往来景物不可模状月出林表清光更多夜久阒寂殆非尘世作古诗二十韵以纪其事奉呈巽达元仲
137432,答原父·炎歊郁然蒸
112141,棹歌·九曲遥岑更郁然
1004612,直庐多暇新绿郁然信笔二绝 其二
1004613,直庐多暇新绿郁然信笔二绝 其一
1250575,宋铙歌鼓吹曲十二首 其一 太祖生洛阳甲马营中神光满室有香郁然经宿不散此圣徵先见者也为启圣徵第一
828487,一夕梦至陈仲恕园中花木郁然有小精室为予画竹一幅题语甚多壁间悬其尊人蓝洲先生山水小幅尤精妙醒记以诗
1072875,中夜起坐惜春亭月照酴醾清香郁然因成四韵
900271,益阳南境松杉夹道郁然父老相传忠定张公为邑时所植也其间亦有既剪而复生者作诗属来者护持之
1132457,伯坚惠新茶绿橘香味郁然便如一到江湖之上戏作小诗二首 其一
501481,二十七日晚到万安县县令冯仲文来问劳翌日登岸观故宋贾相秋壑所居故址左城隍祠右社稷坛中为龙溪书院其后二乔木郁然云贾相生于此书院旧甚盛田多于邑学今归之官独旧屋前后二间中存先圣燕居像左四公木主徘徊久之当宋季年君臣将相皆非气运方兴者敌襄樊无策可救江左人材眇然无可为者譬之奕者不胜其偶无局不败是时有识者为崔菊坡叶西麓无已则为文山李肯斋可也而痴顽已甚贪冒富贵国亡家丧为千载骂笑而刻舟求剑者乃区区议其琐琐之陈迹悲夫因
186745,益阳南境松杉夹道郁然父老相传忠定张公为邑
184637,涧壁梁公主祠武帝女也据高冢上林木郁然形开
234192,直庐多暇新绿郁然信笔二绝
324233,中夜起坐惜春亭月照酴醾清香郁然因成四韵
115359,竟陵酒官舍北有数步草岁寒霜落犹郁然也予为
1132456,伯坚惠新茶绿橘香味郁然便如一到江湖之上戏作小诗二首 其二
896664,竟陵酒官舍北有数步草岁寒霜落犹郁然也予为障其风霜暮冬尚自如一日大火焚舍无遗复往寻草不复有矣
1035742,吾友山阳蹇子韫尝游颍上言彼之居人有许氏者富不因贪学非求进于郡之西手植众木郁然成林林下搆亭壮而不丽郡倅黄公宗旦皇宋有名之士也常造焉上阙歌诗以旌其美故俾予请诗于子吾以子韫之请诗于予八十言以寄题
434795,自东营来广宁道出牵马岭岭西去路几半里松桧郁然桃李閒发问之云利器梁侯之先茔也其榇尚附浅土遂命酒哭奠而去公初待我以国士虽睌意少疏而恩礼未易忘也
689764,二十七日晚到万安县县令冯仲文来问劳翌日登岸观故宋贾相秋壑所居故址左城隍祠右社稷坛中为龙溪书院其后二乔木郁然云贾相生于此书院旧甚盛田多于邑学今归之官独旧屋前后二间中存先圣燕居像左四公木主徘徊久之当宋季年君臣将相皆非气运方兴者敌襄樊无策可救江左人材眇然无可为者譬之奕者不胜其偶无局不败是时有识者为崔菊坡叶西麓无已则为文山李肯斋可也而痴顽已甚贪冒富贵国亡家丧为千载骂笑而刻舟求剑者乃区区议其琐琐之陈迹悲夫因
151753,伯坚惠新茶绿橘香味郁然便如一到江湖之上戏
493248,数日风雪不见武山稍霁出溪上见云气郁然喜赋一绝
1253098,宋铙歌鼓吹曲十二首 太祖生洛阳甲马营中神光满室有香郁然经宿不散此圣徵先见者也为启圣徵第一
1088952,前日出城苗犹立槁今日过兴安境上田水灌输郁然弥望有秋可必乃知贤者之政神速如此辄寄呈交代仲钦秘阁
501480,二十七日晚到万安县县令冯仲文来问劳翌日登岸观故宋贾相秋壑所居故址左城隍祠右社稷坛中为龙溪书院其后二乔木郁然云贾相生于此书院旧甚盛田多于邑学今归之官独旧屋前后二间中存先圣燕居像左四公木主徘徊久之当宋季年君臣将相皆非气运方兴者敌襄樊无策可救江左人材眇然无可为者譬之奕者不胜其偶无局不败是时有识者为崔菊坡叶西麓无已则为文山李肯斋可也而痴顽已甚贪冒富贵国亡家丧为千载骂笑而刻舟求剑者乃区区议其琐琐之陈迹悲夫因
883157,涧壁梁公主祠云武帝女也据高冢上林木郁然形势开敞盖公主所葬欤无碑志未及考诸记载士大夫留诗未见有起人意者余守风四日为十二韵
1224236,县下凿池种树成聚晨起视水深五寸而草树承夜雨后苍翠郁然可爱戏题厅柱
1128157,直庐多暇新绿郁然信笔二绝
1132651,伯坚惠新茶绿橘香味郁然便如一到江湖之上戏作小诗二首
71601,一剪梅·畏日炎炎气郁然
