155108,提刑司勋示及瞑禽图作诗咏之
1050289,将至寿阳谒朱行中龙图作
694465,阅周溪图作赠刘景林归呈尊甫翁肃庵程乡令
264168,观青海图作
47540,吴歌·栽花图作看花人
510361,阅周溪图作赠刘景林归呈尊甫翁肃庵程乡令 其二
745612,观青海图作
510360,阅周溪图作赠刘景林归呈尊甫翁肃庵程乡令 其一
807668,绮罗香  题宋既庭小照 图作长松宽幅
510363,阅周溪图作赠刘景林归呈尊甫翁肃庵程乡令 其四
291740,题鬼趣图·作态烟云欺病眼
610240,扶胥冬泛同卢元明朱季美万伯文刘季德黎缜之区子建刘道子黄元卿区启图作
999304,侍御王公去饶饶之士民数千万人遮道攀辕又相与断城北桥以留之公不得已乃回城从间道遁去馀干主簿翁君画断桥图作诗二十韵寄侍御求和侍御以和篇见示因次韵一首
796011,徵招 为袁薇生题随园饯别图，图作展重阳会，为先贞悯公手笔
510362,阅周溪图作赠刘景林归呈尊甫翁肃庵程乡令 其三
787701,钝斋主人赋诗见赠并弁言白云洞读书图作长句谢之
785599,福州大水行同张樵野丈荫桓龚霭人丈易图作
748455,张石舟与何子贞既构顾先生祠刻亭林年谱成因得睹蔡小石司业家藏万年少秋江别思图图作以赠亭林者也石舟与子贞各摹其画及识语并程氏易畴题跋装为卷石舟手书亭林赠万举人诗又所作次顾韵题此图诗补成顾祠秋祭诗并录于卷属赋诗得五言一首
569233,醉茶轩歌为詹翰林东图作
852187,提刑司勋示及瞑禽图作诗咏之
980498,自和因思国史燕穆之传称其知明州革轻悍斗争之俗及今海潮图作
799052,虞美人 题陈炳权校长十分春色图。图作折枝花十色
744107,未谷在云涛寺避暑余往访之清斋三日而别为留是图作佛前清供
617887,汪生洲左司马致仕将归授其先公诒燕图作歌多怀旧之感
