672227,怀窗友张孟父
494526,为石泉赠窗友
654884,送窗友赵景芳以乡进士出宰商河
653581,窗友张彦晖老未有字甚非古义予惟善不可以老辞过不可以老遂因字以士明为诗以寓箴儆
509631,去岁余与窗友赵伯颙同外补五月十有二日予至钱塘宿斋吴山而伯颙已先至因来叙话夜分始别匆匆一载矣兹予统师南征经伯颙之邻封伯颙亦来犒师亦以是日会于浔阳两情相对喜而复感而伯颙又亟欲别去予因口占三绝以赠 其一
578047,送窗友温知果归省
150618,别枢相·未冠鸡窗友
509416,送窗友陆掌教之柘城
704052,去岁余与窗友赵伯颙同外补五月十有二日予至钱塘宿斋吴山而伯颙已先至因来叙话夜分始别匆匆一载矣兹予统师南征经伯颙之邻封伯颙亦来犒师亦以是日会于浔阳两情相对喜而复感而伯颙又亟欲别去予因口占三绝以赠
509632,去岁余与窗友赵伯颙同外补五月十有二日予至钱塘宿斋吴山而伯颙已先至因来叙话夜分始别匆匆一载矣兹予统师南征经伯颙之邻封伯颙亦来犒师亦以是日会于浔阳两情相对喜而复感而伯颙又亟欲别去予因口占三绝以赠 其二
509633,去岁余与窗友赵伯颙同外补五月十有二日予至钱塘宿斋吴山而伯颙已先至因来叙话夜分始别匆匆一载矣兹予统师南征经伯颙之邻封伯颙亦来犒师亦以是日会于浔阳两情相对喜而复感而伯颙又亟欲别去予因口占三绝以赠 其三
676183,挽钱文翔窗友
