980050,高邮忽见叔易嵩山下所寄绝句次韵和之旧所作不次韵也
810036,浣溪沙　小重山房图题者殆遍，秋日得一二交好。书询及园居风景，将以此图寄之，展阅旧所为小重山令四解，意有未尽，为补三阕于后 其一
185236,张氏园·郭内名园旧所闻
929798,读王季夷旧所寄诗
184533,西溪会范叔刚用旧所寄韵
179821,次常熟县先君旧所摄宰也
920455,李公择求黄鹤楼诗，因记旧所闻于冯当世者
1248391,寓徐给事宅观旧所植竹树怆然有怀
1143348,题萧梅初旧所藏钱塘王畿图二首 其一
1214833,题东城和尚旧所赠卷后
983718,次常熟县先君旧所摄宰也
150694,嘉泰壬戍归省坟墓感仲叔旧所惠诗及延庆堂梦
958293,相识有遗予以紫石砚者谓是下岩石名曰玉斗予自湖南再转之岭畏行李重滞旧所用委弃不存正以无砚为窘得之喜甚且爱其名捧而戏之曰亚父后尔尚无恙耶为赋此
882729,西溪会范叔刚用旧所寄韵
1144597,题萧梅初旧所藏钱塘王畿图二首
99178,李公择求黄鹤楼诗因记旧所闻于冯当世者
459260,十一月十五共肖往平江，访旧所历，游连云山，随行随书。及归，更补怪木、果蜕二章。岳阳汽车站遇老人弹凤凰琴，久听彷徨，有不能为怀者。略资其困，与接言甚欢，遂为吾缕述其事。车上记之
961611,嘉泰壬戌归省坟墓感仲叔旧所惠诗及延庆堂梦二首 其一
1143349,题萧梅初旧所藏钱塘王畿图二首 其二
458331,作上章竟，忆旧所见屋
996407,元师自荣州来追送余于泸之江安绵水驿因复用旧所赋此君轩诗韵赠之并简元师法弟周彦公
887486,永遇乐 林钟商过李氏晚妆阁，见壁间旧所 其一 题词，遂再赋
973537,臧正卿示旧所唱酬秋字韵诗轴要季承同用韵赠之
305389,十一月十七日晚登乌石山王壮悯公祠旧所借居地也还就天后宫访碑循磴烟草芜合怅望久之
961610,嘉泰壬戌归省坟墓感仲叔旧所惠诗及延庆堂梦二首 其二
813199,浣溪沙　小重山房图题者殆遍，秋日得一二交好。书询及园居风景，将以此图寄之，展阅旧所为小重山令四解，意有未尽，为补三阕于后
223610,文中子·先人旧所理
1084403,读孙子尚旧所寄书
1235919,竹山山中太皇观小憩道士白刘伯温御史旧所题二绝句即景和寄
1208974,竹山山中太皇观小憩道士白刘伯温御史旧所题二绝句即景和寄 其一
230001,访旧所游服膺斋怅然有怀
810037,浣溪沙　小重山房图题者殆遍，秋日得一二交好。书询及园居风景，将以此图寄之，展阅旧所为小重山令四解，意有未尽，为补三阕于后 其二
934374,湖上遇道翁乃峡中旧所识也
962469,访旧所游服膺斋怅然有怀
84883,读王季夷旧所寄诗
1091458,怀显上人时在江州次其旧所作诗韵寄之己卯夏予始识之于城西王氏坟庵
149429,高邮忽见叔易嵩山下所寄绝句次韵和之旧所作
1078885,旧所乘马老且瘠见之感怀
95909,臧正卿示旧所唱酬秋字韵诗轴要季承同用韵赠
1208975,竹山山中太皇观小憩道士白刘伯温御史旧所题二绝句即景和寄 其二
363292,题萧梅初旧所藏钱塘王畿图
810038,浣溪沙　小重山房图题者殆遍，秋日得一二交好。书询及园居风景，将以此图寄之，展阅旧所为小重山令四解，意有未尽，为补三阕于后 其三
81496,湖上遇道翁乃峡中旧所识也
1122442,嘉泰壬戌归省坟墓感仲叔旧所惠诗及延庆堂梦二首
429756,十一月十七日晚登乌石山王壮悯公祠旧所借居地也还就天后宫访碑循磴烟草芜合怅望久之
1091422,德裕见过次旧所题隐轩韵谢之
436392,冯弟自北山来出其旧所为诗百馀篇虽未暇尽读尝鼎一脔足知馀味吾弟离群索居无师友之益能自道其所志盖绝无而仅有者也虽然掘井九仞而不及泉犹为弃井耳适汉臣张君见过论文话旧以及吾弟之贤因作诗许其所已能而勉其所未至以寄之幸时复观览以自警省勿徒实箧笥而已
