481061,题谢孔昭雨中过沈孟渊所诗画
665825,棠陵家观释宗林诗画戏为一偈嘲之
406643,陈百庸属题出峡诗画册
559215,送李汉翀回镛汉翀工诗画为两峰先生孙
267864,减字木兰花·题倪鸿宝诗画卷
1247459,酬答启东明上人诗画之惠
272381,台城路·西湖花隐诗画册
570722,黎丘大王以手书及诗画见投寄谢并赠得六绝句 其五
570718,黎丘大王以手书及诗画见投寄谢并赠得六绝句 其一
123796,贴门诗·画合围香裹
347090,为胡子贤题归初粤人诗画集
794950,如此江山 为李艺渊观察题姚简叔浔阳琵琶图，次集中题船山诗画册韵
308335, 为钱仲仙题梁节庵李子申汪沤客送曾履初诗画卷子
751725,听水居士贻诗画扇即次其绝句天字韵
653591,为干景瞻题唐高骈山亭夏日诗画十韵
833085,减字木兰花 其一 题倪鸿宝诗画卷
166976,题范才元湘江诗画
220518,挽王夫人·婉娩娴诗画
481062,题沈公济雪中过沈孟渊所诗画
42011,已亥杂诗·画禅有女定清真
598090,李山人春日别予郊居以诗画寄予作此答之
272637,虞美人·题锄月种梅诗画卷
807376,八声甘州  丙辰夏月，蘧先生游广陵，诸同人以先生昨岁七秩，补作诗画奉赠，初秋归里持以示余，遂于卷尾亦题一章
270708,海上杂诗·画角传荒戍
385820,答张子光·闲携诗画便游山
1138082,次罗梅谷诗画总观
575222,为勋侄题元人诗画
539942,题王子裕佥宪诗画册后
629665,阅小乔诗画
407595,题马王诗画合卷   并序
538949,张山人游吴留一月以诗画为贽赋此赠之
333517,泛碧斋诗·画斋初泛碧溪浔
150419,西湖素公爱余泊黍小诗画为扇子
465307,东风第一枝 癸巳秋闱报罢，无聊中，以诗画遣兴，偶画落梅小幅，并填长调。
569000,题坦庵老人诗画册为甥金博士
843659,减字木兰花 题倪鸿宝诗画卷
843178,为钱仲仙题梁节庵李子申汪沤客送曾履初诗画卷子
1058517,高邮张生出所得诗画一轴求余作诗因书
901489,跋百之诗画
66280,题沈公济雪中过沈孟渊所诗画
278698,曹氏四绝·弟兄诗画艺兼工
233234,跋百之诗画
961680,西湖素公爱余泊舟小诗画为扇子
127250,杂诗·画工作江梅
927599,诗画吟
662661,题沈石田游张公洞诗画
200135,次罗梅谷诗画总观
604271,秋日丰湖宴集田伯善少参汎舟候月纵谈玄教见贻便面诗画次韵赋答
132219,士师诗·画邱置学明如星
666196,观马清痴所临元缪佚山泾杂树诗画戏为题句
278965,题马王诗画合卷 并序
570720,黎丘大王以手书及诗画见投寄谢并赠得六绝句 其三
742834,蓬心太守乞休构心太平庵于鄂渚贻以洗桐之资兼诗为谢依韵奉酬蓬心为麓台先生侄孙太常烟客之后也能诗画善饮年七十余强健如少年
570719,黎丘大王以手书及诗画见投寄谢并赠得六绝句 其二
66279,题谢孔昭雨中过沈孟渊所诗画
512611,保叔傅公得余诗画失去重补
512837,无锡沈宗贵存耕翁之仲子自弱冠侍翁至余家余年十三见先父以诗画赠存耕经四十九年尚存宗贵所观感而赋此
347669,高邮张生出所得诗画一轴求余作诗因书
770670,为胡子贤题归初粤人诗画集
683892,黎丘大王以手书及诗画见投寄谢并赠得六绝句
570723,黎丘大王以手书及诗画见投寄谢并赠得六绝句 其六
677300,扇头见林天素诗画因次其韵
1139647,题梁中砥诗画图
760883,桃源女史朱伯姬，九江先生女公子也，能诗画，为兰史作小幅而自题绝句其上，兰史出观，因为书此
921671,王晋卿作《烟江叠嶂图》，仆赋诗十四韵，晋卿和之，语特奇丽。因复次韵，不独纪其诗画之美，亦为道其出处契阔之故，而终之以不忘在莒之戒，亦朋
568600,题黄斗塘诗画
570721,黎丘大王以手书及诗画见投寄谢并赠得六绝句 其四
905942,题范才元湘江诗画
