968160,题云岫半閒堂用李涉韵 其二
657060,聚英堂用萧宜冲韵
1084941,题寿乐堂用东坡韵赠杨元宾佥判
575005,超然堂用韵答陈子引
263861,满江红·倦游初归顾庵绎堂处实既庭枉集草堂用顾庵原韵
1034245,寄题林上舍真意堂用其元和渊明韵二首 其二
332967,八声甘州·郑延平王祠堂用梦窗游灵岩韵
968161,题云岫半閒堂用李涉韵 其一
1090567,连日雨遂阻到草堂用前韵寄意
1095282,和东坡守汝阴祷雨张龙公祠得小雪会饮聚星堂用欧公故事
321663,追和范文正公鄱阳诗 降圣节诣天庆观因谒颜鲁公范文正公祠堂用赠御赐名道士韵
1132238,寄题林上舍真意堂用其元和渊明韵二首
97834,题徐氏滋德堂用老谢丈韵
974485,题徐氏滋德堂用老谢丈韵
655170,会贺五宫保于部堂用屠都宪韵
1123255,题云岫半閒堂用李涉韵
537814,题项子曲池草堂用原韵 其三
847643,绍兴亲享明堂二十六首 其二 升堂用《仪安》。
683337,题项子曲池草堂用原韵
699387,集平山堂用平山字为韵偕游者方子两谢生也
679190,赋雪堂用千松老人韵寄能仁大彻法师
983386,晦庵文公祠堂用令君韵
572581,集平山堂用平山字为韵偕游者方子两谢生也 其一
1034246,寄题林上舍真意堂用其元和渊明韵二首 其一
804273,乙巳子月六日伊吾旅次被命回京以四五品京堂用纪恩述怀二首 其二
228102,寄题林上舍真意堂用其元和渊明韵
712876,张观察振六招同诸公集惜分堂用杜韵
571199,酬朱邑传再和草堂用西字韵结
212288,章运干和绿阴堂用韵为谢
1085346,追和范文正公鄱阳诗 降圣节诣天庆观因谒颜鲁公范文正公祠堂用赠御赐名道士韵
834972,露华 其二 和闰庵堂，用碧山仄韵
129028,水调歌头·平山堂用东坡韵
123632,寄题商华叔心远堂用卷中韵
662950,南野堂用韵似陆柱史
994843,章运干和绿阴堂用韵为谢
537813,题项子曲池草堂用原韵 其二
836138,八声甘州 郑延平王祠堂用梦窗游灵岩韵
956703,寄题商华叔心远堂用卷中韵
734494,叶已畦招集二弃草堂用昌黎醉赠张秘书韵
537812,题项子曲池草堂用原韵 其一
814474,乙巳子月六日伊吾旅次被命回京以四五品京堂用纪恩述怀二首
1095366,李燕公生华亭尉厅旧有相公阁可斋洪少府于废址更为梦燕堂用玉燕入怀事永嘉赵清旷索同赋
1248018,宴王允同雅会堂用外舅韵
572582,集平山堂用平山字为韵偕游者方子两谢生也 其二
752361,肯堂用大人韵作诗示予因及予与吴仲懿江阴之旧游而以身强为可宝次韵奉酬
204798,题云岫半閒堂用李涉韵
617415,恭陪王侍御老师偕洪徐二公祖方都阃奉祭太师我翁因步遹求堂用求字韵分赋
804272,乙巳子月六日伊吾旅次被命回京以四五品京堂用纪恩述怀二首 其一
854225,水调歌头 其二 平山堂用东坡韵
967591,摸鱼儿 荷花归耕堂用时父韵
708209,满江红 其九 倦游初归顾庵绎堂处实既庭枉集草堂用顾庵原韵
