762095,冬至前二日大雨
269437,冬至前二日大雨
168597,庆元已未冬至前二日访林公度至栗山翌日同访
686012,长至前二日送周驾部考绩二首
662301,冬至前二日赴朝天宫习仪
149425,庚子至前二日韩德全李师民相继而至聊书一时
515225,长至前二日闻李锦衣士敬自南阳扫墓取道访予新安奉迓杨山寺是日相传皇子诞生有赦将到
50368,至前二日朝天宫习仪
494462,奉次舆浦王公冬至前二日韵
462771,丙申夏至前二日，与云叶溪三兄晨入颐和园。观谐趣园乾隆御笔寻诗径碑，过西堤景明楼，狎以群燕绕檐不去。复喜耕织图道旁三百年桑树十九株，乃约押古桑二字成诗
275048,长至前二日同右吉翁山陪曹秋岳先生宿雁门关
607186,冬至前二日寿新安汪封君
587063,长至前二日赏东麓亭和司马王浚川韵 其二
980275,庚子至前二日韩德全李师民相继而至聊书一时之事
994561,庆元己未冬至前二日访林公度至栗山翌日同访吴必大林季亨容之偕行爱其溪山池亭之胜为之赋诗
698080,长至前二日赏东麓亭和司马王浚川韵
606439,长至前二日送周驾部考绩二首 其二
587062,长至前二日赏东麓亭和司马王浚川韵 其一
476637,至前二日朝天宫习仪
606438,长至前二日送周驾部考绩二首 其一
735462,长至前二日同右吉翁山陪曹秋岳先生宿雁门关即事四十韵拈玉树凋伤枫树林之句分凋字
