921658,次韵黄鲁直嘲小德。小德，鲁直子，其母微，故其诗云：解著《潜夫论》，不妨无外家
979160,贵溪徐氏招隐园昔王表避乱居此山依之者数千家其诗云逍遥入南斗者也
1063727,敦素坐诵公衮乌臼树绝句叹爱不已其诗云三年逐客弄湘流华气遮栏两鬓秋秪有荒寒江上树尚成诗句聚眉头成此寄之
520317,是岁二月丁未出郭予宗室昆季诸王往饯于城西之十里铺予因有诗留别其诗云
659128,张旭春草帖予闻其奇久矣今年至京口始得观于少傅杨公之第天下奇迹也公欲予题其后以诗来云敝墨残毫一尺馀老来犹得伴幽居宋元好事题将遍当代名公可缺书余谢不敢当次其诗云
520318,其日巡镇诸公暨诸藩臬候送于崇仁寺予亦有诗留别其诗云
1214212,子昂学士为余作此山二字并作诗见畀其诗云青青云外山炯炯松下石顾此山中人风神照松色又云爽气在襟袖清风拂丝桐悠悠适天趣宴坐心融融书此以谢
102406,次韵黄鲁直嘲小德小德鲁直子其母微故其诗云
520316,弘治癸丑予以足疾未瘳倦于医居恒忽忽或有进者曰去城之西三百里太白山之下有泉曰凤泉去城之东百馀里曰石门亦有汤泉去城之东北六十里曰骊山亦有温泉浴其水者痼疾皆愈予闻而异之曰有是哉第以守藩不敢专出入乃遣使上告于天子天子许之予拜命踊跃不敢烦有司自饰具以往感恩志喜因有一律纪之其诗云
