387460,端阳偕监中诸同年游满井次韵荅赠
683186,端阳偕监中诸同年游满井次韵荅赠
597344,癸丑监中送谢宁湾南旋
1208670,正月二十六日监中习仪即景书怀
166113,监中即事·白云自非桃李族
1216853,春日偕监中士友游南城
78883,致斋监中夜与同官纵谈鬼神效宛陵先生体
468297,端阳偕监中诸同年游满井次韵荅赠 其一
1159581,馆娃宫在旧郡西南砚石山前瞰姑苏台傍有采香径梁天监中置佛寺曰灵岩即故宫也信为绝境因赋二章 其一
1217051,监中暮归
554184,监中夜宿
1194066,馆娃宫在旧郡西南砚石山前瞰姑苏台傍有采香径梁天监中置佛寺曰灵岩即故宫也信为绝境因赋二章
979539,春雪监中即事二首 其一
1125123,春雪监中即事二首
1159582,馆娃宫在旧郡西南砚石山前瞰姑苏台傍有采香径梁天监中置佛寺曰灵岩即故宫也信为绝境因赋二章 其二
81937,宿监中偶作
488849,别童守益回监中
979540,春雪监中即事二首 其二
468298,端阳偕监中诸同年游满井次韵荅赠 其二
488832,寄赠袁叔异由监中除湖州西去
1061274,宝志禅师梁天监中将入寂然一烛付后阁舍人吴庆庆以事闻帝叹曰大师不复留矣烛者将以后事嘱我乎颂
160412,监中直舍种竹同冲卿邻几探韵赋得风字
936705,致斋监中夜与同官纵谈鬼神效宛陵先生体
661003,写怀寄监中寮友
125543,监中会两禁诸公饮饯吴舍人梁正言富修撰叶龙
166112,春雪监中即事
892760,监中会两禁诸公饮饯吴舍人梁正言富修撰叶龙图以计省不赴作诗见寄
933870,宿监中偶作
120524,烟雨图·远峰近薄监中浮
1053867,夜入监中
674162,访从兄监中晚回
379776,宝志禅师梁天监中将入寂然一烛付后阁舍人
1026837,监中直舍种竹同冲卿邻几探韵赋得风字
