600517,房村道中会尚书潘公治河赋赠
1076577,客中会友
1051481,雪中会饮李倅钧东轩三绝 其二
653053,次陈景中会友诗韵
994777,春雨中会西山佛迹
672289,昔宋欧阳公雪中会客出令赋诗禁体物语因追和其韵以寄兴云
117836,雪中会饮李倅钧东轩三绝
922567,奉和成伯大雨中会客解嘲
142517,会河道中·会河村店西
145578,客中会友·客涂方浩荡
1001541,永新道中会曾时仲叙旧
1083694,辛巳腊月休日绝江至瓜洲观战地与马德骏冯圆中二郎中会舟回焦山德骏令嗣始来侍行某偶留金山不获与此游辄和三诗以寄怀时驾至镇江 德骏瘗字韵
924966,雪中会饮李倅钧东轩三绝 其一
376374,客中会友·愁中有句可消除
593428,清明日同王银台方奉常集李宛平宅观红梅花赋得春字十韵嘉靖末余与王方二君广陵游咏最久隆庆中会李君于汝南别亦七载今并集京师不佞病且思归篇中故兼述云
958328,腊中会桂堂太守劝客满觞尝曰怕渡野塘寒酒罢且归又曰月挂竹梢明爱此二语借为两诗云 其一
212510,春雨中会西山佛迹
924965,雪中会孙洙舍人饮王氏西堂戏成三绝 其一
1051476,雪中会孙洙舍人饮王氏西堂戏成三绝 其二
148795,永新道中会曾时仲叙旧
102754,奉和成伯大雨中会客解嘲
1051482,雪中会饮李倅钧东轩三绝 其三
1117131,雪中会饮李倅钧东轩三绝
1083695,辛巳腊月休日绝江至瓜洲观战地与马德骏冯圆中二郎中会舟回焦山德骏令嗣始来侍行某偶留金山不获与此游辄和三诗以寄怀时驾至镇江 圆中鹤字韵
961227,文潞公洛中会四同甲皆丙午七十八予乙巳生与丙午相属岁数偶同戏作
492046,雪中会饮分韵得花字
558067,陈佥宪粹之书报弘宜中会试
1121999,腊中会桂堂太守劝客满觞尝曰怕渡野塘寒酒罢且归又曰月挂竹梢明爱此二语借为两诗云
1051477,雪中会孙洙舍人饮王氏西堂戏成三绝 其三
970022,诉衷情令 其一 雨中会饮赏梅，烧烛花杪
672669,驿中会宿别朱亨之用实夫韵
181776,腊中会桂堂太守劝客满觞尝日怕渡野塘寒酒罢
1117128,雪中会孙洙舍人饮王氏西堂戏成三绝
663335,逆旅中会同年杜子廷献因怀其弟廷陈省元凄然增感
16306,和长安郭明府与友人县中会饮
1082131,中秋夜馆中会饮
125543,监中会两禁诸公饮饯吴舍人梁正言富修撰叶龙
1250164,送辜德中会试
117798,雪中会孙洙舍人饮王氏西堂戏成三绝
1218026,郡中会伯玉
1247504,雨中会云松无善宿西山
1249950,吴中会宋行之库使时贡金北土
1221515,送赵执中会试
512868,雨中会子旸李太常仍同赴谢氏席
150426,文潞公洛中会四同甲皆丙午七十八予乙巳生与
1010180,客中会友
892760,监中会两禁诸公饮饯吴舍人梁正言富修撰叶龙图以计省不赴作诗见寄
953053,吴中会故人
1166755,和长安郭明府与友人县中会饮
958329,腊中会桂堂太守劝客满觞尝曰怕渡野塘寒酒罢且归又曰月挂竹梢明爱此二语借为两诗云 其二
221115,吴中会故人
506644,雨中会司训舒同文书楼
