466001,生查子 星之章三首  星行者
461959,蝶恋花 其二 星之子
1159524,洛滨病卧户部李侍郎见惠药物谑以文星之句斐然仰谢
57528,驾幸朝天宫祭星之作
872273,轻柔杨柳挟春妍孤梗梅花结雪缘此是乾坤大消息相逢切莫说流年此予三十年前赠先见赵太史二绝之一予亦不复记忆矣后三十五年太史访予山中恨诗不存惟为予诵此而亦忘其一竟莫省为何等语也既徵补之且告予以五星之将聚因作二首奉笑 其二
15349,洛滨病卧户部李侍郎见惠药物谑以文星之句斐然仰谢
481441,驾幸朝天宫祭星之作
1155428,看梦得题荅李侍郎诗诗中有文星之句因戏和之
948503,二月二十六日携家游青原归入阳园酴醾盛开诵子中兄摛云摇碧露繁星之句赋此诗
522413,秀州塘过庆云桥南派为小溪山人李公玉家其上公玉善谈星数星之著者为斗人呼其地为斗溪君遂因以自号
19443,看梦得题答李侍郎诗诗中有文星之句因戏和之
461956,生查子 星之章三首  其二 星陨
461958,蝶恋花 其一 星之子
466002,蝶恋花 星之子
779967,喝马一枝花 送沈茶星之来宾任
461957,生查子 星之章三首  其三 星灭
1107993,轻柔杨柳挟春妍孤梗梅花结雪缘此是乾坤大消息相逢切莫说流年此予三十年前赠先见赵太史二绝之一予亦不复记忆矣后三十五年太史访予山中恨诗不存惟为予诵此而亦忘其一竟莫省为何等语也既徵补之且告予以五星之将聚因作二首奉笑
490300,丰厓社饮席上闻前星之喜分韵得国字
1088358,暇日侍法曹叔父陪诸名胜为落星之游分韵得往字率尔赋呈聊发一笑
45423,星之葬
872274,轻柔杨柳挟春妍孤梗梅花结雪缘此是乾坤大消息相逢切莫说流年此予三十年前赠先见赵太史二绝之一予亦不复记忆矣后三十五年太史访予山中恨诗不存惟为予诵此而亦忘其一竟莫省为何等语也既徵补之且告予以五星之将聚因作二首奉笑 其一
332063,喝马一枝花·送沈茶星之来宾任
461955,生查子 星之章三首  其一 星行者
