1088483,次黄叔张宿凉峰韵
675006,过武夷次罗一峰韵
237649,和全父弟巫山峰韵
1250399,次回峰韵
555399,和惠安张大尹登最高峰韵二首 其一
704982,用铁峰韵赠明谷方子北归
680709,和罗一峰赠饶雯峰韵
1101763,古兴和饶云峰韵 其二
317832,元夜和莱峰韵
317797,四月八日游闵忠寺和张莱峰韵
221280,古兴和饶云峰韵
283098,叠峰韵呈群公博笑以示忏悔
886731,和闽人龚玉峰韵 其一
327339,次林择之凉峰韵
1082067,次盛元叙游九峰韵
201174,次折枢留题雪峰韵
1088479,次林择之凉峰韵
563853,火秀宫次一峰韵三首 其三
160683,和王右司回雁峰韵
1230670,题大龙湫和李五峰韵
599312,乘月访觉山先生于西溪次夕复侍教次铁峰韵
586887,九日二首次九峰韵 其二
596179,廓然楼和次峰韵
563851,火秀宫次一峰韵三首 其一
654350,龙城次玉峰韵
265888,水仙谢后作用松峰韵
59027,龙城次玉峰韵
521847,寿定庵八十三用十峰韵
780927,四月八日游闵忠寺和张莱峰韵
1205890,陪赵公子游蒋山即席次李五峰韵
840860,登抚州拟岘台和李秀峰韵
780933,元夜和莱峰韵
701322,和惠安张大尹登最高峰韵二首
895361,次折枢留题雪峰韵
596185,廓然楼和次峰韵
326835,次黄叔张宿凉峰韵
693120,和张碧溪登宝峰韵二首
325893,次盛元叙游九峰韵
226896,和闽人龚玉峰韵
599314,用铁峰韵赠明谷方子北归 其二
518959,奉和石翁游圭峰韵拜呈陶宪长
693763,雪后次西峰韵二首
864893,和叶碧峰韵
589474,登马退山望邕州次静峰韵
227072,玉峰韵·病鹤衰翎叹折伤
659633,又次邵端峰韵
1111500,和闽人龚玉峰韵
590527,次邑博洪螺峰韵
236908,和叶碧峰韵
406964,水仙谢后作，用松峰韵
75562,陪赵公子游蒋山即席次李五峰韵
590680,次长沙府庠友吉桂峰韵
568597,雪后次西峰韵二首 其一
749601,夜坐感秋和一峰韵
880988,古兴和饶云峰韵 其一
659517,雪壶次郡大夫三峰韵
782911,前题步天峰韵
861619,和王右司回雁峰韵
1109786,古兴和饶云峰韵
1210461,次松瀑黄尊师寓筹峰韵
886166,和全父弟巫山峰韵
886841,和闽人龚玉峰韵 其二
589475,入邕州次静峰韵
588735,除夕次大宗伯阳峰韵
555627,圜士送别次巽峰韵
698056,九日二首次九峰韵
512505,和张碧溪登宝峰韵二首 其一
563852,火秀宫次一峰韵三首 其二
586886,九日二首次九峰韵 其一
413920,总结一首叠峰韵呈群公博笑以示忏悔
568598,雪后次西峰韵二首 其二
599313,用铁峰韵赠明谷方子北归 其一
555400,和惠安张大尹登最高峰韵二首 其二
512506,和张碧溪登宝峰韵二首 其二
684308,火秀宫次一峰韵三首
1249490,简于匡山次李五峰韵
