191909,送郑主簿泰兴解官归四明
949701,甲申岁解官归故居有以书相问者
164983,虚舟·西南使者解官归
1029940,送鲍判官解官归浙西
694496,赠刘别驾肃庵解官归永丰
551413,赵仁甫别驾解官归自夔府招同陈履吉陈平夫陈振狂集侣云堂
477568,解官归汴初度日作
510509,赠刘别驾肃庵解官归永丰 其二
908421,送孙远仲知录解官归洪雅
198767,送鲍判官解官归浙西
490999,解官归过旧宅漫述
1091528,送刘元畸解官归宣城兼问讯侍郎陈丈
593529,送吴宗高解官归毗陵
153247,送汉阳刑狱掾邹永年解官归养
510510,赠刘别驾肃庵解官归永丰 其三
1030087,送程正翁解官归徽州
603057,介休四尹达成解官归养过访留饮赋赠一首
57675,解官归汴初度日作
649074,黄友文教授解官归建宁
946149,送郑主簿泰兴解官归四明
610673,赠樊山明府以父病解官归黄州
966806,送汉阳刑狱掾邹永年解官归养
960048,送金簿解官归天台五首 其三
243314,甲申岁解官归故居有以书相问者
510330,赠化州守郑顺解官归
1122182,送金簿解官归天台五首
585457,赠贺少参泰解官归吴
596695,闻锡泉舅氏欲解官归先此奉迓
1217763,送孔鲁茂录事解官归永嘉
1214344,次韵令尹解官归九江
510508,赠刘别驾肃庵解官归永丰 其一
960046,送金簿解官归天台五首 其五
628660,送某护军解官归罗浮奉母塞上送友人归养
825003,送荆宜施道俞君实解官归养
960047,送金簿解官归天台五首 其四
625809,送韩参军解官归越
180431,送孙远仲知录解官归洪雅
541881,汾州以来分守参政如胡世甫葛与立马子懋程信夫彭克宪陈元卿李子高宋伯镇孙格卿张时芳纪恒甫诸公皆旧识也宋有禦敌之功不见知当道解官归越嗟哉
830717,送南康王使君解官归里
748714,沈辰州前辈解官归会稽予属稚蘅写归去来辞意送之并题一诗以坚其志
615843,王总戎镇粤与予未晤比解官归以书见存赋此送之
595977,解官归至洪都逢殷武北上
960049,送金簿解官归天台五首 其二
198395,送程正翁解官归徽州
960045,送金簿解官归天台五首 其一
603229,送临沅兵备施健所解官归粤西
189449,送金簿解官归天台
