697227,舟次清河逢王世叔通侯先是惟寅以尺素贻世叔至是遇于途中二律奉赠
625185,喜更生三叔至皖道从西粤湖南居半月促之入蜀投伯潜叔江津令 其一
545483,舟次清河逢王世叔通侯先是惟寅以尺素贻世叔至是遇于途中二律奉赠 其二
546696,忆与永叔丙戌上春官永叔至安平镇登陆今屈指十载乃余附永叔舟再过兹地追忆曩时王生据鞍上马状恍惚在目相与拊掌大笑即席漫成
625186,喜更生三叔至皖道从西粤湖南居半月促之入蜀投伯潜叔江津令 其二
701019,喜更生三叔至皖道从西粤湖南居半月促之入蜀投伯潜叔江津令
245249,俞伯初见访示吴髓诗既去而江和叔至甚恨相后
1064192,与晦叔至奉新
920159,夷陵县欧阳永叔至喜堂
627075,家敬叔至值雨
1224095,题青田叶叔至野清堂
1008278,念奴娇 其一 中秋呈徐叔至
340217,满江红·和徐叔至御带
918302,俞伯初见访示吴体诗既去而江和叔至甚恨相后先也是夕用韵寄二君子
677965,过龙门滩同元帅叔至应天府
960153,满江红 其三 和徐叔至御带
545482,舟次清河逢王世叔通侯先是惟寅以尺素贻世叔至是遇于途中二律奉赠 其一
378345,与晦叔至奉新
15796,送谏议十六叔至孝义渡后奉寄
1178211,送谏议十六叔至孝义渡后奉寄
