103502,陈经秘校之信州幕
498901,门士俞应和出守处州道由滁阳留之信宿志喜 其二
641261,书宗兄怀之信后
692283,题郭之信梅
625652,闻袁于人同居之信
781531,得方密之信见寄
273579,摸鱼儿·闻桂林柳州相继失陷之信
649312,题郭之信梅 其一
808392,赵大至得孙大入关之信兼闻蒋表弟良卿欲入都城东酒徒无一人居里者感赋此首近简黄二杨三徐大
338202,得秋闱下第之信倚前均寄洛翘
58129,送归开甫之信都
233182,旧闻台城辱井石上有胭脂泪痕久未之信今见之
787562,得秋闱下第之信倚前均寄洛翘
778115,金缕曲·得筱石由川督调鄂之信，因喜生感，又忆及女
1008019,送刘治中之信州
789207,念奴娇 其二 皋谟叔时方侨寓吴门，发春有乘龙之信，故次首及之
362615,喜郑诚斋先生归新安之信
1233568,送陈推官之信州
571423,送刘子廷信之信阳
821212,摸鱼儿 闻桂林柳州相继失陷之信
1130303,余还自海外至崇仁见思禹以四诗先焉既别又有太原之行已而幸归石门复次前韵寄之以致山中之信云
649313,题郭之信梅 其二
771533,泊青浦得伯兄馆奉贤之信
103704,董安员外之信州铅山簿
1063957,余还自海外至崇仁见思禹以四诗先焉既别又有太原之行已而幸归石门复次前韵寄之以致山中之信云 其一
538250,送潘青州之信阳兵备
789206,念奴娇 其一 皋谟叔时方侨寓吴门，发春有乘龙之信，故次首及之
1063958,余还自海外至崇仁见思禹以四诗先焉既别又有太原之行已而幸归石门复次前韵寄之以致山中之信云 其二
739646,柳泉道中得漫士侍郎留徐州待余之信喜赋长句
811113,念奴娇 皋谟叔时方侨寓吴门，发春有乘龙之信，故次首及之
728278,闻有长流之信拟出塞曲
957161,晓发飞鸟晨霞满天少顷大雨吴谚云朝霞不出门暮霞行千里验之信然戏纪其事
701407,门士俞应和出守处州道由滁阳留之信宿志喜
992269,陈经秘校之信州幕
446311,科幻大片观后得句题曰破译自X星系探索队北纬39o东经116o之信号纪录
474275,送归开甫之信都（有引。开甫即震川先生熙甫也）
338375,泊青浦得伯兄馆奉贤之信
338815,金缕曲·得筱石由川督调鄂之信，因喜生感，又忆及女
901326,旧闻台城辱井石上有胭脂泪痕久未之信今见之似是淋漓涂抹之迹失笑不已因成此句
1063959,余还自海外至崇仁见思禹以四诗先焉既别又有太原之行已而幸归石门复次前韵寄之以致山中之信云 其三
786488,岁暮不憀，忽得李二垂危之信
754080,近得沅儿出抚秦中之信因作诗以箴之
498900,门士俞应和出守处州道由滁阳留之信宿志喜 其一
798026,满江红  闻阮亭罢官之信并寄西樵再叠前韵
908356,过大信口忆西归录载大江渺渺忽二石山如伏猊引出水面东西对峙江形若瓢然而山乃其口然相距犹三四里则江之广狭可见视之信然妙哉写物之功感而赋此篇
977368,韩退之蓝田丞厅记所谓雁鹜者相承以为吏每切不然往往人未之信偶读吴子宽诗有雁鹜庭空之语因作此云
1200489,送陈行之之信州推官
204967,送刘治中之信州
993301,董安员外之信州铅山簿
1063960,余还自海外至崇仁见思禹以四诗先焉既别又有太原之行已而幸归石门复次前韵寄之以致山中之信云 其四
239772,送陈行之之信州推官
