1193463,余以咸亨元年在西京寻听于时与并部处一法师莱州弘祎论师更有三二诸德同契鹫岭标心觉树然而一公属母亲之年老遂怀恋于并州祎师遇玄瞻于江宁乃叙情于安养玄逵既到广府复阻先期唯与晋州小僧善行同去神州故友索尔分飞印度新知冥焉未会此时踯躅难以为怀戏拟四愁聊题两绝
706129,恺六种凤仙花盈亩聊题长句
1173255,陪李七司马皂江上观造竹桥即日成往来之人免冬寒入水聊题短作简李公二首 其一
1173256,陪李七司马皂江上观造竹桥即日成往来之人免冬寒入水聊题短作简李公二首 其二
1147697,余以咸亨元年在西京寻听于时与并部处一法师莱州弘祎论师更有三二诸德同契鹫岭标心觉树然而一公属母亲之年老遂怀恋于并州祎师遇玄瞻于江宁乃叙情于安养玄逵既到广府复阻先期唯与晋州小僧善行同去神州故友索尔分飞印度新知冥焉未会此时踯躅难以为怀戏拟四愁聊题两绝 其一
1194640,陪李七司马皂江上观造竹桥即日成往来之人免冬寒入水聊题短作简李公二首 其二
1155830,予与山南王仆射起淮南李仆射绅事历五朝踰三纪海内年辈今唯三人荣路虽殊交情不替聊题长句寄举之公垂二相公
1147699,道希法师求法西域终于庵摩罗跋国后因巡礼希公住房伤其不幸聊题一绝
8419,行次盐亭县聊题四韵奉简严遂州蓬州两使君咨议诸昆季
1147698,余以咸亨元年在西京寻听于时与并部处一法师莱州弘祎论师更有三二诸德同契鹫岭标心觉树然而一公属母亲之年老遂怀恋于并州祎师遇玄瞻于江宁乃叙情于安养玄逵既到广府复阻先期唯与晋州小僧善行同去神州故友索尔分飞印度新知冥焉未会此时踯躅难以为怀戏拟四愁聊题两绝 其二
