559037,癸卯八月八余自广济桥放舟登凤凰台共水扑天有龙见于枫洋白水之间若向台而来少选乃挟云飞去余喜甚命僧买酒并酌逮暮始截河而归即日漫赋纪事其得开字次日为省试初场诗中及之为吾潮兆喜 其二
1244330,贻刘伯敏（去年余尝为恶诗贴壁间一日尽失既而从弟铎过伯敏乃知为伯敏取去相与一笑宁知其非燕石欤故诗中及之）
695631,癸卯八月八余自广济桥放舟登凤凰台共水扑天有龙见于枫洋白水之间若向台而来少选乃挟云飞去余喜甚命僧买酒并酌逮暮始截河而归即日漫赋纪事其得开字次日为省试初场诗中及之为吾潮兆喜
559036,癸卯八月八余自广济桥放舟登凤凰台共水扑天有龙见于枫洋白水之间若向台而来少选乃挟云飞去余喜甚命僧买酒并酌逮暮始截河而归即日漫赋纪事其得开字次日为省试初场诗中及之为吾潮兆喜 其一
622187,紫涛频以牙痛告归若有所期诗中及之
985459,送汝端兄南还兄自诧有仙授异丹故篇中及之
98774,席上奉呈教授欧阳丈时并饯戴兄故其中及之
558983,观察任公祖五月举孙官邸召赴汤饼漫贼四章志喜兼谢时海上有警次日闻大捷诗中及之 其一
807917,贺新郎  诸城李渭清赠我以龙须数茎，同曹舍人实庵、陆编修义山、沈大令融谷赋。余箧中旧有虎须，故篇中及之
559075,送麻将军南柱之松潘元戎将军在潮曾擒斩倭将濒行又忽闻制台念将军母老为改粤西尚在需命诗中及之
695596,观察任公祖五月举孙官邸召赴汤饼漫贼四章志喜兼谢时海上有警次日闻大捷诗中及之
271022,满江红·刀俎馀生欲断荤者数矣奈茹素辄饥故篇中及之
974264,席上奉呈教授欧阳丈时并饯戴兄故其中及之
547825,寄吴少溪宫录七十 其二十一 春暮与陈东甫饮白庄柳树下怀傅伯俊侍御时有驿使投书语中及之
383721,春暮与陈东甫饮白庄柳树下怀傅伯俊侍御时有驿使投书语中及之
573325,送吴体中归皖城，体中与余有净土之约，故诗中及之
559392,黄元宇起粤西右辖为寄一律以襄敏公劝驾是年举英儿诗中及之
826918,长亭怨慢·沈雪渔同年年八十有六，其子霄鹏迎养杭州，起居甚健。余方与约秋中当诣访，乃于中夏无疾遽逝，令弟逋梅来告，赋此写哀。君前官余姚训导最久，而葬木渎，故篇中及之
558985,观察任公祖五月举孙官邸召赴汤饼漫贼四章志喜兼谢时海上有警次日闻大捷诗中及之 其三
1077904,再次韵崧老见和之作时传春秋集传又欲借易说故篇中及之
558986,观察任公祖五月举孙官邸召赴汤饼漫贼四章志喜兼谢时海上有警次日闻大捷诗中及之 其四
558984,观察任公祖五月举孙官邸召赴汤饼漫贼四章志喜兼谢时海上有警次日闻大捷诗中及之 其二
778490,满江红 其五 刀俎馀生欲断荤者数矣奈茹素辄饥故篇中及之
