634011,彭退庵明府汪汉翀水部招同杨司李莲峰黄都阃君甫李副戎禹门张茂才雏隐王孝廉震生及澹归探梅篁村
670709,重送张阃使
209524,和大阃芍药讌韵
620318,送海都阃擢浙江参戎
712500,寄答马卧仙都阃
542551,夜同刘都阃诸君登蓟州城楼
519635,挽国戚廖廷玺都阃 其一
682913,送阃赞善赴南大司成二首
525245,寄题张希孟都阃隐居四首 其二 水心别业
749517,为托见亭都阃题赵子昂画马
340020,题河中府名阃堂
241847,挽诗·閫范三从正
342871,李光弼·阃外分忧屡积勋
623858,冬夜黄伯度蒋文正两都阃偕顾别驾述夫过半竹亭小饮
720108,送萧都阃之云中
1139291,大阃拨醅于园亭坐上文武各半恰西师捷至用同官韵
512271,澹乐轩为孙都阃题
685064,赵家津口阻风逢陈都阃巡湖二首
269476,旧剑·补缀原关中阃事
653329,为张都阃宗大题画四首 其一
660952,送李都阃赴江西
209468,立春久渴雨大阃正月八日祷遄应
596240,赠曾源泉布衣擢两浙都阃和万史部两溪
521741,陈都阃汝玉以思亲册求题久未有以复也二月君提兵过江赋此为别伫闻捷音把笔以俟 其二
1206780,八声甘州 饯帅阃张仲渊外郎先福建帅府出海捕寇服功
88315,即事十绝·移阃于重庆
527264,赠陈都阃汝玉
529053,次韵送李都阃
587676,赵家津口阻风逢陈都阃巡湖二首 其二
701174,横州闻孙都阃震与宋长官下棋舟待水手不至戏柬二首
663598,赠李都阃
909220,荆阃宴交代贾尚书乐语口号
476494,春日周都阃招饮其宅盖亡友梁国吏第怆然兴感
633701,送罗学制守阃
573700,何承渠副将军招同张午垣徐都阃饮首山时桃花一枝开汤泉重搆祖帅治海舟待渡 其一
1044490,谢张解州作名阃堂记
909535,水调歌头 其三 丙戌寿蜀阃
286266,出师·赤羽飞军阃
164365,代饯蜀阃赴召乐语口号
614903,徐爱伯都阃斋捧还贵竹
519631,挽国戚廖都阃之父 其一
599695,都昌晓晴晚别张都阃
493154,赠万讱归清江定侯帅阃
634097,萧柔以参戎力辞专阃告入曰可遂得挂冠道归仙羊过叙适值览揆赋赠
909222,荆阃偶成
660383,酬白都阃携酒过访用前韵
599714,陪侯戎院何方伯张都阃东巡避暑铅山观音洞 其三
691993,明溪篇二首赠周都阃
674160,中秋将台玩月是日卢都阃为会
909534,水调歌头 其九 庚子寿制阃别尚书
670513,明溪篇二首赠周都阃 其二
510547,某昔过淮见平江总戎礼遇甚至都阃王侯厥配陈氏于平江总戎戚也一日过予白沙相与道旧平江今为天下兵马元帅相去万里无由幸会虽隐显殊途然于公之旧德未尝一日忘也因事赋诗托侯为达之诗曰
1000310,四贤古风寿帅阃 赤松子
593120,宋都阃邀游天竺寺
491221,送孙民瞻之广西帅阃照磨
559023,送安都阃使竣回闽
537909,送阃帅狄君入贺万寿
362257,名阃堂·有美东吴胜事繁
551168,赠邓道鸣都阃
587674,赵家津口阻风逢陈都阃巡湖二首 其一
1000309,四贤古风寿帅阃 老聃子
512077,沧浪深隐卷为贵阳林都阃题
703350,寿金国瑞都阃
682601,少野陈都阃留宴公署
511873,春晖图为滇云万都阃题
634168,送王行素擢任山东阃司
514159,阎文振方伯王景端都阃诸公邀饯灵隐寺 其二
164165,庚戌赴荆阃舟过湘江
565886,宴万都阃宅二首 其一
514160,阎文振方伯王景端都阃诸公邀饯灵隐寺 其三
589216,少野陈都阃留宴公署 其二
583835,题李都阃履历七首 其一 威宁堡
565887,宴万都阃宅二首 其二
171277,送监丞弟元亨参江陵阃
566105,逢张宪副忆万都阃一首
909655,满江红 其三 甲申寿蜀阃
107610,平章吕公挽词·难兄捐阃寄
534936,赠都阃督漕北征
545951,新春鲁总戎招同李都阃夜集署中座上得笳字作
497259,吴杭州招同黎阃帅集城西公署
525247,寄题张希孟都阃隐居四首 其四 逍遥亭
516049,东归至清平陈宪副王都阃相与遣使迎劳用祁石阡韵奉谢
493150,赠万讱归清江定侯帅阃
535834,海上夜征次解都阃
219953,挽诗·阃室良规范
680554,王都阃扇面 其一
193651,送郡守·郎围师阃重王人
493883,赠张都阃征安南
559004,送安都阃员石自闽归里入贺万寿
690079,为张都阃宗大题画四首
519394,子贡访原宪画为康文渊都阃题
1111067,乙亥岁八月十五日夜同景叔知府少卿翼道提举大夫望月于河中之名阃堂兼简襄守欧三叔弼虢守孙八元忠二首
605017,茅参戎孺嘉都阃泸川 其一
941681,赠丝桐墨蕙吕能甫淮东制阃之客
519632,挽国戚廖都阃之父 其二
563160,廷评潘同江尊阃顾夫人六十余既为长歌祝觞内子复请此图寿之并题一绝
1231473,独秀峰即事呈都阃诸公
164737,荆阃宴交代贾尚书乐语口号
1139499,阃下忽动归兴
516033,贺守备夏都阃府第成
241445,道中述怀·分阃南来两见秋
664077,送阃帅马东溪武举
566389,同屠比部张仪部集万都阃公署四首 其三
1249998,送乡人钱明之赴闽阃掾
568481,刘都阃以红花本见贻
653330,为张都阃宗大题画四首 其二
908991,重庆阃治十咏 其五 生意堂
501982,送钱掾之浙阃
604886,寄怀焦弱侯太史时弱侯以空名参军粤阃者十年矣怀贤徇知情见乎词
504962,赠都阃掾张彦刚
605018,茅参戎孺嘉都阃泸川 其二
207459,赠丝桐墨蕙吕能甫淮东制阃之客
1030826,淳熙戊戌将命广东侍亲携孥十一月至安仁留云锦驿一宿而去时晋卿侄偕行后二十三年分阃桂林晋卿主馀干簿复以是月来会于此把盏道旧为之怆然因成一诗示晋卿
667820,送张都阃致仕归二首 其二
513108,吴都阃幛
514158,阎文振方伯王景端都阃诸公邀饯灵隐寺 其一
586377,同武都阃游圭峰
164736,荆阃偶成·一出峤南道
673469,高尚为徐松峰都阃题
583836,题李都阃履历七首 其二 野狐庄
494776,为霍武学请送刘都阃
512151,云山图二首为都阃王大经题 其一
690549,茅参戎孺嘉都阃泸川
1139322,立春久渴雨大阃正月八日祷遄应
583839,题李都阃履历七首 其五 大帽山
909202,庚戌赴荆阃舟过湘江
594061,送江都阃入贺还滇中
583486,送义官都阃徐元楷
531239,赠郭云屏阃帅
675852,贺致政都阃陈彦章
535033,送吴都阃赴浙镇
701611,宴万都阃宅二首
576703,杨妃菊为朱阃帅题
599715,陪侯戎院何方伯张都阃东巡避暑铅山观音洞 其四
1000308,四贤古风寿帅阃 广成子
602130,海珠送董都阃
521172,送徐都阃归宜兴
579694,题吴都阃梅花卷
57672,送王都阃之广西
908993,重庆阃治十咏 其一 华明堂
660455,寄陈汝玉都阃
45709,壬子感事四章·上将雍容阃外尊
54110,送何都阃济南省亲至京还广
66602,春日周都阃招饮其宅盖亡友
519440,闻余士英都宪征西得捷时予国戚廖廷玺都阃在麾下得功尤多
653331,为张都阃宗大题画四首 其三
908997,重庆阃治十咏 其九 横舟
670512,明溪篇二首赠周都阃 其一
680555,王都阃扇面 其二
284463,无题·长沙专阃旧扬威
1215911,送都元帅述律杰云南开阃
161250,水调歌头·四载分蜀阃
566387,同屠比部张仪部集万都阃公署四首 其一
538692,赠邵都阃
599713,陪侯戎院何方伯张都阃东巡避暑铅山观音洞 其二
908995,重庆阃治十咏 其二 尊安堂
688140,挽国戚廖都阃之父
171266,送朱南山开蜀阃
1044487,题河中府名阃堂
514280,成化癸夘冬至谒陵与李宾之学士联句二十首 其八 早发暂过守备杜都阃
493152,赠万讱归清江定侯帅阃
513012,送吴朝阳都阃之任浙司
477565,送王都阃之广西
583939,追挽张都阃
543748,送艾都阃督饷淮上
1241282,送于子实辟淮阃掾
531258,潘东溪都阃惠暖床
909066,代饯蜀阃赴召乐语口号
909069,代襄阃宴新除史制卿乐语口号
627243,赠家都阃铭新演实昆弟
909221,荆阃宴吕马帅乐语口号
512152,云山图二首为都阃王大经题 其二
482522,送何都阃济南省亲至京还广
605125,阮玑衡以武科特起都阃东粤入贺赋赠
519793,题忠孝节义传为都阃王徽作
476274,官军谣（段都阃所将省兵四百，无一人援白沙者）
702636,云山图二首为都阃王大经题
47393,次韵和石末公闻海上使命之作因念西州怆然有·大阃寻常弃郑师
684427,送张都阃致仕归二首
519580,听康都阃弹琴
544136,挽马都阃二首 其二
908996,重庆阃治十咏 其四 集思堂
981575,塞下行赠韦士颖归鄂渚上江陵谒阃相
497595,越中阃帅席上
1004015,去岁重阳日得彦威信附六月间二小侄及从弟侄所寄书自蜀阃递中附至历言去冬今春所遭兵祸及有司督迫科调之苦喜其存全哀其窘蹙洒涕如霰寄讯邀其下峡而边事又告急未知其达与否也会杪冬见邸报宣谕使者余公侍郎改命授钺尽护蜀师意欲以此事归控骨肉会聚兹事其谐矣喜极涕零遂成长篇
653806,白都阃携牲酒相访夜酌有作
564850,张文光都阃邀游西湖
849799,阃相可翁先生偕王人有湖山游获侍坐先生有诗辄用韵
164111,寿襄阃·江南三月春事浓
640557,送金中孚赴藩阃辟
518703,梧州送郑都阃往靖海关
701657,同屠比部张仪部集万都阃公署四首
534861,出法象道林赴周都阃宴集
908989,重庆阃治十咏 其三 一廉堂
583840,题李都阃履历七首 其六 姚源洞
670636,送张阃使黔中
908992,重庆阃治十咏 其六 龙虎屏
538727,赠邵都阃迁惠潮参将
517634,赠阃帅张镒
499019,送张都阃
1057199,和希鲁四兄奉议陪蒲守景叔学士宴名阃堂书事
959161,绍定闽寇平上功省府黄伯厚与焉余时在政事堂赵用甫掾西曹力言此文墨士请官以左选既而赏戾法迄授武阶去岁戊戌用甫帅鄞乃来为阃属余浪迹湖山岁馀始一见稍稔接觞咏亹亹迫人间及前事有见晚恨余与之酒曰一文资直慁子然以人废法虽相知如今日亦弗敢则笑而不怨赴调行在所赠以君莫愁之歌
573701,何承渠副将军招同张午垣徐都阃饮首山时桃花一枝开汤泉重搆祖帅治海舟待渡 其二
594949,十四夜同邓都阃集费左使省中楼
530274,赠申将军制阃蓟门
534837,题崔阃帅竹泉卷
528301,答张道夫都阃病怀
658278,演武亭为衡阳王都阃
519636,挽国戚廖廷玺都阃 其二
576013,送牛应祥都阃
521740,陈都阃汝玉以思亲册求题久未有以复也二月君提兵过江赋此为别伫闻捷音把笔以俟 其一
583371,中秋同石太仆允升陈省参宗之陈宪佥裕夫赵都阃德州舟中玩月次许郢州韵
981560,送监丞弟元亨参江陵阃
1217012,送欧阳逊老从谦之湖阃照磨
514260,青县遇漕运王瑾都阃自云宣城人甚有桑梓之念
493153,赠万讱归清江定侯帅阃
1208278,正月十六夜，双门观灯，时闽、粤阃官吏皆集
534993,送阃赞善赴南大司成二首 其一
494708,赠高都阃君阳还楚
667819,送张都阃致仕归二首 其一
201875,皇后阁·正道仪中阃
525244,寄题张希孟都阃隐居四首 其一 石门精舍
519468,挽李都阃
501806,赠王同野阃史归建三十韵
587234,白鹰为沈都阃题
332560,送萧都阃之云中
171281,塞下行赠韦士颍归鄂渚上江陵谒阃相
981559,送朱南山开蜀阃
599712,陪侯戎院何方伯张都阃东巡避暑铅山观音洞 其一
493151,赠万讱归清江定侯帅阃
1057064,乙亥岁八月十五日夜同景叔知府少卿翼道提举大夫望月于河中之名阃堂兼简襄守欧三叔弼虢守孙八元忠二首 其一
566388,同屠比部张仪部集万都阃公署四首 其二
908990,重庆阃治十咏 其十 六角亭
607911,代冯海石上黄都阃兼柬谢假馆之意
72739,次韵虞隐君堪潘阃掾谷雨中见寄
518580,李都阃同登蓬莱阁观海
520320,致政康都阃别业去咸阳仅十里其居枕沣水甚有幽致都阃谒予于道左请留予为之一饭因贻以诗
520320,致政康都阃别业去咸阳仅十里其居枕沣水甚有幽致都阃谒予于道左请留予为之一饭因贻以诗
571602,横州闻孙都阃震与宋长官下棋舟待水手不至戏柬二首 其一
347456,和希鲁四兄奉议陪蒲守景叔学士宴名阃堂书事
605037,刘廷翰将军自碣石移阃郡屯走币索诗赋赠
1162212,题郡南山光福寺寺即严黄门所置时自给事中京兆少尹出守年三十性乐山水故老云每旬数至后分阃川州门有去思碑即郤拾遗之词也
909453,重庆阃治十咏 其七 友石
908994,重庆阃治十咏 其八 吟啸
693895,何承渠副将军招同张午垣徐都阃饮首山时桃花一枝开汤泉重搆祖帅治海舟待渡
634298,寿金国瑞都阃 其二
583838,题李都阃履历七首 其四 沙县
633868,阳山守阃拨夫相送念无德以当纵之自去
532384,送陈把总升都阃
987979,嘉定甲戌正月以金部郎分阃东淮正当金虏弃巢南奔之时人不愿往以君命不敢辞首尾五年而不得代戊寅腊月以少蓬召而病且衰矣自知不堪世用决意南归舟次豫章三疏丐闲而不得请幡然东下舣棹南康重湖阁夜梦人告之曰死于庐山之下觉而识其事并以小诗谢山神
310636,诸将·元戎专阃夜郎遥
590288,寄陈雪厓都阃
909687,糖多令/唐多令 庚戌六月赴荆阃，宿江亭
677634,中秋夜邬使君邀登广视堂后山玩月同舒少参管都阃
511295,别苍梧席间呈谢大参段都阃
164734,荆阃宴吕马帅乐语口号
175433,寿帅阃·盛德元勋绝等伦
551306,七夕邓汝高民部招集玉皇阁同佘宗汉谢脩之明府邓道鸣阃帅钱叔达王粹夫山人陈汝大康元龙袁无竞秀才陈幼孺孝廉兴公舍弟赋分得五歌
237602,夔门桂帅·阃歌整暇化清夷
583841,题李都阃履历七首 其七 武举
700277,陈都阃汝玉以思亲册求题久未有以复也二月君提兵过江赋此为别伫闻捷音把笔以俟
581452,贺张都阃乔迁用张东所韵
610094,赠长白黄都阃
551307,邓道鸣阃帅招集邻霄台送邓汝高计部还朝
945790,水龙吟 其一 寿江阃姚橘洲学士希得
654841,送刘都阃景昌西征
697050,挽马都阃二首
581980,又代徐都阃作
637457,柬杨都阃
566390,同屠比部张仪部集万都阃公署四首 其四
515902,题陆都阃平泸寇诗
528180,同崔太史张侍御饮周都阃亭子
846480,贺新郎 为东阃赵先生寿
654838,挽杨茂都阃
138537,和龚漕·我老强来分外阃
909435,寿襄阃
54985,陈都阃宅看烟火
544751,艾都阃见过不值
497257,徐阃帅邀游南屏诸山
71229,塞上曲·将令传中阃
701805,题李都阃履历七首 威宁堡
704917,陪侯戎院何方伯张都阃东巡避暑铅山观音洞
616178,赠朱瞻御都阃
583837,题李都阃履历七首 其三 马耳山
508560,十六日与学士钱公亚卿章公会饮于崔都阃宅赋此以谢
475638,陈都阃宅看烟火
375888,送赵司理·未报金陵大阃书
517699,南海刘阃帅席间有成
61110,立春日纪山西石二使君陈程二阃帅邀游吹台同
700511,寄题张希孟都阃隐居四首 石门精舍
207775,送雷赴漕召·几年分阃作遨头
538354,送吴韬之浙阃
509426,弓都阃招宗阳宫会饮和钱学士韵
590672,次程雪生都阃韵似之
634424,寿郑国章守阃
531302,送萧凌汉都阃谢病归蜀
206938,德久潘公·风骚閫域自难亲
571020,赠门都阃
1000311,四贤古风寿帅阃 和安老人
688142,挽国戚廖廷玺都阃
668025,周都阃归长沙寄赠一首
596085,送东崖李都阃入觐还楚
1139351,和大阃芍药宴韵
538958,寿户侯蒋子宜时以才分阃
610103,寿蒋谏庭都阃
533455,送杨都阃奉万寿表入京
609969,月夜饮蒋谏庭都阃幕中
264898,卷耳解·闺阃诚难与国防
551140,秋夜同颜廷愉黎廷彬二将军王元直秀才观微上人兴公舍弟集邓道鸣阃帅行署赋得紫薇夜漏同用花字
1240362,次韵虞隐君堪潘阃掾谷雨中见寄
654896,赠李都阃士章
544135,挽马都阃二首 其一
71254,送于子实辟淮阃掾
587754,石葵歌赠乔都阃
353144,秋日郊居·学阃难优入
631372,虔州郡丞董昭时南康郡丞周赞皇都阃徐质美见访因病掩关不得出迓走笔以谢
613013,赠蒋都阃
514805,送房骥都阃赴福建
634487,寿石都阃勋汝
885954,舣舟大藤峡口武陵使至忽奉福唐珍牍附以古风招隐揽之欣耸有会初心而分阃之命下已久矣咏叹不已复次旧韵用寄惓惓冀一观省
634297,寿金国瑞都阃 其一
537775,谢邵都阃惠荔枝
851558,京湖宣阃第九
1081552,蒲中杂咏 名阃堂
617415,恭陪王侍御老师偕洪徐二公祖方都阃奉祭太师我翁因步遹求堂用求字韵分赋
534745,戏作月川歌酒中调武冈守备周阃使
1057065,乙亥岁八月十五日夜同景叔知府少卿翼道提举大夫望月于河中之名阃堂兼简襄守欧三叔弼虢守孙八元忠二首 其二
680910,寄谢浙江陈都阃
511906,双马图为万都阃子和题
702364,阎文振方伯王景端都阃诸公邀饯灵隐寺
685159,王都阃扇面
512068,赠万都阃子和
339771,谢张解州作名阃堂记
653332,为张都阃宗大题画四首 其四
589215,少野陈都阃留宴公署 其一
645412,立春日山西纪石二使君陈程二阃帅邀游吹台同张职方赋
525246,寄题张希孟都阃隐居四首 其三 东溪
529538,刘都阃送菖蒲
223248,民夫·阃帅差夫欲太平
571603,横州闻孙都阃震与宋长官下棋舟待水手不至戏柬二首 其二
672244,送张都阃擢任闽中
568368,次韵送李都阃
634299,寿金国瑞都阃 其三
634015,凤城归舟次石壁逢罗守阃学制野泊苶话
526249,赠李一之都阃
522159,次韵答申天锡都阃
209326,阃下忽动归兴
534994,送阃赞善赴南大司成二首 其二
164760,代襄阃宴新除史制卿乐语口号
581007,题李都阃琢玉轩诗卷
502016,送王都事之闽阃
662021,赠崔都阃移镇广东
878459,送方蒙仲赴辟江阃分韵得既字
209587,大阃拨醅于园亭坐上文武各半恰西师捷至用同
617730,诃林赠王丹一都阃
1114785,重庆阃治十咏 华明堂
