155577,林明府携所和诗见过次韵奉酬
999039,林明府携所和诗见过次韵奉酬
280483,喜沧玉、槐庭二君见过次韵
898501,同年李郎中以诗见寄仍许见过次韵和答
372095,周景瑜同杨伯升见过次景瑜所赠伯升韵
660107,三月廿日王龙山太宰偕雪湖见过次联句韵
937932,张迪功携诗见过次韵谢之二首 其一
660366,二月廿日喜诸舅见过次帘山韵奉酬
1118841,张迪功携诗见过次韵谢之二首
211187,同年李郎中以诗见寄仍许见过次韵和答
95970,曾郢州携和诗见过次韵谢之
937931,张迪功携诗见过次韵谢之二首 其二
1093115,伯皋自永丰见过次韵
883110,秋日程伯玉携诗见过次韵
1094110,周景瑜同杨伯升见过次景瑜所赠伯升韵
180602,张迪功携诗见过次韵谢之
973456,曾郢州携和诗见过次韵谢之
528198,立春管汝济见过次韵
831626,喜沧玉、槐庭二君见过次韵
1092197,王驹父袖诗见过次韵赠之
1113410,杨仲子携诗见过次韵酬赠并呈诚斋二首
196337,宣城李君尝游东湖居士之门袖诗见过次韵以谢
882109,宣城李君尝游东湖居士之门袖诗见过次韵以谢
355718,王驹父袖诗见过次韵赠之
1063908,郑南寿携诗见过次韵谢之
141279,杨仲子携诗见过次韵酬赠并呈诚斋
1091422,德裕见过次旧所题隐轩韵谢之
184190,秋日程伯玉携诗见过次韵
902953,杨仲子携诗见过次韵酬赠并呈诚斋二首 其一
902952,杨仲子携诗见过次韵酬赠并呈诚斋二首 其二
