628344,戊辰仲冬作客新会主人邀余为长夜饮命女伶文仙佐觞歌若连琐笑能倾人细视其微往往有不悦之色余问何姓云某乡良家某姓子顾盼唏嘘不能自抑余亦为之罢酒嗟乎三四十年来故家巨室负才卓立者流落不偶不知凡几多人矣有心之士自悲悲人日且不足岂止一文仙已哉作诗二截并贻同志或有感余言而和之幸邮示我 其一
455093,宝云香茶社主人邀社友品茗
832361,齐天乐 木本园穿井，主人邀集试泉，声为此调
308414,齐天乐·木本园穿井，主人邀集试泉，声为此调
447382,主人邀饮巴音浩日娲酒楼
447471,牛魔王火锅主人邀饮，赋此志谢
689061,戊辰仲冬作客新会主人邀余为长夜饮命女伶文仙佐觞歌若连琐笑能倾人细视其微往往有不悦之色余问何姓云某乡良家某姓子顾盼唏嘘不能自抑余亦为之罢酒嗟乎三四十年来故家巨室负才卓立者流落不偶不知凡几多人矣有心之士自悲悲人日且不足岂止一文仙已哉作诗二截并贻同志或有感余言而和之幸邮示我
628345,戊辰仲冬作客新会主人邀余为长夜饮命女伶文仙佐觞歌若连琐笑能倾人细视其微往往有不悦之色余问何姓云某乡良家某姓子顾盼唏嘘不能自抑余亦为之罢酒嗟乎三四十年来故家巨室负才卓立者流落不偶不知凡几多人矣有心之士自悲悲人日且不足岂止一文仙已哉作诗二截并贻同志或有感余言而和之幸邮示我 其二
