1133794,为魏塘王居士留三日二首 其二
519418,九鸶图为魏大用佥宪题
560425,慎轩诗为魏伯广作
1221468,福源精舍为魏仲远赋
1234028,己卯腊八日雪为魏伯亮赋 其二
747549,题断指图为魏贞女作 其二
829463,八月初九夜梦至一处案上书装册甚古翻视为魏晋六朝人诗梁诗标曰梁言齐曰齐言妙趣纷纶盎有馀味醒后追忆不得遂拟二首彷佛所见云
1223931,己卯腊八日雪为魏伯亮赋
908317,白云先生鲁叶殿丞交之父有隐节其居徽考所赐旁为魏高士守一庵高士上皇所宾礼庵亦赐地也高士亡矣而白云之后至食不给过之慨然为赋此篇
582973,题吴氏流芳卷为魏韦作
751702,孙仁甫丈炳奎出观先世所藏温公澄泥砚李延平有题名南宋为魏鹤山得见真西山跋明有文衡山观款
628800,灵芝为魏少参赋
1106028,予行为魏仓监门忽得前监仓官诗人江南彭少逸诗因次韵时彭以遗火失官
21422,寄狄拾遗时为魏州从事
1068604,予行为魏仓监门忽得前监仓官诗人江南彭少逸诗因次韵时彭以遗火失官 其一
1085251,冯员仲赴阙奏事士君子咸欲其留闻为魏公所辟势不可夺遂成鄙语兼简查元章
509371,隆恩堂为魏中书题
712667,以香瘿杯为魏和公寿系之以歌
1221403,怡云轩为魏良赋
322934,冯员仲赴阙奏事士君子咸欲其留闻为魏公所辟势不可夺遂成鄙语兼简查元章
660015,小仙寿意为魏二尹题
1034065,行香子 永州为魏深甫寿
1068605,予行为魏仓监门忽得前监仓官诗人江南彭少逸诗因次韵时彭以遗火失官 其二
323729,予行为魏仓监门忽得前监仓官诗人江南彭少逸诗因次韵时彭以遗火失官
670705,为魏使君送黄生归楚
828302,八月初九夜梦至一处案上书装册甚古翻视为魏晋六朝人诗梁诗标曰梁言齐曰齐言妙趣纷纶盎有馀味醒后追忆不得遂拟二首彷佛所见云 其二
1133795,为魏塘王居士留三日二首 其一
493586,出赵村闸为魏鉴题墨梅一首
1143981,为魏塘王居士留三日二首
1182257,寄狄拾遗时为魏州从事
239761,渔庄为魏济民赋
828301,八月初九夜梦至一处案上书装册甚古翻视为魏晋六朝人诗梁诗标曰梁言齐曰齐言妙趣纷纶盎有馀味醒后追忆不得遂拟二首彷佛所见云 其一
807347,水调歌头  纪恨为魏里张太君赋
1200424,渔庄为魏济民赋
108312,为魏塘王居士·水乡熟处未全饥
1803,感遇诗·乐羊为魏将
812337,题断指图为魏贞女作
108309,为魏塘王居士留三日
747548,题断指图为魏贞女作 其一
