458447,二零零七年秋归乡，得会老薛并诸友。薛云，中年向暮，馀事皆无，但思重拾诗思，以遣苍髯。故记以赠之。又忆少年十七八时，共约归隐，予有词云：觅佳地、须邻古柏，有小舟、细雨泊烟霏。功名倦，匡山忆处，结屋相依。今廿馀年矣，竟不得践其归志，悲乎
542470,方户曹兆行来自淮上夜话以赠
588064,谢医士过访诗以赠之
503446,与医者遇诗以赠之
501218,赠安南善书阮生生名廷玠为予书春秋春王正月考及安南行稿予喜其楷法遒美更其字曰宝善而诗以赠之
974133,学佛者祖迁自南陵来谒莫万安题诗于知津阁适同莫过而见之用韵以赠
1176689,新秋月夕客有自远相寻者作吴体二首以赠 其一
722338,文与也为予写西洞庭图赋此以赠
749900,五月十一日梦中得首联十字次日剑昙至自京师因续成以赠即送其通判岭西
458440,病卧展眼，床头石人山为置菊花茶，因赋以赠之8.19
1123616,杨时可作十诗以寄河间诗之所及非吾僚则吾友也因悉次其韵以和之又以其所以赠我者复赠时可作还字韵
176751,吟客枉访酒边走笔以赠
636186,周茂才二有筑室山中谈经受徒从之游者皆邑名士书舍鳞集振铎篝灯络诵达旦予游山还时日已西夕留宿斋中睹其规模恍若丛席北方学者未尝有也因赋以赠
1084898,陈大监用赏梅韵以赠依韵酬之
537894,孙鸿胪於群从中官薄而诗佳授予满卷因成以赠
1157717,舒员外游香山寺数日不归兼辱尺书大誇胜事时正值坐衙虑囚之际走笔题长句以赠之
769680,沁园春·己亥十月重过何阜闻缪函九、豹文叔侄今年皆四十初度，题词以赠
718416,文与也为予写西洞庭图赋此以赠 其六
813589,留宿陈卫瞻易安书室口占以赠
1003188,诉衷情  赵德大还延平，因语旧游，作此以赠之
498854,骏马逐电赋以赠友人之官电白
513537,钱塘沈德自成化丁亥以来从家君征川贵山都掌之夷又从平江伯出镇两广总督漕运清谨之操三度如一家君荐之始自从事为选人平江凡七荐之乃自江淮卫知事改隶通政司于是荐绅君子无不嘉君之能获乎二公也拜命言旋赋诗以赠
501494,广东省郎观子毅翩翩佳公子也读书能诗甚闲于礼以省命辅予安南之行雅相敬礼予暂留龙江君与士良典簿先造其国正辞严色大张吾军今子毅北辙而予南辕家贫旅久复送将归深有不释然者口占绝句四首以赠诗不暇工情见乎辞云尔 其一
570092,南昌饶生善医余友王茂才有隐疾能起之索二绝句一韵以赠 其一
807480,念奴娇  半雪弟四十词以赠之即次其自寿原韵
482733,秋夜听谷大弹阳春白雪遂歌以赠
387067,太微子过访留诗因次韵以赠
440474,次韵定庵秋心三首以赠志瑾学兄 其一
1224389,庐山连尊师求真阳诗久诺而未作也一夕梦中得之因书以赠
716040,任秋浦解河清令归养诗以赠之 其二
716259,罗翁八十有五善琴诗以赠之 其一
521808,归善唐汝达尝侍其先君教华亭京邸相逢恍如一梦于其赴铜鼓学也赋以赠之
248896,陈章兄枉过诗以赠之
658099,文太仆之京过定山言别诗以赠之 其二
1218605,熊松云画秋林诗意图送蔡伯雨道士归上清松云在淮阴今其来因见题以赠之就以柬送方壶隐者
667869,豫章陈生纪善堪舆诗以赠之
959029,余自东山往金峨住山戒师迎于中涂到上方泉石幽胜有心匠助天巧者因成数语以赠
1222532,次韵卢疏斋就以赠别二首 其一
731836,在频山子德大弟宅喜晤子祯宋隐君歌以赠之
1060124,几山出示阳桥唱和诸什窃慨英才之沈寂光景之流迈因两次其韵皆以少日为篇首一以赠监镇孙和仲一以赠知丞苗几山云 其二
1060124,几山出示阳桥唱和诸什窃慨英才之沈寂光景之流迈因两次其韵皆以少日为篇首一以赠监镇孙和仲一以赠知丞苗几山云 其二
1060123,几山出示阳桥唱和诸什窃慨英才之沈寂光景之流迈因两次其韵皆以少日为篇首一以赠监镇孙和仲一以赠知丞苗几山云 其一
1060123,几山出示阳桥唱和诸什窃慨英才之沈寂光景之流迈因两次其韵皆以少日为篇首一以赠监镇孙和仲一以赠知丞苗几山云 其一
677628,杨乾叔新搆其先君武东银台有作因追和之以赠乾叔
28233,新秋月夕客有自远相寻者作吴体二首以赠
1208763,舟中闻笛（岳阳楼下邻舟一军将醉而吹笛爱其音韵清壮命酒赏之旦求予诗遂赋此以赠）
658031,施公节枉顾定山诗以赠之
569714,留叶茂长小饮闻将有西南游歌以赠之
467361,庚寅天中节胡马君欲赴青峰会暨屈原奖典礼叠韵以赠
581609,马汝砺府倅入觐乃翁侍读先生以诗示之还治予步韵以赠
753157,赵樾村观察由蜀乞养回滇道老鸦滩枉顾话旧诗以赠之 其二
579737,次庄定山韵二首一以忆定山先生一以赠用美寅长 其一
1124060,斯远兄入城见使君郎中且谒尚书韩先生提属李丈题诗以赠四首
688384,次庄定山韵二首一以忆定山先生一以赠用美寅长
1061691,友人有小石数颗以余酷爱将辍惠佳者唯求一诗赋以赠之
1146094,薛记室收过庄见寻率题古意以赠
785661,徐晋斋观察吴翰涛贰尹随使美洲道出日本余饮之金寿楼翰涛即席有诗和韵以赠
443794,永正兄莅昌，诗以赠之
407892,时宣统二年，道沪上，遇同乡宋君赓平，自云善剑术，著有《剑法学要》，索人题跋，且以其为霆军下将，抑郁不自得，常奔走风尘以结交名士大夫，故作此篇长歌以赠之
722187,姬人墨西氏生日赋以赠之
698222,驾部张员外汝弼以寒不及出饯赋诗见诮遂用韵二首一以赠沈一以答张
410615,有从军于黔得虎以赠善子置之网师园去其槛夜宿主人房王秋湄之夫人曰虎若皈佛当永戢野性遂受戒于报国寺印光法师今闻其病也以诗讯之
1120418,几山出示阳桥唱和诸什窃慨英才之沈寂光景之流迈因两次其韵皆以少日为篇首一以赠监镇孙和仲一以赠知丞苗几山云
1120418,几山出示阳桥唱和诸什窃慨英才之沈寂光景之流迈因两次其韵皆以少日为篇首一以赠监镇孙和仲一以赠知丞苗几山云
1062739,杨时可作十诗以寄河间诗之所及非吾僚则吾友也因悉次其韵以和之又以其所以赠我者复赠时可作还字韵 其四
1007530,吟客枉访酒边走笔以赠
1191292,汉阴驿与宇文十相遇旋归西川因以赠别
1062737,杨时可作十诗以寄河间诗之所及非吾僚则吾友也因悉次其韵以和之又以其所以赠我者复赠时可作还字韵 其二
1091786,李南卿西归求语以赠行山谷偈云八万四千关捩子与君一个锁匙开仆亦有一个锁匙谨以奉赠
992389,周仲章都官示卷因以赠之
550332,涂德公疏救黄幼元廷杖寻奉诏释于其归也作此以赠 其二
886496,何达观久客他乡音问旷绝一日忽见过又匆匆告别吾老且病未知后会何如走笔以赠
1192814,蜀州郑史君寄鸟觜茶因以赠答八韵
1249720,申仲义录事杭州来议论慷慨风节可喜作此以赠
1211249,何国器以精艺受知出而徵入者数矣出守江阴尚虑其不果行也书以赠之
1237528,次韵卢疏斋就以赠别二首
452283,景秀兄侍父来京看病赋此以赠
1161933,卧病喜惠上人李鍊师茅处士见访因以赠
336557,杨次公侍讲得古印于洪井其文云东海开国次翁之子德润以赠徐伯远伯远有诗次韵
718412,文与也为予写西洞庭图赋此以赠 其二
400957,请祖光为慎之写一字幅不意竟写拙作《搓草绳调王子夫妇》一首以赠慎之恰合其时复成此诗并寄
711079,惠城逢曹子介能始先生季子也感其艰难出死诗以赠之
6862,早秋京口旅泊章侍御寄书相问因以赠之时七夕
604334,读王伯度孝廉方内外言赋此以赠其归
250245,辛卯孟夏海楼兄携女儿心莲来京盘桓数日时心莲才考中国美附中赋诗以赠
545181,陈长洲杨吴县访曲水园幼于携尊夜集以河阳花作县秋浦玉为人拈韵余得花字时二明府皆将入觐并以赠行
1113155,庐陵李直卿以复名其斋求予诗久未暇也今日雪霁登楼偶得此遂书以赠顾惟圣门精微纲领岂浅陋所能发祇增三叹
1209064,风流子 至元四年七月廿又二日苏伯修侍郎举一儿子以予同年久交且三子名梯云拿云步云者方成童就傅乃求仿吾儿制名遂命之曰乘云继徵词以纪笔赋此以赠儿已满弥月矣侍郎作汤饼会并书呈席上诸公
717918,秋日挈舟茉莉沙追送孔参军即景口占以赠其行 其三
1105658,主簿程同年和永平门诗再赋四绝因以赠别
510626,碧玉楼昼梦扶病出游村径甚适忽安福罗进士携彭秀才来访遂书以赠之
501497,广东省郎观子毅翩翩佳公子也读书能诗甚闲于礼以省命辅予安南之行雅相敬礼予暂留龙江君与士良典簿先造其国正辞严色大张吾军今子毅北辙而予南辕家贫旅久复送将归深有不释然者口占绝句四首以赠诗不暇工情见乎辞云尔 其四
458358,伤酒至胃出血，夜中强为诸友讲诗，课既毕，疾乃大作。幸小农在侧，老贝复抢送医院，急救之间，丁国强兄亦自金华驰返，俾相料理，事乃稍定。中宵不寐，移吊针之架以就空窗之侧，左书以赠老贝并诸友
1088362,卧龙之游钱通守得江字不及赋诗已解维矣熹用其韵纪事以赠并附卷末
380387,赵樾村观察由蜀乞养回滇道老鸦滩枉顾话旧诗以赠之
301603,金缕曲·甲申阳月合肥李仲仙同黄仕林军门枉顾寓斋，倚声以赠
738662,赵跃斋彭翰文两太史自滇南典试归饮余七一草堂酒酣跃斋出诗扇以赠诗乃试院作也依韵酬之
501649,三衢程君璋氏访友临漳将归赋此以赠
458254,贺新郎　为肖健理旧作，中多少年相共事，赋以赠之 其一
568882,胡楚玉，法门之龙象也，虽混迹㞐士，而超契应真。一旦别余游五台礼文殊大士，感此赋古体一章以赠
42950,梁溪顾梁汾舍人过访赋此以赠兼题其小像
403,薛记室收过庄见寻率题古意以赠
1252513,花心动 黄伯阳岁晚见梅，适遇旧赋以赠别，持行卷来，求孙果翁、卫立礼洎予皆和
971881,斯远兄入城见使君郎中且谒尚书韩先生提属李丈题诗以赠四首 其一
905831,至化士自宣城归蒋陵求颂书此以赠
721912,任秋浦解河清令归养诗以赠之
553950,送僧怀师古庵住惠山并写竹枝以赠
604455,骆勉叔余四十年前同席友也一旦扁舟见访诗以赠之 其一
416008,将之皖，与都门诸友话别江亭，赋此以赠 其一
570395,陆无从茂才自扬州来乞文以赠歙人吴惟登得三绝句与之生高于诗与欧博士桢伯为广陵社 其三
721962,罗翁八十有五善琴诗以赠之
1216956,怀临川旧游赋以赠别戈直伯敬
1168943,友人下第因以赠之
1062742,杨时可作十诗以寄河间诗之所及非吾僚则吾友也因悉次其韵以和之又以其所以赠我者复赠时可作还字韵 其七
1004247,遂宁喻生画鹿甚精介同官梁知丞谒余因令作八幅图帐适赤城观主惠一鹿甚驯未数日忽又一鹿奔至县圃非邑士所豢养者竟不详其所自来物理感召画龙而致真龙似未足为诞也借邑士张权父诗韵以赠之
648008,朱中书为余写溪山幽趣彦鼒南还遂以赠之并题诗云
18849,喜与韦左丞同入南省因叙旧以赠之
286304,冷子示关中友人赠诗且索予作赋此以赠
635484,郑珠江太史还京过大通话别赋此以赠
501683,相士潘碧山久游江湘间今以武功为石臼司警濒行索诗漫赋以赠
103207,周仲章都官示卷因以赠之
1075504,杨次公侍讲得古印于洪井其文云东海开国次翁之子德润以赠徐伯远伯远有诗次韵
1248985,国宝照磨有平野轩在扬州城郭中今寓吴十许年矣至正丙午九月十一日在开元寺为写此图并诗以赠
1077892,张氏二甥寄诗可喜赋此篇以赠之
716801,林沂泽五十又一生日诗以赠之
704052,去岁余与窗友赵伯颙同外补五月十有二日予至钱塘宿斋吴山而伯颙已先至因来叙话夜分始别匆匆一载矣兹予统师南征经伯颙之邻封伯颙亦来犒师亦以是日会于浔阳两情相对喜而复感而伯颙又亟欲别去予因口占三绝以赠
717923,秋日挈舟茉莉沙追送孔参军即景口占以赠其行 其八
252596,叠韵以赠·长夜漫漫宿野阑
1062738,杨时可作十诗以寄河间诗之所及非吾僚则吾友也因悉次其韵以和之又以其所以赠我者复赠时可作还字韵 其三
719426,某君年七十馀纳双妾赋以赠之 其一
585631,次韵姚泽山侍御江门钧台之作因以赠别二首 其二
628164,石人弟十月十五日生日诗以赠之
717464,姬人墨西氏生日赋以赠之 其四
468487,介休李贯道以安东知县听对于山西布政司与余同寓太原右卫知事刘景高所其还所治也诗以赠之
748553,献姚石甫先生即以赠别 其一
955539,滕子京以真箓相示因以赠之
1062736,杨时可作十诗以寄河间诗之所及非吾僚则吾友也因悉次其韵以和之又以其所以赠我者复赠时可作还字韵 其一
509632,去岁余与窗友赵伯颙同外补五月十有二日予至钱塘宿斋吴山而伯颙已先至因来叙话夜分始别匆匆一载矣兹予统师南征经伯颙之邻封伯颙亦来犒师亦以是日会于浔阳两情相对喜而复感而伯颙又亟欲别去予因口占三绝以赠 其二
1233608,安南遣使入朝用故事奉贽纳谒于翰林其归也上介黎括以赠言为请赋诗四韵以遗之
636713,蔚园弟五十一题古松图以赠
837775,金缕曲·甲申阳月合肥李仲仙同黄仕林军门枉顾寓斋，倚声以赠
561686,白贞夫皇甫子安二郎中谪官诗以赠之
746268,闰重阳日集家红生舍人寓宅酒后登阁望西山追和陈紫澜先生原韵盖先生官楚时以赠舍人尊祖者七十七年矣
324077,李南卿西归求语以赠行山谷偈云八万四千关捩子与君一个锁匙开仆亦有一个锁匙谨以奉赠
790211,同王柳村徵君谒阮芸台制军，谈宴竟日，并撰“鸾凤一门才尽美，芝兰千载姓犹馨”楹联以赠。过蒙奖。借赋此志感二首 其二
97162,过陈莘叔尹因以赠之
718415,文与也为予写西洞庭图赋此以赠 其五
675779,沈五峰郡博往松江视其乃婿清浦县学谕王君诗以赠之
604566,冰上人至自中宿以诗为贽病中下榻赋以赠之 其一
570394,陆无从茂才自扬州来乞文以赠歙人吴惟登得三绝句与之生高于诗与欧博士桢伯为广陵社 其二
563470,阳明子之南也其友湛元明歌九章以赠崔子钟和之以五诗于是阳明子作八咏以答之 其六
1123705,卢谊伯宜之见过要斯远同赋以赠二首
772158,山阴陆少海，浙东名下士也。每过从潜园，潜园待之逾于常客。促膝论文，口占以赠
502910,玉融潘原润将义葬其师黄山陈平叔一日持广赙集过予愧贫不能助遂赋此以赠之
605101,张忠叔以循州参军假余邑司马取急还剡东宦评卓尔宦橐萧然次陶靖节归去来词韵见示时病困不能折柳枕上得五十六字力疾捉笔书以赠焉靖节曰云无心而出岫忠叔念之西园公七十有三矣尚能随竹马迎旧衮也
546647,楚余生千里过访乞诗四绝以赠其行 其二
1077838,叔易得水晶笔格赋诗见寄因次其韵顷与叔易奕而胜得其铜兽炉制度甚古携行常置几案间今此格宜以赠远与炉为伴故卒章及之
250509,景秀兄侍父来京看病赋此以赠
1126823,次韵崔伯易席上所赋因以赠行二首
1223788,大廷策士问经世之道仆忝在读卷之列观诸进士所对有感赋此录以赠别刘性粹中支渭兴文举二贤良
826494,蕙兰芳引·鹤亭以赠畹华词属和，次韵答之
575420,郑山人自闽赴友难归，诗以赠之
728570,满江红  梁溪顾梁汾舍人过访赋此以赠兼题其小像
854300,王大令移需岩王隐居手植木樨于郡庭赋诗以赠和黄通判韵
829887,竹香子 癸未海滨修禊图，前余已三次题咏，今又布景添画童子三人于中，尤觉光彩夺目。爰再填小词二阕以赠画师郑君慕康，并博诸老一笑
778511,贺新郎  萧山任千之成进士归里作此词以赠之
683923,周山人稚尊游豫章时己十余年矣今日忽访我金陵容鬓非昔而风范不衰复出吴兴徐生一札徐别亦十年屡有言其无常者似一日得两故人喜成二绝以赠稚尊时己丑之夏四月也
1085864,予雪诗云不来平地只山巅朱钤干和云不能下乞俗人怜志在洁己陈知录云只可在山如去年志在恤民王抚干云散作人间大有年志在润物三子之志虽不同皆可嘉也各用其句作三绝以赠之又以一绝自贶 赠钤干
443742,鹧鸪天 雪樵过访，赋此以赠
1085449,主簿程同年和永平门诗再赋四绝因以赠别 其二
241632,孙秀才下第暂还京口留别起居邀余和以赠行
668012,病中武昌二客过访诗以赠之
791659,洪表侄与余别三年矣，旅馆相逢，喜生意外，爰赋二律以赠之 其二
575063,费子美过锡病不能来遣其子来访且索诗遂赋以赠
550331,涂德公疏救黄幼元廷杖寻奉诏释于其归也作此以赠 其一
509633,去岁余与窗友赵伯颙同外补五月十有二日予至钱塘宿斋吴山而伯颙已先至因来叙话夜分始别匆匆一载矣兹予统师南征经伯颙之邻封伯颙亦来犒师亦以是日会于浔阳两情相对喜而复感而伯颙又亟欲别去予因口占三绝以赠 其三
925873,临江仙 其一 侍者阿钱将行，赋钱字以赠之
687759,文太仆之京过定山言别诗以赠之
679648,赠郑于石于石讳国望越之高士也至日冒雪访予诗以赠之
790505,同盟华相卿明经北上应丁酉科试遵钱君念岵原韵率成二律谨以赠别 其一
824175,竹香子 癸未海滨修禊图，前余已三次题咏，今又布景添画童子三人于中，尤觉光彩夺目。爰再填小词二阕以赠画师郑君慕康，并博诸老一笑 其一
991844,水丘于西湖得活鲫鱼三尾见遗余顷在襄城获数尾时欧阳永叔方自乾德移滑台留待其至且有诗后居京师蔡仲谋者亦有以赠乃思襄时所留复有诗于今三得三咏之矣
444146,凝秋、皎月联袂来访赋此以赠
289450,台南重晤王亚南先生，即以赠别
697403,楚余生千里过访乞诗四绝以赠其行
717917,秋日挈舟茉莉沙追送孔参军即景口占以赠其行 其二
1050269,听惠守钱承议谈罗浮山因以赠之
791658,洪表侄与余别三年矣，旅馆相逢，喜生意外，爰赋二律以赠之 其一
740279,舒生鹦自溆浦来谒诗以赠之并示书院诸生
717921,秋日挈舟茉莉沙追送孔参军即景口占以赠其行 其六
761768,题达诚斋达三榷使诗集即以赠行
252595,庚寅天中节胡马君欲赴青峰会暨屈原奖典礼叠韵以赠
748455,张石舟与何子贞既构顾先生祠刻亭林年谱成因得睹蔡小石司业家藏万年少秋江别思图图作以赠亭林者也石舟与子贞各摹其画及识语并程氏易畴题跋装为卷石舟手书亭林赠万举人诗又所作次顾韵题此图诗补成顾祠秋祭诗并录于卷属赋诗得五言一首
972309,卢谊伯宜之见过要斯远同赋以赠二首 其一
286213,口占以赠·灯影深帘閟
1105545,前日寓邑偶值乍寒陈刘二生济我以衣童生济我以衾既别为二诗以赠 赠陈元佐刘士宗
1051502,次子瞻夜字韵作中秋对月二篇一以赠王郎二以寄子瞻 其二
842622,次韵答几道即以赠别
1178066,君子勿郁郁士有谤毁者作诗以赠之 其一
521146,沂州谷生尝从张友山学能诗善医工画梅家有园亭之胜比自京师还同馆陈君德卿作云山别意诗以赠邀予同赋
422650,木兰花慢 其二 苗子至，偕饮马回回家，词以赠别
1176690,新秋月夕客有自远相寻者作吴体二首以赠 其二
1214576,石门张氏园几二百年事见语溪志南石先生既宣慰河东退而家居每与宾友觞咏其中闻之里父老公之曾祖君为郡太守而归有指而詈之者阍人执以请命公曰彼安敢詈我与之酒且有以赠之责门者曰吾岂以贵势凌人哉汝不待教令而拘系之是扬吾恶名以为子孙累也逐而易之噫斯其所以嗣世益昌而此园之所以弗废与
501189,予别黄岩十又六年谫焉德薄父老当不复记然区区常往来于怀也如晦上人来见语亹亹不能休别又依依不忍释予不知何也赋此以赠
158269,郑君天常有诗贻杨尉因次韵以赠
517065,九我欲买山结室以赠赋诗却之
1152977,城中卧疾知阎薛二子屡从邑令饮因以赠之
432167,将之皖，与都门诸友话别江亭，赋此以赠
555588,赠姜义泉义泉未病时自谓将缘事出狱索诗以赠之过数日病二十日即死命也
841429,陈少蘅岁暮旋里留别答以赠言一章
134022,君倚示诗有归吴这兴为诗三十二韵以赠
999879,某近与和叔游景爱之不足因吟短篇以赠
466768,次韵定庵秋心三首以赠志瑾学兄
570093,南昌饶生善医余友王茂才有隐疾能起之索二绝句一韵以赠 其二
96767,卢谊伯宜之见过要斯远同赋以赠
717920,秋日挈舟茉莉沙追送孔参军即景口占以赠其行 其五
604658,送王民春归楚黄时民春与余俱携家游白下而民春归矣余尚淹留去住含悲用申短律以赠行李
313391,蕙兰芳引·鹤亭以赠畹华词属和，次韵答之
561647,符子太仆出守韶郡赋此以赠符子昔尝作倅于韶也 其二
716403,林叔君六十生日赋以赠之 其五
546646,楚余生千里过访乞诗四绝以赠其行 其一
444558,鹧鸪天 巢湖雅集，分韵得“君”，即以赠乐乐
1085867,予雪诗云不来平地只山巅朱钤干和云不能下乞俗人怜志在洁己陈知录云只可在山如去年志在恤民王抚干云散作人间大有年志在润物三子之志虽不同皆可嘉也各用其句作三绝以赠之又以一绝自贶 自况
964378,程待制以黄居寀芦鹭易燕穆之雪满群山图次韵以赠
494447,书尹黄门相二代敕命册因以赠之归嘉鱼
5621,城中卧疾知阎薛二子屡从邑令饮因以赠之
721998,林叔君六十生日赋以赠之
604567,冰上人至自中宿以诗为贽病中下榻赋以赠之 其二
563466,阳明子之南也其友湛元明歌九章以赠崔子钟和之以五诗于是阳明子作八咏以答之 其二
454540,陈章兄枉过诗以赠之 其二
1250846,王季耕奉命徵吴谋武于江浙还赋长律以赠
716401,林叔君六十生日赋以赠之 其三
282294,有从军于黔得虎以赠善子置之网师园去其槛夜宿主人
815320,赵樾村观察由蜀乞养回滇道老鸦滩枉顾话旧诗以赠之
588078,高明杨子远访山中诗以赠之
704672,癸巳九月与乔生先生夜话见其壁间画像乃十年前梁生所写抚今追昔有少壮之殊爰赋二诗以赠因书其上
333588,张氏二甥寄诗可喜赋此篇以赠之
585630,次韵姚泽山侍御江门钧台之作因以赠别二首 其一
565805,西小湖在林屋洞天之岩石池亩许冬春不竭蔡山人居其傍诗以赠之一首
598086,吴生光卿斋为风雨所破旋葺成之予过见壁上多有题咏因走笔赋此以赠
1235071,汪大雅善?书诗以赠之
1188684,重阳日陪元鲁山德秀登北城瞩对新霁因以赠别
702171,次韵姚泽山侍御江门钧台之作因以赠别二首
138232,忠侍者自隐静来既归觅诗因述其意以赠之自可
780106,摸鱼子 方渭仁葺健松斋幸园松之存也词以赠之
379131,灯禅师出蜀住此山十年为作南食且约同住作此以赠
971880,斯远兄入城见使君郎中且谒尚书韩先生提属李丈题诗以赠四首 其二
365862,徐晋斋观察吴翰涛贰尹随使美洲道出日本余饮之金寿楼翰涛即席有诗和韵以赠
466622,陈章兄枉过诗以赠之
250559,破山寺重逢查先生赋此以赠
717916,秋日挈舟茉莉沙追送孔参军即景口占以赠其行 其一
626642,癸巳九月与乔生先生夜话见其壁间画像乃十年前梁生所写抚今追昔有少壮之殊爰赋二诗以赠因书其上 其二
683820,陆无从茂才自扬州来乞文以赠歙人吴惟登得三绝句与之生高于诗与欧博士桢伯为广陵社
446283,寤兄离职拟回湘不日将别忽生难逢莫名之慨 赋此以赠
684382,阳明子之南也其友湛元明歌九章以赠崔子钟和之以五诗于是阳明子作八咏以答之
436390,彦衡丧子乡社诸君皆有诗以慰其哀余忝交游之长乌能无言因赋此以赠之
1138665,小铜屏铸渊明归去诗并坡和章以赠子华侑以绝句
1209069,南乡子 二月廿又八日君美弄第二雏仍前例名之曰凌云赋此以赠
1047824,圆明师为余鼓琴作昭君操因感其意辞以赠之
569547,殷无美余故人也东归之后贽而强纳拜焉辄成以赠
499507,友人陈仁辅好古之士也效古体以赠之
716039,任秋浦解河清令归养诗以赠之 其一
807894,贺新郎  南耕齿疾养疴南岳山房初夏同雪持南水放庵过访词以赠之
552854,瑞州萧彦良久客宁夏既归省母则其妻已死遂携子以行其妻弟喻孟良求诗以赠
780082,沁园春 日照李伯开作生圹成自题云“竹帛谁千古，烟霞我一丘”，余喜其能达生也，词以赠之
454539,陈章兄枉过诗以赠之 其一
717922,秋日挈舟茉莉沙追送孔参军即景口占以赠其行 其七
452391,破山寺重逢查先生赋此以赠
105473,尹子渐归华产茯苓若人形者赋以赠行
889586,忠侍者自隐静来既归觅诗因述其意以赠之自可呈似简堂老师也
1082957,世弼和酬因继韵以赠之 其二
553087,嘉禾崔彦龄以母在琼州陈词通政司启东宫报可徒步奉迎过广信寓宿数日作诗以赠
1085451,主簿程同年和永平门诗再赋四绝因以赠别 其四
250323,果勇先生五十生日索赋口占以赠
