687002,孙景武从赵伯友先生游宁都兹归省豫章诗以赠之并柬知己者
866918,李养源自号蒙泉求诗于东平包某作此以赠之
717925,秋日挈舟茉莉沙追送孔参军即景口占以赠其行 其十
451960,果勇先生五十生日索赋口占以赠
331983,摸鱼子·方渭仁葺健松斋幸园松之存也词以赠之
924445,次子瞻夜字韵作中秋对月二篇一以赠王郎二以寄子瞻 其一
1085400,金华先生有奇石名碧远携来自蜀陈洪州以诗觅之金华辍所嗜以赠亦一段奇事也予家雁荡群峰错峙皆几案间物因和二公诗颇起乡思寓意断章
1068446,徐叔明校书篆笔奇古复善丹青为予作汉江暮霭扇材极妙力求鄙句作此以赠
1253330,吴子仁氏有斑竹杖藏之数年矣文彩烨然坚劲可爱近以赠仲温葛先生葛公得之甚喜登山临水之兴浩然不可遏也过余求诗为赋二律
13457,卧病喜惠上人李炼师茅处士见访因以赠
722248,秋日挈舟茉莉沙追送孔参军即景口占以赠其行
521551,新蔡张孝子以乙丑岁寿七十其子什贰守松江松人为瀛海奇观图以赠为赋长句
313608,木兰花慢·苗子至，偕饮马回回家，词以赠别
436296,卫生行之少负侠气与余兄弟相遇于艰难之际自抑惴惴常若不及迨今十五年矣家贫而益安岂果有所学乎不然何其舍彼而取此也生正月十六日诞弥日也因赋诗以赠为一笑乐且以坚其志云
118256,次子瞻夜字韵作中秋对月二篇一以赠王郎二以
15637,君子勿郁郁士有谤毁者作诗以赠之
999853,郑君天常有诗贻杨尉因次韵以赠
458394,花城共熊哥清角饮，予为烂醉，略不记省。翌日饭间清角兄为语其状，因索笔戏赋以赠，兼记保安妙语
747183,太史次前韵见答复小书便面以赠称许过情感愧交至叠韵奉报
683624,南昌饶生善医余友王茂才有隐疾能起之索二绝句一韵以赠
1062743,杨时可作十诗以寄河间诗之所及非吾僚则吾友也因悉次其韵以和之又以其所以赠我者复赠时可作还字韵 其八
1242338,花心动 其一 黄伯阳岁晚见梅，适遇旧赋以赠别，持行卷来，求孙果翁、卫立礼洎予皆和
367083,世弼和酬因继韵以赠之
