377876,孔子韶方平与其侄处度相访于香山作此诗以赠之
563472,阳明子之南也其友湛元明歌九章以赠崔子钟和之以五诗于是阳明子作八咏以答之 其八
790506,同盟华相卿明经北上应丁酉科试遵钱君念岵原韵率成二律谨以赠别 其二
134117,兴宗南园草盛不翦仆过而爱这诗以赠
537100,普晦去吏为道人为伯玉中丞募建肇林精舍值岁俭鲜应予辞晋臬未上聊出馀俸助之走笔短歌以赠
718411,文与也为予写西洞庭图赋此以赠 其一
563465,阳明子之南也其友湛元明歌九章以赠崔子钟和之以五诗于是阳明子作八咏以答之 其一
13736,敕赐长寿酒因口号以赠
1207624,宝粹二上人值雨留宿西涧草堂明日赋此以赠
675092,太微子过访留诗因次韵以赠
717462,姬人墨西氏生日赋以赠之 其二
792376,春日喜方耕霞丈见访即以赠别二首 其一
597999,凤渚薛生以岁暮来访季弟于山斋因留信宿别去诗以赠之
209150,古风以赠·贯林齐已唐诗人
996701,次韵斌老冬至书怀示子舟篇末见及之作因以赠子舟归
817129,洪表侄与余别三年矣，旅馆相逢，喜生意外，爰赋二律以赠之
501496,广东省郎观子毅翩翩佳公子也读书能诗甚闲于礼以省命辅予安南之行雅相敬礼予暂留龙江君与士良典簿先造其国正辞严色大张吾军今子毅北辙而予南辕家贫旅久复送将归深有不释然者口占绝句四首以赠诗不暇工情见乎辞云尔 其三
645013,句容县茅山观道官东白能文章且长于诗予无以为寿集杜子美诗二十句以赠
1210754,徽州学正胡泳子游自京都来过予于维扬以士常中郎长诗见示又省掾王约彦博谓子游文笔有中州气象用是不敢以常书生遇之十月复会于杭且以乐府辱贶将拿舟归江东因作二十八字以赠
1234757,颖川赵琏从予游逾二载复同夜坐草亭考索理义始至大辛亥十月癸未至皇庆壬子五月癸丑而止诵讲之馀时相与步武庭中倚树凝立仰观俯察莫匪佳趣间以所见辑成韵语得十馀篇于琏之行书以赠之
57759,宝粹二上人值两留宿西涧草堂明日赋此以赠
444911,踏莎行 读晦窗诗词感而填词一曲以赠
716783,闻前州守王君谈德庆山川之胜诗以赠之
298995,黄仲则景仁自太平来新安留试院月余将有武陵之行诗以赠别
570915,周山人稚尊游豫章时己十余年矣今日忽访我金陵容鬓非昔而风范不衰复出吴兴徐生一札徐别亦十年屡有言其无常者似一日得两故人喜成二绝以赠稚尊时己丑之夏四月也 其二
591065,高淳民芮首忠得心疾予一言药之而瘳兹来见诗以赠归
1158551,秦系顷以家事获谤因出旧山每荷观察崔公见知欲归未遂感其流寓诗以赠之
959093,灵隐慧上人惠诗为古风以赠
716399,林叔君六十生日赋以赠之 其一
522029,陈丕显以贡入京将还试乡闱阅其近作赋以赠之
1049830,仲春樱桃下同许损之小饮因以赠之
869971,兴宗南园草盛不剪仆过而爱之为诗以赠
1034914,六月十四日后殿侍立新永康太守成嘉甫朝辞奏事词气恳恻上为嘉纳尝随笔纪其事今乡人祖帐分韵得西字遂书以赠行
960005,九月初吉永嘉苏太古同游金华洞夜宿鹿田寺用杜陵山馆诗韵以赠
971879,斯远兄入城见使君郎中且谒尚书韩先生提属李丈题诗以赠四首 其三
430465,亚子行有日矣诗以赠别
717461,姬人墨西氏生日赋以赠之 其一
785308,广福门赴旅顺之行期本拟在四月二十四日后迁延至二十八日予以饯行诗书之于扇因以赠之复题一截
811055,同盟华相卿明经北上应丁酉科试遵钱君念岵原韵率成二律谨以赠别
441277,为达斋制迦楼罗精舍二印漫书印蜕以赠
716260,罗翁八十有五善琴诗以赠之 其二
575437,德昂寻师北来，诗以赠之，兼呈汪公
658033,种唐毬子树于天峰阁前周景和加檃栝马诗以赠之
996093,次韵崔伯易席上所赋因以赠行二首 其一
562924,广文有之任彭城者诗以赠行
721916,携公新栖仙掌峰诗以赠之
953706,秀才欧世英惠然见访于其还也聊以赠之
716052,携公新栖仙掌峰诗以赠之 其四
458044,贺新郎　沙子石子兄极少上网，每一显身，爱其诗者辄为雀跃。近于碰壁书斋贴新作，予草翻一过，即去午食，酒中赋此以赠
1117212,次子瞻夜字韵作中秋对月二篇一以赠王郎二以寄子瞻
570393,陆无从茂才自扬州来乞文以赠歙人吴惟登得三绝句与之生高于诗与欧博士桢伯为广陵社 其一
310688,腊杪喜晤向缪两孝廉来都数日即移寓内城，作此以赠
844016,宽孙世讲画梅得自庭训顷将南游手书画便面为别赋谢即以赠行
542102,吴人郑速季入邺省兄中伯每谈倭寇之乱久而思归赋此以赠三首 其二
866537,眉僧晓岑仆未之识也持钵求施既辞以贫则愿丐一诗诗未暇作而三至门知嗜好可喜也因书长句四韵以赠
286212,留宿陈卫瞻易安书室口占以赠
683346,顾季狂见过狂谈竟月於其行也诗以赠之
1063961,信上人自东林来请海印禅师过余湘上以赠之
353283,契师欲予隶书为此以赠
381924,藩邸洪子深参军得旨江南印儒书归国次韵张清夫所赠以赠之
463062,庚寅天中节胡马君欲赴青峰会暨屈原奖典礼叠韵以赠 其二
715406,尹君有三孙甚怜爱诗以赠之
1215509,客有语予以卫生之术者其说流于固赋此以赠之
900829,怀鬼谷山思真洞天因咏以赠元规
1179418,窦三中丞去岁有台中五言四韵未及酬报今领黔南途经蜀门百里而近愿言款觌封略间然因追曩篇持以赠之
523254,翟生苦节尚志人也迩从余河之上余嘉敬焉作诗以赠
654992,驾部张员外汝弼以寒不及出饯赋诗见诮遂用韵二首一以赠沈一以答张 其二
716402,林叔君六十生日赋以赠之 其四
388454,孙鸿胪於群从中官薄而诗佳授予满卷因成以赠
807841,贺新郎  弓冶弟万里省亲三年旋里，于其归也，悲喜交集，词以赠之，并怀卫玉叔暨汉槎吴子，即用赠苏昆生韵
854483,毛伯玉以六月廿七日来访是年天不雨梅亢热异常书数韵述怀且以赠之
1085866,予雪诗云不来平地只山巅朱钤干和云不能下乞俗人怜志在洁己陈知录云只可在山如去年志在恤民王抚干云散作人间大有年志在润物三子之志虽不同皆可嘉也各用其句作三绝以赠之又以一绝自贶 赠抚干
1244415,耒阳郭方中云先世自麻冈分派尝仕前朝今遁迹?亩至徵诗余以同志歌以赠之
717924,秋日挈舟茉莉沙追送孔参军即景口占以赠其行 其九
243913,怀鬼谷山思真洞天因咏以赠元规
1161713,敕赐长寿酒因口号以赠
444305,读虚空君阐《中论》妙文，漫拈此偈以赠
430415,和龙丁留别诗韵即以赠行
15048,苏州白舍人寄新诗有叹早白无儿之句因以赠之
166503,至花士自宣城归蒋陵求颂书比以赠
486185,宝粹二上人值两留宿西涧草堂明日赋此以赠（治）
803239,朱礼庭世讲回浙省侍，不及再与明秋京围之试，诗以赠行
744815,黄仲则景仁自太平来新安留试院月余将有武陵之行诗以赠别
1217499,江东魏元德所制齐峰墨于上都慈仁殿赐文锦马湩以宠之既南归作诗以赠云
295290,陈少蘅岁暮旋里留别答以赠言一章
492233,孙景武从赵伯友先生游宁都兹归省豫章诗以赠之并柬知己者 其二
537861,顾季狂见过狂谈竟月於其行也诗以赠之 其二
1053589,孔子韶方平与其侄处度相访于香山作此诗以赠之
716400,林叔君六十生日赋以赠之 其二
1141881,藩邸洪子深参军得旨江南印儒书归国次韵张清夫所赠以赠之
638325,有乡僧自钱塘来访诗以赠之
569170,闫希言先生道成而游戏人间任真自适闻之久矣今年来访弇园谈笑无间忽语余欲返武当故馆一叩元帝先生有故人不二头陀范丫髻亦余旧识也因歌以赠先生并寄声焉
741880,书傅素余诗卷后即以赠别
1062741,杨时可作十诗以寄河间诗之所及非吾僚则吾友也因悉次其韵以和之又以其所以赠我者复赠时可作还字韵 其六
957618,孙秀才下第暂还京口留别起居邀余和以赠行
563469,阳明子之南也其友湛元明歌九章以赠崔子钟和之以五诗于是阳明子作八咏以答之 其五
611056,米君梦过小斋赋以赠之
452296,辛卯孟夏海楼兄携女儿心莲来京盘桓数日时心莲才考中国美附中赋诗以赠
667694,刘子好辩而不遇诗以赠之
719428,某君年七十馀纳双妾赋以赠之 其三
748555,献姚石甫先生即以赠别 其三
546648,楚余生千里过访乞诗四绝以赠其行 其三
473276,钟山人昔曾被役西方暇日为予说所见因书以赠之
185339,小铜屏铸渊明归去诗并坡和章以赠子华侑以绝
422005,台南重晤王亚南先生，即以赠别
595150,河西务钱郎中邀饮歌以赠
1159706,苏州白舍人寄新诗有叹早白无儿之句因以赠之
463061,庚寅天中节胡马君欲赴青峰会暨屈原奖典礼叠韵以赠 其一
448879,于文清蒋光年二君同游镇江归赋以赠
859803,江侯邀予作山水书以赠之
716050,携公新栖仙掌峰诗以赠之 其二
1067820,从弟用前韵作人日诗见寄复和以赠之
494314,题邹山人江湖诗舫因以赠之
716049,携公新栖仙掌峰诗以赠之 其一
656681,旴江谢郡侯遣钟抡潘玉来习乡射礼二生归裁此以赠之
718413,文与也为予写西洞庭图赋此以赠 其三
827370,西邻家有恒户今检为地主，即咏七古以赠之
900204,庐陵李直卿以复名其斋求予诗久未暇也今日雪霁登楼偶得此遂书以赠顾惟圣门精微纲领岂浅陋所能发祇增三叹 其二
596762,百岁丈人何石龟入夜见访口占以赠
1243968,军中一彦士少好读书喜谈论文章工拙尤笃意诗学求指南于仆为赋一律以赠之
653136,启东医学将还吴葵丘谢缙为写云阳早行图并诗以赠时永乐丁酉岁十月既望也
792377,春日喜方耕霞丈见访即以赠别二首 其二
384176,蒋耘苔茂才求书扇，即以赠行
588374,己酉岁壬辰之夜梦与三洲李丈登高台遥望中原但见齐州九点在苍霭中隐隐可辨三洲曰宇宙内事吾儒分内事也曰子知分内之事则知尽分内之道乎三洲又曰吾今乃知居高则明处下则塞曰子知明塞之义则知尽居处之道矣三洲又曰天地山河存乎两界秦晋为首闽越为尾馀皆毛发肢节也曰子通督任之义则知通致理之源矣须臾云霞四歛皎日照衣环顾太和万物融合浑为一丸三洲曰此所谓弄丸者耶曰子知转九之义则宇宙之柄在手矣语罢而觉遂赋四章以纪其事因以赠三洲之
539309,新安汪惟一徐子与门生也李于鳞作长律题其竹丘卷云截作武陵溪上笛方知马援有门生惟一出以示余则于鳞仙逝矣感叹之馀辄步以赠
972308,卢谊伯宜之见过要斯远同赋以赠二首 其二
437286,延安滋戒师余初主安塞堡簿时相识也今戊子岁春被命作醮平凉偶得相会以四十三年之旧故集句以赠之
696299,涂德公疏救黄幼元廷杖寻奉诏释于其归也作此以赠
636436,刘明府仰山作宰行唐以外艰归里奉命焚黄赋此以赠
1221455,送李克进经历护二亲丧归葬维杨克进蓟州李息斋之孙工画竹寓居维杨先为平阳府经历二亲俱殁于闽至洪武壬子冬始得归葬徐大参命作诗以赠其行
1085865,予雪诗云不来平地只山巅朱钤干和云不能下乞俗人怜志在洁己陈知录云只可在山如去年志在恤民王抚干云散作人间大有年志在润物三子之志虽不同皆可嘉也各用其句作三绝以赠之又以一绝自贶 赠知录
903243,庐陵李英才自制墨与梅花写真艮斋诚斋又许其能诗十月七日携画见访且索拙语因成古风以赠
563468,阳明子之南也其友湛元明歌九章以赠崔子钟和之以五诗于是阳明子作八咏以答之 其四
992271,陈真卿将有秋试倏见访不日告行送于北门歌鹄庭为五言以赠
714862,方湘九年十五时割臂肉疗其伯父疾诗以赠之
717463,姬人墨西氏生日赋以赠之 其三
440475,次韵定庵秋心三首以赠志瑾学兄 其二
972569,过陈莘叔尹因以赠之
1062740,杨时可作十诗以寄河间诗之所及非吾僚则吾友也因悉次其韵以和之又以其所以赠我者复赠时可作还字韵 其五
773841,孙武水索题渡海图鹿鹿久未报适将有台湾之行即书以赠行
458255,贺新郎　为肖健理旧作，中多少年相共事，赋以赠之 其二
957153,倪文举奉常将归东林出示绮川西溪二赋辄赋长句为谢且以赠行
628524,林孟易昆玉山堂落成诗以赠之
690474,冰上人至自中宿以诗为贽病中下榻赋以赠之
722500,某君年七十馀纳双妾赋以赠之
121334,江侯邀予作山水书以赠之
447528,夜饮江上有佳人抱琴而至即席口占以赠
996092,次韵崔伯易席上所赋因以赠行二首 其二
1219529,陆仲明居笠泽，以卜养亲，裕如也，诗以赠之二首 其一
270679,吴汉槎归自塞外，邀同王阮亭祭酒毛会侯大令钱介维小集作歌以赠
499583,邹君伯谦南昌士族也挟笔墨来游金川谒诸文士余观其气宇不凡而有志于学告别归省诗以赠之
277889,在频山子德大弟宅喜晤子祯宋隐君歌以赠之
388512,张司礼尧督备显陵八年而始还朝节惠之政口碑载道余甚愧之敬之於其行赋五言近体以赠
440476,次韵定庵秋心三首以赠志瑾学兄 其三
457980,网友有名司马绿绮者，予睹其名而忆文君事，因赋《白头吟》。兴感有由，即以赠司马兄
220675,滕子京以真籙相示因以赠之
718414,文与也为予写西洞庭图赋此以赠 其四
667911,翟汝和雅善声诗兼工图画浪迹荆郢高视时人一方缙绅争先迎致潦草点缀价比南金然汝和不屑也今来谒予诗以赠之
784366,留宿陈卫瞻易安书室口占以赠 其一
563467,阳明子之南也其友湛元明歌九章以赠崔子钟和之以五诗于是阳明子作八咏以答之 其三
746430,连小瀛参军招同陈大园学博消夏出示所藏魏伯子蔡白采所画雪梅山水长卷及宋元以来各名家墨迹画册诗以赠之
383604,朱礼庭世讲回浙省侍，不及再与明秋京围之试，诗以赠行
644269,无旨兄将归番昜龙台寺遂用宋洪内翰游兹寺韵赋古诗一首以赠
830595,金缕曲·陈仲恕画扇以赠。取前人词流水半湾，斜阳一角，人在红楼之意，戏题一词
784315,冷子示关中友人赠诗且索予作赋此以赠
603038,梁季参见访诗以赠之兼忆黄惟让
900203,庐陵李直卿以复名其斋求予诗久未暇也今日雪霁登楼偶得此遂书以赠顾惟圣门精微纲领岂浅陋所能发祇增三叹 其一
323300,主簿程同年和永平门诗再赋四绝因以赠别
542492,吴子乔有弟从方士数年不归因访于梁宋间赋此以赠
604456,骆勉叔余四十年前同席友也一旦扁舟见访诗以赠之 其二
570914,周山人稚尊游豫章时己十余年矣今日忽访我金陵容鬓非昔而风范不衰复出吴兴徐生一札徐别亦十年屡有言其无常者似一日得两故人喜成二绝以赠稚尊时己丑之夏四月也 其一
843240,宽孙世讲画梅得自庭训顷将南游手书画便面为别赋谢即以赠行 其二
689767,广东省郎观子毅翩翩佳公子也读书能诗甚闲于礼以省命辅予安南之行雅相敬礼予暂留龙江君与士良典簿先造其国正辞严色大张吾军今子毅北辙而予南辕家贫旅久复送将归深有不释然者口占绝句四首以赠诗不暇工情见乎辞云尔
444232,乐乐伉俪见访赋此以赠 次凫公失喜韵
501495,广东省郎观子毅翩翩佳公子也读书能诗甚闲于礼以省命辅予安南之行雅相敬礼予暂留龙江君与士良典簿先造其国正辞严色大张吾军今子毅北辙而予南辕家贫旅久复送将归深有不释然者口占绝句四首以赠诗不暇工情见乎辞云尔 其二
1084549,前日寓邑偶值乍寒陈刘二生济我以衣童生济我以衾既别为二诗以赠 其二 赠童伟侃
1121464,世弼和酬因继韵以赠之
1156743,十年三月三十日别微之于沣上十四年三月十一日夜遇微之于峡中停舟夷陵三宿而别言不尽者以诗终之因赋七言十七韵以赠且欲记所遇之地与相见之时为他年会话张本也
827358,民国二十三年秋月，澄翰学校三十周年纪念，适余君永校六十三周年，题诗一章以赠之
501217,赠安南善书阮生生名太冲为予书春秋春王正月考及安南行稿予喜其楷法遒美更其字曰用和而诗以赠之
643058,张鍊师祈雨歌以赠之
559956,黄门给事中李公继白予邻邑友也兹拜命知永州府事将行愧无以赠聊述五十六字送之非敢言诗庸以识别云
538209,陈子道易向客徐相公所以忤陆都督出游谒余营丘有舍馆之契今年夏初复访海上留少时虽才气不衰而发种种矣赋此惜之且以赠别
794328,玉楼春 郑夫人将旋粤东，索余画小影，并题词以赠
792622,腊杪喜晤向缪两孝廉来都数日即移寓内城，作此以赠
585736,韶州清溪潮水山有泉甚灵黄生经府绣送予为行窝豹谷陈太守为之立石坊增置亭宇选南华僧如昌拨田住守如昌来见予天关诗以赠之用濂溪罗浮韵
158340,某近与和叔游景爱之不足因吟短篇以赠
1084548,前日寓邑偶值乍寒陈刘二生济我以衣童生济我以衾既别为二诗以赠 其一 赠陈元佐刘士宗
719427,某君年七十馀纳双妾赋以赠之 其二
690452,骆勉叔余四十年前同席友也一旦扁舟见访诗以赠之
1236838,陆仲明居笠泽，以卜养亲，裕如也，诗以赠之二首
143166,宣差曾思丁得替归诗以赠之
499841,楚王府典宝邓尚忠访余叙宗族之好诗以赠之
1090124,契师欲予隶书为此以赠
1194850,新秋月夕客有自远相寻者作吴体二首以赠
1247482,吴子仁氏有斑竹杖藏之数年矣文彩烨然坚劲可爱近以赠仲温葛先生葛公得之甚喜登山临水之兴浩然不可遏也过余求诗为赋二律 其二
889640,臻公释氏之秀者浮游徜徉迹接天下乃者归卧云山闭门不出遂命斋名曰戏鲸真得古惠师之遗趣也予喜其志因留二十韵以赠之
1190600,余寓汀州沙县病中闻前郑左丞璘随外镇举荐赴洛兼云继有急徵旋见脂辖因作七言四韵戏以赠之或冀其感悟也
717919,秋日挈舟茉莉沙追送孔参军即景口占以赠其行 其四
1064484,灯禅师出蜀住此山十年为作南食且约同住作此以赠
1172017,早秋京口旅泊章侍御寄书相问因以赠之时七夕
971878,斯远兄入城见使君郎中且谒尚书韩先生提属李丈题诗以赠四首 其四
542103,吴人郑速季入邺省兄中伯每谈倭寇之乱久而思归赋此以赠三首 其三
799494,河问小妓雅喜谈论闻其状甚悲感于太白糟糠养贤才珠玉买歌笑二语恻然反之书扇以赠
1085450,主簿程同年和永平门诗再赋四绝因以赠别 其三
1222127,冬至后在仪真馆赋诗以赠三伴使
209149,灵隐慧上人惠诗为古风以赠
992601,夜酌赵侯家闻合流曹光道诣府遂访之一夕纵谈明日光道赴本任邀余诗送因叙其言以赠焉
25415,蜀州郑史君寄鸟觜茶因以赠答八韵
716051,携公新栖仙掌峰诗以赠之 其三
563471,阳明子之南也其友湛元明歌九章以赠崔子钟和之以五诗于是阳明子作八咏以答之 其七
810979,春日喜方耕霞丈见访即以赠别二首
735717,将之永嘉曹侍郎饯予江上，吴客韦二丈为弹长亭之曲并吹笛送行，歌以赠韦即送其出塞
509631,去岁余与窗友赵伯颙同外补五月十有二日予至钱塘宿斋吴山而伯颙已先至因来叙话夜分始别匆匆一载矣兹予统师南征经伯颙之邻封伯颙亦来犒师亦以是日会于浔阳两情相对喜而复感而伯颙又亟欲别去予因口占三绝以赠 其一
800287,吴汉槎归自塞外，邀同王阮亭祭酒毛会侯大令钱介维小集作歌以赠，用东坡海市诗韵
1085448,主簿程同年和永平门诗再赋四绝因以赠别 其一
753156,赵樾村观察由蜀乞养回滇道老鸦滩枉顾话旧诗以赠之 其一
807111,千秋岁  沧州戴浴扶以人日悬弧作词以赠
716301,觉公善种兰诗以赠之
443818,世广金水二兄以三叠险韵诗见示，适余中酒，未克赓和，聊作一绝以赠
654991,驾部张员外汝弼以寒不及出饯赋诗见诮遂用韵二首一以赠沈一以答张 其一
494446,题曹宁波太守语所藏吕泾野八分书大科训规因以赠之
605131,陈集生太史以其弟乔生白玉楼记传奇索序诗以赠之
626641,癸巳九月与乔生先生夜话见其壁间画像乃十年前梁生所写抚今追昔有少壮之殊爰赋二诗以赠因书其上 其一
1247481,吴子仁氏有斑竹杖藏之数年矣文彩烨然坚劲可爱近以赠仲温葛先生葛公得之甚喜登山临水之兴浩然不可遏也过余求诗为赋二律 其一
553160,玉山县学教谕苏如愚先生谦恭乐善待予如师在任四年以母丧去职作诗以赠云
537860,顾季狂见过狂谈竟月於其行也诗以赠之 其一
583314,赣州节推邓诚之余同年也不相见者十年矣诚之过金陵会予于贡院因写在京时留别诸诗次韵答之并以赠行
561646,符子太仆出守韶郡赋此以赠符子昔尝作倅于韶也 其一
921309,圆通禅院，先君旧游也。四月二十四日晚，至，宿焉。明日，先君忌日也。乃手写宝积献盖颂佛一偈，以赠长老仙公。仙公抚掌笑曰：“昨夜梦宝盖飞下，著处辄出火，岂此祥乎？”乃作是诗，院有蜀僧宣逮事讷长老识先君云
905865,岳公来住涌泉愿为出化者十八人原上座因行袖诗谒筠溪老人风致清远可爱临行索偈书以赠之
546649,楚余生千里过访乞诗四绝以赠其行 其四
1219530,陆仲明居笠泽，以卜养亲，裕如也，诗以赠之二首 其二
886490,宣差曾思丁得替归诗以赠之
416009,将之皖，与都门诸友话别江亭，赋此以赠 其二
1155824,广宣上人以应制诗见示因以赠之诏许上人居安国寺红楼院以诗供奉
658098,文太仆之京过定山言别诗以赠之 其一
217919,李养源自号蒙泉求诗于东包某作此以赠之
783040,熊某为写小照诗以赠之
1072162,家弟元成将参部来取别是夕忽梦与元成跨马并行隐隐闻车毂声如在道途觉而作诗并以赠行
703153,吴人郑速季入邺省兄中伯每谈倭寇之乱久而思归赋此以赠三首
1156550,喜与韦左丞同入南省因叙旧以赠之
1082956,世弼和酬因继韵以赠之 其一
286856,金缕曲·陈仲恕画扇以赠
492232,孙景武从赵伯友先生游宁都兹归省豫章诗以赠之并柬知己者 其一
748554,献姚石甫先生即以赠别 其二
787006,同贻谋过敬亭松轩看竹小酌即题其壁间竹深留客图以赠
551170,王相如文学千里来访诗以赠别
308351,宽孙世讲画梅得自庭训顷将南游手书画便面为别赋谢即以赠行
1222533,次韵卢疏斋就以赠别二首 其二
10944,汉阴驿与宇文十相遇旋归西川因以赠别
811756,献姚石甫先生即以赠别
716404,林叔君六十生日赋以赠之 其六
807188,洞仙歌  龙理侯纳姬秦淮词以赠之
542101,吴人郑速季入邺省兄中伯每谈倭寇之乱久而思归赋此以赠三首 其一
617203,赞宇陈生在金陵为贾矣而手不释卷其志足嘉也诗以赠之
22840,友人下第因以赠之
556550,刘司狱考满索诗口占以赠之
790210,同王柳村徵君谒阮芸台制军，谈宴竟日，并撰“鸾凤一门才尽美，芝兰千载姓犹馨”楹联以赠。过蒙奖。借赋此志感二首 其一
466380,贺新郎　为肖健理旧作，中多少年相共事，赋以赠之
679979,士琛家宴归赋以赠之
1062745,杨时可作十诗以寄河间诗之所及非吾僚则吾友也因悉次其韵以和之又以其所以赠我者复赠时可作还字韵 其十
869995,钱君倚示诗有归吴之兴为诗三十二韵以赠
448125,流花湖观区谧庵演飞云腿拳长歌以赠
1062744,杨时可作十诗以寄河间诗之所及非吾僚则吾友也因悉次其韵以和之又以其所以赠我者复赠时可作还字韵 其九
715442,出伏波门游于伏波山之下有岩俯临漓水王副戎行馆在焉题以赠之
538034,张司礼尧督备显陵八年而始还朝节惠之政口碑载道余甚愧之敬之於其行赋五言近体以赠
772736,值拜石北港兰若夜话久之时将返槜李诗以赠别
617229,秋夜署中与兄汝载话别诗以赠之步其留别诗韵
640115,浙右苗帅率猺獠来归右司王恺往慰之因其回作诗以赠
579738,次庄定山韵二首一以忆定山先生一以赠用美寅长 其二
501211,予使日南道吉安府主来访舟中命医者王本达馈以善药时予困于秋暑心目为之豁然感其意走笔为赋长句以赠
991826,尹子渐归华产茯苓若人形者赋以赠行
113375,次韵斌老冬至书怀示子舟篇末见及之作因以赠
784367,留宿陈卫瞻易安书室口占以赠 其二
96770,同赋以赠·近别溪山郡
816924,同王柳村徵君谒阮芸台制军，谈宴竟日，并撰“鸾凤一门才尽美，芝兰千载姓犹馨”楹联以赠。过蒙奖。借赋此志感二首
138094,秀才欧世英惠然见访於其还也聊以赠之
843239,宽孙世讲画梅得自庭训顷将南游手书画便面为别赋谢即以赠行 其一
635506,龙江黄桓思出秋诗见质赋此以赠
113314,次韵崔伯易席上所赋因以赠行
270837,贺新郎·萧山任千之成进士归里作此词以赠之
688696,符子太仆出守韶郡赋此以赠符子昔尝作倅于韶也
260369,刘司狱考满索诗口占以赠之
620269,喜某世兄至都未几告别诗以赠行
