1225027,送余廷季赴海东佥宪
506993,送李侍书赴广东佥事
67536,送徐石东佥宪潮南分韵得潇湘
494381,送仪制顾郎中迁山东佥事
1226448,索士岩都事赴浙东佥宪以疾不能送作诗寄别
1217570,送余廷心待制之浙东佥宪
516742,送郑时用赴山东佥宪
516708,送王绘赴广东佥宪
1215171,送索都事调浙东佥宪
1211525,送王伯循御史赴广东佥宪时仆将回燕京
648797,萧启御史赴山东佥宪以何澄所画云山求题
491708,琼府与广东佥宪潘牧户部主事元伯常相见于琼台驿作此奉柬
1212072,同御史王伯循时除广东佥事济扬子江余除燕南照磨
480136,送徐石东佥宪湖南分题得潇湘
1209308,上浙东佥帅董公孟起
1218436,樵隐诗为浙东佥事毕公赋
566519,送邓行健之广东佥事
1216074,十月廿八日己酉台臣传旨拜广东佥宪赐四品服入觐谢恩作 其一
1218482,上分宪山东佥事
1216075,十月廿八日己酉台臣传旨拜广东佥宪赐四品服入觐谢恩作 其二
564054,送钟君升广东佥事
1229364,送索都事赴浙东佥宪
527633,送顾锦衣赴广东佥宪
1236505,十月廿八日己酉台臣传旨拜广东佥宪赐四品服入觐谢恩作
