578517,送人省亲归肇庆三首 其三
846087,宝庆三年奉上宁宗徽号导引一首
528834,秋日入佘山观昭庆三栝松
696169,送人省亲归肇庆三首
799214,乾隆癸丑中秋，陈榕溪夫子自三河遣人走京师，招湘读书官舍，且命即日束装，趁节赏月，盖下车之第七日也。距今夕乃五年矣。夫子俸满不迁，湘复留滞都门，偃蹇如故。极思来会此节，一话万端，以病新起不果。对月孤吟，惆怅无极，时嘉庆三年戊午八月十五夜 其一
812879,乾隆癸丑中秋，陈榕溪夫子自三河遣人走京师，招湘读书官舍，且命即日束装，趁节赏月，盖下车之第七日也。距今夕乃五年矣。夫子俸满不迁，湘复留滞都门，偃蹇如故。极思来会此节，一话万端，以病新起不果。对月孤吟，惆怅无极，时嘉庆三年戊午八月十五夜
1206514,长寿仙 道宫皇庆三年三月三日圣节大宴
541930,岁杪行上德平镇康安庆三王
661187,庆三从叔父宏庵翁八十寿
578515,送人省亲归肇庆三首 其一
799215,乾隆癸丑中秋，陈榕溪夫子自三河遣人走京师，招湘读书官舍，且命即日束装，趁节赏月，盖下车之第七日也。距今夕乃五年矣。夫子俸满不迁，湘复留滞都门，偃蹇如故。极思来会此节，一话万端，以病新起不果。对月孤吟，惆怅无极，时嘉庆三年戊午八月十五夜 其二
578516,送人省亲归肇庆三首 其二
281561,偶题·重庆三年史
