432245,游交芦庵僧人老且病出观华秋岳奚铁生西溪诸卷欲访厉太鸿先生墓为时已晚怅然归去赋此赠之
603017,访张子觉留饮赋此赠之
569588,故将李弃官学道垂九十矣而参方不休赋此赠之
568967,辰玉应试留都赋此赠之兼赠孟孺 其三
272958,李培生来客榄溪访予病榻赋此赠之
761920,陈迂谷中翰移居狮子岩，斋额曰栖野巢，赋此赠之
536827,参议范君视事三日即出泰安过莱海还赍表而北赋此赠之
600889,刘廷评镇中乞归养南还赋此赠之
494652,陈中舍使事毕将便还姑苏托兴赋此赠之
423255,游交芦庵僧人老且病出观华秋岳奚铁生西溪诸卷欲访厉太鸿先生墓为时已晚怅然归去赋此赠之 其一
268407,赋此赠之·为慕名山舍故邱
1223895,楚石琛藏主自蒋山归却欲就丛林阅藏同舟清江之上赋此赠之
569713,张肖甫司马特膺简命督抚全浙赋此赠之得二首 其二
269038,陈迂谷中翰维英移居狮子岩斋额曰栖野巢赋此赠之
404590,鹧鸪天·友人赴哈尔滨出席红楼梦学会，临行以临江仙词见示，赋此赠之
569712,张肖甫司马特膺简命督抚全浙赋此赠之得二首 其一
521749,锡山王应藩工真行书尤善题署予辑郡志为予留数月将归赋此赠之
728362,金缕曲  姜西溟言别，赋此赠之
668022,客有以琴书谒予者赋此赠之
568968,辰玉应试留都赋此赠之兼赠孟孺 其四
453468,读邹吉玲香艳断肠词赋此赠之
684030,辰玉应试留都赋此赠之兼赠孟孺
314993,临江仙·沪上重逢刘大杰，赋此赠之
571261,胡漳浦聂安吉敖缙云同领分教又同舟南还赋此赠之
776502,陈迂谷中翰维英移居狮子岩斋额曰栖野巢赋此赠之 其二
568965,辰玉应试留都赋此赠之兼赠孟孺 其一
683244,吴人杜惠由小侯弃官归卧好谈玄理余时避地过从甚得赋此赠之
538949,张山人游吴留一月以诗画为贽赋此赠之
792596,朱子磋明经归自饶阳，赋此赠之
683555,张肖甫司马特膺简命督抚全浙赋此赠之得二首
814654,陈迂谷中翰维英移居狮子岩斋额曰栖野巢赋此赠之 其二
1249554,刘宗海为余作清江春雨碧嶂秋岚二图赋此赠之
294065,鹧鸪天·友人赴哈尔滨出席红楼梦学会，临行以临江仙词见示，赋此赠之
404790,蝶恋花·戊寅秋御霜重来沪上，篝灯话旧，相与黯然，赋此赠之
765521,好事近 癸丑冬与黄子湘同从军于邗上重逢话别赋此赠之
570027,朱定国失意后访我金陵赋此赠之
819892,庶侯自宝应来并出近诗赋此赠之
1027347,元珍弟酌别赋此赠之
537978,向生上脩名臣录采及先事赋此赠之
538921,朱山人见过碧澜欢饮却去赋此赠之
536831,王生近诗爽然有天际真人想乃父沂州君濡首吏牍俱所不晓赋此赠之
538742,中庵上人结庵当虎丘之半赋此赠之
537327,吴人杜惠由小侯弃官归卧好谈玄理余时避地过从甚得赋此赠之 其一
427923,西江月 春江许承晃伉俪絜爱子辰自济南归厦门，中途过沪，留宿蜗居者三夕。倾谈甚契，戏效东坡俳体赋此赠之
569988,潘景升见访后即游南雍应试赋此赠之以壮行色
604980,立春日黄子吉同人自西粤右辖拂衣东归见过赋此赠之并致黄思之左辖张元辉观察许公弘刺史三同人
776503,陈迂谷中翰维英移居狮子岩斋额曰栖野巢赋此赠之 其三
42791,金缕曲·姜西溟言别赋此赠之
136037,元珍弟酌别赋此赠之
538582,邹处士赍茂陵书来谒赋此赠之
423256,游交芦庵僧人老且病出观华秋岳奚铁生西溪诸卷欲访厉太鸿先生墓为时已晚怅然归去赋此赠之 其二
426951,李培生来客榄溪访予病榻赋此赠之
539126,田子秇以诸生异等贡游两都署册曰南北大观赋此赠之
537328,吴人杜惠由小侯弃官归卧好谈玄理余时避地过从甚得赋此赠之 其二
901123,曾希曾见示近作赋此赠之
600914,春日李维任舟中召饮不至赋此赠之
570467,鳦先以书自通于屠青浦有国士之遇赋此赠之
782601,读任东涧史论呓林等作赋此赠之并示同学
568966,辰玉应试留都赋此赠之兼赠孟孺 其二
304301,庶侯自宝应来并出近诗赋此赠之
736695,慈航道人金正希先生女辛巳春同侄阆客入黄山扫蘖庵和尚塔相见云谷赋此赠之
224201,曾希曾见示近作赋此赠之
268430,陈迂谷中翰移居狮子岩，斋额曰栖野巢，赋此赠之
427781,临江仙·沪上重逢刘大杰，赋此赠之
