1103360,郑北山之元孙扁其楼王适庄为书北山之英四字求跋为作诗
307411,王汉宗同宿寺楼求跋所编族谱
1208806,柯敬仲持其乃尊山斋翁遗训诗求跋
1067090,山谷以寒岩子诗十二首作藁书词笔俱绝裴继之出示求跋因题绝句
185359,危金仙示容斋清晖堂诗求跋洪景庐乃骊塘之座
1099842,清古源以隆茂宗画华池佛求跋
337760,清古源以隆茂宗画华池佛求跋
357709,山谷以寒岩子诗十二首作藁书词笔俱绝裴继之出示求跋因题绝句
1034058,衡山何道士有诗声杨伯子监丞盛称之以杨所取之诗求跋其后
1138695,危金仙示容斋清晖堂诗求跋洪景卢乃危骊塘之座主也因成二首 其二
1138696,危金仙示容斋清晖堂诗求跋洪景卢乃危骊塘之座主也因成二首 其一
975834,度周卿携司马公送蒲中舍诗小程先生谒傅长官刺求跋
842743,王汉宗同宿寺楼求跋所编族谱
162318,林竹翁求跋
1045933,岷峨王高士赍牟中秘墨帖来求跋自言能护真气鍊大丹罹兵祸而辍同辈有志于斯事者皆然又言老人村凡二三百岁者亦皆死于兵嗟夫兵之祸生灵甚矣祸蜀则尤惨祸及高士更不轻矣遂为之赋诗
329796,岷峨王高士赍牟中秘墨帖来求跋自言
1144428,危金仙示容斋清晖堂诗求跋洪景卢乃危骊塘之座主也因成二首
883856,林竹翁求跋
1208362,草虫图（蝗螽斯螳螂蟋蟀图国子生求跋）
