1224507,滦阳邢君隐于药制芍药芽代茗饮号曰琼芽先朝尝以进御云 其二
379721,陈道人世缘不顺隐于术糊其口于四方云
901264,邠诗人张谷齐物先生驰名京师四方晚隐于终南山黄池谷陕右多画为醉仙因赠绘者
1061357,陈道人世缘不顺隐于术糊其口于四方云将复如京师乞怜于轻财重义之士冀或有怜之者因其求颂为作短句
1061307,师节受业师慈慧公喜草书得海老琴诀之妙以医隐于会稽比以草书四诗招师节归山师节次其韵报之余亦为赋四首 其三
233051,邠诗人张谷齐物先生驰名京师四方晚隐於终南
790432,家大人为言里中徐某隐于市。仅读学庸，逢人辄询字义。晚年喜为小诗，赏秋日偕众游山，徐后归得句云：人静一山空。饶有意味，因续成一律
1124557,师节受业师慈慧公喜草书得海老琴诀之妙以医隐于会稽比以草书四诗招师节归山师节次其韵报之余亦为赋四首
906874,捣药岩世传昔人炼丹得道今隐于此山下土中时得丹粒服之愈疾
1237410,滦阳邢君隐于药制芍药芽代茗饮号曰琼芽先朝尝以进御云
530512,孙羽士太初　关内人隐于浙江西湖之上
1061308,师节受业师慈慧公喜草书得海老琴诀之妙以医隐于会稽比以草书四诗招师节归山师节次其韵报之余亦为赋四首 其四
300971,读庄·道隐于小成
447623,游无锡蠡园，传范蠡携西施隐于此 其一
198242,捣药岩世传昔人炼丹得道今隐于此山下土中时
1061305,师节受业师慈慧公喜草书得海老琴诀之妙以医隐于会稽比以草书四诗招师节归山师节次其韵报之余亦为赋四首 其一
466988,游无锡蠡园，传范蠡携西施隐于此
883795,涪州江心有巨石隐于深渊石傍刻二鱼古记云鱼出岁必大丰端拱元年十二月十有四日昂自瞿塘回遵途于此知郡琅琊王公□云石鱼再出来岁复稔昂往而观之果如所说因歌圣德辄成一章
86226,有可·父隐于渔者
979140,金陵南数十里江心烈山崒然特起犹金山也家人云安得隐于此作一绝
533467,大慈仁寺国姻辞侯隐于此
1061306,师节受业师慈慧公喜草书得海老琴诀之妙以医隐于会稽比以草书四诗招师节归山师节次其韵报之余亦为赋四首 其二
1224506,滦阳邢君隐于药制芍药芽代茗饮号曰琼芽先朝尝以进御云 其一
220050,赠术士·君平隐於卜
908242,焦山汉末焦光隐于此是日乃其生日土人会者甚众
1218791,河南陆思颜两举不第隐于南浔以医卜治生作诗赠之
502756,题林逸人水竹居巷中州逸人隐于横塘所居环树脩竹凿池以通潮汐暇日常宴坐其中与道徜徉澹如也因以水竹居自名其堂且索予长句诗就主人击节而歌歌竟请书为赠文
447624,游无锡蠡园，传范蠡携西施隐于此 其二
287271,卜算子·吏隐隐于花
109534,涪州江心有巨石隐於深渊石傍刻二鱼古记云鱼
93973,竹隐·大隐隐於酒
1233630,滦阳邢君隐于药市制芍药芽代茗饮号曰琼芽先朝尝以进御云 其一
379697,师节受业师慈慧公喜草书得海老琴诀之妙以医隐于会稽
840346,族弟一元性嗜饮日在醉乡居近港河河畔有田赁与人陶岁取租若干为酒赀一日大醉往陶家索钱至陶侧而踣久不起人视之死矣其人无父母无昆弟无妻子族人议即死所而埋之陶侧噫合刘伯伦郑文渊为一人殆隐于酒者欤作诗以吊之并邀石公同作
180314,焦山汉末焦光隐於此是日乃其生日士人会者甚
