92850,明发三衢·云欲开时又不开
539914,顾尚书有示山僧偈曰着意寻空未是空僧强余和韵仍更为一转语问僧不了吾义吾偈固空了吾义吾偈又不空乎僧无语
403610,金缕曲 其二 心叔之墓已有宿草，敬老又不知以何时示疾，何时捐馆，桑户反其真，而我犹为人猗，悲夫
1034784,临邛张夫人之葬某既先事为之识竁今日月有时而某俨在衰绖义不获往吊又不能为文以侑虞殡命儿冲代赋
434435,月上海棠 诗社诸君复相属和又不免步韵献笑
570917,汪山人沂者故伯玉司马宗人也年七十九矣而诗不衰貌又不衰其游又不衰将之赵魏间依穆考功而老焉乞余诗为赠得二绝句 其二
570917,汪山人沂者故伯玉司马宗人也年七十九矣而诗不衰貌又不衰其游又不衰将之赵魏间依穆考功而老焉乞余诗为赠得二绝句 其二
440456,伯狐返乡过金陵又不能遇于归途长车上口号一首以寄
1216207,始余发京师时已闻河南平章公克复济南渠魁就擒计益都之寇可不烦馀力而下矣夫大将系国家安危行当慎重为宗社计舟中有怀援笔为赋是又不能不留情也大将名察罕特穆尔字廷瑞云
1100012,豨冻宜酒以皮为之入口爽而色可爱客以山谷醒酒冰比之余谓冰鳞物也其性寒比之玉狸又不瑩戏成一首
112514,颂古·不触又不背
1131430,林正甫察院出示送刘德修都运殿院诗并德修和章人事好乖置之勿复道也第一见倾盖如平昔而万里远别又不能一面得非皆有不偶然者存乎勉强继韵一写胸中磊块而结恋之怀又有诗所不能尽者
83786,城南上原陈翁以卖花为业得钱悉供酒资又不能
792273,予以直州判加捐州同指分皖省，乡诸君皆惜予不善择官，又不善择地，赋以自解
224636,孔庙既拜之后又不远三百里过泰山过汶河壮哉
1028778,玉溪梅株柯殊绝宣和间用事者尝图以进竟不报今乃弃置蔬畦摧折憔悴有可怜之态昨陪诸公往观共叹其不遇且约盛开时携壶酒为醉赏之适因循又不果因用韵吊之
478512,茅山中人皆不饮泉水悉下汲于注壑又不善蓄佳茗住兹三日清苦之味颇未沾唇既归作三十韵以自解兼呈社中诸友
90875,东园·两晨又不到东园
1136798,孔庙既拜之后又不远三百里过泰山过汶河壮哉斯游上日观作宾日歌少发葵恋之私
957181,病中不复问节序四遇重阳既不能登高又不觞客聊书老怀
1028975,林正甫察院出示送刘德修都运殿院诗并德修和章人事好乖置之勿复道也第一见倾盖如平昔而万里远别又不能一面得非皆有不偶然者存乎勉强继韵一写胸中磊块而结恋之怀又有诗所不能尽者 其一
633140,心公书来寄乾笋一觔不到天公书来寄乾笋一觔半又不到戏成
683924,汪山人沂者故伯玉司马宗人也年七十九矣而诗不衰貌又不衰其游又不衰将之赵魏间依穆考功而老焉乞余诗为赠得二绝句
683924,汪山人沂者故伯玉司马宗人也年七十九矣而诗不衰貌又不衰其游又不衰将之赵魏间依穆考功而老焉乞余诗为赠得二绝句
1028976,林正甫察院出示送刘德修都运殿院诗并德修和章人事好乖置之勿复道也第一见倾盖如平昔而万里远别又不能一面得非皆有不偶然者存乎勉强继韵一写胸中磊块而结恋之怀又有诗所不能尽者 其二
35588,周泰·名与诸公又不同
570916,汪山人沂者故伯玉司马宗人也年七十九矣而诗不衰貌又不衰其游又不衰将之赵魏间依穆考功而老焉乞余诗为赠得二绝句 其一
570916,汪山人沂者故伯玉司马宗人也年七十九矣而诗不衰貌又不衰其游又不衰将之赵魏间依穆考功而老焉乞余诗为赠得二绝句 其一
936214,城南上原陈翁以卖花为业得钱悉供酒资又不能独饮逢人辄强与共醉辛亥九月十二日偶过其门访之败屋一间妻子饥寒而此翁已大醉矣殆隐者也为赋一诗
730387,易实甫以司马温公残帖砚见赠乃温公与其侄九承议手劄后半段其眉亦缺数字就残石作砚叶东卿故物翁覃溪刻字题为断碑砚误上有元吾子行印及昌龄印昌龄满洲人乾隆时官学士多藏旧椠本书馀每见之印朱文曰长白敷槎氏李南涧日记载其人疑此为昌龄所刻诸家真迹法帖不详帖何名又不知真迹在何所此其半石也
514362,朝陵岁例同寅必有赠行诗以倡和为礼今次独无知我不工于此也往来三宿皆天日晴暖诗景满前竟不能措一辞诚如诸公所料行馆早起漫成一律志愧然继来者免我引玉之劳又不能不自幸也
