1228746,友人杨君所往金陵省忠襄公墓学士虞公送以诗壮郁沈痛使人流涕因用韵为别次篇远哀雍公以虞诗序及此故也二首 其二
945406,贾养晦以其父叔厚所赋临清亭诗求和因用韵寄题
131544,贾养晦以其父叔厚所赋临清亭诗求和因用韵寄
1131518,广东漕王侨卿寄蔷薇露因用韵
541123,读朱淑贞吊林和靖二绝因用韵偶成 其二
978880,白宋瑞自益州和予池上诗来因用韵奉简
853938,去年五月十七庐山祷而雨尝有诗今年五月十七昭武祷而晴因用韵
909219,秋霖喜霁适睹庙堂酬唱相去数千里而阴晴同之因用韵
1061234,法门复故圣恩深厚矣自此恐云巢不能久栖当为众一起承示佳句因用韵备载之
552824,七月望日黄仲瑱先生计偕录跋语且以近体诗见示因用韵别作一诗以谢
1089673,刘正言讲筵视职初直玉堂见案上所和高紫微阳字诗宠和二章见示因用韵答以一首深愧短拙
598033,至郡得郑使君见寄之作有怅别之意焉因用韵答之
1111440,下沱张西叔牡丹号奇品以诗寄花因用韵谢
379635,法门复故圣恩深厚矣自此恐云巢不能久栖当为众一起承示佳句因用韵备载之
1003765,丙子寅月九日五鼓梦馀忆旧作因用韵
1142807,钱秀才要社日呈汉宰诗书以予之钱以长句为谢饶秀才又用社日韵作诗见投因用韵并答二君
956361,予寓邑中与诸子讲学巨山侄孙转示初冬书事因用韵
945549,如心侄有诗因用韵
1070315,叔问观韦苏州诗至萧条竹林院风雨丛兰折幽鸟林上啼青苔人迹绝燕居日已久夏木纷成结几阁积群书时来北窗阅以为适与景会写以寄予因用韵书怀云
131247,如心侄有诗因用韵
1235416,友人杨君所往金陵省忠襄公墓学士虞公送以诗壮郁沈痛使人流涕因用韵为别次篇远哀雍公以虞诗序及此故也二首
935164,予出蜀日尝遣僧则华乞签于射洪陆使君祠使君以老杜诗为签予得遣兴诗五首中第二首其言教戒甚至退休暇日因用韵赋五首 其三
1101679,壬午九日士资自广运铁南雄归途过家士贽士赟有诗因用韵
505576,是夜蒙公相寄示三首因用韵以成 其二
886144,下沱张西叔牡丹号奇品以诗寄花因用韵谢 其二
1217803,松阳学舍读张修撰诗因用韵述怀二首 其二
698022,读朱淑贞吊林和靖二绝因用韵偶成
886145,下沱张西叔牡丹号奇品以诗寄花因用韵谢 其一
494915,张东所与潘黄门用涯翁韵往复予因用韵言别三水
353378,刘正言讲筵视职初直玉堂见案上所和高紫微阳字诗宠和二章见示因用韵答以
1209530,连国华饯予出天山因用韵
184237,和答吴尉俞商卿见赠因用韵送行
1118710,予出蜀日尝遣僧则华乞签于射洪陆使君祠使君以老杜诗为签予得遣兴诗五首中第二首其言教戒甚至退休暇日因用韵赋五首
541122,读朱淑贞吊林和靖二绝因用韵偶成 其一
935162,予出蜀日尝遣僧则华乞签于射洪陆使君祠使君以老杜诗为签予得遣兴诗五首中第二首其言教戒甚至退休暇日因用韵赋五首 其一
521567,丙寅春胡大声自桐庐守参政湖藩过松话旧诵予送通守殷君诗因用韵赋以识别
1217802,松阳学舍读张修撰诗因用韵述怀二首 其一
935163,予出蜀日尝遣僧则华乞签于射洪陆使君祠使君以老杜诗为签予得遣兴诗五首中第二首其言教戒甚至退休暇日因用韵赋五首 其五
1028778,玉溪梅株柯殊绝宣和间用事者尝图以进竟不报今乃弃置蔬畦摧折憔悴有可怜之态昨陪诸公往观共叹其不遇且约盛开时携壶酒为醉赏之适因循又不果因用韵吊之
698427,是夜蒙公相寄示三首因用韵以成
1236377,松阳学舍读张修撰诗因用韵述怀二首
163492,丙子寅月九日五鼓梦余忆旧作因用韵
1028854,余护客至盱眙忽有召命应广文有诗相庆因用韵以谢
505577,是夜蒙公相寄示三首因用韵以成 其三
864259,顷在庐山与故友可师为诗社尝次韵和予诗云空中千尺堕柳絮溪上一旗开茗芽绝爱晴泥翻燕子未须风雨落梨花重江碧树远连雁刺水绿蒲深映沙想见方舟端取醉酒酣风帽任攲斜后三十年避地剡溪山中时可师委蜕亦二纪矣灵隐明上人追和此为赠感念存没泪落衣巾因用韵谢之
191495,余护客至盱眙忽有召命应广文有诗相庆因用韵
237597,下沱张西叔牡丹号奇品以诗寄花因用韵谢
199728,白宋瑞自益州和予池上诗来因用韵奉简
511101,与子长说诗忽闻有谈方伯华容刘先生德政者因用韵以示
935161,予出蜀日尝遣僧则华乞签于射洪陆使君祠使君以老杜诗为签予得遣兴诗五首中第二首其言教戒甚至退休暇日因用韵赋五首 其四
505575,是夜蒙公相寄示三首因用韵以成 其一
367364,壬午九日士资自广运铁南雄归途过家士贽士赟有诗因用韵
935165,予出蜀日尝遣僧则华乞签于射洪陆使君祠使君以老杜诗为签予得遣兴诗五首中第二首其言教戒甚至退休暇日因用韵赋五首 其二
206041,立春前一日再雪因用韵
963135,三月十四日送焘东下至龙爪滩过虞开国坟庵见壁间虞仲易观棋诗有天上人间元一气如何顷刻烂樵柯之句雁湖甚赏之因用韵反骚
237598,因用韵谢·天香吹落五云来
1090620,广东漕王侨卿寄蔷薇露因用韵 其二
1228745,友人杨君所往金陵省忠襄公墓学士虞公送以诗壮郁沈痛使人流涕因用韵为别次篇远哀雍公以虞诗序及此故也二首 其一
1030588,双林壁间有人写董仲达希字韵诗和者纷纷因用韵
882766,和答吴尉俞灏商卿见赠因用韵送行
1090619,广东漕王侨卿寄蔷薇露因用韵 其一
907556,立春前一日再雪因用韵
