677515,赠李二守 其二
542296,张二守鸣远携酒夜过禅房率尔赋赠
361604,答前人喜杭越二守赓唱
561558,赠萧二守赴任济宁 其一
695613,送朱二守二公子二首 赠长公
586119,九日薄暮至镇江闻二守梁宗烈以入贺行大负心约惘然者久之诗以寄候聊致惓惓
682779,用韵答廖梅南二守
674289,化州何二守邀饮石宁铺醉归道中口占
922248,又次韵二守许过新居
589146,同杨二守游玉台用壁间韵
571168,和罗二守山中累有戒心之作
677514,赠李二守 其一
496053,沁园春 其二十 赠余东台二守
558257,送姚良甫二守之京
1087230,会郑韩二守乐语口号
660422,靳二守昆仲文武联科
660251,雪湖山庄雅集次韵时方即席家下忽报屈二守及门遂不及尽欢而别
571249,刘二守业由金华改处州奉赠一首
588986,偕太守左双江二守赵合江郊游
674490,三月在旌德次姜二守壁间韵
561559,赠萧二守赴任济宁 其二
661216,复过常州承李太守罗二守饯于毗陵驿中
559262,送朱二守二公子二首 其一 赠长公
561254,赠柳州桂二守
583038,上二守祷雨有应
571116,送奚二守应朝北上
701128,讨贼和平喜伍二守寄示班师之作次韵二章
697599,赠李二守
589081,感时呈郭二守
664510,送吕二守西征二首 其二
590839,赠戴龙台之任惠州二守
586435,用韵答廖梅南二守 其二
816825,秋晴游妙相庵同周二守卿周大凤笙筱园绍由弟
922247,次韵惠循二守相会
686739,送吕二守西征二首
1250949,题九华山图为陈二守
571043,竹亭歌和复汪二守
586434,用韵答廖梅南二守 其一
99712,又次韵二守同访新居
571205,讨贼和平喜伍二守寄示班师之作次韵二章 其二
1040129,答前人喜杭越二守赓唱
579257,刘二守百可园
583083,送别王二守
496166,菩萨蛮 其一 赠赵二守
751748,秋晴游妙相庵同周二守卿周大凤笙筱园绍由弟 其二
660459,送靳二守九载考绩之京
571622,送萧二守之济宁
664509,送吕二守西征二首 其一
571204,讨贼和平喜伍二守寄示班师之作次韵二章 其一
600643,茅中峨觐毕之建宁二守任
599825,十六日偕胡余二守登柳州南楼小酌
586436,用韵答廖梅南二守 其三
922249,又次韵二守同访新居
571451,送袁二守之武□
661217,罗二守复携酒送至新闸
495766,烛影摇红 送二守之任毗陵
660359,赠屈二守考绩之京
559263,送朱二守二公子二首 其二 赠次公
664080,送郭二守述职如京师
342241,会郑韩二守乐语口号
688737,赠萧二守赴任济宁
499136,元夕赠苏州二守如雍侄
663609,重阳冷二守过访留酌
672159,次韵复潮阳柯二守
531240,书扇赠薛曲泉二守
603204,答洪孺成姻家兼呈赵二守
571621,送李东平二守
100518,次韵惠循二守相会
588920,象川林少参旅顾致谭二守瓶台故人消息
698693,菩萨蛮 赠赵二守
751747,秋晴游妙相庵同周二守卿周大凤笙筱园绍由弟 其一
673026,赠二守李春江
468284,次舍弟忠寄杨胡二守韵
681074,赠司训黄文光擢重庆府二守
