678729,赐游万岁山
1111293,拜赐宫花纪恩诗
352171,赐史祥诗·伯煚朝继重
813768,壬辰1832春捧檄来澎随同周芸皋观察查办抚恤蒙赐书画联扇赋诗申谢
296618,咏篱仙馆·龙池赐酒敞云屏
13449,奉和圣制九日言怀赐中书门下及百寮
482172,元夕赐观灯诗 其五
1006349,比访叔才旋蒙赐诗以贫不能留客为愧次韵
813745,屡辱侍读王先生以卢藏用种明逸常彝甫见嘲未敢用鄙句唐突又蒙赐口号四章语意郑重督和甚切勉遵无言不酬之义敬答四首以当解嘲
465917,太平花，社稷坛所见。小花浅红纯白，似桃而四出，原出蜀之青城山，千百枝萼繁密若缀骈萃成海，宋仁宗曾赐名太平瑞圣花
555065,止赐酒
840520,贵阳李芘园尚书师命题赐环纪恩图三首 其一
788298,赐庄亲王
1084891,丁丑二月二十一日集英殿赐第
307256,陈以光先生屡赐诗词惭于应答写此见意
1066782,侍读官程伯禹以赐茶寄汪敦仁教授蒙惠四胯以诗纪谢
560422,杨湖草堂为王彦赐题
650709,元夕赐观灯 其七
128090,谢赐丹桂·秋入幽岩桂影团
1077978,恭闻诏书褒悼陈少阳赠官与一子恩泽赐缗钱五十万感涕四首 其二
577962,赐观灯诗五首　永乐二十年正月十五日进 其二
775790,道光壬辰1832春仲周芸皋观察来澎抚恤蒙赐诗文集五种即用襄阳集春游杂兴八首韵赋呈 其二
189804,赐馆阁官花酒·宜秋门外喜参寻
902008,贺师垣赐御书一德格天之阁牌并镀金器皿青罗凉伞从人紫罗衫镀金腰带仪物等四首 其一
486676,赐太子少师姚广孝七十寿诗二首 其二
1183578,奉和圣制送张说上集贤学士赐宴赋得谟字
1087836,秀野以喜无多屋宇幸不碍云山为韵赋诗熹伏读佳作率尔攀和韵剧思悭无复律吕笑览之馀赐以斤斧幸甚 其三
735826,屡辱侍读王先生以卢藏用种明逸常彝甫见嘲未敢用鄙句唐突又蒙赐口号四章语意郑重督和甚切勉遵无言不酬之义敬答四首以当解嘲 其四
981129,上巳赐宴琼林与二府诸公游水心憩于西轩 其一
429640,四叠均谢天琴老人赐诗并以拙句为制艺
238225,茶山堂·山是朝廷赐
583427,送饶廷赐之汀州
887261,谢御赐紫金鱼袋乌纱象简
260362,九日昆峰赐饮拟和刘静修先生九日九饮歌韵体
682018,赐太子少师姚广孝七十寿诗二首
340519,太平欢·圣节赐宴
811698,赐抚远大将军图海二首
1057264,诏赐南园示亲党
428549,张相臣姻兄精于医学，寓居津门，每于诊治之暇，时常著书。丁卯春，偶以咏怀诗赐及命和，江才识浅陋，唯有勉步原韵，凑四首奉和而已，未敢云诗也 其一
736275,邢太保玠征倭所赐上方剑歌
13736,敕赐长寿酒因口号以赠
151054,讲官沈大监献东宫米字回赐笔墨因作小诗以求
873043,五日东宫赐酒肴
1156380,闻行简恩赐章服喜成长句寄之
556529,九日昆峰赐饮拟和刘静修先生九日九饮歌韵体 其二
669698,赐枇杷
275272,咏枣·紫衣传赐出蓬壶
54720,西城宫词·新传牌子赐昭容
936620,恩赐龟紫二首 其一
441329,吕三惠赐画一纸画集二册因急就一绝自题履错集却寄
775675,壬辰1832春捧檄来澎随同周芸皋观察查办抚恤蒙赐书画联扇赋诗申谢 其一
644735,谢蜀王抚问赐药六首 其三
1007323,乾会圣节赐宴
362172,幸天长赐僧广宝
142679,恭和御制赐吴叔告已下闻喜宴诗
1034315,十八日上寿退赐坐十九日贡院锡宴二十一日紫宸殿御筵即事 其二
1233156,前御史杨元诚辞官归第御书山居二字赐之公卿大夫赋诗以荣其归余访旧万松山拜观宸翰及诸吟卷席间以重来休沐地真作野人居分韵得居字
3047,敕赐百官樱桃
351931,以茶芽焦坑送周德友德友来索赐茶仆无之也
1171740,始忝四座奏状闻荐蒙恩授官旋进歌诗延英宣赐言怀纪事呈同馆诸公二十四韵
209007,孟童中异科而还来访余於行都赐第辄赠以诗
561840,纪赐十二绝 其三 赐金寿仙二
561840,纪赐十二绝 其三 赐金寿仙二
698982,内阁二瓷缸乃宪庙所赐种莲者三年不开已今年盛开因赋二首纪事
294483,五十双寿·六载赐环日
561630,扈跸南巡自出京至在途蒙恩赉诸物各恭纪一绝以志荣感其酒馔牲品等物尤多盖不能悉纪也 其十一 赐磁器瓯碗十二件
383687,谢绎梅中丞过邑赐访不遇题诗驿壁而去赋此寄谢
1192205,中和节赐百官燕集因示所怀
209188,赐第登楼·避俗懒成癖
128490,梦中作·赐得渊书下太微
317407,示内绝句·珍重秋粮下赐难
505180,谢蜀府赐口衲歌
563090,敕赐午门百麦饼宴恭纪 其一
1251473,和赐瞿长史象牙笏韵
1167005,朝日敕赐百官樱桃
1099301,赐宜春易太极
144311,苦笋·临轩解褐赐汤沐
984499,水调歌头 呈判府宣机先生乞赐笑览
512347,内阁二瓷缸乃宪庙所赐种莲者三年不开已今年盛开因赋二首纪事 其二
1165150,恩赐乐游园宴应制
893820,观文丁右丞求赐茶因奉短诗二章 其一
867979,和九日赐宴琼林苑
561719,赐游小山并金海泛舟至广寒殿诗八首 其八 金海
152086,邦衡侍郎留金陵再用津字韵赋诗谢送赐茗复以
486400,怀仙歌赐周玄初（永乐四年九月十九日。见周玄真《鹤林类集》）
809008,春日内苑赐宴诗并序
613126,甄邦圣为兄鸣冤世所同义反坐十年神人共愤既而得释天心见矣廿馀年来家道徐徐而起莫非天祐岁丁丑正月邦圣病笃梦一神披发抚圣背曰义士也为兄报仇赐汝一纪之寿觉而渐愈始知玄帝所赐也岂非天哉足以传矣诗以纪之 其一
613126,甄邦圣为兄鸣冤世所同义反坐十年神人共愤既而得释天心见矣廿馀年来家道徐徐而起莫非天祐岁丁丑正月邦圣病笃梦一神披发抚圣背曰义士也为兄报仇赐汝一纪之寿觉而渐愈始知玄帝所赐也岂非天哉足以传矣诗以纪之 其一
788299,赐果郡王
53378,丁丑五月大旱雩祷上斋居御讲颁赐素蔬一盒
179682,赐进士诗韵·云汉昭回下建章
668646,腊日与才伯小酌追怀去腊午门赐燕
95359,呈郭峡州·往者枉书并赐诗
594003,贺蒙中丞加恩赐诰拜寿太恭人
194188,五日东宫赐酒肴
1078878,某上章辞免召命蒙恩矜许仍赐羊酒存问自念衰残辱此异数不胜感天荷圣之情谨课成拙诗一首
570890,辱宗伯李公赐和六章词丽意深不揣续貂四绝仰尘清览 其一
585276,恭纪圣恩春日同游并颁赐殊品 其七
326969,伏蒙致政少傅相公宠赐寄题武夷精舍诗
124706,闻后苑赐宴
617787,赐环纪恩 其二
185937,赐陈抟·餐霞成鹤骨
1071682,孙朝散母封彭城郡君赐霞帔以诗贺之
814472,送嶰筠赐环东归二首
35163,蒙恩赐酒旨令醉进诗以谢
482066,元夕赐观灯应制五首 其五
428552,张相臣姻兄精于医学，寓居津门，每于诊治之暇，时常著书。丁卯春，偶以咏怀诗赐及命和，江才识浅陋，唯有勉步原韵，凑四首奉和而已，未敢云诗也 其四
577964,赐观灯诗五首　永乐二十年正月十五日进 其四
234470,过秀邸赐第
365335,上巳日玉津园赐宴是日杂端为主人
672194,赐宴
1078278,以旧赐战袍等赠韩少师二首 其一
183886,恭和御制赐太师致仕文彦博五言六韵诗
808185,西湖月  明慈圣李太后赐画九莲观音像在灵隐寺借秋阁
1115054,伏蒙赐和复用韵二章拜呈可谓出丑衒媸惟自叙鄙怀并以见区区敬慕之意姑惟教之是所愿也
522484,晚坐东轩睹水木山亭知为夏忠靖公赐第感旧怀贤得绝句八首 其六
561829,奉次少师桂翁赐宴纪恩 其一
518455,敬蒙书赐梧冈二大字伏睹八法精妙超入神品宠荣所及不胜喜庆十袭珍藏永为家宝谨赋诗谢恩
939512,赓上赐病归韵
883639,次韵公绍贺崇静之赐金紫 其二
590880,赠曾元山赐还临川二首 其一
561737,万寿日赐宴内殿赐宫制彩花并柏叶一枝金筒簪之
561737,万寿日赐宴内殿赐宫制彩花并柏叶一枝金筒簪之
471777,赐太液乘舟
863558,贺温正言赐紫
199102,咏史·赐也相国尊
1111048,秀野以喜无多屋宇幸不碍云山为韵赋诗熹伏读佳作率尔攀和韵剧思悭无复律吕笑览之馀赐以斤斧幸甚
79,赋秋日悬清光赐房玄龄
506709,元夕赐观灯 其三
1074595,昨日召卿等自卿私第泛舟经景龙江游撷芳园灵沼闻卿有小诗今俯同其韵赐太师 其三
327621,奉和御制上巳日赐宴
193177,秘阁赐讌送右谏议大夫种放得假归终南山应製
993311,赐绯鱼
956596,青城山会庆建福宫宫旧名丈人观，予为请于朝，赐今名。入山前数日，敕书至自行在，予就设醮以祝圣人寿云
454746,退密老赐寄《鱼韵唱和三百首》读后效作
822349,减字木兰花 尹默赐题寄庵词卷二首，次韵述谢 其一
482068,元夕赐观灯 其四
224014,幸赐披·荜为扉阖槿为籓
246348,踏莎行·萧斋翁赐法书索作
18719,闻行简恩赐章服喜成长句寄之
561839,纪赐十二绝 其二 赐银像生人马并太平牌子四
561839,纪赐十二绝 其二 赐银像生人马并太平牌子四
357918,彦韵三和·韶颜秘殿赐恩袍
214124,九日赐宴琼林苑作
385509,抚问赐药·贤王思贱士
1087834,秀野以喜无多屋宇幸不碍云山为韵赋诗熹伏读佳作率尔攀和韵剧思悭无复律吕笑览之馀赐以斤斧幸甚 其一
684663,元夕赐宴观灯应制
1154242,奉和李令扈从温泉宫赐游骊山韦侍郎别业
201802,依韵和蔡相公宣赐
891772,赐杨万里
700952,大司农李葵孺先生得请赐乘传归粤赋此以祖其行
1221892,宋徽宗赐周准人马图
48426,赐藕·只向名花看画图
700313,晚坐东轩睹水木山亭知为夏忠靖公赐第感旧怀贤得绝句八首
426360,甲寅夏历七月十三日益老两度赐宴赓得一读吴门胡老“搁笔吟”回周后陈以光老师又以“答谢胡心斋老先生四律”相示，因用其韵胡乱凑成四首，分呈胡李两老乞正，并面请益老斧削 其一
966372,禁直赐果
642143,和晏助教赐茵褥诗
264735,金缕曲·元韵酬彭醇士赐和五九初度此词
282442,辘轳金井·避暑天赐庄冬天大学
237176,恭和御制赐进士韵
561729,详定试卷上命中官赍赐丁香花一枝并金筒簪之恭纪四绝 其四
453215,仙韵二首赠隅山主人并谢惠赐画作 其一
923007,次韵子瞻锁院赐酒烛
561627,扈跸南巡自出京至在途蒙恩赉诸物各恭纪一绝以志荣感其酒馔牲品等物尤多盖不能悉纪也 其八 赐綵装松竹梅鸾带
112627,和御赐诗
10418,奉酬茅山赠赐并简綦毋正字
561753,赐川扇在西苑作 其一
506706,题赐上尊封识小帖
604530,恩诏赐复冠带县大夫雨中携酒赐贺赋此呈谢 其四
604530,恩诏赐复冠带县大夫雨中携酒赐贺赋此呈谢 其四
53382,端午赐黄金艾叶银书灵符等物岁以为常
738533,钱唐相国分饷上赐郑宅茶寄奉老母
651636,赐纱
517528,立春早朝赐酺答郑编修之作
383772,戊寅正月上出内府画册命讲官六人各题四幅分得宣庙御画二幅诗成奏上各赐银叶一包
506713,元夕赐观灯诗 其四
728895,文渊阁赐茶
1063464,郡人献笋守以分饷郡寮而吏独见遗守知之命追赐焉盖不出既久而人忘之也因成一篇
162286,赐赵士忠
905485,所苦之中无以遣闷更题新竹别献五章幸赐披览 其一
788271,赐大学士白潢
66433,赐方教授诗·闻说眼空天下士
420365,青门饮 印敬铭师赐哈密瓜，赋谢
110923,御赐钟·大声扣洪钟
79885,散吏·拜赐明时散吏名
209247,赐第登楼·病思归心走兔
1184443,奉和敕赐公主镜
201988,宫词·中宫赐雪玉成峰
228726,伏蒙赐和复用韵二章拜呈可谓出愧炫媸惟自叙
894625,赐知贡举晁迥 其二
1215941,七月十二日奉诏以香酒赐曲阜代祀孔圣庙越五日别翰林诸友 其二
1074590,太师以被赐暹字韵诗前后凡三次进和盖欲示其韵愈严而愈工耳复以前韵又赐太师
1074590,太师以被赐暹字韵诗前后凡三次进和盖欲示其韵愈严而愈工耳复以前韵又赐太师
909942,木文真人章圣朝合州进到其事甚怪至京其木中人呼万岁者三诏赐崇福宫
495996,法驾导引曲 上赐金符金仙人银太平牌应制三阕 其三
731144,乾隆九年十月重葺翰林院落成车驾临幸赐宴送大学士掌院事鄂尔泰张廷玉进署以张说东壁图书府五律字为韵赋东字音字二首敕诸臣各分一字赋诗 其一
1197015,皇太子赐燕诗
1149934,上巳日赐裴度
53385,丙戌秋月以皇次子生赐万喜金字彩花金币等物
218221,及第谢恩和御赐诗韵
991181,和范景仁王景彝殿中杂题三十八首并次韵 其十九 赐书
650321,端午赐宴观击毬射柳 其三
957642,和张芸叟左司被赐资治通鉴
613220,赐宴 其二
1038216,西归日琼林苑赐宴即席
276134,诸公赐和秋夜旅怀之作，叠韵奉酬
864245,舟行扶病访王文孺曜庵且蒙和赐佳章次韵为别
788274,赐大学士王顼龄
471998,纪赐四十首 其三十七 戊子九月寿宫随驾步视宝城还于东廊称贺玉音宣劳赐茶并赉綵花文绮等物
471998,纪赐四十首 其三十七 戊子九月寿宫随驾步视宝城还于东廊称贺玉音宣劳赐茶并赉綵花文绮等物
385507,谢蜀王抚问赐药
1023947,捧赐佛照禅师号敕黄示众
541652,九日圣驾阅寿宫奉命同丰城李侯守崇文门时有綵罗之赐 其一
645112,蒙恩赐归省恭纪
385247,端午赐扇·剡藤湘竹巧裁将
515489,自六月来屡赐杨梅枇杷及鲥鱼诸鲜
577535,元宵赐观灯诗五首 其四
39403,艳歌行·长者赐颜色
650003,清平乐 其七 赐从游万岁山词
791566,冉石云丈赐和旧作，仍步原韵二首 其二
654696,传胪之明日赐宴礼部凡供事者皆与焉都宪屠公又赋一律仆再和之
92917,生辰·少阳拜赐太阳旁
272776,恭和御制赐朝鲜琉球安南诸国使臣诗
135162,三月七日上赐牡丹并蔷薇露劝酒
1166350,恩赐乐游园宴
514923,七月二十日文华殿后讲毕上顾中官赐讲臣冠带靴袍臣敏政预赐织金云雁绯袍一有副金带一乌纱帽及皂靴面谢讫上顾谓曰先生辛苦共对曰此皆职分所当为顿首而退
514923,七月二十日文华殿后讲毕上顾中官赐讲臣冠带靴袍臣敏政预赐织金云雁绯袍一有副金带一乌纱帽及皂靴面谢讫上顾谓曰先生辛苦共对曰此皆职分所当为顿首而退
1121029,闰月之腊诏赐银合腊药三首
698015,和穆少春后赐诗扇二首
1244669,庚子日南至愚得子枫林朱先生允升赐书并诗举资中黄先生书成得子为况且其令郎以寅年寅月夜半生而是子以子年子月日中生偶亦相类次韵谢之
1151840,敕赐百官樱桃
383156,丙戌冬至南郊扈驾圣母轸念天寒特赐姜苏杏仁一盒
158533,予连日奔走吏事蚤出暮还君然兄数赐临问乃不
606636,赐飞鱼服
953861,清明赐新火
803319,余在顾辛庄佣书有李笑檐顾子白赐题咏白牡丹五十韵得一先韵
69627,小游仙·元君赐觐素华台
267001,即席谢胡老赐宴
159057,舍人院观御篆微阁榜赐宴奏御
880232,送梁伯赐归括苍三首 其二
1039892,谢赐飞白御书晏群玉殿
788276,赐尚书孙柱
757032,恭和御制赐朝鲜琉球安南诸国使臣诗
906832,和进樱桃上宣谕近臣洛中今年进樱桃甚大当日分赐
1126884,谢公择舅分赐茶三首
1058808,奉和御制颁赐荔枝
911583,恭谢侍读仁皇训典彻章御赐杜工部紫宸殿诗退朝口号并鞍马香茶 其一
432310,虚度八十深荷叶老惠赐五言三律敬步原韵并乞郢政
267037,赋谢乔木先生赐画
103984,杂题·天子赐烛昏夜时
323784,清明日赐宴琼林苑奉酬宫使太师相公
385457,谢蜀王赐果
650320,端午赐宴观击毬射柳 其二
533227,端午赐扇綵楼
607657,明会典成赐宴礼部有述馆课
696792,元夕赐观灯
1123434,赐马廷鸾四首
991180,和范景仁王景彝殿中杂题三十八首并次韵 其十七 赐食
547922,纪赐四十首 其十一 戊寅二月大婚礼成赐万喜金字綵币等物
547922,纪赐四十首 其十一 戊寅二月大婚礼成赐万喜金字綵币等物
561452,皇储恩例赐给二品诰命感忭有作 其二
857794,依韵和蔡相公宣赐金橘
645839,车驾临蒋山于崇祷寺赐高僧斋议设无遮会谩成口号 其二
609302,孟津殿下新建书堂得请赐额勉学书院恭赋
961588,赐节
138701,赐余复·临轩策士岂徒然
686224,十骥咏 御赐千里雪
169964,南园荔子熟名曰魏紫盖是陈家紫种以先公赐封
561830,奉次少师桂翁赐宴纪恩 其二
384924,林赐阶邑宰以诗赠行，赋此答谢
322507,南归·廿载劳人得赐闲
529376,介溪宗伯荣赐麟袍和甬川少宰韵
1189736,题李相公敕赐锦屏风
520022,题杂画赐门正相傧 其五
504063,御赐西马
541665,雪中谢赐藕少宰裴公元闇司寇谢公汉甫中丞郭公哲卿有作聊和 其二
506712,元夕赐观灯诗 其二
810408,恭和御赐杨制府诗原韵有序
71410,一剪梅·天赐平遥好歇心
371904,哭斯远·彤庭将赐第
1036961,清明日赐宴琼林苑奉酬宫使太师相公 其二
60260,元夕午门赐观灯
734076,闰三月二十八日午门应制赐宴及烛
650006,清平乐 其十 赐从游万岁山词
1040357,送僧得赐经还永嘉
139678,讲筵侍立·御前亲赐密云龙
915792,谢木韫之舍人分送讲筵赐茶
809804,赐将军吴英
197026,赐宴·汉家传洛欣
383146,丙子八月扈从圣驾幸学赐御膳银叶等物
892107,紫宸赐宴
616679,册封荣藩世子暨长宁王承荣殿下赐宴于青阳阁
26441,题李相公敕赐锦屏风
1121087,十月廿五日有诏以予班六卿赐对衣金带鞍马二首
688746,元日蒙召五臣于文华殿赐谕赐酒馔于殿西厢沾醉而出恭述四绝
688746,元日蒙召五臣于文华殿赐谕赐酒馔于殿西厢沾醉而出恭述四绝
384679,赐长寿綵缕
14051,中和节诏赐公卿尺
850299,初赐幡胜戏和诸公二首 其一
153838,赐僧义澄
40155,奉答赐酒诗
855375,经筵彻章御赐诗卷
538485,丁巳春余以青臬朝衡王赐宴殿中大雪有述
831370,浣溪沙 诸君赐和再踵前韵
887112,曲江津亭谒华严长老见所赐御书因成二韵
1145597,奉和赐酺诗
788322,赐淳亲王
1167732,奉和圣制送张说上集贤学士赐宴
207430,天赐白·君不见书生镌羌勒兵入
1188655,奉和圣制送张说上集贤学士赐宴
366150,诏赐御书稽古两字作口号示子弟
692591,元夕赐观灯
555064,赐粽
360766,恭和御制以嘉雪愆候躬致恳祷精意上孚灵贶昭格己卯庚辰降雪盈尺赐相臣诗
387207,朝天词·重赐弓刀内宴回
423810,金缕曲·元韵酬彭醇士赐和五九初度此词
950677,十月廿五日有诏以予班六卿赐对衣金带鞍马二首 其一
143396,恭和御制赐牟子才韵
362216,赐刘煇及第
916296,喜王虞部赐进士及第
83,于太原召侍臣赐宴守岁
1170832,评事翁寄赐饧粥走笔为答
513414,次韵原博宾之舜咨鸣治赐宴联句 其一
1215948,九月十七日承诏篆追号明庙玺文锡宴中书有衣币之赐
518458,谢赐睿书 其一
1160611,赐齐州李希遇诗
669699,纪赐枇杷
102381,次韵刘贡父春日赐幡胜
36015,敕赐三相马
960960,恭和御赐诗
843992,劳韧叟乡举重逢拜御书丹心黄发之赐寄贺
522485,晚坐东轩睹水木山亭知为夏忠靖公赐第感旧怀贤得绝句八首 其七
484827,唐昭宗赐钱武肃王铁券歌
365119,清明日玉津园奉陪赐宴文太师
385408,抚问赐药·服猛本王政
1047855,和赐后苑金橘
843098,臣宝琛八十二岁生辰蒙御书老圃黄花标晚节仙洲丹橘拥高门联语并如意文绮以赐感悚恭纪
428411,壬午夏，从梦苕师谒梅村墓于石壁山前，墓为予考定后募资重建于原址之上者。梦苕师作《贺新凉》词赐寄，因用原韵勉成此阙
1061730,和中书梁侍郎君臣庆会阁赐御筵诗
959081,谢徐德夫右司和御制赐诗 其一
843067,恭和御制赐寿诗原韵
183868,恭和御制赐太师致仕文彦博七言四韵诗
1074591,神霄玉清万寿宫庆成卿以使事奉安圣像闻有二诗书屏俯同其韵复赐太师 其一
1110132,送朱叔赐赴闽中幕府二首
165997,戊子六月十三日曝书得史院赐笔感怀
224012,幸赐披·疏丛宜少不宜多
1121067,六月二十一日内引赐对缉熙殿玉音宣问漏下数刻将退赐金币香茗有差既而御笔除长地官将旨八路复赐一札兼镇姑孰敬纪感遇以昭恩荣四首
1121067,六月二十一日内引赐对缉熙殿玉音宣问漏下数刻将退赐金币香茗有差既而御笔除长地官将旨八路复赐一札兼镇姑孰敬纪感遇以昭恩荣四首
1121067,六月二十一日内引赐对缉熙殿玉音宣问漏下数刻将退赐金币香茗有差既而御笔除长地官将旨八路复赐一札兼镇姑孰敬纪感遇以昭恩荣四首
1187472,赐耆老布帛
1024195,谢宣赐金襕
541649,立春前二日雪中谢赐元旦宴钞时岁庚子两立春也
335153,次律兄饷鱼鱼不至而诗至颇类南海使君送酒辄成三绝一笑而已赐茗少分以报厚意
696766,元夕赐午门观灯
383150,赐内府新刻经史直解
1161713,敕赐长寿酒因口号以赠
327629,赐宴·纪元新历布
650319,端午赐宴观击毬射柳 其一
992502,和范景仁王景彝殿中杂题三十八首并次韵 其二十 赐烛
64383,赐观灯诗
775796,道光壬辰1832春仲周芸皋观察来澎抚恤蒙赐诗文集五种即用襄阳集春游杂兴八首韵赋呈 其八
507063,赐荣堂为西江潜溟题
547828,寄吴少溪宫录七十 其二十四 承赵国主赐问并赉刻书二种敬因苏长史奉谢
747899,雨舲中丞赐和拙诗兼和坡公海市篇见柬奉答两篇 其二
1124000,初八日微雨明日犹有赐意作两绝句
976605,宣赐翠芳亭双头并蒂牡丹仍令赋诗
1147967,奉和人日宴大明宫恩赐綵缕人胜应制
1036960,清明日赐宴琼林苑奉酬宫使太师相公 其一
200180,诗谒按察疏斋赐贱号二大字赋诗以谢
561638,扈跸南巡自出京至在途蒙恩赉诸物各恭纪一绝以志荣感其酒馔牲品等物尤多盖不能悉纪也 其十九 赐酒竹叶清真珠红二品
385508,抚问赐药·听政忧民切
923234,恭和御制赐太师致仕文彦博七言四韵诗一首
1188656,奉和御制左丞相说右丞相璟太子少傅乾曜同日上官命宴都堂赐诗
404036,金缕曲·癸未立冬，石窗词长为拙集《延目词稿》赐题弁言，谨步原韵以谢
516760,御赐批点五经有感而作
1077979,恭闻诏书褒悼陈少阳赠官与一子恩泽赐缗钱五十万感涕四首 其三
654559,双桂堂为秋官李时赐赋
1216039,兴圣殿进讲即事是日赐酒饮杏花下
655066,五月二十又二日蒙赐鲜品自是时鱼梅笋之类皆叨预焉感激有作
142964,上巳至玉津园赐宴
696771,元夕午门赐观灯
843187,吴蔚若宫保八十赐寿
735824,屡辱侍读王先生以卢藏用种明逸常彝甫见嘲未敢用鄙句唐突又蒙赐口号四章语意郑重督和甚切勉遵无言不酬之义敬答四首以当解嘲 其二
1057269,恭和御制己亥十一月十三日南郊祭天斋宫即事赐诗 其一
108972,琼林赐宴
894596,赐状元张镇孙以下诗
561451,皇储恩例赐给二品诰命感忭有作 其一
674697,宣赐鲥鱼
857920,依韵恭和圣制俯同太师文彦博玉津园赐宴席上述怀
648667,谢赐嘉禾诗
495999,感皇恩 其一 送钦赐书院诸扁出城
385732,赐书楼成有感
588910,少参归凤屿以带币赐贺
1125297,上巳赐宴琼林与二府诸公游水心憩于西轩
112596,和御赐登第
93,赐房玄龄
63605,立春日赐百官春饼
561586,宫保顾公吏侍张公被命校文仆承乏礼曹知贡举予三人者弘治乙丑同年进士也孝皇赐第距今三十有四年矣顾公有诗纪遇志感余嗣和焉 其一
1123439,题丹桂画扇赐从臣
1038250,次韵留守相公以某赴东庄特赐佳篇
482069,元夕赐观灯 其六
383774,十一月二十九日圣母万寿圣节赐金币镂金篆字黄朱灵符等物岁以为常
561808,恭纪恩赐诗 其二十四 赐御药如意饮五贴谕曰能治百病以八月望日修合
561808,恭纪恩赐诗 其二十四 赐御药如意饮五贴谕曰能治百病以八月望日修合
1217499,江东魏元德所制齐峰墨于上都慈仁殿赐文锦马湩以宠之既南归作诗以赠云
113939,赐茶·细题叶字包青箬
913563,雪中讲堂赐酒二首 其一
809659,山庄书怀赐大学士
1190264,清明日赐百僚新火
414241,书怀奉酬申甫赐和
53416,丁亥二月奏进大明会典赐白金文绮宴于南宫仍
482193,元夕午门赐观灯 其二
1132248,赐冠帔杨氏挽诗
383151,赐新刻韵府群玉
153842,赐詹骙·名阅夸詹氏
541062,和穆少春后赐诗扇二首 其二
1001025,谢人送壑源绝品云九重所赐也
553741,元夕赐宴观灯应制 其三
869585,始平公以光得免使北赐之以诗谨依韵酬和
124927,赐禁中所种稻米
561804,恭纪恩赐诗 其二十 万寿日赐吃面青磁龙盌盛之
561804,恭纪恩赐诗 其二十 万寿日赐吃面青磁龙盌盛之
938276,蒙赐佳什钦叹不足不揆浅陋辄次元韵
1224688,赐经筵官酒次苏伯修韵
206233,叔赐迎侍以诗饯之且趣其来
471973,纪赐四十首 其四 丙子九月工部奏进万历制钱式样赐讲官六人各一锭
471973,纪赐四十首 其四 丙子九月工部奏进万历制钱式样赐讲官六人各一锭
320602,留守相公宠赐雅章召赴东楼真率之会次韵和呈
93905,谢木韫之舍人分送讲筵赐茶
682093,赐方教授诗
1145970,赋秋日悬清光赐房玄龄
561859,内直对雪有庆雪银币之赐
24000,评事翁寄赐糖粥走笔为答
246336,唐多令·谢兼翁赐题额
357828,次韵中散兄庆立方赐第
951115,徐浩谢赐书帖赞
482001,端午日赐观射柳二首 其二
1104953,初赐幡胜戏和诸公二首
172512,忆越州·贺监赐湖名价高
