498161,午节外母仍赐一缣泫然赋谢
957631,和子瞻禁林锁院诏赐烛酒
1038078,某伏蒙昭文相公以某方忝瀍洛之寄因有嵩少之行惠赐游山器一副质轻而制雅外华而中坚匪惟便于赍持实为林下之珍玩也辄成拙诗一章报谢
532450,扁舟同师山拜山翁于蒲坂别墅蒙赐诗步韵奉答 其二
684724,端午日赐观射柳二首
897624,休日同宋遐叔诣法云遇李公择黄鲁直公择烹赐茗出高丽盘龙墨鲁直出近作数诗皆奇绝坐中怀无咎有作呈鲁直遐叔
444378,踏莎行 萧斋翁赐法书索作
548424,赠管舍人御赐烛笔等物六首时丙戌新正二日王孝廉邸舍即席赋 其一 烛
561622,扈跸南巡自出京至在途蒙恩赉诸物各恭纪一绝以志荣感其酒馔牲品等物尤多盖不能悉纪也 其三 赐压袋银钱
16200,朝日敕赐百官樱桃
547927,纪赐四十首 其二十五 赐鲜杨梅
547927,纪赐四十首 其二十五 赐鲜杨梅
506725,赐游万岁山诗十首 其四
1181538,人日重宴大明宫恩赐綵缕人胜应制
561790,恭纪恩赐诗 其六 赐五味汤寝宫垂花帘下饮之
561790,恭纪恩赐诗 其六 赐五味汤寝宫垂花帘下饮之
471972,纪赐四十首 其二 丙子七月初侍日讲纪述
561715,赐游小山并金海泛舟至广寒殿诗八首 其四 曲流观
506726,赐游万岁山诗十首 其五
513417,次韵原博宾之舜咨鸣治赐宴联句 其四
843072,戊辰元日谕止行礼亲笔书大吉春条分赐诸臣
1220482,保定王氏母九十得赐帛乡人合燕为寿
260337,族兄东城亲家鹤峰狱中赐顾同宿二夜感作
342545,赠梅圣俞试馆职得赐进士出身
53412,赐鲜鲥鱼
698674,法驾导引曲 上赐金符金仙人银太平牌应制三阕
1079001,睿谋殿赐宴和御制
241705,和子瞻禁林锁院诏赐烛酒
388021,赐贺赋谢·对酒当歌兴未阑
1037783,讲毕周礼诏赐御筵
1087840,秀野以喜无多屋宇幸不碍云山为韵赋诗熹伏读佳作率尔攀和韵剧思悭无复律吕笑览之馀赐以斤斧幸甚 其七
1115691,跋澹庵先生缴张钦夫赐章服答诏二首
506750,题御赐黄封
702530,赐庄八景为周草亭驸马作 路接神京
40042,奉报赵王出师在道赐诗
310433,山长沈公蒙恩赐币恭纪
1151776,奉和圣制赐史供奉曲江宴应制
1171471,赐宫人庆奴
907772,送徐致州交代赐第归亲庭
905483,至性灵迂僻学术空虚幸逢好古之君获在藏书之府惟无功而禄重招髦彦之讥而多病所萦实喜优闲之任居常事简得以狂吟因成恶诗十章以蓬阁多馀暇冠其篇而为之目亦乐天何处难忘酒之类也尘黩英鉴幸赐一览下情不任兢灼之至 其七
482199,元夕赐午门观灯 其二
327631,奉和御制睿谟殿赐宴
1100180,赐镜湖一曲
217748,御书飞白玉堂之署四字颁赐禁苑今悬挂已毕辄
231788,比访叔才旋蒙赐诗以贫不能留客为愧次韵
83540,咏史·入郢功成赐属镂
134615,赐果·南海荔支来
514914,二月七日右顺天门奉雍王殿下讲读及侍书三日赐宴有作
649581,太平圣德诗十章 皇上以年谷屡丰四境宁谧每于岁首敕群臣百姓自正旦至元夕皆饮酒为乐市中如故事张灯五城弛夜禁仍赐戒敕各循礼度此与众同乐之大恩也为推恩之诗第七 其七
1036941,琼林苑赐燕饯别留守太尉辄继元韵
1137568,己巳秋七月不雨人心焦然乃戊午斋宿致城隍清源渠渡龙君嶅山五神于州宅以祷始至雨洗尘自是间微雨辄随止旱气转深苗且就槁要神弗获某忧惧不知所出越癸亥日亭午率郡僚吏申祷于庭未移顷雨大挚旄稚呼舞皆曰神之赐也某既拜贶又明日以神归念无为神报者乃作送神之诗七章以侈神功且又以祈焉 其二
809120,赐抚远大将军图海二首 其一
1003049,清明日赐新火
249699,八一生朝政协惠赐寿糕赋此感谢
1058712,提刑都讲颁赐题古楠寺佳篇伏读玩味词旨豪肆感叹战汗不揆浅拙仰次严韵
1178973,集贤书院成，送张说上集贤学士，赐宴得珍字
145893,集英殿赐进士及第恭谢诗
621466,端午赐扇
561718,赐游小山并金海泛舟至广寒殿诗八首 其七 广寒殿
577965,赐观灯诗五首　永乐二十年正月十五日进 其五
83207,休日·赐休暂许养衰残
900738,次御制赐于真人韵
42597,赐沈德潜
198261,垂拱殿赐对蒙恩入省
222141,湖南·犹记琼林插赐花
168375,十月廿五日有诏以予班六卿赐对衣金带鞍马
659545,经筵赐宴
648270,赐游西苑同诸学士作 其三
1077771,渊圣皇帝赐宝剑生铁花感而赋诗
956740,寓直玉堂拜赐御酒
923322,谢赐御书诗五言十二韵
911534,伏蒙赐和复用韵二章拜呈可谓出丑衒媸惟自叙鄙怀并以见区区敬慕之意姑惟教之是所愿也 其一
520018,题杂画赐门正相傧 其一
13423,试中和节诏赐公卿尺诗
95084,口号·赐花新剪茜香罗
1206783,清平乐 赠张居仁获贼有功赐三界巡检
1153200,奉和圣制送张说上集贤学士赐宴
564931,和桂洲阁老赐宴礼部记恩遇诗二首 其一
514830,小女以乙巳岁腊月八日生与予生辰隔一日人以为奇至弥月之旦予适署左春坊印百晬之旦又有赐诰之荣人益以为不偶因请于母夫人小字之曰恩姐并赋一诗简尚宝锦衣二贤舅及宫簿弟以私识喜不足为外人道也
561637,扈跸南巡自出京至在途蒙恩赉诸物各恭纪一绝以志荣感其酒馔牲品等物尤多盖不能悉纪也 其十八 赐代衣银
1115586,雪中讲堂赐酒二首
688231,和冯检斋方伯赐诗
410796,香宋师赐和知剑霜将迎师至自流井并约缓衡及馀同往
999876,某不度轻僭始以鄙句尘献判府安抚司徒侍中特屈威尊过赐宠和伏读荣荷谨成律诗一首代启上谢
907565,朱叔赐来自都城云梅已放因思每岁饮赏之乐
1016396,史太师入觐赐带以不知官高卑玉带悬金鱼为韵寄呈 其六
839630,和谢李邑侯赐题慎余稿首原韵四首 其二
41283,赐张率诗
618270,内阁阶砌牡丹为宣庙赐植三首 其二
368117,萧公挽章·履赐西州事可寻
559962,元夕赐观灯诗 其二
1016046,御赐真赞师演成四偈 其二
1191969,奉和御制左丞相说右丞相璟太子少傅乾曜同日上官命都堂赐诗
53407,戊寅正月上尚巾礼成群臣称贺赐白金文绮
95085,口号·已赐仪鸾锦坐蒲
53410,赐鲜藕·芙容别殿晓风凉
366764,中使传宣二月一日史院赐御筵某亦预召作七言呈禹玉真孺景仁三内翰
1063266,慈圣皇后赐钟赞
788279,赐尚书张廷玉
619441,天启壬戌上御文华殿欣得赐朝
1215940,七月十二日奉诏以香酒赐曲阜代祀孔圣庙越五日别翰林诸友 其一
1036962,清明日赐宴琼林苑奉酬宫使太师相公 其三
561846,纪赐十二绝 其九 赐酒蟹一瓮
561846,纪赐十二绝 其九 赐酒蟹一瓮
385356,谢蜀王赐果·利欲颓波挽不回
593143,尊赐楼为茂材奉国题
650329,元夕午门赐观灯 其一
224015,幸赐披·乾箨坠莎何用扫
1004202,闻喜宴恭和御制赐进士诗
561712,赐游小山并金海泛舟至广寒殿诗八首 其一 清虚殿
907615,叔赐迎侍以诗饯之且趣其来
650707,元夕赐观灯 其三
889480,白石道者栖于洪岩以石为粮先朝敬爱之赐予之物甚盛一日主僧持来郡斋因获恭览叹仰之馀偶成拙句二首 其二
566026,送邢君赐还彰德一首
722473,和太仓许子题宋高宗赐岳武穆王班师手诏后
1052168,谢公权赐蜀笺
1216008,二月十九日承诏复兼经筵官是日进讲咸宁殿面赐卮酒作
307270,原韵答谢陈以光老师惠赐“登楼”一律
385353,谢蜀王赐果·翠笼擎出殿门东
561793,恭纪恩赐诗 其九 赐画面扇二十四孝人物
561793,恭纪恩赐诗 其九 赐画面扇二十四孝人物
506770,西江月 端午赐观击毬射柳五阕 其三
1095848,曹泸南得思陵旧赐张魏公琴曰播云
329843,和芸叟左司被资治通鉴之赐感事赋诗
809517,守陵太监崔邦琪侍慈宁宫年久诗以赐之
696775,元夕赐观灯
1027324,三月七日上赐牡丹并蔷薇露劝酒
894657,赐圆觉寺僧德信 其一
46865,谢赐衣
243909,次御制赐于真人韵
325018,张设·辎车乘马君王赐
757146,恭和御制赐朝鲜琉球安南诸国使臣诗
617817,赐鲥鱼
1038125,去春蒙西都致政李少师惠诗五首追叙旧游因而招隐某尚羁枢务请退未谐深味来章未知所答迁延宿留遂涉岁时今蒙圣慈俯从人欲听解重柄均逸便藩仰西河之上游瞻仁宅之实迩即当胥会弥积欣怡辄成小诗三章代书见意且答去春之赐
387503,辰日荷正峰李谕君赐贺赋谢
1169492,人日侍宴大明宫恩赐綵缕人胜应制
907622,和叔赐对榴花
773859,恭和御赐杨制府诗原韵有序 其一
561726,详定试卷上命中官赍赐丁香花一枝并金筒簪之恭纪四绝 其一
1144237,己巳秋七月不雨人心焦然乃戊午斋宿致城隍清源渠渡龙君嶅山五神于州宅以祷始至雨洗尘自是间微雨辄随止旱气转深苗且就槁要神弗获某忧惧不知所出越癸亥日亭午率郡僚吏申祷于庭未移顷雨大挚旄稚呼舞皆曰神之赐也某既拜贶又明日以神归念无为神报者乃作送神之诗七章以侈神功且又以祈焉
593562,慈圣皇太后寿日上御皇极殿受贺赐宴
688755,恭纪恩赐诗 赐玲珑雕花玉带
688755,恭纪恩赐诗 赐玲珑雕花玉带
1057322,赐秦国大长公主挽词三首 其一
471989,纪赐四十首 其二十七 赐鲜桃李
471989,纪赐四十首 其二十七 赐鲜桃李
175641,减字木兰花·华清赐浴
1037694,赠梅圣俞试馆职得赐进士出身
788337,赐怡亲王二首 其一
1074585,赐和蔡京
146159,御赐琼林宴恭和诗
688750,详定试卷上命中官赍赐丁香花一枝并金筒簪之恭纪四绝
851361,御赐琼林宴恭和诗
158337,某蒙太守卢公惠酒因作诗以谢公子仇香遽赐光
1034312,十八日上寿退赐坐十九日贡院锡宴二十一日紫宸殿御筵即事 其五
809575,国舅佟国维六十寿诗以赐之
516706,题御赐倭扇
495995,法驾导引曲 上赐金符金仙人银太平牌应制三阕 其二
1123501,赐知贡举晁迥
181007,蒙示黄磵佳诗三读钦羡辄继韵仰报嘉赐
2025,奉和圣制赐王公千秋镜应制
605757,侯令博罗获上信下两年如一日矣公门桃李药笼参苓四境无弃物者独知之契物外之交惟萱一人实徼福焉一旦惠赐表庐曰圣世人龙何物老圃能无愧色而侯过情之誉有加无已复不惜綵毫更题啸傲烟霞一榜永光衡泌且贶以珠玉不一而足谓为老圃真面目以传老圃之神岂抱瓮荷锄者亦有葑菲可采乎九顿拜嘉即悬于百尺楼头喜而欲狂步侯来韵勉短赋谢珠玉在前不辞形秽 其四
113938,赐茶·文书满案惟生睡
613127,甄邦圣为兄鸣冤世所同义反坐十年神人共愤既而得释天心见矣廿馀年来家道徐徐而起莫非天祐岁丁丑正月邦圣病笃梦一神披发抚圣背曰义士也为兄报仇赐汝一纪之寿觉而渐愈始知玄帝所赐也岂非天哉足以传矣诗以纪之 其二
613127,甄邦圣为兄鸣冤世所同义反坐十年神人共愤既而得释天心见矣廿馀年来家道徐徐而起莫非天祐岁丁丑正月邦圣病笃梦一神披发抚圣背曰义士也为兄报仇赐汝一纪之寿觉而渐愈始知玄帝所赐也岂非天哉足以传矣诗以纪之 其二
1031407,御笔赐字诗
561624,扈跸南巡自出京至在途蒙恩赉诸物各恭纪一绝以志荣感其酒馔牲品等物尤多盖不能悉纪也 其五 赐御笔诗
850326,武仲伏蒙宠寄新篇不忘往事恩谊甚厚谨依严韵和酬伏惟台慈特赐采览
159391,观文丁右丞求赐茶因奉短诗二章
35190,太傅相公与家兄梅花酬唱许缀末篇再赐新诗
738548,题桐城张相国赐园泛舟图 其一
893980,甲戌冬属疾赐告二首 其二
957683,谢赐御书诗五言十韵
360898,恭和御制己亥十一月十三日南郊祭天斋宫即事赐诗
647936,赐游东苑诗九章 其一 斋宫
266034,谢俞人老赐题友声集
326069,次韵公绍贺崇静之赐金紫
923317,恭和御制赐太师致仕文彦博五言六韵诗一首
187456,丁巳春言事四归和朱子云赐诗韵
120919,寄严文炳·赵侯当赐环
917802,伏蒙提举秘书郎中以留题县驿新篇封示恻隐惠爱之意自然著见可谓发情止义无愧古作道中不得即具申谢之仪夜还舍秉烛亟次崇韵庸见不敢虚辱大赐之诚非敢为文某惶恐敬上
547353,抵舍承邢知吾侍御赐问裁答二首 其一
306284,天中节赐纱卷次温毅夫御史韵
1118211,过武连县北柳池安国院煮泉试日铸顾渚茶院有二泉皆甘寒传云唐僖宗幸蜀在道不豫至此饮泉而愈赐名报国灵泉云三首
20937,恩赐魏文贞公诸孙旧第以导直臣
665,敕赐宁王池宴
7646,端午日赐衣
788338,赐怡亲王二首 其二
1016209,史太师入觐赐带以不知官高卑玉带悬金鱼为韵寄呈 其二
1182864,和徐商贺卢员外赐绯
384187,送林赐阶邑侯奉讳归琼州
850298,初赐幡胜戏和诸公二首 其二
1191339,端午日恩赐百索
605755,侯令博罗获上信下两年如一日矣公门桃李药笼参苓四境无弃物者独知之契物外之交惟萱一人实徼福焉一旦惠赐表庐曰圣世人龙何物老圃能无愧色而侯过情之誉有加无已复不惜綵毫更题啸傲烟霞一榜永光衡泌且贶以珠玉不一而足谓为老圃真面目以传老圃之神岂抱瓮荷锄者亦有葑菲可采乎九顿拜嘉即悬于百尺楼头喜而欲狂步侯来韵勉短赋谢珠玉在前不辞形秽 其二
385618,谢赐飞鱼服
1167286,人日重宴大明宫恩赐綵缕人胜应制
889481,白石道者栖于洪岩以石为粮先朝敬爱之赐予之物甚盛一日主僧持来郡斋因获恭览叹仰之馀偶成拙句二首 其一
57967,端午赐观骑射击球侍宴
775137,壬辰1832春捧檄来澎随同芸皋先生观察查办抚恤蒙赐书画联扇赋诗申谢 其一
153834,赐道人郑隐归山
644153,钦和御制山居诗赐灵谷寺住持 其八
707686,鲁王将入粤，赐诗留别；次韵奉和
644853,谢蜀王赐果十首 其九
364567,立春谢赐幡胜口号呈子瞻冲元内翰子开器资舍人
674852,宪副沈公赐答前韵再重申和
1244108,彭中和有赠松林墨兰一幅许以贶余余因故以墨梅先之既而中和赐报以诗遂次韵复之
13117,奉和登玄武楼观射即事书怀赐孟涉应制
35994,恩赐耆老布帛
788280,赐尚书励廷仪
513416,次韵原博宾之舜咨鸣治赐宴联句 其三
362215,赐梅挚知杭州
426291,再谢缪宏画家赐绘杜鹃花图
688703,嘉靖壬寅三月四日同勋辅五臣直宿西苑时雨适澍上召赐酒仁寿宫中谕曰寒春宵分召卿等饮一钟朕手注之酒殿中少看待雨略住出银钟带归圣恩隆渥前代所未有也恭赋近体二首志感
361857,宣和己巳冬祀大礼卿以执绥侍玉辂回銮礼毕以诗来上俯同元韵赐伸仍宣示俅杰
352172,赐诸葛颖·参翰长洲苑
894656,赐僧守璋二首 其二
471984,纪赐四十首 其十八 甲戌七月奏进穆庙实录赐白金文绮宴于南宫
471984,纪赐四十首 其十八 甲戌七月奏进穆庙实录赐白金文绮宴于南宫
1063270,庠拜手顿首启伏蒙学士九丈再赐诗章庠僭率继和尚觊采览
1384,奉和御制璟与张说源乾曜同日上官命宴都堂赐诗应制
690468,恩诏赐复冠带县大夫雨中携酒赐贺赋此呈谢
690468,恩诏赐复冠带县大夫雨中携酒赐贺赋此呈谢
773861,恭和御赐杨制府诗原韵有序 其三
905442,至性灵迂僻学术空虚幸逢好古之君获在藏书之府惟无功而禄重招髦彦之讥而多病所萦实喜优闲之任居常事简得以狂吟因成恶诗十章以蓬阁多馀暇冠其篇而为之目亦乐天何处难忘酒之类也尘黩英鉴幸赐一览下情不任兢灼之至 其五
723711,奉答赐酒诗
556008,送孔上公助祭太学归阙里时赐衮衣一袭
229120,史太师入觐赐带以不知官高卑玉带悬金鱼为韵
644157,钦和御赐诗一首
666504,南唐李昪画竹题云升元阁上作赐宋齐邱
486304,赐方教授诗 其二
13424,省试恩赐耆老布帛
115883,休日同宋遐叔诣法云遇李公择黄鲁直公择烹赐
1078833,衰病辞禄蒙恩赐可时小子坚方尘末第陈德昭袁仲诚惠诗褒借褒借甚宠次韵奉答二首 其一
1087838,秀野以喜无多屋宇幸不碍云山为韵赋诗熹伏读佳作率尔攀和韵剧思悭无复律吕笑览之馀赐以斤斧幸甚 其五
688697,恩赐麒麟服次俨山陆学士见赠韵
1034314,十八日上寿退赐坐十九日贡院锡宴二十一日紫宸殿御筵即事 其三
698184,赐麦饼宴
426155,前往为王老介寿，反荷宠赐隆仪，诗以志谢
41286,觉意诗赐江革
65394,苑中·新赐文舟泛碧澜
1051770,某偷惰不强日陷罪恶元忠哀怜惷愚未忍诛绝赐诗为戒佩服弗忘韵险且长赓和未逮聊作短句以代负荆
27894,谏议以罢郡将归以六韵赐示因伫酬献
362214,赐武元亨·只向身边有大还
471993,纪赐四十首 其三十二 甲申春月扈从车驾奉两宫圣母阅定寿宫赐綵花文绮等物
471993,纪赐四十首 其三十二 甲申春月扈从车驾奉两宫圣母阅定寿宫赐綵花文绮等物
1185787,谢令狐绹相公赐衣九事
728960,赐大学士张廷玉
775138,壬辰1832春捧檄来澎随同芸皋先生观察查办抚恤蒙赐书画联扇赋诗申谢 其二
570892,辱宗伯李公赐和六章词丽意深不揣续貂四绝仰尘清览 其三
1175978,奉和恩赐乐游园宴应制
212304,御赐阁额·功掩萧何第
1058810,奉和御制上巳日赐宴二首 其一
960494,太平欢 圣节赐宴
559963,元夕赐观灯诗 其三
1178976,千秋节赐群臣镜
561775,诏赐金海乘凉诗 其一
644448,九月晦日高僧同朝赐馔
1057271,恭和御制己亥十一月十三日南郊祭天斋宫即事赐诗 其三
987453,甥舅同登进士亦世之不易得者今幸逢其会因吟一律以寄一以表祖宗积善之徵二以谢圣主宠赐之荣三以致勉忠之意二子惟勖诸
183504,谢赐御书诗五言十二韵
891777,赐余复
321965,丁丑二月二十一日集英殿赐第
1087843,秀野以喜无多屋宇幸不碍云山为韵赋诗熹伏读佳作率尔攀和韵剧思悭无复律吕笑览之馀赐以斤斧幸甚 其十
153840,赐王钦若除太子太保判杭州十韵
561803,恭纪恩赐诗 其十九 赐葫芦画八幅
561803,恭纪恩赐诗 其十九 赐葫芦画八幅
94869,雪中讲堂赐酒
1076063,次韵伯远端午日拜碧香之赐
938272,蒙示黄礀佳诗三读钦羡辄继韵仰报嘉赐
923801,次韵子瞻十一月旦日锁院赐酒及烛
1216038,闰二月八日入直宣文阁上命陈阁中前代礼器赐问制作之由具对称旨纪事二首 其二
561795,恭纪恩赐诗 其十一 赐画扇有木刻海榴罂坠子一罂可寸许穴其腹藏象刻物器一百事工巧异甚
561795,恭纪恩赐诗 其十一 赐画扇有木刻海榴罂坠子一罂可寸许穴其腹藏象刻物器一百事工巧异甚
13426,赐耆老布帛
606637,赐金
688647,赐游清馥殿
561837,元日赐柏叶诗
809553,赐皇子允祀
960886,丁巳春言事西归和朱子云赐诗韵
340393,癸未游杭·黄门飞鞚赐厨珍
107992,赠綦大将军·先皇玉带亲解赐
362121,宫词·南阳耆老赐恩荣
641340,十月二日宝应舟中夜梦先君手赐一狐裘仰视慈颜似怜其远行者梦回伤感悲不自胜
149460,天宁节後二日集英赐燕辄成长句
53408,八月十七日万寿圣节赐白金文币及镂金万寿福
472000,纪赐四十首 其四十 辛夘九月乞休得请钦遣内使赍赐路费宝钞次日又遣内使赍赐白金文绮盖六卿日讲各有特恩也
472000,纪赐四十首 其四十 辛夘九月乞休得请钦遣内使赍赐路费宝钞次日又遣内使赍赐白金文绮盖六卿日讲各有特恩也
472000,纪赐四十首 其四十 辛夘九月乞休得请钦遣内使赍赐路费宝钞次日又遣内使赍赐白金文绮盖六卿日讲各有特恩也
893711,俞延禧进古涧松以诗赐之
911582,恭谢侍读仁皇训典彻章御赐杜工部紫宸殿诗退朝口号并鞍马香茶 其三
53383,十一月二十九日圣母万寿圣节赐金币镂金篆字
894790,昌化县进嘉禾嘉粟赐贾丞相
994848,御赐阁额二首 其一
553740,元夕赐宴观灯应制 其二
475279,再和严相公诏赐直庐有作次韵
613132,甄邦圣为兄鸣冤世所同义反坐十年神人共愤既而得释天心见矣廿馀年来家道徐徐而起莫非天祐岁丁丑正月邦圣病笃梦一神披发抚圣背曰义士也为兄报仇赐汝一纪之寿觉而渐愈始知玄帝所赐也岂非天哉足以传矣诗以纪之 其七
613132,甄邦圣为兄鸣冤世所同义反坐十年神人共愤既而得释天心见矣廿馀年来家道徐徐而起莫非天祐岁丁丑正月邦圣病笃梦一神披发抚圣背曰义士也为兄报仇赐汝一纪之寿觉而渐愈始知玄帝所赐也岂非天哉足以传矣诗以纪之 其七
577532,元宵赐观灯诗五首 其一
192617,上已玉津园赐宴
168,中和节赐群臣宴赋七韵
593549,驾幸太学赐衣
86566,挽方德润宝学·晚赐延和对
913562,雪中讲堂赐酒二首 其二
692628,九日昆峰赐饮拟和刘静修先生九日九饮歌韵体
1187372,又赐宴自歌
971379,初八日微雨明日犹有赐意作两绝句 其一
53414,癸未甲申三扈圣驾上陵赐大红织金曳撒鸾带等
153833,赐陈尧叟谢病归济源
644155,钦和御制山居诗赐灵谷寺住持 其十
53380,戊寅正月进讲赐大红织成段衣一袭
688706,奉次少师桂翁赐宴纪恩
738550,题桐城张相国赐园泛舟图 其三
197486,用适庄赐韵回祝
809741,赐吏部尚书宋荦予告还里
1061723,恭和御制以嘉雪愆候躬致恳祷精意上孚灵贶昭格己卯庚辰降雪盈尺赐相臣诗二首 其一
352265,衰病辞禄蒙恩赐可时小子坚方尘末第陈德昭袁仲诚惠诗褒借褒借
863866,谢宣赐御草书急就章并朱邸旧集歌
108372,戊戌端午·退休敢望赐宫衣
182883,初赐幡胜戏和诸公
152447,进读三朝宝训终篇赐宴赐赉谢恩诗
152447,进读三朝宝训终篇赐宴赐赉谢恩诗
1066174,改葬西山延仲主簿特赐庆什次韵
53430,丙戌冬至南郊扈驾圣母轸念天寒特赐姜苏杏仁
324827,诸亲庆赐第复会致语口号
520023,题杂画赐门正相傧 其六
519602,颁赐新历
156613,昌化县进嘉禾嘉粟赐贾丞相
1138578,慈元殿赐牡丹
1184495,奉和圣制送张说赴集贤院学士赐宴赋得虚字
323540,上赐讲读官建茶某以说书与焉以十饼分赠太学同舍苪太博有诗次韵
605121,壬申正月十七夜刘令公赐续元夕惠临赋谢
514795,赐庄八景为周草亭驸马作 其五 柳塘春燕
788275,赐内大臣马武
1211304,题经筵安仝译史新刻千文赐本二首 其一
1169876,省试恩赐耆老布帛
131317,暇日偶成·天赐衰年一屋清
585270,恭纪圣恩春日同游并颁赐殊品 其一
142516,集英殿赐第出马上口占
362174,赐枢密院楼炤
552374,十骥咏 其八 御赐燕色驹
504098,谢赐虎肉馒头
561750,赐游清馥殿 其二
506769,西江月 端午赐观击毬射柳五阕 其二
181521,慈元殿赐牡丹
547921,纪赐四十首 其七 丁丑八月奏进世庙实录赐白金文绮锡宴南宫
547921,纪赐四十首 其七 丁丑八月奏进世庙实录赐白金文绮锡宴南宫
702282,洪武九年岁丙辰二月十日被擢秦王礼官十七日同秦晋燕王府官僚召见奉天门下各赐马一疋楮币有差惶悚感激退而赋诗
1118435,恩赐龟紫二首
471897,立春日赐百官春饼
541060,和穆少春前赐诗扇二首 其二
1028013,史少师赐第赏芍药分韵得木字
1078287,辞免不允蒙恩遣中使降赐趣行不获已受命二首 其二
1187366,奉和人日重宴大明宫恩赐綵缕人胜应制
891069,赐刘煇及第
382768,赐问裁答·海岳终堪隐
735825,屡辱侍读王先生以卢藏用种明逸常彝甫见嘲未敢用鄙句唐突又蒙赐口号四章语意郑重督和甚切勉遵无言不酬之义敬答四首以当解嘲 其三
288121,和谢李邑侯赐题慎余稿首原韵
1215973,至正二年岁壬午正月明仁殿进讲易恒卦赐金织绿色对衣一袭作
160889,生日四绝·黄门宣赐出丹墀
1129381,御赐真赞师演成四偈
649208,追和周侍郎大雪赐宴诗
320910,次韵留守相公以某赴东庄特赐佳篇
648268,赐游西苑同诸学士作 其一
678099,赐元夕观灯
1123467,赐陈抟 其二
561675,元日蒙召五臣于文华殿赐谕赐酒馔于殿西厢沾醉而出恭述四绝 其四
561675,元日蒙召五臣于文华殿赐谕赐酒馔于殿西厢沾醉而出恭述四绝 其四
671486,蒙赐佐枢环召别石斋兄兼怀诸公
561716,赐游小山并金海泛舟至广寒殿诗八首 其五 瑶景翠林二亭
212305,御赐阁额·杰阁侵霄汉
512709,钟离意不拜赐张恢赃珠
869417,伏蒙留守相公赐示陪太师潞公东田宴集诗辄敢属和
1123509,赐秦国大长公主挽词三首
177804,贺温正言赐紫
134143,谢始平公以近诗一卷赐示
514798,赐庄八景为周草亭驸马作 其八 仙桃凝露
723709,奉和赐曹美人诗
883640,次韵公绍贺崇静之赐金紫 其一
719313,和太仓许子题宋高宗赐岳武穆王班师手诏后 其二
506728,赐游万岁山诗十首 其七
642830,赐胙次何尹韵
506746,神功圣德诗一十五首 其十三 赐观猎
384678,腊日赐燕·绮筵错落映朱旗
426423,虚度八十深荷叶老惠赐五言三律敬步原韵并乞郢政 其二
104750,送谢寺丞新赐及第赴扶沟宰
260001,还需要什么赐福
514791,赐庄八景为周草亭驸马作 其一 路接神京
644854,谢蜀王赐果十首 其十
6527,尚书念旧垂赐袍衣率题绝句献上以申感谢
533228,献俘礼成颁赐金币
428550,张相臣姻兄精于医学，寓居津门，每于诊治之暇，时常著书。丁卯春，偶以咏怀诗赐及命和，江才识浅陋，唯有勉步原韵，凑四首奉和而已，未敢云诗也 其二
336601,次韵伯远端午日拜碧香之赐
843010,贺雪斋贝子三十赐寿
203031,御笔赐字诗
