506747,神功圣德诗一十五首 其十四 赐观射虎
740784,宣德赐印歌
939451,三城侍郎寄示留题延庆寺二韵诗二章顷岁予肄业于此遗景尽在幸会之迹首唱之序详矣谨依命攀和但于首章增为四韵盖浅陋之才不觉辞费因遣稚子赞善大夫通判邠州事学古写于此牌以永嘉赐 其二
327622,奉和御制颁赐荔枝
1145994,赐魏徵诗
526778,四月八日午门赐宴次秉衡韵
788310,赐总督杨宗仁
2118,恩赐乐游园宴
337254,米元晖待制岁以赐冰及荔子分遗季共而今年荔枝不至有诗次韵
707179,仿昭代诸家体三十八首 二十六 于阁学慎行 纪赐
1196259,将就十章更献三首词虽愈拙诚即可矜或歌执事之风猷或导鄙人之情志愿宽捷给稍赐披寻 其二
13452,奉和圣制中和节赐百官宴集因示所怀
1043618,贺王丞相赐玉带
644591,近述基命录粗载三代帝王宽厚之政以寓忠爱之私幸彻睿览过蒙赐诗宠褒词高旨远复增惭荷谨依韵略陈情以谢万一云
1090364,和吴守拜上方历日之赐已而雪作约同僚登俯江楼见怀之作 其二
1026642,次韵和相公九月八日所赐诗
700995,甄邦圣为兄鸣冤世所同义反坐十年神人共愤既而得释天心见矣廿馀年来家道徐徐而起莫非天祐岁丁丑正月邦圣病笃梦一神披发抚圣背曰义士也为兄报仇赐汝一纪之寿觉而渐愈始知玄帝所赐也岂非天哉足以传矣诗以纪之 其三
700995,甄邦圣为兄鸣冤世所同义反坐十年神人共愤既而得释天心见矣廿馀年来家道徐徐而起莫非天祐岁丁丑正月邦圣病笃梦一神披发抚圣背曰义士也为兄报仇赐汝一纪之寿觉而渐愈始知玄帝所赐也岂非天哉足以传矣诗以纪之 其三
738549,题桐城张相国赐园泛舟图 其二
561811,恭纪恩赐诗 其二十七 赐银八宝亦曰八吉祥锭胜珊瑚犀角珠子名状各异
561811,恭纪恩赐诗 其二十七 赐银八宝亦曰八吉祥锭胜珊瑚犀角珠子名状各异
509602,丙子夏洪吉袁瑞临抚建信江饶南康十一郡大旱田租二百三十二万勘有一百三十八万成灾封章上闻蒙恩俱赐蠲免忧民之怀稍舒口占一绝以识感激
1004216,晋仲文学渊邃方为朝阳鸣凤仆所次前韵及之而荐赐佳章招隐敢再次韵以反之以资他日重会一笑
124013,李中令挽词·家赐齐侯履
471999,纪赐四十首 其三十八 己丑六月三品考满荷蒙圣恩遣内使及门赍赐羊酒宝钞
471999,纪赐四十首 其三十八 己丑六月三品考满荷蒙圣恩遣内使及门赍赐羊酒宝钞
507245,午日赐观击毬射柳诗
700994,甄邦圣为兄鸣冤世所同义反坐十年神人共愤既而得释天心见矣廿馀年来家道徐徐而起莫非天祐岁丁丑正月邦圣病笃梦一神披发抚圣背曰义士也为兄报仇赐汝一纪之寿觉而渐愈始知玄帝所赐也岂非天哉足以传矣诗以纪之
700994,甄邦圣为兄鸣冤世所同义反坐十年神人共愤既而得释天心见矣廿馀年来家道徐徐而起莫非天祐岁丁丑正月邦圣病笃梦一神披发抚圣背曰义士也为兄报仇赐汝一纪之寿觉而渐愈始知玄帝所赐也岂非天哉足以传矣诗以纪之
1145909,赐萧瑀
658791,恩赐玉带麒麟服 其二
1099728,郡圃小山大资可斋先生所作也石久散而池亦荒恕斋来公补处叠之浚之访求旧记重刊之仍续留题之句以寄可翁翁又和之以某同出可斋之门不鄙赐示借韵为谢 其二
811832,题桐城张相国赐园泛舟图
788273,赐大学士张鹏翮
604532,恩诏赐复冠带县大夫雨中携酒赐贺赋此呈谢 其六
604532,恩诏赐复冠带县大夫雨中携酒赐贺赋此呈谢 其六
1145528,赐诸葛颖
1173406,端午日赐衣
665238,赐鲥鱼
855868,集英殿赐第出马上口占
559732,端午日赐观击毬射柳诗
80853,哭季长·我荷锄时君赐环
839971,癸酉九秋得翁师赐函提及前事，再次前韵寄呈师座二首 其一
728309,扈驾马兰峪赐观温泉恭纪十韵
506753,赐扇及綵缕
1232730,赐范迈
479907,端午食赐粽有感
995806,谢公择舅分赐茶三首 其三
561749,赐游清馥殿 其一
621467,赐长寿綵缕
506729,赐游万岁山诗十首 其八
651637,赐扇
68015,满庭芳·吾剑非凡玉皇宣赐
1191224,唐故江南西道观察使中大夫洪州刺史兼御史中丞上柱国赐紫金鱼袋赠左散骑常侍太原王公神道碑铭附诗
159004,明堂宿斋赐贡茶珍果上樽御膳
1178954,左丞相说右丞相璟太子少傅乾曜同日上官命宴东堂赐诗
561780,诏赐金海乘凉诗 其六
747898,雨舲中丞赐和拙诗兼和坡公海市篇见柬奉答两篇 其一
894635,赐丁谓 其二
891072,嘉祐六年八月十五日赐林悦 其一
561801,恭纪恩赐诗 其十七 赐银套杯六小大各异以礼乐射御书数字别之
561801,恭纪恩赐诗 其十七 赐银套杯六小大各异以礼乐射御书数字别之
502452,冬至日蒙赐饮膳赋诗
905461,所苦之中无以遣闷更题新竹别献五章幸赐披览 其五
1211893,同张伯雨过凝神庵因观宋高宗所赐蒲衣道士张达道白羽扇
324876,和九日赐宴琼林苑
809180,赐奉命大将军杰淑二首 其一
1152150,奉和圣制送张说上集贤院学士赐宴得筵字
668545,实录成蒙恩赐袭衣银币
53320,主上于奉天门赐坐焚香供茶午就赐斋问以宗门
53320,主上于奉天门赐坐焚香供茶午就赐斋问以宗门
613129,甄邦圣为兄鸣冤世所同义反坐十年神人共愤既而得释天心见矣廿馀年来家道徐徐而起莫非天祐岁丁丑正月邦圣病笃梦一神披发抚圣背曰义士也为兄报仇赐汝一纪之寿觉而渐愈始知玄帝所赐也岂非天哉足以传矣诗以纪之 其四
613129,甄邦圣为兄鸣冤世所同义反坐十年神人共愤既而得释天心见矣廿馀年来家道徐徐而起莫非天祐岁丁丑正月邦圣病笃梦一神披发抚圣背曰义士也为兄报仇赐汝一纪之寿觉而渐愈始知玄帝所赐也岂非天哉足以传矣诗以纪之 其四
870221,御沟 赐书
809574,赐皇太子生辰诗
561714,赐游小山并金海泛舟至广寒殿诗八首 其三 水帘洞
733780,世祖章皇帝御画渡水牛戏以指上螺纹成之赐中官某臣从黄州通判臣宋荦得观恭赋一章
561717,赐游小山并金海泛舟至广寒殿诗八首 其六 省耕亭
579499,庆成赐宴
1058813,奉和御制睿谟殿赐宴
923410,南郊大礼庆成诗五首 其四 赐赦宣德门
383078,周文伯载赐中泠慧山泉水赋谢
585277,恭纪圣恩春日同游并颁赐殊品 其八
650530,元夕赐观灯 其二
940923,南园荔子熟名曰魏紫盖是陈家紫种以先公赐封大名地冠之
362188,赐刘能真·简易高人道
405130,答喻蘅兄赐和
320904,西归日琼林苑赐宴即席
4413,奉和圣制送张说上集贤学士赐宴
153835,赐丁谓·践历功皆著
223604,徐孝克·自今所赐馔
241640,和张芸叟左司被赐资治通鉴
63369,元夕赐观灯·禁苑东风暖
748036,十八日自守口历宏赐镇边镇川三堡宿古庙作 其一
894797,赐状元文天祥以下
858006,御街行 赐衣袄子
1178932,千秋节赐群臣镜
361837,己亥十一月十三日南郊祭天斋宫即事赐太师
382026,诗·妖魂受赐欲报郎
617786,赐环纪恩 其一
1161186,奉和圣制左丞相说右丞相璟太子少傅乾曜同日上官命宴都堂赐诗
939480,三城侍郎寄示留题延庆寺二韵诗二章顷岁予肄业于此遗景尽在幸会之迹首唱之序详矣谨依命攀和但于首章增为四韵盖浅陋之才不觉辞费因遣稚子赞善大夫通判邠州事学古写于此牌以永嘉赐 其一
665237,赐藕
773862,恭和御赐杨制府诗原韵有序 其四
598916,题舒中赐大尹种德传芳图
275639,减字木兰花·尹默赐题寄庵词卷
941731,及第谢恩和御赐诗韵
1122084,赐第登楼 其二
613131,甄邦圣为兄鸣冤世所同义反坐十年神人共愤既而得释天心见矣廿馀年来家道徐徐而起莫非天祐岁丁丑正月邦圣病笃梦一神披发抚圣背曰义士也为兄报仇赐汝一纪之寿觉而渐愈始知玄帝所赐也岂非天哉足以传矣诗以纪之 其六
613131,甄邦圣为兄鸣冤世所同义反坐十年神人共愤既而得释天心见矣廿馀年来家道徐徐而起莫非天祐岁丁丑正月邦圣病笃梦一神披发抚圣背曰义士也为兄报仇赐汝一纪之寿觉而渐愈始知玄帝所赐也岂非天哉足以传矣诗以纪之 其六
656817,赐粽
547923,纪赐四十首 其十五 十月朔日颁历赐新书五十册岁以为常
547923,纪赐四十首 其十五 十月朔日颁历赐新书五十册岁以为常
648262,赐文渊阁五色菊一本应制
121555,再次韵·视草行看赐上樽
508715,景泰壬申九月初六日，经筵讲退，蒙召至文华殿。皇上负扆而立，面垂顾问，赐楮币一千贯。复遣中官赐雪花梨及鲜果一笼，荷恩感激赋此以识
508715,景泰壬申九月初六日，经筵讲退，蒙召至文华殿。皇上负扆而立，面垂顾问，赐楮币一千贯。复遣中官赐雪花梨及鲜果一笼，荷恩感激赋此以识
1237246,题奉元韩氏所藏蓝关风雪图孀亲赐绢并先陇画图三诗卷三首
507242,两蒙恩赐倭扇欣戴之馀赋此
739174,御赐砥石砚歌赠石庭上人
663134,黄冈张儒士清河张尹弟也上便宜七十五事既赐施行矣买舟南还搢绅多赋诗 其一
661279,寿府免见遣官来赐羊酒
340522,满庭芳·赐坐再赋
110019,诏修两朝国史赐筵史院和首相吴公原韵
281458,浣溪沙·诸君赐和再踵前韵
788025,皇父颁赐御制诗扇恭纪
66432,赐方教授诗
471981,纪赐四十首 其十四 八月十七日万寿圣节赐白金文币及镂金万寿福禄篆字银书黄朱灵符等物岁以为常
471981,纪赐四十首 其十四 八月十七日万寿圣节赐白金文币及镂金万寿福禄篆字银书黄朱灵符等物岁以为常
1074597,上巳日赐太师
896165,以茶芽焦坑送周德友德友来索赐茶仆无之也 其一
266855,赋谢吴门刘晓光吟台赐和乞正
644154,钦和御制山居诗赐灵谷寺住持 其九
91611,赐章服答诏·紫绶当时赐两人
91611,赐章服答诏·紫绶当时赐两人
385281,腊日与才伯小酌追怀去腊午门赐燕
184054,右赐赦宣德门
1074586,保和殿下荔枝成实赐王安中
541664,雪中谢赐藕少宰裴公元闇司寇谢公汉甫中丞郭公哲卿有作聊和 其一
1087839,秀野以喜无多屋宇幸不碍云山为韵赋诗熹伏读佳作率尔攀和韵剧思悭无复律吕笑览之馀赐以斤斧幸甚 其六
1152812,奉和圣制重阳日赐宴
691086,陵祀归得赐暖耳诗和方石韵四首（时和者颇众，类为骑字所苦）
980141,天宁节后二日集英殿赐燕辄成长句
1178989,赐道士邓紫阳
333315,恭闻诏书褒悼陈少阳赠官与一子恩泽赐缗钱五十万感涕
963710,恭和御制赐吴叔告已下闻喜宴诗
683112,谢蜀王赐果十首
101825,奉和圣制左丞相说右丞相璟太子少傅乾曜同日上官命宴都堂赐诗
948648,邦衡侍郎留金陵再用津字韵赋诗谢送赐茗复以丙申小春四銙寄赠
809153,赐圣感寺僧海岫
792925,叠韵答汪大清纯徐大挹泉赐和遣怀之作
690683,侯令博罗获上信下两年如一日矣公门桃李药笼参苓四境无弃物者独知之契物外之交惟萱一人实徼福焉一旦惠赐表庐曰圣世人龙何物老圃能无愧色而侯过情之誉有加无已复不惜綵毫更题啸傲烟霞一榜永光衡泌且贶以珠玉不一而足谓为老圃真面目以传老圃之神岂抱瓮荷锄者亦有葑菲可采乎九顿拜嘉即悬于百尺楼头喜而欲狂步侯来韵勉短赋谢珠玉在前不辞形秽
548428,赠管舍人御赐烛笔等物六首时丙戌新正二日王孝廉邸舍即席赋 其五 五色丝绦
17908,上巳日恩赐曲江宴会即事
811704,赐大将军安亲王岳乐二首
77104,恩赐龟紫
538925,寄汪中丞伯玉时以录闽功赐金币特诏推用 其一
1216089,岁己丑天寿节拜赐御酒作
2577,同望幸新亭赐钱公宴
471980,纪赐四十首 其十三 端午赐黄金艾叶银书灵符等物岁以为常
471980,纪赐四十首 其十三 端午赐黄金艾叶银书灵符等物岁以为常
401064,趁韵五和苗公留赐诗即呈大政
250309,诗·丰隆赐美味
185917,太平兴国七年季冬大雪赐学士
650510,元夕午门赐观灯 其一
61142,赐貂纪事用福清少师韵
18387,与沈杨二舍人阁老同食敕赐樱桃玩物感恩因成十四韵
600582,立春日赐宴和王见斋年丈韵
620210,重阳节赐百官宴先数日仍赐讲官酒馔
620210,重阳节赐百官宴先数日仍赐讲官酒馔
1006474,罢职还家汉卿叔赐诗和韵
1159757,奉和郑相公以考功十弟山姜花俯赐篇咏
667731,闻曹子仲礼缘近臣之疏蒙恩赐还
385664,恭和圣制作字以赐
541657,谢赐庆成宴具后合请建储毕婚用汉甫司寇韵
32717,蒙闽王改赐乡里
471982,纪赐四十首 其十六 十一月二十九日圣母万寿圣节赐金币镂金篆字黄朱灵符等物岁以为常
471982,纪赐四十首 其十六 十一月二十九日圣母万寿圣节赐金币镂金篆字黄朱灵符等物岁以为常
462753,太平花，社稷坛所见。小花浅红纯白，似桃而四出，原出蜀之青城山，千百枝萼繁密若缀骈萃成海，宋仁宗曾赐名太平瑞圣花 其一
1166243,奉和圣制赐王公千秋镜应制
108,赐诸州刺史以题座右
1088879,谢刘恭父玉潭月色真石室之赐
1037757,召赴天章宝文阁观御集赐御书飞白扇子群玉殿锡宴
644734,谢蜀王抚问赐药六首 其二
624092,族叔孚伯以诸生请老七十馀得赐爵一级
561546,皇储大庆侍读屠文升告赐汴藩便道过家省觐赋赠
579496,元旦赐宴
1236494,七月十二日奉诏以香酒赐曲阜代祀孔圣庙越五日别翰林诸友
577961,赐观灯诗五首　永乐二十年正月十五日进 其一
657966,孙地官以诗赐会儿且有第三句之说及韦斋扛鼎子之句遂和以自解
1210655,赐蒙固岱平章海青
656818,赐扇
317246,苏州天赐庄重谒梦苕师
386154,题桐城张相国赐园泛舟图
911581,恭谢侍读仁皇训典彻章御赐杜工部紫宸殿诗退朝口号并鞍马香茶 其二
905440,至性灵迂僻学术空虚幸逢好古之君获在藏书之府惟无功而禄重招髦彦之讥而多病所萦实喜优闲之任居常事简得以狂吟因成恶诗十章以蓬阁多馀暇冠其篇而为之目亦乐天何处难忘酒之类也尘黩英鉴幸赐一览下情不任兢灼之至 其八
1177091,恩赐魏文贞公诸孙旧第以?直臣
649997,清平乐 其一 赐从游万岁山词
991183,和范景仁王景彝殿中杂题三十八首并次韵 其十八 赐酒
482170,元夕赐观灯诗 其一
234674,天赐白·君不见书生镌羌勒兵人
502684,国子先生郑孟宣以赐告归省丘墓暇日访余新宁之沙堤余因载酒于沧洲野堂以宴之适文墨友方外交翕然来集酒酣乐甚分韵赋诗余得酒字时庚辰孟秋七月
698471,谢赐睿书
360899,即事赐诗·衮龙朱履午阶南
577534,元宵赐观灯诗五首 其三
287641,叶圣陶先生赐示道旁树十绝句赋七律奉酬
597887,送董太常得赐还上海
781247,衣轩堂翁汇梓太翁诗稿赐教赋赠
472104,赐貂纪事用福清少师韵二首 其一
360798,和中书梁侍郎君臣庆会阁赐御筵诗
547388,查虞皋仪部道出济上遣书赐问赋答二首 其一
183949,次韵王都尉团练押赐高丽归使宴射赠馆伴舍人
239263,奉和御赐进士诗
46575,唐昭宗赐钱武肃王铁券歌
922807,次韵李公择送新赐龙团与黄学士三绝句 其二
569485,马将军海盐之役以力战殉节特诏进世官二阶赐祠春秋飨祀弗绝其子总戎君建勋持重廉惠有大将风可谓世美矣因并及之
618431,圣寿赐文绮
650529,元夕赐观灯 其一
815066,壬辰1832春捧檄来澎随同芸皋先生观察查办抚恤蒙赐书画联扇赋诗申谢
893821,过都造朝入见之日蒙恩延登赐坐感天荷德退而成篇
506711,赐见东宫谢恩
414209,冬日遣兴二首酬家寰兄赐和 其一
916271,秘阁赐宴送右谏议大夫种放得假归终南山应制
129,千秋节赐群臣镜
983876,恭和御制赐进士诗韵二首 其一
649998,清平乐 其二 赐从游万岁山词
2034,皇帝降诞日集贤殿赐宴
320823,尧夫惠簟·使指及门传惠赐
428986,苏州天赐庄重谒梦苕师
556533,九日昆峰赐饮拟和刘静修先生九日九饮歌韵体 其六
949045,天赐白
894786,赐贾相
561777,诏赐金海乘凉诗 其三
928895,过武连县北柳池安国院煮泉试日铸顾渚茶院有二泉皆甘寒传云唐僖宗幸蜀在道不豫至此饮泉而愈赐名报国灵泉云三首 其二
522481,晚坐东轩睹水木山亭知为夏忠靖公赐第感旧怀贤得绝句八首 其三
1196277,御书飞白玉堂之署四字颁赐禁苑今悬挂已毕辄述恶诗一章用歌盛事
794954,踏莎行 佩卿夫人赐题一词，和韵答谢
809501,赐江宁文武将士宴于教场
891595,赐状元蔡仲龙
505432,奉和松轩公子敬受鞍马鹰鹘之赐
617794,黎仲赐
402530,右公书李昌符句赐赠用韵答谢
840521,贵阳李芘园尚书师命题赐环纪恩图三首 其二
1185193,御命归乡蒙赐锦衣
383228,辛夘九月乞休得请钦遣内使赍赐路费宝钞次日又遣内使赍赐白金文绮盖六卿日讲各有特恩也
383228,辛夘九月乞休得请钦遣内使赍赐路费宝钞次日又遣内使赍赐白金文绮盖六卿日讲各有特恩也
1016395,史太师入觐赐带以不知官高卑玉带悬金鱼为韵寄呈 其一
97940,佥判丈两赐新字韵诗因次韵兼简文显
561754,赐川扇在西苑作 其二
548426,赠管舍人御赐烛笔等物六首时丙戌新正二日王孝廉邸舍即席赋 其三 墨
980054,偶见夏英公与文庄公书云秋序始凉师门尚远又一书云念其出自师门赐一善地辄成绝句
426199,即席谢胡老赐宴
480204,陵祀归得赐暖耳诗和方石韵四首（时和者颇众，类为骑字所苦） 其二
402336,答喻蘅兄赐和 其一
788323,赐都统拉锡
404037,金缕曲·癸未小雪田遨词长赐题《延目词稿》弁言，谨步原韵以谢
1038279,近以洛花寄献斋阁蒙赐诗五绝褒借今辄成五篇以答来贶端明 其四
809226,赐大将军安亲王岳乐二首 其一
518465,谢赐睿翰神妙变化远法钟王臣子仪不胜欣跃赋诗以进 其三
426422,虚度八十深荷叶老惠赐五言三律敬步原韵并乞郢政 其一
163,中和节赐百官燕集因示所怀
2110,奉和圣制赐崔日知往潞州应制
989216,宣召看红木犀赐宴索诗并谢恩
1171347,批答安禄山贺雪兼赐口号
1190641,重和大庆堂赐宴元珰而有诗呈吴越王
894683,赐刘能真三首 其二
1156159,和杨六尚书喜两弟汉公转吴兴鲁士赐章服命宾开宴用庆恩荣赋长句见示
891220,赐陈抟 其三
880231,送梁伯赐归括苍三首 其三
525549,寄唐渔石司寇赐告归养
432309,甲寅夏历七月十三日益老两度赐宴赓得一读吴门胡老“搁笔吟”回周后陈以光老师又以“答谢胡心斋老先生四律”相示，因用其韵胡乱凑成四首，分呈胡李两老乞正，并面请益老斧削
383157,戊子九月寿宫随驾步视宝城还于东廊称贺玉音宣劳赐茶并赉綵花文绮等物
685709,赐观灯诗五首　永乐二十年正月十五日进
768590,瑶华慢 高澹人内翰入直南书房，上手摘白石榴一枚赐之，舍人尝不敢竟携归，命友人作半榴图，因题卷末
1211686,赐恩荣宴
1069882,太上皇帝御制题扇面所画红木犀赐从臣荣薿
156614,赐贾相·清明朝野遇清明
681722,赐扇
974476,题沈临江邀赐亭
809895,优隆主眷酬耆旧芸阁宸章赐绮筵赋得二月春风似剪刀
407959,满州里画界事竣，呈宋友梅中丞，兼索赐《边声诗集》 其二
13905,和人与人分惠赐冰
384680,再赐银币·流银嘉币上方琛
486752,醉太平 赐学士沈度
1156808,初授秘监拜赐金紫闲吟小酌偶写所怀
849683,恭和御制赐进士韵
180786,徙舍蒙大成赐诗
950754,闰月之腊诏赐银合腊药三首 其一
839632,和谢李邑侯赐题慎余稿首原韵四首 其四
669696,赐杨梅
263196,邵息庵阅倚云吟草蒙赐佳章次韵奉答
563093,敕赐午门百麦饼宴恭纪 其四
506724,赐游万岁山诗十首 其三
613887,同载赓命美赐炬公毅夜集圣符宅余独后至时圣符新婚
1112286,甲戌冬属疾赐告二首
426292,赋谢乔木先生赐画
246938,赐和·谁道诗人思路宽
552369,十骥咏 其三 御赐玉顶赤
1025745,好事近 汴京赐宴闻教坊乐有感
777022,恭记御赐平章台逆匾额于澎湖天后宫
156617,赐马廷鸾·古掖摛文步武高
462754,太平花，社稷坛所见。小花浅红纯白，似桃而四出，原出蜀之青城山，千百枝萼繁密若缀骈萃成海，宋仁宗曾赐名太平瑞圣花 其二
650004,清平乐 其八 赐从游万岁山词
570891,辱宗伯李公赐和六章词丽意深不揣续貂四绝仰尘清览 其二
541026,闻喜五咏 其四 宴赐琼林
1161941,奉和圣制九日言怀赐中书门下及百寮
309844,菩萨蛮·寂老赐示红梅和作击节之馀再酬一章
1016391,史太师入觐赐带以不知官高卑玉带悬金鱼为韵寄呈 其九
217802,闻馆中宣赐赏雪赋诗之会书五十六字呈秘阁侍
333648,辞免不允蒙恩遣中使降赐趣行不获已受命
962358,正蒙主文教授大著宠示佳章辄继严韵仰酬盛意之辱兼呈诸契丈幸赐采瞩正皇恐再拜 其五
370357,雪寒钱·加赐雪寒钱
513695,至河间之明日拜扫先世赐茔
416159,辘轳金井  避暑天赐庄冬天大学
1095504,刘簿分赐茶
647944,赐游东苑诗九章 其九 瑞匏
583472,大行人沈子高赍敕并镪币到太平府赐缜因赠
127901,宣召看红木犀赐宴索诗并谢恩
668546,再赐银币
367269,太上皇帝御制题扇面所画红木犀赐从臣荣薿
839631,和谢李邑侯赐题慎余稿首原韵四首 其三
13868,端午日伏蒙内侍赐晨服
1223810,三用韵答巢翁就以奎章赐墨赠之
538926,寄汪中丞伯玉时以录闽功赐金币特诏推用 其二
274935,黄农部见访赐诗病不能兴依韵和答
1057323,赐秦国大长公主挽词三首 其二
809688,总兵刘汉业补授肃州因地远职重特书御制诗截句一首赐之以奖武职惜兵爱民之意也
983753,沈无隐国正惠殿庐所赐香茶
882056,送朱叔赐赴闽中幕府二首 其一
905460,所苦之中无以遣闷更题新竹别献五章幸赐披览 其三
921664,卧病逾月，请郡不许，复直玉堂。十一月一日锁院，是日苦寒，诏赐宫烛法酒，书呈同院
1224689,泰定丁卯八月十二日崇天门传胪赐进士右榜第一人阿察赤左榜第一人李黼皆肄业国学日新斋余西厅授业生也是日京尹备鼓乐旗帜麾盖甚都导二状元入学谢师拜余明伦堂榜眼刘思诚探花郎徐容尝因同年黄晋卿彭幼元从予游亦拜其侧其馀进士以门生礼来拜谢杂遝不记姓名圜桥门而观者万计都人以为斯文盛事昔未有也同寅举酒相属偶成四绝以纪其事 其一
1156746,与沈杨二舍人閤老同食敕赐樱桃玩物感恩因成十四韵
756208,樊樊山先生赐题双修阁近作诗片七律一首谨次元韵赋谢（三首） 其一
809572,赐将军孙思克
894798,赐郑丞相
1074596,上清宝箓宫立冬日讲经之次有羽鹤数千飞翔空际公卿士庶众目仰瞻卿时预荣观作诗纪实来上因俯同其韵赐太师以下
225306,贾复·骁勇称奇赐左骖
159386,过都造朝入见之日蒙恩延登赐坐感天荷德退而
561843,纪赐十二绝 其六 赐绒锦护膝一双
561843,纪赐十二绝 其六 赐绒锦护膝一双
10845,端午日恩赐百索
466751,仙韵二首赠隅山主人并谢惠赐画作
337197,效王建体·金兽分香赐老臣
1131713,恭和御制以嘉雪愆候躬致恳祷精意上孚灵贶昭格己卯庚辰降雪盈尺赐相臣诗二首
1477,人日宴大明宫恩赐彩缕人胜应制
1164607,奉和御制璟与张说源乾曜同日上官命宴都堂赐诗应制
1236595,泰定丁卯八月十二日崇天门传胪赐进士右榜第一人阿察赤左榜第一人李黼皆肄业国学日新斋余西厅授业生也是日京尹备鼓乐旗帜麾盖甚都导二状元入学谢师拜余明伦堂榜眼刘思诚探花郎徐容尝因同年黄晋卿彭幼元从予游亦拜其侧其馀进士以门生礼来拜谢杂遝不记姓名圜桥门而观者万计都人以为斯文盛事昔未有也同寅举酒相属偶成四绝以纪其事
547530,大司空朱师分赐鲥鱼赋谢
737277,恩赐哆啰雨衣恭纪
432904,泉州守石有纪惠赐海错赋谢兼求万安桥碑
870222,御沟 赐果
1109513,送梁伯赐归括苍三首
894792,淳祐丙午讲礼记毕锡宴秘书省赐侍读少师郑清之以下
388713,鲁王将入粤，赐诗留别
1016049,御赐真赞师演成四偈 其四
561788,恭纪恩赐诗 其四 喜雨赐饮酒又皇女生赐白金彩币
561788,恭纪恩赐诗 其四 喜雨赐饮酒又皇女生赐白金彩币
561788,恭纪恩赐诗 其四 喜雨赐饮酒又皇女生赐白金彩币
948733,胡邦衡端明用癸巳旧韵宠赐佳篇辄续貂为不一之贺
385354,谢蜀王赐果·无才惭曳殿门裾
49751,西夏凯歌·诏赐田租墨未干
948910,进读三朝宝训终篇赐宴赐赉谢恩诗
948910,进读三朝宝训终篇赐宴赐赉谢恩诗
480203,陵祀归得赐暖耳诗和方石韵四首（时和者颇众，类为骑字所苦） 其一
809239,五日泛舟赐内大臣侍卫宴
547936,赐扇六韵
1031418,群玉殿赐宴
495994,法驾导引曲 上赐金符金仙人银太平牌应制三阕 其一
59949,喜雪歌赐兵部尚书张本
1034316,十八日上寿退赐坐十九日贡院锡宴二十一日紫宸殿御筵即事 其一
1196288,将就十章更献三首词虽愈拙诚即可矜或歌执事之风猷或导鄙人之情志愿宽捷给稍赐披寻 其一
1113948,所苦之中无以遣闷更题新竹别献五章幸赐披览 其二
916490,正冬御殿上寿乐章八首 其五 赐群臣第二盏酒宫悬作正安之曲
2778,书殿赐宴应制
