826242,临江仙·用李后主韵。民国廿流年七夕，余在沪，约诸友为南唐李后主逝世千年纪念。时兵氛方烈，风声鹤唳，举座黯然，旋约各赋词纪事，依后主虞美人、临江仙二调体韵，■之成卷。兹检出重读，如见诸故人，而大庵已于月前仙去，所绘残杏犹纷披满眼。时艰方棘，感痛滋深。因再和此阕，其为凄悒，殆不止山阳闻笛之悲已也
690483,母夫人遣急足入长安促就子舍从括苍以家仲蔚见怀诗至正余与仲蔚戊戌长安泣别日也时余亦以迎养引疾者一月矣仲复嘱余归当握手武彝山下循陔在原之感黯然对深因以三诗报焉
1070708,丙寅重九权郡李申之置酒严氏野趣亭爱其幽深因作此诗
1181286,驾部郑郎中三十八丈尹贰东周荣加金紫谷以末派之外恩旧事深因贺送
604620,母夫人遣急足入长安促就子舍从括苍以家仲蔚见怀诗至正余与仲蔚戊戌长安泣别日也时余亦以迎养引疾者一月矣仲复嘱余归当握手武彝山下循陔在原之感黯然对深因以三诗报焉 其三
1195743,鼎臣学士侍郎楚金舍人学士以再伤庭梅诗同垂宠和清绝感叹情致俱深因成四十字陈谢
604619,母夫人遣急足入长安促就子舍从括苍以家仲蔚见怀诗至正余与仲蔚戊戌长安泣别日也时余亦以迎养引疾者一月矣仲复嘱余归当握手武彝山下循陔在原之感黯然对深因以三诗报焉 其二
570031,顾仲韩携酒船相送倾倒尤深因赠仲韩并及张长舆朱氏三子
604618,母夫人遣急足入长安促就子舍从括苍以家仲蔚见怀诗至正余与仲蔚戊戌长安泣别日也时余亦以迎养引疾者一月矣仲复嘱余归当握手武彝山下循陔在原之感黯然对深因以三诗报焉 其一
