915503,胡英彦得欧阳公二帖盖训其子仲纯叔弼之语其一公自书之其一东坡书之英彦刻石以遗朋友吾叔父春卿得一本有诗谢英彦和焉万里用其韵以简英彦
592174,同惟敬夜过明卿得台字
505418,访马参卿得微字
932401,陈阜卿先生为两浙转运司考试官时秦丞相孙以右文殿修撰来就试直欲首送阜卿得予文卷擢置第一秦氏大怒予明年既显黜先生亦几蹈危机偶秦公薨遂已予晚岁料理故书得先生手帖追感平昔作长句以识其事不知衰涕之集也
879102,沁园春 十和 其二十五 林卿得女
549270,徐鸣卿得告南还赋赠
922706,王晋卿得破墨三昧，又尝闻祖师第一义，故画邢和璞、房次律论前生图，以寄其高趣，东坡居士既作《破琴》诗以记异梦矣，复说偈云。
227073,贺中斋黄大卿得子
100083,王晋卿得破墨三昧又尝闻祖师第一义
236251,深正卿得男以诗庆之
872826,沈正卿得男以诗庆之
388123,病答明卿·得汝怜贫惫
523994,别徐子祯卿得江字
966127,喜义卿得子端倅摄新守
510577,喜闻刘亚卿得请还东山
554873,赵松雪家垂云石太卿得之赋诗次韵
557190,同余德甫王元美夜集明卿得何字
372069,钱宗卿得当涂守
1094050,钱宗卿得当涂守
584163,贺闻山杨太卿得子用高吾得孙韵
886868,贺中斋黄大卿得子
637517,彦卿得子以诗来示依韵酬之
677570,同诸君携咀别何振卿得翩字
515605,贺徐原一亚卿得双生子
182294,喜义卿得子端倅摄新守
