657245,青县冻成青谶也同行尤之赋以解嘲
956691,逍遥楼席上赠张邦达教授张癸未省闱门生也同年进士俱会楼上者七人
712072,客有自粤西来者以石遗吾家宗虞曰此某将军所宝为王祥卧冰石也同人多为诗予歌以和之
389910,李程二生皆国手也同入张公洞视仙人局戏赠一绝
835150,高阳台 其二 光绪甲午仆年二十，举贤书，出瑞安黄公门下，明年公以女妻之，而为之蹇修者，房考会稽王公也。同人艳其事者交赋催妆，戏拈黄字赋博诸子一粲
966196,古今豪逸自放之士鲜不嗜酒以其类也虽以此致失者不少而清坐不饮醒眼看醉人亦未必尽得盖可考矣予好饮而尝患不给二顷种秫之念往来于怀世网婴之未有其会因作五言酒诗一百韵以寄吾意虽寄古人陈迹并及酒德之大概以为开辟醉乡之羽檄参差反复不能论次也同年兄唐仲章闻而悦之因录以寄庶几兹乡他日不乏宝邻尔
540042,李程二生皆国手也同入张公洞视仙人局戏赠一绝
1224689,泰定丁卯八月十二日崇天门传胪赐进士右榜第一人阿察赤左榜第一人李黼皆肄业国学日新斋余西厅授业生也是日京尹备鼓乐旗帜麾盖甚都导二状元入学谢师拜余明伦堂榜眼刘思诚探花郎徐容尝因同年黄晋卿彭幼元从予游亦拜其侧其馀进士以门生礼来拜谢杂遝不记姓名圜桥门而观者万计都人以为斯文盛事昔未有也同寅举酒相属偶成四绝以纪其事 其一
1236595,泰定丁卯八月十二日崇天门传胪赐进士右榜第一人阿察赤左榜第一人李黼皆肄业国学日新斋余西厅授业生也是日京尹备鼓乐旗帜麾盖甚都导二状元入学谢师拜余明伦堂榜眼刘思诚探花郎徐容尝因同年黄晋卿彭幼元从予游亦拜其侧其馀进士以门生礼来拜谢杂遝不记姓名圜桥门而观者万计都人以为斯文盛事昔未有也同寅举酒相属偶成四绝以纪其事
826230,菩萨蛮·卅年前与曾刚父、杨昀谷、陈石遗、罗瘿公、章曼仙、胡漱唐、赵尧生同集诗牌字为词。众剧赏上阕铜弦三句，余久忘全章。今冬偶忆前事，因足成此阕，虽所感不同，而情尘如接，真所谓感慨系之也。同人仅尧生与余在矣
1224690,泰定丁卯八月十二日崇天门传胪赐进士右榜第一人阿察赤左榜第一人李黼皆肄业国学日新斋余西厅授业生也是日京尹备鼓乐旗帜麾盖甚都导二状元入学谢师拜余明伦堂榜眼刘思诚探花郎徐容尝因同年黄晋卿彭幼元从予游亦拜其侧其馀进士以门生礼来拜谢杂遝不记姓名圜桥门而观者万计都人以为斯文盛事昔未有也同寅举酒相属偶成四绝以纪其事 其二
1189015,饯张七琚任宗城即环之季也同产八人俱以才名知
