1122115,頔上人持瑩萝月五诗见示因走笔和韵聊禦睡魔
320395,寒食宴北山席上走笔得松字
1116912,走笔次韵察推见别二篇
1083841,次韵郑郎中作四明谢遗尘九题走笔不二 其四 云北
28046,醉中先起李縠戏赠走笔奉酬
1027084,王原庆诉盘餐萧然走笔次韵 其一
292030,俞律诗兄督予先作《登庐山龙首崖放歌》，因走笔赋此，不知能入法眼否
187780,走笔谢王老丈惠花牋
798784,菩萨蛮 读温飞卿词，恍惚有悟入处，急走笔效之
713196,走笔送潘子登
999413,弼观罢走笔书后卷
596372,东山寺留别限韵走笔
621866,泊皖江走笔讯方肃之
704952,走笔
1192881,座中走笔送前萧使君
701122,下第蒙王大史宜学年兄走笔见慰且云切勿效时人叹老嗟卑也偶呈二章
1135236,癸未至节以病晚起走笔戏书纪事排闷十首 其一
672515,走笔谢石门赠东坡墨刻
1107468,次韵郑郎中作四明谢遗尘九题走笔不二 石窗
999477,走笔依韵和酬王彦霖四首 其一
537100,普晦去吏为道人为伯玉中丞募建肇林精舍值岁俭鲜应予辞晋臬未上聊出馀俸助之走笔短歌以赠
539819,吴峻伯校诸生走笔二绝 其一
1083916,走笔次韵吴判院
599626,邵少湄折柬有楼台将送暑凉露报新秋之句用何诗飘洒欣然余怀走笔答之 其二
912301,庆长叔招饮一杯未釂雪声璀然即席走笔赋十诗 其三
744122,友人有问余诗法者走笔答之
638299,七夕过怀玉水南寺遇丁玉夫索诗走笔奉答
569209,王上津季问生好佛以九日礼昙师化靖出沈嘉则长歌见示求赠言走笔应之
555230,送方寿卿秋官之京二首走笔和林见素韵 其一
922900,三月十七日三舍人宴集西省刘叔贡作诗贻坐客席上走笔和呈
570398,胡元瑞读鄙集有寄走笔四韵答之 其二
912715,走笔和张功父玉照堂十绝句 其八
999963,席上走笔赠别李子先
1083740,走笔次韵张以道 鹿亭
22146,走笔赠许玖赴桂州命
597680,王生卜居于东走笔赋赠
1128551,比作黑饭新茶二首未蒙文中县丞宠和走笔再赋以助一笑
947548,叔达及第书走笔答之
912298,庆长叔招饮一杯未釂雪声璀然即席走笔赋十诗 其五
807064,玉梅令  南耕所葺书舍，颜曰梅庐。昨始移得古梅一株，遽以誇我，走笔戏柬
570388,徐孟章索诗为赠走笔得三绝句 其三
683822,走笔寿表兄盛氏
583254,乡友陈廷评以道乞养南归示诗索和走笔二首 其一
583354,弘治十二年秋八月到靖康外叔祖陈廷圭赠诗一律席上走笔次韵三首 其三
360735,道源朝奉重阳后以诗招赏菊走笔答之
912716,走笔和张功父玉照堂十绝句 其一
207663,陈倅寄惠四诗用昌黎和裴相韵愧不能当也走笔
772268,读卓人孝廉「逐疫行」，走笔率成绝句 其二
772267,读卓人孝廉「逐疫行」，走笔率成绝句 其一
580163,成化庚子岁长至后八日余偕冯秋官佩之过同寅邵文敬第夜坐联句八首俱借韵走笔 其五
686707,赵文昌中乙榜雨中感怀见遗走笔和荅
479981,走笔送谢大参
773187,七夕范松浦郡守邀饮榕桥下书楸村给谏即席赋绝句余与同人既走笔和之复成一律仍用原韵
1090088,午暑睡起忽怀范武子走笔当简 其五
999474,走笔依韵和酬王彦霖四首 其四
583462,走笔次王文济宪副过安宁浴温泉之作韵
1135227,癸未至节以病晚起走笔戏书纪事排闷十首 其十
706452,走笔赠刘生思肯三首 其三
1028076,走笔送僧义冲
687709,高存之以湖山之游有门帖谕阍者走笔二绝代为谢客
999517,暮春伯宪留饮席上走笔戏成二首 其二
599535,吕亭驿走笔 其二
733037,走笔别程伯建
545446,薛生以七夕初度故小字巧巧又清斋学佛复有素素之称行父拉余过曲中薛持笺索题走笔赋此
631649,因峰顶侍者偶忆往事走笔寄晦林禅师二首 其一
990372,季直经干喜得三白次师绎韵见饷走笔奉和
705021,吕亭驿走笔
186547,走笔次韵·壮岁几成山水癖
1153623,走笔追王内丘
390011,王上饶将入觐与余有酒人燕市之约寻余赴留任归里君亦当便道省觐走笔戏赠
1113395,连日雪未能多曾无逸见惠二首遵欧苏律禁体物语及用故事走笔次韵
1131315,王原庆诉盘餐萧然走笔次韵
1077157,志宏送千叶莺粟走笔代简
574394,吴心远惠新茗重以盆蕙走笔谢之
990327,谭仁季以二诗见贻走笔次韵 其一
570796,上人自峨眉来云欲涉海礼补陀北礼五台走笔二绝赠之 其二
334795,丘舜臣遣人还乡托以家书时六月望因走笔寄主学胡君及士招学正诸同舍
549521,初任司理到任日吏用印报云升授吏科给事中虚套取喜何必乃尔走笔题其上
118310,六月十三日病起走笔寄仇池
601279,走笔题友人笑游海宇卷
176530,题叶山甫见惠古琴走笔以谢
1000185,依韵走笔和答徐无畏见招
950806,赵季茂通判惠诗走笔奉和十篇 其二
1135921,会鹤臞郑高士庵为予写神走笔赋杂言
1057397,北禅水阁走笔
971579,亭午欲过意复凄然偶引杯酒而沅陵丈送诗适至因走笔成两绝并呈教授兄 其二
599684,岐山亲家东厅雅叙走笔 其二
1126387,谭仁季以二诗见贻走笔次韵
552190,吴菊庵将军以黄玉辰题园亭诗索和走笔次之
566087,处州太守张叔载访予西湖山中走笔荅此一首
599890,走笔 其三
1078149,循梅道中遣人如江南走笔寄诸季十首 其七
599426,陈剑岩西游走笔送之
367108,小生日因与友人作文字饮醉中走笔
999447,升甫旋和答复走笔酬之
704899,走笔和海山舍弟订来樵之约
560100,戏题小扇诸侄各争先以讨走笔以荅之各回物状形十首 其七
1121476,小生日因与友人作文字饮醉中走笔
1234302,德昌总管雪后见过而余适往德清别业归来承惠诗走笔奉和
544659,王次公敬美寄惠计偕集叙走笔二律奉谢 其一
1112930,夜半走笔酬寿翁
713788,雷阳郡斋醉中走笔呈吴使君
137675,霁後看雪走笔呈元珍判官
900312,廖宪送牡丹用海棠韵复走笔戏和之 其二
1066973,比作黑饭新茶二首未蒙文中县丞宠和走笔再赋以助一笑 其一
1078143,循梅道中遣人如江南走笔寄诸季十首 其一
1113186,廖宪送牡丹用海棠韵复走笔戏和之
999703,走笔送杨正臣先辈还吴
721446,走笔送梁台佐赴粤西幕府二首
2806,座上走笔赠薛璩慕容损
971587,将至辰州走笔寄在伯教授二首 其一
912714,走笔和张功父玉照堂十绝句 其四
1003194,定风波  赏牡丹席上走笔
103213,走笔送王琪
537696,得舍弟试文喜其必第走笔寄之
92623,即席走笔·老子那知鬓脚凋
434768,高武略复和尖字韵见赠走笔奉酬
915056,上巳日予与沈虞卿尤延之莫仲谦招陆务观沈子寿小集张氏北园赏海棠务观持酒酹花予走笔赋长句 其一
327759,七夕范松浦郡守邀饮榕桥下书楸村给谏即席赋绝句余与同人既走笔和之复成一律仍用原韵
83945,病中数辱曾无逸架阁见问今日忽闻徙居走笔奉
536978,走笔恼徐汀州入计
948665,杨子直示还寿皇御批制草熟状将以新诗叹服匠手走笔奉酬既谢厚贶且为王春度玉墀之祝
1007193,陈石泉送诗走笔次韵
92620,即席走笔·急雪穿帘绕蜡灯
911149,子金舅出示雁湖和章走笔为谢三首 其二
921043,罢徐州，往南京，马上走笔寄子由五首 其二
1068931,景蕃暂如无锡不暇相寻于云间诗来问讯甚殷勤会予续至江上遂及邂逅走笔奉呈
1157824,醉后走笔酬刘五主簿长句之赠兼简张大贾二十四先辈昆季
896679,喜雪走笔呈李宣城三首 其一
1066968,蒙文中县丞以诗送苦笋走笔六首为谢 其四
604253,欧子建邓伯乔招同黄元卿李烟客雅集即席探题各赋一体余得竹素草堂走笔却赠
879184,贺新郎 其二十七 实之三和有忧边之语，走笔答之
1051971,走笔和萧推官迎提举承议 其二
368178,走笔代书寄岊仲七弟
281680,江山楼席上走笔赋别
389117,走笔二绝·金沟清泚楝花香
357649,走笔·公圃荒凉此物无
560094,戏题小扇诸侄各争先以讨走笔以荅之各回物状形十首 其一
1137978,省斋寄诗用韵走笔以谢 其二
599806,走笔奉和陈唐山见怀之作
95900,早过桃川不能谒一庵走笔寄之
902575,走笔和曾无逸掌故约观玉照堂梅诗六首 其五
499350,高梁桥陪诸公会饮遇雨走笔戏呈
34928,走笔送义兴令赵宣辅
135212,史清翁谈诗走笔次韵
853336,十二月二十四日雪盖予三年于淮才见此耳时东师援淝水捷书西来走笔呈赵公借官奴与幕友一醉
1137979,省斋寄诗用韵走笔以谢 其一
1018382,走笔代颜西叔次途中即事之什
1170832,评事翁寄赐饧粥走笔为答
950807,赵季茂通判惠诗走笔奉和十篇 其八
915342,走笔谢张功父送似酴醾
367093,夜读元容良臣登云阁上旧轴因走笔作诗以寄二公
387433,走笔谢石门赠东坡墨刻
1207683,八月廿一日惟寅徵君踏雨过林馆为留终日因诵近赋绝句三首爱其词致清婉辄走笔次韵如上古道寥寞人以角逐声利为务惟寅独逍遥恬淡之乡时来□之篇章翰墨之事岂易得也哉 其二
1116267,走笔酬亨甫所示二篇次韵和之
194969,琳老惠麸乾隆走笔奉寄
1103771,周德言游小庐山观余壁间诗次韵示教走笔奉谢 其二
712035,走笔送袁士旦归江南兼怀魏凝叔和公杨长苍二首 其二
677004,将赴试白下走笔别荃之
1067007,走笔再和凤凰山十韵酬良器解元兼呈文中宣德 其一
1063902,宝月偶值报慈坐中走笔
570695,意上人一梓甓婆罗门弃家入道通习三乘援苏学士赠乡僧文老例乞余一言走笔应之 其二
948526,从驾过德寿宫马上得程泰之次庚寅玉堂旧韵有银章金带之戏走笔为谢
948122,七兄夜以小诗相戏走笔和韵
570566,穆考功敬甫早岁乞休惟以读书苦吟为事今年拟少陵秋兴八首使其子光胤习右军书书之见寄走笔为谢得四绝句 其三
570314,余佐留枢诸曹掾中有南充刘璋者偶诸生试其文烂然已而竟从本格得官将归省叩余秋署乞一言之赠若有不释然者余闵其意走笔得二绝句付之时方乞休在告也 其一
1226511,余山林多暇瞌睡之馀偶成偈语自娱纸墨少便不欲记之云衲禅人请书盖欲知我山中趣向于是静思随意走笔不觉盈帙故掩而归之复嘱慎勿以此为歌咏之助当须参意则有激焉 其二
570315,余佐留枢诸曹掾中有南充刘璋者偶诸生试其文烂然已而竟从本格得官将归省叩余秋署乞一言之赠若有不释然者余闵其意走笔得二绝句付之时方乞休在告也 其二
562173,九月望日钱塘玛瑙寺僧照觉原过幽湖读书所出示诗数篇因其别也走笔赋诗一首为赠且有紫微山之约云
596448,谈元翼举子拟拉泛江走笔促之三首 其一 初促
1027417,史清翁谈诗走笔次韵
583155,九月九日寓九江时户部李时雍同年预约游庐山以是日雨作中辍时雍复遣人送酒侑以一绝因走笔戏答四绝 其四
604800,甲寅生日李康侯广文以诗见寿对使走笔用来韵
247690,菊庵道兄以诗见讯走笔却寄
712410,走笔送梁台佐赴粤西幕府二首 其一
912719,走笔和张功父玉照堂十绝句 其十
1065487,道源朝奉重阳后以诗招赏菊走笔答之
546694,卧病舟中旬日永叔命郎君过讯走笔赋赠二章 其一
158815,张文通以诗觅小桃走笔依韵和答
1165958,走笔赠许玖赴桂州命
174537,雪中走笔寄邓延硕
1135194,春半久雨走笔五首 其三
24000,评事翁寄赐糖粥走笔为答
92625,即席走笔·长廊尽处绕梅行
187955,汤参议惠莲走笔以谢
1051289,布作高阳台众乐园成被命与金陵易地兄弟待罪侍从对更方面实为私门之庆走笔记子开弟
1063432,走笔赠仙姑
903253,陈子西投赠长句走笔次韵奉酬
103214,走笔戏邵兴宗
158131,升甫旋和答复走笔酬之
158273,走笔依韵和杨进士倜登南楼之作
911150,子金舅出示雁湖和章走笔为谢三首 其一
647054,初夏走笔和湘灵
1161899,太原郑尚书远寄新诗走笔酬赠因代书贺
771754,宿大坪庄，夜半风雨骤至，走笔率记
470599,送汪伯昭游白门伯昭将自京口至栖霞寺因忆旧游走笔得四绝句 其二
1234418,余山林多暇瞌睡之馀偶成偈语自娱纸墨少便不欲记之云衲禅人请书盖欲知我山中趣向于是静思随意走笔不觉盈帙故掩而归之复嘱慎勿以此为歌咏之助当须参意则有激焉 其十三
546629,祝生如华旧从余学诗溪上一别三载馀是秋余羁寓武林忽棹扁舟来谒投我七言律四章风骨崚嶒殊可喜愕于其行也走笔五绝勉之 其二
1135228,癸未至节以病晚起走笔戏书纪事排闷十首 其九
8834,江阁卧病走笔寄呈崔卢两侍御
709699,走笔询家兄山中潴水复满几尺
1245655,宗叔方逸来邑走笔寄上
1135195,春半久雨走笔五首 其二
510396,龙山吟走笔和陈冕 其三
721298,走笔送袁士旦归江南兼怀魏凝叔和公杨长苍二首
991956,刘弟示诗一轴走笔答之
570567,穆考功敬甫早岁乞休惟以读书苦吟为事今年拟少陵秋兴八首使其子光胤习右军书书之见寄走笔为谢得四绝句 其四
704909,岐山亲家东厅雅叙走笔
1066965,蒙文中县丞以诗送苦笋走笔六首为谢 其一
760382,少瀛以诗舲自寿诗索和，走笔书此
420647,满江红 娟净谱平韵，走笔和之
333621,家问自闽中转来走笔寄诸弟
585528,走笔答柯双华佥宪
912718,走笔和张功父玉照堂十绝句 其七
921046,罢徐州，往南京，马上走笔寄子由五首 其五
923083,走笔奉酬签判殿丞游思上人院
956355,己丑中秋寓宿玉堂闻沈公雅大卿刘正夫户部集张园赏月走笔寄之
1122584,走笔寄师川三绝
102938,将解舟走笔呈表臣
903251,连日雪未能多曾无逸见惠二首遵欧苏律禁体物语及用故事走笔次韵 其一
999450,文通复用旧韵相示仍走笔和之
539910,走笔呈王使君 其二
563150,谭广文练江相见走笔为赠
539820,吴峻伯校诸生走笔二绝 其二
753914,徐夫人以西湖图见赠走笔谢之
160437,去冬蒙君实示嘉篇懒拙不即修谢临书走笔深愧
1124020,将至辰州走笔寄在伯教授二首
580164,成化庚子岁长至后八日余偕冯秋官佩之过同寅邵文敬第夜坐联句八首俱借韵走笔 其六
919741,走笔谢高秘书送示诗文
704908,走笔招区顿池四表
546632,祝生如华旧从余学诗溪上一别三载馀是秋余羁寓武林忽棹扁舟来谒投我七言律四章风骨崚嶒殊可喜愕于其行也走笔五绝勉之 其五
712955,走笔送黄叔威兼柬高固斋
1003182,西江月  元夕醉中走笔
1144106,送男存心如燕二月二十五日夜走笔古体
596462,饮陈氏别墅走笔
494806,承邓贲斋以诗报到普惠寺走笔依韵迓之
624649,赤城道人与傅由庚居士共订出世之约将拟结茅水竹见示缘册走笔戏题
705663,吁嗟行走笔示张子石
1208590,苏伯脩脩撰分院滦阳众仲（陈）君实（王）有诗送行读之洒然动人清兴走笔拟之
537649,峻伯将至先以诗来走笔邀之
370602,走笔答上饶
914027,从范至能参政游石湖精舍坐间走笔二首 其二
604843,过骆达叔湖园留酌夜归灯下对使走笔赋谢
570447,走笔赠张将军赴岭外
521623,皮沟闸阁浅都水曹元孝郎中以书来迓自云困于沽头走笔戏简
140768,陈子西投赠长句走笔次韵奉酬
948724,秋官少常伯失杯复得乃好客之报来诗误认天意遂欲因噎废食走笔次韵发笑
580166,成化庚子岁长至后八日余偕冯秋官佩之过同寅邵文敬第夜坐联句八首俱借韵走笔 其八
1049630,走笔代书寄岊仲七弟
570564,穆考功敬甫早岁乞休惟以读书苦吟为事今年拟少陵秋兴八首使其子光胤习右军书书之见寄走笔为谢得四绝句 其一
915210,庆长叔招饮一杯未釂雪声璀然即席走笔赋十诗 其十
273035,北郊醉酒谭希吕掖归明晨走笔
993033,闻曼叔腹疾走笔为戏
389052,谢病闲行至摄山而司马故部刘将军驰送出一扇乞诗走笔得五言绝与之
218752,将有远行走笔效江西体赠叔嘉
700961,甲寅秋麦盛际返自晋阳过我斋头别之次日寄我以诗兼惠仪物走笔赋答
958998,頔上人持瑩萝月五诗见示因走笔和韵聊禦睡魔 其三
599826,七月三日午刻走笔
1021055,丁巳灯夕前六日观抱拙寄敏斋韵因事有感走笔以赋
325836,走笔次韵吴判院
207700,使君见示鹿鸣诗走笔奉和
479652,壬申正月十九日过北野同南村访北花园废址明日北野有诗仍用清虚堂韵走笔奉答
49625,走笔答赠胡京孺
1018383,走笔酬黎德夫
187163,张道夫惠大小砚五走笔戏谢
597644,闻侄儿应昆昨始发蒙走笔赋此兼贻示后生
539907,为冯生走笔赠别杨都督二绝 其一
546630,祝生如华旧从余学诗溪上一别三载馀是秋余羁寓武林忽棹扁舟来谒投我七言律四章风骨崚嶒殊可喜愕于其行也走笔五绝勉之 其三
353604,有喜真爱亭梅花开走笔呈转庵
538031,余忝督郧楚与季朗后先发辱以丽赋见赠且出扇命诗走笔酬谢
1083844,次韵郑郎中作四明谢遗尘九题走笔不二 其七 潺湲洞
142054,见寄·坐想云烟走笔端
159990,和子华兄寄酒走笔
92159,即席走笔·燕宁轩里集群仙
218776,叔达及第书走笔答之
904638,大雨水忧三堰决坏且念吾挺之在病无与共此忧者因走笔为问四首 其二
1189789,李羽处士寄新酝走笔戏酬
1226519,余山林多暇瞌睡之馀偶成偈语自娱纸墨少便不欲记之云衲禅人请书盖欲知我山中趣向于是静思随意走笔不觉盈帙故掩而归之复嘱慎勿以此为歌咏之助当须参意则有激焉 其十
992148,余之亲家有女子能点酥为诗并花果麟凤等物一皆妙绝其家持以为岁日辛盘之助余丧偶儿女服未除不作岁因转赠通判通判有诗见答故走笔酬之
324811,竹院昙老病目寄诗索和走笔次韵
390056,走笔寿表兄盛氏
794578,点绛唇 悔堂弟将至，走笔迎之
94646,走笔谢吉守赵判院分饷三山生荔子
614367,走笔示刘郎
1082984,谒希哲不遇轩上走笔
580162,成化庚子岁长至后八日余偕冯秋官佩之过同寅邵文敬第夜坐联句八首俱借韵走笔 其四
1144353,癸酉三月园亭小饮之明日又适澹斋所薄暮醉归广文寄佳句二首走笔次韵
26390,李羽处士寄新酝走笔戏酬
599879,走笔奉别陈省斋 其一
76271,九月一日夜读诗稿有感走笔作歌
854967,琳老惠麸乾走笔奉寄
1115816,上巳日予与沈虞卿尤延之莫仲谦招陆务观沈子寿小集张氏北园赏海棠务观持酒酹花予走笔赋长句
152332,七兄夜以小诗相戏走笔和韵
971430,张伯永折梅走笔谢之
1156453,偶于维扬牛相公处觅得筝筝未到先寄诗来走笔戏荅
999513,韩及甫惠陕梨走笔书句谢之
560103,戏题小扇诸侄各争先以讨走笔以荅之各回物状形十首 其十
950877,鹿鸣宴中走笔呈林教授
537778,虚白上人出关后走笔问之
626925,甲寅秋麦盛际返自晋阳过我斋头别之次日寄我以诗兼惠仪物走笔赋答 其一
948235,刘韶美监丞以予发策玉堂小诗送笔墨云腹囊英物吐长虹翰墨区区有底功也要同盟作旗鼓三山直上一帆风走笔次韵时在雨中
494456,走笔偶赠省元唐子元殊
599827,走笔答何次澜见寄
948497,七月十四日江西美约周愚卿兄弟及许景阳相过共观鹤雏羽毛褐色因饮食双投新酒擘闽中新荔放白莲池上遂成胜赏明日西美有诗走笔奉和
876493,仲晦监簿和放翁七十三吟三篇华予初度走笔□韵答之 其二
713823,东湖走笔寄詹明府
522060,壶阴阻冰河下用前赠行韵见寄有悔心焉走笔戏荅 其一
158271,仲灵禅师以诗见邀辄走笔依韵附还使奉和
622145,与今础至蕲春同话一署因及旧事州茂才袁道长兄弟翩然相顾各以诗章见赠走笔步韵答其一
509477,予整兵西巡辱中贵韦公携酒邀太监陈公王公同饯别行台酒酣韦公探唐人早朝诗和韵见赠走笔立就词致高远观者竦然起敬公复属予和辞不获已且重公之为人避权辞名有古人风因草草步韵并及之
1078151,循梅道中遣人如江南走笔寄诸季十首 其九
1115592,走笔送济翁弟过浙东谒丘宗卿二首
919740,走笔次韵黄观复学士二首 其一
320475,走笔呈承君
1120357,走笔次李仁甫夜直观月韵二首
1000156,丙午寒食厚卿置酒压沙寺邀诸君观梨花独苏子由不至以诗来邀席客同作予走笔依韵和之
1063660,七月七日晚步至齐云楼走笔赠吴邦直
1067011,走笔再和凤凰山十韵酬良器解元兼呈文中宣德 其五
843015,日本阪口五峰自其国电索予书走笔应之
1006347,天游以前韵赋雪诗走笔和
1078147,循梅道中遣人如江南走笔寄诸季十首 其五
1063019,赤尉苏太原寄半丈红走笔谢之
999704,走笔谢司徒侍中惠柑
1089509,有喜真爱亭梅花开走笔呈转庵
649418,龙洲姚老人献山薯土瓜获受恩赏临归乞诗走笔书三绝句 其三
158275,公度惠花走笔戏谢
599492,走笔奉和匡南见寄 其二
1176295,袭美醉中寄一壶并一绝走笔次韵奉酬
546628,祝生如华旧从余学诗溪上一别三载馀是秋余羁寓武林忽棹扁舟来谒投我七言律四章风骨崚嶒殊可喜愕于其行也走笔五绝勉之 其一
732684,五夜余澹心涂次尾及同乡诸兄招饮河房时大雨如注经宵不歇醉归走笔记之
231910,天游以前韵赋雪诗走笔和
522022,海虞施君精地理卜筮之学别予南去约以高秋会于云间走笔有赠
1090416,林子长惠芡实走笔为谢
583507,都宪林见素示和山谷赠咎茶歌走笔次韵
683889,意上人一梓甓婆罗门弃家入道通习三乘援苏学士赠乡僧文老例乞余一言走笔应之
1227331,中秋走笔
659144,东冈有只愁风雨似今朝之句走笔次韵荅之
460688,除夕走笔
141211,暑中杨伯虎见访翌日有诗来因走笔次韵
544986,与朱在明订期江上十年矣是秋北上余复病不能赴约走笔寄此并询诸郎
599681,走笔招区顿池四表 其一
539908,为冯生走笔赠别杨都督二绝 其二
1067016,走笔再和凤凰山十韵酬良器解元兼呈文中宣德 其十
631650,因峰顶侍者偶忆往事走笔寄晦林禅师二首 其二
501338,安南使者同时敏大夫登舟相访献诗述怀一首就坐走笔次韵答之以纪一时盛事云
347242,周德言游小庐山观余壁间诗次韵示教走笔奉谢
1028072,旱久无水王伯容分惠桃源大溪泉将以长篇水至已雨走笔次韵
923081,走笔次韵察推见别二篇 其一
1105642,余全之赠菊栽二十品并示三十绝走笔二绝酬之
469304,走笔戏赠万伯修使君二首 其一
685887,谈元翼举子拟拉泛江走笔促之三首 初促
1218474,元正二日喜雪走笔示诸侄
501599,古心上人颜其禅轩曰爱松林梅隐氏为作图索余赋诗因走笔题之
915509,赴调宿白沙渡族叔文远携酒追送走笔取别
692357,龙洲姚老人献山薯土瓜获受恩赏临归乞诗走笔书三绝句
999475,走笔依韵和酬王彦霖四首 其三
683833,走笔再送冯使君之楚
921034,作书寄王晋卿，忽忆前年寒食北城之游，走笔为此诗
1090084,午暑睡起忽怀范武子走笔当简 其一
367232,醉中走笔·二妙高轩肯过门
683821,胡元瑞读鄙集有寄走笔四韵答之
322369,点绛唇·悔堂弟将至，走笔迎之
621333,柳絮三者客舍晚坐走笔题歌者扇 其三
115945,喜雪走笔呈李宣城
1006721,王深道别酒走笔次韵
154203,走笔次韵黄观复学士
494582,期邹谦之不至，走笔寄之
697411,卧病舟中旬日永叔命郎君过讯走笔赋赠二章
91889,赴调宿白沙渡族叔文远携酒追送走笔取别
685213,弘治十二年秋八月到靖康外叔祖陈廷圭赠诗一律席上走笔次韵三首
948300,走笔次李仁甫夜直观月韵二首 其一
1135230,癸未至节以病晚起走笔戏书纪事排闷十首 其七
1083843,次韵郑郎中作四明谢遗尘九题走笔不二 其六 樊榭
1084095,适过宝奎寿居仁师出示王判院偈真隐老子走笔次韵
158818,张升甫惠新笋走笔代简谢之
613511,醉歌走笔示胡伯连
739385,俭堂饷水西庄红菱走笔奉谢
372780,走笔戏呈机宜著作与诸同席
583413,再用前韵走笔答方时鸣侍御二首 其二
87113,方具免牍走笔次竹溪中书韵
570399,胡元瑞读鄙集有寄走笔四韵答之 其三
540267,金翁八十矣为小祇园作新词游戏三昧语走笔为谢 其二
240588,醉中走笔次赵彦和韵
1113778,大雨水忧三堰决坏且念吾挺之在病无与共此忧者因走笔为问四首
540250,周公瑕导余至胥口不能渡走笔有嘲
912723,走笔送济翁弟过浙东谒丘宗卿二首 其一
701269,送方寿卿秋官之京二首走笔和林见素韵
133841,走笔和君锡尧夫
539779,走笔二绝赠弈者刘生 其一
1127451,走笔依韵和酬王彦霖四首
637970,辛丑得年四十三七月初见髭一茎白者走笔赋此
543675,蚤春苦雨邦相明府见过留饮斋中竟夕走笔放歌为今雨行并怀燕社诸子
1066970,蒙文中县丞以诗送苦笋走笔六首为谢 其六
953596,霁后看雪走笔呈元珍判官二首 其一
201433,走笔次廷藻韵二绝
608231,独酌梅花下走笔索陈山人画梅
1139487,客谈矩山大资近事近诗及新相麻云欲浮海以安归走笔附讯
1083010,小生日因与友人作文字饮醉中走笔 其二
1168359,走笔赠独孤驸马
92158,即席走笔·酒香端的似梅无
1062976,雨中走笔招唐臣徐子明饮
1071830,走笔谢人送酒
76944,大醉梅花下走笔赋此
685219,斋居对雪走笔次韵答清溪赵司寇兼柬王与时胡伯珩黄伯固二首
1000177,走笔送张伯起
774142,庄副使惠女贞酒走笔赋谢
176580,溪亭夜集走笔
1113979,循梅道中遣人如江南走笔寄诸季十首
