541885,终南仙人引走笔遣怀
537013,林公励志薰修七日不食走笔问之
140948,走笔和曾无逸掌故约观玉照堂梅诗
1207684,八月廿一日惟寅徵君踏雨过林馆为留终日因诵近赋绝句三首爱其词致清婉辄走笔次韵如上古道寥寞人以角逐声利为务惟寅独逍遥恬淡之乡时来□之篇章翰墨之事岂易得也哉 其三
664411,孙塘秀才以芍药二枝见赠走笔奉谢 其二
427874,好事近 叶子琳由合浦寄贻龙眼肉，走笔报谢
599683,岐山亲家东厅雅叙走笔 其一
827951,贻先弟见予戒坛松诗遂梦至戒坛见松高数丈涛声如雷惊寤寄书相告并感怀四首走笔和之
1089127,王龟龄遣妓送酒赐诗走笔为谢
912720,走笔和张功父玉照堂十绝句 其三
154202,走笔谢高秘书送示诗文
1135846,五月十四日梅雨始通走笔二十韵
510394,龙山吟走笔和陈冕 其一
494564,走笔寄题守愚高乡宾
990266,桂阳走笔呈以道
704900,邵少湄折柬有楼台将送暑凉露报新秋之句用何诗飘洒欣然余怀走笔答之
1060593,走笔送叔牙
176203,走笔次月夜颐斋见寄
1103770,周德言游小庐山观余壁间诗次韵示教走笔奉谢 其一
949819,寓宿黄观复书堂晨至海棠花下走笔呈苏召叟
190523,走笔为谢·词源病起不全枯
1078144,循梅道中遣人如江南走笔寄诸季十首 其二
580161,成化庚子岁长至后八日余偕冯秋官佩之过同寅邵文敬第夜坐联句八首俱借韵走笔 其三
545008,闻汪伯玉至自京口暂寓武林僧舍走笔代柬并以奉期
207842,季直经干喜得三白次师绎韵见饷走笔奉和
1085204,余全之赠菊栽二十品并示三十绝走笔二绝酬之 其一
1047751,走笔酬亨甫所示二篇次韵和之 其二
896677,喜雪走笔呈李宣城三首 其三
94645,走笔送赵正则司户来访皈觐亲庭
570387,徐孟章索诗为赠走笔得三绝句 其二
190524,走笔为谢·运数从来略相似
911148,子金舅出示雁湖和章走笔为谢三首 其三
510398,龙山吟走笔和陈冕 其五
900311,廖宪送牡丹用海棠韵复走笔戏和之 其一
557363,王子夜半来过席间有赠走笔相荅
570658,袁绳之太常起家赴南少司空走笔为赠 其三
622106,风泊洪都何非鸣明府榼酒相贻走笔谢之
697399,祝生如华旧从余学诗溪上一别三载馀是秋余羁寓武林忽棹扁舟来谒投我七言律四章风骨崚嶒殊可喜愕于其行也走笔五绝勉之
1151997,座上走笔赠薛璩慕容损
677021,西湖泛舟走笔戏呈同游诸子
709640,竹下走笔简薛二
902579,走笔和曾无逸掌故约观玉照堂梅诗六首 其一
208136,走笔酬黎德夫
420720,风流子 其二 年来家国多故，环境日非，四顾茫茫，生趣日促。因走笔书此，以寄孤愤
94647,走笔送济翁弟过浙东谒丘宗卿
599493,走笔奉和匡南见寄 其三
1226510,余山林多暇瞌睡之馀偶成偈语自娱纸墨少便不欲记之云衲禅人请书盖欲知我山中趣向于是静思随意走笔不觉盈帙故掩而归之复嘱慎勿以此为歌咏之助当须参意则有激焉 其一
599842,走笔附寄安寓方田二表
400241,芰荷香 静庵倚此调见怀，清夜孤坐，即以同部走笔却寄
570675,百谷别余礼补陀出此扇索题走笔戏之
560098,戏题小扇诸侄各争先以讨走笔以荅之各回物状形十首 其五
1090089,午暑睡起忽怀范武子走笔当简 其六
1083845,次韵郑郎中作四明谢遗尘九题走笔不二 其八 青棂子
599536,吕亭驿走笔 其三
869148,走笔和君锡尧夫
740064,酒肆走笔戏赠汪苍岩
352141,走笔戏呈世叔伯达二亲友
354531,走笔和萧推官迎提举承议
1082556,走笔和孔纯老催诗债次韵
912722,走笔送济翁弟过浙东谒丘宗卿二首 其二
314154,姚叔祥以诗卷见示走笔书赠
877023,郑宁示边报走笔戏赠
1101715,走笔和法石纪游
187757,走笔送韩昕伯谒任广文
1153624,走笔谢孟谏议寄新茶
772271,读卓人孝廉「逐疫行」，走笔率成绝句 其五
1078150,循梅道中遣人如江南走笔寄诸季十首 其八
912295,庆长叔招饮一杯未釂雪声璀然即席走笔赋十诗 其二
105942,走笔送僧宣无言归泉南
683708,走笔呈王使君
1054140,走笔 其一
1107395,南岳高台长老道光尝为灵源清侍者邂逅一见颇能谈其行戒走笔为赋两绝赠之
1066974,比作黑饭新茶二首未蒙文中县丞宠和走笔再赋以助一笑 其二
494487,走笔赠萧上舍归潮阳
1224256,题王山仲所藏潇湘八景图卷走笔作 其三 平沙落雁
80824,卯酒径醉走笔
664390,胡菊泉惠我丈菊走笔谢荅四首 其一
1195839,走笔送义兴令赵宣辅
102580,作书寄王晋卿忽忆前年寒食北城之游走笔为此
1090085,午暑睡起忽怀范武子走笔当简 其二
964838,走笔次月夜颐斋见寄
543933,伯隅童子冶卿持扇索题走笔一律赠之
470600,送汪伯昭游白门伯昭将自京口至栖霞寺因忆旧游走笔得四绝句 其三
604802,韩寅仲以诗见寿对使走笔用来韵赋谢
1083846,次韵郑郎中作四明谢遗尘九题走笔不二 其九 鞠侯
544660,王次公敬美寄惠计偕集叙走笔二律奉谢 其二
1226515,余山林多暇瞌睡之馀偶成偈语自娱纸墨少便不欲记之云衲禅人请书盖欲知我山中趣向于是静思随意走笔不觉盈帙故掩而归之复嘱慎勿以此为歌咏之助当须参意则有激焉 其六
1115577,走笔和张功父玉照堂十绝句
423288,北郊醉酒谭希吕掖归明晨走笔
447305,偶翻旧日影集感不能已走笔成此
900134,二使者游东山酒后寄诗走笔次韵 其一
421979,蔡铁生出狱，以蛰龙吟寄示，走笔报之
570660,吴生得神符治余少子士骏疟应手即愈走笔赠之
570485,晓上人自云能草书转法华千遍谒补陀落迦者再矣告余且复往走笔反前韵止之 其一
1127444,暮春伯宪留饮席上走笔戏成二首
540160,用晦寄四种杯仍系以诗走笔二绝为谢 其二
919739,走笔次韵黄观复学士二首 其二
421618,江山楼席上走笔赋别
389116,于鳞寄太行诸篇走笔以谢
419445,满江红 大厂居士以丙子清明再用文信国改王昭仪词韵见寄，走笔奉酬，兼呈不匮室主
1115674,观张功父南湖海棠杖藜走笔三首
915273,观张功父南湖海棠杖藜走笔三首 其一
183515,王都尉示及吕丞相柳溪图诗见邀同作走笔奉呈
879832,走笔送韩昕伯谒任广文
1060590,走笔寄师川三绝 其一
1154386,力疾马上走笔
