429468,偶过厂肆得樊山翁手写所为十鞬斋诗若干卷卷耑有李越缦张篑斋辈题识盖光绪庚辰癸未之间作也走笔成长句柬翁乞和
1139018,癸酉三月园亭小饮之明日又适澹斋所薄暮醉归广文寄佳句二首走笔次韵 其一
470601,送汪伯昭游白门伯昭将自京口至栖霞寺因忆旧游走笔得四绝句 其四
1135229,癸未至节以病晚起走笔戏书纪事排闷十首 其八
712034,走笔送袁士旦归江南兼怀魏凝叔和公杨长苍二首 其一
570652,昨秋有传殿卿左史游道山者得一绝见慰不胜快心走笔奉贺
876494,仲晦监簿和放翁七十三吟三篇华予初度走笔□韵答之 其三
683858,穆考功敬甫早岁乞休惟以读书苦吟为事今年拟少陵秋兴八首使其子光胤习右军书书之见寄走笔为谢得四绝句
640733,九日泊安庆城下危广文饷酒走笔奉谢
89661,仲晦监簿和放翁七十三吟三篇华予初度走笔
1141039,九日会王修竹西楼预坐者七人以落霞与孤鹜齐飞分韵予得落字即席走笔
1143942,春半久雨走笔五首
184487,李允蹈以诗见诒走笔和之李号能诗诸贵人客也
1234420,余山林多暇瞌睡之馀偶成偈语自娱纸墨少便不欲记之云衲禅人请书盖欲知我山中趣向于是静思随意走笔不觉盈帙故掩而归之复嘱慎勿以此为歌咏之助当须参意则有激焉 其十五
510399,龙山吟走笔和陈冕 其六
580159,成化庚子岁长至后八日余偕冯秋官佩之过同寅邵文敬第夜坐联句八首俱借韵走笔 其一
1113515,走笔和曾无逸掌故约观玉照堂梅诗六首
686717,孙塘秀才以芍药二枝见赠走笔奉谢
540101,李于鳞损饷诸物侑以新诗走笔为谢 其三 藤障子
287172,雨后由众兴抵顺河集旅舍烦郁走笔书壁
94430,从范至能参政游石湖精舍坐间走笔
999518,暮春伯宪留饮席上走笔戏成二首 其一
1144280,省斋寄诗用韵走笔以谢
902966,连日雪未能多曾无逸见惠二首遵欧苏律禁体物语及用故事走笔次韵 其二
177527,陈石泉送诗走笔次韵
583255,乡友陈廷评以道乞养南归示诗索和走笔二首 其二
1237260,余山林多暇瞌睡之馀偶成偈语自娱纸墨少便不欲记之云衲禅人请书盖欲知我山中趣向于是静思随意走笔不觉盈帙故掩而归之复嘱慎勿以此为歌咏之助当须参意则有激焉
494702,走笔赠孝子国子学录加博士杨君成章宗道归道州
552109,许亦龄持朱允冈吉士扇头韵索和走笔次之
1135234,癸未至节以病晚起走笔戏书纪事排闷十首 其三
116332,走笔约无咎同赴大尹龙图四丈羔酒
539780,走笔二绝赠弈者刘生 其二
1234419,余山林多暇瞌睡之馀偶成偈语自娱纸墨少便不欲记之云衲禅人请书盖欲知我山中趣向于是静思随意走笔不觉盈帙故掩而归之复嘱慎勿以此为歌咏之助当须参意则有激焉 其十四
486207,茌平县西门邮亭废圃中有花名玉珑瑽枝叶与琼花无异但花蕊层生与叶相间远望如翠烟笼玉幽香扑人遂呼浊醪痛饮花下陈令取纸笔索诗乘醉走笔赋二律 其二
136046,周伯范棋会以足疾不赴走笔寄坐客
28681,力疾马上走笔
560101,戏题小扇诸侄各争先以讨走笔以荅之各回物状形十首 其八
1084183,走笔送王省干
389980,金翁八十矣为小祇园作新词游戏三昧语走笔为谢
1240593,夜泊芙蓉洲走笔寄张鍊师
676948,观妓即席走笔
560099,戏题小扇诸侄各争先以讨走笔以荅之各回物状形十首 其六
1026268,对雪送花走笔况之
476449,至日偶然走笔
814448,读卓人孝廉「逐疫行」，走笔率成绝句
1112698,喜雪走笔呈李宣城三首
639031,职方后署小酌走笔并序
731864,走笔寄甘健斋转张曲江明府
965396,溪亭夜集走笔
1094815,走笔答上饶
357651,比作黑饭新茶二首未蒙文中县丞宠和走笔再赋以助一笑
105968,春半久雨走笔·早从师读易乾元
914310,走笔谢吉守赵判院分饷三山生荔子
1089198,夜半走笔酬寿翁 其二
863136,诗去得仰之报云旦夕必有风雨可速相过走笔以诗报之
710174,走笔因柬止言澹归二上人
1172893,江阁卧病走笔寄呈崔卢两侍御
1226513,余山林多暇瞌睡之馀偶成偈语自娱纸墨少便不欲记之云衲禅人请书盖欲知我山中趣向于是静思随意走笔不觉盈帙故掩而归之复嘱慎勿以此为歌咏之助当须参意则有激焉 其四
583154,九月九日寓九江时户部李时雍同年预约游庐山以是日雨作中辍时雍复遣人送酒侑以一绝因走笔戏答四绝 其三
599912,走笔和玉田见示之作
523263,客有笑余霜发者走笔戏之
923076,李公择尚书见示出郊奉雩祀马上口占七言四韵走笔继和
683928,吴江赵令君特访我吴阊走笔得二绝句赠之
23144,走笔送杜十三归京
1136269,送男存心如燕二月二十五日夜走笔古体 其一
540266,金翁八十矣为小祇园作新词游戏三昧语走笔为谢 其一
574314,秋莲走笔荅文玉
832450,减字木兰花 张钝叟为余作墨梅，走笔报谢
92621,即席走笔·雪政飞时梅政开
666683,西亭宗室送白牡丹一本走笔书此寄谢
453419,韩山走笔遣怀次退之宿曾江口示侄孙湘韵二首 其一
876350,方具免牍走笔次竹溪中书韵
16432,走笔追王内丘
63994,至日偶然走笔
1071324,郑固道累书求寓屋诗走笔封寄
546631,祝生如华旧从余学诗溪上一别三载馀是秋余羁寓武林忽棹扁舟来谒投我七言律四章风骨崚嶒殊可喜愕于其行也走笔五绝勉之 其四
1078152,循梅道中遣人如江南走笔寄诸季十首 其十
677064,与仲和期潭西看花仲和云当至洞庭已闻滞虎丘走笔寄嘲
904636,大雨水忧三堰决坏且念吾挺之在病无与共此忧者因走笔为问四首 其四
683818,徐孟章索诗为赠走笔得三绝句
599686,岐山亲家东厅雅叙走笔 其四
630661,得澹归稍病即愈之讯时会龙拟新搆走笔寄之
1135192,春半久雨走笔五首 其五
700211,壶阴阻冰河下用前赠行韵见寄有悔心焉走笔戏荅
666920,大司寇恒山张公父母俱八十馀三疏得归省太夫人旧患丧明公归而愈缙绅多咏其事郑同年与聚索予作忙中走笔
1036832,观张功父南湖海棠杖藜走笔三首 其二
971580,亭午欲过意复凄然偶引杯酒而沅陵丈送诗适至因走笔成两绝并呈教授兄 其一
731585,夏日走笔赠隋海侯
683646,余佐留枢诸曹掾中有南充刘璋者偶诸生试其文烂然已而竟从本格得官将归省叩余秋署乞一言之赠若有不释然者余闵其意走笔得二绝句付之时方乞休在告也
1018425,途次走笔送张明府之都城
902988,诚斋再韵见遗走笔复和并邀尤检正京右司观花
570656,袁绳之太常起家赴南少司空走笔为赠 其一
934932,九月一日夜读诗稿有感走笔作歌
712755,走笔送沈山隐
543998,王孙贞吉以手镌印章寄惠走笔奉谢
598228,余在梧时尝赠刘生诗箑一执既别去八年闻其箑尚在兹有复持扇至为生请书者因走笔寄此二首 其二
712071,走笔送家紫驭孝廉
1067010,走笔再和凤凰山十韵酬良器解元兼呈文中宣德 其四
100165,罢徐州往南京马上走笔寄子
1213244,西京赵良臣都事四十年之旧以诗见赠走笔述和勉其归家养疾不听逮月馀遂卒官所
599682,走笔招区顿池四表 其二
637613,从弟重器诗来索纸走笔次韵以纸二十幅与之
919927,走笔次韵刍父喜雨三首 其一
712430,走笔送程德基归黄山兼怀其弟立方
99582,罢徐州往南京马上走笔寄子由
691580,送汪伯昭游白门伯昭将自京口至栖霞寺因忆旧游走笔得四绝句
688581,走笔戏赠万伯修使君二首
1054487,走笔呈承君
915211,庆长叔招饮一杯未釂雪声璀然即席走笔赋十诗 其七
999445,公度惠花走笔戏谢
560096,戏题小扇诸侄各争先以讨走笔以荅之各回物状形十首 其三
583401,斋居对雪走笔次韵答清溪赵司寇兼柬王与时胡伯珩黄伯固二首 其一
924380,六月十三日病起走笔寄仇池
959197,頔上人持瑩萝月五诗见示因走笔和韵聊禦睡魔 其四
627978,合江楼前走笔送刘鳌石还广州即有太原之行
1246858,走笔戏赠张文鼎墨梅
1144038,癸未至节以病晚起走笔戏书纪事排闷十首
711449,羊城归日汪王二君复以首韵赠别走笔再答汪鐏石
599622,走笔和海山舍弟订来樵之约 其一
546695,卧病舟中旬日永叔命郎君过讯走笔赋赠二章 其二
915183,上巳日予与沈虞卿尤延之莫仲谦招陆务观沈子寿小集张氏北园赏海棠务观持酒酹花予走笔赋长句 其二 再和
685220,再用前韵走笔答方时鸣侍御二首
683690,吴峻伯校诸生走笔二绝
1067014,走笔再和凤凰山十韵酬良器解元兼呈文中宣德 其八
522171,走笔和时敏客中写怀
1083738,走笔次韵张以道 云南
588660,梦后闻梅花香甚走笔二首 其一
248674,除夕走笔·冀去此夕万象更
664379,赵文昌中乙榜雨中感怀见遗走笔和荅 其一
1207682,八月廿一日惟寅徵君踏雨过林馆为留终日因诵近赋绝句三首爱其词致清婉辄走笔次韵如上古道寥寞人以角逐声利为务惟寅独逍遥恬淡之乡时来□之篇章翰墨之事岂易得也哉 其一
560095,戏题小扇诸侄各争先以讨走笔以荅之各回物状形十首 其二
183459,走笔次韵察推见别二篇
474229,斋室初成有劝多栽花竹者走笔示之
1083741,走笔次韵张以道 樊榭
494318,走笔送刑部谢主事少南改官北上
158076,前日奉和仲灵禅老春雨诗复辱见答走笔依元韵
1026689,和子华兄寄酒走笔
24638,座中走笔送前萧使君
1083838,次韵郑郎中作四明谢遗尘九题走笔不二 其一 石窗
677017,吴门舟中邂逅闲孟自白下归出予画卷索题时予方北上走笔见意
357647,蒙文中县丞以诗送苦笋走笔六首为谢
735897,竹下偶次李宾之题丁御史墨竹韵走笔成此
921044,罢徐州，往南京，马上走笔寄子由五首 其三
626927,甲寅秋麦盛际返自晋阳过我斋头别之次日寄我以诗兼惠仪物走笔赋答 其三
603879,醉戏走笔赠歌者
878353,竹溪除司封郎中走笔贺
1078145,循梅道中遣人如江南走笔寄诸季十首 其三
677036,别友夏同孟阳无敕亦因修之君长过林女郎天素月下听天素弹琴琵琶因索余诗走笔纪事
649416,龙洲姚老人献山薯土瓜获受恩赏临归乞诗走笔书三绝句 其一
610270,走笔戏问进之病
1226520,余山林多暇瞌睡之馀偶成偈语自娱纸墨少便不欲记之云衲禅人请书盖欲知我山中趣向于是静思随意走笔不觉盈帙故掩而归之复嘱慎勿以此为歌咏之助当须参意则有激焉 其十一
677070,西湖走笔赠雪峤上人渡江寻云门山
400020,菊庵道兄以诗见讯走笔却寄
501211,予使日南道吉安府主来访舟中命医者王本达馈以善药时予困于秋暑心目为之豁然感其意走笔为赋长句以赠
706451,走笔赠刘生思肯三首 其二
510397,龙山吟走笔和陈冕 其四
1047750,走笔酬亨甫所示二篇次韵和之 其一
340864,走笔寄师川三绝
538455,五月五日李侍御以诗见邀走笔有答
1231774,风雨连日闭户默坐怀思可知忽翠涛轩以笋蔬之惠走笔答之
537593,李二丈给事以诗谢不赴看菊之约走笔倚和
1036833,观张功父南湖海棠杖藜走笔三首 其三
403593,水调歌头 山中月色甚佳，与瞿禅徘徊松影间久之，走笔为词，邀瞿禅和，兼戏江冷
999857,前日奉和仲灵禅老春雨诗复辱见答走笔依元韵酬之
585533,走笔谢王嘉兴护送之使
19393,偶于维扬牛相公处觅得筝筝未到先寄诗来走笔戏答
958996,頔上人持瑩萝月五诗见示因走笔和韵聊禦睡魔 其二
522024,走笔留汪秀夫
243201,寓宿黄观复书堂晨至海棠花下走笔呈苏召叟
649353,雨夜蒋立恭赠诗走笔次韵 其二
950805,赵季茂通判惠诗走笔奉和十篇 其十
948520,己未立春留杨伯子知县小酌夜闻窗竹有声伯子以为雪或曰风也已而果雪诘旦敲门送诗走笔戏和
990181,使君见示鹿鸣诗走笔奉和
761537,戚氏 沤尹为畹华索赋此调，走笔应之
1039018,邂逅刘公尤于平望之西联舟夜语走笔叙意
1246984,日者留海宁叔固寄以佳什走笔奉谢兼简惠翁贤父子
883057,李允蹈以诗见诒走笔和之李号能诗诸贵人客也
183458,走笔奉酬签判殿丞游思上人院
351838,王龟龄遣妓送酒赐诗走笔为谢
995613,走笔谢王朴居士拄杖
494486,走笔代简答庞举人朱明洞
1002340,诸公出游有翼有诗和者盈轴次日饮正卿家出以示余走笔继韵
1083716,走笔次韵寄平元衡禅老
494962,走笔次韵和少司空林小泉同差于功德寺话旧
683781,金翁八十矣为小祇园作新词游戏三昧语走笔为谢
537054,郭帅致石子云为余小祗园三径之资走笔志谢
1171660,规公业在净名得甚深义仆近获顾长康月宫真影对戴安道所画文殊走笔此篇以屈瞻礼
1000176,走笔成一篇答徐君先辈见寄
1161988,唐开州文编远寄新赋累惠良药咏叹仰佩不觉斐然走笔代书聊书还荅
928534,卯酒径醉走笔
1070899,魏子介然甲戌中春不远数百里访予寂寞之滨予方厄穷适此久旱市无鱼肉园乏佳蔬介然处之宴然眷眷不忍舍去予与介然别久介然气貌议论益超然孟夏既望慨然请辞欲归筑室读未见之书科举之文不足学走笔作长句送行且勉使力学志其远且大者仍用喜雨诗韵
560140,走笔题梅花墨色
900848,忆桃源 其一 蔡师元款予及神翁侍宸，师元发问予如何是修炼之术，予走笔成小词以答之
749390,渭长乞予画扇醉中走笔写水仙灵芝
1245613,吕尊师画三茅观梅藤为图号曰二老走笔赋之
104651,潘乐二君对雪寄声似欲予赋适方知之走笔奉呈
1173292,崔评事弟许相迎不到应虑老夫见泥雨怯出必愆佳期走笔戏简
840734,雨后由众兴抵顺河集旅舍烦郁走笔书壁
1089197,夜半走笔酬寿翁 其一
990257,重阳湖庄无菊走笔招赵季清黄一之登高
1036462,点绛唇 其一 葛守坐上出此词，道思归之意，走笔次其韵
685203,乡友陈廷评以道乞养南归示诗索和走笔二首
570397,胡元瑞读鄙集有寄走笔四韵答之 其一
585854,走笔谢邓念斋太守惠佳荔
1078148,循梅道中遣人如江南走笔寄诸季十首 其六
314807,摸鱼儿·丙子上巳秦淮水榭禊集，释戡来书索赋，走笔报之
299628,走笔询家兄山中潴水复满几尺
772272,读卓人孝廉「逐疫行」，走笔率成绝句 其六
990328,谭仁季以二诗见贻走笔次韵 其二
950809,赵季茂通判惠诗走笔奉和十篇 其五
964995,分得台字走笔
539404,徐荆州过余兄弟不肯饮而留连金金吾许夕拜所走笔戏之
136021,走笔送僧义冲
799621,饮太白酒楼醉后走笔成篇
883102,顷过周叔和见故人石应之诗及诸贤和篇大轴邀余继韵久不暇遣因通五夫诸李丈书划然有怀走笔寄之
990600,走笔戏邵兴宗
712515,走笔送家云石二首 其二
357665,走笔再和凤凰山十韵酬良器解元兼呈文中宣德
494562,走笔赠李道行司训还扬州
447216,一九九一年一月十七日夜颜光群君邀饮，归经巴王庙，不意于黑暗中坠入深壕，头部触石壁有声，赖诸友提携始得出，移街灯下视之，已头血如注衣衫为湿，乃急赴医院缝合包扎。午夜归家，走笔成此，时血犹未干也
1121414,霁后看雪走笔呈元珍判官二首
207665,走笔·两岁驱驰马首东
973363,得邢广声书且索近诗走笔报之
1116766,罢徐州，往南京，马上走笔寄子由五首
694473,龙山吟走笔和陈冕
353263,午暑睡起忽怀范武子走笔当简
96564,将至辰州走笔寄在伯教授
92619,即席走笔·南烹北果聚君家
741239,慈伯再叠前韵见誉走笔奉答即促西涧和章
102830,走笔谢吕行甫惠子鱼
296504,满江红·娟净谱平韵，走笔和之
837919,再集款月楼醉后走笔
1250645,走笔送金贤良
1142275,十月既望能静饮客海棠花下即席索诗走笔一笑
1236537,八月廿一日惟寅徵君踏雨过林馆为留终日因诵近赋绝句三首爱其词致清婉辄走笔次韵如上古道寥寞人以角逐声利为务惟寅独逍遥恬淡之乡时来□之篇章翰墨之事岂易得也哉
568971,宜兴吴詹簿见贻山海珍错走笔为谢
1052441,诸君江步以病不能从走笔寄之
912294,庆长叔招饮一杯未釂雪声璀然即席走笔赋十诗 其六
912296,庆长叔招饮一杯未釂雪声璀然即席走笔赋十诗 其四
860745,醉中走笔次赵彦和韵
1041585,戏金壶道士法墨走笔杂言寄邻几圣俞
569184,走笔题雪泉图赠彼上人者不知能酬对否
1126386,陈倅寄惠四诗用昌黎和裴相韵愧不能当也走笔赋二章以谢
603877,戏走笔为半塘歌赠卢少梅
1039285,走笔戏呈机宜著作与诸同席
1034352,正月九日川上之游杨季穆以酬唱见寄走笔次韵
92624,即席走笔·晚饮西邻大阮家
159923,对雪送花走笔况之
902576,走笔和曾无逸掌故约观玉照堂梅诗六首 其四
903396,江城子 黄子由少监同内子慧斋奉岳母定斋相过席间因走笔次韵
94431,坐间走笔·孤塔鸥边迥
176751,吟客枉访酒边走笔以赠
598166,山阴姚生过潮谒予请书走笔赋此
1224255,题王山仲所藏潇湘八景图卷走笔作 其二 洞庭秋月
484109,至正戊子下第南归与同贡黄章仲珍雷燧景阳同舟仲珍赋诗因走笔次韵
900490,二使者游东山酒后寄诗走笔次韵 其二
705022,走笔谢齐太衢戴浑庵
1062474,秋日泛舟走笔呈同游诸公
1081427,余去秋七月登舟逮此一年矣六月晦日午睡觉闻儿女辈相谓曰明朝又是秋风起推枕怅然走笔记之
999468,张升甫惠新笋走笔代简谢之
522061,壶阴阻冰河下用前赠行韵见寄有悔心焉走笔戏荅 其二
1054142,走笔 其三
1157717,舒员外游香山寺数日不归兼辱尺书大誇胜事时正值坐衙虑囚之际走笔题长句以赠之
1170338,却归巴陵途中走笔寄唐知言
207185,谭仁季以二诗见贻走笔次韵
92160,即席走笔·不是今宵雪不清
599888,走笔 其一
956924,全守支耀卿饮饯七里倅杨仲宣复携具至深溪酌别且乞余书走笔作此兼寄耀卿
599880,走笔奉别陈省斋 其二
245270,壁间古木新篁影有可爱走笔戏题
208147,走笔代颜西叔次途中即事之什
16416,走笔谢孟谏议寄新茶
599889,走笔 其二
105900,五月十四日梅雨始通走笔二十韵
346777,黎丞传示史宰聋字诗走笔和之
570463,走笔再送冯使君之楚 其一
340838,走笔送叔牙
1135231,癸未至节以病晚起走笔戏书纪事排闷十首 其六
1047548,走笔奉酬正夫即次元韵
1112410,走笔次廷藻韵二绝
158329,走笔戏成·春去无多日
697118,王次公敬美寄惠计偕集叙走笔二律奉谢
622347,走笔向宋尔孚乞绛桃
904637,大雨水忧三堰决坏且念吾挺之在病无与共此忧者因走笔为问四首 其三
695132,余在梧时尝赠刘生诗箑一执既别去八年闻其箑尚在兹有复持扇至为生请书者因走笔寄此二首
935042,大醉梅花下走笔赋此
95757,张伯永折梅走笔谢之
544920,闻王长公元美再起南都司寇走笔奉寄
921562,走笔谢吕行甫惠子鱼
540368,王上饶将入觐与余有酒人燕市之约寻余赴留任归里君亦当便道省觐走笔戏赠
105851,癸未至节以病晚起走笔戏书纪事排闷
948127,八月十八日与客小集赏岩桂而红梅海棠金林檎盛开明日江西美赋四绝句走笔次首篇韵
993426,魏文以予病渴赠薏苡二丛值庭下走笔戏谢
92622,即席走笔·梅花得雪更清妍
62207,走笔送谢大参
948904,江西美示古调七篇皆以风雅久寂寞为首句责仆一言仆素不能词念此意不可不酬走笔直述所怀而非诗也
104618,刘弟示诗一轴走笔答之
743003,孙香岩先生以自乘良马惠赠走笔赋谢
301175,走笔因柬止言澹归二上人
523138,徐子将适湖湘余实恋恋难别走笔长句述一代人文之盛兼寓祝望焉耳
1221952,同仲实南湖赏莲醉中走笔
176346,分得台字走笔
355613,诸君江步以病不能从走笔寄之
570694,意上人一梓甓婆罗门弃家入道通习三乘援苏学士赠乡僧文老例乞余一言走笔应之 其一
999618,仲灵禅师以诗见邀辄走笔依韵附还使奉和
158766,走笔依韵和酬王彦霖
912713,走笔和张功父玉照堂十绝句 其六
958995,頔上人持瑩萝月五诗见示因走笔和韵聊禦睡魔 其五
950803,赵季茂通判惠诗走笔奉和十篇 其一
1120408,走笔问讯晁四以道
1102458,丘舜臣遣人还乡托以家书时六月望因走笔寄主学胡君及士招学正诸同舍
953678,至喜堂新开北轩手植楠木两株走笔呈元珍表臣
867272,南岳高台长老道光尝为灵源清侍者邂逅一见颇能谈其行戒走笔为赋两绝赠之 其一
990368,陈倅寄惠四诗用昌黎和裴相韵愧不能当也走笔赋二章以谢 其二
923082,走笔次韵察推见别二篇 其二
1040816,明叔惠洛中花走笔为谢
598227,余在梧时尝赠刘生诗箑一执既别去八年闻其箑尚在兹有复持扇至为生请书者因走笔寄此二首 其一
1054293,寒食宴北山席上走笔得松字
58990,走笔戏赠若庸司训
367220,谒希哲不遇轩上走笔
390053,徐生号云樵而以叶子雪樵书为介走笔戏成一绝句
1085507,赵果州致羊酒走笔戏酬
638811,饮普光寺坐中走笔用前韵
638185,沈亚参邀华林寺酌别时徐方伯刘大参索诗留别走笔奉答
207626,桂阳走笔呈以道
755391,将去西园走笔留别
93075,走笔·疾风动地雨倾荷
1124021,亭午欲过意复凄然偶引杯酒而沅陵丈送诗适至因走笔成两绝并呈教授兄
190522,子金舅出示雁湖和章走笔为谢
947564,将有远行走笔效江西体赠叔嘉
1127534,走笔和萧推官迎提举承议
307485,日本阪口五峰自其国电索予书走笔应之
895275,走笔次廷藻韵二绝 其一
599538,走笔谢齐太衢戴浑庵 其二
655032,登兜率岩走笔次沈佥宪仲律韵
557365,夜召明卿报言病目畏灯火走笔戏简二绝 其二
1157267,苏州李中丞以元日郡斋感怀诗寄微之及予辄依来篇七言八韵走笔奉荅兼呈微之
721456,走笔送家云石二首
494563,走笔赠李司训世用父母双寿
1093214,走笔戏咏散庵
621332,柳絮三者客舍晚坐走笔题歌者扇 其二
912480,过三衢徐载叔采菊载酒夜酌走笔二首 其二
867404,兰陵王 其一 南湖同碧莲见寄，走笔次韵
539063,卢使君君万手植一松百花洲且侑以诗走笔奉谢
345288,走笔送王省干
1083737,走笔次韵张以道 过云
1083742,走笔次韵张以道 潺湲洞
1116455,走笔次韵黄观复学士二首
622625,走笔向宋尔孚乞绛桃一种
999469,张文通以诗觅小桃走笔依韵和答
990365,老梅晦父改韵见贻走笔奉和
1060592,走笔寄师川三绝 其三
504651,走笔次韵答卓伯长
1088995,蒙侍御丈再用韵作送行诗走笔和答迫放船不暇工也
950812,赵季茂通判惠诗走笔奉和十篇 其三
599627,邵少湄折柬有楼台将送暑凉露报新秋之句用何诗飘洒欣然余怀走笔答之 其三
912721,走笔和张功父玉照堂十绝句 其九
506645,游湖漫兴醉中走笔呈孟博孙公
921045,罢徐州，往南京，马上走笔寄子由五首 其四
545739,王将军过访不值次日遣信相闻走笔四韵代东时方拜总戎之擢而余寄居胡氏园芍药盛开故诗句云云
685227,九月九日寓九江时户部李时雍同年预约游庐山以是日雨作中辍时雍复遣人送酒侑以一绝因走笔戏答四绝
1083739,走笔次韵张以道 云北
1113173,二使者游东山酒后寄诗走笔次韵
1136973,水调歌头 其六 自龙眠李氏夜过臞山康氏，走笔和其家灯障水调，迫暮始归
583153,九月九日寓九江时户部李时雍同年预约游庐山以是日雨作中辍时雍复遣人送酒侑以一绝因走笔戏答四绝 其二
317548,再集款月楼醉后走笔
834530,浪淘沙 九月十九日石工约集词社同人为展重阳之会。病不克与，走笔赋呈，不耐苦吟，聊慰猎心耳
583352,弘治十二年秋八月到靖康外叔祖陈廷圭赠诗一律席上走笔次韵三首 其一
1115496,庆长叔招饮一杯未釂雪声璀然即席走笔赋十诗
1025979,西江月 走笔因宋九韵示黄六
621331,柳絮三者客舍晚坐走笔题歌者扇 其一
1116452,走笔次韵刍父喜雨三首
570389,徐生号云樵而以叶子雪樵书为介走笔戏成一绝句
1241258,韩醴泉先辈余曲车道士邀游东欢桥钓矶岩壁既赴郑糟台宴众谓予同有高世志属赋进酒歌遂走笔
569515,石丈自滁穆丈自魏贻诗见慰罢官走笔呈谢并抒近况 其二
415968,俞律诗兄督予先作《登庐山龙首崖放歌》，因走笔赋此，不知能入法眼否
569456,陆成叔出新诗俊丽甚然多平康巷中语走笔戏赠且以为风
512856,走笔留客
106944,会鹤臞郑高士庵为予写神走笔赋杂言
1038488,走笔答原甫提刑学士
599534,吕亭驿走笔 其一
621922,过清江晤陈建侯主簿走笔书赠
539909,走笔呈王使君 其一
135044,陈天成诗多和东坡韵兹因寄喜雨诗走笔谢之
105290,魏文以予病渴赠薏苡二丛植庭下走笔戏谢
599623,走笔和海山舍弟订来樵之约 其二
1104881,走笔
308626,减字木兰花·张钝叟为余作墨梅，走笔报谢
1135196,春半久雨走笔五首 其一
599799,读莱轩感事之作走笔漫书
912300,庆长叔招饮一杯未釂雪声璀然即席走笔赋十诗 其一
1135232,癸未至节以病晚起走笔戏书纪事排闷十首 其五
1007530,吟客枉访酒边走笔以赠
1028084,周伯范棋会以足疾不赴走笔寄坐客
599494,走笔奉和匡南见寄 其四
62393,初夏走笔和湘灵
540100,李于鳞损饷诸物侑以新诗走笔为谢 其二 龙井茶
1224257,题王山仲所藏潇湘八景图卷走笔作 其四 江天暮雪
