604807,韩叔捷同人六十有一以诗见贻对使走笔用来韵却赠
1067012,走笔再和凤凰山十韵酬良器解元兼呈文中宣德 其六
1027083,王原庆诉盘餐萧然走笔次韵 其二
721011,走笔赠刘生思肯三首
583353,弘治十二年秋八月到靖康外叔祖陈廷圭赠诗一律席上走笔次韵三首 其二
638990,承伦内翰叶侍御垂顾失迓走笔奉谢
242690,王深道别酒走笔秋韵
876492,仲晦监簿和放翁七十三吟三篇华予初度走笔□韵答之 其一
470885,走笔答赠胡京孺（名拱极）
474087,茂之乞画楚山图余将游武林走笔戏答
357549,走笔·茂林髡取未应贫
555310,走笔题扇送方恒谦行人之京
419444,摸鱼儿 丙子上巳秦淮水榭禊集，释戡来书索赋，走笔报之
626926,甲寅秋麦盛际返自晋阳过我斋头别之次日寄我以诗兼惠仪物走笔赋答 其二
1078146,循梅道中遣人如江南走笔寄诸季十首 其四
540159,用晦寄四种杯仍系以诗走笔二绝为谢 其一
683906,上人自峨眉来云欲涉海礼补陀北礼五台走笔二绝赠之
388269,虚白上人出关后走笔问之
664382,赵文昌中乙榜雨中感怀见遗走笔和荅 其四
886496,何达观久客他乡音问旷绝一日忽见过又匆匆告别吾老且病未知后会何如走笔以赠
570400,胡元瑞读鄙集有寄走笔四韵答之 其四
246574,入伏苦雨晚窗风入寒气袭人秋意极浓因走笔漫成一律
94659,走笔和袁起岩元夕前一夜雪作
105700,正仲答云鲎酱乃是毛鱼耳走笔戏之
1174155,走笔送杜十三归京
207690,走笔次韵·风声久想杜陵珂
867273,南岳高台长老道光尝为灵源清侍者邂逅一见颇能谈其行戒走笔为赋两绝赠之 其二
305136,俶玉赠石绝肖竹根走笔谢之
685238,茌平县西门邮亭废圃中有花名玉珑瑽枝叶与琼花无异但花蕊层生与叶相间远望如翠烟笼玉幽香扑人遂呼浊醪痛饮花下陈令取纸笔索诗乘醉走笔赋二律
999520,醉中刘道叔尹嗣复李子先垂和予乙巳岁开元寺仁王院咏竹二十八字复依元韵走笔答之
1021119,丙辰季夏避暑山中长松脩竹恍若蓬莱异人之居走笔索句以纪其事
543610,两得欧桢伯书及致西署秣陵二集走笔寄谢询其苍头李英
950804,赵季茂通判惠诗走笔奉和十篇 其六
679649,走笔和王同野韵
453425,重九登楼走笔次少陵韵
871386,西湖大醉走笔百韵
1047774,走笔奉酬伯昌示潇湘烟竹图
428605,走笔答吴氏
537781,董生善丹青欲为邵武吴使君作小像走笔嘲邵武
152289,六曹长贰观潮予以入直不预晡时大雷雨走笔戏
560132,四月十九日过骊山访高味道弟侄各以扇索诗随景物走笔荅之
1066967,蒙文中县丞以诗送苦笋走笔六首为谢 其三
445904,随“诗旅团”自银川至额济纳旗客途走笔
603910,送朱少白醉后走笔
896678,喜雪走笔呈李宣城三首 其二
566880,戊辰廿有四日尚宾时中宿于圜夜大风雨冰厚尺诘朝得子甘北报走笔遍诸友
501016,龙凤己亥秋九月上於建龙关仪凤楼杂写金陵山川六处命僚属各赋绝句走笔立成
948153,六曹长贰观潮予以入直不预晡时大雷雨走笔戏蔡子平
357550,走笔·碧润那忧盛夏无
570565,穆考功敬甫早岁乞休惟以读书苦吟为事今年拟少陵秋兴八首使其子光胤习右军书书之见寄走笔为谢得四绝句 其二
158420,席上走笔赠别李子先
1226512,余山林多暇瞌睡之馀偶成偈语自娱纸墨少便不欲记之云衲禅人请书盖欲知我山中趣向于是静思随意走笔不觉盈帙故掩而归之复嘱慎勿以此为歌咏之助当须参意则有激焉 其三
1182664,朗州窦常员外寄刘二十八诗见促行骑走笔酬赠
703748,因峰顶侍者偶忆往事走笔寄晦林禅师二首
386107,临江仙·金婿戾臣工楷法及行草，课业之暇，出纸索书，走笔题赠
1083842,次韵郑郎中作四明谢遗尘九题走笔不二 其五 鹿亭
570928,吴江赵令君特访我吴阊走笔得二绝句赠之 其二
288975,蔡铁生出狱，以蛰龙吟寄示，走笔报之
61270,走笔戏赠万伯修使君
541940,走笔效太白歌行寄上沈王殿下
569572,戚都督以一壶双斝为寿走笔志谢
61657,茂之乞画楚山图余将游武林走笔戏答
683838,晓上人自云能草书转法华千遍谒补陀落迦者再矣告余且复往走笔反前韵止之
1114980,子金舅出示雁湖和章走笔为谢三首
94644,走笔谢张功父送似酴醾
701503,梦后闻梅花香甚走笔二首
207746,重阳湖庄无菊走笔招赵季清黄一这登高
700763,戏题小扇诸侄各争先以讨走笔以荅之各回物状形十首
469305,走笔戏赠万伯修使君二首 其二
607453,方延客而公出走笔缓之
583464,观沈材美大参与沐希申锦衣手卷走笔次韵
919925,走笔次韵刍父喜雨三首 其三
1066698,走笔追记十二月九日潭头之游
168337,鹿鸣宴中走笔呈林教授
535642,走笔柬数畴
649417,龙洲姚老人献山薯土瓜获受恩赏临归乞诗走笔书三绝句 其二
588661,梦后闻梅花香甚走笔二首 其二
72260,夜泊芙蓉洲走笔寄炼师
1071835,醉中走笔留别杨将军
683533,石丈自滁穆丈自魏贻诗见慰罢官走笔呈谢并抒近况
1060082,走笔问讯晁四以道 其一
1211431,走笔赠燕孟初
1027441,刘德修右史去国示所和从父东溪及杨子直诗走笔次韵 其三
351596,景蕃暂如无锡不暇相寻于云间诗来问讯甚殷勤会予续至江上遂及邂逅走笔奉呈
1226514,余山林多暇瞌睡之馀偶成偈语自娱纸墨少便不欲记之云衲禅人请书盖欲知我山中趣向于是静思随意走笔不觉盈帙故掩而归之复嘱慎勿以此为歌咏之助当须参意则有激焉 其五
1060591,走笔寄师川三绝 其二
1083917,竹院昙老病目寄诗索和走笔次韵
539782,于鳞寄太行诸篇走笔以谢
1157166,自到郡斋仅经旬日方专公务未及宴游偷闲走笔题二十四韵兼寄常州贾舍人湖州崔郎中仍呈吴中诸客
1091133,痁疾中元式示诗走笔次韵
555231,送方寿卿秋官之京二首走笔和林见素韵 其二
903074,暑中杨伯虎见访翌日有诗来因走笔次韵
538537,于鳞寄余登华诸篇走笔奉答
971586,将至辰州走笔寄在伯教授二首 其二
1078109,家问自闽中转来走笔寄诸弟
1067008,走笔再和凤凰山十韵酬良器解元兼呈文中宣德 其二
569504,余将赴金陵陜帅董中丞追诗及贶走笔报谢
271910,太夷丈见示过眼两绝句走笔应之
570379,在明遗我湘竹榻走笔言谢
1226517,余山林多暇瞌睡之馀偶成偈语自娱纸墨少便不欲记之云衲禅人请书盖欲知我山中趣向于是静思随意走笔不觉盈帙故掩而归之复嘱慎勿以此为歌咏之助当须参意则有激焉 其八
686710,胡菊泉惠我丈菊走笔谢荅四首
557364,夜召明卿报言病目畏灯火走笔戏简二绝 其一
569925,吴三皋倩应试金陵以通家子来谒得见新文赋慰赏之余走笔为赠
990702,将解舟走笔呈表臣
200372,走笔以谢·每思分袂岁寒天
468056,韩山走笔遣怀次退之宿曾江口示侄孙湘韵二首
510395,龙山吟走笔和陈冕 其二
772269,读卓人孝廉「逐疫行」，走笔率成绝句 其三
1111214,午暑睡起忽怀范武子走笔当简
948298,走笔次七兄韵戏奉新新庄
1082977,夜读元容良臣登云阁上旧轴因走笔作诗以寄二公
1060083,走笔问讯晁四以道 其二
1226521,余山林多暇瞌睡之馀偶成偈语自娱纸墨少便不欲记之云衲禅人请书盖欲知我山中趣向于是静思随意走笔不觉盈帙故掩而归之复嘱慎勿以此为歌咏之助当须参意则有激焉 其十二
968537,永遇乐 其二 甲午走笔和岳大用梅词韵
156318,弼观罢走笔书后卷
596449,谈元翼举子拟拉泛江走笔促之三首 其二 再促
912297,庆长叔招饮一杯未釂雪声璀然即席走笔赋十诗 其九
571174,下第蒙王大史宜学年兄走笔见慰且云切勿效时人叹老嗟卑也偶呈二章 其二
152521,走笔再次西美韵兼简季章
136009,王原庆诉盘餐萧然走笔次韵
1026265,去冬蒙君实示嘉篇懒拙不即修谢临书走笔深愧浼渎
1208613,台州郡治后山亭留饮席上走笔
744785,初冬宿二林居夜起走笔简秋士
958997,頔上人持瑩萝月五诗见示因走笔和韵聊禦睡魔 其一
1128558,走笔再和凤凰山十韵酬良器解元兼呈文中宣德
953595,霁后看雪走笔呈元珍判官二首 其二
501483,南康驿丞王圭文玉尝逮事故郎中颜希古求诗为走笔书一绝
389972,周公瑕导余至胥口不能渡走笔有嘲
527301,得徽子书走笔荅之
921042,罢徐州，往南京，马上走笔寄子由五首 其一
335677,走笔问讯晁四以道
540099,李于鳞损饷诸物侑以新诗走笔为谢 其一 石耳
540102,李于鳞损饷诸物侑以新诗走笔为谢 其四 鹦鹉杯
569681,夜听印师礼诵走笔偶成
649352,雨夜蒋立恭赠诗走笔次韵 其一
1136381,景安录示旧雪诗拟简斋走笔赋所感奉谢
13478,太原郑尚书远寄新诗走笔酬赠因代书贺
1051970,走笔和萧推官迎提举承议 其一
950808,赵季茂通判惠诗走笔奉和十篇 其九
683678,走笔二绝赠弈者刘生
950811,赵季茂通判惠诗走笔奉和十篇 其七
717501,走笔奉答湖州徐蘋村司业见赠之作用元韵
704969,走笔奉和匡南见寄
999702,走笔和杨蟠从事庭菊
624637,使舟归泊金陵遇旧馆人以便面索书走笔赋赠
965405,题叶山甫见惠古琴走笔以谢
563393,高存之以湖山之游有门帖谕阍者走笔二绝代为谢客 其一
174910,令防得女招饮以病不往走笔戏之
569514,石丈自滁穆丈自魏贻诗见慰罢官走笔呈谢并抒近况 其一
158286,走笔和杨蟠从事庭菊
187538,走笔谢王去非遣馈江鲚
1088224,彦集圭父择之同饮白云精舍以醉酒饱德为韵熹分得饱字醉中走笔奉呈
368746,菩萨蛮·读温飞卿词，恍惚有悟入处，急走笔效之
1115146,从范至能参政游石湖精舍坐间走笔二首
599537,走笔谢齐太衢戴浑庵 其一
54751,斋室初成有劝多栽花竹者走笔示之
369694,走笔谢人送酒
494882,走笔题双松卷
1108658,仲晦监簿和放翁七十三吟三篇华予初度走笔□韵答之
990769,赠裴直讲水梨二颗言太鲜答吴柑三颗以为多走笔呈之
570486,晓上人自云能草书转法华千遍谒补陀落迦者再矣告余且复往走笔反前韵止之 其二
314865,满江红·大厂居士以丙子清明再用文信国改王昭仪词韵见寄，走笔奉酬，兼呈不匮室主
17753,醉后走笔酬刘五主簿长句之赠兼简张大贾二十四先辈昆季
918333,壁间古木新篁影有可爱走笔戏题
41392,走笔戏书应令诗
1135235,癸未至节以病晚起走笔戏书纪事排闷十首 其二
563394,高存之以湖山之游有门帖谕阍者走笔二绝代为谢客 其二
106103,走笔送吴僧庆间游明越
443769,愁中走笔
158586,文通复用旧韵相示仍走笔和之
596450,谈元翼举子拟拉泛江走笔促之三首 其三 三促
158773,走笔送杨正臣先辈还吴
1083736,走笔次韵张以道 石窗
94354,观张功父南湖海棠杖藜走笔
1082365,庞祐甫卜居白蘋洲走笔寄感
706450,走笔赠刘生思肯三首 其一
571173,下第蒙王大史宜学年兄走笔见慰且云切勿效时人叹老嗟卑也偶呈二章 其一
597670,病在告闻李子藩亦病欲乞归走笔讯之
712411,走笔送梁台佐赴粤西幕府二首 其二
914050,引见前一夕寓宿徐元达小楼元达招符君俞胡季永小集走笔和君俞韵
539091,敬美需次不调于秋夜倡和有庾公南楼之思走笔为答时予有岭右命
494700,张水部惠予浆水玉石砚予视之隐有云气梅干双双侵云月色照耀走笔短歌谢之
826344,金缕曲·雪中读杨崙西寄词，走笔次韵作答
664380,赵文昌中乙榜雨中感怀见遗走笔和荅 其二
1028079,陈天成诗多和东坡韵兹因寄喜雨诗走笔谢之
522202,生辰饮酒用吴与贤韵时有所感走笔乱书不计其无伦次也
914028,从范至能参政游石湖精舍坐间走笔二首 其一
208184,途次走笔送张明府之都城
419510,浣溪沙 太疏寄示重三之作，感其悽抑，走笔和之
480543,题丁御史同年墨竹走笔长句
543508,惟寅以书贶驰使潞河适媵人偶举一子走笔赋答
990557,正仲答云鲎酱乃是毛鱼耳走笔戏之
1025551,雪中走笔寄邓延硕
664393,胡菊泉惠我丈菊走笔谢荅四首 其四
867891,鹧鸪天 其一 昙少云丈室观李子永见赠佳阕，走笔次韵
1025328,令防得女招饮以病不往走笔戏之
424070,减兰·新植杜鹃一本，花发秾丽逾常。因触亡儿之痛，走笔成此
880182,走笔谢王去非遣馈江鲚
388209,峻伯将至先以诗来走笔邀之
991636,潘乐二君对雪寄声似欲予赋适方知之走笔奉呈
704620,柳絮三者客舍晚坐走笔题歌者扇
596281,与友人坐忽风雨大作得单字走笔
387440,送王正之丞新淦走笔次瓯滨先生韵
733494,己亥小寒走笔赠古林和尚
664391,胡菊泉惠我丈菊走笔谢荅四首 其二
545841,诘旦两公各以诗来走笔和答
683880,袁绳之太常起家赴南少司空走笔为赠
158587,走笔成一篇答徐君先辈见寄
488097,张子明马一卿过山居有作走笔答之
599685,岐山亲家东厅雅叙走笔 其三
1066966,蒙文中县丞以诗送苦笋走笔六首为谢 其二
1090087,午暑睡起忽怀范武子走笔当简 其四
97108,得邢广声书且索近诗走笔报之
105628,闻曼叔腹疾走笔为戏
912299,庆长叔招饮一杯未釂雪声璀然即席走笔赋十诗 其八
860765,东禅别新资官令荣安中走笔次韵
545373,过王思延斋头读所撰新草并钞本夷坚支志十?主人索七言一律及诗薮三编为报即以见归走笔赋此
186546,二使者游东山酒后寄诗走笔次韵
186549,走笔次韵·颇闻东山盛行乐
339834,病起闻走马宴同僚走笔戏呈席上
1067015,走笔再和凤凰山十韵酬良器解元兼呈文中宣德 其九
1063637,予与故人别因得寄诗三十韵走笔答之
570659,袁绳之太常起家赴南少司空走笔为赠 其四
912717,走笔和张功父玉照堂十绝句 其二
106187,送男存心如燕二月二十五日夜走笔古体
704949,走笔奉别陈省斋
140901,程尧仲以杨秘监所赠诗见示因走笔次韵约观园
1083743,走笔次韵胡中方赏丹桂之什
1124937,周德言游小庐山观余壁间诗次韵示教走笔奉谢
1027443,刘德修右史去国示所和从父东溪及杨子直诗走笔次韵 其一
1055476,走笔赠报宁老
92261,过三衢徐载叔采菊载酒夜酌走笔
105967,春半久雨走笔·月余不浴不流头
599491,走笔奉和匡南见寄 其一
570927,吴江赵令君特访我吴阊走笔得二绝句赠之 其一
879833,走笔谢王老丈惠花笺
922956,王都尉示及吕丞相柳溪图诗见邀同作走笔奉呈
1135233,癸未至节以病晚起走笔戏书纪事排闷十首 其四
570401,走笔寿表兄盛氏 其一
494699,走笔赠倪中舍霄
620781,走笔云杜乞王幼度刺史磬口蜡梅
991757,刁经臣将归南徐许予寻隐居之所及亡室坟地因走笔奉呈
948301,走笔答程泰之以简问莲社事
606057,淫雨颓垣甚多走笔戏作
1157819,履信池樱桃岛上醉后走笔送别舒员外兼寄宗正李卿考功崔郎中
1085205,余全之赠菊栽二十品并示三十绝走笔二绝酬之 其二
470886,醉中走笔送茂修赴留京督府幕
536885,袁履善惠芡实作鸡珠儿歌遗我走笔谢之
672529,送王正之丞新淦走笔次瓯滨先生韵
388186,李二丈给事以诗谢不赴看菊之约走笔倚和
912712,走笔和张功父玉照堂十绝句 其五
1248919,走笔次陶蓬韵送叶参谋归金华
419516,鹧鸪天·故人吴湖帆为作《风雨龙吟室图》，走笔赋谢
560102,戏题小扇诸侄各争先以讨走笔以荅之各回物状形十首 其九
1249180,海虞山人缪叔正扁舟相过以慰别后之思余谓兵后朋旧星散得一顷相见旷如隔世遂邀汝阳袁子英天平范君本彭城钱好学荣城赵善长扶风马孟昭聚首可诗斋内诸公亦乐就饮或携肴或挈果共成真率之会由是皆尽欢饮酒酣各赋诗以纪走笔而就兴有未尽者复能酬倡以乐永夜余以诗先成叔正俾余叙数语于篇首缅思烽火隔江近在百里今夕之会诚不易得况后会无期乎吴宫花草娄江风月今皆走麋鹿于瓦砾场矣独吾草堂宛在溪上余虽祝发尚能与诸公觞咏其下共忘此身于干戈
677013,西碛看花宿六浮阁上走笔示闲孟兼呈同游诸子
1083009,小生日因与友人作文字饮醉中走笔 其一
207180,老梅晦父改韵见贻走笔奉和
331197,循梅道中遣人如江南走笔寄诸季
158550,依韵走笔和答徐无畏见招
881660,减字木兰花 其三 梅花盛开，走笔戏呈韩叔夏
553421,饮酒沔县市中走笔次刘忠江韵
320369,走笔·触目方多事
289010,闻南强、铁生、芳园出狱，走笔讯之
1098046,黎丞传示史宰聋字诗走笔和之
712514,走笔送家云石二首 其一
1044271,病起闻走马宴同僚走笔戏呈席上
1057355,走笔答郭子隆勾稽
569466,马从甫别六年矣以诗投赠余诗转佳而复不第走笔慰之
919926,走笔次韵刍父喜雨三首 其二
1226518,余山林多暇瞌睡之馀偶成偈语自娱纸墨少便不欲记之云衲禅人请书盖欲知我山中趣向于是静思随意走笔不觉盈帙故掩而归之复嘱慎勿以此为歌咏之助当须参意则有激焉 其九
351792,蒙侍御丈再用韵作送行诗走笔和答迫放船不暇工也
570386,徐孟章索诗为赠走笔得三绝句 其一
470598,送汪伯昭游白门伯昭将自京口至栖霞寺因忆旧游走笔得四绝句 其一
1027442,刘德修右史去国示所和从父东溪及杨子直诗走笔次韵 其二
158259,韩及甫惠陕梨走笔书句谢之
692339,雨夜蒋立恭赠诗走笔次韵
1131159,刘德修右史去国示所和从父东溪及杨子直诗走笔次韵 其三
560097,戏题小扇诸侄各争先以讨走笔以荅之各回物状形十首 其四
561218,聂君持梅雪卷请题走笔赠之
89675,郑宁示边报走笔戏赠
1083839,次韵郑郎中作四明谢遗尘九题走笔不二 其二 过云
638822,水部正郎傅日会招饮姑苏官署适红梅花蕾满树一朵初放座中走笔
1158000,醉中先起李縠戏赠走笔奉詶
723440,走笔戏书应令诗
694866,夜召明卿报言病目畏灯火走笔戏简二绝
94673,子上弟折赠木犀数枝走笔谢之
228267,丁巳灯夕前六日观抱拙寄敏斋韵因事有感走笔
1067013,走笔再和凤凰山十韵酬良器解元兼呈文中宣德 其七
933730,病中数辱曾无逸架阁见问今日忽闻徙居走笔奉简因致卜邻之约
599680,顷波来柬有游樵之约喜走笔答之
950810,赵季茂通判惠诗走笔奉和十篇 其四
105965,春半久雨走笔
1066969,蒙文中县丞以诗送苦笋走笔六首为谢 其五
569731,沈太史请告归嘉禾走笔问之
1224254,题王山仲所藏潇湘八景图卷走笔作 其一 烟寺晚钟
1135064,走笔送吴僧庆间游明越
154205,走笔次韵刍父喜雨
583402,斋居对雪走笔次韵答清溪赵司寇兼柬王与时胡伯珩黄伯固二首 其二
830276,俶玉赠石绝肖竹根走笔谢之
1174495,梁秀才以早春旅次大梁将归郊扉言怀兼别示亦蒙见赠凡二十韵走笔依韵
830701,张知县凤冈相访赠诗走笔答和
486206,茌平县西门邮亭废圃中有花名玉珑瑽枝叶与琼花无异但花蕊层生与叶相间远望如翠烟笼玉幽香扑人遂呼浊醪痛饮花下陈令取纸笔索诗乘醉走笔赋二律 其一
583510,锦衣马汝砺奉朝旨提徐希曾过余话旧索诗以君字为韵走笔赠之
158328,暮春伯宪留饮席上走笔戏成
140903,诚斋现韵见遗走笔复和并邀尤检正京右司观花
999476,走笔依韵和酬王彦霖四首 其二
752854,采石舟中走笔寄呈刘绍庭孝廉
61271,走笔戏赠万伯修使君·杞花垂实玉关秋
369607,醉中走笔留别杨将军
113800,走笔谢王朴居士拄杖
1054141,走笔 其二
1230399,春日病起看花走笔呈座上诸友
570464,走笔再送冯使君之楚 其二
664392,胡菊泉惠我丈菊走笔谢荅四首 其三
613359,走笔答蒋慰功见邀
990601,走笔送王琪
4995,走笔赠独孤驸马
423094,齐天乐 罗元一教授兄?题手册，走笔成此。遭世乱离，寸情天远，不觉其言之凄异矣
539183,兵宪王君阳德数过弇山园颇述泉石之美走笔奉寄
320175,走笔·种竹禁当雪
880174,汤参议惠莲走笔以谢
605249,元陟先生老亲家惠鱼对使走笔附谢
895324,才元思如涌泉愈和愈好晨兴遣骑扣门披衣疾读走笔再酬严韵
622433,雪后杨荆岫见投近藁走笔代柬
357548,走笔·张衡愁坐政烦冤
900135,二使者游东山酒后寄诗走笔次韵 其三
683739,李于鳞损饷诸物侑以新诗走笔为谢 石耳
186467,廖宪送牡丹用海棠韵复走笔戏和之
772270,读卓人孝廉「逐疫行」，走笔率成绝句 其四
915072,子上弟折赠木犀数枝走笔谢之
1083840,次韵郑郎中作四明谢遗尘九题走笔不二 其三 云南
1067009,走笔再和凤凰山十韵酬良器解元兼呈文中宣德 其三
26138,卧疾走笔酬韩愈书问
1185612,卧疾走笔詶韩愈书问
580160,成化庚子岁长至后八日余偕冯秋官佩之过同寅邵文敬第夜坐联句八首俱借韵走笔 其二
1092469,赵季若染髭走笔简之
583415,走笔次伍松月都宪谢宴诗
570319,谢病闲行至摄山而司马故部刘将军驰送出一扇乞诗走笔得五言绝与之
598086,吴生光卿斋为风雨所破旋葺成之予过见壁上多有题咏因走笔赋此以赠
540481,彭城道中夜得上谷王中丞遗余成制锦裘不知余尚未御此服也走笔集古诗句为谢
597998,唐明府自泰和驰素卷索书兼示近作走笔赋此
1078865,走笔戏呈世叔伯达二亲友
948299,走笔次李仁甫夜直观月韵二首 其二
664381,赵文昌中乙榜雨中感怀见遗走笔和荅 其三
1237509,题王山仲所藏潇湘八景图卷走笔作 烟寺晚钟
664410,孙塘秀才以芍药二枝见赠走笔奉谢 其一
480399,走笔戏赠若庸司训
200371,省斋寄诗用韵走笔以谢
1139017,癸酉三月园亭小饮之明日又适澹斋所薄暮醉归广文寄佳句二首走笔次韵 其二
544866,吴文仲与余订约净慈昭庆间届期往晤则文仲尚未至也余迫归不能待意甚怅怅走笔寄吴
89662,初度走笔·镜中雪鬓数茎新
1034233,走笔代书答西士
912481,过三衢徐载叔采菊载酒夜酌走笔二首 其一
614154,走笔邀林迁之
351869,夜半走笔酬寿翁
384953,黄寿泉广文归觐，过吉安小集彭芷生寓斋，仍用前韵留别，走笔和之
948671,走笔再次西美韵兼简季章
902574,走笔和曾无逸掌故约观玉照堂梅诗六首 其六
570657,袁绳之太常起家赴南少司空走笔为赠 其二
903350,程尧仲以杨秘监所赠诗见示因走笔次韵约观园中桂花
335707,走笔问讯·故乡群盗阻
1135193,春半久雨走笔五首 其四
1142255,送男存心如燕二月二十五日夜走笔古体 其二
320368,走笔·霁雪如泉滴
105784,景安录示旧雪诗拟简斋走笔赋所感奉谢
570795,上人自峨眉来云欲涉海礼补陀北礼五台走笔二绝赠之 其一
677244,无际游句馀将便道参云栖走笔送之
973901,早过桃川不能谒一庵走笔寄之
688346,成化庚子岁长至后八日余偕冯秋官佩之过同寅邵文敬第夜坐联句八首俱借韵走笔
683707,为冯生走笔赠别杨都督二绝
253506,高武略复和尖字韵见赠走笔奉酬
650663,正月十四夕黄侍读宗豫请赏莲花灯光大胡公席上有咏走笔属和之
914308,走笔和袁起岩元夕前一夜雪作
1090086,午暑睡起忽怀范武子走笔当简 其三
453420,韩山走笔遣怀次退之宿曾江口示侄孙湘韵二首 其二
1128549,蒙文中县丞以诗送苦笋走笔六首为谢
895274,走笔次廷藻韵二绝 其二
227983,走笔代书答西士
357648,走笔·爨无烟火叹厨贫
583152,九月九日寓九江时户部李时雍同年预约游庐山以是日雨作中辍时雍复遣人送酒侑以一绝因走笔戏答四绝 其一
914309,走笔送赵正则司户来访归觐亲庭
1136123,走笔送僧宣无言归泉南
599625,邵少湄折柬有楼台将送暑凉露报新秋之句用何诗飘洒欣然余怀走笔答之 其一
48394,题丁御史同年墨竹走笔长句
557432,上元夜走笔戏简呈忠教主人
674646,走笔寄友
49537,醉中走笔送茂修赴留京督府幕
209193,頔上人持莹萝月五诗见示因走笔和韵聊禦睡魔
960600,张道夫惠大小砚五走笔戏谢
1062941,走笔谢仲达饷新橘诗
1226516,余山林多暇瞌睡之馀偶成偈语自娱纸墨少便不欲记之云衲禅人请书盖欲知我山中趣向于是静思随意走笔不觉盈帙故掩而归之复嘱慎勿以此为歌咏之助当须参意则有激焉 其七
990367,陈倅寄惠四诗用昌黎和裴相韵愧不能当也走笔赋二章以谢 其一
902577,走笔和曾无逸掌故约观玉照堂梅诗六首 其三
1057472,夜饮留李圣咨法曹走笔
570402,走笔寿表兄盛氏 其二
421977,闻南强、铁生、芳园出狱，走笔讯之
158770,走笔送张伯起
583412,再用前韵走笔答方时鸣侍御二首 其一
158771,走笔谢司徒侍中惠柑
1115628,过三衢徐载叔采菊载酒夜酌走笔二首
580165,成化庚子岁长至后八日余偕冯秋官佩之过同寅邵文敬第夜坐联句八首俱借韵走笔 其七
1121011,赵季茂通判惠诗走笔奉和十篇
881688,虞美人 其四 梅花盛开，走笔戏呈韩叔夏司谏
521715,午窗睡起杜以芳持扇索诗走笔书赠
136296,西湖大醉走笔百韵
904639,大雨水忧三堰决坏且念吾挺之在病无与共此忧者因走笔为问四首 其一
683755,用晦寄四种杯仍系以诗走笔二绝为谢
999701,走笔依韵和杨进士倜登南楼之作
902578,走笔和曾无逸掌故约观玉照堂梅诗六首 其二
631372,虔州郡丞董昭时南康郡丞周赞皇都阃徐质美见访因病掩关不得出迓走笔以谢
