815472,宋建中靖国辛巳七月二十八日为东波先生骑箕之辰先生乞居常州，卒于孙氏寓馆，其地去余家不数十武，旧迹犹存，岁值辛巳，去先生六百年矣，感今追昔，邀同学诸子于是日肇祀先生，用眉山二字成诗二章，致敬恭思慕之意云
800750,宋建中靖国辛巳七月二十八日为东波先生骑箕之辰先生乞居常州，卒于孙氏寓馆，其地去余家不数十武，旧迹犹存，岁值辛巳，去先生六百年矣，感今追昔，邀同学诸子于是日肇祀先生，用眉山二字成诗二章，致敬恭思慕之意云 其一
800751,宋建中靖国辛巳七月二十八日为东波先生骑箕之辰先生乞居常州，卒于孙氏寓馆，其地去余家不数十武，旧迹犹存，岁值辛巳，去先生六百年矣，感今追昔，邀同学诸子于是日肇祀先生，用眉山二字成诗二章，致敬恭思慕之意云 其二
90089,穆生·决去先生勇
457128,继钧表弟于旧历二月十八得一子，时去先外祖母归山不过月馀
823995,金缕曲 丙午正月，题先聘妻遗像，宵深灯灺，凄绝万端，偶聆前尘，愁怀顿触，因书此阕，时去先聘妻没已十年矣
254430,继钧表弟于旧历二月十八得一子时去先外祖母归山不过月馀
411632,寒雨卧疾，得屐丈诗简，言散原翁至自金陵，视墓西山，伏念去先公墓次今已三年，竟不得一省视，既愧作者，行自恨也，次屐丈韵末语用散原诗意
