973623,伯威和章记祥符定交云尔蕃之次韵曾未及此再用韵作二首后一首重寄伯山尚留太和伯威诗乃去腊既望写四月晦蕃始得之 其一
1092563,伯威和章记祥符定交云尔蕃之次韵曾未及此再用韵作二首后一首重寄伯山尚留太和伯威诗乃去腊既望写四月晦蕃始得之 其二
1123668,伯威和章记祥符定交云尔蕃之次韵曾未及此再用韵作二首后一首重寄伯山尚留太和伯威诗乃去腊既望写四月晦蕃始得之
978713,师袭卿来权摄峨眉县禄东之来乃去送以诗乃元日也
826910,金缕曲·樊山彩云曲传诵一时，仆曩亦尝见其人。一昔入梦求诗，诿以樊山在前，仆当阁笔。乃请为词，要必诺，乃去。旦而异焉，为拈此解，不敢以长公梦盼盼比也
1214688,余自辛亥岁馆于魏塘吴氏时义士静心先生方无恙长子彦良应门于家次子景良输力于时皆一时伟人季子季良为赘婿于外与余尤相友善岁壬申景良卒于官所归葬胥山诸孙各求分异学遂废而余乃去矣顷者不逞之徒坏其守冢之庐季良之子璋闻于官罪人斯得众称之曰能故为是诗以勉之
1073570,雉山岩昔有僧结庵此山中诵法华经野雉日一集听之至终卷乃去率以为常忽数日不至山下有妇人产子腰胁间馀雉毛数寸寺有石纪其事 西山超然亭
1073571,雉山岩昔有僧结庵此山中诵法华经野雉日一集听之至终卷乃去率以为常忽数日不至山下有妇人产子腰胁间馀雉毛数寸寺有石纪其事 虞氏隐居雷守虞沇避地桂林结茅江上万山环立二水交流游客过其下皆有忘归与卜邻之意
1073569,雉山岩昔有僧结庵此山中诵法华经野雉日一集听之至终卷乃去率以为常忽数日不至山下有妇人产子腰胁间馀雉毛数寸寺有石纪其事 永宁寺佛阁五代末马氏据有荆广时其子賨所营也阅二百年壮丽如故有画像存焉状貌魁梧称其阁云
199816,师袭卿来权摄峨眉县禄东之来乃去送以诗乃无
569453,曹子晋有狭邪之游以余一言而绝扁舟特造白下见谢壮其意留之十日乃去身心家国之感别自有之不以子晋也
882966,黄岩郑瀛子仙弱冠入太学五上书论时事以直闻于时老犹不衰客游海陵馆于余一月乃去作诗送之郑方谋少官田故有章末之戏
1073568,雉山岩昔有僧结庵此山中诵法华经野雉日一集听之至终卷乃去率以为常忽数日不至山下有妇人产子腰胁间馀雉毛数寸寺有石纪其事
1041163,送袁同年殿丞陟通判抚州因还洪井旧居袁在朝数上书言当世事某与袁别十年矣语旧多可悲者留三日乃去
974206,舣舟杨口叩居人以何时缚屋于此何时复去云我乃雁泊人户冬来春乃去
341498,徐大御六种菊满斋头访之则主人往禾水徘徊花下良久乃去
