129930,十二月二十四日雪盖予三年于淮才见此耳时东
120850,正月十四日雪
479628,十四日雪后朝回史馆作
853336,十二月二十四日雪盖予三年于淮才见此耳时东师援淝水捷书西来走笔呈赵公借官奴与幕友一醉
991747,二月四日雪
942993,正月十四日雪
672663,元日雷雨三日雨雪仍雷四日雪
969219,十一月四日雪中小饮是月十日冬至
1131522,十四日雪复作
1250283,丁酉岁正月四日雪
103802,二月四日雪
1238604,八月初四日雪坡太守周门拓入云居山中复度岭饮于水月尼寺赋诗书似太守及苏州刺史周义卿
1090633,十四日雪复作 其二
73562,丁酉岁正月四日雪
541043,戊寅新正四日雪中用唐韵一首
1085857,四日雪坐间有江梅水仙花因目曰三白 梅花
302512,十二月四日雪中作乡书，既而得句
1085858,四日雪坐间有江梅水仙花因目曰三白 水仙花
817839,十二月四日雪中作乡书，既而得句
1085859,四日雪坐间有江梅水仙花因目曰三白 雪
54871,十四日雪后朝回史馆作
1090632,十四日雪复作 其一
227137,十一月四日雪中小饮是月十日冬至
