746624,谢叠山遗琴诗为新安吴素江明经赋
239717,希静堂·二江明月九峰云
749421,答曹莼江明府叠韵
747999,三水道中和施星江明经韵
145665,塞孤·雪江明
1252303,戊申岁间中清赏十景 秋江明月艇
731864,走笔寄甘健斋转张曲江明府
571163,城南新堂燕集饯送江明府先生
289395,安平渡口·鲲身渔火隔江明
594149,送江明府应吾谪庐州幕三首 其一
708191,千秋岁 其二 午日祝江明府
1196012,送黄梅江明府
695933,送江明府应吾谪庐州幕三首
756374,谢文节公号钟琴歌为吴素江明经作
13278,南昌滩·渠江明净峡逶迤
35034,送黄梅江明府
571692,喜迁莺 庆江明府先生荣膺奖擢 并引
545361,寄赠长洲江明府明府楚之桃源人
1240288,戊申岁间中清赏十景 其一 秋江明月艇
594151,送江明府应吾谪庐州幕三首 其三
377951,送桐江明上人之都下
855199,夜行船 其一 雨夜泊吴江，明日过垂虹亭
1053416,送桐江明上人之都下
263851,千秋岁·午日祝江明府
1071461,喜汪发之见访并简婺源江明府
594150,送江明府应吾谪庐州幕三首 其二
334955,喜汪发之见访并简婺源江明府
