793377,新正初四喜见新月
291599,望江南·山庐好，湿雨正初晴
191836,送缙云叶正初兼简杜伯高
1195909,正初答钟郎中见招
34932,正初答钟郎中见招
155576,检正·初寮久已往
137052,蓦山溪·新正初破
837537,水龙吟·题章价人太守铜官感旧图。曾文正初战靖港，兵挫，愤欲投水，章君援之以免。及文正卒后，乃为此图以记。其子曼仙太史出图徵题
55270,性初余同门友至正初定交钱唐及兹两纪顷以先
792714,新正初六外子书至掣签直隶尚候改近省
1174323,正初奉酬歙州刺史邢群
322494,骆义乌墓·晓发军山日正初
290739,新正初三日上遵化文星阁出南城游龙山寺
23061,正初奉酬歙州刺史邢群
1239682,性初余同门友也至正初定交钱唐及兹两纪中间出处离合之不同有足慨者顷辱以先师黄文献公所赠诗见示感今念昔抚卷泫然因用次韵追和虽辞不能工而师生之谊庶几见之矣
291845,纪事·新正初一叩琳宫
23000,湖南正初招李郢秀才
330411,崇宁求诗时正初老住为初祖
35053,正初和鄂州边郎中见寄
1055999,崇宁求诗时正初老住为初祖
59924,拟古宫词·新观玉历识正初
749314,庚午新正初十日试笔
1195908,正初和鄂州边郎中见寄
946160,送缙云叶正初兼简杜伯高
175417,寿成都黄副帅·王正初生七叶蓂
1174446,湖南正初招李郢秀才
