346997,法源寺看花
347966,同倦斋同年崇效寺看花即题倦斋集
770507,法源寺看花
764132,满庭芳 春日，雨中同田子纶、谢方山过邻寺看花分赋。时有寺僧，能诗善字，谈久，坐月而归
1153740,河中府崇福寺看花
743400,余将出都伊墨卿邀同罗两峰法时帆马秋药汪剑潭李石农蒋砺堂晓过崇效寺看花归集寒玉斋饯别
283064,清平乐·四月朔日同人集悯忠寺看花
770682,同倦斋同年崇效寺看花即题倦斋集
779298,风光好 天宁寺看花望西山积雪
270667,满庭芳·春日，雨中同田子纶、谢方山过邻寺看花分赋
730365,题潘伯寅侍郎极乐寺看花图卷
371044,报国寺看花
742715,云?见示龙槐寺同饭崇效寺看花之作复次其韵
784272,上巳日龙泉寺看花作
286179,上巳日龙泉寺看花作
789372,崇效寺看花之约事后方知有赵尧生太史曾刚甫杨筼谷二部郎复作一首
11534,河中府崇福寺看花
1051538,次韵王适一百五日太平寺看花二绝 其二
835195,清平乐 其二 四月朔日同人集悯忠寺看花
275141,崇效寺看花之约事后方知有赵尧生太史曾刚甫杨筼谷二部郎复作
756068,报国寺看花
1117151,次韵王适一百五日太平寺看花二绝
924576,次韵王适一百五日太平寺看花二绝 其一
632670,同天中清臣赤岩过山寺看花
118387,次韵王适一百五日太平寺看花二绝
