470024,陈山甫遨集杨姬华林馆同赋四首 其四
454845,一萼红丁亥岁杪偕京战游云南，途于思茅南郊无名山谷流连竟日。此地亦有人称八十号，林径幽深山水奇绝，时动清兴约同赋之，归后三日勉得此解
636376,雪麓梅花西乾山同赋
298622,同赋·地接扶桑日早烘
1124050,雨中夜归闻两儿诵书偶成二绝幸明叔先生同赋以示之
471183,秋日赴友人席修微有作同赋
147509,泉州紫极宫寿星殿古桧诸葛机宜同赋
1146311,辽东侍宴山夜临秋同赋临韵应诏
830560,大雪后偕苍虬入灵隐寺同赋
673083,画菊与邹汝愚同赋
1248318,舟中闻笛与张文学同赋
873264,李伯时画十古图郑尚明作诗诗辞多振绝因为同赋 高阳长揖
603058,初冬日承黄四茂才君甫元生元醴伯守黄苏欧八文士元昌元玉元佩元庸伯起伯安廷魁能见携李英偕赴吴茂才子赞之约即席同赋轻字韵
900564,时为桂林之役前一日刑部刘公置酒相饯曾节夫预焉既而刘公用陶靖节斜川诗韵见贻亦复同赋以谢
178843,同赋·三日山中游
1004109,李宰和唐子西芙蓉溪诗索同赋
1008075,辰十月八日同希周扫松灵石晚步松下怆然有怀以数诗示儿侄辈邀希周同赋时阿同在新城他日当寄之 其二
302691,安平乐慢·登窑梨花为一春胜赏。雨后道冲以车迓游，与美荪螴弟同赋
440165,霜叶飞 辛卯秋暮偕京中诸侣访西山黄叶村，传为曹雪芹晚岁著书之所，宁信其实，同赋此调
613171,除夕舟过韶关与钟同寅分韵同赋
502397,金铜仙人辞汉歌周伯宁同赋
1240776,承枢札致祭羊公太傅庙有作率舜章同赋
403638,醉吟商小品 四月初一夜闻杜鹃，是夜履平来宿，遂邀同赋。履平有《踏莎行》一首甚美，惜今佚其稿
636215,与李苍水何古钱放舟罗江登立石矶晚过黄茂才山庄同赋
1239777,东城道中与王守敬张思廉同赋
166638,虞仲通判以溪声名轩约同赋
1058351,湖南运使柯少卿用广西提刑曹司勋游岳麓寺韵送广西行俾令同赋
290071,绛都春·蛰园词集，赏牡丹。限调同赋
1070612,叔问作崇兰馆图画叔问去非与余相从林壑间二公各题二绝句余同赋四首 其三
1249398,用杨铁厓新居书画船亭韵与玉山同赋二首 其二
1231597,乾明寺钟诗与玉山同赋
1239723,无题回文七言绝句四首与友人同赋 其四
449308,荔枝香近  重午与朱师佟老同赋
201543,范才元参议求酒於延使君邀予同赋谨次其韵
345,送刘散员同赋得陈思王诗山树郁苍苍
902086,与陈去非夏致宏孙信道游南涧同赋四首 其四
531092,春郊得紫字张惟信同赋
985065,冯当可以日暮碧云合佳人殊未来效建除体作诗招胜之且索同赋因用其韵
869204,昌言谪官符离有病鹤折翼舟载以行及还修注始平公以诗问之命光同赋二首 其二
531768,游粤台与方棠陵伦右溪王象川伦彦蕃同赋得览字
308369,贺新凉·立秋日蒙赏秋叶饼与愔仲同赋
666893,谈思永以唐张祜题惠山诗勒石重街小洞之闲与诸弟同赋
1003993,工侍国史李丈奉御香祷雪上竺前一夕雪瑞已应道间志喜成诗以示敬借韵同赋 其一
1227683,戏效子夜歌体六首与达兼善御史同赋 其二
1026862,骐骥池上与冲卿同赋
159787,邻几和叔饮定力同赋
985234,登致爽阁观山用种字韵同赋一首
444421,霜叶飞 壬申秋杪京华吟聚，与盛元小步龙潭湖，同赋此阕，用梦窗韵
835418,解语花 黛黛花，吴淞茗名。与赵尧生同赋
998471,伯仲时德升用均父韵送德父守菑川邀余同赋
1245487,梅花清梦辞与贝廷琚博士同赋
466049,浣溪沙 戊寅初冬，萍影重过津门，与诸侣小集华夏酒楼，同赋二首
768771,高阳台 无锡华竹楼于凤凰山麓民家得牙牌一面背刻荔枝纹面镌宋词玉楼春其上字画明劲决为南宋宫禁物因偕汪小米晋竹滋伯同赋
242998,蔡天启作中兴碑诗且邀同赋
157399,赵观察作斋名烟艇孙耘老作唐律相邀同赋乃次
1103936,丁酉正月九日省谒家叔洁山居士于郭仙峰下是日仲退亦省其叔四山翁于是偕行洁山既留饭送别乌龙潭上裴回久之绝壁梅花炯然独立如高人招之不来冻泉泠泠下岩窦如瑟筑声相顾绝赏因以春山多胜事分韵约四山父子同赋时四山留外未归也韵以齿次瑞得多字
828942,双双燕 哲园灯社以新燕命题，同人写新燕为灯。因题小词，并索诸君同赋
1127997,邑令招讲上元故事与簿尉同赋二首
1116752,广陵会三同舍，各以其字为韵，仍邀同赋 刘贡父
602659,寒食访潘茂才子科昆季书馆夜坐同赋家字韵
1053137,维王府园与王元规承事同赋 其三
185704,丁酉春识庆上人于钱唐邓君善之索余同赋孝僧
1003933,道传山丹一本两花举以见遗夜窗翻书偶见刘潜夫尝赋云偶然避雨过民舍一本山丹恰盛开种久树身樛似盖浇频花面大如杯怪疑朱草非时出惊问红云甚处来可惜书生无事力千金移入画栏栽因借韵同赋一首
486078,青楼曲刘子雍胡伯清程伯羽同赋 其四
521513,程德望祠部于书室前凿池作亭秋望落成而正之内翰适至因名其亭曰登月室曰聚奎要予同赋 其一
712212,屈翁山寓楼老谷树为大风所摧诗以伤之索予同赋
292206,贺新凉·壬申季夏客居邛廨，蕉窗送雨，烦襟洒然，张紫帆枉存，同赋此解
1137290,六么令 云舍赵使君同赋
371673,雪后昌甫将归章泉斯远诸兄偕来留饮因咏林逋诗约同赋
355868,叔问作崇兰馆图画叔问去非与余相从林壑间二公各题二绝句余同赋
452501,踏莎行 与江南赴和轩小聚席间电话约引之同赋引之先成
1068857,用伯初韵再和一篇请子温户曹同赋
558634,淡轩为胡运同赋
603042,杪秋黄茂才君甫偕元性元玉元佩伯守伯祥伯安伯任诸文士同赋菊花天分韵得花字
172564,江社同赋·月树争枝影共寒
98905,江城子·湖上与张先同赋时闻弹筝
427518,暗香 和白石均。匑厂词宗属同赋红梅，率尔效颦，即题新刊碧虑商歌，并希正律
1168927,喷玉泉冥会诗八首 其二 四丈夫同赋
834402,南浦 其二 师曾同赋前题，叠韵荅之
603033,中秋后三日访黄茂才君甫留饮元玉伯安偕李英同赋
185507,有诗同赋·此山独姓楚春申
617743,郑太史既游罗浮访我月泉精舍入小嫏嬛同赋
904191,次韵德基效欧阳体作雪诗禁体物之字兼送表臣才臣友直勉诸郎力学之乐仍率同赋 其一
687910,壬午重阳后一日初住大通古寺罗戒轩黄葵村霍西牛陈臣张过宿同赋同葵村韵
132930,江海水仙同赋
635733,与谢邺门还山同赋
246251,高阳台·盛元过津酒后泛舟水上同赋
532008,郊祀斋居大兴隆寺与懋贤举之绳武三太史同赋二首得旗字 其一
424303,拜星月慢·秋霁卧疴，彦通拈此调属同赋
1192998,同赋龙沙墅
486188,同赋（治）
670520,与魏使君宿龙洞山寺同赋 其四
682438,九月雪时在苑西楼，与四家兄、傅逊之、高正甫诸公同赋
512497,舟中望虞山与吴匏庵同赋
1109693,和江邻几雪轩与持国同赋二首
588721,冬日介翁宗伯招饮赏菊次韵与甬川俨山二学士内方庶子同赋
973666,二十七日复雪用东坡聚星堂雪韵禁物体作诗约诸友同赋
979053,东坡公以种松法授都梁杜子师并为作诗子师求余同赋 其二
446263,寤兄夜半相约临屏同赋松斋兄韵
518815,水坑山家与何文甫廖敷锡限韵同赋三绝 其三
180752,粹翁用奇父韵赋九日与义同赋兼呈奇父
260217,同赋绝句·老去追欢强不能
895408,范才元参议求酒于延平使君邀予同赋谨次其韵
250655,游和顺古镇后于农家老宅食饵块饵丝幻庐得诗一联众人相约以此为结同赋
492304,题珠林江口谢公庙与旷伯逵同赋
160466,西轩会中与辛杨诸君同赋
881591,更漏子 其一 题赵伯山青白轩，时王丰父、刘长因同赋
712331,药亭入峡有月亲高峡烧星夹远江灯之句索予同赋别后出峡目睹其妙因为继作
330907,灵真道人久无诗来用协甫韵并前篇寄之且拉尔耳翁同赋
668411,月夜葛氏墓饮酒与子重履仁同赋二首 其二
1008076,辰十月八日同希周扫松灵石晚步松下怆然有怀以数诗示儿侄辈邀希周同赋时阿同在新城他日当寄之 其四
236225,适见诸公咏梅之什因用其韵率作者同赋
833141,寿楼春 秋气渐深，旋归有日，子宜至自保阳，寻当复去，连夕侍爱伯师饮丰楼，同赋是解
1029185,林正甫寺簿举似所和判院徐同年咏所居诗且俾同赋
34149,送刘散员同赋陈思王诗得好鸟鸣高枝
701567,秋日登万岁山不果至琼华岛辽后妆楼而返与张廖二子同赋分韵得登万二字
1041249,和江邻几雪轩与持国同赋二首 其二
1094267,雪后昌甫将归章泉斯远诸兄偕来留饮因咏林逋诗约同赋 其二
842435,十二月八日散步上海废城西见古木寒鸦与伯未同赋四首 其一
58571,秋日赴友人席修微有作同赋
268072,点绛唇·雨中见流萤，岚君、怡女同赋
1081785,曾守置酒月波楼以张倅至有诗命坐客同赋
489423,汗漫游与姚子静钱公权壁上人同赋
1187396,与郑辕薛晏游枋口同赋三韵诗 蒙泉
636066,山中除夕与诸子同赋
668442,东禅寺与蔡九逵同赋
819198,海棠盛开与稚辛似斋二弟同赋四首 其二
674276,思乡与伯乔子山限韵同赋
492696,遁迹山中日有幽事因即涧沐云卧草栖木食为四题与子中兄子彦弟同赋以自释 其四 木食
290084,双双燕·哲园灯社以新燕命题，同人写新燕为灯。因题小词，并索诸君同赋
871560,问月台苏竹庄同赋
1128216,叔问作崇兰馆图画叔问去非与余相从林壑间二公各题二绝句余同赋四首
377772,同赋·蔼蔼春空宿雾披
103759,奉和持国曼叔方叔送师直归马上同赋之什
1068519,同郡李达之贡辟廱偶试不利还乡及河不得济作二诗凄然读之殆难为怀因为次韵极其悲苦卒少纾之当烦刘元忠彭少逸同赋 其二
410579,中秋月蚀诗邀霜杰晓浦同赋
502387,乌夜啼练高同赋
449076,念奴娇  光子火箭与潘元福同赋
843484,采桑子 香雪约在小港探梅同赋
1062935,顷官会稽与江彦文赵胜非为僚盖二十馀年于今矣前日相会于庭中道旧乐胜非许以家酿饷我久而不至尝请为后堂之客屡矣辄复未果意者殆余请之未坚也因以诗戏之并约彦文同赋
573112,元夕度门出宫中月饼同赋 其二
451697,踏莎行 戊子新正与金水邵林小聚引之遥约同赋
987055,卜算子 泛西湖坐间寅斋同赋
1252669,用杨铁厓新居书画船亭韵与玉山同赋二首
685482,除夕携演春乐部过张伯起幼于昆仲园亭把玩腊梅残菊席上同赋三首
635321,夏日陈牧止孝廉招游南园舟中与庞若云张直咨诸子同赋
800512,鹰坊歌与夏重恺功同赋
182804,同赋虎帧·何事斑然虎
465287,高阳台 乙酉上巳禊集武侯祠水榭，感时事，约会者同赋
872538,题陈所翁为叶半隐作全龙邀同赋
1003994,工侍国史奉御香祷雪上竺前一夕雪瑞已应道间志喜成诗以示敬借韵同赋
483193,二月三日泊瓜洲渡与吴庵同赋
1222724,海子上即事与李子构同赋
492636,腊月廿三夜会西冈刘氏书房以传奉邀竹庭徵君子所国录俱以事不果至因写此述怀录示以传并柬同赋者
848168,夏日过庄严寺寺僧索诗为留三绝拉舍弟同赋 其二
98492,雨中夜归闻两儿诵书偶成二绝幸明叔先生同赋
1224960,题吴性存所藏赵仲穆竹枝双蝶图与玉山同赋
172563,凤鹤鹊三题与江社同赋
229233,兴化存公作竹林新亭雪庵雪林二老同赋次韵
465280,月边娇 同圭璋持生南园赏白杜鹃花，约同赋此
15710,汝州陆中丞席喜张从事至同赋十韵
735962,宿刘家园子苏孝廉懋斿过话是夕有兵信且值雷雨大作与懋斿同赋
1229894,与龚子敬同赋
864366,蔡天启作中兴碑诗且邀同赋
1041248,和江邻几雪轩与持国同赋二首 其一
52577,除夕曹能始宅林茂之弟彦先同赋
542490,秋集杜子奇园亭顾圣少同赋
1094268,雪后昌甫将归章泉斯远诸兄偕来留饮因咏林逋诗约同赋 其三
635206,王澹子居士新葺野樗亭成招集同赋
1063350,大观四年春吾与友人任景初舍弟端孺自蜀来京师至长安时方寒食吾三人相与戎服游九龙池饮酒赋诗乐甚是岁吾迁岭表明年景初亦谪江左忽忽数岁皆未得去寒食无几念念悽然作诗寄任因命舍弟同赋
1081956,次律兄以鼠盗防风感而作诗命某同赋
178697,与陈去非夏致宏孙信道游南涧同赋
850471,同赋蚊
972308,卢谊伯宜之见过要斯远同赋以赠二首 其二
443834,江梅引乙酉残腊感怀依白石四声，与颖庐同赋
850190,蜡梅二绝黄鲁直云王都尉有之邀同赋 其二
523904,庄上看花归见庭中海棠落英与客同赋
938871,赵观察作斋名烟艇孙耘老作唐律相邀同赋乃次其韵
1231824,题顾仲渊烟云轩与玉山同赋
492695,遁迹山中日有幽事因即涧沐云卧草栖木食为四题与子中兄子彦弟同赋以自释 其三 草栖
160443,骐骥池上与冲卿同赋
1008077,辰十月八日同希周扫松灵石晚步松下怆然有怀以数诗示儿侄辈邀希周同赋时阿同在新城他日当寄之 其一
1013511,山行与伯弜同赋野庙
1078439,冬至前六日奉陪舅氏燕集于张甥东斋泰孙侍坐舅甥四世同会岂易得也舅氏以诗见贶谨次韵成两章拜呈并简季弟二甥同赋 其二
542037,游水竹园孔丈同赋
56550,陈山甫遨集杨姬华林馆同赋
1211661,凤凰台为御史大夫易释董公同赋
1129437,兴化存公作竹林新亭雪庵雪林二老同赋次韵
188667,任伯仲时德升用均你韵送德父守菑川邀奈同赋
756672,同洪稚存太史王柳村秀才暨令嗣小村借庵主人登月波台看潮同赋
612301,中元后二夕玩月镜池贞元毓庭同赋
444470,浣溪沙 戊寅初冬，萍影重过津门，与诸侣小集华夏酒楼，同赋二首 其一
850253,同赋李梦符酒斗
948135,三月三日适值清明会客江楼共观并蒂魏紫偶成二小诗约坐客同赋 其一
808186,绮罗香  壬寅春分约徐丈紫山同赋
98496,同赋·檐雨浪浪欲二更
543966,易惟效署中避暑同赋四首 其二
437952,子文致君九日用安字韵聊亦同赋
617504,黄逢永过访同赋
418394,安平乐慢 登窑梨花为一春胜赏。雨后道冲以车迓游，与美荪螴弟同赋
902088,与陈去非夏致宏孙信道游南涧同赋四首 其二
602670,访黄茂才伯守留饮偕乃兄弟同赋体得三五七言
1132464,文季侍郎得绿萼香梅子文待制有诗辄亦同赋
183085,猩猩毛笔与黄鲁直同赋
98542,移松与斯远同赋
1079413,用寄璧上人韵寄范元实赵才仲及从叔知止兼率山伯同赋
594288,秋日雨中同方允治集范介儒书斋同赋霞伦二字 其二
1075170,沈元用太守和具茨诗张元明两用其韵见邀同赋
1154775,过坚上人故院与李端同赋
873261,李伯时画十古图郑尚明作诗诗辞多振绝因为同赋 张释之谏文帝
1079362,席大光邀同赋墨梅花 其四
1231827,玉笙谣玉山席上赠周生时铁厓同赋
636077,冬日与铁城诸子游小岭同赋 其一
938160,陈叔易赋王秀才所藏梁织佛图诗邀同赋因次其韵
486076,青楼曲刘子雍胡伯清程伯羽同赋 其二
628082,三城留别野望雨望两侄与任山有同赋
1034479,李微之闻其弟贯之西归以诗迓之刘左史和韵属余同赋 其六
178412,边公明尽屏荤茹因成古风约叔度良佐周翰同赋
1178044,汝州陆中丞席喜张从事至同赋十韵
899572,声声慢 都下与沈尧道同赋别本作北游答曾心 传惠诗
904204,张元览追和东坡咏梅要予同赋
893296,常山杨氏有二怪石奇险百状田曹张中行家雒阳遍见都中诸家所得异石皆出此下予他日思之恐常人忽而不珍作诗以诧其处并邀中行伯逢同赋
335283,曾守置酒月波楼以张倅至有诗命坐客同赋
183049,同赋蚊·生长虽微细
550058,瓶花影与仲诏同赋 其二
1095931,卢蒲江雪夜约同直省中出示采菊读书煎茶种橘四诗索危秘书诸名胜同赋 其一
1079359,席大光邀同赋墨梅花 其一
227473,范宰见寄游草堂谁谓渔盐市之什辄同赋一篇
1114593,景伯正字招东郊观梅晚集茶院秀远堂举之舍弟有诗景伯和章见简同赋
275809,宿刘家园子苏孝廉懋斿过话是夕有兵信且值雷雨大作与懋斿同赋
11281,张评事涉秦居士系见访郡斋即同赋中字
615336,卢一清韩孟郁李烟客诸子过访村居同赋
923334,与蒙城知县陈著作同赋吐绶鸟
1003512,工侍国史李丈奉御香祷雪上竺前一夕雪瑞已应道间志喜成诗以示敬借韵同赋 其六
820854,菩萨蛮 春雪集吟风台，息厂立盦同赋
602657,上巳日陪欧黄苏李诸社长集海西台同赋西字韵
975339,鸡冠后庭花同赋
978490,洗竹简诸公同赋
1130064,维王府园与王元规承事同赋
1168929,喷玉泉冥会诗八首 其四 四丈夫同赋
486067,琼姬墓宋仲珩同赋
973518,签判丈读曾文清公坐闻幽鸟语胜与俗人言之句感之为长句蕃谨次韵同赋
819199,海棠盛开与稚辛似斋二弟同赋四首 其三
923320,景德寺饮会丘思同作述怀诗兼纪一席之事见约同赋辄次元韵
133018,鸡冠后庭花同赋
1079361,席大光邀同赋墨梅花 其三
971568,雨中夜归闻两儿诵书偶成二绝幸明叔先生同赋以示之 其一
1146105,送刘散员同赋陈思王诗得好鸟鸣高枝
256586,洞仙歌·汴梁与许道真郭伯诚刘光甫同赋
216923,题陈所翁为叶半隐作全龙邀同赋
842438,十二月八日散步上海废城西见古木寒鸦与伯未同赋四首 其四
1003510,工侍国史李丈奉御香祷雪上竺前一夕雪瑞已应道间志喜成诗以示敬借韵同赋 其四
260218,同赋绝句·宾主相忘间浊清
1193206,九日与敬处士左学士同赋采菊上东山便为首句
288405,雨淋铃·八月二十三日即事，索无隅师同赋
1106090,与微之同赋梅花得香字三首
289991,菩萨蛮·春雪集吟风台，息厂立盦同赋
923306,同赋山寺郁李花
1026679,邻几和叔饮定力同赋
1079364,席大光邀同赋墨梅花 其六
1138799,丁酉春识庆上人于钱塘邓君善之索余同赋孝僧诗余请以二十字尽记其实既成善之喜而书之不知何人持去后二年上人访余江上复书以遗之
295234,十二月八日散步上海废城西见古木寒鸦与伯未同赋
532286,与李子同赋观奕
617763,智海修六若惺三上人过访同赋得风雨亦来过
502381,河中之水歌寄刘子雍程伯羽同赋
132754,酴醾牡丹同赋
538832,过欧广文苜蓿斋与子与同赋
320399,同赋·昨叶何摇落
686935,来日苦短黄子邕同赋
973464,游宋衡送示登明录诗卷次韵并呈同赋诸公
124152,同赋饮舫·饮有乘舟乐
370648,梨花蚁蝶图昌甫伯皋约同赋
1007741,景祐丁丑创曲水亭寮属同赋诸官诗成因书二韵于后
1142298,同赋开元宫避暑诗
1079363,席大光邀同赋墨梅花 其五
151761,文季侍郎得绿萼香梅子文待制有诗辄亦同赋
1137181,谒金门 其一 风乍起，约巽吾同赋海棠
850469,同赋京尘
183359,同赋山寺郁李花
1230893,虎丘三首郑君明德偕廉夫伯雨诸公同赋次东坡先生韵 其一
921533,雪林砚屏率鲁直同赋
1065981,康师见访于竹阁因师臣师同赋问讯元老人
636473,游飞水潭与诸子同赋限韵 其二
935637,江东韩漕晞道寄杨廷秀所赠诗来求同赋作此寄之
1081803,曾宏父作诗别行简索仆同赋
443409,翠楼吟　丙子新秋与蛰堪、梦芙、成纲、引之诸君聚于柏森诗丈双枣书屋，相约同赋此调
148606,临安主人出冰块佐饮曾簿严宰同赋
1132,同赋山居七夕
518813,水坑山家与何文甫廖敷锡限韵同赋三绝 其一
557644,同赋清平阁饮宋山人二首 其二
1067983,元亮诗次玉局翁过二李故居韵赏仆作草堂于故园同赋一章
610976,冬至前三日对雪时值圣母万寿与陈裕所同赋禁用雪套
1001484,与邓继高望沙山同赋
719775,松江春日张带三老丈招同修来先生宴集分得九佳灯下同赋明日既返棹金陵书此并以为别求正时庚申二月四日
850672,蜡梅二绝黄鲁直云王都尉有之邀同赋 其一
592028,春夜同惟敬约卿集寿承学舍时休承将之吉水在坐同赋得寒字
593653,熊典籍四十八始举一男孙学录邀余同赋
329189,用寄璧上人韵寄范元实赵才仲及从叔知止兼率山伯同赋
1041327,吴九秋过西池作诗持国和之邀予同赋
320205,新作西庵将及春景戏成两诗请李思中节推同赋
602675,黄上舍伯舆将游太学□过小集偕乃兄弟同赋林字韵
633890,宿冯孝廉载赓敏来斋斋中植鸡冠花数本一茎径可尺馀诸公同赋限红字
1227684,戏效子夜歌体六首与达兼善御史同赋 其三
1053237,吴江垂虹亭同赋得岸字
987057,凤栖梧/蝶恋花 其三 湖头即席，长翁同赋
213400,倦寻芳·花翁遇旧欢吴门老妓李怜邀分韵同赋此词
288637,曲游春·偕彦通游徐园，同赋。时彦通将有北行
665449,虎丘与思道同赋
306,送刘散员同赋陈思王诗游人久不归
636079,冬日与铁城诸子游小岭同赋 其三
636472,游飞水潭与诸子同赋限韵 其一
826639,壶中天慢·清史馆西轩外桃花一枝，生于榆叶梅上，高枝过屋。乙卯仲春盛放，同人目为寄生桃。偕邓孝先、金篯孙同赋
854684,以诗句咏梅 玉笛冰滩索同赋
687024,遁迹山中日有幽事因即涧沐云卧草栖木食为四题与子中兄子彦弟同赋以自释 涧沐
1113321,与陈去非夏致宏孙信道游南涧同赋四首
1154208,绵州官池赠别同赋湾字
881705,鹧鸪天 其六 有怀京师上元，与韩叔夏司谏、王夏卿侍郎、曹仲谷少卿同赋
160509,徐秘校携酒池上同赋
1066512,九月二十四日陪少蕴左辖饮朱氏林亭以朱行中寄其弟诗为韵席上同赋
855931,伏蒙知县县尉二寮友以夏旱得雨赓石徂徕喜雨韵见贶不可虚辱复嗣其韵书谢仍命儿曹同赋
979363,东坡公以种松法授都梁杜子师并为作诗子师求余同赋 其一
132924,江梅蜡梅同赋
191152,和耘老弟木犀诗韵且督汉老弟同赋
610475,除夕携演春乐部过张伯起幼于昆仲园亭把玩腊梅残菊席上同赋三首 其一
900563,张安国约同赋仇氏㔶瓮酒
858629,与微之同赋梅花得香字三首 其一
864200,同赋梅花十二题 其六 雨中
1113869,中春之初与诸友游黎氏园荆华赠予桃花一枝归置瓶中连日不凋因成两绝示同行且令同赋
436763,岁己酉春正月十有一日吾友张君汉臣下世家贫不能葬乡邻办丧事诸君皆有吊章且邀余同赋每一忖思辄神情错乱秉笔复罢今忽四旬矣欲绝不言无以表其哀因作古意四篇虽比兴之不足观者足知予志之所在则进知吾汉臣也无疑
156022,晚菊二绝·并与杞同赋
1183174,台头寺愿上人院古松下有小松裁毫末新生与纤草不辨重其有凌云干霄之志与赵八员外裴十补阙同赋之
375098,刘改之题王总干虏中怀亲帖拉朴翁与余同赋
250127,踏莎行·与江南赴和轩小聚席间电话约引之同赋引之先成
1034478,李微之闻其弟贯之西归以诗迓之刘左史和韵属余同赋 其一
282405,中秋月蚀诗邀霜杰晓浦同赋
560481,存德堂为包山徐以同赋
632583,寒食偕诸子访苗李二鍊师归见木斋留诗同赋
668680,千叶梅与方山人同赋
635833,社集香莲庵同赋初秋野望用酡字
1001663,临安主人出冰块佐饮曾簿严宰同赋
1053136,维王府园与王元规承事同赋 其一
1028945,和耘老弟木犀诗韵且督汉老弟同赋
612033,香淡斋莲池新成净友道人午日自飞来寺回过访小酌同赋
1249134,赵子期尚书于省幕创轩曰小瀛洲题诗要余与明德同赋
562065,观海与鲍仲孚同赋
470352,圣仆宿永福寺同赋空字
836346,醉太平 赠雏伶红牡丹，王瘿叟、孙竹孙同赋
506590,咏雪与寮友同赋
502390,来日苦短黄子邕同赋 其二
1250798,雪夜与友人同赋四十韵
820977,绛都春 蛰园词集，赏牡丹。限调同赋
611078,夏日米君梦吴翁晋载酒过斋头席上同赋二首 其二
1168926,喷玉泉冥会诗八首 其一 四丈夫同赋
1062561,汪信民顷赴符离约谒告还家为盛集戏作诗嘲之以助一笑仍率诸友同赋
692738,毛园萃芳亭与沈中白丘月渚同赋
506607,酒垆行与曾侍讲同赋
603065,过黄宅书馆吴子赞黄君甫二茂才黄元庸欧裔能黄叔和雅集同赋之字韵
314824,绿盖舞风轻·己卯七夕前一日，海上词流集李公祠看荷花，拈此曲同赋
671092,初度日子与过署中同赋
434367,洞仙歌 汴梁与许道真郭伯诚刘光甫同赋
612493,清明日雨歇泥深竟阻郊游尹冲玄载酒集朝爽台彭周两君同赋
1034706,余既赋诗坐客请以唐人家花车斜韵同赋醉中作五十六言
1124990,夏日过庄严寺寺僧索诗为留三绝拉舍弟同赋
843973,听水第二斋落成幼点嘿园同赋
179031,同赋·策杖南涧边
903474,凤鹤鹊三题与江社同赋 其二
604199,伏日区用孺太史招饮慈仁寺蟠松下同赋
873263,李伯时画十古图郑尚明作诗诗辞多振绝因为同赋 冯媛当熊
111879,中秋前一日诸生携酒见过对月同赋
1074970,张载扬言扬州燕子无屋可居即船为巢命黄叔鱼赋诗今年春余始见叔鱼诗于宣城遂同赋
1236367,虎丘三首郑君明德偕廉夫伯雨诸公同赋次东坡先生韵
81024,江东韩漕曦道寄杨庭秀所赠诗来求同赋作此寄
594439,李君实万未夫范藏卿余无且林仙客丁君朗梅季豹枉过同赋
439513,闰八月十八日会同馆诸公同赋绝句五首
685505,雨夕陈仪翔年丈过小斋话旧同赋十首
260216,同赋绝句·太平胜事古难并
