952524,同钱则父登郡城观予所和梅仲潜金山吊东鲁林表民逢吉诗淮民同赋一绝
158530,与盛毅同赋暮角行
307421,同赋·尚嫌石鼓泉声细
670718,与子与游灵隐寺吴马诸公同赋
531534,毛园萃芳亭与沈中白丘月渚同赋 其二
1054360,新作西庵将及春景戏成两诗请李思中节推同赋 其一
1062943,东坡兄弟应制举日各携砚一入对廷中而黄门之砚为其甥文骥所宝好事者往往有诗文以请余故亦同赋
185506,八月初游君山谊斋有诗同赋
820922,水龙吟 息厂观庞郎季云演明妃故事，约同赋
522496,王豸使既返东月皎升乃与李曹二子径觞吹台之巅口占柬黄子同赋
611088,雨夕陈仪翔年丈过小斋话旧同赋十首 其十
670518,与魏使君宿龙洞山寺同赋 其二
55387,圣仆宿永福寺同赋空字
906415,虞仲通判以溪声名轩约同赋
873303,李伯时画十古图郑尚明作诗诗辞多振绝因为同赋 明妃出塞
446065,汝启梅岗绿烟来访晓南在座议以几上生香蕉为题约同赋
611082,雨夕陈仪翔年丈过小斋话旧同赋十首 其四
1130767,雪后昌甫将归章泉斯远诸兄偕来留饮因咏林逋诗约同赋
133103,次韵张安抚李侍郎同赋茯苓酥
1083471,李伯时画十古图郑尚明作诗诗辞多振绝因为同赋 醉山简
1003511,工侍国史李丈奉御香祷雪上竺前一夕雪瑞已应道间志喜成诗以示敬借韵同赋 其七
447500,暮春登剑门关用温飞卿韵与诸君同赋
485189,登江阁远怀徐记室与杜进士同赋
496434,浣溪沙 欧园离席，与刘珥江同赋
1226884,清明日宴集贤宋学士园时梨花盛开诸老属仆同赋
377771,维王府园与王元规承事同赋
292159,解语花·黛黛花，吴淞茗名。与赵尧生同赋
1066634,初得庵基于青山用立方韵请道祖同赋
118281,所寓堂後月季再生与远同赋
1113538,凤鹤鹊三题与江社同赋
1095933,卢蒲江雪夜约同直省中出示采菊读书煎茶种橘四诗索危秘书诸名胜同赋 其三
1029186,林正甫举似所和双丫岩诗且索同赋
381746,海棠盛开与稚辛似斋二弟同赋
593959,刘仲修园赏牡丹苏以时袁景从李袭美同赋花字得十韵
101263,述古闻之明日即来坐上复用前韵同赋
180743,陈叔易赋王秀才所藏梁织佛图诗邀同赋因次其
699481,元夕度门出宫中月饼同赋
938284,粹翁用奇父韵赋九日与义同赋兼呈奇父
1249397,用杨铁厓新居书画船亭韵与玉山同赋二首 其一
573113,元夕度门出宫中月饼同赋 其三
1223559,秋露白酒熟卧闻槽声喜而得句可行当同赋也
492307,陪虞管勾幼悦坐王子启南园竹林同赋
1192418,与郑辕崔全素游枋口同赋三韵诗（题拟） 石笋高
523966,人有送牡丹花至者与客同赋
858628,与微之同赋梅花得香字三首 其二
215226,与微之同赋梅花得香字
298616,续前题与宋奕岩同赋
543965,易惟效署中避暑同赋四首 其一
96770,同赋以赠·近别溪山郡
661395,贺其荣病京师吴原博舁归第中而卒为之殓殡其荣父作感义诗谢之要予同赋
588615,元夕与传道人同赋得时字
687956,岛门秋雨与诸子同赋
770144,惜红衣•楚中午日同赋
476693,毛园萃芳亭与沈中白丘月渚同赋 其一
174233,按部留小诗命男明复同赋
906342,青原台与兄弟同赋
502392,惜别词端孝思同赋 其二
733819,曹升六谢千仞携酒过饮宋牧仲张杞园亦至同赋长句 其二
469897,除夕曹能始宅林茂之弟彦先同赋（癸卯）
903473,凤鹤鹊三题与江社同赋 其一
366791,汾州有唐大历中崇徽公主嫁回鹘时手迹在石壁上李山甫作七言诗并刻之子华永叔内翰皆继其韵亦同赋
1194470,喷玉泉冥会诗八首 四丈夫同赋
1003960,十四日同张伯修罗坚甫大智赏月探韵即事感兴殊激懦衷翌日会保福辱诗示教借张大韵同赋
1174962,与李文仲秀才同赋泛酒花诗
733818,曹升六谢千仞携酒过饮宋牧仲张杞园亦至同赋长句 其一
283504,月下笛·倬盦要同赋龙笛，云是清太庙乐，谱清真
1103949,六月三日赴周南翁之招时芳洲留梅山堂述行实仆与观焉临别以高山流水四字分韵约仲退同赋瑞得山字
924804,所寓堂后月季再生与远同赋
992604,奉和持国曼叔方叔送师直归马上同赋之什
178698,同赋·山桃深复浅
260214,闰八月十八日会同馆诸公同赋绝句
1050085,蒋颖叔要予同赋平云阁
447149,贺新郎 与八舅幺舅胡惠溥世兄游忠县石宝寨同赋
569880,华太学邀过鸿胪卿王公慧山西园景物尤胜丽与俞比部曹山人同赋
531743,秋日登万岁山不果至琼华岛辽后妆楼而返与张廖二子同赋分韵得登万二字 其一
180503,诸公和渊明止酒诗因同赋
102049,大人按部过云安下岩留小诗命同赋
562124,风泾定光寺周回三里皆荷花彷佛有钱塘西湖之胜与筠谷高士同赋
437830,予所居之南下临短壑因凿壁开窗规为书室坐获山林之趣榜曰野斋且作诗约诸友同赋
828058,法相寺中老樟一株双干皆大十围其本殆不可量不知何代物也散原老人属同赋之
283288,南浦·师曾同赋前题，叠韵荅之
591249,少司寇大庾刘公出示郑少谷所书李空同何大复诗同赋
1000141,与盛毅同赋暮角行
102742,雪林砚屏率鲁直同赋
236763,玉笛冰滩索同赋
444452,翠楼吟 柏森先生招饮双枣书屋，与梦芙、新河、引之同赋此调
922901,与次道集贤谏议元素翰林赴冲卿枢密谏议见招宴会同赋
701498,郊祀斋居大兴隆寺与懋贤举之绳武三太史同赋二首得旗字
1958,送李侍郎迥秀薛长史季昶同赋得水字
1137129,恋绣衾 其二 或送肉色牡丹同赋
1042497,汾州有唐大历中崇徽公主嫁回鹘时手迹在石壁上李山甫作七言诗并刻之子华永叔内翰皆继其韵亦同赋
1026002,绕池游慢 赵倅游濠，作绕池游慢，约同赋
531744,秋日登万岁山不果至琼华岛辽后妆楼而返与张廖二子同赋分韵得登万二字 其二
975743,次韵张安抚李侍郎同赋茯苓酥
670126,逼除过右史水村江山人同赋
618869,孺朗携酒过明叔山房同赋
1247836,小轩得白石玉雪不足喻置之竹泉石间大可人意也因邀云松同赋
955031,儗过钱塘约诸客同赋
1104885,新作西庵将及春景戏成两诗请李思中节推同赋
443433,昭君怨  三月晦日送春，依依拈此调同赋
350688,惜红衣·楚中午日同赋
737003,咏香与顾书宣陈南麓汪安公同赋
307423, 同赋·君去城中莫浪传
1239486,至正丁酉冬昆山顾仲瑛会客芝云堂适时贵自海上来以黄柑遗之仲瑛分饷坐客喜而有作属余及陆良贵袁子英等六客同赋
492405,有咏胡麻花者同赋一首
307422,同赋·一路琅玕绿到山
711918,月夜姚菊里载酒招同郭清霞陶苦子邹中和简文震重集邹仪生寒玉堂同赋用空字
842772,听水第二斋落成幼点嘿园同赋 其四
437690,闰八月十八日会同馆诸公同赋绝句五首 其一
999285,余祷雨龙湫翼日响应儿子兴之有诗纪实仲文季直弟亦既同赋老子久不作诗因得绝句
148884,与邓继高望沙山同赋
1079360,席大光邀同赋墨梅花 其二
54161,月夜登阊门西虹桥与子重同赋
1252077,陪徐汝澄元晖元中张宗献陈彦初诸君饮陈太真湖亭顺泛沧洲矶游三山书院沿郭西而归同赋
1070613,叔问作崇兰馆图画叔问去非与余相从林壑间二公各题二绝句余同赋四首 其四
1196093,太傅相公以庭梅二篇许舍弟同赋再迂藻思曲有虚称谨依韵奉和庶申感谢
896998,自巴河至蕲阳口道中得二诗示仲达与秬同赋 其二
1187397,与郑辕薛晏游枋口同赋三韵诗 薜荔壁
351559,席大光邀同赋墨梅花
985179,眉州太守刘公忽于池中获东坡所作远景楼碑乡人费洪雅有诗美之因率同赋次其韵
1003801,余拉威济取山路归家用光独溯江再和见贻仍同赋
837293,惜余春慢·慈仁寺双松。相传有清中叶重植，非渔洋诸老所题旧物。寺燬于庚子兵燹，松独无恙。社集分咏京师花木，召南拈得，以平生未睹为憾。偶偕访之，一已枯萎，盖昨岁栖止流民，爨湢所侵也，慨然同赋
486077,青楼曲刘子雍胡伯清程伯羽同赋 其三
1192420,与郑辕崔全素游枋口同赋三韵诗（题拟） 薜荔壁
1170565,喜邢校书远至对雨同赋远晚饭阮返五韵
452361,游和顺古镇后于农家老宅食饵块饵丝幻庐得诗一联众人相约以此为结同赋
874335,江头送赵教即席同赋
258215,予所居之南下临短壑因凿壁开窗规为书室坐获山林之趣榜曰野斋且作诗约诸友同赋
873262,李伯时画十古图郑尚明作诗诗辞多振绝因为同赋 王猛扪虱
250164,鹧鸪天·十二梅花馆雅集相约同赋
611400,修褉日苏汝载介绍林茂之昆玉过我西园小酌同赋
868756,赵振文在城北厢两月无日不游马塍作歌美之请知振文者同赋
452538,鹧鸪天 十二梅花馆雅集相约同赋
826850,露华·西馆植榆叶梅与桃同根，每岁花开，桃先梅后。曩尝邀孝先、阶青二君同赋。顷闰枝用碧山词平韵咏桃，仄韵咏梅，更与同馆诸君依韵和之
386891,金缕曲·咏八仙宫黄杨，邀湘绮同赋
316939,间行与文震青编修同赋
1075290,元素再邀同赋
602971,访欧隐君少玄留饮偕何梁二文学同赋庐字韵
1230894,虎丘三首郑君明德偕廉夫伯雨诸公同赋次东坡先生韵 其二
492694,遁迹山中日有幽事因即涧沐云卧草栖木食为四题与子中兄子彦弟同赋以自释 其二 云卧
444553,倦寻芳 千山词聚，拈此调与诸侣同赋
1008078,辰十月八日同希周扫松灵石晚步松下怆然有怀以数诗示儿侄辈邀希周同赋时阿同在新城他日当寄之 其六
1200733,吴志道即居左凿池，池中立石假山，高丈馀，络以翠萝，环以清流，旁创小亭，为游息之所。肩吾陈子扁之曰咫尺蓬莱，作歌要余同赋，因次其韵云：
1034480,李微之闻其弟贯之西归以诗迓之刘左史和韵属余同赋 其二
336480,张载扬言扬州燕子无屋可居即船为巢命黄叔鱼赋诗今年春余始见叔鱼诗于宣城遂同赋
591356,鉴江月夜与少承同赋
842437,十二月八日散步上海废城西见古木寒鸦与伯未同赋四首 其三
58790,予适太原熊惟远吴求叔还武昌同赋
489476,题赠笔生王纯与径山愚庵及公同赋
592090,十六夜小斋待月元白约卿同赋
260215,同赋绝句·闰年都未有新霜
864199,同赋梅花十二题 其八 竹外
54510,琼姬墓宋仲珩同赋
1106990,同赋梅花十二题 半开
873266,李伯时画十古图郑尚明作诗诗辞多振绝因为同赋 李密迓太宗
1217470,题崇真宫陈练师壁间竹梅邀倪仲恺同赋
470023,陈山甫遨集杨姬华林馆同赋四首 其三
939252,边公明尽屏荤茹因成古风约叔度良佐周翰同赋公明学佛而不专意性理故及之
742164,粤东诗与陈简亭同赋 其二
835362,贺新凉 壬申季夏客居邛廨，蕉窗送雨，烦襟洒然，张紫帆枉存，同赋此解
993196,梦与公度同赋藕华追录之
869205,昌言谪官符离有病鹤折翼舟载以行及还修注始平公以诗问之命光同赋二首 其一
908583,景伯正字招东郊观梅晚集茶院秀远堂举之舍弟有诗景伯和章见简同赋 其一
502389,来日苦短黄子邕同赋 其一
1120372,三月三日适值清明会客江楼共观并蒂魏紫偶成二小诗约坐客同赋
172566,江社同赋·一去朝阳寂不闻
1138801,八月初游君山谊斋有诗同赋二首 其二
1106043,同郡李达之贡辟廱偶试不利还乡及河不得济作二诗凄然读之殆难为怀因为次韵极其悲苦卒少纾之当烦刘元忠彭少逸同赋
974385,移松与斯远同赋
1125097,东坡公以种松法授都梁杜子师并为作诗子师求余同赋
635843,壬午重阳后一日初住大通古寺罗戒轩黄葵村霍西牛陈臣张过宿同赋同葵村韵 其一
492693,遁迹山中日有幽事因即涧沐云卧草栖木食为四题与子中兄子彦弟同赋以自释 其一 涧沐
474338,肖甫送至天雄故城因观宋大观五礼碑同赋
436085,岁己酉春正月十有一日吾友张君汉臣下世家贫不能葬乡邻办丧事诸君皆有吊章且邀余同赋每一忖思辄神情错乱秉笔复罢今忽四旬矣欲绝不言无以表其哀因作古意四篇虽比兴之不足观者足知予志之所在则进知吾汉臣也无疑 其一
610719,花朝集山人钱简栖宅夜饮王百谷同赋
915069,乡士李英才得老潘墨法善作墨梅复喜作诗艮斋目以三奇赠之七字予复同赋云
518814,水坑山家与何文甫廖敷锡限韵同赋三绝 其二
815618,续前题与宋奕岩同赋
13886,与李文仲秀才同赋泛酒花诗
834602,月下笛 倬盦要同赋龙笛，云是清太庙乐，谱清真
833392,金缕曲 咏八仙宫黄杨，邀湘绮同赋
1137172,绮寮怨 青山和前韵忆旧时学馆，因复感慨同赋
968988,和徐径坂帛诗韵并约徐立大同赋
545825,汪明府邀集衙斋陶驾部懋中适至同赋
665819,望武夷时与黄元质同赋
920395,广陵会三同舍，各以其字为韵，仍邀同赋 其三 刘莘老
985170,按部留小诗命男明复同赋
975283,江梅蜡梅同赋
1003823,邑令招讲上元故事与簿尉同赋二首 其一
842649,七月十五夜舆幼点泛月同赋兼答珍午再叠之意三叠前韵
1230895,虎丘三首郑君明德偕廉夫伯雨诸公同赋次东坡先生韵 其三
430422,题三子游草次吹万见赠原韵与三兄不识同赋
447565,西湖与诸诗友同赋送春诗二首 其一
166204,青原台与兄弟同赋
670173,早春元美公实访茂秦华严精舍同赋
1026304,西轩会中与辛杨诸君同赋
608827,九月雪时在苑西楼，与四家兄、傅逊之、高正甫诸公同赋 其二
842770,听水第二斋落成幼点嘿园同赋 其二
532009,郊祀斋居大兴隆寺与懋贤举之绳武三太史同赋二首得旗字 其二
686923,青楼曲刘子雍胡伯清程伯羽同赋
864194,同赋梅花十二题 其四 月下
920542,述古闻之，明日即至，坐上复用前韵同赋
46822,登江阁远怀徐记室与杜进士同赋
371680,叶侍郎寄乌石茶昌甫诗谢之次韵同赋
742163,粤东诗与陈简亭同赋 其一
593337,李于美方允治见过阅徐子与闽中所寄诗同赋
636369,九日与丹霞诸子登海螺峰绝顶，同赋用咸韵
103448,八月二十七日梦与宋侍读同赋泛伊水诗觉而录
611087,雨夕陈仪翔年丈过小斋话旧同赋十首 其九
611079,雨夕陈仪翔年丈过小斋话旧同赋十首 其一
611086,雨夕陈仪翔年丈过小斋话旧同赋十首 其八
980127,三月五日南京梢工来报船经金人残毁之后尚有书籍存者且以二诗为信忽睹高仲夷唱和诗不胜感叹辄用其韵识其事率同赋
867455,贺新郎 其五 湖上高宾王、赵子野同赋
573111,元夕度门出宫中月饼同赋 其一
864198,同赋梅花十二题 其九 江村
620122,罗若思贻珍珠菊与客同赋
634710,咏冬月恭祝本师和尚同赋
1107713,昌言谪官符离有病鹤折翼舟载以行及还修注始平公以诗问之命光同赋二首
542136,敬轩诚轩携酒见过西岩西池同赋
663899,十月十三日高唐会石峰陈提学同赋
864203,同赋梅花十二题 其十一 薄暮
436087,岁己酉春正月十有一日吾友张君汉臣下世家贫不能葬乡邻办丧事诸君皆有吊章且邀余同赋每一忖思辄神情错乱秉笔复罢今忽四旬矣欲绝不言无以表其哀因作古意四篇虽比兴之不足观者足知予志之所在则进知吾汉臣也无疑 其三
842769,听水第二斋落成幼点嘿园同赋 其一
1231865,题东山图玉山同赋
611193,元夕前四日余将之官留垣韩圣期韩孟郁苏汝载谭公谨诸子过集珠江舟中玩月同赋用青字
592150,九日惟敬置酒与张刘管张四山人同赋
436088,岁己酉春正月十有一日吾友张君汉臣下世家贫不能葬乡邻办丧事诸君皆有吊章且邀余同赋每一忖思辄神情错乱秉笔复罢今忽四旬矣欲绝不言无以表其哀因作古意四篇虽比兴之不足观者足知予志之所在则进知吾汉臣也无疑 其四
612082,辛酉元夕立春邀米君梦观灯同赋
1008071,辰十月八日同希周扫松灵石晚步松下怆然有怀以数诗示儿侄辈邀希周同赋时阿同在新城他日当寄之 其八
116444,同赋·浩浩浑流卷白沙
1144354,八月初游君山谊斋有诗同赋二首
1007161,冷翠阁与秋岩同赋
183495,与丘程凌林四君同赋食河豚
665490,东漈柴门歌陈执之侍御席上与思道同赋
159876,宝奎殿前花树子去年与宋中道同赋今复答宋诗
543967,易惟效署中避暑同赋四首 其三
531159,泛舟浣花东阜狷斋同赋
736900,淮南拈唐人韵顾梁汾同赋
99805,广陵会三同舍各以其字为韵仍邀同赋刘贡父
605070,何龙友太史还朝以出山诗见示余既次韵答赠陈集生太史复即事赋别余又次韵同赋 其二
712765,重阳前二日李尚卿孝廉过坐晚成堂月下小饮同钟裴仙处士侄汝侯二儿赣励同赋
548519,对菊得诗字与若抚同赋
1132343,李微之闻其弟贯之西归以诗迓之刘左史和韵属余同赋
1071136,中春之初与诸友游黎氏园荆华赠予桃花一枝归置瓶中连日不凋因成两绝示同行且令同赋 其一
1094266,雪后昌甫将归章泉斯远诸兄偕来留饮因咏林逋诗约同赋 其一
603046,十日过黄茂才君甫宅留酌偕梁欧黄诸文学同赋黄字韵
427748,大酺 一九五二年国庆前夕，上海市文物管理委员会同人宴集人民广场大厦，柳翼谋丈诒徵属倚此曲，兼邀沈尹默、汪旭初东两翁同赋
829563,海棠盛开与稚辛似斋二弟同赋四首
815617,粤东诗与陈简亭同赋
864201,同赋梅花十二题 其十二 欲谢
1003514,工侍国史李丈奉御香祷雪上竺前一夕雪瑞已应道间志喜成诗以示敬借韵同赋 其三
493628,同礼部主事张孟兼国录萧子所焚香夜坐同赋线香联句二十韵
635844,壬午重阳后一日初住大通古寺罗戒轩黄葵村霍西牛陈臣张过宿同赋同葵村韵 其二
864193,同赋梅花十二题 其十 山馆
670517,与魏使君宿龙洞山寺同赋 其一
1192419,与郑辕崔全素游枋口同赋三韵诗（题拟） 蒙泉
551,绵州官池赠别同赋湾字
400097,渡江云 中秋芋园对月，咏雩先成此调索和，并次原韵。同赋者有劳墨斋、梁藕庵
335233,次律兄以鼠盗防风感而作诗命某同赋
1073525,游钟石寺问名寺之因缘老僧指门旁石如覆钟状赋诗一首邀何袭明登仕同赋
1252790,无题回文七言绝句四首与友人同赋
531536,毛园萃芳亭与沈中白丘月渚同赋 其四
611085,雨夕陈仪翔年丈过小斋话旧同赋十首 其七
177612,江城与秋岩同赋
176689,冷翠阁与秋岩同赋
385289,千叶梅与方山人同赋
864196,同赋梅花十二题 其三 风前
444420,高阳台 盛元过津，酒后泛舟水上同赋
658542,匏庵和乐天五十八归来因同赋
163535,李宰和唐子西芙蓉溪诗索同赋
608826,九月雪时在苑西楼，与四家兄、傅逊之、高正甫诸公同赋 其一
602680,方隐君绍一招游芙蓉别业喜食菠罗蜜偕何李诸君同赋玄字韵
174277,登致爽阁观山用种字韵同赋
437691,闰八月十八日会同馆诸公同赋绝句五首 其二
828422,春尽后又二十日见海棠一株妍媚绝世约治芗同赋
974459,潘元寿以九月十一日行莫令君领客携具泛舟饯之蕃用九日韵作诗要莫及徐丞同赋以送潘
69604,钱塘怀古率堵无傲同赋
444491,宴清都 辛巳仲春与淑萍、盛元、连珠小集京华紫竹院，同赋此调
687939,冬日与铁城诸子游小岭同赋
1071137,中春之初与诸友游黎氏园荆华赠予桃花一枝归置瓶中连日不凋因成两绝示同行且令同赋 其二
437693,闰八月十八日会同馆诸公同赋绝句五首 其四
477908,月夜登阊门西虹桥与子重同赋
1035985,江神子 湖上与张先同赋时闻弹筝
1129553,卢蒲江雪夜约同直省中出示采菊读书煎茶种橘四诗索危秘书诸名胜同赋
834847,点绛唇 其一 雨中见流萤，岚君、怡女同赋
183120,同赋京尘·白日临黄道
1193200,张评事涉秦居士系见访郡斋即同赋中字
1061038,春日饮王立之家同赋三头牡丹依次定十韵节得牡字
690557,何龙友太史还朝以出山诗见示余既次韵答赠陈集生太史复即事赋别余又次韵同赋
611081,雨夕陈仪翔年丈过小斋话旧同赋十首 其三
830956,贺新凉  立秋日蒙赏秋叶饼与愔仲同赋
526799,同馆会都下者十有三人以尘世难逢开口笑菊花须插满头归分韵赋诗予得花字同赋归字
163988,邑令招讲上元故事与簿尉同赋
1026834,徐秘校携酒过池上同赋
246264,翠楼吟·柏森先生招饮双枣书屋与梦芙新河引之同赋此调
975628,酴醾牡丹同赋
635129,峨嵋山僧寄筇竹杖同赋
690153,水坑山家与何文甫廖敷锡限韵同赋三绝
307420,听水第二斋落成幼点嘿园同赋
887628,倦寻芳 林钟羽花翁遇旧欢吴门老妓李怜，邀 其一 分韵同赋此词
605069,何龙友太史还朝以出山诗见示余既次韵答赠陈集生太史复即事赋别余又次韵同赋 其一
696287,瓶花影与仲诏同赋
470133,予适太原熊惟远吴求叔还武昌同赋
821024,探春慢 寓楼对雪，颇动羁愁。季刚次韵先成此解，邀余同赋
848169,夏日过庄严寺寺僧索诗为留三绝拉舍弟同赋 其三
611084,雨夕陈仪翔年丈过小斋话旧同赋十首 其六
1070921,灵真道人久无诗来用协甫韵并前篇寄之且拉尔耳翁同赋
1112589,自巴河至蕲阳口道中得二诗示仲达与秬同赋
685504,夏日米君梦吴翁晋载酒过斋头席上同赋二首
612213,孟冬二日彭贞元陈永平过访小酌共拈七阳与自得同赋
908586,景伯正字招东郊观梅晚集茶院秀远堂举之舍弟有诗景伯和章见简同赋 其二
215178,与平甫同赋槐
670654,与子与游保叔塔同赋
424311,曲游春·偕彦通游徐园，同赋。时彦通将有北行
531209,登丹棱县白塔寺塔与吕竿川同赋
1128719,辰十月八日同希周扫松灵石晚步松下怆然有怀以数诗示儿侄辈邀希周同赋时阿同在新城他日当寄之
1187395,与郑辕薛晏游枋口同赋三韵诗 石笋高
1237468,戏效子夜歌体六首与达兼善御史同赋
1030407,小孤索同黄士殷同赋
801729,雪霁古直结苍过宿旅斋同赋
939037,中秋雨作中夜月明余方叔留寓斋宿酒阑随水纵步方叔有诗用韵同赋
991752,八月二十七日梦与宋侍读同赋泛伊水诗觉而录之
979364,东坡公以种松法授都梁杜子师并为作诗子师求余同赋 其三
440142,鹧鸪天  仲秋客蓉城偕诸侣小集啃轩先生十二梅花吟馆同赋
810836,曹升六谢千仞携酒过饮宋牧仲张杞园亦至同赋长句
466985,西湖与诸诗友同赋送春诗二首
1052092,君时与董君佐以乡荐相次登甲科有诗送之邀予同赋
289859,水龙吟·息厂观庞郎季云演明妃故事，约同赋
864202,同赋梅花十二题 其二 清晨
306435,庭前海棠初开姜斋同赋
1123705,卢谊伯宜之见过要斯远同赋以赠二首
670516,除夕魏使君携长君及黄山人见过同赋
742165,续前题与宋奕岩同赋 其一
611077,夏日米君梦吴翁晋载酒过斋头席上同赋二首 其一
1223676,忆三十年前与元复初参政同赋秋日梨花元有句云朝食叶底梨暮看枝上花而忘其后句因续之云
447566,西湖与诸诗友同赋送春诗二首 其二
377893,同赋·一霎催花骤雨来
1007131,江城与秋岩同赋
1070611,叔问作崇兰馆图画叔问去非与余相从林壑间二公各题二绝句余同赋四首 其二
246281,鹧鸪天·仲秋客蓉城偕诸侣小集啃轩先生十二梅花吟馆同赋
241913,儗过钱塘约诸客同赋
742166,续前题与宋奕岩同赋 其二
543968,易惟效署中避暑同赋四首 其四
183000,同赋李梦符酒斗
1004257,碧云程道士自清江相过示以玉渊刘清叔诗借韵同赋
449307,水龙吟  咏荷与佟老同赋
793589,周凉武、克力两公招饮承恩堂同赋
897714,自巴河至蕲阳口道中得二诗示仲达与秬同赋 其一
666854,乙卯二月二日从川举吟社邀予同赋
668410,月夜葛氏墓饮酒与子重履仁同赋二首 其一
873305,李伯时画十古图郑尚明作诗诗辞多振绝因为同赋 武帝问日磾
1095366,李燕公生华亭尉厅旧有相公阁可斋洪少府于废址更为梦燕堂用玉燕入怀事永嘉赵清旷索同赋
985038,时升咏雪效前人体尽禁比类颜色等字率予同赋用其韵
636433,岛门秋雨与诸子同赋 其二
375242,卢蒲江雪夜约同直省中出示采菊读书煎茶种橘四诗索危秘书诸名胜同赋
273659,探春慢·寓楼对雪，颇动羁愁。季刚次韵先成此解，邀余同赋
902087,与陈去非夏致宏孙信道游南涧同赋四首 其三
843229,庭前海棠初开姜斋同赋
102154,夏日过庄严寺寺僧索诗为留三绝拉舍弟同赋
307984,佳人醉·曾记北风同赋
1075416,道卿论吴中夏果词颇夸且借苏内相春菜诗韵作诗仆亦同赋聊为江南解嘲
611083,雨夕陈仪翔年丈过小斋话旧同赋十首 其五
873304,李伯时画十古图郑尚明作诗诗辞多振绝因为同赋 明皇览镜妃子剪鬟
666050,李中丞邀游南高峰与棠陵子同赋
517032,归自云间道经淀山湖与竹庄同赋
1231843,送姚子章赴浙省计事玉山同赋
1087771,丁丑冬在温陵陪敦宗李丈与一二道人同和东坡惠州梅花诗皆一再往反昨日见梅追省前事忽忽五年旧诗不复可记忆再和一篇呈诸友兄一笑同赋
779775,虞美人 佛手柑，后十数词皆与容若同赋，其余唱和甚多，存者寥寥，言之堕泪
336522,元素再邀同赋
258140,子文致君九日用安字韵聊亦同赋
691994,与魏使君宿龙洞山寺同赋
288643,拜星月慢·秋霁卧疴，彦通拈此调属同赋
