1008073,辰十月八日同希周扫松灵石晚步松下怆然有怀以数诗示儿侄辈邀希周同赋时阿同在新城他日当寄之 其三
116443,自巴河至蕲阳口道中得二诗示仲达与秬同赋
972309,卢谊伯宜之见过要斯远同赋以赠二首 其一
1058181,文湖州作山水横轴吴希全家藏其子诚伯求苏养直赋诗语特奇妙遂用其韵同赋
449309,隔浦莲近拍  重午与朱师佟老同赋
1016214,兴化存公作竹林新亭雪庵雪林二老同赋次韵 其二
597491,秋夜山楼对月与黎惟敬梁思伯诸君同赋
920393,广陵会三同舍，各以其字为韵，仍邀同赋 其一 刘贡父
689595,陈山甫遨集杨姬华林馆同赋四首
136746,问月台苏竹庄同赋
939039,方叔再用前韵约同赋
1034482,李微之闻其弟贯之西归以诗迓之刘左史和韵属余同赋 其四
1146119,送刘散员同赋得陈思王诗山树郁苍苍
437692,闰八月十八日会同馆诸公同赋绝句五首 其三
951770,范宰见寄游草堂谁谓渔盐市之什辄同赋一篇不用元白唱酬之法
545435,同王水部蔡祠部袁仪部集高比部正父邸中同赋兼送正父南还
1234256,晋公子奔狄图邀端父御史同赋
1016213,兴化存公作竹林新亭雪庵雪林二老同赋次韵 其一
864197,同赋梅花十二题 其一 半开
163989,同赋·星弁荧煌鼎足三
618262,初冬李小湾姜箴胜罗萸江三宗伯姚孟长宫庶王季重国子集马园同赋得江字
533816,周廷直茅平仲见过出新酝酌之同赋
531535,毛园萃芳亭与沈中白丘月渚同赋 其三
1128027,工侍国史李丈奉御香祷雪上竺前一夕雪瑞已应道间志喜成诗以示敬借韵同赋
591926,李实夫太守将还泉南集别黎惟敬宅沈管二山人同赋得豪字
521146,沂州谷生尝从张友山学能诗善医工画梅家有园亭之胜比自京师还同馆陈君德卿作云山别意诗以赠邀予同赋
541337,奉陪中丞滕公学宪郭公登白鹤峰同赋
1169535,同赋山居七夕
594583,王元方邀游宝界山登太白峰望太湖顾仲长王彦贻同赋青字
400093,锁窗寒 雁来红与叶遐庵、黎六禾、詹安泰、黄咏雩、冯秋雪、胡伯孝、陈寂园、张纫诗同赋
1250802,余至汧阳辱彦博明府孟昭赞府相留连日有郊行之乐同赋近诗八韵为别
610477,除夕携演春乐部过张伯起幼于昆仲园亭把玩腊梅残菊席上同赋三首 其三
331010,中春之初与诸友游黎氏园荆华赠予桃花一枝归置瓶中连日不凋因成两绝示同行且令同赋
463929,贺新郎癸巳孟冬，诸师友访三星堆，启宇先生拈此调，相约同赋，用张元干韵
298615,粤东诗与陈简亭同赋
939794,沈道院有水墨壁画奇笔也惜其穷年无赏之者贾明叔请余同赋
521514,程德望祠部于书室前凿池作亭秋望落成而正之内翰适至因名其亭曰登月室曰聚奎要予同赋 其二
895344,左举善人物高妙才具敏特要当为世用而乃携孥抚孤以不二价从事丹壶中其胸次讵可窥耶一日出示诸公篇轴邀老夫同赋义不可辞
1078438,冬至前六日奉陪舅氏燕集于张甥东斋泰孙侍坐舅甥四世同会岂易得也舅氏以诗见贶谨次韵成两章拜呈并简季弟二甥同赋 其一
1239720,无题回文七言绝句四首与友人同赋 其一
542353,冯郡丞汝言入计暂还海口吴郎中峻伯沈参军子刚出饯同赋得山字
996122,伯父祖善耆老好学于所居紫阳溪后小马鞍山为放隐斋远寄诗句意欲庭坚和之幸师友同赋率尔上呈
635857,除夕前一日杨式公舟次大通阻风信宿同赋
1095932,卢蒲江雪夜约同直省中出示采菊读书煎茶种橘四诗索危秘书诸名胜同赋 其二
96767,卢谊伯宜之见过要斯远同赋以赠
470022,陈山甫遨集杨姬华林馆同赋四首 其二
183497,与蒙城知县陈著作同赋吐绶鸟
972453,次韵刘先生送行并令诸友及子侄同赋
470021,陈山甫遨集杨姬华林馆同赋四首 其一
901633,与陈去非夏致宏孙信道游南涧同赋四首 其一
333102,采桑子·香雪约在小港探梅同赋
1008072,辰十月八日同希周扫松灵石晚步松下怆然有怀以数诗示儿侄辈邀希周同赋时阿同在新城他日当寄之 其七
55138,二月三日泊瓜州渡与吴庵同赋
636402,寓双照庵除夕与笑溪师同赋
735609,九日同晋江黄俞邰会稽罗宏载牂牁江辰六黄山江梦得黑窑厂登高归饮梦得寓斋同赋
1213696,李陵台约应奉冯昂霄同赋
605060,又与塾师福唐林用吁同赋
1003822,邑令招讲上元故事与簿尉同赋二首 其二
842771,听水第二斋落成幼点嘿园同赋 其三
327734,香烟与兰谷同赋
612205,彭贞元移酌书画船与陈永平同赋
1050562,雨中南楼望西方僧舍要元舆同赋
1062796,昔官会稽故侍讲吕公原明丈请以其孙揆中者娶余之长女既受币矣无何揆中与余女未成婚而俱卒济阴簿本中则揆中之弟也近于同舍林德祖处见其所与石子植唱和诗子植又余太学之旧僚也故次其韵因寄吕兼以简石且请德祖同赋
629563,侍大人载酒偕缜之伯美周兄过子建先生竹素山房暨长公天驹夜集同赋
920394,广陵会三同舍，各以其字为韵，仍邀同赋 其二 孙巨源
987068,东风第一枝 其二 壬戍立春日访梅溪，雨中同赋
610476,除夕携演春乐部过张伯起幼于昆仲园亭把玩腊梅残菊席上同赋三首 其二
683077,月夜葛氏墓饮酒与子重履仁同赋二首
69668,承枢札致祭羊公太傅庙有作率舜章同赋
819197,海棠盛开与稚辛似斋二弟同赋四首 其一
11031,九日与敬处士左学士同赋采菊上东山便为首句
194360,山行与伯弓同赋野庙
486075,青楼曲刘子雍胡伯清程伯羽同赋 其一
1239721,无题回文七言绝句四首与友人同赋 其二
1112495,席大光邀同赋墨梅花
1168928,喷玉泉冥会诗八首 其三 四丈夫同赋
843860,点绛唇 雨中见流萤，岚君、怡女同赋
1070610,叔问作崇兰馆图画叔问去非与余相从林壑间二公各题二绝句余同赋四首 其一
512449,中秋赏月与浦汝正诸君同赋
904192,次韵德基效欧阳体作雪诗禁体物之字兼送表臣才臣友直勉诸郎力学之乐仍率同赋 其二
191111,林正甫举似所和双丫岩诗且索同赋
1000243,寒食安厚卿具酒馔邀数君子游压沙寺观梨花独苏子由不至诗来命座客同赋予既次韵和之明日上巳安复置酒招予与苏又明日清明予屈二君为射饮之会而苏君仍用前韵作诗见及予亦复和
975784,江梅水仙同赋
971569,雨中夜归闻两儿诵书偶成二绝幸明叔先生同赋以示之 其二
304415,春尽后又二十日见海棠一株妍媚绝世约治芗同赋
1138802,八月初游君山谊斋有诗同赋二首 其一
864195,同赋梅花十二题 其七 水边
881904,中秋前一日诸生携酒见过对月同赋
603031,初秋承黄伯安召李英饮偕苏黄诸文士即席同赋先字韵
531766,避暑矩洲书院与欧阳宪副汪少参黎伦二道长王主政同赋得矩字
489754,柳塘轩听雨与谢子兰同赋
437694,闰八月十八日会同馆诸公同赋绝句五首 其五
988918,蔡提举野望亭邀同赋
50356,毛园萃芳亭与沈中白丘月渚同赋
329664,范才元参议求酒于延平使君邀予同赋谨次其韵
544575,诘朝雪不解再柬永叔黄门二十四韵并邀同赋
173894,时升咏雪效前人体尽禁比类颜色等字率予同赋
502391,惜别词端孝思同赋 其一
1113702,次韵德基效欧阳体作雪诗禁体物之字兼送表臣才臣友直勉诸郎力学之乐仍率同赋
447340,赤甲楼与伟明启宇两兄同赋
594287,秋日雨中同方允治集范介儒书斋同赋霞伦二字 其一
557643,同赋清平阁饮宋山人二首 其一
850470,同赋虎帧
867460,恋绣衾 其二 席上梦锡、汉章同赋
436086,岁己酉春正月十有一日吾友张君汉臣下世家贫不能葬乡邻办丧事诸君皆有吊章且邀余同赋每一忖思辄神情错乱秉笔复罢今忽四旬矣欲绝不言无以表其哀因作古意四篇虽比兴之不足观者足知予志之所在则进知吾汉臣也无疑 其二
923325,与丘程凌林四君同赋食河豚
892273,同赋饮舫
819200,海棠盛开与稚辛似斋二弟同赋四首 其四
1248495,立春吴黄二友皆有作率尔同赋
1075289,元素再邀同赋
427713,绿盖舞风轻 己卯七夕前一日，海上词流集李公祠看荷花，拈此曲同赋，依草窗韵
737009,间行与文震青编修同赋
1094282,叶侍郎寄乌石茶昌甫诗谢之次韵同赋
848170,夏日过庄严寺寺僧索诗为留三绝拉舍弟同赋 其一
248000,踏莎行·戊子新正与金水邵林小聚引之遥约同赋
686936,惜别词端孝思同赋
899641,壶中天/念奴娇 夜渡古黄河，与沈尧道、曾子敬同赋
1238593,钱塘怀古率堵无傲同赋
1010682,赵白云宗丞以诗送惠柳下谒浙西宪使包宏斋命余同赋
612016,张孟奇乘五石瓠来观龙潭竞渡宴集同赋
58414,肖甫送至天雄故城因观宋大观五礼碑同赋
1026422,宝奎殿前花树子去年与宋中道同赋今复答宋诗
923072,判秘阁何龙图赴职宴集诸公同赋诗以纪出入之盛
858627,与微之同赋梅花得香字三首 其三
183877,判秘阁何龙图赴职宴集诸公同赋诗以纪出入之
1166433,送李侍郎迥秀薛长史季昶同赋得水字
182910,蜡梅二绝黄鲁直云王都尉有之邀同赋
948136,三月三日适值清明会客江楼共观并蒂魏紫偶成二小诗约坐客同赋 其二
12228,过坚上人故院与李端同赋
347987,雨中南楼望西方僧舍要元舆同赋
864317,同赋梅花十二题 其五 雪后
222515,方叔再用前韵约同赋
766752,贺新郎 其二 席上被酒示程村同赋
611080,雨夕陈仪翔年丈过小斋话旧同赋十首 其二
824757,雨淋铃 八月二十三日即事，索无隅师同赋
1068518,同郡李达之贡辟廱偶试不利还乡及河不得济作二诗凄然读之殆难为怀因为次韵极其悲苦卒少纾之当烦刘元忠彭少逸同赋 其一
1034481,李微之闻其弟贯之西归以诗迓之刘左史和韵属余同赋 其五
1114079,冬至前六日奉陪舅氏燕集于张甥东斋泰孙侍坐舅甥四世同会岂易得也舅氏以诗见贶谨次韵成两章拜呈并简季弟二甥同赋
850648,猩猩毛笔与黄鲁直同赋
233610,洗竹简诸公同赋
660659,城南晓行限韵与白岩双溪同赋
354904,君时与董君佐以乡荐相次登甲科有诗送之邀予同赋
689651,同赋清平阁饮宋山人二首
186719,张安国约同赋仇氏
700324,程德望祠部于书室前凿池作亭秋望落成而正之内翰适至因名其亭曰登月室曰聚奎要予同赋 其一
1239722,无题回文七言绝句四首与友人同赋 其三
695725,秋日雨中同方允治集范介儒书斋同赋霞伦二字
1227682,戏效子夜歌体六首与达兼善御史同赋 其一
1095934,卢蒲江雪夜约同直省中出示采菊读书煎茶种橘四诗索危秘书诸名胜同赋 其四
1137295,买陂塘/摸鱼儿 其一 与沈润宇、邓元实同赋
541997,登楼晚眺达轩子同赋
859188,与平甫同赋槐
550059,瓶花影与仲诏同赋 其三
1003513,工侍国史李丈奉御香祷雪上竺前一夕雪瑞已应道间志喜成诗以示敬借韵同赋 其五
636432,岛门秋雨与诸子同赋 其一
687960,游飞水潭与诸子同赋限韵
229234,同赋次韵·年来幽事慰心期
448664,探梅归作顺用遇韵五百字与逸老同赋
455567,光子火箭约永正同赋
1095495,刘改之题王总干虏中怀亲帖拉朴翁与余同赋
938227,诸公和渊明止酒诗因同赋
444471,浣溪沙 戊寅初冬，萍影重过津门，与诸侣小集华夏酒楼，同赋二首 其二
1034483,李微之闻其弟贯之西归以诗迓之刘左史和韵属余同赋 其三
845386,维王府园与王元规承事同赋 其二
615974,九日区启图黎不回见过因忆去年九日亦同兹会时启图遗落将为归计席间同赋
1192999,岁除日奉推事使牒追赴抚州辨对留别崔法曹陆大祝处士上人同赋人字口号
742984,五鼓起赴苏斋作坡公生日适西湖风水洞拓得苏题姓字四楷迹同赋
773188,香烟与兰谷同赋
636078,冬日与铁城诸子游小岭同赋 其二
370981,绮罗香·壬寅春分约徐丈紫山同赋
937870,元方用韵寄若拙弟邀同赋元方将托若拙觅颜渊之五十亩故诗中见意
1137298,柳梢青 哀二歌者，邓元实同赋
1233434,丙子七月十七日同辉公登紫微岩汪生元明许生存仁来会遂宿鹿田寺明日乃由山桥回至芙蓉峰而别追念数十年间并游之士往者已不可作在者又莫之与同两生顾能不惮其勤相从蹑屩行风雨中诚一时清事也第未知后游为何日同游为何人抚事述情成二十韵邀两生同赋奉呈审言子长
53232,东城道中与王守敬张思廉同赋
592849,雪中吴虎臣过同赋
742390,秋杪登清宁道院与漪亭学庵同赋
1249394,游弁山李云山点杜鹃花与玉山同赋
54517,青楼曲刘子雍胡伯清程伯羽同赋
1095292,赵紫芝得羌村图拉余与赵山中同赋
11174,同赋龙沙墅
624100,幻上人何龙友梁羲年挟陈吴诸少过饮澹圃族祖经季叔原禹原涑兄羽仲弟子敬嘉实席上同赋
104284,梦与公度同赋藕华追录之
1033617,泉州紫极宫寿星殿古桧诸葛机宜同赋
128148,蔡提举野望亭邀同赋
1008074,辰十月八日同希周扫松灵石晚步松下怆然有怀以数诗示儿侄辈邀希周同赋时阿同在新城他日当寄之 其五
98204,游宋衡送示登明录诗卷次韵并呈同赋诸公
386999,无题回文七言绝句四首与友人同赋
1055901,次韵晁尧民黄鲁直苏子瞻同赋半粲字韵十往返而不倦者
845013,十二月八日散步上海废城西见古木寒鸦与伯未同赋四首
873265,李伯时画十古图郑尚明作诗诗辞多振绝因为同赋 霍光取玺
1067306,岁将除因诵前贤粲字韵诗慨然有感次其韵请彦光同赋盖予与彦光皆年三十九矣
1104955,蜡梅二绝黄鲁直云王都尉有之邀同赋
220047,张元览追和东坡咏梅要予同赋
861419,郡中游观之地清风楼为第一前此诸公有诗似觉摹写未尽辄成唐律一篇约魏倅同赋不拘和韵可也
903475,凤鹤鹊三题与江社同赋 其三
228189,和徐径坂帛诗韵并约徐立大同赋
905213,适见诸公咏梅之什因用其韵率作者同赋
180721,元方用韵寄若拙弟邀同赋元方将托若拙觅颜渊
1183167,与张补阙王鍊师自徐方清路同舟南下于台头寺留别赵员外裴补阙同赋杂题一首
1094927,梨花蚁蝶图昌甫伯皋约同赋
550057,瓶花影与仲诏同赋 其一
506608,龙攴行与曾侍讲同赋
697021,易惟效署中避暑同赋四首
1003515,工侍国史李丈奉御香祷雪上竺前一夕雪瑞已应道间志喜成诗以示敬借韵同赋 其二
531072,春郊观射戴玉案叶雨湖钱宪副刘民部同赋
842436,十二月八日散步上海废城西见古木寒鸦与伯未同赋四首 其二
199493,江头送赵教即席同赋
972623,吴仲权相别诗云欲少留桃川山中昨日同在伯怀之作诗约在伯同赋以寄并属徐季纯于去非
95141,次韵刘先生送行并令诸友及子侄同赋
11651,喜邢校书远至对雨同赋远晚饭阮返五韵
246426,宴清都·辛巳仲春与淑萍盛元连珠小集京华紫竹院同赋此调
879512,秋池晓步败荷万柄一花挺然可爱伯益赋诗和韵录呈元翰敬叟君明季仙求同赋
985428,大人按部过云安下岩留小诗命同赋
1054361,新作西庵将及春景戏成两诗请李思中节推同赋 其二
670519,与魏使君宿龙洞山寺同赋 其三
316341,醉太平·赠雏伶红牡丹，王瘿叟、孙竹孙同赋
972399,同谢丈签判送赵台州至灵鹫签判丈道中有诗蕃同赋
246485,倦寻芳·千山词聚拈此调与诸侣同赋
