423473,满庭芳·戊戌闰三月望立夏，忆前月是日正清明也。苏庵出视李㤅伯先生霞川花影词手稿，有庚申闰清明作，谓自辛丑闰后再逢今日，枨触旧怀，含悽成咏。今距庚申垂四十载，中间再闰仅己卯一遇耳。鄙人频年濩落，久惯伤春，客里光阴，逾增惆怅。依韵示苏庵，并寄彦云和之
976701,西州旧俗每当立春前后以巢菜作饼互相招邀名曰东坡饼顷在燕尝有诗云西州最重眉山饼冬后春前无别羞今度燕山试收拾中间惟欠一元修元修即巢菜之别号盖豌豆菜也东坡故人巢元修尝致其种于黄冈下因得名元修南方有之燕中无此种余来河间再见立春感旧事用前韵 其三
939162,昌甫前诗见简方和去未达间再于岩叟处见后诗和韵以谢
1006489,卜算子 其二 席间再作
976699,西州旧俗每当立春前后以巢菜作饼互相招邀名曰东坡饼顷在燕尝有诗云西州最重眉山饼冬后春前无别羞今度燕山试收拾中间惟欠一元修元修即巢菜之别号盖豌豆菜也东坡故人巢元修尝致其种于黄冈下因得名元修南方有之燕中无此种余来河间再见立春感旧事用前韵 其一
884462,闰月四日大风出灵鹫捕鱼具鲙且约冬间再集
222513,昌甫前诗见简方和去未达间再於岩叟处见后诗
208676,闰月四日大负出灵鹫捕鱼具鱠且约冬间再集
1124677,西州旧俗每当立春前后以巢菜作饼互相招邀名曰东坡饼顷在燕尝有诗云西州最重眉山饼冬后春前无别羞今度燕山试收拾中间惟欠一元修元修即巢菜之别号盖豌豆菜也东坡故人巢元修尝致其种于黄冈下因得名元修南方有之燕中无此种余来河间再见立春感旧事用前韵
976700,西州旧俗每当立春前后以巢菜作饼互相招邀名曰东坡饼顷在燕尝有诗云西州最重眉山饼冬后春前无别羞今度燕山试收拾中间惟欠一元修元修即巢菜之别号盖豌豆菜也东坡故人巢元修尝致其种于黄冈下因得名元修南方有之燕中无此种余来河间再见立春感旧事用前韵 其二
