559253,吾父崇祀乡贤志喜四首末一道耑谢诸友 其二
1215941,七月十二日奉诏以香酒赐曲阜代祀孔圣庙越五日别翰林诸友 其二
1217971,再用韵答松阳诸友 其二
768959,由淮之泰州留别诸友 其二
620268,贱旦酬诸友 其二
787559,九月四日重至东阳寄杭诸友 其二
1070783,向丞厅旧有小轩榜曰日哦庳隘不爽近彻墙向南植竹数竿改曰分翠与僚友邑之贤彦日游其间且索鄙句因赋二诗呈诸友 其二
530939,留别安宁滇城诸友 其二
1058226,将之苕溪戏作呈诸友 其二
1052497,至雄州寄诸弟并呈诸友 其二
884996,二诗寄德粲并简内观诸友 其二
511265,留别诸友 其二
511496,赠刘进夫还永丰兼寄罗养明杨荣敷罗清极湖西诸友 其二
1233080,追和文山青原诗柬陈村民寄谢禅林诸友 其二
478700,游宝石山有怀旧游诸友 其二
1217824,三用韵荅松学诸友 其二
640399,写兴寄诸友 其二
1092922,简赵十诸友 其二
499379,岁试榜发名缀三等之末赋呈诸友 其二
838366,寄台南诸友 其二
783714,宿永安桥忆郡中诸友 其二
686345,游宝石山有怀旧游诸友 其二
423348,荆园秋感寄怀兵中诸友 其二
613170,奉旨回任途中寄同学诸友 其二
1034330,书所见闻示诸友 其二
1251928,留别白沙诸友 其二
912866,夜离零陵以避同僚追送之劳留二绝简诸友 其二
940924,南园新舟成呈同游诸友 其二
1138777,赋归四绝呈句容诸友 其二
1003800,余为华阳尉三年事制置使榷牧都漕两使者皆以文字辱知不尽责以吏也既满戍拟濛阳丞归亲旁范使者为改注左绵学官疟病再作未即就戍成二诗呈兄长及诸友 其二
1217078,送景初漕史还平江各赋一诗寄吴下诸友 其二
771522,去淮阴留别诸友 其二
640175,访刘外史题诗见山堂兼美同行诸友 其二
541273,访詹咫亭先生巢云书院兼呈社中诸友 其二
904105,清明日席上呈诸友 其二
410225,太原途中八首书感兼寄别晋阳诸友 其二
771796,双溪观石窍泉，晚归灯下作示同游诸友 其二
785590,代柬寄诗五兰谷并问诸友 其二
1095924,忆水芙蓉木芙蓉寄西湖诸友 其二
940545,延平书院落成柬诸友 其二
1083530,四月一日偶成三绝句奉勉诸友 其二
511074,晚酌示藏用诸友 其二
637289,中秋赏月寄京中诸友 其二
