746584,寄羽可
385899,羽可舍人、楚瞻运副同集荫余别墅，即席有赋，次韵酬之
385990,次羽可舍人怡云楼见怀韵
386000,杨春墅明府复调署永丰，羽可舍人诗以寄慰，依韵和之即赠明府
385998,登层山钟秀峰和羽可舍人韵
386579,吉水道中寄羽可舍人
384937,酬羽可舍人归后见寄次韵
385991,过层山访郭羽可舍人活秀园
303118,适吴诗送黄羽可
747818,四月四日叶筠潭黄树斋两鸿胪徐廉峰黄矩卿两太史汪孟慈陈颂南两部曹招同郭羽可中翰潘四农解元共四十二人作江亭展禊之会
384909,羽可舍人寓居小斋旬余，赋此送别
746837,喜郭羽可至京
384168,次郭羽可舍人《同憩龙蟠洲小风月亭遣兴》原韵
746839,二月二十六日招叶筠潭前辈郭羽可艾至堂蒋子潇张亨甫朱晓山小集江亭
734994,旅夜露坐和高羽可
384922,应诏将入京，羽可舍人寄诗赠行，次韵留别
385784,闻羽可舍人自章门回，适久旱大雨，喜而有作
709598,适吴诗送黄羽可
384154,和羽可舍人《紫薇山房话感》次韵
384870,郭羽可中翰
384908,次羽可舍人夏日见怀韵
386014,郭羽可舍人病愈见寄，即次《活秀园即目》韵
