694722,序：丙寅三月十五日余被逮越宿朱德升朱完天邹虚王殷汝劼同卧县署相对谈笑虚王汝劼各出素扇索书遂录壬戌南还留别文起孟长之作嗟乎在今日又增一罪案矣
189692,元佑三年余被召至京师从翰林苏先生过兴国浴
1078356,许崧老赋三友篇以遗东林圭禅师余尝次韵和之未几余被命宣抚荆广崧老复以诗来曾未一岁间闻吴元中薨于柳崧老东归薨于虔余方罢帅事屏居长乐圭禅师自江西见过阅箧中得崧老二诗相与读之怆然因复追和其韵 其二 次群字韵长句
1071967,余往岁与逊叔侍郎同寓广陵靖康元年逊叔守符离余被召过焉未几余守南都逊叔移真定过留数日绍兴二年复同寓临川感念畴昔奉送一首
935755,余为成都帅司参议成将军汉卿为成都路兵钤相从无虚日余被召出蜀汉卿坐法谪居于涪既得自便因卜筑为涪人今年广汉僧祖成来山阴乃言尝至永嘉乐清县柳市之广福寺有黄先生寓寺中炼丹及见则汉卿也余闻之感叹不已为赋此诗
982313,元祐三年余被召至京师从翰林苏先生过兴国浴室院始识汶师后二年复来阅诸公诗因次韵
549973,序：丙寅三月十五日余被逮越宿朱德升朱完天邹虚王殷汝劼同卧县署相对谈笑虚王汝劼各出素扇索书遂录壬戌南还留别文起孟长之作嗟乎在今日又增一罪案矣 其二
1078355,许崧老赋三友篇以遗东林圭禅师余尝次韵和之未几余被命宣抚荆广崧老复以诗来曾未一岁间闻吴元中薨于柳崧老东归薨于虔余方罢帅事屏居长乐圭禅师自江西见过阅箧中得崧老二诗相与读之怆然因复追和其韵 其一 次孙字韵古风
549972,序：丙寅三月十五日余被逮越宿朱德升朱完天邹虚王殷汝劼同卧县署相对谈笑虚王汝劼各出素扇索书遂录壬戌南还留别文起孟长之作嗟乎在今日又增一罪案矣 其一
