695649,二十年前屡过平远一主大柘林仰峰一主东石林玉山二人皆赀雄闾里以好客闻玉山有子三人因兄弟相诘败仰峰有子十一人不嫖不赌又中有青衿而亦以败何也仰峰以一人聚之子以十一人分之费且不节而亦以废箸此耳辛酉应召过而心伤为赋二绝亦以劝为人子者
614657,刘母曹夫人从夫任之滇舟次武昌金口驿群鹬冠袭之语逼母母惧不免投江死令子铨部君疏闻赐棹楔旌焉夫人有子三人伯季皆举孝廉仲即铨部也
559368,二十年前屡过平远一主大柘林仰峰一主东石林玉山二人皆赀雄闾里以好客闻玉山有子三人因兄弟相诘败仰峰有子十一人不嫖不赌又中有青衿而亦以败何也仰峰以一人聚之子以十一人分之费且不节而亦以废箸此耳辛酉应召过而心伤为赋二绝亦以劝为人子者 其二
559367,二十年前屡过平远一主大柘林仰峰一主东石林玉山二人皆赀雄闾里以好客闻玉山有子三人因兄弟相诘败仰峰有子十一人不嫖不赌又中有青衿而亦以败何也仰峰以一人聚之子以十一人分之费且不节而亦以废箸此耳辛酉应召过而心伤为赋二绝亦以劝为人子者 其一
829887,竹香子 癸未海滨修禊图，前余已三次题咏，今又布景添画童子三人于中，尤觉光彩夺目。爰再填小词二阕以赠画师郑君慕康，并博诸老一笑
824175,竹香子 癸未海滨修禊图，前余已三次题咏，今又布景添画童子三人于中，尤觉光彩夺目。爰再填小词二阕以赠画师郑君慕康，并博诸老一笑 其一
