1120785,顷岁盗起徽严间兵既临城部使者而下皆弃官以走别乘强幼安摄郡事解衣高卧而贼不至城遂以全仆尝作送行诗以书其事后二十一年岁癸亥幼安始得州相遇于钱塘幼安犹能诵鄙诗而余漫不复省矣手录见遗读之惘然为题三绝其后
1075610,顷岁盗起徽严间兵既临城部使者而下皆弃官以走别乘强幼安摄郡事解衣高卧而贼不至城遂以全仆尝作送行诗以书其事后二十一年岁癸亥幼安始得州相遇于钱塘幼安犹能诵鄙诗而余漫不复省矣手录见遗读之惘然为题三绝其后 其二
1075611,顷岁盗起徽严间兵既临城部使者而下皆弃官以走别乘强幼安摄郡事解衣高卧而贼不至城遂以全仆尝作送行诗以书其事后二十一年岁癸亥幼安始得州相遇于钱塘幼安犹能诵鄙诗而余漫不复省矣手录见遗读之惘然为题三绝其后 其三
1075609,顷岁盗起徽严间兵既临城部使者而下皆弃官以走别乘强幼安摄郡事解衣高卧而贼不至城遂以全仆尝作送行诗以书其事后二十一年岁癸亥幼安始得州相遇于钱塘幼安犹能诵鄙诗而余漫不复省矣手录见遗读之惘然为题三绝其后 其一
828423,戴文节公遗砚刻梅花一树萦绕四周左侧镌鹿床居士制五字微有损文予以廉价得之铭其背曰质损而神完犹取义而仁全世皆弃而苍虬所专昔文节以书有破体不为宣宗所喜又为穆相彰阿画山水便面未设色穆以为轻己遭谗斥退后居杭州殉粤匪之难予有感于公之遗事为作此诗
336783,顷岁盗起徽严间兵既临城部使者而下皆弃官
