958255,邻翁以黄菊一本见赠是岁冬暖梅已成蕾以四韵戏菊
625508,栗里诗赠姚翁拂尘翁以明经拜州守不之官授经里门二首 其一
1084751,前日探梅李元翁以疾不往和诗有玉华野人多病恼独守寒炉煨芋魁句复用前韵约同赏
491762,夜梦亡兄中翁以家事相语觉而感泣因追赋二诗以寄予衷 其一
415055,麓山翁以春兴四首见寄因步第一首韵奉酬
522111,孙员外性甫奉使过家为其父双泉翁寿翁以建宁推官致仕
702914,栗里诗赠姚翁拂尘翁以明经拜州守不之官授经里门二首
672018,叶翁以丛竹分种因题墨谢之
976965,因放翁以剑南诗稿为赠咏叹之馀赋短歌以谢
320963,宋震翁以诗见推次韵为谢
958424,邻翁以紫石斛承粗石一块为予书室之奉斛盖端溪之不堪为砚者然较以所载山石则胜矣予是以有白鹿苍璧之句白鹿苍璧事见西汉书若乃忘真假遗美恶则予不知此石之与真山果同异哉
849160,和陆象翁以梅配竹
191469,学录李诗翁以诗访予于乳溪之上且求县学积俸
743120,沛翁以樽酒见惠赋谢
452082,仰翁以耄耋之龄相陪自宜春至丰城再到南昌始还途中更以诗见赠感愧之馀赋此作答
314918,木兰花慢·闻海绡翁以端午后一日在广州下世，倚此抒哀
1243670,题李克明翁媪起家图二首（一翁以指就醋瓮内取醯吮之尝其味之美恶一媪持星火吹灯备诸穷态） 其二
1243669,题李克明翁媪起家图二首（一翁以指就醋瓮内取醯吮之尝其味之美恶一媪持星火吹灯备诸穷态） 其一
686954,夜梦亡兄中翁以家事相语觉而感泣因追赋二诗以寄予衷
250216,戊子腊初仰翁以诗见寄步韵奉答
380956,木兰花慢·己酉闰春，园梅盛开，时彊村翁以特徵不起
566685,湖严氏有二女其翁以长者许渭继室渭自愆盟顷闻为海寇断其翁臂二女俱被执旋复放还便巳作宛转词怜之后知其长女被执时即自奋堕桥死幼女放还亦死因复赋此宛转词中覆水句正悔愆盟也
545131,冬日同喻水部赵观察赵徐章叶郭郑六孝廉赵唐童范四文学游灵洞山房十首 其四 夜投紫霞洞童范二文学携具小酌　洞突出山腰高明宏敞羽流宅焉宋隐士于介翁以古诗有轻举乘紫霞之句故名即其诗所云洞门相对是吾家者也
250401,仰翁以耄耋之龄相陪自宜春至丰城再到南昌始还途中更以诗见赠感愧之馀赋此作答
111008,因放翁以剑南诗稿为赠
575213,兰畹尤翁以苏巾为贶奉谢
491763,夜梦亡兄中翁以家事相语觉而感泣因追赋二诗以寄予衷 其二
771947,祉亭大姻翁以诗见贺，回叠原韵答谢
140065,端平三年春三月戊午朔天子有招俾臣了翁以佥
449663,碧牡丹 披云诗翁以雪庐诗稿见寄，抗战诗史也
415559,张旭初诗翁以七律见赠赋此奉答
83786,城南上原陈翁以卖花为业得钱悉供酒资又不能
625509,栗里诗赠姚翁拂尘翁以明经拜州守不之官授经里门二首 其二
1142595,宋震翁以诗见推次韵为谢
404072,浣溪沙二首·丁巳新正，瞿禅翁以《瞿髯词》见赠，短阕奉报
387143,思佳客·曾孙百朝，爽翁以词见贶，次韵奉酬
1243622,题李克明翁媪起家图（一翁以指就醋瓮取醯吮之尝其味之美恶一媪持星火吹灯备诸穷态）
1124924,庚寅正月十六携家入山大雪弥旬止既月叔祖东绿翁以那知风雨夜复此对床眠分韵瑞得那眠字
1141932,龚岩翁以焦墨作乱山甚奇为题六言
419481,木兰花慢 闻海绡翁以端午后一日在广州下世，倚此抒哀
761039,木兰花慢 己酉闰春，园梅盛开，时彊村翁以特徵不起，高卧空斋，因置酒招之，极意吟赏，有林下相从之乐，赋以见志。
1252288,题李克明翁媪起家图二首（一翁以指就醋瓮内取醯吮之尝其味之美恶一媪持星火吹灯备诸穷态）
1035132,端平三年春三月戊午朔天子有诏俾臣了翁以佥书枢密院奏事既上还山之请乃休沐日丁丑与宾佐谒濂溪先生祠宾主凡二十有二谓是不可无纪也遂以明道先生云淡风轻之诗分韵而赋而诗有二言有四言同一韵者则二客赋之了翁得云字
978274,庚寅正月十六携家入山大雪弥旬止既月叔祖东绿翁以那知风雨夜复此对床眠分韵瑞得那眠字 其一
182081,邻翁以黄菊一本见赠是岁冬暖梅已成蕾以四韵
452169,戊子腊初仰翁以诗见寄步韵奉答
418683,木兰花慢　　一九四〇年 陈含光先生画白石胡马窥江词意自扬州寄贻，欲奉一词为报，乍成半阕，而廖忏庵翁以郭频伽、奚铁生湖上饯春图嘱题，因得成章
514029,贡士佐时生子弥月予适至焉初予以诗寿新安千户于翁八十翁以锦帕为谢因以遗儿用为远寿之徵
205207,和陆象翁以梅配竹
706596,崇祯癸未贼购捕峻亟先母舅玉卿谭翁以死誓脱某兄弟于虎吻谢世以来仰怀悲哽者三十馀年翁孙以扇索敏侄书字缀为哀吟代书苦不能请先兄俯和益以老泪淫淫承睫不止
553787,适閒翁以松蕈风销见饷以诗戏呈
521674,己巳待泮潞渚单氏两翁以乡里来会长者八十二少者七十三皆朴茂淳古类山谷中人溯其生当宣德正统间得气之方厚者也为之感叹适有以画竹惠者因书其上赠之正月二十日
978273,庚寅正月十六携家入山大雪弥旬止既月叔祖东绿翁以那知风雨夜复此对床眠分韵瑞得那眠字 其二
936214,城南上原陈翁以卖花为业得钱悉供酒资又不能独饮逢人辄强与共醉辛亥九月十二日偶过其门访之败屋一间妻子饥寒而此翁已大醉矣殆隐者也为赋一诗
1028962,学录李诗翁以诗访予于乳溪之上且求县学积俸偶值窘匮恨不能满其意漫以数语送之第饥来不堪煮耳
182079,邻翁以紫石斛承粗山一块为予书室这奉斛盖端
135268,江耐翁以最首座十玄谈见示
305933,麓山翁以春兴四首见寄因步第一首韵奉酬
1027133,汪耐翁以最首座十玄谈见示
833497,思佳客 曾孙百朝，爽翁以词见贶，次韵奉酬
