644655,应教恭赋静妙轩
726603,奉和望山应教诗
1145579,暮秋望月示学士各释愁应教
725965,和晋安王薄晚逐凉北楼回望应教诗
881,奉和梁王宴龙泓应教得微字
702277,送王幼度待制致仕归大梁应教
582432,送侄应教之嵩明省亲
389735,独秀山侍宴应教
488731,春日鲁阳王别业应教
318455,蝶恋花·流梦应教山海接
3048,敕借岐王九成宫避暑应教
726839,赋得梅林轻雨应教诗
62773,春日侍宴高唐齐东二王即韵应教
35085,陪郑王相公赋筵前垂冰应教依韵
736842,冬初同谢皆人韩钦甫侍慎郡王贯台应教
710725,独秀山侍宴应教
726837,赋得风生翠竹里应教诗
101632,奉和晚日杨子江应教诗
37100,赏牡丹应教
725565,拟古应教
1151745,从岐王过杨氏别业应教
1144795,梅夏应教诗
725984,咏胡床应教诗
41491,岁穷应教诗
1145610,奉和通衢建灯应教诗
602860,爽台诗应教
486636,上巳侍王驾登五龙山应教
472354,赏雪侍宴应教
1190201,乐府新歌应教
507715,合欢牡丹三首应教作 其三
691388,合欢牡丹三首应教作
725321,拟吴均体应教诗
725389,别萧咨议前夜以醉乖例今昼由酲敬应教诗
433666,卅二年春，长次二子，求学毕节弘毅中学，余应教导主任南汇谈宗录之邀，兼课图画。三月廿七日，该校师生旅行灵峰寺，余因公未往。翌日星期，萧校长吉人宴于校，席示文书清拔贡周老先生介仙留痕旅行偶成二绝，即晚忆韵草和，继知第二首未循原韵，再成一首，并录存之
475962,春日侍宴高唐齐东二王即韵应教
61108,秋日倍文谷翠岩二省使燕东书堂应教
725996,咏主人少姬应教诗
689519,新秋建安王半隐园应教二首
1145611,赋得微雨东来应教诗
1250126,应教题梅卷六所记当作「制」。】
472312,秋夜鹅池侍宴应教
724761,历山草堂应教
52585,新秋建安王半隐园应教
62633,勉学书院侍父王应教
1144784,岁穷应教诗
67627,上巳侍王驾登五龙山应教
486631,勉学书院侍父王应教
2916,从岐王夜宴卫家山池应教
1146235,初晴应教
1151839,敕借岐王九成宫避暑应教
622147,荆王锡宴兼索诗篇应教启谢
1164427,奉和梁王宴龙泓应教得微字
557403,纪南乐应教
1237734,应教题梅
425642,卅二年春，长次二子，求学毕节弘毅中学，余应教导主任南汇谈宗录之邀，兼课图画。三月廿七日，该校师生旅行灵峰寺，余因公未往。翌日星期，萧校长吉人宴于校，席示文书清拔贡周老先生介仙留痕旅行偶成二绝，即晚忆韵草和，继知第二首未循原韵，再成一首，并录存之 其一
726601,奉和初秋西园应教诗
2915,从岐王过杨氏别业应教
507714,合欢牡丹三首应教作 其二
425644,卅二年春，长次二子，求学毕节弘毅中学，余应教导主任南汇谈宗录之邀，兼课图画。三月廿七日，该校师生旅行灵峰寺，余因公未往。翌日星期，萧校长吉人宴于校，席示文书清拔贡周老先生介仙留痕旅行偶成二绝，即晚忆韵草和，继知第二首未循原韵，再成一首，并录存之 其三
1151746,从岐王夜宴卫家山池应教
69118,应教题梅
553328,送王幼度待制致仕归大梁应教 其二
55560,赏雪侍宴应教
652297,秋日倍文谷翠岩二省使燕东书堂应教
571480,观瑞兰应教之作
1196028,陪郑王相公赋檐前垂冰应教依韵
769100,雨霖铃·秋夜梧桐雨和徐太学今吾今吾示《雨霖铃》《新雁过妆楼》二调索和云是二十年前恒亲王邸中应教之作曾命女伶按拍歌之极谐梁邺风流至今可思因倚声和之水痕清浅犹作鸟爪伎俩所谓见猎心喜者耶
726354,咏冰应教诗
425643,卅二年春，长次二子，求学毕节弘毅中学，余应教导主任南汇谈宗录之邀，兼课图画。三月廿七日，该校师生旅行灵峰寺，余因公未往。翌日星期，萧校长吉人宴于校，席示文书清拔贡周老先生介仙留痕旅行偶成二绝，即晚忆韵草和，继知第二首未循原韵，再成一首，并录存之 其二
1145570,奉和晚日杨子江应教诗
725942,奉和泛舟汉水往万山应教诗
726834,初春赋得池应教诗
725612,应教使君春游诗
726602,奉和冬至应教诗
469913,新秋建安王半隐园应教二首 其一
724901,奉辞镇西应教诗
725439,济黄河应教诗
507713,合欢牡丹三首应教作 其一
726596,奉和济黄河应教诗
257807,诗人的住所对应教堂的尖顶
1145608,奉和方山灵岩寺应教诗
55521,秋夜鹅池侍宴应教
553327,送王幼度待制致仕归大梁应教 其一
469914,新秋建安王半隐园应教二首 其二
1147526,赏牡丹应教
41489,梅夏应教诗
378,初晴应教
