752704,山夜病齿答中实送别之作兼呈伯严仲林
323677,次韵道胜冬日惜别之作
635344,和西宁明府李雪樵见寄留别之作
660126,次馆宾何天雨留别之作
837114,步大兄原韵留别之作二首 其二
385971,和马厚庵都转《乞病还山留别之作》次韵
1049093,又借前韵为攀别之作
11032,奉天酬别郑谏议云逵卢拾遗景亮见别之作
1152696,酬柳郎中春日归扬州南郭见别之作
1193232,奉天酬别郑谏议云逵卢拾遗景亮见别之作
301041,步大兄原韵留别之作
609312,和孔阳王孙舟中听琵琶赠别之作
819107,寄酬秋樵赠别之作
958663,次韵陈秀才告别之作
1187175,途中酬李少府赠别之作
818468,蒿翁游白下三宿返沪次和共留别之作
381132,寄酬秋樵赠别之作
623505,答王仿九送别之作
59015,次韵文量留别之作时文量有俵马之役
440769,荅咏馨梦中赠别之作适予将移居雪山山脚
749828,和赵菁衫九日留别之作
340738,次韵和王张赠别之作
611281,酬区启图赠别之作
5818,酬柳郎中春日归扬州南郭见别之作
980260,依韵和钟离秀才留别之作
281343,答兄子铨送别之作
1173626,王阆州筵奉酬十一舅惜别之作
844588,步大兄原韵留别之作二首
301034,依韵和弼卿夫子留别之作
488606,酬许希旦郑兆采陈尧勋方子韩四子赠别之作
464158,惜分飞 和闵次垣闺人送别之作，步原韵
527031,次韵酬安南国王饯别之作
469662,赋得鹫峰寺前残柳答吴非熊林茂之留别之作
837934,酬蕉麓赠别之作
246191,惜分飞·和闵次垣闺人送别之作
840137,辛酉腊月，依韵和啸园赠别之作
491987,十一月二十八日晚予与赵伯友登舟将归既夜舟未开忽将军送诗至舟次则刘侯惜别之作因与伯友奉和一章以答其意
729768,八归  答沈子培刑部赠别之作
883726,次韵李子功留别之作
264023,八归·答沈子培刑部赠别之作
251058,荅咏馨梦中赠别之作适予将移居雪山山脚
211283,次韵陈秀才告别之作
423545,寿楼春·补和娟镜主人长辛店送别之作
480423,次韵文量留别之作时文量有俵马之役三首 其二
681435,和舜咨留别之作
597447,舟次胥江怅然有恍别之作
534802,答张主政镗赠别之作
677821,答陈沧洲留别之作
480422,次韵文量留别之作时文量有俵马之役三首 其一
1159903,詶马大夫以愚献通草茇葜酒感通拔二字因而寄别之作
831554,答兄子铨送别之作
1182900,李张皇甫阎权等数公并有送别之作见寄因答
533728,答张参知留别之作
480424,次韵文量留别之作时文量有俵马之役三首 其三
9737,李张惶甫阎权等数公并有送别之作见寄因答
44319,蒿翁游白下三宿返沪次和共留别之作
946219,答朱翔远见别之作
837113,步大兄原韵留别之作二首 其一
14962,酬马大夫以愚献通草茇葜酒感通拔二字因而寄别之作
712682,送何左王入罗浮兼答留别之作
1088396,谢张彦辅留别之作
837101,依韵和弼卿夫子留别之作(1)
268490,寿楼春·补和娟镜主人长辛店送别之作
6997,途中酬李少府赠别之作
1060644,次韵和王张赠别之作
149289,依韵和锺离季才留别之作
488627,酬立朝叔秋日赠别之作
693812,次韵文量留别之作时文量有俵马之役三首
1068578,次韵道胜冬日惜别之作
736410,安溪夫子示留别之作辄赋鄙言呈诲
752720,琴志楼雨中酬伯严大兄送别之作
343473,又借前韵为攀别之作
8387,王阆州筵奉酬十一舅惜别之作
191607,答朱翔远见别之作
286794,辛酉腊月，依韵和啸园赠别之作
301283,留别之作·双泪难支落绮筵
