542568,冬夜同宣允则集徐进士子与宅
550022,冬夜同王季木介孺泛舟
541966,初冬夜同李伯承过碧云寺
54078,初冬夜同郝公琰龚散木闲谈
66755,冬夜同陈康候秦京集
739734,冬夜同寿门坐南香草堂闻雁
550008,冬夜同岳尔律泛湖限断字
600574,冬夜同戴宫允邀徐殿读陈翰编过饮分韵
593934,冬夜同李比部黎司勋黄李二进士集金舍人宅和得比部二韵 其一
830346,冬夜同行陀看月邻霄台寄怀嘿园日本
695719,冬夜同李比部黎司勋黄李二进士集金舍人宅和得比部二韵
583539,冬夜同田曹长月下对菊各赋一首
804880,冬夜同程祖芬舟行过吴门
262509,高阳忆旧游·冬夜同沈大匡严颢亭顾且庵邵戒三严柱峰诸君饮关六钤草堂即席
622007,冬夜同曹允大方肃之姚永言徐九一陈尔新宋则甫过从李大生夜集得关字
594681,冬夜同陈大参郑冼二别驾陈明府陈都护集陈少参明佐西第
305161,冬夜同行陀看月邻霄台寄怀嘿园日本
550474,冬夜同汝翔振狂在杭集汝大山斋
542323,冬夜同徐比部子与吴舍人明可听张肖甫鼓琴得声字
58424,冬夜同张元易过顾叔潜得红字
474354,冬夜同张元易过顾叔潜得红字
610169,冬夜同余承采张闰生罗幼良无极诸子集张约之斋中得一先韵
538416,冬夜同莫膳部张户曹蔡衡州谢山人过吴比部分韵得重字
471631,初冬夜同郝公琰龚散木閒谈
593935,冬夜同李比部黎司勋黄李二进士集金舍人宅和得比部二韵 其二
712340,冬夜同川南王使君舟泊樵溪骤雨有雷
592115,冬夜同梁彦国宿永光寺禅房怀故园诸子得来字
474121,冬夜同陈康候秦京集毕康侯楼共用寒字
767964,高阳忆旧游   冬夜同沈大匡严颢亭顾且庵邵戒三严柱峰诸君饮关六钤草堂即席
