403689,百字令 石帚思惠示哀瑮之作，情辞凄断，殆不能卒读。时方有灌口之行，倚装率和一首，欲以广吾师之意，不复自慨朋友交谊
457858,此梦得于予少年十八九时。予共一老农犁田，俄而有女子挎篮至，其衣甚粗，其貌甚常，盖为老农之女抑或孙女，携饭馔耕者也。食既毕，与女并坐一长条椅上，予倦极，乃倚其肩小憩，竟尔入睡。中心温暖怅惘，殆不能词达。苟世果有幸福一事，予将并此世界、古今，一切弃之，而举梦中此一刻也。倚枕思之，条椅予自车站所见，父女二人，则平生未尝见，即梦中亦不相识。予盖行客，偶尔路过，略一助老农耳。苟能梦至睡起，必拽行囊而长去者。
520329,予读天宝遗事每叹玉环之丑久秽青史明皇昏惑逆竖酿祸马嵬之变无足悼笑兹经故址驻马徘徊殆不能去因以诗纪之
1073865,绍兴壬子某南迁过疏山上一览亭见拟东坡煨芋诗刻龛之壁间诗律句法良是殆不能辨乃宣卿侍郎守临川时所拟作也后数日道次安仁县一士人吴君出宣卿诗数十解示余奇丽清婉咀嚼有味如啖蔗然读之惟恐尽于是拊卷三叹而后知公置力于斯文久矣又二十年宣卿筑室荆溪山中别营一堂以平生所蓄东坡诗文杂言长短句残章断槁尺牍游戏之作尽椟藏其中号景坡自书榜仍为记刻之某欲具小舟造观而宣卿召用今以集撰守吴门乃赋诗为之先
80691,连日扶病领客殆不能支枕上怀故山偶成
932314,连日扶病领客殆不能支枕上怀故山偶成
