440313,乙未七月十八日
679191,七月十八日重过何氏山林与张守约仝赋
335084,次韵何子应七月十八日书事
80443,七月十八夜枕上作
948251,次韵天官韩尚书七月十八日风雨中观潮予内直不赴 其一
1225270,七月十八日出郊外抵昭潭沿道观虫食松叶尽枯感而赋
965911,七月十八日与诸人集真于燕誉堂
825406,七月十八夜舍饭寺
870339,成都遨乐诗二十一首 其十九 七月十八日太慈寺观施盂兰盆
381675,七月十八夜舍饭寺
182695,七月十八日与诸人集真于燕誉堂
1075057,七月十八日夜独坐静寄月出麻姑背开户徜徉夜久不寐
247523,乙未七月十八日
1071585,次韵何子应七月十八日书事二首 其一
121987,七月十八日浓雾作雨不成
837592,惜红衣·七月十八日中宵不寐，蛩声到枕，露气满帘，肃然其为秋矣。感身世之沈沦，悲人生之憔悴，悄然有作。用白石韵
1199374,诗二十五首 其二 七月十八日夕云林右英夫人授诗
834794,百字令 乙未七月十八感赋，是日亡妇五十生日也
271775,惜红衣·七月十八日中宵不寐，蛩声到枕，露气满帘，肃然其为秋矣
153941,七月十八日太慈寺观施
956813,七月十八日浓雾作雨不成
948250,次韵天官韩尚书七月十八日风雨中观潮予内直不赴 其二
356868,百字令·乙未七月十八感赋，是日亡妇五十生日也
930383,七月十八夜枕上作
1116170,次韵何子应七月十八日书事二首
1120355,次韵天官韩尚书七月十八日风雨中观潮予内直不赴
1071586,次韵何子应七月十八日书事二首 其二
152204,次韵天官韩尚书七月十八日风雨中观潮予内直
