710903,余友韩耳叔文恪公之仲子死于难托生刘两成为子刘亦余友也托生之前梦耳叔入室遂产及能言刘有姑戏之曰汝为谁顿有悟曰我父为官我兄为和尚余为人刃今五年不复记忆余喜续三生之缘诗寄两成令示之
562348,赤城吕徽之博闻强识宋亡遂晦不仕一日大雪中至巨家易谷立堂下久之堂东偏众客方咏雪有分韵得蝶字者艾思不就徽之不觉失笑咸诘之曰汝何笑曰吾欲用滕王蛱蝶事耳众客皆惊阴知其为徽之也延之坐不可欲赒以谷辞既去使人尾之至其居地极幽阻及雪霁候焉荆扉竹屋不蔽风雨见桶中坐一妇人盖其妻也问徽之所在曰出捕鱼矣得于溪上具言所以来之意曰诸子可少留乃换酒共饮返宿道傍大楼下主人怪舆马之盛因言其状主人亦不知有徽之也明日求之则已迁居矣徽之
566972,丁卯六月十六日五鼓梦一宪公更讯予狱予颇恳乞且历数古人事宪公乃取片纸手画一白犬从雪中猎作题且曰汝赋得十韵即止予赋得十二句而宪公逡巡起予亦觉半忘矣今续成之
928252,十月二十八日夜鸡初鸣时梦与数女仙遇其一作诗示予颇哀怨如人间语惟末句稍异予戏之曰若无此句不可为神仙矣其一从傍戒曰汝当勿忘此规作诗者甚有愧色予颇悔之既觉赋两绝句以解嘲 其一
928253,十月二十八日夜鸡初鸣时梦与数女仙遇其一作诗示予颇哀怨如人间语惟末句稍异予戏之曰若无此句不可为神仙矣其一从傍戒曰汝当勿忘此规作诗者甚有愧色予颇悔之既觉赋两绝句以解嘲 其二
1118385,十月二十八日夜鸡初鸣时梦与数女仙遇其一作诗示予颇哀怨如人间语惟末句稍异予戏之曰若无此句不可为神仙矣其一从傍戒曰汝当勿忘此规作诗者甚有愧色予颇悔之既觉赋两绝句以解嘲
42087,已亥杂诗·天意若曰汝毋北
