495553,虏庭以余倡义既久，屡复名城，遂逮及族属；旦开告密之门，波及亲朋，搒掠备至，闻之泫然
1159462,西州李尚书知愚与元武昌有旧远示二篇吟之泫然因以继和二首 其二
1159461,西州李尚书知愚与元武昌有旧远示二篇吟之泫然因以继和二首 其一
264519,辟疆书然弟病中语览之泫然
532895,哀莆中王子世廉侠士也悯闽嵪之乱作为此歌予读之泫然亦同作焉
409321,江宁王生访余山中，容状劬瘁，问旧时郡幕诸友，皆已物故，为之泫然
826237,点绛唇·高斋杜鹃甲香海，今春盛发，不减曩时。幽居未由存临赏，且知主人因有所避，已都攀折，闻之泫然，赋此志慨
820138,辟疆书然弟病中语览之泫然
1230355,至顺初上尝御奎章阁太禧使明理董阿中书左丞赵世安大司农卿哈剌八儿侍上从容询求江南之士臣九思以韩性张翥应诏上曰俟修皇朝经世大典毕卿至江南刊梓时可亲为朕召此二人者来试之馆阁臣九思再拜曰幸甚后有近臣自南使还者上问此二人其人亦曰佳士上颇悦后竟因循遂隔今举事玉山思之泫然流涕玉山请诗以纪因为四十字以寄二子云
1159639,乐天示过敦诗旧宅有感一篇吟之泫然追想昔事因成继和以寄苦怀
306201,江宁王生访余山中，容状劬瘁，问旧时郡幕诸友，皆已物故，为之泫然
1194064,西州李尚书知愚与元武昌有旧远示二篇吟之泫然因以继和二首
