1016216,再答吴仲登三绝 其二
591471,招彦国仲登二子入社得欢字
1016402,再答吴仲登三绝 其一
1016258,答吴知府仲登见招三绝 其一
362898,偕嵇秋云昆仲登九龙山
593613,送梁仲登赴天台文学
614913,次日又同虹仲登黄楼
591296,雪夜同梁仲登泛舟赤花海过水栅十里乃还二首 其一
198819,酬王正仲登岳麓寺阁见寄
591952,岁晏旅中寄故园诸子十二首 其十二 梁仲登
1016257,答吴知府仲登见招三绝 其三
591490,冬日海神庙同梁仲登晚眺
591568,同陈潜甫叶伯埙吴叔颐罗见参吴伯纶罗曜文梁仲登夜集吴氏池亭时余将北上得秋字
591393,伏日雨中梁彦国山馆同陈潜甫梁仲登集得蒸字
856287,次韵陈勉仲登群山观
142034,次韵陈勉仲登群山观
229266,再答吴仲登三绝
1047898,喜子胜仲登第
695836,春夜山房听雨怀潜父彦国士鹄仲登四子二首
229223,答吴知府仲登见招三绝
533305,冬日梅华堂开社招君肃寅仲公补少仲仲登公绍开先诸子
591300,春晚雨中寄梁仲登
591734,春夜山房听雨怀潜父彦国士鹄仲登四子二首 其二
1016259,答吴知府仲登见招三绝 其二
596153,初夏同黄益作从叔干周舍弟肇恩儿豫集梁仲登别馆得稠字
146975,市舶提举管仲登饮于万贡堂有诗
618990,夏日社集梁仲登诃林别业得幽字
597563,山馆燕集忆梁彦国仲登二山人作此招之 其二
597562,山馆燕集忆梁彦国仲登二山人作此招之 其一
1129432,再答吴仲登三绝
700925,山馆燕集忆梁彦国仲登二山人作此招之
1002846,酬王正仲登岳麓寺阁见寄
591733,春夜山房听雨怀潜父彦国士鹄仲登四子二首 其一
596159,暮春同邓君肃陈垣卿黄幼章陈士鹄梁仲登集黎惟仁山楼
1033950,市舶提举管仲登饮于万贡堂有诗
591297,雪夜同梁仲登泛舟赤花海过水栅十里乃还二首 其二
591312,九日同梁仲登黄贤甫登刘王郊台
1129431,答吴知府仲登见招三绝
1016215,再答吴仲登三绝 其三
533020,招梁彦国仲登二子
597478,寄梁仲登兼订游山之约
591514,秋雨怀仲登贤甫
591349,答梁仲登旅馆雨后见怀
920064,虞美人 次虞仲登韵
695662,雪夜同梁仲登泛舟赤花海过水栅十里乃还二首
544779,同茅平仲登甘露寺绝顶作
594620,葛阳舟中逢梁仲登闻已擢守均州喜而有赠
