462181,西湖咏春四首 其三
462182,西湖咏春四首 其四
758662,满江红 西湖咏古十首 其二 表忠观钱武肃王
983531,和范石湖咏双莲三首 其一
253283,西湖咏春·乍暖小楼锁好梦
758669,满江红 西湖咏古十首 其九 南屏济癫
467404,西湖咏春四首
983529,和范石湖咏双莲三首 其三
1125534,和范石湖咏双莲三首
758663,满江红 西湖咏古十首 其三 栖霞岭岳武穆王
758666,满江红 西湖咏古十首 其六 苏公堤苏东坡
580992,小西湖咏竹
758667,满江红 西湖咏古十首 其七 孤山林和靖
462180,西湖咏春四首 其二
462179,西湖咏春四首 其一
253279,西湖咏春·一年好景为春延
983530,和范石湖咏双莲三首 其二
758661,满江红 西湖咏古十首 其一 凤凰山宋高宗
758665,满江红 西湖咏古十首 其五 白公堤白香山
758670,满江红 西湖咏古十首 其十 西泠苏小
253280,西湖咏春·静静楼台隐树丛
758664,满江红 西湖咏古十首 其四 翠微亭韩祈王
253281,西湖咏春·半壁青山曲水通
758668,满江红 西湖咏古十首 其八 葛岭葛稚川
