802326,溯涓水抵花石投逆旅观主人女所制搓爆竹机女年十八九慧甚上年为堰水车献之土豪灌田良便豪欲娶为子妇女不可受所值酬直为此机其法先用二板中横铁丝十馀枚取滑藤及糯粥煮纸为糜以油傅铁丝上取如糜者乘热倾二板閒急搓之凡十数次搓纸捲铁丝上如软竹置石灰中养之一炊许坚如铁石矣复有二板上板密排多刃下板密排多槽槽与刃相受相距皆以寸取所搓者数百枚拔去铁丝置此切之皆寸断为短筒又有二板下板有多孔深八九分圆径与短筒等孔底铺黄泥如粉细
543461,西山绝顶纵目诵供奉呼吸通帝座及拾遗焉能辩皇州二语临风咽桑落十数觥沈醉憩大磐石上昏黑乃下
181201,湖州歌·十数年来国事乖
980439,三川言十数年前尝有一短帽骑驴之士半醉徘徊原上久之曰三川非昔时比矣恍惚失其人所在有收杜老醉游图者物色之知为杜之再来也予独鄙之作诗二首 其二
155998,丞廨之后正瞰城城上有古木十数株盛夏五六月
906945,予往来秦熙汧陇间不啻十数年时闻下里之歌远近相继和高下掩抑所谓其声呜呜也皆含思宛转而有馀意其辞甚陋因其调写道路所闻见犹昔人竹枝纥罗之曲以补秦之乐府云 其九
906948,予往来秦熙汧陇间不啻十数年时闻下里之歌远近相继和高下掩抑所谓其声呜呜也皆含思宛转而有馀意其辞甚陋因其调写道路所闻见犹昔人竹枝纥罗之曲以补秦之乐府云 其七
513709,入东平山中古坟以百十数残碑断磉多有年月可识
906947,予往来秦熙汧陇间不啻十数年时闻下里之歌远近相继和高下掩抑所谓其声呜呜也皆含思宛转而有馀意其辞甚陋因其调写道路所闻见犹昔人竹枝纥罗之曲以补秦之乐府云 其十
370605,送客·荣宦重来十数年
422974,庐山杂诗十四首 其九 庐山瀑布以十数，飞流渟渊各有其胜。余辈攀跻所至，辄解衣游泳其间，至足乐也
513804,严州东下两山高崖瀑布以百十数
872330,丁亥冬大雪十数作邓清旷以苦寒吟见寄
954923,东平府文庙规模颇壮其中亦有儒生十数然无一可语者
824908,傅苕生茂才归自扬州饷菊十数盆
217032,丁亥冬大雪十数作邓清旷以苦寒吟见寄
546698,狄明叔新居河上所幸美人十数辈筑台榭以馆之余过戏赠此绝
853839,蟹至十数日而价比异时特贵贫者只得忍口薄暮有以为饷者作诗回饷
972313,去德清十数里阻冰舟行甚艰
151935,题竹轩·种竹才添十数竿
897323,慎思兄别墅在长沙白鹤山晋陶淡旧居事见本传今其居有大杉可十数围蕃茂特异世传淡藏丹其中用前韵谨赋
277474,庐山瀑布以十数，飞流渟渊各有其胜。余辈攀跻所至，辄解衣游泳其间，至足乐也
515774,帕一方为汪廷器母陈孺人八帙之贺物虽甚薄然其中有福寿字共三十数祝望之意则有在也
906946,予往来秦熙汧陇间不啻十数年时闻下里之歌远近相继和高下掩抑所谓其声呜呜也皆含思宛转而有馀意其辞甚陋因其调写道路所闻见犹昔人竹枝纥罗之曲以补秦之乐府云 其一
966891,潘豳老出十数诗皆有怀苏儋州者因赋二首 其一
1114379,予往来秦熙汧陇间不啻十数年时闻下里之歌远近相继和高下掩抑所谓其声呜呜也皆含思宛转而有馀意其辞甚陋因其调写道路所闻见犹昔人竹枝纥罗之曲以补秦之乐府云
97770,去德清十数里阻冰舟行甚艰
757111,居北江旧庐在坐顾通政孟徐两侍御龙喜社主黄农部宾主九人越十数日农部集同志祖道竟日谈宴赋谢录别
966892,潘豳老出十数诗皆有怀苏儋州者因赋二首 其二
216580,丹霞洞·山西十数里
1034793,某曩在遂宁尝赋木犀云茂树幽花兀老苍不随众卉入词场虎头点点开金粟犀首累累佩印章明月上时疑白傅清风度处看黄香人才生世元如此不为无人不肯芳今十数年矣偶忆前作未免儿戏用韵再赋呈诸友
164993,普通山距府东十数里青州禅师洪果道场也自龙
386479,赠隐者·一别曾经十数年
629166,友人黄逢永尝言晚下清溪遥望西崖诸峰如青纱帐中十数美人探头窥客予酷爱其语壬戌冬溯漓江而西适与此景会为赋是诗
906949,予往来秦熙汧陇间不啻十数年时闻下里之歌远近相继和高下掩抑所谓其声呜呜也皆含思宛转而有馀意其辞甚陋因其调写道路所闻见犹昔人竹枝纥罗之曲以补秦之乐府云 其八
371356,挽章·坚坐山头十数年
906942,予往来秦熙汧陇间不啻十数年时闻下里之歌远近相继和高下掩抑所谓其声呜呜也皆含思宛转而有馀意其辞甚陋因其调写道路所闻见犹昔人竹枝纥罗之曲以补秦之乐府云 其三
770650,前年庭角种桃树谓山桃也花后青子累累儿童日撼树弹鸟雀尽今岁牵牛藤罥其梢时底馀十数熟甚美露坐摘尝因赋
130310,蟹至十数日而异时特贵贫者只得忍口薄暮有以
280080,游庙桥·市舍寥寥十数家
241989,东平府文庙规模颇壮其中亦有儒生十数然无一
854988,仆罢官东归过杭州寓六游堂而楼阁倚空江山在目仆甚乐之无畏老师自武康送客至此过仆于此堂之上留饭终日顷仆作武康令居县之东堂每与师饭于堂上数称东堂饭美每食辄兼人别十数年饭犹健也然师于世故泊然了无芥蒂独于东堂故人若不能忘情者亦复可怪戏作诗一首其末并道所怀
1067373,余赋野香亭前木犀花二小诗盛称此花之妙而江迪彝赋梅花诗以反之往返唱和十数篇二花优劣未决故复长韵示之
445901,乙未孟冬应徐谷青先生之邀与海内吟俦十数子同访衢州开化根宫佛国文化园行前成此
1123143,潘豳老出十数诗皆有怀苏儋州者因赋二首
177920,春居杂兴·闲写新诗十数篇
441155,姚郁庵光孝寺见赠嵌吾泰舆地胜迹名十数因援例奉和
59915,拟古宫词·空有华堂十数重
381418,傅苕生茂才归自扬州饷菊十数盆
906950,予往来秦熙汧陇间不啻十数年时闻下里之歌远近相继和高下掩抑所谓其声呜呜也皆含思宛转而有馀意其辞甚陋因其调写道路所闻见犹昔人竹枝纥罗之曲以补秦之乐府云 其六
46322,中试后自题·十数年笔舞墨歌
906944,予往来秦熙汧陇间不啻十数年时闻下里之歌远近相继和高下掩抑所谓其声呜呜也皆含思宛转而有馀意其辞甚陋因其调写道路所闻见犹昔人竹枝纥罗之曲以补秦之乐府云 其四
740761,县诸生十数辈送余至蔚州之暖泉村越旦暖泉人复为余设饯堡门外迟回久之而别
1038211,余前此二纪保釐西郊与判台李少师及洛社诸君游龙门饮伊上有渔者献鳜鱼十数尾因作羹鲙坐客有思鲈之兴余后守魏累请休致久而未遂曾为忆鳜诗寄洛下诸贤今年秋累与诸君饮于东田池上苇间鲙鱼炊香稻以佐酒浩然有江湖之趣因作是诗并录忆鳜诗如左
1225181,五泄东源有地度可十数亩后负山前则石河如带幽夐深窈盖隐居学道者可筑室偶赋一诗属陈彦正
980440,三川言十数年前尝有一短帽骑驴之士半醉徘徊原上久之曰三川非昔时比矣恍惚失其人所在有收杜老醉游图者物色之知为杜之再来也予独鄙之作诗二首 其一
153283,潘豳老出十数诗皆有怀苏儋州者因赋
1125222,三川言十数年前尝有一短帽骑驴之士半醉徘徊原上久之曰三川非昔时比矣恍惚失其人所在有收杜老醉游图者物色之知为杜之再来也予独鄙之作诗二首
779775,虞美人 佛手柑，后十数词皆与容若同赋，其余唱和甚多，存者寥寥，言之堕泪
149883,三川言十数年前尝有一短帽骑驴之士半醉徘徊
359214,看山亭·雨洗烟笼十数峰
906943,予往来秦熙汧陇间不啻十数年时闻下里之歌远近相继和高下掩抑所谓其声呜呜也皆含思宛转而有馀意其辞甚陋因其调写道路所闻见犹昔人竹枝纥罗之曲以补秦之乐府云 其二
198077,予往来秦熙汧陇间不啻十数年时闻下里之歌远
132650,三和·作者向来十数
998589,丞廨之后正瞰城城上有古木十数株盛夏五六月清风徐来萧然有山林之趣尝诵陈后山城荒可当山之句欲作亭对之榜曰当山而三岁之间十捧差檄三摄剧邑猝猝未能也今且去矣乃留诗壁间庶几后之君子会有成吾之志者
886667,普通山距府东十数里青州禅师洪果道场也自龙华归过之栋宇颓落僧徒鄙野良为可惜是夜雨大作因书所闻所见为长韵
826496,汉宫春·吾家海山仙馆在半塘荔子湾，为南汉昌华苑故址。从伯祖德舆公别业也。水榭风廊，迤迟十数里。中有碧璜，乃仿西湖三潭印月，辟七塘而成者。余足迹遍吴越，曾瞻内苑昆明湖，所称名园未之能及。今人事沧桑，时移景易，维舟凭眺，只余百顷荒塘，荷花送晚耳。夏鸣之、田石友所绘二图犹在友人家。时假披览，尚可指其一二胜概。辛未消夏，偶怀故乡，为拈此调
906717,予往来秦熙汧陇间不啻十数年时闻下里之歌远近相继和高下掩抑所谓其声呜呜也皆含思宛转而有馀意其辞甚陋因其调写道路所闻见犹昔人竹枝纥罗之曲以补秦之乐府云 其五
