557654,再游濮上饮李理卿第感今怀昔因而有赠
1125035,都下追感往昔因成二首
353289,题浯溪图·山川自昔因人胜
959392,顷年尝与董伯孙数子猎兔抵马栏今日重来解鞍佛舍见高仪之题云跃马飞鹘至此追念畴昔因纪一绝兼呈仪之
352936,谒曹娥祠·昔因淑节叹男儿
979023,都下追感往昔因成二首 其一
237807,往昔因成·春风踏月过章华
483495,华山西北夹路皆荷花望不知其顷之为几大石小石错杂乎中边询之途人有老者云此地本山址昔因崩而下陷故水聚荷生
1156324,览卢子蒙侍御旧诗多与微之唱和感今伤昔因赠子蒙题于卷后
191526,挽诗·畴昔因难弟
143036,都下追感往昔因成
32318,赠边将·昔因征远向金微
903919,长庚绍兴十九年七月十九日尝游阳华后十有二年复以是月是日从乡曲诸公再到岩下感今追昔因成十韵
979022,都下追感往昔因成二首 其二
492372,过沙村闻思庵因记往年孙理问奉参政全公檄命驻兵山中招徕东南之负固者时余客军中留刘君方东所常从孙侯游庵中溪山不殊风尘方张怀念今昔因赋诗柬刘并识余志
1208607,端午日雨霁暂出齐化门回入城遥面京西诸山及市肆风景追忆延祐六年六月廿有二日侍诚夫尚书兄初自江南还都亦经此路仍值雨晴今十有五年矣感念畴昔因赋此诗
