1068959,绍兴已未七月六日被旨祷雨风水洞七日清晨诣祠下是晚大雨通夕留宿慈严寺中八日始还城
334054,封氏野老留饮看白兔是晚微雪
668746,是晚过行春桥玩月再赋
1246861,九月十日命次儿文凤携琴谒张仲贤知县是晚宿澄塘兰若同吴德渊文凤联句以叙阳关别意云
385303,是晚过行春桥玩月再赋
1068069,封氏野老留饮看白兔是晚微雪
622379,偶见郭六脩侍御怜古诗八绝句步韵漫成其二 其四 春尽以诘旦渡江是晚风雷骤发
568353,予入晋以四月二日宿权店三日过南关抵盘陀八月东巡还亦以二日抵权店是晚遂宿南关三月午饷盘陀岂有定数耶
902130,行建溪上是晚同宿小桥感怀书事
1247030,孤也不天十有二年矣我先君读书号该博凡平生辛苦而得之者仅见于文辞仕又最晚而位不大显海内器赏不过大参王公继学侍御张公梦臣数人而已呜呼痛哉其忍言诸日者辱养吾先生为题文集五首并序铭一通读之再四涕泪迸落诗语俊逸序约而不遗铭丰而不剩古之作者正如此且典雅奇奥次第刻石墓上以贻不朽其长篇尤浏亮铿锵自成机轴是晚疮作傲兀枕上命次儿鹤奴随读随和遽尔成章鄙俚腐熟纵力焉而不逮也幸有以教之
351725,绍兴已未七月六日被旨祷雨风水洞七日清晨诣祠下是晚大雨通夕留宿慈严寺中八日始还城
178276,行建溪上是晚同宿小桥感怀书事
