451817,贺新郎 友人以感事长调见示元韵答之
821391,昭君怨 前年在南京，友人以女子某氏词笺属和。夹置乱帙中，偶检得之，惘然继韵
1138699,江阴有桃源图方圆尺许宫室人物如针粟可数相传有仙宿民家刻桶板为之一夕而成明日遁去友人以本遗余戏题二绝 其一
806859,清平乐 友人以哭女诗见示作此以代写哀
1158010,友人以人参见惠因以诗谢之
273873,昭君怨·前年在南京，友人以女子某氏词笺属和
1032898,友人以修鍊游方或传其以此死者为赋是诗
1138698,江阴有桃源图方圆尺许宫室人物如针粟可数相传有仙宿民家刻桶板为之一夕而成明日遁去友人以本遗余戏题二绝 其二
490259,友人以西湖灵隐寺旧韵索和
887545,声声慢 其二 友人以梅、兰、瑞香、水仙供客，曰四香，分韵得风字
566102,荅友人以黄甲鱼见馈一首
1101749,余种竹方成扁其室曰竹所友人以诗至用其韵
190728,余种竹方成扁其室日竹所友人以诗至用其韵
183610,余种竹方成扁其室曰竹所友人以诗至用其韵
1144408,江阴有桃源图方圆尺许宫室人物如针粟可数相传有仙宿民家刻桶板为之一夕而成明日遁去友人以本遗余戏题二绝
977889,余种竹方成扁其室曰竹所友人以诗至用其韵
27973,友人以人参见惠因以诗谢之
598027,久辞典修郡乘乃辱友人以诗趣行因次韵答之
