825216,陶斋尚属属题陶公亭雪夜评碑图
837496,锁阳台·陶斋昔赴欧西考察政治，购埃及古刻甚夥。余得其造像拓本，或云五千年前女王也。袒胸被发，冠如鸟形，手执镜制，甚异。无题识，徵同社赋之
295622,陶斋尚书五十生日
825388,陶斋得汉雒阳木平方竹杖端因削箭笴制杖自题以诗又使余赋之
271890,和陶斋督部喜雨之作
830369,题陶斋雪夜评碑图图后有天发神谶拓本
842873,同石遗郁庭藜观宰平游沟沟岩中途阻雨宿白鸰墩归来庵陶斋所营也
825275,题陶斋所藏瘗鹤命水拓本
825389,陶斋属题无闷园雅集图
306263,题陶斋雪夜评碑图图后有天发神谶拓本
842780,金陵晤陶斋赋赠
825279,陶斋属题欧人水画册子
1050262,和陈掾效陶斋
842852,陶斋招为柬坡生日节庵新至信宿即归陶斋有诗索和
842852,陶斋招为柬坡生日节庵新至信宿即归陶斋有诗索和
277041,九月七日与劳玉初刘仲鲁访灵光寺旧址寄陶斋
819745,和陶斋督部喜雨之作
287240,锁阳台·陶斋昔赴欧西考察政治，购埃及古刻甚夥
381249,陶斋属题欧人水画册子
752029,题陶斋所藏秦权
828225,题陶斋毛公鼎拓本为杨诵清作
827954,陶斋尚书作东坡生日宴集同人节庵师会张文襄公之葬亦来京师
842788,题陶斋宝华盦图
306262,金陵晤陶斋赋赠
835491,琵琶仙 孔东塘所藏韩滉小忽雷叶东卿拓本，今在陶斋，乙巳上元日感题名。）
