1078000,南渡次琼管江山风物与海北不殊民居皆在槟榔木间黎人出市交易蛮衣椎髻语音兜离不可晓也因询万安相去犹五百里僻陋尤甚黄茅中草屋二百馀家资生之具一切无有道由生黎峒山往往剽劫行者必自文昌县泛海得便风三日可达艰难至此不胜慨然赋诗二首纪土风志怀抱也 其二
1046012,道祖访赵太宾旧居惜其荒毁慨然赋诗有怀贤念往之深意次韵
329726,道祖访赵太宾旧居惜其荒毁慨然赋诗有怀贤念往之深意次韵
950485,渭南道中逢二蜀兵出印本手诏司马温公范文正公赠太师外祖丞相赠太保悲喜交集慨然赋诗
1114171,南渡次琼管江山风物与海北不殊民居皆在槟榔木间黎人出市交易蛮衣椎髻语音兜离不可晓也因询万安相去犹五百里僻陋尤甚黄茅中草屋二百馀家资生之具一切无有道由生黎峒山往往剽劫行者必自文昌县泛海得便风三日可达艰难至此不胜慨然赋诗二首纪土风志怀抱也
933243,癸丑重九登山亭追怀顷在兴元常以是日猎中梁山下乐甚慨然赋诗予于是生六十有九年矣
1077999,南渡次琼管江山风物与海北不殊民居皆在槟榔木间黎人出市交易蛮衣椎髻语音兜离不可晓也因询万安相去犹五百里僻陋尤甚黄茅中草屋二百馀家资生之具一切无有道由生黎峒山往往剽劫行者必自文昌县泛海得便风三日可达艰难至此不胜慨然赋诗二首纪土风志怀抱也 其一
