269667,潼关用崆峒原韵吊孙司马
955482,依韵和安陆孙司谏见寄
132601,送孙司户秩满东归考试鄂渚
1093980,送孙司户
695461,怀孙司徒九峰
689335,挽孙司理
659683,怀孙司徒九峰 其二
737025,潼关用崆峒原韵吊孙司马
659682,怀孙司徒九峰 其一
220677,依韵和安陆孙司谏见寄
859932,再和陈侍郎子知丞寄桂香酒新到又令孙司户出柑为劝
53133,雪酒为孙司徒赋奉次涯翁先生
105611,孙司谏知邓州
372034,送孙司户·再世论交意已亲
978831,十月晦日同一属官刘司户师教授孙司理游九顶山登万景楼分韵赋诗得游字韵
228646,和孙司门寄宽堂诗
229820,寄澶州孙司理
1115040,和孙司门寄宽堂诗
133219,重九以棘糕饷孙司户
575143,寄题孙司徒寿砚堂
199812,十月晦日同一属官刘司户师教授孙司理游九顶
514005,节庵倪先生以经学教于乡既成其子进贤举进士为御史又出其馀以淑乡之人其在德兴孙司马之塾最久予过婺源望先生之庐尚远不能往拜漫成一律奉寄
975435,送孙司户秩满东归考试鄂渚二首 其一
1156275,春听琵琶兼简长孙司户
203933,再和陈侍郎子知丞寄桂香新到令孙司户出柑为
18200,春听琵琶兼简长孙司户
570938,余以秋月履任有闽人孙司狱者廉慈着狴犴间不久迁广东幕僚憔悴不自得濒行搏颡乞言悯之为赋二绝句 其一
534988,和孙司成戏简张黄门使汴不果
488001,挽孙司理 其一
472110,同阎开府浮檀鹿职方乾岳沈职方彦威杜武库培亭孙司厅初阳袁山石自如刘关内如纶万广宁同予洎三大将军马沧渊王敬之尤定宇出宁远眺首山诸雄要马上用程幕韵
1080729,观孙司户画壁
975736,次韵孙司户黄堂观醮遇雪
488002,挽孙司理 其二
570939,余以秋月履任有闽人孙司狱者廉慈着狴犴间不久迁广东幕僚憔悴不自得濒行搏颡乞言悯之为赋二绝句 其二
683932,余以秋月履任有闽人孙司狱者廉慈着狴犴间不久迁广东幕僚憔悴不自得濒行搏颡乞言悯之为赋二绝句
573900,次孙司勋种松
1124386,送孙司户秩满东归考试鄂渚二首
679448,送孙司训之任良乡学谕
974887,重九以枣糕饷孙司户
911554,和孙司门寄宽堂诗 其一
964594,寄澶州孙司理
479544,雪酒为孙司徒赋奉次涯翁先生
911553,和孙司门寄宽堂诗 其二
537718,题林布政墓志后为其孙司训请
975434,送孙司户秩满东归考试鄂渚二首 其二
133102,次韵孙司户黄堂观醮遇雪
991997,孙司谏知邓州
