1224404,送凌吉叟之杭州教授
207080,王简卿侍郎以诗赠王孟同王成叟之侄也辄亦继
1168504,送方士赵叟之东平
939047,节后赴傅岩叟之招望日同游栖隐庵华严寺呈岩叟及同游者
980287,顷客解梁有诗云中条山下读周易定是前身关子明是时频与张芸叟侍郎通书亦尝寄此诗呈视今再过此郡遇芸叟之客王六东起感怀而作
227247,送曹深叟之越
868697,王简卿侍郎以诗赠王孟同王成叟之侄也辄亦继作
800815,送陆蓬叟之井陉
5168,送方士赵叟之东平
1118995,徐天锡归自玉山昌甫以三诗送之后二篇有及予与徐子融傅岩叟之意且托其转寄答其意以谢之
222625,节后赴传岩叟之招望日同游棲隐庵华严寺吴岩
939179,徐天锡归自玉山昌甫以三诗送之后二篇有及予与徐子融傅岩叟之意且托其转寄答其意以谢之 其二
89090,溪庵放言·蒙叟之言卓诡
749709,高碧湄同年春间谒选入都取道阊门流连旬日盛称铜柈吴叟之为人心向往之道远莫致乃不浃月而余已与吴叟见于金陵碧湄邮书坚余引退之约亦适由济南递至赋此答之并呈铜柈即用湘乡相侯赠吴叟诗原韵
939180,徐天锡归自玉山昌甫以三诗送之后二篇有及予与徐子融傅岩叟之意且托其转寄答其意以谢之 其一
969152,送曹深叟之越
