117307,送曹子方赴福建运判
104523,送施司封福建提刑
583214,次贺志同侍御感怀韵时志同巡按福建闻京师大水抗疏请建储裁内侍时多忌之
1239681,赠陈宪史之福建
404665,玲珑四犯·甲子之秋，福建省文联、工艺美术学会等将在榕举行寿山石诗会，惠书征稿，谨依姜白石玲珑四犯调，倚声一阕，笺寄致贺
649180,赠吴布政归福建
661094,送潘寺正鉴任福建佥事
1250004,寄萨天锡时居福建宪幕
552802,送吴侍御福建分台
1149132,送公度之福建
1206780,八声甘州 饯帅阃张仲渊外郎先福建帅府出海捕寇服功
207615,故福建提刑钟编修挽章
844994,别幼涛后伴书福建并示陈生荔亭二首
1031401,崇德夜泊寄福建提刑章屯田思钱塘春月并游
990219,故福建提刑钟编修挽章二首 其二
55255,赠陈宪史之福建
660948,送刘文焕宪副提学福建
214170,送福建张比部
1148136,送李侍御福建从事
675245,赠蔡给事成之福建佥宪
34517,投赠福建路罗中丞
506893,送尹参议之福建
585565,福建长乐柯生乔可尚迁博学士也斋戒三日尽弃其学而请学焉喜而与之诗二首 其一
650625,赠罗继鼎赴福建理问
1027989,分韵送卢国华福建提刑得华字
93915,谢福建提举应仲实送新茶
584845,送段惟勤擢福建宪佥
897171,送曹子方赴福建运判
420409,长相思 石灵，雅安属有木怀，土名邦邦鱼，赭首背足白腹，与福建石灵同种，皆蛙宗也
987335,次魏明己表弟韵送刘长翁赴福建仓
652019,送高佥宪福建提学
903023,送徐衡仲归侍次福建帅属二首 其二
1152438,洪州送西明寺省上人游福建
202979,崇德夜泊寄福建提刑章屯田思钱塘春月并游
25385,送福建李大夫
1194883,投赠福建桂常侍二首
648932,题福建吴布政竹石图
799250,座主初颐园先生视学福建奉别二首 其一
585392,送黄小江之福建宪副 其一
1043507,送曹辅奉议福建转运判官 其一
991393,送施司封福建提刑
659038,延哲使归自福建得衢州锦川石立于庭前戏作
468570,送行人蔡英夫奉旨颁流求国王印宝就与国王之来享者二人同驾海舟自福建起柁
1246366,送黄生涖祀福建
558025,送罗应魁调官福建
581533,次胡大声方伯福建见寄韵
593651,送蔡伯华谪福建盐运判官兼寄张伯邻
838852,和福建西路观察使吴芝青留别原韵 其一
585395,送黄小江之福建宪副 其四
553688,送任大参勉之福建
812884,座主初颐园先生视学福建奉别二首
34578,投赠福建桂常侍
660791,送陆全卿巡按福建
1159797,洛中詶福建陈判官见赠
1025668,送陆务观福建提仓
1243432,荔枝画，为福建佥宪张惟远题四首 其一
843730,和福建西路观察使吴芝青留别原韵
175029,送陆务观福建提苍
493802,盐提举崔君转福建副都转运使赠以诗
297563,洞仙歌·过日里棉兰福建义冢
165902,送曹子方福建转运判官
402626,重游福建寺
218801,归入福建界作
115054,送刘士彦赴福建转运判官
15251,夜燕福建卢侍郎宅因送之镇
658442,寄福建戴方伯
351730,送贺子忱吏部福建漕
254738,七月回福建的列车上
1206896,沁园春 和复初省郎韵纪仲春陪诸名公游西山 同行都省掾元明善复初行省掾尉迟亨亨甫福建同提举毛吉甫
515270,和答福建提学宪副罗明仲旧寅长
1177143,投赠福建桂常侍二首 其二
1171671,送唐侍御福建省兄
364593,送曹辅奉议福建转运判官
838853,和福建西路观察使吴芝青留别原韵 其二
366700,曹秀之待制罢福建还朝刘君玉待制自长沙移邓俱会郡下作七言叙别
559905,送刘副使棻之福建
507041,送高超佥事之福建
997044,送刘士彦赴福建转运判官
915804,谢福建茶使吴德华送东坡新集
1207823,寄福建杜廉访使君
859011,送福建张比部
512373,送牟都宪改福建佥事
297051,和福建西路观察使吴芝青留别原韵
32442,洪州送西明寺省上人游福建
32519,洪州送僧游福建
493795,赠惺庵弟巡抚福建
36763,送清励上人游福建
659099,观福建内臣进花鸟赋
657969,送任地官参议福建
124297,送张司勋福建转运使
585566,福建长乐柯生乔可尚迁博学士也斋戒三日尽弃其学而请学焉喜而与之诗二首 其二
1080117,福建界首寄福州亲旧
328932,福建界首寄福州亲旧
520763,故福建佥宪陈公直道祠五十韵
25821,送唐侍御福建省兄
238610,次魏明已表弟韵送刘长翁赴福建仓
1126367,故福建提刑钟编修挽章二首
1147022,送清励上人游福建
553526,送赵佥事之福建任
648632,送杨参政景衡考绩还福建
1243433,荔枝画，为福建佥宪张惟远题四首 其二
979319,送曹子方福建转运判官
648705,赠杨晟参政还福建
892664,送张司勋福建转运使
782770,自福建接富氏姊来齐河官署
1216224,至正辛丑诏加福建国王为□□□□本省官属以正月初九为王诞日谒庙称贺走叨先行展敬礼道中欣逢仪仗之过马上有作戏呈幕府诸公
1192717,送福建李大夫
270761,座主初颐园先生视学福建奉别
820161,乙丑元日喜伯远至时方新被福建盐运迂道归南昌省亲冒雪见过长歌赠行
295182,别幼涛后伴书福建并示陈生荔亭
1244687,送蔡齐贤参政行省福建
174761,送陆务观福建提仓
247172,重游福建寺
740643,枫岭出福建界
702136,福建长乐柯生乔可尚迁博学士也斋戒三日尽弃其学而请学焉喜而与之诗二首
501245,送三人杰都事开诏福建
650383,赠福建陈学正省亲
938318,渔家傲 福建道中
671986,送刘职方时雍赴福建参政
1225990,送李德夫福建运司书吏
195481,读福建谦廉访辅大使遗事
842093,别幼涛后伴书福建并示陈生荔亭二首 其二
507213,拟福建乡试
1252398,荔枝画，为福建佥宪张惟远题四首 其一
49986,从少保公视师福建抵严宴眺北高峰同茅大夫沈
559842,送人省亲归福建
494228,送谢考功显之任福建少参
842089,送谢幼陶之福建
1223990,寄福建佥宪马叔惠
577995,挽福建钱参政
538095,送范按察尧卿调补福建
553808,送陶给事德温福建阅武
514302,送刘职方时雍赴福建参政巡视海道
595559,福建巡按攒入秋闱试士
501308,送谢弘道福建理问
506977,送吕佥宪之福建
25239,送李侍御福建从事
1159497,夜燕福建卢侍郎宅因送之镇
135378,分韵送卢国华福建提刑得华字
1243435,荔枝画，为福建佥宪张惟远题四首 其四
649197,送周参政赴福建
179288,虑德华郎中将漕福建
578111,送福建祝副使入觐
514543,次韵送沈时旸参议提督福建银课
990220,故福建提刑钟编修挽章二首 其一
1177142,投赠福建桂常侍二首 其一
581531,送方伯胡大声转福建左辖
114619,送曹子方福建路运判兼简运使张仲谋
838855,和福建西路观察使吴芝青留别原韵 其四
799251,座主初颐园先生视学福建奉别二首 其二
1218845,寄湖州乌雅太守时有福建参政之除
585393,送黄小江之福建宪副 其二
836328,洞仙歌 过日里棉兰福建义冢
250647,自杭飞赴福建安溪做湖头赋终评贪吹空调致病
93916,谢福建茶使吴德华送东坡新集
557980,送林一中福建佥宪
514868,送刘述宪赴福建副使督理银课
683145,送黄小江之福建宪副
1243434,荔枝画，为福建佥宪张惟远题四首 其三
17147,送公度之福建
1152289,洪州送僧游福建
522148,保宁何重器尝通守松江以福建盐课提举致仕其子鉴鏊入太学频辱惠音且存问吾乡故旧甚悉感其雅情赋此奉寄
506854,送按察使郭智之福建
1213287,送潘景梁佥事之福建
947525,归入福建界作
1242052,景辰张先生校文福建归林公崇高画闽溪放棹图赋诗其上以饯因次韵就题
585394,送黄小江之福建宪副 其三
838854,和福建西路观察使吴芝青留别原韵 其三
662748,送罗文学赴福建考官
1208615,福建道中
1113425,送徐衡仲归侍次福建帅属二首
979318,送友福建转运判官
842092,别幼涛后伴书福建并示陈生荔亭二首 其一
1068969,送贺子忱吏部福建漕
1042008,曹秀之待制罢福建还朝刘君玉待制自长沙移邓俱会郡下作七言叙别
903024,送徐衡仲归侍次福建帅属二首 其一
471316,从少保公视师福建抵严宴眺北高峰同茅大夫沈嘉则
997072,送曹子方福建路运判兼简运使张仲谋
452305,自杭飞赴福建安溪做湖头赋终评贪吹空调致病
1208594,送李彦方福建宪副
983881,卢德华郎中将漕福建
171545,石渠行送别福建参议李著作器之
653193,正统戊辰闻福建感而有作
494217,送陈太仆谢病还福建
673648,送何廷秀之任福建
1177170,投赠福建路罗中丞
15026,洛中酬福建陈判官见赠
514805,送房骥都阃赴福建
141189,送徐衡仲归侍次福建帅属
951847,石渠行送别福建参议李著作器之
1232877,江西福建怨谣
1202959,酹江月 福建官舍言怀
294744,送谢幼陶之福建
497762,诸公会荐兵部侍郎得迁福建知府留别京朝诸友
506032,送朱大使朝京回迎父往福建任所
1141672,读福建廉访辅大使遗事
385614,送黄小江之福建宪副
581350,送胡提学升福建宪副
580774,送公巡抚福建
553810,送陶给事之福建佥事
650631,送叶汝梅赴福建运判
521360,春试锁院日闻刑部奏举邵郎中天衢任方面众许作诗送行已而得福建按察副使
264479,乙丑元日喜伯远至时方新被福建盐运迂道归南昌省亲冒雪见过长歌赠行
914913,谢福建提举应仲实送新茶
1216186,为福建监宪恩德卿作
1220501,次韵寄福建魏廉使
507014,送钱佥宪之福建
