784049,答汪桂山明府和古樵寄作仍依韵续成六首 其六
383499,梦中得句蝴蝶有情春入梦杜鹃无语夜开花因续成之
741738,梦中得句蝴蝶有情春入梦杜鹃无语夜开花因续成之
605762,乙未落第南还夜泊潞河梦中集唐句及觉止忆记首二句因续成之
709536,续成语四首 其二
721268,续成语四首
400790,鹧鸪天·壬子人日作，越六载戊午冬至前五日续成之
251971,前诵疏影弟游山佳什得惟君性好山颇会登临意之句然久未完篇今届九日勉为续成即以为赠
1039610,又次韵和续成绝句
814799,和毕续成二首
709538,续成语四首 其四
566972,丁卯六月十六日五鼓梦一宪公更讯予狱予颇恳乞且历数古人事宪公乃取片纸手画一白犬从雪中猎作题且曰汝赋得十韵即止予赋得十二句而宪公逡巡起予亦觉半忘矣今续成之
784044,答汪桂山明府和古樵寄作仍依韵续成六首 其一
771867,夏初以来，四境不靖，园中花事就芜。届残腊，始报安堵。爰修小园，招诸韵士雅集，各有佳作。予忝主位，乃强颜续成五排一首
270192,续成·沉沉衰气送深凉
790864,五月初七日梦中得起二句醒起续成之
784048,答汪桂山明府和古樵寄作仍依韵续成六首 其五
282901,鹧鸪天·壬子人日作，越六载戊午冬至前五日续成之
919645,予顷时有一联云太饱伤清气微寒最好诗葛天民极爱之偶再续成
758372,玉楼春 梦中作春情一阕，醒后续成夏秋冬三词
302029,九月晦夜，梦中得“江上梅花影”五字，寤后续成一诗，题陈师曾水墨兰石
784047,答汪桂山明府和古樵寄作仍依韵续成六首 其四
1033370,石屏久游湖海祖妣遂题二句于壁云机番白苧和愁织门掩黄花带恨吟后石屏归祖妣已亡矣续成一律
426327,生平未解诗词。一九三五年春，执教松江。校园中桃花盛开，同事王先生题词索和，迫于无奈，胡乱成章。原作已忘，还记得最后两句，今以此续成一律，徒供一笑耳
790432,家大人为言里中徐某隐于市。仅读学庸，逢人辄询字义。晚年喜为小诗，赏秋日偕众游山，徐后归得句云：人静一山空。饶有意味，因续成一律
790654,幕中淩君子伟，咏春草有“旧梦南朝葬美人”句，喜其新警续成三律 其二
817639,寅正九夜，梦中子贤示予楹帖，“极昭风云允，后至名德高”，十字。书者杜晴。寤而弗遗，续成是篇
268551,眉峰碧·廿三夕续成此解，时闻妇病，将南归
80192,梦宴客大楼上命笔作诗既觉续成之
841571,前咏怀作未尽所言，续成二章 其二
775858,巡道周公有社仓之议言事者虑格于旧例公概然力任其成立赋抚恤歌六章发明天道人心之应淋漓悽恻情见乎词用述其意更为推衍言之续成长歌一篇
634263,甲寅九月杪予从江宁入句曲晤林明府仅人因得接黍谷钱中丞之欢同寓崇明寺畅谈捧腹已成三日夕之乐十月朔二鼓别归邻院而宿夜梦与中丞凭高俯视见有搅绵花者梦中幻境其花蒙茸如海风撼浪予谓中丞曰可共作搅绵花诗何如中丞诺之予遂先成二句曰却似白云生谷口还如泻水置平川及旦林紫君相过因与中丞同早饭王大席陈南浦俱在焉饭后相与步城头揽郭外秋色而凭高之意遂忆梦中因语中丞中丞索予续成欲和同游者各属一章即以此为相逢剪拂投赠之雅什也
463916,前诵疏影弟游山佳什得惟君性好山颇会登临意之句然久未完篇今届九日勉为续成即以为赠
749900,五月十一日梦中得首联十字次日剑昙至自京师因续成以赠即送其通判岭西
411791,丁丑春日偕广洽法师等访高僧弘一于日光岩下蒙赠以《佛法导论》诸书归福州后续成长句却寄
834805,浣溪沙 戊戌人日，梦与礼卿及二客斗诗牌，予得句云：芳草碧沾游子屐，夕阳红到小姑祠。既觉，乃续成此解纪之
845042,前咏怀作未尽所言，续成二章
814779,答汪桂山明府和古樵寄作仍依韵续成六首
754759,梦得首二句续成
817932,戊辰在广州，岁暮有怀定之诗，仅成三句，未寄;逾年重客旧都，与定之再聚。又四年，癸酉春，定之南归旅沪。别既数月，岁复云徂，检前稿续成末句寄之
409120,续成二首（选一）
784127,过中江城北偶得林丛二语已一易寒暑矣今续成之
813092,幕中淩君子伟，咏春草有“旧梦南朝葬美人”句，喜其新警续成三律
302261,除夕集小画舫斋诗钟得磨画二字夜深归舟中续成一律明日简与会诸子
895836,子山再惠诗见和因又续成子山不以予不才两发章荐
790655,幕中淩君子伟，咏春草有“旧梦南朝葬美人”句，喜其新警续成三律 其三
948323,顷尝梦至善生院赋诗一联己丑七月十三日因游续成一绝
681212,十一月二十七日夜梦楼居风雨中得句云卷帘看风树时亡妻亦在侧觉而有感续成一章
245214,子山再惠诗见和因又续成子山不以予不才两发
1225814,冬日夜梦中得句因续成之
784045,答汪桂山明府和古樵寄作仍依韵续成六首 其二
581573,东所饯黄子任别余与景昌与焉饮罢告别东所云北都有询及者为拜覆景昌亦云然余独默默景昌诘余因应之曰自知潦倒无人问何必殷勤嘱使君后回看竹亭续成前句
783764,和毕续成二首 其一
372512,又次韵和续成绝句
325185,五月初七日梦中得起二句醒起续成之
411778,步何君《半山娘娘庙题壁》续成
636316,初秋夜梦入罗浮，得诗一律，醒后仅忆登高望远之句，援笔续成
841570,前咏怀作未尽所言，续成二章 其一
571344,已邜避地宿宜阳梦绣领二方谩云杜云采色三秋动而首尾俱忘醒念兹游不及秋而黄鸟碧云皆不晓所谓姑续成之以俟
808966,完末场卷，矮屋无聊，成诗数十韵，揭晓后因续成之
790653,幕中淩君子伟，咏春草有“旧梦南朝葬美人”句，喜其新警续成三律 其一
451986,梦中得月因诗废一句枕上再续成篇
423503,眉峰碧·廿三夕续成此解，时闻妇病，将南归
459532,醉中约肖访薛，肖乃醒语止之。作诗聊当神游，才数句，又为彼拽饮。后醉中见稿，辄补数句，屡为肖酒误之。今夜大醉续成，已二年矣。时作时辍，故语无伦次。时元月二十八日，将共往宁乡之前夜也
709537,续成语四首 其三
783765,和毕续成二首 其二
817775,九月晦夜，梦中得“江上梅花影”五字，寤后续成一诗，题陈师曾水墨兰石
934115,梦宴客大楼上命笔作诗既觉续成之
325209,幕中淩君子伟，咏春草有“旧梦南朝葬美人”句，喜其新警续成三律
454825,齐天乐吉安渼陂古村有书斋形似古床，壁存一联：万里风云三尺剑，一庭花草半床书。予游此地，触感先得结句，归后续成此阕
709535,续成语四首 其一
817985,除夕集小画舫斋诗钟得磨画二字夜深归舟中续成一律明日简与会诸子
646446,宿清溪驿梦得草虫鸣断岸沙鸟宿寒汀之句因续成诗
250178,梦中得月因诗废一句枕上再续成篇
784046,答汪桂山明府和古樵寄作仍依韵续成六首 其三
1051322,答张无尽因续成诗
