117582,怀黾池寄子瞻兄·相携话别郑原上
365181,西溪次韵·携手西溪陌
366697,孙侍郎访及仍携示近诗
1075604,周秀实陈庭藻携酒见过徜徉湖山间甚款明日秀实有诗乃次韵
995051,泽卿兰亭考用工深矣携攻愧大参诗见访次韵并呈放翁待制
670984,和许长史玉函宫携妓 其二
510478,湛民泽携诸生游圭峰甚适奉寄小诗呈文定上人 其三
293109,游仙诗·携琴枕石卧松风
71173,庞公携家图引为张橘隐题
558366,携琴图
1128587,蒙莫伯镕饷酒携即菁村元举山庄赏菊坐客皆称叹以诗二首谢
324513,春日携頔子同刘养正教授游净国寺至李家园
198969,初发襄阳携家夜登岘山置酒
948808,曾英发运干顷携二诗相过今复寄赠大篇且惠汉唐金石刻辄次前韵道谢 其二
694242,太夫人晚归携诸孙候于贞节桥下
993898,履方携姜坦道诗卷相过为书其后
270603,清明·相携春服到兰皋
1108908,旴士张季携所注三略访西山先生既跋其书余复题二绝于卷尾
921117,陈州与文郎逸民饮别，携手河堤上，作此诗
220805,送欧伯起·天与神交忽解携
152499,永新贺升卿携中原六图相过其论古名将出师道
492564,夜宿南城彰义门递铺承曾元鼎携酒叙别
491875,过王氏南园看竹刘以和携酒至共酌林间 其二
691803,新买东庄宾友携酒往看十绝句
531749,八美诗八章章八句美同馆八君子也分携眷恋聊宣别情云尔 其一 张侍御
1025408,李彭元携曾吉甫诗卷数帖见过
192089,携子孙到四明洞节叙有感
544939,次公携酒招游弇园山池登缥缈楼二首 其二
618869,孺朗携酒过明叔山房同赋
1190323,送李舍人携家归江东觐省
548338,立夏日同杨钱二孝廉浦进士黄公涧观泉遇王孝廉携美人文如文如擅新声赋十三韵
101795,携手曲·携手共惜芳菲节
101795,携手曲·携手共惜芳菲节
1092240,龙隐洞石壁玉立□门虚明目□江流□贯其中上□□□□如印泥然亦异矣暇日携家泛舟来游
458120,同前出外得辣椒一碟，极烈者也，更复携酒返班，饮中随书 其六
179543,刘子野携诸名公诗轴见过为书其后
407640,四月七日与荣显弟携儿女辈为亡妻及瑛妹扫墓 其一
848285,戏李相如携妇还金乡
743834,壬子十二月六日与亥白兄携酒游凌云山
842928,黄忠端画报国寺前后庭四松应天郊坛左右各一漳浦杨抟九孝廉携以入都属题
472344,九月三日方别驾携酒殽见过因怀徐荆州
632053,从千山携龙牙回约诸子同啖
617069,初寒拜先考墓适君常侄携茶榼至口占
44252,南湖月夜有怀仁先生京师·寻胜谁为携手人
114415,和答刘太博携家游庐山见寄
682541,携酒啸台作
552183,田御宿大参携榼饮余映碧园李念腾计部同约以事阻未至
993656,次郭遐龄所携张安国诗韵
229029,四月十二日携家如钱塘二十二日过湖至九里松
1143948,八月二十日赵西湖携酒夜醒二更记事
569322,谷日同敬美携榼访家元驭因饮元驭园亭 其一
206896,送潘德久·每携瘦竹身长隐
228529,詹世显老丈舂米为赠时有张老之携其父诗求月
557537,夏日携王惟材陪曹公饮城东湖亭
1128553,陪亚仲游习家池不携妓偶作二首
683882,楼道人一衲一笠一瓢遨游海岳而所携诗卷多名士如王格太仆吴国伦参政张位侍读同王稚登太学张凤翼先辈昆弟之作皆在焉仍虚首简以乞余题戏呈二绝归之
178001,岁除日同年冯中允携觞见访因而沉醉病酒三日
52995,玉泉道士携游果园
843976,八月十四夜携家泛南溪晨至小雄山斋晚归诗以纪之
434491,中秋之夕封生仲坚卫生行之携酒与诗见过各依韵以答 其二
714206,携姬游华山赋赠
608618,癸巳九日同焦弱侯周季平吴会甫董玄宰林咨伯庄得全六太史携酒兴德寺后池台 其一
323554,金华先生有奇石名碧远携来自蜀陈洪州以诗觅之
129522,次韵李君携示唐告
455227,浣溪沙 携为儿春日随夫故园踏青二首 其一
570797,畲宗汉令君谢全椒事归作汗漫游者二十载曩岁以四律寄我方在斋居不能为和今岁复携七绝句见赠一谈而别辄依数报之 其一
279121,六丑·南归携一鹦鹉，颇解人意
1000012,常尉携酒馔就部役所见劳
543878,仲嘉携酌过箕台四首末篇怀汪献于 其三
484212,朱伯徽自溪南携酒至婺源山中兼示垂丝海棠醉中求赋七言 其二
956924,全守支耀卿饮饯七里倅杨仲宣复携具至深溪酌别且乞余书走笔作此兼寄耀卿
277278,罗散久客闻冯生启镠携有汉籍数种因从借观
209377,和夏南麓绣斧曾驱当道狼及答尹存吾喻仁山携
251860,题绮梦楼·清风携月叩疏棂
132622,僧了仙携马太守唱和求诗
813521,初冬携舟至平水溪口由望仙桥入宝严寺夜宿澄公房
918388,四月十二日携家如钱塘二十二日过湖至九里松船步头秦家安泊凡住百日八月还家仲冬题金德恭东园
163912,浙江观潮·浙岸携觞差一日
329018,赠范信中·异时携客醉公家
346028,携酒见过·饤坐黄甘噀手香
624544,邑侯王山长携具招游冠山书院
832194,季夏病中，喜仲衡侄携第四姬见过，即次其重题革堂韵五首 其三
807525,念奴娇  秋夜携姬人稚子借宿椒峰东园追忆与白生让木叔氏虞掌读书此閒已十七年矣今二子已亡而余重复经此不胜今昔之感词以怆旧
965973,李簿携具用前韵和之
273613,徵招·飘然携得林间偶
93923,携酒夜饯罗季周
264254,明圃子留·忆昔相携吴楚游
831877,戊申正月携妓访槐庭，慰其丧妾 其一
1050408,元舆携酒见过三首 其二
136109,夜携家登南渡桥
1129566,梁楷画钟馗并引鹤归云际携琴过涧西三题
1156606,携诸山客同上香炉峰遇雨而还沾濡狼籍互相笑谑题此解嘲
810766,妙明归山携一太湖石，因赋三绝
677150,除夕白门喜比玉携榼至寓舍同子将无际升父无我守岁伯敬复遣人饷酒
195282,马浩秀才携秋日海棠诗见过
1132390,丙申携客自康王观东北行十里观谷帘泉
613504,有客携风木遗思卷索题时午月朔次日为先子讳辰余恫焉有感挥泪书之
192118,九日同胡子远携三子以重阳能插菊花无分韵
174890,周航定国携诸公所赠诗求次韵
380427,明郑贵妃·弥戾消除一卷携
595446,春日偕周一阳携酒过福寺访黄暾江春元二首选一
619594,伯襄太史携同似公赞夫代骧定国再过观梅时梅先开者飘落几尽止从山畔得一株太史方惘然不知梅开近皆两度也此事已三年矣是在梅花主人为之纪事 其一
956304,赠临江简寿玉二首简携王仲显使君书来谒并示孔毅甫梦蟾图今庙堂五府皆有题字 其二
106818,二月十五晚吴江二亲携酒
1055490,次韵陈君俞携酒见过
1125828,次韵元舆十绝 休师携茶相过二首
439565,客有自关辅来言秦民之东徙者馀数十万口携持负戴络绎山谷间昼餐无糗糒夕休无室庐饥羸暴露滨死无几间有为秦声写去国之情者其始则历亮而宛转若有所诉焉少则幽抑而悽厉若诉而怒焉及其放也呜呜焉愔愔焉极其情之所之又若弗能任焉者噫秦予父母国也而客言如是闻之悲不可禁乃为作商歌十章倚其声以纾予怀且俾后之歌者知秦风之所自焉
902568,灵芝寺避暑因携茶具汎湖共成十绝 其八
235114,玉楼春·当时携手城东道
1157801,蓝田刘明府携酌相过与皇甫郎中卯时同饮醉后赠之
158443,携印谒新守宿至德上方翌日马上追书十四韵
447855,友人归，携坐水畔茶楼
605112,壬申夏五偕诸君子携酒徵歌于二馀堂时主人以便面诗分贻即席次来韵赋谢 其二
546489,雪中二祝生携酒过访
992223,杜和州寄新醅吴正仲云家有海鲜约予携往就酌逡巡又云幕中有会且罢此饮
965841,和赵庙欲携尊赏残梅二绝 其一
643418,题携琴图
956576,周德万携孥赴龙舒法曹道过水阳相见留别女弟
544373,胡静父携盒过大槐寺作
687294,闰中秋夜田御宿大参携樽饮余映碧园
48152,洞宾花女人携瓶图
614150,清明山行至木下庙和上巳携酒
666578,九日颜子携饮西郭
466988,游无锡蠡园，传范蠡携西施隐于此
382772,子冲携尊方山相候因谋卜筑
786991,题携琴过桥图
765723,喝火令 春日，携建章大儿上粤秀山，望朝汉台
1000793,子苍携和章见过用韵为谢
533666,舍弟将使西粤郑驾部携酒偕桢伯见过
902432,甲辰仲冬八日元衡携两诗过访及归次韵酬送后篇兼寄张武子 其一
119877,次韵元卿·笑携佳句又冲寒
825223,三月初五日携家人往龙华观桃花至则已谢 其一
1133246,晦日携幼湖上
992619,忠上人携王生古砚誇余云是定州汉祖庙上瓦为之因作诗以答
400219,蓦山溪 戊申初夏携浩江过陈村镇二十四湾
541369,叶韡夫李宗阳携酒见访
153273,留别僧永·三处分携跨两年
1004838,以昌黎验长常携尺为韵赋笋五首 其四
950916,予自武昌携二猿归夜闻清啸偶成
861313,汪秘校携诗并雪月二赋相访次其韵
1234839,富春新创关将军庙成吴子中携卷索题
818496,初春携家青溪
136943,拙庵·笑携藜杖倚寒松
953456,拟玉台体七首 携手曲
404873,玉楼春·壬辰七月二十三日携俊儿自台北飞花莲，道经台南台东，盖越卑南山脉而行也
254613,马上漫成·手携篮子满新蔬
688095,孙朴居携酒东林玩月二首
42525,哈萨克陪臣到因携观广陵风景
521758,六月廿二日天彝生辰诸亲友携酒来贺蓼莪棠棣并感予怀因书俗语为八绝句示之 其四
567036,徐济之携新妇侍亲扬州
860124,永嘉何子善琴而有诗名一日携二妙见访求诗
40976,与崔录西别兼叙携手诗
699365,夏日同龚散木能者崔晦之邹伯学李子髯携妓泛舟和尚桥
263919,沁园春·司农招饮携五苗出揖客复次前调奉赠
691696,中秋喜客携酒见访二首
127733,浣溪沙·翠袖携持婉有情
947123,携家游东园
604532,恩诏赐复冠带县大夫雨中携酒赐贺赋此呈谢 其六
438958,客有自关辅来言秦民之东徙者馀数十万口携持负戴络绎山谷间昼餐无糗糒夕休无室庐饥羸暴露滨死无几间有为秦声写去国之情者其始则历亮而宛转若有所诉焉少则幽抑而悽厉若诉而怒焉及其放也呜呜焉愔愔焉极其情之所之又若弗能任焉者噫秦予父母国也而客言如是闻之悲不可禁乃为作商歌十章倚其声以纾予怀且俾后之歌者知秦风之所自焉 其四
1066548,蒙莫伯镕饷酒携即菁村元举山庄赏菊坐客皆称叹以诗二首谢 其二
605111,壬申夏五偕诸君子携酒徵歌于二馀堂时主人以便面诗分贻即席次来韵赋谢 其一
7369,陪王侍御同登东山最高顶宴姚通泉晚携酒泛江
156353,归金华·携手山桥第一轩
579359,中秋诸友携酒饮白沙时余有徵命将行
38714,游仙·招携紫阳友
286850,惜秋华·庚子秋携家避地广平
1252495,风入松 南金寓携李，予客海隅，寄此以叙闲阔
253173,放归故里携扬儿登高
181517,歌妓许冬冬携酒郊外小集
674929,沙道中病足刘美之约同年携酒问之以喉痛不赴戏柬
235756,鹊桥仙·携琴寄鹤
700280,六月廿二日天彝生辰诸亲友携酒来贺蓼莪棠棣并感予怀因书俗语为八绝句示之
253012,陌上花·携内子重游荷兰花田叔谟士铭两夫妇偕去
194128,公冶携酒见过与者温元素康致美赋诗投壶再用
120019,郭家洲·携儿上绝岸
9844,屏风上各赋一物得携琴客
156870,楼·等闲携酒上南楼
315620,夷山夕照·不用携壶上翠微
524428,新买东庄宾友携酒往看十绝句 其九
800138,同陈骠骑携妓西郊射猎
597770,过泰和得刘广文在潮信息其弟同诸侄携酒夜过
1076372,大冶山中有东方寺世传东方曼倩尝读书于此寺后有圣泉凡邑人之乞子于此者随愿辄得僧慧满住持十载无日不醉癸酉冬十二月之吉趺坐示寂九日而色不变人皆携酒来酌师至暮必赪颊泚颡状如醉人然其事甚怪金山贯道人将赴东方之请于其行也戏作三诗送之因纪其事使刻之山中以传好事者 其一
25886,题樱桃·春初携酒此花间
150843,送方叔·九日相携上翠微
1167868,送侄良携二妓赴会稽戏有此赠
121669,录韵·张子携诗来
233828,携家游倭松
913722,携酒夜饯罗季周
546771,黄生九斗携所业千里过访于其别也赠以绝句六章 其一
49050,乡友携酒至舍下
544938,次公携酒招游弇园山池登缥缈楼二首 其一
616055,初冬郭给谏携诸同年游一线天回酌后湖亭
281163,语声有作·不携儿女去嬉春
593151,立春日风雨仍泊石亭馆魏甫佳甫携酒同宗良贞吉孔阳饮舟中得桡字赋成韵
105989,残春感事·果熟携竿扑
956055,闻石湖海棠盛开亟携家过之三绝 其二
881698,蝶恋花 其二 百花洲老桂盛开，张师明、程德远携酒来醉花下，有唱酬蝶恋花，亦次其韵
653806,白都阃携牲酒相访夜酌有作
202127,廌寓龙兴仁王佛舍德麟公定道辅仲宝携酒希纳
960769,安象祖携子饯行英爽可爱赠以诗嘉其有好德秉彝之天必能世其家
616096,七夕后二日承晓湘家门侄自东官携同门诸子佳什见寄因答四韵 其二
1077733,胶山兰若幽胜予寓梁溪久而未之到闻翁士特携家居其间赋诗见意
217745,寄孟宾于·初携书剑别湘潭
808381,清明后一日与孙大携酒饮王七秀才廷俞南圃归过县门忆亡友林嗣基作
633067,大翁携来诸物俱典尽各赋一绝 其一 琴
289546,携眷渡厦，舟泊淡水，偕妻子入台北城竟日，归舟记之
706481,翠涛携诸子游瞻云阁有作见寄遥荅
528997,晚自西堤携楫儿散步
1050407,元舆携酒见过三首 其一
588388,李三洲同岱麓携酒见访用韵一首
208986,育王老禅屡惠佳茗比又携日铸为饷因言久则味
314043,忆江南·携镵去
597129,与云静野钟冲宇同携用扇韵
343198,惜花·玉人携酒对花枝
49632,张翁携酒见过用前韵
1034345,丙申携客自康王观东北行十里观谷帘泉 其一
321171,别弟·欲去相看手重携
484213,朱伯徽自溪南携酒至婺源山中兼示垂丝海棠醉中求赋七言 其三
308597,渔家傲·澳门送秋，携谷儿登新园
52563,过吴门访沈野范汭携酒至因赋
97690,叔文见过且携赵祖文归来图来为赋四十字
133460,白云庄·归去携家住白云
466252,醉欲访肖，车将至，匆匆草此携往
782699,携尊
455501,携侄儿登岳二首 其一
540068,李主簿携具为别索诗 其二
1100202,携手升玉阶
690861,春夜世立携客过访息庐
160687,和李提干携诗相访
1004841,以昌黎验长常携尺为韵赋笋五首 其一
83857,初春幽居·满榼芳醪手自携
237798,戏李相如携妇还金乡
960952,送松麓李应龙彝甫携阿颖鹏升参学
524422,新买东庄宾友携酒往看十绝句 其三
18005,雨中携元九诗访元八侍御
622095,孙蜚莪偕宋尔孚杨承之携酒过从得榴字是日夏尽
573499,饮小修所携惠泉 其四
566045,秋日蒋子携樽过草堂宴集一首
712168,向恬庵携酒西山是日适热发不得痛饮赋此答谢
1224621,端午日泊舟信州城下陈行之推官袁仲野知事携酒馔劳予于挹翠亭上
787806,师竹由东阳携石洞贻芳卷过访，偕饮酒楼，转至戴海门笠青家，夜归书赠师竹 其一
603034,九月三日承黄茂才君甫元玉伯安携李英登海西台
787809,师竹由东阳携石洞贻芳卷过访，偕饮酒楼，转至戴海门笠青家，夜归书赠师竹 其四
945985,袁起岩会饮湖上出示古刻酒罢各携桂花以归因成一绝
699212,平南张别驾携酒约冯次江使君同游思鹅洞舟二首
98932,行香子·携手江村
1172795,王十七侍御抡许携酒至草堂奉寄此诗便请邀高三十五使君同到
543565,忆在京洛遇鸣皋游契甚洽一别五载鸣皋既赴召玉京余亦轗轲家难偶祝生如华携所业印正门下诗以勖之
19439,梦得卧病携酒相寻先以此寄
1223592,和可行圭塘杂咏 其一 携妓落成
533310,潘子携酒同欧氏诸子过清泉山中出吴笺索余拙书因留夜坐
458115,同前出外得辣椒一碟，极烈者也，更复携酒返班，饮中随书 其一
868767,送吕子阳自永康携所解老子访余留未久其家报以细民艰食急归发廪赈之
1247850,喜南邻携酒
332874,题行箧内所携米海岳各帖戏效渔洋论诗绝句
904751,携子孙到四明洞节叙有感
614369,叶山人自楚归携诗稿过访辄有此赠 其一
344704,艾虎·药市谁携病草还
1118209,留樊亭三日王觉民检详日携酒来饮海棠下比去花亦衰矣二首
1076219,飞卿携去腊书见过中有诗次韵
871271,携友生诣桐柏
913721,携家小歇严州建德县簿厅晓起
787807,师竹由东阳携石洞贻芳卷过访，偕饮酒楼，转至戴海门笠青家，夜归书赠师竹 其二
65834,携孺子果定居吴兴守望
253204,戊寅元日携儿辈登高
510699,家兄携秉常看山予病不能往
962430,临邛计次魏自言六世祖破荒先生晚居景陵因葬焉后世子孙岁时不能拜扫日负樵牧不禁之忧慨然欲往携其所藏遗书一卷求书纸尾且云是行并之武昌省运使表兄迤逦观光上国用正岩字韵赋诗一章以言志正亦用岩字韵为赋三章以勉之云 其一
730239,辛丑八月旧庖丁雍姓携南皮相南小画四帧索题口占应之 其一
378802,赠胡子显·社饮扶携春日和
1086883,豹岩之北脩竹数亩中有丛冢数十百处皆绍兴末年所寄予得此地先定规抚某处起亭榭某处植花木七八年间成畦径矣所寄之榇愿移者从之不强也作噩之春有姓淡人来启菆卜日携锸掘土数尺败棺俱在朽骨为土所蚀颇亦不具皆包裹而去后数日忽诉于县于州于外台追问證治踰月始定今不复塞其故穴欲使孙曾知之故作此诗
245313,陪诸公携酒山家用壁间韵
753284,客秋偶憩西子湖皆令携幼女过访发方覆额遂能诵诗写法帖楚楚可人今依然梦想间并裁小诗似之
34276,闲游·携酒复携觞
34276,闲游·携酒复携觞
1110472,到象州寓行衙太守陈容德携酒见过二首
83370,野望·偶携一小竖
585842,戏书天真上人所携罗念庵诗卷及楞严经解
1124924,庚寅正月十六携家入山大雪弥旬止既月叔祖东绿翁以那知风雨夜复此对床眠分韵瑞得那眠字
668950,早春入山詹仲携酒野酌笑咏成诗
1088055,过高台携信老诗集夜读上封方丈次敬夫韵
193990,赵叔鲁端行胡象德携酒见雇
832193,季夏病中，喜仲衡侄携第四姬见过，即次其重题革堂韵五首 其二
626544,区叔永携酒偕弈客见访用前韵
537818,莫参政子良张山人携饮天宁寺作 其二
458116,同前出外得辣椒一碟，极烈者也，更复携酒返班，饮中随书 其二
52788,南涧·携友过南涧
595799,喜刘德夫携侄用明入社
28142,箬笠·朝携下枫浦
134929,陈君举既亡注文子携其所作春秋后传及送行诗
1135964,次韵刘元煇喜予还家携酒见访三首 其二
618062,石岐旅馆汪山人携酒夜过
1135965,次韵刘元煇喜予还家携酒见访三首 其一
492368,携妻子入石龙山
247240,木兰花慢·己卯贱辰诸朋旧携酒见存
694521,梦长髯道士以一囊贮罗浮山携以遗予纪以绝句
203214,白莲僧宗·老去将携只要轻
214079,怀元度·思君携手安能得
685038,避暑粤山中诸君携酒见访
324416,王岩老携诗见访诗未究雪下索余作诗赠之
569287,汪禹乂弃家业诗携其集就质赋此为赠
875330,旴士张季携所注三略访西山先生既跋其书余复题二绝于卷尾 其二
765543,步月 月下携小婢登锡山
237741,章季子携所作乐府来以诗谢之
337594,中秋携小儿步湖堤
564868,贱降前一日俞厚庵暨沃泉携酒饮予舟中即席奉谢二首 其二
107199,九月八日宾旸携酒西斋晚登秀亭次前韵
1128520,提宫工部兄携家见过辄成律诗二首上呈
1094959,成父携酒过余作二绝 其一
99028,上巳日与二三子携酒出游随所见辄作数句明日
1111856,言老自云堂携十六大士画像见过与世间传写者不同惊喜赞叹因成二偈
18902,病假中庞少尹携鱼酒相过
649117,胡祭酒宅秋菊盛开仆携酒就赏胡有诗因次其韵 其二
1076373,大冶山中有东方寺世传东方曼倩尝读书于此寺后有圣泉凡邑人之乞子于此者随愿辄得僧慧满住持十载无日不醉癸酉冬十二月之吉趺坐示寂九日而色不变人皆携酒来酌师至暮必赪颊泚颡状如醉人然其事甚怪金山贯道人将赴东方之请于其行也戏作三诗送之因纪其事使刻之山中以传好事者 其二
217718,采桑子·又是两分携
78114,排闷·曾携一剑远从戎
192522,次韵宇文守携酒相访
937931,张迪功携诗见过次韵谢之二首 其二
422100,携眷归乡，留别厦中诸友
523652,中秋喜客携酒见访二首 其二
615712,王季重董得庵携酒夜过
1172799,王竟携酒高亦同过共用寒字
382783,雪中济南道上携张就山同行忽失所在诗以觅之
1049202,和正月十七日携具见约
570924,大宗伯徐公携阿倩见饯娄江命赋之得二绝 其一
1032655,赵叔鲁端行胡象德携酒见顾
66929,登岳阳楼·春城携伴共跻攀
196663,南至前一日蒋君伯禄携山谷草字来示上有南轩
682452,孝兼四兄侍御七弟携侄自?川舟来约游西樵
999893,赵龙图自西川携鹿儿至秦相惠
173244,谦仲好古携酒见过伯氏以诗谢之次韵
352369,春日览古·曾携壁上鸬鹚杓
383337,中秋同施还初文学携门下诸友汎舟南溪
825007,八月六日携炳垂二子登晴川阁
790107,七月初五，夜梦一老人，携登亭台，饮予以酒，命咏二绝。时酒气在喉，残镫映窗，披衣记此 其二
1030618,刘子野携诸名公诗轴见过为书其后
807939,金明池  蘧庵先生归自吴门闻携有秋岳先生新词作词奉柬
218947,元夕同社众携灯上山谒神祠
956758,携家石湖赏拒霜
1088507,比与邻曲诸贤修举岁事携壶石马追补斜川之游而公济适至饮罢首出和陶之句以纪其胜辄亦用韵酬答兼呈诸同游者请共赋之
1003931,煇父道父携酒相伴饮飞赴寺四望亭
106080,八月二十日赵西湖携酒夜醒二更记事
1005837,周梅所携正仲再和借书韵见示次韵报之
114169,再次韵寄子由·想见苏耽携手僊
962428,临邛计次魏自言六世祖破荒先生晚居景陵因葬焉后世子孙岁时不能拜扫日负樵牧不禁之忧慨然欲往携其所藏遗书一卷求书纸尾且云是行并之武昌省运使表兄迤逦观光上国用正岩字韵赋诗一章以言志正亦用岩字韵为赋三章以勉之云 其三
917425,复用前韵且约携琴寻花下之盟
230003,畅伯圭父子下第归乡携嗣由广文书并手佳章宠
228575,携酒落成倅厅绮霞阁口号代简
388543,汪禹乂弃家业诗携其集就质赋此为赠
492230,张仲良燕饯郑子素于黄竹径之梵閤时天气暖甚桃花盛开后四日为重九矣得携字
347076,葛沽苏庄道中携马兰归种湜亭
1028778,玉溪梅株柯殊绝宣和间用事者尝图以进竟不报今乃弃置蔬畦摧折憔悴有可怜之态昨陪诸公往观共叹其不遇且约盛开时携壶酒为醉赏之适因循又不果因用韵吊之
569751,唐人有画葛稚川移居图者与妇各骑一觠角牛前后五白羊从之一赤脚担装又一少女从之手携束书且行且读妇所乘牛背大幞一婴儿在焉其用笔颇雅劲山谷老人书七言律于尾似不能悉稚川事故为补题一首
183681,宫词·阿姊携侬近紫薇
210703,月下笛·与客携壶
819407,和石遗天宁寺荒台登高，携酒对饮
224458,恋香衾·记得花阴同携手
910185,戏子常携妓见访
622053,宋尔孚携斗酒及新诗追至三河同舟竟日夜而别酒醒却望寻韵寄答
967718,水龙吟 仙源居士有武林之行，因与一二友携酒赏月，饮于县桥之中，乃即事为之词
341420,子服幼瑜读书南郭草堂骏孙携酌汉飞邀同子玉渭臣序皇即席
546776,黄生九斗携所业千里过访于其别也赠以绝句六章 其六
290909,纪事·相逢携手话殷勤
1072276,携家从允迪借居鸬鹚源上沈必先侍御有诗宠其行次韵并呈二公二首 其一
1079762,病中夜闻雪作时尧明有广陵之行未归思为数语奉寄久之未就他日尧明归携诗相过飘然有御风凌云之气因以前诗答之
1155944,同诸客携酒早看樱桃花
956054,闻石湖海棠盛开亟携家过之三绝 其三
605004,乙丑春二月二十有四日邑侯裒谷孙公有事罗浮同社诸君子偕集江上小堂举酒相贺夫劝课农桑巡行阡陌辟草莱以正疆界蒐伏慝而饬干掫此循良实政开邑以来二百五十馀年所未有也遂相与绘图授简侈为诗歌以副野史公复取道于先司徒东皋别业驻辔于先仲第□子二石山房盖有谋野则获之思焉萱乃携子及孙炊脱粟酾茅柴以窥马足公辄欣然班荆移阴而别时余以目眚不能从公于迈为四百三十二君归石候命第以一日之长狎主齐盟敢不悉索敝赋窃附中和乐职之谊遂鼓腹
1050409,元舆携酒见过三首 其三
1143380,大名元复初郎中携示感遇五言八章次韵并陈东平曹子贞编修蓟丘曹克明 其三
1214932,高荣禄筑南城别墅，苍松老柏，异花时果，蔚然成林。公与夫人乘小车，携二孙，来往其间。徵余赋，遂次杜公何将军山林十首云 其十
315758,题载书图·我亦携书作浪游
1214925,高荣禄筑南城别墅，苍松老柏，异花时果，蔚然成林。公与夫人乘小车，携二孙，来往其间。徵余赋，遂次杜公何将军山林十首云 其三
510741,太夫人晚归携诸孙候于贞节桥下 其二
1161426,与庞复言携酒望洞庭
235597,减字木兰花·寻花携李
530237,至日携搕登道场山
