199814,师永锡少出通义其归携伯浑诗来因用其韵伯浑
95414,毕叔文携坡帖及与季真给事倡酬诗卷见访于邢
366970,赠黄少卿·携筇得得访云关
566812,往年观伎走解意当是北产故缀四律首章用北语今年复来知是金陵上元人又携一少伎同坐铲上分镫放体空中名曰童子拜观音乃昔年所无者
497591,携儿子允文登虎丘寺有感昔游
212547,次韵陈宜中携诗见防
714884,蔡玑先铉升携过东园看菊作 其二
445596,粤中纪游 其五 粤游将归熊东遨周燕婷伉俪置酒予携高秋晓辉往诣殆忘归程风雨之忧长句谢之兼寄座中清角无涯彭兄诸侣
593312,顾舍人元浚携酒晚过
96699,仲文叔骥·每忆分携地
524025,谷日酬郑屠二省使携酒见访
994726,邵监携诗相访用集中閒居韵为谢
459572,醉欲访肖，车将至，匆匆草此携往 其一
541254,潘祁叔正叔沈汝清徐文仲携酒过访得林字
820683,点绛唇 南人北来携食物数事故园风味差足慰乡思耳
443284,甲戌仲秋以病住院，内子携佩儿来探视，留三日，送归二首 其二
690920,叶山人自楚归携诗稿过访辄有此赠
720320,九日王秀才携酒至
24449,夜携酒访崔正字
253108,携操儿登五云山
652552,携歌者访方氏不遇
98705,携诗见过·故国闻江左
1042984,夜携贾十五过巨源作
472871,张二吉父袁九龄秀才携酒至吴山馆
1027042,八月十四日携家泛月次韵 其四
162654,幽事·闲携小斧删梅树
565666,题谢安携妓东山图一首
401476,白晓东携诗冒雪访余未遇数日后白以诗见示勉次原韵
832196,季夏病中，喜仲衡侄携第四姬见过，即次其重题革堂韵五首 其五
404882,金缕曲·甲午十月二十四日予与苕君结缡三十年矣。欧俗谓之珠婚，法当以珠玑为寿。乃置酒携儿孙为苕君称觞，兼以自庆
917480,未至池阳五里有齐山寺寺后岩石巉然缘崖而上绝顶有翠微亭即杜樊川九日携壶地也自亭而西憩集仙洞
208463,钱清登舟·日落相携上小舟
1234556,送姜尚忠得官后携新妾归息
319097,采桑子·赤栏桥畔同携手
558515,谢赵弘济进士携酒至兼简丁编修
150066,愁·无奈愁来欲解携
628451,送胡大灵携其门人与幼子作客青齐 其二
483510,玉泉道士携游果园
604994,甲子七夕雨中韩寅仲明府绪仲太史同新安孙子真携两姬过集
556369,家僮自野田携黄菊二株至轩中感而有作三首 其二
814754,都中喜晤宝山侄携眷自蜀归省并应顺天乡试二首
789941,过汪北鱼香南斋时，携琴僧墨隐、画史吴冠英，游大小石湾，久待不归，赋此却寄四首 其四
533344,郭方伯应宿至自南中止广惠寺同刘观察仲脩携酒奉讯 其二
1154637,携仙箓九首 其二
915509,赴调宿白沙渡族叔文远携酒追送走笔取别
520379,予入华山而爱其名胜恨不登落雁峰携谢眺惊人句搔首以问苍天耳玩之不足而因成一诗山灵有知其尚羡予之奇观也哉
1094113,九月二十五日仲至携酒与客相过因为作生日次韵春时所赠
971005,从礼折花携具见过且赋二诗 其一
1071157,予谪海外久矣蒙恩徙郴所寓适与苏仙邻暇日携儿徜徉历览遗集因阅本传不载致仙之因特以事母尽孝行耳自古仙真得道如吴真人之流未有不由此而致者世人不知出此多弃遗父母入深山穷谷中父母冻饿不恤也以此求道去仙远矣因成二小诗题之壁间庶亦少警欲学道而忘其亲者 其一
529096,长女卒后复携家渡江
159957,答微之·南圃携樽数
591776,罗京兆携酒以歌者过吴氏池亭三首 其二
38970,七言·因携琴剑下烟萝
565995,盛子携酒城中为宴一首
208356,梅花十绝·携茶时复过幽亭
872355,危见心携示别去寄谢
130240,赠谈命者·客有携诗夜扣扃
370662,成父携酒过余作二绝
291225,浣溪沙·三日缠绵又解携
547618,病中朱廷平可大携谈易王生见过书怀
911450,刘上舍携酒有诗和其韵 其二
521760,六月廿二日天彝生辰诸亲友携酒来贺蓼莪棠棣并感予怀因书俗语为八绝句示之 其六
1168661,携妓登梁王栖霞山孟氏桃园中
373380,山中即事·携僧缓步听溪声
263920,沁园春·题孙赤厓携孙小像
639108,戊辰重九携子时表衷登岘石岩
1036081,浣溪沙 十二月二日雨后微雪，太守徐君猷携酒见过，坐上作浣溪沙三首。明日酒醒，雪大作，又作二首 其一
404317,减字木兰花·登泰山。携小女冰缨、小儿光明同往
787804,宾于将返武康以所携笋蔬麦餈见赠赋此送之 其三
1096239,梁楷画钟馗并引鹤归云际携琴过涧西三题 其二
1170495,奉酬崔员外副使携琴宿使院见示
593150,贞吉携酒同宗良孔阳再饯滕王阁得筵字
113870,赵令答诗约携山妓见访
1093567,黄仁卿见过留之而无酒因要宋衡携酒以至得以款语已又酌仁卿携行之茶成四十字
1093567,黄仁卿见过留之而无酒因要宋衡携酒以至得以款语已又酌仁卿携行之茶成四十字
992660,金山芷芝二僧携茗见访
336490,次韵魏宗明携酒小集
492622,大赦后一日出京城闻崇庆王太守子启自和州屯所携其佳儿南归喜而有作
130091,次韵牟监薄·几携笔砚傍书林
18133,携诸山客同上香炉峰遇雨而还沾濡狼藉互相笑谑题此解嘲
619511,詹生携酒赤松堂
182275,和赵庙欲携尊赏残梅二绝
876361,长溪陈梦雷携表弟赵君玉书相访
1121648,但能之提刑相别十年自曲江远寄二诗叙旧良厚次韵为谢亦以首章奉怀略道湘南分携故事末篇自述年来衰病不复故吾也
271621,金缕曲·携手
1106671,王岩老携诗见访诗未究雪下索余作诗赠之
1214924,高荣禄筑南城别墅，苍松老柏，异花时果，蔚然成林。公与夫人乘小车，携二孙，来往其间。徵余赋，遂次杜公何将军山林十首云 其二
983484,江岸茅舍傍古梅奇甚携酒即之
282255,晓浦携两姬游虎邱冷香阁看残梅值雪有作和之
355792,丁巳九日携酒要叔问登通道门楼而江彦文寄玉友适至因用己未岁吴下九日诗韵作
155661,十月二十三日携家游裴园
994907,晚自东湖携藕花归儿辈争插盆池香艳不歇亦供两日嗅玩因成
1134456,三月八日百五节林敬舆携酒约盛元仁戴帅初方万里访赵仲实宣慰于西湖第五桥之曲港南山书院五首 其三
452935,放归故里携扬儿登高
602976,中秋后二日承李少思苏仲辂欧仲岳苏四郎林觉苍李少似李少修苏虚白梁小鸾李伯玉李季玉十一君携壶榼泛舟见过酒馆遂登海西台得杯字文字 其二
609612,携酒啸台作 其二
8306,严公仲夏枉驾草堂兼携酒馔
91889,赴调宿白沙渡族叔文远携酒追送走笔取别
682462,携酒偶入包氏园亭
222458,寒食后一日赵国携具拉游清风峡登一览亭分韵
1123583,彦文携玉友见过出示致道小诗因次其韵
543882,春日司马公同携王姬入紫霞洞观桃花时少连太宁仲嘉仲淹并集司马以桃花源美人家为韵分得桃字
978892,师永锡少出通义其归携伯浑诗来因用其韵伯浑顷尝相送至下岩也
1128414,携家避地
1122481,临邛计次魏自言六世祖破荒先生晚居景陵因葬焉后世子孙岁时不能拜扫日负樵牧不禁之忧慨然欲往携其所藏遗书一卷求书纸尾且云是行并之武昌省运使表兄迤逦观光上国用正岩字韵赋诗一章以言志正亦用岩字韵为赋三章以勉之云
173609,正月九日携儿侄游宝庆寺
246031,日前颇闷赋眼花耳热之句自遣未成今军持兄携留社丛刊邀饮既别忽念前句因足为
1125832,陈老父携茶见访因留小饮二首
1027896,携家再游姚江
422068,携眷渡厦，舟泊淡水，偕妻子入台北城竟日，归舟记之 其四
322982,子长携具至溪口复用前韵
569926,八月十六日携酒高坐寺同郭道人次父王山人承父孙山人齐之徐司理茂吴邹学宪彦吉梅茂才禹金凡七人分韵余得南字
385820,答张子光·闲携诗画便游山
383103,携陈山人东甫饮黄石山顶
558305,丁未端午早梦侍讲林亨大与一同官而年少者携幼子过我情好甚洽方饮景星楼上即别去时亨大归省于闽因儿辈书声而觉以诗记之
1114136,海上得孔雀六鹦鹉十馀携归遗童稚辈戏成二绝句
1220370,清明日同学士李惟中赵子期及国学官携酒东岳宫后园看杏花 其四
353406,子仪侍郎欲携家泛湖不及践旬休之约再次韵
459586,已为石作二诗，忆其至佳者，更赋一章。石上鱼乐图，天然奇丽，殆无伦比。惜此石涂中已佚，未及携归
19245,蓝田刘明府携酌相过与皇甫郎中卯时同饮醉后赠之
830583,惜秋华·庚子秋携家避地广平，重九日出郭游莲亭。十八年重到，堤柳萧瑟，大有江潭之感。用梦窗重九韵
570674,楼道人一衲一笠一瓢遨游海岳而所携诗卷多名士如王格太仆吴国伦参政张位侍读同王稚登太学张凤翼先辈昆弟之作皆在焉仍虚首简以乞余题戏呈二绝归之 其二
479543,雪中赏红梅奉次涯翁先生时邃翁携酒共饮怀麓堂二首 其一
608983,携酒偶入包氏园亭 其一
347231,听笛·有客携笛来
887297,予与子寔避盗同走崆峒予以其年十一月归侍金川踰月而子实走豫章阅三载子实携婉妹归梅川道经旴予自金川侍亲归会之酒酣作是诗以饯别壬辰十一月二十七日
348126,崇因老禅诠公携诗见访
98088,潘元寿以九月十一日行莫令君领客携具泛舟饯
114459,答阎求仁·暮天携手步河梁
1104766,首春同枌友携樽过野渡访梅即席
1169470,携手曲
762008,女孙于归有日，途梗未通，曾蓝田总戎适携少君来迎，喜赋
873767,兼道携古墨来墨面龙纹墨背识云保大九年奉敕造长春殿供御龙印香煤旁又识云墨务官臣庭邽监官臣夷中臣子和臣卞等进盖江南李氏物也感之为作此诗
60970,上元病居筿川存山玉田宾山携酒妓过访
1120774,叔共出近诗百馀篇携归灯下读竟题小诗其后三首
587857,王岱麓李三洲携酒过访诗以谢之三首 其一
1025705,寒食前三日携家至丁山
597162,与李瑶泉甘文峰月夜投壶会饮因携游赋此
790535,畏风足不出户者数日矣，次儿自适园回，携到红梅两枝，怅然有感，插瓶赋之庚午
1135932,冰崖杨明府德藻携红酒殽果来饮归舟独坐熊皮索笔作字且出示箧中书为赋吴体
490928,秋日郭参戎携酒过袁侍御园亭小坐
745170,薛又洲携杖山行图
714805,汪学博携饮罗湖 其二
611436,送西席陈玉阳携年儿南归二首 其二
697423,黄生九斗携所业千里过访于其别也赠以绝句六章
691160,过携李陈当时明府招饮烟雨楼
545113,曹子念东归同邦相携酒兰阴作
152624,西江月·携手看花深径
341299,秦溪杂诗·携家栖旷野
348587,余八月十六日携家玉笥山观月览颖叔待制寄题绝句然公之往还终不暇游也故次其韵以寄颖叔
436707,中秋之夕封生仲坚卫生行之携酒与诗见过各依韵以答
1094962,赵清江携临安酒来饮
684336,闻曰仁买田霅上携同志待予归二首
570801,畲宗汉令君谢全椒事归作汗漫游者二十载曩岁以四律寄我方在斋居不能为和今岁复携七绝句见赠一谈而别辄依数报之 其五
970474,结茅守冢偶携子弟散策郊游有感借用壁间韵 其二
521759,六月廿二日天彝生辰诸亲友携酒来贺蓼莪棠棣并感予怀因书俗语为八绝句示之 其五
437056,菩萨蛮 携酒过分定张子华
1009094,岫家居昌国南海上安期先生炼丹之地乡曰安期忆十岁时父携至于家山嘱之曰吾死当葬此地南水上时正朝此处可以荫汝父死日奉遗言而葬焉家废后岫出家从释为僧来多病多难幸不致死今已六十二岁虽学佛无所知粗明善恶因果不堕凡愚数中实父遗言所及今作一偈以代墓志云
741078,早春携鹤儿出郊
626976,三吴山愚翁先生晚喜禅学辛酉秋繇闽入粤访金抚军携其小照坐立二图及海内诸公题赞出以相示予曰立坐者人得见而题之矣其不立不坐者将何居先生笑而不答因作四言三章而括以七绝书之卷末求质正焉
902623,春日汎舟南湖因遍游近港坐间书客所携四扇 其三
803078,暮春携酒登见山楼遇族侄凌沧
18637,同诸客携酒早看樱桃花
644651,邻父携酒相饮
192552,竹间读书·携书携酒秋竹根
192552,竹间读书·携书携酒秋竹根
282590,念奴娇·春莫赴西湖，折园中海棠一枝，携随行箧
1121797,闻石湖海棠盛开亟携家过之三绝
44349,初春携家青溪
969382,携家
194748,题琳老所携二苏书帖
773558,题行箧内所携米海岳各帖戏效渔洋论诗绝句
632636,大翁携来琴画砚帖俱典尽感赋
831879,戊申正月携妓访槐庭，慰其丧妾 其三
533158,雨夜姚元白欧桢伯携酒过访
546773,黄生九斗携所业千里过访于其别也赠以绝句六章 其三
810076,绮罗香　玉壶山人为余作美人拜月图数年矣携之行箧再付装池漫题此阕
460261,南歌子　携酒春游，中怀有念，悲喜无端，词以纪之 其三
545091,同邦相携酒兰阴送曹子念入闽作
666031,九月刘苏州携酒过寄寄堂席上作
188743,吏隐亭会集·扫携共到习家池
326711,茶坂·携籯北岭西
546504,幼于所欢王姬携酒饯别戏酬以小诗
956303,赠临江简寿玉二首简携王仲显使君书来谒并示孔毅甫梦蟾图今庙堂五府皆有题字 其一
305997,油圳杂咏·自携竹椅上禾场
918214,陪诸公携酒山家用壁间韵三首 其三
19399,雪中酒熟欲携访吴监先寄此诗
334442,梅花·携手城南忆旧游
1087941,赵君泽携琴载酒见访分韵得琴字
56508,暑夜孝若携伎饮长桥上同诸从踏月歌
458117,同前出外得辣椒一碟，极烈者也，更复携酒返班，饮中随书 其三
499782,送何同伦携家之武昌寻弟
902566,灵芝寺避暑因携茶具汎湖共成十绝 其五
1085329,元宵邻里携具就弊庐张灯辞之不获因成一绝
487852,病后伯华仁甫汝存携酒见访 其一
591101,薛万钟由生员改充从予入朝将归携轴乞诗爰书勉之二首 其一
148729,中秋途中·携孥犹胜旅
593155,子深用晦携酒同宗良孔阳饯送分得书字
108770,次韵无咎阎子常携琴八村
438963,客有自关辅来言秦民之东徙者馀数十万口携持负戴络绎山谷间昼餐无糗糒夕休无室庐饥羸暴露滨死无几间有为秦声写去国之情者其始则历亮而宛转若有所诉焉少则幽抑而悽厉若诉而怒焉及其放也呜呜焉愔愔焉极其情之所之又若弗能任焉者噫秦予父母国也而客言如是闻之悲不可禁乃为作商歌十章倚其声以纾予怀且俾后之歌者知秦风之所自焉 其九
693255,蒋伯瑞梁仲玉皆余十年前知交也碧水圭峰相去百里一别数载乃得把臂长安缘亦悭矣时伯瑞兄假携仲玉先还余以选事稍阻不意行次姑苏复得联舟而济会又何奇也绸缪几月剖袂珠江销魂如何聊赋二绝
324470,见访·渡湘千里忆分携
357787,还乡有作·孑孑携家反故园
1027041,八月十四日携家泛月次韵 其一
884991,草堂诸陈同游崧山精舍冕仲携琴先归用壁间韵 其一
569970,请告杜门大司成张公少宗伯赵公学士余公携觞见枉分韵得桑字
634266,甲寅九月张南村携其所选风怀访友江上限韵索送予旅人也亦见采及
612325,夏日翊文载酒携玉姬集湛碧唱余竹林小记新曲是夕翊文留玉宿森兰堂赋以调之
682407,癸巳九日同焦弱侯周季平吴会甫董玄宰林咨伯庄得全六太史携酒兴德寺后池台
280748,摸鱼儿·记分携十年一梦
537817,莫参政子良张山人携饮天宁寺作 其一
674832,三月二十五日懋鲁携酒东园看花
89092,溪庵放言·客子相过有携
612400,镜园秋杪芙蓉盛开黎美周再携酒过赏凌澹兮韩煦仲周石林彭洞虚修六上人共集流觞得霞字
533925,请告后沈刑部顾中舍张光禄秦参军朱文学汪茅二山人携酒过讯
147510,去年访曾幼卿通判携歌舞者同游凤山仆有歌舞
1093565,昌甫携儿侄载酒来送分韵得房字
769366,仆妇李氏随余六七年今为家大嫂凤仪夫人携往盛京因成十韵以畀之
1217602,阳明洞丁元善尊师携酒招省郎穆萨君过余夜饮
706174,五日携攽儿同子直洎贤从哲仲小饮分得端字
881630,浣溪沙 其五 政和壬辰正月豫章龟潭作，时徐师川、洪驹父、汪彦章携酒来作别
626979,三吴山愚翁先生晚喜禅学辛酉秋繇闽入粤访金抚军携其小照坐立二图及海内诸公题赞出以相示予曰立坐者人得见而题之矣其不立不坐者将何居先生笑而不答因作四言三章而括以七绝书之卷末求质正焉 其四
363520,携家从允迪借居鸬鹚源上沈必先侍御有诗宠其行次韵并呈二公
531751,八美诗八章章八句美同馆八君子也分携眷恋聊宣别情云尔 其三 葛黄门
469970,暑夜孝若携伎饮长桥上同诸从踏月歌
405685,送Ｏ。Ｅ。君携兰归国
716051,携公新栖仙掌峰诗以赠之 其三
1131341,八月十四日携家泛月次韵
160509,徐秘校携酒池上同赋
332972,蝶恋花·依约年时携手处
690468,恩诏赐复冠带县大夫雨中携酒赐贺赋此呈谢
453244,携子清越登凤凰岭戏题二首 其二
336529,雪后北墙·携儿聊作北墙行
351964,广右无笔刘子思携一束来择其尤者作字但如此它日中州有笔当爱惜也
1103764,己亥重九夜归篝灯独酌因思乙未岁是日陪余敬可携赵定庵马宁卿王叔文云隐二三道伴登芝山驻接仙亭蔬盘果食清谈竟日今诸道萍散而敬可九原不可作对酒凄然殆无以为怀也
937663,满江红 其三 雨后携家游西湖，荷花盛开
28732,杂题·棋局长携上钓船
910056,赵令畤德麟作襄阳从事丁丑季冬出行南山三邑某同谢公定曾仲成潘仲宝携酒自大悲寺登舟过岘山宿鹿门明日复自岘首目送缘绝壁而往上船山下相与酌酒而去德麟赋诗次韵和之
481164,元日喜郑山人携子见访
604999,园中黄花盛开携诸小妇赏之醉中戏笔
336608,次韵相之见过口占雪中新句且许约季共携山谷书伯时画过敝庐
367035,许练师携手求题
349519,戊寅年二月侍母携弟由安庆赴江宁十三岁作
610475,除夕携演春乐部过张伯起幼于昆仲园亭把玩腊梅残菊席上同赋三首 其一
1004840,以昌黎验长常携尺为韵赋笋五首 其二
526322,春日顾吏部武祥张兵部惟静携酒过息园重辱佳篇漫谢一首
676677,陈道复舟访遂携同泛二首 其二
612315,元夕镜园集诸词客醉后携妓行歌鼓吹前导遍历九衢闻鸡始散得三首 其二
570926,大宗伯徐公携阿倩见饯娄江命赋之得二绝
512593,赵民部梦麟王廷信符用愚诸公携酒会饮涵虚楼民部索诗遂有此作
227261,寻胜·老子携筇杖
900562,张子渊携二子西归求予诗为赋此以致乡党之义
403619,木兰花慢 己卯贱辰，诸朋旧携酒见存，就登凤坪绝顶，诸公并有佳构。余既客峨眉四月，寒山落木，倍切归怀，率赋此解以应
834097,百字令 其一 花朝日两大人携家游五榕山，渡江遇雨，小憩山侧观音阁，归，用忠雅堂体赋二词
133342,度周卿携司马公送蒲中舍诗小程先生谒傅长宫
96184,寄曾运使·携诗十载旧登门
537552,孟夏上谷署中梦客携商山四皓图令余赋之
776631,题行箧内所携米海岳各帖戏效渔洋论诗绝句
1113482,灵芝寺避暑因携茶具汎湖共成十绝
356626,八声甘州·更不须携酒看黄花
156756,水调歌头·上马趣携酒
142865,邛杖次韵·槎使携归饷老人
530218,辛未中秋携张逸人僧龙玉升显东明西湖泛月吹笛饮酒登望湖亭扶醉漫兴
732947,春日郊行携子骧作
290760,暮春携酒登见山楼遇族侄凌沧
249953,白晓东携诗冒雪访余未遇数日后白以诗见示勉次原韵
192982,苏寺丞维甫知简州阳安县兼携家之任
6458,携琴酒寻阎防崇济寺所居僧院
310339,法华寺·谁携厨馔访烟萝
432539,携眷渡厦，舟泊淡水，偕妻子入台北城竟日，归舟记之
413649,代山人谢寓医携米来访 其一
590765,立春史州守白江携酒招同诸僚佐城楼
884737,好事近 其三 子权携酒与弟侄相访作
1030826,淳熙戊戌将命广东侍亲携孥十一月至安仁留云锦驿一宿而去时晋卿侄偕行后二十三年分阃桂林晋卿主馀干簿复以是月来会于此把盏道旧为之怆然因成一诗示晋卿
519478,携琴访友画
862861,和谹父携家南坡期以招客
673128,乙丑二月一日泊晚刘承华见约携酒殽同饯刘廷宣地官宁夏送赏
1207947,九日诸生携酒至城东看菊
1086228,提舶携具过云榭知宗出示和章复用韵 其二
594046,陈膳部子寿朱计部子得携酒见过得留字
1086887,三月十六日龟巢观月渭师携宠同赏后两日大雨复作景卢有诗同其韵
179600,江岸茅舍傍古梅奇甚携酒即之
1128310,以昌黎验长常携尺为韵赋笋五首
114692,十二月十九日夜中发鄂渚晓泊汉阳亲旧携酒追
83933,病思·行携驯鹿寄消摇
561495,暮春广陵往观宗伯湛公甘泉山精舍马赵二户曹携酒至同酌 其二
281414,闻悔之病，携妓骆云莲走访，醉中赋赠
460260,南歌子　携酒春游，中怀有念，悲喜无端，词以纪之 其二
1050752,陈老父携茶见访因留小饮二首 其二
146518,山中即事·携壶藉草醉斜阳
139114,括苍陈与叟携所撰春秋义例见过书于卷后
612072,庚申孟冬韩孟郁年兄游罗浮归携诸词客过访留宿紫烟楼赋
564867,贱降前一日俞厚庵暨沃泉携酒饮予舟中即席奉谢二首 其一
562174,癸丑元日喜雪因携酒过来青堂招诸生共饮
160135,携家·携家经月尚羁程
160135,携家·携家经月尚羁程
490284,孙朴居携酒东林玩月二首 其一
375136,别李子源·分携二十年
922328,海南人不作寒食，而以上巳上冢。予携一瓢酒，寻诸生，皆出矣。独老符秀才在，因与饮，至醉。符盖儋人之安贫守静者也
1007571,客来得邻人携酒共饮
377031,次韵和酬·扫携绿野村边去
161573,次韵李仲永携诗相别
686823,伯襄太史携同似公赞夫代骧定国再过观梅时梅先开者飘落几尽止从山畔得一株太史方惘然不知梅开近皆两度也此事已三年矣是在梅花主人为之纪事
911451,刘上舍携酒有诗和其韵 其一
861586,次韵胡元龙携诗相访
720302,送查三容携家入楚便往滇中
721671,汪学博携饮罗湖
165396,渊明携酒图
1234833,岁初喜大人回自岭南遂携儿谔北行送之 其二
776630,题行箧内所携米海岳各帖戏效渔洋论诗绝句
799503,余与晋卿往来数月既尽读其诗歌骈文墨子之属最后又得读其古文益服其无所不能携至保定视吾师吾师叹嗟焉七月余将南还晋卿别以诗和之得卅四韵
612298,七夕祁伊吾携酒镜池泛舟遇微雨
608794,黄行父携酒见过而雨骤至
905190,庚戌仲春携小子访别晦翁过亲友江清卿之门其嗣子尚幼不果见次早道经江清卿墓下怅然有怀
697292,直指叶公以高堂大耋累疏陈情爰自孟冬移节苕上不佞分忝州民遇隆国士分庭抗席迥出形骸睽携在兹眷恋弥剧河梁握别情见乎词二首
89557,挽唐伯玉常卿·久欲携莼鲫
451997,甲申六月十四日王震宇兄携先师槐庵夫子大人诗稿索跋
624128,黄昆父携具邀同黎缜之邓伯乔黄元生梁羲年李伯襄李仲伟李良父黄元礼李珏仲龙池社集分赋体得五言古韵得一先
1246861,九月十日命次儿文凤携琴谒张仲贤知县是晚宿澄塘兰若同吴德渊文凤联句以叙阳关别意云
952245,卢守携酒过薛直老草堂次韵
313098,齐天乐·七月既望，王俊庭、王际云同携酒肴偕应子乘、魏文古诸人集饮余亭玩月，拈此
547383,暮抵吴家渡杨令君携酒宿王户部别业
512256,送龙克温还金陵时携侄袭百户职
826638,念奴娇·春母赴西湖，折园中海棠一枝，携随行箧。曼睩柔仪，与一枕云山相骀荡也
370349,邢大声广声于去非携酒约解元衡毕叔文及蕃过陈叔尹值叔尹之出成四十字
447669,弟容容自合肥雪夜驱车携妻子来晤三叠前韵
167837,草堂诸陈同游崧山精舍冕仲携琴先归用壁间韵
937932,张迪功携诗见过次韵谢之二首 其一
770241,携诗视石遗出门为风吹去属有所思竟勿觉也
483494,骑骊行食所携松实枕枣以适
210866,山行·瘦藤惭愧肯相携
102356,夜直玉堂携李之仪端叔诗百余首读至夜半书其
281045,次韵·珍重携锄槛外栽
962372,畅伯圭父子下第归乡携嗣由广文书并手佳章宠贶正旧读程门遗书知有潜道者列由求之间今见伯圭父子姓名不胜惊喜因问家世出处果潜道近族遂用其韵反其意出鄙语以谢庶几朋友相与切磋之义也
544661,蚤春雪后携尊小楼独坐因忆客岁同三君子舟中饮乐甚也辄赋四韵寄麟洲公并柬张彭二丈
227201,醵饮刘园·随意携盘馔
531753,八美诗八章章八句美同馆八君子也分携眷恋聊宣别情云尔 其五 杨中允
438962,客有自关辅来言秦民之东徙者馀数十万口携持负戴络绎山谷间昼餐无糗糒夕休无室庐饥羸暴露滨死无几间有为秦声写去国之情者其始则历亮而宛转若有所诉焉少则幽抑而悽厉若诉而怒焉及其放也呜呜焉愔愔焉极其情之所之又若弗能任焉者噫秦予父母国也而客言如是闻之悲不可禁乃为作商歌十章倚其声以纾予怀且俾后之歌者知秦风之所自焉 其八
649116,胡祭酒宅秋菊盛开仆携酒就赏胡有诗因次其韵 其一
375775,尼童携无象书求疏
591846,始至京师姚元白黎惟敬携酒夜过得春字
343837,携李钟佽飞为尊慈项孺人乞言为寿
708793,卜算子  伊璜再携歌姬过
