727410,守风不行而船得泊岸浦仙去之安福内人触动悲怀余无以慰之乃携之游滕王阁各为长歌一篇以取欢
997989,携家游倭松
243116,留诗为别·已作分携计
622644,孙蜚莪宋尔孚携酒琴过从得榴字是日夏尽
768590,瑶华慢 高澹人内翰入直南书房，上手摘白石榴一枚赐之，舍人尝不敢竟携归，命友人作半榴图，因题卷末
81350,灌园·少携一剑行天下
593308,是夜雨后郭建初陈忠甫程无过复携酒玩月显恩精舍
948552,永新贺升卿携中原六图相过其论古名将出师道路形势可指诸掌为赋此诗
385483,别母舅·女甥携抱远相从
723005,与崔录事别兼叙携手诗
509000,壬申岁暮预约同寅余公新正郊游值霖雨闷甚正月三日因携壶独酌贡院池亭怅然有怀
1185113,徐侍郎素未相识时携酒命馔兼命诸诗客同访会稽山居
612326,陈古民表弟新居落成夏日携歌者载酒庆之和古民作
498371,长至前一日霜月甚冷饮于先孝斋头俄而醉矣睡矣端己韬仲孝先频呼不觉继以扶携拥掖余竟颓然其时僮仆无一人从者韬仲卒倩一客负余以归且行歌相送直至余居呼吾儿起置余于所坐胡床覆以被裘而后去四鼓始醒儿云若此因纪以一诗志友生之志爱云
722679,家大人携客山行集忍草庵时谢守夔之命已八年矣忧时感事情见乎辞率赋四诗以记
902433,甲辰仲冬八日元衡携两诗过访及归次韵酬送后篇兼寄张武子 其二
284337,携明道游玉皇山
691224,七夕后二日承晓湘家门侄自东官携同门诸子佳什见寄因答四韵
531863,黄月溪太守归自京师得脱风涛之险携酒往南园饯之醉中赋此
1193821,携仙箓九首
184796,置酒签厅观荷徐判官携家酿
479140,谢顾良弼李世贤携酒过访（五月晦）
542136,敬轩诚轩携酒见过西岩西池同赋
1001996,前仁和郑大夫载酒携文过我妙山逆旅中
979586,阎子常携琴入村
728925,哈萨克陪臣到因携观广陵风景
150856,叶仲修令其子携所作求诗
573498,饮小修所携惠泉 其三
491874,过王氏南园看竹刘以和携酒至共酌林间 其一
206753,游吴蜀·携得筇枝背得琴
557220,元美自塞上归暂驻城西携酒出视
250245,辛卯孟夏海楼兄携女儿心莲来京盘桓数日时心莲才考中国美附中赋诗以赠
533705,张司理羽王将之雷阳携酒见过招姚元白苏子川吴化卿欧桢伯黄定甫同集
545181,陈长洲杨吴县访曲水园幼于携尊夜集以河阳花作县秋浦玉为人拈韵余得花字时二明府皆将入觐并以赠行
741323,余性爱琴某山人有旧藏古琴四其最佳者为赵松雪故物许自南中携赠诗以速之
911512,清贞褚道士携罗丈唱和访余求诗予非能诗者辞不获力拙次韵能不以狂斐疵我否
744788,携蒋子山塘访石道人
703567,大翁携来诸物俱典尽各赋一绝 琴
522452,南村约庵相携为北野先生八十寿自今岁一行之赋此为例十一月二十九日也
488091,雨中诸君子携歌者过饮草堂醉后赋此 其一
189642,水龙吟·乱花丛里曾携手
347390,庚寅正月十六携家入山大雪弥旬止既月叔祖东
883110,秋日程伯玉携诗见过次韵
153609,送裕师骨·去年石上君携我
978341,丙申二月既望仲退再来山中意行谈旧送别怅望寄两绝句其一云别君乌石冈头路一树梨花照晚烟总是旧来携手处东风回首十三年其二云入山不远六七里老我应行千百回昨日与君谈未了今朝策蹇又重来读之黯然次韵用谢 其一
488092,雨中诸君子携歌者过饮草堂醉后赋此 其二
524421,新买东庄宾友携酒往看十绝句 其二
1124942,丙申二月既望仲退再来山中意行谈旧送别怅望寄两绝句其一云别君乌石冈头路一树梨花照晚烟总是旧来携手处东风回首十三年其二云入山不远六七里老我应行千百回昨日与君谈未了今朝策蹇又重来读之黯然次韵用谢
400468,八声甘州 携琴海畔，秋深夜阑，万籁俱寂，冷然清响，不知人间何世也
752074,初冬携舟至平水溪口由望仙桥入宝严寺夜宿澄公房 其一
998779,黄石榴吾里所未有仆始携自中都植之二年方著花明洁可爱异于他榴 其二
948131,万安韦邦彦字俊臣携王民瞻杨廷秀谢昌国绝句相过次韵勉之 其二
1214928,高荣禄筑南城别墅，苍松老柏，异花时果，蔚然成林。公与夫人乘小车，携二孙，来往其间。徵余赋，遂次杜公何将军山林十首云 其六
879415,甘州/八声甘州 余客燕山，心传曾君携日观葡萄见示，辄倚玉田甘州韵，形容墨妙之万一云
524429,新买东庄宾友携酒往看十绝句 其十
255931,途中书事·老稚扶携访熟乡
228621,清贞褚道士携罗丈唱和访余求诗予非能诗者辞
872809,志师自通州访我于仪真因携之至长芦留语数日及其归也作诗以送之
150894,余有仲子之戚九日亲故携酒访我於梅山之上因
510626,碧玉楼昼梦扶病出游村径甚适忽安福罗进士携彭秀才来访遂书以赠之
608702,正月三日黎惟仁诸公携酒见过得供字
683338,莫参政子良张山人携饮天宁寺作
325553,绮罗香·玉壶山人为余作美人拜月图数年矣携之行箧再付装池漫题此阕
491071,家弟归自秣陵携酒同登虎邱
709005,摸鱼儿  陈用亶尧夫携尊济武寓中同集叠前韵
316578,对镜·孤山与我偶相携
587974,赵东台携酒过访诗以谢之
411477,故友赠予藤杖一枝，携行逾十载，几次遗失，为之怅惘不置，赋此悼之
726231,初春携内人行戏诗
1078222,闻建寇逼境携家将由乐沙县以如剑浦
1214208,庞眉黄冠方外奇士也携山水图求售知余不纳必欲求诗
591093,水原高子携无锡邵母贞节卷至留都示予援笔书之
897496,壬午正月望夜赴临汝宿襄城古驿县有古寺家人辈夜往焚香襄城古邑也可以眺二室地爽垲退之所谓颍水嵩山豁眼明者癸未元夕谪居齐安携家游定惠妙圆承天下大云东禅盖出雨夜有感示秬秸
381757,八月六日携炳垂二子登晴川阁
883067,到荆州春物正佳枢使王公招宴欢甚已而幕府诸公携饯荆江亭并成四诗 其四
873548,致明携酒来云际
331606,海上得孔雀六鹦鹉十馀携归遗童稚辈戏成二绝句
783245,立秋日携近诗过天峰饮
569533,程京兆汝懋视余少长别燕中者三十年矣余自郧入留棘谓得相从而竟以言罢方成一诗奉怀适太学张恒思携画索寄漫题于首
1072277,携家从允迪借居鸬鹚源上沈必先侍御有诗宠其行次韵并呈二公二首 其二
569656,傅公瑕携丽人梅花新居贻书自辨而诗有晚得新交萼绿华语盖指梅也且索和章赋此驳之并用志嘲
573348,携尊江上 其二
539319,助甫携见甫过郧镇留饮喜赠
603301,贱辰承吕维师徐献和李宗诚曾舜徵袁季友诸省丈及罗布衣汝存携酒见过集杜
479138,次韵世贤和供字韵之作约顾良弼携酒来慰
570031,顾仲韩携酒船相送倾倒尤深因赠仲韩并及张长舆朱氏三子
1164807,携琴酒寻阎防崇济寺所居僧院
225583,咏史·五湖范蠡携西子
97677,斯远徐兄携李丈子永去冬江上诗卷来成四十字
422065,携眷渡厦，舟泊淡水，偕妻子入台北城竟日，归舟记之 其一
300508,水调歌头·携手来天上
510740,太夫人晚归携诸孙候于贞节桥下 其一
151628,三岩·闲携一壶酒
593495,明卿入贺携其二子至同敬美谦之出访报国寺
208738,后两日叶干携酒
219323,次郭遐龄所携张安国诗韵
296227,望江南·东瓯好，携手上河桥
371597,世昌携项平甫所和诗来叹其已逝次韵
336764,叔共出近诗百馀篇携归灯下读竟题小诗其后
189671,文英阁·都门将酒惜分携
533157,七夕约卿携酒邀过桢伯馆
663858,清明日刘黎二子携酒过访 其一
615043,张孟奇太守余士翘何邦藻二明府谢绍程车君远二茂才携酒过二馀堂即席赋谢
615390,仲夏与安国侄泛舟访伍国开兄弟因携酌前林大醉放歌
610098,方孟旋遣小杨携红缣见遗戏答
344549,山父携酒集仲木山堂因就仲木宿
86728,留别表弟方时父·忆昔分携今再闰
692246,胡祭酒宅秋菊盛开仆携酒就赏胡有诗因次其韵
293568,登城南楼·旅客携琴去不还
529944,庭实久约携酒见访不至贻诗嘲之
160100,岁杪·岁杪携家客桂林
402588,丁未生朝，世杰为祝，并携纫诗新作见示，久无消息，忽 接惠书，问访梅之讯，风雨怀人，感此投寄
205523,首春同枌友携樽过野渡访梅即席
547446,中秋同施还初文学携门下诸友汎舟南溪
1070682,迎山阁为长庆寺登览之胜暇日携觞命友屡醉其上因赋此诗
494907,赠张澹轩携子养病南归上海同年九苞乃尊也
243618,游方壶·摘胜寻幽须携壶
554261,东里学士携酒肴就菊对酌赋此酬寄
422067,携眷渡厦，舟泊淡水，偕妻子入台北城竟日，归舟记之 其三
853502,次韵李君携示唐告
458121,同前出外得辣椒一碟，极烈者也，更复携酒返班，饮中随书 其七
194689,立秋日破晓入山携枕簟睡於禅静庵中作诗
611612,泛舟次日翊文复携四妓小演湛碧蓬时暑甚不雨来献负约不至末句戏嘲之二首 其二
1190398,送山阴姚丞携妓之任兼寄山阴苏少府
978274,庚寅正月十六携家入山大雪弥旬止既月叔祖东绿翁以那知风雨夜复此对床眠分韵瑞得那眠字 其一
939106,予始生日岩叟携酒见过且有寿语赋此以谢之
138410,言老自云堂携十六大士画像见过与世间传写者
1050494,携酒就陈安国隐居小酌
422066,携眷渡厦，舟泊淡水，偕妻子入台北城竟日，归舟记之 其二
697157,次公携酒招游弇园山池登缥缈楼二首
382391,二月初八日携舅家弟妹重上大观楼
974459,潘元寿以九月十一日行莫令君领客携具泛舟饯之蕃用九日韵作诗要莫及徐丞同赋以送潘
1109268,签判承议携官酒并具殽炙晚饮桧下二首
975834,度周卿携司马公送蒲中舍诗小程先生谒傅长官刺求跋
1082158,贡士张智观登禾山白云峰绝顶爱其清旷乃结庵辟谷凡十年后遂落发法名永元绍兴三年夏访予于城中具道所以出家及携诗东游之意因作是诗以饯之
1075534,叔共出近诗百馀篇携归灯下读竟题小诗其后三首 其一
81196,怀友·酒家旗下分携久
970796,好事近 其一 雪中携酒过元长
182626,谢彦修携具见过
511391,梦长髯道士以一囊贮罗浮山携以遗予纪以绝句 其一
226024,以昌黎验长常携尺为韵赋笋
921294,上巳日，与二三子携酒出游，随所见辄作数句，明日集之为诗，故辞无伦次
721689,蔡玑先铉升携过东园看菊作
714127,再送天生携家自代返秦 其二
624031,张守戎叶太仆携妓招同万伯文梁元珍邓伯乔李烟客饮湖心亭
873815,携筇
178064,携稚子东园刈菜因书触目兼寄均州宋四阁长
53619,朱伯徽自溪南携酒至婺源山中兼示垂丝海棠醉
422071,携眷渡厦，舟泊淡水，偕妻子入台北城竟日，归舟记之 其七
296945,赠原韵·故人携手话河梁
1028110,秋雨兀坐王原庆携孙吉父菊花倡和见过有分遗之意次韵
293558,辛丑八月旧庖丁雍姓携南皮相南小画四帧索题口占应之
612397,戊辰仲秋晦前三日羊城孝廉张庸修黎美周载酒携二妓过镜园流觞听雨张孟奇冯无文及社中诸子同集用风字
1096238,梁楷画钟馗并引鹤归云际携琴过涧西三题 其一
300955,独携·风昏云翳作天容
297336,曼谷·不曾携得丹青笔
480584,文敬携叠韵诗见过且督再和去后急就一首
593169,吴仲实携酒同陆华父吴仲足方献成吴虎臣方元素汪仲嘉泛新安江得飞字
113997,同谢公定携书浴室院汶师置饭作此
521761,六月廿二日天彝生辰诸亲友携酒来贺蓼莪棠棣并感予怀因书俗语为八绝句示之 其七
905967,月夜携家筠庄露坐池上分韵得谁字
432733,代山人谢寓医携米来访
195364,袁提干挽诗·我昔携家走
300957,独携·故人风义夙相知
300266,未秋杂诗·少年携手凤城边
628070,将归北田家蒲涧携酒同诸子云峰饯别
825225,三月初五日携家人往龙华观桃花至则已谢 其三
57463,闻曰仁买田霅上携同志待予归
289577,哭沈少鹤·几度相携入醉乡
150748,出闽中·千里携定一秃翁
232007,复用前韵且约携琴寻花下之盟
118052,次韵秦观秀才携李公择书相访
572457,夏日同龚散木能者崔晦之邹伯学李子髯携妓泛舟和尚桥 其一
389921,李主簿携具为别索诗
378375,宿鹿苑·冷斋托宿自携衾
537882,礼部诸曹丈携尊万松庵
110046,泽卿兰亭考用工深矣携攻愧
996208,赵令答诗约携山妓见访
1094111,世昌携项平甫所和诗来叹其已逝次韵一首
170910,承友携琴见访
466304,同前出外得辣椒一碟，极烈者也，更复携酒返班，饮中随书
589444,平南张别驾携酒约冯次江使君同游思鹅洞舟二首 其一
1026834,徐秘校携酒过池上同赋
1057222,和陈子思马上口占令益师携茶纸赴会之作二首 其二
1050413,谢君仪携酒要客慰唁愁寂二首 其二
1039972,新定获龟继得梓漕携之赴官
1151861,慕容承携素馔见过
552023,携樽饮胡汉涵民部于杨氏园 其一
95612,程季仪沈俭夫携酒见饯于湘中馆借用季仪的次
597051,携琴访友图
205251,山行·携友行莫春
523116,夏日田居苏生携酒过
86821,有感·京携刽子丹谁颈
278971,龙坑展墓·竹篮麦饭手亲携
902570,灵芝寺避暑因携茶具汎湖共成十绝 其四
888207,十二月八日携家过因胜
1006413,携家避地 其一
404615,玉楼春·癸亥暮春，友人过沪，旋飞去。忆曩日分携，亦在落花夕照之时，风景不殊，华年难再，归途怅惘，口占小令
236126,庚戍仲春携小子访别晦翁过亲友江清卿之门
363050,菜·携筐入市价难酬
213956,寄程给事·忆昔都门手一携
603044,闰九月八日承茂才元生偕乃兄弟侄诸文士携酒见过因订九日之会
362564,重九日雨张守先携酒见过
1066833,提宫工部兄携家见过辄成律诗二首上呈 其二
122226,聞石湖海棠盛開亟携家過之三絶
902621,春日汎舟南湖因遍游近港坐间书客所携四扇 其一
623788,冬日族祖虞卿华玉携榼过淡圃家大人及从弟嘉敬实同集体赋得隈字
191029,戏子常携妓见访
180602,张迪功携诗见过次韵谢之
631081,作金携牡丹回
135977,携家再游姚江
616095,七夕后二日承晓湘家门侄自东官携同门诸子佳什见寄因答四韵 其一
1183184,屏风上各赋一物得携琴客
733886,寄张帝臣时帝臣携家住华山
778176,暗香·庚申二月粤匪肆扰，广德被陷，湖郡纂严。杭人多有迁地者。予家半在杭州，适从宣州军，匆促就道，牵衣惜别，惘惘可怜。舟中携有白石道人歌曲，中有暗香疏影两阕，即张叔夏改为红情绿意者也。偶步其韵，却寄内子
541116,携琴小图
590812,陈唐山先生携寿觞邀同罗容所邝五岭何古林林艾陵四先生东山寺谈易
861587,次韵胡连翁携诗见访
595189,秋日同杜刺史游百万湖因芙蓉盛开舣舟湖中主翁苏原山人携尊以赏之散后苏原赠以佳章遂次韵以答谢云 其三
487763,真州送林明府携家还乡 其二
95980,曾耆英自太和携所录谢民师观妙诗文副以长句
888694,言老自云堂携十六大士画像见过与世间传写者不同惊喜赞叹因成二偈 其二
593600,郑伯良张元易二光禄携酒见过得丝字
533143,李伯承将之谪所同吴约卿欧桢伯携酒过讯
1073475,吴益先携文见过以诗为谢
999283,何茂宏茂恭携酒见过复侑以诗次韵一首
723364,携手曲
273484,秋末晚眺·携筇闲步夕阳天
888354,携茶过智海
348770,携酒就陈安国隐居小酌
972286,王璠伯玉携诗见过二首 其一
544710,易侍御苏别驾蔡廉访携酒清源大雄阁饯别得才字
798048,念奴娇  送子万弟携五弟之睢阳并令二弟三弟四弟同和他日一展齐纨便成聚首也
682679,友人栽莲踰夏无花携酒雅观屡约屡移用韵戏之
1008707,拾得携苕帚赞
1116825,浣溪沙 十二月二日雨后微雪，太守徐君猷携酒见过，坐上作浣溪沙三首。明日酒醒，雪大作，又作二首
524424,新买东庄宾友携酒往看十绝句 其五
1086227,提舶携具过云榭知宗出示和章复用韵 其一
1091414,题朱德裕诗卷后丁元晖携来
173096,从伯氏携稚孺游保庆即事
973456,曾郢州携和诗见过次韵谢之
966200,用明有携酒赏梅之约久而未至复和以督之
1110835,草堂诸陈同游崧山精舍冕仲携琴先归用壁间韵
120752,呈张守·朋旧携持过陋栖
443080,携友于草庐饮茶
633069,大翁携来诸物俱典尽各赋一绝 其三 砚
714883,蔡玑先铉升携过东园看菊作 其一
902774,携杨秘监诗一编登舟因成二绝 其二
536832,邵子携同年袁鲁望诗来乞赠尊甫守中先生之作辄嗣响焉
1033347,去年访曾幼卿通判携歌舞者同游凤山仆有歌舞不容人不醉樽前方见董娇娆之句今岁到凤山又辟西隅筑堤种柳新作数亭且欲建藏书阁后堂佳丽皆屏去之矣仆嘉其志又有数语并录之 其二
1218050,次韵叶训导元旦携诗见访
570799,畲宗汉令君谢全椒事归作汗漫游者二十载曩岁以四律寄我方在斋居不能为和今岁复携七绝句见赠一谈而别辄依数报之 其三
843007,黄忠端画所见古松为长卷作记七章载集中杨抟九孝廉尝携报国寺四松应天郊坛二松来京予题有诗后九年又出天台东西九松属题盖先德所藏已分为二中更豪夺近始索回案诸原记尚缺包山以下三章不知落谁手矣
70726,点绛唇·背剑携筇
1220369,清明日同学士李惟中赵子期及国学官携酒东岳宫后园看杏花 其三
176763,客来得邻人携酒共饮
586375,小儿元履携家赴任饶庠诗以示意
265571,侄庄携何陋居集苏庵集诗读之感赋
903266,茂洪奉亲携妾迁新馆戏赠
238270,卢守携酒过薛直老草堂次韵
819885,九日同俞觚庵其侄伯刚朱棣卿马卓群陆澍斋徐肖研许姬传七伯父觉先弟儿子邦荣邦直共十二人携酒肴至龙井登高
307434,八月十四夜携家泛南溪晨至小雄山斋晚归诗以纪之
887679,惜黄花慢 其二 次吴江小泊，夜饮僧窗惜别，邦人赵簿携小妓侑尊，连歌数阕，皆清真词。酒尽，已四鼓，赋比词饯尹梅津
552214,闰中秋夜田御宿大参携樽饮余映碧园 其一
613696,将之五羊羽甫家兄携酒同诸子话别
972437,早到超果寺示成父且约归日携家来游
910299,题北岩定林院方丈戊戌正月二十四日携诸童稚来游藉草而饮既醉书方丈小垣以去 其二
278957,乱后携家人登黄岐山亭共饭侣云寺
447624,游无锡蠡园，传范蠡携西施隐于此 其二
510479,湛民泽携诸生游圭峰甚适奉寄小诗呈文定上人 其四
251098,妻为儿买龟种于瓦盆今携至护国寺放生戏题
817751,白沙先生书“心贺诗卷”，为柯廷言尹阳江时，祠宋太傅张世杰墓于赤坎作也。秋枚十馀年前得于海上。壬戌三月，携置北来，以值归之陈子援庵。为志一诗于后
1099182,游东山国庆院院有明月堂白云轩土人云明月白云谢太傅所携妓小字也此出于李白忆东山诗特纪一时景色王性之记中直言明月白云二堂是太傅旧迹又误矣因成一绝以识之
1120772,黄文若携秦别驾侍儿像见过戏题二绝
810836,曹升六谢千仞携酒过饮宋牧仲张杞园亦至同赋长句
1132170,去年访曾幼卿通判携歌舞者同游凤山仆有歌舞不容人不醉樽前方见董娇娆之句今岁到凤山又辟西隅筑堤种柳新作数亭且欲建藏书阁后堂佳丽皆屏去之矣仆嘉其志又有数语并录之
1036082,浣溪沙 十二月二日雨后微雪，太守徐君猷携酒见过，坐上作浣溪沙三首。明日酒醒，雪大作，又作二首 其二
593424,莫肇襄携酒夜过听冯文在弹琴
1094257,昌甫携渭南诗见过
147571,赵苇江与东嘉诗社诸君游一日携吟卷见过一语
48482,文敬携叠韵诗见过且督再和去后急就一首
8485,云安九日郑十八携酒陪诸公宴
863446,岁除日同年冯中允携觞见访因而沉醉病酒三日醒而偶题
533784,元夕前偕梁舍人思伯携酒过余伯祥旅寓邀周潘刘黄诸子同集
863023,壬戌立冬十月十一日陪路文周朋携禔祖同访后山道人庵道人出就庵烹茶庵外采菊拾橡实以归偶成即事 其一
612314,元夕镜园集诸词客醉后携妓行歌鼓吹前导遍历九衢闻鸡始散得三首 其一
661217,罗二守复携酒送至新闸
186716,张子囦携二子西归求予诗为赋此以致乡党之义
1064376,次韵郤子中学句游岳山携怪石归
592078,雨夜郑驾部携酒同过黎司封宅时司封已擢广西参藩
311837,四月七日与荣显弟携儿女辈为亡妻及瑛妹扫墓
1066980,陪亚仲游习家池不携妓偶作二首 其二
469927,过吴门访沈野范汭携酒至因赋
613858,春夜世立携客过访息庐 其二
1220367,清明日同学士李惟中赵子期及国学官携酒东岳宫后园看杏花 其一
1115065,刘上舍携酒有诗和其韵
465331,满庭芳 次夜，携佩仙女郎偕诸君饮珊洲。
815601,辛丑八月旧庖丁雍姓携南皮相南小画四帧索题口占应之
773550,题行箧内所携米海岳各帖戏效渔洋论诗绝句
561494,暮春广陵往观宗伯湛公甘泉山精舍马赵二户曹携酒至同酌 其一
842795,八月十四夜携家泛南溪晨至小雄山斋晚归诗以纪之 其二
825226,三月初五日携家人往龙华观桃花至则已谢 其四
1089161,广右无笔刘子思携一束来择其尤者作字但如此它日中州有笔当爱惜也
347983,携茶访徐彦醇助教
670516,除夕魏使君携长君及黄山人见过同赋
849328,小山游翠峰寺携枕席寄宿僧堂僧甚多而不与人相接戏成
320639,送友人·携手北梁道
212272,晚自东湖携藉花归儿辈争插盆池香艳不歇亦供
500778,壬辰清明日客有携酒城东邀陈致中谢行可程子舟马希穆及余游月盘洞天偶遇张文泰遂同饮欢甚行可以老杜清明二诗次韵纪事因就韵赋 其二
1004837,以昌黎验长常携尺为韵赋笋五首 其五
615592,过携李陈当时明府招饮烟雨楼 其一
910300,题北岩定林院方丈戊戌正月二十四日携诸童稚来游藉草而饮既醉书方丈小垣以去 其一
533161,伯常携酒过访僦居
807709,望湘人  秋日过准提庵访石公上人时上人初自都门归携有纬云弟家讯
1074785,次韵次卿携酒见过
66815,赠友·与子分携后
494997,送少司成鲁振之先生谢病携其子侄归竟陵十六韵
49228,诸公携酒苏台饯别醉归海上作此奉谢
1077838,叔易得水晶笔格赋诗见寄因次其韵顷与叔易奕而胜得其铜兽炉制度甚古携行常置几案间今此格宜以赠远与炉为伴故卒章及之
540151,秋日官舍无事携元白长庆集阅一遍题此二绝句后置之箧中矣 其一
604529,恩诏赐复冠带县大夫雨中携酒赐贺赋此呈谢 其三
831285,水调歌头 其一 九日，与顾印伯携榼渡江，饮王病山斋中。和稼轩九日韵，赠印伯
1108208,李佐国携致中赠别诗来戏成二首
175965,致明携酒来云际
131768,见寄·随意提携容易率
1156437,病假中庞少尹携鱼酒相过
652355,池上纳凉履方履中二侄挟琴携酒索临禊帖醉后并示堚儿
1093228,昨日过沈兄无隐邂逅杨溥子亦来溥子携酒就无隐饮余酒行颇虐病不胜焉席间先逸作诗道谢意
132167,杨侍郎之侄有文刘左史之娅靖之携文见过
591871,七夕约卿携酒惟敬同过得凉字
1134385,九月八日宾旸携酒西斋晚登秀亭次前韵 其二
752075,初冬携舟至平水溪口由望仙桥入宝严寺夜宿澄公房 其二
737930,暮春访汪玉山太守求是斋出欧阳圭斋送王都转长律横卷适朱上舍携春桥草堂图册索题即用圭斋韵应之
493599,泊徐州洪乡人有携酒相饷者喜而赋此
134945,八月十四日携家泛月次韵
1144338,余将南归燕赵诸公子携妓把酒饯别醉中作把酒听歌行
773559,题行箧内所携米海岳各帖戏效渔洋论诗绝句
904687,杨德彝立春日携诗远访次韵
236242,志师自通州访我於仪真因携之至长芦留语数日
209895,携家游南山
607768,端阳幕中喜彭祁连自大鹏携酒过酌因示兵略酒阑诸部献俘至
470276,沈端伯陆仲飞携酒过碧云庵
815780,闻客生昆仲入粤，予子法祖随焉。鉴在、蕴修、坤丞应相携同去，予独留滞闽乡，诗以写怀
593530,王符卿敬美携酒同石廷尉拱辰见过
590253,庚子夏初携二儿府试湆溪早发
311492,临江仙·惠君携两儿归长沙，寄泊无所，书此慰之
626568,送查伊璜携妓还西陵
156254,周梅所携正仲再和书韵见示次韵报之
574104,雪中赏红梅奉次涯翁先生时邃翁携酒共饮怀麓堂二首 其二
438961,客有自关辅来言秦民之东徙者馀数十万口携持负戴络绎山谷间昼餐无糗糒夕休无室庐饥羸暴露滨死无几间有为秦声写去国之情者其始则历亮而宛转若有所诉焉少则幽抑而悽厉若诉而怒焉及其放也呜呜焉愔愔焉极其情之所之又若弗能任焉者噫秦予父母国也而客言如是闻之悲不可禁乃为作商歌十章倚其声以纾予怀且俾后之歌者知秦风之所自焉 其七
488497,九日登苍翠阁值郑九携酒至
1249178,余与杨君铁崖别两年矣庚寅嘉平之朔君自淞泖过余溪上适永嘉曹新民自武林至相与饮酒芝云堂明日铁崖将赴任曹君亦有茂异之举同往武林信欢会之甚难而分携之独易安可不痛饮尽兴以洗此愦愦之怀因以对酒当歌为韵赋诗如左于匡庐属瑛序数语为识
479960,闻曰仁买田霅上携同志待予归二首 其一
