756893,丁未仲冬携钵渡江喜过深翠山房巢民先生出小影索题赋赠
651789,夏夜邑学士友携酒共话
371479,题司马寺丞约汪倅赵倅携酒相过涧亭
181031,西轩书事·千里空携一影来
329479,寄邓师厚·茅屋分携但偶然
330744,三月十一日独寓经阁民先元发商叟见过纵步长廊因至旼师房爱其洁雅携棋瀹茗竟日而归因成鄙句
348289,携酒见过·酒味年来美
274962,薛又洲携杖山行图
1000763,置酒签厅观荷徐判官携家酿四首 其一
440730,妻为儿买龟种于瓦盆今携至护国寺放生戏题一首
947298,元夕同社众携灯上山谒神祠
697008,仲嘉携酌过箕台四首末篇怀汪献于
402393,临江仙 游西湖遇雨避一别墅亭中先有一人携丽于雨中吹笛情景如画词以记之
612141,中元日刘觐国携生鱼过小署对酌赋
648250,己酉元夕偕行俭学夔公绪百鍊并携稻秫市中观灯遂过退庵小酌即席赋诗得谁字
1036083,浣溪沙 十二月二日雨后微雪，太守徐君猷携酒见过，坐上作浣溪沙三首。明日酒醒，雪大作，又作二首 其三
727556,方靖民杨巨源携樽过余寓斋小饮
1214744,庚辰四月廿日赴谢氏馆吴季良携酒为别
1006412,携家避地 其二
587975,苏见江携酒过访诗以谢之
453243,携子清越登凤凰岭戏题二首 其一
61251,除夜·远宦携家任路歧
1212428,泊白鱮江尘外亭高道士携琴相访
595188,秋日同杜刺史游百万湖因芙蓉盛开舣舟湖中主翁苏原山人携尊以赏之散后苏原赠以佳章遂次韵以答谢云 其二
1139362,和夏南麓绣斧曾驱当道狼及答尹存吾喻仁山携诗相过值出
667390,九月十一日北野携酌徐元大池亭宴集
140636,甲辰仲冬八日元衡携两诗过访及归次韵酬送后
303276,山花子·未到分携已断肠
267643,三姝媚·瞻园约为西山之游，寒阴殢人，屡阻携屐，雪后引眺，赋此代简
601779,清远道中朱荆玉携酒同弟学张懋纬承宰承藻承衮送至东林寺
373435,霅上·玉人携手弄秋英
542296,张二守鸣远携酒夜过禅房率尔赋赠
562316,辛亥岁烧灯日张彦皋携酒相过与杨鸣鹤丁一鹤陈仲谋及诸门生十有二人共饮回以笙歌归院落灯火下楼台分韵赋诗余得归字
603058,初冬日承黄四茂才君甫元生元醴伯守黄苏欧八文士元昌元玉元佩元庸伯起伯安廷魁能见携李英偕赴吴茂才子赞之约即席同赋轻字韵
790106,七月初五，夜梦一老人，携登亭台，饮予以酒，命咏二绝。时酒气在喉，残镫映窗，披衣记此 其一
211837,金缕曲/贺新郎·携手登高赋
509970,九日诸生携酒饮白沙醉中和答 其三
1134411,八月二十日赵西湖携酒夜醒二更记事 其一
95297,呈潘文叔·岳寺分携后
416075,月夜偕冯大携酒宝光寺院前畅饮醉后得长句一章以答之
1055946,大暑不可逃偶携数友过湖上因咏老杜槐叶冷淘句凡十人以君王纳凉晚此味亦时须得须字
255739,阳光又给我慈爱的提携
770592,葛沽苏庄道中携马兰归种湜亭
348729,元舆携酒见过
853500,次韵张录携书见过 其一
948320,郑准广文赴官九江携予真索赞
1061543,寇彦时自历下归携古铁刀白石压尺见赠因以二诗答之 其二 古铁刀
357777,提宫工部兄携家见过辄成律诗
1155677,携酒往朗之庄居同饮
1062963,九月二十六日韩弼夫与十九娘赴官郢州之京山携家出饯于城南郝氏之园席上作小诗送韩儿侄咸和
971006,从礼折花携具见过且赋二诗 其二
1075058,次韵魏宗明携酒小集
490294,早夏日东滨携酒肴拉予辈过西皋草堂聚饮
978342,丙申二月既望仲退再来山中意行谈旧送别怅望寄两绝句其一云别君乌石冈头路一树梨花照晚烟总是旧来携手处东风回首十三年其二云入山不远六七里老我应行千百回昨日与君谈未了今朝策蹇又重来读之黯然次韵用谢 其二
807285,满庭芳  谈长益携具招游八公岩
438956,客有自关辅来言秦民之东徙者馀数十万口携持负戴络绎山谷间昼餐无糗糒夕休无室庐饥羸暴露滨死无几间有为秦声写去国之情者其始则历亮而宛转若有所诉焉少则幽抑而悽厉若诉而怒焉及其放也呜呜焉愔愔焉极其情之所之又若弗能任焉者噫秦予父母国也而客言如是闻之悲不可禁乃为作商歌十章倚其声以纾予怀且俾后之歌者知秦风之所自焉 其二
1143385,大名元复初郎中携示感遇五言八章次韵并陈东平曹子贞编修蓟丘曹克明 其八
985290,传言玉女 五月四日孙佥判四昆仲携具稽古堂观竞渡有作
403965,玉楼春·丙辰春荣远携凡儿去金陵小住，适天安门事件波及江南，雨花台畔，亦掀起悼念周总理风潮。函告所见，因赋
545576,重九前一夕宗鲁携具泛舟中流月光澄彻千里如练命北部乐人合丝竹二奚童以南音佐之丙夜改席登台畅饮主客咸潦倒濡首复泛舟奏乐而归二首 其二
161575,次韵胡元龙携诗相访
510729,菊节后五日丁明府彦诚携酒来饮白沙社赋补会 其一
884422,后两日叶干携酒
707206,晓同叔直出寺拂读朱菊水所携谭友夏岳记
55653,洵美濒行携歌姬过山中言别阻雨不赴因简以诗
245549,携家游东园
973792,比见愚卿于庐陵出示杨谨仲诗卷中及其弟鲁卿问其所在云携琴往岳麓度夏今日见杨谨仲又云其弟卓卿近过此奉其母往游洪之西山回途游阁皂乃归尔余方困于道途有叹于其人作诗须到吉示愚卿及二君云
509968,九日诸生携酒饮白沙醉中和答 其一
7781,元宵灯谜·朝罢谁携两袖烟
569792,甲申中秋夕成伯寅叔孟嘉复携酒弇园楚人李惟祯来不疑辈在焉颇具歌吹之乐得一首
208172,和自然·南北三年一解携
18925,忆晦叔·游山弄水携诗卷
1156843,松江亭携乐观渔宴宿
173421,携稚幼看桃花·人面看花花笑人
1027039,八月十四日携家泛月次韵 其三
842796,八月十四夜携家泛南溪晨至小雄山斋晚归诗以纪之 其三
720819,东风第一枝  送张君携假返杭州
179237,周可大携子入山读书
63805,元日喜郑山人携子见访
675532,冬日友人携酒至留饮
345549,到象州寓行衙太守陈容德携酒见过
548453,暑夜同沈飞霞山人携具朱虚谷舟中分得中字
19395,长斋月满携酒先与梦得对酌醉中同赴令公之宴戏赠梦得
561062,永州城西朝阳岩踞湘水上景号奇绝太守何君携酒岩上
937153,携瘿尊醉梅花下
611928,丙辰七夕盂山池馆携妓泛舟
371961,十三夜携杯浮桥看月
755836,携忠儿归甬上别外子
531756,八美诗八章章八句美同馆八君子也分携眷恋聊宣别情云尔 其八 王太史
155577,林明府携所和诗见过次韵奉酬
911712,詹世显老丈舂米为赠时有张老之子携其父诗求月助即以詹米转馈之詹丈以诗送米和其诗
163986,用光弟携儿送于南定
787803,宾于将返武康以所携笋蔬麦餈见赠赋此送之 其二
1106803,壬戌立冬十月十一日陪路文周朋携禔祖同访后山道人庵道人出就庵烹茶庵外采菊拾橡实以归偶成即事
1095853,永嘉壁书记携诸公诗卷索语
174896,李彭元携曾吉甫诗卷数帖见过
274755,携六弟至遁庵兄处夜话
256644,游青莲·闲携方外友
699585,携尊江上
658626,八月十六夜匏庵携酒过宜晚轩 其一
603944,携李王文学伯仲饮予西湖谈烟雨楼之胜因偕会稽王道坚登之
1154644,携仙箓九首 其九
1137975,昨携拙稿呈康使君郢正以诗促之
833940,洞仙歌 七夕后二日携玉可泛舟葑门荷荡观白莲，遇雨，用东坡韵连句纪游二首 其一
636198,送周生携儿归省
1116054,陪诸公携酒山家用壁间韵三首
888194,携家游南山
545285,次日复携酒酌山堂晴眺再题壁之左方
1214929,高荣禄筑南城别墅，苍松老柏，异花时果，蔚然成林。公与夫人乘小车，携二孙，来往其间。徵余赋，遂次杜公何将军山林十首云 其七
414696,独携五首 其四
327647,玉京洞·秉烛携筇步步前
402700,甲辰除夕前，大雪，携侄女诗华自锦石负米归古塘桥，感赋
485424,乡友携酒至舍下
522165,生日三江石潭携酒见过且以诗补寿六十次韵为谢 其二
121758,吴节推赵杨子曹器远赵子野携具用韵谢之
677193,吴门送徐令公携家白下
543877,仲嘉携酌过箕台四首末篇怀汪献于 其二
1155618,喜裴涛使君携诗见访醉中戏赠
479961,闻曰仁买田霅上携同志待予归二首 其二
854975,题琳老所携二苏书帖
521757,六月廿二日天彝生辰诸亲友携酒来贺蓼莪棠棣并感予怀因书俗语为八绝句示之 其三
832857,三姝媚 瞻园约为西山之游，寒阴殢人，屡阻携屐，雪后引眺，赋此代简
612398,冯无文过访居停栖霞阁携令弟瞻初诗扇投赠步韵奉酬
1050412,谢君仪携酒要客慰唁愁寂二首 其一
459573,醉欲访肖，车将至，匆匆草此携往 其二
296288,锦堂春慢·咏恭邸萃锦园海棠，分韵得携字
43623,孟传是携其长郎北游余于九江遇之喜赠
920948,携妓乐游张山人园
949939,品令 其一 重九前一日，飞卿携酒相过，坐中歌空青送客词，因用其韵。是日淮上贼军退舍
844320,戊申正月携妓访槐庭，慰其丧妾
918215,陪诸公携酒山家用壁间韵三首 其二
498488,孝先韬仲过存病榻携具为欢予于枕上劝酬笑谈弥日乐而咏之 其二
1072642,春日携頔子同刘养正教授游净国寺至李家园
114970,南安试院无酒饮周道辅自赣上携一榼时时对酌
1076214,文若自华亭携家来游西湖袖出新诗其归乃和前篇聊以当别
812615,过汪北鱼香南斋时，携琴僧墨隐、画史吴冠英，游大小石湾，久待不归，赋此却寄四首
1068803,曾徽言学士求赋所蓄端砚曾尝避乱海陵家赀尽没于贼独携此砚脱去
1033949,去年访曾幼卿通判携歌舞者同游凤山仆有歌舞不容人不醉樽前方见董娇娆之句今岁到凤山又辟西隅筑堤种柳新作数亭且欲建藏书阁后堂佳丽皆屏去之矣仆嘉其志又有数语并录之 其一
627217,舟发珠江承诸子携酒饯送用前韵赋别
438959,客有自关辅来言秦民之东徙者馀数十万口携持负戴络绎山谷间昼餐无糗糒夕休无室庐饥羸暴露滨死无几间有为秦声写去国之情者其始则历亮而宛转若有所诉焉少则幽抑而悽厉若诉而怒焉及其放也呜呜焉愔愔焉极其情之所之又若弗能任焉者噫秦予父母国也而客言如是闻之悲不可禁乃为作商歌十章倚其声以纾予怀且俾后之歌者知秦风之所自焉 其五
114053,又戏题下岩·往往携家来托宿
668777,病中承次河携樽过访
781425,闻客生昆仲入粤，予子法祖随焉。鉴在、蕴修、坤丞应相携同去，予独留滞闽乡，诗以写怀 其二
634309,铁源赵典闱见访奉赠一律同入花田携二章见赠用予原韵即于花田叠詶其意 其一
604530,恩诏赐复冠带县大夫雨中携酒赐贺赋此呈谢 其四
351210,毅夫即事·谢安携妓是清游
612316,元夕镜园集诸词客醉后携妓行歌鼓吹前导遍历九衢闻鸡始散得三首 其三
691590,甲子元日试笔作画兼题二绝句示家弟无垢是岁予五十将携家至武林有别业在皋亭桃花坞中山水佳处也
740781,泰西画人物田舍一幅自蜀携来十余年矣重加装潢以诗志之
474220,姚匡叔以道术为用晦诸王上客携其书来访惓惓七子之盛有感而赠
747994,正月十四日作三绝句即书子何所携明周服卿梅花卷后时子何将行矣 其一
443366,暮秋携佩儿香山看红叶
413523,携明道游玉皇山二首选一
773556,题行箧内所携米海岳各帖戏效渔洋论诗绝句
445153,黔中行吟 其十一 仰老携吾等过道丰城殊熠亦自南昌至
1092945,二十五日文蔚携酒饵夜同访郑教授
613921,秋日徐子靖携区余诸子过访溪上
70442,颍亭留别·故人重分携
990505,渊明携酒图
333723,泛雪厅·月团携下九重天
1168667,詶中都小吏携斗酒双鱼于逆旅见赠
64244,过汉浦塘有感·往岁携妻子
1139514,萱径携筇
1093753,九日破晓携儿侄上前山伫立佳甚
352017,龟龄携具同景卢嘉叟饯别于荐福即席再用韵赋四客诗
475136,幻于携酌南馆
201618,寄公辟·念昔都门手一携
993961,迁居亲戚携酒见过
140599,灵芝寺避暑因携茶具汎湖共成十绝
292958,乱离·急装携妇挈儿行
921295,刘监仓家煎米粉作饼子，余云为甚酥。潘邠老家造逡巡酒，余饮之，云莫作醋，错著水来否？后数日，携家饮郊外，因作小诗戏刘公，求之二首 其二
184801,携家酿·休看红药咏翻阶
558891,士龙携二孙同弱侯过余解粽 其四
1066547,蒙莫伯镕饷酒携即菁村元举山庄赏菊坐客皆称叹以诗二首谢 其一
852010,文领相仍意虑烦浊聊携野策独访山园因睹霜柏亭残梅忆公向时有诗酒之惠感物成诗缮写拜呈知府龙图谏议吴公
902773,携杨秘监诗一编登舟因成二绝 其一
817410,壬申三月三日李眉山招同人万柳塘修禊宁王喜闻其盛亲携杯茗肴核以助雅游
831878,戊申正月携妓访槐庭，慰其丧妾 其二
360611,春日携客游武夷
1556,陈仓别陇州司户李维深·京国自携手，同途欣解颐
1072564,六月上浣陪王元勃舍人携客游青原山周秀实通判作韵语纪一时胜集奉次元韵
965842,和赵庙欲携尊赏残梅二绝 其二
1061665,建炎己酉冬自婺女携家至临海岁首泛舟憩天柱精舍谒吴君文叟山林感泉石之胜叹城邑之人沈酣势利不知山中之乐也
578231,题携琴访友图
902562,灵芝寺避暑因携茶具汎湖共成十绝 其一
685600,元夕镜园集诸词客醉后携妓行歌鼓吹前导遍历九衢闻鸡始散得三首
191758,携客过王提举园访梅刘连州以诗来因用其韵
90869,中秋前一夕携酒与子仁侄登多稼亭
721916,携公新栖仙掌峰诗以赠之
413520,周生明道，萧山周家湖人，家贫失学，致力于医，居恒一卷自随，且性耽吟韵，见余诗慕其为人，毅然携所作诗稿过访，殷殷下问立身治学之道，于其还萧，得四绝示之选二 其一
956538,但能之提刑相别十年自曲江远寄二诗叙旧良厚次韵为谢亦以首章奉怀略道湘南分携故事末篇自述年来衰病不复故吾也 其二
531754,八美诗八章章八句美同馆八君子也分携眷恋聊宣别情云尔 其六 廖太史
436145,中秋之夕封生仲坚卫生行之携酒与诗见过各依韵以答 其一
452434,癸巳寒食前二日蝴蝶会七期赏山谷诗和轩携朱竹垞手绘松石延龄图助兴试步山谷快阁韵以记
695842,罗京兆携酒以歌者过吴氏池亭三首
884582,方提干有端石砚池狭不能容水予携以归令匠者广之疑其不返也书来见督以诗解嘲
716052,携公新栖仙掌峰诗以赠之 其四
570803,畲宗汉令君谢全椒事归作汗漫游者二十载曩岁以四律寄我方在斋居不能为和今岁复携七绝句见赠一谈而别辄依数报之 其七
324105,赠汤元亨·汤子亲携宝鉴囊
902622,春日汎舟南湖因遍游近港坐间书客所携四扇 其四
256725,九日济之君祥仲宽子昂携酒于汉臣
45923,送OE君携兰归国
911569,郑宁夫携诗什访余并有赠篇闻其浙右之行诗以送
131187,山居避难·患难合扶携
608619,癸巳九日同焦弱侯周季平吴会甫董玄宰林咨伯庄得全六太史携酒兴德寺后池台 其二
1066979,陪亚仲游习家池不携妓偶作二首 其一
956539,但能之提刑相别十年自曲江远寄二诗叙旧良厚次韵为谢亦以首章奉怀略道湘南分携故事末篇自述年来衰病不复故吾也 其一
523811,菊时一种数本其一逾秋独妍爰及至日黄华韡然当庭见者骇叹携酒来赏予赋二诗 其二
1086663,次日宏父携家出游而小雨新晴
521756,六月廿二日天彝生辰诸亲友携酒来贺蓼莪棠棣并感予怀因书俗语为八绝句示之 其二
155602,黄石榴吾里所未有仆始携自中都植之二年方着
860431,詹林宗携文见过一首
996192,南安试院无酒饮周道辅自赣上携一榼时时对酌惟恐尽试毕仆夫言尚有馀樽木芙蓉盛开戏呈道辅
746872,王秋垞子梅携酒见过同酌黄叶堆中
539096,周银台汝学携酒净海寺贻诗见赠时余适有太仆之除落句云云遂成答谢
918216,陪诸公携酒山家用壁间韵三首 其一
934489,携一尊寻春湖上
862744,壬戌立冬十月十一日陪路文周朋携禔祖同访后山道人庵道人出就庵烹茶庵外采菊拾橡实以归偶成即事 其二
720466,家大人携客山行集忍草庵时谢守夔之命已八年矣忧时感事情见乎辞率赋四诗以记 其二
526456,高吏部公次奏绩自大江携弟入荆州却赴京师
438964,客有自关辅来言秦民之东徙者馀数十万口携持负戴络绎山谷间昼餐无糗糒夕休无室庐饥羸暴露滨死无几间有为秦声写去国之情者其始则历亮而宛转若有所诉焉少则幽抑而悽厉若诉而怒焉及其放也呜呜焉愔愔焉极其情之所之又若弗能任焉者噫秦予父母国也而客言如是闻之悲不可禁乃为作商歌十章倚其声以纾予怀且俾后之歌者知秦风之所自焉 其十
432940,周生明道，萧山周家湖人，家贫失学，致力于医，居恒一卷自随，且性耽吟韵，见余诗慕其为人，毅然携所作诗稿过访，殷殷下问立身治学之道，于其还萧，得四绝示之选二
562644,游山寺寺僧携卷求诗因次人韵
350062,菊·携锄亲种费思量
567618,五十生辰吴景长携诸子弟饷予圜中
38520,赠琴客·曾携五老峰前过
704358,郭方伯应宿至自南中止广惠寺同刘观察仲脩携酒奉讯
592004,雷比部携酒同古比部夜过得何字
342493,愁雨·襆被携人卧上方
110202,十三日纳合道僧携印来降
357379,双双燕·予携度儿来粤节届立秋矣燕子方营巢于寓室之楣怜而赋此
543991,秋日溪南晚眺适赵生携酒共酌村店中
614532,王尧韭持怪石数颗置盘池中云自楚江携来者
452660,日前颇闷赋眼花耳热之句自遣未成今军持兄携留社丛刊邀饮既别忽念前句因足为一首兼呈军持并留社诸子
673969,七夕寓湖州市吴汝美水亭沈集古杨宗汉携酒至
581041,客携使交诗过读次韵赠湛民泽
655897,携小儿方家坪拜先陇
594474,吴参知明卿东游泊舟江上同李临淮惟寅方比部子及李司封于田周山人文美李小侯汝藩携酒访之分得孤字
123667,全守支耀卿饮饯七里倅杨仲宣复携具至深溪酌
308266,和石遗天宁寺荒台登高，携酒对饮
918674,次韵朱同人携妓见访留题
247893,蓦山溪·戊申初夏携浩江过陈村镇二十四湾
497772,送李行素携子东阳编修茶陵访祖
290529,余性爱琴某山人有旧藏古琴四其最佳者为赵松雪故物许自南中携赠诗以速之
542282,同李元博携酒访岐南道人
1138516,余将南归燕赵诸公子携妓把酒饯别醉中作把酒听歌行 其一
1222878,善之携酒招游西湖值雷雨分韵得杯字
697179,秋日同邦相明府敬承太史集郑氏园亭薄暮携酒登大云山二首
613973,余方营剩溪梁子鱼携诗过访喜而有赠
843290,四月十四日招秦伯虞邓熙之陈雨生并携琴师王耀先泛舟秦淮
612975,闰十五夜携两儿暨诸弟侄同孔聘王苏昌期何景朗李邑生就酌三弟宅分得台字
849209,首春同枌友携樽过野渡访梅即席 其一
763632,念奴娇 其九 “念奴娇·舟中携酒同西樵送荔裳入都”
194105,铨携具赏石渠酴醾用坡韵呈同舍
100960,陈州与文郎逸民饮别携手河堤上作此诗
282879,菩萨蛮·扬帆携梦江湖客
593797,雪中同诸僚携酒过马伯懋宅
1121744,赠临江简寿玉二首简携王仲显使君书来谒并示孔毅甫梦蟾图今庙堂五府皆有题字
1027367,夫人携家泛湖
244166,詹林宗携文见过
604257,戊午腊月立春日携诸小妇及幼稚儿孙从游西园戏笔
305508,癸酉元日携儿辈登鸡鸣寺奇寒中人归得纕蘅诗次均却寄
922123,二月十九日，携白酒、鲈鱼过詹使君，食槐叶冷淘
1235778,岁初喜大人回自岭南遂携儿谔北行送之
590312,承郭易庵陈守愚邹柏窗邹静轩四老携酒过访话旧乐甚赋此答之
657246,借住刘宸宠小斋姚彦襄庚尧枉顾兼携酒榼
175903,李佐国携致中赠别诗来戏成
1078031,海上得孔雀六鹦鹉十馀携归遗童稚辈戏成二绝句 其一
1043261,签判承议携官酒并具殽炙晚饮桧下二首 其二
1185897,携新文诣张籍韩愈途中成
651260,刘广文携酒饯行
130223,枕石·短簟相携入薜萝
306792,丁未生朝，世杰为祝，并携纫诗新作见示
521755,六月廿二日天彝生辰诸亲友携酒来贺蓼莪棠棣并感予怀因书俗语为八绝句示之 其一
531257,十二月二日张龙山谢高泉敖梅坡余九崖杜晴江梁一江潘东溪携酒过访高峣
297955,水盂吾家旧物也从侄自故里携来感而得句
362772,望华亭·日晡携酒上危亭
587981,乡回东台见江携酒过饮为别次韵
949146,迎春乐 双调携妓
1251899,庚戍正月仆有金陵之行而商翁将归高安同舟至湄湘留数日不能相违夜宿王氏甥西斋吹箫酌酒为别夫倾盖相逢犹有分携之感况平生故人耶书此以见眷恋之情耳
410581,晓浦携两姬游虎邱冷香阁看残梅值雪有作和之
1120841,王兴周以苏养直诗见借今日偶携至直舍且诵且已自喜亦自笑也为题三诗因效其体
417853,金缕曲 携手
673145,题天章携琴访友图
112333,村舍柳·邮亭折尽为分携
163719,辉父道携酒相伴饮飞赴寺四望亭
944175,携襄阳诗卷示子孙再次韵
611610,夏日罗翊文携歌者镜园泛舟
1143381,大名元复初郎中携示感遇五言八章次韵并陈东平曹子贞编修蓟丘曹克明 其四
200407,昨携拙稿呈康使君郢正以诗促之
806886,醉乡春 秦对岩携具寄畅园举填词第三集
1143846,九月八日宾旸携酒西斋晚登秀亭次前韵
785028,题画 其五 携琴图
201430,左举善人物高妙才具敏特要当为世用而乃携孥
543696,仲秋同祝鸣皋诸文学再游西山得诗四首天 其四 携尊翠微阁晚坐
861275,次韵李仲永携诗相别
279547,鬲溪梅令·强携春困软酲扶
973452,斯远徐兄携李丈子永去冬江上诗卷来成四十字寄李
348437,休师携茶相过
594299,秋日宋西宁忠父黄孝廉白仲李山人次公携酒过访得秋字
1050742,次韵元舆十绝 休师携茶相过二首 其一
34339,清明日·他皆携酒寻芳去
437509,上巳游西园分韵得兰字与杨礼部携同院诸公赋二首 其二
1210077,携妓泛舟遇雨
783995,都中喜晤宝山侄携眷自蜀归省并应顺天乡试二首 其二
540067,李主簿携具为别索诗 其一
1072465,张持操携徐献之侍郎书见访兼出示著述中兴论诸杂文为赋诗一篇以文轴还之他日亦录寄献之也
1050743,次韵元舆十绝 休师携茶相过二首 其二
1000761,置酒签厅观荷徐判官携家酿四首 其三
1116668,刘监仓家煎米粉作饼子，余云为甚酥。潘邠老家造逡巡酒，余饮之，云莫作醋，错著水来否？后数日，携家饮郊外，因作小诗戏刘公，求之二首
603066,吴茂才子赞偕黄欧六文士携酒见过雅集
500777,壬辰清明日客有携酒城东邀陈致中谢行可程子舟马希穆及余游月盘洞天偶遇张文泰遂同饮欢甚行可以老杜清明二诗次韵纪事因就韵赋 其一
1001234,携茶访杨东山
998671,老僧携筇竹杖来试就求之欣然举以见赠
511405,题携琴访友图
445689,孟秋毗陵之什 其一 携蕙若纫霞立中并晨儿游天目湖长歌以志
543431,秋日携尊城东大寺山作
333932,食蟹·溪友提携紫蟹肥
925736,玉楼春 其二 客有游山者，忘携具，以词来索酒，用韵以答。时余有事不往
966144,携酒访奇父小酌竹斋以诗来谢次其韵
472530,新昌莲峰吕山人夜携鱼酒过访丘中因有此作
381444,三月初五日携家人往龙华观桃花至则已谢
817243,汉阳登晴川阁至归元池小憩出寺访莲花堤散步携亢止一酒家小饮复过月湖堤上琴台
1093842,携秉垓千散步
1103411,春日携客游武夷
966418,中秋前一夕携家步至北湖藉缛草久之和东坡湖上听琴韵
848624,癸酉仲夏自□道□华严山主正师上人□□相遇今忽至止且云□□□□□□携酒□□□□□□□□□□□□□□
39225,四言赠兄秀才入军诗·携我好仇
41606,赋得携手上河梁应诏诗
619586,何龙友将入京携同瑞昆诸子过余信宿席上分赋得寒云
884420,华干携茶入园晚坐柔桑下
564814,中秋夜携酒访戴东滨
1124108,从礼折花携具见过且赋二诗
147087,得早梅一枝携访酒家
621502,何象冈相君携同泛舟送李定夫
48515,幽怀·懒携行杖踏莓苔
616537,黎美周燕归携峨嵋僧过访出新诗见赠和答
510983,西良容君携孙来访
1065144,戊戌岁元日梦云庵携登塔问答甚多觉而忘之作此
243268,行吟·独行沙岸不相携
228332,古乐府·携君石上琴
231590,寄朋介石·诗卷前年手自携
558711,谢雍府长史携酒远饯
676347,栖霞携酒观音溪避暑同用霞字
1170534,与宣供奉携瘿尊归杏溪园联句
280976,季夏病中，喜仲衡侄携第四姬见过，即次其重题革堂韵
807522,念奴娇  周弇山携具八关斋同亦人恭士诸君子万弟快饮风雨飒至炎熇尽解词以纪事
978165,朱可翁陈西老徐灵渊携酒饯别饮罢以周兴嗣千字文中语为韵曰谓语助者且名为江上行云分得语字
614080,余将北渡梁澹明潘寰瀛林华东三公饯之海门诸生各携具追送王尧韭林公毅郑圣符信宿招提平明始别比余阻风白沙眷怀雅谊寄此别章
