91964,和萧伯和韵
470615,闲居寄沈伯和博士（时伯和将之京应贡举）
470615,闲居寄沈伯和博士（时伯和将之京应贡举）
131732,次韵董伯和镫夕有感
912864,夜闻萧伯和与子上弟读书
973448,寒食前一日伯永相约过陈氏茅轩蕃亦载酒共往与者常宁尉曹明叔伯和蕃赋诗
1057195,和欧阳伯和见寄
1214287,次韵陈伯和
915082,己亥正月二日送李伯和提干归豫章
864126,简章伯和
135245,送李伯和吏部提举浙东伯珍寺丞将漕夔门
1051587,欧阳伯和仲纯挽词二首 其二
1221231,姚伯和所藏五马图
968944,送伯和侄归里之戍
347601,挽欧阳伯和
1111079,挽欧阳伯和三首
856706,虞美人 其一 和姚伯和
152230,初春岩桂着花诗人太和令君首赋佳篇才臣伯和
117964,欧阳伯和仲纯挽词
973540,蕃有诗谢萧伯和见访伯和和之节推丈见而同作谨用韵并呈教授丈宋衡兄
973540,蕃有诗谢萧伯和见访伯和和之节推丈见而同作谨用韵并呈教授丈宋衡兄
1078862,次韵王周伯和应文诗
1114593,景伯正字招东郊观梅晚集茶院秀远堂举之舍弟有诗景伯和章见简同赋
97152,过吉水问萧伯和兄弟云在县四十里之罗陂远不
884150,瑞鹤仙 寿秦伯和侍郎
131731,次韵董伯和·事难言处只长吁
206085,陈伯和和经字韵复以为报
347454,和欧阳伯和见寄
174227,寄王褒伯和明举韵
1209079,题淞江夏伯和自怡悦斋
945202,次韵董伯和镫夕有感二首 其二
1115269,留萧伯和仲和小饮二首
1119894,次韵董伯和镫夕有感二首
409060,惺伯和前韵叠而答之
984995,寄王褒伯和明举韵二首 其一
945458,董伯和竹溪寓居
1078349,申伯和篇举叔易自代叔诗复推申伯要之二子皆当由此科取重名于世恨吾资妄高不得偕二子鸣跃其间复次前韵以兼勉之
1116989,欧阳伯和仲纯挽词二首
907614,陈伯和和经字韵复以为报
94535,已亥正月二日送李伯和提干归豫章
527195,赠潘大参伯和
945688,送董伯和西归
972565,过吉水问萧伯和兄弟云在县四十里之罗陂远不及见以诗寄之并呈仲和
502218,同董伯和登砂子岭观圣潭瀑布
908583,景伯正字招东郊观梅晚集茶院秀远堂举之舍弟有诗景伯和章见简同赋 其一
928070,伯和见过
436269,伯和告别北迈欲得一言以资行橐惓惓之意盖不能违也病卧中殊无好怀漫以此赠
358730,伯和见过·参军跋马瘴江滨
864123,答章伯和问疾
1027742,送李伯和吏部提举浙东伯珍寺丞将漕夔门
273363,惺伯和前韵叠而答之
130991,董伯和竹溪寓居
924814,欧阳伯和仲纯挽词二首 其一
92202,留萧伯和仲和小饮·谁曾白月上青天
984994,寄王褒伯和明举韵二首 其二
1125740,寄王褒伯和明举韵二首
168061,简章伯和
1214347,次韵陈伯和
657268,和司马提学倡和诗韵 来教谓寻梅之约已订然不知此中梅易得否李贞伯和章虽有相寻不难之句然亦约莫之言耳故更和一章问尚文土人云昶为贞伯解围遂亦不揣和奉一章然亦不知更为约莫之言否也 其三
908586,景伯正字招东郊观梅晚集茶院秀远堂举之舍弟有诗景伯和章见简同赋 其二
228209,送伯和侄归里之戍
1057134,挽欧阳伯和三首 其二
168036,答章伯和问疾
1185386,春日书情寄元校书伯和相国元子
143245,伯和见过
914430,和萧伯和韵
1057133,挽欧阳伯和三首 其一
352274,次韵王周伯和应文诗
10660,春日书情寄元校书伯和相国元子
945203,次韵董伯和镫夕有感二首 其一
62525,闲居寄沈伯和博士
569557,赠从孙伯和需次察幕
856707,虞美人 其二 代简督伯和借战国策
131289,送董伯和西归
91966,和萧伯和春舆
90567,留萧伯和仲和小饮
915381,和萧伯和春兴
1119997,次韵董伯和二首
502542,遁素轩为张伯和赋
914716,留萧伯和仲和小饮二首 其二
1057135,挽欧阳伯和三首 其三
94794,夜闻萧伯和与子上弟读书
97448,蕃有诗谢萧伯和见访伯和和之节推丈见而同作
97448,蕃有诗谢萧伯和见访伯和和之节推丈见而同作
914717,留萧伯和仲和小饮二首 其一
948286,初春岩桂著花诗人太和令君首赋佳篇才臣伯和仲和三友继作句法高妙不容措辞姑述四句
945200,次韵董伯和二首 其二
945201,次韵董伯和二首 其一
131730,次韵董伯和
