556954,同余德甫吴明卿王元美再游张园 其三
594469,十六夜周稚尊陆伯生臧晋叔陶懋中黄白仲宋忠甫吴孟白枉集青溪馆迟吴公择俞公临不至得关字
985834,余与吕守之买舟西归林常甫吴清淑吕伯起出饯江楼古调以别
556953,同余德甫吴明卿王元美再游张园 其二
1135038,别汪翔甫吴式贤
533631,同文寿承李伯承郭次甫吴约卿夜集思伯馆得阳字
556955,同余德甫吴明卿王元美再游张园 其四
62619,仲春廿日发瓜渚同顾使君益卿赴闽粤郭次甫吴
703862,赠同年关德甫吴用潜成进士
488658,同戴朝宾陈观甫吴潜夫陈叔理泛舟晋安城西作
219394,余与吕守之买舟西归林常甫吴清淑吕伯起出饯
610219,赠同年关德甫吴用潜成进士 其二
556956,同余德甫吴明卿王元美再游张园 其五
557022,余德甫吴明卿夜至赋得虚字
610218,赠同年关德甫吴用潜成进士 其一
694810,同余德甫吴明卿王元美再游张园
592844,寄汪德弘陆华甫吴虎臣黄定甫吴子化吴孝甫卞长卿吴叔承程良学邵长孺倪惟思十一子
592844,寄汪德弘陆华甫吴虎臣黄定甫吴子化吴孝甫卞长卿吴叔承程良学邵长孺倪惟思十一子
594578,丹阳别陆华甫吴允兆
533142,上巳雨夜王仪甫吴约卿杜从殷见过时王将外补
533611,从周移寓真如寺同张肖甫吴约卿过访
1245591,寄吴养浩甫吴时以集贤待制代祀南海会稽之神
594597,韩承志阮时济张幼于马云卿陈忠甫吴德光周懋脩钱功甫黄子华张孟彪舟送宝带桥赋别得关字
556952,同余德甫吴明卿王元美再游张园 其一
106288,别汪翔甫吴式贤
472986,仲春廿日发瓜渚同顾使君益卿赴闽粤郭次甫吴孝甫吴叔原送余京口是日值余初度记此留别
472986,仲春廿日发瓜渚同顾使君益卿赴闽粤郭次甫吴孝甫吴叔原送余京口是日值余初度记此留别
