547850,寄吴少溪宫录七十 其四十六 同冯用韫少宰登岱因送北上
592684,同冯文学汝行吴山人子充夜集许太常仲贻宅
613885,命美邀同冯载赓集空可亭
807299,满庭芳  汴梁客舍同冯蓼庵夜坐，蓼庵出梁溪闺秀永愁人诗稿示余，凄然赋此
669084,同冯比部集贤膳部草堂得心字
53386,四月一日曹常侍园看花同冯用韫葛仲明二馆丈
592359,始至江都学舍适逢新秋京口姚伯子见过同冯刘二僚长小集
542603,报国寺同冯户曹汝言昆季饯别王太守学甫得桥字
908325,同冯缙云游无为以吾独胡为在泥滓分韵赋诗得泥字
547311,同冯殿讲琢吾夜过东邻魏光禄见泉二首 其一
224730,同冯蓬州当可游中岩分韵得林字
612512,夏日潦涨弥茫同冯无文龙玄珠摇小艇出浣花溪访祁伊吾遍探梨涌幽胜逶迤曲折溪转竹深冥迷不辨东西恍惚暗窥村坞楼台半藏树杪炊烟高接霞标真觉武陵天台犹浅浅耳欲招歌者同载先已他适流莺有韵不藉丝肉鸣榔长谣沉醉而返得五言排律二十四韵
580900,同冯大尹醉归
547312,同冯殿讲琢吾夜过东邻魏光禄见泉二首 其二
703165,暮秋同冯直卿秦廷献李士美游黄花山
472013,四月一日曹常侍园看花同冯用韫葛仲明二馆丈赋 其四
542209,中秋夜潞阳旅馆同冯员外言别得分字
592160,曾比部子玉宅同冯侍御黎秘书胡礼曹夜集
382704,四月一日曹常侍园看花同冯用韫葛仲明二馆丈赋
547261,朱可大邀同冯太史饮摩诃庵南园步至钓鱼台夜眺还宿法藏精舍次日观慈寿浮图纪游四首 其四 慈寿寺阁
542234,暮秋同冯直卿秦廷献李士美游黄花山 其一
603041,霜降日同冯欧诸君子登西台
547259,朱可大邀同冯太史饮摩诃庵南园步至钓鱼台夜眺还宿法藏精舍次日观慈寿浮图纪游四首 其二 钓台
738109,春日有事学宫同冯校官登尊经阁次日雨中奉寄
383110,同冯用韫少宰登岱因送北上
179843,同冯缙云游无为以吾独胡为在泥滓分韵赋诗得
472010,四月一日曹常侍园看花同冯用韫葛仲明二馆丈赋 其一
682146,朱可大邀同冯太史饮摩诃庵南园步至钓鱼台夜眺还宿法藏精舍次日观慈寿浮图纪游四首 南园
541968,暮春晦夜同冯汝强汝言昆季饯别章行人景南使上党得光字
547258,朱可大邀同冯太史饮摩诃庵南园步至钓鱼台夜眺还宿法藏精舍次日观慈寿浮图纪游四首 其一 南园
565894,同冯明府全邑博诸君宴虞山南轩一首
502188,同冯伯昂泛舟由姑苏过吴江抵钱塘舟中有作
472012,四月一日曹常侍园看花同冯用韫葛仲明二馆丈赋 其三
867355,同冯蓬州当可游中岩分韵得林字
547260,朱可大邀同冯太史饮摩诃庵南园步至钓鱼台夜眺还宿法藏精舍次日观慈寿浮图纪游四首 其三 法藏庵
542236,暮秋同冯直卿秦廷献李士美游黄花山 其三
594586,八日同冯元敏谢少廉俞公临曹子念饮王敬美澹圃
488133,过朱宾徵馆中留酌赋赠同冯彝甫作
528557,同冯光禄登慈仁寺阁
542235,暮秋同冯直卿秦廷献李士美游黄花山 其二
673133,同冯西屏郁文渊游西山
682153,同冯殿讲琢吾夜过东邻魏光禄见泉二首
682232,四月一日曹常侍园看花同冯用韫葛仲明二馆丈赋
472011,四月一日曹常侍园看花同冯用韫葛仲明二馆丈赋 其二
591742,同冯用唯陈士鹄夜集郑克一宅
383272,同冯殿讲琢吾夜过东邻魏光禄见泉
761278,小重山 二月二日同冯笠尉江皋村行
542249,同冯汝隆万泉山
735284,东园弟招同冯又三集翛然阁感赋
