280652,白苧·谢汪舟次惠诗箑及山闻诗
735864,赠汪舟次兼怀吴野人
733503,寄倪闇公汪舟次两翰林
749239,汪舟次先生临晋唐诸帖卷 其一
314101,沁园春·忆丙寅九月八日为先子六十诞辰，客汪舟次先生家，先生张宴为寿
764336,念奴娇 其十 次韵答汪舟次
705920,寄汪舟次司训赣榆
332515,剔银灯·邓孝威、毛大可、吴庆伯、汪舟次、吴志伊、徐大文集邸中小饮
708014,剔银灯 其二 邓孝威、毛大可、吴庆伯、汪舟次、吴志伊、徐大文集邸中小饮
749240,汪舟次先生临晋唐诸帖卷 其二
769668,沁园春·忆丙寅九月八日为先子六十诞辰，客汪舟次先生家，先生张宴为寿。今己亥是日，从郡返里，追念往昔，不禁盛衰存殁之感焉。赋此兼示公有
768101,白苧 谢汪舟次惠诗箑及山闻诗
807472,念奴娇  曹顾庵王西樵邓孝威沈方邺汪舟次季希韩李云田兄散木皆有送余归阳羡词作此留别
749241,汪舟次先生临晋唐诸帖卷 其三
813959,汪舟次先生临晋唐诸帖卷
799705,送汪舟次检讨奉使册封琉球
731900,赠汪舟次兼寄吴野人
734371,五月十七日喜闻施愚山汪钝翁秦对岩钱宫声曹峨嵋乔石林李子德陈其年毛大可朱竹垞汪舟次严荪友徐胜力潘次耕李渭清方渭仁周雅楫暨家戒三诸公以鸿博制科同官翰林赋赠五十韵
261801,送汪舟次检讨奉使册封琉球
