1144238,都梁北乡士多好学有向君敏衡者一日访予语甚质气甚夷礼甚虔予心异之间为予言曰家故沅徙也今所居有溪实自沅来乃筑室聚书其上以教子弟因以沅溪书舍名之而其亭则曰无加盖其地旧号无加庄以其东止于石西止于岸南止于路北止于泉也愿有以发之予既为籀右书二颜而向君复以所谓廉崖者谂予予闻此石杰立千尺实峭厉峻削可敬可仰有类乎廉者颇思一至其处摩挲此石以激衰懦而未能也乃各为一解以谢焉
1142389,都梁北乡士多好学有向君敏衡者一日访予语甚质气甚夷礼甚虔予心异之间为予言曰家故沅徙也今所居有溪实自沅来乃筑室聚书其上以教子弟因以沅溪书舍名之而其亭则曰无加盖其地旧号无加庄以其东止于石西止于岸南止于路北止于泉也愿有以发之予既为籀右书二颜而向君复以所谓廉崖者谂予予闻此石杰立千尺实峭厉峻削可敬可仰有类乎廉者颇思一至其处摩挲此石以激衰懦而未能也乃各为一解以谢焉 其二
284995,沙先生君敏
1137476,都梁北乡士多好学有向君敏衡者一日访予语甚质气甚夷礼甚虔予心异之间为予言曰家故沅徙也今所居有溪实自沅来乃筑室聚书其上以教子弟因以沅溪书舍名之而其亭则曰无加盖其地旧号无加庄以其东止于石西止于岸南止于路北止于泉也愿有以发之予既为籀右书二颜而向君复以所谓廉崖者谂予予闻此石杰立千尺实峭厉峻削可敬可仰有类乎廉者颇思一至其处摩挲此石以激衰懦而未能也乃各为一解以谢焉 其一
236517,都梁北乡士多好学有向君敏衡者一日访予语甚
249295,赠答新草·惜君敏捷诗千首
839837,消寒五集曹远老命题拈得清字儗循旧例赋诗分赠二十三首 其十一 赠君敏先生
1137477,都梁北乡士多好学有向君敏衡者一日访予语甚质气甚夷礼甚虔予心异之间为予言曰家故沅徙也今所居有溪实自沅来乃筑室聚书其上以教子弟因以沅溪书舍名之而其亭则曰无加盖其地旧号无加庄以其东止于石西止于岸南止于路北止于泉也愿有以发之予既为籀右书二颜而向君复以所谓廉崖者谂予予闻此石杰立千尺实峭厉峻削可敬可仰有类乎廉者颇思一至其处摩挲此石以激衰懦而未能也乃各为一解以谢焉 其三
284928,赠君敏先生
839808,壬申十二月四日陶社消寒第一集分呈众览二十首 其四 沙先生君敏
