569306,空山者法门中狮子儿也俗腊半七十矣而犹童真安居羯磨精进般若前后受持经典何止十夹犹以未明心要遍拟参方诣余言别叩其所之则云将泛嘉禾抵余杭奉楗椎于月庭之席敷法具于莲池之堂然后折芦渡淮飞锡登嵩放达摩之少林壁掠文殊之金刚窟束铜固腹始归故山余蚁处一穴不能偕也姑为四韵以壮之
569395,金山上人苦行头陀行若一切无涉者得刘子威赠言数百字而犹乞余诗未已为子威所迫勉成一律老夫其尤罪魁也哉
416975,齐天乐 国难日深，客愁如织，孤愤酸情，盖有长言之而犹不足者。香港作
184230,答潘文叔见寄予十月尝访文叔许来而犹未也
569025,成化乙酉世大父郎中公捷留省遂破吾族天荒今年复为乙酉而犹子士骃入太学应试恰与大父同庚赋此期之
520407,近郭有玄都观盖禹锡看花处也种桃道士既不可见而兔葵燕麦今尚复然予山行之趣悉见于诗兹将入城而犹有玄都之兴散人好奇亦自可笑诗亦不可不留也
883184,答潘文叔见寄予十月尝访文叔文叔许来而犹未也
520359,予过造书台远怀苍颉因睹空阶鸟迹而犹讶其造书时也夫何鸟篆既远而字体变化真如浮云矣彼以俗书逞遒媚者得不知所自欤因成一绝姑以吊造书者云
307781,齐天乐·国难日深，客愁如织，孤愤酸情，盖有长言之而犹不足者
