520402,予自草堂将归过古之樊川亦有所感而不能已于言也
125695,绳水吟·水能平而不能直
1026678,苏才翁与予定林下之约今被命提点湖南刑狱恐其侵寻而不能反作诗贻之
978878,平都山硖中胜处余思欲一到而不能近得予弟书云今岁仲春尝与外兄孙长文顺流往游焉闻之不胜怅然
973380,晚坐欲过在伯而不能
539215,请太室兄为代而不能俟赋此寄怀
132781,望三叠泉谷帘泉而不能至
98708,晚坐欲过在伯而不能
570021,答赠张太学孺愿兼寄示沈嘉则屠长卿孺愿之先人为大司马公嘉则长卿俱其客且与孺愿善序其诗而不能无白首之叹故云
126295,治乱吟·天能生而不能养
996201,癸亥立春日煮茗于石池寺见庚戌中盛二十舅中叔为县时题名叹此寺不日而成哀县学弊而不能复
458460,近往龙门，仰瞻卢舍那佛，眼若有光，汪然来注，使予身心俱栗，颅顶微麻。越数日，酒中追记，而不能道其万一
810209,舟过岳阳楼，风利而不得泊，望之而不能登，怅然赋此
273815,点绛唇·鹰若客死安庆，临殁，数呼余名而不能语也
1088354,屡游庐阜欲赋一篇而不能就六月中休董役卧龙偶成此诗
658829,过黄墅沈氏阻风望洞庭甚近而不能至
199989,平都山硖中胜处余思欲一到而不能近得予弟书
1048039,教授推官出示米元章诗词翰俱美三四读而不能休敬书二十八字谢之
974916,望三叠泉谷帘泉而不能至
