196763,判府大帅督参宝谟户部先生持漕来长沙继升师
651620,中秋夜诸生持酒至二首 其二
651619,中秋夜诸生持酒至二首 其一
543588,章生持所业游余门诗勖之
546794,卧病经旬吴生持所业新诗来谒讶其精进赋赠二章 其二
697430,卧病经旬吴生持所业新诗来谒讶其精进赋赠二章
704690,中秋夜诸生持酒至二首
781181,京兆瑶峰先生持同乡常观察行述示余知公儒臣殉节风义凛然读公爱吟草又如裴晋公故里凤凰山诸什益恍然于公之学有经术平生不朽之事非慷慨捐生一端可竟也余欲出一二语为颂第念忠魂享庙食矣德政纪浣溪矣文章寿梨枣矣捃摭遗迹近于剽窃吁公逝十馀年矣西充民肖像尸祝至今不衰何以感人之深而去思之长也因作迎神曲一章代西充民歌咏之云尔
27712,贞女墓·生持节操心
451905,得徐天宁荐收溱湖田怀海先生持赠蟹油两罐以诗答谢
546793,卧病经旬吴生持所业新诗来谒讶其精进赋赠二章 其一
938796,判府大帅督参宝谟户部先生持漕节来长沙继升帅守追惟平庵先生分教是邦越四十有九年而多士尊仰说服如一日乃市地立祠以慰士心祠成门下士陈某拜手稽首而诗之曰
666919,少宗伯王瓯滨先生持节封益藩便道归省予为何爱之正郎赋赠
