849704,德寿宫古松太上爱之尝持御香酾酒祠土神以祈屏蟊贼云时绍兴壬午思陵馘亮之岁也于今百二十年矣仆生六十年后而十月八日又思陵上仙之晨感而有赋 其二
749882,送蒋恭亮之东台
516980,题朝阳读书图送吴伯亮之官武陵
700465,述谢陈亮之邦伯时自广平被召
514894,送进士陈亮之赴南京武选主事
1104839,德寿宫古松太上爱之尝持御香酾酒祠土神以祈屏蟊贼云时绍兴壬午思陵馘亮之岁也于今百二十年矣仆生六十年后而十月八日又思陵上仙之晨感而有赋
517107,送王公亮之桂林
671551,送赏元亮之官
526183,述谢陈亮之邦伯时自广平被召 其一
329252,赠李元亮之子李子
1243525,梅友公游芙蓉峰探神仙遗迹登高长啸俯视尘世然后朗吟步月而归自魏晋之下曹氏父子桓温庾亮之徒登高对月饮酒赋诗其后寂寥千年世无斯乐今公乃能以雅道继之盖庶几焉予足不至此山几年矣因公之游遂唤醒旧梦从道复出诗见示遂次韵焉
526184,述谢陈亮之邦伯时自广平被召 其二
849705,德寿宫古松太上爱之尝持御香酾酒祠土神以祈屏蟊贼云时绍兴壬午思陵馘亮之岁也于今百二十年矣仆生六十年后而十月八日又思陵上仙之晨感而有赋 其一
1080292,赠李元亮之子李子
