1222513,寅夫惠教游鼓山四诗细读如在屴崱杖屦间想像追和用坚重游之约四首 其三
1103936,丁酉正月九日省谒家叔洁山居士于郭仙峰下是日仲退亦省其叔四山翁于是偕行洁山既留饭送别乌龙潭上裴回久之绝壁梅花炯然独立如高人招之不来冻泉泠泠下岩窦如瑟筑声相顾绝赏因以春山多胜事分韵约四山父子同赋时四山留外未归也韵以齿次瑞得多字
1222511,寅夫惠教游鼓山四诗细读如在屴崱杖屦间想像追和用坚重游之约四首 其一
1222514,寅夫惠教游鼓山四诗细读如在屴崱杖屦间想像追和用坚重游之约四首 其四
1237522,寅夫惠教游鼓山四诗细读如在屴崱杖屦间想像追和用坚重游之约四首
521554,往在京师赵君希德有南游之约四月廿五风雨中忽相见于东楼留两月别去将由金陵视其侄锦衣君而归赋此为赠
138488,二月望日三七侄移庖于休休堂约四老人为送春
478511,下小茅峰行平野约四五里入玉晨观
1222512,寅夫惠教游鼓山四诗细读如在屴崱杖屦间想像追和用坚重游之约四首 其二
427960,水调歌头 一九六三年三月十五日，仲弘元帅作国际形势报告。十九日，召集座谈国际形势问题，与会者约四十人，赋此志感
888956,二月望日三七侄移庖于休休堂约四老人为送春之集拙者预一老之数因成八句
252837,贺纽约四海诗社张老社长病知期颐大庆
66906,下小茅峰行平野约四五里
