431683,阔别宜城，瞬经八载，江山依旧，人物全非，赋此抒感
1095637,唐人刘长卿送彻上人归越云禅客无心杖锡还沃洲深处草堂闲身随弊履经残雪手绽寒衣入旧山独向青山依树下空留明月在人间那堪别后长相忆云水苍苍但闲关洪义二上人请次韵归山阴
288229,长亭怨·和又点。白石自度此腔，草窗碧山依之，皆用上去韵
403982,浣溪沙·富春山依绿园杂咏 其一
687056,春日承鹏举过余林居适留龙陂山中不果会蒙寄诗三绝趣余入武山依韵奉荅
249084,生日杂咏·青山依旧夕阳忙
405385,浣溪沙·富春山依绿园杂咏
1153899,送赵真长归夏县旧山依阳徵君读书
321281,凤凰台·江山依旧昔人非
336737,齐山依小岩作观音阁
979160,贵溪徐氏招隐园昔王表避乱居此山依之者数千家其诗云逍遥入南斗者也
165737,贵溪徐氏招隐园昔王表避乱居此山依之者数千
492960,春日承鹏举过余林居适留龙陂山中不果会蒙寄诗三绝趣余入武山依韵奉荅 其三
146327,念奴娇·庐山依旧
1075327,齐山依小岩作观音阁
915852,雾中见灵山依约不真
866492,自行在解维宿长安闸下回望天竺诸山依依在目微臣去国抚事感伤因成此诗
286793,冬日游惠山依韵和棘园
416433,石州引    和东山  依星凤阁传斠本
403983,浣溪沙·富春山依绿园杂咏 其二
94137,雾中见云山依约不真
138784,云山阁·云山依旧接清秋
221950,自行在解维宿长安闸下回望天竺诸山依依在目
492958,春日承鹏举过余林居适留龙陂山中不果会蒙寄诗三绝趣余入武山依韵奉荅 其一
492959,春日承鹏举过余林居适留龙陂山中不果会蒙寄诗三绝趣余入武山依韵奉荅 其二
411446,阔别宜城，瞬经八载，江山依旧，人物全非，赋此抒感 其二
245585,万年山·依松屈曲疑无路
311727,阔别宜城，瞬经八载，江山依旧，人物全非，赋此抒感
372517,早赴坟庄·叠叠山依皱晓霞
11340,送赵真长归夏县旧山依阳征君读书
840123,冬日游惠山依韵和棘园
411445,阔别宜城，瞬经八载，江山依旧，人物全非，赋此抒感 其一
824343,长亭怨 和又点。白石自度此腔，草窗碧山依之，皆用上去韵。玉田用入韵，而稍变其格，意者宫调不相谐耳。今又点用入韵，字句则依白石。惜无善歌者一按定谱也。
