746799,壬戌五月初三夜忽中风痹之疾香山所谓体瘝目眩左足不支与有同病焉昔苻坚得习凿齿于汉南因其蹇疾裁堪半丁香山诗云汉上羸残号半人是也余年已七十可以称翁因自号半翁纪之以诗 其一
897496,壬午正月望夜赴临汝宿襄城古驿县有古寺家人辈夜往焚香襄城古邑也可以眺二室地爽垲退之所谓颍水嵩山豁眼明者癸未元夕谪居齐安携家游定惠妙圆承天下大云东禅盖出雨夜有感示秬秸
1137477,都梁北乡士多好学有向君敏衡者一日访予语甚质气甚夷礼甚虔予心异之间为予言曰家故沅徙也今所居有溪实自沅来乃筑室聚书其上以教子弟因以沅溪书舍名之而其亭则曰无加盖其地旧号无加庄以其东止于石西止于岸南止于路北止于泉也愿有以发之予既为籀右书二颜而向君复以所谓廉崖者谂予予闻此石杰立千尺实峭厉峻削可敬可仰有类乎廉者颇思一至其处摩挲此石以激衰懦而未能也乃各为一解以谢焉 其三
906950,予往来秦熙汧陇间不啻十数年时闻下里之歌远近相继和高下掩抑所谓其声呜呜也皆含思宛转而有馀意其辞甚陋因其调写道路所闻见犹昔人竹枝纥罗之曲以补秦之乐府云 其六
1214219,余昔年邂逅登山东卢长卿之门遂联辔游京师真所谓倾盖如故者也别六年重过其庐则已为他人屠沽肆矣因诘邻翁乃知以穷徙他所遂往访之缱绻话旧成短歌以勉之
697374,翌日吴肇成招同司马洎诸君浮筏遇雨泊梁下有挈歌姬赵某至左手三指爪皆长六寸馀司马记中所谓邯郸才人者也
855906,历阳倅蒙庵郑公卒于位记岁在丁丑与仆有交承之契方来自镇西而仆亦自安丰往邂逅于合肥驿中获为三日之款所谈无非周易太玄老庄之书开警蒙昧多矣公平生学佛行一着端的不昧所谓毫发无遗恨者仆老矣请从其后而为净土之游似不晚也作是诗以吊之 其二
906944,予往来秦熙汧陇间不啻十数年时闻下里之歌远近相继和高下掩抑所谓其声呜呜也皆含思宛转而有馀意其辞甚陋因其调写道路所闻见犹昔人竹枝纥罗之曲以补秦之乐府云 其四
1227152,读王维夷门歌尽述侯嬴朱亥之事今春侍大人官汴省得以周览城郭而遗台废圃往往瓦砾山积所谓夷门者不可复识其处而嬴亥遗迹无知之者千数百年于此矣用其意作歌续其后大德甲辰岁也
1091150,乙亥岁东游会稽谒禹陵过马臻祠下询所谓鉴湖者则已堙塞为民田因赋
1118470,楚辞所谓桂数见于唐人诗句及图画间今不复见矣作二绝句属山僧野人试求之
434641,陶君秀晋人尝为司竹监使因祖渊明尝游五柳庄为立五柳祠在县东西原方见有祠堂诗碑向禹城侯先生司竹时与扶风张明叙六曲李仲常凤翔董彦材从之学如白云楼海棠馆所谓胜游也兵后吾弟主之亦西州衣冠之幸感今慨昔不能不惘然也握手一笑知复何年敢先此以为质兼示鄠亭赵秀才 其三
842398,苏州有僧名虚生者，以诗要结善男女充报馆访员，傥亦所谓善知识也，戏题四绝句以谑之 其一
45421,或者所谓春天
698875,今来自岭海者云扶桑花也予昔所见殊不类是殆大苏所咏涓涓泣露紫含笑焰焰烧空红拂桑耳花家剪双头见寄始觉首四作之误乘酒漫成六首以赎差错插砚水瓶嫣然有笑语意岂亦怜老人之衰眊耶复取馀沥浇之当缠头耳滇蜀村歌云披蓑衣打杖头鼓风流在何处予拟答乡谚云雪落长江里依旧化作水何不落则雨却要是个底不知花神有知作何平章夜见梦云叟所谓黄连树下弹琴也
826230,菩萨蛮·卅年前与曾刚父、杨昀谷、陈石遗、罗瘿公、章曼仙、胡漱唐、赵尧生同集诗牌字为词。众剧赏上阕铜弦三句，余久忘全章。今冬偶忆前事，因足成此阕，虽所感不同，而情尘如接，真所谓感慨系之也。同人仅尧生与余在矣
174157,众香桥·标名何所谓
1142339,荷花辱于淫邪陷于老佛几千载自托根濂溪而后始得以其中通外直者侪于道而近世魏鹤山又推本周子之意取泽陂之诗所谓硕大且俨者归之君子焉明伦堂后新池骤著花教授遂见之诗且有取于周子香远之句寄兴远矣因次韵
973740,山花有所谓绕茧漆者盖缲丝藉此以取头耳
1196220,伏蒙侍郎见示蓬阁多馀暇诗十首调高情逸无以咏歌篇篇实为绝伦一一尤难次韵强率鄙思别奉五章却以秘阁清虚地为首句所谓效西子之颦也惟工拙之不同岂天壤之相接莞尔而笑其敢逃乎 其三
566902,今来自岭海者云扶桑花也予昔所见殊不类是殆大苏所咏涓涓泣露紫含笑焰焰烧空红拂桑耳花家剪双头见寄始觉首四作之误乘酒漫成六首以赎差错插砚水瓶嫣然有笑语意岂亦怜老人之衰眊耶复取馀沥浇之当缠头耳滇蜀村歌云披蓑衣打杖头鼓风流在何处予拟答乡谚云雪落长江里依旧化作水何不落则雨却要是个底不知花神有知作何平章夜见梦云叟所谓黄连树下弹琴也 其一
827359,寒食日至校，见花飞满处，古诗所谓『春城无处不飞花』，即咏五律八韵
776324,蒹葭苍苍白露为霜所谓伊人在水一方
423830,折红梅·北泉寺梅数百株，红梅居多，软红次之。绛裙缟袂，所谓萼绿者仅二三株
532862,仙鹤花异植也青跗素萼状类胎禽即嵇含草木记所谓鹤草也观自随时山人余因命舍弟为图系以此作
415466,秋夜宿扬州梅花岭，所谓十月先开岭上梅者殊未验也
845010,苏州有僧名虚生者，以诗要结善男女充报馆访员，傥亦所谓善知识也，戏题四绝句以谑之
433617,诵子苾近作十年春梦总成婆老去始知才已尽及短发乱梳头诸句感叹今昔不能入睡辄作小诗奉寄此亦少陵所谓老妻书数纸应悉未归情也二首
1051557,张惕山人即昔所谓惠思师也余旧识之于京师忽来相访茫然不复省徐自言其故戏作二小诗赠之 其二
1077753,闻山东盗所谓丁一箭者拥数万众临江破黄州官吏皆保武昌江湖间骚然未知备禦之策感而赋诗
842400,苏州有僧名虚生者，以诗要结善男女充报馆访员，傥亦所谓善知识也，戏题四绝句以谑之 其三
769100,雨霖铃·秋夜梧桐雨和徐太学今吾今吾示《雨霖铃》《新雁过妆楼》二调索和云是二十年前恒亲王邸中应教之作曾命女伶按拍歌之极谐梁邺风流至今可思因倚声和之水痕清浅犹作鸟爪伎俩所谓见猎心喜者耶
980353,通叟年兄视以柳侯庙诗三首辄亦有作所谓增来章之美也 其三
1005422,石上种剑蒲其脊成矣非陶隐居所谓溪荪者耶
422976,庐山杂诗十四首 其十一 开先寺后有读书台。杜甫诗云：“匡山读书处，头白好归来”；苏轼诗亦云：“匡山头白好归来”。余登斯台，有感其言，因为此诗。余所谓“归来”与杜苏所云不同也
256549,所谓写作
571344,已邜避地宿宜阳梦绣领二方谩云杜云采色三秋动而首尾俱忘醒念兹游不及秋而黄鸟碧云皆不晓所谓姑续成之以俟
951757,丁亥九月十六夜偕李监仓宿龙卧山中听雨看月同时事也所谓鱼与熊掌兼得之赋诗一篇以纪其事
149318,通叟年兄视以柳侯庙诗三首辄亦有作所谓增来
1055481,七言古风寄题薛公尉氏逍遥阁兼送伯成知县宣德解印当涂直书民言耳非所谓诗也
1063016,余有鉴其制如书册戏号勋业簿取子美诗所谓勋业频看鉴者马子约题诗其上云勋业簿中频点捡只添白发与苍颜和之
45459,所谓永恒
1070679,次韵元裕同游东山佳什东坡所谓爱此小天竺即其地也
780592,水调歌头 辛酉三月廿七日，移居文殊寺巷，所谓蜗角蚊睫，又足相容者也
843008,病起赋谢克礼医师君有声沪上前岁归与欧战近来京师始与余相识岂佛家所谓缘耶
855114,径山无畏老人从旁郡来解包武康观音院昨日访别云当走钱塘吴兴二郡谒林丰二主人仆怪其枯槁淡薄士当无求于世反从事于王公门墙下老人知仆意因云二公有道士我佛所谓大长者辈今佛长城在彼我当归之仆是其说作诗以饷其行老人常挂瘗鹤铭于座右自言得其行笔法又苦吟名于士大夫间屡过仆东堂饭每称吾家饭美以故并载诗中
1196219,伏蒙侍郎见示蓬阁多馀暇诗十首调高情逸无以咏歌篇篇实为绝伦一一尤难次韵强率鄙思别奉五章却以秘阁清虚地为首句所谓效西子之颦也惟工拙之不同岂天壤之相接莞尔而笑其敢逃乎 其五
992251,近有谢师厚寄襄阳柑子乃吴人所谓绿橘耳今王德言遗姑苏者十枚此真物也因以诗答
566905,今来自岭海者云扶桑花也予昔所见殊不类是殆大苏所咏涓涓泣露紫含笑焰焰烧空红拂桑耳花家剪双头见寄始觉首四作之误乘酒漫成六首以赎差错插砚水瓶嫣然有笑语意岂亦怜老人之衰眊耶复取馀沥浇之当缠头耳滇蜀村歌云披蓑衣打杖头鼓风流在何处予拟答乡谚云雪落长江里依旧化作水何不落则雨却要是个底不知花神有知作何平章夜见梦云叟所谓黄连树下弹琴也 其四
668222,小斋盆兰一干数花山谷所谓蕙也初秋抽数干芳馥可爱因与次明道复赏而赋之
977368,韩退之蓝田丞厅记所谓雁鹜者相承以为吏每切不然往往人未之信偶读吴子宽诗有雁鹜庭空之语因作此云
882425,郡守吕叔恭以甲戌季春七日游中隐岩山水膏肓之兴未已后两日再拉机宜刘子思监州朱国辅经属陈朝彦同至新洞所见愈奇真所谓倒餐甘蔗聊书五十六字
400426,满庭芳 访所谓“曹雪芹故居”
906943,予往来秦熙汧陇间不啻十数年时闻下里之歌远近相继和高下掩抑所谓其声呜呜也皆含思宛转而有馀意其辞甚陋因其调写道路所闻见犹昔人竹枝纥罗之曲以补秦之乐府云 其二
896205,予向集贤殿试罢寓居京师尝游西冈钱昌武郎中之第时同会者河东柳子文与钱氏三子夏中予出京今才半年而昔所共游者或东或西有不知所之者古人所谓俯仰之间已为陈迹者欤夫求昨日之我于今日终其身而不得而况偶然相值聚而旋散者欤追记春睡诗一首乃寓钱第所为者
264745,折红梅·北泉寺梅数百株，红梅居多，软红次之。绛裙缟袂，所谓萼绿者仅二三株
948663,李子权屡求所居江月亭浴沂斋诗老病未能作坐上示及和花妃诗甚工即席次韵一首所谓一彩两赛也
984579,正纪诞辰辄成三绝句为寿所谓寿者非世俗之寿也盖期君道学坚固将与造物者游无终始者为友而已 其一
910007,岑使君牧襄阳受代还朝某同赵德麟谢公定潘仲宝皆饯于八叠驿酒中以西王母所谓山川悠远白云自出相期不老尚能复来各人分四字为韵以送之某分得相期不老 其四
980354,通叟年兄视以柳侯庙诗三首辄亦有作所谓增来章之美也 其二
125673,十分吟·所谓十分人
514716,石城门外有巨石临水如伏虎疑即所谓石城虎踞者
434743,至新蔡寓居开元寺暇日与文伯起登经楼赋诗寺壁旧有秦少游题咏计其年尚少于此作学官当时坡谷钜公皆推重意为远到而竟不然所谓方行万里出门车折轴惜哉
906717,予往来秦熙汧陇间不啻十数年时闻下里之歌远近相继和高下掩抑所谓其声呜呜也皆含思宛转而有馀意其辞甚陋因其调写道路所闻见犹昔人竹枝纥罗之曲以补秦之乐府云 其五
1075935,次韵鲍仲山官居临大池傍鲍题以协趣取谢宣城所谓后协沧洲趣之句也
856360,彦嘉通守当今之俊伟人也余心向慕之常以未获识君为恨兹因孔纯老遂有邂逅之适其何幸如此将归纯老置酒饯别仆实预坐酒数行纯老丐诗于彦嘉以记坐上笑谈之乐顷刻扫数百言挥毫落纸云烟飞动永叔所谓盈前尽珠玑一一难简汰者殆谓是邪索鄙句不敢以固陋辞辄和北庄二诗奉呈 其一
189492,赠韩拙堂·世所谓巧
980628,通叟年兄视以柳侯庙诗三首辄亦有作所谓增来章之美也 其一
179853,吾友黄仲秉读枚乘七发至所谓洞房清宫命曰寒
157873,石上种剑蒲其脊成矣非陶隐居所谓溪荪者耶
