1144238,都梁北乡士多好学有向君敏衡者一日访予语甚质气甚夷礼甚虔予心异之间为予言曰家故沅徙也今所居有溪实自沅来乃筑室聚书其上以教子弟因以沅溪书舍名之而其亭则曰无加盖其地旧号无加庄以其东止于石西止于岸南止于路北止于泉也愿有以发之予既为籀右书二颜而向君复以所谓廉崖者谂予予闻此石杰立千尺实峭厉峻削可敬可仰有类乎廉者颇思一至其处摩挲此石以激衰懦而未能也乃各为一解以谢焉
520352,说经台之北仅一舍有祖庭焉予访重阳旧迹虽有黄冠数辈惜无可问之者然而叠阁重楼气象甚都所谓五祖七真者其亦乘云驭鹤而来憩于此耶盖不可知也予面峰峦徘徊松下恍若飞渡弱流而容与蓬山之上矣因作一诗以写幽兴云
88106,北山·所谓善鸣者
546478,翌日吴肇成招同司马洎诸君浮筏遇雨泊梁下有挈歌姬赵某至左手三指爪皆长六寸馀司马记中所谓邯郸才人者也 其一
910006,岑使君牧襄阳受代还朝某同赵德麟谢公定潘仲宝皆饯于八叠驿酒中以西王母所谓山川悠远白云自出相期不老尚能复来各人分四字为韵以送之某分得相期不老 其三
566903,今来自岭海者云扶桑花也予昔所见殊不类是殆大苏所咏涓涓泣露紫含笑焰焰烧空红拂桑耳花家剪双头见寄始觉首四作之误乘酒漫成六首以赎差错插砚水瓶嫣然有笑语意岂亦怜老人之衰眊耶复取馀沥浇之当缠头耳滇蜀村歌云披蓑衣打杖头鼓风流在何处予拟答乡谚云雪落长江里依旧化作水何不落则雨却要是个底不知花神有知作何平章夜见梦云叟所谓黄连树下弹琴也 其二
1074791,过张参军故居曲肱亭旧基在焉山谷老人名亭且有诗所谓邻鸡呼不起拥被听松风者是也
1105854,彦嘉通守当今之俊伟人也余心向慕之常以未获识君为恨兹因孔纯老遂有邂逅之适其何幸如此将归纯老置酒饯别仆实预坐酒数行纯老丐诗于彦嘉以记坐上笑谈之乐顷刻扫数百言挥毫落纸云烟飞动永叔所谓盈前尽珠玑一一难简汰者殆谓是邪索鄙句不敢以固陋辞辄和北庄二诗奉呈
1070064,同江彦文纬江仲嘉褒度菱湖岭游三衢诸山道灵真出入岩谷胜绝可骇杂然有卜筑之意然此地寥阒人所不争小隐不难致顾吾曹出处何如耳二公皆脩真养气精进不衰予晚闻此道又为忧病顿挫志倦体疲每思益友傥得静舍安馀年资二子以待老岂不乐哉作诗叙游且志本末岩谷之胜实自仲嘉发之予尝闻而赋诗所谓武陵迷汉魏妙喜断山川者也
1222661,七月六日承贞居先生远寄周钟铣间有女象凫之形则考工记所谓凫氏为钟者也击之与夷则合而是日又适立秋古物之来岂偶然哉辄成小诗拜贶之辱
746800,壬戌五月初三夜忽中风痹之疾香山所谓体瘝目眩左足不支与有同病焉昔苻坚得习凿齿于汉南因其蹇疾裁堪半丁香山诗云汉上羸残号半人是也余年已七十可以称翁因自号半翁纪之以诗 其二
858643,元珍以诗送绿石砚所谓玉堂新样者
789557,齐天乐  题张少南年丈影香词君怀才不遇，托于缘情绮靡，以纾幽抱，竹垞老人所谓空中传恨也，因本此意写之，或无戾风人之旨乎
984580,正纪诞辰辄成三绝句为寿所谓寿者非世俗之寿也盖期君道学坚固将与造物者游无终始者为友而已 其三
1142603,予家世居富山久矣世有隐德老坡所谓我家韦布三百年惟有阴功不知数盖类是也因作此以记其实且以勉族氏子弟云 其三
404822,虞美人·东篱红梅绚烂如燕支，所谓透骨红者是也。将谢矣，因忆白石尝赋潭州红，仿佛似之，又安知此花非我乡里耶
267685,声声慢·西园逭暑。园在广州提学廨，余襄公武溪集注所谓庭际罗立九曜石者也
414620,诵子苾近作十年春梦总成婆老去始知才已尽及短发乱梳头诸句感叹今昔不能入睡辄作小诗奉寄此亦少陵所谓老妻书数纸应悉未归情也二首 其一
1070576,新作纸屏隆师为作山水笔墨略到而远意有馀戏题此句末句盖取所谓柴门鸟雀噪游子千里至也
965912,二十七日立春夜雪高下尽白闽中所谓大雪也
906945,予往来秦熙汧陇间不啻十数年时闻下里之歌远近相继和高下掩抑所谓其声呜呜也皆含思宛转而有馀意其辞甚陋因其调写道路所闻见犹昔人竹枝纥罗之曲以补秦之乐府云 其九
971544,经旬不作诗今日霜晴可喜问梅沈园得两绝句此坡所谓痼疾逢虾蟹也 其二
434868,庆州北山之麓辽山陵在焉俗谓之三殿二十年前常为盗发所得不赀是所谓厚葬以致寇者叹而成诗
1082555,彦嘉通守当今之俊伟人也余心向慕之常以未获识君为恨兹因孔纯老遂有邂逅之适其何幸如此将归纯老置酒饯别仆实预坐酒数行纯老丐诗于彦嘉以记坐上笑谈之乐顷刻扫数百言挥毫落纸云烟飞动永叔所谓盈前尽珠玑一一难简汰者殆谓是邪索鄙句不敢以固陋辞辄和北庄二诗奉呈 其二
906948,予往来秦熙汧陇间不啻十数年时闻下里之歌远近相继和高下掩抑所谓其声呜呜也皆含思宛转而有馀意其辞甚陋因其调写道路所闻见犹昔人竹枝纥罗之曲以补秦之乐府云 其七
1196223,伏蒙侍郎见示蓬阁多馀暇诗十首调高情逸无以咏歌篇篇实为绝伦一一尤难次韵强率鄙思别奉五章却以秘阁清虚地为首句所谓效西子之颦也惟工拙之不同岂天壤之相接莞尔而笑其敢逃乎 其四
1080410,尤美轩在玉山县小叶村喻子才作尉时名之取欧阳文忠公醉翁亭记所谓林壑尤美望之蔚然者后数年旧轩既毁复作寺僧移轩山下汪圣锡要诗叙本末因成数句寄之
83978,楚辞所谓桂数见於唐人诗句及图画间今不复见
566906,今来自岭海者云扶桑花也予昔所见殊不类是殆大苏所咏涓涓泣露紫含笑焰焰烧空红拂桑耳花家剪双头见寄始觉首四作之误乘酒漫成六首以赎差错插砚水瓶嫣然有笑语意岂亦怜老人之衰眊耶复取馀沥浇之当缠头耳滇蜀村歌云披蓑衣打杖头鼓风流在何处予拟答乡谚云雪落长江里依旧化作水何不落则雨却要是个底不知花神有知作何平章夜见梦云叟所谓黄连树下弹琴也 其五
306313,病起赋谢克礼医师君有声沪上前岁归与欧战近来京师始与余相识岂佛家所谓缘耶
835272,暗香 潭月山房木莲花放，俗称大玉兰，实即古所谓木兰，香山诗所称木莲也
933560,食荠糁甚美盖蜀人所谓东坡羹也
566904,今来自岭海者云扶桑花也予昔所见殊不类是殆大苏所咏涓涓泣露紫含笑焰焰烧空红拂桑耳花家剪双头见寄始觉首四作之误乘酒漫成六首以赎差错插砚水瓶嫣然有笑语意岂亦怜老人之衰眊耶复取馀沥浇之当缠头耳滇蜀村歌云披蓑衣打杖头鼓风流在何处予拟答乡谚云雪落长江里依旧化作水何不落则雨却要是个底不知花神有知作何平章夜见梦云叟所谓黄连树下弹琴也 其三
119306,张惕山人即昔所谓惠思师也余旧识之於京师忽
434639,陶君秀晋人尝为司竹监使因祖渊明尝游五柳庄为立五柳祠在县东西原方见有祠堂诗碑向禹城侯先生司竹时与扶风张明叙六曲李仲常凤翔董彦材从之学如白云楼海棠馆所谓胜游也兵后吾弟主之亦西州衣冠之幸感今慨昔不能不惘然也握手一笑知复何年敢先此以为质兼示鄠亭赵秀才 其一
1105776,历阳倅蒙庵郑公卒于位记岁在丁丑与仆有交承之契方来自镇西而仆亦自安丰往邂逅于合肥驿中获为三日之款所谈无非周易太玄老庄之书开警蒙昧多矣公平生学佛行一着端的不昧所谓毫发无遗恨者仆老矣请从其后而为净土之游似不晚也作是诗以吊之
906947,予往来秦熙汧陇间不啻十数年时闻下里之歌远近相继和高下掩抑所谓其声呜呜也皆含思宛转而有馀意其辞甚陋因其调写道路所闻见犹昔人竹枝纥罗之曲以补秦之乐府云 其十
815460,壬戌五月初三夜忽中风痹之疾香山所谓体瘝目眩左足不支与有同病焉昔苻坚得习凿齿于汉南因其蹇疾裁堪半丁香山诗云汉上羸残号半人是也余年已七十可以称翁因自号半翁纪之以诗
1076444,季夏极暑正昼草木俱萎独吾坡上数君子玉立苍然傲睨自得岂杜少陵所谓脩竹不受暑者乎
128501,老景逢春每多留赏子美所谓老去原春迟子忱雅
1117158,张惕山人即昔所谓惠思师也余旧识之于京师忽来相访茫然不复省徐自言其故戏作二小诗赠之
434642,陶君秀晋人尝为司竹监使因祖渊明尝游五柳庄为立五柳祠在县东西原方见有祠堂诗碑向禹城侯先生司竹时与扶风张明叙六曲李仲常凤翔董彦材从之学如白云楼海棠馆所谓胜游也兵后吾弟主之亦西州衣冠之幸感今慨昔不能不惘然也握手一笑知复何年敢先此以为质兼示鄠亭赵秀才 其四
520392,予既游天池行半舍登所谓五台山者爱其秀丽口占一绝
459699,六月廿八午小眠梦之，然所见实别为一人，醒不待思，知即彼所隐化。弗洛伊德论梦，有所谓移置，此似差相仿佛。因述梦境，移心中而置诸纸上，或可稍解郁结乎。然予于弗氏梦说，时有不许
588374,己酉岁壬辰之夜梦与三洲李丈登高台遥望中原但见齐州九点在苍霭中隐隐可辨三洲曰宇宙内事吾儒分内事也曰子知分内之事则知尽分内之道乎三洲又曰吾今乃知居高则明处下则塞曰子知明塞之义则知尽居处之道矣三洲又曰天地山河存乎两界秦晋为首闽越为尾馀皆毛发肢节也曰子通督任之义则知通致理之源矣须臾云霞四歛皎日照衣环顾太和万物融合浑为一丸三洲曰此所谓弄丸者耶曰子知转九之义则宇宙之柄在手矣语罢而觉遂赋四章以纪其事因以赠三洲之
1196222,伏蒙侍郎见示蓬阁多馀暇诗十首调高情逸无以咏歌篇篇实为绝伦一一尤难次韵强率鄙思别奉五章却以秘阁清虚地为首句所谓效西子之颦也惟工拙之不同岂天壤之相接莞尔而笑其敢逃乎 其二
337339,过张参军故居曲肱亭旧基在焉山谷老人名亭且有诗所谓邻鸡呼不起拥被听松风者是也
520346,予经山寺爱其幽雅因留宿焉昔人所谓天下名山僧占多者信然哉所惜者世无金山长老而吾带盖不足留聊成一诗以自适云
1142602,予家世居富山久矣世有隐德老坡所谓我家韦布三百年惟有阴功不知数盖类是也因作此以记其实且以勉族氏子弟云 其二
104447,近有谢师厚寄襄阳柑子乃吴人所谓绿橘耳今王
1091629,题宣书记塞门积雪图此图真柳子厚所谓千山鸟飞绝万径人踪灭者若孤舟蓑笠翁独钓寒江雪则以余诗见之
842401,苏州有僧名虚生者，以诗要结善男女充报馆访员，傥亦所谓善知识也，戏题四绝句以谑之 其四
448815,乙卯梦中得星际二句不知所谓因书示雪逸三十年后雪逸觅得当时所书残纸命足成之
1137513,岁在丙辰元日立春是时先人守当涂郡斋宾客云集皆用元祐八年东坡和王仲至秦少游诗故事所谓省事天公厌雨回先人笑曰天公省事今乃多事耶今三十有九年矣追念感慨小诗聊记当时笑谈之语
1214521,吴中汤孟实余闻之衍师道原同居七世矣能率正其家人庭无间言室无私藏诸舍少有不律辄晨起盛服至其寝门引咎自责必改而后止天子赐复以表孝义之门馆阁名臣皆为诗歌美之余虽未见君子中心藏之矣遂为之诗所谓不必寄元也
828680,自来官京朝者皆居宣武门外屋宇湫隘依然寒士家风所谓南城士大夫也国变后王侯第宅皆易新主速化者率居东西内城然盛衰不常倏焉灭迹予因病请急来京僦居景山下盖有不胜今昔之感者爰成长句一首
257718,所谓一生就是大哭一场
854979,十月十日访琳道人于禅静寺与之徘徊泉石间甚久道人云有大龙团藏亦数年食且几尽因出刀圭许而龙躯仅馀一爪色理极苍古又云赵清献公尝得须菩提画像乃张画壁间煎所谓龙爪以饷仆迫夜来归坐县之东堂见月奉寄一首
447627,蝶恋花 芳草邀游璧山青杠，夜半酒酣，狂歌醉舞，真所谓不知老之将至也，即兴赋此
902533,余以雪牡丹歌呈诚斋回柬云只得籍没是兵家不传之妙谓不和答也又尝以来日立夏问诚斋所谓风月库中当作何措置蒙绝句示报因次韵致谢并破前说云
1089802,李若兄菊诗同社久已嗟赏赓和属蒙写寄仍用韵以致予奉祠之喜予两年从金陵觅菊栽而一种至今著蕊未开岂所谓晚节香者耶次韵奉酬 其一
105882,上元晚晴·所谓上元者
1077913,华容西二十许里有墨山即离骚所谓玄石也山有大云寺寺有云母泉甘芳洁清大旱不竭唐李华有诗序之甚详其末云华贬杭州司公恩复左补阙次于岳阳江山延望思与高贤共饮云母之泉躬耕墨山之下敢违朝命以询私欲秋风露寒洞庭微波一闻猿声不觉涕下况支离多病年甫始衰愿饵药扶寿以究无生之学事乖志负火爇余心三复其言而悲之因次其韵
282776,秋夜宿扬州梅花岭，所谓十月先开岭上梅者殊未验也
930193,楚辞所谓桂数见于唐人诗句及图画间今不复见矣作二绝句属山僧野人试求之 其二
908364,吾友黄仲秉读枚乘七发至所谓洞房清宫命曰寒热之媒皓齿蛾眉命曰伐性之斧感而作诗以示予予谓乘尝事吴已而去之梁斯言也殆为两君发欤贤司马长卿长门远矣因次韵以申其意
1073610,某靖国中与时发同寓郡庠潜心之北窗凡三年而别别后三十五年复相遇于荆溪颐山之下苍颜白发互相惊叹追数一时同舍生在鬼录者十八九独两翁无恙耳方筑室山中以老焉将与时发杖屦往来如杜子美所谓两老者乃赋诗而以为之先
1142389,都梁北乡士多好学有向君敏衡者一日访予语甚质气甚夷礼甚虔予心异之间为予言曰家故沅徙也今所居有溪实自沅来乃筑室聚书其上以教子弟因以沅溪书舍名之而其亭则曰无加盖其地旧号无加庄以其东止于石西止于岸南止于路北止于泉也愿有以发之予既为籀右书二颜而向君复以所谓廉崖者谂予予闻此石杰立千尺实峭厉峻削可敬可仰有类乎廉者颇思一至其处摩挲此石以激衰懦而未能也乃各为一解以谢焉 其二
803983,伊拉里克河水利林文忠公遣戍时所开，所谓四十八坎儿也，贤者所至，有益于民如此
906946,予往来秦熙汧陇间不啻十数年时闻下里之歌远近相继和高下掩抑所谓其声呜呜也皆含思宛转而有馀意其辞甚陋因其调写道路所闻见犹昔人竹枝纥罗之曲以补秦之乐府云 其一
566907,今来自岭海者云扶桑花也予昔所见殊不类是殆大苏所咏涓涓泣露紫含笑焰焰烧空红拂桑耳花家剪双头见寄始觉首四作之误乘酒漫成六首以赎差错插砚水瓶嫣然有笑语意岂亦怜老人之衰眊耶复取馀沥浇之当缠头耳滇蜀村歌云披蓑衣打杖头鼓风流在何处予拟答乡谚云雪落长江里依旧化作水何不落则雨却要是个底不知花神有知作何平章夜见梦云叟所谓黄连树下弹琴也 其六
1114379,予往来秦熙汧陇间不啻十数年时闻下里之歌远近相继和高下掩抑所谓其声呜呜也皆含思宛转而有馀意其辞甚陋因其调写道路所闻见犹昔人竹枝纥罗之曲以补秦之乐府云
1125141,通叟年兄视以柳侯庙诗三首辄亦有作所谓增来章之美也
570051,昔白文公有诗赠裴淄州其起句云九十不衰真地仙余以此例赠九十翁者凡五人矣莆田林方渠公以名进士官至郡守累进阶正三品今年寿九十二而其子敬夫复以雷阳守便道彩侍毋论五人者仅一宗马湖雁行即所谓裴淄州者当亦不及也喜羡之余敬步前韵授之俾歌以称觞
1234400,偶得灵壁石笔格状如俗所谓钻云螭虎者因成绝句
501361,情事未申视息宇内劬劳之旦哀痛倍深悲歌以继恸哭所谓情见乎辞云尔呈阎初阳天使牛士良典簿
434640,陶君秀晋人尝为司竹监使因祖渊明尝游五柳庄为立五柳祠在县东西原方见有祠堂诗碑向禹城侯先生司竹时与扶风张明叙六曲李仲常凤翔董彦材从之学如白云楼海棠馆所谓胜游也兵后吾弟主之亦西州衣冠之幸感今慨昔不能不惘然也握手一笑知复何年敢先此以为质兼示鄠亭赵秀才 其二
832899,声声慢 西园逭暑。园在广州提学廨，余襄公武溪集注所谓庭际罗立九曜石者也
984578,正纪诞辰辄成三绝句为寿所谓寿者非世俗之寿也盖期君道学坚固将与造物者游无终始者为友而已 其二
607947,甲午孟冬先妣坟下土圯予督役修理前一夕梦先妣仪容如弥留时语予曰可加一枋不识所谓或者加土厚筑之意醒因泫然有感
1089803,李若兄菊诗同社久已嗟赏赓和属蒙写寄仍用韵以致予奉祠之喜予两年从金陵觅菊栽而一种至今著蕊未开岂所谓晚节香者耶次韵奉酬 其二
1041611,往年筑青涧城各有得佩刀者莫知其何世物余按故史则赫连勃勃所铸也所谓大夏龙雀者是矣客因以遗予为作七言诗
623542,白沙洞从穴中持火而入行里馀乃至所谓丹砂即此
411941,甲成戊冬大雾亘六七日大木细枝一白如披絮即所谓雾凇也县署有古柏数十株郁硉夭矫尤为奇绝王大令济若拍照见示题为一诗
182520,二十七日立春夜雪高下尽白暗闽中所谓大雪也
520358,昆明池即老杜所谓昆明汉武旧时功者也予经其地盖已墟矣因作一律以寓慨叹之意云
1137476,都梁北乡士多好学有向君敏衡者一日访予语甚质气甚夷礼甚虔予心异之间为予言曰家故沅徙也今所居有溪实自沅来乃筑室聚书其上以教子弟因以沅溪书舍名之而其亭则曰无加盖其地旧号无加庄以其东止于石西止于岸南止于路北止于泉也愿有以发之予既为籀右书二颜而向君复以所谓廉崖者谂予予闻此石杰立千尺实峭厉峻削可敬可仰有类乎廉者颇思一至其处摩挲此石以激衰懦而未能也乃各为一解以谢焉 其一
958470,荆州之川曰江曰汉曰沱曰潜曰三澨其泽曰云梦汉志谓三澨在江夏竟陵竟陵即今之景陵复州是也春秋传楚子与郑伯田于江南之梦梦与云自不同渡武昌道汉阳至复州非冬晴水涸则渺漫极目乃三澨之尾所谓梦泽也己已二月春水未生行蒲稗间累日将至景陵望孤城盖大泽中之环堵州治即古章台也
316258,满庭芳·访所谓“曹雪芹故居”
174399,正纪诞辰辄成三绝句为寿所谓寿者非世俗之寿
1067911,钱伸仲乞静照轩诗取逸少所谓静照在忘求云
910008,岑使君牧襄阳受代还朝某同赵德麟谢公定潘仲宝皆饯于八叠驿酒中以西王母所谓山川悠远白云自出相期不老尚能复来各人分四字为韵以送之某分得相期不老 其二
436828,陶君秀晋人尝为司竹监使因祖渊明尝游五柳庄为立五柳祠在县东西原方见有祠堂诗碑向禹城侯先生司竹时与扶风张明叙六曲李仲常凤翔董彦材从之学如白云楼海棠馆所谓胜游也兵后吾弟主之亦西州衣冠之幸感今慨昔不能不惘然也握手一笑知复何年敢先此以为质兼示鄠亭赵秀才
826510,大酺·一天芳事，惟春暮最乐。閒步后圃，杂花生树，空负春韶，爰制此词，付雪儿歌之。桓伊所谓辄唤奈何者也
744491,章鹾尹秋濠出示怀弟诗自伤憔悴以敝乡荒陋比之东坡儋耳岂所谓诗必穷而后工乎然诗工矣敝乡之冤嘻其甚也因戏拈此赠之
910005,岑使君牧襄阳受代还朝某同赵德麟谢公定潘仲宝皆饯于八叠驿酒中以西王母所谓山川悠远白云自出相期不老尚能复来各人分四字为韵以送之某分得相期不老 其一
1142601,予家世居富山久矣世有隐德老坡所谓我家韦布三百年惟有阴功不知数盖类是也因作此以记其实且以勉族氏子弟云 其一
436126,蒲城董公余素不识其何如人也一日袖横轴所谓龙窝图者同仲坚来过而以诗见谒余雅不能文诗尤非所长者加之老病日久纵不避拙恶亦安能为他人摧肝肾耶渠请益坚余重违封意且念其勤姑因所见以叙之云耳
355857,新作纸屏隆师为作山水笔墨略到而远意有馀戏题此句末句盖取所谓柴门鸟雀噪游子千里至也
920306,周公庙，庙在岐山西北七八里，庙后百许步，有泉依山，涌冽异常，国史所谓「润德泉世乱则竭」者也
414621,诵子苾近作十年春梦总成婆老去始知才已尽及短发乱梳头诸句感叹今昔不能入睡辄作小诗奉寄此亦少陵所谓老妻书数纸应悉未归情也二首 其二
1196642,伏蒙侍郎见示蓬阁多馀暇诗十首调高情逸无以咏歌篇篇实为绝伦一一尤难次韵强率鄙思别奉五章却以秘阁清虚地为首句所谓效西子之颦也惟工拙之不同岂天壤之相接莞尔而笑其敢逃乎
1025147,去岁得黟江县牡丹数种今年开一枝盖白者谱中所谓水晶毬也
320966,予家世居富山久矣世有隐德老坡所谓
1125710,正纪诞辰辄成三绝句为寿所谓寿者非世俗之寿也盖期君道学坚固将与造物者游无终始者为友而已
906949,予往来秦熙汧陇间不啻十数年时闻下里之歌远近相继和高下掩抑所谓其声呜呜也皆含思宛转而有馀意其辞甚陋因其调写道路所闻见犹昔人竹枝纥罗之曲以补秦之乐府云 其八
1143686,予家世居富山久矣世有隐德老坡所谓我家韦布三百年惟有阴功不知数盖类是也因作此以记其实且以勉族氏子弟云
906942,予往来秦熙汧陇间不啻十数年时闻下里之歌远近相继和高下掩抑所谓其声呜呜也皆含思宛转而有馀意其辞甚陋因其调写道路所闻见犹昔人竹枝纥罗之曲以补秦之乐府云 其三
1114857,岑使君牧襄阳受代还朝某同赵德麟谢公定潘仲宝皆饯于八叠驿酒中以西王母所谓山川悠远白云自出相期不老尚能复来各人分四字为韵以送之某分得相期不老
855907,历阳倅蒙庵郑公卒于位记岁在丁丑与仆有交承之契方来自镇西而仆亦自安丰往邂逅于合肥驿中获为三日之款所谈无非周易太玄老庄之书开警蒙昧多矣公平生学佛行一着端的不昧所谓毫发无遗恨者仆老矣请从其后而为净土之游似不晚也作是诗以吊之 其一
335873,题宣书记塞门积雪图此图真柳子厚所谓千山鸟飞绝万径人踪灭者若孤舟蓑笠翁独钓寒江雪则以余诗见之
546479,翌日吴肇成招同司马洎诸君浮筏遇雨泊梁下有挈歌姬赵某至左手三指爪皆长六寸馀司马记中所谓邯郸才人者也 其二
1070930,予生世几八十年交游士友有昧平生而一见气合者有同乡并舍而终身情乖者因悟笑曰此释氏所谓宿缘也知此则可以忘忧恼泯是非免轮回而脱生死也因作拙句以道其意云
746801,壬戌五月初三夜忽中风痹之疾香山所谓体瘝目眩左足不支与有同病焉昔苻坚得习凿齿于汉南因其蹇疾裁堪半丁香山诗云汉上羸残号半人是也余年已七十可以称翁因自号半翁纪之以诗 其三
203573,忧·忧吾所谓果何忧
842399,苏州有僧名虚生者，以诗要结善男女充报馆访员，傥亦所谓善知识也，戏题四绝句以谑之 其二
1123990,经旬不作诗今日霜晴可喜问梅沈园得两绝句此坡所谓痼疾逢虾蟹也
996540,延寿寺僧小轩极萧洒予为名曰林乐取庄生所谓林乐而无形者并为赋诗
1196221,伏蒙侍郎见示蓬阁多馀暇诗十首调高情逸无以咏歌篇篇实为绝伦一一尤难次韵强率鄙思别奉五章却以秘阁清虚地为首句所谓效西子之颦也惟工拙之不同岂天壤之相接莞尔而笑其敢逃乎 其一
435786,甲辰秋洛阳得黄葵子种之南庵明年夏六月作花佛经所谓阎浮檀金明净柔软令人爱乐者此花可以当之因为赋长韵予方以病止酒故卒章及之
803139,遂昌卸任只将兰花带赴湘湖，其余杂花概交后任，口占四句不入交册，亦所谓旧管新收开除实在云尔
113771,延寿寺僧小轩极萧洒予为名曰林乐取庄生所谓
989079,老景逢春每多留赏子美所谓老去愿春迟子忱雅知其况以佳句见贻信笔为答
930194,楚辞所谓桂数见于唐人诗句及图画间今不复见矣作二绝句属山僧野人试求之 其一
461611,所谓圣歌
895409,宫使枢密富丈和篇高妙所谓压倒元白末句许予尤非所敢承谨用前韵叙谢
826189,水调歌头·去岁重九扫叶楼盛集，纕蘅为拈鉴字韵，久而未就，兹乃补作一词。晏叔原所谓殷勤理旧狂也
215171,元珍以诗送绿石砚所谓玉堂新样者
971543,经旬不作诗今日霜晴可喜问梅沈园得两绝句此坡所谓痼疾逢虾蟹也 其一
77787,食荠糁甚美盖蜀人所谓东坡羹也
201568,宫使枢密富丈和篇高妙所谓压倒元白末句许予
117926,张惕山人即昔所谓惠思师也余旧识之于京师忽
1111184,李若兄菊诗同社久已嗟赏赓和属蒙写寄仍用韵以致予奉祠之喜予两年从金陵觅菊栽而一种至今著蕊未开岂所谓晚节香者耶次韵奉酬
924674,张惕山人即昔所谓惠思师也余旧识之于京师忽来相访茫然不复省徐自言其故戏作二小诗赠之 其一
900497,广汉黄仲秉即转运使治之东作亭扁以楚翠盖取杜陵所谓楚岫千峰翠者属客赋诗
