250772,浣溪沙·辛未冬日小乘山房作画并题
604592,辛未冬闰宝安黎宗瀚先辈过访西园留诗未及投辖用来韵答之
246248,金缕曲·辛未冬暮龙潭湖吊袁崇焕和孔凡翁
409800,辛未冬来江上，与姚甥农卿游迎江寺大士阁，茗话至暮而归，农卿有诗，次韵和之
751195,张船山先生嘉庆庚午出守莱州冬日履任次年辛未冬乞休壬申春二月解组归时年四十有九予光绪乙巳出守徽州冬日履任次年丙午冬乞休丁未春解组归与先生若合符节然予年已六十有六矣因赋二绝志之 其一
668298,虎丘剑池相传深不可测旧志载秦皇发阖闾墓凿山求剑其凿处遂成深涧王禹称作剑池铭尝辨其非正德辛未冬水涸池空得石阙中空不知其际余往观之赋诗贻同游者和而传焉
811067,张船山先生嘉庆庚午出守莱州冬日履任次年辛未冬乞休壬申春二月解组归时年四十有九予光绪乙巳出守徽州冬日履任次年丙午冬乞休丁未春解组归与先生若合符节然予年已六十有六矣因赋二绝志之
751196,张船山先生嘉庆庚午出守莱州冬日履任次年辛未冬乞休壬申春二月解组归时年四十有九予光绪乙巳出守徽州冬日履任次年丙午冬乞休丁未春解组归与先生若合符节然予年已六十有六矣因赋二绝志之 其二
263296,辛未冬来江上，与姚甥农卿游迎江寺大士阁，茗话至暮而归
444412,金缕曲 辛未冬暮龙潭湖吊袁崇焕，和孔凡翁
449033,浣溪沙 辛未冬日小乘山房作画并题
