427377,解连环 为公湛画水仙并题，用清真韵
980061,晚日临水得此句呈季和先为公家池上明日之游也
1145182,百姓为公孙轨语
581168,予既为诗以为公功德之颂矣复作迎送神辞二曲俾岁时歌以祀公云
907908,先公三池祠室学官相传占为公署同年李南才毅然欲复其旧贻以四绝句 其二
843132,梁退庵先生青灯有味似儿时遗照为公曾孙鸿志题
907907,先公三池祠室学官相传占为公署同年李南才毅然欲复其旧贻以四绝句 其四
956921,伏闻知府秘书欲取小杜桐庐诗语以见花名堂成大记东坡送郑户曹诗云荡荡清河壖黄楼我所开迟君为坐客新诗出琼瑰楼成君已去人事固多乖此段大类今日成大行且受代计梅开堂成归舟已下南浦欲为坐客不可得怀不能已请先为公赋之
1224556,宗忠简公画像为公外曾孙叶深道作
1114546,先公三池祠室学官相传占为公署同年李南才毅然欲复其旧贻以四绝句
907906,先公三池祠室学官相传占为公署同年李南才毅然欲复其旧贻以四绝句 其一
420609,满江红 题刘蕺山先生海天旭日砚，为公孙海门上含赋
699453,江上见数渔舟为公卒所窘
634543,西朋老居士七十一初度闻以放生为乐放生之报报在上寿仅广其意作二章以为公劝 其二
194758,玉楼春·今朝何以为公寿
139632,水调歌头·岁岁为公寿
1199019,南燕人为公孙氏语
273855,蝶恋花·绣谷在灵岩山下，邑人辟其地为公墓
1065085,闰三月经旬雨江涨已及旧痕而湖山堂之下船犹著沙二十七日与天宁清修白鹿龙牙开法同赴景醇饭而广法益阳来遂掇坐入门湖水涨满其碧胜镜景醇曰湖山正为公辈甚喜作此
427891,百字令 三年前仲弘元帅招过高斋，促膝畅谈，询及马齿，知公长予一岁。默数来年为公六十大庆，适得李翰林集初印本，谨题此曲，预献九如之颂
460391,贺新郎　四月二夜步往橘子洲头，已立为公园矣，而铁将军把门，不得入。予立栏外赋此
469131,江上见数渔舟为公卒所窘 其一
821364,蝶恋花 绣谷在灵岩山下，邑人辟其地为公墓。摩挲碑识，多旧相识者
634542,西朋老居士七十一初度闻以放生为乐放生之报报在上寿仅广其意作二章以为公劝 其一
843094,林文恭公遗像为公子贻书提学题
291101,解连环·为公湛画水仙并题，用清真韵
573008,江上见数渔舟为公卒所窘 其二
54043,江上见数渔舟为公卒所窘
179946,先公三池祠室学官相传占为公署同年李南才毅
389586,国难有感·既称天下已为公
150320,晚日临水得此句呈季和先为公家池上明日之游
907905,先公三池祠室学官相传占为公署同年李南才毅然欲复其旧贻以四绝句 其三
296491,满江红·题刘蕺山先生海天旭日砚，为公孙海门上含赋
617750,叠前韵为公逊拨闷
147261,枢密·贵为公相不如归
703385,西朋老居士七十一初度闻以放生为乐放生之报报在上寿仅广其意作二章以为公劝
