334610,送观物初禅师退院后归灵隐
953616,与谢三学士唱和八首 陪饮上林院后亭见樱桃花悉已披谢因成七言四韵
59360,临洮院后半壁古城歌
610579,偶读东坡海外寄人书云某到贬所半年百凡粗遣更不能细说大约似灵隐天竺和尚退院后却住一个小村院于折足铛中糙罨米饭吃便过一生也得令人绝倒戏成三绝以效希调 其三
584016,院后桂花
340608,呈同院后至诸公
583736,院后紫薇四月即花
210989,和慎思诗呈同院后至诸公
471802,临洮院后较射亭放歌行
1100715,送观物初禅师退院后归灵隐
1056326,呈同院后至诸公
472293,长春道院后楼
1223768,欧阳元功待制入院后仆以兼领成均辰酉甚严绝不得相见今夜当同宿斋宫赋此先寄并简谢敬德修撰
105064,依韵和永叔同游上林院後亭见樱桃花悉已披谢
610577,偶读东坡海外寄人书云某到贬所半年百凡粗遣更不能细说大约似灵隐天竺和尚退院后却住一个小村院于折足铛中糙罨米饭吃便过一生也得令人绝倒戏成三绝以效希调 其一
991070,依韵和永叔同游上林院后亭见樱桃花悉已披谢
344148,自南山道院后登东山巅
685657,偶读东坡海外寄人书云某到贬所半年百凡粗遣更不能细说大约似灵隐天竺和尚退院后却住一个小村院于折足铛中糙罨米饭吃便过一生也得令人绝倒戏成三绝以效希调
740984,婺州试院后有宋皇子魏王节度使碑院故节度使第
740974,独秀峰在桂林城内贡院后旁无培塿坡陀特起如浮屠登其颠俯瞰院中时假为制府行馆上元前后于峰之上下张镫设燕此粤西仅见之盛事也
166078,孔雀院后蒙泉
793396,登平阳试院后平台
1048099,诗呈同院后至诸公
526615,益阳院后小轩
610578,偶读东坡海外寄人书云某到贬所半年百凡粗遣更不能细说大约似灵隐天竺和尚退院后却住一个小村院于折足铛中糙罨米饭吃便过一生也得令人绝倒戏成三绝以效希调 其二
59372,临洮院后较射亭放歌行
936213,城西接待院后竹下作
138008,陪饮上林院後亭见樱桃
979051,孔雀院后蒙泉
584003,院后池亭纳凉
57576,长春道院后楼
953754,春日独游上林院后亭见樱桃花奉寄希深圣俞仍酬递中见寄之什
83779,城西接待院後竹下作
865079,诗呈同院后至诸公
963599,老人晚得女真真又曾孙女金华皆再周而殇葬塔院后今春焚化用前韵赋诗谨和
1030993,和慎思诗呈同院后至诸公
471801,临洮院后半壁古城歌
940010,智宝院后楼怀胡元茂
117284,诗呈同院后至诸公
340824,题总持院·后土祠边柏造天
583516,题柯学士所种二柏在翰林院后
738209,冬晓登韬光禅院后山望晴雪
897099,诗呈同院后至诸公
583733,院后牡丹和江侍御
168786,智宝院後楼怀胡元茂
