640047,洪武十八年二月二十日自漳州府回闽宪因思去年七月五日出闽关土人云宪司官初过此关值微雨故有小不利今出关而天日晶明旌节当复还矣及至京师纠劾奸贪事既得实彼乃伏诛我则还职再入关天又晴人复云必大亨也前后所作二绝句谩志于此 其一
1244313,余穷阨闾里年甚一年风雨重伤世味尤恶因思去年索酒于志明以与黄花解嘲今年志明亦复避地虽黄花可得见哉感慨成诗又无与寄因题之壁上以记此时情况焉
476715,八月十三日夜梦亡室安人惊泣而窹因思去年丁丑是日在京师安人未明兴告予曰今日趋朝不可如常日之宴盖其日警跸值新狩还也今遇是日感其贤淑又小子周二岁之晬重感赋绝句二首 其二
692749,八月十三日夜梦亡室安人惊泣而窹因思去年丁丑是日在京师安人未明兴告予曰今日趋朝不可如常日之宴盖其日警跸值新狩还也今遇是日感其贤淑又小子周二岁之晬重感赋绝句二首
571196,乙酉冬至募兵英德晓起对烛因思去年此日适部兵在梧州幕府到官未及二载而两以兵事奔走军门慨然有怀遂成此作
50280,八月十三日夜梦亡室安人惊泣而寤因思去年丁
1084936,元日冒雪赴天庆观朝拜既趋府拜表还舍饮屠苏酒因思去年元日亦不在家感而有作
476714,八月十三日夜梦亡室安人惊泣而窹因思去年丁丑是日在京师安人未明兴告予曰今日趋朝不可如常日之宴盖其日警跸值新狩还也今遇是日感其贤淑又小子周二岁之晬重感赋绝句二首 其一
703084,洪武十八年二月二十日自漳州府回闽宪因思去年七月五日出闽关土人云宪司官初过此关值微雨故有小不利今出关而天日晶明旌节当复还矣及至京师纠劾奸贪事既得实彼乃伏诛我则还职再入关天又晴人复云必大亨也前后所作二绝句谩志于此
640048,洪武十八年二月二十日自漳州府回闽宪因思去年七月五日出闽关土人云宪司官初过此关值微雨故有小不利今出关而天日晶明旌节当复还矣及至京师纠劾奸贪事既得实彼乃伏诛我则还职再入关天又晴人复云必大亨也前后所作二绝句谩志于此 其二
