772910,道光三十年1850秋八月在台湾府署评石头记成作七律三章志喜 其一
573383,读小修南游稿志喜 其一
659691,郊祀志喜 其一
628131,丹霞圆音和尚惠顾香草庄三日连宵同谦长侄作诗志喜 其一
569733,仲氏力辞浙学之命得请志喜 其一
646758,金明老人黄叶庵落成志喜 其一
767649,如约志喜 其一
605526,五石匏告成用玄真子韵志喜 其一
608711,草堂新开四家兄携诸侄自?川移舫志喜 其一
968243,为子侄入宗学赋二首志喜 其一
498912,巡江周监察及溪按滁志喜 其一
1003570,自永康还连日又告旱恳祈勤恪初四五日再得甘霔农畴无高下沛然沾渥因赋绝句志喜 其一
777060,军事将蒇余归有日矣诗以志喜 其一
471830,三屯新城工成志喜 其一
545871,邓远游以浦阳改剧槜李孟秋有事棘垣不佞邂逅湖上二律志喜 其一
635067,雪鸿居士偕诸护法入山游兴既倍群贤留题复迈前哲小作志喜 其一
784053,敬谒房师晓亭夫子并叩见太师母太夫人及二世兄三世兄退而志喜 其一
634095,己酉夏五月海幢抽并头兰两枝适澹归西堂至自丹霞有诗亦引其意作二律即以志喜 其一
548704,陈肖平擢守大名且得长孙短言赠行兼以志喜 其一
809875,秋幸出郊见收成志喜 其一
659689,祈雪志喜 其一
537233,闻卢生将出狱志喜 其一
498900,门士俞应和出守处州道由滁阳留之信宿志喜 其一
572516,三弟回志喜 其一
605012,韩绪仲宗伯卧子舍以神祖实录告成束急还朝计日爰立索诗为赠赋此志喜 其一
537344,闻京师诏下志喜 其一
