432245,游交芦庵僧人老且病出观华秋岳奚铁生西溪诸卷欲访厉太鸿先生墓为时已晚怅然归去赋此赠之
368804,鹧鸪天·病中清明，不能省墓，为之怅然
428411,壬午夏，从梦苕师谒梅村墓于石壁山前，墓为予考定后募资重建于原址之上者。梦苕师作《贺新凉》词赐寄，因用原韵勉成此阙
489811,复邹忠公墓为谢子兰赋
423255,游交芦庵僧人老且病出观华秋岳奚铁生西溪诸卷欲访厉太鸿先生墓为时已晚怅然归去赋此赠之 其一
401334,贺新凉  其庸诗人携谒吴梅村墓，墓为君新考定核实重建者，颇为壮观
140074,韵语·周官虽有墓为尸
512279,题郏城二苏墓为眉山吴方伯重修赋
798902,鹧鸪天·病中清明，不能省墓，为之怅然
737420,削平魏珰墓为张蘧若侍御赋
663432,银台墓为韩通政赋
278619,魏璞墓·为爱名山葬此间
423256,游交芦庵僧人老且病出观华秋岳奚铁生西溪诸卷欲访厉太鸿先生墓为时已晚怅然归去赋此赠之 其二
430130,季鸾以其尊人百年忌日归里表墓为赋此诗
837825,题墓为故林君纪堂作
297678,题墓为故林君纪堂作
305522,季鸾以其尊人百年忌日归里表墓为赋此诗
