976701,西州旧俗每当立春前后以巢菜作饼互相招邀名曰东坡饼顷在燕尝有诗云西州最重眉山饼冬后春前无别羞今度燕山试收拾中间惟欠一元修元修即巢菜之别号盖豌豆菜也东坡故人巢元修尝致其种于黄冈下因得名元修南方有之燕中无此种余来河间再见立春感旧事用前韵 其三
1085119,李德远寺簿敢言勇退今之古人也东嘉王某赋诗以高其行
976699,西州旧俗每当立春前后以巢菜作饼互相招邀名曰东坡饼顷在燕尝有诗云西州最重眉山饼冬后春前无别羞今度燕山试收拾中间惟欠一元修元修即巢菜之别号盖豌豆菜也东坡故人巢元修尝致其种于黄冈下因得名元修南方有之燕中无此种余来河间再见立春感旧事用前韵 其一
226737,寄元龄弟·季也东归何太迟
569547,殷无美余故人也东归之后贽而强纳拜焉辄成以赠
587508,我有两贺祝也东峰之何翁南海致庵伦氏皆八月寿期桃瑞西来五章
1124677,西州旧俗每当立春前后以巢菜作饼互相招邀名曰东坡饼顷在燕尝有诗云西州最重眉山饼冬后春前无别羞今度燕山试收拾中间惟欠一元修元修即巢菜之别号盖豌豆菜也东坡故人巢元修尝致其种于黄冈下因得名元修南方有之燕中无此种余来河间再见立春感旧事用前韵
976700,西州旧俗每当立春前后以巢菜作饼互相招邀名曰东坡饼顷在燕尝有诗云西州最重眉山饼冬后春前无别羞今度燕山试收拾中间惟欠一元修元修即巢菜之别号盖豌豆菜也东坡故人巢元修尝致其种于黄冈下因得名元修南方有之燕中无此种余来河间再见立春感旧事用前韵 其二
