253271,八月十日返乡侍母疾读书达旦
600206,送徐少浦膳部侍母还吴
801675,八月十五夜侍母宴，时大人客上党，大兄客夔州，即事书情次苏长公中秋见月寄子由韵
1242576,送蔡孝廉回侍母
763559,千秋岁 其二 题袁重其侍母弄孙图
753646,侍母点消寒图
455236,鹧鸪天 侍母疾
402666,还湘侍母疾，不旬日母愈，又将别家去桂，书怀 其一
1003866,送别彦威侄西归侍母 其一
405148,还湘侍母疾，不旬日母愈，又将别家去桂，书怀
523496,繁台送张内史侍母还蜀同毛袁监察三首 其一
402667,还湘侍母疾，不旬日母愈，又将别家去桂，书怀 其二
691660,繁台送张内史侍母还蜀同毛袁监察三首
349519,戊寅年二月侍母携弟由安庆赴江宁十三岁作
771523,三月四日侍母登舟谢淮阴诸友送至宝应
1003864,送别彦威侄西归侍母 其二
523498,繁台送张内史侍母还蜀同毛袁监察三首 其三
768851,侍母归家 其一
802209,戊寅年二月侍母携弟由安庆赴江宁十三岁作
184220,端午侍母氏饮有怀二兄偶阅苏日高安唱和慨然
559048,送郡幕黄浚源致官侍母
462171,八月十日返乡侍母疾读书达旦
247160,还湘侍母疾不旬日母愈又将别家去桂
1127975,送别彦威侄西归侍母
523497,繁台送张内史侍母还蜀同毛袁监察三首 其二
331885,千秋岁·题袁重其侍母弄孙图
218424,盗犯金川境扶侍母妹复走兴安有怀
345769,千秋岁·题袁重其侍母图
404750,满江红·癸酉秋侍母大人游旧京故宫，遍历三殿，玉砌雕阑，烟芜如织。此昔人禾黍之什所由咏也
768852,侍母归家 其二
707567,千秋岁　　题袁重其侍母弄孙图
526296,唐京兆应韶侍母夫人还楚
797322,贺新郎 庚子暮秋，侍母乡旋，舟中作
338089,侍母归家·布帆无恙挂天涯
445306,侍母恙
338192,三月四日侍母登舟谢淮阴诸友送至宝应
338272,侍母归家·一峰盘绕势崔巍
713290,方长斯侍母夫人之其兄蒙章官舍赋别
887332,盗犯金川境扶侍母妹复走兴安有怀
883192,端午侍母氏饮有怀二兄偶阅二苏是日高安唱和慨然用韵
769859,千秋岁•题袁重其侍母图
812391,侍母归家
534833,送高安吴太史侍母南归
516261,送唐给事出使侍母还乡
1003865,送别彦威侄西归侍母 其三
1222002,送潘鹤臞归侍母
535375,送孙志高侍母归浙
163689,送别彦威侄西归侍母
252301,鹧鸪天·侍母疾
795534,摘得新 侍母
