520325,予读汉史暨武帝内传每叹其雄才大略而乃惑神仙且穷兵于远俾末年不下轮台一诏则汉事未可知也矧闻茂陵侈葬可为于邑予行经驻视不无千古之感因占一诗以寄怀云
61154,自徐州至吕梁述水势大略
1091512,亡友高伯庸滑稽玩世屡与人忤而见余则加敬人共怪之亡八年矣今庆臣风度大略相似而所忤所敬又极同也感叹之馀次庆臣韵赠庆臣
922637,数日前，梦人示余一卷文字，大略若谕马者，用「吃蹶」两字，梦中甚赏之，觉而忘其馀，戏作数语足之
790742,题沙定峰读史大略后
1073507,余大观中偕何袭明登仕同为太学诸生别后二十六年余□南迁道清江袭明逆余于新淦之洲上苍颜白发大略相似感叹之馀饮酒赋诗以为笑乐袭明笔力雄赡操纸立就凡六七反必用前韵余继和者十二篇云 其一
471222,自徐州至吕梁述水势大略
1073508,余大观中偕何袭明登仕同为太学诸生别后二十六年余□南迁道清江袭明逆余于新淦之洲上苍颜白发大略相似感叹之馀饮酒赋诗以为笑乐袭明笔力雄赡操纸立就凡六七反必用前韵余继和者十二篇云 其二
1110465,余大观中偕何袭明登仕同为太学诸生别后二十六年余□南迁道清江袭明逆余于新淦之洲上苍颜白发大略相似感叹之馀饮酒赋诗以为笑乐袭明笔力雄赡操纸立就凡六七反必用前韵余继和者十二篇云
511167,得世卿书讶其大略
950824,予癸巳在京口因郡中元夕张灯偶阅国史靖康丙午正月十五日辛巳祐陵南巡驻跸是郡二月二十三日己未始还京师凡居郡三十有八兹闻箫鼓感旧兴叹不胜潸然因涉笔以记大略而僧有冲希者乃携以示正伦彼谓予讽己遂架大怨迄兴妄狱圣明察知其冤予复将指前漫尽白因悼正伦之殁闵其左计亮其初心附昔所作诗于后
