1060427,雪霁陪诸公登滕王阁分韵得阁字
499575,中秋陪诸公燕集
1116054,陪诸公携酒山家用壁间韵三首
918215,陪诸公携酒山家用壁间韵三首 其二
1149421,陪诸公游故江西韦大夫通德湖旧居有感题四韵兼呈李六侍御即韦大夫旧寮也
180739,陪诸公登南楼啜新茶家弟出建除体诗诸公既和
925381,次韵陪诸公湖上春游
918216,陪诸公携酒山家用壁间韵三首 其一
494220,陪诸公瀛洲胜会 其二 呈朱玉峰冢宰
499350,高梁桥陪诸公会饮遇雨走笔戏呈
194669,昨夜陪诸公饮今尚委顿未能起坐闻孙守出送陈
1233504,甲辰清明日陪诸公入南山拜胡侍郎墓回汎舟湖中作
1173532,陪诸公上白帝城宴越公堂之作
700436,连陪诸公柳山春游
61941,陪诸公郊行
991044,依韵和丁学士陪诸公城东饮
855120,昨夜陪诸公饮今尚委顿未能起坐闻孙守出送陈祠部供帐溪上见招不果往戏作小诗寄之
208569,上已陪诸公集西湖
1116175,陪诸公游文雅台憩法云寺二首
105243,依韵和丁学士陪诸公城东饮
1131823,重九日陪诸公游花田
1141425,辛亥岁七夕醉陪诸公登西湖竹阁
244192,陪诸公登广福观下望鼓蠡
49353,春日陪诸公往戴山眺集暮入北麓得石床岩洞诸
1206882,陪诸公杖屦豋梁王吹台悠悠悼古之情不能自已呈孟子周子文二友
8559,陪诸公上白帝城宴越公堂之作
918214,陪诸公携酒山家用壁间韵三首 其三
608361,盘松篇夏日陪诸公饮报国寺盘松下共赋
1071348,陪诸公游文雅台憩法云寺二首 其一
219732,次韵陪诸公湖上春游
494219,陪诸公瀛洲胜会 其一
653576,廿六日复陪诸公游灵隐寺留题祥上人所十二韵
201139,忆陪诸公会张侯之第
484086,陪诸公郊行
807456,念奴娇  十一夜黑窑厂对月龚芝麓先生招陪诸公送董玉虬侍御之任秦中五叠前韵
494221,陪诸公瀛洲胜会 其三 呈赵类庵少宗伯
173940,十一月四日陪诸公游神泉南山院二十韵
1092511,重九日陪诸公游花田 其四
195535,辛亥岁七夕醉陪诸公登西湖竹阁
938229,陪诸公登南楼啜新茶家弟出建除体诗诸公既和余因次韵
245313,陪诸公携酒山家用壁间韵
1239966,春日陪诸公往戴山眺集暮入北麓得石床岩洞诸胜
1028778,玉溪梅株柯殊绝宣和间用事者尝图以进竟不报今乃弃置蔬畦摧折憔悴有可怜之态昨陪诸公往观共叹其不遇且约盛开时携壶酒为醉赏之适因循又不果因用韵吊之
702238,陪诸公瀛洲胜会
620047,秋夜陪诸公宿镇海楼
1211245,贡院陪诸公夜话俄闻晓钟
1071349,陪诸公游文雅台憩法云寺二首 其二
855626,合寨陪诸公观月
1092510,重九日陪诸公游花田 其三
1060433,陪诸公步城北分韵得亦字
733653,早秋陪诸公游密将山
883723,太守召陪诸公游虎丘
524849,连陪诸公柳山春游 其二
1071350,陪诸公游惠山
1085569,九日陪诸公登高
8485,云安九日郑十八携酒陪诸公宴
985043,十一月四日陪诸公游神泉南山院二十韵
494222,陪诸公瀛洲胜会 其四 呈李蒲汀少宰
1092508,重九日陪诸公游花田 其一
524848,连陪诸公柳山春游 其一
438021,莲塘陪诸公赋
959619,忆陪诸公会张侯之第
1092509,重九日陪诸公游花田 其二
884576,上巳陪诸公集西湖
1058164,陪诸公观稼
1172760,云安九日郑十八携酒陪诸公宴
860411,陪诸公登广福观下望鼓蠡一首
142190,合寨陪诸公观月
494223,陪诸公瀛洲胜会 其五 呈何柏斋太常
494224,陪诸公瀛洲胜会 其六 呈郭杏东翰长
494225,陪诸公瀛洲胜会 其七 呈陈琴溪少司成
