434504,汉宫春 纯甫生朝，且有弄璋之喜，赋此以贺
410184,送姊丈许峨轩孝廉韵璋之任蜀中，即和留别原韵
916261,闻扬州柴给事有弄璋之庆寄诗贺之
514348,庆赵竹溪先生子登科兼有弄璋之喜
212504,弄璋之什·时序乡心破
994701,次韵弟师白至日及弄璋之什二首 其一
193038,闻扬州柴给事有弄璋之庆寄诗贺之
288833,送姊丈许峨轩孝廉韵璋之任蜀中，即和留别原韵
491541,送焦廷璋之洪
498642,送陈兰陔作令衡阳时方有弄璋之喜 其二
960029,景定甲子夏五三日王希夷兄有弄璋之庆是时希夷尚在岁寒堂报至以历推之日在参月在东井火在天西北鲁斋先生曰此卿相之命也越七日希夷煮饼岁寒诸朋友与焉桐阳金履祥吉甫为诗以贺
994870,次韵弟师白至日及弄璋之什二首 其二
1246918,和程生克有弄璋之庆
445579,遥贺红叶竹子弄璋之喜
604891,戊午初度曾泽卿太史亲家从金陵函文走币见寿赋此奉谢并讯弄璋之喜
189416,景定甲子夏五三日王希夷兄有弄璋之庆是时希
684795,送陈兰陔作令衡阳时方有弄璋之喜
212501,次韵弟师白至日及弄璋之什
498641,送陈兰陔作令衡阳时方有弄璋之喜 其一
