263134,居君敬之·居君我师友
625439,参将杨邦达阵中生擒渠魁五人曰万中永俞世安何碧奇邓琏张洽苍鞫之皆河南人也未正刑我师又北五渠遂得狡脱良可叹哉
495128,我师围漳郡，余过觇之，赋以志慨
44359,本事诗·丹顿裴伦是我师
1006472,闻我师大捷虏骑宵遁上时宰五十韵
287088,孙师郑以感逝诗徵题诗分甲乙二集辛亥后不仕者入甲集出仕者入乙集大半亦我师友也
139222,寄题隐静·我师一出几何年
251623,新年书感·试笔油然念我师
840555,孙师郑以感逝诗徵题诗分甲乙二集辛亥后不仕者入甲集出仕者入乙集大半亦我师友也二首 其二
844697,孙师郑以感逝诗徵题诗分甲乙二集辛亥后不仕者入甲集出仕者入乙集大半亦我师友也二首
273052,荆园秋感·举世嵚崎有我师
840554,孙师郑以感逝诗徵题诗分甲乙二集辛亥后不仕者入甲集出仕者入乙集大半亦我师友也二首 其一
636356,送无我师还里，兼柬里中诸子
231933,闻我师大捷骑宵遁上时宰五十韵
300330,竹友歌·竹能虚心是我师
488757,和大宗伯陈公闻倭寇遁归我师追击尽复朝鲜之地志喜韵
289260,城南杂诗·云石山人是我师
