574667,次王郡公煎茶行
573228,王郡丞邀饮阳和楼 其一
50122,投王郡守
542522,寄怀王郡丞叔纯
1240996,投王郡守
721994,奉题惠阳王郡侯署中忆雪楼
574962,代柬留王郡公用前韵
703383,送陈羽王郡丞赴都改除
40367,奉和竟陵王郡县名诗
723396,奉和齐竟陵王郡县名诗
634538,送陈羽王郡丞赴都改除 其一
574719,次韵王郡公除夕 其一
716387,奉题惠阳王郡侯署中忆雪楼 其四
575004,用韵答王郡公
574539,再荅王郡公
575186,谢王郡公送鹿
587780,同济美王郡守游通天岩
573229,王郡丞邀饮阳和楼 其二
574732,谢王郡公惠响器留别
716384,奉题惠阳王郡侯署中忆雪楼 其一
598088,献岁春前王郡公还自惠州以书见贻有虚馆相迎语作此谢之
693472,次韵王郡公除夕
606649,王郡丞有赠未答旋复惠酒并谢
575017,王郡公朝正告别
598089,王郡公以人日见贻诗箑依韵奉酬
716386,奉题惠阳王郡侯署中忆雪楼 其三
633971,答陈羽王郡丞
574938,山堂雨坐用怀王郡公韵
575016,送莫如山应王郡公纂修之聘兼柬陈廷猷
723258,奉和竟陵王郡县名诗
574720,次韵王郡公除夕 其二
574669,谢王郡公惠风折古柏用杜韵
716385,奉题惠阳王郡侯署中忆雪楼 其二
41351,奉和齐竟陵王郡县名诗
574913,王郡公得芝于泉上次韵
781406,贡川闻王郡伯死，为位哭之
574841,春水寿王郡侯
591509,王郡倅应文邀登镇海楼
634539,送陈羽王郡丞赴都改除 其二
724888,奉和竟陵王郡县名诗
699509,王郡丞邀饮阳和楼
574986,王郡公命善权僧访予山中因遣僧圆金驰谢
732955,楚泽凯旋和王郡守韵
