716542,于两大人冢旁作予生圹书示儿辈 其二
458044,贺新郎　沙子石子兄极少上网，每一显身，爱其诗者辄为雀跃。近于碰壁书斋贴新作，予草翻一过，即去午食，酒中赋此以赠
428410,贺新郎 己丑牡丹盛时作。予园中牡丹皆从洛阳移来，至今十年，已满园春色矣，因为赋此解
771867,夏初以来，四境不靖，园中花事就芜。届残腊，始报安堵。爰修小园，招诸韵士雅集，各有佳作。予忝主位，乃强颜续成五排一首
738984,中元约玉川于次日游北山玉川以事不往夜闻风雨大作予亦兴索感赋
713941,惠州王太守入罗浮寻梅花村不得用子瞻松风亭下梅花诗原韵有作予为和之
1000156,丙午寒食厚卿置酒压沙寺邀诸君观梨花独苏子由不至以诗来邀席客同作予走笔依韵和之
494928,壬午秋有鹤降于吏部庭见素翁和白岩诸公有作予亦步韵二首 其一
1221528,次韵张伯雨天一井阑诗元金荪璧积庆冈物后在开元宫黄蔑楼今在王景周东圃万文远先作予因和之
1067913,诸人绝江游同安大风涛作予适病眩不能渡
523582,甥嘉北采出其谒逢干庙之作予为和之嘉时谪茂州判
494929,壬午秋有鹤降于吏部庭见素翁和白岩诸公有作予亦步韵二首 其二
716546,于两大人冢旁作予生圹书示儿辈 其六
722017,于两大人冢旁作予生圹书示儿辈
702106,壬午秋有鹤降于吏部庭见素翁和白岩诸公有作予亦步韵二首
716543,于两大人冢旁作予生圹书示儿辈 其三
716545,于两大人冢旁作予生圹书示儿辈 其五
515915,予归自贵藩与何贰守祁使君同游铁溪入溪既深见路左三山鼎立如画祁君有作予和韵健之致和
1246838,东南山水瑰奇甲天下莫若天台匡庐三茅武彝予尝游焉其以温泉名者如三山之天汤句曲之汤水又尝游焉私怪句曲人颇以牲杀污辱之三山置士卒锔鐍虽不同句曲污辱为王公贵人禁不得一澡浴者黄山予乡闬之名山也距郡城百有馀里未尝一即焉以游癸夘九月某日狂风怒号滕六大作予游焉浴于池甑蒸汤沸其气如饙馏然内池限以石甃外池濒于溪流当水涨龙必潜泳易致湮塞盖地产丹砂故也与句曲三山特异虽知群仙饷以琼琳玉树珍禽缟鹤但恨诸峰巘崿千态万状不能悉睹
716541,于两大人冢旁作予生圹书示儿辈 其一
593058,答朱用晦怀予光州之作予时游河洛已归岭南
529220,陈仲鲁玉舜诸作予读之悲其志焉再叠一首慰之
331063,与得之手谈约不胜者赋诗探题得题厉吉老所居得之当作予和之云
1251644,先约九日共城中诸贤友登瑶台至日风雨大作予处荒村无菊酒自娱闭门兀坐终日晚命童儿取笔书近体诗明日寄与约者
992071,汝南江邻几云鄎南并淮浮光山有张隐居种松桧于其上养母甚孝时有猛兽驯庭中又郡西麻田山土沃泉美久不垦有刘叟者辟而居之近董氏黄氏欲买土为邻故江有慕之之作予辄次其韵
716547,于两大人冢旁作予生圹书示儿辈 其七
1221517,香橼即枸橼也康雪庭上人用赠紫芝上人因而有作予偶见之遂次其韵仍简紫芝
778179,霓裳中序第一·壬戌春莫过城西草堂，读壁间词句，悽婉清丽，款为梅边吹笛客重九对芙蓉作。予自抱骑省之戚，益复无聊，睹此新词，能无枨触，依韵和之
1070839,与得之手谈约不胜者赋诗探题得题厉吉老所居得之当作予和之云
422808,沁园春 城中传诵毛润之雪词，亚子、君左均有和作，予次韵，仍咏雪
1041564,雷氏子推迹石鼓为隶古定圣俞作长诗叙之诸公继作予亦继其后
716544,于两大人冢旁作予生圹书示儿辈 其四
457972,贺新郎　归乡省墓作。予已数年不事此矣
