1027084,王原庆诉盘餐萧然走笔次韵 其一
105279,王原叔内翰宅观山水园
1131315,王原庆诉盘餐萧然走笔次韵
905687,重建羊太傅祠和王原叔句
972400,同签判谢丈简寄教授李丈仍用王原庆旧韵
137693,来燕堂与赵叔平王禹玉王原叔韩子华联句
692544,送王原之诗
991854,王原叔内翰宅观山水图
857776,依韵和王原叔内翰禁直有怀
895478,和韵奉酬王原父集福山之什
201559,和韵奉酬王原父集福山之什
892591,秋日与天章侍讲王原叔曾明仲正言余安道三学士集普光院
489361,次席帽山人王原吉韵赠石林上人
1028000,王原庆新迁居南堂以古风求写恕斋二大字并石刻次韵
992626,欧阳永叔王原叔二翰林韩子华吴长文二舍人同过弊庐值出不及见
672578,送王原常用其留别诗句为题三首 其三 分歧思不禁
789861,题王原祁虞山秋色图
136016,同王原庆知道游天童
102774,正月二十四日与儿子过赖仙芝王原秀才僧昙颖
482958,简王原翚
678676,春波渔傲为王原鲁赋
1078501,游王原山
1242352,齐天乐 其七 次韵王原吉龙江别业
104256,欧阳永叔王原叔二翰林韩子华吴长文二舍人同
672576,送王原常用其留别诗句为题三首 其一 白云时在目
895811,重建羊侯祠和王原叔句
1027083,王原庆诉盘餐萧然走笔次韵 其二
1043947,重建羊侯祠和王原叔句
648759,送王原之诗 其三
984527,重建羊侯祠和王原叔句
136010,王原庆新迁居南堂以古风求写恕斋二大字并石
857896,靴淀除夕之会呈王原叔给事燕唐卿谏议
1028110,秋雨兀坐王原庆携孙吉父菊花倡和见过有分遗之意次韵
1038486,来燕堂与赵叔平王禹玉王原叔韩子华联句
648757,送王原之诗 其一
136009,王原庆诉盘餐萧然走笔次韵
890032,重建羊太傅祠和王原叔句
972284,王原庆有诗寄谢丈签判子畅尉曹具以见及次韵酬之
926398,重建羊侯祠和王原叔句
125254,秋日与天章侍讲王原叔曾明仲正言余安道三学
922119,正月二十四日，与儿子过、赖仙芝、王原秀才、僧昙颖、行全、道士何宗一同游罗浮道院及栖禅精舍，过作诗，和其韵，寄迈、迨一首
1038882,过濠梁别王原叔
672577,送王原常用其留别诗句为题三首 其二 璧水日论心
108875,重建羊太傅祠和王原叔句
201659,靴淀除夕之会呈王原叔给事燕唐聊谏议
97550,同签判谢丈简寄教授李丈仍用王原应旧韵
648758,送王原之诗 其二
692581,送王原常用其留别诗句为题三首 白云时在目
1027447,同王原庆知道游天童
98695,王原庆有诗寄谢丈签判子畅尉曹具以见及次韵
1248093,赠医士吕彦伦和王原吉韵
201863,依韵和王原叔内翰禁直有怀
63273,简王原翚
135254,秋雨兀坐王原庆携孙吉父菊花倡和见过有分遗
