575393,宁德平
79801,绍兴中予初仕为宁德主簿与同官饮酒食蛎房甚
79124,予初仕为宁德县主簿而朱孝闻景参作尉情好甚
928383,予初仕为宁德县主簿而朱孝闻景参作尉情好甚笃后十馀年景参下世今又几四十年忽梦见之若平生觉而感叹不已
1025818,奉诏讨范汝为过宁德西陂访阮大成
590815,宁德李大华死倭难
590857,表忠卷为宁德李太华死倭难次韵三首 其一
170017,送李尉赴宁德任
545722,七夕冯太史开之邀同俞羡长潘景升吴泰宁德符喻叔虞傅太学王山人集湖上观少姬走马戚不磷洎仲君继至余夜分返太史以轻舟载羡长不磷宿玉莲亭
501258,丙寅乡贡同宁德黄君泽韩君瑕林鹤山登幔亭峰今十五年矣赋此并怀黄子肃同年
503638,寄宁德林训迪
452322,重阳后一日与宁德诗友游支提山华严寺
694978,表忠卷为宁德李太华死倭难次韵三首
590858,表忠卷为宁德李太华死倭难次韵三首 其二
1216441,宁德寄呈郑德和参政绕兵古田
941166,送李尉赴宁德任
597291,送左侯小洲归宁德
128990,奉诏讨范汝为过宁德西陂访阮大成
932677,绍兴中予初仕为宁德主簿与同官饮酒食蛎房甚乐后五十年有饷此味者感叹有赋酒海者大劝杯容一升当时所尚也
675005,至宁德喜与君聘一会
590859,表忠卷为宁德李太华死倭难次韵三首 其三
676576,同宁德林柏山秀才家兄云塘舍弟竹溪游罗汉寺分韵得罗字
250523,重阳后一日与宁德诗友游支提山华严寺
351670,皇后词·宝殿开宁德
490516,哭李太华时为宁德令倭寇陷城死节
654751,初度有感时寓宁德行台
