518492,送都宪闵公赴任南京大司寇
454385,报载日本首相参拜靖国神社忆南京大屠杀事感而赋此 其一
454386,报载日本首相参拜靖国神社忆南京大屠杀事感而赋此 其二
466634,报载日本首相参拜靖国神社忆南京大屠杀事感而赋此 其二
55735,寄南京大理廖少卿
654919,南京大司寇周庄懿公挽诗
561169,黄子伯固昔为兵部郎官率同列谏止巡幸，被杖斥归。今上登极起为南京大理丞，奉表入贺饯以是诗
494435,赠南京大理寺正澹轩戴君升任柳州府太守诗
457951,贺新郎　和嘘堂兄南京大屠杀二首 其一
466366,贺新郎　和嘘堂兄南京大屠杀二首
286644,减字木兰花·祝南京大学研究生院成立
509124,庆南京大理寺卿夏公季爵致仕诗
494493,送南京大理寺正赵鲲迁守汉中府
649025,送万资中赴南京大理寺副
414001,南京大屠杀三周年感赋
514435,送屠元勋郎中赴南京大理丞
249242,报载日本首相参拜靖国神社忆南京大屠杀事感而赋此
419427,减字木兰花 祝南京大学研究生院成立
515821,送张庭毓赴南京大理评事
509177,挽南京大理何寺丞衷
441261,金陵城上乌南京大屠杀国家公祭日作
293060,南京大屠杀三周年感赋
457952,贺新郎　和嘘堂兄南京大屠杀二首 其二
494198,送南京大鸿胪刘克柔
480847,寄南京大理廖少卿
