366551,隐直感秋思南游予欲北还未得
600942,北还东洲见罗浮
1046040,道州何道士相会于途次匆匆告归余亦北还作诗致远别之意
427700,临江仙 丙子秋自岭表避乱北还，适得香宋老人峨眉寄诗，因赋小词为报
686738,送毛东塘侍御北还后怀寄八首
1079958,端午日北还至斛岭寄连州诸公
664047,赠别东塘毛侍御北还
581380,送陈祐卿奉使北还
1041542,六月六日自城北还过深甫避暑
537708,余以幽忧久废吟咏至八月十二日夜忽梦於停云馆饯人北还得二句云中原垂鸟道久客自鹑衣寻改赋古体八句觉后悉记之不知其何说也
1222352,送李郎中德昌北还情见乎辞
1182650,北还登汉阳北原题临川驿
1070733,清湘道士潘静素抱琴南来予方谪居远屏郊外如逃虚中每佳辰良夜风清月明对脩竹俯清池必快作数弄如是几年今将北还旧隐索诗为别屡请而不懈因歌而送之
64919,丁酉北还述怀呈社中诸子
581382,送修书黄陈二进士事竣北还 其二
44263,任公讲学白下及北还索句赠别
547870,寄吴少溪宫录七十 其六十七 送张昆江文学北还
705882,趵突泉送严子餐都谏北还
1070711,自然解印北还作古风送行
538211,赠刘君北还兼简谢丈茂秦
689615,送修书黄陈二进士事竣北还 其二
664504,送毛东塘侍御北还后怀寄八首 其六
581873,春日北还鄱阳湖即事
314813,临江仙·丙子秋自岭表避乱北还，适得香宋老人峨眉寄诗，因赋小词为报
468285,次韵送周府引礼舍人崇德程原道奉使入越买茶北还
606583,送谭金吾北还
1222486,予自闽中北还舟行过常秀间卧听棹歌殊有惬予心者每一句发端以声和之者三扣其辞语敷浅而鄙俚曾不若和声之欢亮也因变而作十二阕且道其传送艰苦之状亦刘连州竹枝之意云 其一
495184,送姚兴公北还 其二
1222490,予自闽中北还舟行过常秀间卧听棹歌殊有惬予心者每一句发端以声和之者三扣其辞语敷浅而鄙俚曾不若和声之欢亮也因变而作十二阕且道其传送艰苦之状亦刘连州竹枝之意云 其五
690752,送姚兴公北还
1222489,予自闽中北还舟行过常秀间卧听棹歌殊有惬予心者每一句发端以声和之者三扣其辞语敷浅而鄙俚曾不若和声之欢亮也因变而作十二阕且道其传送艰苦之状亦刘连州竹枝之意云 其四
355467,水调歌头·广陵送李长文学士北还
383748,送张昆江文学北还
469774,丁酉北还述怀呈社中诸子
595484,送张南川春元省觐北还因上春官
764029,水调歌头 广陵送李长文学士北还
317018,送贡三弟北还
664503,送毛东塘侍御北还后怀寄八首 其五
581048,赠王司谏文哲奉使北还兼柬吴世美司谏
1235318,予自闽中北还舟行过常秀间卧听棹歌殊有惬予心者每一句发端以声和之者三扣其辞语敷浅而鄙俚曾不若和声之欢亮也因变而作十二阕且道其传送艰苦之状亦刘连州竹枝之意云
581381,送修书黄陈二进士事竣北还 其一
329740,道州何道士相会于途次匆匆告归余亦北还作诗致远别之意
664499,送毛东塘侍御北还后怀寄八首 其一
9146,送安都秀才北还
1222488,予自闽中北还舟行过常秀间卧听棹歌殊有惬予心者每一句发端以声和之者三扣其辞语敷浅而鄙俚曾不若和声之欢亮也因变而作十二阕且道其传送艰苦之状亦刘连州竹枝之意云 其三
1211555,送观志能分得君字志能与仆同榜又同南台从事考满北还
531063,送周子吁工部北还
901407,梁才甫自湖南移使广西自广西移使广东自广东复移湖外三年之间周历四路今者北还已越郴岭道次作诗见寄渴于会遇谨用赓和
664505,送毛东塘侍御北还后怀寄八首 其七
388241,余以幽忧久废吟咏至八月十二日夜忽梦於停云馆饯人北还
664500,送毛东塘侍御北还后怀寄八首 其二
329116,端午日北还至斛岭寄连州诸公
1193148,送柳道时余北还
1186207,送安都秀才北还
495183,送姚兴公北还 其一
1222487,予自闽中北还舟行过常秀间卧听棹歌殊有惬予心者每一句发端以声和之者三扣其辞语敷浅而鄙俚曾不若和声之欢亮也因变而作十二阕且道其传送艰苦之状亦刘连州竹枝之意云 其二
739115,送贡三弟北还
575405,奉召北还，元日邀友人集大安暨氏耀金亭，分得连字
495193,北还入浙偶成
627018,喜刘长孺婿上书北还
664501,送毛东塘侍御北还后怀寄八首 其三
1209052,虞美人 福州北还雨中观梅
733373,孙钟元先生北还夜话宁境僧舍
1063767,送文中北还
1041752,隐直感秋思南游予欲北还未得
11129,送柳道时余北还
1217094,中秋望亭驿对月代祀北还
664506,送毛东塘侍御北还后怀寄八首 其八
52082,大驾北还
855505,温原庙神御北还和谢景思韵
664502,送毛东塘侍御北还后怀寄八首 其四
478020,大驾北还
818387,任公讲学白下及北还索句赠别
675200,赠郭侍御北还
