348289,携酒见过·酒味年来美
1036083,浣溪沙 十二月二日雨后微雪，太守徐君猷携酒见过，坐上作浣溪沙三首。明日酒醒，雪大作，又作二首 其三
348729,元舆携酒见过
345549,到象州寓行衙太守陈容德携酒见过
522165,生日三江石潭携酒见过且以诗补寿六十次韵为谢 其二
993961,迁居亲戚携酒见过
746872,王秋垞子梅携酒见过同酌黄叶堆中
603066,吴茂才子赞偕黄欧六文士携酒见过雅集
155970,何茂宏茂恭携酒见过复侑以诗次韵
471022,张翁携酒见过用前韵
524107,东庄谢臬司诸公携酒见过
348730,携酒见过·沉毅陈夫子
1073577,到象州寓行衙太守陈容德携酒见过二首 其一
515818,夜泊河西务京兆杨君恒叔携酒见过别后赋一律奉寄不弃衰散和教为佳
1036081,浣溪沙 十二月二日雨后微雪，太守徐君猷携酒见过，坐上作浣溪沙三首。明日酒醒，雪大作，又作二首 其一
594046,陈膳部子寿朱计部子得携酒见过得留字
608794,黄行父携酒见过而雨骤至
208847,七夕后一日诸公携酒见过
111879,中秋前一日诸生携酒见过对月同赋
922116,詹守携酒见过，用前韵作诗，聊复和之
91189,迁居亲戚携酒见过
1036084,浣溪沙 十二月二日雨后微雪，太守徐君猷携酒见过，坐上作浣溪沙三首。明日酒醒，雪大作，又作二首 其四
1075604,周秀实陈庭藻携酒见过徜徉湖山间甚款明日秀实有诗乃次韵
346028,携酒见过·饤坐黄甘噀手香
1050408,元舆携酒见过三首 其二
1055490,次韵陈君俞携酒见过
194128,公冶携酒见过与者温元素康致美赋诗投壶再用
1050407,元舆携酒见过三首 其一
49632,张翁携酒见过用前韵
1110472,到象州寓行衙太守陈容德携酒见过二首
173244,谦仲好古携酒见过伯氏以诗谢之次韵
1050409,元舆携酒见过三首 其三
542136,敬轩诚轩携酒见过西岩西池同赋
533705,张司理羽王将之雷阳携酒见过招姚元白苏子川吴化卿欧桢伯黄定甫同集
608702,正月三日黎惟仁诸公携酒见过得供字
603301,贱辰承吕维师徐献和李宗诚曾舜徵袁季友诸省丈及罗布衣汝存携酒见过集杜
939106,予始生日岩叟携酒见过且有寿语赋此以谢之
603044,闰九月八日承茂才元生偕乃兄弟侄诸文士携酒见过因订九日之会
362564,重九日雨张守先携酒见过
593600,郑伯良张元易二光禄携酒见过得丝字
999283,何茂宏茂恭携酒见过复侑以诗次韵一首
1116825,浣溪沙 十二月二日雨后微雪，太守徐君猷携酒见过，坐上作浣溪沙三首。明日酒醒，雪大作，又作二首
1036082,浣溪沙 十二月二日雨后微雪，太守徐君猷携酒见过，坐上作浣溪沙三首。明日酒醒，雪大作，又作二首 其二
1074785,次韵次卿携酒见过
884379,七夕后一日诸公携酒见过
1073578,到象州寓行衙太守陈容德携酒见过二首 其二
862974,谦仲好古携酒见过伯氏以诗谢之次韵
966420,公冶携酒见过与者温元素康致美赋诗投壶再用前韵
1036085,浣溪沙 十二月二日雨后微雪，太守徐君猷携酒见过，坐上作浣溪沙三首。明日酒醒，雪大作，又作二首 其五
593717,元夕伍子谦朱子得谢叔蒙携酒见过得招字
881904,中秋前一日诸生携酒见过对月同赋
593322,刘继孝钱德咸二僚长携酒见过同邵山人恩上人集绣佛斋
1125770,元舆携酒见过三首
522164,生日三江石潭携酒见过且以诗补寿六十次韵为谢 其一
596151,黎惟敬携酒见过迟董述夫张来聘诸子不至
1070702,九月二日徙居双泉翌日徐自然使君李申之监郡携酒见过退成古调百三十言戏简二公一笑
100464,詹守携酒见过用前韵作诗聊复和之
262739,王秋垞子梅携酒见过同酌黄叶堆中
336459,次韵次卿携酒见过
700213,生日三江石潭携酒见过且以诗补寿六十次韵为谢
615566,立冬日寓羊城黎君选何赞侯陶摇光傅贞父彭伯时戴安仲同区启图区叔永诸子携酒见过
602957,元夕旅泊石湾杨明壮携酒见过舟中
616009,黄逢永黎君选陶遥光陈集生诸子携酒见过池亭用黄韵
