907964,富池罗汉院有钱希白中大科赴信州别驾时所题诗有陈朝柏二绝句 其二
531015,登金华山玉京观中有陈子昂书台 其一
940962,重九日登道山亭柱间有陈休斋题词曰师相者先君也予既感时之用师而怀先君之去此已垂卅年慨然流涕归而赋之
316483,赠平羽·岂有陈王八斗才
420722,望海潮 其二 姚名达教授与其女弟子封禾子沈乃蓉二女士为女子月刊社宴客于沪上青年会，时予方自槟城假归，被邀列席，在座有陈碧云梁雪清诸女士及王统照赵景深汪馥泉许杰张若英马子华上官公仆等三十余人，皆当世文坛名作家，洵省事也。因为之赋
1139481,武冈向权叔家有陈魏祠堂合祀简斋鹤山惟两公世异事殊实难牵合诸公既极推引复徵予言
526309,送金子有陈羽伯春试
548350,四月十二日秦太学邀同赵吏部饮衍泽堂达旦坐有陈李二姬堂为余故读书处
1066577,丁巳游大雄寺有陈朝桧
196803,挽诗·讵有陈平解久贫
1114568,富池罗汉院有钱希白中大科赴信州别驾时所题诗有陈朝柏二绝句
1246413,题石末元帅扇上有陈太初画松
209366,武冈向权叔家有陈魏祠堂合祀简斋鹤山惟两公
169694,重九日登道山亭柱间有陈休斋题词曰师相者先
319503,杂感·亦有陈东泣上书
692704,登金华山玉京观中有陈子昂书台
531016,登金华山玉京观中有陈子昂书台 其二
1147934,皇太子频赐存问并索唱和新诗因有陈谢
907963,富池罗汉院有钱希白中大科赴信州别驾时所题诗有陈朝柏二绝句 其一
320812,再和·惟有陈园接府城
73675,漫兴·永嘉为儒有陈子
