559126,丁未七夕雨适郑德进馈芳园胡桃时乡人报夷舶因风出洋矣转忆沈约有云胡桃挺自禁地为胡羯奔逃之兆感而赋此 其一
908367,宋文约有谒于邡江不遂而归复用韵见贻以此答之
1113816,八月晦日游东山彦约有诗次韵为谢二首
231115,答熟庵·昨宵约有临西池
559127,丁未七夕雨适郑德进馈芳园胡桃时乡人报夷舶因风出洋矣转忆沈约有云胡桃挺自禁地为胡羯奔逃之兆感而赋此 其二
50338,与诸弟别乐庵弟约有江阳之会
331049,八月晦日游东山彦约有诗次韵为谢
471033,重过拂水山居经宿遂撤新楼开竁域主人复申墓田耦耕之约有述
1032369,庚辰六月陪谨斋准轩雅山游西禅超师院以柳诗道人庭宇静分韵约有兴即赋余得庭字时小寐禅床风雨适至遂赋宇字
1070812,八月晦日游东山彦约有诗次韵为谢二首 其二
476659,与诸弟别乐庵弟约有江阳之会
306951,虞美人·西湖苏小小墓石隐约有
538307,斋日子相考功投诗见怀且拟郊游之约有答
695580,丁未七夕雨适郑德进馈芳园胡桃时乡人报夷舶因风出洋矣转忆沈约有云胡桃挺自禁地为胡羯奔逃之兆感而赋此
820383,虞美人 西湖苏小小墓石隐约有「佳人例让才人吊」之句不知何人所题盖亦伤心人语耳
104937,水荭·灼约有芳艳
1070811,八月晦日游东山彦约有诗次韵为谢二首 其一
305987,有约·有约成痴忆镜台
180386,宋文约有谒於邡江不遂而归复用韵见贻以此答
243991,王局治·座隅依约有余香
336419,有约·有约携樽去
