1109903,次韵王漕见赠并寄曾吉父二首
143909,夏日和友人见赠并谢兰膏名酒
329120,次韵王漕见赠并寄曾吉父
845101,同张琳论事谈诗有赠并送归省沅江
694673,夏日和友人见赠并谢兰膏名酒二首
830775,同张琳论事谈诗有赠并送归省沅江 其一
498544,子荆复倒压前韵一首亦复和之即以奉赠并呈端己韬仲子山诸叔及孝仪兄
524237,晚过序公戏赠并喜徐编修缙迹访二首 其一
1079988,次韵王漕见赠并寄曾吉父二首 其二
694986,喜会归安二尹徐石濑乡丈赋赠并谢二首
789567,摸鱼子 家仲甫丈宴黄韵甫大令于湖上，即赋赠并送归海盐。韵甫惊才绝艳，所著帝女花、鸳鸯镜、桃溪雪各种传奇，盛行于时。曾在皖中李霭如方伯幕府，擘笺赌句，剪烛传歌，殆无虚日，今方伯溘逝，时变日亟，大江南北满目烽尘，殊有萧瑟江关之慨矣
420702,满江红 其二 黄岩管震民老丈以手书条幅见赠，并嘱为其玉照留题，因谨倚少苏大兄满江红原韵，填此阕报之，即希粲正
647371,夏日和友人见赠并谢兰膏名酒二首 其一
683782,程孟孺谒余武昌以是日至而余以是日发因偕登庐岳各返故里遂成二绝为赠并呈豫章诸王孙
544528,友人分惠秋海棠一本烂漫槛中自缀小词命双鬟霓裳歌以送酒醉中赋赠并命玉素和之
691761,晚过序公戏赠并喜徐编修缙迹访二首
1079987,次韵王漕见赠并寄曾吉父二首 其一
540283,程孟孺谒余武昌以是日至而余以是日发因偕登庐岳各返故里遂成二绝为赠并呈豫章诸王孙 其一
590940,喜会归安二尹徐石濑乡丈赋赠并谢二首 其二
828853,浣溪纱·栩园于临武得赵明诚金石考，贻书来告，并道李易安跋语。会余从蔡哲夫得赵李夫妇归来堂校碑砚拓，因以移赠，并题一词
411908,有赠并序
818720,雨晴访芸生归而有作，因赠并寄寰尘
1043650,赴官京东同舍诸公观音院见饯有赠并简不至者
830776,同张琳论事谈诗有赠并送归省沅江 其二
290125,有赠并序·情比桃潭水
730274,朝鲜参政海崖使君游历至嘉州过访郡斋情深文明语及三韩国是并中夏大局忧愤形于词色殆豪杰之士也临行书联语见赠并祈一诗乃为长句报之
677614,冬日毛右军自螺川枉访精舍赋赠并寄讯耿符台
818341,开岁四日黄秋岳自沪至雪中登六和塔归过我即别戏赠并题新诗卷得二绝 其一
277846,水龙吟·有赠并索美人画幅
706159,李广生自黔阳生还归阙率尔吟赠并感洪一龙三阳太仆山公及郎君郑石诸逝者浮湘亭之游
818342,开岁四日黄秋岳自沪至雪中登六和塔归过我即别戏赠并题新诗卷得二绝 其二
1068796,子温县丞侄长篇见赠并携少卿伯父梅堂所赋绝句相示翰墨宛然叹息久之因次其韵
829334,开岁四日黄秋岳自沪至雪中登六和塔归过我即别戏赠并题新诗卷得二绝
559076,陈德真尊壶刲股活翁赋此为赠并期德真
304955,中秋日赵仲固前辈招同曾君表比部祝吏香太守饮熙春堂，即席赋赠并呈君表
590939,喜会归安二尹徐石濑乡丈赋赠并谢二首 其一
728121,逢韩茂贻因赠并追伤戴敬夫
43804,逢韩茂贻因赠并追伤戴敬夫
464370,相见欢 养浩以近影寄赠，并媵新词。次和
561650,俨山学士以漆镂八仙盘见赠并侑以诗用韵奉谢
414091,乙卯仲冬让公来劄略云小恙医嘱半休又游菜市口得廉价宜书纸将以两卷为赠并拟以菜市口寻曹芹圃不遇为题书长句一时兴发先书长句却寄
464899,绮罗香 庆育往巴黎，旋回金陵，先后道出比京，为步玉田原韵赋赠。并寄黄贯道、袁子健
764793,百字令 海昌署中古柏相傅千百年神物屡著灵异尝亲降墨迹于署之西轩自称古木主人笔势飘洒语亦盘曲可味当事者勒诸碑石胡云次刺史泽沛以拓本见赠并索题词
540284,程孟孺谒余武昌以是日至而余以是日发因偕登庐岳各返故里遂成二绝为赠并呈豫章诸王孙 其二
545197,夜过汪士能家看灯同肇元太学奕戏赠并呈司马公
1088362,卧龙之游钱通守得江字不及赋诗已解维矣熹用其韵纪事以赠并附卷末
424901,六月三日饯别秋湘之奉新即席赋赠并示吾社诸子
838580,施沄访山长在厦用「寄郑养斋原韵」作诗二首寄赠，并索和章；仍用原韵奉呈 其二
631399,尚都统宜芾入山时将搆梵殿叨承净檀赋赠并谢
524238,晚过序公戏赠并喜徐编修缙迹访二首 其二
501180,答豫章邓文若进士见赠并谢苏昌龄徵君
85469,晴皋以平蛮三将题名及元佑党籍碑拓见赠并先以诗赋此答谢
787701,钝斋主人赋诗见赠并弁言白云洞读书图作长句谢之
277603,雨晴访芸生归而有作，因赠并寄寰尘
389988,程孟孺谒余武昌以是日至而余以是日发因偕登庐岳各返故里遂成二绝为赠并呈豫章诸王孙
1113410,杨仲子携诗见过次韵酬赠并呈诚斋二首
790397,中秋日赵仲固前辈招同曾君表比部祝吏香太守饮熙春堂，即席赋赠并呈君表
788855,水龙吟 有赠并索美人画幅
843708,施沄访山长在厦用「寄郑养斋原韵」作诗二首寄赠，并索和章；仍用原韵奉呈
647372,夏日和友人见赠并谢兰膏名酒二首 其二
760295,晴皋以平蛮三将题名及元佑党籍碑拓见赠并先以诗赋此答谢
838579,施沄访山长在厦用「寄郑养斋原韵」作诗二首寄赠，并索和章；仍用原韵奉呈 其一
141279,杨仲子携诗见过次韵酬赠并呈诚斋
545080,吴文仲明府过访有赠并柬喻水部
385870,壶园秋兴二首，次郑蓉轩广文见赠并贺小孙幸捷元韵
902953,杨仲子携诗见过次韵酬赠并呈诚斋二首 其一
251400,相见欢·养浩以近影寄赠并媵新词次和
902952,杨仲子携诗见过次韵酬赠并呈诚斋二首 其二
