949263,春从天上来 武昌秋夜
311392,定风波·两年以来，屡约藏云来武汉大学讲学，辄因故不果，拈此调之
504112,季翔弟惟学自嘉禾来武昌省母及其还也赋诗为别乃翁清江先生有文集行于世惟学婿于沈氏云
546759,汪明府以校文来武林旬日别去追送四章 其三
546758,汪明府以校文来武林旬日别去追送四章 其二
97443,蕃欲为辰阳之行适寺簿先生以使事来武陵既获
1247460,永平王谷云来武夷奉其师慈谷萧先生仙蜕以归蓝山拙者嘉其谊而赠之
827063,定风波 两年以来，屡约藏云来武汉大学讲学，辄因故不果，拈此调之
196414,游武夷山·我来武夷山
697420,汪明府以校文来武林旬日别去追送四章
546760,汪明府以校文来武林旬日别去追送四章 其四
546757,汪明府以校文来武林旬日别去追送四章 其一
1052753,予十一月甲申以使来武冈坐茅茨之室逼闾阎之陋无故人往来之乐怀羁旅不足之情于是有游古山之寺在县西十五里而山水俊拔深秀亦有可爱者因留置酒抵暮还驿而作是诗
974466,蕃欲为辰阳之行适寺簿先生以使事来武陵既获再侍又蒙俯用近者寄上鄙韵赐之辄复次韵叙别并呈子实百六丈
