1089126,小憩孙氏竹轩观诸公诗 其二
978637,读江南诸公诗
1093082,僧窗观斯远诸公诗
1095853,永嘉壁书记携诸公诗卷索语
1122769,钟惠叔转示赵临安两山堂诸公诗刻随喜二首
342224,用景卢诸公诗轴韵招监司太守
1089125,小憩孙氏竹轩观诸公诗 其一
200083,读江南诸公诗
144024,锺惠叔转示赵临安两山堂诸公诗刻随喜
674111,次林宫保见寄留别诸公诗
1218651,王彦芳御史所居之堂曰绣荣诸公诗题卷末
220250,妙空出示诸公诗卷次元韵
709276,暮春羊城社集诸公诗成寄示并索赋赋此答和
233259,萧长公来访示以诸公诗卷谓与予游从之久不能
963701,钟惠叔转示赵临安两山堂诸公诗刻随喜二首 其二
376278,永嘉壁书记携诸公诗卷索语
571996,德胜桥水轩集诸公诗
943776,次诸公诗韵
504758,题息斋南风堂松竹图有欧阳虞揭诸公诗
351948,观诸公诗·种竹主人今白发
1228002,观弋阳诸公诗题其后简刘国瑞
879603,萧长公来访示以诸公诗卷谓与予游从之久不能一辞为赠颇相噍责予赋之不可辞之亦不可皆有说焉名章俊语前后相望无数次乎其间是睹西子之容面自增丑耳所不容却者予年十五时海山官丁受琴于长夫今予年四十与长夫有二十五年之旧辞之弗作其可乎因书数言
1086898,用景卢诸公诗轴韵招监司太守
856302,灯下读魏彦成诸公诗因次其韵呈曾子修诸君
120272,次诸公诗韵·墙围护风烟
982313,元祐三年余被召至京师从翰林苏先生过兴国浴室院始识汶师后二年复来阅诸公诗因次韵
879602,萧长公来访示以诸公诗卷谓与予游从之久不能一辞为赠颇相噍责予赋之不可辞之亦不可皆有说焉名章俊语前后相望无数次乎其间是睹西子之容而自增丑耳所不容却者予年十五时海山官丁受琴于长夫今予年四十与长夫有二十五年之旧辞之弗作其可乎因书长句
1112915,小憩孙氏竹轩观诸公诗
233261,萧长公来访示以诸公诗卷谓与予游从之不久不
141922,灯下读魏彦成诸公诗因次其韵呈曾子修诸君
351837,小憩孙氏竹轩观诸公诗
963702,钟惠叔转示赵临安两山堂诸公诗刻随喜二首 其一
680839,留别部院诸公诗
904039,妙空出示诸公诗卷次元韵
