438807,兴定庚辰夏六月望予与元好问赵郡李献能同游玉华谷又将历崧前诸刹因憩于少姨庙元周行廊庑得古仙人词于壁间然其首章直屋漏雨为所漫剥殆不可辨乃磴木石而上拂拭汛涤迫视者久之始可完读观其体则柏梁事则终始二汉字画在钟王之间东井又元鼎所都幽州必贤宗子虞也夫眷眷不忘幽州者非吾田畴尚谁欤田复所事之雠却曹瞒之赏衰俗波荡中挺挺有烈丈夫风气其死而不忘盖无疑其能道此语亦无疑观者不应以文体古今之变而疑仙语也噫仙山灵岳宜有闳衍博大
588374,己酉岁壬辰之夜梦与三洲李丈登高台遥望中原但见齐州九点在苍霭中隐隐可辨三洲曰宇宙内事吾儒分内事也曰子知分内之事则知尽分内之道乎三洲又曰吾今乃知居高则明处下则塞曰子知明塞之义则知尽居处之道矣三洲又曰天地山河存乎两界秦晋为首闽越为尾馀皆毛发肢节也曰子通督任之义则知通致理之源矣须臾云霞四歛皎日照衣环顾太和万物融合浑为一丸三洲曰此所谓弄丸者耶曰子知转九之义则宇宙之柄在手矣语罢而觉遂赋四章以纪其事因以赠三洲之
625507,浮丘诗赠林翁翁字粤夫每醉谈忠孝事则气见于须义生于齿 其二
625506,浮丘诗赠林翁翁字粤夫每醉谈忠孝事则气见于须义生于齿 其一
895038,客有谈嘉祐间事者一客瞪目不应及闻介甫新事则心目开明殊可怪也聊作诗以纪之
702913,浮丘诗赠林翁翁字粤夫每醉谈忠孝事则气见于须义生于齿
