1088498,伏读致政少傅相公送赵成都佳句两篇不胜慰幸已次高韵并饯其行而再赋此章以见区区瞻仰之意缮录拜呈伏乞采览 其一
1068550,长句送以道既辱和答而夏传圣诗亦用此韵以道复和一篇篇末颇及少逸与不肖因再赋此传圣姻家书问必数或可达以道
790881,二十六日朔风逾紧小女捧盆就火俄闻窸窣声，启视则虫焦矣。此虫不死于寒反死于热，不特予不及料，即虫亦不自料也。再赋此唁之
918645,金缕曲 月夕赋道词，书毕，怆然有 感，再赋此
418653,蝶恋花 前意不畅，再赋此即寄荫君
844773,丁巳元日赋长篇后意未尽而韵已将尽乃再赋此二章吾平生所得在此也
830221,丁巳元日赋长篇后意未尽而韵已将尽乃再赋此二章吾平生所得在此也 其二
184200,陈传朋和余梅花旧作余再赋此
882743,陈传朋和余梅花旧作余再赋此
1099998,嘉禾瑞于丁卯此粟瑞于戊辰两年之间嘉瑞迭见所产之地其名亦美琴化所感盛矣哉再赋此为梯飙明府贺
319032,蝶恋花·前意不畅，再赋此即寄荫君
1088499,伏读致政少傅相公送赵成都佳句两篇不胜慰幸已次高韵并饯其行而再赋此章以见区区瞻仰之意缮录拜呈伏乞采览 其二
320401,再赋·此地龙舒国
531365,高泉临行再赋此以别
403297,高阳台 午枕方酣，花帘影艳，延赏至再，赋此
784556,乙卯九月九日来游西涧西涧主委客去竟赴千像寺斋遂得孤游竟日戊午夏又至西涧涧主又赴千像寺斋时节顿易而踪迹略同追和前作再赋此诗
544825,长公偶以小恙为余强起卧榻间隐几对谈阅二晨夕迫归告别意殊恋恋再赋此
830220,丁巳元日赋长篇后意未尽而韵已将尽乃再赋此二章吾平生所得在此也 其一
309791,高阳台·午枕方酣，花帘影艳，延赏至再，赋此
1110916,伏读致政少傅相公送赵成都佳句两篇不胜慰幸已次高韵并饯其行而再赋此章以见区区瞻仰之意缮录拜呈伏乞采览
