619431,丙午再入闽闱
337781,癸巳再入京宿璜溪寄二弟
784629,再入千山游大安寺
472224,宿润州半月再入金陵留别姚麓居道纪
279921,再入华山·客病经年矣
640047,洪武十八年二月二十日自漳州府回闽宪因思去年七月五日出闽关土人云宪司官初过此关值微雨故有小不利今出关而天日晶明旌节当复还矣及至京师纠劾奸贪事既得实彼乃伏诛我则还职再入关天又晴人复云必大亨也前后所作二绝句谩志于此 其一
849794,再入台作
619282,再入那山读书
793804,再入华山
675118,再入华山
695199,壬辰九月二十二日再入讲筵进讲得诗三首
223050,贺游先生再入元枢
230058,奉呈制机·三弄董风再入弦
556108,寄赠曾郎中再入礼部
604573,过饮黄周士小园柱诗见赠隃今三载再入五羊重辱招呼乃克和答 其二
690476,过饮黄周士小园柱诗见赠隃今三载再入五羊重辱招呼乃克和答
918182,次早再入山用前韵
638053,再入羚羊峡
636117,喜衣石上人再入山同住
543488,乙未秋邂逅梅生泰符把臂甚昵同观涛江上别去未几则闻生病且殆俄闻生竟不起矣余再入武林检敝箧得生手书屡纸不胜山阳邻笛之怆爰赋二言投宛溪之上以吊之 其一
537137,甲戌春暮再入都憩善果寺逢杏花作
1099576,癸巳再入京宿璜溪寄二弟
609545,再入显灵道院有感 其三
245394,次早再入出用前韵
94736,再入城宿张氏庄早起进退格
766026,桃源忆故人 再入都中，留别淝上许燕珍夫人
1038681,再入禁林即事
543489,乙未秋邂逅梅生泰符把臂甚昵同观涛江上别去未几则闻生病且殆俄闻生竟不起矣余再入武林检敝箧得生手书屡纸不胜山阳邻笛之怆爰赋二言投宛溪之上以吊之 其二
1218873,贺李左丞再入中书
867536,再入湖南境
609543,再入显灵道院有感 其一
665243,壬辰九月二十二日再入讲筵进讲得诗三首 其二
937000,喜杨廷秀秘监再入馆
238827,再入湖南境
82778,喜杨廷秀秘监再入馆
892257,再入翰林
341860,再至保州·再入中原境
321380,阮仙翁宅·再入山中去
297518,摸鱼子·再入都有感
863555,贺范舍人再入西掖
665244,壬辰九月二十二日再入讲筵进讲得诗三首 其三
636151,送何不偕再入吴门
703084,洪武十八年二月二十日自漳州府回闽宪因思去年七月五日出闽关土人云宪司官初过此关值微雨故有小不利今出关而天日晶明旌节当复还矣及至京师纠劾奸贪事既得实彼乃伏诛我则还职再入关天又晴人复云必大亨也前后所作二绝句谩志于此
768552,清平乐 送家柘西再入东粤
682529,再入显灵道院有感
893609,贺游先生再入元枢
1228673,湖山歌送攸州武宽则再入京
869516,和伯镇再入馆
109004,再入台·紫纶飞下会稽山
124748,再入翰林·银台路入複门赊
1147925,再入道场纪事应制
495214,再入长江
773528,七月七日再入大湖作
351474,再入禁林即事
665242,壬辰九月二十二日再入讲筵进讲得诗三首 其一
609544,再入显灵道院有感 其二
980022,闻胡少汲再入省
344677,再入西林·风急晴皋落野禽
986147,再入台
919630,八月十二日再入都
640048,洪武十八年二月二十日自漳州府回闽宪因思去年七月五日出闽关土人云宪司官初过此关值微雨故有小不利今出关而天日晶明旌节当复还矣及至京师纠劾奸贪事既得实彼乃伏诛我则还职再入关天又晴人复云必大亨也前后所作二绝句谩志于此 其二
697479,乙未秋邂逅梅生泰符把臂甚昵同观涛江上别去未几则闻生病且殆俄闻生竟不起矣余再入武林检敝箧得生手书屡纸不胜山阳邻笛之怆爰赋二言投宛溪之上以吊之
604572,过饮黄周士小园柱诗见赠隃今三载再入五羊重辱招呼乃克和答 其一
133954,和伯镇再入馆
149324,闻胡少汲再入省
749315,再入都门有疑以谒选来者赋诗为笑
915181,再入城宿张氏庄早起进退格
153503,八月十二日再入都
177949,贺范舍人再入西掖
836283,摸鱼子 再入都有感
629323,再入栖贤谒天和尚
657127,再入山中偕友人饮
545614,再入武林柬王水部并怀蔡南宫
