1159115,留别复本修古二上人
26742,留别复本修古二上人
67383,惜别·惜别复惜别
1006374,具上人以诗相别复和之
231893,具上人以诗相别复知之
454848,留别复旦诸同门
604464,泰和萧君还拙以青乌氏客端州十六寒暑矣馆于余者甫三年乡思忽动孤舟遄发既惜其别复望其来乃留其家还拙以古人行谈古人术往往能取今人信第今人得还拙曰地师余得之曰人师也故于其言别也既为之治装复为之赋诗 其一
650042,留别复古谢先生
1142421,比来东安以欢字十二韵别复翁继有和章送别今再和答之
138492,耿曼老将命乡邦见过匆遽言别复作诗送之
566834,将别复偕游碧云流觞枯柳之下
604465,泰和萧君还拙以青乌氏客端州十六寒暑矣馆于余者甫三年乡思忽动孤舟遄发既惜其别复望其来乃留其家还拙以古人行谈古人术往往能取今人信第今人得还拙曰地师余得之曰人师也故于其言别也既为之治装复为之赋诗 其二
690455,泰和萧君还拙以青乌氏客端州十六寒暑矣馆于余者甫三年乡思忽动孤舟遄发既惜其别复望其来乃留其家还拙以古人行谈古人术往往能取今人信第今人得还拙曰地师余得之曰人师也故于其言别也既为之治装复为之赋诗
590665,十九夜到袁州念九发舟承五台邀邑博陈阳山潘木斋窦益斋临流饯别复遣使送至江滨一律谢之
889611,耿曼老将命乡邦见过匆遽言别复作诗送之
