384535,王履吉示余春日即事之作久而未复三月望后汎舟出西郭借韵赠答
477966,石湖绝句和王履吉
525107,寄王履吉
676484,予既和履吉八绝，因思湖上四时之景有不减此者，摘其可爱，更赋二首 其二
676604,蔡九逵文徵仲王履约汤子重王履吉诸知己自吴来访欢数日别去怅然增怀赋此奉寄
662868,答王履吉
551413,赵仁甫别驾解官归自夔府招同陈履吉陈平夫陈振狂集侣云堂
520563,怀知诗 王文学履吉二首之一 其三
469061,席上答王履吉
470324,寄陈履吉
61539,寄陈履吉
384252,予既和履吉八绝，因思湖上四时之景有不减此者，摘其可爱
52118,钱孔周席上话文衡山王履吉金元宾
662965,过王履吉墓二首 其二
668335,兰房曲戏赠王履吉效李贺
676379,仲春履吉与之永之小集得草字
676609,哭王履吉
526295,十一月五日同子鱼风雨舟往治平寺访履约履吉
676582,治平燕集与吴次明蔡九逵文徵仲钱孔周王直夫汤子重王履吉
48139,席上答王履吉
477994,钱孔周席上话文衡山王履吉金元宾
550396,怀陈履吉久居山中
384212,人日祝京兆徐子九王履吉集停云馆得题字
520564,怀知诗 王文学履吉二首之二 其四
662964,过王履吉墓二首 其一
525853,与王氏履约履吉文氏寿承休承袁氏补之永之六贤上方山玩月
676483,予既和履吉八绝，因思湖上四时之景有不减此者，摘其可爱，更赋二首 其一
659746,赠王履约履吉二生
477827,石湖伤王履吉一首
550873,夏日园居柬履吉
536836,虎丘老僧有竹林精舍文伯仁为图之王履吉书疏于后余游竹林僧出示此卷履吉下世已三十载矣为之怃然因成此诗
536836,虎丘老僧有竹林精舍文伯仁为图之王履吉书疏于后余游竹林僧出示此卷履吉下世已三十载矣为之怃然因成此诗
60683,石湖伤王履吉
668338,王履吉示余春日即事之作久而未复三月望后汎舟出西郭借韵赠答
687174,过王履吉墓二首
676447,人日祝京兆徐子九王履吉集停云馆得题字
682985,予既和履吉八绝，因思湖上四时之景有不减此者，摘其可爱，更赋二首
65516,石湖绝句和王履吉
526388,秋霁会王履吉朱振之诸君
525151,金元宾自吴赴山中商定王履吉遗藁临别有赠
741911,题马香谷所藏王履吉借券手迹
