578336,黄方伯饶泰政遣人送至常山因赋此以谢之
522142,吾乡先辈勇退急流者二人宪副定庵先生今八十八宪佥一斋先生今八十四予既数为定翁赋诗而宪佥不及非阙典欤何生行赋此以谢不敏且为他日乡邦故事云
222737,叶茂卿寄诗卷赋此以谢之
443655,香港李国明兄以墨梅一幅见赠赋此以谢 其二
186480,筠州曾使君寄贶中州新芽赋此以谢
1242932,雪庭上人惠药资是经钱，赋此以谢
586386,寿诞黄菊初开邑长诸公惠礼赋此以谢
939118,叶茂卿寄诗卷赋此以谢之
288989,杨笑侬叠寄新诗，并惠铁观音佳茗，赋此以谢
468027,香港李国明兄以墨梅一幅见赠赋此以谢
452417,三江兄远寄脐橙赋此以谢
448887,林丰俗兄赠牡丹图赋此以谢
186481,赋此以谢·黄蘖山前水绕沙
1211673,元统乙亥余除闽宪知事未行立春十日参政许可用惠茶赋此以谢
900310,筠州曾使君寄贶中州新芽赋此以谢 其一
250564,三江兄远寄脐橙赋此以谢
289454,赋此以谢·日高睡足起常迟
443654,香港李国明兄以墨梅一幅见赠赋此以谢 其一
1113160,筠州曾使君寄贶中州新芽赋此以谢
1212107,中书久病得请将归吴閒閒大宗师亦有疾以其象为赠云代彼陪行焚香对之作此以谢
585229,予有天津之行同僚耿副郎辈郊饶赋此以谢之
268333,贺新凉·钱奎卿见贻佳句，又为余莲因室稿作序，赋此以谢
222499,予始生日岩叟酒见过且有寿语赋此以谢之
432504,杨笑侬叠寄新诗，并惠铁观音佳茗，赋此以谢
422011,杨笑侬叠寄新诗，并惠铁观音佳茗，赋此以谢 其二
939106,予始生日岩叟携酒见过且有寿语赋此以谢之
900309,筠州曾使君寄贶中州新芽赋此以谢 其二
731002,贺新凉 钱奎卿见贻佳句，又为余莲因室稿作序，赋此以谢
512853,过华光禄适出乃返后遇途半叙话夜深余以丹毒思归遂解缆而东留此以谢失告之过
1248014,喜许孝廉见过赋此以谢
1214212,子昂学士为余作此山二字并作诗见畀其诗云青青云外山炯炯松下石顾此山中人风神照松色又云爽气在襟袖清风拂丝桐悠悠适天趣宴坐心融融书此以谢
508560,十六日与学士钱公亚卿章公会饮于崔都阃宅赋此以谢
531229,木泾周公裒集鄙诗刻之作此以谢
422010,杨笑侬叠寄新诗，并惠铁观音佳茗，赋此以谢 其一
