884615,罗巨济辟学之西序为轩以奉板舆之乐余名之曰难老轩
650243,帝王膺受天命至圣之德格于天心故三光全而寒暑时群生和而万物育是以上天昭锡景贶以彰盛美钦惟皇上统绍鸿基主宰神人宵旰图治至仁孚于海内至信昭于天下华夷效顺海宇清宁雨旸晦明各顺其叙时和岁登家给人足乃永乐十一年春二月皇上再狩北京行庆赏黜陟之典田野之民莫不鼓舞欢跃瞻仰日月之光华以为盛世太平之贺乃夏五月丁未山东兖州府曹县以驺虞来献白质黑章五采绚烂目光如电尾长倍躯起伏蹲卧不扰不惊在廷臣僚洎蛮夷酋长与夫工商舆?之徒莫
1066772,周文之运使巡按海宁追忆曩岁与伯仲同奉板舆之乐感慨赋诗不惟辞藻格力清蔚高迈且足以敦孝悌而厚风俗昔夏侯湛作诗示潘岳曰此文非徒温雅乃别见孝悌之性因次韵和二首 其二
357893,周文之运使巡按海宁追忆曩岁与伯仲同奉板舆之乐感慨赋诗
1066771,周文之运使巡按海宁追忆曩岁与伯仲同奉板舆之乐感慨赋诗不惟辞藻格力清蔚高迈且足以敦孝悌而厚风俗昔夏侯湛作诗示潘岳曰此文非徒温雅乃别见孝悌之性因次韵和二首 其一
1128507,周文之运使巡按海宁追忆曩岁与伯仲同奉板舆之乐感慨赋诗不惟辞藻格力清蔚高迈且足以敦孝悌而厚风俗昔夏侯湛作诗示潘岳曰此文非徒温雅乃别见孝悌之性因次韵和二首
208583,罗巨济辟学之西序为轩以奉板舆之乐余名之曰
