36730,霅溪馆送韩明府章辞满归
24126,雨中长乐水馆送赵十五滂不及
616153,同诸子集小馆送别区启图已成江字韵二首复取诸子所分咸覃盐肴四韵各成一律得咸韵
57558,玉泓馆送沈嘉则归越得微字
557510,妓馆送人还金陵
302091,陵阳江馆送韦寅东访漆夫村居
1147452,霅溪馆送韩明府章辞满归
1170849,雨中长乐水馆送赵十五滂不及
13330,立秋日与陆华原于县界南馆送邹十八
1179234,立秋日与陆华原于县界南馆送邹十八
268096,双调望江南·杭州旅馆送别迦陵
243267,溪馆送别·旅馆成佳集
297990,酌荷仙馆送庸斋
1160864,吐蕃别馆送杨七录事先归
610171,腊夜集约之馆送张闰生还广陵得春字
1147073,太湖馆送殷秀才赴举
547411,泰山客馆送朱可大登岳
36770,太湖馆送殷秀才赴举
557587,沙津妓馆送杨少通渡江南征
949783,溪馆送别
382796,泰山客馆送朱可大登岳
710286,陵阳江馆送韦寅东访漆夫村居
15491,吐蕃别馆送杨七录事先归
834893,双调望江南 杭州旅馆送别迦陵
472282,玉泓馆送沈嘉则归越得微字
