200558,汪正夫云已厌游湖上顾予犹未数往遂成长篇寄
826886,霓裳中序第一·城东人家艺菊得异种，花径尺有咫，重跗叠鄂，赪若明霞，余瓣四垂，蹁跹尽态，名曰羽衣舞。龙伯欲以此调写之，未数日遽即世。霜腴既槁，露迹同晞，乃为补题，并寄哀愫
1079559,潘邠老尝得诗云满城风雨近重阳文章之妙至此极矣后托谢无逸缀成无逸诗云病思王子同倾酒愁忆潘郎共赋诗盖为此语也王子立之也作此诗未数年而立之邠老墓木已拱无逸穷困江南未有定止感叹之馀辄成二绝 其二
959647,汪正夫云已厌游湖上顾予犹未数往遂成长篇寄之
1079558,潘邠老尝得诗云满城风雨近重阳文章之妙至此极矣后托谢无逸缀成无逸诗云病思王子同倾酒愁忆潘郎共赋诗盖为此语也王子立之也作此诗未数年而立之邠老墓木已拱无逸穷困江南未有定止感叹之馀辄成二绝 其一
1109949,潘邠老尝得诗云满城风雨近重阳文章之妙至此极矣后托谢无逸缀成无逸诗云病思王子同倾酒愁忆潘郎共赋诗盖为此语也王子立之也作此诗未数年而立之邠老墓木已拱无逸穷困江南未有定止感叹之馀辄成二绝
169736,右·诗跨唐人未数钱
1004247,遂宁喻生画鹿甚精介同官梁知丞谒余因令作八幅图帐适赤城观主惠一鹿甚驯未数日忽又一鹿奔至县圃非邑士所豢养者竟不详其所自来物理感召画龙而致真龙似未足为诞也借邑士张权父诗韵以赠之
155904,读淮海集·五言未数韦应物
513838,游惠山与廷韶赋诗看懋成作画不觉至暮相别未数里风雨大作竟误一程船窗灯下漫赋一律奉寄二君子
