401743,[中吕]喜春来  故乡
711113,和曾旅斋登飞来故地
522027,三山廖彦正往以新喻司训同校文南都秩满升吉安推官来别得备闻兵兴以来故人行事消息之详且出示其尊人德翁遗像及诸名人题咏临觞永叹赠以是诗
628344,戊辰仲冬作客新会主人邀余为长夜饮命女伶文仙佐觞歌若连琐笑能倾人细视其微往往有不悦之色余问何姓云某乡良家某姓子顾盼唏嘘不能自抑余亦为之罢酒嗟乎三四十年来故家巨室负才卓立者流落不偶不知凡几多人矣有心之士自悲悲人日且不足岂止一文仙已哉作诗二截并贻同志或有感余言而和之幸邮示我 其一
1214137,来故人
133025,还家即事·丁令归来故国时
420649,八声甘州 鹣庵相别廿余年，重来故都，谱此见示，次韵和之
501866,冯性之以顾定之墨竹寄其友方时举题曰清风来故人索赋一绝
689061,戊辰仲冬作客新会主人邀余为长夜饮命女伶文仙佐觞歌若连琐笑能倾人细视其微往往有不悦之色余问何姓云某乡良家某姓子顾盼唏嘘不能自抑余亦为之罢酒嗟乎三四十年来故家巨室负才卓立者流落不偶不知凡几多人矣有心之士自悲悲人日且不足岂止一文仙已哉作诗二截并贻同志或有感余言而和之幸邮示我
296529,八声甘州·鹣庵相别廿余年，重来故都，谱此见示，次韵和之
628345,戊辰仲冬作客新会主人邀余为长夜饮命女伶文仙佐觞歌若连琐笑能倾人细视其微往往有不悦之色余问何姓云某乡良家某姓子顾盼唏嘘不能自抑余亦为之罢酒嗟乎三四十年来故家巨室负才卓立者流落不偶不知凡几多人矣有心之士自悲悲人日且不足岂止一文仙已哉作诗二截并贻同志或有感余言而和之幸邮示我 其二
