1215478,谢主簿有客曰李玉田随君之京诗以为赠
894325,淳之太尉相公寄示赴镇小编三复成诵研味之馀理当酬继但难于遍和辄取首题赋成拙句一首既伸高山仰止之愿并以为谢
992148,余之亲家有女子能点酥为诗并花果麟凤等物一皆妙绝其家持以为岁日辛盘之助余丧偶儿女服未除不作岁因转赠通判通判有诗见答故走笔酬之
1083853,和道傍大松人取以为明
668236,斋前小山秽翳久矣家兄召工治之剪薙一新殊觉秀爽晚晴独坐诵王临川扫石出古色洗松纳空光之句因以为韵赋小诗十首 其五
921990,王晋卿示诗，欲夺海石，钱穆父、王仲至、蒋颖叔皆次韵。穆、至二公以为不可许，独颖叔不然。今日颖叔见访，亲睹此石之妙，遂悔前语。仆以为晋卿
921990,王晋卿示诗，欲夺海石，钱穆父、王仲至、蒋颖叔皆次韵。穆、至二公以为不可许，独颖叔不然。今日颖叔见访，亲睹此石之妙，遂悔前语。仆以为晋卿
521203,有草名雁来红者茎叶如鸡冠而无花得霜红甚俗呼老少年或画以贻樗翁良德南夫因赋以为寿予亦继作
431667,寒假家居接校中开课信息，天寒岁暮，绝裾远游，行路艰难，离魂酸楚，吟成律句，以为纪念云
378454,时余适金陵定居定林超然将南归从余游以为诗谶也复次其韵
498637,临行阿锁欲尽写前诗凡十一首既而色有未满曰：『斯语太文妾不用此可为别制数章取数月来情事综迹历历于心者谱之勿诳勿艳勿誉妾姿艺如一语有犯即罚君一杯』余曰『固然但每诗成而卿以为可亦引满赏此何如』一笑许诺遂口占为下酒十六首 其十五
571905,五弟新卜园居余笑曰柰物力不敷何社中遂以为韵作诗嘲之仍限四章各四韵 其二
1082456,王希深合新香烟气清洒不类寻常可以为道人开笔端消息
605117,冬十一月止园黄花大放携尊偕韩寅仲余士翘过之时寅仲七十有一因以为寿
687735,舍弟为予作一轩以为读书之所既落成诸友来贺作此诗歌以奉客
630675,康熙庚戌孟秋制府周彝初持服北归道出韶石订入山不果赋诗三首奉柬兼以为别 其二
459915,送人归乡之北。时约游岳阳楼以为别，既会而不果游，故以洞庭湖起兴
1070918,元弼主簿喜饮而吝于开阁又累输棋不偿同僚颇以为言八月朔出郊乃有厄陈之叹因再次其韵
514921,十三日文华后殿早进读尚书孟子午进讲大学衍义日以为常读毕赐宴讲毕赐茶上皆呼先生而不名惭感之馀敬赋以志
103336,刘成伯遗建州小片的乳茶十枚因以为答
1113940,至启休沐之中静专一室病不复饮无以慰怀性且寡合若何为乐但窗閒弄笔信意乱书无所从意无所得自如而已岂曰诗乎不觉又成五章章之首句皆云朱门多好景盖纪田第园林之胜美明公游豫之适昔张处士献牛奇章诗尤鲙炙人口其警句有带盘红鼹鼠袍砑紫犀牛之盛然而清议者不以为累公之德何哉赋闲宴而歌富贵也小子是作焉敢望回然亦驽骀之希骥尔
144808,惠莲峰诗以为谢
320111,知郡太博临宴公宇诗以为谢唐林夫在席
313571,破阵子·饮顾墨三长官祝同，明日遂返东战场，词以为别
573590,余尝游牛首从麓至巅幽胜应接不暇最后山僧引至一小山回观山面更觌全体因悟山内看山不如山外看山之旷窃持此法以搜洞胜乃择小阜筑室回向之一洞所有无不环列至瀑布在洞之上者两崖夹束翳以林霭一道水光隐约吞吐折而八洞始彰喷薄之全势而洞上之源游者向未之睹也推窗入目不觉大叫奇绝以为得未曾有譬诸西子之美不能自见其面对镜乃见之耳用前咏珠璧韵
412050,本届参政会余偶未出席知者多以为问其实偶然耳人生行止不必皆有理由如偶厌江瑶一思螺蛤亦何必定须理由邪戏书一律以当代答
1223934,缙山张君荣字仲华来丞抚之崇仁历两政六年心平气顺上下相安如一日虽有远役重劳亦无阙事甚可称也予之閒居相爱如故旧每怀扈从东道往来缙山道中见其风土之胜民俗之美未尝不谈道以为乐于其受代调官京师因记之以诗而与之别明年进秩南来观旧治父老儿童相迎于东门之外又当歌此以为一笑之欢也
1223934,缙山张君荣字仲华来丞抚之崇仁历两政六年心平气顺上下相安如一日虽有远役重劳亦无阙事甚可称也予之閒居相爱如故旧每怀扈从东道往来缙山道中见其风土之胜民俗之美未尝不谈道以为乐于其受代调官京师因记之以诗而与之别明年进秩南来观旧治父老儿童相迎于东门之外又当歌此以为一笑之欢也
457954,班中翻《三国演义》，伏见刘备兄盖世英雄，战无不败，宁屈不死，百逃不殆，及入赘东吴，始过上幸福生活；再逃东吴，又多得贤内之助；予仰之无已，因恭作二绝，以为颂歌焉 其二
1132337,次李参政所和五绝句韵因以为寿
853839,蟹至十数日而价比异时特贵贫者只得忍口薄暮有以为饷者作诗回饷
905465,昨晚又捧五章尽含六义意转新而韵皆紧才益赡而调弥高始知元白之前贤虚擅车斜之美誉夜来绕遍林树搜穷肺肝虽巧拙以不侔亦讴吟而自得又依前韵各罄乃怀所贵夫伏老之身心亦冈避不量力之讥诮自兹解甲且议休兵向非起予何以为乐大雅君子无或见咍 其二
103143,吴冲卿示和韩持国诗一卷辄以为谢
683071,斋前小山秽翳久矣家兄召工治之剪薙一新殊觉秀爽晚晴独坐诵王临川扫石出古色洗松纳空光之句因以为韵赋小诗十首
572057,王回先一夕尚痛饮叫笑如常时侵晓三弟来云回病且革以为戏也急往观之回奄然逝矣遂为长律哭之
1077707,去岁道巴陵登岳阳楼以望洞庭真天下之壮观也因诵孟浩然气蒸云梦泽波撼岳阳城之句追古今绝唱用以为韵赋诗十篇 其六
774145,台俗除夕门设纸虎祭以鸭焚之谓可厌煞余名之曰焚虎元夕女子偷折人家花枝谓异日可得佳婿余名之曰窃花往时在京师作梦树堂花二诗谓事极韵且可举以为偶也今兹将毋同因赋四绝句
35627,蔡撙·紫茄白苋以为珍
522301,赵叔敬佥宪示和东湖诗次韵写怀因以为赠 其一
921209,伯父《送先人下第归蜀》诗云：「人稀野店休安枕，路入灵关稳跨驴。」安节将去，为诵此句，因以为韵，作小诗十四首送之 其十一
1036118,醉翁操 琅琊幽谷，山川奇丽，泉鸣空涧，若中音会。醉翁喜之，把酒临听，辄欣然忘归。既去十馀年，而好奇之士沈遵闻之。往游，以琴写其声，曰醉翁操，节奏疏宕，而音指华畅，知琴者以为绝伦。然有其声而无其辞。翁虽为作歌，而与琴声不合。又依楚词作醉翁引，好事者亦倚其辞以制曲。虽粗合韵度，而琴声为词所绳约，非天成也。后三十馀年，翁既捐馆舍，遵亦没久矣。有庐山玉涧道人崔闲，特妙于琴。恨此曲之无词，乃谱其声，而请东坡
522391,昔司空表圣辞官后预营冢圹与宾客同游世传以为达予葬淑人迫于岁暮功虽未讫而规制定矣营度往还得绝句十二首目之曰生游棹歌非敢仰希先躅亦聊以寄兴云尔 其一
713945,次和惠州王子千太守初入罗浮宿冲虚观用东坡同子过游罗浮韵并以为寿
1052699,妇人面涂黄而吏告以为瘴疾问云谓佛妆也
904680,严一飞惠余一唯图书赞其上甚佳石更名忠恕图置之座右以为居官奉母之规再用眩字韵
605283,五月七日宝安诸君子招汎龙潭八日复汎篁村同观竞渡客有歌落日放船好轻风生浪迟之句者因以为韵人赋十章邓玄度六言首奏余亦步其韵以六言赓焉 其一
434755,李仲佐辽东之豪士也初识于大元帅席上怪其议论英发坐客尽倾至于通练世务商较人物虽博学老儒或有所不及仆喜其为人临分以二诗赠行且将以为定交之券也 其一
414655,江南故人闻余将休致咸劝东游辄赋小诗以为息壤七首 其三
498626,临行阿锁欲尽写前诗凡十一首既而色有未满曰：『斯语太文妾不用此可为别制数章取数月来情事综迹历历于心者谱之勿诳勿艳勿誉妾姿艺如一语有犯即罚君一杯』余曰『固然但每诗成而卿以为可亦引满赏此何如』一笑许诺遂口占为下酒十六首 其四
545620,袁履善过访余报谒秋湘馆则先一日避暑入虎跑矣泚笔题此章芭蕉茎上毋以为嵇生之凤也
920617,胡穆秀才遗古铜器，似鼎而小，上有两柱，可以覆而不蹶，以为鼎则不足，疑其饮器也，胡有诗，答之
498043,昔年同社为秋词，今成往事，离居多感，岁晏不聊，触绪生吟，冰霜满月，凛尖风之透骨，感皎月之映心，多因梦后之思，添出酒边之句，聊作秋声貂续，以为春咏前驱，合曰寒词得一十六首 其十
498038,昔年同社为秋词，今成往事，离居多感，岁晏不聊，触绪生吟，冰霜满月，凛尖风之透骨，感皎月之映心，多因梦后之思，添出酒边之句，聊作秋声貂续，以为春咏前驱，合曰寒词得一十六首 其五
1073570,雉山岩昔有僧结庵此山中诵法华经野雉日一集听之至终卷乃去率以为常忽数日不至山下有妇人产子腰胁间馀雉毛数寸寺有石纪其事 西山超然亭
1084322,辛亥九日侍家君同孙子渊子昭子尚登高于家之东山时菊花未开坐客皆以为恨至十月望独步东篱下见前日青枝已烂熳矣东坡云凉天佳月即中秋菊花开日乃重阳不以日月断也于是命酒肴呼邻里饮于丛畔云
342433,戎马错居列肆樵采绝迹多撤民屋扉几物以为薪
948649,邦衡置酒出小鬟予以官柳名之闻邦衡近买婢名野梅故以为对
532359,赠孙芝溪孙君廷载家世缙绅游意岐黄之术别号芝溪侍宦来莆小诗奉赠兼呈尊翁先生以为何如
492255,罗巡检一中由袁府告籴于赣道阻留西昌久之将归袁州诗以为别
521589,颐浩辩公寄莼菜瓜菹有别久不见渴心生尘之语因以为韵作绝句八首寄谢 其五
521585,颐浩辩公寄莼菜瓜菹有别久不见渴心生尘之语因以为韵作绝句八首寄谢 其一
905432,至启休沐之中静专一室病不复饮无以慰怀性且寡合若何为乐但窗閒弄笔信意乱书无所从意无所得自如而已岂曰诗乎不觉又成五章章之首句皆云朱门多好景盖纪田第园林之胜美明公游豫之适昔张处士献牛奇章诗尤鲙炙人口其警句有带盘红鼹鼠袍砑紫犀牛之盛然而清议者不以为累公之德何哉赋闲宴而歌富贵也小子是作焉敢望回然亦驽骀之希骥尔 其五
993049,晏成续太祝遗双井茶五品茶具四枚近诗六十篇因以为谢
209335,罗寿可再如旧都作归来窗以为亲悦劝之归者皆
922917,元丰己未三院东阁作 己未九月予赴鞫御史闻子瞻先已被系予昼居三院东阁而子瞻在知杂南庑才隔一垣不得通音息因作诗四篇以为异日相遇一噱之资耳 其二
679667,生老病死佛家以为四苦宋人又借此以诮权贵今反之为四绝句焉 其四
834718,垂杨 汉南道上，烟水凄绝，寒柳萧萧，似闵人摇落者。因赋此解，他日漱泉见之，当亦以为有桓郎之感也
1077710,去岁道巴陵登岳阳楼以望洞庭真天下之壮观也因诵孟浩然气蒸云梦泽波撼岳阳城之句追古今绝唱用以为韵赋诗十篇 其九
657845,舍弟为予作一轩以为读书之所既落成诸友来贺作此诗歌以奉客 其一
332220,蒹葭在野终岁仰以为薪春叶初肥马食殆尽诗以戏之
353498,祭龙前一日致斋雨大作邑人以为数年未之有也作此呈养正明府
1073610,某靖国中与时发同寓郡庠潜心之北窗凡三年而别别后三十五年复相遇于荆溪颐山之下苍颜白发互相惊叹追数一时同舍生在鬼录者十八九独两翁无恙耳方筑室山中以老焉将与时发杖屦往来如杜子美所谓两老者乃赋诗而以为之先
514830,小女以乙巳岁腊月八日生与予生辰隔一日人以为奇至弥月之旦予适署左春坊印百晬之旦又有赐诰之荣人益以为不偶因请于母夫人小字之曰恩姐并赋一诗简尚宝锦衣二贤舅及宫簿弟以私识喜不足为外人道也
514830,小女以乙巳岁腊月八日生与予生辰隔一日人以为奇至弥月之旦予适署左春坊印百晬之旦又有赐诰之荣人益以为不偶因请于母夫人小字之曰恩姐并赋一诗简尚宝锦衣二贤舅及宫簿弟以私识喜不足为外人道也
1070805,客醉而亟归不虑畏涂之可戒当为罪首丞令不行与吏慢丞命其罪均也以为不然则县令先入又何逃焉因次韵戏答德循且诮深山道人眷眷炬火非胥靡登危而不慄者遂并以寄之
697189,武林徐明府招集西园时风雨骤至剪烛剧谈几达曙矣赋谢二章并以为别时明府将入觐余往吴中
685817,秋夜偕诸生月下诵桂子月中落之句因以为韵
206085,陈伯和和经字韵复以为报
905430,至启休沐之中静专一室病不复饮无以慰怀性且寡合若何为乐但窗閒弄笔信意乱书无所从意无所得自如而已岂曰诗乎不觉又成五章章之首句皆云朱门多好景盖纪田第园林之胜美明公游豫之适昔张处士献牛奇章诗尤鲙炙人口其警句有带盘红鼹鼠袍砑紫犀牛之盛然而清议者不以为累公之德何哉赋闲宴而歌富贵也小子是作焉敢望回然亦驽骀之希骥尔 其二
550047,先曾大父丞郯城有惠政两邑求摄争之境上至今传以为异观风至此忾然有感
581867,和周廷瑞别驾末首反其意以为戏耳三首 其二
668383,甲戌岁朝明日立春东坡元日诗有土牛明日莫辞春之句因以为韵赋七诗 其四
374447,拟寒山寺·不贪以为宝
996749,自咸平至太康鞍马间得十小诗寄怀晏叔原并问王稚川行李鹅儿黄似酒对酒爱新鹅此他日醉时与叔原所咏因以为韵 其八
562743,杨淇园侍御巡方事竣仍视学南畿诗以为赠 其二
922439,东坡居士过龙光，求大竹作肩舆，得两竿。南华圭首座，方受请为此山长老。乃留一偈院中，须其至，授之，以为他时语录中第一问
131612,赋墨鹭·山林以为家兮
378604,宗公以兰见遗风叶萧散兰芽并茁一干双花斗开宗以为瑞乞诗记其事
415036,湘雁兄六旬华诞已过忝在旧交补呈两章以为寿 其二
700232,颐浩辩公寄莼菜瓜菹有别久不见渴心生尘之语因以为韵作绝句八首寄谢
891880,次望喜驿始见嘉陵江得予友天章张文裕西使日咏嘉陵江诗刻于馆壁有感别之叹予因戏答二章他日见文裕以为一笑 其二
325002,和道傍大松人取以为明
719775,松江春日张带三老丈招同修来先生宴集分得九佳灯下同赋明日既返棹金陵书此并以为别求正时庚申二月四日
428321,念奴娇 每岁除日午后偕程子颂嘉游惠山登云起楼酌酒品茗习以为常，今程子卧病已逾三年，余则于客中过却，乙亥正月独游惠山归谱此解并作登楼别岁图以似颂嘉病榻卧游
774144,台俗除夕门设纸虎祭以鸭焚之谓可厌煞余名之曰焚虎元夕女子偷折人家花枝谓异日可得佳婿余名之曰窃花往时在京师作梦树堂花二诗谓事极韵且可举以为偶也今兹将毋同因赋四绝句
1088128,观西山怀岳麓以为莫能相上下也聊赋此云
1088571,丘子服来访道间得古梅折以为赠刘叔通江文卿俱来各有佳句因各次韵为答三首 其三
522028,送三儿应举予己酉乡试初场前夕梦乘雾登鸡鸣山及半见日出惊寤众以为祥既乃下第而三儿天秩以是日生今二十有八年矣始遣其应举因感前事书此励之庶几不以离忧而妨远业也四月十五日识
956587,枕上闻雪复作方以为喜起岩再示新诗复次韵
605284,五月七日宝安诸君子招汎龙潭八日复汎篁村同观竞渡客有歌落日放船好轻风生浪迟之句者因以为韵人赋十章邓玄度六言首奏余亦步其韵以六言赓焉 其二
1221518,东山书隐为郑原宜赋郑本越人居东山先世徙杭遂家焉尝筑室西湖上从徐勉庵授书经因以为扁示不忘本也原直事亲以孝闻及筮仕都卫尤有声誉故赋长句以美之
692962,生老病死佛家以为四苦宋人又借此以诮权贵今反之为四绝句焉
1224610,次韵伯庸待制上京寓直书事四首因以为寄 其四
714968,寄赠九江曾丈并以为寿 其二
821128,换巢鸾凤 比利时人有从其使节至此者，国破无以为生，乃典其妻与人，期十年。余闻而悲之，聊述此解，纪其事云
434640,陶君秀晋人尝为司竹监使因祖渊明尝游五柳庄为立五柳祠在县东西原方见有祠堂诗碑向禹城侯先生司竹时与扶风张明叙六曲李仲常凤翔董彦材从之学如白云楼海棠馆所谓胜游也兵后吾弟主之亦西州衣冠之幸感今慨昔不能不惘然也握手一笑知复何年敢先此以为质兼示鄠亭赵秀才 其二
458229,熊家饮归，周燕婷先生遗以酸菜，瓶大如斗。盖久前饮中偶语，既已忘失者。更饮于街头，桌间书此，以为谢焉 其二
502172,汊口程伯龄扁所居曰容膝山房求余写乔松古木图因题以为赠
921204,伯父《送先人下第归蜀》诗云：「人稀野店休安枕，路入灵关稳跨驴。」安节将去，为诵此句，因以为韵，作小诗十四首送之 其六
988507,念奴娇 其一 宋玉高唐赋述楚怀王遇神女事，后世信之。愚独以为不然，因赋念奴娇，洗千载之诬蔑，以祛流俗之惑
1034376,次李参政所和五绝句韵因以为寿 其一
1214531,介石遗余翁鞋歌以为谢
122774,枕上闻雪复作方以为喜起岩再示新诗
976749,刘文蔚久苦目眚昨日乘凉来过共谈先天图义一夕翳去明现闾里以为异事因诗纪之
834669,南浦 答衣谷，兼以为别
129129,小山·拳石以为山
868746,林叔和见访道旧感叹因以为赠
459855,共卢醉往肖，卢途中命作诗，口号诵之，以为进行曲 其二
1103764,己亥重九夜归篝灯独酌因思乙未岁是日陪余敬可携赵定庵马宁卿王叔文云隐二三道伴登芝山驻接仙亭蔬盘果食清谈竟日今诸道萍散而敬可九原不可作对酒凄然殆无以为怀也
581866,和周廷瑞别驾末首反其意以为戏耳三首 其一
435150,昨晚蒙降临无以为待早赴院谢闻己长往何行之速也因去人寄达少慰客中未伸之志耳 其一
790405,新吾同年手写昌谷集，并摹其小像于简端，谨缀其中语以为之赞
522400,昔司空表圣辞官后预营冢圹与宾客同游世传以为达予葬淑人迫于岁暮功虽未讫而规制定矣营度往还得绝句十二首目之曰生游棹歌非敢仰希先躅亦聊以寄兴云尔 其十
982682,徐仲车食于学官吏或以为不可欲罢去之太守不听礼遇如初感之而作
127136,箕山操·草可以为衣兮
828841,临江仙 雪词谓其妇劝勿作诗，会吾妇亦劝余止酒，因并及之以为笑
458228,熊家饮归，周燕婷先生遗以酸菜，瓶大如斗。盖久前饮中偶语，既已忘失者。更饮于街头，桌间书此，以为谢焉 其一
824431,壶中天 题公曼仇史，即以为赠
411384,寒假家居接校中开课信息，天寒岁暮，绝裾远游，行路艰难，离魂酸楚，吟成律句，以为纪念云 其一
440577,壬辰四月上旬，海内诗家四十余人云集天柱山为诗会焉。余忝随其后，身本皖人，虽珠玉在前，初无取乎默焉尔。爰赋百二十韵，贪多勿诮，亦聊以为山水吐气耳
904528,五更一点月照窗几以为晓也披衣视之雪厚至尺许喜甚赋诗
572761,新买得画舫将以为庵因作舟居诗 其八
1070315,叔问观韦苏州诗至萧条竹林院风雨丛兰折幽鸟林上啼青苔人迹绝燕居日已久夏木纷成结几阁积群书时来北窗阅以为适与景会写以寄予因用韵书怀云
498632,临行阿锁欲尽写前诗凡十一首既而色有未满曰：『斯语太文妾不用此可为别制数章取数月来情事综迹历历于心者谱之勿诳勿艳勿誉妾姿艺如一语有犯即罚君一杯』余曰『固然但每诗成而卿以为可亦引满赏此何如』一笑许诺遂口占为下酒十六首 其十
1176429,顷自桐江得一钓车以袭美乐烟波之思因出以为玩俄辱三篇复抒酬荅 其三
617209,余生平喜食梅日啖数百未厌也四月以之官度岭恨时晚矣偶驻车谒张公祠于道傍得数枝焉辄以为造物有意遂占一绝
440696,杭州初晤天水薇室与之论诗不以为谬别后作诗见寄并索和次韵奉答
878262,丘君双荐前尹古田三年有遗爱邑人以为可继阳岩侍郎洪公今尹孝感又将满小诗将行
437724,山谷于诗每与东坡相抗门人亲党遂谓过之而今之作者亦多以为然予尝戏作四绝云 其三
331103,元弼主簿喜饮而吝于开阁又累输棋不偿同僚颇以为言八月朔出郊乃有厄陈之叹因再次其韵
905468,昨晚又捧五章尽含六义意转新而韵皆紧才益赡而调弥高始知元白之前贤虚擅车斜之美誉夜来绕遍林树搜穷肺肝虽巧拙以不侔亦讴吟而自得又依前韵各罄乃怀所贵夫伏老之身心亦冈避不量力之讥诮自兹解甲且议休兵向非起予何以为乐大雅君子无或见咍 其四
958450,金房道间皆蜡梅居人取以为薪周务本戏为蜡梅叹予用其韵是花在东南每见一枝无不眼明者
883352,忆秦娥 季温老友归樵阳，人来闲书，因以为寄
717505,奉题惠州王子千太守罗浮纪游诗后并以为赠
716380,元孝六十又一生日赋以为寿 其三
882779,昆山龚立道作栖闲堂取李太白题龚处士别墅诗曰龚子栖闲地都无人世喧故以为名尝托范叔刚求诗于予予许之闰八月十九日立道复自以书来为成八句
889449,潘公舍人义荣当世第一流人也仆顷得金华私窃自喜将获从公之游洎至而公已云亡至今以为恨金元鼎出公往还诗帖因即公韵和数句于后姑以少见平生慕用之意云
103866,铁瓮城·壍江以为池
1072224,山居作拆字诗一首寄江子我郎中比尝以拆字语为戏然未有以为诗者请自今始
657998,孤鹤翁过访出韵命诗以其涵监险也易以函椷二韵余喜东坡不为险韵所拘遂并前韵通一赋之世有苏子瞻者见之当复以为何如哉 其一
995568,自咸平至太康鞍马间得十小诗寄怀晏叔原并问王稚川行李鹅儿黄似酒对酒爱新鹅此他日醉时与叔原所咏因以为韵 其二
650243,帝王膺受天命至圣之德格于天心故三光全而寒暑时群生和而万物育是以上天昭锡景贶以彰盛美钦惟皇上统绍鸿基主宰神人宵旰图治至仁孚于海内至信昭于天下华夷效顺海宇清宁雨旸晦明各顺其叙时和岁登家给人足乃永乐十一年春二月皇上再狩北京行庆赏黜陟之典田野之民莫不鼓舞欢跃瞻仰日月之光华以为盛世太平之贺乃夏五月丁未山东兖州府曹县以驺虞来献白质黑章五采绚烂目光如电尾长倍躯起伏蹲卧不扰不惊在廷臣僚洎蛮夷酋长与夫工商舆?之徒莫
786531,生圹诗歌第八，即以为跋，并靳谢老
922928,元丰己未三院东阁作 元丰戊午夏予尹京治陈氏狱言者以为推劾不尽诏移大理而理官推迹陈氏姻党干求府政纵出重辟事下御史推求己未岁予自濠梁赴台讯鞫卒不涉干求之迹而大理反有傅致之状虽蒙辩正听命久之不得出邑邑不已作诗十篇记一时事非欲传之他人但以示子侄辈使知仕宦之艰耳 其二
922918,元丰己未三院东阁作 己未九月予赴鞫御史闻子瞻先已被系予昼居三院东阁而子瞻在知杂南庑才隔一垣不得通音息因作诗四篇以为异日相遇一噱之资耳 其一
1077706,去岁道巴陵登岳阳楼以望洞庭真天下之壮观也因诵孟浩然气蒸云梦泽波撼岳阳城之句追古今绝唱用以为韵赋诗十篇 其五
422733,减字木兰花 伃儿读今从军乐，以为及女子，请补二章 其九
522396,昔司空表圣辞官后预营冢圹与宾客同游世传以为达予葬淑人迫于岁暮功虽未讫而规制定矣营度往还得绝句十二首目之曰生游棹歌非敢仰希先躅亦聊以寄兴云尔 其六
1194821,顷自桐江得一钓车以袭美乐烟波之思因出以为玩俄辱三篇复抒酬荅
545171,武林徐明府招集西园时风雨骤至剪烛剧谈几达曙矣赋谢二章并以为别时明府将入觐余往吴中 其二
821270,感恩多 有歌余新词，以为别后相念之资者，作此追送
904362,杨尉三和篇补其二以为答不敢虚盛意 其二
360830,蒙示叙旧之作情眷甚厚不可虚辱辄次元韵愧非所以为报也
274604,踏莎行·沈君禹钟未尝相识，而每誉余词，以为世无弟二人
715297,王观察招食嘉鱼率赋兼以为别 其二
1078559,蒙示叙旧之作情眷甚厚不可虚辱辄次元韵愧非所以为报也
559049,勿逾方先生令惠来据九年始终一节业当通考忽有贾傅之行伤哉贫也去无以为资士论惜之为赋三章聊志遗思 其一
721777,王观察招食嘉鱼率赋兼以为别
572759,新买得画舫将以为庵因作舟居诗 其六
215698,道旁大松人取以为明
436828,陶君秀晋人尝为司竹监使因祖渊明尝游五柳庄为立五柳祠在县东西原方见有祠堂诗碑向禹城侯先生司竹时与扶风张明叙六曲李仲常凤翔董彦材从之学如白云楼海棠馆所谓胜游也兵后吾弟主之亦西州衣冠之幸感今慨昔不能不惘然也握手一笑知复何年敢先此以为质兼示鄠亭赵秀才
373476,师黯以彭甘五子为寄因怀四明园中此果甚多偶成长句以为谢
