923340,石缝泉清轻而甘滑传闻有年矣前此数欲疏引入州治久不克就予至则命工人寻旧迹相地架竹旬月而水悬听事又析一支以给中堂一支以入西閤其下流则酾出外庑往来取汲人以为利因抒长篇以纪其功云
633984,诸子作病僧诗予以为非有道之病僧光半因请予赋一律
151142,施元用醉谒邑大夫胡公公暴风骤雨者也不以为
331436,建溪再得雪乡人以为宜茶
1036006,减字木兰花 卿有功乎。同舍每以为笑。余过吴兴。而李公择适生子。三日会客。求歌辞。乃为作此戏之。举坐皆绝倒。
559051,勿逾方先生令惠来据九年始终一节业当通考忽有贾傅之行伤哉贫也去无以为资士论惜之为赋三章聊志遗思 其三
594179,周计部元孚被播南行答其临清所寄因以为别 其二
1088065,二诗奉酬敬夫赠言并以为别 其二
522376,南京摺扇名天下成化间尤重李昭骨王孟仁画兼之者誇以为奇而今不可得矣明善内弟以听泉主人扇索题其画则孟仁笔也展玩数四旧京风致宛在目前为书此以志感
881029,前庑两学录罢职公堂求经明行修之士充员时蜀人杨时发当其选杨君以贱姓名荐或谓余求之蜀人董□行越人俞季渊永嘉陈行之咸以为不然余亦自揆焉而记以诗云
443682,菩萨蛮 吴门徐松盦邀咏湖石，予独爱延陵李鬼柳“老夫怀抱沧浪月”一阕，以为最得风人雅致，因用其调续其貂焉
776684,一月十二日王蔼亭太守过访太古巢野人骇然观者如堵以为所未见也又题于壁
1001178,溆浦楠木洞盖神龙所居今年夏大旱县官乞取其水以祷立应民犹以为未足因作是诗以遗诸公致再请之意焉
1111050,二诗奉酬敬夫赠言并以为别
714967,寄赠九江曾丈并以为寿 其一
466187,微吟兄归自美利坚，共聚游者数日。既已别去，乃醉为书此。想予作诗之时，正小女屏上骋辩之刻也，亦微吟兄鸡皮下泪之际也。更饮一盅，聊以为贺三首
421795,法华寺畔有閒散石虎之墓，余以为明之遗民也；将遭毁掘，乃为移葬梦蝶园中。为文祭之，复系一诗
493581,余自北平赴京十二月五日道出济宁会伯高齐君于公馆君本唐县人素擅顾吴之妙草草为予点真观者咸以为肖而余独觉其老丑也临别赋绝句三首奉答并柬赵晋卿夏时佐曹伯仁三先生 其一
797843,蝶恋花 其一 癸丑春日将归洞庭，闺中诸姊妹投赠诗词以为祖饯之意，予亦悲感交集，谱此以别。
699534,五弟新卜园居余笑曰柰物力不敷何社中遂以为韵作诗嘲之仍限四章各四韵
641433,奎在乡里时辱先达诸公折辈行与之交者多矣而或远在百里之外近亦不下一二舍以故不获亟从之游独吾叔御道原公武次泉潜夫数君子居相近志相同出入往来无间蚤暮有得必告有疑必质当是时亦诚以为乐矣而未知其为难得也一二年来或出或处或南入于广或东往于齐而奎亦远迹关辅閒居独处每一兴怀平昔从游之乐如在天外茫乎不可复得然后知会合之不易而离索之为苦也昔之人中年为别必数日作恶岂为过哉作诗一首以寄此怀
712316,送王紫诠使君观察川南兼以为寿
712988,寄孙赤崖且以为祝
594180,周计部元孚被播南行答其临清所寄因以为别 其三
493582,余自北平赴京十二月五日道出济宁会伯高齐君于公馆君本唐县人素擅顾吴之妙草草为予点真观者咸以为肖而余独觉其老丑也临别赋绝句三首奉答并柬赵晋卿夏时佐曹伯仁三先生 其二
498624,临行阿锁欲尽写前诗凡十一首既而色有未满曰：『斯语太文妾不用此可为别制数章取数月来情事综迹历历于心者谱之勿诳勿艳勿誉妾姿艺如一语有犯即罚君一杯』余曰『固然但每诗成而卿以为可亦引满赏此何如』一笑许诺遂口占为下酒十六首 其二
1076669,海邑少交游相见者以为言故作此诗
1126875,自咸平至太康鞍马间得十小诗寄怀晏叔原并问王稚川行李鹅儿黄似酒对酒爱新鹅此他日醉时与叔原所咏因以为韵
679664,生老病死佛家以为四苦宋人又借此以诮权贵今反之为四绝句焉 其一
498045,昔年同社为秋词，今成往事，离居多感，岁晏不聊，触绪生吟，冰霜满月，凛尖风之透骨，感皎月之映心，多因梦后之思，添出酒边之句，聊作秋声貂续，以为春咏前驱，合曰寒词得一十六首 其十二
1049188,公舒朝请得福守所寄荔子佳品二而咏以二诗乃以为示辄次韵奉和 其一
1105547,月上人以拳石植海松莳菖阳于四际苍姿秀色钟清气于几案间以为梅溪之野人赠兼惠诗章因与酬唱凡四首
585891,同洪觉山方时素与曾廓斋为罗浮之游遂饯别江门钓台因以为赠
658140,东坡雪诗善用险韵王介甫赵昌谷诸老和之皆以为不可及余因其言遂戏和之 其三
1070883,唐常建作破山寺诗云竹径通幽处禅房花木深欧阳永叔每叹赏此句以为不可及温陵康元寿守琼踰年乐其地僻而事简以清静治之于郡圃植竹数百竿中有小亭因榜曰通幽偶成拙句
1064184,秋日还庐山故人书因以为寄
974735,四月五日解维成都连日行浅滩中或迟或速如在东中游湖甚以为乐初九日过龙爪滩两江合流江始深舟人至此歌呼鸣橹作发船离岸之声余始怆然觉身是行客颇有离索之念
569122,张守有温甫学士擘窠书老柏行余以仲昭太卿画竹配之时万历丁丑之八月廿五日守诞辰也眷属在里中将有就馆者并以为祝
1152938,李博士弟以余罢官居同德精舍共有伊陆名山之期久而未去枉诗见问中云宋生昔登览未云那能顾蓬荜直寄鄙怀聊以为答
449774,为群中网友题藏头小诗九首以为乐 其四
677554,陪大司成尹洞山先生游三茅山观池中小龙和作并以为别二首 其一
854239,西江月 其二 和郑省仓韵，因以为寿
522399,昔司空表圣辞官后预营冢圹与宾客同游世传以为达予葬淑人迫于岁暮功虽未讫而规制定矣营度往还得绝句十二首目之曰生游棹歌非敢仰希先躅亦聊以寄兴云尔 其九
588363,江虚谷李壁山何古林一瓢道人与余五人集于穗石洞天乘月夜坐把酒朗歌观中道士惊讶以为五羊老人复来也感兴和古成之韵
644295,日彰法师得旨还山王生作泉石閒斋图予题诗其上以为赠行
127300,杂诗·蒸沙以为城
257611,我以为是一条牛
195887,酒船·刳木以为舟
354631,妇人面涂黄而吏告以为瘴疾问云谓佛妆也
311948,水调歌头·原韵酬梦痕见和即以为赠
904343,永兄作灵照寺墨梅两纸殊佳仍书二绝其上以为饷次韵谢之 其二
921201,伯父《送先人下第归蜀》诗云：「人稀野店休安枕，路入灵关稳跨驴。」安节将去，为诵此句，因以为韵，作小诗十四首送之 其三
510963,家兄往东向村收蚤稻登舟后雷雨大作章侍坐贞节堂至夜分以为忧是年甲辰家兄六十一未尝有如意之求
562587,南京给事中童志昂和李商隐无题诗韵南京诸公多和之意盖有寓间出命予属和予村学究也不能外题以为诗姑咏史以复之 其四
1058632,六月旦有芝生于小厅之南楹连叶七层颜色黄润常有露珠联络其上观者叹息以为祥异因作三小诗 其二
605287,五月七日宝安诸君子招汎龙潭八日复汎篁村同观竞渡客有歌落日放船好轻风生浪迟之句者因以为韵人赋十章邓玄度六言首奏余亦步其韵以六言赓焉 其五
1088864,近得一二砚示范达甫笑以为堪支床也许送端州大砚作诗以坚其约
562742,杨淇园侍御巡方事竣仍视学南畿诗以为赠 其一
521588,颐浩辩公寄莼菜瓜菹有别久不见渴心生尘之语因以为韵作绝句八首寄谢 其四
1172801,见王监兵马使说近山有白黑二鹰罗者久取竟未能得王以为毛骨有异他鹰恐腊后春生鶱飞避暖劲翮思秋之甚眇不可见请余赋诗 其二
658141,东坡雪诗善用险韵王介甫赵昌谷诸老和之皆以为不可及余因其言遂戏和之 其四
246267,寿星明·为一庸老人题苍松秋涧图即以为寿
612939,秋夜偕诸生月下诵桂子月中落之句因以为韵 其三
559050,勿逾方先生令惠来据九年始终一节业当通考忽有贾傅之行伤哉贫也去无以为资士论惜之为赋三章聊志遗思 其二
572758,新买得画舫将以为庵因作舟居诗 其五
187565,贺真参政因以为戒
992608,孟夏二日通判太博惠庭花二十枝云是手植因以为答
687748,孤鹤翁过访出韵命诗以其涵监险也易以函椷二韵余喜东坡不为险韵所拘遂并前韵通一赋之世有苏子瞻者见之当复以为何如哉
721701,寄赠九江曾丈并以为寿
937787,某用家弟韵赋绝句上浼清视芜词累句非敢以为诗也赐一言卒相之
516852,桥门之南产芦菔如贯珠十七八内官以为瑞献之
1182740,商山临路有孤松往来斫以为明好事者怜之编竹成楥遂其生植感而赋诗
1076425,富水军治有巨泽往岁荷花满湖郡守岁取荷叶可贸百千一日曝之湖滨大风吹卷飞数十里顷刻俱尽又采叶者颇以为苦沥膏油以毒之逮仆至阅两岁无一花今年结茅于此穴小池植数十根而花已可观因感前事遂书之
904342,永兄作灵照寺墨梅两纸殊佳仍书二绝其上以为饷次韵谢之 其一
1067808,谢灵运诗云中为天地物今成鄙夫有取以为韵遣兴作十章兼寄云叟 其三
909816,友人董耘馈长沙猫笋廌以享太史公太史公辄作诗为贶因笋寓意且以为赠耳廌即和之亦以寓自兴之意且述前相知之情焉
1054498,再作药名诗一首寄亶父并用本字更不假借此诸名布在本草中虽或隐晦然以为不当但取世俗之所知而遗其所不知亦君子之用心也至于搜索牵合亦可以发人意思而消磨光景请亶父同作
711445,汪鐏石席上出巩二诗吴门王楚臣见而和之巩自以为粤风吴人和而为吴风遂以吴风答之 其一
439378,山谷于诗每与东坡相抗门人亲党遂谓过之而今之作者亦多以为然予尝戏作四绝云
192157,杨尉三和篇补其二以为答不敢虚盛意
513958,仆家徽之篁墩有晋循吏陈忠臣之祠第在焉土人尝更名黄以避巢贼之荼毒袭称至今仆近复篁墩之号而翰长镜川先生作十绝非之仆亦未敢以为是也谨次韵随章奉答幸终教之 其六
1036141,无愁可解 国工花日新作越调解愁。洛阳刘几伯寿闻而悦之。戏作俚语之词。天下传咏。以为几于达者。龙丘子犹笑之。此虽免乎愁。犹有所解也。若夫游于自然而托于不得已。人乐亦乐。人愁亦愁。彼且恶乎解哉。乃反其词。作无愁可解云
996750,自咸平至太康鞍马间得十小诗寄怀晏叔原并问王稚川行李鹅儿黄似酒对酒爱新鹅此他日醉时与叔原所咏因以为韵 其九
498638,临行阿锁欲尽写前诗凡十一首既而色有未满曰：『斯语太文妾不用此可为别制数章取数月来情事综迹历历于心者谱之勿诳勿艳勿誉妾姿艺如一语有犯即罚君一杯』余曰『固然但每诗成而卿以为可亦引满赏此何如』一笑许诺遂口占为下酒十六首 其十六
1214576,石门张氏园几二百年事见语溪志南石先生既宣慰河东退而家居每与宾友觞咏其中闻之里父老公之曾祖君为郡太守而归有指而詈之者阍人执以请命公曰彼安敢詈我与之酒且有以赠之责门者曰吾岂以贵势凌人哉汝不待教令而拘系之是扬吾恶名以为子孙累也逐而易之噫斯其所以嗣世益昌而此园之所以弗废与
1107175,公舒朝请得福守所寄荔子佳品二而咏以二诗乃以为示辄次韵奉和
498049,昔年同社为秋词，今成往事，离居多感，岁晏不聊，触绪生吟，冰霜满月，凛尖风之透骨，感皎月之映心，多因梦后之思，添出酒边之句，聊作秋声貂续，以为春咏前驱，合曰寒词得一十六首 其十六
921211,伯父《送先人下第归蜀》诗云：「人稀野店休安枕，路入灵关稳跨驴。」安节将去，为诵此句，因以为韵，作小诗十四首送之 其十三
1034377,次李参政所和五绝句韵因以为寿 其二
658980,东冈隐士筑亭于松竹之间名曰款相意以为予予不敢当而有也为易曰来贤八月二十四日初会亭上口占一律
95259,成父居于普宁寺钟楼之下辟以为斋旧名坎止近
574441,徐用中寓松风阁诗以为问
833938,疏影 昵鶄廔主家在虞山，尝与泛舟尚湖，招凉度夕，时水空天远，星晚月初，湖风吹衣，山翠倒影，夜色中光景奇绝，既泊舟中流，乃弛衣敷簟，并枕鹢首而卧，飞星掠鬓，斜河映胸，共道欢爱则言笑晏晏，相怜同病则悽然俯仰，自以为逢伯陵季荝以来无此乐也。聊赋此调，以追旧欢
921202,伯父《送先人下第归蜀》诗云：「人稀野店休安枕，路入灵关稳跨驴。」安节将去，为诵此句，因以为韵，作小诗十四首送之 其四
965905,魏漕彦成昔宰弋阳政续上闻召对改秩予适当词命后自台郎出守滁垦荒田千二百顷柄国者挟妻家私憾以为罔功将漕襄阳修筑大堤禦水患又以为妄作与洪兴祖为程伯禹刊论语解至周公谓鲁公有太息流涕之言彦成遂被窜于钦州柄国者死例逢赦宥归道南岳以大篇侑酒十尊见遗因成七绝以谢之 其二
965905,魏漕彦成昔宰弋阳政续上闻召对改秩予适当词命后自台郎出守滁垦荒田千二百顷柄国者挟妻家私憾以为罔功将漕襄阳修筑大堤禦水患又以为妄作与洪兴祖为程伯禹刊论语解至周公谓鲁公有太息流涕之言彦成遂被窜于钦州柄国者死例逢赦宥归道南岳以大篇侑酒十尊见遗因成七绝以谢之 其二
716379,元孝六十又一生日赋以为寿 其二
911963,大丞相益国周公访予于碧瑶洞天刘敏叔写以为图求予书其后
922920,元丰己未三院东阁作 己未九月予赴鞫御史闻子瞻先已被系予昼居三院东阁而子瞻在知杂南庑才隔一垣不得通音息因作诗四篇以为异日相遇一噱之资耳 其三
1114697,谢灵运诗云中为天地物今成鄙夫有取以为韵遣兴作十章兼寄云叟
1038916,师黯以彭甘五子为寄因怀四明园中此果甚多偶成长句以为谢
513960,仆家徽之篁墩有晋循吏陈忠臣之祠第在焉土人尝更名黄以避巢贼之荼毒袭称至今仆近复篁墩之号而翰长镜川先生作十绝非之仆亦未敢以为是也谨次韵随章奉答幸终教之 其八
1235941,乞巧辞二章（京师里俗以七月七日昏时设祠乞巧于天星织女盖闺人处子惑于荒谬怪诞之说不事箴组觊倖渺茫虚无之效卒无所得予闵其愚遂设为妇祷神答之意缀成此章假辞托兴以譬夫世之学者昧下学上达之理忽略遗弃于日用寻常之事而谓圣人之迶高远玄妙非力行之所可企及当求之于恍惚有无之域是以终于无闻漫不知省因以为戒且自警云尔）
598092,凤城春夜辱劳使君邀集于金山精舍别归却寄是诗兼以为谢
627152,奉新署中赠冯调冶且以为别 其三
1208449,乞巧辞二章（京师里俗以七月七日昏时设祠乞巧于天星织女盖闺人处子惑于荒谬怪诞之说不事箴组觊倖渺茫虚无之效卒无所得予闵其愚遂设为妇祷神答之意缀成此章假辞托兴以譬夫世之学者昧下学上达之理忽略遗弃于日用寻常之事而谓圣人之迶高远玄妙非力行之所可企及当求之于恍惚有无之域是以终于无闻漫不知省因以为戒且自警云尔） 其二
684822,昔年同社为秋词，今成往事，离居多感，岁晏不聊，触绪生吟，冰霜满月，凛尖风之透骨，感皎月之映心，多因梦后之思，添出酒边之句，聊作秋声貂续，以为春咏前驱，合曰寒词得一十六首
665624,雁宕读壁间诗侯希召云此陈准卿之作也昔与准卿为月夜游仰观天柱诸峰岌岌如坠发狂大叫自以为奇观今兹已矣相顾欷歔赋此酹之
715296,王观察招食嘉鱼率赋兼以为别 其一
883343,赏梅佳什既不得陪从又莫获少留深以为恨辄赓严韵酬叙
1116902,元丰己未三院东阁作 元丰戊午夏予尹京治陈氏狱言者以为推劾不尽诏移大理而理官推迹陈氏姻党干求府政纵出重辟事下御史推求己未岁予自濠梁赴台讯鞫卒不涉干求之迹而大理反有傅致之状虽蒙辩正听命久之不得出邑邑不已作诗十篇记一时事非欲传之他人但以示子侄辈使知仕宦之艰耳
687766,东坡雪诗善用险韵王介甫赵昌谷诸老和之皆以为不可及余因其言遂戏和之
1139483,罗寿可再如旧都作归来窗以为亲悦劝之归者皆是予特下转语焉
894321,淮南早春风雨连日俗以为宜
1224690,泰定丁卯八月十二日崇天门传胪赐进士右榜第一人阿察赤左榜第一人李黼皆肄业国学日新斋余西厅授业生也是日京尹备鼓乐旗帜麾盖甚都导二状元入学谢师拜余明伦堂榜眼刘思诚探花郎徐容尝因同年黄晋卿彭幼元从予游亦拜其侧其馀进士以门生礼来拜谢杂遝不记姓名圜桥门而观者万计都人以为斯文盛事昔未有也同寅举酒相属偶成四绝以纪其事 其二
521592,颐浩辩公寄莼菜瓜菹有别久不见渴心生尘之语因以为韵作绝句八首寄谢 其八
971679,晏斋余自名也故常以榜自随乃以名厅事之东偏厅之后旧有一室面对竹余山居富此物亦以竹隐名对此竹而有思于山中故以思隐名之思隐之东又辟屋丈许连以为斋乞名于张君伯永为名曰容斋并作三绝志其事焉 其一
980422,鄜州张路钤处见东坡所书渔父四首感叹之馀因思诸王孙伯言善歌此辞每以为乐作寄伯言视张
368666,宴清都·客枕羁愁，枯灯煮梦，郁伊善感，何以为怀
522297,弘治己酉盆池莲一茎三花八月梦登鸡鸣山见日出众以为异是秋予下第而三儿生自是栽莲未始成也五月十日方小试盆池一花追忆往事诗以记之
668386,甲戌岁朝明日立春东坡元日诗有土牛明日莫辞春之句因以为韵赋七诗 其七
975460,送郑子仁往岳阳兼以为寿
971194,成父居于普宁寺钟楼之下辟以为斋旧名坎止近易榜曰发深省衡州舅氏书之仆为赋四小诗以发深省斋为韵 其四
1103574,有洗旧诰绫作青色鬻将以为缘以绀缯易得之作手卷赋小乐章求好事书其后
1110940,丘子服来访道间得古梅折以为赠刘叔通江文卿俱来各有佳句因各次韵为答三首 其二
297741,临江仙·雪词谓其妇劝勿作诗，会吾妇亦劝余止酒，因并及之以为笑
1062732,余少时尝种竹于所居之南号竹隐今二十年矣而隐之志盖未遂也孙志康善篆尝欲得竹隐二字题其上因叙所以为诗以乞之且呈好事诸君子各乞一诗以为旧隐光华
1062732,余少时尝种竹于所居之南号竹隐今二十年矣而隐之志盖未遂也孙志康善篆尝欲得竹隐二字题其上因叙所以为诗以乞之且呈好事诸君子各乞一诗以为旧隐光华
1048651,九月八日薄晚离赣城十馀里而雷雨作遂倚舟以宿九日晓行又十馀里而逆风暴甚乃泊于白鹇滩侧虔之史君相留不可屡以亟行见谑今日会宾席间当语及濡滞以为笑矣因书以自戏云
961949,施元用醉谒邑大夫胡公公贤者也不以为浼己翌旦袖刺见之元用以喜雨十诗为谢仙尉孙公赠诗曰瓮边不识毕吏部笔下方知李翰林释其嫌一时和者相继其族兄德茂复有诗箴之元用遂锐然止酒事有曲折情存彼此然百里不失为通德茂合于义元用勇于决皆是也括苍姜子为长篇以合之简元用兼呈诸公庶几期于大同泯然无迹矣
977368,韩退之蓝田丞厅记所谓雁鹜者相承以为吏每切不然往往人未之信偶读吴子宽诗有雁鹜庭空之语因作此云
438754,京叔将拜埽于陈徵言为赠老懒废学茫无所得独记其与屏山云卿襟期所在者非以为诗也
978514,袁同史丈令赋所欲作醉皓堂诗以为后日数椽张本四老有袁谓乃其远祖云
522392,昔司空表圣辞官后预营冢圹与宾客同游世传以为达予葬淑人迫于岁暮功虽未讫而规制定矣营度往还得绝句十二首目之曰生游棹歌非敢仰希先躅亦聊以寄兴云尔 其二
523907,陶公过曹濮分司见丛菊蔓草中移之自随有诗伤之岂以为家物邪予览而和之
687095,余自北平赴京十二月五日道出济宁会伯高齐君于公馆君本唐县人素擅顾吴之妙草草为予点真观者咸以为肖而余独觉其老丑也临别赋绝句三首奉答并柬赵晋卿夏时佐曹伯仁三先生
1176427,顷自桐江得一钓车以袭美乐烟波之思因出以为玩俄辱三篇复抒酬荅 其一
668384,甲戌岁朝明日立春东坡元日诗有土牛明日莫辞春之句因以为韵赋七诗 其五
971680,晏斋余自名也故常以榜自随乃以名厅事之东偏厅之后旧有一室面对竹余山居富此物亦以竹隐名对此竹而有思于山中故以思隐名之思隐之东又辟屋丈许连以为斋乞名于张君伯永为名曰容斋并作三绝志其事焉 其三
509037,十二月二十有八日余与总兵官彰武伯杨公副总兵都督曹公地官郎中罗公习正旦仪于善化寺礼既毕杨具酒肴邀镇守太监王公守备中贵罗公同此小酌以为岁暮休暇之乐余浩然兴发因成五言古诗一章聊叙情曲且识余感
828423,戴文节公遗砚刻梅花一树萦绕四周左侧镌鹿床居士制五字微有损文予以廉价得之铭其背曰质损而神完犹取义而仁全世皆弃而苍虬所专昔文节以书有破体不为宣宗所喜又为穆相彰阿画山水便面未设色穆以为轻己遭谗斥退后居杭州殉粤匪之难予有感于公之遗事为作此诗
422772,破阵子 饮顾墨三长官祝同，明日遂返东战场，词以为别
82825,新裁短褐接客以代戎服或以为慢戏作
668238,斋前小山秽翳久矣家兄召工治之剪薙一新殊觉秀爽晚晴独坐诵王临川扫石出古色洗松纳空光之句因以为韵赋小诗十首 其七
997400,有闻帐中香以为熬蝎者戏用前韵二首 其一
717066,闻观察公以暮春日与诸公为菖蒲涧之游赋此纪事并以为观察公寿
716847,卫广文以荔支诗见示赋此奉酬并以为寿
1034373,次李参政所和五绝句韵因以为寿 其四
627153,奉新署中赠冯调冶且以为别 其四
545170,武林徐明府招集西园时风雨骤至剪烛剧谈几达曙矣赋谢二章并以为别时明府将入觐余往吴中 其一
181544,金房道间皆蜡梅居人取以为薪周务本戏为蜡梅
1032755,左绵山中多青松风俗贱之止供樵爨之用郡斋僧刹不见一本余过而太息辄讽通守晋伯移植佳处使人知为可贵东川距绵百里馀入境遂不复有晋伯因以为惠沿流而来至此皆活作诗述谢并代简师道史君
474695,署中有忆江南梅花者因以为赋
436621,昨晚蒙降临无以为待早赴院谢闻己长往何行之速也因去人寄达少慰客中未伸之志耳
573952,次许给事启衷九日感怀因以为赠二首 其二
292074,本届参政会余偶未出席知者多以为问
414654,江南故人闻余将休致咸劝东游辄赋小诗以为息壤七首 其二
1116653,子由将赴南都，与余会宿于逍遥堂，作两绝句，读之殆不可为怀，因和其诗以自解。余观子由，自少旷达，天资近道，又得至人养生长年之诀，而余亦窃闻其一二。以为今者宦游相别之日浅，而异时退休相从之日长，既以自解，且以慰子由云
995570,自咸平至太康鞍马间得十小诗寄怀晏叔原并问王稚川行李鹅儿黄似酒对酒爱新鹅此他日醉时与叔原所咏因以为韵 其一
494401,过清溪黄太学生绣绪宸谈异泉之胜作此以为他时往观卜筑之张本
243023,舟中夜雪读正卿教授近诗辄赋鄙句并以为别
289418,法华寺畔有閒散石虎之墓，余以为明之遗民也
1077702,去岁道巴陵登岳阳楼以望洞庭真天下之壮观也因诵孟浩然气蒸云梦泽波撼岳阳城之句追古今绝唱用以为韵赋诗十篇 其一
1147698,余以咸亨元年在西京寻听于时与并部处一法师莱州弘祎论师更有三二诸德同契鹫岭标心觉树然而一公属母亲之年老遂怀恋于并州祎师遇玄瞻于江宁乃叙情于安养玄逵既到广府复阻先期唯与晋州小僧善行同去神州故友索尔分飞印度新知冥焉未会此时踯躅难以为怀戏拟四愁聊题两绝 其二
574538,侯职方书问我冉泾听松二精舍诗以为荅
1141297,有人示山水画卷以为元晖作求诗
498628,临行阿锁欲尽写前诗凡十一首既而色有未满曰：『斯语太文妾不用此可为别制数章取数月来情事综迹历历于心者谱之勿诳勿艳勿誉妾姿艺如一语有犯即罚君一杯』余曰『固然但每诗成而卿以为可亦引满赏此何如』一笑许诺遂口占为下酒十六首 其六
668237,斋前小山秽翳久矣家兄召工治之剪薙一新殊觉秀爽晚晴独坐诵王临川扫石出古色洗松纳空光之句因以为韵赋小诗十首 其六
922927,元丰己未三院东阁作 元丰戊午夏予尹京治陈氏狱言者以为推劾不尽诏移大理而理官推迹陈氏姻党干求府政纵出重辟事下御史推求己未岁予自濠梁赴台讯鞫卒不涉干求之迹而大理反有傅致之状虽蒙辩正听命久之不得出邑邑不已作诗十篇记一时事非欲传之他人但以示子侄辈使知仕宦之艰耳 其九
195372,有人示山水画卷以为元晖作求诗
522401,昔司空表圣辞官后预营冢圹与宾客同游世传以为达予葬淑人迫于岁暮功虽未讫而规制定矣营度往还得绝句十二首目之曰生游棹歌非敢仰希先躅亦聊以寄兴云尔 其十一
