498036,昔年同社为秋词，今成往事，离居多感，岁晏不聊，触绪生吟，冰霜满月，凛尖风之透骨，感皎月之映心，多因梦后之思，添出酒边之句，聊作秋声貂续，以为春咏前驱，合曰寒词得一十六首 其三
556451,自乍浦下海至舟山入舟风恶四鼓发舟风恬日霁波面如镜舟人以为海上罕遇是日行六百五十余里
965907,魏漕彦成昔宰弋阳政续上闻召对改秩予适当词命后自台郎出守滁垦荒田千二百顷柄国者挟妻家私憾以为罔功将漕襄阳修筑大堤禦水患又以为妄作与洪兴祖为程伯禹刊论语解至周公谓鲁公有太息流涕之言彦成遂被窜于钦州柄国者死例逢赦宥归道南岳以大篇侑酒十尊见遗因成七绝以谢之 其七
965907,魏漕彦成昔宰弋阳政续上闻召对改秩予适当词命后自台郎出守滁垦荒田千二百顷柄国者挟妻家私憾以为罔功将漕襄阳修筑大堤禦水患又以为妄作与洪兴祖为程伯禹刊论语解至周公谓鲁公有太息流涕之言彦成遂被窜于钦州柄国者死例逢赦宥归道南岳以大篇侑酒十尊见遗因成七绝以谢之 其七
695939,周计部元孚被播南行答其临清所寄因以为别
1079893,京城围闭之初天气晴和军士乘城不以为难也因成四韵
716378,元孝六十又一生日赋以为寿 其一
215576,耰耡·锻金以为曲
771404,疏影•题缪子彬校书图，并以为寿。子彬，艺风先生子
415035,湘雁兄六旬华诞已过忝在旧交补呈两章以为寿 其一
148625,彭澄之告以卜筑佐之一缗一石二绝句以为亲旧
513502,季弟克宽来京师适当端午西湖南海之莲尚未有花而予家盆池特出二萼化工之巧有若为予两人者设耳克宽南行有期辄用开宴以酬花因思予在西城时此花亦于五月盛开司寇陆公辈各赋一诗以为予中举之徵其后果然今十四年矣故诗及之
1193463,余以咸亨元年在西京寻听于时与并部处一法师莱州弘祎论师更有三二诸德同契鹫岭标心觉树然而一公属母亲之年老遂怀恋于并州祎师遇玄瞻于江宁乃叙情于安养玄逵既到广府复阻先期唯与晋州小僧善行同去神州故友索尔分飞印度新知冥焉未会此时踯躅难以为怀戏拟四愁聊题两绝
1077053,建溪再得雪乡人以为宜茶
759168,蒹葭在野终岁仰以为薪春叶初肥马食殆尽诗以戏之
466309,熊家饮归，周燕婷先生遗以酸菜，瓶大如斗。盖久前饮中偶语，既已忘失者。更饮于街头，桌间书此，以为谢焉
1141591,石湖范至能尝作姑恶词以为妇怨非天下之为妇者所愿闻故作续姑恶词以广之
290433,和书屏《六十自述》原韵并以为寿
645013,句容县茅山观道官东白能文章且长于诗予无以为寿集杜子美诗二十句以赠
837813,节孝萧母陈太君者吾台之苗栗人也苑里蔡启运茂才为状其事略以告于当世士大夫谨按太君年二十有七而寡奉二老抚三孤两无所憾今太君已六十有一两子成立且含饴而弄孙矣苦节之甘方兴未艾哲嗣辈将乞言以为寿郑毓臣上舍邮书来岑予为声之诗编以诒来者亦阐扬幽隐之意云尔
355471,河东桥亭以久废置不用欲移菜畦以为老之游息之地因以诗就公权乞之
905466,昨晚又捧五章尽含六义意转新而韵皆紧才益赡而调弥高始知元白之前贤虚擅车斜之美誉夜来绕遍林树搜穷肺肝虽巧拙以不侔亦讴吟而自得又依前韵各罄乃怀所贵夫伏老之身心亦冈避不量力之讥诮自兹解甲且议休兵向非起予何以为乐大雅君子无或见咍 其三
992129,达观禅师昙颖住隐静兰若或言自此猕猴散走不来颖尝哂曰吾知是山枇杷为多始至也未实故其去将实也必群集后果然颖恶乎俗之好异恐传以为人惑欲予咏而播之
498689,邻女有自经者不晓何因而里媪述其光艳皎洁阅日不变且以中夜起自结束选彩而衣配花而戴绾髻涂妆膏唇耀首以至约缣迫袜皆著意精好尽态极妍而始毕命焉其所悬之带以润州朱丝数百条长九尺许为十股细辫手自盘制逾月甫成同伴以为缠腰物也而不知其用意至此为诗以吊之
252509,山谷于诗每与东坡相抗门人亲党遂谓过之而今之作者亦多以为然予尝戏作四绝云
1116594,伯父《送先人下第归蜀》诗云：「人稀野店休安枕，路入灵关稳跨驴。」安节将去，为诵此句，因以为韵，作小诗十四首送之
422732,减字木兰花 伃儿读今从军乐，以为及女子，请补二章 其八
603519,简书美董母谢媛之德也谢媛秉德贞文以相君子实生司寇为时名卿纶綍再褒后命未艾史氏欲传其懿以为世训而作此诗十八章
498044,昔年同社为秋词，今成往事，离居多感，岁晏不聊，触绪生吟，冰霜满月，凛尖风之透骨，感皎月之映心，多因梦后之思，添出酒边之句，聊作秋声貂续，以为春咏前驱，合曰寒词得一十六首 其十一
797844,蝶恋花 其二 癸丑春日将归洞庭，闺中诸姊妹投赠诗词以为祖饯之意，予亦悲感交集，谱此以别。
251062,登岩坦门口山余必芹周永平商于主翁僦屋一区缮治破败以为游赏之所云
834196,高阳台 余与张紫帆、蒋次香倡岁寒三友社于容园，喝月敲花，竟无其四。二君双倚此调见和怨梅之作，率循原韵，以为继声
569221,太宰梦山杨公谓不佞为作桃花岭歌未有以应也今年春以书来云客至吴中册有子二诗然而非子诗也能竟恝然乎哉适晨起行药小径落红狼籍忽有斐然之思因遂成一歌寄公不知其能胜二赝诗否要之落句狂语彼固不肯道也公以为何如
522088,松江判府史君瑭廉靖爱民民亦爱之董漕还便道省亲赋以为寿
905431,至启休沐之中静专一室病不复饮无以慰怀性且寡合若何为乐但窗閒弄笔信意乱书无所从意无所得自如而已岂曰诗乎不觉又成五章章之首句皆云朱门多好景盖纪田第园林之胜美明公游豫之适昔张处士献牛奇章诗尤鲙炙人口其警句有带盘红鼹鼠袍砑紫犀牛之盛然而清议者不以为累公之德何哉赋闲宴而歌富贵也小子是作焉敢望回然亦驽骀之希骥尔 其三
1036078,定风波 十月九日孟亨之置酒秋香亭，有双拒霜独向君猷而开。坐客喜笑，以为非使君莫可当此花，故作是篇
498040,昔年同社为秋词，今成往事，离居多感，岁晏不聊，触绪生吟，冰霜满月，凛尖风之透骨，感皎月之映心，多因梦后之思，添出酒边之句，聊作秋声貂续，以为春咏前驱，合曰寒词得一十六首 其七
1099899,丁卯重作化龙桥嘉平甲子脩梁方举两虹忽现里人皆以为瑞辄赋一首
521590,颐浩辩公寄莼菜瓜菹有别久不见渴心生尘之语因以为韵作绝句八首寄谢 其六
1001426,彭澄之告以卜筑佐之一缗一石二绝句以为亲旧倡 其一
992166,吴冲卿示和韩持国诗一卷辄以为谢
572762,新买得画舫将以为庵因作舟居诗 其九
498041,昔年同社为秋词，今成往事，离居多感，岁晏不聊，触绪生吟，冰霜满月，凛尖风之透骨，感皎月之映心，多因梦后之思，添出酒边之句，聊作秋声貂续，以为春咏前驱，合曰寒词得一十六首 其八
327269,鬼神·鬼神即物以为名
928991,李允蹈判院送酒四斗予答书乃误以为二斗作小诗识愧
53382,端午赐黄金艾叶银书灵符等物岁以为常
498627,临行阿锁欲尽写前诗凡十一首既而色有未满曰：『斯语太文妾不用此可为别制数章取数月来情事综迹历历于心者谱之勿诳勿艳勿誉妾姿艺如一语有犯即罚君一杯』余曰『固然但每诗成而卿以为可亦引满赏此何如』一笑许诺遂口占为下酒十六首 其五
465289,渡江云 钟钟山顷来成都，即将有峨眉乌尤之行，茗叙江楼，缅怀西湖旧游，不胜叹怅，赋此以为迎饯
799500,余为山海一篇略著余所见捕鱼状耳王晋卿以为不典乃博稽载籍拟山谷演雅示余余乃更肆其不经之谈和之得四十四韵
921200,伯父《送先人下第归蜀》诗云：「人稀野店休安枕，路入灵关稳跨驴。」安节将去，为诵此句，因以为韵，作小诗十四首送之 其二
864324,舟中夜雪读正卿教授近诗辄赋鄙句并以为别
540144,岘山有朋寿堂盖为大司空蒋公刘公大司寇顾公筑也已已岁余与吴比部范太史嗣游焉吴与余俱丙戌范丁亥因题一绝以为四十年左證云
921203,伯父《送先人下第归蜀》诗云：「人稀野店休安枕，路入灵关稳跨驴。」安节将去，为诵此句，因以为韵，作小诗十四首送之 其五
905467,昨晚又捧五章尽含六义意转新而韵皆紧才益赡而调弥高始知元白之前贤虚擅车斜之美誉夜来绕遍林树搜穷肺肝虽巧拙以不侔亦讴吟而自得又依前韵各罄乃怀所贵夫伏老之身心亦冈避不量力之讥诮自兹解甲且议休兵向非起予何以为乐大雅君子无或见咍 其五
685790,南京给事中童志昂和李商隐无题诗韵南京诸公多和之意盖有寓间出命予属和予村学究也不能外题以为诗姑咏史以复之
457953,班中翻《三国演义》，伏见刘备兄盖世英雄，战无不败，宁屈不死，百逃不殆，及入赘东吴，始过上幸福生活；再逃东吴，又多得贤内之助；予仰之无已，因恭作二绝，以为颂歌焉 其一
683076,甲戌岁朝明日立春东坡元日诗有土牛明日莫辞春之句因以为韵赋七诗
572861,和退如舟中韵退如访道回家有新姬并以为嘲
990890,刘成伯遗建州小片的乳茶十枚因以为答
498633,临行阿锁欲尽写前诗凡十一首既而色有未满曰：『斯语太文妾不用此可为别制数章取数月来情事综迹历历于心者谱之勿诳勿艳勿誉妾姿艺如一语有犯即罚君一杯』余曰『固然但每诗成而卿以为可亦引满赏此何如』一笑许诺遂口占为下酒十六首 其十一
414656,江南故人闻余将休致咸劝东游辄赋小诗以为息壤七首 其四
833587,金缕曲 其二 莲溪以鹾台领长沙、宝庆二郡，余误以为常德，遂有“武陵桃花”之句，可笑人也。赋此解嘲
1075210,米元章为须江太守闻有怪石在河壖莫知其所自来人以为异而不敢取公命移置州沼为燕游之玩石至而惊遽命设席拜于庭下曰吾欲见石兄二十年矣闻者以为言坐是罢去余游濡须而石犹在询之邦人信然乃作此诗
1075210,米元章为须江太守闻有怪石在河壖莫知其所自来人以为异而不敢取公命移置州沼为燕游之玩石至而惊遽命设席拜于庭下曰吾欲见石兄二十年矣闻者以为言坐是罢去余游濡须而石犹在询之邦人信然乃作此诗
972165,三月初二日雨人以为风止之祥
589545,访李子长不以为礼诗以复之二首 其一
1067811,谢灵运诗云中为天地物今成鄙夫有取以为韵遣兴作十章兼寄云叟 其六
330641,海邑少交游相见者以为言故作此诗
828612,十四岁除夕有句云「诗成两岁乘除里春在万家欢喜中」先师关季华先生极为叹赏以为他日立朝事业所在也今老矣一无所成感赋一绝
965909,魏漕彦成昔宰弋阳政续上闻召对改秩予适当词命后自台郎出守滁垦荒田千二百顷柄国者挟妻家私憾以为罔功将漕襄阳修筑大堤禦水患又以为妄作与洪兴祖为程伯禹刊论语解至周公谓鲁公有太息流涕之言彦成遂被窜于钦州柄国者死例逢赦宥归道南岳以大篇侑酒十尊见遗因成七绝以谢之 其五
965909,魏漕彦成昔宰弋阳政续上闻召对改秩予适当词命后自台郎出守滁垦荒田千二百顷柄国者挟妻家私憾以为罔功将漕襄阳修筑大堤禦水患又以为妄作与洪兴祖为程伯禹刊论语解至周公谓鲁公有太息流涕之言彦成遂被窜于钦州柄国者死例逢赦宥归道南岳以大篇侑酒十尊见遗因成七绝以谢之 其五
251971,前诵疏影弟游山佳什得惟君性好山颇会登临意之句然久未完篇今届九日勉为续成即以为赠
180995,某用家弟韵赋绝句上浼清视芜词累句非敢以为
1087794,昨承诸兄临辱不揆以薄酒蔬食延驻都骑明日视壁间所张墨刻有亡去者人以为德庆丈之廋也驰问遣索蒙需拙诗辄赋所怀往奉一笑而尊犍刻可以归于我矣
949612,醉落魄 洪仲鲁之江西，书以为别
436768,望月婆罗门引 癸卯元宵与诸君各赋词以为乐寂寞山村无可道者因述其昔年京华所见以望月婆罗门引歌之酒酣击节将有堕开元之泪者
435151,昨晚蒙降临无以为待早赴院谢闻己长往何行之速也因去人寄达少慰客中未伸之志耳 其二
812465,蝶恋花 癸丑春日将归洞庭，闺中诸姊妹投赠诗词以为祖饯之意，予亦悲感交集，谱此以别。
563104,大司寇秦六胡老公祖考绩承恩诗以为贺
827205,金缕曲 与痴萍饮后，强余填词，荡气回肠，聊以为笑
974266,徐审知置酒会者三人以为此春酒以介眉寿分韵作诗蕃得介眉字二首 其一
1075205,解人敦武郎富君为余言解池广二百里其利不赀又有六小池官虽置戍以为厉禁而民寔擅其利或悉以属县官则盐不复成其事颇怪作小诗以纪之
1194701,见王监兵马使说近山有白黑二鹰罗者久取竟未能得王以为毛骨有异他鹰恐腊后春生鶱飞避暖劲翮思秋之甚眇不可见请余赋诗
513953,仆家徽之篁墩有晋循吏陈忠臣之祠第在焉土人尝更名黄以避巢贼之荼毒袭称至今仆近复篁墩之号而翰长镜川先生作十绝非之仆亦未敢以为是也谨次韵随章奉答幸终教之 其一
400231,三姝媚 西园暝步，枨触无端，归读静庵邮示三姝媚近词，希颖以为在梅溪、碧山之间者，爰拾往时风怀，并用其同部韵，倚声以报
1077704,去岁道巴陵登岳阳楼以望洞庭真天下之壮观也因诵孟浩然气蒸云梦泽波撼岳阳城之句追古今绝唱用以为韵赋诗十篇 其三
498630,临行阿锁欲尽写前诗凡十一首既而色有未满曰：『斯语太文妾不用此可为别制数章取数月来情事综迹历历于心者谱之勿诳勿艳勿誉妾姿艺如一语有犯即罚君一杯』余曰『固然但每诗成而卿以为可亦引满赏此何如』一笑许诺遂口占为下酒十六首 其八
493290,闻思庵中有罗汉柏二株一花一实或以为有雌雄云
771999,家翔秋茂才以为「兄」字难次，复叠前韵戏成
1066396,罗源护国院危簿以为大类庐山因作两绝句 其二
1113946,昨晚又捧五章尽含六义意转新而韵皆紧才益赡而调弥高始知元白之前贤虚擅车斜之美誉夜来绕遍林树搜穷肺肝虽巧拙以不侔亦讴吟而自得又依前韵各罄乃怀所贵夫伏老之身心亦冈避不量力之讥诮自兹解甲且议休兵向非起予何以为乐大雅君子无或见咍
1231822,至元戊寅四月十九日风雷大作村民以为龙王嫁女予作诗以纪之
1124246,徐审知置酒会者三人以为此春酒以介眉寿分韵作诗蕃得介眉字二首
498037,昔年同社为秋词，今成往事，离居多感，岁晏不聊，触绪生吟，冰霜满月，凛尖风之透骨，感皎月之映心，多因梦后之思，添出酒边之句，聊作秋声貂续，以为春咏前驱，合曰寒词得一十六首 其四
921212,伯父《送先人下第归蜀》诗云：「人稀野店休安枕，路入灵关稳跨驴。」安节将去，为诵此句，因以为韵，作小诗十四首送之 其十四
337592,谢曾同季示近作因以为赠
858561,道旁大松人取以为明
467171,无以为题
1124043,晏斋余自名也故常以榜自随乃以名厅事之东偏厅之后旧有一室面对竹余山居富此物亦以竹隐名对此竹而有思于山中故以思隐名之思隐之东又辟屋丈许连以为斋乞名于张君伯永为名曰容斋并作三绝志其事焉
572763,新买得画舫将以为庵因作舟居诗 其十
513954,仆家徽之篁墩有晋循吏陈忠臣之祠第在焉土人尝更名黄以避巢贼之荼毒袭称至今仆近复篁墩之号而翰长镜川先生作十绝非之仆亦未敢以为是也谨次韵随章奉答幸终教之 其二
159175,淮南早春风雨连日俗以为宜
996753,自咸平至太康鞍马间得十小诗寄怀晏叔原并问王稚川行李鹅儿黄似酒对酒爱新鹅此他日醉时与叔原所咏因以为韵 其六
1010774,惠莲峰诗以为谢
1118202,以石芥送刘韶美礼部刘比酿酒劲甚因以为戏二首
251069,杭州初晤天水薇室与之论诗不以为谬别后作诗见寄并索和次韵奉答
1035185,水调歌头 次韵高才卿恭叔见贻生日 因以为寿
668241,斋前小山秽翳久矣家兄召工治之剪薙一新殊觉秀爽晚晴独坐诵王临川扫石出古色洗松纳空光之句因以为韵赋小诗十首 其十
695632,勿逾方先生令惠来据九年始终一节业当通考忽有贾傅之行伤哉贫也去无以为资士论惜之为赋三章聊志遗思
1091121,闻齐安杂咏板成从沈守求印蒙以为赠
1112221,次望喜驿始见嘉陵江得予友天章张文裕西使日咏嘉陵江诗刻于馆壁有感别之叹予因戏答二章他日见文裕以为一笑
889975,都大华文监丞权府事之明年天子诏将直禁近邦之人有以三瑞为献者曰双莲曰岐麦曰九穗禾皆斯世之上瑞而萃于一时人目之以为盛遂采民谣集成歌颂曲三首以纪其美
434639,陶君秀晋人尝为司竹监使因祖渊明尝游五柳庄为立五柳祠在县东西原方见有祠堂诗碑向禹城侯先生司竹时与扶风张明叙六曲李仲常凤翔董彦材从之学如白云楼海棠馆所谓胜游也兵后吾弟主之亦西州衣冠之幸感今慨昔不能不惘然也握手一笑知复何年敢先此以为质兼示鄠亭赵秀才 其一
921205,伯父《送先人下第归蜀》诗云：「人稀野店休安枕，路入灵关稳跨驴。」安节将去，为诵此句，因以为韵，作小诗十四首送之 其七
194955,谢陈进士见示诗赋并以为别
383774,十一月二十九日圣母万寿圣节赐金币镂金篆字黄朱灵符等物岁以为常
86713,丘君双荐前尹古田三年有遗爱邑人以为可继阳
378341,秋日还庐山故人书因以为寄
345173,公舒朝请得福守所寄荔子佳品二而咏以二诗乃以为示辄次韵奉和
904529,公实公衍伯仲相访云木犀再花香橘新摘也并以为惠且将以佳篇因次韵
581168,予既为诗以为公功德之颂矣复作迎送神辞二曲俾岁时歌以祀公云
879854,贺真参政因以为戒
1064122,宗公以兰见遗风叶萧散兰芽并茁一干双花斗开宗以为瑞乞诗记其事
483522,尝见石刻本华山图以为形似不过如此及既登而还重见于姜月心家不觉失笑因书此于其上
513955,仆家徽之篁墩有晋循吏陈忠臣之祠第在焉土人尝更名黄以避巢贼之荼毒袭称至今仆近复篁墩之号而翰长镜川先生作十绝非之仆亦未敢以为是也谨次韵随章奉答幸终教之 其三
417235,水调歌头    原韵酬梦痕见和即以为赠
715298,王观察招食嘉鱼率赋兼以为别 其三
868716,许敬之用余言作松山草堂然游山之意犹未已也申以为箴
322949,寓栖真四宿时二儿寓上庠未知去留又祠命未下颇以为怀
404932,中兴乐·东吴大学创校起十五年矣。属有高会，为依中兴乐调歌以为寿
1091115,黄杨生拳石间王彦材以为赠且赋之走命曰孤山贞干次韵以酬
905429,至启休沐之中静专一室病不复饮无以慰怀性且寡合若何为乐但窗閒弄笔信意乱书无所从意无所得自如而已岂曰诗乎不觉又成五章章之首句皆云朱门多好景盖纪田第园林之胜美明公游豫之适昔张处士献牛奇章诗尤鲙炙人口其警句有带盘红鼹鼠袍砑紫犀牛之盛然而清议者不以为累公之德何哉赋闲宴而歌富贵也小子是作焉敢望回然亦驽骀之希骥尔 其四
1066235,乙巳八月二十九日宿内府梦过村落循溪而行问路旁人家此云何曰士村也涉溪入山崦谓同行曰此可赋诗因得鸠燕二句既觉足之以为异日之观
238579,物贵日甚·自从为关以为暴
383149,十月朔日颁历赐新书五十册岁以为常
434642,陶君秀晋人尝为司竹监使因祖渊明尝游五柳庄为立五柳祠在县东西原方见有祠堂诗碑向禹城侯先生司竹时与扶风张明叙六曲李仲常凤翔董彦材从之学如白云楼海棠馆所谓胜游也兵后吾弟主之亦西州衣冠之幸感今慨昔不能不惘然也握手一笑知复何年敢先此以为质兼示鄠亭赵秀才 其四
922921,元丰己未三院东阁作 元丰戊午夏予尹京治陈氏狱言者以为推劾不尽诏移大理而理官推迹陈氏姻党干求府政纵出重辟事下御史推求己未岁予自濠梁赴台讯鞫卒不涉干求之迹而大理反有傅致之状虽蒙辩正听命久之不得出邑邑不已作诗十篇记一时事非欲传之他人但以示子侄辈使知仕宦之艰耳 其三
458484,微吟兄归自美利坚，共聚游者数日。既已别去，乃醉为书此。想予作诗之时，正小女屏上骋辩之刻也，亦微吟兄鸡皮下泪之际也。更饮一盅，聊以为贺三首 其三
563101,廉宪王母诰封张太恭人七十寿诗张太恭人刲股血诚神明降鉴天子既表怀清之宅复疏观察之恩荣名所归吉祥来集兹大夫盟府纪功祝釐竣事正当太夫人七帙设帨之辰是日也白华朱萼赓束晢之诗青鸟丹砂受西池之箓九牧之中三乐咸备诗以为贺
894110,和答越州吕乡见赠之作兼以为别
498623,临行阿锁欲尽写前诗凡十一首既而色有未满曰：『斯语太文妾不用此可为别制数章取数月来情事综迹历历于心者谱之勿诳勿艳勿誉妾姿艺如一语有犯即罚君一杯』余曰『固然但每诗成而卿以为可亦引满赏此何如』一笑许诺遂口占为下酒十六首 其一
594178,周计部元孚被播南行答其临清所寄因以为别 其一
498046,昔年同社为秋词，今成往事，离居多感，岁晏不聊，触绪生吟，冰霜满月，凛尖风之透骨，感皎月之映心，多因梦后之思，添出酒边之句，聊作秋声貂续，以为春咏前驱，合曰寒词得一十六首 其十三
641859,李守道芍药有一茎而双葩者是日方纳婿咸以为瑞钱国录有诗王梧溪为之序一日持卷来求予题因赋此
522303,赵叔敬佥宪示和东湖诗次韵写怀因以为赠 其三
693947,奉新署中赠冯调冶且以为别
660658,小圃丝瓜丛生有一蒂三四茎者园丁以为怪一老仆独以为瑞来语予予曰谓之怪者非也谓之瑞者亦非也乃赋一诗以记之
660658,小圃丝瓜丛生有一蒂三四茎者园丁以为怪一老仆独以为瑞来语予予曰谓之怪者非也谓之瑞者亦非也乃赋一诗以记之
991871,北州人有致达头鱼于永叔者素未闻其名盖海鱼也分以为遗聊知异物耳因感而成咏
449776,为群中网友题藏头小诗九首以为乐 其六
333818,子常生日无以为寿偶得团茶一饼因书拙诗一首藉之以献
1211366,大雨两昼夜僮屋尽仆惟轩前新竹绰有生意得二十八字以为口号
513956,仆家徽之篁墩有晋循吏陈忠臣之祠第在焉土人尝更名黄以避巢贼之荼毒袭称至今仆近复篁墩之号而翰长镜川先生作十绝非之仆亦未敢以为是也谨次韵随章奉答幸终教之 其四
928394,以石芥送刘韶美礼部刘比酿酒劲甚因以为戏二首 其二
471979,纪赐四十首 其十二 元旦赐门神挂屏葫芦等物岁以为常
446022,乐安兄诗集将梓索序于予书此塞责即以为贺
197839,和喜雨韵·体天生物以为心
326623,观西山怀岳麓以为莫能相上下也聊赋此云
444469,寿星明 为一庸老人题苍松秋涧图，即以为寿
1206391,次韵伯庸待制上京寓直书事四首因以为寄 其一
414653,江南故人闻余将休致咸劝东游辄赋小诗以为息壤七首 其一
974265,徐审知置酒会者三人以为此春酒以介眉寿分韵作诗蕃得介眉字二首 其二
572757,新买得画舫将以为庵因作舟居诗 其四
414657,江南故人闻余将休致咸劝东游辄赋小诗以为息壤七首 其五
1067810,谢灵运诗云中为天地物今成鄙夫有取以为韵遣兴作十章兼寄云叟 其五
581625,某佥宪左迁别驾六十一生子其婿刘仁仲作图寿之并以为贺予为之赋
553183,九月廿日夜梦韩生唯传动静如常时而面黄惨臃肿予意传其死者之妄不以为梦也觉后成诗一首时残月印衾鸡声喔喔谯楼已四鼓矣为之凄绝
959162,育王老禅屡惠佳茗比又携日铸为饷因言久则味失师授以焙藏之法必有以专之笑谓非力所及谩成拙语解嘲录以为谢
658891,予伏林下睹闾阎之疾苦悯征求之繁多伤循吏之难值也每以为叹癸酉六月客有过予谈海虞胡令之政者为赋诗
690699,五月七日宝安诸君子招汎龙潭八日复汎篁村同观竞渡客有歌落日放船好轻风生浪迟之句者因以为韵人赋十章邓玄度六言首奏余亦步其韵以六言赓焉
677555,陪大司成尹洞山先生游三茅山观池中小龙和作并以为别二首 其二
438195,壬辰二月六日夜梦作一绝句其词曰矫冗连天花春风动光华人眠不知眠我佩绛红霞梦中自以为奇绝觉而思之不能自晓故作是诗以纪之
921208,伯父《送先人下第归蜀》诗云：「人稀野店休安枕，路入灵关稳跨驴。」安节将去，为诵此句，因以为韵，作小诗十四首送之 其十
570774,王阳德大参自诧地理师而极口为江右刘生游扬以为能得景纯三昩墓田丙舍一一听其更定刘子来谒乃有谓其非真者戏成小绝赠之 其一
449772,为群中网友题藏头小诗九首以为乐 其二
1176428,顷自桐江得一钓车以袭美乐烟波之思因出以为玩俄辱三篇复抒酬荅 其二
