513962,仆家徽之篁墩有晋循吏陈忠臣之祠第在焉土人尝更名黄以避巢贼之荼毒袭称至今仆近复篁墩之号而翰长镜川先生作十绝非之仆亦未敢以为是也谨次韵随章奉答幸终教之 其十
551427,苕溪逢谢长史姊丈携家适至赋此志喜且以为别
1067807,谢灵运诗云中为天地物今成鄙夫有取以为韵遣兴作十章兼寄云叟 其二
570775,王阳德大参自诧地理师而极口为江右刘生游扬以为能得景纯三昩墓田丙舍一一听其更定刘子来谒乃有谓其非真者戏成小绝赠之 其二
908480,晚步江浒有得鼋大如箕赎放之邻叟言此家前数日已尝得一煮之通夕旦发盎视之鼋忽引首以水喷其面兹亦可惊异者作是诗以为好杀者之戒
1077708,去岁道巴陵登岳阳楼以望洞庭真天下之壮观也因诵孟浩然气蒸云梦泽波撼岳阳城之句追古今绝唱用以为韵赋诗十篇 其七
459854,共卢醉往肖，卢途中命作诗，口号诵之，以为进行曲 其一
1073571,雉山岩昔有僧结庵此山中诵法华经野雉日一集听之至终卷乃去率以为常忽数日不至山下有妇人产子腰胁间馀雉毛数寸寺有石纪其事 虞氏隐居雷守虞沇避地桂林结茅江上万山环立二水交流游客过其下皆有忘归与卜邻之意
273734,换巢鸾凤·比利时人有从其使节至此者，国破无以为生，乃典其妻与人，期十年
1074779,次韵端叔叠前韵见贻因以为别
522302,赵叔敬佥宪示和东湖诗次韵写怀因以为赠 其二
634543,西朋老居士七十一初度闻以放生为乐放生之报报在上寿仅广其意作二章以为公劝 其二
114062,有闻帐中香以为熬蝎者戏用前韵
702492,仆家徽之篁墩有晋循吏陈忠臣之祠第在焉土人尝更名黄以避巢贼之荼毒袭称至今仆近复篁墩之号而翰长镜川先生作十绝非之仆亦未敢以为是也谨次韵随章奉答幸终教之
494965,承桂洲公部署观莲晚发双花亭亭以为联璧之兆用旧韵作诗以庆之
1206390,次韵伯庸待制上京寓直书事四首因以为寄 其三
668233,斋前小山秽翳久矣家兄召工治之剪薙一新殊觉秀爽晚晴独坐诵王临川扫石出古色洗松纳空光之句因以为韵赋小诗十首 其二
957070,知郡安抚以立春日揭所书新安郡榜南楼之上晓雪纷集邦人以为善祥遂开宴以落之辄赋长句一篇以附风谣之末
452505,鹧鸪天 友人岳父家遭遇强行占地，生计难以为继，夫妇俩仓皇来京为家人申诉，予陪其小酌，归后忽然高烧，竟夜辗转难眠，榻上赋此
1058631,六月旦有芝生于小厅之南楹连叶七层颜色黄润常有露珠联络其上观者叹息以为祥异因作三小诗 其一
1005887,寇攘之馀谷五斗才易一鸡衰老多病资血味以为养求之弗可得畜二母鸡自春抱育至夏百翼不减子美生理喜而有作
449917,庚寅六月末晨起凉甚以为秋
622348,短叶乞花不能尽意昨者一枝新之句主人以为求插净瓶乃余所求者本也
521960,陆腾远将赴吉安来别因及其乡榜书名之异赋以为赠
522395,昔司空表圣辞官后预营冢圹与宾客同游世传以为达予葬淑人迫于岁暮功虽未讫而规制定矣营度往还得绝句十二首目之曰生游棹歌非敢仰希先躅亦聊以寄兴云尔 其五
498631,临行阿锁欲尽写前诗凡十一首既而色有未满曰：『斯语太文妾不用此可为别制数章取数月来情事综迹历历于心者谱之勿诳勿艳勿誉妾姿艺如一语有犯即罚君一杯』余曰『固然但每诗成而卿以为可亦引满赏此何如』一笑许诺遂口占为下酒十六首 其九
779287,定风波 古春轩老人有《消夏集》，徵咏夜来香、鹦哥，纫素馨以为架者，盖云林手制也
1218649,题刘孝子传后泰州海陵县刘子彬性孝友与诸弟隐居读书耕以为养曲尽其道亲丧茔葬有异色蛇见又产连理木人以为孝感状元陈祖仁记其事司业江存礼因作刘孝子传为题其后
1218649,题刘孝子传后泰州海陵县刘子彬性孝友与诸弟隐居读书耕以为养曲尽其道亲丧茔葬有异色蛇见又产连理木人以为孝感状元陈祖仁记其事司业江存礼因作刘孝子传为题其后
920881,子由将赴南都，与余会宿于逍遥堂，作两绝句，读之殆不可为怀，因和其诗以自解。余观子由，自少旷达，天资近道，又得至人养生长年之诀，而余亦窃闻其一二。以为今者宦游相别之日浅，而异时退休相从之日长，既以自解，且以慰子由云 其二
721149,汪鐏石席上出巩二诗吴门王楚臣见而和之巩自以为粤风吴人和而为吴风遂以吴风答之
631213,彭飞云刺史入海云偶谈往事感而成诗即以为赠
1051914,河东桥亭以久废置不用欲移菜畦以为老之游息之地因以诗就公权乞之
498635,临行阿锁欲尽写前诗凡十一首既而色有未满曰：『斯语太文妾不用此可为别制数章取数月来情事综迹历历于心者谱之勿诳勿艳勿誉妾姿艺如一语有犯即罚君一杯』余曰『固然但每诗成而卿以为可亦引满赏此何如』一笑许诺遂口占为下酒十六首 其十三
1084969,中秋见月方以为喜既而阴蔽意殊不满东坡云良天佳月即中秋不以日月断也诸君有醵会之约复用前韵
901050,杜园九日红梅主人以为瑞彭潜心索赋
1067806,谢灵运诗云中为天地物今成鄙夫有取以为韵遣兴作十章兼寄云叟 其一
1123909,成父居于普宁寺钟楼之下辟以为斋旧名坎止近易榜曰发深省衡州舅氏书之仆为赋四小诗以发深省斋为韵
702797,杨淇园侍御巡方事竣仍视学南畿诗以为赠
562584,南京给事中童志昂和李商隐无题诗韵南京诸公多和之意盖有寓间出命予属和予村学究也不能外题以为诗姑咏史以复之 其一
761416,惜秋华  六合城南废祠，或谓祀九江王英布。粤贼陈玉成之溃，土人以为有神力云
921206,伯父《送先人下第归蜀》诗云：「人稀野店休安枕，路入灵关稳跨驴。」安节将去，为诵此句，因以为韵，作小诗十四首送之 其八
654508,太师定兴张忠烈王既葬嗣子英国公懋以宗伯丘先生所作平交南录勒石坟前未几队道产芝一本人以为忠孝所感
194758,玉楼春·今朝何以为公寿
905464,昨晚又捧五章尽含六义意转新而韵皆紧才益赡而调弥高始知元白之前贤虚擅车斜之美誉夜来绕遍林树搜穷肺肝虽巧拙以不侔亦讴吟而自得又依前韵各罄乃怀所贵夫伏老之身心亦冈避不量力之讥诮自兹解甲且议休兵向非起予何以为乐大雅君子无或见咍 其一
657999,孤鹤翁过访出韵命诗以其涵监险也易以函椷二韵余喜东坡不为险韵所拘遂并前韵通一赋之世有苏子瞻者见之当复以为何如哉 其二
498636,临行阿锁欲尽写前诗凡十一首既而色有未满曰：『斯语太文妾不用此可为别制数章取数月来情事综迹历历于心者谱之勿诳勿艳勿誉妾姿艺如一语有犯即罚君一杯』余曰『固然但每诗成而卿以为可亦引满赏此何如』一笑许诺遂口占为下酒十六首 其十四
693463,次许给事启衷九日感怀因以为赠二首
83688,以石芥送刘韶美礼部刘比酿酒劲甚因以为戏
104615,刘十秀才见过寻以为寄次韵和酬
492562,故元侍讲学士邵庵虞公尝作送赵子章还新安叙论述考亭夫子所以为学之方甚悉于篇终复系以诗意甚惓惓焉吾友寿阳继道吕君独好而录之以日诵而自省其必有得于斯言者矣因追和一首以属其后亦将以交勉而更励也
965904,魏漕彦成昔宰弋阳政续上闻召对改秩予适当词命后自台郎出守滁垦荒田千二百顷柄国者挟妻家私憾以为罔功将漕襄阳修筑大堤禦水患又以为妄作与洪兴祖为程伯禹刊论语解至周公谓鲁公有太息流涕之言彦成遂被窜于钦州柄国者死例逢赦宥归道南岳以大篇侑酒十尊见遗因成七绝以谢之 其六
965904,魏漕彦成昔宰弋阳政续上闻召对改秩予适当词命后自台郎出守滁垦荒田千二百顷柄国者挟妻家私憾以为罔功将漕襄阳修筑大堤禦水患又以为妄作与洪兴祖为程伯禹刊论语解至周公谓鲁公有太息流涕之言彦成遂被窜于钦州柄国者死例逢赦宥归道南岳以大篇侑酒十尊见遗因成七绝以谢之 其六
911660,叔虎辱与予游最久其所为诗文仅窥一二未获搴珠璧之椟而纵观也行李来京都携方崖类藁携续集示予暇日隐几读之斲巧抽新绚綵烂烂为之洞心豁目不知君家所藏其富若是辄成古风以自诧奇观因以为谢
679665,生老病死佛家以为四苦宋人又借此以诮权贵今反之为四绝句焉 其二
1127799,彭澄之告以卜筑佐之一缗一石二绝句以为亲旧倡
948520,己未立春留杨伯子知县小酌夜闻窗竹有声伯子以为雪或曰风也已而果雪诘旦敲门送诗走笔戏和
1077703,去岁道巴陵登岳阳楼以望洞庭真天下之壮观也因诵孟浩然气蒸云梦泽波撼岳阳城之句追古今绝唱用以为韵赋诗十篇 其二
735890,镜月归余以先朝典故数事送难于令兄映碧先生先生以为闻所未闻有侨札之誉感赋一律敬寄
300927,江南故人闻余将休致咸劝东游辄赋小诗以为息壤
1034375,次李参政所和五绝句韵因以为寿 其三
522398,昔司空表圣辞官后预营冢圹与宾客同游世传以为达予葬淑人迫于岁暮功虽未讫而规制定矣营度往还得绝句十二首目之曰生游棹歌非敢仰希先躅亦聊以寄兴云尔 其八
302633,八声甘州·瓠厂游鱼鳞峡归，词久未成，赋此以为引喤
1084717,月上人以拳石植海松莳菖阳于四际苍姿秀色钟清气于几案间以为梅溪之野人赠兼惠诗章因与酬唱凡四首 其三
1067813,谢灵运诗云中为天地物今成鄙夫有取以为韵遣兴作十章兼寄云叟 其八
433517,湘雁兄六旬华诞已过忝在旧交补呈两章以为寿
418385,八声甘州 瓠厂游鱼鳞峡归，词久未成，赋此以为引喤
612941,秋夜偕诸生月下诵桂子月中落之句因以为韵 其五
513957,仆家徽之篁墩有晋循吏陈忠臣之祠第在焉土人尝更名黄以避巢贼之荼毒袭称至今仆近复篁墩之号而翰长镜川先生作十绝非之仆亦未敢以为是也谨次韵随章奉答幸终教之 其五
521587,颐浩辩公寄莼菜瓜菹有别久不见渴心生尘之语因以为韵作绝句八首寄谢 其三
305904,湘雁兄六旬华诞已过忝在旧交补呈两章以为寿
1113792,杨尉三和篇补其二以为答不敢虚盛意
922923,元丰己未三院东阁作 元丰戊午夏予尹京治陈氏狱言者以为推劾不尽诏移大理而理官推迹陈氏姻党干求府政纵出重辟事下御史推求己未岁予自濠梁赴台讯鞫卒不涉干求之迹而大理反有傅致之状虽蒙辩正听命久之不得出邑邑不已作诗十篇记一时事非欲传之他人但以示子侄辈使知仕宦之艰耳 其八
463916,前诵疏影弟游山佳什得惟君性好山颇会登临意之句然久未完篇今届九日勉为续成即以为赠
1077711,去岁道巴陵登岳阳楼以望洞庭真天下之壮观也因诵孟浩然气蒸云梦泽波撼岳阳城之句追古今绝唱用以为韵赋诗十篇 其十
1207769,重五日至西峡渡邂逅闽帅王侯盛称山川之壮余谓可以为知矣亦复有赋渡近方山之下
1147697,余以咸亨元年在西京寻听于时与并部处一法师莱州弘祎论师更有三二诸德同契鹫岭标心觉树然而一公属母亲之年老遂怀恋于并州祎师遇玄瞻于江宁乃叙情于安养玄逵既到广府复阻先期唯与晋州小僧善行同去神州故友索尔分飞印度新知冥焉未会此时踯躅难以为怀戏拟四愁聊题两绝 其一
467678,为群中网友题藏头小诗九首以为乐
700221,赵叔敬佥宪示和东湖诗次韵写怀因以为赠
1113779,永兄作灵照寺墨梅两纸殊佳仍书二绝其上以为饷次韵谢之
98120,三月初二日雨人以为风止之祥
1091156,某为令无状不能化服奸盗至加之刑僇仲蟠乡丈不以为过又哦诗以宠之是重某之不肖而播其恶于众也感愧之剧次韵以酬
934550,新裁短褐接客以代戎服或以为慢戏作
773649,庚辰1820岁来郡考试閒步引心书院诣文昌寂凝坛及准提寺吕祖庙见其栋宇坚牢门屏巩固规形体制迥异昔时询诸守院人稔知陈君廷瑜勤劳董脩从事十三年不厌不倦方得遹观厥成余闻而心慕之不揣鄙词歌以为赠
414659,江南故人闻余将休致咸劝东游辄赋小诗以为息壤七首 其七
630676,康熙庚戌孟秋制府周彝初持服北归道出韶石订入山不果赋诗三首奉柬兼以为别 其三
588585,崧台石室隋志本名定山林惟乔以为别号赋诗赠之
905433,至启休沐之中静专一室病不复饮无以慰怀性且寡合若何为乐但窗閒弄笔信意乱书无所从意无所得自如而已岂曰诗乎不觉又成五章章之首句皆云朱门多好景盖纪田第园林之胜美明公游豫之适昔张处士献牛奇章诗尤鲙炙人口其警句有带盘红鼹鼠袍砑紫犀牛之盛然而清议者不以为累公之德何哉赋闲宴而歌富贵也小子是作焉敢望回然亦驽骀之希骥尔 其一
584993,予游象山台既有班班花鸟之句朗司厅适见之以为诮己也因再咏以释其意盖岂绝望于象之无人耶
128138,舆歌·世谓夷齐以为溷兮
1077705,去岁道巴陵登岳阳楼以望洞庭真天下之壮观也因诵孟浩然气蒸云梦泽波撼岳阳城之句追古今绝唱用以为韵赋诗十篇 其四
1000151,予家畜狸花二猫一日狸者获鼠未食而花者私窃之以去家人不知以为鼠自花获也因感而作二猫诗
192149,永兄作灵照寺墨梅雨纸殊佳仍书二绝其上以为
605290,五月七日宝安诸君子招汎龙潭八日复汎篁村同观竞渡客有歌落日放船好轻风生浪迟之句者因以为韵人赋十章邓玄度六言首奏余亦步其韵以六言赓焉 其八
1208448,乞巧辞二章（京师里俗以七月七日昏时设祠乞巧于天星织女盖闺人处子惑于荒谬怪诞之说不事箴组觊倖渺茫虚无之效卒无所得予闵其愚遂设为妇祷神答之意缀成此章假辞托兴以譬夫世之学者昧下学上达之理忽略遗弃于日用寻常之事而谓圣人之迶高远玄妙非力行之所可企及当求之于恍惚有无之域是以终于无闻漫不知省因以为戒且自警云尔） 其一
907614,陈伯和和经字韵复以为报
457923,予目时患炎症，岁必一二回，恒以为常。医云此用目过度之故，苟不调剂，未必不有盲日。今复觉有异，似症又蠢蠢将作，为赋 其二
983885,高庙灾董仲舒推说其意稿未上主父偃候仲舒私见嫉之窃其书而奏焉上召视诸儒吕步舒以为大愚下仲舒吏当死诏赦之
824007,金缕曲 剑公结婚之前数日，成金缕曲一阕，感此新欢，顿触旧绪，音极凄艳，索为和词。爰步其原韵，即以为贺
1067814,谢灵运诗云中为天地物今成鄙夫有取以为韵遣兴作十章兼寄云叟 其九
1088569,丘子服来访道间得古梅折以为赠刘叔通江文卿俱来各有佳句因各次韵为答三首 其一
1070929,海外气候每岁三四月间已如剧暑客有自吉阳至者寓馆问汉亭累日且言吉阳气候昼夜如炊因叹此邦之胜乃知人生无有足时不经热恼岂知平日之清凉乎故古之达者每以此对治释氏云推落大火坑火坑变成池皮鞋和尚以为即时清凉也苏公亦云岭南瘴毒地有此江月寒乃知天壤间何人不清安予谪居岭海踰十五年见闻习熟不以为异因作此诗以自慰且以警世之贱丈夫一不快即愁叹怨愤或讥谤怒骂如柳刘之徒盖未足以语此也
1070929,海外气候每岁三四月间已如剧暑客有自吉阳至者寓馆问汉亭累日且言吉阳气候昼夜如炊因叹此邦之胜乃知人生无有足时不经热恼岂知平日之清凉乎故古之达者每以此对治释氏云推落大火坑火坑变成池皮鞋和尚以为即时清凉也苏公亦云岭南瘴毒地有此江月寒乃知天壤间何人不清安予谪居岭海踰十五年见闻习熟不以为异因作此诗以自慰且以警世之贱丈夫一不快即愁叹怨愤或讥谤怒骂如柳刘之徒盖未足以语此也
852054,余过兴州太守晁侯延之于东池晴碧亭且道其所以为此池亭之意使余赋诗
192151,其上以为·不干老眼眩生花
192207,五更一点月照窗几以为晓也披衣视之雪厚至尺
189673,徐仲车食於学官吏或以为不可欲罢去之太守不
353809,罗源护国院危簿以为大类庐山因作两绝句
973897,成父居于普宁寺钟楼之下辟以为斋旧名坎止近易榜曰发深省衡州舅氏书之仆为赋四小诗以发深省斋为韵 其一
714955,林赤见以谷皮纸见赠予将以为衣赋诗志喜
957218,淳熙四年六月二十七日登大峨之巅一名胜峰山佛书以为普贤大士所居连日光相大现赋诗纪实属印老刻之以为山中一重公案
957218,淳熙四年六月二十七日登大峨之巅一名胜峰山佛书以为普贤大士所居连日光相大现赋诗纪实属印老刻之以为山中一重公案
1070036,吴下去冬不寒春不雨人以为病城中火灾相仍自十二月至今凡八九发雍熙佛寺灾势尤甚闾里讹言相惊往往徙货泉载家具日为避火计二月乙巳郡守以承天佛寺慧感神像供府第为佛事禳祷是日雨明日雪丁未又大雪农事有初火怪庶或熄人心稍安作诗记其事
1111363,罗源护国院危簿以为大类庐山因作两绝句
1062836,翟经国筑室于乡里人誇传以为盛其西吾苇溪也以诗戏之
514193,阎方伯为予言藩省门对吴山有白鹭群飞朝去暮来日以为常因识以诗且将绘图以传遂次韵一首
1058633,六月旦有芝生于小厅之南楹连叶七层颜色黄润常有露珠联络其上观者叹息以为祥异因作三小诗 其三
1073507,余大观中偕何袭明登仕同为太学诸生别后二十六年余□南迁道清江袭明逆余于新淦之洲上苍颜白发大略相似感叹之馀饮酒赋诗以为笑乐袭明笔力雄赡操纸立就凡六七反必用前韵余继和者十二篇云 其一
327062,丘子服来访道间得古梅折以为赠刘叔通江文卿俱来各有佳句因各次韵为答
449773,为群中网友题藏头小诗九首以为乐 其三
449771,为群中网友题藏头小诗九首以为乐 其一
1088570,丘子服来访道间得古梅折以为赠刘叔通江文卿俱来各有佳句因各次韵为答三首 其二
1123101,魏漕彦成昔宰弋阳政续上闻召对改秩予适当词命后自台郎出守滁垦荒田千二百顷柄国者挟妻家私憾以为罔功将漕襄阳修筑大堤禦水患又以为妄作与洪兴祖为程伯禹刊论语解至周公谓鲁公有太息流涕之言彦成遂被窜于钦州柄国者死例逢赦宥归道南岳以大篇侑酒十尊见遗因成七绝以谢之
1123101,魏漕彦成昔宰弋阳政续上闻召对改秩予适当词命后自台郎出守滁垦荒田千二百顷柄国者挟妻家私憾以为罔功将漕襄阳修筑大堤禦水患又以为妄作与洪兴祖为程伯禹刊论语解至周公谓鲁公有太息流涕之言彦成遂被窜于钦州柄国者死例逢赦宥归道南岳以大篇侑酒十尊见遗因成七绝以谢之
91484,我原以为
965908,魏漕彦成昔宰弋阳政续上闻召对改秩予适当词命后自台郎出守滁垦荒田千二百顷柄国者挟妻家私憾以为罔功将漕襄阳修筑大堤禦水患又以为妄作与洪兴祖为程伯禹刊论语解至周公谓鲁公有太息流涕之言彦成遂被窜于钦州柄国者死例逢赦宥归道南岳以大篇侑酒十尊见遗因成七绝以谢之 其三
965908,魏漕彦成昔宰弋阳政续上闻召对改秩予适当词命后自台郎出守滁垦荒田千二百顷柄国者挟妻家私憾以为罔功将漕襄阳修筑大堤禦水患又以为妄作与洪兴祖为程伯禹刊论语解至周公谓鲁公有太息流涕之言彦成遂被窜于钦州柄国者死例逢赦宥归道南岳以大篇侑酒十尊见遗因成七绝以谢之 其三
449775,为群中网友题藏头小诗九首以为乐 其五
893789,再葺流杯亭兼得今翰林胡学士旧记石刻移置坐隅郡人以为宠
457998,予辞故乡网唐风宋韵版主，诸友惜别相送，作诗甚众，予览而感之，感而愧之，赋此聊以为答
966196,古今豪逸自放之士鲜不嗜酒以其类也虽以此致失者不少而清坐不饮醒眼看醉人亦未必尽得盖可考矣予好饮而尝患不给二顷种秫之念往来于怀世网婴之未有其会因作五言酒诗一百韵以寄吾意虽寄古人陈迹并及酒德之大概以为开辟醉乡之羽檄参差反复不能论次也同年兄唐仲章闻而悦之因录以寄庶几兹乡他日不乏宝邻尔
634542,西朋老居士七十一初度闻以放生为乐放生之报报在上寿仅广其意作二章以为公劝 其一
1055889,鲜于子骏用鲁直见寄韵因以为谢
630674,康熙庚戌孟秋制府周彝初持服北归道出韶石订入山不果赋诗三首奉柬兼以为别 其一
658138,东坡雪诗善用险韵王介甫赵昌谷诸老和之皆以为不可及余因其言遂戏和之 其一
433621,江南故人闻余将休致咸劝东游辄赋小诗以为息壤七首
774146,台俗除夕门设纸虎祭以鸭焚之谓可厌煞余名之曰焚虎元夕女子偷折人家花枝谓异日可得佳婿余名之曰窃花往时在京师作梦树堂花二诗谓事极韵且可举以为偶也今兹将毋同因赋四绝句
1036073,临江仙 龙丘子自洛之蜀，戴二侍女，戎装骏马。至溪山佳处，辄留数日，见者以为异人。其后十年，筑室黄冈之北，号曰静安居士。作此词赠之
509508,总镇陈太监宅东有池故名鳄鱼而鳄鱼已绝岁庚寅冬渔人致嘉鱼于公公弗忍烹育之池中因作亭其上而以为名东吴韩子临观见物性之适作诗手书于亭中
509511,总兵官平江伯陈公志坚镇守两广之明年蛮夷咸服境土悉平乃于府第之中作轩三楹颜曰双秀以轩后梧山双岭联秀当轩故以为名东吴韩子往观而悦公得山之趣焉公索诗因题如左义见乎词
612938,秋夜偕诸生月下诵桂子月中落之句因以为韵 其二
296187,管幼安·因山以为庐
1054049,守倅自开元观食起欲往紫极宫道过余之家园乃屈同游太守自以为能知地形余故议卜居之处也以诗谢焉
703647,康熙庚戌孟秋制府周彝初持服北归道出韶石订入山不果赋诗三首奉柬兼以为别
1073569,雉山岩昔有僧结庵此山中诵法华经野雉日一集听之至终卷乃去率以为常忽数日不至山下有妇人产子腰胁间馀雉毛数寸寺有石纪其事 永宁寺佛阁五代末马氏据有荆广时其子賨所营也阅二百年壮丽如故有画像存焉状貌魁梧称其阁云
1141682,傍家东北有山曰绍地余幸得之规以为素庄也
1084716,月上人以拳石植海松莳菖阳于四际苍姿秀色钟清气于几案间以为梅溪之野人赠兼惠诗章因与酬唱凡四首 其二
697608,陪大司成尹洞山先生游三茅山观池中小龙和作并以为别二首
693352,和周廷瑞别驾末首反其意以为戏耳三首
920880,子由将赴南都，与余会宿于逍遥堂，作两绝句，读之殆不可为怀，因和其诗以自解。余观子由，自少旷达，天资近道，又得至人养生长年之诀，而余亦窃闻其一二。以为今者宦游相别之日浅，而异时退休相从之日长，既以自解，且以慰子由云 其一
996754,自咸平至太康鞍马间得十小诗寄怀晏叔原并问王稚川行李鹅儿黄似酒对酒爱新鹅此他日醉时与叔原所咏因以为韵 其五
400256,小秦皇 癸丑初夏，偶作小幅，殊不惬意，方欲毁之，定国见过，以为饶有词韵，辄尔索去，爰题小秦皇一阕以归之
920084,丙申岁余在京师乡人陈景回自南来弃其官得太子中允景回旧有地在蔡今将治园囿于其间以自老余尝有意于嵩山之下洛水之上买地筑室以为休息之馆而未果今景回欲余诗遂道此意景回志余言异日可以知余之非戏云尔
830918,摸鱼儿 李冠卿军门招饮，筵上叠前韵，适子大逾日再招，复以为谢  其三 何维朴诗孙
1034374,次李参政所和五绝句韵因以为寿 其五
853786,梦陈和仲如平生交有三言觉而记其一曰错后乱梦中了了以为事错之后此心撩乱不如早谋其始也
434720,予以朝命催租河朔道出隆虑邂逅杨东卿盖栖霞隐人也尝许予小山以地远卒不能致约以后期故作是诗以为定券
716786,授经耿参藩署中值其生辰诗以为寿
1036150,如梦令 元丰七年十二月十八日浴泗州雍熙塔下，戏作如梦令两阙。此曲本唐庄宗制，名忆仙姿，嫌其名不雅，故改为如梦令。庄宗作此词，卒章云：「如梦。如梦。和泪出门相送。」因取以为名云
59406,署中有忆江南梅花者因以为赋
562585,南京给事中童志昂和李商隐无题诗韵南京诸公多和之意盖有寓间出命予属和予村学究也不能外题以为诗姑咏史以复之 其二
627151,奉新署中赠冯调冶且以为别 其二
562586,南京给事中童志昂和李商隐无题诗韵南京诸公多和之意盖有寓间出命予属和予村学究也不能外题以为诗姑咏史以复之 其三
991954,刘十秀才见过寻以为寄次韵和酬
1074991,山谷先生吊秦少游诗云少游醉卧古藤下谁与愁眉唱一杯解道樽前断肠句江南唯有贺方回此以言语文字知少游者也余乡人有官藤州者谓藤人为余言少游既病洗沐步上光华亭手持白玉杯命取江水立酌一杯而逝呜呼此岂徒然者哉东坡题少游自作挽词以为能一死生齐物我是真知少游者也
256765,昨晚蒙降临无以为待早赴院谢闻己长往何行之速也因去人寄达少慰客中未伸之志耳
