1124050,雨中夜归闻两儿诵书偶成二绝幸明叔先生同赋以示之
96648,九月十一夜雨中读吴梦与诗书以示之
969818,里中康节庵画墨梅求诗因述本末以示之
809432,途中览皇太子仿书以示之
212616,用伯恭次信儿韵因以示之
581377,允祯尹怀安诗以示之
627532,四儿溆生日诗以示之
1176837,合州津口别舍弟至东阳峡步趁不及眷然有忆作以示之
971568,雨中夜归闻两儿诵书偶成二绝幸明叔先生同赋以示之 其一
621904,西番诸夷方物多恶薄及乌思藏入贡违期诗以示之
169887,八三侄借半山诗因以示之
865912,用伯恭次信儿韵因以示之
972068,九月十一夜雨中读吴梦与诗书以示之
196061,里中康节庵画墨梅求诗因述本末以示之
598003,舍弟季子郊居观梅有作因用其韵自嘲书以示之
941054,八三侄借半山诗因以示之
1909,合州津口别舍弟至东阳峡步趁不及眷然有忆作以示之
1160881,读小弟诗有感因口号以示之
971569,雨中夜归闻两儿诵书偶成二绝幸明叔先生同赋以示之 其二
586333,孙日章新婚诗以示之
554856,诸儿灯下请说书因以示之
15536,读小弟诗有感因口号以示之
622524,贵溪枉道为邑令所绐也诗以示之
