612077,冬夜读新会陈抑之李长度集赋寄
546687,潞河留别王行父袁微之李本建徐象先四绝句 其一
1075894,次韵庭藻与陈相之李子至定寻梅之约见示
948818,正月三日胡季亨及伯信仲威叔贤昆仲欧阳宅之李达可同自永和来雨中小集叠岫阁用金鼎玉舟劝酒下视梅林戏举说命五说戏祝六君蒙次前韵赋佳篇各徵旧事各以一篇为谢 答欧阳宅之
1214647,竹斋学士作柏图得之李好古野斋平章旧物也
697409,潞河留别王行父袁微之李本建徐象先四绝句
990930,次韵和表臣惠符离去岁重酝酒时与杜挺之李宣叔王平甫饮于阻水仍有笋酱之遗
948821,正月三日胡季亨及伯信仲威叔贤昆仲欧阳宅之李达可同自永和来雨中小集叠岫阁用金鼎玉舟劝酒下视梅林戏举说命五说戏祝六君蒙次前韵赋佳篇各徵旧事各以一篇为谢 答胡叔贤
593888,七夕同丘谦之李袭美梁公智莫廷韩集海子亭听钟山人琴得南字时谦之将赴阆州
1079589,五月五日泊舟北神与关圣功唐充之李元辅作别意殊惘然端午日行次洪泽把酒北望已如异世事矣因念屈大夫之死正是此日慨然有感于心辄成长韵奉寄李民师翁士时来可求和也
184487,李允蹈以诗见诒走笔和之李号能诗诸贵人客也
1208871,中秋与吕仲实清话忆溉之李内翰不见
1113362,题赵表之李伯时画捉马图诗二首
948822,正月三日胡季亨及伯信仲威叔贤昆仲欧阳宅之李达可同自永和来雨中小集叠岫阁用金鼎玉舟劝酒下视梅林戏举说命五说戏祝六君蒙次前韵赋佳篇各徵旧事各以一篇为谢 答胡季亨
177735,怀贤诗之李兵部
948819,正月三日胡季亨及伯信仲威叔贤昆仲欧阳宅之李达可同自永和来雨中小集叠岫阁用金鼎玉舟劝酒下视梅林戏举说命五说戏祝六君蒙次前韵赋佳篇各徵旧事各以一篇为谢 答胡仲威
592542,汪禹乂吴膺之李鸣卿吴虎臣朱道光邬汝翼诸子集斋中得杯字
1160609,崔中举进士游岳阳遇真人录沁园春词诘其姓名荐之李守排户而入惟见留诗于壁
313823,好事近·过桂林，达云邀游相思江畔之李家村，宿军校，明日为学员讲话后留题山壁
913334,读退之李花诗
1084465,己巳梅溪同舍三十人其九人者游从之旧也酌别之夕独五人在焉谢子与能犹在予馆而四人者且去矣遂各以其姓赋诗送之 李大鼎
94337,读退之李花诗
883057,李允蹈以诗见诒走笔和之李号能诗诸贵人客也
948820,正月三日胡季亨及伯信仲威叔贤昆仲欧阳宅之李达可同自永和来雨中小集叠岫阁用金鼎玉舟劝酒下视梅林戏举说命五说戏祝六君蒙次前韵赋佳篇各徵旧事各以一篇为谢 答胡伯信
546689,潞河留别王行父袁微之李本建徐象先四绝句 其三
546690,潞河留别王行父袁微之李本建徐象先四绝句 其四
204806,李月野舍旁之李花於梅时郡斋有诗遂次其韵
546688,潞河留别王行父袁微之李本建徐象先四绝句 其二
915406,招陈益之李兼济二主管小酌益之指蚕豆云未有赋者戏作七言盖豌豆也吴人谓之蚕豆
1218933,简江西宋子与令尹杨翼之李斯立二先生
103475,次韵和表臣惠符离去岁重酝酒时与杜挺之李宣
178362,题赵表之李伯时画捉马图诗
95066,招陈益之李兼济二主管小酌益之指蚕豆云
968151,李月野舍旁之李花于梅时郡斋有诗遂次其韵 其一
901864,题赵表之李伯时画捉马图诗二首 其二
1062931,暇日过西曹谒何安中得之李倞冲季咸许出近诗而未也戏以诗索
968152,李月野舍旁之李花于梅时郡斋有诗遂次其韵 其二
1123248,李月野舍旁之李花于梅时郡斋有诗遂次其韵
948817,正月三日胡季亨及伯信仲威叔贤昆仲欧阳宅之李达可同自永和来雨中小集叠岫阁用金鼎玉舟劝酒下视梅林戏举说命五说戏祝六君蒙次前韵赋佳篇各徵旧事各以一篇为谢 答李达可
422762,好事近 过桂林，达云邀游相思江畔之李家村，宿军校，明日为学员讲话后留题山壁
901865,题赵表之李伯时画捉马图诗二首 其一
