900368,与弟侄饮梅花下分韵得香字
1083140,饮梅花下赠客
626514,韩玉灵夜过小饮梅下得花字
371995,涧东临水饮梅花尚未全放一树独佳
768382,点绛唇 饮梅树下
367196,良臣聚饮梅仙庄和多字韵
888039,数年前有小词微雨后落花天娇态病恹恹怕人猜著是相思镇日不开帘宝钗横蝉鬓乱院宇待人归尽缓移莲步玉阑前纤手掐花钿兹月夜与客饮梅花下一姝歌前词复出笺徵余新作
1082935,良臣聚饮梅仙庄和多字韵
479869,月夜与何子有饮梅村社赠之 其二
186733,与弟侄饮梅花下分韵得香字
1026631,同景仁况之诸君游南园饮梅花下
930586,小饮梅花下作
52378,月夜与何子有饮梅村社
166635,与何西仲秉烛饮梅下
1081402,独乐园夜饮梅花下再赋
305315,幼伟招陪樊山泊园二老小饮梅郎在座越日樊山两示近作奉答
1081421,乙巳二月初八日集独乐园夜饮梅花下会者宋退翁胡明仲马世甫张与之王子与林秀才及余凡七人以炯如流水涵青蘋为韵赋诗分得流字
906224,与何西仲秉烛饮梅下
1212763,饮梅花下
1093902,涧东临水饮梅花尚未全放一树独佳
908287,从冯黎州饮梅林以山谷旧时爱酒陶彭泽今日梅花树下僧分韵赋诗得时字
884908,鹊桥仙 其五 康州同子权兄弟饮梅花下
694523,月夜与何子有饮梅村社赠之
479868,月夜与何子有饮梅村社赠之 其一
429544,幼伟招陪樊山泊园二老小饮梅郎在座越日樊山两示近作奉答一首
541233,王宪副招饮梅庵
179892,从冯黎州饮梅林以山谷旧时爱酒陶彭泽今日梅
160460,同景仁况之诸君游南再饮梅花下
444119,己丑暮春与诸子夜饮梅湖分韵得“上”字
77585,小饮梅花下作
156173,山居·雀饮梅凡雪
711979,月夜同湛用喈过泉长纵饮梅花下
779104,菩萨蛮 夜饮梅花阁，用前韵却赠主人
