1035044,尝为赵太社作章泉二字及匹纸写诗二十二首赵一再有诗因次韵 其二
139960,尝为赵太社作章泉二字及匹纸写诗
1132295,尝为赵太社作章泉二字及匹纸写诗二十二首赵一再有诗因次韵
655857,程庸以种湖所书拙字及鄙句见示怅然有作
1034791,尝为赵太社作章泉二字及匹纸写诗二十二首赵一再有诗因次韵 其一
944875,七月望郡庠赋秋声诗且欲不犯题字及见所作良可发笑因赋二首示诸儿 其一
871340,潘紫岩与余赋雪约不得用色数并实字及比喻
130603,七月望郡庠赋秋声诗且欲不犯题字及见所作良
586788,赠少参王本一本一以公谴谪戍吾璚上谒军门予适守苍梧道过与语甚悦且闻其善书因求写梧山书院四字及敬义字皆有矩矱临别谓予宜有赠什予归急草古风一章未及脱稿而舟已发矣人便因附寄申意
944876,七月望郡庠赋秋声诗且欲不犯题字及见所作良可发笑因赋二首示诸儿 其二
1179274,闻严秘书与正字及诸客夜会因寄
136559,潘紫岩与余赋雪约不得用色数并实字及比喻
13353,闻严秘书与正字及诸客夜会因寄
1119913,七月望郡庠赋秋声诗且欲不犯题字及见所作良可发笑因赋二首示诸儿
