661362,烈风七章悯吴孝子廷用 其二
514965,幼幼堂歌为越中朱廷用先生赋
560680,题严廷用扇
661361,烈风七章悯吴孝子廷用 其一
560439,画松为金廷用赋
678832,送王廷用司训桐庐
555261,题孟浩然寻梅图二首次同年三山王廷用韵 其二
637636,交城分司与孙廷用酌别口号
513938,送义门镇巡检李廷用
555260,题孟浩然寻梅图二首次同年三山王廷用韵 其一
637975,挥使安廷用访榄山留宿兼惠纸并猪榧子
60914,赠笔生施廷用
675895,泛湖值雨简费廷用
1227104,送王廷用
656803,送马侍郎廷用考绩
695307,癸亥冬至以次该陪祭陵因病不果承学录昌平李廷用先生慨然见代因赋二律奉赠
486241,赠笔生施廷用
701305,题孟浩然寻梅图二首次同年三山王廷用韵
675887,次韵廷用初夏写怀
661367,烈风七章悯吴孝子廷用 其七
661365,烈风七章悯吴孝子廷用 其五
521453,沈廷用以尺籍事来京却归赋别
638967,癸亥冬至以次该陪祭陵因病不果承学录昌平李廷用先生慨然见代因赋二律奉赠 其一
661363,烈风七章悯吴孝子廷用 其三
649104,吴廷用侍郎挽诗
686349,烈风七章悯吴孝子廷用
560447,题高廷用扇
675871,寄费廷用
509102,送锦衣焦公子廷用还京师
659335,荣使寿亲图为郭廷用作
661364,烈风七章悯吴孝子廷用 其四
638968,癸亥冬至以次该陪祭陵因病不果承学录昌平李廷用先生慨然见代因赋二律奉赠 其二
661366,烈风七章悯吴孝子廷用 其六
480224,风雨种竹（以下次陈锦衣廷用韵）
1216386,游吴廷用南庄
680702,赠睢阳刘君廷用
557997,杨子江送焦廷用还京
660502,湘水飞云为徐廷用主事赋
