1245940,梁甫吟 送郑希道入京
924435,吕希道少卿松局图
213212,喜迁莺·同丁基仲过希道家看牡丹
527187,谢盛希道先生枉顾
201533,奉和希道新句兼简祖颖漕使
201477,希道使君见遗古风谨次严韵
895286,祖颖漕使希道使君以绝句相酬答聊成二章解嘲并发一笑 其一
201476,希道使君弭节合沙馆奉太夫人游鼓山乃蒙封示
1002705,延庆寺会景纯正仲希道介夫明叟纳凉同观建邺宫中画象翰林墨迹延庆寺者刘裕故宅中有寿丘山
201475,希道使君入山再有佳句见及复次元韵因简老禅
965029,次希道弟韵寄竹院孚上人
920351,送吕希道知和州
102232,送吕希道知和州
149447,次韵和德麟过希道作
924147,送吕希道少卿知滁州
209870,呈希道兼寄不伐
887562,花犯 其二 郭希道送水仙索赋
1111640,呈希道兼寄不伐
895477,希道使君见遗古风谨次严韵
201431,祖颖漕使希道使君以绝句相酬答聊成二章解嘲
1112412,祖颖漕使希道使君以绝句相酬答聊成二章解嘲并发一笑
895480,奉和希道新句兼简祖颖漕使
1045751,送刘希道龙图赴秦亭
888388,呈希道兼寄不伐 其二
895285,祖颖漕使希道使君以绝句相酬答聊成二章解嘲并发一笑 其二
948769,送韩希道移漕江东
895389,希道使君弭节合沙馆奉太夫人游鼓山乃蒙封示所和梦锡赠行佳句辄次严韵少叙别怀
980217,次韵和德麟过希道作
213359,花犯·郭希道送水仙索赋
887540,声声慢 其三 陪幕中饯孙无怀于郭希道池亭，闰重九前一日
117840,吕希道少卿松局图
888389,呈希道兼寄不伐 其一
693697,与盛希道太史谈玄二首
117482,送吕希道少卿知滁州
329576,次韵刘希道龙图鹿鸣燕进士
993735,送孟希道
1215283,送僧希道迎母之宣州
199113,延庆寺会景纯正仲希道介夫明叟纳凉同观建邺
1246077,送郑希道行省掾满之泉州录事
219169,送孟希道·异县交游少
1045902,次韵刘希道龙图鹿鸣燕进士
568350,与盛希道太史谈玄二首 其二
1223662,送汪希道入都
1242544,送程希道回河南
152139,送韩希道移漕江东
176683,次希道弟韵寄竹院孚上人
568349,与盛希道太史谈玄二首 其一
895388,希道使君入山再有佳句见及复次元韵因简老禅
586606,古意寄盛希道翰林
