483472,近日月岩处有大石如蒸饼状无突陷可顿足然凿石上为小坎托足端恃锁降登众疑经始时不知何法先登以制坎锁
652345,酬方于鲁以制墨见寄
1036118,醉翁操 琅琊幽谷，山川奇丽，泉鸣空涧，若中音会。醉翁喜之，把酒临听，辄欣然忘归。既去十馀年，而好奇之士沈遵闻之。往游，以琴写其声，曰醉翁操，节奏疏宕，而音指华畅，知琴者以为绝伦。然有其声而无其辞。翁虽为作歌，而与琴声不合。又依楚词作醉翁引，好事者亦倚其辞以制曲。虽粗合韵度，而琴声为词所绳约，非天成也。后三十馀年，翁既捐馆舍，遵亦没久矣。有庐山玉涧道人崔闲，特妙于琴。恨此曲之无词，乃谱其声，而请东坡
570365,徐长孺及郁子以制科业见访有答 其一
570366,徐长孺及郁子以制科业见访有答 其二
662127,新安县即函谷关也其地阨塞秦东面以制诸侯故于此设镇
842728,白蜡处处产锡山石皆作玉色西人锯磨以制器布地
983926,遇张玉叔荆漕自潼州易节来言蜀人两载前以制帅相期矣
55771,酬方于鲁以制墨见寄
307400,白蜡处处产锡山石皆作玉色西人锯磨以制器布地
604699,重过七星岩祝明府招同南海王明府岩集时余以制帅戴公出访后至遂成长夜之饮赋谢
140093,次韵荆门张守寺簿见寄诗韵张守以制司调民筑
683812,徐长孺及郁子以制科业见访有答
1148995,为乐天自勘诗集因思顷年城南醉归马上递唱艳曲十馀里不绝长庆初俱以制诰侍宿南郊斋宫夜后偶吟数十篇两掖诸公洎翰林学士三十馀人惊起就听逮至卒吏莫不众观群公直至侍从行礼之时不复聚寐予与乐天吟哦竟亦不绝因书于乐天卷后越中冬夜风雨不觉将晓诸门互启关锁即事成篇
925818,沁园春 其二 寿赵茂嘉郎中，时以制置兼济食振济里中，除直秘阁
179073,遇张玉叔荆漕自潼州易节来言蜀人两载前以制
