653268,四月二日西湖再汛四首 其二
667141,六月二十三日纲庵携酌于元大竹林避暑以敬修韵赠纲庵
121481,九月二十四日
1141584,东阳方韶卿惠古意七篇久不得和五月二十六日将假馆宗阳桥稍有閒暇乃为次韵因寄讯彼中吴子善前辈 其七
1109537,二月二日过吴德仁二首
439008,八月二十三日夜走西山
934961,八月二十三夜梦中作
460377,木兰花　六月二十八夜病目不能事，漫写云溪十二月风情词遣之 其五
369828,四月二日·间或僧人到
1247680,八月二十三日溯大江遇风雨作
605778,正月二十日里中皆以桃枝插门贵贱童稚亦皆以桃叶为佩曰禁鬼也西园公鼓掌人与鬼何辩鬼不害人禁之何为夫害人者人而鬼耳庸可禁耶时街头有青衣桃叶者歌莫禁鬼鬼闻而大笑之亦歌先禁人以答之西园公闻而并录焉莫禁鬼四章 其四
212867,腊月二十九日陈万石石室吕潜心三兄相访夜坐
929461,癸丑七月二十七夜梦游华岳庙二首 其二
186544,二月二十日野步城南晚与吴伯承诸友饮裴台分
955576,十月二十六日三偈 其二
886352,腊月二十八日与知宗提举分岁郡中啜茶于北楼赏梅于忠献堂知宗即席有诗次韵并简提舶
31268,丙寅二月二十二日抚州如归馆雨中有怀诸朝客
23877,二月二日·二月二日江上行
23877,二月二日·二月二日江上行
778439,西江月  二男阿环日者家云长当学武三男阿端以五月五日生忽屈睟盘口号志喜
277418,十月二十四日过西湖
460381,木兰花　六月二十八夜病目不能事，漫写云溪十二月风情词遣之 其九
1071024,丁巳十二月二十六日过吾村早饭宿后溪三首 其三
771594,九月二十五日去苏州
747892,九月二十日潘德舆招饮海山仙馆即事有作 其一
460545,南歌子　四月二十二醉作
306152,十二月二十五日
622093,五月二日王子龙招看赛龙舟得流字
1115877,渔家傲 其二 十月二日老妻生辰
582068,乙丑七月二十有五日北楼观兵有作
379141,八月二十三日蔡元中生辰
528415,九月二十六日同贾广文刘举人任贡士高夔府先生宅内赏菊四首 其二
1064505,八月二十三日蔡元中生辰
1094408,正月二十八日二首 其一
237369,十月二十日感旧
460375,木兰花　六月二十八夜病目不能事，漫写云溪十二月风情词遣之 其三
686662,八月二十日游千佛寺二首
759663,己亥五月二日东山大忠祠祝文信国公生日 其三
1117774,甲子岁十月二十四日夜半梦遇故人于山水间饮酒赋诗既觉仅能记一二乃追补之二首
281666,忆璧·十月二十一日寄璧妹
325736,浪淘沙·凉月二分残
652638,腊月二十七日次江口
1099837,三文祠堂七月二日礼成作 其三
14286,和崔舍人咏月二十韵
577976,七月十五夜对保安对月二首 其一
839398,正月二十二日赴馆后有作
372625,壬子十一月二十九日时雪方洽
199889,予己未十月二十有二日去涪上越明年八月二十
199889,予己未十月二十有二日去涪上越明年八月二十
921110,十月二十日，恭闻太皇太后升遐，以轼罪人，不许成服，欲哭则不敢，欲泣则不可，故作挽词二章 其二
1075344,十二月二十九日雪中煮茗
698413,十一月二十日夜陪我公校阅所抄唐人绝句诗因拟作五首奉献
492501,二月二十九日三更渡海之琼府
297638,己酉十一月二十七日地震
787650,三月二十六日与共甫偕吴门吴憩堂游云栖，翌晨步江干转至虎跑寺，由湖上棹归 其三
504378,八月二十五夜陈世恭邀赏桂花
234345,二月二日东屯感怀
905200,癸丑季春上洲颓岸出败冢冢中有砖云元嘉二十二年七月二十六日余功曹冢后世子孙长兴富贵宜赊因题数句
1200607,拜新月二章 其二
1071089,十月二十二日纵步至教谕谢君所居爱其幽胜而庭植道源诸友见寻烹茗奕棋小酌而归因成二绝句 其二
870414,三月二十八日书怀
844115,葭月二十六日喜晤石庄，兼话大甲官军捷信
1030310,醉落魄/一斛珠 其一 正月二十日张园赏海赏作
726877,关山月二首 其一
836941,待月二首（集句） 其二
1099835,三文祠堂七月二日礼成作 其一
896187,二月二日挑菜节大雨不能出
288868,壬辰秋七月二十八日，奉太夫人命读书省城，居张竹轩外舅广文署中偶作
203199,七月二十四日射弓
1133857,记正月二十五日西湖之游十五首 其十
912187,正月二十八日峡外见燕子二首 其一
105699,正月二十七日江邻几杜挺之刘原甫贡甫韩持国
704866,中秋看月二首
132316,次韵和胡仲方正月二十五日雪
1093969,二月二日赠杜晦之
963844,六月二十八日入朱陀山寺
107708,至节后一日十月二十九日
800751,宋建中靖国辛巳七月二十八日为东波先生骑箕之辰先生乞居常州，卒于孙氏寓馆，其地去余家不数十武，旧迹犹存，岁值辛巳，去先生六百年矣，感今追昔，邀同学诸子于是日肇祀先生，用眉山二字成诗二章，致敬恭思慕之意云 其二
681380,腊月二日舜咨席各赋
930367,丁巳正月二日鸡初鸣梦至一山寺名凤山其尤胜处曰咮轩予为赋诗既觉不遗一字
1064897,三月二十三日心禅饷余新面白蜜作二首 其二
817638,十二月二十九日，与栽甫登江亭，忆去年此日为后山逝日，设祭法源寺。与会者惟贞壮南归，今此事亦不再矣。因为诗寄之
308698,壶中天·己亥腊月二十五日，雪中忆西泠梅花
330960,丁巳十二月二十六日过吾村早饭宿后溪
698498,乙未春正月二十三日早恭遇上御皇极门觐天下来朝诸侯时有岛夷乞封阙下二首
531884,对月二首 其一
253184,三月二十七日夜造卢夫子鸿基教授苦瓜棚居小酌剧谈感其生平即席吟呈
922898,三月二日奉诏赴西园曲宴席上赋呈致政开府太师三首 其二
370378,六月二日晨起
207402,腊月·腊月二十五
140164,四月二十日领客寻龙井前盟以雨阴晴未定不果
923687,十月二十九日雪四首 其四
1102576,甲戌游旴江六月二十二日发武林
825368,八月二十六日游万泉河
769648,贺新郎·除月二十二日，乔文梁、洛闻将别余渡江，余亦由陆路之东亭，前一夕赠别
252455,八月二十三日夜走西山
1111819,四月二十一日同妻孥泛舟登吕氏济川亭二首
922393,六月二十日夜渡海
824888,十一月二十二日出京道中杂诗 其十三
611364,独酌问月二首 其二
901882,魏塘荒僻春来无杂花一枝可慰逐客二月二十六日见篱外桃花盛开如烁红霞因为绝句一首
334321,二月二日行药城下
460432,苏幕遮　六月二十夜
414824,七五年十月二十九日访戊申翁于燕园，招以肴酒，示以珍藏，又同游圆明园遗址，尽一日之欢，归赋五古纪实
328069,庚子七月二十五日出塞偶作
899395,三月二日紫牡丹
726878,关山月二首 其二
237708,腊月二十八日与知宗提举分岁郡中啜茶于北楼
825360,六月二十一日夜起
561987,六月二日至临淮夜宿方丈敏东轩
555964,丙午年首夏患足疾六月淫雨大作狱屋中水深二尺许囚板漂没六七日始退重此湿感不能步履今一载矣殊觉衰惫恐倏殒灭为十招魂以自慰卧起慷慨援笔立就词固不能尽工也丁未年四月二十五日作 其七
505638,十一月二十日夜陪我公校阅所抄唐人绝句诗因拟作五首奉献 其三
55920,甲戌三月二日出行
890778,生查子 其一 己未八月二日四明窗和韵
479210,四月二十八日起屡赐鲜笋青梅鲥鱼枇杷杨梅雪梨鲜藕
464376,西江月二阕·春寒不出，持续整订医稿 其二
572301,九月二日盛集诸公郊游至二圣寺仍用散木韵 其三
674270,九月二十四日遇万寿节遥贺用前韵
521788,过东昌访前贰守郝公适公生辰赋此为寿郝在松职专治水守廉奉公今不易得也四月二十一日
1046917,六月二十日湖上四绝句 其二
379137,三月二十八日枣柏大士生辰
1036925,丙寅九月二十日同蒋颖叔从长干雨中登高座寺诗
290824,十一月二十五日雪
283297,菩萨蛮·戊申三月二日观瑶华为周髯写兰，因题
577978,中秋夜保安对月二首 其一
719879,后秋兴八首壬寅三月二十三日以后，大临无时，啜泣而作 其三
163265,丙寅九月二十八日作来年将告老
460410,人月圆　十月二十九
173318,九月二十日游桃源寺
1064502,十世观音生辰六月二十六日二首 其一
727116,和吴主簿诗六首 春月二首
1112282,群玉殿十二月二十三日锡宴
947799,庚辛二月二十二日宿斋省中
553415,惜日短岁十二月二日同诸友访环中老鲍恂于西溪隐居蒙留款谈论欢洽岂无一言以记之遂命题云各赋一首嗟夫在心为志发言为诗观其所作盖可见矣
379991,菩萨蛮·三月二日偕华荔生晋竹湖上晚归
1006435,八月二十日与馆中同舍游西湖作 其四
178791,五月二十四日宿永睦将口香积院僧轩东望甚远
689186,九月二十六日同贾广文刘举人任贡士高夔府先生宅内赏菊四首
294793,三月二日吴门道中
998871,三月二十六日工部宿直
832008,九月二十六日小妾举一男，坠地即绝。余年三十有六，尚无子嗣，怆然有感 其二
460543,鹧鸪天　三月二十六
460257,鹧鸪天　二月二十六对雨三首 其二
729157,五月二十八日书诗人壁
460383,木兰花　六月二十八夜病目不能事，漫写云溪十二月风情词遣之 其十一
422983,十年三月二十九日，黄花岗七十二烈士墓下作
406937,十一月二十六夜寒起楼宴集，赋谢兼与
729158,五月二十八日书诗人壁
862515,九月二十日游桃源寺
719877,后秋兴八首壬寅三月二十三日以后，大临无时，啜泣而作 其一
1134541,六月二十二日守陴百姓始下城
178790,五月二十四日自达州至永睦县投宿废学即事书
458901,十月二十四午瞢坐复得十二章 其九
460256,鹧鸪天　二月二十六对雨三首 其一
934939,二月二十四日作
77893,记戊午十一月二十四夜梦
916650,渔家傲 其三 十月二日老妻生辰
197458,壬辰三月二十一日读李翰林墓铭云以任侠为事
330867,十月二十二日纵步至教谕谢君所居爱其幽胜而庭植道源诸友见寻烹茗奕棋小酌而归因成二绝句
460268,浣溪沙　二月二十四雪次日消 其五
948734,胡涣季享示寿诗二首十月二十五日因其生日次韵答之 其一
186465,六月二十六日秀青亭初成与客同集
422907,辛亥三月二十九日广州之役，余在北京狱中，偶闻狱卒道一二，未能详也，诗以寄感 其二
459759,八月二十九病起秋来，聊为赋此五首 其五
1094457,六月二日大雨如注山涧水溢 其三
553204,洪武癸亥九月二日与府学赖先生登宋相王钦若墓既归作长短歌一首以示
825422,十二月二十五日鉴泉示生日诗
605006,乙丑春二月二十有四日邑侯裒谷孙公有事罗浮同社诸君子偕集江上小堂举酒相贺夫劝课农桑巡行阡陌辟草莱以正疆界蒐伏慝而饬干掫此循良实政开邑以来二百五十馀年所未有也遂相与绘图授简侈为诗歌以副野史公复取道于先司徒东皋别业驻辔于先仲第□子二石山房盖有谋野则获之思焉萱乃携子及孙炊脱粟酾茅柴以窥马足公辄欣然班荆移阴而别时余以目眚不能从公于迈为四百三十二君归石候命第以一日之长狎主齐盟敢不悉索敝赋窃附中和乐职之谊遂鼓腹
495647,齐天乐 寿吕太守正月二十四日也
1122045,十二月二日腊祭前一日致斋惠照呈清叟察院三绝
591108,修白云书院闰五月二十九飓风越日乃霁
897429,十月二十二日晚作三首 其一
226272,三月二十九日还家花事已过独碧桃盛开
673003,甲戌下第三月二十四日出张家湾
1027879,腊月二十五日大人生朝
605777,正月二十日里中皆以桃枝插门贵贱童稚亦皆以桃叶为佩曰禁鬼也西园公鼓掌人与鬼何辩鬼不害人禁之何为夫害人者人而鬼耳庸可禁耶时街头有青衣桃叶者歌莫禁鬼鬼闻而大笑之亦歌先禁人以答之西园公闻而并录焉莫禁鬼四章 其三
842001,十一月二十一日雪后华墅归途作再叠前韵二首 其一
874570,二月二十日再锁宿四绝 其三
874571,二月二十日再锁宿四绝 其一
57560,十二月二十七日作
387044,腊月二十五日食竹笋菜薹因以记之
868912,临江仙 其十一 正月二十四日晚至湖上
820348,八声甘州 己酉正月二十九梦得句「闲杀流莺外，雨榭风楼」是日为亡妇道清忌日日月如流忽忽十年矣倚甘州一阕
450404,鹧鸪天三十首 其九 新月二
824889,十一月二十二日出京道中杂诗 其十四
315496,腊月二十四夜口号
642825,三月二日陛辞钦蒙赐赉
682197,九月十三夜扈从功德寺陪李渐庵大司寇王忠铭徐检庵二学士登金山对月二首
93628,十一月二十八日雪至十二月十一日日色方暖
1046682,二月二日过吴德仁二首 其二
1172719,八月十五夜月二首 其一
653815,正月二日朱孟瑜宅赏灯是日有雪
934968,十二月二十六夜听雨
107743,乙未十二月二十四日立丙申春予忝七十
423571,菩萨蛮·壬寅三月二十九日
156225,辛卯正月二日蝶轩蚤作
956331,十二月二十四日西楼观雪
666855,正月二十五日修敬吟社宴集次韵
102869,戊子三月二十一日殇小女称
494496,四月二十三日省农上方门，遵河而南，止于夹冈门同人馆，示诸生二首 其二
460550,蝶恋花　七月二十七再至其地不遇其人，因书二十五日赠叶事
1124197,八月二十四日同审知登塔山用审知前载九日留题之韵作二首时彦博归及常山
572304,九月二日盛集诸公郊游至二圣寺仍用散木韵 其六
637624,六月二十七日邀叔厚伯诚可大文哲四内翰时雍司厅元善道鸣德章三地官小酌适阴雨客有难意遂成口号速之
554277,九月二十六日拜谒长陵
950714,六月二十一日内引赐对缉熙殿玉音宣问漏下数刻将退赐金币香茗有差既而御笔除长地官将旨八路复赐一札兼镇姑孰敬纪感遇以昭恩荣四首 其四
1113434,淳熙巳酉二月二日皇帝登宝位镃获厕廷绅辄成驩喜口号十首
408324,伤楠儿四首 其二 楠儿以廿六年八月二十八日晨七时殁于无锡
1228680,正月二日
930475,三月二十五夜达旦不能寐二首 其二
1134544,六月二十日雨
1064503,十世观音生辰六月二十六日二首 其二
412697,七月二十六日抵金陵坐雨
702542,己酉六月二日初至南山
1066995,凤凰山泉石胜绝去城无几里而前此未有知者偶因休吏与文中良器二士访寻得瑰奇卓绝之观于荆棘草莽间相顾大笑因崇基趾筑亭榭疏泉甃池为登临啸咏之地九月二十五日游陟归夜作小诗十首 其九
338107,九月二日病赴睦州
366852,二月二日·江乡春值闰
1108824,三月二日被命祈晴上天竺舟中得六绝句
972798,闰月二十日离玉山八月到馀干易舟又二日抵鄱阳城追集途中所作得诗十有二首 其十一
868931,点绛唇 其三 丙辰八月二十七日雨中与何彦亨小饮
956816,九月二十八日湖上检校篱落
1042381,十二月二日
911628,七月二十七日午到钓滩登其台偶成二绝 其二
302301,六月二十八夜雨中感事
1129977,湖上望月二首
956323,七月二日上沙夜泛
1171624,中秋维舟君山看月二首 其一
555966,丙午年首夏患足疾六月淫雨大作狱屋中水深二尺许囚板漂没六七日始退重此湿感不能步履今一载矣殊觉衰惫恐倏殒灭为十招魂以自慰卧起慷慨援笔立就词固不能尽工也丁未年四月二十五日作 其九
76731,甲子岁十月二十四日夜半梦遇故人於山水间饮
863019,乙酉闰八月二十一日出南城游岘山壁间读东坡诗感而有作
835141,琵琶仙 乙未十一月二十日观伶人演长生殿弹词
780097,贺新凉 二月二日，宣岳州捷是日大雪和其年
158909,二月二十六日偶书
1066991,凤凰山泉石胜绝去城无几里而前此未有知者偶因休吏与文中良器二士访寻得瑰奇卓绝之观于荆棘草莽间相顾大笑因崇基趾筑亭榭疏泉甃池为登临啸咏之地九月二十五日游陟归夜作小诗十首 其五
404882,金缕曲·甲午十月二十四日予与苕君结缡三十年矣。欧俗谓之珠婚，法当以珠玑为寿。乃置酒携儿孙为苕君称觞，兼以自庆
688164,二月二十二日与杨应宁宪副宋惟寅宪佥强景明伴读城东泛舟联句
369865,六月二日大雨如注山涧水溢
276926,三月二十三日集永定门外十里庄范文正顾亭林祠
571102,二月二日余至南冈乾鹊遂定巢小杉佃者云渠自壬申读书巢后比今复来因纪此诗
1005504,辛卯正月二日蝶轩蚤作
158046,长安二月二十二日雪十韵
460513,踏莎行　十二月二日 其一
974093,闰七月二十日侍知府寺簿先生为石鼓山向园之游
788588,庚子七月二十五日出塞偶作
349046,三月二十日游东山参议不至有诗次韵
8794,江边星月二首其一
80512,秋旱方甚七月二十八夜忽雨喜而有作
792123,避兵自正月十三至六月二十三日抵家粪除感赋
824890,十一月二十二日出京道中杂诗 其十五
1098938,十月二十四夜雪霰用苏文忠和赵虢令韵
794913,柳梢青 七月二十四乃贺稚宜表妹生日，书此寄之。
779095,巫山一段云 四月二十日
1094113,九月二十五日仲至携酒与客相过因为作生日次韵春时所赠
625519,十二月二十四日与家人环列灶下烟饥不出祭之以诗因嗟天之下遂无一人自视真老妇矣 其二
123387,祭灶词·古傅腊月二十四
1233604,至大庚戌正月二十一日予与儒公禅师谒松瀑真人于龙翔上方翰林邓先生适至予为赋诗四韵诸老皆属和焉后三十一年是为至元辛已正月二十三日过伯雨尊师之贞居无外式公刘君衍卿不期而集辄追用前韵以纪一时之高会云
1233604,至大庚戌正月二十一日予与儒公禅师谒松瀑真人于龙翔上方翰林邓先生适至予为赋诗四韵诸老皆属和焉后三十一年是为至元辛已正月二十三日过伯雨尊师之贞居无外式公刘君衍卿不期而集辄追用前韵以纪一时之高会云
117257,四月二十日书·久将醉眼视群儿
645978,六月二十三日晚宴仙岩有赋
1001471,七月二十五日为广州蒲涧节巩帅相招坐上默营两诗 其二
630650,秋月二首 其一
457911,九月二十六日加班至晚八点，坐憩抽烟，心中随作。移时同事呼饮店中，归而记之
842831,四月二十夜试院赋呈李荫墀唐春卿二尚书
493348,二月二十日述怀
888630,四月二十一日同妻孥泛舟登吕氏济川亭二首 其二
505423,八月二十四日遇国公入奏得星字
783332,癸亥五月二十后酷热异常死者万计六月五日恭遇皇上省躬求言是夜北风大作继以膏雨沴戾顿除仰见圣主至诚格天捷于影响赋此纪异且私幸其安全也
1065191,三月二十八日枣柏大士生辰用达本情忘知心体合为韵作八偈供之时在建康狱中 其六
966926,三月二十日游南台
108648,二月二日晓梦会于庐陵西斋作寄陈适用
81747,十二月二十六夜听雨
929460,癸丑七月二十七夜梦游华岳庙二首 其一
118272,四月二十八日新热寄仇池
1025925,八月二十五日过南豅 其一
666778,中秋看月二首 其二
153553,十月二十八夜至此怅然继和
872794,七月二十日过王村几到岸遇和中袭明舟回相拉宿于陈氏庵中蚊甚盛达旦不能寝
906614,中秋不见月二首 其二
382368,六月二十晨雨大降
812432,三月二十六日与共甫偕吴门吴憩堂游云栖，翌晨步江干转至虎跑寺，由湖上棹归
843698,贺长沙杨庆荃广文腊月二十八日五十初度
922057,三月二十日开园三首 其二
772265,二月二十四日游登栖云岩、观音山诸胜
1084499,十月二十八日母氏劬劳之日也哀痛中书二十八字
1220330,六月二十日奉迎皇太子宝章龚左司赋诗遂次其韵
1036081,浣溪沙 十二月二日雨后微雪，太守徐君猷携酒见过，坐上作浣溪沙三首。明日酒醒，雪大作，又作二首 其一
169253,正月二十八日夜大雪
827588,七月二十五日子正生子萍
759661,己亥五月二日东山大忠祠祝文信国公生日 其一
1252833,闰七月二十三夜记梦诗二首
295744,三月二十七日作
466421,鹧鸪天　二月二十六对雨三首
911183,赋黄香梅绝句八首正月二十三作时筑楼居将就 其二
514111,闰八月二十七日早送何侍御至阳山寺
817802,五月二日雨中感怀 其四
590505,巽子婿王适四旬踰一　辞 贺老夫欲往石马庄，谩书一律，于使者归之。九月二十五日
55899,六月二十三日晚宴仙岩有赋
458743,五月二十四夜读阮籍诗三首 其一
304379,二月二日·彩殿崇隆曙色侵
840563,四月二十八日为翁文恭师生日孙师郑召集陶然亭结瓶社徵诗
327309,十一月二十六日宿萍乡西三十馀里黄花渡口客舍稍明洁有宋亨伯题诗亦颇不俗因录而和之
134296,正月二十四日夜雪
1128312,己丑正月二十四日避地盐楹入省坑存思庵和旧韵
288405,雨淋铃·八月二十三日即事，索无隅师同赋
1135890,四月二十七日梅雨甚骤
941788,贺新郎 其二 又有实告以九月二十七日者，因和叶少蕴缕字韵并寄
459607,七月二十夜临湘不寐观星作
1238054,济川阻雪九月二十七日客况四首 其三
1070919,郡学落成之初八月二十二日陪郡守同来仍榜郡学二字遒劲结密观者兴叹是日燕郡僚并学职郡守谓予本起诸生俾预燕集因成鄙句呈逢时坐客
697262,中秋同允兆诸子集赵相国第玩月二首
1075364,正月二十九日种柳三十五株
559140,丁未十二月二十三为立春后二日夜梦得六言律诗前俱忘只记结句话到疏英影动一枝明月归来次早足之遂成一律
155925,二月二十八日周提宫叶致政楼司理过访锦园
95196,十二月二十六日
155661,十月二十三日携家游裴园
1126521,戊子三月二十一日殇小女称称三首
460500,蝶恋花　四月二
312372,忆萝月·记正月二十八日
854478,至元廿四年十一月二十日得宣命诣朝可庵有诗不敢当次韵以谢 其二
1130780,正月二十八日二首
1113866,十一月二十八日陈令分寄梅花数枝为赋两绝句
1236776,百丈山中夜坐，闻谨思将还，忆甲寅入南中，正此日也。十二月二十三日六首
811082,八月二十三日先慈八秩忌辰礼佛志感四首
1115746,同子文材翁子直萧巨济中元夜东园望月二首
130167,二月二日即事
961073,沁园春 其三 寿王高安，七月二十八日
1074831,五月二十四日避暑东寺折简邀子容不至
1075944,七月二十日秘阁曝书二首 其一
950724,去岁五月二十八日发雪锦亭以六月旦谒富池而行是夜始望见庐山今岁以此日正在湖渰中念岁月之倏忽惊道途之劳勚回首感叹二首 其一
786019,腊月二十四日诏立皇嗣感赋 其四
466922,西江月二阕·春寒不出，持续整订医稿
1113966,十六夜月二首
1121717,淳熙五年四月二日直宿玉堂怀旧二绝句
1075615,十月二十日晨起见枇杷花
118540,丙戌十月二十三日大雪
827129,蝶恋花  南京解放五日武昌解放。四月二十四日效冯正中体四首 其二
915028,七月二十三日南极老人星歌上叔父十三致政一杯千岁之寿
945511,三月二日醉中快活吟第二笔
458746,五月二十九夜题日记二首 其一
572365,九月二十九日同罗服卿及社中诸兄弟登高二圣寺 其二
240120,除月二十三日夜梦
1115700,初九夜月二首
901622,二月二十四日至魏塘七首 其四
750954,二月二日龙阳道中作
1116418,花月二首
913974,三月二十六殿试进士待罪集英殿门二首 其二
731015,台城路 壬子七月二十夜纪梦
1105458,至元廿四年十一月二十日得宣命诣朝可庵有诗不敢当次韵以谢
654232,念奴娇 三月二十四日孙景章于景瞻邵叔章王瑞之钱文杰邀饮冯彦恭湖亭其地有林泉之胜醉中即景制念奴娇词发诸公一笑
402663,生辰日别家去桂林感赋 一九四一年农历五月二十二日为余二十八岁生辰
50310,八月二日经筵纪事
326824,壬子三月二十七日闻迅雷有感
849545,十月二十日 其二
1122589,己酉岁十一月二十六日避寇至龙潭院十二月十五日作五首
310297,七月二十二日攻克集集，斩首百馀
1111821,六月二十一日早行十六首
245363,六月二十一日大雨数里外旱如故是岁淮浙皆大
984898,和史守八月十四日月二首 其一
610479,宝带桥夜泊玩月二首 其一
998861,二月二日大雪
1110048,癸亥岁正月二首
887297,予与子寔避盗同走崆峒予以其年十一月归侍金川踰月而子实走豫章阅三载子实携婉妹归梅川道经旴予自金川侍亲归会之酒酣作是诗以饯别壬辰十一月二十七日
419757,八声甘州 凤石殁后五周年，今岁五月二十七日正其在世六十生朝也。海上知旧假觉林奠醊，成此抒哀，其遗书捐赠上海文物管理会庋藏，嘉惠来学，因并及焉
1077281,七月二十四日泛舟
850031,秋月二首 其二
1135780,十二月二十日立春系癸巳岁予年已六十七白刘唱和有云共把十千沽一斗相看七十欠三年因此遣兴
303472,西子妆·二月二十三日同社集北湖祠楼感赋
288963,八月二十七日观台北祀孔，有感
125230,闰正月二十五日送客寻春集裴氏园
598023,万历八年岁在庚辰夏四月二十八日晓夜梦五云见于西北光瑩烛天锦绮夺目觉后犹宛然在前诗以纪之
854872,二月二十八日祷雨龙湫
889668,水调歌头 寿徐大参九月二十六
