1207970,三月二十三日，雨中示诸生
1249733,四月二日林自■城归写呈迁居诗四首因以述怀并记时事 其一
155929,二月二日大雪
1058441,元丰六年正月二十九日季壬生徐元立以诗来贺用韵酬之
1074756,二月二十八日雪晴步上西山亭示天用兄弟二首 其二
381580,七月二十九日诣白庙胡同宝斋寿伯茀夫人出见
752734,正月二十六日寄端中丞索和 其二
1064461,二月二十一日奉陪季长游岳麓饭罢登法华台赋此
808869,六月二十晨雨大降
928247,十二月二日夜梦游沈氏园亭二首 其二
828702,乙酉正月二日即事
435893,癸巳四月二十九日出京
118771,闰八月二十五日菊有黄花园中粲然夺目九日不
787754,八月二十二日偕汪苇丈、宾于、衡甫、子兰、西章、少帆诸学博游法华山
701582,草堂踏月二首
915141,四月二日进士唱名万里以省试官待罪殿庐遇林谦之说诗夜归又得林柬因纪其事
68751,闰七月二十三夜记梦诗
612230,镜池待月二首 其二
1028890,闰二月二十九日早离广德大雨日午晚晴又雨宿黄檗坊
1135779,十二月二十八日立春次韵王山长俊甫
1205881,清平乐 寿彬斋四月二十八日
98117,三月二日同明叔过从礼观牡丹
874626,三月二十一日泛舟十绝 其七
958869,三月二十四日自东山到金峨一宿而归偶题壁上安晚居士自觉际航湖入东山道金文意行至此淡晴轻冷风策策有声草树清幽泉石雅洁如在天竺灵隐间深靓过之既暮假榻瀑通夕喧枕始印鲁直梦成风雨诗粥鱼鸣展钵而去因笔一绝
1084891,丁丑二月二十一日集英殿赐第
1036083,浣溪沙 十二月二日雨后微雪，太守徐君猷携酒见过，坐上作浣溪沙三首。明日酒醒，雪大作，又作二首 其三
1035782,淳化五年秋八月二十四日钜鹿魏野江东僧用晦赵郡李识登解城琅琊王衢命联句诗一章凡六十四句请题于是
878941,臈月二十二夜漏下数刻小饮径醉坐小閤睡傍无侍者仆于户限眉鼻伤焉流血被面记以六言九首 其八
678650,二月二日友人王景万园中牡丹初发景万置酒邀余赏之因令作诗以发其不平之鸣为赋七韵
696419,八月二十四日雨雪二首
1171652,初月二首 其二
146170,戊寅腊月二十日空坑败被执于今二周年矣感怀
593716,正月二日伍舍人朱计部谢侍御司考功见过张武库袁民部同集得东字
938943,四月二日往檀林登车遇雨度鹅湖岭渐觉开霁一路晴快野花满山赋二绝 其二
585974,丁巳三月二十五夜梦坐化时四鼓也梦觉归寄罗念山诸同志
1235123,七月十六夜海上看月二首
894578,群玉殿十二月二十三日锡宴 其二
575134,正月二日避客山中遇雪
916651,渔家傲 其一 十月二日老妻生辰
82419,五月二十一日风雨大作
31269,三月二十七日自抚州往南城县舟行见拂水蔷薇因有是作
466159,十月二十八日太平间作，盖为同事家葬事主书记五首
156184,已丑正月二十四日避地盐楹入省坑存思庵和旧
631545,中秋无月二首 其一
1134411,八月二十日赵西湖携酒夜醒二更记事 其一
808177,凄凉犯 庚子十二月二十四日，宿济南敖阳店，寒甚，有怀故园节物，凄然作此解
902729,淳熙巳酉二月二日皇帝登宝位镃获厕廷绅辄成驩喜口号十首 其六
460430,玉楼春　六月二十夜
32833,二月二日宴中贻同年封先辈渭
911852,十二月二十七日大雪中过吉水小盘渡西归三首 其三
1218184,四月二日二首 其二
1135773,八月二十日晓起
772857,十月二日家敬堂总戎邀同安平观水战
664211,四月二日对雨
873619,云岩竹源二禅俱与招客三月二十一日遂饭于竹源庵谋诸野则获也刘奇仲有约不至吴周宝游德华刘致中暨公望刘才仲陈圣叔某会焉从容辩论怀抱甚适因赋诗以纪之
100151,十月二十日恭闻太皇太后升遐以轼罪人
698656,咏十月十五夜月二首
428248,甲戌十一月二十三日以出席苏省一区社会教育研究会将之广陵喜而有作
664148,八月二十日游千佛寺二首 其一
102920,闰正月二日夜张氏纳妇
1131128,甲寅中秋对月二首
676993,丁未梦中游王西轩园作是岁十一月二十日狱吏谭遵令狱卒蔡贤笞楠数百谋以土囊压杀之官觉之免
972793,闰月二十日离玉山八月到馀干易舟又二日抵鄱阳城追集途中所作得诗十有二首 其十二
888611,六月二十一日早行十六首 其七
699639,四月二日再补客司二首
1199356,诗一十七首 其一 七月二十六日夕紫微夫人喻作令与许长史
129930,十二月二十四日雪盖予三年于淮才见此耳时东
459370,七月二暮雨中作七首 其六
458760,六月二十一日黄昏雨，诗止雨亦止
254470,五月二日夜卧读李劼《论晚近历史》至天明
1062963,九月二十六日韩弼夫与十九娘赴官郢州之京山携家出饯于城南郝氏之园席上作小诗送韩儿侄咸和
913962,十二月二十一日迎春
381765,十一月二十七日雪中作
416718,烛影摇红 二月二十二日，送素君柩葬菱溪，舟中望寄园，凄然欲涕
457948,虞美人　十一月二十一日饯别石人，小店饮中作
654918,腊月二日诸同年会饮予家因作图以纪终会云
945505,乙酉正月二十日游慈云三首 其二
1241944,正月二十有六日余与邵青溪张林泉会胡万山夏雪蓑俞山月高彦武张宾旸于佘北踰岭而南访陈孟刚席上分韵得船字
155593,记六月二十日湖上所见
157788,三月二十三日效乐天体
43643,五月二十八日书诗人壁·水晶宫殿玉雕阑
761505,西江月 乙卯七月二十五日梦中哭醒口占
728480,采桑子 正月二十日从吴天石处获读纬云弟京邸春词因和其韵声情拉杂百感风生一夕遂得十首不自知其所云也 其一
186545,二月二十五日登裴台坐上口占
102173,正月二十一日病后述古邀往城外寻春
1133856,记正月二十五日西湖之游十五首 其一
931265,正月二十日晨起弄笔
583470,正德丁丑六月二十九日寅刻天正黑有大星似蓬差大而长五倍之色红照地如昼自东北方起入天天若开裂然见者咸惊口占纪之
874640,三月二十五日饮方校书园十绝 其九
642682,关山月二首 其二
698729,宣德己酉夏四月二十四日早朝应制二首
843561,中秋望月二首
144425,二月二十七游仙洞次壁间韵
878948,臈月二十二夜漏下数刻小饮径醉坐小閤睡傍无侍者仆于户限眉鼻伤焉流血被面记以六言九首 其一
924012,闰八月二十五日菊有黄花园中粲然夺目九日不忧无菊而忧无酒戏作
1006431,八月二十日与馆中同舍游西湖作 其六
1217111,七月二十七日书所见
683550,四月二日即事
978832,三月二十九日舟中作
900287,腊月二十二日渡湘登道乡台夜归得五绝 其四
460376,木兰花　六月二十八夜病目不能事，漫写云溪十二月风情词遣之 其四
337532,二月二十八日雪晴步上西山亭示天用兄弟
1236104,九月二日揭晓仆以朔旦始得閒复成二诗录奉泰甫侍郎思齐御史本中都事道明敏文伯崇有志诸寮友
621894,四月二日再补客司二首 其二
346704,七月二十一日重过赣滩十绝句
305683,九月二十一日作
427012,蝶恋花·七月二十三夜纪梦
830843,师郑举瓶社以四月二十七日为松禅先师作九十生辰招同人集江亭感此奉呈
458747,五月二十九夜题日记二首 其二
1070847,十二月二十五日诗悼傅子骏给事
915323,初食太原生蒲萄时十二月二日
81748,十二月二十七日祭风师归道中作
1247029,二月二十七夜偶尝苦笋与叔固彦章志亨叔侄联句并用述怀
518070,四月二日因公出诣城隍庙行香同高判簿郑长司黄广文及儒士钟子常坐庙门之下观一邑境内之溪山喜而有作 其二
948120,丁酉二月二十日同部中诸公游下竺御园坐枕流亭观放闸桃花数万点随流而下继至集芳亦禁峑也海棠满山郁李绕槛殆不类人间世明日入部而桃花数枝伶俜窗外未时内直则海棠郁李各一株方开遂赋二绝句 其二
639037,二月二日蔡村船中
268316,台城路·壬子七月二十夜纪梦
199208,八月二十九日小饮
1065159,十二月二十六日永明禅师生辰三首 其二
107447,三月二十九日饮杭州路耿同知花园
991893,戊子三月二十一日殇小女称称三首 其二
1146108,登楼望月二首 其一
190508,赋黄香梅绝句八首正月二十三作时筑楼居将就
991761,十一月二十三日欧阳永叔刘原甫范景仁何圣徒见访之什
896916,四月二十日书二首 其一
1053799,十一月二十日德音
313578,贺新凉·五月二十五日记事
700721,五月二十二日㮚死踰旬僮子以其所为诗三卷及杂集回文稿呈览悲悼之馀令之缮写成帙用寄渼陂先生为㮚较定将图入梓漫成二诗以写予怀
1112770,十月二十二日晚作三首
825122,二十夜待月二首 其二
453801,京中初雪己丑正月二十四日凌晨也
99684,十一月二十六日松风亭下梅花盛开
466125,十二月二十七淩晨《女儿曲》二稿成随题其末
830208,庚戊三月二十七日阅报有作
492617,奉和本原教授腊月二十九日过白家桥访彦弟之作
760850,九月二十九日十八叠韵寄伯瑶
719884,后秋兴八首壬寅三月二十三日以后，大临无时，啜泣而作 其八
972790,闰月二十日离玉山八月到馀干易舟又二日抵鄱阳城追集途中所作得诗十有二首 其三
236247,七月二十日过王村几到岸遇和中袭明舟回相拉
638003,二月二日总督府园亭宴赏奉谢朱诚庵都宪
947081,醉春风 三月二十七日出禁谪宁夏安置
459975,暗香　白石韵。五月二日作
894579,群玉殿十二月二十三日锡宴 其一
1236989,二月二日尊经阁望郊外山水二首
342968,正月二日饮茂宗官舍
191598,闰二月二十九日早离广德大雨日午晚晴又雨宿
813342,十月二十日之诏
1119961,乙酉正月二十日游慈云三首
185485,腊月二十九日作
611014,七夕同韩孟郁赋得雨霁吐新月二首 其一
209267,三月二十四日自东山到金峨一宿而归偶题壁上
95722,正月二十二日晚过袁父
1239515,洪武癸丑八月二日与诸暨赵用宾黄汉章赵自立江阴孙大雅大年丘宗岱程传可同游钟山分韵得落字
1065188,三月二十八日枣柏大士生辰用达本情忘知心体合为韵作八偈供之时在建康狱中 其三
878946,臈月二十二夜漏下数刻小饮径醉坐小閤睡傍无侍者仆于户限眉鼻伤焉流血被面记以六言九首 其三
33317,村墅·正月二月村墅闲
153205,三月二十日游南台
888613,六月二十一日早行十六首 其五
904825,临江仙 其四 老母太恭人三月二十一日生，是日仍遇己卯本命，作千岁会祝寿，子孙三十八人
975660,七月二十日被檄考试出门 其二
552833,九月二十七日早祀山川坛风云雷雨师坛随班行礼因过水濂洞而回
1134582,丙戌十一月二十八日南至寓杭
116414,正月二十五日以小疾在告作三绝是日苦寒
704039,二月二十四日舟中观历偶知清明有感二绝
408676,十月二十八日枕上闻飞雪有声移时遂止怅然感赋仿欧阳公禁体用东坡聚星堂韵
433124,六月二日召见仁寿殿恭纪二首
835883,壶中天 其一 己亥腊月二十五日，雪中忆西泠梅花
895070,三月二十四日出城
853330,二月二日即事
843466,台城路 乙酉六月二十四日为荷花生日越八日姚柽甫丈约云阁与余往南河泡看荷花各得词一首时余将出都矣
79855,三月二十七日夜醉中作
458898,十月二十四午瞢坐复得十二章 其六
586884,辛卯十二月二日神乐观祈雪次李少宰蒲汀韵二首 其二 喜雪
89412,五月二十七日游诸洞
1087406,闰月二十一日作落梅花 其一
106357,六月二十日雨
1056374,大观二年戊子三月二十九日请假祀坟和族人升之韵
381722,八月二十八日夜坐时将出都
1208670,正月二十六日监中习仪即景书怀
975108,四月二十八日轮对遇雨
81762,十一月二十二日夜待子聿未归
950921,六月二日乙丑滥溪大雷雨
370869,惜馀春慢·戊戌三月二十二日汎湖用清真韵
825121,二十夜待月二首 其一
900548,严庆胄射策南归迂途相访六月二十有一日同游城南书院论文鼓琴煮茶烹鲜徘徊湖上薄莫乃归明日作别书此为赠
834808,百字令 其一 丙午七月二日菱湖观残荷，臞盦前辈用白石老仙均成此阕。予亦继声，兼忆东华旧游，玉堂天上，不知其词之怨抑也
888615,六月二十一日早行十六首 其三
762641,八月二十三日即事 其二
45680,延安一首五月二十六日赋寄毛主席
528414,九月二十六日同贾广文刘举人任贡士高夔府先生宅内赏菊四首 其一
172552,正月二日雪
1076328,湖亭之胜大似江上但无芦苇二月二十日移植数十本
804266,五月二十三日度天山作
1146361,登楼望月二首
258580,六月二十九日北宫朝回
819066,正月二十一日城西步归作
1120811,正月二十八日雪晴睡起
470930,十月二日亲朋拿舟追饯有同至昆山者时溪父卧病寺中
729907,正月二十五日过白云竹院
878947,臈月二十二夜漏下数刻小饮径醉坐小閤睡傍无侍者仆于户限眉鼻伤焉流血被面记以六言九首 其二
1243913,乙未八月二十二夜梦宿山寺与僧讲道论诗不觉夜分僧赋一联云鹤向白云栖处宿僧从青嶂影边归觉而微改其句足成一律云
874631,三月二十一日泛舟十绝 其二
459239,萤凋殆尽，九月二十九夜肖家浴忽见一丸
418490,扬州慢 十月二十七日南行道中
980126,三月二日大风
1085551,闻诗闻礼不赴秋试以七月二十五日离太学八月二十六日至兴国军喜其来也因作是诗
1085551,闻诗闻礼不赴秋试以七月二十五日离太学八月二十六日至兴国军喜其来也因作是诗
102501,三月二十九日·南岭过云开紫翠
785308,广福门赴旅顺之行期本拟在四月二十四日后迁延至二十八日予以饯行诗书之于扇因以赠之复题一截
991901,正月二十四日同江邻几韩持国过师商庙
891824,中秋夜不见月二首 其二
191585,十一月二十八日用后山诗韵
531885,对月二首 其二
812518,三月二十九日偕徐汉卿、易念堂、刘伯蒪、陈晴陔诸大令，黄庆生副戎，策马出城二十里，游葡萄沟。其地山环水抱，柳暗花明。葡萄尤为其土产，蔓生陇畔，十余里无隙地，同人登农家小楼茶话眺览至足乐也。归而赋之二首
586430,二月二日见山召饮次韵 其一
934974,十月二十六日夜梦行南郑道中既觉恍然揽笔作此诗时且五鼓矣
96786,六月二十二日病中得雨顿觉沈疴去体欣然起饮
790683,八月二十六日挈全眷南归口占
1112705,正月二十五日以小疾在告作三绝是日苦寒
1046681,二月二日过吴德仁二首 其一
901623,二月二十四日至魏塘七首 其三
1001472,七月二十五日为广州蒲涧节巩帅相招坐上默营两诗 其一
493234,五月二十二日晚来南溪诸友过武山避暑
371526,二月二日赠杜晦之
383610,庚午十月二十日
459976,宴山亭　五月二日
19200,十二月二十三日作兼呈晦叔
168376,十一月二十七日步自虎溪至西寺摩挲率更旧碑
972801,闰月二十日离玉山八月到馀干易舟又二日抵鄱阳城追集途中所作得诗十有二首 其六
812402,九月二日病赴睦州
689239,十七夜月二首
493525,余自去冬闰十一月遣人还泰和迎候舍弟子彦与家人偕来今经九十馀日矣未知果来否偶灯下独酌有怀怆然援笔题此俟余弟至而共读之时正月二十七日夜也
815472,宋建中靖国辛巳七月二十八日为东波先生骑箕之辰先生乞居常州，卒于孙氏寓馆，其地去余家不数十武，旧迹犹存，岁值辛巳，去先生六百年矣，感今追昔，邀同学诸子于是日肇祀先生，用眉山二字成诗二章，致敬恭思慕之意云
105920,十月二十二夜三更读清波杂志至五更
901617,七月二日大风作一昼夜方止土人云此风潮信也三首 其二
99566,正月二十日往岐亭郡人潘古郭三人
826445,鹧鸪天·十一月二十八夜客楼听雨，感不成寐。明日是亡妇生辰，用成容若韵
793063,八月二十三日先慈八秩忌辰礼佛志感四首 其三
921217,正月二十日，与潘、郭二生出郊寻春，忽记去年是日同至女王城作诗，乃和前韵
818542,延安一首五月二十六日赋寄毛主席
653269,四月二日西湖再汛四首 其三
1165368,中秋月二首 其一
208603,正月二十日过江氏园
410440,悯农 八月二十四日雨，至十月五日止，田庐尽淹，禾稻生耳，自道光己酉以来未有之灾也，嗟我农夫，何以卒岁
427831,蝶恋花 五月二十七日上海业馀政治大学开学典礼席上听石西民校长讲话，引人间词话中语为喻，感呈此曲
863784,十月二十日作
164987,正月二十七日侍二老人出万里桥游宝历寺谒五
696542,八月二十七日早钟梦后在新城闻王府召命说
818033,三月二十三日立夏迟秋湄看花之约未至
1248899,璚花珠月二名姬
588948,太中府君诞辰感述　镇州十月二十八日
105681,至和元年四月二十日夜梦蔡紫微君谟同在阁下
167245,三月二十六日书所闻
1115556,正月二十八日峡外见燕子二首
514923,七月二十日文华殿后讲毕上顾中官赐讲臣冠带靴袍臣敏政预赐织金云雁绯袍一有副金带一乌纱帽及皂靴面谢讫上顾谓曰先生辛苦共对曰此皆职分所当为顿首而退
282295,前七夕夏正五月二十九日当公历七月七日，敌军芦沟桥始发难
588674,正月二日得黎婿惟和书报除大行人喜甚口占俚语录似惟敬惟仁
1006432,八月二十日与馆中同舍游西湖作 其二
1054130,七月二十六日
535018,奉次许宗鲁中允九月二日居庸佛阁同仇将军登宴二首 其一
139060,四月二十一日同妻孥泛舟登吕氏济川亭
1117212,次子瞻夜字韵作中秋对月二篇一以赠王郎二以寄子瞻
1124421,七月二十日被檄考试出门
876456,甲寅元月二首 其二
854796,齐天乐 寿贾使三月二十八日生
1097959,七月二十一日重过赣滩十绝句 其二
116417,正月二十日梦在京师
1251198,闰五月二十七日发金陵简同舟者
459109,八月二十未明早点店作
107118,六月二十二日守陴百姓始下城
370975,凄凉犯·庚子十二月二十四日，宿济南敖阳店，寒甚，有怀故园节物，凄然作此解
655157,六月二十九日拜命进位尚书适与体斋傅先生年兄同升比承诗示次韵奉复兼柬西涯学士
1130890,五月二十二日寻僧
172410,一斛珠·正月二十日张园赏海赏作
829929,长相思·庚寅八月二十四夜自海外归，宿长相思室，感赋二解
639571,水龙吟 六月二十四日和仲韶
1244449,八月二十四日
1218698,八月十六日送张仲举至秦邮驿是夕邵文卿置酒云峰台望月二首 其一
920426,六月二十七日望湖楼醉书五绝 其三
825146,闻文芸阁同年以八月二十四日卒于萍乡感赋
640047,洪武十八年二月二十日自漳州府回闽宪因思去年七月五日出闽关土人云宪司官初过此关值微雨故有小不利今出关而天日晶明旌节当复还矣及至京师纠劾奸贪事既得实彼乃伏诛我则还职再入关天又晴人复云必大亨也前后所作二绝句谩志于此 其一
891051,题山月水月二亭
98875,六月二十日夜渡海
934993,三月二十日儿辈出谒孤坐北窗二首 其一
105697,正月二十四日同江邻几韩持国过师商庙
727414,三月二十六日言謇博优行援士相见礼以诗造余寓庐明日遂招之饮而诗未报也阅再旬复以其所为训周晓芙诗波及于我而督和会姚丈人来异其为人乃招之饮而同和之 其一
366260,十二月二日
1113770,秋月二首
460244,凤皇台上忆吹箫　九月二十六病卧肖，起留三阕。时肖有分飞之悲，亦触余旧事，故泛写之二首 其二
233652,四月二十三日始设酒禁试东坡羹一本港春味
156090,七月二日戏为纨扇新体
370438,六月二日·高车驷马断经过
427837,声声慢 得龚翰青翁书，报家珠以七月二十六日下世，赋此纪哀
185486,腊月二十六日立春
685453,独酌问月二首
831884,十月二十一夜栎社诸子集予无闷草堂 其一
850249,四月二十二日拜第二表请御正殿
829050,蝶恋花  南京解放五日武昌解放。四月二十四日效冯正中体四首
381125,正月二十一日城西步归作
459756,八月二十九病起秋来，聊为赋此五首 其二
874644,三月二日被命祈晴上天竺舟中得六绝句 其三
103301,九月二日梦後寄裴如晦
459369,七月二暮雨中作七首 其五
107890,十二月二十日立春系癸巳岁予年已六十七白刘
429519,五月二十日归自西山始逢大雨
1015024,丙辰二月二日喜晴 其三
900502,六月二十六日秀青亭初成与客同集
339684,七月二十三日奉寄濑溪书堂吴景朔因讯旧游
572299,九月二日盛集诸公郊游至二圣寺仍用散木韵 其一
604447,立春日胥江驿东方舟友人时丁未冬十二月二十一日也 其一
712560,闰七月二日长寿石公招同毛匏村司马张损持吉士吴晋涛少尹杨勉庵孝廉唐海门黄兰偶司红暹诸文学雅集离六堂次毛韵二首 其二
456430,贺新郎 四月二十日髂痛不已。忽读冬冬谁来了还是谁走了帖子，怅惘曷极
459500,十月二十二暮行，欲往肖，无车，坐车亭作
1124244,十一月二十三夜通夕不寐为赋梅诗且怀斯远成父友弟及五首而晓书呈在伯
304286,十一月二十六日同君亮表侄展外袓墓谨赋
1070017,二月二日富阳城东 其二
1063329,壬辰九月二十三日始寒以诗记之
984715,中秋日赴史漕赏月二首 其二
370414,正月二十八日
955283,依韵酬叶道卿中秋对月二首 其一
1130256,三月二十三日心禅饷余新面白蜜作二首
928233,二月二日梦中作
824891,十一月二十二日出京道中杂诗 其十六
721371,闰七月二日长寿石公招同毛匏村司马张损持吉士吴晋涛少尹杨勉庵孝廉唐海门黄兰偶司红暹诸文学雅集离六堂次毛韵二首
459851,五月二十二夜零点班中饮，忆旧游作此，欲寄王江华
808150,惜馀春慢  戊戌三月二十二日汎湖用清真韵
458761,六月二十四夜不眠
825355,四月二十日渡海 其三
297154,四月二十一日南社同人小集
896915,四月二十日书二首 其二
639315,见复弟二月二十生作诗寿之
827680,中秋对月二首 其二
897597,正月二日探春
731739,十一月二十八日大雪
459620,九月二十四重过陆城养殖场荷池，末首记姑妈语也 其一
1161737,二月二十七日社兼春分端居有怀简所思者
294512,八月二十日自澄赴申浦吴门作
528417,九月二十六日同贾广文刘举人任贡士高夔府先生宅内赏菊四首 其四
322006,五月二十五日饯安国舍人于荐福洪右史王宗丞来会坐间用前韵
970064,浣溪沙 其四 为五叔寿，三月二十六日
590165,塘上月二首 其一
102402,仆领贡举未出钱穆父雪中作诗见及三月二十日
1247881,正月二日答诸公见赠之作
614635,闰四月二十五日明府兄招同孝廉仲兄溪汎晚泊小桃源
157821,免役未几四月二十九日总府复有仓官之命五月
631381,中秋病起与诸子玩月二首 其二
422908,辛亥三月二十九日广州之役，余在北京狱中闻展堂死事，为诗哭之，才成三首，复闻展堂未死，遂辍作 其一
734076,闰三月二十八日午门应制赐宴及烛
1249736,四月二日林自■城归写呈迁居诗四首因以述怀并记时事 其四
531257,十二月二日张龙山谢高泉敖梅坡余九崖杜晴江梁一江潘东溪携酒过访高峣
390358,六月二十三日元符万宁宫为亡儿设醮
787132,十月二十日谒先慈墓感赋
476618,八月二日经筵纪事
155180,二月二十四日杨廷秀郎中诸友约游西湖佘以小
295793,四月二十三日至北京
1130300,三月二十八日枣柏大士生辰二首
708718,齐天乐•二月二十日风雨感怀
106239,八月二十九日雨霁玩古兰
452284,辛卯二月二十七日深夜别后作
826446,长相思·庚寅八月二十四夜自海外归，宿长相思室，感赋二解 其一
1097958,七月二十一日重过赣滩十绝句 其一
919633,十二月二十八夜至此怅然继和
836821,葭月二十六日喜晤石庄，兼话大甲官军捷信 其二
682778,二月二日见山召饮次韵
772353,梅伯言、马湘帆、汤海秋、王少鹤四农部，何子贞编修，陈颂南、苏赓堂、朱伯韩三侍御，叠次召余同亨甫为觞宴之乐。九月二十六日，复集蒹葭阁；盖丙申年入都，伯言、湘帆置酒处也。诸君各以诗文见赠，余行有日，辄成七律数章酬别 其二
998888,六月二十二日夜省宿一首
530934,正月二日观社
751779,七月二十九日得秦中赵岳生司马书知女弟于去岁四月朔日殂谢诗以哭之
1084631,白若遇水以小舟从石门渡势危甚因书数语示图南文卿时八月二日也
180750,自五月二日避寇转徙湖中复从华容道乌沙还郡
96654,九月二十七日题桂溪铺
99227,正月二十日与潘郭二生出郊寻春忽记去年是日
825354,四月二十日渡海 其二
1133076,正月二十四日送廉使出郊 其一
878942,臈月二十二夜漏下数刻小饮径醉坐小閤睡傍无侍者仆于户限眉鼻伤焉流血被面记以六言九首 其七
1072680,正月二十立春观雪次韵向文刚
691727,正月二日台卿李公监察毛公袁公枉驾而顾毛归有作辄次其韵二首
973845,正月二十四日雨霰交作
520266,二月二十二日与杨应宁宪副宋惟寅宪佥强景明伴读城东泛舟联句 其二
