1131093,中秋月二首
874648,三月二日被命祈晴上天竺舟中得六绝句 其一
528131,九月二十五日会曹汝学侍御于麓堂夜归遂过侍御宅
1130954,八月二十五日过南豅
1051502,次子瞻夜字韵作中秋对月二篇一以赠王郎二以寄子瞻 其二
338377,二月二十六日展先大人墓
599754,二月二十一日清明如樵展扫 其七
901883,七月二十四日山中已寒二十九日处暑
931284,甲子岁十月二十四日夜半梦遇故人于山水间饮酒赋诗既觉仅能记一二乃追补之二首 其二
507873,二月二十六日钦颁天花祥云瑞光图至自北京并秦中所献玄兔余忝署礼部事陪百官致辞称贺退而有作
336823,正月二十八日雪晴睡起
1096351,丙申六月二十六日作飘风行
806827,采桑子 正月二十日从吴天石处获读纬云弟京邸春词因和其韵声情拉杂百感风生一夕遂得十首不自知其所云也 其八
276697,七月二十六日抵金陵坐雨
1225612,至正庚子十一月二十七日梦中作
86379,腊月二十二夜漏下数刻小饮径醉坐小合睡傍无
477090,同沈启南吴门载酒泛月二首 其一
1240783,乙酉四月二日与蒋桂轩伯仲诸友同泛震泽大小雷望洞庭之峰吹笛饮酒乘月而归盖不异老杜坡仙游渼陂赤壁也舟中各赋诗余赋二十韵为首唱
1194591,初月二首
700410,舟次对月二首
1130197,三月二十八日枣柏大士生辰六首
303659,众异以海棠诗索和久无以报三月二十八日崇效寺赏牡丹怃然有作因次其韵
1144675,东阳方韶卿惠古意七篇久不得和五月二十六日将假馆宗阳桥稍有閒暇乃为次韵因寄讯彼中吴子善前辈
357941,正月二十六日雪后登子亭示道祖
783922,寒月二首 其一
829911,五月二日雨中感怀
1103329,甲戌七月二十七夜大雷雨有感
865871,腊月二十九日陈万石石室吕潜心三兄相访夜坐分韵得年字
53464,八月二十八日子容过对菊
249002,六月二十三日夜中候夫人作
243067,九月二十七日与客游龙山
436064,乙卯二月二十一日归自汴梁二十五日夜久旱而雨偶记内乡一诗追录于此今三十年矣
338624,百字令·二月二日微雪，晓起至官衙赋
521674,己巳待泮潞渚单氏两翁以乡里来会长者八十二少者七十三皆朴茂淳古类山谷中人溯其生当宣德正统间得气之方厚者也为之感叹适有以画竹惠者因书其上赠之正月二十日
458883,十月二十三中宵起赋杂诗十二章 其二
509501,成化己丑丁先人忧守制甫半载十二月二十日忽奉恩诏夺情起复进阶右都御史总督两广军务兼理巡抚上章辞免升秩乞留终制不蒙俞允感而有作
1241343,二月二日登楼作
494460,戊戌十月二十八日，携徐生世礼、夏生仲、王生奉、黄生耕、黄生牧、刘生誉
458847,五月二十夜自电视房抢归亟书 其四
824879,十一月二十二日出京道中杂诗 其四
1234155,二月二日尊经阁望郊外山水二首 其二
1138931,七月二十九日夜大醉宿陆宣慰廨旦日以一诗谢之
475243,关山月二首 其一
902098,五月二十四日自达州至永睦县投宿废学即事书怀
156323,十月二十四日早始见雪
458413,清平乐　饮至九月二日晨赋寄肖健
963104,四月二十三日晚同太冲表之公实野步
1065158,十二月二十六日永明禅师生辰三首 其一
729159,五月二十八日书诗人壁
146709,绍熙癸丑二月二十六日
107909,十一月二十日南至
1130309,三月二十八日枣柏大士生辰用达本情忘知心体合为韵作八偈供之时在建康狱中
501697,中秋玩月二首 其一
695550,中秋玩月二首
943588,九月二日
102916,七月二十一夜闻韩玉汝宿城北马铺
948735,胡涣季享示寿诗二首十月二十五日因其生日次韵答之 其二
320222,七月二十六日
194154,十二月二十四日问潭孔昭疾见庭下雨中花云木
837955,六月二十二日闻台湾鸡笼屿不守感愤书此和?盦韵 其一
191442,五月二十七日夜大雨前三日热甚
154241,正月二十七日陪唐子耆登卧龙时稼轩已去令人
1068052,正月二十六日寇顺之饮仆以醽渌酒径醉闻横笛音李仲先顺之有苍头能作龙吟三弄偶不果戏成此诗
232376,二月二十四日即事
805046,八月十五夜板桥玩月二首 其一
492498,正月二十二日赴容州道中
1071125,十一月二十八日陈令分寄梅花数枝为赋两绝句 其二
460258,鹧鸪天　二月二十六对雨三首 其三
1159991,奉和中书崔舍人八月十五日夜玩月二十韵
176012,云岩竹源二禅俱与招客三月二十一日遂饭于竹
874636,三月二十五日饮方校书园十绝 其七
786053,读七月二十五日行在所发罪己诏书泣赋
1133854,记正月二十五日西湖之游十五首 其十四
547715,九月十三夜扈从功德寺陪李渐庵大司寇王忠铭徐检庵二学士登金山对月二首 其二
693341,腊月二日待罪私居作二律以自遣
1134331,乙未十二月二十四日立丙申春予忝七十
972795,闰月二十日离玉山八月到馀干易舟又二日抵鄱阳城追集途中所作得诗十有二首 其一
1083151,甲辰七月二日宿永和寺用旧诗韵
944752,良月二十一日郡庠置酒炉亭劳余出山且取子美何时一樽酒重与细论文分韵赋诗韵不以及就成十绝 其九
123339,九月二十八日湖上检校篱落
874624,三月二十一日泛舟十绝 其三
1046916,六月二十日湖上四绝句 其一
459476,七月二十八日培训班完。晚饭后坐二小而雨至，时待夜汇报展也。随作与肖看 其三
466419,凤皇台上忆吹箫　九月二十六病卧肖，起留三阕。时肖有分飞之悲，亦触余旧事，故泛写之二首
1124476,闰月二十一日作落梅花
1032303,三月二十九日还家花事已过独碧桃盛开
658980,东冈隐士筑亭于松竹之间名曰款相意以为予予不敢当而有也为易曰来贤八月二十四日初会亭上口占一律
177686,十月二十日作
902730,淳熙巳酉二月二日皇帝登宝位镃获厕廷绅辄成驩喜口号十首 其五
1112224,中秋夜不见月二首
379214,四月二十七日同姚同年燮熊鹾尹松之陈明经凤孙小集江亭
459757,八月二十九病起秋来，聊为赋此五首 其三
879482,二月二日东屯感怀
184460,九月二十七日夜大风雨顿凉偶作
586551,汤涧松钟海月二公舟中手谈
874646,三月二日被命祈晴上天竺舟中得六绝句 其六
457057,五月二日夜卧读李劼《论晚近历史》至天明，闻窗外鸟语，漫衍四章寄乖崖 其三
108368,五月二十三日怀归
956174,淳熙五年四月二日直宿玉堂怀旧二绝句 其一
459366,七月二暮雨中作七首 其二
842339,七月二十日痴盦小卧二首 其二
43644,五月二十八日书诗人壁·不钩帘幕昼沉沉
638103,四月二十八日狂风大作
466718,信阳三首 壬辰四月二十一日与幻庐赴信阳途中红叶传诗相迓试步元韵
70504,摸鱼儿·正月二十七日
181712,十二月二日腊祭前一日致斋惠照清叟察言观色
918596,好事近 其一 嘉定二年正月二日大雪
930433,八月二十二日嘉州大阅
825721,四月二十七日孙师郑邀集翁文恭生日分韵得荐字
790880,盆蓄蟋蟀一头，冻毙已久，弃置床角。十月二十夜，曼声忽作，启视果虫也。喜其绝而复苏，似有恋主之情，酬之以诗
837956,六月二十二日闻台湾鸡笼屿不守感愤书此和?盦韵 其二
605005,乙丑春二月二十有四日邑侯裒谷孙公有事罗浮同社诸君子偕集江上小堂举酒相贺夫劝课农桑巡行阡陌辟草莱以正疆界蒐伏慝而饬干掫此循良实政开邑以来二百五十馀年所未有也遂相与绘图授简侈为诗歌以副野史公复取道于先司徒东皋别业驻辔于先仲第□子二石山房盖有谋野则获之思焉萱乃携子及孙炊脱粟酾茅柴以窥马足公辄欣然班荆移阴而别时余以目眚不能从公于迈为四百三十二君归石候命第以一日之长狎主齐盟敢不悉索敝赋窃附中和乐职之谊遂鼓腹
459532,醉中约肖访薛，肖乃醒语止之。作诗聊当神游，才数句，又为彼拽饮。后醉中见稿，辄补数句，屡为肖酒误之。今夜大醉续成，已二年矣。时作时辍，故语无伦次。时元月二十八日，将共往宁乡之前夜也
1123633,闰月二十日离玉山八月到馀干易舟又二日抵鄱阳城追集途中所作得诗十有二首
69690,乙酉四月二日与蒋桂轩伯仲诸友同泛震泽大小
408882,癸丑六月二十五夜初更见西北方一星飞下光长数丈随缩而灭不知何兆
427314,少年游 三月二十六日，检历，知春尽
337421,二月二十八日静寄轩作
458908,十月二十四日斜阳如温水，无风，极和静之至，有所感四首 其四
674576,已卯六月二十七日早晚上梦中赋诗四句谩记之
158645,题山月水月二亭
1183695,八月二十九日宿怀
1005748,五月二十八日四绝 其一
458894,十月二十四午瞢坐复得十二章 其二
1134412,八月二十日赵西湖携酒夜醒二更记事 其二
912632,初九夜月二首 其二
1099698,六月二十四日雨后苦热作
407658,八月二十五日与内子携儿女辈游草堂
1094864,五月二十二日寻僧 其三
429222,十二月二十七夜大雪柬瘿公孝觉众异用东坡聚星堂韵
381798,十月二十八日夜起
719878,后秋兴八首壬寅三月二十三日以后，大临无时，啜泣而作 其二
929524,秋夜观月二首 其二
806826,采桑子 正月二十日从吴天石处获读纬云弟京邸春词因和其韵声情拉杂百感风生一夕遂得十首不自知其所云也 其七
825405,四月二十四日渡海
689762,予己丑夏辞家客燕二十年江南风景往往画中见之戊申冬来南京今年六月二十九日奉旨使安南长途秋热年衰神惫气郁不舒舟抵太和舟中睡起烟雨空濛秋意满江宛然画中所见埃为之一空漫成二绝以志之时己酉七月二十四日也
689762,予己丑夏辞家客燕二十年江南风景往往画中见之戊申冬来南京今年六月二十九日奉旨使安南长途秋热年衰神惫气郁不舒舟抵太和舟中睡起烟雨空濛秋意满江宛然画中所见埃为之一空漫成二绝以志之时己酉七月二十四日也
501474,予己丑夏辞家客燕二十年江南风景往往画中见之戊申冬来南京今年六月二十九日奉旨使安南长途秋热年衰神惫气郁不舒舟抵太和舟中睡起烟雨空濛秋意满江宛然画中所见埃为之一空漫成二绝以志之时己酉七月二十四日也 其一
501474,予己丑夏辞家客燕二十年江南风景往往画中见之戊申冬来南京今年六月二十九日奉旨使安南长途秋热年衰神惫气郁不舒舟抵太和舟中睡起烟雨空濛秋意满江宛然画中所见埃为之一空漫成二绝以志之时己酉七月二十四日也 其一
977804,癸丑十月二日上天竺寺祈晴
690544,乙丑春二月二十有四日邑侯裒谷孙公有事罗浮同社诸君子偕集江上小堂举酒相贺夫劝课农桑巡行阡陌辟草莱以正疆界蒐伏慝而饬干掫此循良实政开邑以来二百五十馀年所未有也遂相与绘图授简侈为诗歌以副野史公复取道于先司徒东皋别业驻辔于先仲第□子二石山房盖有谋野则获之思焉萱乃携子及孙炊脱粟酾茅柴以窥马足公辄欣然班荆移阴而别时余以目眚不能从公于迈为四百三十二君归石候命第以一日之长狎主齐盟敢不悉索敝赋窃附中和乐职之谊遂鼓腹
851409,七月二日大雨歌
1021985,湖上望月二首 其二
1192015,同乐天中秋夜洛河玩月二首 其一
640048,洪武十八年二月二十日自漳州府回闽宪因思去年七月五日出闽关土人云宪司官初过此关值微雨故有小不利今出关而天日晶明旌节当复还矣及至京师纠劾奸贪事既得实彼乃伏诛我则还职再入关天又晴人复云必大亨也前后所作二绝句谩志于此 其二
527434,十七夜月二首 其一
1036085,浣溪沙 十二月二日雨后微雪，太守徐君猷携酒见过，坐上作浣溪沙三首。明日酒醒，雪大作，又作二首 其五
277323,四月二十六日雨后刘仲鲁大理招游积水潭即席赋呈
945537,正月二日游慈云为龄叟作
458885,十月二十三中宵起赋杂诗十二章 其四
73139,临江仙·戊午九月二十一日
1071023,丁巳十二月二十六日过吾村早饭宿后溪三首 其二
1016274,十一月二十八日大雪有感
664723,五月二十二日㮚死踰旬僮子以其所为诗三卷及杂集回文稿呈览悲悼之馀令之缮写成帙用寄渼陂先生为㮚较定将图入梓漫成二诗以写予怀 其一
569671,四月二日即事 其四
868930,南歌子 四月二十六日集客临芳观
302050,八月二十八日破晓出长台关
750917,六月二日作
527783,月二首 其一
216858,正月二十日俗号天穿日以煎饼置屋上谓之补天
116416,正月二日探春
410397,己酉十一月二十七日地震（柏梁体）
1116713,三月二十日开园三首
1062106,己酉岁十一月二十六日避寇至龙潭院十二月十五日作五首 其四
773671,十月二十三日庄副使相邀赏菊次范侍御韵
105894,十二月二十八日立春次韵王山长俊甫
920427,六月二十七日望湖楼醉书五绝 其四
181845,已酉三月二十一日夜梦中作
751148,正月二十日由枫桥至五{氵众}泾用东坡是日女王城诗韵
368759,浪淘沙慢·四月二十夜雨中
255067,十二月二十三日对雪
1092682,十二月二十八日
460379,木兰花　六月二十八夜病目不能事，漫写云溪十二月风情词遣之 其七
582017,甲子七月二十日观刘巡抚发兵气势之盛因占丑虏有不足殄作此二律以揄扬之呈寅长诸君索和二首 其二
295132,二月二十六日将之山左旅次倚装口占
1135823,久晴十月二十四日五日连雨程以忠来同饮
878943,臈月二十二夜漏下数刻小饮径醉坐小閤睡傍无侍者仆于户限眉鼻伤焉流血被面记以六言九首 其六
934896,壬辰十月十三日自阆中还兴元游三泉龙门十一月二日自兴元适成都复携儿曹往游赋诗
1118185,对月二首
590766,戊午春督浚滇河继有清查之役寓五华山白云窝五阅月二首 其一
931213,四月二十九日作
666390,丙子十月二十八日初发乡邑述征有作
998552,二月二十八日周提宫叶致政楼司理过访锦园 其一
525647,十一月二日自襄阳赴谷城将游太岳
79858,三月二十日晚酌
1085468,五月二十五日饯安国舍人于荐福洪右史王宗丞来会坐间用前韵
1036152,浣溪沙 元丰七年十二月二十四日从泗州刘倩叔游南山
333258,九月二十五日去苏州
307445,十月二日狮子窝观红叶
329441,十月二十日过陈二表民追讲昔年同学事迹慨然赠之以诗
178627,二月二十四日至魏塘
94885,正月二十四夜朱师古少卿招饮小楼看灯
1030304,鹊桥仙 其三 八月二十八日寿唐子才
665044,咏十月十五夜月二首 其二
52672,三月二日交城大雪
824885,十一月二十二日出京道中杂诗 其十
505357,六月二十二日雨 其一
345453,壬辰九月二十三日始寒以诗记之
727261,关山月二首
1134542,六月二十八日立秋
369866,六月二日·瓮头白酒香初酿
817803,五月二日雨中感怀 其五
107243,久晴十月二十四日五日连雨程以忠来同饮
1141582,东阳方韶卿惠古意七篇久不得和五月二十六日将假馆宗阳桥稍有閒暇乃为次韵因寄讯彼中吴子善前辈 其二
107193,九月二十二日晓倚楼
106209,五月二十三日甲子交六月节稍晴三四五复大雨
1118351,癸丑正月二日二首
827679,中秋对月二首 其一
490285,孙朴居携酒东林玩月二首 其二
825357,四月二十日渡海 其五
1133853,记正月二十五日西湖之游十五首 其十二
580705,四月二日邀李总戎郊行小酌
505649,十二月二十四日夜忆母亲作三首 其一
458730,四月二十一夜
878944,臈月二十二夜漏下数刻小饮径醉坐小閤睡傍无侍者仆于户限眉鼻伤焉流血被面记以六言九首 其五
167362,正月二十四日送廉使出郊
787609,九月二日病赴睦州 其二
991886,四月二十八日记与王正仲及舍弟饮
456540,踏莎行 阳历七月二十二日邱宜钢自广西河池来电，言及目下不慊，而谓余多乐。因赋此调
97740,闰月二日雨三日复雨寄斯远
81743,十二月二十九日夜半雨雪作披衣起听
1115064,七月二十七日午到钓滩登其台偶成二绝
331067,十二月二十五日诗悼傅子骏给事
901624,二月二十四日至魏塘七首 其二
1094863,五月二十二日寻僧 其二
605775,正月二十日里中皆以桃枝插门贵贱童稚亦皆以桃叶为佩曰禁鬼也西园公鼓掌人与鬼何辩鬼不害人禁之何为夫害人者人而鬼耳庸可禁耶时街头有青衣桃叶者歌莫禁鬼鬼闻而大笑之亦歌先禁人以答之西园公闻而并录焉莫禁鬼四章 其一
1245168,丙午十一月二十四日夜梦回书事
1190977,和崔舍人咏月二十韵
990954,至和元年四月二十日夜梦蔡紫微君谟同在阁下食樱桃蔡云与君及此再食矣梦中感而有赋觉而录之
950824,予癸巳在京口因郡中元夕张灯偶阅国史靖康丙午正月十五日辛巳祐陵南巡驻跸是郡二月二十三日己未始还京师凡居郡三十有八兹闻箫鼓感旧兴叹不胜潸然因涉笔以记大略而僧有冲希者乃携以示正伦彼谓予讽己遂架大怨迄兴妄狱圣明察知其冤予复将指前漫尽白因悼正伦之殁闵其左计亮其初心附昔所作诗于后
1065189,三月二十八日枣柏大士生辰用达本情忘知心体合为韵作八偈供之时在建康狱中 其四
78388,正月二十八日大雪过若耶溪至云门山中
118734,十月二十九日雪
555963,丙午年首夏患足疾六月淫雨大作狱屋中水深二尺许囚板漂没六七日始退重此湿感不能步履今一载矣殊觉衰惫恐倏殒灭为十招魂以自慰卧起慷慨援笔立就词固不能尽工也丁未年四月二十五日作 其六
295581,二月二十二日雪后院廨楼望
200018,三月二十九日舟中作
460386,减兰　三月二十四 其二
95409,八月二十四日同审知登塔山用审知前载九日留
1103739,己丑正月二日入山中题岩石二首 其二
458931,十二月二夜与肖谈作
944976,正月二十四日到梅山二首 其一
369827,四月二日·易觉春风老
1056052,大观四年二月二日自采石过藏云取路回远少憩已入夜遂留宿明日聪师相邀登览偶见西偏地真一方之胜也余方营葬庶几得之以托妙缘既去因留此诗
159952,奉和介甫正月二日
1252736,四月二日林自■城归写呈迁居诗四首因以述怀并记时事
1113163,腊月二十二日渡湘登道乡台夜归得五绝
704922,二月二十一日清明如樵展扫
411661,五月二十八日送客作三首选二 其一
19341,九年十一月二十一日感事而作
1070228,和柳子厚诗十七首 其十四 十二月二十三日大雪中种物
466206,五月二十四夜读阮籍诗三首
1207929,百丈山中夜坐，闻谨思将还，忆甲寅入南中，正此日也。十二月二十三日六首 其一
984682,七月二十八日蒲大受仲明举偶来会宿三首 其二
1208559,登第诗五首（泰定元年甲子） 其三 同年会（四月二十九日海岸之万春园）
173410,四月二十九日迓伯氏久渴得雨田父交贺而行客
1034595,二月二日遂宁北郊迎富故事
1041366,答黄寺丞九月二十一日出郊
457932,十月二十八日太平间作，盖为同事家葬事主书记五首 其五
458715,三月二十五夜记梦
835925,满江红 其二 六月二十四日
1116510,九月二十日微雪，怀子由弟二首
974095,闰月二日雨三日复雨寄斯远三首 其三
1135834,己亥十一月二十一日长至前一旬书
459578,四月二十七酒兼病卧肖处作词六章。二十八日归更作二章与肖，其二肖父母也 其一
661126,二月二十九日随驾耕藉
972126,十二月二十九日雪三首 其一
534848,七月二十七日恭谒显陵有述
1005365,己丑正月二十四日避地盐楹入省坑存思庵和旧韵 其一
760260,五月二十八夜不寐
825402,四月二日曾刚父招集崇效寺
422909,辛亥三月二十九日广州之役，余在北京狱中闻展堂死事，为诗哭之，才成三首，复闻展堂未死，遂辍作 其二
772358,梅伯言、马湘帆、汤海秋、王少鹤四农部，何子贞编修，陈颂南、苏赓堂、朱伯韩三侍御，叠次召余同亨甫为觞宴之乐。九月二十六日，复集蒹葭阁；盖丙申年入都，伯言、湘帆置酒处也。诸君各以诗文见赠，余行有日，辄成七律数章酬别 其七
452696,十月二十八日宿天津
818572,八月二十七日明思文皇帝殉国忌辰也。读巢南诗，即题其后
834364,菩萨蛮 戊申三月二日观瑶华为周髯写兰，因题
783047,五月二十日自杭返仪徵舟中纪行 其一
331030,丙寅十月二十二日孟坚理旧箧见纯老送行诗有见及语因次其韵
1129304,丙辰二月二日喜晴
459077,四月二十五消病作春歌
117279,十二月二十六日旦闻东堂啄木声忽记作福昌尉
1199694,诗一十七首 七月二十六日夕紫微夫人喻作令与许长史
1099128,十六夜月二首 其二
80441,七月二十四日作
985384,踏莎行 其二 三月二十日元择旬会
460243,凤皇台上忆吹箫　九月二十六病卧肖，起留三阕。时肖有分飞之悲，亦触余旧事，故泛写之二首 其一
1034308,十二月二十七日宰执率百官请大行皇帝谥于南郊曰宁宗纪事 其二
888616,六月二十一日早行十六首 其二
825353,四月二十日渡海 其一
1203964,春从天上来 至元二十九年八月二十八日
167833,六月二十日
90683,十二月二十七日大雪中过吉水小盘渡西归
466322,十月二十四午瞢坐复得十二章
1218992,闰正月二十日闻泗州盱眙同日失守
972111,八月二十六日雨后呈沅陵教授
790752,许仙屏中丞于正月二十二日殁于奉新原籍，作此志哀
509048,十二月二十有三日发梧州之浔与二三同事小酌书感
838445,贺长沙杨庆荃广文腊月二十八日五十初度 其二
385234,八月十五夜月二首其二
99234,六月二十七日望湖楼醉书五绝
142772,腊中步月二绝·平山堂下解围去
535662,九月二日侍经筵有述
1029134,徽州绩溪县六月二十五日迎汪王于县厅祈雨未之应也七月三日率同官再祷焉酌献方毕阴云四合甘霔大霈因以小诗纪实
459791,九七年七月二十九抄成《后十日梦》随题其末
72963,二月二日寄友
693720,丁丑六月二日与东江石潭未斋介溪饯别閒斋司业于受公房联句二首
509037,十二月二十有八日余与总兵官彰武伯杨公副总兵都督曹公地官郎中罗公习正旦仪于善化寺礼既毕杨具酒肴邀镇守太监王公守备中贵罗公同此小酌以为岁暮休暇之乐余浩然兴发因成五言古诗一章聊叙情曲且识余感
88900,十一月二日至紫极宫诵李白诗及坡谷和篇因念
1249960,丁酉二月二日访仲仁仲远仲刚贤昆季别后赋诗以谢
903911,绍熙癸丑二月二十六日蒋助教言正招游阳华婆娑岩下薄暮乃归得诗五绝以纪其事 其三
321797,戊子八月二日得泉州
458453,忆昔乡居十一月二十日醉书四首 其一
1134427,十一月二十日南至二首 其二
1071971,六月二十一日子文待制见访热甚追记馆中纳凉故事漫成一首
459599,六月二十五夜洗衣破指戏作三首 其二
861209,九月二十九日到思溪庄避人事十月初四日过生朝方归初三日早恕子遣人来送酒食并词二阕因成唐律二首 其二
903975,醉蓬莱 毛氏女兄生朝三月二十八日
152379,十一月二十七日刘公度徐用之许相过公度居忧
555965,丙午年首夏患足疾六月淫雨大作狱屋中水深二尺许囚板漂没六七日始退重此湿感不能步履今一载矣殊觉衰惫恐倏殒灭为十招魂以自慰卧起慷慨援笔立就词固不能尽工也丁未年四月二十五日作 其八
911806,二月二十三日南雄解舟二首 其二
1085456,五月二十日闵雨
735841,得桐城方尔止先生四月二十九日书感赋兼怀密之先生
352742,三月二十七日玉堂夜宿
973677,八月二十四日同审知登塔山用审知前载九日留题之韵作二首时彦博归及常山 其一
867483,满江红 其三 九月二十一日出京怀古
1234595,戊子十一月二十四日拜叠山先生于双桐驿盖先伯见山同丙辰理宗亲擢也先生叙旧好言同心焉明日中赋二诗为别
254431,三月二十四日坐未名湖畔观鱼
1041641,七月二日
181711,十月二十三日赵守侵早泛舟游西山有诗即席各
555962,丙午年首夏患足疾六月淫雨大作狱屋中水深二尺许囚板漂没六七日始退重此湿感不能步履今一载矣殊觉衰惫恐倏殒灭为十招魂以自慰卧起慷慨援笔立就词固不能尽工也丁未年四月二十五日作 其五
1012345,卫进可寺丞腊月二十九日招我以蔬饭从容胜集其居之西一堂榜曰六湛意六处休复同一湛然且求语因作偈云
1070233,五月二日同叔问过弥陀阁观山中飞瀑
828366,二月二日
156313,腊月二十五日偶忆孟浩然白发催年老青阳逼岁
1114910,题北岩定林院方丈戊戌正月二十四日携诸童稚来游藉草而饮既醉书方丈小垣以去
1142255,送男存心如燕二月二十五日夜走笔古体 其二
459367,七月二暮雨中作七首 其三
1064497,三月二十八日枣柏大士生辰六首 其二
466259,十一月二十一寻肖不遇，其家有华容酒，孤饮遂醉，笔墨在案，随而写之
1106836,四月二十九日迓伯氏时久渴得雨田父交贺而行客病之戏成二绝
1115308,问月二首
