90455,十二月二十七日立春夜不寐
956325,二月二十七日病后始能扶头
432411,辛亥三月二十九日广州之役，余在北京狱中闻展堂死事，为诗哭之，才成三首，复闻展堂未死，遂辍作
15178,奉和中书崔舍人八月十五日夜玩月二十韵
163536,腊月二十六日部宿雪甚登天官厅后亭子
850707,正月二十八日夜大雪
698394,六月二十二日雨
232332,三月二十四日出城
460271,菩萨蛮　二月二十四夜不成眠聊赋回文遣之 其三
460391,贺新郎　四月二夜步往橘子洲头，已立为公园矣，而铁将军把门，不得入。予立栏外赋此
1068851,建炎辛亥八月二十六日夜梦舣舟江岸与梅和胜论诗梅出古诗示予极壮丽复为予作汤饼方就席视梅手中器已十裂汤饼淋漓觉而怅然作此篇
581988,甲子岁二月二十日拜进万寿圣节表文宪长陈吉夫首倡予步韵二首 其二
459475,七月二十八日培训班完。晚饭后坐二小而雨至，时待夜汇报展也。随作与肖看 其二
972125,十二月二十九日雪三首 其二
218420,癸巳十一月二十五辞家雪甚作怆然有怀
529032,中秋对月二首 其一
369855,九月二十日
637661,腊月二十六日镇远府送春花土牛作诗以谢 其一
1120843,次韵仲平太博中秋斋中对月二绝
509695,甲午十月二日夜风寒拥炉达旦不寐偶见新月口占一绝书于灭度桥头
849620,十月二十六日甲子
874643,三月二十五日饮方校书园十绝 其八
1121057,四月二十日被以郡事入奏之命再赋二首
831677,阴历六月二十六夜大风雨，诗以志异
1066990,凤凰山泉石胜绝去城无几里而前此未有知者偶因休吏与文中良器二士访寻得瑰奇卓绝之观于荆棘草莽间相顾大笑因崇基趾筑亭榭疏泉甃池为登临啸咏之地九月二十五日游陟归夜作小诗十首 其四
157310,二月二日出郊
305393,十二月二十四夜作
869055,二月二十四日馆宿兴宗舍后桃花盛开偶书牖上
957218,淳熙四年六月二十七日登大峨之巅一名胜峰山佛书以为普贤大士所居连日光相大现赋诗纪实属印老刻之以为山中一重公案
381400,四月二十日渡海
817035,又因明月千家雪树影寒霜月二句松坡成篇余亦足成二律
460409,鹧鸪天　十月二十九
903913,绍熙癸丑二月二十六日蒋助教言正招游阳华婆娑岩下薄暮乃归得诗五绝以纪其事 其五
1118385,十月二十八日夜鸡初鸣时梦与数女仙遇其一作诗示予颇哀怨如人间语惟末句稍异予戏之曰若无此句不可为神仙矣其一从傍戒曰汝当勿忘此规作诗者甚有愧色予颇悔之既觉赋两绝句以解嘲
460384,木兰花　六月二十八夜病目不能事，漫写云溪十二月风情词遣之 其十二
457947,虞美人　十一月二十日慰石人病
932588,庚申十二月二十一日西和州健步持子布书报已取安康襄阳路将至九江矣悲喜交怀作长句二首 其二
153771,次韵高似之秘书谢薛书记七月二十七日早桂
856229,予绍兴三十二年夏四月三日行部至山中时月上人方入山十有八日旋披荆棘立数椽以居其徒明年改元隆兴夏六月二日再过山而堂室粗备且于云母泉侧创为茅亭使往来观者得以驻足而酌甘诚可嘉也时巴陵尉临川李克仁高密刘孝杰华容尉权三衢徐二誉在焉子辈侍行
999859,南都二月二日忆杭州去岁之游
1062830,四月二十七日雨后诣府学道过辟雍不暇谒权朝美归以诗寄之
798810,浪淘沙慢 四月二十夜雨中
825407,七月二十九日诣白庙胡同宝斋寿伯茀夫人出见
96657,九月二日发舟快阁下
918234,五月二十三日雷雹大作
1143948,八月二十日赵西湖携酒夜醒二更记事
825271,二月二十一日又至南京
97729,闰月二十日离玉山八月到余干易舟又二日抵鄱
494985,闰二月二十日于林介立纳言宅会顺限韵
799988,已未二月二日午门听宣岳州大捷遇雪恭纪
465125,蝶恋花 夏历四月二十三初度前一夕
939534,三月二十二日榴花盛开戏作绝句
829580,二十夜待月二首
245328,五月二十三日雷电大作
569668,四月二日即事 其一
809911,小满后偶旱涂中祈雨四月二十三日甘霖大霈
631380,中秋病起与诸子玩月二首 其一
459755,八月二十九病起秋来，聊为赋此五首 其一
92194,六月二十四日病起喜雨闻莺与大儿议秋凉
323505,壬申中秋交朋解散不期而会者郑生逊志夏生伯虎因小饮玩月二子各以诗赠依韵酬之
870354,成都遨乐诗二十一首 其七 二月二日游江会宝历寺
854276,满庭芳 其二 寿通判七月二十二日
94535,已亥正月二日送李伯和提干归豫章
1034925,四月二十日领客寻龙井前盟以雨阴晴未定不果往买舟下西湖步至玉泉观鱼分韵得东字
874629,三月二十一日泛舟十绝 其一
787608,九月二日病赴睦州 其一
168338,六月二日乙丑滥溪大雷雨
581797,腊月二日待罪私居作二律以自遣 其二
125434,七月二十七日·客雁归何处
466244,七月二十八日培训班完。晚饭后坐二小而雨至，时待夜汇报展也。随作与肖看
1194493,中秋月二首
460387,减兰　三月二十四 其三
999533,二月二日作
991774,三月二十五日喜雨
514011,二月二十六日南山雨中晚归
1088348,壬子三月二十七日闻迅雷有感
1038177,熙宁丙辰十一月二十八日安正堂喜雪
998872,三月二十四再到永祐陵
232203,九月二十一夜梦至乱山丛石间出憩道傍拂石坐
459479,七月二十八日培训班完。晚饭后坐二小而雨至，时待夜汇报展也。随作与肖看 其六
832007,九月二十六日小妾举一男，坠地即绝。余年三十有六，尚无子嗣，怆然有感 其一
1053789,十月二十一日夜
615034,正月二日憩双城驿
100153,十二月二十八日蒙恩责授检校水部员外郎黄
122296,照田蚕行·乡村腊月二十五
16473,二月·二月饮酒采桑津
772357,梅伯言、马湘帆、汤海秋、王少鹤四农部，何子贞编修，陈颂南、苏赓堂、朱伯韩三侍御，叠次召余同亨甫为觞宴之乐。九月二十六日，复集蒹葭阁；盖丙申年入都，伯言、湘帆置酒处也。诸君各以诗文见赠，余行有日，辄成七律数章酬别 其六
1094329,四月二日 其三
1037296,四月二十八日作二首 其二
340914,己酉岁十一月二十六日避寇至龙潭院十二月十五日作
203003,八月二日·浓云瞥过双凤飞
975232,次韵和胡仲方正月二十五日雪
321499,十月二十八日母氏劬劳之日也哀痛中书二十八字
286036,且月二十九日览玉泉山昆明湖
459633,十一月二十一寻肖不遇，其家有华容酒，孤饮遂醉，笔墨在案，随而写之 其三
882675,九月二十七日夜大风雨顿凉偶作
1092657,正月二十七日
222640,四月二日往檀林登车遇雨度鹅湖岭渐觉开霁
163908,正月二十五日过真溪见桃花
1006656,腊月二日烟雨馆
950904,十一月二十七日步自虎溪至西寺摩挲率更旧碑近览前闻人故游有感而赋
201848,依韵吴枢密正月二日留题曾侍中斋阁
824876,十一月二十二日出京道中杂诗 其一
215879,夜行船·红溅罗裙三月二
664724,五月二十二日㮚死踰旬僮子以其所为诗三卷及杂集回文稿呈览悲悼之馀令之缮写成帙用寄渼陂先生为㮚较定将图入梓漫成二诗以写予怀 其二
816175,八月十五夜板桥玩月二首
431890,满江红 戊子八月二十日纪事
509600,二月二十四日舟中观历偶知清明有感二绝 其二
1134545,六月二十四日秋夜书
825801,七月二日偕查峻丞郭啸麓唐立庵刺船淼薮
158910,二月二日作
972139,十月二十日晚风雨大作
1208924,闰十二月二十七日喜雪四首（前二日平章彻里特穆尔窜南安） 其三
1132365,十二月二十七日宰执率百官请大行皇帝谥于南郊曰宁宗纪事
84747,二月二日梦中作
1136977,水调歌头 其二 腊月二十一日可远堂索赋
990530,七月二十一夜闻韩玉汝宿城北马铺
518383,二月二十日得家书
978690,正月二日至九江过陈汉卿
1194688,江边星月二首
874632,三月二十一日泛舟十绝 其五
920379,十月二日，将至涡口五里所，遇风留宿
1118461,十二月二日夜梦与客并马行黄河上憩于古驿二首
957954,十二月二日腊祭前一日致斋惠照呈清叟察院三绝 其一
1041334,十月二日邀邻几饮裴二如晦来遂留至夕
526037,舟次对月二首 其一
722662,后秋兴八首壬寅三月二十三日以后，大临无时，啜泣而作
945644,良月二十一日郡庠置酒炉亭劳余出山且取子美何时一樽酒重与细论文分韵赋诗韵不以及就成十绝 其四
452324,辛卯九月二十三日游云居寺步嘉庆帝元韵
653267,四月二日西湖再汛四首 其一
1094455,六月二日大雨如注山涧水溢 其一
844260,十月二十一夜栎社诸子集予无闷草堂
1075370,群不逞乘时纵火以病良民有捕于官者辄送遣之或厚与之金使之出境二月二十八日敝庐为恶少见焚虽复仅免而官不为直不能言安三月六日徙居寓舍
1249734,四月二日林自■城归写呈迁居诗四首因以述怀并记时事 其二
98159,五月二十一日徙寓智门
545663,中秋同允兆诸子集赵相国第玩月二首 其一
457221,七月二十六日应嘘堂邀自汉过宁与诸友集于石头城，明晨独往苏州西山，闻诸子复集于求雨山
199803,三月二十日东山云蜿蜒而上众指日龙也已而大
99867,三月二十日开园
459758,八月二十九病起秋来，聊为赋此五首 其四
1071142,昌化肉不常得予蔬食已惯每闻有猪则召一二友生同饭月不过二三四月二日闻有猪亟令召三职事
184543,五月二十日还旧居有感
1121249,三文祠堂七月二日礼成作
825337,十二月二十八日自大连湾至奉天观日俄战处
829663,十一月二十二日出京道中杂诗
748295,六月二十八日大雪冯君树堂周君荇农郭君筠仙方以试事困于场屋念此殆非所堪诗以调之
1003541,正月二十五日过真溪见桃花 其二
966358,十二月二十四日问谭孔昭疾见庭下雨中花云木芙蓉也楚词云搴芙蓉兮木末言芙蓉水花不在木末也
972124,十二月二十九日雪三首 其三
1086128,戊子八月二日得泉州
948121,丁酉二月二十日同部中诸公游下竺御园坐枕流亭观放闸桃花数万点随流而下继至集芳亦禁峑也海棠满山郁李绕槛殆不类人间世明日入部而桃花数枝伶俜窗外未时内直则海棠郁李各一株方开遂赋二绝句 其一
805047,八月十五夜板桥玩月二首 其二
1138072,十二月二十九夜大雪 其一
972931,顷与公择读东坡雪后北台二诗叹其韵险无窘步尝约追和以见诗之难穷去岁适无雪春正月二十日乃雪因遂用前韵呈公择 其一
1006436,八月二十日与馆中同舍游西湖作 其五
912626,问月二首 其二
305361,六月二十六日雨香馆有所怀寄示韬园散释
1076320,腊月二十三日郡厅祷雪宿斋房赵尉灯下送蜡梅
460264,浣溪沙　二月二十四雪次日消 其一
966709,二月二日席上赋
883016,五月二十日还旧居有感
1108926,三月二十五日饮方校书园十绝
771613,二月二十八日偕龚梓材邑宰游白云洞在东阳城西十里
944901,三月二十五日醵饮于西峰寺分韵得因字
912053,六月二十三日立秋
890866,浣溪沙 其六 己未三月二十五日赏荼
24295,木兰·二月二十二
168362,四月二十日被以郡事入奏之命再赋
828134,己未正月二日偕妇及絜先觉先两弟至灵隐寺己未
896410,所居有梅一株在堂东荒秽中正月二十六日已谢矣二首 其一
1001531,四月二十七日登灵洲阁明日前迓新漕回首望阁赋长韵寄堂头僧
427259,西子妆 二月二十三日同社集北湖祠楼感赋
791219,三月二十四日有怀作
1106426,九月二十九日到思溪庄避人事十月初四日过生朝方归初三日早恕子遣人来送酒食并词二阕因成唐律二首
361192,张公咏二月二日始游江以集观者韩公绛因创乐俗亭为驻车登舟之所
1117107,十月二十九日雪四首
436119,丁未三月二十八日县大夫薛君宝臣过余芹溪精舍酒閒雨作时方苦旱喜而赋之
861313,汪秘校携诗并雪月二赋相访次其韵
209352,十二月二十六日蔡叔庸至剪烛听雨
729553,点绛唇 十月二日马上作
378597,四月二十五日智俱侍者生日戏作此授之
655006,二月二日与诸亲友别后道中偶成
1070768,丙寅十月二十二日孟坚理旧箧见纯老送行诗有见及语因次其韵三首 其一
991895,戊子正月二十六日夜梦
1039687,甲寅中秋对月二首 其一
1137812,十二月二十九夜大雪 其二
404873,玉楼春·壬辰七月二十三日携俊儿自台北飞花莲，道经台南台东，盖越卑南山脉而行也
688095,孙朴居携酒东林玩月二首
265949,二月二十八日程公归榇乡中走送不及泫然作
842338,七月二十日痴盦小卧二首 其一
81003,九月二十三夜小儿方读书而油尽口占此诗示之
571542,江月二绝 其二
814944,西江月二首
378463,三月二十三日心禅饷余新面白蜜作
157474,八月二十五日闻布新条
119744,十二月二十六日趋府
931214,四月二十三日作二首 其一
571541,江月二绝 其一
232222,十二月二十四夜赋梅花
1119930,良月二十一日郡庠置酒炉亭劳余出山且取子美何时一樽酒重与细论文分韵赋诗韵不以及就成十绝
302300,五月二日雨中感怀
923690,十月二十九日雪四首 其一
1128451,八月二十日与馆中同舍游西湖作
493520,余自去冬闰十一月遣人还泰和迎候舍弟子彦与家人偕来今经九十馀日矣未知果来否偶灯下独酌有怀怆然援笔题此俟余弟至而共读之时正月二十七日夜也
991899,正月二十七日江邻几杜挺之刘原甫贡甫韩持国邀饮于定力院
700090,乙丑秋喜家赏月二首
1028706,十二月二十六日早起雪已三寸许夜来初不觉也
322757,五月二十七日入栈值余生日戏作二律邀亥白兄及吕湘帆和
693693,中秋对月二首
116653,二月二日挑菜节大雨不能出
1113976,新月二首
555960,丙午年首夏患足疾六月淫雨大作狱屋中水深二尺许囚板漂没六七日始退重此湿感不能步履今一载矣殊觉衰惫恐倏殒灭为十招魂以自慰卧起慷慨援笔立就词固不能尽工也丁未年四月二十五日作 其三
430083,四月二十一日沪宁车中
1123883,顷与公择读东坡雪后北台二诗叹其韵险无窘步尝约追和以见诗之难穷去岁适无雪春正月二十日乃雪因遂用前韵呈公择
200599,二月雪·戊戌二月二十六
278879,四月二日东明花屯战役为日军包围脱险喜占
146376,五月二日生朝
381792,十二月二十八日自大连湾至奉天观日俄战处
1209928,弹秋宵步月秋夜步月二曲
459147,十二月二十八夜中起记梦
1172887,江边星月二首 其一
1075363,正月二十七日种木瓜五株
13615,二月二十七日社兼春分端居有怀简所思者
827297,庚午正月二十九日，予值消寒第七集赋此
8664,八月十五夜月二首其一
43707,三月二十日朱本固园中牡丹二百余朵
100465,正月二十六日偶与数客野步嘉祐僧舍东南野人
531915,得子弥月二首 其二
1049205,南园正月二十三日见牡丹因剪分送而公舒太守以诗为报遂次来韵
283335,东风第一枝·壬戌十二月二十日立癸亥春，和梅溪韵
100440,江月·二更山吐月
263562,乙丑三月二十四日为古稀序齿会之期
79861,三月二十一日作
1127387,二月二十八日周提宫叶致政楼司理过访锦园
1134413,八月二十四日宾旸华父同登秀亭二首 其二
457056,五月二日夜卧读李劼《论晚近历史》至天明，闻窗外鸟语，漫衍四章寄乖崖 其二
1071360,庚午岁屏居零陵七月二十日以门掩候虫秋为韵赋五首 其三
1120829,七月二十日秘阁曝书二首
950723,去岁五月二十八日发雪锦亭以六月旦谒富池而行是夜始望见庐山今岁以此日正在湖渰中念岁月之倏忽惊道途之劳勚回首感叹二首 其二
775350,辛巳1821二月二十六日鹿港登岸
458707,二月二十四夜长安母家听雨 其三
735154,九月二日同马允彭篯侯董采载臣陈鏦大始严鸿逵赓臣查枢左旋大儿葆中从子至忠放舟东游
1141586,东阳方韶卿惠古意七篇久不得和五月二十六日将假馆宗阳桥稍有閒暇乃为次韵因寄讯彼中吴子善前辈 其五
156066,次韵侍御五月二十日闵雨
280877,十月二十一夜栎社诸子集予无闷草堂
247578,虞美人·二月二日寄砚之
974096,闰月二日雨三日复雨寄斯远三首 其二
505692,中秋同唐仲暹玩月二绝句 其一
470565,过皋亭龙居湾宿永庆禅院同一濂澄心恒可诸上人步月二首 其二
347632,元丰六年正月二十九日季壬生徐元立以诗来贺用韵酬之
1221547,丁巳岁腊月二十日喜雪
1222213,己巳三月二十六日
433474,众异寄示六月二十夜对月诗赋答
1000777,八月十五夜月二首 其一
107934,四月二十日客言兵所不至麦有黑虫食之
140919,淳熙已酉二月二日皇帝登宝位镃获厕廷绅辄成
300565,八月二十五夜苦热与家人倚栏得一绝句
1212766,三月二十二日梦中咏琼花
459541,二月二十七日醉往华容寻薛为宏，车过洞庭湖，出立轮渡看水。记十一年前初过此水往君山，尝作诗，怅焉更赋
365550,腊月二十四日诏立皇嗣感赋
566422,六月二日客途逢亡内期日二首 其二
888610,六月二十一日早行十六首 其八
509772,八月二十四日?作多溺死者
410852,十一月二十五日雪（二首选一）
280229,正月二十二日为丛碧词家七十九生日寄此为寿
1099838,三文祠堂七月二日礼成作 其四
409863,长安月（二首） 其二
827682,中秋后一日偕晓因挈女步月二首 其二
1190562,丙寅二月二十二日抚州如归馆雨中有怀诸朝客
155946,二月二十一日何司业集客于张园玉牒给事命予
530942,五月二日太华寺会效韩昌黎
746839,二月二十六日招叶筠潭前辈郭羽可艾至堂蒋子潇张亨甫朱晓山小集江亭
252128,玉楼春·二月二日过歌乐山木鱼堡松寥簃赋赠主人张默君
728482,采桑子 正月二十日从吴天石处获读纬云弟京邸春词因和其韵声情拉杂百感风生一夕遂得十首不自知其所云也 其四
963173,田家以二月二日晴雨占谷价枕上口占
515067,己酉六月二日初至南山 其一
642080,十一月二十夜梦子严外兄
1121056,庚子三月二十七日又易守当涂四月十一日发辞免之牍书怀成二唐律
783048,五月二十日自杭返仪徵舟中纪行 其二
738202,五月二日自大浃江出海
689974,坡翁雪月二竹
568353,予入晋以四月二日宿权店三日过南关抵盘陀八月东巡还亦以二日抵权店是晚遂宿南关三月午饷盘陀岂有定数耶
903507,正月二日雪
569670,四月二日即事 其三
747893,九月二十日潘德舆招饮海山仙馆即事有作 其二
105917,八月二十日天晓
245997,十月二十八日宿天津
1235555,三月二十五日过上洋十六保徐居士柯庄二首
745066,七月二十五日同人登宝石山天然图画阁遇雨和杨传九用樊榭韵
381166,四月二十日夜起
84464,丁巳正月二日鸡初鸣梦至一山寺名凤山其尤胜
190262,甲辰正月二十三日夕壬申梦坐一江楼上见雪月
138250,水调歌头·九月二十六
888617,六月二十一日早行十六首 其一
919295,花月二首 其一
107939,四月二十九日早起行园
1113329,七月二日大风作一昼夜方止土人云此风潮信也三首
771554,二月二十六日展先大人墓
920515,正月二十一日病后，述古邀往城外寻春
130553,四月二十三日晚同太冲
1116176,庚午岁屏居零陵七月二十日以门掩候虫秋为韵赋五首
973683,十一月二十三夜通夕不寐为赋梅诗且怀斯远成父友弟及五首而晓书呈在伯 其一
155568,六月二十二日夜省宿
851093,十二月二十日作
297010,六月二十四日与社友往竹溪寺参谒关圣
1118532,十二月二日夜梦游沈氏园亭二首
295814,去岁腊月二十三日哲维访余天津旅次余以是日归大连不相直哲维有诗见寄次答
431525,伤楠儿四首 楠儿以廿六年八月二十八日晨七时殁于无锡
974097,闰月二日雨三日复雨寄斯远三首 其一
943590,十二月二十七日趋慈溪
180678,三月二十日闻德音寄李德升席大光新有召命皆
458706,二月二十四夜长安母家听雨 其二
569669,四月二日即事 其二
1069798,八月二十日
1067904,五月二十四日晨起隔壁闻季敌营诗戏作此嘲之
493521,余自去冬闰十一月遣人还泰和迎候舍弟子彦与家人偕来今经九十馀日矣未知果来否偶灯下独酌有怀怆然援笔题此俟余弟至而共读之时正月二十七日夜也
422906,辛亥三月二十九日广州之役，余在北京狱中，偶闻狱卒道一二，未能详也，诗以寄感 其一
818602,四月二十五日四首选三 其三
157529,分龙吟·五月二十分龙雨
817801,五月二日雨中感怀 其三
761326,扬州慢  癸丑十一月二十七日，贼趋京口，报官军收扬州
42865,正月二十日·早年丧乱曾尝过
772352,梅伯言、马湘帆、汤海秋、王少鹤四农部，何子贞编修，陈颂南、苏赓堂、朱伯韩三侍御，叠次召余同亨甫为觞宴之乐。九月二十六日，复集蒹葭阁；盖丙申年入都，伯言、湘帆置酒处也。诸君各以诗文见赠，余行有日，辄成七律数章酬别 其一
631624,立秋夜望月二首 其二
1071359,庚午岁屏居零陵七月二十日以门掩候虫秋为韵赋五首 其二
184686,十一月二十六夜梦与范石湖各赋梅花六言觉仅
459596,五月二十九夜作
1090513,六月二十一日戊寅率同寮诣登源祖庙中迎英济祷雨是日也雨随车至越翼日己卯继之至中宵方霁自辛巳至于乙酉遂沛然沾足丙戌敬送神因书二小诗以纪灵异 其二
120729,九月二日·灯火一樽酒
921631,仆领贡举未出，钱穆父雪中作师见及，三月二十日，同游金明池，始见其诗，次韵为答
466110,四月二十三消病时闻彭将婚二首
291271,八月二十五日登杀牛坪
117138,三月二十四日闻莺
1133797,五月二夜闻雨大□□日至杭
878247,五月二十七日游诸洞
186751,严庆胄射策南归迂途相访六月二十有一日同游
1078067,三月二十三日德音至容南恭闻驻跸浙东王师屡捷虏骑远遁是日得诸季书挈家寓饶之德兴幸免惊扰忻忭之馀辄成口号
958377,甲寅九月末雨至十月二十三日得晴闻是日六飞进狩诸将告捷
294699,十一月二十一日雪后华墅归途作再叠前韵
431408,五月二十八日送客作三首选二
1134543,六月二十三日立秋喜闻贼平镇将凯回归府官俱还
631302,正月二十一日
144496,田家以二月二日晴雨占谷价枕上口占
927229,奉和十月二十四日初见雪呈相国元老
422750,贺新凉 五月二十五日记事
317990,庚戊三月二十七日阅报有作
1125655,七月二十八日蒲大受仲明举偶来会宿三首
277480,十月二十九日月下作
460421,鹧鸪天　五月二十七病作
1064106,四月二十五日智俱侍者生日戏作此授之
1097960,七月二十一日重过赣滩十绝句 其三
115623,将离柯山十月二十七日
237135,十月二十日有感
825285,九月二十四日葬弥明于苏州木渎米斗山
456542,忆江南十一月二十九日理科实验班同学送张雪转学进京戏咏雪
184863,苏秀道中自七月二十五日夜大雨三日秋苗以苏
901635,五月二十四日宿永睦将口香积院僧轩东望甚远满山皆松桧声三首 其三
868918,临江仙 其九 十一月二十四日同王幼安、洪思诚过曾存之园亭
105329,五月二十四日过高邮三沟
410178,六月二日召见仁寿殿恭纪二首 其二
452956,三月二十七日夜造卢夫子鸿基教授苦瓜棚居小酌剧谈感其生平即席吟呈一首
674688,十月二十八日东风
645968,甲戌三月二日出行
466257,九月二十二梦见椒子幼株，欲掘种故家后窗下，作诗曰：异日小窗读周易，可从窗内一抬头。而觅锄不得，惶然遂醒。思梦里故家，乃十馀年前景，久已荡然，无复种树之隙矣；屋亦为姑母加建久居，并无可归之地矣。因足成篇，更补一首。梦中句云云，盖现居窗外有孤树，读书倦处，辄举目相对耳
503755,九月二日见菊蕊尚青偶赋
1075518,三月二十二日春雨终日
827985,十一月二十六日同君亮表侄展外袓墓谨赋
1074775,三月二十二日游昭山前一日讷禅师死
1076427,五月二十四日晚雨忽晴浴罢独卧池亭云峰奇峭既夕方散
745311,十月二十七日晡后过法源寺作
540776,乙丑正月二日慎脩北赴礼闱十一日大雪怀思
896851,己卯十二月二十日感事二首 其二
195099,八月二十八日挈家泛舟游上渚诗
1124174,闰月二日雨三日复雨寄斯远三首
1218059,五月二十四日游平山庵客怀豁然用前韵呈周济川叶诚中
930865,五月二十一日风雨大作
699348,九月二十九日同罗服卿及社中诸兄弟登高二圣寺
379120,二月二十一日奉陪季长游岳麓饭罢登法华台赋此
510315,五月二十六雨
1062107,己酉岁十一月二十六日避寇至龙潭院十二月十五日作五首 其五
1143895,十一月二十日南至二首
1114545,江月二首
471982,纪赐四十首 其十六 十一月二十九日圣母万寿圣节赐金币镂金篆字黄朱灵符等物岁以为常
1042187,九月二十五日召赴后苑观稻
812602,九月二十日潘德舆招饮海山仙馆即事有作
525631,郢中对雪十月二十二日
131238,三月二日醉中快活吟第二笔
1064604,次韵履道雨霁见月二首 其一
849544,十月二十日 其一
