303657,众异既归殊惓惓于江南之游赋此讯之
429378,众异既归殊惓惓于江南之游赋此讯之
816568,今陕甘总制杨石泉尚书卸署福州将军由闽航海莅沪令于军中曰浮江沂汉车骑出潼关度岁西安弭节兰州于时江淮瓯越文武千人云集海上鹤盖成阴候公前旌久矣至顾念边陲汲汲西迈飙轮不灭火虎士不解剑江苏候补道聂仲芳丈时铸后膛钢炮方为中华创制请公视始允为一日之留广钧晋谒于江南制造局以威毅命亦申攀辕之请公出诏书及枢王手书以示乃知风雨驰驱不避艰险敬天子命重边务也孔子之不俟驾诗人之赋出车胥此意也广钧以诗受知于公因广其意为诗以献
1176348,严子重以诗游于名胜间旧矣余晚于江南相遇甚乐不幸且没袭美作诗序而吊之其名真不朽矣又何戚其死哉余因息悲而为之和
802318,今陕甘总制杨石泉尚书卸署福州将军由闽航海莅沪令于军中曰浮江沂汉车骑出潼关度岁西安弭节兰州于时江淮瓯越文武千人云集海上鹤盖成阴候公前旌久矣至顾念边陲汲汲西迈飙轮不灭火虎士不解剑江苏候补道聂仲芳丈时铸后膛钢炮方为中华创制请公视始允为一日之留广钧晋谒于江南制造局以威毅命亦申攀辕之请公出诏书及枢王手书以示乃知风雨驰驱不避艰险敬天子命重边务也孔子之不俟驾诗人之赋出车胥此意也广钧以诗受知于公因广其意为诗以献
1172463,比闻龙门敬善寺有红桂树独秀伊川尝于江南诸山访之莫致陈侍御知予所好因访剡溪樵客偶得数株移植郊园众芳色沮乃知敬善所有是蜀道菵草徒得嘉名因赋是诗兼赠陈侍御
253658,吴永良卓鹤君张伟平于江南会席中合作柳荫品茗图命题
958470,荆州之川曰江曰汉曰沱曰潜曰三澨其泽曰云梦汉志谓三澨在江夏竟陵竟陵即今之景陵复州是也春秋传楚子与郑伯田于江南之梦梦与云自不同渡武昌道汉阳至复州非冬晴水涸则渺漫极目乃三澨之尾所谓梦泽也己已二月春水未生行蒲稗间累日将至景陵望孤城盖大泽中之环堵州治即古章台也
1887,春晦饯陶七于江南同用风字
462363,吴永良卓鹤君张伟平于江南会席中合作柳荫品茗图命题
1176807,春晦饯陶七于江南同用风字
802319,今陕甘总制杨石泉尚书卸署福州将军由闽航海莅沪令于军中曰浮江沂汉车骑出潼关度岁西安弭节兰州于时江淮瓯越文武千人云集海上鹤盖成阴候公前旌久矣至顾念边陲汲汲西迈飙轮不灭火虎士不解剑江苏候补道聂仲芳丈时铸后膛钢炮方为中华创制请公视始允为一日之留广钧晋谒于江南制造局以威毅命亦申攀辕之请公出诏书及枢王手书以示乃知风雨驰驱不避艰险敬天子命重边务也孔子之不俟驾诗人之赋出车胥此意也广钧以诗受知于公因广其意为诗以献
1223346,萧姓渊善鼓琴予尝为之作我思操今自和林归再任巡徼之职于江南比行又求予诗遂为赋汉铜马式歌以送之
