972600,初八日人事少閒命车出游因以寻诗首访滕王阁纷然屠沽思为之败已过东湖得孺子亭亭阁幽邃乃陈阜卿复作者一时诗板甚多择数知名句录之又东数步得孺子祠有像设及曾公衮书南丰所作祠堂记及沈持要重立岁月壁崩粪积殊异敬事迤逦避雨入总持寺谒澹台子羽墓阅雷公祠墓有大篆立于其前祠有乐章无尽所作雨止绝南昌县径还舣舟之地作五诗
452328,辛卯冬秒虞廷兄来京秋扇为置酒半梦抱琴高凉疏影师生同至言及次日蛰门赴天津雅集数日后得疏影来诗云欲留终去别良俦过处云山满目愁衣上京华留酒债孤怀和梦返渝州颇多怏怏之意忆及曾与疏影有渝州之约戏步原韵慰之
552937,三月廿四日会饮于姚先生宗文家时在座者以斋黄先生文竹夏先生野亭沈先生仲良陈先生列坐以齿行酒侑食仰独山之高俯长淮之深燕笑一日之间有足乐者黄先生起论山川形胜因及曾杨之学赋诗一挥而就老成特达其何可及耶因次韵于后纪胜集云
972577,过商叟林居蒙示半村诗集及曾吉父宏父王元渤诗卷因用前者奉简之韵作二诗上呈商叟许抄半村诗集见遗故及之 其二
972578,过商叟林居蒙示半村诗集及曾吉父宏父王元渤诗卷因用前者奉简之韵作二诗上呈商叟许抄半村诗集见遗故及之 其一
79109,与黎道士小饮偶言及曾文清公慨然有感
746689,六月十二山谷生日邵蕙西舍人招吴子叙编修张石舟大令朱伯韩侍御赵伯厚赞善曾涤生学士冯鲁川主政龙翰臣修撰刘蕉云学正及曾亮凡十人集于寓斋舍人有诗属和
97215,过商叟林居蒙示半村诗集及曾吉父宏父王元法
935014,与黎道士小饮偶言及曾文清公慨然有感
655872,大同原牧归后坊道中口占授小儿及曾正
1123882,过商叟林居蒙示半村诗集及曾吉父宏父王元渤诗卷因用前者奉简之韵作二诗上呈商叟许抄半村诗集见遗故及之
