1027255,谢林景思和韵
1093474,王有道诗刊成谢林教授
590558,谢林吾滨先生过访
581347,谢林乡人带家书至北馆
1131949,谢林簿遗庐阜茶芽
946004,谢林默之居士惠酒居士山居方与世绝尚欲友此废人耶小诗举发一笑
190795,谢林可山序诗
977859,谢林可山序诗
760774,谢林雪斋惠画 其二
1031923,谢林簿遗庐阜茶芽 其一
135955,谢林德久正字惠诗次韵
760775,谢林雪斋惠画 其三
371783,王有道诗刊成谢林教授
559365,程乡公署用林楚石韵奉谢林明府
1028217,谢林德久正字惠诗次韵
1031922,谢林簿遗庐阜茶芽 其二
191896,谢林默之居士惠酒居士山居方与世绝尚欲友此
86567,铜雀瓦砚歌一首谢林法曹
811460,谢林雪斋惠画
218389,谢林簿遗庐阜茶芽
760776,谢林雪斋惠画 其四
453672,谢林清晓君为选拙稿
760773,谢林雪斋惠画 其一
1200750,谢林守
135019,谢林景思和韵
209042,谢林治中访别觉际庵
69084,谢林彦广惠酒
878530,铜雀瓦砚歌一首谢林法曹
227461,谢林守架艾轩先生祠堂
959080,谢林治中访别觉际庵
