198075,新罗寺唐有新罗僧咒草愈疾卵塔今在閒来因题
1147249,兵后与故人别予西上至今在扬楚因有是寄
100433,寄欧阳叔弼·昔葬衣冠今在否
1221528,次韵张伯雨天一井阑诗元金荪璧积庆冈物后在开元宫黄蔑楼今在王景周东圃万文远先作予因和之
149385,四明岁晚水仙花盛开今在鄜州辄思之此花清香
979856,四明岁晚水仙花盛开今在鄜州辄思之此花清香异常妇人戴之可留之日为多
735959,义王宫妆楼今在官署中陈绿崖参藩置酒其上即席赋
275768,义王宫妆楼今在官署中陈绿崖参藩置酒其上即席赋
373259,与王子敏相别十年今在汝见招以书往从之闻其斋素卧病以诗劝之肉食
376179,状元袁府判作诗赠王司理其略云简川号工诗只今在市廛试呼一问之参寥师孰贤王索答酬以四十字
36607,兵后与故人别予西上至今在扬楚因有是寄
197931,辛顺忠唐得道之士真身今在河州寺
899130,朝中措 其二 前年十二月十八日入对，遂除吏侍。今在婺州，腊月十八日也
907038,辛顺忠唐得道之士真身今在河州寺
906908,新罗寺唐有新罗僧咒草愈疾卵塔今在閒来因题
1096292,状元袁府判作诗赠王司理其略云简川号工诗只今在市廛试呼一问之参寥师孰贤王索答酬以四十字
1065885,与王子敏相别十年今在汝见招以书往从之闻其斋素卧病以诗劝之肉食
472158,送王户部督饷延绥（延绥旧在绥德，控制河套为易，今在榆林，失险矣）
835491,琵琶仙 孔东塘所藏韩滉小忽雷叶东卿拓本，今在陶斋，乙巳上元日感题名。）
