961736,范大参入觐颇爱鄙作以诗谢之
1246836,同里吴仲机聚石族于窗外被之以菖蒲濯之以涟漪而象诸山焉大夫士咸咏歌之珠玉盈帙里人程仁表以仲机命来徵诗予养痾之日已久愧笔砚荒落且闻西席郑予明编诗甚精于品鉴不知鄙作可以铨次否一笑一笑
1136002,次韵康庆之见过醉归读予鄙作
150817,范大参入觐颇爱鄙作以诗谢之
556009,春夕皇甫膳部见过索观鄙作留夜坐
923273,道元上人累示禅偈诗笔并诸贤赓唱见索鄙作因成短句奉酬
887819,吴秀才出示孙尚书诗求鄙作
1222484,全氏小楼与南山相对殆几案间物也暇日觞予其上索赋鄙作因口占三绝句 其一
1222485,全氏小楼与南山相对殆几案间物也暇日觞予其上索赋鄙作因口占三绝句 其二
184147,道元上人累示禅偈诗笔并诸贤赓唱见索鄙作因
1235312,全氏小楼与南山相对殆几案间物也暇日觞予其上索赋鄙作因口占三绝句
571358,佥宪贾公谢事西川怡神楚北锡忝通家敬呈鄙作公病初起适慰其怀云
106700,次韵康庆之见过醉归读予鄙作
172017,吴秀才出示孙尚书诗求鄙作
1142741,次韵王蒙泉见寄并和鄙作
321242,次韵王蒙泉见寄并和鄙作
1142517,次韵王蒙泉见寄并和鄙作
