473456,题梅客生中丞平朔方卷
781425,闻客生昆仲入粤，予子法祖随焉。鉴在、蕴修、坤丞应相携同去，予独留滞闽乡，诗以写怀 其二
360534,赵宾客生日
781361,江雨，赠延安刘客生卧病 其二
544282,怀梅客生二首 其一
697075,怀梅客生二首
1046289,赵宾客生日
1073458,有客生致两雉不忍杀开笼纵之二首 其二
815756,客生梓石映昆遗稿成，属予为序。因题其后
593896,茅平仲梅客生沈叔成马用昭朱汝修盛泰甫招集苑西草堂同李袭美李惟寅梁持伯分得西字
1110542,有客生致两雉不忍杀开笼纵之二首
1073457,有客生致两雉不忍杀开笼纵之二首 其一
815770,江雨，赠延安刘客生卧病
626526,怀刘客生都宪
633914,刘昆玉从关中来觅其伯祖同庵客生遗榇因得皈予座下别归诗以送之
781360,江雨，赠延安刘客生卧病 其一
781574,刘客生詹尹直经筵讲官
781363,客生梓石映昆遗稿成，属予为序。因题其后 其二
781362,客生梓石映昆遗稿成，属予为序。因题其后 其一
630854,答刘客生中丞用来韵
567392,一内史邀集王氏园亭和梅客生席上之作
79042,幽事绝句·客生闻吠犬
815780,闻客生昆仲入粤，予子法祖随焉。鉴在、蕴修、坤丞应相携同去，予独留滞闽乡，诗以写怀
49814,题梅客生中丞平朔方卷
781391,延平寄客生、鉴在
594031,春日同刘仲修李袭美李惟寅邀詹东图康子秀余君房刘伯玄袁景从梅客生胡文甫祁羡仲胡茂承汤义少魏懋权李季宣董元仲集日涉园分得飞字
593910,同金择阳赵彦卿过梅客生馆玩晋唐诸帖
781376,鹡鸰行，赠刘客生
781424,闻客生昆仲入粤，予子法祖随焉。鉴在、蕴修、坤丞应相携同去，予独留滞闽乡，诗以写怀 其一
544283,怀梅客生二首 其二
593629,中秋同黎惟敬王敬美梅客生沈箕仲屠长卿周元孚唐惟良沈叔成集陶懋中宅对月
566644,六月七日之夕与梅君客生及诸乡里趁凉于长安街醉而称韵得片字
345719,挽词·逐客生还后
781510,得刘客生信
