436274,辛丑清明后三日诗社诸君燕集于封仲坚别墅谈笑竟日宾主乐甚然以未得吾兄弟数语为不足既而遁庵兄有诗余独未也主人责负不已因赋以应命云 其一
586091,同年黔阳县尹杨君得远祖之墓表而祀之大偿夙昔孝思之怀因赋以诗
521203,有草名雁来红者茎叶如鸡冠而无花得霜红甚俗呼老少年或画以贻樗翁良德南夫因赋以为寿予亦继作
492360,余弟子彦归自雩阳程尹幕中承寄墨桧画轴并题以诗其尚友高致可嘉因赋以答谢之
436139,辛丑清明后三日诗社诸君燕集于封仲坚别墅谈笑竟日宾主乐甚然以未得吾兄弟数语为不足既而遁庵兄有诗余独未也主人责负不已因赋以应命云 其二
492063,至里良之明日闻抄兵已入长兴因赋以自慰
1005660,腊月朔第二孙绳祖弥月喜其与翁同十一月而又皆乙亥时也因赋以祝之
458440,病卧展眼，床头石人山为置菊花茶，因赋以赠之8.19
636186,周茂才二有筑室山中谈经受徒从之游者皆邑名士书舍鳞集振铎篝灯络诵达旦予游山还时日已西夕留宿斋中睹其规模恍若丛席北方学者未尝有也因赋以赠
566544,与林玉两上人登会稽最高山山出秦望上率可五六里玉公早有来归之意因赋以止之
251943,八六子·茉莉花前小酌念秋水伊人之句因赋以寄人
903135,马贲以画花竹名政宣间其孙远得贲用笔意人物山水皆极其能余尝令图写林下景有感因赋以示远
463869,八六子 茉莉花前小酌念秋水伊人之句因赋以寄人
436700,辛丑清明后三日诗社诸君燕集于封仲坚别墅谈笑竟日宾主乐甚然以未得吾兄弟数语为不足既而遁庵兄有诗余独未也主人责负不已因赋以应命云
