390195,后秋兴·发兵每叹白人头
483619,余避地千金圩屡游殳史两山酒酣兴发赋诗一首惜山中无赏昔者空乘亦同于瓦器耳姑录以自娱云
340748,章江寺·兴发寻荒径
199891,野亭·兴发寻春去
1064691,愿监寺自长沙游清修依元禅师兴发复入城余口占四首赠之 其二
1130331,愿监寺自长沙游清修依元禅师兴发复入城余口占四首赠之
387060,春兴·忆在梁园诗兴发
1064690,愿监寺自长沙游清修依元禅师兴发复入城余口占四首赠之 其一
509174,成化七年春二月十有八日余与总镇太监陈公总兵官平江伯陈公视耀武扬威关二公留款庆林寺寺前山坡之上其平如掌下临长江旁列茂树众登览为之跃然喜胜地之偶得感二公之高情而慨念时事遂及西师不觉浩然兴发因作一诗书贻寺僧同游者参议王孟育冯文纲也
1064692,愿监寺自长沙游清修依元禅师兴发复入城余口占四首赠之 其三
414091,乙卯仲冬让公来劄略云小恙医嘱半休又游菜市口得廉价宜书纸将以两卷为赠并拟以菜市口寻曹芹圃不遇为题书长句一时兴发先书长句却寄
228881,方壶自咏·兴发花开处
299252,过倦圃·兴发伤头白
47882,无题·兴发总关情
544203,香山寺流憩亭小酌逢张郑应季四文学邀宿华严洞余与诸子素昧平生酒酣兴发策蹇十里从之诘朝复抵碧云泉上
509037,十二月二十有八日余与总兵官彰武伯杨公副总兵都督曹公地官郎中罗公习正旦仪于善化寺礼既毕杨具酒肴邀镇守太监王公守备中贵罗公同此小酌以为岁暮休暇之乐余浩然兴发因成五言古诗一章聊叙情曲且识余感
1064693,愿监寺自长沙游清修依元禅师兴发复入城余口占四首赠之 其四
53778,余避地千金圩屡游殳史两山酒酣兴发赋诗一首
