508365,和陶诗 庚戌岁九月中于西园穫早稻
688348,丙午岁九月廿日余偕同寅李由道罗象州过于冯佩之先生馆因留小酌联句三首
580172,丙午岁九月廿日余偕同寅李由道罗象州过于冯佩之先生馆因留小酌联句三首 其三
508364,和陶诗 己酉岁九月九日
996987,庭坚以去岁九月至鄂登南楼叹其制作之美成长句久欲寄远因循至今书呈公悦
505680,甲辰岁九月一夜梦外舅天趣郑先生问幽冥之事但云海天月色秋茫茫觉而衍其语以寄哀情
922180,和陶己酉岁九月九日，并引
1102641,课仆诣田所偶用渊明庚戌岁九月中于西田穫早稻韵
51054,己酉岁九月九日
889553,和陶庚戌岁九月中于西田穫早稻
31267,乙丑岁九月在萧滩镇驻泊两月忽得商马杨迢
51038,庚戌岁九月中于西田获早稻
1197216,庚戌岁九月中于西田穫旱稻
100617,和陶己酉岁九月九日
1197536,己酉岁九月九日
138880,和陶庚戌岁九月中于西田获早稻
580171,丙午岁九月廿日余偕同寅李由道罗象州过于冯佩之先生馆因留小酌联句三首 其二
580170,丙午岁九月廿日余偕同寅李由道罗象州过于冯佩之先生馆因留小酌联句三首 其一
100938,去岁九月二十七日在黄州生子名遁小名干儿颀
889538,和陶己酉岁九月九日
1116784,去岁九月二十七日，在黄州，生子遁，小名干儿，颀然颖异。至今年七月二十八日，病亡于金陵，作二诗哭之
113666,庭坚以去岁九月至鄂登南楼叹其制作之美成长
154234,用陶己酉岁九月九日韵
1190539,乙丑岁九月在萧滩镇驻泊两月忽得商马杨迢员外书贺余复除戎曹依旧承旨还缄后因书四十字
1077836,后重九半月菊始开因思东坡言菊花开日即重阳取酒为之一醉遂和渊明已酉岁九月九日之作
509749,庚戌岁九月中于西田穫早稻
921337,去岁九月二十七日，在黄州，生子遁，小名干儿，颀然颖异。至今年七月二十八日，病亡于金陵，作二诗哭之 其一
921338,去岁九月二十七日，在黄州，生子遁，小名干儿，颀然颖异。至今年七月二十八日，病亡于金陵，作二诗哭之 其二
919884,用陶己酉岁九月九日韵
788397,壬子岁九月七日吾弟怡贤亲王定窆于水东村朕念手足至谊兼以辅弼功勤献替忠款抚今忆昔情不能已因亲临奠送稍伸积痛夫神游于天魄藏于地亘古迄今理之常也但以吾弟之亲贤为国家柱石幽明异路于兹永别当深秋草木黄落之际朕心曷胜凄怆爰赋此诗以写怀
