624114,送族伯原澹之苍梧兼寄林司理傅明府
475535,南山行为梅林司马赋四首 其三
586666,岭南春色为林司训之子题
569434,送林司谕教授广信
826309,声声慢·九月六日承伯纯吏部招同姚子梁太守、陶矩林司马、桂竹君秋曹集沙萝浦绿雪楼
586423,林司训见召次韵 其一
682940,同年再会西园用林司空韵二首
575693,寄桂林司训王德安
535138,同年再会西园用林司空韵二首 其一
498996,赠林司训
659116,嘉靖元年二月廿九日与林司空见素同登上方俯视云水千顷青黄绚斓见素曰此一片锦也赋诗纪之
1098474,题林司户寒斋
665182,送林司训尚怀之辰州沆陵县学
535139,同年再会西园用林司空韵二首 其二
579940,次前韵答林司训
579942,次林司训赠行韵
1252141,题菊柬林司成先生
169850,次林司户清水岩韵
696317,南山行为梅林司马赋四首
590500,寿罗东林司训母寿节
475534,南山行为梅林司马赋四首 其二
1153930,得耿湋司法书因叙长安故友零落兵部苗员外发秘省李校书端相次倾逝潞府崔功曹峒长林司空丞曙俱谪远方余以摇落之时对书增叹因呈河中郑仓曹畅参军昆季
587060,送林司成文俊方斋
475533,南山行为梅林司马赋四首 其一
313257,声声慢·九月六日承伯纯吏部招同姚子梁太守、陶矩林司马、桂竹君秋曹集沙萝浦绿雪楼
363779,题林司户寒斋
590895,赠番禺林司训擢感恩掌教
940842,次林司户清水岩韵
1153881,送张调参军侍从归觐荆南因寄长林司空十四曙
682853,林司训见召次韵
586424,林司训见召次韵 其二
475536,南山行为梅林司马赋四首 其四
548609,送林司理应召北上
562706,己巳子月饮关使君浴元林司农署中次韵训首倡
11322,送张调参军侍从归觐荆南因寄长林司空十四曙
64914,南山行为梅林司马赋
