104631,陆子履见过·刘郎谪去十年归
1243940,王弘道下访别去十年矣至正戊戌迁浙东宪史相见如梦寐论心话旧不觉怃然赋二律见意云 其二
489600,阿师能画极清真自是金辉玉润人赢得蛟龙双浦上五云飞去十分春
156148,赠别君英·相去十五里
622361,去十三
1213181,王仲通宰公自东吴别去十载甲寅秋会于鄂渚乃知尚在七品常调中使人有郁郁遗才之叹谈论平生相对如梦历数海内诸友离合升沉之状悲欢良久有不能自已者既而仲通有欲为道隐求奉一祠之语诘难未能服俄为借骑下淮复归行馆翌日缀诗二章奉呈兼简钦甫佥司士元使君君平察推 其一
1036118,醉翁操 琅琊幽谷，山川奇丽，泉鸣空涧，若中音会。醉翁喜之，把酒临听，辄欣然忘归。既去十馀年，而好奇之士沈遵闻之。往游，以琴写其声，曰醉翁操，节奏疏宕，而音指华畅，知琴者以为绝伦。然有其声而无其辞。翁虽为作歌，而与琴声不合。又依楚词作醉翁引，好事者亦倚其辞以制曲。虽粗合韵度，而琴声为词所绳约，非天成也。后三十馀年，翁既捐馆舍，遵亦没久矣。有庐山玉涧道人崔闲，特妙于琴。恨此曲之无词，乃谱其声，而请东坡
872485,旧有歙砚雅宜墨镵贱号于阴以乱亡去十馀年矣忽见之村学堂中睨视间有艴然持之却走者如恐予之取也因作此以遗砚
303582,江南好·随潮去，十里石桥头
872459,燕去十年复来巢
195739,寄李君厚·一笑东风去十年
282822,恒宇兄西去十年祭
216954,燕去十年复来巢
1252256,王弘道下访别去十年矣至正戊戌迁浙东宪史相见如梦寐论心话旧不觉怃然赋二律见意云
216913,旧有歙砚雅宜墨鑱贱号于阴以乱亡去十余年
1243939,王弘道下访别去十年矣至正戊戌迁浙东宪史相见如梦寐论心话旧不觉怃然赋二律见意云 其一
370147,往九峰·翁已仙去十七年
1237213,王仲通宰公自东吴别去十载甲寅秋会于鄂渚乃知尚在七品常调中使人有郁郁遗才之叹谈论平生相对如梦历数海内诸友离合升沉之状悲欢良久有不能自已者既而仲通有欲为道隐求奉一祠之语诘难未能服俄为借骑下淮复归行馆翌日缀诗二章奉呈兼简钦甫佥司士元使君君平察推
1213182,王仲通宰公自东吴别去十载甲寅秋会于鄂渚乃知尚在七品常调中使人有郁郁遗才之叹谈论平生相对如梦历数海内诸友离合升沉之状悲欢良久有不能自已者既而仲通有欲为道隐求奉一祠之语诘难未能服俄为借骑下淮复归行馆翌日缀诗二章奉呈兼简钦甫佥司士元使君君平察推 其二
622358,三月三十夜与承之偕二兄小酌计春已去十有三日议各取平上去入之十三韵为五绝以纪事上平十三
622642,三月三十夜偕兄孟尝伯尝与承之小集春去十有三日矣因取平上去入之十三韵为五绝入十三
572530,壬辰秋日余与伯修兄俱得请先后出都门至郑相及同宿州署今相去十五年伯脩厌世亦六年矣电火惊心山川触目因书数语兼示小脩方平两弟
415437,恒宇兄西去十年祭
