84269,春晚至山中因访陈道人
55696,王雅适久居金陵过访山中因赠
1247043,十月二十又一日奉家君偕镏复叔留藤坑山中因憩涧石有作
933154,春晚至山中因访陈道人
472203,戚龙渊游闽八载归乃移家武林冒暑过越访予山中因留半月别去
1222852,育王珙禅师示寂二纪屿上人回山中因寄塔主
222959,赵委顺寄诗山中因次韵
1028473,赵委顺寄诗山中因次韵
523838,秋日访王生山中因与携酒蹑峤探蛮王洞觏古刻遂逾岭造岘石而饮二十二韵
473550,王雅适久居金陵过访山中因赠
656945,萧宜冲见陈公甫于白沙胡宪副希仁隆礼下之海天空阔风日和畅招霞外布衣林缉熙何时矩李德孚辈更酬互答律倡吕和绰有雩下风致宜冲袖谒一峰山中因题其首曰海天吟弄并续貂焉以俟于诸君 其一
696148,萧宜冲见陈公甫于白沙胡宪副希仁隆礼下之海天空阔风日和畅招霞外布衣林缉熙何时矩李德孚辈更酬互答律倡吕和绰有雩下风致宜冲袖谒一峰山中因题其首曰海天吟弄并续貂焉以俟于诸君
574986,王郡公命善权僧访予山中因遣僧圆金驰谢
656946,萧宜冲见陈公甫于白沙胡宪副希仁隆礼下之海天空阔风日和畅招霞外布衣林缉熙何时矩李德孚辈更酬互答律倡吕和绰有雩下风致宜冲袖谒一峰山中因题其首曰海天吟弄并续貂焉以俟于诸君 其二
