123037,有叹·贫富交情乃见
80168,秋思·虚极静笃道乃见
573590,余尝游牛首从麓至巅幽胜应接不暇最后山僧引至一小山回观山面更觌全体因悟山内看山不如山外看山之旷窃持此法以搜洞胜乃择小阜筑室回向之一洞所有无不环列至瀑布在洞之上者两崖夹束翳以林霭一道水光隐约吞吐折而八洞始彰喷薄之全势而洞上之源游者向未之睹也推窗入目不觉大叫奇绝以为得未曾有譬诸西子之美不能自见其面对镜乃见之耳用前咏珠璧韵
812973,久闻听庵兄说西湖山水今乃见之感赋
209687,至楚约诸人饭而圣功不来翌旦乃见过
755374,久闻听庵兄说西湖山水今乃见之感赋 其二
295671,陈寥士见余所作辛夷花诗自宁没和韵见寄久乃见之奉酬一律
1046493,中秋待月夜分乃见
755373,久闻听庵兄说西湖山水今乃见之感赋 其一
888277,至楚约诸人饭而圣功不来翌旦乃见过
290064,绛都春·煮鹤有谈，玉溪所叹。不图怪事，乃见节园。并命伤雌，感音怨独，相怜素羽
441038,乙酉冬之鲁旅途口占 其一 正越郁庵二兄夜饮于杭，郁庵兄以手机短信示诗二句相问。晨起乃见，赘续二句酬之
419177,水调歌头 中秋夕，风雨中渡长江，过徐州乃见月
440423,同门志瑾学兄术精歧黄性好古籍学方有成数年内瘳难症者非鲜而不取一酬今有病友寄民初版秋水轩尺牍一卷而匿其名噫不图古贤之风乃见于浇漓之世用献诗一首以赞藏庋
889389,偶得数琉璃瓶置窗几间因取小鱼漾其中乃见其浮游自适感而有作
287475,水调歌头·中秋夕，风雨中渡长江，过徐州乃见月
139122,偶得数琉璃瓶置窗几间因取小鱼漾其中乃见其
467608,乙酉冬之鲁旅途口占 正越郁庵二兄夜饮于杭，郁庵兄以手机短信示诗二句相问。晨起乃见，赘续二句酬之
247561,卧楼数日乃见黄玉兰已开西府海棠盛极
440310,卧楼数日，乃见黄玉兰已开，西府海棠盛极
