593716,正月二日伍舍人朱计部谢侍御司考功见过张武库袁民部同集得东字
609502,送梁武库赴临洮 其一
480839,题戴武库山水图歌
607073,初冬项明父光禄招同施主客徐武库姚民部朱虞部宴集马家园时天雨忽霁乘月而还
113989,赠柳圣功·武库五兵森森
667008,送王令泉武库出守永州
61147,同阎开府浮檀鹿职方乾岳沈职方彦威杜武库培
672356,谢包武库过访
608584,梁武库经略河陇回
593555,送司武库奉使还江陵省觐
1253168,为剑为豪曹吴钩非宝刀鸣匣欲剸犀流星利吹毛尝闻武库灾穿壁径飞去勃勃芒砀云赤帝何由遇
128474,绿绮七咏·武库森严马政高
593528,送张武库巡延宁甘固诸边
526297,送郗武库元洪入京
110497,十绝·文昌武库九霄中
682517,送梁武库赴临洮
472110,同阎开府浮檀鹿职方乾岳沈职方彦威杜武库培亭孙司厅初阳袁山石自如刘关内如纶万广宁同予洎三大将军马沧渊王敬之尤定宇出宁远眺首山诸雄要马上用程幕韵
657960,送娄武库赞理白亚乡治水黄河
526342,云居送蔡武库赴南曹有怀故国
340533,临江仙·材刃纵横森武库
55733,题戴武库山水图歌
648045,送田郎中还南京武库
638567,题娄武库洪都东湖小楼
608639,赠刘武库玄子
1251049,为剑为豪曹吴钩非宝刀鸣匣欲剸犀流星利吹毛尝闻武库灾穿壁径飞去勃勃芒砀云赤帝何由遇 其二
597193,题何武库悔斋图
566212,武库员外薛侨持其侄左给事中薛宗恺柩归广州过吴门诗以哭之一首
239184,凝清香·公材如武库
1251048,为剑为豪曹吴钩非宝刀鸣匣欲剸犀流星利吹毛尝闻武库灾穿壁径飞去勃勃芒砀云赤帝何由遇 其一
333075,半山故宅·题诗武库至豪雄
638869,再次潘武库恩迎韵
557192,送刘武库使云中便道还楚
592074,送王武库定甫使金陵因还南昌展省
609503,送梁武库赴临洮 其二
