1004636,庆元丁巳十月奉亲如临安宿西菩寺表弟吴克仁俱焉 其二
1095615,雪中登西菩寺参寥旧居分月阁闻读书声
1023771,题于潜西菩兼山阁参寥受业
141342,宿西菩山明智寺诗
1095953,西菩寺三题 其一
1095954,西菩寺三题 其二
1095747,西菩中晖堂乃参寥辨才所居
1074711,道由于潜将游西菩问之路人则云过之已远
99678,与毛令方尉游西菩提寺
375700,西菩寺·本来无垢亦无尘
100254,游西菩寺·路转山腰足未移
99691,与毛令方尉游西菩寺
234184,庆元丁巳十月奉亲如临安宿西菩寺表弟吴克仁
1004637,庆元丁巳十月奉亲如临安宿西菩寺表弟吴克仁俱焉 其一
1129554,西菩寺三题
920703,与毛令方尉游西菩寺二首 其一
1116532,与毛令方尉游西菩寺二首
1128151,庆元丁巳十月奉亲如临安宿西菩寺表弟吴克仁俱焉
375247,西菩寺·蚤觉元龙不足豪
99679,与毛令方尉游西菩提寺·路转山腰足未移
903051,宿西菩山明智寺诗
1095955,西菩寺三题 其三
259468,西菩中晖堂乃参寥辨才所居
920704,与毛令方尉游西菩寺二首 其二
375246,西菩寺三题
