166665,雪夜詹伯尹周少隐见过置酒次伯尹韵
760075,满江红 越王台，次伯鲁韵
676521,奉次伯起有怀之作
1045795,次伯通云顶山长句韵
1143473,次伯机绝句
332286,春感次伯兄镜云韵
1029269,次伯仁过道傍田家韵
654400,塞上次伯氏
730981,次伯严九江舟中见寄韵
1052215,喜择之子文至桐江次伯兄韵
1081397,出郭次伯山韵
258226,次伯坚韵·公道向来惟白发
437840,次伯坚韵
400099,菩萨蛮 拟古四首次伯孝韵 其一
55171,游白塔寺次伯温刘先生韵
757073,到杨花津敬次伯氏
247863,菩萨蛮·拟古四首次伯孝韵
677215,元夕雨邀里中诸君小饮檀园灯下次伯氏韵
677216,十六日诸君载酒重集宝尊堂次伯氏韵
882982,慈溪道中次伯兄韵
1141740,浣溪沙 次伯机
400102,菩萨蛮 拟古四首次伯孝韵 其四
354962,喜择之子文至桐江次伯兄韵
1081396,王官谷夜归次伯山韵
956465,次伯安推官赠别韵
772681,月夜闻笛次伯卿韵
185797,次伯机绝句·梅天风雨一江寒
1029481,善利阁次伯仁所题赵子良画四首 其一
1235282,上京次伯庸学士韵二首
184197,慈溪道中次伯兄韵
1029479,善利阁次伯仁所题赵子良画四首 其四
791392,春感次伯兄镜云韵
61740,次伯兄高原望高台韵
136157,次伯舅汪运干所寄韵
1029480,善利阁次伯仁所题赵子良画四首 其二
1206389,次伯长待制韵送王继学修撰马伯庸应奉扈从上京二首 其二
654399,次伯兄高原望高台韵
906395,雪后詹伯尹周少隐见过置酒次伯尹韵
1236890,次伯长待制韵送王继学修撰马伯庸应奉扈从上京二首
344514,金栗寺四首次伯父韵
226680,次伯仁过道傍田家韵
1089397,欲雪怀度云新种梅三次伯晖韵
74985,次伯长待制韵送王继学修撰
85072,满江红越王台次伯鲁韵
646074,游白塔寺次伯温镏先生韵
1029445,次伯仁善利阁小室韵
1227807,上京次伯庸学士韵二首 其二
1029446,次伯量赠别诗韵
614881,秋夕同林元培曾元鲁集李伯襄宅次伯襄韵
677188,九日泛舟次伯氏韵时方从公路饮归
61741,塞上次伯氏
1029390,次伯仁善利阁
400100,菩萨蛮 拟古四首次伯孝韵 其二
226583,次伯量赠别诗韵
226679,次伯仁善利阁小室韵
344512,登云岫四首次伯父孝廉公韵
1071879,先大夫元丰间及进士第荣州伯父喜而赋诗宣和四年信道兄登科某时为著作郎侍立集英殿与观唱名未几信道兄调而归某谨次伯父韵以送之
1227806,上京次伯庸学士韵二首 其一
226678,次伯仁善利阁
355688,寒食次伯潜韵
843321,庚戌正月十四日游半山寺次伯严韵
404164,玉楼春·丁亥，一九四七年。次伯端韵
400101,菩萨蛮 拟古四首次伯孝韵 其三
1219216,赵千里聚扇上写山，次伯雨韵
1029348,善利阁次伯仁所题赵子良画四首 其三
342482,九日秦山次伯父孝廉公韵
401790,菩萨蛮 拟古四首次伯孝韵
1131545,善利阁次伯仁所题赵子良画四首
1224603,次伯长待制韵送王继学修撰马伯庸应奉扈从上京二首 其一
1089396,仇香种梅已开而出乡未归再次伯晖韵
122827,次伯安推官赠别韵
1027476,次伯舅汪运干所寄韵
1228147,次伯雨韵
1092192,寒食次伯潜韵
384344,奉次伯起有怀之作
226783,善利阁次伯仁所题赵子良画
636209,留别陈次伯用前韵
730732,书愤次伯远韵
