537783,王水部祠古柏
485158,次韵及禅师怀王水曹
167524,小秦王·水拍江堤没软沙
597628,吕梁夜过王水部
1040805,陪晏相公游韩王水硙园三首 其三
226197,輓王水监·庾岭梅千树
903329,酌道傍古松下钱王水对山绝顶微露塔尖闻有僧院名益钱
545569,暮秋望日同潘少逸蔡稚含夜集王水部宅
524167,九日浦江王水亭共泛二首 其二
1040804,陪晏相公游韩王水硙园三首 其二
746897,记钱武肃王水府告文银简
46798,次韵及禅师怀王水曹
634877,访何友大何左王水村因题其书楼
1131049,陪晏相公游韩王水硙园三首
454988,望海潮 呈业师王水照先生
1040803,陪晏相公游韩王水硙园三首 其一
544574,送王水部之钱塘
545608,王水部招集署中
140393,酌道傍古松下钱王水绝顶微露塔尖闻有僧院名
1032279,挽王水监
602412,过夏镇怀王水部奎章
455067,满庭芳 业师王水照先生八十华诞
388271,王水部祠古柏
545435,同王水部蔡祠部袁仪部集高比部正父邸中同赋兼送正父南还
524166,九日浦江王水亭共泛二首 其一
691732,九日浦江王水亭共泛二首
545614,再入武林柬王水部并怀蔡南宫
