585800,贰尹杨亦泉送行恋恋因念其旦旦勤事乎凤凰士民称之寓燕石作诗劳之
660013,雪湖自杭还辱示对雪见怀之作次韵二首奉答因致问劳之意 其一
660014,雪湖自杭还辱示对雪见怀之作次韵二首奉答因致问劳之意 其二
515615,闻绩溪高尹被奖劳之典
515834,归朝欢 漳守陈公洪谟有捕寇功膺奖劳之典僚属乞词以贺
972557,过丰城访甘叔异闻在曲江之矶头庵放舟过之棹未及弭迎劳之诗已至次韵上呈
1084499,十月二十八日母氏劬劳之日也哀痛中书二十八字
604434,自护城驿驰张桥时大雨雪舆从多冻人过响马铺市酒脯慰劳之遂止宿焉因歌苹泽之诗获我心矣偶成二律明日乃行则春二月朔也 其一
908277,马德骏微恙既平作此劳之
703051,雪湖自杭还辱示对雪见怀之作次韵二首奉答因致问劳之意
501361,情事未申视息宇内劬劳之旦哀痛倍深悲歌以继恸哭所谓情见乎辞云尔呈阎初阳天使牛士良典簿
690446,自护城驿驰张桥时大雨雪舆从多冻人过响马铺市酒脯慰劳之遂止宿焉因歌苹泽之诗获我心矣偶成二律明日乃行则春二月朔也
180194,马德骏微恙既平作此劳之
321499,十月二十八日母氏劬劳之日也哀痛中书二十八字
604435,自护城驿驰张桥时大雨雪舆从多冻人过响马铺市酒脯慰劳之遂止宿焉因歌苹泽之诗获我心矣偶成二律明日乃行则春二月朔也 其二
656107,诸生助移门楼诗以劳之
1048355,贾庆甫以局事乘小船犯风波感其危而为诗且以相示仆亦于舟字韵和呈其卒章盖言有俟以慰贤劳之叹也
655999,黄李四生习易小陂寒窗旬月间六经风雪赋此以劳之
