1204761,石州慢 送牛农师赴石州学正
1210754,徽州学正胡泳子游自京都来过予于维扬以士常中郎长诗见示又省掾王约彦博谓子游文笔有中州气象用是不敢以常书生遇之十月复会于杭且以乐府辱贶将拿舟归江东因作二十八字以赠
108216,信州学正·公论乾坤万古留
106102,送陈子振池州学正
1135266,送方仲和信州学正二首 其二
696800,赠孔止武横州学正
580776,送全州学正何汝和之任
650604,赠李彦安赴荆门州学正
650788,赠孔止武横州学正 其五
649866,送刘朝宗随州学正 其二
674746,送张司训爵擢同州学正
650503,赠刘校书赴沂州学正
1228781,送曾韫晖赴京任檀州学正
1143951,送方仲和信州学正二首
513658,送祁门周仲实赴赵州学正
1136270,送陈子振池州学正
650784,赠孔止武横州学正 其一
692483,送刘朝宗随州学正
1135295,送李际可婺源州学正
650785,赠孔止武横州学正 其二
650787,赠孔止武横州学正 其四
555129,题山水图送宋汝勤赴安州学正次刘学士韵
568963,永嘉朱叟去吾州学正后五十年而其邑人陈子继之庄秀才逊学后先获事焉乞余言为赠曰东嘉继美
516862,赠沈翥由仪部迁宿州学正
603646,别泗州学正王乡丈
1135267,送方仲和信州学正二首 其一
511593,送仲弟邦纪任通州学正
202086,送凌霁云赴馀姚州学正
1213275,丁亥清明东平寄二弟济州学正
1233739,送徐子贵南恩州学正
1234762,送胡秋白衢州学正
650786,赠孔止武横州学正 其三
562290,送陈楚宾赴泗州学正
978283,送凌霁云赴馀姚州学正
1246237,送赵元举之奉化州学正
106174,送李际可婺源州学正
1135343,送温州学正陈希静
108200,送温州学正陈希静
506484,送镏天锡校书之沂州学正
649865,送刘朝宗随州学正 其一
555145,挽钧州学正林菊庵先生
108215,送方仲和信州学正
