100881,朱寿昌郎中少不知母所在刺血写经求之五十年
973792,比见愚卿于庐陵出示杨谨仲诗卷中及其弟鲁卿问其所在云携琴往岳麓度夏今日见杨谨仲又云其弟卓卿近过此奉其母往游洪之西山回途游阁皂乃归尔余方困于道途有叹于其人作诗须到吉示愚卿及二君云
330336,石端若以朱丝栏见邀作而偶失所在久方得之喜而赋诗寄丁希韩因以见及遂申前志次韵
346616,瑶真诗·此花所在宜开馆
980439,三川言十数年前尝有一短帽骑驴之士半醉徘徊原上久之曰三川非昔时比矣恍惚失其人所在有收杜老醉游图者物色之知为杜之再来也予独鄙之作诗二首 其二
459269,出连云林场，所在已近主峰，万山丛碧间一小落耳
828612,十四岁除夕有句云「诗成两岁乘除里春在万家欢喜中」先师关季华先生极为叹赏以为他日立朝事业所在也今老矣一无所成感赋一绝
562348,赤城吕徽之博闻强识宋亡遂晦不仕一日大雪中至巨家易谷立堂下久之堂东偏众客方咏雪有分韵得蝶字者艾思不就徽之不觉失笑咸诘之曰汝何笑曰吾欲用滕王蛱蝶事耳众客皆惊阴知其为徽之也延之坐不可欲赒以谷辞既去使人尾之至其居地极幽阻及雪霁候焉荆扉竹屋不蔽风雨见桶中坐一妇人盖其妻也问徽之所在曰出捕鱼矣得于溪上具言所以来之意曰诸子可少留乃换酒共饮返宿道傍大楼下主人怪舆马之盛因言其状主人亦不知有徽之也明日求之则已迁居矣徽之
25694,我思何所在
773747,初至凤山即访小琉球所在以海道险阻不能至
936574,唐长庆中南池新亭碑在汉高帝庙侧亭已失所在矣
854993,王治中招余饮丹阳刘公雪苑英公在座主人俾余坐中席僧居左道居右众宾列坐两傍曰道之所在也余敢当此哉为诗以谢之
932863,青城大面山中有二隐士一曰谯先生定字天授建炎初以经行召至扬州欲留之讲筵不可拜通直郎直秘阁致仕今百三十馀岁巢居崄绝人不能到而先生数年辄一出至山前人有见之者其一曰姚太尉平仲字希晏靖康初在围城中夜将死士攻贼营不利骑骏骡逸去建炎初所在揭榜以观察使召之竟不出淳熙甲午乙未间乃或见之于丈人观道院亦年近九十紫髯长委地喜作草书盖皆得道于山中云偶成五字二首托上官道人寄之 其一 寄谯先生
170580,仁者无敌·仁人所在人心萃
274259,吊严陵·三十年前过富春江，严子陵钓台所在也
1117659,青城大面山中有二隐士一曰谯先生定字天授建炎初以经行召至扬州欲留之讲筵不可拜通直郎直秘阁致仕今百三十馀岁巢居崄绝人不能到而先生数年辄一出至山前人有见之者其一曰姚太尉平仲字希晏靖康初在围城中夜将死士攻贼营不利骑骏骡逸去建炎初所在揭榜以观察使召之竟不出淳熙甲午乙未间乃或见之于丈人观道院亦年近九十紫髯长委地喜作草书盖皆得道于山中云偶成五字二首托上官道人寄之 寄谯先生
53021,曾寻落雁峰不知所在疑即南峰异名至此见峰因
436763,岁己酉春正月十有一日吾友张君汉臣下世家贫不能葬乡邻办丧事诸君皆有吊章且邀余同赋每一忖思辄神情错乱秉笔复罢今忽四旬矣欲绝不言无以表其哀因作古意四篇虽比兴之不足观者足知予志之所在则进知吾汉臣也无疑
483506,曾寻落雁峰不知所在疑即南峰异名至此见峰因而思峰
1029106,游宦十年于外归自浙东睹西山先茔周围林木气象大非昔比盖缘藩篱既彻本家樵采不以时外人侵盗复无禁理势固应尔也今春忧居遂协谋兄弟效先君旧来规模创夹篱界庶外人知吾辈用意所在有所忌惮不肆侵盗而本家樵采亦有时云耳因以诗识岁月
708659,昼夜乐•亡妇遗钗，有火珠一颗。今失所在，怅然赋此
1057527,晋之太博同舍常怆六世外祖郑氏苗裔中绝曩访得丘墓所在岁时享祀不辍乡里化之因有诗纪其事谋弇属和云
920472,朱寿昌郎中，少不知母所在，刺血写经，求之五十年，去岁得之蜀中。以诗贺之
334243,潮州木龟有堂旧在天庆观北极殿之左近为道流窃取而去今莫知所在矣
1140539,扬州后土庙琼花香如莲花落不著地丙子一夕大雷雨失花所在相传以为上天云
436085,岁己酉春正月十有一日吾友张君汉臣下世家贫不能葬乡邻办丧事诸君皆有吊章且邀余同赋每一忖思辄神情错乱秉笔复罢今忽四旬矣欲绝不言无以表其哀因作古意四篇虽比兴之不足观者足知予志之所在则进知吾汉臣也无疑 其一
464530,汉宫春 游西林公园，即广西大学所在地
382783,雪中济南道上携张就山同行忽失所在诗以觅之
1068167,潮州木龟有堂旧在天庆观北极殿之左近为道流窃取而去今莫知所在矣
436087,岁己酉春正月十有一日吾友张君汉臣下世家贫不能葬乡邻办丧事诸君皆有吊章且邀余同赋每一忖思辄神情错乱秉笔复罢今忽四旬矣欲绝不言无以表其哀因作古意四篇虽比兴之不足观者足知予志之所在则进知吾汉臣也无疑 其三
436088,岁己酉春正月十有一日吾友张君汉臣下世家贫不能葬乡邻办丧事诸君皆有吊章且邀余同赋每一忖思辄神情错乱秉笔复罢今忽四旬矣欲绝不言无以表其哀因作古意四篇虽比兴之不足观者足知予志之所在则进知吾汉臣也无疑 其四
383884,寄远·青楼何所在
641339,梦尚之彦强来问病源所在随以数语答之及觉忘记其辞因成一诗遍寄昆山学诸生且因自警云尔
739951,黛流村新营所在
82268,唐长庆中南池新亭碑在汉高帝庙侧亭已失所在
1037266,青城大面山中有二隐士一曰谯先生定字天授建炎初以经行召至扬州欲留之讲筵不可拜通直郎直秘阁致仕今百三十馀岁巢居崄绝人不能到而先生数年辄一出至山前人有见之者其一曰姚太尉平仲字希晏靖康初在围城中夜将死士攻贼营不利骑骏骡逸去建炎初所在揭榜以观察使召之竟不出淳熙甲午乙未间乃或见之于丈人观道院亦年近九十紫髯长委地喜作草书盖皆得道于山中云偶成五字二首托上官道人寄之 其二 寄姚太尉
517036,庚辰苦雨谣时五月至六月阴雨兼旬所在禾苗浸没殆尽忧民感时殊无好况不能措一辞以写闷六日仅得片时晴霁七日又雨为作此谣
980440,三川言十数年前尝有一短帽骑驴之士半醉徘徊原上久之曰三川非昔时比矣恍惚失其人所在有收杜老醉游图者物色之知为杜之再来也予独鄙之作诗二首 其一
1125222,三川言十数年前尝有一短帽骑驴之士半醉徘徊原上久之曰三川非昔时比矣恍惚失其人所在有收杜老醉游图者物色之知为杜之再来也予独鄙之作诗二首
1055530,石端若以朱丝栏见邀作而偶失所在久方得之喜而赋诗寄丁希韩因以见及遂申前志次韵
826257,扫花游·民国十五六年，余卜居圣湖之滨。每来往孤山，见道侧孙花翁墓埋没蓬颗间，心焉伤之，拟为修葺，未果也。旋闻湖滨筑路，墓将被毁，方商之周湘舲，谋迁葬，得易大岸自杭急札，云墓已毁。湘舲立遣人往杭道地，则仅得束棺之铁及石碣、石案诸物，棺椁则云已化尽。湘舲乃与刘翰怡筑冢于道左高阜，表曰宋词人孙花翁墓，树石案于前，实则遗骼已莫知所在矣。方事之殷，大岸为图纪之，且题词甚悲，久存余所。越十余载，余避兵香港，大
499730,庐陵□□寺僧玉鉴之母因乱流离不知所在玉鉴思念不已语及辄流涕乃白佛愿长斋十年卖药以资道里之费求母所在越数月遽得母书而奔走奉迎以归甘旨无不具呜呼岂非墨名儒行至孝而感鬼神也哉庐陵之能文者叙其事余亦喜而作诗题其后
499730,庐陵□□寺僧玉鉴之母因乱流离不知所在玉鉴思念不已语及辄流涕乃白佛愿长斋十年卖药以资道里之费求母所在越数月遽得母书而奔走奉迎以归甘旨无不具呜呼岂非墨名儒行至孝而感鬼神也哉庐陵之能文者叙其事余亦喜而作诗题其后
23215,闲题·男儿所在即为家
547385,雪中济南道上携张就山同行忽失所在诗以觅之
656182,陆主事紫微庵先陇所在
438754,京叔将拜埽于陈徵言为赠老懒废学茫无所得独记其与屏山云卿襟期所在者非以为诗也
1171737,我思何所在
436086,岁己酉春正月十有一日吾友张君汉臣下世家贫不能葬乡邻办丧事诸君皆有吊章且邀余同赋每一忖思辄神情错乱秉笔复罢今忽四旬矣欲绝不言无以表其哀因作古意四篇虽比兴之不足观者足知予志之所在则进知吾汉臣也无疑 其二
899540,甘州/八声甘州 赋众芳所在
247044,自寻·忽失我所在
102139,悼侍儿·兰质蕙心何所在
756507,舟泊汉阳凭栏眺望问鹦鹉洲所在乡人云久已不可问矣愁对烟波漫成近体
