694085,仝许今喜冯载赓杜元洲郑圣符诸人酌郡寓别后有赋
1079716,与宁陵叔弟别后有怀兼寄赵才仲二首 其二
751042,刘农伯过访静公适至谈论甚快别后有诗见寄依韵答和
286567,访梁节庵前辈于岁寒堂别后有作
1070418,别后有怀子我追用巾字韵作寄
438092,别后有怀元济
494873,别后有怀甘泉洞兼呈板筑诸君 其五
250518,辛卯仲夏景秀兄过素涛阁小聚别后有诗见寄步韵以答
654930,和鸣治别后有怀韵
54887,诸广文饯予龙潭僧舍别后有怀味苓
624335,仝许今喜冯载赓杜元洲郑圣符诸人酌郡寓别后有赋 其一
494872,别后有怀甘泉洞兼呈板筑诸君 其四
494870,别后有怀甘泉洞兼呈板筑诸君 其二
547856,寄吴少溪宫录七十 其五十二 平阴徐南龙令君夜邀别后有诗见寄赋此酬谢
635019,王暖村慧则兄同赴梁王顾观梅之约予拟偕行不果别后有怀
479677,诸广文饯予龙潭僧舍别后有怀味苓
753175,访梁洁盦前辈于岁寒堂别后有作 其一
494598,元默别后有怀
663900,别后有怀石峰
1079715,与宁陵叔弟别后有怀兼寄赵才仲二首 其一
607056,姚巽卿过留小酌别后有作答和
338917,刘农伯过访静公适至谈论甚快别后有诗见寄依韵答和
970958,与庆伯广声别后有怀 其二
388013,别后有怀冲默道人前韵
355780,别后有怀子我追用巾字韵作寄
511115,杨敷别后有怀 其一
514026,饮孙挥使家别后有作
585557,何古林别后有怀用前韵
713160,长洲张宗肃见访别后有诗次韵奉答
604009,席上逢梁生别后有怀同鉴清见婴两弟赋
494871,别后有怀甘泉洞兼呈板筑诸君 其三
596578,同云都何龙川至南京会令叔紫坛宴留叙旧别后有怀
383113,平阴徐南龙令君夜邀别后有诗见寄赋此酬谢
494869,别后有怀甘泉洞兼呈板筑诸君 其一
801324,秋日曹秋岳先生过饮桐溪草堂别后有作
653807,平湖吴伯谐大尹见过别后有寄
286561,访梁洁盦前辈于岁寒堂别后有作
694319,杨敷别后有怀
972172,与成父别后有怀
598427,别后有怀冲默道人前韵
730897,访梁节庵前辈于岁寒堂别后有作
98390,与成父别后有怀
470811,素英还吴门别后有忆重赋长句请牧翁同作
702147,别后有怀甘泉洞兼呈板筑诸君
98468,与庆伯广声别后有怀
1058173,与刘羲仲检讨别后有怀
970957,与庆伯广声别后有怀 其一
789664,许公还过访别后有寄
711769,叶世颖重之中湘茅屋别后有寄
202916,梅花韵·孤山别后有谁邻
452311,辛卯仲夏景秀兄过素涛阁小聚别后有诗见寄步韵以答
328719,与宁陵叔弟别后有怀兼寄赵才仲
511116,杨敷别后有怀 其二
741061,东岩别后有忆
1124127,与庆伯广声别后有怀
1109891,与宁陵叔弟别后有怀兼寄赵才仲二首
63977,素英还吴门别后有忆
624336,仝许今喜冯载赓杜元洲郑圣符诸人酌郡寓别后有赋 其二
