830829,莫君楚生以吾家绣谷老人药园诗稿见示用族祖瓯亭翁于京师重获瓶花斋旧藏丁卯集得长律三首韵酬之 其一
402812,琵琶仙 小檀栾室藏王渊雅夫妇合书赤壁前后赋卷子，款署乾隆甲子上元日书于京师楞伽山房属题
384887,朱石翘比部书来，述夏间病于京邸，赖胡镜舫大令待铨在京
1095696,佛眼侍者祖元血书华严八十卷以报母细而楷花石纲初得之藏诸塔寺后复失之复得之于京师
655119,和于京兆景瞻金山八诗 其四 拟赋重游金山
455476,一萼红癸未立秋，关东震宇雨中来访，清谈于城南窑台茶院廊下。昔于京西君曾得句：凭栏不向燕台望，骏骨千斤价亦轻。重来已近十载，感有此赋
550304,送卢德水漕使于京口
119306,张惕山人即昔所谓惠思师也余旧识之於京师忽
1117158,张惕山人即昔所谓惠思师也余旧识之于京师忽来相访茫然不复省徐自言其故戏作二小诗赠之
830830,莫君楚生以吾家绣谷老人药园诗稿见示用族祖瓯亭翁于京师重获瓶花斋旧藏丁卯集得长律三首韵酬之 其二
655123,和于京兆景瞻金山八诗 其八
1203520,满庭芳 于京兆府学正来彦中处觅墨
553408,吾乡富友文擢顺庆府同知三年升保宁府知府以七十致仕顺庆经历陈暹会予于京师言其事喜诗赋之 其一
375996,算命仙于京城的箴言
760745,揭阳林虞笙孝廉得砚十二方于京口，背缩镌周石鼓文者四、汉碑者八，盖百砚斋故物也，拓本见示，为题册端
702283,吾乡富友文擢顺庆府同知三年升保宁府知府以七十致仕顺庆经历陈暹会予于京师言其事喜诗赋之
514712,鸡鸣山上小酌与汪庶子于京兆联句
1041878,杨子寺送彦猷阁老去年四月某别彦猷于京师到今适期年矣
655121,和于京兆景瞻金山八诗 其六
839465,老友浦玉圃兄，以山东知县殁于京邸，旅榇归，囊无常物，忆向日诗酒缱绻，哀其人，悲其遇，作挽诗三章以言情 其二
794916,菩萨蛮  三月初七寄瑟庵于京师
7550,奉赠鲜于京兆二十韵
366514,杨子寺送彦猷阁老去年四月某别彦猷于京师到今适期年矣
839464,老友浦玉圃兄，以山东知县殁于京邸，旅榇归，囊无常物，忆向日诗酒缱绻，哀其人，悲其遇，作挽诗三章以言情 其一
390103,九月初二日奉神宗显皇帝遗诏于京口成服哭临恭赋挽词
839466,老友浦玉圃兄，以山东知县殁于京邸，旅榇归，囊无常物，忆向日诗酒缱绻，哀其人，悲其遇，作挽诗三章以言情 其三
655116,和于京兆景瞻金山八诗 其一
830831,莫君楚生以吾家绣谷老人药园诗稿见示用族祖瓯亭翁于京师重获瓶花斋旧藏丁卯集得长律三首韵酬之 其三
789309,同长沙冢宰蒙古司寇陈侍郎璧左京堂孝同于京堂式枚张观察鹤龄置酒龙树寺祝广雅尚书生日
515426,出清波门过净慈寺饮于京兆先祠庵
655120,和于京兆景瞻金山八诗 其五
655117,和于京兆景瞻金山八诗 其二 重游金山阻雨不果
698241,和于京兆景瞻金山八诗
117926,张惕山人即昔所谓惠思师也余旧识之于京师忽
655118,和于京兆景瞻金山八诗 其三
924674,张惕山人即昔所谓惠思师也余旧识之于京师忽来相访茫然不复省徐自言其故戏作二小诗赠之 其一
1062929,元祐中先人将漕淮南与长乐林旦次中为僚其子硕儒肤与余游相好也后三十五年复相见于京师道旧涕泪已而复遣其爱子薿见过仍辱赠诗叙畴昔之好次其韵答之
843869,莫君楚生以吾家绣谷老人药园诗稿见示用族祖瓯亭翁于京师重获瓶花斋旧藏丁卯集得长律三首韵酬之
503537,行次淮安甘蔗因悼同门友被谴没于京
1063737,蔡老有志好学识面于京师作此示之
263185,老友浦玉圃兄以山东知县殁于京邸
1051557,张惕山人即昔所谓惠思师也余旧识之于京师忽来相访茫然不复省徐自言其故戏作二小诗赠之 其二
655124,送于京兆奏绩南还用其留别诗韵
507762,题萧于京卷
1173779,奉赠鲜于京兆二十韵
645004,题刘于京行乐图
783744,丁卯秋试遇蓟州蒋力斋先生于京邸
789329,广雅尚书招宝侍讲熙朱侍读福诜樊按察增祥于京卿式枚沈编修曾桐作重九于天宁寺塔射山房沈后至作此戏之
655122,和于京兆景瞻金山八诗 其七
778202,金缕曲·沈日初比部以尊公菊庐先生醉菊遗图索句。忆曩在归云堂醉白池时，与先生相见，册中诸老大半与光殷勤奖借。光初昏时，研北丈为词以贺，紫眉丈尝为光模印，桐君鸿甫小田朗如诸老皆屡同觞咏，芝房贳甫又同时睥睨者。今风流歇绝，展卷怃然。同治癸酉与日初聚于京师，追次研丈词韵，勉成一阕，不觉感慨系之也
988377,桐庐员外出勋德之门以儒素为业泊来仪于京阙久飞誉于缙绅今则膺凤诏于朝端奏牛刀于江表会承旨尚书赋琼章于丹地饯兰棹于清流愚虽不才敢继其作
897040,陈履常惠诗有曾门一老之句不肖二十五岁谒见南丰舍人于山阳始一书而褒与过宜阳有同途至亳之约耒以病不能如期后八年始遇公于京师南丰门人惟君一人而已感旧慨叹因成鄙句愿勿他示
553409,吾乡富友文擢顺庆府同知三年升保宁府知府以七十致仕顺庆经历陈暹会予于京师言其事喜诗赋之 其二
453082,岁暮欣逢微吟、束龙二兄于京，畅叙古今，至夜深而不觉。蒙微吟寄诗，亦依韵奉和，兼及席间所论中美之事
843573,老友浦玉圃兄，以山东知县殁于京邸，旅榇归，囊无常物，忆向日诗酒缱绻，哀其人，悲其遇，作挽诗三章以言情
