939121,永邑杨君鉴子明辟斋读书将从事于古人为己之学求斋名于予并欲得一语以示为学之方予谓学虽多端而其要莫先于明善所以子思孟子俱以此开道后学大学格物之训实同出一源故因杨君之请扁以明善且诗以演其义幸毋忽其言之陋云
157399,赵观察作斋名烟艇孙耘老作唐律相邀同赋乃次
807021,后庭宴  春日同仲震过谯岩先生斋看牡丹  斋名壶天
1095370,内相洪容斋名诸孙华亭少府曰可斋
1001213,李商叟秀才求斋名于王元渤以养源名之求诗 其二
879083,西江月 腰痛，旧传陈复斋名方，岁久失之
938871,赵观察作斋名烟艇孙耘老作唐律相邀同赋乃次其韵
889640,臻公释氏之秀者浮游徜徉迹接天下乃者归卧云山闭门不出遂命斋名曰戏鲸真得古惠师之遗趣也予喜其志因留二十韵以赠之
1127698,李商叟秀才求斋名于王元渤以养源名之求诗
941293,萧季贤有斋名雪涧求鄙语置诸贤之后勉成四韵
1001214,李商叟秀才求斋名于王元渤以养源名之求诗 其三
1070689,稚山运使作斋名藏晖且觅诗久不能成今兹以大农召行有日因成鄙句并以送行
622499,己巳读书佳山水王季重禹穴斋名也季重入都徵诗于余即以此意赠之山水果佳应知我言
238228,见杨诚斋·名高身又贵
136492,赠秦止斋·名显不如晦
179845,题宇文叔昭阅斋名予所榜也有王正卿画四时小
185013,李商叟秀才求斋名于王元渤以养源名之求诗
908511,题宇文叔昭阅斋斋名予所榜也有王正卿画四时小景
1001215,李商叟秀才求斋名于王元渤以养源名之求诗 其一
1084628,书院挂额展筵雅会也戏集诸堂轩斋名作诗
162580,萧季贤有斋名雪涧求鄙语置诸贤之后勉成四韵
