1085846,寇莱公取韦苏州野渡无人舟自横之句增为十字见于曾南丰所作公传则知前辈作诗一言一句皆有来历予用其说为巴东词记有新进士作诗云语当人意为佳句何与韦郎野渡舟用其以解嘲
588374,己酉岁壬辰之夜梦与三洲李丈登高台遥望中原但见齐州九点在苍霭中隐隐可辨三洲曰宇宙内事吾儒分内事也曰子知分内之事则知尽分内之道乎三洲又曰吾今乃知居高则明处下则塞曰子知明塞之义则知尽居处之道矣三洲又曰天地山河存乎两界秦晋为首闽越为尾馀皆毛发肢节也曰子通督任之义则知通致理之源矣须臾云霞四歛皎日照衣环顾太和万物融合浑为一丸三洲曰此所谓弄丸者耶曰子知转九之义则宇宙之柄在手矣语罢而觉遂赋四章以纪其事因以赠三洲之
588374,己酉岁壬辰之夜梦与三洲李丈登高台遥望中原但见齐州九点在苍霭中隐隐可辨三洲曰宇宙内事吾儒分内事也曰子知分内之事则知尽分内之道乎三洲又曰吾今乃知居高则明处下则塞曰子知明塞之义则知尽居处之道矣三洲又曰天地山河存乎两界秦晋为首闽越为尾馀皆毛发肢节也曰子通督任之义则知通致理之源矣须臾云霞四歛皎日照衣环顾太和万物融合浑为一丸三洲曰此所谓弄丸者耶曰子知转九之义则宇宙之柄在手矣语罢而觉遂赋四章以纪其事因以赠三洲之
588374,己酉岁壬辰之夜梦与三洲李丈登高台遥望中原但见齐州九点在苍霭中隐隐可辨三洲曰宇宙内事吾儒分内事也曰子知分内之事则知尽分内之道乎三洲又曰吾今乃知居高则明处下则塞曰子知明塞之义则知尽居处之道矣三洲又曰天地山河存乎两界秦晋为首闽越为尾馀皆毛发肢节也曰子通督任之义则知通致理之源矣须臾云霞四歛皎日照衣环顾太和万物融合浑为一丸三洲曰此所谓弄丸者耶曰子知转九之义则宇宙之柄在手矣语罢而觉遂赋四章以纪其事因以赠三洲之
958491,家旁有庙其巫每岁旦必鸣角作法以觞其神邻里闻角声则知其将晓矣
1210656,张提刑向尹大兴天子以二海青宠锡之未几拜兹命则知睿眷之有在也于其行作诗以勉之
