506429,应诏赴北京
859435,夜梦与和甫别如赴北京时和甫作诗觉而有作因寄纯甫
6648,赴北庭度陇思家
648198,十月十六日侍从赴北京出江东门
47219,送王检校珣赴北平
762609,送筱岫赴北闱，兼寄王文在秋曹
1164659,发临洮将赴北庭留别
6434,发临洮将赴北庭留别
493474,至容州将赴北流闻陆川道梗题绣江亭
260652,早赴北宫·苍龙双阙郁层云
1211871,余与观志能俱以公事赴北舟至梁山泊时荷花盛开风雨大至舟不相接遂泊芦苇中余折芦一叶题诗其上寄志能
202569,送任子敏司丞赴北
439209,早赴北宫
649421,送中书舍人陈彝训赴北京 其三
634145,送张稚公赴北雍
10288,送房元直赴北京
1163807,送房元直赴北京
649419,送中书舍人陈彝训赴北京 其一
507824,送周编修考满赴北二首 其一
1206395,袁伯长侍讲伯生伯庸二待制同赴北都却还夜宿联句归以示予次韵效体发三贤一笑
609163,送黄公绍博士赴北雍
648691,送徐提点被召赴北京
1215809,题王元善赴北清江新雁图
649420,送中书舍人陈彝训赴北京 其二
484881,送王检校珣赴北平
1216109,送邹鲁望赴北流令
1141089,送任子敏司丞赴北
649456,负愆同蹇尚书金正字赴北京早发江东门
216148,夜梦与和甫别如赴北京时和甫作诗觉而有作因
663564,白岩将赴北山供祀奉呈
1244736,送友晓发赴北
494277,送葛两溪大理赴北
305981,丁亥早春从南京飞赴北平
653055,送吴广文起复赴北京
661051,送王瓯滨赴北监便道归省
692358,送中书舍人陈彝训赴北京
126219,送王伯初学士赴北京机宜
691411,送周编修考满赴北二首
414966,丁亥早春从南京飞赴北平
507826,送胡御史迁评事考满赴北
507865,召赴北京留别灵谷定岩戒上人
656802,送韩司马文赴北为大司徒
507825,送周编修考满赴北二首 其二
927154,送王伯初学士赴北京机宜
455955,端午赴北校区办事
