1253109,山居七咏题画送周伯阳 游仙顶
647843,题画送陈孟敷
552517,题画送陈驿丞 其一
521713,题画送陈子进教谕贵池
553360,题画送人归越中
560641,题画送□九方
514377,题画送敏聪弟还河间
648818,题画送欧阳广哲
560599,题画送周文叙之融县丞
671492,题画送江夏相公予告
1248545,山居七咏题画送周伯阳 其二 白石坞
667431,题画送同年高颖之册封黄州
552518,题画送陈驿丞 其二
508988,题画送姜惟寅
671543,题画送徐虞求京兆入觐
521325,题画送夏时臣尹龙游
1248544,山居七咏题画送周伯阳 其一 游仙顶
521714,题画送祁通判朝明年正月时宦瑾伏诛海内拭目以观新化
677072,娄江舟中题画送王平仲游南雍
693548,题画送胡仁夫
677321,题画送平仲
574429,题画送胡仁夫 其二
521712,题画送都指挥袁君归河间
574428,题画送胡仁夫 其一
1248550,山居七咏题画送周伯阳 其七 月潭
563195,题画送人归江西
521210,题画送李大尹
648697,题画送陈景茂归金华
384582,题画送钱德夫南还
677293,题画送无际
1248549,山居七咏题画送周伯阳 其六 泠坟
677311,题画送郑彦逸之西湖
514860,题画送金宗德还吴中
696539,题画送陈驿丞
563207,题画送王幼度计偕
649693,题画送韩御史旸归省 其二
521705,题画送王贰守入京
652813,题画送陈孝廉谦还吴
660868,为杨显祖题画送尹别驾实大之嘉兴
671503,题画送魏廓园被谪南还
671522,题画送高硁斋太仆东归
668245,题画送钱德夫南还
692441,题画送韩御史旸归省
649692,题画送韩御史旸归省 其一
1248548,山居七咏题画送周伯阳 其五 九曲山
554019,题画送王服周宰广济
563206,题画送原孚侄巡齐
681424,题画送人还苏州
508975,题画送姜惟寅
521138,题画送胡友松
511660,题画送陈公辅归毗陵
1248547,山居七咏题画送周伯阳 其四 昆仑山
1248546,山居七咏题画送周伯阳 其三 茅坞
