491961,过李黄罗茅堂五首柬克正茂才 其一
205203,次韵酬李黄山
690454,伏日招同李黄陈三广文汎集改席恰受航对月
365600,海行杂感·青李黄甘烂熳堆
491965,过李黄罗茅堂五首柬克正茂才 其五
654685,送李黄门孟旸使占城
686980,过李黄罗茅堂五首柬克正茂才
657608,李黄门琼林燕归图 其二
581743,夜饮李黄门第以技马较胜负约五负者罚诗一首予数负赋此呈同饮诸公
849127,次韵酬李黄山
242768,次韵李黄州淮伟观
383717,正月十五日李黄羽司理行部过访
491964,过李黄罗茅堂五首柬克正茂才 其四
585215,谢李黄门见招不赴
657607,李黄门琼林燕归图 其一
253369,野堂·绿李黄梅绕屋疏
511009,近升宪副翁公以占城国主自海南来省过白沙索和李黄门诸公韵
604460,伏日招同李黄陈三广文汎集改席恰受航对月 其一
491963,过李黄罗茅堂五首柬克正茂才 其三
252695,望海潮·李黄大工杜口回忆
514799,送李黄门孟阳出使占城
604461,伏日招同李黄陈三广文汎集改席恰受航对月 其二
687863,李黄门琼林燕归图
592092,九日同黎秘书李黄门吴冯二侍御登宣武门楼
547817,寄吴少溪宫录七十 其十三 正月十五日李黄羽司理行部过访
491962,过李黄罗茅堂五首柬克正茂才 其二
884079,次韵李黄州江淮伟观
