381305,闰二月十日中照以微疾卒于沪寝偕景垂自青岛航海十八日到沪
894476,二月社日到都门见花卉初发
585033,春日到农家
101656,冬日到泉郡次九龙江与诸公唱和十三韵
1053798,兄长舟次会稽以十月九日发书清江亲故以此日遣使仍以十一月十二日同到去岁会稽书清江人亦同日到尝有诗记其事
863663,淳化二年八月晦日夜梦于上前赋诗既寤唯省一句云九日山州见菊花间一日有商于贰车之命实以十月三日到郡重阳已过残菊尚多意梦已徵矣今忽然一岁又逼登高追续前诗句因成四韵
861210,九月二十九日到思溪庄避人事十月初四日过生朝方归初三日早恕子遣人来送酒食并词二阕因成唐律二首 其一
167674,立春·山城历日到每迟
131179,十月十二日到慈云见去岁与龄叟诗因次韵
171371,元日到湖上·勋业须年少
349503,九日到通州过王铁珊芝祥故宅无片瓦
583193,全椒县一日到滁州次日十一月朔至来安县又至日至灵居寺宿有寺属六合县
1071041,赵丞相过藤州相从累日因言在朝与诸史官会话论修史事恐它时不免南行坐有一士云若有此某当从行今日到此音问也不通退作小诗
169931,春日到小园·屹立虚亭跨野塘
699801,赋得元日到人日未有不阴时二首
859910,二月十六日到仙水未第前屡得梦
802414,九日到通州过王铁珊芝祥故宅无片瓦
379023,宿石霜山前庄梦拜普贤像明日到院见壁间画如所梦有作
321709,宿王家村·扁舟何日到夔州
1132478,中运使寄酒清明日到以诗谢之
327135,到袁州·马蹄今日到袁州
927299,二十日到城中见交旧
1147644,冬日到泉郡次九龙江与诸公唱和十三韵
279764,中秋旅夜·故乡何日到
827949,四月十五日田伏侯同年约崇效寺看牡丹予晨往主客皆未集次日晤李猛庵丈言是日到最后席散客已尽矣独坐成咏因忆昔与半塘老人来游恰亦四月十五日感怀三首予因和之 其三
1119864,正月二十四日到梅山二首
849308,元日到湖上
944978,正月四日到张车偶成
452028,读天放诗知其生日到次韵为贺
114594,次韵宋懋宗三月十四日到西池都人盛观翰林公
161048,舟行过白石见将使夜宿毛家林翌日到
126205,天宫小阁·夏日到天宫
829446,四月十五日田伏侯同年约崇效寺看牡丹予晨往主客皆未集次日晤李猛庵丈言是日到最后席散客已尽矣独坐成咏因忆昔与半塘老人来游恰亦四月十五日感怀三首予因和之
493377,余留宣溪旷氏几半月于别也承惟宁惟南伯仲率诸客送余江浒停舟赋诗眷眷有留恋之意明日到流江书此寄谢
1064258,宿石霜山前庄梦拜普贤像明日到院见壁间画如所梦有作
324057,舟中作·昨日到今日
167186,言怀·奉溪半日到杭城
109440,中运使寄酒清明日到以诗谢之
169930,春日到小园·东郊无地不苍苍
1092184,三月九日祁阳舟中闻鹃忆去年此日到衡阳有感
184041,某两使辽塞俱值郊礼之岁今以至日到北帐感事
944975,正月二十四日到梅山二首 其二
493376,余留宣溪旷氏几半月于别也承惟宁惟南伯仲率诸客送余江浒停舟赋诗眷眷有留恋之意明日到流江书此寄谢
241857,破虏凯歌·捷书日日到甘泉
861592,舟行过白石见将使夜宿毛家林翌日到?莪却回和清老
1216137,二月廿六日到会稽明日代祀南镇题飞流亭
889037,余以前年五月八日到官今年又于此日去郡同僚作饯即席援笔言别
124047,除夕作·四十九年今日到
92207,赏梅偶成·日到青宫分外长
1216136,二月廿六日到会稽
1085613,予自鄂渚登舟近两旬得顺风才二日耳高牙遇风雨留两日既而得顺风过八叠江流迂曲疾徐相半二十六日风驶甚方快之谓公安可一日到也明日如故江与风背浪汹涌停舟不行复用前韵
385101,柬李东琪·闻君昨日到长安
80458,七月十日到故山削瓜瀹茗翛然自适
884410,戊辰元日到南华诗
827948,四月十五日田伏侯同年约崇效寺看牡丹予晨往主客皆未集次日晤李猛庵丈言是日到最后席散客已尽矣独坐成咏因忆昔与半塘老人来游恰亦四月十五日感怀三首予因和之 其二
551560,冬日到山家
153748,春歌·山人昨日到
1106426,九月二十九日到思溪庄避人事十月初四日过生朝方归初三日早恕子遣人来送酒食并词二阕因成唐律二首
150747,出闽中·山行十日到吾家
204119,二月十六日到仙水未第前屡梦
58956,姑苏怀古·看山几日到吴
1218501,冬至前一日到游源及归知元善亦自彼回途中遇风不得相近偶成
825826,闰二月十日中照以微疾卒于沪寝偕景垂自青岛航海十八日到沪
923381,某两使辽塞俱值郊礼之岁今以至日到北帐感事言怀寄呈同馆诸公
1119197,春日到小园
163916,重九前一日到家
1090631,七月三日到镇江欲过金山始登舟暴风雷雨忽大作泊抵寺岸则少霁矣回舟晚晴却遇便风
772551,春日到弘法寺
125215,上春晦日到西湖呈转运叔文学士
250366,读天放诗知其生日到次韵为贺
217876,晋阴山庙·相君一日到郊坰
160899,九月二十九日到思溪庄避人事十月初四日过生
285175,一九四九年六月十六日夜自杭出发，二十四日到山东坊子，又旬日挈儿子南归
996041,次韵宋懋宗三月十四日到西池都人盛观翰林公出遨
208820,戊辰元日到南华诗
342801,去年今日·去年今日到宣州
940664,春日到小园 其二
139326,余以前年五月八日到官今年又于此日去郡同僚
412761,一九四九年六月十六日夜自杭出发，二十四日到山东坊子，又旬日挈儿子南归
125122,皇帝阁·阳和今日到
126760,二十日到城中见交旧
132475,南湖遣兴·朝回日日到南湖
355750,三月九日祁阳舟中闻鹃忆去年此日到衡阳有感
191305,戏书·去年今日到湖州
940663,春日到小园 其一
1216848,清明日到陈庄
1003642,重九前一日到家
944893,十月十二日到慈云见去岁与龄叟诗因次韵
930384,七月十日到故山削瓜瀹茗翛然自适
944976,正月二十四日到梅山二首 其一
827947,四月十五日田伏侯同年约崇效寺看牡丹予晨往主客皆未集次日晤李猛庵丈言是日到最后席散客已尽矣独坐成咏因忆昔与半塘老人来游恰亦四月十五日感怀三首予因和之 其一
861209,九月二十九日到思溪庄避人事十月初四日过生朝方归初三日早恕子遣人来送酒食并词二阕因成唐律二首 其二
583146,松江至湖州又一日到四安登陆半日至广德
131141,正月四日到张车偶成
182441,过疏山·手遮西日到閒山
384495,竹堂·乘閒上日到僧家
622965,赋得元日到人日未有不阴时二首 其一
131143,正月二十四日到梅山
35309,又咏·去年今日到城都
159471,二月社日到都门见花卉初发
893003,上春晦日到西湖呈转运叔文学士
622966,赋得元日到人日未有不阴时二首 其二
