459565,共肖市上饮，归其母家，过某地，予指某楼曰：万物皆流，今之所迷恋者，即后之所追忆者，终将随流而往，为流所灭，亦流中一沤而已。此地可名为匆匆洲。肖曰：且尽眼前，毋太早计，子忘预搔待痒之讥乎？名以过望亭可矣。盖予每过此，必抬头久望也。其言甚佳，予故两存之，为作三章 其三
459260,十一月十五共肖往平江，访旧所历，游连云山，随行随书。及归，更补怪木、果蜕二章。岳阳汽车站遇老人弹凤凰琴，久听彷徨，有不能为怀者。略资其困，与接言甚欢，遂为吾缕述其事。车上记之
459564,共肖市上饮，归其母家，过某地，予指某楼曰：万物皆流，今之所迷恋者，即后之所追忆者，终将随流而往，为流所灭，亦流中一沤而已。此地可名为匆匆洲。肖曰：且尽眼前，毋太早计，子忘预搔待痒之讥乎？名以过望亭可矣。盖予每过此，必抬头久望也。其言甚佳，予故两存之，为作三章 其二
747424,涤生擢学士芝房有诗道其进官之速而勉以乡先辈风义其言甚美因和此篇赠涤生并呈芝房
459563,共肖市上饮，归其母家，过某地，予指某楼曰：万物皆流，今之所迷恋者，即后之所追忆者，终将随流而往，为流所灭，亦流中一沤而已。此地可名为匆匆洲。肖曰：且尽眼前，毋太早计，子忘预搔待痒之讥乎？名以过望亭可矣。盖予每过此，必抬头久望也。其言甚佳，予故两存之，为作三章 其一
466250,共肖市上饮，归其母家，过某地，予指某楼曰：万物皆流，今之所迷恋者，即后之所追忆者，终将随流而往，为流所灭，亦流中一沤而已。此地可名为匆匆洲。肖曰：且尽眼前，毋太早计，子忘预搔待痒之讥乎？名以过望亭可矣。盖予每过此，必抬头久望也。其言甚佳，予故两存之，为作三章
257367,汉阴台·怪来赐也多言甚
513864,与提学娄克让御史饭泗亭驿舟晤言甚洽
