268554,导引曲·八月十八夜梦至一处
828114,夏五月与愔仲同年北游过天津主瀹老浪公两家浪公一夕梦至一处层楼复阁琳琅满架一老人以所书楼额视之首尾为五楼二字中覆以纸问浪公曰试射何字曰当是凤字老人微哂曰君知五凤楼耳揭视乃岳字也浪公既志之爱其名属予归请太夫人书之因题长句于后邀愔仲同作且视瀹老
829463,八月初九夜梦至一处案上书装册甚古翻视为魏晋六朝人诗梁诗标曰梁言齐曰齐言妙趣纷纶盎有馀味醒后追忆不得遂拟二首彷佛所见云
423513,导引曲·八月十八夜梦至一处，长廊曲室，间以疏棂，月光射入，皎洁殊甚。极望烟汀沙渚，清旷无人居，其外平波弥迤，或言此洞庭湖也。恒有仙灵往来，见湖壖大鸟，引咮斫地者再，鸣声戛然。湖中出二女郎，短发齐肩，长眉入鬓，其一人齿尤稚，风裳水佩，绝不类尘世妆，侍者导以行，就室中款语良久。惝恍迷离，多不可晓意者。倦游招隐，其俟我于潇湘云水间乎。醒而赋之，以讯知者
828302,八月初九夜梦至一处案上书装册甚古翻视为魏晋六朝人诗梁诗标曰梁言齐曰齐言妙趣纷纶盎有馀味醒后追忆不得遂拟二首彷佛所见云 其二
828301,八月初九夜梦至一处案上书装册甚古翻视为魏晋六朝人诗梁诗标曰梁言齐曰齐言妙趣纷纶盎有馀味醒后追忆不得遂拟二首彷佛所见云 其一
885001,仆自以四月十四日自延平归所寓之南轩积雨阴湿体中不佳二十五日夜梦至一处流水被道色清绝若有栏槛而无屋宇有笔砚皆浸水中予惊问何地旁有应者曰此玉澜堂也梦中欲取水中笔砚作诗诗未成而觉意绪萧爽殆不类人世鸡已一再鸣矣因赋此
