1003795,西省斋宿陪侍左史曹舍人话旧以除当字赋诗下教和答 其一
352152,亲旧以老夫年及中寿既辱临况又多以诗词相庆祝顾衰谢何以得之辄成鄙句叙述感悰
991459,闻高平公殂谢述哀感旧以助挽歌三首 其三
1126527,闻高平公殂谢述哀感旧以助挽歌三首
160882,会稽六月初五日新米入市价减旧以升计之几十
105635,闻高平公殂谢述哀感旧以助挽歌
991460,闻高平公殂谢述哀感旧以助挽歌三首 其二
352762,高秀才绅十年前有同邸之旧以剑名堂求诗
1003794,西省斋宿陪侍左史曹舍人话旧以除当字赋诗下教和答 其二
1089591,高秀才绅十年前有同邸之旧以剑名堂求诗
1156550,喜与韦左丞同入南省因叙旧以赠之
1213244,西京赵良臣都事四十年之旧以诗见赠走笔述和勉其归家养疾不听逮月馀遂卒官所
164037,西省斋宿陪侍左史曹舍人话旧以除当字赋诗下
861256,会稽六月初五日新米入市价减旧以升计之几十二三闻海商米船方集亦损其直
991461,闻高平公殂谢述哀感旧以助挽歌三首 其一
561441,送张中丞赴召北台张旧以翰林例出补外乃独有今召
1168538,闻丹丘子于城北营石门幽居中有高凤遗迹仆离群远怀亦有栖遁之志因叙旧以寄之
18849,喜与韦左丞同入南省因叙旧以赠之
567299,某子旧以大蟹十个来索画久之答墨蟹一脐松根醉眠道士一幅
1127989,西省斋宿陪侍左史曹舍人话旧以除当字赋诗下教和答
148987,题邓保章真·旧以书生新保章
1078872,亲旧以老夫年及中寿既辱临况又多以诗词相庆祝顾衰谢何以得之辄成鄙句叙述感悰
436392,冯弟自北山来出其旧所为诗百馀篇虽未暇尽读尝鼎一脔足知馀味吾弟离群索居无师友之益能自道其所志盖绝无而仅有者也虽然掘井九仞而不及泉犹为弃井耳适汉臣张君见过论文话旧以及吾弟之贤因作诗许其所已能而勉其所未至以寄之幸时复观览以自警省勿徒实箧笥而已
