38100,谢欧阳侍郎寄示新集
141110,南湖有怀遂初尤公侍郎寄赠
152207,次韵孙从之侍郎寄题新喻周氏用德堂
1076334,谢王侍郎寄东仓祖送图二首 其一
14342,酬马侍郎寄酒
1120698,谢王侍郎寄东仓祖送图二首
337500,谢王侍郎寄东仓祖送图
1190897,酬马侍郎寄酒
1076335,谢王侍郎寄东仓祖送图二首 其二
854004,次韵范侍郎寄赵校正
155924,次韵王侍郎寄题亦好园
1043686,答吴侍郎寄陕府
130120,次韵范侍郎寄赵校正
939451,三城侍郎寄示留题延庆寺二韵诗二章顷岁予肄业于此遗景尽在幸会之迹首唱之序详矣谨依命攀和但于首章增为四韵盖浅陋之才不觉辞费因遣稚子赞善大夫通判邠州事学古写于此牌以永嘉赐 其二
939480,三城侍郎寄示留题延庆寺二韵诗二章顷岁予肄业于此遗景尽在幸会之迹首唱之序详矣谨依命攀和但于首章增为四韵盖浅陋之才不觉辞费因遣稚子赞善大夫通判邠州事学古写于此牌以永嘉赐 其一
1163750,谢欧阳侍郎寄示新集
757102,沙河驿遥同赵干山侍郎寄赠韵
1006888,玉蝴蝶 和维扬晁侍郎寄伯强
371680,叶侍郎寄乌石茶昌甫诗谢之次韵同赋
894027,次韵和吴侍郎寄致政张郎中以令子倅府迎侍河阳
1216273,咨王侍郎寄禊原鲁应奉
999254,次韵王侍郎寄题亦好园
902996,南湖有怀遂初尤公侍郎寄赠七言
948256,次韵孙从之侍郎寄题新喻周氏用德堂
159292,次韵和吴侍郎寄致政张郎中以令子倅府迎侍河
172641,三城侍郎寄示留题延庆寺二韵诗二章顷岁予肄
1094282,叶侍郎寄乌石茶昌甫诗谢之次韵同赋
