549992,牡丹落几尽矣惟馀一枝垂垂不坠因而赋此
1073729,向伯恭侍郎致政芗林筑一堂名之曰企疏晋陵孙某闻而赋诗二首 其一
1128275,自仲嘉云亡未始见梦舟行夜入吴兴境有梦如平生感而赋诗四首
146300,有感而赋·风雪重门老楚囚
862729,与长老夜话出故人俞宋护书予至山之日俞书适至书中又相问讯感而赋诗二篇俞郊居婺源草堂蔬圃教子读书乡人重之闻近苦目疾殊可念 其二
559126,丁未七夕雨适郑德进馈芳园胡桃时乡人报夷舶因风出洋矣转忆沈约有云胡桃挺自禁地为胡羯奔逃之兆感而赋此 其一
690551,丙寅初春参知洪崖王公移镇惠潮喜而赋之
1077367,得家信报淮南飞蝗渡江入浙岁事殊可忧感而赋诗
42907,客有言西江近事者感而赋此
380911,章台月·吴姬宛宛，家在半塘桥，尝述其小时七夕遇仙事，感而赋此
693822,午日谒屈贾二先生祠有感而赋岁嘉靖甲寅也
468028,观新排赣剧《牡丹亭》，曲调多借鉴西乐，舞姿则颇似芭蕾，感而赋此
454385,报载日本首相参拜靖国神社忆南京大屠杀事感而赋此 其一
1070064,同江彦文纬江仲嘉褒度菱湖岭游三衢诸山道灵真出入岩谷胜绝可骇杂然有卜筑之意然此地寥阒人所不争小隐不难致顾吾曹出处何如耳二公皆脩真养气精进不衰予晚闻此道又为忧病顿挫志倦体疲每思益友傥得静舍安馀年资二子以待老岂不乐哉作诗叙游且志本末岩谷之胜实自仲嘉发之予尝闻而赋诗所谓武陵迷汉魏妙喜断山川者也
454386,报载日本首相参拜靖国神社忆南京大屠杀事感而赋此 其二
417558,清平乐　已巳初春梦碧后社成立喜而赋此
948711,鱼儿牡丹得之湘中花红而蕊白状类双鱼累累相比枝不能胜压而下垂若俛首然鼻目良可辨叶与牡丹无异亦以二月开因是得名其干则芍药也予命曰花嫔而赋是诗闻江东山谷间甚多
939133,回郑家桥小酌复以临清流而赋诗为韵得流字
650379,甥光烈自蔚州归喜而赋此
330336,石端若以朱丝栏见邀作而偶失所在久方得之喜而赋诗寄丁希韩因以见及遂申前志次韵
1067871,客有以赝铜香炉见贶者感而赋诗
1115099,龚令国英约小集感冷暴下归卧感而赋焉二首
765391,梦中颜余屋曰空意庵醒而赋此
598046,赵明府以季夏晦日自普宁过访山居因为江舟小酌鼓枻中流是时梧叶未落山意欲秋至夜别去感而赋此
1114012,寓宁国县圃中桃李杂花盛开感而赋诗
999169,锦园双桂植之二十八年未尝著花今忽盛开紫趺黄蕊所未曾见喜而赋诗
913966,十月久雨妨农收二十八日得霜遂晴喜而赋之
415649,二十三年前曾于破晓时趁月色豋雁鹰山，今宵重宿山麓，有感而赋
1025568,丁丑仲春将渡浙江从者请盘沙予畏而不许既登舟乘潮以济中流胶焉捐十金募数力竟至沙上仅达西兴狼狈殊甚从者笑之感而赋诗
815233,甲申游蜀乙酉夏闻亲病遄归感而赋此二首
1097956,子野惠竹?有感而赋二绝 其一
604728,黄梅道中冯茂山为五祖道场稍南即四祖道场破额山也王程束急不暇随喜轺中合掌望而赋之
477920,同王履约过道复东堂时雨后牡丹狼藉存叶底一花感而赋诗邀道复履约同作
466634,报载日本首相参拜靖国神社忆南京大屠杀事感而赋此 其二
783965,闻立亭言梅澥寄书问都中诸友音耗感而赋此
690239,道傍榆柳树皮饥民取食殆尽感而赋之
1092937,文叔入城夜半同斯远见过蚤作闻而赋之
812518,三月二十九日偕徐汉卿、易念堂、刘伯蒪、陈晴陔诸大令，黄庆生副戎，策马出城二十里，游葡萄沟。其地山环水抱，柳暗花明。葡萄尤为其土产，蔓生陇畔，十余里无隙地，同人登农家小楼茶话眺览至足乐也。归而赋之二首
851432,己卯十月一日至燕越五日罹狴犴有感而赋 其十五
915100,六月初四日往云际院田间雨足喜而赋之二首 其一
708762,满酋使来有不登岸不易服之说愤而赋之
431895,约同人游吴淞望东海登废垒而赋此（二首）
545654,答东阿张明府肃仲时肃仲远命书贶物色余长安风尘中不遇几返胡孟韬特为致之感而赋答并似孟韬
783686,书院内小斋花草去年所手植也今又重开感而赋之 其一
678860,吴市居民目予年少笑而赋此
325704,摸鱼儿·过天香楼，忆同崔格卿旧游，感而赋此
784311,秋分日雨后盘僧致牡丹四本酬予书植诸新松之侧罗罗清疏映带可目喜而赋之
1178977,行次成皋途经先圣擒建德之所缅思功业感而赋诗
1233661,壬辰春三月游左溪癸巳春三月游天宫有感而赋
661227,读桂进士兄弟文字喜而赋之
572867,万二酉老师有垂老之疾惑而赋此万里中老儒余家父子兄弟祖孙皆从之游其人可知 其二
478490,沅溪潘进士在长安逆旅中见庭下山丹花诘其主云是沅中移来感而赋诗命予嗣响
597257,午日谒屈贾二先生祠有感而赋岁嘉靖甲寅也 其一
357379,双双燕·予携度儿来粤节届立秋矣燕子方营巢于寓室之楣怜而赋此
148455,厨鸡窜房中张元辅怜而赋诗余不能自已亦为一
532303,禾稼在野人有更生之望喜而赋此 其一
963493,中春中浣后一日老人挈累下西市寓舍越三日某行感而赋诗呈友人 其二
98122,三兄既见过喜而赋此
248275,航班延误滞留南京禄口机场而赋
407956,前阅报见满洲里俄人画界交涉，今过安奉铁道，又见人竭力经营，感而赋此
910174,正月末再来渡石桥见桃花盛开有感而赋
169810,陪赵工部三峡白鹿之游有感而赋
346808,二月廿九日收宗玉弟京口书还家有日喜而赋诗
411467,丁酉夏余应安徽省文史研究馆之聘，寄居岳西县垣，夜不成寐，起读杜工部诗，感而赋此 其四
146299,有感而赋·听着啼鹃泪满襟
248916,有朋友论聂诗奴性感而赋之
581982,六月十八日孔章陈寅长为避暑饮于水利司既而赋此谢之
1231490,己亥南楼九日怀乙未九日将家过前陈北庄倏忽四载有感而赋
270310,对月一首有感而赋时二十九军正受日寇怂恿伪造自治
311617,丁酉夏余应安徽省文史研究馆之聘，寄居岳西县垣，夜不成寐，起读杜工部诗，感而赋此
569636,元驭宗伯留赏菊忽有紫牡丹一株异而赋之
691251,圆榄山有双树连枝者下有古墓存焉与诸子异而赋之
1070276,自仲嘉云亡未始见梦舟行夜入吴兴境有梦如平生感而赋诗四首 其二
1073670,少逸登第还里中喜而赋诗少逸过余出示和篇次韵为贺
406222,夜梦亡友何梅士觉而赋此
637720,归养命下喜而赋之
444239,持社成立于峨嵋金顶感而赋此用太白韵
574863,夏吏部于中以谏除名访予里第予避暑山中闻而赋此
492432,初舍弟子彦将赴赣后闻留荷山曾氏馆中喜而赋诗奉寄并呈子中大兄
597103,春日桃华齐开子结如豆喜而赋之
948161,太和贡士陈诚之记予颜欲置远明楼昔白傅年七十一写真诗云鹤毳变绿发鸡肤换朱颜予今年适同感而赋此
512615,闻邑中欲立周文襄公祠喜而赋此
214431,凤凰台闲眺台前瞰军垒有感而赋
365144,青山高竹楼别业昔尝题诗其壁诗故在而竹楼物故三年矣感而赋诗
818539,王述庵论诗绝句诋諆放翁感而赋此 其二
488999,病中得长儿潜书至自北京喜而赋此因便书示潜凡 其二
813112,箧中检得败纸一束，启视则游梁时留存之要牍也。感而赋此二首
1070278,自仲嘉云亡未始见梦舟行夜入吴兴境有梦如平生感而赋诗四首 其四
816750,法曲献仙音 铜虎媒填词初成，听梁溪女郎为予歌二郎神一曲，喜而赋此
756211,秋日清晨从游法源寺归而赋此
765557,法曲献仙音 其一 铜虎媒填词初成，听梁溪女郎为予歌二郎神一曲，喜而赋此
345953,喜而赋诗·月挂楼钟晓
788725,摸鱼儿 过天香楼，忆同崔格卿旧游，感而赋此
1028784,甲寅十一月朔旦冬至适值先妣太夫人服阕从吉感而赋诗二首 其二
286106,秋分日雨后盘僧致牡丹四本酬予书植诸新松之侧罗罗清疏映带可目喜而赋之
1134701,同年常簿吴次翁子万之万之子直卿将为分水学官喜而赋之
1028434,山园芍药忽有花喜而赋
1215684,昭武图经载天子冈越王驻猎之地樵牧时得古瓦有罗纹雁翅之状坚致如石以时考之数千百年感而赋之
843461,四和香 黄三出所藏元刊文信国集杜诗属题盖囗中作也感而赋此
785638,庚辰四月重野成齐安绎岩谷六一脩日下部东作鸣鹤蒲生絅齐重章冈鹿门千仞诸君子约游后乐园园即源光国旧藩邸感而赋此
1070387,与蒋子有道丁田相从吴下之适感而赋诗
292004,清平乐·已巳初春梦碧后社成立喜而赋此
566958,万历二年翰林院中白燕双乳辅臣以　献进两宫并赏殊瑞闻而赋之
940962,重九日登道山亭柱间有陈休斋题词曰师相者先君也予既感时之用师而怀先君之去此已垂卅年慨然流涕归而赋之
940703,陪赵工部三峡白鹿之游有感而赋 其二
604990,唯仲孝廉归自苍梧垂橐北上喜而赋之以侑行李
598707,谭永明中秋枉顾谈时事因及高堂白发感而赋此
1225270,七月十八日出郊外抵昭潭沿道观虫食松叶尽枯感而赋
498062,妓有幽怨抱疴强对客者悲而赋之
961912,辛亥夏余将广旧庐偶读栾城李方叔新宅诗篇是时子由方治第有余年七十无住著屋成可作十年客之句感而赋之
516203,威州分司梦还家觉而赋此
813368,友人搜录东沙公遗集感而赋诗
334845,过江陵镇登秦申王坟读决策元功精忠粹德碑文有感近事而赋
431687,丁酉夏余应安徽省文史研究馆之聘，寄居岳西县垣，夜不成寐，起读杜工部诗，感而赋此
550737,得谭比部寄先永宁书感而赋答
294763,感而赋之·转眼嗟予五十春
357375,解语花·见江岸草花淡红可爱而赋
1221567,次韵周公辅游东阳东岘因其所述之实而赋之
843955,荫坪叠落花前颌四首索和己未及今十年矣感而赋此
454322,报载广州购书中心妆成喜极而赋
411465,丁酉夏余应安徽省文史研究馆之聘，寄居岳西县垣，夜不成寐，起读杜工部诗，感而赋此 其二
444263,读沈宛君《茉莉花》诗感而赋此未能尽如原意也
191056,正月末再来渡石桥见桃花盛开有感而赋
327901,归化城郊原蒙古持献清茶炒麋伏迎道左喜而赋之
695143,孙比部以建言谪潮阳宾于小墅清夜相过感而赋此四首
604985,甲子元日邑侯裒谷孙公枉驾投辖既贻珠玉复命棋枰留酌竟日喜而赋谢 其二
248661,湘民有负友尸还乡者哀而赋
667936,一雨数日不绝田畯抱病穫之忧予闻而嘲之曰甫幸其润随忌其淫然则天之欲媚于人也难矣感而赋此
912130,东园新种桃李，结子成阴，喜而赋之
411416,闻日寇攻陷皖城，愤而赋此 其二
454212,《陶景明诗书画册》出版忆与陶公交往事感而赋此
632545,余与大来苏筑俱生残冬感而赋此
964755,山中有花一种俗名花叶不相见感而赋之
311710,闻日寇攻陷皖城，愤而赋此
1162065,秋夜醉归有感而赋
925623,千年调 开山径得石壁，事出望外，意天之所赐邪，喜而赋之
792969,梅坡弟生子喜而赋赠
964829,吴潘二台官以直言左迁董夕郎亦以荐贤之故相继翩然而去公论惜之三学叩阍来归刘声伯感而赋诗因次其韵 其一
513310,盆水映日圆影上檐可爱而赋
1237089,次韵周公辅游东阳东岘因其所述之实而赋之
569843,张将军要余与沈令尹潘林曹三子骏儿同泛海时风日清美颇穷胜槩乐而赋之 其二
500814,故人刘彦英见过喜而赋诗
146296,有感而赋·珙璧衣冠十六传
519995,三月十日牡丹盛开将约诸宾客共赏九日夜忽风雨大作黎明园丁走报花已半离披矣感而赋此
728531,八声甘州  客有言西江近事者感而赋此
45650,王述庵论诗绝句诋諆放翁感而赋此
250709,庚寅中秋登狼山望长江子佩言此为长江之尾岸阔潮平恰如人到老境旷达平和感而赋此
623341,夏月困于炎烟情含而光郁也感而赋之
1098207,里中小渔舟被差防江有感而赋
430627,满江红 先子遗容为蠹虫所蚀，重装后，幸无恙，喜而赋此
613405,余畜一黄犬行时留以守衙比再渡琼此犬衔衣跳舞感而赋诗和坡公乌喙
248444,闲憩小汤山红栌山庄感事而赋
970883,七月十有五夜一再梦故舒州使君侍御公宛如平生且于其案间得若纸若缯者一沓皆公所书或印者翻之有如帜者三有曰苛政曰赃吏忘其一焉问傍立者以何所用云始朝议欲遣公为某使故建此云觉而赋诗四绝 其三
146301,有感而赋·两月缥囚里
1239636,秋夜与子充论文退而赋诗一首因简子充并寄胡教授仲申
1077393,得了翁书并寄石芝云其味初淡中苦已而发甘鲜有此味者感而赋诗
274441,望云涯引·野行闻笛，音调类旧人所为，感而赋之
380710,满酋使来有不登岸不易服之说愤而赋之
699671,修邑志成有不察而斋怒者乃得谤又以有所誉来也感而赋之四首
325088,箧中检得败纸一束，启视则游梁时留存之要牍也。感而赋此
630553,因乱奉母蕉林阿字频为省视感而赋诗
1215012,闻瑞州太守、东广宪副宣命俱至，喜而赋之
1244231,分府同知瑶童相公大阅之日天使适至喜而赋诗奉寄刘宾旭参军 其四
604984,甲子元日邑侯裒谷孙公枉驾投辖既贻珠玉复命棋枰留酌竟日喜而赋谢 其一
517271,道中见弋人有感而赋
222523,回郑家桥小酌复以临清流而赋诗为韵得流字
851131,己卯十月一日至燕越五日罹狴犴有感而赋 其十七
598605,弼唐兄食不重肉乃东西远游无宁岁感而赋此寓忠告之意
964828,吴潘二台官以直言左迁董夕郎亦以荐贤之故相继翩然而去公论惜之三学叩阍来归刘声伯感而赋诗因次其韵 其二
622075,修邑志成有不察而斋怒者乃得谤又以有所誉来也感而赋之四首 其一
431675,闻日寇攻陷皖城，愤而赋此
597132,盆梅忽抽长故寻许始华喜而赋之
178075,雪霁霜晴独寻山迳菊花犹盛感而赋诗
862728,与长老夜话出故人俞宋护书予至山之日俞书适至书中又相问讯感而赋诗二篇俞郊居婺源草堂蔬圃教子读书乡人重之闻近苦目疾殊可念 其一
559127,丁未七夕雨适郑德进馈芳园胡桃时乡人报夷舶因风出洋矣转忆沈约有云胡桃挺自禁地为胡羯奔逃之兆感而赋此 其二
1066530,余谪沙阳地僻家远遇寒食如不知盖闽人亦不甚重其节也感而赋诗五首以杜子美无家对寒食五字为韵 其四
335279,报中有盛年休官者感而赋诗
596908,先人琴砖从修宅得之感而赋此
604317,省南上人长安乞诸朝贵为书金刚经镌石时有中贵人欲为开社者余喜而赋之
585791,上唐庄旧名盘龙山村老云崔丞相有碑一通喜而赋此
766153,解佩环 梅为风雨所败感而赋此
94394,龚令国英约小集感冷暴下皈卧感而赋焉
998675,何逊梅花诗云枝横却月观林和靖云水边篱落忽横枝又云疏影横斜水清浅是或一律也亦好园江梅一株枝横丈馀作平坛凿小池于其下坛池初成榜曰横枝喜而赋诗
1221372,次韵周公辅游东阳东岘因其所述之实而赋之 其一
78064,秋晴园中山禽绝多有感而赋
622076,修邑志成有不察而斋怒者乃得谤又以有所誉来也感而赋之四首 其二
410403,约同人游吴淞望东海登废垒而赋此（二首） 其二
211092,大儿时中堂成德修弟喜而赋之因次元韵
1077771,渊圣皇帝赐宝剑生铁花感而赋诗
774608,陈茂才瀚归自闽军以中和诗草见示适闻和议已成感而赋此并题其集
1088040,夜宿方广闻长老守荣化去敬夫感而赋诗因次其韵
808171,一枝春 城东许氏水轩临流梨花一株，妍净可念，主人命酒邀赏，已半落矣，感而赋之
970884,七月十有五夜一再梦故舒州使君侍御公宛如平生且于其案间得若纸若缯者一沓皆公所书或印者翻之有如帜者三有曰苛政曰赃吏忘其一焉问傍立者以何所用云始朝议欲遣公为某使故建此云觉而赋诗四绝 其二
667838,家僮举网获龟即命放之池中感而赋此
604440,南浦钟陵相距一日而近往往车徒不宿舂粮余至武阳值大雨雪当信宿留车徒遂多冻馁母夫人恻然吾儿传食此辈啼饥即皇华使者于心安乎乃倒橐装遍犒之儿萱顿首退而赋诗以识驿壁
1073819,山阳守吴子仁遗两鹤喜而赋诗二首 其一
631058,秋日阅陈全人梁同庵英卓今遗稿感而赋诗并示诸子
973706,三兄既见过喜而赋此
821911,望云涯引 野行闻笛，音调类旧人所为，感而赋之
1240962,适耕堂为吴琴汪寿甫扁而赋之
598259,孙比部以建言谪潮阳宾于小墅清夜相过感而赋此四首 其三
605023,邓玄度佥宪分俸贻书注念笃挚感而赋谢情见乎词
851136,己卯十月一日至燕越五日罹狴犴有感而赋 其十四
985703,宣城琴高之名甚著转送四方甚珍品也比得之乃乡间桐鱼耳一笑而赋二首 其二
1122945,吴潘二台官以直言左迁董夕郎亦以荐贤之故相继翩然而去公论惜之三学叩阍来归刘声伯感而赋诗因次其韵
754138,截竹为小洞箫吹之合律喜而赋此
436852,客有求观予孝经传者感而赋诗
605026,曾元陟亲家以湘阴广文谢事还里喜而赋之 其三
250222,己丑仲冬予作粤闽之游归来见诸友悼诗方知西溪病夫已然下世感而赋此
1110414,山阳守吴子仁遗两鹤喜而赋诗二首
480854,大同克敌进封其镇守总戎都督郭清宁为定襄伯喜而赋此以贺之
604270,日升霞举诗为邑侯裒谷孙公览揆而赋也侯以壬戌秋八月分城南海以乙丑秋八月课绩罗浮时都御史台御史台未获交承故侯之最未上而玺书未报八之日则侯之览揆也罗浮之父老子弟一则以喜矣吉祥善事巧于相值如此惟侯以文事饰吏治以美意行良法求之两汉文苑循吏传中业已前无古人不肖萱尝以三曹抱关于侯之德里缟带之欢盖世讲焉故侯式庐则停镳辍轭问俗则解带开襟东阁吟花有简必授南楼对月无酒不同形骸尽捐肝胆相照盖谊为君民恩为父子矣去岁是日侯方
311618,感而赋此·历尽艰危忍尽饥
814777,古樵郭明府甫卸雅篆又权芦山别未及月作再来人喜而赋寄
958232,未至鼎州道旁有甘泉既酌泉过松竹百步投宿小寺翌日又酌泉登舆松竹间兰香甚盛感而赋之时自移封
217009,二十四夜梦到何许植物多瑞香觉而赋此
810246,三月二十九日偕徐汉卿、易念堂、刘伯蒪、陈晴陔诸大令，黄庆生副戎，策马出城二十里，游葡萄沟。其地山环水抱，柳暗花明。葡萄尤为其土产，蔓生陇畔，十余里无隙地，同人登农家小楼茶话眺览至足乐也。归而赋之二首 其二
851429,己卯十月一日至燕越五日罹狴犴有感而赋 其十
851127,己卯十月一日至燕越五日罹狴犴有感而赋 其三
604515,仲师宗雅见过小园喜而赋赠 其二
94328,东园新种桃李结子成阴喜而赋之
702894,夏日得诸君登镇海楼游浮邱二作喜而赋和
863669,雪霁霜晴独寻山径菊花犹盛感而赋诗
444231,金水高凉莅昌与江右诸子聚饮于江湾酒店把酒论诗飞花行令感而赋此
410409,庚戌秋冬之际上海检查鼠疫风潮陡起，感而赋此
460675,湘民有负友尸还乡者，哀而赋
1029058,耘老弟五月十三日亲往新亭种竹喜而赋诗
818538,王述庵论诗绝句诋諆放翁感而赋此 其一
681946,徵明侄荐授翰林兼修国史喜而赋诗
1218823,题杨仲德照磨自汴梁归话中原荆棘蔽野人烟断绝闻复山东感而赋此
1124896,子野惠竹?有感而赋二绝
972441,有以灵寿杖为贶周旋累年忽尔摧折感而赋之
520620,梦与表弟王制彝卿表甥陈鳌子鱼散步河曲鳌邀饮其室觉而赋之写似二子
935276,丙午五月大雨五日不止镜湖渺然想见湖未废时有感而赋
513209,客遗山柿绐为玉兰戏而赋此
1036841,六月初四日往云际院田间雨足喜而赋之二首 其二
1073730,向伯恭侍郎致政芗林筑一堂名之曰企疏晋陵孙某闻而赋诗二首 其二
1067799,发故箧获端石蟾蜍研形模极小盖予幼小时几案间物对之肃然如与故人相遇感而赋诗
1001792,落南二年无人相牵挽诗几于废罗子琳跫然至止喜而赋长韵
1028857,余假守是邦所幸今夏雨泽适中高下咸宜客有谓今秋一稔前此数岁未之有也果尔则幸矣因喜而赋丰年之诗
345943,山阳守吴子仁遗两鹤喜而赋诗
702282,洪武九年岁丙辰二月十日被擢秦王礼官十七日同秦晋燕王府官僚召见奉天门下各赐马一疋楮币有差惶悚感激退而赋诗
493518,正月二十六日得表弟梁远南京消息且云比江西来者皆未有书感而赋此
879146,贺新郎 五用韵。读坡公《和陶诗》，其九篇为重九作，乃叙坡事而赋之 其三十六
800685,同吕侍御元素过新郑，侍御有妹随婿在宫，予兄弟五人天各一方，感而赋比
614801,大店驿时轮蹄络绎邮吏多逋感而赋此 其一
1131458,甲寅十一月朔旦冬至适值先妣太夫人服阕从吉感而赋诗二首
248320,太平山中有蛙夜鸣不寐而赋
494062,客有别号莲塘者以自附于濂溪之说予谓之曰于中通得圣人之体于外直得圣人之用于不支蔓得圣人之真于出淤不染得圣人之清遂感而赋之
1223923,仙游道士余岫云为从珠溪余隐士求得华山下黄茅冈一曲规作丹室喜而赋之不觉五首 其三
603950,舟泊虎邱全伯典自四明追及感而赋别
765139,中秋与内人对月因忆去年今夕 余客闽之南靖海水爆发几致淹没感而赋此
958064,忠州丰都观乃阴长生之地山最高处栏槛围一古井谓是真人丹成乘云仙去之遗迹道士云时有云气出井中过而赋之
148921,方罹残热忽值新凉喜而赋反悲秋
1100485,被檄乐平至鸣溪渡有山与南丰军山同名者予昔从岭庵谢先生梦得游先生于湖畏友也豪于诗悦军山之峭拔畅其吟怀自昭武徙家于市山筑室曰西窗以朝夕对焉尝命余记之余时从西窗樽酒论文为乐如是者十载今先生已矣感而赋诗
624118,李伯玉久不得面杪夏偶携诗草偕其从弟瑞玉过余池上喜而赋此
1218966,张仲举博士书来言其老健能夜书小字仍饮量不减喜而赋此诗录上
851133,己卯十月一日至燕越五日罹狴犴有感而赋 其四
958120,益昌霪雨踰月负郭皆浸祷祠之后仓廪保全居民复业运使国博喜而赋诗辄成三绝句以报来贶 其三
488998,病中得长儿潜书至自北京喜而赋此因便书示潜凡 其一
415619,闻粤北山区至今尚留有文革期间之大标语有感而赋
587785,安德道中杏花盛开感而赋此
306439,荫坪叠落花前颌四首索和己未及今十年矣感而赋此
664762,同年刘丹棱见过道及己未下第会孟津涂中事感而赋此
512548,三月九日舟泊虞山下见游人续续于椒麓间可爱而赋
792633,甲申游蜀乙酉夏闻亲病遄归感而赋此二首 其二
732503,友人搜录东沙公遗集感而赋诗 其一
824417,阮郎归 上海市文学艺术工作者第二次代表大会开幕，喜而赋此
145874,己卯十月一日至燕越五日罹狴犴有感而赋
597259,午日谒屈贾二先生祠有感而赋岁嘉靖甲寅也 其一
569019,李本宁兄过访挟客曰来君者其名相如其字不疑与谈而悟则吾贞吉先生也喜而赋长篇赠之
851431,己卯十月一日至燕越五日罹狴犴有感而赋 其十一
477493,李子西送佛头青花得自永宁王宫中盖牡丹之殊异者喜而赋诗且改名为萼绿华云
492053,秋旱井涸致水为劳有浚而得泉者喜而赋诗
784039,古樵郭明府甫卸雅篆又权芦山别未及月作再来人喜而赋寄 其一
410402,约同人游吴淞望东海登废垒而赋此（二首） 其一
1028785,甲寅十一月朔旦冬至适值先妣太夫人服阕从吉感而赋诗二首 其一
222871,山园芍药忽有花喜而赋
598258,孙比部以建言谪潮阳宾于小墅清夜相过感而赋此四首 其二
169812,有感而赋·昔年相见尚儿童
605024,曾元陟亲家以湘阴广文谢事还里喜而赋之 其一
769070,双双燕·予携度儿来粤节届立秋矣燕子方营巢于寓室之楣怜而赋此
851430,己卯十月一日至燕越五日罹狴犴有感而赋 其十三
582060,从弟亚夫进士自南安寄书至喜而赋此寄京答之
585542,表弟陈希周号静翁吾爱而赋此
268998,景孙体弱，未严课而诗文日进，喜而赋此
584131,忠南悼舅氏也舅氏萧公曩为忠守去且四十年忠人追祀之衷既展拜祠下退而赋忠南
597985,得良弼楚中书有曾中丞抚蜀平蛮之作且云中丞每有书至及逢人辄猥及不佞浙中事因感而赋之
945347,闻伯求弟鞫狱明允今日行刑而雪应祈喜而赋诗
130651,闻伯求弟鞫狱明允今日行刑而雪应祈喜而赋诗
291150,梅里诗社成立，喜而赋诗，即以申贺
434532,满江红 遁庵主人植菊阶下秋雨既盛草莱芜没殆不可见江空岁晚霜馀草腐而吾菊始发数花生意凄然似诉余以不遇感而赋之因李生湛然归寄菊轩弟
667789,得陈鲁南书感而赋此
784040,古樵郭明府甫卸雅篆又权芦山别未及月作再来人喜而赋寄 其二
667904,得友人书感而赋此
176134,山中有花一种俗名花叶不相见感而赋之
1224418,登钱山望菰城慨然而赋
1098017,去年脩禊后三日得南宫捷报于家今年是日与同年赵簿同事泮宫感而赋诗
