1087793,巢居之集以中有学仙侣吹箫弄明月为韵探策赋之而熹得中字遂误为诸君所推高俾专主约既而赋诗者颇失期于是令最后者具主礼以当罚乃稍集独敦夫圭甫违令后至众白罚如约饮罢以苍茫云海路岁晚将无获分韵熹得将字而子衡兄得苍字实代熹出令
605025,曾元陟亲家以湘阴广文谢事还里喜而赋之 其二
843238,荫坪叠落花前颌四首索和己未及今十年矣感而赋此 其四
443697,井冈诗会初识逸明兄，慕其才调翩翩，余询及石窗、缉庵二老，知其身康笔健，诚吟坛之福祉也，感而赋此
1205480,定风波 商角调西江客舍酒后闻梅花吹香满窗醒而赋此
538580,敬美弟举南宫喜而赋此
511068,将营土阁使人取材于海山飓作舟踰期始至喜而赋此
933458,秋晴园中山禽绝多有感而赋
411415,闻日寇攻陷皖城，愤而赋此 其一
345557,少逸登第还里中喜而赋诗少逸过余出示和篇次韵为贺
146303,有感而赋·浩劫风尘暗
423513,导引曲·八月十八夜梦至一处，长廊曲室，间以疏棂，月光射入，皎洁殊甚。极望烟汀沙渚，清旷无人居，其外平波弥迤，或言此洞庭湖也。恒有仙灵往来，见湖壖大鸟，引咮斫地者再，鸣声戛然。湖中出二女郎，短发齐肩，长眉入鬓，其一人齿尤稚，风裳水佩，绝不类尘世妆，侍者导以行，就室中款语良久。惝恍迷离，多不可晓意者。倦游招隐，其俟我于潇湘云水间乎。醒而赋之，以讯知者
652143,北归有喜而赋
974509,邂逅孙子仪于临安喜而赋诗并怀子进子肃
544114,客有自金华诸洞返者穷幽历险所睹甚异余伟其事而赋之以订再游
843235,荫坪叠落花前颌四首索和己未及今十年矣感而赋此 其一
597258,午日谒屈贾二先生祠有感而赋岁嘉靖甲寅也 其二
1075007,光武二十八年五溪蛮反马文渊年六十三矣踊跃请行卒致困败班定远久在绝域上疏请归词甚切至其略曰臣不敢望至酒泉郡但愿生入玉门关遂老中朝辛亥季春三日灯下读此二传感而赋诗
492431,初舍弟子彦将赴赣后闻留荷山曾氏馆中喜而赋诗奉寄并呈子中大兄
428073,霜降节风雨数日夜感而赋此
1081763,报中有盛年休官者感而赋诗
314100,沁园春·戊子春闰，予应试吴陵，胡修来过敝里访予不遇，兹于东亭握手，喜而赋此
246306,贺新郎·庚寅初冬持社成立诸侣盟于峨眉之巅感而赋此
609153,辛巳仲春有鹤一双巢于耆德寺浮屠顶上感而赋之
356065,与蒋子有道丁田相从吴下之适感而赋诗
958119,益昌霪雨踰月负郭皆浸祷祠之后仓廪保全居民复业运使国博喜而赋诗辄成三绝句以报来贶 其一
322817,沁园春·仲春独步小园，见风景萧条，感而赋此
985210,瓶水生数花须臾有蜂来集感而赋诗
61109,遣使诣李中麓太常求录诸经图解获之喜而赋谢
249242,报载日本首相参拜靖国神社忆南京大屠杀事感而赋此
623358,古柏数株蕴荣拂翠感而赋之
95202,邂逅孙子仪于临安喜而赋诗并怀子进子肃
950904,十一月二十七日步自虎溪至西寺摩挲率更旧碑近览前闻人故游有感而赋
814792,书院内小斋花草去年所手植也今又重开感而赋之
821171,西平乐 匪石来静石湾，夜谈甚乐，归而赋此见寄，依韵奉酬
622077,修邑志成有不察而斋怒者乃得谤又以有所誉来也感而赋之四首 其三
1251662,洪武甲子中秋夜祀风雷山川前此积雨是夜晴霁喜而赋诗以志云
970882,七月十有五夜一再梦故舒州使君侍御公宛如平生且于其案间得若纸若缯者一沓皆公所书或印者翻之有如帜者三有曰苛政曰赃吏忘其一焉问傍立者以何所用云始朝议欲遣公为某使故建此云觉而赋诗四绝 其四
1110423,罨画连雨溪涨丈馀雨霁水落喜而赋诗二首
311737,感而赋此·漫道金闺射策伦
1122052,益昌霪雨踰月负郭皆浸祷祠之后仓廪保全居民复业运使国博喜而赋诗辄成三绝句以报来贶
211035,余试吏初期六十止今遂初原喜而赋之
407403,对月一首有感而赋时二十九军正受日寇怂恿伪造自治
1115744,六月初四日往云际院田间雨足喜而赋之二首
616330,圆榄山有双树连枝者下有古墓存焉与诸子异而赋之 其三
872224,二十四夜梦到何许植物多瑞香觉而赋此
434466,朝中措 偶出见墙头杏花喜而赋之
436119,丁未三月二十八日县大夫薛君宝臣过余芹溪精舍酒閒雨作时方苦旱喜而赋之
810177,章台月  吴姬宛宛，家在半塘桥，尝述其小时七夕遇仙事，感而赋此
1066529,余谪沙阳地僻家远遇寒食如不知盖闽人亦不甚重其节也感而赋诗五首以杜子美无家对寒食五字为韵 其三
1098168,移古梅植于贮清之侧已有生意喜而赋之
1077624,寓宁国县圃中桃李杂花盛开感而赋诗 其二
1103972,客谈西湖旧事感而赋诗
588302,李三洲宅上兰盛开感而赋此 其一
914863,龚令国英约小集感冷暴下归卧感而赋焉二首 其一
499437,高允宪先生客习氏馆中清风修竹翛然有尘外意喜而赋此
384314,徵明侄荐授翰林兼修国史喜而赋诗
784097,慧麟侄出痘新愈于元旦日索诗因而赋此
309989,一萼红·瓶梅一枝，春意蓬勃，将办出山，感而赋此
792632,甲申游蜀乙酉夏闻亲病遄归感而赋此二首 其一
605031,丙寅初春参知洪崖王公移镇惠潮喜而赋之 其二
986287,余试吏初期六十止今遂初愿喜而赋之
951584,夜宿方广闻长老守荣化去敬夫感而赋诗次韵
453410,云生海楼过洪州，感而赋此，兼柬纷纷
411466,丁酉夏余应安徽省文史研究馆之聘，寄居岳西县垣，夜不成寐，起读杜工部诗，感而赋此 其三
370971,一枝春·城东许氏水轩临流梨花一株，妍净可念，主人命酒邀赏，已半落矣，感而赋之
958253,时官多以封州俸薄井邑萧条居处湫隘为叹观如闻而赋之
727772,西子妆·雨中坐放鹤亭眺湖光山色感而赋此
843237,荫坪叠落花前颌四首索和己未及今十年矣感而赋此 其三
797107,沁园春 仲春独步小园，见风景萧条，感而赋此
345697,喜而赋诗·缟袂真仙驭
607689,立春重修三世祖墓松楸独秀有感而赋
453376,湿地公园石榴如火感而赋此
94329,喜而赋之·移处带花非差事
333436,午暑憩潭田精舍老僧求询其曾游方否云以少尝一到分宁感而赋此
311738,感而赋此·风浪刚恬铁锁开
638654,戊午冬至前一日承赵提学先生免试退而赋此
851134,己卯十月一日至燕越五日罹狴犴有感而赋 其二
1122629,中春中浣后一日老人挈累下西市寓舍越三日某行感而赋诗呈友人
763553,行香子  构屋水滨喜而赋此
561338,重经石佛闸望岸傍阁而赋之
1132522,春从天上来 会宁府遇老姬善鼓瑟自言梨园旧籍因感而赋此
1077623,寓宁国县圃中桃李杂花盛开感而赋诗 其一
453160,过寿县，所居宾馆与基督教堂邻，晨起访之，闻有赞美歌声发于内，感而赋
1001771,厨鸡窜房中张元辅怜而赋诗余不能自已亦为一篇
597260,午日谒屈贾二先生祠有感而赋岁嘉靖甲寅也 其二
492430,初舍弟子彦将赴赣后闻留荷山曾氏馆中喜而赋诗奉寄并呈子中大兄
234680,游定夫见过晡饭既去烛下目昏不能阅书感而赋
585583,答桂阳朱则之欧启河得白石壁澄潭作仰泉楼喜而赋之二首 其一
1066531,余谪沙阳地僻家远遇寒食如不知盖闽人亦不甚重其节也感而赋诗五首以杜子美无家对寒食五字为韵 其五
598260,孙比部以建言谪潮阳宾于小墅清夜相过感而赋此四首 其四
1223921,仙游道士余岫云为从珠溪余隐士求得华山下黄茅冈一曲规作丹室喜而赋之不觉五首 其一
683574,张将军要余与沈令尹潘林曹三子骏儿同泛海时风日清美颇穷胜槩乐而赋之
826537,惜红衣·夏日池荷盛开，香云弥望，载酒吟眺，每徘徊不忍去。今岁重过，数花向残，欹徙丛薄閒，感而赋之。用白石无射宫自度曲韵
1213201,张安道提举重临江浙诸君喜而赋诗且以为南北生徒有所矜式之贺
569842,张将军要余与沈令尹潘林曹三子骏儿同泛海时风日清美颇穷胜槩乐而赋之 其一
613006,辛亥春日读书凤台社中此先君论文地也感而赋之
173938,瓶水生数花须臾有蜂来集感而赋诗
55335,秋夜与子充论文退而赋诗一首因简子充并寄胡
614802,大店驿时轮蹄络绎邮吏多逋感而赋此 其二
294762,苏州有作耆英会者感而赋之
842177,苏州有作耆英会者感而赋之二首 其二
650852,闻孔君志仁至喜而赋此
98423,有以灵寿杖为贶周旋累年忽尔摧折感而赋之
622078,修邑志成有不察而斋怒者乃得谤又以有所誉来也感而赋之四首 其四
1224455,予与刘君师鲁为文字交十有四年而固未尝相识也兹过武林偶遂良觌有喜而赋
146302,有感而赋·俨然楚君子
452955,太平山中有蛙夜鸣，不寐而赋
297582,约同人游吴淞望东海登废垒而赋此
19932,秋夜醉归有感而赋
752603,修武县西北有浊鹿城魏受汉禅封献帝为山阳公城即公所居也道经此地感而赋之
501869,夜梦亡友林伯永有风宪之除觉而赋此
605229,正月十三夜元陟先生见过观灯留酌喜而赋之
605143,壬申初夏槎江邑侯存初王公以课绩考最振旅策勋喜而赋之得五十六字
291136,喜而赋诗·自叹长吟自主张
569258,用晦以三寸箧贮金字佛经咒二十余卷精工之甚感而赋谢
655644,璿庆夜读喜而赋此勉焉
596679,顺德刘生惠鹤即教扎竹以阑之越月驯戏而赋此
1001509,方罹残热忽值新凉喜而赋反悲秋
511256,太虚上人以所注定山种树诗见寄喜而赋此兼稿呈定山
829743,王述庵论诗绝句诋諆放翁感而赋此
1046689,青山高竹楼别业昔尝题诗其壁诗故在而竹楼物故三年矣感而赋诗
769664,沁园春·戊子春闰，予应试吴陵，胡修来过敝里访予不遇，兹于东亭握手，喜而赋此
1081706,腊月二十六夜大雪投晓霁色恍然鸟语啁啾便有春意感而赋之
388529,用晦以三寸箧贮金字佛经咒二十余卷精工之甚感而赋谢
851139,己卯十月一日至燕越五日罹狴犴有感而赋 其七
191224,耘老弟五月十三日亲往新亭种竹喜而赋诗
1244230,分府同知瑶童相公大阅之日天使适至喜而赋诗奉寄刘宾旭参军 其三
688260,禾稼在野人有更生之望喜而赋此
604006,夏日得诸君登镇海楼游浮邱二作喜而赋和 其一
454753,有朋友论聂诗奴性感而赋之
1208544,延祐七年十一月朔小雪既上英宗皇帝入太庙祀享致斋万姓瞻仰喜而赋诗
291151,喜而赋诗·红日丽天万象新
958390,先君守官醴陵日予尝随先生读书岳麓山法华台上时年一十五今兹再来四十有七年矣置榻设几之处历历可寻感而赋
699434,万二酉老师有垂老之疾惑而赋此万里中老儒余家父子兄弟祖孙皆从之游其人可知
625558,予卜居大田自癸巳今庚子夏羊城归七月至于十月率病偶一日午毕循塍行邻犬有见而吠者感而赋之
652659,元日归城南旧居见山茶独开感而赋之
666685,孔汝锡得陜右少参邸报台中旧养一鹤俄鸣舞而去汝锡感而赋诗因同作一首
1242753,司马温公九世孙碏，持公自书独乐园记并东坡诗刻，今将二百馀年，纸不盈尺，手泽犹存。感而赋诗
1005867,退之谓以鸟鸣春往往鸟以夏鸣耳古人麦黄韵鹂庚之句乃真知时山斋静听嘲哳群萃有麦熟之鸣戏集鸟名而赋之
598257,孙比部以建言谪潮阳宾于小墅清夜相过感而赋此四首 其一
452761,航班延误，滞留南京禄口机场而赋
440261,贺新郎  庚寅初冬持社成立诸侣盟于峨眉之巅感而赋此
146304,有感而赋·环堵尘如屋
674342,秋日登老子说经台台下有道德经石刻并手植柏在焉感而赋此
986280,大儿时中堂成德脩弟喜而赋之因次元韵
835331,小重山 客有歌鄂王词者，音节慨慷，感而赋此
810245,三月二十九日偕徐汉卿、易念堂、刘伯蒪、陈晴陔诸大令，黄庆生副戎，策马出城二十里，游葡萄沟。其地山环水抱，柳暗花明。葡萄尤为其土产，蔓生陇畔，十余里无隙地，同人登农家小楼茶话眺览至足乐也。归而赋之二首 其一
1035132,端平三年春三月戊午朔天子有诏俾臣了翁以佥书枢密院奏事既上还山之请乃休沐日丁丑与宾佐谒濂溪先生祠宾主凡二十有二谓是不可无纪也遂以明道先生云淡风轻之诗分韵而赋而诗有二言有四言同一韵者则二客赋之了翁得云字
616328,圆榄山有双树连枝者下有古墓存焉与诸子异而赋之 其一
783688,书院内小斋花草去年所手植也今又重开感而赋之 其三
690550,曾元陟亲家以湘阴广文谢事还里喜而赋之
407902,前见日人诗，今又见韩人诗，两家皆学杨万里，而韩人诗较工，感而赋此（惧危亡）
432574,梅里诗社成立，喜而赋诗，即以申贺
1244228,分府同知瑶童相公大阅之日天使适至喜而赋诗奉寄刘宾旭参军 其一
333575,寓宁国县圃中桃李杂花盛开感而赋诗
368228,移古梅植于贮清之侧已有生意喜而赋之
1077802,夜寝梦游泗上观重建僧伽塔才两层塔以今春同普照王寺焚荡殆尽岂大士有意再来此土乎觉而赋诗以纪之
914936,新栽德安牡丹透根生孙枝皆千叶种也即非接头二月二日瑞云红初开清晓起看喜而赋之
285573,霜降节风雨数日夜感而赋此
492556,闻伯中兄家居日课儿子平原读书小女信女红之暇亦时时弄笔学字偶因家问中见近写二纸喜而赋诗寄伯中长公当发一笑耳
428303,梅里诗社成立，喜而赋诗，即以申贺 其二
249229,报载广州购书中心妆成喜极而赋
441835,文革期间有朋逃港感而赋此
738006,乙丑秋孟颖仙告予贫甚质衣助之偶检文箧见其旧字感而赋此不必寄孟也
542438,申参戎汝承归自岢岚喜而赋赠
700885,病中得长儿潜书至自北京喜而赋此因便书示潜凡
778509,水龙吟  乙巳除日得家报新置木峪山庄慨然有终老之意而赋此
446340,诸子聚饮吾病初愈不意大醉烦无双二兄送归醒而赋此
900303,道间晚稻甚盛喜而赋此
1071879,先大夫元丰间及进士第荣州伯父喜而赋诗宣和四年信道兄登科某时为著作郎侍立集英殿与观唱名未几信道兄调而归某谨次伯父韵以送之
693823,午日谒屈贾二先生祠有感而赋岁嘉靖甲寅也
188073,夜宿方广闻长老守荣化去敬夫感而赋诗次韵
1123998,七月十有五夜一再梦故舒州使君侍御公宛如平生且于其案间得若纸若缯者一沓皆公所书或印者翻之有如帜者三有曰苛政曰赃吏忘其一焉问傍立者以何所用云始朝议欲遣公为某使故建此云觉而赋诗四绝
695580,丁未七夕雨适郑德进馈芳园胡桃时乡人报夷舶因风出洋矣转忆沈约有云胡桃挺自禁地为胡羯奔逃之兆感而赋此
1105041,己卯十月一日至燕越五日罹狴犴有感而赋 其八
456882,江城子 李东寄故人照相二帧，背书“也快乐，却悲伤”。感斯言而赋
1237552,仙游道士余岫云为从珠溪余隐士求得华山下黄茅冈一曲规作丹室喜而赋之不觉五首
551412,蔡景明参知重游晋安过访山居话旧时先永宁殁已九载尚辱垂吊感而赋此
1221373,次韵周公辅游东阳东岘因其所述之实而赋之 其二
346658,去年脩禊后三日得南宫捷报于家今年是日与同年赵簿同事泮宫感而赋诗
949063,游定夫见过晡饭既去烛下目昏不能阅书感而赋之
1066527,余谪沙阳地僻家远遇寒食如不知盖闽人亦不甚重其节也感而赋诗五首以杜子美无家对寒食五字为韵 其一
906002,成父居士于普光明堂之东别建大阁榜曰妙严将家焉阁成李子过而赋之
641655,季子延奴初学语见书帙在案时辄作嚅嚅唲唲声若解诵然以其不由教而能尔故喜而赋诗且以示浩使知有所警云
1244229,分府同知瑶童相公大阅之日天使适至喜而赋诗奉寄刘宾旭参军 其二
440108,减字木兰花 偶翻旧帙，扉页中落下残花数片，乃少年时拾作书签者也。感而赋此
1223924,仙游道士余岫云为从珠溪余隐士求得华山下黄茅冈一曲规作丹室喜而赋之不觉五首 其四
762006,景孙体弱，未严课而诗文日进，喜而赋此
558964,九日至极乐寺闻袁中郎且至因喜而赋
532304,禾稼在野人有更生之望喜而赋此 其二
851130,己卯十月一日至燕越五日罹狴犴有感而赋 其九
597065,枯椰先祖移居，植椰成林。经八十馀载，仅存其四。今秋忽枯二株，感而赋之
851129,己卯十月一日至燕越五日罹狴犴有感而赋 其十二
1070277,自仲嘉云亡未始见梦舟行夜入吴兴境有梦如平生感而赋诗四首 其三
368257,里中小渔舟被差防江有感而赋
493599,泊徐州洪乡人有携酒相饷者喜而赋此
685043,李三洲宅上兰盛开感而赋此
1077753,闻山东盗所谓丁一箭者拥数万众临江破黄州官吏皆保武昌江湖间骚然未知备禦之策感而赋诗
186614,道间晚稻甚盛喜而赋此
605234,王幼度明府为今大宗伯云杜李本宁先生犹婿余以本宁先生获交幼度盖三十馀年笔研友也先数岁宝安同社诸君子欲为余作特室于旗峰之阳且受廛矣甲子冬幼度以龙门令摄篆宝安喜而赋之得十六韵以先歌来暮者言非未同幸毋曰此饥鸟此阳鱎也
702138,答桂阳朱则之欧启河得白石壁澄潭作仰泉楼喜而赋之二首
416552,声声慢 闻东北警报，感而赋此
1063074,王晋卿图瀛山笔画精致京师贵游蓄之为希代之宝自图书弃掷于路阳翟张飞卿见而得之过九江以遗友人傅延之延之出以示余余悲而赋诗
844890,苏州有作耆英会者感而赋之二首
690542,甲子元日邑侯裒谷孙公枉驾投辖既贻珠玉复命棋枰留酌竟日喜而赋谢
573572,道傍榆柳树皮饥民取食殆尽感而赋之 其二
676632,登平远见亡友许启衷书扁感而赋此
790812,箧中检得败纸一束，启视则游梁时留存之要牍也。感而赋此二首 其一
1055530,石端若以朱丝栏见邀作而偶失所在久方得之喜而赋诗寄丁希韩因以见及遂申前志次韵
297603,庚戌秋冬之际上海检查鼠疫风潮陡起，感而赋此
443699,观新排赣剧《牡丹亭》，曲调多借鉴西乐，舞姿则颇似芭蕾，感而赋此 其一
1057939,梦与舍弟登灵泉步趋如无疾既觉感而赋诗用王介甫韵
835040,法曲献仙音 仲恕倩其夫人吴重画金带围故事以寿阶青，余艳而赋之
325411,余客闽之南靖海水爆发几致淹没感而赋此
1252619,分府同知瑶童相公大阅之日天使适至喜而赋诗奉寄刘宾旭参军
623340,望白云在天忽然有感而赋此
311602,愤而赋此·元戎开府说天波
914864,龚令国英约小集感冷暴下归卧感而赋焉二首 其二
843236,荫坪叠落花前颌四首索和己未及今十年矣感而赋此 其二
727435,探春·月夜饮荒祠水木明瑟池馆苍凉主人告予曰此邹副使愚谷十二楼址也声伎豪侈今衰歇矣感而赋此
581707,弘治乙丑二月宪长入觐予暂署堂事比得代就间戏而赋此
270839,水龙吟·乙巳除日得家报新置木峪山庄慨然有终老之意而赋此
652298,遣使诣李中麓太常求录诸经图解获之喜而赋谢
851135,己卯十月一日至燕越五日罹狴犴有感而赋 其八
273478,日本投降世界和平公园开庆祝会感而赋此
562039,十月三日过梧桐泾时官籍仆彦宅彦庞氏唐氏自经感而赋之
500106,并州五月中旬雨未沾足而风气萧然与清秋无异感而赋此
520126,杏花盛开喜而赋此
545558,与张仲立顾靖父别且十年馀忽晤于顾山人斋中喜而赋此
428302,梅里诗社成立，喜而赋诗，即以申贺 其一
1102401,过江陵镇登秦申王坟读决策元功精忠粹德碑文有感近事而赋
1182740,商山临路有孤松往来斫以为明好事者怜之编竹成楥遂其生植感而赋诗
553407,洪武九年岁丙辰二月十日被擢秦王礼官十七日同秦晋燕王府官僚召见奉天门下各赐马一疋楮币有差惶悚感激退而赋诗 其二
1070275,自仲嘉云亡未始见梦舟行夜入吴兴境有梦如平生感而赋诗四首 其一
1128586,余谪沙阳地僻家远遇寒食如不知盖闽人亦不甚重其节也感而赋诗五首以杜子美无家对寒食五字为韵
605030,丙寅初春参知洪崖王公移镇惠潮喜而赋之 其一
512837,无锡沈宗贵存耕翁之仲子自弱冠侍翁至余家余年十三见先父以诗画赠存耕经四十九年尚存宗贵所观感而赋此
315542,并州五月中旬雨未沾足而风气萧然与清秋无异感而赋此
443700,观新排赣剧《牡丹亭》，曲调多借鉴西乐，舞姿则颇似芭蕾，感而赋此 其二
566097,予慕游五岳久矣程子乃先我登嵩华高篇寄及感而赋之一首
573571,道傍榆柳树皮饥民取食殆尽感而赋之 其一
783687,书院内小斋花草去年所手植也今又重开感而赋之 其二
345706,罨画连雨溪涨丈馀雨霁水落喜而赋诗
954776,凤凰台闲眺台前瞰军垒有感而赋
94395,皈卧感而赋焉·客里何烦病
1110560,向伯恭侍郎致政芗林筑一堂名之曰企疏晋陵孙某闻而赋诗二首
452204,己丑仲冬予作粤闽之游归来见诸友悼诗方知西溪病夫已然下世感而赋此
146305,有感而赋·直弦不似曲如钩
1106810,与长老夜话出故人俞宋护书予至山之日俞书适至书中又相问讯感而赋诗二篇俞郊居婺源草堂蔬圃教子读书乡人重之闻近苦目疾殊可念
66270,虎丘舟中见杨花撩乱飞入幕内感而赋之
690465,仲师宗雅见过小园喜而赋赠
489475,丙卿还乡里卖药躬耕予喜而赋诗为别
898155,寒食后数日方持斋诵经而东园游人甚盛因而赋此
679824,得石宝山喜而赋
731947,忻口以往气象大类塞垣生来偪琐至此始觉有历落意因而赋诗
963494,中春中浣后一日老人挈累下西市寓舍越三日某行感而赋诗呈友人 其一
985704,宣城琴高之名甚著转送四方甚珍品也比得之乃乡间桐鱼耳一笑而赋二首 其一
553406,洪武九年岁丙辰二月十日被擢秦王礼官十七日同秦晋燕王府官僚召见奉天门下各赐马一疋楮币有差惶悚感激退而赋诗 其一
655573,枕上默诵中庸稍悟一书大旨喜而赋此
333091,四和香·黄三出所藏元刊文信国集杜诗属题盖囗中作也感而赋此
1125955,宣城琴高之名甚著转送四方甚珍品也比得之乃乡间桐鱼耳一笑而赋二首
411464,丁酉夏余应安徽省文史研究馆之聘，寄居岳西县垣，夜不成寐，起读杜工部诗，感而赋此 其一
553855,五月一日钦蒙赐扇上有古人嘉言皆当今名翰伏读之馀喜而赋此
115298,寒食后数日方持斋诵经而东园游人甚盛因而赋
1073859,罨画连雨溪涨丈馀雨霁水落喜而赋诗二首 其二
1061452,李伯时作渊明归去来图王性之刻于琢玉坊病僧祖可见而赋诗
970885,七月十有五夜一再梦故舒州使君侍御公宛如平生且于其案间得若纸若缯者一沓皆公所书或印者翻之有如帜者三有曰苛政曰赃吏忘其一焉问傍立者以何所用云始朝议欲遣公为某使故建此云觉而赋诗四绝 其一
338875,西子妆·雨中坐放鹤亭眺湖光山色感而赋此
540686,己丑开都城有妒妻斮其妾之双足者妻就刑夫逋焉感而赋
668222,小斋盆兰一干数花山谷所谓蕙也初秋抽数干芳馥可爱因与次明道复赏而赋之
679927,永乐甲辰之秋岳阳方豸史佺按辔赤水偶得一联云云生石洞重阴合雨过峰峦积翠深索余足之因而赋此
612095,读张烈妇传不觉雪涕风雨骤至感而赋之
604514,仲师宗雅见过小园喜而赋赠 其一
1073858,罨画连雨溪涨丈馀雨霁水落喜而赋诗二首 其一
585584,答桂阳朱则之欧启河得白石壁澄潭作仰泉楼喜而赋之二首 其二
908356,过大信口忆西归录载大江渺渺忽二石山如伏猊引出水面东西对峙江形若瓢然而山乃其口然相距犹三四里则江之广狭可见视之信然妙哉写物之功感而赋此篇
732504,友人搜录东沙公遗集感而赋诗 其二
347413,客谈西湖旧事感而赋诗
599803,闻唐子妙阳出宪狱喜而赋此
842176,苏州有作耆英会者感而赋之二首 其一
331285,得家信报淮南飞蝗渡江入浙岁事殊可忧感而赋诗
464298,满庭芳·癸亥清明，覃儿归上冢。先数夕梦其母贷用于人，谓何不向儿取，内子怒而去。顷年境幸殊前，每思及内子处困时，辄为之叹息。感而赋此
493219,余兄弟因避乱山中复有衾枕团栾之乐喜而赋诗
281861,前阅报见满洲里俄人画界交涉，今过安奉铁道，又见人竭力经营，感而赋此
369559,先大夫元丰间及进士第荣州伯父喜而赋诗
961896,余卜居偶得山水之胜喜而赋之
616329,圆榄山有双树连枝者下有古墓存焉与诸子异而赋之 其二
471284,漂母非能知人特一时能施于人耳观其对信数语可见而古今论者胥失之予过其祠感而赋此
978230,二月廿九日收宗玉弟京口书还家有日喜而赋诗
145875,有感而赋·风前泣灯影
915267,西斋旧无竹予归自毗陵斋前忽有竹满庭盖墙外之竹迸逸而生此也喜而赋之
1201047,木兰花慢 丙戌岁游永安故宫遍览太液池莲瀛桂窟殿天香阁同坐中诸客感而赋此
957586,黄鲁直示千叶黄梅余因忆蜀中冬月山行江上闻香而不见花此真梅也鲁直然余言曰不得此乐久矣感而赋小诗
444256,梦仙游 庚寅中秋风雨凄凄感而赋此
604007,夏日得诸君登镇海楼游浮邱二作喜而赋和 其二
