940704,陪赵工部三峡白鹿之游有感而赋 其一
443725,窗下蜡梅一株，经风历雪，除夜或有将爆竹悬于枝头燃放者，晨起视之，花犹怒绽，感而赋此
1066528,余谪沙阳地僻家远遇寒食如不知盖闽人亦不甚重其节也感而赋诗五首以杜子美无家对寒食五字为韵 其二
522432,辛巳泊舟青县有畜犬登岸将发哀号觅舟他人驱之至欲泅水而不顾今日午食见其循案齧骨感而赋之时三月六日也
44396,夜梦亡友何梅士觉而赋此
921883,欧阳叔弼见访，诵陶渊明事，叹其绝识，既去，感慨不已，而赋此诗
748426,得以黄兄书知归有日矣喜而赋此
238564,读陆逵常簿奏篇喜而赋
558205,移桂遂长新叶喜而赋之
92783,六月初四日往云际院田间雨足喜而赋之
851132,己卯十月一日至燕越五日罹狴犴有感而赋 其十六
552165,壬申中秋夜邀诸友饮风雅堂月光皎甚兴亦颇佳欢赏未终漏下五鼓矣因忆余自归里以来七度中秋四值阴雨中间愁病相寻事与心阻此饮殊未易得也感而赋此
703899,大店驿时轮蹄络绎邮吏多逋感而赋此
958121,益昌霪雨踰月负郭皆浸祷祠之后仓廪保全居民复业运使国博喜而赋诗辄成三绝句以报来贶 其二
551381,林子真久客临汀闻余归自长安贻书慰藉感而赋荅
420041,一萼红 瓶梅一枝，春意蓬勃，将办出山，感而赋此
790813,箧中检得败纸一束，启视则游梁时留存之要牍也。感而赋此二首 其二
1223922,仙游道士余岫云为从珠溪余隐士求得华山下黄茅冈一曲规作丹室喜而赋之不觉五首 其二
277636,阮郎归·上海市文学艺术工作者第二次代表大会开幕，喜而赋此
1073820,山阳守吴子仁遗两鹤喜而赋诗二首 其二
674338,舟至临清大风晦冥闻过客言谷亭盗贼之势甚剧感而赋此
569250,金陵遇中贵人结好甚深于余归追送栖霞浃日夕乃别感而赋此
679143,中秋闻文用弟有浙江清戎之命喜而赋此
604247,癸丑正月二十五日客有以街谈见示者悲而赋之
851138,己卯十月一日至燕越五日罹狴犴有感而赋 其一
452263,庚寅中秋登狼山望长江子佩言此为长江之尾岸阔潮平恰如人到老境旷达平和感而赋此
788486,归化城郊原蒙古持献清茶炒麋伏迎道左喜而赋之
428078,日本投降世界和平公园开庆祝会感而赋此
992279,麦门冬内子吴中手植甚繁郁罢官移之而归不幸内子道且亡而兹草亦屡枯今所存三之一耳遂感而赋云
851128,己卯十月一日至燕越五日罹狴犴有感而赋 其五
428304,梅里诗社成立，喜而赋诗，即以申贺 其三
311771,声声慢·闻东北警报，感而赋此
149655,祷晴获应喜而赋诗
783689,书院内小斋花草去年所手植也今又重开感而赋之 其四
415609,庚辰中秋之夜宿于巴黎有感而赋
453124,闲憩小汤山红栌山庄，感事而赋
588303,李三洲宅上兰盛开感而赋此 其二
1207485,城上乌者取晋叔向城上有乌齐师其遁之谓而作也汉桓帝时则有其谣迨梁刘孝威吴均辈比有作焉然各有托而不及此意余方感悼其事因补其义而赋云
765052,满江红 羽檄交驰，慨然有从军之志，感而赋此
1119225,陪赵工部三峡白鹿之游有感而赋
301904,桂林柳州相继失守悲愤填膺感而赋此
384534,同王履约过道复东堂时雨后牡丹狼藉存叶底一花感而赋诗邀道复履约同作
618907,潘君理古琴予重而赋此
572866,万二酉老师有垂老之疾惑而赋此万里中老儒余家父子兄弟祖孙皆从之游其人可知 其一
496934,閒助甫参伯近有西秦之命喜而赋诗寄之
769062,解语花·见江岸草花淡红可爱而赋
472982,虎丘舟中见杨花撩乱飞入幕内感而赋之
408346,桂林柳州相继失守悲愤填膺感而赋此
150878,余卜居偶得山水之胜喜而赋之
973834,四月十二日以夏潦暴甚舣舟辰之铁枪崖下偶得浮木于水中宛然如山因其形似名曰卧岭立峰喜而赋诗当寄交友之能诗者求著语焉
1060451,绍圣二年秋七月乙未夜梦游一胜处非平生所经行见一道士延余坐饮以醇酒酒酣道旧故恍然不知所以因而赋诗既觉漫不复记忆戏作五言以补之
627111,梦黎洞石先生招饮大雅堂盖秘书公之诒耶觉而赋之以为先生寿
331880,行香子·构屋水滨喜而赋此
571197,久驻武缘僦居僻漏邑有千户所屋废基存旋命兵士芟草辇秽伐竹构堂而环之以营数日毕工遂移居之时则文武过奁禽鸟欢鸣嘉树扶疏而出喜而赋此
326779,夜宿方广闻长老守荣化去敬夫感而赋诗因次其韵
1233804,吟稿为寇所攘感而赋
1223925,仙游道士余岫云为从珠溪余隐士求得华山下黄茅冈一曲规作丹室喜而赋之不觉五首 其五
591097,元旦夜梦屋后盛产灵芝既报得长孙又闻国医活泉疗儿妇有再生之力喜而赋赠
851137,己卯十月一日至燕越五日罹狴犴有感而赋 其六
866434,祷晴获应喜而赋诗
572603,残冬选曹乏人戴星出入不觉过春感而赋此
1097957,子野惠竹?有感而赋二绝 其二
776982,夜过伯初见三弥案头有司马景和碑内夹和杜五古一首三弥作也喜而赋赠将索损轩同年和以张之
146306,有感而赋·风霜阴忽忽
1077665,午暑憩潭田精舍老僧求询其曾游方否云以少尝一到分宁感而赋此
1239700,二月望在巩昌客馆夜梦归里中与金十二丈傅九文学同游高五处士别业既觉有感而赋
623365,古今人多作留春诗而莫有留夏者感而赋之
571147,宿亨二明府一室萧然喜而赋此且慰公怀云
400655,渔家傲 盂兰会世已绝迹，南中犹盛行，诵经以度拓荒叔伯之魂魄，感而赋之，用范希文韵。
