1087795,昨以诗徵亡碑于四十一丈既蒙酬和而诸兄亦继作焉联为巨编藏之巾笥虽所亡古刻不可复得而此之所获则已多矣顾其中犹有不能释然者因念吾子厚隶法妙古人当为我大书伟辞于壁庶以焜耀区区之望彼死鬼之陈迹其存亡盖不足为重轻也次韵见意云
1112921,仲钦寄民为重斋诗和答
1089152,仲钦寄民为重斋诗和答 其五
1089150,仲钦寄民为重斋诗和答 其三
300886,天问楼图为重禹题
879146,贺新郎 五用韵。读坡公《和陶诗》，其九篇为重九作，乃叙坡事而赋之 其三十六
374659,道场山·水国山为重
607948,乡人张德量为筑先妣坟兹复为重修工讫辞予曰官人此去入朝不知何时再见予不觉感伤赋此别之
200681,游籍田·国典斯为重
92669,将至萍乡欲宿为重客據馆乃出西郊
27524,夷门·晋鄙兵回为重难
483318,中夜闻风雨满林明旦即为重九情之所至辄见乎辞
351958,仲钦寄民为重斋诗和答
1089149,仲钦寄民为重斋诗和答 其二
948540,丙辰七兄有诗及人月分圆己未彼此服药未能夜坐今次旧韵为重九之约
1089148,仲钦寄民为重斋诗和答 其一
492230,张仲良燕饯郑子素于黄竹径之梵閤时天气暖甚桃花盛开后四日为重九矣得携字
913026,将至萍乡欲宿为重客据馆乃出西郊
1089151,仲钦寄民为重斋诗和答 其四
567844,大兄八十初度为重丸后二日直是年以医劳得冠带而楼居南对火珠山
855432,文监丞出关子东西湖春游倡和且约为重九之游次韵
295777,陈韬庵师八十生日又为重宴琼林之岁诗以贺之
447633,渝州大雾白昼如夜，枯坐终日，接友人诗始悟今日为重阳
1249059,十二月廿二日为重阳王真人诞辰是日立春在淞江长春道院瞻拜真人及七真像敬题薛一山丹房
240693,文监丞出关子东西湖春游倡和且约为重九之游
414686,天问楼图为重禹题
60103,中夜闻风雨满林明旦即为重九情之所至辄见
