922677,过潍州驿，见蔡君谟题诗壁上云：「绰约新娇生眼底，逡巡旧事上眉尖。春来试问愁多少，得似春潮夜夜添。」不知为谁而作也？和一首
589771,刈稻过山家留宿夜闻雨声旦视花片满涧疑异境也题诗壁间以志来约
612359,大司马舒公六十年前令莞有保障大功鼎新遗爱祠未竣嗣孝廉再航来莞瞻拜祠下题诗壁间余见而悲之步元韵奉慰
1029198,除日狱空唯欠租监系颇众因悉纵遣之期以开岁五日毕来因记东坡先生倅杭除夜直都厅囚系皆满题诗壁间辄用其韵
544372,载过曹能始时能始入长安余暮留斋头翌日题诗壁上
373326,政和甲午孟冬休后一日苏过叔党彦明自开化甘泉至明仙时念老禅师复出世矣因题诗壁间
801294,华顶道院见三十六峰老农吴青霞题诗壁间寄赠
1065966,政和甲午孟冬休后一日苏过叔党彦明自开化甘泉至明仙时念老禅师复出世矣因题诗壁间
1081543,登第西归过甘罗庙题诗壁间
1250282,至正庚寅岁分宜丞舒君尚翁浚治章湖寓宿白斜巡检署题诗壁间尚翁乙酉进士予故人也岁丙申经过白斜睹遗迹嘉循政因续其韵
362339,登第西归过甘罗庙题诗壁间
555701,许由巢父二人皆唐尧时高士也与后世身陷缧绁者相去不啻万世传称弃瓢饮犊事皆未知有无昨夜梦入其庙中见二人像欣然有感题诗壁上未就而觉乃足成之甲辰九月二十二日书于狱中
