594279,初秋吴幼安佘宗汉闵寿卿陈守礼郝谦亨程孺文黄白仲梅季豹集青溪馆汪象初祁羡仲不至得干字
551266,秋日陈汝大邓汝高陈振狂陈子卿陈幼孺袁无竞兴公弟集绿玉斋时余与子卿幼孺下第归自长安汝高将使浙中兴公将游白下
615996,喜潘冂卿陈给谏同时还里
694015,夜宴邓卿云将军府第同诸生李明卿廉安卿陈子晋潘子敬李大亨时史先生与严思孔刘近之驾扁舟送余湖中风涛大作暮薄相失末首却寄
600843,夜宴邓卿云将军府第同诸生李明卿廉安卿陈子晋潘子敬李大亨时史先生与严思孔刘近之驾扁舟送余湖中风涛大作暮薄相失末首却寄 其一
494631,送太仆少卿陈先生之南寺
511650,题太常少卿陈公锡草堂
541269,同山人林熙甫父老陈焜诸生陈巽卿陈练游菱溪五云山 其二
585047,早朝和大理少卿陈以道韵
622004,九九同周仪伯张长卿陈木生游玉泉寺
614963,宋惟四招同胡虞卿陈治甫曾文卿暨家仲游禺峡新辟诸胜因酌清音楼
594398,中秋郭次父陆华甫周文美陆无从胡伯昂何长卿李季常安茂卿陈从训黄白仲陈季迪梅季豹过集得长字
681107,挽致政太常卿陈贽
1234726,喜雨赠林子卿陈正夫
541270,同山人林熙甫父老陈焜诸生陈巽卿陈练游菱溪五云山 其三
507037,送大理卿陈勉之南京
605064,丁卯仲春入五羊黄元卿陈太素两国学招集太素海上亭时太素欲为余决东官卜筑之策
120258,次韵朱万卿·陈雷好宾主
773611,祝握卿陈先生五十四
600844,夜宴邓卿云将军府第同诸生李明卿廉安卿陈子晋潘子敬李大亨时史先生与严思孔刘近之驾扁舟送余湖中风涛大作暮薄相失末首却寄 其二
600845,夜宴邓卿云将军府第同诸生李明卿廉安卿陈子晋潘子敬李大亨时史先生与严思孔刘近之驾扁舟送余湖中风涛大作暮薄相失末首却寄 其三
773650,寿握卿陈先生四十八
594597,韩承志阮时济张幼于马云卿陈忠甫吴德光周懋脩钱功甫黄子华张孟彪舟送宝带桥赋别得关字
594015,九日登永上人藏经阁同沈比部箕仲沈虞部少卿陈博士伯符分得开字时王宗鲁张文起二中郎不至
541268,同山人林熙甫父老陈焜诸生陈巽卿陈练游菱溪五云山 其一
686375,同山人林熙甫父老陈焜诸生陈巽卿陈练游菱溪五云山
