415784,读餐霞阁主旅游诗后赋呈一律乞正
409757,宾如筑菱湖公园，久期予至，今来三月，不及观荷，宾如有赏雪之约，赋呈一律
469816,闰重阳邀众社集座中又呈一律
426370,叶云老不日赴沪戋戋微物聊表寸心并呈一律乞正
263285,宾如筑菱湖公园，久期予至，今来三月，不及观荷，宾如有赏雪之约，赋呈一律
410795,得香宋师书并诵和章呈一律
774256,僧石峰和余游海会寺诗复呈一律依韵答之
327768,僧石峰和余游海会寺诗复呈一律依韵答之
407270,卧病雨中，象姚、巨卿两兄晨夕过存，赋呈一律
660389,十月十八日雪湖诞辰乃郎告归称寿附呈一律
267898,得香宋师书并诵和章呈一律
287311,戊戌中秋与村白水陈锦涛洪复斋蒋信斋张养农方楚青蒋澍堂常伯旂同饮天津酒楼时余蒋南归率呈一律
318551,卧病雨中，象姚、巨卿两兄晨夕过存，赋呈一律
793379,追感前事复呈一律
819000,戊戌中秋与村白水陈锦涛洪复斋蒋信斋张养农方楚青蒋澍堂常伯旂同饮天津酒楼时余蒋南归率呈一律
318191,读餐霞阁主旅游诗后赋呈一律乞正
307252,叶云老不日赴沪戋戋微物聊表寸心并呈一律乞正
406983,兼翁于书窗前拓地为圃，命之曰瓠，有诗徵和，戏呈一律
58517,闰重阳邀众社集座中又呈一律
