1085929,七月十七日离夔州是夜宿瞿唐
403638,醉吟商小品 四月初一夜闻杜鹃，是夜履平来宿，遂邀同赋。履平有《踏莎行》一首甚美，惜今佚其稿
658714,孟秋夜陪飨太庙值雨礼成趋出门且闭归途水几没膝是夜惟予与谢亚卿同之
384218,是夜令人速王明佐不至至桥上更酌时沈山人寓园咫尺闭户却寄二君
1230997,八月望与项可立约游石湖是夜月蚀又雨次韵就约王山人明日同游
460392,满江红　是夜归涂遇雨戏作
54155,是夜酌泉试宜兴吴大本所奇茶
675163,中秋同献吉诸公登镜光阁是夜无月
751323,四月九日重赴白堤汪氏馆斋是夜月不甚皎徘徊清梦轩池上凄然有作
562172,中秋试院和马新仲一首是夜无月
458031,胡僧兄过巴陵，抵掌相谈，自日之午，及夜之午。是夜秉烛饮于湖上，次午复饮于湖侧。予席间记晨起一绝，复指头夜饮处，补书一绝，聊发胡僧一笑 其一
450020,是夜雨停，新月初升偶题
450094,居城有塔。是夜，万灯寂灭，其一盏独明。令人有思。
700139,乙丑孟秋下旬四日杨中丞绝命诏狱是夜初昏时有气如白练起尾箕间扫紫微掩天枢五星时在燕邸目睹感赋二首
1005341,十月十三日嫩晴薄寒山房新构书阁去年此日北兵入是夜自中心墺徙独山
1215902,中秋宿贵义岭下是夜无月
401781,汕尾渔歌·日落西山是夜昏
1221418,是夜宿三一庵次俞文辅题韵
713291,冬日寓梁药亭六瑩堂始刻日作古乐府梁王顾自车陂至是夜欧阳伟人刘汉水过宿分赋得灯字
911680,是夜闻十六兄雪中有作次韵
512015,丁夘秋予领乡荐之京三兄志广偕亲友饮饯都门之外把袂而别是夜宿龙江驿
552485,七月望宿府学口占一绝呈梁先生伯益是夜月既蚀濠梁卫随班行礼
251193,返京日偕内登匡庐是夜倦客夫妇于浔置酒为余送行
452291,辛卯三月应田茂兄邀到杭是夜与翼奇先生深深女史选钢夫妇宴饮楼外楼散后寄翼奇先生
461584,返京日偕内登匡庐是夜倦客夫妇于浔置酒为余送行，时王公品科、卢兄向闲伉俪、抱月及午阳诸兄在席。感其厚谊作长句为谢
783332,癸亥五月二十后酷热异常死者万计六月五日恭遇皇上省躬求言是夜北风大作继以膏雨沴戾顿除仰见圣主至诚格天捷于影响赋此纪异且私幸其安全也
806858,清平乐  长至前五日适吴门诸子有填词社初集之举同集余澹心秋雪斋是夜风雨
808713,泊舟济宁是夜无酒因怀太白旧游
1077375,是夜复乘泛碧斋至北溪口观新桥与兴宗志宏分题予得泛字
950724,去岁五月二十八日发雪锦亭以六月旦谒富池而行是夜始望见庐山今岁以此日正在湖渰中念岁月之倏忽惊道途之劳勚回首感叹二首 其一
582113,予巡自东还过重庆大参吴公饯予舟中既醉日晚别去予舟西行是夜月色如昼江空沙白壶觞对影有怀吴公因作二律 其一
588320,重九日是夜舟泊石门偶作呈三洲右溪
1245621,七月十有一日寓馆暂移，是夜梦家父有诗云：“移书别西舍，有梦到云林。树远风难至，窗虚月入深。生徒能夜读，朋友肯来寻。呼得邻家酒，孤斟慰客心。”明日用此韵送吕尊师
1225993,九月晦日张机仲同宿明庆亨会堂上人房是夜读罗昭谏诗
65590,杨中丞绝命诏狱是夜初昏
446364,寤堂兄久滞长安尝言如鹰在鞲复言如火焚心为职乎为情乎慨莫能辨是夜忽闻来电欣欣然感而戏赠
546102,月下船窗独坐寄内是夜系缆东昌
1121061,去岁五月二十八日发雪锦亭以六月旦谒富池而行是夜始望见庐山今岁以此日正在湖渰中念岁月之倏忽惊道途之劳勚回首感叹二首
447301,初识万龙生兄于蔡淑萍姐寓所，蔡姐欲备肴小饮，万兄曰：不必，以友谊佐酒可也。遂各尽一盅。是夜得句，寄万兄蔡姐求正
383684,赠获嘉岳茂才内日华仙掌一联乃是夜梦中句也
470774,乙丑孟秋下旬四日杨中丞绝命诏狱是夜初昏时有气如白练起尾箕间扫紫微掩天枢五星时在燕邸目睹感赋二首 其一
275911,南歌子·仲冬廿五日送湘芷南归后，是夜拥被无眠，离怀转侧
676459,是夜令人速王明佐不至至桥上更酌时沈山人寓园咫尺闭户却寄二君
505576,是夜蒙公相寄示三首因用韵以成 其二
466163,胡僧兄过巴陵，抵掌相谈，自日之午，及夜之午。是夜秉烛饮于湖上，次午复饮于湖侧。予席间记晨起一绝，复指头夜饮处，补书一绝，聊发胡僧一笑
809605,癸未春二月二十日自杭回至苏州是夜雨二十一日朕欲北行地方大小官员百姓留住二十二日雨甚冉留不能起行二十三日雨晴又欲留故书怀以示
251202,连康山客栈听雨约赋长句是夜结句先得
74369,五月九日调军入绥宁是夜宿风门岭值雨
255267,已经是夜晚，露珠
746107,宿回水铺是夜风雪交作晨兴书店壁以志岁月
284378,十一月望，为亡室刘建信诞辰，是夜月明如水，匡床独据，感念万千，因作悼亡诗
796252,更漏子 四月十四日五渠观水嬉，是夜微有月色，灯彩甚佳，戏填此阕
1251662,洪武甲子中秋夜祀风雷山川前此积雨是夜晴霁喜而赋诗以志云
677604,是夜宿白水寺相传冬春积雪封山诸兽皆远伏及春深鹿开山人始行
461566,连康山客栈听雨约赋长句是夜结句先得
323381,七月十七日离夔州是夜宿瞿唐
950723,去岁五月二十八日发雪锦亭以六月旦谒富池而行是夜始望见庐山今岁以此日正在湖渰中念岁月之倏忽惊道途之劳勚回首感叹二首 其二
547753,赠获嘉岳茂才内日华仙掌一联乃是夜梦中句也
809729,回舟至常州府是夜甘霖大霈
621932,归道取西山是夜宿碧云
659123,癸未春予送女至京口至之明日为上元节是夜宴邃庵杨少傅第少傅悬灯于山灿烂奇甚
251211,满庭芳·乙未谷雨与诸朋有明月山之行是夜小饮约寄此调
837659,浪淘沙·蕙风翁天春楼漫笔，有记螳螂一则。言藤本花有曰夜来香者，其叶下必有一二小螳螂栖集，纤碧与叶同色，若相依为命者。曩寓金陵岁买是花，罔或爽也。词人体物之微，即小可以见大。余笑语翁若仿王桐花句例，当云妾是夜来香，郎是螳螂矣。翁深赏是语，谓天然浪淘沙佳句也。联咏足成一解
593308,是夜雨后郭建初陈忠甫程无过复携酒玩月显恩精舍
698427,是夜蒙公相寄示三首因用韵以成
708586,玉楼春 游明因寺折桃花一枝贮之胆瓶是夜风雨大作
413530,十一月望，为亡室刘建信诞辰，是夜月明如水，匡床独据，感念万千，因作悼亡诗二首 其一
283591,霜花腴·暂归故里，薄游城邻，风日不殊，坊巷犹是。夜与磊安清话，援笔记之。用梦窗韵
505577,是夜蒙公相寄示三首因用韵以成 其三
228614,是夜闻十六兄雪中有作次韵
1240446,五月九日调军入绥宁是夜宿风门岭值雨
1215837,正月二十二日押纲离杭是夜泊舟浮山
191538,是夜三鼓后睡起月色满庭
809377,是夜对月再成绝句
458032,胡僧兄过巴陵，抵掌相谈，自日之午，及夜之午。是夜秉烛饮于湖上，次午复饮于湖侧。予席间记晨起一绝，复指头夜饮处，补书一绝，聊发胡僧一笑 其二
477898,是夜酌泉试宜兴吴大本所奇茶
256091,我是夜熟知的人
413531,十一月望，为亡室刘建信诞辰，是夜月明如水，匡床独据，感念万千，因作悼亡诗二首 其二
807458,念奴娇  十三夜大宗伯王敬哉先生招饮是夜无月七叠前韵
505575,是夜蒙公相寄示三首因用韵以成 其一
582114,予巡自东还过重庆大参吴公饯予舟中既醉日晚别去予舟西行是夜月色如昼江空沙白壶觞对影有怀吴公因作二律 其二
452797,报称己丑上元月圆为五十二年所未有是夜携内并秉初君一利刚诸君上韬光寺叙茶可仁法师鼓琴亥将尽步月露台中天如洗而遥望钱塘繁华则缥渺若尘外景遽尔心动忽焉思归
622851,十七晚抵乐民是夜宿所内旧栖凄然有述
663982,是夜草堂小集呈坐客
1085611,夜宿下沙步有小浦藏舟于口惧有风也是夜浪忽作声如潮舟为之撼如是者三舟人惊惧初谓有风起视则天籁不号星月皎然篙工云江中畏炮炙邻舟有煎油者岸圮而浪生晓视之果有圮处或云鼋鼍之属因记之
349422,毅夫即事·却笑元宵是夜游
459612,是夜予零点，班中彼忽电至，泣不成声，予心亦难持
470775,乙丑孟秋下旬四日杨中丞绝命诏狱是夜初昏时有气如白练起尾箕间扫紫微掩天枢五星时在燕邸目睹感赋二首 其二
446240,是夜闻风雨大作赋此
250513,辛卯三月应田茂兄邀到杭是夜与翼奇先生深深女史选钢夫妇宴饮楼外楼散后寄翼奇先生
622005,是夜宿碧云寺
553196,八月中秋日宿郑文中家是夜月食随班行礼次日玩月慨然有怀作古诗一首
693401,予巡自东还过重庆大参吴公饯予舟中既醉日晚别去予舟西行是夜月色如昼江空沙白壶觞对影有怀吴公因作二律
886667,普通山距府东十数里青州禅师洪果道场也自龙华归过之栋宇颓落僧徒鄙野良为可惜是夜雨大作因书所闻所见为长韵
524510,是夜雨
576991,斋居许州兴国寺是夜大雪
541379,元旦同梁懋孚叶思叔冒雨游湖是夜风雨大作随波达旦
1029002,是夜三鼓后睡起月色满庭
432934,十一月望，为亡室刘建信诞辰，是夜月明如水，匡床独据，感念万千，因作悼亡诗二首
657985,公去予送至老人港是夜宿于舟中明日言别而仪真之兴尚勃然也更有数语
462127,满庭芳 乙未谷雨，与诸朋有明月山之行，是夜小饮约寄此调
1057217,枫桥寺读张祐诗碑云长洲苑外草萧萧却忆相从岁月遥惟有别时应不忘暮烟疏雨过枫桥是夜与温老语殊可人翼日又邂逅程梦良二人相送寺门因留一章纪事
502193,慈亲花甲之日是夜梦中称寿觉后有感
