324461,次韵欧阳广明以诗送钵盂
155651,始生之日黎明以职事出郊
1244313,余穷阨闾里年甚一年风雨重伤世味尤恶因思去年索酒于志明以与黄花解嘲今年志明亦复避地虽黄花可得见哉感慨成诗又无与寄因题之壁上以记此时情况焉
546549,过晋陵欲访朱在明安二茂卿云在明以先一日往京口矣十载之期竟左成约殊怅怅也
1039495,次韵答并帅王仲仪端明以诗见寄
1128569,汝明以诗谢饷菊次韵二首
147779,读严粲诗风撼潇湘覆江空雪月明以其一联隐括
509313,张式之佥都致政既归四明以诗寄予依韵奉酬
1044356,与张靖学士游华清宫雍帅钱子飞端明以诗见寄次韵和
339977,与张靖学士游华清宫雍帅钱子飞端明以诗见寄次韵和
357691,汝明以诗谢饷菊次韵
999036,始生之日黎明以职事出郊
884527,渊明以正月五日游斜川时年五十予以正月二日游曹源庵年五十有二矣慨然书示同行
1072897,次韵欧阳广明以诗送钵盂
569187,赵君自练川广文迁宰石埭石埭汉陵阳也窦先生子明以循吏仙去君素好道请于乩而得仙篆金丹四百字故以拟之
1077542,尧明以五诗赆行辞意激昂钦玩无已辄用第五首次韵为报聊发一笑
208605,渊明以正月五日游斜川时年五十予以正月二日
659406,蒲圻马文明以济源训导升保宁苍溪教谕亦慕名来求
1033706,读严粲诗风撼潇湘覆江空雪月明以其一联隐括为对
342169,蔡瞻明以诗还行邑鄙卷次韵谢之
1067054,汝明以诗谢饷菊次韵二首 其一
1008823,因禅人发明以颂示之
1067055,汝明以诗谢饷菊次韵二首 其二
373602,因禅人发明以颂示之
613529,王际明以藤枕见贻拈韵答之和坡翁琴枕
1086608,蔡瞻明以诗还行邑鄙卷次韵谢之
