866353,送萧大山赴新兴令
1028138,送孙子祥赴新昌主簿
123160,天平先陇道中时将赴新安掾
407628,篪兄赴新津扫先君墓归示以诗步原韵感赋
969811,必大弟赴新城簿
594500,题画梅送黎文学君实赴新城
735767,赴新安至七里滩作
230336,送萧大山赴新兴令
354924,徐中文赴新建以诗寄之
1038740,赴新定过七里濑
1025676,送泽赴新涂尉
21373,送源中丞赴新罗
982674,送周裕之赴新息令
175041,送泽赴新涂尉
529383,送张懋勉之赴新建县丞
956377,天平先陇道中时将赴新安掾
196071,必大弟赴新城簿
109352,送表弟朱拙夫以县尉赴新安
353361,送郑节卿赴新喻丞并呈李谏议
523941,自新喻马赴新鋈方等寺晚饭
328754,送钱子虚抚干往洪州赴新任
1038780,初赴新定过钱塘江
1080066,送钱子虚抚干往洪州赴新任二首 其二
523353,赴新喻
1052133,徐中文赴新建以诗寄之
647973,送曾仲修训导赴新淦
134906,送孙子祥赴新昌主簿
1182043,送源中丞赴新罗
146077,别弟赴新昌
189722,送周裕之赴新息令
528528,送韩大之赴新都
1158663,赴新安别梁侍郎
3894,赴新安别梁侍郎
351333,赴新定过七里濑
311834,篪兄赴新津扫先君墓归示以诗步原韵感赋
998891,廿五兄宣义见招偕诸弟赴新亭宴集即席有作
1089637,送郑节卿赴新喻丞并呈李谏议
266227,赴新安至七里滩作
66345,送郁文茂赴新宁州幕
1032709,送表弟朱拙夫以县尉赴新安
155554,廿五兄宣义见招偕诸弟赴新亭宴集即席有作
329125,赴新任·老矣吾无用
1109905,送钱子虚抚干往洪州赴新任二首
1080065,送钱子虚抚干往洪州赴新任二首 其一
851225,别弟赴新昌
