633589,送顿修还栖贤随省亲苕上
650107,送黄恒脩还乡祭扫五首 其五
946267,夷门歌送德脩还阙
513534,送刑部郎中陈德修还南京用张汝弼驾部韵
191665,夷门歌送德修还阙
650104,送黄恒脩还乡祭扫五首 其二
650105,送黄恒脩还乡祭扫五首 其三
533274,送彭稚脩还南浦
680268,送江编修还蜀
1205821,朱仲文编修还江西诸公分题赋诗为饯予适同载南归约至扬子桥分别因为赋此
535101,送懋中胡编修还朝
650106,送黄恒脩还乡祭扫五首 其四
764330,念奴娇 其四 送朱近修还海昌，吴西崖往山阴，兼怀宋既庭先还吴门，次顾庵韵
518897,送黄汝脩还天台
49466,送李茂修还山省母
470874,送李茂修还山省母
75186,朱仲文编修还江西
779189,念奴娇 次顾庵韵，送朱近修还海昌、吴西崖往山阴。兼怀宋既庭先还吴门
665431,罗浮四百峰赠湛甘泉编修还岭南
691343,送黄恒脩还乡祭扫五首
1242694,送马编修还明州
642120,送王仲脩还乡
807468,念奴娇  送朱近修还海昌并怀丁飞涛之白下送既庭返吴门仍用顾庵韵
650103,送黄恒脩还乡祭扫五首 其一
