518070,四月二日因公出诣城隍庙行香同高判簿郑长司黄广文及儒士钟子常坐庙门之下观一邑境内之溪山喜而有作 其二
569490,舒司马要饮天妃宫后桥亭水月佳甚畅而有作 其二
742337,丙子岁初出门见有短衣揖让者继凶年之后得此感而有作 其二
732531,读吴梅村宫詹萧史青门引感而有作 其二
509679,桂江舟行见各山畬田广开蛮夷残孽持兵供役夹道拜迎视往年处处益多喜而有作 其二
976693,中秋月蚀邦人鸣钲救月不约而齐中原旧俗犹有存者感而有作 其二
440342,游大溪慈湖，见蒋氏塑像麋集山下，计有数十尊之多，归而有作 其二
1062644,闻幼槃弟归喜而有作 其二
655145,三月十二日肇开经筵岳以翰林旧僚叨侍讲读荐蒙燕赉感而有作 其二
660042,京口遇乡人闻得曾孙喜而有作 其二
655143,三月九日圣驾幸学先是阻雨改卜适际晴和侍从观礼喜而有作 其二
744284,闻川楚捷音喜而有作 其二
831758,五月一日沧玉、锡祺、笛亭、槐庭、藻云及舍侄仲衡集予无闷草堂，喜而有作 其二
1030824,梦介卿感而有作 其二
573163,德山闻长嫂去世恸念伯修感而有作 其二
889385,读丐辞不允诏书感而有作 其二
743449,颍州道中阅邸报读弇山中丞辟雍诗及留漕疏稿喜而有作 其二
510256,书易隐求铭旌后感而有作 其二
836523,在捒连日淫潦，欲归不得，忽逢晴霁，喜而有作 其二
