129930,十二月二十四日雪盖予三年于淮才见此耳时东
1052091,送君时东归夜宿城外并桥上 其二
853336,十二月二十四日雪盖予三年于淮才见此耳时东师援淝水捷书西来走笔呈赵公借官奴与幕友一醉
530201,同凌时东邵文化沈邦魁饮戴山大石上
253867,龙井·此眼枯时东海枯
656089,予书月台字月既毕台字误落笔而为壹又书钩以足之惜无出处也徐思曩在石泉时东窗对一钩之月在缺月五更头寒光皎清夜之句感怀
530117,月夜过凌时东
477111,中秋夜同吴兴凌时东海昌董子言陈用明西湖玩月烂醉歌此
978481,张连鲁仲本蜀人从其先宦岭表仅五六十年矣为言广州城内有桧奇古甚土人相传自唐末至今往时东坡先生道惠宿留此州尝供佛其下得甘露缀枝之异予徵二事皆无所据而耆旧相传云尔要必有从来者张乞诗为赋长谣一篇
382818,过阳谷店山下问小洞庭遗迹是唐时东平太守苏源明宴处
429970,祀灶日访众异于天津君先一时东归既见其经山海关诗别赋却寄
57168,中秋同凌时东董子言陈用明西湖玩月烂醉歌此
48663,送路季琏问聘河东时东驾出师太原
354706,送君时东归夜宿城外并桥上
949925,沙塞子 其二 席上送赵戒叔，时东南方扰
424882,闲步外滩泊美国兵舰多艘时东北内战方殷感而有赋叠前韵
547457,过阳谷店山下问小洞庭遗迹是唐时东平太守苏源明宴处
305473,祀灶日访众异于天津君先一时东归既见其经山海关诗别赋却寄
530141,同凌时东吴介夫僧古心游虎跑寺泉头分韵得空字
484541,送路季琏问聘河东时东驾出师太原
607000,即席寿胡司理时东园桃柳方盛
22334,李谟笛·平时东幸洛阳城
420214,百字令 西湖题楼外楼，时东事方亟，枨楚若无所之。同安耀宸君看画船尽入西泠也
314310,闲步外滩泊美国兵舰多艘时东北内战方殷感而有赋叠前韵
1052090,送君时东归夜宿城外并桥上 其一
