690551,丙寅初春参知洪崖王公移镇惠潮喜而赋之
913966,十月久雨妨农收二十八日得霜遂晴喜而赋之
915100,六月初四日往云际院田间雨足喜而赋之二首 其一
784311,秋分日雨后盘僧致牡丹四本酬予书植诸新松之侧罗罗清疏映带可目喜而赋之
661227,读桂进士兄弟文字喜而赋之
637720,归养命下喜而赋之
597103,春日桃华齐开子结如豆喜而赋之
286106,秋分日雨后盘僧致牡丹四本酬予书植诸新松之侧罗罗清疏映带可目喜而赋之
1134701,同年常簿吴次翁子万之万之子直卿将为分水学官喜而赋之
604990,唯仲孝廉归自苍梧垂橐北上喜而赋之以侑行李
327901,归化城郊原蒙古持献清茶炒麋伏迎道左喜而赋之
912130,东园新种桃李，结子成阴，喜而赋之
925623,千年调 开山径得石壁，事出望外，意天之所赐邪，喜而赋之
1215012,闻瑞州太守、东广宪副宣命俱至，喜而赋之
597132,盆梅忽抽长故寻许始华喜而赋之
604317,省南上人长安乞诸朝贵为书金刚经镌石时有中贵人欲为开社者余喜而赋之
211092,大儿时中堂成德修弟喜而赋之因次元韵
605026,曾元陟亲家以湘阴广文谢事还里喜而赋之 其三
94328,东园新种桃李结子成阴喜而赋之
1036841,六月初四日往云际院田间雨足喜而赋之二首 其二
1223923,仙游道士余岫云为从珠溪余隐士求得华山下黄茅冈一曲规作丹室喜而赋之不觉五首 其三
605024,曾元陟亲家以湘阴广文谢事还里喜而赋之 其一
605025,曾元陟亲家以湘阴广文谢事还里喜而赋之 其二
211035,余试吏初期六十止今遂初原喜而赋之
1115744,六月初四日往云际院田间雨足喜而赋之二首
434466,朝中措 偶出见墙头杏花喜而赋之
436119,丁未三月二十八日县大夫薛君宝臣过余芹溪精舍酒閒雨作时方苦旱喜而赋之
1098168,移古梅植于贮清之侧已有生意喜而赋之
605031,丙寅初春参知洪崖王公移镇惠潮喜而赋之 其二
986287,余试吏初期六十止今遂初愿喜而赋之
94329,喜而赋之·移处带花非差事
585583,答桂阳朱则之欧启河得白石壁澄潭作仰泉楼喜而赋之二首 其一
1223921,仙游道士余岫云为从珠溪余隐士求得华山下黄茅冈一曲规作丹室喜而赋之不觉五首 其一
605229,正月十三夜元陟先生见过观灯留酌喜而赋之
605143,壬申初夏槎江邑侯存初王公以课绩考最振旅策勋喜而赋之得五十六字
986280,大儿时中堂成德脩弟喜而赋之因次元韵
690550,曾元陟亲家以湘阴广文谢事还里喜而赋之
368228,移古梅植于贮清之侧已有生意喜而赋之
914936,新栽德安牡丹透根生孙枝皆千叶种也即非接头二月二日瑞云红初开清晓起看喜而赋之
1237552,仙游道士余岫云为从珠溪余隐士求得华山下黄茅冈一曲规作丹室喜而赋之不觉五首
1223924,仙游道士余岫云为从珠溪余隐士求得华山下黄茅冈一曲规作丹室喜而赋之不觉五首 其四
605234,王幼度明府为今大宗伯云杜李本宁先生犹婿余以本宁先生获交幼度盖三十馀年笔研友也先数岁宝安同社诸君子欲为余作特室于旗峰之阳且受廛矣甲子冬幼度以龙门令摄篆宝安喜而赋之得十六韵以先歌来暮者言非未同幸毋曰此饥鸟此阳鱎也
702138,答桂阳朱则之欧启河得白石壁澄潭作仰泉楼喜而赋之二首
605030,丙寅初春参知洪崖王公移镇惠潮喜而赋之 其一
585584,答桂阳朱则之欧启河得白石壁澄潭作仰泉楼喜而赋之二首 其二
961896,余卜居偶得山水之胜喜而赋之
915267,西斋旧无竹予归自毗陵斋前忽有竹满庭盖墙外之竹迸逸而生此也喜而赋之
558205,移桂遂长新叶喜而赋之
92783,六月初四日往云际院田间雨足喜而赋之
1223922,仙游道士余岫云为从珠溪余隐士求得华山下黄茅冈一曲规作丹室喜而赋之不觉五首 其二
788486,归化城郊原蒙古持献清茶炒麋伏迎道左喜而赋之
150878,余卜居偶得山水之胜喜而赋之
1223925,仙游道士余岫云为从珠溪余隐士求得华山下黄茅冈一曲规作丹室喜而赋之不觉五首 其五
