537086,故东郡太守翟义为汉诛莽不胜而死其事甚伟而郡人不知祀之余始请祀于名宦祠为作翟义公歌
662128,陜州城有石刻魏野草堂即其旧隐处有司立堂祀之
586091,同年黔阳县尹杨君得远祖之墓表而祀之大偿夙昔孝思之怀因赋以诗
402988,虞美人 丁丑七夕为李后主千年忌日，词客有徵词祀之者，鹤亭翁约同作。即用后主词韵
614805,宋明经授易彭城有道士也其门人祀之索赠一章
1086255,韩魏公生于泉南州宅故未有祠于典为阙郡圃有庵名大隐即之以祠八月戊子率同僚祀之
584131,忠南悼舅氏也舅氏萧公曩为忠守去且四十年忠人追祀之衷既展拜祠下退而赋忠南
1214713,某甫者章氏之庶孽子也所出微不得与众兄弟齿治田庐供衣食比分财得黄金盘杆一其从父弟俊甫方脩青龙镇学一日持以造之曰我为农无用此吾家二先生死无后愿鬻此置祠学宫之侧买田收其租入春秋二时用少牢具祀之以徼福于先圣先贤慰吾父与伯父师弟子之心冥冥之中其为我经营之余与闻斯言时至元后癸未岁也每思其人故作诗以寄之
1025043,改祭修斋决疑颂 第五疑：祭祀之家，及彼师巫，得何罪报耶？颂曰：
855108,县境不雨数遣比丘祷佛于庙祀龙于社皆不雨闻龙居响潭水中往潭湄刑鹅而祀之初崖月微明有风飒然动衣袂祀竟云物出雨态生已而遂雨然岁丰时和盖造物者之力而龙之惠也至前此不雨乃令之无状所召尔县之诸儒反为歌诗以雨归令甚无谓聊作一诗奉报
309498,虞美人·丁丑七夕为李后主千年忌日，词客有徵词祀之者，鹤亭翁约同作。即用后主词韵
583156,安庆有皖公山天柱峰者前代尝祀之为南岳又黄山谷尝读书于其下余慕爱之昨过山下秋深气朗诸峰秀出如揖如拱独皖公拥云自蔽有若隐潜偶题一绝
323634,韩魏公生于泉南州宅故未有祠于典为阙郡圃有庵名大隐即之以祠八月戊子率同僚祀之
826218,浣溪纱·旧历四月十六日为明末张儿乔女士生日，同人以名香花果祀之。方壶并歌余所制百花冢曲为寿。先期由邓昙殊绘象供养，因为题此。呜呼，何世何年，此物此志，古愁今恨，能不依依。乔倩有灵，当兴同感
