322927,次韵冯员仲正字湖上有作
947947,秋晦有怀南仲正字
948925,胡原仲正字特改官除宫观馆中置酒饯别会者七人以先生早赋归去来为韵人各赋一首仆得早字
1099538,奉题周南仲正字所藏阎立本画苏李别
1085093,次韵冯员仲正字湖上有作
1094292,周南仲正字挽诗
1005835,近作对江牡丹吟七章呈正仲正仲于拙吟无不亟和者独此七章未和携而归茭湖半月矣递筒未至歌以趣之
892591,秋日与天章侍讲王原叔曾明仲正言余安道三学士集普光院
371685,周南仲正字挽诗
868577,次韵韩仲正
1236429,饯别李仲正府推二首
1217707,饯别李仲正府推二首 其二
1207173,点绛唇 次杜仲正经历怀古韵
206974,和答徐斯远兼简赵昌甫韩仲正
868778,送周明叔王成叟并上昌甫仲正二兄
1207167,临江仙 次仲正经历韵三阕
956476,次韵王夷仲正字同游成氏园
125254,秋日与天章侍讲王原叔曾明仲正言余安道三学
1217706,饯别李仲正府推二首 其一
992638,泾尉徐绛于其廨得鲁公破碑二十六字近又于碑阴得二十八字寄予及吴正仲正仲有诗答亦答之
232868,秋晦有怀南仲正字
650980,张仲正野仙歌用琴川钱工部韵
152420,胡原仲正字特改官除宫观馆中置酒饯别会者七
868739,和答徐斯远兼简赵昌甫韩仲正
157711,近作对江牡丹吟陈列间呈正仲正仲於拙吟阮不
123626,次韵王夷仲正字同游成氏园
