793504,闻味云家兄简任长芦运使寄呈七律二首 其一
1086095,钱再赋二诗复用前韵钱云家无置锥之地寓居僧舍有为题米疏者 其一
369312,闻味云家兄简任长芦运使寄呈七律
275411,绣带儿·翼云家有兔耳花，波斯种也。淡红者名醉杨妃，尤艳绝
793505,闻味云家兄简任长芦运使寄呈七律二首 其二
1105698,钱再赋二诗复用前韵钱云家无置锥之地寓居僧舍有为题米疏者
246530,南溟·白云家在南溟水
925839,念奴娇 其三 余既为傅岩叟两梅赋词，傅君用席上有请云：家有四古梅，今百年矣，未有以品题，乞援香月堂例。欣然许之，且用前遍体制戏赋
1086096,钱再赋二诗复用前韵钱云家无置锥之地寓居僧舍有为题米疏者 其二
102982,杜和州寄新醅吴正仲云家有海鲜约予携往就酌
992223,杜和州寄新醅吴正仲云家有海鲜约予携往就酌逡巡又云幕中有会且罢此饮
837419,陈芷云家藏明人唐解元龙泉岩图失去八年近始索得自为图记徵诗一再函催书此调之
813693,闻味云家兄简任长芦运使寄呈七律二首
323416,钱再赋二诗复用前韵钱云家无置锥之地寓居僧舍有为题米疏者
198608,和杨公维·子云家无儋石储
822122,绣带儿 翼云家有兔耳花，波斯种也。淡红者名醉杨妃，尤艳绝
