1144238,都梁北乡士多好学有向君敏衡者一日访予语甚质气甚夷礼甚虔予心异之间为予言曰家故沅徙也今所居有溪实自沅来乃筑室聚书其上以教子弟因以沅溪书舍名之而其亭则曰无加盖其地旧号无加庄以其东止于石西止于岸南止于路北止于泉也愿有以发之予既为籀右书二颜而向君复以所谓廉崖者谂予予闻此石杰立千尺实峭厉峻削可敬可仰有类乎廉者颇思一至其处摩挲此石以激衰懦而未能也乃各为一解以谢焉
1088248,公济和诗见闵耽书勉以教外之乐以诗请问二首 其一
1142389,都梁北乡士多好学有向君敏衡者一日访予语甚质气甚夷礼甚虔予心异之间为予言曰家故沅徙也今所居有溪实自沅来乃筑室聚书其上以教子弟因以沅溪书舍名之而其亭则曰无加盖其地旧号无加庄以其东止于石西止于岸南止于路北止于泉也愿有以发之予既为籀右书二颜而向君复以所谓廉崖者谂予予闻此石杰立千尺实峭厉峻削可敬可仰有类乎廉者颇思一至其处摩挲此石以激衰懦而未能也乃各为一解以谢焉 其二
1088399,伏蒙某官宠示和陶见寄旧作伏读叹仰又感知待期许之意盖非一日率易次韵少见谢臆伏惟矜怜有以教之
607884,答邓尚龙避地省中三作怨溢于词排和一律勉以教子
1137476,都梁北乡士多好学有向君敏衡者一日访予语甚质气甚夷礼甚虔予心异之间为予言曰家故沅徙也今所居有溪实自沅来乃筑室聚书其上以教子弟因以沅溪书舍名之而其亭则曰无加盖其地旧号无加庄以其东止于石西止于岸南止于路北止于泉也愿有以发之予既为籀右书二颜而向君复以所谓廉崖者谂予予闻此石杰立千尺实峭厉峻削可敬可仰有类乎廉者颇思一至其处摩挲此石以激衰懦而未能也乃各为一解以谢焉 其一
1078059,自学校之制废而戎马之患兴州县长民者不复以教育为意独容南鼎新郡庠招徕生徒弦诵之声不辍诚可嘉叹所建讲堂为名之曰育材辄成五言十韵
1247030,孤也不天十有二年矣我先君读书号该博凡平生辛苦而得之者仅见于文辞仕又最晚而位不大显海内器赏不过大参王公继学侍御张公梦臣数人而已呜呼痛哉其忍言诸日者辱养吾先生为题文集五首并序铭一通读之再四涕泪迸落诗语俊逸序约而不遗铭丰而不剩古之作者正如此且典雅奇奥次第刻石墓上以贻不朽其长篇尤浏亮铿锵自成机轴是晚疮作傲兀枕上命次儿鹤奴随读随和遽尔成章鄙俚腐熟纵力焉而不逮也幸有以教之
327163,公济和诗见闵耽书勉以教外之乐以诗请问
1088249,公济和诗见闵耽书勉以教外之乐以诗请问二首 其二
1137477,都梁北乡士多好学有向君敏衡者一日访予语甚质气甚夷礼甚虔予心异之间为予言曰家故沅徙也今所居有溪实自沅来乃筑室聚书其上以教子弟因以沅溪书舍名之而其亭则曰无加盖其地旧号无加庄以其东止于石西止于岸南止于路北止于泉也愿有以发之予既为籀右书二颜而向君复以所谓廉崖者谂予予闻此石杰立千尺实峭厉峻削可敬可仰有类乎廉者颇思一至其处摩挲此石以激衰懦而未能也乃各为一解以谢焉 其三
1110988,公济和诗见闵耽书勉以教外之乐以诗请问二首
536555,余游蓬莱阁睹弹子涡石因记苏长公一章歌之与参政姜公共拾取数十枚为玩遂戏效其体作数语书付道士并呈姜公公前身为白玉蟾高弟解服食法其有以教我
