692224,寒夕独坐乡思浩然有怀何文渊
1122039,楼枢密过华山浩然有念古慕希夷之心谨用韵作二诗以箴之
994470,油口夜饮醉卧一室及觉三鼓矣秋夜新冷雨湿虫鸣展转不能成寐于是浩然有归志
958182,楼枢密过华山浩然有念古慕希夷之心谨用韵作二诗以箴之 其一
958542,楼枢密过华山浩然有念古慕希夷之心谨用韵作二诗以箴之 其二
192198,谢浩然尝为余作异梦余再被召浩然有诗次韵复
315661,仿张船山佛前饮酒浩然有得四律
1113783,谢浩然尝为余作异梦余再被召浩然有诗次韵复之二首
881639,浣溪沙 其二 渔父词，张志和之兄松龄所作也，有招玄真子归隐之意。居士为姑苏郡守，浩然有归志，因广其声为浣溪沙，示姑苏诸友
648991,寒夕独坐乡思浩然有怀何文渊 其一
182055,楼枢蜜过华山浩然有念古慕希夷之心谨用韵作
648992,寒夕独坐乡思浩然有怀何文渊 其二
1038211,余前此二纪保釐西郊与判台李少师及洛社诸君游龙门饮伊上有渔者献鳜鱼十数尾因作羹鲙坐客有思鲈之兴余后守魏累请休致久而未遂曾为忆鳜诗寄洛下诸贤今年秋累与诸君饮于东田池上苇间鲙鱼炊香稻以佐酒浩然有江湖之趣因作是诗并录忆鳜诗如左
904484,谢浩然尝为余作异梦余再被召浩然有诗次韵复之二首 其二
827273,仿张船山佛前饮酒浩然有得四律并用其韵
904485,谢浩然尝为余作异梦余再被召浩然有诗次韵复之二首 其一
