663763,挽同年程御史良用次见素韵二首 其二
152068,绍兴庚辰九月二十三日与浙东权帅同年程龙图
663762,挽同年程御史良用次见素韵二首 其一
921327,同年程筠德林求先坟二诗 其一 思成堂
921328,同年程筠德林求先坟二诗 其二 归真亭
948700,绍兴庚辰九月二十三日与浙东权帅同年程龙图并试玉堂庚寅岁由少蓬寓直摛文发策试馆职亦九月也有怀泰之辄寄四韵
431665,近遭兵燹，失镶玉宝鼎一座，正深惋惜，忽于旧书麓中得古墨双团，阳面篆书：“双凤玦”三字，阴面刻双凤齐飞，其缘镌：“天启元年程大约藏”，审知为四百年前物，至为可宝，爰赋此七律二章以志之
686614,挽同年程御史良用次见素韵二首
581535,寄同年程德和用前韵
1208379,同年程时叔内翰还浙东
1116495,同年程筠德林求先坟二诗 思成堂
411368,近遭兵燹，失镶玉宝鼎一座，正深惋惜，忽于旧书麓中得古墨双团，阳面篆书：“双凤玦”三字，阴面刻双凤齐飞，其缘镌：“天启元年程大约藏”，审知为四百年前物，至为可宝，爰赋此七律二章以志之 其二
581401,寄同年程德和通政
411367,近遭兵燹，失镶玉宝鼎一座，正深惋惜，忽于旧书麓中得古墨双团，阳面篆书：“双凤玦”三字，阴面刻双凤齐飞，其缘镌：“天启元年程大约藏”，审知为四百年前物，至为可宝，爰赋此七律二章以志之 其一
808799,游北湖，怀昌黎公。湖在郴州北郭外，周广可四十里，今皆为稻田矣。去年，程春海先生属刺史惠安曾钰于道侧蓄一池，祠昌黎于其上
