951344,逍遥楼
1176002,奉和圣制登蒲州逍遥楼应制
612174,桂郡逍遥楼和谢在杭司长时苦旱炎甚
709293,登逍遥楼
884427,有惠曾公逍遥楼字者
1178970,登蒲州逍遥楼
437196,河中八咏 其四 逍遥楼
956691,逍遥楼席上赠张邦达教授张癸未省闱门生也同年进士俱会楼上者七人
685586,冬日微雨集逍遥楼看颜鲁公碑二首
208607,有惠曾公逍遥楼字者
1164397,登逍遥楼
981,登逍遥楼
988,桂州陪王都督晦日宴逍遥楼
1081553,蒲中杂咏 逍遥楼
685958,九月既望陈勋卿招同穆王二令公登龙津逍遥楼望西樵诸山既暮移酌于东轩就月漫赋二首
576962,纳凉逍遥楼
577236,登逍遥楼
1191906,题逍遥楼伤故韦大夫
909362,登逍遥楼和方孚若韵
362344,逍遥楼·元龙高兴绝尘寰
1505,奉和圣制登蒲州逍遥楼应制
1164454,桂州陪王都督晦日宴逍遥楼
769328,阻雨二日与亥白搜剔武连轶事咏之得四首 其二 逍遥楼
606258,九月既望陈勋卿招同穆王二令公登龙津逍遥楼望西樵诸山既暮移酌于东轩就月漫赋二首 其一
547075,寄题朱金庭宗伯逍遥楼一首
606259,九月既望陈勋卿招同穆王二令公登龙津逍遥楼望西樵诸山既暮移酌于东轩就月漫赋二首 其二
260594,逍遥楼·黄河城上逍遥楼
260594,逍遥楼·黄河城上逍遥楼
20430,题逍遥楼伤故韦大夫
113,登蒲州逍遥楼
164399,登逍遥楼和方孚若韵
1098527,逍遥楼
588727,李子逍遥楼寄怀次韵
123089,逍遥楼席上赠张邦达教授张癸未省闱门生也
612200,冬日微雨集逍遥楼看颜鲁公碑二首 其二
606893,秋暮陪沈郡公再登陈勋卿逍遥楼宴集
594958,秋日饮苏叔大逍遥楼
612199,冬日微雨集逍遥楼看颜鲁公碑二首 其一
