921789,熙宁中，轼通守此郡。除夜，直都厅，囚系皆满，日暮不得返舍，因题一诗于壁，今二十年矣。衰病之馀，复忝郡寄，再经除夜，庭事萧然，三圄皆空，盖同僚之力，非拙朽所致。因和前篇呈公济子侔二通守 其一
990817,中伏日陪二通判妙觉寺避暑
532031,别萧潘二通判于淡岩作
1208435,杨柳枝六首 其二 通州道中作至元四年春
1116793,熙宁中，轼通守此郡。除夜，直都厅，囚系皆满，日暮不得返舍，因题一诗于壁，今二十年矣。衰病之馀，复忝郡寄，再经除夜，庭事萧然，三圄皆空，盖同僚之力，非拙朽所致。因和前篇呈公济子侔二通守
102880,中伏日陪二通判妙觉寺避暑
590582,往长沙府送浏阳庠士入应督学岁考至东屯渡遇邦伯夏凫溪先生命回县治事已对应公请免而委同寅东嵎李三尹代之先是自十九夜发舟至廿二通宵烛花不落光焰非常果得此报喜吟一首
843016,题随斋主人所临禊帖二通
1004100,拟九颂 其二 通德门
439676,九怀 其二 通路
921790,熙宁中，轼通守此郡。除夜，直都厅，囚系皆满，日暮不得返舍，因题一诗于壁，今二十年矣。衰病之馀，复忝郡寄，再经除夜，庭事萧然，三圄皆空，盖同僚之力，非拙朽所致。因和前篇呈公济子侔二通守 其二
923286,解秩西还夕次葛驿二通判与签判学士留府诸君远出饯别情至礼勤辄成拙诗奉谢厚意
184026,解秩西还夕次葛驿二通判与签判学士留府诸君
