817349,刘编修殿虎赠余诗己三年矣赋此答之
817129,洪表侄与余别三年矣，旅馆相逢，喜生意外，爰赋二律以赠之
1110550,安仁县有大第一区官兵纵暴主人谷氏避不敢居三年矣县尹常馆过客于第中赋主人避地二首
1073550,安仁县有大第一区官兵纵暴主人谷氏避不敢居三年矣县尹常馆过客于第中赋主人避地二首 其一
747849,邓湘皋丈枉顾别十三年矣喜赋
572815,龙君御载酒过德山见访一别十三年矣感念存没不觉悽然已复自笑举觥相乐遂大醉
365144,青山高竹楼别业昔尝题诗其壁诗故在而竹楼物故三年矣感而赋诗
786979,丁丑榆关除夕同易堂敬亭和东坡粲字韵诗回首已三年矣追忆旧游因复和之并简易堂敬亭
572778,余蔬食三年矣偶因口馋遂复动荤辄尔有作用呈诸衲不独解嘲兼亦志愧云尔
934984,三山卜居今三十有三年矣屋陋甚而地有馀数世之后当自成一村今日病少间作诗以示后人二首 其一
268441,友人自豫章来，喜食蟹，云不尝此味十三年矣，作此赠之
13093,前年春与独孤常州兄花时为别倏已三年矣
79893,三山卜居今三十有三年矣屋陋甚而地有余数世
734998,住孔楼三年矣别去一叹
845036,先业师陈翔翰先生以庚子十二月朔日讳于今三年矣。秋夜沈沈，怆然旧意，百端交集，作感旧三章
677455,余少同欧阳文朝王尚涵读书茶山今丙午复同文朝修业龙洲相去已十又三年矣感赋为赠
761933,友人自豫章来，喜食蟹，云不尝此味十三年矣，作此赠之
923720,予昔在京师画工韩若拙为予写真今十三年矣容貌日衰展卷茫然叶县杨生画不减韩复令作之以记其变偶作
783266,刘编修殿虎赠余诗己三年矣赋此答之 其二
406374,对酒二首剧眩以来，已三年矣。近复一蹶，前路可知。因赋长句二首。
431846,余兄妹五人，于烽烟岁月中各奔东南西北。壬申之夏，得团聚于五羊城，屈指已四十三年矣。感而为诗
686823,伯襄太史携同似公赞夫代骧定国再过观梅时梅先开者飘落几尽止从山畔得一株太史方惘然不知梅开近皆两度也此事已三年矣是在梅花主人为之纪事
841446,先业师陈翔翰先生以庚子十二月朔日讳于今三年矣。秋夜沈沈，怆然旧意，百端交集，作感旧三章 其一
307828,大酺·为吴君懋题彊村先生遗墨，时甲戍十二月，先生下世三年矣
211887,金缕曲/贺新郎·七十三年矣
263936,贺新郎·作客三年矣
415565,余兄妹五人，于烽烟岁月中各奔东南西北。壬申之夏，得团聚于五羊城，屈指已四十三年矣。感而为诗 其二
1118689,三山卜居今三十有三年矣屋陋甚而地有馀数世之后当自成一村今日病少间作诗以示后人二首
459741,往建新农场探哨子，待渡洞庭湖滨，因忆八四年同学辈游君山，初过此渡，今十三年矣
119325,予昔在京师画工韩若拙为予写真今十三年矣容
771302,内家娇•妇亡十有三年矣，适逢诞日，读大壮新词，遂同其调
619594,伯襄太史携同似公赞夫代骧定国再过观梅时梅先开者飘落几尽止从山畔得一株太史方惘然不知梅开近皆两度也此事已三年矣是在梅花主人为之纪事 其一
430655,三月十九日酒痴招饮胜家酒馆，记同子美过此已三年矣，感念存没不能去怀，醉后赋呈同亚子表叔作，兼示同饮诸子
841447,先业师陈翔翰先生以庚子十二月朔日讳于今三年矣。秋夜沈沈，怆然旧意，百端交集，作感旧三章 其二
818666,甲申除夕病榻作时目疾颇剧离香港又三年矣
161296,家有白鸡蓄之三年矣驯熟可爱谦之读书山中一
934985,三山卜居今三十有三年矣屋陋甚而地有馀数世之后当自成一村今日病少间作诗以示后人二首 其二
415564,余兄妹五人，于烽烟岁月中各奔东南西北。壬申之夏，得团聚于五羊城，屈指已四十三年矣。感而为诗 其一
731474,绿阴野屋前海棠二株栽三年矣适值盛开喜而成咏
1046689,青山高竹楼别业昔尝题诗其壁诗故在而竹楼物故三年矣感而赋诗
1073551,安仁县有大第一区官兵纵暴主人谷氏避不敢居三年矣县尹常馆过客于第中赋主人避地二首 其二
854783,家有白鸡蓄之三年矣驯熟可爱谦之读书山中一日相过偶道庵僧所阙遂送谦之以遗之
416943,大酺 为吴君懋题彊村先生遗墨，时甲戍十二月，先生下世三年矣
768561,八归 春夜融谷叔从南雄归，别自都下，会在里门，历三年矣
983243,柳梢青 其四 钓台。绍兴甲子赴试南宫登此，今三十三年矣
791659,洪表侄与余别三年矣，旅馆相逢，喜生意外，爰赋二律以赠之 其二
1049529,往时与今钱唐蒲资政传正修史邓内翰温伯同和唐韦考功张水部盛山十二咏畀开江吴令使榜于宿云亭二十三年矣因缘登览感慨畴昔复为短篇以纪故事元祐二年正月二十八日安岳冯允南
791658,洪表侄与余别三年矣，旅馆相逢，喜生意外，爰赋二律以赠之 其一
619595,伯襄太史携同似公赞夫代骧定国再过观梅时梅先开者飘落几尽止从山畔得一株太史方惘然不知梅开近皆两度也此事已三年矣是在梅花主人为之纪事 其二
404989,蝶恋花·甲午春三月凤老病殁香江，越半月余赋悼亡。匆匆已三年矣。适璞翁示新作，感事怀人，泫然不知涕泪之何从也。遂继声焉
445203,醉妹临别嘱我留守拾叶欲三年矣犹不见芳踪适近其生辰忽念予曾有诺『年年有句到芳辰』因之仓促成句
841448,先业师陈翔翰先生以庚子十二月朔日讳于今三年矣。秋夜沈沈，怆然旧意，百端交集，作感旧三章 其三
826836,百字令·予弟南生游艺多能，素不能画，一日得尺绢临钱萚石先生墨兰，信笔挥洒，便有意致。予弟亡来十三年矣，此帧尚藏箧中，附装先世文字册后，系之以词
783265,刘编修殿虎赠余诗己三年矣赋此答之 其一
406375,对酒二首剧眩以来，已三年矣。近复一蹶，前路可知。因赋长句二首。
1167743,前年春与独孤常州兄花时为别倏已三年矣今莺花又尔睹物增怀因之抒情聊以奉寄
45979,甲申除夕病榻作时目疾颇剧离香港又三年矣
