1174022,夔府书怀四十韵
919933,夜读杜诗四十韵
1156917,新昌新居书事四十韵因寄元郎中张博士
1222924,寿李承旨四十韵
468628,闻庄舍弟自庄浪除广西桂林府修仁县主簿作长律四十韵以寄
991662,代书寄欧阳永叔四十韵
1174500,分司东都寓居履道叨承川尹刘侍郎大夫恩知上四十韵
1003979,上泸州杨尚书四十韵
251051,禹庙四十韵
622903,微病不寐口占四十韵
904156,谒翁丈四十韵
622237,自燕都至白门纪行四十韵
24288,李肱所遗画松诗书两纸得四十韵
1247962,赠张尚书四十韵
899339,悼蜀四十韵并序
1227671,寿陈景让都事四十韵
415965,戊子夏末，偕俞律诗兄四游匡庐，予先作《庐山铁船峰歌》，其后二人往复次韵、倒叠前韵各三首，合为十二首，颇拟梓之自娱兼博同道一笑。时予已才尽，而俞兄诗思方如陆海潘江，滚滚滔滔，不可止遏，旋又首倡《庐山五老峰歌四十韵》，句句皆叶一东、二冬韵部中字，次韵之难可知。然予二人向不肯独乐其乐，因追尘于后，工拙则非所计矣
103745,代书寄欧阳永叔四十韵
175148,靖康改元四十韵
604539,甲子秋七月入宝安过访邓玄度观察镜园同尹用平温尔惇两年丈饮邻仙楼用杜少陵游何将军山林十诗四十韵 其七
478746,挽吴都督四十韵
1149644,江边四十韵
1149535,哭女樊四十韵
604536,甲子秋七月入宝安过访邓玄度观察镜园同尹用平温尔惇两年丈饮邻仙楼用杜少陵游何将军山林十诗四十韵 其四
55475,挽吴都督四十韵
1149605,台中鞫狱忆开元观旧事呈损之兼赠周兄四十韵
580702,松州即事四十韵
35146,奉和宫傅相公怀旧见寄四十韵
270797,家园杂忆四十韵
604542,甲子秋七月入宝安过访邓玄度观察镜园同尹用平温尔惇两年丈饮邻仙楼用杜少陵游何将军山林十诗四十韵 其十
230643,悼蜀四十韵
717504,咏茼蒿花同础尘元孝限四十韵
665881,寿林大司马四十韵
220089,谒翁丈四十韵
1239684,允载章生归括苍赋诗四十韵赠别
18373,新昌新居书事四十韵因寄元郎中张博士
849847,亲旧问盗作诗四十韵以答之亦可备野史之录
735943,拜方正学先生祠四十韵
1222350,谒武惠鲁公林墓四十韵
1230926,言志叙交四十韵答欧阳元翁
106196,岁除夜过白土市不宿夜几失道田家地卧四十韵
231813,朱丞相赴宣州四十韵
829606,恽瑾叔见赠长律四十韵
1171220,五言述德抒情诗一首四十韵献上杜七兄仆射相公
544552,奉赠督学乔公四十韵
651695,喜雨四十韵
415967,俞律诗兄首倡《庐山五老峰歌四十韵》后，不旋踵又得五古《游庐山含鄱口》一首索和，其才思之繁捷使人惊羡，其嘤鸣之真情使予感奋，因竭半日之力勉次其韵，谨呈吟几，仍乞斧正
734963,纪殷仲泓事四十韵
547937,上座师殷棠川相公生辰四十韵
1085527,庐山纪游四十韵
1164366,绵竹山四十韵
1135937,岁除夜过白土市不宿夜几失道田家地卧四十韵
483962,送馆主朝宪使之淮西四十韵
1085006,和喻叔奇游天衣四十韵
690469,甲子秋七月入宝安过访邓玄度观察镜园同尹用平温尔惇两年丈饮邻仙楼用杜少陵游何将军山林十诗四十韵
282856,五老峰歌四十韵呈国武兄索和
1171290,李肱所遗画松诗书两纸得四十韵
469342,万历乙未正月十五日莲池大师受缁白之请诣南屏山弘演圆觉了义经三月四日圆满恭送还山成五言排律四十韵用元和体
604535,甲子秋七月入宝安过访邓玄度观察镜园同尹用平温尔惇两年丈饮邻仙楼用杜少陵游何将军山林十诗四十韵 其三
732452,癸卯三月十九日润州客舍同潘江如小饮述怀四十韵
1250798,雪夜与友人同赋四十韵
1205664,次宋编修显夫南陌诗四十韵
990398,雪中同赵仓从之泛舟饯钱宪文季酒中剧谈汉事临别文季索诗赋四十韵以寄
1171267,今月二日不自量度辄以诗一首四十韵干渎尊严伏蒙仁恩俯赐披览奖踰其实情溢于辞顾惟疏芜曷用酬戴辄复五言四十韵诗献上亦诗人咏叹不足之义也
1171267,今月二日不自量度辄以诗一首四十韵干渎尊严伏蒙仁恩俯赐披览奖踰其实情溢于辞顾惟疏芜曷用酬戴辄复五言四十韵诗献上亦诗人咏叹不足之义也
799246,家园杂忆四十韵
1196105,奉和宫傅相公怀旧见寄四十韵
604541,甲子秋七月入宝安过访邓玄度观察镜园同尹用平温尔惇两年丈饮邻仙楼用杜少陵游何将军山林十诗四十韵 其九
171236,亲旧问盗作诗四十韵以答之说要备野史之录
1149530,奉和浙西大夫李德裕述梦四十韵大夫本题言赠于梦中诗赋以寄一二僚友故今所和者亦止述翰苑旧游而已次本韵
52190,送馆主朝宪使之淮西四十韵
604533,甲子秋七月入宝安过访邓玄度观察镜园同尹用平温尔惇两年丈饮邻仙楼用杜少陵游何将军山林十诗四十韵 其一
415491,五老峰歌四十韵呈国武兄索和
16916,江边四十韵
292056,俞律诗兄首倡《庐山五老峰歌四十韵》后
604540,甲子秋七月入宝安过访邓玄度观察镜园同尹用平温尔惇两年丈饮邻仙楼用杜少陵游何将军山林十诗四十韵 其八
17780,叙德书情四十韵上宣歙翟中丞
832735,齐天乐 其一 苍虬赴天津，寄示渡海四十韵，倚歌赋答
987353,孤愤吟四十韵
1173538,寄刘峡州伯华使君四十韵
1006419,朱丞相赴宣州四十韵
482797,关外纪行四十韵
775769,随办赈务毕作长歌四十韵为蒋怿庵刺史志别
957275,嘲蚊四十韵
505002,送阐禅师住芦山四十韵
153535,夜读杜诗四十韵
749262,壬戌十二月朔自辽州得檄往蒲行至韩侯岭复檄令回省二十七日抵寓咏怀四十韵
975926,题张药局退岩四十韵
780912,读四川崇庆牧辽东常君殉难行状五言古体四十韵
61016,关外纪行四十韵
20308,述梦诗四十韵
24294,井泥四十韵
1171266,井泥四十韵
16781,台中鞫狱忆开元观旧事呈损之兼赠周兄四十韵
717480,雁门关与天生送曹使君返云中四十韵
1057334,元丰辛酉七月九夜大风四十韵
243212,鄱阳湖四十韵
665896,送林待用司空四十韵
1142592,远游四十韵
756206,辛酉六月十八日为完颜恽太君星联生日元默来归之年师郑夫子即以国朝闺秀正始集授之爰于中庭设瓜果陈诗以祭谨赋五古四十韵
1189995,鸿胪寺有开元中锡宴堂楼台池沼雅为胜绝荒凉遗址仅有存者偶成四十韵
468386,龙溪亭阳城县主簿婺源方彦清家近龙溪筑亭溪上征诗为赋四十韵
752469,赠张君自操兼简姚雨平四十韵
1174013,赠王二十四侍御契四十韵
1210025,云汉远寄新诗四十韵因和而谢之
381447,恽瑾叔见赠长律四十韵
233666,上郑参政四十韵
579672,夜坐感怀四十韵书于彭城御史台时甲辰七月七日也
264260,癸卯三月十九日润州客舍同潘江如小饮述怀四十韵
275820,拜方正学先生祠四十韵
873817,靖康改元四十韵
61077,春日述怀寄汤义仍四十韵
604538,甲子秋七月入宝安过访邓玄度观察镜园同尹用平温尔惇两年丈饮邻仙楼用杜少陵游何将军山林十诗四十韵 其六
15186,浙西李大夫述梦四十韵并浙东元相公酬和斐然继声
75552,上执政四十韵
494322,述先德诗四十韵
287150,赵次珊馆长八十寿诗四十韵
978435,上郑参政四十韵
526159,丙子元日于郡斋作四十韵
1090381,赠总领韩郎中四十韵
190131,杨村四十韵
511584,钟氏席上赋四十韵
1201065,上执政四十韵
825257,恽瑾叔见赠长律四十韵 其一
1057515,伤蔡文仲秋闱失意四十韵
1160140,浙西李大夫述梦四十韵并浙东元相公酬和斐然继声
830818,偕慕逸贯恂游狼山回车过西庐步至梅垞门键不得入遂登我马楼四十韵
55299,允载章生归括苍赋诗四十韵赠别
840592,赵次珊馆长八十寿诗四十韵
18561,和三月三十日四十韵
825258,恽瑾叔见赠长律四十韵 其二
1084766,和韩县斋有怀四十韵
949794,鄱阳湖四十韵
1157304,和微之诗二十三首 和三月三十日四十韵
8594,寄刘峡州伯华使君四十韵
24291,五言述德抒情诗一首四十韵献上杜七兄仆射相公
752895,题樊南生小象四十韵
8595,夔府书怀四十韵
480154,胡忠安公挽诗（四十韵）
1086321,喻叔奇采坡诗一联云今谁主文字公合把旌旄为韵作十诗见寄某惧不敢和酬以四十韵
604534,甲子秋七月入宝安过访邓玄度观察镜园同尹用平温尔惇两年丈饮邻仙楼用杜少陵游何将军山林十诗四十韵 其二
1172456,述梦诗四十韵
132738,题张药局退岩四十韵四十韵
132738,题张药局退岩四十韵四十韵
31639,绵竹山四十韵
1156848,叙德书情四十韵上宣歙翟中丞
547939,送御史大夫与川葛公致仕东归四十韵
544643,挽王元美先生二百四十韵
883720,雪夕林亭小酌因成拙诗四十韵以贻坐客昔欧阳公与人咏雪先戒勿用梨梅练絮白舞鹅鹤等字今篇中辄守此戒但愧不工伏惟采览
267460,齐天乐·苍虬赴天津，寄示渡海四十韵，倚歌赋答
122883,嘲蚊四十韵
163622,上泸州杨尚书四十韵
604537,甲子秋七月入宝安过访邓玄度观察镜园同尹用平温尔惇两年丈饮邻仙楼用杜少陵游何将军山林十诗四十韵 其五
502324,郊禋庆成分得霄字四十韵
544553,寿大司空雷公四十韵
735462,长至前二日同右吉翁山陪曹秋岳先生宿雁门关即事四十韵拈玉树凋伤枫树林之句分凋字
910601,杨村四十韵
440654,禹庙四十韵
720335,呈竹垞先生四十韵
8426,赠王二十四侍御契四十韵
1250689,陈元礼奉诏徵彭处士于崇安却归永嘉省亲还京师抚事感时因集杜少陵诗四十韵奉赠
1173458,大历三年春白帝城放船出瞿塘峡久居夔府将适江陵漂泊有诗凡四十韵
16890,哭女樊四十韵
