583470,正德丁丑六月二十九日寅刻天正黑有大星似蓬差大而长五倍之色红照地如昼自东北方起入天天若开裂然见者咸惊口占纪之
523811,菊时一种数本其一逾秋独妍爰及至日黄华韡然当庭见者骇叹携酒来赏予赋二诗 其二
330641,海邑少交游相见者以为言故作此诗
538621,史叔载有见怀之什及贻所著二咏编有答 其二 周公瑕出示小像见者无不绝倒命余题焉因步往韵
1113552,之仪家当涂七年矣屡过禅岳山下望高山塔欲一游辄不果异时山主勤公大师与其子宣上人相过因往报之取路回远薄晚方到遂留宿栋宇一新舍次皆得其便而宏丽高朗唯见者知焉又复规范齐肃钟鼓应接问之乃勤一力所就丝蓄粒聚未尝毫发资之人此尤难者感叹不已因赋二小诗
492045,十九日至二十二日雪作不止客有言是雪十馀年不见者固可喜也因赋五言一律
1098902,书目所见者五首 其四
597869,章别驾园亭北畔有桂一株近地尺许忽长嫩枝结花二颗大如茉莉其色瑩白可爱予过别驾别驾因请予观之亦平昔希所觏见者也因书以纪瑞云
429887,逸塘不相见者十有三年近读其和元日诗见及再次韵奉寄
520405,近雁塔有坡二曰胭脂曰翡翠其春游之盛盖极于开元天宝间矣观其命名之意则当时游冶之乐犹有可想见者因成二律情见乎辞 其一
588419,壬寅闰五月十四夜静坐后但见神气清朗彻夜玩月不寐至五鼓略就枕即梦见白沙先生瘦而长骨格昂峭两目烱然一如画图中所见者持酒一盏饮予曰此醇酒也极甜美曾饮之乎予答曰未饮也曰可饮之饮后即觉寤天将曙矣因纪以诗云
1250575,宋铙歌鼓吹曲十二首 其一 太祖生洛阳甲马营中神光满室有香郁然经宿不散此圣徵先见者也为启圣徵第一
1055627,之仪家当涂七年矣屡过禅岳山下望高山塔欲一游辄不果异时山主勤公大师与其子宣上人相过因往报之取路回远薄晚方到遂留宿栋宇一新舍次皆得其便而宏丽高朗唯见者知焉又复规范齐肃钟鼓应接问之乃勤一力所就丝蓄粒聚未尝毫发资之人此尤难者感叹不已因赋二小诗 其二
1070727,海南有五色雀土人呼为小凤罕有见者苏子瞻谪居此郡绍圣庚辰冬再见之常作诗记其事公实以是年北归癸酉冬予亦两见之今二年矣乙亥八月二十二日会客陈氏园飞鸣庭下回翔久之众客惊叹创见因赋是诗
186346,缘识·达道真人见者稀
1098881,秋后一日书所见者
583314,赣州节推邓诚之余同年也不相见者十年矣诚之过金陵会予于贡院因写在京时留别诸诗次韵答之并以赠行
925682,水调歌头 其五 元日投宿博山寺，见者惊叹其老
186046,逍遥咏·达道真人见者稀
461571,聚武昌与诸同学登黄鹤楼，座中更有十七年不见者，归来赋此以记
792545,甲寅四月，偶赴琴城，晤西京吾兄，欢谈竟日，阔别五六年，精神如昨，出先德柳村图属题。柳村都兄之尊人，弟之世长也，弟即不文，就少年所闻见者而略叙之，虽不足概平生，而落落大端已在，于是赋五古一章，所以纪实也，质之吾兄当乎否乎
305425,逸塘不相见者十有三年近读其和元日诗见及再次韵奉寄
1009160,灵隐虚舟和尚会中三夏每室中举不是心不是佛不是物之语三年不易是时如隔罗縠看月不敢下语后移单净慈常提此语忽蹉口自云恁么说话堕三恶道惜不复见者老和尚今作一偈记诸
1036073,临江仙 龙丘子自洛之蜀，戴二侍女，戎装骏马。至溪山佳处，辄留数日，见者以为异人。其后十年，筑室黄冈之北，号曰静安居士。作此词赠之
787710,前诗题后谛观卷中先人印章为前时所未见者，再成七律写怀
901360,所寓开利寺小池有四色莲花青黄白红红者千叶皆北土所未见者也惜其遐陬有此异卉
1113062,书目所见者五首
520406,近雁塔有坡二曰胭脂曰翡翠其春游之盛盖极于开元天宝间矣观其命名之意则当时游冶之乐犹有可想见者因成二律情见乎辞 其二
583453,弘治十六年十二月二十五日午大雪二十九日寅止正月三日晚又雪至十六日或雪或止惟十五日尤异其雪花大者约广二三寸长亦如之见者莫不惊骇余时奉命在镇是日雨水节寒如冬至沿河冻合舟不能行屋檐积雪弥月不消不知天道竟何如也感而有作
522349,仙鹤褚道人尝欲得一诗久未能答近和元吉寿篇见者谓似游仙体因书以贻之然终不近也
1076669,海邑少交游相见者以为言故作此诗
251199,聚武昌与诸同学登黄鹤楼座中更有十七年不见者归来赋此以记
1098899,书目所见者五首 其一
688169,近雁塔有坡二曰胭脂曰翡翠其春游之盛盖极于开元天宝间矣观其命名之意则当时游冶之乐犹有可想见者因成二律情见乎辞
1024776,某得银杏不食种之庵前见者曰是三十年乃生公老矣能待之乎某不答作曰
523810,菊时一种数本其一逾秋独妍爰及至日黄华韡然当庭见者骇叹携酒来赏予赋二诗 其一
1055626,之仪家当涂七年矣屡过禅岳山下望高山塔欲一游辄不果异时山主勤公大师与其子宣上人相过因往报之取路回远薄晚方到遂留宿栋宇一新舍次皆得其便而宏丽高朗唯见者知焉又复规范齐肃钟鼓应接问之乃勤一力所就丝蓄粒聚未尝毫发资之人此尤难者感叹不已因赋二小诗 其一
1253098,宋铙歌鼓吹曲十二首 太祖生洛阳甲马营中神光满室有香郁然经宿不散此圣徵先见者也为启圣徵第一
691718,菊时一种数本其一逾秋独妍爰及至日黄华韡然当庭见者骇叹携酒来赏予赋二诗
1098903,书目所见者五首 其五
1098901,书目所见者五首 其三
338440,前诗题后谛观卷中先人印章为前时所未见者，再成七律写怀
1098900,书目所见者五首 其二
