1025568,丁丑仲春将渡浙江从者请盘沙予畏而不许既登舟乘潮以济中流胶焉捐十金募数力竟至沙上仅达西兴狼狈殊甚从者笑之感而赋诗
297188,成德桥成，公善领事拟于冬日涓吉落之，感而成诗见示；敬和原韵
545654,答东阿张明府肃仲时肃仲远命书贶物色余长安风尘中不遇几返胡孟韬特为致之感而赋答并似孟韬
1160941,合江亭槛前多高竹不见远岸花客命剪之感而成咏
596908,先人琴砖从修宅得之感而赋此
839079,成德桥成，公善领事拟于冬日涓吉落之，感而成诗见示；敬和原韵
302511,雪朝方读书，姬人来告，邻树鸟尽集吾庭，因物类之感而作是诗
604733,居停古庐奉晤陈司理震阳谭亡友李仰城将军往事不胜西州之感而古庐有黄荆卿太学则不佞乔札欢亦李将军所尝物色者也司理慷慨有大度能得士心故以诗介书为荆卿缓颊若曰交浅言深冗曹其曹丘乎则批颊退矣
457998,予辞故乡网唐风宋韵版主，诸友惜别相送，作诗甚众，予览而感之，感而愧之，赋此聊以为答
817834,雪朝方读书，姬人来告，邻树鸟尽集吾庭，因物类之感而作是诗
298171,好事近·年前定华以西藏檀香见贻，今始燃之，感而成咏
796631,满江红 廿年前，为人题小影，偶复见之，感而作
15504,合江亭槛前多高竹不见远岸花客命翦之感而成咏
1039150,牡丹初芽为鸦啄之感而成咏
838179,台城路·庚子之乱北京棘院毁于火。癸卯会试就汁闱举行。北宋故宫沦为神庙，白石龙座犹当时制作。客谈及之，感而追赋
372480,牡丹初芽为鸦啄之感而成咏
569622,喻工部邦相以前天台令谒选枉道见访出楚中诸集读之感而有赠
