1113925,递中得先之兄书取邕钦宜柳归约十二月到此年节已近未闻来朝寄奉
1056792,金陵递中示到亨父老丈去年秋初见寄诗书捧咏无穷之意不胜私感因成四韵奉呈
355541,某在合肥尝梦同子直在横川旧游递中有诗往还子直见招因用前韵来寄
905337,递中得先之兄书取邕钦宜柳归约十二月到此年节已近未闻来朝寄奉 其二
1052066,某在合肥尝梦同子直在横川旧游递中有诗往还子直见招因用前韵来寄
156957,递中得先之兄书取邕钦宜柳归约十二月到此年
1004015,去岁重阳日得彦威信附六月间二小侄及从弟侄所寄书自蜀阃递中附至历言去冬今春所遭兵祸及有司督迫科调之苦喜其存全哀其窘蹙洒涕如霰寄讯邀其下峡而边事又告急未知其达与否也会杪冬见邸报宣谕使者余公侍郎改命授钺尽护蜀师意欲以此事归控骨肉会聚兹事其谐矣喜极涕零遂成长篇
953754,春日独游上林院后亭见樱桃花奉寄希深圣俞仍酬递中见寄之什
641660,得洛容兄递中报二十韵
329448,金陵递中示到亨父老丈去年秋初见寄诗书捧咏无穷之意不胜私感因成四韵奉呈
905329,递中得先之兄书取邕钦宜柳归约十二月到此年节已近未闻来朝寄奉 其一
1231861,姚子章人回知骑从在杭即欲渡江一见递中得书闻已归玉山中遂成怅然因寄
