761118,鹧鸪天  其一 余往来邓尉山中十馀年矣，独爱青芝一坞，林嶂秀岨，人迹罕至交，有终焉之志，未逮也。还泊西崦因赋是解
698075,和汪少参嘉会抚徭通峡韵先是嘉靖乙酉予在浔与杨兵宪文瑞议雕剿峡贼闻者悚慄惟杨与鄙意合力主之仅戮九人馀悉抚定群蛮震慑愿附籍输税告乞通峡军门乃敕予檄商舟通焉盖自韩公通峡至今六十馀年矣
931905,两蜀故人寄余阆中左绵题名石刻来皆二十馀年矣怅然有感
306277,净师别于鼓山二十馀年矣顷复相过抚今感旧赋呈
1042155,富谷老人臧用自云本京师兵士咸平中没番五十馀年矣
707290,潇湘逢故人慢 赠李简尤初度简尤方五十髭髯如雪已十馀年矣
587021,和汪少参嘉会抚徭通峡韵先是嘉靖乙酉予在浔与杨兵宪文瑞议雕剿峡贼闻者悚慄惟杨与鄙意合力主之仅戮九人馀悉抚定群蛮震慑愿附籍输税告乞通峡军门乃敕予檄商舟通焉盖自韩公通峡至今六十馀年矣 其二
587020,和汪少参嘉会抚徭通峡韵先是嘉靖乙酉予在浔与杨兵宪文瑞议雕剿峡贼闻者悚慄惟杨与鄙意合力主之仅戮九人馀悉抚定群蛮震慑愿附籍输税告乞通峡军门乃敕予檄商舟通焉盖自韩公通峡至今六十馀年矣 其一
872485,旧有歙砚雅宜墨镵贱号于阴以乱亡去十馀年矣忽见之村学堂中睨视间有艴然持之却走者如恐予之取也因作此以遗砚
432650,国际桂冠诗人陈汉山自台北寓书附来海上诗简内录吾家兄弟佚诗二十多首故人契阔不通音问四十馀年矣喜感交集赋二律以报
414521,国际桂冠诗人陈汉山自台北寓书附来海上诗简内录吾家兄弟佚诗二十多首故人契阔不通音问四十馀年矣喜感交集赋二律以报 其一
608805,雪中偶披故太史林开先所书梅花诗卷往时余与黎惟仁林开先倡和至是十馀年矣追往念离用韵寄惟仁
1001725,涂汉英学诗二十馀年矣挟近作来示赏叹之次俾更印可诸公间
413351,赵克臻大家别二十馀年矣归国观光海上喜晤因知近年以诗名藉甚香岛赋二绝赠行 其一
414522,国际桂冠诗人陈汉山自台北寓书附来海上诗简内录吾家兄弟佚诗二十多首故人契阔不通音问四十馀年矣喜感交集赋二律以报 其二
366371,富谷老人臧用自云本京师兵士咸平中没番五十馀年矣
458447,二零零七年秋归乡，得会老薛并诸友。薛云，中年向暮，馀事皆无，但思重拾诗思，以遣苍髯。故记以赠之。又忆少年十七八时，共约归隐，予有词云：觅佳地、须邻古柏，有小舟、细雨泊烟霏。功名倦，匡山忆处，结屋相依。今廿馀年矣，竟不得践其归志，悲乎
807879,贺新郎  不晤黄子艾庵十馀年矣，昨南耕自郡至，艾庵以溪南词一卷寄予，循览之次，追感旧游，兼怀邹董，怆焉填词，即用溪南词中韵
781181,京兆瑶峰先生持同乡常观察行述示余知公儒臣殉节风义凛然读公爱吟草又如裴晋公故里凤凰山诸什益恍然于公之学有经术平生不朽之事非慷慨捐生一端可竟也余欲出一二语为颂第念忠魂享庙食矣德政纪浣溪矣文章寿梨枣矣捃摭遗迹近于剽窃吁公逝十馀年矣西充民肖像尸祝至今不衰何以感人之深而去思之长也因作迎神曲一章代西充民歌咏之云尔
1142395,予读书之室先从兄时南尝扁以绿猗今二十馀年矣感叹存殁遂成长篇
814619,鹧鸪天  余往来邓尉山中十馀年矣，独爱青芝一坞，林嶂秀岨，人迹罕至交，有终焉之志，未逮也。还泊西崦因赋是解
807616,拜星月慢  余不到玉峰三十馀年矣，乙卯清明与植斋、竹逸重游是间，赋词感旧
284105,赵克臻大家别二十馀年矣归国观光海上喜晤因知近年以诗名藉甚香岛赋二绝赠行
807265,满江红  玉峰沈天羽先生，词场耆宿也，选有草堂四集行世，不幸早逝乏嗣，岁月不居，距今已四十馀年矣。贤配钮夫人今年举七十觞，有从甥钮君南六，代为乞言，词以寄慨
706570,徐合素自南来抵郡城远讯船山代书答之尊世父闇公从海上卒于岭表廿馀年矣因寓我尚为人之叹
296027,吴彦复之殁今十馀年矣其夫人七十生日章行严徵诗章吴婿也书二绝句
830381,净师别于鼓山二十馀年矣顷复相过抚今感旧赋呈
432915,赵克臻大家别二十馀年矣归国观光海上喜晤因知近年以诗名藉甚香岛赋二绝赠行
446112,买陂塘 城居十馀年矣，庚寅中秋后感赋
413352,赵克臻大家别二十馀年矣归国观光海上喜晤因知近年以诗名藉甚香岛赋二绝赠行 其二
761119,鹧鸪天  其二 余往来邓尉山中十馀年矣，独爱青芝一坞，林嶂秀岨，人迹罕至交，有终焉之志，未逮也。还泊西崦因赋是解
