1243913,乙未八月二十二夜梦宿山寺与僧讲道论诗不觉夜分僧赋一联云鹤向白云栖处宿僧从青嶂影边归觉而微改其句足成一律云
408047,梦中得“秋风人对残花立”句，自谓有小山“落花人独立”意味，足成一律
453201,见兴福寺山门佳对用作颔联足成一律
457987,二零零一年末夜梦与段学俭兄谈诗，梦中复梦，得断句曰：“潮头断艇波还下，月底惊云骏以奔”。既醒，不识其意。然时复忆及梦中断艇，遂为足成一律
453200,见兴化寺山门佳对用作颔联足成一律
446084,南徐昨晚新惠浣溪沙，忽得谬许知音一句，今晨足成一律
1243759,午窗睡起偶吟閒花落砚池小儿汝廉率尔应声曰香絮粘棋局遂足成一律
545477,次夕饮酣永叔得句云柝声频入夜霜寒余为足成一律时仲子弼侍坐而余于司空为年家
558314,客有诵予昔在淮安与异知县诗者今止记其二句用为次联足成一律以寄毕
631279,曩在海云偶得一天风雨沉山阁之句时尘异诸子侍坐命作对语尘异以万古云烟锁石门应予心异之己未八月初七入双镜楼忽忆前事正当斯时因用旧句足成一律以识梦中之境始信人之心愿原非虚设也
313899,梦中得“秋风人对残花立”句，自谓有小山“落花人独立”意味，足成一律
1231405,六月十七日夜坐李宁之忽得风急落流萤之句遂命足成一律
