597680,王生卜居于东走笔赋赠
510346,问厚郭胡父子起居于其乡人苏
30976,将之泸郡旅次遂州遇裴晤员外谪居于此话旧凄凉因寄
1181294,将之泸郡旅次遂州遇裴晤员外谪居于此话旧凄凉因寄二首 其二
1016293,古城兰若有竹数百道人筑墙而疏逖之十有九居于外或以净香名之取少陵雨洗娟娟净之语殆少吾此君也故以此意为出一语赠之
147557,玉山章泉本章氏所居赵昌甫迁居于此章泉之名
188472,偈公·居於富贵中
373493,某为世所弃困居于苏平生交游过门不顾长安
894506,过曹氏坟庵在灊皖间蜀僧修静自天柱退居于此
159388,过曹氏坟庵在灊皖间蜀僧修静自天柱退居于此
304166,梦与娟净居士同移居于西山之麓精舍幽深红叶满阶下醒记以诗并邀娟净同作
1055720,延之问及当涂近事云君殆能容忍我不及也胡不迁居于此便治馆因口占为谢
1123909,成父居于普宁寺钟楼之下辟以为斋旧名坎止近易榜曰发深省衡州舅氏书之仆为赋四小诗以发深省斋为韵
828466,梦与娟净居士同移居于西山之麓精舍幽深红叶满阶下醒记以诗并邀娟净同作 其一
1039011,某为世所弃困居于苏平生交游过门不顾长安侍读叶丈不以秦吴之远高下之隔闵此穷悴特贶以诗然韵险句奇不可攀续仰酬高谊强抉芜音
329964,延之问及当涂近事云君殆能容忍我不及也胡不迁居于此便治馆因口占为谢
829428,梦与娟净居士同移居于西山之麓精舍幽深红叶满阶下醒记以诗并邀娟净同作
973897,成父居于普宁寺钟楼之下辟以为斋旧名坎止近易榜曰发深省衡州舅氏书之仆为赋四小诗以发深省斋为韵 其一
458452,小农作新居于东阳，居前置小圃，甚有水山之气。予徘徊其间，恍然忆前岁山中共觅乡酒事
1181293,将之泸郡旅次遂州遇裴晤员外谪居于此话旧凄凉因寄二首 其一
973898,成父居于普宁寺钟楼之下辟以为斋旧名坎止近易榜曰发深省衡州舅氏书之仆为赋四小诗以发深省斋为韵 其二
30977,将之泸郡旅次遂州遇裴晤员外谪居于此话旧凄凉因寄·昔年共照松溪影
441856,居于山间，碾米要肩挑至邻乡，抄小路尚须八、九里
828467,梦与娟净居士同移居于西山之麓精舍幽深红叶满阶下醒记以诗并邀娟净同作 其二
1033365,玉山章泉本章氏所居赵昌甫迁居于此章泉之名遂显
935755,余为成都帅司参议成将军汉卿为成都路兵钤相从无虚日余被召出蜀汉卿坐法谪居于涪既得自便因卜筑为涪人今年广汉僧祖成来山阴乃言尝至永嘉乐清县柳市之广福寺有黄先生寓寺中炼丹及见则汉卿也余闻之感叹不已为赋此诗
483511,小峰当玉泉院前道士云此白鹤峰也昔金仙宫主始居于此因玄宗迹之遂跨鹤飞上上方峰故名
1058777,鉴湖先生未老挂冠以诗卜居于姑苏毗陵两郡依韵奉和
95259,成父居于普宁寺钟楼之下辟以为斋旧名坎止近
1195053,将之泸郡旅次遂州遇裴晤员外谪居于此话旧凄凉因寄二首
971194,成父居于普宁寺钟楼之下辟以为斋旧名坎止近易榜曰发深省衡州舅氏书之仆为赋四小诗以发深省斋为韵 其四
973896,成父居于普宁寺钟楼之下辟以为斋旧名坎止近易榜曰发深省衡州舅氏书之仆为赋四小诗以发深省斋为韵 其三
