541300,送陆川尉上计
873955,送刘旬甫之池阳省觐六十四丈遂如行在所上计
606842,寄吴懋中明府时将上计
592169,吴明卿上计至都下
559296,?隍驿送沈令公寿日上计
545802,送张仲立上计二首 其一
593062,送沈纯甫上计
1233574,送顾仁甫上计京师
1001672,昨与余游如陈广元张寿卿江伯纪陈通卿皆上计矣独邹用之邓继高困阨况今相去愈远焉缅我怀因成两诗各书一通寄之 其二
538461,遇于鳞人云当上计台使留为代报喜而有作
533171,闻吴明卿上计以禁例不得相晤赋此寄怀
606643,别上计诸子
614765,送龙太守上计 其三
670706,送魏朴如孝廉省试时使君上计与偕
614763,送龙太守上计 其一
468578,送王知县上计朝京
592182,送魏顺甫使君上计还济南
1111249,送盖总领上计三首
545803,送张仲立上计二首 其二
273397,近事诗·预走曾闻上计推
1127745,昨与余游如陈广元张寿卿江伯纪陈通卿皆上计矣独邹用之邓继高困阨况今相去愈远焉缅我怀因成两诗各书一通寄之
697281,送张仲立上计二首
703889,送龙太守上计
614764,送龙太守上计 其二
148705,昨与余游如陈广元张寿卿江伯纪陈通卿皆上计
1089326,送盖总领上计三首 其三
333138,春闱·荦确频驱上计车
1089324,送盖总领上计三首 其一
1089325,送盖总领上计三首 其二
614766,送龙太守上计 其四
148706,皆上计·枕中肘后为渠空
1001673,昨与余游如陈广元张寿卿江伯纪陈通卿皆上计矣独邹用之邓继高困阨况今相去愈远焉缅我怀因成两诗各书一通寄之 其一
538428,于鳞贻诗见怀云上计非远率尔志喜
529946,闻庭实上计不与怅然有怀
593581,送沈明府上计还县
