603058,初冬日承黄四茂才君甫元生元醴伯守黄苏欧八文士元昌元玉元佩元庸伯起伯安廷魁能见携李英偕赴吴茂才子赞之约即席同赋轻字韵
152175,东坡像李伯时作曾无疑藏之命予赞之
182048,黎解元庄严观音像见而赞之
904170,右司公致书显上人并遗楮衾诗以赞之并简都公
1221561,郑敬常求题画像因用同姓八事赞之
219406,端忞疲於哺蚕老妇悯而饷之余作古调以赞之
140339,谯申甫惠诗有随缘婚嫁之语因次韵赞之
220292,景荀筑室伟甚诗以赞之
319009,浣溪沙·礼赞之二
1001899,万安簿吴公谊实浙馀杭人今书满最归欤欲竟投老未决于其间而赞之
419104,浣溪沙 礼赞之二
944851,龄叟得稼山好语因赞之
985868,端忞疲于哺蚕老妇悯而饷之余作古调以赞之
220026,家君为张丈明叔段丈处厚作诗集序小子赞之
821431,金缕曲 新政府成，废双十节，而令举国狂欢十日。九叠罅韵赞之
493291,余忧愤中戏作墨龙于报恩寺之西壁明日余兄子中复图于东壁有高视阔步之意或请余弟子彦赞之子彦笑而不言因赋一绝以见意
904265,景荀筑室伟甚诗以赞之
671659,会稽宣绣方之上海顾绣适堪姨姒友人见贻分丝观音一幅针锋细贴殆类白描女工之佳者也赞之以歌
958567,黎解元庄严观音像见而赞之
1158330,鲁望读襄阳耆旧传见赠五百言过褒庸材靡有称是然襄阳曩事历历在目夫耆旧传所未载者汉阳王则宗社元勋孟浩然则文章大匠予次而赞之因而寄荅亦诗人无言不詶之义也次韵
220314,右司公致书显上人并遗楮衾诗以赞之併简都公
1034865,谯申甫惠诗有随缘婚嫁之语因次韵赞之
1072592,闻郡中请贤老住报恩作诗赞之
1086127,婺女广文官舍旧有五柳萧侍郎德起为教官时取以名堂岁月浸久柳既剪伐名亦更矣周尧夫欲复其旧诗以赞之
948967,东坡像李伯时作曾无疑藏之命予赞之
904245,家君为张丈明叔段丈处厚作诗集序小子赞之
131515,龄叟得稼山好语因赞之
