430088,兑之道出下关见寄二诗晚行常锡间赋四绝句答之 其二
1223612,郭某席间赋
458153,昨宵醉卧卢智晖许，似梦泛舟西湖。揽衣而起，行犹摇曳，更复持杯，席间赋此。即以寄莼鲈兄二首 其二
545458,惟寅治第于甃石中得大禹岣嵝碑因函置壁间赋此纪事是日同观者王行父汪明生
430090,兑之道出下关见寄二诗晚行常锡间赋四绝句答之 其四
521742,黄岩有水出天台下流入海湍悍能败舟土人呼为恶溪艾斋陈君募乡人筑长堤截而回之民用无患是岁与施彦器宪副访予云间赋此为赠
584868,余自南赣赴抚山东陈都宪原习来代以年谊之厚操舟送至储潭席间赋诗见赠步韵酬之
427729,定风波 秋尽独行三步两桥间，赋呈太疏楼主
545946,秀上人自永嘉过谒乞余言绍介汪司马公将以是秋驻锡黄山白岳间赋赠
542492,吴子乔有弟从方士数年不归因访于梁宋间赋此以赠
307146,感怀诗·如此人间赋卜居
314909,定风波·秋尽独行三步两桥间，赋呈太疏楼主
1242862,命酒徵歌送余婿，时伯庸酒间赋赠董景明、董彦祯诸亲还遂昌
899607,南楼令/唐多令 寿邵素心席间赋
1215042,岁除，水仙、梅、菊盛开，与鹏飞照磨饮于花间，赋之
807616,拜星月慢  余不到玉峰三十馀年矣，乙卯清明与植斋、竹逸重游是间，赋词感旧
1077733,胶山兰若幽胜予寓梁溪久而未之到闻翁士特携家居其间赋诗见意
1069974,德升尚书置酒邀叔厚内翰与余同会叔厚席间赋诗道旧复宠示德升妙句俾余同和谨次韵奉呈
833882,离亭燕 独行金陵山水间，赋此凭吊
458152,昨宵醉卧卢智晖许，似梦泛舟西湖。揽衣而起，行犹摇曳，更复持杯，席间赋此。即以寄莼鲈兄二首 其一
605102,病困两月里中亲友数四过存幸少有间赋此呈谢
466170,昨宵醉卧卢智晖许，似梦泛舟西湖。揽衣而起，行犹摇曳，更复持杯，席间赋此。即以寄莼鲈兄二首
433465,兑之道出下关见寄二诗晚行常锡间赋四绝句答之
430087,兑之道出下关见寄二诗晚行常锡间赋四绝句答之 其一
1136963,木兰花慢 其一 别云屋席间赋
1026094,朝中措 九日周国正席间赋长短句
887711,新雁过妆楼 其二 中秋后一夕，李方庵月庭延客，命小妓过新水令，坐间赋词
430089,兑之道出下关见寄二诗晚行常锡间赋四绝句答之 其三
305786,兑之道出下关见寄二诗晚行常锡间赋四绝句答之
