544403,潞河遇陈子卿同饮胡瀫元斋头即席赋梅花下
569690,华幼圜以古隶见贻赋此报谢仍乞书国风
533109,溪南别业为万考功言卿赋 其一
969413,赋墨雁图分得宿雁
668462,赋瓶梅
78,赋得残菊
320402,再赋·起自然铜鼎
1071587,吕丞相自天台寄示退老堂诗卷赋此二首 其一
697032,顾朗生山人以四诗见贻赋答
900666,芭蕉茶送伯承伯承赋诗三章次韵 其一
700870,集北郭禅院喜邓羽卿冒雨至赋得风雨亦来过二首
1209281,武林韩与玉名玙雅与易之在京师交至密至正十五年乙未归武林病亡六月闻讣余虽未获缔交以易之之故数有翰墨附余是年冬十月朔偕易之暨武林杨彦常乡中蒋伯威叶孔昭应成立祭于鄞江义塾约赋诗以挽之
559051,勿逾方先生令惠来据九年始终一节业当通考忽有贾傅之行伤哉贫也去无以为资士论惜之为赋三章聊志遗思 其三
736411,丰泽园御试论赋蒙赐饮馔仰聆训诲恭纪
844187,丑奴儿令 两大人之黔中，鼎以试事留湘，赋感
83583,诗因赋·露下萤飞仲秋月
606383,孝陵陪祀毕登钟山感赋
1117651,卯饮醉卧枕上有赋二首
1100744,赋僧壬枕流
845157,清平乐 拙词编就，感赋三阕
306435,庭前海棠初开姜斋同赋
1088366,游白鹿洞熹得谢字赋呈元范伯起之才三兄并示诸同游者
1242053,松斋为玉峰秀上人赋
511701,味道斋为秀才程愈赋
944748,良月二十一日郡庠置酒炉亭劳余出山且取子美何时一樽酒重与细论文分韵赋诗韵不以及就成十绝 其七
410146,自高坡至小西山赋呈维彰四兄
607135,冬日初晴登镇海楼历粤秀诸山同张孟奇计部黄士明太史分赋二首 其二
323416,钱再赋二诗复用前韵钱云家无置锥之地寓居僧舍有为题米疏者
904159,士贵要予赋水轮因广之幸率介卿同作兼呈郭宰
991067,依韵和正仲赋杨兵部吴兴五题 其一 □□□
254629,浴桃花汤·惜尔不遭淮海赋
1123705,卢谊伯宜之见过要斯远同赋以赠二首
784866,静亭再从兄见有蜾蠃负螟蛉者为他蠃所夺此蠃飞鸣弃去似有所憾赋五古一首见示因和二章奉答
454707,读梁藻城兄《风雨冰弦诗词》感赋
333322,再赋孔雀鹦鹉
1074860,再赋三首 其二
143478,赋女冠还俗
670516,除夕魏使君携长君及黄山人见过同赋
876237,小圃有双莲夏芙蓉之喜文字祥也各赋一诗为宗族亲朋联名得隽之谶 其一
1206989,阳山昱上人访予吴门寓舍求为湘竹诗予辞以未见竹上人不远六十里自山中舁其竹而来好事有如此者欣然为赋长句
1001504,五羊七月闲赋
81843,数日寒顿减颇有春意感怀赋短歌
128545,改之下第赋赠
698283,余自壬辰释褐同白阳毕公谒天官选公得云间李余得楚泽令一行作吏南北各天闻问遂蛩然矣乃公扬历中外骏声蔚起回翔南北周践台部盖吾榜中自眉也不佞蕙自谢铨务一卧二十余年姑从兵燹之后再成小草得侍公于南大司农部也日共朝夕奉以周旋亦奇合哉公地望隆甚中外引领公入筦铨衡晋陟揆席乃公遽以告老求去公何尝老哉上不忍拂公之意暂从其请旦夕且召公矣才赓埙篪遽赋绣衮三十年何握手之难而分袂之易也谬成四章以别
632291,赤公书来赋答二首 其一
1166275,恩制赐食于丽正殿书院宴赋得林字
872513,诸公赋东园兄铜雀砚甚夸余独不然然苏长公诗铭梅都官长句皆尔如谓举世争称邺瓦坚一枚不换百金颁不及鸳鸯飞乃有科斗情入用固为贵论古难与并之类是已敢并为之反骚
1216634,衡山福严寺二十三题为梓上人赋 其二 一生岩
595987,经徐州数千里尽为水患淤塞进舟之难赋此
709395,黄舍人符升秩迁客部奉使册鄢陵王兼捧前任荣封诰命就道还里赋此送之
220743,九日·欲赋前贤九日诗
444262,辛卯上元感赋
558964,九日至极乐寺闻袁中郎且至因喜而赋
770029,甘州遍•赋得不信比来常下泪，开箱验取石榴裙
717275,赋得摇落深知宋玉悲 其四
1224830,陈新甫生日出红玉杯饮为赋
516307,卧游轩为曾日章赋
544003,与惟寅一别淹冉五载消息不复相闻春来忽得手书新刻见寄赋怀五首 其一
423256,游交芦庵僧人老且病出观华秋岳奚铁生西溪诸卷欲访厉太鸿先生墓为时已晚怅然归去赋此赠之 其二
755630,随宦桂林未遂揽胜之愿匆匆去阻雨愆期因挈马甥瑞熙女寿慈两儿瑞琳瑞麟登叠彩山盘桓竟日赋此留题
559158,戊申贱辰辱父执陈薛谢三先生并持觞至三先生二百四十岁酒力步履如常人老父喜三先生来病辄起留款三日乃游凤凰台登舟别小子漫赋四绝为谢 其一
1062137,将去宝峰诵老杜更欲投何处赋五言三首 其一
771347,瑞鹤仙•有客诵苦恨年年压金线之句，为赋其意
1163864,除授太学国子监司籍之职因赋
1032510,赋催妆
615901,初冬载酒陶摇光宅与诸子夜集分赋
73994,因赋诗云
918236,友人江顺德连日留饮分韵赋诗得日字操笔立成
950300,赋张参政四老堂 其一
175571,赋催妆·严妆应在绣闺中
576901,幽谷辞为范孟祯先生赋
447173,下乡插队二十周年感赋
618380,夏日同侯若朴金元甫陈居一陈集生饮陆氏山园分赋以名园依绿水野竹上青霄为韵十首 其一
1221637,拟赋桃灯杖 其四
438680,松筅同希颜钦叔裕之赋
615677,周玉绳年兄迁居道院屡疏乞身初夏过访漫赋 其三
150876,余方悼亡适山圃牡丹芍药盛开赋长句
134921,次韵章枢密赋吴彩鸾玉篇
220327,和赵西里赋雪
124944,答翁愈赋卷
148788,用山谷新诗徒拜嘉之句为韵赋五篇报尹直卿
990371,奉陪黄帅机访问元夕战场归涂见人家园池花木相与叹息既帅机书前所作八诗示滕审言不及予也枕上不能记韵效唐人和诗体自赋八绝句因以寓意 其五
1242856,樵云诗，为李文彬参政赋
78498,自咏·曾著杞菊赋
243620,赋清旷亭·半村半郭事林丘
416334,东风第一枝 辛未季冬，探梅过香雪海，赋此
624125,秋夜何谷卿黎缜之陈少良邓伯乔李伯襄过饮贻安堂分赋得梧字
1088504,石马斜川之集分韵赋诗得灯字
843914,浪淘沙 锦城重九，无处登高看菊，公园有感赋
279232,飞雪满群山·丙辰腊节为阳历六年元日，灯会步雪，怆然有赋，用蔡伸道韵
1003257,醉蓬莱  侍宴德寿宫应制赋假山
712698,魏子冲司马擢理军府时令子官桂林赋此志贺
532304,禾稼在野人有更生之望喜而赋此 其二
1135869,以读书破万卷下笔如有神为韵赋十诗送赵然然如大都 其七
452180,己丑三月晦日重到杭州赋此送春
1073653,读张彦明饮酒赋诗唱酬次韵归之
688388,吉守顾天锡乃兄会于吉贰守柳邦用以宁知风雨夜复此对床眠一联为题送之余亦赋十绝以见意
500778,壬辰清明日客有携酒城东邀陈致中谢行可程子舟马希穆及余游月盘洞天偶遇张文泰遂同饮欢甚行可以老杜清明二诗次韵纪事因就韵赋 其二
238424,赋梅次韵·未知何处是真梅
1004837,以昌黎验长常携尺为韵赋笋五首 其五
1158378,裴将军剑舞赋附歌
603086,献岁六日欧关黄诸词客初开海西社会午后见过李英酒馆雅谈赋此
886882,雪楼程御史次方山房韵见寄用韵答赋三首 其三
737199,庭柏旱久色悴漫赋
512910,闻杨君谦致政赋此以致健羡十五首 其十一
751041,和沈盦守岁感赋用元遗山甲午除夕诗韵
839496,馨吾王君，于壬寅年造新宅市东静地，落成赋移居诗嘱和，次韵奉寄四首 其二
742165,续前题与宋奕岩同赋 其一
604875,戊午初度车宜仲内兄偕羊鹅二城诸君子为笠屐图以诗见寿赋此奉答 其一
930393,九月十一日疾小间夜赋二首 其一
822963,翠楼吟 江楼送别三十九人，怆然赋此
117638,赋园中所有
210259,赋林景参梅屿
539503,刘太常亟言大城令忽君之贤也其善状非一至祷雨立澍矣予闻而贤之为赋四绝句 其四
435752,九日读书山用陶诗露凄暄风息气清天旷明为韵赋十诗 其一
1128092,丙子重阳触事有赋得绝句七首
712437,赋送顾禹二首 其一
844671,表兄方剑华农部久参董军去岁言不见用今将赴蜀省其弟和斋刺史相见西安信宿而别赋二诗 赠剑华
1221686,报德诗为郭伯瑆赋
862767,赋红梅
618747,履端二日赋十绝句 其四
916000,昭君怨 赋松上鸥
557087,张助甫席上同吴峻伯白伯伦再饯朱主客南还赋得江飞兢渡日草见踏青心十韵 其十
760001,王晓沧将之官闽中赋别 其五
937726,同继祖民瞻游赋诗亭二首 其二
533229,白雪山房为李惟寅典禁赋
952372,赋应斋卷后
1088209,游昼寒以茂林脩竹清流激湍分韵赋诗得竹字
504648,忆昔自京至关中将四千里所历古迹不能殚记因閒居无事追赋律诗凡十首目之曰忆晋以泄曩日之思云 其一
430029,壬申燕九广和酒肆赋呈太玄纕蘅
827010,木兰花慢 绍周六兄前岁五十初度，同好咸以诗文为寿。予时方崎岖道路中，无一语相贶，补赋此调寄之
963035,考亭陈国器以家酿饷吾友人卓民表民表以饮予香味色皆清绝不可名状因为制名曰武夷仙露仍赋一首
404786,雨中花慢·本意，赋荷
1122228,为汤提刑赋南园玉绣毬花二首
431580,赋谢吕兆棠先生惠诗二首
614841,鉴止榭之前有古榕焉枝干半枯余滋溉一年所复尔荣茂偶读杜工部老树空庭得之句欣然有会遂分为韵各赋一章 其一
33703,赋得送轩辕先生归罗浮山
918499,开禧元年四月自中都挈家还乡寓居城南十二月迁居柳溪上其夜大雪初一日盖宰来访约过县斋为一日款深夜而归赋此 其八
663426,题金谷园图赋得绿珠怨
665225,博士苏璞学正方邦望同日拜节推苏在桂林方在广州予为赋一律各书一通赠之
732850,鄗城奉谒魏相国留饮葆石堂赋谢
1175460,汴州船行赋岸傍所见
444001,中元节感赋
2731,赋戚夫人楚舞歌
605208,丙子季春邑侯金公偕归善陆侯游罗浮余以瞽目地主不能从侍赋此呈之以见响往 其二
372708,重九席上赋金铃菊
913571,雪后晚晴四山皆青惟东山全白赋最爱东山晴后雪二绝句 其二
949569,桂枝香 云洞赋桂
502910,玉融潘原润将义葬其师黄山陈平叔一日持广赙集过予愧贫不能助遂赋此以赠之
611077,夏日米君梦吴翁晋载酒过斋头席上同赋二首 其一
1212498,独醉园梅数年无花今岁特盛中觞有索赋梅词者为赋
1212498,独醉园梅数年无花今岁特盛中觞有索赋梅词者为赋
1251849,岁己酉八月十四日寓甫里之野人居刘君元晖邀余酌酒快雪斋中对月理咏因赋长句
1004899,戴氏楼名折桂来觅诗赋二十八字
1127739,乙丑十一月十一日决狱次日迎帅舟中赋二诗首呈吴司理
441073,如冰登弹指楼赋短句见寄步韵奉和
139668,溪上赋诗·莫作溪流看
509090,访少卿李公因送予至小箬邮亭赋此赠别
263317,郑清侯自泰州和予看雪诗，赋此奉答
365906,谕剿义和团感赋
412754,小住泰和感赋
940717,添筑横玉再赋 其一
279209,琵琶仙·为唐采芝赋
503510,山人以春茗见寄赋以荅之
620060,杪秋饮黄石斋太史席中赋谢
1114325,十月桃 二首，同富季申赋梅花
617416,秋日饯王侍御老师于浴日亭次韵赋别二首 其一
1088913,王弱翁与余相遇汉口赋古意赠别
183326,壬申仲秋与东观曝书之会谨赋五言四韵律诗
939391,春日偕游响应山观瀑泉饮漱玉亭上分复磴拥危泉赋磴韵十四
1196028,陪郑王相公赋檐前垂冰应教依韵
1108579,赋得老松老鹤各一首
547995,塞下曲八首为蓟门大夫赋 其五
605615,用平年兄有小舟曰荷花片以诗索赠次来韵赋答 其六
619477,寿叶台山太师二首 其二 赋得鳌顶云峰
444431,忆旧游 乙亥春京华小聚，凡翁命赋此调
613803,赋得虾蟆石
851130,己卯十月一日至燕越五日罹狴犴有感而赋 其九
616015,黎君选陶子昭黄逢永春早过访旋附婚船遄归赋此寄之
306544,八声甘州·甘泉山馆宴集，赋赠任公
1223676,忆三十年前与元复初参政同赋秋日梨花元有句云朝食叶底梨暮看枝上花而忘其后句因续之云
354977,寄君宜弟·三复棣华赋
387805,浪淘沙·园林换叶，新绿满庭，晓起坐西轩下，见石榴新叶可玩，漫赋此解
934956,入秋游山赋诗略无阙日戏作五字七首识之以野店山桥送马蹄为韵 其七
833398,买陂塘 赋得白荷花瓣四首 其一
40239,赋得鸾台诗
515597,哀灵椿卷为徐中行赋 其二
946939,守斋和张倅古岩诗予用韵赋三绝呈守斋 其三
280668,南浦·秋水，用碧山乐府韵，同蘅圃赋
379278,卜算子·小园饯春感赋
1221514,如存堂为程进珉赋
480819,赋得贞松寿姑苏张继孟八十
533805,湖上居为余德甫赋
618326,庚辰初秋日同黎君选徐六出罗子开家从儿侄赋别门人吴孟浚比部于宝莲寺二首 其二
402859,三姝媚 山塘薄游，追忆感赋
1101005,初夏偶赋
542312,同沈禹文周君可二参军集章子吉参军宅时章景南行人至自上党即席赋此
601334,村居四咏为区封君赋 其四 冬日
1068228,予夏中卧病起已见落叶因取渊明诗门庭多落叶慨然知已秋赋十章遣兴 其五
842894,赏穿带嗉貂袿感赋
839408,余去梁溪五年矣，甲申冬有事重游，追思往昔，不禁感慨系之，为赋游仙诗三章 其二
702897,行经汶上堕马复誇驰数十里赋二绝解嘲
786515,自赋
1087673,同僚小集梵天寺坐间雨作已复开霁步至东桥玩月赋诗二首 其二
829461,秋间予病几殆陟甫九兄夷希同年邀游鄮山时为八月十一日为予五十初度两兄斋僧普佛为先母周太夫人资冥福归后病良已追念感赋四首
544016,膝汝载先生卜筑武夷邀余过访余以家慈卧床褥尚孤此约感念今昔不胜怅惘敬赋小诗奉寄凡八章 其五
609727,未果赋此志怀兼呈同游诸君 其二
1224243,二月二十四日自琼州出白沙驿阻风二日不得渡海是日有幕客送寒衣却出赋诗
614074,羊廷信明经过访以儋被为贽赋此詶之
615388,冬日同何似公伍国开有开暨仁伯弟定国安国侄驼山寻梅赋
578112,台州程太守贤京国旧游也考绩相遇于钱塘叙旧之馀赋此识别
875836,黄田人家别墅缭山种海棠为赋二绝 其二
594215,海上三山行为唐仁卿父母双寿赋
344647,赋得残莺知夏浅
466730,画林泉高寄图并赋
1210367,再赋天池
931603,池亭夜赋
315309,望江南·兰成赋
556139,闻石屋彭君置生棺有感为赋四诗 其一
531107,赋得灵岩阁送余懋贤
521484,后二日有旨再赋律诗四首 其一
700032,庚子二月十七日上在姑孰游灵山无相庵时仆与汪朝宗都谏王思文理问俱侍行王赋绝句三首因次其韵
1098198,赵倅赋喜雪诗为黄堂颂黄堂和韵传示僚属众因续貂
1164978,感旧赋附歌
213032,还家夜同赵端行分韵赋
557098,白伯伦仪部移居夜阶助甫司封访之席上赋得卜居赤甲迁居新两见巫山楚水春十四韵 其七
493092,九月二十五日有传秋闱两榜至书舍见思永杨植以诗中乙科喜乡闾之有人学业之丕振因赋三绝以自释 其二
618247,同诸馆丈赋讯倪武双年兄病二首 其二
719344,席上谈及罗浮神蝶有赋 其一
447566,西湖与诸诗友同赋送春诗二首 其二
516052,荀麾使座上得报原谪镇远府通判高君量移青州府赋此为别
103764,赋石昌言家五题其二白石寒树屏
543508,惟寅以书贶驰使潞河适媵人偶举一子走笔赋答
1101844,赋风花 其二
361093,西子湖同马先生赋
656847,思亲堂为建昌王垣赋
993829,秋雨未已客怀不佳夜诵少陵遣兴诗至生涯能几何常在羁旅中三复增感每字赋一诗 其九
492938,题孙碧霄画四时小景为王存睿赋
459785,予至嗜草莓，积年所啖无算，而不曾为赋一首，彼亦将有昧恩之怨。昨醉中共肖山行，新莓始茁，快饱半蓬，稍解两年之馋。夜更以之佐酒，复大醉。今乃赋此 其一
459785,予至嗜草莓，积年所啖无算，而不曾为赋一首，彼亦将有昧恩之怨。昨醉中共肖山行，新莓始茁，快饱半蓬，稍解两年之馋。夜更以之佐酒，复大醉。今乃赋此 其一
1037495,赋江皋
402206,偶赋 江青
836000,金缕曲 读公度今别离四章，枨触千端，怅然赋此。
309280,醉翁操·坐飞车，御长风，泠然善也。词人前未有赋此者
1087772,岁晚燕集以梅花已判隔年开分韵赋诗得已字
451690,之杭州遇雨戏赋
612385,韩煦仲过镜园泛舟玩月先已共赋六言十绝复投赠八律步元韵奉酬 其二
415399,丁巳仲春返扬小游，慨赋八律 其八
1077838,叔易得水晶笔格赋诗见寄因次其韵顷与叔易奕而胜得其铜兽炉制度甚古携行常置几案间今此格宜以赠远与炉为伴故卒章及之
82846,新年书感·早岁西游赋子虚
259101,江城子·王温季自北都归过予三河坐中赋此
774755,客读陆放翁临川道中诗醉饱休相避堪羞甚乞墦语为谑浪语予曰不然是至理也是从处室章赵氏注昏夜乞哀白日骄人句申言之爰赋一律
288981,北郭园雅集，赋示郑幼香
429098,陶璞青将军专祠新成感赋
247217,高阳台·再赋绿阴
253458,赋桃花·江陵二月李花飞
234799,奉赋朱新父足庵
850293,过紫极宫感道士卓玘遗迹因赋诗以续诸公哀辞之后
956272,题宝林寺可赋轩
597065,枯椰先祖移居，植椰成林。经八十馀载，仅存其四。今秋忽枯二株，感而赋之
908329,岁庚午予过来凤驿观壁间碑刻火池事尝赋诗今岁甲午再过用前韵
650251,雪窝为翰林修撰苗衷赋
784633,丁酉秋张兰谷招游龙泉夜中得雨泉韵清佳因赋长句即谢兰谷
604529,恩诏赐复冠带县大夫雨中携酒赐贺赋此呈谢 其三
300650,赋被·锦绣合欢被
1004047,过房公湖临发广文载酒登南楼听隐士陈希逸弹琴读雁湖先生诗及悦斋先生赋
286121,分花漫赋·吾衰强了生前事
620972,美接兄从蜀中归知刺史五叔父宦况感赋二首 其一
1141689,韩君美经历赋孟夏木长五诗示仆因写鄙怀通呈阮使君
891034,诸公饮海棠下因赋韦陶体二首 其一
786656,瑞安李茂才叔諴相遇孤山寺，酷爱余诗文集；邀游雁宕，愿为东道主。余以远游历半载，方自会稽还，未得如愿；赋此为后游之券
646158,为圆上人赋雪洞
182116,读杜子美三大礼赋
1103115,游法华瑶阜蜃洞以糁径杨花铺白毡点溪荷叶叠青钱分韵余既有作复各赋古诗一以纪游事 其十四
851129,己卯十月一日至燕越五日罹狴犴有感而赋 其十二
250509,景秀兄侍父来京看病赋此以赠
250614,清泉兄生性好酒日前随编辑部迁至营口海滨予道海鲜正适合白酒兄言白酒太费戏赋此篇以寄
425857,归侨邱卫材先生赋易卦吟征题
860828,置酒登赋楼观月立夫有诗序别次韵
339249,赋赠·盈盈十五羡罗敷
930648,山行见三十年前题名怅然有赋
1083648,时晋亨作小轩块石盆池名曰趣远真隐居士赋之
1126823,次韵崔伯易席上所赋因以赠行二首
723463,诏问山中何所有赋诗以答
289554,鹭门旅兴·海上何人赋草薰
716329,赋得间柳发红桃
631377,纪梦诗成后再赋一章
755041,自先夫子薨逝后意不为诗冬窗检点遗稿卷中诗多唱和触目感怀结习难忘遂赋数字非敢有所怨聊记予生之不幸也兼示钊初两儿
1072662,次韵伍孺安赋草堂瑞香
385978,星斋再叠前韵送别赋谢
616258,鹪鹩园十七绝为黄与东赋 其十六 竹
463108,冬至餐桌戏赋
262245,浣溪沙·不信山林可赋闲
273846,浣溪沙·王母瑶池赋索居
1197014,皇太子宴玄圃宣猷堂有令赋诗
493049,净妙寺读李少鸿所书山门记过东院看百结花其枝皆纽结之而香气大异感赋二绝 其一
35722,赋得垣衣·漠漠复霏霏
946942,蒋实斋出示孟浩然画像因赋二绝 其二
714811,阳江道上逢卢子归自琼州赋赠 其四
214950,题端明苏子瞻书天庆观乳泉赋后
835458,瑞鹤仙 其二 赋得镫前细雨檐花落
485061,郊墅杂赋（十六首） 其十二
545189,千秋阁四首为司马汪公赋阁在千秋里中 其三
96756,赋诗凡·户户薪充纩
271594,貂裘换酒·庚子暮春，薄游约园，归后感赋
828822,木兰花慢    旧京移菊，憔悴可怜，感赋。
925945,贺新郎    其四 赋琵琶
1034287,二月十九日席上赋 其一
304460,归蜀感赋·醰醰二老爱王朱
887739,蕙兰芳引 林钟商，俗名歇指调赋藏一家吴郡王画兰
286430,赋此却寄·石路逶迤西涧西
1160103,客有为余话登天坛遇雨之状因以赋之
474054,臧晋叔希林阁赋得雨中钟山春望 其一
1135868,以读书破万卷下笔如有神为韵赋十诗送赵然然如大都 其二
509434,湖山旧隐为锡山钱津赋
1122179,都下赋归奉别天台金彦如惠子明沈新之马景昭赵寅仲并呈于晦仲时与寅仲以上诸兄初相识诸兄又约便道至王先生岁寒堂相会也
1223788,大廷策士问经世之道仆忝在读卷之列观诸进士所对有感赋此录以赠别刘性粹中支渭兴文举二贤良
842636,何粮储成浩以广雅丛书捐置鳌峰书院赋谢
377893,同赋·一霎催花骤雨来
1056013,元祐末宿秋试院曾和王敏父四诗是时以疾先出院方欲出而未得况味有类今日追用前韵再赋四首 其三
596776,城外旧居予大父方伯公所筑也虚存七十馀载兹复以居之感赋
1200732,长寿晏道人自号阜云，尝卖药游江湖，有道术，能致雷雨。岁旱，州官命祷雨有应。一日以画龙半轴徵予语，因赋长句云：
471113,和拟古九首从京师归以篇籍自娱有感辄赋（录三首） 其一
690463,李伯东方伯以西粤晋南囧卿过榕溪话别因用少司空陈公韵赋赠
1005666,赋水仙花
370875,玲珑四犯·恽正叔西湖汎月图为陈玉几赋
635911,秋日寓中宿华严精舍舍后有树名九里香花叶并茂李东园赋诗六章予至而和之亦触物写怀之意云尔 其六
1153939,赋得彭祖楼送杨德宗归徐州幕
152839,与张历阳追怀从禽之乐因赋
628184,人日作客那邕与主人王问溪赋共用东坡人日韵
612675,杏花十首为林子赋林子有美膢名杏者别嫁而懊思不已情见乎词而邓子和之 其七
856538,南乡子 其四 用韵赋杨花
448503,赋罢 其一
566166,东皋草堂为倪令赋一首
753190,过巢湖赋呈莱山侍郎
615507,吴孝廉光卿初至韩绪仲先生招同曾元鲁黎不回夜集分赋 其四
637081,澹斋为邻翁邓氏赋
835471,探芳讯 夏芝岑修饰定王台，每岁人日探梅，必有赋咏。癸未邀集，用草窗调应之
1099840,再和自赋
901953,余于今年二月初一日夜梦中与刘彦礼兄弟水边饮酒赋诗曾记所作元八句忘其馀今足成之
266633,金缕曲·读公度今别离四章，枨触千端，怅然赋此
414748,石少逸自沪来书戏赋一律寄奉
458280,得藏刀一柄，车中戏赋与静玄兄看
430640,沁园春 十月朔蓉君生朝，亚子赋沁园春吊之，嘱和
1052642,戊寅城上闲步因各赋诗
1070277,自仲嘉云亡未始见梦舟行夜入吴兴境有梦如平生感而赋诗四首 其三
834876,绮罗香 岚君以木樨、素心与菊花同插一瓶，索赋
967618,秋晚登眠牛冈偶赋
688878,赋别区象先观察出都二首
248261,暗香·赋淮安腊梅次姜夔韵
511700,望云思亲卷为史侍御赋
1007131,江城与秋岩同赋
1220494,彦脩秘监作亭阶前栽竹一个名一竿亭咸为赋诗
213228,沁园春·冰漕凿方泉宾客请以名斋邀赋
558376,聚爱楼四咏为克勤赋 其四
435923,亭同麻知几赋
973849,用一代不数人百年能几见为韵诗赋十章呈陈君举 其六
856247,用子蔺韵赋九日小酌
607223,公远抵家后以顾渚新茶寄惠且云其馨若兰用佐臭味之同也赋此答之
282666,徵招·闻子戴赁居余吴门老屋，赋此寄怀
426951,李培生来客榄溪访予病榻赋此赠之
909653,满江红 其四 甲午宜兴赋僧舍墨梅
1249516,至正壬寅二月廿一日雍虞岂临江宋□道士刘旻李文同登西峰之烟云台以登高望远为韵各赋四首 其四
1221529,脑月见白牡丹为吕仲善长司赋
1144232,贾节庵冒夏暑越修涂过我苕霅情谊甚厚令闻古式无思大节不可复见而骨肉消息访问难真相对殆感慨不能为怀青灯夜语诵少陵夜阑更秉烛相对如梦寐之句意甚惘然其归也儿曹以此为韵赋诗道别余亦作焉衰老拙恶姑写我怀且以卜后期云尔
295902,段合肥没期年矣过霞飞路故居感赋
690382,聚爱楼四咏为克勤赋
1003061,同戴石屏十人重游分韵得凿字即席赋
569104,吴子故泰伯之后思追至德自名曰守让而别号吴荆余为赋之
846704,摸鱼儿 紫云山房拟赋莼
1137609,贾节庵冒夏暑越修涂过我苕霅情谊甚厚令闻古式无思大节不可复见而骨肉消息访问难真相对殆感慨不能为怀青灯夜语诵少陵夜阑更秉烛相对如梦寐之句意甚惘然其归也儿曹以此为韵赋诗道别余亦作焉衰老拙恶姑写我怀且以卜后期云尔 其九
790865,予历年避暑祠中，每邀荪湄小住，披襟岸帻相对怡情。今夏移榻来祠而荪湄去秋作古矣，怅赋此诗八首 其一
566817,过陈守经留饭海棠树下赋得夜雨剪春韭
1110471,利见置酒燕超轩袭明赋诗次韵二首
963973,春风堂左偏郑宣抚诗刻犹存程季允次韵亦赋
539126,田子秇以诸生异等贡游两都署册曰南北大观赋此赠之
1089575,喜闻转庵新结暖阁因赋
1083264,赋王伯温家酴醾
796637,南乡子 四首，赋得瘦竹如幽人，秋花如处女 其二
