1034244,浣川定海奉饯乐成郭明府年兄赴改官班赵振文司令首赋古体因辄有述
1073652,兴化朱公大卿没于庚申岁既除丧矣其子彦寔过余于晋陵留十日而别赋二小诗以饯之 其二
677289,次慧法师山居诗韵同忭中上人李九仙张尔完赋 其二
867106,锦园春三犯/锦园春 其一 赋牡丹
43441,哀羊裘为孙八赋
544802,大司空潘公寄示河渠诸刻卒业赋此奉赠
231910,天游以前韵赋雪诗走笔和
271862,松尾翁招饮西京左阿弥家即席赋谢
844019,十六日陪刘漳州溎煜登大顶峰观日因话旧游感赋二首即送其监税泉州
1060631,因读梅圣俞六鹤诗或令余别赋之 啄食
820728,台城路 忏庵寄示秦淮闻歌词赋此报之
517404,菊逸为三衢金山人赋 其四
697006,病卧原口长公以诗见存遂有起色赋谢四章
550058,瓶花影与仲诏同赋 其二
688073,遭诬得罪赋此以见志
418309,志俊于劳山佛耳崖置别业蓺蔬种树有归隐之志乙亥秋招同伯明螴弟往游赋赠主人
1095931,卢蒲江雪夜约同直省中出示采菊读书煎茶种橘四诗索危秘书诸名胜同赋 其一
605006,乙丑春二月二十有四日邑侯裒谷孙公有事罗浮同社诸君子偕集江上小堂举酒相贺夫劝课农桑巡行阡陌辟草莱以正疆界蒐伏慝而饬干掫此循良实政开邑以来二百五十馀年所未有也遂相与绘图授简侈为诗歌以副野史公复取道于先司徒东皋别业驻辔于先仲第□子二石山房盖有谋野则获之思焉萱乃携子及孙炊脱粟酾茅柴以窥马足公辄欣然班荆移阴而别时余以目眚不能从公于迈为四百三十二君归石候命第以一日之长狎主齐盟敢不悉索敝赋窃附中和乐职之谊遂鼓腹
8799,江陵节度阳城郡王新楼成王请严侍御判官赋七字句同作
989305,赋陈嘉谟东西轩二首 其一
721147,酌罢过二百堂挑灯坐漏已下戏再赋
950707,予归未省松楸将以初秋望前汎湖之龙门已戒舟舰而连夕雨作不见月因赋天问二章 其二
517271,道中见弋人有感而赋
1140829,雪居为安上人赋
963543,龙州麸金丹砂到官后民告所得倍于他时喜为赋诗
558607,二月八日予生辰也喜浙江左大参桂坡先生至绝不饮酒茶话甚适赋此以识 其一
670069,九日集殿卿池亭分赋 其一
677727,赋得函谷关送贾一
843302,城头望夕阳西没感赋
711158,偶赋四首 其三
370797,梦谢对越赋寄
557102,白伯伦仪部移居夜阶助甫司封访之席上赋得卜居赤甲迁居新两见巫山楚水春十四韵 其十一
671346,忆母遂病三上疏求归不允却赋十诗 其五
74701,南村杂赋
389582,赵伯母张太夫人成主之期赋诗三章
726837,赋得风生翠竹里应教诗
457966,每大醉间寻肖、卢，赋赠
400347,戴密微教授赴日，临行贻书，谓唯汉土之人最知山水，以余将有Alpes之游也。深感其意，赋诗却寄，兼简京都故人。用大谢送孔令韵
973371,教授以忆梅韵赋雪诗蕃同之五首 其五
385838,岱孙春闱幸捷供职西曹，赋此寄勖
652081,晚翠轩为杨大参赋
1133323,予久客思归以秋光都似宦情薄山色不如归意浓为韵言志约金溧诸友共赋寄钱唐亲旧 其十二
822376,长亭怨慢 夏日赋邛池柳
868055,赋洞霄宫隐居十年后
554365,胡学士卧病赋简二首 其一
937599,沁园春 其二十八 赋月潭主人荷花障
483888,赋得明月楼赠孙伯融
322517,赋得落日楼台一笛风
972749,李通判休日约僚属追凉于净因已复酌于芙蕖馆既题名于寺之壁为赋唐律
588556,崇德楼怀古八首为彭城马子津赋 其二
207473,为僧如赋深居
974408,曾季明经过相见闻寿冈先生挂冠之报且承动静因其归赋古句寄呈用坡谷赠王庆源韵
684038,耿大夫入为司徒领太仓事时余方上书乞骸赋此赠别
139801,中秋有赋·望舒与日元非敌
1066912,友卿弟见和复赋二首 其一
1225004,听雨堂为周叔量赋
763987,潇湘逢故人慢 为阮亭赋余氏女子绣柳毅传书图
808205,瑞鹤仙  赋圣几斋中牡丹名藕丝霓裳种来自亳州
1208518,至元三年六月八日史局作休从伯京御史公亮太监伯温秘卿伯循待制暂至城西秘卿待制别去伯京归家予遂偕公亮回憩都水监双清亭监掾平伯钦留饮即席赋五言十八韵
259452,赋侯相公云溪
1253226,赋得秦淮夜月送友人往茶陵
726351,赋得临水诗
1146019,冬日宴群公于宅各赋一字得杯
1147213,赋得石梁泉送崔逵
553092,赋鹤瓢杯用方参政韵
222523,回郑家桥小酌复以临清流而赋诗为韵得流字
1079359,席大光邀同赋墨梅花 其一
345526,韵赋十诗·我心不可规
1239598,游览杂赋 其三
444217,儿童节 六一儿童节醉卧，忆放翁“梦里都忘困晚途”之句，感赋三首 其三
957556,同安诞日赋小诗祝延
776651,赋示诸将 其三
331585,道阳朔山·赋诗曾送谪仙人
1001434,谭贺州勉赋水仙花四绝 其四
623406,赋得陶渊明无钱对菊花
822437,望海潮 蜀都赋
818232,游白云归，感赋四律，并柬同游诸子
411457,武汉铁桥落成，赋此致贺 其二
721556,代州夏日冯方伯招饮故大司马白谷孙公园亭即席赋
697341,余既赋瞻堂十景矣而意有未尽复三绝句写之 古柏
572372,灯下观菊花影同社中诸友赋 其三
161562,赋梅·岂无和靖诗
550402,赋得华林暮雪
227473,范宰见寄游草堂谁谓渔盐市之什辄同赋一篇
913809,德远叔坐上赋肴核八首 其一 糟蟹
790839,闻人述赵展如中丞事感赋二首 其一
1251141,巢云为萧伯玙赋 其二
1114593,景伯正字招东郊观梅晚集茶院秀远堂举之舍弟有诗景伯和章见简同赋
660877,庚戌春赴南雍省侍秋半乃还颇有赋咏而亡其稿追忆仅得此下十章 其七 过清溪
493180,夜宿丈溪道院喜赋和呈萧同知孙经历
559159,戊申贱辰辱父执陈薛谢三先生并持觞至三先生二百四十岁酒力步履如常人老父喜三先生来病辄起留款三日乃游凤凰台登舟别小子漫赋四绝为谢 其二
619569,将游西樵舟中与李太史诸公赋 其二
684780,赋得别梦依依到谢家八首
275809,宿刘家园子苏孝廉懋斿过话是夕有兵信且值雷雨大作与懋斿同赋
162940,临江仙·和叶仲洽赋羊桃
714810,阳江道上逢卢子归自琼州赋赠 其三
756196,雨窗感赋
955741,再赋末利二绝 其一
1029199,食后过竹堂风雨遽作赋所见
337180,湖上杂赋·山边骑马醉王孙
1149872,赋得临江迟来客
419910,月下笛 久不闻杨致存信，昨来书讯近况，兼问同人，赋此代柬
1034598,八月十四日夜约客月下有赋
430084,夜饮鉴园月色甚美归途感赋 其一
227468,陪范明府与诸同官饮新亭是夕以莞尔榜之因赋
802975,夜合花 七夕前二夕遣伻返锡感赋
419579,玉楼春 匑翁下世百日矣，小窗风雨中赋词追悼
773168,赋得书三味得三字七排
314617,再赋·一日能当二十年
118167,将之绩溪梦中赋泊舟野步
737127,重过韬光禅舍与松岳上人话旧出示书画册子即赋长句再题
750646,野人送菜感赋
635037,喜陆孝山太守重游丹霞赋赠
1220311,赋渊明归来图送致仕者
813522,盂鼎铭拓本为伯寅侍郎赋
1249580,读黄危二阁老送何彦正归省诗序追赋一首
781066,忆癸酉春夏与奉峨兄读书于城南之保安寺甚自得也时有秦先生者山东快士喜堪舆精占卜聚谈者屡遂订交焉今日各有所就而风流云散如此追感不胜惘惘因赋绝句九首呈奉峨兄 其六
498569,阿姚之归凡同心皆为予喜而向来知其事者端己韬仲叔也于其来贺赋谢一章
11281,张评事涉秦居士系见访郡斋即同赋中字
936061,夜赋
827970,谒节庵师不遇感赋一首
459882,金农诗云：“故人笑比中庭树，一日秋风一日疏。”似指故人物故。予虽无此，而故人日散，殆亦相类。赋此首
654998,篁墩为程克勤赋
215100,赵同叔开轩植竹以自娱乐诸公虽为赋诗而未尝
1159001,冬日宴于庶子宅各赋一字得鲜
890005,鱼游春水 神泉春日赋
851131,己卯十月一日至燕越五日罹狴犴有感而赋 其十七
297987,自澳返穗止于友家感怆万端援笔赋此
649547,五月八日史馆困睡梦侍献陵顾问虏事觉而感赋
401149,岁尾年头有以诗词不见惠者赋谢
1123966,知府提举访求前守凌公遗迹忽于庭庑雨压复壁中得公所题诗赋六绝句
418886,风入松 次箫赋《水龙吟》题余词集，语多溢美，赋此所以报也
418886,风入松 次箫赋《水龙吟》题余词集，语多溢美，赋此所以报也
534099,竹在亭四绝为贞吉赋 其三
1092123,董铢求诗赋古风二章示之 其二
813689,自庚寅1830洎庚午1870四十一年惟今岁闰十月两度生辰适寓北郭园感赋
645912,山泽居为徐端蒙赋
492158,冬日同诸友访萧国录登西楼复会宿山房分韵得连字因怀往昔夜过监学访萧国录会宋学士周员外诸公赋诗旧事明日赋柬鹏南伯仲并分韵诸作者
492158,冬日同诸友访萧国录登西楼复会宿山房分韵得连字因怀往昔夜过监学访萧国录会宋学士周员外诸公赋诗旧事明日赋柬鹏南伯仲并分韵诸作者
832989,虞美人 八月十四夕，同吴瞿庵赋
43865,驻军大定与苗胞欢聚即席赋诗
809849,赋得梅候宫中树
1144079,过芙蓉岭对镜岭羊斗岭新岭塔岭赋短歌五首
545278,董使君过访赋赠二首 其一
345525,韵赋十诗·宝元乃多故
500765,三月三十日费安中山长告别走赋六首 其四 寄金仲宣
848682,再赋
789656,夏五过弟黍谷中丞别业赋赠 其一
795925,临江仙 清明前二日，买舟扫祭，即事感赋
331790,汉宫春·客园晚集，即席赋呈钱龙门先生
493316,重游里良感赋
442115,秋夜岑寂无聊忽忆是日乃余之生朝因赋
1001564,庆元六年七月至儋耳问前守之政改元四年罢归八月过封川谒谭史君乃前守也用赋二长韵呈似 其二
617215,兄汝载曾赋贪泉诗二首书于曲江张先生祠十年矣余因之官度岭谒而见焉遂感而和之 其一
1100054,寿溪刘岩傅唐御史之裔乃翁国学前一辈同舍也筑新居名曰西村以此求扁为赋二韵 其一
729787,鹧鸪天  王幼霞御史得其友人由江南拓寄江总残碑，因作秋窗忆远图，属题，为赋此阕
885003,尤溪县之南李花千树无一杂木春时尝饮其中酒家小轩可爱不知何故不曾作诗追赋二首明年修故事当书之壁间 其一
493177,题林下高士图为王存常赋
62751,赋得眠鬟压落花
709471,夏日承本师天然和上属阿字持书沈阳诗扇寄示赋此奉答兼怀阿公
482187,誓师毕随驾回营中马上赋
746193,残腊积冻连旬癸丑元朝倏尔开霁喜赋
498830,衡守蔡白石月夜见过赋此别之
330452,徐元美甲第新修同诸公赋诗
774637,东征逾载整棹言归巡使黄玉圃先生索台湾近咏知其留心海国志在经纶非徒广览土风娱词翰已也赋此奉教 其三
867687,翟簿示似中秋高作命意着语殆与商素争清读至人与月忘年之句不觉击节借五言为韵赋诗答谢 其四
892217,出城所见赋五题 其三
1001952,过南安接孟使君辞警策多矣复承遣诗追惠遂足度岭所赋梅还谢万一
611253,余濒行金陵诸词客分赋都下名胜兼傅之丹青壮我行色舟中无事披册展读忽然技痒赋寄酬之共得二十八景诗如其数 其二十八 玄武湖
611253,余濒行金陵诸词客分赋都下名胜兼傅之丹青壮我行色舟中无事披册展读忽然技痒赋寄酬之共得二十八景诗如其数 其二十八 玄武湖
743120,沛翁以樽酒见惠赋谢
297567,爰赋五律·最难风雅主
1098940,戊辰春二月雪吕君国秀曾赋七字句予和云试来月下逢仙子何似风前聘宓妃乙酉春二月一日雪再吟二首 其二
784315,冷子示关中友人赠诗且索予作赋此以赠
417511,高阳台　吴伯之方静怡伉俪招饮，即席赋
351749,龟龄侍御以番阳士子之意作五峰亭且赋诗某敬和
727020,赋得咏风诗
86678,初秋感事·跌荡当年赋两京
52848,赋得无诸城送浦舍人源归晋阳
973541,蕃来湖州连与叔骥和叔明父叔宝相从又从和叔获见先给事遗墨辄赋二首 其二
526485,西坡为程正夫赋
1108035,舟过吴江谒臞庵翁少留为赋二诗
828042,九月以事至天津季湘苕雪治芗子安楚生八兄寥志二弟皆自京来会适逢九日就市楼小饮即别去途中感赋二首 其二
987840,秋气凛然庭木将坠道谦上人有南征之役赋诗祖行
1244141,明妃曲与宜春龙旂馀杭吴植真定魏岩分题并赋
544865,陈玉叔书来赋答
521392,再赋
222831,赋竹间禽·晴哢连林春翕翕
503857,赋得云梦泽黄鹤楼送李圣瑞之湖广 其二
81841,偶赋·湖上蜗庐仅自容
590569,樟树取道浏阳遇聂凤冈惠酒赋此谢之
1026674,拟杜子美体赋夏日閒居三章 其二
831997,闻槐庭东游，赋此寄赠 其一
788044,御赐樱桃恭赋
265845,和杨九缉曦楼感赋诗
616211,冬夜伍国开有开同诸从过宿小楼以酒态美如嵇叔夜诗才清似沈休文为韵赋十四绝 其一
603897,座上分赋得佳人雪藕丝
286296,再赋哀雁·故雄失，故雄惊
1202824,好事近 赋庭下新开梨花
531871,桂之树行为李宫谕寿母赋
661429,舒啸亭为东林山陈氏赋
1251292,次荔支韵赋 其四
598605,弼唐兄食不重肉乃东西远游无宁岁感而赋此寓忠告之意
1035289,浪淘沙令 其一 刘左史光祖之生正月十日李夫人之生以十九日赋两词寄之
680625,舟中遇同年吴圯宪副往洮泯兵备问余彼中风俗赋此答之
421998,北郭园雅集，赋示郑幼香
481183,题袯襫轩为夏叔敏赋
452082,仰翁以耄耋之龄相陪自宜春至丰城再到南昌始还途中更以诗见赠感愧之馀赋此作答
839835,消寒五集曹远老命题拈得清字儗循旧例赋诗分赠二十三首 其九 赠塍粟表叔祖
412613,初三日岩前司晓发望黄峰感赋
419446,贺新郎 用张仲宗寄李伯纪丞相韵赋呈不匮，兼示大厂。更端以进，亦无聊之极思也
1147224,酬李侍御萼题看心道场赋以眉毛肠心牙等五字
515117,筑居郡城山麓经始之日正值立春漫赋二绝 其一
149386,秋思堙郁忽蒙圆机宠示祟赋欣然开豁为惠大矣
797378,满江红 韵玉六妹赴陕，赋此送别
597324,溪南书屋成却赋
150385,赋莲城堂·此是吾邦别洞天
92427,赋梅花·对酒初惊发半华
512181,舟回采石夜泊谪仙楼下值雨弗果登楼用赋一诗以吊
503856,赋得云梦泽黄鹤楼送李圣瑞之湖广 其一
569846,卓澄甫光禄邀汪司马及仲季诸社友大会西湖南屏选伎征声分韵赋诗伯玉以高字韵见寄俾余同作得二首 其一
1001639,龟山之孙杨子顺肇庆一见相投随至德庆谋馆寓迹过从年馀辞归乡赋诗送行 其二
326999,观黄德美延平春望两图为赋
305,冬日宴于庶子宅各赋一字得鲜
1220524,关西道士求赋雪巢
488957,赋玉笥山赠长史入京
1235572,寄衰翁东宫典宝监知事史仲文赴京之任赋诗二首为饯
375180,雨后山水入潮江方岩索赋
50181,有怀淬用刚赋此以寄
689338,午日分赋得桃印符
1153544,赋得岸花临水发
550062,八月十一夜与介孺看月成醉共赋十四盐 其一
599032,上元曲李子藩席上赋 其一
541314,藩伯徐公子与饯别省中赋得轩字同席顾季狂郭建初
873005,赋梅下小池
697235,徐参知总角与余游中间显晦殊途不相闻问者廿载兹邂逅淮甸特邀余为具署中清灯话旧不胜今昔之感即席载赋二律时参知以青雀见假由此竟达燕中矣
509719,扶南访黄岩尹邝载道适来顾白沙两不值赋三侧韵 其三
1169089,赋戚夫人楚舞歌
750569,南钱杂赋
638279,竹间偶赋
799101,八声甘州 子大丈属效湘社集体赋六忆词 其一 来
615336,卢一清韩孟郁李烟客诸子过访村居同赋
287647,蝶庵来书云蒙恩改正，赋七律答之
381648,陈雨生孝廉属赋其子妇殉节事
544058,王长公寄惠集序赋谢四首 其三
1179521,赋得沽美玉
415393,丁巳仲春返扬小游，慨赋八律 其二
28080,小桂·讽赋轻八植
826007,星浦大和旅馆赋盆花
323300,主簿程同年和永平门诗再赋四绝因以赠别
950672,二十七日复有旨除帅江西一旬之间两奉除音再赋二首 其一
267746,鹧鸪天·高啸桐病中索赋
468057,梦江南 小薇师养病于市八医院，赋此以慰
294507,冯逆犯阙，缶老来书云：聋有所闻，歌以代哭，赋此答之
542492,吴子乔有弟从方士数年不归因访于梁宋间赋此以赠
237452,韵赋小书·月照窗炯炯
608309,高正甫出守袁州九月九日予偕家兄暨诸亲友能文者十九人饯之毗卢阁赋诗为别 其二
360774,知县沈奉议所至榜双清于书室诸公篇咏甚多猥以见属辄赋四韵
925607,八声甘州 夜读李广传，不能寐。因念晁楚老、杨民瞻约同居山间，戏用李广事赋以寄之
324573,从叔君冕见访山间自云平生躬耕钓无求于人中有至乐令某作诗写其萧散之状为赋此篇
724126,赋贫民田诗
923334,与蒙城知县陈著作同赋吐绶鸟
143724,被旨祈祷数至天竺珪僧录法语白云堂诗为赋唐
949459,赋介轩半村新居
421200,满江红 过镇南关见施琅纪功坊已毁，感赋
928754,杂赋十二首 其八
1242651,碧梧轩，为贾彦仁、彦德二贡士赋
602994,欧雷二子往游西粤见过宿别赋赠二首 其二
104037,赋永叔家白鹦鹉杂言
664840,去年二月九日与德充德一二弟洎子栗过此各赋小诗十馀首今日杏花开二弟复至悟省旧作有待得函关公事了年年沉醉杏花天及年年花发年年醉更乞天公六万场之句因次原韵再赋十首 其二
664840,去年二月九日与德充德一二弟洎子栗过此各赋小诗十馀首今日杏花开二弟复至悟省旧作有待得函关公事了年年沉醉杏花天及年年花发年年醉更乞天公六万场之句因次原韵再赋十首 其二
316175,三姝媚·偕春渠、小梅、子健太湖看梅赋
342083,再赋·解褐方闻上玉除
150915,遂再赋·省口须知亦省缘
616249,鹪鹩园十七绝为黄与东赋 其七 北窗
618751,履端二日赋十绝句 其八
623704,傅贞甫枉过村居有作赋答二首 其一
69699,题跋月山公九马图手卷为任伯温赋
698914,嘉靖辛丑之夏妇翁潘公即阳江官舍将令予合婚其乡刘寺丞公代为之媒先以三绝见遗后六年而细子弃帷又三年闻刘公亦谢世癸丑冬徙书室检旧札见之不胜悽惋因赋五首
95768,绝句·已载相如赋
619178,邓虚舟社长饯余北上即席赋呈
327304,敬夫用熹定王台韵赋诗因复次韵
880449,种玉亭为黄元信赋
1068227,予夏中卧病起已见落叶因取渊明诗门庭多落叶慨然知已秋赋十章遣兴 其四
327802,楸村送蘋果赋谢
525061,卜得彭城乐丘漫赋用鲁南韵
964828,吴潘二台官以直言左迁董夕郎亦以荐贤之故相继翩然而去公论惜之三学叩阍来归刘声伯感而赋诗因次其韵 其二
261521,漫赋·贫知囊底一钱无
493050,净妙寺读李少鸿所书山门记过东院看百结花其枝皆纽结之而香气大异感赋二绝 其二
384904,五十初度赋怀
952596,台州郡治十二诗太守尤延之命赋 其十二 节爱堂
753990,读王孟诗偶赋
207812,赋唐律·错落珠玑满袖倾
1252020,日峰歌为升居士赋
614060,偶过钟禹铸园馆有赋
402950,醉翁操 坐飞车，御长风，泠然善也。词人前未有赋此者
307146,感怀诗·如此人间赋卜居
559730,孝友堂为王评事友人赋
182525,赋永宁严老幻庵
1003847,挟文薛君自赋五首克己读书安贫择交训子为题戒其子婿王叔俨万里索和 其四
956921,伏闻知府秘书欲取小杜桐庐诗语以见花名堂成大记东坡送郑户曹诗云荡荡清河壖黄楼我所开迟君为坐客新诗出琼瑰楼成君已去人事固多乖此段大类今日成大行且受代计梅开堂成归舟已下南浦欲为坐客不可得怀不能已请先为公赋之
1109569,重葺前堂榜曰学易景亮六丈宠惠新诗谨赋二诗上谢
1225386,仙山图为赵彦昭赋
772211,四十初度感赋
269038,陈迂谷中翰维英移居狮子岩斋额曰栖野巢赋此赠之
96623,赋雪诗蕃同之·剩有骑驴兴
940754,赋梅堂闲吟 其九
655593,同孙脩撰曰恭赋诗留石源黄宅
61367,同孔加淳父诸君集时济山斋分赋得主人林馆秋
694843,白伯伦仪部移居夜阶助甫司封访之席上赋得卜居赤甲迁居新两见巫山楚水春十四韵
1090404,中秋前一日风雨大作林子长辄动归兴赋二绝因次其韵 其二
561045,常甫宪副钦之翰检与予先后登岳钦之独值雨是日予与常甫坐候云开堂因赋二章 其二
545449,王行父入都以鹅飵糟鲥葛簟等物见饷赋此
931802,舟中夜赋
1029113,赋雪 其一
577549,春晖堂为指挥王敏赋
605176,戊辰七十有一境内外诸名硕皆以佳章见寿赋此奉谢四首 其一
663345,寄弟赋 其一
560260,题小景为邢编脩克敬赋
447627,蝶恋花 芳草邀游璧山青杠，夜半酒酣，狂歌醉舞，真所谓不知老之将至也，即兴赋此
442850,瀛园诗社成立十年有赋
1090296,次韵常之用前人韵赋梅花十绝 其一
1089340,再次大用韵赋梅花
742300,下第后侍家大人归里彡石叔有感赋二律即次原韵 其一
545698,章纳言宗理有事诸陵拉余同谒归赋七言四章 其四
1242559,东圃诗，为道士王景丹赋
961579,赋张舍人抱啸堂五首 其三
1003512,工侍国史李丈奉御香祷雪上竺前一夕雪瑞已应道间志喜成诗以示敬借韵同赋 其六
402915,南浦 将去燕台，赋此留别
542198,宋伯镇招饮署中赋得长字
518140,暇日同郑以孝游定光庵坐志喜亭上以池清龟出曝松暝鹤飞回为韵各赋十首用纪一时之清兴云 其六
521323,东海先生有表弟褚君跛一足先生呼为鹧鸪叟输赋入京求此诗
273252,琼宜女侄和余夜楼居四律赋此励之
1006241,酹江月/念奴娇 其四 次韵东坡赋别
426168,端阳感赋
925972,浪淘沙令 其二 赋虞美人草
1076469,祁居之作亭山间名之以宜谓四时之皆宜也其后寓安有亭未名居之使榜以似宜寓安虽从之而其诗乃有未必输公之语气似未平也寓安欲余赋诗因为解纷且以见二公相忘之意
683071,斋前小山秽翳久矣家兄召工治之剪薙一新殊觉秀爽晚晴独坐诵王临川扫石出古色洗松纳空光之句因以为韵赋小诗十首
42957,汴梁城内有李师师巷经过感赋
581743,夜饮李黄门第以技马较胜负约五负者罚诗一首予数负赋此呈同饮诸公
969800,康不领此诗又有许梅谷者仍求再赋长律
44327,舟过刘庄感赋
612247,天旌节孝册为新会梁文学母陈太君赋二首 其二
1102466,羁燕四十馀日归兴殊切口占赋归 其四
622075,修邑志成有不察而斋怒者乃得谤又以有所誉来也感而赋之四首 其一
1128500,伯父致政通直取谢灵运诗句作萧散堂赋诗次和寄二首
701592,宫桑闻北郊亲蚕赋
637318,坐中获睹诸生所作文赋因赠以诗
62423,萧子卜居梅林赋赠
617278,杪秋萧雁宕丈招饮学中即席赋 其一
906401,暇日约诸友生饭于石泉以讲居贫之策枢密富丈欣然肯顾宾至者七人次方德顺和贫士韵人赋一章 其二 尧翁
1100703,赋元秀坐主孤峰
431675,闻日寇攻陷皖城，愤而赋此
404590,鹧鸪天·友人赴哈尔滨出席红楼梦学会，临行以临江仙词见示，赋此赠之
597132,盆梅忽抽长故寻许始华喜而赋之
1253163,次荔支韵赋
791222,善化令盛朴人司马赓，元宵张灯，招饮赋谢
797193,传言玉女 计蕊仙赠所画团扇，赋谢。
775768,壬辰1832春捧檄来澎随同芸皋观察查办抚恤蒙赐书画联扇赋诗申谢 其二
1242605,宴犒将士，酒酣，命健儿舞剑为乐，浙省平章泣下不禁，感事有赋
592817,人日同仲贞赋
248876,《当代诗词》二十初度感赋
635498,郑珠江太史特授给谏拜命日诗札见寄赋答一章遥致相期之意
790854,十月初十与家人话梁园旧事感赋二首 其一
810104,三姝媚  秋晚新晴，买舟黄步，时闻易五中实卧病惠山，便一寻问，用梦窗韵赋此。
1001436,谭贺州勉赋水仙花四绝 其二
843240,宽孙世讲画梅得自庭训顷将南游手书画便面为别赋谢即以赠行 其二
438678,赋伯玉透光镜
616158,七夕何龙友马伯起过集分赋 其一
187784,夜梦续句·大化赋群有
1074761,钱申仲大夫索四亭诗各赋一首 遂初亭
627416,客中九日同泰弟赋
329847,归成都·欲赋长谣赠别君
531205,绿竹亭为李前渠赋 其二
611051,赋得春风芳草篇送比部梁卓卿转饷边镇便道归粤东
925907,柳梢青 赋牡丹
873621,分韵赋古松得青字
86766,读汤伯纪大人赋
1098215,方岩山有仙人田项宜父家其下于屋之西偏筑亭疏沼杂莳花木为娱奉寿母之地即以名之自著怀仙杂咏百有一首名胜留题亦多未免皆泥乎神仙之说来徵余吟余谓神仙之事深言之则似诞今诸贤所赋无复馀蕴使余更下注脚不愈诞乎且人生一世苟能超然达观惟适之安斯人中之仙已岂必十洲三岛间之谓哉因即此意赋十章 其七
1098215,方岩山有仙人田项宜父家其下于屋之西偏筑亭疏沼杂莳花木为娱奉寿母之地即以名之自著怀仙杂咏百有一首名胜留题亦多未免皆泥乎神仙之说来徵余吟余谓神仙之事深言之则似诞今诸贤所赋无复馀蕴使余更下注脚不愈诞乎且人生一世苟能超然达观惟适之安斯人中之仙已岂必十洲三岛间之谓哉因即此意赋十章 其七
124903,代赋后苑赏花钓鱼
178075,雪霁霜晴独寻山迳菊花犹盛感而赋诗
186445,赋遗经阁·生世岂云晚
763589,满江红 其十五 忆西樵湖上兼寄阮亭同展成既庭赋
768232,南浦 春水用玉田词韵同融谷赋
368938,齐天乐·三弟寄椒珠并蜀笺数种赋此二阕示之
