46650,赋得真娘墓送蟾上人之虎丘
1089222,石惠叔以石斛为贶因笔赋诗
743117,访钱箨石阁学留坐四照楼却赋一律即呈箨石
571800,严子陵滩限韵同陶石篑方子公赋 其三
1145643,赋得镜诗
55351,游览杂赋·别后不见山
554944,筹亭为高都宪赋
819963,乙亥秋九月至旧京视散原先生日与心畬叔明立之伯夔君任羹梅过从寥志强志贻先询先诸弟自津沪来旧藏五十馀年陈酒由杭至京连日聚饮赋诗属和 其三
1088505,游石马以驾言出游分韵赋诗得出字
669138,赋得梦中携宝剑
559611,五月四日奉邀贺父母同蒋四公小集文昌阁并循河观舟即事漫赋用谭孝廉壁间韵
1166191,三月三日诏宴定昆池宫庄赋得筵字
1077705,去岁道巴陵登岳阳楼以望洞庭真天下之壮观也因诵孟浩然气蒸云梦泽波撼岳阳城之句追古今绝唱用以为韵赋诗十篇 其四
930451,十五日云阴凉尤甚再赋长句
305478,四月七日独游稷园将观芍药忽睹牡丹名豆绿者独盛开再用前均赋之
905996,再用粹中韵各赋牡丹梅花 其一
892121,漱玉斋前杂卉皆龙图王至之所植各赋一章凡得八物或赏或否亦应乎至之意欤遂写寄至之 其八 芭蕉
333031,江南好·与香雪花下谈少年春秋佳日为赋此解
235248,题国直先伯祖海潮赋后
633372,广陵感赋
276241,壬戌仲秋有鹤自西北来集予舍，为赋来鹤篇
546439,喻邦相即署中建楼题曰信美索诗为赋四绝 其一
737318,得邵甘来中州信感赋
1029233,予从元德弟借到西廊书斋朝夕其间今二年矣戏题作病僧寮且赋三绝 其一
544400,张博士过访赋赠二首 其二
433384,为畹华饯别后再赋二律题缀玉轩话别图
946943,蒋实斋出示孟浩然画像因赋二绝 其一
402914,龙山会 卓君庸营精舍玉泉山下，榜曰自青榭。属赋
1251122,过清远县爱其山水追赋赵佗刘汉墓
826774,一枝春·彭刚直公红梅画幅，为遣嫁孙女于俞氏所作，孙婿陛云移付其女夫郭则沄藏之，为赋此解
840062,林素园居士以诗僧见称却赋
900363,十三日晨起霜晴用定王台韵赋此
697086,同王行父管建初汪公干谢彦云集区太史馆即景分赋余得盆中紫茄
1205821,朱仲文编修还江西诸公分题赋诗为饯予适同载南归约至扬子桥分别因为赋此
1205821,朱仲文编修还江西诸公分题赋诗为饯予适同载南归约至扬子桥分别因为赋此
146303,有感而赋·浩劫风尘暗
278370,飞雪满群山·得陈大向手书，存问殷拳，感赋
606609,宋文学自以忧郁不乐远游适志赋此别之
844295,颂臣谢丈留须，余戏赠两绝，有『长须国里如求婿，跨凤乘龙属此髯』之句，后余弟烈堂果赠一姬，喜拙诗竟成佳谶，因次前韵，再赋二章，以博妆台双笑
1141803,赋宋文璧伯牙禅
51756,鹦鹅赋·陇西千里向平原
483502,摘涧上似橘者于上山之时然酸苦不可食有感于中下山重逢复摘之以玩因赋
739294,松吹书堂歌为杭堇浦赋
807835,贺新郎  季沧苇侍御广陵纳姬为赋花烛词
292400,浪淘沙·壬子九月暂归武昌，赋寄内子上海
1159003,赋得春莺送友人
950725,四月二十日被以郡事入奏之命再赋二首 其二
1138805,无文上人舍财鸠工建新安桥普济众生闻者赞叹随喜赋诗一首
716758,初至汉阳赋赠王别驾
1026149,再赋颂二首 其一
532399,丙申岁腊访甥杨继宗子熙春读书山中宿留赋此 其二
1251530,题郝陵川琼花赋后
925026,赋园中所有十首 其七 果裸
353965,赤鉴客馆以清陂名堂赋诗
229926,萧五监丞新作堂成名曰知雄且赋彫章题之屋壁
828058,法相寺中老樟一株双干皆大十围其本殆不可量不知何代物也散原老人属同赋之
1145905,赋得临池竹
71065,浣溪沙·广陵席上赋别
454813,读罗家宝《艺海沉浮六十年》感赋 其二
1181064,赋得长洲苑送李惠
428051,木兰花慢 傅抱石以一九六五年九月廿九日午后一时零七分逝世南京，赋此志悼
567504,赋得紫骝马送子荩春北上次前韵
158210,同杨公济赋破山得开字
681413,周评事母墓有横塘烟霭之景邀余赋
1232166,予少年过蓟门酒楼赋此题曰连十八书郡人疑其为吕洞宾作也谩记于此
1183052,齐郎中筵赋得的的帆向浦留别
1220864,客有赋大军来者戏答 其二
636595,长至日晤宪公胡子树于崧台署中赋此
811683,赋得帐殿郁崔嵬
489034,见圣堂感赋
1116907,开府潞公太师得谢西归谨赋七言四韵诗五首拜送
1154299,赋洞庭
1954,修书院学士奉敕宴梁王宅赋得树字
283288,南浦·师曾同赋前题，叠韵荅之
376977,齐天乐·董竹沙亡兄苔石，尝寓焦山松寮阁，竹沙追赋焦山夜话诗
400197,渡江云 西园重过，被酒有赋
594974,定安四景为宗伯王公赋 其二 金鸡春晓
431830,稚晖先生偕张议长溥泉招游马山赋寄冯山人四首并上南湖
382617,再至长安见无弦上人移住法藏庵因听弹琴赋赠
694867,人日大雪峻伯助甫来过赋得榆愁门阳四字四首
591249,少司寇大庾刘公出示郑少谷所书李空同何大复诗同赋
360504,赋梅送黄庭方
978613,眉州燕游杂咏十首 其四 晚赋园
502876,为陈谷骏赋东墅閒居
507167,洪熙乙巳秋仲赐观内苑珍禽奇兽应制赋
350889,孤鸾·夜泊江干，赋得梦回时酒醉后思量着
814749,吴素云女士写秋芳图寄其仲兄兰雪法时帆学士见而爱之以曹墨琴夫人手书洛神赋册易去甲寅春日兰雪过吴门属咏其事
933677,晓赋
734364,有以琴命予者赋谢
605872,夜宿三山禅房漫赋刀剑二首 其一 刀
350394,罗敷媚·才人词赋飘零尽
474129,赋得秋鸿送客
1000141,与盛毅同赋暮角行
1154879,赋得的的帆向浦
659048,野人献菊碧色每丛作双鸟并立名鸳鸯菊为之赋诗 其三
711408,酌罢过二百堂挑灯坐漏已下戏再赋 其五
493291,余忧愤中戏作墨龙于报恩寺之西壁明日余兄子中复图于东壁有高视阔步之意或请余弟子彦赞之子彦笑而不言因赋一绝以见意
616255,鹪鹩园十七绝为黄与东赋 其十三 杨柳
63328,山水闲游为寂庵赋
413746,仲春留园感赋嘉陵江上
102742,雪林砚屏率鲁直同赋
267977,意难忘·盆兰为虫所伤，未几复茁。喜赋
690560,次日龙川宋元实明府随过小园留酌竟日亦以二诗见赠次韵赋谢
735758,陈州村人或赋上阳白发人者毛甡过闻而感焉
405593,自上海放舟，横太平洋经美国赴法国，舟中感赋
1072232,赋程伯禹给事漫吾亭一首
1145991,赋得早雁出云鸣
423513,导引曲·八月十八夜梦至一处，长廊曲室，间以疏棂，月光射入，皎洁殊甚。极望烟汀沙渚，清旷无人居，其外平波弥迤，或言此洞庭湖也。恒有仙灵往来，见湖壖大鸟，引咮斫地者再，鸣声戛然。湖中出二女郎，短发齐肩，长眉入鬓，其一人齿尤稚，风裳水佩，绝不类尘世妆，侍者导以行，就室中款语良久。惝恍迷离，多不可晓意者。倦游招隐，其俟我于潇湘云水间乎。醒而赋之，以讯知者
605086,移家羊城道路戒心帅府以帐下戈船来迎自榕水至珠海遂获利涉赋而谢之
1001297,有售画于余令作杨柳黄鹂池塘萱草既成可观用随其题赋二绝句 其一
744731,登金山塔顶同铁门赋
1212338,雪香亭月下偶得名酒径醉为赋
1146201,侍宴赋得起坐弹鸣琴二首 其二
428037,玉楼春 马茂元以胡云翼下世见告，亟赴万国殡仪馆吊之，至则已移入火葬场，赋此致悼
698151,与虞山人胜伯陈山人惟寅谈及仙游事醉后赋诗三首兼呈二贤
1235931,竹枝歌三首 洞庭舟中赋时至治二年二月
541139,盐城初夏，雨中诵“不知春去几多时，纱窗几点黄梅雨”之句，用赋十四首 其九
383786,感兴·陈王徒作赋
236763,玉笛冰滩索同赋
899794,为徐叔刚赋达斋
409713,光炯将赴云南制府幕，泛海取道越南，赋此赠别
408774,登大观楼感赋 其二
444452,翠楼吟 柏森先生招饮双枣书屋，与梦芙、新河、引之同赋此调
621224,中秋陆清章招同郭履台先生过雁宕村赏桂漫赋二首 其二
688863,同黎君选欧嘉可碧瓯亭纳凉分赋二首
606421,暮春李长卿偕梅子庾移樽过访赋答二首 其二
922958,丘林诸君以春雪三绝见寄走赋长句奉酬
748310,丙午初冬寓居报国寺赋诗 其二
51507,吴江舟中赋得秋怀·礼乐重开气象新
786586,前月诸罗斗六地方山崩川走，沿及全台，地震连月不止，再为悼赋七律
570027,朱定国失意后访我金陵赋此赠之
932050,初夏幽居杂赋七首 其一
145041,萤火·尔质非天赋
716341,过何明府城隅客居赋赠
819892,庶侯自宝应来并出近诗赋此赠之
171229,殿廷初考圹同舍约共赋诗
962505,赋张袁州隐斋三首 其一
521837,师邵以墙头过浊醪为韵赋五绝句依次答之 其四
79829,山园杂赋·初夏未觉暑
812459,感赋
652143,北归有喜而赋
922901,与次道集贤谏议元素翰林赴冲卿枢密谏议见招宴会同赋
463060,送辛磊兄四首 其四 连霄风雨对紫荆怀辛磊君再赋
363067,游潘园感赋
544886,同诸友分赋临安十景二首 其二 玉莲亭
269315,疏影·读梅花喜神谱感赋，次姜白石韵
668298,虎丘剑池相传深不可测旧志载秦皇发阖闾墓凿山求剑其凿处遂成深涧王禹称作剑池铭尝辨其非正德辛未冬水涸池空得石阙中空不知其际余往观之赋诗贻同游者和而传焉
828041,九月以事至天津季湘苕雪治芗子安楚生八兄寥志二弟皆自京来会适逢九日就市楼小饮即别去途中感赋二首 其一
1055894,子瞻参寥太虚同游惠山用王武陵窦郡朱宿三诗韵各有所赋参寥录以相示余将游焉用次其韵 其三
505794,淦江书屋为李宅赋
529329,五月廿七日雨后过山居观屏间所留橘实更丰肥而色回葱茜诘旦南邻致白菊一本三花灿然皆异也赋诗纪之
636154,从泷西还亦庵庞卯君见赠赋答
653196,怀恩楼为王宗勋赋
264024,三姝媚·王幼霞侍御见示春柳词，未及奉和，又有送行之作，赋此阕答之
974509,邂逅孙子仪于临安喜而赋诗并怀子进子肃
918271,里人俞退翁自号南山南菊逸尝赋诗以道其志继有和者一日示两钜编则有故文丞相长句冠于其首盖君谒丞相于燕京时所赠也谨次韵以归之
915807,赋金盘露椒花雨
835479,辘轳金井 废圃寻春，见樱桃花，感赋
827119,鹧鸪天  读寅恪丁亥除夕诗感赋
701498,郊祀斋居大兴隆寺与懋贤举之绳武三太史同赋二首得旗字
1208707,次韵赋春词三首 其三
826447,长相思·庚寅八月二十四夜自海外归，宿长相思室，感赋二解 其二
696783,龙潭十景为太医院判蒋用文赋 三江观潮
433276,周总理逝世感赋选二
1179220,奉和宴小山池赋得溪字应制
1242341,西河 一春索居，况味殊恶，赋此纪怀
1958,送李侍郎迥秀薛长史季昶同赋得水字
1141015,随隐为祝南山赋
986146,以久字韵赋翁仲
644167,应制赋甘露诗十二韵
668295,岁暮雪晴山斋肆目偶阅谢皋羽诗穷冬疑有雨一雪却成晴喜其精妙因衍为韵赋小诗十章 其八
1248140,九月十六日陈逸人旭访余蜀山中明日将还武塘因赋此送别
635932,中宿归舟赋得落日放船好和张子白韵 其十七
849089,为僧赋竹泉诗
1245681,大树歌为冯渊如赋
647454,拙斋为徐希孟赋
492618,公文契尚书由参政山西入拜礼部而予以侍郎起于家同日拜命赴南宫今承恩致仕又适同日公文有别业在溧阳予将南还泰和于别也不能以无词焉因赋二律诗为赠 其一
651416,十二景为衍圣公孔彦缙赋二十四首 其四
72105,逸庵诗为吴子明赋
592497,姚元白枉书问讯因闻元白与陈子野俱已乞休赋寄二子
356252,三台令·赋丽
341538,蒋脩撰述天台之游赋赠次韵
46768,赋得惠山泉送客游越
671789,又赋伤心行 其十三
1239510,闻玉山顾隐居以赋役入城负疾而归而山中花竹多为有区区怀思寄诗代简
390103,九月初二日奉神宗显皇帝遗诏于京口成服哭临恭赋挽词
1053572,赋王立之承奉园亭 赋归堂
1053572,赋王立之承奉园亭 赋归堂
538691,李子任侠好施予有古朱家剧孟风而文采胜之忽过余下榻留连竟日其空谷之慰可知也因赋近体一章赠之
220966,赋双松堂呈薛监簿
918906,俞舜俞作墨梅八轴皆取古人诗句请余赋之
515926,题慈节卷为萧给事赋
791552,感赋八首 其三 山秋
1034008,高九万见示落星长句赋此答之
509069,善庆堂为祝大参赋
536611,与黎职方吕光禄共赋岘山石尊
590444,赋雪次滁州孙环山进士韵 其六
685223,侍御吴德彰佥潮南观察事限韵赋诗送之
351705,用文之韵赋岩桂
1124264,蕃丙午冬分宜见公度簿公尊兄已而邂逅于宜春蒙以蕃与徐斯远志别六言之韵作诗为赠久未和答今日东归乃克赋之四首
1242952,月轩，为张令赋
411469,夫人归宁母家，逾期不返，赋此寄之
607017,常德张使君祈晴有应为赋二首 其二
833594,鹧鸪天 雨夜，易五以车迓某郎，赋此调之
791231,五月四日抵里喜赋七律四章 其三
191975,赋芙蕖简诸友
1137129,恋绣衾 其二 或送肉色牡丹同赋
1042497,汾州有唐大历中崇徽公主嫁回鹘时手迹在石壁上李山甫作七言诗并刻之子华永叔内翰皆继其韵亦同赋
268050,山花子·山花忽开一枝，怜其晚秋无侣，摘供案头，为赋小词
1094168,尹谏议秋怀昌甫以其韵赋之因亦和焉 其五
605290,五月七日宝安诸君子招汎龙潭八日复汎篁村同观竞渡客有歌落日放船好轻风生浪迟之句者因以为韵人赋十章邓玄度六言首奏余亦步其韵以六言赓焉 其八
1250641,阳翟新朱定甫赋 其三
842780,金陵晤陶斋赋赠
812431,清明南郊看桃过友成、崇正两书院遗址感赋
617406,刘平子馆予青竹园将别赋赠
1026002,绕池游慢 赵倅游濠，作绕池游慢，约同赋
544114,客有自金华诸洞返者穷幽历险所睹甚异余伟其事而赋之以订再游
370990,瑞鹤仙·赋圣几斋中牡丹名藕丝霓裳种来自亳州
493508,题甘溪归养图为萧国录子所赋
1236537,八月廿一日惟寅徵君踏雨过林馆为留终日因诵近赋绝句三首爱其词致清婉辄走笔次韵如上古道寥寞人以角逐声利为务惟寅独逍遥恬淡之乡时来□之篇章翰墨之事岂易得也哉
600489,寿萱卷为刘母邓孺人赋
1170656,魏仓曹宅各赋一物得当轩石竹
605614,用平年兄有小舟曰荷花片以诗索赠次来韵赋答 其五
1194608,落帆后赋得二绝
548753,赋得双塔寺
653463,唐安八景为尹朴之赋 其一 东湖夜月
544427,思齐夜出杨瓜佐酒稍异常者讯之知杨姥得诸异人即席赋此
860863,点绛唇 赋登楼
935703,舟中咏落景馀清晖轻桡弄溪渚之句盖孟浩然耶溪泛舟诗也因以其句为韵赋诗十首 其五
770650,前年庭角种桃树谓山桃也花后青子累累儿童日撼树弹鸟雀尽今岁牵牛藤罥其梢时底馀十数熟甚美露坐摘尝因赋
1101609,使长初约客观文殊寺牡丹忽有走数种自小洛阳来者觞于东山堂席上赋
201698,次胡则大赋雪韵
755048,过访少如座中忽值雷电交作雨雹横飞闻朝阳城楼竟为雷火所毁便道往观归来赋此记之时壬寅夏四月二十二日也
365912,五用前韵·掩抑鱼轩赋载驱
1032895,为郑菊山赋斗室
283992,赋得马·天育开群牧
477578,弟洛为猗氏学谕以襄陵酒方见示如法酿造良佳赋此答意
591525,陈推府九十过余山馆始获瞻承赋此上寿
277351,绮罗香·冰如有美洲之行，赋此送之
307276,江城吴老招饮，赋此致谢
579713,桃源图二首为周惟中赋 其二
573573,有取苜蓿草而食者感赋
283376,忆旧游·重九题师曾芝兰便面遗墨，为悟园赋
492717,同舒伯源自双溪口度桥登高山望幽谷诸峰赋八绝 其一
545086,贞吉以秦镜并短歌见贻赋此奉答
775835,壬辰1832春仲护送巡道周公抵澎抚恤赋呈二律 其一
833143,一萼红 东邻桃花一树横枝侧出，映入小窗，红萼窥人，嫣然欲笑。爱玩既久，倚此赋之
152318,顷在道中闻邦衡侍郎将进周礼新解尝赋诗就为
1165042,园中时蔬尽皆锄理唯秋兰数本委而不顾彼虽一物有足悲者遂赋二章 其一
925813,沁园春 其一 弄溪赋
30851,赵璘郎中席上赋蝴蝶
819999,民国建元喜赋一律和寒云由青岛见寄原韵
1060447,立秋日诸公过敝庐赋诗
197935,上巳成季召会于西溪会上赋诗须多韵仍用故事
657124,淮上逢董浔阳太史归湖州赋此言别
974354,得晴欲过江访梅已忽病作天亦复阴怅然有赋
195102,曹彦约昌谷集同官绝赋经梅成五十六字
697288,邓远游以书贶见贻赋答二律
960550,满庭芳 赐坐再赋
480815,雪山图为建德周廷晖赋
541036,慎修以夏曹郎出守维扬经年怀想间书来鬓渐生白因而感赋
296437,颐伯到周庄与子开作书，邀我观伞墩梅，天雨不果赴约。赋诗寄之
603939,永安赖氏别业在寿春岩故称名胜戊子之秋余自大田言归而门人萧生汝培独骑追送薄暮经焉辄辱地主吉泉君偕游因赋二律 其二
561044,常甫宪副钦之翰检与予先后登岳钦之独值雨是日予与常甫坐候云开堂因赋二章 其一
426915,盛九万丧其掌珠匡华赋此慰之 其三
512788,常熟张修撰孙女许人为妾杨大尹明父改妻先贤言氏之子因赋
1098151,亦龙弟覆篑累石作亭其阴屏翁名曰野亭索诗谩赋二首 其二
188084,十六日下山各赋二篇以纪时事云
327316,择之诵所赋拟吕子进元宵诗因用元韵
608464,赋得泥融飞燕子
1001362,癸卯与宋尧夫集于豫章之贡院既别尧夫就亲南丰戊申赴召除评事余到部再得款尧夫赋诗道旧次韵答之 其一
271792,鹊桥仙·七名云楼留饮赋赠
843235,荫坪叠落花前颌四首索和己未及今十年矣感而赋此 其一
671786,又赋伤心行 其十
626936,赋答屈本庵话旧见寄
518098,考满舟经十八滩因分各滩名赋诗 其九 清洲滩
716027,过黄积庵南轩赋赠 其二
493506,题墨菊图为杨员外公辅赋
791168,拟赴都门，承王雅伯赋诗赠行，即步韵谢之
452098,五月京城诗会诸师友佳作叠出予则诗思全无唯艳羡而已今日偷閒试赋三章以记 其一
682057,七月七日八日敬承用韫招饮时敬承将有留院之行同诸丈赋
425655,和星叔舟游鹅鼻山下归赋四绝原韵 其二
868753,赵子容任温州司法终日看册子而事自理又新廪储粮功利可传也为赋读书行率诸友同作
1031611,三月十二日晚雨因取渊明诗微雨洗高林清飙矫云翮之句定韵赋十诗翌日雨未已侄坦师来相招时方赋六首暮雨暗还舍遂足十韵 其八
1031611,三月十二日晚雨因取渊明诗微雨洗高林清飙矫云翮之句定韵赋十诗翌日雨未已侄坦师来相招时方赋六首暮雨暗还舍遂足十韵 其八
752346,甲辰仲冬赋呈葵园师 其三
51516,赋得武夷君送陆无从游闽中
709757,朱子勷赠予墨拓瘗鹤铭喜赋
1126876,十四弟归洪州赋莫如兄弟四章赠行
721391,家黄公守戎招同王础尘屈翁山家位先集于署斋即事赋赠二首
444116,己丑仲春浔阳年会赋得“莫问长江水浅深”赠江右诗社同仁
402985,清平乐 湖帆写松竹两帧见赠，客索松去，赋此题记
101573,赋得高柳鸣蝉诗
972586,邢兄大声以重九日置酒约梁丈仁伯段兄元衡蕃亦与焉赋诗二首 其一
464887,风入松 江楼感赋
1249514,至正壬寅二月廿一日雍虞岂临江宋□道士刘旻李文同登西峰之烟云台以登高望远为韵各赋四首 其二
1131056,明叔昆仲特惠梅花聊赋小诗三篇为谢
699033,闵孝昭送其尊人隐武夷自归广陵赋此以送
951771,范宰同郑簿应尉送战船至海上招野人同游赋得可月湖一篇奉呈
143440,春社斋禁连雨不止赋呈梦得
562221,洪武六年五月初一日早朝奉天殿西域国师来朝盖前代所未有也目击盛事因赋
682074,陆敬承有台曰来爽暇日登之漫赋
329795,又赋·忠胆轻生甚一毛
572617,百六诗为丘大赋 其二
437763,王元仲海岳楼同诸公赋
754615,闻唐陶山明府重修桃花庵感赋用原韵 其一
521453,沈廷用以尺籍事来京却归赋别
912294,庆长叔招饮一杯未釂雪声璀然即席走笔赋十诗 其六
298898,凌玉去燕游晋归以诗见赠赋此奉酬
292230,一丛花·梨花将谢漫赋
763633,念奴娇 其十 《念奴娇·即席再赋呈李研斋前辈宋荔裳观察王西樵考功》
152021,李得善赋绝句疑为鹿按广韵注鹿云麞属注麞云
118038,用林侄韵赋雪
475534,南山行为梅林司马赋四首 其二
1068160,七夕怀徐十用去年所赋东坡清凉韵
426018,次儿恒丰，调职东归，合家团聚，秋夜会宴赋示一律
826761,鼓笛令·赋蛙
1236199,天冠山同诸学士为祝丹阳赋 鍊丹井
616254,鹪鹩园十七绝为黄与东赋 其十二 梧桐
1249474,过南沙曹氏别墅会沈伯熙索赋
1039120,再赋柳枝词二阕 其二
503808,为刘君道赋昱岭关
296,冬日宴于庶子宅各赋一字得节
240673,魏彦诚见示出守广德朝士送行诗用韵追赋
265528,晓行东郭外漫赋
764129,满江红 其一 初伏雨中，上幸宣武门观洗象，闻信趋至，乘舆已返，象亦洗毕矣。赋以寄概
767263,赋得吹气如兰有赠
1143727,郡人有朱买臣严子陵按史传买臣吴人尝出为会稽太守名曰乡郡会稽盖今两浙之地吾郡特以去州二十里曰朱池为买臣昔居之地难以考见其实子陵晚耕于富春山中则今钓台是也二公出处不同心事亦异姑以其同为郡人各赋一首使九原有作不怅来者之不我知也
238025,三省齐为洪中行赋
491563,颜明德自全椒避乱归安成道过瑞阳赋别
265244,赋得春荻诗
84153,杂赋·径绕茶冈北
1218646,赋樗杜之诗一首送大岁大彻二位上人归日本国樗杜之上人自号也
71186,宋制置彭大雅玛瑙酒碗歌周伯温大参征赋
1106870,和赋千叶桃花二首
599978,赋得杨柳
1028008,代仲舅尚书赋江山得助楼
775912,劝农归路经海会寺与诸同人分赋 其一
83582,北窗哦诗因赋
987297,五月六日约诸友游北山舟已具而予偶不能出诸友和坡公法华寺诗亦赋一首
483798,书带轩诗为郑同夫赋
1211772,西宫春日与吴锦衣赋
236773,为君援笔赋梅花
671133,乙卯春大人有文安之行送至京口大人用杨柳青青渡水人为韵赋七绝以别敬步原韵 其四
606742,送谢参军转赋二首 其一
566873,五色鹦鹉黄鹦鹉并是圣母所驯各赋 其三
164031,赋客室·屋下何妨架屋重
1223785,赋砀山成简卿心远亭
457923,予目时患炎症，岁必一二回，恒以为常。医云此用目过度之故，苟不调剂，未必不有盲日。今复觉有异，似症又蠢蠢将作，为赋 其二
880825,赋何明府爱山堂
157513,孤坑头上篮舆烟雨中赋此醒困
412040,参政会中遇陶玄女士询及亡妻赵娴清女士身后情况归来怅惘感赋此篇戊寅
1221497,东圆分题七叶坡为王景周赋
606459,天界社集赋得薰风自南来殿阁生微凉二首 其一
279394,还京乐·借待制旧韵赋新事
308,赋得春莺送友人
837766,金缕曲·金陵乡试第九回，感赋。寄幽贞馆
359489,长乐閒赋·五十年前梦此游
577010,环翠草堂为毕思诚赋二首 其一
168356,孙过庭摹洛神赋赞
1109774,次酬胡编校赋竹屋
529882,学谢灵运赋华子岗诗赠赵建昌
54469,题方壶画为斯贞侄赋
715160,归舟得二山鹕喜赋 其一
696910,二月十五夜子浚兄灯宴再赋
1124502,赋庄贤良招隐楼三首
402525,九日世杰见赠茶叶赋谢兼寄纫诗
407480,喜晤孙养臞、余越园、刘卓群三先生于龙川，养臞先生出示《待旦集》并越园先生和章，感赋
773067,癸丑1913仲冬内田民政长官阁下南巡抵嘉召集厅下各支厅长厅参事区长等训示并赐宴席上赋此奉呈
652940,题溪山春雨图为淞江金文鼎赋并画
595315,乙卯李三洲都宪讯予北上之期赋此答之
612324,夏日邀洪约吾赏荔辞以病足投诗赋酬因遣绛衣一队趣订后期
1085982,舟遇逆风破浪赋诗
492138,十二月十日晚同吟所郭光辈奉陪溪南隐君与其诸郎群从观舍傍蔬畦仍出山后临眺江上周览林麓追念旧游抚余羁怀益深感慕因赋五言近体六诗柬同游诸君亦以识嘉会也 其三
1035324,鹊桥仙 七夕之明日载酒李彭州家即席赋
1110368,赋成都张氏蜀锦园
639297,吴门锁钥为邑侯王苍野赋
57238,村居杂赋·野路经行处
1208062,离席合赋赠南剑教授盛复之之官，凡十首 其六
220983,用拙为金罍徐氏赋
639352,虚窗独步为昌仲叔赋
1099947,叶万山以诗求诗为赋一首
835610,探春 人日偕钟绍泉、何弼臣、程干卿诸君游工部草堂感赋
621302,醮夜同耑孙遨游邂逅何生索锦缠头辄解赠之同耑孙各赋一曲
319153,踏莎行·为老兵送人出关杀敌赋
835150,高阳台 其二 光绪甲午仆年二十，举贤书，出瑞安黄公门下，明年公以女妻之，而为之蹇修者，房考会稽王公也。同人艳其事者交赋催妆，戏拈黄字赋博诸子一粲
835150,高阳台 其二 光绪甲午仆年二十，举贤书，出瑞安黄公门下，明年公以女妻之，而为之蹇修者，房考会稽王公也。同人艳其事者交赋催妆，戏拈黄字赋博诸子一粲
439420,九日月中对菊同禧伯郎中赋六首
545918,唐明府长公新搆园亭三泖之上书来徵诗赋荅二首 其一
47116,郊墅杂赋·路迂桥断处
882158,天台陈石居出示乃祖梅隐先生遗稿其序中所载与友人冯使君入蜀之事可伤因赋四十字
202702,石窗为明上人赋
119078,赋园中·蒲桃不禁冬
