718303,从塞上偕内子南还赋赠 其三十一
1217496,耕乐为张处士赋
1214452,赋陆子敬旧时月色亭
267273,水龙吟·四印斋赋白芍药，分得肯字
855219,南歌子 其二 东堂小酌赋秋月
541925,读周谏议用馨诗集漫赋长歌行
474060,赋得千山红树送姚园客还闽 其一
548733,吴太华宪佥买燕姬赴蜀赋赠 其二
13597,杂言赋得风送崔秀才归白田限三五六七言
1073868,东坡先生与蒋魏公游最善宣卿侍郎蓄东坡诗文自公始也心慕手追遂入于室某尝赋景坡堂诗宣卿谓余知音者遂标藏之椟中比守吴门治有状玺书褒进待制敷文阁某驰小舟往贺宣卿出诗三章见属句法华妙为一时绝唱有云正索解人那复得其谁知我固无从此真东坡语也辄次韵书于卷末 其一
427666,洞仙歌 用柳屯田体为湖帆先生题仇实甫画长门赋图
470024,陈山甫遨集杨姬华林馆同赋四首 其四
1099347,出朝赋归来好 其九
454845,一萼红丁亥岁杪偕京战游云南，途于思茅南郊无名山谷流连竟日。此地亦有人称八十号，林径幽深山水奇绝，时动清兴约同赋之，归后三日勉得此解
1050803,阮师旦希圣彻垣开轩而东湖仙亭射的诸山如在掌上予为之名曰新轩盖取景物变态新新无穷之义赋十绝句 其十
460105,贺新郎　王江华来，赋以接客
567977,施生归自九江赋赠 其二
701835,新恩为沂乐廷卿赋二首 晓阙颁书
753262,以渔洋精华录寄琥唐山春榆侍郎有诗见述率赋奉答
673236,正统已已年丽寇至缙云大肆摽掠延杀无辜乡氓赵氏女自经死钟氏妇堕南岩宛予特赋其事二首 其一 赵氏女
431683,阔别宜城，瞬经八载，江山依旧，人物全非，赋此抒感
843201,叔毅陪枚老雯青游青原山寺予未获偕雯青为图于帐额枚老有诗时光绪癸未九月也豫侄装标乞题感赋
1062148,再赋弈棋五首 其五
1127242,湖上閒赋
541069,高玉翁左史见枉用韵赋简五首 其三
124247,春集东园诗赋得筍字
434513,临江仙 三月十日与诸君约会西园久而不至花又狼藉因赋此以排闷
380976,临江仙引·九日有怀瞻园，时方辟兵海上，用耆卿仙吕宫赋此
904498,漱玉轩为邑之佳处顷春祝寺僧少葺之重来则眼界增明矣因拉王和叟刘曼卿相与碎建茗瀹之泉上石作观音像通悟禅师手琢亦甚灵异赋三绝 其二
409768,东坡生日用坡词“不知天上宫阙，今夕是何年”拈韵赋诗得年字
432245,游交芦庵僧人老且病出观华秋岳奚铁生西溪诸卷欲访厉太鸿先生墓为时已晚怅然归去赋此赠之
97061,登岳阳楼·几思假日赋登楼
843417,八声甘州 赋六忆 其四 眠
1026148,再赋颂二首 其二
840630,龙泉寺旧有寿山石刻十六应真象庚子兵乱失其二邵伯絅于厂市见二像购归寺中恰合洵异事也绘图徵题为赋二绝 其二
1064461,二月二十一日奉陪季长游岳麓饭罢登法华台赋此
291118,看花回·赋兰，用片玉韵
458154,十一月八夜梦见先父，予问曰：“这几天你到哪里去了？”语未及终，即蹲身咽泣，不复能声。恍然中似觉先父渐近予前，然予闭目，未尝见其面目举止，但觉如是耳。既醒，犹闻唇吻间喃喃自语曰：“你不在家，怎么吃饭的？”倚枕更忆，梦中语时，尝略犹疑，不知当谓“几天”抑“几年”；实则先父弃世，行将廿年矣。越三二日，中夜复醒，乃为赋此
605628,辛未岁除冯无文客止园贻诗馈食余分杖头钱馈之用来韵对使赋答 其一
945762,戴时可家赏木芙蓉花醉赋
413350,望舒逝世十三载矣时人罕复齿及忽见吴晓铃有文怀之因感赋
726375,徐尚书座赋得阿怜诗
498217,再赋个侬 其四
629525,潘幼涵中表枉过村居因偕访载孺家叔命酒赋诗用韵裁答
549992,牡丹落几尽矣惟馀一枝垂垂不坠因而赋此
864922,长生草为叶峭峰赋
440556,张九痴先生，青箱世家，博通文史。长以岐黄立业，世路坎坷，备极艰辛。间以其余发为歌诗，怪怪奇奇，莫名一家。近十年来，先生编辑《桐城诗词》，殚精竭虑，造福乡梓文化多多。余之获交先生即在其时也。先生不以余为不敏，刮垢磨光，奖掖备至，热道古肠，有不能以文字形容者也。顷闻先生于小恙之余，编次历年歌诗都为一编，拟付诸梨枣，传之其人。噫，此淑世之壮举也，余乌得无言？爰赋长句，以志大庆
1102465,羁燕四十馀日归兴殊切口占赋归 其三
813768,壬辰1832春捧檄来澎随同周芸皋观察查办抚恤蒙赐书画联扇赋诗申谢
671779,又赋伤心行 其三
250536,初到长沙诸友设宴接风相约各赋绝句限东韵予颇觉不能尽意乃赋一律
250536,初到长沙诸友设宴接风相约各赋绝句限东韵予颇觉不能尽意乃赋一律
1242854,桑梓图，为徐复初参政赋
245348,友人江顺德连日留饮分韵赋诗得日字操笔立成
280934,瀛社诸友招宴，即席赋谢
688962,履端二日赋十绝句
492986,往时杨清溪为乡先达菊存陈公作种菊图工妙逼真去之六十馀年其五世孙继先乃得之于其仲父有实家盖其家故物也出以示余因题其后以致景仰之意 其十四 舟中望南塘酒楼再赋有怀故人旷伯逵孙伯虞
402959,金缕曲 李释堪寄示与许守白用稼轩韵唱酬词来，继赋
573291,白燕篇为元驭阁老赋
1073729,向伯恭侍郎致政芗林筑一堂名之曰企疏晋陵孙某闻而赋诗二首 其一
756893,丁未仲冬携钵渡江喜过深翠山房巢民先生出小影索题赋赠
718293,从塞上偕内子南还赋赠 其二十一
605109,制府姚江王公疏荐地方人才谬以见及注曰原任贵州平越府知府张萱学穷二酉胸富五车岭南开著述之宗天北起斗山之望即未报闻第草莽之臣获以姓名从诸名流入公夹袋亦感恩知己矣赋此寄谢 其三
163488,赋绝句·雅志求仁苦力难
600331,癸丑七月八日贱生七十有二初度日举高年会约家兄八十翁德铭偕莫吴周程褚五老在坐合五百馀岁爰赋诗五言古风七章以侑寿觞云 其七
573238,苏潜夫侍御买燕姬为赋合欢诗 其三
684024,敬美弟杜门信州移文乞休赋此寄之
810972,旷庐落成移居赋此
39507,皇太子宴玄圃宣猷堂有令赋诗
739370,中元登海光寺楼写望同张鸿斋汪西颢陈江皋万循初分赋得八庚
107663,大明赋·草制无知傅伯寿
674927,碧渠诗为李君宗朝赋
607460,高唐王惠自斲桐琴汉宫瓦砚赋谢二首 其一
1039977,得守虔州过乡邦赠别衢州太守高赋同年
980656,黄河多淘河之属有曰漫画者常以觜画水求鱼有曰信天缘者常开口待鱼感之赋三诗 其二 漫画
1128275,自仲嘉云亡未始见梦舟行夜入吴兴境有梦如平生感而赋诗四首
909022,丁未效八窗叔赋黄郎
379753,为谢无逸赋梅花
250226,江右诗社相邀于庚寅三月初三丰城雅聚先赋此篇以寄
500635,昱至枞阳喜而有赋
1137103,南乡子 其二 木犀花下，因忆永阳宣溪与故乡族子门径之盛，而其人皆适在此，感叹复赋
646248,十五日上服衮冕乘辇辂赴法会至日夕迎佛上率公侯百官临法筵供佛行大礼乐用善世等曲先是十四日微雪呈祥寻即开霄是夕星月在天风露湛寂丝竹迭奏灯火交辉礼仪之盛前古莫及赋迎佛礼佛送佛 其一
417616,青玉案 偕娟访蒋锡鸾，赋此为赠
816956,东征逾载整棹言归巡使黄玉圃先生索台湾近咏知其留心海国志在经纶非徒广览土风娱词翰已也赋此奉教
1145950,赋得花庭雾
880945,赋望云寮
616224,冬夜伍国开有开同诸从过宿小楼以酒态美如嵇叔夜诗才清似沈休文为韵赋十四绝 其十四
1016409,和山谷赋黄迪墨竹韵
539225,咏物体六十六首 其十 又赋绿牡丹
773222,楸村送蘋果赋谢 其一
238789,懒不作诗觉文房四友俱有愠然谩赋
687913,春日双桂天公偕何孟门过访归后唱和见寄用韵赋答
1161285,赋得铁马鞭
1036352,九日登天湖以菊花须插满头归分韵赋诗得归字
286194,西宁令洪时懋见过赋赠
603025,夏日同欧卢冼诸社长访杜四隐君居赋赠二首 其二
1070193,同赵叔问江仲嘉游法华之胜为曲水会有客先焉还饮舟中分韵赋诗得山字一首
817949,盆兰久不放花七月晦日忽生两茎欣然赋之
939079,追赋齐山
1101106,赠黄中为赋澹翁
769480,水龙吟  分韵赋白芍药得后字
542547,夜集吴比部鸣仲宅赋得秋月
957511,园丁折花七品各赋一绝 其六 鞓红
292030,俞律诗兄督予先作《登庐山龙首崖放歌》，因走笔赋此，不知能入法眼否
478628,闻杨君谦致政赋此以致健羡十五首 其六
718286,从塞上偕内子南还赋赠 其十四
1038396,群贤宿山赋得暮云岩下宿
952576,教授两为玉蕊花赋长韵富赡清新老病无以奉酬辄用杨史君韵为谢
261065,韵赋诗·寒泉漱云根
405221,瑞鹤仙 西湖归来载兰花丛为赋
331894,满江红·湖上坐雨同西樵赋
146300,有感而赋·风雪重门老楚囚
151990,赵正则司户沿檄而归玉蕊已过追赋车字韵诗奉
690338,村居杂赋四首
570025,故人卓澄甫光禄补官北上过金陵饮官舍赋此送之且订留署之约
291199,八声甘州·辛稼轩水调歌头和杨济翁、破阵子为陈同甫赋及本调读李广传
867688,翟簿示似中秋高作命意着语殆与商素争清读至人与月忘年之句不觉击节借五言为韵赋诗答谢 其二
304956,与君表饮虞山酒肆，醉后赋呈，即邀同作
1197540,闲情赋并序
798035,水调歌头  题余氏女子绣西施浣纱图为阮亭赋
119079,赋园中·堂後病石榴
614586,社中观餐霞王叟塑佛赋赠
426193,赋谢杨老吟台再度赠诗送别
636376,雪麓梅花西乾山同赋
828486,立之属赋白孔雀
608153,赋得巫山高
415395,丁巳仲春返扬小游，慨赋八律 其四
848939,月集呼声妓不至野渡于觞末俾赋诗以纪初集
1026839,监宿同邻几赋
360825,德升尚书赋溪风亭二首以题为韵顾风字某已先作别赋溪字
360825,德升尚书赋溪风亭二首以题为韵顾风字某已先作别赋溪字
99096,再用前韵赋
785637,陆军官学校开校礼成赋呈有栖川炽仁亲王
430264,三姝媚    和玉田，剑知斋前三莲并蒂，笙伯为图乞予赋之
620841,庚子偕大岁和尚与傅司马等重登元魁塔文昌阁再赋十律 其五
604473,邓玄度观察以归兴十章见寄用来韵漫赋草土馀生不宜拈弄笔墨第兰契久阔芳讯遥临掩泣抒怀罪我勿计也 其八
572618,百六诗为丘大赋 其三
298622,同赋·地接扶桑日早烘
826534,水龙吟·立春日偶赋
862729,与长老夜话出故人俞宋护书予至山之日俞书适至书中又相问讯感而赋诗二篇俞郊居婺源草堂蔬圃教子读书乡人重之闻近苦目疾殊可念 其二
1221046,剡西八景为开明空相寺僧华月江赋  其八 孤松晚翠
473460,张婿归自都门喜赋
990825,元夕同次道中道平叔如晦赋诗得闲字
74702,杂赋·路直华亭谷
559126,丁未七夕雨适郑德进馈芳园胡桃时乡人报夷舶因风出洋矣转忆沈约有云胡桃挺自禁地为胡羯奔逃之兆感而赋此 其一
716378,元孝六十又一生日赋以为寿 其一
142444,能赋台·万顷玻瓈水浸空
517161,南园十咏为南野先生赋 其一 红药翻阶
925956,浣溪沙 其六 赋清虚
1040832,明叔昆仲特惠梅花聊赋小诗三篇为谢 其一
925718,永遇乐 其一 赋梅雪
163960,有赋·岐路暂须执手
828256,秋间予病几殆陟甫九兄夷希同年邀游鄮山时为八月十一日为予五十初度两兄斋僧普佛为先母周太夫人资冥福归后病良已追念感赋四首 其二
833959,绛都春 为琴绮赋
1033489,张子明索赋永斋诗诺之久矣杜撰四十字以还冷债
612141,中元日刘觐国携生鱼过小署对酌赋
546352,黎秘书刘观察刘金吾丘计部李环卫周明府康茅朱三山人出饯即席赋 其二
501201,赤盏为肃慎贵族于今为清门希曾其字者读书为诗善鼓琴且工墨菊有新意为予作四幅留其二徵诗为赋此云
388210,春晴与峻伯游云门既别雪乃大作赋此志之且订后约
760843,絜斋世丈以西园述怀集苏六十韵诗见示，为赋五古四章 其二
386558,胡雪村解馆将归，赋诗留别，次韵送之
1029289,次余求之坐间所赋
752350,陪张湛存先生入崂访逄公栖止感赋 其一
518793,乌符观读吕仙诗刻忽报蓝祁阳改知嘉善喜赋二绝为别 其一
741183,夏日喜静山诸君过我留饮赋此
976308,桂枝香 天柱山房拟赋蟹
542226,夜集孙郎中文揆宅赋得月字
416925,声声慢 江亭重到景物都非感赋此阕
514447,宝泽堂为吴人陈翥赋
431484,摸鱼子 生日感赋
423512,莺啼序·津门羁迹，七度蟾圆。今将南去，临岐惘惘。用梦窗韵赋此，留示同人
1252644,同周恺子谅赋老人会诗
690551,丙寅初春参知洪崖王公移镇惠潮喜而赋之
648250,己酉元夕偕行俭学夔公绪百鍊并携稻秫市中观灯遂过退庵小酌即席赋诗得谁字
454661,邵燕祥《当代打油诗丛书弁言》读后赋此自嘲 其一
1103758,余自入山距出山五十五日竹屋青灯山阴杖屦忘其痴不了事矣随所赋录之得二十首 其十九 石洼
625493,读焦桐山集赋得画堂留草本野竹淡时名寄柘乡诸友十三首 其二
279154,绿意·赋绿菜
1124050,雨中夜归闻两儿诵书偶成二绝幸明叔先生同赋以示之
1248986,十七日过与之洛涧山庄留宿复大雪作及明起视户外岩岫如玉琢削竹树压倒径无行踪飘瞥竟日至暮未已雪深尺馀赋诗留别
671403,诸虫名呼被于人事因据为义者凡八物各赋一章 其八 浑沌
1077367,得家信报淮南飞蝗渡江入浙岁事殊可忧感而赋诗
222282,雨夜许氏第会宿各赋四韵
1075453,湖居春晚杂赋八绝 其三
559687,大司徒毕堂翁老年伯蒙恩予告敬赋
402357,多丽 余所居为李莲英旧墅同人于此作词社第二集即席赋
405337,与敬老、臞翁、季思共赋风雨龙吟楼诗，以“未知明年又在何处”分韵，得“未”字“又”字
979128,和答曾敬之秘书见招能赋堂烹茶二首 其二
549106,六弟有美才恐其荒于嬉也漫赋相勖
1075219,客舍有井极深而寒今岁大暑日汲以供盥濯喜甚赋此
1158380,登姑苏台赋附歌
550124,庚申元夕仁常招饮灯市酒楼同王无近章甫仲田伯善年兄有赋 其四
564801,赋玉河春水
500764,三月三十日费安中山长告别走赋六首 其三 寄邢彦贤
948146,中秋梅桂盛开前所未有黄岩老通判欲赋诗纪异辄以二韵引玉
1090300,次韵常之用前人韵赋梅花十绝 其五
1215203,题画马为方远上人赋
496903,赋淂夏云多奇峰分色字
73137,江城子·和元复初赋玄圃梅花
1159898,楚州开元寺北院枸杞临井繁茂可观群贤赋诗因以继和
833052,寿楼春 社集赋查楼菊部
1178952,为赵法师别造精院过院赋诗
887399,赋新繁周表权如诏亭
1032214,清溪许希贤自号拙逸为赋四绝 其二
492315,送萧子所之九江谒刘太守楚奇 其三 出西郊登山望城中感赋
608308,高正甫出守袁州九月九日予偕家兄暨诸亲友能文者十九人饯之毗卢阁赋诗为别 其一
471183,秋日赴友人席修微有作同赋
840962,秋试报罢久滞里门感赋二首 其一
314433,小病经旬食不下咽俞大松斋馈克宁奶粉代餐赋得诗申谢
304317,自辛亥八月乘京汉车南下今岁四月复由此路北上感赋
36890,赋得夜雨滴空阶送陆羽归龙山
834090,沁园春 小斋开同心兰一枝，为赋此解
764824,一萼红 朱修伯太史同年学勤见余上年赠月娥词属倚原调转赠雪卿为赋此阙
491375,题太古斋为刘政卿赋
300900,大壮先生既为余治印复书词卷见贻赋谢
67537,湖乡佳处为朱昌年赋
1218849,周平叔夜宿崇明寺海云楼偕罗成之隐君文长老及卢隐君以沙头双瓶为韵各赋诗四首次韵卷后 其二
678650,二月二日友人王景万园中牡丹初发景万置酒邀余赏之因令作诗以发其不平之鸣为赋七韵
677649,卧雪东林寺延望天池感赋五绝 其五
1132081,普觉院登上人房老梅擅名滋久昔四灵与其先师道公方公游赋咏盈纸距今三世矣余每至其所辄徘徊不忍去登亦对坐不倦有前辈之风槐径弟拉同游者赋诗因用其韵俾登藏之庶不愧昔日尔
1132081,普觉院登上人房老梅擅名滋久昔四灵与其先师道公方公游赋咏盈纸距今三世矣余每至其所辄徘徊不忍去登亦对坐不倦有前辈之风槐径弟拉同游者赋诗因用其韵俾登藏之庶不愧昔日尔
194024,赋二十八字·水满沟塍不愁旱
438232,醉经斋为虞乡麻长官赋
900639,赋石廪峰
831438,访袭君赋赠
826246,眼儿媚·丁柏岩又行，赋此送之，益难为怀矣
891867,同兄长赋朝鸡
101602,赋得镜诗
89,赋得弱柳鸣秋蝉
1067897,以形模妇女笑度量儿童轻为韵赋十诗 其五
251968,甲午穷秋诗友燕云过访并赋五古相赠
610689,闲居七咏孙建侯赋 其二 闭户
671438,道经吴桥范质公吏部招饮澜园月上汎舟却赋 其四
42907,客有言西江近事者感而赋此
1118873,再赋
555006,再经庐山东林寺又用始祖御史公韵赋六首 其六
440171,鹧鸪天 丁亥仲冬与青凤江南猫儿金水乐乐游西湖题赋嵌江南“碎叶红铺软似泥”句
740195,陈希冯居邓尉六年复归故里赋诗赠之
1135815,上饶周君梦至梅花洞吟曰我家本住梅花洞一阵风来一阵香为赋长句
491677,赋金精山寄赠王使君
147509,泉州紫极宫寿星殿古桧诸葛机宜同赋
463040,见胡马君新书腰封『文化遗民』一语感赋 其一
1196064,赋得有所思
775674,壬辰1832春来澎办赈务临行赋此为蒋怿庵刺史志别 其二
502361,敬轩诗为王达善赋
990035,三绝句赋和靖梅 其三
1231573,赋得青天月团团盛孟章古香亭
836424,满江红 读南幽百绝句感赋，用太一生日词韵 其二
286411,藏公生塔落成喜赋
924361,三日上辛祈谷除日宿斋户部右曹元日赋三绝句寄呈子瞻兄 其一
370992,菩萨蛮·马佩兮梅花卷子寓骑省之戚徵予赋此
651418,十二景为衍圣公孔彦缙赋二十四首 其六
50197,永乐寺观先师柳公三大篆及诸石刻泫然赋此
976162,效进退律赋水乡三实 其一
782239,槐树赋
1146311,辽东侍宴山夜临秋同赋临韵应诏
718283,从塞上偕内子南还赋赠 其十一
611897,祷雨有应喜赋
959832,梦赋诗寻得唐韵册检看见恩字韵
152020,李仁甫赋诗送其子塾下第归次韵为赠
140770,春前一日赋呈诚斋觅荆溪诗编且邀看玉照堂花
636562,李广文斗山谒选北行舟过大通赋诗留别并出丹霞题咏见示用韵赠行 其二
507767,春坊黄学士索赋刘缙草堂二首 其一
1241992,和琴清万山五日雨窗酌酒赋诗韵
56218,赋易水送人使燕
563325,仲春望后同高存之泛五里湖游漆塘诸山分韵各赋五言近体 其三
177900,赠王巇·举子竟文赋
163980,行黑水谷三十里以耳目闻见有赋
890379,赵同叔开轩植竹以自娱乐诸公虽为赋诗而未尝有见之者某不日北归同叔亦为楚令尹矣诗以馈之 其一
215228,赋梅花·汉宫娇额半涂黄
775790,道光壬辰1832春仲周芸皋观察来澎抚恤蒙赐诗文集五种即用襄阳集春游杂兴八首韵赋呈 其二
650179,鲁林怀思诗为太常孔克准赋
685508,舆中无事赋得美人三上三中三下诗共九首 楼上
877927,赋得老松老鹤各一首 其二
165220,又赋一律
972008,题刘叔骥梦游赤壁赋后二首 其二
489804,郑明德先生卖寿器以赘婿玉山道人复赠一棺赋诗以谢邀予次韵
700260,石邦秀侍御再按陕西乃弟翰检先生索赋
380911,章台月·吴姬宛宛，家在半塘桥，尝述其小时七夕遇仙事，感而赋此
402877,玲珑玉 次公索赋玲珑词
684429,人有自郢来者辄有所述敬赋三诗
635480,白沙先生梦长髯道士手挈一囊贮罗浮山遗之纪之以诗黄子汉人奇其事继以长歌予见而复奇之赋此以广其志
518028,寄来绵衣宽博甚揣情因赋
513502,季弟克宽来京师适当端午西湖南海之莲尚未有花而予家盆池特出二萼化工之巧有若为予两人者设耳克宽南行有期辄用开宴以酬花因思予在西城时此花亦于五月盛开司寇陆公辈各赋一诗以为予中举之徵其后果然今十四年矣故诗及之
738239,思州行为镇远袁功懋赋
830560,大雪后偕苍虬入灵隐寺同赋
1183578,奉和圣制送张说上集贤学士赐宴赋得谟字
1087836,秀野以喜无多屋宇幸不碍云山为韵赋诗熹伏读佳作率尔攀和韵剧思悭无复律吕笑览之馀赐以斤斧幸甚 其三
841845,重九日为鲤南死后四十九日赋以志悼四首 其三
442171,即事有赋
721589,过翁子山房赋别
890703,赋惠计院允堂
148938,庚戌长至稚子杓觅诗赋一篇警之
554266,赋归二首 其二
263313,伯韦屡绘松柏应予之索，并赋诗，次韵呈谢
514965,幼幼堂歌为越中朱廷用先生赋
811434,镇平城北山曰蕉岭，又曰桂岭，书院所由名也，蕉桂故粤产，今此山乃无萌蘖之存，濯濯者虚有其名矣，若于书院补植以存名实，亦山城一故事也，因赋二诗，寄衡南大令
715004,过太原傅丈青渚宅赋赠 其一
938943,四月二日往檀林登车遇雨度鹅湖岭渐觉开霁一路晴快野花满山赋二绝 其二
1099722,春谷惠示榕桥精舍二十四诗借首篇韵赋一首
160399,九日席上赋得茱萸
559825,凝清卷为潘惟善赋
489800,正己亥冬客杭有客持毛袜去久不见还因戏赋以自解
677647,卧雪东林寺延望天池感赋五绝 其三
599035,上元曲李子藩席上赋 其四
963934,辛巳夏四月行西山欲赋未能也得曹泸南壬午冬留题上清诗因次韵 其一
416494,高阳台  周氏园本曾宾谷先生故宅。丘壑有致，花木便娟，今沦为学校，抚今感昔，为赋此解
1028752,比收张伯子尚书书报诸公有相招意因赋拙句 其三
747267,初冬避居东乡感赋 其二
436018,赋瓶中杂花七首 其一
515519,主一斋为都宪常熟徐公赋
1062532,游西塔寺分韵赋诗怀汪信民以渊明停云诗岂无他人念子实多为韵探得念字
304522,梅泉重赀助刊拙集感赋
737811,戊午腊之中旬大雪盈尺方臬使实村来留饮用聚星堂体赋诗
1224179,赋飞鸿送胡则大
910040,故谏议大夫鲜于公欲作新堂以传世谱名曰卓绝内相先生题其名曰蜀鲜于氏卓绝之堂某以此八字为韵作八诗盖鲜于公顷尝俾某赋之而三子以求其诗故原其古而美其今以颂美之 其二
369003,天香·程春庐驾部瑞鹊巢探春第一集分赋佛手柑
468373,辛亥冬十月九日从余兄原礼及陆好问刘主敬同登萝岩倚圣屏憩禅庵饮清凉池临筀竹湾谒龙湫玩仙李遂宿绝顶看月明日南俯大小车岩望东西二岭还北崖瞰石龟石笋复游眺久之乃下山所得奇胜赋长句五首 其一
1020677,有司欲取寺松供朝用感赋
1143659,予久客思归以秋光都似宦情薄山色不如归意浓为韵言志约金溧诸友共赋寄钱唐亲旧
455319,清平乐 岁杪得倚云女史绘赠《小梅窗填词图》更蒙蛰堪兄首倡《清平乐》诸吟侣迭相和赠铭感于怀赋此一并拜谢
1035256,南柯子/南歌子 即席次韵张太傅方为叔母生日赋
606658,山斗图为掌院李公赋
142236,用子蔺韵赋九日小酌
987325,次韵俞掞县尉见赠钓台赋梅
1123823,二十八日雪二十九日未已赋诗凡五首
547129,大伾山亭图歌为朱令君赋
718411,文与也为予写西洞庭图赋此以赠 其一
612077,冬夜读新会陈抑之李长度集赋寄
516359,禅舫为顺上人赋
274390,阮郎归·调友人，赋得搀字。俗谓以手相扶，以物相和，皆曰搀
356857,百字令·得少符吴中书，赋此答之，丁亥试灯日也
510195,半江十咏为谢德明赋 其六
1123849,蕃来湖州连与叔骥和叔明父叔宝相从又从和叔获见先给事遗墨辄赋二首
508629,竹雪轩为陆元泰赋
267643,三姝媚·瞻园约为西山之游，寒阴殢人，屡阻携屐，雪后引眺，赋此代简
378102,为邓子煇赋拙斋
413409,香港高润霞女史翩然来访得奉神光未尽款曲别后来书殷殷存问感此隆情赋诗致意
831777,台中遇郑君贻林及同社庄君太岳赋赠
294885,陈肩苍以画意徵题择其近怀古者赋之箕山秋月
561128,郡学罗守新肄乐请予观赋
118763,赋三绝句·今岁初辛日正三
488446,赋得西枝室
627737,平洲莫即秋索字馈兰为谢因赋答
423090,锁阳台 蒙安自沪上寄声存问，赋此报?，兼抒近怀。征尘未浣，仆御在门，命笔黯然不自知其言之掩抑也
963146,小雪前三日钟冠之约余侍老人行山舟发后洪入杜坞自郑盖庵过阆山趋翔凤山菁山遍览杨坟秀园遂至何山道场山乘兴薄吴兴访玉湖书院水晶境界而归自戊子至庚子阴晴相半胜处辄徘徊赋诗饮酒伟哉观也数诗见后 其二 宿资福小阁次梁间韵
548605,丙午十一月内侄张世卿茂才宅桂花盛开因赋 其二
1221635,拟赋桃灯杖 其二
382778,夏日山居周砺斋太史奉使周藩过邑见访赋赠
673083,画菊与邹汝愚同赋
839548,甲寅立春前一日，庞聱叟招饮，座中九人，合六百十三岁，醉归赋四绝句简谢 其四
682471,将游燕感赋
1248318,舟中闻笛与张文学同赋
909979,同德麟仲宝过谢公定酌酒赏菊以悲哉秋之为气萧瑟八字探韵各赋二诗仍复相次八韵某分得哉萧二字 其三
1065071,崇山堂五咏为通判大乐张侯赋 其一 静隐堂
267897,山腴过许近作赋以报之
458538,予分配在岳化，暑假至其地，正肖健所居也。与姑母饭于其家。归车中赋此，记所与共语意也
1093577,坐客竞置殽核因赋示尹子潜
400257,减字木兰花 为某君嘉礼赋
