958484,郡治西厅锦被花不为治架每花开覆地而红或缘他木以升予分其本植草亭之东家僮相与栽木于地高七尺许上布圆竹复破竹交加之外出四檐如屋之状通小窗侧户以窥视而出入馀皆花地下置一榻一几可以独酌作诗以记之云
1127785,老范善画牛有学为八牛图者一犊在前又置一童持竿牧其后
440245,菩萨蛮 午休购得茉莉一株，入门置一角，旋踵即忘，花气则藏而愈烈
1001303,老范善画牛有学为八牛图者一犊在前又置一童持竿牧其后 其一
458227,熊哥自作一菜，盖凉拌黄瓜、粉丝、蛋皮，拼置一盘。命碰壁名之。碰壁曰，是皆村野物也，即名三家村可矣，因为书此
1001302,老范善画牛有学为八牛图者一犊在前又置一童持竿牧其后 其二
348304,元舆怜我复有漳南之行以曲局不可出遂置一樽托公域弟酌发
1156659,慕巢尚书书云室人欲为置一歌者非所安也以诗相报因而和之
28234,闲书·病学高僧置一床
214022,酬俞秀老·洒扫东庵置一床
148610,老范善画牛有学为八牛图者一犊在前又置一童
1050439,元舆怜我复有漳南之行以曲局不可出遂置一樽托公域弟酌发眷眷之情于此可见矣以四韵谢元舆并呈公域弟
923400,暇日游逍遥台睹南华塑像独置一榻旁无侍卫前无香火对之歆然起怀古之思因抒长句一千四百字题于台上
183505,暇日游逍遥台睹南华塑像独置一榻旁无侍卫前
