815662,别徐郎子昆季同学
165089,送聂侍郎子述
972682,呈赵叔侍郎子直二首 其二
987971,送聂侍郎子述 其一
1001636,陈伯英侍郎子也广帅辟入幕既至参差帅别思所以处未定间余载酒相过
859932,再和陈侍郎子知丞寄桂香酒新到又令孙司户出柑为劝
538673,读枢筦集答寄蔡侍郎子本
118572,曹郎子文赴山阳令
987970,送聂侍郎子述 其二
208739,寄王承可·籍甚王郎子
65600,竹枝词·郎子别时秋月明
256773,郎子云酒熟同李茂卿史正之豪取不许
1043669,致斋中太一宫见屏风有唐贤和常舍人诗因次韵寄子瞻内翰子由侍郎子开舍人穆父待制数公皆尝祠太一也
738098,别徐郎子昆季同学 其一
593943,送朱中郎子得守怀庆次其留别韵二首 其一
203933,再和陈侍郎子知丞寄桂香新到令孙司户出柑为
738099,别徐郎子昆季同学 其二
521470,张廷肃宪副致仕归中途得二郎子德捷报
736107,题张侍郎子大朴园图
435164,郎子云酒熟同李茂卿史正之豪取不许
593944,送朱中郎子得守怀庆次其留别韵二首 其二
239487,采桑子·无双谁似黄郎子
1123825,呈赵叔侍郎子直二首
95640,呈赵叔侍郎子直·忆昨才闻召节趋
921657,次韵王郎子立风雨有感
1006477,蒙恩除吏部侍郎子侄以诗相庆
1202991,贺新郎 子昭见和再用韵
924228,曹郎子文赴山阳令
695720,送朱中郎子得守怀庆次其留别韵二首
231690,蒙恩除吏部侍郎子侄以诗相庆
368458,赋诗·郎子风流栖枳鸾
972683,呈赵叔侍郎子直二首 其一
95392,呈赵叔侍郎子直
148419,陈伯英侍郎子也广帅辟入幕既至参差帅别思所
918707,如梦令 次韵吴郎子信残春
1126128,送聂侍郎子述
86845,杂书·六郎子晋后身
