1223218,次韵王参议寄上京胡安常诸公二首 其一
632580,赠陈令公二首 其一
544047,寄宫詹陈公二首 其一
631257,秋日游白鹿洞时督学邵公太守伦公重修书院赋呈伦公二首 其一
1032096,送淡公二首 其一
486616,寄怀大司马郭公二首 其一
924824,试制举人呈同舍诸公二首 其一
854452,挽宋尚书余公二首 其一
850299,初赐幡胜戏和诸公二首 其一
567914,鹧鸪天 闻张子荩捷报呈学使公二首 其一 有序
610155,赠督学潘完朴公二首 其一
618348,寄谢高硁斋相公二首 其一
1240339,次韵蔡彦文寄谢省院诸公二首 其一
545032,奉东师相赵公二首 其一
569437,再呈袁公二首 其一
1038370,送钤辖馆使王公二首 其一
915845,瑞香盛开呈益国公二首 其一
946622,挽处士富公二首 其一
914161,后一月再宿城外野店夙兴入城谒益公二首 其一
596322,挽少司寇葛两溪公二首 其一
1180707,寄澜公二首 其一
982473,次韵裴秀才上太守向公二首 其一
961415,和荆公二首 其一
1038079,答青州相公二首 其一
1044524,赠蕲簟与潞公二首 其一
745978,哭故相王文恪公二首 其一
1046868,挽资政殿学士吏部尚书曾公二首 其一
633061,重入山寄木公二首 其一
1046772,挽中书侍郎懿献傅公二首 其一
960027,栖真纪胜赠立公二首 其一
586625,别族祖瀚公二首 其一
1224515,哭御史王公二首 其一
544984,怀大中丞滕公二首 其一
602977,答苏秀才履周愚公二首 其一
818998,赠任公 二首 其一
606762,答赠少司马陈公二首 其一
919801,挽故开府节使观文赵公二首 其一
1088624,挽梁文靖公二首 其一
545649,寿相国赵公二首 其一
606427,答少司马陈公二首 其一
546142,题祝生无殊潇湘坐同司马汪公二首 其一
972874,奉寄子耕簿公尊兄兼呈德化令君丞公二首 其一
667918,奉别大司空顾公二首 其一
971044,以笋送诸公二首 其一
1180909,将入匡山别芳昼二公二首 其一
1250083,次韵监郡鲁公二首 其一
651335,董公二首 其一
561519,居守京城赠同事靖远伯王公二首 其一
1173255,陪李七司马皂江上观造竹桥即日成往来之人免冬寒入水聊题短作简李公二首 其一
886690,吊岳文二公二首 其一
1163412,寄匡阜诸公二首 其一
438083,代王簿上梁孟容副公二首 其一
545412,奉赠大司徒蒲坂杨公二首 其一
1003892,挽桃源使君虞公二首 其一
804738,读书东林书院追怀邵文庄公二首 其一
953677,纪德陈情上致政太傅杜相公二首 其一
866481,见张魏公二首 其一
577326,试院夜坐偶成柬同考诸公二首 其一
473355,哭袁相公二首 其一
610151,呈赠大观察汪云阳公二首 其一
865203,再和宰公二首 其一
939894,送杨侍禁兼寄颜黄二公二首 其一
1234163,赠别夹谷公二首 其一
1192777,赠苗端公二首 其一
1049512,寄上范蜀公二首 其一
509134,寿大司寇杨公二首 其一
1072276,携家从允迪借居鸬鹚源上沈必先侍御有诗宠其行次韵并呈二公二首 其一
1192465,罚赴边上武相公二首 其一
676758,送华从化省谒还章丘兼呈东鲁诸公二首 其一
637324,奉都宪彭公二首 其一
632280,寄心公二首 其一
932795,雨中别同朝诸公二首 其一
848156,呈寇公二首 其一
479561,通州相城呈同事诸公二首 其一
1072412,悼忠显刘公二首 其一
801923,感怀和周铁门韵兼呈汝南公二首 其一
1213129,次韵王菊圃朋益相公二首 其一
495226,寄怀徐闇公二首 其一
663587,舟泊清江有怀交游诸公二首 其一
591658,豫章留诸公二首 其一
594412,寄冢宰王公二首 其一
1046774,挽右光禄大夫知枢密院事赠开府仪同三司孙公二首 其一
1046776,挽司空文定张公二首 其一
1044528,龙门秋日上潞公二首 其一
1043426,次韵韩康公二首 其一
865087,重九考罢试卷书呈同院诸公二首 其一
1057131,挽王元之相公二首 其一
544022,奉寄司成许公二首 其一
914694,挽封州太守赵次公二首 其一
801066,洞庭山馆呈司寇东海公二首 其一
606848,答大中丞陈公二首 其一
1057833,和邓慎思重九考罢试卷书呈同院诸公二首 其一
434786,上南京留守完颜公二首 其一
606835,答大宗伯陈公二首 其一
1061705,挽赠开府仪同三司朱公二首 其一
556918,中秋无月呈席上诸公二首 其一
1192467,罚赴边有怀上韦令公二首 其一
