934933,九月七日子坦子聿俱出敛租谷鸡初鸣而行甲夜始归劳以此诗
81145,甲子秋八月丙辰鸡初鸣时梦刘韶美示诗八篇高
930367,丁巳正月二日鸡初鸣梦至一山寺名凤山其尤胜处曰咮轩予为赋诗既觉不遗一字
935427,甲子秋八月丙辰鸡初鸣时梦刘韶美示诗八篇高古可爱明旦作此诗志之
928252,十月二十八日夜鸡初鸣时梦与数女仙遇其一作诗示予颇哀怨如人间语惟末句稍异予戏之曰若无此句不可为神仙矣其一从傍戒曰汝当勿忘此规作诗者甚有愧色予颇悔之既觉赋两绝句以解嘲 其一
928253,十月二十八日夜鸡初鸣时梦与数女仙遇其一作诗示予颇哀怨如人间语惟末句稍异予戏之曰若无此句不可为神仙矣其一从傍戒曰汝当勿忘此规作诗者甚有愧色予颇悔之既觉赋两绝句以解嘲 其二
1118385,十月二十八日夜鸡初鸣时梦与数女仙遇其一作诗示予颇哀怨如人间语惟末句稍异予戏之曰若无此句不可为神仙矣其一从傍戒曰汝当勿忘此规作诗者甚有愧色予颇悔之既觉赋两绝句以解嘲
928227,九月十四日夜鸡初鸣梦一故人相语曰我为莲华博士盖镜湖新置官也我且去矣君能暂为之乎月得酒千壶亦不恶也既觉惘然作绝句记之
80988,九月七日子坦子聿俱出歛租谷鸡初鸣而行甲夜
84464,丁巳正月二日鸡初鸣梦至一山寺名凤山其尤胜
81729,十月二十八日夜鸡初鸣时梦与数女仙遇
80979,九月十四日夜鸡初鸣梦一故人相语曰我为莲华
81728,十月二十八日夜鸡初鸣时梦与数女仙遇其一作
12514,鸡鸣曲·鸡初鸣
84766,反感愤·膊膊庭树鸡初鸣
