1001014,曾宏甫见招看海裳而郡城新有更初阖扉之令予闻鼓亟归一诗呈宏甫
1206909,满江红 次白君举州倅所寄韵君举三十年前友屡示佳制读之令人起敬比以簿书倥偬不遑酬答闻改除天台恐因得簪盍于惠泉之侧用以叙怀
1112005,三用喜雪韵呈同官诸丈不敢辍禁物之令也二首
284405,郁达夫先生授书安大，闻有通缉之令，匆促出奔，诗以送之
1075686,客有为予言笋不可食食之令人瘦者戏作二绝为解嘲 其二
57670,送李济之令泰和
184784,曾宏甫见招看海棠而郡城新有更初阖扉之令予
541659,送米仲诏之令铜梁
1048640,送周广之令桂阳
890556,三用喜雪韵呈同官诸丈不敢辍禁物之令也二首 其一
1065216,余日渡海即号甘露灭所至问者尤多时作偈答益不解乃告之曰涅槃经云甘露之性食之令人不死若合异物亦能不死维摩经亦曰得甘露灭觉道成又为之偈
133931,安之令子河阳官舍作蛙乐轩安之有诗寄题辄敢
1248731,仆尝夜梦从彦成饮彦成曰此荔枝浆也饮之令人寿子能为我赋之当赠三百壶予自口占一诗觉乃梦也及会玉山闻彦成酿酒果名荔枝浆以梦白之不觉大笑玉山曰君当书此诗吾当与子致酒以质所梦因莞尔书之彦成见之必更一笑也
869432,安之令子河阳官舍作蛙乐轩安之有诗寄题辄敢继和
664739,送吴慎之令铜梁
194524,之令也·不用忧他道路难
575109,辞巡按发帑之令发书有作呈邑中长贰诸君子
345040,送周广之令桂阳
413494,郁达夫先生授书安大，闻有通缉之令，匆促出奔，诗以送之
1120792,客有为予言笋不可食食之令人瘦者戏作二绝为解嘲
521295,送汪进之令永嘉
1142367,高贤孺厚斋使君之令子自番来霅访明亲旧此意甚古岁辛亥余识厚斋金陵通守之舍堂陪朔斋刘公饮海棠花下俯仰四十五年追念悽然
631021,乙巳冬闻沙汰之令
1075685,客有为予言笋不可食食之令人瘦者戏作二绝为解嘲 其一
336796,客有为予言笋不可食食之令人瘦者戏作二绝为解嘲
1036010,阮郎归 一年三过苏。最后赴密州时。有问这回来不来。其色凄然。太守王规父嘉之。令作此词
1220295,送吾安之令渤海县
607973,舟返三河见诸得举者归内有黄生继章乃宪副及泉公之令子予之姻家也喜而有作
477563,送李济之令泰和
890555,三用喜雪韵呈同官诸丈不敢辍禁物之令也二首 其二
194523,三用喜雪韵呈同官诸丈不敢辍禁物之令也
