415813,王克宽老以怀乡诗见示依韵答之五首选二 其一
597278,中秋宴集洪山寺林梅墩大参以告不果作诗见示依韵奉答
429096,蜷公以癸丑岁除都门感事二首见示依韵奉和二首 其一
266729,惜余春慢·六禾丈以留春词见示，依韵奉和
687920,姚齐州有爱子之戚书闷诗见示依韵赋慰
533658,桢伯以泰泉先生梦游罗浮之作见示依韵寄上
415814,王克宽老以怀乡诗见示依韵答之五首选二 其二
635897,姚齐州有爱子之戚书闷诗见示依韵赋慰 其二
410422,吴寅斋口知申报罢后，以陶然亭春眺诗见示，依韵和之
637280,王佥宪足梦中诗见示依韵答之
635896,姚齐州有爱子之戚书闷诗见示依韵赋慰 其一
173369,刘行简以自题所车墨竹诗见示依韵酬之
533735,陈亮夫以尊公司徒韶石诗见示依韵奉怀
863043,刘行简以自题所画墨竹诗见示依韵酬之
803634,闰中秋谒翁叔平先生，归后俞调卿以所和诗见示，依韵奉简二首 其一
803635,闰中秋谒翁叔平先生，归后俞调卿以所和诗见示，依韵奉简二首 其二
835396,念奴娇 其一 雷仲宣庚子感怀，次坡韵见示，依韵奉答
296676,喝火令·鹣庵以寄鹤亭词见示，依韵赋赠
292168,念奴娇·雷仲宣庚子感怀，次坡韵见示，依韵奉答
433803,王克宽老以怀乡诗见示依韵答之五首选二
420684,喝火令 鹣庵以寄鹤亭词见示，依韵赋赠
826213,惜余春慢·六禾丈以留春词见示，依韵奉和
287806,蜷公以癸丑岁除都门感事二首见示依韵奉和
552307,闰中秋夜田御宿大参邀饮映碧园樊淑鲁民部以微恙未与书二绝见示依韵答之
429097,蜷公以癸丑岁除都门感事二首见示依韵奉和二首 其二
635898,姚齐州有爱子之戚书闷诗见示依韵赋慰 其三
297606,吴寅斋口知申报罢后，以陶然亭春眺诗见示，依韵和之
431821,蜷公以癸丑岁除都门感事二首见示依韵奉和二首
811834,闰中秋谒翁叔平先生，归后俞调卿以所和诗见示，依韵奉简二首
635899,姚齐州有爱子之戚书闷诗见示依韵赋慰 其四
863803,仲咸因春游商山下得三怪石辇致郡斋甚有幽趣序其始末题六十韵见示依韵和之
843904,念奴娇 雷仲宣庚子感怀，次坡韵见示，依韵奉答
314596,王克宽老以怀乡诗见示依韵答之
752922,吴辟疆以用韩退之山石韵见示依韵酬之
