808853,题莫郘亭藏文衡山西湖图
458280,得藏刀一柄，车中戏赋与静玄兄看
1122818,大龙山五咏用家君所和胡别驾韵 经藏
160490,同阵太丞游龙兴寺经藏院
57813,题蔡挥使所藏林良双鹊
1102572,题刘同知所藏春山访隐图
1247718,题璋上人所藏温日观墨蒲萄
176984,冬寒客怀·争锥无意志摧藏
129203,次韵才老·藏拙欲分萝月阴
421040,齐天乐 题屈劭宣家藏翁山先生手卷
825589,题济宁李一山所藏唐拓武梁祠画像
405362,自题梅苑藏印二首
858699,华藏寺会故人
170259,送郑左藏·还家香稻荐新红
297452,题画梅，赠吉村长藏君
915932,题眉山程侅所藏山谷写杜诗帖
288902,题师郑前辈所藏子潇先生诗册
826636,菩萨蛮·集龙藏寺碑字
100088,王伯敭所藏赵昌花四首梅花
1078340,题唐氏所藏崔白画雪中山水
408333,得余漱石书知病中犹尽力照料留锡藏书并写寄目录喜极寄却二首 其一
677168,娄塘过杨娄南故居感赋娄南为先君旧识有昆山巧石尚藏余家今其地已半属他姓且别构园亭矣
1210546,题鹤亭所藏马图
195584,题东玉师府所藏潇湘图
318428,迎春乐·题汉墓砖人物彩绘，波士顿美术馆藏
915888,题文发叔所藏潘子真水墨江湖八境小轴 其二 武昌春色
568899,穿率然洞入小云门望山顶却与藏经阁背隔水相唤
1015271,留别陈藏一
694135,初至龙兴寺斋宿赠无为禅师兼东海藏主二首
33138,新月·云际婵娟出又藏
348900,净明寺阅藏经
1028162,送赵伯藏添倅永嘉 其一
837533,瑶华·刘健之得杨幼云、张叔宪、李亦元所藏蜀石经，又续收陈芳林、陈颂南两本，自署所居曰蜀石经斋。此外，见著录者仅黄松石、赵晋斋二家，不知尚在人间否。物聚所好，剑合会有时耳，词以祝之
419253,石湖仙 为吷庵丈题所藏大鹤山人手书词卷
384443,题王侍御敬止所藏仲穆马图
439310,莲叶观音恩禅师所藏同路宣叔赋
101238,刘景文家藏乐天身心问答三首戏书一绝其后
700570,宗伯邵公寿藏诗四首
471111,和饮酒二十首初夏天气微热方不欲饮偶龚仲和邀看园中新绿出所藏名酒意甚乐之次日捉笔和渊明先生饮酒诗数篇与索一樽独酌会雨窗无事遂尽和其韵（录十五首） 其十四
289847,金菊对芙蓉·题霜根所藏王晋卿山水轴
247456,虞美人·芙蓉藏萼谁同老
374174,寄宝藏主·识尘消落尽
48286,题沈启南所藏郭忠恕雪霁江行图真迹
932584,居室甚隘而藏书颇富率终日不出户二首 其一
101221,书刘景文所藏王子敬帖绝句
156213,题王任所藏林逋索句图
168905,清平乐·藏藏摸摸
168905,清平乐·藏藏摸摸
684956,书陈思孟家藏古画二幅 其一
125450,偶作·衰翁好藏密
924323,藏菜
744761,孟蜀石经传世已希闻程芳林明府藏有左传残本顷偶过茂堂段先生斋适见此册于案头急假归摩娑数日字较唐刻稍小而结体端劲仍不让焉册尾有翁阁学诗跋因追和其韵兼呈段先生
499237,古囊寿藏 其一
521282,题史引之所藏长江六月图
330839,过丰城·匣藏千古秘潜虬
860090,跋大庾令赵宗华时棣藏诸公帖
113781,寄李子先·摧藏褫冠冕
503245,题西村陈氏所藏高待诏水墨四幅 其三
163310,仙迹岩·地秘岩藏骨
555121,题吴继学先生家藏边景昭花鸟图五首 其四 败荷四鹡鸰
740780,题家藏仇十洲画马
791647,乱后怀外家更生斋藏书处
793101,家藏旧画效前人论画绝句各系一诗 其二十三
946697,端午洪积仁召客口占戏柬薛仲藏
1191965,书化度藏院壁
825588,喻兆蕃出世所藏高宗纯皇帝书画小册敬题
886106,郴江百咏 其五 藏春亭
1015817,阅藏后题智證庵壁
1049679,次韵苏子由咏李伯时所藏韩干马
1003975,上后乐刘先生左史十首用襄阳诗两句行藏坚晚节进退法先民为韵 其一
292867,街头焚书数日，亦尽肩出所作所藏参与盛会
863191,游天圣邂逅正师知藏作诗赠之
781126,寄和常理斋四弟二十一首 其七 来札嘱家有藏书许借观且代为收贮无徒饱蠹鱼意甚高矣然亦何遽少什袭耶愿仍留百城为将来骥子之资且上慰老伯倚望万里之外不时把观常如君环左右也因申谢之
322959,夜宿下沙步有小浦藏舟于口惧有风
451965,丙戌清明后一日京城小雨夹雪甘棠诗社邀游玉渊潭赏樱花相约步海藏楼韵 其二
350321,点绛唇·戏咏迷藏
844487,金缕曲 题耆寿民见山楼藏书图
1086594,大龙山五咏用家君所和胡别驾韵 其一 经藏
739739,秋晚小集寿门出藏茗洞庭春饷客分体得六言 其二
972271,无尽藏境界
739738,秋晚小集寿门出藏茗洞庭春饷客分体得六言 其一
479211,题陆廉伯庶子所藏墨梅
560701,题奚彦礼所藏画四首 其一 凤凰
319863,游灵谷寺·松杉藏古寺
242301,寄陈藏一·万人如海亦纷纭
552692,题广信府李经历仲谋所藏画 其三 抱琴图
162095,藏六庵·莫言藏六便忘筌
162095,藏六庵·莫言藏六便忘筌
118620,三绝·井水中藏东海鱼
1027290,题汪季路太傅所藏龙眠阳关图 其二
78433,自儆·牛解谨藏刀
354783,同游西园·地禁蛟龙藏玉宇
1213015,题吴桂芳所藏张即之墨迹
286123,咏法藏寺古松
408334,得余漱石书知病中犹尽力照料留锡藏书并写寄目录喜极寄却二首 其二
1252044,送天宁谧藏主回净光
702578,题鲍栗之通判所藏四景牛
453097,丙戌清明后一日，甘棠诗社玉渊潭樱花雅集，相约步海藏楼《樱花花下作》韵 其二
110653,藏云锁·灵根郁三素
402802,八声甘州 蕙师为徐积余丈题所藏临安砖塔藏经
402802,八声甘州 蕙师为徐积余丈题所藏临安砖塔藏经
491608,题曾郁文所藏山水小景
555235,己未九日乌山登高次刘静常郑藏庵东庵韵 其二 次东庵韵
1090433,目痛废看藏经
504631,胡君济源家藏钱舜举所画俾予题之按山水形胜人物草木凡图中所具者莫不曲尽微妙大率吴中佳处沉吟细玩若湖山之在目遂成长律十八韵以写怀乡之意云
821302,西江月慢 月色新得寒琼遗迹八幅，皆设色花卉，秘藏箧中，但述其事。以自绘梅花笺乞题
403966,玉楼春·丙辰春，集右军圣教序为苏乾英教授治藏书印
695094,和卢方伯暮春见访郊居出示家藏二首
157863,帅安屡书有相访之约且求予文集知予有藏山之
1234612,用欧阳文忠公神清洞韵题罗士鼎所藏米元晖神清洞图
222863,寄思溪老藏叟珍上人
1218469,题张彦明所藏剪纸惜花春起早图
384119,爱山中丞招饮节署，泛舟珍珠泉，并阅所藏古名人书画
1231461,题曾省元藏温日观葡萄后用温师韵
351885,题断堤寺·堤边杨柳密藏鸦
872535,题危见心所藏陈常庵水月障及松鹤芦雁各一首 其一
353197,龟巢·藏六自为巢
709945,寓华林寺飓风欲归不果与天藏上人
870297,县斋十咏 其四 藏书阁署群籍也
1096475,送善藏主出岭 其一
745100,英煦斋师所藏天启三年小铁斧歌
1141977,题了堂所藏郭天锡作乱山烟雨图
449774,为群中网友题藏头小诗九首以为乐 其四
120744,梁元帝·慢藏已重阿琳忧
122722,重九日行营寿藏之地
793013,藏兵洞
466531,甘棠社邀赏玉渊潭樱花步海藏楼诗韵四首
485882,题高理瞻所藏小景图
1132998,题赵希贤所藏墨竹 其一
493162,题萧曙所藏曾同可画水四首 其三
1230672,题曾彦明所藏雨竹
1003968,上后乐刘先生左史十首用襄阳诗两句行藏坚晚节进退法先民为韵 其四
413375,写藏书藏碑目录竟各题一绝句 其一
413375,写藏书藏碑目录竟各题一绝句 其一
402871,疏影 吴湖帆属题所藏宋刻梅花喜神谱，为闺中奁物
826486,摸鱼子·泛西溪至交芦庵，观所藏西溪图画。是日谒樊榭先生与月上夫人栗主，因用樊榭题西溪卜居图韵
363292,题萧梅初旧所藏钱塘王畿图
813587,同西涧藏公重过野寺茗饮
658639,天昭御史家藏王朋梅画屡失而得
292519,渔家傲·束发曾闻龙藏寺
825697,又为思缄题所藏二帖 其二
206837,送薛子长·藏冰待炎威
351499,久客感怀·自笑行藏愧古人
1064210,晚坐藏胜桥望石门
663639,藏六轩夜别东卿
65069,题豫章镏孝纪所藏
1003972,上后乐刘先生左史十首用襄阳诗两句行藏坚晚节进退法先民为韵 其十
492535,题前崇文直长赵居敬令子所藏翰林诸老诗卷后
547253,再至长安见无弦上人移住法藏庵因听弹琴赋赠
511075,晚酌示藏用诸友 其四
905446,至性灵迂僻学术空虚幸逢好古之君获在藏书之府惟无功而禄重招髦彦之讥而多病所萦实喜优闲之任居常事简得以狂吟因成恶诗十章以蓬阁多馀暇冠其篇而为之目亦乐天何处难忘酒之类也尘黩英鉴幸赐一览下情不任兢灼之至 其四
186675,前日从赵漕饮因得遍观所藏书帖之富既戏成
170546,邴原·无数潜龙不肯藏
531656,题西湖十景邹和峰家藏戴文进画巨浸秋波 其六 江山平远楼避暑六言
825313,海藏楼杂诗 其十三
1005845,往时予有湖湘之游同年黄东发提举以清江楮衾赠别藏之四年矣山房夜寒覆之甚佳乱后不知东发避地何处作此拟寄
1028247,题家藏二画 二虎
262610,春日携李眉山彭湘南王兰谷藏上人重游
695817,题刘仲修所藏杂画四首
489783,露筋庙书谢琼树所藏米南宫帖后
1085295,予还自武林葺先人弊庐净扫一室晨起焚香读书于其间兴至赋诗客来饮酒啜茶或弈棋为戏藏书数百卷手自暴之有小园时策杖以游，时遇秋旱驱家僮浚井汲水浇花良天佳月与兄弟邻里把酒杯同赏过重九方见菊以泛觞有足乐者每览镜见苍颜白发亦聊自叹也作小诗十五首 其十二 赏月
748455,张石舟与何子贞既构顾先生祠刻亭林年谱成因得睹蔡小石司业家藏万年少秋江别思图图作以赠亭林者也石舟与子贞各摹其画及识语并程氏易畴题跋装为卷石舟手书亭林赠万举人诗又所作次顾韵题此图诗补成顾祠秋祭诗并录于卷属赋诗得五言一首
1120006,赋虚谷黄子羽所藏吴山西墨兰三章
211391,宫词·三伏金藏暑正隆
1058181,文湖州作山水横轴吴希全家藏其子诚伯求苏养直赋诗语特奇妙遂用其韵同赋
1210279,东坡书蔡君谟梦中绝句二放营妓绝句三虞伯生题四绝于后真迹藏义兴王子明家要予次韵凡九首 其七
253435,题张信道所藏李元素淮山清晓图
815687,检藏书感赋
930284,题张几仲所藏醉道士图二首 其二
1083602,侄端旻示游浦江花藏寺诗且道皎老相问意因次韵并烦为简皎公禅师
1204258,满庭芳 藏头拆字
423445,写藏书藏碑目录竟各题一绝句 其二
423445,写藏书藏碑目录竟各题一绝句 其二
354796,藏舟浦·花明肥上藏舟浦
354796,藏舟浦·花明肥上藏舟浦
1077567,唐植甫左司许出示所藏红丝砚辄成短歌奉呈并简顾子美
748642,魏太和铜熨斗歌沈西雍太守所藏
182470,和路枢·进退行藏合道枢
349250,寄曹载德·晚途无复计行藏
577206,题襄城伯李公所藏草虫手卷
320542,累约慎思视事今已入境盘桓不进欲以十四日交承又云六甲穷日戏作藏头
920952,和子由送将官梁左藏仲通
348208,题潘温叟家藏戴牛画卷
564621,横山八景 其五 藏春坞
1090146,题潘德久所藏杨补之竹梅
480979,题普春上人所藏谢孔昭画
129314,春日杂兴·渔翁樵叟自行藏
905637,藏六庵
375584,送王常熟左藏
1072018,题孙子绍所藏王摩诘渡水罗汉
1020250,送孚藏主归江西
738629,绣谷先生有所藏宋椠丁卯集亡去二十年令嗣瓯亭游京师重购得之以归同人赋诗为记其事
613039,槛砌藏云
746671,题金冬心徵君临东汉华山庙碑为武筠庄所藏黄小松旧藏本
746671,题金冬心徵君临东汉华山庙碑为武筠庄所藏黄小松旧藏本
692433,题凌士昌所藏张子厚山水
1027289,题汪季路太傅所藏龙眠阳关图 其一
36668,奉同颜使君真卿开元寺经藏院会观树文殊碑
81528,书叹·三代藏宝器
294096,木兰花·冻云珍珠藏芳韵
793080,家藏旧画效前人论画绝句各系一诗 其二
38531,谢阴符经勉送藏休上人
341325,晓坐当湖德藏寺
793095,家藏旧画效前人论画绝句各系一诗 其十七
183490,华藏竹·竹性本孤洁
921886,刘景文家藏乐天《身心问答三者》，戏书一绝其后
375831,藏云·层层叠叠烂银堆
1002103,题游德昭寿藏名曰复庵
173170,观僧作藏会·推崇社首劝来人
748682,黎召民仪部以其先大父楷屏先生所藏玉板十三行帖见示并赋五言古诗要余题识仪部少孤尝值邻火母冯太夫人仅挈此帖出余感其事因赋长句以书帖后
1016217,成都信藏主求送行 其一
331113,秀香堂·山远江深胜地藏
100851,读道藏·嗟余亦何幸
888948,藏云寺有海棠一树在僧舍后竹篱荆棘之间余因劝耕偶见之遣兵移植于堂下仍赋一绝以纪之
756409,秋夜读道藏有作
1053692,子明棋战两败输张遇墨并蒙见许夏间出箧中所藏以相示诗索所负且坚元约
1224533,奉皇姑鲁国长公主教题所藏巨然江山行舟图
224337,题郑柏窗所藏莲社图
1234853,寄希白藏主
379426,送化士·袖里深藏大吉山
819964,乙亥秋九月至旧京视散原先生日与心畬叔明立之伯夔君任羹梅过从寥志强志贻先询先诸弟自津沪来旧藏五十馀年陈酒由杭至京连日聚饮赋诗属和 其四
837413,题林镜湖家藏花卉册
1148266,柳藏经二绝句 其二
1234537,牧牛去题袁庆远经历所藏画
1043490,送乔左藏自太常博士除知施州
1133277,廉公子家藏元石名武夷春雨
402907,南浦 题药农兄去非草堂所藏春水居图卷，用玉田原韵
1201290,如梦令 继重阳韵藏头
115647,感遇·腹心主包藏
349045,有感之作·吏隐声藏雾
1095883,云天瑞所藏李唐风雨图
353272,绝亦次韵·贤者行藏只委天
381956,题刘平叔所藏辋川图
747437,刘宽夫侍御藏沈启南画像绝类伯言戏简
372769,再答·拙者奔驰智者藏
364981,杂事诗·载书新付大司藏
789561,酹江月  葛壮节公宝刀歌公讳云飞，官总戎，道光辛丑抵英夷于舟山死之，建祠甬东并藏所遗宝刀二，其一曰成忠，乃殉节时手握不释者
436350,龙门八题 其五 神谷藏春
341567,经藏·万法俱一空
828449,伯夔以所藏惜抱典试鲁湘日记册属题
598078,和卢方伯暮春见访郊居出示家藏二首 其二
311417,鹧鸪天·奉题皓白所藏梨洲先生画像
286816,感赋·七尺昂藏原不伦
1061462,书性之所藏伯时木石屏 其三
273046,舟中读海藏楼诗同韩树园
679194,送宁藏主东归
835805,贺新凉 其一 题徐积余太守所藏渊雅夫妇合璧书前后赤壁赋，用易硕甫观察原调
451964,丙戌清明后一日京城小雨夹雪甘棠诗社邀游玉渊潭赏樱花相约步海藏楼韵 其一
507386,题赵尚书所藏花鸟四首 其二 哺雏雀
282996,满江红·外族周季况先生以旧藏新莽始建国二年镜见付
485684,观王生所藏王维画
1014022,寄予藏主
1241022,题平章公所藏天马图
825934,二月廿四日归海藏楼花已半残 其二
441164,癸巳九日登黄岩方山用海藏虎坊桥独坐韵
594015,九日登永上人藏经阁同沈比部箕仲沈虞部少卿陈博士伯符分得开字时王宗鲁张文起二中郎不至
695837,题关元诚所藏赵观四景画
1130084,病中四绝句呈刘景文左藏
303753,琐窗寒·题吴湖帆藏隋董美人墓志
504075,题胡长史所藏风晴雨嫩墨竹四首 其三
179066,题王顺伯秘书所藏兰亭修禊帖
140940,至华藏寺先呈琏长老
113934,谢胡藏之送栗鼠尾画维摩
455696,观荣宝斋藏李晴江风竹图依其题诗原韵 其四
503131,题高牧隐家藏西园雅集图
633794,甲寅春二月与蜜在慧均四藏自显超汉铁关洞开瓶出法敌不息漪文始十靖一挂云诸子从燕台南归取道泰安登岱岳所经胜槩矢口咏歌共得五言近体十二章以志一时 其四 晒红石
452707,西藏杂诗之米林县藏医学校
452707,西藏杂诗之米林县藏医学校
409778,范之以先德尚书公三万卷楼藏书图属题，敬赋一律
1114990,乐庵所藏柳影及松梅二画因作二绝摹作砑花笺至今盛行于吴门
415929,为王毓骅学长题所藏抱琴应邀图
707863,苏幕遮 其二 彭湖舟中，题弘载所藏吕半隐画册
784277,藏上人寄诗招游西涧以事不果赋此却寄 其三
1125871,题潘温叟家藏戴牛画卷二首
525820,宗伯邵公寿藏诗四首 其一
189448,题汪功父所藏画卷
537750,尤子求尝自言其手画苏长公后赤壁赋甚精索余书赋其尾未果今年冬子求忽使阿獠携此卷来乞二金为腊夕之资余如数与之还其卷为书赋且题一五言律子求可付虎儿善藏之勿售非其人也
413559,以仅存诗稿付明道收藏，系以长句
423069,永遇乐 仲琴丈属题陈恭甫旧藏武梁石刻
1234314,次韵杜浩卿咏所藏研
1207488,洪武庚申夏四月登玉山顶时雅上人适迁华藏于塔院历览终日而返是夕宿友人家灯前闻雨援笔有赋
918321,曹主簿泾自卜寿藏追范石湖韵谨依虚谷使君例各一再和 其四
313896,冬藏·三冬闭户谢登临
406422,西蜀江君骏卿不知自何处收得余二十二岁所作英文文稿，藏之三十年，寄燕谋转致并索赋诗以志二首选一
513614,题尹性之御史所藏周文靖竹
200031,宇文绍恭所藏其父德闻手书其祖家训一卷
1027297,题施武子所藏老融二牛图 其一
1087644,次韵傅丈题吕少卫教授藏书阁
752400,题冯鲁川廉访所藏米芾芜湖县学记为武养斋大令作
1178350,题韦少保静恭宅藏书洞
1055514,读吴思道藏海诗集效其体
1100486,重到地藏院
751954,德宗景皇帝实录尊藏皇史宬礼成恭纪 其二
1005719,十二月初六日龟藏夜坐有感
1101195,陈藏一山房
1091833,送赵子真送藏经于朝廷
822520,霓裳中序第一 借南雅楼所藏琴川翁氏慵盦旧本珂雪词，手录成帙，即次集中李分虎题词韵书后
507350,题赵侍郎所藏画三首 其二 月月红
438189,楚清之画乐天小娃撑小艇偷采白莲回不解藏踪迹浮萍一道开诗因题其后
1072969,兵火之后家藏坟籍荡然寄居江村欲借书诸公先寄此诗 其一
872536,题危见心所藏陈常庵水月障及松鹤芦雁各一首 其三
900240,前日从赵漕饮因得遍观所藏书帖之富既归戏成三绝简之 其一
1225404,题张参政所藏太真上马图
948967,东坡像李伯时作曾无疑藏之命予赞之
198508,挽黄承事·不用籯金侈厚藏
311440,浣溪沙·晚归，楼主惠赠藏香笺纸，赋谢
1126958,题王居士所藏王友画桃杏花二首
555118,题吴继学先生家藏边景昭花鸟图五首 其一 梅竹双鹊
136527,武夷有感·几尺雪藏山径暮
904208,叔父作寿藏
1053297,过公择藏书室
1142337,景定甲子理宗尝以颜曾传道配飨下问词臣越咸淳丁卯昉以曾子子思升侑孔庭盖推本先意也先臣所被宸笔藏之私室会军学撤旧庙崇新阁愿得摹刻其上而某固未敢也府教张君遂诗以成之后之观者将有考于斯文谨用韵以谢 其一
1087629,借王嘉叟所藏赵祖文画孙兴公天台赋凝思幽岩朗咏长川一幅有契于心因作此诗二首 其二
134941,跋袁起岩所藏修禊序
253442,题高解元所藏武元直山水
951508,题雪峰如藏主水月图
219477,试墨·玉藏顽石藕出泥
248411,访石经山雷音洞隋静琬师藏石经版以备法难所也
238480,送李左藏·忆昔议和日
1020021,送悟藏主还姑苏
1083575,题四兄茂安藏春园
484936,题王翰林所藏画兰
947655,藏春峡四首 其四
799370,汪奂之寄示和苏文忠定惠院寓居月夜偶出二诗题其兄均之所藏二诗草稿墨迹并约同作得四首 其二
15732,题韦少保静恭宅藏书洞
657725,藏书室
793089,家藏旧画效前人论画绝句各系一诗 其十一
898783,水调歌头 其五 汪德邵无尽藏
921731,雪后，便欲与同僚寻春，一病弥月，杂花都尽，独牡丹在尔，刘景文左藏和顺阇黎诗见赠，次韵答之
1027291,题汪季路尚书所藏米元晖湖山瑞雪图
201397,伯仲一笑·天上宝囊无尽藏
447465,张南君以所藏朵云轩制前明沈周《两江名胜图册》嘱题，因赋短句
1088596,题尤溪宗室所藏二妃图 其一 湘夫人
796096,留春令 偶阅花蕊夫人宫词，内藏垂丝海棠花瓣，尚系七年前所收，感成一词
821106,卜算子 余屡和稼轩词题画，人多传之顷有言家藏旧画，似是文君当垆者，意欲乞题。因再用韵
1016496,安藏主
572864,初夏同惟学惟长舅尊游二圣禅林检藏有述 其三
921675,王晋卿所藏《著色山》二首 其一
978591,宇文绍恭所藏其父德闻手书其祖家训一卷
1013948,清藏主归乡省亲
1203572,蓬莱阁 俗秦楼月藏头
633975,陈牧芷孝廉游白岳归后掩关读藏经弥年欲有下询先以折柬并赠丁南羽佛相一轴佳韵一首率笔奉答
467609,遣闷二首用海藏韵
702586,题沈廷美尚宝所藏四烈妇图 冯媛当熊
709365,藏经楼上作 其二
84521,冬夜读书·平生喜藏书
820985,南浦 题端甫所藏黄小松湘江归棹图
178127,赁宅·萍流匏系任行藏
586334,藏春亭
770047,百媚娘•迷藏
930287,题陈伯予主簿所藏秦少游像
381150,海藏楼试笔
547318,寿宝藏上人二首 其一
273724,卜算子·余屡和稼轩词题画，人多传之顷有言家藏旧画，似是文君当垆者，意欲乞题
240970,地藏塔·八十四级山头石
740550,果亭运使所藏李龙眠五百应真图卷矛既为书淮海图记而缀以诗
1131477,吴文炳报载藏经船坏已为曝晒毕二首
176660,寄藏叟·版扉常半掩
908466,袁季海别驾以所藏灵壁石诗轴见示为此篇
793195,家藏书画乱后云散
633797,甲寅春二月与蜜在慧均四藏自显超汉铁关洞开瓶出法敌不息漪文始十靖一挂云诸子从燕台南归取道泰安登岱岳所经胜槩矢口咏歌共得五言近体十二章以志一时 其七 二虎庙望南天门
842956,沈臞禅画梅册盛季瑩所藏节庵每叶有赞
293476,题王蓉洲丈藏宋拓麻姑仙坛记
514685,饮灵藏寺
813603,藏上人寄诗招游西涧以事不果赋此却寄
1022596,通藏主之南国
291659,阮郎归·周生梦庄见余旧藏清仪老人金石手稿
633280,贺藏主师新筑
1235479,题胡彬所藏乃祖澹庵书藁后二首
286165,和刘东郊五石瓠堂夜坐怀西涧藏公
87551,绵亭林逸人扁所居室曰藏晖求诗
142902,山房藏书万三千卷子有赋诗用韵
921703,次韵答刘景文左藏
299436,德宗景皇帝实录尊藏皇史宬礼成恭纪
1015806,泉州惠安县迎藏经请小参偈
912827,和段季承左藏惠四绝句 其二
1006451,为章道祖作颇及葛藤 华藏庵
505834,题匏庵所藏画 其二
456443,藏书病
286404,将自田盘归与藏公坐倒影潭话声闻事久之乃别
752029,题陶斋所藏秦权
957800,藏春园
1065965,先公守汝阴尝以诗送都曹路君挂冠东归载乖崖公留其录曹语今传播世间三十年矣过寓居颍昌一日有都曹公之季子文老者来自京师出其家所藏二帖纸墨如新因道存没之旧感慨于怀乃追继先公诗韵以遗文老时方就试春官待报也
185848,微诗三绝·莫把行藏间斗牛
800141,钱编修所藏司马相如玉印歌
634809,同澹书记观张登子所藏曹将军画马卷
1106638,兵火之后家藏坟籍荡然寄居江村欲借书诸公先寄此诗
833019,满庭芳 赋刘聚卿所藏大小忽雷
766670,菩萨蛮弈棋私语迷藏弹琴读书潜窥秘戏 其十一 回文
1224254,题王山仲所藏潇湘八景图卷走笔作 其一 烟寺晚钟
552491,题韩允传所藏钱舜举山居图 其三
253877,弓格剑·羌不知余之所藏
760201,题易实甫所藏张梦晋岁寒三友图，实甫自言张后身也
333091,四和香·黄三出所藏元刊文信国集杜诗属题盖囗中作也感而赋此
411367,近遭兵燹，失镶玉宝鼎一座，正深惋惜，忽于旧书麓中得古墨双团，阳面篆书：“双凤玦”三字，阴面刻双凤齐飞，其缘镌：“天启元年程大约藏”，审知为四百年前物，至为可宝，爰赋此七律二章以志之 其一
1123087,初冬快晴陪宣卿叔夏游石头庵过三生藏穷深极峻遂登上封却下福严最爱廓然亭静憩久之乘兴入后洞置酒云庄榭徘徊方广阁山行崎岖不可以马虽笋舆傲兀小劳尚胜骑从之烦也既归山前之翌日复会于坚伯兄小阁同安赵涧看北山馀雪披云映日翠瑩珑葱殆难模状因访季父庙令欢饮而罢集记所见成十五绝
480558,题鲁京尹所藏双鹰图
20171,步虚词·十二楼藏玉堞中
487813,水亭读凤皇山藏稿赠黄尧衢 其三
1085611,夜宿下沙步有小浦藏舟于口惧有风也是夜浪忽作声如潮舟为之撼如是者三舟人惊惧初谓有风起视则天籁不号星月皎然篙工云江中畏炮炙邻舟有煎油者岸圮而浪生晓视之果有圮处或云鼋鼍之属因记之
219349,阅藏书·羡子孤云野鹤
162426,和僧啸云双插法藏寺韵
209123,湖上口占·卖葑千艘底处藏
451967,丙戌清明后一日京城小雨夹雪甘棠诗社邀游玉渊潭赏樱花相约步海藏楼韵 其四
408053,冬藏
813458,汪奂之寄示和苏文忠定惠院寓居月夜偶出二诗题其兄均之所藏二诗草稿墨迹并约同作得四首
138934,寄陈彦邦·不须细细说行藏
577254,藏杏为医者赋
522079,题三江所藏吕纪画鹰
834554,千秋岁 题藏山草堂图，为主人寿，六一体
1201751,黄鹤洞中仙 继重阳韵藏头
90534,左藏南库西庑下纸合负暄戏题
1099966,雪峰藏叟过门见访赠别一首
1225129,题李则平宪副所藏息斋竹
182383,藏穷深极·鞭笞鸾凤地行仙
654116,无锡杨叔屿寿藏八景 其七 一沤亭
101193,读道藏·嗟予亦何幸
