836379,金缕曲 其二 腊日偕向君南皋、蔡君根泉、李君步洲、向君寿芝游东湖至龙藏寺宿
642996,赠医士长律十首 其五 龙藏
855884,题南巢地藏寺
353253,即事韵·倦翼归来足退藏
95146,登愚卿无尽藏再用韵呈愚卿
170258,临安送郑左藏
218566,和游南岩·南峰不藏善
339806,甘结实·遮藏霜雪免摧残
441050,鄞州旅次飘雨厉风四更枕上口占海藏韵 其一
196650,题蒋同知所藏马图前后凡五
502545,题冯公夙家藏方壸神岳琼林图
306386,题傅沅叔藏园校书图
1133475,晨入东寺阅藏行香
183825,题方叔所藏马中远春牧晚归图
1054475,累约慎思视事今已入境盘桓不进欲以十四日交承又云六甲穷日戏作藏头一首
150657,感物·今年叶底已藏花
93987,题眉山程侅所藏山谷写杜诗帖
414633,以旧藏诗集数种寄赠淡芳聊答存问之厚因媵二绝 其一
1125610,送李左藏三首
1129504,复斋奚左藏挂冠
487812,水亭读凤皇山藏稿赠黄尧衢 其二
835267,金缕曲 为藏山题画
661400,题刘大参所藏兰图
457218,腊八日有雪用海藏楼韵
203854,跋大庾令赵宗华时棣藏诸公帖
1049860,魏中舍家藏王摩诘海风图
499240,古囊寿藏 其四
700330,题子渊内翰所藏画册
286459,就藏上人乞花木栽草堂前戏效少陵体
97546,僧圆契梅·西轩宜热竹能藏
135024,跋正法眼藏
829993,点绛唇 戏咏迷藏
204735,清溪解缆用秀才甫韵宁杜藏用
1065693,题刘均国所藏燕公山水图
453098,丙戌清明后一日，甘棠诗社玉渊潭樱花雅集，相约步海藏楼《樱花花下作》韵 其三
192147,余所藏李文才画鹤甚奇伟岁久缣烂各缺一趾偶
249607,题九思堂主所藏李鹿门花卉立轴
471109,和饮酒二十首初夏天气微热方不欲饮偶龚仲和邀看园中新绿出所藏名酒意甚乐之次日捉笔和渊明先生饮酒诗数篇与索一樽独酌会雨窗无事遂尽和其韵（录十五首） 其十二
1236156,题王士让御史所藏画卷 风雨回舟
575900,题袁清溪所藏雪夜泛舟图
661947,黄伯固起大理寺丞得枯株类石爱而藏之戏题
825324,海藏楼杂诗 其二十六
822050,百字令 王晋卿烟江叠嶂图，宋宣和内府所藏，无苏公题诗，盖又一本也
924226,寄题蒲传正学士阆中藏书阁
976376,观藏珠
771621,王鉴叔藏有名纸欲易以诗因次其送春诗韵
238922,虞美人·倚窗人似莺藏柳
158090,题华藏环峰阁
971909,腊月十九日饮于周氏无尽藏雪作
147322,题姚雪蓬使君所藏苏野塘画
703281,甲寅春二月与蜜在慧均四藏自显超汉铁关洞开瓶出法敌不息漪文始十靖一挂云诸子从燕台南归取道泰安登岱岳所经胜槩矢口咏歌共得五言近体十二章以志一时 上横冈
1032942,近买山范湾自营藏地与亡弟草塘君及外家墓茔悉可跂望感事述情继有是作 其四
930312,题詹仲信所藏米元晖云山小幅二首 其一
219160,送刘道士之山阴阅藏书
560508,题陆昌所藏杜用嘉画
825471,又题雨山所藏黄石斋文治论卷子
186103,缘识·伏藏终不见
1088555,奉题李彦中所藏俞侯墨戏
920968,送将官梁左藏赴莫州
1019201,德富藏主请
904628,三藏梨
568426,岁暮风雨中发藏书示楫子
1057371,送真藏主赴泐潭乾老会中
1106785,无尽藏斋诗
464560,玉楼春 八月四日藏春园避寇，园为蕙风故宅，今为吕镜秋所有
1119186,临安送郑左藏
129263,梦寻梅·野径深藏隐者家
1009136,悼清藏主
457645,何涤非兄书赠郁庵藏兵之骆越王弓形格剑组诗长卷 其二
39015,入定·闭目藏真神思凝
103658,观邵不疑学士所藏名书古画
965736,初冬快晴陪宣卿叔夏游石头庵过三生藏穷深极峻遂登上封却下福严最爱廓然亭静憩久之乘兴入后洞置酒云庄榭徘徊方广阁山行崎岖不可以马虽笋舆傲兀小劳尚胜骑从之烦也既归山前之翌日复会于坚伯兄小阁同安赵涧看北山馀雪披云映日翠瑩珑葱殆难模状因访季父庙令欢饮而罢集记所见成十五绝 其十
1127111,谢胡藏之送栗鼠尾画维摩二首
937292,题施武子所藏杨补之梅
877825,绵亭林逸人扁所居室曰藏晖求诗
368674,菩萨蛮·岩冰壑雪中藏腹
378488,老春·叶欲藏禽花没腰
557776,题葛原良所藏王元章所作梅鸟图 其一 梅竹白鸟
767334,自题二十四诗后每句藏二十四意
179866,袁季海别驾以所藏灵壁石诗轴见示为此篇
457142,代荒坡赋隋龙藏寺碑用山谷书摩崖碑后韵并寄八胡冷公
634786,还庐山兼往嘉禾请藏留别雷峰诸同学 其二
1035565,和蹇藏用暮秋郊居言怀二首 其一
1027767,送赵伯藏添倅永嘉 其二
374690,题陈藏一山房
389931,小祇园·藏经阁前风雨横
306301,题研忱丈所藏石斋逸诗墨迹
840407,题焦山书藏曝书图五首 其二
368126,还丹复命·巧拙仍藏伏
128665,庶子泉·深藏西竹寺
193348,因藏主持此稽首诸山如有小小寺院保明出世
253437,题高敬之所藏云溪独钓图
376348,题刘民用居士藏六庵
47614,杂诗·雷藏蛰虫伏
745330,得辅宜弟书以予今年四十奉文端公书晋书良吏传遗墨畀予宝藏
1053611,次韵王潜翁题王孝孙所藏摩诘听松图
87274,病起·躬圭宝箑俱藏起
630462,黄石藏惠药
467678,为群中网友题藏头小诗九首以为乐
826778,金缕曲·题皋兰吴柳堂侍御罔极编册。册为侍御遭母丧时日记，时值文宗有木兰之狩，家国巨变，均详记中。后为第三孙郭龄所藏，郭龄予僚婿也。以难荫试令鄂中，于宣统辛亥兵变失之，今归浙人姚某
767335,艳体一章每句戏藏十六意
114025,闻致政胡朝请多藏书以诗借书目
956706,得寿藏于先陇之傍俯酬素愿感慨交怀
108466,定风波·次高左藏使君韵
182394,藏穷深极·宝楼香殿隘空山
103260,和吴冲卿藏菜
1168253,地藏菩萨赞
1230444,题吴瑩之所藏郭忠恕画册
697963,为三府安公题所藏史痴翁图二首 春景
410204,题师郑前辈所藏子潇先生诗册
408309,题柱尊所藏黄宾虹前辈松石
912824,和段季承左藏惠四绝句 其三
361204,书院·雨久藏书蠹
1133453,题王师尹所藏三峡图
499549,题何幼恭所藏方方壶洪崖图
1247148,题陈惟贤藏芸轩
1156157,和李澧州题韦开州经藏诗
373789,会观藏主·日月东西行未尽
57820,题陆廉伯庶子所藏墨梅
654113,无锡杨叔屿寿藏八景 其四 知息所
842970,题研忱丈所藏石斋逸诗墨迹
302671,兰陵王·华严寺建自明季藏经廔风景最胜丁酉夏日与丛碧同游
992470,和吴冲卿藏菜
769761,菩萨蛮•题青溪遗事画册和阮亭韵 其五 迷藏
663089,题卢润卿所藏陈所翁画龙
357180,论文·面壁藏神不计年
191289,宿巢县地藏寺枕上偶成
290187,题昼石·敛崿藏棱书一拳
1118889,题江参山水横轴画俞秀才所藏二首
182396,藏穷深极·西岭回看天柱峰
633801,甲寅春二月与蜜在慧均四藏自显超汉铁关洞开瓶出法敌不息漪文始十靖一挂云诸子从燕台南归取道泰安登岱岳所经胜槩矢口咏歌共得五言近体十二章以志一时 其十一 玉皇阁
994009,浪淘沙令 云藏鹅湖山
167263,题李益师谦所藏和靖吟梅图
833155,菩萨蛮 藏香，以下四解和周会生同年
976060,藏一山房
70208,金莲堂·俗惜黄花藏头
303746,石湖仙·题吷盦丈藏郑叔问年丈手书此册
1000038,游华藏寺
578287,题沈斌所藏画三首 其一 独立相思鸟
191902,题沈仲一所藏周氏群公书帖
832739,倦寻芳 题吷盦藏大鹤山人词墨
825822,李厚基求题所藏李星野先生书册
311872,漫兴·小园幽静足藏身
798715,摸鱼儿 家藏岭南三先生墨迹，感题其后
1129615,题刘民用居士藏六庵
373756,勉日藏主书楞严
551281,屠田叔使君枉过兼惠藏书赋谢
1252045,送兴藏主游金陵
1210583,王仲思所藏幸蜀图
337844,同年赵左藏挽诗
915817,跋罗春伯所藏高氏乐毅论
1096603,相藏主往景山看藏经
1096603,相藏主往景山看藏经
1201763,道成归 藏头赠岳秀才
99912,失题·浮云有意藏山顶
498774,武夷有茶灶石酒杯洞大藏峰翰墨峰仙机岩棋盘石天壶峰大小廪石幔亭峰仙迹石水帘洞投龙洞汉祀坛大隐峰升真洞一线天灵岩石晚对峰虹桥金鸡洞钟峰玉女峰妆镜台铁笛岩天游峰钓矶石偶即景写怀馀未尽书也 其四
333781,松谷·云藏烟锁昼苍苍
283463,千秋岁·题藏山草堂图，为主人寿，六一体
1055628,藏云山居 其一
132747,题刘都干所藏杨秘监诗卷
784395,七益诗 其七 西涧开士藏山
190287,游北湖·真有鬼谣藏古锦
293635,蝶恋花·藏墨山房丁香花盛开，为填此阕
184581,与赵伯藏信叟游天衣寺
99423,司竹监烧苇园因召都巡检柴贻勖左藏以其徒会
262315,赵灵儿隐藏结局
1103270,藏书示儿
1032934,近买山范湾自营藏地与亡弟草塘君及外家墓茔悉可跂望感事述情继有是作 其二
1240469,题吴彦嘉所藏张秋蟾龙图
60787,越溪柳·掠燕藏莺覆碧潭
1218746,藏李氏拙斋
818483,为刘健之题所藏蜀石图
286263,寓西涧藏师竟赴千像寺斋孤游涧中竟日有作
139859,题南叔兄藏修阁息游观
185681,跋徐积压事所藏实贴
1223620,题答失帖木儿大夫所藏王维画寒林晓行图
48752,感怀·璞玉宜深藏
467481,何涤非兄书赠郁庵藏兵之骆越王弓形格剑组诗长卷
1128349,家藏画鹊二轴其一棠梨结子青黄叶亦虫蚀尚带晚花有鹊眠枝上枝若垂垂不胜者其一作攲竹一茎有鹊把竹磔螳螂而食之叶若振振而动摇者笔意精妙非黄筌不能也
1225385,题张参政所藏骢马滚尘图
696531,题韩允传所藏钱舜举山居图
946383,闻叶正则阅藏经次其送客韵以问之
819963,乙亥秋九月至旧京视散原先生日与心畬叔明立之伯夔君任羹梅过从寥志强志贻先询先诸弟自津沪来旧藏五十馀年陈酒由杭至京连日聚饮赋诗属和 其三
826774,一枝春·彭刚直公红梅画幅，为遣嫁孙女于俞氏所作，孙婿陛云移付其女夫郭则沄藏之，为赋此解
175487,永遇乐·朝霭藏晖
145047,野外·绝巘应藏佛屋
546113,王恒叔山居杂咏十首 其十 龙藏
731327,春日携李眉山彭湘南王兰谷藏上人重游盘山自西甘东甘二涧历上方东竺
553377,题韩伯时寿藏卷 其二
68232,柳梢青·藏头
382617,再至长安见无弦上人移住法藏庵因听弹琴赋赠
1153849,秋夜同畅当宿藏公院
928360,书李商叟秀才所藏曾文清诗卷后
377550,通藏主之南国
174510,过谦上人房·小房藏曲折
745992,游宝藏寺清凉厂
284119,写藏书藏碑目录竟各题一绝句
284119,写藏书藏碑目录竟各题一绝句
1201838,满庭芳 继重阳韵藏头
331452,瓷垆·华藏初游愿力坚
490057,寄梅林普庆二长老恢复初首座彝天伦藏主
1201365,报师恩 继重阳韵藏头
526557,题何大渊藏吕廷振画雁
377546,法光藏主之南徐
240605,题何朝申所藏赵邈卓馋虎图
315889,题周汝昌先生所藏顾二娘制翔凤砚
1217634,题王虚斋所藏镇南王墨竹
804719,华藏雨望
686305,西园八咏 藏书屋
882694,与赵伯藏信叟游天衣寺
340841,题藏春谷壁
215572,二绝·沙砾藏春未放来
121299,宝藏寺洪钟
437174,仿玉川子沙麓云鸿研屏吕唐卿藏
730212,蓉洲王丈所藏宋拓小字仙坛记庚申之冬曾为题句蓉丈既卒其家请濒石杨公铭墓因以此拓赠之今藏其嗣吉南献叔处辛丑正月持以见示开卷怆然用前题诗韵
730212,蓉洲王丈所藏宋拓小字仙坛记庚申之冬曾为题句蓉丈既卒其家请濒石杨公铭墓因以此拓赠之今藏其嗣吉南献叔处辛丑正月持以见示开卷怆然用前题诗韵
150951,刘致政寿藏归庵
514040,赠程都纪宗贵宋相文清公之裔藏有先世诰牒
1132077,近买山范湾自营藏地与亡弟草塘君及外家墓茔悉可跂望感事述情继有是作
1177186,哭宝月三藏大禅师
902978,夜宿华藏寺
433704,胡汀鹭藏有纳兰容若、顾梁汾书扇二叶，因画贯华阁图，征题，寒厓要余同作三首
306416,八月廿八日沅叔招为蓬山话旧第二集视所藏明内府写本翰苑群书
1219183,赠藏书顾明则
255716,在西藏
825413,续海藏楼杂诗 其三
1215099,题胡彬所藏乃祖澹庵书藁后二首 其一
16648,神仙曲·碧峰海面藏灵书
920325,司竹监烧苇园，因召都巡检柴贻最左藏，以其徒会猎园下
513543,题刘廷问舍人所藏夏仲昭太常晴雨二竹 其一
419673,月下笛 其一 题俞慧殊藏陆宣公墓古柏重青图
287569,清平乐·题《柳如是诗集附尺牍》，野侯先生藏
240430,端午洪积仁召客口占戏柬薛仲藏
346253,上林殿·林氏家藏万帙书
1057377,宿法藏禅院二首 其一
940920,临安送郑左藏 其一
155122,石左藏挽诗
220793,依韵酬益利钤辖马端左藏
1238853,梁家守藏奴
229421,近买山范湾自营藏地与亡弟草塘君及外家墓茔
515901,题毛水部所藏万竿烟雨图
995936,三月壬申同尧民希孝观净名寺经藏得弘明集中沈烱同庾肩吾诸人游明庆寺诗次韵奉呈二公
845205,题焦山书藏曝书图五首
100164,藏春坞·退之身外无穷事
167516,桃源忆故人·苎萝山下花藏路
701345,题吴继学先生家藏边景昭花鸟图五首 梅竹双鹊
203271,泉州北藏院见初荷华
1060799,藏之和予虾蟆短调再作之因以策事
676562,题狮藏精舍和黄文盛先生韵
1224924,题杨氏所藏画图
650873,题徐崇威所藏贵妃上马图
184804,自广西归上饶阅所藏书
69308,梁家守藏奴
1013668,干藏
1179237,同陈六侍御寒食游禅定藏山上人院
216951,题危见心所藏陈常庵水月障及松鹤芦雁
546505,邓远游貤书远讯纚纚千言副以绝句十章如龙泉太阿不可迫视间颇为余致前新之愤不知余比为浮名所累无地自藏知我者希我且贵矣四绝寥寥用谢良友 其一
293477,题自藏石谷仿董巨画卷题自藏石谷仿董巨画卷
293477,题自藏石谷仿董巨画卷题自藏石谷仿董巨画卷
531657,题西湖十景邹和峰家藏戴文进画巨浸秋波 其七 永宁早发寄郭云屏
547261,朱可大邀同冯太史饮摩诃庵南园步至钓鱼台夜眺还宿法藏精舍次日观慈寿浮图纪游四首 其四 慈寿寺阁
1016403,成都信藏主求送行 其二
119166,闻卞氏旧有怪石藏宅中问其遗孙指一废井云尽
91630,跋余伯益所藏张钦夫书西铭短纸
480548,沈刑部所藏墨竹歌
256299,捉迷藏
246024,访汉阳归元寺五百罗汉遇雨读寺藏唐阎立本绘观音像拓碑
288612,石湖仙·题吷庵所藏大鹤山人词札
502845,书沧州翁家藏高漫士山水图
252636,别巫山·雾失荒台万壑藏
161022,以事夺銛寄·南山藏雾豹
1009167,读古剑和尚语送是藏主归常州
501208,题双峰禄天泉上人所藏南岳笑印蒲萄幛
552570,题陈仲良所藏高彦敬青山白云图
1022755,元藏主游方
1244122,题萧质所藏终南雪霁图
468407,题邵允直所藏会稽山水图
800389,题冀渭公所藏杨忠悯梅花诗卷
204022,山居即事·出处行藏不偶然
13405,虹藏不见
100257,与梁左藏会饮傅国埔家
1036059,浣溪沙 彭门送梁左藏
1085287,予还自武林葺先人弊庐净扫一室晨起焚香读书于其间兴至赋诗客来饮酒啜茶或弈棋为戏藏书数百卷手自暴之有小园时策杖以游，时遇秋旱驱家僮浚井汲水浇花良天佳月与兄弟邻里把酒杯同赏过重九方见菊以泛觞有足乐者每览镜见苍颜白发亦聊自叹也作小诗十五首 其四 赋诗
751910,检藏书感赋 其一
1224255,题王山仲所藏潇湘八景图卷走笔作 其二 洞庭秋月
486264,追和柯丹丘所藏坡翁诗帖五首（洪武辛酉九月） 其五
267448,鹧鸪天·简苏堪，时将营寿藏，丐其书碑，碑曰彊村词人之墓
162473,谢高左藏惠墨竹
423483,蝶恋花·旧藏林天素绢本画幅，作钩勒设色花鸟，题云：景丽春华，一枝稳寄，物犹如此，而况于人乎。兰窗无事，作此写意。知我者谅之。林雪凡。三十二字一行。下钤林雪天素二印。夙好蒐集胜朝以来文人才媛诸名迹。流风余韵，多可憙者。此帧尤所爱玩。壬辰忽失之，极意踪迹不可得。荏苒数载，时时往来于怀，追省旧事，因成此词，以存一段因缘。剑返延津，或非无日，聊自慰其惓惓而已
578262,题金尚书所藏画四首 其四 梨花鸲鹆
826920,一枝春·藏园以文美斋百花笺徵书。走十七八时侍先学士天津，与其主人焦君相识，此笺初出即供涂抹，晚而南还，箧中尚有一二百番，乡县被兵，一时俱尽，睹物兴怀，咏叹深之
245974,将赴西藏宿成都
1128606,读道藏
53016,闻王刁三洞在山外西崖上中藏古书甚多然无由
520808,题沈山人藏王舍人竹枝
449773,为群中网友题藏头小诗九首以为乐 其三
449771,为群中网友题藏头小诗九首以为乐 其一
913860,题汪季路所藏李伯时飞骑斫鬃射杨枝及绣毬图二首 其一
378995,赠鉴上人·毗尼藏出清净宝
55774,智公在永宁寺检藏
997759,清溪解缆用秀才甫韵寄杜藏用 其一
506789,题童杰所藏登瀛图
956702,寄题永新张教授无尽藏
831332,巫山一段云 仁先示海藏所书函髻记，为作行云图
1224520,题金德原所藏元晖小景
553207,题青山白云图系广信府同知方公所藏
81579,书李商叟秀才所藏曾文清诗卷後
216947,书马使君所藏草虫
814003,家藏耕烟散人东篱图为唐半园作吴君圣俞谓与所居适相当索临一纸因题二首
754164,方正学画竹赞心斋先生家藏
163973,雁湖先生揆初在旦某以家藏唐画炽盛光如来像
985396,鹧鸪天 其一 次孚先韵，重阳前两日无尽藏作
144265,八阵图·负卦龟藏尾
236166,为韵·贱子甘藏拙
1219113,题徐仲原所藏王冕画红梅
1248138,藏春轩
270670,百字令·同王北山、叶讱庵、王阮亭过张晴峰寓斋，听金山人弹琴。晴峰出藏书鉴定
52247,题石生仲濂所藏李克孝竹木
291198,清平乐·为邹景叔先生题所藏李抱真虫蛀砚图
965734,初冬快晴陪宣卿叔夏游石头庵过三生藏穷深极峻遂登上封却下福严最爱廓然亭静憩久之乘兴入后洞置酒云庄榭徘徊方广阁山行崎岖不可以马虽笋舆傲兀小劳尚胜骑从之烦也既归山前之翌日复会于坚伯兄小阁同安赵涧看北山馀雪披云映日翠瑩珑葱殆难模状因访季父庙令欢饮而罢集记所见成十五绝 其十五
68586,舟中杂纪·芦花藏别浦
560711,题汤汝鸣所藏葵丘
1108011,题危见心所藏陈常庵水月障及松鹤芦雁各一首
502772,书董景和家藏高待诏山水图
409756,疏君通甫以所藏金梅僧遗画长卷属题，通甫笃于故旧，而予亦不无宿草秋风之感，遂成一律
1081181,跋子静所藏鲁直书乐天八字偈
266696,疏影·题吴湖帆所藏旧拓隋蜀王秀董美人墓志
796512,百字令 题王佛云明府寿迈家藏《叶小鸾眉子研拓本》
918320,曹主簿泾自卜寿藏追范石湖韵谨依虚谷使君例各一再和 其一
387545,菩萨蛮·藏香，以下四解和周会生同年
843182,八月廿八日沅叔招为蓬山话旧第二集视所藏明内府写本翰苑群书
224550,倾杯乐·隔座藏钩
667468,游华藏寺次邵半江太守韵
701383,武夷有茶灶石酒杯洞大藏峰翰墨峰仙机岩棋盘石天壶峰大小廪石幔亭峰仙迹石水帘洞投龙洞汉祀坛大隐峰升真洞一线天灵岩石晚对峰虹桥金鸡洞钟峰玉女峰妆镜台铁笛岩天游峰钓矶石偶即景写怀馀未尽书也
730360,题彭侍郎画梅画为何人所藏，其人亦能画，今忆其人乃谢麟伯也
449775,为群中网友题藏头小诗九首以为乐 其五
569146,梅竹双清卷歌题所藏王冕元章吴镇仲画也
968835,敬和九锁步虚词 藏云锁
569374,藏经阁西偏俯小罨画溪
947657,藏春峡四首 其二
453099,丙戌清明后一日，甘棠诗社玉渊潭樱花雅集，相约步海藏楼《樱花花下作》韵 其四
1128076,上后乐刘先生左史十首用襄阳诗两句行藏坚晚节进退法先民为韵
1022529,立藏主之三衢
525923,题柯行人所藏秋水纤鳞图
1210726,韩君美所藏支遁观马图
157331,老翁·八十昂藏一老翁
251212,鹧鸪天·华藏山行
455949,藏书拆包
38532,谢阴符经勉送藏休上人·一林霜雪未沾头
300603,挽柳北野·逢人犹道芥藏楼
504702,题柯允中所藏张师夔云山桧石
621246,偕谢伯子吴达生黄虞六观梁氏家藏古鼎卣窑盘各器作
126759,二十五日依韵和左藏吴传正寺丞见赠
423981,八声甘州·辛稼轩水调歌头和杨济翁、破阵子为陈同甫赋及本调读李广传，皆自写肮脏，不独鹧鸪天追念少年时也。余少志颇似稼轩，辛亥以后，始一意文史。去冬谢太学归卧海上，至菽水不给，遂斥藏书，辄效稼轩体赋此
988636,观月藏书楼
68996,司马氏藏唐子华山水扇画
63732,无题·太息弓藏狗又烹
903106,题天台凝真宫陈道士缘化藏经既成求诗还山
1201289,如梦令 继重阳韵咏围棋藏头
888372,题贾表之所藏九马图
1223906,同开先南楚悦禅师观息斋画竹卷于崇仁普安寺煜公之禅室盖煜之师一初本公所藏也因记延祐甲寅息斋奉诏写嘉熙殿壁南楚与之同寓庆寿寺时予同为太常博士俯仰之间已为陈迹乃题其后云
1083615,次韵侄端臣同游藏春园
99456,送将官梁左藏赴莫州
48407,题鲁京尹所藏双鹰图
117488,次韵子瞻赠梁交左藏
819971,寄海藏旧京
226936,古意·夜舟不藏壑
1087661,题可老所藏徐明叔画卷二首 其二
491566,题杨奇琛所藏山水图歌
632599,喜文玄参方因请藏回
1245233,题刘伯升所藏兰亭
138674,寄藏叟僧善珍
749603,题蒋伯生丈所藏钱东涧东山唱和图 其一
274589,西江月·戏题柳溪所藏竹砚
1027937,赠宝藏老道源
749604,题蒋伯生丈所藏钱东涧东山唱和图 其二
833044,齐天乐 刘体乾奉所藏蜀石经残拓，上呈乙览，蒙御题孟蜀石经四篆文，以示孝臧，敬书其后
1128204,题太守钱侍郎所藏薛少保独鹤图和韵三首
965733,初冬快晴陪宣卿叔夏游石头庵过三生藏穷深极峻遂登上封却下福严最爱廓然亭静憩久之乘兴入后洞置酒云庄榭徘徊方广阁山行崎岖不可以马虽笋舆傲兀小劳尚胜骑从之烦也既归山前之翌日复会于坚伯兄小阁同安赵涧看北山馀雪披云映日翠瑩珑葱殆难模状因访季父庙令欢饮而罢集记所见成十五绝 其八
553912,藏晖阁
1062354,送禅人化缘转藏
50174,袁君庭玉以所藏何思敬山水图求题为赋长句
965740,初冬快晴陪宣卿叔夏游石头庵过三生藏穷深极峻遂登上封却下福严最爱廓然亭静憩久之乘兴入后洞置酒云庄榭徘徊方广阁山行崎岖不可以马虽笋舆傲兀小劳尚胜骑从之烦也既归山前之翌日复会于坚伯兄小阁同安赵涧看北山馀雪披云映日翠瑩珑葱殆难模状因访季父庙令欢饮而罢集记所见成十五绝 其十三
704197,题吴教授所藏郭奉祠子虚墨梅
1040060,钤兵李左藏厅赏梅
1214717,藏钩似陈汉卿
489459,赠日本僧立恒中藏主
228454,登楼野望·云藏日影微吞吐
1055114,藏春峡
970837,览梦得所藏李伯时画吴中三贤像因各书绝句 陆龟蒙
1147113,奉同颜使君真卿开元寺经藏院会观树文殊碑
1176911,蓟丘览古赠卢居士藏用七首 其四 燕太子
287517,清平乐·题罗两峰鬼趣图，颉刚翁藏
842998,题傅沅叔藏元椠通鉴初印本 其一
1209850,燕京大觉禅寺奥公乞经藏记既成以诗戏之
701270,己未九日乌山登高次刘静常郑藏庵东庵韵 次静常韵
108122,题罗观光所藏李仲宾墨竹
572865,初夏同惟学惟长舅尊游二圣禅林检藏有述 其四
537103,休承在湖学以此十五帧见寄潇洒冲澹故不易及因题其后而藏之
726686,过藏矜道馆诗
1032935,近买山范湾自营藏地与亡弟草塘君及外家墓茔悉可跂望感事述情继有是作 其六
100932,书晁补之所藏与可画竹
293513,费屺怀太史以苏斋旧藏张公方碑见示次册中苏斋观碑等图诗
135067,题汪季路太傅所藏龙眠阳关图
1031717,吴熙老所藏风雨图
222569,二月廿一日游藏胜有感
137126,题翠蛟亭·山英藏水巧能欺
1249148,题吴性存所藏赵仲穆竹枝双蝶图
434855,题张子正运使所藏杨德懋山居老闲图仍次元韵四首 其一
358118,过唐潜亨·藏拙堂深不浪开
1063617,送元上人还桂阳建转轮藏
507514,题周参政所藏山水小景
62312,题王金吾所藏徐熙秋荷鸳鸯翡翠图
54550,题吴教授所藏黄大痴画松江送别图
525823,宗伯邵公寿藏诗四首 其四
194854,南歌子·绿暗藏城市
972029,憩汭口之秘藏院
513483,题宗人愈大上舍所藏白描风荷图
102384,次韵答刘景文左藏
555236,己未九日乌山登高次刘静常郑藏庵东庵韵 其三 次藏庵韵
555236,己未九日乌山登高次刘静常郑藏庵东庵韵 其三 次藏庵韵
707857,凤栖梧 其三 题张卣臣所藏画册
582658,梅花百咏 其九十八 显仁藏用
1234857,草堂陵藏主火浴牙齿数珠不坏坚固尤多因为说偈三首 其二
242318,四安梵惠藏
381937,题郑子实所藏燕穆之龙图山水及牛戬雁图
257316,翠兰亭·蓬艾丛深特地藏
1163683,赠智满三藏
494584,题曾春官惟馨藏予小影
965738,初冬快晴陪宣卿叔夏游石头庵过三生藏穷深极峻遂登上封却下福严最爱廓然亭静憩久之乘兴入后洞置酒云庄榭徘徊方广阁山行崎岖不可以马虽笋舆傲兀小劳尚胜骑从之烦也既归山前之翌日复会于坚伯兄小阁同安赵涧看北山馀雪披云映日翠瑩珑葱殆难模状因访季父庙令欢饮而罢集记所见成十五绝 其十一
53315,胡侍郎所藏会稽王冕梅花图
