157612,登楼·千年日月藏丹鼎
54848,安山待闸憩大柳下见蜣螂转丸及窟穴埋藏之状
1073868,东坡先生与蒋魏公游最善宣卿侍郎蓄东坡诗文自公始也心慕手追遂入于室某尝赋景坡堂诗宣卿谓余知音者遂标藏之椟中比守吴门治有状玺书褒进待制敷文阁某驰小舟往贺宣卿出诗三章见属句法华妙为一时绝唱有云正索解人那复得其谁知我固无从此真东坡语也辄次韵书于卷末 其一
1231726,正月廿三日借竹洲访顾藏六于司马庙
4353,咏史·昂藏獬豸兽
888230,木平像吾友宣老所藏宣示寂久矣余因归朱方遇其徒慈俊乞得之喜而作此
878395,陈佐藏之温陵
638249,游德藏寺四首 其一
633798,甲寅春二月与蜜在慧均四藏自显超汉铁关洞开瓶出法敌不息漪文始十靖一挂云诸子从燕台南归取道泰安登岱岳所经胜槩矢口咏歌共得五言近体十二章以志一时 其八 孔子小天下处
1009087,会观藏主
1018548,碧云寄华藏故旧
373744,寄广恩藏山和尚
963708,奚左藏挽诗二首 其一
1219072,高昌王所画蒲萄熊九皋藏
273653,减字木兰花·题马湘兰画兰卷子，湖帆所藏
813745,屡辱侍读王先生以卢藏用种明逸常彝甫见嘲未敢用鄙句唐突又蒙赐口号四章语意郑重督和甚切勉遵无言不酬之义敬答四首以当解嘲
281888,留别吉原大藏筱本重一
912826,和段季承左藏惠四绝句 其一
457407,郁庵藏兵之骆越王弓格剑 其七
171996,野步·密竹藏啼鸟
1082636,题圆融庵藏书坞辋川图 其一
1082637,题圆融庵藏书坞辋川图 其二
1022569,恺藏主号庾岭
27672,贞女祠·何穴藏贞骨
206691,和蹇藏用暮秋郊居言怀
821025,金人捧露盘 题湖帆所藏隋董美人墓志
1139643,题郑柏窗所藏莲社图
309474,金缕曲·为王瑶卿供奉题所藏罗瘿公手书诗卷
602029,隋书十首 其五 杜正藏
650961,游华藏寺次水部家叔韵
149306,行藏·行藏本自迷
149306,行藏·行藏本自迷
1132081,普觉院登上人房老梅擅名滋久昔四灵与其先师道公方公游赋咏盈纸距今三世矣余每至其所辄徘徊不忍去登亦对坐不倦有前辈之风槐径弟拉同游者赋诗因用其韵俾登藏之庶不愧昔日尔
687040,题萧与靖所藏古潭墨竹四首
321267,陈藏一山房
672765,为三府安公题所藏史痴翁图二首 其二 雪景
134950,跋汪季路所藏修禊序
462838,丙申冬至，冲霾聚饮。与生云、霜于、白藏、采芦约押至字
843991,题傅沅叔藏元椠通鉴初印本
513571,题张修撰养正所藏王舜耕山水画
286411,藏公生塔落成喜赋
921583,书晁补之所藏与可画竹三首 其三
930311,题詹仲信所藏米元晖云山小幅二首 其二
979920,呈华藏密印
735826,屡辱侍读王先生以卢藏用种明逸常彝甫见嘲未敢用鄙句唐突又蒙赐口号四章语意郑重督和甚切勉遵无言不酬之义敬答四首以当解嘲 其四
268891,旅菲杂咏·五金百货满储藏
793091,家藏旧画效前人论画绝句各系一诗 其十三
164801,吴熙老所藏风雨图
825897,杨一斋所藏颜鲁公三表帖
1076197,孤山之颠旧有开氏四照阁次年部使者献西湖图神庙阅图久之问开氏四照阁安在部使者失对其知名如此昨跋马过下山见赭衣荷锸数百人问之则军中藏冰于此也
267834,减字木兰花·题黄九烟为李元白藏周江左书离骚经跋
436589,跋杨损之所藏杨德懋秋江捕鱼图二首
141291,夜宿华藏寺
923987,初成遗老斋待月轩藏书室三首 其二 待月轩
1142126,题张氏所藏石经
796554,蝶恋花 藏墨山房丁香花盛开，为填此阕
377742,次韵王潜翁题王孝孙所藏摩诘听松图
829687,海藏楼杂诗
830829,莫君楚生以吾家绣谷老人药园诗稿见示用族祖瓯亭翁于京师重获瓶花斋旧藏丁卯集得长律三首韵酬之 其一
99181,次韵答舒教授观余所藏墨
152175,东坡像李伯时作曾无疑藏之命予赞之
1003973,上后乐刘先生左史十首用襄阳诗两句行藏坚晚节进退法先民为韵 其五
266688,惜红衣·用白石体题吴湖帆所藏七姬权厝志旧拓
370627,昌甫示所藏淮海谪处州税官时诗草
520604,独当奇处行题何大参子元藏沈隐君画郴州江山图
251451,虞美人·得亡友郭延年旧藏宋词一本噙泪展读
60129,题王学士所藏王孟端老桧苍崖图
635080,九日送足公请藏
1016713,题刘民用居士藏六庵 其一
1222674,赋张秋泉真人所藏研山
681249,题黄宗器秋官所藏何太守山水图
306053,溽暑访肖伋，读所藏画幅
868413,寿藏十韵
1032554,绍兴戊午秋因观毕氏所藏定武旧石本兰亭因题
441117,暮阑公藏游见寄步韵奉和
741023,宿藏云阁
402834,金浮图 徐积余丈属题所藏钱忠懿王造金涂塔图卷
286329,西涧开士藏山
47232,题王翰林所藏画兰
521597,题华文远所藏五松图
573076,祗园理藏完 其三
984254,送李左藏三首 其三
158134,送陇州使君刘仲仪左藏赴治
254181,郁庵藏兵之夜郎剑
374884,春郊有感·用舍行藏只自伤
344074,德藏寺·一榻掩云卧
293454,果亭运使所藏李龙眠五百应真图卷矛既为书淮海图记而缀以诗
1216636,衡山福严寺二十三题为梓上人赋 其四 三生藏
373799,会法眷泽藏主
798764,向湖边 题林畏庐先生西汉图卷，卷藏秋雪庵
784352,雪夜同藏上人宿云公房
1096476,送善藏主出岭 其二
1159962,赠日本僧智藏
402812,琵琶仙 小檀栾室藏王渊雅夫妇合书赤壁前后赋卷子，款署乾隆甲子上元日书于京师楞伽山房属题
698741,题赵侍郎所藏画三首 菖蒲石
1244471,题安成戴观所藏崔徽图
213537,赵老园·藏书几万郑
567841,钮给事中花园藏陈山人所画水仙花次王子韵一首而陈文学示我五首故我亦如数 其三
551119,题王太史家藏孙都护墨菊
1214507,题吕德常所藏云西雪山小景
825427,答陈伯严同登海藏楼之作
502915,题萧将军家藏山水图得青字
451641,甘棠社邀赏玉渊潭樱花步海藏楼诗韵四首 其一
176195,郊外即事·林密深藏三四家
1230440,题危太朴所藏李昭道画春江图次苏东坡韵
913833,题文发叔所藏潘子真水墨江湖八境小轴 其四 海门残照
1036054,浣溪沙 徐州藏春阁园中
574615,绣岭寿藏四景 其一 左石
378741,与谦知藏·老烂丛林四十年
1053452,过彭城观陈传道知录所藏东坡公画
631205,乙卯人日酬樊月藏孝廉并寄大愿文学
298201,寿楼春·嗟东风难藏
521255,题孙良辅所藏小景四幅 其四
162239,题雪峰如藏主水月图
157902,十二月初六日龟藏夜有感
112201,题所藏赵清献公梅花图
97545,同徐斯远看王远父所藏僧圆契梅
945722,赋虚谷黄子羽所藏吴山西墨兰三章 其二
1032941,近买山范湾自营藏地与亡弟草塘君及外家墓茔悉可跂望感事述情继有是作 其十
699421,余友黄鹄生与所䁥相去二舍为置符以召各藏其半题曰花信风社中雅其事作诗咏之
746510,道光壬午为周节庵题所藏李龙眠揭钵图今王仲琡以仇十洲临本属录其诗因与图不同别成一首
300917,复以家藏汉砖砚奉寄
499238,古囊寿藏 其二
452566,叠前韵题法王寺释迦舍利藏志
1242162,题金华赵彦如所藏画轴
261271,珍宝藏在自私的人家中
272950,余旧藏何越巢诗条墨迹散佚庐子枢以重价购得属提其上
825307,海藏楼杂诗 其四
840679,癸酉八月宴于藏园重为蓬山话旧之会主人出观明内府钞本洪氏翰苑群书以长句纪之
243198,禹穴·若有藏瘗空山中
578261,题金尚书所藏画四首 其三 杏花画眉
754555,题阮太师母石室藏书小照
504164,赠洪山霖藏主
262293,林月如隐结藏局
210557,竹风水月·造物无尽藏
819216,海藏楼杂诗 其三十二
1071741,靖康元年自南都移黄州八月十六日华藏民老渡江见访于定山下院一夕别去以诗送之
798900,沁园春 题唐天如所藏听帆楼扁额，黄宾虹图
293660,卖花声·题藏墨山房
531658,题西湖十景邹和峰家藏戴文进画巨浸秋波 其八 周仪晚晴六言
578289,题沈斌所藏画三首 其三 桂仙
74833,题吴彦嘉所藏张秋蟾龙图
552686,题周千户所藏盛子昭雪中读书图 其二
434714,题高解元所藏武元直山水
802911,湘春夜月 观灵武陆氏所藏仇十洲临李龙眠白描《龙女牧羊图》
304351,夜坐·此身何分万峰藏
905426,至启伏蒙仆射相公以小子近司靶阁罕扣芜音忽徵庸陋之词盖示记怜之旨特贻篇什俯耀行藏捧玩无厌感戴交切谨依高韵奉和聊抒下情
1109203,寄题吴介夫专壑七咏 寿藏
1083543,浦江华藏寺如胜上人欲募施者开田佐僧供以长老皎公书来求予诗作二十韵奉勉
1022565,法光藏主之南徐
1169715,送三藏归西天国
787319,阻雨地藏庵
1005304,题王任所藏林逋索句图 其二
961035,赞赵直阁所藏四美人画 冬
263341,疏君通甫以所藏金梅僧遗画长卷属题
165261,药圃·不发藏丹采石英
1115685,跋余伯益所藏张钦夫书西铭短纸二首
740493,礼金地藏塔用王文成宿化城寺韵 其一
593455,题刘仲修所藏杂画四首 其三
251247,眉山华藏三五夜
452709,西藏杂诗之巴松措扎西岛
1050099,观柳殿丞家藏竹柏图
518455,敬蒙书赐梧冈二大字伏睹八法精妙超入神品宠荣所及不胜喜庆十袭珍藏永为家宝谨赋诗谢恩
961037,赞赵直阁所藏四美人画 秋
95224,题旧日所藏晋陶渊明采区东篱下悠然见南山画
1031710,题赵承远所藏大年画平远二首 其二
457482,郁盦藏兵有感 其二
1234858,草堂陵藏主火浴牙齿数珠不坏坚固尤多因为说偈三首 其三
1087660,题可老所藏徐明叔画卷二首 其一
306389,以丁巳藏酒分饷仁先有怀愔仲
825318,海藏楼杂诗 其十九
326669,次韵傅丈题吕少卫教授藏书阁
446115,买陂塘 十馀年前居山中，香江李国明兄曾为我绘《冷翠轩擪笛填词图》，藏未面世。近读蛰堪新河诸家题图之作，因成一阕乞正
281707,凉夜·几番流火已深藏
751953,德宗景皇帝实录尊藏皇史宬礼成恭纪 其一
1132981,题五牧蒋氏所藏阎次平小景
913927,藏船屋二首 其一
493160,题萧曙所藏曾同可画水四首 其一
918154,先世藏减笔画马甚精妙因乱失之追悼赋此
315820,题焦山书藏曝书图
1052690,藏舟浦
920284,读道藏
129885,山中·溪村杨柳好藏鸦
405358,题所藏明初王宗素墨梅册二首
830646,答赠袁章京昶袁语及西藏旧计谬以刘向陈汤相比因伤丁文诚怃然有作
232244,怀汪圣锡·美玉藏精璞
324314,祖麟作东山藏主以一偈送之
1095696,佛眼侍者祖元血书华严八十卷以报母细而楷花石纲初得之藏诸塔寺后复失之复得之于京师
48406,徐用和侍御所藏云山图歌
373381,瑞泉庵·当年正觉此韬藏
1087795,昨以诗徵亡碑于四十一丈既蒙酬和而诸兄亦继作焉联为巨编藏之巾笥虽所亡古刻不可复得而此之所获则已多矣顾其中犹有不能释然者因念吾子厚隶法妙古人当为我大书伟辞于壁庶以焜耀区区之望彼死鬼之陈迹其存亡盖不足为重轻也次韵见意云
520910,家藏刘松年小方
157470,含笑花·半面羞藏袂
1053621,书申正己秀才所藏雀竹图后 其一
245369,曹主簿泾自卜寿藏追范石湖韵谨依虚谷使君例
825316,海藏楼杂诗 其十七
993921,送刘道士之山阴阅藏书四首 其二
377050,庵中夏·草中得路便藏身
1211329,题明初所藏暮云楼阁图
53316,蜀府命题所藏唐十八学士瀛洲图
286156,壑庵·一壑藏春水
829703,又为思缄题所藏二帖
1244121,题袁寅亮进士所藏袁安卧雪图
1219577,题达监司所藏柯博士秋山图
215039,藏春峡·花落花开蝶自忙
843142,题傅沅叔藏园校书图
560488,题顾叔明所藏湘江雨霁竹图
402949,金缕曲 为王瑶卿供奉题所藏罗瘿公手书诗卷
742473,集吴香亭太常斋见所藏孙雪居董香光书画合册作歌
1033949,去年访曾幼卿通判携歌舞者同游凤山仆有歌舞不容人不醉樽前方见董娇娆之句今岁到凤山又辟西隅筑堤种柳新作数亭且欲建藏书阁后堂佳丽皆屏去之矣仆嘉其志又有数语并录之 其一
514945,题沈廷美尚宝所藏四烈妇图 其二 楚妃投水
83614,跋冯氏兰亭·茧纸藏昭陵
1146931,送圆仁三藏归本国
73159,满庭芳·藏头拆字
903621,观汪丞相所藏崔白画罗汉
913828,题文发叔所藏潘子真水墨江湖八境小轴 其七 西湖夏日
1228143,为学古澹藏主题安庆金君美秀野次潘仲举韵
995866,题王居士所藏王友画桃杏花二首 其一
432877,月下笛 题俞慧殊藏陆宣公墓古柏重青图
418117,晋斋藏张溥孙三家画剩二首 其一
1252028,白云山谷歌赠麟藏主
1097580,题陈藏一山房
97114,观王文之所藏荆公帖
648817,题杨学士藏子昂画刺虎图
921422,王伯扬所藏赵昌花四首 其三 芙蓉
691544,秋风三叠题德邻家所藏画三首
194786,西江月·花下春藏五马
999930,送陇州使君刘仲仪左藏赴治
325215,五十书怀·此去行藏总听天
633796,甲寅春二月与蜜在慧均四藏自显超汉铁关洞开瓶出法敌不息漪文始十靖一挂云诸子从燕台南归取道泰安登岱岳所经胜槩矢口咏歌共得五言近体十二章以志一时 其六 七十二君封禅辇路
975630,题刘都干所藏杨秘监诗卷
840410,题焦山书藏曝书图五首 其五
431018,湘月 题李洞庭先生所藏康南海遗札墨迹
1244111,题边桂节所藏雪夜访戴图
373803,答太白宗藏主
253969,贺怡藏法师览揆良辰
860831,题冯申之所藏徐皋鱼
594346,观顾道行所藏面壁图
835203,金缕曲 其一 题耆寿民见山楼藏书图
1233337,咏儒释道三教总赠程洁庵：儒理十五首 其十二 退藏于密
1205536,摸鱼儿 题熊伯宜藏梅花卷子
498772,武夷有茶灶石酒杯洞大藏峰翰墨峰仙机岩棋盘石天壶峰大小廪石幔亭峰仙迹石水帘洞投龙洞汉祀坛大隐峰升真洞一线天灵岩石晚对峰虹桥金鸡洞钟峰玉女峰妆镜台铁笛岩天游峰钓矶石偶即景写怀馀未尽书也 其二
9896,同张侍御咏兴宁寺经藏院海石榴花
286335,倒影潭听藏公弹琴因怀抱光子
1085290,予还自武林葺先人弊庐净扫一室晨起焚香读书于其间兴至赋诗客来饮酒啜茶或弈棋为戏藏书数百卷手自暴之有小园时策杖以游，时遇秋旱驱家僮浚井汲水浇花良天佳月与兄弟邻里把酒杯同赏过重九方见菊以泛觞有足乐者每览镜见苍颜白发亦聊自叹也作小诗十五首 其七 弈棋
143089,藏春园·园径萧条草树荒
1210357,开元真人见贻刘商观弈图石刻毫发布缕皆尽精妙盖李龙眠临唐画本茅君彦模勒为玉局仙翁所藏云
973552,题旧日所藏晋陶渊明采菊东篱下悠然见南山画
572800,余友黄鹄生与所䁥相去二舍为置符以召各藏其半题曰花信风社中雅其事作诗咏之 其一
10611,渭上送李藏器移家东都
1238240,司马氏藏唐子华山水扇画
296330,惜红衣·金纤纤墓铭册，袁随园撰，王梦楼书。及门王韶九大成藏其世父惕庵翁物
147464,静寄孟运管招客皆藏春侍郎故人因与花翁孙季
182429,藏穷深极·祝融朝日丽东天
426935,余旧藏何越巢诗条墨迹散佚庐子枢以重价购得属提其上
1224372,三月三日奉陪宪使程公游麻原第三谷宴藏书山房白云楼
1252043,送的藏主归里
1070235,某前日谒见国史侍读尚书获款燕谈蒙出示周杨子书报许藏山中得岩壑之胜过冷泉亭者叹想不已俾某赋诗退成七言古句一首上呈
692533,题朱给事所藏马牛二图
493056,题许侯藏临江杨万户所燕饯诗后
1228244,题王士让御史所藏画卷 其二 古庙折碑
1181000,题弘顗三藏院
1089777,旧藏英石沈俭夫族人处谢俭夫转为取还
311392,定风波·两年以来，屡约藏云来武汉大学讲学，辄因故不果，拈此调之
1009148,题汶藏主行卷
373779,读古剑和尚语送是藏主归常州
1105112,寄夏文州左藏佾
1219071,题邓毅夫所藏青山白云图
521184,题戴司寇所藏张翚小景四幅 其一
1176908,蓟丘览古赠卢居士藏用七首 其五 田光先生
498771,武夷有茶灶石酒杯洞大藏峰翰墨峰仙机岩棋盘石天壶峰大小廪石幔亭峰仙迹石水帘洞投龙洞汉祀坛大隐峰升真洞一线天灵岩石晚对峰虹桥金鸡洞钟峰玉女峰妆镜台铁笛岩天游峰钓矶石偶即景写怀馀未尽书也 其一
921581,书晁补之所藏与可画竹三首 其一
381506,李厚基求题所藏李星野先生书册
749711,题瑞邸所藏宋文丞相蕉雨琴拓本
342384,登云岫·列巘深藏古刹开
44079,西蜀江君骏卿不知自何处收得余二十二岁所·藏拙端宜付烬灰
646024,待月轩为式藏主作
441051,鄞州旅次飘雨厉风四更枕上口占海藏韵 其二
560702,题奚彦礼所藏画四首 其二 天鹅
242994,蒙蔡藏用惠古风一轴叹仰不足辄赋病桐书为谢
330328,读吴思道藏海诗集效其体
457481,郁盦藏兵有感 其一
1235626,草堂陵藏主火浴牙齿数珠不坏坚固尤多因为说偈三首
945328,送同少野赴华藏寺二首 其一
38656,赠智舟三藏
25612,牡丹·残花何处藏
957902,宝藏寺雨中
91762,藏船屋·望见官旗御舳舻
376248,复斋奚左藏挂冠
638250,游德藏寺四首 其二
1070463,比阅藏经偶成短偈仍寄同志者
72034,桃源忆故人·再用前韵藏头拆字
1130257,与谦知藏二首
649958,题杨宗勖所藏赵仲穆小画 其二
1130111,书申正己秀才所藏雀竹图后
453354,乐耕堂观藏画
983651,题徐氏子所藏四贤帖
130424,经史阁·买书堆屋当藏珍
432069,街头焚书数日，亦尽肩出所作所藏参与盛会二首
632578,送明藏主同大茎尸林二子南行
648041,题刘伯埙所藏云山图
440245,菩萨蛮 午休购得茉莉一株，入门置一角，旋踵即忘，花气则藏而愈烈
1184560,虹藏不见
195230,题陈高十所藏冬青枝上白头翁画
400031,参观新会博物馆藏陈白沙手卷
471101,和饮酒二十首初夏天气微热方不欲饮偶龚仲和邀看园中新绿出所藏名酒意甚乐之次日捉笔和渊明先生饮酒诗数篇与索一樽独酌会雨窗无事遂尽和其韵（录十五首） 其四
376361,藏六庵·虚空正体没边涯
696575,题广信府李经历仲谋所藏画 海棠画眉
434863,跋杨损之所藏杨德懋秋江捕鱼图二首 其一
1047835,游藏春坞用坡韵复题其后
1238444,题宋仲观所藏竹图
377452,立藏主之三衢
784270,就藏上人乞花木栽草堂前戏效少陵体 其四
1226002,题鲁彦康所藏范宽山水手轴
100082,王晋卿所藏著色山
243055,藏岩·小年轻别庐山道
370634,黄仲明所藏巩诗小卷次上饶韵
504097,用季翔韵题胡长史所藏东坡墨竹
1203093,玉炉三涧雪 藏头
405056,题周汝昌先生所藏顾二娘制翔凤砚1956
703339,从罗浮下山与张给谏相订度中秋于尹澜柱园亭张公以行止不果予独泛舟泊南海神祠上浴日亭同四藏自显自坚铁关诸子赏月
194501,藏冰井·尤喜凌人职未隳
1026616,同陈太丞游龙兴寺经藏院
1003976,上后乐刘先生左史十首用襄阳诗两句行藏坚晚节进退法先民为韵 其三
315804,焦山·阮公昔年置书藏
681241,题衍圣公所藏画竹因忆阙里南园之胜故篇终及之
182376,藏穷深极·大明遗甃已荆生
1227021,题危太朴所藏荥阳郑虔画秋峦横霭图二首 其一
1218812,题罗成之藏柯敬仲悬崖竹
33729,送三藏归西天国
1141341,题东玉师府所藏潇湘图
1214873,题黄德明所藏山居图
502667,题梁氏家藏十牛图
505163,题吴至灵葆和藏董元寒林重汀图歌
961038,赞赵直阁所藏四美人画 夏
1201544,桃源忆故人 赠董先生藏头联珠
937839,题江参山水横轴画俞秀才所藏二首 其二
1218617,题顾秀才所藏舟中看月图
677152,元日偕子将无际过比玉居停主人费节卿为置酒竟日节卿好武时鼓掌说剑比玉有家藏端砚甚古至是始得观
912176,左藏南库西庑下纸閤负暄戏题
964407,洪庆善韩美成观所藏宣和殿书画庆善有诗次韵
306750,题所藏明初王宗素墨梅册
661538,西园八咏 其一 藏书屋
340053,侄端旻示游浦江花藏寺诗且道皎老相问意因次韵并烦为简皎公禅师
253659,别贵州·西游已许识行藏
250328,丙戌清明后一日京城小雨夹雪甘棠诗社邀游玉渊潭赏樱花相约步海藏楼韵
528936,予家旧藏潇湘图聊因旧题各成短咏八首 其六 洞庭秋月
290529,余性爱琴某山人有旧藏古琴四其最佳者为赵松雪故物许自南中携赠诗以速之
94057,题汪季路所藏李伯时飞骑斫鬃射杨枝及绣球图
826174,被花恼·题吴湖帆所藏薛素素、马湘兰兰花合卷，用宋杨守斋韵
355949,题蒋崇德彝所藏明皇夜游图
34511,哭宝月三藏大禅师
263291,范之以先德尚书公三万卷楼藏书图属题，敬赋一律
521252,题孙良辅所藏小景四幅 其一
552703,题钱同知所藏张天师画
1133465,题赵希贤所藏墨竹 其四
528830,题严介溪所藏何竹鹤画
525955,题罗侍御所藏周必都古松障
185279,题王复初所藏子昂临禊帖
455694,观荣宝斋藏李晴江风竹图依其题诗原韵 其二
698958,钮给事中花园藏陈山人所画水仙花次王子韵一首而陈文学示我五首故我亦如数
997519,定风波 其一 次高左藏韵
240148,挽李左藏·少年谓子气横秋
793088,家藏旧画效前人论画绝句各系一诗 其十
233011,和同使郑内藏见始之作
1047304,第六十九洛浦藏教颂
140635,旧藏文与可墨竹未有对者叔祖阁学以一枝为惠
793090,家藏旧画效前人论画绝句各系一诗 其十二
681016,题蒙庵兄家藏范宽春景
402813,瑶华慢 董茧庵属题所藏郑恒崔夫人合袝墓志
818322,题蔡哲夫藏担当《山水册》
568893,入小祗林门至此君轩穿竹径度清凉界梵生桥达藏经阁
291518,清平乐·天梅得里中钱氏所藏何猿叟致张诗舲手札，嘱题
509193,题顾仲礼藏春楼
235424,玉烛新·荒山藏古寺
92046,题文发叔所藏潘子真水墨江湖八境小轴西湖复
1096343,崔中书家藏阎立本醉道士图
730221,题家藏灵飞经真迹
498773,武夷有茶灶石酒杯洞大藏峰翰墨峰仙机岩棋盘石天壶峰大小廪石幔亭峰仙迹石水帘洞投龙洞汉祀坛大隐峰升真洞一线天灵岩石晚对峰虹桥金鸡洞钟峰玉女峰妆镜台铁笛岩天游峰钓矶石偶即景写怀馀未尽书也 其三
965739,初冬快晴陪宣卿叔夏游石头庵过三生藏穷深极峻遂登上封却下福严最爱廓然亭静憩久之乘兴入后洞置酒云庄榭徘徊方广阁山行崎岖不可以马虽笋舆傲兀小劳尚胜骑从之烦也既归山前之翌日复会于坚伯兄小阁同安赵涧看北山馀雪披云映日翠瑩珑葱殆难模状因访季父庙令欢饮而罢集记所见成十五绝 其一
346081,大涤洞·大涤山藏碧玉函
1070500,题蒋崇德彝所藏明皇夜游图 其二
965735,初冬快晴陪宣卿叔夏游石头庵过三生藏穷深极峻遂登上封却下福严最爱廓然亭静憩久之乘兴入后洞置酒云庄榭徘徊方广阁山行崎岖不可以马虽笋舆傲兀小劳尚胜骑从之烦也既归山前之翌日复会于坚伯兄小阁同安赵涧看北山馀雪披云映日翠瑩珑葱殆难模状因访季父庙令欢饮而罢集记所见成十五绝 其六
1210280,东坡书蔡君谟梦中绝句二放营妓绝句三虞伯生题四绝于后真迹藏义兴王子明家要予次韵凡九首 其八
374179,寄明藏主·一颗如来藏里珠
374179,寄明藏主·一颗如来藏里珠
905673,藏春峡
1113174,前日从赵漕饮因得遍观所藏书帖之富既归戏成三绝简之
1139153,题王复初所藏子昂临禊帖
182430,藏穷深极·山北山南久问津
11494,秋夜同畅当宿藏公院
434707,题张信道所藏李元素淮山清晓图
507387,题赵尚书所藏花鸟四首 其三 鸲鹆
741849,观大兴师所藏宋椠施注苏诗本敬题其后
370654,伯皋所藏名妓墨竹逼令题之可谓戏剧
1016924,一化士取血和墨写藏经乞颂
108275,题孙廷玉藏李仲宾墨竹
504074,题胡长史所藏风晴雨嫩墨竹四首 其二
899671,清平乐 题处梅家藏所南翁画兰
665492,徐瑞卿给事所藏仲姬墨竹引
574406,题景娄翁寿藏追次张东海韵
819961,乙亥秋九月至旧京视散原先生日与心畬叔明立之伯夔君任羹梅过从寥志强志贻先询先诸弟自津沪来旧藏五十馀年陈酒由杭至京连日聚饮赋诗属和 其一
504691,周伯温题郑仁可所藏张师夔斗泉图
649650,题凌士昌所藏张子厚山水 其二
793084,家藏旧画效前人论画绝句各系一诗 其六
288410,浪淘沙·飞鸟藏阴
346105,祥光亭·地藏金玉自通灵
1022566,泳侍者不受育王藏主
690047,题张仲敷所藏古画册
883896,绍兴乙□中秋后五日乘休沐之□□舟□家为藏真之游
342194,再赋·幽壑藏云水作声
75626,题陈氏所藏著色山水图
922416,跋王进叔所藏画五首 其一 徐熙杏花
378975,冷然斋·以身为舌毗尼藏
859005,送崔左藏之广东
229496,归洁庵·行藏自有意
517043,题印上人所藏赵子昂杨廉夫二公墨迹卷
993922,送刘道士之山阴阅藏书四首 其一
521254,题孙良辅所藏小景四幅 其三
507383,题吴志道所藏画竹
373253,大人生日·畴昔东华典秘藏
345617,金沙寺端老营大藏殿小诗示之
784446,藏师饷予山豆苗诗以纪之
188912,游山光寺·寺藏两山腹
676175,题郑可之所藏郑嘉言遗墨
165258,石室·琅玕蕊笈藏幽谷
452713,西藏杂诗之大昭寺
516360,寿藏为顾静趣赋
355130,城上怀古·水涨藏舟浦
356086,比阅藏经偶成短偈仍寄同志者
1053324,病中四绝句呈刘景文左藏 其一
161433,送举人·藏山有良玉
1129774,书性之所藏伯时木石屏
751911,检藏书感赋 其二
