924824,试制举人呈同舍诸公二首 其一
187101,乙卯七月庚子魁祀礼成同舍诸新元相与宴拟鹿
1079257,晚霁独坐戏呈周元举刘希范许少伊同舍诸兄二首 其一
1048106,次韵无咎戏赠兼呈同舍诸公
364738,贡院奏号奉呈同舍诸公
1112478,晚霁独坐戏呈周元举刘希范许少伊同舍诸兄二首
819761,东山夜归示同舍诸子
1043650,赴官京东同舍诸公观音院见饯有赠并简不至者
915038,二月二十四日寺丞田丈清叔及学中旧同舍诸丈拉予同屈祭酒颜丈几圣学官诸丈集于西湖雨中泛舟坐上二十人用迟日江山丽四句分韵赋诗余得融字呈同社
791925,寒柳二律示南菁同舍诸友，并索和章 其一
1117081,试制举人呈同舍诸公二首
1041171,恩赐御书呈同舍诸公
1079307,睡起戏书呈葛鲁卿席大光周举同舍诸兄
1079258,晚霁独坐戏呈周元举刘希范许少伊同舍诸兄二首 其二
351509,晚霁独坐戏呈周元举刘希范许少伊同舍诸兄
960744,乙卯七月庚子魁祀礼成同舍诸新元相与宴拟鹿鸣也故敢亦拟劝驾诗呈幸领此意
1058128,与同舍诸公饮王诜都尉家有侍儿辈侍香求诗求字者以烟浓近侍香为韵
1051575,试制举人呈同舍诸公二首 其二
1057526,贡院奏号奉呈同舍诸公
1062762,五月十八日陪同舍诸友游慈云寺
576497,初入书阁呈董宗文博士兼简同舍诸公
118787,试制举人呈同舍诸公
351500,睡起戏书呈葛鲁卿席大光周举同舍诸兄
791926,寒柳二律示南菁同舍诸友，并索和章 其二
182772,秘阁观唐法帖呈同舍诸公
815748,寒柳二律示南菁同舍诸友，并索和章
94290,二月二十四日寺丞田文清叔及学中旧同舍诸
271859,东山夜归示同舍诸子
850609,秘阁观唐法帖呈同舍诸公
