947567,贺子永为令郎醮妇
518455,敬蒙书赐梧冈二大字伏睹八法精妙超入神品宠荣所及不胜喜庆十袭珍藏永为家宝谨赋诗谢恩
1124043,晏斋余自名也故常以榜自随乃以名厅事之东偏厅之后旧有一室面对竹余山居富此物亦以竹隐名对此竹而有思于山中故以思隐名之思隐之东又辟屋丈许连以为斋乞名于张君伯永为名曰容斋并作三绝志其事焉
29726,尚书新创敌楼·异境永为欢乐地
218825,贺子永为令郎醮妇
617604,三水蒋令公聘黄逢永为诸生授业诗美其事
773848,评台湾收入版图永为海外文物富饶之邦
948812,登仕郎曾忠佐迎母王于乐氏母许新居成即归于是筑第高沙极轮奂母欲迁而逝乃虚中堂榜之曰思永为赋四韵
971679,晏斋余自名也故常以榜自随乃以名厅事之东偏厅之后旧有一室面对竹余山居富此物亦以竹隐名对此竹而有思于山中故以思隐名之思隐之东又辟屋丈许连以为斋乞名于张君伯永为名曰容斋并作三绝志其事焉 其一
971680,晏斋余自名也故常以榜自随乃以名厅事之东偏厅之后旧有一室面对竹余山居富此物亦以竹隐名对此竹而有思于山中故以思隐名之思隐之东又辟屋丈许连以为斋乞名于张君伯永为名曰容斋并作三绝志其事焉 其三
971681,晏斋余自名也故常以榜自随乃以名厅事之东偏厅之后旧有一室面对竹余山居富此物亦以竹隐名对此竹而有思于山中故以思隐名之思隐之东又辟屋丈许连以为斋乞名于张君伯永为名曰容斋并作三绝志其事焉 其二
