802750,秋夜与周南村作
683575,月夜与张将军及诸贤合饮海舶即事
892875,寒夜与伯氏晏坐
505735,冬夜与池文仲联句
273534,六花飞·雪夜与友人饮，用松隐韵，赋呈
603961,春夜与舍弟小酌二首即席赋 其一
644278,夏夜与钱子贞坐西斋以欲觉闻晨钟令人发深省之句为韵各赋诗以叙会别之意 其二
485138,寒夜与家人坐语忆客中时
909911,三冈亭在邑西南三十里秦昭王使谒者王稽使魏夜与范雎言先生待我于三冈亭之南是也
301061,夏夜与大兄话别
538889,莺脰湖洗天亭月夜与公瑕子念王复舍弟饮别 其一
306818,远深楼烛夜与纫诗铭诗揖舜读婉婷外大父福雅堂遗著分赋
440612,春夜与陈曙共饮西门外继登郭公山归途雷雨大作四首 其三
295400,秋夜与其觉谈诗
636247,元夕后一夜与诸子话别
553594,雪夜与乡人旅邸中小酌
597528,秋夜与谢山人茂秦
765363,癸亥春夜与李二莪璋香小饮醉后有赠 其二
459891,元旦夜与老二饮醉作。其人了然于湘江上下民间传说，为余缕述
408242,深夜与柱尊酌酒次韵
944106,雪夜与师是棋次前韵
1007466,天池寺夜与主僧觉翁圆上共坐谈浯溪山水之胜信笔因赠长句
11819,冬夜与故友聚送吉校书
256726,辛丑中秋夜与用亨汉臣济之君祥子昂仲宽及诸同志聚饮于学宫阴不见月
453990,新春夜与杜蘅网聊二首 其二
458961,四月十夜与肖坐作语不得语歌
247719,春云怨·十一月十五夜与咏雩湘碧慈博步月城西
992093,舟中夜与家人饮
526699,雪夜与鹏举弟过禅房 其二
78883,致斋监中夜与同官纵谈鬼神效宛陵先生体
206660,秋夜与陈孟话别
452558,中秋夜与虎公臞公乐公宿三清山下
384894,鹭洲雨夜与钟问渠茂才话旧有感
741564,雨夜与梦钿坐话
888958,十五夜与朝宗对月把酒朝宗屡怀归因赋二首 其一
401333,贺新郎 三月望夜，与妇苏堤玩月，归华侨饭店作
1237343,寒夜与王记室宴集
228436,夏夜与东叔昆仲小酌
544921,忆燕中元夜与朱十六童三安二纵游长安陌上今倏十载矣山馆寂寥再逢兹夕感旧赋此
435500,元夜与泰禅洛阳观灯
746446,八月十四夜与刘兰心玩月贞元阁
24501,冬夜与蔡校书宿无可上人院
1031870,夜与仲严叔倚季成三弟同坐闻笛各赋一绝
62871,秋夜与金璘秉贞同酌有怀沈愚
53089,八月十三夜与文济时范质甫城西泛舟达秦淮
574439,秋夜与东泉澜庵坐月
1035446,秋夜与陈孟话别
1169296,冬夜与修睦上人宿远公亭寄南岳玄泰禅师
693677,十六夜与朱都二子酌月承天寺二首
466855,春夜与陈曙共饮西门外继登郭公山归途雷雨大作四首
757128,雨夜与李友石曹烟岩两侍郎沈茝石朴锦铃曹荷上三承宣赵兰西学士游挹清楼
1062548,八月十五夜与诸友游南湖玩月
103000,夜与原甫江家步归
531381,四月五日夜与叙庵末庵乐庵得庵话别集句
472407,暑夜与葛九惟善步信州浮桥
703797,夏夜与钱子贞坐西斋以欲觉闻晨钟令人发深省之句为韵各赋诗以叙会别之意
629576,山间秋夜与衲子奕兼呈以诗
550063,八月十一夜与介孺看月成醉共赋十四盐 其二
675963,夜与许生酌别
244767,秋夜与空舟弄泉于北溪之上赋是诗
312057,竹枝词·不知昼夜与晨昏
948124,二月十七夜与诸弟小酌尝榧实误食乌喙乌喙堇也古书云以堇寘酒杀人戏成小诗
598269,雨夜与何名川宪副
400054,春云怨 十一月十五夜与咏雩、湘碧、慈博步月城西，忆去年与霜筠曾留是约，抚景追情，有不能已于言者
690208,雪夜与鹏举弟过禅房
452291,辛卯三月应田茂兄邀到杭是夜与翼奇先生深深女史选钢夫妇宴饮楼外楼散后寄翼奇先生
428437,丁未七月十五夜与连仲甫小万柳堂宴集二首 其一
630437,秋夜与诸衲坐月
440613,春夜与陈曙共饮西门外继登郭公山归途雷雨大作四首 其四
1239636,秋夜与子充论文退而赋诗一首因简子充并寄胡教授仲申
1211426,寒夜与王记室宴集
490922,秋夜与徐兵宪东轩小坐
760787,月夜与季平饮萧氏台 碧空云散月华清，梅雨潇潇已放晴。水国荷花新世界，前身金粟大光明。千觞鳄海登台寔，万里狮山作客情。我亦思乡更忧国，倚阑同看夜 潮阳三生歌
447770,大风雨夜与沪上军持兄饮于芜湖，约作七虞韵
123646,顷乾道辛卯岁三月望夜与周子充内翰泛舟石
257161,元夜与泰禅洛阳观灯
866679,建炎庚戌中秋夜与同官相期于月下既为具顽云障空不可人意作诗以纪之得赏见二字 其二
138404,夜与作霖避暑南园登江月台
537890,月夜与惟敬浮玉岛饮
1069752,雨夜与模论中原旦起模与徐惇济游清凉观形势嘉其有志因以勉之
817881,中秋夜与小平、绥方、桥川、子雍同饮社园作
663158,清明夜与诸友围棋观音寺
951540,水调歌头 括东坡月夜与客饮杏花下
302534,中秋夜与小平、绥方、桥川、子雍同饮社园作
550062,八月十一夜与介孺看月成醉共赋十四盐 其一
1172317,冬夜与故友聚送吉校书
415595,春夜与熊鉴汝伦共饮，各有诗，共用一韵
884381,八月十三夜与张检法泛武溪
514311,斋夜与汪伯谐庶子陆鼎仪张启昭谕德联句 其一
888039,数年前有小词微雨后落花天娇态病恹恹怕人猜著是相思镇日不开帘宝钗横蝉鬓乱院宇待人归尽缓移莲步玉阑前纤手掐花钿兹月夜与客饮梅花下一姝歌前词复出笺徵余新作
999575,月夜与陈行父杨公济吴常甫出诣蔡子难
83431,夜与子遹说蜀道因作长句示之
105704,舟中夜与家人饮
479869,月夜与何子有饮梅村社赠之 其二
301877,十一月十四日半夜与十弟及妻儿自无锡城南王祥巷乘小舟沿运河避难十七日晚达镇江
739559,夜与谷林坐天目山房看月谈及倪文正公筑灵台以种竹乃以徽墨涂壁谷林欣然思效之率尔有作
973761,五月十有八夜与审知同宿塔山次审知韵
602088,省垣夜与严春门掌科共酌
832368,烛影摇红 丁卯正月初三夜，与闺人烧烛候春
368281,月夜与儿曹露坐庭中
1213174,良月九日夜与吉甫提举宿王氏精舍风雨不寐闻寄令弟潜夫同知佳章骨肉之情蔼然具见令人讽诵不已别后次韵写怀
1162788,冬夜与友人会宿
23284,秋夜与友人宿
1036205,减字木兰花 二月十五日夜与赵德麟小酌聚星堂
208681,八月十三夜与张检法泛武溪
424961,中秋夜与儿女话日本杂事
373027,月夜与张辑论诗
52774,夏夜与钱子贞集西斋赋诗叙别
711102,月夜与姚君作陆青章泛舟
173502,元夕夜与戎琳殊三老僧对棋琳请作诗赋之
428438,丁未七月十五夜与连仲甫小万柳堂宴集二首 其二
436148,元日夜与二三子小酌
469881,秋夜与俞安期宿乌龙潭吴家水亭
534338,十五夜与傅丁戊月坐得圆字
825237,六月十五夜与稚辛拔可至华园取凉
83430,夜与儿子出门闲步
673851,秋夜与客饮酒桂花下
12969,秋暮忆中秋夜与王璠侍御赏月因怆远离聊以奉寄
287972,中秋夜与儿女话日本杂事
482075,客夜与故人话旧
95203,五月十有八夜与审知同宿塔山次审知韵
34067,夜与张舒话别
1196552,夜与张舒话别
1078052,除夜与宗之对酌怀家
435112,辛丑中秋夜与用亨汉臣济之君祥子昂仲宽及诸同志聚饮于学宫阴不见月 其二
152153,二月十七夜与诸弟小酌尝榧实误食乌喙乌喙堇
901196,九月望夜与诗僧可久泛西湖
888771,夜与作霖避暑南园登江月台二首 其一
759628,夏夜与季平萧氏台听涛，追话旧事作
325489,癸亥春夜与李二莪璋香小饮醉后有赠
1089040,月夜与蔡济忠曹公会汎舟自水东归
1107320,建炎庚戌中秋夜与同官相期于月下既为具顽云障空不可人意作诗以纪之得赏见二字
1250798,雪夜与友人同赋四十韵
445858,立春前夜与秋扇和轩约赋
473594,九月十七夜与周国雍话旧
672886,冬夜与惟清小酌用笼字韵
52378,月夜与何子有饮梅村社
526698,雪夜与鹏举弟过禅房 其一
79206,雨夜与邻翁饮用前辈韵
659163,月夜与客饮千人石
612403,秋夜与修公谈禅步投赠元韵酬答
809005,元夜与诸王宴饮乾清宫
711400,冬夜与陈、梁二君咏物，各得三首 其二 尘
668264,金陵秋夜与彭寅之汤子重步月
64428,九月十七夜与周国雍话旧
158026,八月十六夜与宗哲纯甫翫月
794912,南楼令 秋夜与阶青弟作
569844,月夜与张将军及诸贤合饮海舶即事 其一
825541,市楼有号新世界者八月十四夜与聘三锡之鉴泉共饮玩月
610864,春夜与社中诸君凤台言别因留赠
615473,冬夜与戴公纶诸子泛月
408327,十一月十四日半夜与十弟及妻儿自无锡城南王祥巷乘小舟沿运河避难十七日晚达镇江
709310,浴佛前四夜与周量芝五震生元孝订游海幢寺先柬阿首座分得城字
621524,朔夜与袁大司马话别
837156,夏夜与大兄话别
525981,八月十三夜与文济时范质甫城西泛舟达秦淮三首 其三
301826,深夜与柱尊酌酒次韵
475270,十六夜与朱都二子酌月承天寺二首 其二
624207,丁卯夏夜与友人携琴烹茗水月宫
99676,月夜与客饮酒杏花下
103191,月夜与兄公度纳凉闲行至御桥
644280,夏夜与钱子贞坐西斋以欲觉闻晨钟令人发深省之句为韵各赋诗以叙会别之意 其四
569845,月夜与张将军及诸贤合饮海舶即事 其二
475300,五月望夜与诸君山中再酌和仅初韵
1111773,夜与作霖避暑南园登江月台二首
721146,冬夜与陈、梁二君咏物，各得三首 井
1234959,除夜与邬进德
1167168,十五夜与友人对月
1100455,月夜与张辑论诗
530232,十五夜与汝盛泛舟湖中再叠前韵
992593,夜与邻几持国归
459412,中秋夜与肖饮月下。无席而坐地，以酒瓶盖代盏，以月代日，捉二萤囊纸以替灯。乐甚，醉作此。诗成忽忆先时出院者，想车已到家，此生之途亦已到站矣。人苦如是，予乐如是，天心之不公平也。及予乐时，竟未一念及其人，人心之不相通也。苦乐相形，予惘惘若有愧疚。然空言何用，“一如饱汉讥饿枵”而已，如斯而已
750394,八月十五夜与同人西郭泛舟至一览亭迟任庵庸庵不至 其四
218364,晴·西风一夜与晴期
603962,春夜与舍弟小酌二首即席赋 其二
711399,冬夜与陈、梁二君咏物，各得三首 其一 井
475269,十六夜与朱都二子酌月承天寺二首 其一
674916,夜与孙九峰吏侍论丘深庵太学故事慨然兴仰乃用壁间黎太仆先生韵赠孙
595884,秋夜与子伯话旧
1062594,月夜与儿曹露坐庭中
436618,辛丑中秋夜与用亨汉臣济之君祥子昂仲宽及诸同志聚饮于学宫阴不见月
13226,八月十五夜与诸公锦楼望月得中字
22515,雪夜与真上人宿韩协律宅
52877,冬夜与高五秀才馆林八员外宅
250483,己丑腊月十六日夜与景秀野鹤高凉小聚席间孤鹤兄自兰州传诗助兴戏赋此篇为谢
702890,春夜与舍弟小酌二首即席赋
668391,五月十三夜与子重履约履仁石湖行春桥看月
451716,醉蓬莱 己丑立夏夜与力夫抚仙湖畔茗坐
992594,夜与原甫江家步归
387312,满庭芳·春夜与少聚卿子岱饮花下
921029,月夜与客饮杏花下
636308,中秋夜与诸子归舟泊港口，玩月分赋
817810,中秋夜，与李子沧萍、张子友鹤，观月社园。忆去年中秋与诸贞壮、黄元白同饮于此，李、张二子亦与焉。贞壮、元白后先南归，惟二子尚相从不去。又朝来始得唐天如兵间书，知其仍在人世，伤乱怀远，一时交集。张子为余援琴奏“捣衣之操”，诗以写之
1063922,雪夜与僧拥垆僧曰闻唐刘叉赋雪车冰柱诗为退之所赏愿闻其诗予曰忘矣僧请续之口占以授
381446,六月十五夜与稚辛拔可至华园取凉
591356,鉴江月夜与少承同赋
5287,秋夜与刘砀山泛宴喜亭池
1147767,夜与故人别
36720,春夜与诸公同宴呈陆郎中
1161526,雪夜与真上人宿韩协律宅
991841,月夜与兄公度纳凉闲行至御桥
1193127,客夜与故人偶集
460162,减兰　十二月七夜与肖健谈平生幻想因次其韵
837097,秋夜与阿嫂论诗(1)
1000137,八月十六夜与宗哲纯甫玩月
702372,斋夜与汪伯谐庶子陆鼎仪张启昭谕德联句
158265,月夜与陈行父杨公济吴常甫出诣蔡子难
1167987,秋夜与刘砀山泛宴喜亭池
821323,六花飞 雪夜与友人饮，用松隐韵，赋呈
694523,月夜与何子有饮梅村社赠之
644277,夏夜与钱子贞坐西斋以欲觉闻晨钟令人发深省之句为韵各赋诗以叙会别之意 其一
402545,远深楼烛夜与纫诗铭诗揖舜读婉婷外大父福雅堂遗著分赋
479868,月夜与何子有饮梅村社赠之 其一
132504,遣闷·夜与影同宿
888957,十五夜与朝宗对月把酒朝宗屡怀归因赋二首 其二
31141,入蜀赴举秋夜与先生话别
465679,中秋夜与李八老塘边赏月
55335,秋夜与子充论文退而赋诗一首因简子充并寄胡
469862,寒夜与范汭过黄习远萧萧斋宿得人字
482670,冬夜与高五秀才馆林八员外宅
749033,夏夜与龚定庵王子若豫园话月子若为作图
1171218,七月二十八日夜与王郑二秀才听雨后梦作
935332,冬夜与溥庵主说川食戏作
440611,春夜与陈曙共饮西门外继登郭公山归途雷雨大作四首 其二
62542,五月望夜与诸君山中再酌和仅初韵
487166,蝶恋花 丙寅寒夜与宛君谈君庸流落相对泣下而作
65706,十六夜与朱都二子酌月承天寺
331618,客有馈鲜鲫月夜与宗之溪上放之
1187570,入蜀赴举秋夜与先生话别
1063026,中秋夜与赵承之杨时可月下联句
385152,金陵秋夜与彭寅之汤子重步月
606063,十四夜与诸文学对月酌别
676840,春夜与吴山人饮穆前江宅招妓弹琵琶不至
386596,郡馆寒夜与止翁话别
888770,夜与作霖避暑南园登江月台二首 其二
1071768,夜与疏山清公对语因设果供戏成长句
33619,避地冬夜与二三禅侣吟集茅斋
750391,八月十五夜与同人西郭泛舟至一览亭迟任庵庸庵不至 其一
1140479,秋夜与空舟弄泉于北溪之上赋是诗
458542,夜与肖健说童年事
139069,十五夜与朝宗对月把酒朝宗屡怀归因赋
936705,致斋监中夜与同官纵谈鬼神效宛陵先生体
917657,中秋夜与赵鼎臣狄端叔月下联句句 其二
283591,霜花腴·暂归故里，薄游城邻，风日不殊，坊巷犹是。夜与磊安清话，援笔记之。用梦窗韵
27255,夜与故人别
249465,中秋夜与李八老塘边赏月
386781,鹧鸪天·中秋宿灵石县，秋花满庭，房栊新净。夜与内子待月，漫赋此解
765362,癸亥春夜与李二莪璋香小饮醉后有赠 其一
514313,斋夜与汪伯谐庶子陆鼎仪张启昭谕德联句 其三
151930,九月望夜与诗僧可久泛西湖
165319,夜与仲严叔倚季成三弟同坐闻笛各赋一绝
1160370,冬夜与蔡校书宿无可上人院
360208,夜与方仲履饮
453989,新春夜与杜蘅网聊二首 其一
514314,斋夜与汪伯谐庶子陆鼎仪张启昭谕德联句 其四
301032,秋夜与阿嫂论诗
855186,西江月 其三 长安秋夜与诸君饮，分题作
833919,青玉案 清夜与二窗泛舟秦淮
1162506,秋夜与友人宿
564842,月夜与客閒步中庭
815017,八月十五夜与同人西郭泛舟至一览亭迟任庵庸庵不至
25061,荆州夜与友亲相遇
711401,冬夜与陈、梁二君咏物，各得三首 其三 灯
76375,冬夜与溥庵主说川食戏作
26504,雪夜与友生同宿晓寄近邻
121799,雪夜与师是棋次前韵
759036,调笑令 春夜与墨香听雨
515341,雨中自郡城归至岩镇承谢廷懋廷彝廷馨昆仲款留夜与埙子联句置屋壁用酬雅意且纪岁月云
529395,中秋后二夜与姜蓉塘诸友登楼
351751,月夜与蔡济忠曹公会汎舟自水东归
32688,十五夜与友人对月
813180,癸亥春夜与李二莪璋香小饮醉后有赠
1179300,八月十五夜与诸公锦楼望月得中字
548518,秋夜与林若抚即席赋得回字
936162,雨夜与邻翁饮用前辈韵
302501,中秋夜，与李子沧萍、张子友鹤，观月社园
932453,夜与儿子出门闲步
1147127,春夜与诸公同宴呈陆郎中
1204974,木兰花慢 清明夜与芳洲话旧
833176,鹧鸪天 中秋宿灵石县，秋花满庭，房栊新净。夜与内子待月，漫赋此解
1191640,秋暮忆中秋夜与王璠侍御赏月因怆远离聊以奉寄
800234,中秋夜与泾阳刘西谷编修吴山对月
673461,元夜与鲁翁对话
20913,秋暮八月十五夜与王璠侍御赏月因怆远离聊以奉寄
381807,市楼有号新世界者八月十四夜与聘三锡之鉴泉共饮玩月
308567,烛影摇红·丁卯正月初三夜，与闺人烧烛候春
301030,秋夜与李秀峰代雪轩小饮
515125,元夜与文远联句
17401,冬夜与钱员外同直禁中
756953,春夜与阆音师咏月
606790,秋夜与友人对酌
696288,八月十一夜与介孺看月成醉共赋十四盐
124849,寒夜与伯氏晏坐
569893,夜与诸公饮大雄殿前庭银杏下得月有作
433703,丁未七月十五夜与连仲甫小万柳堂宴集二首
622358,三月三十夜与承之偕二兄小酌计春已去十有三日议各取平上去入之十三韵为五绝以纪事上平十三
490658,十四夜与方司训金进士临水玩月
383109,七月望夜与刘晋川司空约会南旺湖舟中赋赠
301104,元夜与友人话旧
1169845,避地冬夜与二三禅侣吟集茅斋
1157045,冬夜与钱员外同直禁中
480895,秋夜与金璘秉贞同酌有怀沈愚
250402,九月十五日夜与倦客一得眉子小酌浔阳江畔相约赋诗限压眉字
700399,八月十三夜与文济时范质甫城西泛舟达秦淮三首
1035775,夏夜与臧奎陈越会宿河亭联句三十韵
774743,暮春夜与吴焕章邱瑞岚邱桂芳唐英臣侯鹏九壶春楼小集
29235,冬夜与修睦上人宿远公亭寄南岳玄泰禅师
750392,八月十五夜与同人西郭泛舟至一览亭迟任庵庸庵不至 其二
672123,通州秋夜与进士冯子佩言别
11010,客夜与故人偶集
660654,中秋夜与俦弟玩月用西涯韵
459767,中秋夜与肖卢饮于三中操坪月下，及夜之深，尚有吉它数人未去，呼与共饮，更相酣歌
615582,夜与诸子步月
476832,八月十三夜与文济时范质甫城西泛舟达秦淮三首 其二
862742,元夕夜与戎琳殊三老僧对棋琳请作诗赋之
866680,建炎庚戌中秋夜与同官相期于月下既为具顽云障空不可人意作诗以纪之得赏见二字 其一
206414,夏夜与臧奎陈越会宿河亭联句三十韵
489438,中秋夜与坚上人看月
333612,除夜与宗之对酌怀家
105155,夜与邻几持国归
534019,秋夜与张仪仲陈伯求黄仲孝携张合卿过小楼
458931,十二月二夜与肖谈作
932454,夜与子遹说蜀道因作长句示之
247990,醉蓬莱·己丑立夏夜与力夫抚仙湖畔茗坐
221889,建炎庚戌中秋夜与同官相期於月下既为顽云障
739588,禅藻斋观元鲜于伯机草书嵇叔夜与山巨源绝交书卷子
514312,斋夜与汪伯谐庶子陆鼎仪张启昭谕德联句 其二
491033,冬夜与诸友同集冯郡伯园亭分得栖字
957081,顷乾道辛卯岁三月望夜与周子充内翰泛舟石湖松江之间夜艾归宿农圃距今淳熙己亥九年矣余先得归田复以是夕泛湖有怀昔游赋诗纪事
52507,寒夜与范汭过黄习远萧萧斋宿得人字
1055839,晚步汴堤始见春色次夜与蔡君规郑希仁同饮进奏官舍
476831,八月十三夜与文济时范质甫城西泛舟达秦淮三首 其一
452084,九月十五日夜与倦客一得眉子小酌浔阳江畔相约赋诗限压眉字
250513,辛卯三月应田茂兄邀到杭是夜与翼奇先生深深女史选钢夫妇宴饮楼外楼散后寄翼奇先生
969160,夏夜与东叔昆仲小酌
636266,客夜与林叔吾湖上话旧
24731,长安月夜与友人话故山
440610,春夜与陈曙共饮西门外继登郭公山归途雷雨大作四首 其一
176777,天池寺夜与主僧觉翁圆上共坐谈浯溪山水之胜
833797,满庭芳 春夜与少聚卿子岱饮花下
1252081,六月初七夜与岭南族中长少二十二人乘月泛西湖示诸同游
683488,莺脰湖洗天亭月夜与公瑕子念王复舍弟饮别
52540,秋夜与俞安期宿乌龙潭吴家水亭
27650,冬夜与友人会宿
46786,寒夜与家人坐语忆客中时
66184,客夜与故人话旧
610353,冬夜与顾桐柏泛舟弄月
452206,己丑腊月十六日夜与景秀野鹤高凉小聚席间孤鹤兄自兰州传诗助兴戏赋此篇为谢
435111,辛丑中秋夜与用亨汉臣济之君祥子昂仲宽及诸同志聚饮于学宫阴不见月 其一
492753,月夜与旷伯逵夜坐
602544,秋夜与祀山陵
1184017,荆州夜与友亲相遇
467909,新春夜与杜蘅网聊二首
1085704,夜与韶美饮酒瑞白堂秉烛观跳珠，分韵得跳字
1183830,长安月夜与友人话故山
1078162,客有馈鲜鲫月夜与宗之溪上放之
23848,七月二十八日夜与王郑二秀才听雨后梦作
1189885,雪夜与友生同宿晓寄近邻
538890,莺脰湖洗天亭月夜与公瑕子念王复舍弟饮别 其二
642325,春夜与友饮别
644279,夏夜与钱子贞坐西斋以欲觉闻晨钟令人发深省之句为韵各赋诗以叙会别之意 其三
587019,又和汪南隽月夜与余仲栗话旧
547848,寄吴少溪宫录七十 其四十四 七月望夜与刘晋川司空约会南旺湖舟中赋赠二首
528949,月夜与高进之沈德桢诸友过簳山次壁间韵
1057217,枫桥寺读张祐诗碑云长洲苑外草萧萧却忆相从岁月遥惟有别时应不忘暮烟疏雨过枫桥是夜与温老语殊可人翼日又邂逅程梦良二人相送寺门因留一章纪事
1111690,十五夜与朝宗对月把酒朝宗屡怀归因赋二首
85252,夏夜与季平萧氏台听涛追话旧事作
765364,癸亥春夜与李二莪璋香小饮醉后有赠 其三
750393,八月十五夜与同人西郭泛舟至一览亭迟任庵庸庵不至 其三
710102,元夜与友人话旧
