303236,玉楼春·閒中偶与春相见
795031,太常引 七夕早起，偶与女媛围棋
1187356,清明节郭侍御偶与李侍御孔校书王秀才游开化寺卧病不得同游赋得十韵兼呈马十八郎丞公
971847,章少隐尝有逸句云片片梅花随雨脱浑疑春雪堕林梢今日雪后梅已有落者偶与公择清坐举似此诗欣然联成一绝
922120,正月二十六日，偶与数客野步嘉祐僧舍东南野人家，杂花盛开，扣门求观。主人林氏媪出应，白发青裙，少寡，独居三十年矣。感叹之馀，作诗记之
54002,游山偶与客语成句
921566,偶与客饮，孔常父见访，方设席延请，忽上马驰去，已而有诗，戏用其韵答之
354972,偶与诚之小饮翌日以诗谢之
1052762,偶与诚之小饮翌日以诗谢之
76500,偶与客话峡中旧游
755002,午窗苦热偶与三妹话及昨宵梦境诗以记之
945255,杜工部诗有送弟观归蓝田迎新妇二首偶与县尉弟达观同名娶事又同因韵戏示 其一
766600,百字令 其二 秀州十三龄女子徐子琴以拆字谋生，机锋敏捷，偶与同人过访，即以姓名三字效拆字，戏赋之
13118,清明节郭侍御偶与李侍御孔校书王秀才
833610,高阳台 其一 吴县中丞视陕学时，酷好毡蜡，艳一石工妻，以访碑故，再宿其家。偶与淇泉述此事，因赋是解
945254,杜工部诗有送弟观归蓝田迎新妇二首偶与县尉弟达观同名娶事又同因韵戏示 其二
911256,南歌子 偶与子建小酌，知府秘书惠然临顾，此一段奇也。辄成小阕，呈二使君
83133,闲游·溪桥偶与僧游话
100465,正月二十六日偶与数客野步嘉祐僧舍东南野人
948863,平园创三层楼子直秘书远贶新诗有山中宰之句自念挂朝服筑层楼偶与陶隐居相符他日倘得寿与之齐则登临之乐未已也次韵为谢每句用本传中语
1222402,山阳偶与大继长相遇自辛亥年相别至今廿八年矣追念畴昔作诗为赠
1155616,雪暮偶与梦得同致仕裴宾客王尚书饮
102304,偶与客饮孔常父见访方设席延请忽上马驰去已
747880,偶与仲弟研芸为周子坚作小印数方蒙以小词招饮研芸既和其词余亦先以诗谢
414361,偶与西老话及黄晦闻绝笔诗西老感次其韵属余继声兼以题晦闻蒹葭楼诗集
459864,五月十四夜观《泰坦尼克号》后偶与共坐
845281,高阳台 吴县中丞视陕学时，酷好毡蜡，艳一石工妻，以访碑故，再宿其家。偶与淇泉述此事，因赋是解
136158,次病足韵·定数无过偶与奇
936805,偶与客话峡中旧游
1119858,杜工部诗有送弟观归蓝田迎新妇二首偶与县尉弟达观同名娶事又同因韵戏示
19573,雪暮偶与梦得同致仕裴宾客王尚书饮
1210657,吾乡之崖有以青得名者余尝取以自号至元十四年偕御史国瑞外郎周卿有东州之行道出阆州阆之南二十馀里佛阁突兀因周览形胜得河南人王子京青崖石刻不知阆之崖与吾乡之崖一而二者耶抑海内一家山川脉络同一元气二而一者耶或其偶与之合耶乃书此以识
936804,偶与客饮客去戏作
78111,偶与客饮客去戏作
355748,寒溪·溪名偶与故乡同
99529,正月二十六日偶与数客野步嘉佑僧舍东南野
278382,太常引·七夕早起，偶与女媛围棋
471708,游山偶与客语成句
