508996,七月四日避暑天界禧上人西庵号天祥
442392,重游海门咏文天祥四首（古风） 其二
674546,沈天祥宅赏莲有并头品字二种 其二
506482,读文天祥诗
674545,沈天祥宅赏莲有并头品字二种 其一
467311,重游海门咏文天祥四首（古风） 其二
145885,二月六日海上大战国事不济孤臣天祥坐北舟中
680804,文天祥就义
247093,沁园春·读谢天祥兄桥缘一文
442393,重游海门咏文天祥四首（古风） 其三
512532,谢顾天祥送将乐石
1135670,题文文山天祥遗墨
453441,谒文天祥墓
415512,海丰方饭亭吊文天祥
468292,送浙东宪史陈天祥归永嘉
289163,文天祥·崖山悲宋祚
619171,吊文丞相天祥
430224,仲鸣以四贤画象属题各系一诗 其四 文天祥
894797,赐状元文天祥以下
404343,沁园春·读谢天祥兄“桥缘”一文，题后
501520,文信国公天祥
511201,次韵答张天祥秀才
422425,咏史一百三十首 其九十六 文天祥
108259,题文文山天祥遗墨
442391,重游海门咏文天祥四首（古风） 其一
851412,二月六日海上大战国事不济孤臣天祥坐北舟中向南恸哭为之诗曰
442394,重游海门咏文天祥四首（古风） 其四
558148,饮顾天祥家
1231120,送萧天祥为萧山县学官
691313,沈天祥宅赏莲有并头品字二种
