413520,周生明道，萧山周家湖人，家贫失学，致力于医，居恒一卷自随，且性耽吟韵，见余诗慕其为人，毅然携所作诗稿过访，殷殷下问立身治学之道，于其还萧，得四绝示之选二 其一
432940,周生明道，萧山周家湖人，家贫失学，致力于医，居恒一卷自随，且性耽吟韵，见余诗慕其为人，毅然携所作诗稿过访，殷殷下问立身治学之道，于其还萧，得四绝示之选二
1214688,余自辛亥岁馆于魏塘吴氏时义士静心先生方无恙长子彦良应门于家次子景良输力于时皆一时伟人季子季良为赘婿于外与余尤相友善岁壬申景良卒于官所归葬胥山诸孙各求分异学遂废而余乃去矣顷者不逞之徒坏其守冢之庐季良之子璋闻于官罪人斯得众称之曰能故为是诗以勉之
1073865,绍兴壬子某南迁过疏山上一览亭见拟东坡煨芋诗刻龛之壁间诗律句法良是殆不能辨乃宣卿侍郎守临川时所拟作也后数日道次安仁县一士人吴君出宣卿诗数十解示余奇丽清婉咀嚼有味如啖蔗然读之惟恐尽于是拊卷三叹而后知公置力于斯文久矣又二十年宣卿筑室荆溪山中别营一堂以平生所蓄东坡诗文杂言长短句残章断槁尺牍游戏之作尽椟藏其中号景坡自书榜仍为记刻之某欲具小舟造观而宣卿召用今以集撰守吴门乃赋诗为之先
291304,百字令·巢南见示永历钱，索题，且云：仆尽精力于帝，至矣
413521,周生明道，萧山周家湖人，家贫失学，致力于医，居恒一卷自随，且性耽吟韵，见余诗慕其为人，毅然携所作诗稿过访，殷殷下问立身治学之道，于其还萧，得四绝示之选二 其二
284412,周生明道，萧山周家湖人，家贫失学，致力于医
297481,偶成·辛勤终岁力于田
