992129,达观禅师昙颖住隐静兰若或言自此猕猴散走不来颖尝哂曰吾知是山枇杷为多始至也未实故其去将实也必群集后果然颖恶乎俗之好异恐传以为人惑欲予咏而播之
1032219,楚翁别五年丙午四月来山中风雨数日因话旧作再赋三绝仆与楚翁至是三听雨矣不知自此又几听雨耶 其二
459766,李智国归自海南，自此不去。共饮至深夜，更聊至六时半，彼等熟卧，独作此诗，醉笔不知何语
191099,七月十四日夜大雨彻晓方止田家云早晚禾自此
1054287,介之惠诗言斥于礼部欲自此高退山园且招予游故答此章
103571,达观禅师昙颖住隐静兰若或言自此猕猴散走不
568063,到云影院自此下甚险
1061234,法门复故圣恩深厚矣自此恐云巢不能久栖当为众一起承示佳句因用韵备载之
1028694,七月十四日夜大雨彻晓方止田家云早晚禾自此不忧矣喜而为诗
1113949,尚欠四章别成十首强抽拙思更续残篇篇既一而意重气已衰而词困愿容衔璧自此投戈仰渎台慈不胜惭惧
320527,介之惠诗言斥于礼部欲自此高退山园且招予游故答此章
96702,蕃归自浙之十日斯还赴处州之约入城自此遂将
379635,法门复故圣恩深厚矣自此恐云巢不能久栖当为众一起承示佳句因用韵备载之
733134,宜都阻雨入夜始霁自荆门虎牙山而上群峰络绎险怪万状蜀江之奇自此始
1037376,尚欠四章别成十首强抽拙思更续残篇篇既一而意重气已衰而词困愿容衔璧自此投戈仰渎台慈不胜惭惧 其二
793740,过汝州西四十里，自此皆山驿骑行，山上漫成
862590,近陋室以斗升酿家妇谓予未饮不以见告昨夜偷儿入室挈二壶去自此室中又复索寞今后酒熟便呼近邻痛饮遇夜守视庶大家着力也呈诸兄兼简士修思远三首 其一
1149831,僧如展及韦载同游碧涧寺各赋诗予落句云他生莫忘灵山座满壁人名后会稀展共吟他生之句因话释氏缘会所以莫不悽然久之不十日而展公长逝惊悼返覆则他生岂有兆耶其间展公仍赋黄字五十韵飞札相示予方属和未毕自此不复撰成徒以四韵为识
905488,尚欠四章别成十首强抽拙思更续残篇篇既一而意重气已衰而词困愿容衔璧自此投戈仰渎台慈不胜惭惧 其三
1032220,楚翁别五年丙午四月来山中风雨数日因话旧作再赋三绝仆与楚翁至是三听雨矣不知自此又几听雨耶 其一
59107,明发昆阳自此入山四望空寂情甚无赖因以自遣
1037375,尚欠四章别成十首强抽拙思更续残篇篇既一而意重气已衰而词困愿容衔璧自此投戈仰渎台慈不胜惭惧 其一
862589,近陋室以斗升酿家妇谓予未饮不以见告昨夜偷儿入室挈二壶去自此室中又复索寞今后酒熟便呼近邻痛饮遇夜守视庶大家着力也呈诸兄兼简士修思远三首 其三
973539,蕃归自浙之十日斯还赴处州之约入城自此遂将从处州入关迤逦往谒朱晦庵先生兴怀契阔乃成长句
270937,宜都阻雨入夜始霁自荆门虎牙山而上群峰络绎险怪万状蜀江之奇自此始
1131975,楚翁别五年丙午四月来山中风雨数日因话旧作再赋三绝仆与楚翁至是三听雨矣不知自此又几听雨耶
562811,钟黄初以余有三楚之命亟徵余画谓余于画自此远耳勉应其请并系以诗
975706,出安平山口自此无山矣作别山诗
1208267,正月二十四日至宝圭驿是北流县自此遵陆指郁林矣
1082479,近陋室以斗升酿家妇谓予未饮不以见告昨夜偷儿入室挈二壶去自此室中又复索寞今后酒熟便呼近邻痛饮遇夜守视庶大家着力也呈诸兄兼简士修思远三首 其二
917525,秦侯不调累年识者叹息兹以规恢秘略亲简上知有诏复其官亨衢自此发轫闻之喜甚为作古篇
279932,过汝州西四十里，自此皆山驿骑行，山上漫成
1032221,楚翁别五年丙午四月来山中风雨数日因话旧作再赋三绝仆与楚翁至是三听雨矣不知自此又几听雨耶 其三
157007,书事·淮畔风尘自此清
1208268,登沓磊驿楼，自此度海
133143,出安平山口自此无山矣作别山诗
212432,别吕守·自此调元去
482405,明发昆阳自此入山四望空寂情甚无赖因以自遣
950930,比闻赵季茂奉板舆行春甚乐予跃然效之是日乃值大风雨昏后倦归则素月流天仍复晴矣自此连日春色尤浓杏已过雨红英满地怅然有作因寄
936289,故蜀别苑在成都西南十五六里梅至多有两大树夭矫若龙相传谓之梅龙予初至蜀尝为作诗自此岁常访之今复赋一首丁酉十一月也
915079,小憩二龙争珠盖两长岭夹一圜峰故名自此出官路入山路云
417414,台城路　戊子秋城南诗社雅集，时为择庐丈殡期后二日，自此城南遂无社集矣
390165,重题·宦途自此心长别
1106834,近陋室以斗升酿家妇谓予未饮不以见告昨夜偷儿入室挈二壶去自此室中又复索寞今后酒熟便呼近邻痛饮遇夜守视庶大家着力也呈诸兄兼简士修思远三首
779677,风流子 辛亥春月告归，得请，途次寄阎百诗，自此不复梦入春明矣
