677499,魏黄门册封汴藩便归省觐二首 其二
535058,送陈太史奉使淮藩便觐
383651,送邹四山太史册封岷藩便道省觐
535061,送兴化李太史奉使衡藩便省
614670,送王光禄出使潞藩便道归粤
697596,魏黄门册封汴藩便归省觐二首
547588,送孙柏潭太史册封唐藩便道省觐
547710,送彭肯亭太史册封沈藩便道过里寿太公九十
383040,送李榕厓谏议册封荆藩便道省觐
383409,送孙柏潭太史册封唐藩便道省觐
547711,送李榕厓谏议册封荆藩便道省觐
677498,魏黄门册封汴藩便归省觐二首 其一
547707,送徐端铭太史册封衡藩便道迎养
383038,送徐端铭太史册封衡藩便道迎养
383656,送彭肯亭太史册封沈藩便道过里寿太公九十
561546,皇储大庆侍读屠文升告赐汴藩便道过家省觐赋赠
666919,少宗伯王瓯滨先生持节封益藩便道归省予为何爱之正郎赋赠
547697,送邹四山太史册封岷藩便道省觐
600506,送太史何锡川使襄楚二藩便道省觐
545023,送区太史使江藩便道暂还南海寄讯程孔信山人
535060,送万太史奉使唐藩便觐
674266,送黄才伯内翰出使湖藩便道归省
