817554,晚过东园独饮月上乃归
1244321,去年中秋与郭怡饮舍弟处酒半以事散去今年余饮桐江上乃以群不逞又走渡东岸德之不建民之无援哀哉
492524,寄莱州太守赵圭玉往在兵部与君实同事余后乘檄出海上乃相失于交臂之顷今年秋余亦调官北平望莱州复隔千里追忆旧好诗以讯之 其一
624429,送李其础公车北上兼上乃翁太史
563179,画家霜景与烟景淆乱余未有以易也丁酉冬燕山道上乃始悟之题诗驿楼云
583328,南山潘孔修先生学甚纯正事母至孝尝著孝经正误诸书以济时行道为志在刑部时上筹边十策及时政得失忠义剀切海内想望风采盖第一流人物也后以迎养陈情疏凡二上乃改南都缜适奉命至得以亲炙受益为多顾复奔走江南念兹远违情不能已用韵奉答以著平生之谊云
302356,晚过东园独饮月上乃归
854990,六月二十日舍贾耘老溪居旦起蔡成允见访仆方蓬头赤脚坐溪上乃用此见成允而君不以为无礼反寄诗有褒借意甚愧过情戏作一首奉报
687014,寄莱州太守赵圭玉往在兵部与君实同事余后乘檄出海上乃相失于交臂之顷今年秋余亦调官北平望莱州复隔千里追忆旧好诗以讯之
492525,寄莱州太守赵圭玉往在兵部与君实同事余后乘檄出海上乃相失于交臂之顷今年秋余亦调官北平望莱州复隔千里追忆旧好诗以讯之 其二
