569100,耿大夫入为司徒领太仓事时余方上书乞骸赋此赠别 其一
421147,满庭芳 复生归蜀，赋此赠别
537017,周胤昌自金华丞入计迁太守赋此赠别
736877,同钱青在夜饮赋此赠别
458014,晨起即归，匆匆赋此赠别无名
409732,季野之江上，赋此赠别，兼致雪楼、慎登 其二
684038,耿大夫入为司徒领太仓事时余方上书乞骸赋此赠别
307605,满庭芳·复生归蜀，赋此赠别
676367,四山往教河阳留宿草堂赋此赠别
465681,蔡生星仪游学首都赋此赠别
537099,吴虎臣谒予兄弟吴门将北访于鳞且云欲与汪中丞伯玉共建维摩精舍赋此赠别兼用示嘲
781988,为张建侯进士写照竣赋此赠别
277628,蝶恋花·将去日本，因忆往岁平安神宫观樱之游，赋此赠别凤举
492597,吉水曾士与访予南富山中却归梅冈赋此赠别
617522,庄景说奉使靖江王邸往来五羊见访赋此赠别 其一
409713,光炯将赴云南制府幕，泛海取道越南，赋此赠别
617523,庄景说奉使靖江王邸往来五羊见访赋此赠别 其二
428040,南乡子 刘定一自江宁乡间来，留宿萧斋者六日，倾谈特契，赋此赠别
263271,光炯将赴云南制府幕，泛海取道越南，赋此赠别
824395,蝶恋花 将去日本，因忆往岁平安神宫观樱之游，赋此赠别凤举。凤举亦将归江西，故有末句
683560,肖甫兄治浙师功成召拜御史大夫行左司马事道过吴门轻舟入访弇中赋此赠别得二章
569744,肖甫兄治浙师功成召拜御史大夫行左司马事道过吴门轻舟入访弇中赋此赠别得二章 其二
249467,蔡生星仪游学首都赋此赠别
569101,耿大夫入为司徒领太仓事时余方上书乞骸赋此赠别 其二
509090,访少卿李公因送予至小箬邮亭赋此赠别
538805,戚大将军入帅禁旅枉驾草堂赋此赠别
409731,季野之江上，赋此赠别，兼致雪楼、慎登 其一
263333,季野之江上，赋此赠别，兼致雪楼、慎登
569743,肖甫兄治浙师功成召拜御史大夫行左司马事道过吴门轻舟入访弇中赋此赠别得二章 其一
57216,董山人来白田为寄高季迪诗赋此赠别
482890,董山人来白田为寄高季迪诗赋此赠别
693853,庄景说奉使靖江王邸往来五羊见访赋此赠别
638361,冬官林居鲁谢病归养来访平湖赋此赠别
246250,水龙吟·珍怀先生移居海外闻之凄然赋此赠别
431309,季野之江上，赋此赠别，兼致雪楼、慎登
444418,水龙吟 珍怀先生移居海外，闻之凄然，赋此赠别
