197712,孟冬朔旦修翁诞辰韦轩府判寺簿同宴与三侄孙
13227,春分与诸公同宴呈陆三十四郎中
6164,夜同宴用人字
698160,甲子端午蒙邑侯张潮山见召与郡博朱观閒春元黄笔阳贡元邱二山邑幕周龙山同宴印山亭赋二律以识胜游云
531774,蒋少傅约游湘山阻雨不果招陈宋卿同宴湘皋书屋
155590,寄程教授士廓·去年同宴小重阳
558277,与范进士同宴金鳌阁赋此奉送兼柬黄佥宪
19368,酬郑二司录与李六郎中寒食日相过同宴见赠
1218023,次韵刘彦英教授春日同宴吴元正宅
1155806,与诸同年贺座主侍郎新拜太常同宴萧尚书亭子
494156,附渡北行夜阻风山旗坑寄怀陈睡乡马怀瑞诸同宴
36720,春夜与诸公同宴呈陆郎中
862274,孟冬朔旦修翁诞辰韦轩府判寺簿同宴与三侄孙忝陪于僎介之间以纪其事
17778,与诸同年贺座主侍郎新拜太常同宴萧尚书亭子
1166595,夜同宴用人字
1155948,同梦得和思黯见赠来诗中先叙三人同宴之欢次有叹鬓发渐衰嫌孙子催老之意因酬妍唱兼吟鄙怀
494990,西园清宴和陈石亭侍讲呈东园公及诸同宴
1147127,春夜与诸公同宴呈陆郎中
821479,采桑子 前年读瘦东瓶粟斋诗，未相见也。顷蕖川邀同宴席，分韵得生字，因赋赠
669339,山游会周张二大尹同宴飞来山得峰字
1156634,酬郑二司录与李六郎中寒食日相过同宴见赠
1242686,谢左丞自军中至，同宴周德新员外别业
595254,甲子端午蒙邑侯张潮山见召与郡博朱观閒春元黄笔阳贡元邱二山邑幕周龙山同宴印山亭赋二律以识胜游云 其一
595255,甲子端午蒙邑侯张潮山见召与郡博朱观閒春元黄笔阳贡元邱二山邑幕周龙山同宴印山亭赋二律以识胜游云 其二
273881,恋情深·七月十三同宴席
