470024,陈山甫遨集杨姬华林馆同赋四首 其四
577718,鲫鳉鲭鳜鱼图为王菊堂赋四首 其四
902086,与陈去非夏致宏孙信道游南涧同赋四首 其四
651468,四景为李通政赋四首 其四
618172,己卯孟冬黎美周将上公车偕黎君选谢伯子陈中行过访海曲邀李代际显国家从右文伯承侄明公陟遐暨两儿载酒罗浮梦夜过宝莲寺分赋四首 其四 一双桥归月
482901,村居杂赋四首 其四
619652,午日同有开龙友诸子饮瑞虞点石斋席上赋四首 其四 得花字
791737,三十初度，同人以酒食相遗，感赋四首 其四
1223962,中秋前偶赋四首 其四
1025233,姜特立寄诗编为赋四首 其四
475838,十四夜都司席上饯光禄屠公分赋四首 其四
1056014,元祐末宿秋试院曾和王敏父四诗是时以疾先出院方欲出而未得况味有类今日追用前韵再赋四首 其四
711159,偶赋四首 其四
557653,留别再赋四首 其四
842438,十二月八日散步上海废城西见古木寒鸦与伯未同赋四首 其四
564668,题画为许松皋赋四首 其四
542048,薄暮赵户部良弼官署西园同郑山人中伯醉赋四首 其四
577800,高士谦竹为崇安知县金怀赋四首 其四 露
426063,蓉城招饮感赋四首 其四
712634,龟峰白云为徐凤池赋四首 其四
980200,朱郎元章以予不得宫观与诸侄有唱和见寄揽之欣喜五更枕上赋四首 其四
1061308,师节受业师慈慧公喜草书得海老琴诀之妙以医隐于会稽比以草书四诗招师节归山师节次其韵报之余亦为赋四首 其四
804515,里人来言学使张公重葺二泉书院感赋四首 其四
828494,小极音哑感赋四首 其四
1070613,叔问作崇兰馆图画叔问去非与余相从林壑间二公各题二绝句余同赋四首 其四
676488,鴳林八景诗为赵都谏赋四首 其四
930661,山园杂赋四首 其四
429095,前诗意犹未尽再赋四首 其四
619656,端阳后二日何瑞虞龙周勚何龙友诸子过集紫芝园同家霞举幼度桢卿有开文度分赋席上赋四首 其四 得杯字
577530,清乐轩四景诗为驸马沐公赋四首 其四
606220,貤恩初下感赋四首 其四
1006990,自庐山归城赋四首 其四
547393,壬辰冬月连营兄弟二葬抚今追昔潸然有感聊赋四首 其四
828258,秋间予病几殆陟甫九兄夷希同年邀游鄮山时为八月十一日为予五十初度两兄斋僧普佛为先母周太夫人资冥福归后病良已追念感赋四首 其四
780838,出嘉峪关感赋四首 其四
1249516,至正壬寅二月廿一日雍虞岂临江宋□道士刘旻李文同登西峰之烟云台以登高望远为韵各赋四首 其四
543968,易惟效署中避暑同赋四首 其四
475536,南山行为梅林司马赋四首 其四
931126,出行湖山间杂赋四首 其四
911220,季允用韵各赋两章予亦再赋四首 其四
819200,海棠盛开与稚辛似斋二弟同赋四首 其四
410084,读《卢骚小传》感赋（四首） 其四
593825,顾玄言以游赤城诸作见寄漫赋四首 其四
577808,边景昭四时鹌鹑为周副都御史赋四首 其四 冬
564346,仲夏廿二日同吴石湖苏一斋杨麟山会王鹤城别业漫赋四首 其四
508819,家庆堂为吴宗政赋四首 其四
618187,秋日同黎君选徐木之侄明公儿准集愚公楼时方延僧诵法华经分赋四首 其四
1224159,东湖四景为大尹本斋王侯赋四首 其四
792627,癸丑浙闱奉调帘差因格于例，明经科未与考者凡五人出闱后，蒋颖生大令以闱中和中丞监临原韵七绝四首见示爰次韵感赋四首 其四
