538858,少司徒清丰吕公枉驾见访即席有作
792376,春日喜方耕霞丈见访即以赠别二首 其一
592360,郭次甫自焦山过访即往东岱
703335,秋日喜螺浮张给谏见访即订四百峰之游率赠
598091,暮春送孙比部至郡承郡公携觞过访即席口占为赠
426202,承杨老、吕老过访，即就溪边纳凉口占相酬二首 其二
792377,春日喜方耕霞丈见访即以赠别二首 其二
807427,金菊对芙蓉  姜学在自宛陵扫墓归停舟过访即送其返吴门
402420,念奴娇 其二 春暮夜雨正刚敏庵来访即和敏庵韵
431585,承杨老、吕老过访，即就溪边纳凉口占相酬二首
625940,宝安将发陈元孝金吾归自滇南过访即别
1226041,张野泉偕虚谷方使君赵春洲数先辈见访即席赋诗各以酒字为韵
267003,承杨老、吕老过访，即就溪边纳凉口占相酬
810979,春日喜方耕霞丈见访即以赠别二首
270715,喜彭躬庵处士过访即席赋赠兼送往江南
766600,百字令 其二 秀州十三龄女子徐子琴以拆字谋生，机锋敏捷，偶与同人过访，即以姓名三字效拆字，戏赋之
1035274,贺新郎 生日前数日杨仲博约载酒见访即席次韵
601310,冬日李亮侯过访即席限多字各赋一首
634202,秋日喜螺浮张给谏见访即订四百峰之游率赠 其二
426201,承杨老、吕老过访，即就溪边纳凉口占相酬二首 其一
592638,吴孝甫见访即返江上
734148,喜彭躬庵处士过访即席赋赠兼送往江南
634201,秋日喜螺浮张给谏见访即订四百峰之游率赠 其一
293821,念奴娇·春暮夜雨正刚敏庵来访即和敏庵韵
637609,增城郑叔清司训顾道充上舍吴时彦贡士来访即告归途值大风雨思之不置
545554,闵山人逸之工琴奕丹青而卖药长安市秋日过访即席赋赠
