539991,初夏屏居山亭与国手刘君对奕倦偶拈长庆集得一绝句云红旗破贼非吾事黄纸除书非我名唯共嵩阳刘处士围棋赌酒到天明时郡将以倭警出师而刘君姓与事有相合者因戏书赠之仍和二绝于后 其二
1077991,峤南僧罕遵戒律况向上事独琮师隐居湖岩绝不至城市超然拔俗闻余来策杖见过与语可人知为饱参衲子也询其所见盖尝从长芦了游了居长芦聚徒至千五百众道价籍甚江淮间余虽不之识然声气相合心期自亲尝辱贻问今见琮益知了之门风孤峻真楷老儿孙也退处天台琮将浮海访之因赋诗赠琮且简了公异时得归决须相随于石桥侧可以握手一笑梁溪居士云
1222957,仲章诗律大进数日道中论诗亦颇相合复次前韵以勉之
939108,仓使亦为梅著句适与予意相合和其韵
229011,居城南·群处那相合
427814,临江仙 中央音乐学院民族音乐研究所副所长杨荫浏同志先后以敦煌唐乐谱及西安何家营鼓乐社、北京智化寺所传宋元旧谱见寄，其字谱多与白石道人歌曲相合，沈埋数百年之词乐，行将重显于世，绵此坠绪，推陈出新，诗人与乐家分工合作，以民族形式结合社会主义思想，创作新体歌词，以应广大人民之需要，此其时矣。赋谢荫浏，兼简叶遐庵
539990,初夏屏居山亭与国手刘君对奕倦偶拈长庆集得一绝句云红旗破贼非吾事黄纸除书非我名唯共嵩阳刘处士围棋赌酒到天明时郡将以倭警出师而刘君姓与事有相合者因戏书赠之仍和二绝于后 其一
222563,仓使亦为梅着句适与予意相合和其韵
683719,初夏屏居山亭与国手刘君对奕倦偶拈长庆集得一绝句云红旗破贼非吾事黄纸除书非我名唯共嵩阳刘处士围棋赌酒到天明时郡将以倭警出师而刘君姓与事有相合者因戏书赠之仍和二绝于后
172202,赠张駉·乍见语相合
296077,吴敬臣出梁节庵所赠画梅旧扇属题敬臣梁门下士扇款本署敬臣适相合也
