346930,王颛庵太史拙修堂宴集分韵
350952,八六子·杨青岩舅遂初堂宴集
816749,八六子 杨青岩舅遂初堂宴集
404129,燕归梁·甲申，一九四四年。人日，诵芬堂宴集，玉繠首唱，予亦继声，并柬慈博
940057,九日与智叔雕堂宴集夜归
428437,丁未七月十五夜与连仲甫小万柳堂宴集二首 其一
623726,田都护兆祥来薰堂宴集
512563,君子堂宴集分韵得上字
743544,竹西草堂宴集分得还字
737418,秀野堂宴集时侠君止酒以诗先之
63791,和岳子嵩山草堂宴集
765545,八六子 其一 杨青岩舅遂初堂宴集
428438,丁未七月十五夜与连仲甫小万柳堂宴集二首 其二
1251840,与张贞居云林堂宴集分韵得春字
737079,甲申中秋澄观堂宴集以昌黎一年明月今宵多为韵分得月字
385842,蔼吉堂宴集，和雪村次韵
734288,王颛庵太史拙修堂宴集分韵时移家还里将有远游留别娄中诸君子
590971,新春自然堂宴集
169368,九日与智叔鵰堂宴集夜归
566045,秋日蒋子携樽过草堂宴集一首
1066545,柏悦堂宴集晚移望岳亭德升有诗复次韵
553518,中秋玉堂宴集分韵得霄字
649225,东郭草堂宴集
641706,春晖堂宴集
473266,和岳子嵩山草堂宴集
720626,买陂塘　仲春六瑩堂宴集
433703,丁未七月十五夜与连仲甫小万柳堂宴集二首
742219,书王太守平山堂宴集诗后
