937975,某窃慕东坡以铁拄杖为乐全生日之寿今以大铜瓶上判府待制庶几因物以露区区且作诗二首将之亦东坡故事 其二
1000160,北京判府司徒侍中生日三十四韵
559930,送人归老清江为周判府作
984499,水调歌头 呈判府宣机先生乞赐笑览
522088,松江判府史君瑭廉靖爱民民亦爱之董漕还便道省亲赋以为寿
158343,某不度轻僭始以鄙句尘献判府安抚司徒侍中特
492978,往时杨清溪为乡先达菊存陈公作种菊图工妙逼真去之六十馀年其五世孙继先乃得之于其仲父有实家盖其家故物也出以示余因题其后以致景仰之意 其六 奉青李一盛寄子渊杨判府
158488,依韵奉和判府经略司徒侍中上巳晚游九曲池诗
196763,判府大帅督参宝谟户部先生持漕来长沙继升师
346752,上判府陈秘丞
53099,试院呈同事陶判府
1110608,判府曹宣徽生日
1097997,上判府陈秘丞 其二
158027,北京判府司徒侍中生日三十四韵
883676,闰月丙子判府相公被制命升使弼越六月癸卯公诞生之辰谨斋洁为诗二章拜献左右虽辞句芜颣不足奉扬盛德姑以述惓惓之诚 其一
868009,奉赠德新知府并呈明德通守时中判府良心长司善卿知事
326071,判府曹宣徽生日
999723,依韵和判府司徒侍中雪霁登休逸台
180703,偶成古调十六韵上呈判府兼赠刘兴州
564759,为郭判府题蟠桃图
846354,临江仙 寿判府七月十四
180513,同家弟用前韵谢判府惠酒
1034238,春风行为判府韩郎中寿
638148,奉谢王判府惠米
642816,送判府万侯秩满如京
938231,偶成古调十六韵上呈判府兼赠刘兴州
926832,谢判府王宣徽惠酒
999876,某不度轻僭始以鄙句尘献判府安抚司徒侍中特屈威尊过赐宠和伏读荣荷谨成律诗一首代启上谢
346746,判府罗郎中举似快阁佳篇辄次严韵
999787,依韵奉和判府司徒侍中望宸閤雪后
158491,依韵奉和判府经略司徒侍中春阴马上之什
158485,依韵奉和判府司徒侍中赏西禅院牡丹之什
227991,春风行为判府韩郎中寿
515075,亚卿知郡似公提刑判府沈公邀仆与康亚卿饮席上作
638895,送高判府之临江
1097910,判府罗郎中举似快阁佳篇辄次严韵
126559,谢判府王宣徽惠酒
999789,依韵奉和判府司徒侍中壕林
158514,依韵和判府司徒侍中雪霁登休逸台
674713,送叶判府尚原东还二首 其一
1118853,同家弟用前韵谢判府惠酒
937974,某窃慕东坡以铁拄杖为乐全生日之寿今以大铜瓶上判府待制庶几因物以露区区且作诗二首将之亦东坡故事 其一
999810,和判府司徒侍中喜雪
1110610,闰月丙子判府相公被制命升使弼越六月癸卯公诞生之辰谨斋洁为诗二章拜献左右虽辞句芜颣不足奉扬盛德姑以述惓惓之诚
999790,依韵奉和判府经略司徒侍中上巳晚游九曲池诗
158489,依韵奉和判府司徒侍中壕林
694684,送叶判府尚原东还二首
659268,蹇判府六十及生子诗
180842,再用迹字韵成一首呈判府
1124868,上判府陈秘丞
999788,依韵奉和判府司徒侍中赏西禅院牡丹之什
158341,某伏睹判府司徒侍中置酒宴客即时雪作谨成七
938796,判府大帅督参宝谟户部先生持漕节来长沙继升帅守追惟平庵先生分教是邦越四十有九年而多士尊仰说服如一日乃市地立祠以慰士心祠成门下士陈某拜手稽首而诗之曰
638894,赠杨判府之九江
133340,对雪呈判府周丞相
883662,判府蒲左丞宠赠佳篇谨次韵
501808,赠塔斯图判府二十韵
883660,判府曹宣徽生日 其一
325975,判府蒲左丞宠赠佳篇谨次韵
674714,送叶判府尚原东还二首 其二
1250089,次韵元章先生简奉讷斋判府相公一笑
162147,钱判府国史直讲秘书赴镇南剑
638963,赠别饶廷赐判府之汀州用张廷实主事韵
999791,依韵奉和判府经略司徒侍中春阴马上之什
1097939,贺判府生子
938119,同家弟用前韵谢判府惠酒 其一
915640,寄王用之判府监簿
158486,依韵奉和判府司徒侍中望宸合雪后
92633,寄王用之判府监簿
1082523,同家弟用前韵谢判府惠酒 其二
975121,对雪呈判府周丞相
883661,判府曹宣徽生日 其二
179509,读王莽传寄廖判府
883677,闰月丙子判府相公被制命升使弼越六月癸卯公诞生之辰谨斋洁为诗二章拜献左右虽辞句芜颣不足奉扬盛德姑以述惓惓之诚 其二
999878,某伏睹判府司徒侍中置酒宴客即时雪作谨成七言律诗一首上献
938106,再用迹字韵成一首呈判府
1097996,上判府陈秘丞 其一
326072,闰月丙子判府相公被制命升使弼越六月癸卯公诞生之辰
854466,钱判府国史直讲秘书赴镇南剑
680783,奉送苏判府往湖广便归南京公干
1097926,林判府和前韵见示且约暇日论茗次韵为谢
506908,题张判府恒山书屋
476847,试院呈同事陶判府
643188,送判府万侯秩满如京
158251,和判府司徒侍中喜雪
1118851,某窃慕东坡以铁拄杖为乐全生日之寿今以大铜瓶上判府待制庶几因物以露区区且作诗二首将之亦东坡故事
586688,庆省图赠判府何汝弘
1030633,读王莽传寄廖判府
