232223,十二日出城见隔江茅舍可爱
895070,三月二十四日出城
751289,初九日出城既至善桥作
924663,初到绩溪视事三日出城南谒二祠游石照偶成四小诗呈诸同官 石照二首 其一
153935,二日出城
1220635,九月十日出城
849355,明日出城爱其平沙浅水有钱塘西湖气象借前韵呈诸公
923989,初到绩溪视事三日出城南谒二祠游石照偶成四小诗呈诸同官 汪王庙
1223443,五月三日出城南书所见
1051548,初到绩溪视事三日出城南谒二祠游石照偶成四小诗呈诸同官 石照二首 其二
385155,十月五日出城暮归门阖留宿南濠王氏楼与履约昆仲夜话有作
1010660,昨日出城南行
920429,七月一日出城舟中苦热
1117154,初到绩溪视事三日出城南谒二祠游石照偶成四小诗呈诸同官 石照二首
668279,十月五日出城暮归门阖留宿南濠王氏楼与履约昆仲夜话有作
528309,赠张时济陈伯行胡承之周少安三月三日出城游宴
895068,十二日出城见隔江茅舍可爱
354480,四月七日出城西见河中资政侍郎遇中叔联骑入池南门行东北隅以归各赋
183084,休日出城西
102180,七月一日出城舟中苦热
232332,三月二十四日出城
923990,初到绩溪视事三日出城南谒二祠游石照偶成四小诗呈诸同官 梓桐庙
232338,七月十二日出城
144918,昨日出城南行
870353,成都遨乐诗二十一首 其二 二日出城
895060,七月十二日出城
540584,春日出城
568445,晦日出城送葬曹启东宪副
895079,正月二十日出城
232210,正月二十日出城
894886,三月六日出城
117910,初到绩溪视事三日出城南谒二祠游石照偶成四
1051828,四月七日出城西见河中资政侍郎遇中叔联骑入池南门行东北隅以归各赋一首
1088952,前日出城苗犹立槁今日过兴安境上田水灌输郁然弥望有秋可必乃知贤者之政神速如此辄寄呈交代仲钦秘阁
232330,三月六日出城
266322,江城子·日出城头鸡子黄
850252,休日出城西
164833,明日出城爱其平沙浅水有钱塘西湖气象借前韵
