462344,乌伤客中题二十五年前旧作松山长春图
422664,好事近 二十五年元日
411411,民国二十五年秋游菊江杂咏 其四
1030757,先人尝宰贵池今二十五年矣舟行经此不胜黯然
311667,民国二十五年秋游菊江杂咏
241565,先人尝宰贵池今二十五年矣舟行经此不胜黯然
313628,好事近·二十五年元日
203064,过泗州岭·二十五年间
569216,醉歌行赠别吴明卿记与明卿别二十五年矣舟行二千里而访我作十日平原饮于其别也情见乎辞
850486,与廖开甫自淮南同行赴举相别二十五年复相遇于蕲水县为诗赠之
879603,萧长公来访示以诸公诗卷谓与予游从之久不能一辞为赠颇相噍责予赋之不可辞之亦不可皆有说焉名章俊语前后相望无数次乎其间是睹西子之容面自增丑耳所不容却者予年十五时海山官丁受琴于长夫今予年四十与长夫有二十五年之旧辞之弗作其可乎因书数言
134210,昔予尝权宰韦城今重过之二十五年矣慨然有怀
1010475,冯深居长余二十三岁赵东阁长余二十二岁周汶阳长余一十七岁皆折行辈与余交淳祐辛丑同访余于竺山有会宿诗距咸淳乙丑已二十五年矣痛先觉之凋零感吾生之既老因成十韵以寄死生之情
411409,民国二十五年秋游菊江杂咏 其二
771396,绛都春•有咏社稷坛芍药者，率同其调。计余丁卯出都，正值花时，尽二十五年矣
276642,二十五龄·二十五年尘里住
773647,准提寺创建已百馀载供奉准提佛母并诸神佛为比丘尼住持焉后尼死失及星散阒其无人香火萧条只存前后二殿虽有北畔店屋作本寺香资然亦典质人家矣而寺宇坍塌炉冷烟消偶至其地令人生寥落之感嘉庆十三年1808增生陈廷瑜等倡议重兴次年即捐资赎回北畔店屋修葺前后两傍寺宇暨所倒坏店屋斋舍香火始复迨二十二年1817再小葺户牖瓦甍佛座神居颇称安稳二十五年1820复捐资重脩各殿堂妆塑佛像修置神龛补造器物又复灿然可观焉呜呼寺观盛衰
182800,与谬开甫自淮南同行赴举相别二十五年复相遇
411410,民国二十五年秋游菊江杂咏 其三
253644,乌伤客中题二十五年前旧作松山长春图
569660,伯承少卿自报国寺分手二十五年矣虽讯问不废而笑谈永隔今岁初夏复有一诗见遗聊尔奉答
869208,昔予尝权宰韦城今重过之二十五年矣慨然有怀
879602,萧长公来访示以诸公诗卷谓与予游从之久不能一辞为赠颇相噍责予赋之不可辞之亦不可皆有说焉名章俊语前后相望无数次乎其间是睹西子之容而自增丑耳所不容却者予年十五时海山官丁受琴于长夫今予年四十与长夫有二十五年之旧辞之弗作其可乎因书长句
1243777,诞日（前元己丑仲春予知命之年贤甥童中州赋诗寿予揆今二十五年矣甥亦五旬予曾赋五言唐律一首今书于此云）
411408,民国二十五年秋游菊江杂咏 其一
431702,民国二十五年秋游菊江杂咏
1208645,予以延祐元年从先兄正献公入汴始识彦辉吴徵君是岁故中丞马公伯庸今翰林学士谢公敬德国子博士王君师鲁乡贡河南行省迄今二十五年予再以按行至汴居监察行院去徵君所居仅半里犹以公事未毕尚迟于请见时马公亦薨谢王在馆阁感念存殁赋唐律一首先遣持遗徵君正之（至元四年戊寅）
