978439,予客昆山得荐严长老时道人散朗閒远不交人事心甚敬之今来海上复得悟公老成疏练能言吴中山水人物甚详东轩种竹如云不问其人可知也一日忽起故山之想予语悟野田荒草在处愁人心目安能复作沩山之牛乎因作一诗言君子出处之大致以告不知者
379162,题沩山立雪轩
1129957,颂古二首 沩山百年后，向山前檀越家作一头水牯牛去。
148612,善画牛·熟事沩山白水牛
1064392,过沩山陪空印禅师夜话
369648,送沩山显化士往印经
1071773,送沩山显化士往印经
263023,戊寅年初夏沩山道中
977783,游沩山
1064697,赠沩山湘书记二首 其一
729985,沩山水牯牛颂
1130333,赠沩山湘书记二首
1063843,次韵吴兴宗送弟从沩山空印出家
1063869,送悟上人归沩山礼觐
1023939,沩山问仰山临济得大愚力得黄檗力颂
1065185,题沩山立雪轩
378835,过沩山陪空印禅师夜话
1064698,赠沩山湘书记二首 其二
185204,王周士显谟自闽中归沩山旧隐道经临川惠然先
1062101,颂古二首 其一 沩山百年后，向山前檀越家作一头水牯牛去。
128788,游沩山·我行之宜阳
1065318,沩山轼禅师赞
840041,戊寅年初夏沩山道中
1063865,大沩山外侍者求诗
1000798,王周士显谟自闽中归沩山旧隐道经临川惠然先辱且出示吕居仁送行诗有见及语因次其韵赠周士
