304599,周念衣约游洪山不果枉赠一首次韵留别
644811,次韵留别陈季明先生 其一
644812,次韵留别陈季明先生 其二
165811,巳卯六月赴上饶之谪醇臣以诗送行次韵留别
1094819,次韵留饮翼日诗来因次韵为答
828807,周念衣约游洪山不果枉赠一首次韵留别
519667,次韵留郑子初长史怀归
58626,次韵留别张西盘大参
1038250,次韵留守相公以某赴东庄特赐佳篇
1038202,次韵留守相公同游龙门
1038204,次韵留守相公以罗门新渠并成喜而成咏
385441,次韵留别陈季明先生
370035,次韵留饮翼日诗来因次韵为答
688669,赴任南礼部九卿会饯于万福庵次韵留别
369543,次韵留别南公
522075,中元谒陵三江以诗送次韵留别时连雨初霁
1250975,与韩公望衍斯道游穹窿山次韵留题显忠寺
1038219,次韵留守相公光和运使度支诗
320603,次韵留守相公以罗门新渠并成喜而成咏
320902,次韵留守相公佳雪应时
584002,院北池亭次韵留咏诸公
1084777,人日过电山随行有昌黎集因读城南登高诗遂次韵留别孙先觉
1043149,陆子履有诗赠行次韵留别
320905,次韵留守相公光和运使度支诗
561333,赴任南礼部九卿会饯于万福庵次韵留别 其一
320910,次韵留守相公以某赴东庄特赐佳篇
743194,玉存赋长句赠行次韵留别兼呈杨西禾
320834,次韵留守相公洛中金橘
364411,陆子履有诗赠行次韵留别
518729,次韵留别白沙先生 其三
386561,次韵留别·咨牧传闻十二州
859170,次韵留题僧假山
979227,己卯六月赴上饶之谪醇臣以诗送行次韵留别
131746,次韵留友直道士来访
1038203,次韵留守相公佳雪应时
561334,赴任南礼部九卿会饯于万福庵次韵留别 其二
615224,次韵留别陈徵君
704264,次韵留别曹霜厓二首
509068,次韵留别祝大参惟清
945171,次韵留友直道士来访
1089672,次韵留守刘观文鹿鸣之什
1218014,次韵留题此岩
509067,次韵留别陈大参宗理
384923,次韵留别·循陔恋阙此时情
166131,次韵留守王公喜春
1038291,次韵留守相公洛中金橘
384922,应诏将入京，羽可舍人寄诗赠行，次韵留别
518728,次韵留别白沙先生 其二
320716,次韵留守相公促令归洛
509066,次韵留别徐武功先生
510980,廷实归赠以瑞香之花次韵留别
353555,次韵留守刘观文鹿鸣之什
518727,次韵留别白沙先生 其一
1038238,次韵留守相公促令归洛
979278,次韵留守王公喜春
690133,次韵留别白沙先生
587630,伦右溪以诗赠行次韵留别
527181,次韵留别曹霜厓二首 其二
1071780,次韵留别南公
558208,次韵留别
215453,次韵留题僧假山
527180,次韵留别曹霜厓二首 其一
386560,次韵留别·故人书至涤炎尘
683105,次韵留别陈季明先生
