454409,十年再会梁小萍有赠 其三
896858,予元丰戊午岁自楚至宋由柘城至福昌年二十有五后十年当元祐二年再过宋都追感存殁怅然有怀
1036172,定风波 余昔与张子野、刘孝叔、李公择、陈令举、杨元素会于吴兴。时子野作六客词，其卒章云：「见说贤人聚吴分。试问。也应旁有老人星。」凡十五年，再过吴兴，而五人者皆已亡矣。时张仲谋与曹子方、刘景文、苏伯固、张秉道为坐客，仲谋请作后六客词云
682940,同年再会西园用林司空韵二首
766382,醉蓬莱 全州古松余尝有词纪之，十年再至，存者无几，俯仰今昔，殆难为怀
454408,十年再会梁小萍有赠 其二
550305,立秋前四日同诸子秦淮夜泛计二十年再续此游感慨系之分得霜字
567573,沈先辈别归松江十年再至醉而授笔倚马悬河仆目以吴蒙辱赠七律次韵答之
535138,同年再会西园用林司空韵二首 其一
454411,十年再会梁小萍有赠 其五
200809,帝城·半年再作华亭客
98008,示梅山宁老·八年再到仍冲暑
535139,同年再会西园用林司空韵二首 其二
501803,洪武十年再奉使安南还道经丰城留馆驿父老乞留题急笔赋此
249243,十年再会梁小萍有赠
466667,十年再会梁小萍有赠
923002,吏部顿郎中起陆尚书佃与同年因迎哲宗神主集班西苑追思昔预闻喜逮今三十一年再至感旧赓唱长言远垂寄示老病读之不觉感叹强次前韵以答嘉贶
772341,戊戌至台湾，或馈素心兰四盆，殊繁妙。明年再华，犹盛。中出一枝，一华两蕊，犹子以增，谓是同心兰。余曰：一华两蕊，当为异心，何同邪？明日又出一枝，八瓣而同蒂，两蕊合袌。余曰：此真同心矣。嗟呼！海外岩疆，故称多事，其何以酬兹灵异乎
286973,立春感事柬赵芝生同年再叠前韵
454407,十年再会梁小萍有赠 其一
840513,立春感事柬赵芝生同年再叠前韵
1056881,熙宁六年再至邓氏北轩感而书壁
773647,准提寺创建已百馀载供奉准提佛母并诸神佛为比丘尼住持焉后尼死失及星散阒其无人香火萧条只存前后二殿虽有北畔店屋作本寺香资然亦典质人家矣而寺宇坍塌炉冷烟消偶至其地令人生寥落之感嘉庆十三年1808增生陈廷瑜等倡议重兴次年即捐资赎回北畔店屋修葺前后两傍寺宇暨所倒坏店屋斋舍香火始复迨二十二年1817再小葺户牖瓦甍佛座神居颇称安稳二十五年1820复捐资重脩各殿堂妆塑佛像修置神龛补造器物又复灿然可观焉呜呼寺观盛衰
454410,十年再会梁小萍有赠 其四
1089553,陈同年再次韵为谢而王才叔判院和篇继至复用韵并谢
546546,记十八九时章二宅中食江鲚狂饮剧醉豪兴欲飞迄今二十馀年再过瓜洲食此此物风味不减畴昔乃余发则种种不复能作少年态矣
454706,读周海婴《鲁迅与我七十年》“再说几句”集鲁迅聂绀弩诗为记 其二 集聂绀弩诗
454821,与怀信兄隔年再聚有赠
663206,弟善甫亡后数年再过其别墅
329344,熙宁六年再至邓氏北轩感而书壁
352744,陈同年再次韵为谢而王才叔判院和篇继至复用韵并谢
780412,摸鱼子 和潘吾亭同年再叠前韵
