1159129,游上方石窟寺
480277,闻刘东山司马致仕之命是日得谢方石祭酒到家日所寄诗感而有作
669527,石榴一首赠方石
638843,次韵李祯伯秀才面侍方石先生索赠二首 其一
479540,谢方石先生挽词
685144,游灵岩谒杜清献读书处次方石先生韵
480267,次王古直哭兆先韵柬方石二首 其二
655134,谢方石乃叔宝庆太守采藻亭次韵
695297,次韵李祯伯秀才面侍方石先生索赠二首
190745,杯泉·一方石甃溜涓涓
101353,咏石僧·云作袈裟方石僧
672429,游灵岩谒杜清献读书处次方石先生韵 其二
48498,陵祀归得赐暖耳诗和方石韵
681222,闻方石先生得遗腹孙
53118,谢方石先生挽词
672415,送方石先生赴召分韵
26751,游上方石窟寺
574038,谢方石以祖母旌门有作次韵
662330,送方石谢先生
638854,西厅候试诸生呈堂尊方石先生
1105960,送刘方石归旴江
480266,次王古直哭兆先韵柬方石二首 其一
638844,次韵李祯伯秀才面侍方石先生索赠二首 其二
480206,陵祀归得赐暖耳诗和方石韵四首（时和者颇众，类为骑字所苦） 其四
521521,方石先生季父逸老以宝庆守致仕先生名其居曰悬车旧第宝庆殁先生有诗命次其韵
673934,问安次谢方石先生韵
691096,次王古直哭兆先韵柬方石二首
672459,建溪席上次方石先生见忆韵
735209,题方石居赠忍公用吴愧庵先生韵
211520,送刘方石归旴江
691086,陵祀归得赐暖耳诗和方石韵四首（时和者颇众，类为骑字所苦）
672779,禫祭谒陵和匏庵方石二先生赠行韵
681286,方石先生祖母赵节妇没已五十年方石以礼部侍郎诰请移为旌表为诗纪事
681286,方石先生祖母赵节妇没已五十年方石以礼部侍郎诰请移为旌表为诗纪事
498852,乙酉同方石南侯石溪过江郎山行酒赋诗兹辛卯秋复过此二兄不可作矣凄然有感
738366,谷雨后二日程芗溪招同洪棕亭汪春泉方石堂游上方寺寺有三绝碑及坡公送李使君诗十韵墨刻在壁即用坡公白板烧松烟为韵分得烧字
480204,陵祀归得赐暖耳诗和方石韵四首（时和者颇众，类为骑字所苦） 其二
48544,次王古直哭兆先韵柬方石
480203,陵祀归得赐暖耳诗和方石韵四首（时和者颇众，类为骑字所苦） 其一
672449,次韵方石先生秋夜感怀
857551,送刘方石归旴江 其二
857552,送刘方石归旴江 其一
48545,次王古直哭兆先韵柬方石·极知世事如春梦
636646,通方石
48499,陵祀归得赐暖耳诗和方石韵四首
150237,赠然公界方·西方石为简
48343,闻刘东山司马致仕之命是日得谢方石祭酒到家
779217,春风袅娜 寿西樵司勋，同果庵、梅岑、方石、瑶田赋
480205,陵祀归得赐暖耳诗和方石韵四首（时和者颇众，类为骑字所苦） 其三
672428,游灵岩谒杜清献读书处次方石先生韵 其一
801673,挽方石川
