809813,五月上旬避暑热河涂中喜麦秋盈野雨旸得时赋七言一律
492045,十九日至二十二日雪作不止客有言是雪十馀年不见者固可喜也因赋五言一律
544929,孔旸得王中丞所贻西僧自焚灰像因立精舍奉之乞余作诗先是惟敬永叔诸君咸有题咏遂继七言一律
789781,辛卯春仲，阴雨连旬，梅英落飞，真花神一厄也。为赋怨言一律
809864,南方青竹丛林不乏观玩北地气寒非保护得宜即难艺植朕尝有事河干往来数次览竹树之畅茂暂时停辇即行后于禁苑种植颇蕃今经三十馀年迩来延至数亩之广其围至八寸径二寸五分有零古人以竹比君子因而思及草木无知积小以至于高大人有血气加之培养岂非国家桢干之选欤故赋七言一律记之
545537,参知淮甸张公以崇正书院志属余校定且命赋诗寄以七言一律
569440,李本建乡进士以其兄本宁大参之状来请铭其母匡得五言一律赠之
809866,每见村农野老不识不知天然自得孝弟发于至性朴诚不事文辞故美其实而取先进之意赋七言一律
839330,辛丑冬月十七日朝廷接驾咏五言一律以志幸
545373,过王思延斋头读所撰新草并钞本夷坚支志十?主人索七言一律及诗薮三编为报即以见归走笔赋此
310059,辛丑冬月十七日朝廷接驾咏五言一律以志幸
