878901,送强甫赴惠安六言十首 其九
172959,皇甫嵩·几多孟德总欺孤
24869,赠皇甫垣
1003255,踏莎行  和材甫听弹琵琶作
414772,挽王丈文甫
265856,叠韵奉酬絅甫
878895,送明甫赴铜铅场六言七首 其一
427666,洞仙歌 用柳屯田体为湖帆先生题仇实甫画长门赋图
696826,竹枝 孙光宪、皇甫松俱有此体
470024,陈山甫遨集杨姬华林馆同赋四首 其四
337871,别躔甫·一别三秋喜我过
1223817,次韵宋显甫
688031,和周吉甫春日移居二首
886713,和王德甫见寿二律 其二
634011,彭退庵明府汪汉翀水部招同杨司李莲峰黄都阃君甫李副戎禹门张茂才雏隐王孝廉震生及澹归探梅篁村
712240,送区兴甫之阳江二首 其二
978718,次韵李仁甫
53496,出阁过勤甫省中
670810,寄余德甫
238623,题天台夏肯甫晓山亭诗
1147067,今上初登极岁送皇甫孝廉赴选
952340,赠赵遂甫别
215559,和郭公甫·且欲相邀卧看山
1041395,寄贡甫
372148,题昌甫所得陆待制手书次韵昌甫之题句
372148,题昌甫所得陆待制手书次韵昌甫之题句
320385,赠王吉甫·嗟予困羁旅
190550,题清虚庵皇甫真人坦之隐居
780243,金缕曲 送陈厚须甫前辈赴粤东讲席，◆已己岁和同人韵
787754,八月二十二日偕汪苇丈、宾于、衡甫、子兰、西章、少帆诸学博游法华山
1144525,咏史 皇甫嵩
907018,观梅次豫章公饮润甫家韵
1041067,寄因甫
868536,蔡艮甫观颐堂
570025,故人卓澄甫光禄补官北上过金陵饮官舍赋此送之且订留署之约
291199,八声甘州·辛稼轩水调歌头和杨济翁、破阵子为陈同甫赋及本调读李广传
953908,赠王介甫
569190,傅令治吴有神君称而风流文采又复称是迩者解张将军子予厄折节顾山人山甫相与结词酒欢张之怀德顾之徇知欲以不谷一言蔽之难矣谊不可却聊成短歌一章以志区区
880229,送赵玉甫赴穿山盐场
813745,屡辱侍读王先生以卢藏用种明逸常彝甫见嘲未敢用鄙句唐突又蒙赐口号四章语意郑重督和甚切勉遵无言不酬之义敬答四首以当解嘲
538133,送万比部章甫兵备云南十六韵
570642,和张肖甫司马题王阳德使君阳湖别墅十咏 其四 红雨蹊
751362,偕谭仲修施均父黄元同潘仪甫张子虞孙子宜及皋社诸子宴集吴山道院
59898,怀用修仁甫
1116918,补和王深甫颍川西湖四篇 甘棠湖
142735,次及甫见寄·文采晁无咎
592928,答张乾甫二首 其一
1094190,有怀昌甫兄弟
160082,重阳对雨招介甫
1158647,将赴湖南湖上别皇甫曾
1135779,十二月二十八日立春次韵王山长俊甫
1137110,洞仙歌 其一 寿中甫
828256,秋间予病几殆陟甫九兄夷希同年邀游鄮山时为八月十一日为予五十初度两兄斋僧普佛为先母周太夫人资冥福归后病良已追念感赋四首 其二
1252952,雨中寄季山甫二首
304393,九日同季馥巩庵勉甫桐君及强志贻先弟约立之至香山作登高之会
1093110,二十七日置酒饯昌甫雪作次张上饶韵
323753,和梁才甫赠定帅元彬
1146758,赠别皇甫曾
468632,垂虹桥送戴明甫归休宁
860150,和后村刘甫纪梦
388262,皇甫司勋宅逢故九江守王丈王於先君同年其来也为其尊大夫乞皇甫志墓因赠五言三章
388262,皇甫司勋宅逢故九江守王丈王於先君同年其来也为其尊大夫乞皇甫志墓因赠五言三章
371629,次韵昌甫送周正子入太学
497899,赠冯元甫
695424,与李羽甫索秋海棠漫成二绝
550124,庚申元夕仁常招饮灯市酒楼同王无近章甫仲田伯善年兄有赋 其四
213789,别和甫赴南除
89889,甫韵·老禅和筑退居庵
995960,古风次韵答初和甫二首 其二
419267,木兰花慢 闻汪衮甫下世伤逝
608308,高正甫出守袁州九月九日予偕家兄暨诸亲友能文者十九人饯之毗卢阁赋诗为别 其一
873955,送刘旬甫之池阳省觐六十四丈遂如行在所上计
329839,甫斋宫·尝驰别乘走龙沙
592840,张见甫自新蔡来访得情字书字二首 其二
1093117,刘簿之婿游以诗来见且持昌甫书和韵答之
1094085,次韵昌甫 其九
1142725,别通甫
867297,黄雀饷师浑甫家仲安 其二
593043,纯甫见邀同思伯惟仁公补公绍饮小瀛洲得高字
843709,和易实甫观察原韵
992842,送张山甫武功簿
539088,寄答张助甫 其一
1062534,游西塔寺探得王夷甫玉柄麈尾以柄字为韵
4064,赴江西湖上赠皇甫曾之宣州
538719,送归熙甫之长兴令 其一
453130,闲思次杜甫《秋兴》韵八章 其三
156189,贻山甫·多病空余老
809783,热河三十六景诗 其三十五 甫田丛樾
132583,送叶吉甫往建康
883144,挽李中甫使君 其五
600338,送任白甫孝廉应试
562067,送户部尚书贡泰甫开司闽中榷盐易米给京师 其二
1217877,次韵叶中甫见寄
152020,李仁甫赋诗送其子塾下第归次韵为赠
1078275,初见梅花三绝句奉呈王丰甫待制 其三
851170,生日和聂吉甫
881381,野饮呈祝山甫
474146,青溪水亭迟叶五循甫
992764,送王介甫知毗陵
1112928,闻德远与曾裘甫黎师侯会饮范周士所
585525,先期史恭甫来同游茅山家人已迎至镇江矣月十二日也意其连夜归报速来予已到山二日至望之暮犹未至岂为泥雨所阻欤或赈饥之务未暇欤未可知也因作二诗唁之 其一
537080,汉女行寄张助甫
1245940,梁甫吟 送郑希道入京
1217596,失剌斡耳朵观诈马宴奉次贡泰甫授经先生韵五首 其三
735826,屡辱侍读王先生以卢藏用种明逸常彝甫见嘲未敢用鄙句唐突又蒙赐口号四章语意郑重督和甚切勉遵无言不酬之义敬答四首以当解嘲 其四
201980,访别成献甫经历时新拜四台御史之命
86296,又五言·甫白不可作
849855,送黄成甫殿讲被召
97376,送赵成都·甫也会依武
1186441,苦雨忆皇甫冉
534310,舟中呈程十二贞甫蓝三十六汝汲
473517,无题四首戏呈孝甫子建 其三
143416,九日偕翁与可江正甫
948350,送杨子止赴郴守罗达甫之招二首 其一
292487,杜甫·济世风骚冠古今
992330,依韵和表臣闻与挺之宣叔平甫饮
1130869,将到章泉水赵成甫寄三绝来
569351,读马司空侍御父子集因赠其子从甫
683495,用晦宗侯余德甫宪副寄诗贶问兼致先公挽些赋此奉酬
1002555,招泽甫竹亭闲话
10311,奉和皇甫大夫祈雨应时雨降
603058,初冬日承黄四茂才君甫元生元醴伯守黄苏欧八文士元昌元玉元佩元庸伯起伯安廷魁能见携李英偕赴吴茂才子赞之约即席同赋轻字韵
52036,赠华子中甫
746760,湘水怀石甫
434504,汉宫春 纯甫生朝，且有弄璋之喜，赋此以贺
553068,洪武十九年夏五月不雨广信郡太守番禺彭公推府灵台李公率所属及父老民人祷于群祠祝词甫毕甘雨随至三日之间四郊沾足赋诗志喜用以见二公精诚所致云 其二
1032579,寒山寺坏庄产尽为势家所夺余游天台甚为普贤惜之陈约甫摄郡号不畏彊禦者必能与寒山出气
1247026,载效唐律二解兼寄弘甫夏君 其二
542531,温纯甫宅同诸词丈夜集得池字
824613,浣溪纱 其一 次介甫韵
866439,次韵忠甫初见菊开
1042490,采蓝寄王深甫
881457,寄敬甫叶兄
383300,灵岩禅室子冲兴甫夜饮大醉
1093486,昌甫有诗和韵
695575,送王孟箕明府之留都水部次日逢重九同曾时甫凤栖岩登高四首
682052,送王孝甫大理阅视延绥
380580,杜甫诸将·众志成城百战场
811043,裴伯谦同年将南归宋子顿侍御方筱泉观察随少伯制军之幕兰州定甫上公星桥中丞邀集同人宴之于依斗亭佐以西域偎郎之舞因赋小诗志别二首
1150956,上李吉甫相公
1078273,初见梅花三绝句奉呈王丰甫待制 其一
114286,次韵和答孔毅甫
858499,寄茶与和甫
129688,九日寄汪澄甫
821964,采桑子慢 偕叙甫游虞山，至兴福寺、帘珠洞、大小剑门，欲访柳如是墓，不果
1094765,二十五日昌甫斋中徐倅送酒因次韵共答 其一
1000196,奉和纯甫秋扇
370627,昌甫示所藏淮海谪处州税官时诗草
1033330,见湖南绣使陈益甫大著 其一
352729,次韵宣甫约元宵入城不至
1156281,春晚咏怀赠皇甫朗之
165514,及第后将谒告先归留赠成甫
695672,送张助甫之湖南四首
909082,用从军古云乐为韵贺杨觉甫制干 其一
712905,送关敏甫北上
683432,暮春同茂秦子与顺甫正叔游韦园分韵得村字
152241,陈正仲提刑制勘甫毕首过小楼既出新诗仍惠手
210401,别韩菊山·结庐甫里邻
536649,助甫远驾见访遂成四章情见乎辞 其四
87521,耄志·甫入乌台宾客贺
615729,为李珏甫悼亡
992430,和刘原甫省中新菊
999700,纯甫出近郊以梅花未开成篇见贻因次元韵奉酬
1051302,挽王平甫二首 其一
1236127,送泰甫贡先生还朝便先往浙东访妻子
836183,步蟾宫 贺吕甫宗侄上舍新婚
748046,读载甫遗诗有感
370596,用昌甫寄晁于潜诗韵寄之
1156126,闲吟赠皇甫郎中亲家翁
539042,肖甫中丞拟八月见过近九日始达吾州贻诗有黄花孟嘉句聊此奉和
1026120,鹧鸪天 次韵昌甫
898928,蓦山溪 其二 和清虚先生皇甫坦韵
132421,劝醇甫酒·欲劝临歧酒一卮
539011,答德甫用晦追和感事之作 其一
488194,别林及甫 其二
167690,和胡定甫·几年野水倚扁舟
533079,暮春张考功助甫邀游韦氏园时梁舍人思伯偕至 其一
559550,笔客持卢文甫下雉书来附荅一首
538596,答助甫 其一
557198,送张肖甫奉命督租闽粤二首 其一
371635,有怀昌甫兄弟
976229,读章嘉甫诗
749100,同陈兰甫花埭泛舟
692353,挽刘荣甫
960918,访郭德甫
303627,即事书石甫幽恨词后
886870,送自然子夏德甫
1134947,次韵酬郝润甫二首 其一
41110,答谢谘议·告离甫尔
356790,己酉清明同运甫晚望
1077699,唐工部员外郎杜甫
945809,西江月 其一 寿季父吉甫六十
147881,怀江村何宏甫自赣上寄林檎
728140,效杜甫七歌在长洲县作
1108445,挽林法曹实甫二首
571289,寓思行沙庄呈尊甫南山隐翁三首 其二
1094548,过玉山同昌甫宿岁寒轩感怆不已
147421,两山赵仁甫宰临安有武学生张丈相访酒边弄刀
954094,奉答原甫九月八日见过会饮之作
323704,以魏花两枝送梁才甫花不甚大作二诗解嘲
359217,送陈季甫·閒于孤鹤淡于秋
110412,赠郭功甫二绝
1002635,酬介甫还自舅家书所感
103021,次韵答德化尉郭功甫遂以送之
1041235,舟次颍上寄贡甫
342531,览孙祐甫卷
541682,秋日同董维益司寇蔡弘甫内翰集朱汝修保御脩竹馆得开字
760198,次易实甫观察即席韵
573403,挽同年李检讨成甫四首 其二
1001014,曾宏甫见招看海裳而郡城新有更初阖扉之令予闻鼓亟归一诗呈宏甫
1001014,曾宏甫见招看海裳而郡城新有更初阖扉之令予闻鼓亟归一诗呈宏甫
1042748,次韵和原甫登禅智寺上方院二首 其一
238065,寄桐庐李华甫
105056,依韵和原甫厅壁许道宁山水云是富彦国作判官
75218,送谢芝甫赴山南宪
750418,寄挚甫
199065,雪后同徐秘丞皇甫节推孔教授北园晚步
557308,明月曲同峻伯助甫席上赋得深字
799519,兰山驿中王韬甫示以绿杨春影图且告之缘起为题八绝 其四
470254,严明甫园中
566094,赠茅顺甫进士归吴兴一首
533104,同肖甫夜宿龙华寺 其一
961798,赋婺州之录参厅明远楼为李中甫董奇卿作也
557082,张助甫席上同吴峻伯白伯伦再饯朱主客南还赋得江飞兢渡日草见踏青心十韵 其五
179683,和林子长谢徐吉甫蒲萄韵
538384,怀顺甫
858743,次韵和甫春日金陵登台
362673,晓起楼上·甫有鸦惊树
541951,雪中偶过李鸿胪东明宅留酌因怀卢太史浚卿刘少参才甫王侍御子梁张户曹聚甫
541951,雪中偶过李鸿胪东明宅留酌因怀卢太史浚卿刘少参才甫王侍御子梁张户曹聚甫
592360,郭次甫自焦山过访即往东岱
132970,寒食哭承甫兄暮
1044705,送邓德甫
530417,戏效汪京兆西湖六首为孙道甫书于湖之南屏山居 其二 和靖答不允
756654,悼鹤次蒋迪甫太史韵
380579,杜甫诸将·提兵鹭岛发峨舸
184707,寻春次曾宏甫韵
796269,满江红 题黄韵甫帝女花院本传明季坤兴宫主
1094900,喻郎中墨刻寄昌甫
1035886,移合浦郭功甫见寄
1149223,酬孝甫见赠十首 其七
683636,送六君子 送肖甫司马于清洋江口
132276,承甫兄生朝
309154,浪淘沙慢·沪上送易由甫
1157626,寄皇甫宾客
6860,送皇甫冉往安宜
498689,邻女有自经者不晓何因而里媪述其光艳皎洁阅日不变且以中夜起自结束选彩而衣配花而戴绾髻涂妆膏唇耀首以至约缣迫袜皆著意精好尽态极妍而始毕命焉其所悬之带以润州朱丝数百条长九尺许为十股细辫手自盘制逾月甫成同伴以为缠腰物也而不知其用意至此为诗以吊之
138057,斋宫感事寄原甫学士
429540,挽易石甫
147659,雁山罗汉寺省王总干之墓待和甫主簿之来
618388,夏日同侯若朴金元甫陈居一陈集生饮陆氏山园分赋以名园依绿水野竹上青霄为韵十首 其九
195621,同孙祖仁王平甫游蒋山作
716462,赠罗颢甫五十又一生日 其四
1236104,九月二日揭晓仆以朔旦始得閒复成二诗录奉泰甫侍郎思齐御史本中都事道明敏文伯崇有志诸寮友
701075,寓思行沙庄呈尊甫南山隐翁三首
859435,夜梦与和甫别如赴北京时和甫作诗觉而有作因寄纯甫
859435,夜梦与和甫别如赴北京时和甫作诗觉而有作因寄纯甫
859435,夜梦与和甫别如赴北京时和甫作诗觉而有作因寄纯甫
161913,送张敬甫常出守荆门
39481,梁甫吟·玉衡既已骖
237641,庚寅予自莲荡泝流金甫弟顺流赴性善之招舟行
106640,次韵汪翔甫和西城吕全州见过
533696,答助甫
573224,偕王章甫陈公弼登黄鹤楼 其一
1168037,鲁郡东石门送杜二甫
563313,宿华容寺次壁间丁元甫韵
915971,赠倪正甫令子阿麟
520353,予过渼陂是即岑参兄弟约杜甫以同游者也予亦好奇者想渼陂之名忆岑杜之游因成四韵以传好事者
1094136,答行甫
858985,送纯甫如江南
56769,寄潘章甫
353939,寄卢中甫·制胜关头雪未融
666936,柳州别王桢甫
15707,和皇甫判官游琅琊溪
1156199,咏怀寄皇甫朗之
780827,张仲甫舍人闻余改役东河以诗志喜因叠寄谢武林诸君韵答之二首 其一
962403,别坚甫伯修
1094652,次韵昌甫所赋癞可瘦权且言去岁到白鹿洞 其一
538059,寄肖甫 其一
214087,寄王回深甫
877663,翀甫侄西上
997982,答王甫判官示游兴庆池之作
566055,雪后对月和皇甫子循二首 其二
609083,过高比部正甫斋中小酌无肴因共作贫仕诗
1092982,二十七日同伯皋宿真隐二十八日寒食观昌甫诗恭叔所题字观中两树辛夷花甚大道士抚琴试新茗
26154,皇甫主簿期游山不及赴
330238,和郭功甫赠陈待制致仕
489058,怀李聪峦随宦新甫 其三
991761,十一月二十三日欧阳永叔刘原甫范景仁何圣徒见访之什
494821,先期史恭甫来同游茅山家人已迎至镇江矣月十二日也意其连夜归报速来予已到山二日至望之暮犹未至岂为泥雨所阻欤或赈饥之务未暇欤未可知也因作二诗唁之 其二
1036068,南歌子 送行甫赴馀姚
568270,张太史常甫得予告
964974,与瞻甫同访际书记
1031357,过皇甫侍郎
371769,次韵王教授同寄昌甫器远无为临漳
1193166,宿城南盛本道怀皇甫冉
464542,浣溪沙 为万少石题李芸甫秉绶百福齐眉图
533106,郭山人次甫从东海来将游北海留止轩中因赠 其一
963202,次及甫入峡杂咏 其一 三游洞
939074,昌甫寄徐崇甫书并崇甫寄渠诗及渠兄弟和章因次其韵呈昌甫
939074,昌甫寄徐崇甫书并崇甫寄渠诗及渠兄弟和章因次其韵呈昌甫
939074,昌甫寄徐崇甫书并崇甫寄渠诗及渠兄弟和章因次其韵呈昌甫
939074,昌甫寄徐崇甫书并崇甫寄渠诗及渠兄弟和章因次其韵呈昌甫
559700,寄朱隐君性甫
670462,殷太史正甫至自太山为赠
369961,次韵昌甫所赋癞可瘦权且言去岁到白鹿洞
146423,生日和聂吉甫
418960,梦江南 其二 和皇甫松
174896,李彭元携曾吉甫诗卷数帖见过
941815,鹧鸪天 怀王道甫
750918,九日偕镜寰公玉少甫稚甫大儿二儿饮八里庄酒家醉后登摩诃庵东南石楼题壁
750918,九日偕镜寰公玉少甫稚甫大儿二儿饮八里庄酒家醉后登摩诃庵东南石楼题壁
42920,用辛稼轩陈同甫倡和韵
1053988,次韵孙亨甫见寄
256151,车上读杜甫
157502,关胡山甫归山房
274158,甲申纪乱·昔见杜甫诗
963207,次及甫入峡杂咏 虾蟆培泉
1089370,王宣甫求崇斋扁榜仍索诗转庵之作先成即次韵为寄
1172015,同皇甫冉登重玄阁
18688,春雪过皇甫家
649401,挽刘荣甫 其三
559701,赠性甫
608355,淮上赠李道甫中丞 其二
1136331,铅山虞华甫往谢叠山枋得君直为书耕隐二字今年八十一其子舜臣字舜民来见尝师君直年四十九求赋耕隐诗
585781,为梁宪甫进士寿亲禄峰六十一华诞
103557,次韵和永叔雨中寄原甫舍人
133473,留题·巢父滩头甫着鞭
1212380,送安善甫
276522,送王熙甫始举进士之官吏部
263341,疏君通甫以所藏金梅僧遗画长卷属题
532896,送吴约卿西巡讯张助甫
592996,送王侍御纯甫量移内江令六首 其六
984019,和林子长谢徐吉甫蒲萄韵
839997,公安局长刘干甫先生汉桢四十初度，赋诗侑觞八首 其五
745956,答陈恭甫前辈
925865,雨中花慢 登新楼有怀昌甫、斯远、仲止、子似、民瞻
544562,送沈纯甫司马还就李十八韵
488604,赠别驾陈观甫之金陵
877222,送质甫侄铨试
489922,次韵陈敬初陪贡泰甫待制降香娄上 其二
488477,别黄贞甫
237947,送陈仲甫挟书游甫里
237947,送陈仲甫挟书游甫里
243243,甫里观·天随清调何人继
1115843,赵平甫幽居八操 筠居操
1028146,送苏寿甫少卿赴潼川漕
592474,宝应张氏丛桂园同皇甫子循郭次甫黄淳甫赋八首 其七 玉勾洞
592474,宝应张氏丛桂园同皇甫子循郭次甫黄淳甫赋八首 其七 玉勾洞
592474,宝应张氏丛桂园同皇甫子循郭次甫黄淳甫赋八首 其七 玉勾洞
1000837,次曾宏甫社日赏海棠吴守宅且试新茗韵
948484,敷文阁学士李仁甫挽词十绝 其一
1125490,赓周纯甫求归三首
1213073,戏作村中谣呈吉甫提举诸兄
592083,夜饮诸太史端甫宅
1033672,闻杜仪甫出台
349644,醉蓬莱·江上逢韬甫
506133,己未九月余新归灉江度构茅居甫成姻兄王氏效先有诗见美倚歌和之以酬其深意云 其一
1044070,为郭功甫偈 其二
604195,吴孝甫以雨后秋山图并诗见赠赋此奉答
480539,藤蓑次陈公甫韵
371585,次韵昌甫·叹息弥襟强拄撑
187530,送魏华甫侍郎谪靖州
1093579,次韵昌甫分遗乌石茶
1135375,闻汪翔甫八月十日卒去曹元会五月三日之报仅三月馀两翁皆年八十四
550128,庚申元夕仁常招饮灯市酒楼同王无近章甫仲田伯善年兄有赋 其八
537424,上巳同茂秦子与顺甫游姚令园分韵 其一
358781,寄李献甫运使
1030856,饯张平甫折海棠赠之
344997,喜德甫彦文至
547725,偕朱可大丞卿王兴甫文学会于子冲藩伯于城西道观二首 其一
533845,朱宗良吉甫巍甫佳甫方士功赵修甫彭稚修招饮
533845,朱宗良吉甫巍甫佳甫方士功赵修甫彭稚修招饮
533845,朱宗良吉甫巍甫佳甫方士功赵修甫彭稚修招饮
533845,朱宗良吉甫巍甫佳甫方士功赵修甫彭稚修招饮
1093411,昌甫以平生诗藁俾赵家净录因见题后
134339,依前韵奉送才元和甫使北
86651,次韵竹子彬五言·甫暮书窗黑
991153,和刘原甫白鹦鹉
843466,台城路 乙酉六月二十四日为荷花生日越八日姚柽甫丈约云阁与余往南河泡看荷花各得词一首时余将出都矣
57072,哭皇甫子安
88688,送德甫侄省试
1058025,和长历赋纸阁用王介甫韵
822958,迷神引 题胡高甫墓石
987986,陈秘书分符星渚同舍饯别用杜甫老手便剧郡之句分韵赋诗得老字
284942,赠曹老同年颖甫
538940,移晋臬将发寄别黄使君执甫及诸僚友
473946,江上送陈元甫还江西
321073,仁甫次弟余韵
903438,满江红 贺项平甫起复知鄂渚
139714,嘉甫弟生日
803998,定甫上公水磨沟别墅公宴别宋子顿
1048725,和潘通甫陈贴港道中作
569723,送傅吴县入觐以善治民闻而山甫子予辈谓其负仙骨精禅理因赋此为饯
1108389,挽王华甫提刑二首
567303,沈小霞梅为侄良甫题
816621,温甫读书城南寄示二首
605008,郑与庄畸园五岭之名园也欲候吕安之远驾君是嵇康寄题杜甫之草堂余惭高适戏呈二律窃附千秋 其一
705055,迁逐甫还次韵答舍弟文信
1048719,送潘通甫沿牒淮东
176578,喜郭吉甫擢第调尉八柱还里
408270,次韵和戒甫谈旧事见酬之作 其一
1026005,贺新郎 次韵昌甫雪梅曲
1043534,次韵王平甫直舍未开梅花
540485,联句 春夜顺甫子与见过
1121808,次韵陈融甫支盐年家见赠二首
1229927,送程中丞介甫赴云南行台
497305,同功甫豹孙游定慧仁寿二寺
963563,次及甫见寄 其二
353268,次韵居甫六绝句
875592,送明甫初筮十首 其一
362758,月下登太白楼和容甫壁间见怀韵
199664,题赵诚甫养恬轩
1093064,次韵斯远和答昌甫读谪仙诗 其二
19643,出斋日喜皇甫十早访
1040821,和原甫安福院二绝 其一
1094584,昌甫寄二绝和韵答之 其二
551040,送王生之临邛省州守叔父献甫 其二
881464,慰吴吉甫县尉
1242982,归来堂诗，为云间青龙镇章吉甫太守题
538638,魏济南顺甫寄过李于鳞之作
105800,次韵酬郝润甫
1052409,送元博县丞还浙忠甫沈翊还鄱阳
1042831,寻王深甫值其不在归寄此诗
1026083,朝中措 昌甫作长短句呈朱卿、余倅，因和韵
835708,浪淘沙慢 沪上送易由甫，用清真韵
1048706,喜潘通甫回郡
526324,赠朱铭甫还松江
1034854,新繁县禾登九穗嘉甫弟有诗索和
1232398,至正二十年八月十五日招同诸彦小集南湖以杜甫不可久留豺虎地南方犹有未招魂为均得不字
999888,秋试甫期辄成短篇呈马公节裴进士光世
533250,下山别在明徵甫
1158535,送子婿崔真甫李穆往扬州四首 其三
1212906,怀曹通甫
1049491,和新成都知府邓润甫温伯内翰道中见寄
3884,酬皇甫侍御见寄时前相国姑臧公初临郡
1043044,自江南将归先寄和甫 其二
1026743,和原甫见送
594787,送陈忠甫游南岳
613748,别李干甫
596978,七夕偕许稚干寮长童子鸣诸公集王太仆仪甫园亭得惊字
1208946,江浙省段照磨吉甫于予为同年友至顺癸酉会于吴门今春书来寄近诗十馀首遂和其次韵张伯雨新居四绝句以答时同年吕仲实佥浙西宪并以柬之 其二
559699,戊子春将赴温州杨君谦邀饯于虎丘同集者沈启南韩克赞二老复巾藜杖从子寿椿与朱性甫青袍方巾唐子畏与徐昌国并举子巾服而余与君谦独纱帽相对会凡八人人各为侣适四类不杂
1131612,次韵萧昭甫同游江东四绝句 宝云寺
1034914,六月十四日后殿侍立新永康太守成嘉甫朝辞奏事词气恳恻上为嘉纳尝随笔纪其事今乡人祖帐分韵得西字遂书以赠行
320240,赠王吉甫·生计箪瓢少郁陶
873779,读曾吉甫横碧斋诗
142331,为彭积甫题熙春堂
883146,挽李中甫使君 其三
488171,剑浦对月呈陈观甫
556787,小除夕偕马太史吴驾部集助甫宅分得源字
106342,寄题九华苏君明甫梦牛亭
1142724,次韵通甫至日
539834,寄魏顺甫
108499,题章和甫钓亭放言
142734,次及甫觉寒
593671,送习太史时甫谪泉州推官
670664,东陂同许殿卿陆南道函灌甫兄弟赋
821871,最高楼 题巢章甫海天楼读书图
147065,寄南昌故人黄存之宋谦甫
744796,成左二仲甫论诗 其一
1078274,初见梅花三绝句奉呈王丰甫待制 其二
1005711,九日敏求与侄璋九万载酒荪墅邀予与胡山甫潘少白及华顶周服之道士周若晦作客欲摘蕊浮杯丛委草间未有消息悯然赋之
343407,昨日以事不得陪赴和甫学士之召
302519,送刘栽甫去官之申江
285212,纪念杜甫·淋漓大笔包元气
1247025,载效唐律二解兼寄弘甫夏君 其一
569357,再赠马从甫
533160,助甫梦与余泣别见寄
366337,离京后寄贡甫隐直
176530,题叶山甫见惠古琴走笔以谢
539918,寄张广平助甫六首 其一
992272,饮刘原甫舍人家同江邻几陈和叔学士观白鹇孔雀凫鼎周亚夫印钿玉宝赫连勃勃龙雀刀
709947,答陆导甫
992340,依韵和原甫置酒兰菊间
670136,酬皇甫虞部寒夜书怀见寄
557225,大雪张助甫席上同子畏赋得胡字
545308,春日送赵均甫敬甫二文学一之北庠一之南雍秋试并寄怀大学士汝迈先生
545308,春日送赵均甫敬甫二文学一之北庠一之南雍秋试并寄怀大学士汝迈先生
920846,董储郎中尝知眉州，与先人游，过安丘，访其故居，见其子希甫，留诗屋壁
637604,次陈公甫先生见寄韵二首 其二
1163815,陪皇甫大夫谒禹庙
971493,奉呈何叔信魏昭甫三首 其三
370554,次韵昌甫·煖翠浮岚不可摹
371588,二十五日次韵昌甫别后所寄
435166,代乐仲和张温甫处督米
496928,京口桃李园作时戊寅春赵敬甫邬汝翼陈永年同游
556954,同余德甫吴明卿王元美再游张园 其三
1170048,洛阳城外别皇甫湜
844455,大庾乱甫定偕僚友出游近郊诸山
618881,石洞歌访叶化甫先生不值作此寄之
991368,送张殿丞吉甫知资阳
156111,山甫还峡石有怀书寄
680591,过巢县黄山峡怀友人孔道甫
488093,夏日仝陈元甫僧宏恩过万松庵盛仲文读书处得中字
559119,别驾刘景华甫下车即署海阳篆不三月以入觐行漫赋五绝为赠 其二
473518,无题四首戏呈孝甫子建 其四
