1213333,对雪寄范平甫二首 其二
209376,和姚山长一甫
533810,明晨同徵甫在明游玉龙洞题名其上
561041,南台寺同常甫兄宿是夕闻钦之兄自攸县来会
696138,唐曲江公张九龄志徐孺子碣陈献章公甫题宪副夏寅正夫邀伦同和宪使陈炜文曜刻石东湖亭上聘君子季登及陈蕃礼宜侑享故及
741839,为陆守之题尊甫寒山旧庐图次张文端公韵
609625,寄和沈纯甫比部游崆峒岩 其一
1067345,朱端甫以画牛一纸遗李成德成德以示予为赋长韵
552269,宁署壁间刻马端甫公咏竹诗而竹与人俱不可睹矣次以志感
670361,送范敬甫之闽中
1217083,九月二日揭晓仆以朔旦始得閒复成二诗录奉泰甫侍郎思齐御史本中都事道明敏文伯崇有志诸寮友 其一
798601,醉蓬莱·江上逢韬甫
829441,云甫得莫子偲抄校本简斋集属题
948478,敷文阁学士李仁甫挽词十绝 其八
1005705,和韵寄胡山甫
174491,和庞次甫秋日海棠
1080332,送曾宏甫知黄州四绝 其二
195816,噫田操四章章六句寄呈王介甫
920964,答范淳甫
1235678,和吴行甫雨雹韵
851886,李坚甫净居杂题一十三首 其二 静叟
1147294,杂言重送皇甫侍御曾
658140,东坡雪诗善用险韵王介甫赵昌谷诸老和之皆以为不可及余因其言遂戏和之 其三
49770,袁相国故居访李孝甫太仆
147307,见湖南绣使陈益甫大著
528214,同李川甫邹子家过张子言舍
851875,李坚甫净居杂题一十三首 其十一 水亭
286913,送从弟实甫柩归里
900850,风入松 用王介甫韵
911251,小重山 数椽甫葺，知府载酒宠临，辄次日近环湖所赋韵为一杯寿
833355,沁园春 其三 石甫罢官归寄慰
566054,雪后对月和皇甫子循二首 其一
475172,即事贻仪部皇甫员外
1058244,奉酬山甫
1135021,何仁甫作室日生男
1093279,昌甫有诗学长句次韵以柬处晦且当应举
474331,伏日姚唯之陆华甫董述夫见过
668337,偶过甫里乘月至白莲寺访陆天随故祠
539920,寄张广平助甫六首 其三
999813,和纯甫独往至德上方避暑
946398,寄陈同甫生日
815220,胡子莹同赵艮甫过访金山艮甫有诗见赠次韵
815220,胡子莹同赵艮甫过访金山艮甫有诗见赠次韵
598347,由青霞过石洞访叶化甫得龙字
274306,阳关引·送淮甫六兄还南京，自言或将赴成都就其婿女，有黯然惜别之意
567336,送吕中甫之潞
700407,将往吴下成少子婚罗质甫徐一之俞鲁用泛舟送至令桥二首
1085903,送宋山甫知县
248968,冒雨拜谒杜甫草堂
542584,夏日郑园陪饯皇甫子循别驾同沈禹文参军元仰之给事王元美比部沈子文刘朝宗进士赋此
435853,送曹吉甫兼及通甫
435853,送曹吉甫兼及通甫
818003,悼黄克强、蔡松坡，示刘栽甫 其一
538330,寄皇甫子循别驾
613680,过羽甫家兄池馆留赠 其一
1094781,次韵王寺簿所和昌甫句 其二
593634,怀铜梁张中丞肖甫
873785,寄茶与曾吉甫
497192,梅花篇初春偕山甫始馀长倩三隐君及儿子允文过湖上邓尉聚坞诸山为十日游制三百字
913670,谢赵茂甫惠浙曹中笔蜀越薄笺二首 其二
497182,谢都尉新楼落成与山甫丈各赋诗赠之
569122,张守有温甫学士擘窠书老柏行余以仲昭太卿画竹配之时万历丁丑之八月廿五日守诞辰也眷属在里中将有就馆者并以为祝
944907,上巳日同弟观张子开会内弟贝端甫家
1048426,咏唐史 李林甫
604565,刘觐国方伯以阅甫亭索诗赋赠
1057935,舟行怀斯川用王介甫韵
39119,甫田·无田甫田
39119,甫田·无田甫田
1215062,奉别瑞甫高掾郎还南台
556788,除夕放歌行同助甫赋
991379,送李献甫寺丞知虹县先归金陵
117734,刘贡甫·贡甫少多才
117734,刘贡甫·贡甫少多才
341089,和李山甫咏柳
1105925,我策我马寄王介甫
963771,答及甫见和 其二
1048273,送浦大会甫赴榆次
592837,午日过新蔡访张助甫
908420,送吕义甫
571288,寓思行沙庄呈尊甫南山隐翁三首 其一
1047515,和李正甫喜雨
334607,月林为僧甫赋
303787,汉宫春·为吴湖帆题仇实甫绘长门赋图卷
921371,王中甫哀辞，并叙
557100,白伯伦仪部移居夜阶助甫司封访之席上赋得卜居赤甲迁居新两见巫山楚水春十四韵 其九
541881,汾州以来分守参政如胡世甫葛与立马子懋程信夫彭克宪陈元卿李子高宋伯镇孙格卿张时芳纪恒甫诸公皆旧识也宋有禦敌之功不见知当道解官归越嗟哉
541881,汾州以来分守参政如胡世甫葛与立马子懋程信夫彭克宪陈元卿李子高宋伯镇孙格卿张时芳纪恒甫诸公皆旧识也宋有禦敌之功不见知当道解官归越嗟哉
547836,寄吴少溪宫录七十 其三十二 携陈山人东甫饮黄石山顶
760527,云泉仙馆次壁间韵与易实甫同诸子作
614718,送关德甫恤刑江南
833595,浣溪纱 其一 昨以小词调石甫，今始知可人期不来也，再赠
371584,次韵昌甫·何处逢人可共杯
883798,尘土呈介甫
1005578,送山甫还峡中
558461,和韵留陈公甫
960936,先贤八咏 其七 杜甫吟诗
689314,病后伯华仁甫汝存携酒见访
533086,暮春张考功助甫邀游韦氏园时梁舍人思伯偕至 其八
158171,纯甫小池生双莲
1191363,留守府酬皇甫曙侍御弹琴之什
1057939,梦与舍弟登灵泉步趋如无疾既觉感而赋诗用王介甫韵
1110150,送刘仪甫职方东归二首
1094583,昌甫寄二绝和韵答之 其一
1231526,丁未四月十一夜避地船居沈华甫家下
13283,甫构西亭偶题因呈监军及幕中诸公
22013,寄友人·杜甫在时贪入蜀
196863,和介甫寄安丰张公仪之什
383767,鲍兵部山甫过访谷城山馆
1210993,同李吉甫载酒泛顺阳江
1094602,和昌甫竹句 其一
597453,答皇甫稽勋子循
912275,同岳大用甫抚干雪后游西湖早饭显明寺步至四圣观访林和靖故居观鹤听琴得四绝句时去除夕二日 其四
277876,荣寿·崧岳何时诞甫申
1064523,代夏均甫宴人致语一首
299235,赠倪端甫·处士高风山并高
533115,和徐子与答郭次甫折梅相赠之作
228263,送李容甫归北都
167396,与子野过永仙观循西城以归邂逅李戒甫夕山西
989127,和石及甫惠蔓菁子
629234,过姑熟访曹元甫光禄 其二
174827,过庞佑甫·半亩方园水到门
95867,别马庄甫·邂逅成深识
700646,甫里即事四首
907792,题罗源驿用马驹甫韵 其二
1146754,酬皇甫冉西陵见寄
683522,送助甫使君赴河西
1099874,寄刘躔甫
1139184,赠翟良甫洛人南游
1102486,留示逯云甫秀才 其一
605163,读旌柏堂录为陆贞姑七十寿赋贞姑今宪副廉石陆公之姑也姑年十六归同邑参知冯公皋谟之子曰春旸甫期春旸逝姑举遗腹子五岁亦夭姑投缳触棺誓殉地下左右力护视始免参知公伤其志欲为择嗣无可择者乃以幼女为姑之女是贞姑以小姑为女亦为子也盖义起矣参知公曰小姑长唯妇择婿婿之于是宪副公为贞姑之婿宪副公郎水部日辄疏贞姑之节以闻得报表闾称贞姑云岁甲戌姑年七十矣八月既望为设帨之辰宪副公适以入贺过里乃索拙句为寿不得辞敢以三章侑勺者
945916,国朝自建隆至大中祥符七年垂五十载谢颐素始奏名甫官太守
858678,平甫与宝觉游金山思大觉并见寄及相见得诗次韵二首 其一
1093140,次韵昌甫同酌宋知军家酿
791220,六月四日为余六十初度，魏盘仲刺史刘申甫太守姚彦嘉通守徐然明上舍先后各以肴酒为祝，是月魏赴苏，姚赴鄂，徐赴岳州即席口占志别
865101,王夷甫
566035,送皇甫礼部子安使中都省亲还京一首
568883,赠卓征甫光禄见访弇园作
585780,为黄肖甫进士寿亲六十一华诞
899385,赋山茶示陈慧甫三首 其三
569839,助甫中丞解夏州节候次新蔡里中得二律寄之 其一
89883,甫韵·把茅容膝强名庵
445825,平江谒杜墓时全国第四次杜甫诗歌研究会在此召开
750402,偕吴挚甫方伦叔家子椿侄携楷朴概三儿子寻披雪瀑即送吴方二君北行
132986,和黄醇甫将行赴范侍郎海棠夜宴八韵
372056,送曾鸿甫著作还朝
559121,别驾刘景华甫下车即署海阳篆不三月以入觐行漫赋五绝为赠 其四
600411,夏日同陈仁甫陈公望游净业寺 其三
471795,和刘怡溪观涨韵酬邓子高龚进甫三首 其一
671484,送陈天甫督学岭西
1093065,次韵斯远和答昌甫读谪仙诗 其三
594535,送张山人英甫还永嘉二首 其一
667472,寄沈诚甫兼柬泽源禅师
534085,同邹方伯继甫游罗浮
1043577,酬王平甫
1094727,十二日次韵昌甫 其一
415731,读杜甫诗后
537761,皇甫司勋宅逢故九江守王丈王於先君同年其来也为其尊大夫乞皇甫志墓因赠五言三章 其二
537761,皇甫司勋宅逢故九江守王丈王於先君同年其来也为其尊大夫乞皇甫志墓因赠五言三章 其二
488513,题林中丞柳桥别业兼赠洁甫公子 其二
689444,夏日馆张以正以济餐秀园留题兼呈吴宗甫
454793,成都行 其二 杜甫草堂打油
570185,和肖甫司马题旸德大参东园五言绝句十首 其二 团云径
245648,李迅甫送蟹
51274,送张肖甫
922480,次韵郭功甫观予画雪雀有感二首 其二
488655,寄用晦王孙兼柬余德甫宪副
568715,四十咏 其一 皇甫佥事汸
433703,丁未七月十五夜与连仲甫小万柳堂宴集二首
155056,送坚甫同年·春深行剑栈
1207714,赠陈章甫
343557,贾中甫送庆甫弟来尉永兴久之告归仆多其来而重其去乃为诗以送之
343557,贾中甫送庆甫弟来尉永兴久之告归仆多其来而重其去乃为诗以送之
542027,送王端甫归浦坂
375227,老融放耕图皇甫都护雁图二绝
807796,沁园春  溉堂先生客南昌幕府屈首经师已踰两载甫归广陵词以讯之
1001013,曾宏甫分饷洞庭柑
1042862,和原甫郓州乐郊诗
298168,台城路·希翁邀赴湾仔市楼话旧，因忆往日朋俦如绍弼、巽甫、秀冥等皆先后谢世，不胜黄垆之感
422976,庐山杂诗十四首 其十一 开先寺后有读书台。杜甫诗云：“匡山读书处，头白好归来”；苏轼诗亦云：“匡山头白好归来”。余登斯台，有感其言，因为此诗。余所谓“归来”与杜苏所云不同也
878050,题金华王山甫吟稿
910749,题清虚庵皇甫真人坦之隐居
345067,和通甫道中先寄
61608,溪閤坐雨招胡国珍陈用甫二丈
186714,正甫还长沙复用斜川日和陶韵为别
551326,送黄君甫还剑津
683757,中丞徐公追挽先君三章甫至举寒食奠感叹之馀因成二绝奉报
911574,赵山甫居玉壶尽得湖山之胜醉后和其韵二章 其一
132902,敬甫生日·苹尾生薰梅作霖
1131053,和原甫安福院二绝
675800,寄功甫归隐东麓
105132,依韵和王介甫兄弟舟次芜江怀寄吴正仲
1166539,春夜皇甫冉宅欢宴
761332,齐天乐  送周韬甫、赵敬甫之杭州
761332,齐天乐  送周韬甫、赵敬甫之杭州
810309,哭石甫叔
1062805,送宋宏甫出守邠州
948481,敷文阁学士李仁甫挽词十绝 其六
243234,赠雪林李和甫
541696,丙午上元西社观灯登城楼次日桥上看龙灯同孔治甫暨薛龙阜胡含素梁君旭来阳伯驭仲家弟希孔得同字
228659,和耕甫弟梅
237182,次韵朱婿实甫见寿
594310,雨中李惟寅宋忠甫邀集冯虚阁同吴公择方子及诸君得游字 其二
695950,送张山人英甫还永嘉二首
1217069,会试院泰甫兵部既答和拙作且示以佳章仆以汨于校文遂稽貂续仍韵见趣所考既就格辄缀四首录奉一笑 其二
1048349,和聂充甫晨霜
1077567,唐植甫左司许出示所藏红丝砚辄成短歌奉呈并简顾子美
620610,答李绳甫
570557,赠孙章甫 其二
1088864,近得一二砚示范达甫笑以为堪支床也许送端州大砚作诗以坚其约
624142,得傅贞甫容县书呈其尊人明府公
593926,答豫草五宗侯五首 其三 答魏甫
353370,中川席上送陈同甫
354228,忆郑元甫·别后黄花两度残
634874,酬罗仲髯因苏未仁过钟山同坐月兼附见讯时余与徐圣甫游西樵
114180,再次孔四韵寄怀元翁兄弟并致问毅甫
812433,秋暮师竹过访偕伍硕甫舟泛西湖纪事集成 湖滨携酒
557086,张助甫席上同吴峻伯白伯伦再饯朱主客南还赋得江飞兢渡日草见踏青心十韵 其九
370530,昌甫诗·紫芝九日上杭都
994148,题梅坛毛庆甫云悦楼二首 其一
983357,赓周纯甫求归三首 其一
661005,庆族叔用丹甫寿七十
1131410,林正甫与子中春并命为御史正甫按刑浙东道别去兼旬而予衔命按视宫陵经越上获一再款语临行有诗因次其韵
1131410,林正甫与子中春并命为御史正甫按刑浙东道别去兼旬而予衔命按视宫陵经越上获一再款语临行有诗因次其韵
533951,用晦宗侯偕赵脩甫刺史过访
787675,秋暮师竹过访偕伍硕甫舟泛西湖纪事集成 其二 舟中持螯
1213297,倚和吉甫提举见赠雨中述怀诗兼寄王觉轩山长
1093954,寄昌甫
369807,次韵昌甫寒食
691005,过姑熟访曹元甫光禄
906290,次韵明甫西山之咏
569999,寿余德甫七十
689595,陈山甫遨集杨姬华林馆同赋四首
593132,雪中同陆华甫泛舟章江忆曾与华甫自广陵冒雪渡扬子过白下
593132,雪中同陆华甫泛舟章江忆曾与华甫自广陵冒雪渡扬子过白下
593875,送阎进士俊甫宰蕲水
986240,次韵王衡甫
1043463,酬潘及甫同年秘丞
1124377,又次王醇甫闻人主簿二首
829420,秋日同愔仲剑丞病山彊村勉甫游西溪访交芦庵秋雪庵遇雨归作西溪泛雨图题四绝句
826755,八宝妆·甫里保圣寺罗汉塑像
537425,上巳同茂秦子与顺甫游姚令园分韵 其二
156171,山甫游嵊拜戴安道墓而归新年过我凤栖作此赠
141348,题寒绿轩·甫里先生穷到老
591312,九日同梁仲登黄贤甫登刘王郊台
1156486,寄皇甫七
343543,和聂充甫水南见寄
475578,春日同皇甫子循游吉祥寺
370656,谢昌甫芋药
1000912,贺曾裘甫得解
1168838,癸巳岁吉甫圜丘摄事合于中书后阁宿斋常负忝愧移止于集贤院会门下相公以七言垂寄亦有所酬短章绝韵不足抒意因叙所怀奉寄相公兼呈集贤院诸学士
1000218,送张升甫三十韵
622663,江上花词　杜甫
1026638,次韵和平甫同介甫当世过饮见招
1026638,次韵和平甫同介甫当世过饮见招
533048,送苏仁甫之永安
1208354,江阳毛定甫天光云影阁
1094792,将到章泉水赵成甫寄三绝来 其三
1215606,三华吴宜甫桃溪十咏 其一 本原楼
618007,游南池读杜甫诗望太白酒楼
756830,胡子莹同赵艮甫过访金山艮甫有诗见赠次韵 其一
756830,胡子莹同赵艮甫过访金山艮甫有诗见赠次韵 其一
828007,散原先生夜过观先师关先生及强甫遗稿感而有诗奉答一首
146093,赠蜀医钟正甫
1028976,林正甫察院出示送刘德修都运殿院诗并德修和章人事好乖置之勿复道也第一见倾盖如平昔而万里远别又不能一面得非皆有不偶然者存乎勉强继韵一写胸中磊块而结恋之怀又有诗所不能尽者 其二
471140,鲍溪甫话旧
1130844,次韵昌甫并帖斯远五首
999699,纯甫小池生双莲
732413,建州符山寺别楚黄樊山甫
658141,东坡雪诗善用险韵王介甫赵昌谷诸老和之皆以为不可及余因其言遂戏和之 其四
911692,送耕甫弟赴补
1051803,韩氏周宣王时为侯尝入觐而归显父饯之尹吉甫作诵今司空康国公既老元祐丁卯朝京师戊辰春还许天子赐燕某赋是诗
1093825,同昌甫游瑞应峰一宿次韵
804656,北渡黄河甫登岸风雨即至驴背上诗以纪之
534069,别次甫因忆子与 其二
1032026,戏书王文甫家
860740,赵成甫招饭次默夫韵
216290,送和甫至龙安暮归
533678,秋夜曹有卿余德甫刘仲恭吴约卿见过得楼字
1026115,醉桃源 和昌甫
475308,答同年李仁甫寄点苍山石
859640,答扬州刘原甫
700542,答李川甫二首
319652,杜甫·稷契寻常便许身
43051,温甫读书城南寄示
189498,寄题材夏时甫晓山亭诗
1042706,次韵和王平甫赠张舍人
274008,金缕曲·亚子招饮凯歌归酒楼，越日北返。用稼轩送陈同甫韵赋赠
271128,闻易实甫比部入蜀题诗却寄
691347,潇湘竹二绝为谢大尹尊甫尚哲题
158825,赠苏宣甫·谪宦多因众口谗
369996,昌甫所寄·经行宛转动吟肠
1035513,同大孙状元送杨甫之蒲中
275869,追悼友萍次立甫韵
335655,和中甫新开湖
829387,嘉兴吊强甫
197408,忆江阴呈介甫
591329,陈潜甫于风雪中见访闻将寻张苏二逸人怅然怀之
1131516,和林正甫遐思湖上丽人绝句
1055229,送陈季甫
842077,和张哲甫四十书怀二首 其一
533083,暮春张考功助甫邀游韦氏园时梁舍人思伯偕至 其五
378010,孙志甫主簿挽词
991154,和刘原甫复雨寄永叔
592881,陈使君敬甫张进士于皋过斋中对菊
828776,云甫得莫子偲抄校本简斋集属题 其一
593229,同邢子愿陈忠甫诸君过摩诃庵听无弦上人琴
825884,陈一甫观察六十双寿
1093497,次韵昌甫九峰留诗 其一
54050,皇甫仲璋邀饮惠山
807320,水调歌头  夜饮季端木斋中归忽尔飞雪填词奉柬并怀尊甫孚公
975587,寒食哭承甫兄墓
1089184,闻德远与曾裘甫黎师侯会饮范周士所 其二
371826,昌甫携儿侄载酒来送分韵得房字
704437,送王仪甫之蓬莱县
1094944,谢昌甫芋药 其二
565703,赠杭郡太守李端甫一首
697986,和刘怡溪观涨韵酬邓子高龚进甫三首 其二
787761,借书柬衡甫
366046,踏莎行·题潘补之希甫春驿寄诗图
1234758,送李荣甫知事迁淮西 其一
700399,八月十三夜与文济时范质甫城西泛舟达秦淮三首
530044,题汪庸夫孙道甫道义同心卷
509501,成化己丑丁先人忧守制甫半载十二月二十日忽奉恩诏夺情起复进阶右都御史总督两广军务兼理巡抚上章辞免升秩乞留终制不蒙俞允感而有作
1051630,和亶甫夜字
88749,送明甫初筮·宁游屋溪畔
709033,上元夜同河东君泊舟虎丘西溪小饮沈璧甫斋中
1130691,次韵王教授同寄昌甫器远无为临漳
152303,刘共甫枢密挽词
1136462,赠医士清溪居士丘通甫
165756,次韵阎仲甫郎中病起
604465,泰和萧君还拙以青乌氏客端州十六寒暑矣馆于余者甫三年乡思忽动孤舟遄发既惜其别复望其来乃留其家还拙以古人行谈古人术往往能取今人信第今人得还拙曰地师余得之曰人师也故于其言别也既为之治装复为之赋诗 其二
7652,送许八拾遗归江宁觐省甫昔时尝客游此县
987390,题天台夏肯甫晓山亭诗
374739,陆税院·甫里云间谱
908576,题旴江王章甫梅境
549983,明孔山偈呈性甫
538427,送张肖甫徵金岭西道便道还蜀 其二
360168,春暮呈容甫
563044,詶卢原甫次韵
6867,酬皇甫十六侍御曾见寄
992305,依韵和刘原甫舍人赴扬州途次赠予翩翩河中船
671069,答殿卿代寄正甫
137953,送王平甫下第
597520,送同年施钦甫宰萧山二首 其二
323682,次韵梁才甫游苑氏园
1016386,为张功甫赋寒绿
88748,送明甫初筮·先绪微如线
676358,柬高成甫
978975,寄太府丞王能甫
538368,暮春同茂秦子与顺甫正叔游韦园分韵得村字 其二
530419,戏效汪京兆西湖六首为孙道甫书于湖之南屏山居 其四 和靖怒答
274382,减字木兰花·淮甫兄辍西蜀之行，复来相会
1093171,和昌甫
1093948,寄永嘉叶丈以昌甫韵
983375,咏丹桂赠周纯甫冯德厚 其二
88399,寄强甫·守局喧卑地
876433,用强甫蒙仲韵十首 其七
709149,留别曾自昭徐圣甫
1026042,浣溪沙 其一 同昌甫饮南池
304281,梦强甫·死别吞声意已灰
729800,南乡子  题易硕甫洞庭眺月图
744995,李芸甫水部画松为子佩参军赋
247718,木兰花慢·为马宾甫题何邹崖陈述叔诗词合卷
663613,寄胡文甫
1093447,次韵王教授同寄昌甫器远无为临漳 其一
496263,万年欢 和答白下史恭甫庆予六十之作二阕 其一
1158533,送子婿崔真甫李穆往扬州四首 其一
1093504,昌甫自衢送客入城得其诗次韵呈之 其二
947520,贺刘叔猷为用甫纳妇
667894,赠别皇甫百泉 其三
1093515,马庄甫经过留五字次韵
999833,岳庙斋宫与崔伯宪都官王正甫殿丞饮别二君各以诗送行席上作短篇奉答
857138,次韵介甫集禧池上咏鹅
835805,贺新凉 其一 题徐积余太守所藏渊雅夫妇合璧书前后赤壁赋，用易硕甫观察原调
1050686,王平甫下第南归
896596,宿钱睦甫南斋
959997,徐山甫夜话有诗言别次韵
433186,谢振甫赠纸二首
592468,宝应张氏丛桂园同皇甫子循郭次甫黄淳甫赋八首 其一 淮南草堂
592468,宝应张氏丛桂园同皇甫子循郭次甫黄淳甫赋八首 其一 淮南草堂
592468,宝应张氏丛桂园同皇甫子循郭次甫黄淳甫赋八首 其一 淮南草堂
1245582,赠儿大同甫之龙岩巡检任
334264,次驹甫涵虚阁韵
1179869,题杜甫集
1114313,次韵明甫西园之什
787512,熙甫晓雨寄《丹桂》诗见示，因感子乔南行，即示二子
843154,衮甫纕蘅正月十九日招集西长安街广和饭庄广和居旧庖也
411459,怀光明甫老先生 其二
107697,居士丘通甫·若有人兮云锦裳
1094606,和昌甫竹句 其五
664460,内弟文甫至清河一见而别题扇赠之
1088323,刘平甫分惠水栀小诗为谢二首 其一
471300,怀陈将军同甫
371280,谢昌甫到九峰
284989,三十三叠前韵赠曹老同年颖甫先生
348672,王平甫下第南归
860019,送黄同年京甫必昌赴广西提干二首 其一
366910,和吴端甫书怀
372058,送章抚干兼寄皇甫襄阳
991668,次韵刘原甫社后对雪
557083,张助甫席上同吴峻伯白伯伦再饯朱主客南还赋得江飞兢渡日草见踏青心十韵 其六
275709,为吴起凡赠许贞甫南还
470993,仲冬同周虞卿葛震甫郭圣胎恒光牧隐二上人石镫庵话别用三字
557314,新春赠李司封子藩用助甫韵五首 其三
435476,侄谦甫任长安回 其一
530317,题孙道甫小景五首 其一
228524,耕甫弟寄示秋怀二章冗不能皆和次韵后章谩见
570677,伯玉肖甫见过后即作书遣候明卿而殊苦一介之难因成二绝并寄明卿 其二
66657,寄中甫上舍
1200306,送吕才甫之官合肥
920552,五月十日，与吕仲甫、周邠、僧惠勤、惠思、清顺、可久、惟肃、义诠同泛湖游北山
1045877,次韵思道同晦甫春日过李氏园亭
345068,和潘通甫寄孙太守
556853,皇甫别驾初至夜集得归字
557085,张助甫席上同吴峻伯白伯伦再饯朱主客南还赋得江飞兢渡日草见踏青心十韵 其八
354468,和蒋深甫雷亭韵
198833,和贡甫送元考元考不至
585915,题易吉甫观心卷
608357,淮上赠李道甫中丞 其四
539886,赠吏部张大夫助甫 其二
222513,昌甫前诗见简方和去未达间再於岩叟处见后诗
1219782,送苏吉甫馆于穆千户家归
572591,王章甫送余石头口因共游赤壁章甫将归读书九峰山 其二
572591,王章甫送余石头口因共游赤壁章甫将归读书九峰山 其二
86655,次韵赵克勤吏部·甫里薄田汾曲庐
569466,马从甫别六年矣以诗投赠余诗转佳而复不第走笔慰之
473780,春日皇甫司勋见过余出小鬟以筝琶侑觞司勋为赋三绝句率尔奉答 其三
1142329,仲实践约来访又得韶甫方君同行数日语蝉联甚慰五诗寄意甚高次韵为一笑 其三
104221,和介甫明妃曲
547796,初夏陈东甫张仲参东园小集
866715,僧有悟策者见予于珞碛江上诵程子山孙季辰李仁甫赋成都信相寺水月亭之什仆曩客成都朝夕过信相鉴公求此诗至再三余谓诗于佛法业成绮语每笑诃之不为作今策诵二三公佳句起予追赋长句付策令寄鉴公
869302,晚行后园见菊戏宜甫
593647,送沈纯甫谪戍雷州
423069,永遇乐 仲琴丈属题陈恭甫旧藏武梁石刻
381662,与易实甫观察同游玉洞
533668,寄吕肇庆仁甫
455760,杜甫诞辰一千二百九十年
1008022,辞洞斋、华甫二刘兄惠寒衣
811194,村居书感，次崧甫韵
58542,重吟·重吟梁甫自悲嗟
195879,寄介甫·已推事业皆归命
829916,悼黄克强、蔡松坡，示刘栽甫
1034445,次韵谯仲甫致政闻南迁见寄 其二
778218,百字令·甲戌月正三日黄子寿太史招集奎画楼，刘培甫词先成，予为效颦
1182912,同皇甫侍御斋中春望见示之作
285091,桃源忆故人·碧水舟山塔顶见易实甫、于晦若诸君题名
653707,八月十九日与张良甫宿彭城风雨有作
171205,书怀奉简黄成甫史君
1032020,句：岁除题王文甫家桃符
445437,甫接诗友电极言山居閒适因有感焉信口漫成
1128017,和程及甫迎春三首
962277,少年游 戏平甫
1048449,喜德甫彦文至
211671,送陈敬甫·十年所闻溢吾耳
676350,武夷傲吏行赠潘勉甫
255920,送李嘉甫信都令耘甫之弟
255920,送李嘉甫信都令耘甫之弟
833745,采绿吟 上巳日小园桃花犹盛，柬招伯严、石甫、午诒、公倩小集
1155260,问韦山人山甫
292287,青山湿遍·余初娶于舅氏，妇陈结缡甫五月，昙花遽遗，榇尚旅殡吴淞十五年
948479,敷文阁学士李仁甫挽词十绝 其七
592994,送王侍御纯甫量移内江令六首 其四
487772,题九鲤湖仝郭士龙林翌甫作
1005674,新历未颁遗民感怆二首贻王达善曹季辩胡山甫戴帅初诸君皆避地客也 其二
860144,岁暮呈同行蔡实甫
159850,答贡甫酌骐骥池上见诒
838347,和哭盦道人易实甫观察台舟感怀原韵 其二
839811,壬申十二月四日陶社消寒第一集分呈众览二十首 其七 沙先生怀甫
569001,洪山人自永嘉偕肖甫司马过吴门轻舟入访云将入燕赴平津之约余时病起为蔬食以供从容久之因成一章为别
88746,送明甫初筮·博士今儒彦
550123,庚申元夕仁常招饮灯市酒楼同王无近章甫仲田伯善年兄有赋 其三
945578,次韵吴山甫
943163,次韵刘常甫见赠二首 其二
