1210669,赠李吉甫
789580,探芳讯  朱氏湖庄和云甫丈
603070,怀苏隐君文甫
748747,闻石甫先生蒙恩赦复官四川奉寄 其二
1094764,次韵昌甫
817685,社园送栽甫南归
557367,人日大雪峻伯助甫来过赋得榆愁门阳四字四首 其二
958710,和孔义甫送谢丈致仕
605162,读旌柏堂录为陆贞姑七十寿赋贞姑今宪副廉石陆公之姑也姑年十六归同邑参知冯公皋谟之子曰春旸甫期春旸逝姑举遗腹子五岁亦夭姑投缳触棺誓殉地下左右力护视始免参知公伤其志欲为择嗣无可择者乃以幼女为姑之女是贞姑以小姑为女亦为子也盖义起矣参知公曰小姑长唯妇择婿婿之于是宪副公为贞姑之婿宪副公郎水部日辄疏贞姑之节以闻得报表闾称贞姑云岁甲戌姑年七十矣八月既望为设帨之辰宪副公适以入贺过里乃索拙句为寿不得辞敢以三章侑勺者
570640,和张肖甫司马题王阳德使君阳湖别墅十咏 其二 清凉界
705062,陇外寄答李道甫二首
550785,同陆纂父郭圣仆雨夜集曹重甫客舍得凉字
861413,送相士管明甫
566247,怀皇甫子安蔡子木一首
206191,谒皇甫清虚
533978,寄余德甫观察
447863,鹧鸪天   甫至成都，偕王蛰公，吴金水、邱登成、张青云、高凉、梅疏影、吴文洁诸友宴集川大何峥先生十二梅花吟馆，约别后共赋此调
995682,奉答李和甫代简二绝句 其二
497292,同赵敬甫京口游桃李园作
876062,赠日者朱俊甫二首 其一
1094062,二十六日昌甫归章泉水
627955,独坐柬罗颢甫胡大灵 其一
817505,南归，甫抵家门，次儿绶华遽殇。吟咏概绝，两月有馀。小暑日，独坐海幢寺后园，得句
610218,赠同年关德甫吴用潜成进士 其一
216289,送和甫至龙安微雨因寄吴氏女子
615420,同陈治甫邓伯乔何龙友朱惟四何伯承游峡山登眺虚岩绝顶得二十韵
1144147,送升甫归九江
939043,用前韵寄昌甫
1000846,次镇江守曾宏甫见寄韵
1094034,送陈同甫丈赴省
372085,次韵昌甫·老觉浮生空地隔
474665,立秋后一日助甫见访得霜字
750515,敬题通甫师诗集后时师新自都归
1003072,舒州寄王介甫
371579,昌甫所寄·飞舞醯鸡只瓮天
592975,九日王九德崔继甫沈恩甫见邀同吴虎臣饮八首 其四
592975,九日王九德崔继甫沈恩甫见邀同吴虎臣饮八首 其四
569666,云巢老人走使渡江以诗相问有作序定千皇甫谧语赋此报之仍寓怀仰
569368,题灵椿图寿卓澄甫光禄五十
945366,挽张正甫二首 其一
962295,阮郎归 其一 为张平甫寿，是日同宿湖西定香寺
1094152,次韵昌甫寒食 其二
876470,示强甫
1005742,山甫游嵊拜戴安道墓而归新年过我凤栖作此赠别
1088230,观洪遵双陆谱有感呈刘平甫范仲宣二兄
594327,夏日周公瑕马从甫陆成叔同集悦上人禅房得书字
533082,暮春张考功助甫邀游韦氏园时梁舍人思伯偕至 其四
603060,访李隐君裕培宅留饮偕次魁珏甫良甫诸茂才同集
603060,访李隐君裕培宅留饮偕次魁珏甫良甫诸茂才同集
1132406,挽王平甫二首
1045873,廨舍之北有海棠二本惜非其地移植庭前呈晦甫同年博士
497119,山中逢顾山甫不得过访
1219522,寄贡泰甫授经二首 其二
1139278,题梅坛毛庆甫道士云悦楼
817644,春晚示栽甫
557063,得余德甫书二首 其一
592859,夏日同陈使君敬甫游郑园泛舟因怀王侍御纯甫
592859,夏日同陈使君敬甫游郑园泛舟因怀王侍御纯甫
103160,王平甫惠画水卧屏
115934,戏赠张嘉甫
371786,昌甫题徐仙民诗集因和韵两篇
694867,人日大雪峻伯助甫来过赋得榆愁门阳四字四首
807798,沁园春  酬赠黄交三即次原韵并示尊甫仙裳贤昆月舫
226911,远游丞樵隐王德甫寄诗辄和二章以谢
962319,莺声绕红楼 甲辰春，平甫与予自越来吴，携家妓观梅于孤山之西村，命国工吹笛，妓皆以柳黄为衣
1025472,送中甫兄之淮南 其一
778358,千秋岁 和王介甫
1157286,和皇甫郎中秋晓同登天宫阁言怀六韵
91065,许昌公宇书怀呈欧阳永叔韩子华王介甫
365009,病起次和何温甫秘丞雪琬中见寄
941747,三部乐 七月二十六日寿王道甫
47364,梁甫吟·谁谓秋月明
1142081,过棠山徐坟欲招通甫不果晚憩景德观以归寄通甫
1142081,过棠山徐坟欲招通甫不果晚憩景德观以归寄通甫
1093526,次韵昌甫 其五
925239,和洪玉甫秘监荔枝三首 其二
530244,孟秋十六日孙道甫范文一昆仲邀予同汪进之京兆方质夫逸人泛舟西湖二首 其一
102830,走笔谢吕行甫惠子鱼
1089366,雪再作山甫约游雨花台不遂闻与诸公登凤凰台次韵送似
652295,吹台上送李柬还关中兼寄李素甫孝廉
1234429,用行甫韵
866346,陈东甫酒閒举作归心只有杜鹃知之句犹未成篇因为续之
539083,赠曾参议公公子中丞以三抚蜀甫迁官即归郢
19603,闲居偶吟招郑庶子皇甫郎中
1208344,送魏通甫南归
572469,得李宏甫先生书
683335,答张助甫三首
695898,送茅平仲还京口因怀郭次甫陆无从四首
531035,新正六日随徐子容郭介甫唐守之登镜光阁一首
1191566,经杜甫旧宅
1102025,柬王德甫 其一
296099,林霜杰属题尊甫蜦铁先生单笠双鞋团扇小象
378898,代夏均甫宴人致语
470610,期顾德甫兄弟看花不至
1145280,时人为裴皇甫二姓兄弟语
371301,陪昌甫成甫寻泉看鹤而归
371301,陪昌甫成甫寻泉看鹤而归
1042497,汾州有唐大历中崇徽公主嫁回鹘时手迹在石壁上李山甫作七言诗并刻之子华永叔内翰皆继其韵亦同赋
1094168,尹谏议秋怀昌甫以其韵赋之因亦和焉 其五
1250641,阳翟新朱定甫赋 其三
66491,春日同皇甫子循游吉祥寺
677212,再赠夏华甫
819821,嘉兴吊强甫 其二
602507,春日怀高博士正甫
1089734,次王宣甫韵
1066439,寄卢中甫四首 其二
229060,和李中甫知录采兰
540166,中丞徐公追挽先君三章甫至举寒食奠感叹之馀因成二绝奉报 其二
85454,次王雪澄赠实甫韵
859083,寄黄吉甫
499610,寄何幼恭（时余失内助幼恭年将五十生子甫及一周而失之俱可恸也）
1214488,章俊甫水心亭
561044,常甫宪副钦之翰检与予先后登岳钦之独值雨是日予与常甫坐候云开堂因赋二章 其一
561044,常甫宪副钦之翰检与予先后登岳钦之独值雨是日予与常甫坐候云开堂因赋二章 其一
851879,李坚甫净居杂题一十三首 其七 春轩
374893,次陈平甫提干晚春韵
900301,跋王介甫游钟山图
1179381,甫搆西亭偶题因呈监军及幕中诸公
453129,闲思次杜甫《秋兴》韵八章 其二
1092762,溪山堂曾宏甫作徐师川吕居仁曾吉甫王元渤郑顾道晁恭道王起岩吴传朋徐明叔游咏之地
1092762,溪山堂曾宏甫作徐师川吕居仁曾吉甫王元渤郑顾道晁恭道王起岩吴传朋徐明叔游咏之地
63155,寄怀王震甫客蜀
372130,次韵昌甫九峰庵所寄
562715,送方众甫备兵永平三首 其一
1210861,投邓州节副刘光甫祖谦
851787,题毛霆甫诗集 其一
1235107,失剌斡耳朵观诈马宴奉次贡泰甫授经先生韵五首
858799,次韵酬龚深甫二首 其一
1218043,挽李山甫教授
382955,春江花月夜·交甫怜瑶佩
469269,塞上曲二首寄大中丞张肖甫 其二
371583,次韵昌甫·交游零落旧同盟
690931,清明同羽甫兄存固弟山行
876419,用厚后弟强甫韵 其二
646693,唐污甫再过
1025386,次韵曾吉甫题画屏风
86865,答方俊甫投赠·李杜坛高未易扳
184993,久雨有怀曾宏甫
1094966,昌甫斯远步过涧园小坐梅下一杯 其二
103538,次韵和原甫陪永叔景仁圣徒饮余家题庭中枯菊
1025408,李彭元携曾吉甫诗卷数帖见过
539998,存没口号十六首 其七 魏济南顺甫
629589,夏日村居次焦山郭次甫韵
1238083,送杨义甫访云林子
1048351,次韵和聂充甫冬晓初起
138755,酬次李辰甫所寄
555684,送李明甫
341776,过黄河用上介龙深甫迁居旧韵
1142330,仲实践约来访又得韶甫方君同行数日语蝉联甚慰五诗寄意甚高次韵为一笑 其四
939060,和张元德寄昌甫末章见及之韵
1136464,赠寿昌墨客叶实甫
1093233,谢昌甫茶且嘱同往来诸友饮之
524689,寄罗八廷尉质甫
482700,题郑昭甫写张骞乘槎图
355150,次皇甫子仁老杜诗韵
698532,同皇甫子循游横山二首
132170,再送黄醇甫四川制干
608591,秋日同开先正甫出郭行经郊坛
592974,九日王九德崔继甫沈恩甫见邀同吴虎臣饮八首 其三
592974,九日王九德崔继甫沈恩甫见邀同吴虎臣饮八首 其三
751736,丁丑正月赠刘恭甫即以留别
1093527,次韵昌甫 其六
1002062,谢新淦令徐信甫至赣相过
372023,寄昌甫·梅花开尽冬亦尽
389845,赠吏部张大夫助甫
158382,秋试甫期辄成短篇呈马公节裴进士光世
103550,次韵和永叔退朝马上见寄兼呈子华原甫
474251,助甫中丞为楼汝水之上颜曰绿波赋寄一首
1157279,闲居偶吟招郑庶子皇甫郎中
585973,侄沾甫送游舫于三岛谢之
1035210,水调歌头 次韵西叔詹叔兄嘉甫弟惠 生日□词
358653,挽词·甫毕荣亲愿
592973,九日王九德崔继甫沈恩甫见邀同吴虎臣饮八首 其二
592973,九日王九德崔继甫沈恩甫见邀同吴虎臣饮八首 其二
601353,春日偕李少芝山人集苏文甫宅
555278,予到官甫二阅岁顿觉老态日增因赋二绝 其二
159973,答原甫试墨见贻
1052491,次张瑞甫贪饮韵
999739,依韵和崔伯宪谢王正甫遗三灵丸蜀茶
132069,送敬甫弟赴省试
1028973,林正甫与子中春并命为御史正甫按刑浙东道别去兼旬而予衔命按视宫陵经越上获一再款语临行有诗因次其韵 其一
1028973,林正甫与子中春并命为御史正甫按刑浙东道别去兼旬而予衔命按视宫陵经越上获一再款语临行有诗因次其韵 其一
380582,杜甫诸将·经年万帐拥貔貅
806919,醉花阴  初秋刘笃甫以词招饮次韵奉酬
1094949,仲至寄蒋阜茶与昌甫且录大监赋来 其二
533908,答张助甫塞上寄怀 其二
1206887,水龙吟 用杨脩甫学士登岳阳楼韵
206339,马驹甫韵·今年小稔遍山村
161038,游东山·家如锦里先生甫
1041572,题永叔白兔同贡甫作
191934,瑞安宰刘伯协载酒游赵园叔静道甫子宜行之同
175026,送马庄甫摄幕鄱阳用赵文鼎韵
291409,如梦令·感事，和仙甫
531958,哭崔南甫二首 其一
540000,存没口号十六首 其九 张佥宪肖甫
1094153,次韵昌甫寒食 其三
995640,和李才甫先辈快阁五首 其四
357635,胡诚甫朝散挽歌辞
572137,皇甫中璋
1110990,刘平甫分惠水栀小诗为谢二首
104605,李献甫於南海魏侍郎得椰子见遗
878908,送强甫赴惠安六言十首 其一
797860,百字令 其一 留别祐甫四姊、撷芬二妹、逸青三妹
64110,赠章安甫老人
632533,贺弘甫三首 其二
305090,梦醅仲即答其见梦之作用杜甫梦李白韵
749415,次和定甫台长病起韵 其四
106470,赠寿昌墨客叶实甫
828778,云甫得莫子偲抄校本简斋集属题 其三
557199,送张肖甫奉命督租闽粤二首 其二
183989,和宣甫叔读白傅丁相诗集
879994,再韵谢张持甫过访二首 其一
1041904,独酌忆和甫
963889,次及甫入峡杂咏 十二培
583217,樊城在襄阳吉甫所筑也
1048074,与刚中适甫游惠山
868809,读王德甫文卷因送省试
1045784,和孔毅甫州名五首 其四
759846,星洲喜晤容纯甫副使，即送西行 其三
789149,西江月 即景用赵元甫韵
943164,次韵刘常甫见赠二首 其一
591923,送张助甫之湖南四首 其三
438409,和吕介甫
1213332,对雪寄范平甫二首 其一
613686,苦雨再柬羽甫兄并书所感
883145,挽李中甫使君 其四
158836,和纯甫红叶·秋园无艳色
594627,余德甫哀词二首 其一
6621,七言诗·戏改杜甫
215609,杜甫画像·吾观少陵诗
542807,送皇甫水部之荆州 其四
1102598,聂道录和王寅甫外郎雪诗因次韵仍依白战体
1036865,赵平甫幽居八操 其四 竹斋操
99701,送吕行甫司门倅河阳
1093549,二十四日昌甫斯远子功集雪观次韵斯远
1197402,泰山梁甫行
298765,读杨范甫蛰盦诗草，戏题四律
408040,题梓州杜甫草堂
974997,又次王醇甫闻人主簿二首 其一
592430,寄张肖甫时备兵天雄 其一
632687,遥哭丁善甫梁渐子
537127,况子行答吉甫参政
877779,寄夔漕王中甫
771615,题胡馨甫西泠饯别图
1092903,斯远云閒睡醉天下之至乐也约各赋一首寄昌甫 其二
348465,人日微阴与从弟慕陶从妹倩凌五寿荪并辔至黄玠甫邓子贤处不晤而返归途口占
196862,和康甫兄见寄
469268,塞上曲二首寄大中丞张肖甫 其一
1197068,梁甫吟
1235089,答方俊甫投赠二首
383805,赠王粹甫·入竹避生客
1053636,孙志甫主簿挽词 其二
592469,宝应张氏丛桂园同皇甫子循郭次甫黄淳甫赋八首 其二 三花馆
592469,宝应张氏丛桂园同皇甫子循郭次甫黄淳甫赋八首 其二 三花馆
592469,宝应张氏丛桂园同皇甫子循郭次甫黄淳甫赋八首 其二 三花馆
204466,苔钱·夷甫不言非尔类
1182938,暮春于山谷寺上方遇恩命加官赐服詶皇甫侍御见贺之作
551039,送王生之临邛省州守叔父献甫 其一
991850,王平甫惠画水卧屏
673011,一峰亭为乡同年方世元尊甫侍御作
470663,送陈献甫之云栖
316789,赠荣军王又甫
533103,张肖甫洪从周过款山房
11128,送谢夷甫宰余姚县
1094164,尹谏议秋怀昌甫以其韵赋之因亦和焉 其一
1081253,二月五日入都厅久坐候山甫不至厅前桃花一夜风雨落尽感事写怀
857324,我策我马寄王介甫 其三
880285,趣刘圣与寓王甫桂墅
1122758,答及甫和
608618,癸巳九日同焦弱侯周季平吴会甫董玄宰林咨伯庄得全六太史携酒兴德寺后池台 其一
851729,题王声甫松坡樵苦唱后
110413,赠郭功甫·雪后姑溪水更深
524795,答李川甫二首 其一
593807,闻张助甫乞归不允二首 其一
177400,题孙端甫别墅
999468,张升甫惠新笋走笔代简谢之
692065,送殷正甫内翰之京
106452,赠医士清溪居士丘通甫
729606,温甫读书城南寄示二首 其一
1129228,为郭功甫偈
59371,和刘怡溪观涨韵酬邓子高龚进甫
160060,和原甫封月招江梅不至
839934,和曹颖甫同年春草四首用王渔洋秋柳韵四首 其四
1245659,投简李仲公甫
334953,移守临川曾吉甫以诗见寄次韵答之时吉甫除闽漕未行
334953,移守临川曾吉甫以诗见寄次韵答之时吉甫除闽漕未行
21475,万年县中雨夜会宿寄皇甫甸
830442,闻易实甫比部入蜀题诗却寄
19307,对晚开夜合花赠皇甫郎中
364253,次韵王平甫直舍未开梅花
592613,霁上人裹白云茶至汲大明水试之同次甫斋中作
541713,移居宣武街庭前有奇石四各题以名维益汝脩弘甫欣然赋诗余亦各得一首 其一 立禅僧
518714,促何文甫廖敷锡限韵之作
566052,雪咏和皇甫子俊二首 其一
851294,送张宗甫兄弟楚观登舟赴湖北试
93481,宿湖甫山·夜泊湖甫山
93481,宿湖甫山·夜泊湖甫山
909643,朝中措 送管顺甫赴漕
997759,清溪解缆用秀才甫韵寄杜藏用 其一
215554,和平甫寄陈正叔
117064,宿钱睦甫南斋
156055,次韵林参议致甫以诗见索近作
206819,陈同甫抱膝斋
978920,李仁甫和予如字韵诗再用韵寄之
1046007,送皇甫秉彝殿丞
158442,谢纯甫惠笔
1133078,生日和洪山甫见赠韵
569527,德甫居太夫人忧致诗见慰悲激用壮聊成一律为答
990778,二十一日雪中赴宿怀邻几原甫
434968,刘汉臣堂甫北归
911700,耕甫弟寄示秋怀二章冗不能皆和次韵后章谩见爱助之意
772357,梅伯言、马湘帆、汤海秋、王少鹤四农部，何子贞编修，陈颂南、苏赓堂、朱伯韩三侍御，叠次召余同亨甫为觞宴之乐。九月二十六日，复集蒹葭阁；盖丙申年入都，伯言、湘帆置酒处也。诸君各以诗文见赠，余行有日，辄成七律数章酬别 其六
1080326,次曾宏甫九日韵
760381,次韵易实甫肇庆道中
944662,次韵王文甫先生二首 其一
429841,凉夜追为感逝之作得四律诗 其二 曾刚甫
568969,冯京兆先生挂冠其子咸甫赴公车言别需一言之赠
480418,次韵答亨甫
1115082,耕甫归书约信二字为别二首
198902,江上怀介甫·江上信清华
948675,陈正仲提刑制勘甫毕首过小楼既出新诗仍惠手书十扇次韵二篇致感幸之意 其一
1028689,丁未礼部贡院监门次张伯子判院韵兼简正甫判院三诗 其三
147273,寄项宜甫兼简韩右司
833757,金缕曲 其一 和石甫咏七娘子
1110937,题刘平甫定庵五咏 定庵
138996,和曾吉甫四明见寄
352883,次韵居甫·西湖弭棹曲廊腰
976220,次季弼索杨继甫诗 其一
533087,暮春张考功助甫邀游韦氏园时梁舍人思伯偕至 其九
230048,金堂涂恭甫奉其母夫人谢氏还山为赋挽诗一章
1026573,又和原甫省壁画蟹
213732,招约之职方并示正甫书记
719253,柬罗颢甫
363791,雪中过城东仰怀平甫学士
198776,秋日感事示介甫
234419,秋晚与许端甫山行
802455,申甫得蕳苏布政饯之天心阁 其二
789340,同广雅尚书于晦若沈子封王韬甫宝瑞臣朱桂卿置酒天宁寺展重九兼赠别樊按察作
306773,鹤巢小葺甫成，值戊戌初度，诸友即席题诗作画为祝
1108571,用强甫蒙仲韵十首
858859,到舒州次韵答平甫
19448,早春持斋答皇甫十见赠
551217,南还留别许灵长张叔韬冯咸甫邓泰素文梦珠柯起之诸子
372081,昌甫所寄·催景阴阳长短宵
881287,呈鄱阳赵及甫
1130880,送昌甫盖前晚独立涧上看桃花初开意思正适时见昌甫来也
1130880,送昌甫盖前晚独立涧上看桃花初开意思正适时见昌甫来也
634860,同徐圣甫夜投三桂村
409756,疏君通甫以所藏金梅僧遗画长卷属题，通甫笃于故旧，而予亦不无宿草秋风之感，遂成一律
409756,疏君通甫以所藏金梅僧遗画长卷属题，通甫笃于故旧，而予亦不无宿草秋风之感，遂成一律
144052,又次及甫渚宫
290729,秦州咏古·杜甫咏诗南郭寺
36782,杂言重送皇甫侍御曾
532913,陈忠甫以邛竹杖遗予戏作短歌
921563,送吕行甫司门倅河阳
358788,和李献甫云顶
201051,次韵酬张择甫
12349,送皇甫冉往白田
909083,用从军古云乐为韵贺杨觉甫制干 其二
372115,昌甫寒食·寒食同为异乡客
907059,和李献甫守岁
594134,问区用孺病因怀高正甫崔子玉 其二
325512,李林甫·便佞阴柔结主欢
147614,朱行甫和前韵送别烹鹿荐酒
533958,寄张肖甫中丞
975426,送叶吉甫往建康 其二
537688,答助甫吏部八首 其六
54065,繁台张昭甫给谏竹居王孙邀饮留别
570783,余生为其父德甫丈乞志墓其别也得四绝句送之中间且悲且喜或规或嘲往往情见乎辞 其二
923038,次韵和宣甫叔父迁谪过都见寄
1094366,送昌甫至十里分韵得四首 其一
749592,宿天堂墟寄徐铁孙陈仲卿尚秋湄邹云客徐子远萧榄轩陈子彝梁松甫
364575,次韵王介甫金陵怀古
600779,春日对雪简白甫
1093479,和昌甫梦中见寄
557290,赠余德甫奉使两浙四首 其三
371587,次韵昌甫闻予过仲益见寄
354872,合肥府学中赓诸公韵和正寺翔甫总翠亭
488242,题沈纯甫绿萝庄 其二
868855,魏华甫鹤山书院
513145,画玉台山图荅白沙先生陈公甫
1095753,寄秋塘陈敬甫
885166,奉陪原甫泛汝水作
130664,挽张正甫·河汾坐下旧诸生
1025954,水调歌头 坐间有伤仲至，且怀昌甫，因呈张宰
542890,杜甫墓
1134847,次韵汪翔甫和西城吕全州见过四首 其二
353831,寄卢中甫·朝米暮盐何日休
1031468,摸鱼儿 怀云崖陈乘车东甫，时游湘潭
184970,送曾宏甫守天台
416611,金缕曲 寄北京丁巽甫杨金甫仿顾梁汾寄吴季子
416611,金缕曲 寄北京丁巽甫杨金甫仿顾梁汾寄吴季子
901329,同刘贡甫学士登石鼓合江亭一首
618387,夏日同侯若朴金元甫陈居一陈集生饮陆氏山园分赋以名园依绿水野竹上青霄为韵十首 其八
214094,寄平甫弟衢州道中
787678,秋暮师竹过访偕伍硕甫舟泛西湖纪事集成 其五 岳坟醉酒
929600,送邢刍甫入闽二首 其二
338814,金缕曲·十五日江中遇雨，甫抵鄂署，忆女作
1094169,尹谏议秋怀昌甫以其韵赋之因亦和焉 其六
287627,秋怀答罗季甫
302430,和栽甫雨夜韵
176439,次郭吉甫梅仙之官广右
1025548,清明日雨中同中甫子云二兄集湖上
557331,峻伯夜过迟助甫不至各赋嘲之
992594,夜与原甫江家步归
613434,羽甫家兄招游石涧同区茂对区君玉犹子仲昭流连迨暮归途狼藉赋此纪兴
1183688,杜甫同谷茅茨
956304,赠临江简寿玉二首简携王仲显使君书来谒并示孔毅甫梦蟾图今庙堂五府皆有题字 其二
921562,走笔谢吕行甫惠子鱼
1070345,高邮旅泊书怀寄淮东提举蔡成甫观兼呈郑使君弇三首 其二
885516,次韵胡温升玉甫西野
1130872,用昌甫寄晁于潜诗韵寄之
877276,送强甫赴漳倅二首 其二
423981,八声甘州·辛稼轩水调歌头和杨济翁、破阵子为陈同甫赋及本调读李广传，皆自写肮脏，不独鹧鸪天追念少年时也。余少志颇似稼轩，辛亥以后，始一意文史。去冬谢太学归卧海上，至菽水不给，遂斥藏书，辄效稼轩体赋此
1163833,奉和皇甫大夫祈雨应时雨降
9763,朱方南郭留别皇甫冉
1155169,早春持斋荅皇甫十见赠
1007944,许昌公宇书怀呈欧阳永叔韩子华王介甫
161669,破阵子·为陈同甫赋壮词以寄
749302,题亨甫食肉叹后
1034065,行香子 永州为魏深甫寿
882695,于彝甫用许右丞别黄岩韵见寄亦用韵答之
548782,送王孝甫大理阅视延绥 其一
1093958,寄昌甫
1002602,寄王荆公介甫
1156638,酬皇甫十早春对雪见赠
1034861,嘉甫弟生日
225451,寄亨甫·晴空当昼栖暘虫
623503,蒋桢夫干夫兄弟招同刘章甫饮天宁寺
978332,题周南甫草窗吟卷后
1157801,蓝田刘明府携酌相过与皇甫郎中卯时同饮醉后赠之
219587,哭顾平甫前韵
658138,东坡雪诗善用险韵王介甫赵昌谷诸老和之皆以为不可及余因其言遂戏和之 其一
528518,夜访黄明甫
939162,昌甫前诗见简方和去未达间再于岩叟处见后诗和韵以谢
996268,答德甫弟
699508,偕王章甫陈公弼登黄鹤楼
594382,郭次甫往游玄岳过金陵见寄用韵遥答
370658,仲至寄蒋阜茶与昌甫且录大监赋来
987598,清明日约宋正甫黄行之兄弟为东湖之集
593631,送瞿睿甫同其子应甲还黄梅
1099867,别躔甫
939023,赠陈敬甫
815325,次和定甫台长病起韵
883143,挽李中甫使君 其六
796520,念奴娇 为声甫甥题“戏猫仕女图”
1090797,?花唐玉蕊花介甫谓之玚花鲁直谓之山矾武昌山中多有之其叶可供染事土人用之酿酒
367457,探芳讯·与俭才、薇客置酒朱彦甫孝廉长丰山馆
434698,送诗人李正甫
103048,送郭功甫还青山
329563,答晦甫·花往诗来报礼优
1197766,皇甫嵩歌
548786,顾实甫宫赞予告南还
509242,送刘黄门华甫起复之京
1130759,二十五日次韵昌甫别后所寄
1214782,程祥甫南山篇
583210,与彭总制幸庵侍御汪端甫正即鲍继文主政张德容同游金山寺次戴松崖大司寇韵
1039218,郡甫初夏
180054,次韵杨文甫监茶名山新建学桥
1126505,依韵和刘原甫舍人扬州五题 时会堂二首
817699,岁暮怀刘栽甫
694810,同余德甫吴明卿王元美再游张园
538941,用晦宗侯余德甫宪副寄诗贶问兼致先公挽些赋此奉酬 其一
1000216,送吴令常甫之武平
772199,元宵延陈榕士、叶松潭、郑贞甫茂才、家薇臣上舍宴赏龙灯烟火诸戏，竟为风雨所阻，不胜懊闷。漫成一律，并示诸君子
19430,冬夜对酒寄皇甫十
470325,斜塘招星甫
107595,铅山虞华甫往谢叠山枋得君直为书耕隐二字今
883877,九日偕翁与可江正甫郑景云游凤山
819841,八月乘车夜过黄河桥甫筑成明灯绵互无际洵奇观也
569023,张助甫中丞自夏州遣信问存侑以三月俸曰为米汁费报谢一章
537045,九华歌赠董山人浙甫
1093507,次韵昌甫见诒
667873,奉酬皇甫百泉雪中见过留赠之什三首 其三
857000,送介甫行畿县
613706,羽甫兄得还旧磬赋此志喜
329035,次曾宏甫九日韵
948532,太守赵山甫示和篇次韵为谢
85527,春尽夜次韵寄答实甫
496701,竹枝 其三 孙光宪、皇甫松俱有此体
195754,羁旅呈介甫
367826,寄题崇仁吴甫伯寿康堂
1129547,老融放耕图皇甫都护雁图二绝
1111215,呈张功甫
557692,赠皇甫斌
1026374,和原甫对月招江梅不至
277828,东亭览旧，寄李五星、王熙甫
187497,读张氏义庄画一寄持甫辂院
1053635,孙志甫主簿挽词 其一
293869,桂枝香·岁暮同蔼仁南田华甫夜话时山茶水仙并开去年风景犹如昨日词以写之
760252,实甫将行赋此为别 其一
1089075,皇甫坦所居
1143893,九日诗冯伯田王俊甫刘元煇杨泰之见和复次韵二首
300556,挽王丈文甫
156219,题汪日宾西楼附山甫达之
182277,和曾漕吉甫
370062,同昌甫观赵将所录庞白蘋与其诸父兄诗
434665,题终南和甫提点筠溪
689620,集古寄滕吉甫侍御
372021,寄昌甫·章丘死矣章泉老
1093093,次韵昌甫 其二
1075197,次韵魏定甫早春题咏五首 其一
683318,答助甫吏部八首
550126,庚申元夕仁常招饮灯市酒楼同王无近章甫仲田伯善年兄有赋 其六
1094874,题昌甫所录郭文诸人传后
147675,闻杜仪甫出台
752980,和王介甫阴山画虎图用元韵
533252,同潘少承陈忠甫过康裕卿访童子鸣
1216734,留宿洪洞庆云观刘山甫方丈
104831,送李献甫·览君南来诗
594027,王宪副敬美入计以病乞休张中丞肖甫与余各赋一诗兼怀长公元美
1225282,为叶敬甫赋母线石
