604959,辛酉秋日高正甫先生招同黎君玺君选集大忠祠之超然亭
593775,舍弟经季山人华甫从子及游西山还同于善果寺送别子及因怀虎臣二首 其一
954513,朝中措 送刘仲原甫出守维扬
533102,张肖甫宅饯别高右丞伯宗得杯字
922818,补和王深甫颍川西湖四篇 其一 甘棠湖
699593,挽同年李检讨成甫四首
432971,纪念杜甫二绝
533624,送张助甫之南都 其四
956967,次韵陈融甫支盐年家见赠二首 其一
180514,王应仲欲附张恭甫舟过湖南久不决今日忽闻遂
542603,报国寺同冯户曹汝言昆季饯别王太守学甫得桥字
569846,卓澄甫光禄邀汪司马及仲季诸社友大会西湖南屏选伎征声分韵赋诗伯玉以高字韵见寄俾余同作得二首 其一
992635,泊徐城寄杜挺之王平甫
1093619,报昌甫青岩之游
104240,和刘原甫省中新菊
572887,送焦弱侯老师使梁因之楚访李宏甫先生
446861,减字木兰花    贺克熙、甫珊二老评为金婚佳侣
1233574,送顾仁甫上计京师
90801,李仁甫侍讲阁学挽诗
1225437,至元二年二月八日陈子善范昭甫同游虎丘四首 其一
496710,竹枝 其十二 孙光宪、皇甫松俱有此体
615704,卢原甫与陈孺登过集 其二
313369,金缕曲·语石用实甫韵见赠一词，次韵答之
556067,同皇甫子循游横山二首 其一
802838,读杨范甫蛰盦诗草，戏题四律 其三
1080333,送曾宏甫知黄州四绝 其三
132949,寄承甫兄·不见夫君岁月过
608309,高正甫出守袁州九月九日予偕家兄暨诸亲友能文者十九人饯之毗卢阁赋诗为别 其二
80574,秋怀·改朔甫再宿
1026114,醉桃源 昌甫有曲，名之濯缨，因和
329769,廨舍之北有海棠二本惜非其地移植庭前呈晦甫同年博士
370296,昌甫回自大明见过别后二诗寄之
790923,春闱报罢答寄宜甫刺史四首 其一
1133165,和胡定甫 其二
623704,傅贞甫枉过村居有作赋答二首 其一
65473,金陵七夕赠皇甫司勋
184775,郑深道饯曾宏甫台州之行见招风雨不能度溪桥
215492,奉招吉甫·经纶无地委蓬蒿
1213181,王仲通宰公自东吴别去十载甲寅秋会于鄂渚乃知尚在七品常调中使人有郁郁遗才之叹谈论平生相对如梦历数海内诸友离合升沉之状悲欢良久有不能自已者既而仲通有欲为道隐求奉一祠之语诘难未能服俄为借骑下淮复归行馆翌日缀诗二章奉呈兼简钦甫佥司士元使君君平察推 其一
547370,灵岩禅室子冲兴甫夜饮大醉
857016,寄介甫
488770,喜杨道行徵会濮上呈李伯承穆敬甫陈翼甫
488770,喜杨道行徵会濮上呈李伯承穆敬甫陈翼甫
140010,次韵谯仲甫致闻南迁见寄
1222967,昌上人游京师欲言禅林弊事甫入国门若使之去者昌余里人幼岁留吴东郡遗老及颖秀自异者多处其地以予所识闻若承天了天平恩穹窿林开元茂皆可依止遂各一诗以问讯虎丘永从游尤久闻其谢世末为一章以悼六首 其六
851786,题毛霆甫诗集 其三
133849,介甫作巫山高命光属和勉率成篇真不知量
694843,白伯伦仪部移居夜阶助甫司封访之席上赋得卜居赤甲迁居新两见巫山楚水春十四韵
561045,常甫宪副钦之翰检与予先后登岳钦之独值雨是日予与常甫坐候云开堂因赋二章 其二
561045,常甫宪副钦之翰检与予先后登岳钦之独值雨是日予与常甫坐候云开堂因赋二章 其二
1166602,送皇甫龄宰交河
817617,七夕园坐归途同栽甫
306252,次韵答实甫
533632,郭次甫移寓姚元白馆过讯
39373,泰山梁甫行
686765,送沈仁甫归省二章
592504,寄朱灌甫宗尉
1042785,别王深甫
1185806,题皇甫荀蓝田厅
1005681,暮春山居呈山甫正仲
1155095,出斋日喜皇甫十早访
158579,送张升甫三十韵
557370,席上酬助甫
984085,十三日饮俞园昌甫斯远彦章毕至
351286,月夜吴春卿苏仪甫相过会饮忽闻五鼓遂同入朝
986626,过林忠甫山房
530420,戏效汪京兆西湖六首为孙道甫书于湖之南屏山居 其五 解和
147680,王和甫主簿卜地改葬双亲一夕梦到一处风水佳
175023,送庞佑甫·燕鸿望南飞
184975,贺曾裘甫得解
999575,月夜与陈行父杨公济吴常甫出诣蔡子难
1093503,昌甫自衢送客入城得其诗次韵呈之 其一
326821,刘平甫分惠水栀小诗为谢
573421,赵御史贞甫
1237222,对雪寄范平甫二首
480408,三月十八日与亨甫归自城西并玉河而北见宫树参差山日隐映时已薄暮无人声独二骑云
1246483,苕溪皇甫秀才幽居 其一
559704,次韵性甫诞日与吴彭年会饮阊门
372157,昌甫约过施仲益
613705,慰羽甫家兄失磬拈得四支韵
62545,答同年李仁甫寄点苍山石
889218,和曾吉甫寄韵呈李相之二首 其一
384573,与逵甫燕坐小斋为写竹石
1001512,比以形字韵诗递送张功甫直阁未报复于本韵中思之别得一篇并写呈
487868,仝赵献武林洁甫饮仲仁宅
362420,过高邮饮张才甫家作诗为别
1075199,次韵魏定甫早春题咏五首 其三
533617,钟户曹邀游郑园同肖甫作
556984,同峻伯夜过助甫得钟箫二字
533373,同邬汝翼黄清甫陈崇训汪公干李季常过焦山访郭次甫
533373,同邬汝翼黄清甫陈崇训汪公干李季常过焦山访郭次甫
1108471,送山甫赴岭口仓五言二首
1078263,秋日奉陪王丰甫许子大康平仲游贤沙宿凤池登升山偶成二首 其一
978742,别郭安道卢能甫
995642,和李才甫先辈快阁五首 其二
167449,中秋同陈奎甫放舟
950525,满江红 甫敬赋满江红，敬祝百千遐算，甫再拜
950525,满江红 甫敬赋满江红，敬祝百千遐算，甫再拜
1096382,过周骧甫勉其教子 其二
381333,日本漫画者安田雅甫求书·
569712,张肖甫司马特膺简命督抚全浙赋此赠之得二首 其一
668287,冬日杨仪部宅宴集会耆朱性甫朱尧民祝希哲邢丽文陈道复及余六人分韵得酒字
859057,寄王回深甫
1041207,二十六日大风寄贡甫
107026,过汪翔甫宅
488103,同邬汝翼冯咸甫显甫姜元从集于邬先南楼
488103,同邬汝翼冯咸甫显甫姜元从集于邬先南楼
206139,饮桂香茶简翁及甫
992336,依韵和原甫厅壁钱谏议画蟹
1137378,次韵王寅甫
699255,次韵陈敬初陪贡泰甫待制降香娄上
975066,劝醇甫酒
802238,人日微阴与从弟慕陶从妹倩凌五寿荪并辔至黄玠甫邓子贤处不晤而返归途口占 其一
1095825,老融放耕图皇甫都护雁图二绝 其二
557092,白伯伦仪部移居夜阶助甫司封访之席上赋得卜居赤甲迁居新两见巫山楚水春十四韵 其一
147447,客中岁晚呈何宏甫
454161,夜读《杜甫诗选》偶成
886915,八声甘州 其一 寿徐信甫母夫人七秩
1061595,御试宿集英殿雨过有作呈敏甫学士
688712,山行赠仁甫
104661,十七日和原甫风花偶书
55405,送衲公之彭门兼寄实甫
477981,赠华子中甫
882872,挽李中甫使君 其一
335641,和平甫寄介甫羡会稽之行
335641,和平甫寄介甫羡会稽之行
941681,赠丝桐墨蕙吕能甫淮东制阃之客
760251,次王雪澄赠实甫韵 其三
1109349,次韵和原甫登禅智寺上方院二首
592744,怀张助甫
542388,秋夜同吴方伯子有孟廉宪存甫冯大参汝言周学宪子才游东寺
329254,次韵曾宏甫木犀
435883,刘光甫内乡新居
857989,玉蝴蝶 和梁才甫游园作
1068187,用元亮韵寄驹甫
608840,送沈仁甫逸人游蓟门
113411,郭明甫作西斋于颍尾请予赋诗
866552,送张仁甫见何少卿续郎中二首 其一
44077,振甫追和秋怀韵再叠酬之
1089701,用韵酬侯居甫
1027288,题汪宏甫三马图
339743,和曹演甫中秋见怀
158141,送李山甫赴熙州
438417,李平甫为裕之画系舟山图閒閒公有诗某亦继作
750219,笈甫藏有袁候台瓦研属作长歌纪之
951851,送别湖北漕李秘监仁甫
555197,同昭武刘太守仁甫游西庵二首 其一
215247,中秋夕寄平甫诸弟
150397,赋婺州之录参厅明远楼为李中甫董奇卿作也
122820,次韵陈融甫支盐年家见赠
1077913,华容西二十许里有墨山即离骚所谓玄石也山有大云寺寺有云母泉甘芳洁清大旱不竭唐李华有诗序之甚详其末云华贬杭州司公恩复左补阙次于岳阳江山延望思与高贤共饮云母之泉躬耕墨山之下敢违朝命以询私欲秋风露寒洞庭微波一闻猿声不觉涕下况支离多病年甫始衰愿饵药扶寿以究无生之学事乖志负火爇余心三复其言而悲之因次其韵
447077,苍溪吟草  其四 杜甫放船石
998765,读韩诗有感用介甫体
966077,和曾漕吉甫
1215613,三华吴宜甫桃溪十咏 其八 纳稼亩
1094367,送昌甫至十里分韵得四首 其二
1090670,和林正甫碾茶 其二
684027,寄顾山甫
570193,和肖甫司马题旸德大参东园五言绝句十首 其十 通华径
600359,赠年家子李说甫
556955,同余德甫吴明卿王元美再游张园 其四
488623,秋夜集王汝存宅同赵仁甫作
791921,集杜挽郑荐甫
155907,读韩诗有感用介甫体
1242444,和吴升甫见寄韵二首 其一
1088319,题刘平甫定庵五咏 其三 山台
768863,同褚子方、刘小墅、范桐轩、高龚甫游卧龙山，登望海亭
1026643,次韵和原甫游会灵观
533276,同梁公智过灵济道院访陈忠甫
802449,汪衮甫荣宝来湘查考咨议局谭组安冯星槎曾孳元三咨议宴之天心阁同座有胡子靖监督杨皙子京卿即席口号送衮甫还京兼奉同席诸君子 其一
802449,汪衮甫荣宝来湘查考咨议局谭组安冯星槎曾孳元三咨议宴之天心阁同座有胡子靖监督杨皙子京卿即席口号送衮甫还京兼奉同席诸君子 其一
204050,送黄同年京甫必昌赴广西提干
62619,仲春廿日发瓜渚同顾使君益卿赴闽粤郭次甫吴
695895,雪中同华甫发南浦酬用晦
85727,送实甫游罗浮
225360,崔佑甫·道德驰声满建中
534200,送王仪甫之蓬莱县 其二
344860,詶届甫见投作
537881,张参议肖甫由广西入贺得书有寄
593382,答黄清甫因讯谈世重
541714,移居宣武街庭前有奇石四各题以名维益汝脩弘甫欣然赋诗余亦各得一首 其二 二华峰
878896,送明甫赴铜铅场六言七首 其四
1048770,和潘倅通甫游狼山寺三首 其二
1028690,丁未礼部贡院监门次张伯子判院韵兼简正甫判院三诗 其二
16616,洛阳城外别皇甫湜
166519,南山送客席上次明甫韵
632534,贺弘甫三首 其三
683504,答德甫用晦追和感事之作
1052018,皇甫乞诗为赠因次其韵
195553,史昭甫招陈宗鲁之长兴
594468,元夕同周稚尊陆伯生吴公择臧晋叔陶懋中诸君集西宁侯宋忠甫宅得先字
256586,洞仙歌·汴梁与许道真郭伯诚刘光甫同赋
665152,送郑谐甫
446067,耒阳吊杜甫墓
879993,再韵谢张持甫过访二首 其二
538417,立春日诗呈王新甫先是新甫梦与予分韵得香字
538417,立春日诗呈王新甫先是新甫梦与予分韵得香字
939014,傅材甫窗前白月桂开材甫索诗戏作 其二
939014,傅材甫窗前白月桂开材甫索诗戏作 其二
812432,三月二十六日与共甫偕吴门吴憩堂游云栖，翌晨步江干转至虎跑寺，由湖上棹归
369959,昌甫诗·佳辰人物本难俱
203361,慰吴吉甫县尉
187307,送同窗赵章甫上舍入京
578661,杜甫游春
3750,别皇甫五
509502,佥都御史吴公舆璧巡抚广东甫一月朝廷以两广事不归一仍命予总督两广军务兼理巡抚舆璧得代回途次会别书此寓期望意
845337,和郑润甫提举见寄 其二
371581,次韵昌甫·既贫且病是今年
1222962,昌上人游京师欲言禅林弊事甫入国门若使之去者昌余里人幼岁留吴东郡遗老及颖秀自异者多处其地以予所识闻若承天了天平恩穹窿林开元茂皆可依止遂各一诗以问讯虎丘永从游尤久闻其谢世末为一章以悼六首 其一
908165,送李仁甫运判赴召三首 其二
157700,春深赠山甫
830345,次韵答实甫
936835,寄赵昌甫
115126,甫卢泉水·卢泉之木百尺长
1131486,和林正甫韵
114469,答李康文·才甫经年断来往
572920,夏日冯明甫郡公招游谢公岩同顾朗哉处士于野宗侯剧饮分韵得千字
1089762,王宣甫以新妇鱼能斗为胜负鱼有诗释其讹谬次韵戏答
952556,挽新昌王明府吉甫
963777,答程及甫徐少望
453679,长沙杜甫江阁
452863,戊子正月廿八日尹氏园中赏梅用同甫韵
83844,初春书怀·甫及初春日已长
696078,送别傅贞甫纯甫二首
696078,送别傅贞甫纯甫二首
1111911,酬次李辰甫所寄三首
1172008,元日无衣冠入朝寄皇甫拾遗冉从弟补阙纾
138343,和曾吉甫寄韵呈李相之
1133164,和胡定甫 其一
1155922,对晚开夜合花赠皇甫郎中
84053,残春·章甫从诸老
206338,题罗源驿用马驹甫韵
816597,赵芷孙侍御启霖别久矣罢官里居忽奉四川提学之命到会垣视余言陆君申甫忧余疾情殊挚口占赠赵兼柬申甫
816597,赵芷孙侍御启霖别久矣罢官里居忽奉四川提学之命到会垣视余言陆君申甫忧余疾情殊挚口占赠赵兼柬申甫
787548,寿龚甫三十
946687,送李明甫召除奉常簿
204006,简南剑倅赵用甫以夫同年
1094084,次韵昌甫 其八
1136550,送升甫归九江 其一
371677,昌甫分寄瓢泉继而辛卿遗一壶来以诗为谢
562066,送户部尚书贡泰甫开司闽中榷盐易米给京师 其一
602962,送盛泰甫还无锡
343034,和苏正甫劝饮之作
1046624,病起次和何温甫秘丞雪琬中见寄
1005695,题汪日宾西楼附山甫达之
1026037,浣溪沙 其三 次韵昌甫
189455,徐山甫夜话有诗言别次韵
1041389,风雨寄贡甫
1091426,以蛮菩提数珠送王嘉甫
613516,羽甫家兄池上白鹇歌
657061,唐曲江公张九龄志徐孺子碣陈献章公甫题宪副夏寅正夫邀伦同和宪使陈炜文曜刻石东湖亭上聘君子季登及陈蕃礼宜侑享故及 其一
372177,喻伯经推官约施翔甫父子载酒涧上
174893,重九日中甫子云二兄会别龙山
173143,和平甫·八节滩头老醉吟
483036,用贡泰甫尚书韵别吴君济掾史
572231,秋日集江进之王以明方子公王章甫小修饮崇国寺
120266,答毛叔子·章甫不价越
122527,秋日得王介甫书
424100,雨中花慢·哭达甫
220324,简申甫求画
214195,平甫归饮·无田士相吊
946401,悼杨休甫
897991,送胡考甫
652362,同赵汝迈漆中甫二太史宿张明成司业东郊别墅分赋四章 其二
594479,送宋西宁忠甫入都
856615,朝中措 其七 魏倅定甫生日
592266,王仪甫索题黎惟敬画
745717,清江怀松甫先生
11850,同皇甫侍御题惟一上人房
305252,玉甫招集江亭作展上巳未至分均得初字
1041080,一月赠深甫
996576,戏赠张叔甫
834185,满江红 兆儿生甫九十日，遽殇金竹寓中，口占此阕，以当一哭
977672,崔祐甫
199776,寄李仁甫·守地难越境
1222295,和吴行甫雨雹韵 其一
389630,莫愁湖赠刘瞻甫
1034183,送侯居甫监军器所门
532631,杨参仁甫招至东麓亭上
825863,寄汪衮甫
541282,李敬可刘和甫访予石洞敬可赠诗有卜邻之意赋此奉答
138201,和刘原甫平山堂见寄
670480,罗山甫自晋徂齐见困盐官暂诣京师㩦家南还遂有此赠
1213174,良月九日夜与吉甫提举宿王氏精舍风雨不寐闻寄令弟潜夫同知佳章骨肉之情蔼然具见令人讽诵不已别后次韵写怀
1182936,答皇甫十六侍御北归留别作
86002,用厚后弟强甫韵·了无杰句似平庵
344984,贾庆甫以局事乘小船犯风波感其危而为诗
61107,吹台上送李柬还关中兼寄李素甫孝廉
984623,和庞次甫秋日海棠二首 其一
364330,省中寄王平甫
602481,梁思立谭永明梁公益偕宗弟忠甫出饯林氏水楼赋别得中字
1108740,用厚后弟强甫韵
1052019,合肥府学中赓诸公韵和正寺翔甫总翠亭
1110171,和礼部孔经甫斋宫三首
298611,巢经巢观李少温篆书元次山浯溪铭拓本用皇甫持正题浯溪石韵
488193,别林及甫 其一
214105,寄茶与平甫
180443,送吕义甫·河伯矜秋浸
799729,九月八日病起有怀宋既庭计甫草因忆亡友侯研德宋畴三丁绣夫
370501,和昌甫·水南上郭荒凉甚
1088318,题刘平甫定庵五咏 其二 巢云
355050,次张瑞甫贪饮韵
542314,夏夜邹参政君哲宅陪饯皇甫别驾得才字
325771,倦寻芳·次韵黄韵甫大令春日过竹素园
19141,和皇甫郎中秋晓同登天宫阁言怀六韵
992273,饮刘原甫家原甫怀二古钱劝酒其一齐之大刀长五寸半其一王莽时金错刀长二寸半
992273,饮刘原甫家原甫怀二古钱劝酒其一齐之大刀长五寸半其一王莽时金错刀长二寸半
468065,丙戌人日书感二首，遵中镇诗社约用蔡襄韵，时余甫返蓉定居，距二十二岁出川，三十八年矣
215565,和甫如京师微之置酒
997620,虞美人 其一 至当涂呈郭功甫
1094898,次韵昌甫所题唐宋诸贤画像石刻 其四
1065548,次韵李全甫惠荼蘼五首 其二
89551,挽王华甫提刑·丱角从诸老
233613,与太常丞丁晦甫
362761,将至芜湖忆文子容甫
542447,过杨子畏别业登楼同田深甫醉赋
353482,王宣甫以灯夕入城而予偶无佳思阻同游有诗为寒食之约次韵奉酬
975160,再送黄醇甫四川制干二首 其一
594236,送倪公甫渡河访朱子得
371665,昌甫约诸人茶山病不能往次韵其所赋
19063,哭皇甫七郎中
569691,甫尔逍遥偶得陆司空与绳数行坐客因举吴门诗语一笑赋此
130856,代赵信甫千人助冬衣
1044741,七言景德寺考试院壁和王介甫所题诗二首 其二
556764,春日姚园同德甫明卿元美燕集分赋下字
11049,宿城南盛本道怀皇甫冉
837431,贺陈小豪县长尊甫芳园封翁八十一寿
331719,春晚柬届甫寅仲
992509,和原甫会灵宴集之什
948300,走笔次李仁甫夜直观月韵二首 其一
591921,送张助甫之湖南四首 其一
371801,马庄甫经过留五字次韵
593663,忆新安旧游寄何少愚李功甫汪禹乂郑鲁文金上甫
593663,忆新安旧游寄何少愚李功甫汪禹乂郑鲁文金上甫
742351,古意寄汤吉甫
1127643,送戚弼甫解官盐场二首
920336,夜直秘阁呈王敏甫
794566,踏莎行 季萍妹归桐川后，别已五年，今秋始得聚首，甫及两月又将遄返，作此送之
797664,贺新郎 贺莲甫十六舅氏就婚浦口
372946,送吴仪甫之合淝谒杜帅
383103,携陈山人东甫饮黄石山顶
85424,题易实甫所藏张梦晋岁寒三友图实甫自言张后身也
85424,题易实甫所藏张梦晋岁寒三友图实甫自言张后身也
802453,赵芷孙侍御启霖别久矣罢官里居忽奉四川提学之命到会垣视余言陆君申甫忧余疾情殊挚口占赠赵兼柬申甫 其二
802453,赵芷孙侍御启霖别久矣罢官里居忽奉四川提学之命到会垣视余言陆君申甫忧余疾情殊挚口占赠赵兼柬申甫 其二
1041563,题深甫所种树
538060,寄肖甫 其二
355800,高邮旅泊书怀寄淮东提举蔡成甫观兼呈郑使君弇
875587,送明甫初筮十首 其六
592838,答张见甫载酒十里出饯汝河
811186,星洲喜晤容纯甫副使，即送西行
829924,浣溪纱 次介甫韵
613839,过羽甫兄旧馆 其二
158818,张升甫惠新笋走笔代简谢之
1134946,次韵酬郝润甫二首 其二
945365,挽张正甫二首 其二
592991,送王侍御纯甫量移内江令六首 其一
267843,定风波·寿钱新甫七十
1031193,宋君辅许当世陈彦谦苏宣甫自远还乡上元同饮
866682,绍兴六年十月六日同信可舜弼进道谒隐甫值渠晒画于中庭遂得纵观中间不无可人意独范宽雪山八幅超然绝群令人意象肃如真得脱身归岩壑间者请赋诗以知君重毫素为韵得君字
963811,镜月酒后戏呈及甫
963206,次及甫入峡杂咏 钓鱼石翁
570475,庄临甫力田种竹有长者风今六十矣其婿陈生懋谦中表侄也索诗寿之得一绝句
136167,定斋为杨和甫赋
1005576,贻山甫
542182,送赵少尹文甫之华阴
353614,次韵酬王宣甫
643660,过甫里祠
670934,送殷正甫内翰之京 其二
838610,上易观察实甫 其一
785848,立秋日访易实甫顺鼎遂偕游秦淮和实甫作
785848,立秋日访易实甫顺鼎遂偕游秦淮和实甫作
552075,己未五月抵舍甫浃旬而北辕又发矣浪迹萍踪可胜惆怅因成一律以志感尤以道区区将母之私云
19245,蓝田刘明府携酌相过与皇甫郎中卯时同饮醉后赠之
174744,次韵沈驹甫观石井
370648,梨花蚁蝶图昌甫伯皋约同赋
1153794,同兵部李纾侍郎刑部包佶侍郎哭皇甫侍御曾
566057,腊月十五立春和皇甫子约二首 其二
656815,送白沙先生陈公甫
230272,陈东甫酒閒举作归心只有杜鹃知之句犹未成篇
414836,秋怀答罗季甫
1065574,次韵萧昭甫同游江东四绝句 其一 宝云寺
178618,李广甫挽词
858498,寄茶与平甫
237374,送文甫兄归番阳
199207,发松门寄介甫
1002717,江上怀介甫
104242,和刘原甫白鹦鹉
877109,送方文甫判官
1094125,次韵昌甫
614963,宋惟四招同胡虞卿陈治甫曾文卿暨家仲游禺峡新辟诸胜因酌清音楼
817607,三月三十日与栽甫过崇效寺看牡丹多已披谢 其四
104798,送张殿丞吉甫知资阳
859422,和平甫舟中望九华山二首 其一
550459,王震甫以王叔明山水见贻答谢
342187,小雨同裴弟深甫坚上人登新亭次韵
652376,问巍甫侄疾
475174,和皇甫子循送兄赴浙中
539996,存没口号十六首 其五 俞宪使德甫
1146755,酬皇甫冉将赴无锡于云门寺赠别
1045814,和思道招晦甫
828166,秋日同愔仲剑丞病山彊村勉甫游西溪访交芦庵秋雪庵遇雨归作西溪泛雨图题四绝句 其一
62883,青溪水亭迟叶五循甫
602857,陆山人华甫见过山房二首 其一
52667,褫亭闻边事用壁间李川甫韵川甫大梁人
52667,褫亭闻边事用壁间李川甫韵川甫大梁人
142365,送张仲甫赴酒杯参议
206869,赠夏肯甫·自识贤尊熟
571003,题墨兰寄恽宪副公甫先生 其一
859082,寄黄吉甫
728483,贺新郎  用辛稼轩陈同甫倡和原韵送王正子之襄阳明春归广陵并嘱示何生龙若
488733,秋夜同屠子卿朱汝脩集宋忠甫邸第分得含字
831737,题邱大达甫鸳鸯湖草堂 其一
196462,赠朱仁甫·吾宗贤叔父
1240962,适耕堂为吴琴汪寿甫扁而赋之
575226,山中看梅简如山襄甫 其三
238102,登横碧轩继赵昌甫作
604668,寄海阳广文顾靖甫
129868,书楼考甫梅花百咏因徐直孺寄考甫
129868,书楼考甫梅花百咏因徐直孺寄考甫
1106021,次韵和梁才甫上元诗二首
572590,王章甫送余石头口因共游赤壁章甫将归读书九峰山 其一
572590,王章甫送余石头口因共游赤壁章甫将归读书九峰山 其一
542629,送李侍御源甫奉使云中诸镇
342852,庆甫借棋子
670223,郡斋送张肖甫 其一
1042832,寄王深甫
1094897,次韵昌甫所题唐宋诸贤画像石刻 其三
566053,雪咏和皇甫子俊二首 其二
288841,游宾川东西平、子厚、秀山、小泉、寄甫、二南诸友
608238,送何平甫同年宰嘉兴 其二
473558,中甫过斋中烹茗清谈试笔写图因题其上三首 其三
537418,春日同子与顺甫游姚园分韵四首 其一
1166555,奉寄皇甫补阙
240610,赵成甫招饭次默夫韵
19451,酬皇甫十早春对雪见赠
561687,再赠贞夫时甫迁官秩遽有左官之命
105875,次韵酬郝润甫·幸君三复甫田诗
105875,次韵酬郝润甫·幸君三复甫田诗
567666,北上别丁肖甫于虎丘
539836,寄张肖甫
885173,送刘正甫赴南徐幕府
747137,追悼张亨甫孝廉即题其娄光堂稿后
338371,夜半泊邵伯驿访龚甫
745595,皖江送石甫北上
1210574,挽贡正甫经历
652364,同赵汝迈漆中甫二太史宿张明成司业东郊别墅分赋四章 其四
99288,孔毅甫以诗戒饮酒问
1130906,仲至寄蒋阜茶与昌甫且录大监赋来
211241,观孔义甫与谢致仕诗有感
222479,徐敬甫出示所居之别南岩图并圹公题咏欲予同
575160,闻周用仁言襄甫作诗遣疟诗以问之谓东庐
601229,咏柳戏赠任文甫
991960,刘原甫观相国寺净土杨惠之塑像吴道子画又越僧鼓琴闽僧写真予解其诧
791282,丁亥重九后二日贺讷甫弟入泮
539921,寄张广平助甫六首 其四
525124,赠苏州教授钱宏甫二首 其一
1228271,赵汝甫枯木竹石卷
1111280,答云甫程文
992767,送王平甫拟离骚
510360,阅周溪图作赠刘景林归呈尊甫翁肃庵程乡令 其一
623500,入宣化周穆卿讯傅贞甫并其尊公消息
1094896,次韵昌甫所题唐宋诸贤画像石刻 其二
1000205,将别纯甫四十字奉呈
6171,送皇甫龄宰交河
837801,浪淘沙·哭葛蕙生，次马谏甫韵
77357,阿通自闽中归甫九岁颇有老成之风作此诗示之
544816,闻张助甫擢宁夏中丞喜而有作四首 其四
557091,腊月十七夜月同峻伯助甫席上赋 其四 得去字
593157,雪中同华甫发南浦酬用晦 其二
207149,送周明叔王成叟并上昌甫仲止二兄
161405,送相士管明甫
986638,和文本公先生赠许端甫
487974,紫阳道中逢余珍甫
438858,送李嘉甫信都令耘甫之弟
438858,送李嘉甫信都令耘甫之弟
372019,寄昌甫斯远
990920,次韵和永叔退朝马上见寄兼呈子华原甫
1125575,赠郭功甫二绝
1055841,次韵孔经甫题剡县史氏竞秀堂
524670,同金曼甫饮儿屿呈诗乃和之 其二
1041210,春旱天多风赠深甫
133205,谢王主簿·夷甫风姿满坐头
533315,尚雅斋为佳甫作
912274,同岳大用甫抚干雪后游西湖早饭显明寺步至四圣观访林和靖故居观鹤听琴得四绝句时去除夕二日 其一
1089183,闻德远与曾裘甫黎师侯会饮范周士所 其一
580178,丙午岁正月七日李大参德馨邀余偕宪副冯佩之佥宪庄仪甫为同年会燕于滕王阁相与联句四首 其二
872531,题云锦刘从甫水竹云山亭
979095,次韵阎仲甫郎中病起二首 其一
975237,次韵承甫兄重阳
1093104,次韵昌甫所寄因答施仲益且寄斯远 其二
608237,送何平甫同年宰嘉兴 其一
258137,郝吉甫蜗室
