285464,袁浦同兰孙、绮秋买舟还江南
693,饯陈学士还江南同用征字
1065153,送肇上人还江南省阿尚
298902,送钱子璧还江南
1064796,石头庵主居南岳仅三十年忽思还江南龙安作此寄之三首 其二
1130237,石头庵主居南岳仅三十年忽思还江南龙安作此寄之三首
1216393,自高邮买舟还江南至常州值雨寄鲁元达
606973,送林桢灿别驾督运事竣还江南
1225693,送刘提举还江南
1224868,送潘泽民还江南诗
992831,送吴照邻都官还江南
1165064,饯陈学士还江南同用徵字
1064797,石头庵主居南岳仅三十年忽思还江南龙安作此寄之三首 其三
859331,舟还江南阻风有怀伯兄
735603,送侯大年还江南
608860,送慧上人还江南兼寄陆伯生文学
378708,石头庵主居南岳仅三十年忽思还江南龙安作此寄之
594013,送谈思永下第还江南
735546,送钱子璧还江南
1232152,三凤行赠海东之还江南
1038483,送吴照邻都官还江南
1064795,石头庵主居南岳仅三十年忽思还江南龙安作此寄之三首 其一
213886,舟还江南阻风有怀伯兄
662432,送苏指挥解职还江南
680624,寓徐州送友人还江南
557042,送人还江南
104788,送吴照邻都官还江南
137975,送吴照邻还江南
