1155950,因梦得酬牛相公初到洛中小饮见赠
1156086,初致仕后戏酬留守牛相公并呈分司诸寮友
14965,牛相公林亭雨后偶成
14843,和牛相公南溪醉歌见寄
1159982,和牛相公题姑苏所寄太湖石兼寄李苏州
1159709,和仆射牛相公以离阙庭七年班行亲故亡殁十无一人再睹龙颜喜庆虽极感叹风烛能不怆然因成四韵并示集贤中书二相公所和
1159636,牛相公留守见示城外新墅有溪竹秋月亲情多往宿游恨不得去因成四韵兼简洛中亲故之什兼命同作
1159714,和仆射牛相公寓言二首 其二
19585,题牛相公归仁里宅新成小滩
1160183,詶留守牛相公宫城早秋寓言见寄
15129,酬淮南牛相公述旧见贻
1159716,和牛相公游南庄醉后寓言戏赠乐天兼见示
19675,初致仕后戏酬留守牛相公并呈分司诸寮友
15130,和仆射牛相公见示长句
1156453,偶于维扬牛相公处觅得筝筝未到先寄诗来走笔戏荅
1160072,和牛相公溪醉歌见寄
1174225,寄牛相公
1159715,和牛相公雨后寓怀见示
19204,洛下送牛相公出镇淮南
15133,和仆射牛相公寓言
23304,寄牛相公
19396,奉酬淮南牛相公思黯见寄二十四韵
1159711,和仆射牛相公春日闲坐见怀
1159915,詶淮南牛相公述旧见贻
1160180,詶牛相公独饮偶醉寓言见示
15177,牛相公见示新什谨依本韵次用以抒下情
19379,宿香山寺酬广陵牛相公见寄
1159597,酬仆射牛相公晋国池上别后至甘棠馆忽梦同游因成口号见寄
1159710,和仆射牛相公见示长句
1156840,奉酬淮南牛相公思黯见寄二十四韵
19393,偶于维扬牛相公处觅得筝筝未到先寄诗来走笔戏答
18665,求分司东都寄牛相公十韵
1156861,洛下送牛相公出镇淮南
15107,和牛相公游南庄醉后寓言戏赠乐天兼见示
15131,和牛相公雨后寓怀见示
1159975,牛相公见示新什谨依本韵次用以抒下情
1156644,酬寄牛相公同宿话旧劝酒见赠
1194055,和仆射牛相公寓言二首
19423,因梦得酬牛相公初到洛中小饮见赠
1160020,牛相公林亭雨后偶成
15185,和牛相公题姑苏所寄太湖石兼寄李苏州
1156476,宿香山寺酬广陵牛相公见寄
19193,酬牛相公宫城早秋寓言见示兼呈梦得
1159713,和仆射牛相公寓言二首 其一
19681,酬寄牛相公同宿话旧劝酒见赠
15111,和仆射牛相公春日闲坐见怀
1157807,酬牛相公宫城早秋寓言见示兼呈梦得
14790,酬留守牛相公宫城早秋寓言见寄
1156812,求分司东都寄牛相公十韵
1159712,和仆射牛相公追感韦裴六相登庸皆四十馀未五十薨殁岂早荣枯之义今年将六十犹粗强健因亲故劝酒率然成篇并见寄之作
14784,酬牛相公独饮偶醉寓言见示
388400,和仆射牛相公寓言·心如止水鉴常明
1157831,题牛相公归仁里宅新成小滩
