387139,浪淘沙·燕九日宿板桥，用甲申旧韵成解
874535,丁酉重九日宿顺昌步云阁绝句七首呈味道明府 其四
924361,三日上辛祈谷除日宿斋户部右曹元日赋三绝句寄呈子瞻兄 其一
808177,凄凉犯 庚子十二月二十四日，宿济南敖阳店，寒甚，有怀故园节物，凄然作此解
92027,人日宿味田驿·破驿荒凉晚解鞍
321907,十月四日宿于沙市舟中捲
616602,九日宿丞相峰
1116516,是日宿水陆寺，寄北山清顺僧二首
322537,秋日宿武连驿怀船山
206137,至日宿蓝田驿感旧
874536,丁酉重九日宿顺昌步云阁绝句七首呈味道明府 其五
313987,贺新郎·别文梁、洛闻之明日，宿江堰镇却寄
134197,同次道元日宿尚书省听誓戒寄州邵不疑
752727,九日王胡镇与阎成叔别越日宿祁县奉寄
370975,凄凉犯·庚子十二月二十四日，宿济南敖阳店，寒甚，有怀故园节物，凄然作此解
748341,三月四日宿朝天关
874534,丁酉重九日宿顺昌步云阁绝句七首呈味道明府 其三
915152,正月三日宿范氏庄四首 其四
168944,八月十日宿百丈山庆善院明日游松风庵谒震禅
606628,长至日宿河间客舍
1093937,二十三日宿舒料院家因以寄料院
190374,七夕日宿长江
833244,踏莎行 三月初五日宿彭善村，夜雨寒甚，晓起雪积寸许，因赋
914200,至日宿蓝坑小民居竹柱荻壁壁皆不土
699524,仲春十八日宿上天竺
936801,乾道初予自临川归钟陵李德远范周士送别于西津是日宿战平风雨终夕今自临川之高安复以雨中宿战平怅然感怀二首 其二
384820,甲寅二月廿一日宿常熟城外
1066235,乙巳八月二十九日宿内府梦过村落循溪而行问路旁人家此云何曰士村也涉溪入山崦谓同行曰此可赋诗因得鸠燕二句既觉足之以为异日之观
617002,二十七日宿护城驲饮主家吴名扬
371511,二十三日宿舒料院家因以寄料院
571771,仲春十八日宿上天竺 其二
1149561,三月二十四日宿曾峰馆夜对桐花寄乐天
214332,夏日宿西禅院
1228121,十六日宿芜湖县
711339,秋日宿僧舍
595290,秋日宿玉岩寺
86590,丁酉重九日宿顺昌步云阁绝句
639285,甲寅二月廿一日宿常熟城外
947799,庚辛二月二十二日宿斋省中
178791,五月二十四日宿永睦将口香积院僧轩东望甚远
489221,三月十一日宿天宁寺
783187,出山海关是日宿叶家坟 其一
94889,至日宿蓝坑小民居竹柱荻壁壁皆不土
99836,是日宿水陆寺寄北山清顺僧
353485,寒食日宿芜湖县廨
833489,浪淘沙 燕九日宿板桥，用甲申旧韵成解
703235,丁酉生日宿沈阳南塔寺
327309,十一月二十六日宿萍乡西三十馀里黄花渡口客舍稍明洁有宋亨伯题诗亦颇不俗因录而和之
571770,仲春十八日宿上天竺 其一
62466,九日宿院
372781,次韵和都运崔谏议寄示立春前一日宿岚谷山程
380750,月下笛·戊戌八月十三日宿王禦史宅，夜雨闻邻笛感音而作和石帚
117949,三日上辛祈谷除日宿斋户部右曹元日赋三绝句
512089,九月十日宿下关驿书怀
952212,重九前一日宿灵岩
166490,夏日宿广教寺风月清甚思李白敬亭诗有怀有似
869875,三月十五日宿魏云夫山庄
1161881,酬崔舍人阁老冬至日宿直省中奉简两掖阁老并见示
13612,酬崔舍人阁老冬至日宿直省中奉简两掖阁老并见示
633514,丁酉生日宿沈阳南塔寺 其二
277035,九月二十八日宿山海关
874537,丁酉重九日宿顺昌步云阁绝句七首呈味道明府 其一
1227041,至正己亥四月廿二日宿翠峰禅室登留云阁数日与净莲公
530936,正月十一日宿禄礼寄丘月渚杨溪山张见梅杨墨池
468479,贱日宿方顺桥
901636,五月二十四日宿永睦将口香积院僧轩东望甚远满山皆松桧声三首 其二
1222908,立春日宿大清口舟中见新月二鼓雪作
1051571,三日上辛祈谷除日宿斋户部右曹元日赋三绝句寄呈子瞻兄 其二
1179747,夏日宿灵岩寺宗公院
1042242,立春日宿高阳关以病酒不饮复用前韵
923457,三日上辛祈谷除日宿斋户部右曹元日赋三绝句寄呈子瞻兄 其三
743538,秋日宿武连驿怀船山
350609,水龙吟·九月八日宿清风店
366192,立春日宿高阳关以病酒不饮复用前韵
476521,九日宿院
929853,乾道初予自临川归钟陵李德远范周士送别于西津是日宿战平风雨终夕今自临川之高安复以雨中宿战平怅然感怀二首 其一
915154,正月三日宿范氏庄四首 其二
920475,是日宿水陆寺，寄北山清顺僧二首 其二
1039289,次韵和都运崔谏议寄示立春前一日宿岚谷山程
1046666,八月十五日宿平原寄跂蹈
89232,辛亥三月九日宿囊山
1118260,乾道初予自临川归钟陵李德远范周士送别于西津是日宿战平风雨终夕今自临川之高安复以雨中宿战平怅然感怀二首
144270,六月六日宿观音寺次朝南韵二绝
1089530,寒食日宿芜湖县廨
1225236,十二月二十二日宿七里寺书壁
869427,同次道元日宿尚书省听戒誓寄常州卲不疑
876815,辛亥三月九日宿囊山
769649,贺新郎·别文梁、洛闻之明日，宿江堰镇却寄
910159,七夕日宿长江
911839,人日宿味田驿
181713,十一月十三日宿东林是日小雨不见庐山戏留绝
618073,人日宿濠州
654935,丁亥元宵前三日宿院中分得金字
920277,七月二十四日，以久不雨，出祷磻溪。是日宿虢县。二十五日晚，自虢县渡渭，宿于僧舍曾阁。阁故曾氏所建也。夜久不寐，见壁间有前县令赵荐留名，有怀其人
387587,踏莎行·三月初五日宿彭善村，夜雨寒甚，晓起雪积寸许，因赋
956819,九月三日宿胥口始闻雁
494566,十六日宿句容土桥南庵示周生
738028,冬日宿青门草堂
907590,至日宿蓝田驿感旧
258693,八月十四日宿官塔下院
438560,八月十四日宿官塔下院二首 其一
94879,正月三日宿范氏庄
963152,六月六日宿观音寺次朝南韵 其一
760975,月下笛 戊戌八月十三日宿王禦史宅，夜雨闻邻笛感音而作和石帚。
229708,秋日宿楚江西寺
963151,六月六日宿观音寺次朝南韵 其二
387449,贱日宿方顺桥
720400,水龙吟 九月八日宿清风店
29832,春日宿崇贤里
783188,出山海关是日宿叶家坟 其二
568353,予入晋以四月二日宿权店三日过南关抵盘陀八月东巡还亦以二日抵权店是晚遂宿南关三月午饷盘陀岂有定数耶
245997,十月二十八日宿天津
80758,六月十四日宿东林寺
874540,丁酉重九日宿顺昌步云阁绝句七首呈味道明府 其七
621045,戊辰生日宿淩江上药上人禅房七夕前二夜也
1122695,六月六日宿观音寺次朝南韵
505542,四月六日宿方东轩观方集有作
365030,八月十五日宿平原寄跂蹈
901635,五月二十四日宿永睦将口香积院僧轩东望甚远满山皆松桧声三首 其三
663154,诞日宿周溪寺
804264,四月望日宿泐巴泉，雨雪，次日早行，晴霁
447473,猛忆去年今日宿稻城亚丁事，因与同游诸友夜饮忠州东坡
711098,与李伯昭过霍子远日宿其林园
354078,乙巳八月二十九日宿内府梦过村落循溪而行问路旁人
674133,二月朔日宿桃花口
1085618,十月四日宿于沙市舟中捲帘忽见新月天色如水乡思凄然得诗一联云诗成天作纸帘捲月为钩连夕烛有花至六日家书来自临安足成一篇寄二弟
1108914,丁酉重九日宿顺昌步云阁绝句七首呈味道明府
515377,九日宿存中家明日与汝彝汰万同登其屋南感钟山
24810,八月二十九日宿怀
915153,正月三日宿范氏庄四首 其三
515247,五日宿浯村明日饮大畈
1085135,五月十八日去国明日宿富阳庙山怀馆中同舍
1216757,九月六日宿宝集寺
674132,廿九日宿蔡村河下
920474,是日宿水陆寺，寄北山清顺僧二首 其一
1032061,夏日宿西禅院
970660,秋日宿楚江西寺
1078161,自梅趣汀行小路硗确危甚六月十一日宿金沙寺
1179726,春日宿崇贤里
321398,五月十八日去国明日宿富阳庙山怀馆中同舍
742105,望日宿安国镇
438561,八月十四日宿官塔下院二首 其二
901637,五月二十四日宿永睦将口香积院僧轩东望甚远满山皆松桧声三首 其一
134729,三月十五日宿魏云夫山庄
161980,庚辛二月二十二日宿斋省中
637173,发广宁都宪诸公饯于城东是日宿高平
487826,春日宿康孟担斋头赋赠
874539,丁酉重九日宿顺昌步云阁绝句七首呈味道明府 其二
1083151,甲辰七月二日宿永和寺用旧诗韵
616603,己卯重阳用九日宿丞相峰原韵
1183695,八月二十九日宿怀
1115814,正月三日宿范氏庄四首
915155,正月三日宿范氏庄四首 其一
884503,离临安日范伯达送茶约至钓台烹之正月十八日宿台下兼简务德
970654,春日宿信安张明府厅
229733,春日宿信安张明府厅
1171930,夏日宿秘书姚监宅
817341,出山海关是日宿叶家坟
1218499,八月十九日宿慈水车轮桥野人家夜闻犬吠有一人立门首忽问曰鸡鸣否诘之乃入县膺役者盖卜夜之早晚恐违官事也感而枕上有作
1083219,七月四日宿丹溪道中
957953,十一月十三日宿东林是日小雨不见庐山戏留绝诗于方丈
452696,十月二十八日宿天津
1117165,三日上辛祈谷除日宿斋户部右曹元日赋三绝句寄呈子瞻兄
86054,丁酉重九日宿顺昌步云阁绝句七首呈味道明府
742329,春日宿田家
458215,贺新郎　五月四日宿酲未醒，市中见燕，一瞥而逝
553196,八月中秋日宿郑文中家是夜月食随班行礼次日玩月慨然有怀作古诗一首
1088075,十一月二十六日宿萍乡西三十馀里黄花渡口客舍稍明洁有宋亨伯题诗亦颇不俗因录而和之
1213608,二月三日宿丘温驿见新月正在天心众各惊异因诗以记之
1239701,十一月十日宿陈敬初馆中临别有作
633513,丁酉生日宿沈阳南塔寺 其一
906172,夏日宿广教寺风月清甚思李白敬亭诗有怀用似表弟韵
123337,九月三日宿胥口始闻雁
439385,八月十四日宿官塔下院二首
55275,十一月十日宿陈敬初馆中临别有作
29968,夏日宿灵岩寺宗公院
1113366,五月二十四日宿永睦将口香积院僧轩东望甚远满山皆松桧声三首
26857,夏日宿秘书姚监宅
238415,重九前一日宿灵岩
494613,腊二十八日宿三洲滩
874538,丁酉重九日宿顺昌步云阁绝句七首呈味道明府 其六
326287,七月四日宿丹溪道中
930893,六月十四日宿东林寺
940059,八月十日宿百丈山庆善院明日游松风庵谒震禅师
674489,立冬日宿东峰驿次李五石韵
16786,三月二十四日宿曾峰馆夜对桐花寄乐天
