723911,拟魏太子邺中集诗八首 其二 王粲
41153,拟魏太子邺中集诗应玚
840557,雨中集法源寺看丁香示右衡惺憔两同年
530478,狱中集古十六首　东岩同扉 其十四
605762,乙未落第南还夜泊潞河梦中集唐句及觉止忆记首二句因续成之
600652,舟中集杜句 其一
344932,浣溪沙·銮江舟中，集刘随州句，寄孙无言
530480,狱中集古十六首　东岩同扉 其十六
703944,狱中集古十六首　东岩同扉
530465,狱中集古十六首　东岩同扉 其一
693723,舟中集杜句寄顾九和谕德二首
530470,狱中集古十六首　东岩同扉 其六
41150,拟魏太子邺中集诗陈琳
274054,看花回·雨中集紫兰小筑观梅，盆景尤佳绝。归用清真韵作
41117,拟魏太子邺中集诗
41152,拟魏太子邺中集诗刘桢
542881,雨中集王文父别墅登楼得秋字
41155,拟魏太子邺中集诗平原侯植
723912,拟魏太子邺中集诗八首 其八 平原侯植
593377,雨中集玉河堤之光远堂得披字
740726,雨中集竹所赋春阴得烟字
63634,暮春雨中集惟时西园
122464,雨中集水月·献之今年不堪暑
474047,雨中集清凉寺送梅子马赴楚曹能始还闽
701558,秋日送同年刘鄜南归秦中集杜四绝
353486,四月晦日袁起岩同年雨中集聚景园
530467,狱中集古十六首　东岩同扉 其三
58786,雨中集清凉寺送梅子马赴楚曹能始还闽
727346,拟魏太子邺中集诗八首 魏太子
588847,秋日送同年刘鄜南归秦中集杜四绝 其一
41151,拟魏太子邺中集诗徐干
530466,狱中集古十六首　东岩同扉 其二
530472,狱中集古十六首　东岩同扉 其八
487929,雨中集洪仲昭楼居仝詹淑正何行吉管象吉殷公觐分得樽字
588848,秋日送同年刘鄜南归秦中集杜四绝 其二
723917,拟魏太子邺中集诗八首 其四 徐干
551297,邀黄仲高张孺愿钱叔达张公鲁陈汝大陈汝翔陈惟秦王玉生陈幼孺王粹夫颜廷愉曹能始兴公弟雨中集万岁寺即席送徐仲和归钱唐
530468,狱中集古十六首　东岩同扉 其四
723914,拟魏太子邺中集诗八首 其七 阮瑀
732410,雨中集饮周忠介公蓼庵与如须怀旧作
600653,舟中集杜句 其二
753312,读毛西河濑中集作 其二
741034,秋夜雨中集企晋园中即席感怀亡友亦瑜
957079,雨中集水月
723916,拟魏太子邺中集诗八首 其三 陈琳
237501,挽张龙山·大雅林中集众英
863825,还杨遂蜀中集
530479,狱中集古十六首　东岩同扉 其十五
588850,秋日送同年刘鄜南归秦中集杜四绝 其四
588849,秋日送同年刘鄜南归秦中集杜四绝 其三
684182,舟中集杜句
530471,狱中集古十六首　东岩同扉 其七
769738,浣溪沙•銮江舟中，集刘随州句，寄孙无言
821594,看花回 雨中集紫兰小筑观梅，盆景尤佳绝。归用清真韵作
530475,狱中集古十六首　东岩同扉 其十一
815947,读毛西河濑中集作
530476,狱中集古十六首　东岩同扉 其十二
177965,还杨遂蜀中集
1089532,四月晦日袁起岩同年雨中集聚景园
286995,雨中集法源寺看丁香示右衡惺憔两同年
7351,述古·市人日中集
41149,拟魏太子邺中集诗王粲
572399,小修久住沙市苏潜夫迟之十馀日矣雨中集刘绳之高斋小脩忽至赋得十灰
677170,雨中集侯雍瞻东园
1025773,减字木兰花 其一 雪中集醉高楼
731939,夏日郢中集吕工寅宅 其二
529588,舟中集杜句寄顾九和谕德二首 其一
703946,狱中集古十六首　东岩同扉 其三
488532,燕中集西宁侯邸第观菊
733466,立夏日雨中集城西书院
731938,夏日郢中集吕工寅宅 其一
530469,狱中集古十六首　东岩同扉 其五
344163,花朝雨中集字
743136,九日雨中集东皋姚王祠
488105,雨中集游元封双璧堂因怀其尊人宗谦
753311,读毛西河濑中集作 其一
723915,拟魏太子邺中集诗八首 其六 应玚
529589,舟中集杜句寄顾九和谕德二首 其二
475932,暮春雨中集惟时西园
528077,元夜寺中集
41154,拟魏太子邺中集诗阮瑀
815256,夏日郢中集吕工寅宅
703945,狱中集古十六首　东岩同扉 其五
530474,狱中集古十六首　东岩同扉 其十
530477,狱中集古十六首　东岩同扉 其十三
530473,狱中集古十六首　东岩同扉 其九
723918,拟魏太子邺中集诗八首 其一 魏太子
572802,雨中集龚名世平远楼
723913,拟魏太子邺中集诗八首 其五 刘桢
