502440,拜文公朱紫阳祠堂呈江惟中朱士正苏明远
514965,幼幼堂歌为越中朱廷用先生赋
601779,清远道中朱荆玉携酒同弟学张懋纬承宰承藻承衮送至东林寺
485760,夜雪有怀范玉厓叔中朱沧洲孟辩
862545,乐平道中朱门当道诗二首 其一
280005,肇庆舟中·朱曦得残暑
232141,毗陵道中·朱槿碧芦相间栽
73450,摸鱼儿·问疏斋湘中朱凤
909578,沁园春 其十七 丙午和淮安朱赞府韵，以同在丙寅安陆围中，朱八十馀矣
547618,病中朱廷平可大携谈易王生见过书怀
382994,病中朱廷平可大携谈易王生见过书怀
862544,乐平道中朱门当道诗二首 其二
696017,将之勾漏社中朱季美周彦昆万伯文马伯起赵丕振蒙伯羽黄元卿韩孟郁邓伯乔何龙友赵子熙陈公望梁子芳治具夜过斋头为别各分赋一诗
916149,坐中朱博士言今荆南张谏议典襄阳日尝留意一妓公颇畏内终不得近及移郡荆渚泣别邮亭乃为歌词流布巴郢予感其事赓而成诗
1106844,乐平道中朱门当道诗二首
623438,将之勾漏社中朱季美周彦昆万伯文马伯起赵丕振蒙伯羽黄元卿韩孟郁邓伯乔何龙友赵子熙陈公望梁子芳治具夜过斋头为别各分赋一诗 其二
192942,坐中朱博士言今荆南张谏议典襄阳日尝留意
173377,乐平道中朱门当道诗
349298,金丹诗诀·鼎中朱橘亘天红
341018,盆中朱鱼·绿藻盈盈动
623437,将之勾漏社中朱季美周彦昆万伯文马伯起赵丕振蒙伯羽黄元卿韩孟郁邓伯乔何龙友赵子熙陈公望梁子芳治具夜过斋头为别各分赋一诗 其一
1247996,与金文中、朱仲义、宋仲温过李士明鍊师，雨阻留宿，探韵得孤字。师有酒瓢如鹤形，因扁居曰：鹤瓢山房
