1051993,和张季友正夫归因为诗寄
236177,癸丑七月十九日以老病分任诸子以家务因为诗
817638,十二月二十九日，与栽甫登江亭，忆去年此日为后山逝日，设祭法源寺。与会者惟贞壮南归，今此事亦不再矣。因为诗寄之
756407,赵季和刻青田石章见赠时将归蜀因为诗以报之
992675,脩真观李道士年老贫饿无所依忽缢死因为诗以悼之
105388,新安潘侯将行约游山门寺予以泞淖遂止因为诗
1160049,有僧言罗浮事因为诗以写之
103004,修真观李道士年老贫饿无所依忽缢死因为诗以
894283,都官谢员外今年春榜舟奉使予饯别于东亭孟夏之初不幸卒于中道其孤迎丧还都予又出吊于饯所俯仰陈迹因为诗以寄哀
894507,余卧病畿邑御史王君假守潭楚道出于舍下特见存访且寻先子之旧钦承风仪因为诗抒感云
894514,谷城主簿王崇者少得养生禅寂之道中年弃官入汉阴武当之间邈与世绝又有吴人山者自远携母与王同隐时余方贫病慨然慕之因为诗代书以寄二子且托王寻耕钓之地相与迩者并以叙怀云
905199,癸丑七月十九日以老病分任诸子以家务因为诗以示戒
993336,新安潘侯将行约游山门寺予以泞淖遂止因为诗以见怀
354859,和张季友正夫归因为诗寄
1062939,史东美置酒见招偶以释奠致斋不果往因为诗戏之以请他日之约兼呈周与刘敏叔
14764,有僧言罗浮事因为诗以写之
993313,道损司门前日过访别且云计程二月到郡正看暗恶海棠颇见太守风味因为诗以送行
495300,吴佩远游雁宕山归，备述名胜；因为诗纪略，亦志余企望之怀也
1159742,和李相公以平泉新墅获方外之名因为诗以报洛中士君子兼见寄之什
1137510,长儿授馆于杭每休暇过仲实家相与谭经析理间则饮酒赋诗为乐今闰秋十四日会于复轩相视而笑曰好天凉月即中秋况今岁两中秋乎乃留饮剧论夜参半蝉联不休情愈郁穆予闻之甚喜因为诗寄之
