306081,秋夜不寐起临快雪堂帖
751356,舟中不寐起视月色如昼
271708,秋感·不寐起彷徨
315953,夜深不寐，起续蹉跎吟一律
411467,丁酉夏余应安徽省文史研究馆之聘，寄居岳西县垣，夜不成寐，起读杜工部诗，感而赋此 其四
453137,夜宿泉城，不寐起赋
311617,丁酉夏余应安徽省文史研究馆之聘，寄居岳西县垣，夜不成寐，起读杜工部诗，感而赋此
402359,秋思 秋夜同慧素窗丛碧山房不寐起吟用梦窗韵
452667,雨夜不寐起读春冰集时夜气纵横中心如沸因借如冰甲申韵拉杂记之
441487,不寐起咏
431687,丁酉夏余应安徽省文史研究馆之聘，寄居岳西县垣，夜不成寐，起读杜工部诗，感而赋此
411465,丁酉夏余应安徽省文史研究馆之聘，寄居岳西县垣，夜不成寐，起读杜工部诗，感而赋此 其二
246038,雨夜不寐起读春冰集时夜气纵横中心如沸因借如冰甲申韵拉杂记之
500120,夜寒不成寐起坐观书
84516,冬夕·不寐起中夕
425622,夜深不寐，起续蹉跎吟一律
157727,九月十四日夜枕不寐起视明月清寒著人冷然有
312988,水调歌头·寒夜不寐，起坐对月口占
573164,夜深不寐起视星文遂成谜语戏别君御兄
996197,既作闵雨诗是夕遂澍雨夜中喜不能寐起作喜雨诗
797471,水调歌头 寒夜不寐，起坐对月口占
315551,夜寒不成寐起坐观书
291335,金缕曲·夜不成寐，起填此解。旧恨新愁，纷然叠至。世有解人，其谓我何
411466,丁酉夏余应安徽省文史研究馆之聘，寄居岳西县垣，夜不成寐，起读杜工部诗，感而赋此 其三
412127,秋夜不寐起临快雪堂帖
1004455,凤栖梧/蝶恋花 其一 客临安，连日愁霖，旅枕无寐，起作
419554,点绛唇·秋宵不寐，起看盆竹写影窗间，宛然坡翁墨妙也，戏成小阕
83033,夜分不寐起坐园中至旦
108436,晓起·夜凉无寐起吟诗
932459,夜分不寐起坐园中至旦
1005712,九月十四日夜枕不寐起视明月清寒著人泠然有欲仙之意
248457,夜宿泉城不寐起赋
293902,秋思·秋夜同慧素窗丛碧山房不寐起吟用梦窗韵
411464,丁酉夏余应安徽省文史研究馆之聘，寄居岳西县垣，夜不成寐，起读杜工部诗，感而赋此 其一
612404,秋杪不寐起与洞虚对酌共得长字
115157,既作闵雨诗是夕遂澍雨夜中喜不能寐起作喜雨
