542568,冬夜同宣允则集徐进士子与宅
478052,王进士直夫僧房见招
634398,小塘迟朱廉斋进士不至
224421,又代挽·壮岁名登进士科
29257,和蒋进士秋日
208562,诸公劝楚真叟应进士举以诗勉之
915141,四月二日进士唱名万里以省试官待罪殿庐遇林谦之说诗夜归又得林柬因纪其事
915024,拟进士金波丽鳷鹊诗
602816,送余沈二春元赴进士举
594156,送臧进士晋叔赴教荆州五首 其五
1187603,春晚怀进士韦澹
590664,袁州偕郡博两川郭进士陈平斋胡前溪邑博陈阳山潘木斋窦益斋兴贤楼共饮观竞渡
524260,送熊进士入朝三首 其一
1212070,题进士索士岩诗卷士岩与余同榜又同为燕南官由翰林编修为御史台掾兼经筵检讨除为燕南廉访经历
1181481,寄进士崔鲁范
608997,又赋得并蒂花送李进士归娶
1211670,寄进士野仙不花仲实除侍仪通事舍人
160570,送樊进士归宁
566010,送杨进士令贵溪一首
1102513,呈金陵教授陈宜之钺前进士三人居慈湖
540866,春日得二翟进士书兼枉佳篇
29211,赠来进士鹏
721404,上元日邑侯徐戢斋招同佘齐枢进士游允陵梁殿一殿张佘兼五卢闻仲严孚长燕集青云山阁即事赋谢二首
560236,和进士胡公智留别字宗愚会稽人任御史终布政
673649,送赵进士瑶还泉州
158185,酬杨立之进士见赠
494453,题西溪卷为俞进士宪乃祖
658652,送史进士巽仲归省溧阳
27097,浐川寄进士刘驾
572909,送曹远生进士左迁宜川典史
902772,集英殿立侍观进士唱名六首 其一
591983,同徐子与使君过袁鲁望进士留酌
566094,赠茅顺甫进士归吴兴一首
589561,步伦内翰送钟进士南归韵送钟天庆上京
155641,试院中秋效诸进士作月涌大江流
1191116,送进士刘师服东归
550848,送林应卿进士理梧州
557870,答胡廷慎进士
179682,赐进士诗韵·云汉昭回下建章
924343,试院唱酬十一首 观试进士呈试官
817336,哭陈进士宪图
512427,挽同年方进士
571519,酬龙道亨进士
870386,和朱玄进士对雪
1233146,奉简吉州萧进士自省
484845,送前进士夏尚之归宜春
687580,戏调浦进士
914113,四月十七日侍立集英殿观进士唱名
894527,庚午春观新进士锡宴琼林苑因书所见
585781,为梁宪甫进士寿亲禄峰六十一华诞
276522,送王熙甫始举进士之官吏部
511477,弘治己酉春姜仁夫进士以使事贵州还取道广东过予白沙自己夘至丙戌凡八日辞别三首予亦次韵为别明日仁夫至潮连寨方十馀里遣隶回并得三绝和之通前九首吾与仁夫之意皆不在诗也岂尚多乎哉仁夫浙之兰溪从学章先生德懋吾廿年旧好故吾诗两及之 其一
1234548,寄题进士宋翔仲书室 其一
561869,少傅相公二郎偕第进士暮春宴城东王氏园纪贺 其一
634009,送罗澹峰进士入都改除 其一
575944,寄赵进士安中
559977,送同年田进士
1219879,送张仲举归晋阳举进士 其三
680942,临湘舟中有怀孔儒太守李承恩进士三昆季
515492,送程忠显进士江西公干便道还新安
30089,秋夜寄进士顾荣
526546,秋兴同商进士景贞押韵作 其五
62919,送龚进士文彦
533606,送吴进士子沐使辽左兼归揭阳省觐
237928,题林进士玉芝西磵小隐
1022199,赠进士叶授
492955,题墨龙赠起予彭进士
661914,送启范进士北上
650594,赠进士陈素漳州教授
491604,奉答彭进士晋怀祖诗
610241,赠黄宏选进士
504210,江夏奚瑛以进士出宰武城其兄瑄作鹄山秋思图寄之索题为赋绝句一首
1244121,题袁寅亮进士所藏袁安卧雪图
1208932,送翰林应奉寿同海涯挈家觐省十首（供奉字弘毅至顺四年进士第二名辉和尔人自号清冰玉壶登第时寓居蓬莱真境） 其六
609970,赠李葵孺进士归娶时初授连城令
1148327,大中后进士语
237176,恭和御制赐进士韵
999888,秋试甫期辄成短篇呈马公节裴进士光世
159711,赠令狐进士
587594,贺刘惟静乃子新进士公事到南都与同年会
499617,挽成之刘进士
514659,送王公济进士知丹徒县
695934,送臧进士晋叔赴教荆州五首
849310,长沙鹿鸣宴送诸进士
686307,次进士马中锡吴淑游京师西山韵八首
1062944,马宗玉教授自大名考进士归以诗赠之
1242081,送乡贡进士钱宗善馀庆吴时纬仲文吴克潜纲赴京会试 其三
894213,送齐进士奉章阙下
1181317,送进士韦序赴举
615810,送何进士卜熙领教镇江
548201,戏调浦进士 其四
687208,访许进士台仲九杞山中二首
534760,沛中歌赠钦进士赴沛公分司
555330,题进士起家卷
940840,次延平郡文学宴新进士韵
1043622,与宋次道舍人同在殿中覆考进士次道子侄同就御试赠次道二首 其二
658069,休宁汪进士枉顾定山有诗和之
764665,云仙引 寿王鄂叔进士
524760,春夜歌立春夜试灯同张陈二进士饮后作
731117,病中偶尔问及工部尚书翰林院掌院学士徐元梦乃同学旧翰林康熙十六年以前进士再无一人矣率赋一律以遣闷怀
569279,送沈进士病起还朝时其父鸿胪君无恙有弟同榜而谒选当得邑职
1188105,浐川寄进士刘驾
551070,送丁亨文进士司理召陵 其二
676146,送淩伯远进士之任德化
855025,县境不雨祷响潭得之明日一龟出潭水上取以归县斋诸进士有诗因作一首
661580,次进士马中锡吴淑游京师西山韵八首 其六
547198,送邹进士南皋谪戍贵阳二首 其一
179622,会新第进士和陈振享韵
515729,画菖蒲为汪进士乃尊赋
562469,四友图为安成刘进士秩之父作
569791,癸未十月成伯从孙詹录偕弟进士寅季侄孟嘉过敬美澹圃看菊花作
1211622,哭同年进士李竹操经历 其一
1215366,送马彦翚进士赴江西省筦勾二首 其一
661227,读桂进士兄弟文字喜而赋之
695282,赠熊士选进士尹平湖二首
527657,谷进士宴归图歌
478490,沅溪潘进士在长安逆旅中见庭下山丹花诘其主云是沅中移来感而赋诗命予嗣响
499847,送□进士
1000202,前日以诗赠贾麟进士继蒙和答而杨蟠从事亦随次元韵鄙思不休辄复自和二篇 其一
4541,送张子容进士赴举
286538,赠朝鲜进士金山泉
550749,送邓汝高进士还朝 其二
583206,至滇南次答陆进士震韵 其一
1045905,和鹿鸣燕进士二首 其二
38416,逢进士沉彬
480606,题西陵送别图送姚进士
1165421,江上逢进士许棠
615802,同樊孟泰工部吴尔达进士集韩寅仲明府寓分得朝字
1180117,寄进士卢休
485101,与杜进士寅登白莲阁对雨
524775,送张进士自全州成婚归桂林
1026826,送樊进士归宁
721409,送张畏岩进士归吴门兼怀孙赤崖二首
876581,次江权军宴新进士韵
856026,和邹进士
1236596,天历庚午会试院中马伯庸尚书杨廷镇司业及玄皆乙卯榜进士偶成绝句纪其事出院明日有敕督修经世大典又成小诗寄诸弟
528910,送徐进士昌谷湖南纂修
569181,为胡进士孟韬作匡山读书处歌
1127456,前日以诗赠贾麟进士继蒙和答而杨蟠从事亦随次元韵鄙思不休辄复自和二篇
594066,送朱进士希尹司法洛中
239299,庆元戊午临江劝驾多士凡由进士科进者皆预焉
228153,赠隆中黄进士
521377,进士熊世芳太仆陆献臣先生令新建时所造士也奉使过家先生赋诗为其尊人寿要予同作
782347,赠戴进士通乾
597703,周进士挽诗四首 其二
1045953,广安鹿呜燕送诸进士
1181319,送进士许彬
783008,廷璋儿以武举效力京营千总秉瑛侄以进士试用户部主事数年资其薄俸以供饘粥今二子前后归班候选生路遂绝赋此见志且励二子固贫之志不可不坚也
923364,和丘与权秘校咏宝寄林成之进士
526655,夜至铜岩驿逢臧进士张茂才
509226,送洛阳严进士宪来江西劳功因便道故乡还京
517660,赠李进士
902770,集英殿立侍观进士唱名六首 其三
521671,送刘公勋太学兼简尊翁聘君文仪进士
1177101,赠元和十三年登第进士
1244049,赋丁氏悠然斋兼呈罗宗仲进士
916296,喜王虞部赐进士及第
343643,次韵杨久中将试进士
593876,送汪进士以虚宰金华
179601,饯送蜀进士入奉廷对
1000203,前日以诗赠贾麟进士继蒙和答而杨蟠从事亦随次元韵鄙思不休辄复自和二篇 其二
508606,送章进士纶毕姻还永嘉
691763,送熊进士入朝三首
566096,赠武进士万民望转漕北上一首
27974,伤进士严子重诗
592990,秋晚同陈使君张进士饮喻园五首 其五
523993,送殷进士病免归
996860,和冕仲观试进士
514854,送袁进士翱之南畿分采实录便道省其父雪桧君
590207,为毛旸谷进士题风烟雪月梅卷四首 其一 风梅
537145,题望云遥祝卷为袁进士母
534718,秋风二章送杨进士赴守濮州 其一
590445,赋雪次滁州孙环山进士韵 其七
531210,嘉州刘介川进士母寿诗
526504,用韵送李怀德进士归建宁
561870,少傅相公二郎偕第进士暮春宴城东王氏园纪贺 其二
783159,哭陈进士宪图 其三
746493,赠朝鲜进士金山泉 其二
511485,弘治己酉春姜仁夫进士以使事贵州还取道广东过予白沙自己夘至丙戌凡八日辞别三首予亦次韵为别明日仁夫至潮连寨方十馀里遣隶回并得三绝和之通前九首吾与仁夫之意皆不在诗也岂尚多乎哉仁夫浙之兰溪从学章先生德懋吾廿年旧好故吾诗两及之 其九
1085846,寇莱公取韦苏州野渡无人舟自横之句增为十字见于曾南丰所作公传则知前辈作诗一言一句皆有来历予用其说为巴东词记有新进士作诗云语当人意为佳句何与韦郎野渡舟用其以解嘲
606631,送何进士令嘉兴
615806,送吴进士出宰归安
515194,留题古岩寺时汪州守时夫汪进士仲和及二方生经纶两次候予不至先归
1146561,注苗张二进士题名
993028,闻进士贩茶
686158,读王进士下第时所拟宫词六十首为赋四绝
29224,酬郑进士九江新居见寄
655936,十四夜同李进士玩月
125071,送袁进士赴举
499639,寄刘进士伯琛 其一
28096,奉和袭美酬前进士崔潞盛制见寄因赠至一百四十言
836386,貂裘换酒 其一 彭县赠向君南皋，名步瀛，戊戌进士，官至贵州劝业道
597704,周进士挽诗四首 其三
1180131,寄徐济进士
978864,王才谅自行朝归以进士题名示予怆然有感
561586,宫保顾公吏侍张公被命校文仆承乏礼曹知贡举予三人者弘治乙丑同年进士也孝皇赐第距今三十有四年矣顾公有诗纪遇志感余嗣和焉 其一
1251312,风树亭临江经历潘德全进士其父葬海宁之彭坡待制赵仲睦为书树亭赋二绝 其一
30546,送谢进士还闽
592987,秋晚同陈使君张进士饮喻园五首 其二
892657,送朱进士赴举
580071,次杜进士还朝诗
194955,谢陈进士见示诗赋并以为别
607457,读王进士下第时所拟宫词六十首为赋四绝 其四
511119,赠余进士行简别
560753,题杜进士公馀清玩画卷八绝 其三
46608,金进士宿江馆阻雨连夕二首
593621,送淩进士元学知合肥
592989,秋晚同陈使君张进士饮喻园五首 其四
177881,送郑南进士归洪州
517378,梦萱堂为孙进士子良题 其二
542569,雪夜集吴进士明可宅候李给事元树吴进士子修不至得楼字
542569,雪夜集吴进士明可宅候李给事元树吴进士子修不至得楼字
1072629,郡燕新进士胡文侍读即席赋诗因次其韵
670498,答王敬美进士
124248,进士·离邦嗟病免
689936,为毛旸谷进士题风烟雪月梅卷四首 风梅
740238,送李翼兹进士出塞省亲
490578,喜甥韩进士存良入馆选
983705,会新第进士和陈振享韵
581382,送修书黄陈二进士事竣北还 其二
112881,甥舅同登进士亦世之不易得
1248059,赋荷送陈进士启
557907,红梅赠萧文明进士
578984,寄新会余马两进士
30852,贺进士骆用锡登第
481330,送龚进士文彦
657949,送冯养正进士出宰江陵
638730,赠周仲鸣进士四首 其三
30847,哭进士李洞·自闻东蜀病
962383,殿中覆考进士
870462,赠朱玄进士
587134,阅历科进士录 其二
1211522,终南进士行和李五峰题马麟画钟馗图
594153,送臧进士晋叔赴教荆州五首 其二
782872,赠舒进士乃来
783161,哭陈进士宪图 其五
1248090,陪牛进士冯明府宿遂初庵得心字
1211545,凤凰台望祭进士郑复初录事
1180496,明进士北斋避暑
1035542,和冯亚寄进士孙磻
158273,走笔依韵和杨进士倜登南楼之作
479158,朱天昭始第进士主余家至明年移居西邻
929249,绍兴癸亥余以进士来临安年十九明年上元从舅光州通守唐公仲俊招观灯后六十年嘉泰壬戌被命起造朝明年癸亥复见灯夕游人之盛感叹有作
522825,九子浴九首 马进士君卿 其七
924378,刘顗宫苑，退老于庐山石碑庵，顗，陕西人，本进士换武，家有声伎 其一
1244178,经周进士闻孙墓二首（次首重到一本另起） 其一
855147,赠陈进士
1251313,风树亭临江经历潘德全进士其父葬海宁之彭坡待制赵仲睦为书树亭赋二绝 其二
658417,送杨尚絅杨名甫毛贞甫陆全卿四进士归省 其四 全卿
583208,至滇南次答陆进士震韵 其三 游滇池
1216392,山之英寓所观壬午进士题名记有感
63028,寄奚元启顾文之二进士
592883,送张进士于皋使河南因归岭外省觐
1181259,访题进士张乔延兴门外所居
570717,乡进士邹道甫以严君之命借听于余余实无得也不忍逆其意以二绝酬之 其二
491342,出赣滩读伯友赵君知非藁命同李以庄进士韵题其后
494917,宿谏议祠次韵余子华太史兼呈郑伯兴朱守中二进士
528592,送戴进士时亮
669391,题金门候对图赠济川蔡进士
514434,送黄进士金还定远
661579,次进士马中锡吴淑游京师西山韵八首 其五
515187,分得石人峰送徐中行进士
1238391,颖语次杨廉夫进士古声韵
864675,谢进士张翼投诗两轴
479419,项进士便面
558340,进士卞华伯奚元启用齐字韵联句因掇其遗韵
657847,赠湘阴夏进士
206418,和进士田亚夫见赠
990471,题增城进士单有明清白传家卷
137520,和公仪试进士终场有作
698828,题杜进士公馀清玩画卷八绝
953647,礼部贡院阅进士就试
498731,送陈宪卿进士使长沙
33413,送进士喻坦之游太原
265682,云仙引·寿王鄂叔进士
1227888,鄢陵经进士李伯昭墓
569858,周进士移居贺之
828674,闻近日求人书者以进士为贵戏作一绝
1154348,送进士苗纵归紫逻山居
922122,惠州近城数小山，类蜀道。春，与进士许毅野步，会意处，饮之且醉，作诗以记。适参寥专使欲归，使持此以示西湖之上诸友，庶使知予未尝一日忘湖山
593665,送吴进士汝南司理衡州
811052,唐制新进士杏园宴集三首
570014,寿曹茂来进士七十以故人仲蔚子请也
547199,送邹进士南皋谪戍贵阳二首 其二
876606,次韵丰守宴新进士
688711,少傅相公二郎偕第进士暮春宴城东王氏园纪贺
479193,宿资胜寺与王文玙进士夜谈
514894,送进士陈亮之赴南京武选主事
410598,端阳至矣开笈得钟进士四图奇趣满抱乘醉命笔匪云讽议聊致轩渠 其一 嫁妹图
516473,石城霁雪送李进士
892383,呈胡希元进士二首 其一
33220,伤进士谢庭皓
613176,赠魏合虚进士
1034798,赴遂宁进士期集即席赋
615809,立春前一日韩太史绪仲何进士卜熙黎山人不回过寓赏梅
514436,送安成欧阳子履进士奉命犒师广中便道归省
682962,秋风二章送杨进士赴守濮州
920651,成都进士杜暹伯升，出家，名法通，往来吴中
638595,赠熊士选进士尹平湖二首 其二
530192,同吾进士谨游陈遂初湖上草堂
592211,余省觐岭外马进士使辽东饮别霍进士爱大宅得真字
592211,余省觐岭外马进士使辽东饮别霍进士爱大宅得真字
816205,壶中天·江亭寓中寄题张进士奕山学圃居即次原韵
1242079,送乡贡进士钱宗善馀庆吴时纬仲文吴克潜纲赴京会试 其一
30846,哭进士李洞
29560,途中逢进士许巢
591993,七夕遇雨同徐使君袁进士刘沈二山人集潘大理宅时子与已有长芦之役
560976,送进士陈则英归觐
956691,逍遥楼席上赠张邦达教授张癸未省闱门生也同年进士俱会楼上者七人
1031343,州学饯送解发进士
158904,范钺进士遗楼彻司马庭石以质交楼作诗美之因
99735,和黄鲁直效进士作二首岁寒知松柏
1243746,题雪岩画倒兰（黄瑨卿题云袅袅春风一样吹托根高处欲何为从渠自作颠倒想终有悬崖撒手时瑨卿举进士历官至行省左丞乞身归私第幅巾布衣澹如也予喜赋一绝于其后）
608617,送梁进士宰零陵
709888,兰陵赠庄书采进士
510228,题林进士廷玉继母陈氏挽卷
510297,赠张进士入京 其四
593184,夜登曹进士仲宣楼
159487,送谢沂进士
675798,江南别送毛给事吴行人蒋进士
1181258,访题进士孙秦延福南街居
60016,送曹进士知贵池
275356,茶陵·进士山东李中麓
118789,观试进士呈试官·松庭散朝日
510766,赠黄进士廷章还京
509445,赠修实录沈进士
673089,送刘宗哲进士知束鹿
661372,金台行送吴进士汝砺之京
654884,送窗友赵景芳以乡进士出宰商河
599943,送聂瑶峰进士知南陵 其一
1125522,恭和御制赐进士诗韵二首
558308,送嘉定李吉夫进士
783157,哭陈进士宪图 其一
1215956,至正元年复科举取士制承中书檄以八月十九日至上京即国子监为试院考试乡贡进士纪事
817325,丙子岁暮得王进士简泉书却寄
27113,关试前送进士姚潜下第归南阳
695367,次韵石斋先生赠姜仁夫进士三首
608996,送李进士南还毕姻兼宰连城
569280,赠乡进士曾嘉帙乞其父志铭还楚
512332,五荣堂为张氏兄弟进士题
663884,石桥驿逢詹进士赴京
570037,大宗伯吴兴董公枉棹海滨道返命进士长君代访且赠长律饰奖过情愧感之情托之申和
229950,殿中覆考进士
530695,驻马听　寄答世宁进士壬申
1057162,入内考进士同考官唱和三首 其二
30783,送进士许彬
992762,送方进士游庐山
35412,寄孟进士
515504,送进士王恂省亲还毗陵
888688,余壬戌春校试进士同事者五十五人至戊子岁因阅小录所存者止四人感而有作二首 其一
535003,送朱进士令浮梁
638732,陪周进士仲鸣谒思范亭小酌成诗二首 其一
103504,池州进士陈生惠然见过不日且行因以诗赠别
1219882,送张仲举归晋阳举进士 其六
1057163,入内考进士同考官唱和三首 其三
1001956,免解进士应致远过晋康见谓以上文字而忤权要听读藤州十馀年得旨自便赋诗赠行
535527,送周进士使淮便省 其一
46870,送前进士夏尚之归宜春
515564,送徐中行进士赴青州推官
808687,黄进士淳耀
694449,赠张进士入京
165444,北京水后往棣州试进士
535009,送陈履旋进士奉使得省
1178481,送洗然弟进士举
863636,商州进士张齐说将赴春闱以诗别冯中允冯君酬和予亦次韵继之
587133,阅历科进士录 其一
695882,秋晚同陈使君张进士饮喻园五首
615837,寄黄进士
1181318,送进士卢棨东归
454958,康园十咏 其十 进士坊
388539,送沈进士病起还朝时其父鸿胪君无恙有弟同榜而谒选当得邑职
1219881,送张仲举归晋阳举进士 其五
1188621,送谢进士还闽
592070,送陈进士彦吾使密云兼还南海省觐
922764,刘顗宫苑，退老于庐山石碑庵，顗，陕西人，本进士换武，家有声伎 其二
1116735,刘顗宫苑，退老于庐山石碑庵，顗，陕西人，本进士换武，家有声伎
352220,次韵方守送进士
660500,灵寿杖为罗进士父赋
137855,圣俞在南省监印进士试卷有兀然独坐之叹因思
1111086,入内考进士同考官唱和三首
548343,四月朔日同浦进士蔡户部二年兄饮
551700,枫桥夜泊梦邓汝高进士
877501,挽林进士
843916,貂裘换酒 彭县赠向君南皋，名步瀛，戊戌进士，官至贵州劝业道
524123,哭亡友范副使渊其族孙进士永銮寄其绝笔诗到
206713,送进士孙磻赴举
535472,胡进士琼林醉归图
137345,礼部贡院阅进士试
680764,双桂卷为河南吴进士升作
593934,冬夜同李比部黎司勋黄李二进士集金舍人宅和得比部二韵 其一
1112097,呈胡希元进士二首
29208,送进士刘松
271816,金缕曲·郫县晤李干廷，名作桢，郫县人，庚辰进士，广东知县
569849,顾进士懋善令闽之瓯宁
695719,冬夜同李比部黎司勋黄李二进士集金舍人宅和得比部二韵
590613,己酉季十日雨雪忆孙环山进士
962740,赠诸进士诗
869363,之美举进士寓京师此诗寄之
521966,开化徐进士良节介其友谢锦衣汝容求南峰书院诗汝容故剡人康乐之后也因托以起意
33388,山中寒夜呈进士许棠
1180176,湘中见进士乔诩
590446,赋雪次滁州孙环山进士韵 其八
703201,送徐进士子绳谪建阳少尹
638298,次韵石斋先生赠姜仁夫进士三首 其三
670625,赠李封君兼讯长君进士
658582,送白进士金归省
1236443,送张仲举归晋阳举进士
1208934,送翰林应奉寿同海涯挈家觐省十首（供奉字弘毅至顺四年进士第二名辉和尔人自号清冰玉壶登第时寓居蓬莱真境） 其八
1179063,新岭临眺寄连总进士
558515,谢赵弘济进士携酒至兼简丁编修
514588,送吴容之进士还歙
1208928,送翰林应奉寿同海涯挈家觐省十首（供奉字弘毅至顺四年进士第二名辉和尔人自号清冰玉壶登第时寓居蓬莱真境） 其二
610105,苏孺子汝载族弟也所居碧山去余乡五里而近孺子尝读书山阳双鹤来巢其举进士也捷至鳌跃于江诗以美之
782103,辛丑三月望后一日闻亨儿成进士五百字
526486,赠徐景禹进士
27089,送进士下第归南海
695290,陪周进士仲鸣谒思范亭小酌成诗二首
342545,赠梅圣俞试馆职得赐进士出身
493204,题散兰图花叶狼藉若采而弃之者有松枝竹叶杂之盖戏墨也进士刘仲炯以示余因为赋此
575932,乙丑元夕送傅城进士还桂林
14290,学诸进士作精卫衔石填海
542791,送徐进士子绳谪建阳少尹 其四
527820,寄马君卿进士
650673,赠进士傅玉良玉润昆弟还临江
594040,送萧进士以孚饷边因归汉阳省觐
579955,送进士姚廷述归省
542607,送杞县刘进士子旭使宣府
1188112,送进士李殷下第游汾河
894348,感怀寄进士胡肃
1249076,寄陆宅之进士钱思复提学全希言学正
593215,同许光禄王进士集余太史伯祥宅
558593,送高进士赴京
593778,题王进士子牧琼林宴归图二首 其二
1181329,哭进士李洞二首 其一
565904,超果寺访张进士承宪宴集一首
510790,用韵寄姜进士仁夫
994763,庚午秋观进士入试
539176,内乡李翁少偕计公车不第遂弃归以长君翰林封顾翁时时称乡贡进士扁舟见访谈诗论世事多感慨不平语于其别也赠之一诗
562432,送蒲进士赴铅山县
30832,访题进士孙秦延福南街居
910745,寄进士熊退斋 其一
59845,项进士便面
661575,次进士马中锡吴淑游京师西山韵八首 其一
145893,集英殿赐进士及第恭谢诗
527705,同李进士观铜雀砚歌
557845,夏仲昭画竹为吴进士题
511484,弘治己酉春姜仁夫进士以使事贵州还取道广东过予白沙自己夘至丙戌凡八日辞别三首予亦次韵为别明日仁夫至潮连寨方十馀里遣隶回并得三绝和之通前九首吾与仁夫之意皆不在诗也岂尚多乎哉仁夫浙之兰溪从学章先生德懋吾廿年旧好故吾诗两及之 其八
179704,蜀进士许成子魁天下用其殿前赋诗韵以志喜
509274,送昆山赵进士博还京
357390,壶中天·江亭寓中寄题张进士奕山学圃居即次原韵
575036,戴进士巾山行
597702,周进士挽诗四首 其一
1217531,送进士王克敏赴成都录事
585810,赠苏仁伯何于逵霍勉衷三进士之京二首 其二
527824,寄戴仲鹖进士
689615,送修书黄陈二进士事竣北还 其二
583209,至滇南次答陆进士震韵 其四 住春阁即温泉阁
46753,白莲寺次韵杜进士喜予见过话旧之作
1253167,风树亭临江经历潘德全进士其父葬海宁之彭坡待制赵仲睦为书树亭赋二绝
654586,海屋添筹图寿徐进士父母
68793,颖语次杨廉夫进士古声韵
1219880,送张仲举归晋阳举进士 其四
913974,三月二十六殿试进士待罪集英殿门二首 其二
1163394,宿沈彬进士书院
548200,戏调浦进士 其三
745024,送李寅庵进士游长安
627472,贺祁东园进士锦旋为九旬令祖母暨两尊人寿
1004202,闻喜宴恭和御制赐进士诗
679014,溪云堂为陆进士赋
108711,和冕仲观试进进士
37405,明进士北斋避暑
578054,题万进士赴召手卷
580782,送进士钟元溥归东莞次张尚书韵
79798,绍兴癸亥余以进士来临安年十九明年上元从舅
30114,送进士臧濆下第后归池州
257172,贾佐之以进士充军被挞
30469,赠进士王雄
1070483,和王给事易简殿试举人五首 其一 试进士
355795,试进士·切云冠弁拱长生
746494,赠朝鲜进士金山泉 其三
570051,昔白文公有诗赠裴淄州其起句云九十不衰真地仙余以此例赠九十翁者凡五人矣莆田林方渠公以名进士官至郡守累进阶正三品今年寿九十二而其子敬夫复以雷阳守便道彩侍毋论五人者仅一宗马湖雁行即所谓裴淄州者当亦不及也喜羡之余敬步前韵授之俾歌以称觞
214070,宝应二三进士见送乞诗
1037694,赠梅圣俞试馆职得赐进士出身
694429,林缉熙县博张廷实进士何孝子子完先后见访既而缉熙往平湖廷实归五羊子完还博罗因赋四绝
969556,和寄卢进士
507303,题宋进士袁天与忠节传后
158237,寄陈介进士·圣门颜子最称贫
703862,赠同年关德甫吴用潜成进士
1192125,送进士苏瞻乱后出家
684989,梦萱堂为孙进士子良题
685759,寄刘进士伯琛
555256,寿进士吴浚母八十
653668,送周民表进士养病南还
