1000423,庆元戊午临江劝驾多士凡由进士科进者皆预焉且沿乡人饮酒之意叙坐以齿酒半使君又出杰句宠其行某陈人也偶睹盛事思有以记之敬嗣严韵二首极愧不工尚几镌削 其二
702201,赠苏仁伯何于逵霍勉衷三进士之京二首
1115228,三月二十六殿试进士待罪集英殿门二首
672648,即事用韵荅赵叔鸣进士
177274,赠朱玄进士
558110,送张廷仪进士
504031,送进士奚瑛服阕赴京
685330,送尤宗阳进士之京
517379,梦萱堂为孙进士子良题 其三
1042464,送张奕进士归广德省亲
346312,赠余进士·江南风物清温好
757826,满庭芳 丁丑春，贺素庵及第，时中丞翁抚蓟奏捷。 先太翁举万历进士，亦丁丑也
382170,题族兄马子英进士梅花
234906,和寄庐进士
331720,无题和王阮亭祠部彭骏孙进士
514501,送长洲孙进士林赴南京刑部主事
139814,燕新进士·已办书生场屋缘
102641,惠州近城数小山类蜀道春与进士许毅野步会意
510977,馆廷实进士于白沙社率尔成章兼呈丁明府
57842,访进士何斯复于歙北黄荆渡不值时斯复方以养
650262,徽庙古松山鹊为顾进士作
869831,答陈进士谓之忆江东旧游见赠
506969,题陈进士竹石图
175320,鹿鸣燕诗送诸进士
527695,观吴进士舞剑歌
773457,寄怀陈瑞阶进士浚芝
30833,访题进士张乔延兴门外所居
470154,和颍州张进士飞花曲
1109003,学进士作大方无隅二首
1224689,泰定丁卯八月十二日崇天门传胪赐进士右榜第一人阿察赤左榜第一人李黼皆肄业国学日新斋余西厅授业生也是日京尹备鼓乐旗帜麾盖甚都导二状元入学谢师拜余明伦堂榜眼刘思诚探花郎徐容尝因同年黄晋卿彭幼元从予游亦拜其侧其馀进士以门生礼来拜谢杂遝不记姓名圜桥门而观者万计都人以为斯文盛事昔未有也同寅举酒相属偶成四绝以纪其事 其一
1224689,泰定丁卯八月十二日崇天门传胪赐进士右榜第一人阿察赤左榜第一人李黼皆肄业国学日新斋余西厅授业生也是日京尹备鼓乐旗帜麾盖甚都导二状元入学谢师拜余明伦堂榜眼刘思诚探花郎徐容尝因同年黄晋卿彭幼元从予游亦拜其侧其馀进士以门生礼来拜谢杂遝不记姓名圜桥门而观者万计都人以为斯文盛事昔未有也同寅举酒相属偶成四绝以纪其事 其一
661923,古溪亭为卢师陈进士题
571283,寿谢进士乃翁
1207818,将赴江浙大府校进士试会疾止建安驿上后山东眺郡城作十二韵
590442,赋雪次滁州孙环山进士韵 其四
759563,乡间人有误以予为武进士者，戏纪以诗
527505,挽叶进士
510626,碧玉楼昼梦扶病出游村径甚适忽安福罗进士携彭秀才来访遂书以赠之
638728,赠周仲鸣进士四首 其一
542331,冬夜宗考功子相宅同张比部士直钱进士惟重饯别方行人仲安使阙里便道还蜀
593236,朱进士子得邀饮同裕卿忠甫作
1236595,泰定丁卯八月十二日崇天门传胪赐进士右榜第一人阿察赤左榜第一人李黼皆肄业国学日新斋余西厅授业生也是日京尹备鼓乐旗帜麾盖甚都导二状元入学谢师拜余明伦堂榜眼刘思诚探花郎徐容尝因同年黄晋卿彭幼元从予游亦拜其侧其馀进士以门生礼来拜谢杂遝不记姓名圜桥门而观者万计都人以为斯文盛事昔未有也同寅举酒相属偶成四绝以纪其事
1236595,泰定丁卯八月十二日崇天门传胪赐进士右榜第一人阿察赤左榜第一人李黼皆肄业国学日新斋余西厅授业生也是日京尹备鼓乐旗帜麾盖甚都导二状元入学谢师拜余明伦堂榜眼刘思诚探花郎徐容尝因同年黄晋卿彭幼元从予游亦拜其侧其馀进士以门生礼来拜谢杂遝不记姓名圜桥门而观者万计都人以为斯文盛事昔未有也同寅举酒相属偶成四绝以纪其事
663435,归人哀为南海张进士作
27177,送进士李殷下第游汾河
485473,马氏西园宴别吴进士善卿
817304,国进士云浦斋中检得骑都尉白鹤亭旧诗数纸笔意迥异时蹊即同过访二首
410599,端阳至矣开笈得钟进士四图奇趣满抱乘醉命笔匪云讽议聊致轩渠 其二 移家图
680214,盛用章进士归省松江兼柬廷琛汝濂应辰诸君子
651869,邯郸赠贾进士使关中
638491,承吴献臣明府王日雨进士张廷实地曹饯别东山寺用地曹韵留别三首 其二
1009307,次韵参寥师寄秦太虚三绝句，时秦君举进士不得 其一
1127600,庆元戊午临江劝驾多士凡由进士科进者皆预焉且沿乡人饮酒之意叙坐以齿酒半使君又出杰句宠其行某陈人也偶睹盛事思有以记之敬嗣严韵二首极愧不工尚几镌削
1221480,挽沙子中进士
113225,次韵冕仲考进士试卷
492350,奉寄周思忠其先丞相益国公于余六世从祖常德府君为同年进士凡志铭哀挽及倡和诗文槩见于周氏所藏遗书当时尝录以归遭乱逸去因再请于思忠必有以相慰答也思忠有弟思廉极相友爱余往来城中尝寓其书舍云
921018,次韵参寥师寄秦太虚三绝句，时秦君举进士不得 其二
558092,送石廷坚进士出宰上杭
570490,詹东图进士以所刻石书见示为成二绝赠之 其二
169571,次韵杨内翰赠诸进士
206437,和冯亚寄进士孙磻
695363,重九日张侍御招饮元妙寺时董侍御林大行人泮及弟佥宪包进士咸在席酒酣因和张侍御旧游韵二首
1185175,擢进士
1057161,入内考进士同考官唱和三首 其一
535528,送周进士使淮便省 其二
681691,送同年翁进士晏归省
769091,壶中天·江亭寓中寄题张进士奕山学圃居即次原韵 其一
574007,和溪为程进士赋
1244407,寄王进士（伏睹前乡贡进士王礼子让所刻长留天地间集辱收谬作厕其间心窃愧焉而误名为昂因笔寄意二首） 其一
1244407,寄王进士（伏睹前乡贡进士王礼子让所刻长留天地间集辱收谬作厕其间心窃愧焉而误名为昂因笔寄意二首） 其一
230646,与进士宋严话别
642835,送进士会试之京
30123,寄进士卢休
1215977,三月七日廷试越三日奏进士榜名作
685278,送杨尚絅杨名甫毛贞甫陆全卿四进士归省 尚絅
514742,闻中山张进士錞除休宁知县诗以寄之
1188553,山中送进士刘蟾赴举
598692,赠方进士之任慈利
212485,庚午秋观进士入试
590447,赋雪次滁州孙环山进士韵 其九
469501,行部公安袁进士中郎过访
573354,南平社六人各一首 其四 中郎弟进士
494723,送乡进士刘子实归省广信永丰诗
1113438,集英殿立侍观进士唱名六首
553852,挽盛进士衍
1252082,再送唐进士士昭之京
329806,广安鹿呜燕送诸进士
597705,周进士挽诗四首 其四
589440,游大钵山西岩刘将军陆侯李三进士同集以横山最高处为韵赋诗三首 其二
21758,从军行·滥得进士名
103236,赠黄庭筠举进士
569440,李本建乡进士以其兄本宁大参之状来请铭其母匡得五言一律赠之
140649,集英殿立侍观进士唱名
566260,题田进士敬叔太素草堂一首
203407,寄卢进士·丈夫策定在吴钩
739285,送赵汉忠进士归常熟兼柬次山前辈
204430,赠进士叶授
530013,送周用宾进士访道入少华山
30807,送进士卢棨东归
681421,送金进士楷之涪州
669285,题李进士扇图
700429,送陆进士伯载还京四首
678927,送杨进士毕姻归姑苏
329576,次韵刘希道龙图鹿鸣燕进士
1110157,和鹿鸣燕进士二首
661576,次进士马中锡吴淑游京师西山韵八首 其二
638775,次韵周仲鸣进士题便面见寄
855066,谢陈进士见示诗赋并以为别
1207193,寄丁卯进士萨都剌天锡
1158017,伤进士严子重诗
656178,赠毕王二进士
650680,乙未三月一日策试进士读卷
1208936,送翰林应奉寿同海涯挈家觐省十首（供奉字弘毅至顺四年进士第二名辉和尔人自号清冰玉壶登第时寓居蓬莱真境） 其十
239049,送进士高枢拱辰
514587,送宗人德望进士还德兴
590210,为毛旸谷进士题风烟雪月梅卷四首 其四 月梅
1000022,涵碧阁东阳山水佳处予闻且久独未能往近得进士与邑官唱和诗读之景物依然如暂经目因次元韵附诸篇之末云
22426,寄陈去疾进士
650193,赠顾进士让南京刑部主事
999690,呈陆革进士
991590,答陈五进士遗山水枕屏
598233,赠周进士
548777,寿俞进士父 其二
530708,新水令带过折桂令　别仲华进士辛巳
499726,送刘进士允泰赴召
57511,喜张进士叔豫见宿旅舍
669105,题杨进士小像
27697,宣城送进士郑徽赴举
849859,寄居元职方北第呈西邻盛进士
382315,送进士都坚巴哈出宰三山
1179127,寄陈去疾进士
499640,寄刘进士伯琛 其二
1208935,送翰林应奉寿同海涯挈家觐省十首（供奉字弘毅至顺四年进士第二名辉和尔人自号清冰玉壶登第时寓居蓬莱真境） 其九
655202,承李士常进士以所和与李宾之内翰潘时用秀才冬夜联句之作见示用韵以答
133714,答陈进士谓之忆江东旧游见赠
1250282,至正庚寅岁分宜丞舒君尚翁浚治章湖寓宿白斜巡检署题诗壁间尚翁乙酉进士予故人也岁丙申经过白斜睹遗迹嘉循政因续其韵
863334,闻进士孙何及第因寄
743809,同邵进士晋涵寻益然大师塔不得
511479,弘治己酉春姜仁夫进士以使事贵州还取道广东过予白沙自己夘至丙戌凡八日辞别三首予亦次韵为别明日仁夫至潮连寨方十馀里遣隶回并得三绝和之通前九首吾与仁夫之意皆不在诗也岂尚多乎哉仁夫浙之兰溪从学章先生德懋吾廿年旧好故吾诗两及之 其三
1071879,先大夫元丰间及进士第荣州伯父喜而赋诗宣和四年信道兄登科某时为著作郎侍立集英殿与观唱名未几信道兄调而归某谨次伯父韵以送之
647989,送进士彭琉赴政和知县
271814,貂裘换酒·彭县赠向君南皋，名步瀛，戊戌进士，官至贵州劝业道
51461,同谢水部陈山人游虎丘王进士赠华荡酒与高家
435514,贾佐之以进士充军被挞
1182017,送进士田卓入华山
124246,呈胡希元进士
548264,二月十五日雨中同黎参议欧博士顾典客顾舍为钟丈人人沈进士黄文学永上人集王鸿胪宅得风字
501180,答豫章邓文若进士见赠并谢苏昌龄徵君
703863,赠黄仕明进士
508454,送陶进士希文南还
686985,定上人屡约游山不果近承寄示送孙景贤诗未及和答因刘进士仲炯游青原山赋此奉寄
1208927,送翰林应奉寿同海涯挈家觐省十首（供奉字弘毅至顺四年进士第二名辉和尔人自号清冰玉壶登第时寓居蓬莱真境） 其一
578282,题进士郑良所藏画二首 其二 悬崖梅
651141,金台春意图为夏进士赋
508448,送同年李进士郁归省
511483,弘治己酉春姜仁夫进士以使事贵州还取道广东过予白沙自己夘至丙戌凡八日辞别三首予亦次韵为别明日仁夫至潮连寨方十馀里遣隶回并得三绝和之通前九首吾与仁夫之意皆不在诗也岂尚多乎哉仁夫浙之兰溪从学章先生德懋吾廿年旧好故吾诗两及之 其七 次韵仁夫潮连寨见寄
223583,元德秀·进士能毋举
507838,喜钱进士习礼除翰林检讨赋此寄之
1245208,题族兄马子英进士梅花
1184571,伤进士谢庭皓
1224616,阅进士卷赋呈同院诸公
569263,袁丈宪副马大参冯少参薛进士邀游石湖
599944,送聂瑶峰进士知南陵 其二
1181262,作尉鄠郊送进士潘为下第南归
1181396,题进士王驾郊居
1109305,与宋次道舍人同在殿中覆考进士次道子侄同就御试赠次道二首
1234549,寄题进士宋翔仲书室 其二
1169372,送进士刘松
590208,为毛旸谷进士题风烟雪月梅卷四首 其二 烟梅
843915,金缕曲 郫县晤李干廷，名作桢，郫县人，庚辰进士，广东知县
1244398,和袁寅亮进士见寄
205302,为徐进士天隐赋辟谷和吟
745088,送陈进士
952897,寄耏门梁进士
551069,送丁亨文进士司理召陵 其一
863029,仙上人举进士过三十不第作诗曰男儿三十未有立人世百年徒自劳径拂衣削发为比丘今二十年矣精力甚健及将游天台既羡师行复自悔讼因其将行作诗纪之
535002,送陆进士令南昌
1103374,寄进士熊退斋 其二
849087,为徐进士天隐赋辟谷长吟
1178612,送丁大凤进士赴举呈张九龄
684552,汉阳二律皇陵宫殿木舟运汉阳夏口周进士仲方沽酒来别命二题各作联句 沽酒船
776698,哭家瑞陔进士
790459,唐制新进士杏园宴集三首 其一
878346,次韵徐守宴新进士
91024,谢进士张翼投诗两轴
744866,大玲珑山馆消寒第三集梧门学士出示所藏顺治壬辰乙未戊戌三科进士履历辄作长歌题其后
46714,送贾二进士归省
540939,用翟楼村进士原韵寄乃兄雩泉进士
540939,用翟楼村进士原韵寄乃兄雩泉进士
783163,哭陈进士宪图 其七
382940,春日同罗虞臣囧卿李本宁太史朱可大进士游摩诃庵得冬字
962459,殿中覆考进士
790461,唐制新进士杏园宴集三首 其三
1233125,奉寄陈进士村民 其二
526149,送陆进士伯载还京四首 其二
799566,赠蜀中李鹏海进士
1224695,天历庚午会试院中马伯庸尚书杨廷镇司业及玄皆乙卯榜进士偶成绝句纪其事出院明日有敕督修经世大典又成小诗寄诸弟 其五
1100057,和洪帅燕新进士
1180016,秋日怀贾随进士
514893,送刘进士瑱赴南京祠部主事
1245101,送奚仲瑛进士服阕朝京
1066515,辛卯次雾山大明院进士万廷老介来谒
511481,弘治己酉春姜仁夫进士以使事贵州还取道广东过予白沙自己夘至丙戌凡八日辞别三首予亦次韵为别明日仁夫至潮连寨方十馀里遣隶回并得三绝和之通前九首吾与仁夫之意皆不在诗也岂尚多乎哉仁夫浙之兰溪从学章先生德懋吾廿年旧好故吾诗两及之 其五
638296,次韵石斋先生赠姜仁夫进士三首 其一
164042,闻喜宴薛和御制惕进士诗
217255,寄耏门梁进士
1244179,经周进士闻孙墓二首（次首重到一本另起） 其二
1219877,送张仲举归晋阳举进士 其一
4566,送洗然弟进士举
1208930,送翰林应奉寿同海涯挈家觐省十首（供奉字弘毅至顺四年进士第二名辉和尔人自号清冰玉壶登第时寓居蓬莱真境） 其四
1223788,大廷策士问经世之道仆忝在读卷之列观诸进士所对有感赋此录以赠别刘性粹中支渭兴文举二贤良
388064,送彭进士谪江右
666047,西湖同李水部孟玉詹进士泮
928280,丫头岩见周洪道以进士入都日题字
651876,赠舞阳朱进士
480834,终南进士行为刘主事廷美赋
892382,呈胡希元进士二首 其二
548199,戏调浦进士 其二
983838,饯送蜀进士入奉廷对
194720,赠陈进士·民生委所穷
813625,赠朝鲜进士金山泉
660384,酬陈德光进士见访用前韵
1041377,李觏以太学助教召曾巩以进士及第归俱会郡下素闻两人之贤留饮涵虚阁
778511,贺新郎  萧山任千之成进士归里作此词以赠之
1163391,逢进士沈彬
510224,读林进士信宜祭母墓文 其二
148633,免解进士应致远过晋康见谓以上文字而忤权要
634154,酬夏戒庵进士
1233124,奉寄陈进士村民 其一
658523,送周进士炯还常熟觐省
672593,送董启之进士
517377,梦萱堂为孙进士子良题 其一
544786,寄朱可大进士
507682,怀元进士龚友孚
884643,诸公劝楚真叟应进士举以诗勉之
678742,送陈进士徽仲归三山
615992,饮同年萧伯懋太史宅与刘韶也进士同集
568725,四十咏 其十一 殷进士都
690190,秋兴同商进士景贞押韵作
678923,送林季聪进士使三湘图
1180990,遇叶进士
551327,分得宫花一万树送曹能始进士赴阙
712467,贺家植普进士
526544,秋兴同商进士景贞押韵作 其三
1045902,次韵刘希道龙图鹿鸣燕进士
1041253,宴得解进士
542584,夏日郑园陪饯皇甫子循别驾同沈禹文参军元仰之给事王元美比部沈子文刘朝宗进士赋此
594155,送臧进士晋叔赴教荆州五首 其四
173046,寄何宣仲·同年进士同坛僧
544206,送赵进士使太原
1224692,天历庚午会试院中马伯庸尚书杨廷镇司业及玄皆乙卯榜进士偶成绝句纪其事出院明日有敕督修经世大典又成小诗寄诸弟 其二
1195051,哭进士李洞二首
1022263,送进士万知古
602230,送陈士鹄赴进士举兼柬黎惟敬欧桢伯梁彦国诸公
528551,送卫进士推武昌
511482,弘治己酉春姜仁夫进士以使事贵州还取道广东过予白沙自己夘至丙戌凡八日辞别三首予亦次韵为别明日仁夫至潮连寨方十馀里遣隶回并得三绝和之通前九首吾与仁夫之意皆不在诗也岂尚多乎哉仁夫浙之兰溪从学章先生德懋吾廿年旧好故吾诗两及之 其六
510298,赠张进士入京 其五
509339,庆左进士赞擢稽勋主事
585780,为黄肖甫进士寿亲六十一华诞
1208929,送翰林应奉寿同海涯挈家觐省十首（供奉字弘毅至顺四年进士第二名辉和尔人自号清冰玉壶登第时寓居蓬莱真境） 其三
1035198,燕甲戌进士归自都城(水调歌头)
658576,送盛进士应期归娶吴中
610220,赠黄仕明进士 其一
1238459,曹居贞进士月下弹琴图引
479517,送曹进士知贵池
526148,送陆进士伯载还京四首 其一
878412,学进士作大方无隅二首 其一
675180,送顾进士使浙纂修
14198,送进士刘师服东归
490658,十四夜与方司训金进士临水玩月
31059,题进士王驾郊居
569700,吴母六十寿言母长斋三十年有子富而好道筑净乐宫七真堂于齐云岩顶进士李元泾索句寿之
789944,题终南进士图
479856,林缉熙县博张廷实进士何孝子子完先后见访既而缉熙往平湖廷实归五羊子完还博罗因赋四绝 其一
192634,予以缙云进士周启明长书呈秘阁黄少卿黄颇歎
184403,悼毕进士·磨励灯前志
681395,象峰扫松送林进士诚
526543,秋兴同商进士景贞押韵作 其二
594152,送臧进士晋叔赴教荆州五首 其一
439072,同新进士吕子成辈宴集状元楼
593875,送阎进士俊甫宰蕲水
1244335,和周宗瑾寄彭南暝进士韵
1150235,赠进士章碣
1215976,三月七日廷试进士读卷作
1000431,奉和御赐进士诗
783062,丙子岁暮得王进士简泉书却寄 其二
893272,送袁进士赴举
691489,和答顾进士孟乔
195124,林进士数见过又遗一诗辄以奉报
1026585,之祀奉呈同行二进士
991967,吊裴易进士
1000200,范钺进士遗楼彻司马庭石以质交楼作诗美之因邀某同作
21923,送进士陈峣往睦州谒冯郎中
89331,挽林进士·一门皆擢第
592881,陈使君敬甫张进士于皋过斋中对菊
887408,兄弟同登进士
515185,送徐中行进士
38271,宿沉彬进士书院
1162838,宣城送进士郑徽赴举
494474,答安福乡进士周君得之所问八条后赋此
870401,寄韩丕进士
158044,和施耕进士忆竹
790460,唐制新进士杏园宴集三首 其二
524261,送熊进士入朝三首 其二
1185209,赠进士李德新接海棠梨
481429,喜张进士叔豫见宿旅舍
517420,杨进士新卜幽居
661578,次进士马中锡吴淑游京师西山韵八首 其四
637092,送进士马克毅还新会
1219878,送张仲举归晋阳举进士 其二
1223260,次韵进士宋显夫海岸春行
601532,萧进士给饟辽东便道汉阳省觐
523244,别田进士
83333,丫头岩见周洪道以进士入都日题字
695911,题王进士子牧琼林宴归图二首
694433,读林进士信宜祭母墓文
582395,送伍孟伦进士归省
1169340,和彭进士感怀
529967,题潘进士赠谢昌邑雪山图
511480,弘治己酉春姜仁夫进士以使事贵州还取道广东过予白沙自己夘至丙戌凡八日辞别三首予亦次韵为别明日仁夫至潮连寨方十馀里遣隶回并得三绝和之通前九首吾与仁夫之意皆不在诗也岂尚多乎哉仁夫浙之兰溪从学章先生德懋吾廿年旧好故吾诗两及之 其四
672123,通州秋夜与进士冯子佩言别
177295,寄韩丕进士
510299,赠张进士入京 其六
35758,寄进士贾希
1116744,和黄鲁直效进士作二首 岁寒知松柏
511478,弘治己酉春姜仁夫进士以使事贵州还取道广东过予白沙自己夘至丙戌凡八日辞别三首予亦次韵为别明日仁夫至潮连寨方十馀里遣隶回并得三绝和之通前九首吾与仁夫之意皆不在诗也岂尚多乎哉仁夫浙之兰溪从学章先生德懋吾廿年旧好故吾诗两及之 其二
538337,张通政宇清周比部济叔沈进士子善饯予昆山有作
638891,赠方纯吉进士尹平阳
530196,访许进士台仲九杞山中二首 其二
1163550,寓居岳麓谢进士沈彬再访
30749,秋夜不寐寄崔温进士
118364,观试进士呈试官
607455,读王进士下第时所拟宫词六十首为赋四绝 其二
514851,贞寿堂寿浮梁范进士玶母
30813,送进士赵能卿下第南归
171250,寄居元职方北第呈西邻盛进士
685199,至滇南次答陆进士震韵
968972,赠隆中黄进士
962470,过丹山访黄元英不值英壬子岁正资州所解进士也
585739,已酉三月廿五予卧病潘进士直卿槐告别索予赠言呻吟之间遂成一绝赠之还邕州
1246100,明斋诗为湖广陈进士赋
1244408,寄王进士
677789,寄唐进士震
533953,唐别驾惟良招同康山人蒋进士集郡斋
569997,尚进士请告扶侍者十五年渡江见访索诗为赠
1224690,泰定丁卯八月十二日崇天门传胪赐进士右榜第一人阿察赤左榜第一人李黼皆肄业国学日新斋余西厅授业生也是日京尹备鼓乐旗帜麾盖甚都导二状元入学谢师拜余明伦堂榜眼刘思诚探花郎徐容尝因同年黄晋卿彭幼元从予游亦拜其侧其馀进士以门生礼来拜谢杂遝不记姓名圜桥门而观者万计都人以为斯文盛事昔未有也同寅举酒相属偶成四绝以纪其事 其二
1224690,泰定丁卯八月十二日崇天门传胪赐进士右榜第一人阿察赤左榜第一人李黼皆肄业国学日新斋余西厅授业生也是日京尹备鼓乐旗帜麾盖甚都导二状元入学谢师拜余明伦堂榜眼刘思诚探花郎徐容尝因同年黄晋卿彭幼元从予游亦拜其侧其馀进士以门生礼来拜谢杂遝不记姓名圜桥门而观者万计都人以为斯文盛事昔未有也同寅举酒相属偶成四绝以纪其事 其二
57825,宿资胜寺与王文玙进士夜谈
561587,宫保顾公吏侍张公被命校文仆承乏礼曹知贡举予三人者弘治乙丑同年进士也孝皇赐第距今三十有四年矣顾公有诗纪遇志感余嗣和焉 其二
542555,送栾进士孔原使宣大
680645,题感山寺次涂太守恒孚车进士之韵
177797,闻进士孙何及第因寄
783164,哭陈进士宪图 其八
1245159,送进士都坚巴哈出宰三山
665720,陈遂初进士邀宿赪谷草堂夜观西湖渔火
996688,次韵冕仲考进士试卷
1208636,送范悦古赴江西宪掾（悦古名亭曲进士不第掾江西宪久之以诬罢去又中乡举会科场废御史辨其冤复为江西宪掾）
32731,擢进士·霓旌引上大罗天
661577,次进士马中锡吴淑游京师西山韵八首 其三
598749,赠霍悦来进士还京
142499,和邹进士·望外青山便到家
22940,池州春送前进士蒯希逸
637169,试院中读黄鲁直和冕仲考进士之作依韵赋之
1000000,寄陈介进士
87053,次江权军宴新进士韵
594041,署中答臧进士晋叔因柬余进士君房
594041,署中答臧进士晋叔因柬余进士君房
228201,勉癸丑新进士
534499,重阳后九日过赵特峰庭菊盛开主人索酒于周迹山主政迟酌不至时赵以进士乞教授因戏呈兼简迹山
548198,戏调浦进士 其一
299823,兰陵赠庄书采进士
873577,鹿鸣燕诗送诸进士
101035,成都进士杜暹伯升出家名法通往来吴中
1190250,赠进士李守微
607023,别杨弼泰进士归汉中杨久谪贵筑
49884,送曹能始进士北上
689945,赋雪次滁州孙环山进士韵
902768,集英殿立侍观进士唱名六首 其五
494658,赠霍渭先进士毕姻归南海长律一百韵
581603,送琼台胡宗周进士荣归
548640,寿米坤泉户侯七十米二子伯举武进士仲举进士
548640,寿米坤泉户侯七十米二子伯举武进士仲举进士
902771,集英殿立侍观进士唱名六首 其二
542341,送何进士振卿谪乐平少尹
491968,赠帖有道进士自成都之官舒城
783158,哭陈进士宪图 其二
93320,四月十七日侍立集英殿观进士唱名
593622,淩进士出知合肥归拜敕封贞节祖母张太安人索诗为寿时太安人八十有七子以建昌太守侍养于家孙则进士及乃兄乡贡士也
593622,淩进士出知合肥归拜敕封贞节祖母张太安人索诗为寿时太安人八十有七子以建昌太守侍养于家孙则进士及乃兄乡贡士也
593205,初至燕京袁文谷邢子愿梁孔适三进士朱在明顾叔潜二光禄汪太学仲淹同集黎秘书惟敬宅得春字
169912,次延平郡文学宴新进士韵
585252,和顾工部送成孔二进士回京
521423,送刘宗哲进士尹束鹿
1169341,和蒋进士秋日
52097,王进士直夫僧房见招
171348,长沙鹿鸣宴送诸进士
517617,送马进士之姑塾
369559,先大夫元丰间及进士第荣州伯父喜而赋诗
105633,闻进士贩茶
511623,题御史傅实进士画像
533232,送方进士季邻之乌程
766843,水调歌头 其二 吴元符进士證仙
522826,九子浴九首 戴进士仲鹖 其八
855115,林进士数见过又遗一诗辄以奉报
558638,送潘络克理进士之京
688382,约轩为余进士题二首
158190,呈陆革进士
1181326,闻进士许彬罢举归睦州怅然怀寄
621055,湖上答赠朱子庄进士
713090,上元日邑侯徐戢斋招同佘齐枢进士游允陵梁殿一殿张佘兼五卢闻仲严孚长燕集青云山阁即事赋谢二首 其二
1248050,杨进士载酒亭卷
593935,冬夜同李比部黎司勋黄李二进士集金舍人宅和得比部二韵 其二
59811,题西陵送别图送姚进士
29284,和彭进士秋日游靖居山寺
695289,赠周仲鸣进士四首
1169407,酬进士秦颙若
329577,和鹿鸣燕进士
