1208363,送高丽进士李仁复东分题得箕子庙
179681,恭和御制赐进士诗韵
560751,题杜进士公馀清玩画卷八绝 其一
590440,赋雪次滁州孙环山进士韵 其二
270864,赠蜀中李鹏海进士
93228,和御制琼林宴赐进士余复等诗
739397,赠顾进士复初
541754,徐州同朱进士登子房山
1235913,送翰林应奉寿同海涯挈家觐省十首（供奉字弘毅至顺四年进士第二名辉和尔人自号清冰玉壶登第时寓居蓬莱真境）
85233,乡间人有误以予为武进士者戏纪以诗
32230,寄进士崔鲁范
560992,赠王克明进士之吉郡
658414,送杨尚絅杨名甫毛贞甫陆全卿四进士归省 其一 尚絅
621006,将至五云泊舟同黄献君进士閒步刘须弥侍御园亭时侍御官楚中因赋
671580,柬熊玄年有怀金正希太史尹宣子进士
607454,读王进士下第时所拟宫词六十首为赋四绝 其一
569595,董徐二进士见访山园守公留晏而余以扫墓东归不复称主人赋此志愧且订后期
638183,重九日张侍御招饮元妙寺时董侍御林大行人泮及弟佥宪包进士咸在席酒酣因和张侍御旧游韵二首 其一
1099693,题郭进士所进万世宝鼎鉴
680814,送乡进士金台王君载道
745242,立夏后荆溪周进士济偕徐吕诸子放棹过香溪招余游西山 其二
592364,送邵进士还馀姚
580072,次前韵送陈进士
579009,汉阳二律皇陵宫殿木舟运汉阳夏口周进士仲方沽酒来别命二题各作联句 其一 沽酒船
1035604,送外甥李渭进士赴举
585809,赠苏仁伯何于逵霍勉衷三进士之京二首 其一
1252615,经周进士闻孙墓二首（次首重到一本另起）
1219298,送许具瞻进士
953643,圣俞在南省监印进士试卷有兀然独坐之叹因思去岁同在礼闱慨然有感兼简子华景仁
31188,和进士张曙闻雁见寄
509208,送姑苏潘进士暄淮府造坟事竣还京
1196177,寄孟进士
531308,送杨仲立进士归省
660396,赠曹进士子进知兴化
560755,题杜进士公馀清玩画卷八绝 其五
674753,送汪进士奏回毕姻
379675,改德士颂·德士旧尝称进士
554993,乡贡进士三山王士奇大父母挽诗二首 其一
1045904,和鹿鸣燕进士二首 其一
685747,题进士郑良所藏画二首 折梅枝
590209,为毛旸谷进士题风烟雪月梅卷四首 其三 雪梅
671985,送郭翔鹏进士知福宁州兼寄州倅马庭简
658862,送尤宗阳进士之京 其二
508192,和答顾进士孟乔 其一
614693,送李柱可进士南还
52026,沅溪潘进士在长安逆旅中见庭下山丹花诘其主
49061,马氏西园宴别吴进士善卿
65286,行部公安袁进士中郎过访
527640,大梁吟送李进士
589441,游大钵山西岩刘将军陆侯李三进士同集以横山最高处为韵赋诗三首 其三
999701,走笔依韵和杨进士倜登南楼之作
658415,送杨尚絅杨名甫毛贞甫陆全卿四进士归省 其二 名甫
37530,寄静林别墅胡进士兄弟
672299,次廖师贤进士十日再登乌石山韵
146966,留守参政大资范公余同年进士往岁帅桂林题刻
695045,周进士挽诗四首
921677,和黄鲁直效进士作二首 其一 岁寒知松柏
1034004,留守参政大资范公余同年进士往岁帅桂林题刻最多四方传之暇日尝与同寮遍观因即公所名壶天观题数语
491649,寄赠陈侯短歌并柬项性高陈宗舜二进士
509209,景泰改元正月一日王潘二进士赍敕奖劳亚卿杨公有清勤公正之褒且有金帛之赐诗以贺之
533944,同陈德基胡进士李季常同集吕心文园亭
1187255,和王昭符进士赠洞庭赵先生
196274,效进士作三年通一经
514846,送王进士元聘之山东分采实录
582061,喜亚夫进士将选寄以期勉
559872,送韦进士
1111812,余壬戌春校试进士同事者五十五人至戊子岁因阅小录所存者止四人感而有作二首
882950,悼毕进士
540902,送管励山进士尹六合
1179981,往年进士赵能卿尝话金庭胜事见示叙
30994,作尉鄠郊送进士潘为下第南归
649109,送进士赴南京刑部主事
561560,送进士卢木伯宰嘉兴 其一
1100069,次韵梯飙明府燕新进士一首
432815,端阳至矣开笈得钟进士四图奇趣满抱乘醉命笔匪云讽议聊致轩渠 嫁妹图
73711,寄丁卯进士萨都剌天锡
526150,送陆进士伯载还京四首 其三
591995,观上虞谢进士读书山房图
1035620,送进士孙磻赴举
648091,晚次景州遇李颀给事吕文质进士
4461,送丁大凤进士赴举呈张九龄
587136,阅历科进士录 其四
1148768,明经进士语
922765,刘顗宫苑，退老于庐山石碑庵，顗，陕西人，本进士换武，家有声伎 其三
514093,寄进士金溪尹黄硕夫
519865,送许进士还朝季升都宪之子
1009306,次韵参寥师寄秦太虚三绝句，时秦君举进士不得 其三
638964,赠袁阳健夫进士尹上元
502598,浮峰歌送进士陈以义贡京师
159411,次韵和度支苏员外覆考进士文卷锁宿景福殿
913975,三月二十六殿试进士待罪集英殿门二首 其一
1043621,与宋次道舍人同在殿中覆考进士次道子侄同就御试赠次道二首 其一
578281,题进士郑良所藏画二首 其一 折梅枝
523143,李进士醉归图歌
203899,挽制干·曾见端平进士评
672710,次韵答赵叔鸣进士
585634,以建古冚山代券付曾我山唯卿进士收管
193020,喜王虞部赐进士及第
638735,元妙观陪张淳安明府周仲鸣进士诸公夜话
52158,题进士卜友曾瘦马图
159494,送齐进士奉章阙下
604671,为毛进士具茨题其大父中丞公墓
134306,之美举进士寓京师范此诗寄之
996317,效进士作观成都石经
542790,送徐进士子绳谪建阳少尹 其三
93322,四月二日进士唱名以省试官待罪殿庐遇林
1253264,送乡贡进士钱宗善馀庆吴时纬仲文吴克潜纲赴京会试
1000194,和施耕进士忆竹
745053,扬州别宋学博家进士
510294,赠张进士入京 其一
673103,送刘进士克立知屯留
1035174,木兰花慢 宴遂宁新进士
362698,次韦进士书城见赠移居四首原韵奉酬
510270,戏题顾进士琼林宴图
1181320,送进士吴延保及第后南游
1000071,酬杨立之进士见赠
852885,元英先生家鸬鹚步当文正时其裔孙楷登进士赠之诗云唐家三百年冠盖谁有诗书到远孙予家自严徙徽而谱系远矣因览石刻次韵左方
343319,武龙道中·四十年前前进士
533266,同李阳谷袁进士暨儿琰夜集得峰字
519661,灞桥别意送徐进士还京
510210,林缉熙县博张廷实进士何孝子子完先后见访既而缉熙往平湖廷实归五羊子完还博罗因赋四绝 其四
493184,题墨梅赠进士刘允恭
1225694,送新进士还蜀
160083,之祀奉呈同行二进士
570489,詹东图进士以所刻石书见示为成二绝赠之 其一
547536,春日同罗虞臣囧卿李本宁太史朱可大进士游摩诃庵得冬字
1190140,寄进士贾希
508612,送胡进士拱辰宰黟邑
523251,故人殷进士特使自寿张来兼致怀作仆离群远遁颇有游陟之志酬美订约遂有此寄
1224328,进士张于高得邛州判官归成都
593918,西署赠杨进士道行
754629,岁暮张子白进士过访竹士
593620,送魏进士懋明司理荆州
524262,送熊进士入朝三首 其三
683891,乡进士邹道甫以严君之命借听于余余实无得也不忍逆其意以二绝酬之
510281,次韵廷实进士送伦长官出游
206640,送外甥李渭进士赴举
1248032,期万佥宪杜进士徐校理游张林山
22011,赠元和十三年登第进士
410601,端阳至矣开笈得钟进士四图奇趣满抱乘醉命笔匪云讽议聊致轩渠 其四 沽酒图
30268,寄徐济进士
781980,送施进士汉仪云翔就诠
650306,二月廿五日夜写进士榜复命
1174338,池州春送前进士蒯希逸
633440,荔枝行送彭进士骏孙归海盐
