30993,送进士王驾下第归蒲中
953714,和公仪试进士终场有作
658107,送高大用进士放回
1208231,宿村庄，见高进士留题，戏作
581580,象山别意送梁进士北行
336092,宫词·庭试初宣进士班
158998,感怀寄进士胡肃
648694,送罗崇本进士归省
578876,陪白冬官张进士游西湖
604335,赠刘浴之进士令盐城
979368,北京水后往棣州试进士
999199,试院中秋效诸进士作月涌大江流
526352,咏扇画寄诸故人八首 其二 咏山水寄易后斋进士
1158291,奉酬崔璐进士见寄次韵
217433,春日送袁成进士北归
30047,广陵秋日酬进士臧濆见寄
990947,池州进士陈生惠然见过不日且行因以诗赠别
21922,山中送进士刘蟾赴举
854069,邵武宴进士致语口号
58807,和颍州张进士飞花曲
651811,夏溪书舍为刘进士赋
560203,送同年田进士
624073,送梁进士器圃出宰景陵
699053,送丁亨文进士司理召陵
679103,访杨维立进士留赠
699211,游大钵山西岩刘将军陆侯李三进士同集以横山最高处为韵赋诗三首
1207858,赠海康举进士者
526151,送陆进士伯载还京四首 其四
530674,踏莎行　夜饯良谋进士入函谷已已
347437,入内考进士同考官唱和
740294,晋王宫漆碗歌和齐进士翀
509201,题沈进士纪松月扇面
481318,寄奚元启顾文之二进士
1114948,寄进士熊退斋
808476,前进士
577473,寄翟进士溥福
1159833,送前进士蔡京赴学究科
578297,题郑进士雨竹二首 其一
561725,辛丑三月十七日直宿无逸殿奉旨同阁老翟公详定进士试卷遂命充读卷官故事礼卿不得预此盖特命云
557813,金牛思阡词为柯在亨进士赋
534719,秋风二章送杨进士赴守濮州 其二
515687,送进士李应灵赴宣城知县
93562,三月二十六殿试进士得罪集英殿门
542321,秋夜雪后同王给事以宁集胡进士文澄宅予病先归
534737,怀李进士材二首 其一
25326,送进士许棠下第东归
472748,同谢水部陈山人游虎丘王进士赠华荡酒与高家惠泉伯仲也
494445,题日惺斋为杬上舍封兼似乡进士郑世迪
987453,甥舅同登进士亦世之不易得者今幸逢其会因吟一律以寄一以表祖宗积善之徵二以谢圣主宠赐之荣三以致勉忠之意二子惟勖诸
516720,挽王进士
1244227,重和荅周闻孙进士兼寄宗瑾
859442,宝应二三进士见送乞诗
508639,徐进士父挽诗
593623,送徐进士懋吴司理袁州
581757,送杨进士尹新喻
537295,送彭进士谪江右
30839,闻进士许彬罢举归睦州怅然怀寄
46607,金进士宿江馆阻雨连夕
542792,送徐进士子绳谪建阳少尹 其五
560298,为李进士题竹
178156,商州进士张齐说将赴春闱以诗别冯中允冯君酬
536667,嘉靖丁未夏四月余以进士隶大理得左寺凡九人朝夕甚乐也又明年六月则八人者以次授去独予在晨候大吏升揖散步空馆顾影凄然为赋一章
580762,送进士林公器宰永嘉
58827,朱天昭始第进士主余家至明年移居西邻
609846,别刘觐国时初成进士 其二
504029,送进士万嵩会试
593777,题王进士子牧琼林宴归图二首 其一
509411,送王进士
578298,题郑进士雨竹二首 其二
1250279,小留豫章袁尚志归自浙右得刘伯温书并寄吴兴温国宝笔十枚感其远贶一诗奉寄伯温名基处州青田人举进士为高安丞再迁江浙儒学副提举
158867,河北送洪景之进士如荆南
712681,端州至日黄敬旃进士招同叶渊发周维念集七星岩
46771,与杜进士寅登白莲阁对雨
492026,定上人屡约游山不果近承寄示送孙景贤诗未及和答因刘进士仲炯游青原山赋此奉寄 其一
358637,追凉晚步邂逅张云卿王文辅王子正三进士同行
592988,秋晚同陈使君张进士饮喻园五首 其三
578953,吴江雪舟三山进士林谨夫父子微时所作图也
598747,送李兰亭进士还京
610219,赠同年关德甫吴用潜成进士 其二
550748,送邓汝高进士还朝 其一
548311,送赵进士谒选
173050,仟上人举进士过三十不第诗日男儿三十未有立
638733,陪周进士仲鸣谒思范亭小酌成诗二首 其二
781988,为张建侯进士写照竣赋此赠别
1224693,天历庚午会试院中马伯庸尚书杨廷镇司业及玄皆乙卯榜进士偶成绝句纪其事出院明日有敕督修经世大典又成小诗寄诸弟 其三
304209,闻近日求人书者以进士为贵戏作一绝
592205,送戚进士世秀请告归泗州毕姻
511645,送进士钱景通赴青州堆官
530281,过陈进士遂初湖上草堂
1181330,哭进士李洞二首 其二
364297,与宋次道舍人同在殿中覆考进士次道子侄同就御试赠次道
560756,题杜进士公馀清玩画卷八绝 其六
510223,读林进士信宜祭母墓文 其一
579536,送陈梦祥进士奉使还家
510208,林缉熙县博张廷实进士何孝子子完先后见访既而缉熙往平湖廷实归五羊子完还博罗因赋四绝 其二
952839,春日送袁成进士北归
27819,奉酬崔璐进士见寄次韵
1179892,广陵秋夜读进士常修三篇因题
1035765,和进士田亚夫见赠
214324,秋日登楼客次怀张覃进士
533464,同张别驾梁进士管山人乾上人过晓上人方丈
30477,赠进士李德新接海棠梨
177253,和朱玄进士对雪
968942,勉癸丑新进士
1215367,送马彦翚进士赴江西省筦勾二首 其二
517380,梦萱堂为孙进士子良题 其四
559813,送同年田进士
514005,节庵倪先生以经学教于乡既成其子进贤举进士为御史又出其馀以淑乡之人其在德兴孙司马之塾最久予过婺源望先生之庐尚远不能往拜漫成一律奉寄
983943,蜀进士许成子魁天下用其殿前赋诗韵以志喜
534497,醉后作呈赵南特进士
510300,赠张进士入京 其七
183402,和丘与权秘校咏宝寄林成之进士
877727,陪新进士公宴用太守韵
704963,送聂瑶峰进士知南陵
625882,送严庶华进士归西湖
489216,张进士父绍轩八十五初度
1160609,崔中举进士游岳阳遇真人录沁园春词诘其姓名荐之李守排户而入惟见留诗于壁
681527,进脩斋为彭进士题
609845,别刘觐国时初成进士 其一
503298,冶城遇集呈陈绅进士因观故人陈则诚博士书至
680974,送萧进士归省
130198,元英先生家鸬鹚步当文正其裔孙楷全登进士赠
1176619,奉和袭美酬前进士崔潞盛制见寄因赠至一百四十言
592986,秋晚同陈使君张进士饮喻园五首 其一
634155,赠何半千进士
1224696,天历庚午会试院中马伯庸尚书杨廷镇司业及玄皆乙卯榜进士偶成绝句纪其事出院明日有敕督修经世大典又成小诗寄诸弟 其六
30163,秋日怀贾随进士
337660,题郭进士所进万世宝鼎鉴
579728,约轩为余进士题二首 其二
1179891,广陵秋日酬进士臧濆见寄
1236544,奉寄陈进士村民
558637,送陈进士之京
1181307,贺进士骆用锡登第
638729,赠周仲鸣进士四首 其二
1242080,送乡贡进士钱宗善馀庆吴时纬仲文吴克潜纲赴京会试 其二
583207,至滇南次答陆进士震韵 其二 谒黔宁王祠
29274,酬进士秦颙若
590678,次醴陵刘两塘进士韵
158049,前日以诗赠贾麟进士繼蒙和答而杨蟠从事亦随
534738,怀李进士材二首 其二
669191,送朱进士北上应试
684244,送周进士使淮便省
1217516,汝州园亭宴集奉答太守胡敬先进士摩哩齐德明
881367,寄卢进士
1049027,次韵杨久中将试进士
30995,送进士韦序赴举
304827,哭家瑞陔进士
1116658,次韵参寥师寄秦太虚三绝句，时秦君举进士不得
629583,寄怀舒碣石进士
329782,进士·里有宾兴方启燕
581115,赠世杰进士谢病归潮阳
525670,进士蒋君养孚会余天柱峰下授宗伯公移
140055,赴遂宁进士期集即席赋
558277,与范进士同宴金鳌阁赋此奉送兼柬黄佥宪
658995,董谕德文玉归省其父太守德初诗以寄之德初余同年进士也
590441,赋雪次滁州孙环山进士韵 其三
1089070,诗送荆州进士入都
699027,送邓汝高进士还朝
657924,送冯进士之京
745241,立夏后荆溪周进士济偕徐吕诸子放棹过香溪招余游西山 其一
681865,李祥进士父南塘先生还东广
526542,秋兴同商进士景贞押韵作 其一
489211,重阳前五日买菊数本招苏进士张中翰张户部小饮
631014,酬彭进士羡门二首 其一
551299,送曹二进士之金溪吊周明府
863589,送郑南进士归洪州
99778,次韵参寥师寄秦太虚三绝句时秦君举进士不得
92553,拟进士金波丽鳷鹊诗
1165520,赠进士顾云
473439,送曹能始进士北上
787515,送王熙甫始举进士之官吏部
926350,题林进士玉芝西涧小隐
663494,送张进士孔昭赴南刑部
683839,詹东图进士以所刻石书见示为成二绝赠之
782870,国进士云浦斋中检得骑都尉白鹤亭旧诗数纸笔意迥异时蹊即同过访二首 其一
510296,赠张进士入京 其三
1051272,题李进士连云玉山图像
673306,与林方伯世调叶学谕茂才乡进士世增洎堂兄文厚夜泛分得鸟惊二韵时乙丑岁十一月十三日
485189,登江阁远怀徐记室与杜进士同赋
782871,国进士云浦斋中检得骑都尉白鹤亭旧诗数纸笔意迥异时蹊即同过访二首 其二
554330,华盖殿读卷放进士榜
1183774,哭李进士
86957,次韵徐守宴新进士
230020,燕漕司进士小诗奉勉
899109,江城子 和吕丞送进士赴省
610221,赠黄仕明进士 其二
682050,寿俞进士父
560416,刘约之进士却金图
658444,送袁进士翱纂修
528132,冬夜过饮戴时亮进士
1181316,送进士王驾下第归蒲中
916406,予以缙云进士周启明长书呈秘阁黄少卿黄颇叹重作诗六韵美之因次韵和酬
103717,吊裴易进士·力学未及仕
682131,送邹进士南皋谪戍贵阳二首
607456,读王进士下第时所拟宫词六十首为赋四绝 其三
650520,赠进士钱稽穑佥宪湖广
33554,送进士苏瞻乱后出家
30107,湘中见进士乔诩
914434,和御制琼林宴赐进士余复等诗
510301,赠张进士入京 其八
1034885,燕新进士
137355,礼部贡院阅进士就试
1214704,日出柳树东哀刘先生也先生字环翁登进士第授建德录事卒于都下
351766,诗送荆州进士入都
688693,宫保顾公吏侍张公被命校文仆承乏礼曹知贡举予三人者弘治乙丑同年进士也孝皇赐第距今三十有四年矣顾公有诗纪遇志感余嗣和焉
902767,集英殿立侍观进士唱名六首 其六
482737,题周进士古木清猿图
1032057,秋日登楼客次怀张覃进士
610108,赠林元培进士
582060,从弟亚夫进士自南安寄书至喜而赋此寄京答之
665172,兴田再逢卓进士起嵓
483920,题进士卜友曾瘦马图
658416,送杨尚絅杨名甫毛贞甫陆全卿四进士归省 其三 贞甫
542591,秋夜灵济宫同薛朱二进士赋
1216334,留别同乡严进士
560752,题杜进士公馀清玩画卷八绝 其二
1147528,保大五年元日大雪同太弟景遂汪王景逖齐王景逵进士李建勋中书徐铉勤政殿学士张义方登楼赋
202999,州学饯送解发进士
1244299,避地石洞有怀罗处士就柬周以立进士
1187593,和进士张曙闻雁见寄
110682,赠诸进士
746492,赠朝鲜进士金山泉 其一
634010,送罗澹峰进士入都改除 其二
575771,寄郑进士毅德宏
511643,送进士邓珙荣归
609847,别刘觐国时初成进士 其三
580994,和沈进士秋兴
558192,贺吴章仲子登进士第
373478,送陈进士游江南
590443,赋雪次滁州孙环山进士韵 其五
579727,约轩为余进士题二首 其一
713140,送张畏岩进士归吴门兼怀孙赤崖二首 其一
37799,寓居岳麓谢进士沉彬再访
551053,邓汝高进士转饷辽东便道过家见访喜赠
1059606,追凉晚步邂逅张云卿王文辅王子正三进士同行
631015,酬彭进士羡门二首 其二
270837,贺新郎·萧山任千之成进士归里作此词以赠之
1188155,山中寒夜呈进士许棠
485001,送贾二进士归省
554643,赵进士梦萱堂
673342,与竹为二陈进士乃尊题
510753,寄张进士廷实
28865,送友人进士许棠
158548,依韵和答陆革进士招饮池上诗
1078868,次韵方守送进士
560987,胡进士出宰东阳便省尊翁佥宪送赠
527145,双节为简辅进士庶母洎姊作
625883,寄严矱庵侍御兼致令弟庶华进士
921678,和黄鲁直效进士作二首 其二 款寨来享
633930,送徐进士元定归南昌
499711,奉柬曾进士得之
102843,送方进士游庐山
508193,和答顾进士孟乔 其二
658861,送尤宗阳进士之京 其一
492027,定上人屡约游山不果近承寄示送孙景贤诗未及和答因刘进士仲炯游青原山赋此奉寄 其二
1180049,送进士臧濆下第后归池州
112392,寄进士熊退斋
324345,郡燕新进士胡文侍读即席赋诗因次其韵
574905,寄浦进士文玉用其韵
159053,庚午春观新进士锡宴琼林苑因书所见
30086,广陵秋夜读进士常修三篇因题
671872,进士顾君乞假归省徵双寿诗
542789,送徐进士子绳谪建阳少尹 其二
514527,寿吴门蒋竹居九十进士县尹昂之父
610218,赠同年关德甫吴用潜成进士 其一
540943,寄吊丘月林丧冢器肖林进士
1208933,送翰林应奉寿同海涯挈家觐省十首（供奉字弘毅至顺四年进士第二名辉和尔人自号清冰玉壶登第时寓居蓬莱真境） 其七
24813,哭李进士
485069,白莲寺次韵杜进士喜予见过话旧之作
561561,送进士卢木伯宰嘉兴 其二
661582,次进士马中锡吴淑游京师西山韵八首 其八
676963,别冀康川进士口号
899199,与进士宋严话别
500671,次韵前进士唐仲文登黄山诗
1227361,阅穆陵丙辰御赐进士诗
590444,赋雪次滁州孙环山进士韵 其六
1188215,送进士喻坦之游太原
878193,学进士作大方无隅二首 其二
515855,分韵送萧进士璿赴广东纂修实录
590420,寄毛旸谷进士
528796,送陈进士还江西
593942,送余进士明复司法常州
902769,集英殿立侍观进士唱名六首 其四
703860,别刘觐国时初成进士
479214,访进士何斯复于歙北黄荆渡不值时斯复方以养亲告归
99766,次韵参寥师寄秦太虚三绝句时秦君举进士不
1188043,送进士下第归南海
64819,题周进士古木清猿图
638731,赠周仲鸣进士四首 其四
484784,金进士宿江馆阻雨连夕二首 其一
661581,次进士马中锡吴淑游京师西山韵八首 其七
29760,赠进士章碣
1249039,岁星渐高赠王伯紞进士
1057160,内中考进士
1223787,送进士刘闻文廷赴临江录事
514598,送潘玉汝进士
548338,立夏日同杨钱二孝廉浦进士黄公涧观泉遇王孝廉携美人文如文如擅新声赋十三韵
508720,送吴中进士知清流县
158382,秋试甫期辄成短篇呈马公节裴进士光世
573984,答王进士演之
560758,题杜进士公馀清玩画卷八绝 其八
29285,和彭进士感怀
999838,河北送洪景之进士如荆南
579011,和进士姑苏杜子开宴读书台韵
515707,送卢文渊进士赴兖州推官
103568,答陈五进士遗山水枕屏
594048,送谢进士见齐奉命归娶
530195,访许进士台仲九杞山中二首 其一
1238619,大唐钟山进士歌
507855,读元进士李祁云阳集
1085183,宝印叔得小假山以长篇模写进士钦逢辰和之某次韵并简钦
1185208,赠进士王雄
125040,送朱进士赴举
851373,集英殿赐进士及第恭谢诗
1038927,送陈进士游江南
1177364,秋夜不寐寄崔温进士
590448,赋雪次滁州孙环山进士韵 其十
1044791,送诸进士赴试礼部
701256,乡贡进士三山王士奇大父母挽诗二首
553819,送僧归吴兴用杨进士韵
685750,题郑进士雨竹二首
27287,送进士苗纵归紫逻山居
698120,阅历科进士录
569148,沈君五十时其子乡进士昌期与余善
655331,柬陈进士
607764,区进士閒居之作
469557,赠钱季梁进士省觐归寿其太夫人八十
30006,往年进士赵能卿尝话金庭胜事见示叙
63694,赠钱季梁进士省觐
14994,送前进士蔡京赴学究科
1045411,赠余进士
984070,谢王进士惠近作
27353,和王昭符进士赠洞庭赵先生
623837,送张进士汝尚自戍所还金陵
516465,送陈进士
774402,家瑞陔进士寄诗问近况次韵奉答
680048,送李进士元
1169421,赠来进士鹏
540739,都城送栾岱沧进士尹溧水
713141,送张畏岩进士归吴门兼怀孙赤崖二首 其二
230054,过丹山访黄元英不值英壬子岁正资州所解进士
1044772,五言后殿考进士解嘲
688738,送进士卢木伯宰嘉兴
859400,和王乐道读进士试卷
638490,承吴献臣明府王日雨进士张廷实地曹饯别东山寺用地曹韵留别三首 其一
1233152,奉同刘进士嗛游衡岳登祝融峰
590439,赋雪次滁州孙环山进士韵 其一
611974,送王壮其进士北上谒选
813801,立夏后荆溪周进士济偕徐吕诸子放棹过香溪招余游西山
999742,依韵和答陆革进士招饮池上诗
682966,怀李进士材二首
983875,恭和御制赐进士诗韵二首 其二
962462,燕漕司进士小诗奉勉
592188,答戴进士仪周
703308,送罗澹峰进士入都改除
676818,留别冯少洲进士
836378,金缕曲 其一 郫县晤李干廷，名作桢，郫县人，庚辰进士，广东知县
1178478,送张子容进士赴举
1128188,和王给事易简殿试举人五首 试进士
27452,新岭临眺寄连总进士
531133,送周世宁进士归楚
659336,乡进士边君予友屈君之内弟也不得愿而归予重屈及君诗以道意
525145,清旷亭酌酒同许隐君赠别臧子明进士春试
515793,弘治戊午春正月十三日舟次淳安春霖不止进士维扬张君凤举方知县事以灯节燕予酒后赋此纪事兼致谢意
510295,赠张进士入京 其二
528167,晚过周进士言别闻琴
490665,赠别冯进士之任海阳
993416,赠黄庭筠举进士
517488,双桂堂为彭进士汝器赋
55729,终南进士行为刘主事廷美赋
894241,送谢沂进士
1165454,送友人进士许棠
509335,送张进士养病回苏州
633763,送冯孔武进士
1218193,送钱思复进士赴会试
579258,柬南昌周进士仲芳
1252627,寄王进士（伏睹前乡贡进士王礼子让所刻长留天地间集辱收谬作厕其间心窃愧焉而误名为昂因笔寄意二首）
1252627,寄王进士（伏睹前乡贡进士王礼子让所刻长留天地间集辱收谬作厕其间心窃愧焉而误名为昂因笔寄意二首）
589439,游大钵山西岩刘将军陆侯李三进士同集以横山最高处为韵赋诗三首 其一
1208931,送翰林应奉寿同海涯挈家觐省十首（供奉字弘毅至顺四年进士第二名辉和尔人自号清冰玉壶登第时寓居蓬莱真境） 其五
1190979,学诸进士作精卫衔石填海
1237271,哭同年进士李竹操经历
662399,寄从兄德坚进士
579010,汉阳二律皇陵宫殿木舟运汉阳夏口周进士仲方沽酒来别命二题各作联句 其二 卖菜声
638184,重九日张侍御招饮元妙寺时董侍御林大行人泮及弟佥宪包进士咸在席酒酣因和张侍御旧游韵二首 其二
534794,毛进士使边得省十二韵
1169408,酬郑进士九江新居见寄
410600,端阳至矣开笈得钟进士四图奇趣满抱乘醉命笔匪云讽议聊致轩渠 其三 吹箫图
581381,送修书黄陈二进士事竣北还 其一
1224694,天历庚午会试院中马伯庸尚书杨廷镇司业及玄皆乙卯榜进士偶成绝句纪其事出院明日有敕督修经世大典又成小诗寄诸弟 其四
179231,谢王进士惠近作
649459,题竹与谢进士
1224691,天历庚午会试院中马伯庸尚书杨廷镇司业及玄皆乙卯榜进士偶成绝句纪其事出院明日有敕督修经世大典又成小诗寄诸弟 其一
539106,喜少师徐公杨公二子并成进士
229899,送刘进士游边
1192713,送进士许棠下第东归
204137,送进士万知古
1181321,送进士赵能卿下第南归
28928,江上逢进士许棠
638594,赠熊士选进士尹平湖二首 其一
713089,上元日邑侯徐戢斋招同佘齐枢进士游允陵梁殿一殿张佘兼五卢闻仲严孚长燕集青云山阁即事赋谢二首 其一
610092,赠王参裕进士
1000422,庆元戊午临江劝驾多士凡由进士科进者皆预焉且沿乡人饮酒之意叙坐以齿酒半使君又出杰句宠其行某陈人也偶睹盛事思有以记之敬嗣严韵二首极愧不工尚几镌削 其一
560754,题杜进士公馀清玩画卷八绝 其四
86715,陪新进士公宴用太守韵
542615,春夜徐进士子与宅饯别陈进士宪卿使楚
542615,春夜徐进士子与宅饯别陈进士宪卿使楚
501564,书吕诚夫进士金环诗后为萨达道同年赠
136119,又次韵·投老归称前进士
653700,顾文之进士养病还姑苏
964573,送刘进士游边
638492,承吴献臣明府王日雨进士张廷实地曹饯别东山寺用地曹韵留别三首 其三
337941,次韵梯飙明府燕新进士
1169339,和彭进士秋日游靖居山寺
594154,送臧进士晋叔赴教荆州五首 其三
578457,挽丁进士尊人
1188572,送进士陈峣往睦州谒冯郎中
882132,效进士作三年通一经
474545,初春夜同沈子文梁公实薛思素进士宗子相比部赋得声字
528552,送顾隐君还常州君来视其侄中书子进士
783160,哭陈进士宪图 其四
542788,送徐进士子绳谪建阳少尹 其一
1235160,送马彦翚进士赴江西省筦勾二首
1180023,秋夜寄进士顾荣
561882,送王克斋都宪总督漕运自举进士至今予三赠诗矣
30992,送进士吴延保及第后南游
581083,赠李士达进士
347607,内中考进士
513550,新安洪生通今郑州守有约之少子乡进士远之弟而予兄汀州贰守克和之婿也来京师从人受春秋学日以成岁暮欲将往省于郑且南还入郡学以俟秋试其志可谓健矣道别之际赋诗赠之
89143,学进士作大方无隅
544979,别章陈二进士
611978,送袁青瑶进士北上谒选
570716,乡进士邹道甫以严君之命借听于余余实无得也不忍逆其意以二绝酬之 其一
334786,呈金陵教授陈宜之钺前进士三人居慈湖
100922,次韵黄鲁直效进·士作岁寒知松柏诗
553551,题徐进士岘山读书卷
783162,哭陈进士宪图 其六
1216359,儒有萨氏子者家无田囊无储始以进士入官为京口录事长行南台辟为掾继而御史台奏为燕廉访架阁官岁馀迁知闽海廉访事又岁馀诏进河北廉访经历皆奉其母以行其禄养也后至元三年八月望舟泊延平津上是夕星河粲然天无翳云月色如白日溪潺潺如乐奏四山环抱如拱如立如侍左右如奔走执事者萨子奉母船上与其妇具酒殽盘馔奉觞继而若妹妹之婿若仆若婢次而进和而不亵谨而怡怡月光荡酒而溪韵杂语笑母叹息舟人醉歌亦相与鼓枻作南歌为乐今夕何夕不知其异乡
1180706,寄静林别墅胡进士兄弟
510209,林缉熙县博张廷实进士何孝子子完先后见访既而缉熙往平湖廷实归五羊子完还博罗因赋四绝 其三
658485,送陈进士恪知宿松
514862,送陈进士宗之采实录于江西便道省亲
783061,丙子岁暮得王进士简泉书却寄 其一
213997,和王乐道读进士试卷
548776,寿俞进士父 其一
677975,题冯进士养质山水画
512374,送庄进士养病归金陵
894034,次韵和度支苏员外覆考进士文卷锁宿景福殿
1237476,寄题进士宋翔仲书室
31142,春晚怀进士韦澹
654571,寿俞进士母
1211623,哭同年进士李竹操经历 其二
939751,次韵杨内翰赠诸进士
1069757,送光上人还湖南光丞相吴元忠之母弟旧名惇字元常以进士入官已而弃家祝发云
239263,奉和御赐进士诗
1188032,关试前送进士姚潜下第归南阳
37179,遇叶进士
560757,题杜进士公馀清玩画卷八绝 其七
617867,为陈湖仲进士大父寿时尊甫新迁国博
983876,恭和御制赐进士诗韵二首 其一
695380,承吴献臣明府王日雨进士张廷实地曹饯别东山寺用地曹韵留别三首
366303,送张奕进士归广德省亲
69524,大唐钟山进士歌
339667,和洪帅燕新进士
492351,奉寄周思忠其先丞相益国公于余六世从祖常德府君为同年进士凡志铭哀挽及倡和诗文槩见于周氏所藏遗书当时尝录以归遭乱逸去因再请于思忠必有以相慰答也思忠有弟思廉极相友爱余往来城中尝寓其书舍云
703669,酬彭进士羡门二首
801615,寄范声佩进士都门
782438,赠陈进士宪图
304824,家瑞陔进士寄诗问近况次韵奉答
1247665,赠南山进士赴邵武录事
1246955,朝宗进士和韵有怀
894381,赠令狐进士
519782,送陈公辅伴读省亲入蜀时其弟进士亦归省
46822,登江阁远怀徐记室与杜进士同赋
516046,纂修姜进士以诗相慰问次韵奉荅
694538,弘治己酉春姜仁夫进士以使事贵州还取道广东过予白沙自己夘至丙戌凡八日辞别三首予亦次韵为别明日仁夫至潮连寨方十馀里遣隶回并得三绝和之通前九首吾与仁夫之意皆不在诗也岂尚多乎哉仁夫浙之兰溪从学章先生德懋吾廿年旧好故吾诗两及之
1150140,途中逢进士许巢
516748,送进士黄德安还乡
606597,周进士赴柳州司理枉过见赠赋答
871793,送进士高枢拱辰
554994,乡贡进士三山王士奇大父母挽诗二首 其二
602990,送欧春元入京赴进士举
587135,阅历科进士录 其三
557812,挽俞进士母词
113988,效进士作观成都石经
551079,重游锦溪怀邓汝高进士
888687,余壬戌春校试进士同事者五十五人至戊子岁因阅小录所存者止四人感而有作二首 其二
382588,送邹进士南皋谪戍贵阳
528013,送郭进士告归大梁
548345,同王鸿胪顾进士杨王二茂才谭陆二徵君赏蒋氏杜鹃花甚盛因作短歌
199745,王才谅自行朝归以进士题名示予怆然有感
21336,送进士田卓入华山
535098,寿陈进士母七十
638297,次韵石斋先生赠姜仁夫进士三首 其二
526545,秋兴同商进士景贞押韵作 其四
510999,读张进士挽丁明府彦诚诗次韵
849683,恭和御制赐进士韵
230100,考进士·交戟重门间九阍
480042,送神武蔡千户致仕还湖州（进士中孚之父）
510423,赠夏进士升
