837364,与王君慕韩同游竹峰山寺辟东轩小坐山翠万重环列左右俯视帆影片片从槛底飞过即景觅韵爰纪以诗不暇计其句之工拙也 其一
630904,夏日与刘见颙王入闻阿字无方白庵须识诸子小坐山亭
934563,暇日坐山麓松石间作
1231927,与白云山人夜坐山人将归天台即席赋此送之
1005542,春日与正仲坐山斋余隐几就睡既觉而正仲端坐诵书未已此意似更胜渊明卿且去之语也
837365,与王君慕韩同游竹峰山寺辟东轩小坐山翠万重环列左右俯视帆影片片从槛底飞过即景觅韵爰纪以诗不暇计其句之工拙也 其二
82950,暇日坐山麓松石间作
828618,丁卯之岁予病甚陟甫约游鄮山阿育王寺一日晚坐山门外万念俱忘恍然若有以无得为得也别经廿载世变不可言感念不已因寄怀陟甫一首
1870,同王员外雨后登开元寺南楼因酬晖上人独坐山亭有赠
154542,晚坐山亭口占
371356,挽章·坚坐山头十数年
743597,梦五星坐山广下指一草示余云是当归感赋此章
585431,偕陈本诚区文光坐山池中墩
94132,夏夜露坐·山翠都成黑
379424,送化士·堂中宴坐山含月
83703,夜坐·山城意象自萧然
282793,山齐雷雨·独坐山斋味寂然
844395,与王君慕韩同游竹峰山寺辟东轩小坐山翠万重环列左右俯视帆影片片从槛底飞过即景觅韵爰纪以诗不暇计其句之工拙也
131647,次韵夜坐·山林分老不求官
157703,春日与正仲坐山斋余隐几就睡既觉而正仲端坐
851950,晚坐山亭口占
1176800,同王员外雨后登开元寺南楼因酬晖上人独坐山亭有赠
385634,偕陈本诚区文光坐山池中墩
