656089,予书月台字月既毕台字误落笔而为壹又书钩以足之惜无出处也徐思曩在石泉时东窗对一钩之月在缺月五更头寒光皎清夜之句感怀
1034793,某曩在遂宁尝赋木犀云茂树幽花兀老苍不随众卉入词场虎头点点开金粟犀首累累佩印章明月上时疑白傅清风度处看黄香人才生世元如此不为无人不肯芳今十数年矣偶忆前作未免儿戏用韵再赋呈诸友
525640,马上忆曩在全州送孟望之归汝有襄阳骑马之句今亡久矣长途独暮凄然沾襟
1142359,曩在长沙有遗以石山今旧物云散此石以坚顽独存渔庄为赋九芙蓉之句遂以归之目为壶中九华致其怅望
631279,曩在海云偶得一天风雨沉山阁之句时尘异诸子侍坐命作对语尘异以万古云烟锁石门应予心异之己未八月初七入双镜楼忽忆前事正当斯时因用旧句足成一律以识梦中之境始信人之心愿原非虚设也
139912,某曩在遂宁尝赋木犀云茂树幽花兀老苍不随众
778202,金缕曲·沈日初比部以尊公菊庐先生醉菊遗图索句。忆曩在归云堂醉白池时，与先生相见，册中诸老大半与光殷勤奖借。光初昏时，研北丈为词以贺，紫眉丈尝为光模印，桐君鸿甫小田朗如诸老皆屡同觞咏，芝房贳甫又同时睥睨者。今风流歇绝，展卷怃然。同治癸酉与日初聚于京师，追次研丈词韵，勉成一阕，不觉感慨系之也
