138929,寄龚漕·闻公新有帅垣除
53208,张提学寄先师文正公新集至代简为答
94519,益公新作三层百尺新楼
1182195,和裴令公新成绿野堂即事
19459,又和令公新开龙泉晋水二池
721916,携公新栖仙掌峰诗以赠之
716052,携公新栖仙掌峰诗以赠之 其四
15173,奉和裴令公新成绿野堂即书
170141,题王忠文公新祠
1160073,和东川王相公新涨驿池八韵
454256,浣溪沙 赏陶公新书张维屏诗《新雷》后赋此呈正时近春节
869586,始平公新作双樗庵命光为诗
352592,相公新创云山观于州治之东诗以颂之
471345,督府明公新膺加荫（加太子太保、左都御史。一子荫锦衣千户）
716050,携公新栖仙掌峰诗以赠之 其二
594414,大司空曾公新加宫保寄贺二首 其一
716049,携公新栖仙掌峰诗以赠之 其一
594493,御史大夫姑苏袁公新拜春官宗伯赋上贺篇时余南还
580786,次右辖戴公新参留别韵二首 其一
199460,庆周益公新府
1156838,奉和裴令公新成午桥庄绿野堂即事
50037,督府明公新膺加荫
1155801,又和令公新开龙泉晋水二池
1115275,益公新作三层百尺新楼署曰围山观贺以唐律二章
632623,木公新斋成题寄
142441,宁公新拜首座因赠
1245644,梁国狄文惠公新庙诗
716051,携公新栖仙掌峰诗以赠之 其三
923060,次韵签判太博谢府公新诗墨迹
608879,题道公新建溪南精舍 其一
628284,赠箕公新筑草阁
577189,徐太守雪梅为巡抚江西侍郎赵公新赋
19348,奉和裴令公新成午桥庄绿野堂即事
160013,奉同景仁九日宴相公新堂
1163791,一公新泉
159969,范公新池·忘机人似汉川阴
594415,大司空曾公新加宫保寄贺二首 其二
589553,赠母舅谢东园公新筑东园书舍
1156825,和汴州令狐相公新于郡内栽竹百竿拆壁开轩旦夕对玩偶题七言五韵
580787,次右辖戴公新参留别韵二首 其二
697301,唐明府长公新搆园亭三泖之上书来徵诗赋荅二首
545919,唐明府长公新搆园亭三泖之上书来徵诗赋荅二首 其二
874333,庆周益公新府
134684,始产公新作双樗庵命光为诗
1041296,奉和府公新作盆山激水若泉见招十二韵
10276,一公新泉
723504,同会河阳公新造山池聊得寓目诗
862495,赠仙山刚公新创香林
15182,和东川王相公新涨驿池八韵
863433,宁公新拜首座因赠
545918,唐明府长公新搆园亭三泖之上书来徵诗赋荅二首 其一
347975,淮南韩魏公新祠
695771,大司空曾公新加宫保寄贺二首
701003,次右辖戴公新参留别韵二首
941026,题王忠文公新祠
544960,次夏镇谒朱公新祠
1217252,宝公新堂歌
14946,酬令狐相公新蝉见寄
682447,题道公新建溪南精舍
525525,寄贺夏桂洲相公新第次前人
509000,壬申岁暮预约同寅余公新正郊游值霖雨闷甚正月三日因携壶独酌贡院池亭怅然有怀
40096,同会河阳公新造山池聊得寓目诗
21656,和裴令公新成绿野堂即事
523905,春日过黄公新堂
1159994,奉和裴令公新成绿野堂即书
1158830,奉和杜相公新移长兴宅呈元相公
104620,留守相公新刱双桂楼
200828,相公新创云山观於州治之东诗以颂之
1050538,淮南韩魏公新祠
277107,癸亥清明后三日游天坛观两院诸公新植树次陈家鼎议员韵
1159909,詶令狐相公新蝉见寄
914732,益公新作三层百尺新楼署曰围山观贺以唐律二章 其一
197490,赠仙山刚公新创香林
1026427,范公新池
11990,题觉公新兰若
4139,奉和杜相公新移长兴宅呈元相公
1147633,和荐福寺英公新搆禅堂
183897,次韵签判太博谢府公新诗墨迹
900021,相公新创云山观于州治之东诗以颂之
1039049,览资政富公新诗
559599,赠蒋四公新造官衙志喜
525524,寄贺李序庵相公新第次浚川公韵
1172291,题觉公新兰若
914731,益公新作三层百尺新楼署曰围山观贺以唐律二章 其二
632349,天公新搆茆舍观音堂侧
532405,登梅峰制干李公新祠
1026406,奉同景仁九日宴相公新堂
94522,益公新作三层百尺新楼署日围山观贺以唐
479621,张提学寄先师文正公新集至代简为荅
608880,题道公新建溪南精舍 其二
2537,和荐福寺英公新构禅堂
991490,留守相公新创双桂楼
606012,读郭郡公新筑东洲记
