833826,丑奴儿 船窗坐雨，兼闻雁声
583974,全州行台忧旱得雨兼闻灌阳贼遁志喜和屠巡察
808392,赵大至得孙大入关之信兼闻蒋表弟良卿欲入都城东酒徒无一人居里者感赋此首近简黄二杨三徐大
1049599,李待制寄僧诗有歇定之语兼闻有岷峨之游因作诗以寄之二首 其一
677600,过风洞嵿望雪山兼闻魏南台使君开府诸蕃服属边烽始静感怀书此预简南台
677142,丰干得孟阳广陵归讯兼闻淑士从白下奉使南还率尔有作
627094,赣关接云淙老师手书兼闻大疏 其二
614925,施羽王以书附乃弟卫幕枉讯兼闻其迁南司业赋此却寄
752369,梅叟移居近巷时遭国恤兼闻皖中兵乱奉柬
195232,苏伯清席中领张仲宾所寄二诗兼闻陈无逸已从
358807,李待制寄僧诗有歇定之语兼闻有岷峨之游因作诗以寄之
693994,赣关接云淙老师手书兼闻大疏
605880,自乡返城喜春雨沾足兼闻欲罢矿税释建言得罪诸臣
751900,病中岳二兄朝夕临过兼闻乡讯感赋
627093,赣关接云淙老师手书兼闻大疏 其一
1107278,李待制寄僧诗有歇定之语兼闻有岷峨之游因作诗以寄之二首
606302,清溪驿阻风适制府戴公书至兼闻西所已报捷云
1049600,李待制寄僧诗有歇定之语兼闻有岷峨之游因作诗以寄之二首 其二
1141422,苏伯清席中领张仲宾所寄二诗兼闻陈无逸已从湘南官满归养喜而有答仍次来韵
531303,凤翔阻雨兼闻寇未靖拨闷
