948970,南城吴氏记予七十三岁之颜
147593,侄孙昺以东野农歌一编来细读足以起予七言
1135628,谢张老山御史庆予七十
152019,李卿月子西记予七十七岁之颜求赞
659174,王成宪府博自昆山来为予七十寿成宪时年七十八矣追数京师诗社中人惟予两人在者感刘禹锡诗因成四首 其三
119432,予七十赵监税见贺以诗次韵
106751,次韵张师道庆予七十
659173,王成宪府博自昆山来为予七十寿成宪时年七十八矣追数京师诗社中人惟予两人在者感刘禹锡诗因成四首 其二
659175,王成宪府博自昆山来为予七十寿成宪时年七十八矣追数京师诗社中人惟予两人在者感刘禹锡诗因成四首 其四
1134867,次韵俞好问庆予七十
685347,王成宪府博自昆山来为予七十寿成宪时年七十八矣追数京师诗社中人惟予两人在者感刘禹锡诗因成四首
999022,陈知府体仁和予七夕试院诗并以龙涎数十饼为饷次韵奉酬陈每讲会甚盛
1135728,次韵张师道庆予七十
77932,甲寅元日予七十矣酒间作短歌示子侄辈
1134961,牟献之提刑来杭纳婿庆予七十次韵二首 其二
107806,谢张老山御史庆予七二
590807,寿刘素予七十一
106403,牟献这提刑来杭纳婿庆予七十次韵
1134962,牟献之提刑来杭纳婿庆予七十次韵二首 其一
659172,王成宪府博自昆山来为予七十寿成宪时年七十八矣追数京师诗社中人惟予两人在者感刘禹锡诗因成四首 其一
106560,次韵俞好问庆予七十
935430,甲寅元日予七十矣酒间作短歌示子
152347,南城吴氏记予七十三岁之颜
1144098,牟献之提刑来杭纳婿庆予七十次韵二首
1033550,侄孙炳以东野农歌一编来细读足以起予七言有汲水灌花私雨露临池叠石幻溪山草欺兰瘦能香否杏笑梅残柰俗何似此两联皆自出新意自可传世然言语之工又未足多其体格纯正气象和平为可喜余非谀言自有识者因题其卷末以归之
942299,予七十赵监税见贺以诗次韵
156002,陈知府体仁和予七夕试院诗并以龙涎数十饼为
948293,李卿月子西记予七十七岁之颜求赞
