28249,奉和袭美见访不遇
825336,诸贞壮吴仓硕见访不遇
1184226,友人见访不值因寄
992271,陈真卿将有秋试倏见访不日告行送于北门歌鹄庭为五言以赠
1176384,奉和袭美见访不遇
862936,寄李叔飞见振叔云叔飞尝见访不遇
783658,答尚铁峰见访不遇
1227393,酬友人见访不遇
66177,季冬章少参见访不值
1171410,谢梁尊师见访不遇
762275,家云汀编修见访不遇留题楹联有云『处士应门唯使鹤』却寄
1228528,友人见访不遇
1146710,酬卢仝见访不遇题壁
102965,陈真卿将有秋试条倏见访不日告行送於北门歌
476886,王司训聪投诗见访不值次韵为谢
33766,友人见访不值因寄
529944,庭实久约携酒见访不至贻诗嘲之
215068,汪叔耕见访不数日别去恶语为赠兼简子用子美
173303,寄李叔飞见振叔云叔飞尝见访不遇
890419,汪叔耕见访不数日别去恶语为赠兼简子用子美二友
381575,诸贞壮吴仓硕见访不遇
473062,季冬章少参见访不值
37004,酬卢同见访不遇题壁
711149,易兼上人见访不值
556304,养病道院忽张君见访不值奉寄
62280,王司训聪投诗见访不值次韵为谢
