917366,诗僧常不轻以梅花句得名于时雪后踏月相过论诗终夕退得二绝以谢 其二
1070969,自象登舟入武仙县境有山耸拔四十丈奇秀异常有道人于此升仙因以得名
948711,鱼儿牡丹得之湘中花红而蕊白状类双鱼累累相比枝不能胜压而下垂若俛首然鼻目良可辨叶与牡丹无异亦以二月开因是得名其干则芍药也予命曰花嫔而赋是诗闻江东山谷间甚多
1037167,嘉泰昭阳大渊献筑室董孝君祠之西下有湖焉某曰溪以董君慈孝而得名县又以是名则是湖宜亦以慈名作诗曰 其五
917810,嘉泰昭阳大渊献筑室董孝君祠之西下有湖焉某曰溪以董君慈孝而得名县又以是名则是湖宜亦以慈名作诗曰 其二
1095807,清泉得名于真大参
353720,和董适道·十载江湖早得名
985679,花头巡检先君纪之详矣孝女乡女子骑虎以救亲今汝滩下有孝女石即其处也乡之得名以此然则汝滩旧名女滩米坑旧名女坑皆当仍旧不可改也吾乡有此二事宜庙而祭之以表励风俗因成一绝道余所志云
100809,三绝次韵·从来苏李得名双
69130,吉祥草·得名良不恶
1110774,冬至后三日与罗楚入倅厅两松下梅花盛开取酒酌石台上思得名手作松梅图
323437,州治有忠献堂以韩魏公始生得名废于俗吏更以清暑今复之
330810,自象登舟入武仙县境有山耸拔四十丈奇秀异常有道人于此升仙因以得名
1111481,学射山相传蜀后主刘禅习射于此因以得名有感二作
168418,舟过庾楼·得名元自庾西阳
153534,予既赋金貂亭诗巽伯求益不已偶得名酒连饮辄
636690,邓子东山得名画半帧乃昔时好手绘未成幅者索予题破口占三绝书以还之 其一
956176,清音堂与赵德庄太常小饮在馀干琵琶洲傍洲以形似得名
80225,梅花绝句·吾州古梅旧得名
520388,向读三秦记闻周平王东迁见白鹿於此原以是得名予自辋川经此漫思往事而姑识之以诗
1116027,嘉泰昭阳大渊献筑室董孝君祠之西下有湖焉某曰溪以董君慈孝而得名县又以是名则是湖宜亦以慈名作诗曰
917811,嘉泰昭阳大渊献筑室董孝君祠之西下有湖焉某曰溪以董君慈孝而得名县又以是名则是湖宜亦以慈名作诗曰 其三
980330,泰州人自徐神翁后多以奉道为事即今有周高唐三先生皆足以动众得名因作长句
976701,西州旧俗每当立春前后以巢菜作饼互相招邀名曰东坡饼顷在燕尝有诗云西州最重眉山饼冬后春前无别羞今度燕山试收拾中间惟欠一元修元修即巢菜之别号盖豌豆菜也东坡故人巢元修尝致其种于黄冈下因得名元修南方有之燕中无此种余来河间再见立春感旧事用前韵 其三
363769,冬青·得名固不诬
58104,宝剑篇·人间得名千百载
908755,从何使君父子游墨池分韵得名字
636692,邓子东山得名画半帧乃昔时好手绘未成幅者索予题破口占三绝书以还之 其三
1086237,州治有忠献堂以韩魏公始生得名废于俗吏更以清暑今复之
1081428,泊桐庐县合江亭下昔有得道之士不知姓名结庐山间手植桐数本因谓之桐君县亦以此得名
452019,古城村有双古松远望如城门村因此得名今村委会索题言松已枯死
83951,病中偶得名酒小醉作此篇是夕极寒
933728,病中偶得名酒小醉作此篇是夕极寒
884403,冬至后三日与罗楚入倅厅两松下梅花盛开取酒酌石台上思得名手作松梅图 其一
488110,同祖仁甫李得名杨唯光饮谷神观
250359,古城村有双古松远望如城门村因此得名今村委会索题言松已枯死
377860,行歌亭·自古山林浪得名
1231759,五月廿八日重过翠涛轩清坐终日薄暮而归赋此盖书所见也翠涛为竹而得名余不能无辞矣
344764,瓶中牡丹·折得名花第一株
666486,小园旧名退乐中丞马敬臣先生改曰常乐因为题榜兼赋古诗二章见赠蕙敬次韵奉酬且记吾园得名之始 其一
329616,送李宝之·流落文场晚得名
323038,退思轩·会得名轩意
917367,诗僧常不轻以梅花句得名于时雪后踏月相过论诗终夕退得二绝以谢 其一
101161,三绝次韵·従来苏李得名双
320265,戏承君·越上荒山浪得名
1212338,雪香亭月下偶得名酒径醉为赋
383481,台湾杂咏·纪叟中山浪得名
155846,登清音堂·洲以檀槽旧得名
886641,学射山相传蜀后主刘禅习射于此因以得名有感二作 其一
884404,冬至后三日与罗楚入倅厅两松下梅花盛开取酒酌石台上思得名手作松梅图 其二
539298,过于鳞郡斋分赋十二体得名字
886640,学射山相传蜀后主刘禅习射于此因以得名有感二作 其二
636691,邓子东山得名画半帧乃昔时好手绘未成幅者索予题破口占三绝书以还之 其二
33247,送友人游蜀·为儒早得名
919873,予既赋金貂亭诗巽伯求益不已偶得名酒连饮辄醉随意长哦忽数十句录而成篇真醉汉口中语是可塞严命矣惜不令子大德允见之共一醉噱耳
247083,离亭宴·记得名山初夏
1099813,太平莲者草花也本如藤蔓好事者结竹而植之其花大如当三钱四围先绽中有一萼如初出水莲最后方拆想以此得名一花可十许日邻人馈以一盆亦自可爱推其所以名者戏述一首
1091159,孙元可赋张公石室诗句语险怪辞峰秀拔读之如神游洞府而陵果为之奔属也非身行此洞不知此诗之工盖其质似卢仝而文丽多之如又加鞭当千里一瞬其视刘叉马异得名浪矣诗文与我过当诚无足以当之牵韵勉酬真添薪煮箦之举
317961,漫兴·倩得名园水一湾
704887,小园旧名退乐中丞马敬臣先生改曰常乐因为题榜兼赋古诗二章见赠蕙敬次韵奉酬且记吾园得名之始
358185,榕树·榕树能容故得名
726953,赋得名都一何绮诗
376107,清泉得名于真大参
328993,次韵尧明·王李风华旧得名
51396,老人灯·百岁身躯浪得名
976699,西州旧俗每当立春前后以巢菜作饼互相招邀名曰东坡饼顷在燕尝有诗云西州最重眉山饼冬后春前无别羞今度燕山试收拾中间惟欠一元修元修即巢菜之别号盖豌豆菜也东坡故人巢元修尝致其种于黄冈下因得名元修南方有之燕中无此种余来河间再见立春感旧事用前韵 其一
917740,嘉泰昭阳大渊献筑室董孝君祠之西下有湖焉某曰溪以董君慈孝而得名县又以是名则是湖宜亦以慈名作诗曰 其一
1037168,嘉泰昭阳大渊献筑室董孝君祠之西下有湖焉某曰溪以董君慈孝而得名县又以是名则是湖宜亦以慈名作诗曰 其六
342678,太湖石·海岱铅松妄得名
385791,马当·江上峰青最得名
232093,诗僧常不轻以梅花句得名于时雪后踏月相过论
1076227,河鲀之美唯西施乳得名旧矣而未有作诗者戏作此诗
66556,有渚轩宴集用韵答潘景升轩以顾渚茶得名余与
938557,汉宫春 其一 寿乡帅范尚书。郡有苍云堂，因古柏得名
538664,天平山饮废寺还谒范祠作得名字
612299,咏画眉鸟以双眉白得名
1221371,孟得名画雪景寒鸦
164984,学射山相传蜀后主刘禅习射於此因以得名有感
162070,绝句·移得名花手自栽
334123,再和·清朝画省得名郎
474163,有渚轩宴集用韵答潘景升轩以顾渚茶得名余与景升不善酒而有茶癖故云
285026,徐君逢吉·鹗荐秋闱盼得名
592365,朱仲开黄定父吴孝父邵长孺管建初邹君植陆无从过饮得名字
346655,酬朱直学·儒官领袖得名流
666487,小园旧名退乐中丞马敬臣先生改曰常乐因为题榜兼赋古诗二章见赠蕙敬次韵奉酬且记吾园得名之始 其二
240229,挽王郎中·早得名师友
520356,予闻文王之作灵台盖以望氛祲察灾祥也且其倏然而成若神灵之所为者故以得名诗不云乎彼美人兮西方之人兮因经台下谩成一绝以寓景行之意云
182323,岳阳楼·大手文章浪得名
80242,梅花·折得名花伴此翁
1210657,吾乡之崖有以青得名者余尝取以自号至元十四年偕御史国瑞外郎周卿有东州之行道出阆州阆之南二十馀里佛阁突兀因周览形胜得河南人王子京青崖石刻不知阆之崖与吾乡之崖一而二者耶抑海内一家山川脉络同一元气二而一者耶或其偶与之合耶乃书此以识
343342,内乐亭·谁谓兹亭浪得名
917812,嘉泰昭阳大渊献筑室董孝君祠之西下有湖焉某曰溪以董君慈孝而得名县又以是名则是湖宜亦以慈名作诗曰 其四
484800,皋桥（在阊门内，由汉皋伯通所居得名。唐妓泰娘亦居此焉）
687986,邓子东山得名画半帧乃昔时好手绘未成幅者索予题破口占三绝书以还之
149956,书触目·山以石得名
1226924,当涂郡有脱靴亭以谪仙采石得名乃绘之图而赞以诗
179698,和洪叔·亭为君来又得名
364725,题清漪亭·平昔江流清得名
1124677,西州旧俗每当立春前后以巢菜作饼互相招邀名曰东坡饼顷在燕尝有诗云西州最重眉山饼冬后春前无别羞今度燕山试收拾中间惟欠一元修元修即巢菜之别号盖豌豆菜也东坡故人巢元修尝致其种于黄冈下因得名元修南方有之燕中无此种余来河间再见立春感旧事用前韵
1115979,诗僧常不轻以梅花句得名于时雪后踏月相过论诗终夕退得二绝以谢
976700,西州旧俗每当立春前后以巢菜作饼互相招邀名曰东坡饼顷在燕尝有诗云西州最重眉山饼冬后春前无别羞今度燕山试收拾中间惟欠一元修元修即巢菜之别号盖豌豆菜也东坡故人巢元修尝致其种于黄冈下因得名元修南方有之燕中无此种余来河间再见立春感旧事用前韵 其二
534472,嘉靖乙巳冬自京师取长骑抵淮徐初得驽足勤策不进既三日再得名驹引鞭而去每出群骑数里鞍上作骝马行赏之
