593043,纯甫见邀同思伯惟仁公补公绍饮小瀛洲得高字
717114,人日双桧堂社集与诸从分得高字
457141,六月望日钱塘雅集分韵得高字
900494,三茅观李仁父刘文潜员显道赵温叔崔子渊置酒分韵得高字
594482,吴明卿从吴中还泊金陵午日同方允治携酒邀集佑圣观方仲美适至分得高字
254420,六月望日钱塘雅集分韵得高字
224345,姑苏台晚眺分韵得高字
594668,九日过唐寅仲青门隐居同梁彦国邓君肃赋得高字
1139621,姑苏台晚眺分韵得高字
533316,同丁计部诸子集王鸿胪山斋怀五岳之胜得高字
670700,郡斋同元美赋得高字
592117,雪夜同惟敬饯别彦国还卢龙得高字
1473,奉和圣制九日侍宴应制得高字
593182,陈明府德基邀游江石台迟汪禹乂邵长孺未至得高字
1170130,奉和圣制九日侍宴应制得高字
1248402,晚归饮众芳亭得高字
883312,徐孺子读书台分得高字
474031,鸡笼山赋得台城怀古得高字
538159,秋日过于鳞郡斋分赋十体得高字
544697,秋夜同惟敬诸子集刘观察园亭分得高字
1249198,春晖楼以攀桂仰天高分韵得高字
593181,元宵同李功甫陆华甫邵一坤邵格之汪禹乂金德润金上甫郑鲁文程鸣甫汪虞仲邵济时邵惟成邵汝恒集邵长孺环斋程子虚无过兄弟自歙适至分得高字
1249886,七月既望日玉山主人与客晚酌于草堂中肴果既陈壶酒将泻时暑渐退月色出林树间主人乃以高秋爽气相鲜新分韵余得高字
594587,九日同陈敬甫梁伯龙登马鞍山得高字
