862538,以酒饷谹父蒙以绝句为谢因次韵并叙送行之意时欲往吴中二首 其一
572906,五月十二日退如生辰蒙以诗见示聊述二章奏报 其一
1091121,闻齐安杂咏板成从沈守求印蒙以为赠
862537,以酒饷谹父蒙以绝句为谢因次韵并叙送行之意时欲往吴中二首 其二
974575,蕃丙午冬分宜见公度簿公尊兄已而邂逅于宜春蒙以蕃与徐斯远志别六言之韵作诗为赠久未和答今日东归乃克赋之四首 其四
572907,五月十二日退如生辰蒙以诗见示聊述二章奏报 其二
974577,蕃丙午冬分宜见公度簿公尊兄已而邂逅于宜春蒙以蕃与徐斯远志别六言之韵作诗为赠久未和答今日东归乃克赋之四首 其二
862738,仆近还舍以一篇饷秀实蒙以两篇见酢谨用前韵再酬一篇
160041,蒙以诗惠水晶鱠次韵答谢
1026929,蒙以诗惠水晶鲙次韵答谢
974576,蕃丙午冬分宜见公度簿公尊兄已而邂逅于宜春蒙以蕃与徐斯远志别六言之韵作诗为赠久未和答今日东归乃克赋之四首 其三
908391,林夫体中不佳而能不废翰墨且蒙以文轴见教其天性所嗜如此敬叹不已既勿药作诗贺之
180145,林夫体中不佳而能不废翰墨且蒙以文轴见教其
1124264,蕃丙午冬分宜见公度簿公尊兄已而邂逅于宜春蒙以蕃与徐斯远志别六言之韵作诗为赠久未和答今日东归乃克赋之四首
747880,偶与仲弟研芸为周子坚作小印数方蒙以小词招饮研芸既和其词余亦先以诗谢
1106859,以酒饷谹父蒙以绝句为谢因次韵并叙送行之意时欲往吴中二首
155160,以春盂送茂恭蒙以古诗为谢次韵奉酬
974574,蕃丙午冬分宜见公度簿公尊兄已而邂逅于宜春蒙以蕃与徐斯远志别六言之韵作诗为赠久未和答今日东归乃克赋之四首 其一
584992,招朗司厅饮蒙以诗谢因步韵答之
173361,仆近还舍似一篇饷秀实蒙以两篇见酢谨用前韵
173616,以酒饷谹父蒙以绝句为谢因次韵并叙送行这意
1157600,偶以拙诗数首寄呈裴少尹侍郎蒙以盛制四篇一时酬和重投长句美而谢之
699439,五月十二日退如生辰蒙以诗见示聊述二章奏报
999226,以春盂送茂恭蒙以古诗为谢次韵奉酬
