900615,陪舍人兄过陈仲思溪亭深有买山卜邻之意舍人兄预以颛壑见名因成古诗赠仲思
173898,前十三章未见营创之意因成古风
903335,寄春膏笺与何同叔监簿因成古体
857351,嘉泰二年岁在壬戌正月八日携家还里幕中诸友远来饯别同游乳洞遂为终日之款因成古风一章
985168,前十三章未见营创之意因成古风
999349,都丞李侍郎叔永和予小园二十六诗因成古风一首奉谢
903243,庐陵李英才自制墨与梅花写真艮斋诚斋又许其能诗十月七日携画见访且索拙语因成古风以赠
178412,边公明尽屏荤茹因成古风约叔度良佐周翰同赋
155912,都丞李侍郎叔永和予小园二十六诗因成古风一
866203,某属闻少伊广文归别墅将挂其冠然乎富贵恐不免耳欲谒未能因成古诗奉迓某无策可去断章不忘健羡也
939252,边公明尽屏荤茹因成古风约叔度良佐周翰同赋公明学佛而不专意性理故及之
219135,元用见过诵诗剧谈因成古风以成戏恼兼简若晦
1098098,壬子立夏日同郡博士黄次夔游江祖太白钓台因成古诗并呈偕行诸丈
1085379,不欺室三字参政张公书也笔力劲健如端人正士俨然人望而敬之因成古诗八韵
993773,元用见过诵诗剧谈因成古风以成戏恼兼简若晦唐卿
1014981,游洞霄得乡友道士邓君德清话因成古语
985819,五日晨兴说既济彖殊惬因成古调
1057454,有诏遣移局实录院因成古诗奉别同舍学士诸公聊佐一笑
