509970,九日诸生携酒饮白沙醉中和答 其三
509968,九日诸生携酒饮白沙醉中和答 其一
114970,南安试院无酒饮周道辅自赣上携一榼时时对酌
996192,南安试院无酒饮周道辅自赣上携一榼时时对酌惟恐尽试毕仆夫言尚有馀樽木芙蓉盛开戏呈道辅
323869,西江月·用荼酿酒饮尽，因成此，谩呈继韩王炎
1216039,兴圣殿进讲即事是日赐酒饮杏花下
163588,道山诸丈置酒饮饯秀野园以诗谢别
694387,九日诸生携酒饮白沙醉中和答
126584,饮酒吟·时时醇酒饮些些
826366,虞美人·月夜过陈朗山先生梅窝。老梅数树，冲寒竞放，杂坐林底，清气袭裾。有客倚短竹一枝，雪色花光，随声上下，觉逋仙暗香浮动月黄昏句若为此地咏者。先生出酒饮客，命记以词
356002,庭菊烂开招子我共赏而空无酒饮闻瓜洲酒美遣酤数升
1004008,诸友载酒饮沧江海棠下公许以上寿亲庭不克与胜赏翌日招饮出示新作敬和元韵
1070559,庭菊烂开招子我共赏而空无酒饮闻瓜洲酒美遣酤数升殆如灰汁戏作三绝句因以酬九月四日戏赠之作 其一
491290,数日无酒饮
107280,偶书·一日无酒饮
564867,贱降前一日俞厚庵暨沃泉携酒饮予舟中即席奉谢二首 其一
1003932,道山诸丈置酒饮饯秀野园以诗谢别
974247,重九才四日尔风雨如此病卧殊亡聊小儿辈取酒饮予且索作诗强和渊明九日閒居一首
369783,侍郎见简·排闷径须沽酒饮
511505,过漷县风大作取舟中储酒饮之
43684,十月十日蔡铉升载酒饮我于病榻
451918,和陶饮酒饮酒一
807486,念奴娇  睢州田子益唐昕林孙啸史徐次微袁信庵褚宸宣吴子纯侯长六诸子邸中沽酒饮我别来数日荒村风雪有怀昨游用前韵寄之
1128207,庭菊烂开招子我共赏而空无酒饮闻瓜洲酒美遣酤数升殆如灰汁戏作三绝句因以酬九月四日戏赠之作
579359,中秋诸友携酒饮白沙时余有徵命将行
808381,清明后一日与孙大携酒饮王七秀才廷俞南圃归过县门忆亡友林嗣基作
100043,戏答佛印·远公沽酒饮陶潜
564868,贱降前一日俞厚庵暨沃泉携酒饮予舟中即席奉谢二首 其二
1070561,庭菊烂开招子我共赏而空无酒饮闻瓜洲酒美遣酤数升殆如灰汁戏作三绝句因以酬九月四日戏赠之作 其三
50963,拟挽歌辞·在昔无酒饮
69840,西江月·酒饮清光滑辣
926804,笺年老逢春八首 其二 美酒饮教微醉后
1070560,庭菊烂开招子我共赏而空无酒饮闻瓜洲酒美遣酤数升殆如灰汁戏作三绝句因以酬九月四日戏赠之作 其二
861807,西江月 用荼酿酒饮尽，因成此，谩呈继韩王炎
509969,九日诸生携酒饮白沙醉中和答 其二
728269,十月十日蔡铉升载酒饮我于病榻练江南枝二诗衲偕至
781968,甲申元夕巢大司寇寄斋可托以柏叶露和梅花酒饮松涛阁下同人分赋得操字
687412,贱降前一日俞厚庵暨沃泉携酒饮予舟中即席奉谢二首
