764824,一萼红 朱修伯太史同年学勤见余上年赠月娥词属倚原调转赠雪卿为赋此阙
97137,过潼川之飞乌县见余干丞相题驿舍诗有感次韵
496942,尧峰山清晖轩落成送楞伽寺弘上人归隐且见余志
1116611,仲天贶、王元直自眉山来见余钱塘，留半岁，既行，作绝句五首送之
921434,云师无著自金陵来，见余广陵，且遗余《支遁鹰马图》。将归，以诗送之，且还其画
413520,周生明道，萧山周家湖人，家贫失学，致力于医，居恒一卷自随，且性耽吟韵，见余诗慕其为人，毅然携所作诗稿过访，殷殷下问立身治学之道，于其还萧，得四绝示之选二 其一
1058500,欧阳叔向见余试院中诗卷作诗见誉次韵酬之
432940,周生明道，萧山周家湖人，家贫失学，致力于医，居恒一卷自随，且性耽吟韵，见余诗慕其为人，毅然携所作诗稿过访，殷殷下问立身治学之道，于其还萧，得四绝示之选二
101701,孤寂吟·时人见余守孤寂
100902,仲天贶王元直自眉山来见余钱塘留半岁既行作
702274,早行忽数人被甲持弩至道左俟土酋及见余或揖或跪译者曰此倚石村部民也期此地迎酋而归既而上马从行至晚同宿山中赋此
139924,大理曾少卿欲见余近作录数篇寄之以诗为谢且
1089552,九月十一日龙华寺斋宿礼部陈同年见余嵬字韵诗宠和惠示复用韵奉酬
821044,卜算子 其二 从子星伯见余和辛词而好之，因持所作天风海涛之图，乞用前韵
499295,盛阳先生见余和刘羽冲诗亦和以见规有狂奴犹故态旷达是牢骚句敬赋一篇奉答
833586,金缕曲 其一 韬父见余近词，不胜感怅。宣南老友，惟君一人，言愁欲愁，再成是解
764291,满江红 其五 湖上遇顾庵，见余和词用韵见柬，复次奉答。
546865,王生庭中二雏鹤见余甚狎即席赠诗二章 其一
1235378,余尝作二诗观者皆喜文卿见余写此卷俾余书之于上
824188,阮郎归 周生梦庄见余旧藏清仪老人金石手稿，中有君子耆老册一种，因为订正，更一再续辑得百人，加弁语见贻祝我，可感也。生好佛学，而耽倚声，于金石亦素研治，其所钤章曰“海红精舍”，曰“鸳鸯同梦楼”，皆极雅趣
329445,道先游仙都至李尊师故居见余早岁题赠拙句存于屋壁辄寄四韵重相叹赏谨有赓酬
295673,赵柏庼见余寄寥士诗次韵见怀赋答
1091512,亡友高伯庸滑稽玩世屡与人忤而见余则加敬人共怪之亡八年矣今庆臣风度大略相似而所忤所敬又极同也感叹之馀次庆臣韵赠庆臣
1231918,余尝作二诗观者皆喜文卿见余写此卷俾余书之于上 其一
500832,万户赵祯见余访单宪使不遇之作赓歌四章雨中来谒用韵以荅
697438,王生庭中二雏鹤见余甚狎即席赠诗二章
1231919,余尝作二诗观者皆喜文卿见余写此卷俾余书之于上 其二
553311,早行忽数人被甲持弩至道左俟土酋及见余或揖或跪译者曰此倚石村部民也期此地迎酋而归既而上马从行至晚同宿山中赋此 其一
546866,王生庭中二雏鹤见余甚狎即席赠诗二章 其二
347661,欧阳叔向见余试院中诗卷作诗见誉次韵酬之
353496,九月十一日龙华寺斋宿礼部陈同年见余嵬字韵诗宠和惠示复用韵奉酬
538560,于鳞归绝不见客而独见余饮之酒又走使损饷绒褐予以吴丝答之而侑以诗
295671,陈寥士见余所作辛夷花诗自宁没和韵见寄久乃见之奉酬一律
1079671,临川王坦夫故从溪堂先生谢无逸学北行过广陵见余意甚勤其行也作诗送之
148627,潘宰见余三生图诗广一篇见示再赋谢之
533549,和竹平山人见余庭前桃花
761352,尉迟杯  春暮别褚又梅、金丽生，秋始相见。余又将出游，用美成韵留别
387789,金缕曲·韬父见余近词
1034906,大理曾少卿欲见余近作录数篇寄之以诗为谢且云连日疮疡作读余文而愈因次其韵
273700,卜算子·从子星伯见余和辛词而好之，因持所作天风海涛之图，乞用前韵
553312,早行忽数人被甲持弩至道左俟土酋及见余或揖或跪译者曰此倚石村部民也期此地迎酋而归既而上马从行至晚同宿山中赋此 其二
1056779,道先游仙都至李尊师故居见余早岁题赠拙句存于屋壁辄寄四韵重相叹赏谨有赓酬
567584,干溪许某是蠢子山行遇二仙女折松花令其送往香炉峰上见二人棋他日又见二女令其送往秦望山上与二桃一符一诗曰子父母肯令子来则啖以桃而来否者且烧符后许亦不与父母桃阴置香厨上父母亦不与来而许辄烧符后视桃不见余登秦望山山人对余说乃是前年事
921734,仲天贶、王元直自眉山来见余钱塘，留半岁，既行，作绝句五首送之 其三
1002067,潘宰见余三生图诗广一篇见示再赋谢之
277123,芦湖富士倒影为箱根山中胜景顾甚不易见余以初冬
470587,余买一小丘于铁山下登陟不数十武而尽揽湖山之胜尤于看梅为宜盖踞花之上千村万落一望而收之久欲作一小阁名为六浮六浮之名遂满人耳而阁竟不就友人邹孟阳见余叹息每欲代为经营今日始引孟阳至其地亦复叫绝不能已余因为作六浮阁图兼题一诗冀孟阳无忘此盟时丁巳八月十八日也
99616,仲天贶王元直自眉山来见余钱塘
336051,亡友高伯庸滑稽玩世屡与人忤而见余则加敬人共怪之
921736,仲天贶、王元直自眉山来见余钱塘，留半岁，既行，作绝句五首送之 其五
101152,刘贡父见余歌词数首以诗见戏聊次其韵
921732,仲天贶、王元直自眉山来见余钱塘，留半岁，既行，作绝句五首送之 其一
291659,阮郎归·周生梦庄见余旧藏清仪老人金石手稿
117900,偶游大愚见余杭明雅照师旧识子瞻能言西湖旧
413521,周生明道，萧山周家湖人，家贫失学，致力于医，居恒一卷自随，且性耽吟韵，见余诗慕其为人，毅然携所作诗稿过访，殷殷下问立身治学之道，于其还萧，得四绝示之选二 其二
845276,金缕曲 韬父见余近词，不胜感怅。宣南老友，惟君一人，言愁欲愁，再成是解
921735,仲天贶、王元直自眉山来见余钱塘，留半岁，既行，作绝句五首送之 其四
921733,仲天贶、王元直自眉山来见余钱塘，留半岁，既行，作绝句五首送之 其二
920772,刘贡父见余歌词数首，以诗见戏，聊次其韵
