451957,甲申夏应三江有月之邀赴三峡得与众诗友相识，其后东遨兄三江兄几度来京小聚，日前三江才走，东遨兄又至，赋此以呈
298050,复斋客坎拿大久无书至赋此寄怀
624633,公眉兄自闽漳来访予旧有游漳之约因事不果感其远至赋此为赠
553309,晚至昆阳州饮通守家土官留此州俟予至同宿马氏有邻妇李氏抱子携酒而至赋此
1225146,严陵应仲章自杭寄书至赋此答之
551427,苕溪逢谢长史姊丈携家适至赋此志喜且以为别
615046,余自秣陵奉慈讣奔归孙燕诒闵士行林茂芝诸子送我秦淮之上余既除服诸子寄秦淮折柳册至赋此志谢
443962,浣溪纱花朝将至，赋此以贺颖庐芳诞
424046,渡江云·蟠云先生招集江心浩然楼，阻雨未至，赋此致意
493585,夜宿城南天井闸候水忆孟邻王贰守时许为余写弄琴小像未至赋此以寄并柬府公赵大参秉彝
493584,夜宿城南天井闸候水忆孟邻王贰守时许为余写弄琴小像未至赋此以寄并柬府公赵大参秉彝
600914,春日李维任舟中召饮不至赋此赠之
749709,高碧湄同年春间谒选入都取道阊门流连旬日盛称铜柈吴叟之为人心向往之道远莫致乃不浃月而余已与吴叟见于金陵碧湄邮书坚余引退之约亦适由济南递至赋此答之并呈铜柈即用湘乡相侯赠吴叟诗原韵
296219,渡江云·蟠云先生招集江心浩然楼，阻雨未至，赋此致意
761485,寿楼春 乙未清明后一日，星岑前辈招同答泉、半塘游江亭，答泉期而不至，赋此调寄怀，半塘属和，吾亦继声，起句同用“嗟春来何迟”五字。
