1120785,顷岁盗起徽严间兵既临城部使者而下皆弃官以走别乘强幼安摄郡事解衣高卧而贼不至城遂以全仆尝作送行诗以书其事后二十一年岁癸亥幼安始得州相遇于钱塘幼安犹能诵鄙诗而余漫不复省矣手录见遗读之惘然为题三绝其后
828322,十一月廿四日携女下山治疾走别散原先生
1075610,顷岁盗起徽严间兵既临城部使者而下皆弃官以走别乘强幼安摄郡事解衣高卧而贼不至城遂以全仆尝作送行诗以书其事后二十一年岁癸亥幼安始得州相遇于钱塘幼安犹能诵鄙诗而余漫不复省矣手录见遗读之惘然为题三绝其后 其二
43926,走别张文峙杜于皇苍略因登鸡鸣山
1075611,顷岁盗起徽严间兵既临城部使者而下皆弃官以走别乘强幼安摄郡事解衣高卧而贼不至城遂以全仆尝作送行诗以书其事后二十一年岁癸亥幼安始得州相遇于钱塘幼安犹能诵鄙诗而余漫不复省矣手录见遗读之惘然为题三绝其后 其三
729148,走别张文峙、杜于皇、苍略，因登鸡鸣山
1075609,顷岁盗起徽严间兵既临城部使者而下皆弃官以走别乘强幼安摄郡事解衣高卧而贼不至城遂以全仆尝作送行诗以书其事后二十一年岁癸亥幼安始得州相遇于钱塘幼安犹能诵鄙诗而余漫不复省矣手录见遗读之惘然为题三绝其后 其一
