713305,九日湛静斋亦宋乔梓载酒元明石室登高同郭公鹫湛天沐天及祯士文安泽君介以长儿端木纵饮至夜月高而还地为甘泉先生书院故址碑碣存焉二首 其二
826201,八声甘州·重阳日挈伴灵岩登高，同人绘琴台秋畅图记其事。越二旬，余继赋此，时秋深霜厉，边氛益恶，眼底新愁，视重阳时又增几许。宜其声之掩抑矣
502387,乌夜啼练高同赋
410933,秋津山寺登高同两徐、戴、袁群
147824,过三衢寻乡僧适遇爱山徐叔高同访郑监丞其家
713304,九日湛静斋亦宋乔梓载酒元明石室登高同郭公鹫湛天沐天及祯士文安泽君介以长儿端木纵饮至夜月高而还地为甘泉先生书院故址碑碣存焉二首 其一
558179,送佥宪杨惟高同年兼简陈邦贵
819077,九日爱宕山登高同秋樵袖海
1033462,过三衢寻乡僧适遇爱山徐叔高同访郑监丞其家梅园甚佳选百家诗
869364,子高有徐浩诗碑昌言借摹其文甫及数本石有微衅惧而归之子高答简有碎珊瑚之戏昌言以诗赠子高同舍皆和
285476,秋津山寺登高同两徐、戴、袁群
404898,霜叶飞·丁酉九月北投登高，同蔼麓絜生渔叔，用清真韵，兼呈醇士寥音二公
381127,九日爱宕山登高同秋樵袖海
445263,丁亥九日遥念江右同仁狮子岭登高同用小杜九日齐山登高韵
721412,九日湛静斋亦宋乔梓载酒元明石室登高同郭公鹫湛天沐天及祯士文安泽君介以长儿端木纵饮至夜月高而还地为甘泉先生书院故址碑碣存焉二首
304343,九日焦山登高同公渚作寄君适庐山
828303,九日焦山登高同公渚作寄君适庐山
