956921,伏闻知府秘书欲取小杜桐庐诗语以见花名堂成大记东坡送郑户曹诗云荡荡清河壖黄楼我所开迟君为坐客新诗出琼瑰楼成君已去人事固多乖此段大类今日成大行且受代计梅开堂成归舟已下南浦欲为坐客不可得怀不能已请先为公赋之
1033358,归舟已具李宪楼仓有约盗贼梗道见避乱者可怜 其一
178988,出峡·牵舟已出峡
147831,归舟已具李宪楼仓有约盗贼梗道见避乱者可怜
1216873,宴四明江中醉卧及醒舟已次车厩站
1033951,归舟已具李宪楼仓有约盗贼梗道见避乱者可怜 其二
238629,五月六日约诸友游北山舟已具而予偶不能出诸
987297,五月六日约诸友游北山舟已具而予偶不能出诸友和坡公法华寺诗亦赋一首
649258,到桃源黄学士舟已先在南岸不得相即相望怅然
105683,至第四铺·轻舟已过第四铺
1032359,饭石壁下逢僧附船还叫岩寺明石山如平台曰赭亭山也僧至岩下饮要余同游舟已去矣
1132137,归舟已具李宪楼仓有约盗贼梗道见避乱者可怜
283500,减字木兰花·守瑕得旧扇，故宫物也。中舟已作篆书，署臣字，更属补桂，因题
42309,洞仙歌·行舟已发
834592,减字木兰花 守瑕得旧扇，故宫物也。中舟已作篆书，署臣字，更属补桂，因题
586788,赠少参王本一本一以公谴谪戍吾璚上谒军门予适守苍梧道过与语甚悦且闻其善书因求写梧山书院四字及敬义字皆有矩矱临别谓予宜有赠什予归急草古风一章未及脱稿而舟已发矣人便因附寄申意
522212,十一日晚登舟已大醉夜梦读书喜而有作
