660955,次韵吴克温先生雪假山 其二
1123360,何推官见招游岳麓以郡中事冗弗克偕行口占二绝以谢
45136,结局或开始---献给遇罗克
1001006,喻子才提举招昌源观梅倦不克往苏仁仲有诗次韵
717281,过马佐领克起粤秀山房赋赠 其二
502750,赋得沙堤送别造士王克刚赴召入翰林
558373,聚爱楼四咏为克勤赋 其一
915649,寄题分宜李克明上舍高居二咏 其二 东塾
415436,李克因整理全集，赋此寄感
248780,步黄克孙韵题《莪默绝句集译笺》
313767,乌夜啼·丁树本率民团克清丰
882834,闽宪克庄以故旧托文公五世孙明仲远徵鄙文老退遗弃散逸荷伯宗用昭止善浩渊子勖至善及余表侄孙陈谊予兄子丰仲弟之婿贾熙用昭之从子大年等十馀人寒冬连旬日夜录之得五十卷亦已劳矣赋此为谢
445454,江右诗社己丑浔阳年会诗草 其二 访白居易草堂大雨不克而返用梅岗起句
240178,警懦·颜子之克己
677481,别南刑部黎克芳蔡汝聘二首时淮阳方有寇警 其二
518987,海珠寺燕张克脩吴献臣 其一 送克脩
518987,海珠寺燕张克脩吴献臣 其一 送克脩
313396,大酺·重检瑞士柏林意大利萨克逊图画，忆欧西旧游
14519,旅次沔阳闻克复而用师者穷兵黩武因书简之
740583,礼烈亲王克勒马图歌
514320,上元日与林谕德亨大商懋衡李世贤二侍讲饯同年陆叙州克深考绩西还联句十首 其一
807357,八节长欢  元日后二日，积雨新晴，偕大鸿、云臣散步城南，望铜官一带翠色，眷恋久之，不克，游南岳而返
105499,欲晚访韩持国忽道损见过不克往持国示诗因答
651156,舟中杂兴柬韩克和刘自牧王尚文宋广文十八首 其四
513542,送克宽弟南还至茶庵独归 其三
92004,十月四日同子文克信子潜子直材翁
427692,贺新郎 予转徙岭南，情怀牢落，适得双照楼主二月二十七日书云，将转地疗养，且殷殷以三百年来词选为询。二十一日，先生舟经香港，不克趋前握别，赋此寄之
1088462,次吕季克东堂九咏 其二 敬义堂
491962,过李黄罗茅堂五首柬克正茂才 其二
875246,次韵赵克勤吏部六首 其一
412806,答戴克光寄登峨眉绝顶诗二首 其二
658579,送吴编修克温归省宜兴
711708,宿罗克生
803985,阿克苏守岁呈朗公
660564,题沈克寅扇
495344,师入宁国，时徽郡来降，留都尚未克复
1088465,次吕季克东堂九咏 其五 爱莲
515126,送前泌阳令丁声远自番阳取道新安还辽东兼致意贺克恭给事同年
1228645,庐陵十景同萧克有孚有诸公作 其一 神冈晚桥
612327,冯无文重访镜园班荆道故交情弥笃忆昔曾与邝湛若偕来计三换历矣湛若待秋试今弗克偕念旧伤离对酒惆怅赋赠无文兼寄湛若
515914,高克明左迁镇远府判自号铁溪主人及内移为赋此
897227,离楚夜泊高丽馆寄杨克一甥四首 其三
468708,自举师不克与二三同志怏怏不平赋此
422742,乌夜啼 丁树本率民团克清丰
1248085,送赵克常归楚
1033636,赵克勤曾橐卿景寿同登黄南恩南楼 其二
1231441,篬筤轩为张克旻作
259810,哈耶克
1002088,题李克明依绿园
973106,挽俞克晦丈二首 其一
491996,奉和崔州判仁卿山长克诚夏日同游开善寺
836867,七月二十二日攻克集集，斩首百馀级 其二
803944,望博克达山
516188,送丁克明归常州省亲
113713,公溪口·江都克家才
54836,为潘克承题林良芦雁
256598,鹧鸪天·吊李克修
406670,白克路故居女颐生处
672616,送胡佥宪克敬
1141539,大名元复初郎中携示感遇五言八章次韵并陈东平曹子贞编修蓟丘曹克明 其二
1143383,大名元复初郎中携示感遇五言八章次韵并陈东平曹子贞编修蓟丘曹克明 其六
1229932,嘉平十日访文伯纯遂偕施克刚胡明初游眺鳌峰道院饮韦鍊师方丈王敬叔继至分韵赋得山字
661800,玉楼春 赏克振弟牡丹
1215666,二山九日示铁克刚
138836,和金克孝韵·天公放我作閒人
637404,用韵答蔡克智暨王节推
993206,欲晚访韩持国忽道损见过不克往持国示诗因答
793255,暨阳克复渡江纪事八首 其六
1184287,克复后登安国寺阁
460864,叠前韵悼物理学家兼诗人黄克孙先生三首 其一
326913,不改其乐·己私既克本心存
327095,克己·宝鉴当年照胆寒
184301,闽宪法克庄以故旧吒文公五世孙明仲远徵鄙老
274326,菩萨蛮·土耳其名诗人希克梅时有诗颂新中国，余译其意
803929,将至鼸泉车中别博克达山
1218642,仪真向有馆驿久废船马俱无使客不便省委宣使梁克诚振治一新粲然可观诸公有诗题赠因题卷后
138230,用金克家韵赋梅花
574505,正月三日小饯施克和于惠山酒间克和诵刘后村元日诗为令因用其韵再致别意是日予奉老母观新精舍故别设于知微山房云
574505,正月三日小饯施克和于惠山酒间克和诵刘后村元日诗为令因用其韵再致别意是日予奉老母观新精舍故别设于知微山房云
695554,次韵王克明三首
515021,留别蒋长洲克明 其二 宣溪
1250586,宋铙歌鼓吹曲十二首 其十二 海内咸臣唯北汉假息汤釜上亲征之其主刘继元素服纱帽待罪台下诏释之为克戎逋第十二
1144659,大名元复初郎中携示感遇五言八章次韵并陈东平曹子贞编修蓟丘曹克明 其二
1023938,兴化打克宾克宾如此答颂
1023938,兴化打克宾克宾如此答颂
731418,官军攻克金陵诗以志快
314596,王克宽老以怀乡诗见示依韵答之
672697,送克温改官礼部
1251647,送解克铭周仲玉吴所宗赴京
491348,奉答丁克诚拟古四首并各因其首句云 其二
836866,七月二十二日攻克集集，斩首百馀级 其一
279219,龙山会·九月初二日同克群散步南洼，寻龙树、龙泉、凫潭诸胜
810195,由托克逊夜抵苏巴什沟
512476,与韩克瞻苏安道守岁
494285,送周克道吕汝德入九华兼寄先在山诸君
909960,卢泉之水次韵晁克民赠隐人
1253264,送乡贡进士钱宗善馀庆吴时纬仲文吴克潜纲赴京会试
585257,贺刘克柔正郎严慈俱七十有五以人生七十古来稀为韵七首 其五
514329,上元日与林谕德亨大商懋衡李世贤二侍讲饯同年陆叙州克深考绩西还联句十首 其十
569773,明卿走酹先司马墓贞以病不克从仅家弟侍行志痛志感
163307,吴克明广文见和再用韵答之
515372,自断石与司训黄伦汝彝及亲契汪锭克成族孙乙汰万并载竹筏沿溪泛至流塘饮詹贵存中家道中联句五首 其一
673103,送刘进士克立知屯留
829503,八犯玉交枝 次日朝霁，与克群踏雪至江亭，归而雪复大作矣
513865,舟中清明有感寄克俭弟
413352,赵克臻大家别二十馀年矣归国观光海上喜晤因知近年以诗名藉甚香岛赋二绝赠行 其二
499434,外甥吴缉字克熙洪武十二年二月客死于景陵时年二十八余哭之恸赋此以志余哀
668262,与宜兴吴祖贻夜话有作就简李宗渊杭道卿吴克学
659359,和吴克温白发诗
513864,与提学娄克让御史饭泗亭驿舟晤言甚洽
697590,别南刑部黎克芳蔡汝聘二首时淮阳方有寇警
540648,慰克加侄
254970,致一位萨克森诗人
283142,偕内子挈儿女游莫斯科近郊阿汗格司克宫偶成一绝
97613,送刘克昌文显·驿使相看合寄梅
660946,送朱克谐谒告还进贤
521335,送程克晦
564941,清明日都人士俱为扫松之行儿子克弘告予曰儿不随父拜垄上三岁矣闻之怆然因述以诗
1107550,待制中书舍人陈公之亡以山宅须利既迁殡而未葬也后五月乃克葬焉二首
742987,秦小岘侍郎诗来问病约同李石农茶话余病不克往用韵谢之兼寄石农
909588,沁园春 其二十二 以雨不克登楼，用前韵
1208942,三原张氏茔望松亭（张克礼）
1242554,寄河南卫镇抚赵克家叙旧
256058,青春 ——读蒙克的画
452441,诸君寻长干里予未克往
651158,舟中杂兴柬韩克和刘自牧王尚文宋广文十八首 其六
204041,送刘无竞克逊司门赴召
259586,重阳后雪寄马柔克
478521,永乐初给事姚伯善采木广右被瘴客死殡及六十年至其孙榛鹤始克归葬先兆作诗记之 其十一
821099,如梦令 冬至后苦雨沈阴，凄懑欲绝，先有人属为巴山话雨图，病不克就。每与尹默夜谈，笑谓此真他时画稿也
702378,有感次高夏官克明韵二首
651165,舟中杂兴柬韩克和刘自牧王尚文宋广文十八首 其十三
514227,都廷美参将之子克让思以经术自奋求诗为勉
620473,德州中秋同姑苏徐觉予西湖张克壮对月
836876,再克集集，俘斩二百馀级，溪水为赤 其一
952140,贤者之孝二百四十首 其一七六 徐孝克
822510,八犯玉交枝 其一 次日朝霁，与克群踏雪至江亭，归而雪复大作矣
96673,克斋·百川恣奔腾
1248320,与丘克庄晚立瓜洲望京口诸山
638349,哭舍弟克明三首 其三
425462,陈克昌夫妇忠烈
513431,送克俭克宽弟省觐南京 其三
513431,送克俭克宽弟省觐南京 其三
666190,送克相侍御使齐鲁五首 其四
637396,次高克明韵 其一
721350,移家西归留别湛克正克茂外弟兼柬同人二首
721350,移家西归留别湛克正克茂外弟兼柬同人二首
445313,临川雅集予不克往先谢诸子次韵山谷登快阁应月课
593077,寄袭克懋二首 其二
1141538,大名元复初郎中携示感遇五言八章次韵并陈东平曹子贞编修蓟丘曹克明 其一
660807,题沈克寅扇
524174,辛巳九日田子要东陂之游雨弗克赴三首 其三
520109,次娄克让宪副咏梅韵 其二
