581849,送平乐尹克龙梁公奏最之京时寓临江行台理疾以俟归命
561882,送王克斋都宪总督漕运自举进士至今予三赠诗矣
828985,望博克达山不能上也
834530,浪淘沙 九月十九日石工约集词社同人为展重阳之会。病不克与，走笔赋呈，不耐苦吟，聊慰猎心耳
513550,新安洪生通今郑州守有约之少子乡进士远之弟而予兄汀州贰守克和之婿也来京师从人受春秋学日以成岁暮欲将往省于郑且南还入郡学以俟秋试其志可谓健矣道别之际赋诗赠之
560469,韩克赞求存一道人诗
659331,和吴克温直禁卫卒韵二首 其二
510877,寄张梧州克修
451446,百字令 寄怀陈君克明。
633807,乙卯五月素敷谒选赴都相晤于九成台畔四十字赠行相喜相勉之私非四十字能尽然素敷随事躬省栽培德行虽得时向荣以慰北堂之欢又能端悫克慎不堕青云之志只在回光返照中耳
1243622,题李克明翁媪起家图（一翁以指就醋瓮取醯吮之尝其味之美恶一媪持星火吹灯备诸穷态）
1012449,浮舟之昌国谒韩克明知县
809560,克鲁伦河上流雨后草生
346790,令佐约登息梅岭不克赴次来韵
501332,赠副使丘克明
1208840,送刘克让归汴中三首（名天秩由河南乡贡中第竞以便养辞馆阁之职除济宁录事须次觐省） 其二
493033,小雨约李克正过池上
603319,送何侍御谪楚藩司从事因怀范原易李克苍原易旧守洪都克苍先以比部谪楚 其一
603319,送何侍御谪楚藩司从事因怀范原易李克苍原易旧守洪都克苍先以比部谪楚 其一
912706,芙蓉盛开戏简子文克信
431522,挽黄克强先生二首
448783,乌鲁木齐谒欧阳克嶷先生蒙赠长句次韵奉答
319807,菩萨蛮·克劬北上旬日，计程未达帝都，寒夜不寐，悄然念之
513429,送克俭克宽弟省觐南京 其一
513429,送克俭克宽弟省觐南京 其一
586049,答陈克威
513430,送克俭克宽弟省觐南京 其二
513430,送克俭克宽弟省觐南京 其二
637402,秋夜言怀次高克明韵 其一
502735,王克刚碧萝山房
747103,阿济克鸠
486020,荅王克让
680531,和邹克清韵
1236281,同朱克齐蒋教授游大梵寺二首
794156,秋夜怀克九
1242672,寄内台侍御史韩克庄
673440,送陈岳克厚归琼河
689565,送万克修归省
680529,和邹克清韵
696208,次韵吴克温先生雪假山
914270,克信弟坐上赋梅花二首 其二
661772,何克廉宅观妓 其二
92659,见张钦夫·克巳今颜子
637950,谢石斋转惠辽东贺克恭黄门所寄高丽团领
798685,重叠金·中秋同家笃初侍讲启煇访日本船津克己领事辰一郎山中，归途口号
672928,送克温尊甫先生
651162,舟中杂兴柬韩克和刘自牧王尚文宋广文十八首 其十
1211319,次巴克实彦卿雪中见示韵六首 其四
690052,武克显赠别卷二首
504139,伴读周庠求题其师叙南游克成先生双溪草堂
652962,题沈克全鹤沙八咏 其六 西湾夕照
607844,秋夜黎缜之何克函黄汝昌方熙之集饮谢宗吉宅喜李永后至
92426,克信弟坐上赋梅花
981480,和克家侄谢周凤隐雪中留宿韵
1003849,挟文薛君自赋五首克己读书安贫择交训子为题戒其子婿王叔俨万里索和 其三
264897,克己复礼·克己工夫未肯加
264897,克己复礼·克己工夫未肯加
672203,赓嘉定二教林克清见寄
1004177,挟文薛君自赋五首克己读书安贫择交训子为题戒其子婿王叔俨万里索和 其五
376122,克己斋·罔念圣为狂
494539,题周克道藏脩所二首 其二 桃溪精舍
516553,送吴克全
591487,寄郑克一
324320,蝶恋花·王克恭生日
1143380,大名元复初郎中携示感遇五言八章次韵并陈东平曹子贞编修蓟丘曹克明 其三
680732,送克新内兄还匡南
654985,廷试执事和程克勤诗韵 其二
666187,送克相侍御使齐鲁五首 其一
641581,古乐府煌煌京洛行送施掾史克让使还京都
974574,蕃丙午冬分宜见公度簿公尊兄已而邂逅于宜春蒙以蕃与徐斯远志别六言之韵作诗为赠久未和答今日东归乃克赋之四首 其一
836886,自林圯埔进师，与官军会约由溪洲底攻克斗六逆巢，越日袭取东埔蚋等处，俘获逆徒十三人，作歌纪事
1218982,和李克约东皋杂兴四首 其二
654120,武克显赠别卷二首 其二
503765,送陈克明还茶陵省亲
502655,书郑克刚云泉清隐卷
679887,赋得二题送严克谦之京 其二 鹅湖晚钟
516184,送贺克恭黄门得告归辽左二首 其一
671022,感逝示克懋
564897,句曲山房为王克斋题
628052,赠程克庵县尉 其二
673122,和克温寒夜独坐
732416,霖臣过绿玉斋同克张小饮
651154,舟中杂兴柬韩克和刘自牧王尚文宋广文十八首 其二
94948,重九後二日同徐克章登万花川谷月下传觞
660954,次韵吴克温先生雪假山 其一
433803,王克宽老以怀乡诗见示依韵答之五首选二
460806,步黄克孙韵题《莪默绝句集译笺》三首 其三
774098,题马云伯贰尹克惇课诗汇编
728925,哈萨克陪臣到因携观广陵风景
540295,克懋藏于鳞卷后
489694,题丘克庄敬云楼
460703,读《苏子聊斋-克拉玛依十一年记》
687061,忆李氏茅堂三首奉柬克正兄
689575,雨中与沈克寅赏莲二绝
545957,虞鸿胪以精舍借居竟不克往赋谢
915050,十月四日同子文克信子潜子直材翁子立诸弟访三十二叔祖于小蓬莱酌酒摘金橘小集戏成长句
244917,赠番易程克已
91461,致克恩
489976,施克让大监以效忠输贡南来会于钱塘 其一
939200,新居六咏 其五 克斋
739625,札克丹鄂佛浴营观蒙古骑生马歌
558483,欲至济宁访过太朴冬官途遇工部张克谦饮驿舟中至暮不果见太朴作一绝记与克谦相见之偶肰也
558483,欲至济宁访过太朴冬官途遇工部张克谦饮驿舟中至暮不果见太朴作一绝记与克谦相见之偶肰也
661420,秋日杂兴和程学士克勤韵 其一
1163871,题杨克俭池馆
255164,马克丘·毕克丘之巅
255164,马克丘·毕克丘之巅
581648,雪夜饮黄门李克昭第以阄马较胜负约以五败者兼罚诗一首用以塞命
603682,赠李克庵楚中开府
1157225,别杨颖士卢克柔殷尧藩
459864,五月十四夜观《泰坦尼克号》后偶与共坐
1123787,挽俞克晦丈二首
809572,赐将军孙思克
542336,送沈克昌东归
1088464,次吕季克东堂九咏 其四 吟哦室
1108946,次韵赵克勤吏部六首
457609,连日幸会叶克勤兄、戴丛洁兄、方清刚兄、扬絮飞李国新贤伉俪及胡巍兄等用前韵
713245,寄怀何克谏何景雪
663357,刘克柔迎养二亲乞诗为寿以人生七十古来稀七字为韵
781343,寄孙克咸 其二
1198090,魏鼓吹曲十二曲 其四 克官渡
354107,诸友偶赋克己以战喻次韵酬之
695695,寄袭克懋二首
98696,挽俞克晦丈·好官堪底用
152836,同王克慎宿清凉寺兼示和上人孙安之
552451,送王克让归湖南侍亲并柬李中卿县丞
897759,别外甥杨克一
560182,送陈克让
577561,挽庄教谕克敬
48633,遇史克敬询故园
651160,舟中杂兴柬韩克和刘自牧王尚文宋广文十八首 其八
363062,秋日克九过访留饮
1242951,克让许寄酒，诗以趣之
1251634,和陈克斋清明登瑶台有感 其二
1122493,昨幸甚得见子玉教授丈得一论其说出于订顽克己铭词致超绝辄借前韵以庆兼呈诸丈幸乞一笑正再拜上
163533,计友载酒沧江海棠下公许以上寿亲庭不克与胜
661771,何克廉宅观妓 其一
971635,送刘克昌文显二首 其一
645862,次韵答刘克勤
1219286,送李举人克明任教职
149040,题李克明依绿园
794155,秋日克九过访留饮
408370,挽黄克强先生二首 其二
1252288,题李克明翁媪起家图二首（一翁以指就醋瓮内取醯吮之尝其味之美恶一媪持星火吹灯备诸穷态）
665711,别林克相二首 其一
1225963,送曹克明员外之湖广省
116488,寄杨克·水天夕云重
1001686,送五行家唐克寿
661389,寄许克大
859868,问邵武守刘无竞克逊求邵武红朱三首 其一
696045,上巳日孙清远陈三水沈从化三明府公偕程参戎田都护招同社岑克念朱季美万伯文刘季德咽慈度寺分赋
654965,壬辰斋居和程克勤韵
688486,和林克全韵三首
202141,卢泉之水次韵晁克民赠隐人
1106281,送刘无竞克逊司门赴召三首
673109,同张中舍克之访陈士彦国子监
473514,简克承丈
389989,赠袭克懋文学
255336,潘维悼念麦克迪尔米德
807348,水调歌头  元夕前董樗亭至都下，樗亭昨岁射陂遇盗，身被重创，患不克来，今之来也，词以志喜，即用樗亭见赠原韵
962377,昨幸甚得见子玉教授丈得一论其说出于订顽克己铭词致超绝辄借前韵以庆兼呈诸丈幸乞一笑正再拜上 其五
672754,送吴克温南归 其二
516287,挽黄门林克翀其子任中书舍人
1091527,邓才卿同年两顾敝庐病睡不克见别后次庭藻送行韵谢之
1033635,赵克勤曾橐卿景寿同登黄南恩南楼 其一
1051988,中丞温伯杂端持正约同饯夷仲不克某独出城重阳后一日
563696,别族太叔克彰
453322,伊犁特克斯峡谷
607152,六月六日诸词客大集天界社招余以公阻不克赴
781429,得孙克咸死难信 其四
520253,秋夜斋居与娄克让宪使马启东大参刘文纲少参联句
540277,过九江风迅不克上匡庐自嘲
278851,江豚·汹涌江涛孰克留
604746,旗峰之约余数食言矣再期于今岁人日若弗克则不敢再订也第旗峰无恙园公亦无恙情见乎词
673111,再次韵克温雪假山兼谢留饮 其一
86993,次韵赵克勤吏部·篱边雪畔影横斜
585253,贺刘克柔正郎严慈俱七十有五以人生七十古来稀为韵七首 其一
513541,送克宽弟南还至茶庵独归 其二
875954,蒙恩复畀明道祠寄呈赵克勤吏部三首 其一
1231207,客海陵光孝寺秋深感怀二首简盛克明 其二
477869,送吴克存还山
371646,刘克庄潜夫诗编
1040190,何推官见招游岳麓以郡中事冗弗克偕行口占二绝以谢 其一
500743,送邵克忠赴武冈照磨
794157,春日元修克九过饮淡园
385817,闻九江克复口占
564786,句曲山房歌王克斋司徒请赋
1251633,和陈克斋清明登瑶台有感 其一
694762,送贺克恭黄门得告归辽左二首
1088460,正月五日欲用斜川故事结客载酒过伯休新居风雨不果二月五日始克践约坐间以陶公卒章二十字分韵熹得中字赋呈诸同游者
1225048,扬州别斡克庄佥宪
828973,浣溪沙 塔里木戈壁中忆阿克苏温宿之游
491963,过李黄罗茅堂五首柬克正茂才 其三
501768,次韵王克明三首 其一
471497,哭梅克生
301916,挽黄克强先生
702374,上元日与林谕德亨大商懋衡李世贤二侍讲饯同年陆叙州克深考绩西还联句十首
98594,闻克斋舅氏除江东提举以此寄贺
518973,悼卢克让
58550,答王克让·万国烟尘海沸波
661330,确斋为礼舍丰城王克振题 其一
267141,东科克
446955,致冯克熙先生
659292,日磾调马图为吴克温题
898032,离楚夜泊高丽馆寄杨克一甥四首 其四
681846,张克振归顺德
802116,四弟恳予易其名字，子取文王世子语为更名曰克昕，字徵子，因诗以勖
916379,闻北师克捷喜而成咏
560424,庆韩克美母寿
514098,雨后与克俭弟联句
1135677,题沈克己无名庵
875953,蒙恩复畀明道祠寄呈赵克勤吏部三首 其二
282821,李克因整理全集，赋此寄感
595766,贻云间高士吴次一朱克温兄弟
583313,次韵答赵克用煎茶
658459,陈给事玉汝羞鳖见邀雨不克赴以鳖见馈作诗谢之
116487,寄杨克·客去水关闭
755572,舟次白泖塘遇雪至梅里闻省城克捷时癸亥冬十月廿五日也
134609,景仁思归雨未克行以诗留之
897084,奉议杨君予姊丈也廉静乐道不交世俗造道微妙自得不耀未六十而终予实铭其墓其子克一又纂其遗文求书卷末怀想平昔不知涕之横集也
520056,有怀娄克让 其一
607845,秋夜黎缜之何克函黄汝昌方熙之集饮谢宗吉宅迓林元美不至
514328,上元日与林谕德亨大商懋衡李世贤二侍讲饯同年陆叙州克深考绩西还联句十首 其九
933731,病中简仲弥性唐克明苏训直
362804,冬日克一过访和赠
661421,秋日杂兴和程学士克勤韵 其二
962284,永遇乐 次韵辛克清先生
542903,拟大明铙歌曲十八首 其四 克建业
66454,自举师不克
501685,海漕使京停舟鸡屿呈朱伯厚明府王克明邑尉
809916,泽卜尊丹巴胡土克图老喇嘛上寿
817224,柬任克家
749476,攻克彭泽夺回小姑山要隘
1221612,松月斋为张克敬赋
966734,同王克慎宿清凉寺兼示和上人孙安之
1231130,和曹克明都事灵岩二绝 其二
1218984,和李克约东皋杂兴四首 其四
1218979,赋得铁瓮城送杨克明之淮海书院山长
1239694,五月余还至渭南适克正博士为丞于兹款遇有加意义兼至因用赋诗以道旧并以留别
1235575,和李克约东皋杂兴四首
653141,六礼有将式克语之三加有辞式克御之死丧之威翕共与之饮食言笑肃慎祇之增增来仍式谷以之毋俾此邦不竞谓之 其一
653141,六礼有将式克语之三加有辞式克御之死丧之威翕共与之饮食言笑肃慎祇之增增来仍式谷以之毋俾此邦不竞谓之 其一
923340,石缝泉清轻而甘滑传闻有年矣前此数欲疏引入州治久不克就予至则命工人寻旧迹相地架竹旬月而水悬听事又析一支以给中堂一支以入西閤其下流则酾出外庑往来取汲人以为利因抒长篇以纪其功云
1039798,先与祠岳续以权市征弗克往呈通判沈侯
316274,长亭怨慢·逸兄避暑匡山，予以事不克偕往，挥汗谱寄
535251,平冈七夕见招风雨不克赴
583429,挽李克昭都谏
548872,五忆诗 其四 克孝
862010,凤栖梧/蝶恋花 王克恭生日
520060,有怀娄克让 其五
184791,喻子才提举招昌源观梅倦不克往苏仁仲有诗次
1088467,次吕季克东堂九咏 其七 菜畦
270516,菩萨蛮·咏费尼克斯
324187,和刘克强谢仲振
558376,聚爱楼四咏为克勤赋 其四
690382,聚爱楼四咏为克勤赋
1128151,庆元丁巳十月奉亲如临安宿西菩寺表弟吴克仁俱焉
86990,次韵赵克勤吏部
651153,舟中杂兴柬韩克和刘自牧王尚文宋广文十八首 其一
479251,次吴侍郎克温天界寺别春 其二
709199,送岑克图刈稻东安
663358,西台遗恨为吴克学御史作
1232188,过浮山赠陈克甫
1208839,送刘克让归汴中三首（名天秩由河南乡贡中第竞以便养辞馆阁之职除济宁录事须次觐省） 其一
925541,和吴克明广文赋梅
666191,送克相侍御使齐鲁五首 其五
793589,周凉武、克力两公招饮承恩堂同赋
86994,次韵赵克勤吏部·苔径荒芜薇架斜
460804,步黄克孙韵题《莪默绝句集译笺》三首 其一
460751,赋乌克兰饥荒七十三年祭二章 其二
513481,送克俭克宽二弟南归
513481,送克俭克宽二弟南归
650955,沈氏园赏菊次韵施克和呈在座
513592,送陆克深员外知叙州府
666046,同留克全丁文范董文玉西湖泛舟遂历湖上诸山
981485,勉制干侄克家归乡
641709,宅之约余中秋过小海楼不克往
1208484,宛平县尹李克中号约斋
694374,赠克修别驾迁梧州守来别白沙赠之
880137,口占送纸鹤帐与王克家中书
781342,寄孙克咸 其一
1231434,和克旻孙秋日感兴
463186,自题《莪默绝句集译笺》步黄克孙韵题 其三
691734,辛巳九日田子要东陂之游雨弗克赴三首
1228761,赠胡履平偕克有之兴国
455426,共甲夫克强游江亭用江南韵
665712,别林克相二首 其二
579953,送娄克让绣衣提学次郑从俭韵
882999,挽汪克之给事母程夫人
859867,问邵武守刘无竞克逊求邵武红朱三首 其二
1235900,送刘克让归汴中三首（名天秩由河南乡贡中第竞以便养辞馆阁之职除济宁录事须次觐省）
576958,寄尹伯宏兼柬陈克杰四首 其四
479265,次克温南宫赏魏花
54398,送潘御史克容释累赴京
1216084,送巴克实彦卿学士之任燕南宪使得云字
818003,悼黄克强、蔡松坡，示刘栽甫 其一
875244,次韵赵克勤吏部六首 其三
662236,留赠翟克徵
915574,重九后二日同徐克章登万花川谷月下传觞
497821,题邢克宽太守梅花
514249,刘阮遇仙图为提督河道杨克敏通政赋
1124697,挽克斋陈先生四首
541881,汾州以来分守参政如胡世甫葛与立马子懋程信夫彭克宪陈元卿李子高宋伯镇孙格卿张时芳纪恒甫诸公皆旧识也宋有禦敌之功不见知当道解官归越嗟哉
650725,题指挥克勤斋
772260,温陵故友翁汝哲茂才物化数载，其嗣君克刚抵艋见访，盘桓旬日赴彰春试，握手依依，口号送之
654984,廷试执事和程克勤诗韵 其一
638123,灵州晚泊与舍弟克明小酌
661122,送刘克柔尚宝祭告南行
681411,送张克谦郎中治水利山东
491349,奉答丁克诚拟古四首并各因其首句云 其三
926736,两岁锦屏之游不克见郑令因以寄之
483804,南门司柝诗赠玉珊克温
493662,克念堂订会呈岑蒲谷大方伯
515406,南山梅盛开以将北行不得赏立春日始克至精舍与客夜饮听逸清歌上清词有作
1252898,和陈克斋清明登瑶台有感
494906,赠郑克新同年奉命采实录拟由南宁达云南得便省亲
712047,寿何克谏
915384,和曾克俊惠诗
542361,送许克之下第归历城
520059,有怀娄克让 其四
652023,留别姚克脩御史
585259,贺刘克柔正郎严慈俱七十有五以人生七十古来稀为韵七首 其七
557915,碧桃翠竹图为陈克勤赋
319777,菩萨蛮·盼次男克常不归
979628,赠文潜甥杨克一学文与可画竹求诗
95219,挽俞克晦丈
270604,博克达山·月窟通天柱
1228760,赠萧克有赴兴国税务
520057,有怀娄克让 其二
432915,赵克臻大家别二十馀年矣归国观光海上喜晤因知近年以诗名藉甚香岛赋二绝赠行
1109490,和王克家所寄草堂诗二首
576555,鹡鸰图并序，为大巷伍克和题三首 其一
333443,得诸季书报薛克寅范茂载胡仲俨皆物故感怆有作
660920,赠乡旧张克谋
744609,礼烈亲王克勒马歌
677196,送徐克勤试京兆
361638,先与祠岳续以权市征弗克往呈通判沈侯
651159,舟中杂兴柬韩克和刘自牧王尚文宋广文十八首 其七
542542,赠别武克仁
525040,次赵克用游灵谷三首 其三
623848,上巳日孙清远陈三水沈从化三明府公偕程参戎田都护招同社岑克念朱季美万伯文刘季德咽慈度寺分赋 其二
243646,又次韵答克修
328492,克己·克己功夫未肯加
328492,克己·克己功夫未肯加
1205805,满庭芳 为施克明题雪拥蓝关图
577553,寄克杰陈先生
702413,留别蒋长洲克明 篁墩
665788,克相过草堂别去余病垂死诗来见怀呻吟中答之
502087,为许克谦题画
1218852,邱克庄敞云楼
774060,克澎湖
735909,答刘克猷子壮
804235,阿克苏桑椹因成八韵咏事
513610,克宽弟南归小诗二首奉简淮阴驿丞林文秀内兄休宁上舍汪汝温亲契 其二 简汪
1215810,郑克刚双松图
655007,泊河西务与杨郎中克敬同年夜话
138371,又和金克家送春
515375,自断石与司训黄伦汝彝及亲契汪锭克成族孙乙汰万并载竹筏沿溪泛至流塘饮詹贵存中家道中联句五首 其四
577916,克己斋
660782,送沈克寅
461026,布鲁克巴
341571,慈云祖老相邀至悠然阁倦不克往
637092,送进士马克毅还新会
86655,次韵赵克勤吏部·甫里薄田汾曲庐
346682,诸公约会县中观灯不克赴既又见趣座中赋一章
680781,送玉融庄克荣从戎四川
86992,次韵赵克勤吏部·有小林泉傍隐庐
673123,和克温春夜独坐
829916,悼黄克强、蔡松坡，示刘栽甫
1234236,赵克敬耘庵
517116,别沈克懋
793251,暨阳克复渡江纪事八首 其二
1235646,次巴克实彦卿雪中见示韵六首
698502,送何侍御谪楚藩司从事因怀范原易李克苍原易旧守洪都克苍先以比部谪楚
698502,送何侍御谪楚藩司从事因怀范原易李克苍原易旧守洪都克苍先以比部谪楚
51761,哭梅克生
793252,暨阳克复渡江纪事八首 其三
1242673,夜泊牛渚矶，同韩克庄佥事、李五峰先辈登蛾眉亭
686338,何克廉宅观妓
1202038,临江仙 题王克明喜神
843008,病起赋谢克礼医师君有声沪上前岁归与欧战近来京师始与余相识岂佛家所谓缘耶
973240,寄克斋舅氏
515373,自断石与司训黄伦汝彝及亲契汪锭克成族孙乙汰万并载竹筏沿溪泛至流塘饮詹贵存中家道中联句五首 其二
577616,寄珠冈陈先生兼柬蔡克恭欧阳伯瑄
142633,范漕季克云坡
642073,杏林生意为王克让作
500468,送王克敏赴安丰录事兼简元中宣差
51358,明月山下逢武宾相克仁话旧
1251519,送孙克让赴京
250685,诸君寻长干里予未克往
664163,寿同年贡克仁乃翁
815806,寄孙克咸
526555,咏雪次洪克明邑博韵
660824,雨中与沈克寅赏莲二绝 其二
514401,有感次高夏官克明韵二首 其二
344902,攻克彭泽夺回小姑山要隘
1218801,贺顾克善授平江经历
575333,望白鹿不克至
518440,寄秀才罗季翔刘德明刘志用陈克让王达礼方文兴邓子民杨汝诚 其二
515222,芦塘山庄今岁始一克到其境实清邃为留竟日忘返他日略加脩辟可以佚老因赋一诗
443328,夜雨醉访灞桥，同克光、海洲、星汉、亚平、逸明、京战、迎建、庆霖、力夫、尽心诸君
35012,赠泰州掾令狐克己
1238078,送王克敏之安丰录事
257463,帕斯捷尔纳克
471786,瓜洲风雨不克渡江
187766,口占送纸鹤帐与王克家中书
803986,阿克苏有花，叶似淡竹，花似菊而小，五色均备而无香，中华所未有也。缠回以种，自俄国来，即名俄罗斯花。余以其名不雅，易之曰‘边城菊’，以诗纪之
460866,叠前韵悼物理学家兼诗人黄克孙先生三首 其三
494198,送南京大鸿胪刘克柔
162425,和克家侄谢周凤隐雪中留宿韵
509865,张克修见访
1213122,辛亥三月陪马克脩治书谒天游孙真人方丈阶前牡丹盛开卮酒同玩座中范提点索诗
385949,豫章别曾克庵归吉水
347410,李俊民三十年前凡两寄诗时困于世故俱不克和常抱
688466,次高克明韵
826500,大酺·重检瑞士柏林意大利萨克逊图画，忆欧西旧游
749473,克复岳州
653917,倪克威寿萱图
540294,赠袭克懋文学
898302,题外甥杨克一诗篇末
352626,中秋夜寄克道运使
593076,寄袭克懋二首 其一
466583,步黄克孙韵题《莪默绝句集译笺》三首
520058,有怀娄克让 其三
1211674,别江州总管真定王克绍
279211,八声甘州·故乡人来，娄闻乱耗，夜窗听雨，倍觉黯然。赋示克群
637875,吉阳避风示舍弟克明
513982,大雨雪过黄茅山吴知州克宽邀宿
640073,送陈克明陪师进浙与孙伯融各赋五言赠别分得蛟龙得云雨五韵
739933,题欧舫新诗时届季冬栖息三慧庵相约蔬食习养生之术余未克赴也 其二
520006,一路功名到白头画为娄克让宪使题
55272,五月余还至渭南适克正博士为丞于兹赋诗道旧
562588,挽李克述先生之表叔
747513,奉使越南入关留别和越南魏克循韵 其一
812613,金陵克复后寄颂湘乡师时将回籍
514324,上元日与林谕德亨大商懋衡李世贤二侍讲饯同年陆叙州克深考绩西还联句十首 其五
1218176,和韵秋日述怀简李克明
553641,送倪知县克明服阕赴京
793254,暨阳克复渡江纪事八首 其五
704781,舟中杂兴柬韩克和刘自牧王尚文宋广文十八首
828986,人月圆 迪化至阿克苏机中作
913384,寄题分宜李克明上舍高居二咏 其一 不碍云山楼
443859,克难坡访阎锡山故居
466591,叠前韵悼物理学家兼诗人黄克孙先生三首
740323,鄂尔楚克哈达大营
706597,别峰庵二如表长老类知子者对众大言天下无和峤之癖者唯船山一汉愧不克任而表师志趣于此徵矣就彼法中得坐脱其宜也诗以吊之
591742,同冯用唯陈士鹄夜集郑克一宅
553690,题赠潘克诚菖蒲卷
494466,题克斋为王奉常炜
859986,送刘无竞克逊司门赴召三首 其一
604572,过饮黄周士小园柱诗见赠隃今三载再入五羊重辱招呼乃克和答 其一
1216954,李克约饷腊梅并诗用韵答之
558638,送潘络克理进士之京
1250580,宋铙歌鼓吹曲十二首 其六 师克南平趋朗州武安节度使周保权拒命讨获之为鹰之扬第六
1091211,克商操
662386,送张光禄弟克允还兖州
258563,萨克斯及其吹奏者
1213772,赋纸被呈王克斋同知
1223421,同朱克齐蒋教授游大梵寺二首 其二
1092573,昆山兄惠笔颇佳谢之并呈克斋舅二首 其二
521851,送吴栋卿谒告归兼简黄克明胡希文二太学
492075,谢李克贞送盐
666188,送克相侍御使齐鲁五首 其二
511324,赠黎申兼呈克修梧州
437457,重阳后雪寄马柔克
810891,拔可邀食新荔病冷不克往梦回口渴忆粤中黄皮果不置写寄二绝句
661331,确斋为礼舍丰城王克振题 其二
571230,送朱克诚年兄
688186,有怀娄克让
500239,送顾克新南还
925651,木兰花慢 其一 题广文克明菊隐
558374,聚爱楼四咏为克勤赋 其二
315642,送顾克新南还
560992,赠王克明进士之吉郡
485349,春日怀十友诗 其二 宋军咨克
513473,成化癸巳腊月十日予生盖三十年矣适有史事不克归省怅然有怀谨步韵家君守寿诗一章录似克俭克宽二弟
513473,成化癸巳腊月十日予生盖三十年矣适有史事不克归省怅然有怀谨步韵家君守寿诗一章录似克俭克宽二弟
513473,成化癸巳腊月十日予生盖三十年矣适有史事不克归省怅然有怀谨步韵家君守寿诗一章录似克俭克宽二弟
117030,题外甥杨克一诗篇末
116249,寄杨克一·吾甥颇似魏家舒
485763,丙申三月从平章左公总戎临安过南山访杨铁崖先生时溪涨马不克渡延伫口号
53783,送王克让员外赴陕西
