739552,鄂尔楚克哈达帐中漫兴
1019062,克圆上人
752455,拔可邀食新荔病冷不克往梦回口渴忆粤中黄皮果不置写寄二绝句 其一
445440,小石源探春不克往次韵谢汝启兄
603294,庚寅春三月始克赴京至二河留别诸亲友奉和薛舜徵兄见赠之韵
314433,小病经旬食不下咽俞大松斋馈克宁奶粉代餐赋得诗申谢
709159,喜岑克畴生孙及子举茂才
491961,过李黄罗茅堂五首柬克正茂才 其一
494762,送梁克明掌教乐会
560261,题小竹为邢克敬作
827585,革命军北伐，颇以未克投笔相从为憾
650179,鲁林怀思诗为太常孔克准赋
513502,季弟克宽来京师适当端午西湖南海之莲尚未有花而予家盆池特出二萼化工之巧有若为予两人者设耳克宽南行有期辄用开宴以酬花因思予在西城时此花亦于五月盛开司寇陆公辈各赋一诗以为予中举之徵其后果然今十四年矣故诗及之
513502,季弟克宽来京师适当端午西湖南海之莲尚未有花而予家盆池特出二萼化工之巧有若为予两人者设耳克宽南行有期辄用开宴以酬花因思予在西城时此花亦于五月盛开司寇陆公辈各赋一诗以为予中举之徵其后果然今十四年矣故诗及之
687108,奉答丁克诚拟古四首并各因其首句云
711983,移家西归留别湛克正克茂外弟兼柬同人二首 其一
711983,移家西归留别湛克正克茂外弟兼柬同人二首 其一
644357,寿采堂为许克谦赋
460750,赋乌克兰饥荒七十三年祭二章 其一
1211318,次巴克实彦卿雪中见示韵六首 其三
875241,次韵赵克勤吏部六首 其六
1035259,柳梢青 某既赋小阕为叔母寿因复惟念昔者未尝不得与称觞之列今迎侍不果又以简书不克往侍缺然于怀再遣小阕托诸兄代劝
542938,补蜀汉铙歌十二首 其三 克老瞒
1216145,哭宪使巴克实彦卿
310228,克复林圯埔，在军中偶
1218713,送干克庄佥宪调淮西道
1143385,大名元复初郎中携示感遇五言八章次韵并陈东平曹子贞编修蓟丘曹克明 其八
503791,题彭克让心远亭
404531,念奴娇·咏海和总政老干部学院里克同志原韵
673048,邂逅张克修时闻李天瑞邹汝愚贬官
875952,蒙恩复畀明道祠寄呈赵克勤吏部三首 其三
252919,菩萨蛮·伊克昭盟道中
696079,岑克名挽歌二首
428809,博克达山
1247137,题剡张克让万松窝
674644,克柔乃尊就养京师还靖江搢绅饯别有卷
513775,腊月半后祠堂前并后园梅花盛开敬次家君卷中旧韵二首柬克俭 其二
552894,咏周克复先生三友轩
651166,舟中杂兴柬韩克和刘自牧王尚文宋广文十八首 其十四
674389,刘尚宝克柔邀同其父友桂翁游牛首献花岩次白楼韵
1213228,古任临流亭宴集寄谢座主冀需轩中丞兼简张克斋司农曹子贞郎中及席间诸友
696667,送克相侍御使齐鲁五首
1112563,别外甥杨克一二首
162445,勉制干侄克家归乡
375065,送定维那·兴化当年为克宾
434363,南乡子 李克绍生朝
717280,过马佐领克起粤秀山房赋赠 其一
606796,拟酌游宗振于兰若公阻弗克承示对酒之作聊和其一
877558,挽赵漕克勤礼部二首 其二
1087710,克己
1112757,离楚夜泊高丽馆寄杨克一甥四首
344897,克复岳州·城隅高耸岳阳楼
363063,春日元修克九过饮淡园
98783,雪中用俞克晦丈公择唱酬之韵呈克晦
98783,雪中用俞克晦丈公择唱酬之韵呈克晦
1224729,同曹克明清明日登北固山次韵 其二
306372,哀韩克义·谁尸铸错弃干城
626241,怀梁七克矩
748592,金陵克复后寄颂湘乡师时将回籍 其一
650376,喜克超袁君至
711984,移家西归留别湛克正克茂外弟兼柬同人二首 其二
711984,移家西归留别湛克正克茂外弟兼柬同人二首 其二
559699,戊子春将赴温州杨君谦邀饯于虎丘同集者沈启南韩克赞二老复巾藜杖从子寿椿与朱性甫青袍方巾唐子畏与徐昌国并举子巾服而余与君谦独纱帽相对会凡八人人各为侣适四类不杂
481625,送潘御史克容释累赴京
508706,水竹幽居为唐克敬赋
983337,和赵克家三洞天二首 其一
92906,和曾克俊惠诗
538745,九日汎舟灵岩以病且雨不克登有作
491558,宴集洞山寺分韵得见字奉柬丁克诚颜中行王敬仲詹德裕枯林上人
278772,陈克昌夫妇忠烈
1242081,送乡贡进士钱宗善馀庆吴时纬仲文吴克潜纲赴京会试 其三
1236303,和曹克明都事灵岩二绝
514327,上元日与林谕德亨大商懋衡李世贤二侍讲饯同年陆叙州克深考绩西还联句十首 其八
458267,车中作愧诗谢潘克强潘乐乐贤父子并三江兄
525038,次赵克用游灵谷三首 其一
731740,正月晦日同泽望至草庵与克归话旧
880838,王宗臣赵处仁郑季克同游分得村字
658936,将游毛公坛宿包山寺明日雨不克往
96320,寄克斋舅氏
515664,题杨克仁鸿胪公车奏牍卷
673088,访晁克仁
1004636,庆元丁巳十月奉亲如临安宿西菩寺表弟吴克仁俱焉 其二
1003848,挟文薛君自赋五首克己读书安贫择交训子为题戒其子婿王叔俨万里索和 其二
491347,奉答丁克诚拟古四首并各因其首句云 其一
415813,王克宽老以怀乡诗见示依韵答之五首选二 其一
424855,小病经旬食不下咽俞大松斋馈克宁奶粉代餐赋得诗申谢
520108,次娄克让宪副咏梅韵 其一
531352,庚辰九日闻金鹤卿张惟信有彭门之会疾不克陪
417720,鹧鸪天 赠陈克吾
585254,贺刘克柔正郎严慈俱七十有五以人生七十古来稀为韵七首 其二
51707,胡克逊·人言西北边
149060,送五行家唐克寿
326894,克己·本体原来只是公
889187,和金克孝韵
257706,扑克牌方阵
626307,春夕同梁孔瑞梁克矩伯明倩叔挺昌兄七来集赋春字
1088469,次吕季克东堂九咏 其九 橘堤
389984,过九江风迅不克上匡庐自嘲
138837,和金克孝韵·长嗟轩冕累吾身
526884,山行柬刘侍御克温
654119,武克显赠别卷二首 其一
278831,赵郁氏克报夫仇
104554,送王克宪奉职之彭泽
623778,伏日同赵丕显傅贞甫赵丕振李伯襄饮岑克懋云谷山斋
468729,遇史克敬询故园
772189,南征八咏 其四 十一月初一二鼓，所部全军过大渡，冒险疾趋。彰城内应外攻，奋勇争先，随即克复城池，闻鸡初唱。止寅时二刻也
514325,上元日与林谕德亨大商懋衡李世贤二侍讲饯同年陆叙州克深考绩西还联句十首 其六
788488,驻军拉拉克泰有作
1213243,道过东昌申仲礼佥司暨状元呼都克岱尔诸父台辅贤昆仲厚意相邀别后以诗寄谢
1228648,庐陵十景同萧克有孚有诸公作 其四 小洲暮渔
446985,忆冯公克熙先生
868751,待制中书舍人陈公之亡以山宅须利既迁殡而未葬也后五月乃克葬焉二首 其二
519460,哀娄克让方伯
628183,寿王克广
435185,和秦克容来韵
110126,颂古·兴化逐克宾
660786,送万克修归省 其二
230010,昨幸甚得见子玉教授丈得一论其说出于订顽克
843108,哀韩克义
443875,蓉城盛会未克前往，谨赋此以贺〈岷峨诗稿〉创刊二十周年
463184,自题《莪默绝句集译笺》步黄克孙韵题 其一
1224108,士开燕岳氏溪堂有溪山新月上江海故人同之句邀予及张仲实曹克明同足成之
1228496,丁丑三月七日会同年于城南子期工部仲礼省郎世文编修文远照磨学升县尹子威主事克成秘书至能照磨子通编修凡十人二首 其一
460805,步黄克孙韵题《莪默绝句集译笺》三首 其二
525039,次赵克用游灵谷三首 其二
513540,送克宽弟南还至茶庵独归 其一
704522,鹡鸰图并序，为大巷伍克和题三首
673115,送吴克温
1143381,大名元复初郎中携示感遇五言八章次韵并陈东平曹子贞编修蓟丘曹克明 其四
675866,挽阴阳正术沈克永
1228835,和萧克有主簿沅州竹枝歌四首 其四
748593,金陵克复后寄颂湘乡师时将回籍 其二
693164,永乐初给事姚伯善采木广右被瘴客死殡及六十年至其孙榛鹤始克归葬先兆作诗记之 其十
543633,钱象先过访深雪中往报不克短歌柬之
623631,岑克名挽歌二首 其二
1228646,庐陵十景同萧克有孚有诸公作 其二 螺峰残雪
471424,胡克逊
555262,题三山施克端江湖览胜卷次张坦斋韵
962378,昨幸甚得见子玉教授丈得一论其说出于订顽克己铭词致超绝辄借前韵以庆兼呈诸丈幸乞一笑正再拜上 其一
644680,巾山晨望柬钱克温
1229220,送丘克明副使休官归河南
750687,夜泊螺山大雨不克谒王子寿丈怅然赋诗
695218,哭舍弟克明三首
825403,陈士可属赋李克用题字
905666,贺熊克进九朝要略转一官
814394,江宁克复，曾涤生先生功绩伟甚。敬赋二律，以志欣仰
66309,乐隐为尹克俊赋
1095950,克己斋
1242949,送别唐克让还家
508792,谢严克勉送蛇酒
306313,病起赋谢克礼医师君有声沪上前岁归与欧战近来京师始与余相识岂佛家所谓缘耶
525146,和赵克用自寿
623847,上巳日孙清远陈三水沈从化三明府公偕程参戎田都护招同社岑克念朱季美万伯文刘季德咽慈度寺分赋 其一
354085,寄薛克勤·高才犹佐古诸侯
1216509,题郑克让渊明卷
681283,送吴学士克温之南京
651161,舟中杂兴柬韩克和刘自牧王尚文宋广文十八首 其九
592367,送吴克之还歙因游浙中
822481,八声甘州 故乡人来，娄闻乱耗，夜窗听雨，倍觉黯然。赋示克群
793257,暨阳克复渡江纪事八首 其八
310192,再克集集，俘斩二百馀级，溪水为赤
29479,昆阳·师克由来在协和
483624,送王克让员外赴陕西
521260,题陈克明竹
1221482,题克俊主事蓟丘山传
415814,王克宽老以怀乡诗见示依韵答之五首选二 其二
576955,寄尹伯宏兼柬陈克杰四首 其一
794351,菩萨蛮 盼次男克常不归
504989,倪克受惠药
1108639,挽赵漕克勤礼部二首
678836,题周文靖竹石图寄赠山中叶克颖
1235446,和萧克有主簿沅州竹枝歌四首
491652,题薛克恭金陵竹西堂
804231,阿克苏
557691,种德堂为程克新作
637543,和林克全韵三首 其二
215927,修身吟·克己工夫熟
502673,送郑克复睢阳军
585255,贺刘克柔正郎严慈俱七十有五以人生七十古来稀为韵七首 其三
673582,题林克韶巢云亭
1235009,乙未二月十九日喜雪适间道有赍至托克托太师出征诏因赋
518988,海珠寺燕张克脩吴献臣 其二 送献臣
499813,答外甥吴克善惠砚
516185,送贺克恭黄门得告归辽左二首 其二
677067,潘克家蒋韶宾邀游善卷寺酒后偶成
1211317,次巴克实彦卿雪中见示韵六首 其二
538645,春日为西山之游仲蔚病不克偕贻诗见问率尔有答
742476,小除日经厂市见王叔明画爱不克购归以志懊
359728,正月晦日同泽望至草庵与克归话旧
583404,同赵克正朱懋忠蒋肃之吴献臣胡伯珩登报恩寺塔次联句韵
413834,偕内子挈儿女游莫斯科近郊阿汗格司克宫偶成一绝
256611,南乡子·李克绍生朝
434417,鹧鸪天 吊李克修
562076,云间见李克敏将归吴陵作诗为别
503871,送李克允还黄山别业
489978,施克让大监以效忠输贡南来会于钱塘 其三
560552,松石为华克谋作
558317,寄鹧鸪叟褚克用
451386,满江红 纪念马克思逝世一百周年
5048,流夜郎半道承恩放还兼欣克复之美书怀示息秀才
290049,木兰花慢·为克斋题山游图卷
1143382,大名元复初郎中携示感遇五言八章次韵并陈东平曹子贞编修蓟丘曹克明 其五
455841,晚成兄招饮路远卧病不克相从怅然有作
672753,送吴克温南归 其一
687333,克嗣侄毕姻示以诗二首
1094212,刘克庄潜夫诗编
748161,题唐宫歌舞图同方又韩克铣弟德远侄作
479161,送吴大章还宜兴（编修克温父）
604573,过饮黄周士小园柱诗见赠隃今三载再入五羊重辱招呼乃克和答 其二
1216047,送巴克实彦卿尚书监宪浙东
585258,贺刘克柔正郎严慈俱七十有五以人生七十古来稀为韵七首 其六
295844,九日金陵埽叶楼有登高之集余不克赴分得雄字
495425,秋日传蜀郡克复、琼海反正，喜而有赋
141577,周处台·克己功夫鲜矣能
868602,待制中书舍人陈公之亡以山宅须利既迁殡而未葬也后五月乃克葬焉二首 其一
562567,过沛县吊张克勤
219876,挽词·缮性克知命
735982,柬任克家 其一
1106269,问邵武守刘无竞克逊求邵武红朱三首
1251355,北海鲸时北征纳克楚
735983,柬任克家 其二
722134,送姜克犹归山阴
731105,渡克鲁伦河网鱼暂驻待后军至
1213724,泾河诗一首寄王克斋同知
651169,舟中杂兴柬韩克和刘自牧王尚文宋广文十八首 其十七
681138,送贺克恭还辽东
673439,甲戍十月五日午饷告乏薄暮库部分到俸钱亟易之市始克举炊诗发一笑
648177,送沙同知赴䘵州兼问克伟消息
690476,过饮黄周士小园柱诗见赠隃今三载再入五羊重辱招呼乃克和答
916239,胡小著克顺知泉州惠安县兼过南昌别墅
455462,与甲夫克强结社宣武志感
445110,莫名兄将返美猫儿拟饯行杭州望湖楼有诗先寄予不克往次韵酬之
752456,拔可邀食新荔病冷不克往梦回口渴忆粤中黄皮果不置写寄二绝句 其二
533241,郑伯良携赵子昂宋克温真迹见示
277091,与波兰世家克那倍君夜话君生平极慕
1217142,瓜州与成居竹王克纯登江风山月亭
1040191,何推官见招游岳麓以郡中事冗弗克偕行口占二绝以谢 其二
301856,挽黄克强·大难将来抱百忧
836877,再克集集，俘斩二百馀级，溪水为赤 其二
446376,归途车过湘江一桥用克非兄韵口占兼怀长沙诗友
312800,念奴娇·咏海和总政老干部学院里克同志原韵
386665,七月初一日闻金陵于六月十六日克复
219952,挽诗·克家宗从誉
432204,答戴克光寄登峨眉绝顶诗二首
794363,菩萨蛮 克劬北上旬日，计程未达帝都，寒夜不寐，悄然念之。
672383,寄刘克刚太守
637876,再用前韵答克明
781427,得孙克咸死难信 其二
974575,蕃丙午冬分宜见公度簿公尊兄已而邂逅于宜春蒙以蕃与徐斯远志别六言之韵作诗为赠久未和答今日东归乃克赋之四首 其四
1115205,克信弟坐上赋梅花二首
897022,别外甥杨克一二首 其一
923941,次韵洞山克文长老
48719,瓜洲逢丘克庄
698232,孟冬时享斋宿院中和韵答克勤宾之二同年
875245,次韵赵克勤吏部六首 其二
94384,芙蓉盛开戏简子文克信
514422,夏日独卧西斋陶懋学贡士与克俭弟隔坐写画笑语而窗外槐阴与盆石掩映宛如往岁回舟北上时事因成一诗
560308,山水图为赵辅作本学教谕克通之子也
187574,和王克宽有所寄草堂诗
1127454,陈伯成学士垂访以病中新浴不克见走书二短篇谢之
651157,舟中杂兴柬韩克和刘自牧王尚文宋广文十八首 其五
1215249,送张克让
314014,虞美人·郑克柔述梦
673396,赠林克英表弟是日舣舟会饮
781428,得孙克咸死难信 其三
1088466,次吕季克东堂九咏 其六 月台
1242079,送乡贡进士钱宗善馀庆吴时纬仲文吴克潜纲赴京会试 其一
672134,挽三山强克谦太守
373669,题壁·望北空期克复功
815009,题欧舫新诗时届季冬栖息三慧庵相约蔬食习养生之术余未克赴也
1221455,送李克进经历护二亲丧归葬维杨克进蓟州李息斋之孙工画竹寓居维杨先为平阳府经历二亲俱殁于闽至洪武壬子冬始得归葬徐大参命作诗以赠其行
1221455,送李克进经历护二亲丧归葬维杨克进蓟州李息斋之孙工画竹寓居维杨先为平阳府经历二亲俱殁于闽至洪武壬子冬始得归葬徐大参命作诗以赠其行
324231,送刘克强再赴殿试
221379,王宗臣赵处仁郑季克同游分得村字
889188,和金克孝韵
228058,仙都示马令克
804071,九月七日行抵丹噶尔前诣札木巴拉多尔济贝勒弩克图大藏寺祭毕敬成
1086643,慈云祖老相邀至悠然阁倦不克往
859866,问邵武守刘无竞克逊求邵武红朱三首 其三
772208,近接移知，以克彰微芳，蒙上恩赏加布政使衔。三月十二日，望北叩谢恭纪
1218981,和李克约东皋杂兴四首 其一
772254,闻曾涤生大师克复江宁，诸贼歼戮殆尽，不觉狂喜
623630,岑克名挽歌二首 其一
807460,念奴娇  十五夜宋蓼天太史招饮以雨不克赴少顷月出同纬云鲁望两弟暨曼殊小饮寺寓九叠前韵
548873,五忆诗 其五 克敬
474606,明月山下逢武宾相克仁话旧
491965,过李黄罗茅堂五首柬克正茂才 其五
798686,明月生南浦 八月廿一日克己领事宴余山中，出册索题，即席赠此
268701,革命军北伐，颇以未克投笔相从为憾
163261,和吴克明广文赋梅
521829,刘君克柔以亲老思归适有南京尚宝卿之命喜而索诗
499706,和何克敬春行
815757,得孙克咸死难信
594307,送刘计部克和何起部师召考绩同舟北上
879834,和王克家所寄草堂诗二首 其二
963966,范漕季克云坡
115717,别外甥杨克·泽国授衣早
562611,送吴克恢南归因柬王用先生
673943,送陈克用
1232785,赠陈克甫诗
257689,里尔克与豹
679991,别克从先生文馆
493046,忆李氏茅堂三首奉柬克正兄 其三
660154,赠表弟邹克敬之来安司训用前韵
976893,挽克斋陈先生四首 其四
508571,送王克敬南还
116489,寄杨克·去城未五里
1077754,得诸季书报薛克寅范茂载胡仲俨皆物故感怆有作
55758,大同克敌进封其镇守总戎都督郭清宁为定襄伯
898034,离楚夜泊高丽馆寄杨克一甥四首 其一
651164,舟中杂兴柬韩克和刘自牧王尚文宋广文十八首 其十二
973428,雪中用俞克晦丈公择唱酬之韵呈克晦
973428,雪中用俞克晦丈公择唱酬之韵呈克晦
1218983,和李克约东皋杂兴四首 其三
663628,送施克和
674612,和赵克用豸史煎茶韵
193042,闻北师克捷喜而成咏
460865,叠前韵悼物理学家兼诗人黄克孙先生三首 其二
553331,送征江倅朱克正赴京师
859984,送刘无竞克逊司门赴召三首 其三
686980,过李黄罗茅堂五首柬克正茂才
1088468,次吕季克东堂九咏 其八 海棠屏
514326,上元日与林谕德亨大商懋衡李世贤二侍讲饯同年陆叙州克深考绩西还联句十首 其七
564206,克嗣侄毕姻示以诗二首 其一
17616,别杨颖士卢克柔殷尧藩
514321,上元日与林谕德亨大商懋衡李世贤二侍讲饯同年陆叙州克深考绩西还联句十首 其二
87580,蒙恩复畀明道祠寄呈赵克勤吏部
53130,胶山忠定祠次施克和韵
976896,挽克斋陈先生四首 其一
1231844,送赵克让归洛阳赴举
974577,蕃丙午冬分宜见公度簿公尊兄已而邂逅于宜春蒙以蕃与徐斯远志别六言之韵作诗为赠久未和答今日东归乃克赋之四首 其二
1230139,望玉笥山弗克登览留诗万年宫
548784,何克斋侍御谪武昌
234185,吴克仁·熙定相望百馀年
700446,次赵克用游灵谷三首
86991,次韵赵克勤吏部·两鬓星星暮景斜
1110997,次吕季克东堂九咏 野塘小隐
978269,李俊民三十年前凡两寄诗时困于世故俱不克和常抱此欠近理败箧忽见两诗岁月可惊凄然有感辄赋长句附便以谢不敏
651167,舟中杂兴柬韩克和刘自牧王尚文宋广文十八首 其十五
513609,克宽弟南归小诗二首奉简淮阴驿丞林文秀内兄休宁上舍汪汝温亲契 其一 简林
515688,题洪克正行乐图
125694,盛衰吟·克肖子孙
752728,齐克达坂
1143384,大名元复初郎中携示感遇五言八章次韵并陈东平曹子贞编修蓟丘曹克明 其七
1228834,和萧克有主簿沅州竹枝歌四首 其三
561797,恭纪恩赐诗 其十三 赐睿宗皇帝御书大字八音克谐天光云影于文华殿面授
361214,何推官见招游岳麓以郡中事冗弗克偕行口占二绝以谢
662159,章锦衣园饯克温
518439,寄秀才罗季翔刘德明刘志用陈克让王达礼方文兴邓子民杨汝诚 其一
702476,送克宽弟南还至茶庵独归
666210,延陵送刘克柔
421409,菩萨蛮 其一 咏费尼克斯
163575,挟文薛君自赋五首克己读书安贫择交训子为题
501767,呈克明县尉
673612,送施克礼游南都
222676,克斋·燕坐焚清香
270621,托多克道中戏作胡桐行
1215594,送监郡库克楚通议公致仕归维扬一十二韵
504659,忠孝行为江西行省右丞呼图克布哈作
515020,留别蒋长洲克明 其一 篁墩
693669,海珠寺燕张克脩吴献臣 送克脩
693669,海珠寺燕张克脩吴献臣 送克脩
355506,中丞温伯杂端持正约同饯夷仲不克某独出城重阳后一日
675274,寄周克之侍御谪居南海
1124107,送刘克昌文显二首
654998,篁墩为程克勤赋
489977,施克让大监以效忠输贡南来会于钱塘 其二
404676,踏莎行·一九九七年十月，忽得日英电告，克正以肺癌弃世，不胜震悼，哀吟当哭
327638,八咏警戒·无私仍克己
446861,减字木兰花    贺克熙、甫珊二老评为金婚佳侣
243650,次韵答克修
711959,送任克家归皖江时将遏选二首 其二
1235445,庐陵十景同萧克有孚有诸公作 神冈晚桥
1003847,挟文薛君自赋五首克己读书安贫择交训子为题戒其子婿王叔俨万里索和 其四
1072783,和刘克强谢仲振
560260,题小景为邢编脩克敬赋
511081,得贺黄门克恭书
248689,读《苏子聊斋-克拉玛依十一年记》
1211320,次巴克实彦卿雪中见示韵六首 其五
1212030,逢托克托景颜
69010,送王克敏之安丰录事
1213058,张菊存精舍读克明樵隐佳什附诗于后
1211687,同克明曹生清明日登北固山和韵
637797,别舍弟克明
877559,挽赵漕克勤礼部二首 其一
501770,次韵王克明三首 其三
313828,小重山·因魁北克之会作
699264,施克让大监以效忠输贡南来会于钱塘
271461,赠周克群·蜀江东流直趋海
702481,克宽弟南归小诗二首奉简淮阴驿丞林文秀内兄休宁上舍汪汝温亲契 简林
1212188,凯歌乐词九首 其六 克临安
793256,暨阳克复渡江纪事八首 其七
835717,解连环 余去杭州，巴陵方湘宾用梦窗赠石帚韵见诒。词意深美，行已六日，始克和此奉寄
286092,将至鼸泉车中别博克达山
1249654,琼花行送盛克明教授归维扬
665129,刘诚意先生以梁公道学为之师王练忠鲠为之友乃克以名名堂而启后之不忘也然以不及识为恨故为之赋登堂三章章十句
1228497,丁丑三月七日会同年于城南子期工部仲礼省郎世文编修文远照磨学升县尹子威主事克成秘书至能照磨子通编修凡十人二首 其二
293463,礼烈亲王克勒马图歌
1228833,和萧克有主簿沅州竹枝歌四首 其二
1082090,次韵刘克强寄刘齐庄并见寄
428820,至阿克苏晚宿渡旁
652964,题沈克全鹤沙八咏 其八 彭仙闲室
869315,景仁思归雨未克行以诗留之
1108948,蒙恩复畀明道祠寄呈赵克勤吏部三首
115720,别外甥杨克·弹琴不须弦
1216207,始余发京师时已闻河南平章公克复济南渠魁就擒计益都之寇可不烦馀力而下矣夫大将系国家安危行当慎重为宗社计舟中有怀援笔为赋是又不能不留情也大将名察罕特穆尔字廷瑞云
506027,寄黄侍御克敬谪归
470840,避兵（丁未腊月十五日避阿克之乱）
155644,侍御宴僚属于番江楼以卧病不克与分韵得四字
272652,曲阳孙晴崖明府掘地得晋王李克用手书安天庙题名碑
580045,赠冯克明判永州先任湖州
342124,景卢约赏朝天菊不克往
625557,阅表弟陈克棐近诗与订同异
514017,新推府陈公良至任以久雨弗克趋贺有传其诗章至休宁者因借韵奉赠
502939,题郑克曼复睢阳军手卷
147120,太湖县雪中简段子克知县
1217531,送进士王克敏赴成都录事
1111024,训蒙绝句 克己二首
1088461,次吕季克东堂九咏 其一 野塘小隐
619240,秋日与克念翠岭上人游滴水岩
712077,何克谏八十
649167,姚克脩御史挽诗
1004008,诸友载酒饮沧江海棠下公许以上寿亲庭不克与胜赏翌日招饮出示新作敬和元韵
248828,叠前韵悼物理学家兼诗人黄克孙先生
1220550,赠聂克敬兼简宗武
1003846,挟文薛君自赋五首克己读书安贫择交训子为题戒其子婿王叔俨万里索和 其一
1085276,再至双植堂呈表兄李克明
537108,高克明溪山雪霁图歌
55646,简克承丈
875242,次韵赵克勤吏部六首 其五
594426,送郑兵宪克渐赴岭西
722144,过马佐领克起粤秀山房赋赠
694219,赋得二题送严克谦之京 分水晨关
651168,舟中杂兴柬韩克和刘自牧王尚文宋广文十八首 其十六
628051,赠程克庵县尉 其一
310297,七月二十二日攻克集集，斩首百馀
803983,伊拉里克河水利林文忠公遣戍时所开，所谓四十八坎儿也，贤者所至，有益于民如此
659670,赠林侍御克相
652963,题沈克全鹤沙八咏 其七 翟公故园
962375,昨幸甚得见子玉教授丈得一论其说出于订顽克己铭词致超绝辄借前韵以庆兼呈诸丈幸乞一笑正再拜上 其四
422771,小重山 因魁北克之会作
859985,送刘无竞克逊司门赴召三首 其二
651170,舟中杂兴柬韩克和刘自牧王尚文宋广文十八首 其十八
638716,过方生克宽行寓看蒂双瓜
673110,和中允克温咏雪
483973,题石生仲濂所藏李克孝竹木
506499,送江克恭还南京
514255,赠临清刘克庄孝子
670311,袭克懋托疾不肯入试赋赠
702471,送克俭克宽弟省觐南京
702471,送克俭克宽弟省觐南京
1231206,客海陵光孝寺秋深感怀二首简盛克明 其一
974257,闻克斋舅氏除江东提举以此寄贺
822663,西河 闻党军克金陵，用美成韵
1243670,题李克明翁媪起家图二首（一翁以指就醋瓮内取醯吮之尝其味之美恶一媪持星火吹灯备诸穷态） 其二
652958,题沈克全鹤沙八咏 其二 虹桥夜月
89100,喜仲晦除江西宪·厌闻桑孔工掊克
