694294,番阳丘先生远示杰作二章仰仞垂爱之厚感慰兼极章衰疾龙钟无足为故人道者勉据来韵少布区区之忱耳倘过辽阳之便假手录寄以发克恭黄门一笑幸甚
678675,题冯克敬清风轩
65072,瓜洲风雨不克渡江
564207,克嗣侄毕姻示以诗二首 其二
481770,乐隐为尹克俊赋
514013,新安旧有二程先生祠荷侍御提学娄公克让许修复之偶于婺源陈简教谕处得克让往年过博野祠下之作因借韵一首奉寄
514013,新安旧有二程先生祠荷侍御提学娄公克让许修复之偶于婺源陈简教谕处得克让往年过博野祠下之作因借韵一首奉寄
248510,布鲁克巴·瞻彼山之阳兮
543564,庚辰夏五月念之二日余三旬初度也碌碌尘土加以幽忧之疾靡克自树俯仰今昔不胜感慨信笔抒怀六百字
879835,和王克家所寄草堂诗二首 其一
522058,竹泉为黄克清赋
279234,八犯玉交枝·次日朝霁，与克群踏雪至江亭，归而雪复大作矣
652961,题沈克全鹤沙八咏 其五 东庄春雨
510981,番阳丘先生远示杰作二章仰仞垂爱之厚感慰兼极章衰疾龙钟无足为故人道者勉据来韵少布区区之忱耳倘过辽阳之便假手录寄以发克恭黄门一笑幸甚 其一
1217640,送王子克归金华
1066249,寄薛克勤
524172,辛巳九日田子要东陂之游雨弗克赴三首 其一
97612,送刘克昌文显
463185,自题《莪默绝句集译笺》步黄克孙韵题 其二
480854,大同克敌进封其镇守总戎都督郭清宁为定襄伯喜而赋此以贺之
680223,秋日与梁克宣韩成章陈彦章游湖
564788,汉宫春晓图歌为克斋司徒题
1228832,和萧克有主簿沅州竹枝歌四首 其一
821792,菩萨蛮 土耳其名诗人希克梅时有诗颂新中国，余译其意
118376,次韵洞山克文长老
62725,送吴克存还山
506656,送江克显还杭
327280,克己·莫道公私未判然
513767,哭亡弟克宽于南山堂僧舍
1177030,旅次沔阳闻克复而用师者穷兵黩武因书简之
1098072,令佐约登息梅岭不克赴次来韵
576957,寄尹伯宏兼柬陈克杰四首 其三
513517,腊月念八日得仲弟克俭南京书季弟克宽杭州书报家君已至徽州
513517,腊月念八日得仲弟克俭南京书季弟克宽杭州书报家君已至徽州
794151,赠周大克九
747190,博克达山之麓有溪出焉迤逦北流越乌垣东鄙入峡俗名水磨沟是也峡左有泉涌穿石隙会小泉数十道下注大溪溪岸嘉树茏葱野花错杂桥堤楼榭位置天然不意荒陬得此佳境因赋诗以记之
574414,施克咨友石竹枝扇面
1097462,上赵克家太守
740110,饭芦庵赠克念讲师
158189,陈伯成学士垂访以病中新浴不克见走书二短篇
1158849,送贾侍御克复后入京
479644,为潘克承题林良芦雁
1034117,仙都示马令克
1098065,诸公约会县中观灯不克赴既又见趣座中赋一章
925568,吴克明广文见和再用韵答之
711958,送任克家归皖江时将遏选二首 其一
1249347,次朱克用万户韵
524173,辛巳九日田子要东陂之游雨弗克赴三首 其二
515376,自断石与司训黄伦汝彝及亲契汪锭克成族孙乙汰万并载竹筏沿溪泛至流塘饮詹贵存中家道中联句五首 其五
509839,九月木犀花盛开偶成寄贺黄门克恭
712573,重阳前五日高中含司马招同刘卓崖主考屈四会凤山张广宁鹤洲杨阳春止庵钱茂名蔗山张翁源泰亭高东莞菉园田英德克五雅集云半阁时闱事初竣
971634,送刘克昌文显二首 其二
828984,江城子 阿克苏至喀什机中作
1115315,寄题分宜李克明上舍高居二咏 不碍云山楼
484360,瓜洲逢丘克庄
591712,寄郑克一
1125495,和赵克家三洞天二首
512696,韩克瞻宿五国城因赋
748595,金陵克复后寄颂湘乡师时将回籍 其四
1223773,鳌峰者国史院庭中石名也伯宁御史为仆言自其先公时与诸老名胜赋诗者盖数百篇今玉堂无本而御史家具有之且曰峰所托差低盍稍崇其址乃八月五日既克如命因赋此以报且请录示旧诗补故事以传云
820647,齐天乐  吾楼对白琅克冰山Mont Blanc，晨观日出山顶，赋此
793253,暨阳克复渡江纪事八首 其四
659296,王克承按江西道姚江省母
591270,同郑克一送郭三归桂林郡
384416,与宜兴吴祖贻夜话有作就简李宗渊杭道卿吴克学
525599,谏议润夫使君自应城数百里访余武昌适值中秋风雨大作且公私见夺不克夜叙殊负良晤明日送于黄鹤楼匆匆别去意所难尽缀以短诗
143405,自警·私既克
560118,题小景为中书邢克敬赋
443818,世广金水二兄以三叠险韵诗见示，适余中酒，未克赓和，聊作一绝以赠
639229,寄金华节推表弟张克举
976895,挽克斋陈先生四首 其二
641355,蹋雪入汳城简丘克庄郎中
467150,江右诗社己丑浔阳年会诗草 其二 访白居易草堂大雨不克而返用梅岗起句
962374,昨幸甚得见子玉教授丈得一论其说出于订顽克己铭词致超绝辄借前韵以庆兼呈诸丈幸乞一笑正再拜上 其三
583421,九日无酒亦不登高倚韵答赵克正大司寇
253980,连日幸会叶克勤兄戴丛洁兄方清刚兄扬絮飞李国新贤伉俪及胡巍兄等用前韵
702353,腊月半后祠堂前并后园梅花盛开敬次家君卷中旧韵二首柬克俭
804399,阿克苏城被水驰往勾当记事
1035309,满江红 叔母生日刘左史光祖以余正月 十日所与为寿词韵见贻至是 始克再用韵谢之
626209,哭从弟克简
321742,胜己山·私心克尽道方大
560181,为克让赋竹
542642,九月七日游佛山同薛子乔阎达夫许克之赋得黄字
652959,题沈克全鹤沙八咏 其三 潮音晚钟
1249379,寄黄克敬谪归
1086839,景卢约赏朝天菊不克往
1092572,昆山兄惠笔颇佳谢之并呈克斋舅二首 其一
672695,贺克温迁居次仲湜太宰韵
1249385,送苹乡丘克明
444310,闻利比亚民众攻克的黎波里
510982,番阳丘先生远示杰作二章仰仞垂爱之厚感慰兼极章衰疾龙钟无足为故人道者勉据来韵少布区区之忱耳倘过辽阳之便假手录寄以发克恭黄门一笑幸甚 其二
665756,林克相
553694,寄潘克诚
698464,寄秀才罗季翔刘德明刘志用陈克让王达礼方文兴邓子民杨汝诚
445903,丙申端午偕克光连生觅竹雨中访遂溪苏二村
1243669,题李克明翁媪起家图二首（一翁以指就醋瓮内取醯吮之尝其味之美恶一媪持星火吹灯备诸穷态） 其一
377432,寄节维那·几度忘言话克宾
983336,和赵克家三洞天二首 其二
217916,寿家君克堂先生
652957,题沈克全鹤沙八咏 其一 海岳晴岚有招鹤楼
838183,长亭怨慢·逸兄避暑匡山，予以事不克偕往，挥汗谱寄
696618,别林克相二首
744647,礼烈亲王克勒马歌 其二
256795,和秦克容来韵
1088770,训蒙绝句 克己二首 其一
412805,答戴克光寄登峨眉绝顶诗二首 其一
254985,开始学习盎格鲁-萨克森语法
558375,聚爱楼四咏为克勤赋 其三
911138,贺新郎 题高克恭夜山图
697962,送吴克温南归
89518,挽赵漕克勤礼部·息影空山与世疏
255226,敏感的萨克斯
1127967,挟文薛君自赋五首克己读书安贫择交训子为题戒其子婿王叔俨万里索和
91443,哥萨克
512256,送龙克温还金陵时携侄袭百户职
1196078,赠泰州掾令狐克己
277327,九年七月自意大利还经勃路能因登亚克生斯台因闻内地乱耗感赋
336052,邓才卿同年两顾敝庐病睡不克见别后次庭藻送行韵谢之
603320,送何侍御谪楚藩司从事因怀范原易李克苍原易旧守洪都克苍先以比部谪楚 其二
603320,送何侍御谪楚藩司从事因怀范原易李克苍原易旧守洪都克苍先以比部谪楚 其二
574873,杭方伯世卿登我龙山不克奉陪
1208841,送刘克让归汴中三首（名天秩由河南乡贡中第竞以便养辞馆阁之职除济宁录事须次觐省） 其三
655070,孟冬时享斋宿院中和韵答克勤宾之二同年 其一
56082,次克温南宫赏魏花
422447,咏史一百三十首 其一一八 郑克?
321882,再至双植堂呈表兄李克明
674214,写扇赠柴克修
77399,病中简仲弥性唐克明苏训直
677771,攸县周克己交翠轩
689020,赠程克庵县尉
516469,谢克一蒋院判送菊
446293,登明思克航母
512428,挽同年赵克周乃祖
888996,用金克家韵赋梅花
1132176,赵克勤曾橐卿景寿同登黄南恩南楼
279413,西河·闻党军克金陵，用美成韵
653142,六礼有将式克语之三加有辞式克御之死丧之威翕共与之饮食言笑肃慎祇之增增来仍式谷以之毋俾此邦不竞谓之 其二
653142,六礼有将式克语之三加有辞式克御之死丧之威翕共与之饮食言笑肃慎祇之增增来仍式谷以之毋俾此邦不竞谓之 其二
1123959,昆山兄惠笔颇佳谢之并呈克斋舅二首
818004,悼黄克强、蔡松坡，示刘栽甫 其二
703108,题沈克全鹤沙八咏 海岳晴岚有招鹤楼
673408,送吕克兴会试
492526,赠李克隽主事还京
973993,克斋
681367,用韵答陈克敬杏花下作
516853,寄馀干徐仲敏高克诚二良友兼赠彦明原祐丙午之夏余寓于越与二公相知及己未岁忽彦明原祐相过彦明则克诚之弟原祐则仲敏之子也
516853,寄馀干徐仲敏高克诚二良友兼赠彦明原祐丙午之夏余寓于越与二公相知及己未岁忽彦明原祐相过彦明则克诚之弟原祐则仲敏之子也
256903,爱情是里尔克的豹
1210402,玄览真人示以李遵道旧诗一章俾次韵悼之将寄其子克孝
486024,荅王克让
999305,侍御宴僚属于番江楼以卧病不克与分韵得四字
637397,次高克明韵 其二
458481,零八年十月末，予过巩县，思一谒杜陵生窑及其旧墓，而病酒伤风，终不克就。聊赋此解，以谢杜公
494538,题周克道藏脩所二首 其一 静趣坡书馆
626183,秋夜达生适生克蒙克慎昌言斐廷诸昆弟赏月得月字
626183,秋夜达生适生克蒙克慎昌言斐廷诸昆弟赏月得月字
1251635,和陈克斋清明登瑶台有感 其三
202099,李俊民三十年前凡两寄诗时困于世故俱不克和
844084,七月二十二日攻克集集，斩首百馀级
363008,秋夜怀克九
295859,龚怀西师招饮不克赴有诗见及次韵奉酬
898081,寄杨克一
1242080,送乡贡进士钱宗善馀庆吴时纬仲文吴克潜纲赴京会试 其二
1211444,同曹克明清明日登北固山次韵 其一
803948,博克达山
693314,贺刘克柔正郎严慈俱七十有五以人生七十古来稀为韵七首
976894,挽克斋陈先生四首 其三
422338,咏史一百三十首 其九 克林威尔
1218918,送盛克明辟掾浙省移家吴兴
508805,送崔冢宰克让赴阙
254218,挖耳罗汉·非礼勿听归克己
491964,过李黄罗茅堂五首柬克正茂才 其四
479250,次吴侍郎克温天界寺别春 其一
284332,偕徐贤恭、余建章谒马克思墓
637542,和林克全韵三首 其一
35183,题杨克俭池馆
58546,答王克让
898033,离楚夜泊高丽馆寄杨克一甥四首 其二
493045,忆李氏茅堂三首奉柬克正兄 其二
4116,送贾侍御克复后入京
210744,永遇乐·次韵辛克清先生
576956,寄尹伯宏兼柬陈克杰四首 其二
386649,中秋夜郡城克复，十七日闻捷
638049,喜侄生舟中书寄克明弟
1088771,训蒙绝句 克己二首 其二
518134,送魏克让除陕西宪府经历
630307,门人崔今婴居家事佛而先得观音大士像以其意乞赞焉为释之曰子初事佛而进退作辍未克自信是不可不乞庇于大士事大士正所以深事佛也遂赞以诗
501769,次韵王克明三首 其二
666836,感怀用吴克温太史韵
519687,送娄廉使克让朝京
660823,雨中与沈克寅赏莲二绝 其一
425521,赵郁氏克报夫仇
478520,永乐初给事姚伯善采木广右被瘴客死殡及六十年至其孙榛鹤始克归葬先兆作诗记之 其十
492387,秋日承薛克恭马君佑舣舟相问留尊酒而别
541710,送来阳伯常脩之薛允执高大克石复朴偕计
712117,伏日同王础尘张桐君朱子成周文康梁药亭林叔吾董克灌王紫巘集潘亚目视苍楼分赋因寄董无休
559851,送张中书克巳归陕西
413506,偕徐贤恭、余建章谒马克思墓
694175,寄尹伯宏兼柬陈克杰四首
1247820,雨中喜刘俊民孔克逊相过
866892,寿家君克堂先生
515446,赵式画芙蓉为镇江高克明同知赋
594969,上元夕同刘季德岑克名刘道子集苏叔大小雅斋是日叔大举长子弥月
47074,宋军咨克
499516,题吴克承雍穆堂
509903,赠克修别驾迁梧州守来别白沙赠之 其一
1237382,丁丑三月七日会同年于城南子期工部仲礼省郎世文编修文远照磨学升县尹子威主事克成秘书至能照磨子通编修凡十人二首
651163,舟中杂兴柬韩克和刘自牧王尚文宋广文十八首 其十一
781426,得孙克咸死难信 其一
623817,岑克念次子以髫年补诸生作此赠之
582584,梅花百咏 其二十四 克复
586014,九日社醉次陈克威韵
820941,木兰花慢 为克斋题山游图卷
660851,持节瞻云图为符台刘克柔赋
741124,曲阳孙晴崖明府掘地得晋王李克用手书安天庙题名碑
559766,送克让陈友回
649364,题高克恭墨竹
1246795,昨归自城府闻仁和彦克二君席上以诗争雄长故区区僭和一章以和其天倪以全其交道云
585655,永新诸生尹克恭龙诚史鸣辞归赠之诗
696260,确斋为礼舍丰城王克振题
690088,六礼有将式克语之三加有辞式克御之死丧之威翕共与之饮食言笑肃慎祇之增增来仍式谷以之毋俾此邦不竞谓之
690088,六礼有将式克语之三加有辞式克御之死丧之威翕共与之饮食言笑肃慎祇之增增来仍式谷以之毋俾此邦不竞谓之
702427,自断石与司训黄伦汝彝及亲契汪锭克成族孙乙汰万并载竹筏沿溪泛至流塘饮詹贵存中家道中联句五首
514191,与时翊大参若虚宪副同至胜果寺欲寻宋宫遗址雨不克往
793250,暨阳克复渡江纪事八首 其一
413351,赵克臻大家别二十馀年矣归国观光海上喜晤因知近年以诗名藉甚香岛赋二绝赠行 其一
602475,送王克从别驾董献上服因讯都下旧游诸子
702126,题周克道藏脩所二首 静趣坡书馆
638348,哭舍弟克明三首 其二
702001,次吴侍郎克温天界寺别春
637403,秋夜言怀次高克明韵 其二
147574,赵克勤曾橐卿景寿同登黄南恩南楼
480019,孟冬时享斋宿院中和韵答克勤宾之二同年 其二
508729,送胡克容上舍南还
661597,许克大分教桐城道过余家留诗见柬赋以谢之
721349,送任克家归皖江时将遏选二首
267144,J·阿尔弗瑞德·普鲁弗洛克的情歌
248736,赋乌克兰饥荒七十三年祭二章
257590,麦克佩斯敲门声
688193,次娄克让宪副咏梅韵
325750,偶阅·克敌端资将帅和
521218,陪李子阳吴克温二太史杭世卿吏部游城东潘氏园赋得流水
999482,陈伯成学士垂访以病中新浴不克见走书二短篇谢之 其二
1197937,克商操
574413,王友石渭川烟雨图为施克文题
1217574,送都水大监托克托清卿使君奉命塞白茅决河
1198138,吴鼓吹曲十二曲 其六 克皖城
560520,谢医士韩克赞
166018,赠文潜甥杨克一学文与可画竹求诗
248829,自题《莪默绝句集译笺》步黄克孙韵题
558299,赠刘克平
278984,昆仑关·岁暮克昆仑
354149,上赵克家太守
900926,克己
1217009,送曹鉴克明自浙省员外迁湖广
569918,约周公瑕隐君汤沈二比部袁右军陆山人齐王孙游清凉寺阻雨不克登台小饮方丈作
671023,袭克懋托疾不肯入试赋赠
1214282,挽徐克谦教授
576557,鹡鸰图并序，为大巷伍克和题三首 其三
525131,赠王光禄克明迁北寺
660785,送万克修归省 其一
914271,克信弟坐上赋梅花二首 其一
651727,简揭克英府幕
1250783,正月十日临洮会宗明尚书克让王传
651155,舟中杂兴柬韩克和刘自牧王尚文宋广文十八首 其三
974576,蕃丙午冬分宜见公度簿公尊兄已而邂逅于宜春蒙以蕃与徐斯远志别六言之韵作诗为赠久未和答今日东归乃克赋之四首 其三
674923,送盛秋亭兼柬吴克温
688468,秋夜言怀次高克明韵
744567,题礼烈亲王克勒马图
126347,雨岁锦屏之游不克见郑令因以寄之
257867,读里尔克情诗三章
660045,佩之约会牛屯山庄雨不克赴辱诗见贶依韵答之
1038218,臣伏蒙圣恩今月二日就琼林苑特遣中使宠赐御诗仰味圣言恭披宸翰曲推恩礼过奖愚臣感愧之深负荷弗克辄课愚陋恭和圣制
812842,礼烈亲王克勒马歌
514400,有感次高夏官克明韵二首 其一
115718,别外甥杨克·东南秋雨
709239,五日岑克昌家宴招予
987621,赠番昜程克己
193699,挽克斋陈先生
281607,白克路故居女颐生处
810240,经戈克腾木感怀
66848,次韵答刘克勤
493044,忆李氏茅堂三首奉柬克正兄 其一
772256,江宁克复，曾涤生先生功绩伟甚。敬赋二律，以志欣仰 其二
662328,和吴克温送弟还宜兴
643606,题克已斋
652960,题沈克全鹤沙八咏 其四 咸塘晚棹
897760,别外甥杨克一二首 其二
491350,奉答丁克诚拟古四首并各因其首句云 其四
310575,妆梅·春来克色满含章
45322,只要再克制一下
327902,驻军拉拉克泰有作
509864,张克修别驾约游罗浮
1223420,同朱克齐蒋教授游大梵寺二首 其一
86010,挽赵漕克勤礼部
836882,克复林圯埔，在军中偶兴
489580,为范克齐题张道士画帧
1033309,太湖县雪中简段子克知县
1249317,竹溪书室图为黄克文题
748594,金陵克复后寄颂湘乡师时将回籍 其三
1124264,蕃丙午冬分宜见公度簿公尊兄已而邂逅于宜春蒙以蕃与徐斯远志别六言之韵作诗为赠久未和答今日东归乃克赋之四首
408439,黄克强先生与李西屏先生书札 十八年七月廿八日 西屏先生属吾友陈冕雅示侃于大石桥寓中追怀民国前三年与克强遁初两先生同居新宿者旬日辛亥季秋两君自沪渎赴武昌与侃会于蕃舶遂同入鄂元年克强先生为留守时侃犹得一晤后此遂不相闻岁月飘忽两君皆亡追思昔游犹在心目抚弦青简不禁泫然敬题一诗以志感
408439,黄克强先生与李西屏先生书札 十八年七月廿八日 西屏先生属吾友陈冕雅示侃于大石桥寓中追怀民国前三年与克强遁初两先生同居新宿者旬日辛亥季秋两君自沪渎赴武昌与侃会于蕃舶遂同入鄂元年克强先生为留守时侃犹得一晤后此遂不相闻岁月飘忽两君皆亡追思昔游犹在心目抚弦青简不禁泫然敬题一诗以志感
408439,黄克强先生与李西屏先生书札 十八年七月廿八日 西屏先生属吾友陈冕雅示侃于大石桥寓中追怀民国前三年与克强遁初两先生同居新宿者旬日辛亥季秋两君自沪渎赴武昌与侃会于蕃舶遂同入鄂元年克强先生为留守时侃犹得一晤后此遂不相闻岁月飘忽两君皆亡追思昔游犹在心目抚弦青简不禁泫然敬题一诗以志感
514981,挽清源刘孝子克庄
875243,次韵赵克勤吏部六首 其四
752731,吐鲁番王玛特木迓于苏尼相从至连木齐修谒乃返鲁克沁城仍遣四台吉护行至省寄酬以诗
530138,宜兴吴克学雨中远访予于吴山一宿而别咏此送之
992774,送王克宪奉职之彭泽
585256,贺刘克柔正郎严慈俱七十有五以人生七十古来稀为韵七首 其四
30694,克复后登安国寺阁
577554,寄庄克敬广文
501755,送聂克敬归省
410088,赠周克群
310296,二十九日攻克施厝坪等处
1066293,诸友偶赋克己以战喻次韵酬之
856229,予绍兴三十二年夏四月三日行部至山中时月上人方入山十有八日旋披荆棘立数椽以居其徒明年改元隆兴夏六月二日再过山而堂室粗备且于云母泉侧创为茅亭使往来观者得以驻足而酌甘诚可嘉也时巴陵尉临川李克仁高密刘孝杰华容尉权三衢徐二誉在焉子辈侍行
508696,宣圣五十五代孙孔克愚挽诗
509904,赠克修别驾迁梧州守来别白沙赠之 其二
638347,哭舍弟克明三首 其一
1212212,后凯歌词九首 其三 克夷门
514322,上元日与林谕德亨大商懋衡李世贤二侍讲饯同年陆叙州克深考绩西还联句十首 其三
812655,奉使越南入关留别和越南魏克循韵
701990,再次韵克温雪假山兼谢留饮
591942,岁晏旅中寄故园诸子十二首 其二 郑克一
660633,寿刘尚宝克柔
491363,陪王珊克温薛益伯谦王睿王佑严焕夜宴焦瑜宅看薛舞剑分韵得深字
512994,送韩克赞
809561,登山巅下瞰克鲁伦河周览山川形势指麾营阵
643176,岘山樵隐歌为二令刘克和赋
673112,再次韵克温雪假山兼谢留饮 其二
52247,题石生仲濂所藏李克孝竹木
1168546,流夜郎半道承恩放还兼欣剋复之美书怀示息秀才
133606,浮舟之昌国谒韩克明知县
44915,在哀克刹脱教堂前
408369,挽黄克强先生二首 其一
1054608,中秋夜寄克道运使
638456,对紫荆花有怀亡弟克明
466577,赋乌克兰饥荒七十三年祭二章
637544,和林克全韵三首 其三
1215177,次韵刘伯善康克正新春游冶城谒卞壸墓
662083,送刘克柔之任南鸿胪
1217066,许编修克敬归平水奉寄王秘监先辈
836865,二十九日攻克施厝坪等处
506059,题黄克文先生竹溪图
804215,托多克道中戏作胡桐行
679886,赋得二题送严克谦之京 其一 分水晨关
1217633,寄浙西廉访托克托使君
303165,黄克强先生与李西屏先生书札
108277,题沈克己无名庵
659330,和吴克温直禁卫卒韵二首 其一
466592,自题《莪默绝句集译笺》步黄克孙韵题
804400,阿克苏浑巴什河
563039,调李京兆克庵备边疏
519770,送娄克让之四川方伯
779334,木兰花慢 瓶花论，效刘克庄体
287897,边事感怀·指顾雄师克谅山
403780,菩萨蛮 其三 伊克昭盟道中
254969,得克萨斯
431994,菩萨蛮 咏费尼克斯
973105,挽俞克晦丈二首 其二
678873,题丁克恭临清轩
1072871,送刘克强再赴殿试
962376,昨幸甚得见子玉教授丈得一论其说出于订顽克己铭词致超绝辄借前韵以庆兼呈诸丈幸乞一笑正再拜上 其二
717234,送姜克犹归山阴 其一
574870,送施克和之平乐
865567,又次韵答克修
1211316,次巴克实彦卿雪中见示韵六首 其一
448576,登楼闻科胡特克彗星掠过
653797,武克显博古堂诗
576556,鹡鸰图并序，为大巷伍克和题三首 其二
559967,送陈同知克让同学友也
116486,离楚夜泊高丽馆寄杨克一甥
1246194,为韩克铭题画石鼎联句图
617557,王克仲孝廉佳诗见存用韵却寄
581949,送刘克让同知还湖南佥宪刘原左迁者
496101,减字木兰花 其五 送杨郎中克实谪官
677480,别南刑部黎克芳蔡汝聘二首时淮阳方有寇警 其一
511407,代简旧友克明梁先生
42525,哈萨克陪臣到因携观广陵风景
999481,陈伯成学士垂访以病中新浴不克见走书二短篇谢之 其一
814015,暨阳克复渡江纪事八首
56068,次吴侍郎克温天界寺别春
521527,送吴克常南京光禄监事
888963,又和金克家送春
479535,胶山忠定祠次施克和韵
1231129,和曹克明都事灵岩二绝 其一
666189,送克相侍御使齐鲁五首 其三
483857,与周思忠刘孟文诸君子会饮李克贞宅分韵得三字
304446,乙亥秋·申君温克午君豪
698220,廷试执事和程克勤诗韵
400316,中印度班底蒲向为美素儿名王畋猎之所。沿途古木参天，来游者夤夜宿峰顶，凌晨坐坦克入森林中，日出骑象而归。次东坡法华寺韵，以记游踪
696178,和吴克温直禁卫卒韵二首
1088463,次吕季克东堂九咏 其三 方拙寮
522247,吴克学郎中自义兴访予西湖之上即席有诗因共游天马山历樱桃湾绝吴松而归次韵为赠
647600,歌风台送刘克让先生之沛县邑庠
440408,青玉案  己丑秋九黄山登高后启宇诸君同游合肥，予以故不克往，新河作赤阑桥怀古图，青凤以此调属和
509924,赠李克常
663434,嗟克明为段佥事惟勤乃翁作
1236135,客海陵光孝寺秋深感怀二首简盛克明
1208888,送张克宁赴淮东宪掾
284105,赵克臻大家别二十馀年矣归国观光海上喜晤因知近年以诗名藉甚香岛赋二绝赠行
87874,离郡五绝·丘笔郑克段
1211321,次巴克实彦卿雪中见示韵六首 其六
514323,上元日与林谕德亨大商懋衡李世贤二侍讲饯同年陆叙州克深考绩西还联句十首 其四
769595,虞美人·郑克柔述梦
605910,诸同社期集梅花坞余以公阻弗克赴
223604,徐孝克·自今所赐馔
234184,庆元丁巳十月奉亲如临安宿西菩寺表弟吴克仁
558070,与陈公甫饮有怀贺克恭给事庄孔阳司副
717235,送姜克犹归山阴 其二
491494,蓟丘墨竹歌为克隽李兵曹赋
1216342,同曹克明登北固山和韵
772255,江宁克复，曾涤生先生功绩伟甚。敬赋二律，以志欣仰 其一
512870,黄克明使云南还夜话
739932,题欧舫新诗时届季冬栖息三慧庵相约蔬食习养生之术余未克赴也 其一
744646,礼烈亲王克勒马歌 其一
581767,挽程太夫人学士克勤母也
193107,胡小著克顺知录州惠安县兼过南昌别墅
513774,腊月半后祠堂前并后园梅花盛开敬次家君卷中旧韵二首柬克俭 其一
686351,秋日杂兴和程学士克勤韵
653621,植兰堂为仇克明
1246918,和程生克有弄璋之庆
665433,居杭旬月迟王员外不克先赴闽州
844086,再克集集，俘斩二百馀级，溪水为赤
515374,自断石与司训黄伦汝彝及亲契汪锭克成族孙乙汰万并载竹筏沿溪泛至流塘饮詹贵存中家道中联句五首 其三
1228647,庐陵十景同萧克有孚有诸公作 其三 古城秋酿
289076,克林威尔·弑君冒不韪
865674,次韵答克修
522246,十七日得黄克明书报八月四日封事
1004637,庆元丁巳十月奉亲如临安宿西菩寺表弟吴克仁俱焉 其一
747514,奉使越南入关留别和越南魏克循韵 其二
585579,题吴郎克容东白号
