1070193,同赵叔问江仲嘉游法华之胜为曲水会有客先焉还饮舟中分韵赋诗得山字一首
882674,九日偕同寮至破山还饮誓清亭是日早雨寻霁自余至官三见菊花节常会于誓清因成二诗志之 其二
184431,九日偕同寮至破山还饮誓清亭是日上雨寻霁自
166723,奉陪赵颜术登叠嶂还饮陵峰梅竹间
522350,四月七日陪约庵适斋二太守东园鸿胪龙山都谏登超果一览楼望西隐堂有感还饮翠林精舍作时西隐火已一年而寺主杰峰亦化去矣是日翠林亦病出蔬馔延客故末句云云
882673,九日偕同寮至破山还饮誓清亭是日早雨寻霁自余至官三见菊花节常会于誓清因成二诗志之 其一
658905,与道卿鸣阳辈同游法海寺循平岭涉杨家坞还饮偃月冈
818477,三月三日鹤亭自丹徒至携同宗武公约伯臧及苍崖上人泛舟秦淮夜还饮水榭与鹤亭别
608245,既登济上楼还饮舟中对酒作
747966,同柏容郘亭泛舟过禹门山还饮姑园
818432,雨中自丁家山康庐还饮苍虬湖居被酒夜归同闲止作
1216744,上除日南山莲社期忏偕伯清昆季还饮南园
956833,与同僚游栖霞洞极深远中有数路相传有通九疑者烛将尽乃还饮碧虚上陈仲思用二华君韵赋诗即席和之
1110294,九日偕同寮至破山还饮誓清亭是日早雨寻霁自余至官三见菊花节常会于誓清因成二诗志之
712075,甲子重阳后四日蒋莘田大参招同潘亚目屈翁山登城北诸峰望全粤形胜还饮酒粤王台上时有建复镇海楼之议即事赋呈
906105,奉陪赵彦术登叠嶂还饮陵峰梅竹间
44342,雨中自丁家山康庐还饮苍虬湖居被酒夜归同闲
591344,九日陪陈梦庚诸子游佛教台还饮桥东草堂
