208568,石斛栽莲·数夕一梦吴淞江
180414,累年中秋无月今年凡数夕有之十五日尤佳
247563,暴力梅雨数夕不寐
373420,秋宿虎丘寺数夕执以诗见贶因次元韵
881706,鹧鸪天 其一 绍兴壬戌中秋前数夕与杨谨仲，鲁子明，刘曼容及子驹兄弟待月新桥
509758,读林缉熙近诗时缉熙典文衡闽中欲便道还家数夕前尝梦见之故有是作
268366,溪山晚渡·青山无数夕阳多
854257,贺新郎 别吴侍郎吴时闲居，数夕前梦枯梅成 其一 林，一枝独秀
1038989,秋宿虎丘寺数夕执以诗见贶因次元韵
440312,暴力梅雨，数夕不寐
164939,蝶恋花·数夕孤眠如度岁
908484,累年中秋无月今年凡数夕有之十五日尤佳
881549,八声甘州 其一 中秋前数夕，久雨方晴
587631,胡节庵联舟英德某所闻教者数夕矣皆心学也圣贤成己成物之训也某深自惭负无听教之地谨因先生赠贲翁诗附赘见愿学之悃焉
882701,予顷至鄞中常馆同叔之筠轩修篁交阴奇石中峙清风爽致袭人肌骨今年夏又假榻数夕尝得小诗以示同叔因其通书写寄池阳郡斋
464298,满庭芳·癸亥清明，覃儿归上冢。先数夕梦其母贷用于人，谓何不向儿取，内子怒而去。顷年境幸殊前，每思及内子处困时，辄为之叹息。感而赋此
