1232580,清明后四日红梨花开用明字韵赋诗一章奉邀虞李二学士以践看花之约玄德真人且属和矣学士竟不至又六日风雨大作花已委地依韵再赋一章呈玄德真人并简二学士
1232580,清明后四日红梨花开用明字韵赋诗一章奉邀虞李二学士以践看花之约玄德真人且属和矣学士竟不至又六日风雨大作花已委地依韵再赋一章呈玄德真人并简二学士
134024,寄陕西提刑江学士
1078499,渊圣皇帝题十八学士颂
1235628,和谢敬德学士见寄韵
539314,尚书学士吴兴董公过小祗园作
738439,壬午秋日刘圃三学士重过西园喜赋二章仍用见赠韵 其一
737034,题查声山学士花溪石漾图 其二
513969,下陵与李学士宾之联句
206521,送王专王衢之许下自维扬谒孙学士王舍人
655075,岁暮祷雪致斋柬李西涯学士
811091,喜湖南诸路大捷和学士李容斋前辈韵二首
1121410,斋宫尚有残雪思作学士时摄事于此尝有闻莺诗寄原父因而有感四首
1131175,端明殿学士汪公挽词
1053562,与廖明略学士赋馀干县白云亭一首呈吴明府
552589,唐十八学士登瀛洲图 其二
104864,送江西转运冯广渊学士
245433,送彦祖学士赴兖州
483264,次韵宋学士见寄四首 其二
894021,次韵和判曹韩学士见赏湖山
1213278,寿李野斋学士
789385,以菊花饷恽薇孙学士诗来用渊明自拟作此答之 其十
105409,依韵朱学士廉叔忆颖川西湖春色寄献尚书晏公
67548,送胡学士杨金二侍讲扈驾北伐
1223444,送马伯庸学士赴上都
923266,景纯学士文丈再录早年见庆嘉篇重用前韵奉和
1057191,次韵和贡父学士游左山归泛北湖
992076,江邻几沈文通二学士见过
1035761,长安龙图陈学士宠示重阳日翠微楼上见览拙诗之作兼蒙寄翠微楼长乐亭二记各述一绝寄而谢之 长乐亭
383090,黄水部便道省觐附候葵阳学士
480571,学士柏
1227806,上京次伯庸学士韵二首 其一
76822,别曾学士
125521,寄会稽天休学士
1039160,答丹阳李公素学士
1220369,清明日同学士李惟中赵子期及国学官携酒东岳宫后园看杏花 其三
808528,刘学士三吾
65106,游西湖和钱学士韵
721800,王学士亦经屈沱作诗予复和之
923259,寄题蒲传正学士清风阁
916113,次韵和阁长修书毕退朝下直寄诸学士之什
324859,丁酉八月十三日夜以经筵官番宿翰苑予十五年前曾为学士
661421,秋日杂兴和程学士克勤韵 其二
964348,次韵学士重阳雪中见招不赴前后十六首 其九
1035431,次韵和酬知开封县钱易学士见寄三首 其三
1070297,次韵和颍昌叶翰林 其三 同许学士亢宗干誉汎舟潩水
780892,贺新郎 题潘星斋画梅团扇顾南雅学士所作也
869546,和始平公长句寄汉州何学士
892506,河南希深学士
1045675,蔡学士挽词 其一
692324,鬼谷圮桥东山云房四图为金学士题
1229562,梅花百咏和冯学士海粟作 其十
698208,九日游陈氏西园即席次镜川杨学士韵
366349,酒席赠钦圣提刑学士
125280,送常州陈商学士
512816,写菊寿王学士济之尊翁八十
118111,次韵黄庭坚学士猩毛笔
1053343,四照阁奉陪辩才老师夜坐怀少游学士
648393,胡学士在北京闻予病寄诗慰问次韵奉酬 其七
1002608,寄晋州孙学士
1116404,提举刘学士以某论守江之策未行作诗见遗谨次
574076,闻吴宁庵转南京学士二首 其二
117593,次韵孔武仲学士见赠
650316,冬日扈驾猎龙山同尚书蹇公学士胡公登斗首山佛窟寺偶成十诗奉简 其九
1223684,同阁学士赋金鸭烧香
137973,送谢学士归阙
692297,胡学士在北京闻予病寄诗慰问次韵奉酬
482034,奉和胡学士光大侍从游万岁山诗韵十首 其六
206532,依韵和长安龙图陈学士登煕煕台之什
509645,张廷慎怡梅卷承钱学士命来索予题为赋三绝 其一
923592,学士院端午帖子二十七首 皇太妃阁五首 其三
739963,归自东皋得顾密斋学士书口号即寄
372573,次韵答子渊赵学士
343513,又和义夫学士用其韵
1049314,春后五日即事呈信道中丞致平学士
1088573,引年得请伏蒙致政学士契丈特垂庆问宠以佳篇捧玩之馀感愧亡量辄借高韵少见谢诚伏幸笑览
1228166,和宋学士晚出丽正门
696590,次韵宋学士见寄四首
744866,大玲珑山馆消寒第三集梧门学士出示所藏顺治壬辰乙未戊戌三科进士履历辄作长歌题其后
1223778,触石坠马卧病蒙恩予告先至上京寄溉之学士敬仲参书二首 其二
335225,次韵学士兄述怀
588757,院中同龙湖少湖二学士赏红莲 其二
1220367,清明日同学士李惟中赵子期及国学官携酒东岳宫后园看杏花 其一
1026266,史局坐寝戏呈崇文掌学士
682665,和四素黄学士兼呈章岩周中宪
1042336,十一月十五日朝拜章武殿雪中口占呈圣民学士
697606,西苑恭睹三杨学士锡游之处拟作二首
160347,和永叔小饮怀同州江十学士
1219350,送刘宗师入觐，次虞学士韵
893811,次韵和石学士见寄十首 其一
121260,代书寄集贤李昌武学士
514283,成化癸夘冬至谒陵与李宾之学士联句二十首 其十一 相赠
4677,韩大使东斋会岳上人诸学士
780049,永遇乐 送孙屺瞻学士归省
600498,扈驾功德寺陪李大司寇于徐二学士登西山对月三首 其二
1223374,秋日陪大学士赵公憩龙山玄真宫
342656, 送兵部陆学士赴漕闽中
354491,范学士韵·先生亡子众推贤
1102769,送程道大归新安兼简宪使卢处道学士四首 其二
506863,水竹居为王学士题
137919,西斋小饮赠别陕州冲卿学士
220634,酬叶道卿学士见寄
692540,送黄学士还永嘉
525070,陈鲁南学士自山东寄遁志十绝和之 其七
1039089,次韵和春聊学士早春
1191423,奉和圣制送张说上集贤学士赐宴
106015,呈李让臣就寄翰林阎学士
1025438,故资政殿大学士枢密洪公挽词二首 其一
917976,陪润州裴如晦学士游金山回作
330769,久旱得雨奉呈申之权郡学士
1052799,门下王相公南郊谢雪子敏甫学士监礼杨杰有诗次其韵
1213665,呈傅初庵学士 其二
496218,浣溪沙 暮入詹事府访崔后渠学士二阕 其三
676340,堂成敬酬丰五溪学士之作
1071611,学士蒋公母挽词三首 其三
892373,兵部学士移镇昭潭
1217694,呈黄晋卿学士二首 其二
63587,斋宫候驾次西涯学士韵
953858,寄题景纯学士藏春坞新居
132072,试学士院闻大贺过重华宫
1039102,和春卿学士上元罢灯
918105,挽学士张公
184183,和陈彦升学士九月校书怀旧之作
1169656,和杜学士旅次淮口阻风
953620,子华学士儤直未满遽出馆伴病夫遂当轮宿辄成拙句奉呈
548042,送张洪阳学士请告南旋四首 其三
1042108,答次道学士
111962,送高学士知越
547714,九月十三夜扈从功德寺陪李渐庵大司寇王忠铭徐检庵二学士登金山对月二首 其一
892449,和杨学士同晏尚书西园对菊
514504,慰李世贤学士丧子 其三
1236116,偶成二绝句简鲁威学士
354475,学士友兄·看山更饱更无厌
554338,和胡学士扈从猎阳山
1213725,读灌夫传呈傅初庵学士
1164855,太一石鳖崖口潭旧庐招王学士
53864,寄赠华鸿山学士
863493,和庐州通判李学士见寄 其二
1223414,秋日陪集贤学士赵公敬夫憩龙山玄真宫
858796,次韵酬府推仲通学士雪中见寄
137802,送刘学士知衡州
508904,贡院撤棘黄学士以诗见遗步韵以复 其一
1040275,寄酬齐州曾巩学士二首 其一
104518,送石昌言学士
548040,送张洪阳学士请告南旋四首 其一
698987,送李学士南归次韵
507127,题十八学士四首 其四 画
1148995,为乐天自勘诗集因思顷年城南醉归马上递唱艳曲十馀里不绝长庆初俱以制诰侍宿南郊斋宫夜后偶吟数十篇两掖诸公洎翰林学士三十馀人惊起就听逮至卒吏莫不众观群公直至侍从行礼之时不复聚寐予与乐天吟哦竟亦不绝因书于乐天卷后越中冬夜风雨不觉将晓诸门互启关锁即事成篇
702523,慰李世贤学士丧子
723922,命学士讲书诗
661040,次韵荅吴石楼学士 其二
1158473,奉和圣制送张说上集贤学士赐宴
1035421,长安龙图陈学士宠示重阳日翠微楼上见览拙诗之作兼蒙寄翠微楼长乐亭二记各述一绝寄而谢之 翠微楼
992040,次韵和司马学士虑囚
103423,送韩钦圣学士京西提刑
140824,贺尤礼侍兼修史侍讲直学士院
1230470,赵子昂画夏景仿王摩诘次韵为袁清容学士
1234048,十八学士图
149715,答王学士
105250,送李才元学士知邛州
134563,和张促通学士苦暑思长安幕中望终南秋雪呈邻
1112130,季秋十九日追还学士院回舟入都作二首
1039502,次韵答子渊赵学士
1069002,次韵宁徽言学士立春六绝 其三
789392,以菊花饷恽薇孙学士诗来用渊明自拟作此答之 其十七
1037655,送兵部陆学士赴漕闽中
696763,扈从再狩武冈次学士胡公韵
195808,吴学士席上作
1053522,次韵秦少游学士 其二
893804,次韵和石学士见寄十首 其八
990675,和石昌言学士官舍十题 其十 兰
2016,送考功武员外学士使嵩山署舍利塔
710040,寄方密之学士
494948,送许思仁学士归东昌省亲
545386,奉寿大学士洪都张公四首 其一
948482,敷文阁学士李仁甫挽词十绝 其四
192897,次韵和族弟日华寄编修诸学士之什
647983,胡学士山居六景 其三 沧江烟雨
554890,赠吴汝贤学士
650341,岁暮祀太庙斋宿翰林奉简胡杨二学士 其一
508745,和内阁李学士赏花诗 其八
1052663,熙宁丁巳蜡祭致斋玉津东园雪中与监礼莘老学士同游西园 其二
1035518,次韵和酬知开封县钱易学士见寄三首 其一
125219,陕府祖择之学士
365381,和江学士闻蝉
692538,胡学士山居八景之二首竹坞云林
506518,奉和胡学士光大侍从游万岁山诗韵十首 其九
1142316,寄阎静斋徐容斋二学士
858740,次韵陈学士小园即事
366578,送史馆齐学士知荆南唐相映之孙有权文公行修国史制书在
1050100,李公择学士出示胡九龄归牧图
554182,次韵胡学士春日陪驾游万岁山十首 其九
921920,次韵晁无咎学士相迎
1093139,俞伯辉主簿同徐必大判院见过涧上纳凉约鲍南仲教授小酌次韵南仲所赋兼怀林德久国录陈敬甫学士
939956,寄李学士
582055,寄刘仁仲学士同年
650275,奉和学士胡公春日陪驾同游万岁山 其二
509647,张廷慎怡梅卷承钱学士命来索予题为赋三绝 其三
1039819,送李运使学士赴阙十咏 其四
922809,次韵李公择送新赐龙团与黄学士三绝句 其一
183137,宋履中学士挽词
547702,张洪阳学士在告问疾
1043628,齐州史君学士有游山诗学官诸生咸和史君又有诗二章赠之以刻石摹本示予因次韵 其二
183879,寄题蒲传正学士清风阁
104559,送王道粹学士知亳州
891897,西湖席上呈张学士
955536,酬叶道卿学士见寄
518408,题玉堂学士图
577432,奉柬翰林侍读学士王公达善
366239,十一月十五日朝拜章武殿雪中口占呈圣民学士
1027903,端明殿学士王公挽词 其一
523557,春日寄题崔学士后渠书屋七首 其三
354833,承臬山毅夫提点学士有游会庾楼因用元韵
1051807,皇帝郊祀礼毕诣景灵恭谢次履中学士韵
169484,寄文潜无咎少游三学士
789384,以菊花饷恽薇孙学士诗来用渊明自拟作此答之 其九
1146273,在陇头哭潘学士
366831,挽资政殿学士吏部尚书曾公
916394,路学士知河中府
1020410,送史馆李学士任和州
37419,江陵寄翰林韩偓学士
1039046,喜雪答赵宗道学士
1030850,奉和子真学士咏雪之什
903294,贺尤礼侍兼修史侍讲直学士院四首 其三
424146,凤蝶令·浙人重葺白文公祠，附祀樊谏议，从絅斋学士议也，次韵奉和林丈鹍翔
941619,和祖择之学士袁州庆丰堂十咏 其三
871807,读石安仁学士诗
1120277,资正殿学士萧照邻挽词二首
648390,胡学士在北京闻予病寄诗慰问次韵奉酬 其四
1223784,二十五日即事呈阁老诸学士
1211668,元统乙亥岁集贤学士济尔噶台奉旨代祀真定路玉华宫睿宗仁圣景襄皇帝影堂仆备监礼
903296,贺尤礼侍兼修史侍讲直学士院四首 其一
650538,山居八景为大学士胡公光太赋 其三 天玉泉石
1220612,赠墨工侯务本次虞学士韵 其二
650430,和答庶吉士杨之宜就柬宗豫大学士士奇谕德及翰林诸同志 其六
869618,故翰林彭学士挽歌 其一
702335,三月廿六日饮镜川杨学士后乐园亭
916332,冬夕与诸公宴集贤梅学士西斋分得今夕何夕探得云字
530814,怀音篇寄张惟信学士
1002789,送陈商学士
523555,春日寄题崔学士后渠书屋七首 其一
600497,扈驾功德寺陪李大司寇于徐二学士登西山对月三首 其一
1207757,奉同元学士以落月满屋梁犹疑照颜色为韵赋赠邓提举之官江浙一首
887150,和钱学士见谢新栽竹
75553,留别凯烈彦卿学士
1189305,和段学士对雪
1037664,送陈学士知常州
494954,奉诏西苑陪祀谷祇坛舟渡西太液而归因览诸胜次韵张亭溪学士二首 其二
835000,寿楼春 新甫学士八旬双寿，重谐花烛，倚声奉祝
1038564,兖海孙学士寄昼锦编述先德宣公进退之美报之长句四韵奉扬盛事
708481,贺新郎  其一 送谷梁三叠顾庵学士韵
863603,送密直温学士西京迁葬
561678,恩赐麒麟服次俨山陆学士见赠韵 其二
945790,水龙吟 其一 寿江阃姚橘洲学士希得
342681,送聂学士赴阙
136743,温学士再访山中
361725,荣諲学士按部未还因寄
948478,敷文阁学士李仁甫挽词十绝 其八
104731,送周介之学士通判定州
1227145,送侍讲学士邓善之辞官还钱塘十首 其八
1015800,郑学士请赞
192914,次韵和史馆盛学士朝退书怀之什
2588,哭补阙亡友綦毋学士
937279,题十八学士图
85891,木兰花慢·瀛洲真学士
1216084,送巴克实彦卿学士之任燕南宪使得云字
166486,学士兄还乡之始会宾亲石门寺以开门见山不能
798691,明月生南浦·潘季展大令元长以其先人峄琴学士衍桐石刻遗诗见贻，奉酬此解，并即寄怀
159478,学士·彼美闺台彦
1244197,和虞学士春兴八首 其一
697708,闻杨学士士奇卧病赋诗寄简十首
1229870,送王魏二学士应聘
927578,和邢和叔学士见别
1053182,和莘老经六合西门水亭怀裴学士
893048,和石学士直舍晨兴
1220104,和张伯雨寄揭曼石学士时揭奉旨祀岳渎留杭丐老
569122,张守有温甫学士擘窠书老柏行余以仲昭太卿画竹配之时万历丁丑之八月廿五日守诞辰也眷属在里中将有就馆者并以为祝
954023,戏书拜呈学士三丈
1166432,送考功武员外学士使嵩山署舍利塔
105251,送李才元学士知广安军
472014,题张学士閒云馆四首 其一
166922,筠庄亭轩皆以筠名学士兄有诗次韵
922808,次韵李公择送新赐龙团与黄学士三绝句 其三
992077,江邻几学士寄酥梨
692611,题十八学士四首 琴
535350,和钟石学士斋夜见雪拗体二首 其一
923373,和胡俛学士游西池书事
741679,山阴潘筠轩学士招同汪九观旂沈大俨斋集冶城寓轩时学士自大梁返
741679,山阴潘筠轩学士招同汪九观旂沈大俨斋集冶城寓轩时学士自大梁返
788272,赐大学士徐元梦
870224,登平陆北山回瞰陜城奉寄李八丈学士使君二十二韵
894576,献臣学士与余通书因成感咏
1213813,同张学士赋莲房
552588,唐十八学士登瀛洲图 其一
1039103,次韵酬子渊学士灯夕不出闻诸公继有游赏
206496,河中孙学士以诗见寄因次本韵继和三章用为酬
230832,用韵赠傅学士兼述怀思古
183831,送祖择之少卿学士出疆
159623,忧关诣台先寄献臣天休二学士
955406,知府孙学士见示和终南监宫太保道怀五首因以缀篇 其四
514335,诗例奉送倪学士舜咨清明谒陵之行 其二
645956,送王尚书还朝兼简张学士
923065,观文殿大学士刑部尚书赠左仆射兼侍中刘公挽辞三首 其二
1114272,次韵谭彦成学士早春
953613,与谢三学士唱和八首 和游午桥庄
548835,送冯用韫学士归省 其二
560074,和周学士梅花诗韵
947147,次韵李学士勾院海棠
650013,寿黄学士
1035863,题卢鸿一《学士堂图》
923579,学士院端午帖子二十七首 皇太妃阁五首 其一
137382,奉答子履学士见寄之作
62950,秋怀酬泰泉学士
1052816,依韵和王微之学士
1229556,梅花百咏和冯学士海粟作 其四
1071609,学士蒋公母挽词三首 其一
996770,观秘阁苏子美题壁及中人张侯家墨迹十九纸率同舍钱才翁学士赋之
103068,叙两会事戏寄刁景纯学士
1116917,龙图阁学士赠银青光禄大夫滕元发挽辞二首
946901,休沐端居有怀希圣少卿学士
166439,次韵谭彦成学士早春
1068815,汴中追寄吕居仁学士
104462,送陆子履学士通判宿州
1046063,寄题洋川与可学士公园十七首 其十二 书轩
1214817,题集贤全大学士三首 其一
561275,赠别汝湖学士
263626,满江红·即席赠顾庵学士
1010229,送王商公游永嘉兼呈东圳曹侍郎荆山刘学士
1046066,寄题洋川与可学士公园十七首 其十五 寒芦港
720378,百字令·祝徐学士母亲太夫人寿
698250,癸丑春闱忝知贡举试事将毕寄柬李陆二学士
1099982,贺刘尚书除龙图阁学士
684152,扈驾功德寺陪李大司寇于徐二学士登西山对月三首
789388,以菊花饷恽薇孙学士诗来用渊明自拟作此答之 其十三
1225376,俞元明参军雪中以诗招饮就和韵时学士东泉鲁公大参叔能王公御史子昭郭公同行
1059129,次韵和知府欧阳叔弼学士祷雨武侯祠
940052,赠欧阳叔弼学士
570594,元驭学士于新观种花挑野菜前后戏呈得十二首 其十
488382,秋日题林学士菊花园
939967,寄徐吉父学士
26453,经故翰林袁学士居
104587,李士元学士守临邛日有谷一茎九穟者数本芝数
948481,敷文阁学士李仁甫挽词十绝 其六
1214227,贺欧阳公除翰林学士
514637,并蒂莲和青溪学士韵四首 其四
1038621,近自钟山采松花和汤甚美送汤一罂呈仲文学士 其二
992790,送司马学士君实通判郓州
702371,成化癸夘冬至谒陵与李宾之学士联句二十首 其一 宾之约德胜关土城寺候同行予误出安定关土城过道赴约
663912,临颍与贾学士夜坐
654979,送韩府杨教授学士尹先生表弟
315607,题唐十八学士登瀛洲图
648189,诸公从狩龙山因登牛首山访佛窟寺胡学士有诗是日仆以病不及行想像佳游辄用次韵三首 其二
608378,题王学士忠铭先生山中四景 其三 石垄马鞍
106916,寄集贤阎子静学士
15125,裴相公大学士见示答张秘书谢马诗并群公属和因命追作
1234930,月氐王头饮器歌和贯学士韵
1114326,小重山 学士生日二首
561343,杨州别邓太仆以正因寄玄庵穆学士
554354,次韵胡学士内阁新成四首 其二
1052550,元丰己未冬至夜万载驿尝有诗寄广汉今岁万安驿用前韵呈广汉友兄学士 其二
548041,送张洪阳学士请告南旋四首 其二
347644,安学士·节遇中秋挟日馀
1168838,癸巳岁吉甫圜丘摄事合于中书后阁宿斋常负忝愧移止于集贤院会门下相公以七言垂寄亦有所酬短章绝韵不足抒意因叙所怀奉寄相公兼呈集贤院诸学士
372739,次韵和春聊学士早春
700572,徐学士子容薜荔园十二首 思乐堂
1222508,次韵肯堂学士冬日红梨花
649437,答胡学士 其三
698727,挽故文渊阁大学士胡公光大二首
288,在陇头哭潘学士
1225452,题吉学士墨梅
1224024,代祀西岳答袁伯长王继学马伯庸三学士二首 其二
554339,和胡学士扈从再猎武冈 其一
1052430,陈师道教授示黄梅诗次韵呈正夫学士四首 其二
733388,赠张篑山学士
648044,题曾学士竹
125528,寄临江知军刘子先学士
354472,赠去华学士
342553,送周学士归永嘉
648155,题金学士画
916241,贺资政学士王侍郎
660602,送邦彦学士先生二首 其一
222188,秋兴浩然追忆馆殿幽致偶成长句寄徐休学士
924827,雨中陪子瞻同颜复长官送梁焘学士舟行归汶上
1252883,奉教和王达善学士梅花四咏 梅影
548836,送冯用韫学士归省 其三
1194254,送薛学士赴任峡州二首
523558,春日寄题崔学士后渠书屋七首 其四
664031,东园饯别杏东郭学士
991642,题滕学士九华山书堂
204549,和陆学士夏日见寄
869689,送李学士使北
1213205,偶得数语留别诸名公录赠伯宗学士子贞奉常
922939,太平守梅学士隔阔累年会遇京口喜道旧故特枉篇章勉次来韵二首 其二
103347,送孙学士知太平州
32380,雨霁池上作呈侯学士
1166381,右侍郎集贤院学士徐公挽词二首 其一
1180437,江陵寄翰林韩偓学士
716995,学士泉
1039820,送李运使学士赴阙十咏 其五
720952,留守相公六帙仰同诸公共次方密之学士旧韵二首
514506,慰李世贤学士丧子 其五
230808,小王仲冬望置酒学士赋诗次韵
696744,奉和学士胡公春日陪驾同游万岁山
664194,追和元马伯常学士无题韵四首 其四
869768,寄陜西提刑江学士
693642,舟中寄怀张明成学士邓以德太史涂汝高侍御三先生二首
137365,和谢学士泛伊川浩然无归意因咏刘长卿佳句作
1039076,次韵答子渊学士
547851,寄吴少溪宫录七十 其四十七 九日登三阳观与冯用韫学士公孝与文学言别
528533,送贾学士之南都
736460,寄顾山容学士
618194,戊辰除夕宫詹学士命下适内使捧赐上尊珍馔恭赋志感
1224300,集贤大学士赵国公王开府庆八十应制
569830,苏子瞻学士初通判杭州过秀州遇乡僧本觉庵文长老赋一诗留赠其后以学士再莅杭过之则文已退院三过之圆寂矣皆有诗志其感慨后四百年太守龚君勉于庵内别构丙舍祀苏公颜之曰三过而悉步其韵一时诸贤和之不佞继焉 其一
569830,苏子瞻学士初通判杭州过秀州遇乡僧本觉庵文长老赋一诗留赠其后以学士再莅杭过之则文已退院三过之圆寂矣皆有诗志其感慨后四百年太守龚君勉于庵内别构丙舍祀苏公颜之曰三过而悉步其韵一时诸贤和之不佞继焉 其一
1035433,依韵和长安龙图陈学士登熙熙台之什二首 其二
894091,和龙图王学士经涂洛邑见寄
106563,次韵阎学士靖轩赠受益山居
548045,题张学士閒云馆四首 其三
1083818,丁酉八月十三日夜以经筵官番宿翰苑予十五年前曾为学士 其三
159363,和答李学士见寄长韵
1052662,熙宁丁巳蜡祭致斋玉津东园雪中与监礼莘老学士同游西园 其一
168406,得合门报以予班学士诏复赐衣带因怀初锡倏阅
1031364,和王学士芍药
128694,答内翰学士
547715,九月十三夜扈从功德寺陪李渐庵大司寇王忠铭徐检庵二学士登金山对月二首 其二
650317,冬日扈驾猎龙山同尚书蹇公学士胡公登斗首山佛窟寺偶成十诗奉简 其十
1214212,子昂学士为余作此山二字并作诗见畀其诗云青青云外山炯炯松下石顾此山中人风神照松色又云爽气在襟袖清风拂丝桐悠悠适天趣宴坐心融融书此以谢
672801,予既以诗赠邦振北潭学士谓其四弟亦欲一诗乃和前韵赠之
608379,题王学士忠铭先生山中四景 其四 桥头碧水
698239,学士四荣为丘先生仲深赋 史馆进书
1037899,次韵王舍人忆省中小桃寄江学士
893118,羸疾益间呈聂长孺学士
923600,学士院端午帖子二十七首 皇帝阁六首 其六
18891,送河南尹冯学士赴任
647947,题勉仁学士草虫图
1132411,河中孙学士以诗见寄因次本韵继和三章用为酬赠
202961,和王学士水车
357836,哀范卿学士弟
846808,蓦山溪 寿李学士十月廿六
227296,和运使张学士惠诗
514839,三月廿六日饮镜川杨学士后乐园亭 其二
514287,成化癸夘冬至谒陵与李宾之学士联句二十首 其十五 下陵
1049788,将至江夏先寄太守李学士
328215,杂忆·娄江学士擅风华
906295,次韵学士兄发毗陵之作
1242594,投赠潞国公承旨学士张仲举
1236513,次韵大学士喀喇子山公见寄二首
583183,待隐图次杨邃庵大学士韵八首 其七
948479,敷文阁学士李仁甫挽词十绝 其七
508560,十六日与学士钱公亚卿章公会饮于崔都阃宅赋此以谢
137907,吴学士石屏歌
515544,西涯学士再和东坡雪韵邀予同作四章 其二
698255,奉次屠都宪韵贺篁墩学士领教翰林兼柬西涯学士二首
698255,奉次屠都宪韵贺篁墩学士领教翰林兼柬西涯学士二首
320903,知府学士远寄雅章曲念衰老谨依高韵和呈粗伸感佩之意
991386,送陆介夫学士通判秦州
435794,王学士熊岳图
1205158,人月圆 子昂学士小景
194704,暑雨蒸溽奉王元规学士
323792,七言一章赠别吴兴太守中父学士兄
654913,草庭都尉西涯学士两以正月四日同复命奉天殿有诗纪之辄赋一首
906094,和夷仲弟喜学士兄归
982489,林次中奉使契丹刘仲平出倅郓州同舍十有六人饮饯于丁氏园次少蓬韵二首 其二 送平仲学士
1052278,深父学士示易诗四首某辄和韵 其三
737033,题查声山学士花溪石漾图 其一
1225406,游玉泉山呈袁伯长学士
894104,和杨学士和答中丞晏尚书西园玩菊
869968,石昌言学士宰中牟日为诗见寄久未之答今冬罢武成幕来京师此诗谢之
684863,奉和胡学士光大侍从游万岁山诗韵十首
351448,兖海孙学士寄昼锦编述先德宣公进退之美报之长句四韵奉扬盛事
869675,送齐学士知荆南
919841,简朱子大学士二首 其二
992685,叙两会事戏寄刁景纯学士
906286,次韵刘宽夫题学士进此庵
102903,吴冲卿学士以王平甫言淮甸会予久未至冲卿与
688655,宿昌平刘谏议祠次韵赠蒲汀学士
1152510,题汧阳县马跑泉李学士别业
1057043,观文与可学士画枯木
892788,寄会稽天休学士
