1027910,端明殿学士汪公挽词 其一
323789,次韵徽之学士马上口占
1225451,天冠山同诸学士为祝丹阳赋 其五 小隐岩
923357,即席分韵送李才元学士守临邛
383039,送周寅所太史册封周藩并寄沈蛟门学士
154338,寄题密州苏学士快哉亭太史云此城之西北送客
1213644,八月朝回呈学士阎静斋李野斋赵方塘 其二
357395,法曲献仙音·邹学士卢御史顾中翰传钞予词惭赋
507003,和胡学士韵四首 其二
322278,寄李厚庵学士
508906,贡院撤棘黄学士以诗见遗步韵以复 其三
1035571,河中孙学士以诗见寄因次本韵继和三章用为酬赠 其一
1026454,送沈学士知常州
47683,题赵学士松图
494951,次韵贺夏桂洲学士受赐箱金犀带
482192,奉和学士胡公春日陪驾同游万岁山 其八
939975,寄提刑李学士
905731,怀湘南旧游寄起居刘学士
1116926,次韵和丹阳裴如晦学士寄示与蔡子直陈述古唱酬五篇
554365,胡学士卧病赋简二首 其一
1126495,和石昌言学士官舍十题 病竹
213694,送文学士倅邛州
339739,和元子发学士见寄
950862,得閤门报以予班学士诏复赐衣带因怀初锡倏阅十年感恩纪事二首 其一
159463,奉送滁州赵学士
506513,奉和胡学士光大侍从游万岁山诗韵十首 其三
732977,送汤荆岘学士巡抚下江
103524,答宋学士次道寄澄心堂纸百幅
953512,斋宫尚有残雪思作学士时摄事于此尝有闻莺诗寄原父因而有感四首 其四
492158,冬日同诸友访萧国录登西楼复会宿山房分韵得连字因怀往昔夜过监学访萧国录会宋学士周员外诸公赋诗旧事明日赋柬鹏南伯仲并分韵诸作者
753213,送黄仲韬学士提学湖北先发日本 其二
993083,读邵不疑学士诗卷杜挺之忽来因出示之且伏高致辄书一时之语以奉呈
955290,和提刑赵学士探梅三绝 其一
1116858,观文殿大学士刑部尚书赠左仆射兼侍中刘公挽辞三首
702442,与庄定山司副潘时用待诏同至李宾之学士先茔登古城
682197,九月十三夜扈从功德寺陪李渐庵大司寇王忠铭徐检庵二学士登金山对月二首
683889,意上人一梓甓婆罗门弃家入道通习三乘援苏学士赠乡僧文老例乞余一言走笔应之
133636,退天童上太守吴学士
1227036,哭李息斋大学士 其一
807237,满江红  赠史远公五十即用学士原韵
137933,戏书拜呈学士三丈
523561,春日寄题崔学士后渠书屋七首 其七
1127176,和李学士试院感秋二首
948555,龙图阁直学士吴明可挽词二首 其二
789389,以菊花饷恽薇孙学士诗来用渊明自拟作此答之 其十四
230061,梦得学士贤表惠寄蕨芽小诗驰谢聊发一粲
183909,次韵李公择送新赐龙团与黄学士三绝句
650474,腊月四日同杨谕德晚出访友人李伯葵余回至长安街坠马遂在告数日胡学士先以诗见寄明日杨复以诗来相嘲因次韵奉答且以自解也然后诗结语盖答杨意也 其二
809568,行间赐大学士张玉书
480245,己亥中元陪祀山陵道中奉和杨学士先生韵四首 其一
981222,和宋子京召还学士院 其二
1052535,和履中学士上元有作 其一
193228,史馆杨嵎学士以诗话及空门之事次韵和之
327426,引年得请伏蒙致政学士契丈特垂庆问宠以佳篇捧玩之馀感愧亡量辄借高韵少见谢诚伏幸笑览
137713,寄题景纯学士藏春坞新居
954160,送胡学士知湖州
1042970,送章学士知湖州
377777,次韵少游学士送龚深之往金陵见王荆公
339640,贺刘尚书除龙图阁学士
2265,伤王学士
680836,题潜溪宋学士祠墓
1053356,晓发苕溪将次径山呈通判廖明略学士
1052555,竹间见梅花呈都运大夫提刑学士一笑
648392,胡学士在北京闻予病寄诗慰问次韵奉酬 其六
1210336,奉和揭学士听松轩
922829,和兖弟与梁况之学士同作四绝句 二首并和况之元韵 其一
1112447,近自钟山采松花和汤甚美送汤一罂呈仲文学士
352038,徐学士诗·不须乘月坐胡床
583177,待隐图次杨邃庵大学士韵八首 其一
12586,和蒋学士新授章服
947201,送彦祖学士赴兖州
1052002,呈运判学士 其二
506583,送黄学士严翁思恭荣受诰命还永嘉
650299,追和学士胡公秋日同陪驾重游太液池 其八
1235350,送侍讲学士邓善之辞官还钱塘十首
175296,长句寄尚明学士
979593,游栖岩寺呈提刑学士毅夫兄
660609,和石学士予庄韵四首 其二
698242,弘治纪元戊申二月十三日侍从亲耕藉田用程学士韵一首怀不能已复缀短韵一章
1107731,效赵学士体成口号十章献开府太师
372589,寄西台子渊赵学士
508747,和内阁李学士赏花诗 其十
964530,书怀寄呈莱州张学士
180702,陈叔易学士母阮氏挽词
1196383,奉和武功学士舍人纪赠文懿大师净公 其一
991705,送李学士河东转运
124989,送薛学士伯垂同理嘉兴郡兼简太守集仙柳著作
1061595,御试宿集英殿雨过有作呈敏甫学士
151869,寄寿春使君陈学士
561563,同顾学士于神乐观赏牡丹次韵 其一
1035529,还何学士诗集
999084,闻东嘉王公得杂学士喜而成篇
649516,题杨学士画 其三
880552,寄灵仙观舒职方学士
355198,范学士韵·风雨先催十月寒
1052537,和履中学士上元有作 其三
692293,简胡学士索木芙蓉栽
515543,西涯学士再和东坡雪韵邀予同作四章 其一
894028,次韵和吴侍郎喜令弟学士请告归省
869685,送张学士两浙提点刑狱
1037722,寄张唐公学士
850312,陈用之学士挽词二首 其一
1059063,送杜君童学士赴阙
662077,南山宴集简丰原学学士二首 其一
482305,送胡学士杨金二侍讲扈驾北伐
1045956,致政侍郎知郡学士赓和诗凡数篇谨用元韵寄呈知郡学士
1045956,致政侍郎知郡学士赓和诗凡数篇谨用元韵寄呈知郡学士
48403,彭学士先生所藏刘进画鱼
992810,送孙学士知太平州
48525,己亥中元陪祀山陵道中奉和杨学士先生韵·夜深灯火下斋宫
515535,十月廿六日大雪约廉伯宾之二学士启昭庶子小饮
941594,送高学士知越
1116890,次韵刘莘老学士惜别言怀兼呈次中察院二首
124230,和宫师相公待制庞学士贤年二韵续川然两字
214379,中秋与柳赞善开宗赞善坦寇学士准宿宋拾遗白
1184497,送考功武员外学士使嵩山置舍利塔歌
225680,送张学士赴阙
1236305,呈傅初庵学士
1035570,河中孙学士以诗见寄因次本韵继和三章用为酬赠 其二
554550,卜筑新成胡学士以诗见寄就韵奉答三首 其二
1068878,古律诗戏简汪彦章学士
702108,奉诏西苑陪祀谷祇坛舟渡西太液而归因览诸胜次韵张亭溪学士二首
361670,和荣諲学士按部过长濆关所寄诗
923576,学士院端午帖子二十七首 太皇太后阁六首 其六
1127524,和致远学士游池
648720,杨学士乃弟仲宜归建安以道中五景求诗赠之 其四 鹅湖晴云
892517,陕府祖择之学士
1135487,寄集贤阎子静学士
654910,九日游陈氏西园即席次镜川杨学士韵 其二
1078721,谒蒋仲远坐中出所知和徐学士诗归而次韵二首是日饮仲远宅见二侍儿 其二
220827,知府孙学士见示和终南监宫太保道怀
1033703,读三学士人论事三书 其二
990676,和石昌言学士官舍十题 其九 甘菊
18880,和集贤刘学士早朝作
384775,寄黄泰泉学士
650280,奉和学士胡公春日陪驾同游万岁山 其七
159254,送雨浙转连道卿学士
789383,以菊花饷恽薇孙学士诗来用渊明自拟作此答之 其八
425155,张学士祠
662078,南山宴集简丰原学学士二首 其二
1213664,呈傅初庵学士 其一
215549,和钱学士喜雪
905798,次韵学士兄秋初 其二
587627,樵翁大学士归赠
1051657,察院学士灸焫连日戏作鄙句
1193206,九日与敬处士左学士同赋采菊上东山便为首句
1039818,送李运使学士赴阙十咏 其三
506796,乐琴书处为沈学士题
906034,次韵学士兄偶成
893803,次韵和石学士见寄十首 其九
525298,出蒲圻饮廖学士山庄留赠
543527,读国初四君遗集 其一 宋学士景濂
648103,题杨学士画 其一
1178973,集贤书院成，送张说上集贤学士，赐宴得珍字
513552,题尹正言学士菊
1212106,李惟中学士自西台侍御召入以未央宫瓦砚为贶作此谢之
1095927,次韵谢学士
905827,次韵谭彦成学士早春 其三
104399,来上人归宣城兼柬太守孙学士
857884,普净院避暑呈陆子履学士
195256,送陈彦恂北上兼简李奇卿学士
1037606,送集贤李学士赴荆台
564403,饮许龙石学士园亭短述三首 其一
67614,次西墅学士己亥元日雪
996399,以酒渴爱江清作五小诗寄廖明略学士兼简初和父主簿 其一
685602,挽故少宰学士黄焯星先生三首先生丁母艰未小祥而逝
656225,奉别彭吕二学士
1002069,题三衢汪学士听雨轩
650541,山居八景为大学士胡公光太赋 其六 墨潭秋月
892673,送杨学士三首 其二
123997,羸疾益间呈聶长孺学士
1236426,呈黄晋卿学士二首
688704,晚秋时菊盛开复有红葵一株作花次韵俨山学士
1216069,次韵宋显夫学士马上偶成
859094,晚兴和冲卿学士
514741,题歙人徐昊所藏十八学士图
320669,令弟坚官满归京偶成四十言代书寄判武学顾学士略资一噱
859173,和钱学士喜雪
648270,赐游西苑同诸学士作 其三
992819,送江西转运冯广渊学士
894214,送伯中尚书学士归阙
994380,谢择之学士惠示吏隐宜春郡十诗因成五十六言奉答
553562,题胡学士从叔祖母曹氏死节卷
154203,走笔次韵黄观复学士
105657,张圣民学士出御书并法帖共阅之
906033,次韵学士兄桐庐道中
103744,代书寄王道粹学士
648791,题杨学士藏陈所翁四龙图
534810,舟中别用均学士有怀
1226932,梁贡父学士江行阻风图
124939,答张学士西湖即席
720154,送家立庵学士册封安南
1039098,和春卿学士柳枝词五阕 其二
1169550,和杜学士江南初霁羁怀
855059,寄蔡学士
681163,清明谒陵次杨学士维新韵 其一
561262,送吴学士视篆南京予旧领此职
383738,九日登三阳观与冯用韫学士公孝与文学言别
580087,次倪学士韵答庄孔易
1026461,送晁怀州学士 其一
1153200,奉和圣制送张说上集贤学士赐宴
892697,送常州陈商学士
574571,为龚时亨题王中书春流出峡图追次王耐轩学士韵
655272,题瀛洲学士图 其四
1251475,奉教和王达善学士梅花四咏 其二 梅香
545503,大学士赵公手书促驾赋谢二首 其一
1207921,奉寄翰林邓善之侍讲学士
1122863,用韵赠傅学士兼述怀思古
583181,待隐图次杨邃庵大学士韵八首 其五
811242,陈伯潜学士以路事来粤，相晤感赋二首
1071759,题韩晃沈本作滉画瀛洲学士图
649210,寄李学士
1235745,赠墨工侯务本次虞学士韵
1229557,梅花百咏和冯学士海粟作 其五
1227868,上京次李学士韵五首 其四
916118,次韵和族弟日华寄编修诸学士之什
641674,挽全希言学士
104959,送刁景纯学士赴越州
511590,对盆荷怀王廷贵学士
1042110,酒席赠钦圣提刑学士
1220370,清明日同学士李惟中赵子期及国学官携酒东岳宫后园看杏花 其四
116198,元忠学士八兄耒离京师远蒙追送许惠服丹法托
134828,送张少卿学士知洪州
125072,送越州陆学士
525843,徐学士子容薜荔园十二首 其九 留月轩
48524,己亥中元陪祀山陵道中奉和杨学士先生韵
118338,次韵张耒学士病中
1035667,寄陈越学士托附魏仲容
514406,沁园春 寿少詹学士镜川杨公
159300,次韵和石学士见寄
372740,次韵和子渊学士春雨
1051857,和范学士韵 其九
547709,送周寅所太史册封周藩并寄沈蛟门学士
554553,闻杨学士士奇卧病赋诗寄简十首 其一
77746,送曾学士赴行在
150376,菩萨蛮·蓬山学士文章伯
554430,题竹鹤图为金学士赋
650315,冬日扈驾猎龙山同尚书蹇公学士胡公登斗首山佛窟寺偶成十诗奉简 其八
964346,次韵学士重阳雪中见招不赴前后十六首 其十一
1223777,触石坠马卧病蒙恩予告先至上京寄溉之学士敬仲参书二首 其一
926960,同王胜之学士转运赏西园芍药
561867,赠华学士视篆南院
1057192,次韵和裴士杰库部对棋上贡父学士
514275,成化癸夘冬至谒陵与李宾之学士联句二十首 其三 沙河道中大风
650536,山居八景为大学士胡公光太赋 其一 芳洲春草
525072,陈鲁南学士自山东寄遁志十绝和之 其九
941622,和祖择之学士袁州庆丰堂十咏 其五
1053154,次韵少游学士送龚深之往金陵见王荆公 其三
893032,次韵和李长学士正月二十八日出郊见寄之作
948576,华文阁学士沈持要挽词 其二
137947,题张损之学士兰皋亭
1052961,王圣美学士挽歌词
648387,胡学士在北京闻予病寄诗慰问次韵奉酬 其一
361757,次韵文同学士春雪
1213771,理发一首寄傅初庵学士
101205,吕与叔学士挽词
564811,题吴学士先生白楼三首 其一
1019432,寄池阳曾学士
515552,廉伯学士家赏盆梅限韵 其二
906436,小重山 学士生日二首 其二
645177,简胡学士光大 其一
1083816,丁酉八月十三日夜以经筵官番宿翰苑予十五年前曾为学士 其一
538690,过华师学士作
1144637,上李承旨学士
991823,六月晦日定力院同原父赋送伯镇景纯枢言三学士
1009804,送史馆李学士任和州
206478,和何学士见咏新得鹤
193116,和集贤李学士千字诗
1065089,题通判学士适轩
360440,送陈成伯学士知湖州
1225075,和马伯庸学士拟古宫词七首 其七
1152276,雨霁池上作呈侯学士
697487,读国初四君遗集 宋学士景濂
893165,龙图蔡学士镇高密
32366,江上逢史馆李学士
648403,子启学士见过仆适他出不遇奉简 其二
159658,献臣学士与余通书因成感咏
1044356,与张靖学士游华清宫雍帅钱子飞端明以诗见寄次韵和
1112987,谒蒋仲远坐中出所知和徐学士诗归而次韵二首是日饮仲远宅见二侍儿
1051658,再用前韵呈察院学士
1051850,和范学士韵 其二
230033,正伏承泽深佥判学士贤友以正生朝宠贶佳篇辄
986148,代书寄集贤李昌武学士
1054960,和李学士试院感秋二首 其二
992467,和吴冲卿江邻几二学士王景彝舍人秋兴
1037686,集贤石学士出守符离
498770,赠学士张龙湖南冢宰之任
647985,胡学士山居六景 其五 石屋晴澜
1216815,陪东泉学士泛湖
567879,陶学士烹茶图
905796,次韵学士兄秋初 其四
178092,送史馆学士杨亿闽中迎侍
1107465,丁酉八月十三日夜以经筵官番宿翰苑予十五年前曾为学士
892450,和季长学士绵汉道中作
1008956,谢安抚张学士惠茸毡
205134,寄池阳曾学士
1230711,玉雪坡为周伯温学士作
655107,学士四荣为丘先生仲深赋 其四 谨身读卷
230057,奉挽灵泉明府东叔学士
1039097,和春卿学士柳枝词五阕 其一
808543,方学士孝孺 其二
514334,诗例奉送倪学士舜咨清明谒陵之行 其一
202525,上李承旨学士
731168,故大学士刘统勋
115980,邓学士慎思挽词
1046869,挽资政殿学士吏部尚书曾公二首 其二
958769,题阎立本十八学士图
5474,翰林读书言怀呈集贤诸学士
1041658,和江学士闻蝉
654911,九日游陈氏西园即席次镜川杨学士韵 其三
922800,次韵孔平仲学士详定次口占
1046058,寄题洋川与可学士公园十七首 其七 露香亭
1035569,河中孙学士以诗见寄因次本韵继和三章用为酬赠 其三
923520,次韵黄庭坚学士猩毛笔
612334,挽故少宰学士黄焯星先生三首先生丁母艰未小祥而逝 其二
964350,次韵学士重阳雪中见招不赴前后十六首 其七
514669,王司言仪宾园亭夜酌与李世贤学士李符卿士钦联句二首 其二
871936,送郑十学士戬通理越州
964324,用韵赠傅学士兼述怀思古 其一
1114286,次韵学士兄秋初
675736,青环阁留题在白学士香山别业
1205930,洞仙歌 谢欧阳学士偕陈众仲助教过访
548837,送冯用韫学士归省 其四
535501,题张学士仰宸楼卷
1196482,鼎臣学士侍郎以东馆庭梅昔翰苑之毫末今复半枯向时同僚零落都尽素发垂领兹唯二人感旧伤怀发于吟咏惠然好我不能无言辄次来韵攀和
535539,和玉溪学士斋夕有感韵二首 其二
623493,入朗宁赠少宰学士萧公五言二十韵
355053,元祐三年同深之学士子开侍郎在初考
1236587,梅花百咏和冯学士海粟作
789376,以菊花饷恽薇孙学士诗来用渊明自拟作此答之 其一
275295,以菊花饷恽薇孙学士诗来用渊明自拟作此答之
1139633,送释存游苕川兼怀子昂学士
852540,寄题杭州通判胡学士官居诗四首 其一 凤咮堂
339977,与张靖学士游华清宫雍帅钱子飞端明以诗见寄次韵和
525841,徐学士子容薜荔园十二首 其五 观耕台
1127496,和范学士韵
562541,为林学士题十二红画
704011,次韵酬倪学士
507241,又次胡学士扈从猎武冈山诗韵
660603,送邦彦学士先生二首 其二
923005,次韵刁景纯学士将至郡见寄
103429,送范景仁学士归蜀焚黄
357558,两绝·北门学士居新卜
570596,元驭学士于新观种花挑野菜前后戏呈得十二首 其十二
1120361,敷文阁学士李仁甫挽词十绝
225821,送修撰杨学士留守南京
1249588,西昌萧鹏举橐其师北平按察司副使刘君子高之诗千馀篇过潭溪山中欲余选择将归而刻之子高余友也负奇才硕学知名当时其诗今翰林侍讲学士宋公评之至矣余何足以知之徒感鹏举师友之谊重增故人之思次韵二章聊答盛意他日子高见之当发一笑也
941621,和祖择之学士袁州庆丰堂十咏 其一
685286,避暑傅氏山庄次陆学士廉伯韵二首
566504,己亥清明陪祀皇陵二律和杨维新学士韵 其一
880515,休沐端居有怀希圣少卿学士
183941,次韵次中寄莘老学士
124177,次韵和李长学士正月二十八日出郊见寄之作
569970,请告杜门大司成张公少宗伯赵公学士余公携觞见枉分韵得桑字
96400,贺周待制兼直学士院
1035517,次韵和酬知开封县钱易学士见寄三首 其二
587662,约重游铁壁次阳峰张学士
656804,送吴学士俨考绩
648961,时勉学士升国子祭酒奉赠 其二
1041673,送楘州王学士
155802,闻东嘉王公得杂学士喜而成篇
1109822,送湖南提刑安学士
355211,执中学士以蔬菜见贶戏寄小诗
158189,陈伯成学士垂访以病中新浴不克见走书二短篇
937942,陈叔易学士母阮氏挽词 其二
948485,敷文阁学士李仁甫挽词十绝 其十
359486,灵壁游张学士园
514635,并蒂莲和青溪学士韵四首 其二
126442,和邢和叔学士见别
655271,题瀛洲学士图 其三
655154,癸丑春闱忝知贡举试事将毕寄柬李陆二学士 其二
789391,以菊花饷恽薇孙学士诗来用渊明自拟作此答之 其十六
808115,百字令 九日偕法梧门学士贾素斋上舍游极乐寺
437517,庆学士叔献七十寿二首 其一
1205945,七月七日同宋显夫学士暨经筵僚属游上京西山纪事二首 其一
720137,曲江得方学士苏翁先生书
22905,赠沉学士张歌人
1121587,知府孙学士见示和终南监宫太保道怀五首因以缀篇
568501,送邹东郭学士赴南院
923213,送洞霄宫王文玉学士归吴
117681,次韵刘贡甫学士画松石图歌
126519,和凤翔横渠张子厚学士
1102770,送程道大归新安兼简宪使卢处道学士四首 其三
15261,逢王十二学士入翰林因以诗赠
710305,虎丘寄吴梅村学士
697676,和胡学士扈从再猎武冈
731166,故大学士一等忠勇公傅恒
869611,故侍读学士张公哀辞二首 其二
659076,至乐楼诗为大学士费公赋
1037740,岁晚禁直呈承旨侍郎同院五学士
1114317,次韵陆虞仲学士涂中咏雪
1069005,次韵宁徽言学士立春六绝 其六
358831,和湖州文同与可学士见寄
649436,答胡学士 其二
955402,知府孙学士见示和终南监宫太保道怀五首因以缀篇 其一
547762,寄问冯学士扶侍旋里兼候北上
1214205,呈赵子昂学士
193176,密直任学士知益州
650298,追和学士胡公秋日同陪驾重游太液池 其七
549,西使兼送孟学士南游
507811,寄胡学士光太二首 其二
514688,和石城学士韵送馀姚贾尹宗锡南还
1246039,题赵学士色竹图
741709,秋日雨后同朱笥河学士宋小岩洗马曹竹虚中允褚筠心侍读集汪持斋阁学邸舍时谈及邓尉山桂华之盛故有落句
1063270,庠拜手顿首启伏蒙学士九丈再赐诗章庠僭率继和尚觊采览
1012217,赵学士求颂
329603,致政侍郎知郡学士赓和诗凡数篇谨用元韵寄呈知郡学士
329603,致政侍郎知郡学士赓和诗凡数篇谨用元韵寄呈知郡学士
937943,陈叔易学士母阮氏挽词 其一
923127,和陈彦升学士九月校书怀旧之作
1040753,故汉嘉太守礼院学士张公挽诗 其一
1104939,陈用之学士挽词二首
1229564,梅花百咏和冯学士海粟作 其十二
906505,醉花阴 学士生日
1131185,仲舅敷文阁学士汪公挽词
760098,陈伯潜学士以路事来粤，相晤感赋二首 其一
110308,和祖择之学士袁州庆丰堂十咏
1068975,次韵朱新仲学士元日会饮馆中同舍家
948836,端明殿学士张定叟挽词
356011,戏简陆学士宰
696425,南山宴集简丰原学学士二首
948834,端明殿学士王日严挽词二首 其二
809801,大学士陈廷敬挽诗
688697,恩赐麒麟服次俨山陆学士见赠韵
810594,壬午秋日刘圃三学士重过西园喜赋二章仍用见赠韵
855138,暑雨蒸溽奉王元规学士
704025,送钱学士
1244203,和虞学士春兴八首 其七
858655,王中甫学士挽辞
919593,提举刘学士以某论守江之策未行作诗见遗谨次 其二
728960,赐大学士张廷玉
1227140,送侍讲学士邓善之辞官还钱塘十首 其三
169486,寄提刑李学士
479164,避暑傅氏山庄次陆学士廉伯韵二首 其一
869612,故侍读学士张公哀辞二首 其一
924590,次韵刘贡甫学士画松石图歌
133574,以何学士韵示像侍者
481959,题王学士所藏王孟端老桧苍崖图
1066937,和必先龙图谢酒兼呈沈次律大学士
130996,樊学士送菊次韵答之
497276,奉寄瑶泉申学士二首 其二
692596,和胡学士韵四首
1213642,偕承旨野庄公学士刘东崖侍讲张西岩游庆寿寺憩僧窗有作
104535,送少卿张学士知洪州
948556,龙图阁直学士吴明可挽词二首 其一
585636,次大学士方樵翁用濂溪韵开金牛洞之作三首 其二
569086,咏诸功臣像二十六首 其二十六 故特进光禄大夫柱国少师太子太师吏部尚书华盖殿大学士赠太师徐文贞公阶
991317,送少卿张学士知洪州
664191,追和元马伯常学士无题韵四首 其一
992421,和石昌言学士官舍十题 其二 石榴花
169470,寄张学士·湖海三年别
327929,恭和圣制挽大学士张玉书
654959,游无锡小嵩山僧寺 其一 次钱学士先生韵
1032751,奉寄鲁直学士
1051817,奉怀深父学士友兄 其一
683863,元驭学士于新观种花挑野菜前后戏呈得十二首
923289,翰林侍读学士尚书右丞李公挽辞三首 其三
1111318,寄题张学士三径堂二首
991060,依韵和王景彝学士紫宸仲冬早谒
220762,送吴安道学士知崇州
514508,慰李世贤学士丧子 其七
684689,送大学士黄静庵先生拜封归永嘉
1044533,昔帅环庆为部将所讼冯君学士被制鞠狱而获平反今相遇于洛
355081,深父学士示易诗四首某辄和韵
916415,次韵和史馆盛学士朝退书怀之什
923596,学士院端午帖子二十七首 皇帝阁六首 其二
658545,送张学士廷祥之南京
155067,送李野夫兼简公择学士同年
692325,杨学士以海棠双鹊图赠其弟归求题
134830,送张学士两浙提点刑狱
514464,送吴学士汝贤莅事南京
964347,次韵学士重阳雪中见招不赴前后十六首 其十
733114,和曹顾庵学士湖舟泛雨
991374,送李学士公达北使
744745,呈梁学士丈
514636,并蒂莲和青溪学士韵四首 其三
508744,和内阁李学士赏花诗 其七
561280,赠许学士归省
382900,题张学士·滕王阁下碧波寒
697652,胡学士山居八咏 芳洲春草
153709,简朱子大学士
1223836,题李溉之学士湖上诸亭 其四 秋水观
1244212,和虞学士登宜春台
531771,赠吴白楼学士展墓归苏州
1027527,观文殿学士赵公挽词 其五
892454,和待制庞学士寄献宫师相公之作
883389,杨学士廷秀过访
905554,伏睹禁林新成盛事辄思歌咏不避荒芜上李学士
507004,和胡学士韵四首 其三
991511,寄西京通判宋次道学士
175978,有怀·青钱学士妙文章
583179,待隐图次杨邃庵大学士韵八首 其三
1178576,韩大使东斋会岳上人诸学士
992464,和江邻几学士得雷殿直墨竹二轴
892453,和宫师相公待制庞学士贤年二韵续川然两字
989005,与李先生学士
1051848,时在集英幕中呈诸公学士
554226,雨雪中独坐怀杨学士士奇二首 其一
648389,胡学士在北京闻予病寄诗慰问次韵奉酬 其三
650362,为杨学士勉仁题小景
789393,以菊花饷恽薇孙学士诗来用渊明自拟作此答之 其十八
506427,送胡学士扈从北征
953775,送王学士赴两浙转运
704123,简胡学士光大
923585,学士院端午帖子二十七首 夫人阁四首 其四
501171,送杨士杰学士代祀阙里分题得砚井台
354613,熙宁丁巳蜡祭致斋玉津东园雪中与监礼莘老学士同游西园
1109902,桂林解后拜见仲古龙图吉父学士别后得两诗书怀奉寄
1040288,次韵文学士寄仲南长老四句
220700,寄石学士·家有清白志
892515,转运李宥学士
507005,和胡学士韵四首 其四
514290,成化癸夘冬至谒陵与李宾之学士联句二十首 其十八 游清河惠应寺
104925,书李学士北使集後
506512,奉和胡学士光大侍从游万岁山诗韵十首 其二
192928,次韵和钱少卿早春对景有怀诸学士
166819,次韵学士兄偶成
507220,挽故文渊阁大学士胡公光大二首 其一
1045676,蔡学士挽词 其二
