383066,寄问冯学士扶侍旋里兼候北上
545442,夏日集大学士赵公斋中时群从诸孙咸集
1049579,送范百禄子功学士知谏院二首 其二
1228746,友人杨君所往金陵省忠襄公墓学士虞公送以诗壮郁沈痛使人流涕因用韵为别次篇远哀雍公以虞诗序及此故也二首 其二
515546,西涯学士再和东坡雪韵邀予同作四章 其四
678255,和胡学士冬至后六日游牛首佛窟寺 其一
952904,寄解州李学士
361626,湖北运使学士十二弟扬生日
992319,依韵和李君锡学士北使见寄
905858,和学士秋怀 其七
1120265,端明殿学士王日严挽词二首
1117113,学士院端午帖子二十七首 皇帝阁六首
651789,夏夜邑学士友携酒共话
365414,送祖学士使北
507839,寄曾学士子棨
1130504,故资政殿大学士枢密洪公挽词二首
1229554,梅花百咏和冯学士海粟作 其二
166821,次韵学士兄发毗陵之作
1109746,挽资政殿学士吏部尚书曾公二首
105389,新安钱学士以近诗一轴见贶辄成短言用叙单悃
372204,韩渎学士领益漕
561765,晚秋时菊盛开复有红葵一株作花次韵俨山学士 其一
612335,挽故少宰学士黄焯星先生三首先生丁母艰未小祥而逝 其三
1035748,送朱台符学士关西巡抚
1223530,和鲁子翚学士见寄诗韵二首 其二
996402,以酒渴爱江清作五小诗寄廖明略学士兼简初和父主簿 其四
1035740,上解梁潘学士十韵
941617,和祖择之学士袁州庆丰堂十咏 其八
1112453,故端明殿学士工部尚书致仕清源王公挽辞二首
1040284,和荣学士长濆关所寄
1188894,寄同年崔学士
761,同綦毋学士月夜闻雁
1038972,和丹阳公素学士晚望见怀
1228758,再和曾学士
1210626,送某学士
514505,慰李世贤学士丧子 其四
1037681,送林学士赴明州
583182,待隐图次杨邃庵大学士韵八首 其六
365085,简提刑朱仲隐初玉学士
513513,文渊阁大学士彭先生哀挽
650282,奉和学士胡公春日陪驾同游万岁山 其十
323770,中父礼院学士挽词
507767,春坊黄学士索赋刘缙草堂二首 其一
507197,和胡学士冬至后六日扈从猎龙山同蹇尚书诸公游牛首山佛窟寺诗韵三首 其二
159357,和龙图王学士经涂洛邑见寄
1183578,奉和圣制送张说上集贤学士赐宴赋得谟字
525840,徐学士子容薜荔园十二首 其三 风竹轩
696036,上元夜萧学士老师招饮绿野堂
177821,得昭文李学士书报以二绝
214287,晚兴和冲卿学士
656224,奉别李尚书学士
869288,效赵学士体成口号十章献开府太师 其七
1172366,仆射相公偶话于故集贤张学士厅写得德裕与仆射旧唱和诗其时和者五人惟仆射与德裕皆列高位凄然怀旧辄献此诗
1164132,送薛学士赴任峡州二首 其二
655269,题瀛洲学士图 其一
137383,奉答子履学士见赠之作
102993,送刘元忠学士还南京
1220117,呈鲁子翚学士
1012918,游龟山和何学士
138156,送京西提刑赵学士
1168710,翰林读书言怀呈集贤诸学士
1235186,虞伯生学士以五诗赠一上人蒙见及一公将归蜀谒赵鲁公次韵二首
548043,送张洪阳学士请告南旋四首 其四
894521,和答李学士见寄长韵
1244202,和虞学士春兴八首 其六
645178,简胡学士光大 其二
1019447,谢鲍学士惠腊茶
1230896,学士山怀古
964341,次韵学士重阳雪中见招不赴前后十六首 其十六
688774,大江东去和东坡词三首 忆旧游呈陆俨山学士
953822,闻颍州通判国博与知郡学士唱和颇多因以奉寄知邵陆经通判杨褒
953930,送谢希深学士北使
650308,冬日扈驾猎龙山同尚书蹇公学士胡公登斗首山佛窟寺偶成十诗奉简 其一
118820,学士院端午帖子
60129,题王学士所藏王孟端老桧苍崖图
1053551,哭少游学士 其二
569831,苏子瞻学士初通判杭州过秀州遇乡僧本觉庵文长老赋一诗留赠其后以学士再莅杭过之则文已退院三过之圆寂矣皆有诗志其感慨后四百年太守龚君勉于庵内别构丙舍祀苏公颜之曰三过而悉步其韵一时诸贤和之不佞继焉 其二
569831,苏子瞻学士初通判杭州过秀州遇乡僧本觉庵文长老赋一诗留赠其后以学士再莅杭过之则文已退院三过之圆寂矣皆有诗志其感慨后四百年太守龚君勉于庵内别构丙舍祀苏公颜之曰三过而悉步其韵一时诸贤和之不佞继焉 其二
1152069,哭补阙亡友綦毋学士
1057136,挽履中学士二首 其一
1036945,七言一章赠别吴兴太守中父学士兄
554177,次韵胡学士春日陪驾游万岁山十首 其三
1138330,北岳降香呈严学士
982480,怀李公择学士
697679,次韵胡学士内阁新成四首
870049,和张仲通学士苦暑思长安幕中望终南秋雪呈江邻几
1081921,次韵学士兄见一亭 其一
1207386,水龙吟 拱北楼呈汉臣学士
648589,题泉坡学士龙
1101740,答直学士院见访
1025437,故资政殿大学士枢密洪公挽词二首 其二
361614,次韵程给事同孙觉学士杨宪景略游天衣寺
1246142,题商学士寒林图
1225448,天冠山同诸学士为祝丹阳赋 其二 逍遥岩
649514,题杨学士画 其一
905850,和学士秋怀 其十五
178116,送冯学士入蜀
922832,和兖弟与梁况之学士同作四绝句 呈况之常叔立之
754631,吴素云女士写秋芳图寄其仲兄兰雪法时帆学士见而爱之以曹墨琴夫人手书洛神赋册易去甲寅春日兰雪过吴门属咏其事 其一
953616,与谢三学士唱和八首 陪饮上林院后亭见樱桃花悉已披谢因成七言四韵
577615,和侍读王学士时彦见寄韵
634249,雨中过先雪楼与梦也学士禅话
1215422,送渭清远上人谒虞学士求墓志 其一
570592,元驭学士于新观种花挑野菜前后戏呈得十二首 其八
554549,卜筑新成胡学士以诗见寄就韵奉答三首 其一
650200,静闇为黄学士尊人赋
1123416,题唐十八学士图二首
447,伤顾学士
887149,和胡学士馆中庭树
923073,即席分得秋字送张吉老学士移使京西
685231,待隐图次杨邃庵大学士韵八首
647984,胡学士山居六景 其四 天玉泉石
1069000,次韵宁徽言学士立春六绝 其一
103368,送制置发运唐子方学士
648655,送黄学士还永嘉 其二
133834,追和张学士从沂公游广固城
1069004,次韵宁徽言学士立春六绝 其五
648654,送黄学士还永嘉 其一
1032072,阙下留别孙丁二学士归旧山
731165,故大学士张廷玉
1125409,陈用之学士挽词
104823,送梁学士知襄州
738836,答金桧门学士和见赠诗韵
1054930,灵壁游张学士园
500712,益都城北三十里有邮亭名白羊铺壁间石刻张梦臣学士诗一首乃至大辛亥未第时所作其诗曰迢迢长日路途间两字功名抵死难岂为身荣爱奔竞正缘亲老逼饥寒云霄附凤心徒壮客馆无鱼铗自弹百亩薄田容易办也应无梦到长安仆因次韵书事
138057,斋宫感事寄原甫学士
976607,送凤茶与记室燕学士诗
647753,寿董学士 其一
32530,和同年韦学士华下途中见寄
177752,内翰毕学士外制迤舍人故仈部阁老王公之门生
964352,次韵学士重阳雪中见招不赴前后十六首 其四
570590,元驭学士于新观种花挑野菜前后戏呈得十二首 其六
514628,和镜川学士东阁静坐之什
1213782,失马次张畴斋学士韵
1166808,寄白学士
354724,和履中学士上元有作
1081922,次韵学士兄见一亭 其二
1214647,竹斋学士作柏图得之李好古野斋平章旧物也
1211540,次韵虞学士见寄
1227740,送蒙古潘学士
648718,杨学士乃弟仲宜归建安以道中五景求诗赠之 其二 广陵夜雨
554340,和胡学士扈从再猎武冈 其二
650030,古意寄曾学士二首 其二
1145655,答江学士协诗
554017,送大学士黄静庵先生拜封归永嘉 其二
1049809,留题吕学士无为军谪居廊轩
1049834,公择鄂守学士三堂请雨
119161,外孙文骥与可学士之孙也予亲教之学作诗俊发
1167394,谒翰林刘学士不遇
916387,密直任学士知益州
18900,和刘郎中学士题集贤阁
980491,次韵和马子虚学士感事见赠
342544,送子思学士倅河内
1236769,和南质张学士敏之见赠七首
124987,送杨学士·左幡彤赤抗前旌
992894,送制置发运唐子方学士
514440,万福寺送文明与倪舜咨李宾之二学士傅曰川吴原博谢于乔三谕德林亨大修撰陈汝玉给事李士常侍御联句 其二
1186524,送集贤学士伊阙史少府敕放归江东觐省
347471,陪蒲守景叔学士会畅家园
32895,和吴学士对春雪献韦令公次韵
1081705,郑维心约赵安道中大家兄次律学士及仆探梅城山乘月泛舟而归
682237,送张洪阳学士请告南旋四首
192913,次韵和守邦道人寄编修诸学士之什
1041149,寄朱三学士
525846,徐学士子容薜荔园十二首 其十二 钓矶
1037743,石曼卿学士挽词
1066088,寄题张学士三径堂二首 其一
1039816,送李运使学士赴阙十咏 其一
57525,酬曾学士子棨见赠复职之作
923016,次韵刘莘老学士惜别言怀兼呈次中察院二首 其二
905829,次韵谭彦成学士早春 其一
905851,和学士秋怀 其十四
183867,和李子仪学士上元
954151,送张学士知郢州
1196389,奉和武功学士舍人纪赠文懿大师净公 其七
585635,次大学士方樵翁用濂溪韵开金牛洞之作三首 其一
382717,题张学士閒云馆
648366,简胡学士索木芙蓉栽 其二
1235170,送渭清远上人谒虞学士求墓志
1027353,太上皇帝圣体清康老母进封信安郡太夫人适斋除敷文阁学士有诗为贺次韵 其二
347530,挽履中学士
680054,江学士柬之侨居草亭
948484,敷文阁学士李仁甫挽词十绝 其一
809692,览皇清文颖内大学士陈廷敬作各体诗清雅醇厚非集字累句之初学所能窥也故作五言近体一律以表风度
672612,朝陵次学士家兄韵
140827,学士院·化权亚史法
1227909,观祀南郊和李学士韵二首 其一
809139,夏日同大学士明珠暨诸侍卫过黑龙潭途中作
962398,正伏承泽深佥判学士贤友以正生朝宠贶佳篇辄次元韵 其三
659520,学士白庵丰先生论大礼谪漳南赠篇
337850,遣兴·风流不羡三学士
556042,题张学士阳峰卷
1120305,华文阁学士沈持要挽词
1081836,寄次律兄学士柯田山新居
1027528,观文殿学士赵公挽词 其一
185393,题子昂学士小景
138069,与子华原父小饮坐中寄同州江十学士休复
1027453,安行表兄除华文阁直学士奉祠次韵为贺
1093689,竹院晁学士挽诗 其一
916067,史馆张学士知婺州
1196397,寄舒州乐学士
926705,和凤翔横渠张子厚学士亡后篇
950901,九月十三日始就郊墅拜宝谟阁直学士提举江州太平兴国宫之命
808554,解学士缙
962382,梦得学士贤表惠寄蕨芽小诗驰谢聊发一粲
32825,出京别崔学士
482204,扈从狩阳山次韵答胡学士
514840,三月廿六日饮镜川杨学士后乐园亭 其三
888047,谢程钜夫学士
262525,屠牛叹呈张中柱学士
953684,西湖泛舟呈运使学士张掞
104255,和司马学士上辛祀事出郊寄冯学士
104255,和司马学士上辛祀事出郊寄冯学士
53316,蜀府命题所藏唐十八学士瀛洲图
1216229,题临川曾仲衍手卷时仲衍授永嘉之平阳州同知有旨命赍御酒宣慰本州周宗道佥院贡米入京卷有危太朴参政所书虞学士邵庵送行序并诗三首走亦不揆效颦于左兼简君道使君 其二
507789,寄同年曾学士子棨
1135456,读方处士墓志挽诗题其后阎集贤承旨文赵翰直书傅学士序
869280,效赵学士体成口号十章献开府太师 其八
1220480,玉雪坡为周学士赋
1180710,寄翰林陆学士
963117,十一月五日锁学士院
1068803,曾徽言学士求赋所蓄端砚曾尝避乱海陵家赀尽没于贼独携此砚脱去
1214341,谢欧阳学士
1032798,送高学士知越
518246,十八学士卷
1176808,送东莱王学士无竞
193114,贺资政学士王侍郎
7491,寄柏学士林居
1223392,读马伯庸学士止酒诗
65836,送王尚书还朝兼简张学士
905828,次韵谭彦成学士早春 其二
125068,送张清臣学士省侍金陵
342543,送次道学士倅洛中
1057196,和李文叔寄虢州孙元忠学士
1039817,送李运使学士赴阙十咏 其二
343460,同文馆试上舍和同事孔彦常学士即事
649506,子启学士见过仆适他出不遇奉简
104234,和韩钦圣学士襄阳闻喜亭
61159,十八学士歌
697707,卜筑新成胡学士以诗见寄就韵奉答三首
570585,元驭学士于新观种花挑野菜前后戏呈得十二首 其一
953795,送京西提刑赵学士
650460,和答光太胡学士至日喜雪之作
534894,送陆俨山学士南归
103870,和谢公仪学士正月十七日雨後复雪
1243137,题十八学士弈棋图
697216,仲冬长至大学士赵公汝迈大将军李惟寅同日先后招饮赋谢二章
510720,读西涯李学士撰赵员外沧江别墅记
351436,故端明殿学士工部尚书致仕清源王公挽辞
188422,寄灵仙观舒职方学士
343407,昨日以事不得陪赴和甫学士之召
648817,题杨学士藏子昂画刺虎图
992272,饮刘原甫舍人家同江邻几陈和叔学士观白鹇孔雀凫鼎周亚夫印钿玉宝赫连勃勃龙雀刀
991414,送梁学士知襄州
1214221,呈袁伯长学士
501290,元日早朝次马彦?学士韵 其二
506514,奉和胡学士光大侍从游万岁山诗韵十首 其四
354845,拙句送通判学士正夫
655105,学士四荣为丘先生仲深赋 其二 经筵进讲
49095,古意·翩翩为学士
545308,春日送赵均甫敬甫二文学一之北庠一之南雍秋试并寄怀大学士汝迈先生
698726,和胡学士冬至后六日扈从猎龙山同蹇尚书诸公游牛首山佛窟寺诗韵三首
923017,次韵刘莘老学士惜别言怀兼呈次中察院二首 其一
788271,赐大学士白潢
1220611,赠墨工侯务本次虞学士韵 其一
1083817,丁酉八月十三日夜以经筵官番宿翰苑予十五年前曾为学士 其二
109238,题袁学士像
507124,题十八学士四首 其一 琴
687404,题吴学士先生白楼三首
201813,王公和学士挽词
1130997,送晁怀州学士
145450,送王商公游永嘉兼呈东甽曹侍郎荆山刘学士
515656,十二月七日监放官吏俸粮其册云学士程某等共支米二百石初盖不知当此首选也戏成一律奉寅长西涯先生同一捧腹云
869284,效赵学士体成口号十章献开府太师 其四
16271,寄白学士
1234379,偶成绝句二首奉怀宋齐彦学士田师孟省郎 其一
731144,乾隆九年十月重葺翰林院落成车驾临幸赐宴送大学士掌院事鄂尔泰张廷玉进署以张说东壁图书府五律字为韵赋东字音字二首敕诸臣各分一字赋诗 其一
1041315,贺尹学士辟经略府
1039101,和春卿学士柳枝词五阕 其五
698217,游无锡小嵩山僧寺 次钱学士先生韵
892106,答燕侍郎谢与端明李学士见过之什
1070295,次韵和颍昌叶翰林 其一 同许学士亢宗干誉汎舟潩水
962399,正伏承泽深佥判学士贤友以正生朝宠贶佳篇辄次元韵 其四
697218,奉寿大学士洪都张公四首
3416,送集贤学士伊阙史少府放归江东觐省
693,饯陈学士还江南同用征字
118812,张耒学士病中
1107623,故翰林彭学士挽歌
691092,己亥中元陪祀山陵道中奉和杨学士先生韵四首
1051856,和范学士韵 其八
923323,刁景纯学士寄示嘉篇述前后过颍游览之乐不鄙虚陋曲蒙推奖感叹不足辄用本韵通成五十仰答来贶
788274,赐大学士王顼龄
119023,次韵文氏外孙骥以其祖父与可学士书卷还谢悰
545387,奉寿大学士洪都张公四首 其二
134354,送齐学士公知荆南
1102771,送程道大归新安兼简宪使卢处道学士四首 其四
649185,呈澹斋少保并诸学士
509043,三茅观与左迁钱学士致仕陈太常宴集分韵 其二 对字
14828,翰林白二十二学士见寄诗一百篇因以答贶
744584,送呈山尊学士乞养归里
1224042,次韵景远学士立春日二首 其二
188829,陪润州裴如晦学士游金山回作
923586,学士院端午帖子二十七首 皇太后阁六首 其一
1213773,观曹娥庙碑同张师道学士赋
1225959,送酸斋学士之西川
509407,暇日与倪学士罗郎中饮萧寺中和李白诗韵二首 其一
731117,病中偶尔问及工部尚书翰林院掌院学士徐元梦乃同学旧翰林康熙十六年以前进士再无一人矣率赋一律以遣闷怀
3853,送集贤学士伊阙史少府敕放归江东觐省
522054,奉饯壶阴学士之南院兼简整庵少宰白楼太常
125346,书局梅圣俞刘仲更二学士讣问继至潸然有感
361647,送李运使学士赴阙十咏
857951,胡则大学士满秩趋京赋诗为赠
201629,和林乔年学士普净院避暑
859522,送文学士倅邛州
955507,和谢希深学士见寄
184166,和胡俛学士红丝桃
905863,和学士秋怀 其二
553145,送玉山汪生起复入国监端明学士状元拱辰公之后也生号冰玉堂就题
158894,病中漫呈师朴学士
953660,吊黄学士三首 其一
789378,以菊花饷恽薇孙学士诗来用渊明自拟作此答之 其三
104483,送刘元忠学士归陈州省亲
789381,以菊花饷恽薇孙学士诗来用渊明自拟作此答之 其六
850311,陈用之学士挽词二首 其二
1145579,暮秋望月示学士各释愁应教
655157,六月二十九日拜命进位尚书适与体斋傅先生年兄同升比承诗示次韵奉复兼柬西涯学士
125341,抒怀上孙侍讲学士
105035,三十二弟寺丞归宣城因寄太守孙学士
1038885,奉酬公素学士见招之作
1040280,送雍子方学士
648014,雪夜胡学士载酒见过剧饮四鼓乃罢明日辱诗次韵奉答
547810,寄吴少溪宫录七十 其六 黄水部便道省觐附候葵阳学士
197052,少卿学士·雕盘琼蕊冰寒凘
377717,四照阁奉陪辩才老师夜坐怀少游学士
1140875,上李承旨学士 其二
554178,次韵胡学士春日陪驾游万岁山十首 其四
689992,和陈彦章见寄用钱学士原韵二首
552428,洪武癸丑九月十八日为外兄集贤大学士张东谷贺八十 其四
650311,冬日扈驾猎龙山同尚书蹇公学士胡公登斗首山佛窟寺偶成十诗奉简 其四
852144,送李野夫兼简公择学士同年
554016,送大学士黄静庵先生拜封归永嘉 其一
679216,题商学士画兰
509438,游云居庵次钱学士韵
215433,送王介学士知湖州
650297,追和学士胡公秋日同陪驾重游太液池 其六
47408,题朱孟章虞学士送别图后
672760,马学士先生有诗贺伯父致仕用韵奉答
964323,用韵赠傅学士兼述怀思古 其三
654698,谨身殿开卷出听传胪次学士李公韵
201644,普净院避暑呈陆子履学士
991385,送陆子履学士通判宿州
1141774,盛庶斋先生初见于维扬程雪楼学士坐中再见练溪学官诗见遗次韵
1114287,和学士秋怀
660608,和石学士予庄韵四首 其一
177791,送密直温学士西京迁葬
126113,同王胜之学士转运赏西园芍药
682238,题张学士閒云馆四首
66407,次韵宋学士见寄
953962,与谢三学士唱和八首 和龙门晓望
1039537,寄西台子渊赵学士
85358,陈伯潜学士以路事来粤相晤感赋
345104,和范子功学士留题二贤堂
697832,题瀛洲学士图
523556,春日寄题崔学士后渠书屋七首 其二
508905,贡院撤棘黄学士以诗见遗步韵以复 其二
650278,奉和学士胡公春日陪驾同游万岁山 其五
1024679,次韵韩伯修学士读楞严见寄
351160,门下王相公南郊谢雪子敏甫学士监礼杨杰有诗次其韵
16033,病中寄白学士拾遗
923590,学士院端午帖子二十七首 皇太后阁六首 其五
936841,寄酬曾学士学宛陵先生体比得书云所寓广教僧舍有陆子泉每对之辄奉怀
532027,董学士父母受封
552425,洪武癸丑九月十八日为外兄集贤大学士张东谷贺八十 其一
923597,学士院端午帖子二十七首 皇帝阁六首 其三
916070,史馆盛学士以诗相贺因而答之
992302,依韵和石昌言学士求鼠须笔之什鼠须鼠尾者前遗君谟今以松管代赠
137977,送谢希深学士北使
689635,洪武癸丑九月十八日为外兄集贤大学士张东谷贺八十
270877,和曹顾庵学士湖舟泛雨
1035531,依韵和长安龙图陈学士登熙熙台之什二首 其一
916333,可久道人之歙州兼简知郡李学士
1043901,灯夕寄呈张学士
1053195,访彭门太守苏子瞻学士
650281,奉和学士胡公春日陪驾同游万岁山 其九
1214913,通集贤全大学士
29062,谒翰林刘学士不遇
1160461,上翰林丁学士
366348,答次道学士
38283,酬蜀国欧阳学士
355173,皇帝郊祀礼毕诣景灵恭谢次履中学士韵
1174552,赠沈学士张歌人
650427,和答庶吉士杨之宜就柬宗豫大学士士奇谕德及翰林诸同志 其三
214347,阙下留别孙丁二学士归旧山
15022,蒙恩转仪曹郎依前充集贤学士举韩潮州自代因寄七言
651036,黄学士以陈叔起所画树石见贻赋此以答之
702434,西涯学士再和东坡雪韵邀予同作四章
905859,和学士秋怀 其六
158976,寄齐州曾子固学士
680251,送李学士归省
1208403,奎章阁学士院照磨林彦广代祀岳镇海渎以诗送之
355174,次韵履中学士宴集英殿
1005968,答刘学士
359525,和李学士试院感秋
103685,读邵不疑学士诗卷杜挺之忽来因出示之且伏高
1131301,太上皇帝圣体清康老母进封信安郡太夫人适斋除敷文阁学士有诗为贺次韵
609181,闲云馆为洪阳学士赋
558824,南还宋工部可葵顾学士东江沈大参东老宋大参樗庵唐藩幕饬轩过访
1057018,和孔毅夫学士题小阁
733985,授职翰林学士感恩述怀
507768,春坊黄学士索赋刘缙草堂二首 其二
166820,次韵学士兄春日谩成
922813,次韵和丹阳裴如晦学士寄示与蔡子直陈述古唱酬五篇 其二
1127532,陈师道教授示黄梅诗次韵呈正夫学士四首
1072186,待潮浙江口寄左与言大夫叶元亮学士兼简吴似之大著
789377,以菊花饷恽薇孙学士诗来用渊明自拟作此答之 其二
361426,寄酬齐州曾巩学士
154159,忆朱子大学士
57806,题安城彭学士山水图
687377,饮许龙石学士园亭短述三首
953513,斋宫尚有残雪思作学士时摄事于此尝有闻莺诗寄原父因而有感四首 其三
18721,对酒吟·一抛学士笔
1167732,奉和圣制送张说上集贤学士赐宴
225721,送凤茶与记室燕学士诗
206494,还何学士诗集
644116,题陶学士遇秦弱兰图
1046062,寄题洋川与可学士公园十七首 其十一 菡萏轩
220786,依韵酬吴安道学士见寄
8729,柏学士茅屋
640805,题子昂学士所书诗后
1164326,中秋陪熙用学士禁中玩月
1188655,奉和圣制送张说上集贤学士赐宴
1072231,次韵建安刘彦冲学士寄茶一首
621210,万茂先斋头得高丽纸一幅乃姜燕及学士使朝鲜归所贻予从陈士业饮过宿茂先因为作画并题其上时朝鲜已为东□所灭
506895,挽胡学士
200884,舟次芜湖却寄维扬刁学士
342530,送陈学士知常州
991148,和司马学士上辛祀事出郊寄冯学士
991148,和司马学士上辛祀事出郊寄冯学士
704015,西湖钱别瞿中书次钱学士韵三首
1224480,送张良卿学士之淮南
577053,拜侍读学士王公达善墓
948835,端明殿学士王日严挽词二首 其一
159046,忧阕还台次韵和道卿学士终丧归集贤旧职见寄
1053550,哭少游学士 其一
622169,以诗言诗送王觉斯学士之南掌院二首 其二
1046056,寄题洋川与可学士公园十七首 其五 涵虚亭
346568,赠至几·淮东学士求新范
509433,游净慈寺次钱学士韵
517432,投胡学士
206669,陪留台李学士筵上赋得文石酒杯分得杯字
1211891,登众妙堂题商学士画雨霁归舟图
588721,冬日介翁宗伯招饮赏菊次韵与甬川俨山二学士内方庶子同赋
953792,送沈学士知常州
906035,次韵学士兄富阳道中
789390,以菊花饷恽薇孙学士诗来用渊明自拟作此答之 其十五
364311,灯夕寄呈张学士
124941,答燕侍郎谢与端明李学士见过之什
1031363,和王学士水车
569085,咏诸功臣像二十六首 其二十五 故光禄大夫柱国少师太子太师吏部尚书华盖殿大学士赠太师张文忠公孚敬
1235285,上京次李学士韵五首
923025,次韵宋次道学士重过礼院
86458,唐诗·瀛洲学士风流远
1056330,次韵呈文潜学士同年
738440,壬午秋日刘圃三学士重过西园喜赋二章仍用见赠韵 其二
134764,齐山诗呈王学士
561693,赞治堂赏莲次席间诸学士韵 其三 太子宾客张公甬川
199170,送陈商学士
506588,题黄学士八世祖宋校理衮告身三道后十二韵
731169,故协办大学士一等武毅谋勇公兆惠
708056,如此江山 其一 送孙屺瞻学士省觐归吴兴。
692295,九日怀黄学士
103355,送吴冲卿学士归蔡州
655153,癸丑春闱忝知贡举试事将毕寄柬李陆二学士 其一
623498,上元夜萧学士老师招饮绿野堂 其二
704077,三茅观与左迁钱学士致仕陈太常宴集分韵 沧字
137923,西湖泛舟呈运使学士张掞
923575,学士院端午帖子二十七首 太皇太后阁六首 其五
206726,赠华山何学士致仕
125157,和杨学士同晏尚书西园对菊
669476,采桑玉堂阴二首答篁墩学士 其二
332799,贺新郎·元夜用顾庵学士韵赠蛟门
779173,意难忘 送曹顾庵学士还武塘，同用高字
863460,次韵和丁学士途中偶作
105230,依韵答泰州王道粹学士见寄
991333,送石昌言学士
892711,送越州陆学士
1051808,皇帝郊丘从驾次履中学士
104538,送陕西提刑陆介夫学士
522176,纶褒晋锡卷赋者甚盛刘紫岩学士序之要予同作
184100,和林乔年学士
192935,次韵和集贤李学士寒食即事之什
939916,送提刑李学士移使东路
1046067,寄题洋川与可学士公园十七首 其十六 野人庐
183395,刁景纯学士寄示嘉篇述前后过颍游览之乐不鄙
159955,奉和府判学士景彝喜雪
894127,季秋侍宴中阙与诸公憩学士院作
923587,学士院端午帖子二十七首 皇太后阁六首 其二
990937,次韵和韩子华内翰于李右丞家移红薇子种学士院
507126,题十八学士四首 其三 书
1226791,寿王学士秋涧七十
