892789,寄沂州王学士
800123,喜湖南诸路大捷和学士李容斋前辈韵二首 其二
514616,周草庭都尉李西涯学士两岁复命同日有诗次韵
1225073,和马伯庸学士拟古宫词七首 其五
498728,斋居对雪次钟石学士韵 其一
1020416,寄昭文馆陈学士
1954,修书院学士奉敕宴梁王宅赋得树字
1049578,送范百禄子功学士知谏院二首 其一
1188956,和吴学士对春雪献韦令公次韵
1170918,梦令狐学士
1159682,同乐天送河南冯尹学士
177276,酬宋湜贾黄中二学士菊花之什兼呈诸厅学士
177276,酬宋湜贾黄中二学士菊花之什兼呈诸厅学士
992463,和江邻几学士画鬼拔河篇
814749,吴素云女士写秋芳图寄其仲兄兰雪法时帆学士见而爱之以曹墨琴夫人手书洛神赋册易去甲寅春日兰雪过吴门属咏其事
117824,雨中陪子瞻同颜复长官送梁焘学士舟行归汶上
1191258,奉和圣制送张说上集贤学士赐宴
1039093,叔平学士知青州
153578,提举刘学士以某论守江之策未行作诗见遗谨次
1146054,建德破后入长安咏秋蓬示辛学士
508907,贡院撤棘黄学士以诗见遗步韵以复 其四
514280,成化癸夘冬至谒陵与李宾之学士联句二十首 其八 早发暂过守备杜都阃
990854,代书寄王道粹学士
1208388,庐江县尹俞器之妻罗恭人节行（罗汉臣学士之女）
809874,饯大学士李光地暂回闽省
903295,贺尤礼侍兼修史侍讲直学士院四首 其二
137428,答子履学士见寄
982358,陈用之学士挽词 其三
1037864,寄子美学士
508742,和内阁李学士赏花诗 其五
211112,寄会稽刁景纯学士
1215426,送渭清远上人谒虞学士求墓志 其五
648639,胡学士山居八景之二首竹坞云林 其一
688739,同顾学士于神乐观赏牡丹次韵
1227144,送侍讲学士邓善之辞官还钱塘十首 其七
211459,宫词·学士经筵论古今
355513,运判学士·相望冰壶江水滨
76332,寄酬曾学士学宛陵先生
1173497,奉留赠集贤院崔于二学士
991096,依韵和宋次道学士紫宸早谒
850306,宋履中学士挽词二首 其一
941615,和祖择之学士袁州庆丰堂十咏 其十
1236199,天冠山同诸学士为祝丹阳赋 鍊丹井
1116934,次韵李公择送新赐龙团与黄学士三绝句
650029,古意寄曾学士二首 其一
905862,和学士秋怀 其三
86413,怀旧·陌上传宣学士声
32475,题汧阳县马跑泉李学士别业
525067,陈鲁南学士自山东寄遁志十绝和之 其四
149562,读水经·蓬莱学士有家声
892293,庆历初召为学士岁馀罢久之出守凡三十年还拜承旨感而成咏
340455,送程道大归新安兼简宪使卢处道学士
130818,至直学士院樊伯撝家
124649,喜仲微学士直右史
302109,虎丘寄吴梅村学士
892668,送张清臣学士省侍金陵
1052277,深父学士示易诗四首某辄和韵 其二
693399,题宋学士祠二首
992424,和石昌言学士官舍十题 其七 蔬畦
808526,宋学士濂
922883,七言二首奉答签判学士 其一
1135049,呈李让臣就寄翰林阎学士
873242,次韵蔡学士岩桂
1172472,雨中自秘书省访王三侍御知早入朝便入集贤侍御任集贤校书及升柏台又与秘阁相对同院张学士亦余特厚故以诗赠之
993054,泰州王学士寄车螯蛤蜊
561651,用韵奉酬俨山甬川二学士同年
1027526,观文殿学士赵公挽词 其六
648186,卧病院中寄黄学士
372672,和春卿学士登广文阁观京阙之盛
954092,奉答子华学士安抚江南见寄之作
1053155,次韵少游学士送龚深之往金陵见王荆公 其四
1883,送东莱王学士无竞
779190,念奴娇 次学士即席韵，兼呈宋荔裳观察、王西樵司勋
1190439,中秋寄杨学士
197080,方学士·方瞳玄鬓粉闱郎
648271,赐游西苑同诸学士作 其四
1141458,送陈彦恂北上兼简李奇卿学士
509406,次韵酬倪学士 其三
1210382,赠商学士德符
1206887,水龙吟 用杨脩甫学士登岳阳楼韵
702327,追和江东之学士留寓南京上新河徐氏园亭之作
863732,赠浚仪朱学士
570586,元驭学士于新观种花挑野菜前后戏呈得十二首 其二
184045,龙图阁学士赠银青光禄大夫滕元发挽辞
324133,寄贺刘美中舍人直学士院
553480,题静庵卷为黄学士乃尊作
1213627,偕翰林学士刘东崖礼部侍郎李两山登悯忠寺阁
589263,和四素黄学士兼呈章岩周中宪 其二
683026,次韵荅徐子容学士见怀三首
896876,邓学士慎思挽词
905852,和学士秋怀 其十三
953658,吊黄学士三首 其三
1214609,寄呈虞伯生学士
1032081,送孙学士两浙转运使兼简杭州知府张侍郎
103461,次韵和司马学士虑囚
539112,王学士元驭留饮花下作
863643,寄状元孙学士
743768,翁覃溪学士为摹砖塔铭赋谢
526166,送费学士南试还朝
1027525,观文殿学士赵公挽词 其四
104371,江邻几沈文通二学士见过
278493,张学士祠·学士清廉侍读宜
278493,张学士祠·学士清廉侍读宜
924877,送刘道原学士归南康
1139622,孤凤篇上静轩阎学士
1236030,揭学士过武康山中十日薛外史江东未至二首
991773,三十二弟寺丞归宣城因寄太守孙学士
569645,贺学士何公弟仲君入史馆
1229560,梅花百咏和冯学士海粟作 其八
545504,大学士赵公手书促驾赋谢二首 其二
514277,成化癸夘冬至谒陵与李宾之学士联句二十首 其五 刘谏议祠旧在学东谈本彝府尹移奉于此
544557,寿大学士赵公二十四韵
515554,四日早听郊戒复陪庙享次韵李宾之学士
581602,吴静观学士挽诗
992846,送张圣民学士知登州
1237558,题李溉之学士湖上诸亭 烟萝境
1165064,饯陈学士还江南同用徵字
159227,次韵和龙图何学士以荣憩乡州有感旧见存之作
655158,甲寅正月四日受誓戒恭陪庙祀和李学士西涯韵
964351,次韵学士重阳雪中见招不赴前后十六首 其五
1049674,召试学士院试罢作
826920,一枝春·藏园以文美斋百花笺徵书。走十七八时侍先学士天津，与其主人焦君相识，此笺初出即供涂抹，晚而南还，箧中尚有一二百番，乡县被兵，一时俱尽，睹物兴怀，咏叹深之
1112319,次韵和石学士见寄十首
916280,寄灵仙观舒职方学士
986069,寄灵仙观舒职方学士
1212417,呈鹏南学士
648721,杨学士乃弟仲宜归建安以道中五景求诗赠之 其五 闽岭停骖
1235484,题集贤全大学士三首
140830,学士院·礼云风断烟
366749,送沈康学士知常州
218167,送芋酥与宿斋三学士
1113527,贺尤礼侍兼修史侍讲直学士院四首
525073,陈鲁南学士自山东寄遁志十绝和之 其十
1130068,次韵少游学士送龚深之往金陵见王荆公
658632,避暑傅氏山庄次陆学士廉伯韵二首 其二
365644,闰月饮集钟山送文芸阁学士廷式假归兼怀陈伯严吏部三立
506886,竹鹤双清图为西杨学士题
655167,奉次屠都宪韵贺篁墩学士领教翰林兼柬西涯学士二首 其一
655167,奉次屠都宪韵贺篁墩学士领教翰林兼柬西涯学士二首 其一
809665,翰林魏学诚该直命大学士陈廷敬出题考得四方无事太平年朕喜其句而偶成四韵
734229,屠牛叹呈张中柱学士
1124778,蔡学士挽词
554221,胡学士山居八咏 其四 玉山泉石
990668,和永叔六篇 其五 和邻几学士桃花
1116891,七言二首奉答签判学士
1051818,奉怀深父学士友兄 其二
954052,吴学士石屏歌
992208,李士元学士守临邛日有谷一茎九穟者数本芝数本莲花连叶并蒂者各一本因赋之
1227138,送侍讲学士邓善之辞官还钱塘十首 其一
980499,至河中首访鬼拔河图有画人云因陆学士移其壁乃毁寸尽令人感慨终日有作
560966,除夕和石潭学士时车驾狩于榆林
1224028,游冈子原呈王学士
261778,沁园春·为卓火传甥题传经堂同曹顾庵学士作
1020882,送安学士守睦州
1224103,赠周景远学士
1039100,和春卿学士柳枝词五阕 其四
893153,车驾出猎和丁学士
103261,和吴冲卿江邻几二学士王景彝舍人秋兴
159274,从猎晚归马上默成奉呈承旨端明王学士
569832,苏子瞻学士初通判杭州过秀州遇乡僧本觉庵文长老赋一诗留赠其后以学士再莅杭过之则文已退院三过之圆寂矣皆有诗志其感慨后四百年太守龚君勉于庵内别构丙舍祀苏公颜之曰三过而悉步其韵一时诸贤和之不佞继焉 其三
569832,苏子瞻学士初通判杭州过秀州遇乡僧本觉庵文长老赋一诗留赠其后以学士再莅杭过之则文已退院三过之圆寂矣皆有诗志其感慨后四百年太守龚君勉于庵内别构丙舍祀苏公颜之曰三过而悉步其韵一时诸贤和之不佞继焉 其三
1171334,荅常学士
363791,雪中过城东仰怀平甫学士
1191320,元日喜闻大礼寄上翰林四学士中书六舍人二十韵
1173838,柏学士茅屋
192998,衢州阮比部学士得假归乡见过陋止留题诗什因
863461,次韵和史馆丁学士赴阙书怀见示
104792,送张圣民学士知登州
48526,己亥中元陪祀山陵道中奉和杨学士先生韵·马头残梦不成酣
1066950,哀范卿学士弟
481772,清明节同高苗二学士扈驾谒山陵次韵
23847,寄令狐学士
1209368,和南质张学士敏之见赠七首 其四
894552,哭公实学士
583180,待隐图次杨邃庵大学士韵八首 其四
125031,送枢直梅学士守并州
660725,送南京张学士先生
138083,子华学士儤直未满遽出馆伴病夫遂当轮宿辄成
588759,院中同龙湖少湖二学士赏红莲 其四
688668,奉诏陪祀谷祗坛西苑游瞩汎舟太液和亭溪学士
214031,酬淮南提刑邵不疑学士
1241569,题赵学士松图　
1196673,奉和武功学士舍人纪赠文懿大师净公
649258,到桃源黄学士舟已先在南岸不得相即相望怅然
570593,元驭学士于新观种花挑野菜前后戏呈得十二首 其九
146531,谢张学士惠灵寿杖
811656,乾隆九年十月重葺翰林院落成车驾临幸赐宴送大学士掌院事鄂尔泰张廷玉进署以张说东壁图书府五律字为韵赋东字音字二首敕诸臣各分一字赋诗
554419,题古木修篁图为黄学士宗豫赋
517870,闻胡学士物故诗以悼之二首 其一
166817,次韵学士兄桐庐道中
893789,再葺流杯亭兼得今翰林胡学士旧记石刻移置坐隅郡人以为宠
1046061,寄题洋川与可学士公园十七首 其十 禊亭
103482,次韵和韩子华内翰於李右丞家移红薇子种学士
379455,次韵韩伯修学士读楞严见寄
185302,题登瀛图·世傅阎公学士图
361255,曾巩学士·乐天当日咏东吴
508794,次韵奉学士钱公原溥
1130062,次韵秦少游学士
1220530,宋枢密权公葬婺源之麓八世孙居都昌者作楼以望其丘陇于千里之外名曰寓思虞学士尝为赋诗今楼已废矣九世孙缉来求余诗赋此
1046052,寄题洋川与可学士公园十七首 其一 湖桥
901329,同刘贡甫学士登石鼓合江亭一首
992905,送河北转运使陈修撰学士
1041150,送李綖学士请示江韩诸君
1227139,送侍讲学士邓善之辞官还钱塘十首 其二
1112302,忧阕还台次韵和道卿学士终丧归集贤旧职见寄二首
310,中书寓直咏雨简褚起居上官学士
1069003,次韵宁徽言学士立春六绝 其四
124830,和待制庞学士寄献宫师相公之作
1190093,奉和圣制送张说上集贤学士赐宴
858999,送赵学士陕西提刑
1226496,虞伯生学士以五诗赠一上人蒙见及一公将归蜀谒赵鲁公次韵二首 其二
1051446,题滑州画舫斋赠李公择学士
509369,挽内阁吕逢原学士
483263,次韵宋学士见寄四首 其一
372753,答丹阳李公素学士
217251,寄薛学士·飞徵偶未下天衢
1045700,和运使学士浣花亭
681164,清明谒陵次杨学士维新韵 其二
697653,雨雪中独坐怀杨学士士奇二首
647539,赠解学士
512360,寿钱学士外舅庄公八十
691194,寄萧玄圃少宰学士
891951,和承旨学士喜资政侍郎休退五绝 其三
1178964,春晚宴两相及礼官丽正殿学士探得风字
201065,翰林夜直·中使传宣学士家
1041676,送邵武张学士
315654,王一宁学士哀挽
482408,送景德辉教授归越中（误刻宋学士）
1039910,次韵程给事同孙觉学士杨宪景略天衣谒禹庙夜归
764029,水调歌头 广陵送李长文学士北还
808529,危学士素
586782,瞻云图为贾学士题
722797,贺新郎 元夜用顾庵学士韵赠蛟门
343625,春后五日即事呈信道中丞致平学士
894520,和答吴充学士见寄长韵
483265,次韵宋学士见寄四首 其三
1041807,送史馆齐学士知荆南唐相映之孙有权文公行修国史制书在
896207,元忠学士八兄耒离京师远蒙追送许惠服丹法托故竟未惠及赋五绝句 其四
1227812,和马伯庸寄袁学士
125101,车驾出猎和丁学士
35223,送德林郎中学士赴东府·掺袂向江头
183870,观文殿大学士刑部尚书赠左仆射兼侍中刘公挽
498797,次张学士水南见赠韵
513017,送朱武选调常德别驾次李西崖学士韵
1215425,送渭清远上人谒虞学士求墓志 其四
192632,元净上人之新安谒李学士兼游庐阜
677557,兴化沈山人逃羁子旧别淮海近十年春杪忽走京师访今学士李公方欣款遘遽复言别作赠之
704012,暇日与倪学士罗郎中饮萧寺中和李白诗韵二首
1046259,送陈成伯学士知湖州
980295,故资政殿学士特赠光禄大夫曾公挽辞二首 其二
692527,胡学士山居六景 芳洲春草
938139,汝州吴学士观我斋分韵得真字
1236503,七月七日同宋显夫学士暨经筵僚属游上京西山纪事二首
693477,闻吴宁庵转南京学士二首
562159,京师雨夜一首呈宋景濂学士王子充侍制兼主事
218099,送郑十学士戬通理越州
123939,寄天休学士
733296,和吴学士梅村送王元照
154204,观复学士·自叹冯唐老
1128278,次韵和颍昌叶翰林 同许学士亢宗干誉汎舟潩水
514281,成化癸夘冬至谒陵与李宾之学士联句二十首 其九 道中
152417,华文阁学士沈持要挽词
1015559,寄广南转运陈学士
34450,寄张学士洎
738175,辞青门学士别业卜居木场巷
1133970,次韵阎学士靖轩赠受益山居二首 其二
1152465,病中闻相府夜宴戏赠集贤卢学士
514279,成化癸夘冬至谒陵与李宾之学士联句二十首 其七 将发
102809,题卢鸿学士堂图
1052667,熙宁丁巳蜡祭致斋玉津东园雪中与监礼莘老学士同游西园 其六
570694,意上人一梓甓婆罗门弃家入道通习三乘援苏学士赠乡僧文老例乞余一言走笔应之 其一
999481,陈伯成学士垂访以病中新浴不克见走书二短篇谢之 其一
870128,故翰林彭学士挽歌 其二
658713,送马良佐学士还南京
215801,题仪真致政孙学士归来亭
1034041,嘉定甲戌孟秋二十有七日起居舍人兼直学士院真德秀上殿直前奏边事不顾忌讳一疏万言援引古今铺陈方略忠谊感激辞章浩瀚诚有补于国家天台戴复古获见此疏伏读再三窃有所感敬效白乐天体以纪其事录于野史
869287,效赵学士体成口号十章献开府太师 其一
195003,顷刘子先学士守姑苏尝寄洞庭春酒得为西湖
6252,太一石鳖崖口潭旧庐招王学士
1035705,谢何学士王专推官王道士同见访
697233,大学士赵公手书促驾赋谢二首
894459,送荆南李学士
508263,赓薛学士诗韵
11242,对酒示申屠学士
922014,吕与叔学士挽词
1195743,鼎臣学士侍郎楚金舍人学士以再伤庭梅诗同垂宠和清绝感叹情致俱深因成四十字陈谢
1195743,鼎臣学士侍郎楚金舍人学士以再伤庭梅诗同垂宠和清绝感叹情致俱深因成四十字陈谢
66185,和曾学士元日遇雪
552426,洪武癸丑九月十八日为外兄集贤大学士张东谷贺八十 其二
788273,赐大学士张鹏翮
1214161,呈伯长袁学士
691415,送陈郎中重使西域次曾学士子棨韵六首
1244777,方学士招饮不赴
516258,李程二学士被命教庶吉士唐大夫有作奉柬予次其韵
57091,寄华鸿山学士
1038607,次韵酬潭州周沆学士见寄
192936,次韵和翰林师学士赠伦上人新居之什
105368,夏日陪提刑彭学士登周襄王故城
674413,寿顾处士次陈子雨学士韵
525845,徐学士子容薜荔园十二首 其十一 花源
355197,范学士韵·南阳虽好远江干
175927,次韵蔡学士梅诗
483266,次韵宋学士见寄四首 其四
124693,西湖席上呈张学士
1224041,次韵景远学士立春日二首 其一
509431,西湖钱别瞿中书次钱学士韵三首 其二
137415,吊黄学士·自古兰衰早
1245584,送张月梅游江浙拜袁伯长学士
202147,汝州王学士射弓行
169480,寄徐吉父学士
893086,寄天休学士
702435,廉伯学士家赏盆梅限韵
648472,鬼谷圮桥东山云房四图为金学士题 其三
62659,奉和胡学士侍游万岁山
789382,以菊花饷恽薇孙学士诗来用渊明自拟作此答之 其七
941618,和祖择之学士袁州庆丰堂十咏 其六
922812,次韵和丹阳裴如晦学士寄示与蔡子直陈述古唱酬五篇 其一
992039,次韵和司马君实同钱君倚二学士见过
642058,和高学士贺庆成诗二十韵
1188824,出京别崔学士
621654,姚孟长学士谬相奖掖感而有言
424064,沁园春·江心文信国公祠，感明季钱希声学士题词事
1081958,某蒙学士兄相要陪赏芍药花多白者月色相射光彩映发殆玉盘盂之苗裔耶维心有诗辄次其韵
137829,送胡学士知湖州
416436,凤皇台上忆吹箫    和晁学士
383659,九月十三夜扈从功德寺陪李渐庵大司寇王忠铭徐检庵二学士登金山对月
1051852,和范学士韵 其四
204599,送通判学士归南国
564813,题吴学士先生白楼三首 其三
372742,和邃卿学士霁登秘阁
337782,有怀·金莲学士起持衡
999981,病中漫呈师朴学士
849870,跋林学士宋卿帖
1207168,临江仙 次解东庵学士咏梅韵
1039821,送李运使学士赴阙十咏 其六
1219514,虞学士小像，为其侄孙堪题二首 其一
109499,杨十七应之兄学士挽辞
347625,和李文叔寄虢州孙元忠学士
1152150,奉和圣制送张说上集贤院学士赐宴得筵字
60252,扈从再狩武冈次学士胡公韵
514411,三月十七日原博谕德饯汝玉给事于玉延亭会者宾之学士于乔谕德济之世贤侍讲曰川校书道亨编修暨予得联句四章时黄蔷薇盛开复移尊于海月庵酹花酌别又得三章予亦将有饯约而觞汝玉者多刻日有次第不能夺也手录此以致缱绻不已之意 其二
1049040,韩敏之学士贰少府往拜凡三而未觏因致以诗
373486,和丹阳公素学士晚望见怀
972975,贺周待制兼直学士院
905855,和学士秋怀 其十
896209,元忠学士八兄耒离京师远蒙追送许惠服丹法托故竟未惠及赋五绝句 其五
270665,满江红·拾瑶亭中秋宴集，再次顾庵学士韵
1131172,观文殿学士赵公挽词
137368,和武平学士岁晚禁直书怀五言二十韵
104970,钱君倚学士日本刀
664027,奉送石门翟学士典文北上
509430,西湖钱别瞿中书次钱学士韵三首 其一
480248,己亥中元陪祀山陵道中奉和杨学士先生韵四首 其四
1236047,和鲁子翚学士见寄诗韵二首
354490,时在集英幕中呈诸公学士
1143993,次韵阎学士靖轩赠受益山居二首
623502,学士萧老师招陈明府道见刘文学章甫朱孝廉瑞徵游对江九莲庵分赋 其二
193182,路学士知河中府
1236468,挽袁伯长学士诗稿曾蒙题跋
342564,寄子美学士
649065,次韵荅耐轩学士病中见寄
561650,俨山学士以漆镂八仙盘见赠并侑以诗用韵奉谢
922987,龙图阁学士赠银青光禄大夫滕元发挽辞二首 其一
918103,挽侍读龙图学士周公
159301,次韵和侍读梅学士秋雪
1039825,送李运使学士赴阙十咏 其十
648187,冬至早朝遇雪和胡学士韵
1019347,送通判学士归南国
175313,次韵方学士万卷楼
991324,送王景彝学士使虏
159360,和答吴充学士见寄长韵
652257,内阁用唐人韵简徐李许三学士
863494,和庐州通判李学士见寄 其一
224316,孤凤篇上静轩阎学士
916101,次韵和守邦道人寄编修诸学士之什
508838,刘主静学士题墨梅见寄因次其韵以复四首 其二
1039822,送李运使学士赴阙十咏 其七
347623,次韵和裴士杰库部对棋上贡父学士
4413,奉和圣制送张说上集贤学士赐宴
830638,赠翰林周学士寿昌
1202681,满江红 寿张良卿学士
891950,和承旨学士喜资政侍郎休退五绝 其二
661039,次韵荅吴石楼学士 其一
698293,和内阁李学士赏花诗
104954,送次道学士知太平州因寄曾子固
922815,次韵和丹阳裴如晦学士寄示与蔡子直陈述古唱酬五篇 其三
335234,某蒙学士兄相要陪赏芍药花多白者月色相射光彩映发殆玉盘盂之苗裔耶维心有诗辄次其韵
1112280,送两浙转运道卿学士二首
585817,郁林守邝和仲乃元博宪副之犹子而吾友松溪程学士之徒也谬称予为师祖持松溪赠良守诗访天关予喜其贤而赓之云
342631,送集贤李学士赴荆台
581767,挽程太夫人学士克勤母也
893075,送胡学士赴益州漕
686351,秋日杂兴和程学士克勤韵
1229558,梅花百咏和冯学士海粟作 其六
715430,王学士亦经屈沱作诗予复和之 其一
156543,怀湘南旧游寄起居刘学士
1116455,走笔次韵黄观复学士二首
814294,题查声山学士花溪石漾图
202622,学士·儒林学海老宗师
124028,寄沂州王学士
342541,集贤石学士出守符离
691407,寄胡学士光太二首
1131131,和春卿学士柳枝词五阕
1093089,次韵喻学士
905857,和学士秋怀 其八
175315,次韵蔡学士岩桂
514284,成化癸夘冬至谒陵与李宾之学士联句二十首 其十二 晚眺
706077,刘端星学士昭州初度时初出诏狱
953734,奉寄襄阳张学士兄
588756,院中同龙湖少湖二学士赏红莲 其一
583333,同李容正夏景升谒包孝肃祠次马紫崖学士韵祠在庐州城外濠中
869286,效赵学士体成口号十章献开府太师 其十
923593,学士院端午帖子二十七首 皇太妃阁五首 其四
1041147,以近文投谢学士
525838,徐学士子容薜荔园十二首 其一 思乐堂
1156193,和集贤刘学士早朝作
514416,三月十七日原博谕德饯汝玉给事于玉延亭会者宾之学士于乔谕德济之世贤侍讲曰川校书道亨编修暨予得联句四章时黄蔷薇盛开复移尊于海月庵酹花酌别又得三章予亦将有饯约而觞汝玉者多刻日有次第不能夺也手录此以致缱绻不已之意 其七
183850,送沈学士守毗陵
75073,七月七日同宋显夫学士
1039106,和春卿学士登广文阁观京阙之盛
227429,送杨学士益州路转运
124984,送杨学士·觚棱初日九天开
586020,燕城除夕呈同年方西樵学士
87562,感旧七绝句·学士朋来似堵墙
166024,游栖岩寺呈提刑学士毅夫兄
702136,福建长乐柯生乔可尚迁博学士也斋戒三日尽弃其学而请学焉喜而与之诗二首
1158375,送德林郎中学士赴东府
1072281,再用韵寄沈次律学士
545977,蚤春寄怀大学士赵公三十韵
992829,送吴冲卿学士归蔡州
509405,次韵酬倪学士 其二
1205862,翰苑荐为应奉文字二十韵谢大司徒并呈诸学士
735453,寄朱学士沧起先生
222263,遂转运梅学士巡边郡
125152,和季长学士绵汉道中作
150107,次韵和马子虚学士感事见赠
1219268,次韵虞学士赠赵伯容
762821,贺圣朝 西江送富云麓学士入都
1069001,次韵宁徽言学士立春六绝 其二
650551,内阁新成次大学士胡公韵 其四
939948,寄文潜无咎少游三学士
1227807,上京次伯庸学士韵二首 其二
1222788,次袁学士上都诗韵
193250,冬夕与诸公宴集贤梅学士西斋分得今夕何夕探
1156079,初到江州寄翰林张李杜三学士
799827,寄李厚庵学士
1032017,中秋与柳赞善开宗赞善坦寇学士准宿宋拾遗白宅不见月
350050,送家立庵学士册封安南
161256,春社日寄李学士
894225,送总阁学士守秦亭二首 其二
507848,送陈郎中重使西域次曾学士子棨韵六首 其一
509408,暇日与倪学士罗郎中饮萧寺中和李白诗韵二首 其二
992927,送祖择之学士北使
206493,寄陈越学士·损之不见数年馀
335774,窃闻子瞻学士昨日飘然单乘独出南屏旋至北山
5847,答史馆张学士段柳庶子学士集贤院看花见寄兼呈柳学士
5847,答史馆张学士段柳庶子学士集贤院看花见寄兼呈柳学士
5847,答史馆张学士段柳庶子学士集贤院看花见寄兼呈柳学士
1214324,次韵子昂学士人日立春赵诗 其二
905864,和学士秋怀 其一
528840,题李蒲汀学士所藏赵千里射熊图
1216470,集贤学士喀尔喀册奉旨代祭真定路玉华宫仆备鉴礼
697649,次韵胡学士春日陪驾游万岁山十首
508743,和内阁李学士赏花诗 其六
981223,和宋子京召还学士院 其一
702109,于席学士院池观莲宴集和张亭溪詹事二首兼呈同会诸公
354494,范学士韵·起照青铜已鬓斑
1051884,执中学士以蔬菜见贶戏寄小诗
570615,周三俊郎时诵道书辞其舅学士公游南太学得绝句二首 其二
964353,次韵学士重阳雪中见招不赴前后十六首 其三
554554,闻杨学士士奇卧病赋诗寄简十首 其二
509522,送钱学士 其一
684248,和玉溪学士斋夕有感韵二首
554353,次韵胡学士内阁新成四首 其一
1209366,和南质张学士敏之见赠七首 其二
185917,太平兴国七年季冬大雪赐学士
712420,送刘虚舟孝廉北上柬史耕岩学士
558230,送秦主事还南京兼柬王学士 其二
863566,送牛学士知润州
1117086,次韵张耒学士病中二首
35188,送程德琳郎中学士
554227,雨雪中独坐怀杨学士士奇二首 其二
870451,寄宋准学士
554561,闻杨学士士奇卧病赋诗寄简十首 其九
992012,早夏陪知府学士登叠嶂楼
131664,答直学士院见访
159186,季秋侍宴中阙与诸公憩学士院作
205193,谢鲍学士惠腊茶
999755,依韵奉和王平甫学士寄元内翰诗
1038488,走笔答原甫提刑学士
335224,次韵学士兄见一亭
1159563,逢王十二学士入翰林因以诗赠
