1078024,立春日龙化道中得家问诸季已挈家渡浙江如剑川又闻江西颇有群盗啸聚遂决意由五羊趋循惠潮阳假道闽中以归偶成三篇时十二月十九日 其二
948543,去年孙从之示玉蕊佳篇时过未敢赓和今年此花盛开辄次严韵并以新刻辨证为献
1114033,立春日龙化道中得家问诸季已挈家渡浙江如剑川又闻江西颇有群盗啸聚遂决意由五羊趋循惠潮阳假道闽中以归偶成三篇时十二月十九日
1190617,奉和峡州孙舍人肇荆南重围中寄诸朝士二篇时李常侍洵严谏议龟李起居殷衡李郎中冉皆有继和余久有是债今至湖南方暇牵课 其一
594493,御史大夫姑苏袁公新拜春官宗伯赋上贺篇时余南还
31245,奉和峡州孙舍人肇荆南重围中寄诸朝士二篇时·征途安敢更迁延
158193,短篇·时情逐势饵边鱼
133407,去夏孙从之示玉蕊佳篇时
152362,去年孙从之示玉蕊佳篇时过未敢赓和今年此花
1190618,奉和峡州孙舍人肇荆南重围中寄诸朝士二篇时李常侍洵严谏议龟李起居殷衡李郎中冉皆有继和余久有是债今至湖南方暇牵课 其二
262980,佛慈篇时在民国三十三年秋
1078025,立春日龙化道中得家问诸季已挈家渡浙江如剑川又闻江西颇有群盗啸聚遂决意由五羊趋循惠潮阳假道闽中以归偶成三篇时十二月十九日 其三
840080,佛慈篇，时在民国三十三年秋
1078023,立春日龙化道中得家问诸季已挈家渡浙江如剑川又闻江西颇有群盗啸聚遂决意由五羊趋循惠潮阳假道闽中以归偶成三篇时十二月十九日 其一
1195431,奉和峡州孙舍人肇荆南重围中寄诸朝士二篇时李常侍洵严谏议龟李起居殷衡李郎中冉皆有继和余久有是债今至湖南方暇牵课
31244,奉和峡州孙舍人肇荆南重围中寄诸朝士二篇时
190716,午梦·篇时才欠急忙偿
