523840,送陈宪使淮上兵备
533164,陈宪使少岩之西越附寄舍弟书
1239681,赠陈宪史之福建
698620,送陈宪章
574858,答陈宪使文鸣过访不遇
648582,题陈宪虎
515906,题陈宪副湖山一览诗后
533898,答陈宪使道襄永平见寄
581526,谢胡方伯大声陈宪长希冉作同年会于张东所小西湖上次东所韵 其一
581908,岁晏偶怀陈宪长金丹之谈赋此遣兴
55255,赠陈宪史之福建
614180,同区季誉林阳仲过陈宪副东皋别业留题得十四韵
582917,上分巡陈宪佥
554910,代陈宪副赠原都宪用祁主事韵
498731,送陈宪卿进士使长沙
554931,和丁石崖太守赠箕阳陈宪副致政诗六首 其三
690852,挽陈宪副
924831,临川陈宪大夫挽词二首 其一
1051532,临川陈宪大夫挽词二首 其二
526920,次韵陈宪副归田
516049,东归至清平陈宪副王都阃相与遣使迎劳用祁石阡韵奉谢
924222,寄题陈宪郎中竹轩
648583,题陈宪龙
554932,和丁石崖太守赠箕阳陈宪副致政诗六首 其四
648701,题陈宪山水
1137297,临江仙 和陈宪使韵
542461,北望有感寄梁公济陈宪卿张子畏万言卿四职方
649305,题画鱼赠陈宪南归
554929,和丁石崖太守赠箕阳陈宪副致政诗六首 其一
613694,留别卢一清次陈宪副韵
613301,苦雨柬陈宪副吴山人
613961,同梁山人过访陈宪副有赠
581527,谢胡方伯大声陈宪长希冉作同年会于张东所小西湖上次东所韵 其二
693366,春日病中遣怀呈陈宪长二首
594908,花朝陈宪副锦侍堂社集
487723,同郑观察郑明府泛舟徐潭兼送陈宪副之浙中
653265,和陈宪副扫墓诗
637672,次陈宪副五十六韵述其历履并近日朝京往返之概而期勉于篇末云
118219,寄题陈宪郎中竹轩
554930,和丁石崖太守赠箕阳陈宪副致政诗六首 其二
901355,和陈宪章蜡梅
581965,奉和陈宪长吉夫二首 其二
583682,送陈宪副入觐
581964,奉和陈宪长吉夫二首 其一
582013,弘治甲子陈宪长吉夫入觐时予按保宁送之郊即别去赋此寄之
613828,挽陈宪副 其一
118315,临川陈宪大夫挽词
581961,春日病中遣怀呈陈宪长二首 其二
554934,和丁石崖太守赠箕阳陈宪副致政诗六首 其六
689598,谢胡方伯大声陈宪长希冉作同年会于张东所小西湖上次东所韵
581960,春日病中遣怀呈陈宪长二首 其一
593519,寄陈宪副于韶
613379,陈宪副招同吴非熊集大云寺，分得怀字
51205,题陈宪副卖书图后
637588,雪梅为陈宪副题
576525,赠陈宪使还嘉兴
479108,题陈宪副卖书图后
558752,和陈宪副归田诗
478202,送陈宪章 其二
583371,中秋同石太仆允升陈省参宗之陈宪佥裕夫赵都阃德州舟中玩月次许郢州韵
637368,次陈宪副粹之见寄
648933,送陈斌副使之陜西兼柬陈宪使于副使
488075,白沙谒陈宪副墓
554933,和丁石崖太守赠箕阳陈宪副致政诗六首 其五
163732,广漠亭二首和陈宪益之旧韵
651035,题陈叔起画为陈宪章赋
613829,挽陈宪副 其二
640923,哭陈宪使
693368,奉和陈宪长吉夫二首
648912,题陈宪山水
944453,名陈宪友清轩
48254,送陈宪章
1117063,临川陈宪大夫挽词二首
648711,题陈宪章巡检山水
529287,五月十八日代州筹边堂同陈宪副汝正大阅诸生因赠汝正
637669,游庐山开先寺和陈宪长韵
513449,题陈宪章梅花
1127999,广漠亭二首和陈宪益之旧韵
876561,广漠亭二首和陈宪益之旧韵 其二
582120,奉和陈宪长先生来韵
233236,和陈宪车蜡梅
240168,名陈宪友清轩
518687,和季广陈宪副阳朔题壁
627934,题赠陈宪副白主新筑
1003995,广漠亭二首和陈宪益之旧韵 其一
478201,送陈宪章 其一
551335,送陈宪伯入觐便道归省
530073,环溪钓处为陈宪佥题
701338,和丁石崖太守赠箕阳陈宪副致政诗六首
581911,同前奉和陈宪长韵
593481,送陈宪副道襄备兵天雄
