985679,花头巡检先君纪之详矣孝女乡女子骑虎以救亲今汝滩下有孝女石即其处也乡之得名以此然则汝滩旧名女滩米坑旧名女坑皆当仍旧不可改也吾乡有此二事宜庙而祭之以表励风俗因成一绝道余所志云
483521,乡人徐仲瑜见访谈其曾至上方峰所见之详因有失机之憾
522027,三山廖彦正往以新喻司训同校文南都秩满升吉安推官来别得备闻兵兴以来故人行事消息之详且出示其尊人德翁遗像及诸名人题咏临觞永叹赠以是诗
1079800,次韵季叔友贺尧明登第叔友丹阳人也本中得其人之详于王尧明恨未之识也尧明擢第叔友作诗贺之尧明令继作既喜叔友能不妄许可又嘉尧明进退取舍皆中乎道也三首 其二
1109966,次韵季叔友贺尧明登第叔友丹阳人也本中得其人之详于王尧明恨未之识也尧明擢第叔友作诗贺之尧明令继作既喜叔友能不妄许可又嘉尧明进退取舍皆中乎道也三首
52961,乡人徐仲瑜见访谈其曾至上方峰所见之详因有
135304,次韵雷知院观音诗因叙家中铜像之详
1028054,次韵雷知院观音诗因叙家中铜像之详
973764,仆自北门放舟过溥子而告行坐间出示上蔡景迂两先生墨帖具道先世契之详益重其别为成是诗
1079799,次韵季叔友贺尧明登第叔友丹阳人也本中得其人之详于王尧明恨未之识也尧明擢第叔友作诗贺之尧明令继作既喜叔友能不妄许可又嘉尧明进退取舍皆中乎道也三首 其一
777318,台郡红毛楼在县治之左旧址犹存闻密室之下有地道通安平未之详也楼半倾坏房室幽奥久封尘土人踪罕到登览一周用成七律
1079801,次韵季叔友贺尧明登第叔友丹阳人也本中得其人之详于王尧明恨未之识也尧明擢第叔友作诗贺之尧明令继作既喜叔友能不妄许可又嘉尧明进退取舍皆中乎道也三首 其三
219609,花头巡检先君纪之详矣孝妇乡妇子骑虎以救亲
