67353,送少司成朱文石之金陵
292939,由羊石之新会舟中
744811,翁海村见过出示近著并悉金石之富
711093,霍山古循之仙洞雷江东去数十里望之如奇云巫进隐居其下皆称泉石之胜诗以先订 其二
958389,石季平题李南画石之傍曰叠石为山已是一重公案况画者耶郑子见而笑之明日戏成伽佗问随缘云随缘居士即季平道号也
1061665,建炎己酉冬自婺女携家至临海岁首泛舟憩天柱精舍谒吴君文叟山林感泉石之胜叹城邑之人沈酣势利不知山中之乐也
901984,昔柳柳州作永州山水诸记泉石之状如在目前兹峡上群山与柳州之文颇类
44231,周雪盦乞题浮岚作雨石供为九云石之一
820753,壶中天 逊园小集，观所供盆石，云阻风夔门时所得，或鱼复阵石之遗。为填此解
818502,周雪盦乞题浮岚作雨石供为九云石之一
109272,元石·卷石之中有道存
1033323,王和甫主簿卜地改葬双亲一夕梦到一处风水佳甚及到雁荡罗汉寺后山宛如梦中所见及造圹众石之中独有一穴仅可容双棺孝感如此
1070739,子猷知府给事宠寄道中阻雨之什忧时悯农有古良二千石之风感叹次韵 其一
858422,送陈景初金陵持服举族贫病烦君药石之功
635519,再续前题备述园林花石之胜兼送领军入觐
958424,邻翁以紫石斛承粗石一块为予书室之奉斛盖端溪之不堪为砚者然较以所载山石则胜矣予是以有白鹿苍璧之句白鹿苍璧事见西汉书若乃忘真假遗美恶则予不知此石之与真山果同异哉
626743,代端州张太守送梁叠石之定安广文任
459264,献冲访许间夕老师不遇，余语频老师初识者，邀宿其家。次日即登连云，暮归而其祖母卒，甚难为怀。此诗书于溪石之背，石在连云小学侧，八六年予始游，亦坐此石作诗也
475546,送少司成朱文石之金陵
921990,王晋卿示诗，欲夺海石，钱穆父、王仲至、蒋颖叔皆次韵。穆、至二公以为不可许，独颖叔不然。今日颖叔见访，亲睹此石之妙，遂悔前语。仆以为晋卿
521383,御医杨信之故宅在玉河东涯有花竹山石之胜时行借居有作次韵
587792,送伦穗石之留都
1210641,子阳李兄与余家交三世矣故于初颇相爱念子阳才疏意广不屑细务且知时命未偶因放浪于诗酒泉石之间尝自赵抵淇由洛阳登华山至长安而还得诗文二十馀篇皆名公投赠之什也至元十一年初以事来镇阳得遂披读敬书五十六字以发挥吾子阳襟期之梗槩云
178787,昔柳柳州作永州山水诸记泉石之状如在目前兹
233687,次韵陈景斋纠掾题品山斋数石之作
588209,送伦穗石之留都
564937,送许龙石之南少宰
1078232,宿开平寺去剑浦二十里有泉石之胜曩与郡守谢德夫同游今一纪矣溪山草木依然住持犹旧人也感叹有作二首 其二
216316,送陈景初金陵持服举族贫病烦君药石之功
978470,次韵陈景斋纠掾题品山斋数石之作
721193,霍山古循之仙洞雷江东去数十里望之如奇云巫进隐居其下皆称泉石之胜诗以先订
445712,传信豫章胡邓李陶诸君子见过恰直邑中诗友泉石之约
181709,石季平题李南画石之傍日叠石为山已是一重公
273718,淡黄柳·尹默喜白石此词音节谐婉，倚声调之，亦如白石之调张仲远也
1113982,宿开平寺去剑浦二十里有泉石之胜曩与郡守谢德夫同游今一纪矣溪山草木依然住持犹旧人也感叹有作二首
588327,送伦穗石之留都
711092,霍山古循之仙洞雷江东去数十里望之如奇云巫进隐居其下皆称泉石之胜诗以先订 其一
969949,挈家来游饫山林之美款泉石之胜引睇莆阳扁画因慨思关河鼎沸版图之归无期当有任其咎者
333465,宿开平寺去剑浦二十里有泉石之胜曩与郡守谢德夫同游
772725,和伯卿庭石之作
258173,拳秀峰·平滑石之俗
1085473,郡斋旧有假山暇日命工葺之取石之嵌者繂置山顶汲水筒竹引而激之自顶而下有悬崖飞瀑之状予既以萧洒名斋因镌二字于石戏成古风
1113882,子猷知府给事宠寄道中阻雨之什忧时悯农有古良二千石之风感叹次韵
1078231,宿开平寺去剑浦二十里有泉石之胜曩与郡守谢德夫同游今一纪矣溪山草木依然住持犹旧人也感叹有作二首 其一
256167,巨石之变
139906,格斋·水非石之鑽
412897,由羊石之新会舟中
539183,兵宪王君阳德数过弇山园颇述泉石之美走笔奉寄
1070740,子猷知府给事宠寄道中阻雨之什忧时悯农有古良二千石之风感叹次韵 其二
569044,游摄山栖霞寺颇得泉石之胜因访明征君僧绍故址读江令诸篇遂效其体
920304,二月十六日，与张、李二君游南溪，醉后，相与解衣濯足，因咏韩公《山石》之篇，慨然知其所以乐而忘其在数百年之外也。次其韵
625551,送同年郑沙石之开建广文任
277330,陆子兴为其尊人云峰先生营葬京师阜成门外既成求为刻石之词作此与之
1038709,兴州长举县西二十里阁道立表曰飞石阁告往来者急度勿停予赴益部兴州将吏来迎皆至长举因访老吏飞石之状云昔尝有之亦飘风暴雨之时也予望山顶皆已垦耕而行人熟虚名至是皆驰过因成一绝
821089,淡黄柳 尹默喜白石此词音节谐婉，倚声调之，亦如白石之调张仲远也
1181532,古石之歌
289910,壶中天·逊园小集，观所供盆石，云阻风夔门时所得，或鱼复阵石之遗。为填此解
