510473,次韵顾别驾留宿碧玉楼 其五
187452,访李兴伯不遇其家人命二子留宿有古人截发撤
1248986,十七日过与之洛涧山庄留宿复大雪作及明起视户外岩岫如玉琢削竹树压倒径无行踪飘瞥竟日至暮未已雪深尺馀赋诗留别
133797,南园饮罢留宿诘朝呈鲜于子骏尧夫彝叟兄弟
1207624,宝粹二上人值雨留宿西涧草堂明日赋此以赠
1068959,绍兴已未七月六日被旨祷雨风水洞七日清晨诣祠下是晚大雨通夕留宿慈严寺中八日始还城
114003,同刘景文游郭氏西园因留宿
46763,张山人见访留宿草堂
174280,到巴川县日炽不可行遂留宿用明复留题韵
732542,康小范彭燕又秦汝翼近修师同盟诸子集家仲草堂汝翼与师留宿西轩谈越州事竟夕 其二
527927,寺僧留宿
510472,次韵顾别驾留宿碧玉楼 其四
792983,过刘墩留宿即席赠内兄兼寄赵甥恒
57759,宝粹二上人值两留宿西涧草堂明日赋此以赠
502204,过瑶溪访俞敬道不遇因留宿是时敬道有金陵经商之行
709248,丁亥初春重游甘竹中途留宿岑六
346822,三月十一夜仲退留宿山中即景赋诗次韵
996342,三月乙巳来赋盐万岁乡且蒐狝匿赋之家晏饭此舍遂留宿是日大风自采菊苗荐汤饼二首 其二
48489,黄土道中李员外同年留宿
646163,雨中留宿息耘轩话旧
286245,留宿梅子坞
621099,同顾修远访周仲驭焦山留宿时以茂先遗书为乞志铭
485239,金征士玟雨中见过留宿二首 其一
652793,九月十日雨中访徐校理留宿
611917,乙卯闰中秋同林愚庵钟柱明族兄玉宇集袁伯益江上园亭泛舟弄月醉后留宿时呼琵琶伎不至但雅歌清谈而已　五首 其五
700301,六月十日过分水王主事舜夫留宿明日以十绝句追送次韵答之
785240,至双峰寺留宿 其三
233506,奉檄往哭象山复会葬及归自金溪留宿本县仙乐
626253,门人何乃图过访留宿赋赠
932409,饮伯山家因留宿
286212,留宿陈卫瞻易安书室口占以赠
784511,冬夜留宿虚壑精舍暨朱抱光陈行一讲易图夜分抱光援琴弹碧天秋思雉朝飞诸曲行一起复为我剑舞二十四变烛见跋寒月瑩然而霜鸡已再唱矣
532634,内兄来自松江留宿鸡鸣山舍
2967,喜祖三至留宿
613671,访邱宗上人留宿
615787,夏日黎君献黄逢永邓升仲见过池亭留宿夜谈
544277,夜集王将军园亭留宿斋头二首 其二
1069879,予同彦老自四明之永嘉中道留宿岳林会法照海印二禅伯夜话投晓登车乃行留题于寺三首 其三
589771,刈稻过山家留宿夜闻雨声旦视花片满涧疑异境也题诗壁间以志来约
370942,台城路·留宿张龙威艺舫同话丁卯旧游有感用前韵
917807,奉檄往哭象山复会葬及归自金溪留宿本县仙乐观归而作是诗 其二
772079,偕友登栖云岩留宿
486185,宝粹二上人值两留宿西涧草堂明日赋此以赠（治）
1113552,之仪家当涂七年矣屡过禅岳山下望高山塔欲一游辄不果异时山主勤公大师与其子宣上人相过因往报之取路回远薄晚方到遂留宿栋宇一新舍次皆得其便而宏丽高朗唯见者知焉又复规范齐肃钟鼓应接问之乃勤一力所就丝蓄粒聚未尝毫发资之人此尤难者感叹不已因赋二小诗
562281,杨鸣鹤顾留宿殳山有诗相示用韵荅之
3240,答王维留宿
114079,薛乐道自南阳来入都留宿会饮作诗饯行
332446,行香子·春日过中山雪海留宿唐城
282798,久别静茶，重访，留宿
1207044,黄尊师高轩观鹅因留宿
1103961,三月十一夜仲退留宿山中即景赋诗次韵
17656,喜友至留宿
830320,朱二子涵留宿寓斋得诗四首 其三
130756,谢前人留宿饮食
926660,访南园张氏昆仲因而留宿
55201,圌山朱都尉过访留宿草堂中夜不寐情见乎词
330072,大观四年二月二日自采石过藏云取路回远少憩已入夜遂留宿明日
626862,南阳姚菊里过访草堂留宿
286225,正月十有四日桐公至自普陀因同藏上人留宿萧斋分赋得分字
997330,薛乐道自南阳来入都留宿会饮作诗饯行
544276,夜集王将军园亭留宿斋头二首 其一
520346,予经山寺爱其幽雅因留宿焉昔人所谓天下名山僧占多者信然哉所惜者世无金山长老而吾带盖不足留聊成一诗以自适云
711095,暮春同叶秀翀欧伯梁族叔游罗浮至乌坭塘日晡访孔唐之不值留宿园林
707875,行香子 其二 春日过中山雪海留宿唐城
603087,元夕过黄隐君言甫宅访康茂才思魏赏灯醉饮留宿
47185,金征士玟雨中见过留宿
523522,徐子过别因而留宿
830321,朱二子涵留宿寓斋得诗四首 其四
800749,竹垞先生留宿枫桥慧庆寺夜话追悼陆文孙
624970,留宿丹霞
1069877,予同彦老自四明之永嘉中道留宿岳林会法照海印二禅伯夜话投晓登车乃行留题于寺三首 其一
533184,雨中留宿张幼千家 其一
286240,留宿友人易安书屋
1211544,偕赵逢吉避暑石头城日暮余归逢吉留宿山中次日寄逢吉并长老圭白岩
569762,余以己巳正月渡江访会家弟于天界寺雪阻五宿今年腊月寺僧访余昙阳庵留宿雪复大作因成一律寄之
637975,挥使安廷用访榄山留宿兼惠纸并猪榧子
641879,清明前二日林泉过予西郊留宿草堂晚步赋诗因次其韵
385155,十月五日出城暮归门阖留宿南濠王氏楼与履约昆仲夜话有作
784366,留宿陈卫瞻易安书室口占以赠 其一
634868,省英卓今病因留宿旅舍经旬临别赋此 其二
785241,至双峰寺留宿 其四
267197,有事至寨门过访严竹坪表兄快谈心曲承留宿书斋拈此遗赠
1217916,乙酉二月十六日偕杨贯道谒张贞居外史留宿南山登善庵明旦以诗奉别
679904,寒夜留宿故人隐处
367257,予同彦老自四明之永嘉中道留宿岳林
807788,沁园春  薛国符方伯招饮留宿园亭
1250280,太平观灵枢堂有轩临池扁曰山水间因访曾鍊师留宿赋之
522218,六月十日过分水王主事舜夫留宿明日以十绝句追送次韵答之 其三
1003792,自船庄过化城留宿翌旦炷香宣石桥卯塔
709851,困酒入诃林留宿自公房
1044237,君实南园饮罢留宿二首 其二
830319,朱二子涵留宿寓斋得诗四首 其二
676367,四山往教河阳留宿草堂赋此赠别
522217,六月十日过分水王主事舜夫留宿明日以十绝句追送次韵答之 其二
1055627,之仪家当涂七年矣屡过禅岳山下望高山塔欲一游辄不果异时山主勤公大师与其子宣上人相过因往报之取路回远薄晚方到遂留宿栋宇一新舍次皆得其便而宏丽高朗唯见者知焉又复规范齐肃钟鼓应接问之乃勤一力所就丝蓄粒聚未尝毫发资之人此尤难者感叹不已因赋二小诗 其二
966087,绍兴壬子六月先公再被掖垣之命某时侍行自清江登舟经祖印江口趋行在所未几罢归还憩丰城之龙泽寺明年初夏归隐南山己巳岁予偶游祖印留宿寺僧惠嵩能道昔寓龙泽之梗概两寺相望盖五十里时先公没十有二年矣予亦衰病投绂俯仰悲慨因成两诗以遗嵩 其二
515382,九月廿八日黄司训汝彝雨中留宿联句二首 其一
174536,留宿田家·迟落前溪水
1248295,允中留宿山斋已而复往令弟允升宅明日赋诗谢之
1193108,吴明府自远而来留宿
869601,南园饮罢留宿诘朝呈鲜于子骏范尧夫彝叟兄弟
1041216,深甫过留宿并示近诗
793848,访锦石上人静空蒙留宿
510469,次韵顾别驾留宿碧玉楼 其一
842991,志道留宿樱桃沟卜筑处 其二
493227,三月五日同鹏举萧茂材白水道人游三华未至留宿山下袁氏明日雨作望三华在咫尺不能至乃冒雨步归袁君追至山外不果留途中因赋柬同游者
668279,十月五日出城暮归门阖留宿南濠王氏楼与履约昆仲夜话有作
1235041,汴梁朝元宫留宿
515383,九月廿八日黄司训汝彝雨中留宿联句二首 其二
306470,朱二子涵留宿寓斋得诗
738334,莱石翁枉顾留宿听雨
279951,访锦石上人静空蒙留宿
984894,到巴川县日炽不可行遂留宿用明复留题韵
996341,三月乙巳来赋盐万岁乡且蒐狝匿赋之家晏饭此舍遂留宿是日大风自采菊苗荐汤饼二首 其一
1044236,君实南园饮罢留宿二首 其一
612072,庚申孟冬韩孟郁年兄游罗浮归携诸词客过访留宿紫烟楼赋
808271,台城路  留宿张龙威艺舫同话丁卯旧游有感用前韵
1204300,风中柳 饮山亭留宿
1157679,喜友至留宿
839341,刘石香来虞，留宿旬日，握手言欢，因作古歌赠之二首 其一
1136067,过嘉兴道中接待寺丁丑十二月赴逮扬州遇雪留宿怆然有感
487428,圌山朱都尉过访留宿草堂中夜不寐情见乎词
411303,秋日访穆庐师户庐晚眺湖景，因留宿
694483,次韵顾别驾留宿碧玉楼
1114868,同仲宝风雨中过德麟留宿以夜未央为韵分得未字并和二公夜央字韵
1228764,谒安成魏君坛留宿其下
603051,十五日过黄文士元庸宅访吴茂才子赞留宿
286956,归轺过永年张沚蒪丈留宿衙斋距昔年随任时已阅十八年吏役老者犹能识之感赋
522225,六月十日过分水王主事舜夫留宿明日以十绝句追送次韵答之 其十
641881,次韵林泉留宿草堂感旧
952404,连雨留宿陈药房吟所
624070,陈山人景文归自蜀中将韩宪副叔捷书问至留宿斋中
843990,志道留宿樱桃沟卜筑处
521684,阻风邳南第七屯百户王君留宿薄暮风止行二里馀复作与天民舟相失戏书示风
553628,雪夜凯师留宿戏赠
542670,雪夜过李于鳞宅适已醉卧因留宿作
290527,严秀才冬友过访山园留宿画船坞论诗
38253,宿江寺·岛僧留宿慰衰颜
1126726,次云见过留宿有诗因赓其韵二首
839342,刘石香来虞，留宿旬日，握手言欢，因作古歌赠之二首 其二
126755,访南园张氏昆仲因而留宿
1107363,予同彦老自四明之永嘉中道留宿岳林会法照海印二禅伯夜话投晓登车乃行留题于寺三首
784367,留宿陈卫瞻易安书室口占以赠 其二
1141649,南岩留宿分韵落字
1058283,谢吴安中留宿
202192,同仲宝风雨中过德麟留宿以夜未央为韵分得未
816949,康小范彭燕又秦汝翼近修师同盟诸子集家仲草堂汝翼与师留宿西轩谈越州事竟夕
1248083,同唐文学肃王校书行访衍略二上人留宿真庆精舍得闻字
586948,思抑送敦夫留宿江口
613640,初出关留宿玄帝观与亲友言别
279997,莱石翁枉顾留宿听雨
510471,次韵顾别驾留宿碧玉楼 其三
786627,鸡笼山遇雨，留宿颜君云年陋园
210913,立春日焦留宿
74852,黄尊师高轩观鹅因留宿
286311,寒夜石东村留宿东村村舍
789776,马退山拉过湖南新居留宿话旧
988040,九月二十九日迩英开讲忝预末班讲退小集玉堂之庐即留宿直因赋唐律呈诸讲官
56357,月夜留宿冯夫人池上
1121919,君实南园饮罢留宿二首
785239,至双峰寺留宿 其二
738305,秋日访子憨上人留宿精舍
263084,刘石香来虞留宿旬日握手言欢因作古歌赠之
1103950,辛丑九月十二与芳洲留宿雅山堂岁且周矣芳洲再往赋古诗十二韵奉寄壬寅九月十一日也
1251012,踏莎行 诜上人留宿 是日俞明府鹤瓢道人同访
636186,周茂才二有筑室山中谈经受徒从之游者皆邑名士书舍鳞集振铎篝灯络诵达旦予游山还时日已西夕留宿斋中睹其规模恍若丛席北方学者未尝有也因赋以赠
843598,刘石香来虞，留宿旬日，握手言欢，因作古歌赠之二首
612235,仲夏十八日彭贞元李尔明载酒镜园玩月留宿邻仙楼次贞元韵
1055898,和参寥过敝庐留宿因见寄之韵为谢
1216888,游武康禺山留宿升元宫
813589,留宿陈卫瞻易安书室口占以赠
1058964,同仲宝风雨中过德麟留宿以夜未央为韵分得未字并和二公夜央字韵 其三
11045,吴明府自远而来留宿
1088690,淳熙戊戌七月廿九日早发潭溪西登云谷取道芹溪友人丘子野留宿因题芹溪小隐以贻之作此以纪其事
909975,同仲宝风雨中过德麟留宿以夜未央为韵分得未字并和二公夜央字韵 其一
984980,留宿田家
920379,十月二日，将至涡口五里所，遇风留宿
1068859,顾景蕃访大年侄昆仲留宿细柳轩夜论诗律辄及老朽大年作长篇调景蕃末章见称过实且欲尽借拙诗因次其韵为谢
620900,七夕酌李文中竹圃留宿作
1204319,菩萨蛮 饮山亭留宿
830318,朱二子涵留宿寓斋得诗四首 其一
1216734,留宿洪洞庆云观刘山甫方丈
647211,月夜留宿冯夫人池上
945462,谢前人留宿饮食
307476,志道留宿樱桃沟卜筑处
987398,留宿灵岩
286401,留宿王兰谷斋中因赠
470919,正月四日张次公先生过遇琴馆留宿对雪即事
784443,留宿梅子坞
886544,游天柱宫因留宿观醮
120500,喜雨·永宁开善皆留宿
543615,夜同方吴两生集汪士能宅留宿作新都豪士歌
772252,连日为风雨所困，留宿圭柔山田家，□以遣闷
817038,至双峰寺留宿
784425,留宿友人易安书屋
784543,留宿王兰谷斋中因赠 其一
612117,过郴阳巡道旧署留宿抚衙前双古松怅然有感
1193162,留宿罗源西峰寺示辉上人
428040,南乡子 刘定一自江宁乡间来，留宿萧斋者六日，倾谈特契，赋此赠别
522224,六月十日过分水王主事舜夫留宿明日以十绝句追送次韵答之 其九
702429,九月廿八日黄司训汝彝雨中留宿联句二首
994689,次云见过留宿有诗因赓其韵二首 其一
1069878,予同彦老自四明之永嘉中道留宿岳林会法照海印二禅伯夜话投晓登车乃行留题于寺三首 其二
784396,正月十有四日桐公至自普陀因同藏上人留宿萧斋分赋得分字
732541,康小范彭燕又秦汝翼近修师同盟诸子集家仲草堂汝翼与师留宿西轩谈越州事竟夕 其一
427923,西江月 春江许承晃伉俪絜爱子辰自济南归厦门，中途过沪，留宿蜗居者三夕。倾谈甚契，戏效东坡俳体赋此赠之
840484,归轺过永年张沚蒪丈留宿衙斋距昔年随任时已阅十八年吏役老者犹能识之感赋
703427,省英卓今病因留宿旅舍经旬临别赋此
747773,襄阳晤罗澹村同年留宿郡斋因登孟亭
545943,春日侍家君过祝太学留宿别馆夜出群少侑觞豪饮申旦醉梦中拈韵得此诗题壁示太学并示山人无殊
685528,九日同潘景升吴翁晋卜伯符孙燕诒苏汝载家仲玄御登牛首山绝顶留宿僧院诘朝又游献花岩三首 游牛首
996956,雨晴过石塘留宿赠大中供奉
317028,锦阳川·黄昏留宿在茅亭
981480,和克家侄谢周凤隐雪中留宿韵
62768,至都始见峻伯留宿
716409,夕向诃林承二三禅人留宿风幡堂即事赋赠得风字
657983,公留宿天峰草阁数日告别奉赠以诗
612089,黎玉涛过访留宿
611804,九日同潘景升吴翁晋卜伯符孙燕诒苏汝载家仲玄御登牛首山绝顶留宿僧院诘朝又游献花岩三首 其二 留宿
611804,九日同潘景升吴翁晋卜伯符孙燕诒苏汝载家仲玄御登牛首山绝顶留宿僧院诘朝又游献花岩三首 其二 留宿
986787,林庇民保留宿夜话
522220,六月十日过分水王主事舜夫留宿明日以十绝句追送次韵答之 其五
1058963,同仲宝风雨中过德麟留宿以夜未央为韵分得未字并和二公夜央字韵 其二
212503,次云见过留宿有诗因赓其韵
11097,留宿罗源西峰寺示辉上人
507293,过吴江泗州寺访僧留宿
603083,罗象先谈万字见过留宿
1123033,绍兴壬子六月先公再被掖垣之命某时侍行自清江登舟经祖印江口趋行在所未几罢归还憩丰城之龙泽寺明年初夏归隐南山己巳岁予偶游祖印留宿寺僧惠嵩能道昔寓龙泽之梗概两寺相望盖五十里时先公没十有二年矣予亦衰病投绂俯仰悲慨因成两诗以遗嵩
813601,留宿王兰谷斋中因赠
868006,留宿山家
785238,至双峰寺留宿 其一
544935,次公于昙阳观傍新搆澹圃落成适余过访留宿其中敬赋
102240,十月一日将至涡口五里所遇风留宿
807167,蓦山溪  虎邱送春夜同顾伊人天石留宿山中次伊人韵
428666,有事至寨门过访严竹坪表兄快谈心曲承留宿书斋拈此遗赠
485081,张山人见访留宿草堂
1126935,三月乙巳来赋盐万岁乡且蒐狝匿赋之家晏饭此舍遂留宿是日大风自采菊苗荐汤饼二首
1030934,立春日焦山留宿
276063,少翯过访留宿斋中谈艺甚乐习日以诗奉柬兼寄芗甫明江
492208,将发舟承曾自道留宿舟中临别赋赠
995437,同刘景文游郭氏西园因留宿
681431,至昌平留宿廖指挥宅
512855,次匏庵雨中留宿
121458,留宿山家
918387,去昌化县西四十里留宿陈东鲁南楼
492009,过郑氏隐居承二子之纯之纪留宿赋赠一首
522223,六月十日过分水王主事舜夫留宿明日以十绝句追送次韵答之 其八
650146,余自城中逢与粟同归过去伐隐居留宿明日告别去伐又欲留有不满之意作诗赠余勉强和之云
192854,孤标上人留宿
677029,自齐云乘筏至落石台留宿
981786,孤标上人留宿
765564,满江红 其六 过周山人山居留宿
768796,曹跃舟留宿南轩
354350,满江红·过周山人山居留宿
628713,同黄元卿张约之梁日良游月溪留宿
351725,绍兴已未七月六日被旨祷雨风水洞七日清晨诣祠下是晚大雨通夕留宿慈严寺中八日始还城
49551,正月四日张次公先生过遇琴馆留宿对雪即事
47186,金征士玟雨中见过留宿·莫辞同宿掩书帏
641800,次韵林泉留宿听钟有感
299787,困酒入诃林留宿自公房
183588,连雨留宿陈药房吟所
611803,九日同潘景升吴翁晋卜伯符孙燕诒苏汝载家仲玄御登牛首山绝顶留宿僧院诘朝又游献花岩三首 其一 游牛首
965472,留宿陈氏书斋
212640,离相院·一夕僧留宿
741318,严秀才冬友过访山园留宿画船坞论诗
195136,南岩留宿分韵落字
545548,相国赵公邸中夜谈因留宿斋头作
515192,九月五日重至万山观观主宗贵兄留宿东明楼上
522222,六月十日过分水王主事舜夫留宿明日以十绝句追送次韵答之 其七
533185,雨中留宿张幼千家 其二
960916,访李兴伯不遇其家人命二子留宿有古人截发撤荐之风喜诗之
1151844,喜祖三至留宿
522219,六月十日过分水王主事舜夫留宿明日以十绝句追送次韵答之 其四
611915,乙卯闰中秋同林愚庵钟柱明族兄玉宇集袁伯益江上园亭泛舟弄月醉后留宿时呼琵琶伎不至但雅歌清谈而已　五首 其三
1216329,陈诚中留宿壶山别墅雨中纪怀
1248056,赵曹莫三助教留宿南斋
162192,林庇民保留宿夜话
994688,次云见过留宿有诗因赓其韵二首 其二
700633,金征士玟雨中见过留宿二首
619628,冬日刘平子周献之过访留宿秋兰阁分得壶字
799930,冬日同友人游南岩精舍留宿次达上上人韵
1055626,之仪家当涂七年矣屡过禅岳山下望高山塔欲一游辄不果异时山主勤公大师与其子宣上人相过因往报之取路回远薄晚方到遂留宿栋宇一新舍次皆得其便而宏丽高朗唯见者知焉又复规范齐肃钟鼓应接问之乃勤一力所就丝蓄粒聚未尝毫发资之人此尤难者感叹不已因赋二小诗 其一
362748,过维衍留宿灯下次韵
229041,去昌化县西四十里留宿陈东鲁南楼
83561,饮伯山家因留宿
327537,谢吴安中留宿
704347,雨中留宿张幼千家
612241,新都孙子真过访镜园留宿赋赠
162425,和克家侄谢周凤隐雪中留宿韵
748492,杨四留宿
1056052,大观四年二月二日自采石过藏云取路回远少憩已入夜遂留宿明日聪师相邀登览偶见西偏地真一方之胜也余方营葬庶几得之以托妙缘既去因留此诗
677626,仲冬尹凤湖参军过顾留宿
514065,兖山汪处士世宁留宿予适有事辞归别后寄此
765565,满江红 其七 过周山人山居留宿
306111,秋日访穆庐师户庐晚眺湖景，因留宿
917759,奉檄往哭象山复会葬及归自金溪留宿本县仙乐观归而作是诗 其一
784353,寒夜石东村留宿东村村舍
521717,文仪别予赴会试风甚留宿拈韵赋此为赠
611913,乙卯闰中秋同林愚庵钟柱明族兄玉宇集袁伯益江上园亭泛舟弄月醉后留宿时呼琵琶伎不至但雅歌清谈而已　五首 其一
685542,乙卯闰中秋同林愚庵钟柱明族兄玉宇集袁伯益江上园亭泛舟弄月醉后留宿时呼琵琶伎不至但雅歌清谈而已　五首
568913,张山人寓侯先生适园得诗廿二首见示因留宿我弇州园五日而赠以此诗
748058,少翯过访留宿斋中谈艺甚乐习日以诗奉柬兼寄芗甫明江
35326,留宿廖融山斋
734448,从弟元长自陵至樊?留宿不得一见而去怀不能己作诗以寄
475967,至都始见峻伯留宿廨舍识喜
1183317,答王维留宿
357382,锦缠道·丰台观芍药留宿城南花坞
522216,六月十日过分水王主事舜夫留宿明日以十绝句追送次韵答之 其一
510470,次韵顾别驾留宿碧玉楼 其二
966088,绍兴壬子六月先公再被掖垣之命某时侍行自清江登舟经祖印江口趋行在所未几罢归还憩丰城之龙泽寺明年初夏归隐南山己巳岁予偶游祖印留宿寺僧惠嵩能道昔寓龙泽之梗概两寺相望盖五十里时先公没十有二年矣予亦衰病投绂俯仰悲慨因成两诗以遗嵩 其一
50550,雨中留宿息耘轩话旧
522221,六月十日过分水王主事舜夫留宿明日以十绝句追送次韵答之 其六
843966,朱二子涵留宿寓斋得诗四首
641398,陪吴令访古长陵留宿萧城僧舍
133693,南园饮罢留宿诘朝呈鲜于子骏范尧夫彝叟兄弟
611805,九日同潘景升吴翁晋卜伯符孙燕诒苏汝载家仲玄御登牛首山绝顶留宿僧院诘朝又游献花岩三首 其三 游献花岩
480171,黄土道中李员外同年留宿
468504,春日山房有客过访因留宿别
769077,锦缠道·丰台观芍药留宿城南花坞
784544,留宿王兰谷斋中因赠 其二
114145,雨晴过石塘留宿赠大中供奉
1247996,与金文中、朱仲义、宋仲温过李士明鍊师，雨阻留宿，探韵得孤字。师有酒瓢如鹤形，因扁居曰：鹤瓢山房
611916,乙卯闰中秋同林愚庵钟柱明族兄玉宇集袁伯益江上园亭泛舟弄月醉后留宿时呼琵琶伎不至但雅歌清谈而已　五首 其四
712590,正月六日将归锦岩泊舟潘子登寓楼下新月甚佳因留宿三日两登斯楼亦一快也
415464,久别静茶，重访，留宿
73836,风中柳·饮山亭留宿
613670,吴彦先过访旅舍留宿
611914,乙卯闰中秋同林愚庵钟柱明族兄玉宇集袁伯益江上园亭泛舟弄月醉后留宿时呼琵琶伎不至但雅歌清谈而已　五首 其二
697073,夜集王将军园亭留宿斋头二首
842990,志道留宿樱桃沟卜筑处 其一
772205,淡文山留宿佃屋，马上口占
595579,不染上人斋中留宿
485240,金征士玟雨中见过留宿二首 其二
634867,省英卓今病因留宿旅舍经旬临别赋此 其一
