378321,七月四日昼梦云庵和尚教诲久之而觉作此示超然
508996,七月四日避暑天界禧上人西庵号天祥
938909,七月四夜雨过差凉閒坐和徐子融晦日所寄四绝 其三
222600,七月四夜十过差凉闲坐和徐子融晦日所寄四绝
664119,七月四日泛湖次暮春佛寺韵
930385,七月四日夜赋
751047,七月四日圭盦复招同人由天宁寺至北河泊观荷仍集苇湾柳叟醉堕水再用前韵调之
938911,七月四夜雨过差凉閒坐和徐子融晦日所寄四绝 其二
529190,七月四日与姚时望放舟过南浦
938910,七月四夜雨过差凉閒坐和徐子融晦日所寄四绝 其四
1118978,七月四夜雨过差凉閒坐和徐子融晦日所寄四绝
80448,七月四日夜赋
1246138,七月四日自深谷之灵峰作
1064139,七月四日昼梦云庵和尚教诲久之而觉作此示超然
938908,七月四夜雨过差凉閒坐和徐子融晦日所寄四绝 其一
1083219,七月四日宿丹溪道中
509240,赠何太守盛之高州七月四日
443276,蜀中飞行杂诗选五首 其二 居蜀七月，四十三次飞越长江
634250,七月四日诸公集塔下喜雨之作
326287,七月四日宿丹溪道中
