31342,初赴期集
1040269,初赴杭州游风水洞
122867,初赴明州·四征惟是欠东征
1127409,京兆府初赴同天节宴诗二首
563344,送金太初赴徐练府幕下
844425,甲戌春初赴罗墅湾二首
840993,甲戌春初赴罗墅湾二首 其一
1220812,送韩一初赴马万户府参议
1037581,初赴扬子任
342610,初赴扬子任
1018640,赠闽清黄释褐初赴上庠
195367,於杭州九月送袁太初赴宁海教官
1147155,送杨遂初赴选
804930,百字令 送潜阳金肯公初赴燕台
1141363,于杭州九月送袁太初赴宁海教官
1039075,初赴早朝
874425,天仙子 其一 初赴省别妾
678119,送陈继初赴京
521022,初赴举时赋七律一首留别诸公适时敏以诗来即用其韵
615169,初赴公车亲友子弟饯送江上
999710,京兆府初赴同天节宴诗二首 其一
1038780,初赴新定过钱塘江
158233,京兆府初赴同天节宴诗
1212071,送丁太初赴永嘉学正十八韵
840994,甲戌春初赴罗墅湾二首 其二
465697,送别周达初赴美
361423,初赴杭州游风水洞
883051,祐侄初赴乡举吾家读书三世至此侄才七人作十八韵诲之
249474,送别周达初赴美
500730,送张太初赴西台御史
999709,京兆府初赴同天节宴诗二首 其二
1218985,送郑复初赴白沙蔡宅馆
36814,送杨遂初赴选
188448,赠闽清黄释褐初赴上庠
957025,初赴明州
1190462,初赴期集
