697294,送左辖赵公入觐兼便道还晋中
522132,定庵兄孙从哲之官便道还家赋此豫寿
174513,何耕道还邛南赠诗为别
515492,送程忠显进士江西公干便道还新安
865890,与所盘行溪边有一小屋可爱问之乃为南山主人盘翁欲买居越日诗来有孟光到老不晓事刚道还山活计非之句用韵以勉之
985116,何耕道还邛南赠诗为别
486061,予昔与孟思鲁参戎事于三衢监司宋公幕府及兵溃得间道还乡遂归休之志故历叙之
682650,便道还乡阅月赴任和诸士大夫赠章
509512,送户部祁主事致和奉使便道还东莞省母复还京师
551041,读礼日谢在杭拜官湖州便道还家见访赋赠
612323,送别龙门王纫度父母擢守涿郡便道还楚王公摄莞政半载
542457,送蹇武选子修使秦中便道还巴郡
700071,送郁林乡亲关少宰取道还家二首
586616,送伦殿撰使安南便道还乡
905566,水龙吟 其一 次韵任世初送林商叟海道还闽中
606992,郝太学侍亲赴阙便道还晋
616085,送别萧伯懋之南掌院时有内子之戚借道还里
528012,送曾建昌取道还泸州
545556,送区用孺之楚中便道还粤
538448,赠别陈信可比部使闽便道还吴时两地俱有岛寇之警
974596,送张达道还山
538393,送刘库部使云中取道还楚省侍
545881,送左辖赵公入觐兼便道还晋中 其一
615951,送卢侯见之任清江便道还里
509758,读林缉熙近诗时缉熙典文衡闽中欲便道还家数夕前尝梦见之故有是作
515679,送尹同道还历城
672997,送刘司训迁合江掌教且便道还万安
475577,送李伯华饷军宣府便道还家
683435,送张肖甫徵金岭西道便道还蜀
538426,送张肖甫徵金岭西道便道还蜀 其一
84184,东村晚归·蜀道还吴鬓已丝
66490,送李伯华饷军宣府便道还家
987992,嘉定甲申以礼部尚书得请便道还家作此诗
1246347,至婺州闻官军自温处之江东所过皆空遂从间道还乡
539127,赠谈思重中军饷上谷便道还里
322239,春日寄怀·都道还乡梦自恬
488782,送王使君擢霸州兵备道还东省
973039,送赵咏道还侍兼简然道昆仲
615970,黄宫谕樊水部同集小寓酌别谢大行册封崇府便道还里
560086,送杨都宪仲子本道还朝
492578,送王巡检宗道还卓口
595957,送张朝使使朝鲜便道还浙
469381,送胥计部使饷蓟州便道还巴中
59472,送胥计部使饷蓟州便道还巴中
97362,送赵咏道还侍兼简然道昆仲
545882,送左辖赵公入觐兼便道还晋中 其二
542331,冬夜宗考功子相宅同张比部士直钱进士惟重饯别方行人仲安使阙里便道还蜀
589131,便道还乡阅月赴任和诸士大夫赠章 其二
589130,便道还乡阅月赴任和诸士大夫赠章 其一
709395,黄舍人符升秩迁客部奉使册鄢陵王兼捧前任荣封诰命就道还里赋此送之
538427,送张肖甫徵金岭西道便道还蜀 其二
569592,孙状元册封南阳便道还里索赠
165085,嘉定甲以礼部尚书得请便道还家作此诗
1208381,赵存诚除曲江县尹将上枉道还长沙为乃父平远公焚黄
596950,送郁林乡亲关少宰取道还家二首 其一
557192,送刘武库使云中便道还楚
513926,分得剑井送濮用昭兵部公差便道还毗陵
291263,半边山·千里艰辛鸟道还
618228,送比部张武程老师谪外便道还楚
582392,送贡士余载道还龙南
1231560,送陈思道还乡戊申春二月十六日
596951,送郁林乡亲关少宰取道还家二首 其二
