581451,喜元恶伏诛
780981,凤凰山张献忠伏诛处
587024,烈妇祠雷人夫妇佣于新会，主人谋害其夫，沉之于江，尸浮逆流而上，妇见之痛哭，抱幼子同死。三尸浮至门，推去复来，事觉伏诛
640047,洪武十八年二月二十日自漳州府回闽宪因思去年七月五日出闽关土人云宪司官初过此关值微雨故有小不利今出关而天日晶明旌节当复还矣及至京师纠劾奸贪事既得实彼乃伏诛我则还职再入关天又晴人复云必大亨也前后所作二绝句谩志于此 其一
857366,海寇赵某伏诛
521714,题画送祁通判朝明年正月时宦瑾伏诛海内拭目以观新化
481664,送季方归感事有作石生怒季方欲杀之愤云必置汝于天尽处死而后已石氏伏诛季方乃得释老魅有知含羞地下矣
703084,洪武十八年二月二十日自漳州府回闽宪因思去年七月五日出闽关土人云宪司官初过此关值微雨故有小不利今出关而天日晶明旌节当复还矣及至京师纠劾奸贪事既得实彼乃伏诛我则还职再入关天又晴人复云必大亨也前后所作二绝句谩志于此
661011,闻逆宦伏诛次澄江公韵
274922,咏史·文成甫伏诛
317930,凤凰山张献忠伏诛处
640048,洪武十八年二月二十日自漳州府回闽宪因思去年七月五日出闽关土人云宪司官初过此关值微雨故有小不利今出关而天日晶明旌节当复还矣及至京师纠劾奸贪事既得实彼乃伏诛我则还职再入关天又晴人复云必大亨也前后所作二绝句谩志于此 其二
