871081,八月三日即事
300401,二小儿抬水歌八月三日为路、踊作于井上庐
1236411,八月三日伯玉留饮西涧别馆二首
471486,八月三日得月亭夜宴有感而作
1075068,八月三日早起
1249834,八月三日夜宿张景叔听雨联句忆张思廉
930434,八月三日骤凉有感
1251851,八月三日与刘道益连床夜话风雨凄然五日开霁道益赋诗见贻次韵一首
1218063,八月三日伯玉留饮西涧别馆二首 其二
83863,八月三日骤凉有感
990783,八月三日咏原甫庭前林檎花
1058927,八月三日舟行自蔡河赴临淮
791211,闰四月四日，儿子来湘省亲，八月三日返江右，诗以送之
504661,八月三日游方广洞天留题纪实望仙台与洞天相对乃前山也
460330,罥马索　八月三日将归横铺，与芳叔行岳阳火车站诸隘巷，繁华拥挤；忽认为旧曾经处，惘然为赋
1218898,八月三日书所见
415252,二小儿抬水歌八月三日为路、踊作于井上庐
313337,人月圆·记八月三日晨梦
481311,八月三日直内阁杨少保延话率口呈此
1218062,八月三日伯玉留饮西涧别馆二首 其一
826073,八月三日飞行自承德历榆关至锦州
51754,八月三日得月亭夜宴有感而作
19386,八月三日夜作
1156742,八月三日夜作
826411,人月圆·记八月三日晨梦
63025,八月三日直内阁
492159,八月三日晚圣驾夕月清凉山上陪祀礼成喜赋
103445,八月三日咏原甫庭前林檎花
