923396,累年告老恩旨未俞诏领祠宫遂还乡闬燕閒无事追省平生因成感事述怀诗五言一百韵示儿孙辈使知遭遇终始之意以代家训故言多不文
893991,同年庞汝弼赴宰临贺见过叙别因成感咏
159658,献臣学士与余通书因成感咏
426305,春节中，老友吴天鹏以七绝二章相示。端午节素未谋面之陈以光亦赠七律诗四首。旧雨新知，不可无和。往事萦怀不无遐想因成感怀二首 其一
894482,天禧初侨寓安陆有宅一区尝于斋前手植橘树才尺馀许未几擢第随牒游方天圣庚午冬屏居畿邑守舍儿自安陆馈余丹橘一箧因曰此即斋前所植抚物怀旧悽然不平者久之因成感咏
159533,同年庞汝弼赴宰临贺见过叙别因成感咏
569552,郧襄之役与伯玉侍郎别恰三载矣闻出谼中至钱唐走信奉迎因成感旧之作
159771,初春置酒河上得前忠武记室饶廷评书因成感咏
426306,春节中，老友吴天鹏以七绝二章相示。端午节素未谋面之陈以光亦赠七律诗四首。旧雨新知，不可无和。往事萦怀不无遐想因成感怀二首 其二
894576,献臣学士与余通书因成感咏
894509,初春置酒河上得前忠武记室饶廷评书因成感咏以寄
907549,六龙驻跸温州先公职列西掖扈从至此手泽具载一时之事三十三年嗣子洪守官于此因成感事诗
432311,春节中，老友吴天鹏以七绝二章相示。端午节素未谋面之陈以光亦赠七律诗四首。旧雨新知，不可无和。往事萦怀不无遐想因成感怀二首
