569357,再赠马从甫
1026488,寄秦川马从事
702274,早行忽数人被甲持弩至道左俟土酋及见余或揖或跪译者曰此倚石村部民也期此地迎酋而归既而上马从行至晚同宿山中赋此
652693,将之京留别马从兄敬
488130,马从甫招饮病中却寄兼呈诸君
488081,同游宗谦集马从甫草堂作
160369,寄秦川马从事
594409,别吴叔嘉黄白仲马从甫余食其四子
553311,早行忽数人被甲持弩至道左俟土酋及见余或揖或跪译者曰此倚石村部民也期此地迎酋而归既而上马从行至晚同宿山中赋此 其一
134363,知汉州·金马从容乐
322296,王补楼·天马从来惯脱缰
487725,赵仁甫邀登越王山同王汝存马从甫林天迪赋
594327,夏日周公瑕马从甫陆成叔同集悦上人禅房得书字
488099,秋夜月仝马从甫许希旦方子韩作
639926,又赓马从韵
347889,昔梦·白马从骊驹
488727,仙霞道中同马从甫作
553312,早行忽数人被甲持弩至道左俟土酋及见余或揖或跪译者曰此倚石村部民也期此地迎酋而归既而上马从行至晚同宿山中赋此 其二
488104,西湖同蔡幼公马从甫冯咸甫作
569466,马从甫别六年矣以诗投赠余诗转佳而复不第走笔慰之
119361,谢张安道惠马·从事年来鬓似蓬
594392,酬马从甫见投因怀林邦介
594399,次夕李文仲孙齐之姚伯道罗伯符王元方程子虚汪仲嘉马从甫黄思素吴大觉过集得逢字
