974472,题甘叔异曲江矶庵
1088568,诗送碧崖甘叔怀游庐阜兼简白鹿山长吴兄唐卿及诸耆旧三首 其三
972748,抚州初程夜寄孙温叟甘叔异
1111004,诗送碧崖甘叔怀游庐阜兼简白鹿山长吴兄唐卿及诸耆旧三首
972332,生米市尽处有寺名演义有二物且得甘叔异邓南秀简寿玉诗
972557,过丰城访甘叔异闻在曲江之矶头庵放舟过之棹未及弭迎劳之诗已至次韵上呈
972724,怀甘叔异曲江庵寄叔异
152062,洪景卢内翰为甘叔怀作碧崖修造疏戏题小诗奉
91731,酬合皂山碧崖道士甘叔怀赠美名人不及佳
98186,新桂林户曹甘叔异过余于津亭留以小饮论论文
1088566,诗送碧崖甘叔怀游庐阜兼简白鹿山长吴兄唐卿及诸耆旧三首 其一
973227,寄甘叔异户曹贾季承邓南季教授二首 其一
97247,怀甘叔异曲江庵寄叔异
913759,酬阁皂山碧崖道士甘叔怀赠美名人不及佳句法如何十古风二首 其二
1123869,寄甘叔异户曹贾季承邓南季教授二首
326847,诗送碧崖甘叔怀游庐阜兼简白鹿山长吴兄唐卿及诸耆旧
97158,过丰城访甘叔异闻在曲江之矶头庵放舟过之棹
948330,洪景卢内翰为甘叔怀作碧崖修造疏戏题小诗奉劝本宫管辖而下诸道友助缘
913760,酬阁皂山碧崖道士甘叔怀赠美名人不及佳句法如何十古风二首 其一
97812,题甘叔异曲江矶庵
974342,寄谢新安丰守胡达孝见遗近诗一轴便呈甘叔异章梦与
96443,寄谢新安丰守胡达孝见遗近诗一轴便呈甘叔异
97390,抚州初程夜寄孙温叟甘叔异
1088567,诗送碧崖甘叔怀游庐阜兼简白鹿山长吴兄唐卿及诸耆旧三首 其二
96312,寄甘叔异户曹贾季承邓南季教授
97156,过丰城见甘叔异怀孙温叟
1115766,酬阁皂山碧崖道士甘叔怀赠美名人不及佳句法如何十古风二首
98277,生米市尽处有寺名演义有二物且得甘叔异邓南
972556,过丰城见甘叔异怀孙温叟
974437,新桂林户曹甘叔异过余于津亭留以小饮论文县僚有招之者遂败此兴既夕作诗呈之
973226,寄甘叔异户曹贾季承邓南季教授二首 其二
