502575,建安王彦真善墨竹道遇新宁林彦时写岁寒烟雨为别索余就题其上
412316,夜坐寄子大新宁五首 其一
502712,赠新宁陈五处士大初应召
412320,夜坐寄子大新宁五首 其五
502636,题新宁陈叔谟留耕别墅
613626,新宁道中 其五
576860,新宁龙溪山石室
502538,寄新宁林伯坚秀才
272057,夜坐寄子大新宁
502842,题新宁陈叔永环秀楼
615635,新宁刘明府元夜过访村居
613624,新宁道中 其三
432177,夜坐寄子大新宁五首
502535,送新宁簿丹徒镏公之天官
628457,送颖斯侄孙作幕新宁
613623,新宁道中 其二
517489,薜萝山房歌为新宁王锡赋
620966,赠新宁令
760516,新宁刘小芸将为大江南北之游，介孝方索诗壮行，为赋四绝句 其一
412319,夜坐寄子大新宁五首 其四
811426,新宁刘小芸将为大江南北之游，介孝方索诗壮行，为赋四绝句
613627,新宁道中 其六
502733,宪从事新宁陈氏归隐卷
673092,新宁伯家飨堂成赐额壮节
487735,读姚新宁苦竹记有感赋此为赠
613625,新宁道中 其四
678243,送蜀中新宁教谕
594941,新宁饮张明府县斋
502684,国子先生郑孟宣以赐告归省丘墓暇日访余新宁之沙堤余因载酒于沧洲野堂以宴之适文墨友方外交翕然来集酒酣乐甚分韵赋诗余得酒字时庚辰孟秋七月
412317,夜坐寄子大新宁五首 其二
329587,寄新宁黎叔茜
690834,新宁道中
760518,新宁刘小芸将为大江南北之游，介孝方索诗壮行，为赋四绝句 其三
827076,步蟾宫 寇氛逼新宁，怀故园兄弟
760517,新宁刘小芸将为大江南北之游，介孝方索诗壮行，为赋四绝句 其二
311324,步蟾宫·寇氛逼新宁，怀故园兄弟
412318,夜坐寄子大新宁五首 其三
565881,至香山新宁伯谭公邀宴山堂一首
502734,书新宁高鲁仲心远堂
625224,送麦木公还新宁读书
712461,赠宜新宁逊庵
66345,送郁文茂赴新宁州幕
533566,石冷为潘新宁赋
1045924,寄新宁黎叔茜
681263,送茹知县玉之新宁
760519,新宁刘小芸将为大江南北之游，介孝方索诗壮行，为赋四绝句 其四
613622,新宁道中 其一
