1079265,获从枢密徐公游者累月虽接名理不敢言诗念挥斤般郢之门古人所诮也日者恶语流传不图彻听过蒙奖誉形之篇什辄复次韵叙谢
948377,致政杨图南佥判惠园亭石刻来索恶语寄题四首 其一 湖山亭
948964,戴子微运使出使湖北约以恶语送行而未遣也佳篇见督次韵奉寄
230603,干藏·恶语重重放出门
1120348,致政杨图南佥判惠园亭石刻来索恶语寄题四首 秀野堂
948813,程元成待制书来叙别圃揽有亭葵心秀野二堂之胜见索恶语老病不暇遍赋谩往一篇
948378,致政杨图南佥判惠园亭石刻来索恶语寄题四首 其二 湖山亭
948579,同年杨谨仲示芗林诸帖皆以老杜相期惟童敏德谓不合学东坡殆非知诗者辄用此意成恶语一篇为诞辰寿祝颂之意见于末章
152102,致政杨图南佥判惠园亭石刻来索恶语寄题
297437,严武·乃有此儿非恶语
215068,汪叔耕见访不数日别去恶语为赠兼简子用子美
152528,戴子微运使出使湖北约以恶语送行而未遣也佳
948375,致政杨图南佥判惠园亭石刻来索恶语寄题四首 其二 秀野堂
890419,汪叔耕见访不数日别去恶语为赠兼简子用子美二友
948667,杨廷秀秘监万花川谷中洛花甚富乃用野人韵为鱼儿牡丹赋诗光荣多矣恶语叙谢
1120347,致政杨图南佥判惠园亭石刻来索恶语寄题四首 湖山亭
948376,致政杨图南佥判惠园亭石刻来索恶语寄题四首 其一 秀野堂
