134477,和景仁缑氏别后见寄求决乐议虽用其韵而不依
1177667,缑氏韦明府厅
957863,题缑氏山王子晋祠
870091,和景仁缑氏别后见寄求决乐议虽用其韵而不依次盖以景仁才力高逸步骤绝群非驽拙所能追故也
148005,题缑氏山王子晋祠
104794,送张山甫秘校归缑氏
23378,送前缑氏韦明府南游
3599,缑氏尉沉兴宗置酒南溪留赠
10874,缑氏拜陵回道中呈李舍人少尹
992843,送张山甫秘校归缑氏
1058588,缑氏道中口占
1152925,张彭州前与缑氏冯少府各惠寄一篇多故未答张已云没因追哀叙事兼远简冯生
347704,和河南府倅程朝散缑氏僧舍题壁
355981,七夕·缑氏山头白鹤飞
592825,过缑氏上轘辕岭
5927,张彭州前与缑氏冯少府各惠寄一篇多故未答
1153968,卧病寓居龙兴观枉冯十七著作书知罢摄洛阳赴缑氏因题十四韵寄冯生并赠乔尊师
897638,同杨十二缑氏寺宿草酌张正民秀才见访
21788,缑氏韦明府厅
1162546,送前缑氏韦明府南游
138193,缑氏县作·亭候彻郊畿
1151415,缑氏尉沈兴宗置酒南溪留赠
1058603,和河南府倅程朝散缑氏僧舍题壁
1191319,缑氏拜陵回道中呈李舍人少尹
347766,缑氏道中口占
117372,同杨十二缑氏寺宿草酌张正民秀才见访
953891,缑氏县作
