388512,张司礼尧督备显陵八年而始还朝节惠之政口碑载道余甚愧之敬之於其行赋五言近体以赠
452082,仰翁以耄耋之龄相陪自宜春至丰城再到南昌始还途中更以诗见赠感愧之馀赋此作答
513647,成化戊戌四月十一日储皇御左春坊敏政进讲大学首章退宴文华门十二日上御经筵敏政进讲中庸第二十章退宴左顺门感愧之馀赋此呈同事诸君子
538034,张司礼尧督备显陵八年而始还朝节惠之政口碑载道余甚愧之敬之於其行赋五言近体以赠
250401,仰翁以耄耋之龄相陪自宜春至丰城再到南昌始还途中更以诗见赠感愧之馀赋此作答
1038218,臣伏蒙圣恩今月二日就琼林苑特遣中使宠赐御诗仰味圣言恭披宸翰曲推恩礼过奖愚臣感愧之深负荷弗克辄课愚陋恭和圣制
1091156,某为令无状不能化服奸盗至加之刑僇仲蟠乡丈不以为过又哦诗以宠之是重某之不肖而播其恶于众也感愧之剧次韵以酬
457998,予辞故乡网唐风宋韵版主，诸友惜别相送，作诗甚众，予览而感之，感而愧之，赋此聊以为答
1213232,威卿中丞溽暑中遣送秋露芳尊侑以佳篇感愧之馀用韵以谢
479273,陈情奉旨仍许病痊起用感愧之余再次前韵
641466,昨蒙仲弘赞府招预新酒河鱼之会筵重席叠不胜杯酌而归惭愧之馀赋此为谢
979269,次韵和求仁不赴照碧堂会呈无愧之作
166097,次韵和求仁不赴照碧堂会呈无愧之作
56089,陈情奉旨仍许病痊起用感愧之余再次前韵
561683,予昔卧痾钤山有终焉之志矣既而复玷朝籍不自意叨窃至今偶诵姑苏蔡九逵往年为予作钤山堂诗有他年玉带归山灵喜无愧之句感念其情因纪一绝并寄谢蔡君
