1247301,予壮年时幽居山谷尘俗罕接惟与泉石草木为侣日徜徉其间醒悦心目而已年老力衰世移事改向之醒心悦目者反足以损灵乱思矣盖所养于中者既异故应于外者自殊是以石失其贞而存其乱木失其美而存其恶泉失其清而存其污草失其劲而存其弱理固然也因成律诗四首以泄胸中之郁抑呈录同志庶知比兴之有在焉 其一
1247303,予壮年时幽居山谷尘俗罕接惟与泉石草木为侣日徜徉其间醒悦心目而已年老力衰世移事改向之醒心悦目者反足以损灵乱思矣盖所养于中者既异故应于外者自殊是以石失其贞而存其乱木失其美而存其恶泉失其清而存其污草失其劲而存其弱理固然也因成律诗四首以泄胸中之郁抑呈录同志庶知比兴之有在焉 其三
1174928,郡斋有紫薇双本自朱明接于徂暑其花芳馥数旬犹茂庭宇之内迥无其伦予嘉其美而能久因诗纪述
1253305,予壮年时幽居山谷尘俗罕接惟与泉石草木为侣日徜徉其间醒悦心目而已年老力衰世移事改向之醒心悦目者反足以损灵乱思矣盖所养于中者既异故应于外者自殊是以石失其贞而存其乱木失其美而存其恶泉失其清而存其污草失其劲而存其弱理固然也因成律诗四首以泄胸中之郁抑呈录同志庶知比兴之有在焉
1155811,与微之唱和来去常以竹筒贮诗陈协律美而成篇因以此荅
700272,周文焕致槐栽十二本列植道南美而且巨不日成阴矣诗以谢之庚午正月望日
869473,花庵多牵牛清晨始开日出已瘁花虽甚美而不堪留赏
1247304,予壮年时幽居山谷尘俗罕接惟与泉石草木为侣日徜徉其间醒悦心目而已年老力衰世移事改向之醒心悦目者反足以损灵乱思矣盖所养于中者既异故应于外者自殊是以石失其贞而存其乱木失其美而存其恶泉失其清而存其污草失其劲而存其弱理固然也因成律诗四首以泄胸中之郁抑呈录同志庶知比兴之有在焉 其四
133975,花庵多牵牛清晨始开日出已瘁花虽甚美而不堪
521691,周文焕致槐栽十二本列植道南美而且巨不日成阴矣诗以谢之庚午正月望日 其一
258312,为美而想
721161,钟子建才美而文有怀高云白之作社中人为和章余亦步韵二律代高子赋答二首
569869,顾尚玺名世八十寿言公有二子美而文
711580,钟子建才美而文有怀高云白之作社中人为和章余亦步韵二律代高子赋答二首 其二
1049615,小溪尉丘君父母年皆九十康强精明尚能读书挫箴如五六十岁人相继受恩命某固未尝见也亦未尝闻也因作诗遗丘君且以传诸士大夫如果未尝见闻则宜相与乐道其美而形于歌颂云
512431,时长孙焕从其父来省予爱其资美而恐怠于学也因其还赋此训之
1157600,偶以拙诗数首寄呈裴少尹侍郎蒙以盛制四篇一时酬和重投长句美而谢之
521692,周文焕致槐栽十二本列植道南美而且巨不日成阴矣诗以谢之庚午正月望日 其二
1247302,予壮年时幽居山谷尘俗罕接惟与泉石草木为侣日徜徉其间醒悦心目而已年老力衰世移事改向之醒心悦目者反足以损灵乱思矣盖所养于中者既异故应于外者自殊是以石失其贞而存其乱木失其美而存其恶泉失其清而存其污草失其劲而存其弱理固然也因成律诗四首以泄胸中之郁抑呈录同志庶知比兴之有在焉 其二
711579,钟子建才美而文有怀高云白之作社中人为和章余亦步韵二律代高子赋答二首 其一
