327427,己未九日子服老弟及仲宣诸友载酒见过坐间居厚庙令出示佳句叹伏之馀次韵为谢并呈同社诸名胜
158116,宋周士以新蕈为惠并示佳句依韵和答
1061234,法门复故圣恩深厚矣自此恐云巢不能久栖当为众一起承示佳句因用韵备载之
1061238,适承再示佳句亦强勉再成一首
379635,法门复故圣恩深厚矣自此恐云巢不能久栖当为众一起承示佳句因用韵备载之
989031,双溪云老寄示佳句及新茶用来韵为谢
127407,双溪云老寄示佳句及新茶用来韵为谢
906131,彦术权郡大夫相邀昭亭以病酒不果往得所示佳句辄次韵呈
379575,不愚兄再示佳句如璧亦重用来韵
1105729,和李士举陪提刑徽猷游中梁山临秀远轩以望江中平陆之胜承示佳句且叙故旧离合之感次韵二首
96703,蕃方为纪游之诗未就知府寺簿先生宠示佳句敢
231931,朝隐病瘧作谴瘧鬼文而差示佳句次韵
1051822,兵部敏叔颁示佳句谨依原韵
974463,蕃方为纪游之诗未就知府寺簿先生宠示佳句敢辄次韵
999467,宋周士以新蕈为惠并示佳句依韵和答
1088575,己未九日子服老弟及仲宣诸友载酒见过坐间居厚庙令出示佳句叹伏之馀次韵为谢并呈同社诸名胜
379637,适承再示佳句亦强勉再成
855479,和李士举陪提刑徽猷游中梁山临秀远轩以望江中平陆之胜承示佳句且叙故旧离合之感次韵二首 其一
1061235,不愚兄再示佳句如璧亦重用来韵
354477,兵部敏叔颁示佳句谨依原韵
855478,和李士举陪提刑徽猷游中梁山临秀远轩以望江中平陆之胜承示佳句且叙故旧离合之感次韵二首 其二
1006409,朝隐病疟作谴疟鬼文而差示佳句次韵
