478620,送程宫谕
383016,寄沈蛟门宫谕
620831,与孟郁守岁绪仲宫谕斋中
498804,用渠翁老师韵赠宫谕王槐野主翰留院 其一
531181,温民怀宫谕许于浣别墅相招恐失佳约作此戏简
659685,登李宫谕叙庵午风亭 其二
701388,用渠翁老师韵赠宫谕王槐野主翰留院
681833,冯佩之之江西督学和宫谕谢木斋韵
547051,送田钟台宫谕视篆南都二首 其二
629061,韩孟郁招同黄宫谕刘宪副高太守梁韩二明府暨苏梁诸公集浮丘步寅仲韵 其二
593484,送范宫谕赴留都掌院
617791,送吴玺卿兼寄何宫谕 其一
629064,韩孟郁招同黄宫谕刘宪副高太守梁韩二明府暨苏梁诸公集浮丘步寅仲韵 其五
660373,酬董文玉宫谕过访用前韵
383649,乙酉九月从李元甫宫谕再登峄山
629060,韩孟郁招同黄宫谕刘宪副高太守梁韩二明府暨苏梁诸公集浮丘步寅仲韵 其一
709698,何印尼太常招同刘安世司马陈忝生宫谕雨集分得来字
547695,乙酉九月从李元甫宫谕再登峄山
690996,韩孟郁招同黄宫谕刘宪副高太守梁韩二明府暨苏梁诸公集浮丘步寅仲韵
547660,寄罗康洲宫谕
693844,送吴玺卿兼寄何宫谕
531871,桂之树行为李宫谕寿母赋
560977,奉同温宫谕移疾寺居之作
615973,送黄士明宫谕典试留都
695462,登李宫谕叙庵午风亭
560965,冬闰和李宫谕
629062,韩孟郁招同黄宫谕刘宪副高太守梁韩二明府暨苏梁诸公集浮丘步寅仲韵 其三
560951,酬未斋宫谕见赠 其一
813922,秦对岩宫谕七十
549956,哭殉难十公用前韵 其五 宫谕湛陆刘公
666835,饮泉亭次张水南宫谕韵
560952,酬未斋宫谕见赠 其二
659684,登李宫谕叙庵午风亭 其一
383258,九月八日罗康洲宗伯黄仪庭司成田钟台宫谕习豫南司成会集朝天宫道院
383015,寄罗康洲宫谕
299644,何印尼太常招同刘安世司马陈忝生宫谕雨集分得来字
701377,次龚云冈宫谕赏莲韵
547050,送田钟台宫谕视篆南都二首 其一
617792,送吴玺卿兼寄何宫谕 其二
498739,次龚云冈宫谕赏莲韵 其二
629063,韩孟郁招同黄宫谕刘宪副高太守梁韩二明府暨苏梁诸公集浮丘步寅仲韵 其四
560981,温宫谕省觐
602559,区海目宫谕过访留夜酌
615970,黄宫谕樊水部同集小寓酌别谢大行册封崇府便道还里
561242,夕会顾宫谕兄姑苏驿下
629076,送黄仕明宫谕
547285,九月八日罗康洲宗伯黄仪庭司成田钟台宫谕习豫南司成会集朝天宫道院
803059,秦对岩宫谕七十 其三
521451,送宫谕李子阳先生赴南京太常少卿
600321,雨过即事简陈公望宫谕
659513,寿董颐斋郡伯宫谕中峰之叔
522080,荐溪宫谕省觐归赋诗末就而别八月七日礼部南斋独坐怅然有怀足成奉寄
609301,将至苏门途中寄黄平倩宫谕次见赠韵
717019,送孟宫谕
803057,秦对岩宫谕七十 其一
522089,伯畴宫谕登第予同考春闱今年又得其子彦式魁省试伯畴可谓不亡而予亦与有荣矣彦式告归逆妇俯仰慨然赋此为赠
562705,詶韩宫谕若海
655111,用篁墩宫谕韵贺樊驸马大振总禁兵宿卫
547335,告中冯用韫宫谕朱可大丞卿见过
494935,李宫谕母太淑人八十寿诞
682266,送田钟台宫谕视篆南都二首
498805,用渠翁老师韵赠宫谕王槐野主翰留院 其二
521636,考试应天泊龙江和宫谕傅先生韵
547132,燕子矶歌呈李棠轩宫谕
659527,寿宫谕叙庵李先生母边夫人
609175,奉送宫谕赵先生之南大司成
662460,送毛宫谕兄文之
600353,雨中感秋和陈公望宫谕韵
547662,寄沈蛟门宫谕
498738,次龚云冈宫谕赏莲韵 其一
803058,秦对岩宫谕七十 其二
522130,对雪次未斋宫谕韵
382758,告中冯用韫宫谕朱可大丞卿见过
615111,送傅寄庵宫谕册封周藩
560972,赠董宫谕
688654,酬未斋宫谕见赠
