1099437,天末遇周子俊自行在还言石屏消息
258188,遇周永昌·幼时种木巳巢鸢
372966,天末遇周子俊自行在还言石屏消息
834053,湘月 遇周意皆于朗江舟次，谈春明旧游，感赋
116780,感遇·周王仗黄钺
123855,己丑五月被召至行在遇周畏知司直和五年
1079887,长葛道中遇周原仲
439360,四月十日遇周永昌二首
594427,同汪主客李司封遇周计部元孚饮江上
816637,六安遇周八即送之临淮
437864,四月十日遇周永昌二首 其二
1123641,同成父弟访王亢宗遇周钦止同过圆通看竹二首
749697,六安遇周八即送之临淮 其一
448282,道遇周锡䪖戏赠
258187,四月十日遇周永昌
437863,四月十日遇周永昌二首 其一
972393,同成父弟访王亢宗遇周钦止同过圆通看竹二首 其二
97559,同成父弟访王亢宗遇周钦止同过圆通看竹
956356,己丑五月被召至行在遇周畏知司直和五年前送周归弋阳韵见赠复次韵答之
514244,济宁遇周仲瞻黄门夜酌
594223,邳州遇周比部子仁北上
749698,六安遇周八即送之临淮 其二
972394,同成父弟访王亢宗遇周钦止同过圆通看竹二首 其一
493452,遇周道士
