187101,乙卯七月庚子魁祀礼成同舍诸新元相与宴拟鹿
355173,皇帝郊祀礼毕诣景灵恭谢次履中学士韵
1038532,大祀礼成
1045852,郊祀礼成诗
640260,韩国公曹国公暨中山侯等官奉旨诣岳镇海渎行报祀礼早朝赋诗呈别
543578,褒忠祠祀礼成代直指萧公作
1074589,清庙斋幄常有诗赐太师已曾和进禋祀礼成以目击之事依前韵再进今亦用元韵复赐太师非特以此相困盖清时君臣赓载亦一时盛事耳
1208143,到京之七日，亲祀礼成，闻喜有作，简曹奉常
1216973,庚辰十月朔奉迎明宗册宝至石佛寺明日壬辰迎至太庙清祀礼成赋以纪事
225759,奉祀礼成宴
228525,奉祀礼毕饮福有感偶成
1217113,十一月六日大明殿贺清祀礼成
960744,乙卯七月庚子魁祀礼成同舍诸新元相与宴拟鹿鸣也故敢亦拟劝驾诗呈幸领此意
576498,十月二十二日四望山陪祀礼成呈诸执事
976614,奉祀礼毕还京
976595,奉和御制奉祀礼成宴
225709,奉祀礼毕还京
592094,癸亥明堂大祀礼成纪事
1051807,皇帝郊祀礼毕诣景灵恭谢次履中学士韵
911678,奉祀礼毕饮福有感偶成
809300,告祀礼成宴诸臣于旧宫
361855,清庙斋幄常有诗赐太师已曾和进禋祀礼成以目击之事
519643,送齐应璧鸿胪脩祀礼成还朝
492159,八月三日晚圣驾夕月清凉山上陪祀礼成喜赋
