28619,古乐府·一叶随西风
108850,献帅府·一饭感恩无地报
388417,贻张明府·一官知久厌
566027,送皇甫子循黄州推府一首
962491,送张伯修省干归省重庆府一首
565656,送表弟王曰俞之武冈州岷王府一首
173076,庚午岁伯氏生朝作乐府一章为寿
586680,又乐府一首
1103968,馀干学录徐君名桂蟾号月斋龙游人善文词善谈方外之学春晚来山中谈七日乃别今重到玄妙寄乐府一阕赋此为别
489482,心远楼为瀚上人赋并发同席郑明府一笑
1238992,宋竹坡与余有延桂看菊之约竟不及赴赋乐府一章以寄之
217235,赠胡明府·一琴牢落倚松窗
1172002,七言登北山寺西阁楼冯禅师茶酌赠崔少府一首
451910,新乐府一首
863131,庚午岁伯氏生朝作乐府一章为寿
951113,唐世有刺郡江表者时宰嘱以新淦出笔令制以寄刺史始至召佳手一老父应命百日而得二管驰贡相府一见已讶其迟且鲜试之乃绝不堪大怒曰数千里乃寄两管恶笔来刺史闻之惧欲寘老父于罪老父诉曰使君毋草草我所制乃欧褚所用丐先示以相君翰墨容再制苟不称甘鼎镬遂示之慨然曰如此只消使君三十钱笔不日献五十管暨再使至长安相一试大喜复书令优赐匠者夜窗偶试毗陵张颢笔戏为之赋
1211226,桃花雨乐府一章寄翼之
228326,古乐府·一入经战场
571147,宿亨二明府一室萧然喜而赋此且慰公怀云
