1140271,文公书厨 出此谟训
400228,水龙吟 林霭女弟模伫晴阁青山无恙图卷，深为李居端所激赏，谓足以乱己之作，并曾许亲为跋识。讵装池未竟，而居端遽归道山，林霭亦远游海国，死生两诀，人事叠更，癸丑初春，区季谋出此卷嘱为题词，感逝伤离，曷胜枨触
278422,镇山·昔有虹霓出此山
976816,方外诗友机空二禅娄诧莲峰五月梅雨深林丛薄中娑罗花特异每以未见为恨夏初过此而桥东是花豫开岂应真大士出此以相劳耶
622143,今础久寓广济相需筮诸关圣得此时宾主欢相得他日王侯却并肩之语筮者方旋而余继至相晤出此竞叹灵奇因各诗以纪之
889587,泽民因诵乐天欲留年少待富贵富贵不来年少去之句慨然有感遂广此意作诗相示余以谓人之会遇各自有时年少固不可留而时亦何可待乐天自不应出此语而泽民亦不应为此诗因反其意以和之 其一
569203,康生时万将归云间出此纸求识别援笔数语不复能论工拙也
1113876,予谪海外久矣蒙恩徙郴所寓适与苏仙邻暇日携儿徜徉历览遗集因阅本传不载致仙之因特以事母尽孝行耳自古仙真得道如吴真人之流未有不由此而致者世人不知出此多弃遗父母入深山穷谷中父母冻饿不恤也以此求道去仙远矣因成二小诗题之壁间庶亦少警欲学道而忘其亲者
893296,常山杨氏有二怪石奇险百状田曹张中行家雒阳遍见都中诸家所得异石皆出此下予他日思之恐常人忽而不珍作诗以诧其处并邀中行伯逢同赋
1071157,予谪海外久矣蒙恩徙郴所寓适与苏仙邻暇日携儿徜徉历览遗集因阅本传不载致仙之因特以事母尽孝行耳自古仙真得道如吴真人之流未有不由此而致者世人不知出此多弃遗父母入深山穷谷中父母冻饿不恤也以此求道去仙远矣因成二小诗题之壁间庶亦少警欲学道而忘其亲者 其一
817071,梦洪大亮吉忆旧时同出此途感吟二首
731119,丰登者朕之获福歉收者朕之失政出此入彼不能自恕故作近体一律以自遣
1071158,予谪海外久矣蒙恩徙郴所寓适与苏仙邻暇日携儿徜徉历览遗集因阅本传不载致仙之因特以事母尽孝行耳自古仙真得道如吴真人之流未有不由此而致者世人不知出此多弃遗父母入深山穷谷中父母冻饿不恤也以此求道去仙远矣因成二小诗题之壁间庶亦少警欲学道而忘其亲者 其二
1036462,点绛唇 其一 葛守坐上出此词，道思归之意，走笔次其韵
170347,出此谟训·仁心忧万世
458033,厂外卫生所侧，薄有小林，有树久为斧伐，但一根蔸，上残数枯株而已。予出此抽烟，忽见枯株生菌，轮绕而上，枯株尽为所覆，其美盖不可名状，因为赋此
784985,梦洪大亮吉忆旧时同出此途感吟二首 其二
889262,泽民因诵乐天欲留年少待富贵富贵不来年少去之句慨然有感遂广此意作诗相示余以谓人之会遇各自有时年少固不可留而时亦何可待乐天自不应出此语而泽民亦不应为此诗因反其意以和之 其二
1569,龙池篇·龙池初出此龙山
1111731,泽民因诵乐天欲留年少待富贵富贵不来年少去之句慨然有感遂广此意作诗相示余以谓人之会遇各自有时年少固不可留而时亦何可待乐天自不应出此语而泽民亦不应为此诗因反其意以和之
241205,挽山居刘侯官·渥漥生出此骅骝
1172910,至德二载甫自京金光门出问道归凤翔乾元初从左拾遗移华州掾与亲故别因出此门有悲往事
242292,西天目·苕水之源出此山
570675,百谷别余礼补陀出此扇索题走笔戏之
784984,梦洪大亮吉忆旧时同出此途感吟二首 其一
1058243,张长史今岁仍得见于越上长史遂出此展之可爱成佳物也主者宝之
