664246,董启之按滇过鄞省母夫人焚黄于父墓作难将寸草心报得三春晖十章赠之 其三
1071146,戊辰冬与邻士纵步至吴由道书会所课诸生作梅花诗以先字为韵戏成一绝句后三年由道来昌化索前作复次韵三首并前诗赠之 其三
719428,某君年七十馀纳双妾赋以赠之 其三
587592,赵子銮守顺庆清才有志于古书此赠之 其三
1024765,泐潭暹上人出示延福颂古三首索鄙语因用其韵赠之 其三
509890,神泉八景为饶鉴赋其四赠之 其三 茶山分香
1243919,送李本存归江西新喻州本存儒学教授历省掾为御史所论改温州海隅巡尉赋三律赠之 其三
717463,姬人墨西氏生日赋以赠之 其三
997009,柳闳展如子瞻甥也其才德甚美有意于学故以桃李不言下自成蹊八字作诗赠之 其三
1100127,王日起谋请乐轩先生主席其乡隐山堂喜以诗赠之 其三
557348,芜湖遇陈山人鹤席上分韵三首赠之 其三
1082643,刘世美宅新架诗礼堂莱衣阁来薰台游息轩养心斋以五偈赠之 其三
716051,携公新栖仙掌峰诗以赠之 其三
570070,梁内史奉诏为谭司马治墓便道归省访余弇园得三绝赠之 其三
716372,喜侃士病愈赠之 其三
996474,圣柬将寓于卫行乞食于齐有可怜之色再次韵感春五首赠之 其三
715338,尹君七十又一生日赠之 其三
905312,客有写真者见予因以三诗赠之 其三
1064692,愿监寺自长沙游清修依元禅师兴发复入城余口占四首赠之 其三
776503,陈迂谷中翰维英移居狮子岩斋额曰栖野巢赋此赠之 其三
459921,十一月肖将往宁乡故里。忆予向年尝随肖归乡度岁，数日间遍饮其亲族，乃作此赠之 其三
1077558,吴元中书言近不作诗以所著豳七月诗义见示因成三篇赠之 其三
1054316,方逢原借示方干先生诗以集句诗赠之 其三
716401,林叔君六十生日赋以赠之 其三
549824,予独宿太平山房果清上人远顾云欲复归宗寺予再三难之渠心甚坚予熟察其愿力学力必有合也漫书三绝赠之 其三
648719,杨学士乃弟仲宜归建安以道中五景求诗赠之 其三 金山晓钟
