948649,邦衡置酒出小鬟予以官柳名之闻邦衡近买婢名野梅故以为对
1141931,江鱼少赋者思杜少陵青青竹笋迎船出白白江鱼入馔来虽非此江鱼然可与吴郡志所载楝子花开石首来箧中紫被舞三台为对戏赋一诗
989525,中秋前一日邀贺子忱为对月之款乃审放意山林扁舟东去引企不已偶得小诗
802445,余傍资水溯流采金遂穷序水之源贪其山水或冒雨陵雪坐卧松泉至数日不返受障气饮毒泉前后历年至戊申夏五又泛洞庭浮沅遍涉辰鼎渐诸水水中大洲率新淤水皆有毒居之者辄病疟余亦染焉客益阳就医六月廿七日日加申见一人杂诸人中但有身首无腰足问左右皆不见乃鬼也至七月朔酉时若虢太子之尸蹶者炊许觉魂游空虚中余素有离魂病然尚知魂与我为对待者此日则不知有我嗒然若丧其一乃真死也左右疾呼之以千数始苏心先明目乍黑乍明又良久口始能言他医皆
802444,余傍资水溯流采金遂穷序水之源贪其山水或冒雨陵雪坐卧松泉至数日不返受障气饮毒泉前后历年至戊申夏五又泛洞庭浮沅遍涉辰鼎渐诸水水中大洲率新淤水皆有毒居之者辄病疟余亦染焉客益阳就医六月廿七日日加申见一人杂诸人中但有身首无腰足问左右皆不见乃鬼也至七月朔酉时若虢太子之尸蹶者炊许觉魂游空虚中余素有离魂病然尚知魂与我为对待者此日则不知有我嗒然若丧其一乃真死也左右疾呼之以千数始苏心先明目乍黑乍明又良久口始能言他医皆
127992,中秋前一日邀贺子忱为对月之款乃审放意山林
1033706,读严粲诗风撼潇湘覆江空雪月明以其一联隐括为对
948715,前岁冬至与胡邦衡小语端诚殿下道值夏旧事今年邦衡举易纬六日七分之说辄用子美五更三点为对后数日得刘文潜运使书记去年馆中团拜人今作八处感叹成诗
816594,余傍资水溯流采金遂穷序水之源贪其山水或冒雨陵雪坐卧松泉至数日不返受障气饮毒泉前后历年至戊申夏五又泛洞庭浮沅遍涉辰鼎渐诸水水中大洲率新淤水皆有毒居之者辄病疟余亦染焉客益阳就医六月廿七日日加申见一人杂诸人中但有身首无腰足问左右皆不见乃鬼也至七月朔酉时若虢太子之尸蹶者炊许觉魂游空虚中余素有离魂病然尚知魂与我为对待者此日则不知有我嗒然若丧其一乃真死也左右疾呼之以千数始苏心先明目乍黑乍明又良久口始能言他医皆
645794,主上于奉天门赐坐焚香供茶午就赐斋问以宗门大意首以灵山付嘱继以迦叶感化为对喜赋诗以献
