811043,裴伯谦同年将南归宋子顿侍御方筱泉观察随少伯制军之幕兰州定甫上公星桥中丞邀集同人宴之于依斗亭佐以西域偎郎之舞因赋小诗志别二首
803996,裴伯谦同年将南归宋子顿侍御方筱泉观察随少伯制军之幕兰州定甫上公星桥中丞邀集同人宴之于依斗亭佐以西域偎郎之舞因赋小诗志别二首 其二
568423,昨弘治辛酉南畿秋试获识吴江钱廷辅廷佐兄弟若联珠骈璧文采映射心窃赏之既别去无从晤言时时往来于怀今嘉靖丁亥夏廷佐以扁舟访予江村始知廷辅方应郡贡去而廷佐先领正德己卯乡荐矣转盻三朝垂三十载而予亦老矣为之感叹次韵奉荅
1190736,余自刑部员外郎为权所挤值盘石出镇藩屏朝选宾佐以余充职掌记郁郁不乐因成长句寄所知
803995,裴伯谦同年将南归宋子顿侍御方筱泉观察随少伯制军之幕兰州定甫上公星桥中丞邀集同人宴之于依斗亭佐以西域偎郎之舞因赋小诗志别二首 其一
946971,毕履和惠端砚余以大歙砚报之佐以一诗
183582,毕履和惠端砚余以大歙砚报之佐以一诗
1057363,黄鱼鲊寄狄复之因佐以诗
1052092,君时与董君佐以乡荐相次登甲科有诗送之邀予同赋
354904,君时与董君佐以乡荐相次登甲科有诗送之邀予同赋
