639155,访曹西泉侍御山居二首 其二
710295,访曹秋岳侍郎
1086133,访曹梦良
736826,过槜李访曹秋岳先生不遇
130972,到永固寺访曹约斋
322990,访曹梦良·我自箫峰下
1086657,次韵范子芬雪中同访曹功显
795154,忆秦娥 晚步访曹苇坚
428357,香山访曹雪芹遗址
1057297,访曹副宫不遇留题
945269,到永固寺访曹约斋
302100,访曹秋岳侍郎
543911,访曹子念戏赠
629233,过姑熟访曹元甫光禄 其一
639154,访曹西泉侍御山居二首 其一
497309,访曹子念
455367,三访曹雪芹故居口号
497605,病起访曹子念
569878,虎丘西僧房晨访曹茂来居士山阁小饮
487477,娄水行访曹子念作
629234,过姑熟访曹元甫光禄 其二
691005,过姑熟访曹元甫光禄
341763,次韵范子芬雪中同访曹功显
521771,过锦溪访曹古松时年九十二以不及再见送予甚远为之怆然临别赠此
695327,访曹西泉侍御山居二首
1242022,干山访曹雪林刘深云周云坞看菊花云庄有诗次其韵
787045,访曹雪芹不值
360154,访曹以南五明寺
