695086,汝南赵良弼顷以中丞出抚荆襄遂南至于衡岳望予于岭外因使使讯焉且示近作及先后见梦诸篇予乃掇其略和之凡得四首聊以寄怀云尔
1086529,前韵虽险用之未尽掇其馀复成三百言
597981,汝南赵良弼顷以中丞出抚荆襄遂南至于衡岳望予于岭外因使使讯焉且示近作及先后见梦诸篇予乃掇其略和之凡得四首聊以寄怀云尔 其一
558340,进士卞华伯奚元启用齐字韵联句因掇其遗韵
597984,汝南赵良弼顷以中丞出抚荆襄遂南至于衡岳望予于岭外因使使讯焉且示近作及先后见梦诸篇予乃掇其略和之凡得四首聊以寄怀云尔 其四
1088610,读十二辰诗卷掇其馀作此聊奉一笑
1134163,读陶集爱其致意于菊者八因作八首 其七 七曰秋菊有佳色裛露掇其英
245286,歙南汪叔和示以新吟掇其卷首一篇次韵归之
918334,歙南汪叔和示以新吟掇其卷首一篇次韵归之
597983,汝南赵良弼顷以中丞出抚荆襄遂南至于衡岳望予于岭外因使使讯焉且示近作及先后见梦诸篇予乃掇其略和之凡得四首聊以寄怀云尔 其三
597982,汝南赵良弼顷以中丞出抚荆襄遂南至于衡岳望予于岭外因使使讯焉且示近作及先后见梦诸篇予乃掇其略和之凡得四首聊以寄怀云尔 其二
