1079265,获从枢密徐公游者累月虽接名理不敢言诗念挥斤般郢之门古人所诮也日者恶语流传不图彻听过蒙奖誉形之篇什辄复次韵叙谢
948646,邦衡侍郎再惠春字韵诗次韵怀旧叙谢且致登庸之祝
1033328,见淮东制帅赵南仲侍郎相待厚甚特送买山钱又欲刊石屏诗置于扬州郡斋话别叙谢
883735,春秋终讲伏蒙知府谏议临视学舍宴劳诸生谨成小诗叙谢
644593,仰德之深非言可喻谨次渊明九日诗韵叙谢万一
228780,又叙谢·竹翁恶俗客
948501,七兄初约登新楼作重阳敦前岁之盟适病足不能出佳篇送鱼酒且及二苏逍遥堂风雨之句次韵叙谢并为后约
999881,某前日以鄙诗叙谢通判国博特垂宠和谨复依韵上答
948721,某昨蒙宝文待制辄送扬州红都胜欲占小诗叙谢怯大巫而止兹者贤郎明府相过屡索芍药诗实不曾作谨用前意成四韵拙迟可笑
989035,王元龙惠新制辄依末后耘田韵叙谢
152350,某昨蒙宝文待制辄送扬州红都胜欲占小诗叙谢
355791,彦章屡顾郊居叙谢
1237550,王仪伯参政见和郊字韵诗复用韵叙谢二首
1223782,王仪伯参政见和郊字韵诗复用韵叙谢二首 其二
918522,又叙谢
152181,邦衡侍郎再惠春字韵诗次韵怀旧叙谢且致登庸
158334,某前日以鄙诗叙谢通判国博特垂宠和谨复依韵
641454,伏承陜省卜架阁以臈粥稻米相馈麟游危赞府亦寄鹿脯到斋赋此叙谢
1070466,彦章屡顾郊居叙谢
883715,仲春上丁知府金部躬率僚寀释奠于先圣既而升公堂命学官讲书窃惟中庸之篇自安定先生常以是诲人阅岁既久嗣音者希某孤陋无似窃慕前哲其启讲也今龙阁黄公尝临之其终讲也金部使君又临之郡儒在列咸与荣观辄成五言律诗二十韵叙谢
989893,江神子/江城子 谹父以昔年梦诗寄为长短句，因韵叙谢
895409,宫使枢密富丈和篇高妙所谓压倒元白末句许予尤非所敢承谨用前韵叙谢
641499,伏承士景明府增广学舍招致生徒借韵叙谢
1223781,王仪伯参政见和郊字韵诗复用韵叙谢二首 其一
948667,杨廷秀秘监万花川谷中洛花甚富乃用野人韵为鱼儿牡丹赋诗光荣多矣恶语叙谢
128062,王元龙惠新制辄依末后耘田韵叙谢
