164915,六月十五日诣水公庵雨作
972256,六月十五日时闵雨甚矣三首 其二
819881,六月十五日夜同九兄四弟五弟步至飞来峰看月
359847,百字令·六月十五日京闱题壁
650638,六月十五日哭子添禄作
1224559,六月十五日大雨雹行
96778,六月十五日时闵雨甚矣三乎
416973,月下笛 六月十五日，夜漏三响，香梦出床，四顾阒然，因移坐阶前绿荫下，皓月当空，暑气顿失，篱根乱蛩，声声如诉怀抱，惜无素心人来共酌酒，一领此幽凄况味也
1063949,六月十五日夜大雨梦瑩中
970886,七月六夜闻雨寄怀钦止斯远而玉山使来亦得斯远六月十五日怀去年夜雨之绝句复次韵以报
972255,六月十五日时闵雨甚矣三首 其三
956862,六月十五日夜汎西湖风月温丽
1090431,闻六月十五日厅屋以二绝句寄衢 其二
972254,六月十五日时闵雨甚矣三首 其一
884395,六月十五日西湖宿斋
307869,月下笛·六月十五日，夜漏三响，香梦出床，四顾阒然
885066,六月十五日诣水公庵雨作
774246,甲申1884初夏法夷窥伺台北兵轮游奕不绝六月十五日攻燬基隆炮台旋据口岸久而不退诗以志愤　
1090430,闻六月十五日厅屋以二绝句寄衢 其一
1089312,六月十五日西湖夜泛高炳如集客赵临安蟠老致饷同游者陈可行杨少云李元德王顺伯何绍彭张宗尹杨氏子弟侍僧方与焉次炳如韵
1131476,闻六月十五日厅屋以二绝句寄衢
1123768,六月十五日时闵雨甚矣三首
468405,甲寅六月十五日夜荪溪书舍玩月有怀任鲁民先生时任巳逝
674365,六月十五日夜大雨病中作
765646,百字令 其七 六月十五日京闱题壁
122196,六月十五日夜泛西湖风月温丽
303930,六月十五日夜同九兄四弟五弟步至飞来峰看月
561960,六月十五日夜坐明德堂
867457,贺新郎 其四 六月十五日夜西湖月下
208763,六月十五日西湖宿斋
