830847,有人述南中时论谓洛阳近出魏代元氏志皆吾辈伪造忽蒙盛誉惊喜愈望小诗纪之 其二
157728,九月初十日山房午睡恍见梅枝已吐白矣惊喜而
830849,有人述南中时论谓洛阳近出魏代元氏志皆吾辈伪造忽蒙盛誉惊喜愈望小诗纪之 其四
830848,有人述南中时论谓洛阳近出魏代元氏志皆吾辈伪造忽蒙盛誉惊喜愈望小诗纪之 其三
400329,缅甸蒲甘（Pagan）石洞，壁绘蒙古骑士，惊喜题此，次东坡开元寺韵
843871,有人述南中时论谓洛阳近出魏代元氏志皆吾辈伪造忽蒙盛誉惊喜愈望小诗纪之
830846,有人述南中时论谓洛阳近出魏代元氏志皆吾辈伪造忽蒙盛誉惊喜愈望小诗纪之 其一
888695,言老自云堂携十六大士画像见过与世间传写者不同惊喜赞叹因成二偈 其一
962372,畅伯圭父子下第归乡携嗣由广文书并手佳章宠贶正旧读程门遗书知有潜道者列由求之间今见伯圭父子姓名不胜惊喜因问家世出处果潜道近族遂用其韵反其意出鄙语以谢庶几朋友相与切磋之义也
268523,有人述南中时论谓洛阳近出魏代元氏志皆吾辈伪造忽蒙盛誉惊喜愈望小诗纪之
641344,仆与进成簿吕公别七八年矣今兹西行道出钟离进成适佐是邑相见城南涧阿为予惊喜买酒相劳苦同榻涧西土室中夜兴感惜予远去故意甚长口占一首以写鄙怀
1005117,九月初十日山房午睡恍见梅枝已吐白矣惊喜而作
170522,石堂·闻言惊喜是家山
1111856,言老自云堂携十六大士画像见过与世间传写者不同惊喜赞叹因成二偈
656888,易庵李令誉同学郡庠别二十载见予金牛惊喜交集敬酬元倡
568583,予素不能饮酒昨至成都僚友并劝予蜀烧酒云可祛暑湿也命家童以蜜和之初吸半盏渐至引满复能加一酌极有效自后每晨起便饮饮之辄冲和与年少时苦酒迥异不意老来始知其趣乃尔日饮两三度陶如也家童惊喜谓自饮酒来颜色颇异岂于此将有所得耶笑成一绝
559626,别凤藻与予考选同年分袂四十年矣顷晤令侄广文松心道其春秋九十有一惊喜倍常因忆万历中谢松屏毕松坡并登九十袁中郎捧诏存问作有双松诗今凤翁越九犹健大瑞奇绝忭赋一律书似松心因托寄声以代柬也
558514,郭总戎率僚吏饯予于查山初发矢有雉惊起于麦陇继发一矢雉即毙众惊喜而贺予口占一绝
888694,言老自云堂携十六大士画像见过与世间传写者不同惊喜赞叹因成二偈 其二
106281,悲歌·忧惊喜愕梦纷纷
63205,拟古·惊喜君王至
428034,临江仙·与晋江丘生立字豫凡一别近卌年矣，每逢泉厦客来，辄托代为探访。忽得生从马尼拉寄到贺年片，惊喜欲狂，辄拈秃笔蘸焦墨涂鹭门惜别小帧以寄豫凡，知当于春节爆竹声中为发一大噱也
1213204,乙酉暮秋朔旦偶会陈鲁彦先生辅伯贤理问崔鼎新太守孟子周佥司于汴梁客舍数分携之期凡四十寒暑矣嗟岁月之遄迈思薄宦之徒劳惊喜相对恍然如梦因述怀呈诸公
830850,有人述南中时论谓洛阳近出魏代元氏志皆吾辈伪造忽蒙盛誉惊喜愈望小诗纪之 其五
787010,芹圃曹君别来已一载馀矣偶过明君养石轩隔院闻高谈声疑是曹君急就相访惊喜意外因呼酒话旧事感成长句
