632943,夜雨怀傅陈二子二首 其二
606387,送苏陈二比部考绩北上二首 其二
60443,斋居呈陈二高三兼似故人黄玄林敏及从弟
1858,同宋参军之问梦赵六赠卢陈二子之作
1086789,戏孙陈二弟 其四
607065,胡陈二参军父子洎姚韩诸君同集河亭各用姓为韵
125410,览中丞尚书谯陈二郡新诗
564423,送陈二尹部运还松
1086787,戏孙陈二弟 其二
524760,春夜歌立春夜试灯同张陈二进士饮后作
377014,刀镊黄陈二生
1091399,冬日予与六人者游焦山谒圜禅师访瘗鹤铭断碑及焦公丹台怆然有怀兼柬朱陈二友陈方病目而朱校易未毕
514384,饮王陈二真人园亭
7574,赠陈二补阙
6873,伤歙州陈二使君
636983,送李陈二子赴中宿 其一
542056,宿少林寺同莫陈二秀才
732473,过陈二如读书处
966600,怀寄彭城朋好十首 其六 陈二
272584,洞仙歌·陈二山空房对月图
581711,用韵期杨陈二同寅枉顾小叙
581382,送修书黄陈二进士事竣北还 其二
1173432,赠陈二补阙
668008,夜酌舒陈二子
658237,黄公山钓台浸水荅陈二教先生 其一
645099,赠常熟陈二尹
7027,宋中遇陈二
1187134,宋中遇陈二
762307,寄耀州牧陈二濂村
502125,雪中书怀歌和范平仲韵奉寄黄陈二亲
1156063,访陈二
685995,送苏陈二比部考绩北上二首
18393,访陈二·晓垂朱绶带
1122841,戏孙陈二弟
689615,送修书黄陈二进士事竣北还 其二
503347,暮春赠别方陈二公游泉城
713686,赵陈二烈女
342070,戏孙陈二弟
716663,赠陈二游
717341,陈守戎招饮同王陈二君分赋
687785,黄公山钓台浸水荅陈二教先生
551404,送陈二表兄重游高州兼柬诸旧好
532146,秋日宴凤来亭呈同游符陈二使君
604302,过陈二酉绿水园时二酉客金陵
533108,陈侍御道襄招朱陈二使君同集
739685,次陈二乳巢韵
1250949,题九华山图为陈二守
676066,游青萝岩简同行汪陈二知己
720341,阎陈二公祠
88138,柬惠安同安叶陈二明府并烦安溪林明府寄似
598823,东门别业为陈二山太守题
1161771,奉和史馆张阁老以许陈二阁长爱弟俱为尚书郎伯仲同时列在南北省会于左掖因而有咏
445714,景德镇客中余兄招偕刘陈二子茶楼夜坐分韵得水字适闻次日大幅降温
1043292,去陈二首 其二
482757,斋居呈陈二高三兼似故人黄玄林敏及从弟
636986,送李陈二子赴中宿 其四
742427,陈二西招同渌饮泛湖至南山而还
593230,黄太史懋中席高陈二文学同集
1129860,刀镊黄陈二生
636985,送李陈二子赴中宿 其三
581381,送修书黄陈二进士事竣北还 其一
563835,游通天岩示邹陈二子
575509,秋日饮孙协镇葡萄园，忆北平傅、陈二使君
877065,柬惠安同安叶陈二明府并烦安溪林明府寄似
623851,程陈二参戎招同倪郡丞翁水部朱季美饮崧台分赋得云字
544979,别章陈二进士
488134,七夕集社中诸子迟柯陈二孝廉不至得槎字
658827,宿卢氏芝秀堂留别师邵师陈二首 其一
1020181,刀镊黄陈二生 其一
602973,关黄欧三文学枉过持陈二山人所寄赠章率尔酬答因订中秋之约
503582,送陈二林粮长运军储之海城
1020182,刀镊黄陈二生 其二
636984,送李陈二子赴中宿 其二
658238,黄公山钓台浸水荅陈二教先生 其二
1109274,去陈二首
688018,送李陈二子赴中宿
607589,送任陈二子西游
1056780,十月二十日过陈二表民追讲昔年同学事迹慨然赠之以诗
584152,三月晦汶川北谒诸葛武侯涪翁太史祠与晁陈二参相山亭宴别
1086786,戏孙陈二弟 其一
658828,宿卢氏芝秀堂留别师邵师陈二首 其二
703551,夜雨怀傅陈二子二首
1086788,戏孙陈二弟 其三
1176868,同宋参军之问梦赵六赠卢陈二子之作
632817,同傅陈二子看喜哥
538306,送陈二刑部出守彰德
685298,宿卢氏芝秀堂留别师邵师陈二首
893068,览中丞尚书谯陈二郡新诗
13480,奉和李给事省中书情寄刘苗崔三曹长因呈许陈二阁老
329441,十月二十日过陈二表民追讲昔年同学事迹慨然赠之以诗
446231,闻酒老传刘陈二公有端午五言诗约勉成
606386,送苏陈二比部考绩北上二首 其一
1161775,奉和李给事省中书情寄刘苗崔三曹长因呈许陈二阁老
1172013,伤歙州陈二使君
1043291,去陈二首 其一
265622,陈二西招同渌饮泛湖至南山而还
1231608,金石交为孙陈二义士赋
707222,寄怀陈耳臣兼怀安福陈二止
632797,同傅陈二子送北里之堡中
545392,夜同胡孟韬龙君超杨世叔三孝廉周陈二山人集宋忠父第观梅花繁英盛开芬郁殊绝适侯万二都尉在坐琳琅珠玉与花艳相映发同集诸君应接不遑余倾赏丙夜几欲醉卧阁中作赵师雄罗浮梦矣归赋一律似忠父并博笑侯万二君
632942,夜雨怀傅陈二子二首 其一
502127,雪后喜晴三用韵奉寄黄陈二亲一笑
