600897,寄吴明卿大参
1233156,前御史杨元诚辞官归第御书山居二字赐之公卿大夫赋诗以荣其归余访旧万松山拜观宸翰及诸吟卷席间以重来休沐地真作野人居分韵得居字
687220,读李世卿大厓文集二首柬乃弟立卿宪长
999576,月卿大师以书抵予言到自永嘉今将还杭因索诗送行聊书短章塞来请之勤
581572,送陈祐卿大参之闽
569963,承明卿大参以诗见贺司寇之迁且订修真之约而所托似非其人聊以奉酬且示微风 其一
683586,承明卿大参以诗见贺司寇之迁且订修真之约而所托似非其人聊以奉酬且示微风
592349,酬许殿卿大梁见寄
89103,咸淳龙飞大魁之归卿大夫以某兄弟有一日之长
159840,遗吴冲卿大飨碑文
915213,戏作司花谣呈詹进卿大监郎中
649584,太平圣德诗十章 其十 皇上仁圣之心惟在与民同乐故载于玺书先后一致今岁灯夕预沐恩荣者自公侯卿大夫下至京城内外介胄之士市廛之夫近而郊坰畎亩之氓远而冰天炎徼之使皆得仰瞻光华心存铭戴为与众同乐之诗第十
530383,读李世卿大厓文集二首柬乃弟立卿宪长 其二
877041,咸淳龙飞大魁之归卿大夫以某兄弟有一日之长俾主其事水村农卿谓某当为诗为壶山唤回百年英灵之气客散诗成翌早录呈且约同社属和 其一
658624,送李茂卿大理还嘉鱼
569964,承明卿大参以诗见贺司寇之迁且订修真之约而所托似非其人聊以奉酬且示微风 其二
600856,大梁逢吴明卿大参张子承佥宪学阁夜宴留别一首
158041,月卿大师以书抵予言到自永嘉今将还杭因索诗
877042,咸淳龙飞大魁之归卿大夫以某兄弟有一日之长俾主其事水村农卿谓某当为诗为壶山唤回百年英灵之气客散诗成翌早录呈且约同社属和 其二
561707,送曹际卿大参
219809,李隐卿名谷与青城刘翁同舟至兰溪卿大夫修生
1026919,遗吴冲卿大飨碑文
94443,戏作司花谣呈詹进卿大监郎中
569934,陈先辈子卿大宗伯公子也美秀而文亡弟太常有拂拭之契访我白下论诗契合寻上公车饮而赠之
628794,赠王羽卿大将军
530382,读李世卿大厓文集二首柬乃弟立卿宪长 其一
1108779,咸淳龙飞大魁之归卿大夫以某兄弟有一日之长俾主其事水村农卿谓某当为诗为壶山唤回百年英灵之气客散诗成翌早录呈且约同社属和
518578,和李茂卿大理见寄
569770,吴明卿大参挟方山人仲美王太学行父以三月三日访我弇园与家弟敬美曹子念骐儿小集分韵得林字
587735,九日与招勤卿大尹登高
313367,湘月·余将出都，陈楚卿大使饯余于禺山馆
93146,送詹进卿大监出宣城
569108,别留都诸公卿大夫 其二
570030,过陆震卿大行读书处有赠
684039,别留都诸公卿大夫
569107,别留都诸公卿大夫 其一
1036702,李隐卿名谷与青城刘翁同舟至兰溪卿大夫修生者馆之道侣赠李诗云李郎涉世似虚舟片帆来渡楚江秋之句又毗陵家弟季文和此篇云梦蝶岂知真是蝶骑牛何必更寻牛老夫亦慕道者次韵和之记刘李事迹刘本书生工诗奇异飘然尘外也
826454,湘月·余将出都，陈楚卿大使饯余于禺山馆。出所画山水册嘱题，此越国纪游也。词以写之
868970,鹧鸪天 其五 次韵鲁卿大钱观太湖
386573,题沈槐卿大令《鄱阳大水纪事图》
914663,送詹进卿大监出宣城
