906308,自毗陵与兄弟避地南来约为连江之归中涂各以事留遂成独往念兹离乱易于隔绝作诗以寄之
1113880,琼惟水东林木幽茂予爱此三士所居虽无亭馆之胜而气象清远连日水涨隔绝悠然遐想各成一诗目为城东三咏 杜公司法
1070710,琼惟水东林木幽茂予爱此三士所居虽无亭馆之胜而气象清远连日水涨隔绝悠然遐想各成一诗目为城东三咏 其二 林曾城
427822,诉衷情 与罗莘田隔绝廿年，春明把手，感成此阕
520338,孔明天下奇才也其八阵一图鬼神莫测出师二表王业所关奈何天不祚汉而星殒中军可胜叹哉陈寿作史以将略非其所长真缪论也予因登西山绝顶遥望五丈原甚迩且见一祠在林麓间即侯庙也以隔绝未得一荐牲酒姑以诗吊之
636180,自英利抵徐闻一径迂回延袤百里万木蓊蔚百卉错绣身入其中如处翠幕从林隙见日已及亭午道俗殊情匪欣则怖古称仙源辽邈人境隔绝武陵之后未曾有也诗以纪胜
1200737,青山白云歌。思余嘉宾也，风尘澒洞，南北不通，音问隔绝，思而作之。嘉宾母梦吞云而生，小名云孙。
1147117,奉贺颜使君真卿二十八郎隔绝自河北远归
36614,奉贺颜使君真卿二十八郎隔绝自河北远归
1070709,琼惟水东林木幽茂予爱此三士所居虽无亭馆之胜而气象清远连日水涨隔绝悠然遐想各成一诗目为城东三咏 其一 杜公司法
710890,福州冬杪同钱塘孙大苏饮陈君湖亭时疏柳黄花林峦映带大苏指点佳处云恍见家湖山断桥也隔绝兵戈言念昔游共为感叹
711077,福州冬杪同钱塘孙大苏饮陈君湖亭时疏柳黄花林峦映带大苏指点佳处云恍见家湖山断桥也隔绝兵戈言念昔游共为感叹
