433426,己未除日与啸麓薄游翠微元旦复至其地车中口占成四绝
458538,予分配在岳化，暑假至其地，正肖健所居也。与姑母饭于其家。归车中赋此，记所与共语意也
672951,砻岩去吾郡城虽不远顾平生未始一游自去年冬仲至今年春季未半岁间乃获两至其地登览之馀喜而得诗
460550,蝶恋花　七月二十七再至其地不遇其人，因书二十五日赠叶事
305654,己未除日与啸麓薄游翠微元旦复至其地车中口占成四绝
803384,阅兴济减水闸议改为坝，命侍郎郎裘曰修至其地与总督杨廷璋、藩司周元理会堪集议，诗以示意
429485,己未除日与啸麓薄游翠微元旦复至其地车中口占成四绝 其一
773647,准提寺创建已百馀载供奉准提佛母并诸神佛为比丘尼住持焉后尼死失及星散阒其无人香火萧条只存前后二殿虽有北畔店屋作本寺香资然亦典质人家矣而寺宇坍塌炉冷烟消偶至其地令人生寥落之感嘉庆十三年1808增生陈廷瑜等倡议重兴次年即捐资赎回北畔店屋修葺前后两傍寺宇暨所倒坏店屋斋舍香火始复迨二十二年1817再小葺户牖瓦甍佛座神居颇称安稳二十五年1820复捐资重脩各殿堂妆塑佛像修置神龛补造器物又复灿然可观焉呜呼寺观盛衰
429488,己未除日与啸麓薄游翠微元旦复至其地车中口占成四绝 其四
470587,余买一小丘于铁山下登陟不数十武而尽揽湖山之胜尤于看梅为宜盖踞花之上千村万落一望而收之久欲作一小阁名为六浮六浮之名遂满人耳而阁竟不就友人邹孟阳见余叹息每欲代为经营今日始引孟阳至其地亦复叫绝不能已余因为作六浮阁图兼题一诗冀孟阳无忘此盟时丁巳八月十八日也
930481,三年前与儿辈步过东泾小岭得胜处可营别墅贫不能成偶复至其地怅然有感
429487,己未除日与啸麓薄游翠微元旦复至其地车中口占成四绝 其三
429486,己未除日与啸麓薄游翠微元旦复至其地车中口占成四绝 其二
