561808,恭纪恩赐诗 其二十四 赐御药如意饮五贴谕曰能治百病以八月望日修合
561744,嘉靖壬寅三月四日同勋辅五臣直宿西苑时雨适澍上召赐酒仁寿宫中谕曰寒春宵分召卿等饮一钟朕手注之酒殿中少看待雨略住出银钟带归圣恩隆渥前代所未有也恭赋近体二首志感 其二
688703,嘉靖壬寅三月四日同勋辅五臣直宿西苑时雨适澍上召赐酒仁寿宫中谕曰寒春宵分召卿等饮一钟朕手注之酒殿中少看待雨略住出银钟带归圣恩隆渥前代所未有也恭赋近体二首志感
991813,五月十七日四鼓梦与孺人在宫庭谢恩至尊令小黄门宣谕曰今日社与卿喜此佳辰便可作诗进来枕上口占
828392,辛未十二月至旅顺行在所上为僦小楼三椽并购铁床一长方桌二椅四饭碗菜碗小碟羹匙竹筋各四茶壶一茶杯四水壶二白铁镬二炒勺一小铁勺二乃至盥漱之具罔弗备皆上亲过目次日入谢谕曰患难君臣犹兄弟也其无谢此千古臣子受恩所未有者敬谨陈之一室以示子孙勿忘报称今岁壬申秋八月立之君任勉甫聚晤室中每至夜分因为之图并纪以诗
561743,嘉靖壬寅三月四日同勋辅五臣直宿西苑时雨适澍上召赐酒仁寿宫中谕曰寒春宵分召卿等饮一钟朕手注之酒殿中少看待雨略住出银钟带归圣恩隆渥前代所未有也恭赋近体二首志感 其一
