920444,沈谏议召游湖，不赴，明日得双莲于北山下，作一绝持献沈，既见和，又别作一首，因用其韵 其二
134401,景仁召游范东园马上口占
327627,奉和御制宣召游龙德西园
1061237,再次韵且召游山
674482,同礼部王南原黄德裕吏科潘希召游献花岩用潘韵
937591,沁园春 其二十一 送宗人景召游姑苏
99875,沈谏议召游湖不赴明日得双莲於北山下
99180,沈谏议召游湖不赴明日得双莲于北山下作一绝
872814,奉和陈德召游惠山见寄三十韵
579623,娄侍御召游茶山寺
1223912,题秦虢二夫人承召游华清宫图
586376,林见山召游大云山寺
1167346,下第卧疾卢员外召游曲江
379576,再次韵且召游山
586033,九月七日驻节苕溪承王方伯载酒召游岘山山有三贤祠奇峦秀峰仙阁禅宫掩映松竹之外凭高引目灏气渺然诚一郡佳胜也因赋短律用识高游
920443,沈谏议召游湖，不赴，明日得双莲于北山下，作一绝持献沈，既见和，又别作一首，因用其韵 其一
236308,奉和陈德召游惠山见寄三十韵
1058821,奉和御制宣召游龙德西园
1116619,沈谏议召游湖，不赴，明日得双莲于北山下，作一绝持献沈，既见和，又别作一首，因用其韵
29086,下第卧疾卢员外召游曲江
