516486,题玩月仕女
947615,哨遍 陈抑斋乞致仕
594473,送黄助教致仕还延平
668600,姚太仆思永致仕进秩光禄少卿
1250986,仕女障子
650576,赠李君元珙致仕还家 其二
1208595,道士王用亨父母高年作寿庆堂其上世蜀人仕宋今居江东
577112,送云南龙佥事致仕回桂林
652237,题何司训致仕卷
980593,说之方忧韩公表大夫疾遽致仕乃蒙传视送陈州王枢密诗十首意典辞丽忻喜辄次韵和呈以公若登台辅临危莫爱身为韵 其九
647706,题看花仕女
500247,送知县莫文渊致仕归钱塘
1112453,故端明殿学士工部尚书致仕清源王公挽辞二首
230903,再寄·馆阁飞声强仕年
872185,江南归附后不仕述怀
672511,送太医院使仲惟馨致仕
996216,送莫郎中致仕归湖州
1059124,送察推贾时以通直郎致仕还荆南
203516,嘲贺将仕·吾身西圛拘犹少
673442,送李守讷致仕南归诗 其二
575973,饯宋承旨潜溪先生致仕归金华七首 其三
81394,寒夜吟·仕宦孰不愿美官
672608,诏晋升吏部尚书致仕
555574,遣仕男归家
980587,说之方忧韩公表大夫疾遽致仕乃蒙传视送陈州王枢密诗十首意典辞丽忻喜辄次韵和呈以公若登台辅临危莫爱身为韵 其八
701263,致仕归言怀效吴体四首
797253,黄金缕 折梅仕女图
385272,送乔冢宰致仕还太原二
566952,读易园诗应一仕人之索
329820,题致仕袁成均燕申亭
122751,五言诗·贵仕龟钻笑
916340,朱侍郎致仕南归上特锡宴于玉津园仍诏两制三馆并预其会以伸祖送辄赋诗美之
479065,次韵任太常致仕留别五首 其一
487278,满江红 送友致仕
404600,忆江南·题谨怀绘红楼梦仕女图十首 其十 晴雯
664475,送钱水部致仕次杭秋官韵 其四
513618,送汪希颜佥事改仕湖广 其一
1246192,送李叔允脩撰致仕归钧州
1031554,送俞汝尚致仕还乡
446165,韩国学界为金退庵亡国后隐居不仕之节义征诗限韵，赋此二首以应 其二
488960,送某指挥致仕
479080,送杨君谦致仕
153065,周元翁·周郎强仕年
515536,寿致仕周二令先生
554504,送陈宗显致仕还乡 其三
933782,致仕后述怀六首 其四
352111,挽诗·仕路青霄逼
1125455,寿刘上舍将仕
384726,致仕还蜀·朝辞黄阁谢君王
1239396,题李伯时仕女图 其一 妾心不忆交河冷，手冷难裁金剪刀
614954,赠李中丞自滇中致仕还里 其三
136019,同年郑贵温寺丞直华文阁致仕次韵为贺
357177,误市俚言·欲借鸣蛙问仕途
980590,说之方忧韩公表大夫疾遽致仕乃蒙传视送陈州王枢密诗十首意典辞丽忻喜辄次韵和呈以公若登台辅临危莫爱身为韵 其二
201153,送石中允致仕归新昌
1249830,题张士厚四时仕女四首 其二
663339,奉赠少司徒华容王公致仕
134328,又和秋怀·畴革共登仕
1156086,初致仕后戏酬留守牛相公并呈分司诸寮友
494072,赠吾廷介致仕归开化诗四首 其一
672798,寄致仕司空李公时雍次韵
924139,送文太师致仕还洛三首 其二
926367,送人入北求仕
550514,题陈仕卿蕉雨亭
1123613,京兆王持正叔以特诏至阙下除将仕郎放归山意若不释然者于其行置酒以饯之
127500,得致仕喜成
577631,和刑部侍郎俞士吉致仕南归韵
609083,过高比部正甫斋中小酌无肴因共作贫仕诗
330238,和郭功甫赠陈待制致仕
682086,桃花仕女诗
50722,闻杨君谦致仕·都门祖帐百花飞
366513,石少傅致仕
835159,念奴娇 其一 为穰庼题仕女纨扇
677865,题叶仕晦后山亭
538571,寄致仕尚书山阴何公
554502,送陈宗显致仕还乡 其一
50719,闻杨君谦致仕·神武高冠挂急流
183886,恭和御制赐太师致仕文彦博五言六韵诗
152511,新光州守赵师奭字国佐才高一世仕京口以谗废
697887,送彭仕贞归涟川省亲
672943,送同知儋州事陈君汝坚进苏州府通判致仕归应城
660636,送田尚书致仕
59114,送人致仕归越
559137,九月十九辰德仕招饮时适邀黄将军为攺次日德进惠以二绝次韵奉答 其二
566339,题仕女图一首
959544,送石中允致仕归新昌
742724,道光壬午五月自曹镇任奉命致仕返黔俶装将行赋长句四章敬以纪恩兼用志别 其二
35083,和陈赞善致仕还京口
1026292,次韵玉汝弟乞致仕不允
704749,送孙俊先生致仕归鄢陵三首
822313,虞美人 李庄为宪民女彭令范画琵琶仕女扇面。宪民属题
869660,送光禄王卿致仕归荆南
383383,致仕还蜀·天书晓下禁门东
929779,致仕后即事十五首 其十
590830,包一山旧同僚擢守葭州遽致仕归赋此致赠
1112454,故兵部侍郎致仕安定公挽辞三首
702985,和答西涯见寄诸作致仕述怀韵
699291,题仕女
213849,送张卿致仕
560039,送唐舟御史致仕归广东
351436,故端明殿学士工部尚书致仕清源王公挽辞
650228,赠周子瓛致仕还永丰
509367,天顺癸未夏大司空南宫白公省堂之后以盆池植莲数本六月中旬有花亭亭出水间世传植莲须谷雨前过此而植则无花惟此莲五月才植今已相次盛发而初发一朵尤高洁可爱异于常品他公馆寓第虽先谷雨而植者犹未有花是诚司空公之贤超越群辈故造物者先时发此以彰美之况公以忠清刚正简在圣衷年逾强仕已峻擢柄用若此异时进台衡掌钧轴展大谋猷建大勋业以俪美古之大贤君子不卜可知是又必宰造化者预以此而示兆也前监察御史孟端之子公乘暇具酒肴延太子少保
202812,寄姜仕可·独学苦无友
133098,次韵田将仕年八十八岁作诗自喜
871123,次韵王将仕
675986,送张别驾致仕还汉阳
650646,赠康志高致仕还庐陵
67219,题红叶仕女
51195,次韵任太常致仕留别·篮舆朝出看山初
54134,送翰林宋先生致仕归金华
811840,道光壬午五月自曹镇任奉命致仕返黔俶装将行赋长句四章敬以纪恩兼用志别
1058974,说之方忧韩公表大夫疾遽致仕乃蒙传视送陈州王枢密诗十首意典辞丽忻喜辄次韵和呈以公若登台辅临危莫爱身为韵 其三
79801,绍兴中予初仕为宁德主簿与同官饮酒食蛎房甚
187631,贺陈子扬致仕追赠父母
89704,赠许登仕·蓬户无人来问疾
1049218,送莫和中刑部致仕归吴兴
863557,贺将作孔监致仕
494937,送杨石斋少师致仕
580189,甲辰仲冬十日会同年周世祥于杭酌酒联句五首时世祥已致仕矣故云 其二
520841,送张掌教致仕归临江
509043,三茅观与左迁钱学士致仕陈太常宴集分韵 其二 对字
1230173,题县令王从仕新建公宅
1157573,秦中吟十首 其五 不致仕
1101359,马顺文裒金买登仕为漕试计戏题其取青券
18806,和杨郎中贺杨仆射致仕后杨侍郎门生合宴席上作
695706,送大宗伯古林何公致仕南归二首
495559,满江红 以下四首皆致仕归作，和吕居仁。
1043515,李尚书除少保致仕
1062996,京兆王持正叔以特诏至阙下除将仕郎放归山意若不释然者于其行置酒以饯之 其二
652060,送李永年大参致仕十首 其十
168792,再赠寇司户·仕屈诸儒底
468817,题芭蕉仕女
652056,送李永年大参致仕十首 其六
857958,资善堂御筵送尚书刑部侍郎致仕李受归庐山
929781,致仕后即事十五首 其七
826262,浣溪纱·题竹阴仕女
661901,奉候林见素都宪平蜀寇致仕三首 其三
661075,送大司空柴公致仕
575314,阙题 送司徒叶公致仕
134013,题致仕李太传园亭
672760,马学士先生有诗贺伯父致仕用韵奉答
1036026,水龙吟 咏笛材，时太守闾丘公显已致仕，居姑苏。后房懿卿者，甚有才色，因赋此诗
79124,予初仕为宁德县主簿而朱孝闻景参作尉情好甚
673513,赠授业刘先生致仕还吉水
480277,闻刘东山司马致仕之命是日得谢方石祭酒到家日所寄诗感而有作
327467,拜中岳命·常贫须漫仕
425392,焦丙挂带不仕
117533,送青州签判俞退翁致仕还湖州
437989,和致仕李政奉韵
539872,寄致仕尚书山阴何公
1036094,水龙吟 闾秋大夫孝终公显尝守黄州，作栖霞楼，为郡中绝胜。元丰五年，余谪居黄。正月十七日梦扁舟渡江，中流回望，楼中歌乐杂作。舟中人言：公显方会客也。觉而异之，乃作此曲。盖越调鼓笛慢。公显时已致仕。在苏州
1249831,题张士厚四时仕女四首 其三
664472,送钱水部致仕次杭秋官韵 其一
484571,红绿蕉二仕女图
581357,送李寅教谕致仕
562348,赤城吕徽之博闻强识宋亡遂晦不仕一日大雪中至巨家易谷立堂下久之堂东偏众客方咏雪有分韵得蝶字者艾思不就徽之不觉失笑咸诘之曰汝何笑曰吾欲用滕王蛱蝶事耳众客皆惊阴知其为徽之也延之坐不可欲赒以谷辞既去使人尾之至其居地极幽阻及雪霁候焉荆扉竹屋不蔽风雨见桶中坐一妇人盖其妻也问徽之所在曰出捕鱼矣得于溪上具言所以来之意曰诸子可少留乃换酒共饮返宿道傍大楼下主人怪舆马之盛因言其状主人亦不知有徽之也明日求之则已迁居矣徽之
187615,呈丁师·仕有为贫难择地
494280,送光禄刘毅斋致仕
234726,借居湖上·出仕归来贫似旧
1195959,和致仕张尚书新创道院
980591,说之方忧韩公表大夫疾遽致仕乃蒙传视送陈州王枢密诗十首意典辞丽忻喜辄次韵和呈以公若登台辅临危莫爱身为韵 其四
1108050,薄暮游潘登仕园园有堂三间榜曰一枝盖湖公枢密两取庄周郤诜之语既以嘉潘亦以勉潘之二子因用其意各赋一绝
516468,送邓道录致仕还乡
673082,送杨惟高先生致仕
779358,探春慢 题顾螺峰女史 韶 画寻梅仕女，用张玉田韵
652051,送李永年大参致仕十首 其一
358285,故通仕孙公挽词
556524,送宋司狱致仕
533841,和陈公载致仕言怀
576187,送翰林宋先生致仕归金华二十五首 其二十一
283002,念奴娇·为穰庼题仕女纨扇
1109459,贺陈子扬致仕追赠父母二首
479068,次韵任太常致仕留别五首 其四
702324,送汪希颜佥事改仕湖广
126570,出仕·欲遂终焉老闲计
928383,予初仕为宁德县主簿而朱孝闻景参作尉情好甚笃后十馀年景参下世今又几四十年忽梦见之若平生觉而感叹不已
169913,丁巳调选·人生四十方强仕
881161,寄王五四将仕 其一
442050,别仕斋（古风）
508613,送陈侍郎琏致仕还东广
663338,维洛美刘子也刘子仕洛为大夫作室以奉母君子名之曰荣养风人美之故作是诗焉 其三
535145,和周中丞喜致仕报作
154157,忆紫芝·清才漫仕橐长空
975202,次韵田将仕年八十八岁作诗自喜三首 其三
652054,送李永年大参致仕十首 其四
87675,绿珠·畏死仕新室
649095,送吕大理致仕兼寄王孟坚
519828,送郑德新方伯致仕
314023,沁园春·赠刘在园先生致仕之作
35081,和致仕张尚书新创道院
490138,题仕女 其二
1244415,耒阳郭方中云先世自麻冈分派尝仕前朝今遁迹?亩至徵诗余以同志歌以赠之
558241,寄致仕张佥宪
183868,恭和御制赐太师致仕文彦博七言四韵诗
704077,三茅观与左迁钱学士致仕陈太常宴集分韵 沧字
637303,送曾亚卿致仕
206726,赠华山何学士致仕
1247974,翠竹黄花二仕女图 其一
522111,孙员外性甫奉使过家为其父双泉翁寿翁以建宁推官致仕
587463,送博罗赖县丞致仕归
643247,题李仕廉雪溪诗卷
364597,李尚书除少保致仕
384735,致仕出京言怀
118808,送文太师致仕还洛三
693011,宋景濂承旨致仕还金华
1059758,闻周仲修复致仕
929785,致仕后即事十五首 其八
616891,请告致仕
644452,送詹承旨致仕还乡
1123323,和寄王五四将仕
201818,资善常御筵送太子少保致仕李柬之归西京
1239395,题李伯时仕女图 其一
923234,恭和御制赐太师致仕文彦博七言四韵诗一首
576177,送翰林宋先生致仕归金华二十五首 其三
643123,送彭仕贞归涟川省亲 其二
1233566,送贡教授致仕归里
178037,忆旧游寄致仕了倩寺丞
120564,十诗·二年仕穷山
694923,致仕后戏作
316140,谒金门·题大千作团扇仕女
1042934,方仕致仕
1042934,方仕致仕
198250,吊朱给事·筮仕西州佐邑时
507072,题赵尚书致仕
532672,送陈都御史致仕陈苏州人赣州巡抚 其一
694383,吴主簿诗主簿名则宣平人吴黄门仕伟之父也 军门止杀
784820,图仕女晓绣因题
702277,送王幼度待制致仕归大梁应教
404597,忆江南·题谨怀绘红楼梦仕女图十首 其七 探春
576183,送翰林宋先生致仕归金华二十五首 其十五
68956,李侯·李侯世名仕
826269,菩萨蛮·题画仕女
1124384,次韵田将仕年八十八岁作诗自喜三首
878498,耕仕一首
696864,渡江舟次寄送桢伯致仕还里中
558586,苏州别驾周德中以余致仕居间而称神仙太守作十绝复之 其八
1131079,致仕后次韵答张念七
382939,送少傅陈相公致仕还蜀
519742,送胡廷伦纪善致仕还乡
966881,答致仕吴朝请潜登黄鹤楼见招
542541,刘节推行可尚宝仕可出饯郭外赋此志别
577627,送吕少卿致仕归山阴
652811,题芭蕉仕女图
150276,致仕归东里·板令悬车欠四年
920491,和致仕张郎中春昼
63080,仕女·丝抽霜藕织仙衣
662038,送马善徵致仕还吴
1043516,吴国博未五十致仕归蕲州
651991,送孙俊先生致仕归鄢陵三首 其一
695716,送郭方伯应宿致仕还滇中二首
742725,道光壬午五月自曹镇任奉命致仕返黔俶装将行赋长句四章敬以纪恩兼用志别 其三
483977,太平太傅致仕
63685,赠何翰林致仕居金陵
446164,韩国学界为金退庵亡国后隐居不仕之节义征诗限韵，赋此二首以应 其一
576181,送翰林宋先生致仕归金华二十五首 其十二
1002660,寄致仕欧阳少师
648865,送周存诚州判致仕归清江 其二
294048,浣溪沙·题梅花仕女图
659784,赠太老蒋敬所致仕 其一
658242,闻华容刘东山先生致仕
949860,赠虞部员外郎谭公昉致仕
514576,挽致仕于千户 其一
404595,忆江南·题谨怀绘红楼梦仕女图十首 其五 元春
140832,韩子师尚书致仕
1059918,故通仕孙公挽词 其一
291054,德人朱臻仕为江南炮台教习闵中国时势
106124,杂兴·七十合致仕
660992,送黄太宰先生致仕
50956,饮酒·长公曾一仕
1070885,丁卯二月二十七日与客纵步至判官陈师正所居前有花竹后有港浦爱其幽胜退作此诗师正历官九任今年六十有一母年九十二岁杜门养亲不复仕宦盖琼士之安贫守道者也
227477,次韵奉酬致仕通直吴七丈上元所寄之什
922921,元丰己未三院东阁作 元丰戊午夏予尹京治陈氏狱言者以为推劾不尽诏移大理而理官推迹陈氏姻党干求府政纵出重辟事下御史推求己未岁予自濠梁赴台讯鞫卒不涉干求之迹而大理反有傅致之状虽蒙辩正听命久之不得出邑邑不已作诗十篇记一时事非欲传之他人但以示子侄辈使知仕宦之艰耳 其三
532047,文衡山致仕言归次韵二首 其一
50720,闻杨君谦致仕·到手功名赋子虚
219978,游风·筮仕棓生繇莫京
50721,闻杨君谦致仕·茫茫仕隐不同风
50721,闻杨君谦致仕·茫茫仕隐不同风
593391,送大宗伯古林何公致仕南归二首 其二
481120,题红叶仕女
555563,勉仕男读书
662060,奉赠蒋师相敬所致仕归湘源兼简令兄大司徒二首 其一
662095,兰州闻见素致仕用前留别韵奉寄二首 其二
691912,送陈都御史致仕陈苏州人赣州巡抚
507024,和致仕祭酒胡公诗三首 其一
462150,题张禾仕女图
675061,送钱水部致仕还无锡 其二
577650,送潘参政文奎致仕回永嘉
578489,送何给事致仕归建昌
479281,舟中题画赠钱员外仁夫致仕归吴中
237516,贽鄂帅张仕简
88760,送林推官·仕泉一郡共称贤
481849,送李校尉致仕还江左
14212,从仕·居闲食不足
275485,清平乐·题扇头仕女小景
577640,送礼部尚书蔚公致仕归合肥
924140,送文太师致仕还洛三首 其三
19675,初致仕后戏酬留守牛相公并呈分司诸寮友
104341,寄致仕张郎中
344234,闾江晚泊次东粤曾仕鉴韵
566476,送王府尹致仕
78580,自儆·出仕每辞荣
662090,赠竹田大司空致仕
150274,致仕後寄白莲然公
482540,送翰林宋先生致仕归金华二十五首 其十八
881213,嘲贺将仕 其一
653740,送于宪使致仕
46902,送赵史君致仕归别业
387431,送太医院使仲惟馨致仕
681475,折花仕女
1070369,江仲嘉仕吴兴雅重道场山长老惠颜仲嘉之柩以八月十五日至山下颜以是日告寂
508972,昼锦堂 送都宪高公致仕
61084,漫兴·花县常三仕
93622,山居午睡起弄花·五年出仕喜还家
980348,致仕后寄白莲然公
294438,七十寿言·筮仕连洋日
429709,为友人题仕女画四绝句 其四
649523,送王文英典籍致仕归金华 其三
1044745,五言送余良孺大监致仕归乡
659341,送少师徐先生致仕归宜兴
500728,御史大夫帖木哥公致仕
438775,送李执刚致仕归洛
553574,送叶经历致仕归建宁
519109,赠致仕严掌教
507008,送郑御史致仕还金华
56097,舟中题画赠钱员外仁夫致仕归吴中
3838,送沈芳谒李观察求仕进
689585,次韵任太常致仕留别五首
578522,寄方以高致仕归隐
1059919,故通仕孙公挽词 其二
662069,赠白司寇致仕
1234168,送周正平学士致仕还里
660862,送少司徒郑公进尚书致仕还闽分韵得水字
651992,送孙俊先生致仕归鄢陵三首 其二
1117490,故通仕孙公挽词
602313,和酬丁柴桑二章赠临清周贰守干周名家子也以贡入仕而为卑官余欲广其志和是诗赠之
701253,送韦提学致仕还家二首
102166,和致仕张郎中春昼
648255,送潘景昭致仕归永嘉
337971,挽诗·几年漫仕贫如故
429707,为友人题仕女画四绝句 其二
659785,赠太老蒋敬所致仕 其二
555336,致仕过常思岭兰若和故友彭从吾韵二首 其二
196949,饮酒诗·嗣宗初亦仕
637235,题抚孤松而盘桓送人致仕
1003289,赠胡侍郎致仕
730425,改建贤良祠于祠中设仕学院书示众官祠祀杨清师端公亲仁、胡文忠公林翼
1086316,冯员仲复元官与致仕恩泽
1035752,寄赠华山致仕韩见素
575977,饯宋承旨潜溪先生致仕归金华七首 其七
672797,题名山草亭送户部侍郎王公民望致仕归华容和守溪韵
513462,送陆司寇先生致仕还四明 其一
911591,挽陈将仕
235903,别游定夫·黾勉吾将仕
948393,游元龄登仕写予真求赞
560289,送张先生致仕归闽 其一
519690,送吴元素长史致仕
678470,喜陈少尹致仕还赋此奉寄
64344,梧桐仕女图为钱孟实题
834432,南乡子 其三 王梦白背坐仕女，余与师曾各补景，并填此解
703918,赠李中丞自滇中致仕还里
821971,醉花阴 唐子畏墨笔仕女，一树，一石，美人立其下，持扇凝睇，若有所思
531340,送胡东渠少参致仕归晋阳
587516,于穆赠袁少司徒也袁公三十年显仕犹敝廛一庐
419828,醉思凡 北来友人劝予出仕，戏书示之
364616,回致仕董中允
652597,桃花仕女诗 其三
696424,奉赠蒋师相敬所致仕归湘源兼简令兄大司徒二首
993147,寄题西洛致仕张比部静居院四堂
207859,次韵和致仕陈相公除夜
311635,自寿原韵·仕途坎坷复分歧
513629,送延都运六十致仕得何字
594395,送冯京倅致仕归华亭
118810,致仕还洛三·齐鲁元勋古太师
598878,渡江舟次寄送桢伯致仕还里中 其一
663992,送后渠崔司成致仕归安阳
663336,维洛美刘子也刘子仕洛为大夫作室以奉母君子名之曰荣养风人美之故作是诗焉 其一
702490,送唐御医致仕还嘉兴
1252607,翠竹黄花二仕女图
558588,苏州别驾周德中以余致仕居间而称神仙太守作十绝复之 其十
291995,江南好·游春侣，仕女竟新妆
1067336,送邑尉朱登仕告老归华亭用玉局老仙寄王庆源韵
547719,送太宰梦山杨公致仕
506985,送叶文翰致仕还乡
50723,闻杨君谦致仕·临歧冠盖酒淋漓
86720,七十九吟·仕宦端平甲子岁
553408,吾乡富友文擢顺庆府同知三年升保宁府知府以七十致仕顺庆经历陈暹会予于京师言其事喜诗赋之 其一
652053,送李永年大参致仕十首 其三
481519,仕女
1179231,韦常侍以宾客致仕同诸公题壁
387278,高阳台·奂庭偶得仕女图一帧，谓与其亡室相似，因借作遗挂，为题此词
268029,月华清·为友人题所得《梅花仕女图》
668610,送乔冢宰致仕还太原二首 其二
650582,赠张清纪根致仕还蕲州
576179,送翰林宋先生致仕归金华二十五首 其八
506946,送礼部郎中蒋廷晖致仕还乡
675020,送李献吉致仕归陜
577269,送来安徐知县仕禄
232440,论语绝句·卫多贤者仕伶官
947268,送关都官致仕 其一
115447,赠吴孟求承议·我生仕宦求餬口
695485,赠太老石斋翁致仕
779500,早春怨 题蔡清华夫人桐阴仕女图
305719,为友人题仕女画四绝句
941041,题高将仕墨梅
1215594,送监郡库克楚通议公致仕归维扬一十二韵
552803,永嘉孔正夫生时父母年五十及登第则九十余矣正夫养志不仕明年父母皆死追念不忘为作此诗
898474,致仕后戏赠故人
932863,青城大面山中有二隐士一曰谯先生定字天授建炎初以经行召至扬州欲留之讲筵不可拜通直郎直秘阁致仕今百三十馀岁巢居崄绝人不能到而先生数年辄一出至山前人有见之者其一曰姚太尉平仲字希晏靖康初在围城中夜将死士攻贼营不利骑骏骡逸去建炎初所在揭榜以观察使召之竟不出淳熙甲午乙未间乃或见之于丈人观道院亦年近九十紫髯长委地喜作草书盖皆得道于山中云偶成五字二首托上官道人寄之 其一 寄谯先生
345482,直舍夜坐·强仕似幼学
870168,送李尉以监丞致仕归闽中
1220311,赋渊明归来图送致仕者
65490,致仕还乡
652058,送李永年大参致仕十首 其八
384727,姚太仆思永致仕进秩光禄少卿
810,送李庶子致仕还洛
702219,赠吾廷介致仕归开化诗四首
225243,温峤·刚肠出仕岂徒然
649554,送何布政致仕东归 其一
332331,柳梢青·题竹林仕女图
696201,送李司徒致仕
680045,送林太守元美致仕
687648,饯宋承旨潜溪先生致仕归金华七首
479067,次韵任太常致仕留别五首 其三
672401,送南京参赞机务上司马致仕还公安
1219401,赠张景亮仕回
869861,题致仕李太傅园亭
103323,寄致仕余少卿
933779,致仕后述怀六首 其二
696782,赠李君元珙致仕还家
661026,次韵答司训光郁先生时致仕归
916168,陈尧拱廷评致仕归蜀
482541,送翰林宋先生致仕归金华二十五首 其二十
1169071,赠送致仕郎中
553793,送郑御史致仕归义门
668597,送石斋太傅致仕还蜀 其一
648769,送尚书魏公致仕还乡诗
315656,送知县莫文渊致仕归钱塘
648994,送袁本谦致仕归 其二
686646,送梅轩蒋司徒致仕归湘源二首
1249986,友人仕掾曹为上官所迫从赋此送归
228577,挽陈将仕·事到盖棺方始定
15033,赠致仕滕庶子先辈
652057,送李永年大参致仕十首 其七
1034606,从事郎致仕史挽诗
509937,吴主簿诗主簿名则宣平人吴黄门仕伟之父也 其二 过与弗取
680970,送刘时雍致仕归
886489,吴子珍登仕避地大宁示诗赓韵以谢
702283,吾乡富友文擢顺庆府同知三年升保宁府知府以七十致仕顺庆经历陈暹会予于京师言其事喜诗赋之
209290,劝学韵·仕学优於服田力
575971,饯宋承旨潜溪先生致仕归金华七首 其一
1169019,和致仕沈郎中
405237,忆江南·题谨怀绘红楼梦仕女图十首 宝玉
580192,甲辰仲冬十日会同年周世祥于杭酌酒联句五首时世祥已致仕矣故云 其五
704392,送少师李公致仕还淮南
657762,送毕都宪致仕
1243158,题鹦鹉仕女图
674116,武城闻致仕之命偶书
649059,送晁司直景范致仕归济宁
513923,送唐御医致仕还嘉兴 其一
870204,寄赠致仕刘都官
153533,送陆放翁赴落致仕修史之命
3117,少年行·出身仕汉羽林郎
695037,送钱水部致仕还无锡
259461,送李执刚致仕归洛
1156164,和杨郎中贺杨仆射致仕后杨侍郎门生合宴席上作
88408,寄韩仲止·昨仕京华豪未减
529054,邀甬川少宰过报国寺送吕泾野致仕
1117659,青城大面山中有二隐士一曰谯先生定字天授建炎初以经行召至扬州欲留之讲筵不可拜通直郎直秘阁致仕今百三十馀岁巢居崄绝人不能到而先生数年辄一出至山前人有见之者其一曰姚太尉平仲字希晏靖康初在围城中夜将死士攻贼营不利骑骏骡逸去建炎初所在揭榜以观察使召之竟不出淳熙甲午乙未间乃或见之于丈人观道院亦年近九十紫髯长委地喜作草书盖皆得道于山中云偶成五字二首托上官道人寄之 寄谯先生
1092450,同年郑贵温寺丞直华文阁致仕次韵为贺 其二
110894,贺罗将仕拜命
1027806,莫将仕挽词
139052,绍兴倅·出仕曾尘侍从班
66820,团扇仕女
115987,登山望海·仕宦此身漫尔
1117995,五月七日拜致仕敕口号二首
661900,奉候林见素都宪平蜀寇致仕三首 其二
1038761,故兵部侍郎致仕安定公挽辞三首 其一
562634,乞致仕年得家书
948922,临川梁译投冰溪救母谢昌国作孝德记杨廷秀有诗次其韵译不仕年四十九而终 其一
236294,薄暮游潘登仕园园有堂三间榜曰一枝盖湖公枢
575948,奉致仕詹天官
211241,观孔义甫与谢致仕诗有感
514545,菊庄图为致仕章元益给事赋
56948,题李伯时仕女图
563831,送邵文实方伯致仕
916354,致仕朱侍郎归江陵
650575,赠李君元珙致仕还家 其一
104173,寄题西洛致仕张比部静居院四堂
131119,行路易送陈晟谋仕
137397,感兴·仕宦希寸禄
513924,送唐御医致仕还嘉兴 其二
933780,致仕后述怀六首 其六
1161431,孔尚书致仕因而有寄赠
509124,庆南京大理寺卿夏公季爵致仕诗
