1028885,社日邀温卿溪王天仕吴钦孺游草堂钦孺有诗因次其韵
663300,奉送大司马华容刘公致仕二首 其一
1045981,题致仕袁成均燕申亭
1244775,赠陈仲玉本学教谕致仕
187603,送傅守归·仕至二千石
18595,书绅·仕有职役劳
673509,送徐仕亨复任荆门
516248,萧总制致仕西归予亦自岭外至相会话别
1026202,致仕后次韵答张念七 其一
1109793,寄王五四将仕
490137,题仕女 其一
932677,绍兴中予初仕为宁德主簿与同官饮酒食蛎房甚乐后五十年有饷此味者感叹有赋酒海者大劝杯容一升当时所尚也
929774,致仕后即事十五首 其十二
110794,寿刘上舍将仕
1066495,立秋日六兄将仕先入都赴铨试会饮东郊作诗送之
929784,致仕后即事十五首 其十四
1041876,石少傅致仕
661073,送大司马张泾川进太子少傅致仕归全州
177690,送刑部韩员外同年致仕归华山
521538,赋僮仆欢迎贺叔武尊人都宪致仕
258820,答客·仕晚自知为学拙
202497,范蜀公得请再致仕蜀公作谋命某次韵
507263,送国子助教黄君立致仕归闽
292120,纪事诗·仕女纷纷作野行
667819,送张都阃致仕归二首 其一
266778,浣溪纱·题竹阴仕女
922930,元丰己未三院东阁作 元丰戊午夏予尹京治陈氏狱言者以为推劾不尽诏移大理而理官推迹陈氏姻党干求府政纵出重辟事下御史推求己未岁予自濠梁赴台讯鞫卒不涉干求之迹而大理反有傅致之状虽蒙辩正听命久之不得出邑邑不已作诗十篇记一时事非欲传之他人但以示子侄辈使知仕宦之艰耳 其六
983090,寿刘上舍将仕 其二
1110465,余大观中偕何袭明登仕同为太学诸生别后二十六年余□南迁道清江袭明逆余于新淦之洲上苍颜白发大略相似感叹之馀饮酒赋诗以为笑乐袭明笔力雄赡操纸立就凡六七反必用前韵余继和者十二篇云
301603,金缕曲·甲申阳月合肥李仲仙同黄仕林军门枉顾寓斋，倚声以赠
638871,赠李大使将致仕南归
556300,赠张赣州致仕还吴次达夫韵
660925,送郑司徒致仕还闽
250516,题箜篌仕女图
117845,赠致仕王景纯寺丞
1073525,游钟石寺问名寺之因缘老僧指门旁石如覆钟状赋诗一首邀何袭明登仕同赋
138533,松菊·出仕惭无补
575974,饯宋承旨潜溪先生致仕归金华七首 其四
652595,桃花仕女诗 其一
1038760,故端明殿学士工部尚书致仕清源王公挽辞二首 其二
787703,题许云江梅花仕女帐额 其二
486729,致仕还乡
578453,送易镇抚致仕还五开
43331,戏题仕女图
1026489,寄致仕李洵大夫
577462,寄致仕尚书义门郑公仲与
587678,赠朱司训致仕诗三章
508605,送袁尚宝忠彻致仕还鄞
106390,漫兴·老岂堪从仕
253250,题张禾仕女图
758189,江城梅花引 题“仕女调鹦鹉图”
200858,吴比部致仕归蕲阳
660971,送郑司徒致仕还乡
137912,闻沂州卢侍郎致仕有感
922924,元丰己未三院东阁作 元丰戊午夏予尹京治陈氏狱言者以为推劾不尽诏移大理而理官推迹陈氏姻党干求府政纵出重辟事下御史推求己未岁予自濠梁赴台讯鞫卒不涉干求之迹而大理反有傅致之状虽蒙辩正听命久之不得出邑邑不已作诗十篇记一时事非欲传之他人但以示子侄辈使知仕宦之艰耳 其一
554708,送洪彦章致仕还括苍
1026203,致仕后次韵答张念七 其二
659081,次韵沈方伯良臣为余七十之寿沈与余同生庚午又同在郡胶今同致仕
1057151,送太师潞国文公致仕赴阙朝觐归洛
77047,感遇·仕宦五十年
579445,广于天下为远藩仕籍华秩已少况琼于广又为远郡成化二年秋进薛公远户部尚书邢公宥都御史丘公浚翰林学士皆在一月恐虽天下望郡亦希海外衣冠胜事真奇逢也
507035,送吴佥事致仕还闽中
492619,公文契尚书由参政山西入拜礼部而予以侍郎起于家同日拜命赴南宫今承恩致仕又适同日公文有别业在溧阳予将南还泰和于别也不能以无词焉因赋二律诗为赠 其二
1239397,题李伯时仕女图 其二
524561,浔阳寄耿参政致仕
639136,赠典簿史奈致仕还沁源
500750,镇守太平杨侯致仕
207674,趋朝·仕路何曾乐
583287,松鹤寿大同致仕太守周卑牧同年时敏之父
531187,送彭幸庵尚书致仕 其二
482537,送翰林宋先生致仕归金华二十五首 其十
480090,送范斋李先生致仕还吴
1047909,赠致仕郭朝议
559738,槐阴琴书图为王仕让赋
869525,和宋子才致仕后岁旦见赠
656808,送王司马致仕还乡
985208,挽朝请大夫致仕李公词
648825,惜别行送朱存礼致仕归鄱阳
514976,与世赏庶子同饮通州致仕袁千户家
109435,送邓城令王该致仕
116733,过泗州推官王永年致仕还乡王年四十而致仕士
116733,过泗州推官王永年致仕还乡王年四十而致仕士
1140976,送姜仕可去馆
64584,寄长蘅·吾观仕宦人
1120270,中奉大夫直徽猷阁致仕邵及之挽词二首
922926,元丰己未三院东阁作 元丰戊午夏予尹京治陈氏狱言者以为推劾不尽诏移大理而理官推迹陈氏姻党干求府政纵出重辟事下御史推求己未岁予自濠梁赴台讯鞫卒不涉干求之迹而大理反有傅致之状虽蒙辩正听命久之不得出邑邑不已作诗十篇记一时事非欲传之他人但以示子侄辈使知仕宦之艰耳 其五
1037266,青城大面山中有二隐士一曰谯先生定字天授建炎初以经行召至扬州欲留之讲筵不可拜通直郎直秘阁致仕今百三十馀岁巢居崄绝人不能到而先生数年辄一出至山前人有见之者其一曰姚太尉平仲字希晏靖康初在围城中夜将死士攻贼营不利骑骏骡逸去建炎初所在揭榜以观察使召之竟不出淳熙甲午乙未间乃或见之于丈人观道院亦年近九十紫髯长委地喜作草书盖皆得道于山中云偶成五字二首托上官道人寄之 其二 寄姚太尉
558587,苏州别驾周德中以余致仕居间而称神仙太守作十绝复之 其九
899193,送邓城令王该致仕
657954,五十三初度太虚以诗见寿且有见促从仕之意 其一
1243517,第一人间快活丸歌赠芙蓉峰蓑衣闲道人贯酸斋号云石仕至翰林学士休官辞禄或隐屠沽或侣樵牧人莫测其机尝于临安闹市中立牌额货卖第一人间快活丸人有买者展两手一大笑示之领其意者亦笑而去
192905,陈尧拱廷凭致仕归蜀
933777,致仕后岁事有望欣然赋诗
324228,左世绩妙年登第而飘泊遐荒十年不得调盖尝以事忤权贵今公道方开始欲仕进索余赋诗
34598,寄赠致仕沉彬郎中
149224,大热戏作·仕板三十年
507025,和致仕祭酒胡公诗三首 其二
703863,赠黄仕明进士
663341,伯川子仕为地官大夫能其官且有显陟矣一旦思其母夫人解印绶去予知其必有以也取六义之比赋有兔诗二章以美之 其一
683025,致仕出京言怀
237609,张仕简·不为名缰浪出山
1113578,和郭功甫赠陈待制致仕二首
429708,为友人题仕女画四绝句 其三
567478,灯夕答访诸君因寻百廿四岁老人未青霞误而为仕阍所骂
989273,得致仕喜成
283346,南乡子·王梦白背坐仕女，余与师曾各补景，并填此解
662063,嘉靖四年六月十一日得请致仕书感
922925,元丰己未三院东阁作 元丰戊午夏予尹京治陈氏狱言者以为推劾不尽诏移大理而理官推迹陈氏姻党干求府政纵出重辟事下御史推求己未岁予自濠梁赴台讯鞫卒不涉干求之迹而大理反有傅致之状虽蒙辩正听命久之不得出邑邑不已作诗十篇记一时事非欲传之他人但以示子侄辈使知仕宦之艰耳 其十
674779,周承德除养利州守即乞致仕
1248872,题撚花仕女图
129611,胡登仕送花
652596,桃花仕女诗 其二
482536,送翰林宋先生致仕归金华二十五首 其七
692708,送彭幸庵尚书致仕 其一
39262,六言诗·楚子文善仕
51196,次韵任太常致仕留别·濯足梳头旧有缘
385845,和冯子良太守致仕次韵
553328,送王幼度待制致仕归大梁应教 其二
1157092,刑部尚书致仕
980040,致仕归东里
408842,德人朱臻仕为江南炮台教习闵中国时势日非愤而成疾用手枪自杀陈子哀之为此二诗（选一）
1120365,临川梁译投冰溪救母谢昌国作孝德记杨廷秀有诗次其韵译不仕年四十九而终
348761,送陈辑都曹致仕还乡
177703,除夜·四十强而仕
700796,送张先生致仕归闽
183956,朝议大夫致仕张公挽辞
118921,还颍川·昔贤仕不遇
225991,挽余倅·仕接湖南北
1117388,谢富丞相招出仕二首
837775,金缕曲·甲申阳月合肥李仲仙同黄仕林军门枉顾寓斋，倚声以赠
141382,江南归附后不仕述怀
839091,和公善游仕武兰园用前韵
1161508,送滕庶子致仕归江南
933781,致仕后述怀六首 其五
355510,送郭知章·仕宦悠悠今几年
1227745,送贺尚书致仕后赴召
654957,送陈员外致仕归吴 其一
160074,致仕后次韵答张念
951823,次韵贺邱国镇致仕
275601,虞美人·李庄为宪民女彭令范画琵琶仕女扇面。宪民属题
576189,送翰林宋先生致仕归金华二十五首 其二十三
527047,送吴御医晦叔致仕
274501,醉花阴·唐子畏墨笔仕女，一树，一石，美人立其下，持扇凝睇，若有所思
560292,送张先生致仕归闽 其四
473895,赠何翰林致仕居金陵次文太史韵
88545,二诗纪实·两翁仕不至丞郎
533792,送少师李公致仕还淮南 其二
663337,维洛美刘子也刘子仕洛为大夫作室以奉母君子名之曰荣养风人美之故作是诗焉 其二
530539,山西副使致仕
53799,读史·周燮久不仕
576191,送翰林宋先生致仕归金华二十五首 其二十五
435247,一字百题示商君祥 其六十 仕
909868,范蜀公得请再致仕蜀公作诗命某次韵
1055597,和郭功甫赠陈待制致仕二首 其一
704755,送李永年大参致仕十首
35320,癸卯闽乱从弟监察御史敬凝迎仕别作
513619,送汪希颜佥事改仕湖广 其二
650574,松筠轩为章仕颙作
1214089,告病致仕别李尚书
705291,戏题仕女图
1191454,癸卯闽乱从弟监察御史敬凝迎仕别作
1042117,送刘中允涣年五十馀以颖上县令致仕卜居庐山
929777,致仕后即事十五首 其五
980589,说之方忧韩公表大夫疾遽致仕乃蒙传视送陈州王枢密诗十首意典辞丽忻喜辄次韵和呈以公若登台辅临危莫爱身为韵 其五
241568,挽诗·仕至二千石
663139,送焦阁老致仕
66151,仕女观流水小景
1131297,同年郑贵温寺丞直华文阁致仕次韵为贺
293655,江城梅花引·题仕女调鹦鹉图
668627,致仕出京言怀 其一
506835,送叶太守于渊致仕还乡
404592,忆江南·题谨怀绘红楼梦仕女图十首 其二 黛玉
155965,杂诗·漫仕叹迟暮
660148,和答西涯见寄诸作致仕述怀韵 其一
648731,送罗汝敬侍郎致仕南归
649521,送王文英典籍致仕归金华 其一
658762,倪同知加冠服致仕
241636,送吕通直致仕南游归寿州
452303,题箜篌仕女图
513925,送唐御医致仕还嘉兴 其三
1085275,术者谓予命犯元辰故每仕辄已予笑曰有是哉戏作问答语
856928,代人送常州致仕张待制
576188,送翰林宋先生致仕归金华二十五首 其二十二
993132,寄致仕余少卿
35155,送萧尚书致仕归庐陵
507520,石泉茅屋歌为致仕赵尚书作
376791,郎侍郎致仕
840554,孙师郑以感逝诗徵题诗分甲乙二集辛亥后不仕者入甲集出仕者入乙集大半亦我师友也二首 其一
840554,孙师郑以感逝诗徵题诗分甲乙二集辛亥后不仕者入甲集出仕者入乙集大半亦我师友也二首 其一
195911,代人送常州致仕张待制
1251864,看花仕女图
640257,宋景濂承旨致仕还金华 其二
555929,禹卿归秦仕儿留此难于为别以此慰之 其二
863761,送刑部韩员外同年致仕归华山
858972,送张卿致仕
386727,仕女障子·读罢文窗女史箴
555116,致仕归言怀效吴体四首 其三
580357,送周世祥致仕还乡
640255,赵待制致仕还会稽
339751,寄韵·仕途三黜信多难
1141007,寄姜仕可
948812,登仕郎曾忠佐迎母王于乐氏母许新居成即归于是筑第高沙极轮奂母欲迁而逝乃虚中堂榜之曰思永为赋四韵
519110,赠蔡推府致仕
138913,咏贫士·入仕已四纪
574095,赠祝惟贞致仕南还次陈一夔
649555,送何布政致仕东归 其二
664476,送钱水部致仕次杭秋官韵 其五
929775,致仕后即事十五首 其二
62877,送范斋李先生致仕还吴
283399,瑞鹧鸪·题朽道人京俗画册十七阕 旗下仕女
970850,赠胡侍郎致仕
610220,赠黄仕明进士 其一
981266,次韵和致仕陈相公除夜
19573,雪暮偶与梦得同致仕裴宾客王尚书饮
1219048,送刘将军致仕归襄阳 其一
547532,送少傅陈相公致仕还蜀二首 其一
364244,吴国博未五十致仕归蕲州
1243019,适轩，为致仕浙东宣慰使杨元诚赋
297199,和公善游仕武兰园用前韵
506827,送参议陈彝训致仕还西江
638271,奉寄彭从吾亚卿乞致仕养亲
530681,黄粱梦　谢仕归
593840,送黎秘书惟敬得请致仕二首 其二
51125,送杨君谦致仕
87955,耕仕·耕不逢年仕背时
87955,耕仕·耕不逢年仕背时
51194,次韵任太常致仕留别·此身真喜置吾庐
522148,保宁何重器尝通守松江以福建盐课提举致仕其子鉴鏊入太学频辱惠音且存问吾乡故旧甚悉感其雅情赋此奉寄
560291,送张先生致仕归闽 其三
480958,梧桐仕女图为钱孟实题
494278,送奉常牛西唐致仕归河南
649976,送龚燧宪使致仕 其一
201662,资善御筵送刑部侍郎致仕李受归庐山山
1071708,送倪巨济将仕
648226,送淮安刘千户致仕归吉水
149383,说之方忧韩公表大夫疾遽致仕乃蒙传视送陈州
1247975,翠竹黄花二仕女图 其二
51193,次韵任太常致仕留别
67332,送神武蔡千户致仕还湖州
930864,五月七日拜致仕敕口号二首 其二
651993,送孙俊先生致仕归鄢陵三首 其三
957651,送吕通直致仕南游归寿州
198874,送元厚之资政致仕归苏州
494073,赠吾廷介致仕归开化诗四首 其二
530040,首夏一日坐钱员外仕宏竹间小楼戏简
1032372,忠烈侯酷好山水作葬书以行于世元翁其族子传其书侍父仕赣上尽得杨氏术凡谈阴阳家者见之辄屈膝余闻其论洒洒然起忘倦矣夫既谓之地理理非儒不精元翁儒者精于理固宜为赋
232565,挽陈益谦·先生胡不仕
238653,龟溪即事·二疏仕汉庭
1234580,婺源州判官赴调京师授饶州路乐平州同知致仕拜命而卒归葬庐山
692225,送袁本谦致仕归
238031,送人入北求仕
1245132,送奉祠康仲谦致仕还陕西
184799,致仕·妻孥挽我奉真祠
681097,赠袁鱼典史吴仕明
1043552,回致仕董中允
77684,五月七日拜致仕敕口号
554982,送韦提学致仕还家二首 其二
351437,故兵部侍郎致仕安定公挽辞
687867,送程郎中弟致仕
560007,送医官致仕归金华为邵郎中正赋
579358,筮仕示张诩
1073542,袭明登仕出示尊公家传留读数过抚卷太息赋小诗归之
177951,贺将作孔监致仕
941231,东莱吕氏官箴以觅举求上官保庇书为第一戒今仕者往往十犯八九虽贤不免陷焉为诗以谢兼用奉勉
34705,赠致仕沉彬郎中
85049,南浦·题倚楼仕女
696426,兰州闻见素致仕用前留别韵奉寄二首
167126,归意浓·未仕每愿仕
167126,归意浓·未仕每愿仕
42227,已亥杂诗·熙朝仕版快茹征
481504,蕉萱仕女
1219049,送刘将军致仕归襄阳 其二
532609,送孙京兆致仕归慈溪
650577,赠李君元珙致仕还家 其三
115050,送莫郎中致仕归湖州
1167694,赠致仕沈彬郎中
897014,过泗州推官王永年致仕还乡王年四十而致仕士大夫所少也
897014,过泗州推官王永年致仕还乡王年四十而致仕士大夫所少也
191594,社日邀温卿溪王天仕吴钦孺游草堂钦孺有诗因
1208114,赠余使君致仕还江东
1031341,会亭遇资政孙公赴阙公致仕已七年时召归将有西鄙之任
576190,送翰林宋先生致仕归金华二十五首 其二十四
651120,送卢知县致仕归金华
580188,甲辰仲冬十日会同年周世祥于杭酌酒联句五首时世祥已致仕矣故云 其一
576176,送翰林宋先生致仕归金华二十五首 其二
640256,宋景濂承旨致仕还金华 其一
382302,送奉祠康仲谦致仕还陕西
166096,次韵黄奉议序致仕作
698216,送陈员外致仕归吴
134833,送致仕朱郎中令孙
690363,樊公名瑩字廷璧常山人仕终工部尚书守松郡不三年而遗惠无穷咏此不特为其诗也附写怀原韵二首
649524,送王文英典籍致仕归金华 其四
358607,闻周仲修复致仕
559951,送赵郎中致仕
1195953,和陈赞善致仕还京口
1053889,送谢仲规致仕
355766,江仲嘉仕吴兴雅重道场山长老惠颜仲嘉之柩以八月十五日至山下颜以是日告寂
420848,谒金门 题大千作团扇仕女
278702,焦丙挂带不仕
144150,挽万登仕·种德谏议窦
482421,送刘教授致仕归金华
1116902,元丰己未三院东阁作 元丰戊午夏予尹京治陈氏狱言者以为推劾不尽诏移大理而理官推迹陈氏姻党干求府政纵出重辟事下御史推求己未岁予自濠梁赴台讯鞫卒不涉干求之迹而大理反有傅致之状虽蒙辩正听命久之不得出邑邑不已作诗十篇记一时事非欲传之他人但以示子侄辈使知仕宦之艰耳
373794,送陈学录求仕
532632,送秦凤山尚书致仕归无锡
673454,四叠韵遣兴兼与德仕弟
475255,送待诏文徵仲先生致仕
1249819,题冯叔才芭蕉仕女
90699,圣恩增秩进职致仕感恩述怀
637298,送都察院经历蒋士亨致仕
150273,致仕後闻夜雨
716109,不仕
1035853,赠仲素寺丞致仕归隐潜山
389825,寄致仕尚书山阴何公
1070402,送叶善卷致仕归吴
1070322,送林德祖致仕东归
201695,工部尚书致仕王懿敏公挽词
675060,送钱水部致仕还无锡 其一
686772,伯川子仕为地官大夫能其官且有显陟矣一旦思其母夫人解印绶去予知其必有以也取六义之比赋有兔诗二章以美之
436858,贺罗将仕拜命
648053,送杨参政致仕归永嘉兼简宗豫
929778,致仕后即事十五首 其四
649937,题梅送王琼玉致仕 其一
992680,勉致仕李秘监
48004,芭蕉仕女图
870668,次韵王将仕 其一
1117717,致仕后述怀六首
652052,送李永年大参致仕十首 其二
658691,送徐司空致仕
948523,中奉大夫直徽猷阁致仕邵及之挽词二首 其一
583392,送刘与清大司寇致仕还吴
661899,奉候林见素都宪平蜀寇致仕三首 其一
118076,送文太师致仕还洛
593839,送黎秘书惟敬得请致仕二首 其一
65113,致仕后戏作
507099,送周职方致仕还乡
51197,次韵任太常致仕留别·晏眠不觉过残冬
411876,题陈小溪画仕女
639704,送郑尚书致仕
323002,冯员仲复元官与致仕恩泽
895107,杨干致仕
512736,喜李贞庵致仕
660895,送李司徒致仕 其一
576182,送翰林宋先生致仕归金华二十五首 其十三
526961,送万太守季崇致仕
880030,贺陈子扬致仕追赠父母二首 其一
482538,送翰林宋先生致仕归金华二十五首 其十一
509277,送姚子大佥宪致仕回
1120190,送关都官致仕
526805,赠伍松月致仕
693941,送李守讷致仕南归诗
701280,致仕过常思岭兰若和故友彭从吾韵二首
494904,寿冢宰致仕三原王先生
983091,寿刘上舍将仕 其一
48006,芭蕉仕女图·佳人名字号经莲
558581,苏州别驾周德中以余致仕居间而称神仙太守作十绝复之 其三
266785,菩萨蛮·题画仕女
203033,会亭遇资政孙公赴阙公致仕已七年时召归将有
429706,为友人题仕女画四绝句 其一
578490,送刘布政致仕归石首
103278,寄洪州致仕李国博
687019,公文契尚书由参政山西入拜礼部而予以侍郎起于家同日拜命赴南宫今承恩致仕又适同日公文有别业在溧阳予将南还泰和于别也不能以无词焉因赋二律诗为赠
787704,题许云江梅花仕女帐额 其三
640831,送朱长史致仕还乡
664477,送钱水部致仕次杭秋官韵 其六
48343,闻刘东山司马致仕之命是日得谢方石祭酒到家
852149,送蒲霖中舍致仕归阆中
189879,次韵参寥·长安仕路与云齐
991521,寄致仕张郎中
554981,送韦提学致仕还家二首 其一
468818,芭蕉仕女图
648993,送袁本谦致仕归 其一
1248966,剖瓜仕女图
692919,禹卿归秦仕儿留此难于为别以此慰之
559588,王梦夏踬于仕途暮秋见过手出追和半帙即席次其韵
327465,呈诸友·仕倦成流落
558164,樊公名瑩字廷璧常山人仕终工部尚书守松郡不三年而遗惠无穷咏此不特为其诗也附写怀原韵二首 其一
593899,送郭方伯应宿致仕还滇中二首 其一
488955,送指挥致仕代作
980592,说之方忧韩公表大夫疾遽致仕乃蒙传视送陈州王枢密诗十首意典辞丽忻喜辄次韵和呈以公若登台辅临危莫爱身为韵 其六
681747,寄赠郑郎中希大致仕进阶
870667,次韵王将仕 其二
547939,送御史大夫与川葛公致仕东归四十韵
657622,送程郎中弟致仕 其二
521459,蒋济民自光禄署丞调主靖安簿满考入京乞致仕赋以送之
531186,送彭幸庵尚书致仕 其一
979280,次韵黄奉议序致仕作
692212,送周存诚州判致仕归清江
466488,韩国学界为金退庵亡国后隐居不仕之节义征诗限韵，赋此二首以应
497826,致仕后戏作 其二
648283,送张宗海修撰致仕
924138,送文太师致仕还洛三首 其一
1116940,朝议大夫致仕张公挽辞二首
869719,送致仕朱郎中令孙
664064,闻白岩致仕后起居
553327,送王幼度待制致仕归大梁应教 其一
126061,闲吟·平生如仕官
558583,苏州别驾周德中以余致仕居间而称神仙太守作十绝复之 其五
139925,从事郎致仕史挽诗
452323,回京车上步仕玲韵
682180,送少傅陈相公致仕还蜀二首
211249,赠陈通其致仕熙寿轩
617887,汪生洲左司马致仕将归授其先公诒燕图作歌多怀旧之感
922927,元丰己未三院东阁作 元丰戊午夏予尹京治陈氏狱言者以为推劾不尽诏移大理而理官推迹陈氏姻党干求府政纵出重辟事下御史推求己未岁予自濠梁赴台讯鞫卒不涉干求之迹而大理反有傅致之状虽蒙辩正听命久之不得出邑邑不已作诗十篇记一时事非欲传之他人但以示子侄辈使知仕宦之艰耳 其九
863954,送鹿伯可致仕归天台兼简致政龙学给事吴明可丈
1222554,邓教授致仕还江东
585585,致仕归舟过燕子矶留题刻石
382226,武馀清乐为致仕尹将军赋
662023,寄赠彭元岳佥宪致仕
507261,送春官侍郎仪公致仕归山东
659769,贺杨宗伯月湖致仕
740796,赠介对江吏部致仕归解州
508966,汉宫春 题半身停箫仕女
342781,自守·薄仕功名未计高
676585,仕宦不得意二首 其二
673510,庆致仕阁老商先生寿七十
97622,送刘伯瑞·居乾与仕者
494075,赠吾廷介致仕归开化诗四首 其四
947269,送关都官致仕 其三
929782,致仕后即事十五首 其三
376723,寿傅守·当年膴仕早标缨
99524,赠仲素寺丞致仕归隐潜山
647563,题周昉折花仕女图为刘士宾赋
602500,卧病已经弥月递运大使姑苏陆一鲸念余尝仕其郡数来问讯余心嘉其谊也病起因赋四韵示之
482535,送翰林宋先生致仕归金华二十五首 其五
680600,梅隐为丁仕器题
34293,赠送致仕郎中
506974,送义门郑御史致仕还乡
514577,挽致仕于千户 其二
533791,送少师李公致仕还淮南 其一
692507,题梅送王琼玉致仕
155068,送蒲霖中舍致仕归阆中
404598,忆江南·题谨怀绘红楼梦仕女图十首 其八 妙玉
769695,沁园春·赠刘在园先生致仕之作
521789,张虞咨以南京左军都事满考乞致仕升鸿胪寺丞南归会于崇武驿托附平安有感书赠
118354,送毛君致仕还乡
681575,仕女戏婴图
1252540,题张士厚四时仕女四首
681092,和张宪长赠吴都宪致仕诗
48005,芭蕉仕女图·佳人春睡倚含章
922922,元丰己未三院东阁作 元丰戊午夏予尹京治陈氏狱言者以为推劾不尽诏移大理而理官推迹陈氏姻党干求府政纵出重辟事下御史推求己未岁予自濠梁赴台讯鞫卒不涉干求之迹而大理反有傅致之状虽蒙辩正听命久之不得出邑邑不已作诗十篇记一时事非欲传之他人但以示子侄辈使知仕宦之艰耳 其七
508801,赠韩都宪永熙致仕
673441,送李守讷致仕南归诗 其一
558585,苏州别驾周德中以余致仕居间而称神仙太守作十绝复之 其七
991517,寄洪州致仕李国博
549116,濮州张侍御在嘉靖中弹劾不避权贵廷杖足跛后晋符卿致仕殁数十年而子沧西登第具册索诗因赠
686771,维洛美刘子也刘子仕洛为大夫作室以奉母君子名之曰荣养风人美之故作是诗焉
1040367,致仕后立春偶成
555928,禹卿归秦仕儿留此难于为别以此慰之 其一
508508,脩竹仕女
947270,送关都官致仕 其二
681686,送太宰杨碧川致仕
652599,桃花仕女诗 其五
923268,朝议大夫致仕张公挽辞二首 其一
660898,送茆大卿致仕还溧水 其二
482539,送翰林宋先生致仕归金华二十五首 其十四
76163,破阵子·仕至千锺良易
577124,题致仕尚书严公震直所藏苏东坡墨竹
948325,临川梁译投冰溪救母谢昌国作孝德记杨廷秀有诗次其韵译不仕年四十九而终 其二
273765,醉吟商小品·充和画仕女
654958,送陈员外致仕归吴 其二
81653,示子孙·为贫出仕退为农
929783,致仕后即事十五首 其九
139255,和远老·身居仕路梦家山
52249,太平太傅致仕
662094,兰州闻见素致仕用前留别韵奉寄二首 其一
578554,景泰元年七月二十日蒙恩致仕八月二十一日早于奉天门阶辞奉旨赐酒饭毕复宣至左顺门赐衣一袭俾归服用内大红纻丝圆领一织金獬豸青纻丝搭护一绿纻丝摺子一退赋诗一首以纪其荣云
