922938,太子太保致仕李公挽辞二首 其一
566508,送吴方伯致仕
211240,和孔义甫送谢丈致仕
533793,送少师李公致仕还淮南 其三
404599,忆江南·题谨怀绘红楼梦仕女图十首 其九 尤三姐
1221518,东山书隐为郑原宜赋郑本越人居东山先世徙杭遂家焉尝筑室西湖上从徐勉庵授书经因以为扁示不忘本也原直事亲以孝闻及筮仕都卫尤有声誉故赋长句以美之
940784,题高将仕墨梅
649938,题梅送王琼玉致仕 其二
509938,吴主簿诗主簿名则宣平人吴黄门仕伟之父也 其三 卜筑西溪
1002570,送元厚之资政致仕归苏州
560546,仕女图
345541,余大观中偕何袭明登仕同为太学诸生别后二十六年余
923317,恭和御制赐太师致仕文彦博五言六韵诗一首
1244601,过程河池墓（公名德仕宋为河池令元兵入邑度不能支与夫人同经于官舍）
933783,致仕后述怀六首 其三
206769,上致仕赵中令
692518,送龚燧宪使致仕
809810,吏部尚书引年致仕宋荦因朕六旬寿庆祝来京事毕五月内回本乡朕念旧臣特书七言律一首以纪其事云
530550,晋阳致仕　时年四十五
404594,忆江南·题谨怀绘红楼梦仕女图十首 其四 湘云
853143,胡登仕送花 其一
577453,寄致仕宗人府经历黄子中
1000981,致仕
171537,次韵贺邱国镇致仕
853142,胡登仕送花 其二
1070181,刘朝散长源淮夫刘先生彝之子孝弟有贤行年六十一且致仕侍其亲义兴为赋诗一首
894279,致仕得请泛舟归第
671965,修竹仕女图
614955,赠李中丞自滇中致仕还里 其四
152165,登仕郎曾忠佐迎母王于乐氏母许新居成即归于
206393,寄赠华山致仕韩见素
929786,致仕后即事十五首 其六
578488,送王编修先生致仕归吉水
598879,渡江舟次寄送桢伯致仕还里中 其二
1071760,送韩将仕自抚之衢
78093,穷居·仕宦初何得
187276,送庐陵郭佥判致仕归
948976,登仕郎张武来求一言因记衰颜就以勉之
1050472,送陈辑都曹致仕还乡
136618,次韵王将仕·白雾重重山复山
532024,三江毛尚书致仕归姑苏留别次韵
669140,赠吴仕贤
674864,林见素致仕寄诗就用奉别
661084,送胡司徒致仕
674484,送潘黄门致仕
1195993,送礼部潘尚书致仕还建安
19734,送滕庶子致仕归婺州
509368,天顺癸未夏大司空南宫白公省堂之后以盆池植莲数本六月中旬有花亭亭出水间世传植莲须谷雨前过此而植则无花惟此莲五月才植今已相次盛发而初发一朵尤高洁可爱异于常品他公馆寓第虽先谷雨而植者犹未有花是诚司空公之贤超越群辈故造物者先时发此以彰美之况公以忠清刚正简在圣衷年逾强仕已峻擢柄用若此异时进台衡掌钧轴展大谋猷建大勋业以俪美古之大贤君子不卜可知是又必宰造化者预以此而示兆也前监察御史孟端之子公乘暇具酒肴延太子少保
121567,再次韵·仕为饥寒近
653017,赠致仕徐乐馀
863422,忆旧游寄致仕了倩寺丞
504534,胡生仕中九日载酒
906871,送赵侗承议致仕归
79459,寓言·出仕谢招麾
652146,送太守致仕
183039,湘潭·禄仕飘然寄楚乡
969482,和寄王五四将仕 其二
834487,瑞鹧鸪 题朽道人京俗画册十七阕 旗下仕女
192606,朱侍郎致仕南归上特锡宴于玉津园仍诏两製三
221062,妾薄命·夫君仕虢州
697697,送陈宗显致仕还乡
667820,送张都阃致仕归二首 其二
319855,冬日·仕路人难定
660984,送王实庵太宰致仕
923267,朝议大夫致仕张公挽辞二首 其二
1105346,胡登仕送花
575972,饯宋承旨潜溪先生致仕归金华七首 其二
696720,仕宦不得意二首
859032,致仕虞部曲江谭君挽辞
312925,黄金缕·折梅仕女图
511642,送南京户部员外林原朴先生致仕
671005,为周真阳题芭蕉仕女图戏呈吴明卿使君
338117,题许云江梅花仕女帐额
672392,送张定庵尚书致仕还云间
522414,顾虚斋在湖南闻予致仕有作席间诵之次韵为谢
655204,送致仕袁太守士瑩访旧南归
702343,送陆司寇先生致仕还四明
668628,致仕出京言怀 其二
673055,送宫保徐公致仕
220605,赴金陵典斛·仕历四千石
533780,送顾囧卿致仕
290100,题陈小溪画仕女
576184,送翰林宋先生致仕归金华二十五首 其十六
650207,赠杨景衡致仕还永嘉
560050,送蔡良医孟颐致仕桐川
203699,寄王五四将仕·季叔青天轰霹雳
274910,咏史·方朔仕汉廷
1216226,简秦景容郎中昨日承歌谈笑适诗酒相忘有放浪形骸之意以谓到闽以来无此一乐但伤足下以特达之材㙳坷仕路走也辱为知己之游不能拔而出之此安足为故人耶诗以志怀聊伸雅叹
287088,孙师郑以感逝诗徵题诗分甲乙二集辛亥后不仕者入甲集出仕者入乙集大半亦我师友也
287088,孙师郑以感逝诗徵题诗分甲乙二集辛亥后不仕者入甲集出仕者入乙集大半亦我师友也
337895,罗真隐已化数年曾纠仕五羊病中尝访渠为之求乐曾知其已逝颇有问答曾今为漳倅亲与东庵道老言之
922928,元丰己未三院东阁作 元丰戊午夏予尹京治陈氏狱言者以为推劾不尽诏移大理而理官推迹陈氏姻党干求府政纵出重辟事下御史推求己未岁予自濠梁赴台讯鞫卒不涉干求之迹而大理反有傅致之状虽蒙辩正听命久之不得出邑邑不已作诗十篇记一时事非欲传之他人但以示子侄辈使知仕宦之艰耳 其二
78880,致仕後岁事有望欣然赋诗
677866,题叶仕晦岊水风帆图
532048,文衡山致仕言归次韵二首 其二
668598,送石斋太傅致仕还蜀 其二
704007,天顺癸未夏大司空南宫白公省堂之后以盆池植莲数本六月中旬有花亭亭出水间世传植莲须谷雨前过此而植则无花惟此莲五月才植今已相次盛发而初发一朵尤高洁可爱异于常品他公馆寓第虽先谷雨而植者犹未有花是诚司空公之贤超越群辈故造物者先时发此以彰美之况公以忠清刚正简在圣衷年逾强仕已峻擢柄用若此异时进台衡掌钧轴展大谋猷建大勋业以俪美古之大贤君子不卜可知是又必宰造化者预以此而示兆也前监察御史孟端之子公乘暇具酒肴延太子少保
67225,蕉萱仕女
83842,初春书怀·纳禄贫如筮仕初
668609,送乔冢宰致仕还太原二首 其一
593767,送华光禄致仕归无锡
509042,三茅观与左迁钱学士致仕陈太常宴集分韵 其一 沧字
473606,仕女观流水小景
664478,送钱水部致仕次杭秋官韵 其七
532674,送陈都御史致仕陈苏州人赣州巡抚 其三
78331,杂感·早仕谗销骨
525153,田舍闻柴京兆致仕
507034,送程大参致仕还闽中
665162,送南京太常卿穆公玄庵致仕还山东
152096,中奉大夫直徽猷阁致仕邵及之挽词
878097,赠许登仕
872674,薄暮游潘登仕园园有堂三间榜曰一枝盖湖公枢密两取庄周郤诜之语既以嘉潘亦以勉潘之二子因用其意各赋一绝 其一
326906,汶上·仕非其地宁无仕
326906,汶上·仕非其地宁无仕
927274,谢富丞相招出仕二首 其一
497825,致仕后戏作 其一
1072865,左世绩妙年登第而飘泊遐荒十年不得调盖尝以事忤权贵今公道方开始欲仕进索余赋诗
652992,题芭蕉仕女图
203517,嘲贺将仕·花何太喜谁能赋
1038399,郎侍郎致仕
19674,刑部尚书致仕
1047464,讽仕 其二
690405,苏州别驾周德中以余致仕居间而称神仙太守作十绝复之
182158,赠邢子友·忆昔筮仕初
319350,改建贤良祠于祠中设仕学院书示众官祠祀杨清师端公亲仁、胡文忠公林翼
89388,昔仕·昔仕年伤早
89388,昔仕·昔仕年伤早
163816,水调歌·仕宦至卿相
514237,寿邳州致仕都督韩公八十
250652,回京车上步仕玲韵
859030,致仕邵少卿挽辞二首 其二
1245368,朱长史致仕还里
614873,春日同成靖之马时良林仕济集徐山人水亭骤雪得浮字
200074,次刘机将仕韵
159982,次韵玉汝弟乞致仕不允
649110,送郭鼎贞致仕还临江
196898,题披云阁·仕路无如衣彩荣
509936,吴主簿诗主簿名则宣平人吴黄门仕伟之父也 其一 军门止杀
75970,春日杂兴·出仕常骑秃尾驴
1117085,送文太师致仕还洛三首
960948,送庐陵郭佥判致仕归
321448,唐质肃公·子方筮仕初
779376,凌波曲 孙媖如女士嘱题吹笛仕女团扇
170073,题高将仕墨梅
1235585,送刘将军致仕归襄阳
812406,题许云江梅花仕女帐额
507026,和致仕祭酒胡公诗三首 其三
927273,谢富丞相招出仕二首 其二
84881,之句因·仕宦五十年
152166,登仕郎张武来求一言因记衰颜就以勉之
580801,致仕作金石丝竹匏土革木
310945,醉思凡·北来友人劝予出仕，戏书示之
526921,赠陈千户致仕
1047463,讽仕 其一
948794,通直郎致仕刘楹挽词
22583,孔尚书致仕因而有寄赠
233200,山阳·古人急於仕
578851,送宗兄仕崇还长乐
183475,太子太保致仕李公挽辞
953820,闻沂州卢侍郎致仕有感
980594,说之方忧韩公表大夫疾遽致仕乃蒙传视送陈州王枢密诗十首意典辞丽忻喜辄次韵和呈以公若登台辅临危莫爱身为韵 其十
1196010,送萧尚书致仕归庐陵
50718,闻杨君谦致仕
493683,蒙恩再赐致仕
160417,寄致仕李洵大夫
555562,勉仕男读书
590736,中洲别号为浏阳致仕甘翁题名正邦
203674,寄王五四将仕
506950,送中书陈宗渊致仕还乡
1208453,知足斋歌（东海蔡平甫未七十致仕以知足名斋其子升卿与予为同舍生江陵郡庠）
232262,杨干致仕·黄钟毁弃鸣瓦釜
610221,赠黄仕明进士 其二
103717,吊裴易进士·力学未及仕
682013,致仕辞朝
176585,选官图·百年穷仕宦
404591,忆江南·题谨怀绘红楼梦仕女图十首 其一 宝玉
742723,道光壬午五月自曹镇任奉命致仕返黔俶装将行赋长句四章敬以纪恩兼用志别 其一
686764,奉送大司马华容刘公致仕二首
650206,赠孙博士致仕还丰城
664025,送梅轩蒋司徒致仕归湘源二首 其二
494074,赠吾廷介致仕归开化诗四首 其三
593900,送郭方伯应宿致仕还滇中二首 其二
34322,和致仕沉郎中
652059,送李永年大参致仕十首 其九
468816,芭蕉仕女图
808537,李大理仕鲁
118811,致仕还洛三·西都风物汉唐余
589750,送俞掌教致仕
948522,中奉大夫直徽猷阁致仕邵及之挽词二首 其二
664473,送钱水部致仕次杭秋官韵 其二
653649,送徐尚宝致仕
558582,苏州别驾周德中以余致仕居间而称神仙太守作十绝复之 其四
1035730,赠华山何学士致仕
521470,张廷肃宪副致仕归中途得二郎子德捷报
969481,和寄王五四将仕 其一
575976,饯宋承旨潜溪先生致仕归金华七首 其六
662061,奉赠蒋师相敬所致仕归湘源兼简令兄大司徒二首 其二
649977,送龚燧宪使致仕 其二
366769,送刘中允涣年五十馀以颖上县令致仕卜居庐山
560699,脩竹仕女
1224026,从兄德观父与集同出荣州府君宋亡隐居不仕而殁集来吴门省墓从外亲临邛韩氏得兄遗迹有云我因国破家何在君为唇亡齿亦寒不知为谁作也抚诵不觉流涕因足成一章并发其幽潜之意云
659255,送江仕通之莆田寓言
159696,致仕得请泛舟归第
1026193,送张七元构仕亳州
648181,送刘敦信致仕
922923,元丰己未三院东阁作 元丰戊午夏予尹京治陈氏狱言者以为推劾不尽诏移大理而理官推迹陈氏姻党干求府政纵出重辟事下御史推求己未岁予自濠梁赴台讯鞫卒不涉干求之迹而大理反有傅致之状虽蒙辩正听命久之不得出邑邑不已作诗十篇记一时事非欲传之他人但以示子侄辈使知仕宦之艰耳 其八
660896,送李司徒致仕 其二
552939,送宿州同知胡仲立升授凤阳府通判致仕还里
555126,予致仕归因重葺下皋山庄以居偶诵宋马子才浩浩歌胸次洒然若有得遂次韵以道所怀
576180,送翰林宋先生致仕归金华二十五首 其九
170499,为贫而仕·为子入官须事道
593682,初秋雨中同黎惟敬秘书刘仲修观察李袭美明府蒋少翼吴仲周滕晋生李惟仕朱汝修陈从训六徵士集李临淮惟寅宅得卮字
672157,潮州寄致仕雷大尹
1125223,说之方忧韩公表大夫疾遽致仕乃蒙传视送陈州王枢密诗十首意典辞丽忻喜辄次韵和呈以公若登台辅临危莫爱身为韵
598714,迓陈洛南尚书致仕
975204,次韵田将仕年八十八岁作诗自喜三首 其一
958706,观孔义甫与谢致仕诗有感
833729,高阳台 奂庭偶得仕女图一帧，谓与其亡室相似，因借作遗挂，为题此词
787702,题许云江梅花仕女帐额 其一
1190919,从仕
361301,致仕后立春偶成
859031,致仕邵少卿挽辞二首 其一
515523,寿致仕学谕松坡王先生
1231057,奉饯御史中丞汪公大司徒致仕归陇右
547533,送少傅陈相公致仕还蜀二首 其二
1099939,罗真隐已化数年曾纠仕五羊病中尝访渠为之求乐曾知其已逝颇有问答曾今为漳倅亲与东庵道老言之
678728,送余侍讲致仕南归
508734,送韩旸布政致仕还越
199075,杂诗·妯仕任固小
652598,桃花仕女诗 其四
62107,送待诏文徵仲先生致仕
958710,和孔义甫送谢丈致仕
513937,分得先字寿致仕谢太守
674777,送王兵侍质庵致仕
664039,送松月伍中丞致仕还松滋
834948,月华清 为友人题所得《梅花仕女图》
1156355,送滕庶子致仕归婺州
948826,新光州守赵师奭字国佐才高一世仕京口以谗废宰太和以忧归得郡待对没于逆旅家会稽又遭焚识者闵之今既葬矣其子寄行状求追挽嗟悼不足情见乎辞
201651,刑部侍郎仕王熙仲挽词
404593,忆江南·题谨怀绘红楼梦仕女图十首 其三 宝钗
676584,仕宦不得意二首 其一
920265,和刘长安题薛周逸老亭，周善饮酒，未七十而致仕
558584,苏州别驾周德中以余致仕居间而称神仙太守作十绝复之 其六
1109799,嘲贺将仕
794814,眼儿媚 题仕女图
178728,穗粟·世乱弃禄仕
658957,喜玄敬少卿致仕
1009165,送陈学录求仕
924156,送青州签判俞退翁致仕还湖州
492618,公文契尚书由参政山西入拜礼部而予以侍郎起于家同日拜命赴南宫今承恩致仕又适同日公文有别业在溧阳予将南还泰和于别也不能以无词焉因赋二律诗为赠 其一
840555,孙师郑以感逝诗徵题诗分甲乙二集辛亥后不仕者入甲集出仕者入乙集大半亦我师友也二首 其二
840555,孙师郑以感逝诗徵题诗分甲乙二集辛亥后不仕者入甲集出仕者入乙集大半亦我师友也二首 其二
32407,将卜兰芷村居留别郡中在仕
977403,水调歌头 致仕得请
506949,送顾都御史致仕还乡
880029,贺陈子扬致仕追赠父母二首 其二
578492,送陈叔刚郎中致仕
496033,沁园春 其七 送太子太保大司空小泉林先生致仕
506849,送张纪善世昌致仕归乡
521521,方石先生季父逸老以宝庆守致仕先生名其居曰悬车旧第宝庆殁先生有诗命次其韵
919993,送陆放翁赴落致仕修史之命
69350,家仕叹·小仕时为养
69350,家仕叹·小仕时为养
681728,送仕绎张兄复任河间
664474,送钱水部致仕次杭秋官韵 其三
566518,送曾侍郎致仕
579013,寄致仕南阳李文明太守
99197,陈季常见过·仕宦常畏人
554503,送陈宗显致仕还乡 其二
648864,送周存诚州判致仕归清江 其一
687674,送翰林宋先生致仕归金华二十五首
92036,题尤延之右司遂初堂·漫仕风中絮
872675,薄暮游潘登仕园园有堂三间榜曰一枝盖湖公枢密两取庄周郤诜之语既以嘉潘亦以勉潘之二子因用其意各赋一绝 其二
152456,通直郎致仕刘楹挽词
136243,次韵王将仕
1116879,太子太保致仕李公挽辞二首 其二
672358,贺姑苏李太仆少卿致仕
683020,送石斋太傅致仕还蜀
951709,次韵奉酬致仕通直吴七丈上元所寄之什
696401,奉候林见素都宪平蜀寇致仕三首
48253,题芭蕉仕女
580190,甲辰仲冬十日会同年周世祥于杭酌酒联句五首时世祥已致仕矣故云 其三
576175,送翰林宋先生致仕归金华二十五首 其一
240992,予自南京留守推官循资为掌书记由将仕郎超阶
207827,绝句叙旧·仕已都无喜愠三
1073507,余大观中偕何袭明登仕同为太学诸生别后二十六年余□南迁道清江袭明逆余于新淦之洲上苍颜白发大略相似感叹之馀饮酒赋诗以为笑乐袭明笔力雄赡操纸立就凡六七反必用前韵余继和者十二篇云 其一
294113,忆江南·题谨怀绘红楼梦仕女图
345185,送莫和中刑部致仕归吴兴
1210720,送周集贤正平致仕东归
1208395,赵侯发白返黑（后卫千户致仕年八十八吏前卫时王千户杀西相至今能谈其事）
659780,赠太老石斋翁致仕 其二
660900,送刘司寇致仕还苏州
253084,题刘金珠惜花仕女图
234989,和寄王五四将仕
857738,工部尚书致仕王懿敏公挽词
1175194,送李庶子致仕还洛
958685,赠陈通其致仕頣寿轩
558189,贺漳州太守姜用贞致仕
260331,送宋司狱致仕
614953,赠李中丞自滇中致仕还里 其二
980041,致仕后间夜雨
980595,说之方忧韩公表大夫疾遽致仕乃蒙传视送陈州王枢密诗十首意典辞丽忻喜辄次韵和呈以公若登台辅临危莫爱身为韵 其七
692393,送王文英典籍致仕归金华
383044,送太宰梦山杨公致仕
637490,送司马宪副伯通致仕
680008,赠致仕林相公
173904,挽朝请大夫致仕李公词
370728,绮罗香·题纨扇仕女
550945,水明楼赠陈仕卿
903355,韩子师尚书致仕
513463,送陆司寇先生致仕还四明 其二
653653,送许道中致仕
356183,简赵紫芝·紫芝虽漫仕
660640,饮仕弟淮安官署
796520,念奴娇 为声甫甥题“戏猫仕女图”
479079,送李贞伯致仕
481609,团扇仕女
532673,送陈都御史致仕陈苏州人赣州巡抚 其二
663301,奉送大司马华容刘公致仕二首 其二
1062995,京兆王持正叔以特诏至阙下除将仕郎放归山意若不释然者于其行置酒以饯之 其一
692597,和致仕祭酒胡公诗三首
1106073,致仕邵少卿挽辞二首
330370,致仕·南北纷纷不觉尘
692404,送何布政致仕东归
48679,红绿蕉二仕女图
368072,乡思·达仕租千石
779357,伊州三台 题云林扇头弹琴仕女
513320,仕女图
655017,送冢宰钱先生致仕归淞
844482,念奴娇 为穰庼题仕女纨扇
511521,题徵仕郎张公孺人区氏墓志后
683023,送乔冢宰致仕还太原二首
857957,资善堂御筵送太子少保致仕李柬之归西京
578491,送易镇抚致仕还五开
1249829,题张士厚四时仕女四首 其一
1249209,送周仕宣南台典史分题得芙蓉堂
508640,筠川书屋为清河太守致仕李君赋
152131,游元龄登仕写予真求赞
278410,天寿观·陈锜不仕仰高风
684427,送张都阃致仕归二首
80482,遣怀·出仕才堪斗大州
404596,忆江南·题谨怀绘红楼梦仕女图十首 其六 迎春
49107,古意·陶潜不愿仕
126571,出仕·相招多谢不相遗
916346,次韵和致仕李殿丞寅见寄之什因以纪赠
107274,五言绝句·春秋逾致仕
1055598,和郭功甫赠陈待制致仕二首 其二
130215,为韵见·吾仕竟三黜
79378,杂兴·仕宦遍四方
563914,往岁破桶冈宗舜祖世麟老宣慰实来督兵今兹思田之役乃随父致仕宣慰明辅来从事目击其父子孙三世皆以忠孝相承相尚也诗以嘉之
13350,韦常侍以宾客致仕同诸公题壁
922937,太子太保致仕李公挽辞二首 其二
686731,送钱水部致仕次杭秋官韵
585783,时有冯甥仕卿同游白云因为首尾吟以足其胜
1231741,访偶武孟篬筤轩时武孟制满求仕
560605,梧桐仕女
1118413,致仕后即事十五首
881160,寄王五四将仕 其二
555335,致仕过常思岭兰若和故友彭从吾韵二首 其一
696202,送茆大卿致仕还溧水
614952,赠李中丞自滇中致仕还里 其一
660149,和答西涯见寄诸作致仕述怀韵 其二
34620,送致仕沉彬郎中游茅山
881214,嘲贺将仕 其二
639098,赠华仁甫少参致仕东归
484898,送赵史君致仕归别业
1059110,送李子威致仕还乡
1234653,贺张景亮知州致仕
505798,近郭产瑞莲二枝同邹孟彰杨德显何仕琏赋
652247,送张司马致仕
215668,答虞醇翁·辍学以从仕
366396,送李监丞致仕还乡
488919,送罗君仲矩致仕还乡
560070,送杨仲举先生致仕来朝升侍郎而回
1167651,寄赠致仕沈彬郎中
558579,苏州别驾周德中以余致仕居间而称神仙太守作十绝复之 其一
660779,送徐州苏指挥致仕
478664,贺肤庵先生致仕
644353,赋一曲亭送赵本初待制致仕归越
1038763,故兵部侍郎致仕安定公挽辞三首 其三
659779,赠太老石斋翁致仕 其一
516251,送傅北潭宗伯致仕
593390,送大宗伯古林何公致仕南归二首 其一
794877,柳梢青 题竹林仕女图
109478,赠胡侍郎致仕
978716,次刘机将仕韵
660627,送李亚卿致仕
355775,送叶善卷致仕归吴
586749,送陈学谕致仕归曲江
134087,送光禄王卿致仕归荆
1040991,过士建中屯田居此君年六十请致仕所居蔽风雨而已
506825,送徐太守仲敬致仕
51124,送李贞伯致仕
1012372,朱熙载作平阴令八十日致仕而归
647735,送马先生致仕还松江
98090,偶作·未仕思从仕
98090,偶作·未仕思从仕
914118,圣恩增秩进职致仕感恩述怀
629076,送黄仕明宫谕
560290,送张先生致仕归闽 其二
113807,郭郎中休官·仕路风波双白发
1155616,雪暮偶与梦得同致仕裴宾客王尚书饮
658152,强通致仕
1107830,次韵王将仕
844697,孙师郑以感逝诗徵题诗分甲乙二集辛亥后不仕者入甲集出仕者入乙集大半亦我师友也二首
844697,孙师郑以感逝诗徵题诗分甲乙二集辛亥后不仕者入甲集出仕者入乙集大半亦我师友也二首
576186,送翰林宋先生致仕归金华二十五首 其十九
104283,勉致仕李秘监
652055,送李永年大参致仕十首 其五
133674,朱熙载作平阴令八十日致仕而发
576185,送翰林宋先生致仕归金华二十五首 其十七
681464,脩竹仕女
660629,送列县丞致仕
924869,送毛君致仕还乡
526968,送郭大参于汉致仕
663290,赋得将有事于西畴送王中丞致仕
936704,致仕后即事十五首 其十一
660897,送茆大卿致仕还溧水 其一
655162,送萧文明佥事致仕号海钓
479069,次韵任太常致仕留别五首 其五
929787,致仕后即事十五首 其十五
553706,送郑尚书致仕
648743,送李员外致仕
583260,送丁仕敏赴苕溪宰
215252,致仕虞部曲江谭君挽辞
640258,钱博士致仕还会稽赠别兼柬赵待制
170266,怀古·羲之誓墓终不仕
929780,致仕后即事十五首 其十三
540578,刑部狱官致仕乞赠
796911,阮郎归 题倦绣仕女图
35086,送礼部潘尚书致仕还建安
681245,送金太守致仕
1167609,送致仕沈彬郎中游茅山
1073508,余大观中偕何袭明登仕同为太学诸生别后二十六年余□南迁道清江袭明逆余于新淦之洲上苍颜白发大略相似感叹之馀饮酒赋诗以为笑乐袭明笔力雄赡操纸立就凡六七反必用前韵余继和者十二篇云 其二
555114,致仕归言怀效吴体四首 其一
654651,送余佥宪致仕归南城
79391,杂咏·仕囷风波归可乐
555117,致仕归言怀效吴体四首 其四
687744,五十三初度太虚以诗见寿且有见促从仕之意
1041638,送李监丞致仕还乡
1038759,故端明殿学士工部尚书致仕清源王公挽辞二首 其一
702387,挽致仕于千户
575742,寄石滩陈仕行
385267,送石斋太傅致仕还蜀
164550,送子倅宜春·爱子喜能仕
1247030,孤也不天十有二年矣我先君读书号该博凡平生辛苦而得之者仅见于文辞仕又最晚而位不大显海内器赏不过大参王公继学侍御张公梦臣数人而已呜呼痛哉其忍言诸日者辱养吾先生为题文集五首并序铭一通读之再四涕泪迸落诗语俊逸序约而不遗铭丰而不剩古之作者正如此且典雅奇奥次第刻石墓上以贻不朽其长篇尤浏亮铿锵自成机轴是晚疮作傲兀枕上命次儿鹤奴随读随和遽尔成章鄙俚腐熟纵力焉而不逮也幸有以教之
1046664,徐程致仕寄之
507045,送刘子钦致仕还乡
947271,送关都官致仕 其四
747360,送六安田小泉刺史致仕归临潼
579929,竹轩为致仕萧方伯题
575975,饯宋承旨潜溪先生致仕归金华七首 其五
143165,吴子珍登仕避地大宁示赓韵以谢
1094140,昌甫诗叙同僚以皆为南岳监也昌甫秩满又重请于庙堂矣次韵少笃仕契
40556,数名诗·一身仕关西
695487,赠太老蒋敬所致仕
488954,送罗君仲矩致仕还乡
664024,送梅轩蒋司徒致仕归湘源二首 其一
558165,樊公名瑩字廷璧常山人仕终工部尚书守松郡不三年而遗惠无穷咏此不特为其诗也附写怀原韵二首 其二
742726,道光壬午五月自曹镇任奉命致仕返黔俶装将行赋长句四章敬以纪恩兼用志别 其四
766614,声声慢 题姜晓泉埙听秋仕女图
479066,次韵任太常致仕留别五首 其二
77143,冬日·仕如柳柳州
592585,送霍别驾致仕次乃弟太仆韵
1035503,上致仕赵中令
930863,五月七日拜致仕敕口号二首 其一
494250,送少司空韩信山致仕归东鲁
452807,题刘金珠惜花仕女图
433444,为友人题仕女画四绝句
372110,昌甫诗叙同僚以皆为南岳监也昌甫秩满又重请于庙堂矣次韵少笃仕契
857755,刑部侍郎致仕王熙仲挽词
559782,送县令致仕
1040672,招致仕诸君饮
576178,送翰林宋先生致仕归金华二十五首 其六
134407,寄赠致仕刘都官
695763,送黎秘书惟敬得请致仕二首
508145,送户部尚书沈公致仕
875433,昔仕
530535,山东参议致仕归　时年四十三
480042,送神武蔡千户致仕还湖州（进士中孚之父）
1152428,将卜兰芷村居留别郡中在仕
1038762,故兵部侍郎致仕安定公挽辞三首 其二
1238832,家仕叹
1177328,送沈芳谒李观察求仕进
225632,纪德·仕途例皆谄笑耳
