978453,永嘉魏秘校访仆萧寺且言出处甚详属与余同客昆山使人不能无怀魏云欲还故乡而吴中儿女森森如立竹矣因用所惠诗韵聊缀数语以塞来意韵长不复檃括资客中一噱可也
509273,荣寿堂为昆山项御史璁题
507283,昆山
446153,辛卯初冬与杨兄启宇、王兄邦建游昆山千墩镇，谒顾亭林先生墓，感成四律 其二
569540,题潘中丞芝林时昆山书院成芝满于林故以名焉
585293,胥门与方昆山思道 其二
380630,赠左昆山·将军十六拥金貂
1102115,昆山
1218808,送陈性之昆山从事
70830,迎仙客·道非遥昆山隔
978439,予客昆山得荐严长老时道人散朗閒远不交人事心甚敬之今来海上复得悟公老成疏练能言吴中山水人物甚详东轩种竹如云不问其人可知也一日忽起故山之想予语悟野田荒草在处愁人心目安能复作沩山之牛乎因作一诗言君子出处之大致以告不知者
1249704,顾仲瑛避地嘉兴几二年闻回昆山往不见遇作诗寄之末章兼简白西长老二首 其一
36577,兵后早春登故鄣南楼望昆山寺白鹤观示清道人并沉道士
1178092,苏州昆山惠聚寺僧房
167734,昆山·岁久阡原变
537959,大梁王君用章既去昆山为客部副郎邑人俞仲蔚集古语为八咏饯行要余与家弟和之各得四首毋论其辞之当与否而感德怀贤要自不异也 其三 处处春云生
849529,送昆山丞谢子潚解官还朝
375300,刘改之葬昆山山寺下邑人不知葬处
470930,十月二日亲朋拿舟追饯有同至昆山者时溪父卧病寺中
1241187,登昆山寺谒刘龙洲墓
681489,送僧归昆山
51906,过昆山·桃花杨柳共西湾
606478,送周伯绳比部给假归昆山二首 其一
840371,舟行太仓昆山之閒即目四首 其一
71139,登昆山寺谒刘龙洲墓
885795,华亭百咏 其十七 昆山
189675,玉井泉·云蒸昆山液
267216,摸鱼子·马鞍山访龙洲道人墓，山在昆山县西北隅
1244930,昆山谣送友人
1159305,唐乐府十首 其八 昆山
1205481,定风波 昆山路漕席上
490733,昆山晚归
233645,子客昆山得荐严荐严长老时道人散朗开远不
562831,自画吾松小昆山二首 其二 长松高士图
882629,昆山龚立道昱有月石砚屏斗南君玉诸人皆有诗余亦赋一绝
49547,昆山题画
1047490,昆山
489774,昆山五咏 其四 刘龙洲祠
699300,昆山五咏 娄侯庙
490777,昆山晚归漫兴
470909,昆山响梵阁怀季常上人游九峰二首 其一
1118911,石千里来自昆山陈阔未几倏尔言别辄成诗少舒恋恋
1061629,泊昆山
214127,昆山慧聚寺次张祜韵
49513,昆山响梵阁怀季常上人游九峰
77947,寄题龚立道昆山栖闲堂
1244880,昆山即事寄友人
1208474,游昆山慧聚寺和唐人诗二首 其二
938330,石千里来自昆山陈阔未几倏尔言别辄成诗少舒恋恋 其二
969982,与诸公会饮昆山放生池亭
104825,送良玉人上还昆山
702846,自画吾松小昆山二首
490809,舟发娄门夜抵昆山
976658,到昆山
128814,昆山吕正之三男子
772100,次韵答苏昆山上舍「乞菊」
469615,昆山听杨生曲有赠
1208473,游昆山慧聚寺和唐人诗二首 其一
1038804,昆山初秋观稼回县署与同寮及示姑苏幕府
246813,与诸公会饮昆山放生池亭
1249705,顾仲瑛避地嘉兴几二年闻回昆山往不见遇作诗寄之末章兼简白西长老二首 其二
670643,秋前夜过昆山寄仲蔚时元美兄弟俱就徵车
389427,南歌子·舟泊昆山访玉山草堂遗址
939783,别叔父昆山丞
556138,送王舍人往昆山为顾相公营墓
985484,归昆山省亲别太学同舍 其一
64121,桐孙曲·昆山玉轸苍梧云
659174,王成宪府博自昆山来为予七十寿成宪时年七十八矣追数京师诗社中人惟予两人在者感刘禹锡诗因成四首 其三
485035,送石明府之昆山
969979,昆山吕正之三男子连中神童科盖奇事也建康严别驾为之赋诗某因次其韵
889435,谢子肃任昆山丞和余留题旧游诗复次韵谢之
108180,送昆山州教刘表侄
793931,顾山山茶和昆山顾潜
537960,大梁王君用章既去昆山为客部副郎邑人俞仲蔚集古语为八咏饯行要余与家弟和之各得四首毋论其辞之当与否而感德怀贤要自不异也 其四 轩盖照墟落
489727,赋得昆山送蔡广文
266700,五彩结同心·昆山真义镇之东亭子为顾阿瑛玉山佳处故址之一
109288,到崑山·客槎无路到天津
574173,松风阁赠方昆山用顾与成韵
489775,昆山五咏 其五 朱节妇墓
1231522,昆山道中
509274,送昆山赵进士博还京
748742,游昆山吊徐健庵尚书传是楼故址晚与数客饮山下酒家
938331,石千里来自昆山陈阔未几倏尔言别辄成诗少舒恋恋 其一
520783,昆山清真观
480820,题昆山沈愚通理诗集
764933,南歌子 舟泊昆山访玉山草堂遗址
667329,秋日徐子复从昆山来同游高云从水居
508716,送周德元还昆山以文学举阻于例而归
342760,昆山·九峰西峙比昆崙
123007,夜发昆山·岁寒人墐户
446155,辛卯初冬与杨兄启宇、王兄邦建游昆山千墩镇，谒顾亭林先生墓，感成四律 其四
101346,奉送自强明府之官昆山
740860,自昆山归抵江阴
659173,王成宪府博自昆山来为予七十寿成宪时年七十八矣追数京师诗社中人惟予两人在者感刘禹锡诗因成四首 其二
112458,送昆山丞谢子潚解官还朝
1129574,刘改之葬昆山山寺下邑人不知葬处
1248128,昆山道中
470853,雨中太仓津亭别子柔泊舟昆山
472918,过昆山
246854,昆山吕正之三男子连中神童科盖奇事也建康严
1020447,答昆山李明府
214129,昆山慧聚寺次孟郊韵
497599,同胡侍御昆山傅处士宅看菊
63872,昆山听杨生曲有赠
1092572,昆山兄惠笔颇佳谢之并呈克斋舅二首 其一
62444,清明约友游昆山
675745,丁未春社昆山张石川银台愿来入社坦翁司空以诗招之石川和之录以见示次韵奉答
1141822,送史德甫任昆山教
882779,昆山龚立道作栖闲堂取李太白题龚处士别墅诗曰龚子栖闲地都无人世喧故以为名尝托范叔刚求诗于予予许之闰八月十九日立道复自以书来为成八句
160230,昆山·晋衰士不竞
1123959,昆山兄惠笔颇佳谢之并呈克斋舅二首
991124,依韵和唐彦猷华亭十咏 其九 昆山
659175,王成宪府博自昆山来为予七十寿成宪时年七十八矣追数京师诗社中人惟予两人在者感刘禹锡诗因成四首 其四
771595,重过昆山
1042735,昆山
60812,送慧上人海上归昆山就游吴门西山
252141,有忆·昆山顶上通灵玉
1001154,寄昆山李宰觅石
683989,广五子篇 昆山俞允文
537957,大梁王君用章既去昆山为客部副郎邑人俞仲蔚集古语为八咏饯行要余与家弟和之各得四首毋论其辞之当与否而感德怀贤要自不异也 其一 威凤栖梧桐
1090728,将至昆山舟中作
832663,摸鱼子 马鞍山访龙洲道人墓，山在昆山县西北隅
646294,送慧上人海上归昆山就游吴门西山
528567,送昆山王令还
562830,自画吾松小昆山二首 其一
531869,昆山谣送王子绳武归省
858901,昆山慧聚寺次张祜韵
859446,昆山慧聚寺次孟郊韵
840373,舟行太仓昆山之閒即目四首 其三
103001,昆山·陆氏几世祖
569534,初遇子与方伯昆山旋尔言别赴任江右
685347,王成宪府博自昆山来为予七十寿成宪时年七十八矣追数京师诗社中人惟予两人在者感刘禹锡诗因成四首
702611,昆山响梵阁怀季常上人游九峰二首
746070,昆山过顾亭林先生故里
1241186,游昆山怀旧伤今
1061628,昆山夜泊舟中遣怀
9128,送昆山孙少府
482839,清明约友游昆山（二十四韵）
335406,昆山·昆崙山在玉关西
545355,是夕邦相以公事先行余同司马移舟六桥布王昆山人席堤上澄湖月色万顷如昼箫管间作诸君剧欢丙夜乃返
71188,游昆山怀旧伤今
683167,胥门与方昆山思道
800218,十二辰诗赠昆山支逸人
790750,过昆山怀顾宁人先生
1248129,登昆山次易九成诸友韵
1239486,至正丁酉冬昆山顾仲瑛会客芝云堂适时贵自海上来以黄柑遗之仲瑛分饷坐客喜而有作属余及陆良贵袁子英等六客同赋
652782,题昆山陈隐君玉峰清兴诗卷
388264,奉送彭昆山特徵
992882,送良玉上人还昆山
548365,刘昆山以重九日举子贻此为贺
569812,送昆山刘令入觐
826184,五彩结同心·昆山真义镇之东亭子为顾阿瑛玉山佳处故址之一。今岁池荷盛开，重台骈萼，并蒂至五六花。余偕姚虞琴、江小鹣、郎静山临赏。以其叶小藕窳而不结莲房，又花瓣襞积，卷如蕉心，正与吴中华山刘宋造像中所刊千叶莲同。因断为即天竺传来之千叶莲，盖花中如海棠、海石榴、山茶，凡舶来种恒现多层，此殆同例也。元末明初迄今已六百年，沦落荒村中，今始幸邀吾徒之一顾。感赋此阕，以属阿瑛，兼示同人
77286,菖蒲·雁山菖蒲昆山石
196558,玉压衾·匠出昆山一片珍
945874,喜迁莺 代邑士送梁宰观赴昆山同知
489778,送昆山契知州调嘉定
1101098,夜发昆山问潮馆
537958,大梁王君用章既去昆山为客部副郎邑人俞仲蔚集古语为八咏饯行要余与家弟和之各得四首毋论其辞之当与否而感德怀贤要自不异也 其二 桂楫汎河中
650719,送僧归昆山
976292,华亭十咏 其九 昆山
713231,同宁都魏和公昆山徐原一同里王震生高望公湛用喈程周量何不偕梁器圃陶苦子集药亭六瑩堂得真字
681216,鼎仪宅分韵送其兄武仪还昆山得倪字
42408,鸳鸯湖棹歌·曲律昆山最后时
474998,昆山道中延福寺逢琴僧
50847,昆山道中延福寺逢琴僧
54153,与次明宿昆山舟中次明诵其近作因次韵
869041,昆山吕正之三男子连中神童科盖奇事也次严别驾韵
275480,斗百花·昆山访亭林公园，谒刘改之墓
26683,昆山·肯时玉为宝
252314,鹧鸪天·春游南昆山和先生韵示儿
884560,陪昆山邑官游慧聚寺诗
1249707,昆山陈伯康筑亭山巅杨边梅过之题曰玉山高处且为赋诗命郭羲仲刘景仪及余和之
446154,辛卯初冬与杨兄启宇、王兄邦建游昆山千墩镇，谒顾亭林先生墓，感成四律 其三
1060242,昆山慧聚寺集句
455262,鹧鸪天 春游南昆山和先生韵示儿
388090,昆山别张通参丈人
279903,顾山山茶和昆山顾潜
539016,昆山王大尹汝平入拜客部员外郎
49560,十月二日亲朋拏舟追饯有同至昆山者时谿父卧
658925,舟中望昆山
840372,舟行太仓昆山之閒即目四首 其二
732678,与昆山三弟鑨
1209061,浣溪沙 昆山州城西小寺晚憩
558710,湖上夜行寄昆山顾孔昭年丈
538183,赠昆山何丞之靖江国官
208552,陪昆山邑游慧聚寺诗
985485,归昆山省亲别太学同舍 其二
1216622,昆山寺
128985,归崑山省亲别太学同舍
936854,寄题龚立道昆山栖闲堂
1125917,归昆山省亲别太学同舍
1026736,和彦猷在华亭赋十题依韵 其九 昆山
489947,陪赵仲光顾仲瑛游昆山
1239735,舟行昆山怀陈惟寅山人
49495,雨中太仓津亭别子柔泊舟昆山
213826,昆山·玉人生此山
537370,昆山别张通参丈人
666917,送人之昆山司训
822191,斗百花 昆山访亭林公园，谒刘改之墓
71083,定风波·昆山路漕席上
641339,梦尚之彦强来问病源所在随以数语答之及觉忘记其辞因成一诗遍寄昆山学诸生且因自警云尔
809718,自苏州行至昏刻未到昆山河傍有竹林数亩晚风可佳故驻跸于此赋得劲节疏枝带晚风之句
1073752,昆山道中二首 其二
1249777,瓜隐为昆山邵济民赋
446152,辛卯初冬与杨兄启宇、王兄邦建游昆山千墩镇，谒顾亭林先生墓，感成四律 其一
1135320,送昆山州教刘表侄
184463,昆山龚立道昱有月石砚屏斗南君玉诸人皆有诗
338105,重过昆山·曾记当年载酒过
236336,有客来从阳羡闻元绩离家已月余由昆山过临安
15727,苏州昆山惠聚寺僧房
95193,昆山兄惠笔乃周寿玉簪样试用其一已作秃翁犹
497236,昆山逢长兴徐宪副同王太仆伯仲饮仲蔚宅
956615,施元光在昆山病中远寄长句次韵答之
334550,夜发昆山问潮馆
694608,昆山纪游因奉潘印川先生
1252726,顾仲瑛避地嘉兴几二年闻回昆山往不见遇作诗寄之末章兼简白西长老二首
135731,昆山·昔有人如玉
677168,娄塘过杨娄南故居感赋娄南为先君旧识有昆山巧石尚藏余家今其地已半属他姓且别构园亭矣
558823,南还昆山顾殿元过小亭次韵
872638,有客来从阳羡闻元绩离家已月馀由昆山过临安桐庐计今合归矣元绩当不惜迂路一访仆于苕霅间也戏为一绝招之元绩纯孝人每在道念亲殊切
379929,送史德甫任昆山教
71069,金缕词·送上官子东之昆山州暮官
1030503,浣溪沙 其五 昆山月华阁
681975,喜昆山柴集勋至
845200,舟行太仓昆山之閒即目四首
489771,昆山五咏 其一 娄侯庙
470911,昆山题画
1216378,昆山客邸
1096403,刘改之葬昆山山寺下邑人不知葬处 其二
1147304,兵后早春登故鄣南楼望昆山寺白鹤观示清道人并沈道士
53217,舟行昆山怀陈惟寅山人
659172,王成宪府博自昆山来为予七十寿成宪时年七十八矣追数京师诗社中人惟予两人在者感刘禹锡诗因成四首 其一
507077,送知县罗永年复任昆山
548497,送彭翼庵博士之官昆山
47104,送石明府之昆山
489772,昆山五咏 其二 王御史墓
538337,张通政宇清周比部济叔沈进士子善饯予昆山有作
558153,游小昆山
683368,大梁王君用章既去昆山为客部副郎邑人俞仲蔚集古语为八咏饯行要余与家弟和之各得四首毋论其辞之当与否而感德怀贤要自不异也 威凤栖梧桐
745475,舟过昆山
761814,咏疟，为苏昆山上舍作
992344,依韵和唐彦猷华亭十咏 其八 昆山阴
585292,胥门与方昆山思道 其一
1249647,昆山时州治移居太仓
686025,送周伯绳比部给假归昆山二首
325250,过昆山怀顾宁人先生
466486,辛卯初冬与杨兄启宇、王兄邦建游昆山千墩镇，谒顾亭林先生墓，感成四律
1205482,金缕词 送上官子东之昆山州幕官
859309,次韵唐彦猷华亭十咏 其九 昆山
544354,送章博士之昆山
741556,赠徐昆山先生时先生方选唐宋诸家诗
57861,拟古·昔闻昆山禾
571410,周都宪得假驰驿送母还昆山
668220,处州刘学谕敔乃刘龙洲远孙便道拜龙洲墓于昆山作诗送之
1239118,沁园春 寄昆山友人并自述
1219276,昆山石
443158,浣溪沙 过昆山千灯，顾亭林故里也
168939,别叔父昆山丞
1239489,卢知州宜兴秩满以避乱久寓无锡视同故乡今知昆山必有怀二州风物之美赠诗言情并致颂祷
489773,昆山五咏 其三 李侍御墓
1092573,昆山兄惠笔颇佳谢之并呈克斋舅二首 其二
525301,九日风雨同昆山张水部诚之饮岳阳行台
791603,昆山道中偶见乡村有未被蹂躏者
1003150,奉送自强明府之官昆山
740672,晚登昆山过泗州塔院访二陆读书台
1235859,游昆山慧聚寺和唐人诗二首
345929,昆山道中·归鸟破烟没
55705,题昆山沈愚通理诗集
315749,舟行太仓昆山之閒即目
49514,昆山响梵阁怀季常上人游九峰二首
537768,奉送彭昆山特徵
602498,昆山纪游因奉潘印川先生 其一
956579,夜发昆山
1073751,昆山道中二首 其一
1230639,追和唐询华亭十咏 其九 昆山
840374,舟行太仓昆山之閒即目四首 其四
468339,出昆山候海舟
733663,清明日游昆山
123410,施元光在昆山病中远寄长句次韵答之
1096402,刘改之葬昆山山寺下邑人不知葬处 其一
536746,广五子篇 其一 昆山俞允文
470910,昆山响梵阁怀季常上人游九峰二首 其二
269517,咏疟，为苏昆山上舍作
583256,送毛修撰兄博彦还昆山
1186228,送昆山孙少府
602499,昆山纪游因奉潘印川先生 其二
138435,谢子萧任崑山丞和余留题旧游诗复次韵谢之
562686,丙申闰秋舟行池州江中题陈徵君仲醇小昆山舟中读书图
1058137,昆山
184464,昆山龚立道作棲闲堂取李太白题龚处士别墅诗
65470,前元时昆山王君祐
477895,与次明宿昆山舟中次明诵其近作因次韵
606479,送周伯绳比部给假归昆山二首 其二
579270,送昆山省试
72112,至正丁酉冬昆山顾仲瑛会客芝云堂适时贵自海
