174903,隆兴甲申岁闰月游焦山
987440,渔家傲 绍兴甲子潮州考官作
948313,绍兴甲子予待试庐陵辞曹厅是秋失解后六年乃与计偕考官七人今惟提刑少监赵氏独寿而康其子仲肃来为掾即诗人堂之西辟小斋记予肄业之所写真求赞并题二诗 其一
958468,类试院放榜众论以得士为庆作古诗一章呈详定钱宪元素及同院诸公绍兴甲子十月二十八日也
1243751,重阳感兴（甲午岁）
881560,水龙吟 其一 绍兴甲子上元有怀京师
184484,隆兴甲申仲冬回郡城宿龙泉寺遇雪
882960,隆兴甲申仲冬回自郡城宿龙泉寺遇雪
151513,绍兴甲寅正月至吴文叟山庄
882426,假守吕叔恭游中隐岩无名洞坐客鄱阳朱国辅云此洞未有名因公而题欲名曰吕公岩予未敢披襟而刘子思陈朝彦皆曰甚当戏书五十六字镵于石壁间绍兴甲戌季春七日
948720,某绍兴甲子赴试此地卜居今十年三历秋举每遇中秋必与亲旧歌舞之今岁大病使令辈散遣萧然偶伯信仲威携子侄相过喜成四韵
1120384,绍兴甲子予待试庐陵辞曹厅是秋失解后六年乃与计偕考官七人今惟提刑少监赵氏独寿而康其子仲肃来为掾即诗人堂之西辟小斋记予肄业之所写真求赞并题二诗
948314,绍兴甲子予待试庐陵辞曹厅是秋失解后六年乃与计偕考官七人今惟提刑少监赵氏独寿而康其子仲肃来为掾即诗人堂之西辟小斋记予肄业之所写真求赞并题二诗 其二
1007931,绍兴甲寅正月至吴文叟山庄
1025700,隆兴甲申岁闰月游焦山
152071,某绍兴甲子赴试此地卜居今十年三历秋举每遇
201471,祥符陵老许作先驰归闽因成伽陀赠别绍兴甲戌
983243,柳梢青 其四 钓台。绍兴甲子赴试南宫登此，今三十三年矣
895491,祥符陵老许作先驰归闽因成伽陀赠别绍兴甲戌秋七月书于鹤林山
152383,绍兴甲子予待试庐陵辞曹厅是秋失解后六年
238869,水龙吟·绍兴甲子上元有怀京师
