973448,寒食前一日伯永相约过陈氏茅轩蕃亦载酒共往与者常宁尉曹明叔伯和蕃赋诗
1209232,铁釜中莲（暇日宴金华祥符方丈了堂悟公以铁釜置莲方著一花关西杨伯玉徵予赋诗以呈湛庵信公时与者孟志学萧君祐暨仲深也）
267883,踏莎行·丙子仲春，与者兰谒梅花岭史阁部祠
1085659,出郊送虞参政因游竹亭小饮与者九人
194128,公冶携酒见过与者温元素康致美赋诗投壶再用
451887,予以刘子全书事有春申之行，陆子奇捷招饮百乐门酒店，与者秦子子云奚子子夏蔡子希平王子星客及发初覆眉女史，席间分韵得蒲字，戏为长句
421462,踏莎行 丙子仲春，与者兰谒梅花岭史阁部祠
972166,三月审知以余行有日置酒于智门寺后竹间小亭时与者王彦博审知之侄彦章余之弟成父审知命以尊前失诗流为韵分得流字书以呈之
966420,公冶携酒见过与者温元素康致美赋诗投壶再用前韵
562117,二月五日燕夏士文漪澜堂与者鲁道原马文壁冯困如赋诗一首歌者张宝童不至故及之
562035,壬子春二月既望乘君子材拈余重游殳山遂燕陆景远氏来青堂与者丁一鹤董祖南景远父子及余季子翱一觞一咏不啻兰亭之会也酒半移尊公主墓侧而董海翁亦至子材遂大醉卧石上不能起命两童掖之登舟余与众客至东山兴尽而返目赋一首以纪其事云
