501496,广东省郎观子毅翩翩佳公子也读书能诗甚闲于礼以省命辅予安南之行雅相敬礼予暂留龙江君与士良典簿先造其国正辞严色大张吾军今子毅北辙而予南辕家贫旅久复送将归深有不释然者口占绝句四首以赠诗不暇工情见乎辞云尔 其三
739725,杨柳店有晋太傅羊叔子祠盖故里也读壁间旧句云老决收吴策辄成长律
689767,广东省郎观子毅翩翩佳公子也读书能诗甚闲于礼以省命辅予安南之行雅相敬礼予暂留龙江君与士良典簿先造其国正辞严色大张吾军今子毅北辙而予南辕家贫旅久复送将归深有不释然者口占绝句四首以赠诗不暇工情见乎辞云尔
501495,广东省郎观子毅翩翩佳公子也读书能诗甚闲于礼以省命辅予安南之行雅相敬礼予暂留龙江君与士良典簿先造其国正辞严色大张吾军今子毅北辙而予南辕家贫旅久复送将归深有不释然者口占绝句四首以赠诗不暇工情见乎辞云尔 其二
711930,屈翁山薄游代州镇将赵君妻以姊子本秦人也读其白母书诗以纪怀
501494,广东省郎观子毅翩翩佳公子也读书能诗甚闲于礼以省命辅予安南之行雅相敬礼予暂留龙江君与士良典簿先造其国正辞严色大张吾军今子毅北辙而予南辕家贫旅久复送将归深有不释然者口占绝句四首以赠诗不暇工情见乎辞云尔 其一
918761,何子楚为范明伦赋九疑石石吾不及见也读诗可以知其巑岏秀峙之状吾累卞峰石为小寒林兴寄不浅用其韵并及之
771690,南楼令·春斋寂寥，辄与花事为缘。斟酌寒温，调停燥湿，日数留意，非閒不能，亦非閒不尔也。读昔人句养花原是爱才心，则又非仅遣日方、养生术而已
501497,广东省郎观子毅翩翩佳公子也读书能诗甚闲于礼以省命辅予安南之行雅相敬礼予暂留龙江君与士良典簿先造其国正辞严色大张吾军今子毅北辙而予南辕家贫旅久复送将归深有不释然者口占绝句四首以赠诗不暇工情见乎辞云尔 其四
818572,八月二十七日明思文皇帝殉国忌辰也。读巢南诗，即题其后
