1159916,詶喜相遇同州与乐天替代
16867,与乐天同葬杓直
822671,迷仙引 诗话总龟：石曼卿尝于平阳舍中，代作寄严师鲁诗，曼卿殁后见梦于关永言，永言乃增损其词，度以迷仙引。今桉其调极美，与乐章迷仙引不同，谱律不载，依永和之
633275,谢与乐兄赠药
741785,夜酌与乐寅
1148991,与乐天同葬杓直
194686,闻诸君不裹粮游山暮归清坐静林僧居相与乐以
855052,闻诸君不裹粮游山暮归清坐静林僧居相与乐以忘饥仆老病独在见遗辱君瑞示诗盛道僧居梅竹之赏辄次韵奉答
427814,临江仙 中央音乐学院民族音乐研究所副所长杨荫浏同志先后以敦煌唐乐谱及西安何家营鼓乐社、北京智化寺所传宋元旧谱见寄，其字谱多与白石道人歌曲相合，沈埋数百年之词乐，行将重显于世，绵此坠绪，推陈出新，诗人与乐家分工合作，以民族形式结合社会主义思想，创作新体歌词，以应广大人民之需要，此其时矣。赋谢荫浏，兼简叶遐庵
1159973,三月三日与乐天及河南李尹奉陪裴令公泛洛禊饮各赋十二韵
134267,与乐道约会超化寺比至乐道以疾先归途中有诗
869361,与乐道约会超化寺比至乐道以疾先归涂中有诗见寄
1192088,度自到洛中与乐天为文酒之会时时搆咏乐不可支则慨然共忆梦得而梦得亦分司至止欢惬可知因为联句
1148995,为乐天自勘诗集因思顷年城南醉归马上递唱艳曲十馀里不绝长庆初俱以制诰侍宿南郊斋宫夜后偶吟数十篇两掖诸公洎翰林学士三十馀人惊起就听逮至卒吏莫不众观群公直至侍从行礼之时不复聚寐予与乐天吟哦竟亦不绝因书于乐天卷后越中冬夜风雨不觉将晓诸门互启关锁即事成篇
1149487,酬乐天吟张员外诗见寄因思上京每与乐天于居敬兄升平里咏张新诗
14950,酬喜相遇同州与乐天替代
1049615,小溪尉丘君父母年皆九十康强精明尚能读书挫箴如五六十岁人相继受恩命某固未尝见也亦未尝闻也因作诗遗丘君且以传诸士大夫如果未尝见闻则宜相与乐道其美而形于歌颂云
