596988,陈春宇太史闻余谈衡山之胜有作因次韵答之二首 其一
1070721,绍圣中苏公内翰谪居儋耳尝与军使张中游黎氏园爱其水木之胜劝坐客醵钱作堂黎氏名子云因用扬雄故事名其堂曰载酒予始至儋与琼士魏安石杖策访之退作二诗
427973,菩萨蛮 秋热中闻人言金华北山双龙洞之胜，赋寄马湛翁
1000631,上饶方君小倅官而不婚宦居偏户间静无官宦之事舍后梯城而上即棚为亭尽得溪山之胜名之曰快哉为作四小诗以快哉此风为韵 其二
1003922,游中岩晴烟如春尤觉林壑之胜也
1133837,汉臣明府与公度使君话吾州山水之胜有诗次韵二首 其一
464233,高阳台 扬州城西北一水萦纾至平山堂，闻两岸故皆盐商居中，极士女游观之胜
867345,乙丑中秋与山僧数辈自虎邱灵岩泛太湖登洞庭东山曰翠峰望湖中群山高下出没如大圆镜见百千万亿青螺髻然瑰玮绝特盖入眼未之见恨风作不能过西山睹林屋洞天之胜然已得其彷佛矣 其一
752479,金蘅意来诗盛言彭泽山水之胜君官翰林二十年坚卧不出今忽两作县令寄此调之 其二
898768,丑奴儿/采桑子 其三 王公泽为予言查山之胜，戏赠
1000632,上饶方君小倅官而不婚宦居偏户间静无官宦之事舍后梯城而上即棚为亭尽得溪山之胜名之曰快哉为作四小诗以快哉此风为韵 其四
994561,庆元己未冬至前二日访林公度至栗山翌日同访吴必大林季亨容之偕行爱其溪山池亭之胜为之赋诗
1070825,甲寅仲秋水涨独民先兄元发弟徙居招提日有登览棋酒之胜连日雨复大作水且荐至举室几于湿浸仰二公之旷达叹辎重之为累辄成鄙句以寄并呈志尹宣教表兄洎往来诸友兄一笑
868712,孔鍊士话龙虎山之胜于其行因以送之
1039642,次韵答陈龙图述北第林泉之胜
1090445,郁簿以职事出城且有登临之胜小诗戏之
807204,惜红衣  苦热兼怀村居水木之胜
608933,归自西樵梁少仲黎君玺龚岸文过问经游之胜
527891,西谷有浙聘予喜其得胜游因话浙中之胜
541911,武陵蒋明府子培过邺因谈桃源之胜南都杨茂才伯海曾绘斯图并长歌见寄勉成一篇用答两意云耳
889584,夜来同诸公泛舟湖中乐甚因更潭名作北湖乃作拙句呈诸友亲聊以纪一时之胜云
184375,杜子贞远访自言山居之胜以二诗送之
544726,余为五岳之怀旧矣丙子冬将以计偕北上适少参王公自秦中过访为余剧谈莲花玉女之胜且出诸登览作见示恍然如曳杖从公游憩太华绝顶者不胜飞动之思辄赋七言律四章 其二
800539,听周紫海先生话海外三山之胜
522300,邑博王东之杖文四川却从关中赴春试扪参历井之胜过家上冢之荣此一行也兼之而梁桷同升又以益儒林之美谈矣旗亭抗手歌以扬之
1050695,史君梁奉议送客至高明轩为予言登览之胜作四韵戏寄
423036,比那莲山水之胜，前游曾有诗纪之。自西班牙桥溯瀑流而上，攀跻崎岖山径间可六七里，得一湖，其上更悬瀑布二；更上，则雪峰际天矣，此前诗所未纪也。今岁复游，补之如次
867346,乙丑中秋与山僧数辈自虎邱灵岩泛太湖登洞庭东山曰翠峰望湖中群山高下出没如大圆镜见百千万亿青螺髻然瑰玮绝特盖入眼未之见恨风作不能过西山睹林屋洞天之胜然已得其彷佛矣 其五
951827,前岁过真阳初识子钦今道出曲江不忍遽分手偶成长句以志两处山川人物之胜亦少慰别来耿耿耳
1111797,邦人献芍药四种曰御爱红曰霓裳红曰缀珠冠子曰红都胜因同朝宗夜饮赏之遂成二绝以记一时之胜
304383,与啸麓谈鄮山阿育王寺之胜啸麓为之神往有诗余更和之
533571,重阳前一日过欧桢伯馆因谈西樵之胜示同舍生
470587,余买一小丘于铁山下登陟不数十武而尽揽湖山之胜尤于看梅为宜盖踞花之上千村万落一望而收之久欲作一小阁名为六浮六浮之名遂满人耳而阁竟不就友人邹孟阳见余叹息每欲代为经营今日始引孟阳至其地亦复叫绝不能已余因为作六浮阁图兼题一诗冀孟阳无忘此盟时丁巳八月十八日也
1078231,宿开平寺去剑浦二十里有泉石之胜曩与郡守谢德夫同游今一纪矣溪山草木依然住持犹旧人也感叹有作二首 其一
628476,慧海上人住静西山精舍余以足疾未能应招闻其陂池林木之胜作此寄之 其一
545746,曹计部至自盘山极谭夜宿招提之胜赋此
431020,倦寻芳 长沙城北朱园，地极爽旷，饶池台花木之胜，昔尝一游，忽忽遂二十年。读粲真新词，怅触前尘，不胜海桑之感，因次其韵
1093984,薜农寺连月不相见雪中思其所居对湖山之胜一诗呈之
1088095,分宜晚泊江亭望南山之胜绝江往游将还而舟子不至择之刺船径渡呼之予与伯崇伫立以俟因得二绝 其二
628566,用公归自中都言湖山之胜余以负恩之身频年抱病于用公闲云野鹤为何如哉
544725,余为五岳之怀旧矣丙子冬将以计偕北上适少参王公自秦中过访为余剧谈莲花玉女之胜且出诸登览作见示恍然如曳杖从公游憩太华绝顶者不胜飞动之思辄赋七言律四章 其一
609291,闻宪府李公增修星岩之胜遥有此寄 其二
911574,赵山甫居玉壶尽得湖山之胜醉后和其韵二章 其一
855408,郢守乔民瞻寄襄阳雪中三绝因追述前过石城杯酒登临之胜为和 其三
331062,比见客谈东福昌之胜若可避世恨未能一游偶杜某出诸公宿云庵诗轴戏题其后
783655,与孙宝三言海上之胜
330770,题将领占胜亭亭据双泉之上尽见城东南风物之胜落成之初屡来乞诗为赋长句云
592300,胡仲一谈嘉州淩云寺之胜王叔承欣然赋诗便欲西游邀予同作四首 其二
331082,丙寅元日偶出见桃李已离披海南风土之异不无感叹独追维三伏中荔支之胜又江浙所不及也因并见于诗
706392,昭阳庵同须竹夜话云乘木叶秋波探五老之胜因便送之
521146,沂州谷生尝从张友山学能诗善医工画梅家有园亭之胜比自京师还同馆陈君德卿作云山别意诗以赠邀予同赋
800912,舟泊武林城外因忆新安会稽之胜赋呈确庵夫子志别
520354,予好奇者每邂逅山水之胜辄注目焉及抵鄠县则逼夜矣聊成一诗以自笑
1092717,坐想孤山雪竹压篱碍过之胜
1130283,介然馆道林偶入聚落宿天宁两昔雨中思山遂渡湘饭于南台口占两绝戏之介然住庐山二十年尚能详说山中之胜
1070709,琼惟水东林木幽茂予爱此三士所居虽无亭馆之胜而气象清远连日水涨隔绝悠然遐想各成一诗目为城东三咏 其一 杜公司法
715785,闻蓝子谈武夷折笋隐屏之胜有作
1085932,东屯溪山之胜似吾家左原
855479,和李士举陪提刑徽猷游中梁山临秀远轩以望江中平陆之胜承示佳句且叙故旧离合之感次韵二首 其一
627964,作客惠阳寄居穷巷中有小室方不盈丈仅足读书临帖无隙地可以栽花种竹独辟西牖稍能坐观西湖之胜旅中少暇赋诗自娱二日以来遂成四章 其三
146969,灵峰灵岩有天柱石屏之胜自昔号二灵
1056052,大观四年二月二日自采石过藏云取路回远少憩已入夜遂留宿明日聪师相邀登览偶见西偏地真一方之胜也余方营葬庶几得之以托妙缘既去因留此诗
346825,东绿叔祖得园池之胜于万山深处将拔宅而居焉以诗奉饯
1033697,聂侍郎领客观园林之胜饮中出示名贤书画
593371,丁庸卿陆华甫顾汝修黎惟敬顾汝和同集王彦贻斋中谈五岳之胜得龙字
671997,与蒋宗谊城东观泉因忆旧谈越中五泄之胜
569044,游摄山栖霞寺颇得泉石之胜因访明征君僧绍故址读江令诸篇遂效其体
627963,作客惠阳寄居穷巷中有小室方不盈丈仅足读书临帖无隙地可以栽花种竹独辟西牖稍能坐观西湖之胜旅中少暇赋诗自娱二日以来遂成四章 其二
844197,梦游仙 白太傅尝以此调追忆吴宫钱塘之胜。余则榕城倦旅，即景成咏，以兹区替吴越，岂但儗不于伦，然幸为吾辈所经，岂可使地灵终閟，平生游寓，虽僻陋而未敢忘，约略存之，亦小人怀土之过也
961896,余卜居偶得山水之胜喜而赋之
828370,与啸麓谈鄮山阿育王寺之胜啸麓为之神往有诗余更和之
1229788,题张济之胜览轩
700940,陈春宇太史闻余谈衡山之胜有作因次韵答之二首
131988,咏賨城景物之胜
855407,郢守乔民瞻寄襄阳雪中三绝因追述前过石城杯酒登临之胜为和 其二
826128,高阳台·金风扇威，倏逢摇落，身非蒲柳，乃尔悲秋。情见乎词，聊成此什。时所居越华书院颇有竹木之胜，将以明岁迁去，情不能忘，聊复及之云尔
176777,天池寺夜与主僧觉翁圆上共坐谈浯溪山水之胜
16982,荥阳郑公以稹寓居严茅有池塘之胜寄诗四首因有意献
1105753,郢守乔民瞻寄襄阳雪中三绝因追述前过石城杯酒登临之胜为和
494401,过清溪黄太学生绣绪宸谈异泉之胜作此以为他时往观卜筑之张本
479183,闻南都新开池馆之胜漫摘坦侄二属对成诗二章 其一
1085513,游开先寺观香炉瀑布诸峰读李苏二仙诗知庐阜之胜在是记以十韵
1088094,分宜晚泊江亭望南山之胜绝江往游将还而舟子不至择之刺船径渡呼之予与伯崇伫立以俟因得二绝 其一
310990,扫花游·谢敬之同年约今秋揽浣花草堂之胜，沮乱不来，寄此调之
544727,余为五岳之怀旧矣丙子冬将以计偕北上适少参王公自秦中过访为余剧谈莲花玉女之胜且出诸登览作见示恍然如曳杖从公游憩太华绝顶者不胜飞动之思辄赋七言律四章 其三
752478,金蘅意来诗盛言彭泽山水之胜君官翰林二十年坚卧不出今忽两作县令寄此调之 其一
732604,闵友谈水东之胜
372912,次韵答判河阳文潞公述相洛所居之胜
368196,抵池阳未入关泊于齐山数日因穷岩壑之胜
612024,冬日朱惟四同周陈李三君枉顾小斋时予方卧病强起留酌品诸名家画卷朱君谈家园小青林之胜索予题咏漫赋二章 其一
1079465,一上人屡言琅琊南塔之胜予盖乐之而未能往也
819384,拟出居庸关，由宣化至太原，途经边塞之胜，与游不获，积想成诗五首 其四
607784,秋日霍念赋卢原甫集饮陶紫阁因之楼询我琼山之胜
330365,避暑无地偶过君俞聊资华屋广荫以揖主人之胜绸缪礼意遂至抵暮君俞有诗因次韵
1033523,灵峰灵岩有天柱石屏之胜自昔号二灵
1216955,霍丘孙游武林湖山之胜诏之
1065077,介然馆道林偶入聚落宿天宁两昔雨中思山遂渡湘饭于南台口占两绝戏之介然住庐山二十年尚能详说山中之胜 其一
1046955,予嘉祐中尝迎先妣来主临潼元祐丁卯□月赴守遂宁复过是邑凡山林宫寺之胜皆当日奉板舆盍朋簪岁时游息之处到今二十八年矣因成短诗以叙感慨
744147,神步山登青云塔周览鉴海之胜次明倪公尚忠石刻韵 其一
685558,冬日朱惟四同周陈李三君枉顾小斋时予方卧病强起留酌品诸名家画卷朱君谈家园小青林之胜索予题咏漫赋二章
855478,和李士举陪提刑徽猷游中梁山临秀远轩以望江中平陆之胜承示佳句且叙故旧离合之感次韵二首 其二
888682,邦人献芍药四种曰御爱红曰霓裳红曰缀珠冠子曰红都胜因同朝宗夜饮赏之遂成二绝以记一时之胜 其二
520366,予登骊山而想唐人宫室之盛惟馀故迹于淡烟残照之间而已且终南太华若相竞秀者是亦关中之胜槩也因作诗以写情云
888683,邦人献芍药四种曰御爱红曰霓裳红曰缀珠冠子曰红都胜因同朝宗夜饮赏之遂成二绝以记一时之胜 其一
150878,余卜居偶得山水之胜喜而赋之
947097,余自白阳驰谒宜都周梦得长官饮于清江亭爱其山水之胜留题
1081392,己亥秋陪伯山游中条穷尽山中之胜明年春迓王毅伯再过山下呈伯山
819383,拟出居庸关，由宣化至太原，途经边塞之胜，与游不获，积想成诗五首 其三
1098183,抵池阳未入关泊于齐山数日因穷岩壑之胜
544728,余为五岳之怀旧矣丙子冬将以计偕北上适少参王公自秦中过访为余剧谈莲花玉女之胜且出诸登览作见示恍然如曳杖从公游憩太华绝顶者不胜飞动之思辄赋七言律四章 其四
