1004738,念奴娇 其一 忆先庐春山之胜
727561,伯兄自山中来夜话山居之胜因忆去秋省兄未及十日而别诗以志感得二十韵
1070193,同赵叔问江仲嘉游法华之胜为曲水会有客先焉还饮舟中分韵赋诗得山字一首
754805,听外话皋亭桃花之胜
159762,初至洛阳府廨有东楼曲沼之胜时春色已过园林
1070837,比见客谈东福昌之胜若可避世恨未能一游偶杜某出诸公宿云庵诗轴戏题其后
1001048,上饶方君小倅官而不婚宦居偏户间静无官宦之事舍后梯城而上即棚为亭尽得溪山之胜名之曰快哉为作四小诗以快哉此风为韵 其一
627965,作客惠阳寄居穷巷中有小室方不盈丈仅足读书临帖无隙地可以栽花种竹独辟西牖稍能坐观西湖之胜旅中少暇赋诗自娱二日以来遂成四章 其四
202090,闰八月望日登青阳峰观可玉所得天池之胜
1071150,行潘峒诸村爱其岩壑之胜田畴之美因成小诗 其二
539209,舍弟敬美自秦来郧谈登华山之胜有作
1070064,同江彦文纬江仲嘉褒度菱湖岭游三衢诸山道灵真出入岩谷胜绝可骇杂然有卜筑之意然此地寥阒人所不争小隐不难致顾吾曹出处何如耳二公皆脩真养气精进不衰予晚闻此道又为忧病顿挫志倦体疲每思益友傥得静舍安馀年资二子以待老岂不乐哉作诗叙游且志本末岩谷之胜实自仲嘉发之予尝闻而赋诗所谓武陵迷汉魏妙喜断山川者也
483660,壬子夏端居二湖与二三子读苦书而热如焚一坐四迁杜少陵发狂大叫非过言也回思云间时往来吕邵仁族其地有林薮之美池台之胜可以避暑而游士寓公咸会于此相与穷日夜为乐及兵变之后所至成墟海内忘形半为异物感衰荣之无定悼生死之相违遂成三十四韵粗述其事云
716783,闻前州守王君谈德庆山川之胜诗以赠之
603944,携李王文学伯仲饮予西湖谈烟雨楼之胜因偕会稽王道坚登之
905431,至启休沐之中静专一室病不复饮无以慰怀性且寡合若何为乐但窗閒弄笔信意乱书无所从意无所得自如而已岂曰诗乎不觉又成五章章之首句皆云朱门多好景盖纪田第园林之胜美明公游豫之适昔张处士献牛奇章诗尤鲙炙人口其警句有带盘红鼹鼠袍砑紫犀牛之盛然而清议者不以为累公之德何哉赋闲宴而歌富贵也小子是作焉敢望回然亦驽骀之希骥尔 其三
552326,陈春宇太史闻余谈衡山之胜有作因次韵答之二首 其二
1084701,明庆忏院上方地爽而幽盖精蓝之胜也予因会友托迹于其间一日探囊中得石刻诗一本乃王瞻叔国博先生题台人秀野堂也摹写景物颇类于此因置之壁间意有感触遂借其韵
978272,闰八月望日登青阳峰观可玉所得天池之胜
711093,霍山古循之仙洞雷江东去数十里望之如奇云巫进隐居其下皆称泉石之胜诗以先订 其二
1076328,湖亭之胜大似江上但无芦苇二月二十日移植数十本
1127658,上饶方君小倅官而不婚宦居偏户间静无官宦之事舍后梯城而上即棚为亭尽得溪山之胜名之曰快哉为作四小诗以快哉此风为韵
1070235,某前日谒见国史侍读尚书获款燕谈蒙出示周杨子书报许藏山中得岩壑之胜过冷泉亭者叹想不已俾某赋诗退成七言古句一首上呈
1061665,建炎己酉冬自婺女携家至临海岁首泛舟憩天柱精舍谒吴君文叟山林感泉石之胜叹城邑之人沈酣势利不知山中之乐也
1007466,天池寺夜与主僧觉翁圆上共坐谈浯溪山水之胜信笔因赠长句
592302,胡仲一谈嘉州淩云寺之胜王叔承欣然赋诗便欲西游邀予同作四首 其四
867251,乙丑中秋与山僧数辈自虎邱灵岩泛太湖登洞庭东山曰翠峰望湖中群山高下出没如大圆镜见百千万亿青螺髻然瑰玮绝特盖入眼未之见恨风作不能过西山睹林屋洞天之胜然已得其彷佛矣 其四
689100,作客惠阳寄居穷巷中有小室方不盈丈仅足读书临帖无隙地可以栽花种竹独辟西牖稍能坐观西湖之胜旅中少暇赋诗自娱二日以来遂成四章
907682,陪史志道侍郎遍览南园北第之胜即席赋诗
681241,题衍圣公所藏画竹因忆阙里南园之胜故篇终及之
867249,乙丑中秋与山僧数辈自虎邱灵岩泛太湖登洞庭东山曰翠峰望湖中群山高下出没如大圆镜见百千万亿青螺髻然瑰玮绝特盖入眼未之见恨风作不能过西山睹林屋洞天之胜然已得其彷佛矣 其二
147439,江州德化县漪岚堂尽得庐山之胜醉中作此呈赵
1071331,藻蒙叔雅祠部重九日惠花惠酒惠诗继为袁家碣钴鉧潭之游因循不能答再承佳句见寄今用来韵率课一篇参陪杖履之胜幸一笑而去之以覆酱瓿而作纸绞也
107009,汉臣明府与公度使君话吾州山水之胜有诗次韵
429612,散释书来极道香山雨后泉声之胜新秋诣之涧水犹㶁㶁遂登看云起小亭西望群峰苍翠如滴写二绝句寄之 其二
326794,人言石乳洪羊之胜不及往游作此
855065,登普宁寺岁寒庵面江山之胜令人欲赋而长老因公出诗集相示作此诗谢之
911573,赵山甫居玉壶尽得湖山之胜醉后和其韵二章 其二
538018,游匡庐不能从南康道入取瀑布石梁之胜志叹
900488,襄州护漕使者张侯寄示所作快目亭记辞多慷慨予读而壮之且想斯亭观览之胜为赋此
744148,神步山登青云塔周览鉴海之胜次明倪公尚忠石刻韵 其二
419916,扫花游 谢敬之同年约今秋揽浣花草堂之胜，沮乱不来，寄此调之
388614,听客谈武夷山之胜
348876,史君梁奉议送客至高明轩为予言登览之胜作四韵戏寄
1069741,建康旧俗贵重九上巳诸曹皆休务祀神登北山参议马君独不出携诗相过因言石林之胜次其韵
612025,冬日朱惟四同周陈李三君枉顾小斋时予方卧病强起留酌品诸名家画卷朱君谈家园小青林之胜索予题咏漫赋二章 其二
730140,雪堂月波楼皆在府署前太守英公又作笠屐亭摩东坡笠像及刘文清公跋语于石皆外人所罕至也余既复至自省适新府署乃得偕赵式韩刘琴南张涤泉李华乡历览诸胜复为赤壁之游而黄州之胜始全览焉
1162211,乾元初严黄门自京兆少尹贬牧巴郡以长才英气固多暇日每游郡之东山山侧精舍有盘石细泉䟽为浮杯之胜苔深树老苍然遗躅士谔谬因出守得继兹赏乃赋诗十四韵刻于石壁
661554,沈启南与余约游金陵而先余至又先余归尝闻余谈义兴山水之胜故舍大江与丹阳而不事竟取道于兹将审余之说也因诗以送之
592301,胡仲一谈嘉州淩云寺之胜王叔承欣然赋诗便欲西游邀予同作四首 其三
1089578,净光丈室开小窗颇得江山之胜次璧老壁间韵
905429,至启休沐之中静专一室病不复饮无以慰怀性且寡合若何为乐但窗閒弄笔信意乱书无所从意无所得自如而已岂曰诗乎不觉又成五章章之首句皆云朱门多好景盖纪田第园林之胜美明公游豫之适昔张处士献牛奇章诗尤鲙炙人口其警句有带盘红鼹鼠袍砑紫犀牛之盛然而清议者不以为累公之德何哉赋闲宴而歌富贵也小子是作焉敢望回然亦驽骀之希骥尔 其四
978673,予己未十月二十有二日去涪上越明年八月二十有八日以事再来观山川之胜无异于昔而予之幽忧抑郁亦自若也
353509,净光丈室开小窗颇得江山之胜次璧老壁间韵
533883,闻王敬美谈太华之胜同李惟寅赋
689091,慧海上人住静西山精舍余以足疾未能应招闻其陂池林木之胜作此寄之
435114,九日济之君祥仲宽子昂携酒于汉臣书斋小酌已而乘兴与众老人会于城西马氏东篱谈笑尽醉扺暮而归为赋此以纪一时之胜事
380052,石湖仙·又题花滩渔唱词稿并怀其楼居之胜
436391,丁未新正与诗社诸公园亭宴集彦衡有诗众皆属和一时樽酒宾席之胜殆可乐也余虽老顾不可虚盛意勉为赋此
147092,访方子万使君宅有园林之胜
542527,陈主簿招饮署中因谈宛陵之胜醉笔赋此
542567,程侍御信夫至因话关中之胜
1113880,琼惟水东林木幽茂予爱此三士所居虽无亭馆之胜而气象清远连日水涨隔绝悠然遐想各成一诗目为城东三咏 杜公司法
635519,再续前题备述园林花石之胜兼送领军入觐
710078,曹方伯闻予谈西樵之胜有作赋答
518087,洪武辛巳闰三月初九之吉陪同守郭公游灵山徘徊历览山水之胜可娱心目承命赋诗谩成古体一首录藁奉呈惟冀采览
147587,侄孙仲晦亦龙和前诗甚佳其家有林塘之胜兄弟
479184,闻南都新开池馆之胜漫摘坦侄二属对成诗二章 其二
810893,金蘅意来诗盛言彭泽山水之胜君官翰林二十年坚卧不出今忽两作县令寄此调之
372036,薜农寺连月不相见雪中思其所居对湖山之胜一诗呈之
573588,石乳入池与珠璧水合味合则杂余截竹为筒命小僮持向乳缝处承注八罂因以所贮惠泉比尝觉远逊此易曰山下出泉蒙此水之胜惠泉蒙与壮之分耳赋以记之
1149384,荥阳郑公以稹寓居严茅有池塘之胜寄诗四首因有意献
680923,宿慈利布政分司爱其北窗山水之胜题诗于壁
702342,闻南都新开池馆之胜漫摘坦侄二属对成诗二章
1039653,次韵答判河阳文潞公述相洛所居之胜
1070903,二月九日北园小集烹茗奕棋抵暮坐客及予皆沾醉无志一时之胜者今晨枕上偶成鄙句写呈逢时使君并坐客
609290,闻宪府李公增修星岩之胜遥有此寄 其一
716094,闻人谈曹州之胜
1033549,侄孙仲晦亦龙和前诗甚佳其家有林塘之胜兄弟和睦日以奉亲为乐用此韵以美之
867250,乙丑中秋与山僧数辈自虎邱灵岩泛太湖登洞庭东山曰翠峰望湖中群山高下出没如大圆镜见百千万亿青螺髻然瑰玮绝特盖入眼未之见恨风作不能过西山睹林屋洞天之胜然已得其彷佛矣 其三
423287,居东山五年寓楼颇有竹月之胜澄怀昕夕未尝无慨
810876,神步山登青云塔周览鉴海之胜次明倪公尚忠石刻韵
600163,季春游浮邱小集喜叶化甫至自罗浮谈四百峰之胜
878190,志仁监簿示五言十五韵夸徐潭之胜次韵一首
295856,人日寒甚许疑庵自歙来谈黄山之胜
147001,聂侍郎领客观园林之胜饮中出示名贤书画
57822,闻南都新开池馆之胜漫摘坦侄二属对成诗二章
865074,和蔡肇慎思说家山之胜用其语得诗
210948,慎思说家山之胜用其语得诗
627962,作客惠阳寄居穷巷中有小室方不盈丈仅足读书临帖无隙地可以栽花种竹独辟西牖稍能坐观西湖之胜旅中少暇赋诗自娱二日以来遂成四章 其一
951334,窃闻集贤侍郎政成公暇时出游览因念青社境物之胜长句四韵奉寄
412206,仝君具酒相招，座间与诸友谈太白峨眉之胜，归来风雨大作，苦不成寐，晨起作诗柬之
697126,余为五岳之怀旧矣丙子冬将以计偕北上适少参王公自秦中过访为余剧谈莲花玉女之胜且出诸登览作见示恍然如曳杖从公游憩太华绝顶者不胜飞动之思辄赋七言律四章
1113940,至启休沐之中静专一室病不复饮无以慰怀性且寡合若何为乐但窗閒弄笔信意乱书无所从意无所得自如而已岂曰诗乎不觉又成五章章之首句皆云朱门多好景盖纪田第园林之胜美明公游豫之适昔张处士献牛奇章诗尤鲙炙人口其警句有带盘红鼹鼠袍砑紫犀牛之盛然而清议者不以为累公之德何哉赋闲宴而歌富贵也小子是作焉敢望回然亦驽骀之希骥尔
308280,拟出居庸关，由宣化至太原，途经边塞之胜，与游不获，积想成诗
1223934,缙山张君荣字仲华来丞抚之崇仁历两政六年心平气顺上下相安如一日虽有远役重劳亦无阙事甚可称也予之閒居相爱如故旧每怀扈从东道往来缙山道中见其风土之胜民俗之美未尝不谈道以为乐于其受代调官京师因记之以诗而与之别明年进秩南来观旧治父老儿童相迎于东门之外又当歌此以为一笑之欢也
819385,拟出居庸关，由宣化至太原，途经边塞之胜，与游不获，积想成诗五首 其五
521383,御医杨信之故宅在玉河东涯有花竹山石之胜时行借居有作次韵
1033444,访方子万使君宅有园林之胜
822047,卓牌子 陈器伯书来，道华山及华清温泉之胜。感怀旧游，追述此解
682481,闻宪府李公增修星岩之胜遥有此寄
695855,胡仲一谈嘉州淩云寺之胜王叔承欣然赋诗便欲西游邀予同作四首
905432,至启休沐之中静专一室病不复饮无以慰怀性且寡合若何为乐但窗閒弄笔信意乱书无所从意无所得自如而已岂曰诗乎不觉又成五章章之首句皆云朱门多好景盖纪田第园林之胜美明公游豫之适昔张处士献牛奇章诗尤鲙炙人口其警句有带盘红鼹鼠袍砑紫犀牛之盛然而清议者不以为累公之德何哉赋闲宴而歌富贵也小子是作焉敢望回然亦驽骀之希骥尔 其五
1113576,避暑无地偶过君俞聊资华屋广荫以揖主人之胜绸缪礼意遂至抵暮君俞有诗因次韵二首
654232,念奴娇 三月二十四日孙景章于景瞻邵叔章王瑞之钱文杰邀饮冯彦恭湖亭其地有林泉之胜醉中即景制念奴娇词发诸公一笑
1070880,题将领占胜亭亭据双泉之上尽见城东南风物之胜落成之初屡来乞诗为赋长句云
1135904,汉臣明府与公度使君话吾州山水之胜有诗次韵二首 其二
905430,至启休沐之中静专一室病不复饮无以慰怀性且寡合若何为乐但窗閒弄笔信意乱书无所从意无所得自如而已岂曰诗乎不觉又成五章章之首句皆云朱门多好景盖纪田第园林之胜美明公游豫之适昔张处士献牛奇章诗尤鲙炙人口其警句有带盘红鼹鼠袍砑紫犀牛之盛然而清议者不以为累公之德何哉赋闲宴而歌富贵也小子是作焉敢望回然亦驽骀之希骥尔 其二
1070710,琼惟水东林木幽茂予爱此三士所居虽无亭馆之胜而气象清远连日水涨隔绝悠然遐想各成一诗目为城东三咏 其二 林曾城
835815,一萼红 悱庵书来，极言崇效牡丹之胜。予自人日后卧病，残春易过，长夏又更，转眼新秋，支离益甚，遥忆故人，京华盛赏，时移物换，感叹成篇
1070890,四月十四日晚陈列之见顾追凉玩月于东桥之上辄成长句以写一时风景之胜
337272,湖亭之胜大似江上但无芦苇二月二十日移植数十本
683579,饯右伯对沧王公之浙藩于西浒剧思西湖之胜因成二章送之
635489,闻霍西牛说家住富春山之胜跃然欲往赋此订同住之约
556792,何侍御为予谈泰山蓬莱东海之胜令我飞动辄赋长篇
541877,同李兵宪廷实刘计部伯柬宴集因谈五台山之胜遂赋长歌
385683,感怀和韵·此山之胜甲东吴
1088932,陈仲思以太夫人高年奉祠便养卜居城东茅屋数间澹如也移花种竹山林丘壑之胜湘州所无食不足而乐有馀谓古之隐君子若仲思者非耶乾道戊子六月某同张钦夫过焉裴回弥日既莫而忘去钦夫欲专壑买邻钦夫有诗某次韵
751118,客话太白武功之胜因怀康对山修撰
596166,重阳前一日过欧崙山馆中谈西樵之胜分韵得风字
238703,六亭为邵阳登临之胜识其名於千岩之诗稔矣乃
409799,孝深二侄寄来雪字韵诗，弟兄唱和，一时乐事，其诗有雷霆精锐、冰雪聪明之胜致，次其支字韵一律寄之
563809,登云峰望始尽九华之胜因复作歌
524835,小泛得黄楼诸山之胜
273612,汉宫春·与客话江浙近事，并及太湖之胜，慨然有作。用稼轩白石蓬莱阁韵
948813,程元成待制书来叙别圃揽有亭葵心秀野二堂之胜见索恶语老病不暇遍赋谩往一篇
163943,游中岩晴烟如春尤觉林壑之胜也
764871,齐天乐 行舟将发同人极道西溪茭芦庵之胜遂棹小舟往游夜载月而归
533316,同丁计部诸子集王鸿胪山斋怀五岳之胜得高字
1115038,赵山甫居玉壶尽得湖山之胜醉后和其韵二章
1110248,杜子贞远访自言山居之胜以二诗送之
569643,雪夜大作晨兴有报弇园之胜者病不能赴作
299958,曹方伯闻予谈西樵之胜有作赋答
1064464,周庭秀爱湘中山水之胜定居十馀年宣和五年夏五月忽思吴中别余于湘上作此送之
1105729,和李士举陪提刑徽猷游中梁山临秀远轩以望江中平陆之胜承示佳句且叙故旧离合之感次韵二首
1078232,宿开平寺去剑浦二十里有泉石之胜曩与郡守谢德夫同游今一纪矣溪山草木依然住持犹旧人也感叹有作二首 其二
285734,星丈诗中言虞山之胜赋之
1113873,行潘峒诸村爱其岩壑之胜田畴之美因成小诗
1033422,江州德化县漪岚堂尽得庐山之胜醉中作此呈赵明府
372634,次韵答陈龙图述北第林泉之胜
1061247,再用韵戏纪山中之胜
1055589,避暑无地偶过君俞聊资华屋广荫以揖主人之胜绸缪礼意遂至抵暮君俞有诗因次韵二首 其二
834212,梦游仙 其一 白太傅尝以此调追忆吴宫钱塘之胜。余则榕城倦旅，即景成咏，以兹区替吴越，岂但儗不于伦，然幸为吾辈所经，岂可使地灵终閟，平生游寓，虽僻陋而未敢忘，约略存之，亦小人怀土之过也
207095,题彭泽县尉厅林壑之胜
592885,予至汝南林干夫王叔经亦自朗陵至携酒夜过开元精舍见访二君各谈中条天台之胜因赋
636167,归自罗浮过铁城诸子述洞天之胜
1110973,分宜晚泊江亭望南山之胜绝江往游将还而舟子不至择之刺船径渡呼之予与伯崇伫立以俟因得二绝
789899,星丈诗中言虞山之胜赋之
228544,赵山甫居玉壶尽得湖山之胜醉后和其韵二章
826313,捣练子·与嬉婵女士游高列林。林有酒楼，临夏菲利河，极烟波之胜
855406,郢守乔民瞻寄襄阳雪中三绝因追述前过石城杯酒登临之胜为和 其一
542560,夜集应员外瑞伯宅闻吴山人子充谈匡庐之胜得山字
1088011,奉陪机仲宗正景仁太史期会武夷而文叔茂实二友适自昭武来集相与泛舟九曲周览岩壑之胜而还机仲景仁唱酬迭作谓仆亦不可以无言也衰病懒废那复有此勉出数语以塞嘉贶不足为外人道也
115107,伯氏到济南寄诗颇言太守居有湖山之胜同韵和
294518,诗以纪之·胜地一朝复
867664,六亭为邵阳登览之胜识其名于千岩之诗稔矣乃今仅存其一方欲次第寻访以仍旧贯不谓簿领得我心之所同然舂容大篇率先作倡而令君和章亦复继至闵免赓酢用肩吾人相与祈成之意
1070482,谒蔡开府延客周历堂宇览观山林岩洞之胜顿失袢暑退作律诗一首
1030976,慎思说家山之胜用其语得诗
562124,风泾定光寺周回三里皆荷花彷佛有钱塘西湖之胜与筠谷高士同赋
268599,一萼红·悱庵书来，极言崇效牡丹之胜
905433,至启休沐之中静专一室病不复饮无以慰怀性且寡合若何为乐但窗閒弄笔信意乱书无所从意无所得自如而已岂曰诗乎不觉又成五章章之首句皆云朱门多好景盖纪田第园林之胜美明公游豫之适昔张处士献牛奇章诗尤鲙炙人口其警句有带盘红鼹鼠袍砑紫犀牛之盛然而清议者不以为累公之德何哉赋闲宴而歌富贵也小子是作焉敢望回然亦驽骀之希骥尔 其一
1055588,避暑无地偶过君俞聊资华屋广荫以揖主人之胜绸缪礼意遂至抵暮君俞有诗因次韵二首 其一
1000633,上饶方君小倅官而不婚宦居偏户间静无官宦之事舍后梯城而上即棚为亭尽得溪山之胜名之曰快哉为作四小诗以快哉此风为韵 其三
1088495,腊月九日晚发怀安公父教授寿翁知丞载酒为别而元礼景嵩子木择之廷老考叔舜民诸贤相与同舟乘便风顷刻数十里江空月明饮酒乐甚因以星垂平野阔月涌大江流分韵熹得星字醉中别去乃得数语略纪一时之胜云
894063,初至洛阳府廨有东楼曲沼之胜时春色已过园林寂寞晚坐楼上作
721193,霍山古循之仙洞雷江东去数十里望之如奇云巫进隐居其下皆称泉石之胜诗以先订
1070929,海外气候每岁三四月间已如剧暑客有自吉阳至者寓馆问汉亭累日且言吉阳气候昼夜如炊因叹此邦之胜乃知人生无有足时不经热恼岂知平日之清凉乎故古之达者每以此对治释氏云推落大火坑火坑变成池皮鞋和尚以为即时清凉也苏公亦云岭南瘴毒地有此江月寒乃知天壤间何人不清安予谪居岭海踰十五年见闻习熟不以为异因作此诗以自慰且以警世之贱丈夫一不快即愁叹怨愤或讥谤怒骂如柳刘之徒盖未足以语此也
628477,慧海上人住静西山精舍余以足疾未能应招闻其陂池林木之胜作此寄之 其二
1071149,行潘峒诸村爱其岩壑之胜田畴之美因成小诗 其一
978301,东绿叔祖得园池之胜于万山深处将拔宅而居焉以诗奉饯
89670,志仁监薄示五言十五韵夸徐潭之胜次韵
948141,山谷自赞云作梦中梦见身外身福唐曾锡盛谈西湖水晶宫之胜因写予真用此意题四句
219916,金华邵氏面山临溪而居又架木为亭云丘壑之胜
195109,登普宁寺岁寒庵面江山之胜令人欲赋而长老因
829763,拟出居庸关，由宣化至太原，途经边塞之胜，与游不获，积想成诗五首
542535,过周节推尚占因谈嵩岳之胜
1065078,介然馆道林偶入聚落宿天宁两昔雨中思山遂渡湘饭于南台口占两绝戏之介然住庐山二十年尚能详说山中之胜 其二
882734,杜子贞远访自言山居之胜以二诗送之 其一
277364,比那莲山水之胜，前游曾有诗纪之
378870,周庭秀爱湘中山水之胜定居十馀年宣和五年夏五月忽思吴中别余于湘上作此送之
748396,客有谈洞庭之胜者赋此奉简
323382,东屯溪山之胜似吾家左原
925154,金华邵氏面山临溪而居又架木为亭云林丘壑之胜趣乃兼得之邵氏求其名予诵东坡江郊诗名之曰茜绚题一绝
331014,行潘峒诸村爱其岩壑之胜田畴之美因成小诗
429611,散释书来极道香山雨后泉声之胜新秋诣之涧水犹㶁㶁遂登看云起小亭西望群峰苍翠如滴写二绝句寄之 其一
710998,移家林溪同诸子登瓶山值潦因转观芙蓉石瓮之胜
750765,将以重九放榜前一夕书此赠绎庈偶谈及新修滕王阁之胜故并及之
206328,陪史志道侍郎遍览南园北第之胜即席赋诗
569867,饯右伯对沧王公之浙藩于西浒剧思西湖之胜因成二章送之 其二
868665,题彭泽县尉厅林壑之胜
807963,多丽  刘公㦷吏部每为余言苏门百泉之胜，冬日行汲县道中，遥望峰峦幽异，未及登眺，感赋一阕，并以寄刘
961942,雨霁立门外见万山葱翠如染颇自喜得独占山居之胜因得乱道一联遂足成篇兼怀曲湖居士
743772,五岚问西山之胜
603198,孙肖延极谈樵山之胜以诗见贻次答
886979,咏賨城景物之胜
1088093,人言石乳洪羊之胜不及往游作此
819381,拟出居庸关，由宣化至太原，途经边塞之胜，与游不获，积想成诗五首 其一
819382,拟出居庸关，由宣化至太原，途经边塞之胜，与游不获，积想成诗五首 其二
389449,齐天乐·行舟将发同人极道西溪茭芦庵之胜遂棹小舟往游夜载月而归
379581,再用韵戏纪山中之胜
281790,仝君具酒相招，座间与诸友谈太白峨眉之胜，归来风雨大作，苦不成寐，晨起作诗柬之
1070877,丙寅元日偶出见桃李已离披海南风土之异不无感叹独追维三伏中荔支之胜又江浙所不及也因并见于诗
821136,汉宫春 与客话江浙近事，并及太湖之胜，慨然有作。用稼轩白石蓬莱阁韵
996121,伯氏到济南寄诗颇言太守居有湖山之胜同韵和
594315,闻谭侍御子诚述衡岳之胜辄欲游瞩
1113982,宿开平寺去剑浦二十里有泉石之胜曩与郡守谢德夫同游今一纪矣溪山草木依然住持犹旧人也感叹有作二首
739208,听客谈武夷山之胜
768741,石湖仙 又题花滩渔唱词稿并怀其楼居之胜
743637,云南督署之东园亭馆花木之胜为历任所未有心念此间宜有鹤未几日忽飞一白鹤来翌日又有一鹤盘旋空中鸣声相呼薄暮并集于园月余遂驯且能舞矣作来鹤篇
328860,一上人屡言琅琊南塔之胜予盖乐之而未能往也
896665,竟陵梦野亭在子城西南角一目而尽云梦之野最为郡中之胜
592299,胡仲一谈嘉州淩云寺之胜王叔承欣然赋诗便欲西游邀予同作四首 其一
569866,饯右伯对沧王公之浙藩于西浒剧思西湖之胜因成二章送之 其一
711092,霍山古循之仙洞雷江东去数十里望之如奇云巫进隐居其下皆称泉石之胜诗以先订 其一
882735,杜子贞远访自言山居之胜以二诗送之 其二
330775,四月十四日晚陈列之见顾追凉玩月于东桥之上辄成长句以写一时风景之胜
666900,南曹假归秋杪入山遍访僧舍爱忍草庵之胜宿也
780179,罗敷媚 与同人话闽中之胜再叠前韵
388504,游匡庐不能从南康道入取瀑布石梁之胜志叹
207111,孙鍊士话龙虎山之胜於其行因以送之
1070682,迎山阁为长庆寺登览之胜暇日携觞命友屡醉其上因赋此诗
1107399,乙丑中秋与山僧数辈自虎邱灵岩泛太湖登洞庭东山曰翠峰望湖中群山高下出没如大圆镜见百千万亿青螺髻然瑰玮绝特盖入眼未之见恨风作不能过西山睹林屋洞天之胜然已得其彷佛矣
273034,居东山五年寓楼颇有竹月之胜澄怀昕夕未尝无慨
969949,挈家来游饫山林之美款泉石之胜引睇莆阳扁画因慨思关河鼎沸版图之归无期当有任其咎者
333465,宿开平寺去剑浦二十里有泉石之胜曩与郡守谢德夫同游
433436,散释书来极道香山雨后泉声之胜新秋诣之涧水犹㶁㶁遂登看云起小亭西望群峰苍翠如滴写二绝句寄之
