802342,由二亩甸往方广入山已深忽抵一大池周七八里荷花弥望人家临水而居蜃墙红窗花竹衣桁倒影镜中戏询舆人欲买全湖直几何对云不过百金乃知山乡之业贱不可言古人买山非直耽其幽寂三径之资不当与买宅买邻同价乃可安耕凿长子孙今世惟求近城市价亟昂而租入转少取其贫时易售而已购产而欲其易售悲哉购者之愚也 其一
828618,丁卯之岁予病甚陟甫约游鄮山阿育王寺一日晚坐山门外万念俱忘恍然若有以无得为得也别经廿载世变不可言感念不已因寄怀陟甫一首
114579,春怀·渐老春心不可言
558170,舟留镇江适太仆丞义与李瑞卿至瑞卿与子同京邸而佑巳者相见之喜不可言喻遂与同游甘露金山诸处
816573,由二亩甸往方广入山已深忽抵一大池周七八里荷花弥望人家临水而居蜃墙红窗花竹衣桁倒影镜中戏询舆人欲买全湖直几何对云不过百金乃知山乡之业贱不可言古人买山非直耽其幽寂三径之资不当与买宅买邻同价乃可安耕凿长子孙今世惟求近城市价亟昂而租入转少取其贫时易售而已购产而欲其易售悲哉购者之愚也
200595,淮扬大水·淮扬水暴不可言
802343,由二亩甸往方广入山已深忽抵一大池周七八里荷花弥望人家临水而居蜃墙红窗花竹衣桁倒影镜中戏询舆人欲买全湖直几何对云不过百金乃知山乡之业贱不可言古人买山非直耽其幽寂三径之资不当与买宅买邻同价乃可安耕凿长子孙今世惟求近城市价亟昂而租入转少取其贫时易售而已购产而欲其易售悲哉购者之愚也 其二
