369760,至襄城家君有诗命某属和
1081956,次律兄以鼠盗防风感而作诗命某同赋
948718,故翰林汪公端明居零陵时尝作玩鸥亭今彊中提干敬以其榜揭荆溪第中命某赋诗
966087,绍兴壬子六月先公再被掖垣之命某时侍行自清江登舟经祖印江口趋行在所未几罢归还憩丰城之龙泽寺明年初夏归隐南山己巳岁予偶游祖印留宿寺僧惠嵩能道昔寓龙泽之梗概两寺相望盖五十里时先公没十有二年矣予亦衰病投绂俯仰悲慨因成两诗以遗嵩 其二
629361,崇祯庚午九月十九日为陈母八十佳辰其长君子含命某执笔而颂之
202497,范蜀公得请再致仕蜀公作谋命某次韵
1123033,绍兴壬子六月先公再被掖垣之命某时侍行自清江登舟经祖印江口趋行在所未几罢归还憩丰城之龙泽寺明年初夏归隐南山己巳岁予偶游祖印留宿寺僧惠嵩能道昔寓龙泽之梗概两寺相望盖五十里时先公没十有二年矣予亦衰病投绂俯仰悲慨因成两诗以遗嵩
335233,次律兄以鼠盗防风感而作诗命某同赋
182417,绍兴壬子六月先公再被掖垣之命某时侍行自清
909868,范蜀公得请再致仕蜀公作诗命某次韵
1071781,至襄城家君有诗命某属和
1049615,小溪尉丘君父母年皆九十康强精明尚能读书挫箴如五六十岁人相继受恩命某固未尝见也亦未尝闻也因作诗遗丘君且以传诸士大夫如果未尝见闻则宜相与乐道其美而形于歌颂云
966088,绍兴壬子六月先公再被掖垣之命某时侍行自清江登舟经祖印江口趋行在所未几罢归还憩丰城之龙泽寺明年初夏归隐南山己巳岁予偶游祖印留宿寺僧惠嵩能道昔寓龙泽之梗概两寺相望盖五十里时先公没十有二年矣予亦衰病投绂俯仰悲慨因成两诗以遗嵩 其一
