102190,梵天寺见僧守诠小诗清婉可爱次韵
1207683,八月廿一日惟寅徵君踏雨过林馆为留终日因诵近赋绝句三首爱其词致清婉辄走笔次韵如上古道寥寞人以角逐声利为务惟寅独逍遥恬淡之乡时来□之篇章翰墨之事岂易得也哉 其二
967989,蝶恋花 其一 登楼晚望，闻歌声清婉而作此
883326,禅寂之所有卖花声出廊庑间清婉动耳
155853,村居夜坐读王右丞山中与裴迪书爱其清婉有魏
1207682,八月廿一日惟寅徵君踏雨过林馆为留终日因诵近赋绝句三首爱其词致清婉辄走笔次韵如上古道寥寞人以角逐声利为务惟寅独逍遥恬淡之乡时来□之篇章翰墨之事岂易得也哉 其一
1073865,绍兴壬子某南迁过疏山上一览亭见拟东坡煨芋诗刻龛之壁间诗律句法良是殆不能辨乃宣卿侍郎守临川时所拟作也后数日道次安仁县一士人吴君出宣卿诗数十解示余奇丽清婉咀嚼有味如啖蔗然读之惟恐尽于是拊卷三叹而后知公置力于斯文久矣又二十年宣卿筑室荆溪山中别营一堂以平生所蓄东坡诗文杂言长短句残章断槁尺牍游戏之作尽椟藏其中号景坡自书榜仍为记刻之某欲具小舟造观而宣卿召用今以集撰守吴门乃赋诗为之先
1236537,八月廿一日惟寅徵君踏雨过林馆为留终日因诵近赋绝句三首爱其词致清婉辄走笔次韵如上古道寥寞人以角逐声利为务惟寅独逍遥恬淡之乡时来□之篇章翰墨之事岂易得也哉
999300,村居夜坐读王右丞山中与裴迪书爱其清婉有魏晋风味因集其语作诗一首亦老坡哨遍之义也
73669,漫兴·广平梅词吐清婉
967975,虞美人 其一 清婉亭赏酴醾
920466,梵天寺见僧守诠小诗清婉可爱，次韵
1149329,馀杭周从事以十章见寄词调清婉难于遍酬聊和诗首篇以荅来贶
1207684,八月廿一日惟寅徵君踏雨过林馆为留终日因诵近赋绝句三首爱其词致清婉辄走笔次韵如上古道寥寞人以角逐声利为务惟寅独逍遥恬淡之乡时来□之篇章翰墨之事岂易得也哉 其三
