1241856,乙丑十月廿八日得乡人林序班公辅寄声报舍弟梦臣没于道未知月日地所二首 其二
553426,续得乡人信再寄弟
15511,河南府试赎帖赋得乡饮酒诗
688847,姚孟长顾九畴侯木庵杨慕垣雷伯鳞过集分得乡字二首
1160907,河南府试赎帖赋得乡饮酒诗
888845,得乡书
98964,蝶恋花·京口得乡书
618109,姚孟长顾九畴侯木庵杨慕垣雷伯鳞过集分得乡字二首 其二
505426,九日得乡字
618108,姚孟长顾九畴侯木庵杨慕垣雷伯鳞过集分得乡字二首 其一
1035981,蝶恋花 京口得乡书
1220454,春日得乡信
521930,奉和涯翁西郊观稼是日得乡书有感
689209,喜戴仲鹖得乡荐二首
1056796,得乡信
355186,刘生适中初业儒稍能文词气勇而不暴甚得乡士人心连蹇不得志
577396,挽封□□□□□公祐得乡邑称纯孝，声名迈古人。买书因教子，酿酒为筵宾。宠命颁新至桂林
1241855,乙丑十月廿八日得乡人林序班公辅寄声报舍弟梦臣没于道未知月日地所二首 其一
610861,秋日过尹昆璧小瀛洲同周昆彦谭永明林坦之垂之兄弟脍酌得乡字
473716,郭第得乡字
528700,喜戴仲鹖得乡荐二首 其二
138300,得乡书·闻道交亲知我还
528699,喜戴仲鹖得乡荐二首 其一
1051833,刘生适中初业儒稍能文词气勇而不暴甚得乡士人心连蹇不得志以医游四方元祐七年来京师予与乔给事公权丰侍郎相之荐于朝入翰林为医官孙待制传师帅渭辟以从予哀生之志未得而喜其得贤主人以归也作是诗以送之
1253246,乙丑十月廿八日得乡人林序班公辅寄声报舍弟梦臣没于道未知月日地所二首
57333,郭第得乡字
899991,寓钱塘得乡人消息
665041,得乡茶有感
329450,得乡信·乡信迢迢出旧山
1014981,游洞霄得乡友道士邓君德清话因成古语
585227,得乡人邓世珍讣音
