1035539,和王衢见寄兼呈董行父
12389,酬张二仓曹杨子闲居见寄兼呈韩郎中左补阙皇甫冉
305456,次和纕蘅北戴河见寄兼呈逸塘前溪
990920,次韵和永叔退朝马上见寄兼呈子华原甫
15068,酬郓州令狐相公官舍言怀见寄兼呈乐天
1159949,酬窦员外郡斋宴客偶命柘枝因见寄兼呈张十一院长元九侍御
36600,奉酬李中丞洪湖州西亭即事见寄兼呈吴冯处士
103550,次韵和永叔退朝马上见寄兼呈子华原甫
617299,秋日渡九江步韵酬黄玉轮宫詹先抵通远见寄兼呈李葵孺奉常
1147347,奉酬李中丞洪湖州西亭即事见寄兼呈吴冯处士时中丞量移湖州长史
5847,答史馆张学士段柳庶子学士集贤院看花见寄兼呈柳学士
1162677,酬郭少府先奉使巡涝见寄兼呈裴明府
589251,代柬复周司训见寄兼呈容太守
429953,次和纕蘅北戴河见寄兼呈逸塘前溪
23606,酬郭少府先奉使巡涝见寄兼呈裴明府
588955,和赵宪副诗轴见寄兼呈年家岑都谏
1159944,酬郓州令狐相公官舍言怀见寄兼呈乐天
1152790,答史馆张学士段柳庶子学士集贤院看花见寄兼呈柳学士
9906,酬张二仓曹扬子所居见寄兼呈韩郎中
1183130,酬张二仓曹扬子所居见寄兼呈韩郎中
206422,和王衢见寄兼呈董行父
