1107446,拟进讲筵尚书终篇锡宴诗
1236515,水晶殿进讲鲁论作
655105,学士四荣为丘先生仲深赋 其二 经筵进讲
809450,巡幸回宫内殿进讲毛诗
1216040,西内进讲即事 其一
1215999,水晶殿进讲周易二首 其一
695199,壬辰九月二十二日再入讲筵进讲得诗三首
383405,文华殿进讲有述
1216039,兴圣殿进讲即事是日赐酒饮杏花下
1225063,明仁殿进讲五首 其二
521188,文华进讲
1225062,明仁殿进讲五首 其一
1225066,明仁殿进讲五首 其五
1236255,明仁殿进讲五首
809250,经筵进讲周易
514921,十三日文华后殿早进读尚书孟子午进讲大学衍义日以为常读毕赐宴讲毕赐茶上皆呼先生而不名惭感之馀敬赋以志
513647,成化戊戌四月十一日储皇御左春坊敏政进讲大学首章退宴文华门十二日上御经筵敏政进讲中庸第二十章退宴左顺门感愧之馀赋此呈同事诸君子
513647,成化戊戌四月十一日储皇御左春坊敏政进讲大学首章退宴文华门十二日上御经筵敏政进讲中庸第二十章退宴左顺门感愧之馀赋此呈同事诸君子
1216041,西内进讲即事 其二
1216008,二月十九日承诏复兼经筵官是日进讲咸宁殿面赐卮酒作
561251,经筵进讲毕还至国庠会寮属诸生听讲
53380,戊寅正月进讲赐大红织成段衣一袭
1236496,水晶殿进讲周易二首
1216003,水晶殿进讲鲁论作 其二
1216002,水晶殿进讲鲁论作 其一
1215973,至正二年岁壬午正月明仁殿进讲易恒卦赐金织绿色对衣一袭作
665243,壬辰九月二十二日再入讲筵进讲得诗三首 其二
1216043,东便殿进讲赐酒时牡丹盛开作 其二
1216065,六月七日慈仁宫进讲
1236518,西内进讲即事
547190,夏日进讲和张洪阳年丈韵
1227678,奉和苏授经八月二十九日明仁殿进讲敕赐酒馔许乘舟汎太液池趋西苑之作
1216108,至正岁己丑仲冬兴圣西殿进讲禹谟
1225065,明仁殿进讲五首 其四
1215970,十一月廿八日明仁殿进讲作
53376,丙子二月初与经筵进讲纪述
1083799,拟进讲筵尚书终篇锡宴诗 其二
1216067,明日慈仁宫进讲毕钦承特命改授崇文监丞参检校书籍事是日同僚邀复游西山举酒为寿赋二首简谢雅意 其二
1216064,五月八日上京慈仁宫进讲纪事
665244,壬辰九月二十二日再入讲筵进讲得诗三首 其三
501292,和周子英进讲诗韵
382584,夏日进讲和张洪阳年丈韵
547576,文华殿进讲有述
508883,十六日文华殿进讲易象禹谟
1225064,明仁殿进讲五首 其三
602288,进讲大宝箴效柏梁体
1216000,水晶殿进讲周易二首 其二
583232,文华进讲
324789,拟进讲筵尚书终篇锡宴诗
665242,壬辰九月二十二日再入讲筵进讲得诗三首 其一
471971,纪赐四十首 其一 丙子二月初与经筵进讲纪述
1216066,明日慈仁宫进讲毕钦承特命改授崇文监丞参检校书籍事是日同僚邀复游西山举酒为寿赋二首简谢雅意 其一
1236519,东便殿进讲赐酒时牡丹盛开作
682213,纪赐四十首 丙子二月初与经筵进讲纪述
482365,六月十六日端礼楼进讲奉教赋诗次缪纪善韵
1083798,拟进讲筵尚书终篇锡宴诗 其一
1216017,七月六日上京慈仁殿进讲纪事
1215974,进讲纪事廿韵呈左丞许公可用
1236504,明日慈仁宫进讲毕钦承特命改授崇文监丞参检校书籍事是日同僚邀复游西山举酒为寿赋二首简谢雅意
471978,纪赐四十首 其十 戊寅正月进讲赐大红织成段衣一袭
63583,六月十六日端礼楼进讲奉教赋诗次缪纪善韵
1216042,东便殿进讲赐酒时牡丹盛开作 其一
1216071,七月廿日钦承特命以崇文丞兼经筵参赞官进讲慈仁宫谢恩作
