703282,甲寅秋予以乞经从燕台南归留滞白门顿弟在吴门专侍至之住数日去陵阳订其复至白首天涯易散难聚不已之情未欲遽远且天老人住山无力世乱难安相与共依座下此什送之并似六康居士念予亦一编户民也
633805,甲寅秋予以乞经从燕台南归留滞白门顿弟在吴门专侍至之住数日去陵阳订其复至白首天涯易散难聚不已之情未欲遽远且天老人住山无力世乱难安相与共依座下此什送之并似六康居士念予亦一编户民也 其二
182523,二弟在远经年无书张倩忽来相看蔡生以诗见庆
464728,蝶恋花 仲弟在辽阳，闻有战事，老母倚闾之思甚切，书此寄之
572020,甲辰会榜题名至时旧友及诸弟在场屋者皆被落因及之
965914,二弟在远经年无书张倩忽来相看蔡生以诗见庆次其韵
633804,甲寅秋予以乞经从燕台南归留滞白门顿弟在吴门专侍至之住数日去陵阳订其复至白首天涯易散难聚不已之情未欲遽远且天老人住山无力世乱难安相与共依座下此什送之并似六康居士念予亦一编户民也 其一
226810,二弟·在昔梅花犹有赋
538901,送比部吴枢季之金陵时舍弟在仪部
1208106,夜坐，有怀舍弟在江右，别来凡阅九冬至矣
1214714,伯清兄弟在者三人次仲实又次季博有练溪别业连云庄弗肯分异户门应酬衣食用费宾客燕会岁一人递收其田租以掌之为计帐以相交付同堂异室内外无间言于兹有年矣是亦保家之善道也不然则力分而用广日且不给况能久而弗坠哉是宜诗伯清即韩分石
