931413,安流亭俟客不至独坐成咏
42054,已亥杂诗·北游不至独石口
330898,七月既望雨后对月招邻人夜饮不至独酌成诗
1070904,七月既望雨后对月招邻人夜饮不至独酌成诗一首以写一时之景
848339,拟白乐天期李二十文略王十八质夫不至独宿仙游寺
1155627,期李二十文略王十八质夫不至独宿仙游寺
668827,西湖迟徐郎不至独往林处士墓
471228,丙辰自南宫下第还避倭往来无定居亲交少至独有一二同志时来问学
296148,九日石遗先生约游天宁寺余以事后至独成一诗
565885,陆生望时邀玩牡丹予口期二十三日乃前则阴晦至独晴霁爰惬赏怀次旦风雨复作问讯牡丹一首
17815,期李二十文略王十八质夫不至独宿仙游寺
61166,丙辰自南宫下第还避倭往来无定居亲交少至独
668320,九日期九逵不至独与子重游东禅作诗寄怀兼简社中诸友
384531,九日期九逵不至独与子重游东禅作诗寄怀兼简社中诸友
284350,冬至独游郊外
76351,安流亭俟客不至独坐成咏
413551,冬至独游郊外
458047,贺新郎　平安夜室外监火，俄而雪至，独立雪中赋
347428,拟白乐天期李二十文略王十八质夫不至独宿仙游寺
1231349,庚寅岁秋九月余邀张习之吕志学枉过云丘志学过期不至独与习之觞于紫霞丹房醉后因纪其事
