97137,过潼川之飞乌县见余干丞相题驿舍诗有感次韵
1124504,再过溧阳县见李侍御二首
975520,监利许知县见示诗卷
132184,再过溧阳县见李侍御
765393,过赵城县见道旁有穷饿就毙者恻然赋此 时乙丑八月念五日也
749284,滕县见陈抱潜题名
323613,次韵翁东叟知县见寄并简戴俊仲
1086086,次韵翁东叟知县见寄并简戴俊仲 其一
922095,舟行至清远县，见顾秀才，极谈惠州风物之美
14630,酬曹侍御过象县见寄
199917,大冶县见梅
9724,酬常郿县见赠
1063856,次韵元不伐知县见寄
975720,再过溧阳县见李侍御二首 其二
1035514,次韵和王希知县见赠
1105563,次韵翁东叟知县见寄并简戴俊仲
978669,大冶县见梅
975721,再过溧阳县见李侍御二首 其一
206692,次韵和王希知县见赠
972583,过潼川之飞乌县见馀干丞相题驿舍诗有感次韵
1182646,酬曹侍御过象县见寄
978523,谢叶司理徐知县见贻之什
102458,舟行至清远县见顾秀
99615,舟行至清远县见顾秀才极谈惠州风物之美
31563,灵池县见早梅
1182937,詶常郿县见赠
1164211,灵池县见早梅
132955,监利话知县见示诗卷
1086087,次韵翁东叟知县见寄并简戴俊仲 其二
730848,双流县见新月
233738,谢叶司理徐知县见贻之什
