800811,与顾梁汾舍人次阁学韩公韵
491037,与顾水部期登楼玩雪不赴简一绝
574982,与顾氏昆季饮海天亭复至绣岭草堂
758984,忆王孙 与顾仲楣对弈
271020,满江红·予与顾庵西樵皆被奇祸得免
187579,和刘对与顾龙山探梅
879838,和刘圣与顾龙山探梅四首 其二
1109511,和刘圣与顾龙山探梅四首
1068801,子温作驱疮诗伯初与顾景蕃皆属和蕃以谓不当止酒初以谓宜鍊元气予亦戏次其韵
879839,和刘圣与顾龙山探梅四首 其一
665447,冬日与顾九和殷近夫孙太初顾与成游太湖
807718,薄倖  山下与顾景行话旧三叠前韵
500062,与顾赵范三绣衣晚酌醉后偶题
879836,和刘圣与顾龙山探梅四首 其四
591987,伏日同徐子与顾汝和袁鲁望沈道桢顾汝所集文寿承斋中得家字
1043407,与顾子惇同为秘书少监今年余以病求守汝南子惇亦除河东漕作诗纪事亦用送别
187502,和刘圣与顾龙山约客韵
737003,咏香与顾书宣陈南麓汪安公同赋
384231,舟中与顾贞叔夜话
48490,与顾天锡夜话和留别韵
363842,与顾子惇同为秘书少监今年余以病求守汝南子惇亦除河东漕作诗纪事亦用送别
73659,城南草堂与顾仲瑛夜话
879837,和刘圣与顾龙山探梅四首 其三
275623,摊破浣溪沙·辛丑秋日与顾公硕等六十余人同往角直观唐塑
529255,与顾未斋游西山过海子桥有作
591831,伏日同文寿承徐子与顾汝和饮袁鲁望斋中听讴者杨清歌时子与已补长芦矣因题此句
315460,与顾赵范三绣衣晚酌醉后偶题
778487,满江红 其二 予与顾庵西樵皆被奇祸得免
513852,忆在姑苏与顾天钖郎中语次亦有亡弟之感惨然对泣不能自胜因追次其韵一首
491089,月夜舟次吴塔与顾陆二丈酣坐
831285,水调歌头 其一 九日，与顾印伯携榼渡江，饮王病山斋中。和稼轩九日韵，赠印伯
845159,水调歌头 九日，与顾印伯携榼渡江，饮王病山斋中。和稼轩九日韵，赠印伯
591990,立秋日同文寿承徐子与顾汝和沈道桢顾汝所朱子愚饮袁鲁望宅得凉字
676395,舟中与顾贞叔夜话
610353,冬夜与顾桐柏泛舟弄月
480175,与顾天锡夜话和留别韵（时天锡谪永州府同知）
1239233,城南草堂与顾仲瑛夜话
