559823,赠医士为续经历以仁作
231184,以仁者寿为韵寿侍读节使郑少师
504582,题唐以仁山水图
942192,以仁者寿为韵寿侍读节使郑少师 其三
644476,送怀以仁还雪窦
1119322,以仁者寿为韵寿侍读节使郑少师
385182,剑守南宁李君璧与余雅不相识比以仁和教谕校文南畿颇有意
644240,怀以仁讲师入观图
942193,以仁者寿为韵寿侍读节使郑少师 其二
683008,剑守南宁李君璧与余雅不相识比以仁和教谕校文南畿颇有意于浅薄格于异经不果荐甲戌自杭赴蜀道出吴门邂逅及此因赋赠二诗
52715,怀以仁讲师入观图
644478,送怀以仁法师归钱塘
1225640,谢樊天民先生朱以仁先生谢德清见访并述怀
502130,题郑以仁府掾南山堂
521353,寄寿何以仁御医用匏翁韵
668397,剑守南宁李君璧与余雅不相识比以仁和教谕校文南畿颇有意于浅薄格于异经不果荐甲戌自杭赴蜀道出吴门邂逅及此因赋赠二诗 其一
677694,桃源县送颜以仁回鼎城
1226317,寄恩以仁
473090,初夏同王应凤佘日章汪以仁以敬过佘子玉园居
518198,题孙以仁枫林挟弹小像
1246094,题林以仁平反诗卷
502989,挽梅江陈以仁先辈
942194,以仁者寿为韵寿侍读节使郑少师 其一
668398,剑守南宁李君璧与余雅不相识比以仁和教谕校文南畿颇有意于浅薄格于异经不果荐甲戌自杭赴蜀道出吴门邂逅及此因赋赠二诗 其二
