464122,浪淘沙 过杭访卢师
361542,次韵程给事赴越任过杭相会
608027,过杭州北关主正陈君浒墅钞关主正朱君俱未会面各惠程仪口占志之
49555,再过杭州访许成之同鲍谿父话旧
250646,因事过杭湖边小坐
608016,过杭城羡其富盛文明之邦
447657,元日夜车过杭州湾跨海大桥口号
148155,过杭州故宫
441105,南翔留云寺前小立口占用陆子过杭州湾韵
441161,癸巳桂月壬寅晨暮驱车再过杭州湾跨海大桥口占晨
1040135,次韵毛维瞻度支过杭见赠
470923,再过杭州访许成之同鲍溪父话旧
660295,闻毛汝砺绣衣过杭寄一律
640341,过杭州览古
464019,苏渊雷先生过杭留诗，谬以学人见许，愧不取当，敬次元韵，即请教正
195116,仆罢官东归过杭州寓六游堂而楼阁倚空江山在
253107,薄暮过杭州上天竺法喜寺
854988,仆罢官东归过杭州寓六游堂而楼阁倚空江山在目仆甚乐之无畏老师自武康送客至此过仆于此堂之上留饭终日顷仆作武康令居县之东堂每与师饭于堂上数称东堂饭美每食辄兼人别十数年饭犹健也然师于世故泊然了无芥蒂独于东堂故人若不能忘情者亦复可怪戏作诗一首其末并道所怀
1008248,过杭州故宫二首 其一
1044865,将赴会稽过杭州宝月大师法喜堂
515427,过杭次陆大参同年留别诗韵
999562,予解邑过杭遇介之学士谒告南归
168888,过杭留别曹无逸朝奉
404087,阿那曲·己巳仲秋，一九二九年。与胜瑜内子、福增、福海儿过杭州西湖，扣舷倚声，教二儿唱之，相顾笑乐，正不知思古幽情，枨触无端也
452304,因事过杭湖边小坐
1008249,过杭州故宫二首 其二
249358,车过杭州再咏西湖
608672,使过杭州船中七夕
452835,薄暮过杭州上天竺法喜寺
1128828,过杭州故宫二首
454649,车过杭州再咏西湖
939772,过杭留别曹无逸朝奉
1039869,次韵程给事赴越任过杭相会
361607,次韵毛维瞻度支过杭见赠
451558,胡僧返乡过杭招留社诸君饮
158217,予解邑过杭遇介之学士谒告南归
148156,过杭州·紫云楼阁燕流霞
