291307,貂裘换酒·仙甫感某君营救事，寄示一阕，依韵和之
631438,示一株
633968,本师天老人入丹霞寄示一律依韵恭答二章 其二
824531,貂裘换酒 仙甫感某君营救事，寄示一阕，依韵和之
338541,浪淘沙·丙子礼闱揭晓，芸斋又报罢，盖已三黜于春官矣，寄示一解，次韵奉慰
863092,陈长卿侍郎以玉友末利见饷并示长言已酬再示一篇再此次韵
1147346,奉酬于中丞使君郡斋卧病见示一首
769684,沁园春·辛卯不赴金陵之试，示一二同志
13795,闲斋示一二道者
1162165,闲斋示一二道者
753872,镫下课大儿锡熊古诗拈示一绝
36541,奉酬于中丞使君郡斋卧病见示一首
511543,早饮辄醉示一之
377074,夏散辄病既病且恼因书山偈示一一禅者
1215464,十二月望雪集守一访予出示一木禅师所和海粟玉壶歌且邀见一木谈话临别补韵以留为它日證印张本云
633967,本师天老人入丹霞寄示一律依韵恭答二章 其一
426018,次儿恒丰，调职东归，合家团聚，秋夜会宴赋示一律
683419,应试夜泊贞女庙示一二友
266071,次儿恒丰调职东归合家团聚秋夜会宴赋示一律
708991,摸鱼儿  济武见访示一词次韵奉答
538241,应试夜泊贞女庙示一二友 其二
538240,应试夜泊贞女庙示一二友 其一
1061853,夏散辄病既病且恼因书山偈示一一禅者
1159470,吴兴敬郎中见惠斑竹杖兼示一绝聊以谢之
794696,浪淘沙 丙子礼闱揭晓，芸斋又报罢，盖已三黜于春官矣，寄示一解，次韵奉慰
703301,本师天老人入丹霞寄示一律依韵恭答二章
