963070,逢年与德粲同之温陵谒大智禅师医作四小诗送之 其三
538865,真定谒大士像十二年矣薄暮复过此留题
1059130,宽夫率同诸公谒大悲寺观所画圣像以回向心地初分韵赋诗得初字
625401,谒大司马袁自如先生遗祠怆然有感
50588,题画·仙山曾谒大茅君
998947,次韵王龟龄谒大禹祠酌菲饮泉
963069,逢年与德粲同之温陵谒大智禅师医作四小诗送之 其一
593202,寒食谒大毛公墓祠
1214018,归谒大中祖坟
538222,新安汪将军父尝从戚都督平闽寇积功至三品将军有文武才弃诸生谒大司马铨得父官以归赋此壮之
588107,谒大忠祠分韵得絮字
738036,广州谒大忠祠
750378,浮山谒大禹庙
1084929,腊月望日出郊探春游告成观谒大禹祠酌菲饮泉遂至龙瑞宫观禹穴薄暮而还
533189,铜瓦厢谒大禹庙
582476,从白沙先生游厓山谒大忠祠作
1110683,逢年与德粲同之温陵谒大智禅师医作四小诗送之
189762,次韵宋履中近谒大庆退食馆中
189015,逢年与德粲同之温陵谒大智禅师医作四小诗送
735690,谒大禹陵
596243,谒大忠祠次韵
1187099,自武威赴临洮谒大夫不及因书即事寄河西陇右幕下诸公
611463,赤壁谒大苏祠问而吊之
380605,广州谒大忠祠
731102,谒大禹庙
155876,次韵王龟龄谒大禹祠酌菲饮泉
982461,次韵宋履中近谒大庆退食馆中
592053,谒大复先生祠堂
579671,从白沙先生游厓谒大忠祠作
963072,逢年与德粲同之温陵谒大智禅师医作四小诗送之 其四
625388,谒大司马袁自如先生遗祠
1186944,谒大慈恩寺
323527,腊月望日出郊探春游告成观谒大禹祠酌菲饮泉遂至龙瑞宫观禹穴薄暮而还
101,谒大慈恩寺
544790,仲秋北上次武林谒大中丞滕师招饮赋谢
963071,逢年与德粲同之温陵谒大智禅师医作四小诗送之 其二
