619545,秋日安国伯友诸子过饮古松树下是夕忽大风雨
613921,秋日徐子靖携区余诸子过访溪上
635802,春夜诸子过集马山听卢雁林弹琴
807065,玉梅令  同云臣诸子过放庵禅院看梅时积雨新霁
619586,何龙友将入京携同瑞昆诸子过余信宿席上分赋得寒云
619593,初冬何似公李伯襄诸子过观早梅分赋 其二
636261,月夜李东园诸子过宿马山赋得身閒数得上方眠
619592,初冬何似公李伯襄诸子过观早梅分赋 其一
614590,补遗秋日徐子靖携区金诸子过访
636235,秋日诸子过支提分赋兼订莲社之约
620927,春夜诸子过集草堂颜方平以刘姬之约逃席歌以调之
615336,卢一清韩孟郁李烟客诸子过访村居同赋
807507,念奴娇  徐孚若招同诸子过饮余以怯酒先归赋此言谢
615771,中秋诸子过集迟何戴伍三子不至
704399,西庄耕云堂新成陈太守同诸子过访用韵
632529,同诸子过寿大翁
615782,陈子明托病谢客秋日同诸子过访
619707,冬日龙周勚李襄国显国陈伯良诸子过访留酌梅花下得流字
618525,春日载酒同诸子过友人赏牡丹四首 其一
618528,春日载酒同诸子过友人赏牡丹四首 其四
632444,诸子过集
615463,已酉秋杪还山伍国开有开何景言诸子过访
620490,夏日同陈梅臣洪药倩诸子过芥庵访天然和尚
619654,端阳后二日何瑞虞龙周勚何龙友诸子过集紫芝园同家霞举幼度桢卿有开文度分赋席上赋四首 其二 得园字
533969,西庄耕云堂新成陈太守同诸子过访用韵 其二
619653,端阳后二日何瑞虞龙周勚何龙友诸子过集紫芝园同家霞举幼度桢卿有开文度分赋席上赋四首 其一 得云字
594884,秋日黎继荐携酒同关伯玉诸子过蘧园得停字
620591,帅从龙署阳山回招同诸子过集
636262,春日偕诸子过东园别业分赋古梅
619655,端阳后二日何瑞虞龙周勚何龙友诸子过集紫芝园同家霞举幼度桢卿有开文度分赋席上赋四首 其三 得醒字
632528,至前一日同诸子过雪斋因闻再举子
687907,杨凌霜郑秉渊衍源诸子过宿东林
533310,潘子携酒同欧氏诸子过清泉山中出吴笺索余拙书因留夜坐
619656,端阳后二日何瑞虞龙周勚何龙友诸子过集紫芝园同家霞举幼度桢卿有开文度分赋席上赋四首 其四 得杯字
618527,春日载酒同诸子过友人赏牡丹四首 其三
544044,秋夜诸子过集
632999,大雪李苗二鍊师同诸子过谈竟日
709070,乙卯人日招及门诸子过话即以当简
611193,元夕前四日余将之官留垣韩圣期韩孟郁苏汝载谭公谨诸子过集珠江舟中玩月同赋用青字
635812,杨凌霜郑秉渊衍源诸子过宿东林 其二
593095,华父元光诸子过舍弟明叔酒禅阁同集
712324,家务铉载酒移菊过耋符菊篱同虚斋巨川俊斯诸子共酌次日复同诸子过虚斋西山赏菊醉后即事
632188,九日偕诸子过北里
621400,吾粤无牡丹园白将军园新移至两株作花颇大然姿态自藏连日偕湛君诸子过看聊纪一绝
618526,春日载酒同诸子过友人赏牡丹四首 其二
615726,同诸子过欧虞部蘧园水阁
533968,西庄耕云堂新成陈太守同诸子过访用韵 其一
636526,秋日南园诸子过访
708933,万年欢  济武同诸子过周雨文山房
686833,端阳后二日何瑞虞龙周勚何龙友诸子过集紫芝园同家霞举幼度桢卿有开文度分赋席上赋四首 得云字
763333,乳燕飞 五月八日诸子过集听松书屋和东坡韵
686822,初冬何似公李伯襄诸子过观早梅分赋
688919,春日载酒同诸子过友人赏牡丹四首
622356,速杨承之诸子过坐
615535,阴雨久阻看梅因移一株植之斋头招何龙友同诸子过赏
635811,杨凌霜郑秉渊衍源诸子过宿东林 其一
