1180776,避地毗陵寒月上孙徽使君兼寄东阳王使君三首 其一
607291,重阳后二日寿钱使君
716456,复上韶阳述怀呈使君 其五
902912,次韵酬新九江使君赵明达二诗仍送自制香饼白鸥波酒 其一
544293,卢使君追步隐侯作后八咏诗不佞次题倚和倚槛思民力 其一
1096056,台州使君赵寺丞致馈
1110347,送台州沈虞卿使君入朝
1147119,奉酬袁使君高寺院新亭对雨
1171872,眉州别李使君
472270,雪罪诗呈王使君
12957,和韦使君听江笛送陈侍御
714102,初至雁门赠陈祺公使君 其二
886275,谒同年许使君德开 其二
721553,陪陈使君游雁门山水
7370,春日戏题恼郝使君兄
13297,渐至涪州先寄王使君
670567,青州志成赠杜使君
1076496,李使君挽词三首 其一
1509,饯郢州李使君
1199636,与王使君诗五首
1206394,送张明德使君赴南恩州
7134,同朱五题卢使君义井
883145,挽李中甫使君 其四
1071950,次韵钱逊叔谢曾使君送酒
721489,三水别立安后同王使君入羚羊峡四首
541260,送孙使君请告归槜李 其四
219271,和韩无咎使君吊李谪仙
1183784,寄前黄州窦使君
607458,钱使君虚白室二首 其一
349020,祷雨有应·使君忧国愿年丰
1088313,寄题宜春使君定叟张兄隐斋
900482,题邢使君钓隐
713136,同王紫诠使君自广溯惠即事四首时积雨百馀日江潦骤涨数丈坏官私庐舍不可计使君奉令发赈四首 其二
713136,同王紫诠使君自广溯惠即事四首时积雨百馀日江潦骤涨数丈坏官私庐舍不可计使君奉令发赈四首 其二
1149599,代杭人作使君一朝去二首 其二
717408,上元后二夕惠州韶州两使君暨诸公同集长寿精蓝分得一先韵 其二
545953,同赵使君雨中登大云绝顶夜饮见一楼题
341835,开岁五日使君见约同宫使尚书诸丈观山宫梅花因成拙诗
1130916,正月初三日丁使君送三绝句梅诗
1130199,寄黄嗣深使君二首
488782,送王使君擢霸州兵备道还东省
718254,别胡使君 其二
908298,文南朱使君葬其故人钤兵李侯士大夫高其风义作诗美之亦赋一首
1196080,赠陶使君求梨
697814,喜何使君至雨中有作
1190850,奉和虢州刘给事使君三堂新题二十一咏 镜潭
949334,春日迓新使君 其一
333327,同曹使君登浮金堂
37726,贺郑使君
877495,挽建昌詹使君二首 其二
999126,陪曹使君牧马寺劝农
234069,长沙劝耕·使君元起自锄犂
895285,祖颖漕使希道使君以绝句相酬答聊成二章解嘲并发一笑 其二
1147181,送演上人之抚州觐使君叔
216947,书马使君所藏草虫
714761,赠吴使君 其六
1146737,同使君宿大梁驿
917502,秋日自武林病归渔社李使君惠以长篇诵之再四沈疴脱然
986366,赠章使君
1043466,次韵和登州张使君
550789,送林叔度之庐江寻刘使君
1037678,寄临淮蒋使君
6912,韦使君宅海榴咏
220659,鄱阳酬泉州曹使君见寄
937581,沁园春 其十七 送郑通父之吴门谒宋使君
1180884,拟齐梁体寄冯使君三首 其三
135155,陪沈虞卿使君游钱园
1165263,云阳驿陪崔使君邵道士夜宴
911256,南歌子 偶与子建小酌，知府秘书惠然临顾，此一段奇也。辄成小阕，呈二使君
515915,予归自贵藩与何贰守祁使君同游铁溪入溪既深见路左三山鼎立如画祁君有作予和韵健之致和
120665,使君东游·锦席浮波影
1192862,芙蓉溪送前资州裴使君归京宁拜户部裴侍郎
326062,吴门比月不雨司封使君深闵而精祈俄有佳应谨吟成七言
596123,送香山郭使君
670499,谢魏使君题白雪楼
1162857,送龙州樊使君
1228171,陪萨使君饮酒铁塔寺分题得箨龙轩分韵得而字
1071393,己酉乱后寄常州使君侄四首 其三
961702,和丁使君八咏楼 其二
213490,使君祠·一笑淮兵却
1180014,秋日有寄姑苏曹使君
567334,送欧评事使君之南工主事
712446,贺广州冯使君二首 其二
37479,寄杭州灵隐寺宋震使君
683343,寄明卿使君再觐
570463,走笔再送冯使君之楚 其一
13518,郴州换印缄遣之际率成三韵因寄李二兄员外使君
1155427,看常州柘枝赠贾使君
1158675,送台州李使君兼寄题国清寺
692135,送永宁许使君
716565,病中奉柬王南区使君兼送之任川南 其五
905721,题尤使君郡圃十二诗 其五 凝思斋
1180358,上新定宋使君
918320,曹主簿泾自卜寿藏追范石湖韵谨依虚谷使君例各一再和 其一
7374,将适吴楚留别章使君留后兼幕府诸公得柳字
717509,赠徐君新婚次王使君元韵
163552,和虞使君撷素馨花遗张立蒸沉香四绝句
1217633,寄浙西廉访托克托使君
18364,钱侍郎使君以题庐山草堂诗见寄因酬之
1180749,酬杜使君见寄
859556,送潮州吕使君
13832,偶题寄独孤使君
876839,使君次韵再赋二首 其二
692067,酬许使君读鄙诗见赠
1071481,熊使君次韵
1161406,陪江州李使君重阳宴百花亭
956304,赠临江简寿玉二首简携王仲显使君书来谒并示孔毅甫梦蟾图今庙堂五府皆有题字 其二
1070345,高邮旅泊书怀寄淮东提举蔡成甫观兼呈郑使君弇三首 其二
747,酬宋使君见赠之作
1129459,舟中遇雪寄宋使君
957237,富顺杨商卿使君向与余相别于泸之合江渺然再会之期后九年乃访余吴门则喜可知也今复分袂更增惘然病中强书数语送之
713331,王川南使君紫诠招同李宫詹山公袁通政密山梁太史药亭蓝山人采饮游灵洲予以事不果往诸公分韵及之仍同游韵八首 其六
124650,晚秋北园·寂寥台榭使君家
940251,菩萨蛮 寄赵使君
667074,早春过顾使君春草阁
325947,蒙使君召预池光之会
37332,上杭州令狐使君
1250770,寄栾使君
1106071,河中使君修撰陆公挽辞三首
7704,寄彭州高三十五使君适虢州岑二十七长史参三十韵
1071447,次韵熊使君登楼感秋之作
1194689,宴王使君宅题二首
1173538,寄刘峡州伯华使君四十韵
970882,七月十有五夜一再梦故舒州使君侍御公宛如平生且于其案间得若纸若缯者一沓皆公所书或印者翻之有如帜者三有曰苛政曰赃吏忘其一焉问傍立者以何所用云始朝议欲遣公为某使故建此云觉而赋诗四绝 其四
956171,深溪铺中二绝追路寄呈元将仲显二使君 其二
4299,送崔使君赴寿州
1154082,奉和张使君宴加朝散
883143,挽李中甫使君 其六
18795,赠楚州郭使君
946644,钱使君知原生辰 其二
1121710,深溪铺中二绝追路寄呈元将仲显二使君
228248,赞径坂使君何山促春讲席之盛
1172916,行次盐亭县卿题四韵奉简严遂州蓬州两使君咨议诸昆季
562684,读书佳山水歌送王季重使君归山阴
64898,茅山道中送邢使君之西湖
670334,送彰德陈使君迎侍浙中
3566,献高使君大酺作
1187512,越中送王使君赴江华
1186197,送马使君赴郑州
40648,在荆州与张使君李居士联句
47128,送李使君镇海昌
1003808,寿李悦斋五首和送三荣使君韵 其三
1108401,送项使君季约二首
213793,别葛使君·邑屋为儒知善政
877075,癸卯上元即席次杨使君韵二首 其一
1126808,将次施州先寄张十九使君三首
389803,怀吴明卿·使君车马自风尘
6390,凤翔府行军送程使君赴成州
12956,奉酬韦苏州使君
363871,次韵和登州张使君
544909,岭右张使君辟园城中台榭池沼皆桂林胜绝处予闻窃向往焉赋得六题 其一 清虚阁
245494,常州郡斋·使君非是爱山间
225206,新使君·半生穷巷抱遗经
896034,嘉禾百咏 其八十 曹使君祠
946681,沈德和使君生辰四首 其二
934841,赠林使君二首 其二
917421,谷隐之东芍药酴醾涉夏尚有存者箨龙头角且森列于前次前韵呈九江赵使君
1147113,奉同颜使君真卿开元寺经藏院会观树文殊碑
597904,冬夜郑使君萧徵君见过联句
570679,寄黄州邹使君迪光兼简周弘礿选部 其二
716563,病中奉柬王南区使君兼送之任川南 其三
664528,王使君诲处觅猫
325976,近承南康朝请使君宠访林圃小酌至夜公权特惠篇什谨次韵
693827,人日自衡还潭道中次雨泉使君韵
689392,袁使君平寇歌
1003890,挽顺庆使君宝章李十三丈二首 其一
734366,登台为赤霞赵使君赋
879899,挽京口使君丰郎中十首 其三
1095772,寄宣城使君陈中书兼简谢别驾林叔恭 其一
722003,复上韶阳述怀呈使君
713269,乙亥除夕同袁密山史蕉隐蓝公漪集王紫诠使君寓斋次东坡元旦立春韵三首时余以夜禁先归 其二
1184876,和白使君木兰花
237738,和唐使君秬古风
169421,吕吉父使君生日
879935,谢赵使君豁租
504652,徐仲仁以使君天上来六诗投赠遂歌山中人次韵答之 其一
794126,臣虞杂取米盐琐事，成二十四诗，余读而悲之，勉答其半，韵既不次，语复不伦。亦犹杜陵野老同元使君春陵行，非敢云属和也 其九 绵
670662,寄怀蒲圻魏使君 其二
960498,水调歌头 其四 秩满告归，曾使君饯别，席间奉呈
1118710,予出蜀日尝遣僧则华乞签于射洪陆使君祠使君以老杜诗为签予得遣兴诗五首中第二首其言教戒甚至退休暇日因用韵赋五首
1118710,予出蜀日尝遣僧则华乞签于射洪陆使君祠使君以老杜诗为签予得遣兴诗五首中第二首其言教戒甚至退休暇日因用韵赋五首
614696,寄马北海使君
883664,吴门比月不雨司封使君深闵而精祈俄有佳应谨吟成七言二首聊代谒贺 其二
1174345,初春雨中舟次和州横江裴使君见迎李赵二秀才同来因书四韵兼寄江南许浑先辈
1123291,径坂左司使君惠和近诗为亲而喜合天理之公得性情之正复用韵以庆
1191060,奉和虢州刘给事使君三堂新题二十一咏 梯桥
883644,次韵司封使君和推官早梅山茶二首 其二
1180425,对雪寄新定冯使君二首 其一
1155329,和万州杨使君四绝句 江边草
541603,同邹秦二使君游德山
1193902,寄明州于驸马使君三绝句
1063473,蓬州杜使君洪道屡称我于诸公闻之愧甚赋诗答谢之
200103,康使君惠诗借韵谢
910074,送杭州使君苏内相先生某用先生旧诗方丈仙人出渺茫高情犹爱水云乡为韵作古诗十四首 其九
164046,喜雨上使君
334351,沈子玉使君
671010,早春寄吴使君 其三
1159795,洛中送崔司业使君扶侍赴唐州
154496,乞画雁寄泾州毋使君
37439,上冯使君山水障子
1189184,晚次东亭献郑州宋使君文
979397,次开祖使君韵兼呈端叔大夫圣域长老
358957,将次施州先寄张十九使君
36628,和李舍人使君纾题云明府道室
712320,送王叔琬季如奉川南使君命送家之宜兴时立安自都门奉太翁南来将至
569760,饯李惟桢使君迁浙江行省参政领金华诸郡 其一
959333,戏言寄霅溪使君唐司勋
147476,陪虞使君登岳阳楼
8857,奉赠萧二十使君
192086,同邓使君赏双头牡丹
1173516,送陵州路使君赴任
1172776,巴西驿亭观江涨呈窦使君二首 其一
1005100,粹老使君前被召约往它山谒善政侯祠既不果以书见抵谓可叹惜并示广德湖新记因成长句奉寄
1138856,洛中郑悫三伏之际率宾僚避暑于使君林取大莲叶盛酒以簪刺叶令与柄通屈茎轮囷如象鼻焉传吸之名碧筒杯故坡诗云碧碗犹作象鼻弯白酒时带莲心苦丙寅五月宜兴州赏诚以此为题为赋十一首 其七
973290,寄南安李使君三章 其二
408624,贺掖（县）前令南昌魏起鹏使君乞养还山吟四叠选二 其一
682626,菊月王使君拉饯三塔寺附题
1147242,同卢使君幼平郊外送阎侍御归台
1228229,怀萨使君
533914,陈使君玉叔督饷至京师枉过旅馆同欧桢伯作得根字
1147244,同袁高使君送李判官使回
26965,黔中罢职过峡州题田使君北楼
1180400,东阳罹乱后怀王慥使君五首 其二
910076,送杭州使君苏内相先生某用先生旧诗方丈仙人出渺茫高情犹爱水云乡为韵作古诗十四首 其七
965356,送怀玉之越谒秋房使君
880885,和赵友竹呈求仁使君
1122550,次陈使君韵三首
1162555,送段觉归东阳兼寄窦使君
673836,夏日和氏庄同田三使君
488175,春日寄怀陆使君 其一
147756,长汀寄李使君
1161267,送吉州阎使君入道二首 其一
965163,送谢刑部使君赴召 其一
538922,览何使君振卿所编游名山记有寄
597366,同吴使君明卿游海珠寺时明卿调守高州
1188803,寓江州李使君
1180403,东阳罹乱后怀王慥使君五首 其五
1121645,次韵同年杨廷秀使君寄题石湖
78256,山中小雨得宇文使君简问尝见张僊翁乎戏
22640,送璧州刘使君
564752,送郭使君赴太原节推
641351,仆客中主吕簿所因得遍交府县诸公今日小至辱德和使君招饮馆舍而玄凤丞公又有夜筵之卜客边怀感作此赠之
859587,寄岳州张使君
335674,和使君闵雨
1178570,陪张丞相登荆城楼因寄蓟州张使君及浪泊戍主刘家
1224219,赠别南剑李使君三十韵
89359,挽建昌詹使君·稍喜佩铜鱼
1060509,次韵徐使君观刈禾宴集二首 其二
631164,初春陪廖使君曾文学游玉帘泉
22884,闻庆州赵纵使君与党项战中箭身死辄书长句
918630,谒金门 使君再招饮，牡丹如山，坐上赋此
383858,资阳潭石矶特奇怪艮斋赵使君招宴即席
150387,和丁使君八咏楼
376303,寄处州高使君疏寮
1095741,华亭孙丞迎侍道州使君
541920,长江之水歌送匡使君淑教谪大梁
551285,花朝社集送佘宗汉明府之南康访杨使君
37627,对雪寄新定冯使君·政化由来通上灵
900496,子远使君出守广汉始获倾盖诸官赋诗赠别某广汉人也故末章及之
876840,使君次韵再赋二首 其一
799341,颂使君寄怀齐梅麓剌史
36630,奉酬袁使君送陆灞却回期道寺院
895389,希道使君弭节合沙馆奉太夫人游鼓山乃蒙封示所和梦锡赠行佳句辄次严韵少叙别怀
230314,姚使君·湘鳞六六寄相思
1002331,送张忠州使君八兄二首 其一
908160,送何子闻使君之行在
959167,客有诵袁蒙斋得雨酬倡之什辄赓元韵志喜也呈虚斋使君 其一
883680,佳雪应时呈司封使君三首 其一
845496,和郭使君韵
1172777,巴西驿亭观江涨呈窦使君二首 其二
1173253,陪王使君晦日泛江就黄家亭子二首 其二
879901,挽京口使君丰郎中十首 其一
1167234,逢漳州崔使君北归
670921,汝宁徐使君 其九
697078,卢使君追步隐侯作后八咏诗不佞次题倚和倚槛思民力
36804,陪颜使君饯宣谕萧常侍
918616,念奴娇 寄孟使君
558978,繇茶陵过吉州张使君招饮白鹭书院时三月初十日也就此因闻倭警 其二
75892,次韵宇文使君山行
1116161,熊使君垂和漫兴诗次答四首
858989,送周仲章使君
669414,送张使君考绩之京
1555,饯泽州卢使君赴任·闻道降纶书
647244,花源逢顾何二使君作
855097,孙使君约观灯以病不果往以诗见强次韵和酬
15035,夔州窦员外使君见示悼妓诗顾余尝识之因命同作
700568,杂言送延平朱使君十三首
716453,复上韶阳述怀呈使君 其二
1095389,送常德徐使君兼简李伯达 其一
1180696,寄信州张使君
862790,伯氏临江使君寄芗林次韵 其二
1106811,伯氏临江使君寄芗林次韵
670920,汝宁徐使君 其八
299521,抵西平赠沈藕庵使君
1062177,福州程使君止戈堂二首 其一
79540,寓天庆观有林使君年八十七方烧丹云一桼米大
6505,使君席夜送严河南赴长水
13803,郡中端居有怀袁州王员外使君
337326,李使君挽词
620790,陪程使君宿玉泉寺三首 其一
858636,为裴使君赋拟岘台
539063,卢使君君万手植一松百花洲且侑以诗走笔奉谢
598182,以笔墨秋扇赠郑使君戏成三绝 其二
1177153,泉州刺桐花咏兼呈赵使君 其一
1000422,庆元戊午临江劝驾多士凡由进士科进者皆预焉且沿乡人饮酒之意叙坐以齿酒半使君又出杰句宠其行某陈人也偶睹盛事思有以记之敬嗣严韵二首极愧不工尚几镌削 其一
113641,和中玉使君晚秋开天宁节道场
191115,成均同舍饯别新安使君徐子宜太丞分韵
1130643,次韵金陵赵德夫使君上元三绝
195318,雪窦飞雪亭和孙使君
18281,答杨使君登楼见忆
325957,次韵司封使君新岁喜雪
1058213,元祐己巳岁维扬后斋为亳州使君蒋公仲永写二首 其一
705076,送吴使君服阕之京
534859,中秋云根亭次艮斋使君
712267,除夕咏橄榄同王紫诠使君梁药亭屈翁山吴山带季伟公作四首 其二
537673,泰安戏呈徐张二使君索会 其一
1228856,兰堂上人之金陵因寄宪府张使君
1071422,河中使君莫少卿挽诗二首 其二
20573,出蓝田关寄董使君
1173949,敬寄族弟唐十八使君
1032366,孟使君饯行即席以几时杯重把分韵得几字
4532,唐城馆中早发寄杨使君
1088960,某顷蒙信阳使君教以边字韵佳句伏读降叹病倦答谢甚缓复不能奇仰俟斲削 其一
180278,代上阆中章使君
1193203,渐至涪州先寄王员外使君纵
1169861,送龙州田使君旧诗家
722021,病中奉柬王南区使君兼送之任川南
88502,送洪使君·虽拥朱轓贵阳市
855129,寄曹使君
902930,行近湖州不果入城寄王成之使君
1087253,开岁五日使君见约同宫使尚书诸丈观山宫梅花因成拙诗
1178250,寄卢虔使君
1208103,秋日集咏奉和潘李二使君浦编修诸公十首 其十
714104,陪陈使君游雁门山水 其二
325840,楼予善使君挽辞
1136077,呈吕使君留卿
525802,杂言送延平朱使君十三首 其二
538156,与故赵使君登定州塔
900169,次韵无为使君尊兄见寄之什
173753,野人庐·深深惟使君
219270,韩使君分送芍药索诗因忆旧游
1180816,上杜使君
378881,送匀工人谒蔡州使君
713147,题王惠州紫诠使君观瀑图三首 其一
240380,使君生辰·麟阁仙蓬莱
1183086,送李使君赴抚州
976358,奉继冯使君韵 其一
1124060,斯远兄入城见使君郎中且谒尚书韩先生提属李丈题诗以赠四首
575509,秋日饮孙协镇葡萄园，忆北平傅、陈二使君
533554,同徐中郎吴给事访李使君郡斋
13903,送绛州卢使君
533734,经韶州赠李同野使君
880787,和建小学韵呈赵求仁使君 其四
716482,除夕咏感揽和王使君八首 其一
1182114,寄题蔡州蒋亭兼简田使君
340793,代饯无为马使君口号
1154284,饯唐州高使君赴任
1191575,哭饶州吴谏议使君
532718,饮李氏村同程伯书使君乘月踏雪联舆而还
946679,沈德和使君生辰四首 其四
935162,予出蜀日尝遣僧则华乞签于射洪陆使君祠使君以老杜诗为签予得遣兴诗五首中第二首其言教戒甚至退休暇日因用韵赋五首 其一
935162,予出蜀日尝遣僧则华乞签于射洪陆使君祠使君以老杜诗为签予得遣兴诗五首中第二首其言教戒甚至退休暇日因用韵赋五首 其一
327522,元祐己巳岁维扬后斋为亳州使君蒋公仲永写
652374,初春寄唐惟良使君
163497,别冯伯昭新放归三荣末句乞呈似使君王万里年
597774,酬郑使君见访有怀之作
561016,九日将至衢州寄杨使君 其一
699212,平南张别驾携酒约冯次江使君同游思鹅洞舟二首
358587,敬超先·此地凭熊几使君
24263,赠别前蔚州契苾使君
1172795,王十七侍御抡许携酒至草堂奉寄此诗便请邀高三十五使君同到
1210757,九日对菊忆姜霍二使君 其一
670705,为魏使君送黄生归楚
606247,送郑别驾督鹾还西粤兼柬薛使君二首 其二
1155563,宿窦使君庄水亭
1184526,饯唐州高使君赴任
1095016,正月初三日丁使君送三绝句梅诗 其三
7372,短歌行送祁录事归合州因寄苏使君
1128025,和虞使君撷素馨花遗张立蒸沉香四绝句
123675,青城县何子方使君同年园池
1180191,暇日有寄姑苏曹使君兼呈张郎中郡中宾僚
1180432,早秋即事寄冯使君
6813,送王牧往吉州谒王使君叔
1208102,秋日集咏奉和潘李二使君浦编修诸公十首 其九
570655,题李使君扇头小画
544294,卢使君追步隐侯作后八咏诗不佞次题倚和倚槛思民力 其二 瞻斗望京华
12052,九日陪皇甫使君泛江宴赤岸亭
1120473,陈使君生日二首
1147112,奉同卢使君幼平游精舍寺
37581,怀薛尚书兼呈东阳王使君
1190839,奉和虢州刘给事使君三堂新题二十一咏 竹溪
606062,和钱使君与大司马王公月下汎舟酌别薛明府
36655,同颜使君真卿李侍御萼游法华寺登凤翅山望太湖
1166255,饯唐州高使君
52018,安南歌送沈使君
855034,奉送径山无畏老人谒吴兴蒋使君无畏能作诗写字去径山五年遨游江南以归遂过仆于此聊馆之旁寺老屋三数间而已当坐名山胜刹大佛事而此非所宜安也
883715,仲春上丁知府金部躬率僚寀释奠于先圣既而升公堂命学官讲书窃惟中庸之篇自安定先生常以是诲人阅岁既久嗣音者希某孤陋无似窃慕前哲其启讲也今龙阁黄公尝临之其终讲也金部使君又临之郡儒在列咸与荣观辄成五言律诗二十韵叙谢
1180899,夜对雪寄杜使君
1228269,用观志能韵寄萨使君
597252,春日衡阳道中次陈雨泉使君韵
1109520,挽京口使君丰郎中十首
713352,又寿冯使君次赵秋谷夜话韵
716489,除夕咏感揽和王使君八首 其八
37676,避地毗陵寒月上孙徽使君兼寄东阳王使君·常忆双溪八咏前
37676,避地毗陵寒月上孙徽使君兼寄东阳王使君·常忆双溪八咏前
1180352,上卢使君
538655,送王使君明辅迁陕西行省君有惠政于吴好谈禅理雅与余合故末章寄意焉 其一
562919,送许使君
713137,同王紫诠使君自广溯惠即事四首时积雨百馀日江潦骤涨数丈坏官私庐舍不可计使君奉令发赈四首 其三
713137,同王紫诠使君自广溯惠即事四首时积雨百馀日江潦骤涨数丈坏官私庐舍不可计使君奉令发赈四首 其三
1107456,楼予善使君挽辞
683387,萧使君有惠政于吾州别十有六年矣今以请碑文见过为赋三章志别君宦薄然五世同居近有义门之旌故末章及之
102549,送牛尾狸与徐使君
1173830,将适吴楚留别章使君留后兼幕府诸公得柳字
935163,予出蜀日尝遣僧则华乞签于射洪陆使君祠使君以老杜诗为签予得遣兴诗五首中第二首其言教戒甚至退休暇日因用韵赋五首 其五
935163,予出蜀日尝遣僧则华乞签于射洪陆使君祠使君以老杜诗为签予得遣兴诗五首中第二首其言教戒甚至退休暇日因用韵赋五首 其五
1108568,喜雨二首柬张使君
955380,依韵和胡使君书事
713323,有进川南使君新荔枝者是日初尝苦瓜使君纪之以诗与吴山带和之次吴韵二首 其一
713323,有进川南使君新荔枝者是日初尝苦瓜使君纪之以诗与吴山带和之次吴韵二首 其一
9615,寄徐州郑使君
222755,寄窥堂庄使君
1121621,次韵同年杨使君回自毗陵同泛石湖舟中见赠
1000517,送赵使君老父吟
1208098,秋日集咏奉和潘李二使君浦编修诸公十首 其五
539909,走笔呈王使君 其一
961704,和丁使君惠赠 其一
19855,送陈房谒抚州周使君
1153920,送夔州班使君
1236160,怀萨使君二首
598132,赠广德邝使君
247365,与王使君诗
95357,呈衡州使君先生
550934,高贤祠成荅屠使君 其四
1006016,鹊桥仙 吕使君饯会
900560,庐山有胜处曰卧龙南康朱使君始筑茅绘诸葛武侯像于其中以书属予赋诗寄题此篇
946763,过平望驿有怀湖州李使君二首 其一
1147404,夏日奉陪陆使君长源公堂集
221455,求仁使君·黉舍临溪静最安
877031,饯潘使君二首 其一
1135050,呈孟君复能静使君二首 其二
1007916,过晁使君子莫园有感
855092,对岩桂一首寄曹使君
713324,有进川南使君新荔枝者是日初尝苦瓜使君纪之以诗与吴山带和之次吴韵二首 其二
713324,有进川南使君新荔枝者是日初尝苦瓜使君纪之以诗与吴山带和之次吴韵二首 其二
1087746,奉陪彦集充父同游瑞岩谨次莆田使君留题之韵
87789,呈贾枢使·君亲一念与天通
682630,赠别屏南杨使君归隐
484976,钱塘送马使君之吴中
1162085,寄范使君
46968,顾使君东亭隔帘观竹下舞妓
476286,陈使君招饮阆州王宫
488205,袁使君平寇歌 其三
1003806,寿李悦斋五首和送三荣使君韵 其二
26221,处州李使君改任遂州因寄赠
721496,有进川南使君新荔枝者是日初尝苦瓜使君纪之以诗与吴山带和之次吴韵二首
721496,有进川南使君新荔枝者是日初尝苦瓜使君纪之以诗与吴山带和之次吴韵二首
881052,悼使君赵计院
220079,题九江徐使君眄柯亭
7122,真定即事奉赠韦使君二十八韵
544869,寄姚安杨使君
228183,寄新衡阳徐使君左司山长
713135,同王紫诠使君自广溯惠即事四首时积雨百馀日江潦骤涨数丈坏官私庐舍不可计使君奉令发赈四首 其一
713135,同王紫诠使君自广溯惠即事四首时积雨百馀日江潦骤涨数丈坏官私庐舍不可计使君奉令发赈四首 其一
1166944,送邵州林使君
1132649,顺安辞呈赵使君二首
1003713,虞使君示春日喜雨六绝和韵 其五
1196085,和歙州陈使君见寄
86476,送项使君季约·世有凝香乐
862955,谹父望日欲载酒过南池且云已得潘风酒郑顾道亦作诗再叙南池风物以酬曾使君吟赏之意
1159186,桂江逢王使君旅榇归
199354,再游仪真呈张使君
6507,九日使君席奉饯卫中丞赴长水
934274,寓天庆观有林使君年八十七方烧丹云一黍米大可化汞一斤为黄金梅道人年八十五善医
1119329,陪盱眙王使君东游四首
36807,同杨使君白苹洲送陆侍御士佳入朝
855328,蝶恋花 其七 席上和孙使君。孙暮春当受代
1102556,遣兴十首呈孟兵部使君 其五
851263,和龚使君韵
1180971,寄杜使君
990176,邵武赵使君挽章二首 其二
1189653,贺邓璠使君正拜袁州
1028830,次韵曾使君和删定鲍倅喜谯楼双门复旧观之作
9521,赠别崔司直赴江东兼简常州独孤使君
