19685,喜裴涛使君携诗见访醉中戏赠
962472,寿外舅富顺赵使君
1108380,送陈鲁叟使君赴广西漕
1165163,酬宋使君见诒
18796,和郭使君题枸杞
1172775,巴西驿亭观江涨又呈窦使君
90681,胡平一·後赵前丁两使君
1046685,寄鼎州陶使君商翁
961701,和丁使君八咏楼 其一
122794,次韵同年杨使君回自毘陵同泛石湖
176070,送怀玉之越谒秋房使君
1128163,高邮旅泊书怀寄淮东提举蔡成甫观兼呈郑使君弇三首
140423,次韵酬新九江使君赵明达二诗仍送自制香饼白
336527,二十三日雨霁再陪徐使君登秋浦楼
877030,饯潘使君二首 其二
320260,寄向公美使君
545278,董使君过访赋赠二首 其一
830712,谢王使君送匡山紫芝
37716,上卢使君·司马迁文亚圣人
981544,别永嘉使君赵致轩
1001952,过南安接孟使君辞警策多矣复承遣诗追惠遂足度岭所赋梅还谢万一
544309,吕梁阻风呈徐使君
724253,在荆州与张使君李居士联句
230649,送韩使君赴任越州十一韵
959168,客有诵袁蒙斋得雨酬倡之什辄赓元韵志喜也呈虚斋使君 其二
37494,寄拄杖上王使君
1099927,戊辰谒伯祖惠阳使君坟三绝 其一
1162147,彭州萧使君出妓夜宴见送
908938,阮梅峰举似题高沙郡圃醉醒亭绝句因继元韵并简萧使君 其一
1213181,王仲通宰公自东吴别去十载甲寅秋会于鄂渚乃知尚在七品常调中使人有郁郁遗才之叹谈论平生相对如梦历数海内诸友离合升沉之状悲欢良久有不能自已者既而仲通有欲为道隐求奉一祠之语诘难未能服俄为借骑下淮复归行馆翌日缀诗二章奉呈兼简钦甫佥司士元使君君平察推 其一
876880,和张使君一首
606245,忆罗浮兼寄何使君二首 其二
520766,登太仓州中山子怀故襄阳李使君
721898,为番禺孔使君母陈太夫人寿
1195345,长安客舍叙邵陵旧宴寄永州萧使君五首
6180,赠赵使君美人
1101107,沈子玉使君
545855,寿龙使君六秩
938280,遥碧轩作呈使君少隐时欲赴召
1133205,送郭君贤使君赴建德任 其一
1161576,新安所居答相访人所居萧使君为制
150115,次韵和隰州李九使君见寄绝句
747695,庐阳夜捷行赠江使君达川
670919,汝宁徐使君 其七
562990,题平湖弄珠楼呈萧象林使君二首 其一 弄珠汉水遗事使君汉阳人而平湖亦有汉瑭又称鹦鹉湖于弄珠差合
562990,题平湖弄珠楼呈萧象林使君二首 其一 弄珠汉水遗事使君汉阳人而平湖亦有汉瑭又称鹦鹉湖于弄珠差合
1247343,甲寅仲冬予摄官星渚本邑判簿李公以催租入山忽游武夷予命小舟追之不及是夕宿常庵溪风山月一时清兴王事靡盬明日即附舟逆流而上因忆曩时与石堂卢使君同游放怀山水一觞一咏其乐不可复也援笔书怀遂成唐律二首 其一
1180303,归东阳临岐上杜使君七首 其二
896130,嘉禾百咏 其八十一 高使君祠
1178508,陪姚使君题惠上人房
95922,漫成·峡州使君我所亲
388856,谒台还道逢海上宋使君戏赠
35839,郡城放猿献卫使君
533363,同谦之丘使君自天宁寺骑至西湖上
88698,送陈使君·博士曾森戟
561190,暮春神乐观饯方使君
712626,与柳州江使君磊庵再晤于五羊适有西川督学之擢赋此送之
670663,寄怀蒲圻魏使君 其三
1092110,薛使君生日
1180305,归东阳临岐上杜使君七首 其四
983849,祝子正从范使君锻以诗寄之
597270,人日自衡还潭道中次雨泉使君韵 其二
744614,永春郑使君一论戍秦中伤其老病远迁歌以永诀
1066511,次去非韵简元忠使君
1147335,奉和裴使君清春夜南堂听陈山人弹白雪
469304,走笔戏赠万伯修使君二首 其一
670948,酬许使君读鄙诗见赠 其二
151869,寄寿春使君陈学士
18624,得湖州崔十八使君书喜与杭越邻郡因成长句代贺兼寄微之
686078,寄怀沈使君二首
882872,挽李中甫使君 其一
36725,奉陪杨使君顼送段校书赴南海幕
879893,挽京口使君丰郎中十首 其九
1003746,小诗谢霅川使君帮祠庭薄俸
623480,立春前三日刘使君招饮浔郡城南楼 其一
1033444,访方子万使君宅有园林之胜
1003518,为沧江虞使君赋客室三首 其三
1070906,昨晚约逢时使君今日食后过宾燕瀹茗观莲今日雨忽作因记东坡游西湖遇雨诗云湖光潋滟晴方好山色空濛雨亦奇之句作雨中观莲诗戏呈并示同行诸君
691968,寄子与使君
17560,别萱桂·使君竟不住
716452,复上韶阳述怀呈使君 其一
670309,寄子与使君 其一
239282,送赵使君老父吟
10831,赠宜阳张使君
586958,挽邹使君
686188,守钱五卿使君二首
683316,泰安戏呈徐张二使君索会
1208075,晚经皮使君江居不见，赋简二首 其一
683833,走笔再送冯使君之楚
670494,和魏使君扶侍游太山
606572,送陈使君入觐
98755,口号·使君笑别赤城仙
195380,灼艾戏呈阮使君
696735,徐仲仁以使君天上来六诗投赠遂歌山中人次韵答之
1197644,与王使君诗五首 其五
1095773,寄宣城使君陈中书兼简谢别驾林叔恭 其二
1197858,宣城为封使君语
541612,信阳道中阻雨次杨使君韵
62619,仲春廿日发瓜渚同顾使君益卿赴闽粤郭次甫吴
226195,谭使君·雾阁云窗罨画开
191418,和巩使君释奠韵
1036787,冬至晚起枕上有怀晋陵杨使君 其二
230947,湖州李使君闻予游庐山寄书云为我一谢清绝
1173202,宴戎州杨使君东楼
943419,赵使君淮春楼落成二首 其二
716566,病中奉柬王南区使君兼送之任川南 其六
1214497,雪壑海云使君所自号也 其一
236970,呈赵使君时方西遁
921193,送牛尾狸与徐使君
1060697,晚宴南禅寺呈使君叠前韵
123415,深溪铺中二绝追路寄呈元将仲显二使君
561018,十日李使君郡斋宴
626561,寄锡山朱赋游兼怀蜀中王使君
980368,寄隰州李九使君
216140,雪中游北山呈广州使君和叔同年
1155465,送苏州李使君赴郡二绝句 其二
1226041,张野泉偕虚谷方使君赵春洲数先辈见访即席赋诗各以酒字为韵
21465,寄题蔡州蒋亭兼简田使君
881608,点绛唇 再次王景源使君韵，赋第三首 其十七
596907,观朱使君家乘题赠二首 其二
1180882,拟齐梁体寄冯使君三首 其一
670493,使君重过山楼分赋得空字
1147320,饮茶歌诮崔石使君
1155331,和万州杨使君四绝句 嘉庆李
723754,就蒲州使君乞酒诗
1131977,次韵张龙使君十绝
37500,春晚寄卢使君
37638,归东阳临岐上杜使君·红锦帐中歌白雪
152015,题神冈庙其神盖六朝时刘竺使君也
36654,奉和崔中丞使君论李侍御萼登烂柯山宿石桥寺效小谢体
905711,题尤使君郡圃十二诗 其三 玉霄亭
880874,寿赵使君计院求仁先生
1210675,寄扬州金使君
195105,曹使君舍夜饮归步月出城色山色如画作诗
1056424,将次施州先寄张十九使君三首 其三
224110,鹧鸪天·忆昔南楼旧使君
990361,次韵赵使君师夏谒白鹿游栖贤长句
1151826,送梓州李使君
1147192,夏日同崔使君论登城楼赋得远山
216780,和慎使君出城见梅花
538575,待劾未至信笔成二章拨闷并简吴王二使君 其二
8309,送严侍郎到绵州同登杜使君江楼
1124221,寄南安李使君三章
1182027,送饶州张使君
335597,江阴杨使君寄示与杨从事唱和诗一轴奉酬
469387,赠郑使君开府郧阳
878534,喜雨二首柬张使君 其一
1033498,怀雪蓬姚希声使君 其一
388436,寄明卿使君再觐
669419,赠朱民部使君还朝
1186772,酬漳州张九使君
910806,和慎使君出城见梅花
877258,送项使君季约二首 其二
703278,寄寿秦左星使君
325961,奉和司封使君春日回文之作
883675,近承南康朝请使君宠访林圃小酌至夜公权特惠篇什谨次韵
1001833,德庆府城绕以荷池叶楙花繁时环望之红绿无间断号为荷城记以唐律遗后来使君
898505,至和中得倅新定今领福唐再经此郡感旧书怀因呈使君刘孝叔
907296,送恩平潜使君还里二首 其二
1076267,陪李使君登庾楼是日云雾不见淮山二首 其一
959555,送颍川使君韩司门
524052,仲春繁台饮饯醉归口占呈陈边二使君
1190844,奉和虢州刘给事使君三堂新题二十一咏 柳溪
570954,二月十八日过阜城大雪见中翰郑冲频壁间和杨使君沙民种石田四律依韵再和 其二
1096028,寄严州陆使君
125305,式燕亭·使君班春还
177744,翟使君挽歌
23655,酬绵州于中丞使君见寄
15741,自商行谒复州卢使君虔
96450,寄峡州使君郭郎中
501765,倚李伯康使君韵
1033922,赣州呈雪蓬姚使君
696056,立春前三日刘使君招饮浔郡城南楼
849662,奉谢龙山使君
855131,曹使君置酒石桥山用肉字韵作诗见招不果往复用前韵奉寄
1071993,奉酬泉使君寄荔枝子鱼 其一
327359,奉陪彦集充父同游瑞岩谨次莆田使君留题之韵
1120143,过平望驿有怀湖州李使君二首
910078,送杭州使君苏内相先生某用先生旧诗方丈仙人出渺茫高情犹爱水云乡为韵作古诗十四首 其五
1182672,韦使君黄溪祈雨见召从行至祠下口号
670913,汝宁徐使君 其一
670602,送郭使君解郡暂还豫章诗有序
179851,文南朱使君葬其故人钤兵李侯士大夫高其风义
1195024,拟齐梁体寄冯使君三首
851809,乞画雁寄泾州毌使君
355800,高邮旅泊书怀寄淮东提举蔡成甫观兼呈郑使君弇
1161509,送璧州刘使君
1132462,顺安辞呈赵使君二首 其一
235253,己未试监假道于严报谢使君
545876,秋日集汝申使君喜雨作时潘生对奕久之
855313,摊破浣溪沙/浣溪沙 其一 天雨新晴，孙使君宴客双石堂，遣官奴试小龙茶
544888,郭方伯以三诗见赠赋此奉答 其二 秋日张使君招饮湖上作
874273,雪中呈颜使君升坚 其一
34482,旅次铜山途中先寄温州韩使君
970884,七月十有五夜一再梦故舒州使君侍御公宛如平生且于其案间得若纸若缯者一沓皆公所书或印者翻之有如帜者三有曰苛政曰赃吏忘其一焉问傍立者以何所用云始朝议欲遣公为某使故建此云觉而赋诗四绝 其二
25596,题越王楼寄献中丞使君
1102555,遣兴十首呈孟兵部使君 其四
22474,题江上柳寄李使君
1004091,寿程使君和获白雁诗韵
1135904,汉臣明府与公度使君话吾州山水之胜有诗次韵二首 其二
908937,阮梅峰举似题高沙郡圃醉醒亭绝句因继元韵并简萧使君 其二
124847,汉南使君数以公醪见问
191259,和使君巩大监秋阅
323801,送文渊使君郎中赴当涂
1005062,寄台州使君五首 其四
1161552,和处州韦使君新开南溪
787324,送张阳扶佐庄使君幕校士河南
36201,酬文使君
1173501,奉赠萧二十使君
713138,同王紫诠使君自广溯惠即事四首时积雨百馀日江潦骤涨数丈坏官私庐舍不可计使君奉令发赈四首 其四
713138,同王紫诠使君自广溯惠即事四首时积雨百馀日江潦骤涨数丈坏官私庐舍不可计使君奉令发赈四首 其四
34993,陶使君挽歌·始忆花前宴
325950,奉谢司封使君晏公临顾园居
1033588,南安王使君领客湛泉流觞曲水
1073880,黄州使君朝议惠公挽词
247367,使君诗·遭蒙之吝
1147061,九日陪颜使君真卿登水楼
881646,浣溪沙 其十一 绍兴辛未中秋，王景源使君乘流下萧滩，舍舟从陆。芗林老人以长短句赠行
96186,寄曾使君昭
1173258,陪李梓州王阆州苏遂州李果州四使君登惠义寺
606468,寄金华周使君
1176005,饯郢州李使君
972711,呈衡州使君先生二首 其一
1113135,廉州何使君挽诗二首
1004023,买舟至崖祀陆使君
683468,送王使君明辅迁陕西行省君有惠政于吴好谈禅理雅与余合故末章寄意焉
1173273,陪裴使君登岳阳楼
2389,送泉州李使君之任
794120,臣虞杂取米盐琐事，成二十四诗，余读而悲之，勉答其半，韵既不次，语复不伦。亦犹杜陵野老同元使君春陵行，非敢云属和也 其三 膏
569586,屠长卿使君见过弇园与曹子念同登缥缈楼分韵得云楼字 其二
575422,北海宋使君人贺
716488,除夕咏感揽和王使君八首 其七
88699,送陈鲁叟使君赴广西漕
327471,诗送吴丈宾州使君元丰乙未
1147066,乌程李明府水堂同卢使君幼平送奘上人游五台
968949,挽岩云赵使君
1064509,寄黄嗣深使君二首 其二
1042071,答令狐司封使君舟中见寄
544436,送吴文仲使君并怀参知睿父二首 其一
194729,孙使君见招以不苕荤得醉因过南禅老饭小休庵
579361,奉寄黄岩使君邝载道柱史答来教也二首 其二
881576,好事近 其二 用前韵答邓端友使君
697091,午日访吴文仲使君适湖上燕集寄柬二律
373222,送邕州吴使君
606246,送郑别驾督鹾还西粤兼柬薛使君二首 其一
1186179,奉陪使君十四叔晚憩大云门寺
569870,过喻使君邦相郡斋与其尊大夫八十翁四孙及通家余子小饮有述
745716,记爨使君碑十二韵
1228260,怀萨使君二首 其二
1004141,和虞使君赋山茶花二首 其一
1158836,奉寄婺州李使君舍人
212228,贺孙使君·文宿动三吴
557524,闻徐使君留滞汉阳寄赠
67060,花源逢顾何二使君作
990256,送魏使君归宛陵二首 其一
971878,斯远兄入城见使君郎中且谒尚书韩先生提属李丈题诗以赠四首 其四
999749,依韵和酬顺安使君王大观见寄之什
1137947,呈许使君 其二
700733,送徐使君参知山东政事二首
956303,赠临江简寿玉二首简携王仲显使君书来谒并示孔毅甫梦蟾图今庙堂五府皆有题字 其一
14572,薛舍人使君观察韩判官侍御许雨晴到所居既霁先呈即事
697100,送吴文仲使君并怀参知睿父二首
1042097,寄杨子华阁老使君
1114842,道中即事呈岑使君吏部次和德麟韵三首
1147082,同杨使君白蘋洲送陆侍御士佳入朝
1161487,送邵州林使君
207193,次韵清卿用使君鹿鸣韵见贻
1095903,寄三衢使君赵寺丞
682691,怀归呈林锦峰使君
2758,奉和张使君宴加朝散
1002285,王叔武示忠州张使君德远近诗次韵三首 其二
670483,春夜许使君集送江生过谒李伯华太常江善鼓琴因句及之
545279,董使君过访赋赠二首 其二
189957,赠虞道判·使君本往道家山
22500,湖州韩使君置宴
908755,从何使君父子游墨池分韵得名字
663540,九月望日同大阳有台二使君泛湖出郭二首 其一
1127972,挽桃源使君虞公二首
191582,监学同舍饯南康新使君黄雍文分韵
9535,送巴州杨使君
1070873,自然使君连赋竹诗辄复次韵
200852,戏言寄霅溪使君唐司勋
334960,东安许明府同里之亲任满回家求诗为别即席赋此兼简熊使君
1164876,田使君美人舞如莲花北鋋歌
123416,仲显二使君·贺州归去柳州还
118903,篔簹谷·谁言使君贫
1208076,晚经皮使君江居不见，赋简二首 其二
1003519,为沧江虞使君赋客室三首 其二
877074,癸卯上元即席次杨使君韵二首 其二
36576,同薛员外谊久旱感怀寄兼呈上杨使君
1190341,送郢州郎使君
1158744,送裴使君赴荆南充行军司马
19529,送唐州崔使君侍亲赴任
713326,王川南使君紫诠招同李宫詹山公袁通政密山梁太史药亭蓝山人采饮游灵洲予以事不果往诸公分韵及之仍同游韵八首 其一
487838,左蠡雨泊怀彭使君
13836,客有自渠州来说常谏议使君故事怅然成咏
1110603,佳雪应时呈司封使君三首
973629,使君以十月上休日燕通判教授县令录参沅陵贵溪两尉曹蕃亦与焉坐间出示宋莒公草书刘宾客诗图李西台吕东莱朱希真赵忠简诗帖蕃赋诗十二韵以纪其事
877914,答番昜使君胡直院二首 其二
1251798,赠王使君
946871,赠湖州使君李公择
910357,次韵任使君咏梅二首 其二
1180302,归东阳临岐上杜使君七首 其一
184192,黄州呈赵使君
1166825,答开州韦使君寄车前子
1062178,福州程使君止戈堂二首 其二
694604,舟过沧洲李若临使君邀饮南川楼上
899332,送韩使君赴任越州十一韵
551432,仲冬十八日同王玉生陈伯孺幼孺兴公弟送屠田叔使君自芋江登舟至渊关时积雨初收川原竞爽促膝翻书扣舷觅句香绕笔床烟笼茶鼎情景清绝偶忆少陵野航恰受两三人之句因令玉生绘图共拆杜句为韵各赋一体以纪胜游余拈得三字
1192011,题江上柳寄李使君
586051,赏菊和丹山赵使君 其一
866356,寄雪蓬姚使君
189694,赠刘使君景文
910079,送杭州使君苏内相先生某用先生旧诗方丈仙人出渺茫高情犹爱水云乡为韵作古诗十四首 其四
36558,陪卢使君登楼送方巨之还京
488178,春日寄怀陆使君 其四
976571,赠海州使君
1158617,馀干夜宴奉饯前苏州韦使君新除婺州作
1186351,送王使君移镇淮南
30010,暇日有寄姑苏曹使君兼呈张郎中郡中宾僚
226194,寄龙山谭使君
1033594,客自邵武来言王野使君平寇 其二
1596,饯唐州高使君赴任·香萼媚红滋
1027510,次韵李孟达使君与林雪巢子季武诗
990321,遣吏约同官弈棋议事知有苏山之游不果来晚使君载酒见过遂赋此诗
695595,繇茶陵过吉州张使君招饮白鹭书院时三月初十日也就此因闻倭警
1159769,松江送处州奚使君
569099,题凤麓图为姚使君赋
716485,除夕咏感揽和王使君八首 其四
874367,送程伯俞赴海陵苏使君之招
318105,齐天乐·赠陆天涛使君浚江阴城河
1001053,以汤饼招韩伯周王岩起二提举郑深道曾宏甫二使君宏甫有诗次其韵
225143,呈南安孟使君
898534,寄睦州苏七使君
1107788,龙多山次冯使君韵
230380,饯云壑唐使君赴邕州
549739,次汪静峰使君见怀韵
544122,送王使君之滇中六首 其四
1183245,韦使君宅海榴咏
88954,使君次韵再赋·当年双璧甲科郎
768633,夏初临 别高使君子奋
1161491,送饶州张使君
713428,风乾萍果惠州王子千使君席上作二首 其二
1154846,送严使君游山
545763,寄吴文仲使君八首 其一
730274,朝鲜参政海崖使君游历至嘉州过访郡斋情深文明语及三韩国是并中夏大局忧愤形于词色殆豪杰之士也临行书联语见赠并祈一诗乃为长句报之
698783,安南歌四首送沈使君
545053,寿邵使君八秩
1165164,酬宋使君见赠之作
86870,答番昜使君胡直院·久别番君国
940193,谢赵使君
670661,寄怀蒲圻魏使君 其一
1004139,和虞使君春雨
1127977,和虞使君赋山茶花二首
1083935,楼予善使君挽辞 其二
764658,满庭芳 其三 题玉妃献册图，为汝宁金使君夫人生日
858900,招吕望之使君
1208097,秋日集咏奉和潘李二使君浦编修诸公十首 其四
939814,和李使君九日登戏马台
1236788,晚经皮使君江居不见，赋简二首
541605,同李杜二使君望太和山
525599,谏议润夫使君自应城数百里访余武昌适值中秋风雨大作且公私见夺不克夜叙殊负良晤明日送于黄鹤楼匆匆别去意所难尽缀以短诗
263649,汪涵夫使君招同张公选范赤生泛舟秦淮感旧有作
898503,次韵王治臣九日使君席上二章 其二
1179396,酬陆员外歙州许员外郢州二使君
888535,九月二十六日同朝宗泽民游洞宫用刘使君韵二首 其一
179096,祝子正从范使君锻以诗寄之
1162059,陈使君山庄
3882,送裴使君赴荆南充行军司马
12180,送郎使君赴郢州
669180,奉酬王东华使君
11260,听韩使君美人歌
29661,阳亭言事献漳州于使君
1153497,相里使君第七男生日
186469,廉州何使君挽诗
970460,同王秘校和同年五使君韵饯送严文守江阴 其一
1120112,钱使君知原生辰
202261,送杭州使君苏内相先生某用先生旧诗方丈仙人
1033701,诸诗人会于吴门翁际可通判席上高菊涧有诗仆有客星聚吴会诗派落松江之句方子万使君喜之遂足成篇
24209,和韦潘前辈七月十二日夜泊池州城下先寄上李使君
1165007,饯唐州高使君
3477,安宜园林献高使君
1177361,春中途中寄南巴崔使君
541339,初夏郑使君招饮七星岩
670706,送魏朴如孝廉省试时使君上计与偕
954675,游吴门同乐园疥池光亭壁呈使君张都承
1113423,次韵酬新九江使君赵明达二诗仍送自制香饼白鸥波酒
107810,谢康使君见访示诗观奕庆之
1178546,同独孤使君东斋作
1190424,赠别崔司直赴江东兼简常州独孤使君
504657,徐仲仁以使君天上来六诗投赠遂歌山中人次韵答之 其六
96117,寄南安李使君·频宵为月卧风前
89597,挽南雄林使君
23487,送段觉归东阳兼寄窦使君
1180679,寄冯使君
1150273,漳州于使君罢郡如之任漳南去上国二十四州使君无非亲故
1150273,漳州于使君罢郡如之任漳南去上国二十四州使君无非亲故
190126,送吴使君·西南世家无十族
588990,菊月王使君拉饯三塔寺附题 其二
12955,和韦使君秋夜见寄
120659,陪盱眙王使君东游
37582,上冯使君水晶数珠
10791,送辰州郑使君
183665,挽赠太常少卿封川曹使君观
1147255,秋日遥和卢使君游何山寺宿扬上人房论涅槃经义
1153972,和李使君三郎早秋城北亭楼宴崔司士因寄关中弟张评事时遇
532146,秋日宴凤来亭呈同游符陈二使君
1060670,次韵陈使君咏霰雪三首 其二
525813,杂言送延平朱使君十三首 其十三
533618,同陈使君于舜酌肖甫宅
150979,和丁使君惠赠
164054,小诗谢霅川使君幫祠庭薄俸
1043671,寄杭州通判苏子瞻海州使君孙巨源
120491,喜雨·使君手有垂云帚
1187361,同李使君渭游等慈寺
8365,送陵州路使君赴任
904283,题九江徐使君眄柯亭
21355,送饶州张使君
876590,次张使君韵
974422,谢王使君
663541,九月望日同大阳有台二使君泛湖出郭二首 其二
900477,廉州何使君挽诗二首 其一
570647,和张肖甫司马题王阳德使君阳湖别墅十咏 其九 筠阿馆
1155965,岁暮枉衢州张使君书并诗因以长句报之
626685,柬耒阳胡使君 其二
858906,河中使君修撰陆公挽辞三首 其二
1184069,赠金州姚合使君
375415,送宋使君呈光禄
113248,减字木兰花·使君那里
537934,邀李袁二使君小饮
849347,次韵谢王使君见赠二首 其二
1190849,奉和虢州刘给事使君三堂新题二十一咏 稻畦
22720,哭饶州吴谏议使君
983662,入山呈孙使君
1075101,李使君示开化诸诗
864747,呈赵使君时方西遁
671005,为周真阳题芭蕉仕女图戏呈吴明卿使君
36541,奉酬于中丞使君郡斋卧病见示一首
917809,贺王使君
525810,杂言送延平朱使君十三首 其十
1122372,和丁使君八咏楼
147767,访漳州赵用父使君
895477,希道使君见遗古风谨次严韵
18679,赠杨使君
881679,朝中措 王景源使君生日坐上偶作
688600,九日将至衢州寄杨使君
592988,秋晚同陈使君张进士饮喻园五首 其三
683456,待劾未至信笔成二章拨闷并简吴王二使君
1093986,丁使君和昌父诗朱卿亦有句次韵呈之
17702,初到忠州登东楼寄万州杨八使君
525812,杂言送延平朱使君十三首 其十二
1147086,同颜使君清明日游因送萧主簿
37461,秋寄李频使君·务简趣难陪
183584,送郑严州·父老迎使君
226113,次韵张龙使君十绝
1155447,荅杨使君登楼见忆
1222875,寄南剑李士弘使君
620792,陪程使君宿玉泉寺三首 其三
21350,送林使君赴邵州
3981,鄂渚送池州程使君
1141694,蔚讲师见示方使君唱酬诗次韵
1147276,白云歌寄陆中丞使君长源
1180356,上杭州令狐使君
1179178,薛舍人使君观察韩判官侍御许雨晴到所居既霁先呈即事
201431,祖颖漕使希道使君以绝句相酬答聊成二章解嘲
36885,夏日同崔使君论登城楼赋得远山
1154809,龙池寺望月寄韦使君阎别驾
689110,余十年仅一过邑城兹来止宿毛氏武山别业倚县西堞最高处菁葱峭茜竹柏交响早夕登眺娱极视听感使君之风义喜故人之交亲意之所之辄复染翰
955169,谢南剑黄使君赠松纹剑
909796,道中即事呈岑使君吏部次和德麟韵三首 其三
670541,寄题子与使君薜荔园 其一
720433,齐天乐 赠陆天涛使君浚江阴城河
7705,寄岳州贾司马六丈巴州严八使君两阁老五十韵
1112895,某顷蒙信阳使君教以边字韵佳句伏读降叹病倦答谢甚缓复不能奇仰俟斲削
1044838,使还雄州曹使君夜会戏赠三首 其二
533108,陈侍御道襄招朱陈二使君同集
605852,守钱五卿使君二首 其一
1183098,送崔使君赴寿州
1153876,送申屠正字往湖南迎亲兼谒赵和州因呈上侍郎使君并戏简前历阳李明府
1156362,郢州赠别王八使君
1156938,题郡中荔枝诗十八韵兼寄万州杨八使君
544295,卢使君追步隐侯作后八咏诗不佞次题倚和倚槛思民力 其三 芳圃伤啼鸟
337327,挽词·使君投老益精明
1156805,初到忠州登东楼寄万州杨八使君
149490,寄隰州李九使君
8310,送梓州李使君之任
1106896,翟使君挽歌
1153150,酬刘侍郎使君
375879,寄严州陆使君
1154905,送王使君赴太原拜节度副使
990399,喜雪次倅车韵呈使君
176309,送谢刑部使君赴召
167119,送郭君贤使君赴建德任
214258,河中使君修撰陆公挽辞
1141675,陪阮使君游玉几
794123,臣虞杂取米盐琐事，成二十四诗，余读而悲之，勉答其半，韵既不次，语复不伦。亦犹杜陵野老同元使君春陵行，非敢云属和也 其六 药
713116,有约惠州偶以事不即往月夜独坐奉怀王使君子千三首 其三
340634,次韵和南山即事呈使君
1122555,席上口占和使君韵二首
1157106,早饮湖州酒寄崔使君
606049,五日钱使君招同蒋文学署中小酌时方忧旱
1180951,闻前王使君在泽潞居
1166642,送泉州李使君之任
1060669,次韵陈使君咏霰雪三首 其一
714372,送榷关使君
1029203,监学同舍饯南康新使君黄雍文分韵
1161271,送辰州郑使君
1070346,高邮旅泊书怀寄淮东提举蔡成甫观兼呈郑使君弇三首 其三
940230,临江仙 送叠罗菊与赵使君
