692083,为周真阳诣徐使君得报使有感作此赠
1032193,次韵张龙使君十绝 其二
36736,奉送袁高使君诏征赴行在效曹刘体
551330,夏日邀屠田叔使君佘宗汉明府闵寿卿柳陈父王献子钱叔达吴元瀚诸山人颜廷愉都护兴公舍弟避暑平远堂分得一先韵
968969,赞径坂使君柯山仲春讲席之盛
910075,送杭州使君苏内相先生某用先生旧诗方丈仙人出渺茫高情犹爱水云乡为韵作古诗十四首 其八
544437,送吴文仲使君并怀参知睿父二首 其二
595273,真州□□龙江沈少坡二使君
346046,黄州使君朝议惠公挽词
36783,送演上人之抚州觐使君叔
1180666,陪冯使君游六首 其五 钓罾潭
194681,新酒熟奉怀曹使君
231996,秋日自武林病归渔社李使君惠以长篇诵之再四
1176006,饯唐州高使君赴任
1208094,秋日集咏奉和潘李二使君浦编修诸公十首 其一
1150037,阳亭言事献漳州于使君
335635,使还雄州曹使君夜会戏赠
227958,使君·几夜骊珠落蔀家
1195454,晚次宣溪辱韵州张端公使君惠书叙别酬以绝句二章
713126,西湖送春次王紫诠使君韵十首时积雨八旬矣四月朔日积雨偶晴故有此作寄余索和十首 其三
570642,和张肖甫司马题王阳德使君阳湖别墅十咏 其四 红雨蹊
575439,夏日同徐使君方山人避雨朝阳寺，限阳字
37180,寄杜使君
9697,江上代书寄裴使君
247412,使君诗·靡竭匪浚
166111,次开祖使君韵兼呈端叔大夫圣域长老
982989,鲍使君闲居
1190837,奉和虢州刘给事使君三堂新题二十一咏 竹径
614871,寄罗使君
1041829,送信阳舒使君
89082,喜雨二首柬张使君
141263,行近湖州不果入城寄王成之使君
1177359,次梧州却寄永州使君
881680,满江红 奉酬曾端伯使君，兼简赵若虚监郡
1192881,座中走笔送前萧使君
15788,寄卢虔使君
36779,送简栖上人之建州觐使君舅
491677,赋金精山寄赠王使君
877196,送陈鲁叟使君赴广西漕 其一
37641,归东阳临岐上杜使君·方恐狱中桃树出
883144,挽李中甫使君 其五
618299,上饶使君关蓬石永丰使君高贞复邀集观泉亭 其二
618299,上饶使君关蓬石永丰使君高贞复邀集观泉亭 其二
1190841,奉和虢州刘给事使君三堂新题二十一咏 花岛
883590,次韵司封使君和程给事越来溪三章 其三
176681,次秀野使君见寄
369721,次韵钱逊叔谢曾使君送酒
4220,送建州陆使君
537849,寄明卿使君再觐 其二
1112873,次韵王治臣九日使君席上二章
910006,岑使君牧襄阳受代还朝某同赵德麟谢公定潘仲宝皆饯于八叠驿酒中以西王母所谓山川悠远白云自出相期不老尚能复来各人分四字为韵以送之某分得相期不老 其三
496970,饮冯杜二使君
9963,送处州裴使君赴京
713575,送丁使君之官南赣
2762,戏赠邵使君张郎
630046,陈使君招饮粤秀山是日听词人歌陈乔生新制曲有怀乔生
669314,送李使君考绩之京
164028,为建平詹使君赋山泉
22707,送徐使君赴岳州
201365,次韵文老使君宗兄见赠近体佳什两篇仆与公别
714101,初至雁门赠陈祺公使君 其一
366759,寄杨子华阁老使君
220658,绛州园池·绛台使君府
12348,越中送王使君赴江华
14992,送周使君罢渝州归郢州别墅
602954,得王使君裕参书却寄三首 其二
598183,以笔墨秋扇赠郑使君戏成三绝 其三
1034007,陪徐渊子使君登白雪楼约各赋一诗必以宋玉石对莫愁村
794124,臣虞杂取米盐琐事，成二十四诗，余读而悲之，勉答其半，韵既不次，语复不伦。亦犹杜陵野老同元使君春陵行，非敢云属和也 其七 钱
883593,次韵司封使君和程给事
538801,送别吴枢季使君迁府倅一首
713268,乙亥除夕同袁密山史蕉隐蓝公漪集王紫诠使君寓斋次东坡元旦立春韵三首时余以夜禁先归 其一
700724,夜止朝阳寺分韵 赠徐使君，得时字
1147349,奉酬袁使君西楼饯秦山人与昼同赴李侍御招三韵
1096431,题丘使君竹坡
37746,别卢使君归东阳
1056422,将次施州先寄张十九使君三首 其一
57131,赠王使君
9485,褚主簿宅会毕庶子钱员外郎使君
336599,谢曾使君惠丹邱集
998047,寄南康使君仲晦五十二兄
158134,送陇州使君刘仲仪左藏赴治
1156333,送刘五司马赴任硖州兼寄崔使君
544390,午日访吴文仲使君适湖上燕集寄柬二律 其二
195341,蔚讲师儿示方使君唱酬诗次韵
29979,秋日有寄姑苏曹使君
592779,寄淮安陈使君玉叔二首 其二
1180898,和杨使君游赤松山
3887,送李使君贬连州
563078,寿谢使君象三
4101,酬滁州李十六使君见赠
1171674,送崔使君萧山祷雨甘泽遽降
721415,王川南使君紫诠招同李宫詹山公袁通政密山梁太史药亭蓝山人采饮游灵洲予以事不果往诸公分韵及之仍同游韵八首
7502,敬寄族弟唐十八使君
597928,雨中过麻姑山简董使君王司理
597874,九日陪郭使君梅别驾饮少峰池亭使君有诗四首因用其韵各得一字和之 其三
597874,九日陪郭使君梅别驾饮少峰池亭使君有诗四首因用其韵各得一字和之 其三
1147972,饯唐州高使君赴任
261738,解蹀躞·张使君郡斋听吴山人弹琴
591983,同徐子与使君过袁鲁望进士留酌
943541,谢袁起岩使君借贡院居 其四
1161207,戏赠张使君
136153,次韵李孟达使君与林雪巢子季武诗
909798,道中即事呈岑使君吏部次和德麟韵三首 其一
1185587,处州李使君改任遂州因寄赠
683564,饯李惟桢使君迁浙江行省参政领金华诸郡
1002384,和唐使君秬古风二首 其一
222874,七夕前二日与窥堂庄使君江横观水望霓怅然
6908,奉陪韦中丞使君游鹤林寺
1214065,贽见虚谷方使君
1191323,奉使至邢州赠李八使君
327476,送沂州使君纳政荣归
194694,寄曹子方使君
1138857,洛中郑悫三伏之际率宾僚避暑于使君林取大莲叶盛酒以簪刺叶令与柄通屈茎轮囷如象鼻焉传吸之名碧筒杯故坡诗云碧碗犹作象鼻弯白酒时带莲心苦丙寅五月宜兴州赏诚以此为题为赋十一首 其六
30021,送魏校书兼呈曹使君
228186,次徐径坂衡阳使君韵示林敬则
55841,赋得乌衣巷送周使君之金陵
1094777,题丁使君浮香亭尝招饮继有三绝次韵谢之 其一
652384,同张明成司业饮管子安使君舟中申旦而别各赋一诗
833045,减字木兰花 题颜使君牡丹扇
1071472,东安许明府同里之亲任满回家求诗为别即席赋此兼简熊使君
229996,次合州新赵使君阻雨
673799,晚秋东门郭使君楼宴集得月字
1076268,陪李使君登庾楼是日云雾不见淮山二首 其二
541345,同郑使君游七星岩
1180791,贺郑使君
606702,钱使君寄寿老母赋答
207556,使君黄秘书上印有期闻严召已得好语赋诏律送
11594,送抚州周使君
225849,赠海州使君
1147332,奉和陆使君长源夏月游太湖
98942,满江红·寄鄂州朱使君寿昌
377702,寄莘老·十年手把使君麾
1173203,宴忠州使君侄宅
1189076,献高使君大酺作
717123,赠岭西愈宪孙使君
222781,送使君给事常东轩先生
1177155,泉州刺桐花咏兼呈赵使君 其三
98757,口号·使君自是为霖手
616044,滕署喜雨赠张使君
37469,送杜使君朝觐
688594,船发信州新雨江涨还寄曹使君
935630,次韵使君吏部见赠时欲游鹤山以雨止
717331,送李浣庐使君之湖北方伯任 其二
102685,徐元用使君与其子端常邀仆与小儿过同游东山
1137975,昨携拙稿呈康使君郢正以诗促之
333615,同陈使君登香山寺豁亭
620634,刘锐腾招同越使君过集园亭二首 其二
492335,快阁僧房赏瓶中牡丹赋呈王使君
1135047,呈吕使君二首 其二
1036078,定风波 十月九日孟亨之置酒秋香亭，有双拒霜独向君猷而开。坐客喜笑，以为非使君莫可当此花，故作是篇
713115,有约惠州偶以事不即往月夜独坐奉怀王使君子千三首 其二
1151452,清明日登城春望寄大夫使君
237543,和赵景贤使君入昌溪即事
201543,范才元参议求酒於延使君邀予同赋谨次其韵
882947,寄通州徐居厚使君 其一
1120704,李使君挽词三首
1155618,喜裴涛使君携诗见访醉中戏赠
163648,挽顺庆使君宝章李十三丈
233656,代送别赵使君
713318,月夜紫诠使君寓斋同蓝公漪朱甸安吴山带叠韵三首 其一
222779,送使君右司赵是斋
895366,次韵文老使君宗兄见赠近体佳什两篇仆与公别四十馀年一旦邂逅情著于辞 其一
545839,寄陆使君使君旧治河济上同龚观察及余名姓余弗知也
545839,寄陆使君使君旧治河济上同龚观察及余名姓余弗知也
237175,奉谢龙山使君
36960,裴端公使君清席赋得青桂歌送徐长史
538940,移晋臬将发寄别黄使君执甫及诸僚友
147448,使君平寇·闻说贼来日
1114895,次韵任使君咏梅二首
5038,江夏使君叔席上赠史郎中
245369,曹主簿泾自卜寿藏追范石湖韵谨依虚谷使君例
598232,送揭阳郑生兼讯其伯父贡元二首生归德郑使君之子也 其二
714756,赠吴使君 其一
151522,曾谹父使君招客双岩堂
1180402,东阳罹乱后怀王慥使君五首 其四
1161088,和常州崔使君咏后庭梅二首 其二
154722,正月晦日·游骑翩翩从使君
543562,四知篇 其四 温陵苏学使君禹
1211173,题李仲宾使君画潇湘烟雨竹
1071948,信州连使君惠酒戏书二绝谢之 其一
240457,使君生辰·星斗焕灵辉
1216229,题临川曾仲衍手卷时仲衍授永嘉之平阳州同知有旨命赍御酒宣慰本州周宗道佥院贡米入京卷有危太朴参政所书虞学士邵庵送行序并诗三首走亦不揆效颦于左兼简君道使君 其二
1170834,和韦潘前辈七月十二日夜泊池州城下先寄上李使君
968959,寄新衡阳徐使君左司山长
37174,拟齐梁体寄冯使君·大道贵无心
858907,河中使君修撰陆公挽辞三首 其一
1078071,同曹使君登浮金堂
1180687,寄杭州宋使君
140222,己酉乱后寄常州使君侄
858755,次韵质夫兄使君同年
686574,九月望日同大阳有台二使君泛湖出郭二首
36966,饮茶歌诮崔石使君
230267,寄雪蓬姚使君
333819,喜晴寄张使君
36660,夏日奉陪陆使君长源公堂集
670533,酬黄山人郡中见怀之作兼呈魏使君
56834,与沈使君风雨泊河桥夜半使君先发余沿路追寻
56834,与沈使君风雨泊河桥夜半使君先发余沿路追寻
77886,过夷陵适值祈雪与叶使君清饮谈括苍旧游既行
883146,挽李中甫使君 其三
855203,武陵春 其二 正月十四日夜孙使君席上观雪，继而月复明
971879,斯远兄入城见使君郎中且谒尚书韩先生提属李丈题诗以赠四首 其三
36883,奉酬陆使君见过各赋院中一物得江蓠
1093174,和元立使君起字
997538,雨中花/夜行船 送彭文思使君
686081,惠州何使君考绩二首
999930,送陇州使君刘仲仪左藏赴治
1147283,同薛员外谊喜雨诗兼上杨使君
1075850,送冯远猷使君 其一
228155,挽岩云赵使君
186919,送零陵贾使君
880007,和尤伯华广德使君怡亭对雨 其一
1356,戏赠赵使君美人
943937,陈伯固使君祷雨得雪为作
593040,送戴使君还闽
36887,奉同颜使君真卿送李侍御萼赋得荻塘路
1131968,寄龙山谭使君五首
999273,次韵逢使君寺丞见赠
9926,送李使君赴邵州
1244205,送王国琛使君赴福州
697047,送王使君之滇中六首
583770,限韵送姚使君守琼管二首 其一
1108420,送陈使君二首
620791,陪程使君宿玉泉寺三首 其二
575474,送徐使君参知山东政事二首 其二
180551,十三日再赋二首其一以赞使君是日对花赋此韵
1188513,秋日卢郎中使君幼平泛舟联句一首
851897,和子山陪使君游西湖三绝正月晦日 其一
713327,王川南使君紫诠招同李宫詹山公袁通政密山梁太史药亭蓝山人采饮游灵洲予以事不果往诸公分韵及之仍同游韵八首 其二
245374,使君例·一抔早已瞰陬隅
1003712,虞使君示春日喜雨六绝和韵 其二
713131,西湖送春次王紫诠使君韵十首时积雨八旬矣四月朔日积雨偶晴故有此作寄余索和十首 其八
713001,韶石歌韶州陈使君席上赋
239170,送张忠州使君八兄
37643,归东阳临岐上杜使君·舍鲁依刘一片云
1147328,奉同颜使君真卿送李侍御萼赋得荻塘路
1158543,送建州陆使君
1188058,代罗敷诮使君
545764,寄吴文仲使君八首 其二
1108403,癸卯上元即席次杨使君韵二首
721667,赠吴使君
532437,送笔峰王使君之官
556744,湖上送徐子与使君
962401,次合州新赵使君阻雨
1178143,春日同韦郎中使君送邹儒立少府扶侍赴云阳
336003,使君生日·控鲤云烟外
1060734,次陈使君韵三首 其一
112045,西湖·使君修禊与民游
716455,复上韶阳述怀呈使君 其四
1161602,和崔使君临发不得观积雪
598171,戴使君自广州归壶山取道见访因作此赠之四首 其三
238437,桂花上侯使君
389633,送兴化赵使君奏绩神都
340669,次陈使君韵
880789,和建小学韵呈赵求仁使君 其二
694958,寄夔州郭使君
1186806,题王使君片石
230409,呈姚雪蓬使君
1174027,戏赠赵使君美人
883117,送台州沈虞卿使君入朝 其二
866314,寄雪蓬姚使君
918741,己酉乱后寄常州使君侄四首 其二
1041546,答金陵使君答王待制见寄杂言
538574,待劾未至信笔成二章拨闷并简吴王二使君 其一
1147337,奉和颜使君真卿修韵海毕会诸文士东堂重校
713538,偶从风洞眺望始安山水赋呈秦使君
1056423,将次施州先寄张十九使君三首 其二
713270,乙亥除夕同袁密山史蕉隐蓝公漪集王紫诠使君寓斋次东坡元旦立春韵三首时余以夜禁先归 其三
36627,奉酬李员外使君嘉佑苏台屏营居春首有怀
1168068,江夏使君叔席上赠史郎中
1141454,送双溪汪和仲往象山见周使君兄弟
1122548,又陪陈使君游东禅寺
721498,风乾萍果惠州王子千使君席上作二首
488603,陪蔡使君游何氏园亭同方许二生作
960541,浣溪沙 其一 呈潮阳使君宋台簿敦书
692070,许使君见过林亭
515903,怀母歌送祁使君忧制东还
1147355,杼山上峰和颜使君真卿袁侍御五韵赋得印字仍期明日登开元寺楼之会
1186350,送王使君赴太原行营
237863,西湖见寄·使君重凿西湖罢
212230,贺刘使君·于门为国产英贤
1127968,寿李悦斋五首和送三荣使君韵
1041833,同年陈君制策高第改佐著作东还馀杭作五言送行兼寄彦猷阁老使君二兄
10866,奉寄辰州房使君郎中
1173200,宴王使君宅题二首 其一
717104,端州逢某使君赋赠
713788,雷阳郡斋醉中走笔呈吴使君
880044,送邵监酒兼柬仪真赵法曹呈潘使君二首 其二
201012,和张公达暮春寄宋使君
682891,资阳潭石矶特奇怪艮斋赵使君招宴即席二首
22506,陪江州李使君重阳宴百花亭
1114223,题尤使君郡圃十二诗 参云亭
36810,岘山送崔子向之宣州谒裴使君
1194137,和常州崔使君咏后庭梅二首
4037,奉陪使君西庭送淮西魏判官
478475,安南歌四首送沈使君 其一
883678,佳雪应时呈司封使君三首 其三
468172,冬至酬刘使君
15857,赠竟陵卢使君虔别
18626,早饮湖州酒寄崔使君
224176,同王秘校和同年五使君韶饯送严文守江阴
575458,和徐使君秋日建昌闻警，得“戎”字
883592,次韵司封使君和程给事越来溪三章 其一
881673,清平乐 其五 答赵彦正使君
934840,赠林使君二首 其一
721344,佟声远招同王紫诠使君樊昆来翰检赵秋谷宫赞梁药亭吉士胡□□雅集粟园看新梅分赋二首 五律得八庚
787299,单使君说巴力风土
990154,次韵隆庆杨使君送别之章 其一
1147413,陪颜使君饯宣谕萧常侍
905718,题尤使君郡圃十二诗 其四 匿峰亭
713167,三水别立安后同王使君入羚羊峡四首 其三
1076497,李使君挽词三首 其二
88533,送项使君季约·但见两眉颦
722313,别胡使君
37342,寄冯使君·山风与霜气
1147115,奉和陆中丞使君长源寒食日作
905108,归自南康寄怀朱使君
1104815,次韵谢王使君见赠二首
1249552,为潘仲晕题定使君所赠马郎中画鹤
686089,常德张使君祈晴有应为赋二首
1141494,雪窦飞雪亭和孙使君
12163,龙池寺望月寄韦使君阎别驾
1033643,送包使君入朝除左曹郎二首 其一
485088,送李使君镇海昌（州有双庙）
109002,次韵李使君追悼雪巢先生
1075224,徐使君送冰
866271,呈姚雪蓬使君
798115,怨朱弦  寄淄川毕载积使君
949935,临江仙 其二 送光州曾使君
1190833,奉和虢州刘给事使君三堂新题二十一咏 月台
606556,送石使君之泸州二首 其二
1137290,六么令 云舍赵使君同赋
1178494,唐城馆中早发寄杨使君
147245,寄抚州楼使君
1179337,送邓州潘使君赴任
659384,送嘉兴周使君
794122,臣虞杂取米盐琐事，成二十四诗，余读而悲之，勉答其半，韵既不次，语复不伦。亦犹杜陵野老同元使君春陵行，非敢云属和也 其五 泉
550487,饮黄白仲娑罗馆兼柬屠纬真使君
994873,贺刘使君
935623,次韵宇文使君山行
685954,忆罗浮兼寄何使君二首
975809,陈撄宁既刊周左司太仓稊米集于阜阳赵使君复刊撄宁诗于荆门诗家皆美其师徒传授之懿余亦次韵美之
229986,寿外舅富顺赵使君
1180401,东阳罹乱后怀王慥使君五首 其三
1130659,奉酬泉使君寄荔枝子鱼
943942,使君有诗复次韵
561021,龙泽驿逢钱使君
1127973,挽前眉州使君廖子长二首
659258,送刘使君之任柳州
1076040,寄幼安使君
6444,陪使君早春东郊游眺
978446,代送别赵使君
1080270,寄京口使君
1121744,赠临江简寿玉二首简携王仲显使君书来谒并示孔毅甫梦蟾图今庙堂五府皆有题字
699023,赠史使君
18265,重寄荔枝与杨使君时闻杨使君欲种植故有落句之戏
18265,重寄荔枝与杨使君时闻杨使君欲种植故有落句之戏
491073,秋日与蒋使君同游黄公涧
1147340,奉送袁高使君诏徵赴行在效曹刘体
1155330,和万州杨使君四绝句 竞渡
922123,二月十九日，携白酒、鲈鱼过詹使君，食槐叶冷淘
16203,寄和州刘使君
713271,徐星汉燕尔未几即有惠州之行戏次王使君三十韵赠之以速其归
605853,守钱五卿使君二首 其二
119576,陈伯固使君祷雨得雪为作
1110276,挽李中甫使君
597769,东乡逢抚州陈使君以诗见别次韵奉答
716252,喜某使君枉驾
1147240,冬日遥和卢使君幼平綦毋居士游法华寺高顶临湖亭
8471,宴忠州使君侄宅
606877,寄怀沈使君二首 其一
1071553,熊使君垂和漫兴诗次答四首 其三
107009,汉臣明府与公度使君话吾州山水之胜有诗次韵
1099928,戊辰谒伯祖惠阳使君坟三绝 其二
747697,除夕前一日醉起呈江使君时使君以岁晏享士虚其左西向以荐中丞之灵既毕奠使君揖余就宾位曰君先兄故人状相若齿相埒也见君如见吾先兄矣余之识中丞以陈池州池州之死久而未明而其弟毕凡千里来寻兄骨又久而未至俛仰悲怀轰饮极醉不觉失声哭率成二首呈使君兼留迟毕凡 其二
747697,除夕前一日醉起呈江使君时使君以岁晏享士虚其左西向以荐中丞之灵既毕奠使君揖余就宾位曰君先兄故人状相若齿相埒也见君如见吾先兄矣余之识中丞以陈池州池州之死久而未明而其弟毕凡千里来寻兄骨又久而未至俛仰悲怀轰饮极醉不觉失声哭率成二首呈使君兼留迟毕凡 其二
747697,除夕前一日醉起呈江使君时使君以岁晏享士虚其左西向以荐中丞之灵既毕奠使君揖余就宾位曰君先兄故人状相若齿相埒也见君如见吾先兄矣余之识中丞以陈池州池州之死久而未明而其弟毕凡千里来寻兄骨又久而未至俛仰悲怀轰饮极醉不觉失声哭率成二首呈使君兼留迟毕凡 其二
747697,除夕前一日醉起呈江使君时使君以岁晏享士虚其左西向以荐中丞之灵既毕奠使君揖余就宾位曰君先兄故人状相若齿相埒也见君如见吾先兄矣余之识中丞以陈池州池州之死久而未明而其弟毕凡千里来寻兄骨又久而未至俛仰悲怀轰饮极醉不觉失声哭率成二首呈使君兼留迟毕凡 其二
900476,廉州何使君挽诗二首 其二
36895,夏日登观农楼和崔使君
1035760,上左冯陈使君
3880,朱放自杭州与故里相使君立碑回因以奉简吏部杨侍郎制文
475842,上清祝圣逢孙默斋使君感赠因期同陈午江枉顾山中
37288,寄宋使君
25791,送崔使君萧山祷雨甘泽遽降
695688,寄淮安陈使君玉叔二首
200407,昨携拙稿呈康使君郢正以诗促之
212517,和使君劭农之什
1004053,别冯伯昭新班归三荣末句乞呈似使君王万里年兄
1180350,上冯使君水晶数珠
713332,王川南使君紫诠招同李宫詹山公袁通政密山梁太史药亭蓝山人采饮游灵洲予以事不果往诸公分韵及之仍同游韵八首 其七
237600,使君德开·人人属目快星凰
1147077,冬至日陪裴端公使君清水堂集
1023668,和致轩赵使君午日读骚
544297,卢使君追步隐侯作后八咏诗不佞次题倚和倚槛思民力 其五 署府闻秋笛
561123,彬江罗使君宴别
88430,寄章贡姚使君
907633,奉简潘师原澄江使君
544564,龚使君合祀供奉拾遗于任城纪事三十韵
488143,送陆使君入觐
670520,与魏使君宿龙洞山寺同赋 其四
1071551,熊使君垂和漫兴诗次答四首 其一
18830,宿窦使君庄水亭
713344,佟声远招同王紫诠使君樊昆来翰检赵秋谷宫赞梁药亭吉士胡□□雅集粟园看新梅分赋二首 其二 七律得九佳
1002330,送张忠州使君八兄二首 其二
6900,相里使君第七男生日
671007,为周真阳诣徐使君得报使有感作此赠 其二
1060722,次韵和南山即事呈使君
376160,寄徽州谢使君密斋
227961,使君·闻说天台太守家
6873,伤歙州陈二使君
2393,婺州留别邓使君
1108454,答番昜使君胡直院二首
738270,寄黄州许使君
1108492,武冈叶使君寄诗次韵二首
16204,赠商州王使君
11114,留别道州李使君圻
227876,粹老使君前被召约往它山谒善政侯祠既不果以
630061,席上赠陈使君
13830,彭州萧使君出妓夜宴见送
11608,送郎士元使君赴郢州
544566,寄景陵徐使君三十韵
643434,喜何使君至雨中有作 其二
1071421,河中使君莫少卿挽诗二首 其一
105791,呈孟君复能静使君
27459,寄岳阳严使君
545770,寄吴文仲使君八首 其八
692062,得徐使君所贻王敬美见赠答寄
32337,题安定张使君
340424,赠静斋赵使君淮
1045100,古风一篇赠梅使君
949316,池阳春日迓新使君
163555,和虞使君赋山茶花
601681,府门驿逢浦亭何使君招游白石洞天因讯黄曙苍年丈
713427,风乾萍果惠州王子千使君席上作二首 其一
1160526,题越王楼寄献中丞使君
592990,秋晚同陈使君张进士饮喻园五首 其五
86858,答惠州曾使君韵·潇洒使君风度峻
86858,答惠州曾使君韵·潇洒使君风度峻
943420,赵使君淮春楼落成二首 其一
267824,减字木兰花·题颜使君牡丹扇
504653,徐仲仁以使君天上来六诗投赠遂歌山中人次韵答之 其二
722157,送李浣庐使君之湖北方伯任
895408,范才元参议求酒于延平使君邀予同赋谨次其韵
713124,西湖送春次王紫诠使君韵十首时积雨八旬矣四月朔日积雨偶晴故有此作寄余索和十首 其一
597837,次韵酬郑使君兼以奉招二首 其二
1173011,奉简高三十五使君
335153,次律兄饷鱼鱼不至而诗至颇类南海使君送酒辄成三绝一笑而已赐茗少分以报厚意
1118877,十三日再赋二首其一以赞使君是日对花赋此韵诗笔落纵横而郡中修水战之具方大阅于燕公楼下也其一自叙所感忆年十五在杭州始识此花皆三丈高木尝赋诗焉
713746,采药西宁承张大令使君命其侄孙豫表陪探燕子岩大峒龙井诸胜
149928,书事酬新兴元使君邵大兄邵与圆机有旧因以奉
307763,华亭孙丞迎侍道州使君
598837,寄夔州郭使君 其一
671035,重别魏使君 其一
169382,上赵使君·老气峥嵘盖九州
245371,使君例·醉吟且傍钓砚揪
1102561,遣兴十首呈孟兵部使君 其十
388480,新安汪惟一徐使君子与门人也以尝侍李于鳞先生刻其白雪楼集赋二章赠之
1003601,和虞使君撷素馨花遗张立蒸沉香四绝句 其三
904183,次韵张匡山使君郡斋对雨效韦苏州体
597669,别孙使君教授临江
691996,寄题子与使君薜荔园
973291,寄南安李使君三章 其一
1172601,李司马桥了承高使君自成都回
947721,水调歌头 其一 次永康白使君韵
716454,复上韶阳述怀呈使君 其三
1228254,用志能台郎韵寄萨使君今为江南诸道御史台令史
1163499,寄澧阳吴使君
1190365,寄徐州郑使君
1003742,久旱祷雨罗仙有应使君再赋索和
910661,绮阁吟嘉州李使君命官妓段倩乞诗席上为赋
721408,西湖送春次王紫诠使君韵十首时积雨八旬矣四月朔日积雨偶晴故有此作寄余索和十首
1147343,奉陪陆使君长源裴端公枢春游东西武丘寺
1178359,赠苏州韦郎中使君
544429,送柳使君之南雄
388232,泰安戏呈徐张二使君索会
4667,卢明府九日岘山宴袁使君张郎中崔员外
1133222,润州许使君寄饷新酿以流金笺为贽且供诗藁
228247,和徐径坂衡阳使君韵题渔庄烟雨
503606,拟唐张文昌送汀州元使君
369745,次抚州高使君韵
1180778,避地毗陵寒月上孙徽使君兼寄东阳王使君三首 其三
1180778,避地毗陵寒月上孙徽使君兼寄东阳王使君三首 其三
544097,越岭瞻乔卷为易使君仲子题
1071775,上泰州使君陈瑩中
6887,答泉州薛播使君重阳日赠酒
606878,寄怀沈使君二首 其二
36573,奉酬颜使君真卿王员外圆宿寺兼送员外使回
714759,赠吴使君 其四
960520,临江仙 其二 呈湘川使君丁郎中仲京
