1174337,池州李使君没后十一日处州新命始到后见归妓感而成诗
544389,午日访吴文仲使君适湖上燕集寄柬二律 其一
237537,和赵使君喜雨
326009,次韵司封使君和练推官再咏山茶
855134,累蒙周开祖使君贬示佳章才拙思荒愧不能报谨勉次韵一萹少叙敬避老匠之意
557208,寄赠姜使君二首 其一
375845,寄宣城使君陈中书兼简谢别驾林叔恭
1142367,高贤孺厚斋使君之令子自番来霅访明亲旧此意甚古岁辛亥余识厚斋金陵通守之舍堂陪朔斋刘公饮海棠花下俯仰四十五年追念悽然
1173832,春日戏题恼郝使君兄
25814,留别马使君
1188384,长安客舍叙邵陵旧宴寄永州萧使君五首 其二
597330,怀归呈林锦峰使君 其一
37744,上卢使君·一别旌旗已一年
189068,减字木兰花·使君情素
768265,南乡子 题周栎园使君读画楼册子
1002286,王叔武示忠州张使君德远近诗次韵三首 其一
167251,送王仙麓使君赴道州暂归三山
1098961,食圆用建昌使君叔父韵
670516,除夕魏使君携长君及黄山人见过同赋
910082,送杭州使君苏内相先生某用先生旧诗方丈仙人出渺茫高情犹爱水云乡为韵作古诗十四首 其一
880006,和尤伯华广德使君怡亭对雨 其二
597277,夏日苦热和林梅墩使君纳凉涌月亭 其二
1178509,陪独孤使君同与萧员外證登万山亭
709164,陪陶使君暨诸公游海幢寺拟呈空和尚
1166112,和杜使君九华楼见寄
545631,三楚卢使君过访时以考绩抵武林
879227,满江红 其二十五 次韵徐使君癸亥灯夕
586052,赏菊和丹山赵使君 其二
205095,寄四明使君沈祠部
1033871,蕲州厉使君七夕祈雨
703384,送屠懿颂使君归毗陵取道入都
1190383,赠郓州马使君
1190873,晚次宣溪辱韵州张端公使君惠书叙别酬以绝句二章 其二
9116,奉陪使君十四叔晚憩大云门寺
213520,高使君祠·一瞑移藩日
36413,别卢使君归故栅村
233339,临江仙·送光州曾使君
939705,上赵使君
1028585,送使君给事常东轩先生
607459,钱使君虚白室二首 其二
1032195,次韵张龙使君十绝 其一
670548,魏使君以太公登太山
1147259,九日和于使君思上京亲故
1037120,奉呈彦昭使君陪壮观之赏
24558,贺邓璠使君正拜袁州
37715,上卢使君·一领彤弓下赤墀
877538,挽南雄林使君
832607,木兰花慢 陈伯平使君饮席话旧
1213182,王仲通宰公自东吴别去十载甲寅秋会于鄂渚乃知尚在七品常调中使人有郁郁遗才之叹谈论平生相对如梦历数海内诸友离合升沉之状悲欢良久有不能自已者既而仲通有欲为道隐求奉一祠之语诘难未能服俄为借骑下淮复归行馆翌日缀诗二章奉呈兼简钦甫佥司士元使君君平察推 其二
96115,寄南安李使君·臼捣纷纷何所如
1174478,早春寄岳州李使君李善棋爱酒情地闲雅
1141689,韩君美经历赋孟夏木长五诗示仆因写鄙怀通呈阮使君
1247344,甲寅仲冬予摄官星渚本邑判簿李公以催租入山忽游武夷予命小舟追之不及是夕宿常庵溪风山月一时清兴王事靡盬明日即附舟逆流而上因忆曩时与石堂卢使君同游放怀山水一觞一咏其乐不可复也援笔书怀遂成唐律二首 其二
570646,和张肖甫司马题王阳德使君阳湖别墅十咏 其八 超然台
677634,中秋夜邬使君邀登广视堂后山玩月同舒少参管都阃
1127870,和唐使君秬古风二首
15541,和李使君三郎早秋城北亭宴崔司士因寄关中张评事
37640,归东阳临岐上杜使君·忧民心切出冲炎
1187482,书情寄上苏州韦使君兼呈吴县李明府
237595,谢涪陵刘君举使君见委北岩常长诗
1162143,偶题寄独孤使君
859003,送真州吴处厚使君
187765,口占谢陈使君
562991,题平湖弄珠楼呈萧象林使君二首 其二
219184,韵谢之·丹阳贤使君
1147351,奉酬袁使君高春游鹡鸰峰兰若见怀
163650,挽廖山父·忘年幸接使君游
593073,寄赵使君修甫
16228,寄虔州韩使君
545766,寄吴文仲使君八首 其四
1185455,寄岳阳严使君
716487,除夕咏感揽和王使君八首 其六
710734,送兴化赵使君奏绩神都
1208553,书湘阴谢使君厅壁
598073,顷岁卜居郡南至是始辞郭使君还山怅然有作
1196029,陶使君挽歌二首 其一
569215,送李使君旬宣金华部分赋得东海
1147446,酬邢端公济春日苏台有呈袁州李使君兼书并寄辛阳王三侍御
855096,孙使君见招以不茹荤得醉因过南禅老饭小休庵中作此诗寄之
1007926,曾谹父使君招客双岩堂
18654,欲到东洛得杨使君书因以此报
198795,送章婺州·方拥使君节
388204,答王新甫·使君殊好在
174288,早春即事·使君千骑出重城
494704,寄惠州太守史使君
216322,送潮州吕使君
993801,张使君以画屏求题
108936,题武夷·乘兴来寻杜使君
525805,杂言送延平朱使君十三首 其五
712316,送王紫诠使君观察川南兼以为寿
557140,寄陈使君
488207,袁使君平寇歌 其五
670951,许使君见过林亭 其一
1164787,陪使君早春西亭送王赞府赴选
57202,题竹留别张使君
42209,已亥杂诗·使君谈艺笔通神
533943,九日陈使君德基招同李季常饮吕氏园亭得华字
194699,陪曹使君饮郭别乘舍夜归奉寄
195276,秦题孙使君池馆
801206,白云寺阁次壁间张使君韵
858821,别葛使君
670916,汝宁徐使君 其四
1165951,观宋州于使君家乐琵琶
13825,酬彭州萧使君秋中言怀
1152196,闻韦驸马使君迁拜台州
484725,□顾使君东亭隔帘观竹下舞妓
713283,上元后二夕长寿精舍雅集同王惠州陈韶州两使君梁药亭廖南炜屈翁山王础尘沈上钱方葆宇陈生洲黄葵村分得来字二首 其二
1156941,赠江州李十使君员外十二韵
1158596,朱放自杭州与故里相使君立碑回因以奉简吏部杨侍郎制文
215409,送周仲章使君
866283,饯云壑唐使君赴邕州
64166,邯郸行随张使君肖甫出猎
670652,吴使君自邵武之高州 其二
123016,与吴兴薛士隆使君游弁山石林先生故居
1147178,送简栖上人之建州觐使君舅
155829,挽施州使君钟公
1180486,怀薛尚书兼呈东阳王使君
1138853,洛中郑悫三伏之际率宾僚避暑于使君林取大莲叶盛酒以簪刺叶令与柄通屈茎轮囷如象鼻焉传吸之名碧筒杯故坡诗云碧碗犹作象鼻弯白酒时带莲心苦丙寅五月宜兴州赏诚以此为题为赋十一首 其十
597250,永丰道中次雨泉使君韵
946762,过平望驿有怀湖州李使君二首 其二
541688,送秦二使君之蜀
990183,使君黄秘书上印有期闻严召已得好语赋唐律送之
714103,陪陈使君游雁门山水 其一
990265,朔日迎客之章诸贤多有和者使君再赋仍次韵以谢
877496,挽建昌詹使君二首 其一
947726,水调歌头 其二 奉陪永康白使君游青城再次韵
1195004,陪冯使君游六首 登干霄亭
1180809,上冯使君五首 其三
6359,陪使君早春西亭送王赞府赴选
944144,谢袁起岩使君借贡院居 其一
1036782,次韵同年杨使君回自毗陵同泛石湖舟中见赠 其二
36755,奉酬袁使君西楼饯秦山人与昼同赴李侍御招三韵
184518,送朱仲微使君赴阙
695080,九日陪郭使君梅别驾饮少峰池亭使君有诗四首因用其韵各得一字和之
695080,九日陪郭使君梅别驾饮少峰池亭使君有诗四首因用其韵各得一字和之
1179463,别卢使君归故栅村
206061,奉简潘师原澄江使君
1092543,贺王使君 其三
569585,屠长卿使君见过弇园与曹子念同登缥缈楼分韵得云楼字 其一
816310,臣虞杂取米盐琐事，成二十四诗，余读而悲之，勉答其半，韵既不次，语复不伦。亦犹杜陵野老同元使君春陵行，非敢云属和也 薪
721515,题忆雪楼江山无尽图送紫诠王使君之官川南次留别原韵
1180308,归东阳临岐上杜使君七首 其七
58371,经石堂追怀卢使君
1132461,顺安辞呈赵使君二首 其二
1126378,邵武赵使君挽章二首
551382,送屠使君至芋江是夕留饮驿亭以梨园佐觞使君首倡依韵奉荅
551382,送屠使君至芋江是夕留饮驿亭以梨园佐觞使君首倡依韵奉荅
1136073,初二日许公度使君来自西坑贼寨见访
670947,酬许使君读鄙诗见赠 其一
1192362,赠漳州崔使君乡饮翻韵诗
30752,次梧州却寄永州使君
1138854,洛中郑悫三伏之际率宾僚避暑于使君林取大莲叶盛酒以簪刺叶令与柄通屈茎轮囷如象鼻焉传吸之名碧筒杯故坡诗云碧碗犹作象鼻弯白酒时带莲心苦丙寅五月宜兴州赏诚以此为题为赋十一首 其九
1119383,赵使君淮春楼落成二首
27472,九日卫使君筵上作
543658,布帆行寄徐使君
1061707,挽秘阁校理知湖州余使君二首 其一
544926,敬美使君再起督闽中学闻将于岁杪暂出寄讯
713125,西湖送春次王紫诠使君韵十首时积雨八旬矣四月朔日积雨偶晴故有此作寄余索和十首 其二
1180062,送溪州使君
870478,龙多山次冯使君韵 其一
19290,寄明州于驸马使君三绝句
1151954,和使君五郎西楼望远思归
693829,夏日苦热和林梅墩使君纳凉涌月亭
37671,东阳罹乱后怀王慥使君·为郡无如王使君
37671,东阳罹乱后怀王慥使君·为郡无如王使君
597966,东归夜宿新阳留别赵使君良弼时良弼起自服舍送予至此
364624,寄刁景纯·使君归老意逍遥
670114,送永宁许使君 其二
703274,送管钟石使君荣赴崇安时值览揆
12169,送严使君游山
583771,限韵送姚使君守琼管二首 其二
1091513,陈使君生日二首 其一
944142,谢袁起岩使君借贡院居 其三
870224,登平陆北山回瞰陜城奉寄李八丈学士使君二十二韵
37216,上卢使君
1180883,拟齐梁体寄冯使君三首 其二
997534,采桑子 其二 送彭道微使君移知永康军
112638,过城南梅庵追忆湖守使君叔晦
35088,池州陈使君见示游齐山诗因寄
12837,送元使君自楚移越
1192486,酬文使君
1075312,徐使君新作采菊亭
36653,奉和陆使君长源夏月游太湖
598181,以笔墨秋扇赠郑使君戏成三绝 其一
1158761,寄万州崔使君
561253,送罗南康使君
25794,哭郴州王使君
1188022,早发灵芝望九华寄杜员外使君
538313,赠按察张使君铎
516030,过洞庭湖得风寄李使君
1156329,送王卿使君赴任苏州因思花迎新使感旧游寄题郡中木兰西院一别
683522,送助甫使君赴河西
536725,古意慰子与使君
593039,戴使君邀集镇海楼
1162429,和常秀才寄简归州郑使君借猿
938580,过秦楼 寿建安使君谢右司
879895,挽京口使君丰郎中十首 其七
849934,挽赠太常少卿封川曹使君觐
569470,送故人汪禹乂之子尧卿谒宁国尹使君
830717,送南康王使君解官归里
967609,奉和郭使君游光福寺云閒阁二十韵
504655,徐仲仁以使君天上来六诗投赠遂歌山中人次韵答之 其四
815461,除夕前一日醉起呈江使君时使君以岁晏享士虚其左西向以荐中丞之灵既毕奠使君揖余就宾位曰君先兄故人状相若齿相埒也见君如见吾先兄矣余之识中丞以陈池州池州之死久而未明而其弟毕凡千里来寻兄骨又久而未至俛仰悲怀轰饮极醉不觉失声哭率成二首呈使君兼留迟毕凡
815461,除夕前一日醉起呈江使君时使君以岁晏享士虚其左西向以荐中丞之灵既毕奠使君揖余就宾位曰君先兄故人状相若齿相埒也见君如见吾先兄矣余之识中丞以陈池州池州之死久而未明而其弟毕凡千里来寻兄骨又久而未至俛仰悲怀轰饮极醉不觉失声哭率成二首呈使君兼留迟毕凡
815461,除夕前一日醉起呈江使君时使君以岁晏享士虚其左西向以荐中丞之灵既毕奠使君揖余就宾位曰君先兄故人状相若齿相埒也见君如见吾先兄矣余之识中丞以陈池州池州之死久而未明而其弟毕凡千里来寻兄骨又久而未至俛仰悲怀轰饮极醉不觉失声哭率成二首呈使君兼留迟毕凡
815461,除夕前一日醉起呈江使君时使君以岁晏享士虚其左西向以荐中丞之灵既毕奠使君揖余就宾位曰君先兄故人状相若齿相埒也见君如见吾先兄矣余之识中丞以陈池州池州之死久而未明而其弟毕凡千里来寻兄骨又久而未至俛仰悲怀轰饮极醉不觉失声哭率成二首呈使君兼留迟毕凡
1136178,松江使君张周卿致泖口蟹四十辈
1127850,送张忠州使君八兄二首
691994,与魏使君宿龙洞山寺同赋
200908,戏辄书二绝·使君终日倚朱栏
1102558,遣兴十首呈孟兵部使君 其七
36625,春日和卢使君幼平开元寺听妙奘上人讲
680112,上彭使君
716457,复上韶阳述怀呈使君 其六
377761,观宗室赵明发使君所画访戴图并二小诗因次其韵
156029,次韵逢使君寺丞见赠
589010,赠别屏南杨使君归隐 其一
946862,湖州李使君闻予游庐山寄书云为我一谢清绝
1133206,送郭君贤使君赴建德任 其二
952365,饯使君
337478,送乔郢州·使君双旆拥朱轓
617995,三城春旱南海蒋畹仙使君步祷甘雨喜赋
1028729,以莲心茶送巩使君小诗将之 其二
386127,送吉州阎使君入道·庐陵太守近隳官
11234,将至道州寄李使君
1027096,永嘉试院谢曾使君送酒 其一
375929,送叶桐轩赴永嘉上幕兼简刘使君
935161,予出蜀日尝遣僧则华乞签于射洪陆使君祠使君以老杜诗为签予得遣兴诗五首中第二首其言教戒甚至退休暇日因用韵赋五首 其四
935161,予出蜀日尝遣僧则华乞签于射洪陆使君祠使君以老杜诗为签予得遣兴诗五首中第二首其言教戒甚至退休暇日因用韵赋五首 其四
883641,次韵司封使君立春纪事
326041,次韵司封使君和推官早梅山茶
699078,渊关再别屠使君次来韵
544123,送王使君之滇中六首 其五
1141313,灼艾戏呈阮使君
10755,送吉州阎使君入道
1147344,奉陪郑使君谔游太湖至洞庭山登上真观却望湖水
37512,酬杜使君见寄
716483,除夕咏感揽和王使君八首 其二
190948,绮阁吟嘉州李使君命官妓段倩乞诗席上为赋
1003891,挽桃源使君虞公二首 其二
1180794,送杜使君朝觐
18263,题郡中荔枝诗十八韵兼寄万州杨八使君
598172,戴使君自广州归壶山取道见访因作此赠之四首 其四
1138862,洛中郑悫三伏之际率宾僚避暑于使君林取大莲叶盛酒以簪刺叶令与柄通屈茎轮囷如象鼻焉传吸之名碧筒杯故坡诗云碧碗犹作象鼻弯白酒时带莲心苦丙寅五月宜兴州赏诚以此为题为赋十一首 其一
1037049,诗送吴丈宾州使君元丰乙未长沙掾舍真禧道馆书
36668,奉同颜使君真卿开元寺经藏院会观树文殊碑
670911,得徐使君所贻王敬美见赠答寄 其三
1173517,送梓州李使君之任
100278,遗直坊·使君不浪出
136114,永嘉试院谢曾使君送酒
597873,九日陪郭使君梅别驾饮少峰池亭使君有诗四首因用其韵各得一字和之 其二
597873,九日陪郭使君梅别驾饮少峰池亭使君有诗四首因用其韵各得一字和之 其二
78805,赠林使君
179658,和王使君惠诗酒韵
190303,次韵任使君咏梅
488179,春日寄怀陆使君 其五
794127,臣虞杂取米盐琐事，成二十四诗，余读而悲之，勉答其半，韵既不次，语复不伦。亦犹杜陵野老同元使君春陵行，非敢云属和也 其十 菜
935165,予出蜀日尝遣僧则华乞签于射洪陆使君祠使君以老杜诗为签予得遣兴诗五首中第二首其言教戒甚至退休暇日因用韵赋五首 其二
935165,予出蜀日尝遣僧则华乞签于射洪陆使君祠使君以老杜诗为签予得遣兴诗五首中第二首其言教戒甚至退休暇日因用韵赋五首 其二
1134841,次韵汪以南教授美康使君新政因及贱迹四首 其三
18454,岁暮枉衢州张使君书并诗因以长句报之
1173668,同元使君舂陵行
984277,谢毗陵使君惠画
592881,陈使君敬甫张进士于皋过斋中对菊
1141597,朱使君家诸郎将别十一韵
1028934,和使君巩大监秋阅
178458,使君沈虞卿宗丞命赋郡圃罗汉树其树叶如杨梅
946643,钱使君知原生辰 其一
349432,依韵·使君年老强搜奇
375640,雪中访别魏使君
692084,早春寄吴使君
1134840,次韵汪以南教授美康使君新政因及贱迹四首 其四
382077,和郭使君韵
151874,送可伦赴广南转运凌使君见招
525806,杂言送延平朱使君十三首 其六
1176722,夜到泗州酬崔使君
1195007,别卢使君归东阳二首
910632,送吴使君
370591,题丁使君浮香亭尝招饮继有三绝次韵谢之
918455,重阳赵使君惠酒
747696,除夕前一日醉起呈江使君时使君以岁晏享士虚其左西向以荐中丞之灵既毕奠使君揖余就宾位曰君先兄故人状相若齿相埒也见君如见吾先兄矣余之识中丞以陈池州池州之死久而未明而其弟毕凡千里来寻兄骨又久而未至俛仰悲怀轰饮极醉不觉失声哭率成二首呈使君兼留迟毕凡 其一
747696,除夕前一日醉起呈江使君时使君以岁晏享士虚其左西向以荐中丞之灵既毕奠使君揖余就宾位曰君先兄故人状相若齿相埒也见君如见吾先兄矣余之识中丞以陈池州池州之死久而未明而其弟毕凡千里来寻兄骨又久而未至俛仰悲怀轰饮极醉不觉失声哭率成二首呈使君兼留迟毕凡 其一
747696,除夕前一日醉起呈江使君时使君以岁晏享士虚其左西向以荐中丞之灵既毕奠使君揖余就宾位曰君先兄故人状相若齿相埒也见君如见吾先兄矣余之识中丞以陈池州池州之死久而未明而其弟毕凡千里来寻兄骨又久而未至俛仰悲怀轰饮极醉不觉失声哭率成二首呈使君兼留迟毕凡 其一
747696,除夕前一日醉起呈江使君时使君以岁晏享士虚其左西向以荐中丞之灵既毕奠使君揖余就宾位曰君先兄故人状相若齿相埒也见君如见吾先兄矣余之识中丞以陈池州池州之死久而未明而其弟毕凡千里来寻兄骨又久而未至俛仰悲怀轰饮极醉不觉失声哭率成二首呈使君兼留迟毕凡 其一
22203,观宋州于使君家乐琵琶
952617,使君沈虞卿宗丞命赋郡圃罗汉树其树叶如杨梅经冬不彫生子若罗汉然使君云奇特古怪前所未见也
952617,使君沈虞卿宗丞命赋郡圃罗汉树其树叶如杨梅经冬不彫生子若罗汉然使君云奇特古怪前所未见也
990101,十月一日陪使君领客之湖庄
544679,同诸公夜饯杨使君于梁中翰宅得低字
712429,题忆雪楼江山无尽图送紫诠王使君之官川南次留别原韵 其二
719280,送戴使君 其二
9648,寄赠衡州杨使君
114215,赠黔南贾使君
1155757,题崔使君新楼
937682,十三日再赋二首其一以赞使君是日对花赋此韵诗笔落纵横而郡中修水战之具方大阅于燕公楼下也其一自叙所感忆年十五在杭州始识此花皆三丈高木尝赋诗焉 其二
230936,赠湖州使君李公择
1167042,赠商州王使君
558976,先余册岷府曾过茶陵兹冯使君招饮即席呈谢时使君初任也
558976,先余册岷府曾过茶陵兹冯使君招饮即席呈谢时使君初任也
1180810,上冯使君五首 其四
956483,次韵同年杨廷秀使君寄题石湖 其一
10001,送李使君赴抚州
560934,棠溪宴集赠使君
62363,三醉龙使君帐中歌
8594,寄刘峡州伯华使君四十韵
596906,观朱使君家乘题赠二首 其一
1122604,福州程使君止戈堂二首
883591,次韵司封使君和程给事越来溪三章 其二
8338,陪李梓州王阆州苏遂州李果州四使君登惠义寺
544546,赠董使君十六韵
89408,武冈叶使君寄诗次韵·词客纷纷载后车
439311,谢张使君梦弼馈春肉
1156348,送唐州崔使君侍亲赴任
670915,汝宁徐使君 其三
686046,和大司马王公同钱使君月下园池泛舟之作二首
713343,佟声远招同王紫诠使君樊昆来翰检赵秋谷宫赞梁药亭吉士胡□□雅集粟园看新梅分赋二首 其一 五律得八庚
670113,送永宁许使君 其一
1123851,呈衡州使君先生二首
1237637,九日对菊忆姜霍二使君
245178,桃源忆故人·使君欲醉离亭酒
1095674,舟中遇雪寄宋使君 其一
1096024,寄处州高使君疏寮
713114,有约惠州偶以事不即往月夜独坐奉怀王使君子千三首 其一
598169,戴使君自广州归壶山取道见访因作此赠之四首 其一
156373,爱民堂为涪陵卢使君题
597253,岳阳晓发大雨次韵寄雨泉使君时二月十五也
122796,次韵同年杨廷秀使君寄题石湖
918321,曹主簿泾自卜寿藏追范石湖韵谨依虚谷使君例各一再和 其四
1063405,故游茂先大夫元祐初为唐安守豪逸喜宾客能剧饮谈笑盖陈孟公之流今唐安弦索之盛甲于两蜀自游使君始后累迁至秦凤宪以卒既二十馀载而其子振旅游峤南相过于惠州作此诗赠之
664821,赵使君后堂同东谷太微太华诸君子集 其一
569449,侍御荆使君邀登北固作 其一
88656,题洪使君诗卷
191334,巩使君一新社稷坛宇次汪倅韵
908410,送无害弟之官并呈使君蹇丈一笑
202399,道中即事呈岑使君吏部次和德麟韵
534754,赠张使君佥宪闽中
624849,洪晖吉使君招游阴那山和韵
545768,寄吴文仲使君八首 其六
538572,送范使君视浙江学
725612,应教使君春游诗
340724,席上口占和使君韵
570639,和张肖甫司马题王阳德使君阳湖别墅十咏 其一 知乐轩
695116,戴使君自广州归壶山取道见访因作此赠之四首
670386,赵州赠许使君
960518,临江仙 其八 送使君刘显谟归三衢
550931,高贤祠成荅屠使君 其一
1208114,赠余使君致仕还江东
1175965,夜闻故梓州韦使君明当引绋感而成章
147477,陪徐渊子使君登白雪楼约各赋一诗必以宋玉石
881059,喜雨呈赵使君
207701,使君领客访湖庄分简斋茂林当日映群贤之句得
1116133,河中使君莫少卿挽诗二首
544296,卢使君追步隐侯作后八咏诗不佞次题倚和倚槛思民力 其四 名园惜落花
225205,春日迓新使君
37626,对雪寄新定冯使君
877259,送项使君季约二首 其一
1122917,送谢刑部使君赴召
199633,送程伯俞赴海陵苏使君招
1228236,陪观志能萨天锡二使君游城西光孝寺
1190835,奉和虢州刘给事使君三堂新题二十一咏 北湖
26180,光州王建使君水亭作
433714,贺掖（县）前令南昌魏起鹏使君乞养还山吟四叠选二
609319,水退后呈郑使君十四韵
61110,立春日纪山西石二使君陈程二阃帅邀游吹台同
598092,凤城春夜辱劳使君邀集于金山精舍别归却寄是诗兼以为谢
826198,清平乐·寿陈使君六十
544298,卢使君追步隐侯作后八咏诗不佞次题倚和倚槛思民力 其六 江城暮听笳
981586,摸鱼儿 景定庚申会使君陈碧栖
999071,送张使君
336627,送章使君守竟陵
541338,暮春端州郑使君招饮七星岩
1143606,送郭君贤使君赴建德任
4601,陪姚使君题惠上人房
9630,送端州冯使君
148900,过南安接孟使君辞警策多矣复承遣诗追惠遂足
1060677,陪陈使君宴南山亭
968934,径坂左司使君惠和近诗为亲而喜合天理之公得性情之正复用韵以庆 其二
1089019,将至池阳呈鲁使君
88289,题端溪王使君诗卷
662642,送穆使君入觐
533739,王使君元美招同吕光禄游砚山亭 其一
1005063,寄台州使君五首 其三
185523,洛中郑悫三伏之际率宾僚避暑于使君林取大莲
1033276,口号送椰心簟刘使君
713333,王川南使君紫诠招同李宫詹山公袁通政密山梁太史药亭蓝山人采饮游灵洲予以事不果往诸公分韵及之仍同游韵八首 其八
1216228,题临川曾仲衍手卷时仲衍授永嘉之平阳州同知有旨命赍御酒宣慰本州周宗道佥院贡米入京卷有危太朴参政所书虞学士邵庵送行序并诗三首走亦不揆效颦于左兼简君道使君 其一
366974,鹿头山诗·使君镇爱鹿头山
1088493,伏承侍郎使君垂示所与少傅国公唱酬西湖佳句谨次高韵聊发一笑 其二
1087252,腊雪应祈因成鄙语呈使君
1158477,顾十二况左迁过韦苏州房杭州韦睦州三使君皆有郡中燕集诗辞章高丽鄙夫之所仰慕顾生既至留连笑语因亦成篇以继三君子之风焉
1159971,夔州窦员外使君见示悼妓诗顾余尝识之因命同作
713129,西湖送春次王紫诠使君韵十首时积雨八旬矣四月朔日积雨偶晴故有此作寄余索和十首 其六
575515,读刘使君诗，遂为却寄 其二
1003603,和虞使君撷素馨花遗张立蒸沉香四绝句 其四
713133,西湖送春次王紫诠使君韵十首时积雨八旬矣四月朔日积雨偶晴故有此作寄余索和十首 其十
1044900,送文渊使君郎中赴当涂
1171968,黔中罢职过峡州题田使君北楼
1175022,寄申州卢拱使君
958439,夜闻雨声赋古风时赵使君祈雨之翌日也
1179369,酬崔使君寄麈尾
1102560,遣兴十首呈孟兵部使君 其九
1190417,褚主簿宅会毕庶子钱员外郎使君
1177017,和王中丞使君春日过高评事幽居
1174534,闻庆州赵纵使君与党项战中箭身死辄书长句
240374,沈德和使君生辰
1236789,秋日集咏奉和潘李二使君浦编修诸公十首
575495,寄监兵陈使君 其三
670501,寄汝南徐使君
14380,韶州留别张端公使君
877185,送陈使君二首 其二
9251,送王使君赴太原行营
138631,乌使君·始听歌来暮
1142281,西岩使君上冢过霅首访敝庐又会能静话旧感慨情见于辞所以道别
960556,鹧鸪天 其一 呈鄱阳使君何郎中伯谨
1195027,上冯使君五首
1173201,宴王使君宅题二首 其二
253505,寄题·天下英雄惟使君
1072536,次前韵酬董衮臣使君见寄
1162210,郡中端居有怀袁州王员外使君
27592,送龙州樊使君
1102907,次韵张受益六言兼戏方使君二首 其一
1161293,赠宜阳张使君
1154837,送卢使君赴夔州
19273,送刘五司马赴任硖州兼寄崔使君
493367,春日谩兴柬邹使君
719282,送戴使君 其四
907297,送恩平潜使君还里二首 其一
343818,题朱使君故祠
