1078849,作亭池上日游其间颇觉自适
1070783,向丞厅旧有小轩榜曰日哦庳隘不爽近彻墙向南植竹数竿改曰分翠与僚友邑之贤彦日游其间且索鄙句因赋二诗呈诸友 其二
871427,觉非居士东庵甚奇观玉蟾曾游其间醉吟一篇旧风以纪之
1113813,向丞厅旧有小轩榜曰日哦庳隘不爽近彻墙向南植竹数竿改曰分翠与僚友邑之贤彦日游其间且索鄙句因赋二诗呈诸友
1157210,严十八郎中在郡日改制东南楼因名清辉未立标榜徵归郎署予既到郡性爱楼居宴游其间颇有幽致聊成十韵兼戏寄严
906422,黎道人自长沙入闽解石见之论易颇有所得自言居醴陵山中有田庐养鱼种竹可以卒岁作取足庵义方堂优游其间藏书教子甚乐也遽还求诗赠之
1080058,会稽石道叟教授南剑兵火抢攘之馀兴治郡学尺椽片瓦皆其所自经营也未期月而学成远近赖之又祠前辈贤者以风励多士使游其间者望之而心化由是而入尧舜之道不难也古之教者盖多术矣五帝宪三王有乞言宪贤于乞言也道叟知之矣吕本中为作诗叙本末云
352270,作亭池上日游其间颇觉自适
1070782,向丞厅旧有小轩榜曰日哦庳隘不爽近彻墙向南植竹数竿改曰分翠与僚友邑之贤彦日游其间且索鄙句因赋二诗呈诸友 其一
