462763,寄清溪二画，恨邮途失落，濡毫再写并繫小诗，兄当莞尔我亦安之 其三
462779,丙申小暑前，与叶雨云三兄于绮梦楼消夏食面。时南方洪水并系幽怀，因约分嵌江南雨三字成篇
834485,南柯子 谭瑑情聊园填词图，属为之，并系以词
427539,庆清朝慢·徐随庵游栖霞，得徐锴徐铉题名二碣。余为作摄山访碑图，并系一词
302651,庆清朝慢·徐随庵游栖霞，得徐锴徐铉题名二碣。余为作摄山访碑图，并系一词
462764,寄清溪二画，恨邮途失落，濡毫再写并繫小诗，兄当莞尔我亦安之 其四
1223862,绍兴间临安士人有赋曲一春长费买花钱日日醉湖边玉骢惯识西湖路骄嘶过沽酒楼前红杏香中箫鼓绿杨影里鞦韆晚风十里丽人天花压鬓云偏画船载得春归去馀情付湖水湖烟明日重扶残醉来寻陌上花钿思陵见而喜之恨其后叠第五句重携残酒酸寒改曰重扶残醉因欧阳原功言及此与陈众仲寻腔度之歌之一再董此宇求书其事因书之并系以此诗
492912,为易谦画竹并系以题
400243,美人 何耀光翁属画至乐楼校书图，图成并繫以词
462762,寄清溪二画，恨邮途失落，濡毫再写并繫小诗，兄当莞尔我亦安之 其二
283397,南柯子·谭瑑情聊园填词图，属为之，并系以词
562811,钟黄初以余有三楚之命亟徵余画谓余于画自此远耳勉应其请并系以诗
421637,西湖游罢，以书报少云，并系以诗
831241,清平乐 樾庭孝廉属作玉峰兰隐小印，并系以词
843242,潜楼老弟病中乞为画松予诺之犹期其瘉也已而赴至意不可负写此并系一绝
465912,寄清溪二画，恨邮途失落，濡毫再写并繫小诗，兄当莞尔我亦安之
412286,寄燕生小照并系以诗
462761,寄清溪二画，恨邮途失落，濡毫再写并繫小诗，兄当莞尔我亦安之 其一
385853,刘凤台惠牡丹金橘并系以诗，依韵酬之
350282,清平乐·樾庭孝廉属作玉峰兰隐小印，并系以词
289199,西湖游罢，以书报少云，并系以诗
