7717,王十五司马弟出郭相访兼遗营茅屋赀
304522,梅泉重赀助刊拙集感赋
546699,次盂城稚升使者以酒赀追至再赋二绝寄之 其一
1172577,王录事许脩草堂赀不到聊小诘
789577,金缕曲  岁暮怀熊东美袁世浦东美彯缨世胄，为沈氏宅相，年少才俊，与余缔交庾园，分曹赌酒，剪烛传歌，备极文宴之乐，乙卯春省亲，袁浦旋试京兆，鸾翮偶锻，意将入赀，为郎赋此寄之
938188,某以雨有嘉应遂占有秋辄采用家弟韵赋二绝句少赀勤恤之诚也 其一
670955,谢中丞枉驾见过兼惠营草堂赀 其三
1068803,曾徽言学士求赋所蓄端砚曾尝避乱海陵家赀尽没于贼独携此砚脱去
1135734,送仇仁近持山村图求屋赀
434868,庆州北山之麓辽山陵在焉俗谓之三殿二十年前常为盗发所得不赀是所谓厚葬以致寇者叹而成诗
1075205,解人敦武郎富君为余言解池广二百里其利不赀又有六小池官虽置戍以为厉禁而民寔擅其利或悉以属县官则盐不复成其事颇怪作小诗以纪之
215636,郭解·藉交唯有不赀恩
116428,赵飞燕·苦心膏沐不论赀
107854,送仇仁近持山村图求屋赀
695649,二十年前屡过平远一主大柘林仰峰一主东石林玉山二人皆赀雄闾里以好客闻玉山有子三人因兄弟相诘败仰峰有子十一人不嫖不赌又中有青衿而亦以败何也仰峰以一人聚之子以十一人分之费且不节而亦以废箸此耳辛酉应召过而心伤为赋二绝亦以劝为人子者
773652,凤邑大昆麓庄内福德祠前一带基地被庄众侵占百馀年耕作菜园开池筑厕嘉庆乙亥1815陈君廷瑜首唱捐赀劝解庄人为之清出众皆悦之
615925,予壬子岁过峡山正当冲圯兹出山重过阻风两日获登焉胜迹多新颇复旧观则邑人朱惟四所捐赀也朱与予别亦十年馀矣留题二首 其二
48261,题画·酒赀长苦欠经营
773653,凤邑傀儡山脚有溪曰排律其水甚大长流不绝原水路从北而出外溪突于嘉庆乙亥1815年溪门大塌水势直冲各处田园几变沧海大昆麓陈君廷瑜庄业也适瑜到即倡捐金赀劝勉番仔崙北旗尾埔头三庄业主均同捐金令佃人累石筑堤阔一丈馀长五六丈于是各处田园无致被水冲陷亦全无派累佃农分毫故庄人喜之而作此诗
77760,述怀·宦游轻用不赀身
368227,自况·多赀徒作守钱奴
498886,司成沈十洲守制家于河之浒丁巳夏佞讯至诸监司招之入城公义不往捐赀觅兵与里人捍禦寇至果不敢犯
78621,舟中夜赋·问天乞得不赀身
571859,赠王以明纳赀归小竹林
807774,沁园春  病中云臣馈我药赀赋此志谢
87980,鹤会·投不赀躯火宅中
80610,老民·乞得不赀身
8433,王录事许修草堂赀不到聊小诘
1083461,乞赀曹绩
828633,梅泉重赀助刊拙集感赋
283873,移居韵·如君能办买山赀
540274,董中丞淑化寄饷酒赀
615924,予壬子岁过峡山正当冲圯兹出山重过阻风两日获登焉胜迹多新颇复旧观则邑人朱惟四所捐赀也朱与予别亦十年馀矣留题二首 其一
559368,二十年前屡过平远一主大柘林仰峰一主东石林玉山二人皆赀雄闾里以好客闻玉山有子三人因兄弟相诘败仰峰有子十一人不嫖不赌又中有青衿而亦以败何也仰峰以一人聚之子以十一人分之费且不节而亦以废箸此耳辛酉应召过而心伤为赋二绝亦以劝为人子者 其二
87413,泉州南郭·海贾归来富不赀
604766,庚申夏来送刘觐国少参以入贺还涖武昌并讯楚中任白甫龙君御诸社友时觐国方梦臼而里中南园旧社之役觐国捐赀主盟故咏叹及之
359797,平阳公主·家赀散尽招亡命
1172796,王十五司马弟出郭相访兼遗营茅屋赀
516147,黄岩谢孝子遗事七首 其六 往昌国取赀夜梦母盛妆以为不祥遂弃归
546700,次盂城稚升使者以酒赀追至再赋二绝寄之 其二
559367,二十年前屡过平远一主大柘林仰峰一主东石林玉山二人皆赀雄闾里以好客闻玉山有子三人因兄弟相诘败仰峰有子十一人不嫖不赌又中有青衿而亦以败何也仰峰以一人聚之子以十一人分之费且不节而亦以废箸此耳辛酉应召过而心伤为赋二绝亦以劝为人子者 其一
1118892,某以雨有嘉应遂占有秋辄采用家弟韵赋二绝句少赀勤恤之诚也
808758,挽岳将军公讳钟琪前宁远副将军后拟提督四川己巳春入觐京师还止望都传舍余谒见长身赭面被服儒素为言金川形势及纳降事盖虏夙重公故卧护十年卒无事唐以李世绩为长城信然以雅能诗即席千言立就唯食前方丈行厨之费不赀此外固无一毫负公也将星已没当为天下惜此人
663103,刘尧臣重葺明伦堂扶病草数韵旌之并以儆夫见义不为徒捐赀以饰梵宇琳宫妖祠淫祀者
52020,唐生将卜筑桃花坞谋家无赀贻书见让寄此解嘲
478478,唐生将卜筑桃花之坞谋家无赀贻书见让寄此解嘲
288045,贺诗·积馀有赀抚四儿
1035816,某以雨有嘉应遂占有秋辄采用家弟韵赋二绝句少赀勤恤之诚也 其二
670956,谢中丞枉驾见过兼惠营草堂赀 其四
737637,焦山瘗鹤铭沦入江汜七百年矣家沧洲公捐赀募力士挽出之得五石凡七十一字复还旧观建亭山院因作长歌以纪其事
324669,挽刘英臣·累世以赀雄里闾
840346,族弟一元性嗜饮日在醉乡居近港河河畔有田赁与人陶岁取租若干为酒赀一日大醉往陶家索钱至陶侧而踣久不起人视之死矣其人无父母无昆弟无妻子族人议即死所而埋之陶侧噫合刘伯伦郑文渊为一人殆隐于酒者欤作诗以吊之并邀石公同作
697412,次盂城稚升使者以酒赀追至再赋二绝寄之
670953,谢中丞枉驾见过兼惠营草堂赀 其一
605233,南园旧社国初岭南五先生之旧社圯废二百五十馀年今王太父太常虞石王公按粤时偕黄士明黄亮垣韩绪仲陈集生四太史陈抑之邓玄度刘觐国三观察高正甫太守梁幼宁韩寅仲二明府韩孟郁黎孺旬黄逢永三孝廉及诸二三君子与不佞萱捐赀脩复者也甲子秋八月萱督课儿辈就试棘围以十五夜汛扫南园宴集同社诸君子请公小像为萱所赞者悬社中礼而拜焉遂相与授简以续甘棠之咏萱得九青凡十二韵先一夕月有食之因并及焉
670954,谢中丞枉驾见过兼惠营草堂赀 其二
691203,予壬子岁过峡山正当冲圯兹出山重过阻风两日获登焉胜迹多新颇复旧观则邑人朱惟四所捐赀也朱与予别亦十年馀矣留题二首
692071,谢中丞枉驾见过兼惠营草堂赀
