670806,郡斋同元美赋得桥字
517029,梅花三公图为龚绂朝美赋
318914,风入松·次箫赋《水龙吟》题余词集，语多溢美，赋此所以报也
418886,风入松 次箫赋《水龙吟》题余词集，语多溢美，赋此所以报也
670426,郡斋同元美赋得河字
557136,韦氏池亭四首同于鳞子与元美赋 其一
517109,题东峰庵为王庭美赋
557137,韦氏池亭四首同于鳞子与元美赋 其二
670700,郡斋同元美赋得高字
670159,春日韦氏园亭同元美赋 其一
557139,韦氏池亭四首同于鳞子与元美赋 其四
691937,春日韦氏园亭同元美赋
948127,八月十八日与客小集赏岩桂而红梅海棠金林檎盛开明日江西美赋四绝句走笔次首篇韵
513612,谷庵为吴医沈公美赋
669927,郡斋同元美赋得阴字
55729,终南进士行为刘主事廷美赋
557138,韦氏池亭四首同于鳞子与元美赋 其三
194128,公冶携酒见过与者温元素康致美赋诗投壶再用
694820,韦氏池亭四首同于鳞子与元美赋
671091,郡斋同元美赋得遗字
480834,终南进士行为刘主事廷美赋
983454,昨暮侍玉霄亭坐新月初上凉风叠至配以丹荔白醑景物且美赋诗呈知府丈
670116,郡斋同元美赋
966420,公冶携酒见过与者温元素康致美赋诗投壶再用前韵
670160,春日韦氏园亭同元美赋 其二
670730,郡斋同元美赋得傍字
1218700,送解伯中赴史馆召至正癸未朝廷以史事遣使起河东张先生于广陵明年史局开又于广陵徵解先生广陵连有二盛事睹兹荣美赋诗为别
640097,赵仲穆山水图为郎中董君美赋
670719,郡斋同元美赋得明字
670234,郡斋与元美赋
670061,郡斋同元美赋
521082,筠屋为徐大章季父廷美赋
671093,同元美赋得寒字
