829149,八六子 为遐翁作罔极图卷，丁亥十月送翁南归志别
659970,咏泉为宋通政乃翁作
664626,寿歌三章为松鹤翁作 其三
823381,八六子 其一 为遐翁作罔极图卷，丁亥十月送翁南归志别
561822,海天春晓图歌为桂翁作
1242580,怀远亭诗，为东瓯镇抚谭济翁作
78680,子聿欲暂归山阴见乃翁作恶遂不行赠以此诗
71013,和曲江先生元夕寿伯翔翁作
663353,荣恩介寿诗为陈矩庵中丞乃翁作四首 其三
662146,寿歌三章为松鹤翁作 其一
930548,子聿欲暂归山阴见乃翁作恶遂不行赠以此诗
287488,瑶花·冰花，同仇述翁作
114078,学元翁作女儿浦口诗
657511,松风梅月为孤鹤翁作
380792,祭天神·题归鹤图为彊村翁作
939436,和朱晦翁作
658101,南山为滁阳傅翁作
287496,祝英台近·贞晦翁作庭中花木诗，嗣君叔扬为之绘图
101037,钱道人有诗云直须认取主人翁作两绝戏之
337726,偶得虾酱怀所翁作
1139140,雅宜山在城西五十里有德庆庵在其下穹窿山福顺寺长老绍尧翁作诗取以雅宜为号求诗
922563,钱道人有诗云「直须认取主人翁」，作两绝戏之 其二
664625,寿歌三章为松鹤翁作 其二
470802,赠竹深堂鹤（为牧翁作）
663352,荣恩介寿诗为陈矩庵中丞乃翁作四首 其二
1239535,和曲江先生元夕寿伯翔翁作
406342,祝英台近 贞晦翁作庭中花木诗，嗣君叔扬为之绘图
1064250,钟山悟真庵西竹林间苍崖千尺岁久折裂余与敦素行山中至此未尝不徘徊庵僧为开轩向之尽收其形胜名曰两翁作此
832535,霜叶飞 其二 沪上喜遇半塘翁作
737348,归田诗为后翁作
663434,嗟克明为段佥事惟勤乃翁作
995684,学元翁作女儿浦口诗
658065,东圃为胥江范能用乃翁作
1099968,偶得虾酱怀所翁作
663354,荣恩介寿诗为陈矩庵中丞乃翁作四首 其四
686758,寿歌三章为松鹤翁作
556097,双寿图歌为叚翁作
267321,霜叶飞·沪上喜遇半塘翁作
1116726,钱道人有诗云「直须认取主人翁」，作两绝戏之
739908,家叔于巢以折枝兰花赠方息翁自翁作歌张之壁间书一诗于后呈于巢
419128,瑶花 冰花，同仇述翁作
496075,大江东去 其十一 庚子初度，陆俨翁作金焦图，和东坡此词，遣其子楫瞿、婿学召来为予寿，予喜对二子即席赋答
658184,静庵为文辅乃翁作
658073,一苇为兰雪翁作
609321,瀛海长春歌为宪副刘翁作翁家瀛海以元日生时夫妇皆寿八十馀长子礼部侍郎次子副都御史故并侈其家
674604,楝塘歌为池州推府李伯义乃翁作
761060,祭天神 题归鹤图为彊村翁作
663351,荣恩介寿诗为陈矩庵中丞乃翁作四首 其一
922562,钱道人有诗云「直须认取主人翁」，作两绝戏之 其一
663436,接树叹为方举人乃翁作
686776,荣恩介寿诗为陈矩庵中丞乃翁作四首
269265,八六子·为遐翁作罔极图卷，丁亥十月送翁南归志别
