936801,乾道初予自临川归钟陵李德远范周士送别于西津是日宿战平风雨终夕今自临川之高安复以雨中宿战平怅然感怀二首 其二
266859,挖雅诗·挖雅于今自愧时
1078303,余两过湖湘皆以事阻不到南岳今自衡趋潭意谓决可一到又以新讨降步谅之众不果往为之怅然成两绝句 其一
929853,乾道初予自临川归钟陵李德远范周士送别于西津是日宿战平风雨终夕今自临川之高安复以雨中宿战平怅然感怀二首 其一
1118260,乾道初予自临川归钟陵李德远范周士送别于西津是日宿战平风雨终夕今自临川之高安复以雨中宿战平怅然感怀二首
1078304,余两过湖湘皆以事阻不到南岳今自衡趋潭意谓决可一到又以新讨降步谅之众不果往为之怅然成两绝句 其二
1046838,连年往返水陆万馀里今自乡中挈家南来已至江州行彻险阻喜而作诗寄之
95788,钟子崧己丑岁簿秩满去今自饶州教授还犹选人
1114158,余两过湖湘皆以事阻不到南岳今自衡趋潭意谓决可一到又以新讨降步谅之众不果往为之怅然成两绝句
366816,连年往返水陆万馀里今自乡中挈家南来已至江州行彻险阻喜而作诗寄之
973073,钟子崧己丑岁簿秩满去今自饶州教授还犹选人也感叹之馀赋以别
1223346,萧姓渊善鼓琴予尝为之作我思操今自和林归再任巡徼之职于江南比行又求予诗遂为赋汉铜马式歌以送之
