893100,喜翟颖先辈至有感
402195,蓦山溪 北书至，有感，却寄
54311,喜茂之至有述
1123374,次韵前人长至有怀二首
1040320,次韵前人长至有怀二首 其一
55537,自公安县夜归鹅池庄风雨骤至有作
87414,泉牧帖请囊山福上人住持承天既至有沮之者兴
746431,迟徐九香不至有寄
528317,书院课士雨至有作
1040321,次韵前人长至有怀二首 其二
549169,壬戌长至有感时事漫赋二绝用白苏韵 其一
945250,弟观喜董稼山至有诗因次韵二首 其一
539116,予与自闽明卿自贵同日书至有感 其一
447736,戊子夏，巢湖暴雨不止，衢市积潦，深三四尺，几成泽国，至有溺毙者。余一店亦被灾，乃赤膊跣足，与众工肩扛背负，涉水转运仓储货物，一时汗雨莫辨，感而口号
522025,松守喻侯讣至有感
229179,庵文授·怡云未至有人传
1081785,曾守置酒月波楼以张倅至有诗命坐客同赋
458905,十月二十四日斜阳如温水，无风，极和静之至，有所感四首 其一
302566,招和兄游庐山未至，有诗见寄，因此其韵
538826,子与追于鳞不及喜余后至有作遂成和章
1174811,喜从弟雪中远至有作
980557,忽蒙秀实内黄贤尉寄书期许稠至有经世之语辄代书为谢
524878,诉衷情 桂林徐伯川屡约不至有词见寄作此答之
1081333,三月二十日游东山参议不至有诗次韵
568457,连日迟李献吉不至有作
683513,予与自闽明卿自贵同日书至有感
335283,曾守置酒月波楼以张倅至有诗命坐客同赋
349046,三月二十日游东山参议不至有诗次韵
574947,王近至有悼
803983,伊拉里克河水利林文忠公遣戍时所开，所谓四十八坎儿也，贤者所至，有益于民如此
575110,立春日郊人送小土牛至有作
861609,汪直卿相招子大先至有诗炎后至子大再至因次其韵
588695,立春日世祏祠祭后小憩蓝县丞来谓蔡察院疏予道学已而邸报至有礼乐接乎周孔道学绍乎朱程诚为圣代真儒等语非予所敢当也赋此以自笑
596705,返城南见诏书至有感
513514,乙未十一月十六日长至有感
222072,冬至有感·萧辰俯仰及严冬
511553,邹吏目书至有作兼呈吴县尹 其二
1066026,去年冬至过闽清再至有感
447389,中镇盛会盛元未至，有集句诗来，联此却寄
656798,和郑侍郎廷纲长至有怀
607176,广生至有述赋答
1076167,米元晖待制岁以赐冰及荔子分遗季共而今年荔枝不至有诗次韵三首 其三
539117,予与自闽明卿自贵同日书至有感 其二
124154,喜翟颖先辈至有感
470043,喜茂之至有述
549170,壬戌长至有感时事漫赋二绝用白苏韵 其二
511554,邹吏目书至有作兼呈吴县尹 其三
254565,蓦山溪·北书至有感
160709,汪直卿相招子大先至有诗炎后至子大再至因次
337254,米元晖待制岁以赐冰及荔子分遗季共而今年荔枝不至有诗次韵
492508,兵曹对月念家问不至有怀子中大兄并子彦诸弟
537358,北使至有感
694553,邹吏目书至有作兼呈吴县尹
505725,晚闻雨声至有作
756576,雨后待汪扶苍啜茗不至有怀
458906,十月二十四日斜阳如温水，无风，极和静之至，有所感四首 其二
688284,壬戌长至有感时事漫赋二绝用白苏韵
458907,十月二十四日斜阳如温水，无风，极和静之至，有所感四首 其三
466214,十月二十四日斜阳如温水，无风，极和静之至，有所感四首
658695,庚申长至有事于东陵倪冢宰吴韩两少宰俱有诗赠行和之
299320,迟徐九香不至有寄
848978,和丹岩以青溪至有作
442174,兴至有题二首 其一
564846,钱塘侯崇礼至有诗因和答
32125,喜从弟雪中远至有作
549167,于?先天才隽逸久别乍晤感喜交集长至有诗倚和二首 其一
205362,和丹岩以青溪至有作
537202,春日过李三于鳞小饮适谢茂秦至有怀伯承明府
1119909,弟观喜董稼山至有诗因次韵二首
688283,于?先天才隽逸久别乍晤感喜交集长至有诗倚和二首
472343,自公安县夜归鹅池庄风雨骤至有作
361277,次韵前人长至有怀
1207843,新雨阶除花药倍茂田里生意怀之欣然情至有述简诸作
549168,于?先天才隽逸久别乍晤感喜交集长至有诗倚和二首 其二
511552,邹吏目书至有作兼呈吴县尹 其一
1076166,米元晖待制岁以赐冰及荔子分遗季共而今年荔枝不至有诗次韵三首 其二
866483,冬至有感
458908,十月二十四日斜阳如温水，无风，极和静之至，有所感四首 其四
950950,戊戌二月十日京湖袁总郎以堂帖至有诏复除户侍总饟
443268,老至有感
381930,冬至·有约佳人殊未来
150154,忽蒙秀实内黄贤尉寄书期许稠至有经世之语辄
1120854,米元晖待制岁以赐冰及荔子分遗季共而今年荔枝不至有诗次韵三首
131569,弟观喜董稼山至有诗因次韵
945249,弟观喜董稼山至有诗因次韵二首 其二
877066,泉牧帖请囊山福上人住持承天既至有沮之者兴尽而返戏赠小诗
1076165,米元晖待制岁以赐冰及荔子分遗季共而今年荔枝不至有诗次韵三首 其一
361449,长至有怀·我昔间关出使胡
524977,九日亭上独酌六弟送盘飧至有怀
467238,兴至有题二首
442175,兴至有题二首 其二
492507,兵曹对月念家问不至有怀子中大兄并子彦诸弟
1233561,喜赵继道至有怀陈君采
659060,三月二十三日赏牡丹秉之不至有诗来次其韵
411331,招和兄游庐山未至，有诗见寄，因此其韵
