1099722,春谷惠示榕桥精舍二十四诗借首篇韵赋一首
800575,再赋一首示耑木及同游诸子
828470,此间雉多而值贱入冬即以侑食予齿脱他肴多不能决每食只此一味或益一菘而已忽忽三载未尝生厌计所食不下数百矣感赋一首
1230216,疏斋先生赋湖阴曲书以付余遂赋一首
1088574,蒙恩许遂休致陈昭远丈以诗见贺已和答之复赋一首
1142430,予家窗外种竹逾千个每开窗辄相对终日今岁馆前亦多竹遂赋一首
877682,诸人颇有和余百梅诗者各赋一首 其七 方至贡元
876764,听蛙方君作八老诗效颦各赋一首内三题余四十年前已作遂不重说倡言别赋二题足成十老 老道
406978,苏翁与仙樵书辄及下走，感赋一首奉报  九叠“由”“幽”韵
680209,丹阳北新丰道傍两石人传闻昔有二人夜行遇明遂止于此是固无稽之谈然貌伛偻丑陋不类乎墓道所列者谩赋一首
984905,和余时升周子美江雨有怀雨不绝诗韵各赋一首 其一
1099899,丁卯重作化龙桥嘉平甲子脩梁方举两虹忽现里人皆以为瑞辄赋一首
876738,别赋一首
985234,登致爽阁观山用种字韵同赋一首
1100097,前日苦旱禾恐立槁今雨太多已穫者生芽未穫者欲烂因叹耕者之苦辄赋一首
276368,子乔自县中来言，书田单先生贫状，至食木叶，并邀各赋一首为赠
1077091,再赋一首
1240433,壬午九月九日与郭希仲纪叔维马希远饮周景文晚香堂上纪画墨菊马鼓琴既而各赋一首
553093,用前题别赋一首
1003933,道传山丹一本两花举以见遗夜窗翻书偶见刘潜夫尝赋云偶然避雨过民舍一本山丹恰盛开种久树身樛似盖浇频花面大如杯怪疑朱草非时出惊问红云甚处来可惜书生无事力千金移入画栏栽因借韵同赋一首
642812,何本先以天香茶见惠奉赋一首
1108576,诸人颇有和余百梅诗者各赋一首 赵监簿志仁
958043,良嗣以予生朝将至以古赋一首为寿作三绝与之勉其省愆念咎当在念亲之先 其一
948925,胡原仲正字特改官除宫观馆中置酒饯别会者七人以先生早赋归去来为韵人各赋一首仆得早字
1122027,良嗣以予生朝将至以古赋一首为寿作三绝与之勉其省愆念咎当在念亲之先
660694,诸公以丝瓜诗韵险复赋一首
688857,小金山既分赋后诸子谓望气楼环翠亭二公遂为兹山香火宜有专赋用志所怀遂篝灯各赋一首二首
1052060,次张同年德父移松杉石楠海棠各赋一首 其四
1218616,延祐三年东平申屠先生掾山南宪司行部夷陵毁曹操祠为孔子庙歌颂赋论者夥矣后四十年余亦赋一首
493143,再过新吴寺闻严焕已择卜尚未葬感赋一首
828431,八月余送亡室柩至旧京获见散原先生年八十有二别六年所矣君任北游已倦将南归闻余来止不行伯夔自上海扶病来会立之亦自津来文酒过从无虚日数年来不易得之会合也雨夜不寐感赋一首呈散原先生并邀诸君子和
1052226,昨日陪深之学士饭净因登罗汉阁期致远不至忆山阴弟各赋一首遂寄二君
1037273,昔人有画醉僧醉道士醉学究者皆见于传记及歌诗中予暇日为各赋一首 其三 醉学究
860359,龙舒朱献宾主汉阳簿弃官以归予亦不合丐去为赋一首
1052057,次张同年德父移松杉石楠海棠各赋一首 其一
855139,琳老所居植竹发笋而草茁其傍作诗见寄为赋一首
828733,病树赠湖南茶亡室洪外家为长沙周氏故嗜此茶余亦习焉今数十年不尝此味矣感赋一首
933845,偶作夜雨诗明日读而自笑别赋一首
860391,舍弟挽余为灯火计已而余出夜梦其以诗来感叹赋一首
526078,秋日与诸文士息园宴集各赋一首
1078513,再赋一首趁韵信笔初无定意也
860438,九月六日泛舟航村而舟人不审误抵道场之麓越二日登焉因过何山谩赋一首
1213940,虞博士扁所居东西曰陶曰邵以寓尚友古人之意各赋一首 其二
985180,类试院考校九月十日塔之八级中现宝光杨齐伯有诗记其事亦赋一首
999240,四月二十九日坐直庐读山谷效东坡作薄薄酒二章慨然有感追赋一首
360855,重拟自赋一首呈德升尚书
591865,读姚鸿胪禁中供事诸作辄赋一首
1100044,年来朋友多称所交某公某卿为老师者因赋一首
878378,听蛙方君作八老诗效颦各赋一首内三题余四十年前已作遂不重说倡言别赋二题足成十老 老巫
89626,诸人颇有和余百梅诗者各赋一首
1078558,重拟自赋一首呈德升尚书
618163,小金山既分赋后诸子谓望气楼环翠亭二公遂为兹山香火宜有专赋用志所怀遂篝灯各赋一首二首 其一
413282,偶忆昆明肴馔之美戏赋一首
984904,和余时升周子美江雨有怀雨不绝诗韵各赋一首 其二
553415,惜日短岁十二月二日同诸友访环中老鲍恂于西溪隐居蒙留款谈论欢洽岂无一言以记之遂命题云各赋一首嗟夫在心为志发言为诗观其所作盖可见矣
876763,听蛙方君作八老诗效颦各赋一首内三题余四十年前已作遂不重说倡言别赋二题足成十老 老医
491956,赠赵录判之九江兼柬孙伯虞 斋前黄棠棣生于山茶两株之间春花夏条扶疏可爱兹始及秋而萎黄日见矧后此霜霰交积之时乎感赋一首 其七
1249580,读黄危二阁老送何彦正归省诗序追赋一首
827970,谒节庵师不遇感赋一首
1074761,钱申仲大夫索四亭诗各赋一首 遂初亭
513814,岳王墓再赋一首
1028989,前诗谓思索诗句可以度日第恐终无益再赋一首以广之
492105,见有畜鹚?于庭者因赋一首
958041,良嗣以予生朝将至以古赋一首为寿作三绝与之勉其省愆念咎当在念亲之先 其三
601319,春日过苏廷襄宅畔池亭各赋一首
583539,冬夜同田曹长月下对菊各赋一首
430546,新重阳夕大风，感赋一首
877686,诸人颇有和余百梅诗者各赋一首 其二 何谦
1207627,孝常西斋守岁读王临川除夜寄舍弟诗爱其词致清远因用其韵各赋一首
961280,甲辰岁进诗一编孝宗许其清新翌旦宣谕宰执召试再赋一首
1093198,陆丈剑南诗斯远约各赋一首
628079,梁药亭太史入峡诗有月亲高峡烧星夹远江镫之句遍索同人和之陈独漉继作云野烧难分月江星不碍灯此后和者绝响矣予忆去秋作客端州往来此峡景值斯景因追赋一首续貂之诮知难免矣
1072148,卢骏元宪使寄示会稽竞秀阁识舟亭二诗为各赋一首 其二
1063939,宋迪作八境绝妙人谓之无声句演上人戏余曰道人能作有声画乎因为之各赋一首 洞庭秋月
1074759,钱申仲大夫索四亭诗各赋一首 白云亭
492279,十月二日假馆下径罗氏庄予兄弟所寓相距若东西家喜赋一首柬子中子彦
876765,听蛙方君作八老诗效颦各赋一首内三题余四十年前已作遂不重说倡言别赋二题足成十老 老僧
182083,良嗣以予生朝将至以古赋一首为寿作三绝与这
1075719,徐五十六索勤有种德二轩诗各赋一首 其一
1142407,郡人有朱买臣严子陵按史传买臣吴人尝出为会稽太守名曰乡郡会稽盖今两浙之地吾郡特以去州二十里曰朱池为买臣昔居之地难以考见其实子陵晚耕于富春山中则今钓台是也二公出处不同心事亦异姑以其同为郡人各赋一首使九原有作不怅来者之不我知也 其二
608256,子陵祠下再赋一首
665510,秋夜过虎丘与方思道坐白莲池石各赋一首
1073703,吴江教院首坐索诗赋一首
513832,虎丘之游沈启南在坐作画一幅再赋一首
452722,入夜不寐闻空调声大作误为风雨声即赋一首示诸友
828453,余喜夜坐每窗纸见微白始就枕盖廿年以来矣感赋一首
1066635,道祖见和复赋一首
1108144,卢骏元宪使寄示会稽竞秀阁识舟亭二诗为各赋一首
618164,小金山既分赋后诸子谓望气楼环翠亭二公遂为兹山香火宜有专赋用志所怀遂篝灯各赋一首二首 其二
876766,听蛙方君作八老诗效颦各赋一首内三题余四十年前已作遂不重说倡言别赋二题足成十老 老儒
459786,予至嗜草莓，积年所啖无算，而不曾为赋一首，彼亦将有昧恩之怨。昨醉中共肖山行，新莓始茁，快饱半蓬，稍解两年之馋。夜更以之佐酒，复大醉。今乃赋此 其二
601411,夏日小岑叔过集山居分赋一首
1213939,虞博士扁所居东西曰陶曰邵以寓尚友古人之意各赋一首 其一
1130960,斯远云閒睡醉天下之至乐也约各赋一首寄昌甫
1031889,郑亨仲作亭西山颜曰可友以书求诗为赋一首
1092904,斯远云閒睡醉天下之至乐也约各赋一首寄昌甫 其三
1072147,卢骏元宪使寄示会稽竞秀阁识舟亭二诗为各赋一首 其一
1127517,次张同年德父移松杉石楠海棠各赋一首
953292,知宗柑诗用韵颇险予既知之复取所未用之韵续赋一首三十韵
1125693,和余时升周子美江雨有怀雨不绝诗韵各赋一首
601302,移居省城感赋一首
566206,来鹊楼为张令文宿赋一首
453166,上元雾霭，辜负婵娟，为赋一首
1143727,郡人有朱买臣严子陵按史传买臣吴人尝出为会稽太守名曰乡郡会稽盖今两浙之地吾郡特以去州二十里曰朱池为买臣昔居之地难以考见其实子陵晚耕于富春山中则今钓台是也二公出处不同心事亦异姑以其同为郡人各赋一首使九原有作不怅来者之不我知也
987297,五月六日约诸友游北山舟已具而予偶不能出诸友和坡公法华寺诗亦赋一首
1099947,叶万山以诗求诗为赋一首
958042,良嗣以予生朝将至以古赋一首为寿作三绝与之勉其省愆念咎当在念亲之先 其二
998414,毛彦谟以其弟彦周出殡见索挽词谨赋一首
492405,有咏胡麻花者同赋一首
1092903,斯远云閒睡醉天下之至乐也约各赋一首寄昌甫 其二
1074762,钱申仲大夫索四亭诗各赋一首 通惠亭
817995,腊月十九日广州同人集南园为东坡作生日书来索诗因赋一首
908298,文南朱使君葬其故人钤兵李侯士大夫高其风义作诗美之亦赋一首
1142406,郡人有朱买臣严子陵按史传买臣吴人尝出为会稽太守名曰乡郡会稽盖今两浙之地吾郡特以去州二十里曰朱池为买臣昔居之地难以考见其实子陵晚耕于富春山中则今钓台是也二公出处不同心事亦异姑以其同为郡人各赋一首使九原有作不怅来者之不我知也 其一
601310,冬日李亮侯过访即席限多字各赋一首
974108,周江州有灵壁石赵蕲州名以玉芝周索诗为赋一首
951721,陈文焕秀才所宅近市凭楼一望西山宛然堕几案中县之豪隽唱酬不下数十百篇野人后来承听许不必次韵故为之赋一首
681280,萧海钓寄蛎黄上元日出以飨客因赋一首
877687,诸人颇有和余百梅诗者各赋一首 其一 赵监簿志仁
1070774,琼士黄与善会友堂课诸生作移竹诗为赋一首
937270,昔人有画醉僧醉道士醉学究者皆见于传记及歌诗中予暇日为各赋一首 其二 醉道士
1234290,李仲渊求其弟叔行万竹亭诗为赋一首
491982,斋前青蒿特盛或请薅除之惜其生意森蔚青翠可玩也谩赋一首
1076375,游香岩一小室甚温洁坐客皆言雅宜听雪各赋一首
876762,听蛙方君作八老诗效颦各赋一首内三题余四十年前已作遂不重说倡言别赋二题足成十老 老农
1055842,兼江祥瑛上人能书自以为未工又能诗而求予诗甚勤予以为非所当病也为赋一首勉之使进于道云
807844,贺新郎  暮秋卧病澄江客舍，承刘震修沛元秦其天贺天士椒峰弟诸君枉顾，因感亡友邹程村董文友，漫赋一首并示梅园主人韩尔铉
883508,翠蛟亭泉出天柱之趾将至洞霄门数折下坠方春盛时如蛟饮涧亭当木石最奇处旧取东坡诗语名以舞翠客谓不若直名翠蛟为不费答知宫事王君思明欣改之为赋一首
1063938,宋迪作八境绝妙人谓之无声句演上人戏余曰道人能作有声画乎因为之各赋一首 江天暮雪
492596,明日喜云从隐君自湴坑归再赋一首
877684,诸人颇有和余百梅诗者各赋一首 其八 方蒙仲制干
1052058,次张同年德父移松杉石楠海棠各赋一首 其二
492422,读辛好礼闽中诗感赋一首
936050,夜读唐诸人诗多赋烽火者因记在山南时登城观塞上传烽追赋一首
526329,孟中丞命酒息园集诸文士赋一首
428627,青县坑边发现古瓮一口，贮钱甚多，腐朽斑斓，概属唐文。睹物兴怀，感赋一首
430555,重过宁乡道中去此十六年矣追悼往事不胜凄恻率赋一首
594478,同吴公择方子及臧晋叔宋忠甫饯顾道行石城舟中再赋一首
1118692,昔人有画醉僧醉道士醉学究者皆见于传记及歌诗中予暇日为各赋一首 醉僧
1074760,钱申仲大夫索四亭诗各赋一首 芳美亭
491232,秋日同郑同夫罗孟文田仲颍游苍山访宋曾子实故居遗址今为陈氏居矣感赋一首
1056949,太父太师密国公赋诗江楼世称名笔从侄子绩得之以居肇缅思祖德且爱绩之能继志也为赋一首
413248,又赋一首
520839,又借韵自赋一首用呈诸公
963035,考亭陈国器以家酿饷吾友人卓民表民表以饮予香味色皆清绝不可名状因为制名曰武夷仙露仍赋一首
459785,予至嗜草莓，积年所啖无算，而不曾为赋一首，彼亦将有昧恩之怨。昨醉中共肖山行，新莓始茁，快饱半蓬，稍解两年之馋。夜更以之佐酒，复大醉。今乃赋此 其一
566166,东皋草堂为倪令赋一首
1063942,宋迪作八境绝妙人谓之无声句演上人戏余曰道人能作有声画乎因为之各赋一首 渔村落照
601306,马孟高将乡旋偕法南禅师携酒过别即席各赋一首
1036003,南乡子 沈强辅雯上出文犀丽玉作胡琴送元素还朝，同子野各赋一首
1070120,叶翰林有徐熙桃竹方尺许索诗辄赋一首
492621,五月十五日早赴奉天殿右角门谢恩明日出通济门登舟感赋一首
919291,更赋一首
1053406,同周元翁著作范明远秘校西湖夜泛各赋一首
377724,同周元翁著作范明远秘校西湖夜泛各赋一首
654913,草庭都尉西涯学士两以正月四日同复命奉天殿有诗纪之辄赋一首
1063935,宋迪作八境绝妙人谓之无声句演上人戏余曰道人能作有声画乎因为之各赋一首 平沙落雁
492590,过楮源访罗云从同舍弟子彦各赋一首
492374,仲冬二日由下径舆疾还珠林悼风景之顿殊幸茆庐之无恙喜赋一首
1075720,徐五十六索勤有种德二轩诗各赋一首 其二
1063940,宋迪作八境绝妙人谓之无声句演上人戏余曰道人能作有声画乎因为之各赋一首 潇湘夜雨
877680,诸人颇有和余百梅诗者各赋一首 其九 陈珽判官
492580,廿三日过石头江下访表兄萧则善因赋一首
1051828,四月七日出城西见河中资政侍郎遇中叔联骑入池南门行东北隅以归各赋一首
1052059,次张同年德父移松杉石楠海棠各赋一首 其三
948872,吉水周中显秀才相识二十馀年来求永新谭焕主簿荣寿堂诗为赋一首因以勉谭
1066513,蒙左辖复次韵见寄复赋一首
681248,亨父以梅花扇寄其门人索赋一首
791652,余在海陵诸承成斋从兄关照感赋一首
86568,听蛙方君作八老诗效颦各赋一首内三题余四十
1232960,别赋一首
478082,徐锦衣西园见招日者不赴既而有谈其胜者为赋一首致意
877685,诸人颇有和余百梅诗者各赋一首 其五 王教景长
877681,诸人颇有和余百梅诗者各赋一首 其三 鲍
742488,子乔自县中来言，书田单先生贫状，至食木叶，并邀各赋一首为赠
877688,诸人颇有和余百梅诗者各赋一首 其四 方监镇楷
948709,青衣道人罗尚简论予命宜退不宜进甚契鄙心连日求诗为赋一首
1063941,宋迪作八境绝妙人谓之无声句演上人戏余曰道人能作有声画乎因为之各赋一首 烟寺晚钟
1092902,斯远云閒睡醉天下之至乐也约各赋一首寄昌甫 其一
1063936,宋迪作八境绝妙人谓之无声句演上人戏余曰道人能作有声画乎因为之各赋一首 远浦归帆
466273,予至嗜草莓，积年所啖无算，而不曾为赋一首，彼亦将有昧恩之怨。昨醉中共肖山行，新莓始茁，快饱半蓬，稍解两年之馋。夜更以之佐酒，复大醉。今乃赋此
1235268,虞博士扁所居东西曰陶曰邵以寓尚友古人之意各赋一首
936090,昔人有画醉僧醉道士醉学究者皆见于传记及歌诗中予暇日为各赋一首 其一 醉僧
496417,玉蝴蝶 梁生镇园亭有兰名玉瑚蝶，即席赋一首
1088876,鄱阳史君王龟龄闵雨再赋一首
1063937,宋迪作八境绝妙人谓之无声句演上人戏余曰道人能作有声画乎因为之各赋一首 山市晴岚
877683,诸人颇有和余百梅诗者各赋一首 其六 三山林天麟
936289,故蜀别苑在成都西南十五六里梅至多有两大树夭矫若龙相传谓之梅龙予初至蜀尝为作诗自此岁常访之今复赋一首丁酉十一月也
1120917,徐五十六索勤有种德二轩诗各赋一首
562035,壬子春二月既望乘君子材拈余重游殳山遂燕陆景远氏来青堂与者丁一鹤董祖南景远父子及余季子翱一觞一咏不啻兰亭之会也酒半移尊公主墓侧而董海翁亦至子材遂大醉卧石上不能起命两童掖之登舟余与众客至东山兴尽而返目赋一首以纪其事云
459787,予至嗜草莓，积年所啖无算，而不曾为赋一首，彼亦将有昧恩之怨。昨醉中共肖山行，新莓始茁，快饱半蓬，稍解两年之馋。夜更以之佐酒，复大醉。今乃赋此 其三
878377,听蛙方君作八老诗效颦各赋一首内三题余四十年前已作遂不重说倡言别赋二题足成十老 老吏
492554,八月二十五日夜偶阅地图至西川崇庆州因忆子启王太守感赋一首
524673,正月乡饮赋一首
