1083148,求道人示诗粲然有江湖间道人风味盖尝得句法于东溪可今以其韵作诗送之时将如瑞峰期朝夕还吉祥云
452652,船舶大厦见乔木而盆栽尝得句飘摇人堪恨供赏只自疑今于汤臣中心复见之因补足其意
246023,船舶大厦见乔木而盆栽尝得句飘摇人堪恨供赏只自疑今于汤臣中心复见之因补足其意
962427,临川吴子达以揲蓍游成都访余寺中见堂上晦翁像作而曰向亦尝得见之且见问蜀之易学子云以来代有其人近世何如某叹其用意精切拳拳如此因为出数语以勉之
1079559,潘邠老尝得诗云满城风雨近重阳文章之妙至此极矣后托谢无逸缀成无逸诗云病思王子同倾酒愁忆潘郎共赋诗盖为此语也王子立之也作此诗未数年而立之邠老墓木已拱无逸穷困江南未有定止感叹之馀辄成二绝 其二
854979,十月十日访琳道人于禅静寺与之徘徊泉石间甚久道人云有大龙团藏亦数年食且几尽因出刀圭许而龙躯仅馀一爪色理极苍古又云赵清献公尝得须菩提画像乃张画壁间煎所谓龙爪以饷仆迫夜来归坐县之东堂见月奉寄一首
1079558,潘邠老尝得诗云满城风雨近重阳文章之妙至此极矣后托谢无逸缀成无逸诗云病思王子同倾酒愁忆潘郎共赋诗盖为此语也王子立之也作此诗未数年而立之邠老墓木已拱无逸穷困江南未有定止感叹之馀辄成二绝 其一
1077804,余筑室梁溪之上三年而后成手植花木甚众遭值世故未尝得安居其间岁暮羁旅慨然念之因和渊明时运诗以见意
1109949,潘邠老尝得诗云满城风雨近重阳文章之妙至此极矣后托谢无逸缀成无逸诗云病思王子同倾酒愁忆潘郎共赋诗盖为此语也王子立之也作此诗未数年而立之邠老墓木已拱无逸穷困江南未有定止感叹之馀辄成二绝
965602,双井咏水仙有妃子尘袜盈盈体素倾城之文予作台种此花当天寒风冽草木萎尽而孤根独秀不畏霜雪时有异香来袭襟袖超然意适若与善人君子处而与之俱化乃知双井未尝得水仙真趣也辄成四十字为之刷耻所病词不能达诸君一笑
908480,晚步江浒有得鼋大如箕赎放之邻叟言此家前数日已尝得一煮之通夕旦发盎视之鼋忽引首以水喷其面兹亦可惊异者作是诗以为好杀者之戒
275605,丑奴儿·图禺生尝得柳敬亭平话稿本，以诧黄季刚，遂秘不复出
832956,新雁过妆楼 张山荷尝得薛镜于吴市。背錾思娟小印，索书娟镜楼榜，媵之以词
1012552,吴傅朋郎中书来尝得李伯时所画震旦第一祖西归像相需以赞说偈寄之
404863,鹧鸪天·蒋谷孙属题篝香勘碑图，谷孙尝得唐薛少保书隋信行禅师碑孤本，一时名辈为写图张之，以吴湖帆所作最得情旨
934239,黄昏小雨中暂憩苍头在傍云初未尝得瞑予乃甚适若熟寐者作五字记之
882701,予顷至鄞中常馆同叔之筠轩修篁交阴奇石中峙清风爽致袭人肌骨今年夏又假榻数夕尝得小诗以示同叔因其通书写寄池阳郡斋
267742,新雁过妆楼·张山荷尝得薛镜于吴市
