107198,九月初六日客报吾州初一日大火城中俱尽吾家
979816,三月十一日大阅偶作三绝句 其二
562348,赤城吕徽之博闻强识宋亡遂晦不仕一日大雪中至巨家易谷立堂下久之堂东偏众客方咏雪有分韵得蝶字者艾思不就徽之不觉失笑咸诘之曰汝何笑曰吾欲用滕王蛱蝶事耳众客皆惊阴知其为徽之也延之坐不可欲赒以谷辞既去使人尾之至其居地极幽阻及雪霁候焉荆扉竹屋不蔽风雨见桶中坐一妇人盖其妻也问徽之所在曰出捕鱼矣得于溪上具言所以来之意曰诸子可少留乃换酒共饮返宿道傍大楼下主人怪舆马之盛因言其状主人亦不知有徽之也明日求之则已迁居矣徽之
400407,浪淘沙 三月一日大雪喜作
676450,二月一日大雪同孔加鲁仲公瑕嘉弟游虎丘
660255,立春前一日大雪用前韵志喜
116724,寒食前一日大雨不止
752490,二月十一日大风雨雪
974890,重阳前一日大风雨
1036106,洞仙歌 余七岁时。见眉山老尼。姓朱，忘其名，年九十岁，自言尝随其师入蜀主孟昶宫中。一日大热，蜀主与花蕊夫人夜纳凉摩诃池上，作一词。朱具能记之。今四十年，朱已死久矣，人无知此词者。但记其首两句，暇日寻味，岂洞仙歌令乎，乃为足之云
245363,六月二十一日大雨数里外旱如故是岁淮浙皆大
797012,探芳信 重九前一日，大兄赴城北买菊归，各赋小词记事
918235,六月二十一日大雨数里外旱如故是岁淮浙皆大旱
882671,七月十一日大雨次日又大雨
133262,重阳前一日大风雨
1125188,三月十一日大阅偶作三绝句
316238,浪淘沙·三月一日大雪喜作
923235,润守修撰见招与左丞王公大夫俞公东园集会宾主四人更无他客某顷为南都从事值故相杜公与王宾客焕毕大卿世长朱兵部贯冯郎中平同时退居府中作五老会一日大尹庐陵欧阳公作庆老公宴而王毕二公以病不赴中座亦只四人某时与诸僚同与席末言念往昔正类今辰然自皇祐庚寅迄今元符己卯整五十年矣抚事感怀辄成七言四韵
979817,三月十一日大阅偶作三绝句 其三
371936,初十夜雨十一日大雨呈赵守
540776,乙丑正月二日慎脩北赴礼闱十一日大雪怀思
907812,浣溪沙 其二 山中清明后一日大雪
288851,东日·一日大田宿
896664,竟陵酒官舍北有数步草岁寒霜落犹郁然也予为障其风霜暮冬尚自如一日大火焚舍无遗复往寻草不复有矣
384287,二月一日大雪同孔加鲁仲公瑕嘉弟游虎丘
132918,将往襄阳一日大雨
731678,立秋前一日大风雨自朝抵暮不止石塘水溢屋瓦苔生涛拂长松蜡翻蕉叶台上对之眉宇生快遂命酒与家人饮作长歌下之
298322,探芳信·重九前一日，大兄赴城北买菊归，各赋小词记事
979818,三月十一日大阅偶作三绝句 其一
1093784,初十夜雨十一日大雨呈赵守
897294,寒食前一日大雨不止
1074903,八月二十一日大热夜半微凉
840346,族弟一元性嗜饮日在醉乡居近港河河畔有田赁与人陶岁取租若干为酒赀一日大醉往陶家索钱至陶侧而踣久不起人视之死矣其人无父母无昆弟无妻子族人议即死所而埋之陶侧噫合刘伯伦郑文渊为一人殆隐于酒者欤作诗以吊之并邀石公同作
184291,七月十一日大雨次日又大雨
1134392,九月初六日客报吾州初一日大火城中俱尽吾家亦尽七八九报皆然初十日始报吾家幸免拆毁屋十馀间二十五日得王山长亲家书始知仅存州治州仓州学书院吾家免焚馀所免不过数十家
974855,将往襄阳一日大雨
149875,三月十一日大阅偶作三绝句
632887,腊月一日大雪病中口占
