1058441,元丰六年正月二十九日季壬生徐元立以诗来贺用韵酬之
667390,九月十一日北野携酌徐元大池亭宴集
1076660,徐元美甲第新修同诸公赋诗
102685,徐元用使君与其子端常邀仆与小儿过同游东山
170865,蜀先主·徐元直去马超来
1250235,建业为友生徐元明题骢马图
731117,病中偶尔问及工部尚书翰林院掌院学士徐元梦乃同学旧翰林康熙十六年以前进士再无一人矣率赋一律以遣闷怀
60341,月下新桐喜徐元叹至
736775,赠徐元叹
922406,徐元用使君与其子端常邀仆与小儿过同游东山浮金堂，戏作此诗
948933,徐元敏察院顷和子中兄长篇语颇相属今承出使交广次韵送行兼简经略刘文潜
501390,同徐元徵钱德元酒边即席题壁间山水
990638,依韵和徐元舆读寄内诗戏成
105054,依韵和徐元舆读寄内诗戏成
653767,题徐元玉莲塘胜赏词后
330452,徐元美甲第新修同诸公赋诗
94516,引见前一夕寓宿徐元达小楼元达招符君俞
1058363,徐元立出示李父龙角水壁诗邀予继作因成长篇
628843,题徐元祥清槐居 其二
872124,鹧鸪天 庆徐元寿生子
294333,落花拟徐元叹
948628,次韵徐元敏榷货同年
583486,送义官都阃徐元楷
950374,沁园春 挽徐元杰
628842,题徐元祥清槐居 其一
1208516,徐元庸寒泉庐
872083,渔家傲 其一 送李惠言、徐元集赴试南宫
471739,月下新桐喜徐元叹至
738301,落木庵吊徐元叹先生
347632,元丰六年正月二十九日季壬生徐元立以诗来贺用韵酬之
103797,发丹阳後寄徐元舆
152194,次韵徐元敏榷货同年
1228362,子久为徐元度卷
93471,宿徐元达小楼
1230461,题黄子久为徐元度卷
341074,从徐元上乞硖石山泥
841729,落花拟徐元叹
914050,引见前一夕寓宿徐元达小楼元达招符君俞胡季永小集走笔和君俞韵
172963,田畴·徐元宛似历山中
104169,寄建德徐元舆
788272,赐大学士徐元梦
991515,寄建德徐元舆
993046,徐元舆见邀与诸君同游至峰山溪上作
991875,发丹阳后寄徐元舆
691066,题徐元祥清槐居
151994,徐元敏察院顷和子中兄长篇语颇相属今承出使
628595,青楼曲戏代酉校书寄徐元度
105342,徐元舆见邀与诸君同游至峰山溪上作
915636,宿徐元达小楼
732303,怀徐元叹
