742274,余性爱菊衙斋隙地皆种之并多栽盆盎以待花时玩赏比移官黔中犹携数种以来惟衙署近山闲庭褊小又为荒池所占余则枯竹数竿芜秽木石而已无地可艺菊也乃购瓦盆分植之惜其太少又于荒池种荷以补其缺今小叶如钱已浮水面徘徊吟望率成一章
447323,读龙生兄忆昔四绝句隐括成一律
280426,新春偶成·一从西走避胡沙
580759,新都杨君铅山费君全州蒋君同邑张君钟君有世讲之会而吾弟叔永与焉特作此小诗用识老怀喜乐之意诸君他日更倡叠和联成一轴并请吾石淙石斋二老先生各为训戒法语于前后又安知此轴不遂为通家之张本也哉
796096,留春令 偶阅花蕊夫人宫词，内藏垂丝海棠花瓣，尚系七年前所收，感成一词
1070709,琼惟水东林木幽茂予爱此三士所居虽无亭馆之胜而气象清远连日水涨隔绝悠然遐想各成一诗目为城东三咏 其一 杜公司法
585739,已酉三月廿五予卧病潘进士直卿槐告别索予赠言呻吟之间遂成一绝赠之还邕州
570048,三月三日屋后桃花下与儿子小酌红酒因忆昨岁从吴明卿诸楚人于弇园褉饮遂成一排律
889281,赵默卿用拙者所和乐天七旬诗赋二篇见寄因状山中之景复成一首以报之
300223,先大夫乙丙遗书李范之丈命题斋心竟日敬成一首戊午十月九日夜中
451795,北游以来久无诗车中忽忆辞乡情状漫成一律
817775,九月晦夜，梦中得“江上梅花影”五字，寤后续成一诗，题陈师曾水墨兰石
754488,闺友戏呼余为女书痴偶成一绝聊以见志
428215,甲戌四月一日重到西湖感成一律
379638,复用韵成一首特作狡猾尔勿诮吾作梦也想当一笑
778202,金缕曲·沈日初比部以尊公菊庐先生醉菊遗图索句。忆曩在归云堂醉白池时，与先生相见，册中诸老大半与光殷勤奖借。光初昏时，研北丈为词以贺，紫眉丈尝为光模印，桐君鸿甫小田朗如诸老皆屡同觞咏，芝房贳甫又同时睥睨者。今风流歇绝，展卷怃然。同治癸酉与日初聚于京师，追次研丈词韵，勉成一阕，不觉感慨系之也
424869,移入南洲新居复成一律
569058,余老乞骸而汝师大司成亦在告聊成一章问之
15010,衢州徐员外使君遗以缟纻兼竹书箱因成一篇用答佳贶
862986,德茂以两小篇报聘再成一章
452081,与仰翁一得剑尘剑川水月赴丰城于桂山书院小坐依剑川兄命口成一律并书
967608,积雨初霁乘兴邀王和叟赵久成二监郡游南山饮于云间阁因成一诗醉书于石壁
388444,余旧游魏郡日有双鱼之馔今绝不可得问之则河徙故也戏成一章
323319,归宗枞老言庐山有对云简寂观中甜苦笋归宗寺里淡咸齑予因以汤泉石镜戏成一绝
241418,偶得兄字再成一诗
1188800,翁文尧以美疹暂滞令公大王益得异礼观今日宠待之盛辄成一章
762338,最后买得荔枝，友人言味少逊，率成一绝
1071971,六月二十一日子文待制见访热甚追记馆中纳凉故事漫成一首
518042,邻家伐去墙外柳戏成一绝
939138,行崧岭将半下瞰山中一人家似不与世接者凝伫久之因成一绝
1122374,一年佳节惟立春元夕并在一日亦盛事也灯火笙簧处处有之斗城且尔况京都乎追想旧游成一诗聊摅郁郁
1079464,连日与一上人会话密庵清坐附火乃有山居气息因成一诗奉呈
1085639,初入巫山界登罗护关云雾晦冥默祷之因成一绝
851235,张元帅谓予国已亡矣杀身以忠谁复书之予谓商非不亡夷齐自不食周粟人臣自尽其心岂论书与不书张为改容因成一诗
1247049,五月十六夜汲扬子江心泉煮武夷茶戏成一绝
434463,望月婆罗门引 晨起与仲坚偶坐少焉雨作其声洒洒然绝似文场下笔时因借前韵戏成一篇
570823,大宗伯姜公倡诸公祈雨澍应偶成一绝奉览蒙赐迭四章不揣鄙陋辄依韵补上忘其续貂恐蹈蛇足不知群公能遂翕如成此胜事否 其二
1010593,閒居多暇追叙旧游成一百十韵
618830,家大人手构二亭间树松竹颜曰晚翠曰知津暇日经过长吟野望令人有濠濮间想因成一律
938106,再用迹字韵成一首呈判府
827332,教师节，本校开五周纪念会有京剧六出各成一绝 其四 女起解
828654,梅泉诗来引用唐昭宗谓韩渥朕左右无人之语偶有所感遂成一绝句
798249,一剪梅 其一 意有所触辄成一词，美人芳草不无寄托之辞，商妇琵琶，惟以悲哀为主。
251491,第二届国诗大赛忝为评委凡两阅月蒇事顷赴潮州参加颁奖仪式先成一律却寄与会诸公
641444,奎倚席渭城校室伏承耕学袁公雪樵秦公二先生远自故里寄惠新诗教诏之谊暌离之情备溢乎辞捧诵再四感愧交并不能已已既次严韵属和奉怀因兴起丰城云门河南公武潜夫诸先生例借前韵各成一首以见区区向往之私至于落句嬴瀛互用亦足明仆于二先生无少偏党也 其六 公武
421465,满庭芳 晚间济生连作二词，追悼旧游，感愤时局，凄音苦节，令人不忍卒读。仍用前调前韵和成一首，以通其怫郁焉 其二
1032551,闻报自崖徙雷成一章
798250,一剪梅 其二 意有所触辄成一词，美人芳草不无寄托之辞，商妇琵琶，惟以悲哀为主。
1231405,六月十七日夜坐李宁之忽得风急落流萤之句遂命足成一律
817985,除夕集小画舫斋诗钟得磨画二字夜深归舟中续成一律明日简与会诸子
828648,年来了无诗兴不成一字夜读东坡海外诗若有所会率成四首 其四
569471,偶得桃花坞而竹逾胜遂成一律
595253,旋家后有怀陈年兄再成一律
758199,采桑子 正咏秋海棠，表妹张夫人适以此花见赠，更成一词
222893,石室閒坐忆东坡渔舟一叶江吞天句成一绝
660075,雪湖见过冒雨而归漫成一律奉寄
446242,脱化东坡句衍成一律兼赠梅兮若
537870,余旧游魏郡日有双鱼之馔今绝不可得问之则河徙故也戏成一章
637047,余自虔入闽赠明府张次元一律后公寄我以诗盖悔黑海之飘溺而世网之难出也然顺水张帆每荡神志惟逆风按棹益验骨力历观古锥无不从荆棘林中打开通天大路乃依前韵复成一首答之
498483,端己韬仲斋头谈诗听曲把酒焚香之乐可计日待也先成一诗以坚来约并呈孝先时秋试甫竣
429653,踰白家滩五里始见杏花绵延十馀里抵大觉寺玉兰二株高出屋脊花光艳绝为成一诗
987918,西垣致斋日因成一章呈二相公
420098,醉垂鞭 夹竹桃将放，慢成一阕，以代奚奴羯鼓
514362,朝陵岁例同寅必有赠行诗以倡和为礼今次独无知我不工于此也往来三宿皆天日晴暖诗景满前竟不能措一辞诚如诸公所料行馆早起漫成一律志愧然继来者免我引玉之劳又不能不自幸也
440995,戊寅秋雨作书与子锋至中夜书末信笔成一绝
568990,有荐新蚕豆樱桃麦蚕者邀印师共尝之戏成一章
845490,此游淡岩同成一诗敢用拜呈
520368,新丰盖象丰也汉高斯举其亦孝矣予经是地而闻鸡鸣犬吠之声俨有太平气象第未知太公当日果不思丰否亦不知新丰市上犹有斗酒濯足者乎因成一诗以写兴云
942108,圭示急须制作亭当喜成一绝
400203,探春慢 壬寅开岁九日，与陈永正拿小舟薄游城南诸村，残寒栖树，秾李待花，影事梦痕，顿呈心目。爰成一解，并拟梅溪
803277,读赵忠毅公制艺文漫成一律
376734,藤簟·打成一片凝如水
737831,东园产芝秋暑未能往观先成一律柬二兄
888952,二公见和又成一首寄之
22206,笙·董双成一妙
598392,曙台惠诗久稽裁答漫成一首谢过
628544,先文烈兄没产复勘偶成一律
569800,观奕者周生与朱茂才奕偶成一律赠周
1038709,兴州长举县西二十里阁道立表曰飞石阁告往来者急度勿停予赴益部兴州将吏来迎皆至长举因访老吏飞石之状云昔尝有之亦飘风暴雨之时也予望山顶皆已垦耕而行人熟虚名至是皆驰过因成一绝
302458,漫成一首寄区生得潜
442972,旅途间季子约以翻书作诗恰翻得何其芳先生《偶成》一律因以即景为题步其韵
570584,小病愆花期唯牡丹在耳次公将有豫州之行更成一绝句
283142,偕内子挈儿女游莫斯科近郊阿汗格司克宫偶成一绝
310076,偶成一绝·热念每从伦内伏
80733,六言·爱马能成一癖
404964,忆旧游·伯端丈五十年前侍太夫人课读花下。适有落瓣飘坠，拾置卷中。今检旧帙，睹色转淡黄，理如蝉翼。因赋此调，约社侣同作，余漫成一阕
222202,西垣致斋日因成一章呈二相公
219625,庚辰录譬如结款他日打断得了方成一段公案耳
947544,听吴毕闻讲杜诗今夕行因效释子偈体成一绝
520404,自曲江而来有浮屠耸立于霄汉间者则雁塔也寺曰慈恩尚仍唐扁但钟鱼之盛车马之游则相去远矣漫成一诗聊用吊古云耳
829477,年来了无诗兴不成一字夜读东坡海外诗若有所会率成四首
833678,骤雨打新荷 伏日连雨，清冷如深秋，漫成一阕，即元遗山《小圣乐》也。壬寅七月三日
802130,冬日村居读靖节先生日月依辰至句遂演成一律
641443,奎倚席渭城校室伏承耕学袁公雪樵秦公二先生远自故里寄惠新诗教诏之谊暌离之情备溢乎辞捧诵再四感愧交并不能已已既次严韵属和奉怀因兴起丰城云门河南公武潜夫诸先生例借前韵各成一首以见区区向往之私至于落句嬴瀛互用亦足明仆于二先生无少偏党也 其五 河南
415643,平江谒杜少陵墓，偷墓前半联，凑成一律，聊以述怀
