581462,祭墓见乞者可笑因成一绝
861318,饮阑月上不能留客再成一篇
1002154,中书程先生委校勘春秋分纪大参李雁湖文集因元夕戏成一绝
817708,漫成一首寄区生得潜
427758,月华清 癸巳中秋后一日湖帆有和洪叔玙之作，其年七月初二日为湖帆六十初度，因用原韵补成一阕寿之
339419,偶集·偶来成一笑
1224026,从兄德观父与集同出荣州府君宋亡隐居不仕而殁集来吴门省墓从外亲临邛韩氏得兄遗迹有云我因国破家何在君为唇亡齿亦寒不知为谁作也抚诵不觉流涕因足成一章并发其幽潜之意云
1000176,走笔成一篇答徐君先辈见寄
428828,来往哈密始成一诗
296006,岁暮旅居·客舍真成一事无
539964,省坐无赖阅杂册花草禽鸟凡十六色各成一绝漫题其后 其一 凌霄花
938998,读书傅氏揖桂林外一山恍如徐子融书阁所见书阁见山之阴揖桂见山之阳戏成一绝呈子融
258892,活成一个人
520364,骊山之温泉即唐之华清宫也以路当孔道而浴者殆无虚日予奉诏赐浴而且遂游观之乐其感戴圣恩宜何如哉谨成一律以贻诸缙绅云
581547,再成一首
323283,元宵邻里携具就弊庐张灯辞之不获因成一绝
532358,同马师山访山斋先生于蒲坂别墅晚游戴家水亭师山有作索和漫成一首
210669,三高祠·一为功成一见几
925382,观胡文恭枢密全集偶成一首
568957,黄宪子先辈弱冠受知吾家敬美今年秋闰过吴门扁舟访我弇上出所撰临华新草及北征稿读之盖洋洋矣赋虽吐一斑足窥全豹灵光洞箫将来当不过此至于近体出入初中时挟梁栋之气不耐点检恐指南之车切玉之剑未便可已也仆既钦其才美其志因成一章以效微箴宪子当不逆耳哉
264526,中宵偶成·一清无过中宵茗
1160118,赴和州于武昌县再遇毛仙翁十八兄因成一绝
539969,省坐无赖阅杂册花草禽鸟凡十六色各成一绝漫题其后 其六 虞美人草
1084568,周德远植瑞香于窗前戏成一绝
1118689,三山卜居今三十有三年矣屋陋甚而地有馀数世之后当自成一村今日病少间作诗以示后人二首
888597,予赴官当涂绝江而西夜宿慈严秉烛游三洞时主僧出示诸公留题因用乐天韵成一绝
961626,一年佳节惟立春元夕并在一日亦盛事也灯火笙簧处处有之斗城且尔况京都乎追想旧游成一诗聊摅郁郁 其二
520360,细柳营实汉文劳军之地也予读汉史而追思其事若亚夫者可谓真将军矣彼棘门灞上之军有如儿戏者岂可同日而语哉因成一绝以吊亚夫云
820170,明日再集分韵得急、春字各成一章 其一
984765,邛州西岩轩阁陋甚抡仲知府舍人侍殿撰公来游惜其颓敝乃更新之既成以书招印同游因成一章
1061240,复用韵成一首特作狡猾尔勿诮吾作梦也想当一笑
569566,迎春日对酒客有谈一岁两春及中秋再闰者漫成一律
298811,偶成·一轮皓魄海东来
255913,偶成·一番瘦笋羽林枪
888899,置酒与五客饯行因成一绝
841469,舟泊浒墅关梦得两绝句晓起仅记野烟句因足成一绝
299182,诗韵·讲幄蒸成一室春
1088863,月之四日至南陵大雨江边之圩已有没者入鄱阳境中山田乃以无雨为病偶成一章呈王龟龄
641346,临濠严守按行东屯有唱酬之什惜未之见漫成一首兼简吕簿
428023,满庭芳 甲辰立冬前五日侵晓，漫成一曲寄谢子异诗家远贻药物，兼简公渚教授青岛
681765,偶得红菊一本置之盆中遂成一首
456566,率成一律寿水底鱼
562149,庚戌中秋九思主人置酒予洎景渊副使子仁理问同会时风雨骤作抵暮旋止天无馀滓华月东出相与联句千馀韵皆大醉就寝遂忘所咏因复成一律
446084,南徐昨晚新惠浣溪沙，忽得谬许知音一句，今晨足成一律
1000114,诘朝雨寒密雪杂下辄成一篇呈诸匠者幸赐光和
426376,丁己端阳适逢长至乐成一律
328883,璧上人欲行为雨止戏成一绝用前韵
146117,七月十三夜用灯牌字韵凑成一诗与诸宾一笑
323318,游南山入康谷以不观谷帘泉为恨南康李守致上尊乃此泉名也戏成一绝
536835,案头苏诗一编偶展读之有云龙钟三十九劳生已强半岁暮日斜时还为昔人叹公倅馀杭日作盖取白乐天语兴感也此公尚为摇落语吾辈宁无穷途之恸因成一章兼示舍弟虽然公兄弟名位穹显晚节各天而吾以早废弃故相守田亩间差为优耳他固不敢较也
412084,成都道中闻陈宝毕业中大外文系应南开中学聘率成一律寄示
938914,九月十一日挈浩同省先陇早起四山昏翳冲雾露涉水登山至山颠则日已东上澄空朗然下视村中雾犹蒙罩人烟桑柘皆不可辨戏成一绝
400982,立秋日悠然肇仓小周枉过并同游北海次日得罗振玉联一副文曰岁事既登有禾有黍好宾方集以燕以游如纪昨盛欣成一律呈三公
539973,省坐无赖阅杂册花草禽鸟凡十六色各成一绝漫题其后 其十 子规
569527,德甫居太夫人忧致诗见慰悲激用壮聊成一律为答
409756,疏君通甫以所藏金梅僧遗画长卷属题，通甫笃于故旧，而予亦不无宿草秋风之感，遂成一律
839312,偶成一绝
468366,庚戌秋七月中山刘坦之先生补注选诗辞简而事明论切而指达正五臣之荒谬黜苍山之浅鄙撷花采实成一家言盖可以行今而传后者也诗以美之
895006,庾岭旧传有梅往往诗人借此为江南春信予到此数年因登岭上不见一枝遂成一绝
1247048,程国宝有诞孙之庆留饮欢洽醉中谩成一绝以谢
641442,奎倚席渭城校室伏承耕学袁公雪樵秦公二先生远自故里寄惠新诗教诏之谊暌离之情备溢乎辞捧诵再四感愧交并不能已已既次严韵属和奉怀因兴起丰城云门河南公武潜夫诸先生例借前韵各成一首以见区区向往之私至于落句嬴瀛互用亦足明仆于二先生无少偏党也 其四 云门
548244,丙子春梦得一联足成一绝
965313,余用十字为座右铭因足成一首
1243759,午窗睡起偶吟閒花落砚池小儿汝廉率尔应声曰香絮粘棋局遂足成一律
545477,次夕饮酣永叔得句云柝声频入夜霜寒余为足成一律时仲子弼侍坐而余于司空为年家
429244,再成一律呈太夷兼谢题赠之作
772199,元宵延陈榕士、叶松潭、郑贞甫茂才、家薇臣上舍宴赏龙灯烟火诸戏，竟为风雨所阻，不胜懊闷。漫成一律，并示诸君子
1190721,己巳年正月十二日自沙县抵邵武军将谋抚信之行到才一夕为闽相急脚相召却请赴沙县郊外泊船偶成一篇
414492,前诗既成而遐想未已复成一律
883795,涪州江心有巨石隐于深渊石傍刻二鱼古记云鱼出岁必大丰端拱元年十二月十有四日昂自瞿塘回遵途于此知郡琅琊王公□云石鱼再出来岁复稔昂往而观之果如所说因歌圣德辄成一章
386476,读赵忠毅公制艺文漫成一律
1085381,何子应以蜀中文房四宝分赠洪景卢王嘉叟某与焉因成一绝
772950,台阳笔记题词用陶韵又成一首
258454,蝴蝶-如果我们现在变成一对款款的
777927,清平乐·夕诣青龙潭汤池，适一粲者自池中出，华清初洗，春意焕然。戏成一阕赠之
297479,偶成·一命千金价不多
961628,一年佳节惟立春元夕并在一日亦盛事也灯火笙簧处处有之斗城且尔况京都乎追想旧游成一诗聊摅郁郁 其三
540170,得宋拓右军帖上卷绝佳而大令帖不至戏成一绝
1038247,贤大师以诸巨公画像见示传神写照曲尽其妙兼丐拙诗辄成一首奉呈
807262,满江红  余有怀仲震词，南耕昔在南昌，亦与仲震同作老客，遂次余韵，亦成一首，斐然见示。仍叠前韵，用柬南耕，并令仲震他日读之，一轩渠也
538919,宗伯董丈枉饮岘山泛碧浪湖时范太史伯祯陈都谏体乾在坐太史将赴召北上宗伯遂成一章予嗣得其二一用公原韵一用近赠公韵 其一
570819,宗人光禄华松鸿胪王继山邀余于王贡士园看牡丹后复同光禄看芍药戏成一绝
390053,徐生号云樵而以叶子雪樵书为介走笔戏成一绝句
1113871,戊辰冬与邻士纵步至吴由道书会所课诸生作梅花诗以先字为韵戏成一绝句后三年由道来昌化索前作复次韵三首并前诗赠之
788352,朕御极七载宵旰万几未遑他出己酉夏因命将远讨誓师于南海子缅怀曩日侍奉皇考巡幸此地色笑俨在目前而龙驭杳然邈不可攀俯仰徘徊曷胜今昔之感爰成一律以述追思
641441,奎倚席渭城校室伏承耕学袁公雪樵秦公二先生远自故里寄惠新诗教诏之谊暌离之情备溢乎辞捧诵再四感愧交并不能已已既次严韵属和奉怀因兴起丰城云门河南公武潜夫诸先生例借前韵各成一首以见区区向往之私至于落句嬴瀛互用亦足明仆于二先生无少偏党也 其三 丰城
338378,兵燹后五年不墓祭矣，成一律寄伯兄
798240,薄媚摘遍 前词甫脱稿，闻竹樵方伯行至安肃，笙鹤来迎，为之投笔泪下，因又成一首嗣后，词兴阑珊矣
1079472,沈宗师甚喜江梅而微贬酴醾因成一绝
520357,灵台之下有灵沼焉然物换星移而无复于牣之兴因太息久之亦成一绝
362433,泊舟盐桥儿子洙辄于市买历尾题云客里其如日费多因取笔足成一诗
958007,老翁真个似童儿汲井埋盆作小池退之句也去岁用此尝为小诗云半区茅屋裹疏篱无地容盆作小池祗有案头翻笔墨老翁髣髴似童儿邻舍老近以石方盆见借可容水三升置小鱼其间终日观之不厌复借退之全句成一绝
780598,梦得“东海潮来月怒明”之句，醒，足成一诗 又成一诗 其二
780598,梦得“东海潮来月怒明”之句，醒，足成一诗 又成一诗 其二
798252,一剪梅 其四 意有所触辄成一词，美人芳草不无寄托之辞，商妇琵琶，惟以悲哀为主。
1217075,雪中梁师孟叔原饷浑酒小饮閒窗偶成一章
1078129,夜霁天象明润仰观有感成一百韵时岁在斗荧惑在氐微甚辰镇陵犯于翼轸间夜半斗杓转占帝座未明台星尚拆云
945985,袁起岩会饮湖上出示古刻酒罢各携桂花以归因成一绝
520351,予既出楼观乃登说经台凭高纵目但觉松风满山而恍惚若闻老氏道言也且摩挲古刻而米老第一山字尤甚奇古惜从行无善绘者未能摹写其景以归姑成一诗以涤尘襟云
302261,除夕集小画舫斋诗钟得磨画二字夜深归舟中续成一律明日简与会诸子
947400,读东坡玉糁诗因成一绝续去年芋茎羹后寄丘林陈三友
945994,景元益之诸友考试旁郡余梦与步月联诗得水花初净月如银之句追成一绝
338197,同日展长嫂钱孺人墓，见幼妹附殡倾圮，复成一律
570389,徐生号云樵而以叶子雪樵书为介走笔戏成一绝句
180842,再用迹字韵成一首呈判府
569863,张左虞都尉故与余善每过弇中风流谑浪飞白无算余犹以酒客卤莽遇之后稍出其诗余稍稍称善然不觉其异也及集成而丐余为叙因赋诸友篇左虞仅居四十人之一耳去年左虞死余不能往吊以香帛寓之而无主丧者孟秋之朔偶摊书出晒于散帙中探得他诗读之不甚快最后一卷极清新丽雅之致句字有力格韵不凡而忘其谁作以集考之则左虞制也不觉失声而泣吾愧钟子期多矣遂成一七言律而会其子授官奔丧归并书诸友篇寄之俾焚于棺所逝者有知将从夜台沽酒三叫称快余亦
203435,偶成·一别京华近十年
139094,去郡登舟偶成一绝
569694,同年彭比部辂贻游仙近体见怀漫成一律荅之
948323,顷尝梦至善生院赋诗一联己丑七月十三日因游续成一绝
438088,观古作者梅诗戏成一章
934985,三山卜居今三十有三年矣屋陋甚而地有馀数世之后当自成一村今日病少间作诗以示后人二首 其二
773847,舟次澎湖偶成一律
681212,十一月二十七日夜梦楼居风雨中得句云卷帘看风树时亡妻亦在侧觉而有感续成一章
539430,道过一岭曰米花村其名颇雅因为成一绝
208822,喜雪·嘉瑞真成一旦逢
246574,入伏苦雨晚窗风入寒气袭人秋意极浓因走笔漫成一律
837659,浪淘沙·蕙风翁天春楼漫笔，有记螳螂一则。言藤本花有曰夜来香者，其叶下必有一二小螳螂栖集，纤碧与叶同色，若相依为命者。曩寓金陵岁买是花，罔或爽也。词人体物之微，即小可以见大。余笑语翁若仿王桐花句例，当云妾是夜来香，郎是螳螂矣。翁深赏是语，谓天然浪淘沙佳句也。联咏足成一解
382023,此游淡岩同成一诗敢用拜呈
790443,校贡氏科举志率成一律
828647,年来了无诗兴不成一字夜读东坡海外诗若有所会率成四首 其三
285207,题鲁迅诗·馀事吟成一卷诗
539977,省坐无赖阅杂册花草禽鸟凡十六色各成一绝漫题其后 其十四 燕
218834,读东坡玉糁诗因成一绝续去年芋茎羹后寄丘林
568583,予素不能饮酒昨至成都僚友并劝予蜀烧酒云可祛暑湿也命家童以蜜和之初吸半盏渐至引满复能加一酌极有效自后每晨起便饮饮之辄冲和与年少时苦酒迥异不意老来始知其趣乃尔日饮两三度陶如也家童惊喜谓自饮酒来颜色颇异岂于此将有所得耶笑成一绝
1042441,戏成一首
1083640,醉中偶有所感再成一绝
985710,除日暮放鲫鱼于月池者九夜再得六复秉烛放之偶合阴阳老数成一绝
295106,舟泊浒墅关梦得两绝句晓起仅记野烟句因足成一绝
139366,周相士谓予寿至九十三又成一绝
425642,卅二年春，长次二子，求学毕节弘毅中学，余应教导主任南汇谈宗录之邀，兼课图画。三月廿七日，该校师生旅行灵峰寺，余因公未往。翌日星期，萧校长吉人宴于校，席示文书清拔贡周老先生介仙留痕旅行偶成二绝，即晚忆韵草和，继知第二首未循原韵，再成一首，并录存之 其一
297887,开岁日抱璞斋小集联句至夜始归途中再成一首寄希翁
1085618,十月四日宿于沙市舟中捲帘忽见新月天色如水乡思凄然得诗一联云诗成天作纸帘捲月为钩连夕烛有花至六日家书来自临安足成一篇寄二弟
558314,客有诵予昔在淮安与异知县诗者今止记其二句用为次联足成一律以寄毕
771555,同日展长嫂钱孺人墓，见幼妹附殡倾圮，复成一律
441259,截竹为印钤一纸将寄吕三信笔成一绝
986209,重九与坚大师登坟庵新阁因忆癸巳岁此日同在益昌道中行役之劳遂成一绝
784906,偶得寒月挂霜枝之句命童子联之松坡遂成一律余即韵成书怀之作
283595,金缕曲·午夜不寐成一阕，知我罪我，所不及计
569533,程京兆汝懋视余少长别燕中者三十年矣余自郧入留棘谓得相从而竟以言罢方成一诗奉怀适太学张恒思携画索寄漫题于首
302210,东渡濒行谢英伯出示杜莲英女士杏花画幅属题率成一绝
305230,再成一律呈太夷兼谢题赠之作
264475,明日再集分韵得急春字各成一章
428732,南湖先生邮示题岱老《觚庐画萃》二首，病暑枯坐，勉成一首奉答，即写之岱老画尾。侧身天地，感不尽于予怀也
175566,闻报自崖徙雷成一章
173060,德茂以两小篇报聘再成一章
247235,梦芙蓉·秋已尽思无穷江亭促坐复成一日之欢书付履平索和
255648,总有一天我变成一棵树
826577,鹧鸪天·癸酉秋罢讲燕庠，退居西苑僦园。其地旧为扇子湖，荷花最盛，半塘老人曾有词，率成一解
641339,梦尚之彦强来问病源所在随以数语答之及觉忘记其辞因成一诗遍寄昆山学诸生且因自警云尔
539970,省坐无赖阅杂册花草禽鸟凡十六色各成一绝漫题其后 其七 百舌
699177,奎倚席渭城校室伏承耕学袁公雪樵秦公二先生远自故里寄惠新诗教诏之谊暌离之情备溢乎辞捧诵再四感愧交并不能已已既次严韵属和奉怀因兴起丰城云门河南公武潜夫诸先生例借前韵各成一首以见区区向往之私至于落句嬴瀛互用亦足明仆于二先生无少偏党也 答耕学
227049,偶成·一卷南华一炷香
1249692,中秋日玉山顾仲瑛邀翟明府份陆良贵仁秦文仲约等十人饮金粟冢上酒酣赋诗各成一首
1213795,同张尚书赵侍郎饮于长安酒肆主人从予乞对句标题予为题曰万斛香浮金掌露四时人醉洞庭春上马后足成一诗
539967,省坐无赖阅杂册花草禽鸟凡十六色各成一绝漫题其后 其四 薜荔
1077143,余赋佚老堂志宏见和复用前韵成一篇呈兴宗
186358,缘识·功成一旦等闲休
33035,览柳浑汀洲采白苹之什因成一章
456647,为孙昱东兄歌叫关率成一绝
270254,集唐人诗句成一绝
452656,文庙路小酌有狗肉锅仔戏成一律
139362,置酒与五客饯行因成一绝
198496,挽宋知县刚仲·阀阅方成一段奇
440593,第二届国诗大赛忝为评委凡两阅月蒇事顷赴潮州参加颁奖仪式先成一律却寄与会诸公
228762,天柱·削成一柱是何年
910389,张安化重阳日置酒挽同官游灵泉寺登高时适有客占牧之诗一联因缉成一首书寺垣
851089,七月十三夜用灯牌字韵凑成一诗与诸宾一笑
772360,出狱后，闻今年正月台谏诸公先后上言争台湾事，一时中外作诗著论者甚众，闺阁中亦多感咏。近传台人复有舆论之刻，自非盛朝宽大，何能有此？感成一律
95766,重阳甫近菊殊未花而木犀再开遂成一绝
425644,卅二年春，长次二子，求学毕节弘毅中学，余应教导主任南汇谈宗录之邀，兼课图画。三月廿七日，该校师生旅行灵峰寺，余因公未往。翌日星期，萧校长吉人宴于校，席示文书清拔贡周老先生介仙留痕旅行偶成二绝，即晚忆韵草和，继知第二首未循原韵，再成一首，并录存之 其三
158254,和叔以琴诗见贻因成一篇奉答
328552,送文潜归因成一绝奉寄
827330,教师节，本校开五周纪念会有京剧六出各成一绝 其二 卖黄马
520400,翠微之西有山之小者其拱秀若屏障然有沣水出于其间固可爱玩且有寺曰丰德亦可憩也因成一绝
958565,宣和丁酉太夫人终天墓庐中读金光明经见摩诃萨埵投身饲虎因缘尝以颂赞叹之绍兴庚午临封又得是经诵读复成一偈
604725,正月十五夜北宿海昏既苦无月且苦无灯京国乡邦凄然两地复成一律以纪游踪
1084455,十一月七日东山省坟因思先子昔年题壁有山光水色两依依之句，旧屋已坏墨迹不留山水依然感叹不已因成一绝
1085248,曹梦良赠炭戏成一绝
1085640,雾开复成一绝
631279,曩在海云偶得一天风雨沉山阁之句时尘异诸子侍坐命作对语尘异以万古云烟锁石门应予心异之己未八月初七入双镜楼忽忆前事正当斯时因用旧句足成一律以识梦中之境始信人之心愿原非虚设也
1006384,所居二室号书痴禅悦各成一诗 禅悦
641440,奎倚席渭城校室伏承耕学袁公雪樵秦公二先生远自故里寄惠新诗教诏之谊暌离之情备溢乎辞捧诵再四感愧交并不能已已既次严韵属和奉怀因兴起丰城云门河南公武潜夫诸先生例借前韵各成一首以见区区向往之私至于落句嬴瀛互用亦足明仆于二先生无少偏党也 其二 答雪樵
387526,曙台惠诗久稽裁答漫成一首谢过
529402,有草类藜而干生其本多绿叶至末始敷为红紫经霜更绚烂可爱一名雁来红俗呼老少年山居小阁前倚阑一株尤茂密高可文馀病起过宿相对甚适偶成一律
323132,周德远植瑞香于窗前戏成一绝
570822,大宗伯姜公倡诸公祈雨澍应偶成一绝奉览蒙赐迭四章不揣鄙陋辄依韵补上忘其续貂恐蹈蛇足不知群公能遂翕如成此胜事否 其一
539968,省坐无赖阅杂册花草禽鸟凡十六色各成一绝漫题其后 其五 萍
1099182,游东山国庆院院有明月堂白云轩土人云明月白云谢太傅所携妓小字也此出于李白忆东山诗特纪一时景色王性之记中直言明月白云二堂是太傅旧迹又误矣因成一绝以识之
249508,癸酉元朝偶成一绝代简诸诗友贺岁
641445,奎倚席渭城校室伏承耕学袁公雪樵秦公二先生远自故里寄惠新诗教诏之谊暌离之情备溢乎辞捧诵再四感愧交并不能已已既次严韵属和奉怀因兴起丰城云门河南公武潜夫诸先生例借前韵各成一首以见区区向往之私至于落句嬴瀛互用亦足明仆于二先生无少偏党也 其七 潜夫
321353,二道人以抹利及东山兰为赠再成一章
539979,省坐无赖阅杂册花草禽鸟凡十六色各成一绝漫题其后 其十六 啄木
541911,武陵蒋明府子培过邺因谈桃源之胜南都杨茂才伯海曾绘斯图并长歌见寄勉成一篇用答两意云耳
219043,听吴毕闻讲杜诗今夕行因郊释子偈体成一绝
828645,年来了无诗兴不成一字夜读东坡海外诗若有所会率成四首 其一
958540,道者寮成人为书额拟成一诗
403705,梦芙蓉 秋已尽，思无穷，江亭促坐，复成一日之欢，书付履平索和
448740,香江重见雾卉云花枨触无端偶成一绝
314306,移入南洲新居复成一律
567040,予自浙抵新安登齐云还浙道中旅馆颇多奇景而不成一字至衢自嘲一绝
181545,建炎丁未自中夏徂秋不雨七夕日戏成一诗简牛
888629,去郡登舟偶成一绝
168174,夜坐偶成·一字吟难稳
158587,走笔成一篇答徐君先辈见寄
316703,与海燕公园看牡丹以其意成一绝
313899,梦中得“秋风人对残花立”句，自谓有小山“落花人独立”意味，足成一律
958392,后圃石榴初为夏日所暴得秋雨所烂易落雀又从而窃之树间日以彫疏顾其馀尚可侑吾小饮因成一诗而摘取之
520359,予过造书台远怀苍颉因睹空阶鸟迹而犹讶其造书时也夫何鸟篆既远而字体变化真如浮云矣彼以俗书逞遒媚者得不知所自欤因成一绝姑以吊造书者云
324398,雪中遇胡烈臣归自郴阳戏成一绝
18144,编集拙诗成一十五卷因题卷末戏赠元九李二十
1078319,宿疏山戏成一绝
1215831,黄岩盛景则来为吾郡征官见示诗文因成一章
1085791,至瞿唐关戏用山名成一绝
327870,楼居偶成·一竿晴旭上帘钩
520356,予闻文王之作灵台盖以望氛祲察灾祥也且其倏然而成若神灵之所为者故以得名诗不云乎彼美人兮西方之人兮因经台下谩成一绝以寓景行之意云
539972,省坐无赖阅杂册花草禽鸟凡十六色各成一绝漫题其后 其九 鹊
268206,前诗既成而遐想未已复成一律
593630,余与尧文俱不能酒尧文善奕工书余于二技尤拙而暇即时时过从不厌也戏成一诗示尧文
571021,西堂对菊铁翁先生偶得颓龄欲餐菊黄白何所分二句遂令足成一诗云
1157982,润卿鲁望寒夜见访各惜其志遂成一绝
15331,赴和州于武昌县再遇毛仙翁十八兄因成一绝
1043647,合加字韵两篇二十四字成一章更互次之咏曹之土风并叙出处寄呈司年职方
1085303,黄岩赵十朋贤士也有诗云四枚豚犬教知书二顷良田尽有馀鲁酒三杯棋一局客来浑不问亲疏予亦有东皋二顷，两子皆学读书客至则弈棋饮酒遂用赵君诗意成一绝
425643,卅二年春，长次二子，求学毕节弘毅中学，余应教导主任南汇谈宗录之邀，兼课图画。三月廿七日，该校师生旅行灵峰寺，余因公未往。翌日星期，萧校长吉人宴于校，席示文书清拔贡周老先生介仙留痕旅行偶成二绝，即晚忆韵草和，继知第二首未循原韵，再成一首，并录存之 其二
539974,省坐无赖阅杂册花草禽鸟凡十六色各成一绝漫题其后 其十一 鹤
660832,士修惠左传一部已为峡水所坏后加装潢又几为风雨所漂因成一绝
683491,宗伯董丈枉饮岘山泛碧浪湖时范太史伯祯陈都谏体乾在坐太史将赴召北上宗伯遂成一章予嗣得其二一用公原韵一用近赠公韵
1085687,元章赠笔戏成一绝
277689,重九卧病忆兄弟，前年是日雨，在长安与姊联句寄怀，因成一律
1085528,归宗枞老言庐山有对云简寂观中甜苦笋归宗寺里淡咸齑予因以汤泉石镜戏成一绝
228569,晚坐偶成一绝
158963,诘朝雨寒密雪杂下辄成一篇呈诸匠者幸赐光和
424817,乱中于枫岭得遇俞镜流林秋湘挑灯言愁成一律用前韵
774745,癸酉1813冬夜翔儿入梦哭成一律
995345,予去岁在长沙数与处度元实相从把酒自过岭来不复有此乐感叹之馀戏成一绝
461564,初夏日幻庐金水二兄来信阳草成一首先呈
728471,八归  二月十一夜风月甚佳，过水水绘园听诸郎弦管，灯下因遣家信，凄然不成一字，赋此以寄闺人
614973,刘约我孝廉先刺史莫逆交也余壬子冬之官孝廉觞余江上丁巳返棹孝廉已没兹来墓木拱矣令子宗鲁美秀而文握手道故愀然有感漫成一律
762571,戏成一绝
520354,予好奇者每邂逅山水之胜辄注目焉及抵鄠县则逼夜矣聊成一诗以自笑
436097,余侨居龙门山十有馀年封张二子日从余游而贫又甚焉因写所怀兼简二子共成一笑
570824,大宗伯姜公倡诸公祈雨澍应偶成一绝奉览蒙赐迭四章不揣鄙陋辄依韵补上忘其续貂恐蹈蛇足不知群公能遂翕如成此胜事否 其三
569001,洪山人自永嘉偕肖甫司马过吴门轻舟入访云将入燕赴平津之约余时病起为蔬食以供从容久之因成一章为别
904965,南歌子 民先兄寄野花数枝，状似蓼而丛生。夜置几案，幽香袭人，戏成一阕 其二
740063,听弹琵琶偶成一绝
