1037086,频于梦中作宫词何也漫成一首
673074,邸舍牡丹盛开病中强成一律不欲孤负此花耳兼简南峰仪制
323296,嘉叟宗丞得郡喜成一绝
1072286,卢叔才相过夜话戏成一首
402262,年终算帐，漫成一律
660111,五月初七日恭遇先帝忌辰不胜悲恸强成一律用写哀悰
680844,同张内翰访罗景明过磁溪偶成一律
810298,清明日闲坐溪边归成一律
520331,予闻山曲曰盩水曲曰厔而盩厔一邑果在山水之间乃知昔人立名良有以也予既渡渭水风雨甚寒绝无诗思行台明发聊成一诗以写兴云
540143,见逐参方僧禁约戏成一绝
1220941,刘氏二生从吾儿学赤日中分渠溉枯其意甚善遂成一绝示之
1085908,拾荔枝核欲种之戏成一首
746510,道光壬午为周节庵题所藏李龙眠揭钵图今王仲琡以仇十洲临本属录其诗因与图不同别成一首
537428,苦吟不就呼酒解之戏成一首
958351,马伏波请征蛮据鞍矍铄时年六十一陆鸿渐景陵人蚤年事比邱后始改业为儒今复州东门外小寺断碑犹言是鸿渐当时受业院也予去年蒙恩谪桂阳正年六十一今徙复州尝访鸿渐之遗踪戏成一绝
788344,新霁苑中秋色颇佳临流玩赏率成一律
267889,自塔之泽至芦湖风雨初霁喜成一律
569221,太宰梦山杨公谓不佞为作桃花岭歌未有以应也今年春以书来云客至吴中册有子二诗然而非子诗也能竟恝然乎哉适晨起行药小径落红狼籍忽有斐然之思因遂成一歌寄公不知其能胜二赝诗否要之落句狂语彼固不肯道也公以为何如
411899,论诗 杂阅古今人诗偶有所见辄成一绝计约十首今只存其四略见昔年读诗眼力也 其四
773187,七夕范松浦郡守邀饮榕桥下书楸村给谏即席赋绝句余与同人既走笔和之复成一律仍用原韵
446115,买陂塘 十馀年前居山中，香江李国明兄曾为我绘《冷翠轩擪笛填词图》，藏未面世。近读蛰堪新河诸家题图之作，因成一阕乞正
304207,梅泉诗来引用唐昭宗谓韩渥朕左右无人之语偶有所感遂成一绝句
1158329,鲁望昨以五百言见贻过有褒美内揣庸陋弥增愧悚因成一千言上述吾唐文物之盛次叙相得之欢亦迭和之微旨也
185186,偶成·一堂既虚閒
156279,栀子花·六出台成一寸心
712057,仲冬十三日赣儿受室率成一律示之
1243913,乙未八月二十二夜梦宿山寺与僧讲道论诗不觉夜分僧赋一联云鹤向白云栖处宿僧从青嶂影边归觉而微改其句足成一律云
1063464,郡人献笋守以分饷郡寮而吏独见遗守知之命追赐焉盖不出既久而人忘之也因成一篇
314289,乱中于枫岭得遇俞镜流林秋湘挑灯言愁成一律用前韵
430323,先大夫乙丙遗书李范之丈命题斋心竟日敬成一首戊午十月九日夜中
515656,十二月七日监放官吏俸粮其册云学士程某等共支米二百石初盖不知当此首选也戏成一律奉寅长西涯先生同一捧腹云
1156586,编集拙诗成一十五卷因题卷末戏赠元九李二十
788292,甲辰十一月十三日恭值皇考二周忌辰感时永慕哀痛填膺洒泪述哀敬成一律
973543,蕃近有干字韵属教授兄而知县尉曹皆尝用是韵相酬赠亦成一首奉呈并属录事今年未见梅花故及之
427897,八声甘州 得马湛丈湖上来书，云将往庐山避暑。因挦扯六一东坡词句缀成一曲，寄呈博笑
654769,坐客有谈兵者纵横无穷谩成一绝以警之
570052,余与竹溪王大中丞为郢中之别余十二年矣公抚关右值旱魃为虐公竭力祛之民渐回菜色辱遣使问存怃然有怀遂成一律时闰六月之望也
654688,山西大饥人相食哀叹之馀谩成一律
1166507,以青䭀饭分送袭美鲁望因成一绝
1071144,戊辰冬与邻士纵步至吴由道书会所课诸生作梅花诗以先字为韵戏成一绝句后三年由道来昌化索前作复次韵三首并前诗赠之 其一
456651,睡起背痛知昨夜天转寒矣率成一律寄何白兄
985679,花头巡检先君纪之详矣孝女乡女子骑虎以救亲今汝滩下有孝女石即其处也乡之得名以此然则汝滩旧名女滩米坑旧名女坑皆当仍旧不可改也吾乡有此二事宜庙而祭之以表励风俗因成一绝道余所志云
1005641,菖蒲最难养置而弗省则弗滋勤勤拂拭则病矣余性甚嗜之往往不特人病苗而苗亦病人矣讲求其法至备尝为之作谱书留南郭杨建处建摄令黄岩死于兵无从问矣端午日寻石菖蒲偶成一律
247487,浣溪沙·十四年成一故人
1220332,辛巳秋初归田有期喜而成咏因感今怀昔赋成一百五十韵
829012,明日再集分韵得急、春字各成一章
1053934,元子发龙图以程公咏三园诗见示亦成一篇
1073037,雪中遇胡烈臣归自郴阳戏成一绝
683716,省坐无赖阅杂册花草禽鸟凡十六色各成一绝漫题其后 凌霄花
246027,文庙路小酌有狗肉锅仔戏成一律
771556,兵燹后五年不墓祭矣，成一律寄伯兄
327759,七夕范松浦郡守邀饮榕桥下书楸村给谏即席赋绝句余与同人既走笔和之复成一律仍用原韵
820171,明日再集分韵得急、春字各成一章 其二
1079645,璧上人欲行为雨止戏成一绝用前韵
1071146,戊辰冬与邻士纵步至吴由道书会所课诸生作梅花诗以先字为韵戏成一绝句后三年由道来昌化索前作复次韵三首并前诗赠之 其三
569750,仆近有五子篇拟魏懋权似不欲以文士名也用赠长兄韵答我因再成一章倚韵见志仆亦且谢笔砚矣
1247886,龚士显招饮云有归意偶成一律寄谢并呈庭实掾史
908569,诗友作涉江采夫容触拨鄙思亦成一首
292300,鹧鸪天·癸酉秋罢讲燕庠，退居西苑僦园。其地旧为扇子湖，荷花最盛，半塘老人曾有词，率成一解
580724,宾学相传凡遇大比年则鹊来结巢士登科每如鹊育子之数因成一绝
321669,何子应以蜀中文房四宝分赠洪景卢王嘉叟某与焉因成一绝
788293,是日瞻拜御容追忆慈颜不胜悲怆再成一律
971057,六月二十二日病中得雨顿觉沈疴去体欣然起饮遂成一绝
752337,往复酬和积十馀篇涛不能诗肯堂强之乃依其韵而错杂用之勉成一首
1071145,戊辰冬与邻士纵步至吴由道书会所课诸生作梅花诗以先字为韵戏成一绝句后三年由道来昌化索前作复次韵三首并前诗赠之 其二
286410,秋山对雨有怀陈氏兄弟赋诗三韵而陈书适至遂成一律却寄
112484,偶成·一生富贵皆空梦
788366,朕因去冬未雪忧怀莫释夙夜竭诚祈祷于惊蛰后二日荷蒙上天鉴佑春雪下降朝野同欢因成一律用志欣庆
250400,与仰翁一得剑尘剑川水月赴丰城于桂山书院小坐依剑川兄命口成一律并书
427867,水调歌头·马湛丈寄示戊戌中秋戏和东坡韵词，因念浦东村景，补成一阕
296199,浪淘沙·成一词寄团结报
411896,论诗 杂阅古今人诗偶有所见辄成一绝计约十首今只存其四略见昔年读诗眼力也 其一
231140,圭示急须制作亭当喜成一绝
1085525,游南山入康谷以不观谷帘泉为恨南康李守致上尊乃此泉名也戏成一绝
539976,省坐无赖阅杂册花草禽鸟凡十六色各成一绝漫题其后 其十三 鹧鸪
530406,彭济物宪副雨中访予于吴山三茅观时予方醉卧分付童子未报伫久驰归既而马上戏成一绝见寄聊复奉答
331637,宿疏山戏成一绝
569565,钱叔宝七十岁宴为文沽所役忽忽不暇存故人除夕把盏始悟叔宝七十诞辰遂成一律烧烛书之亦不暇辨为何语也
514539,先公同年之子二十七人作通家会漫成一律
1164273,高侍御话及皮博士池中白莲因成一章寄博士兼奉呈
264685,教师节，本校开五周纪念会有京剧六出各成一绝
780657,铁君惠书，有“玉想琼思”之语，衍成一诗答之
569424,挽李近樗士牧为余画三壁奇伟甚方欲要之别作而死矣惜之痛之遂成一律
413834,偕内子挈儿女游莫斯科近郊阿汗格司克宫偶成一绝
408047,梦中得“秋风人对残花立”句，自谓有小山“落花人独立”意味，足成一律
313025,琴调相思引·梦旧京晴雪，以淡墨写之，成一小帧
401048,与海燕公园看牡丹以其意成一绝
539032,肖甫中丞许为小祗园之会后以江警暂停贻诗再订敬成一章促之
1159972,衢州徐员外使君遗以缟纻兼竹书箱因成一篇用答佳贶
433147,论诗 杂阅古今人诗偶有所见辄成一绝计约十首今只存其四略见昔年读诗眼力也
1184728,览柳浑汀洲采白蘋之什因成一章
144375,二绝·捣成一百八丸黄
829019,教师节，本校开五周纪念会有京剧六出各成一绝 乌盆计
447689,余国松世叔短信示所著《马辩》文，深肯其说，读毕戏成一首
598004,督府司马凌公大征罗旁上功次得蒙绮币之赐兼荫一子为勋卫盖异数也其年冬十月适会诞辰于是丘使君请予作诗为贺遂成一律
741286,平原道中见汉大夫东方朔故里石碣戏成一绝
958443,建炎丁未自中夏徂秋不雨七夕日戏成一诗简牛郎织女云
971847,章少隐尝有逸句云片片梅花随雨脱浑疑春雪堕林梢今日雪后梅已有落者偶与公择清坐举似此诗欣然联成一绝
568923,张芝罘孝廉来请大司马公志铭成一诗送之因订后约
441253,为胡僧制印边款随刀漫成一律用调嘘堂旧韵
641439,奎倚席渭城校室伏承耕学袁公雪樵秦公二先生远自故里寄惠新诗教诏之谊暌离之情备溢乎辞捧诵再四感愧交并不能已已既次严韵属和奉怀因兴起丰城云门河南公武潜夫诸先生例借前韵各成一首以见区区向往之私至于落句嬴瀛互用亦足明仆于二先生无少偏党也 其一 答耕学
538920,宗伯董丈枉饮岘山泛碧浪湖时范太史伯祯陈都谏体乾在坐太史将赴召北上宗伯遂成一章予嗣得其二一用公原韵一用近赠公韵 其二
323341,初入巫山界登罗护关云雾晦冥默祷之因成一绝
182016,道者寮成人为书额拟成一诗
866604,新居凿井饮之味殊清胜因成一首
569532,余燕中别宋廷尉望之今十七年矣公秉钺吾邦余谢病归里虽讯问时及而竟睽握手乃成一诗奉怀适太学张恒思以画索寄漫题于首
793523,前诗意有未尽，复成一律
514422,夏日独卧西斋陶懋学贡士与克俭弟隔坐写画笑语而窗外槐阴与盆石掩映宛如往岁回舟北上时事因成一诗
775411,得告后闲居候代小窗展卷终日萧然率成一律
1113880,琼惟水东林木幽茂予爱此三士所居虽无亭馆之胜而气象清远连日水涨隔绝悠然遐想各成一诗目为城东三咏 杜公司法
731617,晚晴气爽镫火可亲偶翻近诗甲乙编次因成一律
744179,阅藤阴杂记寒寓为梅村祭酒故宅漫成一律
44362,本事诗·目断积成一钵泪
539975,省坐无赖阅杂册花草禽鸟凡十六色各成一绝漫题其后 其十二 白头翁
827331,教师节，本校开五周纪念会有京剧六出各成一绝 其三 探阴山
278867,甲戌四月一日重到西湖感成一律
520346,予经山寺爱其幽雅因留宿焉昔人所谓天下名山僧占多者信然哉所惜者世无金山长老而吾带盖不足留聊成一诗以自适云
814930,一剪梅 意有所触辄成一词，美人芳草不无寄托之辞，商妇琵琶，惟以悲哀为主。
121992,新荔枝四绝·甘露凝成一颗冰
1042595,康定中予过洛桥南得诗两句于今三十二年矣再过其处足成一章
569395,金山上人苦行头陀行若一切无涉者得刘子威赠言数百字而犹乞余诗未已为子威所迫勉成一律老夫其尤罪魁也哉
537590,偶得佳酪巨螯兼致新菜遂成一章
328862,沈宗师甚喜江梅而微贬酴醾因成一绝
1061238,适承再示佳句亦强勉再成一首
539966,省坐无赖阅杂册花草禽鸟凡十六色各成一绝漫题其后 其三 杨花
965460,夜坐与伯氏苇航对床阅江湖诗偶成一首
214245,既别羊王二君与同官会饮于城南因成一篇追寄
492214,自京师归至家园春欲暮矣晨兴登一乐亭喟然有感漫成一律
683910,大宗伯姜公倡诸公祈雨澍应偶成一绝奉览蒙赐迭四章不揣鄙陋辄依韵补上忘其续貂恐蹈蛇足不知群公能遂翕如成此胜事否
623828,朱少襄招同万伯文陈梅卿万儒张傅贞甫张世昌饮中宿峡飞泉洞少襄先成一诗邀诸子步韵
934984,三山卜居今三十有三年矣屋陋甚而地有馀数世之后当自成一村今日病少间作诗以示后人二首 其一
818721,重九卧病忆兄弟，前年是日雨，在长安与姊联句寄怀，因成一律
138274,二公见和又成一首寄之
1010658,春夜梦游溪上如世传桃源与梵僧仙子遇具蟠桃丹液灵芝胡麻于云窗雾阁间请赋古诗颇有思致觉而恍然犹能记忆五句云滩峻舟行迟乱峰青虬蟠一瀑素霓吼灵桃粲丹朱仙饭杂芝糗遂追述梦事足成一十七韵
293280,昭君出塞诗意有未尽再成一律
539306,戌亥之际有闻偶成一首
977424,登舟客有诵杜诗春水船如天上坐之句因成一绝
712055,李苍水司训长乐以罗浮蝶茧数双及茧布见寄云布即蝶茧所成翼日蝶出茧中五色纷翍玩对之间因成一律寄谢其意
246799,年终算帐漫成一律
403472,琴调相思引 梦旧京晴雪，以淡墨写之，成一小帧
899848,读浯碑漫成一绝
860390,昌国偶成一首
569762,余以己巳正月渡江访会家弟于天界寺雪阻五宿今年腊月寺僧访余昙阳庵留宿雪复大作因成一律寄之
264191,晚晴气爽镫火可亲偶翻近诗甲乙编次因成一律
321736,至瞿唐关戏用山名成一绝
302029,九月晦夜，梦中得“江上梅花影”五字，寤后续成一诗，题陈师曾水墨兰石
974167,顷见迂斋谈游子明不容口且诵其诗恨未遂倾盖之愿前年一见既慰我心所恨俱匆遽不得款语近过迂斋闻寄书又复访问死生顾屏窜林壑逃死无日何以辱盛意如此辄成一诗奉寄
999814,和叔以琴诗见贻因成一篇奉答
1033370,石屏久游湖海祖妣遂题二句于壁云机番白苧和愁织门掩黄花带恨吟后石屏归祖妣已亡矣续成一律
669216,将军射林同莫膳部吴比部散步各成一首
784577,秋山对雨有怀陈氏兄弟赋诗三韵而陈书适至遂成一律却寄
569911,张幼于兄薄游金陵过从甚数忽尔告返聊成一章送之并寄长公伯起及韩令
453201,见兴福寺山门佳对用作颔联足成一律
218868,久为尘事关怀因成一绝
301402,妆罢偶成·一庭红影上帘钩
331615,五月晦寓河源馆舍雨凉新沐偶成一绝
410773,自塔之泽至芦湖风雨初霁喜成一律呈黄仲韬吴子修汪颂年叶伯皋刘幼云诸学使
787994,皇父勘河省不获奉侍瞻恋惭悚交迫于怀敬成一律
139003,赏梅偶成·一冬准拟赏江梅
536960,夜入保定公署秋隘风雨横来戏成一首
947289,久为尘事关怀因成一绝
426327,生平未解诗词。一九三五年春，执教松江。校园中桃花盛开，同事王先生题词索和，迫于无奈，胡乱成章。原作已忘，还记得最后两句，今以此续成一律，徒供一笑耳
828646,年来了无诗兴不成一字夜读东坡海外诗若有所会率成四首 其二
539064,楚行意颇不决聊成一章
817976,东渡濒行谢英伯出示杜莲英女士杏花画幅属题率成一绝
888706,周相士谓予寿至九十三又成一绝
1099721,溪居古榕甚佳未尝有所赋得柞山诗卷借奇字韵戏成一首
790432,家大人为言里中徐某隐于市。仅读学庸，逢人辄询字义。晚年喜为小诗，赏秋日偕众游山，徐后归得句云：人静一山空。饶有意味，因续成一律
416948,渡江云 捡旧簏得丙寅清明同冰若游广州北郭词，惜别伤时，百感奔赴，即成一解寄冰若真茹
520379,予入华山而爱其名胜恨不登落雁峰携谢眺惊人句搔首以问苍天耳玩之不足而因成一诗山灵有知其尚羡予之奇观也哉
310814,醉垂鞭·夹竹桃将放，慢成一阕，以代奚奴羯鼓
520377,予经华山而仰观仙掌因笑图经之缪盖不足信偶成一律贻诸缙绅辞虽弗工欲求和也
426736,集唐人诗句成一绝
539978,省坐无赖阅杂册花草禽鸟凡十六色各成一绝漫题其后 其十五 八哥
1190484,思录旧诗于卷上凄然有感因成一章
620107,春夜薄醉放声长歌俄成一律
559140,丁未十二月二十三为立春后二日夜梦得六言律诗前俱忘只记结句话到疏英影动一枝明月归来次早足之遂成一律
517762,承友人和立秋诗韵复成一律以谢之
422629,菩萨蛮    醇庵见示此调咏红梅一阕格韵俱高并对采庵红梅四阕推崇备至读后深有同感爰不忖谫陋勉成一阕
616153,同诸子集小馆送别区启图已成江字韵二首复取诸子所分咸覃盐肴四韵各成一律得咸韵
569457,齐王孙仲望邀游清凉寺因成一律兼简陆生
552075,己未五月抵舍甫浃旬而北辕又发矣浪迹萍踪可胜惆怅因成一律以志感尤以道区区将母之私云
1184826,尚书会仙亭咏蔷薇夤坐中联四韵晚归补缉所联因成一篇
1070710,琼惟水东林木幽茂予爱此三士所居虽无亭馆之胜而气象清远连日水涨隔绝悠然遐想各成一诗目为城东三咏 其二 林曾城
827334,教师节，本校开五周纪念会有京剧六出各成一绝 其六 审郭槐
780597,梦得“东海潮来月怒明”之句，醒，足成一诗 其一
321719,雾开复成一绝
1100012,豨冻宜酒以皮为之入口爽而色可爱客以山谷醒酒冰比之余谓冰鳞物也其性寒比之玉狸又不瑩戏成一首
1172685,漫成一绝
440768,余每开纱窗辄忘关妻则怒责余曰日昼亦有蚊耶妻曰有苍蝇因成一首
1084683,二道人以抹利及东山兰为赠再成一章
569802,汝师语次多及时事民瘼慨然有感复成一首
859473,既别羊王二君与同官会饮于城南因成一篇追寄
414325,洛阳过北邙山史称南唐李后主死葬于此感成一诗吊之
323442,郡圃有荔支名白蜜者熟最晚戏成一绝
411898,论诗 杂阅古今人诗偶有所见辄成一绝计约十首今只存其四略见昔年读诗眼力也 其三
366289,戏成一首·参差翠嶂坐中分
1085329,元宵邻里携具就弊庐张灯辞之不获因成一绝
407052,昭君出塞诗意有未尽再成一律
1085401,嘉叟宗丞得郡喜成一绝
946403,梦人诵诗觉省数句足成一首
979069,旧说庐山有紫芝田百亩人莫得见偶于开先栖贤林中步两日各得一枝正紫如玉戏成一首
760453,罗浮五观皆龙门派，戏成一绝
569523,旧有诗赠月溪上人将十年今春至吾州讲经毕过我小祇园言别更成一章赠之
537892,季俸不至而故人日有来者戏成一章
833092,烛影摇红 题拔可令妹李稚青花影吹笙室填词图，即用其原作集成一解
367027,挽刘明国·浮邱成一梦
985841,庚辰录譬如结款他日打断得了方成一段公案耳子居命时润色此殆谦词敬赓韵以谢
911510,晚坐偶成一绝
515617,甲寅岁八月廿七日过大监戴公城东清适园亭漫成一律
296148,九日石遗先生约游天宁寺余以事后至独成一诗
441800,一春苦旱因成一章
1030819,偶得兄字再成一诗
1078128,五月晦寓河源馆舍雨凉新沐偶成一绝
961627,一年佳节惟立春元夕并在一日亦盛事也灯火笙簧处处有之斗城且尔况京都乎追想旧游成一诗聊摅郁郁 其一
424053,浪淘沙·成一词寄团结报
520365,予浴温泉而追忆玉环之丑禄儿之秽虽万古有不能涤也奈何三郎郎当入蜀幸赖汾阳诸公再造唐室及过马嵬犹不能忘情于一香囊而为之泣下于乎三郎真郎当哉慨叹之馀因成一律云
938274,蒙再示属辞三叹之馀赞巨丽无地托言辄依元韵再成一章非独助家弟称谢区区少褒之使进学焉亦师席善诱之意也
465875,癸酉元朝偶成一绝代简诸诗友贺岁
1030826,淳熙戊戌将命广东侍亲携孥十一月至安仁留云锦驿一宿而去时晋卿侄偕行后二十三年分阃桂林晋卿主馀干簿复以是月来会于此把盏道旧为之怆然因成一诗示晋卿
339351,索山童所拾花旋又坠去更成一绝
971660,重阳甫近菊殊未花而木犀再开遂成一绝
520350,予闻秦始皇好神仙于尹喜楼南立老子庙晋惠更新即今之楼观也厥后废毁胜国时安西王乃大加修饰而于今为盛盖天下第一福地也有系牛柏相传为周时故物殆亦后人附会而补植之者予缅怀青牛老人第无自而闻其道德之言姑成一诗以写胜概云
1081528,泊舟盐桥儿子洙辄于市买历尾题云客里其如日费多因取笔足成一诗
828497,族兄叔容相别三十三年兹复见于沈阳几不相识矣留饭海拉尔磨菇及自制藕丸风味绝佳谈及家乡零落之状不胜感叹率成一首
539971,省坐无赖阅杂册花草禽鸟凡十六色各成一绝漫题其后 其八 山鸡
916376,郡民以岁稔刑清相率为斋以报善政永嘉聂从事赋诗纪其事因依韵足成一百言以谢之
368544,雨中漫成·一树山矾宫样黄
456324,秋日读学生张翕越诗率成一首
445108,中元夜读有鸟蜷窗因成一绝
445109,孤坐无聊忆今春有『若恐伤春愁欲绝，馀愁惜取到清秋』句因成一绝
419274,浣溪沙慢·甲戌暮春，吷庵、众异、公渚、蒙庵、冀野枉过村居，重游张氏园，伤时感旧，相约谱清真此曲，漫成一解
520398,五台之西有山曰翠微太宗避暑处也旧有离宫二曰翠微曰永庆遗趾尚存今废为寺因成一律
290631,清明日闲坐溪边归成一律
958039,每岁正月度太阳岭半山间有梅花尝以此时开每见必折一枝丙午岁成一绝
906692,过浯溪观中兴磨崖因成一绝
313423,洛阳过北邙山史称南唐李后主死葬于此感成一诗吊之
164736,荆阃偶成·一出峤南道
320136,元子发龙图以程公咏三园诗见示亦成一篇
8493,漫成一绝
323274,曹梦良赠炭戏成一绝
110198,偶成·一心忧国不忧家
1048292,昨暮会饮庆甫署观女真花因求一二诺以厥明至期不至遂戏成一首
1028540,石室閒坐忆东坡渔舟一叶江吞天句成一绝
94689,赠曾相士·富贵真成一聚尘
200703,偶成·一洒斑斑小雨晴
791465,张少泉谓予六十始为诗，然哉然哉。得一知己可以无撼矣，戏成一律
514005,节庵倪先生以经学教于乡既成其子进贤举进士为御史又出其馀以淑乡之人其在德兴孙司马之塾最久予过婺源望先生之庐尚远不能往拜漫成一律奉寄
145182,閒居多暇追叙旧游成一百十韵
423099,水调歌头 澄江中秋，不雨不月，只寒风凄紧，万籁萧骚而已。客中对此难乎其为怀也，偶忆坡公明月几时有词，遂成一解
457987,二零零一年末夜梦与段学俭兄谈诗，梦中复梦，得断句曰：“潮头断艇波还下，月底惊云骏以奔”。既醒，不识其意。然时复忆及梦中断艇，遂为足成一律
559502,戊辰十一月廿一日夜梦有令禁私宰余谓合家久不啖牛肉遂拈一诗诵其事睡觉只忆起语二句枕上足之辄成一律
760471,罗浮山阴特少道观，戏成一绝
428734,皖江王铁炉、王务农、王莲禅、王文谷诸先生慕吾邑山水挈伴来游。李仲臣、程绪卿、孟栽庵诸君呼舟载酒，与普禅师谭玄，余亦叨陪末座，率成一律
675826,舟中夜梦廖同年孔服作诗二句觉后足成一首
1079375,送文潜归因成一绝奉寄
433666,卅二年春，长次二子，求学毕节弘毅中学，余应教导主任南汇谈宗录之邀，兼课图画。三月廿七日，该校师生旅行灵峰寺，余因公未往。翌日星期，萧校长吉人宴于校，席示文书清拔贡周老先生介仙留痕旅行偶成二绝，即晚忆韵草和，继知第二首未循原韵，再成一首，并录存之
411897,论诗 杂阅古今人诗偶有所见辄成一绝计约十首今只存其四略见昔年读诗眼力也 其二
453200,见兴化寺山门佳对用作颔联足成一律
388453,季俸不至而故人日有来者戏成一章
28050,润卿鲁望寒夜见访各惜其志遂成一绝
33202,尚书会仙亭咏蔷薇夤坐中联四韵晚归补缉所联因成一篇
520390,予宿石门清不能寐其所闻者野雉之鸣涧水之声而已因成一绝
172977,王允·事成一让一矜功
1006383,所居二室号书痴禅悦各成一诗 书痴
827333,教师节，本校开五周纪念会有京剧六出各成一绝 其五 空城计
371163,满江红·邻女归宁未几，别母悲啼，闻之恻然，遂成一阕，以志感焉
827329,教师节，本校开五周纪念会有京剧六出各成一绝 其一 乌盆计
296267,感事·骗局垂成一掷输
765889,满江红 邻女归宁未几，别母悲啼，闻之恻然，遂成一阕，以志感焉。
869549,和始平公梦中有怀归之念作诗始得两句而寤因足成一章
840862,李秀峰见示旧游庐山诸诗即用其和紫霞真人游白鹿洞歌原韵率成一章以志向往
855418,题前诗已天忽作雨戏成一绝
866218,访赵愚斋不遇谒者云入幕抵晚方归因成一绝奉寄
110180,登舟客有诵杜诗春水船如天上坐之句因成一绝
569730,壬午初冬忽传明卿有非常耗者得书喜剧因成一律情见乎辞
321726,元章赠笔戏成一绝
1086252,郡圃有荔支名白蜜者熟最晚戏成一绝
818790,病中过重九，因忆十年前九日卧病湖州，有“九日风烟淡不收”之作，偶成一首
230401,访赵愚斋不遇谒者云入幕抵晚方归因成一绝奉
307280,丁己端阳适逢长至乐成一律
539965,省坐无赖阅杂册花草禽鸟凡十六色各成一绝漫题其后 其二 金钱花
798251,一剪梅 其三 意有所触辄成一词，美人芳草不无寄托之辞，商妇琵琶，惟以悲哀为主。
1221215,马麟长春蝶并杨太后扑蝶图二小幅成一卷
774980,戊申1788春与诗人吴奇文邱瑞岚邱桂芳夜集袖琴亭刻烛分咏拈得中庸语大为题同人以莫载从何说起予窃以天地人物该之率成一律
