1241856,乙丑十月廿八日得乡人林序班公辅寄声报舍弟梦臣没于道未知月日地所二首 其二
328037,鲍营夜雨追思张梦臣
500712,益都城北三十里有邮亭名白羊铺壁间石刻张梦臣学士诗一首乃至大辛亥未第时所作其诗曰迢迢长日路途间两字功名抵死难岂为身荣爱奔竞正缘亲老逼饥寒云霄附凤心徒壮客馆无鱼铗自弹百亩薄田容易办也应无梦到长安仆因次韵书事
1059541,招梦臣
1241855,乙丑十月廿八日得乡人林序班公辅寄声报舍弟梦臣没于道未知月日地所二首 其一
1226458,次韵张梦臣侍御游蒋山五十韵
1040015,提刑邢梦臣度支连理荔枝
1059167,梦臣惠潘谷墨 其二
1216998,左丞傅梦臣归老汾曲赋以寿之
1247030,孤也不天十有二年矣我先君读书号该博凡平生辛苦而得之者仅见于文辞仕又最晚而位不大显海内器赏不过大参王公继学侍御张公梦臣数人而已呜呼痛哉其忍言诸日者辱养吾先生为题文集五首并序铭一通读之再四涕泪迸落诗语俊逸序约而不遗铭丰而不剩古之作者正如此且典雅奇奥次第刻石墓上以贻不朽其长篇尤浏亮铿锵自成机轴是晚疮作傲兀枕上命次儿鹤奴随读随和遽尔成章鄙俚腐熟纵力焉而不逮也幸有以教之
1059168,梦臣再以墨来
1253246,乙丑十月廿八日得乡人林序班公辅寄声报舍弟梦臣没于道未知月日地所二首
1248847,送费梦臣北上并简十八丈
1117589,梦臣惠潘谷墨
1059166,梦臣惠潘谷墨 其一
788432,鲍营夜雨追思张梦臣
1204759,玉漏迟 同前次张梦臣韵
361727,提刑邢梦臣度支连理荔枝
358297,招梦臣·春色集檐楹
