664183,哭同年范副使渊兼悼亡友徐博士祯卿同空同李子作
539158,欧祯伯自岭南寄书经岁始达时已谒公车矣
470737,杂感十首（崇祯元年） 其八
470730,杂感十首（崇祯元年） 其一
926457,柬吕太学祯
713305,九日湛静斋亦宋乔梓载酒元明石室登高同郭公鹫湛天沐天及祯士文安泽君介以长儿端木纵饮至夜月高而还地为甘泉先生书院故址碑碣存焉二首 其二
536776,四十咏 其二十一 李少卿应祯
569792,甲申中秋夕成伯寅叔孟嘉复携酒弇园楚人李惟祯来不疑辈在焉颇具歌吹之乐得一首
518328,书示次儿祯 其五
499282,崇祯癸酉下第还里后作四首 其二
625985,崇祯四年秋月重葺三洲岩题壁 其二
518162,奉赋祯祥诗
478244,梦唐寅徐祯卿
499283,崇祯癸酉下第还里后作四首 其三
577629,寄潮州卫指挥王祯
592210,送范太史伯祯奉使册封鲁王
581420,电孙生于闽允祯以电名之书报即惊其命名失于所择后果早殁正如电虽光而不久也诗以哭之
53685,读从兄南安令崇祯太平曲有感
577289,寄潮州指挥王祯
533482,舟泊金川望唐允治欧彦祯不至
1148493,司马承祯含象鉴文 其一
688538,崇祯癸酉下第还里后作四首
56408,南阳宅访徐祯卿
132,答司马承祯上剑镜
575988,宋伯祯处士东园
509185,重庆堂为贡士顾祯题
538917,送范状元伯祯召入尚宝时君乡大水予方有疏请恤
1234685,祯祥菊
515941,过苏州与丘时雍李应祯夜话
780655,吴市得题名录一册，乃明崇祯戊辰科物也，题其尾一律
638843,次韵李祯伯秀才面侍方石先生索赠二首 其一
801240,司马悔山即和司马承祯山居洗心韵
648273,送解祯期兼忆大绅
347054,题明崇祯刊本宋学士集
652998,送监生冯伯祯归省
770556,题明崇祯刊本宋学士集
695297,次韵李祯伯秀才面侍方石先生索赠二首
603942,冬至后集元祯叔宅得鱼字
499284,崇祯癸酉下第还里后作四首 其四
593344,季秋晦日同贾汝诚陈伯化张和卿崔德卿周之祯集何仁甫宅得间字
606772,建朱文公祠崇祯堂
538920,宗伯董丈枉饮岘山泛碧浪湖时范太史伯祯陈都谏体乾在坐太史将赴召北上宗伯遂成一章予嗣得其二一用公原韵一用近赠公韵 其二
675285,赠别张汝祯兵宪兼致留意
513831,李员外应祯吴太史原博约游虎丘
704910,和韵呈欧祯伯亲丈
139,王屋山送道士司马承祯还天台
541388,寄欧祯伯
1211327,中秋可行招饮因诵东坡明月明年何处看之句座中请明初可行各和其韵予得二首皆用三叠体仍命祯赋 其一
729772,踏莎行  题明叶绸鸳鸯梦传奇崇祯丙子刻本
496866,水调歌头 其二 崇祯丁丑正月初卜日迎春
270328,春日偕小女永祯公园看梅
625982,崇祯三年冬至日题三洲岩
470716,送钱受之侍郎枚卜罢归一篇（崇祯元年） 其五
277889,在频山子德大弟宅喜晤子祯宋隐君歌以赠之
581377,允祯尹怀安诗以示之
541350,送蔡祯启归端州
709651,崇祯皇帝御琴歌
625984,崇祯四年秋月重葺三洲岩题壁 其一
581442,写怀时允祯初应召
603499,午门早朝简欧祯伯黎惟敬
713304,九日湛静斋亦宋乔梓载酒元明石室登高同郭公鹫湛天沐天及祯士文安泽君介以长儿端木纵饮至夜月高而还地为甘泉先生书院故址碑碣存焉二首 其一
671548,题冯祯卿画石为磊斋都谏
834796,浣溪沙 题江建霞所藏屈翁山手书崇祯宫词册
569399,赠王吏部之子太学元祯
599687,和韵呈欧祯伯亲丈 其一
513803,雨中过严州与张时祯通判同年叙别
264025,踏莎行·题明叶绸鸳鸯梦传奇崇祯丙子刻本
661785,成化十四年十二月十六日吴兴张渊子静松陵史鉴明古长洲李甡应祯吴宽原博颖川陈瑄廷璧入云泉庵观大石联句
518324,书示次儿祯 其一
863,冬宵引赠司马承祯
807801,沁园春  题徐祯起六十斑斓图
470719,送钱受之侍郎枚卜罢归一篇（崇祯元年） 其八
529824,戊戌冬至南郊礼成庆成宴乐章四十九首 其三十四 七奏集祯应之曲
543404,寄李惟寅欧祯伯四首 其四
50485,颍人来得马仲祯消息作诗寄之
1242862,命酒徵歌送余婿，时伯庸酒间赋赠董景明、董彦祯诸亲还遂昌
470735,杂感十首（崇祯元年） 其六
1245429,对月同文祯宗兄赋
681867,分题得卞将军庙送李应祯中书
513397,分得戏马台送李应祯舍人还江东
697464,寄李惟寅欧祯伯四首
470739,杂感十首（崇祯元年） 其十
470539,述古二首（崇祯初年） 其二
599689,和韵呈欧祯伯亲丈 其三
860944,绍兴乙卯张安国为右史明清与仲信兄梁举善郭世祯李大正李泳多馆于安国家春日诸友同游西湖至普安寺于窗间得玉钗半股青蚨半文想是游人欢洽所分偶遗之者各赋诗以纪其事
500832,万户赵祯见余访单宪使不遇之作赓歌四章雨中来谒用韵以荅
496751,长相思 其四 崇祯八年正月十八日，贼陷池河。是日枢部发援兵
470721,送钱受之侍郎枚卜罢归一篇（崇祯元年） 其十
1235647,中秋可行招饮因诵东坡明月明年何处看之句座中请明初可行各和其韵予得二首皆用三叠体仍命祯赋
470738,杂感十首（崇祯元年） 其九
51616,梦唐寅徐祯卿
1178953,王屋山送道士司马承祯还天台
619292,过虞部欧祯伯先生蘧园
509120,仙舟诗为郭汝祯赋
581349,寄刘世祯
470714,送钱受之侍郎枚卜罢归一篇（崇祯元年） 其三
509119,忆秋谷柬其高徒陈绍祯
470736,杂感十首（崇祯元年） 其七
523994,别徐子祯卿得江字
464170,念奴娇 代阿邸吊日本冲君祯介
1208956,赠辛瑞卿（名居祯尝质物于某氏私库误赎得玉带金器不受而返之时人义其事）
470733,杂感十首（崇祯元年） 其四
679893,白塘归隐为莆阳陈维祯赋
470731,杂感十首（崇祯元年） 其二
646174,颍人来得马仲祯消息作诗寄之
638844,次韵李祯伯秀才面侍方石先生索赠二首 其二
693874,崇祯元年元日立春歌
646231,送马仲祯之颖州
687598,王元祯太学别余久矣一日谒余山堂遂赴留都试赋二绝句送之
729136,读崇祯辛未后十余年事
542862,郭寿卿园同申伯宪牛国祯诸君吟酌
625983,崇祯辛未仲秋日题三洲岩
594316,诚意伯刘国祯招饮同郑光禄赵舍人集
543403,寄李惟寅欧祯伯四首 其三
518333,书示次儿祯 其十
470715,送钱受之侍郎枚卜罢归一篇（崇祯元年） 其四
415599,登桂平西山最高峰赠同游谢绍祯诗丈
548630,送王元祯应留都试得船字
499281,崇祯癸酉下第还里后作四首 其一
538919,宗伯董丈枉饮岘山泛碧浪湖时范太史伯祯陈都谏体乾在坐太史将赴召北上宗伯遂成一章予嗣得其二一用公原韵一用近赠公韵 其一
581386,福州贾百户使广为带允祯家书事竣诗以送之
578123,和唐元祯镇越堂诗韵
731836,在频山子德大弟宅喜晤子祯宋隐君歌以赠之
674671,送杨邦祯还蜀
518330,书示次儿祯 其七
646195,为马仲祯题一湾烟水
620914,崇祯己巳东陷遵化城永平节推增城何公死焉歌以识之
518327,书示次儿祯 其四
50495,次韵赠马仲祯全斯立二昆仲
470713,送钱受之侍郎枚卜罢归一篇（崇祯元年） 其二
488696,赠巫维祯太学
629361,崇祯庚午九月十九日为陈母八十佳辰其长君子含命某执笔而颂之
645049,西行示侄祯期还家
705598,登湛祯士新阁
470538,述古二首（崇祯初年） 其一
711784,崇祯皇帝御琴歌
698445,书示次儿祯
1227659,寄陈维祯兼呈揭公公许为故妻作传
1164525,冬宵引赠司马承祯
657114,梦送张万祯
593338,同韦纯显崔德卿周之祯蒋国仰集顾叔震宅赏菊得闲字
1218919,和周子通助教同张元祯倡和诗卷子
655065,送李应祯中舍赴南京车驾分得朝字
560474,吴淞秋色图为沈汝祯题
509481,谢郭汝祯送双桂且索其邻家菊
1252095,题洋江林彦祯所藏洋江春晚图
645149,送侄祯期还家
631100,忆崇祯丁丑寓鹫峰寺上元日早朝
470717,送钱受之侍郎枚卜罢归一篇（崇祯元年） 其六
470718,送钱受之侍郎枚卜罢归一篇（崇祯元年） 其七
356869,浣溪沙·题江建霞所藏屈翁山手书崇祯宫词册
50501,为马仲祯题一湾烟水
826652,金缕曲·题京师枣花寺所藏青沟禅师绘红杏青松卷。禅师官明崇祯朝副将，随洪承畴出关，易代后弃官为僧。是图盖隐寓松杏山之战，纪亡国之悲也。卷长三十余丈，二百年来名流过客题咏殆遍，或流连光景，或托讽微言，鲜赋其事者。甲子夏五宗子戴姊丈自江南来，偕游萧寺，展卷移晷，归寓赋此，未题卷上也
617757,崇祯元年元日立春歌 其二
576901,幽谷辞为范孟祯先生赋
477632,南阳宅访徐祯卿
682287,杂感十首（崇祯元年）
617756,崇祯元年元日立春歌 其一
681089,赠张世祯别
599688,和韵呈欧祯伯亲丈 其二
721412,九日湛静斋亦宋乔梓载酒元明石室登高同郭公鹫湛天沐天及祯士文安泽君介以长儿端木纵饮至夜月高而还地为甘泉先生书院故址碑碣存焉二首
548628,王元祯太学别余久矣一日谒余山堂遂赴留都试赋二绝句送之 其一
1211328,中秋可行招饮因诵东坡明月明年何处看之句座中请明初可行各和其韵予得二首皆用三叠体仍命祯赋 其二
706596,崇祯癸未贼购捕峻亟先母舅玉卿谭翁以死誓脱某兄弟于虎吻谢世以来仰怀悲哽者三十馀年翁孙以扇索敏侄书字缀为哀吟代书苦不能请先兄俯和益以老泪淫淫承睫不止
683491,宗伯董丈枉饮岘山泛碧浪湖时范太史伯祯陈都谏体乾在坐太史将赴召北上宗伯遂成一章予嗣得其二一用公原韵一用近赠公韵
543402,寄李惟寅欧祯伯四首 其二
246140,念奴娇·代阿邸吊日本冲君祯介
508481,梅庵为杨祖顺祯赋
431201,春日偕小女永祯公园看梅
543401,寄李惟寅欧祯伯四首 其一
470485,读从兄南安令崇祯太平曲有感
470712,送钱受之侍郎枚卜罢归一篇（崇祯元年） 其一
518329,书示次儿祯 其六
427966,重叠金 霍子祯唐佩玑七十双寿，并同度金婚，拈此曲为祝
524234,仆思李白落雁之游徐子亦有知章鉴湖之请念人悲离申此短赠徐子者祯卿也
656890,刘氏孟祯迎晖楼
1178950,答司马承祯上剑镜
470720,送钱受之侍郎枚卜罢归一篇（崇祯元年） 其九
691627,崇祯四年秋月重葺三洲岩题壁
518331,书示次儿祯 其八
568711,末五子篇 其二 李参政维祯
581478,闻允祯选南部主事意其怏怏诗以慰之
50532,送马仲祯之颖州
512420,送李应祯下第南归得慎字
522691,赠徐祯卿
518326,书示次儿祯 其三
536781,四十咏 其二十六 徐迪功祯卿
548629,王元祯太学别余久矣一日谒余山堂遂赴留都试赋二绝句送之 其二
518332,书示次儿祯 其九
593727,立秋先一日同黄君庆顾叔震周之祯游满井过观音院逢珍公
470734,杂感十首（崇祯元年） 其五
66525,过以祯西庄
470732,杂感十首（崇祯元年） 其三
696316,送钱受之侍郎枚卜罢归一篇（崇祯元年）
646186,次韵赠马仲祯全斯立二昆仲
602791,初冬至淩江旅寓同何尚锡邝建弘何尚祯丘朝仰黄汝良月夜宴集
518325,书示次儿祯 其二
685141,述古二首（崇祯初年）
476001,过以祯西庄
