1038551,送陈汝玉谒三川大资政左丞吴公
204073,送陈汝功起宰永春
550844,送陈汝翔游龙虎山
551266,秋日陈汝大邓汝高陈振狂陈子卿陈幼孺袁无竞兴公弟集绿玉斋时余与子卿幼孺下第归自长安汝高将使浙中兴公将游白下
514440,万福寺送文明与倪舜咨李宾之二学士傅曰川吴原博谢于乔三谕德林亨大修撰陈汝玉给事李士常侍御联句 其二
534255,送陈汝信
550418,五君咏 其二 陈汝翔
488789,九日陈汝大招集林氏园亭同陈幼孺郑性之康孟担徐惟起袁无竞分得阳字
562462,题友人陈汝谐璞墩
560483,致乐堂诗为陈汝中作
941004,鄂溪呈陈汝昌
551308,八月十四日夜招张孺愿钱叔达谢脩之陈汝大王玉生袁无竞集平远台观万岁神光二塔灯分得八庚
649633,题竹赠陈汝衡之云南佥事
502774,海上赠陈汝机
859998,送陈汝功起宰永春二首 其二
170148,鄂溪呈陈汝昌
811441,次韵陈汝臣见赠
699103,游仙词寿陈汝大
551134,秋日陈汝大载酒林氏水亭
653753,送温州挥使陈汝玉朴庵之孙
551361,舟次枫桥寄陈汝大先生
551672,游仙词寿陈汝大 其三
551293,寒食日陈汝大园亭看海棠
579199,麻竹笋谢友兄陈汝谐
427950,清平乐 壬寅重九陈汝衡枉过寓斋，出示新词索和，次韵奉酬
551428,四月晦日邀屠田叔钱叔达陈彦宗陈汝翔王玉生陈惟秦陈幼孺王粹夫陈正夫曹能始林子真兴公弟西湖观竞渡分得寒字
351335,送陈汝玉谒三川大资政左丞吴公
48437,和韵寄答陈汝砺掌教
579083,和陈汝谐感怀二首 其一
509449,芝轩为陈汝宏题
470093,八月朔日王元直招集南楼送陈汝翱之东粤王玉生之清漳沈从先还姑苏徐兴公之建溪陈惟秦之聊城蒋之才之广陵余返白下
509238,送陈汝善还姑苏
522424,陈汝玉濒行留卷索诗因阳孙奉寄
859999,送陈汝功起宰永春二首 其一
699134,与陈汝大鳌峰宴集
551375,送陈汝翔游惠州
1241960,皆梦轩为陈汝嘉赋
551297,邀黄仲高张孺愿钱叔达张公鲁陈汝大陈汝翔陈惟秦王玉生陈幼孺王粹夫颜廷愉曹能始兴公弟雨中集万岁寺即席送徐仲和归钱唐
551297,邀黄仲高张孺愿钱叔达张公鲁陈汝大陈汝翔陈惟秦王玉生陈幼孺王粹夫颜廷愉曹能始兴公弟雨中集万岁寺即席送徐仲和归钱唐
660455,寄陈汝玉都阃
584151,与晁汝吉陈汝忠二参相翠屏山院宴集
514439,万福寺送文明与倪舜咨李宾之二学士傅曰川吴原博谢于乔三谕德林亨大修撰陈汝玉给事李士常侍御联句 其一
654894,陈汝玉安江楼诗次沈时昜司空韵
681729,送陈汝璋州博之蕲庠
550380,与陈汝大鳌峰宴集 其二
684562,和陈汝谐感怀二首
54373,八月朔日王元直招集南楼送陈汝翱之东粤王玉
494754,送陈汝晦分教万州
480176,和韵寄答陈汝砺掌教
699136,五君咏 陈汝大
551673,游仙词寿陈汝大 其四
551670,游仙词寿陈汝大 其一
760597,次韵陈汝臣见赠 其二
550415,贻陈汝翔
487805,秋夜仝吴湛之陈汝鉴过康孟担草堂
702381,万福寺送文明与倪舜咨李宾之二学士傅曰川吴原博谢于乔三谕德林亨大修撰陈汝玉给事李士常侍御联句
607521,赠陈汝砺刺史请告寿母二首 其二
1141447,春夜喜陈汝晦见过
551151,陈汝大六十初度
550842,柬陈汝大
760599,次韵陈汝臣见赠 其四
550426,赴京酬陈汝大见送之作
521337,陈汝砺宪使自云南入觐升左方伯
502952,赠邑造士陈汝登之军中
195453,春夜喜陈汝晦见过
502736,书梅江陈汝畴家藏古画
686177,赠陈汝砺刺史请告寿母二首
551306,七夕邓汝高民部招集玉皇阁同佘宗汉谢脩之明府邓道鸣阃帅钱叔达王粹夫山人陈汝大康元龙袁无竞秀才陈幼孺孝廉兴公舍弟赋分得五歌
899654,浪淘沙令 题陈汝朝百鹭画卷
1106224,送陈汝功起宰永春二首
550413,酬陈汝大
511063,代陈汝岳谢李世卿撰玩琴轩记
551282,送陈汝翔客建溪书林
607520,赠陈汝砺刺史请告寿母二首 其一
550379,与陈汝大鳌峰宴集 其一
1222865,三月十二日自殿庐归舍梨花盛开薄暮与陈汝海花下小饮
760598,次韵陈汝臣见赠 其三
550927,秋日载酒同陈汝翔黄伯宠惟起惟扬二弟访王玉生郊居
550417,五君咏 其一 陈汝大
760596,次韵陈汝臣见赠 其一
551133,送林熙工陈汝翔陈伯孺潮上人游武夷
551671,游仙词寿陈汝大 其二
579084,和陈汝谐感怀二首 其二
