403386,惜余春慢 乙亥八月廿二日题自摄小影
779507,云淡秋空 八月廿一，屏山姊招看桂花
429674,八月廿七日与宰平视瘿公殡于法源寺
1240494,八月廿三日芙蓉花下留南宫岳山人饮明日岳山人过玉山南宫老矣不知复几聚首观花听琴情不能堪因赋长句并简玉山
825011,八月廿七日挈孥渡江居武昌大潮街湖舍 其一
846024,如意令 寿王学老八月廿一
145776,八月廿七风雨大浸
522183,有怀味苓赋诗未就闰八月廿三夜梦与诵之有所更定而不甚明了寤而足成
1207683,八月廿一日惟寅徵君踏雨过林馆为留终日因诵近赋绝句三首爱其词致清婉辄走笔次韵如上古道寥寞人以角逐声利为务惟寅独逍遥恬淡之乡时来□之篇章翰墨之事岂易得也哉 其二
784525,八月廿四日至山庄草堂荒秽手自芟薙悠然有作
365578,奉谕改于八月廿四日回銮感赋
751814,八月廿三日偕徐性臣重游慈仁寺 其二
168231,己亥八月廿一日除书予拜太平兴国宫祠官呈赵
480651,八月廿三日夏店驿遇国公入奏得云字
798686,明月生南浦 八月廿一日克己领事宴余山中，出册索题，即席赠此
1016503,八月廿七风雨大浸
253212,八月廿九夜梦起怀扬儿
1242190,辛未八月廿三日大风雨口号
515617,甲寅岁八月廿七日过大监戴公城东清适园亭漫成一律
846201,寿星明 庆黄宰秩满八月廿七
381372,八月廿七日挈孥渡江居武昌大潮街湖舍
1207682,八月廿一日惟寅徵君踏雨过林馆为留终日因诵近赋绝句三首爱其词致清婉辄走笔次韵如上古道寥寞人以角逐声利为务惟寅独逍遥恬淡之乡时来□之篇章翰墨之事岂易得也哉 其一
708338,念奴娇  花下小饮时方上书有所论列八月廿五日也用东坡赤壁韵
1216080,八月廿四日起行驿至通州作
247347,惜余春慢·乙亥八月廿二日题自摄小影
1236537,八月廿一日惟寅徵君踏雨过林馆为留终日因诵近赋绝句三首爱其词致清婉辄走笔次韵如上古道寥寞人以角逐声利为务惟寅独逍遥恬淡之乡时来□之篇章翰墨之事岂易得也哉
306416,八月廿八日沅叔招为蓬山话旧第二集视所藏明内府写本翰苑群书
843182,八月廿八日沅叔招为蓬山话旧第二集视所藏明内府写本翰苑群书
786101,奉谕改于八月廿四日回銮感赋
846131,百字歌 寿父子同日八月廿五
286397,八月廿四日至山庄草堂荒秽手自芟薙悠然有作
458441,二零零七年八月廿六夜醉书盆花
950914,己亥八月廿一日除书予拜太平兴国宫祠官呈赵季茂
72331,八月廿三日芙容花下留南宫岳山人饮明日岳山
462791,八月廿七日十六时许天忽有异，狂飙疾雨计五分钟顿收，霞透夕阳双虹并见，历此奇观叹而搦管
522475,兼善赴义塾南渠有诗予亦继作八月廿四日也
845720,水调歌头 寿王枢密，又得子八月廿六
846501,壶中天 寿朋友八月廿二
829553,八月廿七日挈孥渡江居武昌大潮街湖舍
569122,张守有温甫学士擘窠书老柏行余以仲昭太卿画竹配之时万历丁丑之八月廿五日守诞辰也眷属在里中将有就馆者并以为祝
816966,八月廿三日偕徐性臣重游慈仁寺
452984,八月廿九夜梦起怀扬儿
404921,谒金门·丙午八月廿三日壬仲保泰招游鹭鸶潭，自小格头山行十余里，憩食潭上。复渡水陟岭，乘台车趋龟山归。潭在鹭鸶岭下，旧有大树，白鹭群集其上，今云鸬鹚者，误也
66927,八月廿三日夏店驿遇国公入奏得云字
825012,八月廿七日挈孥渡江居武昌大潮街湖舍 其二
1248934,己酉八月廿三日雨至廿六日乃开霁赋五言呈德常
751813,八月廿三日偕徐性臣重游慈仁寺 其一
1207684,八月廿一日惟寅徵君踏雨过林馆为留终日因诵近赋绝句三首爱其词致清婉辄走笔次韵如上古道寥寞人以角逐声利为务惟寅独逍遥恬淡之乡时来□之篇章翰墨之事岂易得也哉 其三
793690,衢州道中八月廿一日为余六十生辰感赋
305366,八月廿七日与宰平视瘿公殡于法源寺
