1181270,谷自乱离之后在西蜀半纪之馀多寓止精舍与圆昉上人为净侣昉公于长松山旧斋尝约他日访会劳生多故游宦数年曩契未谐忽闻谢世怆吟四韵以吊之
162579,戏同舍与内竞
635436,宿西乾山白云精舍与则己师夜话
102440,沐浴启圣僧舍与赵德麟邂逅
650353,扈从车驾巡边过裴村田舍与杨少傅共酌
941287,戏同舍与内竞
561321,清河村舍与闻唐二公小酌
737127,重过韬光禅舍与松岳上人话旧出示书画册子即赋长句再题
84550,东邻筑舍与儿辈访之为小留
184258,胜果僧舍与叶养源论武侯出处作数韵
182262,寄奇父·似闻北舍与南邻
621000,南归已渡江闻万茂先就徵至扬州因买舟还访客舍与郑超宗诸子相聚旬馀茂先赋诗见赠用韵奉答三首 其三
620999,南归已渡江闻万茂先就徵至扬州因买舟还访客舍与郑超宗诸子相聚旬馀茂先赋诗见赠用韵奉答三首 其二
625210,泊樵舍与莂公宅师谈金轮旧事有感
1153090,晚出府舍与独孤兵曹令狐士曹南寻朱雀街归里第
1187599,南山旅舍与故人别
559812,官舍与乡友夜酌
31152,南山旅舍与故人别
883111,胜果僧舍与叶养源论武侯出处作数韵记之
628090,十八夜多异精舍与超有上人坐月
921983,沐浴启圣僧舍，与赵德麟邂逅
1053614,静舍与蔡秀如承事会话
620998,南归已渡江闻万茂先就徵至扬州因买舟还访客舍与郑超宗诸子相聚旬馀茂先赋诗见赠用韵奉答三首 其一
6020,晚出府舍与独孤兵曹令狐士曹南寻朱雀街归里第
708895,玉漏迟  武陵寓舍与介皇兄
565872,泗州精舍与明慧上人谈禅一首
515406,南山梅盛开以将北行不得赏立春日始克至精舍与客夜饮听逸清歌上清词有作
931035,东邻筑舍与儿辈访之为小留
704593,南归已渡江闻万茂先就徵至扬州因买舟还访客舍与郑超宗诸子相聚旬馀茂先赋诗见赠用韵奉答三首
