559404,送景修之博兴二首 其一
505041,送杨敬修之京
689326,鹅湖馆中别詹修之
517528,立春早朝赐酺答郑编修之作
590269,因王脩之邀饮和山岩二首刻一
695587,送景修之博兴二首
551308,八月十四日夜招张孺愿钱叔达谢脩之陈汝大王玉生袁无竞集平远台观万岁神光二塔灯分得八庚
221302,前庑两学录罢职公堂求经明行修之士充员时蜀
487944,鹅湖馆中别詹修之 其一
1217543,送方以愚编修之嘉兴推官 其一
648679,送彭学修之兴宁知县
1217544,送方以愚编修之嘉兴推官 其二
245331,休宁朱肖严葺其先大父岐山书为堂藏修之所而
541710,送来阳伯常脩之薛允执高大克石复朴偕计
677036,别友夏同孟阳无敕亦因修之君长过林女郎天素月下听天素弹琴琵琶因索余诗走笔纪事
245332,修之所而·闭门读书非俗人
182184,自开善寺饭已赴彦修之集新陂初成次其韵
512877,因病不预纂修之徵用呈馆中诸公
1235103,送方以愚编修之嘉兴推官
966218,自开善寺饭已赴彦脩之集新陂初成次其韵
506973,送佥宪王彦修之四川
225045,绝句·大药修之有易难
593601,送彭稚修之兰溪文学并寄胡元瑞
672939,送陈用脩之辰州府通判
1087543,作室为焚修之所拟步虚辞
575016,送莫如山应王郡公纂修之聘兼柬陈廷猷
918242,休宁朱肖岩葺其先大父岐山书堂为藏修之所而徵诗于余余闻其先伯父由释褐职教姑苏今其父子能世家学不坠遗基是可敬已为赋二章 其二
1116059,休宁朱肖岩葺其先大父岐山书堂为藏修之所而徵诗于余余闻其先伯父由释褐职教姑苏今其父子能世家学不坠遗基是可敬已为赋二章
918241,休宁朱肖岩葺其先大父岐山书堂为藏修之所而徵诗于余余闻其先伯父由释褐职教姑苏今其父子能世家学不坠遗基是可敬已为赋二章 其一
881029,前庑两学录罢职公堂求经明行修之士充员时蜀人杨时发当其选杨君以贱姓名荐或谓余求之蜀人董□行越人俞季渊永嘉陈行之咸以为不然余亦自揆焉而记以诗云
551306,七夕邓汝高民部招集玉皇阁同佘宗汉谢脩之明府邓道鸣阃帅钱叔达王粹夫山人陈汝大康元龙袁无竞秀才陈幼孺孝廉兴公舍弟赋分得五歌
487945,鹅湖馆中别詹修之 其二
559405,送景修之博兴二首 其二
251441,谬谏·怨灵修之浩荡兮
