1083356,徐彦猷寄示诗数章皆隐约世外语诗律深妙岂胜叹仰辄次韵和呈彦猷素富学未壮而弃场屋故诗中极道江湖放浪之乐以动荡其心志而卒反之以古人出处之义当有隐君子弄舟烟雨之外倚其声而歌之亦可以一笑也 其二
935022,乡人或病予诗多道蜀中遨乐之盛适春日游镜湖共请赋山阴风物遂即杯酒间作四绝句却当持以誇西州故人也 其二
825289,高楼侨居歇浦戊申小春适鼎胡耗至海上讹言腾沸出门怅惘中信步至张园夕阳黯淡风叶翻飞车马亦已阑珊逡巡间于尘辙中拾得残纸书啼血三首字迹敧斜语义诡痛盖攀髯堕弓小臣之辞也 其二
552902,用万玉麟先生端午韵四首先生临淮知县公父也 其二
731530,乞假十日日课一诗兴到吟成不计工拙虽数茎拈断亦养疴之一术也 其二
1004173,屏居北郊自秋涉冬绝省人事触绪有感托之讽吟书云前一日缉成八章寓兴抒情非以言诗也 其二
1005412,正仲思归作篆畦今夜月十诗非篆畦月乃雁苍月盖杜子美鄜州月之意也予作十章乃篆畦月也 其二
861605,杜工部有同谷七歌其辞高古难及而音节悲壮可拟也用其体作七歌观者不取其辞取其意可也 其二
862761,旧闻邵叟名今识面目于诗句字画中辄取二诗赓之他日会面亦旧相识也 其二
604403,读沈司马伯含被言十二章有感用来韵却赠孤愤离怀黯然对深或可观予同社不必万人传也 其二
934093,梦中江行过乡豪家赋诗二首既觉犹历历能记也 其二
791880,岁在癸丑，张君尔常有《六十自慨》之作，以歌当哭，情见乎词，荏苒三年，迟未赓和。今次原韵，藉以书怀，不作寻常寿辞，谅亦张君所乐与也 其二
802343,由二亩甸往方广入山已深忽抵一大池周七八里荷花弥望人家临水而居蜃墙红窗花竹衣桁倒影镜中戏询舆人欲买全湖直几何对云不过百金乃知山乡之业贱不可言古人买山非直耽其幽寂三径之资不当与买宅买邻同价乃可安耕凿长子孙今世惟求近城市价亟昂而租入转少取其贫时易售而已购产而欲其易售悲哉购者之愚也 其二
1038213,嘉祐中余尹河南与少师李公明龙图董巨源集贤王伯初同游龙门渔者得鳜鱼数十尾以助杯柈饮兴皆欢日月云迈几二十年感旧念游作忆鲈诗乃思鲈之比也 其二
608037,友竹欲从扬州登陆赴京口占赠别时二月十六日也 其二
570378,赠八十翁何中翰迁故世庙侍臣也 其二
