566903,今来自岭海者云扶桑花也予昔所见殊不类是殆大苏所咏涓涓泣露紫含笑焰焰烧空红拂桑耳花家剪双头见寄始觉首四作之误乘酒漫成六首以赎差错插砚水瓶嫣然有笑语意岂亦怜老人之衰眊耶复取馀沥浇之当缠头耳滇蜀村歌云披蓑衣打杖头鼓风流在何处予拟答乡谚云雪落长江里依旧化作水何不落则雨却要是个底不知花神有知作何平章夜见梦云叟所谓黄连树下弹琴也 其二
604467,邓玄度观察以归兴十章见寄用来韵漫赋草土馀生不宜拈弄笔墨第兰契久阔芳讯遥临掩泣抒怀罪我勿计也 其二
462795,中秋后一日，与二金一红轰饮清穆，约拈四支韵，各作论诗绝句以證才情，俱非止饕腹酒肠也 其二
609804,有所思二章怀国倩也 其二
508752,夏日游宣府李挥使北园席上步于景瞻韵二首时天顺庚辰六月也 其二
570915,周山人稚尊游豫章时己十余年矣今日忽访我金陵容鬓非昔而风范不衰复出吴兴徐生一札徐别亦十年屡有言其无常者似一日得两故人喜成二绝以赠稚尊时己丑之夏四月也 其二
598232,送揭阳郑生兼讯其伯父贡元二首生归德郑使君之子也 其二
559271,己酉立秋前四日同郑德进谢行可游吉水寺塔归宿江上德进有诗纪游余未及和丁巳搜箧得诗始为步韵时五月望后也 其二
498772,武夷有茶灶石酒杯洞大藏峰翰墨峰仙机岩棋盘石天壶峰大小廪石幔亭峰仙迹石水帘洞投龙洞汉祀坛大隐峰升真洞一线天灵岩石晚对峰虹桥金鸡洞钟峰玉女峰妆镜台铁笛岩天游峰钓矶石偶即景写怀馀未尽书也 其二
677487,何封君社中二首即何振卿父也 其二
641806,俞东村示教雨窗感兴佳作连篇累牍寓意深远譬如雍门之琴能使听者堕泪讽咏之馀勉强追和不翅鸣瓦釜而配黄钟也 其二
459091,六月十二夜梦甲起作。头日甲廿二生日也 其二
956538,但能之提刑相别十年自曲江远寄二诗叙旧良厚次韵为谢亦以首章奉怀略道湘南分携故事末篇自述年来衰病不复故吾也 其二
971544,经旬不作诗今日霜晴可喜问梅沈园得两绝句此坡所谓痼疾逢虾蟹也 其二
1062825,任邱道中值雪赠权邑宰曹弋取道曹河间同僚也 其二
539283,署中独酌先后共得十首颇有白家门风不足存也 其二
752995,读渔洋山人诗集感怀云图宾石超群诸先生皆渔洋裔也 其二
524731,游覆釜山诸诗八首乃无量主人成果地也 其二 苦鍊庵
1042302,见召西阳池泛舟仍示雅章因成二绝希笑览也 其二
659238,柴虚犹子洵领南畿贤书东归将北上春官予作二诗前道其实后以鼓其勇也 其二
569367,程孟孺以善诗及书与余交十五年矣今春过余则书法益妙云将入燕应中秘之募索一言为赠余久厌笔研且畏绮语虚名落长安人耳不得已勉成二律塞白孟孺慎毋以示人也 其二
572308,九月初五日得三弟京闱第三报志喜仍用散木韵践前约也 其二
936414,秋怀十首末章稍自振起亦古义也 其二
552405,闻元方辞典教之职为省府所留遂用前韵以慰其怀归之念安其传道解惑之心也 其二
761067,卜算子 辛亥岁始春，故人治舟相约观梅于邓尉诸山，雨雪载涂，余以畏寒不出，因忆山中讨春旧游，次韵白石道人梅花八咏以示同志，一丘一壑自谓过之，若所作则伧歌无复雅句也。 其二
576256,幽居杂咏七十四首，自洪武十一年平原还家作也 其二十九
475671,余羁秣陵乞休累疏而格于新令郁郁之怀伏枕增剧遂效杜子美同谷体为秣陵七歌时丙戌九月既望也 其二
1005258,家藏画鹊二轴其一棠梨结子青黄叶亦虫蚀尚带晚花有鹊眠枝上枝若垂垂不胜者其一作攲竹一茎有鹊把竹磔螳螂而食之叶若振振而动摇者笔意精妙非黄筌不能也 其二
570315,余佐留枢诸曹掾中有南充刘璋者偶诸生试其文烂然已而竟从本格得官将归省叩余秋署乞一言之赠若有不释然者余闵其意走笔得二绝句付之时方乞休在告也 其二
1142513,洪平斋有官舍见月三首与程杨二公又各次韵中秋日休诸友用韵为戏奔逸绝尘之作未能拟其万一也 其二
576254,幽居杂咏七十四首，自洪武十一年平原还家作也 其二十七
459621,九月二十四重过陆城养殖场荷池，末首记姑妈语也 其二
679738,雪夜宿避风尘处梦夫人陈氏意极悲酸檃括其语为二绝句时万历乙未仲冬十六日也 其二
938780,韶石使君年丈扁舟过我于松桂林敬哦小诗留为一日款就寄石洲主人以发千里外一笑也 其二
1094825,送昌甫盖前晚独立涧上看桃花初开意思正适时见昌甫来也 其二
948866,甲申四月甲子夜梦以焦坑小团及宜春新芽送隆庆长老了远戏作柬云云矍然而寤枕上又补一颂以茶送达数日前曾有此意而一点千林非因想所及也 其二
419471,水调歌头二首·辛巳中秋前一日，柱尊招饮北极阁下。酒罢登山，素月流天，繁灯缀地，与数客歌啸林樾间，不知今夕何夕也 其二
530541,杂兴　癸夘九月也 其二
1094919,题墦间图孙季仲丈创意为之殊可玩也 其二
894130,府斋岁晏节物感人辄成拙诗二篇上寄昭文相公枢密太尉虽俚调无取亦盍各斐然之义也 其二
1001269,中都之嘉会门陈亦颜为堂曰城南书院取韩文公符读书意也 其二
576253,幽居杂咏七十四首，自洪武十一年平原还家作也 其二十六
1078000,南渡次琼管江山风物与海北不殊民居皆在槟榔木间黎人出市交易蛮衣椎髻语音兜离不可晓也因询万安相去犹五百里僻陋尤甚黄茅中草屋二百馀家资生之具一切无有道由生黎峒山往往剽劫行者必自文昌县泛海得便风三日可达艰难至此不胜慨然赋诗二首纪土风志怀抱也 其二
794119,臣虞杂取米盐琐事，成二十四诗，余读而悲之，勉答其半，韵既不次，语复不伦。亦犹杜陵野老同元使君春陵行，非敢云属和也 其二 粟
767696,咏美人所制杨妃舌用海汁捣糖霜里玫瑰瓣为之取其形似也 其二
663813,家豢鹦鹉为狸奴所毙予伤之赋短律二篇书呈同志期有以慰我也 其二
576252,幽居杂咏七十四首，自洪武十一年平原还家作也 其二十五
1052672,仲至迁居同曹家西巷在蔡湖之北也 其二
561621,扈跸南巡自出京至在途蒙恩赉诸物各恭纪一绝以志荣感其酒馔牲品等物尤多盖不能悉纪也 其二 赐方袋银瓢刀箸三事
532571,西屏诗二首为馆人叶直夫赋直夫卜居宣武坊北门对西山以西屏自号也 其二
570290,伤俞四盲子伯安为其父仲蔚绝后也 其二
837332,九日庭菊未开桃花反盛放异而索句得七绝四章但取协韵不分次第也 其二
561083,晨观风洞登叠綵楼历拱辰亭亭为镇守傅中贵所创岩峦奇耸千里在目诸巡院有诗予辄次韵是日介行登赋不尽兴也 其二
659070,送颜楫楫同年水部澄之之子也 其二
539527,閒居无事偶亿古人恒语成联者因以所感足之不论其合与否也 其二
911533,伏蒙赐和复用韵二章拜呈可谓出丑衒媸惟自叙鄙怀并以见区区敬慕之意姑惟教之是所愿也 其二
545115,王长公闭关修玄谢绝一切独期余过访禅堂余以母病迄今未赴春日索居读公所致诸札掩袂太息怀不能已积成七言律八章用摅鄙臆词之荒陋不暇计也 其二
1217175,读瀛海喜其绝句清远因口号数诗示九成皆寔意也 其二
650474,腊月四日同杨谕德晚出访友人李伯葵余回至长安街坠马遂在告数日胡学士先以诗见寄明日杨复以诗来相嘲因次韵奉答且以自解也然后诗结语盖答杨意也 其二
568919,答汪子且志规也 其二
707195,寒甚下山访病儿存没道中逢夏仲力下小竹舁慄不能语哀我无衣授之以絮归山有咏志感也 其二
509937,吴主簿诗主簿名则宣平人吴黄门仕伟之父也 其二 过与弗取
978503,凄其岁晚不胜乡国坟墓之情再得四篇赠宗之毋以示他人也 其二
830221,丁巳元日赋长篇后意未尽而韵已将尽乃再赋此二章吾平生所得在此也 其二
806824,采桑子 正月二十日从吴天石处获读纬云弟京邸春词因和其韵声情拉杂百感风生一夕遂得十首不自知其所云也 其二
1134266,鄱阳汤仲材以其家息庵存斋东涧三大老鄂州黄龙寺僧惠璋入石诗装为一轴求士大夫赞颂紫阳山下方回之先人字元章嘉定甲戌与晦静先生同年为下偈言而不及此意可乎仲材能作祇夜回作伽佗可也 其二
573133,侍家大人游太和发郡城偕游者僧宝方冷云尹生也 其二
837365,与王君慕韩同游竹峰山寺辟东轩小坐山翠万重环列左右俯视帆影片片从槛底飞过即景觅韵爰纪以诗不暇计其句之工拙也 其二
604448,立春日胥江驿东方舟友人时丁未冬十二月二十一日也 其二
870256,园樱伤老也 其二
618689,泊邵村闸李郭朱王四子邀饮移席僧寺寺荒凉甚去后不知其何地也 其二
633805,甲寅秋予以乞经从燕台南归留滞白门顿弟在吴门专侍至之住数日去陵阳订其复至白首天涯易散难聚不已之情未欲遽远且天老人住山无力世乱难安相与共依座下此什送之并似六康居士念予亦一编户民也 其二
419282,鹊踏枝八首·半塘老人谓冯正中《鹊踏枝》十四阕郁伊惝恍，义兼比兴，次和十阕，载在《鹜翁集》中。予转徙岭南，抑塞谁语。因忆不匮室赠诗，有“君如静女姝，十年贞不字”之句，感音而作，更和八章。以无益遣有涯，不自知其言之掩抑零乱也。 其二
1067389,潘邠老尝作诗云满城风雨近重阳邠老亡后无逸兄用此句足成四篇今兹重阳只数日风两不止凄然有怀作二绝句念泉下二人不再作不觉流涕覆面也 其二
605594,正月十五夜奉迎邑侯雨中观灯雅集岁癸亥余尝为榕溪灯夕词十二章今采民谣复为甲子灯夕词十六章抚今追昔喜可知也 其二
570268,公瑕先生在白下两月许别去得四绝句送之皆实际语也 其二
1142407,郡人有朱买臣严子陵按史传买臣吴人尝出为会稽太守名曰乡郡会稽盖今两浙之地吾郡特以去州二十里曰朱池为买臣昔居之地难以考见其实子陵晚耕于富春山中则今钓台是也二公出处不同心事亦异姑以其同为郡人各赋一首使九原有作不怅来者之不我知也 其二
501475,予己丑夏辞家客燕二十年江南风景往往画中见之戊申冬来南京今年六月二十九日奉旨使安南长途秋热年衰神惫气郁不舒舟抵太和舟中睡起烟雨空濛秋意满江宛然画中所见埃为之一空漫成二绝以志之时己酉七月二十四日也 其二
663267,泉之滨哀隐士也 其二
980322,圆机和邵大及予二诗可谓压倒五更枕上诵叹不已复作谢之足见来章之美能发人情思也 其二
561492,憩舟九石潭下同合溪方伯登张侯庙有作张侯者南唐时将有功封侯方伯之远祖也 其二
663995,奉梧山李司马送别士重文学之都昌王府文学者司马弟也 其二
436380,秋日牡丹为友人赋病久无佳思姑作俳语三章以应命对觞一呼卢可也 其二
910015,求志书院诗四首陈师道履常之所居也 其二
428550,张相臣姻兄精于医学，寓居津门，每于诊治之暇，时常著书。丁卯春，偶以咏怀诗赐及命和，江才识浅陋，唯有勉步原韵，凑四首奉和而已，未敢云诗也 其二
569577,寿莫方伯先生子良七十时诞辰为四月七日也 其二
411897,论诗 杂阅古今人诗偶有所见辄成一绝计约十首今只存其四略见昔年读诗眼力也 其二
1216214,抵楚门即船主戴廷芳廷玉家也 其二
545902,直沽逢丁元父夜谈作余与元父别十年馀而邂逅中野真万里不期之遇也 其二
653703,舟中与徐文海叙旧追赋旧事三首词虽婉媚意实经常总不能效丽则之言然亦非香奁体也 其二
1079747,本中将为海陵之行念当复与子之作别意殊愦愦偶得两诗上呈并告送与壮舆叔用也 其二
524042,柬赵训导二首赵安边营将家子读易人也 其二
576255,幽居杂咏七十四首，自洪武十一年平原还家作也 其二十八
559282,诸生官拱微为龙池先生子戊午自镛访余北归五绝送之余辛卯令镛拱微始生今始称诸生也 其二
939247,文儒见和四诗钦叹高妙谨用韵为答卒章问讯汝霖幸呈似也 其二
558997,奉和任公祖冬日较士以东莆期诸生之作时公正推参知候命也 其二
965548,实弟以诗来督作会文又因太原侄寄声欲作不速此文人狂客所为非素所望也今以五绝奉寄虽小阻高兴若能从而绎之则有味也 其二
573159,德山遇大智龙湖旧侣也 其二
677317,甲子元日试笔作画兼题二绝句示家弟无垢是岁予五十将携家至武林有别业在皋亭桃花坞中山水佳处也 其二
1085593,过毕家池有姓陈者送香橙八颗云有子在太学名景初有佛舍额曰永固院临水而门闭有神祠云江南吴王庙必孙氏也 其二
832716,望江南 意有未尽，再缀二章，红友之律，顺卿之韵，皆足称词苑功臣，新会陈述叔、临桂况夔笙并世两雄，无与抗手也 其二十四
770215,冯庵移居穿虹滨以诗贺之是日四月八也 其二
1058097,翻书见舍弟去年自寿归郓道中诗怅然怀想久不作诗因集句为答用渭城体可歌也 其二
469494,东坡作戒杀诗贻陈季常季常自后不复杀岐亭之人多化之有不食肉者适有感于吾里宴会之侈因和前韵得二诗示闲仲肯倡此戒于里中不也 其二
1100015,方遣三山学记仍寄径山文字笔砚稍宽梁秘阁忽送金钟千颗此吾乡名品也 其二
538934,大宗伯董丈用均用前押韵三章见贻惜别陈怀徵之梦寐至云遥想六桥冠盖集知无一日酒杯閒又云水国共怜门似水山神应望屐登山其托羡湖山寄好风雅真无匹矣复以三章追挽先君子奏之松柏之间霜飙骤零真足肠断不揣辄复和谢依来数其乱篇专志哀感知鉴泣乌之私不以续貂为诮也 其二
956797,藻侄比课五言诗已有意趣老怀甚喜因吟病中十二首示之可率昆季赓和胜终日饱閒也 其二
597258,午日谒屈贾二先生祠有感而赋岁嘉靖甲寅也 其二
546479,翌日吴肇成招同司马洎诸君浮筏遇雨泊梁下有挈歌姬赵某至左手三指爪皆长六寸馀司马记中所谓邯郸才人者也 其二
460354,满庭芳　和薛信中，时中秋次日也 其二
559926,和高侍讲先生韵五首时宣德七年也 其二
654695,弘治三年春三月望上御奉天殿亲策天下贡士命公卿及文学之臣赴东阁读卷都宪屠公赋诗以纪盛事诸公相属和之仆忝同事谨步严韵不自知狗尾续貂之不可也 其二
841000,寄怀姚秋坪刺史刘雪子通守严星樵明府许午楼孝廉卞晋卿明经均于秦淮作平原十日之饮者也 其二
545964,睿父丈既有西江之擢复闻台疏挽留将以大观察移节会稽三郡兴文怆别更赋六诗异时一棹溪头绝倒子猷之兴尽也 其二
537958,大梁王君用章既去昆山为客部副郎邑人俞仲蔚集古语为八咏饯行要余与家弟和之各得四首毋论其辞之当与否而感德怀贤要自不异也 其二 桂楫汎河中
1078871,老夫辞荣里居行年八十酒间漫成拙句二首述意而已不以示外也 其二
544604,诘旦用孺太史亦以赋茄古体至余读之清思道发更赋排律二章章十二韵茄为物最贱吾两人盛为品题若此士固有遇不遇也 其二
936730,读王摩诘诗爱其散发晚未簪道书行尚把之句因用为韵赋古风十首亦皆物外事也 其二
1001656,罗子琳来就广漕试予以檄出至西江峡口怀古感兴两篇寄子琳后篇救子琳穷病也 其二
604435,自护城驿驰张桥时大雨雪舆从多冻人过响马铺市酒脯慰劳之遂止宿焉因歌苹泽之诗获我心矣偶成二律明日乃行则春二月朔也 其二
730096,题唐六如集即赠易笏山方伯笏山自言六如后身也 其二
545500,赵中丞以督学檄祠乡贤中丞宗鲁别驾尊人也 其二
971474,连雪不已复作绝句咏之及六而止殆未免不愁冻杀之诮也 其二
553135,和韵奉答金郡公仲和太守父也 其二
521793,合州训导丘陵资阳训导徐泰皆贡自安宁持原复提学书来临别各赋一诗为赠泰之先吾华亭人也 其二
896996,老舅寓陈诸况不能尽布以二诗代书得閒为和佳也 其二
408162,于归之夕素琼见示赠别四章倚韵奉和时别绪满怀工拙不计也 其二
597260,午日谒屈贾二先生祠有感而赋岁嘉靖甲寅也 其二
622638,雨后春归招杨承之小酌待月作留春诗五绝三月十七日也 其二
1220539,高昌喜山近仁在江州为太常院使礼部尚书新其堂构各有名扁为赋三题馀未暇也 其二
604396,题登高送远册赠郑计部辂思社丈出守括苍时重阳后一日也 其二
900234,岭南荔枝不可寄远龙眼新熟辄以五百颗奉晦叔或可与伯逢共一酌也 其二
604224,尹用平同人以八睡诗见示二年矣己未秋日园居尚寝无觉因忆用平来诗戏笔复之遂得四章诸君子珠玉满前西园公瓦砾继进者雅终不妨奏曲喷饭亦足解颐也 其二
576251,幽居杂咏七十四首，自洪武十一年平原还家作也 其二十四
746169,滇中十月后梅已作花而绿叶满枝未落也 其二
968145,吟社递至诗卷足十四韵以答之为梅水村发也 其二
869083,太博同年叶兄以诗及建茶为贶家有蜀笺二轴辄敢系诗二章献于左右亦投桃报李之意也 其二
928582,甲子秋八月偶思出游往往累日不能归或远至傍县凡得绝句十有二首杂录入稿中亦不复诠次也 其二
972062,九月一日晨起风物凄然不胜怀远之思作五首寄和父憨申并烦转致湖池二州也 其二
576247,幽居杂咏七十四首，自洪武十一年平原还家作也 其二十
563480,一日怀抑之也抑之之赠既尝答以三诗意若有歉焉是以赋也 其二
876984,昔陈北山赵南塘二老各有观物十咏笔力高妙暮年偶效颦为之韵险不复和也 其二 五憎
531761,同年会以新秋同年雅集为韵六首在会者顾佥宪溱刘佥宪乔余给谏经梁侍御世骠伦侍御以谅及予也 其二
960563,己未秋杪虏骑云扰圣主神断斥逐元奸台臣始有抨弹之疏因成二绝一惜言者之后时二愿局面之坚凝也 其二 喜新晴
605137,止园主人以双鹤诗三章见示用来韵奉酬病目命笔不足存也 其二
518252,洪武庚辰八月一日为抚安人民至衣锦乡访安湖书院拜先圣殿谒先贤祠栋宇倾挠廊庑荒茀顾瞻感叹念欲兴修兹焉经始以俟毕工历初十日夜坐挈矩堂新月满庭谩尔兴怀成五言近体十首时儒生钟民敬亦次余韵以纪一时之清兴也 其二
603864,燕邸同王道坚醉后限韵戏为子夜离歌捉笔纵书命侍童击缶促之倡和迭就顷刻盈壁亦一快也 其二
990094,横舟弟相别年馀阻一江之水彼此皆病未有可会之日向得一两诗多悼亡感慨不忍和答今乃粲然盈册老眼增明适兹喜雨取登楼喜雨之作先次韵三章不能多也 其二
962591,一春屡有阳明之约雨辄尼之将旋幕侍外舅来游解后二羽衣一能参上道一能知大丹竟日留话喜赋二解时清明日也 其二
851806,上亭北轩对月吹笛得才元舍人昭华引醉霜月草堂吟皆诗谱也 其二
499369,登景州塔隋开皇中故迹也 其二
1034127,官满寓济川馆得叶嘉仲和朱宰梅花诗次韵云作梅花诗当用欧公雪中酬唱今凡诗家常用字一切屏去乃佳朱令君仆未识面见足下道其语差强人意又与斯君德润善乃赓此诗以兴譬诸草木吾臭味也 其二
1214498,雪壑海云使君所自号也 其二
663053,春怀六首怀方侯也 其二
434756,李仲佐辽东之豪士也初识于大元帅席上怪其议论英发坐客尽倾至于通练世务商较人物虽博学老儒或有所不及仆喜其为人临分以二诗赠行且将以为定交之券也 其二
543915,过淮上读贞烈沈氏实编作沈为侍御吴公妾余丙子吴公所取士也 其二
641440,奎倚席渭城校室伏承耕学袁公雪樵秦公二先生远自故里寄惠新诗教诏之谊暌离之情备溢乎辞捧诵再四感愧交并不能已已既次严韵属和奉怀因兴起丰城云门河南公武潜夫诸先生例借前韵各成一首以见区区向往之私至于落句嬴瀛互用亦足明仆于二先生无少偏党也 其二 答雪樵
449612,鹊踏枝  丙辰春村居多暇效半塘老人和阳春词十四首聊记一时情事无关风人之旨也 其二
492188,五月十日雨宴集周氏亭子适溪水暴至不得归因留夜宴乐甚后数日叔用将之豫章次韵赠答以识感也 其二
876982,昔陈北山赵南塘二老各有观物十咏笔力高妙暮年偶效颦为之韵险不复和也 其二 五爱
552511,洪贾许索芭蕉作四绝以致意贾府通判尊翁洪府同知尊翁也 其二
407798,七十古稀今不稀三章 蓦地六十九，打油三章，时1988年春节也 其二
576248,幽居杂咏七十四首，自洪武十一年平原还家作也 其二十一
492137,十二月十日晚同吟所郭光辈奉陪溪南隐君与其诸郎群从观舍傍蔬畦仍出山后临眺江上周览林麓追念旧游抚余羁怀益深感慕因赋五言近体六诗柬同游诸君亦以识嘉会也 其二
548699,送张洪阳宗伯请告还公有閒云馆盖旧业也 其二
1089092,以茶芽焦坑送周德友德友来索赐茶仆无之也 其二
459579,四月二十七酒兼病卧肖处作词六章。二十八日归更作二章与肖，其二肖父母也 其二
570789,赵凡夫游太学太学师为赵丈汝师其父少参公凡夫之王父佥宪公同年也 其二
572582,集平山堂用平山字为韵偕游者方子两谢生也 其二
545232,赋八诗后鄙怀不能己巳伏枕呻吟再成八律共前什计十六章辄命使者焚之几筵次公有灵当为我击节三神之顶浮一大白也 其二
555944,夜梦一人戴无翅纱帽谓诸葛孔明也予揖而就之谓予曰尘世富贵何足道哉唯唯既觉漏四鼓矣以诗纪其事丁未夏六月十四日也 其二
509039,图韩范二公经略西夏事迹于正心堂之壁各系以诗著志也 其二
590653,螺峰别号与洪司训题次其韵也 其二
576250,幽居杂咏七十四首，自洪武十一年平原还家作也 其二十三
1005674,新历未颁遗民感怆二首贻王达善曹季辩胡山甫戴帅初诸君皆避地客也 其二
568917,安履山房二章为醉梦生赋上言感下言适也 其二
514178,张廷芳李若虚二宪副及江廷诸宪佥约游西湖左时翊大参后至得联句十首时成化癸夘三月三日也 其二
611181,行赣州道中爱其山川丛僻田家茅屋半带云烟拟作隐居诗十首以寄幽怀倘他年解组便可山斋实事非浪语也 其二
561647,符子太仆出守韶郡赋此以赠符子昔尝作倅于韶也 其二
492615,闻子启太守自历下书报来春还家又新有凤雏之喜感念旧好为欣跃不寐辄赋二首先寄难兄竹庭徵君宜载酒一庆也 其二
1094623,昌甫以诗送香任尚书任和答且辱见及次韵昌甫不必寄尚书也 其二
719888,后秋兴八首自壬寅七月至癸卯五月，讹言繁兴，鼠忧泣血，感恸而作，犹冀其言之或不诬也 其二
959998,都下赋归奉别天台金彦如惠子明沈新之马景昭赵寅仲并呈于晦仲时与寅仲以上诸兄初相识诸兄又约便道至王先生岁寒堂相会也 其二
548780,送黄层城先生还蜀李座师婿也 其二
573161,荅龙君御见忆之作君御诗云我家德山不得住故末句云云用博一笑次萹聊为解嘲亦可作一段公案也 其二
576229,幽居杂咏七十四首，自洪武十一年平原还家作也 其二
739933,题欧舫新诗时届季冬栖息三慧庵相约蔬食习养生之术余未克赴也 其二
679754,衰年苦寒暑赖此二物相陪戏各为一绝聊以遣怀非叹老也 其二 竹夫人
955882,杨少监寄西征近诗来因赋二绝为谢诗卷第一首乃石湖作别时倡和也 其二
1035816,某以雨有嘉应遂占有秋辄采用家弟韵赋二绝句少赀勤恤之诚也 其二
1158154,鲁望示广文先生吴门二章情格高散可醒俗态因追想山中风度次韵属和存于诗编鲁望之命也 其二
1029103,曾守谯楼既成邀宾从同登议辟双门以复旧观从士子请也 其二
1079521,十一月五日与才仲弟相别于白沙东门之外怅然久之不能自释乃知谢安石作恶之语不为过也因成八诗奉寄可见别后气味亦可并示京洛间亲旧也 其二
988021,丁亥岁予留建康梦登大桥仰视霄汉有金书阁字北斗落落布列其侧昨夕夜直坐石渠桥忽见七星低昂正倚秘阁而金书大字俨然梦中所见信知世事皆有定分非偶然也 其二
532422,与马子师山夜酌月岩楼联句奉相教和亦见野人近况也 其二
658203,乔节妇宗大希大祖母也 其二
546582,寄亭四绝为邑文学祝宗旦题从其子树勋请也 其二
1062883,任邱道中值雪赠权邑宰曹弋取道曹河间同僚也 其二
654724,子弟廷祺园中紫牡丹盛开邀予赏之醉后赋二律以识其事时弘治八年二月廿二日也 其二
1003529,内机知府郎官再和示教清拔遒美手不能置用韵以答嘉贶愧不足以当琼瑶之报也 其二
633533,时十月十四日作本师诞日也 其二
803993,七月十一日定甫上公招饮水磨沟别墅依斗亭亭公所建也 其二
576249,幽居杂咏七十四首，自洪武十一年平原还家作也 其二十二
1249495,西湖酌别便欲过草堂因冗未果小诗二章奉寄稍凉当买舟相晤也 其二
980354,通叟年兄视以柳侯庙诗三首辄亦有作所谓增来章之美也 其二
