175811,同范智闻五月十四日夜赏月
529586,绿雨楼赏月联句二首 其二
249527,中秋夕与平仲湖边赏月
339831,和阎灏中秋赏月
882484,丁未孟秋夜月明如中秋因思范公守南阳赏月及坡公赤壁之游皆七月望也作短歌记之
843088,中秋味云招集瑩园赏月分韵得宵字
1250969,中秋张来仪宅赏月
616977,桂林中秋舟泊訾家洲同似景侄赏月 其一
882475,丁未仲夏赏月
529585,绿雨楼赏月联句二首 其一
760632,衡仲以西瓜见饷，兼约可园赏月 其一
870283,仲夏赏月次雪斋韵
143629,丁未仲仲赏月
776554,中秋赏月
339760,赏月·老来尤喜见朋游
672433,中秋娄元善家赏月限韵二首 其一
658087,和蒋侍御中秋赏月诗
616979,桂林中秋舟泊訾家洲同似景侄赏月 其三
1044442,八月十六日张伯常见访赏月四首 其一
312725,八声甘州·乙亥仲秋明尼亚波利斯城赏月怀乡
703339,从罗浮下山与张给谏相订度中秋于尹澜柱园亭张公以行止不果予独泛舟泊南海神祠上浴日亭同四藏自显自坚铁关诸子赏月
368820,虞美人·双树居赏月
315900,夏历八月十四日，遵义教堂赏月
405047,夏历八月十四日，遵义教堂赏月，呈杰人司铎1941
1087308,赏月
984715,中秋日赴史漕赏月二首 其二
71420,江城子·沁州神霄宫赏月
859573,陪友人中秋夕赏月
510680,中秋期友赏月遣苍头致馈以诗迓之
453403,持社同人登金陵凤凰坛赏月相约同步太白韵
293974,人月圆·余居效墅四度中秋癸巳园易主中秋夕居城适济南关友声君来小酌同赏月因赋
151086,暑退秋夜赏月
174379,中秋日赴史漕赏月
616729,十六夜赏月
1107764,仲夏赏月次雪斋韵二首
865566,十四夜赏月
1085063,府帅王公中秋宴客蓬莱阁分茶赏月于清白亭某以幕僚与焉坐上成二绝 其一
315632,秋夜赏月·风清月白水无波
462311,中秋江上赏月次坡老韵
634262,与诸子宿万鍊师道院赏月
459411,中秋暮将往肖作赏月之饮，适医院一病友为家戚接归。数日未能救之，时尚未断呼吸，既拔氧气，只在分秒矣。既至肖家，众备酒食，予偷隙作此
1084968,中秋赏月蓬莱阁呈同官
672434,中秋娄元善家赏月限韵二首 其二
956355,己丑中秋寓宿玉堂闻沈公雅大卿刘正夫户部集张园赏月走笔寄之
443361,六月之望夜宿庐山含鄱口置酒赏月
634212,从罗浮下山与张给谏相订度中秋于尹澜柱园亭张公以行止不果予独泛舟泊南海神祠上浴日亭同四藏自显自坚铁关诸子赏月 其二
105785,今秋行·八月十五夜赏月
1143098,中秋苦雨赵知微登天柱峰赏月图
293982,拜星月慢·甲午中秋与娄生稼庵钟美赏月依梦窗韵
421161,百字今 偶经阊门酒家，得宋淳熙，明永历钱各一枚。用宋曾觌淳熙九年中秋，随驾诣德寿宫起居上皇赏月应制韵
252813,甲申中秋泉州赏月晚会赠政协傅主席
617489,秋闱赏月
798936,虞美人 双树居赏月
492126,南溪山上赏月
307509,桂枝香·中秋蒙赏月饼
945878,满江红 其一 丁未九月望赏月
1030428,忆瑶姬 南徐连沧观赏月
340011,赏月·白首相知有几人
403867,拜星月慢 甲午中秋与娄生稼庵钟美赏月依梦窗韵
340010,八月十六日张伯常见访赏月
252385,秋夜赏月和东遨旅途新作
157896,十六夜月色佳甚对酒效乐天体招酒伴赏月
511028,中秋与朱甘节白沙赏月呈甘节兼寄其从子玭
595608,元宵与阎天秀老友赏月
403869,人月圆 甲午中秋敏庵举家自蜀返而正刚去津余聚后归家更独赏月有作
293984,人月圆·甲午中秋敏庵举家自蜀返而正刚去津余聚后归家更独赏月有作
967730,水调歌头 赏月
994537,和江西王仓中秋赏月韵
518932,中秋赏月 其一
253032,望海潮·癸亥中秋兰江中洲赏月
528666,十六夜赏月野塘宅
1121894,八月十六日张伯常见访赏月四首
1043124,冬夜赏月
799214,乾隆癸丑中秋，陈榕溪夫子自三河遣人走京师，招湘读书官舍，且命即日束装，趁节赏月，盖下车之第七日也。距今夕乃五年矣。夫子俸满不迁，湘复留滞都门，偃蹇如故。极思来会此节，一话万端，以病新起不果。对月孤吟，惆怅无极，时嘉庆三年戊午八月十五夜 其一
497282,同谢都尉玄妙观赏月
512453,有竹庄赏月
253612,中秋江上赏月次坡老韵
12969,秋暮忆中秋夜与王璠侍御赏月因怆远离聊以奉寄
403855,人月圆 余居效墅四度中秋癸巳园易主中秋夕居城适济南关友声君来小酌同赏月因赋
372635,八月十四日留监牧张伫职方赏月
1048004,陪东坡中和堂赏月
1044445,八月十六日张伯常见访赏月四首 其四
131728,次韵董三余约赏月丹瑞香
1030783,和李子真八月十四日夜赏月之什
1202101,江城子 沁州神霄宫赏月
508195,十四夜赏月
1125656,中秋日赴史漕赏月二首
64814,绝句·才经赏月时
626183,秋夜达生适生克蒙克慎昌言斐廷诸昆弟赏月得月字
184394,丁未仲夏海陵官舍家大人赏月作诗恭和元韵
685145,中秋娄元善家赏月限韵二首
1044387,中秋赏月
496318,鹊桥仙 中秋白鸥园赏月，次陈大尹三首 其三
868922,临江仙 其十五 乙卯八月九日，南山绝项作台新成，与客赏月作
465648,中秋夜友邀塘边赏月
838665,中秋蒋梓舒明府在河口釐厂楼上邀饮赏月
180779,微雨中赏月桂独酌
945199,次韵董三馀约赏月丹瑞香
363179,中秋苦雨赵知微登天柱峰赏月图
444061,戊子初冬紫清山赏月
109121,仲夏赏月次雪斋韵
701214,桂林中秋舟泊訾家洲同似景侄赏月
293872,秋霁·中秋同韵绮鹤孙西明泛舟昆明湖赏月迟景荣吹笛王瑞芝操弦和之
462385,望海潮　癸亥中秋兰江中洲赏月
1044265,和阎灏中秋赏月四首 其一
1097106,仲夏赏月次雪斋韵二首 其一
1003960,十四日同张伯修罗坚甫大智赏月探韵即事感兴殊激懦衷翌日会保福辱诗示教借张大韵同赋
1121863,和阎灏中秋赏月四首
339761,赏月·今夕无烦秉烛游
616980,桂林中秋舟泊訾家洲同似景侄赏月 其四
1216863,中秋张外史招赏月失约赋以谢之
363785,陪东坡中和堂赏月
278845,长泾月饼·中秋赏月称佳节
812879,乾隆癸丑中秋，陈榕溪夫子自三河遣人走京师，招湘读书官舍，且命即日束装，趁节赏月，盖下车之第七日也。距今夕乃五年矣。夫子俸满不迁，湘复留滞都门，偃蹇如故。极思来会此节，一话万端，以病新起不果。对月孤吟，惆怅无极，时嘉庆三年戊午八月十五夜
1044268,和阎灏中秋赏月四首 其四
439973,赏月
909555,水调歌头 其二 长沙中秋约客赏月
870286,丁未仲夏赏月次雪斋韵
976112,鹧鸪天 其一 中秋赏月和宋卿
531857,中秋登楼赏月分得宵字
903398,折丹桂 中秋南湖赏月
445724,中秋夜中镇社友相约异地同时赏月时在旅途
1083159,中秋赏月
772584,中秋赏月
700090,乙丑秋喜家赏月二首
319489,中秋夜中村公园赏月兼吊日故大将丰臣氏
590827,中秋偕同志海珠寺赏月
216181,陪友人中秋夕赏月
1044444,八月十六日张伯常见访赏月四首 其三
409057,重九贲园赏月
1105625,府帅王公中秋宴客蓬莱阁分茶赏月于清白亭某以幕僚与焉坐上成二绝
909616,临江仙 甲寅中秋和刘舍人赏月
638175,试院中秋赏月和章方伯
414778,中秋至草地独酌，赏月归后成咏并寄松亭
586415,东园赏月
1136972,水调歌头 其一 丙申中秋，两道人出示四十年前濯缨楼赏月水调。臞仙和，意已尽，明日又续之
617068,十五夜麓庵赏月步韵
672115,中秋与同寅团亭赏月
947749,满江红 其一 中秋前同二使者赏月
273368,重九贲园赏月
1044267,和阎灏中秋赏月四首 其三
443802,乙酉八月既望，露台赏月，怅然有作
496316,鹊桥仙 中秋白鸥园赏月，次陈大尹三首 其一
174380,赴史漕赏月·秋色平分日
465679,中秋夜与李八老塘边赏月
582881,中秋赏月
1006897,洞仙歌 其二 十三夜再赏月用前韵
306360,中秋味云招集莹园赏月分韵得宵字
249438,中秋夜友邀塘边赏月
497600,三月望与谢都尉玄妙观赏月
967718,水龙吟 仙源居士有武林之行，因与一二友携酒赏月，饮于县桥之中，乃即事为之词
339916,中秋赏月·张筵赏秋月
300605,中秋至草地独酌，赏月归后成咏并寄松亭
367111,八月十四夜建中二三友过我清话因共把盏赏月从容谈笑
189278,赏月·天净无一云
296833,中秋蒋梓舒明府在河口釐厂楼上邀饮赏月
693722,绿雨楼赏月联句二首
518059,水仙子 拟中秋赏月
465782,中秋夕与路荆湖边赏月
830957,桂枝香  中秋蒙赏月饼
62970,天宝宫词·赏月看灯乐未央
1202080,无俗念 大安山栖云观中秋赏月
339832,中秋赏月·万里边城月
249465,中秋夜与李八老塘边赏月
1044443,八月十六日张伯常见访赏月四首 其二
261675,中秋赏月·三分明月二分秋
698721,鹊桥仙 中秋白鸥园赏月，次陈大尹三首
143628,丁未孟秋夜月明如中秋因思范公守南阳赏月
465876,中秋夕与平仲湖边赏月
984716,中秋日赴史漕赏月二首 其一
455257,秋夜赏月和东遨旅途新作
1085064,府帅王公中秋宴客蓬莱阁分茶赏月于清白亭某以幕僚与焉坐上成二绝 其二
213116,金盏子·赏月梧园
799215,乾隆癸丑中秋，陈榕溪夫子自三河遣人走京师，招湘读书官舍，且命即日束装，趁节赏月，盖下车之第七日也。距今夕乃五年矣。夫子俸满不迁，湘复留滞都门，偃蹇如故。极思来会此节，一话万端，以病新起不果。对月孤吟，惆怅无极，时嘉庆三年戊午八月十五夜 其二
961563,暑退秋夜赏月
237690,舟中独酌·赏月东西两地遥
168569,和江西王仓中秋赏月韵
1191640,秋暮忆中秋夜与王璠侍御赏月因怆远离聊以奉寄
189235,西江月·赏月几成喜雨
20913,秋暮八月十五夜与王璠侍御赏月因怆远离聊以奉寄
531746,十六夜补之席上赏月分韵得水字
638246,中秋当湖文庙赏月
404524,八声甘州·乙亥仲秋明尼亚波利斯城赏月怀乡
518933,中秋赏月 其二
596609,乙丑秋喜家赏月二首 其一
1085295,予还自武林葺先人弊庐净扫一室晨起焚香读书于其间兴至赋诗客来饮酒啜茶或弈棋为戏藏书数百卷手自暴之有小园时策杖以游，时遇秋旱驱家僮浚井汲水浇花良天佳月与兄弟邻里把酒杯同赏过重九方见菊以泛觞有足乐者每览镜见苍颜白发亦聊自叹也作小诗十五首 其十二 赏月
1039644,八月十四日留监牧张伫职方赏月
1062549,中秋与二三子赏月分韵得中字
688456,中秋赏月寄京中诸友
637288,中秋赏月寄京中诸友 其一
948669,杨谨仲教授和徐师川中秋赏月诗邀余次韵
496317,鹊桥仙 中秋白鸥园赏月，次陈大尹三首 其二
671972,中秋夜登仲山新楼赏月
1005720,十六夜月色佳甚对酒效乐天体招酒伴赏月
693658,中秋赏月
339917,中秋赏月·浮云收绝塞
122731,中秋清晖阁静坐因思前二年石湖四明赏月
1083015,八月十四夜建中二三友过我清话因共把盏赏月从容谈笑不觉云容朦胧桂影淡泊端知是夕聚首骚池再谐佳会遂成四韵
811444,衡仲以西瓜见饷，兼约可园赏月
321408,赏月·还舍八十日
402001,秋霁 中秋同韵绮鹤孙西明泛舟昆明湖赏月迟景荣吹笛王瑞芝操弦和之
960350,赏月
634211,从罗浮下山与张给谏相订度中秋于尹澜柱园亭张公以行止不果予独泛舟泊南海神祠上浴日亭同四藏自显自坚铁关诸子赏月 其一
512449,中秋赏月与浦汝正诸君同赋
500222,秋夜赏月
1044266,和阎灏中秋赏月四首 其二
445741,中秋前一日《乌江风情杯》诗赛评审事毕偕诸老思南华严寺赏月
204780,和文文山中秋赏月韵
968217,和文文山中秋赏月韵
364108,冬夜赏月·晕逐阴风起
241463,和李子真八月十四日夜赏月之什
339741,中秋赏月·碧落无云玉鉴飞
1202174,贺圣朝 太平兴国观中秋赏月
243656,十四夜赏月
152117,杨谨仲教授和徐师川中秋赏月诗邀余次韵
883214,丁未仲夏季弟海陵官舍家大人赏月作诗恭次元韵
873647,同范智闻五月十四日夜赏月
616978,桂林中秋舟泊訾家洲同似景侄赏月 其二
883202,丁未仲夏季弟海陵官舍家大人赏月作诗和韵
937822,微雨中赏月桂独酌
1097107,仲夏赏月次雪斋韵二首 其二
1203778,月中仙 赏月
596610,乙丑秋喜家赏月二首 其二
1217860,次韵周子符中秋赏月
955614,中秋清晖阁静坐因思前二年石湖四明赏月
788332,响泉山房赏月
249493,中秋夕与路荆湖边赏月
411698,中秋夜中村公园赏月兼吊日故大将丰臣氏
882669,丁未仲夏海陵官舍家大人赏月作诗恭和元韵
637289,中秋赏月寄京中诸友 其二
760633,衡仲以西瓜见饷，兼约可园赏月 其二
