924149,送张恕朝奉南京签判二首 其二
527257,赠盛程斋年兄赴南京兼简二三同年
447198,庚午远游诗十五首 其六 南京
452600,夜班飞机北京至南京有寄
524789,闻英玉拜南京屯田主事戏寄
665251,陈子道脩来南京求铭父墓赋此送之
650227,赠熊元节还南京
515622,次陈白沙太史韵送广东何贡士赴南京光禄署正
921045,罢徐州，往南京，马上走笔寄子由五首 其四
312797,木兰花慢·题子苾师《沈祖棻诗词集》兼寄千帆师南京
509177,挽南京大理何寺丞衷
180979,赴南京掾·士固难推挽
829954,寄仲容南京
513912,次南京尚宝泰和杨公述职诗韵 其二
535711,送陈沂赴南京卫幕 其六
553713,别南京
481271,送杜亚卿赴南京
558230,送秦主事还南京兼柬王学士 其二
654908,送陈师召侍讲升南京太常少卿 其四
538026,送汪光禄迁南京尹
271687,芙蓉草在南京
517721,丙申秋繫回南京经歌风台
513429,送克俭克宽弟省觐南京 其一
535706,送陈沂赴南京卫幕 其一
513430,送克俭克宽弟省觐南京 其二
1090490,过南京
583496,南京陆孝子刲股诗
264997,望江南·南京春望
650507,赠吴舍人胜复任还南京
513918,送陆顺之赴南京户部主事 其二
507336,随侍太孙殿下回南京途中观射雉
485535,南京口号五首 其一
447585,南京玄武湖
441261,金陵城上乌南京大屠杀国家公祭日作
680982,别眉山余都宪陛辞回南京二首 其一
514370,送三原王天锡赴南京右府都事 其三
521451,送宫谕李子阳先生赴南京太常少卿
674893,南京过旧内 其一
513655,追和江东之学士留寓南京上新河徐氏园亭之作 其一
100168,寄子由·前年过南京
175058,汴都至南京食樱桃
274300,新荷叶·闻南京玄武湖荷花盛开，缅怀旧游，用赵德庄韵
58828,送倪尚书之南京
980127,三月五日南京梢工来报船经金人残毁之后尚有书籍存者且以二诗为信忽睹高仲夷唱和诗不胜感叹辄用其韵识其事率同赋
1201598,减字木兰花 别南京拆字
415973,芙蓉草在南京 其一
513457,夏至日雨病中喜二弟来自南京
514442,题南京邵思谊漏月轩有庄孔阳同年记 其一
1090177,宿南京城下县
506956,送从弟尚文复任南京吏部郎中
514501,送长洲孙进士林赴南京刑部主事
264961,金缕曲·僦居南京饮虹园，答张庚由弟兼过从诸友
661115,送太宰廖公之任南京
414710,南京陷落二首 其二
285421,过南京夜闻东北流亡学生唱“松花江上”
535710,送陈沂赴南京卫幕 其五
485539,南京口号五首 其五
513917,送陆顺之赴南京户部主事 其一
674910,和张司马仲湜韵送工部梁主事叔永还南京叔永厚斋阁老之弟予辛未门生
501443,南京早发
514619,冶城篇一首送袁鍊师道钦还住南京朝天宫
274379,玉烛新·镫夕彦通自南京来话旧，因赠
428253,闻南京陷落
514523,次韵沈廷美尚宝考绩还南京 其一
381787,二月二十一日又至南京
315457,送御史莫资本还南京
407018,南京失陷痛作 其三
412264,东湖夜宿六七年由扬州归南京作
247102,自湘潭抵南京感怀
781456,南京六君咏 其一
54843,送徐中行南京工部
668604,送何少宰左迁南京工侍二首 其一
652235,寄南京张尚书
506976,送弟尚文回南京吏部
648045,送田郎中还南京武库
452761,航班延误，滞留南京禄口机场而赋
587379,赠吴白楼尚书南京吏部四章
485536,南京口号五首 其二
421629,至南京之翌日，登雨花台，吊太平天王，诗以侑之 其三
507667,舟过南京
1200836,导引 正隆六年六月驾幸南京林钟宫
417830,蝶恋花 和南京江城诗社社长李静凤女史于瘦西湖上韵
650187,赠李翊赴南京国学助教
513538,三月十七同日得王贡士寄来休宁腊月书马亚卿寄来南京二月书
655065,送李应祯中舍赴南京车驾分得朝字
652195,南京十咏 其一 钟山叠翠
600575,送临淮李秀岩留守南京 其一
272968,重至南京钟山望诸陵
665259,送陈国英侍御之南京次见赠韵
651539,望南京
918999,剔银灯 其一 途次南京忆营妓张温卿
829104,忆南京叠过夔门诗韵二首
49183,南京口号·圣帝明王德业尊
553813,送吴中书南京复职
666757,皇帝行幸南京歌十首 其九
671994,送姜用贞赴南京刑部因怀项文祥
650193,赠顾进士让南京刑部主事
512400,送李少卿还南京
315665,寄仲容南京
591590,南京三首 其一
654986,送别沈仲威乡友赴南京兵部
781461,南京六君咏 其六
921042,罢徐州，往南京，马上走笔寄子由五首 其一
648245,太常丁博士升工部员外赴南京
287501,虞美人·乙亥上巳，南京乌龙潭禊集，阻事未往，友人代拈“缀”字为韵
1167767,上皇西巡南京歌十首 其九
578962,弘治二年述职泊南京上新河和大里府吴守韵
528044,送范以载之南京
652197,南京十咏 其三 淮清柳色
578438,挽南京陆彦升父
542431,张㠠山廉宪晋阳以书见招因擢南京都宪不果行赋此寄意
648248,送陈时显归南京兼简广哲 其二
654895,送杨应宁赴南京太常
293060,南京大屠杀三周年感赋
513549,次南京钱学士先生入朝之作时先生方有少宰之命 其二
821849,玉烛新 镫夕彦通自南京来话旧，因赠
491719,十月一日至临濠点驿将归南京赋此奉酬德瑜萧虞部
58879,二妹婿书来数问南京消息戏书答之
477529,皇帝行幸南京歌十首 其七
554384,送刘智安主事赴南京
508210,送平江侯守备南京
1201381,苏幕遮 在南京乞化
681272,送杨维立之南京吏部
117705,次韵分司南京李诚之待制求酒
650273,分韵得西山晴云送萧郎中伯辰之官南京
654905,送陈师召侍讲升南京太常少卿 其一
575292,送张东白先生赴南京太常
384772,送何元朗南京孔目
695788,南京三首
514482,送翰林检讨方昌言考绩还南京
492916,余归自南京与舍弟子彦相见于清江舟中别去承寄绝句六章依韵奉答 其三
388508,送汪光禄迁南京尹
574076,闻吴宁庵转南京学士二首 其二
515502,南京工部尚书常熟程公哀挽 其一
650318,赠陈绍夔胡季南下第再试归南京胄监
514466,送杨维立侍读莅任南京
457952,贺新郎　和嘘堂兄南京大屠杀二首 其二
668766,送何元朗南京孔目
569084,咏诸功臣像二十六首 其二十四 故奉天翊运推诚宣力守正文臣特进光禄大夫柱国南京兵部尚书兼都察院左都御史总督四省军务新建伯赠新建侯王文成公守仁
254674,南京留守·赫赫金源帝子家
305855,白石老人莅南京谒谈感喟赋呈长句
575927,送人之南京
522376,南京摺扇名天下成化间尤重李昭骨王孟仁画兼之者誇以为奇而今不可得矣明善内弟以听泉主人扇索题其画则孟仁笔也展玩数四旧京风致宛在目前为书此以志感
509625,成化元年春予奉命偕赵总戎良佐提兵征两广四月望日师发南京次大胜关总戎以诗见赠次韵奉答 其一
991716,资政王侍郎南京留守
702359,次南京尚宝泰和杨公述职诗韵
652200,南京十咏 其六 凤台春晓
514893,送刘进士瑱赴南京祠部主事
829604,南京节署西园
821766,新荷叶 闻南京玄武湖荷花盛开，缅怀旧游，用赵德庄韵
420261,满庭芳 夏口公园与丹符、仲伟共话南京旧事，悽然于怀，因填此调
521149,奉饯圭峰董先生之南京
506941,送都御史熊槩之南京
827131,蝶恋花  南京解放五日武昌解放。四月二十四日效冯正中体四首 其四
781457,南京六君咏 其二
527068,送张主政用载之南京
305981,丁亥早春从南京飞赴北平
358310,将至南京简应介中
515869,成化庚子冬有南京礼部之命回视绾州符十载矣政教无成重自感愧赋此以别州之人士
579543,送徐子明之官南京刑部
282465,南京陷落·斜阳旧巷燕犹归
282485,南京陷落·依旧江城说石头
119193,送张恕朝奉南京签判
314044,忆江南·京江口
649792,题梅花赠宋洵南京户部检校
1245572,赋得桃叶渡送宋仲珩在南京
274306,阳关引·送淮甫六兄还南京，自言或将赴成都就其婿女，有黯然惜别之意
578085,送陈上舍回南京国子监
514658,南京户部尚书三山黄公哀挽
507648,南京送高教授赴选 其二
407813,过南京夜闻东北流亡学生唱“松花江上”
649928,题竹赠陈侍讲复职南京 其二
680257,送同乡金署正还南京
190015,南京妙峰亭·王公厌承明
562587,南京给事中童志昂和李商隐无题诗韵南京诸公多和之意盖有寓间出命予属和予村学究也不能外题以为诗姑咏史以复之 其四
562587,南京给事中童志昂和李商隐无题诗韵南京诸公多和之意盖有寓间出命予属和予村学究也不能外题以为诗姑咏史以复之 其四
510268,何宇新赴南京，来白沙告别云：此行且复见定山，时秋已尽矣，以诗送之 其二
647998,送廖主事还南京
384732,送冢宰朱玉峰之南京
509513,近得文儿书报数年间置有田若干亩予窃自念平生宦拙未尝有私积遗文惟南京常禄付文置产亦未必遽能得如此之多诚吾儿干蛊才优节缩日用所致也昌黎先生尝曰中世士大夫以官为家罢则无所于归吾今有所归志可遂矣喜甚赋诗美之且期望之
888105,至南京道中尚有莺声
677423,忆昔行寄陈廷评南京初唐体
431358,浣溪沙 南京明陵春望
652203,南京十咏 其九 朝阳晓望
538138,送凌云鹄谏议之南京兆
515797,南京户部主事王君彦奇作浮桥于上新河之钞关
514364,次韵奉送少宰王廷贵先生还莅南京 其二
252260,临江仙·南京莫愁湖
516699,南京诗应制 其四
649111,送吕仲贤赴南京户部主事
68024,长思仙·入南京赴蓬瀛
509626,成化元年春予奉命偕赵总戎良佐提兵征两广四月望日师发南京次大胜关总戎以诗见赠次韵奉答 其二
673505,送刘世英南京太仆
649624,题竹送康叔圭郎中之南京刑部 其二
1117072,送张恕朝奉南京签判二首
464126,念奴娇 壬寅六月余自南京渡江，归舟忽遇狂风暴雨，几不能泊。返抵旅舍，成此
1051460,次韵分司南京李诚之待制求酒二首 其一
689762,予己丑夏辞家客燕二十年江南风景往往画中见之戊申冬来南京今年六月二十九日奉旨使安南长途秋热年衰神惫气郁不舒舟抵太和舟中睡起烟雨空濛秋意满江宛然画中所见埃为之一空漫成二绝以志之时己酉七月二十四日也
501474,予己丑夏辞家客燕二十年江南风景往往画中见之戊申冬来南京今年六月二十九日奉旨使安南长途秋热年衰神惫气郁不舒舟抵太和舟中睡起烟雨空濛秋意满江宛然画中所见埃为之一空漫成二绝以志之时己酉七月二十四日也 其一
694380,赠闵督府还升南京秋官
691380,南京送高教授赴选
992918,送南京签判寇中舍
149062,送孙莘老移知南京
429438,晓雾自下关入南京遂登鸡鸣历览同泰寺台城诸胜
483572,南京遇苏平仲编修
274580,西河·南京访淮甫兄，信宿而去。用清真韵寄
976549,送修撰杨学士留守南京
781460,南京六君咏 其五
516696,南京诗应制 其一
1132512,南京遇马丈朝美
511647,送侍讲陈秉中掌南京院事
1167765,上皇西巡南京歌十首 其七
704726,送牛给事领敕命还南京三首
580773,送翰林侍讲陈师召升南京太常寺少卿
561154,南京户部后池双莲同干大司徒王公邀赋
494198,送南京大鸿胪刘克柔
846082,导引 三圣御容赴南京鸿庆宫 庆历七年
677448,下第留南京寄怀庄少府座主二首 其二
471286,谷日大雪口号二首（客南京） 其二
561261,送郑刑部之南京
268671,忆南京叠过夔门诗韵
694445,何宇新赴南京，来白沙告别云：此行且复见定山，时秋已尽矣，以诗送之
781458,南京六君咏 其三
496261,御带花 寄南京杨四泉光禄
661460,一鹤为南京唐道士赋
513913,次南京尚宝泰和杨公述职诗韵 其三
561648,赠王太常之南京
652199,南京十咏 其五 石城霁景
535709,送陈沂赴南京卫幕 其四
674608,哭南京吏部郎中华汝和
479125,送李世贤赴南京礼部侍郎
415615,谒南京中山陵
982644,南京妙峰亭
514785,送南京少宗伯尹正言先生奉表入贺礼成还任次南都赠行韵六章 其二
342665,和承旨给事寄酬南京致政杜相公
648775,送熊御史归南京
553809,写竹题赠举人柯启晖归南京卒业
660445,赠何提学粹夫升南京太常少卿之任
420215,浣溪沙 其一 南京明陵春望
290928,满江红·伤南京沦陷
559931,送黎知州恬之南京
692237,送陈时显归南京兼简广哲
822311,临江仙 自南京还苏州道中作
654933,送董寿卿吉士赴南京户部
1226676,南京遇山楼
702403,送南京少宗伯尹正言先生奉表入贺礼成还任次南都赠行韵六章
278910,闻南京陷落
431361,望江南 春日南京吟望
414966,丁亥早春从南京飞赴北平
288997,至南京之翌日，登雨花台，吊太平天王，诗以侑之
359468,与南京留守
699566,南京口号五首
649479,题竹赠人归南京
897843,泊南京登岸有作呈子由子中子敏逸民
535581,送邹学士赴南京
119196,南京签判·楚蟹吴柑初著霜
513657,追和江东之学士留寓南京上新河徐氏园亭之作 其三
52490,皇帝行幸南京歌·燕姬玉袖抱箜篌
600576,送临淮李秀岩留守南京 其二
597538,送潘尚书改调南京
492915,余归自南京与舍弟子彦相见于清江舟中别去承寄绝句六章依韵奉答 其二
57872,南京遇苏平仲编修
1250792,十月一日得南京音信喜而有作
514789,送南京少宗伯尹正言先生奉表入贺礼成还任次南都赠行韵六章 其六
557967,送郎中吴行德还南京
578080,送蹇冢宰震器英省亲还南京二首 其一
1054886,与南京留守
554268,过南京三首 其一
1167760,上皇西巡南京歌十首 其二
654983,送李立之复任南京太常少卿
691126,送青溪先生之南京吏部
264979,浣溪沙·南京明陵春望
558227,送王廷贵掌南京翰林院事
673511,送光禄寺卿李君之南京兼柬王宗贯
480847,寄南京大理廖少卿
829680,三月十二日四十八岁初度是日自上海赴南京
514861,送周原已院判还南京
432026,芙蓉草在南京
553735,送周编修复任还南京
51161,送李世贤赴南京礼部侍郎
508717,题画赠平江侯南京镇守
649109,送进士赴南京刑部主事
680983,别眉山余都宪陛辞回南京二首 其二
562196,苦两淮水泛溢往来不通缅怀南京故人鄮子宪为赋
668616,盛斯显南京司封
704049,成化元年春予奉命偕赵总戎良佐提兵征两广四月望日师发南京次大胜关总戎以诗见赠次韵奉答
521789,张虞咨以南京左军都事满考乞致仕升鸿胪寺丞南归会于崇武驿托附平安有感书赠
514788,送南京少宗伯尹正言先生奉表入贺礼成还任次南都赠行韵六章 其五
421628,至南京之翌日，登雨花台，吊太平天王，诗以侑之 其二
68005,玩丹砂·寄南京道友
554675,送锦衣刘公子往南京
580848,南京送东墅兄二首 其一
59946,御制山水图歌赐长春真人刘渊然归南京
352914,宿南京城下县
48501,送储静夫主事之南京吏部兼寄夏廷章
991319,送王宗说寺丞归南京
666500,送范师舜调南京兵曹兼讯顾英玉
513419,送李立之太常先生再赴南京 其一
689157,送汪二司业还南京二首
666755,皇帝行幸南京歌十首 其一
680783,奉送苏判府往湖广便归南京公干
434786,上南京留守完颜公二首 其一
684269,送陈沂赴南京卫幕
561580,报国寺阁饯都宪白川周公还南京
871693,予自南京留守推官循资为掌书记由将仕郎超阶至朝奉郎得蜀嘉州友人相贺者因答之
924148,送张恕朝奉南京签判二首 其一
514787,送南京少宗伯尹正言先生奉表入贺礼成还任次南都赠行韵六章 其四
685725,送蹇冢宰震器英省亲还南京二首
1167759,上皇西巡南京歌十首 其一
892800,寄献南京致政杜相公
574075,闻吴宁庵转南京学士二首 其一
591591,南京三首 其二
514784,送南京少宗伯尹正言先生奉表入贺礼成还任次南都赠行韵六章 其一
517842,自讼还南京赋
492918,余归自南京与舍弟子彦相见于清江舟中别去承寄绝句六章依韵奉答 其五
432131,南京失陷痛作
522179,王子仪将赴南京中府都事与乃兄子贞中舍来别赋此兼简成国朱公
381443,南京节署西园
991427,送韩签判玉汝还南京
639173,赠别范邦秀节推转南京春曹
513431,送克俭克宽弟省觐南京 其三
527218,发南京
1167761,上皇西巡南京歌十首 其三
293305,南京失陷痛作
