358041,将至南京·几日风尘困马蹄
513547,送中书舍人桐城何志廉赴南京刑部员外予较艺礼闱志廉实预事于帘内
404527,木兰花慢·题子苾师《沈祖棻诗词集》兼寄千帆师南京
468580,丁未初至南京登凤凰台
652204,南京十咏 其十 鸡寺晚钟
513700,阜城晚遇南京户部张彦质郎中附奏江南旱灾
702376,次韵奉送少宰王廷贵先生还莅南京
479632,送徐中行南京工部
485537,南京口号五首 其三
102993,送刘元忠学士还南京
651864,送牛给事领敕命还南京三首 其二
822303,柳梢青 偕潘慎明、陶叔南、范烟桥诸老赴南京，中途雨霁
658595,送白主事辅之还任南京
698968,谷日大雪口号二首（客南京）
518492,送都宪闵公赴任南京大司寇
58825,送杨侍读维立之南京
454385,报载日本首相参拜靖国神社忆南京大屠杀事感而赋此 其一
358042,将至南京·直谅多闻许我亲
287518,蓦山溪·过南京，寓白下路交通旅馆，嵩云谓蕙风晚年尝应军幕招，宿此逾月
454386,报载日本首相参拜靖国神社忆南京大屠杀事感而赋此 其二
479196,古城驿遇南京参赞机务兵部尚书薛公诗以送之并谢惠粲 其二
455183,临江仙 南京莫愁湖
704773,南京十咏 钟山叠翠
652236,送王郎中还南京
104844,送南京签判寇中舍
115452,自南京之陈宿柘城
385270,送何少宰左迁南京工侍
583345,送张西溪都宪之南京督粮
405620,虞美人 其二 庚辰重阳前三日方君壁妹在南京书肆中得满城风雨近重阳图盖前岁旅居汉皋时悬之斋壁者为题二词其右
514465,送曾士美侍读莅任南京
477530,皇帝行幸南京歌十首 其八
583303,南京察院连日阴
420910,水龙吟 庚申中秋，有怀南京、台北诸校友
419421,减字木兰花 祝南京市古都学会成立
449878,南京有忆
678904,赋得驰道玉声寒送罗泽御史之南京
560143,送黎知州恬之南京
280108,夏日怀旧·昔日南京住
580970,过南京会员外兄
1167766,上皇西巡南京歌十首 其八
329215,宁陵弟相送至南京因成四韵寄季一子之叔用
443410,唐多令　丙子八月赴厦门秋日佳会，途中小驻南京半日，裕陵先生席间以昆曲佐觞，作此曲并示步高、贵生、孟琪诸君
681857,陈师召之南京太常
580770,送南京兵部尚书韩君
1167763,上皇西巡南京歌十首 其五
466634,报载日本首相参拜靖国神社忆南京大屠杀事感而赋此 其二
668614,送冢宰朱玉峰之南京 其二
599815,寄家书南京偶题书缄
357839,和送张元方南京掾
562625,送陈宗尧侍讲署南京院事
681858,屠元勋之南京寺丞得何字韵
685790,南京给事中童志昂和李商隐无题诗韵南京诸公多和之意盖有寓间出命予属和予村学究也不能外题以为诗姑咏史以复之
685790,南京给事中童志昂和李商隐无题诗韵南京诸公多和之意盖有寓间出命予属和予村学究也不能外题以为诗姑咏史以复之
104768,送王宗说寺丞归南京
250021,南京乌衣巷
406330,蓦山溪 过南京，寓白下路交通旅馆，嵩云谓蕙风晚年尝应军幕招，宿此逾月。相与作词吊之
421630,至南京之翌日，登雨花台，吊太平天王，诗以侑之 其四
514363,次韵奉送少宰王廷贵先生还莅南京 其一
514443,题南京邵思谊漏月轩有庄孔阳同年记 其二
513668,送郑洗马赴南京太常少卿
215738,次韵奉和蔡枢密南京种山药法
388255,为张茂才赠张将军时治艘南京
1131791,南京种山药法
513420,送李立之太常先生再赴南京 其二
701681,南京送东墅兄二首
485538,南京口号五首 其四
829050,蝶恋花  南京解放五日武昌解放。四月二十四日效冯正中体四首
105742,资政王侍郎南京留守
562627,送李立之赴南京太常
480152,南京谒孝陵有述
528028,送顾侍御还南京
648207,送吴员外赴南京礼部
248275,航班延误滞留南京禄口机场而赋
52492,皇帝行幸南京歌·玄武湖中绿水多
689526,南京诗应制
264956,庆春泽·南京逢旧时学友，春年域外
514524,次韵沈廷美尚宝考绩还南京 其二
507050,送陈祭酒复任南京
652224,送吴祭酒还南京
421627,至南京之翌日，登雨花台，吊太平天王，诗以侑之 其一
921043,罢徐州，往南京，马上走笔寄子由五首 其二
453375,协和墓前凭吊即用其《至南京》韵
897716,自南京之陈宿柘城
286688,减字木兰花·纪念南京解放三十五周年
358311,将至南京·先生不得醉红裙
678734,南京翰林三年秩满偶书所怀
124087,寄献南京致政杜相公
562428,送刘绍和还南京
668612,送陈尚书南京工部
264998,望江南·春日南京吟望
477526,皇帝行幸南京歌十首 其四
675219,别都玄敬主事改南京礼部
666756,皇帝行幸南京歌十首 其二
654906,送陈师召侍讲升南京太常少卿 其二
1079620,癸已自南京过泗上
55735,寄南京大理廖少卿
683024,送冢宰朱玉峰之南京
704863,皇帝行幸南京歌十首
512393,送周尧佐赴南京
1059244,将至南京简应介中 其四
649927,题竹赠陈侍讲复职南京 其一
825227,三月十二日四十八岁初度是日自上海赴南京 其一
558568,送景方还南京
648247,送陈时显归南京兼简广哲 其一
500056,送御史莫资本还南京
650552,赠子仪张博士还南京胄监
681283,送吴学士克温之南京
401560,南京乌衣巷
815758,南京六君咏
649623,题竹送康叔圭郎中之南京刑部 其一
436575,上南京留守完颜公二首
652062,送夏希纯郎中归南京
1059241,将至南京简应介中 其一
479195,古城驿遇南京参赞机务兵部尚书薛公诗以送之并谢惠粲 其二
654919,南京大司寇周庄懿公挽诗
658411,送曾侍读士美之南京
248289,南京夫子庙
405865,人民解放军占领南京
515986,送项主事还南京
497734,送钱原博南京主事
538328,送詹簿家兄之南京
822053,西河 南京访淮甫兄，信宿而去。用清真韵寄
937980,送张迪功赴南京掾 其一
427449,满江红 伤南京沦陷
341778,次韵南京道中
821776,阳关引 送淮甫六兄还南京，自言或将赴成都就其婿女，有黯然惜别之意。作此慰之
1066645,和送张元方南京掾
515698,送庄孔旸年兄赴南京吏部郎中
553564,送钟子勤之南京复职中书
665216,送南京冢宰紫岩刘公考绩入京
687052,余归自南京与舍弟子彦相见于清江舟中别去承寄绝句六章依韵奉答
514368,送三原王天锡赴南京右府都事 其一
515674,送傅佐还南京
535534,送孙毅斋学士赴南京
654562,送金郎中还南京分韵得韡字
246057,夜班飞机北京至南京有寄
561169,黄子伯固昔为兵部郎官率同列谏止巡幸，被杖斥归。今上登极起为南京大理丞，奉表入贺饯以是诗
827626,忆南京叠过夔门诗韵二首 其二
103422,送韩签判玉汝还南京
414709,南京陷落二首 其一
558229,送秦主事还南京兼柬王学士 其一
665230,题南京守备太监晏公卷
513548,次南京钱学士先生入朝之作时先生方有少宰之命 其一
671980,喜储静夫考功自南京至
585518,送南京宫幕王公子拜官归寿母
652201,南京十咏 其七 江东古渡
153186,登飞鸿亭·南京一登眺
697661,过南京三首
921046,罢徐州，往南京，马上走笔寄子由五首 其五
892397,抒怀上南京常山公
514874,奉送大司寇何公莅任南京
514369,送三原王天锡赴南京右府都事 其二
521220,送李原复之南京刑部
269044,观映南京影片
674894,南京过旧内 其二
680253,送张给事中赴南京
506906,题竹石泉坡赠南京刘给事中
821391,昭君怨 前年在南京，友人以女子某氏词笺属和。夹置乱帙中，偶检得之，惘然继韵
560993,集寿僧房饯少司成汪先生之南京和席间韵 其一
680172,送陈贡士入南京太学将归杭州
514894,送进士陈亮之赴南京武选主事
516698,南京诗应制 其三
48421,南京谒孝陵有述
264944,满庭芳·夏口公园与丹符、仲伟共话南京旧事，悽然于怀
480416,玉堂视篆送王学士赴南京
651865,送牛给事领敕命还南京三首 其三
666758,皇帝行幸南京歌十首 其十
692504,题竹赠陈侍讲复职南京
677447,下第留南京寄怀庄少府座主二首 其一
701937,别眉山余都宪陛辞回南京二首
513656,追和江东之学士留寓南京上新河徐氏园亭之作 其二
678724,渡江望南京有作
482037,送吴太仆还南京
527243,赠南京秦司马入为司徒
681229,送青溪先生之南京吏部 其二
649170,送徐良玉侍郎复职还南京兵部
511641,分得玉堂讲学题送张廷玺员外赴南京刑部
286685,如梦令·祝南京史志创刊
494435,赠南京大理寺正澹轩戴君升任柳州府太守诗
697583,下第留南京寄怀庄少府座主二首
521829,刘君克柔以亲老思归适有南京尚宝卿之命喜而索诗
414958,白石老人莅南京谒谈感喟赋呈长句
319264,望海潮·南京
407019,南京失陷痛作 其四
1167762,上皇西巡南京歌十首 其四
1167764,上皇西巡南京歌十首 其六
506836,送刑部尚书施礼之南京
250610,赴镇江途经南京与青凤小酌
824893,归至南京
668605,送何少宰左迁南京工侍二首 其二
517780,回南京经古城
825228,三月十二日四十八岁初度是日自上海赴南京 其二
52491,皇帝行幸南京歌·淮水南边是狭邪
535708,送陈沂赴南京卫幕 其三
434787,上南京留守完颜公二首 其二
578928,贞庵时寓南京，表兄唐世用索吟，未审其人
317458,蝶恋花·和南京江城诗社社长李静凤女史于瘦西湖上韵
652198,南京十咏 其四 卞壸神祠
1079731,宁陵弟相送至南京因成四韵寄季一子之叔用
657633,授南京吏部郎中 其一
680173,送何宗易郎中改官南京
486697,御制山水图歌赐长春真人刘渊然归南京（有序）
585503,腊望送南京王大理汝温升北少司马
407016,南京失陷痛作 其一
442946,南京
692426,题竹送康叔圭郎中之南京刑部
7711,梅雨·南京西浦道
672584,送人赴南京督府
672010,次韵侍郎王公还南京留别
678694,送廖主事还南京
1201563,浣溪沙 寄南京道友
479194,古城驿遇南京参赞机务兵部尚书薛公诗以送之并谢惠粲 其一
293314,南京失陷·腥风血雨岂人间
702385,次韵沈廷美尚宝考绩还南京
513534,送刑部郎中陈德修还南京用张汝弼驾部韵
62653,送吴太仆还南京
702512,送三原王天锡赴南京右府都事
1167768,上皇西巡南京歌十首 其十
506846,送杨弼学录之南京
508634,送宋尚宝怀赴南京
405619,虞美人 其一 庚辰重阳前三日方君壁妹在南京书肆中得满城风雨近重阳图盖前岁旅居汉皋时悬之斋壁者为题二词其右
581489,送本府陆推府升南京员外
672401,送南京参赞机务上司马致仕还公安
1002014,送孙莘老移知南京
509921,赠闵督府还升南京秋官 其一
578081,送蹇冢宰震器英省亲还南京二首 其二
827625,忆南京叠过夔门诗韵二首 其一
68214,苏幕遮·在南京乞化
510267,何宇新赴南京，来白沙告别云：此行且复见定山，时秋已尽矣，以诗送之 其一
299834,金陵·往日南京事
603148,发南京留别故人
513671,送王廷贵祭酒先生考绩还南京
581542,送陈同府转南京户部副郎
1039695,次韵答赵少师以南京永寿禅院主僧崇祐于新铁铸佛大殿后建堂写真于其中
577920,送李主事复南京吏部
420251,东风齐著力 二十六年十二月十三日南京失手。时在庐山讲舍，闻讯悲苦，且闻委员长痛哭别陵事，益涌澜翻之泪也
41894,南京遇马丈朝美
49185,南京口号·驾出东南正好春
658692,送王尚书之南京户部
512423,送杨司谏之南京
52487,皇帝行幸南京歌
648723,题竹送徐侍郎之南京户部并简黄少保
189953,和刘仆射感旧言怀寄苏左丞左丞昔守南京仆射
457951,贺新郎　和嘘堂兄南京大屠杀二首 其一
477527,皇帝行幸南京歌十首 其五
1030649,南京种山药法 其二
649980,题梅赠挺孙南京都察院检校
648698,送杨礼郎中还南京
702337,南京工部尚书常熟程公哀挽
254673,上南京留守完颜公
559913,送刘御史子深之南京
561262,送吴学士视篆南京予旧领此职
115938,戏同小儿作望南京内门
535707,送陈沂赴南京卫幕 其二
827129,蝶恋花  南京解放五日武昌解放。四月二十四日效冯正中体四首 其二
466366,贺新郎　和嘘堂兄南京大屠杀二首
1079808,寄马巨济察院时监泰州酒得宫祠归南京
264972,沁园春·写感，时去南京，薄游苏淞苕霅间
683022,送何少宰左迁南京工侍二首
381376,归至南京·朔风撼书窗
924106,将至南京雨中寄王巩
60125,冬日扈从还南京随驾出丽正门马上作
405618,虞美人 庚辰重阳前三日方君壁妹在南京书肆中得满城风雨近重阳图盖前岁旅居汉皋时悬之斋壁者为题二词其右
372928,次韵答赵少师以南京永寿禅院主僧崇祐于新铁铸佛大殿后建堂写真于其中
506499,送江克恭还南京
1117519,将至南京简应介中
702471,送克俭克宽弟省觐南京
686460,南京过旧内
559916,送郭指挥之南京
827275,寄仲容南京 其一
419419,减字木兰花 纪念南京解放三十五周年
678727,送黎太守潜辉赴南京
286644,减字木兰花·祝南京大学研究生院成立
1059242,将至南京简应介中 其二
509124,庆南京大理寺卿夏公季爵致仕诗
52489,皇帝行幸南京歌·忆昔高皇定鼎年
982484,和刘仆射感旧言怀寄苏左丞左丞昔守南京仆射方为幕客今同为执政作此诗仆射诗略记其一联云论文青眼今犹在报国丹心老更同
657634,授南京吏部郎中 其二
258108,南京·愔愔坊陌傍深春
425706,拟南京美术专门学校歌
225821,送修撰杨学士留守南京
264946,东风齐著力·二十六年十二月十三日南京失手
513517,腊月念八日得仲弟克俭南京书季弟克宽杭州书报家君已至徽州
268740,之南京入大学院任事
492522,送北平省都事樊仲郛赍洪武七年正旦贺表上南京二首 其二
329206,癸已自南京过泗上
561880,送许仲贻之南京奉常
54099,南京行
658464,送周院判原已还任南京得杲字
559882,送太常魏先生之南京
513911,次南京尚宝泰和杨公述职诗韵 其一
827629,观映南京影片二首 其一
665265,送南京潘少宰希周赴少司寇之召
494184,南京刘秋江至烟霞
494493,送南京大理寺正赵鲲迁守汉中府
1239589,南京别王道士
482505,南京行
516697,南京诗应制 其二
513934,送汝行敏舍人赴南京武选员外
480273,送储静夫主事之南京吏部兼寄夏廷章
443196,荷叶杯 南京东路口占寄薄荷女史答曰适逢其诞辰
57826,古城驿遇南京参赞机务兵部尚书薛公诗以送之
668613,送冢宰朱玉峰之南京 其一
415976,芙蓉草在南京 其四
477528,皇帝行幸南京歌十首 其六
402711,自湘潭抵南京感怀
526800,同年郁希正与予同谪开州希正迁南京户部偶诵水东日记所载先生送别诗谓其词意悲感闻者流涕因索予和漫为赋此词语高妙何敢望前人至于情之可悲则固有甚焉者矣观者略其词而取其情可也
1025615,汴都至南京食樱桃
420314,玉京秋 战场春冷，柳淡如秋。忆去南京城外村居时，客散惊蓬，心随明月，悲夫，将向天壤何处也
525600,赠沈君华甫赴常州别驾故南京人
281784,东湖夜宿六七年由扬州归南京作
313665,一痕沙·初返南京
115494,泊南京登岸有作呈子由子中子敏逸民
658545,送张学士廷祥之南京
665224,送南京主客郎中邬绅守青州
6574,七律·人民解放军占领南京
514464,送吴学士汝贤莅事南京
702517,题南京邵思谊漏月轩有庄孔阳同年记
1250801,庚戌七月十五日离南京作
527864,送慈溪刘伯雨之南京尚宝卿
649025,送万资中赴南京大理寺副
638856,赠林仰之迁南京国子监丞
511642,送南京户部员外林原朴先生致仕
420245,望江南 南京春望
49182,南京口号·放牛归马净尘埃
423279,重至南京钟山望诸陵
528016,送汪二司业还南京二首 其一
1116660,次韵田国博部夫南京见寄二绝
684167,送临淮李秀岩留守南京
273873,昭君怨·前年在南京，友人以女子某氏词笺属和
501475,予己丑夏辞家客燕二十年江南风景往往画中见之戊申冬来南京今年六月二十九日奉旨使安南长途秋热年衰神惫气郁不舒舟抵太和舟中睡起烟雨空濛秋意满江宛然画中所见埃为之一空漫成二绝以志之时己酉七月二十四日也 其二
479163,送倪尚书之南京
514559,送都水姚懋明主事改任南京仪制
275599,临江仙·自南京还苏州道中作
420197,沁园春 写感，时去南京，薄游苏淞苕霅间
481952,冬日扈从还南京随驾出丽正门马上作
493518,正月二十六日得表弟梁远南京消息且云比江西来者皆未有书感而赋此
286689,减字木兰花·祝南京市古都学会成立
825221,南京节署西园 其二
452875,南京夫子庙
1030650,南京种山药法 其一
827130,蝶恋花  南京解放五日武昌解放。四月二十四日效冯正中体四首 其三
471285,谷日大雪口号二首（客南京） 其一
858744,次韵奉和蔡枢密南京种山药法
149876,三月五日南京梢工来报船经金人残毁之後尚有
648256,送吴敏德南京佥都御史
827630,观映南京影片二首 其二
1201230,长相思 往南京搬取风仙灵衬
665162,送南京太常卿穆公玄庵致仕还山东
702360,送陆顺之赴南京户部主事
896971,戏同小儿作望南京内门
591592,南京三首 其三
100165,罢徐州往南京马上走笔寄子
702358,古城驿遇南京参赞机务兵部尚书薛公诗以送之并谢惠粲
652196,南京十咏 其二 玄武波澄
99582,罢徐州往南京马上走笔寄子由
477525,皇帝行幸南京歌十首 其三
59010,玉堂视篆送王学士赴南京
415974,芙蓉草在南京 其二
49184,南京口号·春雨初晴霁色开
992802,送刘元忠学士还南京
781459,南京六君咏 其四
507262,送大理寺丞孙习之疾愈回南京
827589,之南京入大学院任事
690366,送秦主事还南京兼柬王学士
652202,南京十咏 其八 长江秋色
406331,虞美人 乙亥上巳，南京乌龙潭禊集，阻事未往，友人代拈“缀”字为韵
385273,送陈尚书南京工部
654907,送陈师召侍讲升南京太常少卿 其三
428348,望海潮 南京
924557,次韵分司南京李诚之待制求酒二首 其二
436553,南京
702347,次南京钱学士先生入朝之作时先生方有少宰之命
492521,送北平省都事樊仲郛赍洪武七年正旦贺表上南京二首 其一
555144,送同年俞舜卿任南京刑科给事中
655132,赠南京礼部尚书谥恭毅章公大经挽诗
837436,题吴伯谦先生南京试马图
921044,罢徐州，往南京，马上走笔寄子由五首 其三
420200,金缕曲 僦居南京饮虹园，答张庚由弟兼过从诸友，时民国二十年春也
562584,南京给事中童志昂和李商隐无题诗韵南京诸公多和之意盖有寓间出命予属和予村学究也不能外题以为诗姑咏史以复之 其一
562584,南京给事中童志昂和李商隐无题诗韵南京诸公多和之意盖有寓间出命予属和予村学究也不能外题以为诗姑咏史以复之 其一
275591,柳梢青·偕潘慎明、陶叔南、范烟桥诸老赴南京，中途雨霁
265086,水龙吟·庚申中秋，有怀南京、台北诸校友
414001,南京大屠杀三周年感赋
660394,赠刘德夫提学升南京太仆之任
527083,送蓝都宪升南京刑侍
268796,忆南京·南朝痛史老犹温
1090491,回至南京闻杜鹃
419415,如梦令 祝南京史志创刊
687013,送北平省都事樊仲郛赍洪武七年正旦贺表上南京二首
257595,在南京的街头
1092532,以淮白南京山药为子真太夫人寿即用前韵
1071650,大观间题南京道河亭
509922,赠闵督府还升南京秋官 其二
521810,送汪器之太史赴南京司业
649096,潘赐主事升鸿胪少卿赴南京
937979,送张迪功赴南京掾 其二
403991,浣溪沙·南京路天桥晚眺。乙亥1995秋夕
508970,喜迁莺 词赠南京太常少卿莆田陈公赴户部侍郎之召时李立之少卿尚留南寺
514435,送屠元勋郎中赴南京大理丞
263597,南陈北李·南京有一陈
514371,送三原王天锡赴南京右府都事 其四
827128,蝶恋花  南京解放五日武昌解放。四月二十四日效冯正中体四首 其一
651863,送牛给事领敕命还南京三首 其一
678713,奉送大学士曾先生侍从东宫赴南京
672439,分咏江令宅送屠元勋之南京
473798,二妹婿书来数问南京消息戏书答之
507647,南京送高教授赴选 其一
311495,蝶恋花·南京解放五日武昌解放。四月二十四日效冯正中体
515534,送董学士尚矩赴南京礼部侍郎
698207,送陈师召侍讲升南京太常少卿
647994,送王彦鼒还南京
507037,送大理卿陈勉之南京
507036,送吏部黄宗载之南京
492917,余归自南京与舍弟子彦相见于清江舟中别去承寄绝句六章依韵奉答 其四
1086762,次韵南京道中
665232,同年郑成昭将赴南京刑部留诗为别次韵奉赠
1116766,罢徐州，往南京，马上走笔寄子由五首
508721,送童轩给事还南京
447583,南京
428051,木兰花慢 傅抱石以一九六五年九月廿九日午后一时零七分逝世南京，赋此志悼
650609,送葛延琮南京都察院检校
102576,次韵田国博部夫南京见寄二绝
554270,过南京三首 其三
118112,送张睡奉南京签判
827276,寄仲容南京 其二
514786,送南京少宗伯尹正言先生奉表入贺礼成还任次南都赠行韵六章 其三
492919,余归自南京与舍弟子彦相见于清江舟中别去承寄绝句六章依韵奉答 其六
420211,庆春泽 南京逢旧时学友，春年域外，不知今日相见之悲也。明月漾水，歌以永之
479149,送杨侍读维立之南京
1037673,和承旨给事寄酬南京致政杜相公
492944,余归自南京承永新欧阳子韶寄书辄赋奉答
583244,送董尚规之南京礼部侍郎
702327,追和江东之学士留寓南京上新河徐氏园亭之作
209885,至南京道中尚有莺声
921036,次韵田国博部夫南京见寄二绝 其二
825271,二月二十一日又至南京
649211,送宗载尚书复任南京吏部
515503,南京工部尚书常熟程公哀挽 其二
553798,送胡直秀才下第归南京胄监生
681228,送青溪先生之南京吏部 其一
240992,予自南京留守推官循资为掌书记由将仕郎超阶
596578,同云都何龙川至南京会令叔紫坛宴留叙旧别后有怀
1117126,次韵分司南京李诚之待制求酒二首
432434,虞美人 庚辰重阳前三日方君壁妹在南京书肆中得满城风雨近重阳图盖前岁旅居汉皋时悬之斋壁者为题二词其右
702322,送李立之太常先生再赴南京
249242,报载日本首相参拜靖国神社忆南京大屠杀事感而赋此
560994,集寿僧房饯少司成汪先生之南京和席间韵 其二
825220,南京节署西园 其一
554269,过南京三首 其二
562468,送张茂兰黄自立二同年回南京
1194414,上皇西巡南京歌十首
660725,送南京张学士先生
422814,一痕沙 初返南京
434314,水调歌头 上南京留守
419427,减字木兰花 祝南京大学研究生院成立
415975,芙蓉草在南京 其三
180732,送张迪功赴南京掾
1118834,送张迪功赴南京掾
580849,南京送东墅兄二首 其二
515821,送张庭毓赴南京大理评事
407017,南京失陷痛作 其二
522154,送柴德美给事赴南京光禄寺少卿
117833,将至南京雨中寄王巩
662049,送陶司马南京参赞
693477,闻吴宁庵转南京学士二首
49181,南京口号·君王观阙倚天开
688656,集寿僧房饯少司成汪先生之南京和席间韵
540167,戊午岁叔达甥兄弟弱冠应试余寄诗勉之曰玉树元双挺鹓雏好并翻外家饶宅相若个魏阳元又一纪而叔达文日益高有名然宅相犹未应也今年春来别余应南京试复为一绝以促之
52488,皇帝行幸南京歌·翩翩翠盖覆鸣銮
658713,送马良佐学士还南京
521527,送吴克常南京光禄监事
280122,扫叶楼·往昔在南京
648223,送萧雅容郎中归南京吏部
468283,既至潍州寄同考礼者胶西张绅士行上元杨翮文举吴郡钱逵伯行郑元长卿嘉陵杨基孟载吴兴牟鲁仲望燕山翟汾文中东嘉余尧唐诸暨姜渐羽仪余上虞谢肃凡十人皆自浙西而至南京者也
562585,南京给事中童志昂和李商隐无题诗韵南京诸公多和之意盖有寓间出命予属和予村学究也不能外题以为诗姑咏史以复之 其二
562585,南京给事中童志昂和李商隐无题诗韵南京诸公多和之意盖有寓间出命予属和予村学究也不能外题以为诗姑咏史以复之 其二
4947,上皇西巡南京歌十首
1059243,将至南京简应介中 其三
537749,为张茂才赠张将军时治艘南京
432823,南京陷落二首
562586,南京给事中童志昂和李商隐无题诗韵南京诸公多和之意盖有寓间出命予属和予村学究也不能外题以为诗姑咏史以复之 其三
562586,南京给事中童志昂和李商隐无题诗韵南京诸公多和之意盖有寓间出命予属和予村学究也不能外题以为诗姑咏史以复之 其三
128964,南京种山药法
253426,水调歌头·上南京留守
492914,余归自南京与舍弟子彦相见于清江舟中别去承寄绝句六章依韵奉答 其一
452120,赴镇江途经南京与青凤小酌
125342,抒怀上南京常山公
432490,至南京之翌日，登雨花台，吊太平天王，诗以侑之
921035,次韵田国博部夫南京见寄二绝 其一
112803,送杜亚卿赴南京
575598,送王稚川南京司业
678825,送员外李叔玉之南京
316400,悠然·南京人报小
528017,送汪二司业还南京二首 其二
652183,南京端午
687869,授南京吏部郎中
829133,观映南京影片二首
420247,望江南 其一 春日南京吟望
