237806,敦素有以书局处之者作诗迎之
1063711,崇因会王敦素
379020,次韵敦素两翁轩见寄
1064012,雨中闻端叔敦素饮作此寄之
848267,敦素有以书局处之者作诗迎之
1063731,法云同王敦素看东坡枯木
1063713,七夕卧病敦素报云道夫已至北山迟迟未入城其意耽酒用其说作诗促之
848178,王敦素许纸不至戏简促之
237833,王敦素许纸不至戏简促之
1064252,大风夕怀道夫敦素
237840,送王敦素·龙蟠山色引衡庐
378374,大风夕怀道夫敦素
1063727,敦素坐诵公衮乌臼树绝句叹爱不已其诗云三年逐客弄湘流华气遮栏两鬓秋秪有荒寒江上树尚成诗句聚眉头成此寄之
1064250,钟山悟真庵西竹林间苍崖千尺岁久折裂余与敦素行山中至此未尝不徘徊庵僧为开轩向之尽收其形胜名曰两翁作此
1063717,王敦素李道夫游两翁轩次敦素韵
1063717,王敦素李道夫游两翁轩次敦素韵
1063674,赠王敦素兼简正平
243138,送王敦素归金陵
1064251,次韵敦素两翁轩见寄
1063722,次韵叶集之同秀实敦素道夫游北山会周氏书房
848257,送王敦素
848310,送王敦素
237790,次韵集津兄会群从王敦素宿王立之园明日西征
378373,钟山悟真庵西竹林间苍崖千尺岁久折裂余与敦素行山中
848290,次韵集津兄会群从王敦素宿王立之园明日西征马上寄示诸人
1063726,同敦素沈宗师登钟山酌一人泉
864344,送王敦素归金陵
237842,送王敦素·先君有六女
