601292,晦夜双溪兄来访和韵
532634,内兄来自松江留宿鸡鸣山舍
877103,送山甫赴岭口仓与黄兄来复同载
403968,木兰花慢·榆生夫子辞世忽忽一纪，庚申残秋，上海音乐学院为师补行追悼仪式，厦材世兄来函征求遗文轶事，作此致悼
452328,辛卯冬秒虞廷兄来京秋扇为置酒半梦抱琴高凉疏影师生同至言及次日蛰门赴天津雅集数日后得疏影来诗云欲留终去别良俦过处云山满目愁衣上京华留酒债孤怀和梦返渝州颇多怏怏之意忆及曾与疏影有渝州之约戏步原韵慰之
219535,雪夜冯周二兄来小酌诗呈仓使
868706,伟叔蔡兄来永嘉屡辱投赠于其归也奉俚歌为谢兼叙离索
452277,蓝天孤鹤兄来京烟沽野鹤设宴接风席间野鹤提议以有诗无酒不诗人为首句赋诗
264374,家兄来书拟春初抵塞将至奉忆之作
206903,伟叔蔡兄来永嘉屡辱投赠於其归也辄奉俚歌为
251187,三江兄来京小聚席间论及诗事时事皆无不惬遂约分韵得疏字
633076,冯兄来言龙公入城同木公心公寓时心公得子口占
71736,踏莎行·贤兄来到
985760,雪夜冯周二兄来小酌诗呈仓使 其一
882717,仲兄来为母氏寿言归有作
679981,奉和楚芳兄来韵
250409,日前与是务斋主叩石山人小酌言谈甚欢今日河北天放兄来京小聚席间得叩石来诗言及昨日事戏和
453291,海楼兄来京同登居庸关
292445,慎之兄来劄有超尘常乐之语书此代简
250505,蓝天孤鹤兄来京烟沽野鹤设宴接风席间野鹤提议以有诗无酒不诗人为首句赋诗
88486,送山甫赴岭口仓与黄兄来复同载
414076,慎之兄来劄有超尘常乐之语书此代简
1125942,雪夜冯周二兄来小酌诗呈仓使
443927,题雪峰兄《来鸿楼读书图》
452657,胡僧兄来沪会军持风二中天吴诸兄招饮予以公干故遽不得往因各饮其所及见复饮于云南路山东小馆
246028,胡僧兄来沪会军持风二中天吴诸兄招饮予以公干故遽不得往因各饮其所及见复饮于云南路山东小馆
453212,三江兄来京席间忆及凉山限体分韵得头字
428388,得无锡沈绍祖兄来书问平安，诗以答之
415675,喜见海儒兄来台
461564,初夏日幻庐金水二兄来信阳草成一首先呈
452093,日前与是务斋主叩石山人小酌言谈甚欢今日河北天放兄来京小聚席间得叩石来诗言及昨日事戏和
50568,悼明彻庵·我去兄来住此间
251203,初夏日幻庐金水二兄来信阳草成
301766,得无锡沈绍祖兄来书问平安，诗以答之
985761,雪夜冯周二兄来小酌诗呈仓使 其二
462121,三江兄来京小聚席间论及诗事时事皆无不惬遂约分韵得疏字
184615,仲兄来为母氏寿言归有作
738994,家兄来书拟春初抵塞将至奉忆之作
317468,喜见海儒兄来台
