1001982,参政瞿公之孙东广机宜德远惠书若诗以能问于不能久之愧虚盛意敬赋古风谢塞
1174928,郡斋有紫薇双本自朱明接于徂暑其花芳馥数旬犹茂庭宇之内迥无其伦予嘉其美而能久因诗纪述
1061234,法门复故圣恩深厚矣自此恐云巢不能久栖当为众一起承示佳句因用韵备载之
379635,法门复故圣恩深厚矣自此恐云巢不能久栖当为众一起承示佳句因用韵备载之
493484,吴司令友云于磨勘公廨隙地凿两池以种莲而植柳其上五月过之见柳阴荷花盛开既恨不能久留又叹不能数往因赋二绝奉寄 其一
149549,久客·客子能久惯
118238,腊雪·骄阳不能久
687090,吴司令友云于磨勘公廨隙地凿两池以种莲而植柳其上五月过之见柳阴荷花盛开既恨不能久留又叹不能数往因赋二绝奉寄
103343,金陵·恃险不能久
493485,吴司令友云于磨勘公廨隙地凿两池以种莲而植柳其上五月过之见柳阴荷花盛开既恨不能久留又叹不能数往因赋二绝奉寄 其二
297943,癸巳除夕·避地今能久
1214714,伯清兄弟在者三人次仲实又次季博有练溪别业连云庄弗肯分异户门应酬衣食用费宾客燕会岁一人递收其田租以掌之为计帐以相交付同堂异室内外无间言于兹有年矣是亦保家之善道也不然则力分而用广日且不给况能久而弗坠哉是宜诗伯清即韩分石
712319,与潘子登佘兼五有中元宿云阁之约以暑极不能久偕梁巨川卢俊斯放舟先归却柬潘佘二子
1075310,西斋金凤花开百馀日相继不绝难其能久而惜群芳之不留也
