489800,正己亥冬客杭有客持毛袜去久不见还因戏赋以自解
1003005,寄陈正己
1245264,正己堂
1053621,书申正己秀才所藏雀竹图后 其一
1130111,书申正己秀才所藏雀竹图后
975097,冬至前简陈正己李季允
215975,齐家吟·齐家先正己
1053622,书申正己秀才所藏雀竹图后 其二
132432,呈陈正己十四韵
377985,书申正己秀才所藏雀竹图后
132553,送陈正己赴调
132240,拟送陈正己赴沅江令
1216417,至正己亥六月游壶山宿真净岩访忠门西江陈公江亭
1031985,赠王正己
1227041,至正己亥四月廿二日宿翠峰禅室登留云阁数日与净莲公
1146278,伤始平李少府正己
1002995,寄陈正己
1216328,至正己亥夏予游壶山宿真净岩即景赋诗奉简古道了堂二师
975801,拟送陈正己赴沅江令
1235362,至正己亥六月游壶山宿真净岩访忠门西江陈公江亭
585814,承广西大巡东逵陈侍御下车之初即致书来问盖公学出于蒋道林有渊源矣以此正己格物而风俗化矣小诗奉寄
1216416,至正己亥六月游壶山宿真净岩访忠门西江陈公江亭 其一
1243951,至正己丑端午日感怀寄辉东阳一诗至戊戌重午又十年矣王弘道见而和之其语句俊爽清健复次韵美之
485386,听教坊旧妓郭芳卿弟子陈氏歌（时至正己亥岁作）
128641,赠王正己
975452,送陈正己赴调
1196142,赠王正己
1218648,瑞麟图至正己丑夏五月麟出泰兴县张村村民箠死之县尹冯君写为图请以赋之
292,伤始平李少府正己
852961,次韵宋尚书山居十五咏 其十三 正己亭
130054,正己亭·少日横刀属两鞬
975355,和陈正己九日公安道中韵
146634,赠王正己·吟高鄙俗流
975798,呈陈正己十四韵
