377001,廛中佛事·几回走巷复穿衢
1020228,廛中佛事
700609,吴僧日章讲师赴召修蒋山普度佛事既罢东归送别二首
194457,同泰寺·佛事庄严国力疲
47217,吴僧日章讲师赴召修蒋山普度佛事既罢东归送
42024,已亥杂诗·我言送客非佛事
1061338,应上人作法华佛事过余求颂为作短偈
834880,绕佛阁 灵虚道人有佛事于灵栖，以书见招。欲往未得，书此寄题，不啻身在寺中也
622798,村人日以道士作佛事感叹有作
144305,荆州江浮水灯作佛事
47218,吴僧日章讲师赴召修蒋山普度佛事既罢东归送·故乡未解识清容
1070036,吴下去冬不寒春不雨人以为病城中火灾相仍自十二月至今凡八九发雍熙佛寺灾势尤甚闾里讹言相惊往往徙货泉载家具日为避火计二月乙巳郡守以承天佛寺慧感神像供府第为佛事禳祷是日雨明日雪丁未又大雪农事有初火怪庶或熄人心稍安作诗记其事
855034,奉送径山无畏老人谒吴兴蒋使君无畏能作诗写字去径山五年遨游江南以归遂过仆于此聊馆之旁寺老屋三数间而已当坐名山胜刹大佛事而此非所宜安也
634187,癸丑仲春梅长道兄洁诚拨置家缘入海幢将一月修建大悲宝忏深念众生以无明业垢妄造种种能一念回光可以薄宿愆而植新种用是恳祷上及父母下逮亲串凡在梅公相敬相爱之中则以真诚感格仰求拯拔夫舍资财作佛事人或不少舍资财而能洁身洁念则甚少也能洁身洁念时或不少能深知一念回光可以消殒业垢又能扩充其量上及父母下逮亲串此非自信之笃其能如是乎士夫家以理解恃聪明不信有此忏业消垢之事然念念腾腾岂他人哉此固不足与俗人言也梅兄当自信之耳
267989,绕佛阁·灵虚道人有佛事于灵栖，以书见招。欲往未得，书此寄题，不啻身在寺中也
963326,荆州江浮水灯作佛事
484876,吴僧日章讲师赴召修蒋山普度佛事既罢东归送别二首 其一
1242607,至普陀洛伽山寺，作佛事七昼夜，祈见海岸观世音及善财岩。七日之间，随心应现，大众瞻仰，无不庆赞
1000884,空公长老一出即住雪峰书来以建茗为寄长句奉呈空公时以笔砚作佛事也
484877,吴僧日章讲师赴召修蒋山普度佛事既罢东归送别二首 其二
75122,西江月·一百八般佛事
