1193463,余以咸亨元年在西京寻听于时与并部处一法师莱州弘祎论师更有三二诸德同契鹫岭标心觉树然而一公属母亲之年老遂怀恋于并州祎师遇玄瞻于江宁乃叙情于安养玄逵既到广府复阻先期唯与晋州小僧善行同去神州故友索尔分飞印度新知冥焉未会此时踯躅难以为怀戏拟四愁聊题两绝
770691,寒夜校参同契
500270,读参同契有感
999321,显谟左司周公元吉将漕湖北一时名流赋诗饯行予与左司同出于詹事周公之门为同门同居班列二年为同朝同考类试于贡闱为同寮三者既同契好弥笃于其行也作长句以送之
315492,读参同契有感
202091,三月廿夜同徐月齐读参同契次所赠诗韵以谢
1151412,就道士问周易参同契
866598,谢景浚卿东州名士未曾倾盖因僧悟策有诗寄余臭味不殊千里同契望风增感作诗写怀一首寄谢
38835,参同契明镜图诀诗·至道希夷妙且深
978233,三月廿夜同徐月斋读参同契次所赠诗韵以谢
1195387,参同契明镜图诀诗二首
1163388,读参同契
346827,三月廿夜同徐月斋读参同契次所赠诗韵以谢
38094,读参同契
105932,怪梦·子午参同契
3629,就道士问周易参同契
18188,对酒·漫把参同契
510088,读朱晦庵注参同契
1147697,余以咸亨元年在西京寻听于时与并部处一法师莱州弘祎论师更有三二诸德同契鹫岭标心觉树然而一公属母亲之年老遂怀恋于并州祎师遇玄瞻于江宁乃叙情于安养玄逵既到广府复阻先期唯与晋州小僧善行同去神州故友索尔分飞印度新知冥焉未会此时踯躅难以为怀戏拟四愁聊题两绝 其一
547080,慰宗侯玄同契丈居庐
347099,寒夜校参同契
1165009,参同契
529895,王员外不解参同契但索一诗许以遗我率尔戏之
162983,南歌子·玄入参同契
1189651,参同契明镜图诀诗二首 其一
1147698,余以咸亨元年在西京寻听于时与并部处一法师莱州弘祎论师更有三二诸德同契鹫岭标心觉树然而一公属母亲之年老遂怀恋于并州祎师遇玄瞻于江宁乃叙情于安养玄逵既到广府复阻先期唯与晋州小僧善行同去神州故友索尔分飞印度新知冥焉未会此时踯躅难以为怀戏拟四愁聊题两绝 其二
1021241,最明梦一善知识教训坚固参禅醒后亲绘供养越两年值老僧到先来参礼果与梦见一同契悟后捧呈所画顶相求赞
1189652,参同契明镜图诀诗二首 其二
38834,参同契明镜图诀诗
