1088012,奉答景仁老兄赠别之句
609312,和孔阳王孙舟中听琵琶赠别之作
819107,寄酬秋樵赠别之作
1187175,途中酬李少府赠别之作
638706,闻梁侍讲叔厚先生暨王文哲黄门使交南将过富春赋此二律以侯兼致赠别之意 其二
381132,寄酬秋樵赠别之作
201382,次韵陈德用明府赠别之什
440769,荅咏馨梦中赠别之作适予将移居雪山山脚
340738,次韵和王张赠别之作
695287,闻梁侍讲叔厚先生暨王文哲黄门使交南将过富春赋此二律以侯兼致赠别之意
611281,酬区启图赠别之作
488606,酬许希旦郑兆采陈尧勋方子韩四子赠别之作
837934,酬蕉麓赠别之作
840137,辛酉腊月，依韵和啸园赠别之作
729768,八归  答沈子培刑部赠别之作
638705,闻梁侍讲叔厚先生暨王文哲黄门使交南将过富春赋此二律以侯兼致赠别之意 其一
264023,八归·答沈子培刑部赠别之作
251058,荅咏馨梦中赠别之作适予将移居雪山山脚
638317,次韵朱太古太尹述怀兼致赠别之意
534802,答张主政镗赠别之作
895370,次韵陈德用明府赠别之什
6997,途中酬李少府赠别之作
1060644,次韵和王张赠别之作
488627,酬立朝叔秋日赠别之作
286794,辛酉腊月，依韵和啸园赠别之作
