352007,任守作醮为民祈福先期而雪是日开霁
141917,冬不雪春苦雨外台为民心恻檄郡请祷於法轮应
1088975,任守作醮为民祈福先期而雪是日开霁
1048739,和登琅山为民祈福
370194,观钱氏庙·五帝三王只为民
206948,鄱量董季兴往游怀玉山捐田入寺为民祷雨君既
88794,江西·身已为民与世疏
233983,寿陈宰·为民一念彻渊泉
336316,庆成口号·祝史无私本为民
1091150,乙亥岁东游会稽谒禹陵过马臻祠下询所谓鉴湖者则已堙塞为民田因赋
345074,和登琅山为民祈福
548731,送卢东麓祠部廷杖为民南还
862062,至道初元六月不雨为民冒暑乞灵龙湫投辞未竟云气已作雷雨继之
1090787,武昌射圃后山与江接走植柳竹方茂每为民家羊群所龁日有殴羊之事昔赞皇公以祝鸡翁自况走亦可谓牧羊儿矣
856234,冬不雪春苦雨外台为民心恻檄郡请祷于法轮应感尊者悉获灵贶曾不终日教授有诗以发扬盛美郡人相山居士闻而悦之勉次其韵
1026960,奉亲两载为民祈蚕作竞渡于此以五十六言即事
1070920,海外自去冬不雨至今农圃俱病郡侯率僚友为民祈祷二月十八日祭社致斋是日雨作喜而成诗呈逢时使君
331104,海外自去冬不雨至今农圃俱病郡侯率僚友为民祈祷二月十八日祭社致斋是日雨作喜而成诗呈逢时使君
119842,竞岩·去为民劳走险艰
559942,送宿州太守王永隆增秩复任为民告留
96139,寄莫万安·天生尤物为民瘵
868834,鄱阳董季兴往游怀玉山损田入寺为民祷雨君既道其本末又示山中五章请余赋之然比来霖潦淹月种烂乃未秧也方幸数日晴霁尔
