1106803,壬戌立冬十月十一日陪路文周朋携禔祖同访后山道人庵道人出就庵烹茶庵外采菊拾橡实以归偶成即事
823113,寿楼春 十月十七日，十六子士禔生
1056015,若禔告行再寄二诗 其一
862744,壬戌立冬十月十一日陪路文周朋携禔祖同访后山道人庵道人出就庵烹茶庵外采菊拾橡实以归偶成即事 其二
809522,命裕亲王福全皇长子允禔帅师征厄鲁特锡之以诗
848076,熙宁蜡祭十三首 其十一 酌献用《禔安》。
577012,送余德禔归羊城
1056016,若禔告行再寄二诗 其二
108086,太公孔子·禔身涉世谩多忧
308974,寿楼春·十月十七日，十六子士禔生
848042,熙宁祀皇地祇十二首 其八 饮福用《禔安》。
809567,班师拖陵留皇长子允禔殿后示之
1104060,绍兴以后蜡祭四十二首 后稷氏位酌献用《禔安》。
1113590,若禔告行再寄二诗
847485,绍兴以后蜡祭四十二首 神农氏位酌献用《禔安》。
1055862,送慕容若禔公干环庆邠宁
863023,壬戌立冬十月十一日陪路文周朋携禔祖同访后山道人庵道人出就庵烹茶庵外采菊拾橡实以归偶成即事 其一
1055865,谢慕容若禔惠橘皮汤用前韵
330419,若禔告行再寄二诗
