515238,十一月廿七日送士敬至浦口别后赋此
515226,十一月十四日饮流塘詹存中家晚归时李锦衣士敬公便过县同行
515235,送李锦衣士敬 其二
515229,题李锦衣士敬写真
515237,送李锦衣士敬 其四
515234,送李锦衣士敬 其一
1223777,触石坠马卧病蒙恩予告先至上京寄溉之学士敬仲参书二首 其一
513970,赠李士敬锦衣借其梦中旧韵
515225,长至前二日闻李锦衣士敬自南阳扫墓取道访予新安奉迓杨山寺是日相传皇子诞生有赦将到
643192,篆书歌送胡士敬游同安
514269,指挥家叔将归七夕约李士敬昆仲同饯
507755,留别王教谕士敬 其一
515236,送李锦衣士敬 其三
566260,题田进士敬叔太素草堂一首
585140,答李士敬用见寄韵
1221626,梅花清梦为沈士敬赋
1223778,触石坠马卧病蒙恩予告先至上京寄溉之学士敬仲参书二首 其二
507756,留别王教谕士敬 其二
491556,同张士敬姚超白炳文南宗上人饥别张怀德千户于大愚寺之松林赋柬诸君子
702558,送李锦衣士敬
1237549,触石坠马卧病蒙恩予告先至上京寄溉之学士敬仲参书二首
515227,下纹溪过渡调士敬
691397,留别王教谕士敬
514962,赠李士敬锦衣进署千户
1250155,题柯博士敬仲宫词后
507757,留别王教谕士敬 其三
