224335,次韵陆承之岁暮述怀
849704,德寿宫古松太上爱之尝持御香酾酒祠土神以祈屏蟊贼云时绍兴壬午思陵馘亮之岁也于今百二十年矣仆生六十年后而十月八日又思陵上仙之晨感而有赋 其二
1166033,酬武蕴之乙丑之岁始见华发余自悲遂成继和
22227,酬武蕴之乙丑之岁始见华发余自悲遂成继和
1244677,汸始见黄先生问生何岁对曰己未先生曰吾六经补注以己未年刊或曰书已刻矣恨无读者吾应之曰恐读者未生尔岂知子之生年乃吾刊书之岁又获相交岂非偶然乎乃命春秋之学今年二十有七年矣值愚生朝次思敬韵以寓其感云
1104839,德寿宫古松太上爱之尝持御香酾酒祠土神以祈屏蟊贼云时绍兴壬午思陵馘亮之岁也于今百二十年矣仆生六十年后而十月八日又思陵上仙之晨感而有赋
1068912,用文之岁暮言怀韵
802463,笙陔于光绪乙亥冬夜梦至一园杜鹃花零落满地一小轩榜曰安分知止之馆悬巨镜写人了了则貂冠华袿君语张夫人设遇增秩君当无幸及君晋四品之岁果悼亡又尝梦登所居珠泉草堂舍后山长松千章风声谡谡有茅屋汎埽雅洁及卜夫人佳城恰当其处君固不乐进取夫人亦每举榜语风谏夫明识若此而蹈中寿妖梦是践名论空留廖君能无□于怀耶敬述彤徽以题琴羡将使漆园傲吏塞旦宅之悲猗兰仙才罢潜英之石 其二
939112,火田郑次山贫士也家有燕坐之处五为赋之 岁寒谷
403947,迈陂塘·丙戌1946秋寒之岁，内战愈酣之月，购《抗战八年木刻选集》，感赋长调，时在春申
828618,丁卯之岁予病甚陟甫约游鄮山阿育王寺一日晚坐山门外万念俱忘恍然若有以无得为得也别经廿载世变不可言感念不已因寄怀陟甫一首
291186,长亭怨慢·瑞安林君左髓同及介石老师之门，卓荦英才，志清胡秽，居杭之岁，过从为乐
327422,奉同公济诸兄自精舍来集冲佑之岁寒轩因邀诸羽客同饮公济有诗赠守元章师因次其韵
1241822,著雍执徐之岁三月望后一日率僮仆抵钟贾山采薪供爨至四月朔归每日阴雨
184041,某两使辽塞俱值郊礼之岁今以至日到北帐感事
531363,次韵刘润之岁暮见怀
614949,壬子之岁余襄先君大事启吾游君实主卜焉倏忽九霜君来重访感岁月之如驰伤风木之不待赋赠一律情见乎词
353610,次韵常之岁晚督才叔诗课
87502,十绝·退之岁晚南溪上
423973,长亭怨慢·瑞安林君左髓同及介石老师之门，卓荦英才，志清胡秽，居杭之岁，过从为乐。嗣余栖迟海上，君亦来游，不幸遘疾逆旅，怛然物化。寒潮归柩，永伤旗鹤。兹从小阮获睹遗容，长歌当哭，识于楮尾
1089674,次韵常之岁晚督才叔诗课
1138981,至元重光单阏之岁春正月陇西郡太夫人介寿八十子侍郎帅其昆弟子侄内外姻族寮友宾客奉觞上寿如仪州人士相与嘉叹争为歌诗咏其事而绣使紫山胡公为之序云
1139611,次韵陆承之岁暮述怀
185301,至元重光单阏之岁春正月陇西郡太夫人介寿
128076,新岁·从心之岁自由身
923381,某两使辽塞俱值郊礼之岁今以至日到北帐感事言怀寄呈同馆诸公
689994,和于景瞻王瑞之岁暮述怀兼咏梅竹二作因以见彼此之情
295777,陈韬庵师八十生日又为重宴琼林之岁诗以贺之
351678,用文之岁暮言怀韵
802462,笙陔于光绪乙亥冬夜梦至一园杜鹃花零落满地一小轩榜曰安分知止之馆悬巨镜写人了了则貂冠华袿君语张夫人设遇增秩君当无幸及君晋四品之岁果悼亡又尝梦登所居珠泉草堂舍后山长松千章风声谡谡有茅屋汎埽雅洁及卜夫人佳城恰当其处君固不乐进取夫人亦每举榜语风谏夫明识若此而蹈中寿妖梦是践名论空留廖君能无□于怀耶敬述彤徽以题琴羡将使漆园傲吏塞旦宅之悲猗兰仙才罢潜英之石 其一
282264,岁除日以诗向韶九乞宿酝韶九年六十酿酒之岁与之同也
653765,和于景瞻王瑞之岁暮述怀兼咏梅竹二作因以见彼此之情 其一
1088522,奉同公济诸兄自精舍来集冲佑之岁寒轩因邀诸羽客同饮公济有诗赠守元章师因次其韵
653766,和于景瞻王瑞之岁暮述怀兼咏梅竹二作因以见彼此之情 其二
410619,岁除日以诗向韶九乞宿酝韶九年六十酿酒之岁与之同也
1225456,和何得之岁暮见寄
849705,德寿宫古松太上爱之尝持御香酾酒祠土神以祈屏蟊贼云时绍兴壬午思陵馘亮之岁也于今百二十年矣仆生六十年后而十月八日又思陵上仙之晨感而有赋 其一
816601,笙陔于光绪乙亥冬夜梦至一园杜鹃花零落满地一小轩榜曰安分知止之馆悬巨镜写人了了则貂冠华袿君语张夫人设遇增秩君当无幸及君晋四品之岁果悼亡又尝梦登所居珠泉草堂舍后山长松千章风声谡谡有茅屋汎埽雅洁及卜夫人佳城恰当其处君固不乐进取夫人亦每举榜语风谏夫明识若此而蹈中寿妖梦是践名论空留廖君能无□于怀耶敬述彤徽以题琴羡将使漆园傲吏塞旦宅之悲猗兰仙才罢潜英之石
304515,丁卯之岁予病甚陟甫约游鄮山阿育王
