130358,用简斋建除体韵
411262,读思斋诗，用简庵酬容九韵
1127853,陈晞颜董漕湖南过零陵用简斋韵见赠次韵谢之又赋一篇述怀
239097,陈晞颜董漕湖南过零陵用简斋韵见赠次韵谢之
1249961,子素先生客夏盖湖上欲往见而未能因赋诗用简仲远徵君同发一笑
853949,用简斋建除体韵
885010,夜坐池上用简斋韵
575711,岁月徂迁未有归止寓迹江汉怀抱索然时维杪秋凄其絺绤偶有所述用简同志
1002308,陈晞颜董漕湖南过零陵用简斋韵见赠次韵谢之又赋一篇述怀 其二
306066,读思斋诗，用简庵酬容九韵
847488,绍兴以后蜡祭四十二首 北方百神迎神用《简安》。
1103907,晚步用简斋韵
255114,过季思斋闻县前池荷盛开闲步往观用简斋《葆真池》韵
589405,宿龙泉再用简州韵
167836,夜坐池上用简斋韵
1002309,陈晞颜董漕湖南过零陵用简斋韵见赠次韵谢之又赋一篇述怀 其一
402097,过季思斋，闻县前池荷盛开，闲步往观，用简斋《葆真池》韵
847456,绍兴以后蜡祭四十二首 南方百神迎神用《简安》。
848079,熙宁蜡祭十三首 其八 南北方迎神用《简安》。
