1174928,郡斋有紫薇双本自朱明接于徂暑其花芳馥数旬犹茂庭宇之内迥无其伦予嘉其美而能久因诗纪述
280,雍和·柔而能方
570682,洞庭陆生医而能诗以三律见投聊成二绝答之 其一
443929,越南河内泰柑禅寺亦净亦禅，寺中比丘尼不通汉语，而能听懂“南无阿弥陀佛”六字洪音，爰拈一偈，用唤云韵
908391,林夫体中不佳而能不废翰墨且蒙以文轴见教其天性所嗜如此敬叹不已既勿药作诗贺之
180145,林夫体中不佳而能不废翰墨且蒙以文轴见教其
634187,癸丑仲春梅长道兄洁诚拨置家缘入海幢将一月修建大悲宝忏深念众生以无明业垢妄造种种能一念回光可以薄宿愆而植新种用是恳祷上及父母下逮亲串凡在梅公相敬相爱之中则以真诚感格仰求拯拔夫舍资财作佛事人或不少舍资财而能洁身洁念则甚少也能洁身洁念时或不少能深知一念回光可以消殒业垢又能扩充其量上及父母下逮亲串此非自信之笃其能如是乎士夫家以理解恃聪明不信有此忏业消垢之事然念念腾腾岂他人哉此固不足与俗人言也梅兄当自信之耳
1158156,鲁望悯承吉之孤为诗序邀予属和欲用予道振其孤而利之噫承吉之困身后乎鲁望视予困与承吉生前孰若哉未有已困而能振人者抑为之辞用塞良友
641655,季子延奴初学语见书帙在案时辄作嚅嚅唲唲声若解诵然以其不由教而能尔故喜而赋诗且以示浩使知有所警云
683886,洞庭陆生医而能诗以三律见投聊成二绝答之
570683,洞庭陆生医而能诗以三律见投聊成二绝答之 其二
241136,钱张宣慰·贵介而能大耐官
