258433,出梅入夏
341301,自秦溪间行出梅园
243066,临海僧珂公出梅花诗和其韵
948335,胡季怀惠六出梅一枝仍枉绝句率然次韵勿笑迂拙
692217,胡敏御史致事出梅求题余于胡有旧故赋二诗识别
618679,冬日同李伯襄戴公纶过伍国开兄弟园折得八出梅花分赋 其一
102420,饷柑酒·千花未分出梅余
618680,冬日同李伯襄戴公纶过伍国开兄弟园折得八出梅花分赋 其二
834561,汉宫春 腊梅，和子野，并谱四声。子野词出梅苑
628174,四出梅关
716328,赋得垂柳送客出梅关
387284,虞美人·水仙六出梅花五
217992,八出梅·宣城妙品世无双
898097,庵东窗雨霁月出梅花影见窗上
115467,庵东窗雨霁月出梅花影见窗上
904847,八出梅
474831,秋日出梅溪
63952,秋日出梅溪
274412,减兰·先入伏后出梅，俗谓之梅抱伏，主酷暑
283468,汉宫春·腊梅，和子野，并谱四声。子野词出梅苑
648905,胡敏御史致事出梅求题余于胡有旧故赋二诗识别 其二
1222996,六月二十四日夜梦剡源师同游山寺主僧延入丈室出梅花画卷赋诗旁有胡用章先生坐主僧下时剡源对席仆居其次案上绿竹一枝青翠可爱剡源赋诗桷即援笔
648904,胡敏御史致事出梅求题余于胡有旧故赋二诗识别 其一
864260,临海僧珂公出梅花诗和其韵
688947,冬日同李伯襄戴公纶过伍国开兄弟园折得八出梅花分赋
152393,胡季怀惠六出梅一枝仍在枉绝句率然次韵勿笑
