1004738,念奴娇 其一 忆先庐春山之胜
1001048,上饶方君小倅官而不婚宦居偏户间静无官宦之事舍后梯城而上即棚为亭尽得溪山之胜名之曰快哉为作四小诗以快哉此风为韵 其一
539209,舍弟敬美自秦来郧谈登华山之胜有作
552326,陈春宇太史闻余谈衡山之胜有作因次韵答之二首 其二
1127658,上饶方君小倅官而不婚宦居偏户间静无官宦之事舍后梯城而上即棚为亭尽得溪山之胜名之曰快哉为作四小诗以快哉此风为韵
147439,江州德化县漪岚堂尽得庐山之胜醉中作此呈赵
855065,登普宁寺岁寒庵面江山之胜令人欲赋而长老因公出诗集相示作此诗谢之
911573,赵山甫居玉壶尽得湖山之胜醉后和其韵二章 其二
388614,听客谈武夷山之胜
1089578,净光丈室开小窗颇得江山之胜次璧老壁间韵
353509,净光丈室开小窗颇得江山之胜次璧老壁间韵
372036,薜农寺连月不相见雪中思其所居对湖山之胜一诗呈之
295856,人日寒甚许疑庵自歙来谈黄山之胜
865074,和蔡肇慎思说家山之胜用其语得诗
210948,慎思说家山之胜用其语得诗
635489,闻霍西牛说家住富春山之胜跃然欲往赋此订同住之约
541877,同李兵宪廷实刘计部伯柬宴集因谈五台山之胜遂赋长歌
385683,感怀和韵·此山之胜甲东吴
524835,小泛得黄楼诸山之胜
1115038,赵山甫居玉壶尽得湖山之胜醉后和其韵二章
285734,星丈诗中言虞山之胜赋之
1033422,江州德化县漪岚堂尽得庐山之胜醉中作此呈赵明府
1110973,分宜晚泊江亭望南山之胜绝江往游将还而舟子不至择之刺船径渡呼之予与伯崇伫立以俟因得二绝
789899,星丈诗中言虞山之胜赋之
228544,赵山甫居玉壶尽得湖山之胜醉后和其韵二章
115107,伯氏到济南寄诗颇言太守居有湖山之胜同韵和
1030976,慎思说家山之胜用其语得诗
1000633,上饶方君小倅官而不婚宦居偏户间静无官宦之事舍后梯城而上即棚为亭尽得溪山之胜名之曰快哉为作四小诗以快哉此风为韵 其三
195109,登普宁寺岁寒庵面江山之胜令人欲赋而长老因
323382,东屯溪山之胜似吾家左原
743772,五岚问西山之胜
603198,孙肖延极谈樵山之胜以诗见贻次答
996121,伯氏到济南寄诗颇言太守居有湖山之胜同韵和
739208,听客谈武夷山之胜
207111,孙鍊士话龙虎山之胜於其行因以送之
596988,陈春宇太史闻余谈衡山之胜有作因次韵答之二首 其一
1000631,上饶方君小倅官而不婚宦居偏户间静无官宦之事舍后梯城而上即棚为亭尽得溪山之胜名之曰快哉为作四小诗以快哉此风为韵 其二
898768,丑奴儿/采桑子 其三 王公泽为予言查山之胜，戏赠
1000632,上饶方君小倅官而不婚宦居偏户间静无官宦之事舍后梯城而上即棚为亭尽得溪山之胜名之曰快哉为作四小诗以快哉此风为韵 其四
868712,孔鍊士话龙虎山之胜于其行因以送之
800539,听周紫海先生话海外三山之胜
470587,余买一小丘于铁山下登陟不数十武而尽揽湖山之胜尤于看梅为宜盖踞花之上千村万落一望而收之久欲作一小阁名为六浮六浮之名遂满人耳而阁竟不就友人邹孟阳见余叹息每欲代为经营今日始引孟阳至其地亦复叫绝不能已余因为作六浮阁图兼题一诗冀孟阳无忘此盟时丁巳八月十八日也
1093984,薜农寺连月不相见雪中思其所居对湖山之胜一诗呈之
1088095,分宜晚泊江亭望南山之胜绝江往游将还而舟子不至择之刺船径渡呼之予与伯崇伫立以俟因得二绝 其二
628566,用公归自中都言湖山之胜余以负恩之身频年抱病于用公闲云野鹤为何如哉
911574,赵山甫居玉壶尽得湖山之胜醉后和其韵二章 其一
1085932,东屯溪山之胜似吾家左原
700940,陈春宇太史闻余谈衡山之胜有作因次韵答之二首
1088094,分宜晚泊江亭望南山之胜绝江往游将还而舟子不至择之刺船径渡呼之予与伯崇伫立以俟因得二绝 其一
607784,秋日霍念赋卢原甫集饮陶紫阁因之楼询我琼山之胜
1216955,霍丘孙游武林湖山之胜诏之
