1099168,观三贤石本墨妙
1032554,绍兴戊午秋因观毕氏所藏定武旧石本兰亭因题
1039239,次韵答侍读张龙图索阅古堂诗石本
372490,次韵答侍读张龙图索阅古堂诗石本
1124112,以湖州酥秀州木犀面油太和石本观音像送莫万安三首
920200,次韵刘京兆石林亭之作，石本唐苑中物，散流民间，刘购得之
1035862,昭陵六马，唐文皇战马也，琢石象之，立昭陵前，客有持此石本示予，为赋之
898134,萧朝散惠石本韩干马图马亡后足
116075,萧朝散惠石本韩干马图马亡后足
746668,题王叔和所藏磬石本兰亭叙
258799,启母石·顽石本在世
30454,玉声亭·世间泉石本无价
971048,以湖州酥秀州木犀面油太和石本观音像送莫万安三首 其二
740632,覃溪前辈以诗附粤东金石十余通见赠且索余安徽所拓石本依韵奉答
98534,以湖州酥秀州木犀面油太和石本观音像送莫万
971049,以湖州酥秀州木犀面油太和石本观音像送莫万安三首 其一
212454,因成五绝·块然木石本无情
971047,以湖州酥秀州木犀面油太和石本观音像送莫万安三首 其三
352473,观三贤石本墨妙
102248,次韵和刘京兆石林亭之作石本唐苑中物散流民
