206600,司理刘大著·旌旆悠悠出陕时
163675,送考功刘大著出守嘉禾韵得相字
206601,送宣笔与成都司理刘大著
206653,寄赠西川御史薛端公益州司理刘大著陕路运使
206579,赠薛田察院兼呈刘大著
1035534,依韵和益州司理刘大著喜与运使薛端公相见之什
1035695,登龙门县楼与知宰刘大著将话别因有题纪
1035455,送宣笔与成都司理刘大著
1035734,赠薛田察院兼呈刘大著
1035643,送薛端公赴右蜀均输兼呈司理刘大著二首 其一
206599,送薛端公赴右蜀均输兼呈司理刘大著
206502,和薛察院同龙门知县刘大著洎数公禹庙留题
1004186,送考功刘大著出守嘉禾分韵得相字
1035438,和薛察院同龙门知县刘大著洎数公禹庙留题
206530,依韵和益州司理刘大著喜与运使薛端公相见之
206703,寄赠河中孙大谏兼简刘大著李渎处士
1035481,谢益州司理刘大著寄惠筇竹杖
1035678,寄赠河中孙大谏兼简刘大著李渎处士
206624,送刘大著赴任益州司理
1035608,送刘大著赴任益州司理
1035562,和酬益州刘大著同运使薛端公见寄之什
1035676,寄赠西川御史薛端公益州司理刘大著陕路运使臧殿院梓州提刑唐察院
206436,和酬益州刘大著同运使薛端公见寄之什
206474,登龙门县楼与知宰刘大著将话别因有题纪
1035642,送薛端公赴右蜀均输兼呈司理刘大著二首 其二
1132415,送薛端公赴右蜀均输兼呈司理刘大著二首
206547,谢益州司理刘大著寄惠筇竹杖
