389122,上巳与赵宪副郊游赵取小妇由关中适至口占戏之
1023666,和春谷赵泉使贺端斋赵宪使喜雪
538439,高司农赵宪使共游崆峒山二首 其一
223066,谢淅东赵宪使
538440,高司农赵宪使共游崆峒山二首 其二
733064,南昌遇赵宪副韫退
1096364,赵宪使席上
1128929,送赵宪使除郎归班二首
374625,送赵宪使除郎归班
925157,送赵宪御史赴江西三绝 其一
161608,除日出江上迓赵宪
542572,春夜张宪副叔载宅饯别赵宪使子后赴大梁得游字
603812,赵宪副游飞来寺陪酌挹泉亭
1096203,长兴长赵宪可说闽帅王方岩逸事
126988,谢赵宪逼使惠建茶
1246991,送陈进善偕赵宪郎之浙西
1117285,送赵宪御史赴江西三绝
964258,满庭芳 其七 酬赵宪
683436,高司农赵宪使共游崆峒山二首
941985,谢赵宪副使惠建茶
588605,东台歌寿赵宪副
219859,送赵宪御史赴江西三绝
378139,和春谷赵泉使贺端斋赵宪使喜雪
187511,跋赵宪唐率更千字文迹
588944,东台赵宪副远惠竹画赋谢
683681,上巳与赵宪副郊游赵取小妇由关中适至口占戏之
861695,除日出江上迓赵宪
474526,寄赵宪副万举
1097834,送赵宪使除郎归班二首 其一
588955,和赵宪副诗轴见寄兼呈年家岑都谏
669207,题问津图送赵宪副
925156,送赵宪御史赴江西三绝 其二
492365,过凤冈赵宪史仲思隐居茆堂
51302,寄赵宪副万举
625934,赵宪副说于贵筑遇天竺僧命作诗记之
591482,冬夜集赵宪副仲履宅
893641,谢浙东赵宪使举
1097835,送赵宪使除郎归班二首 其二
539794,上巳与赵宪副郊游赵取小妇由关中适至口占戏之 其二
925158,送赵宪御史赴江西三绝 其三
880277,跋赵宪唐率更千字文迹
539793,上巳与赵宪副郊游赵取小妇由关中适至口占戏之 其一
