671046,答殿卿九日见怀 其一
678667,和大兄甲辰岁九日见寄
486400,怀仙歌赐周玄初（永乐四年九月十九日。见周玄真《鹤林类集》）
522336,初九日见红梅约味苓同赏是日新作水楼亦欲诗人过之为后来嘉话也
1116546,次韵王廷老和张十七九日见寄二首
923915,次韵李公择九日见约以疾不赴
1076181,次韵吕晞朴九日见示
796039,南乡子 九日   见汪之珩《东皋诗馀》
604648,答韩伯举五羊九日见怀
337483,次韵吕晞朴九日见示
920997,次韵王廷老和张十七九日见寄二首 其二
1252891,和冯大尹九日见寄二首
99472,和晁同年九日见寄
1142322,和孟能静总管西庄閒居九日见招
115667,次韵李晋裕教授九日见赠
384489,八月初九日见月
117805,次韵李公择九日见约以疾不赴
592588,范太史胡比部九日见过邀郑明府同集
671047,答殿卿九日见怀 其二
1075256,次韵明叔九日见怀
692096,答殿卿九日见怀
1246310,次韵和石末公九日见寄
924046,和青州教授顿起九日见寄
896983,次韵李晋裕教授九日见赠
336518,次韵明叔九日见怀
1251579,和冯大尹九日见寄二首 其一
100743,次韵王廷老和张十七九日见寄
1251580,和冯大尹九日见寄二首 其二
873127,念奴娇 其一 和曾宏父九日见贻
920837,和晁同年九日见寄
920996,次韵王廷老和张十七九日见寄二首 其一
668696,八月初九日见月
1102596,次韵陈静佳治中九日见寄
666035,答近夫九日见寄
