292030,俞律诗兄督予先作《登庐山龙首崖放歌》，因走笔赋此，不知能入法眼否
304393,九日同季馥巩庵勉甫桐君及强志贻先弟约立之至香山作登高之会
944204,题钦庙主器时所作登瀛图
119725,题钦主器时所作登瀛图
698225,九月朔卞庙谒祭因有豫作登高之约归次偶成
302284,九日·闭门不作登高计
655014,九月朔卞庙谒祭因有豫作登高之约归次偶成 其二
458268,车中追作登至喜亭望三江口
999953,闻参政王侍郎令子著作登第复除崇文校书
158411,闻参政王侍郎令子著作登第复除崇文校书
162903,玉楼春·瘦筇倦作登高去
424456,被花恼·社中诸子期九日赴近地作登高会，伤离念乱，无复游观意。倚此解谢之
428321,念奴娇 每岁除日午后偕程子颂嘉游惠山登云起楼酌酒品茗习以为常，今程子卧病已逾三年，余则于客中过却，乙亥正月独游惠山归谱此解并作登楼别岁图以似颂嘉病榻卧游
415968,俞律诗兄督予先作《登庐山龙首崖放歌》，因走笔赋此，不知能入法眼否
655015,九月朔卞庙谒祭因有豫作登高之约归次偶成 其三
743687,同杨明府拟作登端州东门浮屠诗
828385,九日同季馥巩庵勉甫桐君及强志贻先弟约立之至香山作登高之会
655013,九月朔卞庙谒祭因有豫作登高之约归次偶成 其一
288606,被花恼·社中诸子期九日赴近地作登高会
828557,苕雪作感旧诗有「欲近霜风吹帽节可能无感白衣来」之句盖去岁九日余在病中苏堪强邀作登高之会也因次其韵
