140167,史仓使约登齐山自弄水亭过清溪桥至壶天洞洞
111466,游石桥至塔头路
83752,夜漏欲尽行度浮桥至钱清驿待舟
1042283,自西桥至紫温载酒作乐即事呈府公四首 其二
1042285,自西桥至紫温载酒作乐即事呈府公四首 其四
284698,正月二十日由枫桥至五泾用东坡是日女王城诗韵
366213,自西桥至紫温载酒作乐即事呈府公
75842,度浮桥至南台
616040,晚步栖贤桥至籋云桥
1109639,自西桥至紫温载酒作乐即事呈府公四首
806795,浣溪沙 雨中由枫桥至齐门
624811,由断桥至孤山
769288,长桥至草凉驿即目
382360,雪中度吴桥至郡黉
976821,游石桥至塔头路
840378,自三峡桥至栖贤寺二首 其一
934904,过大蓬岭度绳桥至杜秀才山庄
81319,过大蓬岭度绳桥至杜秀才山庄
1166545,清明日自西午桥至瓜岩村有怀
936063,夜漏欲尽行度浮桥至钱清驿待舟
315827,自三峡桥至栖贤寺
936264,度浮桥至南台
751119,由衡岳南台寺历玉版桥至半云庵后山谒庭柏禅师墓还至田家醉书
1034622,史仓使约登齐山自弄水亭过清溪桥至壶天洞洞乃史新作或曰此即左史洞又至华盖洞翠微亭史仓索赋
9463,清明日自西午桥至瓜岩村有怀
845182,自三峡桥至栖贤寺二首
808906,雪中度吴桥至郡黉
751148,正月二十日由枫桥至五{氵众}泾用东坡是日女王城诗韵
1042284,自西桥至紫温载酒作乐即事呈府公四首 其三
677051,舟发斜桥至虎山喜晴一路看花作
840379,自三峡桥至栖贤寺二首 其二
750527,避寇由甘泉公道桥至东台
1042282,自西桥至紫温载酒作乐即事呈府公四首 其一
