1193120,建中癸亥岁奉天除夜宿武当山北茅平村
11120,建中癸亥岁奉天除夜宿武当山北茅平村
593896,茅平仲梅客生沈叔成马用昭朱汝修盛泰甫招集苑西草堂同李袭美李惟寅梁持伯分得西字
593948,茅平仲南归寿母
593551,十日田子艺魏季朗茅平仲朱邦肃胡茂承郭建初莫云卿马用昭邵长孺程无过汪元初程虞仲诸子见过得先字
592374,晦日姚唯之茅平仲管建初蒋子夏陆无从饮斋中得春字
695898,送茅平仲还京口因怀郭次甫陆无从四首
592715,同赵敬辰黄定父茅平仲吕子佩游金山登江天阁
67172,送茅平仲
469515,金陵酒肆赠茅平仲
474162,送茅平仲
593726,送茅平仲还京口因怀郭次甫陆无从四首 其四
604341,柬茅平仲
63318,金陵酒肆赠茅平仲
593413,雪中张平叔杨汝德汪子建茅平仲诸君见过得钟字
533816,周廷直茅平仲见过出新酝酌之同赋
593724,送茅平仲还京口因怀郭次甫陆无从四首 其二
593725,送茅平仲还京口因怀郭次甫陆无从四首 其三
550907,出都门留别茅平仲周思敬朱汝脩吴孝甫张孺宗赵凡夫钟山甫韩兆之吴载伯阮步文张曰肩诸君
593723,送茅平仲还京口因怀郭次甫陆无从四首 其一
544779,同茅平仲登甘露寺绝顶作
