302394,秋霖·十年北地无霖雨
43318,下相极东庵读同年北使时诗卷
828114,夏五月与愔仲同年北游过天津主瀹老浪公两家浪公一夕梦至一处层楼复阁琳琅满架一老人以所书楼额视之首尾为五楼二字中覆以纸问浪公曰试射何字曰当是凤字老人微哂曰君知五凤楼耳揭视乃岳字也浪公既志之爱其名属予归请太夫人书之因题长句于后邀愔仲同作且视瀹老
100038,新年·北渚集群鹭
752349,题徐鞠人同年北江旧庐图
1070727,海南有五色雀土人呼为小凤罕有见者苏子瞻谪居此郡绍圣庚辰冬再见之常作诗记其事公实以是年北归癸酉冬予亦两见之今二年矣乙亥八月二十二日会客陈氏园飞鸣庭下回翔久之众客惊叹创见因赋是诗
212812,杜陵体·景炎元年北人至
343515,尝进酒·昔年北苑试龙茶
699907,送王司业同年北上三绝
624547,偕容瞻公同年北上漫兴
333325,罪谪海上中州亲故罕通问独虞君祖道相从湖海踰年北归同途次容南赋诗识别
491153,送马大参同年北上
214126,老树·去年北风吹瓦裂
490627,送王司业同年北上三绝 其二
319859,赠潘四梅·几年北学重京华
490626,送王司业同年北上三绝 其一
490628,送王司业同年北上三绝 其三
1078051,罪谪海上中州亲故罕通问独虞君祖道相从湖海踰年北归同途次容南赋诗识别
705288,下相极东庵读同年北使时诗卷
334778,简杨治中·当年北骑压杭城
490689,毗陵别伊仪部同年北上
