455619,壬子春词 其一 辛亥岁杪，与叶红自琼归省，旋于壬子春节结缡于广州，并同游肇庆，下榻鼎湖山，有作
1001704,重九独酌次偶成数韵呈江司法李帐干并同游诸僚兄 其二
1001705,重九独酌次偶成数韵呈江司法李帐干并同游诸僚兄 其一
724471,摄山栖霞寺山房夜坐简徐祭酒周尚书并同游群彦诗
455621,壬子春词 其三 辛亥岁杪，与叶红自琼归省，旋于壬子春节结缡于广州，并同游肇庆，下榻鼎湖山，有作
400982,立秋日悠然肇仓小周枉过并同游北海次日得罗振玉联一副文曰岁事既登有禾有黍好宾方集以燕以游如纪昨盛欣成一律呈三公
316702,立秋日悠然肇仓小周枉过并同游北海
466501,壬子春词 辛亥岁杪，与叶红自琼归省，旋于壬子春节结缡于广州，并同游肇庆，下榻鼎湖山，有作
148723,重九独酌次偶成数韵呈江司法李帐干并同游诸
1127715,重九独酌次偶成数韵呈江司法李帐干并同游诸僚兄
455620,壬子春词 其二 辛亥岁杪，与叶红自琼归省，旋于壬子春节结缡于广州，并同游肇庆，下榻鼎湖山，有作
455622,壬子春词 其四 辛亥岁杪，与叶红自琼归省，旋于壬子春节结缡于广州，并同游肇庆，下榻鼎湖山，有作
630973,波罗舟中呈林将军并同游徐梁诸公
