14042,中书即事
1179176,陪太原郑行军中丞登汾上阁中丞诗曰汾楼秋水阔宛似到阊门惆怅江湖思惟将南客论南客即詹也辄书即事上荅
14963,奉和司空裴相公中书即事通简旧僚之作
1192081,中书即事
10804,秋馆雨后得弟兄书即事呈李明府
1172405,招隐山观玉蕊树戏书即事奉寄江西沈大夫阁老
1154017,秋幕中夜独坐迟明因陪陈翃郎中晨谒上公因书即事兼呈同院诸公
1161823,朔旦冬至摄职南郊因书即事
25628,秋晚信州推院亲友或责无书即事寄答
1161759,县君赴兴庆宫朝贺载之奉行册礼因书即事
1193241,桂阳北岭偶过野人所居聊书即事呈王永州邕李道州圻
858053,中书即事
13456,刘绍相访夜话因书即事
1187099,自武威赴临洮谒大夫不及因书即事寄河西陇右幕下诸公
901328,再过黄州苏子瞻东坡雪堂因书即事题于武昌王叟斋扉
1171225,永乐县所居一草一木无非自栽今春悉已芳茂因书即事一章
11278,桂阳北岭偶过野人所居聊书即事呈王永州邕李道州圻
1159756,奉和司空裴相公中书即事通简旧僚之作
13728,县君赴兴庆宫朝贺载之奉行册礼因书即事
1161913,刘绍相访夜话因书即事
233144,再过黄州苏子瞻东坡雪堂因书即事题於武昌王
215248,中书即事·投老翻为世网婴
20309,招隐山观玉蕊树戏书即事奉寄江西沈大夫阁老
1161264,秋馆雨后得弟兄书即事呈李明府
981132,中书即事
1190807,秋晚信州推院亲友或责无书即事寄答
13605,朔旦冬至摄职南郊因书即事
1151742,大同殿柱产玉芝龙池上有庆云神光照殿百官共睹圣恩便赐宴乐敢书即事
208102,中书即事·惨惨高槐落
24204,永乐县所居一草一木无非自栽今春悉已芳茂因书即事一章
