1235444,庚午岁七月自城中归吉文故乡南岭谷平庐陵印山凡故旧多招饮者饮后辄援笔赋诗五七言律外得歌行九篇聊书以遣怀云尔 望城冈
563101,廉宪王母诰封张太恭人七十寿诗张太恭人刲股血诚神明降鉴天子既表怀清之宅复疏观察之恩荣名所归吉祥来集兹大夫盟府纪功祝釐竣事正当太夫人七帙设帨之辰是日也白华朱萼赓束晢之诗青鸟丹砂受西池之箓九牧之中三乐咸备诗以为贺
481431,送陈生归吉水赤岸二首 其一
507633,送陈生归吉水赤岸二首 其二
578488,送王编修先生致仕归吉水
635033,送刘明府归吉安
243033,与郭寿翁俱客钱塘寿翁归吉州追饯至龙山白塔
491998,送邹明道归吉水
553000,送李伯谨同知归吉安
1228630,庚午岁七月自城中归吉文故乡南岭谷平庐陵印山凡故旧多招饮者饮后辄援笔赋诗五七言律外得歌行九篇聊书以遣怀云尔 其三 饮谷平李氏
90492,丙寅人日送药者周叔亮归吉水县
691378,送陈生归吉水赤岸二首
915128,丙寅人日送药者周叔亮归吉水县
207565,送蓬丘山人张以道归吉州
678784,送许中书谢病归吉水
566507,送钱萼飞归吉水
1228628,庚午岁七月自城中归吉文故乡南岭谷平庐陵印山凡故旧多招饮者饮后辄援笔赋诗五七言律外得歌行九篇聊书以遣怀云尔 其一 望城冈
57513,送陈生归吉水赤岸
856384,送无为倅张南仲归吉州
142374,送无为倅张南仲归吉州
578501,送熊都御史弟归吉安
990251,送蓬丘山人张以道归吉州
648226,送淮安刘千户致仕归吉水
385949,豫章别曾克庵归吉水
859551,送董伯懿归吉州
1228631,庚午岁七月自城中归吉文故乡南岭谷平庐陵印山凡故旧多招饮者饮后辄援笔赋诗五七言律外得歌行九篇聊书以遣怀云尔 其四 饮印山田舍
634073,送刘木生明府归吉水
1228629,庚午岁七月自城中归吉文故乡南岭谷平庐陵印山凡故旧多招饮者饮后辄援笔赋诗五七言律外得歌行九篇聊书以遣怀云尔 其二 饮南山故居
54554,送颜用行归吉水并柬康隐君
213969,送董伯懿归吉州
864237,与郭寿翁俱客钱塘寿翁归吉州追饯至龙山白塔寺惜别怅然终日始登车而去既行旬日予得请庐山太平观将归隐浙东山中寄诗奉怀
491576,送颜用行归吉水并柬康隐君宗武
