993383,潘歙州怪予遂行与黄君同路黄先游浙矣依韵酬寄
907076,秉文荐对报罢赴任有诗示予遂和
104650,潘歙州怪予遂行与黄君同路黄先游浙矣依韵酬
1208518,至元三年六月八日史局作休从伯京御史公亮太监伯温秘卿伯循待制暂至城西秘卿待制别去伯京归家予遂偕公亮回憩都水监双清亭监掾平伯钦留饮即席赋五言十八韵
634263,甲寅九月杪予从江宁入句曲晤林明府仅人因得接黍谷钱中丞之欢同寓崇明寺畅谈捧腹已成三日夕之乐十月朔二鼓别归邻院而宿夜梦与中丞凭高俯视见有搅绵花者梦中幻境其花蒙茸如海风撼浪予谓中丞曰可共作搅绵花诗何如中丞诺之予遂先成二句曰却似白云生谷口还如泻水置平川及旦林紫君相过因与中丞同早饭王大席陈南浦俱在焉饭后相与步城头揽郭外秋色而凭高之意遂忆梦中因语中丞中丞索予续成欲和同游者各属一章即以此为相逢剪拂投赠之雅什也
197963,秉文荐对报罢赴任有诗示予遂和
637595,有自西川来镇远者使獭捕鱼甚巧周翠渠同何贰守观之欲赋未就间以语予遂为四句
608133,臬长李公之堂有雉忽来驯扰若家鸡数日后锦羽焕烂此治世文明之象异类驯服之符也一时缀文之士咸作诗侈其事予遂为歌歌曰
1218415,吴南伯王子英李元善会于林湖资敬庵各有诗予遂叙和 其一
1218416,吴南伯王子英李元善会于林湖资敬庵各有诗予遂叙和 其二
472296,张长舆刻虞山游稿命予附后语孙七政前序予遂不敢以诗答长舆
1235955,吴南伯王子英李元善会于林湖资敬庵各有诗予遂叙和
57579,张长舆刻虞山游稿命予附后语孙七政前序予遂
