921836,元祐六年六月，自杭州召还，汶公馆我于东堂，阅旧诗卷，次诸公韵三首 其一
473311,白丈自杭州归要游天池
647756,闻钱仲益自杭州获归
3880,朱放自杭州与故里相使君立碑回因以奉简吏部杨侍郎制文
46004,甲午春朱叟自杭州寄示观新排长生殿传奇诗因
821631,鹧鸪天 静霞自杭州来见，别后复寄词，次其韵
455840,瑞广兄博士毕业自杭州赴无锡途中以诗见寄次韵奉和
1159652,白舍人自杭州寄新诗有柳色春藏苏小家之句因而戏酬兼寄浙东元相公
1185781,喜姚郎中自杭州回
818643,甲午春朱叟自杭州寄示观新排长生殿传奇诗因亦赋答绝句五首近戏撰论再生缘一文故诗语牵连及之也
1116702,元祐六年六月，自杭州召还，汶公馆我于东堂，阅旧诗卷，次诸公韵三首
99993,元佑六年六月自杭州召还汶公馆我於东堂
825528,陈仁先自杭州归见示诗卷且饷山泉二瓶
300545,自杭州夜抵上海，苏仲翔丈风雪漫天至车站，奉手涕零，谨呈一绝
30058,送内使周大夫自杭州朝贡
407559,自杭州夜抵上海，苏仲翔丈风雪漫天至车站，奉手涕零，谨呈一绝
921838,元祐六年六月，自杭州召还，汶公馆我于东堂，阅旧诗卷，次诸公韵三首 其三
821275,采桑子 静霞自杭州寄讯，和其月夜六和塔下韵一首
49723,白丈自杭州归要游天池
101209,元祐六年六月自杭州召还汶公馆我于东堂阅旧
381806,陈仁先自杭州归见示诗卷且饷山泉二瓶
1158596,朱放自杭州与故里相使君立碑回因以奉简吏部杨侍郎制文
273804,采桑子·静霞自杭州寄讯，和其月夜六和塔下韵
921837,元祐六年六月，自杭州召还，汶公馆我于东堂，阅旧诗卷，次诸公韵三首 其二
274091,鹧鸪天·静霞自杭州来见，别后复寄词，次其韵
26072,喜姚郎中自杭州回
1180037,送内使周大夫自杭州朝贡
