18840,喜钱左丞再除华州以诗伸贺
1112918,德庆范监州以子石砚宠假虽小而奇戏作
429738,病起书怀呈真长拔可敷庵兼寄石遗师舜卿表兄福州以霜发秋蓬乱为均 其四
1036024,雨中花慢 初至密州。以累年旱蝗。斋素累月。方春牡丹盛开。遂不获一赏。至九月。忽开千叶一颛。雨中特为置酒。遂作
191758,携客过王提举园访梅刘连州以诗来因用其韵
780849,壶州以后放言诗寄示奉次二首 其二
991872,去年宋中道自洺州以书令魏殊来谒予魏遂托主第后辞归予因中道之兄次道有孔雀赋以送魏生
1078126,东坡谪英州以书语所善衲子曰戒和尚又疏脱矣读之有感
462793,中秋前一日，三江公干莅京。与金红饮锦官居，分“皇宫贡酒”得皇字，三江即邀月底赴夷陵荆州，以避武当山之游鲫，属同行某豪将作黑茶赋
429736,病起书怀呈真长拔可敷庵兼寄石遗师舜卿表兄福州以霜发秋蓬乱为均 其二
104616,刘泾州以所得李士衡观察家号蟾蜍砚其下刻云
1071256,宣和四年东阳梅某出守蕲州以五月十九日斋宿山谷黎明奉亲朝谒真源万寿宫少休五云寺赋此
1005739,子瞻在惠州以十月初吉作重九和渊明己酉九月九日韵余去年以此日奔避万山今日则有间矣有野人馈菊两丛对之叹息因继韵陶苏之后
19246,刘苏州以华亭一鹤远寄以诗谢之
429735,病起书怀呈真长拔可敷庵兼寄石遗师舜卿表兄福州以霜发秋蓬乱为均 其一
661855,兰州以山名北枕黄河城之西有唐帽山尤秀特彭司马幸庵先茔在焉地灵人杰堪舆家之说岂尽诬邪
850514,叶师迎娶还吴省亲遂之官达州以诗见意
390108,题滕县赵宰祠堂辛酉春赵有书遗余谭灭奴方略征播州以勤死
356007,驻跸扬州以提点刑狱公廨为尚书省礼部在西北隅卷书
780848,壶州以后放言诗寄示奉次二首 其一
1156452,钱湖州以箬下酒，李苏州以五酘酒相次寄到，无因同饮，聊咏所怀
1156452,钱湖州以箬下酒，李苏州以五酘酒相次寄到，无因同饮，聊咏所怀
333337,东坡谪英州以书语所善衲子曰戒和尚又疏脱矣读之有感
814473,壶州以后放言诗寄示奉次二首
1155940,刘苏州以华亭一鹤远寄以诗谢之
598088,献岁春前王郡公还自惠州以书见贻有虚馆相迎语作此谢之
488620,赠夏陈州以道
593493,答纪判官自亳州以论草玄草诸刻见寄
323554,金华先生有奇石名碧远携来自蜀陈洪州以诗觅之
18293,钱虢州以三堂绝句见寄因以本韵和之
1057300,季颜师颜谪齐州以诗寄之
196731,胡文昌和东坡子由彭城月诗并绿澹庵新州以所
307080,自均州以西滩岭丛杂一千九百馀里每夜泊舟听雨闻猿盖经两月日行万壑间也
991958,刘泾州以所得李士衡观察家号蟾蜍砚其下刻云天宝八年冬端州刺史李元德灵卵石造示刘原甫原甫方与予饮辨云天宝称载此称年伪也遂作诗予与江邻几诸君和之
1041608,刘泾州以所得李士衡观察家宝砚相示与圣俞玉汝同观戏作此歌
99471,闻乔太博换左藏知钦州以诗招饮
891012,州以隆名诚盛事也父老欢喜一词仆亦感且慰因赋诗以志其盛
1195935,陈觉放还至泰州以诗见寄作此答之
1156557,喜钱左丞再除华州以诗伸贺
429737,病起书怀呈真长拔可敷庵兼寄石遗师舜卿表兄福州以霜发秋蓬乱为均 其三
750348,朱伯韩观察过荆州以诗文见示
429739,病起书怀呈真长拔可敷庵兼寄石遗师舜卿表兄福州以霜发秋蓬乱为均 其五
920819,闻乔太博换左藏知钦州，以诗招饮
105027,去年宋中道自洺州以书令魏殊来谒予魏遂托主
584874,题莆阳吴知州以宽可以亭
1081031,闻公晦叔往廉州以诗送之
1245382,山北佥宪黑思仲义以宗正郎中召还予时在会州以诗送之甲辰岁暮云
156097,子瞻在惠州以十月初吉作重九和渊明已酉九月
1089141,德庆范监州以子石砚宠假虽小而奇戏作 其一
1085965,贾岳州以予阻风致酒肉之赠
321765,贾岳州以予阻风致酒肉之赠
541881,汾州以来分守参政如胡世甫葛与立马子懋程信夫彭克宪陈元卿李子高宋伯镇孙格卿张时芳纪恒甫诸公皆旧识也宋有禦敌之功不见知当道解官归越嗟哉
938822,胡文昌和东坡子由彭城月诗并录澹庵新州以所和见示索和
34990,陈觉放还至泰州以诗见寄作此答之
1089142,德庆范监州以子石砚宠假虽小而奇戏作 其二
351955,德庆范监州以子石砚宠假虽小而奇戏作
1070569,驻跸扬州以提点刑狱公廨为尚书省礼部在西北隅卷书楼下甲戌年余尝寓止焉今寓直其下有感
433491,病起书怀呈真长拔可敷庵兼寄石遗师舜卿表兄福州以霜发秋蓬乱为均
158663,州以隆名诚盛事也父老欢喜一仆亦感且慰因赋
946223,携客过王提举园访梅刘连州以诗来因用其韵
183077,叶师迎娶还吴省亲遂之官达州以诗见意
819526,自均州以西滩岭丛杂一千九百馀里每夜泊舟听雨闻猿盖经两月日行万壑间也
1085400,金华先生有奇石名碧远携来自蜀陈洪州以诗觅之金华辍所嗜以赠亦一段奇事也予家雁荡群峰错峙皆几案间物因和二公诗颇起乡思寓意断章
569433,唐子两司锡学前后八年矣迁教授岳州以行锡诸生碑之以志去思
1035854,扬州以土物寄少游
349228,闻公晦叔往廉州以诗送之
746183,自德州至景州以河决庐舍淹没农事未兴
1155553,钱虢州以三堂绝句见寄因以本韵和之
