854046,约黄成之观琼花予不及从以诗代简 其二
60443,斋居呈陈二高三兼似故人黄玄林敏及从弟
972418,成父弟书来报朱先生过玉山留南山一日且有题名余不及从杖履为恨辄成鄙句寄斯远彦章且示成父
470589,锡山夜别闲孟子薪彦逸及从子宜之儿子杭之 其二
1079413,用寄璧上人韵寄范元实赵才仲及从叔知止兼率山伯同赋
329189,用寄璧上人韵寄范元实赵才仲及从叔知止兼率山伯同赋
1105305,约黄成之观琼花予不及从以诗代简
734179,九日同高念东在衡及从子敷政游丰台
470588,锡山夜别闲孟子薪彦逸及从子宜之儿子杭之 其一
482757,斋居呈陈二高三兼似故人黄玄林敏及从弟
853588,约黄成之观琼花予不及从以诗代简
1004015,去岁重阳日得彦威信附六月间二小侄及从弟侄所寄书自蜀阃递中附至历言去冬今春所遭兵祸及有司督迫科调之苦喜其存全哀其窘蹙洒涕如霰寄讯邀其下峡而边事又告急未知其达与否也会杪冬见邸报宣谕使者余公侍郎改命授钺尽护蜀师意欲以此事归控骨肉会聚兹事其谐矣喜极涕零遂成长篇
163402,去岁重阳日得彦威信附六月间二小倒及从弟倒
623788,冬日族祖虞卿华玉携榼过淡圃家大人及从弟嘉敬实同集体赋得隈字
853589,约黄成之观琼花予不及从以诗代简 其一
615775,邓伯乔万伯文欧子建李烟客诸子游罗浮怅余不及从也诗以讯之
691564,锡山夜别闲孟子薪彦逸及从子宜之儿子杭之
130193,约黄成之观琼花予不及从以诗代简
1149193,寒食日毛空路示侄晦及从简
58144,锡山夜别闲孟子薪彦逸及从子宜之儿子
16861,寒食日毛空路示侄晦及从简
