603294,庚寅春三月始克赴京至二河留别诸亲友奉和薛舜徵兄见赠之韵
115760,崇宁壬午临汝四月始闻莺
1155035,予以长庆二年冬十月到杭州明年秋九月始与范阳卢贾汝南周元范兰陵萧悦清河崔求东莱刘方舆同游恩德寺之泉洞竹石籍甚久矣及兹目击果惬心期因自嗟云到郡周岁方来入寺半日复去俯视朱绶仰睇白云有愧于心遂留绝句
67784,十月始见菊
843186,病山侍郎夏间来觐直讲至八月始归留诗索和次韵寄沪
659796,甲申冬右手足忽废弥月始复书怀
832252,花发沁园春 室人种玫瑰，五年矣。今春三月始见花，欣喜索题
38800,初月·始看东上又西浮
306419,病山侍郎夏间来觐直讲至八月始归留诗索和次韵寄沪
896612,崇宁壬午临汝四月始闻莺二首 其一
545418,蔡立夫素不事曲蘖入都下忽以酒人名每一举觞辄酣畅累日夜乃醒醒则复呼酒酒已复醉或至经月始复常自名连环饮得歌者苗凤时置屏障间相酬酢余甚高其风格戏赠此章
827047,喜迁莺 香港陷落数月，始闻寅恪脱自贼中，将取道桂黔入蜀，已约乃弟致书，劝其来乐山讲学，词以坚之
475074,十八夜儿楙治酒邀诸父待月始阴仍霁
906743,阎先复朝议园牡丹一本四月始开予与李成季同往观阎求诗遂书绝句于其壁
1086883,豹岩之北脩竹数亩中有丛冢数十百处皆绍兴末年所寄予得此地先定规抚某处起亭榭某处植花木七八年间成畦径矣所寄之榇愿移者从之不强也作噩之春有姓淡人来启菆卜日携锸掘土数尺败棺俱在朽骨为土所蚀颇亦不具皆包裹而去后数日忽诉于县于州于外台追问證治踰月始定今不复塞其故穴欲使孙曾知之故作此诗
1210345,涧北梅□三月始华
179286,梅雨逾月始晴甫两日复大雨
896611,崇宁壬午临汝四月始闻莺二首 其二
1112708,崇宁壬午临汝四月始闻莺二首
983891,梅雨踰月始晴甫两日复大雨
50903,十八夜儿楙治酒邀诸父待月始阴仍霁
124716,望月·早月始娟娟
954054,希真堂东手种菊花十月始开
681790,菊花十月始开
476287,十月始见菊
404917,长寿乐·唐咸亨元年四月八日刘玄䫻母樊造像记拓本，静农得之，补模佛像于上。为用柳耆卿长寿乐第一体赋之。考是岁三月始改号咸亨，至今盖已千二百九十六年矣
138132,希真堂东手种菊花十月始开
198033,阎先后朝议园牡丹一本四月始开予与李成季同
