343402,和太守叔康以诗答桃
1160158,崔元受少府自贬所还遗山姜花以诗答之
1214960,仲宜以所植菊花见贻，以诗答之
333514,邓成彦供茉莉以诗答之
183516,同事合使见问奚国山水何如江乡以诗答之
345152,再和岩起以诗答谢惠团茶之句
358868,运使李献甫有书云千山万水之间泥泞劳苦不可胜言者因以诗答之
5812,期卢嵩枉书称日暮无马不赴以诗答
184563,新毗陵守王立之书来以诗答之蜀中同寮也
1077184,吴亲寄瓷枕香垆颇佳以诗答之 瓷垆
1049519,运使李献甫有书云千山万水之间泥泞劳苦不可胜言者因以诗答之
158201,保安杨公济书来问疾以诗答之
14757,崔元受少府自贬所还遗山姜花以诗答之
104974,前以诗答韩三子华後得其简因叙下情
324425,癸未春被召东山益老来贺曰赵州八十犹行脚以诗答之云
1078272,郑梦锡教授送黄精以诗答其意
434572,陈君百禄隐居河汾世以医名家临财廉取予又性喜谐虽外若宽纵内实重慎而有常心真善学医者也辛丑之秋余痁作君调护周至既获勿药欲酬而不可姑以诗答其勤
282845,史兆伸书寄王荆公独山梅花诗，慰我北行，以诗答之
320596,自济源回及中道得通守郎中诗跂羡山水之游以不得陪从为恨因以诗答之
1032403,梁必大归自燕山有诗问讯以诗答之
472166,得应职方书以诗答之
552393,高平儒牛好古以独茧引丝为扇因见赠戏以诗答之
896425,贫病投劾乞补外官亲友问者以诗答之
306064,辟疆为书扇，既别以诗答之
992677,前以诗答韩三子华后得其简因叙下情
15011,唐秀才赠端州紫石砚以诗答之
862799,杨仲承秘书蹉跎三年今得荣州文学冬日贻书以诗答之
825037,丁叔衡画便面见贻以诗答之
519471,沈启南写山水花禽四幅见寄以诗答之
870136,济川有书见贻云以亲老须守远郡以便禄养不得如光在主人幕下因以诗答
451905,得徐天宁荐收溱湖田怀海先生持赠蟹油两罐以诗答谢
441885,故人询回城之事以诗答之
1048754,和太守叔康以诗答桃
103270,和日卧疾恭上人来过不及见因以诗答
411258,辟疆为书扇，既别以诗答之
574033,僧圆显请记行窝以诗答之
12325,刘展下判官相招以诗答之
1152773,假中枉卢二十二书亦称卧疾兼讶李二久不访问以诗答书因亦戏李二
116842,贫病投劾乞补外官亲友问者以诗答之
442141,闻调用风言以诗答之
1187483,刘展下判官相招以诗答之
80527,亲旧书来多问近况以诗答之
12166,卫明府寄枇杷叶以诗答
331151,昌老询予来历以诗答之
923001,同事閤使见问奚国山水何如江乡以诗答之
511234,梦庄定山遣使来问梦中以诗答云
1077183,吴亲寄瓷枕香垆颇佳以诗答之 瓷枕
1076991,昌老询予来历以诗答之
1077185,邓成彦供茉莉以诗答之
17887,庾顺之以紫霞绮远赠以诗答之
1073116,癸未春被召东山益老来贺曰赵州八十犹行脚以诗答之云
1152785,期卢嵩枉书称日暮无马不赴以诗答
63267,得应职方书以诗答之
999856,保安杨公济书来问疾以诗答之
1159852,唐秀才赠端州紫石砚以诗答之
1038152,自济源回及中道得通守郎中诗跂羡山水之游以不得陪从为恨因以诗答之
992251,近有谢师厚寄襄阳柑子乃吴人所谓绿橘耳今王德言遗姑苏者十枚此真物也因以诗答
882984,新毗陵守王立之书来以诗答之蜀中同寮也
415446,史兆伸书寄王荆公独山梅花诗，慰我北行，以诗答之
226298,梁必大归自燕山有诗问讯以诗答之
622128,封荆将就道子仪宜以诗祖余也而索余己巳赠行之作因复以诗答之
472296,张长舆刻虞山游稿命予附后语孙七政前序予遂不敢以诗答长舆
578295,云村梁纹涧惠茶酝以诗答之
1049099,再和岩起以诗答谢惠团茶之句
992398,秋日卧疾恭上人来过不及见因以诗答
622073,葵宸有相念之语复以诗答其意
