802342,由二亩甸往方广入山已深忽抵一大池周七八里荷花弥望人家临水而居蜃墙红窗花竹衣桁倒影镜中戏询舆人欲买全湖直几何对云不过百金乃知山乡之业贱不可言古人买山非直耽其幽寂三径之资不当与买宅买邻同价乃可安耕凿长子孙今世惟求近城市价亟昂而租入转少取其贫时易售而已购产而欲其易售悲哉购者之愚也 其一
400228,水龙吟 林霭女弟模伫晴阁青山无恙图卷，深为李居端所激赏，谓足以乱己之作，并曾许亲为跋识。讵装池未竟，而居端遽归道山，林霭亦远游海国，死生两诀，人事叠更，癸丑初春，区季谋出此卷嘱为题词，感逝伤离，曷胜枨触
807118,隔浦莲近拍  夏日寓吴门花溪草堂与西溟夹水而居赋示西溟
978301,东绿叔祖得园池之胜于万山深处将拔宅而居焉以诗奉饯
219916,金华邵氏面山临溪而居又架木为亭云丘壑之胜
333367,自长沙至醴陵田皆垦辟有筑室而居者
948535,文忠烈公居洛有丙午同甲会诗今执政府凡三位枢密使王季海参政钱师魏先在焉前岁夏某忝参预连墙而居适然齐年时号丙午坊次文公韵简公
925154,金华邵氏面山临溪而居又架木为亭云林丘壑之胜趣乃兼得之邵氏求其名予诵东坡江郊诗名之曰茜绚题一绝
792558,延庆署斋外古槐，系数百年物，檐下鸽依人而居，即景感赋
992071,汝南江邻几云鄎南并淮浮光山有张隐居种松桧于其上养母甚孝时有猛兽驯庭中又郡西麻田山土沃泉美久不垦有刘叟者辟而居之近董氏黄氏欲买土为邻故江有慕之之作予辄次其韵
1078317,自长沙至醴陵田皆垦辟有筑室而居者
126071,闲适吟·为士幸而居盛世
346825,东绿叔祖得园池之胜于万山深处将拔宅而居焉以诗奉饯
524094,甥嘉谪官过汴僦舍而居以时炎热
114632,乔令真赞·抱璞而居
816573,由二亩甸往方广入山已深忽抵一大池周七八里荷花弥望人家临水而居蜃墙红窗花竹衣桁倒影镜中戏询舆人欲买全湖直几何对云不过百金乃知山乡之业贱不可言古人买山非直耽其幽寂三径之资不当与买宅买邻同价乃可安耕凿长子孙今世惟求近城市价亟昂而租入转少取其贫时易售而已购产而欲其易售悲哉购者之愚也
802343,由二亩甸往方广入山已深忽抵一大池周七八里荷花弥望人家临水而居蜃墙红窗花竹衣桁倒影镜中戏询舆人欲买全湖直几何对云不过百金乃知山乡之业贱不可言古人买山非直耽其幽寂三径之资不当与买宅买邻同价乃可安耕凿长子孙今世惟求近城市价亟昂而租入转少取其贫时易售而已购产而欲其易售悲哉购者之愚也 其二
