616331,同诸子寻梅偶得一花八出者因成二绝 其一
233187,客有示余王逢原诗编者因成短韵逢原广陵人死
159410,待罪书馆无所自郊客有以尸素为谑者因成答咏
520405,近雁塔有坡二曰胭脂曰翡翠其春游之盛盖极于开元天宝间矣观其命名之意则当时游冶之乐犹有可想见者因成二律情见乎辞 其一
1234400,偶得灵壁石笔格状如俗所谓钻云螭虎者因成绝句
141316,卧疾连日殊无聊赖客有送二省闱试题者因成四
948507,十一月二十七日刘公度徐用之许相过公度居忧止酒用之偶食素适有饷小春团茶者因成拙诗奉简
902970,卧疾连日殊无聊赖客有送二省闱试题者因成四韵
173296,谹父得洞庭柑分送往往难遇赏者因成小诗
1070933,某到郴几两月适当重阳而菊犹未开然江山清远又仙佛所居有足乐者因成鄙句以写离忧
959029,余自东山往金峨住山戒师迎于中涂到上方泉石幽胜有心匠助天巧者因成数语以赠
520406,近雁塔有坡二曰胭脂曰翡翠其春游之盛盖极于开元天宝间矣观其命名之意则当时游冶之乐犹有可想见者因成二律情见乎辞 其二
330913,某到郴几两月适当重阳而菊犹未开然江山清远又仙佛所居有足乐者因成鄙句以写离忧
862954,谹父得洞庭柑分送往往难遇赏者因成小诗
901286,客有示余王逢原诗编者因成短韵逢原广陵人死年二十八岁
1031045,有遗梅花枕前者因成
688169,近雁塔有坡二曰胭脂曰翡翠其春游之盛盖极于开元天宝间矣观其命名之意则当时游冶之乐犹有可想见者因成二律情见乎辞
691252,同诸子寻梅偶得一花八出者因成二绝
203252,有遗梅花枕前者因成
894160,待罪书馆无所自效客有以尸素为谑者因成答咏
522341,生辰会两学广文有以烟火为戏者因成四韵
616332,同诸子寻梅偶得一花八出者因成二绝 其二
