412125,攻石内兄枉过，不见殆五年矣，喜赠
747849,邓湘皋丈枉顾别十三年矣喜赋
1029234,予既得乌石冈西望葛坛在云霄中相去虽远山势不断林木历历可数异时乞灵仙翁不难矣喜而成诗寄葛坛主人
1028694,七月十四日夜大雨彻晓方止田家云早晚禾自此不忧矣喜而为诗
886224,舟过三游洞知遂脱兵火矣喜赋
558574,闻造楼船甚丽，余明年归必在嘉兴或姑苏相见矣，喜而先此寄诸贤弟
799885,童奴石义托身于阮怀宁府中，颇用事，家五弟衷赤往，谓微官可得，既至，弟识乱徵，时游倡楼，示荒嬉不可用，乃放归，乍归而留都不复守矣，喜其能识时，自污以免，因赠以诗
432650,国际桂冠诗人陈汉山自台北寓书附来海上诗简内录吾家兄弟佚诗二十多首故人契阔不通音问四十馀年矣喜感交集赋二律以报
414521,国际桂冠诗人陈汉山自台北寓书附来海上诗简内录吾家兄弟佚诗二十多首故人契阔不通音问四十馀年矣喜感交集赋二律以报 其一
522291,晚步中庭侍人褚氏问今三月半耶曰然笑曰京中日日思归今归来九月矣喜溢颜面予闻而欣然记以小诗
911572,春雨甲子而润泽不违时夏已更秋方虑乾涸一夕沛然优渥矣喜而写情
237534,舟过三游洞知遂脱兵火矣喜赋
427782,临江仙·民族音乐研究所杨荫浏所长寄赠《陕西的鼓乐社与铜器社》一册，从知唐宋旧曲尚在民间，谱字正与《白石道人歌曲》相同，沈埋六七百年之歌词法，殆将重显于世矣。喜拈小调，赋寄叶遐庵翁恭绰
414522,国际桂冠诗人陈汉山自台北寓书附来海上诗简内录吾家兄弟佚诗二十多首故人契阔不通音问四十馀年矣喜感交集赋二律以报 其二
1004015,去岁重阳日得彦威信附六月间二小侄及从弟侄所寄书自蜀阃递中附至历言去冬今春所遭兵祸及有司督迫科调之苦喜其存全哀其窘蹙洒涕如霰寄讯邀其下峡而边事又告急未知其达与否也会杪冬见邸报宣谕使者余公侍郎改命授钺尽护蜀师意欲以此事归控骨肉会聚兹事其谐矣喜极涕零遂成长篇
514927,得用光宗侄新安寄来书并禄命书一纸有劝予省人事谢应酬及早归之意时予得遣出城已三日矣喜而有作
509513,近得文儿书报数年间置有田若干亩予窃自念平生宦拙未尝有私积遗文惟南京常禄付文置产亦未必遽能得如此之多诚吾儿干蛊才优节缩日用所致也昌黎先生尝曰中世士大夫以官为家罢则无所于归吾今有所归志可遂矣喜甚赋诗美之且期望之
514025,过新馆铺宗老彦举邀宿其家别墅彦举尝从征湖南有义征图卷今老矣喜长生之说得其要领
748426,得以黄兄书知归有日矣喜而赋此
634215,予与陈梅臣别久矣喜得相见赠以诗时癸丑中秋也
243886,赠青城洞翁·人间久矣喜相倍
