178139,南静川野桃花下独酌因简同年冯中允
171232,简同年刁时中俊卿
191955,临桂尉杨渭夫以诗来因次其韵兼简同僚
1249105,游碧浪湖简同行沈高士
668639,阻冰潞河简同行黄太史才伯
1251198,闰五月二十七日发金陵简同舟者
549609,杂兴简同志 其九
693640,杂兴简同志
549602,杂兴简同志 其二
4141,泛曲阿后湖简同游诸公
191852,湖楼送客即事一首奉怀益之兼简同饯诸友
583380,过镇远次壁间韵兼简同年杨居敬郡守二首 其二
839395,重阳后与郭用宾王馨吾诸君小酌香山寺聊句未就后成二律简同游诸君 其一
1251042,夜饮简同席
355717,再用韵呈王臣兼简同社诸公
15124,酬严给事贺加五品兼简同制水部李郎中
1088554,甘泽应祈一苏焦槁皆昭远致政宣义丈及仲卿诸友昼夜精虔不出道场之力而昭远丈惠诗反以见属非所敢当辄依高韵和呈以见鄙怀并简同社诸兄友
1114593,景伯正字招东郊观梅晚集茶院秀远堂举之舍弟有诗景伯和章见简同赋
26581,简同志·开济由来变盛衰
863535,南静川野桃花下独酌因简同年冯中允
968455,简同行翁灵舒
743546,夜泊松江简同舟二客
575711,岁月徂迁未有归止寓迹江汉怀抱索然时维杪秋凄其絺绤偶有所述用简同志
263154,重阳后与郭用宾王馨吾诸君小酌香山寺聊句未就后成二律简同游诸君
1029842,中秋日简同盟诸公
194620,小至三诗呈景回制干并简同官
4185,自紫阳观至华阳洞宿侯尊师草堂简同游李延年
553991,戏贺俞行之纳宠兼简同舍谢郭二秀才发一笑粲 其三
553990,戏贺俞行之纳宠兼简同舍谢郭二秀才发一笑粲 其二
738891,将赴江左早发长清行二百里宿宁阳简同行阿广庭农部 其一
843564,重阳后与郭用宾王馨吾诸君小酌香山寺聊句未就后成二律简同游诸君
1158827,泛曲阿后湖简同游诸公
675054,春初饮亭上简同僚
648139,勉仁少傅行营置酒就席奉简同寅
839396,重阳后与郭用宾王馨吾诸君小酌香山寺聊句未就后成二律简同游诸君 其二
1168848,自紫阳观至华阳洞宿侯尊师草堂简同游
549601,杂兴简同志 其一
1092195,再用韵呈王臣兼简同社诸公
676066,游青萝岩简同行汪陈二知己
1078430,中冬教阅兵将运使徐显谟贶惠佳什降叹之馀因次其韵以答厚意且简同会诸公
554329,秘阁书事简同志
549608,杂兴简同志 其八
1045056,送张九掾兼简同事钱明府可与慎叔良蔡彦规同一笑也
234714,简同行翁灵舒
890559,小至三诗呈景回制干并简同官 其一
946217,湖楼送客即事一首奉怀益之兼简同饯诸友
558626,南坛斋宿简同宿韩推府驭民
491140,山房晓起简同游诸君
975397,将至浯溪简同行
738892,将赴江左早发长清行二百里宿宁阳简同行阿广庭农部 其二
996256,雪中连日行役戏书简同僚
685216,过镇远次壁间韵兼简同年杨居敬郡守二首
203786,简同年刁时中俊卿诗并序
1158984,灞东晚晴简同行薛弃朱训
549604,杂兴简同志 其四
879941,简同志
908583,景伯正字招东郊观梅晚集茶院秀远堂举之舍弟有诗景伯和章见简同赋 其一
890558,小至三诗呈景回制干并简同官 其二
517851,暮秋雨中简同侪
4176,灞东晚晴简同行薛弃朱训
198711,中秋日简同盟诸公
816194,将赴江左早发长清行二百里宿宁阳简同行阿广庭农部
124938,答连生见寄兼简同邑胡希元
1216112,至正庚寅孟春代祀北岳等神简同使刘学士
17386,答元八宗简同游曲江后明日见赠
333679,中冬教阅兵将运使徐显谟贶惠佳什降叹之馀因次其韵以答厚意且简同会诸公
561819,东阁阅庶吉士卷简同事诸先生
1189730,简同志
319695,夜泊松江简同舟二客
35715,自紫阳观至华阳洞宿侯尊师草堂简同游
549606,杂兴简同志 其六
1088423,和林择之黄云之句兼简同游诸兄
132919,将至浯溪简同行
1159942,酬严给事贺加五品兼简同制水部李郎中
908586,景伯正字招东郊观梅晚集茶院秀远堂举之舍弟有诗景伯和章见简同赋 其二
517828,癸夘正旦简同列诸公二十八韵
892921,答连生见寄兼简同邑胡希元
549610,杂兴简同志 其十
576497,初入书阁呈董宗文博士兼简同舍诸公
549607,杂兴简同志 其七
667916,生日有感简同馆汉东少泉二子
114074,雪中连日行役戏书简同僚
1157471,荅元八宗简同游曲江后明日见赠
553989,戏贺俞行之纳宠兼简同舍谢郭二秀才发一笑粲 其一
684682,戏贺俞行之纳宠兼简同舍谢郭二秀才发一笑粲
187702,简同志·竹韵因风来满盈
1251040,甲辰九日游兴国灵山寺简同游
946335,临桂尉杨渭夫以诗来因次其韵兼简同僚
782888,简同人
1112002,小至三诗呈景回制干并简同官
860224,简同年刁时中俊卿诗
583379,过镇远次壁间韵兼简同年杨居敬郡守二首 其一
384736,阻冰潞河简同行黄太史才伯
675354,九日游观音岩歌简同游诸君子
549605,杂兴简同志 其五
890560,小至三诗呈景回制干并简同官 其三
549603,杂兴简同志 其三
