452246,庚寅初夏同一得夫妇云生海楼云想容过镇江蒙多景楼诗社丁小玲于文清昆阳子无锋飞羽诸君子相陪游历当地名胜有作二首以志鸿爪 其二 西津渡
371013,琐窗寒·初夏同葑田松泉过深柳草堂
406013,观林务夏同志演贻顺哥
610060,初夏同汤中允嘉宾黄仪部贞父张民部孟奇刘民部元定米明府仲诏沈虞部季彪徐兵部鸣卿毕秘书孟侯邓兵部玄度蔡兵部敬夫李孝廉伯远刘孝廉百世集草桥赋诗效骆体
699311,初夏同江进之坐孙内使池台感赋
145167,初夏同赵东阁西里诸公山行闻莺分韵得隔字
1010105,初夏同赵东阁西里诸公山行闻莺分韵得隔字
669114,初夏同莫膳部过吴比部草堂论诗得中字
760105,送夏同甫还浙，兼讯汤蛰仙
898515,初夏同孝叔游普光寺
572863,初夏同惟学惟长舅尊游二圣禅林检藏有述 其二
807549,春夏两相期  初夏同友人东郊外访吴绳圃园居
898514,初夏同孝叔游朱氏园
593438,初夏同黎惟敬李于美张元易及舍弟经季集顾叔潜宅得桐字十二韵
918699,初夏同周同人与史尉登西园后山茅亭望远周君有赋依韵奉和兼呈少府
541576,初夏同雷健夫马子充游子德园
77228,初夏同桑甥世昌过邻家
172287,初夏同周同人与史尉登西园后山茅亭望远周君
572862,初夏同惟学惟长舅尊游二圣禅林检藏有述 其一
44749,观林务夏同志演贻顺哥
211201,初夏同孝叔游朱氏园
615678,仲夏同黄玉崙先生暨何龙友韩孟郁二丈游城北园池和黄韵
789837,首夏同青门雪航以宁允恭叔度宴集秋水阁即事限韵
85365,送夏同甫还浙兼讯汤蛰仙
404920,定风波·丙午长夏同仲林元玠儿子俊生外双溪亭子内啜茗。向夕始归
17388,首夏同诸校正游开元观因宿玩月
295585,初夏同家人游玉泉山
677036,别友夏同孟阳无敕亦因修之君长过林女郎天素月下听天素弹琴琵琶因索余诗走笔纪事
808252,琐窗寒  初夏同葑田松泉过深柳草堂
1250056,送崇德州夏同知
670162,初夏同元美汪伯阳皇甫子循集姚明府园亭得春字
807966,多丽  初夏同雪持南水放庵游南岳小憩枫隐寺
807795,沁园春  初夏同徐季重张邑翼朱致一叶九来家躬乙汎舟郭外追晤葛龙仙于攸闻上人精蓝兼送龙仙之西村别业
1157518,首夏同诸校正游开元观因宿玩月
632735,阅未央遗集有初夏同予入循州访刘乃运兄弟诗末云令威他日归华表定在循州古树边似为予今日谶也因和其韵
572865,初夏同惟学惟长舅尊游二圣禅林检藏有述 其四
830694,偕伯严云锦亭夜坐有怀梁节庵去夏同游
596153,初夏同黄益作从叔干周舍弟肇恩儿豫集梁仲登别馆得稠字
625223,初夏同韩犹龙入循州访刘乃运兄弟白隺峰峰为苏子瞻旧游地故人陈全人曾止此感赋
627413,季夏同姚讱庵晓白张敬庵严筑公黎传人汎舟南宗庵访昙大师刘羽士振枰试茗纵谈玄理归次逢禅上人以荔枝驰回饷客和讱庵作
801657,孟夏同沈公倚昆季暨家弟侄辈泛舟登斗姥阁宴集剧谈寓都门事带月而还集杜三十六韵
932011,初夏同桑甥世昌过邻家
572120,初夏同江进之坐孙内使池台感赋 其一
275840,洛阳春·寒日饮胜力寓斋，九来、电发、惟夏同用欧韵
473090,初夏同王应凤佘日章汪以仁以敬过佘子玉园居
572121,初夏同江进之坐孙内使池台感赋 其二
466724,庚寅初夏同一得夫妇云生海楼云想容过镇江蒙多景楼诗社丁小玲于文清昆阳子无锋飞羽诸君子相陪游历当地名胜有作二首以志鸿爪 招隐山
541594,季夏同家弟邀妙上人园游会大雨河涨
768465,洛阳春 其二 寒日饮胜力寓斋，九来、电发、惟夏同用欧韵
813365,洛阳春 寒日饮胜力寓斋，九来、电发、惟夏同用欧韵
572864,初夏同惟学惟长舅尊游二圣禅林检藏有述 其三
768464,洛阳春 其一 寒日饮胜力寓斋，九来、电发、惟夏同用欧韵
807894,贺新郎  南耕齿疾养疴南岳山房初夏同雪持南水放庵过访词以赠之
452245,庚寅初夏同一得夫妇云生海楼云想容过镇江蒙多景楼诗社丁小玲于文清昆阳子无锋飞羽诸君子相陪游历当地名胜有作二首以志鸿爪 其一 招隐山
211141,初夏同孝叔游普光寺
699433,初夏同惟学惟长舅尊游二圣禅林检藏有述
625008,季夏同庾筠倩姚讱庵泛舟南宗庵访昙大师刘羽士振枰试茗纵谈玄理归次逢禅上人以荔枝驰回饷客和讱庵作
