333622,惠州访东坡旧隐
441963,再访东山调杜非
431505,访东坡故居二首
453842,偕谷风青凤访东坡舣舟亭
1043951,再访东坡用前韵
463936,溧阳村行访东野遗迹 其二
750449,古藤花馆访东坡僦居故址
547829,寄吴少溪宫录七十 其二十五 九月七日南昌太守王君华冈过访东郭小园有诗见遗酬赠
663551,宋驸马园亭访东石谈子遇雨
378211,古藤花馆访东坡僦居故址
975293,访东坡题高风堂屏间
826825,洞仙歌·归舟访东涧老人墓，河东君葬其侧。嘉庆庚午陈云伯大令所树小碣尚存
344239,密庵访东明和尚已径山退院庵有小山可远眺
613994,过虔州访东溟上人不值闻寓潭江赋此寄赠
383723,九月七日南昌太守王君华冈过访东郭小园有诗见遗酬赠
740410,访东涧僧不遇
206336,春日韵·偶访东瓯谢守家
268763,清明偕晓因随侍外舅访东四明
627977,张超然蓝公漪将归八闽维舟合江同余访卫立组广文阻雨留饮斋中霁后登白鹤峰访东坡故居
312449,买陂塘·葵卯冬访东山母校
286435,闻石东溪昆季远辱过访东溪疾作而返赋此志谢
282167,洞仙歌·归舟访东涧老人墓
829098,清明偕晓因随侍外舅访东四明二首
710911,陈晚卿过访东溪草堂 其二
133308,访东坡题高风堂屏间
301751,访东坡故居
428416,访东坡故居二首 其二
428415,访东坡故居二首 其一
595809,酬方山人访东山旧隐见寄
784328,闻石东溪昆季远辱过访东溪疾作而返赋此志谢
760477,白鹤峰访东坡故居
320926,再访东坡用前韵
721188,陈晚卿过访东溪草堂
1078112,惠州访东坡旧隐
466911,溧阳村行访东野遗迹
445940,重访东坡书院四壁多权贵题“诗”
637049,次陈心之陈比之二居士过访东皋韵
1217301,访东寺不在
218851,过黄州访东坡雪堂遗迹拟作
710910,陈晚卿过访东溪草堂 其一
827842,清明偕晓因随侍外舅访东四明二首 其二
191066,再和·忆访东坡旧婚居
417211,买陂塘  葵卯冬访东山母校
565874,访东丘上人不遇一首
947461,过黄州访东坡雪堂遗迹拟作
1242506,上巳日，杭州府学教授徐一夔、四斋训导拉游智果寺，访东坡，题参寥泉
447448,渡黄河访东平县程咬金祠堂
463935,溧阳村行访东野遗迹 其一
827841,清明偕晓因随侍外舅访东四明二首 其一
