828418,苕雪治芗作诸葛武侯诗余有感于当时人才之乏亦拟一首
491396,送邢秀才之南海
388155,月夜明卿见过迟子相不至适陆秀才之裘来小饮分韵
1226166,送江西熊履善茂才之金陵
36746,送沈秀才之闽中
103367,送薰传秀才之汝阴
538326,月夜陆秀才之裘吴山人扩见访分韵得看字
1020768,送蔡秀才之漳浦
1163334,送徐秀才之吴
652773,枫桥歌送吴秀才之金陵
1147187,送潘秀才之舒州
304411,苕雪治芗作诸葛武侯诗余有感于当时人才之乏亦拟
37838,送徐秀才之吴
211264,送林六秀才之广劝其早归
893611,送庐陵王月窗秀才之武昌谒秋壑贾侍郎
375446,念奴娇·生才之地
52861,送殷秀才之武功
1213181,王仲通宰公自东吴别去十载甲寅秋会于鄂渚乃知尚在七品常调中使人有郁郁遗才之叹谈论平生相对如梦历数海内诸友离合升沉之状悲欢良久有不能自已者既而仲通有欲为道隐求奉一祠之语诘难未能服俄为借骑下淮复归行馆翌日缀诗二章奉呈兼简钦甫佥司士元使君君平察推 其一
34855,送相里秀才之匡山国子监
335698,几山出示阳桥唱和诸什窃慨英才之沈寂光景之流迈因两次其韵皆以少日为篇
64820,送金秀才之温陵
1147156,送沈秀才之闽中
22570,送吴秀才之山西
641136,送陈秀才之京
165435,送北京学生曹慈明秀才之京师
10806,送张秀才之长沙
537521,月夜明卿见过迟子相不至适陆秀才之裘来小饮分韵 其二
470093,八月朔日王元直招集南楼送陈汝翱之东粤王玉生之清漳沈从先还姑苏徐兴公之建溪陈惟秦之聊城蒋之才之广陵余返白下
1086092,仲冬释奠于学同诸公登稽古阁观弁山望太湖阅壁上题名诵范文正公吴兴先生富道德诜诜弟子皆贤才之句
958679,送林六秀才之广劝其早归
229784,送周湜秀才之武川谒黄员外
683286,月夜明卿见过迟子相不至适陆秀才之裘来小饮分韵
537520,月夜明卿见过迟子相不至适陆秀才之裘来小饮分韵 其一
1161269,送张秀才之长沙
952976,送牛秀才之山阳省兄
1060124,几山出示阳桥唱和诸什窃慨英才之沈寂光景之流迈因两次其韵皆以少日为篇首一以赠监镇孙和仲一以赠知丞苗几山云 其二
1060123,几山出示阳桥唱和诸什窃慨英才之沈寂光景之流迈因两次其韵皆以少日为篇首一以赠监镇孙和仲一以赠知丞苗几山云 其一
231561,送蔡秀才之漳浦
917273,点绛唇 其二 送别洪才之
679837,赋得沧浪矶送程秀才之春官
1226245,送朱伯贤茂才之金陵
103377,送张秀才之淮南
1120418,几山出示阳桥唱和诸什窃慨英才之沈寂光景之流迈因两次其韵皆以少日为篇首一以赠监镇孙和仲一以赠知丞苗几山云
36852,送潘秀才之舒州
1161483,送吴秀才之山西
491679,题赋金银山送萧茂才之遂江并柬周用性
979550,送北京学生曹慈明秀才之京师
970672,送周湜秀才之武川谒黄员外
991441,送董传秀才之汝阴
217304,送牛秀才之山阳省兄
1237213,王仲通宰公自东吴别去十载甲寅秋会于鄂渚乃知尚在七品常调中使人有郁郁遗才之叹谈论平生相对如梦历数海内诸友离合升沉之状悲欢良久有不能自已者既而仲通有欲为道隐求奉一祠之语诘难未能服俄为借骑下淮复归行馆翌日缀诗二章奉呈兼简钦甫佥司士元使君君平察推
1213182,王仲通宰公自东吴别去十载甲寅秋会于鄂渚乃知尚在七品常调中使人有郁郁遗才之叹谈论平生相对如梦历数海内诸友离合升沉之状悲欢良久有不能自已者既而仲通有欲为道隐求奉一祠之语诘难未能服俄为借骑下淮复归行馆翌日缀诗二章奉呈兼简钦甫佥司士元使君君平察推 其二
482738,送金秀才之温陵
1049890,送刘继邺秀才之岳阳访木尉
502132,送吴彦才之京
1167606,送相里秀才之匡山国子监
1242068,送薛应翔人才之京名让
482650,送殷秀才之武功
991364,送张秀才之淮南
223094,送庐陵王月窗秀才之武昌谒秋壑贾侍郎
