763583,满江红 其九 乙巳午日宋既庭见招泛蒲同陆处实姜西溟
592158,雪夜同陆山人过张司理时张已补外陆将还山
701213,同陆周明四兄游双清亭承惠诗扇依韵答之
1161669,同陆太祝鸿渐崔法曹载华见萧侍御留后说得卫抚州报推事使张侍御却回前刺史戴员外无事喜而有作三首 其三
677035,三月十三夜同陆大无界待月虎丘得殿字
362483,丁未冬同陆昭中渡江泊秦淮税亭之侧癸丑三月
36702,寒食日同陆处士行报德寺宿解公房
426721,同陆持伦晓行话别
1233155,同陆书隐范君平和伯长客中端午韵
594489,中元夜钟给事道复招同陆文学伯生李孝廉季宣雨花台玩月得香字
593096,十四夜同陆华父登方清臣问月台
594362,重阳前一日同陆来何吴魏胡黄郭范诸曹长阅留都城还上天坛眺望
270210,同陆持伦晓行话别
732354,春夜同陆不淄尤时纯子邱兄赋新月
1147210,寒食日同陆处士行报德寺宿解公房
472728,石湖小天台同陆生施生兄弟
616886,同陆周明四兄游双清亭承惠诗扇依韵答之 其一
593372,伏日同陆华甫李惟寅李于美胡茂承朱汝修避暑普安寺得云字
589611,同陆月岩游十里庄喜太监寺
473867,灯夕同陆姬过胡姬并怀侯双
593183,同陆华父邵长孺集何少愚侍御日宜园
598954,九日同陆明府刘挥使叶春元江中共酌
550897,同陆纂父山人杨山甫保御集程康伯典客衙斋看芍药
648028,咏水镜同陆伯阳作
731971,初度同陆中黄登城话怀
538124,同陆象孙咏玉兰
303163,三月九日复同陆先生及子侄泛湖至后州买樱桃
550785,同陆纂父郭圣仆雨夜集曹重甫客舍得凉字
616887,同陆周明四兄游双清亭承惠诗扇依韵答之 其二
1161668,同陆太祝鸿渐崔法曹载华见萧侍御留后说得卫抚州报推事使张侍御却回前刺史戴员外无事喜而有作三首 其二
66841,同陆明府过阳山访漳河岳山人
1081523,丁未冬同陆昭中渡江泊秦淮税亭之侧癸丑三月自建康移守南昌登舟顾览即昔年系缆之所也时昭中亡矣感叹存没作诗寄黄冈亲旧
283736,初度同陆中黄登城话怀
592592,雪中同陆山人渡杨子江
1161667,同陆太祝鸿渐崔法曹载华见萧侍御留后说得卫抚州报推事使张侍御却回前刺史戴员外无事喜而有作三首 其一
593099,杪秋同陆华父登青罗山顶望罗浮
593169,吴仲实携酒同陆华父吴仲足方献成吴虎臣方元素汪仲嘉泛新安江得飞字
726352,同陆廷尉惊早蝉诗
507623,太庙孟秋时享同陆员外斋宿
593092,九日同陆华父张仲实蒋子瑞黄元先龟山游宴得花字
408436,三月九日复同陆先生及子侄泛湖至后州买樱桃
550896,同陆纂父暮酌程康伯花下得枝字
543953,过王氏小隐同陆山人周上舍閤中小集
593132,雪中同陆华甫泛舟章江忆曾与华甫自广陵冒雪渡扬子过白下
593093,重阳后一日同陆张蒋三子集黄元光宅
1135906,用康庆之韵约同陆仁重游问政山
1194162,同陆太祝鸿渐崔法曹载华见萧侍御留后说得卫抚州报推事使张侍御却回前刺史戴员外无事喜而有作三首
807949,春风袅娜  正月十二日同陆翼王宋既庭吴志伊庆百徐大文叶九来道子李秋森游白塔旃檀诸寺
593070,除夕同陆华甫守岁
594314,方子及李于田邀陪吴明卿同陆无从方仲美集天界寺属骤雨过得山字
473243,同陆明府过阳山访漳河岳山人
593084,七夕沈纯甫邀集禺山园同陆华父黎惟仁黄公补公绍分得台字
331895,满江红·乙巳午日宋既庭见招泛蒲同陆处实姜西溟
593088,秋日同陆华父黄元光泛海登佛教台
51441,石湖小天台同陆生施生兄弟
107510,用康庆之韵约同陆仁重游问政山
62935,灯夕同陆姬过胡姬并怀侯双
569448,月夜小阁同陆公与绳宿奉呈一首
