783332,癸亥五月二十后酷热异常死者万计六月五日恭遇皇上省躬求言是夜北风大作继以膏雨沴戾顿除仰见圣主至诚格天捷于影响赋此纪异且私幸其安全也
1005822,过字韵诗辱诸友联和方营度枯鄙以酬厚意偶报北兵自瓯闽回驱男女牛羊万计入蛟湖深畯出独山屯尚义由童公岭以北三日夜不休闻之惊心遂成阁笔是月十四夜对月感涕遂即前韵以纪时事奉呈诸友
1224689,泰定丁卯八月十二日崇天门传胪赐进士右榜第一人阿察赤左榜第一人李黼皆肄业国学日新斋余西厅授业生也是日京尹备鼓乐旗帜麾盖甚都导二状元入学谢师拜余明伦堂榜眼刘思诚探花郎徐容尝因同年黄晋卿彭幼元从予游亦拜其侧其馀进士以门生礼来拜谢杂遝不记姓名圜桥门而观者万计都人以为斯文盛事昔未有也同寅举酒相属偶成四绝以纪其事 其一
1236595,泰定丁卯八月十二日崇天门传胪赐进士右榜第一人阿察赤左榜第一人李黼皆肄业国学日新斋余西厅授业生也是日京尹备鼓乐旗帜麾盖甚都导二状元入学谢师拜余明伦堂榜眼刘思诚探花郎徐容尝因同年黄晋卿彭幼元从予游亦拜其侧其馀进士以门生礼来拜谢杂遝不记姓名圜桥门而观者万计都人以为斯文盛事昔未有也同寅举酒相属偶成四绝以纪其事
1224690,泰定丁卯八月十二日崇天门传胪赐进士右榜第一人阿察赤左榜第一人李黼皆肄业国学日新斋余西厅授业生也是日京尹备鼓乐旗帜麾盖甚都导二状元入学谢师拜余明伦堂榜眼刘思诚探花郎徐容尝因同年黄晋卿彭幼元从予游亦拜其侧其馀进士以门生礼来拜谢杂遝不记姓名圜桥门而观者万计都人以为斯文盛事昔未有也同寅举酒相属偶成四绝以纪其事 其二
445202,谷雨江右诗社周年萍乡小石源雅集 其六 雨中凭吊盛公祠传为矿难工人造棺处百馀年何止万计
