821092,蕙兰芳引 霜降日暄㬉而夜气侵人，作此以遣客思。和清真秋怀韵一首
567841,钮给事中花园藏陈山人所画水仙花次王子韵一首而陈文学示我五首故我亦如数 其三
1072877,杨文发将趍行朝辄用所惠诗次韵一首赠别
877843,傅谏议和予所赠傅监仓诗复用前韵一首
1100085,和山中后社韵一首
1057321,子瞻辞免起居之命令铄复用前韵一首以勉之
666978,得董蕨冈白沙村晚酌诗时迟诸公不至次韵一首
498544,子荆复倒压前韵一首亦复和之即以奉赠并呈端己韬仲子山诸叔及孝仪兄
698958,钮给事中花园藏陈山人所画水仙花次王子韵一首而陈文学示我五首故我亦如数
1072260,维心以仆假守毗陵与嘉禾南徐弟侄分符接壤作诗见贻次韵一首
149444,又依韵一首·看去朱轓今已归
574461,得莫如山浦文玉和章复用韵一首禁体物语
1099681,四月二十日得雨方足闻城间一祷即应沾渥久矣此馀波所及也再用前韵一首寄呈恕斋
988084,再次韵一首
876091,七月二十日自瀑上先归方寺丞遣诗夸雷雨之壮次韵一首
974132,季萧兄三贶诗且辱出示陵阳墨帖敢次韵一首为谢
514806,与士钦尚宝俱官满六载次韵一首
478547,暮投承天习静房与老僧夜酌复和清虚堂韵一首
1182678,酬韶州裴曹长使君寄道州吕八大使以见示二十韵一首
876403,永嘉曹君赠诗次韵一首
324234,杨文发将趍行朝辄用所惠诗次韵一首赠别
565010,宿礼部借韵一首
911231,湛庵出示宪使陈益之近作且蒙记忆再次韵一首适王令君国正携酒相过断章并识之有便仍以寄陈也
889817,张仁溥寄游沧浪诗用韵一首非为沧浪作也
659961,再和罗峰先生宸韵一首
1249722,腊月二日偕俞宽仲过筱泾僧舍蒙举似近诗次韵一首
681295,地震斋居国贤侍郎以诗来自通州次韵一首
1072909,刘大虚作十花词相示复以诗来有求挥斤之句兼简中问仆无恙吠犬不为灾次韵一首奉酬
878581,樗庵次前韵一首
427877,浣溪沙 吴藕庼寄示送别赖树翁之作，次韵一首，兼呈树翁
513752,望琅琊诸山不及游典术魏延追及诵吾同年庄孔阳司副四十年来方一到之句不觉笑曰孔阳谢病居江浦去滁不百里而近尚半世一至况碌碌我辈乎马上次韵一首以示延便中寄声孔阳未必不为之抚掌也
581524,何时矩作振蒙论并诗一章示余因次其韵一首及作古诗一章复其意
1052376,次仪父春日草韵一首
674641,华泉司徒丧妾浚川司马以诗悼之和韵一首
655072,五月十一日王世赏侍讲西园晚酌即席限韵一首
877799,曹路分赠诗次韵一首
878190,志仁监簿示五言十五韵夸徐潭之胜次韵一首
1099699,乐轩远日之祀岩尹方兄赋以七言用韵一首
1075907,太一宫成奏告礼毕秦枢密有诗示秘阁次韵一首三绝 其四
1075904,太一宫成奏告礼毕秦枢密有诗示秘阁次韵一首三绝 其一
1100070,东涧以且静坐三字赠莆阳郭堂长阳岩谓莫作禅会名言也用韵一首
1071772,久雨溪涨寿朋惠示长句次韵一首
574495,舜弼去张提学汝立至复用韵一首
567843,钮给事中花园藏陈山人所画水仙花次王子韵一首而陈文学示我五首故我亦如数 其五
580209,弘治庚戌岁十月十日公事稍暇奉邀大参德馨内翰世赏过行台小酌遂相与联句仍用内翰韵得二首别赓韵一首 其一
878612,警斋侍郎舟和放翁五言过奖衰朽且示雄文二编次韵一首
698242,弘治纪元戊申二月十三日侍从亲耕藉田用程学士韵一首怀不能已复缀短韵一章
430387,明村出示回风师旧作，次韵一首
1067498,余尝会李商老于海昏识吕居仁于符离今已五六年矣偶见二公倡和诗各次其韵一首 寄居仁
859042,读眉山集爱其雪诗能用韵复次韵一首
590588,甲辰承乏来浏重脩欧阳圭斋先生南山书院次先生韵一首
515011,与王宣溪世赏同至虎丘醉中限韵一首
876168,又追和坡韵一首
877862,曾景建自临川送予至丰城示诗为别次韵一首
514013,新安旧有二程先生祠荷侍御提学娄公克让许修复之偶于婺源陈简教谕处得克让往年过博野祠下之作因借韵一首奉寄
655110,二十九日夜祀以病不预枕上用韵一首
807211,愁春未醒  竹逸招同云臣、南耕雨中看梅，余舟中既作离亭燕一词纪事，归见云臣、南耕、竹逸词，复次韵一首
492175,次韵一首奉寄孟浩彦弘二友
855037,郑君瑞示同诸公游定空佳什仆亦久欲与君瑞寻春衰病方窘风雨以故未果聊次韵一首
1075906,太一宫成奏告礼毕秦枢密有诗示秘阁次韵一首三绝 其三
567842,钮给事中花园藏陈山人所画水仙花次王子韵一首而陈文学示我五首故我亦如数 其四
580211,弘治庚戌岁十月十日公事稍暇奉邀大参德馨内翰世赏过行台小酌遂相与联句仍用内翰韵得二首别赓韵一首 其三
567839,钮给事中花园藏陈山人所画水仙花次王子韵一首而陈文学示我五首故我亦如数 其一
654975,玉泉限韵一首
1100021,至日再和磨字韵一首
583774,鼓山限韵一首
863180,得丁执中书和前韵依用韵一首
514877,待柽居杜生不至用旧韵一首
1249681,兵后到杭马掾史置酒见招且示所与石处道丘长卿西湖倡和之什次韵一首
1251851,八月三日与刘道益连床夜话风雨凄然五日开霁道益赋诗见贻次韵一首
667136,吟会次秦封君倡韵一首
584656,辛亥夏四月己卯与李璧山游桥山因览首丘璧翁有作次韵一首
1162163,西川独孤侍御见寄七言四韵一首为郡翰墨都捐逮此詶答诚乖拙速
529361,少宰学士温托斋赴召成都邵守作三诗送之予览其辞甚丽和韵一首
1070083,与江仲嘉褒赵叔问子昼潘杲卿杲分题赋诗以颜鲁公裴晋公贺监陈希夷画像为题以我思古人为韵余得裴晋公我字韵一首
999208,二月二十一日何司业集客于张园玉牒给事命予赋诗紫微舍人左史舍人亦以见委因成七言十韵一首
1075905,太一宫成奏告礼毕秦枢密有诗示秘阁次韵一首三绝 其二
860350,长风沙次宋丈韵一首
564992,廿五日复会于宣城第用张白滩韵一首奉赠地主
86292,又追和坡韵一首
655203,昨者候问尝以不作诗奉戒归途欲联数语驰上未果也明日使来复辱和章岂谬言不足信耶抑兴到落笔自不为劳耳辄复借韵一首以终致鄙意
220527,张仁溥寄游沧浪诗用韵一首非为沧浪作也
1099994,和王此山午寄虹字韵一首
1099694,谢刘正奏惠文戏效昌黎体仍用送贾浪仙韵一首
878613,警斋侍郎和放翁与茶山五言寄余次韵一首
783325,前题又步原韵一首
876393,四和林卿槟榔韵一首
608031,舟久行思登陆促句换韵一首
878315,安溪黄明府得子次徐常丞韵一首
427932,鹧鸪天 兆芬新制有击节声中玉漏迟之句，感不绝于予心，次韵一首
1116450,耕堂弟雪中效宛陵仄字平字诗各次韵一首
1033508,李深道得苏养直所为深字韵一首不知题何处景俾跋其后
580084,复次前韵一首
533697,顷以俚述投大司马白石蔡公猥承见答次韵一首
571254,风风宿弥陀寺有怀双州大守偶颂桂洲公壁问隹制适相感发用韵一首
387058,闻贞夫将登华岳次韵一首寄上
583143,吾仲兄游太学东归舟过金陵余时奉命南畿得侍颜色适潘武选孔修过余作倡次韵一首
1066516,寄友卿窄韵一首
980123,又依韵一首
514193,阎方伯为予言藩省门对吴山有白鹭群飞朝去暮来日以为常因识以诗且将绘图以传遂次韵一首
558988,九月十五日任公祖登凤凰台次李韵一首时公次日初度
673443,再会用宋人韵一首
876994,林卿见访食槟榔而醉明日示诗次韵一首
925307,程帅父朝议年八十馀诸人作诗褒咏次韵一首
821275,采桑子 静霞自杭州寄讯，和其月夜六和塔下韵一首
1120688,太一宫成奏告礼毕秦枢密有诗示秘阁次韵一首三绝 其二
1072489,魏彦成寄示桐川琅琊送行诗集奉次柳字韵一首系于卷末
654973,游玉泉洞限韵一首
588388,李三洲同岱麓携酒见访用韵一首
1002250,春至无梅追用前韵一首
1070280,神霄宫知宫陈应常邀乡人集道堂余不果往毛彦时有诗诸公皆和见率同作次韵一首
990397,章泉赵昌父频数寄诗再次韵一首
999304,侍御王公去饶饶之士民数千万人遮道攀辕又相与断城北桥以留之公不得已乃回城从间道遁去馀干主簿翁君画断桥图作诗二十韵寄侍御求和侍御以和篇见示因次韵一首
919632,十月二十八日迁入赵氏借屋适有名酒及延致内黄侯约兄弟共醉颍季有诗次韵一首
567840,钮给事中花园藏陈山人所画水仙花次王子韵一首而陈文学示我五首故我亦如数 其二
688356,弘治庚戌岁十月十日公事稍暇奉邀大参德馨内翰世赏过行台小酌遂相与联句仍用内翰韵得二首别赓韵一首
480021,弘治纪元戊申二月十三日侍从亲耕藉田用程学士韵一首怀不能已复缀短韵一章 其一
1235412,彭琦初用坡翁纸帐韵惠建昌纸衾次韵一首为谢
588692,仲夏酿荔枝酒成与欧麦二友同酌次韵一首因麦有及于天宝故事因及之
876683,自用台字韵一首
471072,辛巳三月廿四日未至桐庐廿里老钱在官舫扬帆顺流东下余唤小渔艇绝流从之同宿新店示黄山新诗且闻曾至余家有题璧诗次韵一首
513835,秦廷韶太守及九龙山樵陆懋成请游惠山遂酌第二泉饮听松庵次少师姚广孝留题旧韵一首
877026,顷净慈伦老将示寂以其师无准塔铭见属后三年竹溪中书君以诗速铭次韵一首
480022,弘治纪元戊申二月十三日侍从亲耕藉田用程学士韵一首怀不能已复缀短韵一章 其二
655071,戚畹雪亭孙挥使祖茔八景其一曰鹤唳长松求题限韵一首
580210,弘治庚戌岁十月十日公事稍暇奉邀大参德馨内翰世赏过行台小酌遂相与联句仍用内翰韵得二首别赓韵一首 其二
447839,感启宇先生南海不买珠，口号次韵一首
541043,戊寅新正四日雪中用唐韵一首
920006,耕堂弟雪中效宛陵仄字平字诗各次韵一首 其二
1094111,世昌携项平甫所和诗来叹其已逝次韵一首
565134,汤君朝仪以菊一本见惠色甚佳用韵一首为谢
513852,忆在姑苏与顾天钖郎中语次亦有亡弟之感惨然对泣不能自胜因追次其韵一首
999283,何茂宏茂恭携酒见过复侑以诗次韵一首
654974,登功德寺新阁限韵一首
860443,再用前韵一首
581523,何时矩作振蒙论并诗一章示余因次其韵一首及作古诗一章复其意
1070187,同叔问诸人以橘栗柿蔗为题以东南之美为韵余得橘美字韵一首
660465,和罗峰郊坛韵一首
860362,再游用前韵一首
564952,因送胡子颇动归思借韵一首
480587,读柳拱之员外严宗哲主事杨应宁舍人倡和长句戏次韵一首
876993,林卿劝开酒禁次韵一首
515255,限韵一首
876134,又次居厚韵一首
655114,显灵陈真人邀赏静观亭芍药至则仅馀白者三数朵殊觉败兴乃诿之昨来风雨之厄或者未然乎即席次王世赏太史韵一首
675097,闻贞夫将登华岳次韵一首寄上
1228721,彭琦初用坡翁纸帐韵惠建昌纸衾次韵一首为谢 其一
1067497,余尝会李商老于海昏识吕居仁于符离今已五六年矣偶见二公倡和诗各次其韵一首 寄商老
876803,来至桂州叶潜仲以诗相迎次韵一首
674376,连雨中因读少陵大雨诗次韵一首
566261,赋苕溪草堂和孙太初韵一首
571115,小圃对花有怀楚蒙用韵一首
633975,陈牧芷孝廉游白岳归后掩关读藏经弥年欲有下询先以折柬并赠丁南羽佛相一轴佳韵一首率笔奉答
660462,奉旨免朝和邃翁老先生韵一首
1212419,和光祖诗韵一首
869461,别韵一首
535578,和与新见赠韵一首
531330,沐希甫叶道亨约会于太华寺雨中用杜少陵韵一首
860458,昌国秩满次陈纠祖行韵一首
876662,竹溪以余得第七孙惠诗次韵一首
1251828,九日过彦行用韵一首
948663,李子权屡求所居江月亭浴沂斋诗老病未能作坐上示及和花妃诗甚工即席次韵一首所谓一彩两赛也
514517,饮王世赏侍讲园亭限韵一首
147431,李深道得苏养直所为深字韵一首不知题何处景
681168,再次赏菊韵一首赠四叔父
1228722,彭琦初用坡翁纸帐韵惠建昌纸衾次韵一首为谢 其二
669250,次徐时亨赠行韵一首
588323,七日饮伦右溪宅用社韵一首
565032,仆衰年病体复来都下情兴可知再用韵一首并呈凤峰一笑
876728,初宿囊山和方云台韵一首
920005,耕堂弟雪中效宛陵仄字平字诗各次韵一首 其一
877661,秘书弟牵玉羔为寿将以唐律次韵一首
513854,予谒告还朝道出淮阴方传漕运总戎平江伯过访而侍御尹君性之奉命巡贵州舣船之际得邂逅焉性之出示阁老寿光刘先生赠行之作谨步韵一首奉别而蒹葭倚玉之诮所不能免云
654976,西湖限韵一首
876972,居厚弟诗将活鹿寿余次韵一首
654972,游西山圆静寺皛庵限韵一首
492284,舟中与叶尧有丘弘道同载和韵一首
