458154,十一月八夜梦见先父，予问曰：“这几天你到哪里去了？”语未及终，即蹲身咽泣，不复能声。恍然中似觉先父渐近予前，然予闭目，未尝见其面目举止，但觉如是耳。既醒，犹闻唇吻间喃喃自语曰：“你不在家，怎么吃饭的？”倚枕更忆，梦中语时，尝略犹疑，不知当谓“几天”抑“几年”；实则先父弃世，行将廿年矣。越三二日，中夜复醒，乃为赋此
358578,梦立求轩名以其面莲池十许顷名之曰妙喜轩
573590,余尝游牛首从麓至巅幽胜应接不暇最后山僧引至一小山回观山面更觌全体因悟山内看山不如山外看山之旷窃持此法以搜洞胜乃择小阜筑室回向之一洞所有无不环列至瀑布在洞之上者两崖夹束翳以林霭一道水光隐约吞吐折而八洞始彰喷薄之全势而洞上之源游者向未之睹也推窗入目不觉大叫奇绝以为得未曾有譬诸西子之美不能自见其面对镜乃见之耳用前咏珠璧韵
1059626,梦立求轩名以其面莲池十许顷名之曰妙喜轩
443156,品令 于法兄新婚在即届时必有谐谑之礼恐其面嫩讷言因檃括其语代制小词聊充俳优
908480,晚步江浒有得鼋大如箕赎放之邻叟言此家前数日已尝得一煮之通夕旦发盎视之鼋忽引首以水喷其面兹亦可惊异者作是诗以为好杀者之戒
138948,机简堂余里人也在方外三十年未识其面乾道己
417639,满江红 已丑春少卿老师命余赴梅兰芳思南路寓所约临票社活动，余观梅剧多矣，而亲晤其面则初次也
889489,机简堂余里人也在方外三十年未识其面乾道己丑余帅豫章乃自圆通来谒与之款语连日忘疲不谓末法中有此龙象且喜余里之有人因其归作诗以送之
89256,题研六言·其面固已晬然
