533873,方奉常李明府招同徐方伯欧博士集广惠寺
615802,同樊孟泰工部吴尔达进士集韩寅仲明府寓分得朝字
741534,同程鱼门舍人曹习庵宋小岩两编修吴白华姚姬传两吉士集王梦楼侍讲斋中分端得观字
347054,题明崇祯刊本宋学士集
770556,题明崇祯刊本宋学士集
892591,秋日与天章侍讲王原叔曾明仲正言余安道三学士集普光院
593934,冬夜同李比部黎司勋黄李二进士集金舍人宅和得比部二韵 其一
695719,冬夜同李比部黎司勋黄李二进士集金舍人宅和得比部二韵
593215,同许光禄王进士集余太史伯祥宅
277296,九月十七日雨中东京诸名士集樱邱南画院祀王右丞观礼有作
493375,题松竹居士集
593682,初秋雨中同黎惟敬秘书刘仲修观察李袭美明府蒋少翼吴仲周滕晋生李惟仕朱汝修陈从训六徵士集李临淮惟寅宅得卮字
825678,松月居士集印编书后
5847,答史馆张学士段柳庶子学士集贤院看花见寄兼呈柳学士
533884,七夕同丁计部蔡刑部欧博士集沈刑部宅观沈石田山水得秋字
1150311,秋暮与诸文士集宿姚端公所居
533953,唐别驾惟良招同康山人蒋进士集郡斋
1152790,答史馆张学士段柳庶子学士集贤院看花见寄兼呈柳学士
593935,冬夜同李比部黎司勋黄李二进士集金舍人宅和得比部二韵 其二
277337,庚午上巳旧都诸名士集水榭禊饮分韵赋诗释戡纕蘅先后书来要余同作率然应之得汎字
610115,七夕后一日同黄周士集刘觐国旅馆
36506,秋暮与诸文士集宿姚端公所居
