673028,次韵朱教谕题邑庠讲堂 其二
272749,秀峰书院讲堂联
983366,衢学讲堂更名时习和贰车韵五首 其二
983367,衢学讲堂更名时习和贰车韵五首 其一
91704,初夏清晓赴东宫讲堂行经和宁门外卖花市
1251343,讲堂前种竹旧极盛茂近为?蝗所食顿见枯落斐然君子无所托兴复有可类者甚可悼焉
913563,雪中讲堂赐酒二首 其一
914703,晓经八盘岭赴东宫讲堂
93896,晓经八盘岭赴东宫讲堂
1085873,二月朔日诣学讲堂前杏花正开呈教授
541247,庞子讲堂与赵太史诸公夜谈
170304,儒家秋·讲堂寂寂夜鸣蛩
537,文翁讲堂
881019,和陈大庾新建邑庠讲堂
983364,衢学讲堂更名时习和贰车韵五首 其四
196635,陈子新前后十年叶赞府寮修明学政讲堂成以诗
1251339,讲堂前右植石榴左植脩竹是年蝗灾竹为所食石榴味苦感而有作
667282,邵文庄公惠山讲堂废址
1115586,雪中讲堂赐酒二首
94869,雪中讲堂赐酒
913562,雪中讲堂赐酒二首 其二
887022,生公讲堂
1060398,慧聚杂题 灵山讲堂
838947,甲寅闰五月七日偕沈琛笙、徐蕴山赴菽庄诗社；夜发芗江，晓至江东桥趋谒黄石斋先生讲堂 其二
914280,初夏清晓赴东宫讲堂行经和宁门外卖花市
14675,曲讲堂
1078059,自学校之制废而戎马之患兴州县长民者不复以教育为意独容南鼎新郡庠招徕生徒弦诵之声不辍诚可嘉叹所建讲堂为名之曰育材辄成五言十韵
1022239,讲堂书事
843675,甲寅闰五月七日偕沈琛笙、徐蕴山赴菽庄诗社；夜发芗江，晓至江东桥趋谒黄石斋先生讲堂
976757,陈子新前后十年叶赞府寮修明学政讲堂成以诗美之
983363,衢学讲堂更名时习和贰车韵五首 其五
15272,生公讲堂
694210,次韵朱教谕题邑庠讲堂
1073649,讲堂
1125484,衢学讲堂更名时习和贰车韵五首
221443,和陈大庾新建邑庠讲堂
189572,衢学讲堂更名时心和贰车韵车韵
676798,过内黄宿圆上人讲堂兼呈张沅洲太守
983365,衢学讲堂更名时习和贰车韵五首 其三
917048,生公讲堂
673029,次韵朱教谕题邑庠讲堂 其三
656322,至日讲堂朝贺
1251573,讲堂雨中看新竹
616930,又寻朱考亭张南轩二先生讲堂拜其遗趾
1154142,文翁讲堂
194470,生公讲堂·海上名山即虎丘
177190,雪江讲堂·索居占得藕花风
204144,讲堂书事·早玩台衡宗
1007358,雪江讲堂
6258,文公讲堂
1159507,金陵五题 其四 生公讲堂
1164859,文公讲堂
673027,次韵朱教谕题邑庠讲堂 其一
1220078,韩伯皋佥事移湖学讲堂时倪仲深作教韩为作堂记予因赋此诗
617393,过光孝寺若惺禅室讲堂分赋
593459,东讲堂对雪戏答熊可行
1182748,巽公院五咏 曲讲堂
838946,甲寅闰五月七日偕沈琛笙、徐蕴山赴菽庄诗社；夜发芗江，晓至江东桥趋谒黄石斋先生讲堂 其一
