592136,春日同惟敬约卿过弘法寺访翠岩和尚
594793,冬日同惟仁叔祥季美君玺季德君美道子虹山赏梅花得园字
592174,同惟敬夜过明卿得台字
591872,秋日同惟敬道襄过天宁寺访真乘上人不遇
572863,初夏同惟学惟长舅尊游二圣禅林检藏有述 其二
572862,初夏同惟学惟长舅尊游二圣禅林检藏有述 其一
591889,雪中同惟敬约卿集休承寓舍得君字
543465,出山投华严寺夜宿晨起游吕公洞曩同惟敬题名老衲炊黄梁作供忆邯郸枕上事怃然久之
592028,春夜同惟敬约卿集寿承学舍时休承将之吉水在坐同赋得寒字
591866,吴约卿自邯郸回同惟敬过讯留酌因览张助甫诸诗
66361,同惟长舅读唐诗有感
551035,中秋同惟秦震卿集汝大草堂看月因怀惟起客吴
592117,雪夜同惟敬饯别彦国还卢龙得高字
591918,伏日同惟敬鹫峰寺避暑
572865,初夏同惟学惟长舅尊游二圣禅林检藏有述 其四
591531,镇海楼同惟敬作
591517,同惟敬思伯夜泊浦口
593405,同惟敬仲修袭美元易于海子亭再别惟良得阴字
546182,蚤春同惟敬诸子登显应宫阁望西山霁色即席赋
528446,袁冲霄先生同惟学过访
471547,同惟长舅读唐诗有感
572864,初夏同惟学惟长舅尊游二圣禅林检藏有述 其三
544697,秋夜同惟敬诸子集刘观察园亭分得高字
545879,同惟敬诸丈邀刘观察集李园
591353,元夕同惟仁维乔少居幼通集公瑞宅
699433,初夏同惟学惟长舅尊游二圣禅林检藏有述
591888,寒夜同惟敬怀杜舍人
550819,同惟秦兴公舟中夜坐
591919,晚同惟敬步至水塘庵
