179145,文帝登虎圈问尉禽兽簿不能对虎圈啬夫对甚悉
379514,登虎丘即事
699899,上巳日与客同登虎邱二首
374910,和魏侍郎登虎丘
595752,登虎邱山
983679,文帝登虎圈问尉禽兽簿不能对虎圈啬夫对甚悉上拜啬夫为上林令张释之曰今以口辨超迁恐天下争口辨无实遂不拜
490691,上巳日与客同登虎邱二首 其二
1239291,奉陪吕志学曾彦鲁刘仲原同登虎丘赋呈居中长老
54256,雨后登虎峰送张七
1142000,次贡仲章登虎丘韵
512516,暮春登虎丘
538651,月夜登虎丘作
64427,重登虎丘
497591,携儿子允文登虎丘寺有感昔游
634384,与张总戎登虎头门望海 其三
485673,登虎溪阁
1076457,十月十七日大风约客登虎渡亭观浪人言今日下水风不可往也戏作此篇
485840,次韵邾仲经同登虎丘长句
491053,新夏登虎邱山阁
682901,冬日登虎塘诸山用韵答莲坪先生二首
1095196,登虎丘西庵
595343,登虎头岩
661520,与沈继南登虎邱天开图画阁奉柬其兄启南
49002,登虎溪阁
1097761,和魏侍郎登虎丘
672216,登虎丘千顷云和聂大年韵
646061,四月九日与斯道衍公登虎丘
970435,登虎丘寺
703364,与张总戎登虎头门望海
486862,风流子 登虎丘致爽阁
555504,奉和袁主事登虎丘寺浮图韵
342466,登虎邱寺浮图遇雨
23455,与裴三十秀才自越西归望亭阻冻登虎丘山寺精舍
814729,月夜同重阆秋岳登虎丘
1061495,登虎丘即事
62618,雨后登虎丘宿梅花楼僧房
624802,登虎丘
52864,同陈秀才登虎头岩
491071,家弟归自秣陵携酒同登虎邱
473598,重登虎丘
470268,雨后登虎峰送张七
534934,冬日登虎塘诸山用韵答莲坪先生二首 其一
55158,四月九日与斯道衍公登虎丘
530166,同孟佥事望之登虎丘山
490760,雨后登虎邱
490676,暮春日与客同登虎邱西阁
534935,冬日登虎塘诸山用韵答莲坪先生二首 其二
738624,月夜同重阆秋岳登虎丘 其一
1228291,至正二十一年春三月二日同孙大雅张孟肤縻仲明登虎丘访居中禅师不遇留题平远堂
741093,偕友人登虎山观音堆眺望
673670,登虎邱
1162322,与裴三十秀才自越西归望亭阻冻登虎丘山寺精舍
383327,暮春邢子愿侍御过访邀登虎窟山洞遇雨和韵
634382,与张总戎登虎头门望海 其一
634383,与张总戎登虎头门望海 其二
667187,病中登虎丘寺楼
738625,月夜同重阆秋岳登虎丘 其二
472985,雨后登虎丘宿梅花楼僧房
673411,嘉靖癸巳十一月望前三日舟饮夜阑乘兴登虎丘有作同游者杨文泉道南谢嵩南宜相许高阳初而东君则张馀山瑀也
482654,同陈秀才登虎头岩
627646,登虎丘
64892,次韵邾仲经同登虎丘长句
490874,三月三十日登虎邱
490690,上巳日与客同登虎邱二首 其一
547424,暮春邢子愿侍御过访邀登虎窟山洞遇雨和韵
371342,登虎丘西庵
661209,永章弟永明挥使晚至请次日登虎邱
343807,登虎丘·红叶天寒日暮时
344767,冒雨登虎丘千顷云望天平诸山
512502,雪中登虎山
1223378,登虎丘山
