585108,和苏州林太守招降海寇韵二首 其一
592556,喜官军已逐海寇寄黄公补公绍
693282,和苏州林太守招降海寇韵二首
704378,陈公聘宪使提五州兵征海寇有作次韵
615075,督府熊公招饮七星岩时山海寇初平
474996,九日寄子约（时海寇甫戢，闻河中盗起）
533243,闻海寇入高凉陷属邑怅然有作
595613,寓白沙公馆阻海寇四日风利渡海次日抵英利遇陈自所同宿驿西偏
857366,海寇赵某伏诛
585109,和苏州林太守招降海寇韵二首 其二
556375,病中食江鱼作自海寇乱此鱼不至者六年矣
73630,漫兴·前月海寇入郡郭
230308,桂林送人之琼州招捕海寇
566685,湖严氏有二女其翁以长者许渭继室渭自愆盟顷闻为海寇断其翁臂二女俱被执旋复放还便巳作宛转词怜之后知其长女被执时即自奋堕桥死幼女放还亦死因复赋此宛转词中覆水句正悔愆盟也
609211,制府刘公之移镇东越破海寇也于时霖雨初霁适有卿云灵鹊之瑞公既自为诗纪之不佞守职词垣遥从万里外倚和焉五色云
866302,桂林送人之琼州招捕海寇
533543,陈公聘宪使提五州兵征海寇有作次韵 其一
565040,抵家值海寇作祸遣怀简石湖
533544,陈公聘宪使提五州兵征海寇有作次韵 其二
1003234,喜迁莺  福唐平荡海寇宴犒将士席上作
602232,闻海寇犯省城
592555,闻岭南海寇警急寄陈德基袁茂文
