150327,涂中寄高仲诏
618286,米仲诏招集漫园三首 其三
610060,初夏同汤中允嘉宾黄仪部贞父张民部孟奇刘民部元定米明府仲诏沈虞部季彪徐兵部鸣卿毕秘书孟侯邓兵部玄度蔡兵部敬夫李孝廉伯远刘孝廉百世集草桥赋诗效骆体
618264,姜箴胜前辈招同李小湾罗萸江二宗伯文湛持姚孟长二宫詹米仲诏太仆王遂东国子分赋
604887,寄怀米仲诏计部毕孟侯侍御两社友
550213,赠米仲诏
546902,春日过皦生斋头米仲诏倪迂扩本在焉披阅数过吴枫秋色照人眉睫恨不携绿蓑青笠容与其间作竟日主人也
696292,偕华愚公齐越石吕介孺王见卿耿明甫刘敬仲蔡韫先集米仲诏古云山房分得六鱼
550058,瓶花影与仲诏同赋 其二
616114,集光禄米仲诏古云斋遍赏所贮奇石
550133,偕华愚公齐越石吕介孺王见卿耿明甫刘敬仲蔡韫先集米仲诏古云山房分得六鱼 其一
541659,送米仲诏之令铜梁
616133,米仲诏光禄柬来称园花盛开以卧病不能往赏命围丁以海棠红藜花枝见贻予适与乡友小饮斋中因赋 其一
618285,米仲诏招集漫园三首 其二
550055,米仲诏斋中观剧与辰叟赋
685688,集米仲诏湛园分得松关花径戏作长歌二首 松关
612515,张孟奇徐鸣卿招同黄贞父李伯远汤嘉宾毕孟侯蔡敬天韩孟郁刘百世陈元朋米仲诏西郊李将军园社集得天字排律三十一韵
610987,集米仲诏湛园分得松关花径戏作长歌二首 其二 花径
688879,米仲诏招集漫园三首
605218,汤太史嘉宾米明府仲诏招集得鞍字
550060,同辰叟集仲诏葆光堂得阳字
980338,途中寄高仲诏
696287,瓶花影与仲诏同赋
691229,米仲诏光禄柬来称园花盛开以卧病不能往赏命围丁以海棠红藜花枝见贻予适与乡友小饮斋中因赋
616134,米仲诏光禄柬来称园花盛开以卧病不能往赏命围丁以海棠红藜花枝见贻予适与乡友小饮斋中因赋 其二
618284,米仲诏招集漫园三首 其一
615411,访米仲诏光禄留坐因招同姜仲讱何龙友王季重同集
610986,集米仲诏湛园分得松关花径戏作长歌二首 其一 松关
545914,米仲诏书画船卷即席题
604240,长安市上歌送米仲诏还令铜梁
611048,长歌行送米仲诏年丈调六合令
550059,瓶花影与仲诏同赋 其三
615426,元夜同王季重姜仲讱何龙友观灯米仲诏光禄宅
550134,偕华愚公齐越石吕介孺王见卿耿明甫刘敬仲蔡韫先集米仲诏古云山房分得六鱼 其二
550057,瓶花影与仲诏同赋 其一
