1080542,邦杰惠砚纸墨三物谨成古体诗一首上谢
1046188,奉陪蓬莱阁赏雪赋诗谨成二十四韵呈知府龙图侍郎
883735,春秋终讲伏蒙知府谏议临视学舍宴劳诸生谨成小诗叙谢
973670,二日晚得少空偶阅杜集无何坠火焚者数叶谨成古句致愧惜之意呈明叔仲威
1044946,因览蓬莱观雪唱和谨成二首 其一
1044947,因览蓬莱观雪唱和谨成二首 其二
1038217,臣得请致政赴阙谢恩脩觐礼成回归西洛感恩恋圣情激于中谨成五言十二韵诗一首斋沐缮写上进
1078046,道勾漏山灵宝观窃睹两朝御书谨成古风
355798,某皇恐上启伏承太师均佚之暇修真养浩日与造物者游谨成拙句上尘钧览
999876,某不度轻僭始以鄙句尘献判府安抚司徒侍中特屈威尊过赐宠和伏读荣荷谨成律诗一首代启上谢
799258,家大人命赋来青之室谨成长歌
1052260,夜坐谨成小诗呈晦堂心老
137937,太傅杜相公索聚星堂诗谨成
1070489,某皇恐上启伏承太师均佚之暇修真养浩日与造物者游谨成拙句上尘钧览
953630,太傅杜相公索聚星堂诗谨成
849939,和姚勔《奉陪蓬莱阁赏雪赋诗谨成二十四韵呈知府龙图侍郎》
320886,仆射侍中荣过潩上小园兼题嘉句谨成十六言仰谢贲饰
520364,骊山之温泉即唐之华清宫也以路当孔道而浴者殆无虚日予奉诏赐浴而且遂游观之乐其感戴圣恩宜何如哉谨成一律以贻诸缙绅云
128392,恭睹上圣亲临江淮耀武伊洛谨成诗一章仰赞圣
1037914,某伏蒙宫师相公杜寄示新居诗斋沐捧读不胜铭叹某谨成拙诗一章上纪盛德粗伸谢意
893166,仲夏愆雨稚苗告悴辄按先帝诏书绘龙请雨兼祷霍山淮渎二祠戊寅蒇祀己卯获雨谨成喜雨诗呈官属
158341,某伏睹判府司徒侍中置酒宴客即时雪作谨成七
1080135,钱逊叔侍郎奉京师旧坟改葬天柱谨成挽诗一首
1038097,仆射侍中荣过潩上小园兼题嘉句谨成十六言仰谢贲饰
1110371,因览蓬莱观雪唱和谨成二首
355073,夜坐谨成小诗呈晦堂心老
1038110,九月十日西园会范内翰李紫微已下诸公惠雅章谨成拙诗仰答厚意
1054378,十三日南湖之集宾主六人谨成诗十韵拜呈
96766,二日晚得少空偶阅杜集无何坠火焚者数叶谨成
279713,家大人命赋来青之室谨成长歌
999878,某伏睹判府司徒侍中置酒宴客即时雪作谨成七言律诗一首上献
989260,恭睹上圣亲临江淮耀武伊洛谨成诗一章仰赞圣化
953614,与谢三学士唱和八首 昨日偶陪后骑同适近郊谨成七言四韵兼呈圣俞
320655,九月十日西园会范内翰李紫微已下诸公惠雅章谨成拙诗仰答厚意
1037003,某顿首今日去国之官谨成拙诗上献相公汲公钧席下执某顿首上
