710295,访曹秋岳侍郎
736826,过槜李访曹秋岳先生不遇
710077,人日寄曹秋岳方伯
299609,人日寄曹秋岳方伯
275037,陈平湖之官附怀曹秋岳先生
624397,家信至六月长男人驹举一孙适吴比部鲁冈曹秋岳大行金明经润孚在座而伍国开年兄家信亦至长郎以仲秋举第三孙座中一噱明日以诗见示赋答其韵 其一
298897,九日登旧城用曹秋岳侍郎韵
735550,九日登旧城用曹秋岳侍郎韵
276123,九日风雨西湖泛舟同曹秋岳
484751,次韵杨礼曹秋日见赠
835320,念奴娇 曹秋岳竹垞图，今藏王息存处，出以索题，追和元韵
710299,夜集曹秋岳啬斋同俞右吉项嵋雪次韵
302100,访曹秋岳侍郎
710823,莞香答和曹秋岳方伯
286447,答保雨村户曹秋夜见怀
625924,上曹秋岳方伯
275048,长至前二日同右吉翁山陪曹秋岳先生宿雁门关
710230,寄曹秋岳
694087,家信至六月长男人驹举一孙适吴比部鲁冈曹秋岳大行金明经润孚在座而伍国开年兄家信亦至长郎以仲秋举第三孙座中一噱明日以诗见示赋答其韵
764135,水调歌头 秋日，送徐方虎太史给假省亲归武源，用朱竹垞检讨寄曹秋岳先生原韵
301231,寄曹秋岳·别来犹见兴飞扬
801324,秋日曹秋岳先生过饮桐溪草堂别后有作
784546,答保雨村户曹秋夜见怀
302103,夜集曹秋岳啬斋同俞右吉项嵋雪次韵
624398,家信至六月长男人驹举一孙适吴比部鲁冈曹秋岳大行金明经润孚在座而伍国开年兄家信亦至长郎以仲秋举第三孙座中一噱明日以诗见示赋答其韵 其二
733452,别曹秋岳夫子十稔偶于晋阳拜晤感而有赋
768247,无俗念 赠曹秋岳侍郎
735586,宴集真如塔院怀曹秋岳先生
705722,岭南喜晤曹秋岳作歌
733206,同曹秋岳先生游韬光庵和高忠宪公韵
720047,送曹秋岳以少司农迁广东左辖
270663,水调歌头·秋日，送徐方虎太史给假省亲归武源，用朱竹垞检讨寄曹秋岳先生原韵
46985,次韵杨礼曹秋日见赠
735462,长至前二日同右吉翁山陪曹秋岳先生宿雁门关即事四十韵拈玉树凋伤枫树林之句分凋字
299421,别曹秋岳夫子十稔偶于晋阳拜晤感而有赋
