653385,刑科钱士义升山西参议临行以流泉小幅求题书此见意
600836,与陈隆之太史侨寓广陵比园庐者累日临别赠余六绝用此见答 其六
307256,陈以光先生屡赐诗词惭于应答写此见意
563665,门人王嘉秀实夫萧琦子玉告归书此见别意兼寄声辰阳诸贤
426359,吴门李西庚先生神交两载，今始识荆，欣喜之馀，赋此见意
600835,与陈隆之太史侨寓广陵比园庐者累日临别赠余六绝用此见答 其五
483991,予少年磊隗负气诵稼轩辛先生郁孤台旧赋菩萨蛮尝慨然流涕岁庚辰过铅山先生神道前有诗云云见南归纪行藁后会赣州黄教授请赋郁孤台诗复作近体八句亡其旧藁因念功名制于数定材杰例与时乖自昔不遇若先生者盖亦多矣然犹惜其未能知时审已恬于静退几以斜阳烟柳之词陷于种豆南山之祸今二十九年矣舟过是台细雨闭蓬静坐忽忆旧诗因录于此见百念灰冷衰老甚矣云
783008,廷璋儿以武举效力京营千总秉瑛侄以进士试用户部主事数年资其薄俸以供饘粥今二子前后归班候选生路遂绝赋此见志且励二子固贫之志不可不坚也
558337,予居春坊之右厢者月馀寂寂无偶适李瑞卿至与居左厢故旧之情切劘之益兼得而备至喜幸之深赋此见意
620221,予为孝廉游南岩数十年往矣通籍后久客长安每思旧胜如隔蓬壶丁卯冬奉命还家辱友人招饮于此见多改观且及结绿先兄欣赏之事怅然不胜今昔之感漫纪一律
421143,临江仙 志道赴沪祝母寿，书此见寄
426308,陈以光先生屡赐诗词惭于应答写此见意
600832,与陈隆之太史侨寓广陵比园庐者累日临别赠余六绝用此见答 其二
826211,卜算子·宵诵东坡此调，意当时怀贤去国，情绪万端，必有不胜其辗转反侧者。赋此见意，亦宋玉微词之旨。世人以侧艳目之，谬矣。港居荐涉冬春，望远登楼，伊郁谁语，偶继坡作，以写我忧。世其有为我作郑笺者乎
826195,点绛唇·重阳闷不出门，遂失灵岩登高之约，赋此见意
408859,白卫岭（明皇于此见老子骑白卫，示取禄山之兆）
600834,与陈隆之太史侨寓广陵比园庐者累日临别赠余六绝用此见答 其四
53021,曾寻落雁峰不知所在疑即南峰异名至此见峰因
307279,吴门李西庚先生神交两载，今始识荆，欣喜之馀，赋此见意
958539,越江之岸人家皆临水种竹叠石作径其屋萧然嗟今齿发踰壮方坐兵火惊焚安得一居如此见之不胜馋慕
411809,星洲既陷厄苏岛困孤舟中赋此见志
483506,曾寻落雁峰不知所在疑即南峰异名至此见峰因而思峰
149348,明仲约七月晦集属抱病先以此见意犹并以申谢
569524,李丈琦自解银台力辞不出读书燕中赋此见怀
188482,偈公·只此见闻非见北
600833,与陈隆之太史侨寓广陵比园庐者累日临别赠余六绝用此见答 其三
420649,八声甘州 鹣庵相别廿余年，重来故都，谱此见示，次韵和之
821171,西平乐 匪石来静石湾，夜谈甚乐，归而赋此见寄，依韵奉酬
266711,点绛唇·重阳闷不出门，遂失灵岩登高之约，赋此见意
558108,诗欲学陆放翁赋此见志
950685,与高紫微雪溪饯客虽已预盟然坐次予每居上为之踧踖寄此见意
416274,木兰花慢 丙寅岁杪，吴中长吏，有迎春之举，已而未果。蒋香谷赋此见示，余亦继声
585162,登岳阳楼陪宴诸公赋此见意
694012,与陈隆之太史侨寓广陵比园庐者累日临别赠余六绝用此见答
600831,与陈隆之太史侨寓广陵比园庐者累日临别赠余六绝用此见答 其一
674013,十一月八日驱车南行客况寥落赋此见志
585064,萧汝柔掌教讶无回书赋此见意
895323,子立昆仲垂和游天宫诗既工且敏义不虚辱再此见意
166848,此见帅宪祷十甚虔枕上闻檐声为之不寐因成
296529,八声甘州·鹣庵相别廿余年，重来故都，谱此见示，次韵和之
604686,泊京口闻李本宁观察未莅武林因留书候吏赋此见怀
820245,金缕曲  示菜佣，菜佣即井研老名士龚熙台先生也，于此浊世，一无所过问，与余同志因制此见赠
657271,和司马提学倡和诗韵 来教谓陈师召太常久稽和章以此见促昶亦以太常非久稽者以全取胜故耳故揣太常之意亦奉和一章 其六
854990,六月二十日舍贾耘老溪居旦起蔡成允见访仆方蓬头赤脚坐溪上乃用此见成允而君不以为无礼反寄诗有褒借意甚愧过情戏作一首奉报
307602,临江仙·志道赴沪祝母寿，书此见寄
980279,明仲约七月晦集属抱病先以此见意犹并以申谢
373456,春晚·纷纷从此见花残
319562,星洲既陷厄苏岛困孤舟中赋此见志
