139456,挽袁正言·言路同游记昔年
155899,次韵提举五正言寒食游茶焙
863558,贺温正言赐紫
1076215,次韵林察院贺章正言得子
976791,念奴娇 其二 送陈正言
353529,送何正言持节湖南
135307,次韵黄文叔正言送日铸茶
102340,次韵王觌正言喜雪
863598,送夏侯正言襄阳迎亲
1131893,和陈正言谠题尊贤堂二首
1093250,十五日夜月蚀闻差中舍正言监测清台
512371,送尹正言父还太和
661586,送计正言
1089673,刘正言讲筵视职初直玉堂见案上所和高紫微阳字诗宠和二章见示因用韵答以一首深愧短拙
150732,黄正言为邑宰累罢郡送行
200854,喜吴几道迁右正言知谏院
892591,秋日与天章侍讲王原叔曾明仲正言余安道三学士集普光院
134894,送王正言守永嘉
505453,送仲权百户之山东兼问薛正言
999274,次韵提举王正言寒食游茶焙
513552,题尹正言学士菊
578621,挽知县刘正言
961726,和黄正言劝农
144385,何正言母安人挽诗
1105571,次韵龚实之正言见寄
1086356,次韵龚实之正言见寄 其二
647995,送陈正言知府归云南
961659,归山间舟中寄黄正言
177804,贺温正言赐紫
1028122,送王正言守永嘉
512264,送尹正言二亲受封南归得拜字
225828,喜种隐君授正言直馆
921498,次韵王觌正言喜雪
723872,撰孔子正言竟述怀诗
177879,送正言杨学士之任缙云
906810,李无玷自左正言出守永州召为吏曹外郎尚阻叙旧先贻此诗
348164,与吴子正言怀
1022189,酬正言上人
514786,送南京少宗伯尹正言先生奉表入贺礼成还任次南都赠行韵六章 其三
177880,送直馆高正言转运荆湖
136095,游香山次正言韵
353378,刘正言讲筵视职初直玉堂见案上所和高紫微阳字诗宠和二章见示因用韵答以
863597,送夏侯正言奉使江南
963613,何正言挽诗
959594,喜吴几道迁右正言知谏院
963614,何正言母安人挽诗
150642,归山间舟中寄黄正言
1039767,寄酬蔡州王陶正言
196634,念奴娇·送陈正言
1027868,游香山次王正言韵
198298,李无玷自左正言出守永州召为吏曹外郎尚阻叙
124536,正言田学士況书言上庠祭酒听北轩予所种竹滋
206637,送王辟太博赴阙呈刘正言
1031471,和陈正言谠题尊贤堂二首 其二
680642,送兵部尹亚卿正言赴京
933902,寄龚实之正言
893163,正言田学士况书言上庠祭酒厅北轩予所种竹滋茂
962009,黄正言为邑宰累罢郡送行
178009,送夏侯正言襄阳迎亲
77953,寄龚实之正言
125543,监中会两禁诸公饮饯吴舍人梁正言富修撰叶龙
1084937,贺何正言用蔡君谟韵
1035599,送王辟太博赴阙呈刘正言
178010,送夏侯正言奉使江南
150386,和黄正言劝农
125254,秋日与天章侍讲王原叔曾明仲正言余安道三学
323646,次韵龚实之正言见寄
863607,送馆中王正言使交趾
1028051,次韵黄文叔正言送日铸茶
667382,送正言弟赴遂安任
1031472,和陈正言谠题尊贤堂二首 其一
204382,酬正言上人
109165,和陈正言谠题尊贤堂
863585,送直馆高正言转运荆湖
41253,撰孔子正言竟述怀诗
976563,喜种隐君授正言直馆
1050858,与吴子正言怀
948538,王季海正言父宣义挽词
514785,送南京少宗伯尹正言先生奉表入贺礼成还任次南都赠行韵六章 其二
892760,监中会两禁诸公饮饯吴舍人梁正言富修撰叶龙图以计省不赴作诗见寄
702403,送南京少宗伯尹正言先生奉表入贺礼成还任次南都赠行韵六章
889366,挽袁正言
178097,送馆中王正言使交趾
514789,送南京少宗伯尹正言先生奉表入贺礼成还任次南都赠行韵六章 其六
1086355,次韵龚实之正言见寄 其一
514788,送南京少宗伯尹正言先生奉表入贺礼成还任次南都赠行韵六章 其五
336610,次韵林察院贺章正言得子
655622,同陈正言登李家山次朱子游山诗韵
863759,送正言杨学士之任缙云
514787,送南京少宗伯尹正言先生奉表入贺礼成还任次南都赠行韵六章 其四
1089618,送何正言持节湖南
514784,送南京少宗伯尹正言先生奉表入贺礼成还任次南都赠行韵六章 其一
