106942,会张仲实宅得天字
593544,立秋日王于慎李于美方允治见过迟刘仲修不至得天字
533680,九日同李给事冯吴二侍御欧文学登城南楼得天字
987962,李大著赴豫章别驾同舍饯别用杜工部天上秋期近人閒月影清之句分韵赋诗得天字
343572,中秋南康夜会得天字
489714,仲春释奠燕集存道斋分韵得天字
783124,重访范兰亭喜晤即同泛舟得天字
264476,春分后一日社集北湖分韵得天字
542117,冬夜范宪伯尧卿宅同许宪副子春得天字
1048511,中秋南康夜会得天字
444754,扬州慢·乙酉荷月津门吟聚分韵得天字
428715,丙子上巳莹园修禊分得天字
513509,陆廉伯太史家赏莲得天字
238073,湖饮得天字
679597,秋日同程张二丈登太原西城楼得天字
742642,海上分韵得天字
591473,晓登城北楼同陈潜父梁彦国得天字
251659,扬州慢·乙酉荷月津门吟聚分韵得天字
1208464,同年小集探策赋诗得天字
634012,篁村探梅后月夜泊舟龙溪江口同澹归乐说觉薰乘消汝得纯铸分赋得天字
309931,鹧鸪天·扑圃置酒再集小楼分得天字
602679,初秋访黎继腾书馆得天字
926331,湖饮得天字
489915,郑德明李廷璧同集顾仲瑛书画舫分韵得天字
556981,同明卿子与送别于鳞元美席上得天字
641138,离云飘叶卷得天字
52886,秋夜浦舍人见宿园亭分得天字
612515,张孟奇徐鸣卿招同黄贞父李伯远汤嘉宾毕孟侯蔡敬天韩孟郁刘百世陈元朋米仲诏西郊李将军园社集得天字排律三十一韵
593396,同于殿讲黎秘书李明府静修上人集圆通精舍得天字
101113,座上赋戴花得天字
537220,夏夕谢山人冯户曹朱驾部伯邻峻伯于鳞三比部见过分韵得天字时谢将有行期
1200470,咏石得天字
482683,秋夜浦舍人见宿园亭分得天字
1141713,陪戴祖禹汎湖分韵得天字
1134676,会张仲实宅得天字
556772,寒夜偶过吴峻伯读其山中诸篇分得天字
1231858,春辉楼以攀桂仰天高分韵得天字
820169,春分后一日社集北湖分韵得天字
542149,栗仁甫园亭饯别得天字
542003,昭觉禅院同南泉西岩二君赋得天字
626208,初夏赏莲得天字
542456,夜酌吴明卿宅迟王元美不至得天字
167480,陪戴祖禹泛湖分韵得天字
542133,初秋同刘兵宪叔清游五龙山值雨得天字
239776,咏石得天字
422627,鹧鸪天 扑圃置酒再集小楼分得天字
619455,秋日玉台寺同智公并社中诸子分得天字
167648,陪戴祖禹汎湖分韵得天字
542181,夏夜集孙员外文揆宅得天字
542026,苗仲材告别登楼晚聎得天字
601383,集青云馆同周茂才誉苏经佐诸子话旧因忆亡友苏经济分赋得天字
610931,灵济宫会饮分韵得天字
542354,立春日与周一之文德承李时明马怀玉集李伯承馆时还宰新喻得天字
920931,坐上赋戴花得天字
600318,岁莫太学宴集分韵得天字
