904587,送程荣州被召二首 其二
932946,将之荣州取道青城
180408,送阴次公赴荣州学官
963487,大人和云楼底雪千峰楼头着寓翁梅方开萼绿桃已亚枝红斟浅偏劳劝眠迟不受烘锦城春在眼何暇问蚕丛时四川李制置以荣州见辟辞之也某因用前韵
192520,次韵赵荣州题芦雁画
1138419,荣州
1034811,送杨子有赴叙倅用高荣州韵
114137,元师自荣州来追送余于泸之江安绵水驿因复用
935773,初到荣州
206642,送太博知荣州
407279,上元再次山公韵寄怀香宋翁荣州
140111,送杨子有赴叙倅和高荣州韵
1113752,送程荣州被召二首
934957,入荣州境
308795,六幺·辛子被困乱军，卜云死矣，一书告存，喜订荣州之游，并问诸遗老
140136,送李蒲江归简池用高荣州韵
1035273,贺新郎 荣州表兄生日
173628,杨仲承秘书蹉跎三年今得荣州文学冬日贻书以
996407,元师自荣州来追送余于泸之江安绵水驿因复用旧所赋此君轩诗韵赠之并简元师法弟周彦公
966054,和赵荣州
77961,将之荣州取道青城
908425,送阴次公赴荣州学官
139897,至左绵尽怀呈荣州二兄
1224026,从兄德观父与集同出荣州府君宋亡隐居不仕而殁集来吴门省墓从外亲临邛韩氏得兄遗迹有云我因国破家何在君为唇亡齿亦寒不知为谁作也抚诵不觉流涕因足成一章并发其幽潜之意云
997165,寄题荣州祖元大师此君轩
181442,荣州·醉倚高楼上
904588,送程荣州被召二首 其一
862799,杨仲承秘书蹉跎三年今得荣州文学冬日贻书以诗答之
182274,和赵荣州·兵戎暌隔几春秋
1035586,送太博知荣州
932091,别荣州
904354,次韵赵荣州题芦雁画
115187,寄题荣州祖元大师此君轩
1035060,送李蒲江归简池用高荣州韵
823043,六幺 辛子被困乱军，卜云死矣，一书告存，喜订荣州之游，并问诸遗老
1071879,先大夫元丰间及进士第荣州伯父喜而赋诗宣和四年信道兄登科某时为著作郎侍立集英殿与观唱名未几信道兄调而归某谨次伯父韵以送之
78219,入荣州境
1034999,至左绵书怀呈荣州绵州二兄
77429,别荣州·浮生岁岁俱如梦
318653,上元再次山公韵寄怀香宋翁荣州
369559,先大夫元丰间及进士第荣州伯父喜而赋诗
192433,送程荣州被召
83847,初到荣州·乱山缺处城楼呀
