888230,木平像吾友宣老所藏宣示寂久矣余因归朱方遇其徒慈俊乞得之喜而作此
209758,离朱方寄怀子和
535107,晚春高唐道中得丁中丞朱方伯书有述
209936,到朱方寄智夫时为户部官
888162,到朱方寄智夫智夫时为户部官
113789,赠朱方李道人
1227282,朱方偶作
704636,还至吴门送朱方黯就徵北上二首
654489,送朱方伯
621219,还至吴门送朱方黯就徵北上二首 其二
654429,桂山十二章送朱方伯赴陜西
1162311,下第归朱方寄刘三复
621218,还至吴门送朱方黯就徵北上二首 其一
23476,下第归朱方寄刘三复
9763,朱方南郭留别皇甫冉
40347,循役朱方道路诗
997336,赠朱方李道人
209674,木平像吾友宣老所藏宣示寂久矣余因归朱方遇
888177,离朱方寄怀子和
917424,顷岁如番禺与庆传十六兄遇上饶后五年胥会于霅时太学增置生试竟不遂志将别去理朱方棹因咏昔人风雨对床之语慨然有感作是诗
233965,题金山·江来朱方注之东
888107,余自离荆渚遍身生疮了无佳思至金陵舍舟登陆之朱方道游钟山
723352,循役朱方道路诗
1181031,朱方南郭留别皇甫冉
