1041889,舍弟及杨十七尊兄同年登科贺彦文
1032345,过干越宿熊氏澹园偕东采驾阁西玉国正二同年登羊角峰观天池访昌国寺陆羽茶灶拿船过琵琶洲回延休观听琴记游四首 其一
129303,社牲·年登敛牲钱
1044910,宋匪躬太祝先辈示及刘贡父伯仲三人同年登第之诗因奉一篇
1177101,赠元和十三年登第进士
150432,王大卿挽诗·少年登雁塔
191813,周宜义三子仲敏明□幼谨同年登第因以前韵奉
731118,朕自幼不喜厚味今年登古稀深知粗食软足以颐养天和有人进蒌蒿苦麻者因而书怀
76611,上巳·残年登八十
8362,九日·去年登高郪县北
161099,三绝·年登八十更何为
240991,予与元均永叔君谟同年登科永叔寻人馆阁元均
1072865,左世绩妙年登第而飘泊遐荒十年不得调盖尝以事忤权贵今公道方开始欲仕进索余赋诗
422828,大有 去年登高桃叶渡大集成酒家，风景犹昨，倏又重九至矣。用潘希白九日词原韵
323811,宋匪躬太祝先辈示及刘贡父伯仲三人同年登第之诗因奉一篇
218895,喜雨·年登犹藉米船通
871718,予与元均永叔君谟同年登科永叔寻入馆阁元均今制策高第君谟复磨砺元均事业独予驽下因寄君谟
1208402,送翰林编脩成谊叔驿召鲁子翚学士于邓遂便觐省成由国子生乡举于大都至顺四年登科今始得归乡里
313558,大有·去年登高桃叶渡大集成酒家，风景犹昨，倏又重九至矣
150786,得节·年登八秩少三春
236443,后数年登旷远亭用前韵再赋
404076,满江红·己巳，一九二九年。登景山谒明思宗殉国处
980309,说之复兼二公而作圆机既同邪籍之契显夫又与仆元丰五年登科事相类时曾子固坐失考罚铜三十斤后为先人语之甚详
324838,寄居庆汪中嘉尚书年登七秩会致语口号
872720,后数年登旷远亭用前韵再赋
324228,左世绩妙年登第而飘泊遐荒十年不得调盖尝以事忤权贵今公道方开始欲仕进索余赋诗
507841,冬日与彭赞礼永年登冶亭
515461,管太仆同年出示往年登楼之作别后次韵奉寄
1131982,过干越宿熊氏澹园偕东采驾阁西玉国正二同年登羊角峰观天池访昌国寺陆羽茶灶拿船过琵琶洲回延休观听琴记游四首
946078,周宣义三子仲敏明□幼谨同年登第因以前韵奉寄
366619,舍弟及杨十七尊兄同年登科贺彦文
541044,已夘新正年登八帙家宴偶成
1032344,过干越宿熊氏澹园偕东采驾阁西玉国正二同年登羊角峰观天池访昌国寺陆羽茶灶拿船过琵琶洲回延休观听琴记游四首 其二
1084084,寄居庆汪中嘉尚书年登七秩会致语口号
588722,与养斋宗伯同年登牛首山
1208618,高丽人李谷字中甫元统元年登乙科为翰林检阅官明年被命使本国宣谕勉厉学校制书其行也赠之以诗
22011,赠元和十三年登第进士
