298178,扬州慢·盛献三兄以擅古琴知名，因赋此调为赠
192669,郡侯奏请为先竹洲易名因送逢原入京
900615,陪舍人兄过陈仲思溪亭深有买山卜邻之意舍人兄预以颛壑见名因成古诗赠仲思
1035439,知府石太尉闲抱瑶琴荣临圭窦烧笋供膳刻竹题名因成二绝纪而谢之 其二
890327,郡侯奏请为先竹洲易名因送逢原入京
1248214,兵妇归七日夫卒乃抱骨赴水逸其姓名因为之赋
33070,塔院小屋四壁皆是卿相题名因成四韵
871750,御史台牒督光台钱牒云以凭石柱镌名因戏书呈通判寺丞景元
604903,吴兴闵谏廷来游罗浮以宝安尹用平同人书至与邓观察玄度皆损诗贻之且见讯西园公此游当不落莫矣余方苦目眚谏廷工鼓琴又以医名因问谏廷此白眼老子不知两瞳亦可方否若峨峨洋洋之音西园公尚能观之请舍石室不必更寻稷丘公也
980330,泰州人自徐神翁后多以奉道为事即今有周高唐三先生皆足以动众得名因作长句
926207,鹧鸪天 其七 有客慨然谈功名，因追忆少年时事，戏作
1172463,比闻龙门敬善寺有红桂树独秀伊川尝于江南诸山访之莫致陈侍御知予所好因访剡溪樵客偶得数株移植郊园众芳色沮乃知敬善所有是蜀道菵草徒得嘉名因赋是诗兼赠陈侍御
162837,鹧鸪天·有客慨然谈功名因追念少年时事戏作
882426,假守吕叔恭游中隐岩无名洞坐客鄱阳朱国辅云此洞未有名因公而题欲名曰吕公岩予未敢披襟而刘子思陈朝彦皆曰甚当戏书五十六字镵于石壁间绍兴甲戌季春七日
1157499,郡厅有树晚荣早凋人不识名因题其上
20407,余所居平泉村舍近蒙韦常侍大尹特改嘉名因寄诗以谢
490695,山中逢人道姓名因口占一绝
1172396,余所居平泉村舍近蒙韦常侍大尹特改嘉名因寄诗以谢
1035440,知府石太尉闲抱瑶琴荣临圭窦烧笋供膳刻竹题名因成二绝纪而谢之 其一
1132429,知府石太尉闲抱瑶琴荣临圭窦烧笋供膳刻竹题名因成二绝纪而谢之
1184773,塔院小屋四壁皆是卿相题名因成四韵
1172434,洛中士君子多以平泉见呼愧获方外之名因以此诗为报奉寄刘宾客
730188,游西山见宝竹坡题名因书其后
293466,游西山见宝竹坡题名因书其后
239094,御史台牒督光台钱牒云以凭石柱镌名因戏书呈
17688,郡厅有树晚荣早凋人不识名因题其上
1159742,和李相公以平泉新墅获方外之名因为诗以报洛中士君子兼见寄之什
