514972,上林清趣卷为嘉蔬署丞兼林衡署事宗侄京赋 其三
857951,胡则大学士满秩趋京赋诗为赠
837973,林君献堂率其二子留学东京赋此赠行
619635,同文徵瑞昆有开诸子送龙友入京赋得闻雁
514970,上林清趣卷为嘉蔬署丞兼林衡署事宗侄京赋 其一
653111,友人严文昌近应医士荐余先之京赋诗留别
201701,胡则大学正满秩趋京赋诗为赠
607146,余比部林廷评将应召入京赋别二首 其二
514975,上林清趣卷为嘉蔬署丞兼林衡署事宗侄京赋 其六
428051,木兰花慢 傅抱石以一九六五年九月廿九日午后一时零七分逝世南京，赋此志悼
428038,木兰花慢 闻谢啬庵丈逝世北京，赋此致悼
514971,上林清趣卷为嘉蔬署丞兼林衡署事宗侄京赋 其二
1244399,得月楼为陈与京赋（陈赘刘）
514973,上林清趣卷为嘉蔬署丞兼林衡署事宗侄京赋 其四
427904,虞美人 辛丑立秋日闻梅畹华兰芳逝世北京，赋此志哀
509218,张评事柷坐累出为处州知事暨丁内艰服阙朝京赋诗留别次韵奉赠
607145,余比部林廷评将应召入京赋别二首 其一
491719,十月一日至临濠点驿将归南京赋此奉酬德瑜萧虞部
686108,余比部林廷评将应召入京赋别二首
1218744,胡道元隐东湖得许旌阳铁符延瘗旧名伏蛟台道元由广陵入京赋此以别
517842,自讼还南京赋
702536,上林清趣卷为嘉蔬署丞兼林衡署事宗侄京赋
514974,上林清趣卷为嘉蔬署丞兼林衡署事宗侄京赋 其五
