542531,温纯甫宅同诸词丈夜集得池字
592083,夜饮诸太史端甫宅
556787,小除夕偕马太史吴驾部集助甫宅分得源字
602389,日至集陈诚甫宅
593344,季秋晦日同贾汝诚陈伯化张和卿崔德卿周之祯集何仁甫宅得间字
1135014,过汪翔甫宅
603087,元夕过黄隐君言甫宅访康茂才思魏赏灯醉饮留宿
533102,张肖甫宅饯别高右丞伯宗得杯字
107026,过汪翔甫宅
594468,元夕同周稚尊陆伯生吴公择臧晋叔陶懋中诸君集西宁侯宋忠甫宅得先字
533618,同陈使君于舜酌肖甫宅
593616,七夕沈纯甫宅同丁庸卿陆华甫黎惟敬蔡伯华观沈启南山水得丛字
594476,金户曹持甫宅赏牡丹同朱仓部次夔苏大理子仁黄侍御唯吾杨计部士遇赋
601353,春日偕李少芝山人集苏文甫宅
594682,同陈大参道襄梁佥宪思立陈少参明佐夜饮陈都护忠甫宅
528219,十四夜李川甫宅
528190,夜集勤甫宅时秉衡至
603046,十日过黄茂才君甫宅留酌偕梁欧黄诸文学同赋黄字韵
542530,重九前一日谢黄门仲川同酌温中丞纯甫宅赋得风字
557371,助甫宅见盆梅同子藩赋之得东愁二字
533607,雪夜同伯宗集缮部张肖甫宅得林字
557372,助甫宅见盆梅同子藩赋之得东愁二字
