503459,与同志泛舟得江字
548257,正月十一夜同陈明府诸君集王鸿胪彦贻宅分得江字即席作
485825,登善住寺新成阁得江字
504384,端午得江字
473018,汲江亭中秋得江字
1249673,玉山以余欲徙居淞江之东设席书画舫邀袁子英陆元祥恢上人用江东日暮云分韵赋诗以饯余得江字用以留别
67201,登善住寺新成阁得江字
139483,约漕使泛舟东郊坐客十人分韵得江字
866653,同郭师圣司空仲容探韵得江字
1062871,寒食前一日率赵伯山李汉老杨时可秦夷行刘仲忱游西池泛舟置酒分韵赋诗以每日江头尽醉归为韵余得江字因即赋所见
1103932,壬辰社日芳洲领客梁必大汤景文吴德昭吴仲退李思宣周南翁游芝山寺登五峰亭瑞在其间羽士洪和叟方君用载酒来会以云飞江外去花落入城来分韵赋诗瑞得江字
221905,同郭师圣司空仲容探韵得江字
900360,二月十日野步城南晚与吴伯承诸友饮裴台分韵得江字
866556,晓行得江字
523994,别徐子祯卿得江字
105312,希深洛中冬夕道话有怀善慧大士因探得江字韵
608527,仲冬集梁氏园得江字
58756,汲江亭中秋得江字
991674,希深洛中冬夕道话有怀善慧大士因探得江字韵联句
691231,伯起启图公给纶三兄端阳后见过得江字
942201,同友人汎舟过断桥登寿星江湖伟观归舟听客讴清真词意甚适分得江字奉寄季大著乡执兼呈真静先生
443150,翻香令 百乐门夜饮分韵得江字
616151,伯起启图公给纶三兄端阳后见过得江字 其一
1034998,约漕使泛舟东郊坐客十人分韵得江字
1088362,卧龙之游钱通守得江字不及赋诗已解维矣熹用其韵纪事以赠并附卷末
492309,罗明道载酒出江寺与旷伯逵痛饮经夕而去因共赋诗为别得江字
616152,伯起启图公给纶三兄端阳后见过得江字 其二
600891,游金山寺同陈隆之太史陈来源外翰分得江字
506232,春夜分韵得江字寄萧君子仪
603339,下蔡镇夜憩文珠寺闻野歌有献胡山人诗者得江字
222055,晓行得江字
1140581,香径分韵得江字
244836,香迳分韵得江字
593430,春日同方奉常刘舍人饮李明府吏隐轩得江字限八韵
618262,初冬李小湾姜箴胜罗萸江三宗伯姚孟长宫庶王季重国子集马园同赋得江字
538317,初抵京承子与携汪魏二君夜过分韵得江字
