700405,宴守溪相国园亭二首
574952,谢守溪翁致洞庭新茶及罗纹笺
674787,一云次王守溪阁老韵
817994,南昌周竹轩善鼓琴出示所藏王守溪书洞庭赋沈石田补画长卷为题一诗
660441,哭王守溪少傅
660437,次韵答守溪见怀
672797,题名山草亭送户部侍郎王公民望致仕归华容和守溪韵
676701,上大学士守溪王公
574853,守溪公惠洞庭新茶侑以长句奉谢
574689,明水草堂次守溪王公韵
526291,游故相守溪公园亭
703032,次韵答王守溪二首
674924,和王守溪先生独居写怀
659919,梁州序 守溪明年亦七十中秋后二日其初度也仍用前调一阕寄寿
660758,用守溪韵送俭弟
574906,暑坐追次文正公韵怀守溪先生
512953,守溪
561149,虎丘寺侍少傅守溪公游奉次高韵 其二
659918,梁州序 戊寅腊月予幸七十初度同年王守溪少傅寄梁州序为寿依韵奉答
659281,守溪王先生父八十
660419,次韵答王守溪二首 其一
561148,虎丘寺侍少傅守溪公游奉次高韵 其一
522381,往岁阻风江上尝登圌山望海门孙思和逸想楼甚近而未之到也诵守溪翁之作遐思渺然敬次其韵
526018,宴守溪相国园亭二首 其二
660727,送守溪乃兄世隐东归
561277,崦西徐少宰省中藤花开有诗邀予同作徐昔侍外舅守溪公授经于此今继践其职云 其二
672935,次宫保戒轩靳公诗韵寄寿少博守溪王公
659963,和答王守溪少傅
660712,次守溪少宰夜饮韵
659951,和答王守溪少傅
561276,崦西徐少宰省中藤花开有诗邀予同作徐昔侍外舅守溪公授经于此今继践其职云 其一
688619,崦西徐少宰省中藤花开有诗邀予同作徐昔侍外舅守溪公授经于此今继践其职云
526017,宴守溪相国园亭二首 其一
301989,南昌周竹轩善鼓琴出示所藏王守溪书洞庭赋沈石田补画长卷为题
660420,次韵答王守溪二首 其二
688662,虎丘寺侍少傅守溪公游奉次高韵
136220,观物·晓鹭守溪图口腹
