1134268,鄱阳汤仲材以其家息庵存斋东涧三大老鄂州黄龙寺僧惠璋入石诗装为一轴求士大夫赞颂紫阳山下方回之先人字元章嘉定甲戌与晦静先生同年为下偈言而不及此意可乎仲材能作祇夜回作伽佗可也 其一
871276,嘉定甲申闰月五日闻皇帝升遐
1134266,鄱阳汤仲材以其家息庵存斋东涧三大老鄂州黄龙寺僧惠璋入石诗装为一轴求士大夫赞颂紫阳山下方回之先人字元章嘉定甲戌与晦静先生同年为下偈言而不及此意可乎仲材能作祇夜回作伽佗可也 其二
1142338,景定甲子理宗尝以颜曾传道配飨下问词臣越咸淳丁卯昉以曾子子思升侑孔庭盖推本先意也先臣所被宸笔藏之私室会军学撤旧庙崇新阁愿得摹刻其上而某固未敢也府教张君遂诗以成之后之观者将有考于斯文谨用韵以谢 其二
146977,嘉定甲戌孟秋二十有七日起居舍人兼直学士院
960029,景定甲子夏五三日王希夷兄有弄璋之庆是时希夷尚在岁寒堂报至以历推之日在参月在东井火在天西北鲁斋先生曰此卿相之命也越七日希夷煮饼岁寒诸朋友与焉桐阳金履祥吉甫为诗以贺
1134267,鄱阳汤仲材以其家息庵存斋东涧三大老鄂州黄龙寺僧惠璋入石诗装为一轴求士大夫赞颂紫阳山下方回之先人字元章嘉定甲戌与晦静先生同年为下偈言而不及此意可乎仲材能作祇夜回作伽佗可也 其四
136360,嘉定甲申闰月五日开皇帝升遐
987992,嘉定甲申以礼部尚书得请便道还家作此诗
1134265,鄱阳汤仲材以其家息庵存斋东涧三大老鄂州黄龙寺僧惠璋入石诗装为一轴求士大夫赞颂紫阳山下方回之先人字元章嘉定甲戌与晦静先生同年为下偈言而不及此意可乎仲材能作祇夜回作伽佗可也 其三
1144018,鄱阳汤仲材以其家息庵存斋东涧三大老鄂州黄龙寺僧惠璋入石诗装为一轴求士大夫赞颂紫阳山下方回之先人字元章嘉定甲戌与晦静先生同年为下偈言而不及此意可乎仲材能作祇夜回作伽佗可也
1034041,嘉定甲戌孟秋二十有七日起居舍人兼直学士院真德秀上殿直前奏边事不顾忌讳一疏万言援引古今铺陈方略忠谊感激辞章浩瀚诚有补于国家天台戴复古获见此疏伏读再三窃有所感敬效白乐天体以纪其事录于野史
189416,景定甲子夏五三日王希夷兄有弄璋之庆是时希
987979,嘉定甲戌正月以金部郎分阃东淮正当金虏弃巢南奔之时人不愿往以君命不敢辞首尾五年而不得代戊寅腊月以少蓬召而病且衰矣自知不堪世用决意南归舟次豫章三疏丐闲而不得请幡然东下舣棹南康重湖阁夜梦人告之曰死于庐山之下觉而识其事并以小诗谢山神
1144220,景定甲子理宗尝以颜曾传道配飨下问词臣越咸淳丁卯昉以曾子子思升侑孔庭盖推本先意也先臣所被宸笔藏之私室会军学撤旧庙崇新阁愿得摹刻其上而某固未敢也府教张君遂诗以成之后之观者将有考于斯文谨用韵以谢
1142337,景定甲子理宗尝以颜曾传道配飨下问词臣越咸淳丁卯昉以曾子子思升侑孔庭盖推本先意也先臣所被宸笔藏之私室会军学撤旧庙崇新阁愿得摹刻其上而某固未敢也府教张君遂诗以成之后之观者将有考于斯文谨用韵以谢 其一
1223678,泰定甲子上京有感次韵马伯庸待制
165085,嘉定甲以礼部尚书得请便道还家作此诗
165073,嘉定甲戌正月
