972756,杨录事以仆与孙温叟唱酬韵作诗见贻又用仆与吴梦与诗韵作诗赠梦与兼以见及并次韵二首 其二
184305,黄岩郑瀛子仙弱冠入太学五上书论时事以直闻
622457,竣事以季秋十三日渡黄河
537144,莫云卿以词翰妙天下一日而名动京师三事以降莫不折行愿交临轩之对策名第一寻用郭有道例入太学别余东归谓余勿以口吻笔札事人且如谢瀹之指口也感慨之馀聊成短歌为赠
1123872,杨录事以仆与孙温叟唱酬韵作诗见贻又用仆与吴梦与诗韵作诗赠梦与兼以见及并次韵二首
622203,既渡河车中即事以新旧见闻作古今愿怀诗八首 其七
1090117,江西刘谋卿秀才以火焚其居谏长序其事以告袁吉故因题其后
622198,既渡河车中即事以新旧见闻作古今愿怀诗八首 其二
622201,既渡河车中即事以新旧见闻作古今愿怀诗八首 其五
277138,李曾廉主事以孤子禀母教至成立禄足以养而太夫人
437780,丁巳九月梦与范季沾同登北潭之临芳亭觉而作诗记其事以示范
622197,既渡河车中即事以新旧见闻作古今愿怀诗八首 其一
19626,李留守相公见过池上泛舟举酒话及翰林旧事以献之
1065819,蜀人宋衍蚤孤母去力学取科第遂获见母盖自蜀至许六千馀里声迹不至逾二十年感叹兹事以送其归
622202,既渡河车中即事以新旧见闻作古今愿怀诗八首 其六
1159632,太和戊申岁大有年诏赐百僚出城观秋稼谨书盛事以俟采诗者
1216946,给事以马乳贶就索诗
211306,论诚·万事以诚立
98136,杨录事以仆与孙温叟唱酬韵作诗见贻又用仆与
1091404,用独乐园故事以雪水烹茶招彦章
575449,元夕开府杨公自范阳过访，赋事以谢 其四 观新庙
1223773,鳌峰者国史院庭中石名也伯宁御史为仆言自其先公时与诸老名胜赋诗者盖数百篇今玉堂无本而御史家具有之且曰峰所托差低盍稍崇其址乃八月五日既克如命因赋此以报且请录示旧诗补故事以传云
542321,秋夜雪后同王给事以宁集胡进士文澄宅予病先归
531024,送邓士曾给事以言事谪金坛名继曾
720142,季天中给事以直谏谪塞外追送不及
1062938,朱贡父自尚书郎领宪河朔会高阳阙守因摄帅事以诗寄之且觅蟹螯
1062751,秉之兄受代还京师余送行次甘陵雨三昼夜不止十二日乃雪平地几尺木压而折者十三四十五日既别秉之于南郭赋其事以寄王履道王时在大名
229909,龙图范给事以禫服向除修治茔域就山筑室因尔
575448,元夕开府杨公自范阳过访，赋事以谢 其三 登阴山
537593,李二丈给事以诗谢不赴看菊之约走笔倚和
1088334,淳熙戊戌七月二十九日与子晦纯叟伯休同发屏山西登云谷越夕乃至而季通德功亦自山北来会赋诗记事以云卧衣裳冷分韵赋诗得冷字
949470,一枝春 其二 越一日，寄闲次余前韵，且未能忘情于落花飞絮间，因寓去燕杨姓事以寄意，此少游“小楼连苑”之词也。余遂戏用张氏故实次韵代答，亦东坡锦里先生之诗乎
189496,蒙程伯寓知府给事以仆生祠妙唱见寄辄次韵奉
983388,蒙程伯寓知府给事以仆生祠妙唱见寄辄次韵奉酬
727406,读外舅一年所为诗因发箧出大人及两弟及罕儿诸作遍与外舅观之外舅爱钟铠诗至仿效其体爰询当事以外间所见诗派之异而喟然有感于斯文也叠韵见示当世仅次其韵略志当世所云云
700732,元夕开府杨公自范阳过访，赋事以谢 观灯火
575446,元夕开府杨公自范阳过访，赋事以谢 其一 观灯火
441885,故人询回城之事以诗答之
515793,弘治戊午春正月十三日舟次淳安春霖不止进士维扬张君凤举方知县事以灯节燕予酒后赋此纪事兼致谢意
964536,龙图范给事以禫服向除修治茔域就山筑室因尔书怀俾无择继和谨次用其韵
575447,元夕开府杨公自范阳过访，赋事以谢 其二 观梅花
334813,金陵僦舟·事以诗书立
882966,黄岩郑瀛子仙弱冠入太学五上书论时事以直闻于时老犹不衰客游海陵馆于余一月乃去作诗送之郑方谋少官田故有章末之戏
14918,到郡未浃日登西楼见乐天题诗因即事以寄
622204,既渡河车中即事以新旧见闻作古今愿怀诗八首 其八
699684,既渡河车中即事以新旧见闻作古今愿怀诗八首
1088362,卧龙之游钱通守得江字不及赋诗已解维矣熹用其韵纪事以赠并附卷末
972757,杨录事以仆与孙温叟唱酬韵作诗见贻又用仆与吴梦与诗韵作诗赠梦与兼以见及并次韵二首 其一
622200,既渡河车中即事以新旧见闻作古今愿怀诗八首 其四
1156759,太和戊申岁大有年诏赐百寮出城观稼谨书盛事以俟采诗
821302,西江月慢 月色新得寒琼遗迹八幅，皆设色花卉，秘藏箧中，但述其事。以自绘梅花笺乞题
835040,法曲献仙音 仲恕倩其夫人吴重画金带围故事以寿阶青，余艳而赋之
388186,李二丈给事以诗谢不赴看菊之约走笔倚和
18877,太和戊申岁大有年诏赐百寮出城观稼谨书盛事以俟采诗
833748,采绿吟 浦西园亭数处，裙裾常满，上春尤盛。友人话其事，以草窗自度曲写之
335858,用独乐园故事以雪水烹茶招彦章
1149329,馀杭周从事以十章见寄词调清婉难于遍酬聊和诗首篇以荅来贶
810152,山中春事以祠山风信为落梅时节 蝶恋花  蓟门晚春
352892,江西刘谋卿秀才以火焚其居谏长序其事以告袁吉故因题其后
622199,既渡河车中即事以新旧见闻作古今愿怀诗八首 其三
