365931,高阳台·同人邀集长丰山馆有序
486038,经汝弼叔故馆有感而作呈汝尚叔及彦常弟
566205,顾中舍壬辰之冬直文华殿书显灵宫碑而邸馆有雁集之未几承御笔题衔之宠若先徵焉索赋此咏一首
668419,初归检理停云馆有感
1042516,张三馆有前岁赴举时题字处作 其一
528837,子醇雨后陪宿道馆有赠
386734,江馆有怀王为善
604432,丁未立春日小憩窑头公馆有感 其二
598066,七夕承郭使君枉过于谢家池馆有诗见贻依韵奉答
795074,水龙吟 初夏避兵惠思三妗母栖凤馆有感，追和外祖母忆旧原韵
713987,奉母人泷州避难寓从弟之姻林氏馆有赋 其一
514774,下山憩昌平旧馆有怀李学士宾之
614060,偶过钟禹铸园馆有赋
60853,朝回宴李君小馆有怀
589442,秦少游馆有晁无咎先生石像掘土得之有赞
1042517,张三馆有前岁赴举时题字处作 其二
514919,视学归行庆贺礼毕初开史馆有诏以敏政为纂修官首
766525,高阳台 同人邀集长丰山馆有序
406528,巴黎咖啡馆有见
819783,过东方图书馆有感
372898,新移宴厅·魏藩池馆有唐风
222419,海康西馆有怀
315490,凭阑·晚晴公馆有馀閒
49649,和牧翁宿方给谏旧馆有怀孟阳
271863,过东方图书馆有感
181509,凤州·凤州山馆有清辉
453680,马王堆文物陈列馆有感
305361,六月二十六日雨香馆有所怀寄示韬园散释
721532,奉母人泷州避难寓从弟之姻林氏馆有赋
604431,丁未立春日小憩窑头公馆有感 其一
557188,冬至夜高子明陆子和子培舍弟集小馆有感时事
481996,朝回宴李君小馆有怀
690445,丁未立春日小憩窑头公馆有感
44088,巴黎咖啡馆有见
509595,次韵答刘主事昌出史馆有作见寄
713988,奉母人泷州避难寓从弟之姻林氏馆有赋 其二
987739,海康西馆有怀
1248200,雨馆有述
429666,六月二十六日雨香馆有所怀寄示韬园散释
873401,同詹明诚傅茂元游晞真馆有诗因次其韵
615828,初冬与仁伯代骧弟寓濠上馆有梅一株初露微蕊独一花先放娟好特甚因忆故乡梅园寄怀伍国开兄弟
1250977,江馆有怀王为善
595095,访石泉虚馆有感
471073,和牧翁宿方给谏旧馆有怀孟阳
629544,夜集乔云馆有妓
54478,经汝弼叔故馆有感而作呈汝尚叔及彦常弟
385185,初归检理停云馆有感
175713,同詹明诚传茂元游晞真馆有诗因次其韵
733846,过宣城馆有感
756,贺给事尝诣蔡起居郊馆有诗因命同作
544749,同詹东图康裕卿胡文父集胡上舍馆有赠
1165143,贺给事尝诣蔡起居郊馆有诗因命同作
1109669,张三馆有前岁赴举时题字处作
366179,张三馆有前岁赴举时题字处作
1210356,次韵元镇玄文馆有怀
