954026,戏答圣俞
400451,菩萨蛮 奉答圣陶尊兄
1026891,答圣俞设脍示客
954247,答圣俞
954093,奉答圣俞达头鱼之作
160059,答圣俞设脍示客
252869,菩萨蛮·奉答圣陶尊兄
137387,奉答圣俞宿直见寄之作
113420,奉答圣思讲论语长句
137931,戏答圣俞持烛之句
692413,太平圣德诗十章 正月十三日大祀天地先日车驾夙兴径诣南郊躬历神厨遍阅祭品申饬太常务精诚意是夕有司请如故事放烟火上曰朕方严对越岂暇嬉事敕免之已而阴云微布瑞雪纷集行事之际天气融和月星皎洁云飙净敛肃如神临此上天昭答圣敬也为敬天之诗第一
1026778,奉答圣俞寄鸭脚实见贻
137388,奉答圣俞岁日书事
954249,答圣俞莫饮酒
137366,和杨子聪答圣俞月夜见寄
137439,答圣俞莫饮酒
996180,奉答圣思讲论语长句
953738,奉答圣俞宿直见寄之作
649575,太平圣德诗十章 其一 正月十三日大祀天地先日车驾夙兴径诣南郊躬历神厨遍阅祭品申饬太常务精诚意是夕有司请如故事放烟火上曰朕方严对越岂暇嬉事敕免之已而阴云微布瑞雪纷集行事之际天气融和月星皎洁云飙净敛肃如神临此上天昭答圣敬也为敬天之诗第一
953670,戏答圣俞持烛之句
137625,答圣俞白鹦鹉杂言
1182306,奉使蒲州返辔奉答圣制
954248,答圣俞白鹦鹉杂言
137446,答圣俞·人皆喜诗翁
953737,奉答圣俞岁日书事
954200,杂言答圣俞见寄兼简东京诸友
137863,谁言答圣俞见寄兼简东京诸友
954078,和杨子聪答圣俞月夜见寄
137389,奉答圣俞达头鱼之作
