1208946,江浙省段照磨吉甫于予为同年友至顺癸酉会于吴门今春书来寄近诗十馀首遂和其次韵张伯雨新居四绝句以答时同年吕仲实佥浙西宪并以柬之 其二
689593,再次韵答时旸饮后见贻
1235915,江浙省段照磨吉甫于予为同年友至顺癸酉会于吴门今春书来寄近诗十馀首遂和其次韵张伯雨新居四绝句以答时同年吕仲实佥浙西宪并以柬之
707689,秋日庚子答时人
925736,玉楼春 其二 客有游山者，忘携具，以词来索酒，用韵以答。时余有事不往
1208948,江浙省段照磨吉甫于予为同年友至顺癸酉会于吴门今春书来寄近诗十馀首遂和其次韵张伯雨新居四绝句以答时同年吕仲实佥浙西宪并以柬之 其四
388715,秋日庚子答时人
521549,数日不过东园澄夫先生有月桂诗见示且归功于封殖之厚次韵奉答时腊月朔也
544795,周元孚过访见赠奉答时元孚方有南都司马之擢
511254,读茂卿次韵呈定山先生诗有梦入罗浮之句用韵寄答时世卿在白沙
1062937,时可屡欲尝白酒会有客馈余因分以饷之既而惠诗讥酒器之隘因复次深字韵为答时可新买舞鬟甚丽而尚稚故云
604941,花朝雨中李自得以诗见访用来韵却答时哲嗣伯开随侍
1208945,江浙省段照磨吉甫于予为同年友至顺癸酉会于吴门今春书来寄近诗十馀首遂和其次韵张伯雨新居四绝句以答时同年吕仲实佥浙西宪并以柬之 其一
479038,再次韵答时旸饮后见贻 其一
51081,再次韵答时旸饮后见贻
543653,金坛邓孺孝以易诠见寄赋答时舟过京口
539091,敬美需次不调于秋夜倡和有庾公南楼之思走笔为答时予有岭右命
410578,避暑皖公别墅之萸舫墅为程学启祠园曰惠荫叠石奇古邀晓浦痛饮越日晓浦诗来挥翰奉答时晓浦有调江宁推官之讯冀其不往也
479039,再次韵答时旸饮后见贻 其二
1208947,江浙省段照磨吉甫于予为同年友至顺癸酉会于吴门今春书来寄近诗十馀首遂和其次韵张伯雨新居四绝句以答时同年吕仲实佥浙西宪并以柬之 其三
