114461,答许觉之惠桂花椰子茶盂
712003,送梁言公之惠州
939238,去冬因元镇有见怀诗草草用韵录上并谢妙药名墨之惠
982463,次韵罗正之惠绵扇
236484,文性之惠蛤蜊绿橘
997213,答许觉之惠桂花椰子茶盂二首 其二
665707,送人之惠州
852010,文领相仍意虑烦浊聊携野策独访山园因睹霜柏亭残梅忆公向时有诗酒之惠感物成诗缮写拜呈知府龙图谏议吴公
507056,送陈颜太守之惠州
92932,寄怀尤延之·惠山一别十年强
336671,潘择之惠合溪芦菔种
1247459,酬答启东明上人诗画之惠
1204524,阮郎归 奉使由平泺之惠州山行
713461,新安罗廷锡见访五羊翌日拜茗碗春茶之惠率尔赋谢
1026246,予会宾答微之惠诗
663500,冯吕梁惠诗率尔酬赠兼谢药草之惠
383705,春日承苏岱髯长史寄问赋此奉酬并谢药饵之惠
925991,添字浣溪沙/山花子 其一 用前韵谢傅岩叟瑞香之惠
1054287,介之惠诗言斥于礼部欲自此高退山园且招予游故答此章
1031724,答王立之惠书
689047,送汪十三南湘之惠州
907295,送荃翁张端义之惠阳
189788,次韵罗正之惠绵扇
673569,送陈永祥之惠州太守
971913,谢莫升之惠茶
122297,次韵施进之惠紫芝术
643248,题马文学之惠安教谕
1095371,酬秋塘古诗之惠
553015,次韵答冯道常谢毡袜之惠
320527,介之惠诗言斥于礼部欲自此高退山园且招予游故答此章
659035,秉之惠巾制甚奇似东坡而小异老夫之所宜戴也赋诗谢之
996611,次韵王炳之惠玉版纸
330832,次韵得之惠笋
848171,又次韵谢王立之惠红丝花
378329,谢性之惠茶
114604,次韵王炳之惠玉版纸
525235,谢顾新之惠绿萼梅
1097440,宗之惠梅窠水玉笺
113735,谢王炳之惠石香鼎
102748,谢苏自之惠酒
914914,谢蜀帅刘仲洪尚书龙学遣骑诒书之惠
997229,谢王炳之惠石香鼎
568623,谢何登之惠玉兰
553043,谢五河孙驿丞鱼酒之惠
1025614,李编修器之惠诗卷
624317,别黄履谦之惠州
712548,晤杨春州止庵于五羊翌日拜良酝之惠赋此奉谢
113933,谢王炳之惠茶
973488,谢李正之惠潘墨
1231774,风雨连日闭户默坐怀思可知忽翠涛轩以笋蔬之惠走笔答之
628012,送黎雨亭再之惠州
716219,送季子之惠阳
628287,送汪十三南湘之惠州 其二
712815,送季伟公之惠州
48447,佩之惠笋干自称玉版老师谓原博冬笋为吴山少
92931,寄怀尤延之·惠山孤绝未为孤
98725,谢莫升之惠茶
1126928,答许觉之惠桂花椰子茶盂二首
1218889,谢王左丞鹅酒之惠
347419,又次韵谢王立之惠红丝花
997214,答许觉之惠桂花椰子茶盂二首 其一
642350,送马文学之惠安教谕
244660,送荃翁张端义之惠阳
160024,予会宾答微之惠诗
174897,李编修器之惠诗卷
98728,谢李正之惠潘墨
90832,谢赵行之惠霜柿
1044245,梁贶之惠酒分饷张伯常朝议
606163,秋初答林园相诗酒之惠二首 其二
628288,送汪十三南湘之惠州 其三
650975,次韵酬钱信之惠诗
642964,送人之惠安教谕
914910,谢赵行之惠霜柿
547795,春日承苏岱髯长史寄问赋此奉酬并谢药饵之惠
855108,县境不雨数遣比丘祷佛于庙祀龙于社皆不雨闻龙居响潭水中往潭湄刑鹅而祀之初崖月微明有风飒然动衣袂祀竟云物出雨态生已而遂雨然岁丰时和盖造物者之力而龙之惠也至前此不雨乃令之无状所召尔县之诸儒反为歌诗以雨归令甚无谓聊作一诗奉报
1076456,谢祁居之惠桃竹杖
103329,马都官行之惠黄柑荔枝醋壶
991796,马都官行之惠黄柑荔枝醋壶
807843,贺新郎  中秋伏枕承蘧庵先生有月饼果物之惠病起赋谢
1215461,谢秋巘杭笔之惠公乃故赵忠靖
628286,送汪十三南湘之惠州 其一
285021,次韵和王君梦僧赠诗并酬枉顾之惠
920337,谢苏自之惠酒
956973,次韵施进之惠紫芝朮
575038,新晴出郊之惠山
1246351,寒夜忽然有怀周紫岩先生遂成口号奉寄且以酬黄柑之惠
103519,答祖择之惠黄雀鮓
67142,谢南阳王大人以手札见讯兼有巾箑之惠
354247,宗之惠梅窠水玉笺
1137570,文性之惠蛤蜊绿橘
514729,淮安韩太守太经韩同守宗鲁迭饯且有新舟之惠
1074828,潘择之惠合溪芦菔种
711453,席上刻韵与王楚臣赋送王羽左之惠州
628032,送黎雨亭之惠阳时余将有琼州之行
983901,惠相之惠顾渚芽答以建茗
993285,答祖择之惠黄雀鲊
685931,秋初答林园相诗酒之惠二首
237890,又次韵谢子立之惠红丝花
1071013,次韵得之惠笋
179617,惠相之惠顾渚芽答以建茗
997230,谢王炳之惠茶
920441,求焦千之惠山泉诗
839939,次韵和王君梦僧赠诗并酬枉顾之惠
772328,三月朔日，自台湾放舟至澎湖，忽遇北风，舟南驶不可收，越两日夜达粤东之惠来，乃舍舟登陆，间道至潮州，偕方子步琛登江楼小饮，凭槛有作，寄颖斋观察
652468,谢南阳王大人以手札见讯兼有巾箑之惠
94275,谢蜀师刘仲洪尚书龙学遣骑诒书之惠
480197,佩之惠笋干自称玉版老师谓原博冬笋为吴山少俊叠韵奉谢
1040775,谢朱厚之惠米
164793,答王立之惠书
606162,秋初答林园相诗酒之惠二首 其一
537010,德甫数辱解衣之惠而负约不来乃成此赠
1064156,谢性之惠茶
715016,送许氏昆弟之惠阳
