742827,赠孟岩枢部兼怀耕亭前辈即次孟岩寄怀舫西原韵 其一
782771,题画壁和同年子毛秋岑原韵 其一
838265,和郭士梯感怀原韵 其一
790986,寿张少泉先生七十即用其自寿原韵 其一
428511,恭和夫子大人榆林留别士民之作敬步原韵 其一
755027,次夫子清明日双桥新寓原韵 其一
838894,和施耐公六十初度见赠之作并次原韵 其一
410648,代友人和张野秋侍郎戊戌秋感原韵 其一
784041,和古樵郭明府见寄原韵 其一
734950,腊月同友寻梅道上登天秀岩和薛中丞叶太傅刻石原韵 其一
838843,步赵云石代某姬送别原韵 其一
838948,和陈丈剑门见赠原韵 其一
783303,和叶某留别原韵 其一
731496,和樗仙题画扇原韵 其一
751369,追和梅树君芦花原韵 其一
838696,春草八首，和沈琛笙大使原韵 其一
838938,和陈丈剑门新秋偶兴呈菽庄主人原韵 其一
838907,和陈忏真原韵 其一
426323,陈以光先生以韵和叶老七律一首相示勉和二首，一步原韵，一倒原韵 其一
838038,咏梅八首和贡觉原韵 其一
428518,敬和荫乔老世兄留别榆林士民之作即步原韵 其一
774290,和梅轩叔原韵 其一
425654,和星叔舟游鹅鼻山下归赋四绝原韵 其一
782458,秋雨不止步海涵百龄原韵 其一
803359,恭和荫乔老先生留别榆林士民之作敬步原韵 其一
839115,和贡觉除夕原韵 其一
825854,近卫文麿公爵招宴星冈茶寮小田切万寿之助即席赠诗次其原韵 其一
411110,和丁以某先生除夕原韵 其一 时客莱阳
742300,下第后侍家大人归里彡石叔有感赋二律即次原韵 其一
838652,和罗邵棠大令见怀蒋梓舒原韵 其一
426318,淮阴陈以光先生以七律四章相赠，敬步原韵 其一
838852,和福建西路观察使吴芝青留别原韵 其一
839137,春日次蟫窟主人原韵 其一
740819,度仙霞岭步周栎园壁间原韵 其一
428504,恭和荫乔老先生留别榆林士民之作敬步原韵 其一
838346,和哭盦道人易实甫观察台舟感怀原韵 其一
428516,遍地兵戈战垒屯阎甲斌奉和杨荫乔先生留别榆林士民之作原韵 其一
582909,奉和都台忧水患诗即次原韵 其一
776676,次徐树人七十述原韵 其一
838885,和耐公送关介堂原韵 其一
793469,汪清纯夫子题唐六如课儿图七绝三首命步原韵 其一
784535,送别易公仙南赴浙江署即次留别原韵 其一
409002,步周紫庭落叶原韵 其一
838533,癸卯乡闱分房襄校，和同乡虞和甫锁院述怀原韵 其一
838995,和林兵爪先生别李丽君原韵 其一
424986,师郑邮示诗史乙集刊成自题二首次原韵 其一
843270,甲午天津杂感和姚慕庭先生原韵 其一
633832,和王宪长入海幢原韵 其一
416195,忆汉月 槟城八景和陈少苏内兄作，并次原韵 其一 关角夜月
746674,东坡定惠院月夜偶出叠韵诗汪均之得其手稿墨迹二首共一纸纸残一角虞山钱宗伯补以细字叠东坡原韵 其一
601282,答五羊梁存吾区白斋诗笺遂和原韵 其一
455693,观荣宝斋藏李晴江风竹图依其题诗原韵 其一
759815,答敬南见赠，次原韵 其一
409738,丁巳季春之初，登中校爱景亭有感，次闻源原韵 其一
1056767,呈知府内翰即次原韵 其一
838313,和赵玲史除夕即事原韵 其一
787062,春忆杂诗次渔洋先生上巳辟疆招同邵潜夫陈其年修禊水绘园八首原韵 其一 斗姥阁道院
412187,感奋书怀八首，用蒋贞金先生五十述怀原韵 其一
676105,九日感兴次元遗山九日读书用陶靖节原韵 其一
836467,与韦镜秋上舍话旧，即次其即事原韵 其一
712428,题忆雪楼江山无尽图送紫诠王使君之官川南次留别原韵 其一
838690,杨花五首，和沈琛笙大使原韵 其一
754615,闻唐陶山明府重修桃花庵感赋用原韵 其一
843403,和散原游桐庐至七里泷钓台作次原韵 其一
787136,全閒居八首用紫琼道人春日园居杂咏原韵 其一
838863,再和沈琛笙五日有感原韵 其一
717394,奉和龚蘅圃驾部偕诸公游光孝寺出城访长寿精舍之作次原韵 其一
775661,次吴厅尊留别原韵 其一
783196,咏落叶敬步御制原韵 其一
838511,再和徐展云先生重九登石门岭原韵 其一
408101,四时闺咏和翠娜即次原韵 其一
405084,步鲁实先教授朱梅四绝原韵 其一
596208,吊达奚司空次苏应机原韵 其一
839133,游马达山，和贡觉原韵 其一
743052,立夏后二日伍尧侍讲招游极乐诸寺饭万泉庄复过圣化寺小憩而归即次原韵 其一
838335,和祁阳陈仲英观察感时示诸将原韵 其一
782960,前题再叠原韵 其一
625126,闺怨一百首次孙西庵原韵 其一○○
783204,答明惺斋招隐沧洲原韵 其一
783320,和同年卢都转雅雨红桥修禊原韵 其一
839093,落花，和贡觉原韵 其一
783270,邯郸梦和屈北雄原韵 其一
760289,拟杜诸将五首用原韵 其一
728681,和阮亭《秋柳》诗原韵 其一
769091,壶中天·江亭寓中寄题张进士奕山学圃居即次原韵 其一
537812,题项子曲池草堂用原韵 其一
717392,奉答方誉子枉顾草堂留赠之作次原韵 其一
838930,和施耐公感兴原韵 其一
838632,秋怀八首和邱仙根工部原韵 其一
740746,和顾牧原舟中见寄原韵 其一
808954,追和程春海先生橡茧十咏原韵 其一 种树
838581,和易实甫观察原韵 其一
774160,再叠台江杂咏原韵 其一
782958,和白鹤亭送无凡上人结茅盘山原韵 其一
782737,石琴步屈悔翁原韵 其一
831957,和绍尧病酒见示原韵 其一
411439,和张国乔校长苦雨诗原韵 其一
755099,和外见赠原韵 其一
429632,壬戌岁除蛰云约游翠微循故例也归后挑灯作此柬之用己未除日始游原韵 其一
838982,林健人游历东西洋归示诗，即和原韵 其一
411498,和同学汪君瑞芳原韵 其一
752607,拟陆士龙为顾彦先赠妇往返四首次原韵 其一
402594,和纫诗己酉生朝二首倒叠原韵 其一
769406,和友兰三姊杭州见怀原韵 其一
411370,和李啸楼先生三醉木芙蓉原韵 其一
645364,雪和苏长公原韵 其一
837371,和陈孟卿送春次原韵 其一
426849,和黄咏雩榄溪杂诗即用原韵 其一
830667,樊山有诗留别同社索和与乙庵同次原韵 其一
755284,小云妹见示寄怀诗即步原韵 其一
561437,大司成陆公枉驾钤山草堂予远寓金陵无缘攀迂感别增情作此寄谢次原韵 其一
407787,和聂公自寿依原韵 其一
792301,寿张少泉先生七十即用其自寿原韵 其一
625027,闺怨一百首次孙西庵原韵 其一
752320,板桥和题壁原韵 其一
753548,吴岩子徵和起句原韵 其一
404011,临江仙·再和石窗词长《米寿放歌》原韵 其一
461555,春日游曲江步少陵原韵 其一
401342,仿杜甫同谷七歌并用原韵 其一
659596,和寄丰太史原韵 其一
671130,乙卯春大人有文安之行送至京口大人用杨柳青青渡水人为韵赋七绝以别敬步原韵 其一
425949,夏初又承友寄怀七律两首再和原韵 其一
782962,前题三叠原韵 其一
783127,范兰亭索赠限梅岑送潘问奇原韵 其一
839097,落叶，和贡觉原韵 其一
415535,和熊鉴兄七十初度步原韵 其一
782865,答巢六国学世馨即用原韵 其一
