889035,余以庚寅十月十日抵敝庐今恰三年感而有作偶成三律 其二
1173771,夜听许十损诵诗爱而有作
662299,恭承诰封母赵为恭人进四品秩从家君贵也喜而有作二首 其一
507873,二月二十六日钦颁天花祥云瑞光图至自北京并秦中所献玄兔余忝署礼部事陪百官致辞称贺退而有作
963866,圣节日望拜黄牛祠前退读众碑感而有作
978678,王才谅归自临安备道群从内集之乐感而有作
585677,访李鳌峰别驾于西台遍观胜景乐而有作六首 其二 观海亭
1118656,初秋梦故山觉而有作四首
509501,成化己丑丁先人忧守制甫半载十二月二十日忽奉恩诏夺情起复进阶右都御史总督两广军务兼理巡抚上章辞免升秩乞留终制不蒙俞允感而有作
736393,彭无山给谏自河工召复原官喜而有作
250322,夜读仰斋先生红梅诗感而有作仍步原韵
1189947,车驾西游因而有作
655144,三月十二日肇开经筵岳以翰林旧僚叨侍讲读荐蒙燕赉感而有作 其一
746779,见燕营巢感而有作
424363,烛影摇红·宿雨初霁，偕天随天放两丈人重莅西兴鼓场，枨触前游，感而有作
296560,与蒋孝廉夜话归而有作
50630,自甲浦道太湖四十里见吴香诸山喜而有作
962004,菘苣初冬稍茂喜而有作
245289,余年二十馀即有二毛盖乱离间所致感而有作
544815,闻张助甫擢宁夏中丞喜而有作四首 其三
1111723,读丐辞不允诏书感而有作
660041,京口遇乡人闻得曾孙喜而有作 其一
862781,此日湖源回展叔颖书颇及往岁经行暨诸同志赏梅花之一笑急景相催又复几年感而有作因寄叔颖并呈子楚
138411,岩桂盛开感而有作
573162,德山闻长嫂去世恸念伯修感而有作 其一
1038979,病中得杜丞相见寄诗感而有作
672818,得邸报有异闻感而有作
544890,中丞萧公自关中来越喜而有作
1030825,梦介卿感而有作 其一
263269,甲辰秋，光炯为兴皖学，往来湘沪间，与予晤皖上，江头对饮，感而有作，依韵和之
1054605,端午同子宣平岚榭晚酌望南山而有作
744283,闻川楚捷音喜而有作 其一
781003,蜀中试院乃故蜀宫殿也感而有作
1030744,丐祠得请喜而有作示介卿 其一
742336,丙子岁初出门见有短衣揖让者继凶年之后得此感而有作 其一
540826,再过金山未得登览舟中望而有作
522212,十一日晚登舟已大醉夜梦读书喜而有作
1131801,丐祠得请喜而有作示介卿
698215,闻捷后值雪喜而有作二首用韵柬宾之
743449,颍州道中阅邸报读弇山中丞辟雍诗及留漕疏稿喜而有作 其二
889405,巢内燕园中鹿俱生子喜而有作
663570,出黄山村遇霍子闻郡守章柳庵将至灵岩喜而有作
298264,和六给谏除夕前一日得雨喜而有作原韵
1194162,同陆太祝鸿渐崔法曹载华见萧侍御留后说得卫抚州报推事使张侍御却回前刺史戴员外无事喜而有作三首
655142,三月九日圣驾幸学先是阻雨改卜适际晴和侍从观礼喜而有作 其一
556370,家僮自野田携黄菊二株至轩中感而有作三首 其三
663681,七夕夜雨送父回家感而有作
698585,家僮自野田携黄菊二株至轩中感而有作三首
653193,正统戊辰闻福建感而有作
935098,中夜睡觉两目每有光如初日历历照物晁文元公自谓养生之验予则偶然耳感而有作
810262,舟泊长沙喜而有作
649201,夏日馆閤假寐梦澹庵写竹笔势翩翩以求余题觉而有作
607973,舟返三河见诸得举者归内有黄生继章乃宪副及泉公之令子予之姻家也喜而有作
275995,闻川楚捷音喜而有作
844136,在捒连日淫潦，欲归不得，忽逢晴霁，喜而有作
283997,喜而有作·东晋兼南宋
585679,访李鳌峰别驾于西台遍观胜景乐而有作六首 其四 面壁亭
510256,书易隐求铭旌后感而有作 其二
286122,九日石堂峪力疾登高适王兰谷遣使遗鲑菜江洲白衣遂复同之喜而有作
932581,定拆号日喜而有作
538718,久不得于鳞书书到得新诗数章喜而有作
278877,甲戌十一月二十三日以出席苏省一区社会教育研究会将之广陵喜而有作
268611,八声甘州·上龈牙脱，仅存一枚，独力支唇，闷而有作
556368,家僮自野田携黄菊二株至轩中感而有作三首 其一
280841,喜而有作·篱门犬吠故人来
232258,客观余孝经传感而有作
384194,十一月朔，偶忆庚戌是日出京，感而有作
1250792,十月一日得南京音信喜而有作
138460,戊子春术者刘五星谓予寿有八十一感而有作二
466872,游大溪慈湖，见蒋氏塑像麋集山下，计有数十尊之多，归而有作
935785,初秋梦故山觉而有作四首 其一
522098,看牲回闻赐迎驾衣喜而有作
518069,四月二日因公出诣城隍庙行香同高判簿郑长司黄广文及儒士钟子常坐庙门之下观一邑境内之溪山喜而有作 其一
453654,读熊社派衍西江责岂辞之句奋而有作
1111812,余壬戌春校试进士同事者五十五人至戊子岁因阅小录所存者止四人感而有作二首
400080,临江仙 梦与草衣小画舫斋听曲，醒而有作
509678,桂江舟行见各山畬田广开蛮夷残孽持兵供役夹道拜迎视往年处处益多喜而有作 其一
1084491,望天台赤城山感而有作
812016,颍州道中阅邸报读弇山中丞辟雍诗及留漕疏稿喜而有作
280507,喜而有作·佣耕奉母岂能贤
674061,陈情归觐得如所请喜而有作
817229,读吴梅村宫詹萧史青门引感而有作
866260,戊戌冬仆客桂林雪中赵叔愚书张司业逢贾岛绝句为寄今冬对雪感而有作
428397,过天山绝顶老虎口至冰川，风雪大作，云生双袖，感而有作
695373,游清河经黄河感而有作四首
686503,恭承诰封母赵为恭人进四品秩从家君贵也喜而有作二首
84566,定拆号日喜而有作
751780,十一月二十八日移入任城梦园是日为王宜人忌日感而有作
813754,丙子岁初出门见有短衣揖让者继凶年之后得此感而有作
658975,得孙喜而有作
1158008,以纱巾寄鲁望因而有作
844226,诸子同过草堂喜而有作四首
1084343,闻韩帅世忠退保丹阳远近忧惧州县议结乡兵以备不虞闾巷少年贯弓走马若有得色感而有作
368304,闻幼槃弟归喜而有作
836523,在捒连日淫潦，欲归不得，忽逢晴霁，喜而有作 其二
815981,长相思  寄迹荒坞一月感而有作
583196,长至寓徐州是日晴明喜而有作
544814,闻张助甫擢宁夏中丞喜而有作四首 其二
835812,八声甘州 上龈牙脱，仅存一枚，独力支唇，闷而有作
581008,闻见素先生谢事归莆阳喜而有作
831727,诸子同过草堂喜而有作四首 其一
1025626,连日得杂花数株艺之池亭感而有作
514920,十二日初开经筵赐宴及白金綵币宝镪感而有作
568416,初试羊㲨予有一端藏笥中者十年兹教内馆始制为衣以禦北风感而有作
589504,阅都御史林念堂宗藩奏疏御史陈青田大征檄文咸用余通纪治安策感而有作
585678,访李鳌峰别驾于西台遍观胜景乐而有作六首 其三 仁智堂
935784,初秋梦故山觉而有作四首 其三
698245,三月九日圣驾幸学先是阻雨改卜适际晴和侍从观礼喜而有作
660346,两峰亲家枉顾喜而有作且申款留之意
569489,舒司马要饮天妃宫后桥亭水月佳甚畅而有作 其一
1186134,山路见梅感而有作
510533,虽乏向用之才忝有晦藏之地引步朱陵寄怀青玉李拾遗徵之不至上疏何为张乖崖救火事严徒劳分争因而有作
831445,舅氏过海相访感而有作
