831757,五月一日沧玉、锡祺、笛亭、槐庭、藻云及舍侄仲衡集予无闷草堂，喜而有作 其一
836522,在捒连日淫潦，欲归不得，忽逢晴霁，喜而有作 其一
831730,诸子同过草堂喜而有作四首 其四
764960,满江红 其三 再叠前韵寄吴虞升。虞升北上后终日惘惘，昨得淮阳书，缕缕千言，情逾骨肉，感而有作
280792,舅氏过海相访感而有作
428248,甲戌十一月二十三日以出席苏省一区社会教育研究会将之广陵喜而有作
501126,重登凤凰台献歌奉进时岁丙午剪除群凶殆尽喜而有作
749857,得上海李梯云书中述吾友南汇张啸山语感而有作
661103,戊寅春分日祀先礼毕奉大人合宴于中堂喜而有作
1072988,县尉任子严出示从军陪大将吴侯游石峒五绝句奉次元韵颂日颂平贼之功喜而有作云 其二
518076,祖印院荒废无僧仅有道人焚脩屋宇漏损予命工瓦以覆之垣以缭之惟存孤松双柏苍然凌云感而有作
177936,登郡南楼望山感而有作
414449,晚步归而有作
1072989,县尉任子严出示从军陪大将吴侯游石峒五绝句奉次元韵颂日颂平贼之功喜而有作云 其三
859435,夜梦与和甫别如赴北京时和甫作诗觉而有作因寄纯甫
518070,四月二日因公出诣城隍庙行香同高判簿郑长司黄广文及儒士钟子常坐庙门之下观一邑境内之溪山喜而有作 其二
1055878,苏子瞻因胶西赵明叔赋薄薄酒杜孝锡晁尧民黄鲁直从而有作孝锡复以属予意则同也聊以广之 其二
1161669,同陆太祝鸿渐崔法曹载华见萧侍御留后说得卫抚州报推事使张侍御却回前刺史戴员外无事喜而有作三首 其三
935816,吾庐东北皆修竹茂木羽族来栖者不可数计感而有作
662300,恭承诰封母赵为恭人进四品秩从家君贵也喜而有作二首 其二
1072990,县尉任子严出示从军陪大将吴侯游石峒五绝句奉次元韵颂日颂平贼之功喜而有作云 其四
519763,闻余士英都宪凯旋喜而有作
638409,游清河经黄河感而有作四首 其三
880432,观沧浪亭石感而有作
660097,教授舅还自蜀遇于越城喜而有作用前韵
79669,久旱忽大雨凉甚小饮醉眠觉而有作
76406,春夏雨阳调适颇有丰岁之望喜而有作
1072692,新学□□□落成释奠诸生毕集喜而有作
781120,寄和常理斋四弟二十一首 其一 接来书得诗稿喜而有作
561268,徐养斋方棠陵偕至喜而有作用王浚川韵
918192,余于汪推官别墅睹壁间蜀道山水欲赋未能一夕忽梦如所见而有作觉记门字韵一联就枕上续之
96621,教授丈作黄字韵诗十首愈出愈奇而有作法孰为
935783,初秋梦故山觉而有作四首 其二
585676,访李鳌峰别驾于西台遍观胜景乐而有作六首 其一 见日亭
428371,香港一九九七年回归祖国，长城勒铭，感而有作
480277,闻刘东山司马致仕之命是日得谢方石祭酒到家日所寄诗感而有作
63256,崇藩邸中莲花盛开感而有作
918193,余年二十馀即有二毛盖乱离间关所致感而有作
138461,感而有作·多少同年尽溘然
702175,访李鳌峰别驾于西台遍观胜景乐而有作六首 见日亭
816951,寄和常理斋四弟二十一首 接来书得诗稿喜而有作
934935,九月十六日夜梦驻军河外遣使招降诸城觉而有作
389403,凤凰台上忆吹箫·晚坐南道宫纳凉吊影凄然感而有作
583454,舟过苏州齐门见娄江三尸浮露感而有作录似林思绍太守思绍以御史作郡于苏
139119,开河毕功喜而有作
676179,二月十五日予卧病杜门忆前月是夕开宴湖上感而有作
347050,郭五琴夜吹箫予被酒偃卧讶曰此何声休和若是答云此北正宫调也感而有作
569490,舒司马要饮天妃宫后桥亭水月佳甚畅而有作 其二
465534,摸鱼儿 锡三兄寿筵席上得闻仲坚虽赋弓招，无心出岫，不久返津，喜而有作
585681,访李鳌峰别驾于西台遍观胜景乐而有作六首 其六 瑞光堂
1084348,昔与南浦刘谦仲大梁孙子尚游自刘死横阳孙亦有浙西之役交旧零落为之慨然感而有作
728886,二月十四日喜而有作
241417,梦介卿感而有作
80521,荞麦初熟刈者满野喜而有作
287768,闻著涒社重开之讯喜而有作
638407,游清河经黄河感而有作四首 其一
674920,舟至河西务喜而有作
1062791,读李生诗爱而有作
742337,丙子岁初出门见有短衣揖让者继凶年之后得此感而有作 其二
931944,初报嘉阳除官还东湖有期喜而有作
413323,闻罢兵受降喜而有作四首存三 其二
199875,王才谅归自临安备道群从内集之乐感而有作
1092496,易地湖外喜而有作
831759,五月一日沧玉、锡祺、笛亭、槐庭、藻云及舍侄仲衡集予无闷草堂，喜而有作 其三
511203,容彦礼率诸弟同在馆下彦昭彦礼彦贞相继而逝彦潜今又卒感而有作
587247,海行因仆夫夜行而歌喜而有作
516057,偏桥分司与王少参读陈简斋诗感而有作
1072991,县尉任子严出示从军陪大将吴侯游石峒五绝句奉次元韵颂日颂平贼之功喜而有作云 其五
479181,四月五日微雨免朝与李太史世贤步出皇城门喜而有作
888217,予谪居荆南赋诗百馀篇书为两轴丙戌夏泛舟归润道由汉阳廖明略邀予饮于郎官湖因携示之明略坚欲抄录会予舟行甚速期以他日见归不幸明略死矣此本不复可得今将可记者录之忘者将复乞于渚宫诸友然平生作语老不自已又安用如许污后人耳目乎因感而有作
9192,山路见梅感而有作
83831,初报嘉阳除官还东湖有期喜而有作
413324,闻罢兵受降喜而有作四首存三 其三
622877,十五发鼍江之百宜喜诸山不染腥尘而有作
760927,去岁往长乐劝学，今闻学堂已开，喜而有作
352658,端午同子宣平岚榭晚酌望南山而有作
275999,喜而有作·汉水奔流急
732530,读吴梅村宫詹萧史青门引感而有作 其一
683416,舒司马要饮天妃宫后桥亭水月佳甚畅而有作
406287,旧友二三相逢海上席间偶谈时事嗒然若失为之衔杯不饮者久之或问昔年走马章台痛饮狂歌意气今安在耶因而有作
672250,潮州会胡允承佥宪喜而有作兼柬丁师孟大参皆旧同寅
732531,读吴梅村宫詹萧史青门引感而有作 其二
26435,车驾西游因而有作
138267,读丐辞不允诏书感而有作
526881,长沙分司竹桂橘三植皆南州高品感而有作时虞逆瑾见害三首 其一
929519,秋旱方甚七月二十八夜忽雨喜而有作
353660,得禁中花喜而有作
863687,登郡南楼望山感而有作
889407,得三七舍侄书云二月二十五日同族人至湖山赏海棠花枝繁丽宛如神仙窟宅感而有作
661323,闻圣驾已次临清喜而有作
753150,夜半得卸灌县信起而有作
1211531,扬帆松江甚驶西望吴诸山快而有作
1131796,梦介卿感而有作
247745,临江仙·梦与草衣小画舫斋听曲醒而有作
509679,桂江舟行见各山畬田广开蛮夷残孽持兵供役夹道拜迎视往年处处益多喜而有作 其二
888636,戊子春术者刘五星谓予寿有八十一感而有作二首 其一
889257,岩桂盛开感而有作
976693,中秋月蚀邦人鸣钲救月不约而齐中原旧俗犹有存者感而有作 其二
507692,除夕宿汝宁僧舍闻停止夫役喜而有作
7210,夜听许十损诵诗爱而有作
581888,予三十年前曾寄学乐昌后以道远之故得公牒移复本邑兹因川行道出前地感而有作二首 其二
440342,游大溪慈湖，见蒋氏塑像麋集山下，计有数十尊之多，归而有作 其二
889036,余以庚寅十月十日抵敝庐今恰三年感而有作偶成三律 其一
468229,寄北行过相思岭因而有作
579410,仲冬念一日寓东桥梦先姊宛然如生感而有作
888688,余壬戌春校试进士同事者五十五人至戊子岁因阅小录所存者止四人感而有作二首 其一
1111750,余以庚寅十月十日抵敝庐今恰三年感而有作偶成三律
844253,五月一日沧玉、锡祺、笛亭、槐庭、藻云及舍侄仲衡集予无闷草堂，喜而有作
674974,冬日奚兰室老友见访喜而有作
750012,访师白丈于帆山寓舍剧谈竟夕感而有作
799498,入冀州境就野人闻吴公断狱事喜而有作
283996,喜而有作·仁者终无敌
704068,桂江舟行见各山畬田广开蛮夷残孽持兵供役夹道拜迎视往年处处益多喜而有作
895042,闻沈元用帅南海喜而有作
508627,祷雨恒岳甘澍应期喜而有作
653782,于景瞻宅赏牡丹花时已过感而有作呈诸公属和 其一
720620,桂枝香 岁端午，予年六十有一，腊月之十日恭遇慈大人生辰，适见第五儿啊需以是日举，喜而有作
139327,余以庚寅十月十日抵敝庐今恰三年感而有作偶
623333,感张平子四愁诗而有作
241570,丐祠得请喜而有作示介卿
888635,戊子春术者刘五星谓予寿有八十一感而有作二首 其二
1092480,予顷岁持节湖湘今二十四年白首重来亲旧十无二三感而有作
1111785,戊子春术者刘五星谓予寿有八十一感而有作二首
818720,雨晴访芸生归而有作，因赠并寄寰尘
829963,忆江南·蜂雕窗纸，孔密如纱。喜而有作，调寄忆江南
863019,乙酉闰八月二十一日出南城游岘山壁间读东坡诗感而有作
1062644,闻幼槃弟归喜而有作 其二
556369,家僮自野田携黄菊二株至轩中感而有作三首 其二
80512,秋旱方甚七月二十八夜忽雨喜而有作
241576,东归喜而有作
151060,菘苣初冬稍茂喜而有作
1251339,讲堂前右植石榴左植脩竹是年蝗灾竹为所食石榴味苦感而有作
931357,仲夏小旱方致祷忽大雨连日江水为涨喜而有作
863329,独酌自吟拙诗次吏报转运使到郡戏而有作
659063,闰中秋观月仍两度生辰喜而有作
368337,喜而有作·风雨多年不对床
1218504,见乞食者日多感而有作
655146,岁暮祫祭大礼肇行骏奔之馀喜而有作
524456,除前五更闻习仪鼓角感而有作二首 其二
573215,雪中看山二仲呈诗一章后来似亦粗能者喜而有作
492622,大赦后一日出京城闻崇庆王太守子启自和州屯所携其佳儿南归喜而有作
138260,巢内燕园中鹿俱生子喜而有作
1210387,读元次山集感而有作
511224,邸报刘亚卿先生以今冬十月得请还东山喜而有作
538461,遇于鳞人云当上计台使留为代报喜而有作
655145,三月十二日肇开经筵岳以翰林旧僚叨侍讲读荐蒙燕赉感而有作 其二
283995,闻罢兵受降喜而有作
509435,迎亲道中得报喜而有作
702966,京口遇乡人闻得曾孙喜而有作
800083,被命修一统志先师司寇公完书也感而有作三首 其三
526882,长沙分司竹桂橘三植皆南州高品感而有作时虞逆瑾见害三首 其二
978901,有客自关外来颇道边亭暴露之苦时子止兄方趋原上予因感而有作
544816,闻张助甫擢宁夏中丞喜而有作四首 其四
730863,栈中与西藏贡使同行感而有作
1184348,奉使岐下闻唐弘夫行军为贼所擒伤而有作
480862,虏使再至喜而有作
704269,长沙分司竹桂橘三植皆南州高品感而有作时虞逆瑾见害三首
1082664,戊辰夏热澹庵为设招凉感而有作
524455,除前五更闻习仪鼓角感而有作二首 其一
831728,诸子同过草堂喜而有作四首 其二
755889,阶下梧桐忽然半枯感而有作
388299,读吴梅村宫詹萧史青门引感而有作
42478,书法中最喜黄庭坚笔意因而有作
301771,过天山绝顶老虎口至冰川，风雪大作，云生双袖，感而有作
1106642,县尉任子严出示从军陪大将吴侯游石峒五绝句奉次元韵颂日颂平贼之功喜而有作云
936498,荞麦初熟刈者满野喜而有作
682007,宏治癸丑岁初会饮，止有八翁，次年第二会予邀方伯李公入社，共成九老。喜而有作，时年七十有一
1030755,东归喜而有作
188697,同工曹至临洛道中禾黍蔚然喜而有作呈朱令
863090,邻僧以木龛养蜂一日坠地僧见蜜积燎烟薰蜂蜂大骇散因割取几尽适睹此事感而有作
660042,京口遇乡人闻得曾孙喜而有作 其二
1230104,将归望云中喜而有作
544813,闻张助甫擢宁夏中丞喜而有作四首 其一
691807,除前五更闻习仪鼓角感而有作二首
1128734,闻幼槃弟归喜而有作
770529,郭五琴夜吹箫予被酒偃卧讶曰此何声休和若是答云此北正宫调也感而有作
784584,九日石堂峪力疾登高适王兰谷遣使遗鲑菜江洲白衣遂复同之喜而有作
353476,金鱼久不浮游喜而有作
1081251,过江郎岩下少驻感而有作
831760,五月一日沧玉、锡祺、笛亭、槐庭、藻云及舍侄仲衡集予无闷草堂，喜而有作 其四
324250,县尉任子严出示从军陪大将吴侯游石峒五绝句奉次元韵颂日颂平贼之功喜而有作云
654950,闻捷后值雪喜而有作二首用韵柬宾之 其二
693355,予三十年前曾寄学乐昌后以道远之故得公牒移复本邑兹因川行道出前地感而有作二首
30716,奉使岐下闻唐弘夫行军为贼所擒伤而有作
1089508,金鱼久不浮游喜而有作
830600,高阳台·题塔影经缘图卷。雷峰塔毁，出吴越小字刻经，陈仁先得残本补完，画图装卷，自题八声甘州有云：漫等閒、擎天梦了，任长空、鸦阵占茫茫。从今后、凭谁管领，万古斜阳。语甚悲壮。卷为邵伯絅所得，徵题。感而有作
810266,今年买得盆花喜而有作
384664,庚辰除夕西斋独坐阅壁间王孟端画竹自题洪武丁丒岁除夜作抵今一百二十四除夕矣感而有作
617515,过酌公逊夜得霖雨喜而有作
638410,游清河经黄河感而有作四首 其四
174978,连日得杂花数株艺之池亭感而有作
655143,三月九日圣驾幸学先是阻雨改卜适际晴和侍从观礼喜而有作 其二
280842,喜而有作·衡茆蠖屈寸心违
699491,德山闻长嫂去世恸念伯修感而有作
1070724,客有见馈温剂云可壮元阳感而有作
85646,去岁往长乐劝学今闻学堂已开喜而有作
544918,方伯滕公起任岭南喜而有作
288630,烛影摇红·宿雨初霁，偕天随天放两丈人重莅西兴鼓场，枨触前游，感而有作
255824,重阳旅中偶记二十年前二诗因而有作
1005887,寇攘之馀谷五斗才易一鸡衰老多病资血味以为养求之弗可得畜二母鸡自春抱育至夏百翼不减子美生理喜而有作
930506,久旱忽大雨凉甚小饮醉眠觉而有作
1000789,苏秀道中自七月二十五日夜大雨三日秋苗以苏喜而有作
323481,昔与南浦刘谦仲大梁孙子尚游自刘死横阳孙亦有浙西之役交旧零落为之慨然感而有作
49279,观习礼神乐观归而有作
1072987,县尉任子严出示从军陪大将吴侯游石峒五绝句奉次元韵颂日颂平贼之功喜而有作云 其一
177938,独酌自吟拙诗次吏报转运使到郡戏而有作
744284,闻川楚捷音喜而有作 其二
510255,书易隐求铭旌后感而有作 其一
935044,子虡当以十月离淝上喜而有作
241464,过鄱阳湖适遇便风湖面如镜喜而有作
268230,晚步归而有作
344800,百旃归自南海喜而有作
1132549,重阳旅中偶记二十年前二诗因而有作
510257,书易隐求铭旌后感而有作 其三
936810,偶得石室酒独饮醉卧觉而有作
659944,舟至直沽长子正来迎喜而有作时正自家来省先还至德州闻予得请复来迎也
749124,观黄淮交汇粮艘竞渡感而有作
668496,庚辰除夕西斋独坐阅壁间王孟端画竹自题洪武丁丒岁除夜作抵今一百二十四除夕矣感而有作
85300,东山重修景贤楼大忠祠次第落成喜而有作
515388,南山精舍理书一月得三万馀卷喜而有作寄王宗植
570980,过凤山祠屋感而有作
742338,丙子岁初出门见有短衣揖让者继凶年之后得此感而有作 其三
638408,游清河经黄河感而有作四首 其二
654949,闻捷后值雪喜而有作二首用韵柬宾之 其一
746864,复与弟饱因忆少时文酒之乐今褚菘塍国录吴和村二尹吴思亭别驾浦又垞明府胡仁圃孝廉徂谢久矣感而有作
54069,久雪忽晴喜而有作
800081,被命修一统志先师司寇公完书也感而有作三首 其一
80339,偶得石室酒独饮醉卧觉而有作
641829,诏赐民租喜而有作因次韵林泉
505373,北平白先生并四公子以诗文见寄喜而有作
581887,予三十年前曾寄学乐昌后以道远之故得公牒移复本邑兹因川行道出前地感而有作二首 其一
1030743,丐祠得请喜而有作示介卿 其二
583368,次韵答省参陈希伯进表过河间民心追恋感而有作
522431,十七夜闻诸孙读书喜而有作
521599,怡庵先生致政归喜而有作
789020,次牧翁新正二日偕河东君过拂水山庄梅花半开春条乍放喜而有作韵
973370,教授丈作黄字韵诗十首愈出愈奇而有作法孰为凉之句何耶因次韵以见窘
759788,东山重修景贤楼大忠祠，次第落成，喜而有作
317893,蜀中试院乃故蜀宫殿也感而有作
1161668,同陆太祝鸿渐崔法曹载华见萧侍御留后说得卫抚州报推事使张侍御却回前刺史戴员外无事喜而有作三首 其二
950349,秋日坐寐觉而有作
76363,初秋梦故山觉而有作
585152,闻举黜陟之典自谓幽辱无疑不意圣恩广大留佐辰府过望之外喜而有作
653783,于景瞻宅赏牡丹花时已过感而有作呈诸公属和 其二
1239486,至正丁酉冬昆山顾仲瑛会客芝云堂适时贵自海上来以黄柑遗之仲瑛分饷坐客喜而有作属余及陆良贵袁子英等六客同赋
1000531,登上封半山而雾大起叹而有作
323500,夜泊萧山酒醒梦觉月色满船感而有作
592520,杨州得小孙潘少承椷诗寄贺喜而有作
241770,秋日坐寐觉而有作
961795,渡淮喜而有作
655572,读罢枕上喜而有作
1113633,苏子瞻因胶西赵明叔赋薄薄酒杜孝锡晁尧民黄鲁直从而有作孝锡复以属予意则同也聊以广之
681329,次日大雨入夜喜而有作
521262,梦作朝退步至南亭诗有步入南亭路不难落花红衬紫苔斑之句感而有作
545932,参知洪公举骆侍御吴中丞朱比部同入贤祠喜而有作
280556,诸子同过草堂喜而有作
738559,予以康熙辛丑壬寅来热河寓徐文定公半山堂今三十年矣感而有作
582121,读史至苏武归国感而有作
660882,何孝子庐墓闻而有作
831758,五月一日沧玉、锡祺、笛亭、槐庭、藻云及舍侄仲衡集予无闷草堂，喜而有作 其二
664154,夜过印寺望镜光阁不遂登眺感而有作
343840,喜而有作·羊城南望是苍梧
526883,长沙分司竹桂橘三植皆南州高品感而有作时虞逆瑾见害三首 其三
1030824,梦介卿感而有作 其二
1232921,是春久阙膏泽而连日大风不见天日晚登西皋归而有作
432901,闻罢兵受降喜而有作四首存三
774295,和六给谏除夕前一日得雨喜而有作原韵
888978,开河毕功喜而有作
1030770,过鄱阳湖适遇便风湖面如镜喜而有作
1084936,元日冒雪赴天庆观朝拜既趋府拜表还舍饮屠苏酒因思去年元日亦不在家感而有作
431817,闻著涒社重开之讯喜而有作二首
410635,与蒋孝廉夜话归而有作
755258,望桂林山水喜而有作
440341,游大溪慈湖，见蒋氏塑像麋集山下，计有数十尊之多，归而有作 其一
831729,诸子同过草堂喜而有作四首 其三
565665,閒居多暇因集汉魏以来英哲高唱命曰诗言龙凤删述既成喜而有作一首
514927,得用光宗侄新安寄来书并禄命书一纸有劝予省人事谢应酬及早归之意时予得遣出城已三日矣喜而有作
728987,书法中最喜黄庭坚笔意因而有作
1124679,中秋月蚀邦人鸣钲救月不约而齐中原旧俗犹有存者感而有作
386077,临江仙·沈君嗣出所藏纳稼图见示，感而有作
373470,病中得杜丞相见寄诗感而有作
471616,久雪忽晴喜而有作
638394,承庄定山先生垂访平湖喜而有作
660453,小儿赘韩宅忽报弄璋喜而有作呈司寇亲家
1161667,同陆太祝鸿渐崔法曹载华见萧侍御留后说得卫抚州报推事使张侍御却回前刺史戴员外无事喜而有作三首 其一
809031,入关见雨膏润泽禾苗茂遂喜而有作
1089780,得禁中花喜而有作
749614,丁卯初夏薄游梨里南去二里许日鸭阑泾东西两小村有天随桥架其上即鲁望斗鸭阑也感而有作
888687,余壬戌春校试进士同事者五十五人至戊子岁因阅小录所存者止四人感而有作二首 其二
280506,五月一日沧玉、锡祺、笛亭、槐庭、藻云及舍侄仲衡集予无闷草堂，喜而有作
888780,客有善画者取予所和归去来辞图之成轴仍为老者写照于其间感而有作
976692,中秋月蚀邦人鸣钲救月不约而齐中原旧俗犹有存者感而有作 其一
759669,凤皇山下投宿文氏家，询之，盖信国公裔也，出其庐陵所刊族谱及公诗文集、自订年谱、遗像三、手书一幅见示，感而有作
150827,渡淮喜而有作
694441,书易隐求铭旌后感而有作
813381,闻川楚捷音喜而有作
1062596,南归渡江去家稍近喜而有作
789674,六月廿四日俗例荷花生辰，玄对斋有盘餐之约，雨不赴，瓶供花三蕊斋放，喜而有作
301799,香港一九九七年回归祖国，长城勒铭，感而有作
78397,仲夏小旱方致祷忽大雨连日江水为涨喜而有作
705906,薛子寿见示免官后诗感而有作
763430,长相思  其一 寄迹荒坞一月感而有作
276161,谒水月大师退而有作
520369,鸿门之会刘项之雌雄实决於此矣予过其地而想其大风之雄帐下之悲同一大梦也感而有作
1086864,六月乡城不雨祷赛无应得建康书一雨连半月至以望日丐晴感而有作
933625,夏秋之交久不雨方以旱为忧忽得甘澍喜而有作
55743,虏使再至喜而有作
583453,弘治十六年十二月二十五日午大雪二十九日寅止正月三日晚又雪至十六日或雪或止惟十五日尤异其雪花大者约广二三寸长亦如之见者莫不惊骇余时奉命在镇是日雨水节寒如冬至沿河冻合舟不能行屋檐积雪弥月不消不知天道竟何如也感而有作
792973,送诸老秋试感而有作
506048,二月七日舟过桃源先是连日风浪至日恬静因而有作
42559,二月十四日喜而有作
216148,夜梦与和甫别如赴北京时和甫作诗觉而有作因
935786,初秋梦故山觉而有作四首 其四
574988,吴星士道光来自许州闻其谈旧事感而有作
478563,自甲浦道太湖四十里见异香诸山喜而有作
495481,闻孤鸟而有作
232293,闻沈元用帅南海喜而有作
573163,德山闻长嫂去世恸念伯修感而有作 其二
889385,读丐辞不允诏书感而有作 其二
380401,彭无山给谏自河工召复原官喜而有作
1062643,闻幼槃弟归喜而有作 其一
764797,凤凰台上忆吹箫 晚坐南道宫纳凉吊影凄然感而有作
698246,三月十二日肇开经筵岳以翰林旧僚叨侍讲读荐蒙燕赉感而有作
385784,闻羽可舍人自章门回，适久旱大雨，喜而有作
697138,闻张助甫擢宁夏中丞喜而有作四首
936314,春夏雨旸调适颇有丰岁之望喜而有作
790458,乙未二月望后大雪感而有作
331821,长相思·寄迹荒坞一月感而有作
585680,访李鳌峰别驾于西台遍观胜景乐而有作六首 其五 休休亭
1221517,香橼即枸橼也康雪庭上人用赠紫芝上人因而有作予偶见之遂次其韵仍简紫芝
239273,登上封半山而雾大起叹而有作
417254,浣溪沙   感旧有序 周生可家于省图画馆抄得省志资料有关余早岁填词与刘鹏年龚粲真楚士铮齐名稿感而有作
27940,以纱巾寄鲁望因而有作
743448,颍州道中阅邸报读弇山中丞辟雍诗及留漕疏稿喜而有作 其一
413322,闻罢兵受降喜而有作四首存三 其一
661835,林竹田司空自予蒙难屡为救解兹过洪都挈予妻子同归感而有作
709032,新正二日偕河东君过拂水山庄梅花半开春条乍放喜而有作
800082,被命修一统志先师司寇公完书也感而有作三首 其二
562133,闻夏士文南归喜而有作特先寄之
451959,夜读仰斋先生红梅诗，感而有作，仍步原韵
78675,子虡当以十月离淝上喜而有作
889384,读丐辞不允诏书感而有作 其一
142890,圣节日望拜黄牛祠前退读众碑感而有作
889389,偶得数琉璃瓶置窗几间因取小鱼漾其中乃见其浮游自适感而有作
689995,于景瞻宅赏牡丹花时已过感而有作呈诸公属和
263552,忆江南·蜂雕窗纸，孔密如纱。喜而有作
792754,先夫子湘辞世三载感而有作
429079,闻著涒社重开之讯喜而有作二首 其一
672790,经筵遇雨衣尽湿时方大雩喜而有作三月二十二日
1084498,夜泊萧山酒醒梦觉月色满船感而有作
648185,文华门侍朝观录囚多所宽宥喜而有作
368282,南归渡江去家稍近喜而有作
660063,闻丕儿得请喜而有作
252743,比邻四友幼稚园洪水刚消即行开学喜而有作
660963,试六馆诸生喜而有作
816942,被命修一统志先师司寇公完书也感而有作三首
889034,余以庚寅十月十日抵敝庐今恰三年感而有作偶成三律 其三
550029,宿长清署中晓起将发感而有作时丙辰正月六日
277603,雨晴访芸生归而有作，因赠并寄寰尘
429080,闻著涒社重开之讯喜而有作二首 其二
660308,韩司寇许缔姻喜而有作用前韵柬雪湖
1055877,苏子瞻因胶西赵明叔赋薄薄酒杜孝锡晁尧民黄鲁直从而有作孝锡复以属予意则同也聊以广之 其一
409705,甲辰秋，光炯为兴皖学，往来湘沪间，与予晤皖上，江头对饮，感而有作，依韵和之
543908,闻王问伯领解南都喜而有作
622959,病起小步感新栽柳竹而有作
661127,三月初七日驾幸太学喜而有作
82698,夏秋之交久不雨方以旱为忧忽得甘澍喜而有作
698476,四月二日因公出诣城隍庙行香同高判簿郑长司黄广文及儒士钟子常坐庙门之下观一邑境内之溪山喜而有作
