835272,暗香 潭月山房木莲花放，俗称大玉兰，实即古所谓木兰，香山诗所称木莲也
624462,戊寅九月博罗韩季闲以毕娶自潮归舟中烦眩拉余岸行婢青青余素所称善亦喜随之弇中乱竹如箭茅戟列荆枳相牵留道陷黝高下足如簸怪石起伏如豺羊群而流泉香花亦数间之盖所名黄竹矶也行三四里许出谷见江得酒家饮以相劳且待后舟次岁己卯余复在潮归里风正帆行盼睐江岸见此惘然无与语者
737849,赵筠谷买得乐安长公主小玉印出以相示予定其为明光宗女熹宗时所称皇八妹者因赋长歌
980132,亡友陈无己有立春诗云朱门谁送青丝菜下里难酬白雪歌颇为都下诗人所称今日立春诵之而作
220038,文度以大笏见遗奇伟特甚非鄙人所称拟柏梁体
904164,文度以大笏见遗奇伟特甚非鄙人所称拟柏梁体廿句以谢然他日出处断不负此笏老狂不衰聊供一笑云
496474,锦鹧鸪 三更一笛一联，胡仲父落梅之句也。词人所称，予惜不见其全篇，遂为足之
313506,仰光杂诗·佛国天南世所称
1070384,江仲嘉书称去常山灵真洞半里许得林壑殊胜余记昔过谢源道中乱峰峭壁间竹树荟蘙今仲嘉所称得非此耶因寄百二十字
794057,夏日子返见过，叹予近诗，庶几于言者无罪，闻者足戒。嗟乎足以垂戒，则吾岂敢。昔苏子瞻以诗得罪，究得罪之故，初不系乎其诗，狱中遗子由二诗反以得白。吾师所称有命信夫。彼自矜罗织之巧，搏击之能，正不堪一笑耳
826496,汉宫春·吾家海山仙馆在半塘荔子湾，为南汉昌华苑故址。从伯祖德舆公别业也。水榭风廊，迤迟十数里。中有碧璜，乃仿西湖三潭印月，辟七塘而成者。余足迹遍吴越，曾瞻内苑昆明湖，所称名园未之能及。今人事沧桑，时移景易，维舟凭眺，只余百顷荒塘，荷花送晚耳。夏鸣之、田石友所绘二图犹在友人家。时假披览，尚可指其一二胜概。辛未消夏，偶怀故乡，为拈此调
821155,瑶华 瓶梅将谢，杨园主人送三色兰补之，一种浅碧，一种朱丝黄瓣，一种深紫，俗所称墨兰者，尤奇绝
