459480,七月八日随肖健浇菜作
294418,寒郊晚眺·落日随人远
455284,秋日随先生大围山小住步明汉君韵
791492,仲冬六日随家大人抵赤溪直隶厅任，恭步祖父大人原韵
650514,三月廿二日随驾出郊外即事
650283,秋日随驾出安定门偶成
467348,浣溪沙 携为儿春日随夫故园踏青二首
665236,陛见日随例赐枇杷诗一首
455228,浣溪沙 携为儿春日随夫故园踏青二首 其二
650326,春日随驾出却世偶过田家 其二
836001,摸鱼儿 予少日随宦羊城儒学署，偶从卖凫鸭笼中购得鸳鸯一只，文彩斑澜。乃畜于莲池中。是鸳因失侣，飞鸣不食而死。余怜之，瘗于池侧。昨阅昔人词集，有瘗
343958,人日随大人饮外大父方将军咫园
650442,冬十一月廿三日随驾阅武于齐化门外
482182,春日随驾北征次清河（永乐八年）
453932,辛卯人日随孙曾辈游戏沙洲
266635,摸鱼儿·予少日随宦羊城儒学署
96497,两日随钱丈放舟恬无风浪今日别归仍值逆风作
696750,春日随驾出却世偶过田家
216455,九日随家人游东山遂游东园
745449,秋日随兰坡先生游太虚洞
252296,浣溪沙·携为儿春日随夫故园踏青
531035,新正六日随徐子容郭介甫唐守之登镜光阁一首
455227,浣溪沙 携为儿春日随夫故园踏青二首 其一
788012,春日随驾舟次
745952,重阳前一日随家大人游浯溪
650637,闰四月九日随驾宿龙虎台
60250,三月十日随驾猎海子上奉简胡学士杨庶子
60256,春日随驾北征次清河
482203,三月十日随驾猎海子上奉简胡学士杨庶子
252379,秋日随先生大围山小住步明汉君韵
650635,四月廿五日随驾出拜郊
145850,扬子江·几日随风北海游
650325,春日随驾出却世偶过田家 其一
859183,九日随家人游东山遂游东园
788067,秋日随驾郊外驻跸遇雨
661126,二月二十九日随驾耕藉
972590,两日随钱丈放舟恬无风浪今日别归仍值逆风作长句寄钱丈
385585,春日随任建宁过东林寺
