1113177,韩廷玉筑亭于官舍之旁园中故多梅会有飞雪予因题其扁曰梅雪盖取少陵诗语而刘公贡父送刘长官掌广西机宜尝用此事有雪片梅花五岭春之句今廷玉适为此官于以名亭抑其宜也亭边花木多吾弟定叟旧植故予首章及之
900306,韩廷玉筑亭于官舍之旁园中故多梅会有飞雪予因题其扁曰梅雪盖取少陵诗语而刘公贡父送刘长官掌广西机宜尝用此事有雪片梅花五岭春之句今廷玉适为此官于以名亭抑其宜也亭边花木多吾弟定叟旧植故予首章及之 其一
1100011,潮阳赵秋惟乂作新廨成以景阳扁之谓阳岩尝历此官也余既为作二隶古因赋唐律一首
339651,潮阳赵秋惟乂作新廨成以景阳扁之谓阳岩尝历此官也余既为作二隶古因赋唐律
1000922,送周仲固寺正提举湖北茶盐余建炎己酉岁尝为此官
327908,自叹·谬忝铨衡愧此官
1181493,中书相公任兵部侍郎日后阁植四松逾数年浣忝此官因献拙什
561302,安陆阳春台在潜邸之西皇考尝登陟□赋今都院行署实枕其麓往年南坞贾公以礼侍奉册命寓止兹署有诗后六年门人嵩亦忝此官来奉册命睹壁间题敬和一章
900305,韩廷玉筑亭于官舍之旁园中故多梅会有飞雪予因题其扁曰梅雪盖取少陵诗语而刘公贡父送刘长官掌广西机宜尝用此事有雪片梅花五岭春之句今廷玉适为此官于以名亭抑其宜也亭边花木多吾弟定叟旧植故予首章及之 其二
1181299,故许昌薛尚书能尝为都官郎中后数岁故建州李员外频自宪府内弹拜都官员外八座外郎皆一时骚雅宗师则都官之曹振盛于此予早年请益实受深知今忝此官复是正秩岂唯俯慰孤宦何以仰继前贤荣惕在衷遂赋自贺
900307,韩廷玉筑亭于官舍之旁园中故多梅会有飞雪予因题其扁曰梅雪盖取少陵诗语而刘公贡父送刘长官掌广西机宜尝用此事有雪片梅花五岭春之句今廷玉适为此官于以名亭抑其宜也亭边花木多吾弟定叟旧植故予首章及之 其三
