428026,鹧鸪天·立冬后二日侵晓，读嵇康养生论，缀成小调示张珍怀。珍怀原籍永嘉，其先世所构如园，传即灵运池上楼遗址
918154,先世藏减笔画马甚精妙因乱失之追悼赋此
973458,曾耆英录先提举著述及屠龙禾谱与先世志文见贶副以长句次韵为谢
946983,寄题长溪杨耻斋梅楼楼乃其先世读书之所
575281,王宣溪先世铁拄杖歌奉次西涯先生韵
909116,过兴安塔寺僧以先世诗来偶赋
1244415,耒阳郭方中云先世自麻冈分派尝仕前朝今遁迹?亩至徵诗余以同志歌以赠之
294265,赠储影壶·交谊论先世
948324,临川贡士徐子比先世有十万庄今唯一山岿然田间立曰独秀求予下语因记东坡以是名南康田氏之峰就用此意致登科之祝
975758,次韵赵领示先世石刻十四韵
342939,登科·先世曾誇尺五天
509191,题吴御史昌衍所藏先世菊隐卷
837482,鹧鸪天·汪仲虎先世有园曰趣园，高宗御笔赐题刻石已毁，得旧拓本，装轴徵题
983131,曾公道夫出示先世手泽敛衽拜观之馀敬题二小诗 其一
152073,临川贡士徐子比先世有十万庄今唯一山岿然田
736465,重刊先世北海集有述
751702,孙仁甫丈炳奎出观先世所藏温公澄泥砚李延平有题名南宋为魏鹤山得见真西山跋明有文衡山观款
262721,重刊先世北海集有述
513788,东密岩乃先世祖都使公沄淘兄弟起兵拒黄巢处
574965,邹光懋为我复先世所藏画诗代简谢
97598,送沈善昌朝·论契繇先世
1221518,东山书隐为郑原宜赋郑本越人居东山先世徙杭遂家焉尝筑室西湖上从徐勉庵授书经因以为扁示不忘本也原直事亲以孝闻及筮仕都卫尤有声誉故赋长句以美之
960975,番阳张君叔振观予以其家双瑞图俾诗之叔振大参忠定公诸孙也惟忠定公政和八年魁天下某先世实隶其榜今某于叔振令子若凤为同年生世科之契也又何辞虽不能诗谨课二首 其一
535083,蕲水李居士承芳余先世故交也往余过其邑迫行不及一访兹辱遣介二子不远数千里谒余白下因归作此寄焉
164360,过兴安塔寺僧以先世诗来偶赋
1125461,曾公道夫出示先世手泽敛衽拜观之馀敬题二小诗
487443,恭谒先世祖荣禄大夫都督公赐茔墓在杭州毛家埠
828264,韬庵太傅以先世诰封属题
382507,太平岩在鹭门之东相传为先世延平郡王读书处外镌有石笑两字书此志感
941201,谢长溪张兄惠其先世所得吴氏研屏
730195,吴又乐名父以先世橙斋公种菜图册见示敬和册中原韵 六首选四 其四
51176,偶见元李希籧提举遗墨乞归宾之盖希籧其先世
1122336,番阳张君叔振观予以其家双瑞图俾诗之叔振大参忠定公诸孙也惟忠定公政和八年魁天下某先世实隶其榜今某于叔振令子若凤为同年生世科之契也又何辞虽不能诗谨课二首
514040,赠程都纪宗贵宋相文清公之裔藏有先世诰牒
775280,太平岩在鹭门之东相传为先世延平郡王读书处外镌有石笑两字书此志感
772121,虹贯月楼为先世藏书处，瞫褫富繁，日久多致残蚀。修葺之馀，感赋此诗
983130,曾公道夫出示先世手泽敛衽拜观之馀敬题二小诗 其二
427585,长亭怨慢 奉题劳山纪游词。集中兼叙先世旧事，西司尤切时地，乔木苦岑之思，其寄于此矣
293544,吴又乐名父以先世橙斋公种菜图册见示敬和册中原韵
960974,番阳张君叔振观予以其家双瑞图俾诗之叔振大参忠定公诸孙也惟忠定公政和八年魁天下某先世实隶其榜今某于叔振令子若凤为同年生世科之契也又何辞虽不能诗谨课二首 其二
95979,曾耆英录先提举著述及屠龙禾谱与先世志文见
617531,为黎瑞生题其先世画龙
1249018,奉题先世所藏严子陵小像
740599,韩桂舲秋曹出其先世洽隐园三友图属题
730193,吴又乐名父以先世橙斋公种菜图册见示敬和册中原韵 六首选四 其二
245330,先世藏减笔尽马甚精妙因乱失之追悼赋比
826789,水龙吟·题徐湘蘋相国夫人晚年墨花册。夫人为吴兔床先世某太君作也。用拙政园词感旧韵
513695,至河间之明日拜扫先世赐茔
135201,嵩岳图·先世前踪不可追
243025,访关子开兄弟于余姚怀先世旧契
906239,仆与公采户曹奉议有先世之契又旧从其伯仲游今复相遇于此前日偶过西邻不知尝辱车马承贶佳什次韵为谢
513771,拜先世祖晋新安太守府君墓于双石
198634,上浙西·先世精忠百世尊
973764,仆自北门放舟过溥子而告行坐间出示上蔡景迂两先生墨帖具道先世契之详益重其别为成是诗
513773,拜先世族祖宋丞相文清公元凤祠宇墓于古城关积庆寺
1137156,减字木兰花 其七 尚学林己丑寿旦，适归庐陵。其先世相州人，居永和，今家临川
286887,鹧鸪天·汪仲虎先世有园曰趣园，高宗御笔赐题刻石已毁，得旧拓本，装轴徵题
1230019,广贤曾堂宾出示先世手墨敬题廿八字
561219,无锡茹氏惜阴楼其先世所创民泽请题
183551,寄题长溪杨耻斋梅楼楼乃其先世读书之所
657978,承黄地官枉顾公予里人先世徙居南海
166899,仆与公采户曹奉议有先世之契又旧从其伯仲游
730192,吴又乐名父以先世橙斋公种菜图册见示敬和册中原韵 六首选四 其一
132894,次韵赵领元先世石刻十四韵
479028,偶见元李希籧提举遗墨乞归宾之盖希籧其先世也因宾之作海月庵记为谢以此酬之
1208686,宣文博士周伯温世家鄱阳别墅有坡先世树梅千株其郡志载宋时守居多梅有亭名玉雪坡伯温爱之亦以名其亭
296289,水龙吟·题徐湘蘋相国夫人晚年墨花册。夫人为吴兔床先世某太君作也。用拙政园词感旧韵
533146,过刘刑曹仲恭出先世所藏名贤翰札相示
513770,拜先世祖陈将军忠壮公庙于篁墩
730194,吴又乐名父以先世橙斋公种菜图册见示敬和册中原韵 六首选四 其三
169583,谢长溪张兄惠其先世所得吴氏研屏
1251233,题平原曾光远所藏先世墨竹
826836,百字令·予弟南生游艺多能，素不能画，一日得尺绢临钱萚石先生墨兰，信笔挥洒，便有意致。予弟亡来十三年矣，此帧尚藏箧中，附装先世文字册后，系之以词
815593,吴又乐名父以先世橙斋公种菜图册见示敬和册中原韵 六首选四
1220609,蔡氏藏先世诰敕
140651,唱名·先世亲题雁塔名
864246,访关子开兄弟于馀姚怀先世旧契
123109,挽词·事契从先世
