569715,大中丞孙公贻书示按部期久不至聊尔奉讯
86062,病起·酒户诗坛聊尔耳
569674,屠青浦长卿以诗采真聊尔倚和
539204,用晦走使以新诗古陶杯见贻且云有丹灶之适聊尔附答并致意孔阳
569696,阆中陈子韶宪使以二诗及书附贾舶见寄聊尔次荅 其一
539156,伯起得余讯札黏之屏上夜为风雨所摧成诗见贻聊尔谢答
568944,张伯起丈创悔世缘闭关缮性投诗见贻超然之致聊尔有答
539200,陈玉叔学宪见讯且索余手书聊尔答寄
662352,夏日思欲园中搆小屋稍储经史以资避暑之馀事虽未集聊尔赋言寄意
538657,殷无美和余与徐荆州还往之作聊尔奉酬并申别臆
683553,阆中陈子韶宪使以二诗及书附贾舶见寄聊尔次荅
226862,八声甘州·叹人生聊尔
358275,思聊斋·頖宫聊尔耳
497654,承左虞兄过访赠余长歌感激用壮聊尔志答
569968,九日家忌掩关同年兄袁相国履善以三诗见督尊酒聊尔倚答
569697,阆中陈子韶宪使以二诗及书附贾舶见寄聊尔次荅 其二
539212,敬美尚宝使秦有江藩之擢取道郧阳言别聊尔有赠
569660,伯承少卿自报国寺分手二十五年矣虽讯问不废而笑谈永隔今岁初夏复有一诗见遗聊尔奉答
180207,山中遣兴·游宦初聊尔
120873,张守有·接翼鸿冥聊尔尔
569461,王承父雨夜过我高斋贻诗颇致鸰原之感聊尔奉酬
91956,和罗巨济教雪·天悭聊尔落
323914,次青渠·市井虽聊尔
225629,纪德·眼中儒生聊尔耳
539184,叔宝约游武当不至欲按余诗作图聊尔次答且寓嘲
