294343,八月十六观潮
368371,八月十六日夜玩月南湖用老杜韵
372882,辛亥八月十六日夜复值阴晦
1071741,靖康元年自南都移黄州八月十六日华藏民老渡江见访于定山下院一夕别去以诗送之
658626,八月十六夜匏庵携酒过宜晚轩 其一
490722,八月十六日与客同游西湖
1044442,八月十六日张伯常见访赏月四首 其一
303618,八月十六日作
1218698,八月十六日送张仲举至秦邮驿是夕邵文卿置酒云峰台望月二首 其一
1216829,癸亥岁八月十六夜对月
295963,八月十六日同家人游翠微诸山夜宿灵光寺
571679,八月十六夜宿石门驿偶忆李正郎小诗一首
850846,八月十六日见梅
330772,八月十六夜江边对月
756335,八月十六日自怀
825100,八月十六日夜月下作
155981,八月十六夜月
1060507,八月十六夜对月
1199420,八月十六日夕请灵真人授诗
1235556,八月十六日送张仲举至秦邮驿是夕邵文卿置酒云峰台望月二首
903727,满庭芳 其一 八月十六夜，景修咏东坡旧词，因韵成此
973961,约斯远同谒晦翁先生八月十六日发章泉夜宿永丰
983280,满庭芳 其一 八月十六日醴陵作
429209,八月十六日作 其二
840727,八月十六夜感怀三首 其三
1218496,八月十六日夜月蚀
287115,八月十六夜感怀
1184331,八月十六日夜月
340010,八月十六日张伯常见访赏月
840726,八月十六夜感怀三首 其二
605043,八月十六夜林寄寰韩寅仲二明府同姬命孝廉过集候月不至得春字
841776,八月十六观潮
569926,八月十六日携酒高坐寺同郭道人次父王山人承父孙山人齐之徐司理茂吴邹学宪彦吉梅茂才禹金凡七人分韵余得南字
542553,八月十六日予归自渔阳值北兵犯京时周一之在安州作此怀之
429208,八月十六日作 其一
348587,余八月十六日携家玉笥山观月览颖叔待制寄题绝句然公之往还终不暇游也故次其韵以寄颖叔
839379,八月十六夜玩月因怀刘石芗
531561,八月十六日游水头 其二
675021,八月十六夜饮王阳明馆
1121894,八月十六日张伯常见访赏月四首
1044445,八月十六日张伯常见访赏月四首 其四
372609,辛亥八月十六日社始月望
733426,八月十六夜宴盱江楼得白字
831572,八月十六夜小集，同赖二、兄子幼春作
295384,八月十六日望月有怀
834377,满江红 八月十六日感事
381770,八月十六日夜月下作
158026,八月十六夜与宗哲纯甫翫月
509267,庆阳司寇八月十六日得子
685320,八月十六夜匏庵携酒过宜晚轩
869873,八月十六日过天街怀景仁
460736,八月十六日访利玛窦及诸西方传教士墓地
174229,八月十六日观月段氏亭次王师老韵
195175,八月十六张园玩月得一字
283123,八月十六夜广州望月有怀内子北平
364572,次韵和陈学士八月十六日省宿
1043465,次韵和陈学士八月十六日省宿
540620,八月十六日洮湖泛月
844719,八月十六夜感怀三首
617729,八月十六日夜宴
95951,约斯远同谒晦翁先生八月十六日发章泉夜宿永
1039582,辛亥八月十六日社始月望
281348,八月十六夜小集，同赖二兄子幼春作
362759,八月十六夜登景阳阁
423949,念奴娇·丁巳八月十六
280204,念奴娇·丁巳八月十六
283278,满江红·八月十六日感事
1222249,八月十六日晓起见月
906931,八月十六日后池上
1000137,八月十六夜与宗哲纯甫玩月
1044444,八月十六日张伯常见访赏月四首 其三
459108,八月十六未明惊梦起作
433382,八月十六日作
862633,和曾谹父约八月十六日看月
795573,菩萨蛮 八月十六夜月
998866,八月十六夜月
1070884,八月十六夜江边对月
63572,八月十六日同文太史诸公登郊台觞治平寺竹下
840725,八月十六夜感怀三首 其一
263122,八月十六夜玩月因怀刘石芗
1153674,八月十六夜月
146237,八月十六日见梅
1062597,八月十六日夜玩月南湖用老杜韵
473150,八月十六日同文太史诸公登郊台觞治平寺竹下待月行春桥夜泛胥门作
198215,八月十六日后池上
1044443,八月十六日张伯常见访赏月四首 其二
692743,八月十六日游水头
1070771,八月十六夜江边对月
604960,八月十六夜吴觉生侍御招饮赋谢
984685,八月十六日观月段氏亭次王师老韵
458271,八月十六日晨醒梅庄所，伏枕随写，留别留社诸子
604220,八月十六夜同徐木之黄元卿黄逢永欧嘉可宴会陈集生太史园亭限赋古体
248722,八月十六日访利玛窦及诸西方传教士墓地
1205609,八月十六日送张仲举至秦邮驿是夕邵文卿置酒云峰台望月二首 其二
880414,八月十六日夜月
658627,八月十六夜匏庵携酒过宜晚轩 其二
1141532,八月十六张园玩月得一字
668494,八月十六夜对月
531560,八月十六日游水头 其一
1054030,八月十六日玩月
340777,八月十六夜对月
1050896,余八月十六日携家玉笥山观月览颖叔待制寄题绝句然公之往还终不暇游也故次其韵以寄颖叔
472935,八月十六夜邀兆和民服民孝元叔乘潦泛月
413831,八月十六夜广州望月有怀内子北平
320482,八月十六日玩月
1065131,八月十六入南昌右狱作对治偈
516915,八月十六夜泊邬子寨示祝权
60766,八月十六夜邀兆和民服民孝元叔乘潦泛月
1039583,辛亥八月十六日夜复值阴晦
30727,八月十六日夜月
133790,八月十六日过天街怀景仁
531562,八月十六日游水头 其三
529209,八月十六夜渡江
747146,八月十六日湖楼坐雨
173105,和曾谹父约八月十六日看月
