674813,三疏乞休伏奉俞旨用韵有述
532010,内阁前迎春花开有述
814380,次牧《翁六月七日迎河东君于云间喜而有述》诗
498776,朱晦庵墓道有述 其一
1210795,顺圣先垄拜祀后有述十首 其九
474245,秋日病起有述
295820,舟泊青岛阻风雨者两日顷忽开霁海行有述
54311,喜茂之至有述
583450,兴济有述
602086,恭祀永陵有述 其二
789080,次牧《翁六月七日迎河东君于云间喜而有述》诗 其三
709048,六月七日迎河东君于云间喜而有述四首 其一
77631,闻蜀盗已平献馘庙社喜而有述
535107,晚春高唐道中得丁中丞朱方伯书有述
789066,次牧《翁六月七日迎河东君于云间喜而有述》诗 其二
789085,次牧《翁六月七日迎河东君于云间喜而有述》诗
1210789,顺圣先垄拜祀后有述十首 其三
52857,海口道上有述怀郑二宣
522182,八月六日会燕新守孔君时久雨忽霁喜而有述
548501,待命有述
538165,安东候警有述
681300,中元陪祀山陵有述
739663,因视饥籍夜投山寺憩宿有述
933558,闻蜀盗已平献馘庙社喜而有述
789068,次牧《翁六月七日迎河东君于云间喜而有述》诗 其一
789060,次牧《翁六月七日迎河东君于云间喜而有述》诗 其三
6891,同阎伯均宿道士观有述
661252,吴白楼重修清风亭有述次韵 其二
683622,王汝止先生过访弇园有述
613635,重过西林有述
624532,同梁坚德受戒椒园有述 其三
480152,南京谒孝陵有述
607657,明会典成赐宴礼部有述馆课
290833,拟陈散原体雨坐有述
479696,岁云晚矣园居独谣追始惟今斐然有述八章 其六
569092,恭谒故宫阙有述
572814,入德山舟中偕寒灰冷云雪照诸衲子及云影居士月中有述
572075,游金山寺见旧作有述同游者两谢君方子公张明教及童子二仲也
538485,丁巳春余以青臬朝衡王赐宴殿中大雪有述
535585,孟冬陈戚畹第会同年有述
480159,郊祀喜晴有述
564771,打鱼纪事少司马良所已两和末复有述怀之篇因奉答
621988,报命之日即转本司正即有述二首 其一
472001,恭谒孝陵有述十四韵
789067,次牧《翁六月七日迎河东君于云间喜而有述》诗 其三
383405,文华殿进讲有述
572863,初夏同惟学惟长舅尊游二圣禅林检藏有述 其二
53141,闻侍养命喜而有述
273071,自香港逃难抵广州取道归里途中有述
621969,孟秋十六日于役天中与黄赞伯联辔有述二首　时虏氛方逼近畿 其一
538966,入太行遇风雨回望中原即景有述
479564,闻侍养命喜而有述
789086,次牧《翁六月七日迎河东君于云间喜而有述》诗
295540,归自沈阳车中有述
623124,念三日抵阳朔雨湍添濑感而有述
1240730,不赴召有述
533520,丁戊山人谒先君墓有述答
593950,辽后妆楼为雷雨所败有述
539005,李驹以父集见授悲感有述
410879,拟陈散原体雨坐有述
433509,薄游吴门有述二首
494145,陪祭皇陵有述
1251973,访杨季常于陈山回途有述
583730,闻报有述
48421,南京谒孝陵有述
53419,恭谒孝陵有述十二韵
753161,有述
536583,奉释典诸部经于小祗园藏经阁中有述
569050,承大宗伯姜公少司寇李公邀同大司寇陆公少司徒方公陟牛首山有述
588770,八月十日万寿圣节梦侍朝有述
279411,浪淘沙慢·九月下旬，西山之战，两军伤亡，过当客有述其惨状者。复次清真韵
789079,次牧《翁六月七日迎河东君于云间喜而有述》诗 其二
144332,和子有雨有述怀
498777,朱晦庵墓道有述 其二
573286,访陈晦伯先生，晦伯留饮斋中有述
623216,庙墙外桃花盛开漫望有述四首 其四
709050,六月七日迎河东君于云间喜而有述四首 其三
833807,八六子 梦兰校书过访萧斋，感而有述
789061,次牧《翁六月七日迎河东君于云间喜而有述》诗 其一
736465,重刊先世北海集有述
611284,坐含清阁下视潇江水涨喷激洲渚雷轰雪溅泠然有述
695023,闻浚城河喜而有述二首
789064,次牧《翁六月七日迎河东君于云间喜而有述》诗 其四
624531,同梁坚德受戒椒园有述 其二
600636,尚书考满蒙恩赋归三世俱拜二品诰命焚黄先垄感而有述
262721,重刊先世北海集有述
709049,六月七日迎河东君于云间喜而有述四首 其二
741559,雨中有述
572862,初夏同惟学惟长舅尊游二圣禅林检藏有述 其一
936663,病中有述二首 其一
691362,恭祀永陵有述
623213,庙墙外桃花盛开漫望有述四首 其一
520386,予经辋川而爱其风物实诗中之画也所惜者摩诘不作徒见黄鹂之啭于夏木白鹭之飞于水田而已缅想昔人不觉有述噫嘻摩诘其有知乎哉
1249529,江滨小警胡居敬助教来访雨中有述
1034244,浣川定海奉饯乐成郭明府年兄赴改官班赵振文司令首赋古体因辄有述
598751,刘跃衢年兄枉驾草堂有述
640925,同周孝廉夜宿郡庠有述
574125,还自长沙未有述作谢沈休翁
529365,发新津风日甚佳有述
480048,嘉靖四年奉诏督师西征再蒙温旨有赵充国马援之褒感而有述
1006046,湖上观柳偶记龙泉先生勾春柳一丝之句感而有述
815492,次牧《翁六月七日迎河东君于云间喜而有述》诗
570079,王汝止先生过访弇园有述 其五
789065,次牧《翁六月七日迎河东君于云间喜而有述》诗 其一
387319,八六子·梦兰校书过访萧斋，感而有述
789062,次牧《翁六月七日迎河东君于云间喜而有述》诗 其二
476621,雨夕梦安公石张习之觉而有述因寄
1210796,顺圣先垄拜祀后有述十首 其十
594921,夏日图南楼成有述
569090,与群公恭阅都城有述
1118752,病中有述二首
789059,次牧《翁六月七日迎河东君于云间喜而有述》诗 其二
569059,恭谒太祖高皇帝御容有述
144059,用子有述怀韵为寿
536480,谒陵有述 其二
536632,由武当之紫霄历青羊桥憩五龙出仁威观有述
529373,立春后一日午门宴罢有述
569870,过喻使君邦相郡斋与其尊大夫八十翁四孙及通家余子小饮有述
338904,夜坐检书偶读工部蜀相篇慨然有述
623111,九日泊浔州望登高者有述
295733,暮归有述·秋林风叶挟霜飞
569089,同内外守备参赞诸公大阅有述
430134,薄游吴门有述二首 其二
69652,不赴召有述
569003,见有演关侯斩貂蝉传奇者感而有述
809252,长至日祀天圜丘有述四章
812594,次牧《翁六月七日迎河东君于云间喜而有述》诗
641066,首春游道山有述
295759,大雨有述·逋人经岁未宁家
571868,真定大悲阁同王六宇年兄及小修弟登览有述
789069,次牧《翁六月七日迎河东君于云间喜而有述》诗 其二
574065,李惟正燕予通州漕府感旧有述追怀张中丞邦镇
640954,夏日登宿云台有述寄霜月上人
789070,次牧《翁六月七日迎河东君于云间喜而有述》诗 其一
529139,登翠微恭望长陵有述
405816,移桐庐所留残书新至，喟然有述
550248,恭谒孝陵有述
613203,南郊陪祀有述
573832,郊坛分献东镇退而有述
54894,岁晚园居追忆史馆容台旧事有述
479695,岁云晚矣园居独谣追始惟今斐然有述八章 其四
720228,初春有述
295670,八月再至大连斥去旧居将归有述
382527,除夕前一夜斋宿起居注馆燃烛校书有述
789082,次牧《翁六月七日迎河东君于云间喜而有述》诗
621989,报命之日即转本司正即有述二首 其二
609672,南雍恭祀孔庙有述
789074,次牧《翁六月七日迎河东君于云间喜而有述》诗四首 其三
531730,伏读嘉靖登极诏有述
641002,海上有述呈冶城诸友
536554,按部东海因怀鲁连逃迹慨然有述
426796,自香港逃难抵广州取道归里途中有述
602085,恭祀永陵有述 其一
1210790,顺圣先垄拜祀后有述十首 其四
1078583,观使太尉俯用拙韵有述怀之作谨赋一篇奉酬嘉咏
547834,寄吴少溪宫录七十 其三十 读许云村先生小传有述
789075,次牧《翁六月七日迎河东君于云间喜而有述》诗四首 其四
607176,广生至有述赋答
789058,次牧《翁六月七日迎河东君于云间喜而有述》诗 其一
620736,扬兵有述
593263,奉天门贺岭西奏捷有述
699822,庙墙外桃花盛开漫望有述四首
153774,次韵刍父试罢有述
570077,王汝止先生过访弇园有述 其三
622848,晋文渊阁及太子太保愧感有述三首 其二
614608,读欧阳子秋声赋有述
789073,次牧《翁六月七日迎河东君于云间喜而有述》诗四首 其二
522108,沙河主人后园枣实甚繁感而有述
1210787,顺圣先垄拜祀后有述十首 其一
1210791,顺圣先垄拜祀后有述十首 其五
622130,忆去岁北趋九歌之作感而有述
598552,泛海有述
570080,王汝止先生过访弇园有述 其六
529371,廿六日雪后赴金太常南郊观礼有述
789076,次牧《翁六月七日迎河东君于云间喜而有述》诗
536830,夏日村居有述
470043,喜茂之至有述
482673,海口道上有述怀郑二宣
572054,泾阳驿见王子声壁间韵怆然有述
699648,孟秋十六日于役天中与黄赞伯联辔有述二首　时虏氛方逼近畿
699655,报命之日即转本司正即有述二首
471033,重过拂水山居经宿遂撤新楼开竁域主人复申墓田耦耕之约有述
699803,眺海外诸峰悠然有述二首
789077,次牧《翁六月七日迎河东君于云间喜而有述》诗
273497,高阳台·隐语有述
572865,初夏同惟学惟长舅尊游二圣禅林检藏有述 其四
531985,嘉靖丙戌郊祀庆成侍宴有述八十韵
622974,眺海外诸峰悠然有述二首 其二
622890,日往山中独寻幽意迫暮乃还马背有述
498741,庚子腊上祈雪西苑越明年元日不受贺从祠曹请令朝官金水桥南行礼雪而有述
789083,次牧《翁六月七日迎河东君于云间喜而有述》诗
532020,康陵禫祭有述
671643,阅董宗伯赠姚画溪先生诗卷有述
623215,庙墙外桃花盛开漫望有述四首 其三
679343,元夜曹学宪纪山枉过有述
738019,闻诸襄七在金华有述
538167,月夜步西园积雪有述
963528,用子有述怀韵为寿
1210792,顺圣先垄拜祀后有述十首 其六
536613,病后初行园有述
813009,次牧《翁六月七日迎河东君于云间喜而有述》诗
789081,次牧《翁六月七日迎河东君于云间喜而有述》诗
430133,薄游吴门有述二首 其一
598832,梁山人夜宿东书堂有述用韵寄酬
429354,大雨有述
536479,谒陵有述 其一
63138,秋日病起有述
360836,观使太尉俯用拙韵有述怀之作谨赋一篇奉酬嘉咏
789063,次牧《翁六月七日迎河东君于云间喜而有述》诗 其三
497736,经筵(1)初开有述
569642,殷无美谈君典筑室水中谢客读书与鄙况合有述
789071,次牧《翁六月七日迎河东君于云间喜而有述》诗 其二
809384,台湾平告祀孝陵有述
522263,岁云晚矣园居独谣追始惟今斐然有述八章 其五
722646,六月七日迎河东君于云间喜而有述四首
739293,除夕前一夜斋宿起居注馆燃烛校书有述
681409,初寒有述
561265,经筵宴罢有述
1248200,雨馆有述
570076,王汝止先生过访弇园有述 其二
1210788,顺圣先垄拜祀后有述十首 其二
517580,新筑草堂成有述
598743,读卢方伯著作篇有述
493743,闻浚城河喜而有述二首 其二
789072,次牧《翁六月七日迎河东君于云间喜而有述》诗四首 其一
356239,湖上观柳偶记龙泉先生勾春柳一丝之句感而有述
568277,武城观涨因忆陈后山五月一雨凉中宵大江南之句情景悠然援毫有述
295730,所居之西有隙地林木蔚然吟望有述
493742,闻浚城河喜而有述二首 其一
343122,宿西直门下有述
700218,岁云晚矣园居独谣追始惟今斐然有述八章
621758,开卷有述
622878,将至百宜晚眺有述
919898,次韵刍父试罢有述
83922,病中有述二首各五韵
547576,文华殿进讲有述
701384,朱晦庵墓道有述
622847,晋文渊阁及太子太保愧感有述三首 其一
561518,驾祀七陵奉敕居守京城即事有述 其二
507420,独酌有述
536549,于役淄川途遇大雨有述
789078,次牧《翁六月七日迎河东君于云间喜而有述》诗 其一
661251,吴白楼重修清风亭有述次韵 其一
48483,重谒孝陵有述
789084,次牧《翁六月七日迎河东君于云间喜而有述》诗
1153492,同阎伯均宿道士观有述
607132,黄太史看菊有述见示赋答
295771,三月二十二日海行抵大连有述
48425,郊祀喜晴有述
621737,溯流夏月日值江风皆北舟滞有述
535597,午日驾幸西苑侍游有述
569644,腊月十日夜雷电大雨有述
736048,雪晴过海上，适海市见之罘下，自亭午至晡，快睹有述，时十月十日
811513,次牧《翁六月七日迎河东君于云间喜而有述》诗四首
672620,孝陵恭谒有述
522261,岁云晚矣园居独谣追始惟今斐然有述八章 其一
822659,浪淘沙慢 其二 九月下旬，西山之战，两军伤亡，过当客有述其惨状者。复次清真韵
569095,休沐归里值大旱山池龟坼募工徙河满之有述
696256,吴白楼重修清风亭有述次韵
936662,病中有述二首 其二
356663,次牧《翁六月七日迎河东君于云间喜而有述》诗
623214,庙墙外桃花盛开漫望有述四首 其二
356721,翁六月七日迎河东君于云间喜而有述
536507,移文两台乞休有述贻示舍弟
1207843,新雨阶除花药倍茂田里生意怀之欣然情至有述简诸作
694044,同梁坚德受戒椒园有述
303652,大雨有述·卧闻檐角水声洪
529127,甲戌四月八日再游龙华有述
383102,读许云村先生小传有述
737111,夜坐检书偶读工部蜀相篇慨然有述
569002,先师移龛日忽已三周晨兴作供感叹有述
821448,高阳台 隐语有述
574891,闻申诏侍养喜而有述
50264,雨中梦安公石张习之二公情话移时觉而有述因
569649,雨中即事有述
279985,与无为上人移坐石上重烹白乳泉有述
536537,岁暮自檀州发赴青州有述
479697,岁云晚矣园居独谣追始惟今斐然有述八章 其七
482652,早秋有述寄林八先辈
681231,先府君墓焚新刻手藁感而有述示兆蕃
1215702,壬申岁游宝陀感时有述
622851,十七晚抵乐民是夜宿所内旧栖凄然有述
547934,恭陪圣驾步诣南郊祷雨有述六韵
522264,岁云晚矣园居独谣追始惟今斐然有述八章 其八
572864,初夏同惟学惟长舅尊游二圣禅林检藏有述 其三
569496,寒食于官舍私荐感痛有述
1210794,顺圣先垄拜祀后有述十首 其八
617553,欧阳伯曦释逮初归偕诸子枉过有述
570075,王汝止先生过访弇园有述 其一
814298,次牧《翁六月七日迎河东君于云间喜而有述》诗
522141,次韵三江赐玉有述
1237639,顺圣先垄拜祀后有述十首
688686,驾祀七陵奉敕居守京城即事有述
480153,重谒孝陵有述
52862,早秋有述寄林八先辈
472711,渡江望金焦忆往岁与商任叔陆伯玉游兹来陆归商死矣感而有述
793834,与无为上人移坐石上重烹白乳泉有述
534848,七月二十七日恭谒显陵有述
624530,同梁坚德受戒椒园有述 其一
709051,六月七日迎河东君于云间喜而有述四首 其四
570078,王汝止先生过访弇园有述 其四
535662,九月二日侍经筵有述
1210793,顺圣先垄拜祀后有述十首 其七
648713,步过田家有述
666596,二月八日趋事山陵出郭有述
662703,雪中朝退有述
569888,徐参议邀游东园有述
569091,恭谒孝陵有述
536539,春日于西园望云门山有述
569060,恭谒成祖文皇帝御容有述
479694,岁云晚矣园居独谣追始惟今斐然有述八章 其三
597742,江上闻董原汉以言事谪戍蛮方慨然有述
569087,谒表忠祠有述
699779,晋文渊阁及太子太保愧感有述三首
621970,孟秋十六日于役天中与黄赞伯联辔有述二首　时虏氛方逼近畿 其二
295725,将雨有述·层阴如墨乱鸦飞
536534,秋日与诸大夫登后湖阁宴眺有述
536623,入林屋洞天不能竟有述
522262,岁云晚矣园居独谣追始惟今斐然有述八章 其二
812221,次牧《翁六月七日迎河东君于云间喜而有述》诗
622973,眺海外诸峰悠然有述二首 其一
529372,仲冬晦过海印寺有述
538434,被命省狱畿郡有述
598689,过田家有述
699433,初夏同惟学惟长舅尊游二圣禅林检藏有述
536481,谒陵有述 其三
561517,驾祀七陵奉敕居守京城即事有述 其一
588700,元日登东城楼再陪甘泉祝圣有述
683953,谒陵有述
622849,晋文渊阁及太子太保愧感有述三首 其三
569879,慧山东园为王光禄家物余再过之矣复以与比部曹安二山人曹王二太学一游即事有述
623328,旱虐如焚靡瞻有述
621115,渡江有述
531701,孟冬亲享礼成有述
536816,见边庭人谈壬子三月事有述
