740300,出都日竹君兄赠我长歌三十六韵缄行箧中过淮阴舟中发而读之乃得次韵
784399,得次女泸川信却寄三首 其三
128132,无锡得次子诗促归
793681,予已三代单丁，年复垂暮，望孙颇切，丙子岁侨居宛陵，九月八日生长孙，取名英范，今戊寅九月廿九日又得次孙，取名元鹤，喜赋
784397,得次女泸川信却寄三首 其一
865502,烛影摇红 雪楼得次子，行台时治金陵
936187,信手翻古人诗随所得次韵二首 其一 夜坐
813591,得次女泸川信却寄三首
286226,得次女泸川信却寄
444268,幽兰岘山寺访桃未得次云海韵
989034,无锡得次子诗促归
79704,信手翻古人诗随所得次韵夜坐除夜沐浴
284326,浪淘沙·得次儿武林家书，为述其意，作此一阕
784398,得次女泸川信却寄三首 其二
1037286,信手翻古人诗随所得次韵二首 其二 除夜沐浴
139146,梅庄主人袖诗见过累日欲得次韵以汩汩无暇且
888853,梅庄主人袖诗见过累日欲得次韵以汩汩无暇且和一绝
836212,浪淘沙 得次儿武林家书，为述其意，作此一阕 其二
1118723,信手翻古人诗随所得次韵二首 夜坐
