535737,三月晦日出郊游衍偶诵唐人诗三月正当三十日因用为起 其一
535738,三月晦日出郊游衍偶诵唐人诗三月正当三十日因用为起 其二
182364,三月晦和唐人韵诗云三月正当三十日风光别我
535740,三月晦日出郊游衍偶诵唐人诗三月正当三十日因用为起 其四
684275,三月晦日出郊游衍偶诵唐人诗三月正当三十日因用为起
535743,三月晦日出郊游衍偶诵唐人诗三月正当三十日因用为起 其七
344284,三月晦日潘侯道旃董生商隐至遇雨共赋三月正当三十日
855020,灯夕当三日而罢今至四日五日国人尚纷然出游势不可禁天既雨仍作小晴老稚皆有閒暇不迫之色千兵所至驩呼随之此前未有也闻使君复为人强出聊作小诗记一时之事
535739,三月晦日出郊游衍偶诵唐人诗三月正当三十日因用为起 其三
339587,太平莲者草花也本如藤蔓好事者结竹而植之其花大如当三钱
321340,三月晦日与同舍送春于梅溪因诵贾阆仙诗云三月更当三十日
1099813,太平莲者草花也本如藤蔓好事者结竹而植之其花大如当三钱四围先绽中有一萼如初出水莲最后方拆想以此得名一花可十许日邻人馈以一盆亦自可爱推其所以名者戏述一首
195054,灯夕当三日而罢今至四月五日国人尚纷然出游
23740,湖上·仿佛欲当三五夕
244303,临江仙·腊月正当三十夜
965712,三月晦和唐人韵诗云三月正当三十日风光别我苦吟身共君今夜不须寐未到五更犹是春
535742,三月晦日出郊游衍偶诵唐人诗三月正当三十日因用为起 其六
261403,当三月再次来临
139139,偶成·剧暑当三伏
172419,临江仙·三月更当三十日
535741,三月晦日出郊游衍偶诵唐人诗三月正当三十日因用为起 其五
1084461,三月晦日与同舍送春于梅溪因诵贾阆仙诗云三月更当三十日，风光别我苦吟身共君今夜不须睡未到晓钟犹是春时有二十八人遂以齿序分韵
274733,立春有感·杀运正当三十载
