631161,仲春得姜山报知以此时入越却寄
545511,徐参知总角与余游中间显晦殊途不相闻问者廿载兹邂逅淮甸特邀余为具署中清灯话旧不胜今昔之感即席载赋二律时参知以青雀见假由此竟达燕中矣 其一
861823,南柯子/南歌子 秀叔娶妇不令人知，以小词为贺，因戏之
772208,近接移知，以克彰微芳，蒙上恩赏加布政使衔。三月十二日，望北叩谢恭纪
97333,三月审知以余行有日置酒于智门寺后竹间小亭
403610,金缕曲 其二 心叔之墓已有宿草，敬老又不知以何时示疾，何时捐馆，桑户反其真，而我犹为人猗，悲夫
605591,人日同人韩叔捷参知以诗见贻用来韵却答
697235,徐参知总角与余游中间显晦殊途不相闻问者廿载兹邂逅淮甸特邀余为具署中清灯话旧不胜今昔之感即席载赋二律时参知以青雀见假由此竟达燕中矣
974135,审知以诗送行借韵留别
98283,审知以诗送行借韵留别
323868,南歌子·秀叔娶妇不令人知，以小词为贺，因戏之
383106,冯宗伯书来知以陨珠之感遂辍西游因寄诗见问用韵慰谢
1000151,予家畜狸花二猫一日狸者获鼠未食而花者私窃之以去家人不知以为鼠自花获也因感而作二猫诗
615041,陆贞姑者陆味道太守之姑也适冯早寡无子阿翁冯参知以幼女命贞姑抚焉参知以女字太守诏旌贞姑节以大守诸也为纪一律
615041,陆贞姑者陆味道太守之姑也适冯早寡无子阿翁冯参知以幼女命贞姑抚焉参知以女字太守诏旌贞姑节以大守诸也为纪一律
972166,三月审知以余行有日置酒于智门寺后竹间小亭时与者王彦博审知之侄彦章余之弟成父审知命以尊前失诗流为韵分得流字书以呈之
1214219,余昔年邂逅登山东卢长卿之门遂联辔游京师真所谓倾盖如故者也别六年重过其庐则已为他人屠沽肆矣因诘邻翁乃知以穷徙他所遂往访之缱绻话旧成短歌以勉之
547842,寄吴少溪宫录七十 其三十八 冯宗伯书来知以陨珠之感遂辍西游因寄诗见问用韵慰谢二首
1034565,恭和闻喜宴赐毛自知以下御制
545512,徐参知总角与余游中间显晦殊途不相闻问者廿载兹邂逅淮甸特邀余为具署中清灯话旧不胜今昔之感即席载赋二律时参知以青雀见假由此竟达燕中矣 其二
