649070,送兖州郡学教授
249406,答湖北大学教授张金煌兄
1228167,送陈杏林赴潮州医学教授
1216672,送郑喧宣伯赴赤那思山大斡耳朵儒学教授四首 其二
821671,瑞鹧鸪 尤墨君为中学教师四十余年，以老退居吴城西白塔子巷。因作塔西掷笔图徵题，次其韵
515585,九桥书舍为京学教授莆田陈君叙畴作
107862,送工泰发晦庵书院小学教谕
560308,山水图为赵辅作本学教谕克通之子也
650619,赠梁教谕萼赴衢州府学教授
1216674,送郑喧宣伯赴赤那思山大斡耳朵儒学教授四首 其四
1243919,送李本存归江西新喻州本存儒学教授历省掾为御史所论改温州海隅巡尉赋三律赠之 其三
553147,落第举人南昌张某特恩授温州永嘉县学教谕兼简刘贡禹学正
130588,送严心传鄞县学教任满
224668,八月八日偕庙学教授曹彦礼及孔颜孟三氏诸孙
1136795,八月八日偕庙学教授曹彦礼及孔颜孟三氏诸孙童齐集游逵泉到沂水缅想风雩之乐余乃浴沂作咏归歌
553160,玉山县学教谕苏如愚先生谦恭乐善待予如师在任四年以母丧去职作诗以赠云
514005,节庵倪先生以经学教于乡既成其子进贤举进士为御史又出其馀以淑乡之人其在德兴孙司马之塾最久予过婺源望先生之庐尚远不能往拜漫成一律奉寄
1252250,送李本存归江西新喻州本存儒学教授历省掾为御史所论改温州海隅巡尉赋三律赠之
274131,瑞鹧鸪·尤墨君为中学教师四十余年
612428,挽思南府学教授尹禺阳世兄
1142551,借王介山韵送子声小学教谕
405055,院系调整，余专任四川大学教职，为赋一绝1952
1216671,送郑喧宣伯赴赤那思山大斡耳朵儒学教授四首 其一
151373,饮黎希明赴与学教论
429162,闻外舅澹庐先生得农学教授书寄
945331,送严心传鄞县学教任满
1244775,赠陈仲玉本学教谕致仕
1216673,送郑喧宣伯赴赤那思山大斡耳朵儒学教授四首 其三
1227901,送蒙古学教授之邛州
1243918,送李本存归江西新喻州本存儒学教授历省掾为御史所论改温州海隅巡尉赋三律赠之 其二
454682,读香港中文大学教授黄坤尧兄大著《番禺刘氏三世诗钞》题后
454810,答湖北大学教授张金煌兄
454519,夜饮番禺宾馆赠王存诚兄一九九九年九月下旬，节近中秋，清华大学教授王存诚兄因公南来，神交数载，一见为快！夜饮名酒小糊涂仙，经纶兄共席。三人同代，来日方长，相逢未晚也
315905,院系调整，余专任四川大学教职，为赋一绝
1135261,送江泰发晦庵书院小学教谕
1242699,送徐大章建宁路学教授
1243917,送李本存归江西新喻州本存儒学教授历省掾为御史所论改温州海隅巡尉赋三律赠之 其一
1218597,送天长县学教谕孙允诚任满归金陵
1242506,上巳日，杭州府学教授徐一夔、四斋训导拉游智果寺，访东坡，题参寥泉
305212,闻外舅澹庐先生得农学教授书寄
1236064,送郑喧宣伯赴赤那思山大斡耳朵儒学教授四首
